{"type":"FeatureCollection","data_type":"Dataset","url_type":null,"permissions":[{"permissions":{"download":true,"view":true},"group_id":"everyone"}],"classification":null,"title":"sept_1-28_crime_data","count":256,"stream_id":161699,"contributor":{"url":"http://geocommons.com/users/33607","name":"Mission Local Crime"},"data_attributes":null,"calculation_params":null,"icon_link":null,"link":"http://geocommons.com/overlays/161699.json","extent":[-122.484,37.7469,-122.389,37.7894],"geometry_types":["point"],"unique_name":null,"name":"sept_1-28_crime_data","feature_count":256,"description":"","next_feature":null,"is_raster":false,"short_classification":"Y","stats":{"latitude":{"max":37.789365,"mean":37.7587767367188,"variance":4.46680647373189e-05,"stdev":0.00668341714524231,"min":37.74688,"median":37.7597548},"time":{"max":"2030/01/12 00:00:00 -0500","mean":"2030/01/01 13:00:30 -0500","variance":3870590315.29412,"stdev":62214.0684676233,"min":"2030/01/01 00:01:00 -0500","median":"2030/01/01 12:00:00 -0500"},"date":{"max":"2011/09/28 00:00:00 -0400","mean":"2011/09/15 15:22:30 -0400","variance":476145520941.176,"stdev":690032.985400826,"min":"2011/09/01 00:00:00 -0400","median":"2011/09/17 00:00:00 -0400"},"longitude":{"max":-122.388759,"mean":-122.425857744531,"variance":0.000404246427715641,"stdev":0.0201058804262743,"min":-122.483519,"median":-122.4195226}},"features":[{"properties":{"latitude":37.7571691,"time":{"end_time":"2030/01/01 09:00:00 -0500","original":"8:00 a.m.","granularity":"hour","time":"2030/01/01 08:00:00 -0500"},"date":{"end_time":"2011/09/02 00:00:00 -0400","original":"9/1/11","granularity":"day","time":"2011/09/01 00:00:00 -0400"},"description":"Stolen Auto","longitude":-122.4167288,"crime type":"Auto Theft","id":"a6ez66xrsog1","address":"21st Street and South Van Ness, San Francisco, CA"},"type":"Feature","geometry":{"type":"Point","coordinates":[-122.4167288,37.7571691]}},{"properties":{"latitude":37.752601,"time":{"end_time":"2030/01/01 07:06:00 -0500","original":"7:05 a.m.","granularity":"min","time":"2030/01/01 07:05:00 -0500"},"date":{"end_time":"2011/09/02 00:00:00 -0400","original":"9/1/11","granularity":"day","time":"2011/09/01 00:00:00 -0400"},"description":"Battery","longitude":-122.412464,"crime type":"Battery","id":"a6ez66p8j51r","address":"24th Street and Balmy, San Francisco, CA"},"type":"Feature","geometry":{"type":"Point","coordinates":[-122.412464,37.752601]}},{"properties":{"latitude":37.7593748,"time":{"end_time":"2030/01/01 21:00:00 -0500","original":"8:00 p.m.","granularity":"hour","time":"2030/01/01 20:00:00 -0500"},"date":{"end_time":"2011/09/02 00:00:00 -0400","original":"9/1/11","granularity":"day","time":"2011/09/01 00:00:00 -0400"},"description":"Burglary","longitude":-122.4068748,"crime type":"Burglary - Home","id":"a6ez6701biyt","address":"20th Street and Potrero, San Francisco, CA"},"type":"Feature","geometry":{"type":"Point","coordinates":[-122.4068748,37.7593748]}},{"properties":{"latitude":37.755576,"time":{"end_time":"2030/01/01 00:21:00 -0500","original":"12:20 a.m.","granularity":"min","time":"2030/01/01 00:20:00 -0500"},"date":{"end_time":"2011/09/02 00:00:00 -0400","original":"9/1/11","granularity":"day","time":"2011/09/01 00:00:00 -0400"},"description":"Theft of unattended cell phone","longitude":-122.4165773,"crime type":"Theft","id":"a6ez66v5t3kk","address":"22nd Street and South Van Ness, San Francisco, CA"},"type":"Feature","geometry":{"type":"Point","coordinates":[-122.4165773,37.755576]}},{"properties":{"latitude":37.7602375,"time":{"end_time":"2030/01/01 03:00:00 -0500","original":"2:00 a.m.","granularity":"hour","time":"2030/01/01 02:00:00 -0500"},"date":{"end_time":"2011/09/02 00:00:00 -0400","original":"9/1/11","granularity":"day","time":"2011/09/01 00:00:00 -0400"},"description":"Theft of unattended purse in bar","longitude":-122.4192191,"crime type":"Theft","id":"a6ez66yzq5f4","address":"19th Stret and Mission, San Francisco, CA"},"type":"Feature","geometry":{"type":"Point","coordinates":[-122.4192191,37.7602375]}},{"properties":{"latitude":37.760601,"time":{"end_time":"2030/01/01 11:00:00 -0500","original":"10:00 a.m.","granularity":"hour","time":"2030/01/01 10:00:00 -0500"},"date":{"end_time":"2011/09/03 00:00:00 -0400","original":"9/2/11","granularity":"day","time":"2011/09/02 00:00:00 -0400"},"description":"Stolen Auto","longitude":-122.408064,"crime type":"Auto Theft","id":"a6ez673k1x1x","address":"19th Street and Hampshire, San Francisco, CA"},"type":"Feature","geometry":{"type":"Point","coordinates":[-122.408064,37.760601]}},{"properties":{"latitude":37.7525047,"time":{"end_time":"2030/01/01 13:43:00 -0500","original":"1:42 p.m.","granularity":"min","time":"2030/01/01 13:42:00 -0500"},"date":{"end_time":"2011/09/03 00:00:00 -0400","original":"9/2/11","granularity":"day","time":"2011/09/02 00:00:00 -0400"},"description":"Criminal threats, battery","longitude":-122.414068,"crime type":"Battery","id":"a6ez671jv31m","address":"24th Street and Folsom, San Francisco, CA"},"type":"Feature","geometry":{"type":"Point","coordinates":[-122.414068,37.7525047]}},{"properties":{"latitude":37.7571691,"time":{"end_time":"2030/01/01 21:00:00 -0500","original":"8:00 p.m.","granularity":"hour","time":"2030/01/01 20:00:00 -0500"},"date":{"end_time":"2011/09/03 00:00:00 -0400","original":"9/2/11","granularity":"day","time":"2011/09/02 00:00:00 -0400"},"description":"Bicycle theft","longitude":-122.4167288,"crime type":"Bicycle Theft","id":"a6ez66wu3h8t","address":"21st Street and South Van Ness, San Francisco, CA"},"type":"Feature","geometry":{"type":"Point","coordinates":[-122.4167288,37.7571691]}},{"properties":{"latitude":37.761423,"time":{"end_time":"2030/01/01 07:46:00 -0500","original":"7:45 a.m.","granularity":"min","time":"2030/01/01 07:45:00 -0500"},"date":{"end_time":"2011/09/03 00:00:00 -0400","original":"9/2/11","granularity":"day","time":"2011/09/02 00:00:00 -0400"},"description":"Burglary, garage","longitude":-122.4260224,"crime type":"Burglary - Home","id":"a6ez673nnrjt","address":"18th Street and Dolores, San Francisco, CA"},"type":"Feature","geometry":{"type":"Point","coordinates":[-122.4260224,37.761423]}},{"properties":{"latitude":37.7518942,"time":{"end_time":"2030/01/01 11:21:00 -0500","original":"11:20 a.m.","granularity":"min","time":"2030/01/01 11:20:00 -0500"},"date":{"end_time":"2011/09/03 00:00:00 -0400","original":"9/2/11","granularity":"day","time":"2011/09/02 00:00:00 -0400"},"description":"Burglary","longitude":-122.4033961,"crime type":"Burglary - Home","id":"a6ez66x57794","address":"25th Street and Vermont, San Francisco, CA"},"type":"Feature","geometry":{"type":"Point","coordinates":[-122.4033961,37.7518942]}},{"properties":{"latitude":37.7633,"time":{"end_time":"2030/01/01 08:00:00 -0500","original":"7:00 a.m.","granularity":"hour","time":"2030/01/01 07:00:00 -0500"},"date":{"end_time":"2011/09/03 00:00:00 -0400","original":"9/2/11","granularity":"day","time":"2011/09/02 00:00:00 -0400"},"description":"Auto burglary","longitude":-122.421732,"crime type":"Burglary - Vehicle","id":"a6ez66pyqpgc","address":"17th Street and Valencia, San Francisco, CA"},"type":"Feature","geometry":{"type":"Point","coordinates":[-122.421732,37.7633]}},{"properties":{"latitude":37.7545752,"time":{"end_time":"2030/01/01 04:00:00 -0500","original":"3:00 a.m.","granularity":"hour","time":"2030/01/01 03:00:00 -0500"},"date":{"end_time":"2011/09/03 00:00:00 -0400","original":"9/2/11","granularity":"day","time":"2011/09/02 00:00:00 -0400"},"description":"Domestic violence","longitude":-122.4064317,"crime type":"Domestic Violence","id":"a6ez66rqijs4","address":"23rd Street and Potrero, San Francisco, CA"},"type":"Feature","geometry":{"type":"Point","coordinates":[-122.4064317,37.7545752]}},{"properties":{"latitude":37.74806,"time":{"end_time":"2030/01/01 13:00:00 -0500","original":"12:00 p.m.","granularity":"hour","time":"2030/01/01 12:00:00 -0500"},"date":{"end_time":"2011/09/03 00:00:00 -0400","original":"9/2/11","granularity":"day","time":"2011/09/02 00:00:00 -0400"},"description":"Criminal threats","longitude":-122.4202659,"crime type":"Unknown","id":"a6ez66yv2bx9","address":"Valencia Street and Cesar Chavez, San Francisco, CA"},"type":"Feature","geometry":{"type":"Point","coordinates":[-122.4202659,37.74806]}},{"properties":{"latitude":37.7491151,"time":{"end_time":"2030/01/01 00:57:00 -0500","original":"12:56 a.m.","granularity":"min","time":"2030/01/01 00:56:00 -0500"},"date":{"end_time":"2011/09/04 00:00:00 -0400","original":"9/3/11","granularity":"day","time":"2011/09/03 00:00:00 -0400"},"description":"Aggravated assault, knife","longitude":-122.4170407,"crime type":"Aggravated Assault","id":"a6ez6720xszd","address":"26th Street and Capp, San Francisco, CA"},"type":"Feature","geometry":{"type":"Point","coordinates":[-122.4170407,37.7491151]}},{"properties":{"latitude":37.7570986,"time":{"end_time":"2030/01/01 23:00:00 -0500","original":"10:00 p.m.","granularity":"hour","time":"2030/01/01 22:00:00 -0500"},"date":{"end_time":"2011/09/05 00:00:00 -0400","original":"9/4/11","granularity":"day","time":"2011/09/04 00:00:00 -0400"},"description":"Stolen Auto","longitude":-122.4178225,"crime type":"Auto Theft","id":"a6ez66y0ooy5","address":"21st Street and Capp, San Francisco, CA"},"type":"Feature","geometry":{"type":"Point","coordinates":[-122.4178225,37.7570986]}},{"properties":{"latitude":37.7649169,"time":{"end_time":"2030/01/01 00:36:00 -0500","original":"12:35 a.m.","granularity":"min","time":"2030/01/01 00:35:00 -0500"},"date":{"end_time":"2011/09/05 00:00:00 -0400","original":"9/4/11","granularity":"day","time":"2011/09/04 00:00:00 -0400"},"description":"Battery","longitude":-122.421886,"crime type":"Battery","id":"a6ez66ot75u1","address":"16th Street and Valencia, San Francisco, CA"},"type":"Feature","geometry":{"type":"Point","coordinates":[-122.421886,37.7649169]}},{"properties":{"latitude":37.7602375,"time":{"end_time":"2030/01/01 03:00:00 -0500","original":"2:00 a.m.","granularity":"hour","time":"2030/01/01 02:00:00 -0500"},"date":{"end_time":"2011/09/05 00:00:00 -0400","original":"9/4/11","granularity":"day","time":"2011/09/04 00:00:00 -0400"},"description":"Burglary, Hotel Room","longitude":-122.4192191,"crime type":"Burglary - Home","id":"a6ez66qh7m1t","address":"19th Street and Mission, San Francisco, CA"},"type":"Feature","geometry":{"type":"Point","coordinates":[-122.4192191,37.7602375]}},{"properties":{"latitude":37.7634959,"time":{"end_time":"2030/01/01 23:21:00 -0500","original":"11:20 p.m.","granularity":"min","time":"2030/01/01 23:20:00 -0500"},"date":{"end_time":"2011/09/05 00:00:00 -0400","original":"9/4/11","granularity":"day","time":"2011/09/04 00:00:00 -0400"},"description":"Burglary, apartment","longitude":-122.418484,"crime type":"Burglary - Home","id":"a6ez66tr9y31","address":"17th Street and Capp, San Francisco, CA"},"type":"Feature","geometry":{"type":"Point","coordinates":[-122.418484,37.7634959]}},{"properties":{"latitude":37.7558329,"time":{"end_time":"2030/01/01 13:00:00 -0500","original":"12:00 p.m.","granularity":"hour","time":"2030/01/01 12:00:00 -0500"},"date":{"end_time":"2011/09/05 00:00:00 -0400","original":"9/4/11","granularity":"day","time":"2011/09/04 00:00:00 -0400"},"description":"Auto burglary","longitude":-122.412198,"crime type":"Burglary - Vehicle","id":"a6ez66qxcmdg","address":"22nd Street and Harrison, San Francisco, CA"},"type":"Feature","geometry":{"type":"Point","coordinates":[-122.412198,37.7558329]}},{"properties":{"latitude":37.768298,"time":{"end_time":"2030/01/01 08:00:00 -0500","original":"7:00 a.m.","granularity":"hour","time":"2030/01/01 07:00:00 -0500"},"date":{"end_time":"2011/09/05 00:00:00 -0400","original":"9/4/11","granularity":"day","time":"2011/09/04 00:00:00 -0400"},"description":"Stolen Motorcycle","longitude":-122.408744,"crime type":"Motorcycle Theft","id":"a6ez66z6bzkd","address":"Alameda and Hampshire, San Francisco, CA"},"type":"Feature","geometry":{"type":"Point","coordinates":[-122.408744,37.768298]}},{"properties":{"latitude":37.7540389,"time":{"end_time":"2030/01/01 09:00:00 -0500","original":"8:00 a.m.","granularity":"hour","time":"2030/01/01 08:00:00 -0500"},"date":{"end_time":"2011/09/05 00:00:00 -0400","original":"9/4/11","granularity":"day","time":"2011/09/04 00:00:00 -0400"},"description":"Stolen Motorcycle","longitude":-122.41532,"crime type":"Motorcycle Theft","id":"a6ez670p6qbu","address":"23rd Street and Shotwell, San Francisco, CA"},"type":"Feature","geometry":{"type":"Point","coordinates":[-122.41532,37.7540389]}},{"properties":{"latitude":37.7649169,"time":{"end_time":"2030/01/01 11:31:00 -0500","original":"11:30 a.m.","granularity":"min","time":"2030/01/01 11:30:00 -0500"},"date":{"end_time":"2011/09/05 00:00:00 -0400","original":"9/4/11","granularity":"day","time":"2011/09/04 00:00:00 -0400"},"description":"Theft of wallet from unattended purse in bar","longitude":-122.421886,"crime type":"Theft","id":"a6ez66vstzgp","address":"16th Street and Valencia, San Francisco, CA"},"type":"Feature","geometry":{"type":"Point","coordinates":[-122.421886,37.7649169]}},{"properties":{"latitude":37.769953,"time":{"end_time":"2030/01/01 16:46:00 -0500","original":"4:45 p.m.","granularity":"min","time":"2030/01/01 16:45:00 -0500"},"date":{"end_time":"2011/09/05 00:00:00 -0400","original":"9/4/11","granularity":"day","time":"2011/09/04 00:00:00 -0400"},"description":"Theft from building","longitude":-122.420947,"crime type":"Theft","id":"a6ez670y9tof","address":"Duboce and Woodward, San Francisco, CA"},"type":"Feature","geometry":{"type":"Point","coordinates":[-122.420947,37.769953]}},{"properties":{"latitude":37.7593094,"time":{"end_time":"2030/01/01 03:00:00 -0500","original":"2:00 a.m.","granularity":"hour","time":"2030/01/01 02:00:00 -0500"},"date":{"end_time":"2011/09/05 00:00:00 -0400","original":"9/4/11","granularity":"day","time":"2011/09/04 00:00:00 -0400"},"description":"Malicious Mischief, graffiti","longitude":-122.40794,"crime type":"Vandalism","id":"a6ez66vqr91v","address":"20th Street and Hampshire, San Francisco, CA"},"type":"Feature","geometry":{"type":"Point","coordinates":[-122.40794,37.7593094]}},{"properties":{"latitude":37.7586337,"time":{"end_time":"2030/01/01 00:57:00 -0500","original":"12:56 a.m.","granularity":"min","time":"2030/01/01 00:56:00 -0500"},"date":{"end_time":"2011/09/06 00:00:00 -0400","original":"9/5/11","granularity":"day","time":"2011/09/05 00:00:00 -0400"},"description":"Aggragated assault","longitude":-122.4190627,"crime type":"Aggravated Assault","id":"a6ez66xn155g","address":"20th Street and Mission, San Francisco, CA"},"type":"Feature","geometry":{"type":"Point","coordinates":[-122.4190627,37.7586337]}},{"properties":{"latitude":37.7598227,"time":{"end_time":"2030/01/01 07:16:00 -0500","original":"7:15 a.m.","granularity":"min","time":"2030/01/01 07:15:00 -0500"},"date":{"end_time":"2011/09/06 00:00:00 -0400","original":"9/5/11","granularity":"day","time":"2011/09/05 00:00:00 -0400"},"description":"Stolen Auto","longitude":-122.4260048,"crime type":"Auto Theft","id":"a6ez66t633dq","address":"19th Street and Dolores, San Francisco, CA"},"type":"Feature","geometry":{"type":"Point","coordinates":[-122.4260048,37.7598227]}},{"properties":{"latitude":37.7634959,"time":{"end_time":"2030/01/01 10:00:00 -0500","original":"9:00 a.m.","granularity":"hour","time":"2030/01/01 09:00:00 -0500"},"date":{"end_time":"2011/09/06 00:00:00 -0400","original":"9/5/11","granularity":"day","time":"2011/09/05 00:00:00 -0400"},"description":"Stolen truck","longitude":-122.418484,"crime type":"Auto Theft","id":"a6ez66tigxzo","address":"17th Street and Capp, San Francisco, CA"},"type":"Feature","geometry":{"type":"Point","coordinates":[-122.418484,37.7634959]}},{"properties":{"latitude":37.7586337,"time":{"end_time":"2030/01/01 07:51:00 -0500","original":"7:50 a.m.","granularity":"min","time":"2030/01/01 07:50:00 -0500"},"date":{"end_time":"2011/09/06 00:00:00 -0400","original":"9/5/11","granularity":"day","time":"2011/09/05 00:00:00 -0400"},"description":"Bicycle theft","longitude":-122.4190627,"crime type":"Bicycle Theft","id":"a6ez66oodn2f","address":"20th Street and Mission, San Francisco, CA"},"type":"Feature","geometry":{"type":"Point","coordinates":[-122.4190627,37.7586337]}},{"properties":{"latitude":37.7601889,"time":{"end_time":"2030/01/01 11:11:00 -0500","original":"11:10 a.m.","granularity":"min","time":"2030/01/01 11:10:00 -0500"},"date":{"end_time":"2011/09/06 00:00:00 -0400","original":"9/5/11","granularity":"day","time":"2011/09/05 00:00:00 -0400"},"description":"Auto burglary","longitude":-122.419975,"crime type":"Burglary - Vehicle","id":"a6ez66t3tfjh","address":"19th Street and San Carlos, San Francisco, CA"},"type":"Feature","geometry":{"type":"Point","coordinates":[-122.419975,37.7601889]}},{"properties":{"latitude":37.75423,"time":{"end_time":"2030/01/01 23:16:00 -0500","original":"11:15 p.m.","granularity":"min","time":"2030/01/01 23:15:00 -0500"},"date":{"end_time":"2011/09/06 00:00:00 -0400","original":"9/5/11","granularity":"day","time":"2011/09/05 00:00:00 -0400"},"description":"Auto burglary","longitude":-122.412047,"crime type":"Burglary - Vehicle","id":"a6ez66sz89ra","address":"23rd Street and Harrison, San Francisco, CA"},"type":"Feature","geometry":{"type":"Point","coordinates":[-122.412047,37.75423]}},{"properties":{"latitude":37.7694819,"time":{"end_time":"2030/01/01 18:45:00 -0500","original":"6:44 p.m.","granularity":"min","time":"2030/01/01 18:44:00 -0500"},"date":{"end_time":"2011/09/06 00:00:00 -0400","original":"9/5/11","granularity":"day","time":"2011/09/05 00:00:00 -0400"},"description":"Auto burglary","longitude":-122.4133685,"crime type":"Burglary - Vehicle","id":"a6ez66par41a","address":"13th Street and Harrison, San Francisco, CA"},"type":"Feature","geometry":{"type":"Point","coordinates":[-122.4133685,37.7694819]}},{"properties":{"latitude":37.7586337,"time":{"end_time":"2030/01/01 02:20:00 -0500","original":"2:19 a.m.","granularity":"min","time":"2030/01/01 02:19:00 -0500"},"date":{"end_time":"2011/09/06 00:00:00 -0400","original":"9/5/11","granularity":"day","time":"2011/09/05 00:00:00 -0400"},"description":"Homicide, gun","longitude":-122.4190627,"crime type":"Homicide","id":"a6ez66v6rug4","address":"20th Street and Mission, San Francisco, CA"},"type":"Feature","geometry":{"type":"Point","coordinates":[-122.4190627,37.7586337]}},{"properties":{"latitude":37.7522494,"time":{"end_time":"2030/01/01 19:10:00 -0500","original":"7:09 p.m.","granularity":"min","time":"2030/01/01 19:09:00 -0500"},"date":{"end_time":"2011/09/06 00:00:00 -0400","original":"9/5/11","granularity":"day","time":"2011/09/05 00:00:00 -0400"},"description":"Attempted grand theft, con","longitude":-122.4184567,"crime type":"Theft","id":"a6ez66uey30i","address":"24th Street and Mission, San Francisco, CA"},"type":"Feature","geometry":{"type":"Point","coordinates":[-122.4184567,37.7522494]}},{"properties":{"latitude":37.7545752,"time":{"end_time":"2030/01/01 04:56:00 -0500","original":"4:55 a.m.","granularity":"min","time":"2030/01/01 04:55:00 -0500"},"date":{"end_time":"2011/09/06 00:00:00 -0400","original":"9/5/11","granularity":"day","time":"2011/09/05 00:00:00 -0400"},"description":"Malicious mischief, windows","longitude":-122.4064317,"crime type":"Vandalism","id":"a6ez66w7fn14","address":"23rd Street and Potrero, San Francisco, CA"},"type":"Feature","geometry":{"type":"Point","coordinates":[-122.4064317,37.7545752]}},{"properties":{"latitude":37.7633,"time":{"end_time":"2030/01/01 10:51:00 -0500","original":"10:50 a.m.","granularity":"min","time":"2030/01/01 10:50:00 -0500"},"date":{"end_time":"2011/09/06 00:00:00 -0400","original":"9/5/11","granularity":"day","time":"2011/09/05 00:00:00 -0400"},"description":"Malicious mischief","longitude":-122.421732,"crime type":"Vandalism","id":"a6ez66t34vzh","address":"17th Street and Valencia, San Francisco, CA"},"type":"Feature","geometry":{"type":"Point","coordinates":[-122.421732,37.7633]}},{"properties":{"latitude":37.7521823,"time":{"end_time":"2030/01/01 06:46:00 -0500","original":"6:45 a.m.","granularity":"min","time":"2030/01/01 06:45:00 -0500"},"date":{"end_time":"2011/09/07 00:00:00 -0400","original":"9/6/11","granularity":"day","time":"2011/09/06 00:00:00 -0400"},"description":"Stolen Auto","longitude":-122.419546,"crime type":"Auto Theft","id":"a6ez66u4s5yb","address":"24th Street and Bartlett, San Francisco, CA"},"type":"Feature","geometry":{"type":"Point","coordinates":[-122.419546,37.7521823]}},{"properties":{"latitude":37.7543749,"time":{"end_time":"2030/01/01 07:00:00 -0500","original":"6:00 a.m.","granularity":"hour","time":"2030/01/01 06:00:00 -0500"},"date":{"end_time":"2011/09/07 00:00:00 -0400","original":"9/6/11","granularity":"day","time":"2011/09/06 00:00:00 -0400"},"description":"Bicycle theft from garage","longitude":-122.423062,"crime type":"Bicycle Theft","id":"a6ez66x0xdne","address":"Alvarado Street and Guerrero, San Francisco, CA"},"type":"Feature","geometry":{"type":"Point","coordinates":[-122.423062,37.7543749]}},{"properties":{"latitude":37.7682031,"time":{"end_time":"2030/01/01 07:00:00 -0500","original":"6:00 a.m.","granularity":"hour","time":"2030/01/01 06:00:00 -0500"},"date":{"end_time":"2011/09/07 00:00:00 -0400","original":"9/6/11","granularity":"day","time":"2011/09/06 00:00:00 -0400"},"description":"Auto Burglary","longitude":-122.4213719,"crime type":"Burglary - Vehicle","id":"a6ez6706mbll","address":"14th Street and Stevenson, San Francisco, CA"},"type":"Feature","geometry":{"type":"Point","coordinates":[-122.4213719,37.7682031]}},{"properties":{"latitude":37.7664112,"time":{"end_time":"2030/01/01 22:00:00 -0500","original":"9:00 p.m.","granularity":"hour","time":"2030/01/01 21:00:00 -0500"},"date":{"end_time":"2011/09/07 00:00:00 -0400","original":"9/6/11","granularity":"day","time":"2011/09/06 00:00:00 -0400"},"description":"Auto burglary","longitude":-122.4243098,"crime type":"Burglary - Vehicle","id":"a6ez66osct23","address":"15th Street and Guerrero, San Francisco, CA"},"type":"Feature","geometry":{"type":"Point","coordinates":[-122.4243098,37.7664112]}},{"properties":{"latitude":37.7668709,"time":{"end_time":"2030/01/01 10:07:00 -0500","original":"10:06 a.m.","granularity":"min","time":"2030/01/01 10:06:00 -0500"},"date":{"end_time":"2011/09/07 00:00:00 -0400","original":"9/6/11","granularity":"day","time":"2011/09/06 00:00:00 -0400"},"description":"Civil sidewalks written warning","longitude":-122.4165614,"crime type":"Civil Sidewalks","id":"a6ez67304bwk","address":"15th Street and Shotwell, San Francisco, CA"},"type":"Feature","geometry":{"type":"Point","coordinates":[-122.4165614,37.7668709]}},{"properties":{"latitude":37.7668709,"time":{"end_time":"2030/01/01 10:07:00 -0500","original":"10:06 a.m.","granularity":"min","time":"2030/01/01 10:06:00 -0500"},"date":{"end_time":"2011/09/07 00:00:00 -0400","original":"9/6/11","granularity":"day","time":"2011/09/06 00:00:00 -0400"},"description":"Civil sidewalks written warning","longitude":-122.4165614,"crime type":"Civil Sidewalks","id":"a6ez66p1qej2","address":"15th Street and Shotwell, San Francisco, CA"},"type":"Feature","geometry":{"type":"Point","coordinates":[-122.4165614,37.7668709]}},{"properties":{"latitude":37.7602375,"time":{"end_time":"2030/01/01 02:26:00 -0500","original":"2:25 a.m.","granularity":"min","time":"2030/01/01 02:25:00 -0500"},"date":{"end_time":"2011/09/07 00:00:00 -0400","original":"9/6/11","granularity":"day","time":"2011/09/06 00:00:00 -0400"},"description":"Robbery, force","longitude":-122.4192191,"crime type":"Robbery","id":"a6ez670w6o50","address":"19th Street and Mission, San Francisco, CA"},"type":"Feature","geometry":{"type":"Point","coordinates":[-122.4192191,37.7602375]}},{"properties":{"latitude":37.7685494,"time":{"end_time":"2030/01/01 08:10:00 -0500","original":"8:09 a.m.","granularity":"min","time":"2030/01/01 08:09:00 -0500"},"date":{"end_time":"2011/09/07 00:00:00 -0400","original":"9/6/11","granularity":"day","time":"2011/09/06 00:00:00 -0400"},"description":"Petty theft, shoplifting","longitude":-122.4156202,"crime type":"Theft","id":"a6ez673aimqu","address":"14th Street and Folsom, San Francisco, CA"},"type":"Feature","geometry":{"type":"Point","coordinates":[-122.4156202,37.7685494]}},{"properties":{"latitude":37.7553071,"time":{"end_time":"2030/01/01 23:11:00 -0500","original":"11:10 p.m.","granularity":"min","time":"2030/01/01 23:10:00 -0500"},"date":{"end_time":"2011/09/07 00:00:00 -0400","original":"9/6/11","granularity":"day","time":"2011/09/06 00:00:00 -0400"},"description":"Trespassing","longitude":-122.4209695,"crime type":"Unknown","id":"a6ez66u6dq44","address":"22nd Street and Valencia, San Francisco, CA"},"type":"Feature","geometry":{"type":"Point","coordinates":[-122.4209695,37.7553071]}},{"properties":{"latitude":37.7620332,"time":{"end_time":"2030/01/01 23:46:00 -0500","original":"11:45 p.m.","granularity":"min","time":"2030/01/01 23:45:00 -0500"},"date":{"end_time":"2011/09/07 00:00:00 -0400","original":"9/6/11","granularity":"day","time":"2011/09/06 00:00:00 -0400"},"description":"Suspicious acts toward female","longitude":-122.4161017,"crime type":"Unknown","id":"a6ez66oxoyll","address":"18th Street and Shotwell, San Francisco, CA"},"type":"Feature","geometry":{"type":"Point","coordinates":[-122.4161017,37.7620332]}},{"properties":{"latitude":37.7693666,"time":{"end_time":"2030/01/01 09:00:00 -0500","original":"8:00 a.m.","granularity":"hour","time":"2030/01/01 08:00:00 -0500"},"date":{"end_time":"2011/09/07 00:00:00 -0400","original":"9/6/11","granularity":"day","time":"2011/09/06 00:00:00 -0400"},"description":"Malicious mischief, vehicle","longitude":-122.4156119,"crime type":"Vandalism","id":"a6ez66xmtlyc","address":"Erie Street and Folsom, San Francisco, CA"},"type":"Feature","geometry":{"type":"Point","coordinates":[-122.4156119,37.7693666]}},{"properties":{"latitude":37.760148,"time":{"end_time":"2030/01/01 00:50:00 -0500","original":"12:49 a.m.","granularity":"min","time":"2030/01/01 00:49:00 -0500"},"date":{"end_time":"2011/09/08 00:00:00 -0400","original":"9/7/11","granularity":"day","time":"2011/09/07 00:00:00 -0400"},"description":"Aggragated assault","longitude":-122.42066,"crime type":"Aggravated Assault","id":"a6ez66r9zs6b","address":"19th Street and Lexington, San Francisco, CA"},"type":"Feature","geometry":{"type":"Point","coordinates":[-122.42066,37.760148]}},{"properties":{"latitude":37.7522494,"time":{"end_time":"2030/01/01 11:51:00 -0500","original":"11:50 a.m.","granularity":"min","time":"2030/01/01 11:50:00 -0500"},"date":{"end_time":"2011/09/08 00:00:00 -0400","original":"9/7/11","granularity":"day","time":"2011/09/07 00:00:00 -0400"},"description":"Aggravated assault, gun","longitude":-122.4184567,"crime type":"Aggravated Assault","id":"a6ez66wefm8j","address":"24th Street and Mission, San Francisco, CA"},"type":"Feature","geometry":{"type":"Point","coordinates":[-122.4184567,37.7522494]}},{"properties":{"latitude":37.7556351,"time":{"end_time":"2030/01/01 22:56:00 -0500","original":"10:55 p.m.","granularity":"min","time":"2030/01/01 22:55:00 -0500"},"date":{"end_time":"2011/09/08 00:00:00 -0400","original":"9/7/11","granularity":"day","time":"2011/09/07 00:00:00 -0400"},"description":"Battery","longitude":-122.4154823,"crime type":"Battery","id":"a6ez66zr7wjn","address":"22nd Street and Shotwell, San Francisco, CA"},"type":"Feature","geometry":{"type":"Point","coordinates":[-122.4154823,37.7556351]}},{"properties":{"latitude":37.7506796,"time":{"end_time":"2030/01/01 20:00:00 -0500","original":"7:00 p.m.","granularity":"hour","time":"2030/01/01 19:00:00 -0500"},"date":{"end_time":"2011/09/08 00:00:00 -0400","original":"9/7/11","granularity":"day","time":"2011/09/07 00:00:00 -0400"},"description":"Burglary, apartment","longitude":-122.4177341,"crime type":"Burglary - Home","id":"a6ez66tbdhtp","address":"25th Street and Lilac, San Francisco, CA"},"type":"Feature","geometry":{"type":"Point","coordinates":[-122.4177341,37.7506796]}},{"properties":{"latitude":37.7749295,"time":{"end_time":"2030/01/01 11:46:00 -0500","original":"11:45 a.m.","granularity":"min","time":"2030/01/01 11:45:00 -0500"},"date":{"end_time":"2011/09/08 00:00:00 -0400","original":"9/7/11","granularity":"day","time":"2011/09/07 00:00:00 -0400"},"description":"Auto burglary","longitude":-122.4194155,"crime type":"Burglary - Vehicle","id":"a6ez66ryn3t4","address":"Alabama Street and Harrison, San Francisco, CA"},"type":"Feature","geometry":{"type":"Point","coordinates":[-122.4194155,37.7749295]}},{"properties":{"latitude":37.7647864,"time":{"end_time":"2030/01/01 06:41:00 -0500","original":"6:40 a.m.","granularity":"min","time":"2030/01/01 06:40:00 -0500"},"date":{"end_time":"2011/09/08 00:00:00 -0400","original":"9/7/11","granularity":"day","time":"2011/09/07 00:00:00 -0400"},"description":"Theft of unattended purse","longitude":-122.4240587,"crime type":"Theft","id":"a6ez66ua8dhy","address":"16th Street and Guerrero, San Francisco, CA"},"type":"Feature","geometry":{"type":"Point","coordinates":[-122.4240587,37.7647864]}},{"properties":{"latitude":37.7518503,"time":{"end_time":"2030/01/01 11:06:00 -0500","original":"11:05 a.m.","granularity":"min","time":"2030/01/01 11:05:00 -0500"},"date":{"end_time":"2011/09/08 00:00:00 -0400","original":"9/7/11","granularity":"day","time":"2011/09/07 00:00:00 -0400"},"description":"Theft of ring from faculty bathroom","longitude":-122.4042472,"crime type":"Theft","id":"a6ez66qqysop","address":"25th Street and San Bruno, San Francisco, CA"},"type":"Feature","geometry":{"type":"Point","coordinates":[-122.4042472,37.7518503]}},{"properties":{"latitude":37.7634362,"time":{"end_time":"2030/01/01 16:06:00 -0500","original":"4:05 p.m.","granularity":"min","time":"2030/01/01 16:05:00 -0500"},"date":{"end_time":"2011/09/08 00:00:00 -0400","original":"9/7/11","granularity":"day","time":"2011/09/07 00:00:00 -0400"},"description":"Theft from unlocked vehicle","longitude":-122.4195226,"crime type":"Theft","id":"a6ez66reflhc","address":"17th Street and Mission, San Francisco, CA"},"type":"Feature","geometry":{"type":"Point","coordinates":[-122.4195226,37.7634362]}},{"properties":{"latitude":37.7649169,"time":{"end_time":"2030/01/01 23:57:00 -0500","original":"11:56 p.m.","granularity":"min","time":"2030/01/01 23:56:00 -0500"},"date":{"end_time":"2011/09/09 00:00:00 -0400","original":"9/8/11","granularity":"day","time":"2011/09/08 00:00:00 -0400"},"description":"Aggragated assault","longitude":-122.421886,"crime type":"Aggravated Assault","id":"a6ez670p5vez","address":"16th Street and Valencia, San Francisco, CA"},"type":"Feature","geometry":{"type":"Point","coordinates":[-122.421886,37.7649169]}},{"properties":{"latitude":37.7618996,"time":{"end_time":"2030/01/01 18:32:00 -0500","original":"6:31 p.m.","granularity":"min","time":"2030/01/01 18:31:00 -0500"},"date":{"end_time":"2011/09/09 00:00:00 -0400","original":"9/8/11","granularity":"day","time":"2011/09/08 00:00:00 -0400"},"description":"Bicycle theft","longitude":-122.4182904,"crime type":"Bicycle Theft","id":"a6ez66qk74pj","address":"18th Street and Capp, San Francisco, CA"},"type":"Feature","geometry":{"type":"Point","coordinates":[-122.4182904,37.7618996]}},{"properties":{"latitude":37.7602375,"time":{"end_time":"2030/01/01 12:16:00 -0500","original":"12:15 p.m.","granularity":"min","time":"2030/01/01 12:15:00 -0500"},"date":{"end_time":"2011/09/09 00:00:00 -0400","original":"9/8/11","granularity":"day","time":"2011/09/08 00:00:00 -0400"},"description":"Auto burglary","longitude":-122.4192191,"crime type":"Burglary - Vehicle","id":"a6ez66v3myrv","address":"19th Street and Mission, San Francisco, CA"},"type":"Feature","geometry":{"type":"Point","coordinates":[-122.4192191,37.7602375]}},{"properties":{"latitude":37.7558329,"time":{"end_time":"2030/01/01 03:11:00 -0500","original":"3:10 a.m.","granularity":"min","time":"2030/01/01 03:10:00 -0500"},"date":{"end_time":"2011/09/09 00:00:00 -0400","original":"9/8/11","granularity":"day","time":"2011/09/08 00:00:00 -0400"},"description":"Disturbing the peace, fighting","longitude":-122.412198,"crime type":"Disturbing the Peace","id":"a6ez674drgsx","address":"22nd Street and Harrison, San Francisco, CA"},"type":"Feature","geometry":{"type":"Point","coordinates":[-122.412198,37.7558329]}},{"properties":{"latitude":37.7529917,"time":{"end_time":"2030/01/01 19:59:00 -0500","original":"7:58 p.m.","granularity":"min","time":"2030/01/01 19:58:00 -0500"},"date":{"end_time":"2011/09/09 00:00:00 -0400","original":"9/8/11","granularity":"day","time":"2011/09/08 00:00:00 -0400"},"description":"Possession of counterfeit","longitude":-122.4062731,"crime type":"Fraud","id":"a6ez66sztohv","address":"24th Street and Potrero, San Francisco, CA"},"type":"Feature","geometry":{"type":"Point","coordinates":[-122.4062731,37.7529917]}},{"properties":{"latitude":37.7602375,"time":{"end_time":"2030/01/01 13:00:00 -0500","original":"12:00","granularity":"hour","time":"2030/01/01 12:00:00 -0500"},"date":{"end_time":"2011/09/09 00:00:00 -0400","original":"9/8/11","granularity":"day","time":"2011/09/08 00:00:00 -0400"},"description":"Theft from hotel room","longitude":-122.4192191,"crime type":"Theft","id":"a6ez66vsebeh","address":"19th Street and Mission, San Francisco, CA"},"type":"Feature","geometry":{"type":"Point","coordinates":[-122.4192191,37.7602375]}},{"properties":{"latitude":37.760101,"time":{"end_time":"2030/01/01 02:00:00 -0500","original":"1:00 a.m.","granularity":"hour","time":"2030/01/01 01:00:00 -0500"},"date":{"end_time":"2011/09/09 00:00:00 -0400","original":"9/8/11","granularity":"day","time":"2011/09/08 00:00:00 -0400"},"description":"Phone stolen from unattended coat (in bar)","longitude":-122.421425,"crime type":"Theft","id":"a6ez66ub3uy7","address":"19th Street and Valencia, San Francisco, CA"},"type":"Feature","geometry":{"type":"Point","coordinates":[-122.421425,37.760101]}},{"properties":{"latitude":37.754337,"time":{"end_time":"2030/01/01 19:00:00 -0500","original":"6:00 p.m.","granularity":"hour","time":"2030/01/01 18:00:00 -0500"},"date":{"end_time":"2011/09/09 00:00:00 -0400","original":"9/8/11","granularity":"day","time":"2011/09/08 00:00:00 -0400"},"description":"Pickpocket","longitude":-122.405454,"crime type":"Theft","id":"a6ez66xm4biv","address":"23rd Street and Utah, San Francisco, CA"},"type":"Feature","geometry":{"type":"Point","coordinates":[-122.405454,37.754337]}},{"properties":{"latitude":37.76654,"time":{"end_time":"2030/01/01 18:41:00 -0500","original":"6:40 p.m.","granularity":"min","time":"2030/01/01 18:40:00 -0500"},"date":{"end_time":"2011/09/09 00:00:00 -0400","original":"9/8/11","granularity":"day","time":"2011/09/08 00:00:00 -0400"},"description":"Theft from room by acquaintance","longitude":-122.422044,"crime type":"Theft","id":"a6ez671wya7a","address":"15th Street and Valencia, San Francisco, CA"},"type":"Feature","geometry":{"type":"Point","coordinates":[-122.422044,37.76654]}},{"properties":{"latitude":37.7617009,"time":{"end_time":"2030/01/01 20:16:00 -0500","original":"8:15 p.m.","granularity":"min","time":"2030/01/01 20:15:00 -0500"},"date":{"end_time":"2011/09/09 00:00:00 -0400","original":"9/8/11","granularity":"day","time":"2011/09/08 00:00:00 -0400"},"description":"Theft from unattended purse","longitude":-122.421578,"crime type":"Theft","id":"a6ez66o40r23","address":"18th Street and Valencia, San Francisco, CA"},"type":"Feature","geometry":{"type":"Point","coordinates":[-122.421578,37.7617009]}},{"properties":{"latitude":37.75423,"time":{"end_time":"2030/01/01 22:11:00 -0500","original":"10:10 p.m.","granularity":"min","time":"2030/01/01 22:10:00 -0500"},"date":{"end_time":"2011/09/10 00:00:00 -0400","original":"9/9/11","granularity":"day","time":"2011/09/09 00:00:00 -0400"},"description":"Aggravated assault, force","longitude":-122.412047,"crime type":"Aggravated Assault","id":"a6ez66u3kxb6","address":"23rd Street and Harrison, San Francisco, CA"},"type":"Feature","geometry":{"type":"Point","coordinates":[-122.412047,37.75423]}},{"properties":{"latitude":37.754337,"time":{"end_time":"2030/01/01 09:00:00 -0500","original":"8:00 a.m.","granularity":"hour","time":"2030/01/01 08:00:00 -0500"},"date":{"end_time":"2011/09/10 00:00:00 -0400","original":"9/9/11","granularity":"day","time":"2011/09/09 00:00:00 -0400"},"description":"Stolen Auto","longitude":-122.405454,"crime type":"Auto Theft","id":"a6ez66ocqgyf","address":"23rd Street and Utah, San Francisco, CA"},"type":"Feature","geometry":{"type":"Point","coordinates":[-122.405454,37.754337]}},{"properties":{"latitude":37.7531616,"time":{"end_time":"2030/01/01 08:31:00 -0500","original":"8:30 a.m.","granularity":"min","time":"2030/01/01 08:30:00 -0500"},"date":{"end_time":"2011/09/10 00:00:00 -0400","original":"9/9/11","granularity":"day","time":"2011/09/09 00:00:00 -0400"},"description":"Stolen Auto","longitude":-122.4298156,"crime type":"Auto Theft","id":"a6ez66v5h7t9","address":"23rd Street and Sanchez, San Francisco, CA"},"type":"Feature","geometry":{"type":"Point","coordinates":[-122.4298156,37.7531616]}},{"properties":{"latitude":37.7678713,"time":{"end_time":"2030/01/01 20:31:00 -0500","original":"8:30 p.m.","granularity":"min","time":"2030/01/01 20:30:00 -0500"},"date":{"end_time":"2011/09/10 00:00:00 -0400","original":"9/9/11","granularity":"day","time":"2011/09/09 00:00:00 -0400"},"description":"Bicycle theft","longitude":-122.4267868,"crime type":"Bicycle Theft","id":"a6ez671l34l5","address":"14th Street and Dolores, San Francisco, CA"},"type":"Feature","geometry":{"type":"Point","coordinates":[-122.4267868,37.7678713]}},{"properties":{"latitude":37.7694819,"time":{"end_time":"2030/01/01 14:00:00 -0500","original":"1:00 p.m.","granularity":"hour","time":"2030/01/01 13:00:00 -0500"},"date":{"end_time":"2011/09/10 00:00:00 -0400","original":"9/9/11","granularity":"day","time":"2011/09/09 00:00:00 -0400"},"description":"Auto burglary","longitude":-122.4133685,"crime type":"Burglary - Vehicle","id":"a6ez66zim261","address":"13th Street and Harrison, San Francisco, CA"},"type":"Feature","geometry":{"type":"Point","coordinates":[-122.4133685,37.7694819]}},{"properties":{"latitude":37.7650543,"time":{"end_time":"2030/01/01 02:11:00 -0500","original":"2:10 a.m.","granularity":"min","time":"2030/01/01 02:10:00 -0500"},"date":{"end_time":"2011/09/10 00:00:00 -0400","original":"9/9/11","granularity":"day","time":"2011/09/09 00:00:00 -0400"},"description":"Robbery, Phone, Gun Simulated","longitude":-122.4196761,"crime type":"Robbery","id":"a6ez66ymrvju","address":"16th Street and Mission, San Francisco, CA"},"type":"Feature","geometry":{"type":"Point","coordinates":[-122.4196761,37.7650543]}},{"properties":{"latitude":37.7618358,"time":{"end_time":"2030/01/01 03:59:00 -0500","original":"3:58 a.m.","granularity":"min","time":"2030/01/01 03:58:00 -0500"},"date":{"end_time":"2011/09/10 00:00:00 -0400","original":"9/9/11","granularity":"day","time":"2011/09/09 00:00:00 -0400"},"description":"Robbery, knife","longitude":-122.4193724,"crime type":"Robbery","id":"a6ez66s4wmi6","address":"18th Street and Mission, San Francisco, CA"},"type":"Feature","geometry":{"type":"Point","coordinates":[-122.4193724,37.7618358]}},{"properties":{"latitude":37.752629,"time":{"end_time":"2030/01/01 10:46:00 -0500","original":"10:45 a.m.","granularity":"min","time":"2030/01/01 10:45:00 -0500"},"date":{"end_time":"2011/09/10 00:00:00 -0400","original":"9/9/11","granularity":"day","time":"2011/09/09 00:00:00 -0400"},"description":"Skil Saw Stolen from bed of pickup","longitude":-122.4119,"crime type":"Theft","id":"a6ez66vwaml6","address":"24th Street and Harrison, San Francisco, CA"},"type":"Feature","geometry":{"type":"Point","coordinates":[-122.4119,37.752629]}},{"properties":{"latitude":37.7649169,"time":{"end_time":"2030/01/01 02:12:00 -0500","original":"2:11 a.m.","granularity":"min","time":"2030/01/01 02:11:00 -0500"},"date":{"end_time":"2011/09/10 00:00:00 -0400","original":"9/9/11","granularity":"day","time":"2011/09/09 00:00:00 -0400"},"description":"Malicious Mischief, Windows","longitude":-122.421886,"crime type":"Vandalism","id":"a6ez6709h73u","address":"16th Street and Valencia, San Francisco, CA"},"type":"Feature","geometry":{"type":"Point","coordinates":[-122.421886,37.7649169]}},{"properties":{"latitude":37.7650543,"time":{"end_time":"2030/01/01 02:46:00 -0500","original":"2:45 a.m.","granularity":"min","time":"2030/01/01 02:45:00 -0500"},"date":{"end_time":"2011/09/11 00:00:00 -0400","original":"9/10/11","granularity":"day","time":"2011/09/10 00:00:00 -0400"},"description":"Aggravated assault, knife","longitude":-122.4196761,"crime type":"Aggravated Assault","id":"a6ez66t0d303","address":"16th Street and Mission, San Francisco, CA"},"type":"Feature","geometry":{"type":"Point","coordinates":[-122.4196761,37.7650543]}},{"properties":{"latitude":37.7651169,"time":{"end_time":"2030/01/01 23:00:00 -0500","original":"10:00 p.m.","granularity":"hour","time":"2030/01/01 22:00:00 -0500"},"date":{"end_time":"2011/09/11 00:00:00 -0400","original":"9/10/11","granularity":"day","time":"2011/09/10 00:00:00 -0400"},"description":"Stolen Auto","longitude":-122.418579,"crime type":"Auto Theft","id":"a6ez66u9o9gy","address":"16th Street and Capp, San Francisco, CA"},"type":"Feature","geometry":{"type":"Point","coordinates":[-122.418579,37.7651169]}},{"properties":{"latitude":37.7604354,"time":{"end_time":"2030/01/02 00:00:00 -0500","original":"11:59 p.m.","granularity":"min","time":"2030/01/01 23:59:00 -0500"},"date":{"end_time":"2011/09/11 00:00:00 -0400","original":"9/10/11","granularity":"day","time":"2011/09/10 00:00:00 -0400"},"description":"Stolen auto","longitude":-122.4109673,"crime type":"Auto Theft","id":"a6ez66ocgtws","address":"19th Street and Florida, San Francisco, CA"},"type":"Feature","geometry":{"type":"Point","coordinates":[-122.4109673,37.7604354]}},{"properties":{"latitude":37.765183,"time":{"end_time":"2030/01/01 01:10:00 -0500","original":"1:09 a.m.","granularity":"min","time":"2030/01/01 01:09:00 -0500"},"date":{"end_time":"2011/09/11 00:00:00 -0400","original":"9/10/11","granularity":"day","time":"2011/09/10 00:00:00 -0400"},"description":"Battery","longitude":-122.417487,"crime type":"Battery","id":"a6ez66xktj03","address":"16th Street and South Van Ness, San Francisco, CA"},"type":"Feature","geometry":{"type":"Point","coordinates":[-122.417487,37.765183]}},{"properties":{"latitude":37.7618358,"time":{"end_time":"2030/01/01 15:16:00 -0500","original":"3:15 p.m.","granularity":"min","time":"2030/01/01 15:15:00 -0500"},"date":{"end_time":"2011/09/11 00:00:00 -0400","original":"9/10/11","granularity":"day","time":"2011/09/10 00:00:00 -0400"},"description":"Battery","longitude":-122.4193724,"crime type":"Battery","id":"a6ez673gfplp","address":"18th Street and Mission, San Francisco, CA"},"type":"Feature","geometry":{"type":"Point","coordinates":[-122.4193724,37.7618358]}},{"properties":{"latitude":37.7666739,"time":{"end_time":"2030/01/01 20:26:00 -0500","original":"8:25 p.m.","granularity":"min","time":"2030/01/01 20:25:00 -0500"},"date":{"end_time":"2011/09/11 00:00:00 -0400","original":"9/10/11","granularity":"day","time":"2011/09/10 00:00:00 -0400"},"description":"Auto burglary","longitude":-122.4198259,"crime type":"Burglary - Vehicle","id":"a6ez671jo9qf","address":"15th Street and Mission, San Francisco, CA"},"type":"Feature","geometry":{"type":"Point","coordinates":[-122.4198259,37.7666739]}},{"properties":{"latitude":37.7522494,"time":{"end_time":"2030/01/01 10:00:00 -0500","original":"9:00 a.m.","granularity":"hour","time":"2030/01/01 09:00:00 -0500"},"date":{"end_time":"2011/09/11 00:00:00 -0400","original":"9/10/11","granularity":"day","time":"2011/09/10 00:00:00 -0400"},"description":"Domestic violence","longitude":-122.4184567,"crime type":"Domestic Violence","id":"a6ez66yklvbt","address":"24th Street and Mission, San Francisco, CA"},"type":"Feature","geometry":{"type":"Point","coordinates":[-122.4184567,37.7522494]}},{"properties":{"latitude":37.7681639,"time":{"end_time":"2030/01/01 10:24:00 -0500","original":"10:23 a.m.","granularity":"min","time":"2030/01/01 10:23:00 -0500"},"date":{"end_time":"2011/09/11 00:00:00 -0400","original":"9/10/11","granularity":"day","time":"2011/09/10 00:00:00 -0400"},"description":"Grand theft, shoptlifting","longitude":-122.4107525,"crime type":"Theft","id":"a6ez670lqa6y","address":"1500 Bryant, San Francisco, CA"},"type":"Feature","geometry":{"type":"Point","coordinates":[-122.4107525,37.7681639]}},{"properties":{"latitude":37.74806,"time":{"end_time":"2030/01/01 12:46:00 -0500","original":"12:45 p.m.","granularity":"min","time":"2030/01/01 12:45:00 -0500"},"date":{"end_time":"2011/09/11 00:00:00 -0400","original":"9/10/11","granularity":"day","time":"2011/09/10 00:00:00 -0400"},"description":"Theft from unlocked vehicle","longitude":-122.4202659,"crime type":"Theft","id":"a6ez670f4zl1","address":"Valencia and Cesar Chavez, San Francisco, CA"},"type":"Feature","geometry":{"type":"Point","coordinates":[-122.4202659,37.74806]}},{"properties":{"latitude":37.7521823,"time":{"end_time":"2030/01/01 16:45:00 -0500","original":"4:44 p.m.","granularity":"min","time":"2030/01/01 16:44:00 -0500"},"date":{"end_time":"2011/09/11 00:00:00 -0400","original":"9/10/11","granularity":"day","time":"2011/09/10 00:00:00 -0400"},"description":"Theft of unattended coin purse","longitude":-122.419546,"crime type":"Theft","id":"a6ez6726if9y","address":"24th Street and Bartlett, San Francisco, CA"},"type":"Feature","geometry":{"type":"Point","coordinates":[-122.419546,37.7521823]}},{"properties":{"latitude":37.7662781,"time":{"end_time":"2030/01/01 23:00:00 -0500","original":"10:00 p.m.","granularity":"hour","time":"2030/01/01 22:00:00 -0500"},"date":{"end_time":"2011/09/11 00:00:00 -0400","original":"9/10/11","granularity":"day","time":"2011/09/10 00:00:00 -0400"},"description":"Theft of wallet by acquaintance","longitude":-122.4264618,"crime type":"Theft","id":"a6ez670m877k","address":"15th Street and Dolores, San Francisco, CA"},"type":"Feature","geometry":{"type":"Point","coordinates":[-122.4264618,37.7662781]}},{"properties":{"latitude":37.7655479,"time":{"end_time":"2030/01/01 13:27:00 -0500","original":"1:26 p.m.","granularity":"min","time":"2030/01/01 13:26:00 -0500"},"date":{"end_time":"2011/09/11 00:00:00 -0400","original":"9/10/11","granularity":"day","time":"2011/09/10 00:00:00 -0400"},"description":"Criminal threats","longitude":-122.411455,"crime type":"Unknown","id":"a6ez670q2diq","address":"16th Street and Florida, San Francisco, CA"},"type":"Feature","geometry":{"type":"Point","coordinates":[-122.411455,37.7655479]}},{"properties":{"latitude":37.7634362,"time":{"end_time":"2030/01/01 17:03:00 -0500","original":"5:02 p.m.","granularity":"min","time":"2030/01/01 17:02:00 -0500"},"date":{"end_time":"2011/09/11 00:00:00 -0400","original":"9/10/11","granularity":"day","time":"2011/09/10 00:00:00 -0400"},"description":"Trespassing, fighting","longitude":-122.4195226,"crime type":"Unknown","id":"a6ez670x00nk","address":"17th Street and Mission, San Francisco, CA"},"type":"Feature","geometry":{"type":"Point","coordinates":[-122.4195226,37.7634362]}},{"properties":{"latitude":37.7618358,"time":{"end_time":"2030/01/01 14:06:00 -0500","original":"2:05 p.m.","granularity":"min","time":"2030/01/01 14:05:00 -0500"},"date":{"end_time":"2011/09/11 00:00:00 -0400","original":"9/10/11","granularity":"day","time":"2011/09/10 00:00:00 -0400"},"description":"Violation of Court Stay-away Order","longitude":-122.4193724,"crime type":"Violation of Court Order","id":"a6ez672kl1ud","address":"18th Street and Mission, San Francisco, CA"},"type":"Feature","geometry":{"type":"Point","coordinates":[-122.4193724,37.7618358]}},{"properties":{"latitude":37.7627621,"time":{"end_time":"2030/01/01 11:31:00 -0500","original":"11:30 a.m.","granularity":"min","time":"2030/01/01 11:30:00 -0500"},"date":{"end_time":"2011/09/12 00:00:00 -0400","original":"9/11/11","granularity":"day","time":"2011/09/11 00:00:00 -0400"},"description":"Auto Theft","longitude":-122.4307496,"crime type":"Auto Theft","id":"a6ez670f3si1","address":"17th Street and Sanchez, San Francisco, CA"},"type":"Feature","geometry":{"type":"Point","coordinates":[-122.4307496,37.7627621]}},{"properties":{"latitude":37.7612889,"time":{"end_time":"2030/01/01 23:46:00 -0500","original":"11:45 p.m.","granularity":"min","time":"2030/01/01 23:45:00 -0500"},"date":{"end_time":"2011/09/12 00:00:00 -0400","original":"9/11/11","granularity":"day","time":"2011/09/11 00:00:00 -0400"},"description":"Battery","longitude":-122.4283998,"crime type":"Battery","id":"a6ez66vn0x4h","address":"18th Street and Church, San Francisco, CA"},"type":"Feature","geometry":{"type":"Point","coordinates":[-122.4283998,37.7612889]}},{"properties":{"latitude":37.7634362,"time":{"end_time":"2030/01/01 18:36:00 -0500","original":"6:35 p.m.","granularity":"min","time":"2030/01/01 18:35:00 -0500"},"date":{"end_time":"2011/09/12 00:00:00 -0400","original":"9/11/11","granularity":"day","time":"2011/09/11 00:00:00 -0400"},"description":"Domestic violence","longitude":-122.4195226,"crime type":"Domestic Violence","id":"a6ez66zgtbla","address":"17th Street and Mission, San Francisco, CA"},"type":"Feature","geometry":{"type":"Point","coordinates":[-122.4195226,37.7634362]}},{"properties":{"latitude":37.7525047,"time":{"end_time":"2030/01/01 05:11:00 -0500","original":"5:10 a.m.","granularity":"min","time":"2030/01/01 05:10:00 -0500"},"date":{"end_time":"2011/09/12 00:00:00 -0400","original":"9/11/11","granularity":"day","time":"2011/09/11 00:00:00 -0400"},"description":"Robbery, knife","longitude":-122.414068,"crime type":"Robbery","id":"a6ez66xrnnlh","address":"24th Street and Folsom, San Francisco, CA"},"type":"Feature","geometry":{"type":"Point","coordinates":[-122.414068,37.7525047]}},{"properties":{"latitude":37.7509364,"time":{"end_time":"2030/01/01 17:31:00 -0500","original":"5:30 p.m.","granularity":"min","time":"2030/01/01 17:30:00 -0500"},"date":{"end_time":"2011/09/12 00:00:00 -0400","original":"9/11/11","granularity":"day","time":"2011/09/11 00:00:00 -0400"},"description":"Robbery","longitude":-122.4133703,"crime type":"Robbery","id":"a6ez66t31o1r","address":"25th Street and Lucky, San Francisco, CA"},"type":"Feature","geometry":{"type":"Point","coordinates":[-122.4133703,37.7509364]}},{"properties":{"latitude":37.7586991,"time":{"end_time":"2030/01/01 23:26:00 -0500","original":"11:25 p.m.","granularity":"min","time":"2030/01/01 23:25:00 -0500"},"date":{"end_time":"2011/09/12 00:00:00 -0400","original":"9/11/11","granularity":"day","time":"2011/09/11 00:00:00 -0400"},"description":"Attempted robbery, pandering","longitude":-122.41798,"crime type":"Robbery","id":"a6ez66ufp0e5","address":"20th Street and Capp, San Francisco, CA"},"type":"Feature","geometry":{"type":"Point","coordinates":[-122.41798,37.7586991]}},{"properties":{"latitude":37.76654,"time":{"end_time":"2030/01/01 02:13:00 -0500","original":"2:12 a.m.","granularity":"min","time":"2030/01/01 02:12:00 -0500"},"date":{"end_time":"2011/09/13 00:00:00 -0400","original":"9/12/11","granularity":"day","time":"2011/09/12 00:00:00 -0400"},"description":"Aggravated assault, force","longitude":-122.422044,"crime type":"Aggravated Assault","id":"a6ez6728gd0z","address":"15th Street and Valencia, San Francisco, CA"},"type":"Feature","geometry":{"type":"Point","coordinates":[-122.422044,37.76654]}},{"properties":{"latitude":37.7620332,"time":{"end_time":"2030/01/01 07:46:00 -0500","original":"7:45 a.m.","granularity":"min","time":"2030/01/01 07:45:00 -0500"},"date":{"end_time":"2011/09/13 00:00:00 -0400","original":"9/12/11","granularity":"day","time":"2011/09/12 00:00:00 -0400"},"description":"Stolen Auto","longitude":-122.4161017,"crime type":"Auto Theft","id":"a6ez673npkas","address":"18th Street and Shotwell, San Francisco, CA"},"type":"Feature","geometry":{"type":"Point","coordinates":[-122.4161017,37.7620332]}},{"properties":{"latitude":37.7642534,"time":{"end_time":"2030/01/01 10:00:00 -0500","original":"9:00 a.m.","granularity":"hour","time":"2030/01/01 09:00:00 -0500"},"date":{"end_time":"2011/09/13 00:00:00 -0400","original":"9/12/11","granularity":"day","time":"2011/09/12 00:00:00 -0400"},"description":"Stolen Auto","longitude":-122.4113277,"crime type":"Auto Theft","id":"a6ez66oalzeq","address":"17th Street and Florida, San Francisco, CA"},"type":"Feature","geometry":{"type":"Point","coordinates":[-122.4113277,37.7642534]}},{"properties":{"latitude":37.7531616,"time":{"end_time":"2030/01/01 19:00:00 -0500","original":"6:00 p.m.","granularity":"hour","time":"2030/01/01 18:00:00 -0500"},"date":{"end_time":"2011/09/13 00:00:00 -0400","original":"9/12/11","granularity":"day","time":"2011/09/12 00:00:00 -0400"},"description":"Burglary","longitude":-122.4298156,"crime type":"Burglary - Home","id":"a6ez66u5dy5x","address":"23rd Street and Sanchez, San Francisco, CA"},"type":"Feature","geometry":{"type":"Point","coordinates":[-122.4298156,37.7531616]}},{"properties":{"latitude":37.7519079,"time":{"end_time":"2030/01/01 07:51:00 -0500","original":"7:50 a.m.","granularity":"min","time":"2030/01/01 07:50:00 -0500"},"date":{"end_time":"2011/09/13 00:00:00 -0400","original":"9/12/11","granularity":"day","time":"2011/09/12 00:00:00 -0400"},"description":"Stolen Motorcycle","longitude":-122.4239868,"crime type":"Motorcycle Theft","id":"a6ez66o8ovs5","address":"24th Street and Fair Oaks, San Francisco, CA"},"type":"Feature","geometry":{"type":"Point","coordinates":[-122.4239868,37.7519079]}},{"properties":{"latitude":37.752907,"time":{"end_time":"2030/01/01 00:21:00 -0500","original":"12:20 a.m.","granularity":"min","time":"2030/01/01 00:20:00 -0500"},"date":{"end_time":"2011/09/13 00:00:00 -0400","original":"9/12/11","granularity":"day","time":"2011/09/12 00:00:00 -0400"},"description":"Robbery - cell phone","longitude":-122.407291,"crime type":"Robbery","id":"a6ez66sv0rbk","address":"24th Street and Hampshire, San Francisco, CA"},"type":"Feature","geometry":{"type":"Point","coordinates":[-122.407291,37.752907]}},{"properties":{"latitude":37.7586991,"time":{"end_time":"2030/01/01 14:46:00 -0500","original":"2:45 p.m.","granularity":"min","time":"2030/01/01 14:45:00 -0500"},"date":{"end_time":"2011/09/13 00:00:00 -0400","original":"9/12/11","granularity":"day","time":"2011/09/12 00:00:00 -0400"},"description":"Grand theft, person","longitude":-122.41798,"crime type":"Theft","id":"a6ez6748a5kq","address":"20th Street and Capp, San Francisco, CA"},"type":"Feature","geometry":{"type":"Point","coordinates":[-122.41798,37.7586991]}},{"properties":{"latitude":37.7650543,"time":{"end_time":"2030/01/01 03:27:00 -0500","original":"3:26 a.m.","granularity":"min","time":"2030/01/01 03:26:00 -0500"},"date":{"end_time":"2011/09/13 00:00:00 -0400","original":"9/12/11","granularity":"day","time":"2011/09/12 00:00:00 -0400"},"description":"Grand theft, purse snatch","longitude":-122.4196761,"crime type":"Theft","id":"a6ez66qjv6ow","address":"16th Street and Mission, San Francisco, CA"},"type":"Feature","geometry":{"type":"Point","coordinates":[-122.4196761,37.7650543]}},{"properties":{"latitude":37.7554415,"time":{"end_time":"2030/01/01 18:42:00 -0500","original":"6:41 p.m.","granularity":"min","time":"2030/01/01 18:41:00 -0500"},"date":{"end_time":"2011/09/13 00:00:00 -0400","original":"9/12/11","granularity":"day","time":"2011/09/12 00:00:00 -0400"},"description":"Petty theft, shoplifting","longitude":-122.4187616,"crime type":"Theft","id":"a6ez66zs9xfk","address":"22nd Street and Mission, San Francisco, CA"},"type":"Feature","geometry":{"type":"Point","coordinates":[-122.4187616,37.7554415]}},{"properties":{"latitude":37.7619356,"time":{"end_time":"2030/01/01 10:16:00 -0500","original":"10:15 a.m.","granularity":"min","time":"2030/01/01 10:15:00 -0500"},"date":{"end_time":"2011/09/13 00:00:00 -0400","original":"9/12/11","granularity":"day","time":"2011/09/12 00:00:00 -0400"},"description":"Criminal threats","longitude":-122.4072485,"crime type":"Unknown","id":"a6ez6717akfl","address":"18th Street and Potrero, San Francisco, CA"},"type":"Feature","geometry":{"type":"Point","coordinates":[-122.4072485,37.7619356]}},{"properties":{"latitude":37.7570986,"time":{"end_time":"2030/01/01 02:31:00 -0500","original":"2:30 a.m.","granularity":"min","time":"2030/01/01 02:30:00 -0500"},"date":{"end_time":"2011/09/13 00:00:00 -0400","original":"9/12/11","granularity":"day","time":"2011/09/12 00:00:00 -0400"},"description":"Malicious mischief, vehicle","longitude":-122.4178225,"crime type":"Vandalism","id":"a6ez673wijre","address":"21st Street and Capp, San Francisco, CA"},"type":"Feature","geometry":{"type":"Point","coordinates":[-122.4178225,37.7570986]}},{"properties":{"latitude":37.7649169,"time":{"end_time":"2030/01/01 00:53:00 -0500","original":"12:52 a.m.","granularity":"min","time":"2030/01/01 00:52:00 -0500"},"date":{"end_time":"2011/09/14 00:00:00 -0400","original":"9/13/11","granularity":"day","time":"2011/09/13 00:00:00 -0400"},"description":"Aggravated assault, knife","longitude":-122.421886,"crime type":"Aggravated Assault","id":"a6ez66w15ehl","address":"16th Street and Valencia, San Francisco, CA"},"type":"Feature","geometry":{"type":"Point","coordinates":[-122.421886,37.7649169]}},{"properties":{"latitude":37.7522494,"time":{"end_time":"2030/01/01 15:31:00 -0500","original":"3:30 p.m.","granularity":"min","time":"2030/01/01 15:30:00 -0500"},"date":{"end_time":"2011/09/14 00:00:00 -0400","original":"9/13/11","granularity":"day","time":"2011/09/13 00:00:00 -0400"},"description":"Possession of Stolen Property","longitude":-122.4184567,"crime type":"Theft","id":"a6ez66qby2dg","address":"24th Street and Mission, San Francisco, CA"},"type":"Feature","geometry":{"type":"Point","coordinates":[-122.4184567,37.7522494]}},{"properties":{"latitude":37.753703,"time":{"end_time":"2030/01/01 18:31:00 -0500","original":"6:30 p.m.","granularity":"min","time":"2030/01/01 18:30:00 -0500"},"date":{"end_time":"2011/09/14 00:00:00 -0400","original":"9/13/11","granularity":"day","time":"2011/09/13 00:00:00 -0400"},"description":"Petty theft, Shoplifting","longitude":-122.420812,"crime type":"Theft","id":"a6ez66xemw6s","address":"23rd Street and Valencia, San Francisco, CA"},"type":"Feature","geometry":{"type":"Point","coordinates":[-122.420812,37.753703]}},{"properties":{"latitude":37.7566263,"time":{"end_time":"2030/01/01 08:46:00 -0500","original":"8:45 a.m.","granularity":"min","time":"2030/01/01 08:45:00 -0500"},"date":{"end_time":"2011/09/15 00:00:00 -0400","original":"9/14/11","granularity":"day","time":"2011/09/14 00:00:00 -0400"},"description":"Stolen Auto","longitude":-122.4256808,"crime type":"Auto Theft","id":"a6ez670f6cwg","address":"21st Street and Dolores, San Francisco, CA"},"type":"Feature","geometry":{"type":"Point","coordinates":[-122.4256808,37.7566263]}},{"properties":{"latitude":37.762158,"time":{"end_time":"2030/01/01 20:00:00 -0500","original":"7:00 p.m.","granularity":"hour","time":"2030/01/01 19:00:00 -0500"},"date":{"end_time":"2011/09/15 00:00:00 -0400","original":"9/14/11","granularity":"day","time":"2011/09/14 00:00:00 -0400"},"description":"Bicycle theft","longitude":-122.4140561,"crime type":"Bicycle Theft","id":"a6ez66yzqeyo","address":"18th Street and Treat, San Francisco, CA"},"type":"Feature","geometry":{"type":"Point","coordinates":[-122.4140561,37.762158]}},{"properties":{"latitude":37.7617009,"time":{"end_time":"2030/01/01 02:34:00 -0500","original":"2:33 a.m.","granularity":"min","time":"2030/01/01 02:33:00 -0500"},"date":{"end_time":"2011/09/15 00:00:00 -0400","original":"9/14/11","granularity":"day","time":"2011/09/14 00:00:00 -0400"},"description":"Burglary,Hot Prowl","longitude":-122.421578,"crime type":"Burglary - Home","id":"a6ez66y4cx9i","address":"18th Street and Valencia, San Francisco, CA"},"type":"Feature","geometry":{"type":"Point","coordinates":[-122.421578,37.7617009]}},{"properties":{"latitude":37.7492383,"time":{"end_time":"2030/01/01 13:05:00 -0500","original":"1:04 p.m.","granularity":"min","time":"2030/01/01 13:04:00 -0500"},"date":{"end_time":"2011/09/15 00:00:00 -0400","original":"9/14/11","granularity":"day","time":"2011/09/14 00:00:00 -0400"},"description":"Attempted burglary","longitude":-122.414869,"crime type":"Burglary - Home","id":"a6ez672dw4g2","address":"26th Street and Shotwell, San Francisco, CA"},"type":"Feature","geometry":{"type":"Point","coordinates":[-122.414869,37.7492383]}},{"properties":{"latitude":37.7489739,"time":{"end_time":"2030/01/01 16:30:00 -0500","original":"4:29 p.m.","granularity":"min","time":"2030/01/01 16:29:00 -0500"},"date":{"end_time":"2011/09/15 00:00:00 -0400","original":"9/14/11","granularity":"day","time":"2011/09/14 00:00:00 -0400"},"description":"Burglary, apartment","longitude":-122.419247,"crime type":"Burglary - Home","id":"a6ez66v0bc9w","address":"26th Street and Bartlett, San Francisco, CA"},"type":"Feature","geometry":{"type":"Point","coordinates":[-122.419247,37.7489739]}},{"properties":{"latitude":37.768016,"time":{"end_time":"2030/01/01 16:51:00 -0500","original":"4:50 p.m.","granularity":"min","time":"2030/01/01 16:50:00 -0500"},"date":{"end_time":"2011/09/15 00:00:00 -0400","original":"9/14/11","granularity":"day","time":"2011/09/14 00:00:00 -0400"},"description":"Burglary, apartment","longitude":-122.4243503,"crime type":"Burglary - Home","id":"a6ez66oi79ub","address":"14th Street and Guerrero, San Francisco, CA"},"type":"Feature","geometry":{"type":"Point","coordinates":[-122.4243503,37.768016]}},{"properties":{"latitude":37.7543388,"time":{"end_time":"2030/01/01 09:46:00 -0500","original":"9:45 a.m.","granularity":"min","time":"2030/01/01 09:45:00 -0500"},"date":{"end_time":"2011/09/15 00:00:00 -0400","original":"9/14/11","granularity":"day","time":"2011/09/14 00:00:00 -0400"},"description":"Auto burglary","longitude":-122.4102306,"crime type":"Burglary - Vehicle","id":"a6ez66qer9ka","address":"23rd Street and Florida, San Francisco, CA"},"type":"Feature","geometry":{"type":"Point","coordinates":[-122.4102306,37.7543388]}},{"properties":{"latitude":37.7612889,"time":{"end_time":"2030/01/01 20:00:00 -0500","original":"7:00 p.m.","granularity":"hour","time":"2030/01/01 19:00:00 -0500"},"date":{"end_time":"2011/09/15 00:00:00 -0400","original":"9/14/11","granularity":"day","time":"2011/09/14 00:00:00 -0400"},"description":"Auto burglary","longitude":-122.4283998,"crime type":"Burglary - Vehicle","id":"a6ez66ygcgnn","address":"18th Street and Church, San Francisco, CA"},"type":"Feature","geometry":{"type":"Point","coordinates":[-122.4283998,37.7612889]}},{"properties":{"latitude":37.7649169,"time":{"end_time":"2030/01/01 01:21:00 -0500","original":"1:20 a.m.","granularity":"min","time":"2030/01/01 01:20:00 -0500"},"date":{"end_time":"2011/09/15 00:00:00 -0400","original":"9/14/11","granularity":"day","time":"2011/09/14 00:00:00 -0400"},"description":"Petty theft, tip jar","longitude":-122.421886,"crime type":"Theft","id":"a6ez66q7i74v","address":"16th Street and Valencia, San Francisco, CA"},"type":"Feature","geometry":{"type":"Point","coordinates":[-122.421886,37.7649169]}},{"properties":{"latitude":37.764755,"time":{"end_time":"2030/01/01 14:16:00 -0500","original":"2:15 p.m.","granularity":"min","time":"2030/01/01 14:15:00 -0500"},"date":{"end_time":"2011/09/15 00:00:00 -0400","original":"9/14/11","granularity":"day","time":"2011/09/14 00:00:00 -0400"},"description":"Theft of unattended purse","longitude":-122.424574,"crime type":"Theft","id":"a6ez66t4nl4a","address":"16th Street and Spencer, San Francisco, CA"},"type":"Feature","geometry":{"type":"Point","coordinates":[-122.424574,37.764755]}},{"properties":{"latitude":37.753845,"time":{"end_time":"2030/01/01 22:30:00 -0500","original":"10:29 p.m.","granularity":"min","time":"2030/01/01 22:29:00 -0500"},"date":{"end_time":"2011/09/15 00:00:00 -0400","original":"9/14/11","granularity":"day","time":"2011/09/14 00:00:00 -0400"},"description":"Petty theft, shoplifting","longitude":-122.4186025,"crime type":"Theft","id":"a6ez66siou1y","address":"23rd Street and Mission, San Francisco, CA"},"type":"Feature","geometry":{"type":"Point","coordinates":[-122.4186025,37.753845]}},{"properties":{"latitude":37.7491151,"time":{"end_time":"2030/01/01 10:53:00 -0500","original":"10:52 a.m.","granularity":"min","time":"2030/01/01 10:52:00 -0500"},"date":{"end_time":"2011/09/16 00:00:00 -0400","original":"9/15/11","granularity":"day","time":"2011/09/15 00:00:00 -0400"},"description":"Civil sidewalks written warning","longitude":-122.4170407,"crime type":"Civil Sidewalks","id":"a6ez670qn672","address":"26th Street and Capp, San Francisco, CA"},"type":"Feature","geometry":{"type":"Point","coordinates":[-122.4170407,37.7491151]}},{"properties":{"latitude":37.750771,"time":{"end_time":"2030/01/01 02:20:00 -0500","original":"2:19 a.m.","granularity":"min","time":"2030/01/01 02:19:00 -0500"},"date":{"end_time":"2011/09/16 00:00:00 -0400","original":"9/15/11","granularity":"day","time":"2011/09/15 00:00:00 -0400"},"description":"Investigative detention","longitude":-122.4161173,"crime type":"Unknown","id":"a6ez66wo17k3","address":"25th Street and South Van Ness, San Francisco, CA"},"type":"Feature","geometry":{"type":"Point","coordinates":[-122.4161173,37.750771]}},{"properties":{"latitude":37.76431,"time":{"end_time":"2030/01/01 23:16:00 -0500","original":"11:15 p.m.","granularity":"min","time":"2030/01/01 23:15:00 -0500"},"date":{"end_time":"2011/09/17 00:00:00 -0400","original":"9/16/11","granularity":"day","time":"2011/09/16 00:00:00 -0400"},"description":"Auto burglary","longitude":-122.410364,"crime type":"Burglary - Vehicle","id":"a6ez66uuyvhv","address":"17th Street and Bryant, San Francisco, CA"},"type":"Feature","geometry":{"type":"Point","coordinates":[-122.410364,37.76431]}},{"properties":{"latitude":37.7519696,"time":{"end_time":"2030/01/01 14:11:00 -0500","original":"2:10 p.m.","granularity":"min","time":"2030/01/01 14:10:00 -0500"},"date":{"end_time":"2011/09/17 00:00:00 -0400","original":"9/16/11","granularity":"day","time":"2011/09/16 00:00:00 -0400"},"description":"Robbery, force","longitude":-122.42294,"crime type":"Robbery","id":"a6ez670amnwo","address":"24th Street and Guerrero, San Francisco, CA"},"type":"Feature","geometry":{"type":"Point","coordinates":[-122.42294,37.7519696]}},{"properties":{"latitude":37.7560022,"time":{"end_time":"2030/01/01 09:00:00 -0500","original":"8:00 a.m.","granularity":"hour","time":"2030/01/01 08:00:00 -0500"},"date":{"end_time":"2011/09/17 00:00:00 -0400","original":"9/16/11","granularity":"day","time":"2011/09/16 00:00:00 -0400"},"description":"Stolen laptop","longitude":-122.4094673,"crime type":"Theft","id":"a6ez673exbv2","address":"22nd Street and Bryant, San Francisco, CA"},"type":"Feature","geometry":{"type":"Point","coordinates":[-122.4094673,37.7560022]}},{"properties":{"latitude":37.7650543,"time":{"end_time":"2030/01/01 15:41:00 -0500","original":"3:40 p.m.","granularity":"min","time":"2030/01/01 15:40:00 -0500"},"date":{"end_time":"2011/09/17 00:00:00 -0400","original":"9/16/11","granularity":"day","time":"2011/09/16 00:00:00 -0400"},"description":"Criminal threats","longitude":-122.4196761,"crime type":"Unknown","id":"a6ez66prmg7l","address":"16th Street and Mission, San Francisco, CA"},"type":"Feature","geometry":{"type":"Point","coordinates":[-122.4196761,37.7650543]}},{"properties":{"latitude":37.7539738,"time":{"end_time":"2030/01/01 09:25:00 -0500","original":"9:24 a.m.","granularity":"min","time":"2030/01/01 09:24:00 -0500"},"date":{"end_time":"2011/09/17 00:00:00 -0400","original":"9/16/11","granularity":"day","time":"2011/09/16 00:00:00 -0400"},"description":"Malicoius mischief, vehicle","longitude":-122.4164228,"crime type":"Vandalism","id":"a6ez66wox5fy","address":"23rd Street and South Van Ness, San Francisco, CA"},"type":"Feature","geometry":{"type":"Point","coordinates":[-122.4164228,37.7539738]}},{"properties":{"latitude":37.754165,"time":{"end_time":"2030/01/01 09:16:00 -0500","original":"9:15 a.m.","granularity":"min","time":"2030/01/01 09:15:00 -0500"},"date":{"end_time":"2011/09/18 00:00:00 -0400","original":"9/17/11","granularity":"day","time":"2011/09/17 00:00:00 -0400"},"description":"Auto burglary","longitude":-122.413141,"crime type":"Burglary - Vehicle","id":"a6ez672ggzdb","address":"23rd Steet and Treat, San Francisco, CA"},"type":"Feature","geometry":{"type":"Point","coordinates":[-122.413141,37.754165]}},{"properties":{"latitude":37.7617009,"time":{"end_time":"2030/01/01 02:31:00 -0500","original":"2:30 a.m.","granularity":"min","time":"2030/01/01 02:30:00 -0500"},"date":{"end_time":"2011/09/18 00:00:00 -0400","original":"9/17/11","granularity":"day","time":"2011/09/17 00:00:00 -0400"},"description":"Disturbing the peace, fighting","longitude":-122.421578,"crime type":"Disturbing the Peace","id":"a6ez6724hyob","address":"18th Street and Valencia, San Francisco, CA"},"type":"Feature","geometry":{"type":"Point","coordinates":[-122.421578,37.7617009]}},{"properties":{"latitude":37.757298,"time":{"end_time":"2030/01/01 00:55:00 -0500","original":"12:54 a.m.","granularity":"min","time":"2030/01/01 00:54:00 -0500"},"date":{"end_time":"2011/09/18 00:00:00 -0400","original":"9/17/11","granularity":"day","time":"2011/09/17 00:00:00 -0400"},"description":"Robbery, force","longitude":-122.414541,"crime type":"Robbery","id":"a6ez66o7nccx","address":"21st Street and Folsom, San Francisco, CA"},"type":"Feature","geometry":{"type":"Point","coordinates":[-122.414541,37.757298]}},{"properties":{"latitude":37.7522494,"time":{"end_time":"2030/01/01 11:00:00 -0500","original":"10:00 a.m.","granularity":"hour","time":"2030/01/01 10:00:00 -0500"},"date":{"end_time":"2011/09/18 00:00:00 -0400","original":"9/17/11","granularity":"day","time":"2011/09/17 00:00:00 -0400"},"description":"Robbery of a smoothie","longitude":-122.4184567,"crime type":"Robbery","id":"a6ez672shvx2","address":"24th Street and Mission, San Francisco, CA"},"type":"Feature","geometry":{"type":"Point","coordinates":[-122.4184567,37.7522494]}},{"properties":{"latitude":37.757298,"time":{"end_time":"2030/01/01 20:56:00 -0500","original":"8:55 p.m.","granularity":"min","time":"2030/01/01 20:55:00 -0500"},"date":{"end_time":"2011/09/18 00:00:00 -0400","original":"9/17/11","granularity":"day","time":"2011/09/17 00:00:00 -0400"},"description":"Attempted robbery","longitude":-122.414541,"crime type":"Robbery","id":"a6ez66xymmfn","address":"21st Street and Folsom, San Francisco, CA"},"type":"Feature","geometry":{"type":"Point","coordinates":[-122.414541,37.757298]}},{"properties":{"latitude":37.7602375,"time":{"end_time":"2030/01/01 00:02:00 -0500","original":"12:01 a.m.","granularity":"min","time":"2030/01/01 00:01:00 -0500"},"date":{"end_time":"2011/09/18 00:00:00 -0400","original":"9/17/11","granularity":"day","time":"2011/09/17 00:00:00 -0400"},"description":"Theft of unattended purse in bar","longitude":-122.4192191,"crime type":"Theft","id":"a6ez66tzxvha","address":"19th Street and Mission, San Francisco, CA"},"type":"Feature","geometry":{"type":"Point","coordinates":[-122.4192191,37.7602375]}},{"properties":{"latitude":37.7660378,"time":{"end_time":"2030/01/01 20:46:00 -0500","original":"8:45 p.m.","granularity":"min","time":"2030/01/01 20:45:00 -0500"},"date":{"end_time":"2011/09/18 00:00:00 -0400","original":"9/17/11","granularity":"day","time":"2011/09/17 00:00:00 -0400"},"description":"Theft of unattended purse","longitude":-122.4306933,"crime type":"Theft","id":"a6ez670hbejf","address":"15th Street and Market, San Francisco, CA"},"type":"Feature","geometry":{"type":"Point","coordinates":[-122.4306933,37.7660378]}},{"properties":{"latitude":37.7597548,"time":{"end_time":"2030/01/01 18:52:00 -0500","original":"6:51 p.m.","granularity":"min","time":"2030/01/01 18:51:00 -0500"},"date":{"end_time":"2011/09/18 00:00:00 -0400","original":"9/17/11","granularity":"day","time":"2011/09/17 00:00:00 -0400"},"description":"Dog bite","longitude":-122.4270638,"crime type":"Unknown","id":"a6ez66wklevo","address":"Dolores Park, San Francisco, CA"},"type":"Feature","geometry":{"type":"Point","coordinates":[-122.4270638,37.7597548]}},{"properties":{"latitude":37.7649169,"time":{"end_time":"2030/01/01 23:00:00 -0500","original":"10:00 p.m.","granularity":"hour","time":"2030/01/01 22:00:00 -0500"},"date":{"end_time":"2011/09/18 00:00:00 -0400","original":"9/17/11","granularity":"day","time":"2011/09/17 00:00:00 -0400"},"description":"Malicious mischief, vehicle","longitude":-122.421886,"crime type":"Vandalism","id":"a6ez66ofw07s","address":"16th Street and Valencia, San Francisco, CA"},"type":"Feature","geometry":{"type":"Point","coordinates":[-122.421886,37.7649169]}},{"properties":{"latitude":37.7522494,"time":{"end_time":"2030/01/01 13:11:00 -0500","original":"1:10 p.m.","granularity":"min","time":"2030/01/01 13:10:00 -0500"},"date":{"end_time":"2011/09/19 00:00:00 -0400","original":"9/18/11","granularity":"day","time":"2011/09/18 00:00:00 -0400"},"description":"Aggravated assault, force","longitude":-122.4184567,"crime type":"Aggravated Assault","id":"a6ez66tax6i4","address":"24th Street and Mission, San Francisco, CA"},"type":"Feature","geometry":{"type":"Point","coordinates":[-122.4184567,37.7522494]}},{"properties":{"latitude":37.7599661,"time":{"end_time":"2030/01/01 07:31:00 -0500","original":"7:30 a.m.","granularity":"min","time":"2030/01/01 07:30:00 -0500"},"date":{"end_time":"2011/09/19 00:00:00 -0400","original":"9/18/11","granularity":"day","time":"2011/09/18 00:00:00 -0400"},"description":"Stolen Auto","longitude":-122.4236983,"crime type":"Auto Theft","id":"a6ez66to2opn","address":"19th Street and Guerrero, San Francisco, CA"},"type":"Feature","geometry":{"type":"Point","coordinates":[-122.4236983,37.7599661]}},{"properties":{"latitude":37.7540389,"time":{"end_time":"2030/01/01 12:16:00 -0500","original":"12:15 p.m.","granularity":"min","time":"2030/01/01 12:15:00 -0500"},"date":{"end_time":"2011/09/19 00:00:00 -0400","original":"9/18/11","granularity":"day","time":"2011/09/18 00:00:00 -0400"},"description":"Battery","longitude":-122.41532,"crime type":"Battery","id":"a6ez672p01m5","address":"23rd Street and Shotwell, San Francisco, CA"},"type":"Feature","geometry":{"type":"Point","coordinates":[-122.41532,37.7540389]}},{"properties":{"latitude":37.7634959,"time":{"end_time":"2030/01/01 04:00:00 -0500","original":"3:00 a.m.","granularity":"hour","time":"2030/01/01 03:00:00 -0500"},"date":{"end_time":"2011/09/19 00:00:00 -0400","original":"9/18/11","granularity":"day","time":"2011/09/18 00:00:00 -0400"},"description":"Bicycle theft","longitude":-122.418484,"crime type":"Bicycle Theft","id":"a6ez673cdfci","address":"17th Street and Capp, San Francisco, CA"},"type":"Feature","geometry":{"type":"Point","coordinates":[-122.418484,37.7634959]}},{"properties":{"latitude":37.7586337,"time":{"end_time":"2030/01/01 16:31:00 -0500","original":"4:30 p.m.","granularity":"min","time":"2030/01/01 16:30:00 -0500"},"date":{"end_time":"2011/09/19 00:00:00 -0400","original":"9/18/11","granularity":"day","time":"2011/09/18 00:00:00 -0400"},"description":"Bicycle theft","longitude":-122.4190627,"crime type":"Bicycle Theft","id":"a6ez66rabbvo","address":"20th Street and Mission, San Francisco, CA"},"type":"Feature","geometry":{"type":"Point","coordinates":[-122.4190627,37.7586337]}},{"properties":{"latitude":37.7570986,"time":{"end_time":"2030/01/01 04:31:00 -0500","original":"4:30 a.m.","granularity":"min","time":"2030/01/01 04:30:00 -0500"},"date":{"end_time":"2011/09/19 00:00:00 -0400","original":"9/18/11","granularity":"day","time":"2011/09/18 00:00:00 -0400"},"description":"Auto burglary","longitude":-122.4178225,"crime type":"Burglary - Vehicle","id":"a6ez66s0vohf","address":"21st Street and Capp, San Francisco, CA"},"type":"Feature","geometry":{"type":"Point","coordinates":[-122.4178225,37.7570986]}},{"properties":{"latitude":37.7634362,"time":{"end_time":"2030/01/01 07:50:00 -0500","original":"7:49 a.m.","granularity":"min","time":"2030/01/01 07:49:00 -0500"},"date":{"end_time":"2011/09/19 00:00:00 -0400","original":"9/18/11","granularity":"day","time":"2011/09/18 00:00:00 -0400"},"description":"Domestic violence","longitude":-122.4195226,"crime type":"Domestic Violence","id":"a6ez66zrm4as","address":"17th Street and Mission, San Francisco, CA"},"type":"Feature","geometry":{"type":"Point","coordinates":[-122.4195226,37.7634362]}},{"properties":{"latitude":37.7484894,"time":{"end_time":"2030/01/01 10:31:00 -0500","original":"10:30 a.m.","granularity":"min","time":"2030/01/01 10:30:00 -0500"},"date":{"end_time":"2011/09/19 00:00:00 -0400","original":"9/18/11","granularity":"day","time":"2011/09/18 00:00:00 -0400"},"description":"Stolen Motorcycle","longitude":-122.4077793,"crime type":"Motorcycle Theft","id":"a6ez674ivrwb","address":"York Street and Cesar Chavez, San Francisco, CA"},"type":"Feature","geometry":{"type":"Point","coordinates":[-122.4077793,37.7484894]}},{"properties":{"latitude":37.7634362,"time":{"end_time":"2030/01/01 02:00:00 -0500","original":"1:00 a.m.","granularity":"hour","time":"2030/01/01 01:00:00 -0500"},"date":{"end_time":"2011/09/19 00:00:00 -0400","original":"9/18/11","granularity":"day","time":"2011/09/18 00:00:00 -0400"},"description":"Robbery, knife","longitude":-122.4195226,"crime type":"Robbery","id":"a6ez66vsub6k","address":"17th Street and Mission, San Francisco, CA"},"type":"Feature","geometry":{"type":"Point","coordinates":[-122.4195226,37.7634362]}},{"properties":{"latitude":37.7654522,"time":{"end_time":"2030/01/01 02:56:00 -0500","original":"2:55 a.m.","granularity":"min","time":"2030/01/01 02:55:00 -0500"},"date":{"end_time":"2011/09/19 00:00:00 -0400","original":"9/18/11","granularity":"day","time":"2011/09/18 00:00:00 -0400"},"description":"Malicious Mischief, graffiti","longitude":-122.4131332,"crime type":"Vandalism","id":"a6ez66wjnzfb","address":"16th Street and Harrison, San Francisco, CA"},"type":"Feature","geometry":{"type":"Point","coordinates":[-122.4131332,37.7654522]}},{"properties":{"latitude":37.768016,"time":{"end_time":"2030/01/01 19:28:00 -0500","original":"7:27 p.m.","granularity":"min","time":"2030/01/01 19:27:00 -0500"},"date":{"end_time":"2011/09/20 00:00:00 -0400","original":"9/19/11","granularity":"day","time":"2011/09/19 00:00:00 -0400"},"description":"Aggravated assault, gun","longitude":-122.4243503,"crime type":"Aggravated Assault","id":"a6ez66ygc28r","address":"14th Street and Guerrero, San Francisco, CA"},"type":"Feature","geometry":{"type":"Point","coordinates":[-122.4243503,37.768016]}},{"properties":{"latitude":37.7749295,"time":{"end_time":"2030/01/01 09:00:00 -0500","original":"8:00 a.m.","granularity":"hour","time":"2030/01/01 08:00:00 -0500"},"date":{"end_time":"2011/09/20 00:00:00 -0400","original":"9/19/11","granularity":"day","time":"2011/09/19 00:00:00 -0400"},"description":"Stolen Auto","longitude":-122.4194155,"crime type":"Auto Theft","id":"a6ez66ttgadx","address":"23rd Street and San Jose, San Francisco, CA"},"type":"Feature","geometry":{"type":"Point","coordinates":[-122.4194155,37.7749295]}},{"properties":{"latitude":37.7569019,"time":{"end_time":"2030/01/01 12:41:00 -0500","original":"12:40 p.m.","granularity":"min","time":"2030/01/01 12:40:00 -0500"},"date":{"end_time":"2011/09/20 00:00:00 -0400","original":"9/19/11","granularity":"day","time":"2011/09/19 00:00:00 -0400"},"description":"Stolen Auto","longitude":-122.421118,"crime type":"Auto Theft","id":"a6ez66zpas3s","address":"21st Street and Valencia, San Francisco, CA"},"type":"Feature","geometry":{"type":"Point","coordinates":[-122.421118,37.7569019]}},{"properties":{"latitude":37.76654,"time":{"end_time":"2030/01/01 11:14:00 -0500","original":"11:13 a.m.","granularity":"min","time":"2030/01/01 11:13:00 -0500"},"date":{"end_time":"2011/09/20 00:00:00 -0400","original":"9/19/11","granularity":"day","time":"2011/09/19 00:00:00 -0400"},"description":"Criminal threats","longitude":-122.422044,"crime type":"Unknown","id":"a6ez673wrr3n","address":"15th Street and Valencia, San Francisco, CA"},"type":"Feature","geometry":{"type":"Point","coordinates":[-122.422044,37.76654]}},{"properties":{"latitude":37.7633,"time":{"end_time":"2030/01/01 21:11:00 -0500","original":"9:10 p.m.","granularity":"min","time":"2030/01/01 21:10:00 -0500"},"date":{"end_time":"2011/09/20 00:00:00 -0400","original":"9/19/11","granularity":"day","time":"2011/09/19 00:00:00 -0400"},"description":"Criminal threats","longitude":-122.421732,"crime type":"Unknown","id":"a6ez66st0gbr","address":"17th Street and Valencia, San Francisco, CA"},"type":"Feature","geometry":{"type":"Point","coordinates":[-122.421732,37.7633]}},{"properties":{"latitude":37.757298,"time":{"end_time":"2030/01/01 17:31:00 -0500","original":"5:30 p.m.","granularity":"min","time":"2030/01/01 17:30:00 -0500"},"date":{"end_time":"2011/09/21 00:00:00 -0400","original":"9/20/11","granularity":"day","time":"2011/09/20 00:00:00 -0400"},"description":"Burglary of garage","longitude":-122.414541,"crime type":"Burglary - Home","id":"a6ez66phehku","address":"21st Street and Folsom, San Francisco, CA"},"type":"Feature","geometry":{"type":"Point","coordinates":[-122.414541,37.757298]}},{"properties":{"latitude":37.7633,"time":{"end_time":"2030/01/01 20:41:00 -0500","original":"8:40 p.m.","granularity":"min","time":"2030/01/01 20:40:00 -0500"},"date":{"end_time":"2011/09/21 00:00:00 -0400","original":"9/20/11","granularity":"day","time":"2011/09/20 00:00:00 -0400"},"description":"Auto burglary","longitude":-122.421732,"crime type":"Burglary - Vehicle","id":"a6ez674ddedc","address":"17th Street and Valencia, San Francisco, CA"},"type":"Feature","geometry":{"type":"Point","coordinates":[-122.421732,37.7633]}},{"properties":{"latitude":37.753776,"time":{"end_time":"2030/01/01 20:41:00 -0500","original":"8:40 p.m.","granularity":"min","time":"2030/01/01 20:40:00 -0500"},"date":{"end_time":"2011/09/21 00:00:00 -0400","original":"9/20/11","granularity":"day","time":"2011/09/20 00:00:00 -0400"},"description":"Auto burglary","longitude":-122.4197059,"crime type":"Burglary - Vehicle","id":"a6ez670e2tj0","address":"23rd Street and Bartlett, San Francisco, CA"},"type":"Feature","geometry":{"type":"Point","coordinates":[-122.4197059,37.753776]}},{"properties":{"latitude":37.7522494,"time":{"end_time":"2030/01/01 23:06:00 -0500","original":"11:05 p.m.","granularity":"min","time":"2030/01/01 23:05:00 -0500"},"date":{"end_time":"2011/09/21 00:00:00 -0400","original":"9/20/11","granularity":"day","time":"2011/09/20 00:00:00 -0400"},"description":"Robbery, restaurant","longitude":-122.4184567,"crime type":"Robbery","id":"a6ez6730ut8n","address":"24th Street and Mission, San Francisco, CA"},"type":"Feature","geometry":{"type":"Point","coordinates":[-122.4184567,37.7522494]}},{"properties":{"latitude":37.7602375,"time":{"end_time":"2030/01/01 00:16:00 -0500","original":"12:15 a.m.","granularity":"min","time":"2030/01/01 00:15:00 -0500"},"date":{"end_time":"2011/09/21 00:00:00 -0400","original":"9/20/11","granularity":"day","time":"2011/09/20 00:00:00 -0400"},"description":"Theft of unattended laptop in bar","longitude":-122.4192191,"crime type":"Theft","id":"a6ez672epetc","address":"19th Street and Mission, San Francisco, CA"},"type":"Feature","geometry":{"type":"Point","coordinates":[-122.4192191,37.7602375]}},{"properties":{"latitude":37.76654,"time":{"end_time":"2030/01/01 08:21:00 -0500","original":"8:20 a.m.","granularity":"min","time":"2030/01/01 08:20:00 -0500"},"date":{"end_time":"2011/09/21 00:00:00 -0400","original":"9/20/11","granularity":"day","time":"2011/09/20 00:00:00 -0400"},"description":"Criminal threats","longitude":-122.422044,"crime type":"Unknown","id":"a6ez66xfv99q","address":"15th Street and Valencia, San Francisco, CA"},"type":"Feature","geometry":{"type":"Point","coordinates":[-122.422044,37.76654]}},{"properties":{"latitude":37.7570986,"time":{"end_time":"2030/01/01 21:31:00 -0500","original":"9:30 p.m.","granularity":"min","time":"2030/01/01 21:30:00 -0500"},"date":{"end_time":"2011/09/21 00:00:00 -0400","original":"9/20/11","granularity":"day","time":"2011/09/20 00:00:00 -0400"},"description":"Malicious mischief, bb gun","longitude":-122.4178225,"crime type":"Unknown","id":"a6ez670znvcq","address":"21st Street and Capp, San Francisco, CA"},"type":"Feature","geometry":{"type":"Point","coordinates":[-122.4178225,37.7570986]}},{"properties":{"latitude":37.7599661,"time":{"end_time":"2030/01/01 15:31:00 -0500","original":"3:30 p.m.","granularity":"min","time":"2030/01/01 15:30:00 -0500"},"date":{"end_time":"2011/09/21 00:00:00 -0400","original":"9/20/11","granularity":"day","time":"2011/09/20 00:00:00 -0400"},"description":"Malicious mischief","longitude":-122.4236983,"crime type":"Vandalism","id":"a6ez66u4owrm","address":"19th Street and Guerrero, San Francisco, CA"},"type":"Feature","geometry":{"type":"Point","coordinates":[-122.4236983,37.7599661]}},{"properties":{"latitude":37.7603666,"time":{"end_time":"2030/01/01 16:51:00 -0500","original":"4:50 p.m.","granularity":"min","time":"2030/01/01 16:50:00 -0500"},"date":{"end_time":"2011/09/22 00:00:00 -0400","original":"9/21/11","granularity":"day","time":"2011/09/21 00:00:00 -0400"},"description":"Aggravated assault","longitude":-122.417033,"crime type":"Aggravated Assault","id":"a6ez6730f6lo","address":"19th Street and South Van Ness, San Francisco, CA"},"type":"Feature","geometry":{"type":"Point","coordinates":[-122.417033,37.7603666]}},{"properties":{"latitude":37.75244,"time":{"end_time":"2030/01/01 00:09:00 -0500","original":"12:08 a.m.","granularity":"min","time":"2030/01/01 00:08:00 -0500"},"date":{"end_time":"2011/09/22 00:00:00 -0400","original":"9/21/11","granularity":"day","time":"2011/09/21 00:00:00 -0400"},"description":"Sale of alcohol to a minor","longitude":-122.415172,"crime type":"Alcohol","id":"a6ez66ttn8vw","address":"24th Street and Shotwell, San Francisco, CA"},"type":"Feature","geometry":{"type":"Point","coordinates":[-122.415172,37.75244]}},{"properties":{"latitude":37.74806,"time":{"end_time":"2030/01/01 22:00:00 -0500","original":"9:00 p.m.","granularity":"hour","time":"2030/01/01 21:00:00 -0500"},"date":{"end_time":"2011/09/22 00:00:00 -0400","original":"9/21/11","granularity":"day","time":"2011/09/21 00:00:00 -0400"},"description":"Stolen Auto","longitude":-122.4202659,"crime type":"Auto Theft","id":"a6ez66yghvzo","address":"Valencia Street and Cesar Chavez, San Francisco, CA"},"type":"Feature","geometry":{"type":"Point","coordinates":[-122.4202659,37.74806]}},{"properties":{"latitude":37.753776,"time":{"end_time":"2030/01/01 15:33:00 -0500","original":"3:32 p.m.","granularity":"min","time":"2030/01/01 15:32:00 -0500"},"date":{"end_time":"2011/09/22 00:00:00 -0400","original":"9/21/11","granularity":"day","time":"2011/09/21 00:00:00 -0400"},"description":"Bicycle theft","longitude":-122.4197059,"crime type":"Bicycle Theft","id":"a6ez66u514my","address":"23rd Street and Bartlett, San Francisco, CA"},"type":"Feature","geometry":{"type":"Point","coordinates":[-122.4197059,37.753776]}},{"properties":{"latitude":37.757233,"time":{"end_time":"2030/01/01 22:48:00 -0500","original":"10:47 p.m.","granularity":"min","time":"2030/01/01 22:47:00 -0500"},"date":{"end_time":"2011/09/22 00:00:00 -0400","original":"9/21/11","granularity":"day","time":"2011/09/21 00:00:00 -0400"},"description":"Burglary, Non-residential","longitude":-122.4156458,"crime type":"Burglary - Commercial","id":"a6ez66yhwhp1","address":"21st Street and Shotwell, San Francisco, CA"},"type":"Feature","geometry":{"type":"Point","coordinates":[-122.4156458,37.757233]}},{"properties":{"latitude":37.75423,"time":{"end_time":"2030/01/01 06:21:00 -0500","original":"6:20 a.m.","granularity":"min","time":"2030/01/01 06:20:00 -0500"},"date":{"end_time":"2011/09/22 00:00:00 -0400","original":"9/21/11","granularity":"day","time":"2011/09/21 00:00:00 -0400"},"description":"Auto burglary","longitude":-122.412047,"crime type":"Burglary - Vehicle","id":"a6ez66uwemla","address":"23rd Street and Harrison, San Francisco, CA"},"type":"Feature","geometry":{"type":"Point","coordinates":[-122.412047,37.75423]}},{"properties":{"latitude":37.757298,"time":{"end_time":"2030/01/01 09:31:00 -0500","original":"9:30 a.m.","granularity":"min","time":"2030/01/01 09:30:00 -0500"},"date":{"end_time":"2011/09/22 00:00:00 -0400","original":"9/21/11","granularity":"day","time":"2011/09/21 00:00:00 -0400"},"description":"Auto burglary","longitude":-122.414541,"crime type":"Burglary - Vehicle","id":"a6ez671do4zv","address":"21st Street and Folsom, San Francisco, CA"},"type":"Feature","geometry":{"type":"Point","coordinates":[-122.414541,37.757298]}},{"properties":{"latitude":37.764977,"time":{"end_time":"2030/01/01 02:00:00 -0500","original":"1:00 a.m.","granularity":"hour","time":"2030/01/01 01:00:00 -0500"},"date":{"end_time":"2011/09/22 00:00:00 -0400","original":"9/21/11","granularity":"day","time":"2011/09/21 00:00:00 -0400"},"description":"Auto burglary","longitude":-122.420901,"crime type":"Burglary - Vehicle","id":"a6ez670ejhzr","address":"16th Street and Julian, San Francisco, CA"},"type":"Feature","geometry":{"type":"Point","coordinates":[-122.420901,37.764977]}},{"properties":{"latitude":37.760429,"time":{"end_time":"2030/01/01 16:00:00 -0500","original":"3:00 p.m.","granularity":"hour","time":"2030/01/01 15:00:00 -0500"},"date":{"end_time":"2011/09/22 00:00:00 -0400","original":"9/21/11","granularity":"day","time":"2011/09/21 00:00:00 -0400"},"description":"Auto burglary","longitude":-122.4159465,"crime type":"Burglary - Vehicle","id":"a6ez66v0u0ne","address":"19th Street and Shotwell, San Francisco, CA"},"type":"Feature","geometry":{"type":"Point","coordinates":[-122.4159465,37.760429]}},{"properties":{"latitude":37.7634362,"time":{"end_time":"2030/01/01 17:36:00 -0500","original":"5:35 p.m.","granularity":"min","time":"2030/01/01 17:35:00 -0500"},"date":{"end_time":"2011/09/22 00:00:00 -0400","original":"9/21/11","granularity":"day","time":"2011/09/21 00:00:00 -0400"},"description":"Domestic violence","longitude":-122.4195226,"crime type":"Domestic Violence","id":"a6ez66vt52v7","address":"17th Street and Mission, San Francisco, CA"},"type":"Feature","geometry":{"type":"Point","coordinates":[-122.4195226,37.7634362]}},{"properties":{"latitude":37.7682114,"time":{"end_time":"2030/01/01 09:16:00 -0500","original":"9:15 a.m.","granularity":"min","time":"2030/01/01 09:15:00 -0500"},"date":{"end_time":"2011/09/22 00:00:00 -0400","original":"9/21/11","granularity":"day","time":"2011/09/21 00:00:00 -0400"},"description":"Defrauding a merchant","longitude":-122.4212167,"crime type":"Fraud","id":"a6ez66zyqhnm","address":"14th Street and Julian, San Francisco, CA"},"type":"Feature","geometry":{"type":"Point","coordinates":[-122.4212167,37.7682114]}},{"properties":{"latitude":37.755699,"time":{"end_time":"2030/01/01 10:31:00 -0500","original":"10:30 a.m.","granularity":"min","time":"2030/01/01 10:30:00 -0500"},"date":{"end_time":"2011/09/22 00:00:00 -0400","original":"9/21/11","granularity":"day","time":"2011/09/21 00:00:00 -0400"},"description":"Theft from vending machine","longitude":-122.414388,"crime type":"Theft","id":"a6ez66thcxl5","address":"22nd Street and Folsom, San Francisco, CA"},"type":"Feature","geometry":{"type":"Point","coordinates":[-122.414388,37.755699]}},{"properties":{"latitude":37.7634362,"time":{"end_time":"2030/01/01 02:41:00 -0500","original":"2:40 a.m.","granularity":"min","time":"2030/01/01 02:40:00 -0500"},"date":{"end_time":"2011/09/23 00:00:00 -0400","original":"9/22/11","granularity":"day","time":"2011/09/22 00:00:00 -0400"},"description":"Aggragated assault","longitude":-122.4195226,"crime type":"Aggravated Assault","id":"a6ez66oulh4t","address":"17th Street and Mission, San Francisco, CA"},"type":"Feature","geometry":{"type":"Point","coordinates":[-122.4195226,37.7634362]}},{"properties":{"latitude":37.7749295,"time":{"end_time":"2030/01/01 09:31:00 -0500","original":"9:30 a.m.","granularity":"min","time":"2030/01/01 09:30:00 -0500"},"date":{"end_time":"2011/09/23 00:00:00 -0400","original":"9/22/11","granularity":"day","time":"2011/09/22 00:00:00 -0400"},"description":"Stolen Auto","longitude":-122.4194155,"crime type":"Auto Theft","id":"a6ez670509cq","address":"20th Street and Bartlett, San Francisco, CA"},"type":"Feature","geometry":{"type":"Point","coordinates":[-122.4194155,37.7749295]}},{"properties":{"latitude":37.7522494,"time":{"end_time":"2030/01/01 15:00:00 -0500","original":"2:00 p.m.","granularity":"hour","time":"2030/01/01 14:00:00 -0500"},"date":{"end_time":"2011/09/23 00:00:00 -0400","original":"9/22/11","granularity":"day","time":"2011/09/22 00:00:00 -0400"},"description":"Bicycle theft","longitude":-122.4184567,"crime type":"Bicycle Theft","id":"a6ez66o4q0cm","address":"24th Street and Mission, San Francisco, CA"},"type":"Feature","geometry":{"type":"Point","coordinates":[-122.4184567,37.7522494]}},{"properties":{"latitude":37.7633241,"time":{"end_time":"2030/01/01 21:57:00 -0500","original":"9:56 p.m.","granularity":"min","time":"2030/01/01 21:56:00 -0500"},"date":{"end_time":"2011/09/23 00:00:00 -0400","original":"9/22/11","granularity":"day","time":"2011/09/22 00:00:00 -0400"},"description":"Attempted burglary","longitude":-122.4055851,"crime type":"Burglary - Home","id":"a6ez66zv0emg","address":"Mariposa Street and San Bruno, San Francisco, CA"},"type":"Feature","geometry":{"type":"Point","coordinates":[-122.4055851,37.7633241]}},{"properties":{"latitude":37.7634362,"time":{"end_time":"2030/01/01 12:21:00 -0500","original":"12:20 p.m.","granularity":"min","time":"2030/01/01 12:20:00 -0500"},"date":{"end_time":"2011/09/23 00:00:00 -0400","original":"9/22/11","granularity":"day","time":"2011/09/22 00:00:00 -0400"},"description":"Auto burglary","longitude":-122.4195226,"crime type":"Burglary - Vehicle","id":"a6ez671w77cz","address":"17th Street and Mission, San Francisco, CA"},"type":"Feature","geometry":{"type":"Point","coordinates":[-122.4195226,37.7634362]}},{"properties":{"latitude":37.754337,"time":{"end_time":"2030/01/01 23:00:00 -0500","original":"10:00 p.m.","granularity":"hour","time":"2030/01/01 22:00:00 -0500"},"date":{"end_time":"2011/09/23 00:00:00 -0400","original":"9/22/11","granularity":"day","time":"2011/09/22 00:00:00 -0400"},"description":"Stolen Motorcycle","longitude":-122.405454,"crime type":"Motorcycle Theft","id":"a6ez66sdpr3n","address":"23rd Street and Utah, San Francisco, CA"},"type":"Feature","geometry":{"type":"Point","coordinates":[-122.405454,37.754337]}},{"properties":{"latitude":37.752214,"time":{"end_time":"2030/01/01 07:16:00 -0500","original":"7:15 a.m.","granularity":"min","time":"2030/01/01 07:15:00 -0500"},"date":{"end_time":"2011/09/23 00:00:00 -0400","original":"9/22/11","granularity":"day","time":"2011/09/22 00:00:00 -0400"},"description":"Theft of unattended laptop in bar","longitude":-122.4190191,"crime type":"Theft","id":"a6ez66vulezo","address":"24th Street and Osage, San Francisco, CA"},"type":"Feature","geometry":{"type":"Point","coordinates":[-122.4190191,37.752214]}},{"properties":{"latitude":37.7633,"time":{"end_time":"2030/01/01 16:04:00 -0500","original":"4:03 p.m.","granularity":"min","time":"2030/01/01 16:03:00 -0500"},"date":{"end_time":"2011/09/23 00:00:00 -0400","original":"9/22/11","granularity":"day","time":"2011/09/22 00:00:00 -0400"},"description":"Petty theft, shoplifting","longitude":-122.421732,"crime type":"Theft","id":"a6ez66opckiz","address":"17th Street and Valencia, San Francisco, CA"},"type":"Feature","geometry":{"type":"Point","coordinates":[-122.421732,37.7633]}},{"properties":{"latitude":37.7620986,"time":{"end_time":"2030/01/01 16:31:00 -0500","original":"4:30 p.m.","granularity":"min","time":"2030/01/01 16:30:00 -0500"},"date":{"end_time":"2011/09/23 00:00:00 -0400","original":"9/22/11","granularity":"day","time":"2011/09/22 00:00:00 -0400"},"description":"Theft of ladders","longitude":-122.415008,"crime type":"Theft","id":"a6ez66w8yyfz","address":"18th Street and Folsom, San Francisco, CA"},"type":"Feature","geometry":{"type":"Point","coordinates":[-122.415008,37.7620986]}},{"properties":{"latitude":37.7643703,"time":{"end_time":"2030/01/01 08:00:00 -0500","original":"7:00 a.m.","granularity":"hour","time":"2030/01/01 07:00:00 -0500"},"date":{"end_time":"2011/09/23 00:00:00 -0400","original":"9/22/11","granularity":"day","time":"2011/09/22 00:00:00 -0400"},"description":"Malicoius mischief, vehicle","longitude":-122.430904,"crime type":"Vandalism","id":"a6ez66qprquh","address":"16th Street and Sanchez, San Francisco, CA"},"type":"Feature","geometry":{"type":"Point","coordinates":[-122.430904,37.7643703]}},{"properties":{"latitude":37.7567582,"time":{"end_time":"2030/01/01 07:11:00 -0500","original":"7:10 a.m.","granularity":"min","time":"2030/01/01 07:10:00 -0500"},"date":{"end_time":"2011/09/23 00:00:00 -0400","original":"9/22/11","granularity":"day","time":"2011/09/22 00:00:00 -0400"},"description":"Malicious mischief","longitude":-122.42341,"crime type":"Vandalism","id":"a6ez66vwijk5","address":"21st Street and Guerrero, San Francisco, CA"},"type":"Feature","geometry":{"type":"Point","coordinates":[-122.42341,37.7567582]}},{"properties":{"latitude":37.74827,"time":{"end_time":"2030/01/01 15:31:00 -0500","original":"3:30 p.m.","granularity":"min","time":"2030/01/01 15:30:00 -0500"},"date":{"end_time":"2011/09/24 00:00:00 -0400","original":"9/23/11","granularity":"day","time":"2011/09/23 00:00:00 -0400"},"description":"Stolen Auto","longitude":-122.413679,"crime type":"Auto Theft","id":"a6ez674hrv20","address":"Folsom and Cesar Chavez, San Francisco, CA"},"type":"Feature","geometry":{"type":"Point","coordinates":[-122.413679,37.74827]}},{"properties":{"latitude":37.751335,"time":{"end_time":"2030/01/01 08:00:00 -0500","original":"7:00 a.m.","granularity":"hour","time":"2030/01/01 07:00:00 -0500"},"date":{"end_time":"2011/09/24 00:00:00 -0400","original":"9/23/11","granularity":"day","time":"2011/09/23 00:00:00 -0400"},"description":"Stolen Auto","longitude":-122.478434,"crime type":"Auto Theft","id":"a6ez670kqljl","address":"21st and Hampshire , San Francisco, CA"},"type":"Feature","geometry":{"type":"Point","coordinates":[-122.478434,37.751335]}},{"properties":{"latitude":37.751335,"time":{"end_time":"2030/01/01 17:00:00 -0500","original":"4 p.m.","granularity":"hour","time":"2030/01/01 16:00:00 -0500"},"date":{"end_time":"2011/09/24 00:00:00 -0400","original":"9/23/11","granularity":"day","time":"2011/09/23 00:00:00 -0400"},"description":"Stolen Auto","longitude":-122.478434,"crime type":"Auto Theft","id":"a6ez670wm1py","address":"21st and Hampshire, San Francisco, CA"},"type":"Feature","geometry":{"type":"Point","coordinates":[-122.478434,37.751335]}},{"properties":{"latitude":37.751235,"time":{"end_time":"2030/01/01 13:31:00 -0500","original":"01:30 p.m.","granularity":"min","time":"2030/01/01 13:30:00 -0500"},"date":{"end_time":"2011/09/24 00:00:00 -0400","original":"9/23/11","granularity":"day","time":"2011/09/23 00:00:00 -0400"},"description":"Stolen Auto","longitude":-122.480579,"crime type":"Auto Theft","id":"a6ez67143nv1","address":"23rd and Harrison , San Francisco, CA"},"type":"Feature","geometry":{"type":"Point","coordinates":[-122.480579,37.751235]}},{"properties":{"latitude":37.76194,"time":{"end_time":"2030/01/01 09:00:00 -0500","original":"8:00 a.m.","granularity":"