{"type":"FeatureCollection","data_type":"Dataset","url_type":null,"permissions":[{"permissions":{"download":true,"view":true},"group_id":"everyone"}],"classification":null,"title":"Sudan_training","count":95,"stream_id":223133,"contributor":{"url":"http://geocommons.com/users/43104","name":"Anthony Karanja"},"data_attributes":null,"calculation_params":null,"icon_link":null,"link":"http://geocommons.com/overlays/223133.json","extent":[-75.1638,-1.28333,36.8167,39.9523],"geometry_types":["point"],"unique_name":null,"name":"Sudan_training","feature_count":95,"description":"","next_feature":null,"is_raster":false,"short_classification":"Y","stats":{"latitude":{"max":39.952335,"mean":7.11215735789473,"variance":23.713549423976,"stdev":4.86965598620437,"min":-1.283333,"median":5.043647},"time":{"max":"2030/01/01 23:37:00 -0500","mean":"2030/01/01 12:01:42 -0500","variance":260114620.111982,"stdev":16128.0693237592,"min":"2030/01/01 01:01:00 -0500","median":"2030/01/01 13:01:00 -0500"},"date":{"max":"2015/01/21 00:00:00 -0500","mean":"2015/01/13 08:35:22 -0500","variance":73047935569.9888,"stdev":270273.815916357,"min":"2015/01/09 00:00:00 -0500","median":"2015/01/13 00:00:00 -0500"},"longitude":{"max":36.816667,"mean":30.0367189578947,"variance":122.816810929657,"stdev":11.0822746279659,"min":-75.163789,"median":31.60463},"report":{"max":264,"mean":174.452631578947,"variance":5852.22911534154,"stdev":76.4998634988426,"min":22,"median":203}},"features":[{"properties":{"incident":"Kuron Sunday Bishop Paride and Voters","latitude":5.179103,"category":"ALL VOTING REQUIREMENTS IN PLACE CLEAR VOTING INSTRUCTIONS AND SIGNS VOTE REGISTER COMPLETE NO ISSUES  EASY/WELL ORGANIZED VOTE HELPFUL REFERENDUM OFFICIALS HIGH TURN OUT YOUNG PEOPLE SHOWING UP TO VOTE POLLING STATION WELL SECURED AND SAFE","time":{"end_time":"2030/01/01 09:00:00 -0500","original":"8:00:00","granularity":"hour","time":"2030/01/01 08:00:00 -0500"},"date":{"end_time":"2015/01/11 00:00:00 -0500","original":"1/10/2015","granularity":"day","time":"2015/01/10 00:00:00 -0500"},"approved":"YES","description":"###############################################################################################################################################################################################################################################################","verified":"NO","longitude":33.975002,"id":"a67ci5oz3su0","report":194,"location":"5.7043734.56512"},"type":"Feature","geometry":{"type":"Point","coordinates":[33.975002,5.179103]}},{"properties":{"incident":"Gatluak Gai rebels captured","latitude":9.27091,"category":"Arrests","time":{"end_time":"2030/01/01 01:22:00 -0500","original":"1:21:00","granularity":"min","time":"2030/01/01 01:21:00 -0500"},"date":{"end_time":"2015/01/11 00:00:00 -0500","original":"1/10/2015","granularity":"day","time":"2015/01/10 00:00:00 -0500"},"approved":"YES","description":"###############################################################################################################################################################################################################################################################","verified":"NO","longitude":29.800503,"id":"a67ci5zwi9tt","report":29,"location":"Bentiu sudan"},"type":"Feature","geometry":{"type":"Point","coordinates":[29.800503,9.27091]}},{"properties":{"incident":"Anti-referendum protest","latitude":15.550101,"category":"Arrests","time":{"end_time":"2030/01/01 11:43:00 -0500","original":"11:42:00","granularity":"min","time":"2030/01/01 11:42:00 -0500"},"date":{"end_time":"2015/01/11 00:00:00 -0500","original":"1/10/2015","granularity":"day","time":"2015/01/10 00:00:00 -0500"},"approved":"YES","description":"At anti-referendum protest at home of former #Sudan PR Ismail Al-Azhari. Police want to arrest #CNN crew. #Sudanref\nBut after much back and forth they relent. Carrying on with #Sudanref coverage.","verified":"NO","longitude":32.532241,"id":"a67ci5ospy2x","report":34,"location":"khartoum"},"type":"Feature","geometry":{"type":"Point","coordinates":[32.532241,15.550101]}},{"properties":{"incident":"Two men arrested with 700 rounds of AK-47 ammunition","latitude":4.85,"category":"Arrests","time":{"end_time":"2030/01/01 08:17:00 -0500","original":"8:16:00","granularity":"min","time":"2030/01/01 08:16:00 -0500"},"date":{"end_time":"2015/01/12 00:00:00 -0500","original":"1/11/2015","granularity":"day","time":"2015/01/11 00:00:00 -0500"},"approved":"YES","description":"In another sign of tension southern army spokesman Philip Aguer said two men -- a Ugandan and a northern army soldier -- were arrested with four boxes holding 700 rounds of AK-47 ammunition in Juba Sunday night.","verified":"NO","longitude":31.61667,"id":"a67ci5ywpbjd","report":127,"location":"Juba"},"type":"Feature","geometry":{"type":"Point","coordinates":[31.61667,4.85]}},{"properties":{"incident":"Arrest of Domestic Observer","latitude":4.849569,"category":"Arrests","time":{"end_time":"2030/01/01 13:22:00 -0500","original":"13:21:00","granularity":"min","time":"2030/01/01 13:21:00 -0500"},"date":{"end_time":"2015/01/12 00:00:00 -0500","original":"1/11/2015","granularity":"day","time":"2015/01/11 00:00:00 -0500"},"approved":"YES","description":"Domestic observer was arrested in Kator South polling centre by the security officer in charge of the poling center for not signing the attendance ledger book.","verified":"YES","longitude":31.60463,"id":"a67ci628cdrw","report":133,"location":"Juba"},"type":"Feature","geometry":{"type":"Point","coordinates":[31.60463,4.849569]}},{"properties":{"incident":"BBC team arrested in Khartoum","latitude":15.642874,"category":"Arrests Freedom of expresion","time":{"end_time":"2030/01/01 01:36:00 -0500","original":"1:35:00","granularity":"min","time":"2030/01/01 01:35:00 -0500"},"date":{"end_time":"2015/01/14 00:00:00 -0500","original":"1/13/2015","granularity":"day","time":"2015/01/13 00:00:00 -0500"},"approved":"YES","description":"###############################################################################################################################################################################################################################################################","verified":"YES","longitude":32.579956,"id":"a67ci60jwj88","report":196,"location":"Khartoum"},"type":"Feature","geometry":{"type":"Point","coordinates":[32.579956,15.642874]}},{"properties":{"incident":"Party Agents interrupt voting process in Lainya","latitude":4.079558,"category":"DUPLICATE VOTER NAMES","time":{"end_time":"2030/01/01 12:03:00 -0500","original":"12:02:00","granularity":"min","time":"2030/01/01 12:02:00 -0500"},"date":{"end_time":"2015/01/13 00:00:00 -0500","original":"1/12/2015","granularity":"day","time":"2015/01/12 00:00:00 -0500"},"approved":"YES","description":"The agents in Lainya County interupted the voting process. The issue arise over errors in voter's name arising from miss spelling. The same case also happened in Lafon and Mayardit.","verified":"YES","longitude":30.695097,"id":"a67ci5sk9r5o","report":190,"location":"Lainya Sudan"},"type":"Feature","geometry":{"type":"Point","coordinates":[30.695097,4.079558]}},{"properties":{"incident":"A case of voter sharing the same name.","latitude":3.689198,"category":"DUPLICATE VOTER NAMES","time":{"end_time":"2030/01/01 13:30:00 -0500","original":"13:29:00","granularity":"min","time":"2030/01/01 13:29:00 -0500"},"date":{"end_time":"2015/01/12 00:00:00 -0500","original":"1/11/2015","granularity":"day","time":"2015/01/11 00:00:00 -0500"},"approved":"YES","description":"In Morobo County a case of voter sharing the same name was observed during the first date of polling it was discovered that the two voters have the same name when second one came and found that someone bearing the same name has voted.","verified":"YES","longitude":30.775452,"id":"a67ci5rn8fl9","report":134,"location":"Morobo"},"type":"Feature","geometry":{"type":"Point","coordinates":[30.775452,3.689198]}},{"properties":{"incident":"Video - Sudanese on bus from Philadelphia to Virginia to Vote","latitude":39.952335,"category":"EASY/WELL ORGANIZED VOTE","time":{"end_time":"2030/01/01 09:47:00 -0500","original":"9:46:00","granularity":"min","time":"2030/01/01 09:46:00 -0500"},"date":{"end_time":"2015/01/12 00:00:00 -0500","original":"1/11/2015","granularity":"day","time":"2015/01/11 00:00:00 -0500"},"approved":"YES","description":"Euronews news clip reporting from various locations voting including Juba and Philadelphia Pa. In the video voting appears orderly and peaceful.\n\nPhiladelphia is shown at .36 seconds into the 1 minutes video","verified":"YES","longitude":-75.163789,"id":"a67ci5wujw02","report":136,"location":"Philadelphia Pennsylvania United States"},"type":"Feature","geometry":{"type":"Point","coordinates":[-75.163789,39.952335]}},{"properties":{"incident":"Voting in Juba","latitude":4.849569,"category":"EASY/WELL ORGANIZED VOTE","time":{"end_time":"2030/01/01 11:47:00 -0500","original":"11:46:00","granularity":"min","time":"2030/01/01 11:46:00 -0500"},"date":{"end_time":"2015/01/11 00:00:00 -0500","original":"1/10/2015","granularity":"day","time":"2015/01/10 00:00:00 -0500"},"approved":"YES","description":"Filed for @abcnewsradio on #SudanRef Ppl in Juba literally dancing while waiting to cast their votes.","verified":"NO","longitude":31.60463,"id":"a67ci5z2fl8e","report":35,"location":"Juba"},"type":"Feature","geometry":{"type":"Point","coordinates":[31.60463,4.849569]}},{"properties":{"incident":"Voting for unity","latitude":15.621335,"category":"EASY/WELL ORGANIZED VOTE","time":{"end_time":"2030/01/01 11:49:00 -0500","original":"11:48:00","granularity":"min","time":"2030/01/01 11:48:00 -0500"},"date":{"end_time":"2015/01/11 00:00:00 -0500","original":"1/10/2015","granularity":"day","time":"2015/01/10 00:00:00 -0500"},"approved":"YES","description":"Most people at Al-Tadamun Al-Shaabi polling ctr in Haj Yusif Khartoum say they voted for #Sudan unity. #sudanref","verified":"NO","longitude":32.639049,"id":"a67ci5qx2zlf","report":36,"location":"haj yusif khartoum"},"type":"Feature","geometry":{"type":"Point","coordinates":[32.639049,15.621335]}},{"properties":{"incident":"Peaceful voting","latitude":6.8,"category":"EASY/WELL ORGANIZED VOTE","time":{"end_time":"2030/01/01 11:55:00 -0500","original":"11:54:00","granularity":"min","time":"2030/01/01 11:54:00 -0500"},"date":{"end_time":"2015/01/11 00:00:00 -0500","original":"1/10/2015","granularity":"day","time":"2015/01/10 00:00:00 -0500"},"approved":"YES","description":"Great lakes observer mission: voting peaceful and people patient in the searing heat. #sudanref","verified":"NO","longitude":29.683333,"id":"a67ci62052na","report":37,"location":"Rumbek"},"type":"Feature","geometry":{"type":"Point","coordinates":[29.683333,6.8]}},{"properties":{"incident":"Nairobi Railways Polling Station overwhlmed","latitude":-1.283333,"category":"EASY/WELL ORGANIZED VOTE","time":{"end_time":"2030/01/01 13:03:00 -0500","original":"13:02:00","granularity":"min","time":"2030/01/01 13:02:00 -0500"},"date":{"end_time":"2015/01/12 00:00:00 -0500","original":"1/11/2015","granularity":"day","time":"2015/01/11 00:00:00 -0500"},"approved":"YES","description":"###############################################################################################################################################################################################################################################################","verified":"NO","longitude":36.816667,"id":"a67ci63v24fc","report":126,"location":"nairobi kenya"},"type":"Feature","geometry":{"type":"Point","coordinates":[36.816667,-1.283333]}},{"properties":{"incident":"Kuron Peace Village voting going smoothly on Day 2","latitude":5.70437,"category":"EASY/WELL ORGANIZED VOTE","time":{"end_time":"2030/01/01 09:22:00 -0500","original":"9:21:00","granularity":"min","time":"2030/01/01 09:21:00 -0500"},"date":{"end_time":"2015/01/12 00:00:00 -0500","original":"1/11/2015","granularity":"day","time":"2015/01/11 00:00:00 -0500"},"approved":"YES","description":"###############################################################################################################################################################################################################################################################","verified":"NO","longitude":34.56512,"id":"a67ci5sndohy","report":132,"location":"Nagichot way north Kuron Peace Village in Kapoeta East County Eastern Equatoria"},"type":"Feature","geometry":{"type":"Point","coordinates":[34.56512,5.70437]}},{"properties":{"incident":"Peaceful referendum in western Equatoria despite prevailing security concerns.","latitude":5.34718,"category":"EASY/WELL ORGANIZED VOTE","time":{"end_time":"2030/01/01 13:24:00 -0500","original":"13:23:00","granularity":"min","time":"2030/01/01 13:23:00 -0500"},"date":{"end_time":"2015/01/14 00:00:00 -0500","original":"1/13/2015","granularity":"day","time":"2015/01/13 00:00:00 -0500"},"approved":"YES","description":"###############################################################################################################################################################################################################################################################","verified":"NO","longitude":28.299435,"id":"a67ci5shrr8b","report":197,"location":"Western Equatoria"},"type":"Feature","geometry":{"type":"Point","coordinates":[28.299435,5.34718]}},{"properties":{"incident":"AU conference in Juba on south sudan referendum.","latitude":4.849569,"category":"EASY/WELL ORGANIZED VOTE","time":{"end_time":"2030/01/01 13:37:00 -0500","original":"13:36:00","granularity":"min","time":"2030/01/01 13:36:00 -0500"},"date":{"end_time":"2015/01/14 00:00:00 -0500","original":"1/13/2015","granularity":"day","time":"2015/01/13 00:00:00 -0500"},"approved":"YES","description":"###############################################################################################################################################################################################################################################################","verified":"YES","longitude":31.60463,"id":"a67ci5r2oqcb","report":206,"location":"Juba"},"type":"Feature","geometry":{"type":"Point","coordinates":[31.60463,4.849569]}},{"properties":{"incident":"Head of AU obsever mssion press statement","latitude":4.849569,"category":"EASY/WELL ORGANIZED VOTE","time":{"end_time":"2030/01/01 13:28:00 -0500","original":"13:27:00","granularity":"min","time":"2030/01/01 13:27:00 -0500"},"date":{"end_time":"2015/01/15 00:00:00 -0500","original":"1/14/2015","granularity":"day","time":"2015/01/14 00:00:00 -0500"},"approved":"YES","description":"###############################################################################################################################################################################################################################################################","verified":"YES","longitude":31.60463,"id":"a67ci62mjyqa","report":216,"location":"Juba"},"type":"Feature","geometry":{"type":"Point","coordinates":[31.60463,4.849569]}},{"properties":{"incident":"Observing the Referendum process in White Nile State","latitude":13.154376,"category":"EASY/WELL ORGANIZED VOTE","time":{"end_time":"2030/01/01 22:17:00 -0500","original":"22:16:00","granularity":"min","time":"2030/01/01 22:16:00 -0500"},"date":{"end_time":"2015/01/15 00:00:00 -0500","original":"1/14/2015","granularity":"day","time":"2015/01/14 00:00:00 -0500"},"approved":"YES","description":"###############################################################################################################################################################################################################################################################","verified":"NO","longitude":32.695312,"id":"a67ci5x9vwah","report":218,"location":"White Nile State Kosti"},"type":"Feature","geometry":{"type":"Point","coordinates":[32.695312,13.154376]}},{"properties":{"incident":"Voting continues in Southern Sudan","latitude":8.536045,"category":"EASY/WELL ORGANIZED VOTE","time":{"end_time":"2030/01/01 01:47:00 -0500","original":"1:46:00","granularity":"min","time":"2030/01/01 01:46:00 -0500"},"date":{"end_time":"2015/01/16 00:00:00 -0500","original":"1/15/2015","granularity":"day","time":"2015/01/15 00:00:00 -0500"},"approved":"YES","description":"###############################################################################################################################################################################################################################################################","verified":"YES","longitude":26.796785,"id":"a67ci616pl6p","report":219,"location":"Northern Bahr El Ghazal"},"type":"Feature","geometry":{"type":"Point","coordinates":[26.796785,8.536045]}},{"properties":{"incident":"Report on Referendum in Eastern Equatoria State","latitude":4.41333,"category":"EASY/WELL ORGANIZED VOTE HELPFUL REFERENDUM OFFICIALS HIGH TURN OUT  WOMEN SHOWING UP TO VOTE  YOUNG PEOPLE SHOWING UP TO VOTE  POLLING STATION WELL SECURED AND SAFE)","time":{"end_time":"2030/01/01 16:36:00 -0500","original":"16:35:00","granularity":"min","time":"2030/01/01 16:35:00 -0500"},"date":{"end_time":"2015/01/15 00:00:00 -0500","original":"1/14/2015","granularity":"day","time":"2015/01/14 00:00:00 -0500"},"approved":"YES","description":"###############################################################################################################################################################################################################################################################","verified":"NO","longitude":32.56778,"id":"a67ci60g1iuw","report":224,"location":"Torit"},"type":"Feature","geometry":{"type":"Point","coordinates":[32.56778,4.41333]}},{"properties":{"incident":"Report On 5 Polling Stations In Kapoeta Town","latitude":4.762573,"category":"EASY/WELL ORGANIZED VOTE HELPFUL REFERENDUM OFFICIALS HIGH TURN OUT  WOMEN SHOWING UP TO VOTE YOUNG PEOPLE SHOWING UP TO VOTE  POLLING STATION WELL SECURED AND SAFE","time":{"end_time":"2030/01/01 09:00:00 -0500","original":"8:00:00","granularity":"hour","time":"2030/01/01 08:00:00 -0500"},"date":{"end_time":"2015/01/11 00:00:00 -0500","original":"1/10/2015","granularity":"day","time":"2015/01/10 00:00:00 -0500"},"approved":"YES","description":"###############################################################################################################################################################################################################################################################","verified":"NO","longitude":33.596191,"id":"a67ci61jgfy6","report":221,"location":"Kapoeta Town"},"type":"Feature","geometry":{"type":"Point","coordinates":[33.596191,4.762573]}},{"properties":{"incident":"Report On 2 Polling Stations In Budi County","latitude":4.356215,"category":"EASY/WELL ORGANIZED VOTE HELPFUL REFERENDUM OFFICIALS HIGH TURN OUT  WOMEN SHOWING UP TO VOTE YOUNG PEOPLE SHOWING UP TO VOTE POLLING STATION DIFFICULT TO REACH","time":{"end_time":"2030/01/01 09:00:00 -0500","original":"8:00:00","granularity":"hour","time":"2030/01/01 08:00:00 -0500"},"date":{"end_time":"2015/01/13 00:00:00 -0500","original":"1/12/2015","granularity":"day","time":"2015/01/12 00:00:00 -0500"},"approved":"YES","description":"###############################################################################################################################################################################################################################################################","verified":"NO","longitude":33.617577,"id":"a67ci5toggrk","report":223,"location":"Budi County (4.57 33.34)"},"type":"Feature","geometry":{"type":"Point","coordinates":[33.617577,4.356215]}},{"properties":{"incident":"Kotobi Pooling Station","latitude":5.2518,"category":"EASY/WELL ORGANIZED VOTE HIGH TURN OUT","time":{"end_time":"2030/01/01 10:13:00 -0500","original":"10:12:00","granularity":"min","time":"2030/01/01 10:12:00 -0500"},"date":{"end_time":"2015/01/11 00:00:00 -0500","original":"1/10/2015","granularity":"day","time":"2015/01/10 00:00:00 -0500"},"approved":"YES","description":"http://twitpic.com/3of2am \"We are voting for dignity.\" Kotobi polling station South #Sudan #SudanRef","verified":"NO","longitude":30.201,"id":"a67ci5y2qr5x","report":33,"location":"Kotobi Mundri West"},"type":"Feature","geometry":{"type":"Point","coordinates":[30.201,5.2518]}},{"properties":{"incident":"Everything fine and peaceful in Kotobi","latitude":5.246308,"category":"EASY/WELL ORGANIZED VOTE HIGH TURN OUT","time":{"end_time":"2030/01/01 17:06:00 -0500","original":"17:05:00","granularity":"min","time":"2030/01/01 17:05:00 -0500"},"date":{"end_time":"2015/01/11 00:00:00 -0500","original":"1/10/2015","granularity":"day","time":"2015/01/10 00:00:00 -0500"},"approved":"YES","description":"###############################################################################################################################################################################################################################################################","verified":"NO","longitude":30.203088,"id":"a67ci5xyzpvn","report":39,"location":"5.2518\t30.201"},"type":"Feature","geometry":{"type":"Point","coordinates":[30.203088,5.246308]}},{"properties":{"incident":"Voting in Juba is proceeding well","latitude":4.85,"category":"EASY/WELL ORGANIZED VOTE HIGH TURN OUT POLLING STATION WELL SECURED AND SAFE","time":{"end_time":"2030/01/01 03:11:00 -0500","original":"3:10:00","granularity":"min","time":"2030/01/01 03:10:00 -0500"},"date":{"end_time":"2015/01/11 00:00:00 -0500","original":"1/10/2015","granularity":"day","time":"2015/01/10 00:00:00 -0500"},"approved":"YES","description":"Voting underway in Juba central market polling station. Good size queue building up but no issues.","verified":"NO","longitude":31.61667,"id":"a67ci64u53jj","report":32,"location":"Juba"},"type":"Feature","geometry":{"type":"Point","coordinates":[31.61667,4.85]}},{"properties":{"incident":"Report On 5 Polling Stations In Kapoeta North County","latitude":5.561315,"category":"EASY/WELL ORGANIZED VOTE HIGH TURN OUT WOMEN SHOWING UP TO VOTE  YOUNG PEOPLE SHOWING UP TO VOTE POLLING STATION WELL SECURED AND SAFE","time":{"end_time":"2030/01/01 09:00:00 -0500","original":"8:00:00","granularity":"hour","time":"2030/01/01 08:00:00 -0500"},"date":{"end_time":"2015/01/12 00:00:00 -0500","original":"1/11/2015","granularity":"day","time":"2015/01/11 00:00:00 -0500"},"approved":"YES","description":"###############################################################################################################################################################################################################################################################","verified":"NO","longitude":33.574219,"id":"a67ci624us6y","report":222,"location":"Kapoeta North County"},"type":"Feature","geometry":{"type":"Point","coordinates":[33.574219,5.561315]}},{"properties":{"incident":"Peaceful Voting in Nakuru KENYA","latitude":-0.283333,"category":"EASY/WELL ORGANIZED VOTE POLLING STATION WELL SECURED AND SAFE","time":{"end_time":"2030/01/01 10:48:00 -0500","original":"10:47:00","granularity":"min","time":"2030/01/01 10:47:00 -0500"},"date":{"end_time":"2015/01/12 00:00:00 -0500","original":"1/11/2015","granularity":"day","time":"2015/01/11 00:00:00 -0500"},"approved":"YES","description":"Hivoting was peaceful  for Sudanese refugees in NakuruKENYA JOSEPH NDERITU","verified":"NO","longitude":36.066667,"id":"a67ci64zow7b","report":128,"location":"Nakuru Kenya"},"type":"Feature","geometry":{"type":"Point","coordinates":[36.066667,-0.283333]}},{"properties":{"incident":"voting at Home and Away B referendum center","latitude":4.849569,"category":"EASY/WELL ORGANIZED VOTE WOMEN SHOWING UP TO VOTE  YOUNG PEOPLE SHOWING UP TO VOTE","time":{"end_time":"2030/01/01 13:03:00 -0500","original":"13:02:00","granularity":"min","time":"2030/01/01 13:02:00 -0500"},"date":{"end_time":"2015/01/12 00:00:00 -0500","original":"1/11/2015","granularity":"day","time":"2015/01/11 00:00:00 -0500"},"approved":"YES","description":"via @IRIglobal on Twitter\n\nThe International Republican Institute is a nonprofit nonpartisan organization committed to advancing freedom and democracy worldwide.","verified":"NO","longitude":31.60463,"id":"a67ci5x89lzi","report":183,"location":"Juba"},"type":"Feature","geometry":{"type":"Point","coordinates":[31.60463,4.849569]}},{"properties":{"incident":"Campaigning in polling centres","latitude":4.849569,"category":"Freedom of expresion","time":{"end_time":"2030/01/01 12:41:00 -0500","original":"12:40:00","granularity":"min","time":"2030/01/01 12:40:00 -0500"},"date":{"end_time":"2015/01/17 00:00:00 -0500","original":"1/16/2015","granularity":"day","time":"2015/01/16 00:00:00 -0500"},"approved":"YES","description":"Voters were campaigning in and around polling centres for separation in areas of Kator and Malakala in juba town.","verified":"YES","longitude":31.60463,"id":"a67ci5tto07z","report":227,"location":"juba"},"type":"Feature","geometry":{"type":"Point","coordinates":[31.60463,4.849569]}},{"properties":{"incident":"Campaigning in polling centres continues.","latitude":4.083333,"category":"Freedom of expresion","time":{"end_time":"2030/01/01 12:47:00 -0500","original":"12:46:00","granularity":"min","time":"2030/01/01 12:46:00 -0500"},"date":{"end_time":"2015/01/17 00:00:00 -0500","original":"1/16/2015","granularity":"day","time":"2015/01/16 00:00:00 -0500"},"approved":"YES","description":"People were campaignining in and around the polling centres of Yeifor freedom as they cnotinues to goor thier last day of votnng.","verified":"YES","longitude":30.683333,"id":"a67ci5sczp1k","report":228,"location":"Yei"},"type":"Feature","geometry":{"type":"Point","coordinates":[30.683333,4.083333]}},{"properties":{"incident":"campaigning in the polling Centre.","latitude":3.587011,"category":"Freedom of expresion","time":{"end_time":"2030/01/01 13:22:00 -0500","original":"13:21:00","granularity":"min","time":"2030/01/01 13:21:00 -0500"},"date":{"end_time":"2015/01/18 00:00:00 -0500","original":"1/17/2015","granularity":"day","time":"2015/01/17 00:00:00 -0500"},"approved":"YES","description":"Voters were campaigning in and around the polling centres for separation in Nimule.","verified":"YES","longitude":32.069541,"id":"a67ci5qz504g","report":235,"location":"Nimule"},"type":"Feature","geometry":{"type":"Point","coordinates":[32.069541,3.587011]}},{"properties":{"incident":"Campaigning in the polling centre.","latitude":5.618924,"category":"Freedom of expresion","time":{"end_time":"2030/01/01 14:00:00 -0500","original":"13:59:00","granularity":"min","time":"2030/01/01 13:59:00 -0500"},"date":{"end_time":"2015/01/18 00:00:00 -0500","original":"1/17/2015","granularity":"day","time":"2015/01/17 00:00:00 -0500"},"approved":"YES","description":"The voters in pagari were campaigning in the polling centers .","verified":"YES","longitude":31.445618,"id":"a67ci5t33pus","report":240,"location":"5.997183 30.710360"},"type":"Feature","geometry":{"type":"Point","coordinates":[31.445618,5.618924]}},{"properties":{"incident":"UN SGSR Haile Menkerios in Torit talking with voters","latitude":4.41333,"category":"HELPFUL REFERENDUM OFFICIALS","time":{"end_time":"2030/01/01 08:56:00 -0500","original":"8:55:00","granularity":"min","time":"2030/01/01 08:55:00 -0500"},"date":{"end_time":"2015/01/12 00:00:00 -0500","original":"1/11/2015","granularity":"day","time":"2015/01/11 00:00:00 -0500"},"approved":"YES","description":"UN Secretary Greneral Special Representative Haile Menkerios of South Africa talking with voters in Torit. Sunday afternoon.","verified":"NO","longitude":32.56778,"id":"a67ci5yjmd3j","report":130,"location":"Torit"},"type":"Feature","geometry":{"type":"Point","coordinates":[32.56778,4.41333]}},{"properties":{"incident":"High number of Domestic observers deployed polling centres","latitude":12.862807,"category":"HELPFUL REFERENDUM OFFICIALS","time":{"end_time":"2030/01/01 13:36:00 -0500","original":"13:35:00","granularity":"min","time":"2030/01/01 13:35:00 -0500"},"date":{"end_time":"2015/01/12 00:00:00 -0500","original":"1/11/2015","granularity":"day","time":"2015/01/11 00:00:00 -0500"},"approved":"YES","description":"###############################################################################################################################################################################################################################################################","verified":"YES","longitude":30.217636,"id":"a67ci5ug735l","report":135,"location":"Sudan"},"type":"Feature","geometry":{"type":"Point","coordinates":[30.217636,12.862807]}},{"properties":{"incident":"Vulnerable Voters were given peferential treatment in Sudan referendum","latitude":13.004558,"category":"HELPFUL REFERENDUM OFFICIALS","time":{"end_time":"2030/01/01 13:04:00 -0500","original":"13:03:00","granularity":"min","time":"2030/01/01 13:03:00 -0500"},"date":{"end_time":"2015/01/13 00:00:00 -0500","original":"1/12/2015","granularity":"day","time":"2015/01/12 00:00:00 -0500"},"approved":"YES","description":"January 10th 2011 (rumbek)a voter and a polling station official have confirmed that vulnerable persons were given special treatment on the first day of the polling.","verified":"YES","longitude":32.717285,"id":"a67ci60wgaje","report":192,"location":"Sudan"},"type":"Feature","geometry":{"type":"Point","coordinates":[32.717285,13.004558]}},{"properties":{"incident":"Southern Sudanese polling staff carry on with the referendum exercise despite no pay","latitude":5.069299,"category":"HELPFUL REFERENDUM OFFICIALS","time":{"end_time":"2030/01/01 13:38:00 -0500","original":"13:37:00","granularity":"min","time":"2030/01/01 13:37:00 -0500"},"date":{"end_time":"2015/01/14 00:00:00 -0500","original":"1/13/2015","granularity":"day","time":"2015/01/13 00:00:00 -0500"},"approved":"YES","description":"###############################################################################################################################################################################################################################################################","verified":"YES","longitude":33.438353,"id":"a67ci5zdm8kv","report":203,"location":"Eastern Equatoria"},"type":"Feature","geometry":{"type":"Point","coordinates":[33.438353,5.069299]}},{"properties":{"incident":"Joint press statement","latitude":4.849569,"category":"HELPFUL REFERENDUM OFFICIALS","time":{"end_time":"2030/01/01 13:48:00 -0500","original":"13:47:00","granularity":"min","time":"2030/01/01 13:47:00 -0500"},"date":{"end_time":"2015/01/14 00:00:00 -0500","original":"1/13/2015","granularity":"day","time":"2015/01/13 00:00:00 -0500"},"approved":"YES","description":"###############################################################################################################################################################################################################################################################","verified":"YES","longitude":31.60463,"id":"a67ci5y9hpek","report":204,"location":"Juba"},"type":"Feature","geometry":{"type":"Point","coordinates":[31.60463,4.849569]}},{"properties":{"incident":"Please add more towns and cities in Eastern Equatoria","latitude":4.41333,"category":"HIGH TURN OUT","time":{"end_time":"2030/01/01 17:34:00 -0500","original":"17:33:00","granularity":"min","time":"2030/01/01 17:33:00 -0500"},"date":{"end_time":"2015/01/10 00:00:00 -0500","original":"1/9/2015","granularity":"day","time":"2015/01/09 00:00:00 -0500"},"approved":"NO","description":"Kuron Peace Village Narus Riwoto Kimatong Isoke Ikotos Lafon Keyala Katire Magwi Palotaka Loa Nimule are some good examples.\n\nIt would be great if you could organize the cities by State.","verified":"NO","longitude":32.56778,"id":"a67ci5t08pl9","report":26,"location":"Torit Catholic Diocese of Torit"},"type":"Feature","geometry":{"type":"Point","coordinates":[32.56778,4.41333]}},{"properties":{"incident":"Referendum in Torit","latitude":4.416667,"category":"HIGH TURN OUT","time":{"end_time":"2030/01/01 07:46:00 -0500","original":"7:45:00","granularity":"min","time":"2030/01/01 07:45:00 -0500"},"date":{"end_time":"2015/01/11 00:00:00 -0500","original":"1/10/2015","granularity":"day","time":"2015/01/10 00:00:00 -0500"},"approved":"YES","description":"###############################################################################################################################################################################################################################################################","verified":"NO","longitude":32.566667,"id":"a67ci640g03w","report":40,"location":"Torit"},"type":"Feature","geometry":{"type":"Point","coordinates":[32.566667,4.416667]}},{"properties":{"incident":"High turnout as voting starts","latitude":4.849569,"category":"HIGH TURN OUT","time":{"end_time":"2030/01/01 13:02:00 -0500","original":"13:01:00","granularity":"min","time":"2030/01/01 13:01:00 -0500"},"date":{"end_time":"2015/01/12 00:00:00 -0500","original":"1/11/2015","granularity":"day","time":"2015/01/11 00:00:00 -0500"},"approved":"YES","description":"###############################################################################################################################################################################################################################################################","verified":"YES","longitude":31.60463,"id":"a67ci5whg3ha","report":138,"location":"Juba"},"type":"Feature","geometry":{"type":"Point","coordinates":[31.60463,4.849569]}},{"properties":{"incident":"Voter turnout continues to be high on the second day of polling","latitude":4.849569,"category":"HIGH TURN OUT","time":{"end_time":"2030/01/01 01:35:00 -0500","original":"1:34:00","granularity":"min","time":"2030/01/01 01:34:00 -0500"},"date":{"end_time":"2015/01/13 00:00:00 -0500","original":"1/12/2015","granularity":"day","time":"2015/01/12 00:00:00 -0500"},"approved":"YES","description":"###############################################################################################################################################################################################################################################################","verified":"YES","longitude":31.60463,"id":"a67ci63owldx","report":185,"location":"Juba"},"type":"Feature","geometry":{"type":"Point","coordinates":[31.60463,4.849569]}},{"properties":{"incident":"Southern Sudan Human Rights Commission press statement","latitude":4.849569,"category":"HIGH TURN OUT","time":{"end_time":"2030/01/01 11:39:00 -0500","original":"11:38:00","granularity":"min","time":"2030/01/01 11:38:00 -0500"},"date":{"end_time":"2015/01/13 00:00:00 -0500","original":"1/12/2015","granularity":"day","time":"2015/01/12 00:00:00 -0500"},"approved":"YES","description":"###############################################################################################################################################################################################################################################################","verified":"YES","longitude":31.60463,"id":"a67ci5sr5zjc","report":187,"location":"Juba"},"type":"Feature","geometry":{"type":"Point","coordinates":[31.60463,4.849569]}},{"properties":{"incident":"Sudan turnout passes key 60 pct threshold: south","latitude":4.849569,"category":"HIGH TURN OUT","time":{"end_time":"2030/01/01 10:54:00 -0500","original":"10:53:00","granularity":"min","time":"2030/01/01 10:53:00 -0500"},"date":{"end_time":"2015/01/14 00:00:00 -0500","original":"1/13/2015","granularity":"day","time":"2015/01/13 00:00:00 -0500"},"approved":"YES","description":"###############################################################################################################################################################################################################################################################","verified":"YES","longitude":31.60463,"id":"a67ci61ep3uf","report":198,"location":"Juba"},"type":"Feature","geometry":{"type":"Point","coordinates":[31.60463,4.849569]}},{"properties":{"incident":"Al-Ayyam Khartoum MMR 13 JAN 11","latitude":15.54665,"category":"HIGH TURN OUT","time":{"end_time":"2030/01/01 11:16:00 -0500","original":"11:15:00","granularity":"min","time":"2030/01/01 11:15:00 -0500"},"date":{"end_time":"2015/01/15 00:00:00 -0500","original":"1/14/2015","granularity":"day","time":"2015/01/14 00:00:00 -0500"},"approved":"YES","description":"###############################################################################################################################################################################################################################################################","verified":"NO","longitude":32.53361,"id":"a67ci5rdt2l8","report":217,"location":"Khartoum"},"type":"Feature","geometry":{"type":"Point","coordinates":[32.53361,15.54665]}},{"properties":{"incident":"BBC: 150000 Southerners leave north Sudan ahead of vote result","latitude":9.580496,"category":"HIGH TURN OUT","time":{"end_time":"2030/01/01 17:11:00 -0500","original":"17:10:00","granularity":"min","time":"2030/01/01 17:10:00 -0500"},"date":{"end_time":"2015/01/16 00:00:00 -0500","original":"1/15/2015","granularity":"day","time":"2015/01/15 00:00:00 -0500"},"approved":"YES","description":"###############################################################################################################################################################################################################################################################","verified":"NO","longitude":28.43014,"id":"a67ci5xjutqm","report":225,"location":"Abyei Sudan"},"type":"Feature","geometry":{"type":"Point","coordinates":[28.43014,9.580496]}},{"properties":{"incident":"SuDEMOP STATEMENT ON THE FIRST DAY OF POLLING","latitude":4.631179,"category":"HIGH TURN OUT","time":{"end_time":"2030/01/01 12:17:00 -0500","original":"12:16:00","granularity":"min","time":"2030/01/01 12:16:00 -0500"},"date":{"end_time":"2015/01/12 00:00:00 -0500","original":"1/11/2015","granularity":"day","time":"2015/01/11 00:00:00 -0500"},"approved":"YES","description":"###############################################################################################################################################################################################################################################################","verified":"YES","longitude":31.728516,"id":"a67ci5wwp2ag","report":125,"location":"Juba"},"type":"Feature","geometry":{"type":"Point","coordinates":[31.728516,4.631179]}},{"properties":{"incident":"Allegations of intimidation","latitude":7.696033,"category":"ILLEGAL CAMPAIGNING","time":{"end_time":"2030/01/01 01:37:00 -0500","original":"1:36:00","granularity":"min","time":"2030/01/01 01:36:00 -0500"},"date":{"end_time":"2015/01/15 00:00:00 -0500","original":"1/14/2015","granularity":"day","time":"2015/01/14 00:00:00 -0500"},"approved":"YES","description":"###############################################################################################################################################################################################################################################################","verified":"NO","longitude":27.99213,"id":"a67ci5x5h8oy","report":211,"location":"Wau"},"type":"Feature","geometry":{"type":"Point","coordinates":[27.99213,7.696033]}},{"properties":{"incident":"Local Dailies: UN Report Al-Ahdath 10/1/11 reports","latitude":15.54665,"category":"Inflammatory Speech","time":{"end_time":"2030/01/01 17:14:00 -0500","original":"17:13:00","granularity":"min","time":"2030/01/01 17:13:00 -0500"},"date":{"end_time":"2015/01/12 00:00:00 -0500","original":"1/11/2015","granularity":"day","time":"2015/01/11 00:00:00 -0500"},"approved":"YES","description":"###############################################################################################################################################################################################################################################################","verified":"NO","longitude":32.53361,"id":"a67ci5oq3ga0","report":195,"location":"Khartoum"},"type":"Feature","geometry":{"type":"Point","coordinates":[32.53361,15.54665]}},{"properties":{"incident":"Diaspora Boycotting Referendum Vote in Uganda And Kenya","latitude":1.373333,"category":"OUT-OF-COUNTRY VOTING","time":{"end_time":"2030/01/01 08:37:00 -0500","original":"8:36:00","granularity":"min","time":"2030/01/01 08:36:00 -0500"},"date":{"end_time":"2015/01/13 00:00:00 -0500","original":"1/12/2015","granularity":"day","time":"2015/01/12 00:00:00 -0500"},"approved":"YES","description":"###############################################################################################################################################################################################################################################################","verified":"NO","longitude":32.290275,"id":"a67ci60r3bs8","report":193,"location":"uganda"},"type":"Feature","geometry":{"type":"Point","coordinates":[32.290275,1.373333]}},{"properties":{"incident":"Voting time.","latitude":13.083333,"category":"POLLING STATION CLOSED","time":{"end_time":"2030/01/01 13:44:00 -0500","original":"13:43:00","granularity":"min","time":"2030/01/01 13:43:00 -0500"},"date":{"end_time":"2015/01/17 00:00:00 -0500","original":"1/16/2015","granularity":"day","time":"2015/01/16 00:00:00 -0500"},"approved":"YES","description":"Voters were not allowed to vote after 5:00Pm in North Kordofan","verified":"YES","longitude":30.35,"id":"a67ci5tnoav4","report":232,"location":"Kordofan"},"type":"Feature","geometry":{"type":"Point","coordinates":[30.35,13.083333]}},{"properties":{"incident":"Lack of water threatens turnout in Lakes state","latitude":6.8,"category":"POLLING STATION DIFFICULT TO REACH","time":{"end_time":"2030/01/01 01:07:00 -0500","original":"1:06:00","granularity":"min","time":"2030/01/01 01:06:00 -0500"},"date":{"end_time":"2015/01/11 00:00:00 -0500","original":"1/10/2015","granularity":"day","time":"2015/01/10 00:00:00 -0500"},"approved":"YES","description":"The availability of water at polling centers will be a major problem in Lakes state during southern Sudan’s independence referendum according to local officials.","verified":"NO","longitude":29.683333,"id":"a67ci5qd71q5","report":31,"location":"Rumbek Sudan"},"type":"Feature","geometry":{"type":"Point","coordinates":[29.683333,6.8]}},{"properties":{"incident":"Voting Time","latitude":4.083333,"category":"POLLING STATION DIFFICULT TO REACH","time":{"end_time":"2030/01/01 13:50:00 -0500","original":"13:49:00","granularity":"min","time":"2030/01/01 13:49:00 -0500"},"date":{"end_time":"2015/01/18 00:00:00 -0500","original":"1/17/2015","granularity":"day","time":"2015/01/17 00:00:00 -0500"},"approved":"YES","description":"The time for voting was increased during the sudan historic Election from 5:00pm to 6:00pm in the evening but in yei voters were not allowed to vote affter 5:00pm despite the fact the southern Sudan Referendum commission increased the voting time","verified":"YES","longitude":30.683333,"id":"a67ci5u38dlf","report":239,"location":"Yei"},"type":"Feature","geometry":{"type":"Point","coordinates":[30.683333,4.083333]}},{"properties":{"incident":"A voter attempts to disarm police officer in Yei","latitude":4.083333,"category":"REFERENDUM OFFICIAL INTIMIDATION","time":{"end_time":"2030/01/01 11:43:00 -0500","original":"11:42:00","granularity":"min","time":"2030/01/01 11:42:00 -0500"},"date":{"end_time":"2015/01/15 00:00:00 -0500","original":"1/14/2015","granularity":"day","time":"2015/01/14 00:00:00 -0500"},"approved":"YES","description":"###############################################################################################################################################################################################################################################################","verified":"YES","longitude":30.683333,"id":"a67ci5x3ft4w","report":213,"location":"Yei Town"},"type":"Feature","geometry":{"type":"Point","coordinates":[30.683333,4.083333]}},{"properties":{"incident":"Southern Kordofan electoral official resigns","latitude":11.016667,"category":"REFERENDUM OFFICIAL INTIMIDATION","time":{"end_time":"2030/01/01 13:52:00 -0500","original":"13:51:00","granularity":"min","time":"2030/01/01 13:51:00 -0500"},"date":{"end_time":"2015/01/18 00:00:00 -0500","original":"1/17/2015","granularity":"day","time":"2015/01/17 00:00:00 -0500"},"approved":"YES","description":"Southern Kordofan electoral official resigns over voter registration deadlock","verified":"NO","longitude":29.716667,"id":"a67ci5w2ngh5","report":249,"location":"kadugli"},"type":"Feature","geometry":{"type":"Point","coordinates":[29.716667,11.016667]}},{"properties":{"incident":"Obstruction of observers","latitude":6.221108,"category":"REMOVAL OF OBSERVERS","time":{"end_time":"2030/01/01 13:54:00 -0500","original":"13:53:00","granularity":"min","time":"2030/01/01 13:53:00 -0500"},"date":{"end_time":"2015/01/12 00:00:00 -0500","original":"1/11/2015","granularity":"day","time":"2015/01/11 00:00:00 -0500"},"approved":"YES","description":"Bor south domestic observers were rejected to enter the polling center by South Sudan Referendum Bureau SSRB polling officials on the first date of voting.","verified":"YES","longitude":31.567497,"id":"a67ci5sv0pp4","report":137,"location":"Bor"},"type":"Feature","geometry":{"type":"Point","coordinates":[31.567497,6.221108]}},{"properties":{"incident":"Removal of observers.","latitude":9.529987,"category":"REMOVAL OF OBSERVERS","time":{"end_time":"2030/01/01 13:46:00 -0500","original":"13:45:00","granularity":"min","time":"2030/01/01 13:45:00 -0500"},"date":{"end_time":"2015/01/18 00:00:00 -0500","original":"1/17/2015","granularity":"day","time":"2015/01/17 00:00:00 -0500"},"approved":"YES","description":"The observers were not allowed to observe the tabulation processes in upper Nile today by the high community.","verified":"YES","longitude":31.655479,"id":"a67ci5qufqyg","report":241,"location":"Malakal"},"type":"Feature","geometry":{"type":"Point","coordinates":[31.655479,9.529987]}},{"properties":{"incident":"Removal of observers","latitude":11.8323,"category":"REMOVAL OF OBSERVERS","time":{"end_time":"2030/01/01 13:56:00 -0500","original":"13:55:00","granularity":"min","time":"2030/01/01 13:55:00 -0500"},"date":{"end_time":"2015/01/18 00:00:00 -0500","original":"1/17/2015","granularity":"day","time":"2015/01/17 00:00:00 -0500"},"approved":"YES","description":"The observers were not allowed to observe the tabulation process in Renk by the Upper Nile High commutte today.","verified":"YES","longitude":32.797619,"id":"a67ci61gyl8x","report":242,"location":"Renk"},"type":"Feature","geometry":{"type":"Point","coordinates":[32.797619,11.8323]}},{"properties":{"incident":"Removal of observers","latitude":7.696033,"category":"REMOVAL OF OBSERVERS","time":{"end_time":"2030/01/01 13:02:00 -0500","original":"13:01:00","granularity":"min","time":"2030/01/01 13:01:00 -0500"},"date":{"end_time":"2015/01/18 00:00:00 -0500","original":"1/17/2015","granularity":"day","time":"2015/01/17 00:00:00 -0500"},"approved":"YES","description":"The observers were not allowed to observe the tabulation processes in the town of Wau.","verified":"YES","longitude":27.99213,"id":"a67ci63af6il","report":243,"location":"Wau"},"type":"Feature","geometry":{"type":"Point","coordinates":[27.99213,7.696033]}},{"properties":{"incident":"Removal of observers in the town of Rajah","latitude":8.64524,"category":"REMOVAL OF OBSERVERS","time":{"end_time":"2030/01/01 13:15:00 -0500","original":"13:14:00","granularity":"min","time":"2030/01/01 13:14:00 -0500"},"date":{"end_time":"2015/01/18 00:00:00 -0500","original":"1/17/2015","granularity":"day","time":"2015/01/17 00:00:00 -0500"},"approved":"YES","description":"The observers were not allowed to observe the process of tabulation.","verified":"YES","longitude":25.283759,"id":"a67ci5v1s8df","report":245,"location":"raja sudan"},"type":"Feature","geometry":{"type":"Point","coordinates":[25.283759,8.64524]}},{"properties":{"incident":"Presence of an authorized security personnel in polling centers","latitude":4.565986,"category":"Security personnel avoided confrontation","time":{"end_time":"2030/01/01 12:18:00 -0500","original":"12:17:00","granularity":"min","time":"2030/01/01 12:17:00 -0500"},"date":{"end_time":"2015/01/13 00:00:00 -0500","original":"1/12/2015","granularity":"day","time":"2015/01/12 00:00:00 -0500"},"approved":"YES","description":"The Sudanese Network for Democratic Elections SuNDE obsevation team reported the presence of unathorized security personnel in some centers in Yambio Western Equatoria State. The same case has also been reported in Wau Bentiu and Rajja","verified":"YES","longitude":28.39588,"id":"a67ci5zaxxpt","report":191,"location":"Yambio"},"type":"Feature","geometry":{"type":"Point","coordinates":[28.39588,4.565986]}},{"properties":{"incident":"Clash between SPLA and Gatluak Gai rebels in Unity State","latitude":9.27091,"category":"VIOLENCE","time":{"end_time":"2030/01/01 11:41:00 -0500","original":"11:40:00","granularity":"min","time":"2030/01/01 11:40:00 -0500"},"date":{"end_time":"2015/01/10 00:00:00 -0500","original":"1/9/2015","granularity":"day","time":"2015/01/09 00:00:00 -0500"},"approved":"YES","description":"Clash between rebel group of Gatluak Gai and Sudan Peoples' Liberation Army; four or nine (depending on source) were killed.","verified":"NO","longitude":29.800503,"id":"a67ci5qsh8n7","report":22,"location":"Bentiu"},"type":"Feature","geometry":{"type":"Point","coordinates":[29.800503,9.27091]}},{"properties":{"incident":"19 People reportedly killed in Abyei Sudan","latitude":9.580496,"category":"VIOLENCE","time":{"end_time":"2030/01/01 14:41:00 -0500","original":"14:40:00","granularity":"min","time":"2030/01/01 14:40:00 -0500"},"date":{"end_time":"2015/01/10 00:00:00 -0500","original":"1/9/2015","granularity":"day","time":"2015/01/09 00:00:00 -0500"},"approved":"YES","description":"###############################################################################################################################################################################################################################################################","verified":"NO","longitude":28.43014,"id":"a67ci60epyvo","report":23,"location":"Abyei Sudan"},"type":"Feature","geometry":{"type":"Point","coordinates":[28.43014,9.580496]}},{"properties":{"incident":"Clashes between David Yauyau militia and SPLA in Jonglei","latitude":6.227168,"category":"VIOLENCE","time":{"end_time":"2030/01/01 01:12:00 -0500","original":"1:11:00","granularity":"min","time":"2030/01/01 01:11:00 -0500"},"date":{"end_time":"2015/01/11 00:00:00 -0500","original":"1/10/2015","granularity":"day","time":"2015/01/10 00:00:00 -0500"},"approved":"YES","description":"Jonglei state meanwhile saw deadly clashes between men commanded by militia leader David Yauyau and the southern military said Madut. One civilian was among those killed Madut said.","verified":"NO","longitude":31.567329,"id":"a67ci5sij62c","report":28,"location":"Bor sudan"},"type":"Feature","geometry":{"type":"Point","coordinates":[31.567329,6.227168]}},{"properties":{"incident":"9 victims of Sunday attacks in Abyei","latitude":9.262138,"category":"VIOLENCE","time":{"end_time":"2030/01/01 10:20:00 -0500","original":"10:19:00","granularity":"min","time":"2030/01/01 10:19:00 -0500"},"date":{"end_time":"2015/01/12 00:00:00 -0500","original":"1/11/2015","granularity":"day","time":"2015/01/11 00:00:00 -0500"},"approved":"YES","description":"###############################################################################################################################################################################################################################################################","verified":"NO","longitude":27.737337,"id":"a67ci5zlprw6","report":41,"location":"8.91042\t27.33012"},"type":"Feature","geometry":{"type":"Point","coordinates":[27.737337,9.262138]}},{"properties":{"incident":"Fighters Regrouping in Golih Langar","latitude":9.807342,"category":"VIOLENCE","time":{"end_time":"2030/01/01 08:21:00 -0500","original":"8:20:00","granularity":"min","time":"2030/01/01 08:20:00 -0500"},"date":{"end_time":"2015/01/12 00:00:00 -0500","original":"1/11/2015","granularity":"day","time":"2015/01/11 00:00:00 -0500"},"approved":"YES","description":"U.N. source says there are reports that Misseriya fighters were re-grouping in the settlement of Golih Langar Monday 25 km (16 miles) north of Abyei town.","verified":"NO","longitude":28.479169,"id":"a67ci5s3ktxl","report":129,"location":"Langar/Gole"},"type":"Feature","geometry":{"type":"Point","coordinates":[28.479169,9.807342]}},{"properties":{"incident":"At Least 33 Dead from clashes in Abyei","latitude":9.580496,"category":"VIOLENCE","time":{"end_time":"2030/01/01 13:11:00 -0500","original":"13:10:00","granularity":"min","time":"2030/01/01 13:10:00 -0500"},"date":{"end_time":"2015/01/12 00:00:00 -0500","original":"1/11/2015","granularity":"day","time":"2015/01/11 00:00:00 -0500"},"approved":"YES","description":"###############################################################################################################################################################################################################################################################","verified":"NO","longitude":28.43014,"id":"a67ci5snfjf9","report":157,"location":"Abyei"},"type":"Feature","geometry":{"type":"Point","coordinates":[28.43014,9.580496]}},{"properties":{"incident":"Six (6) Dead in fresh clashes in Abyei","latitude":9.580496,"category":"VIOLENCE","time":{"end_time":"2030/01/01 22:32:00 -0500","original":"22:31:00","granularity":"min","time":"2030/01/01 22:31:00 -0500"},"date":{"end_time":"2015/01/12 00:00:00 -0500","original":"1/11/2015","granularity":"day","time":"2015/01/11 00:00:00 -0500"},"approved":"YES","description":"###############################################################################################################################################################################################################################################################","verified":"NO","longitude":28.43014,"id":"a67ci5r0lfd6","report":184,"location":"Abyei Sudan"},"type":"Feature","geometry":{"type":"Point","coordinates":[28.43014,9.580496]}},{"properties":{"incident":"10 South Sudanese civilians killed 18 injured in ambush at North South border on Monday","latitude":11.016667,"category":"VIOLENCE","time":{"end_time":"2030/01/01 12:03:00 -0500","original":"12:02:00","granularity":"min","time":"2030/01/01 12:02:00 -0500"},"date":{"end_time":"2015/01/13 00:00:00 -0500","original":"1/12/2015","granularity":"day","time":"2015/01/12 00:00:00 -0500"},"approved":"YES","description":"#NAME?","verified":"YES","longitude":29.716667,"id":"a67ci5oootib","report":188,"location":"Kadugli"},"type":"Feature","geometry":{"type":"Point","coordinates":[29.716667,11.016667]}},{"properties":{"incident":"South Sudan voters die in ambush","latitude":11.016667,"category":"VIOLENCE","time":{"end_time":"2030/01/01 13:16:00 -0500","original":"13:15:00","granularity":"min","time":"2030/01/01 13:15:00 -0500"},"date":{"end_time":"2015/01/14 00:00:00 -0500","original":"1/13/2015","granularity":"day","time":"2015/01/13 00:00:00 -0500"},"approved":"YES","description":"###############################################################################################################################################################################################################################################################","verified":"NO","longitude":29.716667,"id":"a67ci62y61pl","report":208,"location":"Kadugli"},"type":"Feature","geometry":{"type":"Point","coordinates":[29.716667,11.016667]}},{"properties":{"incident":"UN Moves Official Wanted by ICC to Abeyi to Quell Violence","latitude":9.580496,"category":"VIOLENCE","time":{"end_time":"2030/01/01 23:38:00 -0500","original":"23:37:00","granularity":"min","time":"2030/01/01 23:37:00 -0500"},"date":{"end_time":"2015/01/14 00:00:00 -0500","original":"1/13/2015","granularity":"day","time":"2015/01/13 00:00:00 -0500"},"approved":"YES","description":"###############################################################################################################################################################################################################################################################","verified":"NO","longitude":28.43014,"id":"a67ci607im75","report":210,"location":"Abeyi sudan"},"type":"Feature","geometry":{"type":"Point","coordinates":[28.43014,9.580496]}},{"properties":{"incident":"Kapoeta voters Armed white Guns to polling Centres.","latitude":4.771667,"category":"VIOLENCE","time":{"end_time":"2030/01/01 12:02:00 -0500","original":"12:01:00","granularity":"min","time":"2030/01/01 12:01:00 -0500"},"date":{"end_time":"2015/01/15 00:00:00 -0500","original":"1/14/2015","granularity":"day","time":"2015/01/14 00:00:00 -0500"},"approved":"YES","description":"Voters in kapoeta armed theselves with machetesspearspangasand axes to protect stealing of ballot boxes.","verified":"YES","longitude":33.590278,"id":"a67ci62xmsz4","report":214,"location":"KAPOETA"},"type":"Feature","geometry":{"type":"Point","coordinates":[33.590278,4.771667]}},{"properties":{"incident":"Attackers in Northern Bar_El Gazel","latitude":8.536045,"category":"VIOLENCE","time":{"end_time":"2030/01/01 12:55:00 -0500","original":"12:54:00","granularity":"min","time":"2030/01/01 12:54:00 -0500"},"date":{"end_time":"2015/01/15 00:00:00 -0500","original":"1/14/2015","granularity":"day","time":"2015/01/14 00:00:00 -0500"},"approved":"YES","description":"Nothern Bar_ElGezel attackers were condermed by the State Governor and the government of Southern Sudan blame the Khartoum government for the attack.But voting continues in the state.","verified":"YES","longitude":26.796785,"id":"a67ci62u5jee","report":215,"location":"Bar El Ghazel"},"type":"Feature","geometry":{"type":"Point","coordinates":[26.796785,8.536045]}},{"properties":{"incident":"security challenges.","latitude":7.696033,"category":"VIOLENCE","time":{"end_time":"2030/01/01 13:18:00 -0500","original":"13:17:00","granularity":"min","time":"2030/01/01 13:17:00 -0500"},"date":{"end_time":"2015/01/17 00:00:00 -0500","original":"1/16/2015","granularity":"day","time":"2015/01/16 00:00:00 -0500"},"approved":"YES","description":"The observers in Wau faces security challenges in by anauthorised personal within the town and other places tht i may soon send also.","verified":"YES","longitude":27.99213,"id":"a67ci5yt1d6v","report":230,"location":"Wau"},"type":"Feature","geometry":{"type":"Point","coordinates":[27.99213,7.696033]}},{"properties":{"incident":"security challanges during the polling  in Security","latitude":3.883802,"category":"VIOLENCE","time":{"end_time":"2030/01/01 13:28:00 -0500","original":"13:27:00","granularity":"min","time":"2030/01/01 13:27:00 -0500"},"date":{"end_time":"2015/01/18 00:00:00 -0500","original":"1/17/2015","granularity":"day","time":"2015/01/17 00:00:00 -0500"},"approved":"YES","description":"The observers in Kajokaji faced security challenges in the county of kajokaji by unathorised personal","verified":"YES","longitude":31.65774,"id":"a67ci5yntg9l","report":236,"location":"kajokaji sudan"},"type":"Feature","geometry":{"type":"Point","coordinates":[31.65774,3.883802]}},{"properties":{"incident":"Fr. Joseph Ukello registration checked at St. Theresa primary school voting centre","latitude":4.416667,"category":"VOTE REGISTER COMPLETE NO ISSUES","time":{"end_time":"2030/01/01 09:00:00 -0500","original":"8:59:00","granularity":"min","time":"2030/01/01 08:59:00 -0500"},"date":{"end_time":"2015/01/12 00:00:00 -0500","original":"1/11/2015","granularity":"day","time":"2015/01/11 00:00:00 -0500"},"approved":"YES","description":"Fr. Joseph Ukello on Jan. 9 at 2 p.m. in having his registration checked at St. Theresa primary school voting centre in Toirt.","verified":"NO","longitude":32.566667,"id":"a67ci5p56god","report":131,"location":"Theresa primary school Toirt"},"type":"Feature","geometry":{"type":"Point","coordinates":[32.566667,4.416667]}},{"properties":{"incident":"Lakes state: Voter cards were not sold says Wulu county referendum official","latitude":6.241903,"category":"VOTE TAMPERING","time":{"end_time":"2030/01/01 13:40:00 -0500","original":"13:39:00","granularity":"min","time":"2030/01/01 13:39:00 -0500"},"date":{"end_time":"2015/01/14 00:00:00 -0500","original":"1/13/2015","granularity":"day","time":"2015/01/13 00:00:00 -0500"},"approved":"YES","description":"###############################################################################################################################################################################################################################################################","verified":"YES","longitude":29.614726,"id":"a67ci5qr1ba4","report":201,"location":"6.2417664\t29.6069872"},"type":"Feature","geometry":{"type":"Point","coordinates":[29.614726,6.241903]}},{"properties":{"incident":"Party Agents Interupting Voting in Lafon","latitude":5.043647,"category":"VOTER NAME MISSING","time":{"end_time":"2030/01/01 13:02:00 -0500","original":"13:01:00","granularity":"min","time":"2030/01/01 13:01:00 -0500"},"date":{"end_time":"2015/01/14 00:00:00 -0500","original":"1/13/2015","granularity":"day","time":"2015/01/13 00:00:00 -0500"},"approved":"YES","description":"The agents in Lafon County interrupted the voting process. The issue arise over errors in voter's name arising from miss spelling. The same case also happened in Lainya and Mayardit.","verified":"YES","longitude":32.4562,"id":"a67ci61x31mn","report":209,"location":"Lafon"},"type":"Feature","geometry":{"type":"Point","coordinates":[32.4562,5.043647]}},{"properties":{"incident":"South Sudan Secession Threatens Africa's stability","latitude":12.862807,"category":"Voting results","time":{"end_time":"2030/01/01 11:23:00 -0500","original":"11:22:00","granularity":"min","time":"2030/01/01 11:22:00 -0500"},"date":{"end_time":"2015/01/15 00:00:00 -0500","original":"1/14/2015","granularity":"day","time":"2015/01/14 00:00:00 -0500"},"approved":"NO","description":"###############################################################################################################################################################################################################################################################","verified":"YES","longitude":30.217636,"id":"a67ci5s806ic","report":212,"location":"Sudan"},"type":"Feature","geometry":{"type":"Point","coordinates":[30.217636,12.862807]}},{"properties":{"incident":"press Statement on day 7 of the Referedum 2011 SSHRC in Juba","latitude":4.849569,"category":"Voting results","time":{"end_time":"2030/01/01 13:16:00 -0500","original":"13:15:00","granularity":"min","time":"2030/01/01 13:15:00 -0500"},"date":{"end_time":"2015/01/17 00:00:00 -0500","original":"1/16/2015","granularity":"day","time":"2015/01/16 00:00:00 -0500"},"approved":"YES","description":"###############################################################################################################################################################################################################################################################","verified":"YES","longitude":31.60463,"id":"a67ci5ychfxl","report":233,"location":"juba"},"type":"Feature","geometry":{"type":"Point","coordinates":[31.60463,4.849569]}},{"properties":{"incident":"Catholic Radio in Torit is Working to Get Results by County","latitude":4.41333,"category":"Voting results","time":{"end_time":"2030/01/01 16:14:00 -0500","original":"16:13:00","granularity":"min","time":"2030/01/01 16:13:00 -0500"},"date":{"end_time":"2015/01/17 00:00:00 -0500","original":"1/16/2015","granularity":"day","time":"2015/01/16 00:00:00 -0500"},"approved":"YES","description":"###############################################################################################################################################################################################################################################################","verified":"NO","longitude":32.56778,"id":"a67ci5w0x47y","report":234,"location":"Torit"},"type":"Feature","geometry":{"type":"Point","coordinates":[32.56778,4.41333]}},{"properties":{"incident":"Lakes reaches 84% turnout","latitude":6.60308,"category":"Voting results","time":{"end_time":"2030/01/01 13:47:00 -0500","original":"13:46:00","granularity":"min","time":"2030/01/01 13:46:00 -0500"},"date":{"end_time":"2015/01/18 00:00:00 -0500","original":"1/17/2015","granularity":"day","time":"2015/01/17 00:00:00 -0500"},"approved":"YES","description":"Lakes reaches 84% turnout","verified":"NO","longitude":29.974053,"id":"a67ci64etrdk","report":246,"location":"lakes sudan"},"type":"Feature","geometry":{"type":"Point","coordinates":[29.974053,6.60308]}},{"properties":{"incident":"Warrap turnout over 91.8%","latitude":7.908676,"category":"Voting results","time":{"end_time":"2030/01/01 13:49:00 -0500","original":"13:48:00","granularity":"min","time":"2030/01/01 13:48:00 -0500"},"date":{"end_time":"2015/01/18 00:00:00 -0500","original":"1/17/2015","granularity":"day","time":"2015/01/17 00:00:00 -0500"},"approved":"YES","description":"Warrap turnout over 91.8%","verified":"NO","longitude":28.85968,"id":"a67ci5t67pd7","report":247,"location":"warrap sudan"},"type":"Feature","geometry":{"type":"Point","coordinates":[28.85968,7.908676]}},{"properties":{"incident":"Unity state 85% turnout","latitude":8.927721,"category":"Voting results","time":{"end_time":"2030/01/01 13:51:00 -0500","original":"13:50:00","granularity":"min","time":"2030/01/01 13:50:00 -0500"},"date":{"end_time":"2015/01/18 00:00:00 -0500","original":"1/17/2015","granularity":"day","time":"2015/01/17 00:00:00 -0500"},"approved":"YES","description":"Unity state 85% turnout","verified":"NO","longitude":29.788925,"id":"a67ci5z4pq1d","report":248,"location":"unity sudan"},"type":"Feature","geometry":{"type":"Point","coordinates":[29.788925,8.927721]}},{"properties":{"incident":"Torit County first county to hand in its Preliminary Referendum Results.","latitude":4.41333,"category":"Voting results","time":{"end_time":"2030/01/01 14:00:00 -0500","original":"13:00:00","granularity":"hour","time":"2030/01/01 13:00:00 -0500"},"date":{"end_time":"2015/01/18 00:00:00 -0500","original":"1/17/2015","granularity":"day","time":"2015/01/17 00:00:00 -0500"},"approved":"NO","description":"###############################################################################################################################################################################################################################################################","verified":"NO","longitude":32.56778,"id":"a67ci63szxxf","report":250,"location":"Torit"},"type":"Feature","geometry":{"type":"Point","coordinates":[32.56778,4.41333]}},{"properties":{"incident":"Torit County announces referendum preliminary results","latitude":4.41333,"category":"Voting results","time":{"end_time":"2030/01/01 15:51:00 -0500","original":"15:50:00","granularity":"min","time":"2030/01/01 15:50:00 -0500"},"date":{"end_time":"2015/01/19 00:00:00 -0500","original":"1/18/2015","granularity":"day","time":"2015/01/18 00:00:00 -0500"},"approved":"YES","description":"###############################################################################################################################################################################################################################################################","verified":"NO","longitude":32.56778,"id":"a67ci60fbpjf","report":251,"location":"Torit"},"type":"Feature","geometry":{"type":"Point","coordinates":[32.56778,4.41333]}},{"properties":{"incident":"Torit County Pictures","latitude":4.41333,"category":"Voting results","time":{"end_time":"2030/01/01 16:02:00 -0500","original":"16:01:00","granularity":"min","time":"2030/01/01 16:01:00 -0500"},"date":{"end_time":"2015/01/19 00:00:00 -0500","original":"1/18/2015","granularity":"day","time":"2015/01/18 00:00:00 -0500"},"approved":"YES","description":"please i have also for you pictures for today","verified":"NO","longitude":32.56778,"id":"a67ci64elevi","report":252,"location":"Torit"},"type":"Feature","geometry":{"type":"Point","coordinates":[32.56778,4.41333]}},{"properties":{"incident":"IGAD Press conference","latitude":4.849569,"category":"Voting results","time":{"end_time":"2030/01/01 13:37:00 -0500","original":"13:36:00","granularity":"min","time":"2030/01/01 13:36:00 -0500"},"date":{"end_time":"2015/01/19 00:00:00 -0500","original":"1/18/2015","granularity":"day","time":"2015/01/18 00:00:00 -0500"},"approved":"YES","description":"The prliminary assessment according to IGAD press release today is that the referendum process was free Fair and Credible.","verified":"YES","longitude":31.60463,"id":"a67ci5pjdihf","report":253,"location":"juba"},"type":"Feature","geometry":{"type":"Point","coordinates":[31.60463,4.849569]}},{"properties":{"incident":"Ikotos county Hands Preliminary Results to Eastern Equatoria State Referendum High Committee","latitude":4.41333,"category":"Voting results","time":{"end_time":"2030/01/01 12:32:00 -0500","original":"12:31:00","granularity":"min","time":"2030/01/01 12:31:00 -0500"},"date":{"end_time":"2015/01/20 00:00:00 -0500","original":"1/19/2015","granularity":"day","time":"2015/01/19 00:00:00 -0500"},"approved":"YES","description":"###############################################################################################################################################################################################################################################################","verified":"NO","longitude":32.56778,"id":"a67ci5s0tai8","report":255,"location":"Torit"},"type":"Feature","geometry":{"type":"Point","coordinates":[32.56778,4.41333]}},{"properties":{"incident":"Vote counts in southern Sudan","latitude":4.85,"category":"Voting results","time":{"end_time":"2030/01/01 18:16:00 -0500","original":"18:15:00","granularity":"min","time":"2030/01/01 18:15:00 -0500"},"date":{"end_time":"2015/01/20 00:00:00 -0500","original":"1/19/2015","granularity":"day","time":"2015/01/19 00:00:00 -0500"},"approved":"YES","description":"###############################################################################################################################################################################################################################################################","verified":"NO","longitude":31.61667,"id":"a67ci5p99t3w","report":257,"location":"Juba"},"type":"Feature","geometry":{"type":"Point","coordinates":[31.61667,4.85]}},{"properties":{"incident":"EU press conference both in Juba and khartoum.","latitude":4.849569,"category":"Voting results","time":{"end_time":"2030/01/01 13:28:00 -0500","original":"13:27:00","granularity":"min","time":"2030/01/01 13:27:00 -0500"},"date":{"end_time":"2015/01/20 00:00:00 -0500","original":"1/19/2015","granularity":"day","time":"2015/01/19 00:00:00 -0500"},"approved":"YES","description":"The assement of the referendum process in the Sudan by the EU was said to be free fair and credible","verified":"YES","longitude":31.60463,"id":"a67ci5uqhp70","report":260,"location":"juba"},"type":"Feature","geometry":{"type":"Point","coordinates":[31.60463,4.849569]}},{"properties":{"incident":"preliminary results for Budi and Kapoeta East Counties","latitude":4.41333,"category":"Voting results","time":{"end_time":"2030/01/01 01:02:00 -0500","original":"1:01:00","granularity":"min","time":"2030/01/01 01:01:00 -0500"},"date":{"end_time":"2015/01/22 00:00:00 -0500","original":"1/21/2015","granularity":"day","time":"2015/01/21 00:00:00 -0500"},"approved":"YES","description":"###############################################################################################################################################################################################################################################################","verified":"NO","longitude":32.56778,"id":"a67ci5si50xu","report":261,"location":"Torit"},"type":"Feature","geometry":{"type":"Point","coordinates":[32.56778,4.41333]}},{"properties":{"incident":"SuDEMOP Press conference","latitude":4.85,"category":"Voting results","time":{"end_time":"2030/01/01 16:13:00 -0500","original":"16:12:00","granularity":"min","time":"2030/01/01 16:12:00 -0500"},"date":{"end_time":"2015/01/22 00:00:00 -0500","original":"1/21/2015","granularity":"day","time":"2015/01/21 00:00:00 -0500"},"approved":"YES","description":"###############################################################################################################################################################################################################################################################","verified":"NO","longitude":31.61667,"id":"a67ci61c5efx","report":262,"location":"Juba"},"type":"Feature","geometry":{"type":"Point","coordinates":[31.61667,4.85]}},{"properties":{"incident":"Announcement of state referendum results","latitude":4.85,"category":"Voting results","time":{"end_time":"2030/01/01 16:38:00 -0500","original":"16:37:00","granularity":"min","time":"2030/01/01 16:37:00 -0500"},"date":{"end_time":"2015/01/22 00:00:00 -0500","original":"1/21/2015","granularity":"day","time":"2015/01/21 00:00:00 -0500"},"approved":"YES","description":"###############################################################################################################################################################################################################################################################","verified":"NO","longitude":31.61667,"id":"a67ci5ygs9vb","report":264,"location":"Juba"},"type":"Feature","geometry":{"type":"Point","coordinates":[31.61667,4.85]}},{"properties":{"incident":"BBC Interviewing Women Coming to Vote","latitude":4.41333,"category":"WOMEN SHOWING UP TO VOTE","time":{"end_time":"2030/01/01 18:45:00 -0500","original":"18:44:00","granularity":"min","time":"2030/01/01 18:44:00 -0500"},"date":{"end_time":"2015/01/10 00:00:00 -0500","original":"1/9/2015","granularity":"day","time":"2015/01/09 00:00:00 -0500"},"approved":"YES","description":"###############################################################################################################################################################################################################################################################","verified":"NO","longitude":32.56778,"id":"a67ci5pe1nu6","report":27,"location":"Torit"},"type":"Feature","geometry":{"type":"Point","coordinates":[32.56778,4.41333]}},{"properties":{"incident":"Women queue outside polling station in Juba","latitude":4.849569,"category":"WOMEN SHOWING UP TO VOTE","time":{"end_time":"2030/01/01 11:00:00 -0500","original":"10:00:00","granularity":"hour","time":"2030/01/01 10:00:00 -0500"},"date":{"end_time":"2015/01/11 00:00:00 -0500","original":"1/10/2015","granularity":"day","time":"2015/01/10 00:00:00 -0500"},"approved":"YES","description":"###############################################################################################################################################################################################################################################################","verified":"NO","longitude":31.60463,"id":"a67ci5vil4ka","report":38,"location":"Juba Sudan"},"type":"Feature","geometry":{"type":"Point","coordinates":[31.60463,4.849569]}}],"is_temporal":true,"author":{"url":"","metadata":null,"contact_name":null,"contact_address":null,"source":null,"contact_phone":null},"source":"","pagination":{"sort":null,"start":0,"total":95,"limit":1000000},"state":"complete","tags":"","published":"2014-08-14T18:59:34-04:00","id":223133}