{"type":"FeatureCollection","data_type":"Dataset","url_type":null,"permissions":[{"permissions":{"download":true,"view":true},"group_id":"everyone"}],"classification":null,"title":"JS.Geo Attendees  ","count":103,"stream_id":308876,"contributor":{"url":"http://geocommons.com/users/7800","name":"chelm"},"data_attributes":null,"calculation_params":null,"icon_link":null,"link":"http://geocommons.com/overlays/308876.json","extent":[-122.617,27.8516,-70.9935,47.6688],"geometry_types":["point"],"unique_name":"","name":"JS.Geo Attendees  ","feature_count":103,"description":"","next_feature":null,"is_raster":false,"short_classification":"Y","stats":{"gross revenue (usd)":{"max":317.49,"mean":29.8104854368932,"variance":5192.61772623263,"stdev":72.0598204704441,"median":11.54,"min":0.0},"eventbrite fees (usd)":{"max":8.49,"mean":1.7104854368932,"variance":3.13972623262898,"stdev":1.7719272650504,"median":1.24,"min":0.0},"ticket revenue (usd)":{"max":300.0,"mean":27.2815533980583,"variance":4663.12583285742,"stdev":68.2870839387465,"median":10.0,"min":0.0},"order id":{"max":131288726,"mean":126191885.718447,"variance":10170628980170.4,"stdev":3189142.35809103,"median":126458331,"min":120900771},"date":{"max":"2012/12/30 00:00:00 -0500","mean":"2012/11/26 06:06:59 -0500","variance":2034805968246.72,"stdev":1426466.2520532,"median":"2012/11/27 00:00:00 -0500","min":"2012/11/01 00:00:00 -0400"},"tickets":{"max":4,"mean":1.05825242718447,"variance":0.173043974871502,"stdev":0.415985546469468,"median":1,"min":0},"cc processing (usd)":{"max":9.0,"mean":0.818446601941747,"variance":4.19681324957167,"stdev":2.0486125181624,"median":0.3,"min":0.0}},"features":[{"properties":{"gross revenue (usd)":11.54,"status":"Eventbrite Completed","ticket revenue (usd)":10.0,"eventbrite fees (usd)":1.24,"billing state":"CO","order id":120900771,"date":{"end_time":"2012/11/02 00:00:00 -0400","original":"11/1/12","granularity":"day","time":"2012/11/01 00:00:00 -0400"},"last name":"Wadsworth","type":"Credit Card","billing address 1":null,"geo_score":0.857,"payment method":"American Express - XXXX-XXXXXX-X1015","notes":null,"billing address 2":null,"billing city":null,"event name":"JS.geo","tickets":1,"cc processing (usd)":0.3,"id":"ab7z9fkplzoy","first name":"Scooter","email address":"scooterwadsworth@gmail.com","geo_precision":"zip","billing zip":"80905","billing country":"US"},"type":"Feature","geometry":{"type":"Point","coordinates":[-104.801472,38.844319]}},{"properties":{"gross revenue (usd)":11.54,"status":"Eventbrite Completed","ticket revenue (usd)":10.0,"eventbrite fees (usd)":1.24,"billing state":"CO","order id":120900809,"date":{"end_time":"2012/11/02 00:00:00 -0400","original":"11/1/12","granularity":"day","time":"2012/11/01 00:00:00 -0400"},"last name":"Pfister","type":"Credit Card","billing address 1":"605 6th St","geo_score":0.902,"payment method":"Visa - XXXX-XXXXXX-8905","notes":null,"billing address 2":null,"billing city":"Windsor","event name":"JS.geo","tickets":1,"cc processing (usd)":0.3,"id":"ab7z9f67n9sj","first name":"Marc","email address":"marc.pfister@gmail.com","geo_precision":"range","billing zip":"80550","billing country":"US"},"type":"Feature","geometry":{"type":"Point","coordinates":[-104.906035,40.473563]}},{"properties":{"gross revenue (usd)":317.49,"status":"Eventbrite Completed","ticket revenue (usd)":300.0,"eventbrite fees (usd)":8.49,"billing state":"CA","order id":120902625,"date":{"end_time":"2012/11/02 00:00:00 -0400","original":"11/1/12","granularity":"day","time":"2012/11/01 00:00:00 -0400"},"last name":"Citron-Pousty","type":"Credit Card","billing address 1":"21418 Geraldine CT","geo_score":1.0,"payment method":"Visa - XXXX-XXXXXX-4905","notes":null,"billing address 2":null,"billing city":"Los Gatos","event name":"JS.geo","tickets":1,"cc processing (usd)":9.0,"id":"ab7z9f5o7kch","first name":"Steven","email address":"scitronpousty@gmail.com","geo_precision":"range","billing zip":"95033","billing country":"US"},"type":"Feature","geometry":{"type":"Point","coordinates":[-121.980796,37.15846]}},{"properties":{"gross revenue (usd)":0.0,"status":"Free Order","ticket revenue (usd)":0.0,"eventbrite fees (usd)":0.0,"billing state":null,"order id":120904317,"date":{"end_time":"2012/11/02 00:00:00 -0400","original":"11/1/12","granularity":"day","time":"2012/11/01 00:00:00 -0400"},"last name":"Fee","type":"Free Order","billing address 1":null,"geo_score":0.0,"payment method":null,"notes":null,"billing address 2":null,"billing city":null,"event name":"JS.geo","tickets":0,"cc processing (usd)":0.0,"id":"ab7z9f7f0skp","first name":"James","email address":"jfee@weogeo.com","geo_precision":"","billing zip":null,"billing country":null},"type":"Feature","geometry":null},{"properties":{"gross revenue (usd)":0.0,"status":"Free Order","ticket revenue (usd)":0.0,"eventbrite fees (usd)":0.0,"billing state":null,"order id":120906503,"date":{"end_time":"2012/11/02 00:00:00 -0400","original":"11/1/12","granularity":"day","time":"2012/11/01 00:00:00 -0400"},"last name":"Heberton","type":"Free Order","billing address 1":null,"geo_score":0.0,"payment method":null,"notes":null,"billing address 2":null,"billing city":null,"event name":"JS.geo","tickets":1,"cc processing (usd)":0.0,"id":"ab7z9f8lu2mx","first name":"Brendan","email address":"brendan.heberton@gmail.com","geo_precision":"","billing zip":null,"billing country":null},"type":"Feature","geometry":null},{"properties":{"gross revenue (usd)":0.0,"status":"Free Order","ticket revenue (usd)":0.0,"eventbrite fees (usd)":0.0,"billing state":null,"order id":120906709,"date":{"end_time":"2012/11/02 00:00:00 -0400","original":"11/1/12","granularity":"day","time":"2012/11/01 00:00:00 -0400"},"last name":"Bouwman","type":"Free Order","billing address 1":null,"geo_score":0.0,"payment method":null,"notes":null,"billing address 2":null,"billing city":null,"event name":"JS.geo","tickets":2,"cc processing (usd)":0.0,"id":"ab7z9f9ri8gc","first name":"Dave","email address":"dbouwman@dtsagile.com","geo_precision":"","billing zip":null,"billing country":null},"type":"Feature","geometry":null},{"properties":{"gross revenue (usd)":11.54,"status":"Eventbrite Completed","ticket revenue (usd)":10.0,"eventbrite fees (usd)":1.24,"billing state":"CO","order id":120919587,"date":{"end_time":"2012/11/02 00:00:00 -0400","original":"11/1/12","granularity":"day","time":"2012/11/01 00:00:00 -0400"},"last name":"Taraschuk","type":"Credit Card","billing address 1":"9481 E.Mansfield Ave","geo_score":0.316,"payment method":"Visa - XXXX-XXXXXX-9300","notes":null,"billing address 2":"9481 E.Mansfield Ave","billing city":"Aurora","event name":"JS.geo","tickets":1,"cc processing (usd)":0.3,"id":"ab7z9f83hwzl","first name":"Andrei","email address":"andrei.taraschuk@gmail.com","geo_precision":"street","billing zip":"80014","billing country":"US"},"type":"Feature","geometry":{"type":"Point","coordinates":[-104.732759,39.645568]}},{"properties":{"gross revenue (usd)":11.54,"status":"Eventbrite Completed","ticket revenue (usd)":10.0,"eventbrite fees (usd)":1.24,"billing state":"CO","order id":120926593,"date":{"end_time":"2012/11/02 00:00:00 -0400","original":"11/1/12","granularity":"day","time":"2012/11/01 00:00:00 -0400"},"last name":"Sanford","type":"Credit Card","billing address 1":"7910 S Bemis St","geo_score":1.0,"payment method":"Visa - XXXX-XXXXXX-8044","notes":null,"billing address 2":null,"billing city":"Littleton","event name":"JS.geo","tickets":1,"cc processing (usd)":0.3,"id":"ab7z9fh9wen1","first name":"Jason","email address":"jasonsanford@gmail.com","geo_precision":"range","billing zip":"80120","billing country":"US"},"type":"Feature","geometry":{"type":"Point","coordinates":[-105.014159,39.573047]}},{"properties":{"gross revenue (usd)":11.54,"status":"Eventbrite Completed","ticket revenue (usd)":10.0,"eventbrite fees (usd)":1.24,"billing state":"CO","order id":120945043,"date":{"end_time":"2012/11/02 00:00:00 -0400","original":"11/1/12","granularity":"day","time":"2012/11/01 00:00:00 -0400"},"last name":"Giddens","type":"Credit Card","billing address 1":"8121 W Eastman Pl","geo_score":0.915,"payment method":"Visa - XXXX-XXXXXX-7864","notes":null,"billing address 2":"Unit 12-201","billing city":"Lakewood","event name":"JS.geo","tickets":1,"cc processing (usd)":0.3,"id":"ab7z9fgbfamp","first name":"Michael","email address":"mikegiddens@silverbiology.com","geo_precision":"range","billing zip":"80227","billing country":"US"},"type":"Feature","geometry":{"type":"Point","coordinates":[-105.086673,39.658493]}},{"properties":{"gross revenue (usd)":11.54,"status":"Eventbrite Completed","ticket revenue (usd)":10.0,"eventbrite fees (usd)":1.24,"billing state":"CO","order id":120975735,"date":{"end_time":"2012/11/02 00:00:00 -0400","original":"11/1/12","granularity":"day","time":"2012/11/01 00:00:00 -0400"},"last name":"Krueger","type":"Credit Card","billing address 1":null,"geo_score":0.857,"payment method":"MasterCard - XXXX-XXXXXX-6580","notes":null,"billing address 2":null,"billing city":null,"event name":"JS.geo","tickets":1,"cc processing (usd)":0.3,"id":"ab7z9fje4pbd","first name":"John","email address":"jtmkrueger@gmail.com","geo_precision":"zip","billing zip":"80203","billing country":"US"},"type":"Feature","geometry":{"type":"Point","coordinates":[-104.970331,39.729205]}},{"properties":{"gross revenue (usd)":11.54,"status":"Eventbrite Completed","ticket revenue (usd)":10.0,"eventbrite fees (usd)":1.24,"billing state":"CO","order id":121054109,"date":{"end_time":"2012/11/02 00:00:00 -0400","original":"11/1/12","granularity":"day","time":"2012/11/01 00:00:00 -0400"},"last name":"Rice","type":"Credit Card","billing address 1":"4142 Vrain Street","geo_score":1.0,"payment method":"Visa - XXXX-XXXXXX-8562","notes":null,"billing address 2":null,"billing city":"Denver","event name":"JS.geo","tickets":1,"cc processing (usd)":0.3,"id":"ab7z9f7lbjpf","first name":"Christopher","email address":"chris.rice@colocarto.com","geo_precision":"range","billing zip":"80212","billing country":"US"},"type":"Feature","geometry":{"type":"Point","coordinates":[-105.046202,39.774374]}},{"properties":{"gross revenue (usd)":11.54,"status":"Eventbrite Completed","ticket revenue (usd)":10.0,"eventbrite fees (usd)":1.24,"billing state":"CO","order id":121073025,"date":{"end_time":"2012/11/02 00:00:00 -0400","original":"11/1/12","granularity":"day","time":"2012/11/01 00:00:00 -0400"},"last name":"Batty","type":"Credit Card","billing address 1":"1792 Wynkoop St, #508","geo_score":0.512,"payment method":"Visa - XXXX-XXXXXX-7375","notes":null,"billing address 2":null,"billing city":"Denver","event name":"JS.geo","tickets":1,"cc processing (usd)":0.3,"id":"ab7z9fcjxyl7","first name":"Peter","email address":"peter@ebatty.com","geo_precision":"street","billing zip":"80202","billing country":"US"},"type":"Feature","geometry":{"type":"Point","coordinates":[-105.002116,39.750954]}},{"properties":{"gross revenue (usd)":11.54,"status":"Eventbrite Completed","ticket revenue (usd)":10.0,"eventbrite fees (usd)":1.24,"billing state":"UT","order id":121082463,"date":{"end_time":"2012/11/02 00:00:00 -0400","original":"11/1/12","granularity":"day","time":"2012/11/01 00:00:00 -0400"},"last name":"VAN EXEL","type":"Credit Card","billing address 1":"1109 1ST AVE","geo_score":0.87,"payment method":"Visa - XXXX-XXXXXX-7648","notes":null,"billing address 2":"#2","billing city":"SALT LAKE CITY","event name":"JS.geo","tickets":1,"cc processing (usd)":0.3,"id":"ab7z9f7v5mkb","first name":"MARTIJN","email address":"m@rtijn.org","geo_precision":"range","billing zip":"84103","billing country":"US"},"type":"Feature","geometry":{"type":"Point","coordinates":[-111.855266,40.770634]}},{"properties":{"gross revenue (usd)":23.08,"status":"Eventbrite Completed","ticket revenue (usd)":20.0,"eventbrite fees (usd)":2.48,"billing state":"CO","order id":121140859,"date":{"end_time":"2012/11/03 00:00:00 -0400","original":"11/2/12","granularity":"day","time":"2012/11/02 00:00:00 -0400"},"last name":"Kropp","type":"Credit Card","billing address 1":"1 Descombes Dr","geo_score":0.922,"payment method":"MasterCard - XXXX-XXXXXX-8956","notes":null,"billing address 2":null,"billing city":"Broomfield","event name":"JS.geo","tickets":2,"cc processing (usd)":0.6,"id":"ab7z9fgqj77h","first name":"Adrian","email address":"akropp@broomfield.org","geo_precision":"range","billing zip":"80020","billing country":"US"},"type":"Feature","geometry":{"type":"Point","coordinates":[-105.067076,39.919397]}},{"properties":{"gross revenue (usd)":11.54,"status":"Eventbrite Completed","ticket revenue (usd)":10.0,"eventbrite fees (usd)":1.24,"billing state":"VA","order id":121154935,"date":{"end_time":"2012/11/03 00:00:00 -0400","original":"11/2/12","granularity":"day","time":"2012/11/02 00:00:00 -0400"},"last name":"Webb","type":"Credit Card","billing address 1":"608 Settlement Dr","geo_score":0.806,"payment method":"American Express - XXXX-XXXXXX-X8109","notes":null,"billing address 2":"608 Settlement Dr","billing city":"Williamsburg","event name":"JS.geo","tickets":1,"cc processing (usd)":0.3,"id":"ab7z9fc9ibnk","first name":"Travis","email address":"travis@traviswebb.com","geo_precision":"street","billing zip":"23188","billing country":"US"},"type":"Feature","geometry":{"type":"Point","coordinates":[-76.729717,37.287917]}},{"properties":{"gross revenue (usd)":11.54,"status":"Eventbrite Completed","ticket revenue (usd)":10.0,"eventbrite fees (usd)":1.24,"billing state":"CA","order id":121176415,"date":{"end_time":"2012/11/03 00:00:00 -0400","original":"11/2/12","granularity":"day","time":"2012/11/02 00:00:00 -0400"},"last name":"Hiatt","type":"Credit Card","billing address 1":"178 Centre Street #11","geo_score":0.7,"payment method":"Visa - XXXX-XXXXXX-0480","notes":null,"billing address 2":null,"billing city":"Mountain View","event name":"JS.geo","tickets":1,"cc processing (usd)":0.3,"id":"ab7z9f94c12j","first name":"Cyrus","email address":"cyrusnhiatt@gmail.com","geo_precision":"range","billing zip":"94041","billing country":"US"},"type":"Feature","geometry":{"type":"Point","coordinates":[-122.071634,37.381297]}},{"properties":{"gross revenue (usd)":11.54,"status":"Eventbrite Completed","ticket revenue (usd)":10.0,"eventbrite fees (usd)":1.24,"billing state":"MT","order id":121234193,"date":{"end_time":"2012/11/03 00:00:00 -0400","original":"11/2/12","granularity":"day","time":"2012/11/02 00:00:00 -0400"},"last name":"Schaub","type":"Credit Card","billing address 1":"13770 Kelly Canyon Road","geo_score":1.0,"payment method":"Visa - XXXX-XXXXXX-5723","notes":null,"billing address 2":null,"billing city":"Bozeman","event name":"JS.geo","tickets":1,"cc processing (usd)":0.3,"id":"ab7z9fe2x0hg","first name":"Tim","email address":"tim.schaub@gmail.com","geo_precision":"range","billing zip":"59715","billing country":"US"},"type":"Feature","geometry":{"type":"Point","coordinates":[-110.914003,45.686707]}},{"properties":{"gross revenue (usd)":11.54,"status":"Eventbrite Completed","ticket revenue (usd)":10.0,"eventbrite fees (usd)":1.24,"billing state":"CO","order id":121638339,"date":{"end_time":"2012/11/05 00:00:00 -0500","original":"11/4/12","granularity":"day","time":"2012/11/04 00:00:00 -0400"},"last name":"Coats","type":"Credit Card","billing address 1":"517 E 4th Ave","geo_score":0.935,"payment method":"Visa - XXXX-XXXXXX-3405","notes":null,"billing address 2":"517 E 4th Ave","billing city":"Denver","event name":"JS.geo","tickets":1,"cc processing (usd)":0.3,"id":"ab7z9f6nzomx","first name":"Andrew","email address":"andrew.coats@gmail.com","geo_precision":"range","billing zip":"802034173","billing country":"US"},"type":"Feature","geometry":{"type":"Point","coordinates":[-104.980084,39.722584]}},{"properties":{"gross revenue (usd)":11.54,"status":"Eventbrite Completed","ticket revenue (usd)":10.0,"eventbrite fees (usd)":1.24,"billing state":"CO","order id":121980913,"date":{"end_time":"2012/11/06 00:00:00 -0500","original":"11/5/12","granularity":"day","time":"2012/11/05 00:00:00 -0500"},"last name":"Lewis","type":"Credit Card","billing address 1":"690 S. Pennsylvania Street","geo_score":0.597,"payment method":"American Express - XXXX-XXXXXX-X2014","notes":null,"billing address 2":null,"billing city":"Denver","event name":"JS.geo","tickets":1,"cc processing (usd)":0.3,"id":"ab7z9f4tuopf","first name":"Justin","email address":"j.mapping@gmail.com","geo_precision":"street","billing zip":"80209","billing country":"US"},"type":"Feature","geometry":{"type":"Point","coordinates":[-104.981468,39.71653]}},{"properties":{"gross revenue (usd)":11.54,"status":"Eventbrite Completed","ticket revenue (usd)":10.0,"eventbrite fees (usd)":1.24,"billing state":"CO","order id":122021147,"date":{"end_time":"2012/11/06 00:00:00 -0500","original":"11/5/12","granularity":"day","time":"2012/11/05 00:00:00 -0500"},"last name":"Tafel","type":"Credit Card","billing address 1":"790 Washington St #909","geo_score":0.707,"payment method":"Visa - XXXX-XXXXXX-4182","notes":null,"billing address 2":null,"billing city":"Denver","event name":"JS.geo","tickets":1,"cc processing (usd)":0.3,"id":"ab7z9faswezv","first name":"Michael","email address":"michael.tafel@gmail.com","geo_precision":"range","billing zip":"80203","billing country":"US"},"type":"Feature","geometry":{"type":"Point","coordinates":[-104.978754,39.731892]}},{"properties":{"gross revenue (usd)":11.54,"status":"Eventbrite Completed","ticket revenue (usd)":10.0,"eventbrite fees (usd)":1.24,"billing state":"CO","order id":122241979,"date":{"end_time":"2012/11/07 00:00:00 -0500","original":"11/6/12","granularity":"day","time":"2012/11/06 00:00:00 -0500"},"last name":"Hammond","type":"Credit Card","billing address 1":"1085 S Elizabeth St","geo_score":1.0,"payment method":"Visa - XXXX-XXXXXX-5144","notes":null,"billing address 2":null,"billing city":"Denver","event name":"JS.geo","tickets":1,"cc processing (usd)":0.3,"id":"ab7z9fjxya06","first name":"Chad","email address":"chad@chadhammond.com","geo_precision":"range","billing zip":"80209","billing country":"US"},"type":"Feature","geometry":{"type":"Point","coordinates":[-104.955893,39.698122]}},{"properties":{"gross revenue (usd)":11.54,"status":"Eventbrite Completed","ticket revenue (usd)":10.0,"eventbrite fees (usd)":1.24,"billing state":"CO","order id":122270767,"date":{"end_time":"2012/11/07 00:00:00 -0500","original":"11/6/12","granularity":"day","time":"2012/11/06 00:00:00 -0500"},"last name":"Irwin","type":"Credit Card","billing address 1":"4408 Decatur Street","geo_score":1.0,"payment method":"Visa - XXXX-XXXXXX-7814","notes":null,"billing address 2":null,"billing city":"Denver","event name":"JS.geo","tickets":1,"cc processing (usd)":0.3,"id":"ab7z9ffmt51r","first name":"Nate","email address":"nate_irwin@nps.gov","geo_precision":"range","billing zip":"80211","billing country":"US"},"type":"Feature","geometry":{"type":"Point","coordinates":[-105.021585,39.778265]}},{"properties":{"gross revenue (usd)":11.54,"status":"Eventbrite Completed","ticket revenue (usd)":10.0,"eventbrite fees (usd)":1.24,"billing state":"CO","order id":122413829,"date":{"end_time":"2012/11/08 00:00:00 -0500","original":"11/7/12","granularity":"day","time":"2012/11/07 00:00:00 -0500"},"last name":"Skulavik","type":"Credit Card","billing address 1":"2031 Willow Ct","geo_score":1.0,"payment method":"Visa - XXXX-XXXXXX-8420","notes":null,"billing address 2":null,"billing city":"Lakewood","event name":"JS.geo","tickets":1,"cc processing (usd)":0.3,"id":"ab7z9fi362bv","first name":"Jarrod","email address":"jarrod.skulavik@live.com","geo_precision":"range","billing zip":"80215","billing country":"US"},"type":"Feature","geometry":{"type":"Point","coordinates":[-105.13896,39.748065]}},{"properties":{"gross revenue (usd)":11.54,"status":"Eventbrite Completed","ticket revenue (usd)":10.0,"eventbrite fees (usd)":1.24,"billing state":"CO","order id":122840483,"date":{"end_time":"2012/11/09 00:00:00 -0500","original":"11/8/12","granularity":"day","time":"2012/11/08 00:00:00 -0500"},"last name":"Crawford","type":"Credit Card","billing address 1":"2148 South High Street","geo_score":0.585,"payment method":"American Express - XXXX-XXXXXX-X2005","notes":null,"billing address 2":null,"billing city":"Denver","event name":"JS.geo","tickets":1,"cc processing (usd)":0.3,"id":"ab7z9fk8egmx","first name":"Ethan","email address":"ethan.crawford@du.edu","geo_precision":"zip","billing zip":"80208","billing country":"US"},"type":"Feature","geometry":{"type":"Point","coordinates":[-104.408349,39.738752]}},{"properties":{"gross revenue (usd)":11.54,"status":"Eventbrite Completed","ticket revenue (usd)":10.0,"eventbrite fees (usd)":1.24,"billing state":"CO","order id":123157335,"date":{"end_time":"2012/11/10 00:00:00 -0500","original":"11/9/12","granularity":"day","time":"2012/11/09 00:00:00 -0500"},"last name":"Null","type":"Credit Card","billing address 1":"3025 Broadway #3","geo_score":0.415,"payment method":"Discover - XXXX-XXXXXX-2546","notes":null,"billing address 2":"3025 Broadway #3","billing city":"Boulder","event name":"JS.geo","tickets":1,"cc processing (usd)":0.3,"id":"ab7z9f94tiv6","first name":"Matt","email address":"hello@mattnull.com","geo_precision":"street","billing zip":"80304","billing country":"US"},"type":"Feature","geometry":{"type":"Point","coordinates":[-105.279624,40.01687]}},{"properties":{"gross revenue (usd)":317.49,"status":"Eventbrite Completed","ticket revenue (usd)":300.0,"eventbrite fees (usd)":8.49,"billing state":"CA","order id":123863505,"date":{"end_time":"2012/11/14 00:00:00 -0500","original":"11/13/12","granularity":"day","time":"2012/11/13 00:00:00 -0500"},"last name":"Wurtz","type":"Credit Card","billing address 1":"380 New York Street","geo_score":1.0,"payment method":"Visa - XXXX-XXXXXX-2817","notes":null,"billing address 2":null,"billing city":"Redlands","event name":"JS.geo","tickets":1,"cc processing (usd)":9.0,"id":"ab7z9f4vdtub","first name":"Rosie","email address":"rwurtz@esri.com","geo_precision":"range","billing zip":"92373","billing country":"US"},"type":"Feature","geometry":{"type":"Point","coordinates":[-117.19563,34.057167]}},{"properties":{"gross revenue (usd)":11.54,"status":"Eventbrite Completed","ticket revenue (usd)":10.0,"eventbrite fees (usd)":1.24,"billing state":"CO","order id":124132103,"date":{"end_time":"2012/11/15 00:00:00 -0500","original":"11/14/12","granularity":"day","time":"2012/11/14 00:00:00 -0500"},"last name":"Neufeld","type":"Credit Card","billing address 1":"318 CIRES, UCB216","geo_score":0.857,"payment method":"Visa - XXXX-XXXXXX-2023","notes":null,"billing address 2":null,"billing city":"Boulder","event name":"JS.geo","tickets":1,"cc processing (usd)":0.3,"id":"ab7z9f894acz","first name":"David","email address":"david.neufeld@noaa.gov","geo_precision":"zip","billing zip":"80309","billing country":"US"},"type":"Feature","geometry":{"type":"Point","coordinates":[-105.373507,40.087835]}},{"properties":{"gross revenue (usd)":11.54,"status":"Eventbrite Completed","ticket revenue (usd)":10.0,"eventbrite fees (usd)":1.24,"billing state":"CO","order id":124470853,"date":{"end_time":"2012/11/16 00:00:00 -0500","original":"11/15/12","granularity":"day","time":"2012/11/15 00:00:00 -0500"},"last name":"Tuttle","type":"Credit Card","billing address 1":"328 W Elm St","geo_score":1.0,"payment method":"Visa - XXXX-XXXXXX-7535","notes":null,"billing address 2":"328 W Elm St","billing city":"Louisville","event name":"JS.geo","tickets":1,"cc processing (usd)":0.3,"id":"ab7z9f6wlwyn","first name":"Ben","email address":"benjamin.tuttle@gmail.com","geo_precision":"range","billing zip":"80027","billing country":"US"},"type":"Feature","geometry":{"type":"Point","coordinates":[-105.144268,39.974566]}},{"properties":{"gross revenue (usd)":11.54,"status":"Eventbrite Completed","ticket revenue (usd)":10.0,"eventbrite fees (usd)":1.24,"billing state":"CO","order id":125121247,"date":{"end_time":"2012/11/20 00:00:00 -0500","original":"11/19/12","granularity":"day","time":"2012/11/19 00:00:00 -0500"},"last name":"Timoney","type":"Credit Card","billing address 1":"501 17th Street #1000","geo_score":0.707,"payment method":"Visa - XXXX-XXXXXX-5575","notes":null,"billing address 2":null,"billing city":"Denver","event name":"JS.geo","tickets":1,"cc processing (usd)":0.3,"id":"ab7z9f78nqom","first name":"Brian","email address":"brian@thetimoneygroup.com","geo_precision":"range","billing zip":"80202","billing country":"US"},"type":"Feature","geometry":{"type":"Point","coordinates":[-104.994448,39.748788]}},{"properties":{"gross revenue (usd)":11.54,"status":"Eventbrite Completed","ticket revenue (usd)":10.0,"eventbrite fees (usd)":1.24,"billing state":"CO","order id":125283243,"date":{"end_time":"2012/11/21 00:00:00 -0500","original":"11/20/12","granularity":"day","time":"2012/11/20 00:00:00 -0500"},"last name":"ennamorato","type":"Credit Card","billing address 1":"6770 E Harvard Ave","geo_score":1.0,"payment method":"Visa - XXXX-XXXXXX-1253","notes":null,"billing address 2":null,"billing city":"Denver","event name":"JS.geo","tickets":1,"cc processing (usd)":0.3,"id":"ab7z9fe89o9l","first name":"andy","email address":"virtualandy@gmail.com","geo_precision":"range","billing zip":"80224","billing country":"US"},"type":"Feature","geometry":{"type":"Point","coordinates":[-104.912508,39.670742]}},{"properties":{"gross revenue (usd)":11.54,"status":"Eventbrite Completed","ticket revenue (usd)":10.0,"eventbrite fees (usd)":1.24,"billing state":"CO","order id":125295615,"date":{"end_time":"2012/11/21 00:00:00 -0500","original":"11/20/12","granularity":"day","time":"2012/11/20 00:00:00 -0500"},"last name":"Burgett","type":"Credit Card","billing address 1":null,"geo_score":0.857,"payment method":"Visa - XXXX-XXXXXX-4077","notes":null,"billing address 2":null,"billing city":null,"event name":"JS.geo","tickets":1,"cc processing (usd)":0.3,"id":"ab7z9f7x3z0v","first name":"Tyler","email address":"Tyler.burgett@gmail.com","geo_precision":"zip","billing zip":"80218","billing country":"US"},"type":"Feature","geometry":{"type":"Point","coordinates":[-104.968759,39.720236]}},{"properties":{"gross revenue (usd)":11.54,"status":"Eventbrite Completed","ticket revenue (usd)":10.0,"eventbrite fees (usd)":1.24,"billing state":"CO","order id":125302921,"date":{"end_time":"2012/11/21 00:00:00 -0500","original":"11/20/12","granularity":"day","time":"2012/11/20 00:00:00 -0500"},"last name":"Serff","type":"Credit Card","billing address 1":"2910 S. Newark Pl","geo_score":0.61,"payment method":"Visa - XXXX-XXXXXX-1235","notes":null,"billing address 2":null,"billing city":"Aurora","event name":"JS.geo","tickets":1,"cc processing (usd)":0.3,"id":"ab7z9f815z0o","first name":"Andrew","email address":"andrew@serff.net","geo_precision":"street","billing zip":"80014","billing country":"US"},"type":"Feature","geometry":{"type":"Point","coordinates":[-104.852652,39.667033]}},{"properties":{"gross revenue (usd)":11.54,"status":"Eventbrite Completed","ticket revenue (usd)":10.0,"eventbrite fees (usd)":1.24,"billing state":"CA","order id":125391277,"date":{"end_time":"2012/11/21 00:00:00 -0500","original":"11/20/12","granularity":"day","time":"2012/11/20 00:00:00 -0500"},"last name":"Migurski","type":"Credit Card","billing address 1":"159 17th St. #1","geo_score":0.707,"payment method":"MasterCard - XXXX-XXXXXX-1525","notes":null,"billing address 2":null,"billing city":"Oakland","event name":"JS.geo","tickets":1,"cc processing (usd)":0.3,"id":"ab7z9fceh2fn","first name":"Michal","email address":"mike-eventbrite@teczno.com","geo_precision":"range","billing zip":"94612","billing country":"US"},"type":"Feature","geometry":{"type":"Point","coordinates":[-122.262394,37.804196]}},{"properties":{"gross revenue (usd)":11.54,"status":"Eventbrite Completed","ticket revenue (usd)":10.0,"eventbrite fees (usd)":1.24,"billing state":"CO","order id":125471591,"date":{"end_time":"2012/11/22 00:00:00 -0500","original":"11/21/12","granularity":"day","time":"2012/11/21 00:00:00 -0500"},"last name":"Philips","type":"Credit Card","billing address 1":"2229 Blake St #402","geo_score":0.512,"payment method":"Visa - XXXX-XXXXXX-4428","notes":null,"billing address 2":null,"billing city":"Denver","event name":"JS.geo","tickets":1,"cc processing (usd)":0.3,"id":"ab7z9fak2ctn","first name":"Luke","email address":"lukephilips@gmail.com","geo_precision":"street","billing zip":"80205","billing country":"US"},"type":"Feature","geometry":{"type":"Point","coordinates":[-104.993136,39.755233]}},{"properties":{"gross revenue (usd)":11.54,"status":"Eventbrite Completed","ticket revenue (usd)":10.0,"eventbrite fees (usd)":1.24,"billing state":"CO","order id":125477493,"date":{"end_time":"2012/11/22 00:00:00 -0500","original":"11/21/12","granularity":"day","time":"2012/11/21 00:00:00 -0500"},"last name":"Rohlman","type":"Credit Card","billing address 1":"1050 Cherokee St Apt 308","geo_score":0.877,"payment method":"Visa - XXXX-XXXXXX-0440","notes":null,"billing address 2":null,"billing city":"Denver","event name":"JS.geo","tickets":1,"cc processing (usd)":0.3,"id":"ab7z9fcfcx9t","first name":"Shilo","email address":"shilor@gmail.com","geo_precision":"range","billing zip":"80204","billing country":"US"},"type":"Feature","geometry":{"type":"Point","coordinates":[-104.991576,39.732936]}},{"properties":{"gross revenue (usd)":11.54,"status":"Eventbrite Completed","ticket revenue (usd)":10.0,"eventbrite fees (usd)":1.24,"billing state":"CO","order id":125480313,"date":{"end_time":"2012/11/22 00:00:00 -0500","original":"11/21/12","granularity":"day","time":"2012/11/21 00:00:00 -0500"},"last name":"Gillies","type":"Credit Card","billing address 1":"1609 Sheely Dr","geo_score":1.0,"payment method":"Visa - XXXX-XXXXXX-5607","notes":null,"billing address 2":null,"billing city":"Fort Collins","event name":"JS.geo","tickets":1,"cc processing (usd)":0.3,"id":"ab7z9f6o5w3h","first name":"Sean","email address":"sean.gillies@gmail.com","geo_precision":"range","billing zip":"80526","billing country":"US"},"type":"Feature","geometry":{"type":"Point","coordinates":[-105.091473,40.565714]}},{"properties":{"gross revenue (usd)":11.54,"status":"Eventbrite Completed","ticket revenue (usd)":10.0,"eventbrite fees (usd)":1.24,"billing state":"CO","order id":125482017,"date":{"end_time":"2012/11/22 00:00:00 -0500","original":"11/21/12","granularity":"day","time":"2012/11/21 00:00:00 -0500"},"last name":"Hauser","type":"Credit Card","billing address 1":"5988 S Glencoe Way","geo_score":0.912,"payment method":"Visa - XXXX-XXXXXX-2452","notes":null,"billing address 2":null,"billing city":"Centennial","event name":"JS.geo","tickets":1,"cc processing (usd)":0.3,"id":"ab7z9fj8lv60","first name":"Daniel","email address":"velocomp@comcast.net","geo_precision":"range","billing zip":"80121","billing country":"US"},"type":"Feature","geometry":{"type":"Point","coordinates":[-104.926975,39.607775]}},{"properties":{"gross revenue (usd)":11.54,"status":"Eventbrite Completed","ticket revenue (usd)":10.0,"eventbrite fees (usd)":1.24,"billing state":"CO","order id":125486357,"date":{"end_time":"2012/11/22 00:00:00 -0500","original":"11/21/12","granularity":"day","time":"2012/11/21 00:00:00 -0500"},"last name":"kunce","type":"Credit Card","billing address 1":null,"geo_score":0.714,"payment method":"Visa - XXXX-XXXXXX-4009","notes":null,"billing address 2":null,"billing city":null,"event name":"JS.geo","tickets":1,"cc processing (usd)":0.3,"id":"ab7z9f8xv9kk","first name":"Dale","email address":"dale.kunce@gmail.com","geo_precision":"zip","billing zip":"20910","billing country":"US"},"type":"Feature","geometry":{"type":"Point","coordinates":[-77.060533,39.022332]}},{"properties":{"gross revenue (usd)":11.54,"status":"Eventbrite Completed","ticket revenue (usd)":10.0,"eventbrite fees (usd)":1.24,"billing state":"CO","order id":125491237,"date":{"end_time":"2012/11/22 00:00:00 -0500","original":"11/21/12","granularity":"day","time":"2012/11/21 00:00:00 -0500"},"last name":"George","type":"Credit Card","billing address 1":"12210 Jones Park Ct","geo_score":0.963,"payment method":"Visa - XXXX-XXXXXX-0793","notes":null,"billing address 2":null,"billing city":"Colo SPrgs","event name":"JS.geo","tickets":1,"cc processing (usd)":0.3,"id":"ab7z9f5fk97c","first name":"Randy","email address":"rkgeorge@cadmaps.com","geo_precision":"range","billing zip":"80921","billing country":"US"},"type":"Feature","geometry":{"type":"Point","coordinates":[-104.797547,39.008248]}},{"properties":{"gross revenue (usd)":11.54,"status":"Eventbrite Completed","ticket revenue (usd)":10.0,"eventbrite fees (usd)":1.24,"billing state":"CA","order id":125519591,"date":{"end_time":"2012/11/22 00:00:00 -0500","original":"11/21/12","granularity":"day","time":"2012/11/21 00:00:00 -0500"},"last name":"Toms","type":"Credit Card","billing address 1":"832 Page St","geo_score":1.0,"payment method":"Visa - XXXX-XXXXXX-2160","notes":null,"billing address 2":null,"billing city":"San Francisco","event name":"JS.geo","tickets":1,"cc processing (usd)":0.3,"id":"ab7z9f7417cn","first name":"Silas","email address":"silasmerlin@yahoo.com","geo_precision":"range","billing zip":"94117","billing country":"US"},"type":"Feature","geometry":{"type":"Point","coordinates":[-122.435151,37.772558]}},{"properties":{"gross revenue (usd)":11.54,"status":"Eventbrite Completed","ticket revenue (usd)":10.0,"eventbrite fees (usd)":1.24,"billing state":"CO","order id":125519581,"date":{"end_time":"2012/11/22 00:00:00 -0500","original":"11/21/12","granularity":"day","time":"2012/11/21 00:00:00 -0500"},"last name":"Youngerman","type":"Credit Card","billing address 1":"9836 Foxhill Circle","geo_score":0.585,"payment method":"Discover - XXXX-XXXXXX-3693","notes":null,"billing address 2":null,"billing city":"Highlands Ranch","event name":"JS.geo","tickets":1,"cc processing (usd)":0.3,"id":"ab7z9ff6ihbl","first name":"David","email address":"dlyoungerman@gmail.com","geo_precision":"zip","billing zip":"80129","billing country":"US"},"type":"Feature","geometry":{"type":"Point","coordinates":[-105.011797,39.545917]}},{"properties":{"gross revenue (usd)":11.54,"status":"Eventbrite Completed","ticket revenue (usd)":10.0,"eventbrite fees (usd)":1.24,"billing state":"CA","order id":125522523,"date":{"end_time":"2012/11/22 00:00:00 -0500","original":"11/21/12","granularity":"day","time":"2012/11/21 00:00:00 -0500"},"last name":"Selim","type":"Credit Card","billing address 1":"1373 11th Ave","geo_score":0.927,"payment method":"Visa - XXXX-XXXXXX-3376","notes":null,"billing address 2":null,"billing city":"San Francisco","event name":"JS.geo","tickets":1,"cc processing (usd)":0.3,"id":"ab7z9fc2d80d","first name":"Sacha","email address":"sacha.selim@icfi.com","geo_precision":"range","billing zip":"94122","billing country":"US"},"type":"Feature","geometry":{"type":"Point","coordinates":[-122.468471,37.763445]}},{"properties":{"gross revenue (usd)":11.54,"status":"Eventbrite Completed","ticket revenue (usd)":10.0,"eventbrite fees (usd)":1.24,"billing state":"MD","order id":125528893,"date":{"end_time":"2012/11/22 00:00:00 -0500","original":"11/21/12","granularity":"day","time":"2012/11/21 00:00:00 -0500"},"last name":"Hogan","type":"Credit Card","billing address 1":"1315 Webster St","geo_score":1.0,"payment method":"Visa - XXXX-XXXXXX-5636","notes":null,"billing address 2":null,"billing city":"Baltimore","event name":"JS.geo","tickets":1,"cc processing (usd)":0.3,"id":"ab7z9f4t348b","first name":"Christopher","email address":"Chris@CartoLabs.com","geo_precision":"range","billing zip":"21230","billing country":"US"},"type":"Feature","geometry":{"type":"Point","coordinates":[-76.603566,39.273397]}},{"properties":{"gross revenue (usd)":11.54,"status":"Eventbrite Refunded","ticket revenue (usd)":10.0,"eventbrite fees (usd)":1.24,"billing state":"OR","order id":125537869,"date":{"end_time":"2012/11/22 00:00:00 -0500","original":"11/21/12","granularity":"day","time":"2012/11/21 00:00:00 -0500"},"last name":"Kaul","type":"Credit Card","billing address 1":"5732 Broadway St.","geo_score":1.0,"payment method":"Visa - XXXX-XXXXXX-7557","notes":null,"billing address 2":null,"billing city":"West Linn","event name":"JS.geo","tickets":0,"cc processing (usd)":0.3,"id":"ab7z9fgtl3yo","first name":"Yale","email address":"yalestar@gmail.com","geo_precision":"range","billing zip":"97068","billing country":"US"},"type":"Feature","geometry":{"type":"Point","coordinates":[-122.617493,45.367125]}},{"properties":{"gross revenue (usd)":11.54,"status":"Eventbrite Completed","ticket revenue (usd)":10.0,"eventbrite fees (usd)":1.24,"billing state":"CO","order id":125545049,"date":{"end_time":"2012/11/22 00:00:00 -0500","original":"11/21/12","granularity":"day","time":"2012/11/21 00:00:00 -0500"},"last name":"Glen","type":"Credit Card","billing address 1":null,"geo_score":0.857,"payment method":"Visa - XXXX-XXXXXX-8802","notes":null,"billing address 2":null,"billing city":null,"event name":"JS.geo","tickets":1,"cc processing (usd)":0.3,"id":"ab7z9f802ep7","first name":"Allan","email address":"allan@allanglen.com","geo_precision":"zip","billing zip":"80127","billing country":"US"},"type":"Feature","geometry":{"type":"Point","coordinates":[-105.153074,39.544307]}},{"properties":{"gross revenue (usd)":11.54,"status":"Eventbrite Completed","ticket revenue (usd)":10.0,"eventbrite fees (usd)":1.24,"billing state":"CO","order id":125563277,"date":{"end_time":"2012/11/22 00:00:00 -0500","original":"11/21/12","granularity":"day","time":"2012/11/21 00:00:00 -0500"},"last name":"McAndrew","type":"Credit Card","billing address 1":"1231 Downing Street #302","geo_score":0.707,"payment method":"Visa - XXXX-XXXXXX-4686","notes":null,"billing address 2":null,"billing city":"Denver","event name":"JS.geo","tickets":1,"cc processing (usd)":0.3,"id":"ab7z9fivyggs","first name":"Jim","email address":"jim@loc8.us","geo_precision":"range","billing zip":"80218","billing country":"US"},"type":"Feature","geometry":{"type":"Point","coordinates":[-104.972835,39.721914]}},{"properties":{"gross revenue (usd)":11.54,"status":"Eventbrite Completed","ticket revenue (usd)":10.0,"eventbrite fees (usd)":1.24,"billing state":"CA","order id":125784637,"date":{"end_time":"2012/11/24 00:00:00 -0500","original":"11/23/12","granularity":"day","time":"2012/11/23 00:00:00 -0500"},"last name":"Fitzsimmons","type":"Credit Card","billing address 1":"1259 Lendrum Ct.","geo_score":1.0,"payment method":"Visa - XXXX-XXXXXX-8164","notes":null,"billing address 2":"Apt. B","billing city":"San Francisco","event name":"JS.geo","tickets":1,"cc processing (usd)":0.3,"id":"ab7z9fgetmtg","first name":"Seth","email address":"seth@mojodna.net","geo_precision":"range","billing zip":"94129","billing country":"US"},"type":"Feature","geometry":{"type":"Point","coordinates":[-122.471112,37.805085]}},{"properties":{"gross revenue (usd)":11.54,"status":"Eventbrite Completed","ticket revenue (usd)":10.0,"eventbrite fees (usd)":1.24,"billing state":"IN","order id":126056995,"date":{"end_time":"2012/11/27 00:00:00 -0500","original":"11/26/12","granularity":"day","time":"2012/11/26 00:00:00 -0500"},"last name":"Steadman","type":"Credit Card","billing address 1":"265 Ivy Hill Dr","geo_score":1.0,"payment method":"Visa - XXXX-XXXXXX-4040","notes":null,"billing address 2":null,"billing city":"Lawrenceburg","event name":"JS.geo","tickets":1,"cc processing (usd)":0.3,"id":"ab7z9fcl7rl8","first name":"Laura","email address":"lauramsteadman@gmail.com","geo_precision":"range","billing zip":"47025","billing country":"US"},"type":"Feature","geometry":{"type":"Point","coordinates":[-84.825251,39.162369]}},{"properties":{"gross revenue (usd)":11.54,"status":"Eventbrite Completed","ticket revenue (usd)":10.0,"eventbrite fees (usd)":1.24,"billing state":"CO","order id":126111867,"date":{"end_time":"2012/11/27 00:00:00 -0500","original":"11/26/12","granularity":"day","time":"2012/11/26 00:00:00 -0500"},"last name":"Sawatzky","type":"Credit Card","billing address 1":"4575 Martin Drive","geo_score":1.0,"payment method":"MasterCard - XXXX-XXXXXX-2918","notes":null,"billing address 2":null,"billing city":"Boulder","event name":"JS.geo","tickets":1,"cc processing (usd)":0.3,"id":"ab7z9ffoujpf","first name":"Alfred","email address":"alfred.sawatzky@gmail.com","geo_precision":"range","billing zip":"80305","billing country":"US"},"type":"Feature","geometry":{"type":"Point","coordinates":[-105.241787,39.987223]}},{"properties":{"gross revenue (usd)":11.54,"status":"Eventbrite Completed","ticket revenue (usd)":10.0,"eventbrite fees (usd)":1.24,"billing state":"MD","order id":126155991,"date":{"end_time":"2012/11/27 00:00:00 -0500","original":"11/26/12","granularity":"day","time":"2012/11/26 00:00:00 -0500"},"last name":"Heinrich","type":"Credit Card","billing address 1":"7431 Brandenburg Cir","geo_score":1.0,"payment method":"Discover - XXXX-XXXXXX-8819","notes":null,"billing address 2":null,"billing city":"Sykesville","event name":"JS.geo","tickets":1,"cc processing (usd)":0.3,"id":"ab7z9fge1lc5","first name":"Steven","email address":"steven.heinrich@gmail.com","geo_precision":"range","billing zip":"21784","billing country":"US"},"type":"Feature","geometry":{"type":"Point","coordinates":[-76.980826,39.36895]}},{"properties":{"gross revenue (usd)":11.54,"status":"Eventbrite Completed","ticket revenue (usd)":10.0,"eventbrite fees (usd)":1.24,"billing state":"CO","order id":126320293,"date":{"end_time":"2012/11/28 00:00:00 -0500","original":"11/27/12","granularity":"day","time":"2012/11/27 00:00:00 -0500"},"last name":"Drummond","type":"Credit Card","billing address 1":"810 10th Street","geo_score":0.916,"payment method":"Visa - XXXX-XXXXXX-9670","notes":null,"billing address 2":null,"billing city":"Golden","event name":"JS.geo","tickets":1,"cc processing (usd)":0.3,"id":"ab7z9fhgvzc3","first name":"Eric","email address":"ericdrummond@gmail.com","geo_precision":"range","billing zip":"80401","billing country":"US"},"type":"Feature","geometry":{"type":"Point","coordinates":[-105.224373,39.757041]}},{"properties":{"gross revenue (usd)":11.54,"status":"Eventbrite Completed","ticket revenue (usd)":10.0,"eventbrite fees (usd)":1.24,"billing state":"CO","order id":126458331,"date":{"end_time":"2012/11/28 00:00:00 -0500","original":"11/27/12","granularity":"day","time":"2012/11/27 00:00:00 -0500"},"last name":"Hinke","type":"Credit Card","billing address 1":"2107 North Fork Drive","geo_score":0.967,"payment method":"MasterCard - XXXX-XXXXXX-1814","notes":null,"billing address 2":null,"billing city":"Lafayette","event name":"JS.geo","tickets":1,"cc processing (usd)":0.3,"id":"ab7z9fj6zr5y","first name":"Michael","email address":"michael.hinke@ucdenver.edu","geo_precision":"range","billing zip":"80026","billing country":"US"},"type":"Feature","geometry":{"type":"Point","coordinates":[-105.117744,39.999423]}},{"properties":{"gross revenue (usd)":11.54,"status":"Eventbrite Completed","ticket revenue (usd)":10.0,"eventbrite fees (usd)":1.24,"billing state":"CO","order id":126472959,"date":{"end_time":"2012/11/28 00:00:00 -0500","original":"11/27/12","granularity":"day","time":"2012/11/27 00:00:00 -0500"},"last name":"Moreno","type":"Credit Card","billing address 1":"1121 Utica Ave","geo_score":1.0,"payment method":"MasterCard - XXXX-XXXXXX-9241","notes":null,"billing address 2":null,"billing city":"Boulder","event name":"JS.geo","tickets":1,"cc processing (usd)":0.3,"id":"ab7z9fgqwy0x","first name":"Rafael","email address":"Rafael.Moreno@ucdenver.edu","geo_precision":"range","billing zip":"80304","billing country":"US"},"type":"Feature","geometry":{"type":"Point","coordinates":[-105.282165,40.052329]}},{"properties":{"gross revenue (usd)":11.54,"status":"Eventbrite Completed","ticket revenue (usd)":10.0,"eventbrite fees (usd)":1.24,"billing state":"CA","order id":126883827,"date":{"end_time":"2012/11/30 00:00:00 -0500","original":"11/29/12","granularity":"day","time":"2012/11/29 00:00:00 -0500"},"last name":"Swingley","type":"Credit Card","billing address 1":"380 New York Street","geo_score":1.0,"payment method":"Visa - XXXX-XXXXXX-2362","notes":null,"billing address 2":null,"billing city":"Redlands","event name":"JS.geo","tickets":1,"cc processing (usd)":0.3,"id":"ab7z9fkemq1f","first name":"Derek","email address":"DSWINGLEY@ESRI.COM","geo_precision":"range","billing zip":"92373","billing country":"US"},"type":"Feature","geometry":{"type":"Point","coordinates":[-117.19563,34.057167]}},{"properties":{"gross revenue (usd)":11.54,"status":"Eventbrite Completed","ticket revenue (usd)":10.0,"eventbrite fees (usd)":1.24,"billing state":"CA","order id":126884805,"date":{"end_time":"2012/11/30 00:00:00 -0500","original":"11/29/12","granularity":"day","time":"2012/11/29 00:00:00 -0500"},"last name":"Bartley","type":"Credit Card","billing address 1":"380 New York Street","geo_score":1.0,"payment method":"Visa - XXXX-XXXXXX-2362","notes":null,"billing address 2":null,"billing city":"Redlands","event name":"JS.geo","tickets":1,"cc processing (usd)":0.3,"id":"ab7z9fk7gqz4","first name":"Jeremy","email address":"JBARTLEY@ESRI.COM","geo_precision":"range","billing zip":"92373","billing country":"US"},"type":"Feature","geometry":{"type":"Point","coordinates":[-117.19563,34.057167]}},{"properties":{"gross revenue (usd)":11.54,"status":"Eventbrite Completed","ticket revenue (usd)":10.0,"eventbrite fees (usd)":1.24,"billing state":"MO","order id":127151861,"date":{"end_time":"2012/12/01 00:00:00 -0500","original":"11/30/12","granularity":"day","time":"2012/11/30 00:00:00 -0500"},"last name":"Tutt","type":"Credit Card","billing address 1":"4344 Connecticut St.","geo_score":0.965,"payment method":"Visa - XXXX-XXXXXX-1821","notes":null,"billing address 2":null,"billing city":"St. Louis","event name":"JS.geo","tickets":1,"cc processing (usd)":0.3,"id":"ab7z9f99g3ky","first name":"Eleanor","email address":"eleanor.tutt@gmail.com","geo_precision":"range","billing zip":"63116","billing country":"US"},"type":"Feature","geometry":{"type":"Point","coordinates":[-90.263323,38.601741]}},{"properties":{"gross revenue (usd)":11.54,"status":"Eventbrite Completed","ticket revenue (usd)":10.0,"eventbrite fees (usd)":1.24,"billing state":"CO","order id":127152513,"date":{"end_time":"2012/12/01 00:00:00 -0500","original":"11/30/12","granularity":"day","time":"2012/11/30 00:00:00 -0500"},"last name":"Angelino","type":"Credit Card","billing address 1":"2391 Braun Dr","geo_score":0.878,"payment method":"MasterCard - XXXX-XXXXXX-1660","notes":null,"billing address 2":null,"billing city":"Golden","event name":"JS.geo","tickets":1,"cc processing (usd)":0.3,"id":"ab7z9fbvpabe","first name":"Paul","email address":"pangelino@comcast.net","geo_precision":"range","billing zip":"80401","billing country":"US"},"type":"Feature","geometry":{"type":"Point","coordinates":[-105.148855,39.75169]}},{"properties":{"gross revenue (usd)":11.54,"status":"Eventbrite Completed","ticket revenue (usd)":10.0,"eventbrite fees (usd)":1.24,"billing state":"CO","order id":127541082,"date":{"end_time":"2012/12/04 00:00:00 -0500","original":"12/3/12","granularity":"day","time":"2012/12/03 00:00:00 -0500"},"last name":"Harahush","type":"Credit Card","billing address 1":"794 S Leyden St","geo_score":1.0,"payment method":"American Express - XXXX-XXXXXX-X1005","notes":null,"billing address 2":null,"billing city":"Denver","event name":"JS.geo","tickets":1,"cc processing (usd)":0.3,"id":"ab7z9f6d3nlu","first name":"Jonathan","email address":"jharahush@gmail.com","geo_precision":"range","billing zip":"80224","billing country":"US"},"type":"Feature","geometry":{"type":"Point","coordinates":[-104.915194,39.703786]}},{"properties":{"gross revenue (usd)":11.54,"status":"Eventbrite Completed","ticket revenue (usd)":10.0,"eventbrite fees (usd)":1.24,"billing state":"CO","order id":127683416,"date":{"end_time":"2012/12/04 00:00:00 -0500","original":"12/3/12","granularity":"day","time":"2012/12/03 00:00:00 -0500"},"last name":"Trone","type":"Credit Card","billing address 1":"1805 S Emerson St","geo_score":1.0,"payment method":"Visa - XXXX-XXXXXX-8704","notes":null,"billing address 2":null,"billing city":"Denver","event name":"JS.geo","tickets":1,"cc processing (usd)":0.3,"id":"ab7z9f8a3fvn","first name":"Daniel","email address":"royhobbstn@yahoo.com","geo_precision":"range","billing zip":"80210","billing country":"US"},"type":"Feature","geometry":{"type":"Point","coordinates":[-104.977006,39.682233]}},{"properties":{"gross revenue (usd)":11.54,"status":"Eventbrite Completed","ticket revenue (usd)":10.0,"eventbrite fees (usd)":1.24,"billing state":"CO","order id":127782236,"date":{"end_time":"2012/12/05 00:00:00 -0500","original":"12/4/12","granularity":"day","time":"2012/12/04 00:00:00 -0500"},"last name":"Noyle","type":"Credit Card","billing address 1":"350 Bannock Street","geo_score":0.435,"payment method":"Visa - XXXX-XXXXXX-8298","notes":null,"billing address 2":null,"billing city":"Fort Collins","event name":"JS.geo","tickets":1,"cc processing (usd)":0.3,"id":"ab7z9f8pacpq","first name":"Brian","email address":"brian.noyle@gmail.com","geo_precision":"street","billing zip":"80524","billing country":"US"},"type":"Feature","geometry":{"type":"Point","coordinates":[-105.658287,40.858728]}},{"properties":{"gross revenue (usd)":11.54,"status":"Eventbrite Completed","ticket revenue (usd)":10.0,"eventbrite fees (usd)":1.24,"billing state":"CO","order id":127782750,"date":{"end_time":"2012/12/05 00:00:00 -0500","original":"12/4/12","granularity":"day","time":"2012/12/04 00:00:00 -0500"},"last name":"Cutrell","type":"Credit Card","billing address 1":"1151 Mircos St","geo_score":0.48,"payment method":"Visa - XXXX-XXXXXX-0046","notes":null,"billing address 2":null,"billing city":"Erie","event name":"JS.geo","tickets":1,"cc processing (usd)":0.3,"id":"ab7z9fdl69oi","first name":"Max","email address":"max.cutrell@gmail.com","geo_precision":"street","billing zip":"80516","billing country":"US"},"type":"Feature","geometry":{"type":"Point","coordinates":[-105.519211,40.353445]}},{"properties":{"gross revenue (usd)":11.54,"status":"Eventbrite Completed","ticket revenue (usd)":10.0,"eventbrite fees (usd)":1.24,"billing state":"CO","order id":128005140,"date":{"end_time":"2012/12/06 00:00:00 -0500","original":"12/5/12","granularity":"day","time":"2012/12/05 00:00:00 -0500"},"last name":"SINGH","type":"Credit Card","billing address 1":"6398 E 134TH AVE","geo_score":0.61,"payment method":"Visa - XXXX-XXXXXX-7292","notes":null,"billing address 2":null,"billing city":"THORNTON","event name":"JS.geo","tickets":1,"cc processing (usd)":0.3,"id":"ab7z9f8yiyhl","first name":"RAJIV","email address":"Rajiv.Singh@Level3.com","geo_precision":"street","billing zip":"80602","billing country":"US"},"type":"Feature","geometry":{"type":"Point","coordinates":[-104.818301,39.939654]}},{"properties":{"gross revenue (usd)":11.54,"status":"Eventbrite Completed","ticket revenue (usd)":10.0,"eventbrite fees (usd)":1.24,"billing state":"CO","order id":128014768,"date":{"end_time":"2012/12/06 00:00:00 -0500","original":"12/5/12","granularity":"day","time":"2012/12/05 00:00:00 -0500"},"last name":"KUMAR","type":"Credit Card","billing address 1":"1152 S Davenport Ct","geo_score":1.0,"payment method":"American Express - XXXX-XXXXXX-X0948","notes":null,"billing address 2":null,"billing city":"Erie","event name":"JS.geo","tickets":1,"cc processing (usd)":0.3,"id":"ab7z9fjqs2ub","first name":"SANJIV","email address":"sanjiv221@yahoo.com","geo_precision":"range","billing zip":"80516","billing country":"US"},"type":"Feature","geometry":{"type":"Point","coordinates":[-105.067582,40.060977]}},{"properties":{"gross revenue (usd)":11.54,"status":"Eventbrite Completed","ticket revenue (usd)":10.0,"eventbrite fees (usd)":1.24,"billing state":"FL","order id":128253522,"date":{"end_time":"2012/12/07 00:00:00 -0500","original":"12/6/12","granularity":"day","time":"2012/12/06 00:00:00 -0500"},"last name":"Stofan","type":"Credit Card","billing address 1":"1777 87th Terrace North","geo_score":0.941,"payment method":"MasterCard - XXXX-XXXXXX-3143","notes":null,"billing address 2":"1777 87th Terrace North","billing city":"Saint Petersburg","event name":"JS.geo","tickets":1,"cc processing (usd)":0.3,"id":"ab7z9fbuhjfr","first name":"Kevin","email address":"kevin.stofan@gmail.com","geo_precision":"range","billing zip":"33702","billing country":"US"},"type":"Feature","geometry":{"type":"Point","coordinates":[-82.656164,27.851576]}},{"properties":{"gross revenue (usd)":11.54,"status":"Eventbrite Completed","ticket revenue (usd)":10.0,"eventbrite fees (usd)":1.24,"billing state":"CO","order id":128341004,"date":{"end_time":"2012/12/07 00:00:00 -0500","original":"12/6/12","granularity":"day","time":"2012/12/06 00:00:00 -0500"},"last name":"Hanifen","type":"Credit Card","billing address 1":"4215 Balsam St.","geo_score":1.0,"payment method":"Visa - XXXX-XXXXXX-4838","notes":null,"billing address 2":null,"billing city":"Wheat Ridge","event name":"JS.geo","tickets":1,"cc processing (usd)":0.3,"id":"ab7z9f8up79g","first name":"James","email address":"jhanifen@gmail.com","geo_precision":"range","billing zip":"80033","billing country":"US"},"type":"Feature","geometry":{"type":"Point","coordinates":[-105.088513,39.77524]}},{"properties":{"gross revenue (usd)":11.54,"status":"Eventbrite Completed","ticket revenue (usd)":10.0,"eventbrite fees (usd)":1.24,"billing state":"CO","order id":128342084,"date":{"end_time":"2012/12/07 00:00:00 -0500","original":"12/6/12","granularity":"day","time":"2012/12/06 00:00:00 -0500"},"last name":"Steitle","type":"Credit Card","billing address 1":"1401 E Girard Pl","geo_score":1.0,"payment method":"Visa - XXXX-XXXXXX-5319","notes":null,"billing address 2":null,"billing city":"Englewood","event name":"JS.geo","tickets":1,"cc processing (usd)":0.3,"id":"ab7z9fcqscs2","first name":"Matthew","email address":"matt.steitle@mapmyfitness.com","geo_precision":"range","billing zip":"80113","billing country":"US"},"type":"Feature","geometry":{"type":"Point","coordinates":[-104.967745,39.654198]}},{"properties":{"gross revenue (usd)":11.54,"status":"Eventbrite Completed","ticket revenue (usd)":10.0,"eventbrite fees (usd)":1.24,"billing state":"KY","order id":128353740,"date":{"end_time":"2012/12/07 00:00:00 -0500","original":"12/6/12","granularity":"day","time":"2012/12/06 00:00:00 -0500"},"last name":"Poorthuis","type":"Credit Card","billing address 1":"437 W Second St. #3","geo_score":0.514,"payment method":"American Express - XXXX-XXXXXX-X1018","notes":null,"billing address 2":"437 W Second St. #3","billing city":"Lexington","event name":"JS.geo","tickets":1,"cc processing (usd)":0.3,"id":"ab7z9fgboeds","first name":"Ate","email address":"ate.poorthuis@uky.edu","geo_precision":"street","billing zip":"40507","billing country":"US"},"type":"Feature","geometry":{"type":"Point","coordinates":[-84.49528,38.049004]}},{"properties":{"gross revenue (usd)":11.54,"status":"Eventbrite Completed","ticket revenue (usd)":10.0,"eventbrite fees (usd)":1.24,"billing state":"MD","order id":128477052,"date":{"end_time":"2012/12/08 00:00:00 -0500","original":"12/7/12","granularity":"day","time":"2012/12/07 00:00:00 -0500"},"last name":"Dollins","type":"Credit Card","billing address 1":"38060 Cheyenne Court","geo_score":1.0,"payment method":"MasterCard - XXXX-XXXXXX-8916","notes":null,"billing address 2":null,"billing city":"Charlotte Hall","event name":"JS.geo","tickets":1,"cc processing (usd)":0.3,"id":"ab7z9fi4p31g","first name":"William","email address":"bill@geomusings.com","geo_precision":"range","billing zip":"20622","billing country":"US"},"type":"Feature","geometry":{"type":"Point","coordinates":[-76.758095,38.50715]}},{"properties":{"gross revenue (usd)":11.54,"status":"Eventbrite Completed","ticket revenue (usd)":10.0,"eventbrite fees (usd)":1.24,"billing state":"MO","order id":128560388,"date":{"end_time":"2012/12/08 00:00:00 -0500","original":"12/7/12","granularity":"day","time":"2012/12/07 00:00:00 -0500"},"last name":"Lord-Castillo","type":"Credit Card","billing address 1":"14847 Ladue Bluffs Crossing Dr","geo_score":0.616,"payment method":"Visa - XXXX-XXXXXX-9131","notes":null,"billing address 2":null,"billing city":"Chesterfield","event name":"JS.geo","tickets":1,"cc processing (usd)":0.3,"id":"ab7z9fc4ap33","first name":"Brett","email address":"blord-castillo@stlouisco.com","geo_precision":"street","billing zip":"63017","billing country":"US"},"type":"Feature","geometry":{"type":"Point","coordinates":[-90.533993,38.669489]}},{"properties":{"gross revenue (usd)":11.54,"status":"Eventbrite Completed","ticket revenue (usd)":10.0,"eventbrite fees (usd)":1.24,"billing state":"CO","order id":128594862,"date":{"end_time":"2012/12/08 00:00:00 -0500","original":"12/7/12","granularity":"day","time":"2012/12/07 00:00:00 -0500"},"last name":"Turner","type":"Credit Card","billing address 1":null,"geo_score":0.0,"payment method":"MasterCard - XXXX-XXXXXX-5334","notes":null,"billing address 2":null,"billing city":null,"event name":"JS.geo","tickets":1,"cc processing (usd)":0.3,"id":"ab7z9fj3x5dh","first name":"Andrew","email address":"crisiscamp@highearthorbit.com","geo_precision":"unmatched","billing zip":null,"billing country":"US"},"type":"Feature","geometry":null},{"properties":{"gross revenue (usd)":11.54,"status":"Eventbrite Completed","ticket revenue (usd)":10.0,"eventbrite fees (usd)":1.24,"billing state":"CO","order id":128598838,"date":{"end_time":"2012/12/08 00:00:00 -0500","original":"12/7/12","granularity":"day","time":"2012/12/07 00:00:00 -0500"},"last name":"Algire","type":"Credit Card","billing address 1":null,"geo_score":0.714,"payment method":"Visa - XXXX-XXXXXX-6789","notes":null,"billing address 2":null,"billing city":null,"event name":"JS.geo","tickets":1,"cc processing (usd)":0.3,"id":"ab7z9fj4ttf1","first name":"Chris","email address":"Cobie8a@yahoo.com","geo_precision":"zip","billing zip":"22308","billing country":"US"},"type":"Feature","geometry":{"type":"Point","coordinates":[-77.066922,38.714004]}},{"properties":{"gross revenue (usd)":11.54,"status":"Eventbrite Completed","ticket revenue (usd)":10.0,"eventbrite fees (usd)":1.24,"billing state":"VA","order id":128849718,"date":{"end_time":"2012/12/11 00:00:00 -0500","original":"12/10/12","granularity":"day","time":"2012/12/10 00:00:00 -0500"},"last name":"LaForest","type":"Credit Card","billing address 1":"11303 Bulova Ln","geo_score":0.698,"payment method":"Visa - XXXX-XXXXXX-9432","notes":null,"billing address 2":null,"billing city":"Fairfax","event name":"JS.geo","tickets":1,"cc processing (usd)":0.3,"id":"ab7z9f7bslqb","first name":"William","email address":"will@10gen.com","geo_precision":"street","billing zip":"22030","billing country":"US"},"type":"Feature","geometry":{"type":"Point","coordinates":[-77.322259,38.839673]}},{"properties":{"gross revenue (usd)":34.62,"status":"Eventbrite Completed","ticket revenue (usd)":30.0,"eventbrite fees (usd)":3.72,"billing state":"WA","order id":128891968,"date":{"end_time":"2012/12/11 00:00:00 -0500","original":"12/10/12","granularity":"day","time":"2012/12/10 00:00:00 -0500"},"last name":"Slind","type":"Credit Card","billing address 1":"2208 NW Market Street","geo_score":1.0,"payment method":"Visa - XXXX-XXXXXX-2707","notes":null,"billing address 2":"Suite 202","billing city":"Seattle","event name":"JS.geo","tickets":3,"cc processing (usd)":0.9,"id":"ab7z9f66mjfo","first name":"Robert Todd","email address":"tslind@spatialdev.com","geo_precision":"range","billing zip":"98107","billing country":"US"},"type":"Feature","geometry":{"type":"Point","coordinates":[-122.386281,47.668753]}},{"properties":{"gross revenue (usd)":11.54,"status":"Eventbrite Completed","ticket revenue (usd)":10.0,"eventbrite fees (usd)":1.24,"billing state":"DC","order id":128940446,"date":{"end_time":"2012/12/11 00:00:00 -0500","original":"12/10/12","granularity":"day","time":"2012/12/10 00:00:00 -0500"},"last name":"White","type":"Credit Card","billing address 1":"1714 14th Street NW Rear","geo_score":0.842,"payment method":"American Express - XXXX-XXXXXX-X4035","notes":null,"billing address 2":null,"billing city":"washington","event name":"JS.geo","tickets":1,"cc processing (usd)":0.3,"id":"ab7z9f4gcpo1","first name":"Will","email address":"will@mapbox.com","geo_precision":"range","billing zip":"20009","billing country":"US"},"type":"Feature","geometry":{"type":"Point","coordinates":[-77.032027,38.912876]}},{"properties":{"gross revenue (usd)":11.54,"status":"Eventbrite Completed","ticket revenue (usd)":10.0,"eventbrite fees (usd)":1.24,"billing state":"NJ","order id":129078496,"date":{"end_time":"2012/12/12 00:00:00 -0500","original":"12/11/12","granularity":"day","time":"2012/12/11 00:00:00 -0500"},"last name":"Flood","type":"Credit Card","billing address 1":"2 Executive Drive","geo_score":0.585,"payment method":"Visa - XXXX-XXXXXX-4255","notes":null,"billing address 2":"Suite 200","billing city":"Somerset","event name":"JS.geo","tickets":1,"cc processing (usd)":0.3,"id":"ab7z9f6jsptw","first name":"Brian","email address":"bFlood@arc2earth.com","geo_precision":"zip","billing zip":"08873","billing country":"US"},"type":"Feature","geometry":{"type":"Point","coordinates":[-74.580712,40.501493]}},{"properties":{"gross revenue (usd)":11.54,"status":"Eventbrite Completed","ticket revenue (usd)":10.0,"eventbrite fees (usd)":1.24,"billing state":"CO","order id":129081822,"date":{"end_time":"2012/12/12 00:00:00 -0500","original":"12/11/12","granularity":"day","time":"2012/12/11 00:00:00 -0500"},"last name":"Quinby","type":"Credit Card","billing address 1":"2505 Clermont St","geo_score":1.0,"payment method":"MasterCard - XXXX-XXXXXX-8688","notes":null,"billing address 2":null,"billing city":"Denver","event name":"JS.geo","tickets":1,"cc processing (usd)":0.3,"id":"ab7z9f6tzflt","first name":"Ted","email address":"ted.quinby@gmail.com","geo_precision":"range","billing zip":"80207","billing country":"US"},"type":"Feature","geometry":{"type":"Point","coordinates":[-104.935098,39.754598]}},{"properties":{"gross revenue (usd)":11.54,"status":"Eventbrite Completed","ticket revenue (usd)":10.0,"eventbrite fees (usd)":1.24,"billing state":"CO","order id":129085304,"date":{"end_time":"2012/12/12 00:00:00 -0500","original":"12/11/12","granularity":"day","time":"2012/12/11 00:00:00 -0500"},"last name":"Sidor","type":"Credit Card","billing address 1":"727 E Cucharras St","geo_score":1.0,"payment method":"Visa - XXXX-XXXXXX-5638","notes":null,"billing address 2":null,"billing city":"Colorado Springs","event name":"JS.geo","tickets":1,"cc processing (usd)":0.3,"id":"ab7z9f5671s2","first name":"Matthew","email address":"seadour@gmail.com","geo_precision":"range","billing zip":"80903","billing country":"US"},"type":"Feature","geometry":{"type":"Point","coordinates":[-104.811229,38.830612]}},{"properties":{"gross revenue (usd)":11.54,"status":"Eventbrite Completed","ticket revenue (usd)":10.0,"eventbrite fees (usd)":1.24,"billing state":"NY","order id":129091192,"date":{"end_time":"2012/12/12 00:00:00 -0500","original":"12/11/12","granularity":"day","time":"2012/12/11 00:00:00 -0500"},"last name":"de la Torre","type":"Credit Card","billing address 1":"148 Lafayette st. PH","geo_score":0.571,"payment method":"MasterCard - XXXX-XXXXXX-4953","notes":null,"billing address 2":null,"billing city":"New York","event name":"JS.geo","tickets":1,"cc processing (usd)":0.3,"id":"ab7z9f81se5b","first name":"Javier","email address":"jatorre@vizzuality.com","geo_precision":"street","billing zip":"10013","billing country":"US"},"type":"Feature","geometry":{"type":"Point","coordinates":[-74.003181,40.714707]}},{"properties":{"gross revenue (usd)":23.08,"status":"Eventbrite Completed","ticket revenue (usd)":20.0,"eventbrite fees (usd)":2.48,"billing state":"WA","order id":129106352,"date":{"end_time":"2012/12/12 00:00:00 -0500","original":"12/11/12","granularity":"day","time":"2012/12/11 00:00:00 -0500"},"last name":"Harpster","type":"Credit Card","billing address 1":"2208 NW Market St","geo_score":1.0,"payment method":"Visa - XXXX-XXXXXX-5889","notes":null,"billing address 2":"Suite 202","billing city":"Seattle","event name":"JS.geo","tickets":2,"cc processing (usd)":0.6,"id":"ab7z9fd5qicv","first name":"Jubal","email address":"jharpster@spatialdev.com","geo_precision":"range","billing zip":"98107","billing country":"US"},"type":"Feature","geometry":{"type":"Point","coordinates":[-122.386281,47.668753]}},{"properties":{"gross revenue (usd)":11.54,"status":"Eventbrite Completed","ticket revenue (usd)":10.0,"eventbrite fees (usd)":1.24,"billing state":"CO","order id":129106882,"date":{"end_time":"2012/12/12 00:00:00 -0500","original":"12/11/12","granularity":"day","time":"2012/12/11 00:00:00 -0500"},"last name":"Folds","type":"Credit Card","billing address 1":"3312 West Kiowa Street","geo_score":1.0,"payment method":"Discover - XXXX-XXXXXX-7881","notes":null,"billing address 2":null,"billing city":"Colorado Springs","event name":"JS.geo","tickets":1,"cc processing (usd)":0.3,"id":"ab7z9fap1r7e","first name":"Jeremy","email address":"jmfolds@gmail.com","geo_precision":"range","billing zip":"80904","billing country":"US"},"type":"Feature","geometry":{"type":"Point","coordinates":[-104.876892,38.858378]}},{"properties":{"gross revenue (usd)":11.54,"status":"Eventbrite Completed","ticket revenue (usd)":10.0,"eventbrite fees (usd)":1.24,"billing state":"CO","order id":129151682,"date":{"end_time":"2012/12/12 00:00:00 -0500","original":"12/11/12","granularity":"day","time":"2012/12/11 00:00:00 -0500"},"last name":"Reynen","type":"Credit Card","billing address 1":"460 S. Grant St.","geo_score":0.614,"payment method":"MasterCard - XXXX-XXXXXX-6929","notes":null,"billing address 2":null,"billing city":"Denver","event name":"JS.geo","tickets":1,"cc processing (usd)":0.3,"id":"ab7z9fbrj4qs","first name":"Scott","email address":"scott@atendesigngroup.com","geo_precision":"street","billing zip":"80209","billing country":"US"},"type":"Feature","geometry":{"type":"Point","coordinates":[-104.98379,39.716537]}},{"properties":{"gross revenue (usd)":11.54,"status":"Eventbrite Completed","ticket revenue (usd)":10.0,"eventbrite fees (usd)":1.24,"billing state":"CO","order id":129156008,"date":{"end_time":"2012/12/12 00:00:00 -0500","original":"12/11/12","granularity":"day","time":"2012/12/11 00:00:00 -0500"},"last name":"Ballou","type":"Credit Card","billing address 1":"1211 Vine Street Apt 101","geo_score":0.844,"payment method":"Visa - XXXX-XXXXXX-3290","notes":null,"billing address 2":null,"billing city":"Denver","event name":"JS.geo","tickets":1,"cc processing (usd)":0.3,"id":"ab7z9fecnmee","first name":"Rob","email address":"rob@atendesigngroup.com","geo_precision":"range","billing zip":"80206","billing country":"US"},"type":"Feature","geometry":{"type":"Point","coordinates":[-104.962327,39.736636]}},{"properties":{"gross revenue (usd)":317.49,"status":"Eventbrite Completed","ticket revenue (usd)":300.0,"eventbrite fees (usd)":8.49,"billing state":"CO","order id":129158754,"date":{"end_time":"2012/12/12 00:00:00 -0500","original":"12/11/12","granularity":"day","time":"2012/12/11 00:00:00 -0500"},"last name":"Batty","type":"Credit Card","billing address 1":null,"geo_score":0.0,"payment method":"Visa - XXXX-XXXXXX-7375","notes":null,"billing address 2":null,"billing city":null,"event name":"JS.geo","tickets":1,"cc processing (usd)":9.0,"id":"ab7z9fi773a9","first name":"Peter","email address":"peter@ebatty.com","geo_precision":"unmatched","billing zip":null,"billing country":"US"},"type":"Feature","geometry":null},{"properties":{"gross revenue (usd)":11.54,"status":"Eventbrite Completed","ticket revenue (usd)":10.0,"eventbrite fees (usd)":1.24,"billing state":"AZ","order id":129180740,"date":{"end_time":"2012/12/12 00:00:00 -0500","original":"12/11/12","granularity":"day","time":"2012/12/11 00:00:00 -0500"},"last name":"Guerin","type":"Credit Card","billing address 1":"14042 N. Palm Ridge Dr. W","geo_score":0.6,"payment method":"MasterCard - XXXX-XXXXXX-2595","notes":null,"billing address 2":null,"billing city":"Sun City","event name":"JS.geo","tickets":1,"cc processing (usd)":0.3,"id":"ab7z9f649p8u","first name":"Stephen","email address":"stephen.guerin@redfish.com","geo_precision":"street","billing zip":"85351","billing country":"US"},"type":"Feature","geometry":{"type":"Point","coordinates":[-112.296308,33.61083]}},{"properties":{"gross revenue (usd)":11.54,"status":"Eventbrite Completed","ticket revenue (usd)":10.0,"eventbrite fees (usd)":1.24,"billing state":"NM","order id":129266082,"date":{"end_time":"2012/12/13 00:00:00 -0500","original":"12/12/12","granularity":"day","time":"2012/12/12 00:00:00 -0500"},"last name":"SMITH","type":"Credit Card","billing address 1":"114 calle Royale","geo_score":0.805,"payment method":"Visa - XXXX-XXXXXX-4851","notes":null,"billing address 2":"114 calle Royale","billing city":"Santa fe","event name":"JS.geo","tickets":1,"cc processing (usd)":0.3,"id":"ab7z9f862wll","first name":"CODY","email address":"m0ose2@yahoo.com","geo_precision":"range","billing zip":"87501","billing country":"US"},"type":"Feature","geometry":{"type":"Point","coordinates":[-105.944545,35.666355]}},{"properties":{"gross revenue (usd)":317.49,"status":"Eventbrite Completed","ticket revenue (usd)":300.0,"eventbrite fees (usd)":8.49,"billing state":"AZ","order id":129268460,"date":{"end_time":"2012/12/13 00:00:00 -0500","original":"12/12/12","granularity":"day","time":"2012/12/12 00:00:00 -0500"},"last name":"Guerin","type":"Credit Card","billing address 1":"14042 N. Palm Ridge Dr. W","geo_score":0.6,"payment method":"MasterCard - XXXX-XXXXXX-2595","notes":null,"billing address 2":null,"billing city":"Sun City","event name":"JS.geo","tickets":1,"cc processing (usd)":9.0,"id":"ab7z9f7w4g3f","first name":"Stephen","email address":"stephen.guerin@redfish.com","geo_precision":"street","billing zip":"85351","billing country":"US"},"type":"Feature","geometry":{"type":"Point","coordinates":[-112.296308,33.61083]}},{"properties":{"gross revenue (usd)":11.54,"status":"Eventbrite Completed","ticket revenue (usd)":10.0,"eventbrite fees (usd)":1.24,"billing state":"NM","order id":129269178,"date":{"end_time":"2012/12/13 00:00:00 -0500","original":"12/12/12","granularity":"day","time":"2012/12/12 00:00:00 -0500"},"last name":"Lopez","type":"Credit Card","billing address 1":"4359 Lost Feather Ln","geo_score":0.746,"payment method":"Visa - XXXX-XXXXXX-1707","notes":null,"billing address 2":null,"billing city":"Santa Fe","event name":"JS.geo","tickets":1,"cc processing (usd)":0.3,"id":"ab7z9f7j8wzl","first name":"Marcos","email address":"marcos.lopez505@gmail.com","geo_precision":"range","billing zip":"87505","billing country":"US"},"type":"Feature","geometry":{"type":"Point","coordinates":[-106.012172,35.629715]}},{"properties":{"gross revenue (usd)":317.49,"status":"Eventbrite Completed","ticket revenue (usd)":300.0,"eventbrite fees (usd)":8.49,"billing state":"VA","order id":129270678,"date":{"end_time":"2012/12/13 00:00:00 -0500","original":"12/12/12","granularity":"day","time":"2012/12/12 00:00:00 -0500"},"last name":"LaForest","type":"Credit Card","billing address 1":"11303 Bulova Ln","geo_score":0.698,"payment method":"Visa - XXXX-XXXXXX-9432","notes":null,"billing address 2":null,"billing city":"Fairfax","event name":"JS.geo","tickets":1,"cc processing (usd)":9.0,"id":"ab7z9f4u8od6","first name":"William","email address":"lacapaneus@gmail.com","geo_precision":"street","billing zip":"22030","billing country":"US"},"type":"Feature","geometry":{"type":"Point","coordinates":[-77.322259,38.839673]}},{"properties":{"gross revenue (usd)":11.54,"status":"Eventbrite Completed","ticket revenue (usd)":10.0,"eventbrite fees (usd)":1.24,"billing state":"NM","order id":129271364,"date":{"end_time":"2012/12/13 00:00:00 -0500","original":"12/12/12","granularity":"day","time":"2012/12/12 00:00:00 -0500"},"last name":"Johnson","type":"Credit Card","billing address 1":"1201 Madrid Road","geo_score":1.0,"payment method":"Visa - XXXX-XXXXXX-7063","notes":null,"billing address 2":null,"billing city":"Santa Fe","event name":"JS.geo","tickets":1,"cc processing (usd)":0.3,"id":"ab7z9fcm187q","first name":"Tom","email address":"tom@jtjohnson.com","geo_precision":"range","billing zip":"87505","billing country":"US"},"type":"Feature","geometry":{"type":"Point","coordinates":[-105.938463,35.671421]}},{"properties":{"gross revenue (usd)":11.54,"status":"Eventbrite Completed","ticket revenue (usd)":10.0,"eventbrite fees (usd)":1.24,"billing state":"CO","order id":129335294,"date":{"end_time":"2012/12/13 00:00:00 -0500","original":"12/12/12","granularity":"day","time":"2012/12/12 00:00:00 -0500"},"last name":"Barrett","type":"Credit Card","billing address 1":"2510 Pontiac Street","geo_score":1.0,"payment method":"Visa - XXXX-XXXXXX-4520","notes":null,"billing address 2":null,"billing city":"Denver","event name":"JS.geo","tickets":1,"cc processing (usd)":0.3,"id":"ab7z9fkqsbe4","first name":"Branon","email address":"branonbarrett@gmail.com","geo_precision":"range","billing zip":"80207","billing country":"US"},"type":"Feature","geometry":{"type":"Point","coordinates":[-104.905738,39.75459]}},{"properties":{"gross revenue (usd)":11.54,"status":"Eventbrite Completed","ticket revenue (usd)":10.0,"eventbrite fees (usd)":1.24,"billing state":"CO","order id":129364984,"date":{"end_time":"2012/12/13 00:00:00 -0500","original":"12/12/12","granularity":"day","time":"2012/12/12 00:00:00 -0500"},"last name":"Gross","type":"Credit Card","billing address 1":"3958 Wonderland Hill Ave","geo_score":1.0,"payment method":"Visa - XXXX-XXXXXX-7273","notes":null,"billing address 2":null,"billing city":"Boulder","event name":"JS.geo","tickets":1,"cc processing (usd)":0.3,"id":"ab7z9faw9eb6","first name":"Wendy","email address":"wendy.gross@noaa.gov","geo_precision":"range","billing zip":"80304","billing country":"US"},"type":"Feature","geometry":{"type":"Point","coordinates":[-105.2866,40.046019]}},{"properties":{"gross revenue (usd)":11.54,"status":"Eventbrite Completed","ticket revenue (usd)":10.0,"eventbrite fees (usd)":1.24,"billing state":"MO","order id":129415884,"date":{"end_time":"2012/12/14 00:00:00 -0500","original":"12/13/12","granularity":"day","time":"2012/12/13 00:00:00 -0500"},"last name":"Unruh","type":"Credit Card","billing address 1":"16207 Brookside Rd.","geo_score":1.0,"payment method":"Visa - XXXX-XXXXXX-7124","notes":null,"billing address 2":null,"billing city":"Versailles","event name":"JS.geo","tickets":1,"cc processing (usd)":0.3,"id":"ab7z9fhc3s2n","first name":"Jerel","email address":"mail@unruhdesigns.com","geo_precision":"range","billing zip":"65084","billing country":"US"},"type":"Feature","geometry":{"type":"Point","coordinates":[-92.758961,38.433955]}},{"properties":{"gross revenue (usd)":11.54,"status":"Eventbrite Completed","ticket revenue (usd)":10.0,"eventbrite fees (usd)":1.24,"billing state":"TX","order id":129440256,"date":{"end_time":"2012/12/14 00:00:00 -0500","original":"12/13/12","granularity":"day","time":"2012/12/13 00:00:00 -0500"},"last name":"Priour","type":"Credit Card","billing address 1":"222 Victoria Dr.","geo_score":0.878,"payment method":"Visa - XXXX-XXXXXX-7421","notes":null,"billing address 2":"222 Victoria Dr.","billing city":"Kerrville","event name":"JS.geo","tickets":1,"cc processing (usd)":0.3,"id":"ab7z9fih3myz","first name":"Matt","email address":"mpriour@gmail.com","geo_precision":"range","billing zip":"78028","billing country":"US"},"type":"Feature","geometry":{"type":"Point","coordinates":[-99.202896,30.023372]}},{"properties":{"gross revenue (usd)":11.54,"status":"Eventbrite Completed","ticket revenue (usd)":10.0,"eventbrite fees (usd)":1.24,"billing state":"CO","order id":129876634,"date":{"end_time":"2012/12/18 00:00:00 -0500","original":"12/17/12","granularity":"day","time":"2012/12/17 00:00:00 -0500"},"last name":"Barker","type":"Credit Card","billing address 1":"9283 Rogers Road","geo_score":0.915,"payment method":"Visa - XXXX-XXXXXX-1201","notes":null,"billing address 2":"Longmont","billing city":"CO","event name":"JS.geo","tickets":1,"cc processing (usd)":0.3,"id":"ab7z9f62vmue","first name":"Norman","email address":"norman@cloudant.com","geo_precision":"range","billing zip":"80503","billing country":"US"},"type":"Feature","geometry":{"type":"Point","coordinates":[-105.135468,40.159801]}},{"properties":{"gross revenue (usd)":11.54,"status":"Eventbrite Completed","ticket revenue (usd)":10.0,"eventbrite fees (usd)":1.24,"billing state":"CA","order id":129927024,"date":{"end_time":"2012/12/18 00:00:00 -0500","original":"12/17/12","granularity":"day","time":"2012/12/17 00:00:00 -0500"},"last name":"Kenny","type":"Credit Card","billing address 1":"1600 Amphitheatre Pkwy","geo_score":1.0,"payment method":"Visa - XXXX-XXXXXX-1986","notes":null,"billing address 2":null,"billing city":"Mountain View","event name":"JS.geo","tickets":1,"cc processing (usd)":0.3,"id":"ab7z9fgvhgwk","first name":"Brendan","email address":"bckenny@gmail.com","geo_precision":"range","billing zip":"94043","billing country":"US"},"type":"Feature","geometry":{"type":"Point","coordinates":[-122.08452,37.423207]}},{"properties":{"gross revenue (usd)":11.54,"status":"Eventbrite Completed","ticket revenue (usd)":10.0,"eventbrite fees (usd)":1.24,"billing state":"CO","order id":129952082,"date":{"end_time":"2012/12/18 00:00:00 -0500","original":"12/17/12","granularity":"day","time":"2012/12/17 00:00:00 -0500"},"last name":"Gup","type":"Credit Card","billing address 1":"6525 Gunpark Drive #370-417","geo_score":0.512,"payment method":"Visa - XXXX-XXXXXX-9385","notes":null,"billing address 2":null,"billing city":"Boulder","event name":"JS.geo","tickets":1,"cc processing (usd)":0.3,"id":"ab7z9f7k0dta","first name":"Andrew","email address":"agup2001@msn.com","geo_precision":"street","billing zip":"80301","billing country":"US"},"type":"Feature","geometry":{"type":"Point","coordinates":[-105.202128,40.070057]}},{"properties":{"gross revenue (usd)":11.54,"status":"Eventbrite Completed","ticket revenue (usd)":10.0,"eventbrite fees (usd)":1.24,"billing state":"CO","order id":130071666,"date":{"end_time":"2012/12/19 00:00:00 -0500","original":"12/18/12","granularity":"day","time":"2012/12/18 00:00:00 -0500"},"last name":"Truslove","type":"Credit Card","billing address 1":"9852 W 76th Ave","geo_score":0.941,"payment method":"Visa - XXXX-XXXXXX-5434","notes":null,"billing address 2":null,"billing city":"Arvada","event name":"JS.geo","tickets":1,"cc processing (usd)":0.3,"id":"ab7z9fj6mruc","first name":"Ian","email address":"ian.truslove@gmail.com","geo_precision":"range","billing zip":"80005","billing country":"US"},"type":"Feature","geometry":{"type":"Point","coordinates":[-105.109061,39.834135]}},{"properties":{"gross revenue (usd)":11.54,"status":"Eventbrite Completed","ticket revenue (usd)":10.0,"eventbrite fees (usd)":1.24,"billing state":"CO","order id":130183840,"date":{"end_time":"2012/12/20 00:00:00 -0500","original":"12/19/12","granularity":"day","time":"2012/12/19 00:00:00 -0500"},"last name":"Flaherty","type":"Credit Card","billing address 1":"953 E. Nichols Ave.","geo_score":0.479,"payment method":"Visa - XXXX-XXXXXX-2263","notes":null,"billing address 2":null,"billing city":"Centennial","event name":"JS.geo","tickets":1,"cc processing (usd)":0.3,"id":"ab7z9fdvovgj","first name":"Tom","email address":"tef@eazy.net","geo_precision":"street","billing zip":"80122","billing country":"US"},"type":"Feature","geometry":{"type":"Point","coordinates":[-104.982352,39.571044]}},{"properties":{"gross revenue (usd)":46.16,"status":"Eventbrite Completed","ticket revenue (usd)":40.0,"eventbrite fees (usd)":4.96,"billing state":"CO","order id":130230596,"date":{"end_time":"2012/12/20 00:00:00 -0500","original":"12/19/12","granularity":"day","time":"2012/12/19 00:00:00 -0500"},"last name":"Bouwman","type":"Credit Card","billing address 1":"518 Smith St","geo_score":1.0,"payment method":"Visa - XXXX-XXXXXX-4179","notes":null,"billing address 2":null,"billing city":"Fort Collins","event name":"JS.geo","tickets":4,"cc processing (usd)":1.2,"id":"ab7z9fal4mqn","first name":"Dave","email address":"dave@davebouwman.com","geo_precision":"range","billing zip":"80524","billing country":"US"},"type":"Feature","geometry":{"type":"Point","coordinates":[-105.068276,40.580321]}},{"properties":{"gross revenue (usd)":317.49,"status":"Eventbrite Completed","ticket revenue (usd)":300.0,"eventbrite fees (usd)":8.49,"billing state":"MA","order id":130337532,"date":{"end_time":"2012/12/21 00:00:00 -0500","original":"12/20/12","granularity":"day","time":"2012/12/20 00:00:00 -0500"},"last name":"Hevey","type":"Credit Card","billing address 1":"129 South St","geo_score":0.707,"payment method":"American Express - XXXX-XXXXXX-X1002","notes":null,"billing address 2":"Floor 2","billing city":"Boston","event name":"JS.geo","tickets":1,"cc processing (usd)":9.0,"id":"ab7z9fb4zd0x","first name":"Christine","email address":"christine@cloudant.com","geo_precision":"range","billing zip":"02141","billing country":"US"},"type":"Feature","geometry":{"type":"Point","coordinates":[-70.993459,42.260903]}},{"properties":{"gross revenue (usd)":11.54,"status":"Eventbrite Completed","ticket revenue (usd)":10.0,"eventbrite fees (usd)":1.24,"billing state":"CO","order id":131055116,"date":{"end_time":"2012/12/29 00:00:00 -0500","original":"12/28/12","granularity":"day","time":"2012/12/28 00:00:00 -0500"},"last name":"McDermott","type":"Credit Card","billing address 1":"2300 Andrew Dr.","geo_score":0.878,"payment method":"American Express - XXXX-XXXXXX-X6010","notes":null,"billing address 2":null,"billing city":"Superior","event name":"JS.geo","tickets":1,"cc processing (usd)":0.3,"id":"ab7z9fg9vyp5","first name":"Dennis","email address":"dmcdermott@bouldercounty.org","geo_precision":"range","billing zip":"80027","billing country":"US"},"type":"Feature","geometry":{"type":"Point","coordinates":[-105.163603,39.931557]}},{"properties":{"gross revenue (usd)":11.54,"status":"Eventbrite Completed","ticket revenue (usd)":10.0,"eventbrite fees (usd)":1.24,"billing state":"NY","order id":131138470,"date":{"end_time":"2012/12/30 00:00:00 -0500","original":"12/29/12","granularity":"day","time":"2012/12/29 00:00:00 -0500"},"last name":"Ogle","type":"Credit Card","billing address 1":"148 Lafayette St, PH","geo_score":0.571,"payment method":"American Express - XXXX-XXXXXX-X1473","notes":null,"billing address 2":null,"billing city":"New York","event name":"JS.geo","tickets":1,"cc processing (usd)":0.3,"id":"ab7z9fich83q","first name":"Aaron","email address":"aogle@openplans.org","geo_precision":"street","billing zip":"10013","billing country":"US"},"type":"Feature","geometry":{"type":"Point","coordinates":[-74.003181,40.714707]}},{"properties":{"gross revenue (usd)":11.54,"status":"Eventbrite Completed","ticket revenue (usd)":10.0,"eventbrite fees (usd)":1.24,"billing state":"CO","order id":131288726,"date":{"end_time":"2012/12/31 00:00:00 -0500","original":"12/30/12","granularity":"day","time":"2012/12/30 00:00:00 -0500"},"last name":"Lally","type":"Credit Card","billing address 1":"1667 Jackson Street","geo_score":0.585,"payment method":"Visa - XXXX-XXXXXX-8776","notes":null,"billing address 2":null,"billing city":"Denver","event name":"JS.geo","tickets":1,"cc processing (usd)":0.3,"id":"ab7z9fc3a4ma","first name":"Jason","email address":"jason@placematters.org","geo_precision":"zip","billing zip":"80206","billing country":"US"},"type":"Feature","geometry":{"type":"Point","coordinates":[-104.953335,39.730787]}}],"is_temporal":true,"author":{"url":"","metadata":"","contact_name":"","contact_address":"","source":"","contact_phone":""},"source":"","pagination":{"sort":null,"start":0,"total":103,"limit":1000000},"state":"complete","tags":"","published":"2014-08-17T00:33:23-04:00","id":308876}