{"type":"FeatureCollection","data_type":"Dataset","url_type":null,"permissions":[{"permissions":{"download":true,"view":true},"group_id":"everyone"}],"classification":null,"title":"ebirdlocations","count":572,"stream_id":341839,"contributor":{"url":"http://geocommons.com/users/43230","name":"jaredf"},"data_attributes":null,"calculation_params":null,"icon_link":null,"link":"http://geocommons.com/overlays/341839.json","extent":[-124.211,9.2829,-65.6333,48.6448],"geometry_types":["point"],"unique_name":null,"name":"ebirdlocations","feature_count":572,"description":"","next_feature":null,"is_raster":false,"short_classification":"Y","stats":{"latitude":{"max":48.644763,"variance":27.9952003657243,"mean":36.8347285863636,"stdev":5.29104907988239,"min":9.282901,"median":38.5912822},"weight":{"max":76,"variance":30.0003276058455,"mean":2.37587412587413,"stdev":5.47725548115527,"min":1,"median":1},"date":{"max":"2013/03/30 00:00:00 -0400","variance":2.89207920610323e+15,"mean":"2010/12/21 06:00:37 -0500","stdev":53778055.0606214,"min":"2006/02/01 00:00:00 -0500","median":"2011/04/02 00:00:00 -0400"},"longitude":{"max":-65.6332833,"variance":82.0543908460084,"mean":-79.812711681993,"stdev":9.05838787235391,"min":-124.211354,"median":-76.8656761}},"features":[{"properties":{"latitude":39.0304942,"weight":76,"state/province":"US-MD","county":"Montgomery","date":{"end_time":"2013/03/12 00:00:00 -0400","original":"3/11/2013","granularity":"day","time":"2013/03/11 00:00:00 -0400"},"longitude":-77.0913756,"id":"adeypdft7zk2","location":"Parkside"},"type":"Feature","geometry":{"type":"Point","coordinates":[-77.0913756,39.0304942]}},{"properties":{"latitude":39.0803767,"weight":68,"state/province":"US-MD","county":"Montgomery","date":{"end_time":"2009/07/11 00:00:00 -0400","original":"7/10/2009","granularity":"day","time":"2009/07/10 00:00:00 -0400"},"longitude":-77.4035096,"id":"adeypd7ino3j","location":"Hughes Hollow - McKee Beshers WMA"},"type":"Feature","geometry":{"type":"Point","coordinates":[-77.4035096,39.0803767]}},{"properties":{"latitude":39.066803,"weight":50,"state/province":"US-MD","county":"Montgomery","date":{"end_time":"2012/10/31 00:00:00 -0400","original":"10/30/2012","granularity":"day","time":"2012/10/30 00:00:00 -0400"},"longitude":-77.32951,"id":"adeypde3acqx","location":"C&amp;O Canal--Violette's Lock"},"type":"Feature","geometry":{"type":"Point","coordinates":[-77.32951,39.066803]}},{"properties":{"latitude":39.1939588,"weight":40,"state/province":"US-MD","county":"Montgomery","date":{"end_time":"2012/11/13 00:00:00 -0500","original":"11/12/2012","granularity":"day","time":"2012/11/12 00:00:00 -0500"},"longitude":-77.1060175,"id":"adeypdcgb2x2","location":"Blue Mash Nature Trail"},"type":"Feature","geometry":{"type":"Point","coordinates":[-77.1060175,39.1939588]}},{"properties":{"latitude":39.0682467,"weight":27,"state/province":"US-MD","county":"Montgomery","date":{"end_time":"2010/03/14 00:00:00 -0500","original":"3/13/2010","granularity":"day","time":"2010/03/13 00:00:00 -0500"},"longitude":-77.3431492,"id":"adeypd7uux6t","location":"C&amp;O Canal--Riley's Lock"},"type":"Feature","geometry":{"type":"Point","coordinates":[-77.3431492,39.0682467]}},{"properties":{"latitude":38.0995098,"weight":17,"state/province":"US-MD","county":"Worcester","date":{"end_time":"2011/02/07 00:00:00 -0500","original":"2/6/2011","granularity":"day","time":"2011/02/06 00:00:00 -0500"},"longitude":-75.3380585,"id":"adeypdhkk7nl","location":"Truitts Landing"},"type":"Feature","geometry":{"type":"Point","coordinates":[-75.3380585,38.0995098]}},{"properties":{"latitude":38.324,"weight":17,"state/province":"US-MD","county":"Worcester","date":{"end_time":"2010/12/05 00:00:00 -0500","original":"12/4/2010","granularity":"day","time":"2010/12/04 00:00:00 -0500"},"longitude":-75.091,"id":"adeypdaym5uo","location":"Ocean  City Inlet"},"type":"Feature","geometry":{"type":"Point","coordinates":[-75.091,38.324]}},{"properties":{"latitude":39.0534423,"weight":16,"state/province":"US-MD","county":"Montgomery","date":{"end_time":"2011/08/22 00:00:00 -0400","original":"8/21/2011","granularity":"day","time":"2011/08/21 00:00:00 -0400"},"longitude":-77.0319217,"id":"adeypdhk00kw","location":"Wheaton Regional Park"},"type":"Feature","geometry":{"type":"Point","coordinates":[-77.0319217,39.0534423]}},{"properties":{"latitude":38.3357319,"weight":15,"state/province":"US-MD","county":"Worcester","date":{"end_time":"2010/12/05 00:00:00 -0500","original":"12/4/2010","granularity":"day","time":"2010/12/04 00:00:00 -0500"},"longitude":-75.0942564,"id":"adeypd9ffsge","location":"Ocean City--Skimmer Island"},"type":"Feature","geometry":{"type":"Point","coordinates":[-75.0942564,38.3357319]}},{"properties":{"latitude":38.0763725,"weight":13,"state/province":"US-MD","county":"Worcester","date":{"end_time":"2010/11/13 00:00:00 -0500","original":"11/12/2010","granularity":"day","time":"2010/11/12 00:00:00 -0500"},"longitude":-75.3683996,"id":"adeypdkqdl4s","location":"E.A. Vaughn WMA--North"},"type":"Feature","geometry":{"type":"Point","coordinates":[-75.3683996,38.0763725]}},{"properties":{"latitude":33.977962,"weight":13,"state/province":"US-GA","county":"Cobb","date":{"end_time":"2008/04/21 00:00:00 -0400","original":"4/20/2008","granularity":"day","time":"2008/04/20 00:00:00 -0400"},"longitude":-84.57898,"id":"adeypdb6kh8p","location":"Kennesaw Mountain Nat. Battlefield Park"},"type":"Feature","geometry":{"type":"Point","coordinates":[-84.57898,33.977962]}},{"properties":{"latitude":39.0571186,"weight":13,"state/province":"US-MD","county":"Montgomery","date":{"end_time":"2009/10/02 00:00:00 -0400","original":"10/1/2009","granularity":"day","time":"2009/10/01 00:00:00 -0400"},"longitude":-77.0374739,"id":"adeypdkinpv8","location":"Brookside Gardens"},"type":"Feature","geometry":{"type":"Point","coordinates":[-77.0374739,39.0571186]}},{"properties":{"latitude":39.0537674,"weight":13,"state/province":"US-MD","county":"Montgomery","date":{"end_time":"2011/04/24 00:00:00 -0400","original":"4/23/2011","granularity":"day","time":"2011/04/23 00:00:00 -0400"},"longitude":-77.2889461,"id":"adeypdcb2sa9","location":"C&amp;O Canal--Pennyfield Lock"},"type":"Feature","geometry":{"type":"Point","coordinates":[-77.2889461,39.0537674]}},{"properties":{"latitude":39.0278522,"weight":13,"state/province":"US-MD","county":"Montgomery","date":{"end_time":"2010/05/11 00:00:00 -0400","original":"5/10/2010","granularity":"day","time":"2010/05/10 00:00:00 -0400"},"longitude":-77.1579695,"id":"adeypdfkd5dk","location":"Cabin John Regional Park"},"type":"Feature","geometry":{"type":"Point","coordinates":[-77.1579695,39.0278522]}},{"properties":{"latitude":38.4443124,"weight":12,"state/province":"US-MD","county":"Dorchester","date":{"end_time":"2009/11/01 00:00:00 -0400","original":"10/31/2009","granularity":"day","time":"2009/10/31 00:00:00 -0400"},"longitude":-76.1232376,"id":"adeypdevu7wr","location":"Blackwater NWR--Wildlife Drive"},"type":"Feature","geometry":{"type":"Point","coordinates":[-76.1232376,38.4443124]}},{"properties":{"latitude":38.2099782,"weight":11,"state/province":"US-MD","county":"Worcester","date":{"end_time":"2012/01/29 00:00:00 -0500","original":"1/28/2012","granularity":"day","time":"2012/01/28 00:00:00 -0500"},"longitude":-75.1677811,"id":"adeypd8q7avl","location":"Assateague I. NS--Bayside"},"type":"Feature","geometry":{"type":"Point","coordinates":[-75.1677811,38.2099782]}},{"properties":{"latitude":33.9001498,"weight":11,"state/province":"US-GA","county":"Clarke","date":{"end_time":"2007/05/06 00:00:00 -0400","original":"5/5/2007","granularity":"day","time":"2007/05/05 00:00:00 -0400"},"longitude":-83.3857394,"id":"adeypdilcoia","location":"State Botanical Garden of Georgia"},"type":"Feature","geometry":{"type":"Point","coordinates":[-83.3857394,33.9001498]}},{"properties":{"latitude":39.0747419,"weight":10,"state/province":"US-MD","county":"Montgomery","date":{"end_time":"2011/03/04 00:00:00 -0500","original":"3/3/2011","granularity":"day","time":"2011/03/03 00:00:00 -0500"},"longitude":-77.4203464,"id":"adeypdh752fv","location":"C&amp;O Canal--Sycamore Landing"},"type":"Feature","geometry":{"type":"Point","coordinates":[-77.4203464,39.0747419]}},{"properties":{"latitude":38.994821,"weight":10,"state/province":"US-MD","county":"Montgomery","date":{"end_time":"2011/04/15 00:00:00 -0400","original":"4/14/2011","granularity":"day","time":"2011/04/14 00:00:00 -0400"},"longitude":-77.0725922,"id":"adeypdc7zxw1","location":"Chevy Chase Lake Dr"},"type":"Feature","geometry":{"type":"Point","coordinates":[-77.0725922,38.994821]}},{"properties":{"latitude":39.0948139,"weight":10,"state/province":"US-MD","county":"Montgomery","date":{"end_time":"2009/08/23 00:00:00 -0400","original":"8/22/2009","granularity":"day","time":"2009/08/22 00:00:00 -0400"},"longitude":-77.4086809,"id":"adeypdhwl8r8","location":"Hughes Rd. polo fields"},"type":"Feature","geometry":{"type":"Point","coordinates":[-77.4086809,39.0948139]}},{"properties":{"latitude":38.9977412,"weight":9,"state/province":"US-MD","county":"Montgomery","date":{"end_time":"2011/04/28 00:00:00 -0400","original":"4/27/2011","granularity":"day","time":"2011/04/27 00:00:00 -0400"},"longitude":-77.0624077,"id":"adeypddnts6e","location":"Capital Crescent Trail at Rock Creek Trail"},"type":"Feature","geometry":{"type":"Point","coordinates":[-77.0624077,38.9977412]}},{"properties":{"latitude":38.3418582,"weight":9,"state/province":"US-MD","county":"Worcester","date":{"end_time":"2009/12/26 00:00:00 -0500","original":"12/25/2009","granularity":"day","time":"2009/12/25 00:00:00 -0500"},"longitude":-75.1058006,"id":"adeypd6tq8yo","location":"West Ocean City Pond"},"type":"Feature","geometry":{"type":"Point","coordinates":[-75.1058006,38.3418582]}},{"properties":{"latitude":38.1979474,"weight":8,"state/province":"US-MD","county":"Worcester","date":{"end_time":"2012/04/01 00:00:00 -0400","original":"3/31/2012","granularity":"day","time":"2012/03/31 00:00:00 -0400"},"longitude":-75.1578355,"id":"adeypd5vr8pu","location":"Assateague I. NS--Life of the Forest"},"type":"Feature","geometry":{"type":"Point","coordinates":[-75.1578355,38.1979474]}},{"properties":{"latitude":33.7990039,"weight":8,"state/province":"US-GA","county":"DeKalb","date":{"end_time":"2008/01/03 00:00:00 -0500","original":"1/2/2008","granularity":"day","time":"2008/01/02 00:00:00 -0500"},"longitude":-84.3142322,"id":"adeypdkhrxdu","location":"Emory President's Estate"},"type":"Feature","geometry":{"type":"Point","coordinates":[-84.3142322,33.7990039]}},{"properties":{"latitude":39.2750346,"weight":8,"state/province":"US-MD","county":"Montgomery","date":{"end_time":"2009/09/19 00:00:00 -0400","original":"9/18/2009","granularity":"day","time":"2009/09/18 00:00:00 -0400"},"longitude":-77.2905277,"id":"adeypder54lf","location":"Little Bennett Regional Park"},"type":"Feature","geometry":{"type":"Point","coordinates":[-77.2905277,39.2750346]}},{"properties":{"latitude":38.3010345,"weight":8,"state/province":"US-MD","county":"Worcester","date":{"end_time":"2012/05/12 00:00:00 -0400","original":"5/11/2012","granularity":"day","time":"2012/05/11 00:00:00 -0400"},"longitude":-75.1198554,"id":"adeypdd35cbl","location":"Castaways Campground (Eagle's Nest)"},"type":"Feature","geometry":{"type":"Point","coordinates":[-75.1198554,38.3010345]}},{"properties":{"latitude":31.0464993,"weight":8,"state/province":"US-GA","county":"Glynn","date":{"end_time":"2008/05/26 00:00:00 -0400","original":"5/25/2008","granularity":"day","time":"2008/05/25 00:00:00 -0400"},"longitude":-81.4113007,"id":"adeypdhvne6m","location":"Jekyll Island"},"type":"Feature","geometry":{"type":"Point","coordinates":[-81.4113007,31.0464993]}},{"properties":{"latitude":38.8578227,"weight":7,"state/province":"US-MD","county":"Talbot","date":{"end_time":"2012/02/19 00:00:00 -0500","original":"2/18/2012","granularity":"day","time":"2012/02/18 00:00:00 -0500"},"longitude":-76.1252117,"id":"adeypd7heht5","location":"Pickering Creek Audubon Center"},"type":"Feature","geometry":{"type":"Point","coordinates":[-76.1252117,38.8578227]}},{"properties":{"latitude":38.6124442,"weight":7,"state/province":"US-MD","county":"Dorchester","date":{"end_time":"2011/09/11 00:00:00 -0400","original":"9/10/2011","granularity":"day","time":"2011/09/10 00:00:00 -0400"},"longitude":-75.8425713,"id":"adeypdhx97hs","location":"Hurlock WWTP"},"type":"Feature","geometry":{"type":"Point","coordinates":[-75.8425713,38.6124442]}},{"properties":{"latitude":39.1433333,"weight":7,"state/province":"US-MD","county":"Montgomery","date":{"end_time":"2011/03/07 00:00:00 -0500","original":"3/6/2011","granularity":"day","time":"2011/03/06 00:00:00 -0500"},"longitude":-77.5103802,"id":"adeypdgjxoc6","location":"Patton Turf Farm"},"type":"Feature","geometry":{"type":"Point","coordinates":[-77.5103802,39.1433333]}},{"properties":{"latitude":38.9851615,"weight":7,"state/province":"US-MD","county":"Prince George's","date":{"end_time":"2012/10/22 00:00:00 -0400","original":"10/21/2012","granularity":"day","time":"2012/10/21 00:00:00 -0400"},"longitude":-76.9230104,"id":"adeypdlig9bg","location":"Lake Artemesia"},"type":"Feature","geometry":{"type":"Point","coordinates":[-76.9230104,38.9851615]}},{"properties":{"latitude":38.207274,"weight":7,"state/province":"US-MD","county":"Worcester","date":{"end_time":"2012/02/27 00:00:00 -0500","original":"2/26/2012","granularity":"day","time":"2012/02/26 00:00:00 -0500"},"longitude":-75.159605,"id":"adeypd7pdo66","location":"Assateague I. NS--Bayside Campground"},"type":"Feature","geometry":{"type":"Point","coordinates":[-75.159605,38.207274]}},{"properties":{"latitude":39.0065458,"weight":7,"state/province":"US-MD","county":"Montgomery","date":{"end_time":"2011/03/26 00:00:00 -0400","original":"3/25/2011","granularity":"day","time":"2011/03/25 00:00:00 -0400"},"longitude":-77.0564318,"id":"adeypdidh0dy","location":"Forest Glen Complex"},"type":"Feature","geometry":{"type":"Point","coordinates":[-77.0564318,39.0065458]}},{"properties":{"latitude":31.340292,"weight":6,"state/province":"US-GA","county":"McIntosh","date":{"end_time":"2008/05/26 00:00:00 -0400","original":"5/25/2008","granularity":"day","time":"2008/05/25 00:00:00 -0400"},"longitude":-81.44967,"id":"adeypd6sypp3","location":"Altamaha WMA"},"type":"Feature","geometry":{"type":"Point","coordinates":[-81.44967,31.340292]}},{"properties":{"latitude":39.2072177,"weight":6,"state/province":"US-MD","county":"Montgomery","date":{"end_time":"2012/10/01 00:00:00 -0400","original":"9/30/2012","granularity":"day","time":"2012/09/30 00:00:00 -0400"},"longitude":-77.308495,"id":"adeypd63tf5o","location":"Black Hill RP--Ten Mile Creek area, trails and lake"},"type":"Feature","geometry":{"type":"Point","coordinates":[-77.308495,39.2072177]}},{"properties":{"latitude":39.192365,"weight":6,"state/province":"US-MD","county":"Montgomery","date":{"end_time":"2010/12/20 00:00:00 -0500","original":"12/19/2010","granularity":"day","time":"2010/12/19 00:00:00 -0500"},"longitude":-77.295757,"id":"adeypdcht6ar","location":"Black Hill Regional Park"},"type":"Feature","geometry":{"type":"Point","coordinates":[-77.295757,39.192365]}},{"properties":{"latitude":39.1152317,"weight":6,"state/province":"US-MD","county":"Montgomery","date":{"end_time":"2010/09/27 00:00:00 -0400","original":"9/26/2010","granularity":"day","time":"2010/09/26 00:00:00 -0400"},"longitude":-77.1299883,"id":"adeypdda3cqv","location":"Lake Needwood"},"type":"Feature","geometry":{"type":"Point","coordinates":[-77.1299883,39.1152317]}},{"properties":{"latitude":39.0811212,"weight":6,"state/province":"US-MD","county":"Montgomery","date":{"end_time":"2011/08/16 00:00:00 -0400","original":"8/15/2011","granularity":"day","time":"2011/08/15 00:00:00 -0400"},"longitude":-77.4389849,"id":"adeypdccpci3","location":"Summit Hall Turf Farm (private)"},"type":"Feature","geometry":{"type":"Point","coordinates":[-77.4389849,39.0811212]}},{"properties":{"latitude":39.0540422,"weight":6,"state/province":"US-MD","county":"Montgomery","date":{"end_time":"2012/10/14 00:00:00 -0400","original":"10/13/2012","granularity":"day","time":"2012/10/13 00:00:00 -0400"},"longitude":-77.0412376,"id":"adeypd7ku4oe","location":"Wheaton Regional Park--mini-train tracks/Pine Lake"},"type":"Feature","geometry":{"type":"Point","coordinates":[-77.0412376,39.0540422]}},{"properties":{"latitude":39.0128817,"weight":6,"state/province":"US-MD","county":"Montgomery","date":{"end_time":"2009/07/09 00:00:00 -0400","original":"7/8/2009","granularity":"day","time":"2009/07/08 00:00:00 -0400"},"longitude":-77.0902491,"id":"adeypd5qpasb","location":"rock creek park - knowles av - cedar ln"},"type":"Feature","geometry":{"type":"Point","coordinates":[-77.0902491,39.0128817]}},{"properties":{"latitude":39.6999228,"weight":6,"state/province":"US-MD","county":"Garrett","date":{"end_time":"2011/07/03 00:00:00 -0400","original":"7/2/2011","granularity":"day","time":"2011/07/02 00:00:00 -0400"},"longitude":-78.9458442,"id":"adeypdhjgwkq","location":"Finzel Swamp"},"type":"Feature","geometry":{"type":"Point","coordinates":[-78.9458442,39.6999228]}},{"properties":{"latitude":38.2066229,"weight":6,"state/province":"US-MD","county":"Worcester","date":{"end_time":"2011/09/11 00:00:00 -0400","original":"9/10/2011","granularity":"day","time":"2011/09/10 00:00:00 -0400"},"longitude":-75.1602173,"id":"adeypddg8h4o","location":"Assateague I. NS--Life of the Marsh"},"type":"Feature","geometry":{"type":"Point","coordinates":[-75.1602173,38.2066229]}},{"properties":{"latitude":33.7996,"weight":6,"state/province":"US-GA","county":"DeKalb","date":{"end_time":"2007/09/11 00:00:00 -0400","original":"9/10/2007","granularity":"day","time":"2007/09/10 00:00:00 -0400"},"longitude":-84.3407,"id":"adeypddwgq8t","location":"Herbert Taylor Park"},"type":"Feature","geometry":{"type":"Point","coordinates":[-84.3407,33.7996]}},{"properties":{"latitude":38.208281,"weight":5,"state/province":"US-MD","county":"Worcester","date":{"end_time":"2010/05/02 00:00:00 -0400","original":"5/1/2010","granularity":"day","time":"2010/05/01 00:00:00 -0400"},"longitude":-75.152558,"id":"adeypdhym0nr","location":"Assateague Island National Seashore"},"type":"Feature","geometry":{"type":"Point","coordinates":[-75.152558,38.208281]}},{"properties":{"latitude":38.2973677,"weight":5,"state/province":"US-MD","county":"Worcester","date":{"end_time":"2011/05/01 00:00:00 -0400","original":"4/30/2011","granularity":"day","time":"2011/04/30 00:00:00 -0400"},"longitude":-75.1319361,"id":"adeypdkyildh","location":"Bayside Development Marsh"},"type":"Feature","geometry":{"type":"Point","coordinates":[-75.1319361,38.2973677]}},{"properties":{"latitude":33.9118818,"weight":5,"state/province":"US-GA","county":"Cobb","date":{"end_time":"2008/09/28 00:00:00 -0400","original":"9/27/2008","granularity":"day","time":"2008/09/27 00:00:00 -0400"},"longitude":-84.4485999,"id":"adeypdli01xn","location":"Cochran Shoals Unit (CRNRA)"},"type":"Feature","geometry":{"type":"Point","coordinates":[-84.4485999,33.9118818]}},{"properties":{"latitude":39.0086746,"weight":5,"state/province":"US-MD","county":"Montgomery","date":{"end_time":"2011/01/18 00:00:00 -0500","original":"1/17/2011","granularity":"day","time":"2011/01/17 00:00:00 -0500"},"longitude":-77.2442866,"id":"adeypdbt1foe","location":"C&amp;O Canal--Great Falls"},"type":"Feature","geometry":{"type":"Point","coordinates":[-77.2442866,39.0086746]}},{"properties":{"latitude":38.9498308,"weight":5,"state/province":"US-MD","county":"Montgomery","date":{"end_time":"2011/07/31 00:00:00 -0400","original":"7/30/2011","granularity":"day","time":"2011/07/30 00:00:00 -0400"},"longitude":-77.1274996,"id":"adeypdf31t3i","location":"C&amp;O Canal--Little Falls"},"type":"Feature","geometry":{"type":"Point","coordinates":[-77.1274996,38.9498308]}},{"properties":{"latitude":39.2338461,"weight":5,"state/province":"US-MD","county":"Montgomery","date":{"end_time":"2010/05/10 00:00:00 -0400","original":"5/9/2010","granularity":"day","time":"2010/05/09 00:00:00 -0400"},"longitude":-77.0454805,"id":"adeypdeor6e8","location":"Triadelphia Reservoir--Triadelphia Lake Rd."},"type":"Feature","geometry":{"type":"Point","coordinates":[-77.0454805,39.2338461]}},{"properties":{"latitude":38.6320921,"weight":5,"state/province":"US-MD","county":"Prince George's","date":{"end_time":"2013/03/06 00:00:00 -0500","original":"3/5/2013","granularity":"day","time":"2013/03/05 00:00:00 -0500"},"longitude":-76.6930676,"id":"adeypd70i3v6","location":"Milltown Landing"},"type":"Feature","geometry":{"type":"Point","coordinates":[-76.6930676,38.6320921]}},{"properties":{"latitude":39.6011913,"weight":5,"state/province":"US-MD","county":"Allegany","date":{"end_time":"2011/07/03 00:00:00 -0400","original":"7/2/2011","granularity":"day","time":"2011/07/02 00:00:00 -0400"},"longitude":-78.9539337,"id":"adeypdezvkvs","location":"Old Legislative Rd."},"type":"Feature","geometry":{"type":"Point","coordinates":[-78.9539337,39.6011913]}},{"properties":{"latitude":38.2621086,"weight":5,"state/province":"US-MD","county":"Worcester","date":{"end_time":"2012/04/01 00:00:00 -0400","original":"3/31/2012","granularity":"day","time":"2012/03/31 00:00:00 -0400"},"longitude":-75.4619122,"id":"adeypd6mgisc","location":"Nassawango Creek TNC--Mt. Olive Church"},"type":"Feature","geometry":{"type":"Point","coordinates":[-75.4619122,38.2621086]}},{"properties":{"latitude":39.2244492,"weight":4,"state/province":"US-MD","county":"Queen Anne's","date":{"end_time":"2011/01/03 00:00:00 -0500","original":"1/2/2011","granularity":"day","time":"2011/01/02 00:00:00 -0500"},"longitude":-75.9987482,"id":"adeypd6t9cy8","location":"Chino Farms Area"},"type":"Feature","geometry":{"type":"Point","coordinates":[-75.9987482,39.2244492]}},{"properties":{"latitude":33.4724754,"weight":4,"state/province":"US-GA","county":"Clayton","date":{"end_time":"2009/01/22 00:00:00 -0500","original":"1/21/2009","granularity":"day","time":"2009/01/21 00:00:00 -0500"},"longitude":-84.3062496,"id":"adeypdkfhlrt","location":"Clayton County Water Authority--Newman Wetlands Center"},"type":"Feature","geometry":{"type":"Point","coordinates":[-84.3062496,33.4724754]}},{"properties":{"latitude":33.84542,"weight":4,"state/province":"US-GA","county":"Fulton","date":{"end_time":"2008/05/27 00:00:00 -0400","original":"5/26/2008","granularity":"day","time":"2008/05/26 00:00:00 -0400"},"longitude":-84.39551,"id":"adeypdd3kjii","location":"Fulton"},"type":"Feature","geometry":{"type":"Point","coordinates":[-84.39551,33.84542]}},{"properties":{"latitude":39.1981388,"weight":4,"state/province":"US-MD","county":"Montgomery","date":{"end_time":"2012/09/10 00:00:00 -0400","original":"9/9/2012","granularity":"day","time":"2012/09/09 00:00:00 -0400"},"longitude":-77.0156622,"id":"adeypdcb9f70","location":"Triadelphia Reservoir--Greenbridge Rd."},"type":"Feature","geometry":{"type":"Point","coordinates":[-77.0156622,39.1981388]}},{"properties":{"latitude":39.1040649,"weight":4,"state/province":"US-MD","county":"Montgomery","date":{"end_time":"2010/05/17 00:00:00 -0400","original":"5/16/2010","granularity":"day","time":"2010/05/16 00:00:00 -0400"},"longitude":-77.1697658,"id":"adeypdhlett3","location":"Upper Watts Branch Park"},"type":"Feature","geometry":{"type":"Point","coordinates":[-77.1697658,39.1040649]}},{"properties":{"latitude":38.0485698,"weight":4,"state/province":"US-MD","county":"St. Mary's","date":{"end_time":"2012/11/05 00:00:00 -0500","original":"11/4/2012","granularity":"day","time":"2012/11/04 00:00:00 -0400"},"longitude":-76.3231802,"id":"adeypdgmtgon","location":"Point Lookout State Park"},"type":"Feature","geometry":{"type":"Point","coordinates":[-76.3231802,38.0485698]}},{"properties":{"latitude":39.6292465,"weight":4,"state/province":"US-MD","county":"Garrett","date":{"end_time":"2010/11/21 00:00:00 -0500","original":"11/20/2010","granularity":"day","time":"2010/11/20 00:00:00 -0500"},"longitude":-79.1265909,"id":"adeypd61inqy","location":"New Germany State Park"},"type":"Feature","geometry":{"type":"Point","coordinates":[-79.1265909,39.6292465]}},{"properties":{"latitude":38.2385678,"weight":4,"state/province":"US-MD","county":"Worcester","date":{"end_time":"2012/10/09 00:00:00 -0400","original":"10/8/2012","granularity":"day","time":"2012/10/08 00:00:00 -0400"},"longitude":-75.1375794,"id":"adeypdh8xpnv","location":"Assateague SP--Shell Road"},"type":"Feature","geometry":{"type":"Point","coordinates":[-75.1375794,38.2385678]}},{"properties":{"latitude":39.1357693,"weight":4,"state/province":"US-MD","county":"Montgomery","date":{"end_time":"2011/07/04 00:00:00 -0400","original":"7/3/2011","granularity":"day","time":"2011/07/03 00:00:00 -0400"},"longitude":-77.4374342,"id":"adeypd7wyct1","location":"20700 Westerly Rd"},"type":"Feature","geometry":{"type":"Point","coordinates":[-77.4374342,39.1357693]}},{"properties":{"latitude":38.76014,"weight":3,"state/province":"US-MD","county":"Talbot","date":{"end_time":"2013/01/06 00:00:00 -0500","original":"1/5/2013","granularity":"day","time":"2013/01/05 00:00:00 -0500"},"longitude":-76.1256,"id":"adeypde6xi0o","location":"Talbot"},"type":"Feature","geometry":{"type":"Point","coordinates":[-76.1256,38.76014]}},{"properties":{"latitude":38.2427642,"weight":3,"state/province":"US-MD","county":"Worcester","date":{"end_time":"2010/11/15 00:00:00 -0500","original":"11/14/2010","granularity":"day","time":"2010/11/14 00:00:00 -0500"},"longitude":-75.1452827,"id":"adeypdl9dsmx","location":"Assateague SP--Causeway"},"type":"Feature","geometry":{"type":"Point","coordinates":[-75.1452827,38.2427642]}},{"properties":{"latitude":39.1934881,"weight":3,"state/province":"US-MD","county":"Anne Arundel","date":{"end_time":"2012/10/06 00:00:00 -0400","original":"10/5/2012","granularity":"day","time":"2012/10/05 00:00:00 -0400"},"longitude":-76.5353537,"id":"adeypdefa23m","location":"Swan Creek Wetland--Cox Creek DMCF"},"type":"Feature","geometry":{"type":"Point","coordinates":[-76.5353537,39.1934881]}},{"properties":{"latitude":32.8388,"weight":3,"state/province":"US-GA","county":"Bibb","date":{"end_time":"2008/05/07 00:00:00 -0400","original":"5/6/2008","granularity":"day","time":"2008/05/06 00:00:00 -0400"},"longitude":-83.6077,"id":"adeypd75cz6o","location":"Ocmulgee NM"},"type":"Feature","geometry":{"type":"Point","coordinates":[-83.6077,32.8388]}},{"properties":{"latitude":38.4452536,"weight":3,"state/province":"US-MD","county":"Dorchester","date":{"end_time":"2013/01/06 00:00:00 -0500","original":"1/5/2013","granularity":"day","time":"2013/01/05 00:00:00 -0500"},"longitude":-76.088047,"id":"adeypdf688ec","location":"Blackwater NWR--Little Blackwater River Crossing"},"type":"Feature","geometry":{"type":"Point","coordinates":[-76.088047,38.4452536]}},{"properties":{"latitude":38.4687105,"weight":3,"state/province":"US-MD","county":"Dorchester","date":{"end_time":"2011/12/27 00:00:00 -0500","original":"12/26/2011","granularity":"day","time":"2011/12/26 00:00:00 -0500"},"longitude":-76.2998772,"id":"adeypd6g2t5g","location":"Taylor's Island"},"type":"Feature","geometry":{"type":"Point","coordinates":[-76.2998772,38.4687105]}},{"properties":{"latitude":39.189427,"weight":3,"state/province":"US-MD","county":"Montgomery","date":{"end_time":"2009/12/25 00:00:00 -0500","original":"12/24/2009","granularity":"day","time":"2009/12/24 00:00:00 -0500"},"longitude":-77.309455,"id":"adeypd94idqu","location":"Black Hill RP--Little Seneca Lake, Rte.121"},"type":"Feature","geometry":{"type":"Point","coordinates":[-77.309455,39.189427]}},{"properties":{"latitude":39.0640484,"weight":3,"state/province":"US-MD","county":"Montgomery","date":{"end_time":"2012/04/30 00:00:00 -0400","original":"4/29/2012","granularity":"day","time":"2012/04/29 00:00:00 -0400"},"longitude":-77.3058558,"id":"adeypdjjk63b","location":"Blockhouse Point Conservation Park"},"type":"Feature","geometry":{"type":"Point","coordinates":[-77.3058558,39.0640484]}},{"properties":{"latitude":39.2107092,"weight":3,"state/province":"US-MD","county":"Montgomery","date":{"end_time":"2011/10/31 00:00:00 -0400","original":"10/30/2011","granularity":"day","time":"2011/10/30 00:00:00 -0400"},"longitude":-77.1827316,"id":"adeypdfcen1l","location":"Green Hills Farm Wetland"},"type":"Feature","geometry":{"type":"Point","coordinates":[-77.1827316,39.2107092]}},{"properties":{"latitude":39.1361188,"weight":3,"state/province":"US-MD","county":"Montgomery","date":{"end_time":"2011/04/24 00:00:00 -0400","original":"4/23/2011","granularity":"day","time":"2011/04/23 00:00:00 -0400"},"longitude":-77.2670925,"id":"adeypdfekxfu","location":"Seneca Creek SP--Riffle Ford Rd."},"type":"Feature","geometry":{"type":"Point","coordinates":[-77.2670925,39.1361188]}},{"properties":{"latitude":39.1106494,"weight":3,"state/province":"US-MD","county":"Montgomery","date":{"end_time":"2011/03/07 00:00:00 -0500","original":"3/6/2011","granularity":"day","time":"2011/03/06 00:00:00 -0500"},"longitude":-77.4212337,"id":"adeypd8b1uld","location":"Willard Rd"},"type":"Feature","geometry":{"type":"Point","coordinates":[-77.4212337,39.1106494]}},{"properties":{"latitude":38.9721219,"weight":3,"state/province":"US-MD","county":"Montgomery","date":{"end_time":"2011/01/23 00:00:00 -0500","original":"1/22/2011","granularity":"day","time":"2011/01/22 00:00:00 -0500"},"longitude":-77.1750498,"id":"adeypdjda795","location":"lock 10-12"},"type":"Feature","geometry":{"type":"Point","coordinates":[-77.1750498,38.9721219]}},{"properties":{"latitude":38.8174418,"weight":3,"state/province":"US-MD","county":"Prince George's","date":{"end_time":"2009/11/08 00:00:00 -0500","original":"11/7/2009","granularity":"day","time":"2009/11/07 00:00:00 -0500"},"longitude":-76.7408323,"id":"adeypdgc092m","location":"Depot Pond - East"},"type":"Feature","geometry":{"type":"Point","coordinates":[-76.7408323,38.8174418]}},{"properties":{"latitude":38.6795927,"weight":3,"state/province":"US-MD","county":"Talbot","date":{"end_time":"2012/10/13 00:00:00 -0400","original":"10/12/2012","granularity":"day","time":"2012/10/12 00:00:00 -0400"},"longitude":-76.3433933,"id":"adeypd7ddqj0","location":"Black Walnut Point"},"type":"Feature","geometry":{"type":"Point","coordinates":[-76.3433933,38.6795927]}},{"properties":{"latitude":38.298677,"weight":3,"state/province":"US-MD","county":"Worcester","date":{"end_time":"2012/01/29 00:00:00 -0500","original":"1/28/2012","granularity":"day","time":"2012/01/28 00:00:00 -0500"},"longitude":-75.1363778,"id":"adeypdcyzbew","location":"Bayside Development Pond"},"type":"Feature","geometry":{"type":"Point","coordinates":[-75.1363778,38.298677]}},{"properties":{"latitude":38.1895237,"weight":3,"state/province":"US-MD","county":"Worcester","date":{"end_time":"2012/04/15 00:00:00 -0400","original":"4/14/2012","granularity":"day","time":"2012/04/14 00:00:00 -0400"},"longitude":-75.453608,"id":"adeypdcdec0s","location":"Nassawango Creek Preserve--Red House Road"},"type":"Feature","geometry":{"type":"Point","coordinates":[-75.453608,38.1895237]}},{"properties":{"latitude":38.949883,"weight":3,"state/province":"US-MD","county":"Queen Anne's","date":{"end_time":"2012/02/21 00:00:00 -0500","original":"2/20/2012","granularity":"day","time":"2012/02/20 00:00:00 -0500"},"longitude":-76.23053,"id":"adeypdgb0du2","location":"Chesapeake Bay Environmental Center (Horsehead)"},"type":"Feature","geometry":{"type":"Point","coordinates":[-76.23053,38.949883]}},{"properties":{"latitude":31.63771,"weight":3,"state/province":"US-GA","county":"McIntosh","date":{"end_time":"2007/10/12 00:00:00 -0400","original":"10/11/2007","granularity":"day","time":"2007/10/11 00:00:00 -0400"},"longitude":-81.27181,"id":"adeypd5zrskb","location":"Harris Neck NWR"},"type":"Feature","geometry":{"type":"Point","coordinates":[-81.27181,31.63771]}},{"properties":{"latitude":38.3533688,"weight":3,"state/province":"US-MD","county":"Dorchester","date":{"end_time":"2011/04/30 00:00:00 -0400","original":"4/29/2011","granularity":"day","time":"2011/04/29 00:00:00 -0400"},"longitude":-75.9361267,"id":"adeypdeeimpx","location":"Elliott Island Road"},"type":"Feature","geometry":{"type":"Point","coordinates":[-75.9361267,38.3533688]}},{"properties":{"latitude":32.5683396,"weight":3,"state/province":"US-TX","county":"Tarrant","date":{"end_time":"2008/11/28 00:00:00 -0500","original":"11/27/2008","granularity":"day","time":"2008/11/27 00:00:00 -0500"},"longitude":-97.1378678,"id":"adeypd6qqvhm","location":"Catherine Rose Park"},"type":"Feature","geometry":{"type":"Point","coordinates":[-97.1378678,32.5683396]}},{"properties":{"latitude":38.2281059,"weight":3,"state/province":"US-MD","county":"Worcester","date":{"end_time":"2012/11/12 00:00:00 -0500","original":"11/11/2012","granularity":"day","time":"2012/11/11 00:00:00 -0500"},"longitude":-75.1416884,"id":"adeypdj1y2i4","location":"Assateague SP--Campground"},"type":"Feature","geometry":{"type":"Point","coordinates":[-75.1416884,38.2281059]}},{"properties":{"latitude":38.5912822,"weight":3,"state/province":"US-MD","county":"Talbot","date":{"end_time":"2013/01/06 00:00:00 -0500","original":"1/5/2013","granularity":"day","time":"2013/01/05 00:00:00 -0500"},"longitude":-76.0465049,"id":"adeypdc6wx4v","location":"Choptank River--Rte. 50 Bridge (Talbot Co.)"},"type":"Feature","geometry":{"type":"Point","coordinates":[-76.0465049,38.5912822]}},{"properties":{"latitude":38.1533562,"weight":3,"state/province":"US-MD","county":"Worcester","date":{"end_time":"2012/03/18 00:00:00 -0400","original":"3/17/2012","granularity":"day","time":"2012/03/17 00:00:00 -0400"},"longitude":-74.2569656,"id":"adeypdgh94au","location":"Maryland Pelagic (General)"},"type":"Feature","geometry":{"type":"Point","coordinates":[-74.2569656,38.1533562]}},{"properties":{"latitude":38.0757982,"weight":3,"state/province":"US-MD","county":"Worcester","date":{"end_time":"2012/11/11 00:00:00 -0500","original":"11/10/2012","granularity":"day","time":"2012/11/10 00:00:00 -0500"},"longitude":-75.3653097,"id":"adeypdc1lfku","location":"Taylor's Landing"},"type":"Feature","geometry":{"type":"Point","coordinates":[-75.3653097,38.0757982]}},{"properties":{"latitude":9.282901,"weight":3,"state/province":"CR-P","county":null,"date":{"end_time":"2006/02/02 00:00:00 -0500","original":"2/1/2006","granularity":"day","time":"2006/02/01 00:00:00 -0500"},"longitude":-83.8569983,"id":"adeypdk6wqy1","location":"Puntarenas"},"type":"Feature","geometry":{"type":"Point","coordinates":[-83.8569983,9.282901]}},{"properties":{"latitude":32.012231,"weight":3,"state/province":"US-GA","county":"Chatham","date":{"end_time":"2008/01/05 00:00:00 -0500","original":"1/4/2008","granularity":"day","time":"2008/01/04 00:00:00 -0500"},"longitude":-80.840783,"id":"adeypdcy20d4","location":"Tybee Island"},"type":"Feature","geometry":{"type":"Point","coordinates":[-80.840783,32.012231]}},{"properties":{"latitude":38.229,"weight":3,"state/province":"US-MD","county":"Worcester","date":{"end_time":"2011/05/01 00:00:00 -0400","original":"4/30/2011","granularity":"day","time":"2011/04/30 00:00:00 -0400"},"longitude":-75.144,"id":"adeypd7xx1lc","location":"Assateague State Park"},"type":"Feature","geometry":{"type":"Point","coordinates":[-75.144,38.229]}},{"properties":{"latitude":33.8664602,"weight":3,"state/province":"US-GA","county":"DeKalb","date":{"end_time":"2007/10/06 00:00:00 -0400","original":"10/5/2007","granularity":"day","time":"2007/10/05 00:00:00 -0400"},"longitude":-84.2285085,"id":"adeypdjwor7p","location":"Henderson Park"},"type":"Feature","geometry":{"type":"Point","coordinates":[-84.2285085,33.8664602]}},{"properties":{"latitude":39.0778753,"weight":3,"state/province":"US-MD","county":"Anne Arundel","date":{"end_time":"2013/03/04 00:00:00 -0500","original":"3/3/2013","granularity":"day","time":"2013/03/03 00:00:00 -0500"},"longitude":-76.7713881,"id":"adeypd9odzoo","location":"Patuxent Research Refuge--North Tract"},"type":"Feature","geometry":{"type":"Point","coordinates":[-76.7713881,39.0778753]}},{"properties":{"latitude":38.22593,"weight":3,"state/province":"US-MD","county":"Worcester","date":{"end_time":"2010/05/02 00:00:00 -0400","original":"5/1/2010","granularity":"day","time":"2010/05/01 00:00:00 -0400"},"longitude":-75.35402,"id":"adeypdfytq4e","location":"Worcester"},"type":"Feature","geometry":{"type":"Point","coordinates":[-75.35402,38.22593]}},{"properties":{"latitude":33.8062779,"weight":3,"state/province":"US-GA","county":"DeKalb","date":{"end_time":"2007/09/15 00:00:00 -0400","original":"9/14/2007","granularity":"day","time":"2007/09/14 00:00:00 -0400"},"longitude":-84.2843,"id":"adeypdf8kbot","location":"Clyde Shepherd Nature Preserve"},"type":"Feature","geometry":{"type":"Point","coordinates":[-84.2843,33.8062779]}},{"properties":{"latitude":40.4093135,"weight":3,"state/province":"US-CO","county":"Larimer","date":{"end_time":"2012/08/08 00:00:00 -0400","original":"8/7/2012","granularity":"day","time":"2012/08/07 00:00:00 -0400"},"longitude":-105.6417847,"id":"adeypde0guba","location":"RMNP--Endovalley--Alluvial Fan area (including Fan Lake)"},"type":"Feature","geometry":{"type":"Point","coordinates":[-105.6417847,40.4093135]}},{"properties":{"latitude":39.1068782,"weight":3,"state/province":"US-MD","county":"Montgomery","date":{"end_time":"2010/05/09 00:00:00 -0400","original":"5/8/2010","granularity":"day","time":"2010/05/08 00:00:00 -0400"},"longitude":-77.4428791,"id":"adeypd8l1ips","location":"mtnebo cul de sac"},"type":"Feature","geometry":{"type":"Point","coordinates":[-77.4428791,39.1068782]}},{"properties":{"latitude":39.1920524,"weight":3,"state/province":"US-MD","county":"Montgomery","date":{"end_time":"2010/05/10 00:00:00 -0400","original":"5/9/2010","granularity":"day","time":"2010/05/09 00:00:00 -0400"},"longitude":-77.0050406,"id":"adeypdirg087","location":"Triadelphia Reservoir--Brighton Dam (Montgomery County)"},"type":"Feature","geometry":{"type":"Point","coordinates":[-77.0050406,39.1920524]}},{"properties":{"latitude":31.16954,"weight":2,"state/province":"US-TX","county":null,"date":{"end_time":"2008/06/30 00:00:00 -0400","original":"6/29/2008","granularity":"day","time":"2008/06/29 00:00:00 -0400"},"longitude":-100.07837,"id":"adeypdh5pm99","location":"Texas"},"type":"Feature","geometry":{"type":"Point","coordinates":[-100.07837,31.16954]}},{"properties":{"latitude":18.0114667,"weight":2,"state/province":"PR-","county":null,"date":{"end_time":"2012/03/12 00:00:00 -0400","original":"3/11/2012","granularity":"day","time":"2012/03/11 00:00:00 -0500"},"longitude":-67.1025667,"id":"adeypde0p6i3","location":"Laguna Cartegena - Tower"},"type":"Feature","geometry":{"type":"Point","coordinates":[-67.1025667,18.0114667]}},{"properties":{"latitude":39.2382364,"weight":2,"state/province":"US-MD","county":"Kent","date":{"end_time":"2012/01/15 00:00:00 -0500","original":"1/14/2012","granularity":"day","time":"2012/01/14 00:00:00 -0500"},"longitude":-76.0149193,"id":"adeypdlembaw","location":"Buckingham Public Landing"},"type":"Feature","geometry":{"type":"Point","coordinates":[-76.0149193,39.2382364]}},{"properties":{"latitude":39.2632608,"weight":2,"state/province":"US-MD","county":"Kent","date":{"end_time":"2009/10/11 00:00:00 -0400","original":"10/10/2009","granularity":"day","time":"2009/10/10 00:00:00 -0400"},"longitude":-76.1798429,"id":"adeypdgwwfex","location":"Great Oak Pond"},"type":"Feature","geometry":{"type":"Point","coordinates":[-76.1798429,39.2632608]}},{"properties":{"latitude":38.196944,"weight":2,"state/province":"US-MD","county":"Worcester","date":{"end_time":"2011/11/12 00:00:00 -0500","original":"11/11/2011","granularity":"day","time":"2011/11/11 00:00:00 -0500"},"longitude":-75.1556253,"id":"adeypd5h3koe","location":"Assateague I. NS--Oceanside Campground"},"type":"Feature","geometry":{"type":"Point","coordinates":[-75.1556253,38.196944]}},{"properties":{"latitude":38.2888831,"weight":2,"state/province":"US-MD","county":"Worcester","date":{"end_time":"2012/01/09 00:00:00 -0500","original":"1/8/2012","granularity":"day","time":"2012/01/08 00:00:00 -0500"},"longitude":-75.241469,"id":"adeypdkxerzm","location":"Ironshire Station Rd."},"type":"Feature","geometry":{"type":"Point","coordinates":[-75.241469,38.2888831]}},{"properties":{"latitude":38.2465139,"weight":2,"state/province":"US-MD","county":"Worcester","date":{"end_time":"2011/11/12 00:00:00 -0500","original":"11/11/2011","granularity":"day","time":"2011/11/11 00:00:00 -0500"},"longitude":-75.1657856,"id":"adeypddfk56d","location":"Rum Pointe Golf Course"},"type":"Feature","geometry":{"type":"Point","coordinates":[-75.1657856,38.2465139]}},{"properties":{"latitude":39.1134132,"weight":2,"state/province":"US-MD","county":"Anne Arundel","date":{"end_time":"2010/04/26 00:00:00 -0400","original":"4/25/2010","granularity":"day","time":"2010/04/25 00:00:00 -0400"},"longitude":-76.8088531,"id":"adeypdl9wjch","location":"Oxbow Lake"},"type":"Feature","geometry":{"type":"Point","coordinates":[-76.8088531,39.1134132]}},{"properties":{"latitude":39.5044049,"weight":2,"state/province":"US-MD","county":"Baltimore","date":{"end_time":"2011/03/06 00:00:00 -0500","original":"3/5/2011","granularity":"day","time":"2011/03/05 00:00:00 -0500"},"longitude":-76.6224289,"id":"adeypdgqc1ii","location":"Loch Raven Reservoir--Paper Mill Flats"},"type":"Feature","geometry":{"type":"Point","coordinates":[-76.6224289,39.5044049]}},{"properties":{"latitude":39.2361091,"weight":2,"state/province":"US-MD","county":"Baltimore","date":{"end_time":"2013/03/31 00:00:00 -0400","original":"3/30/2013","granularity":"day","time":"2013/03/30 00:00:00 -0400"},"longitude":-76.6265917,"id":"adeypdcfcua0","location":"Southwest Area Park"},"type":"Feature","geometry":{"type":"Point","coordinates":[-76.6265917,39.2361091]}},{"properties":{"latitude":38.6359808,"weight":2,"state/province":"US-MD","county":"Calvert","date":{"end_time":"2012/04/29 00:00:00 -0400","original":"4/28/2012","granularity":"day","time":"2012/04/28 00:00:00 -0400"},"longitude":-76.6708803,"id":"adeypdfhvhj6","location":"Huntingtown NRMA"},"type":"Feature","geometry":{"type":"Point","coordinates":[-76.6708803,38.6359808]}},{"properties":{"latitude":38.8726255,"weight":2,"state/province":"US-MD","county":"Caroline","date":{"end_time":"2011/04/03 00:00:00 -0400","original":"4/2/2011","granularity":"day","time":"2011/04/02 00:00:00 -0400"},"longitude":-75.8217144,"id":"adeypdikpqg8","location":"Denton WWTP"},"type":"Feature","geometry":{"type":"Point","coordinates":[-75.8217144,38.8726255]}},{"properties":{"latitude":38.7126725,"weight":2,"state/province":"US-MD","county":"Caroline","date":{"end_time":"2011/04/03 00:00:00 -0400","original":"4/2/2011","granularity":"day","time":"2011/04/02 00:00:00 -0400"},"longitude":-75.979836,"id":"adeypdjokcja","location":"Frazier Neck Road (Caroline)"},"type":"Feature","geometry":{"type":"Point","coordinates":[-75.979836,38.7126725]}},{"properties":{"latitude":38.7177957,"weight":2,"state/province":"US-MD","county":"Caroline","date":{"end_time":"2011/04/03 00:00:00 -0400","original":"4/2/2011","granularity":"day","time":"2011/04/02 00:00:00 -0400"},"longitude":-75.9721756,"id":"adeypd7eb5fg","location":"Skeleton Creek Rd."},"type":"Feature","geometry":{"type":"Point","coordinates":[-75.9721756,38.7177957]}},{"properties":{"latitude":38.7540916,"weight":2,"state/province":"US-MD","county":"Caroline","date":{"end_time":"2011/04/03 00:00:00 -0400","original":"4/2/2011","granularity":"day","time":"2011/04/02 00:00:00 -0400"},"longitude":-75.9940678,"id":"adeypdf3bq6a","location":"Tanyard Marsh"},"type":"Feature","geometry":{"type":"Point","coordinates":[-75.9940678,38.7540916]}},{"properties":{"latitude":38.9769762,"weight":2,"state/province":"US-MD","county":"Caroline","date":{"end_time":"2011/04/03 00:00:00 -0400","original":"4/2/2011","granularity":"day","time":"2011/04/02 00:00:00 -0400"},"longitude":-75.9314919,"id":"adeypd6d905r","location":"Tuckahoe State Park (Caroline Co)"},"type":"Feature","geometry":{"type":"Point","coordinates":[-75.9314919,38.9769762]}},{"properties":{"latitude":39.3998567,"weight":2,"state/province":"US-MD","county":"Carroll","date":{"end_time":"2010/12/06 00:00:00 -0500","original":"12/5/2010","granularity":"day","time":"2010/12/05 00:00:00 -0500"},"longitude":-76.9872093,"id":"adeypd5i9kdk","location":"Piney Run Park"},"type":"Feature","geometry":{"type":"Point","coordinates":[-76.9872093,39.3998567]}},{"properties":{"latitude":33.4769269,"weight":2,"state/province":"US-GA","county":"Clayton","date":{"end_time":"2008/03/30 00:00:00 -0400","original":"3/29/2008","granularity":"day","time":"2008/03/29 00:00:00 -0400"},"longitude":-84.3368968,"id":"adeypd9i5eyj","location":"Clayton County Water Authority--E.L. Huie Ponds"},"type":"Feature","geometry":{"type":"Point","coordinates":[-84.3368968,33.4769269]}},{"properties":{"latitude":38.5797081,"weight":2,"state/province":"US-MD","county":"Dorchester","date":{"end_time":"2013/01/20 00:00:00 -0500","original":"1/19/2013","granularity":"day","time":"2013/01/19 00:00:00 -0500"},"longitude":-76.077404,"id":"adeypdfyvc93","location":"Cambridge--Oakley Street"},"type":"Feature","geometry":{"type":"Point","coordinates":[-76.077404,38.5797081]}},{"properties":{"latitude":38.5121764,"weight":2,"state/province":"US-MD","county":"Dorchester","date":{"end_time":"2013/01/14 00:00:00 -0500","original":"1/13/2013","granularity":"day","time":"2013/01/13 00:00:00 -0500"},"longitude":-76.1029387,"id":"adeypd7hzvio","location":"Egypt Road"},"type":"Feature","geometry":{"type":"Point","coordinates":[-76.1029387,38.5121764]}},{"properties":{"latitude":39.3152585,"weight":2,"state/province":"US-MD","county":"Howard","date":{"end_time":"2012/10/29 00:00:00 -0400","original":"10/28/2012","granularity":"day","time":"2012/10/28 00:00:00 -0400"},"longitude":-76.875726,"id":"adeypdhfty83","location":"Mount Pleasant Farm - Howard County Conservancy"},"type":"Feature","geometry":{"type":"Point","coordinates":[-76.875726,39.3152585]}},{"properties":{"latitude":39.199835,"weight":2,"state/province":"US-MD","county":"Kent","date":{"end_time":"2009/10/12 00:00:00 -0400","original":"10/11/2009","granularity":"day","time":"2009/10/11 00:00:00 -0400"},"longitude":-76.0795498,"id":"adeypd8wv8vv","location":"Chestertown WWTP"},"type":"Feature","geometry":{"type":"Point","coordinates":[-76.0795498,39.199835]}},{"properties":{"latitude":39.1946123,"weight":2,"state/province":"US-MD","county":"Montgomery","date":{"end_time":"2011/01/28 00:00:00 -0500","original":"1/27/2011","granularity":"day","time":"2011/01/27 00:00:00 -0500"},"longitude":-77.1187642,"id":"adeypdfdxuvz","location":"Oaks Landfill (private)"},"type":"Feature","geometry":{"type":"Point","coordinates":[-77.1187642,39.1946123]}},{"properties":{"latitude":38.994312,"weight":2,"state/province":"US-MD","county":"Queen Anne's","date":{"end_time":"2011/01/09 00:00:00 -0500","original":"1/8/2011","granularity":"day","time":"2011/01/08 00:00:00 -0500"},"longitude":-76.322945,"id":"adeypde1i7xo","location":"Terrapin Nature Park"},"type":"Feature","geometry":{"type":"Point","coordinates":[-76.322945,38.994312]}},{"properties":{"latitude":38.2012081,"weight":2,"state/province":"US-MD","county":"St. Mary's","date":{"end_time":"2011/12/23 00:00:00 -0500","original":"12/22/2011","granularity":"day","time":"2011/12/22 00:00:00 -0500"},"longitude":-76.3711268,"id":"adeypd8lc5pm","location":"The Elms Environmental Education Center (private)"},"type":"Feature","geometry":{"type":"Point","coordinates":[-76.3711268,38.2012081]}},{"properties":{"latitude":38.7648589,"weight":2,"state/province":"US-MD","county":"Talbot","date":{"end_time":"2009/09/15 00:00:00 -0400","original":"9/14/2009","granularity":"day","time":"2009/09/14 00:00:00 -0400"},"longitude":-76.3814163,"id":"adeypd5kqo9w","location":"Poplar Island"},"type":"Feature","geometry":{"type":"Point","coordinates":[-76.3814163,38.7648589]}},{"properties":{"latitude":38.7278737,"weight":2,"state/province":"US-MD","county":"Anne Arundel","date":{"end_time":"2013/03/06 00:00:00 -0500","original":"3/5/2013","granularity":"day","time":"2013/03/05 00:00:00 -0500"},"longitude":-76.5446663,"id":"adeypd8zlhiw","location":"Herrington Harbor"},"type":"Feature","geometry":{"type":"Point","coordinates":[-76.5446663,38.7278737]}},{"properties":{"latitude":38.7431601,"weight":2,"state/province":"US-MD","county":"Caroline","date":{"end_time":"2011/04/03 00:00:00 -0400","original":"4/2/2011","granularity":"day","time":"2011/04/02 00:00:00 -0400"},"longitude":-75.9801605,"id":"adeypd77qd9e","location":"Little Creek--Frazier Neck Road"},"type":"Feature","geometry":{"type":"Point","coordinates":[-75.9801605,38.7431601]}},{"properties":{"latitude":39.6871763,"weight":2,"state/province":"US-MD","county":"Garrett","date":{"end_time":"2012/05/20 00:00:00 -0400","original":"5/19/2012","granularity":"day","time":"2012/05/19 00:00:00 -0400"},"longitude":-79.3847609,"id":"adeypdevbhrz","location":"Youghiogheny Res.--Old Morgantown Road"},"type":"Feature","geometry":{"type":"Point","coordinates":[-79.3847609,39.6871763]}},{"properties":{"latitude":33.3855863,"weight":2,"state/province":"US-GA","county":"Richmond","date":{"end_time":"2007/07/19 00:00:00 -0400","original":"7/18/2007","granularity":"day","time":"2007/07/18 00:00:00 -0400"},"longitude":-81.96069,"id":"adeypdkypxgu","location":"Phinizy Swamp Nature Park"},"type":"Feature","geometry":{"type":"Point","coordinates":[-81.96069,33.3855863]}},{"properties":{"latitude":30.778913,"weight":2,"state/province":"US-TX","county":"Burnet","date":{"end_time":"2012/12/24 00:00:00 -0500","original":"12/23/2012","granularity":"day","time":"2012/12/23 00:00:00 -0500"},"longitude":-98.183156,"id":"adeypd5rxno9","location":"US-TX-Burnet Shady Glen Ranch Rd"},"type":"Feature","geometry":{"type":"Point","coordinates":[-98.183156,30.778913]}},{"properties":{"latitude":38.4174516,"weight":2,"state/province":"US-MD","county":"Dorchester","date":{"end_time":"2013/01/14 00:00:00 -0500","original":"1/13/2013","granularity":"day","time":"2013/01/13 00:00:00 -0500"},"longitude":-75.9921741,"id":"adeypdgg516n","location":"Bestpitch"},"type":"Feature","geometry":{"type":"Point","coordinates":[-75.9921741,38.4174516]}},{"properties":{"latitude":38.2534593,"weight":2,"state/province":"US-MD","county":"Worcester","date":{"end_time":"2012/04/15 00:00:00 -0400","original":"4/14/2012","granularity":"day","time":"2012/04/14 00:00:00 -0400"},"longitude":-75.1297596,"id":"adeypd932idf","location":"Assateague Is. km 8-9"},"type":"Feature","geometry":{"type":"Point","coordinates":[-75.1297596,38.2534593]}},{"properties":{"latitude":34.24538,"weight":2,"state/province":"US-GA","county":"Bartow","date":{"end_time":"2008/05/05 00:00:00 -0400","original":"5/4/2008","granularity":"day","time":"2008/05/04 00:00:00 -0400"},"longitude":-84.84258,"id":"adeypda23czo","location":"Bartow"},"type":"Feature","geometry":{"type":"Point","coordinates":[-84.84258,34.24538]}},{"properties":{"latitude":38.6810877,"weight":2,"state/province":"US-MD","county":"Caroline","date":{"end_time":"2011/04/03 00:00:00 -0400","original":"4/2/2011","granularity":"day","time":"2011/04/02 00:00:00 -0400"},"longitude":-75.9483147,"id":"adeypdh9dxsj","location":"Choptank (Caroline Co.)"},"type":"Feature","geometry":{"type":"Point","coordinates":[-75.9483147,38.6810877]}},{"properties":{"latitude":34.283292,"weight":2,"state/province":"US-GA","county":"Forsyth","date":{"end_time":"2008/08/28 00:00:00 -0400","original":"8/27/2008","granularity":"day","time":"2008/08/27 00:00:00 -0400"},"longitude":-84.0529954,"id":"adeypde3yqeb","location":"American Proteins Settling Ponds (Forsyth Co.)"},"type":"Feature","geometry":{"type":"Point","coordinates":[-84.0529954,34.283292]}},{"properties":{"latitude":39.150564,"weight":2,"state/province":"US-MD","county":"Montgomery","date":{"end_time":"2012/05/06 00:00:00 -0400","original":"5/5/2012","granularity":"day","time":"2012/05/05 00:00:00 -0400"},"longitude":-77.3094499,"id":"adeypdgwzjyv","location":"South Germantown Recreational Park"},"type":"Feature","geometry":{"type":"Point","coordinates":[-77.3094499,39.150564]}},{"properties":{"latitude":39.0189836,"weight":2,"state/province":"US-MD","county":"Montgomery","date":{"end_time":"2011/08/24 00:00:00 -0400","original":"8/23/2011","granularity":"day","time":"2011/08/23 00:00:00 -0400"},"longitude":-77.097609,"id":"adeypdcu6i3k","location":"beach dr / franklin st"},"type":"Feature","geometry":{"type":"Point","coordinates":[-77.097609,39.0189836]}},{"properties":{"latitude":38.9741135,"weight":2,"state/province":"US-MD","county":"Queen Anne's","date":{"end_time":"2013/02/03 00:00:00 -0500","original":"2/2/2013","granularity":"day","time":"2013/02/02 00:00:00 -0500"},"longitude":-76.2462053,"id":"adeypd98o3hs","location":"Mears Point Marina"},"type":"Feature","geometry":{"type":"Point","coordinates":[-76.2462053,38.9741135]}},{"properties":{"latitude":32.5836414,"weight":2,"state/province":"US-TX","county":"Tarrant","date":{"end_time":"2011/04/08 00:00:00 -0400","original":"4/7/2011","granularity":"day","time":"2011/04/07 00:00:00 -0400"},"longitude":-97.1247089,"id":"adeypd8jg3ud","location":"McCallum House"},"type":"Feature","geometry":{"type":"Point","coordinates":[-97.1247089,32.5836414]}},{"properties":{"latitude":39.2094705,"weight":2,"state/province":"US-MD","county":"Baltimore","date":{"end_time":"2011/01/16 00:00:00 -0500","original":"1/15/2011","granularity":"day","time":"2011/01/15 00:00:00 -0500"},"longitude":-76.5330899,"id":"adeypdc6hdq2","location":"Fort Armistead Park (Baltimore City)"},"type":"Feature","geometry":{"type":"Point","coordinates":[-76.5330899,39.2094705]}},{"properties":{"latitude":38.5147537,"weight":2,"state/province":"US-MD","county":"Charles","date":{"end_time":"2013/03/06 00:00:00 -0500","original":"3/5/2013","granularity":"day","time":"2013/03/05 00:00:00 -0500"},"longitude":-76.6743994,"id":"adeypdctd8x9","location":"Benedict--Rte. 231 bridge"},"type":"Feature","geometry":{"type":"Point","coordinates":[-76.6743994,38.5147537]}},{"properties":{"latitude":31.16246,"weight":2,"state/province":"US-GA","county":"Glynn","date":{"end_time":"2009/03/13 00:00:00 -0400","original":"3/12/2009","granularity":"day","time":"2009/03/12 00:00:00 -0400"},"longitude":-81.50159,"id":"adeypd7a0kmp","location":"Andrew's Island Causeway"},"type":"Feature","geometry":{"type":"Point","coordinates":[-81.50159,31.16246]}},{"properties":{"latitude":39.23068,"weight":2,"state/province":"US-MD","county":"Howard","date":{"end_time":"2011/03/06 00:00:00 -0500","original":"3/5/2011","granularity":"day","time":"2011/03/05 00:00:00 -0500"},"longitude":-76.94221,"id":"adeypdc311ei","location":"Howard"},"type":"Feature","geometry":{"type":"Point","coordinates":[-76.94221,39.23068]}},{"properties":{"latitude":39.193229,"weight":2,"state/province":"US-MD","county":"Howard","date":{"end_time":"2013/01/01 00:00:00 -0500","original":"12/31/2012","granularity":"day","time":"2012/12/31 00:00:00 -0500"},"longitude":-77.004452,"id":"adeypdd17u9l","location":"Triadelphia Reservoir--Brighton Dam (Howard County)"},"type":"Feature","geometry":{"type":"Point","coordinates":[-77.004452,39.193229]}},{"properties":{"latitude":31.1536173,"weight":2,"state/province":"US-GA","county":"Glynn","date":{"end_time":"2008/05/27 00:00:00 -0400","original":"5/26/2008","granularity":"day","time":"2008/05/26 00:00:00 -0400"},"longitude":-81.5041351,"id":"adeypdaqohvn","location":"andrew isl causeway"},"type":"Feature","geometry":{"type":"Point","coordinates":[-81.5041351,31.1536173]}},{"properties":{"latitude":37.8774585,"weight":2,"state/province":"US-CA","county":"Tuolumne","date":{"end_time":"2007/06/14 00:00:00 -0400","original":"6/13/2007","granularity":"day","time":"2007/06/13 00:00:00 -0400"},"longitude":-119.3827502,"id":"adeypdd6882p","location":"Yosemite NP--Tuolumne Meadows"},"type":"Feature","geometry":{"type":"Point","coordinates":[-119.3827502,37.8774585]}},{"properties":{"latitude":31.8908005,"weight":2,"state/province":"US-AZ","county":"Cochise","date":{"end_time":"2007/05/30 00:00:00 -0400","original":"5/29/2007","granularity":"day","time":"2007/05/29 00:00:00 -0400"},"longitude":-109.1679001,"id":"adeypd9fpxi9","location":"Cave Creek Canyon"},"type":"Feature","geometry":{"type":"Point","coordinates":[-109.1679001,31.8908005]}},{"properties":{"latitude":34.8742161,"weight":2,"state/province":"US-GA","county":"Union","date":{"end_time":"2008/05/11 00:00:00 -0400","original":"5/10/2008","granularity":"day","time":"2008/05/10 00:00:00 -0400"},"longitude":-83.8113862,"id":"adeypdl645fp","location":"Brasstown Bald"},"type":"Feature","geometry":{"type":"Point","coordinates":[-83.8113862,34.8742161]}},{"properties":{"latitude":38.2062604,"weight":2,"state/province":"US-MD","county":"Worcester","date":{"end_time":"2012/10/09 00:00:00 -0400","original":"10/8/2012","granularity":"day","time":"2012/10/08 00:00:00 -0400"},"longitude":-75.1545525,"id":"adeypdk2ab77","location":"Assateague I. NS--Maintenance Yard"},"type":"Feature","geometry":{"type":"Point","coordinates":[-75.1545525,38.2062604]}},{"properties":{"latitude":18.3301824,"weight":2,"state/province":"PR-","county":null,"date":{"end_time":"2012/03/13 00:00:00 -0400","original":"3/12/2012","granularity":"day","time":"2012/03/12 00:00:00 -0400"},"longitude":-67.2418977,"id":"adeypd8prntm","location":"Casa Vista del Mar"},"type":"Feature","geometry":{"type":"Point","coordinates":[-67.2418977,18.3301824]}},{"properties":{"latitude":31.1570695,"weight":2,"state/province":"US-GA","county":"Glynn","date":{"end_time":"2009/03/13 00:00:00 -0400","original":"3/12/2009","granularity":"day","time":"2009/03/12 00:00:00 -0400"},"longitude":-81.3650036,"id":"adeypdcbdvcp","location":"St. Simons Island--Gould's Inlet"},"type":"Feature","geometry":{"type":"Point","coordinates":[-81.3650036,31.1570695]}},{"properties":{"latitude":10.4502,"weight":2,"state/province":"CR-H","county":null,"date":{"end_time":"2010/08/21 00:00:00 -0400","original":"8/20/2010","granularity":"day","time":"2010/08/20 00:00:00 -0400"},"longitude":-84.0677,"id":"adeypdf5rhxy","location":"Selva Verde Lodge"},"type":"Feature","geometry":{"type":"Point","coordinates":[-84.0677,10.4502]}},{"properties":{"latitude":38.0814397,"weight":2,"state/province":"US-MD","county":"St. Mary's","date":{"end_time":"2012/11/05 00:00:00 -0500","original":"11/4/2012","granularity":"day","time":"2012/11/04 00:00:00 -0400"},"longitude":-76.3520193,"id":"adeypdf0jprk","location":"Long Neck Road"},"type":"Feature","geometry":{"type":"Point","coordinates":[-76.3520193,38.0814397]}},{"properties":{"latitude":38.567396,"weight":2,"state/province":"US-MD","county":"Dorchester","date":{"end_time":"2012/08/16 00:00:00 -0400","original":"8/15/2012","granularity":"day","time":"2012/08/15 00:00:00 -0400"},"longitude":-75.833678,"id":"adeypd9eq2u1","location":"US-MD Maryland 331"},"type":"Feature","geometry":{"type":"Point","coordinates":[-75.833678,38.567396]}},{"properties":{"latitude":38.7181724,"weight":2,"state/province":"US-MD","county":"Talbot","date":{"end_time":"2012/10/13 00:00:00 -0400","original":"10/12/2012","granularity":"day","time":"2012/10/12 00:00:00 -0400"},"longitude":-76.3322783,"id":"adeypd8yfzpx","location":"poplar dock"},"type":"Feature","geometry":{"type":"Point","coordinates":[-76.3322783,38.7181724]}},{"properties":{"latitude":34.0680806,"weight":2,"state/province":"US-GA","county":"Madison","date":{"end_time":"2007/05/12 00:00:00 -0400","original":"5/11/2007","granularity":"day","time":"2007/05/11 00:00:00 -0400"},"longitude":-83.1695509,"id":"adeypd8ed6c7","location":"Fisher Farm"},"type":"Feature","geometry":{"type":"Point","coordinates":[-83.1695509,34.0680806]}},{"properties":{"latitude":39.0240111,"weight":2,"state/province":"US-MD","county":"Montgomery","date":{"end_time":"2013/02/17 00:00:00 -0500","original":"2/16/2013","granularity":"day","time":"2013/02/16 00:00:00 -0500"},"longitude":-77.1576135,"id":"adeypdjbh4r7","location":"Cabin John RP--Locust Grove Nature Center"},"type":"Feature","geometry":{"type":"Point","coordinates":[-77.1576135,39.0240111]}},{"properties":{"latitude":39.1274303,"weight":2,"state/province":"US-MD","county":"Montgomery","date":{"end_time":"2011/05/08 00:00:00 -0400","original":"5/7/2011","granularity":"day","time":"2011/05/07 00:00:00 -0400"},"longitude":-77.1304715,"id":"adeypd95f849","location":"Lake Needwood - north end"},"type":"Feature","geometry":{"type":"Point","coordinates":[-77.1304715,39.1274303]}},{"properties":{"latitude":39.1052548,"weight":2,"state/province":"US-MD","county":"Montgomery","date":{"end_time":"2011/05/02 00:00:00 -0400","original":"5/1/2011","granularity":"day","time":"2011/05/01 00:00:00 -0400"},"longitude":-77.3570967,"id":"adeypdhbvzsr","location":"Sugarland rd near montevideo"},"type":"Feature","geometry":{"type":"Point","coordinates":[-77.3570967,39.1052548]}},{"properties":{"latitude":39.5815802,"weight":2,"state/province":"US-MD","county":"Allegany","date":{"end_time":"2010/06/06 00:00:00 -0400","original":"6/5/2010","granularity":"day","time":"2010/06/05 00:00:00 -0400"},"longitude":-78.8978434,"id":"adeypdbkbet0","location":"Dan's Rock"},"type":"Feature","geometry":{"type":"Point","coordinates":[-78.8978434,39.5815802]}},{"properties":{"latitude":39.0457193,"weight":2,"state/province":"US-MD","county":"Montgomery","date":{"end_time":"2009/09/03 00:00:00 -0400","original":"9/2/2009","granularity":"day","time":"2009/09/02 00:00:00 -0400"},"longitude":-77.0896053,"id":"adeypdh7bfzm","location":"rock creek park - knowles to norbeck"},"type":"Feature","geometry":{"type":"Point","coordinates":[-77.0896053,39.0457193]}},{"properties":{"latitude":38.4381276,"weight":2,"state/province":"US-MD","county":"Worcester","date":{"end_time":"2011/09/11 00:00:00 -0400","original":"9/10/2011","granularity":"day","time":"2011/09/10 00:00:00 -0400"},"longitude":-75.2636433,"id":"adeypdc4m4qf","location":"Murray Sod Farm"},"type":"Feature","geometry":{"type":"Point","coordinates":[-75.2636433,38.4381276]}},{"properties":{"latitude":33.777,"weight":2,"state/province":"US-GA","county":"DeKalb","date":{"end_time":"2008/09/21 00:00:00 -0400","original":"9/20/2008","granularity":"day","time":"2008/09/20 00:00:00 -0400"},"longitude":-84.322,"id":"adeypdaj2dmx","location":"Fernbank Forest"},"type":"Feature","geometry":{"type":"Point","coordinates":[-84.322,33.777]}},{"properties":{"latitude":34.9658559,"weight":2,"state/province":"US-GA","county":"Rabun","date":{"end_time":"2008/10/27 00:00:00 -0400","original":"10/26/2008","granularity":"day","time":"2008/10/26 00:00:00 -0400"},"longitude":-83.2997507,"id":"adeypdj9ahp6","location":"Rabun Bald"},"type":"Feature","geometry":{"type":"Point","coordinates":[-83.2997507,34.9658559]}},{"properties":{"latitude":39.0848045,"weight":2,"state/province":"US-MD","county":"Montgomery","date":{"end_time":"2011/08/11 00:00:00 -0400","original":"8/10/2011","granularity":"day","time":"2011/08/10 00:00:00 -0400"},"longitude":-77.4213409,"id":"adeypd6jq17u","location":"river rd near williard"},"type":"Feature","geometry":{"type":"Point","coordinates":[-77.4213409,39.0848045]}},{"properties":{"latitude":39.0517184,"weight":2,"state/province":"US-MD","county":"Montgomery","date":{"end_time":"2012/01/03 00:00:00 -0500","original":"1/2/2012","granularity":"day","time":"2012/01/02 00:00:00 -0500"},"longitude":-77.1075439,"id":"adeypd868tmo","location":"rockville pike"},"type":"Feature","geometry":{"type":"Point","coordinates":[-77.1075439,39.0517184]}},{"properties":{"latitude":38.83046,"weight":2,"state/province":"US-MD","county":"Prince George's","date":{"end_time":"2010/02/16 00:00:00 -0500","original":"2/15/2010","granularity":"day","time":"2010/02/15 00:00:00 -0500"},"longitude":-76.88211,"id":"adeypd97q3s0","location":"Prince Georges"},"type":"Feature","geometry":{"type":"Point","coordinates":[-76.88211,38.83046]}},{"properties":{"latitude":39.13984,"weight":2,"state/province":"US-MD","county":"Montgomery","date":{"end_time":"2010/05/09 00:00:00 -0400","original":"5/8/2010","granularity":"day","time":"2010/05/08 00:00:00 -0400"},"longitude":-77.20286,"id":"adeypdfm2wdh","location":"Montgomery"},"type":"Feature","geometry":{"type":"Point","coordinates":[-77.20286,39.13984]}},{"properties":{"latitude":38.3524265,"weight":2,"state/province":"US-MD","county":"Worcester","date":{"end_time":"2012/08/16 00:00:00 -0400","original":"8/15/2012","granularity":"day","time":"2012/08/15 00:00:00 -0400"},"longitude":-75.1663971,"id":"adeypdd5d8aa","location":"Ocean Downs Racetrack"},"type":"Feature","geometry":{"type":"Point","coordinates":[-75.1663971,38.3524265]}},{"properties":{"latitude":39.2951704,"weight":2,"state/province":"US-MD","county":"Frederick","date":{"end_time":"2010/06/20 00:00:00 -0400","original":"6/19/2010","granularity":"day","time":"2010/06/19 00:00:00 -0400"},"longitude":-77.4572717,"id":"adeypdcrknyh","location":"Oland Road"},"type":"Feature","geometry":{"type":"Point","coordinates":[-77.4572717,39.2951704]}},{"properties":{"latitude":33.96091,"weight":2,"state/province":"US-GA","county":"Clarke","date":{"end_time":"2007/08/06 00:00:00 -0400","original":"8/5/2007","granularity":"day","time":"2007/08/05 00:00:00 -0400"},"longitude":-83.37798,"id":"adeypd9lchld","location":"Athens"},"type":"Feature","geometry":{"type":"Point","coordinates":[-83.37798,33.96091]}},{"properties":{"latitude":32.1091003,"weight":2,"state/province":"US-NM","county":"Eddy","date":{"end_time":"2007/05/28 00:00:00 -0400","original":"5/27/2007","granularity":"day","time":"2007/05/27 00:00:00 -0400"},"longitude":-104.4710999,"id":"adeypd8o1wyc","location":"Carlsbad Caverns NP -- Rattlesnake Springs"},"type":"Feature","geometry":{"type":"Point","coordinates":[-104.4710999,32.1091003]}},{"properties":{"latitude":34.06371,"weight":2,"state/province":"US-GA","county":"Madison","date":{"end_time":"2007/07/22 00:00:00 -0400","original":"7/21/2007","granularity":"day","time":"2007/07/21 00:00:00 -0400"},"longitude":-83.12547,"id":"adeypd814bst","location":"Comer"},"type":"Feature","geometry":{"type":"Point","coordinates":[-83.12547,34.06371]}},{"properties":{"latitude":39.4138497,"weight":2,"state/province":"US-MD","county":"Baltimore","date":{"end_time":"2012/12/18 00:00:00 -0500","original":"12/17/2012","granularity":"day","time":"2012/12/17 00:00:00 -0500"},"longitude":-76.8400955,"id":"adeypdgnemua","location":"Soldiers Delight NEA"},"type":"Feature","geometry":{"type":"Point","coordinates":[-76.8400955,39.4138497]}},{"properties":{"latitude":39.5121363,"weight":2,"state/province":"US-MD","county":"Garrett","date":{"end_time":"2011/07/03 00:00:00 -0400","original":"7/2/2011","granularity":"day","time":"2011/07/02 00:00:00 -0400"},"longitude":-79.3013763,"id":"adeypdczhlwu","location":"Deep Creek Lake--Discovery Center"},"type":"Feature","geometry":{"type":"Point","coordinates":[-79.3013763,39.5121363]}},{"properties":{"latitude":38.2707344,"weight":2,"state/province":"US-MD","county":"Worcester","date":{"end_time":"2012/05/12 00:00:00 -0400","original":"5/11/2012","granularity":"day","time":"2012/05/11 00:00:00 -0400"},"longitude":-75.4558182,"id":"adeypdb9hv48","location":"Sturges Rd."},"type":"Feature","geometry":{"type":"Point","coordinates":[-75.4558182,38.2707344]}},{"properties":{"latitude":40.3730498,"weight":2,"state/province":"US-CO","county":"Larimer","date":{"end_time":"2012/08/09 00:00:00 -0400","original":"8/8/2012","granularity":"day","time":"2012/08/08 00:00:00 -0400"},"longitude":-105.6140614,"id":"adeypdcl8sr1","location":"RMNP--Upper Beaver Meadows"},"type":"Feature","geometry":{"type":"Point","coordinates":[-105.6140614,40.3730498]}},{"properties":{"latitude":39.0104684,"weight":2,"state/province":"US-MD","county":"Montgomery","date":{"end_time":"2013/01/05 00:00:00 -0500","original":"1/4/2013","granularity":"day","time":"2013/01/04 00:00:00 -0500"},"longitude":-77.0188783,"id":"adeypdezw8w4","location":"Thornhill rd"},"type":"Feature","geometry":{"type":"Point","coordinates":[-77.0188783,39.0104684]}},{"properties":{"latitude":38.9753581,"weight":2,"state/province":"US-MD","county":"Prince George's","date":{"end_time":"2010/11/22 00:00:00 -0500","original":"11/21/2010","granularity":"day","time":"2010/11/21 00:00:00 -0500"},"longitude":-76.9351101,"id":"adeypdczx2le","location":"drexel rd"},"type":"Feature","geometry":{"type":"Point","coordinates":[-76.9351101,38.9753581]}},{"properties":{"latitude":38.5757905,"weight":2,"state/province":"US-MD","county":"Dorchester","date":{"end_time":"2012/06/03 00:00:00 -0400","original":"6/2/2012","granularity":"day","time":"2012/06/02 00:00:00 -0400"},"longitude":-75.8010926,"id":"adeypddtrgv8","location":"hwy 14 sand pit"},"type":"Feature","geometry":{"type":"Point","coordinates":[-75.8010926,38.5757905]}},{"properties":{"latitude":38.1049976,"weight":2,"state/province":"US-MD","county":"Worcester","date":{"end_time":"2011/11/13 00:00:00 -0500","original":"11/12/2011","granularity":"day","time":"2011/11/12 00:00:00 -0500"},"longitude":-75.3458476,"id":"adeypdlldv3c","location":"Truitts (wooded)"},"type":"Feature","geometry":{"type":"Point","coordinates":[-75.3458476,38.1049976]}},{"properties":{"latitude":39.154674,"weight":2,"state/province":"US-MD","county":"Montgomery","date":{"end_time":"2011/05/23 00:00:00 -0400","original":"5/22/2011","granularity":"day","time":"2011/05/22 00:00:00 -0400"},"longitude":-76.9769526,"id":"adeypd6tul9s","location":"Tucker Lane, Ashton"},"type":"Feature","geometry":{"type":"Point","coordinates":[-76.9769526,39.154674]}},{"properties":{"latitude":39.1076857,"weight":2,"state/province":"US-MD","county":"Montgomery","date":{"end_time":"2012/04/26 00:00:00 -0400","original":"4/25/2012","granularity":"day","time":"2012/04/25 00:00:00 -0400"},"longitude":-77.364006,"id":"adeypdf9ez49","location":"Dry Seneca Creek Park"},"type":"Feature","geometry":{"type":"Point","coordinates":[-77.364006,39.1076857]}},{"properties":{"latitude":10.4288,"weight":1,"state/province":"CR-H","county":null,"date":{"end_time":"2010/08/22 00:00:00 -0400","original":"8/21/2010","granularity":"day","time":"2010/08/21 00:00:00 -0400"},"longitude":-84.0128,"id":"adeypdk7g6x7","location":"La Selva (OTS Reserve)"},"type":"Feature","geometry":{"type":"Point","coordinates":[-84.0128,10.4288]}},{"properties":{"latitude":39.266517,"weight":1,"state/province":"US-MD","county":"Baltimore","date":{"end_time":"2010/07/06 00:00:00 -0400","original":"7/5/2010","granularity":"day","time":"2010/07/05 00:00:00 -0400"},"longitude":-76.6985607,"id":"adeypdhkrom9","location":"giant overlooking retirement pond"},"type":"Feature","geometry":{"type":"Point","coordinates":[-76.6985607,39.266517]}},{"properties":{"latitude":26.1787023,"weight":1,"state/province":"US-TX","county":"Hidalgo","date":{"end_time":"2008/07/02 00:00:00 -0400","original":"7/1/2008","granularity":"day","time":"2008/07/01 00:00:00 -0400"},"longitude":-98.3860016,"id":"adeypdcz5lcg","location":"Bentsen-Rio Grande Val. SP WBC (Mission) (LTC 069)"},"type":"Feature","geometry":{"type":"Point","coordinates":[-98.3860016,26.1787023]}},{"properties":{"latitude":26.1260304,"weight":1,"state/province":"US-TX","county":"Hidalgo","date":{"end_time":"2008/07/01 00:00:00 -0400","original":"6/30/2008","granularity":"day","time":"2008/06/30 00:00:00 -0400"},"longitude":-97.9559173,"id":"adeypdjkqdhx","location":"Estero Llano Grande SP WBC (LTC 054)"},"type":"Feature","geometry":{"type":"Point","coordinates":[-97.9559173,26.1260304]}},{"properties":{"latitude":9.808618,"weight":1,"state/province":"CR-P","county":null,"date":{"end_time":"2010/08/27 00:00:00 -0400","original":"8/26/2010","granularity":"day","time":"2010/08/26 00:00:00 -0400"},"longitude":-84.6111202,"id":"adeypdd2kol0","location":"Cerro Lodge"},"type":"Feature","geometry":{"type":"Point","coordinates":[-84.6111202,9.808618]}},{"properties":{"latitude":9.7855279,"weight":1,"state/province":"CR-P","county":null,"date":{"end_time":"2010/08/29 00:00:00 -0400","original":"8/28/2010","granularity":"day","time":"2010/08/28 00:00:00 -0400"},"longitude":-84.633007,"id":"adeypdbuuob1","location":"Ro Tarcoles--manglares"},"type":"Feature","geometry":{"type":"Point","coordinates":[-84.633007,9.7855279]}},{"properties":{"latitude":39.290454,"weight":1,"state/province":"US-MD","county":"Howard","date":{"end_time":"2012/02/22 00:00:00 -0500","original":"2/21/2012","granularity":"day","time":"2012/02/21 00:00:00 -0500"},"longitude":-77.094172,"id":"adeypd5gpufr","location":"Jennings Chapel Rd./Colton Court (private fields)"},"type":"Feature","geometry":{"type":"Point","coordinates":[-77.094172,39.290454]}},{"properties":{"latitude":39.3246043,"weight":1,"state/province":"US-MD","county":"Howard","date":{"end_time":"2011/01/23 00:00:00 -0500","original":"1/22/2011","granularity":"day","time":"2011/01/22 00:00:00 -0500"},"longitude":-77.0598865,"id":"adeypdb15xtv","location":"daisy rd &amp; Bells Dr"},"type":"Feature","geometry":{"type":"Point","coordinates":[-77.0598865,39.3246043]}},{"properties":{"latitude":39.2009491,"weight":1,"state/province":"US-MD","county":"Montgomery","date":{"end_time":"2012/12/31 00:00:00 -0500","original":"12/30/2012","granularity":"day","time":"2012/12/30 00:00:00 -0500"},"longitude":-77.2941077,"id":"adeypdh9vz90","location":"Black Hill RP--Boat Ramp area"},"type":"Feature","geometry":{"type":"Point","coordinates":[-77.2941077,39.2009491]}},{"properties":{"latitude":39.1309507,"weight":1,"state/province":"US-MD","county":"Montgomery","date":{"end_time":"2011/03/07 00:00:00 -0500","original":"3/6/2011","granularity":"day","time":"2011/03/06 00:00:00 -0500"},"longitude":-77.3821968,"id":"adeypd8ie6qs","location":"White Ferry Crossing"},"type":"Feature","geometry":{"type":"Point","coordinates":[-77.3821968,39.1309507]}},{"properties":{"latitude":39.2487391,"weight":1,"state/province":"US-MD","county":"Baltimore","date":{"end_time":"2012/12/11 00:00:00 -0500","original":"12/10/2012","granularity":"day","time":"2012/12/10 00:00:00 -0500"},"longitude":-76.3652802,"id":"adeypdkit3f0","location":"Hart-Miller Island"},"type":"Feature","geometry":{"type":"Point","coordinates":[-76.3652802,39.2487391]}},{"properties":{"latitude":38.9338272,"weight":1,"state/province":"US-NJ","county":"Cape May","date":{"end_time":"2010/02/21 00:00:00 -0500","original":"2/20/2010","granularity":"day","time":"2010/02/20 00:00:00 -0500"},"longitude":-74.9550854,"id":"adeypdjm7305","location":"Cape Island--CMPSP (Cape May Point SP)"},"type":"Feature","geometry":{"type":"Point","coordinates":[-74.9550854,38.9338272]}},{"properties":{"latitude":39.5933046,"weight":1,"state/province":"US-MD","county":"Cecil","date":{"end_time":"2009/12/27 00:00:00 -0500","original":"12/26/2009","granularity":"day","time":"2009/12/26 00:00:00 -0500"},"longitude":-75.9469843,"id":"adeypdf9jtna","location":"North East Community Park"},"type":"Feature","geometry":{"type":"Point","coordinates":[-75.9469843,39.5933046]}},{"properties":{"latitude":39.266,"weight":1,"state/province":"US-DE","county":"Kent","date":{"end_time":"2009/10/12 00:00:00 -0400","original":"10/11/2009","granularity":"day","time":"2009/10/11 00:00:00 -0400"},"longitude":-75.449,"id":"adeypdla65hp","location":"Bombay Hook NWR"},"type":"Feature","geometry":{"type":"Point","coordinates":[-75.449,39.266]}},{"properties":{"latitude":39.1790795,"weight":1,"state/province":"US-MD","county":"Kent","date":{"end_time":"2011/01/03 00:00:00 -0500","original":"1/2/2011","granularity":"day","time":"2011/01/02 00:00:00 -0500"},"longitude":-76.182332,"id":"adeypdbs0zzn","location":"Chesapeake Farms"},"type":"Feature","geometry":{"type":"Point","coordinates":[-76.182332,39.1790795]}},{"properties":{"latitude":38.9702328,"weight":1,"state/province":"US-MD","county":"Queen Anne's","date":{"end_time":"2012/02/27 00:00:00 -0500","original":"2/26/2012","granularity":"day","time":"2012/02/26 00:00:00 -0500"},"longitude":-76.2391716,"id":"adeypdi7wfte","location":"Kent Island--Holiday Inn Express (Queen Annes, MD)"},"type":"Feature","geometry":{"type":"Point","coordinates":[-76.2391716,38.9702328]}},{"properties":{"latitude":38.40829,"weight":1,"state/province":"US-MD","county":"Wicomico","date":{"end_time":"2011/02/07 00:00:00 -0500","original":"2/6/2011","granularity":"day","time":"2011/02/06 00:00:00 -0500"},"longitude":-75.60551,"id":"adeypd6mwhc1","location":"Wicomico"},"type":"Feature","geometry":{"type":"Point","coordinates":[-75.60551,38.40829]}},{"properties":{"latitude":38.4427728,"weight":1,"state/province":"US-MD","county":"Wicomico","date":{"end_time":"2012/11/25 00:00:00 -0500","original":"11/24/2012","granularity":"day","time":"2012/11/24 00:00:00 -0500"},"longitude":-75.6867608,"id":"adeypdg3hn39","location":"Hebron Woods"},"type":"Feature","geometry":{"type":"Point","coordinates":[-75.6867608,38.4427728]}},{"properties":{"latitude":38.9451667,"weight":1,"state/province":"US-NJ","county":"Cape May","date":{"end_time":"2010/02/21 00:00:00 -0500","original":"2/20/2010","granularity":"day","time":"2010/02/20 00:00:00 -0500"},"longitude":-74.8998888,"id":"adeypd6r2h0r","location":"Cape Island--Cape May Harbor--Delaware Ave."},"type":"Feature","geometry":{"type":"Point","coordinates":[-74.8998888,38.9451667]}},{"properties":{"latitude":39.7628285,"weight":1,"state/province":"US-NJ","county":"Ocean","date":{"end_time":"2010/02/21 00:00:00 -0500","original":"2/20/2010","granularity":"day","time":"2010/02/20 00:00:00 -0500"},"longitude":-74.1015387,"id":"adeypd6ocrot","location":"Barnegat Inlet"},"type":"Feature","geometry":{"type":"Point","coordinates":[-74.1015387,39.7628285]}},{"properties":{"latitude":39.016,"weight":1,"state/province":"US-MD","county":"Anne Arundel","date":{"end_time":"2009/11/08 00:00:00 -0500","original":"11/7/2009","granularity":"day","time":"2009/11/07 00:00:00 -0500"},"longitude":-76.402,"id":"adeypdf6ukq6","location":"Sandy Point State Park"},"type":"Feature","geometry":{"type":"Point","coordinates":[-76.402,39.016]}},{"properties":{"latitude":38.0400473,"weight":1,"state/province":"US-MD","county":"St. Mary's","date":{"end_time":"2012/11/05 00:00:00 -0500","original":"11/4/2012","granularity":"day","time":"2012/11/04 00:00:00 -0400"},"longitude":-76.322279,"id":"adeypddvdy6a","location":"Point Lookout SP--The Point"},"type":"Feature","geometry":{"type":"Point","coordinates":[-76.322279,38.0400473]}},{"properties":{"latitude":39.4868614,"weight":1,"state/province":"US-MD","county":"Baltimore","date":{"end_time":"2011/03/06 00:00:00 -0500","original":"3/5/2011","granularity":"day","time":"2011/03/05 00:00:00 -0500"},"longitude":-76.7597526,"id":"adeypdd6y4dm","location":"Tufton Ave."},"type":"Feature","geometry":{"type":"Point","coordinates":[-76.7597526,39.4868614]}},{"properties":{"latitude":39.24,"weight":1,"state/province":"US-MD","county":"Howard","date":{"end_time":"2013/01/03 00:00:00 -0500","original":"1/2/2013","granularity":"day","time":"2013/01/02 00:00:00 -0500"},"longitude":-76.86,"id":"adeypdd8cf9q","location":"Centennial Lake"},"type":"Feature","geometry":{"type":"Point","coordinates":[-76.86,39.24]}},{"properties":{"latitude":34.8680282,"weight":1,"state/province":"US-GA","county":"Walker","date":{"end_time":"2008/12/13 00:00:00 -0500","original":"12/12/2008","granularity":"day","time":"2008/12/12 00:00:00 -0500"},"longitude":-85.290336,"id":"adeypdi5zkxw","location":"Crawfish Spring Lake (cackling)"},"type":"Feature","geometry":{"type":"Point","coordinates":[-85.290336,34.8680282]}},{"properties":{"latitude":39.163,"weight":1,"state/province":"US-MD","county":"Anne Arundel","date":{"end_time":"2013/01/07 00:00:00 -0500","original":"1/6/2013","granularity":"day","time":"2013/01/06 00:00:00 -0500"},"longitude":-76.48,"id":"adeypdghywmm","location":"Fort Smallwood Park"},"type":"Feature","geometry":{"type":"Point","coordinates":[-76.48,39.163]}},{"properties":{"latitude":39.1138774,"weight":1,"state/province":"US-MD","county":"Anne Arundel","date":{"end_time":"2012/05/05 00:00:00 -0400","original":"5/4/2012","granularity":"day","time":"2012/05/04 00:00:00 -0400"},"longitude":-76.5620226,"id":"adeypd5pvquc","location":"Lake Waterford Park"},"type":"Feature","geometry":{"type":"Point","coordinates":[-76.5620226,39.1138774]}},{"properties":{"latitude":38.7154998,"weight":1,"state/province":"US-MD","county":"Anne Arundel","date":{"end_time":"2013/03/06 00:00:00 -0500","original":"3/5/2013","granularity":"day","time":"2013/03/05 00:00:00 -0500"},"longitude":-76.5255747,"id":"adeypdkerxa7","location":"North Beach--Anne Arundel waters"},"type":"Feature","geometry":{"type":"Point","coordinates":[-76.5255747,38.7154998]}},{"properties":{"latitude":38.5895031,"weight":1,"state/province":"US-MD","county":"Calvert","date":{"end_time":"2012/12/09 00:00:00 -0500","original":"12/8/2012","granularity":"day","time":"2012/12/08 00:00:00 -0500"},"longitude":-76.6561558,"id":"adeypd9fsapa","location":"Huntingtown, at Deep Landing Road &amp; New Enterprise Court"},"type":"Feature","geometry":{"type":"Point","coordinates":[-76.6561558,38.5895031]}},{"properties":{"latitude":38.7103954,"weight":1,"state/province":"US-MD","county":"Calvert","date":{"end_time":"2013/03/06 00:00:00 -0500","original":"3/5/2013","granularity":"day","time":"2013/03/05 00:00:00 -0500"},"longitude":-76.5265989,"id":"adeypdac566p","location":"North Beach--Calvert waters"},"type":"Feature","geometry":{"type":"Point","coordinates":[-76.5265989,38.7103954]}},{"properties":{"latitude":38.8736947,"weight":1,"state/province":"US-MD","county":"Caroline","date":{"end_time":"2011/04/03 00:00:00 -0400","original":"4/2/2011","granularity":"day","time":"2011/04/02 00:00:00 -0400"},"longitude":-75.9392166,"id":"adeypdksbovv","location":"Coveys Landing (Caroline Co.)"},"type":"Feature","geometry":{"type":"Point","coordinates":[-75.9392166,38.8736947]}},{"properties":{"latitude":38.79838,"weight":1,"state/province":"US-MD","county":"Caroline","date":{"end_time":"2011/04/03 00:00:00 -0400","original":"4/2/2011","granularity":"day","time":"2011/04/02 00:00:00 -0400"},"longitude":-75.7878971,"id":"adeypdjuri2x","location":"Dion Road Pond--Rte 313 x Dion Road"},"type":"Feature","geometry":{"type":"Point","coordinates":[-75.7878971,38.79838]}},{"properties":{"latitude":38.6896803,"weight":1,"state/province":"US-MD","county":"Caroline","date":{"end_time":"2011/04/03 00:00:00 -0400","original":"4/2/2011","granularity":"day","time":"2011/04/02 00:00:00 -0400"},"longitude":-75.7712674,"id":"adeypd7tr6mh","location":"Federalsburg Wetlands"},"type":"Feature","geometry":{"type":"Point","coordinates":[-75.7712674,38.6896803]}},{"properties":{"latitude":38.8275225,"weight":1,"state/province":"US-MD","county":"Caroline","date":{"end_time":"2011/04/03 00:00:00 -0400","original":"4/2/2011","granularity":"day","time":"2011/04/02 00:00:00 -0400"},"longitude":-75.8450496,"id":"adeypdg1albl","location":"Williston Lake"},"type":"Feature","geometry":{"type":"Point","coordinates":[-75.8450496,38.8275225]}},{"properties":{"latitude":33.5674309,"weight":1,"state/province":"US-GA","county":"Carroll","date":{"end_time":"2009/01/29 00:00:00 -0500","original":"1/28/2009","granularity":"day","time":"2009/01/28 00:00:00 -0500"},"longitude":-85.0637913,"id":"adeypd85df9t","location":"Richard's Lake"},"type":"Feature","geometry":{"type":"Point","coordinates":[-85.0637913,33.5674309]}},{"properties":{"latitude":39.6138113,"weight":1,"state/province":"US-MD","county":"Carroll","date":{"end_time":"2013/01/22 00:00:00 -0500","original":"1/21/2013","granularity":"day","time":"2013/01/21 00:00:00 -0500"},"longitude":-77.2710451,"id":"adeypd6ky0ov","location":"S Keysville Rd"},"type":"Feature","geometry":{"type":"Point","coordinates":[-77.2710451,39.6138113]}},{"properties":{"latitude":38.5833405,"weight":1,"state/province":"US-MD","county":"Charles","date":{"end_time":"2011/12/23 00:00:00 -0500","original":"12/22/2011","granularity":"day","time":"2011/12/22 00:00:00 -0500"},"longitude":-76.8595406,"id":"adeypd66eey6","location":"hwy 5 pond"},"type":"Feature","geometry":{"type":"Point","coordinates":[-76.8595406,38.5833405]}},{"properties":{"latitude":33.9303998,"weight":1,"state/province":"US-GA","county":"Clarke","date":{"end_time":"2007/08/06 00:00:00 -0400","original":"8/5/2007","granularity":"day","time":"2007/08/05 00:00:00 -0400"},"longitude":-83.3714676,"id":"adeypdi4dur6","location":"Lake Herrick"},"type":"Feature","geometry":{"type":"Point","coordinates":[-83.3714676,33.9303998]}},{"properties":{"latitude":33.50235,"weight":1,"state/province":"US-GA","county":"Clayton","date":{"end_time":"2008/02/10 00:00:00 -0500","original":"2/9/2008","granularity":"day","time":"2008/02/09 00:00:00 -0500"},"longitude":-84.34671,"id":"adeypdbubsi0","location":"Clayton"},"type":"Feature","geometry":{"type":"Point","coordinates":[-84.34671,33.50235]}},{"properties":{"latitude":33.4140157,"weight":1,"state/province":"US-GA","county":"Clayton","date":{"end_time":"2008/01/13 00:00:00 -0500","original":"1/12/2008","granularity":"day","time":"2008/01/12 00:00:00 -0500"},"longitude":-84.3701291,"id":"adeypd655d2j","location":"JW Smith Reservoir"},"type":"Feature","geometry":{"type":"Point","coordinates":[-84.3701291,33.4140157]}},{"properties":{"latitude":33.3226708,"weight":1,"state/province":"US-GA","county":"Fayette","date":{"end_time":"2008/11/03 00:00:00 -0500","original":"11/2/2008","granularity":"day","time":"2008/11/02 00:00:00 -0400"},"longitude":-84.4126909,"id":"adeypdenawo0","location":"Lake Horton"},"type":"Feature","geometry":{"type":"Point","coordinates":[-84.4126909,33.3226708]}},{"properties":{"latitude":34.2793825,"weight":1,"state/province":"US-GA","county":"Forsyth","date":{"end_time":"2008/08/10 00:00:00 -0400","original":"8/9/2008","granularity":"day","time":"2008/08/09 00:00:00 -0400"},"longitude":-84.0996766,"id":"adeypdaf7ncr","location":"coal mnt rd pond"},"type":"Feature","geometry":{"type":"Point","coordinates":[-84.0996766,34.2793825]}},{"properties":{"latitude":39.4168337,"weight":1,"state/province":"US-MD","county":"Frederick","date":{"end_time":"2012/04/09 00:00:00 -0400","original":"4/8/2012","granularity":"day","time":"2012/04/08 00:00:00 -0400"},"longitude":-77.4232721,"id":"adeypdi8z882","location":"Baker Park,  Frederick"},"type":"Feature","geometry":{"type":"Point","coordinates":[-77.4232721,39.4168337]}},{"properties":{"latitude":39.3363644,"weight":1,"state/province":"US-MD","county":"Frederick","date":{"end_time":"2011/01/16 00:00:00 -0500","original":"1/15/2011","granularity":"day","time":"2011/01/15 00:00:00 -0500"},"longitude":-77.228993,"id":"adeypdio70kb","location":"Kemptown--Kemptown Church Road"},"type":"Feature","geometry":{"type":"Point","coordinates":[-77.228993,39.3363644]}},{"properties":{"latitude":39.2958972,"weight":1,"state/province":"US-MD","county":"Frederick","date":{"end_time":"2012/12/03 00:00:00 -0500","original":"12/2/2012","granularity":"day","time":"2012/12/02 00:00:00 -0500"},"longitude":-77.4432066,"id":"adeypd79lldr","location":"Lily pons rd"},"type":"Feature","geometry":{"type":"Point","coordinates":[-77.4432066,39.2958972]}},{"properties":{"latitude":39.296,"weight":1,"state/province":"US-MD","county":"Frederick","date":{"end_time":"2012/06/25 00:00:00 -0400","original":"6/24/2012","granularity":"day","time":"2012/06/24 00:00:00 -0400"},"longitude":-77.432,"id":"adeypdfzayc0","location":"Lilypons Water Gardens"},"type":"Feature","geometry":{"type":"Point","coordinates":[-77.432,39.296]}},{"properties":{"latitude":39.6807691,"weight":1,"state/province":"US-MD","county":"Garrett","date":{"end_time":"2012/11/18 00:00:00 -0500","original":"11/17/2012","granularity":"day","time":"2012/11/17 00:00:00 -0500"},"longitude":-79.1061115,"id":"adeypdlctmkg","location":"Little Meadows Lake"},"type":"Feature","geometry":{"type":"Point","coordinates":[-79.1061115,39.6807691]}},{"properties":{"latitude":39.7084412,"weight":1,"state/province":"US-MD","county":"Garrett","date":{"end_time":"2012/04/09 00:00:00 -0400","original":"4/8/2012","granularity":"day","time":"2012/04/08 00:00:00 -0400"},"longitude":-79.0035439,"id":"adeypdhqj27t","location":"Piney Reservoir"},"type":"Feature","geometry":{"type":"Point","coordinates":[-79.0035439,39.7084412]}},{"properties":{"latitude":39.5978226,"weight":1,"state/province":"US-MD","county":"Harford","date":{"end_time":"2011/03/21 00:00:00 -0400","original":"3/20/2011","granularity":"day","time":"2011/03/20 00:00:00 -0400"},"longitude":-76.1277276,"id":"adeypdf12hy7","location":"Lapidum"},"type":"Feature","geometry":{"type":"Point","coordinates":[-76.1277276,39.5978226]}},{"properties":{"latitude":39.6123668,"weight":1,"state/province":"US-MD","county":"Harford","date":{"end_time":"2009/08/02 00:00:00 -0400","original":"8/1/2009","granularity":"day","time":"2009/08/01 00:00:00 -0400"},"longitude":-76.149416,"id":"adeypdkfrk93","location":"Susquehanna State Park"},"type":"Feature","geometry":{"type":"Point","coordinates":[-76.149416,39.6123668]}},{"properties":{"latitude":39.522482,"weight":1,"state/province":"US-MD","county":"Harford","date":{"end_time":"2011/12/04 00:00:00 -0500","original":"12/3/2011","granularity":"day","time":"2011/12/03 00:00:00 -0500"},"longitude":-76.11444,"id":"adeypdbbtxkn","location":"Swan Harbor Farm Park"},"type":"Feature","geometry":{"type":"Point","coordinates":[-76.11444,39.522482]}},{"properties":{"latitude":39.5384858,"weight":1,"state/province":"US-MD","county":"Harford","date":{"end_time":"2009/08/02 00:00:00 -0400","original":"8/1/2009","granularity":"day","time":"2009/08/01 00:00:00 -0400"},"longitude":-76.0896134,"id":"adeypdjpuw0r","location":"Tydings Memorial Park, Havre de Grace"},"type":"Feature","geometry":{"type":"Point","coordinates":[-76.0896134,39.5384858]}},{"properties":{"latitude":39.6583889,"weight":1,"state/province":"US-MD","county":"Harford","date":{"end_time":"2013/02/13 00:00:00 -0500","original":"2/12/2013","granularity":"day","time":"2013/02/12 00:00:00 -0500"},"longitude":-76.5145022,"id":"adeypdeoeq63","location":"White Hall, Maryland (private residence)"},"type":"Feature","geometry":{"type":"Point","coordinates":[-76.5145022,39.6583889]}},{"properties":{"latitude":39.326256,"weight":1,"state/province":"US-MD","county":"Howard","date":{"end_time":"2012/10/29 00:00:00 -0400","original":"10/28/2012","granularity":"day","time":"2012/10/28 00:00:00 -0400"},"longitude":-76.8656761,"id":"adeypdcm6m43","location":"Birders' Cavey Lane Location"},"type":"Feature","geometry":{"type":"Point","coordinates":[-76.8656761,39.326256]}},{"properties":{"latitude":39.3103581,"weight":1,"state/province":"US-MD","county":"Howard","date":{"end_time":"2012/12/03 00:00:00 -0500","original":"12/2/2012","granularity":"day","time":"2012/12/02 00:00:00 -0500"},"longitude":-76.9347456,"id":"adeypdi73e4f","location":"Crest Lawn Memorial Gardens"},"type":"Feature","geometry":{"type":"Point","coordinates":[-76.9347456,39.3103581]}},{"properties":{"latitude":39.2426238,"weight":1,"state/province":"US-MD","county":"Howard","date":{"end_time":"2011/08/14 00:00:00 -0400","original":"8/13/2011","granularity":"day","time":"2011/08/13 00:00:00 -0400"},"longitude":-77.0481491,"id":"adeypdla32py","location":"Triadelphia Reservoir--Cattail Creek"},"type":"Feature","geometry":{"type":"Point","coordinates":[-77.0481491,39.2426238]}},{"properties":{"latitude":38.9826977,"weight":1,"state/province":"US-MD","county":"Montgomery","date":{"end_time":"2011/06/12 00:00:00 -0400","original":"6/11/2011","granularity":"day","time":"2011/06/11 00:00:00 -0400"},"longitude":-77.2316766,"id":"adeypd625nzo","location":"C&amp;O Canal--Old Anglers Inn - Bear Island"},"type":"Feature","geometry":{"type":"Point","coordinates":[-77.2316766,38.9826977]}},{"properties":{"latitude":39.1412698,"weight":1,"state/province":"US-MD","county":"Montgomery","date":{"end_time":"2011/03/07 00:00:00 -0500","original":"3/6/2011","granularity":"day","time":"2011/03/06 00:00:00 -0500"},"longitude":-77.3941004,"id":"adeypdhbxit7","location":"LM Stevens Park"},"type":"Feature","geometry":{"type":"Point","coordinates":[-77.3941004,39.1412698]}},{"properties":{"latitude":39.08202,"weight":1,"state/province":"US-MD","county":"Montgomery","date":{"end_time":"2011/12/19 00:00:00 -0500","original":"12/18/2011","granularity":"day","time":"2011/12/18 00:00:00 -0500"},"longitude":-77.4177025,"id":"adeypdlcdlgq","location":"Mckee Beshers (west) &amp; river rd"},"type":"Feature","geometry":{"type":"Point","coordinates":[-77.4177025,39.08202]}},{"properties":{"latitude":38.9737825,"weight":1,"state/province":"US-MD","county":"Montgomery","date":{"end_time":"2012/02/16 00:00:00 -0500","original":"2/15/2012","granularity":"day","time":"2012/02/15 00:00:00 -0500"},"longitude":-77.2163012,"id":"adeypd60pkzl","location":"Potomac gorge - billygoatB"},"type":"Feature","geometry":{"type":"Point","coordinates":[-77.2163012,38.9737825]}},{"properties":{"latitude":39.0683134,"weight":1,"state/province":"US-MD","county":"Montgomery","date":{"end_time":"2011/03/13 00:00:00 -0500","original":"3/12/2011","granularity":"day","time":"2011/03/12 00:00:00 -0500"},"longitude":-77.3361969,"id":"adeypdh5ld2d","location":"violettes to rileys"},"type":"Feature","geometry":{"type":"Point","coordinates":[-77.3361969,39.0683134]}},{"properties":{"latitude":40.39449,"weight":1,"state/province":"US-CO","county":"Morgan","date":{"end_time":"2012/08/05 00:00:00 -0400","original":"8/4/2012","granularity":"day","time":"2012/08/04 00:00:00 -0400"},"longitude":-104.07198,"id":"adeypd7yk9l1","location":"Jackson Reservoir"},"type":"Feature","geometry":{"type":"Point","coordinates":[-104.07198,40.39449]}},{"properties":{"latitude":33.62435,"weight":1,"state/province":"US-GA","county":"Morgan","date":{"end_time":"2007/08/12 00:00:00 -0400","original":"8/11/2007","granularity":"day","time":"2007/08/11 00:00:00 -0400"},"longitude":-83.47685,"id":"adeypd6lrc7t","location":"Morgan"},"type":"Feature","geometry":{"type":"Point","coordinates":[-83.47685,33.62435]}},{"properties":{"latitude":34.6026936,"weight":1,"state/province":"US-GA","county":"Murray","date":{"end_time":"2008/02/25 00:00:00 -0500","original":"2/24/2008","granularity":"day","time":"2008/02/24 00:00:00 -0500"},"longitude":-84.6942043,"id":"adeypd5ld99i","location":"Carter's Lake"},"type":"Feature","geometry":{"type":"Point","coordinates":[-84.6942043,34.6026936]}},{"properties":{"latitude":33.8314,"weight":1,"state/province":"US-GA","county":"Oconee","date":{"end_time":"2007/08/06 00:00:00 -0400","original":"8/5/2007","granularity":"day","time":"2007/08/05 00:00:00 -0400"},"longitude":-83.46261,"id":"adeypd6186zb","location":"Oconee"},"type":"Feature","geometry":{"type":"Point","coordinates":[-83.46261,33.8314]}},{"properties":{"latitude":38.9363,"weight":1,"state/province":"US-MD","county":"Prince George's","date":{"end_time":"2012/02/12 00:00:00 -0500","original":"2/11/2012","granularity":"day","time":"2012/02/11 00:00:00 -0500"},"longitude":-76.938538,"id":"adeypdk0cgic","location":"Bladensburg Waterfront Park"},"type":"Feature","geometry":{"type":"Point","coordinates":[-76.938538,38.9363]}},{"properties":{"latitude":39.0287153,"weight":1,"state/province":"US-MD","county":"Prince George's","date":{"end_time":"2013/02/20 00:00:00 -0500","original":"2/19/2013","granularity":"day","time":"2013/02/19 00:00:00 -0500"},"longitude":-76.800254,"id":"adeypdghvatr","location":"Patuxent Research Refuge--South Tract"},"type":"Feature","geometry":{"type":"Point","coordinates":[-76.800254,39.0287153]}},{"properties":{"latitude":38.6939427,"weight":1,"state/province":"US-MD","county":"Prince George's","date":{"end_time":"2009/12/07 00:00:00 -0500","original":"12/6/2009","granularity":"day","time":"2009/12/06 00:00:00 -0500"},"longitude":-77.054286,"id":"adeypd7hc0cn","location":"Piscataway Park--Boardwalk"},"type":"Feature","geometry":{"type":"Point","coordinates":[-77.054286,38.6939427]}},{"properties":{"latitude":38.9698363,"weight":1,"state/province":"US-MD","county":"Queen Anne's","date":{"end_time":"2012/12/17 00:00:00 -0500","original":"12/16/2012","granularity":"day","time":"2012/12/16 00:00:00 -0500"},"longitude":-76.2390822,"id":"adeypd7ueov9","location":"Kent Narrows--Holiday Inn Express"},"type":"Feature","geometry":{"type":"Point","coordinates":[-76.2390822,38.9698363]}},{"properties":{"latitude":38.962882,"weight":1,"state/province":"US-MD","county":"Queen Anne's","date":{"end_time":"2011/04/03 00:00:00 -0400","original":"4/2/2011","granularity":"day","time":"2011/04/02 00:00:00 -0400"},"longitude":-75.9460616,"id":"adeypdku3oam","location":"Tuckahoe State Park (Queen Anne's County)"},"type":"Feature","geometry":{"type":"Point","coordinates":[-75.9460616,38.962882]}},{"properties":{"latitude":33.438241,"weight":1,"state/province":"US-GA","county":"Richmond","date":{"end_time":"2009/02/01 00:00:00 -0500","original":"1/31/2009","granularity":"day","time":"2009/01/31 00:00:00 -0500"},"longitude":-81.95548,"id":"adeypd96x3yr","location":"Merry Brothers Brickyard Ponds"},"type":"Feature","geometry":{"type":"Point","coordinates":[-81.95548,33.438241]}},{"properties":{"latitude":33.6724257,"weight":1,"state/province":"US-GA","county":"Rockdale","date":{"end_time":"2008/05/03 00:00:00 -0400","original":"5/2/2008","granularity":"day","time":"2008/05/02 00:00:00 -0400"},"longitude":-83.9442158,"id":"adeypd9x86a5","location":"Georgia International Horse Park (Conyers)"},"type":"Feature","geometry":{"type":"Point","coordinates":[-83.9442158,33.6724257]}},{"properties":{"latitude":38.8536119,"weight":1,"state/province":"US-DE","county":"Sussex","date":{"end_time":"2012/07/22 00:00:00 -0400","original":"7/21/2012","granularity":"day","time":"2012/07/21 00:00:00 -0400"},"longitude":-75.2592659,"id":"adeypddog7pg","location":"Prime Hook NWR--Prime Hook Beach Rd."},"type":"Feature","geometry":{"type":"Point","coordinates":[-75.2592659,38.8536119]}},{"properties":{"latitude":35.5767609,"weight":1,"state/province":"US-NC","county":"Swain","date":{"end_time":"2008/05/31 00:00:00 -0400","original":"5/30/2008","granularity":"day","time":"2008/05/30 00:00:00 -0400"},"longitude":-83.3619055,"id":"adeypda645ph","location":"Great Smoky Mountains NP--Swain Co., NC"},"type":"Feature","geometry":{"type":"Point","coordinates":[-83.3619055,35.5767609]}},{"properties":{"latitude":38.862852,"weight":1,"state/province":"US-MD","county":"Talbot","date":{"end_time":"2013/02/05 00:00:00 -0500","original":"2/4/2013","granularity":"day","time":"2013/02/04 00:00:00 -0500"},"longitude":-76.0192323,"id":"adeypde2h79o","location":"stakeout Northern Lapwing, Cordova (2013)"},"type":"Feature","geometry":{"type":"Point","coordinates":[-76.0192323,38.862852]}},{"properties":{"latitude":32.9178613,"weight":1,"state/province":"US-GA","county":"Troup","date":{"end_time":"2008/11/03 00:00:00 -0500","original":"11/2/2008","granularity":"day","time":"2008/11/02 00:00:00 -0400"},"longitude":-85.1910001,"id":"adeypd8zkxpw","location":"West Point Dam"},"type":"Feature","geometry":{"type":"Point","coordinates":[-85.1910001,32.9178613]}},{"properties":{"latitude":39.3242115,"weight":1,"state/province":"US-MD","county":"Washington","date":{"end_time":"2010/05/31 00:00:00 -0400","original":"5/30/2010","granularity":"day","time":"2010/05/30 00:00:00 -0400"},"longitude":-77.7260828,"id":"adeypdlu1qoj","location":"C&amp;O Canal--Harpers Ferry"},"type":"Feature","geometry":{"type":"Point","coordinates":[-77.7260828,39.3242115]}},{"properties":{"latitude":34.8970544,"weight":1,"state/province":"US-GA","county":"Whitfield","date":{"end_time":"2008/12/13 00:00:00 -0500","original":"12/12/2008","granularity":"day","time":"2008/12/12 00:00:00 -0500"},"longitude":-85.007937,"id":"adeypdegderh","location":"Lake Kathy"},"type":"Feature","geometry":{"type":"Point","coordinates":[-85.007937,34.8970544]}},{"properties":{"latitude":38.4538156,"weight":1,"state/province":"US-MD","county":"Wicomico","date":{"end_time":"2011/02/07 00:00:00 -0500","original":"2/6/2011","granularity":"day","time":"2011/02/06 00:00:00 -0500"},"longitude":-75.7559788,"id":"adeypdeiryhq","location":"Mardela Springs Park"},"type":"Feature","geometry":{"type":"Point","coordinates":[-75.7559788,38.4538156]}},{"properties":{"latitude":38.3882597,"weight":1,"state/province":"US-MD","county":"Wicomico","date":{"end_time":"2012/01/08 00:00:00 -0500","original":"1/7/2012","granularity":"day","time":"2012/01/07 00:00:00 -0500"},"longitude":-75.6352687,"id":"adeypd9t5bgt","location":"Salisbury landfill"},"type":"Feature","geometry":{"type":"Point","coordinates":[-75.6352687,38.3882597]}},{"properties":{"latitude":38.205944,"weight":1,"state/province":"US-MD","county":"Worcester","date":{"end_time":"2010/05/02 00:00:00 -0400","original":"5/1/2010","granularity":"day","time":"2010/05/01 00:00:00 -0400"},"longitude":-75.468104,"id":"adeypdijc2ns","location":"Nassawango Creek Preserve"},"type":"Feature","geometry":{"type":"Point","coordinates":[-75.468104,38.205944]}},{"properties":{"latitude":38.2227067,"weight":1,"state/province":"US-MD","county":"Worcester","date":{"end_time":"2010/11/14 00:00:00 -0500","original":"11/13/2010","granularity":"day","time":"2010/11/13 00:00:00 -0500"},"longitude":-75.316987,"id":"adeypdlsu8op","location":"Worcester County Central Landfill"},"type":"Feature","geometry":{"type":"Point","coordinates":[-75.316987,38.2227067]}},{"properties":{"latitude":38.2537682,"weight":1,"state/province":"US-MD","county":"Worcester","date":{"end_time":"2010/11/14 00:00:00 -0500","original":"11/13/2010","granularity":"day","time":"2010/11/13 00:00:00 -0500"},"longitude":-75.2394605,"id":"adeypd8sb13w","location":"croppers island pond"},"type":"Feature","geometry":{"type":"Point","coordinates":[-75.2394605,38.2537682]}},{"properties":{"latitude":38.4620573,"weight":1,"state/province":"US-MD","county":"Dorchester","date":{"end_time":"2013/01/14 00:00:00 -0500","original":"1/13/2013","granularity":"day","time":"2013/01/13 00:00:00 -0500"},"longitude":-75.9553528,"id":"adeypdauis5j","location":"Decoursey Bridge Rd."},"type":"Feature","geometry":{"type":"Point","coordinates":[-75.9553528,38.4620573]}},{"properties":{"latitude":38.4393881,"weight":1,"state/province":"US-MD","county":"Dorchester","date":{"end_time":"2011/02/13 00:00:00 -0500","original":"2/12/2011","granularity":"day","time":"2011/02/12 00:00:00 -0500"},"longitude":-76.1451995,"id":"adeypd5gr82c","location":"Golden Hill Rd"},"type":"Feature","geometry":{"type":"Point","coordinates":[-76.1451995,38.4393881]}},{"properties":{"latitude":38.694286,"weight":1,"state/province":"US-MD","county":"Prince George's","date":{"end_time":"2009/12/07 00:00:00 -0500","original":"12/6/2009","granularity":"day","time":"2009/12/06 00:00:00 -0500"},"longitude":-77.0137739,"id":"adeypd6cgryp","location":"Piscataway Creek--Wharf Road"},"type":"Feature","geometry":{"type":"Point","coordinates":[-77.0137739,38.694286]}},{"properties":{"latitude":38.8319856,"weight":1,"state/province":"US-MD","county":"Caroline","date":{"end_time":"2011/04/03 00:00:00 -0400","original":"4/2/2011","granularity":"day","time":"2011/04/02 00:00:00 -0400"},"longitude":-75.8542657,"id":"adeypd9ltdpf","location":"Choptank River--Williston Road"},"type":"Feature","geometry":{"type":"Point","coordinates":[-75.8542657,38.8319856]}},{"properties":{"latitude":38.8883981,"weight":1,"state/province":"US-MD","county":"Caroline","date":{"end_time":"2011/04/03 00:00:00 -0400","original":"4/2/2011","granularity":"day","time":"2011/04/02 00:00:00 -0400"},"longitude":-75.8381295,"id":"adeypd7gp4j4","location":"Daniel Crouse Memorial Park"},"type":"Feature","geometry":{"type":"Point","coordinates":[-75.8381295,38.8883981]}},{"properties":{"latitude":38.7601573,"weight":1,"state/province":"US-MD","county":"Caroline","date":{"end_time":"2011/04/03 00:00:00 -0400","original":"4/2/2011","granularity":"day","time":"2011/04/02 00:00:00 -0400"},"longitude":-75.7217699,"id":"adeypdcvdbts","location":"Idylwild WMA--Noble Rd."},"type":"Feature","geometry":{"type":"Point","coordinates":[-75.7217699,38.7601573]}},{"properties":{"latitude":39.0499187,"weight":1,"state/province":"US-MD","county":"Caroline","date":{"end_time":"2011/04/03 00:00:00 -0400","original":"4/2/2011","granularity":"day","time":"2011/04/02 00:00:00 -0400"},"longitude":-75.7482862,"id":"adeypdbrd8k5","location":"Jackson Lane"},"type":"Feature","geometry":{"type":"Point","coordinates":[-75.7482862,39.0499187]}},{"properties":{"latitude":38.8607635,"weight":1,"state/province":"US-MD","county":"Caroline","date":{"end_time":"2011/04/03 00:00:00 -0400","original":"4/2/2011","granularity":"day","time":"2011/04/02 00:00:00 -0400"},"longitude":-75.8396101,"id":"adeypd5j5100","location":"Martinak State Park"},"type":"Feature","geometry":{"type":"Point","coordinates":[-75.8396101,38.8607635]}},{"properties":{"latitude":34.351178,"weight":1,"state/province":"US-GA","county":"Dawson","date":{"end_time":"2007/10/08 00:00:00 -0400","original":"10/7/2007","granularity":"day","time":"2007/10/07 00:00:00 -0400"},"longitude":-84.1397381,"id":"adeypdhfrgin","location":"Dawson Forest"},"type":"Feature","geometry":{"type":"Point","coordinates":[-84.1397381,34.351178]}},{"properties":{"latitude":44.3403645,"weight":1,"state/province":"US-ME","county":"Hancock","date":{"end_time":"2011/10/15 00:00:00 -0400","original":"10/14/2011","granularity":"day","time":"2011/10/14 00:00:00 -0400"},"longitude":-68.2512397,"id":"adeypdd0rbwk","location":"Acadia NP"},"type":"Feature","geometry":{"type":"Point","coordinates":[-68.2512397,44.3403645]}},{"properties":{"latitude":38.7732908,"weight":1,"state/province":"US-MD","county":"Prince George's","date":{"end_time":"2012/04/21 00:00:00 -0400","original":"4/20/2012","granularity":"day","time":"2012/04/20 00:00:00 -0400"},"longitude":-76.7106628,"id":"adeypdjs9inn","location":"Patuxent River Park--Jackson Landing"},"type":"Feature","geometry":{"type":"Point","coordinates":[-76.7106628,38.7732908]}},{"properties":{"latitude":38.8724919,"weight":1,"state/province":"US-MD","county":"Talbot","date":{"end_time":"2011/04/03 00:00:00 -0400","original":"4/2/2011","granularity":"day","time":"2011/04/02 00:00:00 -0400"},"longitude":-75.9449244,"id":"adeypd6kyec2","location":"Coveys Landing (Talbot Co.)"},"type":"Feature","geometry":{"type":"Point","coordinates":[-75.9449244,38.8724919]}},{"properties":{"latitude":38.9391024,"weight":1,"state/province":"US-NJ","county":"Cape May","date":{"end_time":"2010/02/21 00:00:00 -0500","original":"2/20/2010","granularity":"day","time":"2010/02/20 00:00:00 -0500"},"longitude":-74.9631287,"id":"adeypd7vy4iq","location":"Cape Island--CMP--Lily Lake"},"type":"Feature","geometry":{"type":"Point","coordinates":[-74.9631287,38.9391024]}},{"properties":{"latitude":38.819,"weight":1,"state/province":"US-MD","county":"Prince George's","date":{"end_time":"2012/02/12 00:00:00 -0500","original":"2/11/2012","granularity":"day","time":"2012/02/11 00:00:00 -0500"},"longitude":-76.752,"id":"adeypd7zerkb","location":"Schoolhouse Pond"},"type":"Feature","geometry":{"type":"Point","coordinates":[-76.752,38.819]}},{"properties":{"latitude":38.5771598,"weight":1,"state/province":"US-MD","county":"Dorchester","date":{"end_time":"2013/01/14 00:00:00 -0500","original":"1/13/2013","granularity":"day","time":"2013/01/13 00:00:00 -0500"},"longitude":-76.0746467,"id":"adeypdgcwhqm","location":"Cambridge Waterfront - Choptank River"},"type":"Feature","geometry":{"type":"Point","coordinates":[-76.0746467,38.5771598]}},{"properties":{"latitude":44.5435052,"weight":1,"state/province":"US-WY","county":"Teton","date":{"end_time":"2007/06/28 00:00:00 -0400","original":"6/27/2007","granularity":"day","time":"2007/06/27 00:00:00 -0400"},"longitude":-110.5993652,"id":"adeypd5gwzmm","location":"Yellowstone NP--Wyoming"},"type":"Feature","geometry":{"type":"Point","coordinates":[-110.5993652,44.5435052]}},{"properties":{"latitude":38.2005864,"weight":1,"state/province":"US-MD","county":"Worcester","date":{"end_time":"2011/11/12 00:00:00 -0500","original":"11/11/2011","granularity":"day","time":"2011/11/11 00:00:00 -0500"},"longitude":-75.1627064,"id":"adeypd62m93z","location":"Assateague I. NS--Ferry Landing"},"type":"Feature","geometry":{"type":"Point","coordinates":[-75.1627064,38.2005864]}},{"properties":{"latitude":38.2618278,"weight":1,"state/province":"US-MD","county":"Worcester","date":{"end_time":"2012/11/25 00:00:00 -0500","original":"11/24/2012","granularity":"day","time":"2012/11/24 00:00:00 -0500"},"longitude":-75.1261915,"id":"adeypdcjcf7b","location":"Assateague Is. km 7-8"},"type":"Feature","geometry":{"type":"Point","coordinates":[-75.1261915,38.2618278]}},{"properties":{"latitude":38.6929964,"weight":1,"state/province":"US-MD","county":"Calvert","date":{"end_time":"2012/12/09 00:00:00 -0500","original":"12/8/2012","granularity":"day","time":"2012/12/08 00:00:00 -0500"},"longitude":-76.5403748,"id":"adeypd7pccol","location":"Chesapeake Beach--marsh and old impoundments"},"type":"Feature","geometry":{"type":"Point","coordinates":[-76.5403748,38.6929964]}},{"properties":{"latitude":38.7067466,"weight":1,"state/province":"US-MD","county":"Calvert","date":{"end_time":"2012/12/09 00:00:00 -0500","original":"12/8/2012","granularity":"day","time":"2012/12/08 00:00:00 -0500"},"longitude":-76.5311413,"id":"adeypdaqvp9e","location":"North Beach--fishing pier"},"type":"Feature","geometry":{"type":"Point","coordinates":[-76.5311413,38.7067466]}},{"properties":{"latitude":38.694554,"weight":1,"state/province":"US-MD","county":"Caroline","date":{"end_time":"2011/04/03 00:00:00 -0400","original":"4/2/2011","granularity":"day","time":"2011/04/02 00:00:00 -0400"},"longitude":-75.9388733,"id":"adeypdl3qj95","location":"Choptank Road"},"type":"Feature","geometry":{"type":"Point","coordinates":[-75.9388733,38.694554]}},{"properties":{"latitude":38.9441234,"weight":1,"state/province":"US-MD","county":"Caroline","date":{"end_time":"2011/04/03 00:00:00 -0400","original":"4/2/2011","granularity":"day","time":"2011/04/02 00:00:00 -0400"},"longitude":-75.9015369,"id":"adeypdhylwqg","location":"Ridgely WWTP"},"type":"Feature","geometry":{"type":"Point","coordinates":[-75.9015369,38.9441234]}},{"properties":{"latitude":38.9054113,"weight":1,"state/province":"US-MD","county":"Caroline","date":{"end_time":"2011/04/03 00:00:00 -0400","original":"4/2/2011","granularity":"day","time":"2011/04/02 00:00:00 -0400"},"longitude":-75.8810878,"id":"adeypd67bjl3","location":"Thawley Road Pond"},"type":"Feature","geometry":{"type":"Point","coordinates":[-75.8810878,38.9054113]}},{"properties":{"latitude":33.9470291,"weight":1,"state/province":"US-GA","county":"Cobb","date":{"end_time":"2009/01/29 00:00:00 -0500","original":"1/28/2009","granularity":"day","time":"2009/01/28 00:00:00 -0500"},"longitude":-84.4027891,"id":"adeypd79q28y","location":"Johnson Ferry Unit (CRNRA)"},"type":"Feature","geometry":{"type":"Point","coordinates":[-84.4027891,33.9470291]}},{"properties":{"latitude":32.6410372,"weight":1,"state/province":"US-TX","county":"Dallas","date":{"end_time":"2012/12/28 00:00:00 -0500","original":"12/27/2012","granularity":"day","time":"2012/12/27 00:00:00 -0500"},"longitude":-96.9767475,"id":"adeypdkk2z58","location":"Joe Pool Lake- Dam area (Dallas Co.)"},"type":"Feature","geometry":{"type":"Point","coordinates":[-96.9767475,32.6410372]}},{"properties":{"latitude":38.5718405,"weight":1,"state/province":"US-MD","county":"Dorchester","date":{"end_time":"2013/03/23 00:00:00 -0400","original":"3/22/2013","granularity":"day","time":"2013/03/22 00:00:00 -0400"},"longitude":-76.062212,"id":"adeypdfymm21","location":"Bill Burton Pier (Dorchester)"},"type":"Feature","geometry":{"type":"Point","coordinates":[-76.062212,38.5718405]}},{"properties":{"latitude":39.3103332,"weight":1,"state/province":"US-MD","county":"Garrett","date":{"end_time":"2012/05/20 00:00:00 -0400","original":"5/19/2012","granularity":"day","time":"2012/05/19 00:00:00 -0400"},"longitude":-79.4711249,"id":"adeypdb4smpi","location":"red house farm"},"type":"Feature","geometry":{"type":"Point","coordinates":[-79.4711249,39.3103332]}},{"properties":{"latitude":38.98438,"weight":1,"state/province":"US-MD","county":"Montgomery","date":{"end_time":"2013/03/10 00:00:00 -0500","original":"3/9/2013","granularity":"day","time":"2013/03/09 00:00:00 -0500"},"longitude":-77.24241,"id":"adeypd5t0t3a","location":"10, Billy Goat Trail Section A"},"type":"Feature","geometry":{"type":"Point","coordinates":[-77.24241,38.98438]}},{"properties":{"latitude":38.9724082,"weight":1,"state/province":"US-MD","county":"Montgomery","date":{"end_time":"2011/08/13 00:00:00 -0400","original":"8/12/2011","granularity":"day","time":"2011/08/12 00:00:00 -0400"},"longitude":-77.1960257,"id":"adeypdh02g85","location":"Carderock Recreation Area"},"type":"Feature","geometry":{"type":"Point","coordinates":[-77.1960257,38.9724082]}},{"properties":{"latitude":38.9699364,"weight":1,"state/province":"US-MD","county":"Queen Anne's","date":{"end_time":"2010/03/21 00:00:00 -0400","original":"3/20/2010","granularity":"day","time":"2010/03/20 00:00:00 -0400"},"longitude":-76.2394953,"id":"adeypddej8uk","location":"holiday inn xpress"},"type":"Feature","geometry":{"type":"Point","coordinates":[-76.2394953,38.9699364]}},{"properties":{"latitude":38.879079,"weight":1,"state/province":"US-DE","county":"Sussex","date":{"end_time":"2012/07/22 00:00:00 -0400","original":"7/21/2012","granularity":"day","time":"2012/07/21 00:00:00 -0400"},"longitude":-75.272948,"id":"adeypdjuby1b","location":"Prime Hook NWR--Fowler Beach Rd."},"type":"Feature","geometry":{"type":"Point","coordinates":[-75.272948,38.879079]}},{"properties":{"latitude":30.2181988,"weight":1,"state/province":"US-TX","county":"Travis","date":{"end_time":"2011/10/08 00:00:00 -0400","original":"10/7/2011","granularity":"day","time":"2011/10/07 00:00:00 -0400"},"longitude":-97.6458054,"id":"adeypdd0pqx0","location":"Hornsby Bend (HOTE 037)"},"type":"Feature","geometry":{"type":"Point","coordinates":[-97.6458054,30.2181988]}},{"properties":{"latitude":37.234292,"weight":1,"state/province":"US-UT","county":"Washington","date":{"end_time":"2007/06/04 00:00:00 -0400","original":"6/3/2007","granularity":"day","time":"2007/06/03 00:00:00 -0400"},"longitude":-112.9619408,"id":"adeypd5j1n1k","location":"Zion NP"},"type":"Feature","geometry":{"type":"Point","coordinates":[-112.9619408,37.234292]}},{"properties":{"latitude":38.4145934,"weight":1,"state/province":"US-MD","county":"Wicomico","date":{"end_time":"2011/09/11 00:00:00 -0400","original":"9/10/2011","granularity":"day","time":"2011/09/10 00:00:00 -0400"},"longitude":-75.5779552,"id":"adeypdcbod7u","location":"Oakwood Turf Farm--Hampshire Road"},"type":"Feature","geometry":{"type":"Point","coordinates":[-75.5779552,38.4145934]}},{"properties":{"latitude":47.6641904,"weight":1,"state/province":"US-MT","county":"Cascade","date":{"end_time":"2007/06/26 00:00:00 -0400","original":"6/25/2007","granularity":"day","time":"2007/06/25 00:00:00 -0400"},"longitude":-111.3007221,"id":"adeypdjvjfvj","location":"Benton Lake NWR"},"type":"Feature","geometry":{"type":"Point","coordinates":[-111.3007221,47.6641904]}},{"properties":{"latitude":32.5436297,"weight":1,"state/province":"US-GA","county":"Peach","date":{"end_time":"2008/08/27 00:00:00 -0400","original":"8/26/2008","granularity":"day","time":"2008/08/26 00:00:00 -0400"},"longitude":-83.7365055,"id":"adeypdixwitz","location":"Perry Super Sod Farm"},"type":"Feature","geometry":{"type":"Point","coordinates":[-83.7365055,32.5436297]}},{"properties":{"latitude":18.4823849,"weight":1,"state/province":"PR-","county":null,"date":{"end_time":"2012/03/15 00:00:00 -0400","original":"3/14/2012","granularity":"day","time":"2012/03/14 00:00:00 -0400"},"longitude":-66.8877855,"id":"adeypdebaomd","location":"PR485 rd pond"},"type":"Feature","geometry":{"type":"Point","coordinates":[-66.8877855,18.4823849]}},{"properties":{"latitude":38.6335001,"weight":1,"state/province":"US-MD","county":"Prince George's","date":{"end_time":"2011/03/28 00:00:00 -0400","original":"3/27/2011","granularity":"day","time":"2011/03/27 00:00:00 -0400"},"longitude":-76.7239666,"id":"adeypdf4s0rb","location":"croom rd pond"},"type":"Feature","geometry":{"type":"Point","coordinates":[-76.7239666,38.6335001]}},{"properties":{"latitude":38.6891276,"weight":1,"state/province":"US-MD","county":"Caroline","date":{"end_time":"2011/04/03 00:00:00 -0400","original":"4/2/2011","granularity":"day","time":"2011/04/02 00:00:00 -0400"},"longitude":-75.9562486,"id":"adeypdjirztk","location":"Poplar Neck Road"},"type":"Feature","geometry":{"type":"Point","coordinates":[-75.9562486,38.6891276]}},{"properties":{"latitude":38.6723643,"weight":1,"state/province":"US-MD","county":"Dorchester","date":{"end_time":"2011/04/03 00:00:00 -0400","original":"4/2/2011","granularity":"day","time":"2011/04/02 00:00:00 -0400"},"longitude":-75.9419632,"id":"adeypdljo1eq","location":"Dorchester Co. as viewed from Choptank Marina"},"type":"Feature","geometry":{"type":"Point","coordinates":[-75.9419632,38.6723643]}},{"properties":{"latitude":38.6736903,"weight":1,"state/province":"US-MD","county":"Talbot","date":{"end_time":"2011/04/03 00:00:00 -0400","original":"4/2/2011","granularity":"day","time":"2011/04/02 00:00:00 -0400"},"longitude":-75.9580221,"id":"adeypd8dhpae","location":"Talbot viewed from Choptank Rd."},"type":"Feature","geometry":{"type":"Point","coordinates":[-75.9580221,38.6736903]}},{"properties":{"latitude":39.0241682,"weight":1,"state/province":"US-MD","county":"Caroline","date":{"end_time":"2011/04/03 00:00:00 -0400","original":"4/2/2011","granularity":"day","time":"2011/04/02 00:00:00 -0400"},"longitude":-75.7854509,"id":"adeypd8ht2r3","location":"Rte 313--Quarry"},"type":"Feature","geometry":{"type":"Point","coordinates":[-75.7854509,39.0241682]}},{"properties":{"latitude":38.9812799,"weight":1,"state/province":"US-MD","county":"Queen Anne's","date":{"end_time":"2011/01/16 00:00:00 -0500","original":"1/15/2011","granularity":"day","time":"2011/01/15 00:00:00 -0500"},"longitude":-76.3344884,"id":"adeypdcl6afr","location":"Hemmingway's rest"},"type":"Feature","geometry":{"type":"Point","coordinates":[-76.3344884,38.9812799]}},{"properties":{"latitude":38.2163343,"weight":1,"state/province":"US-MD","county":"Worcester","date":{"end_time":"2012/02/27 00:00:00 -0500","original":"2/26/2012","granularity":"day","time":"2012/02/26 00:00:00 -0500"},"longitude":-75.1916742,"id":"adeypdie2s4w","location":"South Point"},"type":"Feature","geometry":{"type":"Point","coordinates":[-75.1916742,38.2163343]}},{"properties":{"latitude":39.10672,"weight":1,"state/province":"US-NJ","county":"Cape May","date":{"end_time":"2010/02/21 00:00:00 -0500","original":"2/20/2010","granularity":"day","time":"2010/02/20 00:00:00 -0500"},"longitude":-74.703598,"id":"adeypdgim3vi","location":"Avalon--8th St. Jetty"},"type":"Feature","geometry":{"type":"Point","coordinates":[-74.703598,39.10672]}},{"properties":{"latitude":38.9238936,"weight":1,"state/province":"US-NJ","county":"Cape May","date":{"end_time":"2010/02/21 00:00:00 -0500","original":"2/20/2010","granularity":"day","time":"2010/02/20 00:00:00 -0500"},"longitude":-75.0242615,"id":"adeypdljllt6","location":"Cape May-Lewes Ferry (NJ waters)"},"type":"Feature","geometry":{"type":"Point","coordinates":[-75.0242615,38.9238936]}},{"properties":{"latitude":38.5719286,"weight":1,"state/province":"US-MD","county":"Dorchester","date":{"end_time":"2013/01/06 00:00:00 -0500","original":"1/5/2013","granularity":"day","time":"2013/01/05 00:00:00 -0500"},"longitude":-76.0639823,"id":"adeypdcwo4gi","location":"Cambridge--Visitor Center"},"type":"Feature","geometry":{"type":"Point","coordinates":[-76.0639823,38.5719286]}},{"properties":{"latitude":38.8308824,"weight":1,"state/province":"US-DE","county":"Sussex","date":{"end_time":"2010/02/21 00:00:00 -0500","original":"2/20/2010","granularity":"day","time":"2010/02/20 00:00:00 -0500"},"longitude":-75.1073456,"id":"adeypd7vv726","location":"Lewes-Cape May Ferry (DE waters)"},"type":"Feature","geometry":{"type":"Point","coordinates":[-75.1073456,38.8308824]}},{"properties":{"latitude":38.763056,"weight":1,"state/province":"US-DE","county":"Sussex","date":{"end_time":"2011/02/06 00:00:00 -0500","original":"2/5/2011","granularity":"day","time":"2011/02/05 00:00:00 -0500"},"longitude":-74.9875,"id":"adeypdkoqyll","location":"Pelagic 5 Feb 2011--07:15-07:30"},"type":"Feature","geometry":{"type":"Point","coordinates":[-74.9875,38.763056]}},{"properties":{"latitude":38.723333,"weight":1,"state/province":"US-DE","county":"Sussex","date":{"end_time":"2011/02/06 00:00:00 -0500","original":"2/5/2011","granularity":"day","time":"2011/02/05 00:00:00 -0500"},"longitude":-74.923889,"id":"adeypdibafi6","location":"Pelagic 5 Feb 2011--07:30-08:00"},"type":"Feature","geometry":{"type":"Point","coordinates":[-74.923889,38.723333]}},{"properties":{"latitude":38.30114,"weight":1,"state/province":"US-MD","county":"Worcester","date":{"end_time":"2013/03/03 00:00:00 -0500","original":"3/2/2013","granularity":"day","time":"2013/03/02 00:00:00 -0500"},"longitude":-74.99919,"id":"adeypdjh8lz1","location":"Pelagic 02 Mar 2013-06:30-07:00"},"type":"Feature","geometry":{"type":"Point","coordinates":[-74.99919,38.30114]}},{"properties":{"latitude":38.5352759,"weight":1,"state/province":"US-DE","county":"Sussex","date":{"end_time":"2011/02/06 00:00:00 -0500","original":"2/5/2011","granularity":"day","time":"2011/02/05 00:00:00 -0500"},"longitude":-74.9102783,"id":"adeypd7gvz1p","location":"offshore delaware"},"type":"Feature","geometry":{"type":"Point","coordinates":[-74.9102783,38.5352759]}},{"properties":{"latitude":38.40793,"weight":1,"state/province":"US-MD","county":"Worcester","date":{"end_time":"2013/03/03 00:00:00 -0500","original":"3/2/2013","granularity":"day","time":"2013/03/02 00:00:00 -0500"},"longitude":-74.49566,"id":"adeypd6cmz1h","location":"Pelagic 02 Mar 2013-09:30-10:00"},"type":"Feature","geometry":{"type":"Point","coordinates":[-74.49566,38.40793]}},{"properties":{"latitude":38.603056,"weight":1,"state/province":"US-DE","county":"Sussex","date":{"end_time":"2011/02/06 00:00:00 -0500","original":"2/5/2011","granularity":"day","time":"2011/02/05 00:00:00 -0500"},"longitude":-74.708333,"id":"adeypd5qdtp1","location":"Pelagic 5 Feb 2011--08:30-09:00"},"type":"Feature","geometry":{"type":"Point","coordinates":[-74.708333,38.603056]}},{"properties":{"latitude":38.3236461,"weight":1,"state/province":"US-MD","county":"Dorchester","date":{"end_time":"2013/01/06 00:00:00 -0500","original":"1/5/2013","granularity":"day","time":"2013/01/05 00:00:00 -0500"},"longitude":-76.0690784,"id":"adeypdfhjbvk","location":"Cedar Creek Rd. (Dorchester Co)"},"type":"Feature","geometry":{"type":"Point","coordinates":[-76.0690784,38.3236461]}},{"properties":{"latitude":48.644763,"weight":1,"state/province":"US-MT","county":"Glacier","date":{"end_time":"2007/06/24 00:00:00 -0400","original":"6/23/2007","granularity":"day","time":"2007/06/23 00:00:00 -0400"},"longitude":-113.690432,"id":"adeypdl7ysmg","location":"Glacier NP"},"type":"Feature","geometry":{"type":"Point","coordinates":[-113.690432,48.644763]}},{"properties":{"latitude":38.1978021,"weight":1,"state/province":"US-MD","county":"St. Mary's","date":{"end_time":"2012/11/05 00:00:00 -0500","original":"11/4/2012","granularity":"day","time":"2012/11/04 00:00:00 -0400"},"longitude":-76.3678438,"id":"adeypdjallse","location":"Elms Beach Park"},"type":"Feature","geometry":{"type":"Point","coordinates":[-76.3678438,38.1978021]}},{"properties":{"latitude":38.782281,"weight":1,"state/province":"US-DE","county":"Sussex","date":{"end_time":"2010/02/21 00:00:00 -0500","original":"2/20/2010","granularity":"day","time":"2010/02/20 00:00:00 -0500"},"longitude":-75.119763,"id":"adeypdhy344h","location":"Lewes Ferry Terminal"},"type":"Feature","geometry":{"type":"Point","coordinates":[-75.119763,38.782281]}},{"properties":{"latitude":38.0574856,"weight":1,"state/province":"US-MD","county":"St. Mary's","date":{"end_time":"2012/01/02 00:00:00 -0500","original":"1/1/2012","granularity":"day","time":"2012/01/01 00:00:00 -0500"},"longitude":-76.3529205,"id":"adeypd8te8di","location":"Cornfield Harbor"},"type":"Feature","geometry":{"type":"Point","coordinates":[-76.3529205,38.0574856]}},{"properties":{"latitude":26.2644011,"weight":1,"state/province":"US-TX","county":"Cameron","date":{"end_time":"2008/06/30 00:00:00 -0400","original":"6/29/2008","granularity":"day","time":"2008/06/29 00:00:00 -0400"},"longitude":-97.3870182,"id":"adeypdckbdyp","location":"Laguna Atascosa NWR (LTC 024)"},"type":"Feature","geometry":{"type":"Point","coordinates":[-97.3870182,26.2644011]}},{"properties":{"latitude":26.0615634,"weight":1,"state/province":"US-TX","county":"Hidalgo","date":{"end_time":"2008/07/01 00:00:00 -0400","original":"6/30/2008","granularity":"day","time":"2008/06/30 00:00:00 -0400"},"longitude":-98.1492805,"id":"adeypdban3pb","location":"Santa Ana NWR (LTC 059)"},"type":"Feature","geometry":{"type":"Point","coordinates":[-98.1492805,26.0615634]}},{"properties":{"latitude":10.30386,"weight":1,"state/province":"CR-P","county":null,"date":{"end_time":"2010/08/25 00:00:00 -0400","original":"8/24/2010","granularity":"day","time":"2010/08/24 00:00:00 -0400"},"longitude":-84.81654,"id":"adeypdjcwm5t","location":"Monteverde--Bajo del Tigre"},"type":"Feature","geometry":{"type":"Point","coordinates":[-84.81654,10.30386]}},{"properties":{"latitude":10.4361,"weight":1,"state/province":"CR-A","county":null,"date":{"end_time":"2010/08/23 00:00:00 -0400","original":"8/22/2010","granularity":"day","time":"2010/08/22 00:00:00 -0400"},"longitude":-84.7107,"id":"adeypdcahzaq","location":"Arenal Observatory Lodge"},"type":"Feature","geometry":{"type":"Point","coordinates":[-84.7107,10.4361]}},{"properties":{"latitude":48.15347,"weight":1,"state/province":"US-WA","county":"Clallam","date":{"end_time":"2007/06/20 00:00:00 -0400","original":"6/19/2007","granularity":"day","time":"2007/06/19 00:00:00 -0400"},"longitude":-123.17553,"id":"adeypddllybj","location":"Dungeness NWR--Harbor side"},"type":"Feature","geometry":{"type":"Point","coordinates":[-123.17553,48.15347]}},{"properties":{"latitude":38.4184267,"weight":1,"state/province":"US-MD","county":"Dorchester","date":{"end_time":"2011/04/30 00:00:00 -0400","original":"4/29/2011","granularity":"day","time":"2011/04/29 00:00:00 -0400"},"longitude":-75.9368134,"id":"adeypd5vo0db","location":"Griffith Neck Rd"},"type":"Feature","geometry":{"type":"Point","coordinates":[-75.9368134,38.4184267]}},{"properties":{"latitude":38.4176869,"weight":1,"state/province":"US-MD","county":"Dorchester","date":{"end_time":"2009/07/29 00:00:00 -0400","original":"7/28/2009","granularity":"day","time":"2009/07/28 00:00:00 -0400"},"longitude":-75.9350967,"id":"adeypdikgspa","location":"bobwhite"},"type":"Feature","geometry":{"type":"Point","coordinates":[-75.9350967,38.4176869]}},{"properties":{"latitude":33.1247572,"weight":1,"state/province":"US-GA","county":"Jones","date":{"end_time":"2008/05/07 00:00:00 -0400","original":"5/6/2008","granularity":"day","time":"2008/05/06 00:00:00 -0400"},"longitude":-83.7522125,"id":"adeypdlhlvza","location":"Piedmont NWR"},"type":"Feature","geometry":{"type":"Point","coordinates":[-83.7522125,33.1247572]}},{"properties":{"latitude":40.355,"weight":1,"state/province":"US-CO","county":"Larimer","date":{"end_time":"2012/08/09 00:00:00 -0400","original":"8/8/2012","granularity":"day","time":"2012/08/08 00:00:00 -0400"},"longitude":-105.635,"id":"adeypd8djly8","location":"RMNP--Fern Lake Trail"},"type":"Feature","geometry":{"type":"Point","coordinates":[-105.635,40.355]}},{"properties":{"latitude":47.9457865,"weight":1,"state/province":"US-WA","county":"Clallam","date":{"end_time":"2007/06/19 00:00:00 -0400","original":"6/18/2007","granularity":"day","time":"2007/06/18 00:00:00 -0400"},"longitude":-123.5302734,"id":"adeypdac9ddg","location":"Olympic National Park"},"type":"Feature","geometry":{"type":"Point","coordinates":[-123.5302734,47.9457865]}},{"properties":{"latitude":38.5542066,"weight":1,"state/province":"US-MD","county":"Dorchester","date":{"end_time":"2010/05/02 00:00:00 -0400","original":"5/1/2010","granularity":"day","time":"2010/05/01 00:00:00 -0400"},"longitude":-75.9824324,"id":"adeypde6zt7i","location":"Route 50 at Chateau Rd"},"type":"Feature","geometry":{"type":"Point","coordinates":[-75.9824324,38.5542066]}},{"properties":{"latitude":34.030825,"weight":1,"state/province":"US-GA","county":"Madison","date":{"end_time":"2008/03/10 00:00:00 -0400","original":"3/9/2008","granularity":"day","time":"2008/03/09 00:00:00 -0500"},"longitude":-83.0421352,"id":"adeypdiqrocy","location":"Fisher house"},"type":"Feature","geometry":{"type":"Point","coordinates":[-83.0421352,34.030825]}},{"properties":{"latitude":39.0993601,"weight":1,"state/province":"US-MD","county":"Montgomery","date":{"end_time":"2011/04/17 00:00:00 -0400","original":"4/16/2011","granularity":"day","time":"2011/04/16 00:00:00 -0400"},"longitude":-77.3504019,"id":"adeypdig36h5","location":"montevideo road"},"type":"Feature","geometry":{"type":"Point","coordinates":[-77.3504019,39.0993601]}},{"properties":{"latitude":38.4848453,"weight":1,"state/province":"US-MD","county":"Wicomico","date":{"end_time":"2011/09/11 00:00:00 -0400","original":"9/10/2011","granularity":"day","time":"2011/09/10 00:00:00 -0400"},"longitude":-75.7832032,"id":"adeypdip4xbs","location":"Old Bradley Road"},"type":"Feature","geometry":{"type":"Point","coordinates":[-75.7832032,38.4848453]}},{"properties":{"latitude":38.560833,"weight":1,"state/province":"US-DE","county":"Sussex","date":{"end_time":"2011/02/06 00:00:00 -0500","original":"2/5/2011","granularity":"day","time":"2011/02/05 00:00:00 -0500"},"longitude":-74.659722,"id":"adeypdfe07i3","location":"Pelagic 5 Feb 2011--09:00-09:30"},"type":"Feature","geometry":{"type":"Point","coordinates":[-74.659722,38.560833]}},{"properties":{"latitude":38.3175,"weight":1,"state/province":"US-MD","county":"Worcester","date":{"end_time":"2013/03/03 00:00:00 -0500","original":"3/2/2013","granularity":"day","time":"2013/03/02 00:00:00 -0500"},"longitude":-74.81279,"id":"adeypdlaz9v9","location":"Pelagic 02 Mar 2013-07:30-08:00"},"type":"Feature","geometry":{"type":"Point","coordinates":[-74.81279,38.3175]}},{"properties":{"latitude":34.0274818,"weight":1,"state/province":"US-GA","county":"Elbert","date":{"end_time":"2009/05/18 00:00:00 -0400","original":"5/17/2009","granularity":"day","time":"2009/05/17 00:00:00 -0400"},"longitude":-82.5953865,"id":"adeypd9r8n3b","location":"Lake Richard B Russel Dam"},"type":"Feature","geometry":{"type":"Point","coordinates":[-82.5953865,34.0274818]}},{"properties":{"latitude":31.6263444,"weight":1,"state/province":"US-GA","county":"Clay","date":{"end_time":"2008/11/23 00:00:00 -0500","original":"11/22/2008","granularity":"day","time":"2008/11/22 00:00:00 -0500"},"longitude":-85.061903,"id":"adeypdhidmi7","location":"Walter F. George Dam"},"type":"Feature","geometry":{"type":"Point","coordinates":[-85.061903,31.6263444]}},{"properties":{"latitude":38.652222,"weight":1,"state/province":"US-DE","county":"Sussex","date":{"end_time":"2011/02/06 00:00:00 -0500","original":"2/5/2011","granularity":"day","time":"2011/02/05 00:00:00 -0500"},"longitude":-74.785833,"id":"adeypdd71ouc","location":"Pelagic 5 Feb 2011--08:00-08:30"},"type":"Feature","geometry":{"type":"Point","coordinates":[-74.785833,38.652222]}},{"properties":{"latitude":38.517222,"weight":1,"state/province":"US-DE","county":"Sussex","date":{"end_time":"2011/02/06 00:00:00 -0500","original":"2/5/2011","granularity":"day","time":"2011/02/05 00:00:00 -0500"},"longitude":-74.615,"id":"adeypd8ziibp","location":"Pelagic 5 Feb 2011--09:30-10:00"},"type":"Feature","geometry":{"type":"Point","coordinates":[-74.615,38.517222]}},{"properties":{"latitude":38.441667,"weight":1,"state/province":"US-DE","county":"Sussex","date":{"end_time":"2011/02/06 00:00:00 -0500","original":"2/5/2011","granularity":"day","time":"2011/02/05 00:00:00 -0500"},"longitude":-74.481111,"id":"adeypd66u94z","location":"Pelagic 5 Feb 2011--10:00-10:30"},"type":"Feature","geometry":{"type":"Point","coordinates":[-74.481111,38.441667]}},{"properties":{"latitude":38.3365902,"weight":1,"state/province":"US-MD","county":"Worcester","date":{"end_time":"2010/05/02 00:00:00 -0400","original":"5/1/2010","granularity":"day","time":"2010/05/01 00:00:00 -0400"},"longitude":-75.0875616,"id":"adeypdfjvn7d","location":"Ocean City - 4th St"},"type":"Feature","geometry":{"type":"Point","coordinates":[-75.0875616,38.3365902]}},{"properties":{"latitude":38.31401,"weight":1,"state/province":"US-MD","county":"Worcester","date":{"end_time":"2013/03/03 00:00:00 -0500","original":"3/2/2013","granularity":"day","time":"2013/03/02 00:00:00 -0500"},"longitude":-74.96744,"id":"adeypd89im81","location":"Pelagic 02 Mar 2013-17:00-17:30"},"type":"Feature","geometry":{"type":"Point","coordinates":[-74.96744,38.31401]}},{"properties":{"latitude":33.0798196,"weight":1,"state/province":"US-GA","county":"Monroe","date":{"end_time":"2009/03/11 00:00:00 -0400","original":"3/10/2009","granularity":"day","time":"2009/03/10 00:00:00 -0400"},"longitude":-83.8139248,"id":"adeypdk3sitx","location":"Ash Pond"},"type":"Feature","geometry":{"type":"Point","coordinates":[-83.8139248,33.0798196]}},{"properties":{"latitude":37.77493,"weight":1,"state/province":"US-CA","county":"San Francisco","date":{"end_time":"2007/06/15 00:00:00 -0400","original":"6/14/2007","granularity":"day","time":"2007/06/14 00:00:00 -0400"},"longitude":-122.41908,"id":"adeypdabjcwu","location":"San Francisco"},"type":"Feature","geometry":{"type":"Point","coordinates":[-122.41908,37.77493]}},{"properties":{"latitude":18.4891345,"weight":1,"state/province":"PR-","county":null,"date":{"end_time":"2012/03/15 00:00:00 -0400","original":"3/14/2012","granularity":"day","time":"2012/03/14 00:00:00 -0400"},"longitude":-66.8677464,"id":"adeypd5rrz95","location":"Charca Salobre Los Amadores"},"type":"Feature","geometry":{"type":"Point","coordinates":[-66.8677464,18.4891345]}},{"properties":{"latitude":38.04217,"weight":1,"state/province":"US-MD","county":"Worcester","date":{"end_time":"2012/08/26 00:00:00 -0400","original":"8/25/2012","granularity":"day","time":"2012/08/25 00:00:00 -0400"},"longitude":-73.35942,"id":"adeypd9hiwt7","location":"Pelagic 25 Aug 2012--07:30-08:00"},"type":"Feature","geometry":{"type":"Point","coordinates":[-73.35942,38.04217]}},{"properties":{"latitude":31.5433333,"weight":1,"state/province":"US-GA","county":"Chatham","date":{"end_time":"2009/06/15 00:00:00 -0400","original":"6/14/2009","granularity":"day","time":"2009/06/14 00:00:00 -0400"},"longitude":-80.3055556,"id":"adeypdb0ihbe","location":"M2R6"},"type":"Feature","geometry":{"type":"Point","coordinates":[-80.3055556,31.5433333]}},{"properties":{"latitude":38.32265,"weight":1,"state/province":"US-NJ","county":"Cape May","date":{"end_time":"2012/08/26 00:00:00 -0400","original":"8/25/2012","granularity":"day","time":"2012/08/25 00:00:00 -0400"},"longitude":-73.43402,"id":"adeypdj6zefq","location":"Pelagic 25 Aug 2012--11:00-11:30"},"type":"Feature","geometry":{"type":"Point","coordinates":[-73.43402,38.32265]}},{"properties":{"latitude":38.36474,"weight":1,"state/province":"US-NJ","county":"Cape May","date":{"end_time":"2012/08/26 00:00:00 -0400","original":"8/25/2012","granularity":"day","time":"2012/08/25 00:00:00 -0400"},"longitude":-73.42815,"id":"adeypdhuglfa","location":"Pelagic 25 Aug 2012--11:30-12:00"},"type":"Feature","geometry":{"type":"Point","coordinates":[-73.42815,38.36474]}},{"properties":{"latitude":38.05544,"weight":1,"state/province":"US-MD","county":"Worcester","date":{"end_time":"2012/08/26 00:00:00 -0400","original":"8/25/2012","granularity":"day","time":"2012/08/25 00:00:00 -0400"},"longitude":-73.47647,"id":"adeypdgmazg1","location":"Pelagic 25 Aug 2012--06:00-06:30"},"type":"Feature","geometry":{"type":"Point","coordinates":[-73.47647,38.05544]}},{"properties":{"latitude":31.2361111,"weight":1,"state/province":"US-GA","county":"Liberty","date":{"end_time":"2009/06/15 00:00:00 -0400","original":"6/14/2009","granularity":"day","time":"2009/06/14 00:00:00 -0400"},"longitude":-79.8027778,"id":"adeypda3j54b","location":"Gulf Stream"},"type":"Feature","geometry":{"type":"Point","coordinates":[-79.8027778,31.2361111]}},{"properties":{"latitude":38.2061508,"weight":1,"state/province":"US-MD","county":"Worcester","date":{"end_time":"2011/07/24 00:00:00 -0400","original":"7/23/2011","granularity":"day","time":"2011/07/23 00:00:00 -0400"},"longitude":-75.1491022,"id":"adeypdfhn0bz","location":"Assateague NS - beach near gate"},"type":"Feature","geometry":{"type":"Point","coordinates":[-75.1491022,38.2061508]}},{"properties":{"latitude":31.2972222,"weight":1,"state/province":"US-SC","county":null,"date":{"end_time":"2009/06/15 00:00:00 -0400","original":"6/14/2009","granularity":"day","time":"2009/06/14 00:00:00 -0400"},"longitude":-77.7686111,"id":"adeypda79odv","location":"Gulf Stream 2"},"type":"Feature","geometry":{"type":"Point","coordinates":[-77.7686111,31.2972222]}},{"properties":{"latitude":18.4907009,"weight":1,"state/province":"PR-","county":null,"date":{"end_time":"2012/03/15 00:00:00 -0400","original":"3/14/2012","granularity":"day","time":"2012/03/14 00:00:00 -0400"},"longitude":-66.9508068,"id":"adeypd5judxg","location":"El Merendero de Guajataca"},"type":"Feature","geometry":{"type":"Point","coordinates":[-66.9508068,18.4907009]}},{"properties":{"latitude":31.0117481,"weight":1,"state/province":"US-GA","county":"Glynn","date":{"end_time":"2008/11/09 00:00:00 -0500","original":"11/8/2008","granularity":"day","time":"2008/11/08 00:00:00 -0500"},"longitude":-81.4304924,"id":"adeypdjbwd79","location":"Jekyll Island--South Beach"},"type":"Feature","geometry":{"type":"Point","coordinates":[-81.4304924,31.0117481]}},{"properties":{"latitude":31.6428598,"weight":1,"state/province":"US-GA","county":"Liberty","date":{"end_time":"2007/10/14 00:00:00 -0400","original":"10/13/2007","granularity":"day","time":"2007/10/13 00:00:00 -0400"},"longitude":-81.1573792,"id":"adeypdg647vb","location":"St. Catherine's Island"},"type":"Feature","geometry":{"type":"Point","coordinates":[-81.1573792,31.6428598]}},{"properties":{"latitude":31.4219457,"weight":1,"state/province":"US-GA","county":"McIntosh","date":{"end_time":"2007/10/13 00:00:00 -0400","original":"10/12/2007","granularity":"day","time":"2007/10/12 00:00:00 -0400"},"longitude":-81.2786736,"id":"adeypdkaj85i","location":"Sapelo Island"},"type":"Feature","geometry":{"type":"Point","coordinates":[-81.2786736,31.4219457]}},{"properties":{"latitude":28.06654,"weight":1,"state/province":"US-FL","county":null,"date":{"end_time":"2007/04/21 00:00:00 -0400","original":"4/20/2007","granularity":"day","time":"2007/04/20 00:00:00 -0400"},"longitude":-81.69403,"id":"adeypddnzodl","location":"Florida"},"type":"Feature","geometry":{"type":"Point","coordinates":[-81.69403,28.06654]}},{"properties":{"latitude":18.3651667,"weight":1,"state/province":"PR-","county":null,"date":{"end_time":"2012/03/11 00:00:00 -0500","original":"3/10/2012","granularity":"day","time":"2012/03/10 00:00:00 -0500"},"longitude":-65.6332833,"id":"adeypd5tqixq","location":"Las Croabas"},"type":"Feature","geometry":{"type":"Point","coordinates":[-65.6332833,18.3651667]}},{"properties":{"latitude":17.9742187,"weight":1,"state/province":"PR-","county":null,"date":{"end_time":"2012/03/12 00:00:00 -0400","original":"3/11/2012","granularity":"day","time":"2012/03/11 00:00:00 -0500"},"longitude":-67.0563852,"id":"adeypdjx66bg","location":"Parguera - ferreteria/field"},"type":"Feature","geometry":{"type":"Point","coordinates":[-67.0563852,17.9742187]}},{"properties":{"latitude":18.342257,"weight":1,"state/province":"PR-","county":null,"date":{"end_time":"2012/03/13 00:00:00 -0400","original":"3/12/2012","granularity":"day","time":"2012/03/12 00:00:00 -0400"},"longitude":-67.256555,"id":"adeypdbapjfd","location":"PR-Rincn 18.3423x-67.2566"},"type":"Feature","geometry":{"type":"Point","coordinates":[-67.256555,18.342257]}},{"properties":{"latitude":31.641667,"weight":1,"state/province":"US-GA","county":"Chatham","date":{"end_time":"2009/06/15 00:00:00 -0400","original":"6/14/2009","granularity":"day","time":"2009/06/14 00:00:00 -0400"},"longitude":-80.437778,"id":"adeypd9j2q98","location":"GA offshore waters (Tybee)"},"type":"Feature","geometry":{"type":"Point","coordinates":[-80.437778,31.641667]}},{"properties":{"latitude":38.43167,"weight":1,"state/province":"US-DE","county":"Sussex","date":{"end_time":"2011/02/06 00:00:00 -0500","original":"2/5/2011","granularity":"day","time":"2011/02/05 00:00:00 -0500"},"longitude":-74.62444,"id":"adeypdc59lxm","location":"Pelagic 5 Feb 2011--15:30-16:00"},"type":"Feature","geometry":{"type":"Point","coordinates":[-74.62444,38.43167]}},{"properties":{"latitude":38.29495,"weight":1,"state/province":"US-MD","county":"Worcester","date":{"end_time":"2013/03/03 00:00:00 -0500","original":"3/2/2013","granularity":"day","time":"2013/03/02 00:00:00 -0500"},"longitude":-74.90961,"id":"adeypdej72fs","location":"Pelagic 02 Mar 2013-07:00-07:30"},"type":"Feature","geometry":{"type":"Point","coordinates":[-74.90961,38.29495]}},{"properties":{"latitude":38.42159,"weight":1,"state/province":"US-MD","county":"Worcester","date":{"end_time":"2013/03/03 00:00:00 -0500","original":"3/2/2013","granularity":"day","time":"2013/03/02 00:00:00 -0500"},"longitude":-74.67672,"id":"adeypde6hq1n","location":"Pelagic 02 Mar 2013-08:30-09:00"},"type":"Feature","geometry":{"type":"Point","coordinates":[-74.67672,38.42159]}},{"properties":{"latitude":38.41518,"weight":1,"state/province":"US-MD","county":"Worcester","date":{"end_time":"2013/03/03 00:00:00 -0500","original":"3/2/2013","granularity":"day","time":"2013/03/02 00:00:00 -0500"},"longitude":-74.587,"id":"adeypdkuojpv","location":"Pelagic 02 Mar 2013-09:00-09:30"},"type":"Feature","geometry":{"type":"Point","coordinates":[-74.587,38.41518]}},{"properties":{"latitude":38.39531,"weight":1,"state/province":"US-MD","county":"Worcester","date":{"end_time":"2013/03/03 00:00:00 -0500","original":"3/2/2013","granularity":"day","time":"2013/03/02 00:00:00 -0500"},"longitude":-74.41305,"id":"adeypdd0e6j7","location":"Pelagic 02 Mar 2013-10:00-10:30"},"type":"Feature","geometry":{"type":"Point","coordinates":[-74.41305,38.39531]}},{"properties":{"latitude":38.37736,"weight":1,"state/province":"US-MD","county":"Worcester","date":{"end_time":"2013/03/03 00:00:00 -0500","original":"3/2/2013","granularity":"day","time":"2013/03/02 00:00:00 -0500"},"longitude":-74.35545,"id":"adeypd680tag","location":"Pelagic 02 Mar 2013-10:30-11:00"},"type":"Feature","geometry":{"type":"Point","coordinates":[-74.35545,38.37736]}},{"properties":{"latitude":38.34629,"weight":1,"state/province":"US-MD","county":"Worcester","date":{"end_time":"2013/03/03 00:00:00 -0500","original":"3/2/2013","granularity":"day","time":"2013/03/02 00:00:00 -0500"},"longitude":-74.31616,"id":"adeypdlgp1xh","location":"Pelagic 02 Mar 2013-11:00-11:30"},"type":"Feature","geometry":{"type":"Point","coordinates":[-74.31616,38.34629]}},{"properties":{"latitude":38.2987,"weight":1,"state/province":"US-MD","county":"Worcester","date":{"end_time":"2013/03/03 00:00:00 -0500","original":"3/2/2013","granularity":"day","time":"2013/03/02 00:00:00 -0500"},"longitude":-74.26141,"id":"adeypd6hqong","location":"Pelagic 02 Mar 2013-11:30-12:00"},"type":"Feature","geometry":{"type":"Point","coordinates":[-74.26141,38.2987]}},{"properties":{"latitude":38.29462,"weight":1,"state/province":"US-MD","county":"Worcester","date":{"end_time":"2013/03/03 00:00:00 -0500","original":"3/2/2013","granularity":"day","time":"2013/03/02 00:00:00 -0500"},"longitude":-74.19714,"id":"adeypdh9vtaz","location":"Pelagic 02 Mar 2013-12:00-12:30"},"type":"Feature","geometry":{"type":"Point","coordinates":[-74.19714,38.29462]}},{"properties":{"latitude":38.28099,"weight":1,"state/province":"US-MD","county":"Worcester","date":{"end_time":"2013/03/03 00:00:00 -0500","original":"3/2/2013","granularity":"day","time":"2013/03/02 00:00:00 -0500"},"longitude":-74.11791,"id":"adeypdarbn9a","location":"Pelagic 02 Mar 2013-12:30-13:00"},"type":"Feature","geometry":{"type":"Point","coordinates":[-74.11791,38.28099]}},{"properties":{"latitude":38.26067,"weight":1,"state/province":"US-MD","county":"Worcester","date":{"end_time":"2013/03/03 00:00:00 -0500","original":"3/2/2013","granularity":"day","time":"2013/03/02 00:00:00 -0500"},"longitude":-74.16131,"id":"adeypdazamwe","location":"Pelagic 02 Mar 2013-13:00-13:30"},"type":"Feature","geometry":{"type":"Point","coordinates":[-74.16131,38.26067]}},{"properties":{"latitude":38.26707,"weight":1,"state/province":"US-MD","county":"Worcester","date":{"end_time":"2013/03/03 00:00:00 -0500","original":"3/2/2013","granularity":"day","time":"2013/03/02 00:00:00 -0500"},"longitude":-74.25686,"id":"adeypd9xrp94","location":"Pelagic 02 Mar 2013-13:30-14:00"},"type":"Feature","geometry":{"type":"Point","coordinates":[-74.25686,38.26707]}},{"properties":{"latitude":38.27537,"weight":1,"state/province":"US-MD","county":"Worcester","date":{"end_time":"2013/03/03 00:00:00 -0500","original":"3/2/2013","granularity":"day","time":"2013/03/02 00:00:00 -0500"},"longitude":-74.35628,"id":"adeypd7pmwzu","location":"Pelagic 02 Mar 2013-14:00-14:30"},"type":"Feature","geometry":{"type":"Point","coordinates":[-74.35628,38.27537]}},{"properties":{"latitude":38.2806,"weight":1,"state/province":"US-MD","county":"Worcester","date":{"end_time":"2013/03/03 00:00:00 -0500","original":"3/2/2013","granularity":"day","time":"2013/03/02 00:00:00 -0500"},"longitude":-74.45691,"id":"adeypdlvu2lv","location":"Pelagic 02 Mar 2013-14:30-15:00"},"type":"Feature","geometry":{"type":"Point","coordinates":[-74.45691,38.2806]}},{"properties":{"latitude":38.28837,"weight":1,"state/province":"US-MD","county":"Worcester","date":{"end_time":"2013/03/03 00:00:00 -0500","original":"3/2/2013","granularity":"day","time":"2013/03/02 00:00:00 -0500"},"longitude":-74.55845,"id":"adeypdcyjibl","location":"Pelagic 02 Mar 2013-15:00-15:30"},"type":"Feature","geometry":{"type":"Point","coordinates":[-74.55845,38.28837]}},{"properties":{"latitude":38.29679,"weight":1,"state/province":"US-MD","county":"Worcester","date":{"end_time":"2013/03/03 00:00:00 -0500","original":"3/2/2013","granularity":"day","time":"2013/03/02 00:00:00 -0500"},"longitude":-74.66128,"id":"adeypddohqrd","location":"Pelagic 02 Mar 2013-15:30-16:00"},"type":"Feature","geometry":{"type":"Point","coordinates":[-74.66128,38.29679]}},{"properties":{"latitude":38.30288,"weight":1,"state/province":"US-MD","county":"Worcester","date":{"end_time":"2013/03/03 00:00:00 -0500","original":"3/2/2013","granularity":"day","time":"2013/03/02 00:00:00 -0500"},"longitude":-74.76407,"id":"adeypdfauqgp","location":"Pelagic 02 Mar 2013-16:00-16:30"},"type":"Feature","geometry":{"type":"Point","coordinates":[-74.76407,38.30288]}},{"properties":{"latitude":38.391111,"weight":1,"state/province":"US-MD","county":"Worcester","date":{"end_time":"2011/02/06 00:00:00 -0500","original":"2/5/2011","granularity":"day","time":"2011/02/05 00:00:00 -0500"},"longitude":-74.390833,"id":"adeypd911tts","location":"Pelagic 5 Feb 2011--10:30-11:00"},"type":"Feature","geometry":{"type":"Point","coordinates":[-74.390833,38.391111]}},{"properties":{"latitude":38.328611,"weight":1,"state/province":"US-MD","county":"Worcester","date":{"end_time":"2011/02/06 00:00:00 -0500","original":"2/5/2011","granularity":"day","time":"2011/02/05 00:00:00 -0500"},"longitude":-74.278333,"id":"adeypd7bhhha","location":"Pelagic 5 Feb 2011--11:00-11:30"},"type":"Feature","geometry":{"type":"Point","coordinates":[-74.278333,38.328611]}},{"properties":{"latitude":38.29306,"weight":1,"state/province":"US-MD","county":"Worcester","date":{"end_time":"2011/02/06 00:00:00 -0500","original":"2/5/2011","granularity":"day","time":"2011/02/05 00:00:00 -0500"},"longitude":-74.17917,"id":"adeypdkaglvt","location":"Pelagic 5 Feb 2011--12:00-12:30"},"type":"Feature","geometry":{"type":"Point","coordinates":[-74.17917,38.29306]}},{"properties":{"latitude":38.28194,"weight":1,"state/province":"US-MD","county":"Worcester","date":{"end_time":"2011/02/06 00:00:00 -0500","original":"2/5/2011","granularity":"day","time":"2011/02/05 00:00:00 -0500"},"longitude":-74.12306,"id":"adeypdemx8k8","location":"Pelagic 5 Feb 2011--12:30-13:00"},"type":"Feature","geometry":{"type":"Point","coordinates":[-74.12306,38.28194]}},{"properties":{"latitude":38.29556,"weight":1,"state/province":"US-MD","county":"Worcester","date":{"end_time":"2011/02/06 00:00:00 -0500","original":"2/5/2011","granularity":"day","time":"2011/02/05 00:00:00 -0500"},"longitude":-74.1725,"id":"adeypd8bam5r","location":"Pelagic 5 Feb 2011--13:00-13:30"},"type":"Feature","geometry":{"type":"Point","coordinates":[-74.1725,38.29556]}},{"properties":{"latitude":38.28583,"weight":1,"state/province":"US-MD","county":"Worcester","date":{"end_time":"2011/02/06 00:00:00 -0500","original":"2/5/2011","granularity":"day","time":"2011/02/05 00:00:00 -0500"},"longitude":-74.245,"id":"adeypdhw5f4r","location":"Pelagic 5 Feb 2011--13:30-14:00"},"type":"Feature","geometry":{"type":"Point","coordinates":[-74.245,38.28583]}},{"properties":{"latitude":38.31028,"weight":1,"state/province":"US-MD","county":"Worcester","date":{"end_time":"2011/02/06 00:00:00 -0500","original":"2/5/2011","granularity":"day","time":"2011/02/05 00:00:00 -0500"},"longitude":-74.31333,"id":"adeypdbbka3m","location":"Pelagic 5 Feb 2011--14:00-14:30"},"type":"Feature","geometry":{"type":"Point","coordinates":[-74.31333,38.31028]}},{"properties":{"latitude":38.32778,"weight":1,"state/province":"US-MD","county":"Worcester","date":{"end_time":"2011/02/06 00:00:00 -0500","original":"2/5/2011","granularity":"day","time":"2011/02/05 00:00:00 -0500"},"longitude":-74.38306,"id":"adeypdcecx9n","location":"Pelagic 5 Feb 2011--14:30-15:00"},"type":"Feature","geometry":{"type":"Point","coordinates":[-74.38306,38.32778]}},{"properties":{"latitude":38.36806,"weight":1,"state/province":"US-MD","county":"Worcester","date":{"end_time":"2011/02/06 00:00:00 -0500","original":"2/5/2011","granularity":"day","time":"2011/02/05 00:00:00 -0500"},"longitude":-74.50361,"id":"adeypdcsnlvd","location":"Pelagic 5 Feb 2011--15:00-15:30"},"type":"Feature","geometry":{"type":"Point","coordinates":[-74.50361,38.36806]}},{"properties":{"latitude":38.3283294,"weight":1,"state/province":"US-MD","county":"Worcester","date":{"end_time":"2012/10/09 00:00:00 -0400","original":"10/8/2012","granularity":"day","time":"2012/10/08 00:00:00 -0400"},"longitude":-75.0893345,"id":"adeypdi9iwb5","location":"Ocean City--Sunset Park"},"type":"Feature","geometry":{"type":"Point","coordinates":[-75.0893345,38.3283294]}},{"properties":{"latitude":38.3509773,"weight":1,"state/province":"US-MD","county":"Dorchester","date":{"end_time":"2011/12/27 00:00:00 -0500","original":"12/26/2011","granularity":"day","time":"2011/12/26 00:00:00 -0500"},"longitude":-76.2291211,"id":"adeypdj9hxp6","location":"Upper Hooper pier"},"type":"Feature","geometry":{"type":"Point","coordinates":[-76.2291211,38.3509773]}},{"properties":{"latitude":38.1943505,"weight":1,"state/province":"US-MD","county":"Worcester","date":{"end_time":"2012/09/25 00:00:00 -0400","original":"9/24/2012","granularity":"day","time":"2012/09/24 00:00:00 -0400"},"longitude":-75.1602303,"id":"adeypda4c85g","location":"Assateague I. NS--Great Horned Grove"},"type":"Feature","geometry":{"type":"Point","coordinates":[-75.1602303,38.1943505]}},{"properties":{"latitude":38.2052234,"weight":1,"state/province":"US-MD","county":"Worcester","date":{"end_time":"2012/08/17 00:00:00 -0400","original":"8/16/2012","granularity":"day","time":"2012/08/16 00:00:00 -0400"},"longitude":-75.1509476,"id":"adeypdj6t6bu","location":"Assateague I. NS--beach at Ranger Station"},"type":"Feature","geometry":{"type":"Point","coordinates":[-75.1509476,38.2052234]}},{"properties":{"latitude":18.2662333,"weight":1,"state/province":"PR-","county":null,"date":{"end_time":"2012/03/13 00:00:00 -0400","original":"3/12/2012","granularity":"day","time":"2012/03/12 00:00:00 -0400"},"longitude":-67.1873556,"id":"adeypd7iufdf","location":"Punta Algarrobo"},"type":"Feature","geometry":{"type":"Point","coordinates":[-67.1873556,18.2662333]}},{"properties":{"latitude":39.0422362,"weight":1,"state/province":"US-MD","county":"Anne Arundel","date":{"end_time":"2010/07/03 00:00:00 -0400","original":"7/2/2010","granularity":"day","time":"2010/07/02 00:00:00 -0400"},"longitude":-76.7245245,"id":"adeypdi6j10x","location":"Patuxent Ponds Park"},"type":"Feature","geometry":{"type":"Point","coordinates":[-76.7245245,39.0422362]}},{"properties":{"latitude":38.5150978,"weight":1,"state/province":"US-MD","county":"Calvert","date":{"end_time":"2012/04/29 00:00:00 -0400","original":"4/28/2012","granularity":"day","time":"2012/04/28 00:00:00 -0400"},"longitude":-76.5257406,"id":"adeypdg95frh","location":"American Chestnut Land Trust"},"type":"Feature","geometry":{"type":"Point","coordinates":[-76.5257406,38.5150978]}},{"properties":{"latitude":31.1511198,"weight":1,"state/province":"US-GA","county":"Glynn","date":{"end_time":"2008/08/25 00:00:00 -0400","original":"8/24/2008","granularity":"day","time":"2008/08/24 00:00:00 -0400"},"longitude":-81.3753891,"id":"adeypd7yz7m5","location":"St. Simons Island--Bloody Marsh"},"type":"Feature","geometry":{"type":"Point","coordinates":[-81.3753891,31.1511198]}},{"properties":{"latitude":38.9690272,"weight":1,"state/province":"US-MD","county":"Montgomery","date":{"end_time":"2011/05/22 00:00:00 -0400","original":"5/21/2011","granularity":"day","time":"2011/05/21 00:00:00 -0400"},"longitude":-77.1792555,"id":"adeypdju017f","location":"American Legion Bridge"},"type":"Feature","geometry":{"type":"Point","coordinates":[-77.1792555,38.9690272]}},{"properties":{"latitude":38.175447,"weight":1,"state/province":"US-MD","county":"Somerset","date":{"end_time":"2012/07/01 00:00:00 -0400","original":"6/30/2012","granularity":"day","time":"2012/06/30 00:00:00 -0400"},"longitude":-75.877643,"id":"adeypdiq9inc","location":"Deal Island--Green Dumpster Rd"},"type":"Feature","geometry":{"type":"Point","coordinates":[-75.877643,38.175447]}},{"properties":{"latitude":39.1466201,"weight":1,"state/province":"US-MD","county":"Howard","date":{"end_time":"2009/09/12 00:00:00 -0400","original":"9/11/2009","granularity":"day","time":"2009/09/11 00:00:00 -0400"},"longitude":-76.9604516,"id":"adeypdl03rxm","location":"Rocky Gorge Reservoir - Browns Bridge (Howard County)"},"type":"Feature","geometry":{"type":"Point","coordinates":[-76.9604516,39.1466201]}},{"properties":{"latitude":39.1451723,"weight":1,"state/province":"US-MD","county":"Montgomery","date":{"end_time":"2009/09/12 00:00:00 -0400","original":"9/11/2009","granularity":"day","time":"2009/09/11 00:00:00 -0400"},"longitude":-76.9633484,"id":"adeypda7ip1u","location":"Rocky Gorge Reservoir - Browns Bridge (Montgomery County)"},"type":"Feature","geometry":{"type":"Point","coordinates":[-76.9633484,39.1451723]}},{"properties":{"latitude":38.2407507,"weight":1,"state/province":"US-MD","county":"Worcester","date":{"end_time":"2012/05/12 00:00:00 -0400","original":"5/11/2012","granularity":"day","time":"2012/05/11 00:00:00 -0400"},"longitude":-75.1943941,"id":"adeypdkj1bv6","location":"newport bay dr"},"type":"Feature","geometry":{"type":"Point","coordinates":[-75.1943941,38.2407507]}},{"properties":{"latitude":40.684888,"weight":1,"state/province":"US-CA","county":"Humboldt","date":{"end_time":"2007/06/16 00:00:00 -0400","original":"6/15/2007","granularity":"day","time":"2007/06/15 00:00:00 -0400"},"longitude":-124.211354,"id":"adeypd5efan9","location":"Humboldt Bay NWR"},"type":"Feature","geometry":{"type":"Point","coordinates":[-124.211354,40.684888]}},{"properties":{"latitude":39.010114,"weight":1,"state/province":"US-MD","county":"Montgomery","date":{"end_time":"2012/04/02 00:00:00 -0400","original":"4/1/2012","granularity":"day","time":"2012/04/01 00:00:00 -0400"},"longitude":-77.0251894,"id":"adeypdlhtewx","location":"Sligo Creek Park (south)"},"type":"Feature","geometry":{"type":"Point","coordinates":[-77.0251894,39.010114]}},{"properties":{"latitude":39.0054786,"weight":1,"state/province":"US-MD","county":"Montgomery","date":{"end_time":"2011/03/23 00:00:00 -0400","original":"3/22/2011","granularity":"day","time":"2011/03/22 00:00:00 -0400"},"longitude":-77.0165205,"id":"adeypdgw8c49","location":"sligo creek"},"type":"Feature","geometry":{"type":"Point","coordinates":[-77.0165205,39.0054786]}},{"properties":{"latitude":38.194347,"weight":1,"state/province":"US-MD","county":"Worcester","date":{"end_time":"2010/05/02 00:00:00 -0400","original":"5/1/2010","granularity":"day","time":"2010/05/01 00:00:00 -0400"},"longitude":-75.3725517,"id":"adeypd6i6b63","location":"field 113/timmons"},"type":"Feature","geometry":{"type":"Point","coordinates":[-75.3725517,38.194347]}},{"properties":{"latitude":38.6271638,"weight":1,"state/province":"US-MD","county":"Calvert","date":{"end_time":"2013/02/04 00:00:00 -0500","original":"2/3/2013","granularity":"day","time":"2013/02/03 00:00:00 -0500"},"longitude":-76.6752577,"id":"adeypdbhiv20","location":"Kings Landing Park"},"type":"Feature","geometry":{"type":"Point","coordinates":[-76.6752577,38.6271638]}},{"properties":{"latitude":32.0286983,"weight":1,"state/province":"US-GA","county":"Chatham","date":{"end_time":"2008/01/04 00:00:00 -0500","original":"1/3/2008","granularity":"day","time":"2008/01/03 00:00:00 -0500"},"longitude":-80.8897483,"id":"adeypdbhc997","location":"Fort Pulaski NM"},"type":"Feature","geometry":{"type":"Point","coordinates":[-80.8897483,32.0286983]}},{"properties":{"latitude":39.2690089,"weight":1,"state/province":"US-MD","county":"Howard","date":{"end_time":"2011/06/05 00:00:00 -0400","original":"6/4/2011","granularity":"day","time":"2011/06/04 00:00:00 -0400"},"longitude":-77.1125221,"id":"adeypd6mvwto","location":"Patuxent River SP--Hipsley Mill Rd.  (Howard Co.)"},"type":"Feature","geometry":{"type":"Point","coordinates":[-77.1125221,39.2690089]}},{"properties":{"latitude":38.0658655,"weight":1,"state/province":"US-MD","county":"St. Mary's","date":{"end_time":"2012/11/05 00:00:00 -0500","original":"11/4/2012","granularity":"day","time":"2012/11/04 00:00:00 -0400"},"longitude":-76.3555598,"id":"adeypdcpgbj2","location":"Cornfield Harbor Dr"},"type":"Feature","geometry":{"type":"Point","coordinates":[-76.3555598,38.0658655]}},{"properties":{"latitude":38.1131752,"weight":1,"state/province":"US-MD","county":"St. Mary's","date":{"end_time":"2012/01/02 00:00:00 -0500","original":"1/1/2012","granularity":"day","time":"2012/01/01 00:00:00 -0500"},"longitude":-76.3693569,"id":"adeypd801h7l","location":"rt 5"},"type":"Feature","geometry":{"type":"Point","coordinates":[-76.3693569,38.1131752]}},{"properties":{"latitude":38.3475969,"weight":1,"state/province":"US-MD","county":"Worcester","date":{"end_time":"2012/01/29 00:00:00 -0500","original":"1/28/2012","granularity":"day","time":"2012/01/28 00:00:00 -0500"},"longitude":-75.1228595,"id":"adeypd5kwime","location":"Herring Creek Nature Park"},"type":"Feature","geometry":{"type":"Point","coordinates":[-75.1228595,38.3475969]}},{"properties":{"latitude":39.613029,"weight":1,"state/province":"US-MD","county":"Allegany","date":{"end_time":"2010/06/06 00:00:00 -0400","original":"6/5/2010","granularity":"day","time":"2010/06/05 00:00:00 -0400"},"longitude":-78.620035,"id":"adeypd5vu9t6","location":"Warrior Mountain WMA"},"type":"Feature","geometry":{"type":"Point","coordinates":[-78.620035,39.613029]}},{"properties":{"latitude":39.1259321,"weight":1,"state/province":"US-NJ","county":"Cape May","date":{"end_time":"2010/02/21 00:00:00 -0500","original":"2/20/2010","granularity":"day","time":"2010/02/20 00:00:00 -0500"},"longitude":-74.7720051,"id":"adeypd6sxh20","location":"Garden State Parkway at Avalon Blvd"},"type":"Feature","geometry":{"type":"Point","coordinates":[-74.7720051,39.1259321]}},{"properties":{"latitude":38.7349919,"weight":1,"state/province":"US-MD","county":"Caroline","date":{"end_time":"2011/04/03 00:00:00 -0400","original":"4/2/2011","granularity":"day","time":"2011/04/02 00:00:00 -0400"},"longitude":-75.9957147,"id":"adeypdi1w2c1","location":"Choptank River--Hog Island Road"},"type":"Feature","geometry":{"type":"Point","coordinates":[-75.9957147,38.7349919]}},{"properties":{"latitude":38.7324268,"weight":1,"state/province":"US-MD","county":"Caroline","date":{"end_time":"2011/04/03 00:00:00 -0400","original":"4/2/2011","granularity":"day","time":"2011/04/02 00:00:00 -0400"},"longitude":-75.7612467,"id":"adeypdbngeuw","location":"Idyllwild (Smithville Road)"},"type":"Feature","geometry":{"type":"Point","coordinates":[-75.7612467,38.7324268]}},{"properties":{"latitude":38.6717361,"weight":1,"state/province":"US-MD","county":"Caroline","date":{"end_time":"2011/04/03 00:00:00 -0400","original":"4/2/2011","granularity":"day","time":"2011/04/02 00:00:00 -0400"},"longitude":-75.7258791,"id":"adeypd6ja270","location":"Kinder Road (Caroline)"},"type":"Feature","geometry":{"type":"Point","coordinates":[-75.7258791,38.6717361]}},{"properties":{"latitude":33.8264336,"weight":1,"state/province":"US-GA","county":"Cobb","date":{"end_time":"2008/01/27 00:00:00 -0500","original":"1/26/2008","granularity":"day","time":"2008/01/26 00:00:00 -0500"},"longitude":-84.5461464,"id":"adeypd69vzox","location":"bthummer"},"type":"Feature","geometry":{"type":"Point","coordinates":[-84.5461464,33.8264336]}},{"properties":{"latitude":39.5218861,"weight":1,"state/province":"US-MD","county":"Garrett","date":{"end_time":"2010/11/21 00:00:00 -0500","original":"11/20/2010","granularity":"day","time":"2010/11/20 00:00:00 -0500"},"longitude":-79.0610504,"id":"adeypd8a5eer","location":"Aaron Run Road"},"type":"Feature","geometry":{"type":"Point","coordinates":[-79.0610504,39.5218861]}},{"properties":{"latitude":39.4719803,"weight":1,"state/province":"US-MD","county":"Garrett","date":{"end_time":"2011/07/03 00:00:00 -0400","original":"7/2/2011","granularity":"day","time":"2011/07/02 00:00:00 -0400"},"longitude":-79.4400787,"id":"adeypdcmxhgd","location":"Herrington Manor to Swallow Falls"},"type":"Feature","geometry":{"type":"Point","coordinates":[-79.4400787,39.4719803]}},{"properties":{"latitude":35.1454593,"weight":1,"state/province":"US-SC","county":"Greenville","date":{"end_time":"2011/09/05 00:00:00 -0400","original":"9/4/2011","granularity":"day","time":"2011/09/04 00:00:00 -0400"},"longitude":-82.5235891,"id":"adeypdln53sd","location":"mbc-mount"},"type":"Feature","geometry":{"type":"Point","coordinates":[-82.5235891,35.1454593]}},{"properties":{"latitude":39.2041813,"weight":1,"state/province":"US-MD","county":"Howard","date":{"end_time":"2013/01/03 00:00:00 -0500","original":"1/2/2013","granularity":"day","time":"2013/01/02 00:00:00 -0500"},"longitude":-76.8649211,"id":"adeypdarnkox","location":"Columbia--Sebring Dr"},"type":"Feature","geometry":{"type":"Point","coordinates":[-76.8649211,39.2041813]}},{"properties":{"latitude":39.23937,"weight":1,"state/province":"US-MD","county":"Kent","date":{"end_time":"2011/12/04 00:00:00 -0500","original":"12/3/2011","granularity":"day","time":"2011/12/03 00:00:00 -0500"},"longitude":-76.09656,"id":"adeypdhluuin","location":"Kent"},"type":"Feature","geometry":{"type":"Point","coordinates":[-76.09656,39.23937]}},{"properties":{"latitude":32.5526011,"weight":1,"state/province":"US-GA","county":"Laurens","date":{"end_time":"2008/01/04 00:00:00 -0500","original":"1/3/2008","granularity":"day","time":"2008/01/03 00:00:00 -0500"},"longitude":-82.9482043,"id":"adeypd9j4q72","location":"Rhodes"},"type":"Feature","geometry":{"type":"Point","coordinates":[-82.9482043,32.5526011]}},{"properties":{"latitude":38.6096273,"weight":1,"state/province":"US-MD","county":"Prince George's","date":{"end_time":"2011/03/28 00:00:00 -0400","original":"3/27/2011","granularity":"day","time":"2011/03/27 00:00:00 -0400"},"longitude":-76.684227,"id":"adeypdc2hpr3","location":"Patuxent River Park--Aquasco Farm"},"type":"Feature","geometry":{"type":"Point","coordinates":[-76.684227,38.6096273]}},{"properties":{"latitude":39.2099444,"weight":1,"state/province":"US-MD","county":"Queen Anne's","date":{"end_time":"2009/08/25 00:00:00 -0400","original":"8/24/2009","granularity":"day","time":"2009/08/24 00:00:00 -0400"},"longitude":-75.8655739,"id":"adeypdidatoe","location":"1421 Millington Road"},"type":"Feature","geometry":{"type":"Point","coordinates":[-75.8655739,39.2099444]}},{"properties":{"latitude":30.3428001,"weight":1,"state/province":"US-TX","county":"Travis","date":{"end_time":"2008/07/03 00:00:00 -0400","original":"7/2/2008","granularity":"day","time":"2008/07/02 00:00:00 -0400"},"longitude":-97.8314972,"id":"adeypdlchrws","location":"Emma Long Metropolitan Park"},"type":"Feature","geometry":{"type":"Point","coordinates":[-97.8314972,30.3428001]}},{"properties":{"latitude":38.4334443,"weight":1,"state/province":"US-MD","county":"Wicomico","date":{"end_time":"2011/09/11 00:00:00 -0400","original":"9/10/2011","granularity":"day","time":"2011/09/10 00:00:00 -0400"},"longitude":-75.6165683,"id":"adeypd60bqgg","location":"Adkins Road Turf Farm"},"type":"Feature","geometry":{"type":"Point","coordinates":[-75.6165683,38.4334443]}},{"properties":{"latitude":38.4218136,"weight":1,"state/province":"US-MD","county":"Wicomico","date":{"end_time":"2011/09/11 00:00:00 -0400","original":"9/10/2011","granularity":"day","time":"2011/09/10 00:00:00 -0400"},"longitude":-75.6157637,"id":"adeypdhycqyf","location":"Log Cabin Rd Sod Fields - Wicomico"},"type":"Feature","geometry":{"type":"Point","coordinates":[-75.6157637,38.4218136]}},{"properties":{"latitude":17.97142,"weight":1,"state/province":"PR-","county":null,"date":{"end_time":"2012/03/14 00:00:00 -0400","original":"3/13/2012","granularity":"day","time":"2012/03/13 00:00:00 -0400"},"longitude":-66.8686,"id":"adeypdgz534g","location":"Bosque Estatal de Gunica"},"type":"Feature","geometry":{"type":"Point","coordinates":[-66.8686,17.97142]}},{"properties":{"latitude":34.1657952,"weight":1,"state/province":"US-GA","county":"Cherokee","date":{"end_time":"2008/08/10 00:00:00 -0400","original":"8/9/2008","granularity":"day","time":"2008/08/09 00:00:00 -0400"},"longitude":-84.4336224,"id":"adeypdkfdyjj","location":"swallow tailed"},"type":"Feature","geometry":{"type":"Point","coordinates":[-84.4336224,34.1657952]}},{"properties":{"latitude":10.30702,"weight":1,"state/province":"CR-P","county":null,"date":{"end_time":"2010/08/25 00:00:00 -0400","original":"8/24/2010","granularity":"day","time":"2010/08/24 00:00:00 -0400"},"longitude":-84.80974,"id":"adeypdl6o1ez","location":"Monteverde"},"type":"Feature","geometry":{"type":"Point","coordinates":[-84.80974,10.30702]}},{"properties":{"latitude":40.3137959,"weight":1,"state/province":"US-CO","county":"Larimer","date":{"end_time":"2012/08/08 00:00:00 -0400","original":"8/7/2012","granularity":"day","time":"2012/08/07 00:00:00 -0400"},"longitude":-105.6468487,"id":"adeypd5lhein","location":"RMNP--Bear Lake area"},"type":"Feature","geometry":{"type":"Point","coordinates":[-105.6468487,40.3137959]}},{"properties":{"latitude":39.55978,"weight":1,"state/province":"US-MD","county":"Garrett","date":{"end_time":"2010/11/21 00:00:00 -0500","original":"11/20/2010","granularity":"day","time":"2010/11/20 00:00:00 -0500"},"longitude":-79.0343142,"id":"adeypdbmn3df","location":"Russell Road"},"type":"Feature","geometry":{"type":"Point","coordinates":[-79.0343142,39.55978]}},{"properties":{"latitude":39.1369842,"weight":1,"state/province":"US-MD","county":"Howard","date":{"end_time":"2009/08/14 00:00:00 -0400","original":"8/13/2009","granularity":"day","time":"2009/08/13 00:00:00 -0400"},"longitude":-76.8500519,"id":"adeypdgxkzd2","location":"I95 harrier"},"type":"Feature","geometry":{"type":"Point","coordinates":[-76.8500519,39.1369842]}},{"properties":{"latitude":31.9784488,"weight":1,"state/province":"US-GA","county":"Sumter","date":{"end_time":"2008/01/13 00:00:00 -0500","original":"1/12/2008","granularity":"day","time":"2008/01/12 00:00:00 -0500"},"longitude":-83.9979458,"id":"adeypd9ekg1n","location":"Cobb Owl Fields"},"type":"Feature","geometry":{"type":"Point","coordinates":[-83.9979458,31.9784488]}},{"properties":{"latitude":38.2698696,"weight":1,"state/province":"US-MD","county":"Worcester","date":{"end_time":"2012/11/25 00:00:00 -0500","original":"11/24/2012","granularity":"day","time":"2012/11/24 00:00:00 -0500"},"longitude":-75.1222494,"id":"adeypd5ypdj4","location":"Assateague Is. km 6-7"},"type":"Feature","geometry":{"type":"Point","coordinates":[-75.1222494,38.2698696]}},{"properties":{"latitude":33.7761153,"weight":1,"state/province":"US-GA","county":"Fulton","date":{"end_time":"2008/04/09 00:00:00 -0400","original":"4/8/2008","granularity":"day","time":"2008/04/08 00:00:00 -0400"},"longitude":-84.3569756,"id":"adeypdficmla","location":"home"},"type":"Feature","geometry":{"type":"Point","coordinates":[-84.3569756,33.7761153]}},{"properties":{"latitude":39.6424622,"weight":1,"state/province":"US-MD","county":"Allegany","date":{"end_time":"2010/11/21 00:00:00 -0500","original":"11/20/2010","granularity":"day","time":"2010/11/20 00:00:00 -0500"},"longitude":-78.9087868,"id":"adeypddv6e6o","location":"Frostburg. Day's Inn"},"type":"Feature","geometry":{"type":"Point","coordinates":[-78.9087868,39.6424622]}},{"properties":{"latitude":39.0182876,"weight":1,"state/province":"US-MD","county":"Anne Arundel","date":{"end_time":"2012/11/27 00:00:00 -0500","original":"11/26/2012","granularity":"day","time":"2012/11/26 00:00:00 -0500"},"longitude":-76.4413583,"id":"adeypddwwapx","location":"Amberley"},"type":"Feature","geometry":{"type":"Point","coordinates":[-76.4413583,39.0182876]}},{"properties":{"latitude":37.5367508,"weight":1,"state/province":"US-VA","county":"Richmond City","date":{"end_time":"2011/11/25 00:00:00 -0500","original":"11/24/2011","granularity":"day","time":"2011/11/24 00:00:00 -0500"},"longitude":-77.477957,"id":"adeypdl9mybb","location":"Maymont Park"},"type":"Feature","geometry":{"type":"Point","coordinates":[-77.477957,37.5367508]}},{"properties":{"latitude":33.96701,"weight":1,"state/province":"US-GA","county":"Clarke","date":{"end_time":"2007/05/15 00:00:00 -0400","original":"5/14/2007","granularity":"day","time":"2007/05/14 00:00:00 -0400"},"longitude":-83.27818,"id":"adeypdhs7v32","location":"Winterville"},"type":"Feature","geometry":{"type":"Point","coordinates":[-83.27818,33.96701]}},{"properties":{"latitude":33.9473117,"weight":1,"state/province":"US-GA","county":"DeKalb","date":{"end_time":"2008/02/18 00:00:00 -0500","original":"2/17/2008","granularity":"day","time":"2008/02/17 00:00:00 -0500"},"longitude":-84.3212378,"id":"adeypdhxkxfk","location":"grosbeak"},"type":"Feature","geometry":{"type":"Point","coordinates":[-84.3212378,33.9473117]}},{"properties":{"latitude":38.5037977,"weight":1,"state/province":"US-MD","county":"Dorchester","date":{"end_time":"2011/12/27 00:00:00 -0500","original":"12/26/2011","granularity":"day","time":"2011/12/26 00:00:00 -0500"},"longitude":-76.1816053,"id":"adeypd84kutn","location":"taylor island rd"},"type":"Feature","geometry":{"type":"Point","coordinates":[-76.1816053,38.5037977]}},{"properties":{"latitude":34.0920201,"weight":1,"state/province":"US-GA","county":"Forsyth","date":{"end_time":"2009/02/22 00:00:00 -0500","original":"2/21/2009","granularity":"day","time":"2009/02/21 00:00:00 -0500"},"longitude":-84.1278774,"id":"adeypdc3j90i","location":"Rtrump"},"type":"Feature","geometry":{"type":"Point","coordinates":[-84.1278774,34.0920201]}},{"properties":{"latitude":39.2658566,"weight":1,"state/province":"US-MD","county":"Montgomery","date":{"end_time":"2012/05/06 00:00:00 -0400","original":"5/5/2012","granularity":"day","time":"2012/05/05 00:00:00 -0400"},"longitude":-77.2802219,"id":"adeypdk167mn","location":"Little Bennett RP--Kingsley Trail"},"type":"Feature","geometry":{"type":"Point","coordinates":[-77.2802219,39.2658566]}},{"properties":{"latitude":39.1530164,"weight":1,"state/province":"US-MD","county":"Montgomery","date":{"end_time":"2012/12/31 00:00:00 -0500","original":"12/30/2012","granularity":"day","time":"2012/12/30 00:00:00 -0500"},"longitude":-77.5148043,"id":"adeypdfvhzv5","location":"River Rd - Near White's Ferry"},"type":"Feature","geometry":{"type":"Point","coordinates":[-77.5148043,39.1530164]}},{"properties":{"latitude":38.6419475,"weight":1,"state/province":"US-MD","county":"Talbot","date":{"end_time":"2013/02/03 00:00:00 -0500","original":"2/2/2013","granularity":"day","time":"2013/02/02 00:00:00 -0500"},"longitude":-76.0590363,"id":"adeypdizd9or","location":"rt 50"},"type":"Feature","geometry":{"type":"Point","coordinates":[-76.0590363,38.6419475]}},{"properties":{"latitude":34.8810288,"weight":1,"state/province":"US-GA","county":"Union","date":{"end_time":"2009/05/21 00:00:00 -0400","original":"5/20/2009","granularity":"day","time":"2009/05/20 00:00:00 -0400"},"longitude":-83.9583242,"id":"adeypdhp04hj","location":"blairsville ingles"},"type":"Feature","geometry":{"type":"Point","coordinates":[-83.9583242,34.8810288]}},{"properties":{"latitude":38.2931281,"weight":1,"state/province":"US-MD","county":"Wicomico","date":{"end_time":"2012/05/12 00:00:00 -0400","original":"5/11/2012","granularity":"day","time":"2012/05/11 00:00:00 -0400"},"longitude":-75.4453012,"id":"adeypdju0pdm","location":"Bear Swamp"},"type":"Feature","geometry":{"type":"Point","coordinates":[-75.4453012,38.2931281]}},{"properties":{"latitude":38.3873691,"weight":1,"state/province":"US-MD","county":"Wicomico","date":{"end_time":"2012/01/08 00:00:00 -0500","original":"1/7/2012","granularity":"day","time":"2012/01/07 00:00:00 -0500"},"longitude":-75.3535232,"id":"adeypdk4nwwq","location":"hwy 50"},"type":"Feature","geometry":{"type":"Point","coordinates":[-75.3535232,38.3873691]}},{"properties":{"latitude":34.85501,"weight":1,"state/province":"US-GA","county":"Rabun","date":{"end_time":"2008/05/09 00:00:00 -0400","original":"5/8/2008","granularity":"day","time":"2008/05/08 00:00:00 -0400"},"longitude":-83.38184,"id":"adeypdbd14tu","location":"Rabun"},"type":"Feature","geometry":{"type":"Point","coordinates":[-83.38184,34.85501]}},{"properties":{"latitude":38.7974435,"weight":1,"state/province":"US-MD","county":"Talbot","date":{"end_time":"2009/09/15 00:00:00 -0400","original":"9/14/2009","granularity":"day","time":"2009/09/14 00:00:00 -0400"},"longitude":-76.0640144,"id":"adeypdgsd8hh","location":"broadwing"},"type":"Feature","geometry":{"type":"Point","coordinates":[-76.0640144,38.7974435]}},{"properties":{"latitude":40.4180372,"weight":1,"state/province":"US-CO","county":"Morgan","date":{"end_time":"2012/08/05 00:00:00 -0400","original":"8/4/2012","granularity":"day","time":"2012/08/04 00:00:00 -0400"},"longitude":-104.0702634,"id":"adeypd9wssjd","location":"rt 4 near jackson lake"},"type":"Feature","geometry":{"type":"Point","coordinates":[-104.0702634,40.4180372]}},{"properties":{"latitude":40.7875169,"weight":1,"state/province":"US-CO","county":"Weld","date":{"end_time":"2012/08/05 00:00:00 -0400","original":"8/4/2012","granularity":"day","time":"2012/08/04 00:00:00 -0400"},"longitude":-104.3735934,"id":"adeypd6c6uas","location":"Pawnee National Grassland"},"type":"Feature","geometry":{"type":"Point","coordinates":[-104.3735934,40.7875169]}},{"properties":{"latitude":40.103026,"weight":1,"state/province":"US-PA","county":"Cumberland","date":{"end_time":"2012/01/16 00:00:00 -0500","original":"1/15/2012","granularity":"day","time":"2012/01/15 00:00:00 -0500"},"longitude":-77.4951553,"id":"adeypdi0qxql","location":"Mud Level Rd."},"type":"Feature","geometry":{"type":"Point","coordinates":[-77.4951553,40.103026]}},{"properties":{"latitude":32.34729,"weight":1,"state/province":"US-GA","county":"Macon","date":{"end_time":"2008/01/13 00:00:00 -0500","original":"1/12/2008","granularity":"day","time":"2008/01/12 00:00:00 -0500"},"longitude":-84.03929,"id":"adeypde5lkvv","location":"Macon"},"type":"Feature","geometry":{"type":"Point","coordinates":[-84.03929,32.34729]}},{"properties":{"latitude":39.1235684,"weight":1,"state/province":"US-MD","county":"Montgomery","date":{"end_time":"2009/08/23 00:00:00 -0400","original":"8/22/2009","granularity":"day","time":"2009/08/22 00:00:00 -0400"},"longitude":-77.494812,"id":"adeypde0vc1n","location":"field off river rd"},"type":"Feature","geometry":{"type":"Point","coordinates":[-77.494812,39.1235684]}},{"properties":{"latitude":39.6927243,"weight":1,"state/province":"US-MD","county":"Washington","date":{"end_time":"2012/06/17 00:00:00 -0400","original":"6/16/2012","granularity":"day","time":"2012/06/16 00:00:00 -0400"},"longitude":-78.2351875,"id":"adeypdkfs7y8","location":"Hancock--Willow Road"},"type":"Feature","geometry":{"type":"Point","coordinates":[-78.2351875,39.6927243]}},{"properties":{"latitude":39.71229,"weight":1,"state/province":"US-MD","county":"Washington","date":{"end_time":"2012/06/17 00:00:00 -0400","original":"6/16/2012","granularity":"day","time":"2012/06/16 00:00:00 -0400"},"longitude":-77.67912,"id":"adeypdcxovos","location":"Reid"},"type":"Feature","geometry":{"type":"Point","coordinates":[-77.67912,39.71229]}},{"properties":{"latitude":39.6612797,"weight":1,"state/province":"US-MD","county":"Washington","date":{"end_time":"2009/08/18 00:00:00 -0400","original":"8/17/2009","granularity":"day","time":"2009/08/17 00:00:00 -0400"},"longitude":-77.759074,"id":"adeypdl779vk","location":"sedgewick ln"},"type":"Feature","geometry":{"type":"Point","coordinates":[-77.759074,39.6612797]}},{"properties":{"latitude":39.6054237,"weight":1,"state/province":"US-MD","county":"Allegany","date":{"end_time":"2010/11/21 00:00:00 -0500","original":"11/20/2010","granularity":"day","time":"2010/11/20 00:00:00 -0500"},"longitude":-78.9545345,"id":"adeypd9rbzeu","location":"Old Legislative Road near Klondike Road"},"type":"Feature","geometry":{"type":"Point","coordinates":[-78.9545345,39.6054237]}},{"properties":{"latitude":33.74901,"weight":1,"state/province":"US-GA","county":"Fulton","date":{"end_time":"2009/03/01 00:00:00 -0500","original":"2/28/2009","granularity":"day","time":"2009/02/28 00:00:00 -0500"},"longitude":-84.38803,"id":"adeypd9vpfnl","location":"Atlanta"},"type":"Feature","geometry":{"type":"Point","coordinates":[-84.38803,33.74901]}},{"properties":{"latitude":39.083472,"weight":1,"state/province":"US-MD","county":"Montgomery","date":{"end_time":"2013/02/17 00:00:00 -0500","original":"2/16/2013","granularity":"day","time":"2013/02/16 00:00:00 -0500"},"longitude":-77.3578155,"id":"adeypd626tn9","location":"River rd and Partnership"},"type":"Feature","geometry":{"type":"Point","coordinates":[-77.3578155,39.083472]}},{"properties":{"latitude":38.2611651,"weight":1,"state/province":"US-MD","county":"Worcester","date":{"end_time":"2012/08/17 00:00:00 -0400","original":"8/16/2012","granularity":"day","time":"2012/08/16 00:00:00 -0400"},"longitude":-75.1297474,"id":"adeypd93bzak","location":"Assateague I. NS--km 7.5 flats"},"type":"Feature","geometry":{"type":"Point","coordinates":[-75.1297474,38.2611651]}},{"properties":{"latitude":38.9604766,"weight":1,"state/province":"US-MD","county":"Caroline","date":{"end_time":"2011/04/03 00:00:00 -0400","original":"4/2/2011","granularity":"day","time":"2011/04/02 00:00:00 -0400"},"longitude":-75.7658386,"id":"adeypdhkt8dj","location":"Kibler Road rain ponds"},"type":"Feature","geometry":{"type":"Point","coordinates":[-75.7658386,38.9604766]}},{"properties":{"latitude":38.9354883,"weight":1,"state/province":"US-MD","county":"Caroline","date":{"end_time":"2011/04/03 00:00:00 -0400","original":"4/2/2011","granularity":"day","time":"2011/04/02 00:00:00 -0400"},"longitude":-75.8957219,"id":"adeypdatuh7b","location":"Ridgely--a nursery"},"type":"Feature","geometry":{"type":"Point","coordinates":[-75.8957219,38.9354883]}},{"properties":{"latitude":38.7085647,"weight":1,"state/province":"US-VA","county":"Fairfax","date":{"end_time":"2012/04/22 00:00:00 -0400","original":"4/21/2012","granularity":"day","time":"2012/04/21 00:00:00 -0400"},"longitude":-77.0871073,"id":"adeypdltivme","location":"Mt. Vernon"},"type":"Feature","geometry":{"type":"Point","coordinates":[-77.0871073,38.7085647]}},{"properties":{"latitude":39.45987,"weight":1,"state/province":"US-MD","county":"Garrett","date":{"end_time":"2012/05/28 00:00:00 -0400","original":"5/27/2012","granularity":"day","time":"2012/05/27 00:00:00 -0400"},"longitude":-79.21002,"id":"adeypddcfld1","location":"Garrett"},"type":"Feature","geometry":{"type":"Point","coordinates":[-79.21002,39.45987]}},{"properties":{"latitude":32.4267024,"weight":1,"state/province":"US-GA","county":"Macon","date":{"end_time":"2008/01/13 00:00:00 -0500","original":"1/12/2008","granularity":"day","time":"2008/01/12 00:00:00 -0500"},"longitude":-83.9935684,"id":"adeypd5fxicd","location":"Marshallville Super Sod Farm"},"type":"Feature","geometry":{"type":"Point","coordinates":[-83.9935684,32.4267024]}},{"properties":{"latitude":38.9569727,"weight":1,"state/province":"US-MD","county":"Queen Anne's","date":{"end_time":"2009/12/26 00:00:00 -0500","original":"12/25/2009","granularity":"day","time":"2009/12/25 00:00:00 -0500"},"longitude":-75.9786129,"id":"adeypd99a40b","location":"hwy 481"},"type":"Feature","geometry":{"type":"Point","coordinates":[-75.9786129,38.9569727]}},{"properties":{"latitude":38.1036364,"weight":1,"state/province":"US-MD","county":"Worcester","date":{"end_time":"2012/11/11 00:00:00 -0500","original":"11/10/2012","granularity":"day","time":"2012/11/10 00:00:00 -0500"},"longitude":-75.3770837,"id":"adeypde6q0ev","location":"boxiron rd"},"type":"Feature","geometry":{"type":"Point","coordinates":[-75.3770837,38.1036364]}},{"properties":{"latitude":31.6926989,"weight":1,"state/province":"US-GA","county":"Worth","date":{"end_time":"2008/08/27 00:00:00 -0400","original":"8/26/2008","granularity":"day","time":"2008/08/26 00:00:00 -0400"},"longitude":-83.9552021,"id":"adeypdjehxod","location":"Iron Oak Turf Farm"},"type":"Feature","geometry":{"type":"Point","coordinates":[-83.9552021,31.6926989]}},{"properties":{"latitude":39.154025,"weight":1,"state/province":"US-MD","county":"Montgomery","date":{"end_time":"2011/04/24 00:00:00 -0400","original":"4/23/2011","granularity":"day","time":"2011/04/23 00:00:00 -0400"},"longitude":-77.5124073,"id":"adeypdgu8dff","location":"field river/whites ferry"},"type":"Feature","geometry":{"type":"Point","coordinates":[-77.5124073,39.154025]}},{"properties":{"latitude":39.2073817,"weight":1,"state/province":"US-MD","county":"Howard","date":{"end_time":"2012/09/10 00:00:00 -0400","original":"9/9/2012","granularity":"day","time":"2012/09/09 00:00:00 -0400"},"longitude":-77.0086842,"id":"adeypdlrhbjb","location":"Triadelphia Reservoir (Howard County)"},"type":"Feature","geometry":{"type":"Point","coordinates":[-77.0086842,39.2073817]}},{"properties":{"latitude":39.49721,"weight":1,"state/province":"US-MD","county":"Baltimore","date":{"end_time":"2012/01/03 00:00:00 -0500","original":"1/2/2012","granularity":"day","time":"2012/01/02 00:00:00 -0500"},"longitude":-76.652798,"id":"adeypdfzwylg","location":"Hunt Valley Towne Centre"},"type":"Feature","geometry":{"type":"Point","coordinates":[-76.652798,39.49721]}},{"properties":{"latitude":38.9882351,"weight":1,"state/province":"US-MD","county":"Queen Anne's","date":{"end_time":"2011/01/03 00:00:00 -0500","original":"1/2/2011","granularity":"day","time":"2011/01/02 00:00:00 -0500"},"longitude":-76.3632202,"id":"adeypdl7vpd3","location":"bay bridge"},"type":"Feature","geometry":{"type":"Point","coordinates":[-76.3632202,38.9882351]}},{"properties":{"latitude":38.306111,"weight":1,"state/province":"US-MD","county":"Worcester","date":{"end_time":"2011/02/06 00:00:00 -0500","original":"2/5/2011","granularity":"day","time":"2011/02/05 00:00:00 -0500"},"longitude":-74.226944,"id":"adeypd8zl507","location":"Pelagic 5 Feb 2011--11:30-12:00"},"type":"Feature","geometry":{"type":"Point","coordinates":[-74.226944,38.306111]}},{"properties":{"latitude":34.1624929,"weight":1,"state/province":"US-GA","county":"Forsyth","date":{"end_time":"2009/01/26 00:00:00 -0500","original":"1/25/2009","granularity":"day","time":"2009/01/25 00:00:00 -0500"},"longitude":-84.0749788,"id":"adeypdk5yong","location":"Lake Lanier (Buford Dam)"},"type":"Feature","geometry":{"type":"Point","coordinates":[-84.0749788,34.1624929]}},{"properties":{"latitude":31.5766667,"weight":1,"state/province":"US-GA","county":"Chatham","date":{"end_time":"2009/06/15 00:00:00 -0400","original":"6/14/2009","granularity":"day","time":"2009/06/14 00:00:00 -0400"},"longitude":-80.3680556,"id":"adeypdkwje9e","location":"Offshore GA"},"type":"Feature","geometry":{"type":"Point","coordinates":[-80.3680556,31.5766667]}},{"properties":{"latitude":39.2401028,"weight":1,"state/province":"US-MD","county":"Baltimore","date":{"end_time":"2012/01/03 00:00:00 -0500","original":"1/2/2012","granularity":"day","time":"2012/01/02 00:00:00 -0500"},"longitude":-76.6040182,"id":"adeypdld38fm","location":"I95-S"},"type":"Feature","geometry":{"type":"Point","coordinates":[-76.6040182,39.2401028]}},{"properties":{"latitude":38.7077163,"weight":1,"state/province":"US-MD","county":"Calvert","date":{"end_time":"2013/02/04 00:00:00 -0500","original":"2/3/2013","granularity":"day","time":"2013/02/03 00:00:00 -0500"},"longitude":-76.5312606,"id":"adeypdk1643i","location":"Bay Ave - North Beach"},"type":"Feature","geometry":{"type":"Point","coordinates":[-76.5312606,38.7077163]}},{"properties":{"latitude":39.683659,"weight":1,"state/province":"US-MD","county":"Garrett","date":{"end_time":"2011/07/03 00:00:00 -0400","original":"7/2/2011","granularity":"day","time":"2011/07/02 00:00:00 -0400"},"longitude":-78.9704561,"id":"adeypda5vl50","location":"68 bridge"},"type":"Feature","geometry":{"type":"Point","coordinates":[-78.9704561,39.683659]}},{"properties":{"latitude":18.15033,"weight":1,"state/province":"PR-","county":null,"date":{"end_time":"2012/03/12 00:00:00 -0400","original":"3/11/2012","granularity":"day","time":"2012/03/11 00:00:00 -0500"},"longitude":-66.99281,"id":"adeypdk6y3x9","location":"Bosque Estatal de Maricao"},"type":"Feature","geometry":{"type":"Point","coordinates":[-66.99281,18.15033]}},{"properties":{"latitude":10.3056726,"weight":1,"state/province":"CR-P","county":null,"date":{"end_time":"2010/08/25 00:00:00 -0400","original":"8/24/2010","granularity":"day","time":"2010/08/24 00:00:00 -0400"},"longitude":-84.7890472,"id":"adeypdcn8hir","location":"Reserva Bosque Nuboso Monteverde"},"type":"Feature","geometry":{"type":"Point","coordinates":[-84.7890472,10.3056726]}},{"properties":{"latitude":33.7639213,"weight":1,"state/province":"US-GA","county":"Walton","date":{"end_time":"2009/05/18 00:00:00 -0400","original":"5/17/2009","granularity":"day","time":"2009/05/17 00:00:00 -0400"},"longitude":-83.548665,"id":"adeypddbpgep","location":"Braswell Church Rd"},"type":"Feature","geometry":{"type":"Point","coordinates":[-83.548665,33.7639213]}},{"properties":{"latitude":38.8846074,"weight":1,"state/province":"US-MD","county":"Caroline","date":{"end_time":"2011/12/23 00:00:00 -0500","original":"12/22/2011","granularity":"day","time":"2011/12/22 00:00:00 -0500"},"longitude":-75.8270816,"id":"adeypdlf6sly","location":"Denton--Market St"},"type":"Feature","geometry":{"type":"Point","coordinates":[-75.8270816,38.8846074]}},{"properties":{"latitude":33.8797152,"weight":1,"state/province":"US-GA","county":"Gwinnett","date":{"end_time":"2008/01/27 00:00:00 -0500","original":"1/26/2008","granularity":"day","time":"2008/01/26 00:00:00 -0500"},"longitude":-84.1060281,"id":"adeypdeuh2t6","location":"Krause"},"type":"Feature","geometry":{"type":"Point","coordinates":[-84.1060281,33.8797152]}},{"properties":{"latitude":39.4621526,"weight":1,"state/province":"US-MD","county":"Washington","date":{"end_time":"2011/11/21 00:00:00 -0500","original":"11/20/2011","granularity":"day","time":"2011/11/20 00:00:00 -0500"},"longitude":-77.7320831,"id":"adeypdda6nuz","location":"Sharpsburg - private location"},"type":"Feature","geometry":{"type":"Point","coordinates":[-77.7320831,39.4621526]}},{"properties":{"latitude":39.6905448,"weight":1,"state/province":"US-MD","county":"Allegany","date":{"end_time":"2009/09/27 00:00:00 -0400","original":"9/26/2009","granularity":"day","time":"2009/09/26 00:00:00 -0400"},"longitude":-78.4529185,"id":"adeypdg8gdwg","location":"Green Ridge SF--15 Mile Creek Rd."},"type":"Feature","geometry":{"type":"Point","coordinates":[-78.4529185,39.6905448]}},{"properties":{"latitude":38.6122514,"weight":1,"state/province":"US-MD","county":"Dorchester","date":{"end_time":"2012/06/03 00:00:00 -0400","original":"6/2/2012","granularity":"day","time":"2012/06/02 00:00:00 -0400"},"longitude":-75.797083,"id":"adeypd7alvb9","location":"Chesapeake Forest--Puckum Road"},"type":"Feature","geometry":{"type":"Point","coordinates":[-75.797083,38.6122514]}},{"properties":{"latitude":34.6811465,"weight":1,"state/province":"US-GA","county":"Fannin","date":{"end_time":"2007/10/08 00:00:00 -0400","original":"10/7/2007","granularity":"day","time":"2007/10/07 00:00:00 -0400"},"longitude":-84.1985321,"id":"adeypddbbxtx","location":"Noontootla Creek"},"type":"Feature","geometry":{"type":"Point","coordinates":[-84.1985321,34.6811465]}},{"properties":{"latitude":39.0085883,"weight":1,"state/province":"US-MD","county":"Montgomery","date":{"end_time":"2011/09/02 00:00:00 -0400","original":"9/1/2011","granularity":"day","time":"2011/09/01 00:00:00 -0400"},"longitude":-77.0614904,"id":"adeypd5l02xb","location":"Rock Creek Park--Chevy Chase"},"type":"Feature","geometry":{"type":"Point","coordinates":[-77.0614904,39.0085883]}},{"properties":{"latitude":38.2623782,"weight":1,"state/province":"US-MD","county":"Worcester","date":{"end_time":"2011/07/24 00:00:00 -0400","original":"7/23/2011","granularity":"day","time":"2011/07/23 00:00:00 -0400"},"longitude":-75.4105854,"id":"adeypddwj4n0","location":"Laws rd"},"type":"Feature","geometry":{"type":"Point","coordinates":[-75.4105854,38.2623782]}},{"properties":{"latitude":39.4815205,"weight":1,"state/province":"US-MD","county":"Garrett","date":{"end_time":"2012/05/27 00:00:00 -0400","original":"5/26/2012","granularity":"day","time":"2012/05/26 00:00:00 -0400"},"longitude":-79.4618669,"id":"adeypd7b59mp","location":"Garrett SF--Snaggy Mountain Rd."},"type":"Feature","geometry":{"type":"Point","coordinates":[-79.4618669,39.4815205]}},{"properties":{"latitude":34.16973,"weight":1,"state/province":"US-AZ","county":null,"date":{"end_time":"2007/05/29 00:00:00 -0400","original":"5/28/2007","granularity":"day","time":"2007/05/28 00:00:00 -0400"},"longitude":-111.93299,"id":"adeypdien98h","location":"Arizona"},"type":"Feature","geometry":{"type":"Point","coordinates":[-111.93299,34.16973]}},{"properties":{"latitude":38.2507183,"weight":1,"state/province":"US-MD","county":"Worcester","date":{"end_time":"2010/11/14 00:00:00 -0500","original":"11/13/2010","granularity":"day","time":"2010/11/13 00:00:00 -0500"},"longitude":-75.2908516,"id":"adeypd71szg4","location":"Newark"},"type":"Feature","geometry":{"type":"Point","coordinates":[-75.2908516,38.2507183]}},{"properties":{"latitude":38.7052019,"weight":1,"state/province":"US-MD","county":"Caroline","date":{"end_time":"2011/09/11 00:00:00 -0400","original":"9/10/2011","granularity":"day","time":"2011/09/10 00:00:00 -0400"},"longitude":-75.900515,"id":"adeypdhw80zb","location":"Preston--just east of town"},"type":"Feature","geometry":{"type":"Point","coordinates":[-75.900515,38.7052019]}},{"properties":{"latitude":32.7732029,"weight":1,"state/province":"US-GA","county":"Bibb","date":{"end_time":"2007/10/07 00:00:00 -0400","original":"10/6/2007","granularity":"day","time":"2007/10/06 00:00:00 -0400"},"longitude":-83.5855293,"id":"adeypd9tscki","location":"Bond Swamp"},"type":"Feature","geometry":{"type":"Point","coordinates":[-83.5855293,32.7732029]}},{"properties":{"latitude":34.2631575,"weight":1,"state/province":"US-GA","county":"Bartow","date":{"end_time":"2009/05/10 00:00:00 -0400","original":"5/9/2009","granularity":"day","time":"2009/05/09 00:00:00 -0400"},"longitude":-84.6802139,"id":"adeypdirok31","location":"Pine Log WMA"},"type":"Feature","geometry":{"type":"Point","coordinates":[-84.6802139,34.2631575]}},{"properties":{"latitude":34.720398,"weight":1,"state/province":"US-GA","county":"Habersham","date":{"end_time":"2011/05/15 00:00:00 -0400","original":"5/14/2011","granularity":"day","time":"2011/05/14 00:00:00 -0400"},"longitude":-83.448844,"id":"adeypdi4ggou","location":"glen ella inn"},"type":"Feature","geometry":{"type":"Point","coordinates":[-83.448844,34.720398]}},{"properties":{"latitude":39.0272115,"weight":1,"state/province":"US-MD","county":"Prince George's","date":{"end_time":"2010/07/03 00:00:00 -0400","original":"7/2/2010","granularity":"day","time":"2010/07/02 00:00:00 -0400"},"longitude":-76.7577092,"id":"adeypd5t7tid","location":"Fran Uhler Natural Area"},"type":"Feature","geometry":{"type":"Point","coordinates":[-76.7577092,39.0272115]}},{"properties":{"latitude":38.1754061,"weight":1,"state/province":"US-MD","county":"Worcester","date":{"end_time":"2012/05/12 00:00:00 -0400","original":"5/11/2012","granularity":"day","time":"2012/05/11 00:00:00 -0400"},"longitude":-75.3946227,"id":"adeypdj3muec","location":"snow hill"},"type":"Feature","geometry":{"type":"Point","coordinates":[-75.3946227,38.1754061]}},{"properties":{"latitude":39.1934909,"weight":1,"state/province":"US-MD","county":"Howard","date":{"end_time":"2011/10/26 00:00:00 -0400","original":"10/25/2011","granularity":"day","time":"2011/10/25 00:00:00 -0400"},"longitude":-76.9255078,"id":"adeypd92do1v","location":"Clarksville--Warm Sunshine Path(private)"},"type":"Feature","geometry":{"type":"Point","coordinates":[-76.9255078,39.1934909]}},{"properties":{"latitude":34.3712825,"weight":1,"state/province":"US-GA","county":"Dawson","date":{"end_time":"2008/08/10 00:00:00 -0400","original":"8/9/2008","granularity":"day","time":"2008/08/09 00:00:00 -0400"},"longitude":-84.018631,"id":"adeypddxtlwg","location":"rufous"},"type":"Feature","geometry":{"type":"Point","coordinates":[-84.018631,34.3712825]}},{"properties":{"latitude":34.9306971,"weight":1,"state/province":"US-GA","county":"Rabun","date":{"end_time":"2008/07/28 00:00:00 -0400","original":"7/27/2008","granularity":"day","time":"2008/07/27 00:00:00 -0400"},"longitude":-83.5003853,"id":"adeypdlmxmt3","location":"crossbill feeder"},"type":"Feature","geometry":{"type":"Point","coordinates":[-83.5003853,34.9306971]}},{"properties":{"latitude":35.37326,"weight":1,"state/province":"US-CA","county":"Kern","date":{"end_time":"2007/06/08 00:00:00 -0400","original":"6/7/2007","granularity":"day","time":"2007/06/07 00:00:00 -0400"},"longitude":-119.01893,"id":"adeypde4khc0","location":"Bakersfield"},"type":"Feature","geometry":{"type":"Point","coordinates":[-119.01893,35.37326]}},{"properties":{"latitude":40.3430116,"weight":1,"state/province":"US-CO","county":"Larimer","date":{"end_time":"2012/08/09 00:00:00 -0400","original":"8/8/2012","granularity":"day","time":"2012/08/08 00:00:00 -0400"},"longitude":-105.5690002,"id":"adeypdk3cdi6","location":"Estes Park YMCA Camp"},"type":"Feature","geometry":{"type":"Point","coordinates":[-105.5690002,40.3430116]}},{"properties":{"latitude":38.9907112,"weight":1,"state/province":"US-MD","county":"Montgomery","date":{"end_time":"2010/12/20 00:00:00 -0500","original":"12/19/2010","granularity":"day","time":"2010/12/19 00:00:00 -0500"},"longitude":-77.0261002,"id":"adeypdhi8ylm","location":"Silver Spring"},"type":"Feature","geometry":{"type":"Point","coordinates":[-77.0261002,38.9907112]}},{"properties":{"latitude":38.7413981,"weight":1,"state/province":"US-MD","county":"Talbot","date":{"end_time":"2011/12/04 00:00:00 -0500","original":"12/3/2011","granularity":"day","time":"2011/12/03 00:00:00 -0500"},"longitude":-76.0745716,"id":"adeypdiy8xdr","location":"Easton--Cooke's Hope (private)"},"type":"Feature","geometry":{"type":"Point","coordinates":[-76.0745716,38.7413981]}},{"properties":{"latitude":38.9983018,"weight":1,"state/province":"US-MD","county":"Caroline","date":{"end_time":"2011/04/03 00:00:00 -0400","original":"4/2/2011","granularity":"day","time":"2011/04/02 00:00:00 -0400"},"longitude":-75.9169006,"id":"adeypde26fiz","location":"Cherry Lane (Caroline Co.)"},"type":"Feature","geometry":{"type":"Point","coordinates":[-75.9169006,38.9983018]}},{"properties":{"latitude":38.9816635,"weight":1,"state/province":"US-MD","county":"Caroline","date":{"end_time":"2011/04/03 00:00:00 -0400","original":"4/2/2011","granularity":"day","time":"2011/04/02 00:00:00 -0400"},"longitude":-75.9093261,"id":"adeypdcr4c88","location":"Sparks Road (Caroline Co.)"},"type":"Feature","geometry":{"type":"Point","coordinates":[-75.9093261,38.9816635]}},{"properties":{"latitude":36.5637293,"weight":1,"state/province":"US-CA","county":"Tulare","date":{"end_time":"2007/06/09 00:00:00 -0400","original":"6/8/2007","granularity":"day","time":"2007/06/08 00:00:00 -0400"},"longitude":-118.6135019,"id":"adeypdfhab2j","location":"Sequoia NP"},"type":"Feature","geometry":{"type":"Point","coordinates":[-118.6135019,36.5637293]}},{"properties":{"latitude":38.7998516,"weight":1,"state/province":"US-MD","county":"Caroline","date":{"end_time":"2011/04/03 00:00:00 -0400","original":"4/2/2011","granularity":"day","time":"2011/04/02 00:00:00 -0400"},"longitude":-75.7435226,"id":"adeypdcxxcf2","location":"Chesapeake Forest--Line Road (Caroline Co.)"},"type":"Feature","geometry":{"type":"Point","coordinates":[-75.7435226,38.7998516]}},{"properties":{"latitude":39.0250176,"weight":1,"state/province":"US-MD","county":"Montgomery","date":{"end_time":"2013/01/23 00:00:00 -0500","original":"1/22/2013","granularity":"day","time":"2013/01/22 00:00:00 -0500"},"longitude":-77.0536937,"id":"adeypddmflpn","location":"Insley St, Silver Spring, MD"},"type":"Feature","geometry":{"type":"Point","coordinates":[-77.0536937,39.0250176]}},{"properties":{"latitude":38.4949477,"weight":1,"state/province":"US-MD","county":"Wicomico","date":{"end_time":"2011/09/11 00:00:00 -0400","original":"9/10/2011","granularity":"day","time":"2011/09/10 00:00:00 -0400"},"longitude":-75.7550561,"id":"adeypd96unrb","location":"Scott Bennett Rd -- Wicomico/MD"},"type":"Feature","geometry":{"type":"Point","coordinates":[-75.7550561,38.4949477]}},{"properties":{"latitude":38.9085003,"weight":1,"state/province":"US-MD","county":"Anne Arundel","date":{"end_time":"2012/11/12 00:00:00 -0500","original":"11/11/2012","granularity":"day","time":"2012/11/11 00:00:00 -0500"},"longitude":-76.4640284,"id":"adeypd6gi8sl","location":"Thomas Point Park"},"type":"Feature","geometry":{"type":"Point","coordinates":[-76.4640284,38.9085003]}},{"properties":{"latitude":40.3491116,"weight":1,"state/province":"US-CO","county":"Larimer","date":{"end_time":"2012/08/10 00:00:00 -0400","original":"8/9/2012","granularity":"day","time":"2012/08/09 00:00:00 -0400"},"longitude":-105.6659725,"id":"adeypd9i3iga","location":"RMNP"},"type":"Feature","geometry":{"type":"Point","coordinates":[-105.6659725,40.3491116]}},{"properties":{"latitude":38.948842,"weight":1,"state/province":"US-MD","county":"Caroline","date":{"end_time":"2011/04/03 00:00:00 -0400","original":"4/2/2011","granularity":"day","time":"2011/04/02 00:00:00 -0400"},"longitude":-75.8929592,"id":"adeypdiagj77","location":"Cow Barn Road (Caroline Co.)"},"type":"Feature","geometry":{"type":"Point","coordinates":[-75.8929592,38.948842]}},{"properties":{"latitude":32.180752,"weight":1,"state/province":"US-AZ","county":"Pima","date":{"end_time":"2007/07/01 00:00:00 -0400","original":"6/30/2007","granularity":"day","time":"2007/06/30 00:00:00 -0400"},"longitude":-110.719749,"id":"adeypdlc1xi5","location":"Saguaro NP--Rincon Mountains Unit"},"type":"Feature","geometry":{"type":"Point","coordinates":[-110.719749,32.180752]}},{"properties":{"latitude":38.7027213,"weight":1,"state/province":"US-MD","county":"Caroline","date":{"end_time":"2011/04/03 00:00:00 -0400","original":"4/2/2011","granularity":"day","time":"2011/04/02 00:00:00 -0400"},"longitude":-75.9316528,"id":"adeypd7a5cnu","location":"Prchal Road (Caroline Co.)"},"type":"Feature","geometry":{"type":"Point","coordinates":[-75.9316528,38.7027213]}},{"properties":{"latitude":38.7493141,"weight":1,"state/province":"US-MD","county":"Caroline","date":{"end_time":"2011/04/03 00:00:00 -0400","original":"4/2/2011","granularity":"day","time":"2011/04/02 00:00:00 -0400"},"longitude":-75.7565045,"id":"adeypdl1z341","location":"Smithville Road--Fields (Caroline)"},"type":"Feature","geometry":{"type":"Point","coordinates":[-75.7565045,38.7493141]}},{"properties":{"latitude":38.47995,"weight":1,"state/province":"US-MD","county":"Dorchester","date":{"end_time":"2013/01/06 00:00:00 -0500","original":"1/5/2013","granularity":"day","time":"2013/01/05 00:00:00 -0500"},"longitude":-76.00051,"id":"adeypdjjltue","location":"Dorchester"},"type":"Feature","geometry":{"type":"Point","coordinates":[-76.00051,38.47995]}},{"properties":{"latitude":38.444506,"weight":1,"state/province":"US-MD","county":"Wicomico","date":{"end_time":"2012/02/27 00:00:00 -0500","original":"2/26/2012","granularity":"day","time":"2012/02/26 00:00:00 -0500"},"longitude":-75.693807,"id":"adeypd9urn6h","location":"US-MD-Wicomico 38.4445x-75.6938"},"type":"Feature","geometry":{"type":"Point","coordinates":[-75.693807,38.444506]}},{"properties":{"latitude":46.67686,"weight":1,"state/province":"US-MT","county":null,"date":{"end_time":"2007/06/23 00:00:00 -0400","original":"6/22/2007","granularity":"day","time":"2007/06/22 00:00:00 -0400"},"longitude":-110.05254,"id":"adeypdh3tm9x","location":"Montana"},"type":"Feature","geometry":{"type":"Point","coordinates":[-110.05254,46.67686]}},{"properties":{"latitude":32.605604,"weight":1,"state/province":"US-TX","county":"Dallas","date":{"end_time":"2012/12/28 00:00:00 -0500","original":"12/27/2012","granularity":"day","time":"2012/12/27 00:00:00 -0500"},"longitude":-96.94948,"id":"adeypdj8d27s","location":"US-TX-Cedar Hill-265 W Pleasant Run Rd"},"type":"Feature","geometry":{"type":"Point","coordinates":[-96.94948,32.605604]}},{"properties":{"latitude":9.7908333,"weight":1,"state/province":"CR-P","county":null,"date":{"end_time":"2010/08/27 00:00:00 -0400","original":"8/26/2010","granularity":"day","time":"2010/08/26 00:00:00 -0400"},"longitude":-84.5961111,"id":"adeypd90w8yl","location":"PN Carara"},"type":"Feature","geometry":{"type":"Point","coordinates":[-84.5961111,9.7908333]}},{"properties":{"latitude":39.6452216,"weight":1,"state/province":"US-MD","county":"Garrett","date":{"end_time":"2011/07/03 00:00:00 -0400","original":"7/2/2011","granularity":"day","time":"2011/07/02 00:00:00 -0400"},"longitude":-79.005003,"id":"adeypd5mjdyt","location":"frostburg rd"},"type":"Feature","geometry":{"type":"Point","coordinates":[-79.005003,39.6452216]}},{"properties":{"latitude":34.8503329,"weight":1,"state/province":"US-GA","county":"Rabun","date":{"end_time":"2011/05/15 00:00:00 -0400","original":"5/14/2011","granularity":"day","time":"2011/05/14 00:00:00 -0400"},"longitude":-83.6026955,"id":"adeypd6tm925","location":"andersonville ln hike"},"type":"Feature","geometry":{"type":"Point","coordinates":[-83.6026955,34.8503329]}},{"properties":{"latitude":39.0038943,"weight":1,"state/province":"US-MD","county":"Montgomery","date":{"end_time":"2011/04/28 00:00:00 -0400","original":"4/27/2011","granularity":"day","time":"2011/04/27 00:00:00 -0400"},"longitude":-77.0599209,"id":"adeypd9pv453","location":"rock creek - chevy chase area"},"type":"Feature","geometry":{"type":"Point","coordinates":[-77.0599209,39.0038943]}},{"properties":{"latitude":26.17648,"weight":1,"state/province":"US-TX","county":"Hidalgo","date":{"end_time":"2008/07/02 00:00:00 -0400","original":"7/1/2008","granularity":"day","time":"2008/07/01 00:00:00 -0400"},"longitude":-98.2294094,"id":"adeypdexszvm","location":"Quinta Mazatlan WBC (LTC 063)"},"type":"Feature","geometry":{"type":"Point","coordinates":[-98.2294094,26.17648]}},{"properties":{"latitude":38.3162524,"weight":1,"state/province":"US-MD","county":"Worcester","date":{"end_time":"2012/11/12 00:00:00 -0500","original":"11/11/2012","granularity":"day","time":"2012/11/11 00:00:00 -0500"},"longitude":-75.1280027,"id":"adeypdes0pn4","location":"OC Airport"},"type":"Feature","geometry":{"type":"Point","coordinates":[-75.1280027,38.3162524]}},{"properties":{"latitude":33.4065106,"weight":1,"state/province":"US-GA","county":"Henry","date":{"end_time":"2008/05/25 00:00:00 -0400","original":"5/24/2008","granularity":"day","time":"2008/05/24 00:00:00 -0400"},"longitude":-84.1365194,"id":"adeypdhfiegw","location":"scissor tail"},"type":"Feature","geometry":{"type":"Point","coordinates":[-84.1365194,33.4065106]}},{"properties":{"latitude":38.8539795,"weight":1,"state/province":"US-MD","county":"Talbot","date":{"end_time":"2011/01/03 00:00:00 -0500","original":"1/2/2011","granularity":"day","time":"2011/01/02 00:00:00 -0500"},"longitude":-76.1323357,"id":"adeypdkpjtrm","location":"todd's corner/presquile"},"type":"Feature","geometry":{"type":"Point","coordinates":[-76.1323357,38.8539795]}},{"properties":{"latitude":39.6564437,"weight":1,"state/province":"US-MD","county":"Washington","date":{"end_time":"2012/01/16 00:00:00 -0500","original":"1/15/2012","granularity":"day","time":"2012/01/15 00:00:00 -0500"},"longitude":-77.7602005,"id":"adeypdfigohq","location":"Hagerstown Mall Ponds"},"type":"Feature","geometry":{"type":"Point","coordinates":[-77.7602005,39.6564437]}},{"properties":{"latitude":31.8562726,"weight":1,"state/province":"US-GA","county":"Tattnall","date":{"end_time":"2008/05/28 00:00:00 -0400","original":"5/27/2008","granularity":"day","time":"2008/05/27 00:00:00 -0400"},"longitude":-82.0743942,"id":"adeypdgtlduz","location":"Big Hammock"},"type":"Feature","geometry":{"type":"Point","coordinates":[-82.0743942,31.8562726]}},{"properties":{"latitude":38.993639,"weight":1,"state/province":"US-MD","county":"Prince George's","date":{"end_time":"2013/01/04 00:00:00 -0500","original":"1/3/2013","granularity":"day","time":"2013/01/03 00:00:00 -0500"},"longitude":-76.940646,"id":"adeypdd33hap","location":"US-MD-College Park"},"type":"Feature","geometry":{"type":"Point","coordinates":[-76.940646,38.993639]}},{"properties":{"latitude":39.6103831,"weight":1,"state/province":"US-MD","county":"Washington","date":{"end_time":"2012/04/09 00:00:00 -0400","original":"4/8/2012","granularity":"day","time":"2012/04/08 00:00:00 -0400"},"longitude":-78.0101395,"id":"adeypdiz0tbs","location":"Fort Frederick SP--Big Pool"},"type":"Feature","geometry":{"type":"Point","coordinates":[-78.0101395,39.6103831]}},{"properties":{"latitude":39.665534,"weight":1,"state/province":"US-CO","county":"Jefferson","date":{"end_time":"2012/08/12 00:00:00 -0400","original":"8/11/2012","granularity":"day","time":"2012/08/11 00:00:00 -0400"},"longitude":-105.205556,"id":"adeypdf481v7","location":"Red Rocks Park"},"type":"Feature","geometry":{"type":"Point","coordinates":[-105.205556,39.665534]}},{"properties":{"latitude":37.6461898,"weight":1,"state/province":"US-UT","county":"Garfield","date":{"end_time":"2007/06/02 00:00:00 -0400","original":"6/1/2007","granularity":"day","time":"2007/06/01 00:00:00 -0400"},"longitude":-112.1660052,"id":"adeypdl1mznw","location":"Bryce Canyon NP"},"type":"Feature","geometry":{"type":"Point","coordinates":[-112.1660052,37.6461898]}},{"properties":{"latitude":38.2839449,"weight":1,"state/province":"US-MD","county":"Worcester","date":{"end_time":"2011/02/07 00:00:00 -0500","original":"2/6/2011","granularity":"day","time":"2011/02/06 00:00:00 -0500"},"longitude":-75.2302833,"id":"adeypd6napye","location":"Mason Road (Worcester Co.)"},"type":"Feature","geometry":{"type":"Point","coordinates":[-75.2302833,38.2839449]}},{"properties":{"latitude":39.2923285,"weight":1,"state/province":"US-MD","county":"Howard","date":{"end_time":"2011/03/06 00:00:00 -0500","original":"3/5/2011","granularity":"day","time":"2011/03/05 00:00:00 -0500"},"longitude":-77.0248032,"id":"adeypdlk53lg","location":"Hwy 97"},"type":"Feature","geometry":{"type":"Point","coordinates":[-77.0248032,39.2923285]}},{"properties":{"latitude":39.0782918,"weight":1,"state/province":"US-MD","county":"Montgomery","date":{"end_time":"2009/07/11 00:00:00 -0400","original":"7/10/2009","granularity":"day","time":"2009/07/10 00:00:00 -0400"},"longitude":-77.3281074,"id":"adeypdimsjo1","location":"river rd-seneca rd int"},"type":"Feature","geometry":{"type":"Point","coordinates":[-77.3281074,39.0782918]}},{"properties":{"latitude":38.7019979,"weight":1,"state/province":"US-MD","county":"Caroline","date":{"end_time":"2011/04/03 00:00:00 -0400","original":"4/2/2011","granularity":"day","time":"2011/04/02 00:00:00 -0400"},"longitude":-75.8667004,"id":"adeypdldgv75","location":"American Corner x Fuchs Road"},"type":"Feature","geometry":{"type":"Point","coordinates":[-75.8667004,38.7019979]}},{"properties":{"latitude":38.9993255,"weight":1,"state/province":"US-MD","county":"Caroline","date":{"end_time":"2011/04/03 00:00:00 -0400","original":"4/2/2011","granularity":"day","time":"2011/04/02 00:00:00 -0400"},"longitude":-75.9019876,"id":"adeypdj0v3wc","location":"Clarks Lane (Caroline)"},"type":"Feature","geometry":{"type":"Point","coordinates":[-75.9019876,38.9993255]}},{"properties":{"latitude":39.3260982,"weight":1,"state/province":"US-MD","county":"Howard","date":{"end_time":"2011/03/06 00:00:00 -0500","original":"3/5/2011","granularity":"day","time":"2011/03/05 00:00:00 -0500"},"longitude":-76.9799781,"id":"adeypdkuh7hx","location":"Old Frederick Rd."},"type":"Feature","geometry":{"type":"Point","coordinates":[-76.9799781,39.3260982]}},{"properties":{"latitude":39.246745,"weight":1,"state/province":"US-MD","county":"Montgomery","date":{"end_time":"2011/01/28 00:00:00 -0500","original":"1/27/2011","granularity":"day","time":"2011/01/27 00:00:00 -0500"},"longitude":-77.1193886,"id":"adeypdabfgyy","location":"damascus rd"},"type":"Feature","geometry":{"type":"Point","coordinates":[-77.1193886,39.246745]}},{"properties":{"latitude":38.2272734,"weight":1,"state/province":"US-MD","county":"Worcester","date":{"end_time":"2012/04/15 00:00:00 -0400","original":"4/14/2012","granularity":"day","time":"2012/04/14 00:00:00 -0400"},"longitude":-75.4512627,"id":"adeypdbzvq5n","location":"rd side"},"type":"Feature","geometry":{"type":"Point","coordinates":[-75.4512627,38.2272734]}},{"properties":{"latitude":39.628102,"weight":1,"state/province":"US-MD","county":"Garrett","date":{"end_time":"2011/07/03 00:00:00 -0400","original":"7/2/2011","granularity":"day","time":"2011/07/02 00:00:00 -0400"},"longitude":-79.0528965,"id":"adeypdcqe43p","location":"pea ridge rd"},"type":"Feature","geometry":{"type":"Point","coordinates":[-79.0528965,39.628102]}},{"properties":{"latitude":38.5816116,"weight":1,"state/province":"US-CA","county":"Sacramento","date":{"end_time":"2007/06/11 00:00:00 -0400","original":"6/10/2007","granularity":"day","time":"2007/06/10 00:00:00 -0400"},"longitude":-121.494072,"id":"adeypdgn5giw","location":"Sacramento"},"type":"Feature","geometry":{"type":"Point","coordinates":[-121.494072,38.5816116]}},{"properties":{"latitude":36.0575541,"weight":1,"state/province":"US-AZ","county":"Coconino","date":{"end_time":"2007/06/01 00:00:00 -0400","original":"5/31/2007","granularity":"day","time":"2007/05/31 00:00:00 -0400"},"longitude":-112.1677308,"id":"adeypdalaxld","location":"Grand Canyon NP--South Rim"},"type":"Feature","geometry":{"type":"Point","coordinates":[-112.1677308,36.0575541]}},{"properties":{"latitude":32.33929,"weight":1,"state/province":"US-GA","county":"Bulloch","date":{"end_time":"2008/08/24 00:00:00 -0400","original":"8/23/2008","granularity":"day","time":"2008/08/23 00:00:00 -0400"},"longitude":-81.80871,"id":"adeypd77zrrr","location":"Titan Turf Farm (Bulloch Co.)"},"type":"Feature","geometry":{"type":"Point","coordinates":[-81.80871,32.33929]}},{"properties":{"latitude":38.0934982,"weight":1,"state/province":"US-MD","county":"Worcester","date":{"end_time":"2011/11/13 00:00:00 -0500","original":"11/12/2011","granularity":"day","time":"2011/11/12 00:00:00 -0500"},"longitude":-75.360589,"id":"adeypdjrd1pk","location":"Bayview rd"},"type":"Feature","geometry":{"type":"Point","coordinates":[-75.360589,38.0934982]}},{"properties":{"latitude":39.6286474,"weight":1,"state/province":"US-MD","county":"Garrett","date":{"end_time":"2010/11/21 00:00:00 -0500","original":"11/20/2010","granularity":"day","time":"2010/11/20 00:00:00 -0500"},"longitude":-79.1117764,"id":"adeypd92zm8b","location":"Gaffney's Feeders"},"type":"Feature","geometry":{"type":"Point","coordinates":[-79.1117764,39.6286474]}},{"properties":{"latitude":34.749582,"weight":1,"state/province":"US-GA","county":"Union","date":{"end_time":"2007/10/09 00:00:00 -0400","original":"10/8/2007","granularity":"day","time":"2007/10/08 00:00:00 -0400"},"longitude":-83.9272642,"id":"adeypd5jx323","location":"Blood Mountain"},"type":"Feature","geometry":{"type":"Point","coordinates":[-83.9272642,34.749582]}},{"properties":{"latitude":39.52656,"weight":1,"state/province":"US-MD","county":"Carroll","date":{"end_time":"2011/01/23 00:00:00 -0500","original":"1/22/2011","granularity":"day","time":"2011/01/22 00:00:00 -0500"},"longitude":-77.05014,"id":"adeypdid188v","location":"Carroll"},"type":"Feature","geometry":{"type":"Point","coordinates":[-77.05014,39.52656]}},{"properties":{"latitude":32.68067,"weight":1,"state/province":"US-GA","county":null,"date":{"end_time":"2008/02/21 00:00:00 -0500","original":"2/20/2008","granularity":"day","time":"2008/02/20 00:00:00 -0500"},"longitude":-83.25196,"id":"adeypdl3c4xr","location":"Georgia"},"type":"Feature","geometry":{"type":"Point","coordinates":[-83.25196,32.68067]}},{"properties":{"latitude":24.6664,"weight":1,"state/province":"US-FL","county":"Monroe","date":{"end_time":"2007/04/24 00:00:00 -0400","original":"4/23/2007","granularity":"day","time":"2007/04/23 00:00:00 -0400"},"longitude":-81.2611,"id":"adeypdi7lo9u","location":"Bahia Honda SP"},"type":"Feature","geometry":{"type":"Point","coordinates":[-81.2611,24.6664]}},{"properties":{"latitude":39.7004374,"weight":1,"state/province":"US-MD","county":"Garrett","date":{"end_time":"2012/04/09 00:00:00 -0400","original":"4/8/2012","granularity":"day","time":"2012/04/08 00:00:00 -0400"},"longitude":-78.9506565,"id":"adeypdfp8xdw","location":"hwy 546"},"type":"Feature","geometry":{"type":"Point","coordinates":[-78.9506565,39.7004374]}},{"properties":{"latitude":39.2483735,"weight":1,"state/province":"US-MD","county":"Howard","date":{"end_time":"2009/11/15 00:00:00 -0500","original":"11/14/2009","granularity":"day","time":"2009/11/14 00:00:00 -0500"},"longitude":-76.8231869,"id":"adeypd78sr2c","location":"Meadowbrook Park (Howard Co.)"},"type":"Feature","geometry":{"type":"Point","coordinates":[-76.8231869,39.2483735]}},{"properties":{"latitude":39.1156442,"weight":1,"state/province":"US-MD","county":"Montgomery","date":{"end_time":"2011/04/18 00:00:00 -0400","original":"4/17/2011","granularity":"day","time":"2011/04/17 00:00:00 -0400"},"longitude":-77.4489784,"id":"adeypdbg3zl7","location":"offut &amp; mt nebo"},"type":"Feature","geometry":{"type":"Point","coordinates":[-77.4489784,39.1156442]}},{"properties":{"latitude":33.3989512,"weight":1,"state/province":"US-GA","county":"Henry","date":{"end_time":"2008/05/28 00:00:00 -0400","original":"5/27/2008","granularity":"day","time":"2008/05/27 00:00:00 -0400"},"longitude":-84.2130375,"id":"adeypdknqlk0","location":"simpson mill rd"},"type":"Feature","geometry":{"type":"Point","coordinates":[-84.2130375,33.3989512]}},{"properties":{"latitude":38.3085276,"weight":1,"state/province":"US-MD","county":"Worcester","date":{"end_time":"2011/05/01 00:00:00 -0400","original":"4/30/2011","granularity":"day","time":"2011/04/30 00:00:00 -0400"},"longitude":-75.3141975,"id":"adeypdb0ji2r","location":"Libertytown siderd"},"type":"Feature","geometry":{"type":"Point","coordinates":[-75.3141975,38.3085276]}},{"properties":{"latitude":32.3453793,"weight":1,"state/province":"US-TX","county":"Ellis","date":{"end_time":"2010/12/25 00:00:00 -0500","original":"12/24/2010","granularity":"day","time":"2010/12/24 00:00:00 -0500"},"longitude":-96.6063237,"id":"adeypd88jh2y","location":"ennis"},"type":"Feature","geometry":{"type":"Point","coordinates":[-96.6063237,32.3453793]}},{"properties":{"latitude":38.2201569,"weight":1,"state/province":"US-MD","county":"Worcester","date":{"end_time":"2010/11/14 00:00:00 -0500","original":"11/13/2010","granularity":"day","time":"2010/11/13 00:00:00 -0500"},"longitude":-75.2568895,"id":"adeypd6kin2e","location":"Langmaid Rd"},"type":"Feature","geometry":{"type":"Point","coordinates":[-75.2568895,38.2201569]}},{"properties":{"latitude":39.6785575,"weight":1,"state/province":"US-MD","county":"Garrett","date":{"end_time":"2012/05/20 00:00:00 -0400","original":"5/19/2012","granularity":"day","time":"2012/05/19 00:00:00 -0400"},"longitude":-79.4011322,"id":"adeypdix5vve","location":"morgantown field"},"type":"Feature","geometry":{"type":"Point","coordinates":[-79.4011322,39.6785575]}},{"properties":{"latitude":38.5445242,"weight":1,"state/province":"US-MD","county":"Dorchester","date":{"end_time":"2013/01/06 00:00:00 -0500","original":"1/5/2013","granularity":"day","time":"2013/01/05 00:00:00 -0500"},"longitude":-76.060152,"id":"adeypdb5o0ux","location":"blackbird flock"},"type":"Feature","geometry":{"type":"Point","coordinates":[-76.060152,38.5445242]}},{"properties":{"latitude":38.4653504,"weight":1,"state/province":"US-MD","county":"Dorchester","date":{"end_time":"2011/02/13 00:00:00 -0500","original":"2/12/2011","granularity":"day","time":"2011/02/12 00:00:00 -0500"},"longitude":-76.0694218,"id":"adeypd7ue7cb","location":"Maple Dam Rd"},"type":"Feature","geometry":{"type":"Point","coordinates":[-76.0694218,38.4653504]}},{"properties":{"latitude":29.4241295,"weight":1,"state/province":"US-TX","county":"Bexar","date":{"end_time":"2007/05/27 00:00:00 -0400","original":"5/26/2007","granularity":"day","time":"2007/05/26 00:00:00 -0400"},"longitude":-98.4935913,"id":"adeypdja1aev","location":"San Antonio"},"type":"Feature","geometry":{"type":"Point","coordinates":[-98.4935913,29.4241295]}},{"properties":{"latitude":39.1142124,"weight":1,"state/province":"US-MD","county":"Montgomery","date":{"end_time":"2011/08/14 00:00:00 -0400","original":"8/13/2011","granularity":"day","time":"2011/08/13 00:00:00 -0400"},"longitude":-77.2386503,"id":"adeypdcpfqdf","location":"Darnestown Rd. ponds"},"type":"Feature","geometry":{"type":"Point","coordinates":[-77.2386503,39.1142124]}},{"properties":{"latitude":42.9423499,"weight":1,"state/province":"US-OR","county":"Klamath","date":{"end_time":"2007/06/17 00:00:00 -0400","original":"6/16/2007","granularity":"day","time":"2007/06/16 00:00:00 -0400"},"longitude":-122.1240234,"id":"adeypdb0z889","location":"Crater Lake NP"},"type":"Feature","geometry":{"type":"Point","coordinates":[-122.1240234,42.9423499]}}],"is_temporal":true,"author":{"url":"","metadata":"","contact_name":"","contact_address":"","source":"","contact_phone":""},"source":"","pagination":{"sort":null,"start":0,"total":572,"limit":1000000},"state":"complete","tags":"","published":"2014-08-16T14:54:51-04:00","id":341839}