{"type":"FeatureCollection","data_type":"Dataset","url_type":null,"permissions":[{"permissions":{"download":true,"view":true},"group_id":"everyone"}],"classification":null,"title":"eBird data","count":1569,"stream_id":351068,"contributor":{"url":"http://geocommons.com/users/70795","name":"sschuette"},"data_attributes":null,"calculation_params":null,"icon_link":null,"link":"http://geocommons.com/overlays/351068.json","extent":[-170.297,-46.9184,176.759,66.8898],"geometry_types":["point"],"unique_name":null,"name":"eBird data","feature_count":1569,"description":"","next_feature":null,"is_raster":false,"short_classification":"Y","stats":{"column_5":{"max":389,"variance":174.448299157142,"mean":2.75908221797323,"stdev":13.2078877628916,"min":1,"median":1},"latitude":{"max":66.8898083,"variance":734.163818066944,"mean":22.4789050205226,"stdev":27.0954575172102,"min":-46.9183793,"median":32.2804254},"date":{"max":"2013/04/23 00:00:00 -0400","variance":1.57337884352707e+16,"mean":"2007/10/05 00:53:57 -0400","stdev":125434398.931357,"min":"1990/08/05 00:00:00 -0400","median":"2008/02/02 00:00:00 -0500"},"longitude":{"max":176.7585182,"variance":8070.30171169736,"mean":-59.2542327899299,"stdev":89.8348579989825,"min":-170.296751,"median":-93.1733966}},"features":[{"properties":{"latitude":57.17012,"column_5":389,"date":{"end_time":"2008/05/20 00:00:00 -0400","original":"5/19/2008","granularity":"day","time":"2008/05/19 00:00:00 -0400"},"longitude":-170.296751,"id":"adv9lsrfsjkf","location":"St. Paul Island (Pribilof Islands-Bering Sea)"},"type":"Feature","geometry":{"type":"Point","coordinates":[-170.296751,57.17012]}},{"properties":{"latitude":46.769001,"column_5":214,"date":{"end_time":"1999/07/06 00:00:00 -0400","original":"7/5/1999","granularity":"day","time":"1999/07/05 00:00:00 -0400"},"longitude":-84.9530029,"id":"adv9lsyqa17f","location":"Whitefish Point"},"type":"Feature","geometry":{"type":"Point","coordinates":[-84.9530029,46.769001]}},{"properties":{"latitude":39.004817,"column_5":142,"date":{"end_time":"1995/01/17 00:00:00 -0500","original":"1/16/1995","granularity":"day","time":"1995/01/16 00:00:00 -0500"},"longitude":-90.691561,"id":"adv9lsr4s5dq","location":"Winfield Lock &amp; Dam 25"},"type":"Feature","geometry":{"type":"Point","coordinates":[-90.691561,39.004817]}},{"properties":{"latitude":32.278549,"column_5":141,"date":{"end_time":"2005/09/05 00:00:00 -0400","original":"9/4/2005","granularity":"day","time":"2005/09/04 00:00:00 -0400"},"longitude":-111.022495,"id":"adv9lt3sc5uv","location":"Sweetwater Wetlands"},"type":"Feature","geometry":{"type":"Point","coordinates":[-111.022495,32.278549]}},{"properties":{"latitude":39.002632,"column_5":114,"date":{"end_time":"1994/01/07 00:00:00 -0500","original":"1/6/1994","granularity":"day","time":"1994/01/06 00:00:00 -0500"},"longitude":-90.9046892,"id":"adv9lszi0qpk","location":"MO: Schuette Property"},"type":"Feature","geometry":{"type":"Point","coordinates":[-90.9046892,39.002632]}},{"properties":{"latitude":39.0507547,"column_5":80,"date":{"end_time":"1994/12/18 00:00:00 -0500","original":"12/17/1994","granularity":"day","time":"1994/12/17 00:00:00 -0500"},"longitude":-90.9351872,"id":"adv9lt4pfpc6","location":"Cuivre River SP"},"type":"Feature","geometry":{"type":"Point","coordinates":[-90.9351872,39.0507547]}},{"properties":{"latitude":39.2630138,"column_5":62,"date":{"end_time":"1996/07/10 00:00:00 -0400","original":"7/9/1996","granularity":"day","time":"1996/07/09 00:00:00 -0400"},"longitude":-90.7878129,"id":"adv9lt1b103i","location":"Clarence Cannon NWR"},"type":"Feature","geometry":{"type":"Point","coordinates":[-90.7878129,39.2630138]}},{"properties":{"latitude":8.52111,"column_5":56,"date":{"end_time":"2011/01/28 00:00:00 -0500","original":"1/27/2011","granularity":"day","time":"2011/01/27 00:00:00 -0500"},"longitude":-83.39991,"id":"adv9lstzgwzj","location":"Bosque del Rio Tigre Lodge"},"type":"Feature","geometry":{"type":"Point","coordinates":[-83.39991,8.52111]}},{"properties":{"latitude":39.1371374,"column_5":50,"date":{"end_time":"2004/11/30 00:00:00 -0500","original":"11/29/2004","granularity":"day","time":"2004/11/29 00:00:00 -0500"},"longitude":-90.7372551,"id":"adv9lsve3nuo","location":"BK Leach CA- Kings Lake Unit"},"type":"Feature","geometry":{"type":"Point","coordinates":[-90.7372551,39.1371374]}},{"properties":{"latitude":39.1078384,"column_5":39,"date":{"end_time":"1996/05/12 00:00:00 -0400","original":"5/11/1996","granularity":"day","time":"1996/05/11 00:00:00 -0400"},"longitude":-90.697681,"id":"adv9lsyl8tel","location":"BK Leach CA- Original Unit"},"type":"Feature","geometry":{"type":"Point","coordinates":[-90.697681,39.1078384]}},{"properties":{"latitude":39.2119654,"column_5":35,"date":{"end_time":"1995/05/18 00:00:00 -0400","original":"5/17/1995","granularity":"day","time":"1995/05/17 00:00:00 -0400"},"longitude":-90.7448982,"id":"adv9lsri2n4a","location":"Prairie Slough CA"},"type":"Feature","geometry":{"type":"Point","coordinates":[-90.7448982,39.2119654]}},{"properties":{"latitude":32.2298515,"column_5":32,"date":{"end_time":"1998/06/09 00:00:00 -0400","original":"6/8/1998","granularity":"day","time":"1998/06/08 00:00:00 -0400"},"longitude":-109.8243175,"id":"adv9lt0ceygm","location":"Willcox--Lake Cochise and Twin Lakes Golf Course"},"type":"Feature","geometry":{"type":"Point","coordinates":[-109.8243175,32.2298515]}},{"properties":{"latitude":38.9541511,"column_5":30,"date":{"end_time":"2001/05/13 00:00:00 -0400","original":"5/12/2001","granularity":"day","time":"2001/05/12 00:00:00 -0400"},"longitude":-90.7376949,"id":"adv9lsqscahy","location":"Keeteman Road Sod Farm"},"type":"Feature","geometry":{"type":"Point","coordinates":[-90.7376949,38.9541511]}},{"properties":{"latitude":39.206009,"column_5":24,"date":{"end_time":"2004/05/02 00:00:00 -0400","original":"5/1/2004","granularity":"day","time":"2004/05/01 00:00:00 -0400"},"longitude":-90.7628775,"id":"adv9lt0on9j9","location":"BK Leach CA- Bittern Basin Unit"},"type":"Feature","geometry":{"type":"Point","coordinates":[-90.7628775,39.206009]}},{"properties":{"latitude":32.2856814,"column_5":23,"date":{"end_time":"2005/08/24 00:00:00 -0400","original":"8/23/2005","granularity":"day","time":"2005/08/23 00:00:00 -0400"},"longitude":-111.0346556,"id":"adv9lsrbir7s","location":"Christopher Columbus Park"},"type":"Feature","geometry":{"type":"Point","coordinates":[-111.0346556,32.2856814]}},{"properties":{"latitude":32.2212982,"column_5":23,"date":{"end_time":"2007/09/02 00:00:00 -0400","original":"9/1/2007","granularity":"day","time":"2007/09/01 00:00:00 -0400"},"longitude":-111.0286026,"id":"adv9lt32z0u6","location":"Tucson--Shannon-Broadway Desert"},"type":"Feature","geometry":{"type":"Point","coordinates":[-111.0286026,32.2212982]}},{"properties":{"latitude":61.1466858,"column_5":23,"date":{"end_time":"2012/02/14 00:00:00 -0500","original":"2/13/2012","granularity":"day","time":"2012/02/13 00:00:00 -0500"},"longitude":-149.8711313,"id":"adv9lsv02iam","location":"AK: Anchorage--TDX Office (Dimond Center)"},"type":"Feature","geometry":{"type":"Point","coordinates":[-149.8711313,61.1466858]}},{"properties":{"latitude":31.9815,"column_5":22,"date":{"end_time":"2006/08/30 00:00:00 -0400","original":"8/29/2006","granularity":"day","time":"2006/08/29 00:00:00 -0400"},"longitude":-110.2924,"id":"adv9lt3k7j8m","location":"Benson STP"},"type":"Feature","geometry":{"type":"Point","coordinates":[-110.2924,31.9815]}},{"properties":{"latitude":31.539,"column_5":19,"date":{"end_time":"1998/06/09 00:00:00 -0400","original":"6/8/1998","granularity":"day","time":"1998/06/08 00:00:00 -0400"},"longitude":-110.761,"id":"adv9lt3mb9ag","location":"Patagonia--Patons' yard"},"type":"Feature","geometry":{"type":"Point","coordinates":[-110.761,31.539]}},{"properties":{"latitude":31.4724011,"column_5":18,"date":{"end_time":"2004/10/18 00:00:00 -0400","original":"10/17/2004","granularity":"day","time":"2004/10/17 00:00:00 -0400"},"longitude":-110.9867749,"id":"adv9lstfce2q","location":"Rio Rico Pond"},"type":"Feature","geometry":{"type":"Point","coordinates":[-110.9867749,31.4724011]}},{"properties":{"latitude":31.7306042,"column_5":18,"date":{"end_time":"2004/10/18 00:00:00 -0400","original":"10/17/2004","granularity":"day","time":"2004/10/17 00:00:00 -0400"},"longitude":-111.0544619,"id":"adv9lt04tktj","location":"Amado WTP"},"type":"Feature","geometry":{"type":"Point","coordinates":[-111.0544619,31.7306042]}},{"properties":{"latitude":38.74425,"column_5":18,"date":{"end_time":"2006/03/12 00:00:00 -0500","original":"3/11/2006","granularity":"day","time":"2006/03/11 00:00:00 -0500"},"longitude":-90.30541,"id":"adv9lsu7wv0o","location":"Ferguson"},"type":"Feature","geometry":{"type":"Point","coordinates":[-90.30541,38.74425]}},{"properties":{"latitude":32.3380383,"column_5":18,"date":{"end_time":"2006/11/03 00:00:00 -0500","original":"11/2/2006","granularity":"day","time":"2006/11/02 00:00:00 -0500"},"longitude":-111.0814548,"id":"adv9lt6fptb0","location":"Santa Cruz River--Ina Rd."},"type":"Feature","geometry":{"type":"Point","coordinates":[-111.0814548,32.3380383]}},{"properties":{"latitude":31.712726,"column_5":17,"date":{"end_time":"2005/05/02 00:00:00 -0400","original":"5/1/2005","granularity":"day","time":"2005/05/01 00:00:00 -0400"},"longitude":-110.874989,"id":"adv9lsvdq7cn","location":"Madera Canyon--upper canyon"},"type":"Feature","geometry":{"type":"Point","coordinates":[-110.874989,31.712726]}},{"properties":{"latitude":38.97945,"column_5":16,"date":{"end_time":"1997/05/21 00:00:00 -0400","original":"5/20/1997","granularity":"day","time":"1997/05/20 00:00:00 -0400"},"longitude":-90.98074,"id":"adv9lt6whsh3","location":"Troy"},"type":"Feature","geometry":{"type":"Point","coordinates":[-90.98074,38.97945]}},{"properties":{"latitude":32.3810005,"column_5":16,"date":{"end_time":"1998/06/06 00:00:00 -0400","original":"6/5/1998","granularity":"day","time":"1998/06/05 00:00:00 -0400"},"longitude":-110.6791992,"id":"adv9lssplf0e","location":"Mt. Lemmon--Bear Canyon"},"type":"Feature","geometry":{"type":"Point","coordinates":[-110.6791992,32.3810005]}},{"properties":{"latitude":39.0022217,"column_5":15,"date":{"end_time":"1997/05/11 00:00:00 -0400","original":"5/10/1997","granularity":"day","time":"1997/05/10 00:00:00 -0400"},"longitude":-90.9556108,"id":"adv9lt3c07dq","location":"MO: Troy--Old Monsanto Lagoon"},"type":"Feature","geometry":{"type":"Point","coordinates":[-90.9556108,39.0022217]}},{"properties":{"latitude":38.86911,"column_5":15,"date":{"end_time":"1997/11/10 00:00:00 -0500","original":"11/9/1997","granularity":"day","time":"1997/11/09 00:00:00 -0500"},"longitude":-90.17156,"id":"adv9lss5rlsg","location":"Riverlands Migratory Bird Sanctuary"},"type":"Feature","geometry":{"type":"Point","coordinates":[-90.17156,38.86911]}},{"properties":{"latitude":31.720328,"column_5":14,"date":{"end_time":"2005/05/02 00:00:00 -0400","original":"5/1/2005","granularity":"day","time":"2005/05/01 00:00:00 -0400"},"longitude":-110.879045,"id":"adv9lt4u1t24","location":"Madera Canyon--Madera Kubo B&amp;B"},"type":"Feature","geometry":{"type":"Point","coordinates":[-110.879045,31.720328]}},{"properties":{"latitude":31.7251514,"column_5":14,"date":{"end_time":"2005/05/02 00:00:00 -0400","original":"5/1/2005","granularity":"day","time":"2005/05/01 00:00:00 -0400"},"longitude":-110.8801067,"id":"adv9lt2plqd0","location":"Madera Canyon--Santa Rita Lodge"},"type":"Feature","geometry":{"type":"Point","coordinates":[-110.8801067,31.7251514]}},{"properties":{"latitude":32.1805717,"column_5":14,"date":{"end_time":"2006/04/16 00:00:00 -0400","original":"4/15/2006","granularity":"day","time":"2006/04/15 00:00:00 -0400"},"longitude":-111.0074136,"id":"adv9lt2mnpml","location":"Kennedy Park"},"type":"Feature","geometry":{"type":"Point","coordinates":[-111.0074136,32.1805717]}},{"properties":{"latitude":61.1901201,"column_5":14,"date":{"end_time":"2012/02/29 00:00:00 -0500","original":"2/28/2012","granularity":"day","time":"2012/02/28 00:00:00 -0500"},"longitude":-149.889843,"id":"adv9lt24pjpv","location":"AK: Anchorage--Continental Apartments"},"type":"Feature","geometry":{"type":"Point","coordinates":[-149.889843,61.1901201]}},{"properties":{"latitude":61.2040178,"column_5":14,"date":{"end_time":"2012/04/06 00:00:00 -0400","original":"4/5/2012","granularity":"day","time":"2012/04/05 00:00:00 -0400"},"longitude":-149.905293,"id":"adv9lt00v0gz","location":"Anchorage--Spenard Crossing"},"type":"Feature","geometry":{"type":"Point","coordinates":[-149.905293,61.2040178]}},{"properties":{"latitude":39.16675,"column_5":13,"date":{"end_time":"1996/05/12 00:00:00 -0400","original":"5/11/1996","granularity":"day","time":"1996/05/11 00:00:00 -0400"},"longitude":-90.78093,"id":"adv9lsw1rl0k","location":"Elsberry"},"type":"Feature","geometry":{"type":"Point","coordinates":[-90.78093,39.16675]}},{"properties":{"latitude":32.4404984,"column_5":12,"date":{"end_time":"1998/06/06 00:00:00 -0400","original":"6/5/1998","granularity":"day","time":"1998/06/05 00:00:00 -0400"},"longitude":-110.7902985,"id":"adv9lt0g0jiz","location":"Mt. Lemmon--upper"},"type":"Feature","geometry":{"type":"Point","coordinates":[-110.7902985,32.4404984]}},{"properties":{"latitude":31.508,"column_5":12,"date":{"end_time":"1998/06/09 00:00:00 -0400","original":"6/8/1998","granularity":"day","time":"1998/06/08 00:00:00 -0400"},"longitude":-110.802,"id":"adv9lt71ccws","location":"Patagonia Roadside Rest Area"},"type":"Feature","geometry":{"type":"Point","coordinates":[-110.802,31.508]}},{"properties":{"latitude":31.3769,"column_5":12,"date":{"end_time":"2004/10/18 00:00:00 -0400","original":"10/17/2004","granularity":"day","time":"2004/10/17 00:00:00 -0400"},"longitude":-110.8543,"id":"adv9lsxwukki","location":"Kino Springs"},"type":"Feature","geometry":{"type":"Point","coordinates":[-110.8543,31.3769]}},{"properties":{"latitude":31.4481247,"column_5":12,"date":{"end_time":"2005/02/20 00:00:00 -0500","original":"2/19/2005","granularity":"day","time":"2005/02/19 00:00:00 -0500"},"longitude":-110.6026093,"id":"adv9lsvphpv4","location":"San Rafael Grasslands"},"type":"Feature","geometry":{"type":"Point","coordinates":[-110.6026093,31.4481247]}},{"properties":{"latitude":31.739938,"column_5":12,"date":{"end_time":"2005/05/02 00:00:00 -0400","original":"5/1/2005","granularity":"day","time":"2005/05/01 00:00:00 -0400"},"longitude":-110.886147,"id":"adv9lsupbscm","location":"Madera Canyon--Proctor Rd."},"type":"Feature","geometry":{"type":"Point","coordinates":[-110.886147,31.739938]}},{"properties":{"latitude":61.1848779,"column_5":12,"date":{"end_time":"2012/03/21 00:00:00 -0400","original":"3/20/2012","granularity":"day","time":"2012/03/20 00:00:00 -0400"},"longitude":-149.8792303,"id":"adv9lswdxwhr","location":"Anchorage--Cuddy Pond"},"type":"Feature","geometry":{"type":"Point","coordinates":[-149.8792303,61.1848779]}},{"properties":{"latitude":61.2059712,"column_5":11,"date":{"end_time":"2004/07/07 00:00:00 -0400","original":"7/6/2004","granularity":"day","time":"2004/07/06 00:00:00 -0400"},"longitude":-149.9211502,"id":"adv9lsy0dypv","location":"Anchorage--Westchester Lagoon"},"type":"Feature","geometry":{"type":"Point","coordinates":[-149.9211502,61.2059712]}},{"properties":{"latitude":32.6767071,"column_5":11,"date":{"end_time":"2005/09/19 00:00:00 -0400","original":"9/18/2005","granularity":"day","time":"2005/09/18 00:00:00 -0400"},"longitude":-111.5850217,"id":"adv9lsrm8uwo","location":"Santa Cruz Flats Travel Count"},"type":"Feature","geometry":{"type":"Point","coordinates":[-111.5850217,32.6767071]}},{"properties":{"latitude":32.2321157,"column_5":11,"date":{"end_time":"2005/11/02 00:00:00 -0500","original":"11/1/2005","granularity":"day","time":"2005/11/01 00:00:00 -0500"},"longitude":-110.9511852,"id":"adv9lt2e5utc","location":"University of Arizona"},"type":"Feature","geometry":{"type":"Point","coordinates":[-110.9511852,32.2321157]}},{"properties":{"latitude":32.165,"column_5":11,"date":{"end_time":"2005/11/14 00:00:00 -0500","original":"11/13/2005","granularity":"day","time":"2005/11/13 00:00:00 -0500"},"longitude":-111.179,"id":"adv9lt34g1u6","location":"Avra Valley WTP"},"type":"Feature","geometry":{"type":"Point","coordinates":[-111.179,32.165]}},{"properties":{"latitude":32.4210014,"column_5":10,"date":{"end_time":"1998/06/06 00:00:00 -0400","original":"6/5/1998","granularity":"day","time":"1998/06/05 00:00:00 -0400"},"longitude":-110.731102,"id":"adv9lt0x7zwg","location":"Mt. Lemmon--Bear Wallow"},"type":"Feature","geometry":{"type":"Point","coordinates":[-110.731102,32.4210014]}},{"properties":{"latitude":32.4261364,"column_5":10,"date":{"end_time":"2005/04/03 00:00:00 -0500","original":"4/2/2005","granularity":"day","time":"2005/04/02 00:00:00 -0500"},"longitude":-110.9076127,"id":"adv9lst4cd4u","location":"Catalina SP"},"type":"Feature","geometry":{"type":"Point","coordinates":[-110.9076127,32.4261364]}},{"properties":{"latitude":32.4281938,"column_5":10,"date":{"end_time":"2005/09/02 00:00:00 -0400","original":"9/1/2005","granularity":"day","time":"2005/09/01 00:00:00 -0400"},"longitude":-110.7560945,"id":"adv9lsujgkcr","location":"Mt. Lemmon--Marshall Gulch"},"type":"Feature","geometry":{"type":"Point","coordinates":[-110.7560945,32.4281938]}},{"properties":{"latitude":32.2506776,"column_5":10,"date":{"end_time":"2006/05/08 00:00:00 -0400","original":"5/7/2006","granularity":"day","time":"2006/05/07 00:00:00 -0400"},"longitude":-111.0198151,"id":"adv9lsrux6x8","location":"AZ: Tucson--Sterling Apartments"},"type":"Feature","geometry":{"type":"Point","coordinates":[-111.0198151,32.2506776]}},{"properties":{"latitude":32.22178,"column_5":10,"date":{"end_time":"2006/09/06 00:00:00 -0400","original":"9/5/2006","granularity":"day","time":"2006/09/05 00:00:00 -0400"},"longitude":-110.92665,"id":"adv9lt3v803o","location":"Tucson"},"type":"Feature","geometry":{"type":"Point","coordinates":[-110.92665,32.22178]}},{"properties":{"latitude":39.1506686,"column_5":9,"date":{"end_time":"2006/01/02 00:00:00 -0500","original":"1/1/2006","granularity":"day","time":"2006/01/01 00:00:00 -0500"},"longitude":-90.7868165,"id":"adv9lsvzq2wv","location":"Plant Materials Center, Elsberry"},"type":"Feature","geometry":{"type":"Point","coordinates":[-90.7868165,39.1506686]}},{"properties":{"latitude":38.8636,"column_5":9,"date":{"end_time":"2007/05/17 00:00:00 -0400","original":"5/16/2007","granularity":"day","time":"2007/05/16 00:00:00 -0400"},"longitude":-92.4504,"id":"adv9lt3sr4ph","location":"Eagle Bluffs CA"},"type":"Feature","geometry":{"type":"Point","coordinates":[-92.4504,38.8636]}},{"properties":{"latitude":32.337101,"column_5":8,"date":{"end_time":"1998/06/06 00:00:00 -0400","original":"6/5/1998","granularity":"day","time":"1998/06/05 00:00:00 -0400"},"longitude":-110.6921005,"id":"adv9lsxd4cvw","location":"Mt. Lemmon--Molino Basin"},"type":"Feature","geometry":{"type":"Point","coordinates":[-110.6921005,32.337101]}},{"properties":{"latitude":31.5614979,"column_5":8,"date":{"end_time":"1999/07/29 00:00:00 -0400","original":"7/28/1999","granularity":"day","time":"1999/07/28 00:00:00 -0400"},"longitude":-109.7200191,"id":"adv9lsuvmcb5","location":"Whitewater Draw WA"},"type":"Feature","geometry":{"type":"Point","coordinates":[-109.7200191,31.5614979]}},{"properties":{"latitude":61.0776738,"column_5":8,"date":{"end_time":"2004/06/27 00:00:00 -0400","original":"6/26/2004","granularity":"day","time":"2004/06/26 00:00:00 -0400"},"longitude":-149.8256367,"id":"adv9lt3t9aa7","location":"Anchorage--Potter Marsh-boardwalk (Seward Hwy. MP A9.5)"},"type":"Feature","geometry":{"type":"Point","coordinates":[-149.8256367,61.0776738]}},{"properties":{"latitude":31.9015007,"column_5":8,"date":{"end_time":"2004/10/18 00:00:00 -0400","original":"10/17/2004","granularity":"day","time":"2004/10/17 00:00:00 -0400"},"longitude":-110.9710007,"id":"adv9lt0p4xfs","location":"Green Valley WTP"},"type":"Feature","geometry":{"type":"Point","coordinates":[-110.9710007,31.9015007]}},{"properties":{"latitude":31.3904516,"column_5":8,"date":{"end_time":"2005/05/02 00:00:00 -0400","original":"5/1/2005","granularity":"day","time":"2005/05/01 00:00:00 -0400"},"longitude":-110.2392496,"id":"adv9lsvaef27","location":"Ash Canyon B&amp;B"},"type":"Feature","geometry":{"type":"Point","coordinates":[-110.2392496,31.3904516]}},{"properties":{"latitude":31.5051994,"column_5":8,"date":{"end_time":"2005/08/29 00:00:00 -0400","original":"8/28/2005","granularity":"day","time":"2005/08/28 00:00:00 -0400"},"longitude":-110.7031021,"id":"adv9lss2vk62","location":"Harshaw Canyon"},"type":"Feature","geometry":{"type":"Point","coordinates":[-110.7031021,31.5051994]}},{"properties":{"latitude":33.3614502,"column_5":8,"date":{"end_time":"2005/11/24 00:00:00 -0500","original":"11/23/2005","granularity":"day","time":"2005/11/23 00:00:00 -0500"},"longitude":-111.7339478,"id":"adv9lt0g8we2","location":"Riparian Preserve at Gilbert Water Ranch"},"type":"Feature","geometry":{"type":"Point","coordinates":[-111.7339478,33.3614502]}},{"properties":{"latitude":39.226018,"column_5":8,"date":{"end_time":"2006/03/15 00:00:00 -0500","original":"3/14/2006","granularity":"day","time":"2006/03/14 00:00:00 -0500"},"longitude":-90.7652002,"id":"adv9lt4bt5es","location":"Prairie Slough Duck Clubs"},"type":"Feature","geometry":{"type":"Point","coordinates":[-90.7652002,39.226018]}},{"properties":{"latitude":40.42328,"column_5":8,"date":{"end_time":"2006/05/25 00:00:00 -0400","original":"5/24/2006","granularity":"day","time":"2006/05/24 00:00:00 -0400"},"longitude":-104.70952,"id":"adv9lstzt6ou","location":"Greeley"},"type":"Feature","geometry":{"type":"Point","coordinates":[-104.70952,40.42328]}},{"properties":{"latitude":40.4111111,"column_5":8,"date":{"end_time":"2006/05/26 00:00:00 -0400","original":"5/25/2006","granularity":"day","time":"2006/05/25 00:00:00 -0400"},"longitude":-105.7305556,"id":"adv9lt1s2vx8","location":"RMNP (Rocky Mountain NP)"},"type":"Feature","geometry":{"type":"Point","coordinates":[-105.7305556,40.4111111]}},{"properties":{"latitude":31.5620774,"column_5":8,"date":{"end_time":"2006/10/27 00:00:00 -0400","original":"10/26/2006","granularity":"day","time":"2006/10/26 00:00:00 -0400"},"longitude":-111.047042,"id":"adv9lsskslir","location":"Santa Gertrudis Lane (foot access only)"},"type":"Feature","geometry":{"type":"Point","coordinates":[-111.047042,31.5620774]}},{"properties":{"latitude":31.7692091,"column_5":8,"date":{"end_time":"2007/02/05 00:00:00 -0500","original":"2/4/2007","granularity":"day","time":"2007/02/04 00:00:00 -0500"},"longitude":-110.6684777,"id":"adv9lsuf1hwj","location":"Las Cienegas NCA (Pima Co.)"},"type":"Feature","geometry":{"type":"Point","coordinates":[-110.6684777,31.7692091]}},{"properties":{"latitude":61.1787982,"column_5":8,"date":{"end_time":"2008/05/20 00:00:00 -0400","original":"5/19/2008","granularity":"day","time":"2008/05/19 00:00:00 -0400"},"longitude":-149.9607182,"id":"adv9lssm37i0","location":"Anchorage--Lake Spenard and Lake Hood"},"type":"Feature","geometry":{"type":"Point","coordinates":[-149.9607182,61.1787982]}},{"properties":{"latitude":60.9403976,"column_5":8,"date":{"end_time":"2012/03/26 00:00:00 -0400","original":"3/25/2012","granularity":"day","time":"2012/03/25 00:00:00 -0400"},"longitude":-149.1730499,"id":"adv9lsrk0fl4","location":"Girdwood Junction (Seward Hwy. MP A37) (Anchorage Muni.)"},"type":"Feature","geometry":{"type":"Point","coordinates":[-149.1730499,60.9403976]}},{"properties":{"latitude":31.6618004,"column_5":7,"date":{"end_time":"1998/06/04 00:00:00 -0400","original":"6/3/1998","granularity":"day","time":"1998/06/03 00:00:00 -0400"},"longitude":-111.4347992,"id":"adv9lsyf9x4f","location":"Buenos Aires NWR"},"type":"Feature","geometry":{"type":"Point","coordinates":[-111.4347992,31.6618004]}},{"properties":{"latitude":38.70534,"column_5":7,"date":{"end_time":"2002/12/24 00:00:00 -0500","original":"12/23/2002","granularity":"day","time":"2002/12/23 00:00:00 -0500"},"longitude":-90.74048,"id":"adv9lsyts8ix","location":"Busch CA"},"type":"Feature","geometry":{"type":"Point","coordinates":[-90.74048,38.70534]}},{"properties":{"latitude":39.162661,"column_5":7,"date":{"end_time":"2003/02/02 00:00:00 -0500","original":"2/1/2003","granularity":"day","time":"2003/02/01 00:00:00 -0500"},"longitude":-90.7772459,"id":"adv9lsthcuh6","location":"Elsberry WWTP"},"type":"Feature","geometry":{"type":"Point","coordinates":[-90.7772459,39.162661]}},{"properties":{"latitude":31.4951992,"column_5":7,"date":{"end_time":"2005/03/06 00:00:00 -0500","original":"3/5/2005","granularity":"day","time":"2005/03/05 00:00:00 -0500"},"longitude":-110.8566971,"id":"adv9lt4o146h","location":"Patagonia Lake State Park"},"type":"Feature","geometry":{"type":"Point","coordinates":[-110.8566971,31.4951992]}},{"properties":{"latitude":31.4421997,"column_5":7,"date":{"end_time":"2005/08/29 00:00:00 -0400","original":"8/28/2005","granularity":"day","time":"2005/08/28 00:00:00 -0400"},"longitude":-110.2855988,"id":"adv9lt1ft0f0","location":"Carr Canyon"},"type":"Feature","geometry":{"type":"Point","coordinates":[-110.2855988,31.4421997]}},{"properties":{"latitude":32.556822,"column_5":7,"date":{"end_time":"2005/09/12 00:00:00 -0400","original":"9/11/2005","granularity":"day","time":"2005/09/11 00:00:00 -0400"},"longitude":-111.3772954,"id":"adv9lt4ihny8","location":"Santa Cruz Flats--Red Rock feedlot"},"type":"Feature","geometry":{"type":"Point","coordinates":[-111.3772954,32.556822]}},{"properties":{"latitude":39.1372689,"column_5":7,"date":{"end_time":"2006/03/18 00:00:00 -0500","original":"3/17/2006","granularity":"day","time":"2006/03/17 00:00:00 -0500"},"longitude":-90.7172458,"id":"adv9lt5aui2z","location":"Norton Woods Access"},"type":"Feature","geometry":{"type":"Point","coordinates":[-90.7172458,39.1372689]}},{"properties":{"latitude":32.2220001,"column_5":7,"date":{"end_time":"2006/04/12 00:00:00 -0400","original":"4/11/2006","granularity":"day","time":"2006/04/11 00:00:00 -0400"},"longitude":-111.1505966,"id":"adv9lt3z7cv2","location":"Tucson Mountain Park"},"type":"Feature","geometry":{"type":"Point","coordinates":[-111.1505966,32.2220001]}},{"properties":{"latitude":32.2270534,"column_5":7,"date":{"end_time":"2006/05/31 00:00:00 -0400","original":"5/30/2006","granularity":"day","time":"2006/05/30 00:00:00 -0400"},"longitude":-111.0162642,"id":"adv9lt0uhkku","location":"AZ: Tucson--PCC (West)"},"type":"Feature","geometry":{"type":"Point","coordinates":[-111.0162642,32.2270534]}},{"properties":{"latitude":39.26115,"column_5":7,"date":{"end_time":"2006/08/02 00:00:00 -0400","original":"8/1/2006","granularity":"day","time":"2006/08/01 00:00:00 -0400"},"longitude":-90.82763,"id":"adv9lt439u0g","location":"Annada"},"type":"Feature","geometry":{"type":"Point","coordinates":[-90.82763,39.26115]}},{"properties":{"latitude":40.4540663,"column_5":7,"date":{"end_time":"2011/05/18 00:00:00 -0400","original":"5/17/2011","granularity":"day","time":"2011/05/17 00:00:00 -0400"},"longitude":-109.0167332,"id":"adv9lt26cn6n","location":"Dinosaur National Monument"},"type":"Feature","geometry":{"type":"Point","coordinates":[-109.0167332,40.4540663]}},{"properties":{"latitude":40.4307529,"column_5":6,"date":{"end_time":"1990/08/06 00:00:00 -0400","original":"8/5/1990","granularity":"day","time":"1990/08/05 00:00:00 -0400"},"longitude":-109.3313138,"id":"adv9lt5s0whw","location":"UT: Dinosaur NM"},"type":"Feature","geometry":{"type":"Point","coordinates":[-109.3313138,40.4307529]}},{"properties":{"latitude":37.5679404,"column_5":6,"date":{"end_time":"1998/11/29 00:00:00 -0500","original":"11/28/1998","granularity":"day","time":"1998/11/28 00:00:00 -0500"},"longitude":-90.1320266,"id":"adv9lt14icta","location":"MO: The Cabin"},"type":"Feature","geometry":{"type":"Point","coordinates":[-90.1320266,37.5679404]}},{"properties":{"latitude":31.4156019,"column_5":6,"date":{"end_time":"1999/07/30 00:00:00 -0400","original":"7/29/1999","granularity":"day","time":"1999/07/29 00:00:00 -0400"},"longitude":-110.2765277,"id":"adv9lt4v00h0","location":"Miller Canyon--Beatty's Guest Ranch"},"type":"Feature","geometry":{"type":"Point","coordinates":[-110.2765277,31.4156019]}},{"properties":{"latitude":60.10364,"column_5":6,"date":{"end_time":"2004/06/29 00:00:00 -0400","original":"6/28/2004","granularity":"day","time":"2004/06/28 00:00:00 -0400"},"longitude":-149.44414,"id":"adv9lsy7s9c6","location":"Seward"},"type":"Feature","geometry":{"type":"Point","coordinates":[-149.44414,60.10364]}},{"properties":{"latitude":32.2806015,"column_5":6,"date":{"end_time":"2005/04/12 00:00:00 -0400","original":"4/11/2005","granularity":"day","time":"2005/04/11 00:00:00 -0400"},"longitude":-110.7303009,"id":"adv9lt4f0tp9","location":"Agua Caliente Park"},"type":"Feature","geometry":{"type":"Point","coordinates":[-110.7303009,32.2806015]}},{"properties":{"latitude":48.38825,"column_5":6,"date":{"end_time":"2005/06/17 00:00:00 -0400","original":"6/16/2005","granularity":"day","time":"2005/06/16 00:00:00 -0400"},"longitude":-115.556,"id":"adv9lt3s5a5z","location":"Libby"},"type":"Feature","geometry":{"type":"Point","coordinates":[-115.556,48.38825]}},{"properties":{"latitude":32.3300526,"column_5":6,"date":{"end_time":"2005/07/19 00:00:00 -0400","original":"7/18/2005","granularity":"day","time":"2005/07/18 00:00:00 -0400"},"longitude":-110.7944301,"id":"adv9lsub8wym","location":"Sabino Canyon Recreation Area"},"type":"Feature","geometry":{"type":"Point","coordinates":[-110.7944301,32.3300526]}},{"properties":{"latitude":32.3926274,"column_5":6,"date":{"end_time":"2005/08/25 00:00:00 -0400","original":"8/24/2005","granularity":"day","time":"2005/08/24 00:00:00 -0400"},"longitude":-110.7024693,"id":"adv9lt3sqikp","location":"Mt. Lemmon--Rose Canyon and Lake"},"type":"Feature","geometry":{"type":"Point","coordinates":[-110.7024693,32.3926274]}},{"properties":{"latitude":31.4043999,"column_5":6,"date":{"end_time":"2005/08/26 00:00:00 -0400","original":"8/25/2005","granularity":"day","time":"2005/08/25 00:00:00 -0400"},"longitude":-111.0858002,"id":"adv9lt4j5yxr","location":"Pena Blanca Lake"},"type":"Feature","geometry":{"type":"Point","coordinates":[-111.0858002,31.4043999]}},{"properties":{"latitude":31.9601613,"column_5":6,"date":{"end_time":"2005/09/18 00:00:00 -0400","original":"9/17/2005","granularity":"day","time":"2005/09/17 00:00:00 -0400"},"longitude":-111.5981701,"id":"adv9lsy9qk49","location":"Kitt Peak"},"type":"Feature","geometry":{"type":"Point","coordinates":[-111.5981701,31.9601613]}},{"properties":{"latitude":32.7376219,"column_5":6,"date":{"end_time":"2005/10/31 00:00:00 -0500","original":"10/30/2005","granularity":"day","time":"2005/10/30 00:00:00 -0400"},"longitude":-111.6787993,"id":"adv9lt3gkxkx","location":"Arizona City Lake"},"type":"Feature","geometry":{"type":"Point","coordinates":[-111.6787993,32.7376219]}},{"properties":{"latitude":32.3175773,"column_5":6,"date":{"end_time":"2006/01/31 00:00:00 -0500","original":"1/30/2006","granularity":"day","time":"2006/01/30 00:00:00 -0500"},"longitude":-110.9677989,"id":"adv9lsqv94e4","location":"AZ: Tucson--Rick Wright's House"},"type":"Feature","geometry":{"type":"Point","coordinates":[-110.9677989,32.3175773]}},{"properties":{"latitude":31.67949,"column_5":6,"date":{"end_time":"2006/04/09 00:00:00 -0400","original":"4/8/2006","granularity":"day","time":"2006/04/08 00:00:00 -0400"},"longitude":-110.65564,"id":"adv9lsyv9oxo","location":"Sonoita"},"type":"Feature","geometry":{"type":"Point","coordinates":[-110.65564,31.67949]}},{"properties":{"latitude":31.85428,"column_5":6,"date":{"end_time":"2006/04/30 00:00:00 -0400","original":"4/29/2006","granularity":"day","time":"2006/04/29 00:00:00 -0400"},"longitude":-110.99365,"id":"adv9lt4riq2o","location":"Green Valley"},"type":"Feature","geometry":{"type":"Point","coordinates":[-110.99365,31.85428]}},{"properties":{"latitude":32.7407148,"column_5":6,"date":{"end_time":"2006/05/05 00:00:00 -0400","original":"5/4/2006","granularity":"day","time":"2006/05/04 00:00:00 -0400"},"longitude":-110.6504989,"id":"adv9lsuwgdtz","location":"Mammoth Sewage Ponds"},"type":"Feature","geometry":{"type":"Point","coordinates":[-110.6504989,32.7407148]}},{"properties":{"latitude":32.2804254,"column_5":6,"date":{"end_time":"2006/05/06 00:00:00 -0400","original":"5/5/2006","granularity":"day","time":"2006/05/05 00:00:00 -0400"},"longitude":-111.0256058,"id":"adv9lssf88nt","location":"Roger Road WRF"},"type":"Feature","geometry":{"type":"Point","coordinates":[-111.0256058,32.2804254]}},{"properties":{"latitude":40.37718,"column_5":6,"date":{"end_time":"2006/08/08 00:00:00 -0400","original":"8/7/2006","granularity":"day","time":"2006/08/07 00:00:00 -0400"},"longitude":-105.52155,"id":"adv9lsyb5nn0","location":"Estes Park"},"type":"Feature","geometry":{"type":"Point","coordinates":[-105.52155,40.37718]}},{"properties":{"latitude":32.2102866,"column_5":6,"date":{"end_time":"2007/01/20 00:00:00 -0500","original":"1/19/2007","granularity":"day","time":"2007/01/19 00:00:00 -0500"},"longitude":-110.9235907,"id":"adv9lss506pt","location":"Reid Park"},"type":"Feature","geometry":{"type":"Point","coordinates":[-110.9235907,32.2102866]}},{"properties":{"latitude":38.478,"column_5":6,"date":{"end_time":"2007/05/19 00:00:00 -0400","original":"5/18/2007","granularity":"day","time":"2007/05/18 00:00:00 -0400"},"longitude":-93.226,"id":"adv9lsybwl3w","location":"Hi Lonesome Prairie CA"},"type":"Feature","geometry":{"type":"Point","coordinates":[-93.226,38.478]}},{"properties":{"latitude":4.3858,"column_5":6,"date":{"end_time":"2009/01/19 00:00:00 -0500","original":"1/18/2009","granularity":"day","time":"2009/01/18 00:00:00 -0500"},"longitude":102.4005,"id":"adv9lsy5jlji","location":"Taman Negara NP"},"type":"Feature","geometry":{"type":"Point","coordinates":[102.4005,4.3858]}},{"properties":{"latitude":31.4456005,"column_5":5,"date":{"end_time":"1998/06/07 00:00:00 -0400","original":"6/6/1998","granularity":"day","time":"1998/06/06 00:00:00 -0400"},"longitude":-110.3124008,"id":"adv9lt2cvaog","location":"Ramsey Canyon Preserve"},"type":"Feature","geometry":{"type":"Point","coordinates":[-110.3124008,31.4456005]}},{"properties":{"latitude":31.5478992,"column_5":5,"date":{"end_time":"1998/06/08 00:00:00 -0400","original":"6/7/1998","granularity":"day","time":"1998/06/07 00:00:00 -0400"},"longitude":-110.1408997,"id":"adv9lswevkdy","location":"San Pedro RNCA--San Pedro House"},"type":"Feature","geometry":{"type":"Point","coordinates":[-110.1408997,31.5478992]}},{"properties":{"latitude":31.9030991,"column_5":5,"date":{"end_time":"1999/07/27 00:00:00 -0400","original":"7/26/1999","granularity":"day","time":"1999/07/26 00:00:00 -0400"},"longitude":-109.2776031,"id":"adv9lstdr620","location":"Rustler Park"},"type":"Feature","geometry":{"type":"Point","coordinates":[-109.2776031,31.9030991]}},{"properties":{"latitude":31.4596996,"column_5":5,"date":{"end_time":"1999/07/31 00:00:00 -0400","original":"7/30/1999","granularity":"day","time":"1999/07/30 00:00:00 -0400"},"longitude":-110.3644028,"id":"adv9lt6v8z73","location":"Garden Canyon"},"type":"Feature","geometry":{"type":"Point","coordinates":[-110.3644028,31.4596996]}},{"properties":{"latitude":33.024915,"column_5":5,"date":{"end_time":"2005/04/03 00:00:00 -0500","original":"4/2/2005","granularity":"day","time":"2005/04/02 00:00:00 -0500"},"longitude":-110.7321816,"id":"adv9lt17az9i","location":"AZ: Winkelman--Gila River"},"type":"Feature","geometry":{"type":"Point","coordinates":[-110.7321816,33.024915]}},{"properties":{"latitude":32.917,"column_5":5,"date":{"end_time":"2005/04/03 00:00:00 -0500","original":"4/2/2005","granularity":"day","time":"2005/04/02 00:00:00 -0500"},"longitude":-110.735,"id":"adv9lt4cwjjg","location":"Dudleyville"},"type":"Feature","geometry":{"type":"Point","coordinates":[-110.735,32.917]}},{"properties":{"latitude":48.7166667,"column_5":5,"date":{"end_time":"2005/06/16 00:00:00 -0400","original":"6/15/2005","granularity":"day","time":"2005/06/15 00:00:00 -0400"},"longitude":-116.4,"id":"adv9lt2lfiqn","location":"Kootenai NWR"},"type":"Feature","geometry":{"type":"Point","coordinates":[-116.4,48.7166667]}},{"properties":{"latitude":31.4650365,"column_5":5,"date":{"end_time":"2005/08/26 00:00:00 -0400","original":"8/25/2005","granularity":"day","time":"2005/08/25 00:00:00 -0400"},"longitude":-111.2370498,"id":"adv9lszbzhi2","location":"AZ: Ruby Rd."},"type":"Feature","geometry":{"type":"Point","coordinates":[-111.2370498,31.4650365]}},{"properties":{"latitude":32.1812,"column_5":5,"date":{"end_time":"2005/09/05 00:00:00 -0400","original":"9/4/2005","granularity":"day","time":"2005/09/04 00:00:00 -0400"},"longitude":-110.932,"id":"adv9lt3m1vyb","location":"Sam Lena Park and KERP"},"type":"Feature","geometry":{"type":"Point","coordinates":[-110.932,32.1812]}},{"properties":{"latitude":39.3732721,"column_5":5,"date":{"end_time":"2006/03/15 00:00:00 -0500","original":"3/14/2006","granularity":"day","time":"2006/03/14 00:00:00 -0500"},"longitude":-90.9056532,"id":"adv9lt014qei","location":"Clarksville Lock and Dam 24"},"type":"Feature","geometry":{"type":"Point","coordinates":[-90.9056532,39.3732721]}},{"properties":{"latitude":39.228264,"column_5":5,"date":{"end_time":"2006/12/20 00:00:00 -0500","original":"12/19/2006","granularity":"day","time":"2006/12/19 00:00:00 -0500"},"longitude":-90.7250977,"id":"adv9lt2esy2p","location":"Hamburg Ferry Access"},"type":"Feature","geometry":{"type":"Point","coordinates":[-90.7250977,39.228264]}},{"properties":{"latitude":37.234292,"column_5":5,"date":{"end_time":"2011/05/10 00:00:00 -0400","original":"5/9/2011","granularity":"day","time":"2011/05/09 00:00:00 -0400"},"longitude":-112.9619408,"id":"adv9lswhxk8w","location":"Zion NP"},"type":"Feature","geometry":{"type":"Point","coordinates":[-112.9619408,37.234292]}},{"properties":{"latitude":61.2123171,"column_5":5,"date":{"end_time":"2012/03/19 00:00:00 -0400","original":"3/18/2012","granularity":"day","time":"2012/03/18 00:00:00 -0400"},"longitude":-149.8611697,"id":"adv9lsyv025s","location":"AK: Anchorage--Luke's Apartment"},"type":"Feature","geometry":{"type":"Point","coordinates":[-149.8611697,61.2123171]}},{"properties":{"latitude":60.0706365,"column_5":5,"date":{"end_time":"2012/03/26 00:00:00 -0400","original":"3/25/2012","granularity":"day","time":"2012/03/25 00:00:00 -0400"},"longitude":-149.4349383,"id":"adv9lswawbif","location":"Seward--Lowell Point"},"type":"Feature","geometry":{"type":"Point","coordinates":[-149.4349383,60.0706365]}},{"properties":{"latitude":26.2644011,"column_5":4,"date":{"end_time":"1994/12/29 00:00:00 -0500","original":"12/28/1994","granularity":"day","time":"1994/12/28 00:00:00 -0500"},"longitude":-97.3870182,"id":"adv9lt0gh2rm","location":"Laguna Atascosa NWR (LTC 024)"},"type":"Feature","geometry":{"type":"Point","coordinates":[-97.3870182,26.2644011]}},{"properties":{"latitude":39.1596053,"column_5":4,"date":{"end_time":"1997/05/19 00:00:00 -0400","original":"5/18/1997","granularity":"day","time":"1997/05/18 00:00:00 -0400"},"longitude":-91.0414485,"id":"adv9lsyzkpnm","location":"Logan CA"},"type":"Feature","geometry":{"type":"Point","coordinates":[-91.0414485,39.1596053]}},{"properties":{"latitude":31.528,"column_5":4,"date":{"end_time":"1998/06/08 00:00:00 -0400","original":"6/7/1998","granularity":"day","time":"1998/06/07 00:00:00 -0400"},"longitude":-110.775,"id":"adv9lt34fy4r","location":"Patagonia-Sonoita Creek Preserve"},"type":"Feature","geometry":{"type":"Point","coordinates":[-110.775,31.528]}},{"properties":{"latitude":34.9553486,"column_5":4,"date":{"end_time":"1998/06/14 00:00:00 -0400","original":"6/13/1998","granularity":"day","time":"1998/06/13 00:00:00 -0400"},"longitude":-107.8185944,"id":"adv9lsqvojlt","location":"El Malpais NM"},"type":"Feature","geometry":{"type":"Point","coordinates":[-107.8185944,34.9553486]}},{"properties":{"latitude":37.5627639,"column_5":4,"date":{"end_time":"1998/11/28 00:00:00 -0500","original":"11/27/1998","granularity":"day","time":"1998/11/27 00:00:00 -0500"},"longitude":-90.1440972,"id":"adv9lswfr1p9","location":"Amidon CA"},"type":"Feature","geometry":{"type":"Point","coordinates":[-90.1440972,37.5627639]}},{"properties":{"latitude":31.4177935,"column_5":4,"date":{"end_time":"1999/07/30 00:00:00 -0400","original":"7/29/1999","granularity":"day","time":"1999/07/29 00:00:00 -0400"},"longitude":-110.0970863,"id":"adv9lt6suu5m","location":"San Pedro River Inn"},"type":"Feature","geometry":{"type":"Point","coordinates":[-110.0970863,31.4177935]}},{"properties":{"latitude":10.314,"column_5":4,"date":{"end_time":"2000/02/21 00:00:00 -0500","original":"2/20/2000","granularity":"day","time":"2000/02/20 00:00:00 -0500"},"longitude":-84.818,"id":"adv9lt1vldxe","location":"CR: Hotel Montana Monteverde"},"type":"Feature","geometry":{"type":"Point","coordinates":[-84.818,10.314]}},{"properties":{"latitude":10.4502,"column_5":4,"date":{"end_time":"2000/02/26 00:00:00 -0500","original":"2/25/2000","granularity":"day","time":"2000/02/25 00:00:00 -0500"},"longitude":-84.0677,"id":"adv9lt2w7700","location":"Selva Verde Lodge"},"type":"Feature","geometry":{"type":"Point","coordinates":[-84.0677,10.4502]}},{"properties":{"latitude":40.7875169,"column_5":4,"date":{"end_time":"2002/07/08 00:00:00 -0400","original":"7/7/2002","granularity":"day","time":"2002/07/07 00:00:00 -0400"},"longitude":-104.3735934,"id":"adv9lt4b0cl2","location":"Pawnee National Grassland"},"type":"Feature","geometry":{"type":"Point","coordinates":[-104.3735934,40.7875169]}},{"properties":{"latitude":38.97085,"column_5":4,"date":{"end_time":"2003/03/06 00:00:00 -0500","original":"3/5/2003","granularity":"day","time":"2003/03/05 00:00:00 -0500"},"longitude":-91.13125,"id":"adv9lsy339a1","location":"Hawk Point"},"type":"Feature","geometry":{"type":"Point","coordinates":[-91.13125,38.97085]}},{"properties":{"latitude":32.988,"column_5":4,"date":{"end_time":"2005/04/03 00:00:00 -0500","original":"4/2/2005","granularity":"day","time":"2005/04/02 00:00:00 -0500"},"longitude":-110.767,"id":"adv9lt0tsvgo","location":"Winkelman Flats and Pedestrian Bridge"},"type":"Feature","geometry":{"type":"Point","coordinates":[-110.767,32.988]}},{"properties":{"latitude":32.2812996,"column_5":4,"date":{"end_time":"2005/05/10 00:00:00 -0400","original":"5/9/2005","granularity":"day","time":"2005/05/09 00:00:00 -0400"},"longitude":-111.178299,"id":"adv9lsswi5oi","location":"Saguaro NP--Tucson Mountains Unit"},"type":"Feature","geometry":{"type":"Point","coordinates":[-111.178299,32.2812996]}},{"properties":{"latitude":32.1861206,"column_5":4,"date":{"end_time":"2005/07/18 00:00:00 -0400","original":"7/17/2005","granularity":"day","time":"2005/07/17 00:00:00 -0400"},"longitude":-110.8162263,"id":"adv9lt6cn75d","location":"Lakeside Park"},"type":"Feature","geometry":{"type":"Point","coordinates":[-110.8162263,32.1861206]}},{"properties":{"latitude":32.2518324,"column_5":4,"date":{"end_time":"2005/12/09 00:00:00 -0500","original":"12/8/2005","granularity":"day","time":"2005/12/08 00:00:00 -0500"},"longitude":-110.8064827,"id":"adv9lt0lx1np","location":"Tucson--Woodland Road"},"type":"Feature","geometry":{"type":"Point","coordinates":[-110.8064827,32.2518324]}},{"properties":{"latitude":39.1660826,"column_5":4,"date":{"end_time":"2005/12/27 00:00:00 -0500","original":"12/26/2005","granularity":"day","time":"2005/12/26 00:00:00 -0500"},"longitude":-90.7008717,"id":"adv9lt2nj66y","location":"Red's Landing WMA (Calhoun Co.)"},"type":"Feature","geometry":{"type":"Point","coordinates":[-90.7008717,39.1660826]}},{"properties":{"latitude":39.5429,"column_5":4,"date":{"end_time":"2005/12/28 00:00:00 -0500","original":"12/27/2005","granularity":"day","time":"2005/12/27 00:00:00 -0500"},"longitude":-91.1650694,"id":"adv9lt4uvu9t","location":"Ted Shanks CA"},"type":"Feature","geometry":{"type":"Point","coordinates":[-91.1650694,39.5429]}},{"properties":{"latitude":32.3377823,"column_5":4,"date":{"end_time":"2006/02/01 00:00:00 -0500","original":"1/31/2006","granularity":"day","time":"2006/01/31 00:00:00 -0500"},"longitude":-110.718673,"id":"adv9lt4thtqs","location":"Mt. Lemmon--Gordon Hirabayashi RA (Prison Camp)"},"type":"Feature","geometry":{"type":"Point","coordinates":[-110.718673,32.3377823]}},{"properties":{"latitude":38.9550857,"column_5":4,"date":{"end_time":"2006/05/12 00:00:00 -0400","original":"5/11/2006","granularity":"day","time":"2006/05/11 00:00:00 -0400"},"longitude":-90.8216686,"id":"adv9lsvuksq6","location":"MO: South Ethlyn Rd. &amp; Brevator Rd."},"type":"Feature","geometry":{"type":"Point","coordinates":[-90.8216686,38.9550857]}},{"properties":{"latitude":36.7255392,"column_5":4,"date":{"end_time":"2006/07/30 00:00:00 -0400","original":"7/29/2006","granularity":"day","time":"2006/07/29 00:00:00 -0400"},"longitude":-90.0963879,"id":"adv9lt2mi8eq","location":"Otter Slough CA"},"type":"Feature","geometry":{"type":"Point","coordinates":[-90.0963879,36.7255392]}},{"properties":{"latitude":40.4213376,"column_5":4,"date":{"end_time":"2006/08/10 00:00:00 -0400","original":"8/9/2006","granularity":"day","time":"2006/08/09 00:00:00 -0400"},"longitude":-105.3540802,"id":"adv9lsurz6c7","location":"Big Thompson Canyon"},"type":"Feature","geometry":{"type":"Point","coordinates":[-105.3540802,40.4213376]}},{"properties":{"latitude":39.04645,"column_5":4,"date":{"end_time":"2006/08/14 00:00:00 -0400","original":"8/13/2006","granularity":"day","time":"2006/08/13 00:00:00 -0400"},"longitude":-90.74232,"id":"adv9lszo0pkc","location":"Foley"},"type":"Feature","geometry":{"type":"Point","coordinates":[-90.74232,39.04645]}},{"properties":{"latitude":31.477,"column_5":4,"date":{"end_time":"2006/10/04 00:00:00 -0400","original":"10/3/2006","granularity":"day","time":"2006/10/03 00:00:00 -0400"},"longitude":-110.63,"id":"adv9lt3fxdjh","location":"Bog Hole WA"},"type":"Feature","geometry":{"type":"Point","coordinates":[-110.63,31.477]}},{"properties":{"latitude":34.4775,"column_5":4,"date":{"end_time":"2006/10/22 00:00:00 -0400","original":"10/21/2006","granularity":"day","time":"2006/10/21 00:00:00 -0400"},"longitude":-114.3631,"id":"adv9lst28ij0","location":"Lake Havasu"},"type":"Feature","geometry":{"type":"Point","coordinates":[-114.3631,34.4775]}},{"properties":{"latitude":31.6128313,"column_5":4,"date":{"end_time":"2006/10/27 00:00:00 -0400","original":"10/26/2006","granularity":"day","time":"2006/10/26 00:00:00 -0400"},"longitude":-111.040829,"id":"adv9lstougsz","location":"De Anza Trail--Tubac"},"type":"Feature","geometry":{"type":"Point","coordinates":[-111.040829,31.6128313]}},{"properties":{"latitude":32.3246444,"column_5":4,"date":{"end_time":"2006/11/03 00:00:00 -0500","original":"11/2/2006","granularity":"day","time":"2006/11/02 00:00:00 -0500"},"longitude":-111.0673611,"id":"adv9lswu8ei8","location":"Santa Cruz River--Orange Grove Pond"},"type":"Feature","geometry":{"type":"Point","coordinates":[-111.0673611,32.3246444]}},{"properties":{"latitude":31.6799882,"column_5":4,"date":{"end_time":"2006/11/05 00:00:00 -0500","original":"11/4/2006","granularity":"day","time":"2006/11/04 00:00:00 -0500"},"longitude":-109.6864126,"id":"adv9lsrhbrp7","location":"Sulphur Springs Valley--south of Sunizona"},"type":"Feature","geometry":{"type":"Point","coordinates":[-109.6864126,31.6799882]}},{"properties":{"latitude":32.2378512,"column_5":4,"date":{"end_time":"2006/12/06 00:00:00 -0500","original":"12/5/2006","granularity":"day","time":"2006/12/05 00:00:00 -0500"},"longitude":-111.000967,"id":"adv9lt3r09bi","location":"AZ: Tucson--El Rio Golf Course"},"type":"Feature","geometry":{"type":"Point","coordinates":[-111.000967,32.2378512]}},{"properties":{"latitude":40.6044,"column_5":4,"date":{"end_time":"2006/12/18 00:00:00 -0500","original":"12/17/2006","granularity":"day","time":"2006/12/17 00:00:00 -0500"},"longitude":-95.65777,"id":"adv9lszhz6pg","location":"Hamburg"},"type":"Feature","geometry":{"type":"Point","coordinates":[-95.65777,40.6044]}},{"properties":{"latitude":38.5175826,"column_5":4,"date":{"end_time":"2007/05/19 00:00:00 -0400","original":"5/18/2007","granularity":"day","time":"2007/05/18 00:00:00 -0400"},"longitude":-93.2090378,"id":"adv9lstad046","location":"Mora CA"},"type":"Feature","geometry":{"type":"Point","coordinates":[-93.2090378,38.5175826]}},{"properties":{"latitude":32.4298176,"column_5":4,"date":{"end_time":"2007/09/01 00:00:00 -0400","original":"8/31/2007","granularity":"day","time":"2007/08/31 00:00:00 -0400"},"longitude":-110.7435608,"id":"adv9lsy6ok7a","location":"AZ: Mt. Lemmon"},"type":"Feature","geometry":{"type":"Point","coordinates":[-110.7435608,32.4298176]}},{"properties":{"latitude":32.9204706,"column_5":4,"date":{"end_time":"2007/11/05 00:00:00 -0500","original":"11/4/2007","granularity":"day","time":"2007/11/04 00:00:00 -0400"},"longitude":-111.7807174,"id":"adv9lsxd36ef","location":"Dave White Golf Course"},"type":"Feature","geometry":{"type":"Point","coordinates":[-111.7807174,32.9204706]}},{"properties":{"latitude":32.9100005,"column_5":4,"date":{"end_time":"2007/11/05 00:00:00 -0500","original":"11/4/2007","granularity":"day","time":"2007/11/04 00:00:00 -0400"},"longitude":-111.7894936,"id":"adv9lsv5zmav","location":"Casa Grande WTP"},"type":"Feature","geometry":{"type":"Point","coordinates":[-111.7894936,32.9100005]}},{"properties":{"latitude":32.241953,"column_5":4,"date":{"end_time":"2007/12/01 00:00:00 -0500","original":"11/30/2007","granularity":"day","time":"2007/11/30 00:00:00 -0500"},"longitude":-111.0037994,"id":"adv9lt24w6q6","location":"Joaquin Murrieta Park"},"type":"Feature","geometry":{"type":"Point","coordinates":[-111.0037994,32.241953]}},{"properties":{"latitude":-4.0870485,"column_5":4,"date":{"end_time":"2009/09/25 00:00:00 -0400","original":"9/24/2009","granularity":"day","time":"2009/09/24 00:00:00 -0400"},"longitude":-78.9578819,"id":"adv9lsr5g1w0","location":"Copalinga Lodge"},"type":"Feature","geometry":{"type":"Point","coordinates":[-78.9578819,-4.0870485]}},{"properties":{"latitude":-18.9764287,"column_5":4,"date":{"end_time":"2009/11/15 00:00:00 -0500","original":"11/14/2009","granularity":"day","time":"2009/11/14 00:00:00 -0500"},"longitude":146.1641693,"id":"adv9lsx43fzx","location":"Paluma Mountain NP"},"type":"Feature","geometry":{"type":"Point","coordinates":[146.1641693,-18.9764287]}},{"properties":{"latitude":8.5360375,"column_5":4,"date":{"end_time":"2011/01/28 00:00:00 -0500","original":"1/27/2011","granularity":"day","time":"2011/01/27 00:00:00 -0500"},"longitude":-83.3055496,"id":"adv9lsx7mznh","location":"CR: Puerto Jimenez"},"type":"Feature","geometry":{"type":"Point","coordinates":[-83.3055496,8.5360375]}},{"properties":{"latitude":37.6461898,"column_5":4,"date":{"end_time":"2011/05/13 00:00:00 -0400","original":"5/12/2011","granularity":"day","time":"2011/05/12 00:00:00 -0400"},"longitude":-112.1660052,"id":"adv9lt5r3t95","location":"Bryce Canyon NP"},"type":"Feature","geometry":{"type":"Point","coordinates":[-112.1660052,37.6461898]}},{"properties":{"latitude":40.4555588,"column_5":4,"date":{"end_time":"2011/05/16 00:00:00 -0400","original":"5/15/2011","granularity":"day","time":"2011/05/15 00:00:00 -0400"},"longitude":-109.5286865,"id":"adv9lsznandl","location":"Vernal"},"type":"Feature","geometry":{"type":"Point","coordinates":[-109.5286865,40.4555588]}},{"properties":{"latitude":61.2006376,"column_5":4,"date":{"end_time":"2012/03/05 00:00:00 -0500","original":"3/4/2012","granularity":"day","time":"2012/03/04 00:00:00 -0500"},"longitude":-149.9433312,"id":"adv9lt55p937","location":"AK: Anchorage--Turnagain Neighborhood"},"type":"Feature","geometry":{"type":"Point","coordinates":[-149.9433312,61.2006376]}},{"properties":{"latitude":61.8530718,"column_5":4,"date":{"end_time":"2012/04/15 00:00:00 -0400","original":"4/14/2012","granularity":"day","time":"2012/04/14 00:00:00 -0400"},"longitude":-147.37185,"id":"adv9lsu0k8ek","location":"Gunsight Mtn. Hawkwatch-MP A118.9 Glenn Hwy."},"type":"Feature","geometry":{"type":"Point","coordinates":[-147.37185,61.8530718]}},{"properties":{"latitude":60.777602,"column_5":4,"date":{"end_time":"2012/04/29 00:00:00 -0400","original":"4/28/2012","granularity":"day","time":"2012/04/28 00:00:00 -0400"},"longitude":-148.7033844,"id":"adv9lszbq3c2","location":"Whittier"},"type":"Feature","geometry":{"type":"Point","coordinates":[-148.7033844,60.777602]}},{"properties":{"latitude":61.1469632,"column_5":4,"date":{"end_time":"2013/02/06 00:00:00 -0500","original":"2/5/2013","granularity":"day","time":"2013/02/05 00:00:00 -0500"},"longitude":-149.9434447,"id":"adv9lt3mplgh","location":"AK: Anchorage--Shady Birch Park"},"type":"Feature","geometry":{"type":"Point","coordinates":[-149.9434447,61.1469632]}},{"properties":{"latitude":44.5435052,"column_5":3,"date":{"end_time":"1991/06/20 00:00:00 -0400","original":"6/19/1991","granularity":"day","time":"1991/06/19 00:00:00 -0400"},"longitude":-110.5993652,"id":"adv9lszcdoy8","location":"Yellowstone NP--Wyoming"},"type":"Feature","geometry":{"type":"Point","coordinates":[-110.5993652,44.5435052]}},{"properties":{"latitude":26.0615634,"column_5":3,"date":{"end_time":"1994/12/28 00:00:00 -0500","original":"12/27/1994","granularity":"day","time":"1994/12/27 00:00:00 -0500"},"longitude":-98.1492805,"id":"adv9lt4ls76w","location":"Santa Ana NWR (LTC 059)"},"type":"Feature","geometry":{"type":"Point","coordinates":[-98.1492805,26.0615634]}},{"properties":{"latitude":48.6950849,"column_5":3,"date":{"end_time":"1995/08/06 00:00:00 -0400","original":"8/5/1995","granularity":"day","time":"1995/08/05 00:00:00 -0400"},"longitude":-113.7199347,"id":"adv9lt6q7eeo","location":"Glacier NP--Logan Pass"},"type":"Feature","geometry":{"type":"Point","coordinates":[-113.7199347,48.6950849]}},{"properties":{"latitude":48.644763,"column_5":3,"date":{"end_time":"1995/08/07 00:00:00 -0400","original":"8/6/1995","granularity":"day","time":"1995/08/06 00:00:00 -0400"},"longitude":-113.690432,"id":"adv9lt3loqdx","location":"Glacier NP"},"type":"Feature","geometry":{"type":"Point","coordinates":[-113.690432,48.644763]}},{"properties":{"latitude":28.7072422,"column_5":3,"date":{"end_time":"1996/06/15 00:00:00 -0400","original":"6/14/1996","granularity":"day","time":"1996/06/14 00:00:00 -0400"},"longitude":-80.7299856,"id":"adv9lsy5kd6u","location":"Merritt Island NWR"},"type":"Feature","geometry":{"type":"Point","coordinates":[-80.7299856,28.7072422]}},{"properties":{"latitude":37.21535,"column_5":3,"date":{"end_time":"1997/07/21 00:00:00 -0400","original":"7/20/1997","granularity":"day","time":"1997/07/20 00:00:00 -0400"},"longitude":-93.29829,"id":"adv9lsxnhdhe","location":"Springfield"},"type":"Feature","geometry":{"type":"Point","coordinates":[-93.29829,37.21535]}},{"properties":{"latitude":33.802,"column_5":3,"date":{"end_time":"1998/06/14 00:00:00 -0400","original":"6/13/1998","granularity":"day","time":"1998/06/13 00:00:00 -0400"},"longitude":-106.88,"id":"adv9lt6zl9gb","location":"Bosque del Apache NWR"},"type":"Feature","geometry":{"type":"Point","coordinates":[-106.88,33.802]}},{"properties":{"latitude":29.6136475,"column_5":3,"date":{"end_time":"1999/01/01 00:00:00 -0500","original":"12/31/1998","granularity":"day","time":"1998/12/31 00:00:00 -0500"},"longitude":-94.5341778,"id":"adv9lsvtir4c","location":"Anahuac NWR (UTC 049)"},"type":"Feature","geometry":{"type":"Point","coordinates":[-94.5341778,29.6136475]}},{"properties":{"latitude":46.6017722,"column_5":3,"date":{"end_time":"1999/07/06 00:00:00 -0400","original":"7/5/1999","granularity":"day","time":"1999/07/05 00:00:00 -0400"},"longitude":-85.2040083,"id":"adv9lsr4cc0o","location":"Tahquamenon Falls SP (Chippewa Co.)"},"type":"Feature","geometry":{"type":"Point","coordinates":[-85.2040083,46.6017722]}},{"properties":{"latitude":46.2696135,"column_5":3,"date":{"end_time":"1999/07/07 00:00:00 -0400","original":"7/6/1999","granularity":"day","time":"1999/07/06 00:00:00 -0400"},"longitude":-86.079071,"id":"adv9lt5r75tl","location":"Seney NWR"},"type":"Feature","geometry":{"type":"Point","coordinates":[-86.079071,46.2696135]}},{"properties":{"latitude":31.9041957,"column_5":3,"date":{"end_time":"1999/07/23 00:00:00 -0400","original":"7/22/1999","granularity":"day","time":"1999/07/22 00:00:00 -0400"},"longitude":-109.1561556,"id":"adv9lt6hvpld","location":"Portal--Cave Creek Ranch"},"type":"Feature","geometry":{"type":"Point","coordinates":[-109.1561556,31.9041957]}},{"properties":{"latitude":31.83539,"column_5":3,"date":{"end_time":"1999/07/23 00:00:00 -0400","original":"7/22/1999","granularity":"day","time":"1999/07/22 00:00:00 -0400"},"longitude":-109.03161,"id":"adv9lt4kw9sq","location":"Rodeo"},"type":"Feature","geometry":{"type":"Point","coordinates":[-109.03161,31.83539]}},{"properties":{"latitude":31.8771992,"column_5":3,"date":{"end_time":"1999/07/24 00:00:00 -0400","original":"7/23/1999","granularity":"day","time":"1999/07/23 00:00:00 -0400"},"longitude":-109.1781998,"id":"adv9lstww8ae","location":"Cave Creek Canyon--South Fork"},"type":"Feature","geometry":{"type":"Point","coordinates":[-109.1781998,31.8771992]}},{"properties":{"latitude":31.9328003,"column_5":3,"date":{"end_time":"1999/07/29 00:00:00 -0400","original":"7/28/1999","granularity":"day","time":"1999/07/28 00:00:00 -0400"},"longitude":-109.2713013,"id":"adv9lsygrg2n","location":"Pinery Canyon"},"type":"Feature","geometry":{"type":"Point","coordinates":[-109.2713013,31.9328003]}},{"properties":{"latitude":9.9292859,"column_5":3,"date":{"end_time":"2000/02/20 00:00:00 -0500","original":"2/19/2000","granularity":"day","time":"2000/02/19 00:00:00 -0500"},"longitude":-84.0766525,"id":"adv9lszqy75m","location":"CR: San Jose"},"type":"Feature","geometry":{"type":"Point","coordinates":[-84.0766525,9.9292859]}},{"properties":{"latitude":10.475,"column_5":3,"date":{"end_time":"2000/02/24 00:00:00 -0500","original":"2/23/2000","granularity":"day","time":"2000/02/23 00:00:00 -0500"},"longitude":-84.73,"id":"adv9lt3rq8n0","location":"Tabacon Resort"},"type":"Feature","geometry":{"type":"Point","coordinates":[-84.73,10.475]}},{"properties":{"latitude":38.9178836,"column_5":3,"date":{"end_time":"2002/12/15 00:00:00 -0500","original":"12/14/2002","granularity":"day","time":"2002/12/14 00:00:00 -0500"},"longitude":-90.6672478,"id":"adv9lt2xcxzc","location":"Cuivre Island CA"},"type":"Feature","geometry":{"type":"Point","coordinates":[-90.6672478,38.9178836]}},{"properties":{"latitude":32.9881406,"column_5":3,"date":{"end_time":"2005/04/03 00:00:00 -0500","original":"4/2/2005","granularity":"day","time":"2005/04/02 00:00:00 -0500"},"longitude":-110.7798756,"id":"adv9lsrlig6i","location":"Winkleman--Hayden Golf Club"},"type":"Feature","geometry":{"type":"Point","coordinates":[-110.7798756,32.9881406]}},{"properties":{"latitude":47.4333333,"column_5":3,"date":{"end_time":"2005/06/12 00:00:00 -0400","original":"6/11/2005","granularity":"day","time":"2005/06/11 00:00:00 -0400"},"longitude":-117.5666667,"id":"adv9lsrneghp","location":"Turnbull NWR"},"type":"Feature","geometry":{"type":"Point","coordinates":[-117.5666667,47.4333333]}},{"properties":{"latitude":48.4541028,"column_5":3,"date":{"end_time":"2005/06/13 00:00:00 -0400","original":"6/12/2005","granularity":"day","time":"2005/06/12 00:00:00 -0400"},"longitude":-115.7666889,"id":"adv9lt67o7sm","location":"Kootenai Falls"},"type":"Feature","geometry":{"type":"Point","coordinates":[-115.7666889,48.4541028]}},{"properties":{"latitude":48.304675,"column_5":3,"date":{"end_time":"2005/06/14 00:00:00 -0400","original":"6/13/2005","granularity":"day","time":"2005/06/13 00:00:00 -0400"},"longitude":-115.3081361,"id":"adv9lsv78jzs","location":"MT: Libby--Fisher River"},"type":"Feature","geometry":{"type":"Point","coordinates":[-115.3081361,48.304675]}},{"properties":{"latitude":34.01005,"column_5":3,"date":{"end_time":"2005/07/26 00:00:00 -0400","original":"7/25/2005","granularity":"day","time":"2005/07/25 00:00:00 -0400"},"longitude":-109.45865,"id":"adv9lszbwi30","location":"Greer"},"type":"Feature","geometry":{"type":"Point","coordinates":[-109.45865,34.01005]}},{"properties":{"latitude":38.93175,"column_5":3,"date":{"end_time":"2005/08/14 00:00:00 -0400","original":"8/13/2005","granularity":"day","time":"2005/08/13 00:00:00 -0400"},"longitude":-90.74683,"id":"adv9lt192jyr","location":"Old Monroe"},"type":"Feature","geometry":{"type":"Point","coordinates":[-90.74683,38.93175]}},{"properties":{"latitude":31.4596004,"column_5":3,"date":{"end_time":"2005/09/04 00:00:00 -0400","original":"9/3/2005","granularity":"day","time":"2005/09/03 00:00:00 -0400"},"longitude":-110.3525009,"id":"adv9lt2acax2","location":"Scheelite Canyon"},"type":"Feature","geometry":{"type":"Point","coordinates":[-110.3525009,31.4596004]}},{"properties":{"latitude":39.6108364,"column_5":3,"date":{"end_time":"2005/11/26 00:00:00 -0500","original":"11/25/2005","granularity":"day","time":"2005/11/25 00:00:00 -0500"},"longitude":-92.63161,"id":"adv9lsqu39pc","location":"Thomas Hill Reservoir"},"type":"Feature","geometry":{"type":"Point","coordinates":[-92.63161,39.6108364]}},{"properties":{"latitude":31.96788,"column_5":3,"date":{"end_time":"2006/02/05 00:00:00 -0500","original":"2/4/2006","granularity":"day","time":"2006/02/04 00:00:00 -0500"},"longitude":-110.29463,"id":"adv9lt0o8iad","location":"Benson"},"type":"Feature","geometry":{"type":"Point","coordinates":[-110.29463,31.96788]}},{"properties":{"latitude":38.9548419,"column_5":3,"date":{"end_time":"2006/03/15 00:00:00 -0500","original":"3/14/2006","granularity":"day","time":"2006/03/14 00:00:00 -0500"},"longitude":-91.1586215,"id":"adv9lsxbtqgt","location":"Hawk Point Agricultural Area"},"type":"Feature","geometry":{"type":"Point","coordinates":[-91.1586215,38.9548419]}},{"properties":{"latitude":31.4180254,"column_5":3,"date":{"end_time":"2006/04/04 00:00:00 -0400","original":"4/3/2006","granularity":"day","time":"2006/04/03 00:00:00 -0400"},"longitude":-111.2382513,"id":"adv9lt3md7uh","location":"California Gulch"},"type":"Feature","geometry":{"type":"Point","coordinates":[-111.2382513,31.4180254]}},{"properties":{"latitude":39.0635652,"column_5":3,"date":{"end_time":"2006/05/12 00:00:00 -0400","original":"5/11/2006","granularity":"day","time":"2006/05/11 00:00:00 -0400"},"longitude":-90.9137993,"id":"adv9lsx1h8b9","location":"Kessler CA"},"type":"Feature","geometry":{"type":"Point","coordinates":[-90.9137993,39.0635652]}},{"properties":{"latitude":40.068893,"column_5":3,"date":{"end_time":"2006/05/24 00:00:00 -0400","original":"5/23/2006","granularity":"day","time":"2006/05/23 00:00:00 -0400"},"longitude":-95.23534,"id":"adv9lszbg28g","location":"Squaw Creek NWR"},"type":"Feature","geometry":{"type":"Point","coordinates":[-95.23534,40.068893]}},{"properties":{"latitude":39.7391891,"column_5":3,"date":{"end_time":"2006/05/25 00:00:00 -0400","original":"5/24/2006","granularity":"day","time":"2006/05/24 00:00:00 -0400"},"longitude":-104.9845428,"id":"adv9lt4ldbd2","location":"Denver"},"type":"Feature","geometry":{"type":"Point","coordinates":[-104.9845428,39.7391891]}},{"properties":{"latitude":38.8896369,"column_5":3,"date":{"end_time":"2006/07/25 00:00:00 -0400","original":"7/24/2006","granularity":"day","time":"2006/07/24 00:00:00 -0400"},"longitude":-90.9197212,"id":"adv9lst4s1ce","location":"MO: Lincoln County--Big Creek"},"type":"Feature","geometry":{"type":"Point","coordinates":[-90.9197212,38.8896369]}},{"properties":{"latitude":38.0024459,"column_5":3,"date":{"end_time":"2006/07/29 00:00:00 -0400","original":"7/28/2006","granularity":"day","time":"2006/07/28 00:00:00 -0400"},"longitude":-90.0796487,"id":"adv9lsw3i635","location":"Tower Rock Stone Quarry"},"type":"Feature","geometry":{"type":"Point","coordinates":[-90.0796487,38.0024459]}},{"properties":{"latitude":36.2080352,"column_5":3,"date":{"end_time":"2006/07/30 00:00:00 -0400","original":"7/29/2006","granularity":"day","time":"2006/07/29 00:00:00 -0400"},"longitude":-89.747712,"id":"adv9lstr7qen","location":"Caruthersville Catfish Ponds"},"type":"Feature","geometry":{"type":"Point","coordinates":[-89.747712,36.2080352]}},{"properties":{"latitude":31.876683,"column_5":3,"date":{"end_time":"2006/09/17 00:00:00 -0400","original":"9/16/2006","granularity":"day","time":"2006/09/16 00:00:00 -0400"},"longitude":-110.2126819,"id":"adv9lsxegfse","location":"St. David--Holy Trinity Monastery"},"type":"Feature","geometry":{"type":"Point","coordinates":[-110.2126819,31.876683]}},{"properties":{"latitude":34.14254,"column_5":3,"date":{"end_time":"2006/10/16 00:00:00 -0400","original":"10/15/2006","granularity":"day","time":"2006/10/15 00:00:00 -0400"},"longitude":-109.96066,"id":"adv9lsxgcijm","location":"Pinetop-Lakeside"},"type":"Feature","geometry":{"type":"Point","coordinates":[-109.96066,34.14254]}},{"properties":{"latitude":34.25424,"column_5":3,"date":{"end_time":"2006/10/16 00:00:00 -0400","original":"10/15/2006","granularity":"day","time":"2006/10/15 00:00:00 -0400"},"longitude":-110.02967,"id":"adv9lsz4zzuq","location":"Show Low"},"type":"Feature","geometry":{"type":"Point","coordinates":[-110.02967,34.25424]}},{"properties":{"latitude":34.8,"column_5":3,"date":{"end_time":"2006/10/22 00:00:00 -0400","original":"10/21/2006","granularity":"day","time":"2006/10/21 00:00:00 -0400"},"longitude":-114.52,"id":"adv9lsva6801","location":"Havasu NWR--Topock Marsh"},"type":"Feature","geometry":{"type":"Point","coordinates":[-114.52,34.8]}},{"properties":{"latitude":34.296,"column_5":3,"date":{"end_time":"2006/10/22 00:00:00 -0400","original":"10/21/2006","granularity":"day","time":"2006/10/21 00:00:00 -0400"},"longitude":-114.1,"id":"adv9lt3iuljo","location":"Bill Williams River NWR (La Paz Co.)"},"type":"Feature","geometry":{"type":"Point","coordinates":[-114.1,34.296]}},{"properties":{"latitude":34.2970718,"column_5":3,"date":{"end_time":"2006/10/22 00:00:00 -0400","original":"10/21/2006","granularity":"day","time":"2006/10/21 00:00:00 -0400"},"longitude":-114.1379466,"id":"adv9lt4ngeam","location":"Parker Dam (AZ)"},"type":"Feature","geometry":{"type":"Point","coordinates":[-114.1379466,34.2970718]}},{"properties":{"latitude":40.4115,"column_5":3,"date":{"end_time":"2006/12/17 00:00:00 -0500","original":"12/16/2006","granularity":"day","time":"2006/12/16 00:00:00 -0500"},"longitude":-105.08763,"id":"adv9lt36csqk","location":"Loveland--Lake Loveland"},"type":"Feature","geometry":{"type":"Point","coordinates":[-105.08763,40.4115]}},{"properties":{"latitude":39.04909,"column_5":3,"date":{"end_time":"2006/12/29 00:00:00 -0500","original":"12/28/2006","granularity":"day","time":"2006/12/28 00:00:00 -0500"},"longitude":-90.9691,"id":"adv9lsucfffj","location":"Lincoln"},"type":"Feature","geometry":{"type":"Point","coordinates":[-90.9691,39.04909]}},{"properties":{"latitude":32.25287,"column_5":3,"date":{"end_time":"2007/02/18 00:00:00 -0500","original":"2/17/2007","granularity":"day","time":"2007/02/17 00:00:00 -0500"},"longitude":-109.83162,"id":"adv9lt1nr83g","location":"Willcox"},"type":"Feature","geometry":{"type":"Point","coordinates":[-109.83162,32.25287]}},{"properties":{"latitude":32.8268076,"column_5":3,"date":{"end_time":"2007/03/19 00:00:00 -0400","original":"3/18/2007","granularity":"day","time":"2007/03/18 00:00:00 -0400"},"longitude":-114.4490433,"id":"adv9lswlrpnc","location":"Mittry Lake"},"type":"Feature","geometry":{"type":"Point","coordinates":[-114.4490433,32.8268076]}},{"properties":{"latitude":32.352286,"column_5":3,"date":{"end_time":"2007/04/26 00:00:00 -0400","original":"4/25/2007","granularity":"day","time":"2007/04/25 00:00:00 -0400"},"longitude":-111.0955524,"id":"adv9lsyoq786","location":"Santa Cruz River--Cortaro Rd."},"type":"Feature","geometry":{"type":"Point","coordinates":[-111.0955524,32.352286]}},{"properties":{"latitude":38.8678252,"column_5":3,"date":{"end_time":"2007/05/17 00:00:00 -0400","original":"5/16/2007","granularity":"day","time":"2007/05/16 00:00:00 -0400"},"longitude":-92.3256795,"id":"adv9lt2lwfqb","location":"Rock Bridge SP"},"type":"Feature","geometry":{"type":"Point","coordinates":[-92.3256795,38.8678252]}},{"properties":{"latitude":38.5494889,"column_5":3,"date":{"end_time":"2007/05/19 00:00:00 -0400","original":"5/18/2007","granularity":"day","time":"2007/05/18 00:00:00 -0400"},"longitude":-93.2651639,"id":"adv9lt01o4hl","location":"Paint Brush Prairie CA"},"type":"Feature","geometry":{"type":"Point","coordinates":[-93.2651639,38.5494889]}},{"properties":{"latitude":38.5767403,"column_5":3,"date":{"end_time":"2007/05/22 00:00:00 -0400","original":"5/21/2007","granularity":"day","time":"2007/05/21 00:00:00 -0400"},"longitude":-92.1734772,"id":"adv9lt1zc7b0","location":"Jefferson City"},"type":"Feature","geometry":{"type":"Point","coordinates":[-92.1734772,38.5767403]}},{"properties":{"latitude":37.0420722,"column_5":3,"date":{"end_time":"2007/05/24 00:00:00 -0400","original":"5/23/2007","granularity":"day","time":"2007/05/23 00:00:00 -0400"},"longitude":-91.1865444,"id":"adv9lt1ntava","location":"Peck Ranch CA"},"type":"Feature","geometry":{"type":"Point","coordinates":[-91.1865444,37.0420722]}},{"properties":{"latitude":38.81456,"column_5":3,"date":{"end_time":"2007/06/27 00:00:00 -0400","original":"6/26/2007","granularity":"day","time":"2007/06/26 00:00:00 -0400"},"longitude":-91.93434,"id":"adv9lt3ry64s","location":"Callaway"},"type":"Feature","geometry":{"type":"Point","coordinates":[-91.93434,38.81456]}},{"properties":{"latitude":37.0594238,"column_5":3,"date":{"end_time":"2007/06/27 00:00:00 -0400","original":"6/26/2007","granularity":"day","time":"2007/06/26 00:00:00 -0400"},"longitude":-89.4876337,"id":"adv9lstbe1oq","location":"MO: Sikeston Heronry 2007"},"type":"Feature","geometry":{"type":"Point","coordinates":[-89.4876337,37.0594238]}},{"properties":{"latitude":48.4101749,"column_5":3,"date":{"end_time":"2007/07/26 00:00:00 -0400","original":"7/25/2007","granularity":"day","time":"2007/07/25 00:00:00 -0400"},"longitude":-115.3146458,"id":"adv9lt278p4k","location":"Libby Dam"},"type":"Feature","geometry":{"type":"Point","coordinates":[-115.3146458,48.4101749]}},{"properties":{"latitude":33.44834,"column_5":3,"date":{"end_time":"2007/08/17 00:00:00 -0400","original":"8/16/2007","granularity":"day","time":"2007/08/16 00:00:00 -0400"},"longitude":-112.0737,"id":"adv9lt1igpen","location":"Phoenix"},"type":"Feature","geometry":{"type":"Point","coordinates":[-112.0737,33.44834]}},{"properties":{"latitude":31.9640686,"column_5":3,"date":{"end_time":"2007/11/29 00:00:00 -0500","original":"11/28/2007","granularity":"day","time":"2007/11/28 00:00:00 -0500"},"longitude":-110.6917405,"id":"adv9lt4jr9ex","location":"AZ: Keith Kamper's House"},"type":"Feature","geometry":{"type":"Point","coordinates":[-110.6917405,31.9640686]}},{"properties":{"latitude":39.13675,"column_5":3,"date":{"end_time":"2007/12/28 00:00:00 -0500","original":"12/27/2007","granularity":"day","time":"2007/12/27 00:00:00 -0500"},"longitude":-90.86433,"id":"adv9lsvr39gy","location":"New Hope"},"type":"Feature","geometry":{"type":"Point","coordinates":[-90.86433,39.13675]}},{"properties":{"latitude":12.1516,"column_5":3,"date":{"end_time":"2008/12/10 00:00:00 -0500","original":"12/9/2008","granularity":"day","time":"2008/12/09 00:00:00 -0500"},"longitude":99.9815,"id":"adv9lsxfnnfl","location":"Khao Sam Roi Yot NP"},"type":"Feature","geometry":{"type":"Point","coordinates":[99.9815,12.1516]}},{"properties":{"latitude":12.8112457,"column_5":3,"date":{"end_time":"2008/12/14 00:00:00 -0500","original":"12/13/2008","granularity":"day","time":"2008/12/13 00:00:00 -0500"},"longitude":99.411335,"id":"adv9lt075s42","location":"Kaeng Krachan NP"},"type":"Feature","geometry":{"type":"Point","coordinates":[99.411335,12.8112457]}},{"properties":{"latitude":14.4343,"column_5":3,"date":{"end_time":"2008/12/16 00:00:00 -0500","original":"12/15/2008","granularity":"day","time":"2008/12/15 00:00:00 -0500"},"longitude":101.3722,"id":"adv9lsrr170z","location":"Khao Yai NP"},"type":"Feature","geometry":{"type":"Point","coordinates":[101.3722,14.4343]}},{"properties":{"latitude":19.8826,"column_5":3,"date":{"end_time":"2008/12/20 00:00:00 -0500","original":"12/19/2008","granularity":"day","time":"2008/12/19 00:00:00 -0500"},"longitude":99.0469,"id":"adv9lsyr2k1q","location":"Doi Ang Khang"},"type":"Feature","geometry":{"type":"Point","coordinates":[99.0469,19.8826]}},{"properties":{"latitude":13.972,"column_5":3,"date":{"end_time":"2009/01/02 00:00:00 -0500","original":"1/1/2009","granularity":"day","time":"2009/01/01 00:00:00 -0500"},"longitude":104.8871,"id":"adv9lsxf8et9","location":"KH: Tmat boey"},"type":"Feature","geometry":{"type":"Point","coordinates":[104.8871,13.972]}},{"properties":{"latitude":3.7142614,"column_5":3,"date":{"end_time":"2009/01/24 00:00:00 -0500","original":"1/23/2009","granularity":"day","time":"2009/01/23 00:00:00 -0500"},"longitude":101.7368882,"id":"adv9lt73s1uz","location":"Frasers Hill"},"type":"Feature","geometry":{"type":"Point","coordinates":[101.7368882,3.7142614]}},{"properties":{"latitude":-3.6497966,"column_5":3,"date":{"end_time":"2009/09/20 00:00:00 -0400","original":"9/19/2009","granularity":"day","time":"2009/09/19 00:00:00 -0400"},"longitude":-79.7662354,"id":"adv9lswf6vqv","location":"Buenaventura Reserve"},"type":"Feature","geometry":{"type":"Point","coordinates":[-79.7662354,-3.6497966]}},{"properties":{"latitude":-3.996808,"column_5":3,"date":{"end_time":"2009/09/23 00:00:00 -0400","original":"9/22/2009","granularity":"day","time":"2009/09/22 00:00:00 -0400"},"longitude":-79.2035294,"id":"adv9lsxjlyte","location":"EC: Loja"},"type":"Feature","geometry":{"type":"Point","coordinates":[-79.2035294,-3.996808]}},{"properties":{"latitude":-0.9971306,"column_5":3,"date":{"end_time":"2009/10/02 00:00:00 -0400","original":"10/1/2009","granularity":"day","time":"2009/10/01 00:00:00 -0400"},"longitude":-77.8180075,"id":"adv9lssh8i9j","location":"Tena--Parque Amazonico \"La Isla\""},"type":"Feature","geometry":{"type":"Point","coordinates":[-77.8180075,-0.9971306]}},{"properties":{"latitude":-1.0649259,"column_5":3,"date":{"end_time":"2009/10/02 00:00:00 -0400","original":"10/1/2009","granularity":"day","time":"2009/10/01 00:00:00 -0400"},"longitude":-77.6138592,"id":"adv9lt6cnmav","location":"Jatun Sacha Biological Station"},"type":"Feature","geometry":{"type":"Point","coordinates":[-77.6138592,-1.0649259]}},{"properties":{"latitude":-0.0510693,"column_5":3,"date":{"end_time":"2009/10/11 00:00:00 -0400","original":"10/10/2009","granularity":"day","time":"2009/10/10 00:00:00 -0400"},"longitude":-78.77841,"id":"adv9lst7cz11","location":"Mindo--general area"},"type":"Feature","geometry":{"type":"Point","coordinates":[-78.77841,-0.0510693]}},{"properties":{"latitude":-34.1062259,"column_5":3,"date":{"end_time":"2009/11/10 00:00:00 -0500","original":"11/9/2009","granularity":"day","time":"2009/11/09 00:00:00 -0500"},"longitude":150.976696,"id":"adv9lsvg68m3","location":"Heathcote NP"},"type":"Feature","geometry":{"type":"Point","coordinates":[150.976696,-34.1062259]}},{"properties":{"latitude":-21.1679846,"column_5":3,"date":{"end_time":"2009/11/12 00:00:00 -0500","original":"11/11/2009","granularity":"day","time":"2009/11/11 00:00:00 -0500"},"longitude":148.5052228,"id":"adv9lt24q5ry","location":"Eungella NP"},"type":"Feature","geometry":{"type":"Point","coordinates":[148.5052228,-21.1679846]}},{"properties":{"latitude":-34.7526497,"column_5":3,"date":{"end_time":"2009/12/24 00:00:00 -0500","original":"12/23/2009","granularity":"day","time":"2009/12/23 00:00:00 -0500"},"longitude":142.3431587,"id":"adv9lt61r200","location":"Hattah-Kulkyne NP"},"type":"Feature","geometry":{"type":"Point","coordinates":[142.3431587,-34.7526497]}},{"properties":{"latitude":-38.5046541,"column_5":3,"date":{"end_time":"2010/01/17 00:00:00 -0500","original":"1/16/2010","granularity":"day","time":"2010/01/16 00:00:00 -0500"},"longitude":175.5821228,"id":"adv9lstmmgzw","location":"Pureora Forest Park"},"type":"Feature","geometry":{"type":"Point","coordinates":[175.5821228,-38.5046541]}},{"properties":{"latitude":-46.9183793,"column_5":3,"date":{"end_time":"2010/01/21 00:00:00 -0500","original":"1/20/2010","granularity":"day","time":"2010/01/20 00:00:00 -0500"},"longitude":167.8848267,"id":"adv9lt507p0p","location":"NZ: Stewart Island"},"type":"Feature","geometry":{"type":"Point","coordinates":[167.8848267,-46.9183793]}},{"properties":{"latitude":33.35285,"column_5":3,"date":{"end_time":"2010/02/16 00:00:00 -0500","original":"2/15/2010","granularity":"day","time":"2010/02/15 00:00:00 -0500"},"longitude":-111.78869,"id":"adv9lst7m9xa","location":"Gilbert"},"type":"Feature","geometry":{"type":"Point","coordinates":[-111.78869,33.35285]}},{"properties":{"latitude":40.7888599,"column_5":3,"date":{"end_time":"2010/06/29 00:00:00 -0400","original":"6/28/2010","granularity":"day","time":"2010/06/28 00:00:00 -0400"},"longitude":-111.9760895,"id":"adv9lszgs2au","location":"UT: Salt Lake City Intl Airport"},"type":"Feature","geometry":{"type":"Point","coordinates":[-111.9760895,40.7888599]}},{"properties":{"latitude":33.42225,"column_5":3,"date":{"end_time":"2010/07/21 00:00:00 -0400","original":"7/20/2010","granularity":"day","time":"2010/07/20 00:00:00 -0400"},"longitude":-111.8227,"id":"adv9lt453smm","location":"Mesa"},"type":"Feature","geometry":{"type":"Point","coordinates":[-111.8227,33.42225]}},{"properties":{"latitude":38.81145,"column_5":3,"date":{"end_time":"2010/11/22 00:00:00 -0500","original":"11/21/2010","granularity":"day","time":"2010/11/21 00:00:00 -0500"},"longitude":-90.85293,"id":"adv9lsru29qd","location":"Wentzville"},"type":"Feature","geometry":{"type":"Point","coordinates":[-90.85293,38.81145]}},{"properties":{"latitude":-18.9202523,"column_5":3,"date":{"end_time":"2010/11/28 00:00:00 -0500","original":"11/27/2010","granularity":"day","time":"2010/11/27 00:00:00 -0500"},"longitude":47.5196457,"id":"adv9lsse4044","location":"MG: Antananarivo"},"type":"Feature","geometry":{"type":"Point","coordinates":[47.5196457,-18.9202523]}},{"properties":{"latitude":-21.2588213,"column_5":3,"date":{"end_time":"2010/12/01 00:00:00 -0500","original":"11/30/2010","granularity":"day","time":"2010/11/30 00:00:00 -0500"},"longitude":47.3945904,"id":"adv9lsulnlru","location":"Ranomafana NP"},"type":"Feature","geometry":{"type":"Point","coordinates":[47.3945904,-21.2588213]}},{"properties":{"latitude":-23.354352,"column_5":3,"date":{"end_time":"2010/12/04 00:00:00 -0500","original":"12/3/2010","granularity":"day","time":"2010/12/03 00:00:00 -0500"},"longitude":43.6531448,"id":"adv9lsqxzhpf","location":"Toliara"},"type":"Feature","geometry":{"type":"Point","coordinates":[43.6531448,-23.354352]}},{"properties":{"latitude":-17.7905354,"column_5":3,"date":{"end_time":"2011/01/07 00:00:00 -0500","original":"1/6/2011","granularity":"day","time":"2011/01/06 00:00:00 -0500"},"longitude":25.1689911,"id":"adv9lsxot85c","location":"Kasane--town"},"type":"Feature","geometry":{"type":"Point","coordinates":[25.1689911,-17.7905354]}},{"properties":{"latitude":8.5752925,"column_5":3,"date":{"end_time":"2011/02/08 00:00:00 -0500","original":"2/7/2011","granularity":"day","time":"2011/02/07 00:00:00 -0500"},"longitude":-83.359623,"id":"adv9lsxldpzi","location":"Playa Sandolo"},"type":"Feature","geometry":{"type":"Point","coordinates":[-83.359623,8.5752925]}},{"properties":{"latitude":9.1871755,"column_5":3,"date":{"end_time":"2011/12/12 00:00:00 -0500","original":"12/11/2011","granularity":"day","time":"2011/12/11 00:00:00 -0500"},"longitude":-79.4185352,"id":"adv9lss5aqnw","location":"Cerro Azul"},"type":"Feature","geometry":{"type":"Point","coordinates":[-79.4185352,9.1871755]}},{"properties":{"latitude":9.119788,"column_5":3,"date":{"end_time":"2011/12/18 00:00:00 -0500","original":"12/17/2011","granularity":"day","time":"2011/12/17 00:00:00 -0500"},"longitude":-79.713007,"id":"adv9lt53aoz8","location":"Ammo Dump Ponds"},"type":"Feature","geometry":{"type":"Point","coordinates":[-79.713007,9.119788]}},{"properties":{"latitude":40.1503634,"column_5":3,"date":{"end_time":"2012/01/07 00:00:00 -0500","original":"1/6/2012","granularity":"day","time":"2012/01/06 00:00:00 -0500"},"longitude":26.4026354,"id":"adv9lsxji9z4","location":"TR: Canakkale"},"type":"Feature","geometry":{"type":"Point","coordinates":[26.4026354,40.1503634]}},{"properties":{"latitude":61.1741577,"column_5":3,"date":{"end_time":"2012/02/12 00:00:00 -0500","original":"2/11/2012","granularity":"day","time":"2012/02/11 00:00:00 -0500"},"longitude":-150.034183,"id":"adv9lt13cvrh","location":"AK: Anchorage--Clitheroe Center"},"type":"Feature","geometry":{"type":"Point","coordinates":[-150.034183,61.1741577]}},{"properties":{"latitude":60.9909475,"column_5":3,"date":{"end_time":"2012/11/26 00:00:00 -0500","original":"11/25/2012","granularity":"day","time":"2012/11/25 00:00:00 -0500"},"longitude":-149.5183077,"id":"adv9lsy7c2an","location":"Anchorage--Indian (Seward Hwy. MP A23.4)"},"type":"Feature","geometry":{"type":"Point","coordinates":[-149.5183077,60.9909475]}},{"properties":{"latitude":61.1404183,"column_5":3,"date":{"end_time":"2013/01/08 00:00:00 -0500","original":"1/7/2013","granularity":"day","time":"2013/01/07 00:00:00 -0500"},"longitude":-149.7570419,"id":"adv9lswjglit","location":"Anchorage--Hillside Park"},"type":"Feature","geometry":{"type":"Point","coordinates":[-149.7570419,61.1404183]}},{"properties":{"latitude":18.3562261,"column_5":3,"date":{"end_time":"2013/01/20 00:00:00 -0500","original":"1/19/2013","granularity":"day","time":"2013/01/19 00:00:00 -0500"},"longitude":-77.6468128,"id":"adv9lswshdii","location":"Windsor Research Station"},"type":"Feature","geometry":{"type":"Point","coordinates":[-77.6468128,18.3562261]}},{"properties":{"latitude":61.548467,"column_5":3,"date":{"end_time":"2013/04/11 00:00:00 -0400","original":"4/10/2013","granularity":"day","time":"2013/04/10 00:00:00 -0400"},"longitude":-149.229269,"id":"adv9lt4qv224","location":"Palmer--Old Matanuska Townsite"},"type":"Feature","geometry":{"type":"Point","coordinates":[-149.229269,61.548467]}},{"properties":{"latitude":28.2824635,"column_5":2,"date":{"end_time":"1994/12/31 00:00:00 -0500","original":"12/30/1994","granularity":"day","time":"1994/12/30 00:00:00 -0500"},"longitude":-96.810751,"id":"adv9lt0am863","location":"Aransas NWR (CTC 037)  (Aransas Co.)"},"type":"Feature","geometry":{"type":"Point","coordinates":[-96.810751,28.2824635]}},{"properties":{"latitude":38.99725,"column_5":2,"date":{"end_time":"1997/05/11 00:00:00 -0400","original":"5/10/1997","granularity":"day","time":"1997/05/10 00:00:00 -0400"},"longitude":-90.73842,"id":"adv9lt6spi1v","location":"Winfield"},"type":"Feature","geometry":{"type":"Point","coordinates":[-90.73842,38.99725]}},{"properties":{"latitude":26.4553,"column_5":2,"date":{"end_time":"1997/12/29 00:00:00 -0500","original":"12/28/1997","granularity":"day","time":"1997/12/28 00:00:00 -0500"},"longitude":-80.3185,"id":"adv9lsvit2t4","location":"Loxahatchee NWR"},"type":"Feature","geometry":{"type":"Point","coordinates":[-80.3185,26.4553]}},{"properties":{"latitude":39.7509986,"column_5":2,"date":{"end_time":"1998/04/11 00:00:00 -0400","original":"4/10/1998","granularity":"day","time":"1998/04/10 00:00:00 -0400"},"longitude":-93.2301081,"id":"adv9lt15e5k4","location":"Pershing SP"},"type":"Feature","geometry":{"type":"Point","coordinates":[-93.2301081,39.7509986]}},{"properties":{"latitude":31.9539069,"column_5":2,"date":{"end_time":"1998/06/03 00:00:00 -0400","original":"6/2/1998","granularity":"day","time":"1998/06/02 00:00:00 -0400"},"longitude":-112.7996361,"id":"adv9lsrky0b5","location":"Organ Pipe Cactus NM"},"type":"Feature","geometry":{"type":"Point","coordinates":[-112.7996361,31.9539069]}},{"properties":{"latitude":32.3264152,"column_5":2,"date":{"end_time":"1998/06/06 00:00:00 -0400","original":"6/5/1998","granularity":"day","time":"1998/06/05 00:00:00 -0400"},"longitude":-110.7003665,"id":"adv9lsunpulm","location":"Mt. Lemmon--Molino Canyon Vista"},"type":"Feature","geometry":{"type":"Point","coordinates":[-110.7003665,32.3264152]}},{"properties":{"latitude":29.3735739,"column_5":2,"date":{"end_time":"1998/12/30 00:00:00 -0500","original":"12/29/1998","granularity":"day","time":"1998/12/29 00:00:00 -0500"},"longitude":-95.6230259,"id":"adv9lt12x0za","location":"Brazos Bend SP (UTC 117)"},"type":"Feature","geometry":{"type":"Point","coordinates":[-95.6230259,29.3735739]}},{"properties":{"latitude":46.5803962,"column_5":2,"date":{"end_time":"1999/07/03 00:00:00 -0400","original":"7/2/1999","granularity":"day","time":"1999/07/02 00:00:00 -0400"},"longitude":-86.282854,"id":"adv9lt1495lw","location":"Pictured Rocks National Lakeshore"},"type":"Feature","geometry":{"type":"Point","coordinates":[-86.282854,46.5803962]}},{"properties":{"latitude":31.8835432,"column_5":2,"date":{"end_time":"1999/07/24 00:00:00 -0400","original":"7/23/1999","granularity":"day","time":"1999/07/23 00:00:00 -0400"},"longitude":-109.2058731,"id":"adv9lswdssqw","location":"Cave Creek Canyon--Southwestern Research Station"},"type":"Feature","geometry":{"type":"Point","coordinates":[-109.2058731,31.8835432]}},{"properties":{"latitude":31.9307003,"column_5":2,"date":{"end_time":"1999/07/25 00:00:00 -0400","original":"7/24/1999","granularity":"day","time":"1999/07/24 00:00:00 -0400"},"longitude":-109.1744537,"id":"adv9lssr9y0f","location":"Portal-Paradise Road"},"type":"Feature","geometry":{"type":"Point","coordinates":[-109.1744537,31.9307003]}},{"properties":{"latitude":31.8908005,"column_5":2,"date":{"end_time":"1999/07/25 00:00:00 -0400","original":"7/24/1999","granularity":"day","time":"1999/07/24 00:00:00 -0400"},"longitude":-109.1679001,"id":"adv9lsveyw67","location":"Cave Creek Canyon"},"type":"Feature","geometry":{"type":"Point","coordinates":[-109.1679001,31.8908005]}},{"properties":{"latitude":31.8724995,"column_5":2,"date":{"end_time":"1999/07/26 00:00:00 -0400","original":"7/25/1999","granularity":"day","time":"1999/07/25 00:00:00 -0400"},"longitude":-109.2335968,"id":"adv9lswnrbci","location":"Cave Creek Canyon--Herb Martyr CG"},"type":"Feature","geometry":{"type":"Point","coordinates":[-109.2335968,31.8724995]}},{"properties":{"latitude":31.9172001,"column_5":2,"date":{"end_time":"1999/07/27 00:00:00 -0400","original":"7/26/1999","granularity":"day","time":"1999/07/26 00:00:00 -0400"},"longitude":-109.2790985,"id":"adv9lsqr95mr","location":"Barfoot Park"},"type":"Feature","geometry":{"type":"Point","coordinates":[-109.2790985,31.9172001]}},{"properties":{"latitude":10.3023369,"column_5":2,"date":{"end_time":"2000/02/21 00:00:00 -0500","original":"2/20/2000","granularity":"day","time":"2000/02/20 00:00:00 -0500"},"longitude":-84.7953129,"id":"adv9lsx0um8j","location":"CR: Monteverde Cloud Forest Reserve"},"type":"Feature","geometry":{"type":"Point","coordinates":[-84.7953129,10.3023369]}},{"properties":{"latitude":38.4851729,"column_5":2,"date":{"end_time":"2000/05/23 00:00:00 -0400","original":"5/22/2000","granularity":"day","time":"2000/05/22 00:00:00 -0400"},"longitude":-98.654995,"id":"adv9lt3q9t1y","location":"Cheyenne Bottoms SWA"},"type":"Feature","geometry":{"type":"Point","coordinates":[-98.654995,38.4851729]}},{"properties":{"latitude":48.15347,"column_5":2,"date":{"end_time":"2001/07/01 00:00:00 -0400","original":"6/30/2001","granularity":"day","time":"2001/06/30 00:00:00 -0400"},"longitude":-123.17553,"id":"adv9lswknjvk","location":"Dungeness NWR--Harbor side"},"type":"Feature","geometry":{"type":"Point","coordinates":[-123.17553,48.15347]}},{"properties":{"latitude":46.9166667,"column_5":2,"date":{"end_time":"2001/07/06 00:00:00 -0400","original":"7/5/2001","granularity":"day","time":"2001/07/05 00:00:00 -0400"},"longitude":-119.25,"id":"adv9lt26lq7z","location":"Columbia NWR (Adams Co.)"},"type":"Feature","geometry":{"type":"Point","coordinates":[-119.25,46.9166667]}},{"properties":{"latitude":40.429675,"column_5":2,"date":{"end_time":"2002/09/14 00:00:00 -0400","original":"9/13/2002","granularity":"day","time":"2002/09/13 00:00:00 -0400"},"longitude":-91.5547167,"id":"adv9lt73rxto","location":"Iliniwek Village SHS"},"type":"Feature","geometry":{"type":"Point","coordinates":[-91.5547167,40.429675]}},{"properties":{"latitude":40.5926379,"column_5":2,"date":{"end_time":"2002/09/16 00:00:00 -0400","original":"9/15/2002","granularity":"day","time":"2002/09/15 00:00:00 -0400"},"longitude":-91.7136423,"id":"adv9lt21ytxe","location":"Battle of Athens SHS"},"type":"Feature","geometry":{"type":"Point","coordinates":[-91.7136423,40.5926379]}},{"properties":{"latitude":44.3403645,"column_5":2,"date":{"end_time":"2003/06/26 00:00:00 -0400","original":"6/25/2003","granularity":"day","time":"2003/06/25 00:00:00 -0400"},"longitude":-68.2512397,"id":"adv9lt57ht4y","location":"Acadia NP"},"type":"Feature","geometry":{"type":"Point","coordinates":[-68.2512397,44.3403645]}},{"properties":{"latitude":39.4762365,"column_5":2,"date":{"end_time":"2004/06/09 00:00:00 -0400","original":"6/8/2004","granularity":"day","time":"2004/06/08 00:00:00 -0400"},"longitude":-91.8107324,"id":"adv9lsvdusvl","location":"Mark Twain Lake and SP"},"type":"Feature","geometry":{"type":"Point","coordinates":[-91.8107324,39.4762365]}},{"properties":{"latitude":60.7740425,"column_5":2,"date":{"end_time":"2004/06/27 00:00:00 -0400","original":"6/26/2004","granularity":"day","time":"2004/06/26 00:00:00 -0400"},"longitude":-148.8268568,"id":"adv9lstdoayr","location":"Portage Lake (Anchorage Muni.)"},"type":"Feature","geometry":{"type":"Point","coordinates":[-148.8268568,60.7740425]}},{"properties":{"latitude":34.9658735,"column_5":2,"date":{"end_time":"2004/08/17 00:00:00 -0400","original":"8/16/2004","granularity":"day","time":"2004/08/16 00:00:00 -0400"},"longitude":-101.6720295,"id":"adv9lsz6ytk1","location":"Palo Duro Canyon  SP (PHP 040)"},"type":"Feature","geometry":{"type":"Point","coordinates":[-101.6720295,34.9658735]}},{"properties":{"latitude":31.5394897,"column_5":2,"date":{"end_time":"2004/10/18 00:00:00 -0400","original":"10/17/2004","granularity":"day","time":"2004/10/17 00:00:00 -0400"},"longitude":-110.7566376,"id":"adv9lt6t5dj4","location":"Patagonia"},"type":"Feature","geometry":{"type":"Point","coordinates":[-110.7566376,31.5394897]}},{"properties":{"latitude":31.8865151,"column_5":2,"date":{"end_time":"2004/10/18 00:00:00 -0400","original":"10/17/2004","granularity":"day","time":"2004/10/17 00:00:00 -0400"},"longitude":-110.9685629,"id":"adv9lt37by5m","location":"Continental Maintenance Yard"},"type":"Feature","geometry":{"type":"Point","coordinates":[-110.9685629,31.8865151]}},{"properties":{"latitude":32.9051389,"column_5":2,"date":{"end_time":"2005/04/03 00:00:00 -0500","original":"4/2/2005","granularity":"day","time":"2005/04/02 00:00:00 -0500"},"longitude":-110.5633593,"id":"adv9lsy87vi6","location":"Aravaipa Canyon--west"},"type":"Feature","geometry":{"type":"Point","coordinates":[-110.5633593,32.9051389]}},{"properties":{"latitude":30.235563,"column_5":2,"date":{"end_time":"2005/05/17 00:00:00 -0400","original":"5/16/2005","granularity":"day","time":"2005/05/16 00:00:00 -0400"},"longitude":-95.4852676,"id":"adv9lsxrwi6z","location":"W.G. Jones State Forest (UTC 036)"},"type":"Feature","geometry":{"type":"Point","coordinates":[-95.4852676,30.235563]}},{"properties":{"latitude":39.1818693,"column_5":2,"date":{"end_time":"2005/06/02 00:00:00 -0400","original":"6/1/2005","granularity":"day","time":"2005/06/01 00:00:00 -0400"},"longitude":-91.0128679,"id":"adv9lt08uc1j","location":"White Memorial WA"},"type":"Feature","geometry":{"type":"Point","coordinates":[-91.0128679,39.1818693]}},{"properties":{"latitude":48.5353194,"column_5":2,"date":{"end_time":"2005/06/16 00:00:00 -0400","original":"6/15/2005","granularity":"day","time":"2005/06/15 00:00:00 -0400"},"longitude":-115.2570417,"id":"adv9lt6s2myt","location":"Lake Koocanusa"},"type":"Feature","geometry":{"type":"Point","coordinates":[-115.2570417,48.5353194]}},{"properties":{"latitude":48.2545139,"column_5":2,"date":{"end_time":"2005/06/17 00:00:00 -0400","original":"6/16/2005","granularity":"day","time":"2005/06/16 00:00:00 -0400"},"longitude":-115.8531667,"id":"adv9lt4xj9f0","location":"MT: Libby--Bull Lake"},"type":"Feature","geometry":{"type":"Point","coordinates":[-115.8531667,48.2545139]}},{"properties":{"latitude":32.7015857,"column_5":2,"date":{"end_time":"2005/07/15 00:00:00 -0400","original":"7/14/2005","granularity":"day","time":"2005/07/14 00:00:00 -0400"},"longitude":-109.8713923,"id":"adv9lt3i22q8","location":"Mt. Graham"},"type":"Feature","geometry":{"type":"Point","coordinates":[-109.8713923,32.7015857]}},{"properties":{"latitude":32.8526001,"column_5":2,"date":{"end_time":"2005/08/28 00:00:00 -0400","original":"8/27/2005","granularity":"day","time":"2005/08/27 00:00:00 -0400"},"longitude":-111.4804001,"id":"adv9lsv4kmos","location":"Picacho Reservoir"},"type":"Feature","geometry":{"type":"Point","coordinates":[-111.4804001,32.8526001]}},{"properties":{"latitude":32.2335526,"column_5":2,"date":{"end_time":"2005/09/17 00:00:00 -0400","original":"9/16/2005","granularity":"day","time":"2005/09/16 00:00:00 -0400"},"longitude":-111.0234348,"id":"adv9lswec5jd","location":"Greasewood Park"},"type":"Feature","geometry":{"type":"Point","coordinates":[-111.0234348,32.2335526]}},{"properties":{"latitude":32.0575981,"column_5":2,"date":{"end_time":"2005/10/30 00:00:00 -0400","original":"10/29/2005","granularity":"day","time":"2005/10/29 00:00:00 -0400"},"longitude":-109.762548,"id":"adv9lstz8pe8","location":"Kansas Settlement Rd"},"type":"Feature","geometry":{"type":"Point","coordinates":[-109.762548,32.0575981]}},{"properties":{"latitude":32.613,"column_5":2,"date":{"end_time":"2005/10/31 00:00:00 -0500","original":"10/30/2005","granularity":"day","time":"2005/10/30 00:00:00 -0400"},"longitude":-111.638,"id":"adv9lt08d8qd","location":"Western Sod Farm"},"type":"Feature","geometry":{"type":"Point","coordinates":[-111.638,32.613]}},{"properties":{"latitude":40.2557462,"column_5":2,"date":{"end_time":"2005/12/28 00:00:00 -0500","original":"12/27/2005","granularity":"day","time":"2005/12/27 00:00:00 -0500"},"longitude":-92.146874,"id":"adv9lt710l6o","location":"North Sever Lake"},"type":"Feature","geometry":{"type":"Point","coordinates":[-92.146874,40.2557462]}},{"properties":{"latitude":33.2795082,"column_5":2,"date":{"end_time":"2006/01/22 00:00:00 -0500","original":"1/21/2006","granularity":"day","time":"2006/01/21 00:00:00 -0500"},"longitude":-111.158756,"id":"adv9lt3ula1p","location":"Boyce Thompson Arboretum SP"},"type":"Feature","geometry":{"type":"Point","coordinates":[-111.158756,33.2795082]}},{"properties":{"latitude":31.5302935,"column_5":2,"date":{"end_time":"2006/01/30 00:00:00 -0500","original":"1/29/2006","granularity":"day","time":"2006/01/29 00:00:00 -0500"},"longitude":-111.2521748,"id":"adv9lsx22cdi","location":"Arivaca Lake"},"type":"Feature","geometry":{"type":"Point","coordinates":[-111.2521748,31.5302935]}},{"properties":{"latitude":31.572,"column_5":2,"date":{"end_time":"2006/01/30 00:00:00 -0500","original":"1/29/2006","granularity":"day","time":"2006/01/29 00:00:00 -0500"},"longitude":-111.3244,"id":"adv9lsxtiujk","location":"Buenos Aires NWR--Arivaca Cienega"},"type":"Feature","geometry":{"type":"Point","coordinates":[-111.3244,31.572]}},{"properties":{"latitude":31.5860821,"column_5":2,"date":{"end_time":"2006/01/30 00:00:00 -0500","original":"1/29/2006","granularity":"day","time":"2006/01/29 00:00:00 -0500"},"longitude":-111.3521013,"id":"adv9lt0set0r","location":"Buenos Aires NWR--Arivaca Creek"},"type":"Feature","geometry":{"type":"Point","coordinates":[-111.3521013,31.5860821]}},{"properties":{"latitude":32.4635648,"column_5":2,"date":{"end_time":"2006/01/31 00:00:00 -0500","original":"1/30/2006","granularity":"day","time":"2006/01/30 00:00:00 -0500"},"longitude":-110.9018976,"id":"adv9lsudsgsz","location":"Catalina Regional Park--pond"},"type":"Feature","geometry":{"type":"Point","coordinates":[-110.9018976,32.4635648]}},{"properties":{"latitude":32.3103,"column_5":2,"date":{"end_time":"2006/02/05 00:00:00 -0500","original":"2/4/2006","granularity":"day","time":"2006/02/04 00:00:00 -0500"},"longitude":-110.5689,"id":"adv9lsscbcxl","location":"Redington Pass"},"type":"Feature","geometry":{"type":"Point","coordinates":[-110.5689,32.3103]}},{"properties":{"latitude":31.4290009,"column_5":2,"date":{"end_time":"2006/02/19 00:00:00 -0500","original":"2/18/2006","granularity":"day","time":"2006/02/18 00:00:00 -0500"},"longitude":-111.1905975,"id":"adv9lt3o4vrb","location":"Sycamore Canyon (Santa Cruz Co.)"},"type":"Feature","geometry":{"type":"Point","coordinates":[-111.1905975,31.4290009]}},{"properties":{"latitude":31.733668,"column_5":2,"date":{"end_time":"2006/03/05 00:00:00 -0500","original":"3/4/2006","granularity":"day","time":"2006/03/04 00:00:00 -0500"},"longitude":-110.882269,"id":"adv9lt2bounp","location":"Madera Canyon--Whitehouse Picnic area"},"type":"Feature","geometry":{"type":"Point","coordinates":[-110.882269,31.733668]}},{"properties":{"latitude":39.0496046,"column_5":2,"date":{"end_time":"2006/03/15 00:00:00 -0500","original":"3/14/2006","granularity":"day","time":"2006/03/14 00:00:00 -0500"},"longitude":-90.7180465,"id":"adv9lsss30az","location":"Foley River Access"},"type":"Feature","geometry":{"type":"Point","coordinates":[-90.7180465,39.0496046]}},{"properties":{"latitude":32.0860639,"column_5":2,"date":{"end_time":"2006/04/16 00:00:00 -0400","original":"4/15/2006","granularity":"day","time":"2006/04/15 00:00:00 -0400"},"longitude":-111.3423083,"id":"adv9lsuci7f1","location":"Three Points--El Mesquital Restaurant"},"type":"Feature","geometry":{"type":"Point","coordinates":[-111.3423083,32.0860639]}},{"properties":{"latitude":33.261167,"column_5":2,"date":{"end_time":"2006/05/05 00:00:00 -0400","original":"5/4/2006","granularity":"day","time":"2006/05/04 00:00:00 -0400"},"longitude":-110.7755891,"id":"adv9lt6bnajk","location":"AZ: Hwy. 77--MP 162"},"type":"Feature","geometry":{"type":"Point","coordinates":[-110.7755891,33.261167]}},{"properties":{"latitude":33.309,"column_5":2,"date":{"end_time":"2006/05/05 00:00:00 -0400","original":"5/4/2006","granularity":"day","time":"2006/05/04 00:00:00 -0400"},"longitude":-111.054,"id":"adv9lt6y5o7m","location":"Oak Flat CG"},"type":"Feature","geometry":{"type":"Point","coordinates":[-111.054,33.309]}},{"properties":{"latitude":38.45005,"column_5":2,"date":{"end_time":"2006/05/20 00:00:00 -0400","original":"5/19/2006","granularity":"day","time":"2006/05/19 00:00:00 -0400"},"longitude":-91.00844,"id":"adv9lsyhbmfy","location":"Union"},"type":"Feature","geometry":{"type":"Point","coordinates":[-91.00844,38.45005]}},{"properties":{"latitude":38.9172,"column_5":2,"date":{"end_time":"2006/05/24 00:00:00 -0400","original":"5/23/2006","granularity":"day","time":"2006/05/23 00:00:00 -0400"},"longitude":-97.2139,"id":"adv9lt539xu0","location":"Abilene"},"type":"Feature","geometry":{"type":"Point","coordinates":[-97.2139,38.9172]}},{"properties":{"latitude":40.7146442,"column_5":2,"date":{"end_time":"2006/05/25 00:00:00 -0400","original":"5/24/2006","granularity":"day","time":"2006/05/24 00:00:00 -0400"},"longitude":-105.7329319,"id":"adv9lsvb5g0q","location":"CO: Hwy. 14--Ft. Collins to Cameron Pass"},"type":"Feature","geometry":{"type":"Point","coordinates":[-105.7329319,40.7146442]}},{"properties":{"latitude":39.3394,"column_5":2,"date":{"end_time":"2006/05/25 00:00:00 -0400","original":"5/24/2006","granularity":"day","time":"2006/05/24 00:00:00 -0400"},"longitude":-101.88946,"id":"adv9lt2olhpv","location":"Ruleton"},"type":"Feature","geometry":{"type":"Point","coordinates":[-101.88946,39.3394]}},{"properties":{"latitude":31.7012861,"column_5":2,"date":{"end_time":"2006/07/05 00:00:00 -0400","original":"7/4/2006","granularity":"day","time":"2006/07/04 00:00:00 -0400"},"longitude":-111.0467833,"id":"adv9lsxhwd61","location":"AZ: Santa Cruz River--Rex Ranch Resort"},"type":"Feature","geometry":{"type":"Point","coordinates":[-111.0467833,31.7012861]}},{"properties":{"latitude":37.64564,"column_5":2,"date":{"end_time":"2006/07/25 00:00:00 -0400","original":"7/24/2006","granularity":"day","time":"2006/07/24 00:00:00 -0400"},"longitude":-91.53595,"id":"adv9lsuyvelc","location":"Salem"},"type":"Feature","geometry":{"type":"Point","coordinates":[-91.53595,37.64564]}},{"properties":{"latitude":37.2807206,"column_5":2,"date":{"end_time":"2006/07/26 00:00:00 -0400","original":"7/25/2006","granularity":"day","time":"2006/07/25 00:00:00 -0400"},"longitude":-91.4085511,"id":"adv9lsw9pf37","location":"Ozark National Scenic Riverways--Round Spring"},"type":"Feature","geometry":{"type":"Point","coordinates":[-91.4085511,37.2807206]}},{"properties":{"latitude":37.98335,"column_5":2,"date":{"end_time":"2006/07/29 00:00:00 -0400","original":"7/28/2006","granularity":"day","time":"2006/07/28 00:00:00 -0400"},"longitude":-90.05181,"id":"adv9lt76oucn","location":"Sainte Genevieve"},"type":"Feature","geometry":{"type":"Point","coordinates":[-90.05181,37.98335]}},{"properties":{"latitude":37.0859163,"column_5":2,"date":{"end_time":"2006/07/29 00:00:00 -0400","original":"7/28/2006","granularity":"day","time":"2006/07/28 00:00:00 -0400"},"longitude":-89.5199148,"id":"adv9lt3cp64i","location":"MO: Sikeston Heronry 2006"},"type":"Feature","geometry":{"type":"Point","coordinates":[-89.5199148,37.0859163]}},{"properties":{"latitude":36.7108364,"column_5":2,"date":{"end_time":"2006/07/30 00:00:00 -0400","original":"7/29/2006","granularity":"day","time":"2006/07/29 00:00:00 -0400"},"longitude":-89.3362771,"id":"adv9lt5gl3tu","location":"Ten Mile Pond CA"},"type":"Feature","geometry":{"type":"Point","coordinates":[-89.3362771,36.7108364]}},{"properties":{"latitude":36.9477654,"column_5":2,"date":{"end_time":"2006/07/30 00:00:00 -0400","original":"7/29/2006","granularity":"day","time":"2006/07/29 00:00:00 -0400"},"longitude":-90.3265858,"id":"adv9lss82yy3","location":"Lake Wappapello SP"},"type":"Feature","geometry":{"type":"Point","coordinates":[-90.3265858,36.9477654]}},{"properties":{"latitude":36.9709345,"column_5":2,"date":{"end_time":"2006/07/30 00:00:00 -0400","original":"7/29/2006","granularity":"day","time":"2006/07/29 00:00:00 -0400"},"longitude":-90.2290768,"id":"adv9lsrhklr8","location":"Mingo NWR--Wayne Co."},"type":"Feature","geometry":{"type":"Point","coordinates":[-90.2290768,36.9709345]}},{"properties":{"latitude":36.58646,"column_5":2,"date":{"end_time":"2006/07/30 00:00:00 -0400","original":"7/29/2006","granularity":"day","time":"2006/07/29 00:00:00 -0400"},"longitude":-89.52788,"id":"adv9lsvjfk5j","location":"New Madrid"},"type":"Feature","geometry":{"type":"Point","coordinates":[-89.52788,36.58646]}},{"properties":{"latitude":36.7662614,"column_5":2,"date":{"end_time":"2006/07/30 00:00:00 -0400","original":"7/29/2006","granularity":"day","time":"2006/07/29 00:00:00 -0400"},"longitude":-90.1247195,"id":"adv9lsz2cc3r","location":"Otter Slough Rice Fields"},"type":"Feature","geometry":{"type":"Point","coordinates":[-90.1247195,36.7662614]}},{"properties":{"latitude":36.77976,"column_5":2,"date":{"end_time":"2006/07/30 00:00:00 -0400","original":"7/29/2006","granularity":"day","time":"2006/07/29 00:00:00 -0400"},"longitude":-89.38567,"id":"adv9lt627wtu","location":"East Prairie"},"type":"Feature","geometry":{"type":"Point","coordinates":[-89.38567,36.77976]}},{"properties":{"latitude":38.95174,"column_5":2,"date":{"end_time":"2006/08/05 00:00:00 -0400","original":"8/4/2006","granularity":"day","time":"2006/08/04 00:00:00 -0400"},"longitude":-92.33408,"id":"adv9lsydw93t","location":"Columbia"},"type":"Feature","geometry":{"type":"Point","coordinates":[-92.33408,38.95174]}},{"properties":{"latitude":38.8403,"column_5":2,"date":{"end_time":"2006/08/05 00:00:00 -0400","original":"8/4/2006","granularity":"day","time":"2006/08/04 00:00:00 -0400"},"longitude":-97.61141,"id":"adv9lt38b08k","location":"Salina"},"type":"Feature","geometry":{"type":"Point","coordinates":[-97.61141,38.8403]}},{"properties":{"latitude":38.87921,"column_5":2,"date":{"end_time":"2006/08/05 00:00:00 -0400","original":"8/4/2006","granularity":"day","time":"2006/08/04 00:00:00 -0400"},"longitude":-99.32678,"id":"adv9lsrd5dht","location":"Hays"},"type":"Feature","geometry":{"type":"Point","coordinates":[-99.32678,38.87921]}},{"properties":{"latitude":31.3189611,"column_5":2,"date":{"end_time":"2006/08/27 00:00:00 -0400","original":"8/26/2006","granularity":"day","time":"2006/08/26 00:00:00 -0400"},"longitude":-113.4917092,"id":"adv9lsw5njtu","location":"Puerto Penasco--New Sewage Ponds"},"type":"Feature","geometry":{"type":"Point","coordinates":[-113.4917092,31.3189611]}},{"properties":{"latitude":31.8672802,"column_5":2,"date":{"end_time":"2006/08/27 00:00:00 -0400","original":"8/26/2006","granularity":"day","time":"2006/08/26 00:00:00 -0400"},"longitude":-112.8456402,"id":"adv9lt585r3j","location":"SON: Sonoyta"},"type":"Feature","geometry":{"type":"Point","coordinates":[-112.8456402,31.8672802]}},{"properties":{"latitude":31.321115,"column_5":2,"date":{"end_time":"2006/08/27 00:00:00 -0400","original":"8/26/2006","granularity":"day","time":"2006/08/26 00:00:00 -0400"},"longitude":-113.529178,"id":"adv9lss2stcn","location":"Puerto Peasco"},"type":"Feature","geometry":{"type":"Point","coordinates":[-113.529178,31.321115]}},{"properties":{"latitude":31.3249001,"column_5":2,"date":{"end_time":"2006/08/27 00:00:00 -0400","original":"8/26/2006","granularity":"day","time":"2006/08/26 00:00:00 -0400"},"longitude":-113.5220718,"id":"adv9lt05y8ik","location":"SON: Puerto Penasco--Town"},"type":"Feature","geometry":{"type":"Point","coordinates":[-113.5220718,31.3249001]}},{"properties":{"latitude":31.316908,"column_5":2,"date":{"end_time":"2006/08/27 00:00:00 -0400","original":"8/26/2006","granularity":"day","time":"2006/08/26 00:00:00 -0400"},"longitude":-113.5050344,"id":"adv9lsvtckfj","location":"Puerto Penasco--Old Sewage Ponds"},"type":"Feature","geometry":{"type":"Point","coordinates":[-113.5050344,31.316908]}},{"properties":{"latitude":31.32694,"column_5":2,"date":{"end_time":"2006/09/03 00:00:00 -0400","original":"9/2/2006","granularity":"day","time":"2006/09/02 00:00:00 -0400"},"longitude":-109.94778,"id":"adv9lsvg6sn4","location":"Naco"},"type":"Feature","geometry":{"type":"Point","coordinates":[-109.94778,31.32694]}},{"properties":{"latitude":31.48869,"column_5":2,"date":{"end_time":"2006/09/13 00:00:00 -0400","original":"9/12/2006","granularity":"day","time":"2006/09/12 00:00:00 -0400"},"longitude":-111.54166,"id":"adv9lsz7flcc","location":"Sasabe"},"type":"Feature","geometry":{"type":"Point","coordinates":[-111.54166,31.48869]}},{"properties":{"latitude":31.90429,"column_5":2,"date":{"end_time":"2006/09/17 00:00:00 -0400","original":"9/16/2006","granularity":"day","time":"2006/09/16 00:00:00 -0400"},"longitude":-110.21463,"id":"adv9lt4je14q","location":"Saint David"},"type":"Feature","geometry":{"type":"Point","coordinates":[-110.21463,31.90429]}},{"properties":{"latitude":32.83397,"column_5":2,"date":{"end_time":"2006/10/14 00:00:00 -0400","original":"10/13/2006","granularity":"day","time":"2006/10/13 00:00:00 -0400"},"longitude":-109.70764,"id":"adv9lsz8mmod","location":"Safford"},"type":"Feature","geometry":{"type":"Point","coordinates":[-109.70764,32.83397]}},{"properties":{"latitude":32.8684138,"column_5":2,"date":{"end_time":"2006/10/15 00:00:00 -0400","original":"10/14/2006","granularity":"day","time":"2006/10/14 00:00:00 -0400"},"longitude":-109.7692966,"id":"adv9lt031yu5","location":"Thatcher--Reay Lane WTP"},"type":"Feature","geometry":{"type":"Point","coordinates":[-109.7692966,32.8684138]}},{"properties":{"latitude":33.8302806,"column_5":2,"date":{"end_time":"2006/10/15 00:00:00 -0400","original":"10/14/2006","granularity":"day","time":"2006/10/14 00:00:00 -0400"},"longitude":-109.0919481,"id":"adv9lssmb0b8","location":"Luna Lake"},"type":"Feature","geometry":{"type":"Point","coordinates":[-109.0919481,33.8302806]}},{"properties":{"latitude":33.9053821,"column_5":2,"date":{"end_time":"2006/10/15 00:00:00 -0400","original":"10/14/2006","granularity":"day","time":"2006/10/14 00:00:00 -0400"},"longitude":-109.118122,"id":"adv9lt0wz5k0","location":"Terry Flat"},"type":"Feature","geometry":{"type":"Point","coordinates":[-109.118122,33.9053821]}},{"properties":{"latitude":34.1555035,"column_5":2,"date":{"end_time":"2006/10/16 00:00:00 -0400","original":"10/15/2006","granularity":"day","time":"2006/10/15 00:00:00 -0400"},"longitude":-109.3061496,"id":"adv9lt1n8lbh","location":"Becker Lake"},"type":"Feature","geometry":{"type":"Point","coordinates":[-109.3061496,34.1555035]}},{"properties":{"latitude":34.0827203,"column_5":2,"date":{"end_time":"2006/10/16 00:00:00 -0400","original":"10/15/2006","granularity":"day","time":"2006/10/15 00:00:00 -0400"},"longitude":-109.4139009,"id":"adv9lsvki76m","location":"Little Colorado River--South Fork"},"type":"Feature","geometry":{"type":"Point","coordinates":[-109.4139009,34.0827203]}},{"properties":{"latitude":34.0155775,"column_5":2,"date":{"end_time":"2006/10/16 00:00:00 -0400","original":"10/15/2006","granularity":"day","time":"2006/10/15 00:00:00 -0400"},"longitude":-109.4519042,"id":"adv9lt0b6mxd","location":"Greer--Butler Canyon Nature Trail"},"type":"Feature","geometry":{"type":"Point","coordinates":[-109.4519042,34.0155775]}},{"properties":{"latitude":34.15002,"column_5":2,"date":{"end_time":"2006/10/21 00:00:00 -0400","original":"10/20/2006","granularity":"day","time":"2006/10/20 00:00:00 -0400"},"longitude":-114.28878,"id":"adv9lszfkk6z","location":"Parker"},"type":"Feature","geometry":{"type":"Point","coordinates":[-114.28878,34.15002]}},{"properties":{"latitude":33.66392,"column_5":2,"date":{"end_time":"2006/10/21 00:00:00 -0400","original":"10/20/2006","granularity":"day","time":"2006/10/20 00:00:00 -0400"},"longitude":-114.22978,"id":"adv9lst5blst","location":"Quartzsite"},"type":"Feature","geometry":{"type":"Point","coordinates":[-114.22978,33.66392]}},{"properties":{"latitude":33.2334404,"column_5":2,"date":{"end_time":"2006/10/21 00:00:00 -0400","original":"10/20/2006","granularity":"day","time":"2006/10/20 00:00:00 -0400"},"longitude":-112.6409567,"id":"adv9lszuu68o","location":"AZ: Buckeye--Hwy. 85"},"type":"Feature","geometry":{"type":"Point","coordinates":[-112.6409567,33.2334404]}},{"properties":{"latitude":32.94785,"column_5":2,"date":{"end_time":"2006/10/21 00:00:00 -0400","original":"10/20/2006","granularity":"day","time":"2006/10/20 00:00:00 -0400"},"longitude":-112.71672,"id":"adv9lt21p5ts","location":"Gila Bend"},"type":"Feature","geometry":{"type":"Point","coordinates":[-112.71672,32.94785]}},{"properties":{"latitude":32.75586,"column_5":2,"date":{"end_time":"2006/10/22 00:00:00 -0400","original":"10/21/2006","granularity":"day","time":"2006/10/21 00:00:00 -0400"},"longitude":-111.55468,"id":"adv9lswcchp5","location":"Eloy"},"type":"Feature","geometry":{"type":"Point","coordinates":[-111.55468,32.75586]}},{"properties":{"latitude":33.421644,"column_5":2,"date":{"end_time":"2006/10/29 00:00:00 -0400","original":"10/28/2006","granularity":"day","time":"2006/10/28 00:00:00 -0400"},"longitude":-111.9019673,"id":"adv9lsw13t4k","location":"AZ: Tempe--Cameron Creek Apartments"},"type":"Feature","geometry":{"type":"Point","coordinates":[-111.9019673,33.421644]}},{"properties":{"latitude":32.0725746,"column_5":2,"date":{"end_time":"2006/11/05 00:00:00 -0500","original":"11/4/2006","granularity":"day","time":"2006/11/04 00:00:00 -0500"},"longitude":-109.8826039,"id":"adv9lstrwifa","location":"Apache Station WA"},"type":"Feature","geometry":{"type":"Point","coordinates":[-109.8826039,32.0725746]}},{"properties":{"latitude":31.9541528,"column_5":2,"date":{"end_time":"2006/11/05 00:00:00 -0500","original":"11/4/2006","granularity":"day","time":"2006/11/04 00:00:00 -0500"},"longitude":-109.8414417,"id":"adv9lswfvd9q","location":"Sunsites Sewage Ponds"},"type":"Feature","geometry":{"type":"Point","coordinates":[-109.8414417,31.9541528]}},{"properties":{"latitude":34.2552361,"column_5":2,"date":{"end_time":"2006/11/13 00:00:00 -0500","original":"11/12/2006","granularity":"day","time":"2006/11/12 00:00:00 -0500"},"longitude":-114.1591,"id":"adv9lswiir0m","location":"AZ: Hwy. 95--Parker Dam to Parker"},"type":"Feature","geometry":{"type":"Point","coordinates":[-114.1591,34.2552361]}},{"properties":{"latitude":38.8165432,"column_5":2,"date":{"end_time":"2006/11/24 00:00:00 -0500","original":"11/23/2006","granularity":"day","time":"2006/11/23 00:00:00 -0500"},"longitude":-90.1197445,"id":"adv9lt4utn5a","location":"Confluence Point SP"},"type":"Feature","geometry":{"type":"Point","coordinates":[-90.1197445,38.8165432]}},{"properties":{"latitude":38.94785,"column_5":2,"date":{"end_time":"2006/11/25 00:00:00 -0500","original":"11/24/2006","granularity":"day","time":"2006/11/24 00:00:00 -0500"},"longitude":-90.91824,"id":"adv9lsyqc9zt","location":"Moscow Mills"},"type":"Feature","geometry":{"type":"Point","coordinates":[-90.91824,38.94785]}},{"properties":{"latitude":39.7563593,"column_5":2,"date":{"end_time":"2006/11/26 00:00:00 -0500","original":"11/25/2006","granularity":"day","time":"2006/11/25 00:00:00 -0500"},"longitude":-92.5144121,"id":"adv9lsynzjz4","location":"Long Branch Lake and SP"},"type":"Feature","geometry":{"type":"Point","coordinates":[-92.5144121,39.7563593]}},{"properties":{"latitude":33.3624704,"column_5":2,"date":{"end_time":"2006/12/12 00:00:00 -0500","original":"12/11/2006","granularity":"day","time":"2006/12/11 00:00:00 -0500"},"longitude":-112.6889563,"id":"adv9lsv57q3k","location":"Lower River Road Ponds"},"type":"Feature","geometry":{"type":"Point","coordinates":[-112.6889563,33.3624704]}},{"properties":{"latitude":33.2293472,"column_5":2,"date":{"end_time":"2006/12/12 00:00:00 -0500","original":"12/11/2006","granularity":"day","time":"2006/12/11 00:00:00 -0500"},"longitude":-112.7673075,"id":"adv9lsvh6ga4","location":"Gillespie Dam (restricted access)"},"type":"Feature","geometry":{"type":"Point","coordinates":[-112.7673075,33.2293472]}},{"properties":{"latitude":39.1234019,"column_5":2,"date":{"end_time":"2006/12/27 00:00:00 -0500","original":"12/26/2006","granularity":"day","time":"2006/12/26 00:00:00 -0500"},"longitude":-90.6769466,"id":"adv9lt1iejkx","location":"IL: Two Rivers NWR--Gilead"},"type":"Feature","geometry":{"type":"Point","coordinates":[-90.6769466,39.1234019]}},{"properties":{"latitude":32.0034178,"column_5":2,"date":{"end_time":"2007/01/10 00:00:00 -0500","original":"1/9/2007","granularity":"day","time":"2007/01/09 00:00:00 -0500"},"longitude":-109.2183924,"id":"adv9lsuczgxh","location":"East Whitetail Canyon"},"type":"Feature","geometry":{"type":"Point","coordinates":[-109.2183924,32.0034178]}},{"properties":{"latitude":32.4896011,"column_5":2,"date":{"end_time":"2007/01/11 00:00:00 -0500","original":"1/10/2007","granularity":"day","time":"2007/01/10 00:00:00 -0500"},"longitude":-111.3182983,"id":"adv9lt59kw2y","location":"Marana Pecan Grove"},"type":"Feature","geometry":{"type":"Point","coordinates":[-111.3182983,32.4896011]}},{"properties":{"latitude":31.6714585,"column_5":2,"date":{"end_time":"2007/01/16 00:00:00 -0500","original":"1/15/2007","granularity":"day","time":"2007/01/15 00:00:00 -0500"},"longitude":-110.941082,"id":"adv9lsw7zjob","location":"Montosa Canyon"},"type":"Feature","geometry":{"type":"Point","coordinates":[-110.941082,31.6714585]}},{"properties":{"latitude":33.1833931,"column_5":2,"date":{"end_time":"2007/01/22 00:00:00 -0500","original":"1/21/2007","granularity":"day","time":"2007/01/21 00:00:00 -0500"},"longitude":-110.5140495,"id":"adv9lsvsdh2f","location":"San Carlos Lake (Gila Co.)"},"type":"Feature","geometry":{"type":"Point","coordinates":[-110.5140495,33.1833931]}},{"properties":{"latitude":33.31036,"column_5":2,"date":{"end_time":"2007/01/22 00:00:00 -0500","original":"1/21/2007","granularity":"day","time":"2007/01/21 00:00:00 -0500"},"longitude":-110.45565,"id":"adv9lswz8a2n","location":"Peridot"},"type":"Feature","geometry":{"type":"Point","coordinates":[-110.45565,33.31036]}},{"properties":{"latitude":33.1809507,"column_5":2,"date":{"end_time":"2007/01/22 00:00:00 -0500","original":"1/21/2007","granularity":"day","time":"2007/01/21 00:00:00 -0500"},"longitude":-110.467186,"id":"adv9lstlz09h","location":"San Carlos Lake (Pinal Co.)"},"type":"Feature","geometry":{"type":"Point","coordinates":[-110.467186,33.1809507]}},{"properties":{"latitude":31.7310142,"column_5":2,"date":{"end_time":"2007/02/12 00:00:00 -0500","original":"2/11/2007","granularity":"day","time":"2007/02/11 00:00:00 -0500"},"longitude":-110.881319,"id":"adv9lsswhtrk","location":"Madera Canyon--Pima Co."},"type":"Feature","geometry":{"type":"Point","coordinates":[-110.881319,31.7310142]}},{"properties":{"latitude":31.4482,"column_5":2,"date":{"end_time":"2007/02/15 00:00:00 -0500","original":"2/14/2007","granularity":"day","time":"2007/02/14 00:00:00 -0500"},"longitude":-109.92863,"id":"adv9lt4rd0oa","location":"Bisbee"},"type":"Feature","geometry":{"type":"Point","coordinates":[-109.92863,31.4482]}},{"properties":{"latitude":31.4736757,"column_5":2,"date":{"end_time":"2007/02/15 00:00:00 -0500","original":"2/14/2007","granularity":"day","time":"2007/02/14 00:00:00 -0500"},"longitude":-109.9745232,"id":"adv9lsu3gmpk","location":"Banning Creek Field Station (historical)"},"type":"Feature","geometry":{"type":"Point","coordinates":[-109.9745232,31.4736757]}},{"properties":{"latitude":31.4661537,"column_5":2,"date":{"end_time":"2007/03/04 00:00:00 -0500","original":"3/3/2007","granularity":"day","time":"2007/03/03 00:00:00 -0500"},"longitude":-110.7364368,"id":"adv9lsrog9y4","location":"Humboldt Canyon"},"type":"Feature","geometry":{"type":"Point","coordinates":[-110.7364368,31.4661537]}},{"properties":{"latitude":33.61032,"column_5":2,"date":{"end_time":"2007/03/12 00:00:00 -0400","original":"3/11/2007","granularity":"day","time":"2007/03/11 00:00:00 -0500"},"longitude":-114.59679,"id":"adv9lsz6hv2t","location":"Blythe"},"type":"Feature","geometry":{"type":"Point","coordinates":[-114.59679,33.61032]}},{"properties":{"latitude":33.9903418,"column_5":2,"date":{"end_time":"2007/03/13 00:00:00 -0400","original":"3/12/2007","granularity":"day","time":"2007/03/12 00:00:00 -0400"},"longitude":-116.0914993,"id":"adv9lsxigsxq","location":"Joshua Tree NP"},"type":"Feature","geometry":{"type":"Point","coordinates":[-116.0914993,33.9903418]}},{"properties":{"latitude":33.1965376,"column_5":2,"date":{"end_time":"2007/03/14 00:00:00 -0400","original":"3/13/2007","granularity":"day","time":"2007/03/13 00:00:00 -0400"},"longitude":-115.6128216,"id":"adv9lt75fjvm","location":"Salton Sea--Red Hill area"},"type":"Feature","geometry":{"type":"Point","coordinates":[-115.6128216,33.1965376]}},{"properties":{"latitude":33.1722397,"column_5":2,"date":{"end_time":"2007/03/14 00:00:00 -0400","original":"3/13/2007","granularity":"day","time":"2007/03/13 00:00:00 -0400"},"longitude":-115.6427077,"id":"adv9lt0kw8y5","location":"Salton Sea--Obsidian Butte"},"type":"Feature","geometry":{"type":"Point","coordinates":[-115.6427077,33.1722397]}},{"properties":{"latitude":33.12564,"column_5":2,"date":{"end_time":"2007/03/14 00:00:00 -0400","original":"3/13/2007","granularity":"day","time":"2007/03/13 00:00:00 -0400"},"longitude":-115.51382,"id":"adv9lt22qxg6","location":"Calipatria"},"type":"Feature","geometry":{"type":"Point","coordinates":[-115.51382,33.12564]}},{"properties":{"latitude":33.0826963,"column_5":2,"date":{"end_time":"2007/03/15 00:00:00 -0400","original":"3/14/2007","granularity":"day","time":"2007/03/14 00:00:00 -0400"},"longitude":-115.7097244,"id":"adv9lt74rr3q","location":"Salton Sea NWR--Unit 1"},"type":"Feature","geometry":{"type":"Point","coordinates":[-115.7097244,33.0826963]}},{"properties":{"latitude":33.2480745,"column_5":2,"date":{"end_time":"2007/03/15 00:00:00 -0400","original":"3/14/2007","granularity":"day","time":"2007/03/14 00:00:00 -0400"},"longitude":-116.3119898,"id":"adv9lszbke67","location":"Borrego Valley"},"type":"Feature","geometry":{"type":"Point","coordinates":[-116.3119898,33.2480745]}},{"properties":{"latitude":33.2082972,"column_5":2,"date":{"end_time":"2007/03/17 00:00:00 -0400","original":"3/16/2007","granularity":"day","time":"2007/03/16 00:00:00 -0400"},"longitude":-117.3980334,"id":"adv9lss82yxd","location":"Oceanside Harbor"},"type":"Feature","geometry":{"type":"Point","coordinates":[-117.3980334,33.2082972]}},{"properties":{"latitude":27.9531649,"column_5":2,"date":{"end_time":"2007/04/01 00:00:00 -0400","original":"3/31/2007","granularity":"day","time":"2007/03/31 00:00:00 -0400"},"longitude":-111.0549545,"id":"adv9lt6qv7ja","location":"San Carlos"},"type":"Feature","geometry":{"type":"Point","coordinates":[-111.0549545,27.9531649]}},{"properties":{"latitude":31.57479,"column_5":2,"date":{"end_time":"2007/05/03 00:00:00 -0400","original":"5/2/2007","granularity":"day","time":"2007/05/02 00:00:00 -0400"},"longitude":-111.33265,"id":"adv9lt14y8av","location":"Arivaca"},"type":"Feature","geometry":{"type":"Point","coordinates":[-111.33265,31.57479]}},{"properties":{"latitude":31.422409,"column_5":2,"date":{"end_time":"2007/05/03 00:00:00 -0400","original":"5/2/2007","granularity":"day","time":"2007/05/02 00:00:00 -0400"},"longitude":-111.245972,"id":"adv9lt2ewr2w","location":"Oro Blanco Mine"},"type":"Feature","geometry":{"type":"Point","coordinates":[-111.245972,31.422409]}},{"properties":{"latitude":38.5933947,"column_5":2,"date":{"end_time":"2007/05/23 00:00:00 -0400","original":"5/22/2007","granularity":"day","time":"2007/05/22 00:00:00 -0400"},"longitude":-92.2286367,"id":"adv9lt1635o3","location":"MO: MDC Headquarters"},"type":"Feature","geometry":{"type":"Point","coordinates":[-92.2286367,38.5933947]}},{"properties":{"latitude":38.8161056,"column_5":2,"date":{"end_time":"2007/06/02 00:00:00 -0400","original":"6/1/2007","granularity":"day","time":"2007/06/01 00:00:00 -0400"},"longitude":-90.1332583,"id":"adv9lt6hqctf","location":"Columbia Bottom CA"},"type":"Feature","geometry":{"type":"Point","coordinates":[-90.1332583,38.8161056]}},{"properties":{"latitude":38.8761002,"column_5":2,"date":{"end_time":"2007/06/02 00:00:00 -0400","original":"6/1/2007","granularity":"day","time":"2007/06/01 00:00:00 -0400"},"longitude":-90.6572485,"id":"adv9lsvkp2ki","location":"MO: St. Charles County--Peruque Creek Rd."},"type":"Feature","geometry":{"type":"Point","coordinates":[-90.6572485,38.8761002]}},{"properties":{"latitude":36.6815889,"column_5":2,"date":{"end_time":"2007/06/07 00:00:00 -0400","original":"6/6/2007","granularity":"day","time":"2007/06/06 00:00:00 -0400"},"longitude":-92.4247917,"id":"adv9lsz025pg","location":"Caney Mountain CA"},"type":"Feature","geometry":{"type":"Point","coordinates":[-92.4247917,36.6815889]}},{"properties":{"latitude":36.6910657,"column_5":2,"date":{"end_time":"2007/06/07 00:00:00 -0400","original":"6/6/2007","granularity":"day","time":"2007/06/06 00:00:00 -0400"},"longitude":-92.7863216,"id":"adv9lsvemgbr","location":"Glade Top Trail"},"type":"Feature","geometry":{"type":"Point","coordinates":[-92.7863216,36.6910657]}},{"properties":{"latitude":37.33865,"column_5":2,"date":{"end_time":"2007/06/07 00:00:00 -0400","original":"6/6/2007","granularity":"day","time":"2007/06/06 00:00:00 -0400"},"longitude":-92.90708,"id":"adv9lsx97ksw","location":"Marshfield"},"type":"Feature","geometry":{"type":"Point","coordinates":[-92.90708,37.33865]}},{"properties":{"latitude":38.5891011,"column_5":2,"date":{"end_time":"2007/06/08 00:00:00 -0400","original":"6/7/2007","granularity":"day","time":"2007/06/07 00:00:00 -0400"},"longitude":-92.2316623,"id":"adv9lsvbl376","location":"Runge Conservation Nature Center"},"type":"Feature","geometry":{"type":"Point","coordinates":[-92.2316623,38.5891011]}},{"properties":{"latitude":38.022,"column_5":2,"date":{"end_time":"2007/06/20 00:00:00 -0400","original":"6/19/2007","granularity":"day","time":"2007/06/19 00:00:00 -0400"},"longitude":-94.289,"id":"adv9lsrgphsg","location":"Four Rivers CA"},"type":"Feature","geometry":{"type":"Point","coordinates":[-94.289,38.022]}},{"properties":{"latitude":38.9716988,"column_5":2,"date":{"end_time":"2007/07/24 00:00:00 -0400","original":"7/23/2007","granularity":"day","time":"2007/07/23 00:00:00 -0400"},"longitude":-95.2352524,"id":"adv9lsv2r9sm","location":"Lawrence"},"type":"Feature","geometry":{"type":"Point","coordinates":[-95.2352524,38.9716988]}},{"properties":{"latitude":38.87834,"column_5":2,"date":{"end_time":"2007/07/24 00:00:00 -0400","original":"7/23/2007","granularity":"day","time":"2007/07/23 00:00:00 -0400"},"longitude":-91.38346,"id":"adv9lt577eta","location":"High Hill"},"type":"Feature","geometry":{"type":"Point","coordinates":[-91.38346,38.87834]}},{"properties":{"latitude":48.8169527,"column_5":2,"date":{"end_time":"2007/07/25 00:00:00 -0400","original":"7/24/2007","granularity":"day","time":"2007/07/24 00:00:00 -0400"},"longitude":-116.4104462,"id":"adv9lst8f8sw","location":"Ball Creek Ranch Preserve"},"type":"Feature","geometry":{"type":"Point","coordinates":[-116.4104462,48.8169527]}},{"properties":{"latitude":48.824045,"column_5":2,"date":{"end_time":"2007/07/25 00:00:00 -0400","original":"7/24/2007","granularity":"day","time":"2007/07/24 00:00:00 -0400"},"longitude":-116.5266609,"id":"adv9lt13uzah","location":"Trout Creek Rd."},"type":"Feature","geometry":{"type":"Point","coordinates":[-116.5266609,48.824045]}},{"properties":{"latitude":48.27662,"column_5":2,"date":{"end_time":"2007/08/02 00:00:00 -0400","original":"8/1/2007","granularity":"day","time":"2007/08/01 00:00:00 -0400"},"longitude":-116.55303,"id":"adv9lsxt29ib","location":"Sandpoint"},"type":"Feature","geometry":{"type":"Point","coordinates":[-116.55303,48.27662]}},{"properties":{"latitude":32.78343,"column_5":2,"date":{"end_time":"2007/11/23 00:00:00 -0500","original":"11/22/2007","granularity":"day","time":"2007/11/22 00:00:00 -0500"},"longitude":-96.80028,"id":"adv9lstoopj8","location":"Dallas"},"type":"Feature","geometry":{"type":"Point","coordinates":[-96.80028,32.78343]}},{"properties":{"latitude":32.9450132,"column_5":2,"date":{"end_time":"2007/12/10 00:00:00 -0500","original":"12/9/2007","granularity":"day","time":"2007/12/09 00:00:00 -0500"},"longitude":-112.9284668,"id":"adv9lsx0xaa5","location":"Paloma Ranch"},"type":"Feature","geometry":{"type":"Point","coordinates":[-112.9284668,32.9450132]}},{"properties":{"latitude":39.34194,"column_5":2,"date":{"end_time":"2008/01/09 00:00:00 -0500","original":"1/8/2008","granularity":"day","time":"2008/01/08 00:00:00 -0500"},"longitude":-91.19514,"id":"adv9lsys49z6","location":"Bowling Green"},"type":"Feature","geometry":{"type":"Point","coordinates":[-91.19514,39.34194]}},{"properties":{"latitude":31.7607994,"column_5":2,"date":{"end_time":"2008/03/30 00:00:00 -0400","original":"3/29/2008","granularity":"day","time":"2008/03/29 00:00:00 -0400"},"longitude":-110.8443985,"id":"adv9lszydnaa","location":"Florida Work Center"},"type":"Feature","geometry":{"type":"Point","coordinates":[-110.8443985,31.7607994]}},{"properties":{"latitude":31.535384,"column_5":2,"date":{"end_time":"2008/05/09 00:00:00 -0400","original":"5/8/2008","granularity":"day","time":"2008/05/08 00:00:00 -0400"},"longitude":-111.0310078,"id":"adv9lstwzpfe","location":"Tumacacori Fields"},"type":"Feature","geometry":{"type":"Point","coordinates":[-111.0310078,31.535384]}},{"properties":{"latitude":33.9916228,"column_5":2,"date":{"end_time":"2008/10/24 00:00:00 -0400","original":"10/23/2008","granularity":"day","time":"2008/10/23 00:00:00 -0400"},"longitude":-109.552145,"id":"adv9lt5i9wgt","location":"Sunrise Campground"},"type":"Feature","geometry":{"type":"Point","coordinates":[-109.552145,33.9916228]}},{"properties":{"latitude":34.1100646,"column_5":2,"date":{"end_time":"2008/10/24 00:00:00 -0400","original":"10/23/2008","granularity":"day","time":"2008/10/23 00:00:00 -0400"},"longitude":-109.5748435,"id":"adv9lt4x4ec2","location":"Green's Peak"},"type":"Feature","geometry":{"type":"Point","coordinates":[-109.5748435,34.1100646]}},{"properties":{"latitude":33.862,"column_5":2,"date":{"end_time":"2008/10/24 00:00:00 -0400","original":"10/23/2008","granularity":"day","time":"2008/10/23 00:00:00 -0400"},"longitude":-109.391,"id":"adv9lsvgodsl","location":"Big Lake Lookout"},"type":"Feature","geometry":{"type":"Point","coordinates":[-109.391,33.862]}},{"properties":{"latitude":32.6347491,"column_5":2,"date":{"end_time":"2008/11/02 00:00:00 -0400","original":"11/1/2008","granularity":"day","time":"2008/11/01 00:00:00 -0400"},"longitude":-118.190918,"id":"adv9lt66dywv","location":"CA: San Diego Pelagic--Los Angeles County"},"type":"Feature","geometry":{"type":"Point","coordinates":[-118.190918,32.6347491]}},{"properties":{"latitude":7.9214,"column_5":2,"date":{"end_time":"2008/12/11 00:00:00 -0500","original":"12/10/2008","granularity":"day","time":"2008/12/10 00:00:00 -0500"},"longitude":99.2592,"id":"adv9lstjibty","location":"Morakot Resort"},"type":"Feature","geometry":{"type":"Point","coordinates":[99.2592,7.9214]}},{"properties":{"latitude":7.9252,"column_5":2,"date":{"end_time":"2008/12/11 00:00:00 -0500","original":"12/10/2008","granularity":"day","time":"2008/12/10 00:00:00 -0500"},"longitude":99.2697,"id":"adv9lt6812ct","location":"Khao Nor Chu Chi"},"type":"Feature","geometry":{"type":"Point","coordinates":[99.2697,7.9252]}},{"properties":{"latitude":13.0337214,"column_5":2,"date":{"end_time":"2008/12/14 00:00:00 -0500","original":"12/13/2008","granularity":"day","time":"2008/12/13 00:00:00 -0500"},"longitude":100.0760038,"id":"adv9lt6pkgoo","location":"Laem Phak Bia--\"abandoned building\" wetlands"},"type":"Feature","geometry":{"type":"Point","coordinates":[100.0760038,13.0337214]}},{"properties":{"latitude":15.674,"column_5":2,"date":{"end_time":"2008/12/18 00:00:00 -0500","original":"12/17/2008","granularity":"day","time":"2008/12/17 00:00:00 -0500"},"longitude":100.2437,"id":"adv9lt4egx12","location":"Bueng Boraphet--boat launch &amp; nature trail"},"type":"Feature","geometry":{"type":"Point","coordinates":[100.2437,15.674]}},{"properties":{"latitude":20.3032,"column_5":2,"date":{"end_time":"2008/12/19 00:00:00 -0500","original":"12/18/2008","granularity":"day","time":"2008/12/18 00:00:00 -0500"},"longitude":100.0912,"id":"adv9lsyl72jg","location":"Mekong River, Chiang Saen"},"type":"Feature","geometry":{"type":"Point","coordinates":[100.0912,20.3032]}},{"properties":{"latitude":19.3938,"column_5":2,"date":{"end_time":"2008/12/22 00:00:00 -0500","original":"12/21/2008","granularity":"day","time":"2008/12/21 00:00:00 -0500"},"longitude":98.8774,"id":"adv9lt0re213","location":"Doi Chiang Dao NP"},"type":"Feature","geometry":{"type":"Point","coordinates":[98.8774,19.3938]}},{"properties":{"latitude":18.5891,"column_5":2,"date":{"end_time":"2008/12/24 00:00:00 -0500","original":"12/23/2008","granularity":"day","time":"2008/12/23 00:00:00 -0500"},"longitude":98.4874,"id":"adv9lsutaa8r","location":"Doi Inthanon NP"},"type":"Feature","geometry":{"type":"Point","coordinates":[98.4874,18.5891]}},{"properties":{"latitude":9.3813223,"column_5":2,"date":{"end_time":"2009/01/09 00:00:00 -0500","original":"1/8/2009","granularity":"day","time":"2009/01/08 00:00:00 -0500"},"longitude":98.1216431,"id":"adv9lt1x3vat","location":"Mu Ko Surin NP"},"type":"Feature","geometry":{"type":"Point","coordinates":[98.1216431,9.3813223]}},{"properties":{"latitude":3.1574,"column_5":2,"date":{"end_time":"2009/01/18 00:00:00 -0500","original":"1/17/2009","granularity":"day","time":"2009/01/17 00:00:00 -0500"},"longitude":101.7122,"id":"adv9lt0fg02t","location":"MY: Kuala Lumpur"},"type":"Feature","geometry":{"type":"Point","coordinates":[101.7122,3.1574]}},{"properties":{"latitude":25.796491,"column_5":2,"date":{"end_time":"2009/09/19 00:00:00 -0400","original":"9/18/2009","granularity":"day","time":"2009/09/18 00:00:00 -0400"},"longitude":-80.2824211,"id":"adv9lstiqg3a","location":"FL: Miami International Airport"},"type":"Feature","geometry":{"type":"Point","coordinates":[-80.2824211,25.796491]}},{"properties":{"latitude":-3.6826881,"column_5":2,"date":{"end_time":"2009/09/21 00:00:00 -0400","original":"9/20/2009","granularity":"day","time":"2009/09/20 00:00:00 -0400"},"longitude":-79.6804047,"id":"adv9lt0p98zx","location":"EC: Pinas"},"type":"Feature","geometry":{"type":"Point","coordinates":[-79.6804047,-3.6826881]}},{"properties":{"latitude":-4.0990341,"column_5":2,"date":{"end_time":"2009/09/23 00:00:00 -0400","original":"9/22/2009","granularity":"day","time":"2009/09/22 00:00:00 -0400"},"longitude":-79.1721153,"id":"adv9lswro1s3","location":"PN Podocarpus--Cajanuma"},"type":"Feature","geometry":{"type":"Point","coordinates":[-79.1721153,-4.0990341]}},{"properties":{"latitude":-4.1094786,"column_5":2,"date":{"end_time":"2009/09/26 00:00:00 -0400","original":"9/25/2009","granularity":"day","time":"2009/09/25 00:00:00 -0400"},"longitude":-78.96595,"id":"adv9lt57rvuw","location":"PN Podocarpus--Ro Bombuscaro"},"type":"Feature","geometry":{"type":"Point","coordinates":[-78.96595,-4.1094786]}},{"properties":{"latitude":-2.9005242,"column_5":2,"date":{"end_time":"2009/09/29 00:00:00 -0400","original":"9/28/2009","granularity":"day","time":"2009/09/28 00:00:00 -0400"},"longitude":-79.0037155,"id":"adv9lstxemw8","location":"EC: Cuenca"},"type":"Feature","geometry":{"type":"Point","coordinates":[-79.0037155,-2.9005242]}},{"properties":{"latitude":-0.3404883,"column_5":2,"date":{"end_time":"2009/10/07 00:00:00 -0400","original":"10/6/2009","granularity":"day","time":"2009/10/06 00:00:00 -0400"},"longitude":-77.8088236,"id":"adv9lsvupfj8","location":"El Chaco"},"type":"Feature","geometry":{"type":"Point","coordinates":[-77.8088236,-0.3404883]}},{"properties":{"latitude":-0.0500393,"column_5":2,"date":{"end_time":"2009/10/10 00:00:00 -0400","original":"10/9/2009","granularity":"day","time":"2009/10/09 00:00:00 -0400"},"longitude":-78.7882805,"id":"adv9lt2hzoth","location":"Mindo--South Road"},"type":"Feature","geometry":{"type":"Point","coordinates":[-78.7882805,-0.0500393]}},{"properties":{"latitude":-0.0251484,"column_5":2,"date":{"end_time":"2009/10/12 00:00:00 -0400","original":"10/11/2009","granularity":"day","time":"2009/10/11 00:00:00 -0400"},"longitude":-78.7579823,"id":"adv9lt4d65p0","location":"Sachatamia Lodge"},"type":"Feature","geometry":{"type":"Point","coordinates":[-78.7579823,-0.0251484]}},{"properties":{"latitude":-0.0022745,"column_5":2,"date":{"end_time":"2009/10/18 00:00:00 -0400","original":"10/17/2009","granularity":"day","time":"2009/10/17 00:00:00 -0400"},"longitude":-78.4559011,"id":"adv9lt0u4lb7","location":"Mitad del Mundo"},"type":"Feature","geometry":{"type":"Point","coordinates":[-78.4559011,-0.0022745]}},{"properties":{"latitude":38.99619,"column_5":2,"date":{"end_time":"2009/10/29 00:00:00 -0400","original":"10/28/2009","granularity":"day","time":"2009/10/28 00:00:00 -0400"},"longitude":-105.54598,"id":"adv9lsvuhjzf","location":"Colorado"},"type":"Feature","geometry":{"type":"Point","coordinates":[-105.54598,38.99619]}},{"properties":{"latitude":-34.1237423,"column_5":2,"date":{"end_time":"2009/11/10 00:00:00 -0500","original":"11/9/2009","granularity":"day","time":"2009/11/09 00:00:00 -0500"},"longitude":151.0462189,"id":"adv9lt4ibrsc","location":"Royal NP"},"type":"Feature","geometry":{"type":"Point","coordinates":[151.0462189,-34.1237423]}},{"properties":{"latitude":-22.4582369,"column_5":2,"date":{"end_time":"2009/11/12 00:00:00 -0500","original":"11/11/2009","granularity":"day","time":"2009/11/11 00:00:00 -0500"},"longitude":144.5031937,"id":"adv9lsr1xek4","location":"Queensland"},"type":"Feature","geometry":{"type":"Point","coordinates":[144.5031937,-22.4582369]}},{"properties":{"latitude":-19.8791003,"column_5":2,"date":{"end_time":"2009/11/15 00:00:00 -0500","original":"11/14/2009","granularity":"day","time":"2009/11/14 00:00:00 -0500"},"longitude":147.6868057,"id":"adv9lssp19re","location":"QLD: Gumlu"},"type":"Feature","geometry":{"type":"Point","coordinates":[147.6868057,-19.8791003]}},{"properties":{"latitude":-17.8676683,"column_5":2,"date":{"end_time":"2009/11/16 00:00:00 -0500","original":"11/15/2009","granularity":"day","time":"2009/11/15 00:00:00 -0500"},"longitude":146.0687256,"id":"adv9lssaljgk","location":"Mission Beach"},"type":"Feature","geometry":{"type":"Point","coordinates":[146.0687256,-17.8676683]}},{"properties":{"latitude":-17.5573415,"column_5":2,"date":{"end_time":"2009/11/17 00:00:00 -0500","original":"11/16/2009","granularity":"day","time":"2009/11/16 00:00:00 -0500"},"longitude":146.0894966,"id":"adv9lsta14rp","location":"Etty Bay"},"type":"Feature","geometry":{"type":"Point","coordinates":[146.0894966,-17.5573415]}},{"properties":{"latitude":-21.9181644,"column_5":2,"date":{"end_time":"2009/11/19 00:00:00 -0500","original":"11/18/2009","granularity":"day","time":"2009/11/18 00:00:00 -0500"},"longitude":149.4633722,"id":"adv9lsyifzn2","location":"Carmilla Beach"},"type":"Feature","geometry":{"type":"Point","coordinates":[149.4633722,-21.9181644]}},{"properties":{"latitude":-26.8656542,"column_5":2,"date":{"end_time":"2009/11/20 00:00:00 -0500","original":"11/19/2009","granularity":"day","time":"2009/11/19 00:00:00 -0500"},"longitude":153.1103611,"id":"adv9lt53x0fi","location":"QLD: Beerwah SF"},"type":"Feature","geometry":{"type":"Point","coordinates":[153.1103611,-26.8656542]}},{"properties":{"latitude":-28.1987208,"column_5":2,"date":{"end_time":"2009/11/22 00:00:00 -0500","original":"11/21/2009","granularity":"day","time":"2009/11/21 00:00:00 -0500"},"longitude":153.1873941,"id":"adv9lt3le65z","location":"Lamington NP--Binna Burra"},"type":"Feature","geometry":{"type":"Point","coordinates":[153.1873941,-28.1987208]}},{"properties":{"latitude":-26.0211541,"column_5":2,"date":{"end_time":"2009/11/24 00:00:00 -0500","original":"11/23/2009","granularity":"day","time":"2009/11/23 00:00:00 -0500"},"longitude":153.0810928,"id":"adv9lt534693","location":"Great Sandy NP"},"type":"Feature","geometry":{"type":"Point","coordinates":[153.0810928,-26.0211541]}},{"properties":{"latitude":-31.2774138,"column_5":2,"date":{"end_time":"2009/11/27 00:00:00 -0500","original":"11/26/2009","granularity":"day","time":"2009/11/26 00:00:00 -0500"},"longitude":148.9985561,"id":"adv9lt2fnth1","location":"Warrumbungle NP"},"type":"Feature","geometry":{"type":"Point","coordinates":[148.9985561,-31.2774138]}},{"properties":{"latitude":-32.6374957,"column_5":2,"date":{"end_time":"2009/11/28 00:00:00 -0500","original":"11/27/2009","granularity":"day","time":"2009/11/27 00:00:00 -0500"},"longitude":148.3815193,"id":"adv9lsrmssij","location":"Goobang NP"},"type":"Feature","geometry":{"type":"Point","coordinates":[148.3815193,-32.6374957]}},{"properties":{"latitude":-21.7105463,"column_5":2,"date":{"end_time":"2009/12/03 00:00:00 -0500","original":"12/2/2009","granularity":"day","time":"2009/12/02 00:00:00 -0500"},"longitude":165.8291817,"id":"adv9lsyyodjz","location":"La Foa"},"type":"Feature","geometry":{"type":"Point","coordinates":[165.8291817,-21.7105463]}},{"properties":{"latitude":-20.4887331,"column_5":2,"date":{"end_time":"2009/12/05 00:00:00 -0500","original":"12/4/2009","granularity":"day","time":"2009/12/04 00:00:00 -0500"},"longitude":164.7457409,"id":"adv9lt32lshd","location":"NWC: Colnett"},"type":"Feature","geometry":{"type":"Point","coordinates":[164.7457409,-20.4887331]}},{"properties":{"latitude":-21.6127492,"column_5":2,"date":{"end_time":"2009/12/06 00:00:00 -0500","original":"12/5/2009","granularity":"day","time":"2009/12/05 00:00:00 -0500"},"longitude":165.4003716,"id":"adv9lsssp9dp","location":"Poe Beach"},"type":"Feature","geometry":{"type":"Point","coordinates":[165.4003716,-21.6127492]}},{"properties":{"latitude":-34.9655922,"column_5":2,"date":{"end_time":"2009/12/11 00:00:00 -0500","original":"12/10/2009","granularity":"day","time":"2009/12/10 00:00:00 -0500"},"longitude":148.6227036,"id":"adv9lt2pp9md","location":"Burrinjuck Nature Reserve"},"type":"Feature","geometry":{"type":"Point","coordinates":[148.6227036,-34.9655922]}},{"properties":{"latitude":-36.1245647,"column_5":2,"date":{"end_time":"2009/12/12 00:00:00 -0500","original":"12/11/2009","granularity":"day","time":"2009/12/11 00:00:00 -0500"},"longitude":146.6130638,"id":"adv9lt6vwm93","location":"Chiltern-Mt. Pilot NP"},"type":"Feature","geometry":{"type":"Point","coordinates":[146.6130638,-36.1245647]}},{"properties":{"latitude":-36.1504201,"column_5":2,"date":{"end_time":"2009/12/13 00:00:00 -0500","original":"12/12/2009","granularity":"day","time":"2009/12/12 00:00:00 -0500"},"longitude":144.2273998,"id":"adv9lsutxknp","location":"Terrick Terrick NP"},"type":"Feature","geometry":{"type":"Point","coordinates":[144.2273998,-36.1504201]}},{"properties":{"latitude":-37.8935502,"column_5":2,"date":{"end_time":"2009/12/15 00:00:00 -0500","original":"12/14/2009","granularity":"day","time":"2009/12/14 00:00:00 -0500"},"longitude":145.3755569,"id":"adv9lt53ksxd","location":"Sherbrooke Forest Park"},"type":"Feature","geometry":{"type":"Point","coordinates":[145.3755569,-37.8935502]}},{"properties":{"latitude":-35.0094361,"column_5":2,"date":{"end_time":"2009/12/21 00:00:00 -0500","original":"12/20/2009","granularity":"day","time":"2009/12/20 00:00:00 -0500"},"longitude":138.6532116,"id":"adv9lsrpp2yr","location":"Belair NP"},"type":"Feature","geometry":{"type":"Point","coordinates":[138.6532116,-35.0094361]}},{"properties":{"latitude":-35.5844207,"column_5":2,"date":{"end_time":"2009/12/23 00:00:00 -0500","original":"12/22/2009","granularity":"day","time":"2009/12/22 00:00:00 -0500"},"longitude":142.0526218,"id":"adv9lt26n3bh","location":"Wyperfeld NP"},"type":"Feature","geometry":{"type":"Point","coordinates":[142.0526218,-35.5844207]}},{"properties":{"latitude":-31.2753965,"column_5":2,"date":{"end_time":"2009/12/26 00:00:00 -0500","original":"12/25/2009","granularity":"day","time":"2009/12/25 00:00:00 -0500"},"longitude":142.3040843,"id":"adv9lsrgccj7","location":"Mutawintji NP"},"type":"Feature","geometry":{"type":"Point","coordinates":[142.3040843,-31.2753965]}},{"properties":{"latitude":-31.5247027,"column_5":2,"date":{"end_time":"2009/12/28 00:00:00 -0500","original":"12/27/2009","granularity":"day","time":"2009/12/27 00:00:00 -0500"},"longitude":138.6385345,"id":"adv9lt4cs9dz","location":"Flinders Range NP"},"type":"Feature","geometry":{"type":"Point","coordinates":[138.6385345,-31.5247027]}},{"properties":{"latitude":-30.2234751,"column_5":2,"date":{"end_time":"2009/12/29 00:00:00 -0500","original":"12/28/2009","granularity":"day","time":"2009/12/28 00:00:00 -0500"},"longitude":138.527298,"id":"adv9lt4xsyff","location":"Strzelecki Track km 1-30"},"type":"Feature","geometry":{"type":"Point","coordinates":[138.527298,-30.2234751]}},{"properties":{"latitude":-26.9959341,"column_5":2,"date":{"end_time":"2009/12/31 00:00:00 -0500","original":"12/30/2009","granularity":"day","time":"2009/12/30 00:00:00 -0500"},"longitude":139.0097094,"id":"adv9lt3ovk88","location":"Birdsville Track--Mungerannie to Birdsville"},"type":"Feature","geometry":{"type":"Point","coordinates":[139.0097094,-26.9959341]}},{"properties":{"latitude":-23.776548,"column_5":2,"date":{"end_time":"2010/01/04 00:00:00 -0500","original":"1/3/2010","granularity":"day","time":"2010/01/03 00:00:00 -0500"},"longitude":133.0732727,"id":"adv9lsr820s2","location":"Ellery Creek Big Hole"},"type":"Feature","geometry":{"type":"Point","coordinates":[133.0732727,-23.776548]}},{"properties":{"latitude":-33.5373526,"column_5":2,"date":{"end_time":"2010/01/10 00:00:00 -0500","original":"1/9/2010","granularity":"day","time":"2010/01/09 00:00:00 -0500"},"longitude":115.0187874,"id":"adv9lsykll49","location":"Cape Naturaliste NP"},"type":"Feature","geometry":{"type":"Point","coordinates":[115.0187874,-33.5373526]}},{"properties":{"latitude":-38.9536021,"column_5":2,"date":{"end_time":"2010/01/18 00:00:00 -0500","original":"1/17/2010","granularity":"day","time":"2010/01/17 00:00:00 -0500"},"longitude":175.7622814,"id":"adv9lt4js51u","location":"Lake Taupo--Old Wharf"},"type":"Feature","geometry":{"type":"Point","coordinates":[175.7622814,-38.9536021]}},{"properties":{"latitude":-42.4406876,"column_5":2,"date":{"end_time":"2010/01/19 00:00:00 -0500","original":"1/18/2010","granularity":"day","time":"2010/01/18 00:00:00 -0500"},"longitude":173.7171936,"id":"adv9lt47lmyz","location":"NZ: Kaikoura"},"type":"Feature","geometry":{"type":"Point","coordinates":[173.7171936,-42.4406876]}},{"properties":{"latitude":-46.743625,"column_5":2,"date":{"end_time":"2010/01/21 00:00:00 -0500","original":"1/20/2010","granularity":"day","time":"2010/01/20 00:00:00 -0500"},"longitude":168.2858276,"id":"adv9lt2jv092","location":"Stewart Island Ferry"},"type":"Feature","geometry":{"type":"Point","coordinates":[168.2858276,-46.743625]}},{"properties":{"latitude":-44.7701368,"column_5":2,"date":{"end_time":"2010/01/23 00:00:00 -0500","original":"1/22/2010","granularity":"day","time":"2010/01/22 00:00:00 -0500"},"longitude":167.9699707,"id":"adv9lstjrhy7","location":"NZ: Fiordland NP"},"type":"Feature","geometry":{"type":"Point","coordinates":[167.9699707,-44.7701368]}},{"properties":{"latitude":-43.69511,"column_5":2,"date":{"end_time":"2010/01/25 00:00:00 -0500","original":"1/24/2010","granularity":"day","time":"2010/01/24 00:00:00 -0500"},"longitude":169.26927,"id":"adv9lt5kv1ip","location":"Westland Tai Poutini NP -- Monro Beach"},"type":"Feature","geometry":{"type":"Point","coordinates":[169.26927,-43.69511]}},{"properties":{"latitude":-43.716031,"column_5":2,"date":{"end_time":"2010/01/25 00:00:00 -0500","original":"1/24/2010","granularity":"day","time":"2010/01/24 00:00:00 -0500"},"longitude":169.420166,"id":"adv9lt0p32pc","location":"Lake Paringa Recreation Area"},"type":"Feature","geometry":{"type":"Point","coordinates":[169.420166,-43.716031]}},{"properties":{"latitude":-42.9879,"column_5":2,"date":{"end_time":"2010/01/26 00:00:00 -0500","original":"1/25/2010","granularity":"day","time":"2010/01/25 00:00:00 -0500"},"longitude":171.751,"id":"adv9lsrpf5na","location":"Arthur's Pass NP -- Hawdon Valley"},"type":"Feature","geometry":{"type":"Point","coordinates":[171.751,-42.9879]}},{"properties":{"latitude":-43.2744558,"column_5":2,"date":{"end_time":"2010/02/03 00:00:00 -0500","original":"2/2/2010","granularity":"day","time":"2010/02/02 00:00:00 -0500"},"longitude":147.343998,"id":"adv9lss2vqjz","location":"Bruny Island"},"type":"Feature","geometry":{"type":"Point","coordinates":[147.343998,-43.2744558]}},{"properties":{"latitude":-41.3252637,"column_5":2,"date":{"end_time":"2010/02/04 00:00:00 -0500","original":"2/3/2010","granularity":"day","time":"2010/02/03 00:00:00 -0500"},"longitude":148.2440186,"id":"adv9lsv17egz","location":"TAS: St. Helen's"},"type":"Feature","geometry":{"type":"Point","coordinates":[148.2440186,-41.3252637]}},{"properties":{"latitude":-41.4135415,"column_5":2,"date":{"end_time":"2010/02/05 00:00:00 -0500","original":"2/4/2010","granularity":"day","time":"2010/02/04 00:00:00 -0500"},"longitude":145.9763288,"id":"adv9lsvi8zhr","location":"Mountain Valley Lodge"},"type":"Feature","geometry":{"type":"Point","coordinates":[145.9763288,-41.4135415]}},{"properties":{"latitude":14.0819,"column_5":2,"date":{"end_time":"2010/03/04 00:00:00 -0500","original":"3/3/2010","granularity":"day","time":"2010/03/03 00:00:00 -0500"},"longitude":-87.2063,"id":"adv9lt4mibpw","location":"HN: Tegucigalpa"},"type":"Feature","geometry":{"type":"Point","coordinates":[-87.2063,14.0819]}},{"properties":{"latitude":15.6699821,"column_5":2,"date":{"end_time":"2010/03/14 00:00:00 -0500","original":"3/13/2010","granularity":"day","time":"2010/03/13 00:00:00 -0500"},"longitude":-84.8965073,"id":"adv9lswdvb91","location":"HN: Las Marias (Gracias a Dios Province)"},"type":"Feature","geometry":{"type":"Point","coordinates":[-84.8965073,15.6699821]}},{"properties":{"latitude":15.7703658,"column_5":2,"date":{"end_time":"2010/03/15 00:00:00 -0400","original":"3/14/2010","granularity":"day","time":"2010/03/14 00:00:00 -0500"},"longitude":-84.5391941,"id":"adv9lsysx4kf","location":"Brus Lagoon"},"type":"Feature","geometry":{"type":"Point","coordinates":[-84.5391941,15.7703658]}},{"properties":{"latitude":15.6929962,"column_5":2,"date":{"end_time":"2010/03/16 00:00:00 -0400","original":"3/15/2010","granularity":"day","time":"2010/03/15 00:00:00 -0400"},"longitude":-86.9022846,"id":"adv9lt6x3s2f","location":"Lodge at Pico Bonito"},"type":"Feature","geometry":{"type":"Point","coordinates":[-86.9022846,15.6929962]}},{"properties":{"latitude":29.2590008,"column_5":2,"date":{"end_time":"2010/04/09 00:00:00 -0400","original":"4/8/2010","granularity":"day","time":"2010/04/08 00:00:00 -0400"},"longitude":-103.2685013,"id":"adv9lsyjk5hr","location":"Big Bend NP"},"type":"Feature","geometry":{"type":"Point","coordinates":[-103.2685013,29.2590008]}},{"properties":{"latitude":39.9205894,"column_5":2,"date":{"end_time":"2010/05/08 00:00:00 -0400","original":"5/7/2010","granularity":"day","time":"2010/05/07 00:00:00 -0400"},"longitude":-105.0865402,"id":"adv9lt3u4n9x","location":"Broomfield"},"type":"Feature","geometry":{"type":"Point","coordinates":[-105.0865402,39.9205894]}},{"properties":{"latitude":43.3387879,"column_5":2,"date":{"end_time":"2010/05/12 00:00:00 -0400","original":"5/11/2010","granularity":"day","time":"2010/05/11 00:00:00 -0400"},"longitude":-103.5549402,"id":"adv9lt0ftmfg","location":"Whitney Preserve"},"type":"Feature","geometry":{"type":"Point","coordinates":[-103.5549402,43.3387879]}},{"properties":{"latitude":48.9694181,"column_5":2,"date":{"end_time":"2010/05/24 00:00:00 -0400","original":"5/23/2010","granularity":"day","time":"2010/05/23 00:00:00 -0400"},"longitude":-116.2163638,"id":"adv9lsuk7zkf","location":"Robinson Lake Campground"},"type":"Feature","geometry":{"type":"Point","coordinates":[-116.2163638,48.9694181]}},{"properties":{"latitude":47.6337882,"column_5":2,"date":{"end_time":"2010/05/27 00:00:00 -0400","original":"5/26/2010","granularity":"day","time":"2010/05/26 00:00:00 -0400"},"longitude":-116.2810564,"id":"adv9lsw70l8m","location":"Bumblebee Campground"},"type":"Feature","geometry":{"type":"Point","coordinates":[-116.2810564,47.6337882]}},{"properties":{"latitude":23.516017,"column_5":2,"date":{"end_time":"2010/08/04 00:00:00 -0400","original":"8/3/2010","granularity":"day","time":"2010/08/03 00:00:00 -0400"},"longitude":-105.83691,"id":"adv9lszqabcx","location":"Durango Hwy--km 211"},"type":"Feature","geometry":{"type":"Point","coordinates":[-105.83691,23.516017]}},{"properties":{"latitude":46.5549281,"column_5":2,"date":{"end_time":"2010/08/27 00:00:00 -0400","original":"8/26/2010","granularity":"day","time":"2010/08/26 00:00:00 -0400"},"longitude":-85.0312936,"id":"adv9lsyqe8wn","location":"Tahquamenon River Mouth"},"type":"Feature","geometry":{"type":"Point","coordinates":[-85.0312936,46.5549281]}},{"properties":{"latitude":46.62752,"column_5":2,"date":{"end_time":"2010/11/18 00:00:00 -0500","original":"11/17/2010","granularity":"day","time":"2010/11/17 00:00:00 -0500"},"longitude":-85.03759,"id":"adv9lsuuw0r2","location":"Paradise"},"type":"Feature","geometry":{"type":"Point","coordinates":[-85.03759,46.62752]}},{"properties":{"latitude":-18.9265853,"column_5":2,"date":{"end_time":"2010/11/28 00:00:00 -0500","original":"11/27/2010","granularity":"day","time":"2010/11/27 00:00:00 -0500"},"longitude":48.4144306,"id":"adv9lt6s64zs","location":"Perinet (Analamazaotra Special Reserve)"},"type":"Feature","geometry":{"type":"Point","coordinates":[48.4144306,-18.9265853]}},{"properties":{"latitude":-23.1226796,"column_5":2,"date":{"end_time":"2010/12/05 00:00:00 -0500","original":"12/4/2010","granularity":"day","time":"2010/12/04 00:00:00 -0500"},"longitude":43.6177826,"id":"adv9lt2l3zx5","location":"Ifaty--spiny forest vicinity"},"type":"Feature","geometry":{"type":"Point","coordinates":[43.6177826,-23.1226796]}},{"properties":{"latitude":-22.8856644,"column_5":2,"date":{"end_time":"2010/12/06 00:00:00 -0500","original":"12/5/2010","granularity":"day","time":"2010/12/05 00:00:00 -0500"},"longitude":44.6918678,"id":"adv9lt5try0o","location":"Zombitse-Vohibasia NP"},"type":"Feature","geometry":{"type":"Point","coordinates":[44.6918678,-22.8856644]}},{"properties":{"latitude":-16.3102559,"column_5":2,"date":{"end_time":"2010/12/09 00:00:00 -0500","original":"12/8/2010","granularity":"day","time":"2010/12/08 00:00:00 -0500"},"longitude":46.8116012,"id":"adv9lsvuglzw","location":"Ankarafantsika NP"},"type":"Feature","geometry":{"type":"Point","coordinates":[46.8116012,-16.3102559]}},{"properties":{"latitude":-23.1089441,"column_5":2,"date":{"end_time":"2010/12/14 00:00:00 -0500","original":"12/13/2010","granularity":"day","time":"2010/12/13 00:00:00 -0500"},"longitude":31.4355969,"id":"adv9lszgqhi4","location":"Kruger NP--Shingwedzi Camp"},"type":"Feature","geometry":{"type":"Point","coordinates":[31.4355969,-23.1089441]}},{"properties":{"latitude":-24.3944753,"column_5":2,"date":{"end_time":"2010/12/15 00:00:00 -0500","original":"12/14/2010","granularity":"day","time":"2010/12/14 00:00:00 -0500"},"longitude":31.7782116,"id":"adv9lt376d37","location":"Kruger NP--Satara Camp"},"type":"Feature","geometry":{"type":"Point","coordinates":[31.7782116,-24.3944753]}},{"properties":{"latitude":-27.3327351,"column_5":2,"date":{"end_time":"2010/12/17 00:00:00 -0500","original":"12/16/2010","granularity":"day","time":"2010/12/16 00:00:00 -0500"},"longitude":30.1244259,"id":"adv9lsvxt4wg","location":"Wakkerstroom"},"type":"Feature","geometry":{"type":"Point","coordinates":[30.1244259,-27.3327351]}},{"properties":{"latitude":-27.6242278,"column_5":2,"date":{"end_time":"2010/12/18 00:00:00 -0500","original":"12/17/2010","granularity":"day","time":"2010/12/17 00:00:00 -0500"},"longitude":32.2582626,"id":"adv9lt1gd6dw","location":"Mkhuze Game Reserve"},"type":"Feature","geometry":{"type":"Point","coordinates":[32.2582626,-27.6242278]}},{"properties":{"latitude":-30.7071577,"column_5":2,"date":{"end_time":"2010/12/20 00:00:00 -0500","original":"12/19/2010","granularity":"day","time":"2010/12/19 00:00:00 -0500"},"longitude":30.2706599,"id":"adv9lt5q5d5h","location":"Oribi Gorge Nature Reserve"},"type":"Feature","geometry":{"type":"Point","coordinates":[30.2706599,-30.7071577]}},{"properties":{"latitude":-29.3325024,"column_5":2,"date":{"end_time":"2010/12/26 00:00:00 -0500","original":"12/25/2010","granularity":"day","time":"2010/12/25 00:00:00 -0500"},"longitude":18.9728737,"id":"adv9lt55pbot","location":"Koa Dunes"},"type":"Feature","geometry":{"type":"Point","coordinates":[18.9728737,-29.3325024]}},{"properties":{"latitude":-21.4609961,"column_5":2,"date":{"end_time":"2010/12/30 00:00:00 -0500","original":"12/29/2010","granularity":"day","time":"2010/12/29 00:00:00 -0500"},"longitude":15.8745204,"id":"adv9lt6ygqp3","location":"Erongo Wilderness Lodge"},"type":"Feature","geometry":{"type":"Point","coordinates":[15.8745204,-21.4609961]}},{"properties":{"latitude":-19.0363184,"column_5":2,"date":{"end_time":"2011/01/01 00:00:00 -0500","original":"12/31/2010","granularity":"day","time":"2010/12/31 00:00:00 -0500"},"longitude":16.4712524,"id":"adv9lsz2lwx6","location":"Etosha NP--Halali Camp"},"type":"Feature","geometry":{"type":"Point","coordinates":[16.4712524,-19.0363184]}},{"properties":{"latitude":-17.8942771,"column_5":2,"date":{"end_time":"2011/01/02 00:00:00 -0500","original":"1/1/2011","granularity":"day","time":"2011/01/01 00:00:00 -0500"},"longitude":19.8014617,"id":"adv9lsta15ht","location":"Rundu WTP"},"type":"Feature","geometry":{"type":"Point","coordinates":[19.8014617,-17.8942771]}},{"properties":{"latitude":-17.497062,"column_5":2,"date":{"end_time":"2011/01/05 00:00:00 -0500","original":"1/4/2011","granularity":"day","time":"2011/01/04 00:00:00 -0500"},"longitude":24.3433857,"id":"adv9lss1vde2","location":"Katima Mulilo--Hippo Island"},"type":"Feature","geometry":{"type":"Point","coordinates":[24.3433857,-17.497062]}},{"properties":{"latitude":-18.0270572,"column_5":2,"date":{"end_time":"2011/01/08 00:00:00 -0500","original":"1/7/2011","granularity":"day","time":"2011/01/07 00:00:00 -0500"},"longitude":25.2139664,"id":"adv9lszkefyl","location":"Kasane Forest Preserve"},"type":"Feature","geometry":{"type":"Point","coordinates":[25.2139664,-18.0270572]}},{"properties":{"latitude":-25.7034901,"column_5":2,"date":{"end_time":"2011/01/12 00:00:00 -0500","original":"1/11/2011","granularity":"day","time":"2011/01/11 00:00:00 -0500"},"longitude":28.9448547,"id":"adv9lsyxr51k","location":"Ezemvelo Nature Reserve"},"type":"Feature","geometry":{"type":"Point","coordinates":[28.9448547,-25.7034901]}},{"properties":{"latitude":9.60596,"column_5":2,"date":{"end_time":"2011/03/26 00:00:00 -0400","original":"3/25/2011","granularity":"day","time":"2011/03/25 00:00:00 -0400"},"longitude":-83.82256,"id":"adv9lsr3pkxt","location":"PN Los Quetzales--Ojo de Agua"},"type":"Feature","geometry":{"type":"Point","coordinates":[-83.82256,9.60596]}},{"properties":{"latitude":9.5563276,"column_5":2,"date":{"end_time":"2011/03/27 00:00:00 -0400","original":"3/26/2011","granularity":"day","time":"2011/03/26 00:00:00 -0400"},"longitude":-83.7068617,"id":"adv9lszawbpt","location":"Villa Mills"},"type":"Feature","geometry":{"type":"Point","coordinates":[-83.7068617,9.5563276]}},{"properties":{"latitude":9.7932459,"column_5":2,"date":{"end_time":"2011/03/29 00:00:00 -0400","original":"3/28/2011","granularity":"day","time":"2011/03/28 00:00:00 -0400"},"longitude":-83.5640073,"id":"adv9lt26jlq6","location":"Silent Mountain"},"type":"Feature","geometry":{"type":"Point","coordinates":[-83.5640073,9.7932459]}},{"properties":{"latitude":39.2741769,"column_5":2,"date":{"end_time":"2011/05/03 00:00:00 -0400","original":"5/2/2011","granularity":"day","time":"2011/05/02 00:00:00 -0400"},"longitude":-108.8396124,"id":"adv9lt69feuv","location":"Highline Lake State Park"},"type":"Feature","geometry":{"type":"Point","coordinates":[-108.8396124,39.2741769]}},{"properties":{"latitude":36.8625921,"column_5":2,"date":{"end_time":"2011/05/08 00:00:00 -0400","original":"5/7/2011","granularity":"day","time":"2011/05/07 00:00:00 -0400"},"longitude":-112.7396393,"id":"adv9lt6fuiw8","location":"Pipe Springs NM"},"type":"Feature","geometry":{"type":"Point","coordinates":[-112.7396393,36.8625921]}},{"properties":{"latitude":22.1302507,"column_5":2,"date":{"end_time":"2011/07/08 00:00:00 -0400","original":"7/7/2011","granularity":"day","time":"2011/07/07 00:00:00 -0400"},"longitude":-159.6556377,"id":"adv9lsxlgljm","location":"Koke'e State Park"},"type":"Feature","geometry":{"type":"Point","coordinates":[-159.6556377,22.1302507]}},{"properties":{"latitude":21.8764,"column_5":2,"date":{"end_time":"2011/07/09 00:00:00 -0400","original":"7/8/2011","granularity":"day","time":"2011/07/08 00:00:00 -0400"},"longitude":-159.454,"id":"adv9lsxvhl3s","location":"Poipu"},"type":"Feature","geometry":{"type":"Point","coordinates":[-159.454,21.8764]}},{"properties":{"latitude":22.2202244,"column_5":2,"date":{"end_time":"2011/07/11 00:00:00 -0400","original":"7/10/2011","granularity":"day","time":"2011/07/10 00:00:00 -0400"},"longitude":-159.5803642,"id":"adv9lsri7m9q","location":"Ha'ena State Park"},"type":"Feature","geometry":{"type":"Point","coordinates":[-159.5803642,22.2202244]}},{"properties":{"latitude":19.6348271,"column_5":2,"date":{"end_time":"2011/07/14 00:00:00 -0400","original":"7/13/2011","granularity":"day","time":"2011/07/13 00:00:00 -0400"},"longitude":-155.9892082,"id":"adv9lsxpxka5","location":"Kailua-Kona Town Area (not wilderness or upper elevations!)"},"type":"Feature","geometry":{"type":"Point","coordinates":[-155.9892082,19.6348271]}},{"properties":{"latitude":19.3292867,"column_5":2,"date":{"end_time":"2011/07/15 00:00:00 -0400","original":"7/14/2011","granularity":"day","time":"2011/07/14 00:00:00 -0400"},"longitude":-155.194416,"id":"adv9lssouf4q","location":"Hawai'i Volcanoes National Park (general)"},"type":"Feature","geometry":{"type":"Point","coordinates":[-155.194416,19.3292867]}},{"properties":{"latitude":44.4638034,"column_5":2,"date":{"end_time":"2011/08/11 00:00:00 -0400","original":"8/10/2011","granularity":"day","time":"2011/08/10 00:00:00 -0400"},"longitude":-84.3294668,"id":"adv9lt6gpn5u","location":"MI: Huron NF--St. Helen area"},"type":"Feature","geometry":{"type":"Point","coordinates":[-84.3294668,44.4638034]}},{"properties":{"latitude":9.1573493,"column_5":2,"date":{"end_time":"2011/12/08 00:00:00 -0500","original":"12/7/2011","granularity":"day","time":"2011/12/07 00:00:00 -0500"},"longitude":-79.135621,"id":"adv9lt4wyuc2","location":"PAN: Chepo rice fields"},"type":"Feature","geometry":{"type":"Point","coordinates":[-79.135621,9.1573493]}},{"properties":{"latitude":9.1382513,"column_5":2,"date":{"end_time":"2011/12/08 00:00:00 -0500","original":"12/7/2011","granularity":"day","time":"2011/12/07 00:00:00 -0500"},"longitude":-78.6899666,"id":"adv9lsuvvtz2","location":"PAN: Rio Mono bridge"},"type":"Feature","geometry":{"type":"Point","coordinates":[-78.6899666,9.1382513]}},{"properties":{"latitude":8.915906,"column_5":2,"date":{"end_time":"2011/12/09 00:00:00 -0500","original":"12/8/2011","granularity":"day","time":"2011/12/08 00:00:00 -0500"},"longitude":-78.3931211,"id":"adv9lt5rlooz","location":"PAN: Torti"},"type":"Feature","geometry":{"type":"Point","coordinates":[-78.3931211,8.915906]}},{"properties":{"latitude":9.3370832,"column_5":2,"date":{"end_time":"2011/12/11 00:00:00 -0500","original":"12/10/2011","granularity":"day","time":"2011/12/10 00:00:00 -0500"},"longitude":-78.984795,"id":"adv9lsr7qtci","location":"Nusagandi"},"type":"Feature","geometry":{"type":"Point","coordinates":[-78.984795,9.3370832]}},{"properties":{"latitude":8.3664736,"column_5":2,"date":{"end_time":"2011/12/14 00:00:00 -0500","original":"12/13/2011","granularity":"day","time":"2011/12/13 00:00:00 -0500"},"longitude":-80.2249733,"id":"adv9lsqwpnmw","location":"PAN: Juan Hombron"},"type":"Feature","geometry":{"type":"Point","coordinates":[-80.2249733,8.3664736]}},{"properties":{"latitude":61.2302603,"column_5":2,"date":{"end_time":"2012/03/05 00:00:00 -0500","original":"3/4/2012","granularity":"day","time":"2012/03/04 00:00:00 -0500"},"longitude":-149.8797798,"id":"adv9lszzfpsb","location":"Anchorage--Government Hill"},"type":"Feature","geometry":{"type":"Point","coordinates":[-149.8797798,61.2302603]}},{"properties":{"latitude":61.1660515,"column_5":2,"date":{"end_time":"2012/03/22 00:00:00 -0400","original":"3/21/2012","granularity":"day","time":"2012/03/21 00:00:00 -0400"},"longitude":-149.7793579,"id":"adv9lsu441h7","location":"Anchorage--Campbell Creek Science Center trail system"},"type":"Feature","geometry":{"type":"Point","coordinates":[-149.7793579,61.1660515]}},{"properties":{"latitude":61.2342515,"column_5":2,"date":{"end_time":"2012/04/16 00:00:00 -0400","original":"4/15/2012","granularity":"day","time":"2012/04/15 00:00:00 -0400"},"longitude":-149.2712295,"id":"adv9lsyp72yl","location":"Eagle River Nature Center (Anchorage)"},"type":"Feature","geometry":{"type":"Point","coordinates":[-149.2712295,61.2342515]}},{"properties":{"latitude":61.2232627,"column_5":2,"date":{"end_time":"2012/04/20 00:00:00 -0400","original":"4/19/2012","granularity":"day","time":"2012/04/19 00:00:00 -0400"},"longitude":-149.8787284,"id":"adv9lt42sdja","location":"Anchorage--Ship Creek"},"type":"Feature","geometry":{"type":"Point","coordinates":[-149.8787284,61.2232627]}},{"properties":{"latitude":61.1277532,"column_5":2,"date":{"end_time":"2012/04/22 00:00:00 -0400","original":"4/21/2012","granularity":"day","time":"2012/04/21 00:00:00 -0400"},"longitude":-146.3382501,"id":"adv9lt4lndh1","location":"AK: Valdez"},"type":"Feature","geometry":{"type":"Point","coordinates":[-146.3382501,61.1277532]}},{"properties":{"latitude":61.71087,"column_5":2,"date":{"end_time":"2012/04/22 00:00:00 -0400","original":"4/21/2012","granularity":"day","time":"2012/04/21 00:00:00 -0400"},"longitude":-148.8962,"id":"adv9lss5imgo","location":"Sutton"},"type":"Feature","geometry":{"type":"Point","coordinates":[-148.8962,61.71087]}},{"properties":{"latitude":60.8215092,"column_5":2,"date":{"end_time":"2012/10/21 00:00:00 -0400","original":"10/20/2012","granularity":"day","time":"2012/10/20 00:00:00 -0400"},"longitude":-148.9844546,"id":"adv9lst4npjd","location":"Seward Hwy.--AK Wildlife Cons. Cen. (MP A48) (Anchorage Muni.)"},"type":"Feature","geometry":{"type":"Point","coordinates":[-148.9844546,60.8215092]}},{"properties":{"latitude":26.1857402,"column_5":2,"date":{"end_time":"2012/11/08 00:00:00 -0500","original":"11/7/2012","granularity":"day","time":"2012/11/07 00:00:00 -0500"},"longitude":-97.6641657,"id":"adv9lt17pfpc","location":"Harlingen Arroyo Colorado (Ramsey Park) WBC (LTC 026)"},"type":"Feature","geometry":{"type":"Point","coordinates":[-97.6641657,26.1857402]}},{"properties":{"latitude":18.5027742,"column_5":2,"date":{"end_time":"2013/01/16 00:00:00 -0500","original":"1/15/2013","granularity":"day","time":"2013/01/15 00:00:00 -0500"},"longitude":-77.7121085,"id":"adv9lt0c7qgf","location":"JM: Salt Marsh"},"type":"Feature","geometry":{"type":"Point","coordinates":[-77.7121085,18.5027742]}},{"properties":{"latitude":28.4317663,"column_5":2,"date":{"end_time":"2013/01/16 00:00:00 -0500","original":"1/15/2013","granularity":"day","time":"2013/01/15 00:00:00 -0500"},"longitude":-81.3076344,"id":"adv9lt45cdug","location":"Orlando International Airport"},"type":"Feature","geometry":{"type":"Point","coordinates":[-81.3076344,28.4317663]}},{"properties":{"latitude":18.073819,"column_5":2,"date":{"end_time":"2013/01/17 00:00:00 -0500","original":"1/16/2013","granularity":"day","time":"2013/01/16 00:00:00 -0500"},"longitude":-76.71673,"id":"adv9lt4n18ua","location":"Hardwar Gap"},"type":"Feature","geometry":{"type":"Point","coordinates":[-76.71673,18.073819]}},{"properties":{"latitude":28.6121693,"column_5":2,"date":{"end_time":"2013/01/24 00:00:00 -0500","original":"1/23/2013","granularity":"day","time":"2013/01/23 00:00:00 -0500"},"longitude":-80.807579,"id":"adv9lsxssqlc","location":"Titusville"},"type":"Feature","geometry":{"type":"Point","coordinates":[-80.807579,28.6121693]}},{"properties":{"latitude":28.6349126,"column_5":2,"date":{"end_time":"2013/01/25 00:00:00 -0500","original":"1/24/2013","granularity":"day","time":"2013/01/24 00:00:00 -0500"},"longitude":-80.8226395,"id":"adv9lswj30gd","location":"Brevard Community College--Chain of Lakes Park south"},"type":"Feature","geometry":{"type":"Point","coordinates":[-80.8226395,28.6349126]}},{"properties":{"latitude":59.6432847,"column_5":2,"date":{"end_time":"2013/02/03 00:00:00 -0500","original":"2/2/2013","granularity":"day","time":"2013/02/02 00:00:00 -0500"},"longitude":-151.5481567,"id":"adv9lsvc2xu8","location":"Homer (Kenai Peninsula)"},"type":"Feature","geometry":{"type":"Point","coordinates":[-151.5481567,59.6432847]}},{"properties":{"latitude":60.48691,"column_5":2,"date":{"end_time":"2013/02/03 00:00:00 -0500","original":"2/2/2013","granularity":"day","time":"2013/02/02 00:00:00 -0500"},"longitude":-149.37111,"id":"adv9lt680ru0","location":"Moose Pass"},"type":"Feature","geometry":{"type":"Point","coordinates":[-149.37111,60.48691]}},{"properties":{"latitude":29.8736946,"column_5":1,"date":{"end_time":"1994/12/26 00:00:00 -0500","original":"12/25/1994","granularity":"day","time":"1994/12/25 00:00:00 -0500"},"longitude":-98.4859303,"id":"adv9lsunphw0","location":"Guadalupe River SP (HOTE 077)"},"type":"Feature","geometry":{"type":"Point","coordinates":[-98.4859303,29.8736946]}},{"properties":{"latitude":30.5035242,"column_5":1,"date":{"end_time":"1994/12/27 00:00:00 -0500","original":"12/26/1994","granularity":"day","time":"1994/12/26 00:00:00 -0500"},"longitude":-98.8157129,"id":"adv9lsrlq683","location":"Enchanted Rock SNA (Llano Co.)"},"type":"Feature","geometry":{"type":"Point","coordinates":[-98.8157129,30.5035242]}},{"properties":{"latitude":27.5330653,"column_5":1,"date":{"end_time":"1994/12/30 00:00:00 -0500","original":"12/29/1994","granularity":"day","time":"1994/12/29 00:00:00 -0500"},"longitude":-97.2612891,"id":"adv9lt1p5bfj","location":"Padre Isl. NS (Kleberg Co.) (CTC 063)"},"type":"Feature","geometry":{"type":"Point","coordinates":[-97.2612891,27.5330653]}},{"properties":{"latitude":48.4001123,"column_5":1,"date":{"end_time":"1995/08/11 00:00:00 -0400","original":"8/10/1995","granularity":"day","time":"1995/08/10 00:00:00 -0400"},"longitude":-107.6513472,"id":"adv9lt4yw104","location":"Bowdoin NWR"},"type":"Feature","geometry":{"type":"Point","coordinates":[-107.6513472,48.4001123]}},{"properties":{"latitude":34.52,"column_5":1,"date":{"end_time":"1996/04/01 00:00:00 -0500","original":"3/31/1996","granularity":"day","time":"1996/03/31 00:00:00 -0500"},"longitude":-86.94,"id":"adv9lsv995r3","location":"Wheeler NWR"},"type":"Feature","geometry":{"type":"Point","coordinates":[-86.94,34.52]}},{"properties":{"latitude":30.3111382,"column_5":1,"date":{"end_time":"1996/04/02 00:00:00 -0500","original":"4/1/1996","granularity":"day","time":"1996/04/01 00:00:00 -0500"},"longitude":-84.3456192,"id":"adv9lt1qa2wo","location":"Leon Sinks Geological Area"},"type":"Feature","geometry":{"type":"Point","coordinates":[-84.3456192,30.3111382]}},{"properties":{"latitude":30.3636608,"column_5":1,"date":{"end_time":"1996/04/02 00:00:00 -0500","original":"4/1/1996","granularity":"day","time":"1996/04/01 00:00:00 -0500"},"longitude":-84.3819351,"id":"adv9lt0f4ip0","location":"Apalachicola NF--Lost Lake Recreation Area"},"type":"Feature","geometry":{"type":"Point","coordinates":[-84.3819351,30.3636608]}},{"properties":{"latitude":30.1071,"column_5":1,"date":{"end_time":"1996/04/03 00:00:00 -0500","original":"4/2/1996","granularity":"day","time":"1996/04/02 00:00:00 -0500"},"longitude":-84.1408,"id":"adv9lsztjny4","location":"St. Marks NWR"},"type":"Feature","geometry":{"type":"Point","coordinates":[-84.1408,30.1071]}},{"properties":{"latitude":30.2335,"column_5":1,"date":{"end_time":"1996/04/03 00:00:00 -0500","original":"4/2/1996","granularity":"day","time":"1996/04/02 00:00:00 -0500"},"longitude":-84.3037,"id":"adv9lss33eni","location":"Wakulla Springs SP"},"type":"Feature","geometry":{"type":"Point","coordinates":[-84.3037,30.2335]}},{"properties":{"latitude":30.084121,"column_5":1,"date":{"end_time":"1996/04/04 00:00:00 -0500","original":"4/3/1996","granularity":"day","time":"1996/04/03 00:00:00 -0500"},"longitude":-85.6333289,"id":"adv9lsz5oswg","location":"Tyndall AFB"},"type":"Feature","geometry":{"type":"Point","coordinates":[-85.6333289,30.084121]}},{"properties":{"latitude":28.1922058,"column_5":1,"date":{"end_time":"1996/06/12 00:00:00 -0400","original":"6/11/1996","granularity":"day","time":"1996/06/11 00:00:00 -0400"},"longitude":-82.7866387,"id":"adv9lt51439r","location":"Anclote Gulf County Park"},"type":"Feature","geometry":{"type":"Point","coordinates":[-82.7866387,28.1922058]}},{"properties":{"latitude":28.0706,"column_5":1,"date":{"end_time":"1996/06/12 00:00:00 -0400","original":"6/11/1996","granularity":"day","time":"1996/06/11 00:00:00 -0400"},"longitude":-82.8314,"id":"adv9lt3qenqh","location":"Honeymoon Island SP"},"type":"Feature","geometry":{"type":"Point","coordinates":[-82.8314,28.0706]}},{"properties":{"latitude":29.1092685,"column_5":1,"date":{"end_time":"1996/06/13 00:00:00 -0400","original":"6/12/1996","granularity":"day","time":"1996/06/12 00:00:00 -0400"},"longitude":-81.3752445,"id":"adv9lszhmt4k","location":"Lake Woodruff NWR"},"type":"Feature","geometry":{"type":"Point","coordinates":[-81.3752445,29.1092685]}},{"properties":{"latitude":27.928,"column_5":1,"date":{"end_time":"1996/06/14 00:00:00 -0400","original":"6/13/1996","granularity":"day","time":"1996/06/13 00:00:00 -0400"},"longitude":-81.3647,"id":"adv9lss2x5y3","location":"Lake Kissimmee SP"},"type":"Feature","geometry":{"type":"Point","coordinates":[-81.3647,27.928]}},{"properties":{"latitude":27.6786636,"column_5":1,"date":{"end_time":"1996/06/16 00:00:00 -0400","original":"6/15/1996","granularity":"day","time":"1996/06/15 00:00:00 -0400"},"longitude":-81.2943649,"id":"adv9lt3mlvjg","location":"Avon Park AFR (Polk Co.)"},"type":"Feature","geometry":{"type":"Point","coordinates":[-81.2943649,27.6786636]}},{"properties":{"latitude":27.7299,"column_5":1,"date":{"end_time":"1996/06/17 00:00:00 -0400","original":"6/16/1996","granularity":"day","time":"1996/06/16 00:00:00 -0400"},"longitude":-82.6541,"id":"adv9lt66axts","location":"Boyd Hill Nature Park"},"type":"Feature","geometry":{"type":"Point","coordinates":[-82.6541,27.7299]}},{"properties":{"latitude":43.5555151,"column_5":1,"date":{"end_time":"1997/08/03 00:00:00 -0400","original":"8/2/1997","granularity":"day","time":"1997/08/02 00:00:00 -0400"},"longitude":-88.6301422,"id":"adv9lt1uh78i","location":"Horicon Marsh--General"},"type":"Feature","geometry":{"type":"Point","coordinates":[-88.6301422,43.5555151]}},{"properties":{"latitude":45.23046,"column_5":1,"date":{"end_time":"1997/08/04 00:00:00 -0400","original":"8/3/1997","granularity":"day","time":"1997/08/03 00:00:00 -0400"},"longitude":-86.99683,"id":"adv9lsw8hpi4","location":"Newport SP"},"type":"Feature","geometry":{"type":"Point","coordinates":[-86.99683,45.23046]}},{"properties":{"latitude":45.07171,"column_5":1,"date":{"end_time":"1997/08/05 00:00:00 -0400","original":"8/4/1997","granularity":"day","time":"1997/08/04 00:00:00 -0400"},"longitude":-87.10943,"id":"adv9lszu5yyv","location":"Ridges Sanctuary"},"type":"Feature","geometry":{"type":"Point","coordinates":[-87.10943,45.07171]}},{"properties":{"latitude":44.597,"column_5":1,"date":{"end_time":"1997/08/06 00:00:00 -0400","original":"8/5/1997","granularity":"day","time":"1997/08/05 00:00:00 -0400"},"longitude":-88.0293,"id":"adv9lt50tjgi","location":"L. H. Barkhausen Waterfowl Preserve"},"type":"Feature","geometry":{"type":"Point","coordinates":[-88.0293,44.597]}},{"properties":{"latitude":46.59244,"column_5":1,"date":{"end_time":"1997/08/07 00:00:00 -0400","original":"8/6/1997","granularity":"day","time":"1997/08/06 00:00:00 -0400"},"longitude":-90.88379,"id":"adv9lsyf7ggd","location":"Ashland"},"type":"Feature","geometry":{"type":"Point","coordinates":[-90.88379,46.59244]}},{"properties":{"latitude":46.050326,"column_5":1,"date":{"end_time":"1997/08/07 00:00:00 -0400","original":"8/6/1997","granularity":"day","time":"1997/08/06 00:00:00 -0400"},"longitude":-89.6512891,"id":"adv9lswpzkx2","location":"Northern Highland-American Legion SF--Vilas Co."},"type":"Feature","geometry":{"type":"Point","coordinates":[-89.6512891,46.050326]}},{"properties":{"latitude":44.0786372,"column_5":1,"date":{"end_time":"1997/08/08 00:00:00 -0400","original":"8/7/1997","granularity":"day","time":"1997/08/07 00:00:00 -0400"},"longitude":-90.173705,"id":"adv9lsvw749w","location":"Necedah NWR"},"type":"Feature","geometry":{"type":"Point","coordinates":[-90.173705,44.0786372]}},{"properties":{"latitude":46.614754,"column_5":1,"date":{"end_time":"1997/08/09 00:00:00 -0400","original":"8/8/1997","granularity":"day","time":"1997/08/08 00:00:00 -0400"},"longitude":-91.246544,"id":"adv9lst0lzcx","location":"WI: Chequamegon NF"},"type":"Feature","geometry":{"type":"Point","coordinates":[-91.246544,46.614754]}},{"properties":{"latitude":46.8563375,"column_5":1,"date":{"end_time":"1997/08/10 00:00:00 -0400","original":"8/9/1997","granularity":"day","time":"1997/08/09 00:00:00 -0400"},"longitude":-90.6177323,"id":"adv9lsy45rms","location":"Madeline Island"},"type":"Feature","geometry":{"type":"Point","coordinates":[-90.6177323,46.8563375]}},{"properties":{"latitude":45.842964,"column_5":1,"date":{"end_time":"1997/08/11 00:00:00 -0400","original":"8/10/1997","granularity":"day","time":"1997/08/10 00:00:00 -0400"},"longitude":-92.62031,"id":"adv9lsuafopj","location":"Crex Meadows SWA"},"type":"Feature","geometry":{"type":"Point","coordinates":[-92.62031,45.842964]}},{"properties":{"latitude":25.1416,"column_5":1,"date":{"end_time":"1997/12/23 00:00:00 -0500","original":"12/22/1997","granularity":"day","time":"1997/12/22 00:00:00 -0500"},"longitude":-80.9255,"id":"adv9lss8370q","location":"Everglades NP--Flamingo"},"type":"Feature","geometry":{"type":"Point","coordinates":[-80.9255,25.1416]}},{"properties":{"latitude":25.44789,"column_5":1,"date":{"end_time":"1997/12/24 00:00:00 -0500","original":"12/23/1997","granularity":"day","time":"1997/12/23 00:00:00 -0500"},"longitude":-80.47918,"id":"adv9lt4zkfhk","location":"Florida City"},"type":"Feature","geometry":{"type":"Point","coordinates":[-80.47918,25.44789]}},{"properties":{"latitude":25.1876968,"column_5":1,"date":{"end_time":"1997/12/25 00:00:00 -0500","original":"12/24/1997","granularity":"day","time":"1997/12/24 00:00:00 -0500"},"longitude":-80.8741825,"id":"adv9lt0ci813","location":"Everglades NP--Snake Bight Trail"},"type":"Feature","geometry":{"type":"Point","coordinates":[-80.8741825,25.1876968]}},{"properties":{"latitude":25.3316,"column_5":1,"date":{"end_time":"1997/12/26 00:00:00 -0500","original":"12/25/1997","granularity":"day","time":"1997/12/25 00:00:00 -0500"},"longitude":-80.7945,"id":"adv9lt3jowtp","location":"Everglades NP"},"type":"Feature","geometry":{"type":"Point","coordinates":[-80.7945,25.3316]}},{"properties":{"latitude":25.1280556,"column_5":1,"date":{"end_time":"1997/12/27 00:00:00 -0500","original":"12/26/1997","granularity":"day","time":"1997/12/26 00:00:00 -0500"},"longitude":-80.41,"id":"adv9lt5rftlf","location":"John Pennekamp Coral Reef SP"},"type":"Feature","geometry":{"type":"Point","coordinates":[-80.41,25.1280556]}},{"properties":{"latitude":24.6664,"column_5":1,"date":{"end_time":"1997/12/28 00:00:00 -0500","original":"12/27/1997","granularity":"day","time":"1997/12/27 00:00:00 -0500"},"longitude":-81.2611,"id":"adv9lt4exizc","location":"Bahia Honda SP"},"type":"Feature","geometry":{"type":"Point","coordinates":[-81.2611,24.6664]}},{"properties":{"latitude":24.7449,"column_5":1,"date":{"end_time":"1997/12/28 00:00:00 -0500","original":"12/27/1997","granularity":"day","time":"1997/12/27 00:00:00 -0500"},"longitude":-81.4225,"id":"adv9lsur4z58","location":"National Key Deer NWR"},"type":"Feature","geometry":{"type":"Point","coordinates":[-81.4225,24.7449]}},{"properties":{"latitude":25.759737,"column_5":1,"date":{"end_time":"1997/12/30 00:00:00 -0500","original":"12/29/1997","granularity":"day","time":"1997/12/29 00:00:00 -0500"},"longitude":-80.76597,"id":"adv9lstjoja3","location":"Everglades NP--Shark Valley Visitor Center"},"type":"Feature","geometry":{"type":"Point","coordinates":[-80.76597,25.759737]}},{"properties":{"latitude":26.3746846,"column_5":1,"date":{"end_time":"1997/12/31 00:00:00 -0500","original":"12/30/1997","granularity":"day","time":"1997/12/30 00:00:00 -0500"},"longitude":-81.6035485,"id":"adv9lt4ah77k","location":"Corkscrew Swamp Sanctuary"},"type":"Feature","geometry":{"type":"Point","coordinates":[-81.6035485,26.3746846]}},{"properties":{"latitude":26.0276433,"column_5":1,"date":{"end_time":"1997/12/31 00:00:00 -0500","original":"12/30/1997","granularity":"day","time":"1997/12/30 00:00:00 -0500"},"longitude":-81.7273622,"id":"adv9lsutq8cf","location":"Briggs Nature Center"},"type":"Feature","geometry":{"type":"Point","coordinates":[-81.7273622,26.0276433]}},{"properties":{"latitude":26.4595,"column_5":1,"date":{"end_time":"1998/01/01 00:00:00 -0500","original":"12/31/1997","granularity":"day","time":"1997/12/31 00:00:00 -0500"},"longitude":-82.1154,"id":"adv9lswyzif2","location":"J. N. Ding Darling NWR"},"type":"Feature","geometry":{"type":"Point","coordinates":[-82.1154,26.4595]}},{"properties":{"latitude":26.5720999,"column_5":1,"date":{"end_time":"1998/01/02 00:00:00 -0500","original":"1/1/1998","granularity":"day","time":"1998/01/01 00:00:00 -0500"},"longitude":-81.8247154,"id":"adv9lt4ax81y","location":"Six Mile Cypress Slough Preserve"},"type":"Feature","geometry":{"type":"Point","coordinates":[-81.8247154,26.5720999]}},{"properties":{"latitude":39.7019579,"column_5":1,"date":{"end_time":"1998/04/11 00:00:00 -0400","original":"4/10/1998","granularity":"day","time":"1998/04/10 00:00:00 -0400"},"longitude":-93.3107237,"id":"adv9lsxjr8gw","location":"Fountain Grove CA"},"type":"Feature","geometry":{"type":"Point","coordinates":[-93.3107237,39.7019579]}},{"properties":{"latitude":39.613988,"column_5":1,"date":{"end_time":"1998/04/12 00:00:00 -0400","original":"4/11/1998","granularity":"day","time":"1998/04/11 00:00:00 -0400"},"longitude":-93.2222444,"id":"adv9lt0arvow","location":"Swan Lake NWR"},"type":"Feature","geometry":{"type":"Point","coordinates":[-93.2222444,39.613988]}},{"properties":{"latitude":37.6343663,"column_5":1,"date":{"end_time":"1998/04/27 00:00:00 -0400","original":"4/26/1998","granularity":"day","time":"1998/04/26 00:00:00 -0400"},"longitude":-89.14678,"id":"adv9lt6jmon7","location":"Little Grassy Lake (Williamson Co.)"},"type":"Feature","geometry":{"type":"Point","coordinates":[-89.14678,37.6343663]}},{"properties":{"latitude":37.6164386,"column_5":1,"date":{"end_time":"1998/04/27 00:00:00 -0400","original":"4/26/1998","granularity":"day","time":"1998/04/26 00:00:00 -0400"},"longitude":-89.1916921,"id":"adv9lsu1ogsn","location":"Giant City SP"},"type":"Feature","geometry":{"type":"Point","coordinates":[-89.1916921,37.6164386]}},{"properties":{"latitude":32.3689293,"column_5":1,"date":{"end_time":"1998/06/02 00:00:00 -0400","original":"6/1/1998","granularity":"day","time":"1998/06/01 00:00:00 -0400"},"longitude":-112.8648745,"id":"adv9lss1a6wy","location":"AZ: Ajo--Guest House Inn"},"type":"Feature","geometry":{"type":"Point","coordinates":[-112.8648745,32.3689293]}},{"properties":{"latitude":32.1769218,"column_5":1,"date":{"end_time":"1998/06/11 00:00:00 -0400","original":"6/10/1998","granularity":"day","time":"1998/06/10 00:00:00 -0400"},"longitude":-104.4373627,"id":"adv9lt1jbhfr","location":"Carlsbad Caverns NP -- Cavern Entrance"},"type":"Feature","geometry":{"type":"Point","coordinates":[-104.4373627,32.1769218]}},{"properties":{"latitude":32.1091003,"column_5":1,"date":{"end_time":"1998/06/11 00:00:00 -0400","original":"6/10/1998","granularity":"day","time":"1998/06/10 00:00:00 -0400"},"longitude":-104.4710999,"id":"adv9lt0y2i10","location":"Carlsbad Caverns NP -- Rattlesnake Springs"},"type":"Feature","geometry":{"type":"Point","coordinates":[-104.4710999,32.1091003]}},{"properties":{"latitude":31.9860597,"column_5":1,"date":{"end_time":"1998/06/11 00:00:00 -0400","original":"6/10/1998","granularity":"day","time":"1998/06/10 00:00:00 -0400"},"longitude":-104.7691626,"id":"adv9lstae79g","location":"Guadalupe Mountains NP--McKittrick Canyon (FWTX 17)"},"type":"Feature","geometry":{"type":"Point","coordinates":[-104.7691626,31.9860597]}},{"properties":{"latitude":33.4467359,"column_5":1,"date":{"end_time":"1998/06/13 00:00:00 -0400","original":"6/12/1998","granularity":"day","time":"1998/06/12 00:00:00 -0400"},"longitude":-104.4049001,"id":"adv9lszlq95e","location":"Bitter Lake NWR"},"type":"Feature","geometry":{"type":"Point","coordinates":[-104.4049001,33.4467359]}},{"properties":{"latitude":35.0640148,"column_5":1,"date":{"end_time":"1998/06/15 00:00:00 -0400","original":"6/14/1998","granularity":"day","time":"1998/06/14 00:00:00 -0400"},"longitude":-109.7847412,"id":"adv9lt66thh0","location":"Petrified Forest NP"},"type":"Feature","geometry":{"type":"Point","coordinates":[-109.7847412,35.0640148]}},{"properties":{"latitude":36.0575541,"column_5":1,"date":{"end_time":"1998/06/17 00:00:00 -0400","original":"6/16/1998","granularity":"day","time":"1998/06/16 00:00:00 -0400"},"longitude":-112.1677308,"id":"adv9lt1s8p74","location":"Grand Canyon NP--South Rim"},"type":"Feature","geometry":{"type":"Point","coordinates":[-112.1677308,36.0575541]}},{"properties":{"latitude":34.816,"column_5":1,"date":{"end_time":"1998/06/18 00:00:00 -0400","original":"6/17/1998","granularity":"day","time":"1998/06/17 00:00:00 -0400"},"longitude":-111.828,"id":"adv9lsz6eooo","location":"Red Rock SP"},"type":"Feature","geometry":{"type":"Point","coordinates":[-111.828,34.816]}},{"properties":{"latitude":26.1787023,"column_5":1,"date":{"end_time":"1998/12/26 00:00:00 -0500","original":"12/25/1998","granularity":"day","time":"1998/12/25 00:00:00 -0500"},"longitude":-98.3860016,"id":"adv9lt4athch","location":"Bentsen-Rio Grande Val. SP WBC (Mission) (LTC 069)"},"type":"Feature","geometry":{"type":"Point","coordinates":[-98.3860016,26.1787023]}},{"properties":{"latitude":25.8519631,"column_5":1,"date":{"end_time":"1998/12/27 00:00:00 -0500","original":"12/26/1998","granularity":"day","time":"1998/12/26 00:00:00 -0500"},"longitude":-97.4211788,"id":"adv9lswzth09","location":"Sabal Palm Sanctuary (LTC 042)"},"type":"Feature","geometry":{"type":"Point","coordinates":[-97.4211788,25.8519631]}},{"properties":{"latitude":26.02528,"column_5":1,"date":{"end_time":"1998/12/27 00:00:00 -0500","original":"12/26/1998","granularity":"day","time":"1998/12/26 00:00:00 -0500"},"longitude":-98.17306,"id":"adv9lstjiesd","location":"Alacranes"},"type":"Feature","geometry":{"type":"Point","coordinates":[-98.17306,26.02528]}},{"properties":{"latitude":42.64628,"column_5":1,"date":{"end_time":"1999/07/01 00:00:00 -0400","original":"6/30/1999","granularity":"day","time":"1999/06/30 00:00:00 -0400"},"longitude":-88.13607,"id":"adv9lt76x8z0","location":"Richard Bong SRA"},"type":"Feature","geometry":{"type":"Point","coordinates":[-88.13607,42.64628]}},{"properties":{"latitude":46.4502639,"column_5":1,"date":{"end_time":"1999/07/02 00:00:00 -0400","original":"7/1/1999","granularity":"day","time":"1999/07/01 00:00:00 -0400"},"longitude":-86.60265,"id":"adv9lszrdby4","location":"MI: Pictured Rocks NL--Sand Point"},"type":"Feature","geometry":{"type":"Point","coordinates":[-86.60265,46.4502639]}},{"properties":{"latitude":46.3933292,"column_5":1,"date":{"end_time":"1999/07/03 00:00:00 -0400","original":"7/2/1999","granularity":"day","time":"1999/07/02 00:00:00 -0400"},"longitude":-86.8332666,"id":"adv9lt35xd17","location":"Au Train--Songbird Trail"},"type":"Feature","geometry":{"type":"Point","coordinates":[-86.8332666,46.3933292]}},{"properties":{"latitude":46.8093262,"column_5":1,"date":{"end_time":"1999/07/08 00:00:00 -0400","original":"7/7/1999","granularity":"day","time":"1999/07/07 00:00:00 -0400"},"longitude":-89.7502479,"id":"adv9lsva8s8t","location":"Porcupine Mountains Wilderness SP (Ontonagon Co.)"},"type":"Feature","geometry":{"type":"Point","coordinates":[-89.7502479,46.8093262]}},{"properties":{"latitude":32.3382984,"column_5":1,"date":{"end_time":"1999/07/22 00:00:00 -0400","original":"7/21/1999","granularity":"day","time":"1999/07/21 00:00:00 -0400"},"longitude":-110.9804286,"id":"adv9lswzp3i3","location":"Tohono Chul Park"},"type":"Feature","geometry":{"type":"Point","coordinates":[-110.9804286,32.3382984]}},{"properties":{"latitude":31.9204006,"column_5":1,"date":{"end_time":"1999/07/25 00:00:00 -0400","original":"7/24/1999","granularity":"day","time":"1999/07/24 00:00:00 -0400"},"longitude":-109.1275024,"id":"adv9lt14nmcf","location":"Portal--Big Thicket"},"type":"Feature","geometry":{"type":"Point","coordinates":[-109.1275024,31.9204006]}},{"properties":{"latitude":31.4521999,"column_5":1,"date":{"end_time":"1999/07/31 00:00:00 -0400","original":"7/30/1999","granularity":"day","time":"1999/07/30 00:00:00 -0400"},"longitude":-110.3761978,"id":"adv9lt6u52be","location":"Sawmill Canyon"},"type":"Feature","geometry":{"type":"Point","coordinates":[-110.3761978,31.4521999]}},{"properties":{"latitude":10.168,"column_5":1,"date":{"end_time":"2000/02/21 00:00:00 -0500","original":"2/20/2000","granularity":"day","time":"2000/02/20 00:00:00 -0500"},"longitude":-84.921,"id":"adv9lsyc1m8m","location":"CR: Rancho Hannia Restaurant"},"type":"Feature","geometry":{"type":"Point","coordinates":[-84.921,10.168]}},{"properties":{"latitude":10.0875158,"column_5":1,"date":{"end_time":"2000/02/21 00:00:00 -0500","original":"2/20/2000","granularity":"day","time":"2000/02/20 00:00:00 -0500"},"longitude":-84.3434143,"id":"adv9lssd85y7","location":"CR: Sarchi"},"type":"Feature","geometry":{"type":"Point","coordinates":[-84.3434143,10.0875158]}},{"properties":{"latitude":10.353,"column_5":1,"date":{"end_time":"2000/02/23 00:00:00 -0500","original":"2/22/2000","granularity":"day","time":"2000/02/22 00:00:00 -0500"},"longitude":-84.8,"id":"adv9lstx3zi1","location":"CR: Monteverde Sky Walk"},"type":"Feature","geometry":{"type":"Point","coordinates":[-84.8,10.353]}},{"properties":{"latitude":10.309,"column_5":1,"date":{"end_time":"2000/02/23 00:00:00 -0500","original":"2/22/2000","granularity":"day","time":"2000/02/22 00:00:00 -0500"},"longitude":-84.816,"id":"adv9lt3pat0w","location":"CR: Children's Eternal Rainforest"},"type":"Feature","geometry":{"type":"Point","coordinates":[-84.816,10.309]}},{"properties":{"latitude":10.317,"column_5":1,"date":{"end_time":"2000/02/23 00:00:00 -0500","original":"2/22/2000","granularity":"day","time":"2000/02/22 00:00:00 -0500"},"longitude":-84.824,"id":"adv9lssztyj7","location":"CR: Santa Elena"},"type":"Feature","geometry":{"type":"Point","coordinates":[-84.824,10.317]}},{"properties":{"latitude":10.506,"column_5":1,"date":{"end_time":"2000/02/24 00:00:00 -0500","original":"2/23/2000","granularity":"day","time":"2000/02/23 00:00:00 -0500"},"longitude":-84.883,"id":"adv9lsrpv2uh","location":"CR: Lago de Arenal"},"type":"Feature","geometry":{"type":"Point","coordinates":[-84.883,10.506]}},{"properties":{"latitude":10.47,"column_5":1,"date":{"end_time":"2000/02/24 00:00:00 -0500","original":"2/23/2000","granularity":"day","time":"2000/02/23 00:00:00 -0500"},"longitude":-84.968,"id":"adv9lsv6r8yu","location":"CR: Tiliran"},"type":"Feature","geometry":{"type":"Point","coordinates":[-84.968,10.47]}},{"properties":{"latitude":10.4711853,"column_5":1,"date":{"end_time":"2000/02/25 00:00:00 -0500","original":"2/24/2000","granularity":"day","time":"2000/02/24 00:00:00 -0500"},"longitude":-84.6449375,"id":"adv9lsudzdsg","location":"CR: La Fortuna"},"type":"Feature","geometry":{"type":"Point","coordinates":[-84.6449375,10.4711853]}},{"properties":{"latitude":10.4391955,"column_5":1,"date":{"end_time":"2000/02/25 00:00:00 -0500","original":"2/24/2000","granularity":"day","time":"2000/02/24 00:00:00 -0500"},"longitude":-84.6663094,"id":"adv9lsrha1cv","location":"CR: La Fortuna Falls"},"type":"Feature","geometry":{"type":"Point","coordinates":[-84.6663094,10.4391955]}},{"properties":{"latitude":10.3781611,"column_5":1,"date":{"end_time":"2000/02/26 00:00:00 -0500","original":"2/25/2000","granularity":"day","time":"2000/02/25 00:00:00 -0500"},"longitude":-84.2080593,"id":"adv9lss5c2h6","location":"CR: Venecia"},"type":"Feature","geometry":{"type":"Point","coordinates":[-84.2080593,10.3781611]}},{"properties":{"latitude":10.4516,"column_5":1,"date":{"end_time":"2000/02/26 00:00:00 -0500","original":"2/25/2000","granularity":"day","time":"2000/02/25 00:00:00 -0500"},"longitude":-84.1211,"id":"adv9lsw6726z","location":"La Quinta de Sarapiqu Lodge"},"type":"Feature","geometry":{"type":"Point","coordinates":[-84.1211,10.4516]}},{"properties":{"latitude":10.4512659,"column_5":1,"date":{"end_time":"2000/02/27 00:00:00 -0500","original":"2/26/2000","granularity":"day","time":"2000/02/26 00:00:00 -0500"},"longitude":-84.0099621,"id":"adv9lt3jjwes","location":"CR: Puerto Viejo de Sarapiqui"},"type":"Feature","geometry":{"type":"Point","coordinates":[-84.0099621,10.4512659]}},{"properties":{"latitude":10.4288,"column_5":1,"date":{"end_time":"2000/02/28 00:00:00 -0500","original":"2/27/2000","granularity":"day","time":"2000/02/27 00:00:00 -0500"},"longitude":-84.0128,"id":"adv9lsulib6d","location":"La Selva (OTS Reserve)"},"type":"Feature","geometry":{"type":"Point","coordinates":[-84.0128,10.4288]}},{"properties":{"latitude":10.4265338,"column_5":1,"date":{"end_time":"2000/02/28 00:00:00 -0500","original":"2/27/2000","granularity":"day","time":"2000/02/27 00:00:00 -0500"},"longitude":-84.1181946,"id":"adv9lt4bk6qs","location":"CR: Rio Sarapiqui--whitewater rafting"},"type":"Feature","geometry":{"type":"Point","coordinates":[-84.1181946,10.4265338]}},{"properties":{"latitude":38.1769,"column_5":1,"date":{"end_time":"2000/05/24 00:00:00 -0400","original":"5/23/2000","granularity":"day","time":"2000/05/23 00:00:00 -0400"},"longitude":-98.5259,"id":"adv9lt0gvb0h","location":"Quivira NWR"},"type":"Feature","geometry":{"type":"Point","coordinates":[-98.5259,38.1769]}},{"properties":{"latitude":37.4675011,"column_5":1,"date":{"end_time":"2000/06/04 00:00:00 -0400","original":"6/3/2000","granularity":"day","time":"2000/06/03 00:00:00 -0400"},"longitude":-94.2119694,"id":"adv9lsv9izi3","location":"Treaty Line Prairie CA"},"type":"Feature","geometry":{"type":"Point","coordinates":[-94.2119694,37.4675011]}},{"properties":{"latitude":37.3091865,"column_5":1,"date":{"end_time":"2000/06/04 00:00:00 -0400","original":"6/3/2000","granularity":"day","time":"2000/06/03 00:00:00 -0400"},"longitude":-94.5967527,"id":"adv9lt6dos46","location":"Wha-sha-she Prairie"},"type":"Feature","geometry":{"type":"Point","coordinates":[-94.5967527,37.3091865]}},{"properties":{"latitude":37.5172109,"column_5":1,"date":{"end_time":"2000/06/05 00:00:00 -0400","original":"6/4/2000","granularity":"day","time":"2000/06/04 00:00:00 -0400"},"longitude":-94.5502686,"id":"adv9lsxvs193","location":"Prairie SP"},"type":"Feature","geometry":{"type":"Point","coordinates":[-94.5502686,37.5172109]}},{"properties":{"latitude":46.2451827,"column_5":1,"date":{"end_time":"2001/06/13 00:00:00 -0400","original":"6/12/2001","granularity":"day","time":"2001/06/12 00:00:00 -0400"},"longitude":-122.090495,"id":"adv9lswi8dc3","location":"Mount St. Helen's NM"},"type":"Feature","geometry":{"type":"Point","coordinates":[-122.090495,46.2451827]}},{"properties":{"latitude":47.978072,"column_5":1,"date":{"end_time":"2001/07/02 00:00:00 -0400","original":"7/1/2001","granularity":"day","time":"2001/07/01 00:00:00 -0400"},"longitude":-123.5205743,"id":"adv9lt1szj17","location":"Olympic NP--Hurricane Ridge"},"type":"Feature","geometry":{"type":"Point","coordinates":[-123.5205743,47.978072]}},{"properties":{"latitude":47.8540969,"column_5":1,"date":{"end_time":"2001/07/03 00:00:00 -0400","original":"7/2/2001","granularity":"day","time":"2001/07/02 00:00:00 -0400"},"longitude":-123.9388149,"id":"adv9lt7210jk","location":"Olympic NP--Hoh Rain Forest"},"type":"Feature","geometry":{"type":"Point","coordinates":[-123.9388149,47.8540969]}},{"properties":{"latitude":48.6649236,"column_5":1,"date":{"end_time":"2001/07/04 00:00:00 -0400","original":"7/3/2001","granularity":"day","time":"2001/07/03 00:00:00 -0400"},"longitude":-121.266201,"id":"adv9lsvcvye0","location":"North Cascades NP"},"type":"Feature","geometry":{"type":"Point","coordinates":[-121.266201,48.6649236]}},{"properties":{"latitude":48.11702,"column_5":1,"date":{"end_time":"2001/07/04 00:00:00 -0400","original":"7/3/2001","granularity":"day","time":"2001/07/03 00:00:00 -0400"},"longitude":-122.76028,"id":"adv9lt5n0d0u","location":"Port Townsend"},"type":"Feature","geometry":{"type":"Point","coordinates":[-122.76028,48.11702]}},{"properties":{"latitude":48.3977886,"column_5":1,"date":{"end_time":"2001/07/04 00:00:00 -0400","original":"7/3/2001","granularity":"day","time":"2001/07/03 00:00:00 -0400"},"longitude":-122.6570541,"id":"adv9lsshcuoy","location":"Deception Pass"},"type":"Feature","geometry":{"type":"Point","coordinates":[-122.6570541,48.3977886]}},{"properties":{"latitude":47.58902,"column_5":1,"date":{"end_time":"2001/07/05 00:00:00 -0400","original":"7/4/2001","granularity":"day","time":"2001/07/04 00:00:00 -0400"},"longitude":-119.39275,"id":"adv9lstn53r1","location":"Sun Lakes State Park"},"type":"Feature","geometry":{"type":"Point","coordinates":[-119.39275,47.58902]}},{"properties":{"latitude":43.2654648,"column_5":1,"date":{"end_time":"2001/07/07 00:00:00 -0400","original":"7/6/2001","granularity":"day","time":"2001/07/06 00:00:00 -0400"},"longitude":-118.8440412,"id":"adv9lt5nqclu","location":"Malheur NWR--Headquarters"},"type":"Feature","geometry":{"type":"Point","coordinates":[-118.8440412,43.2654648]}},{"properties":{"latitude":41.9513199,"column_5":1,"date":{"end_time":"2001/07/08 00:00:00 -0400","original":"7/7/2001","granularity":"day","time":"2001/07/07 00:00:00 -0400"},"longitude":-121.6845703,"id":"adv9lssk700p","location":"Lower Klamath NWR (CA side)"},"type":"Feature","geometry":{"type":"Point","coordinates":[-121.6845703,41.9513199]}},{"properties":{"latitude":41.7141347,"column_5":1,"date":{"end_time":"2001/07/08 00:00:00 -0400","original":"7/7/2001","granularity":"day","time":"2001/07/07 00:00:00 -0400"},"longitude":-121.5111723,"id":"adv9lsy09gm1","location":"Lava Beds NM"},"type":"Feature","geometry":{"type":"Point","coordinates":[-121.5111723,41.7141347]}},{"properties":{"latitude":41.9910331,"column_5":1,"date":{"end_time":"2001/07/09 00:00:00 -0400","original":"7/8/2001","granularity":"day","time":"2001/07/08 00:00:00 -0400"},"longitude":-122.1896885,"id":"adv9lsrambcj","location":"CA: Klamath River Takeout"},"type":"Feature","geometry":{"type":"Point","coordinates":[-122.1896885,41.9910331]}},{"properties":{"latitude":42.4220019,"column_5":1,"date":{"end_time":"2001/07/10 00:00:00 -0400","original":"7/9/2001","granularity":"day","time":"2001/07/09 00:00:00 -0400"},"longitude":-122.8581762,"id":"adv9lsz9gnga","location":"Denman WMA--Hall Tract Unit"},"type":"Feature","geometry":{"type":"Point","coordinates":[-122.8581762,42.4220019]}},{"properties":{"latitude":43.8364312,"column_5":1,"date":{"end_time":"2001/07/11 00:00:00 -0400","original":"7/10/2001","granularity":"day","time":"2001/07/10 00:00:00 -0400"},"longitude":-124.1630495,"id":"adv9lsreyykq","location":"Oregon Dunes Overlook"},"type":"Feature","geometry":{"type":"Point","coordinates":[-124.1630495,43.8364312]}},{"properties":{"latitude":44.2648878,"column_5":1,"date":{"end_time":"2001/07/11 00:00:00 -0400","original":"7/10/2001","granularity":"day","time":"2001/07/10 00:00:00 -0400"},"longitude":-124.1079783,"id":"adv9lst19y10","location":"Neptune SP"},"type":"Feature","geometry":{"type":"Point","coordinates":[-124.1079783,44.2648878]}},{"properties":{"latitude":44.1372626,"column_5":1,"date":{"end_time":"2001/07/11 00:00:00 -0400","original":"7/10/2001","granularity":"day","time":"2001/07/10 00:00:00 -0400"},"longitude":-124.1278589,"id":"adv9lsr3kmx9","location":"Devils Elbow SP"},"type":"Feature","geometry":{"type":"Point","coordinates":[-124.1278589,44.1372626]}},{"properties":{"latitude":44.6768624,"column_5":1,"date":{"end_time":"2001/07/11 00:00:00 -0400","original":"7/10/2001","granularity":"day","time":"2001/07/10 00:00:00 -0400"},"longitude":-124.0788388,"id":"adv9lt6w5nwn","location":"Yaquina Head Lighthouse"},"type":"Feature","geometry":{"type":"Point","coordinates":[-124.0788388,44.6768624]}},{"properties":{"latitude":45.4878795,"column_5":1,"date":{"end_time":"2001/07/11 00:00:00 -0400","original":"7/10/2001","granularity":"day","time":"2001/07/10 00:00:00 -0400"},"longitude":-123.9678597,"id":"adv9lszvyqzc","location":"Cape Meares SP"},"type":"Feature","geometry":{"type":"Point","coordinates":[-123.9678597,45.4878795]}},{"properties":{"latitude":46.2302,"column_5":1,"date":{"end_time":"2001/07/12 00:00:00 -0400","original":"7/11/2001","granularity":"day","time":"2001/07/11 00:00:00 -0400"},"longitude":-124.003624,"id":"adv9lsusf55v","location":"Fort Stevens SP"},"type":"Feature","geometry":{"type":"Point","coordinates":[-124.003624,46.2302]}},{"properties":{"latitude":46.2682069,"column_5":1,"date":{"end_time":"2001/07/12 00:00:00 -0400","original":"7/11/2001","granularity":"day","time":"2001/07/11 00:00:00 -0400"},"longitude":-124.0796438,"id":"adv9lt0wkoz2","location":"Lewis and Clark NHP--North Jetty Columbia River"},"type":"Feature","geometry":{"type":"Point","coordinates":[-124.0796438,46.2682069]}},{"properties":{"latitude":46.8503299,"column_5":1,"date":{"end_time":"2001/07/14 00:00:00 -0400","original":"7/13/2001","granularity":"day","time":"2001/07/13 00:00:00 -0400"},"longitude":-121.7524849,"id":"adv9lsvt2doo","location":"Mount Rainier National Park"},"type":"Feature","geometry":{"type":"Point","coordinates":[-121.7524849,46.8503299]}},{"properties":{"latitude":40.5543129,"column_5":1,"date":{"end_time":"2002/07/07 00:00:00 -0400","original":"7/6/2002","granularity":"day","time":"2002/07/06 00:00:00 -0400"},"longitude":-105.1434097,"id":"adv9lszbbh1n","location":"Dixon Reservoir"},"type":"Feature","geometry":{"type":"Point","coordinates":[-105.1434097,40.5543129]}},{"properties":{"latitude":41.4338739,"column_5":1,"date":{"end_time":"2002/07/09 00:00:00 -0400","original":"7/8/2002","granularity":"day","time":"2002/07/08 00:00:00 -0400"},"longitude":-109.339768,"id":"adv9lt68mycz","location":"WY: Rock Springs--Little Firehole Rd."},"type":"Feature","geometry":{"type":"Point","coordinates":[-109.339768,41.4338739]}},{"properties":{"latitude":41.4790338,"column_5":1,"date":{"end_time":"2002/07/10 00:00:00 -0400","original":"7/9/2002","granularity":"day","time":"2002/07/09 00:00:00 -0400"},"longitude":-112.2662611,"id":"adv9lstiz169","location":"Bear River MBR"},"type":"Feature","geometry":{"type":"Point","coordinates":[-112.2662611,41.4790338]}},{"properties":{"latitude":44.1289671,"column_5":1,"date":{"end_time":"2002/07/10 00:00:00 -0400","original":"7/9/2002","granularity":"day","time":"2002/07/09 00:00:00 -0400"},"longitude":-114.9813124,"id":"adv9lt182o8s","location":"Sawtooth Wilderness"},"type":"Feature","geometry":{"type":"Point","coordinates":[-114.9813124,44.1289671]}},{"properties":{"latitude":44.8819306,"column_5":1,"date":{"end_time":"2002/07/15 00:00:00 -0400","original":"7/14/2002","granularity":"day","time":"2002/07/14 00:00:00 -0400"},"longitude":-114.7305686,"id":"adv9lt2534z0","location":"Middle Fork of the Salmon River"},"type":"Feature","geometry":{"type":"Point","coordinates":[-114.7305686,44.8819306]}},{"properties":{"latitude":44.6543226,"column_5":1,"date":{"end_time":"2002/07/17 00:00:00 -0400","original":"7/16/2002","granularity":"day","time":"2002/07/16 00:00:00 -0400"},"longitude":-111.4378007,"id":"adv9lsvec7au","location":"Henry's Lake"},"type":"Feature","geometry":{"type":"Point","coordinates":[-111.4378007,44.6543226]}},{"properties":{"latitude":43.9509896,"column_5":1,"date":{"end_time":"2002/07/17 00:00:00 -0400","original":"7/16/2002","granularity":"day","time":"2002/07/16 00:00:00 -0400"},"longitude":-112.2557731,"id":"adv9lsx1xchr","location":"Camas NWR"},"type":"Feature","geometry":{"type":"Point","coordinates":[-112.2557731,43.9509896]}},{"properties":{"latitude":44.1829878,"column_5":1,"date":{"end_time":"2002/07/17 00:00:00 -0400","original":"7/16/2002","granularity":"day","time":"2002/07/16 00:00:00 -0400"},"longitude":-111.3197362,"id":"adv9lssdtusp","location":"ID: Upper Mesa Falls Campground"},"type":"Feature","geometry":{"type":"Point","coordinates":[-111.3197362,44.1829878]}},{"properties":{"latitude":44.971117,"column_5":1,"date":{"end_time":"2002/07/19 00:00:00 -0400","original":"7/18/2002","granularity":"day","time":"2002/07/18 00:00:00 -0400"},"longitude":-109.4798463,"id":"adv9lt5bcp1x","location":"Beartooth Mtns., Park Co."},"type":"Feature","geometry":{"type":"Point","coordinates":[-109.4798463,44.971117]}},{"properties":{"latitude":44.590762,"column_5":1,"date":{"end_time":"2002/07/20 00:00:00 -0400","original":"7/19/2002","granularity":"day","time":"2002/07/19 00:00:00 -0400"},"longitude":-104.7180517,"id":"adv9lt6bnaxk","location":"Devils Tower NM"},"type":"Feature","geometry":{"type":"Point","coordinates":[-104.7180517,44.590762]}},{"properties":{"latitude":43.1078385,"column_5":1,"date":{"end_time":"2002/07/21 00:00:00 -0400","original":"7/20/2002","granularity":"day","time":"2002/07/20 00:00:00 -0400"},"longitude":-101.5455236,"id":"adv9lt0ahfzz","location":"Lacreek NWR"},"type":"Feature","geometry":{"type":"Point","coordinates":[-101.5455236,43.1078385]}},{"properties":{"latitude":42.4965,"column_5":1,"date":{"end_time":"2002/07/22 00:00:00 -0400","original":"7/21/2002","granularity":"day","time":"2002/07/21 00:00:00 -0400"},"longitude":-100.5317,"id":"adv9lssefhuj","location":"Valentine NWR"},"type":"Feature","geometry":{"type":"Point","coordinates":[-100.5317,42.4965]}},{"properties":{"latitude":40.4412333,"column_5":1,"date":{"end_time":"2002/09/14 00:00:00 -0400","original":"9/13/2002","granularity":"day","time":"2002/09/13 00:00:00 -0400"},"longitude":-91.5511472,"id":"adv9lsu2fq8l","location":"Frost Island CA"},"type":"Feature","geometry":{"type":"Point","coordinates":[-91.5511472,40.4412333]}},{"properties":{"latitude":40.1881583,"column_5":1,"date":{"end_time":"2002/09/15 00:00:00 -0400","original":"9/14/2002","granularity":"day","time":"2002/09/14 00:00:00 -0400"},"longitude":-91.8252222,"id":"adv9lsr3v2xz","location":"Deer Ridge CA"},"type":"Feature","geometry":{"type":"Point","coordinates":[-91.8252222,40.1881583]}},{"properties":{"latitude":42.3641047,"column_5":1,"date":{"end_time":"2003/06/22 00:00:00 -0400","original":"6/21/2003","granularity":"day","time":"2003/06/21 00:00:00 -0400"},"longitude":-71.0123533,"id":"adv9lswewfso","location":"MA: Boston-Logan Intl Airport"},"type":"Feature","geometry":{"type":"Point","coordinates":[-71.0123533,42.3641047]}},{"properties":{"latitude":42.3583984,"column_5":1,"date":{"end_time":"2003/06/23 00:00:00 -0400","original":"6/22/2003","granularity":"day","time":"2003/06/22 00:00:00 -0400"},"longitude":-71.0597992,"id":"adv9lszlyho7","location":"Boston"},"type":"Feature","geometry":{"type":"Point","coordinates":[-71.0597992,42.3583984]}},{"properties":{"latitude":42.2047014,"column_5":1,"date":{"end_time":"2003/06/24 00:00:00 -0400","original":"6/23/2003","granularity":"day","time":"2003/06/23 00:00:00 -0400"},"longitude":-70.7156897,"id":"adv9lsvy7k92","location":"Scituate Lighthouse"},"type":"Feature","geometry":{"type":"Point","coordinates":[-70.7156897,42.2047014]}},{"properties":{"latitude":42.7639008,"column_5":1,"date":{"end_time":"2003/06/25 00:00:00 -0400","original":"6/24/2003","granularity":"day","time":"2003/06/24 00:00:00 -0400"},"longitude":-70.8022995,"id":"adv9lssa5wni","location":"Parker River NWR"},"type":"Feature","geometry":{"type":"Point","coordinates":[-70.8022995,42.7639008]}},{"properties":{"latitude":44.5,"column_5":1,"date":{"end_time":"2003/06/28 00:00:00 -0400","original":"6/27/2003","granularity":"day","time":"2003/06/27 00:00:00 -0400"},"longitude":-67.1027778,"id":"adv9lsqpkt22","location":"Machias Seal Island"},"type":"Feature","geometry":{"type":"Point","coordinates":[-67.1027778,44.5]}},{"properties":{"latitude":44.8624737,"column_5":1,"date":{"end_time":"2003/06/28 00:00:00 -0400","original":"6/27/2003","granularity":"day","time":"2003/06/27 00:00:00 -0400"},"longitude":-66.942046,"id":"adv9lstnqzsx","location":"Roosevelt Campobello International Park"},"type":"Feature","geometry":{"type":"Point","coordinates":[-66.942046,44.8624737]}},{"properties":{"latitude":45.1388635,"column_5":1,"date":{"end_time":"2003/06/29 00:00:00 -0400","original":"6/28/2003","granularity":"day","time":"2003/06/28 00:00:00 -0400"},"longitude":-67.2810268,"id":"adv9lt067miu","location":"Moosehorn NWR--Baring Division"},"type":"Feature","geometry":{"type":"Point","coordinates":[-67.2810268,45.1388635]}},{"properties":{"latitude":44.855993,"column_5":1,"date":{"end_time":"2003/06/29 00:00:00 -0400","original":"6/28/2003","granularity":"day","time":"2003/06/28 00:00:00 -0400"},"longitude":-67.1531386,"id":"adv9lt40rdr8","location":"Cobscook Bay State Park"},"type":"Feature","geometry":{"type":"Point","coordinates":[-67.1531386,44.855993]}},{"properties":{"latitude":45.9754792,"column_5":1,"date":{"end_time":"2003/07/01 00:00:00 -0400","original":"6/30/2003","granularity":"day","time":"2003/06/30 00:00:00 -0400"},"longitude":-68.9351746,"id":"adv9lsz2qew7","location":"Baxter State Park"},"type":"Feature","geometry":{"type":"Point","coordinates":[-68.9351746,45.9754792]}},{"properties":{"latitude":44.169908,"column_5":1,"date":{"end_time":"2003/07/02 00:00:00 -0400","original":"7/1/2003","granularity":"day","time":"2003/07/01 00:00:00 -0400"},"longitude":-71.687409,"id":"adv9lt19la1n","location":"Franconia Notch SP"},"type":"Feature","geometry":{"type":"Point","coordinates":[-71.687409,44.169908]}},{"properties":{"latitude":44.2823538,"column_5":1,"date":{"end_time":"2003/07/04 00:00:00 -0400","original":"7/3/2003","granularity":"day","time":"2003/07/03 00:00:00 -0400"},"longitude":-71.290415,"id":"adv9lsu7buup","location":"Mt. Washington"},"type":"Feature","geometry":{"type":"Point","coordinates":[-71.290415,44.2823538]}},{"properties":{"latitude":44.1150737,"column_5":1,"date":{"end_time":"2003/07/05 00:00:00 -0400","original":"7/4/2003","granularity":"day","time":"2003/07/04 00:00:00 -0400"},"longitude":-71.3561498,"id":"adv9lst1xka0","location":"White Mt. NF--Nancy Pond Trail, Crawford Notch"},"type":"Feature","geometry":{"type":"Point","coordinates":[-71.3561498,44.1150737]}},{"properties":{"latitude":47.6572389,"column_5":1,"date":{"end_time":"2004/02/28 00:00:00 -0500","original":"2/27/2004","granularity":"day","time":"2004/02/27 00:00:00 -0500"},"longitude":-122.3071972,"id":"adv9lt6zwiu0","location":"WA: U of W"},"type":"Feature","geometry":{"type":"Point","coordinates":[-122.3071972,47.6572389]}},{"properties":{"latitude":48.5366132,"column_5":1,"date":{"end_time":"2004/02/29 00:00:00 -0500","original":"2/28/2004","granularity":"day","time":"2004/02/28 00:00:00 -0500"},"longitude":-123.0523682,"id":"adv9lsvypbt0","location":"San Juan Island"},"type":"Feature","geometry":{"type":"Point","coordinates":[-123.0523682,48.5366132]}},{"properties":{"latitude":48.4978566,"column_5":1,"date":{"end_time":"2004/02/29 00:00:00 -0500","original":"2/28/2004","granularity":"day","time":"2004/02/28 00:00:00 -0500"},"longitude":-122.6520219,"id":"adv9lt6ziohx","location":"Anacortes Area"},"type":"Feature","geometry":{"type":"Point","coordinates":[-122.6520219,48.4978566]}},{"properties":{"latitude":48.499429,"column_5":1,"date":{"end_time":"2004/02/29 00:00:00 -0500","original":"2/28/2004","granularity":"day","time":"2004/02/28 00:00:00 -0500"},"longitude":-122.482668,"id":"adv9lt6apg2k","location":"Padilla Bay"},"type":"Feature","geometry":{"type":"Point","coordinates":[-122.482668,48.499429]}},{"properties":{"latitude":30.3374,"column_5":1,"date":{"end_time":"2004/03/17 00:00:00 -0500","original":"3/16/2004","granularity":"day","time":"2004/03/16 00:00:00 -0500"},"longitude":-86.19714,"id":"adv9lsue5zg7","location":"Blue Mountain Beach"},"type":"Feature","geometry":{"type":"Point","coordinates":[-86.19714,30.3374]}},{"properties":{"latitude":30.1151,"column_5":1,"date":{"end_time":"2004/03/18 00:00:00 -0500","original":"3/17/2004","granularity":"day","time":"2004/03/17 00:00:00 -0500"},"longitude":-85.7198,"id":"adv9lst5yrld","location":"St. Andrew State Recreation Area"},"type":"Feature","geometry":{"type":"Point","coordinates":[-85.7198,30.1151]}},{"properties":{"latitude":30.3934994,"column_5":1,"date":{"end_time":"2004/03/19 00:00:00 -0500","original":"3/18/2004","granularity":"day","time":"2004/03/18 00:00:00 -0500"},"longitude":-86.4957504,"id":"adv9lssgjvoj","location":"Destin"},"type":"Feature","geometry":{"type":"Point","coordinates":[-86.4957504,30.3934994]}},{"properties":{"latitude":40.0042101,"column_5":1,"date":{"end_time":"2004/06/11 00:00:00 -0400","original":"6/10/2004","granularity":"day","time":"2004/06/10 00:00:00 -0400"},"longitude":-91.5129917,"id":"adv9lsqvms2h","location":"Wakonda SP"},"type":"Feature","geometry":{"type":"Point","coordinates":[-91.5129917,40.0042101]}},{"properties":{"latitude":66.8898083,"column_5":1,"date":{"end_time":"2004/06/23 00:00:00 -0400","original":"6/22/2004","granularity":"day","time":"2004/06/22 00:00:00 -0400"},"longitude":-162.5955222,"id":"adv9lssz6h4h","location":"AK: Kotzebue"},"type":"Feature","geometry":{"type":"Point","coordinates":[-162.5955222,66.8898083]}},{"properties":{"latitude":64.4955329,"column_5":1,"date":{"end_time":"2004/06/23 00:00:00 -0400","original":"6/22/2004","granularity":"day","time":"2004/06/22 00:00:00 -0400"},"longitude":-165.3870532,"id":"adv9lsxvpetm","location":"AK: Nome--waterfront"},"type":"Feature","geometry":{"type":"Point","coordinates":[-165.3870532,64.4955329]}},{"properties":{"latitude":64.845727,"column_5":1,"date":{"end_time":"2004/06/24 00:00:00 -0400","original":"6/23/2004","granularity":"day","time":"2004/06/23 00:00:00 -0400"},"longitude":-163.7038422,"id":"adv9lssmuwi8","location":"Nome-Council Road"},"type":"Feature","geometry":{"type":"Point","coordinates":[-163.7038422,64.845727]}},{"properties":{"latitude":64.4938,"column_5":1,"date":{"end_time":"2004/06/24 00:00:00 -0400","original":"6/23/2004","granularity":"day","time":"2004/06/23 00:00:00 -0400"},"longitude":-165.3753722,"id":"adv9lst02jr0","location":"AK: Nome"},"type":"Feature","geometry":{"type":"Point","coordinates":[-165.3753722,64.4938]}},{"properties":{"latitude":64.4912815,"column_5":1,"date":{"end_time":"2004/06/24 00:00:00 -0400","original":"6/23/2004","granularity":"day","time":"2004/06/23 00:00:00 -0400"},"longitude":-164.7520065,"id":"adv9lsu2966d","location":"Nome--Safety Sound"},"type":"Feature","geometry":{"type":"Point","coordinates":[-164.7520065,64.4912815]}},{"properties":{"latitude":64.7875103,"column_5":1,"date":{"end_time":"2004/06/25 00:00:00 -0400","original":"6/24/2004","granularity":"day","time":"2004/06/24 00:00:00 -0400"},"longitude":-165.2113724,"id":"adv9lsxbzkrl","location":"Kougarok Road (Nome)"},"type":"Feature","geometry":{"type":"Point","coordinates":[-165.2113724,64.7875103]}},{"properties":{"latitude":64.6344688,"column_5":1,"date":{"end_time":"2004/06/26 00:00:00 -0400","original":"6/25/2004","granularity":"day","time":"2004/06/25 00:00:00 -0400"},"longitude":-165.7150269,"id":"adv9lt0mnnil","location":"Teller Rd. (Nome)"},"type":"Feature","geometry":{"type":"Point","coordinates":[-165.7150269,64.6344688]}},{"properties":{"latitude":64.5238417,"column_5":1,"date":{"end_time":"2004/06/26 00:00:00 -0400","original":"6/25/2004","granularity":"day","time":"2004/06/25 00:00:00 -0400"},"longitude":-165.2812528,"id":"adv9lsw2iz0m","location":"Nome--dump (Beam Rd.)"},"type":"Feature","geometry":{"type":"Point","coordinates":[-165.2812528,64.5238417]}},{"properties":{"latitude":59.7,"column_5":1,"date":{"end_time":"2004/06/28 00:00:00 -0400","original":"6/27/2004","granularity":"day","time":"2004/06/27 00:00:00 -0400"},"longitude":-149.6914215,"id":"adv9lt25lypy","location":"AK: Kenai Fjords NP"},"type":"Feature","geometry":{"type":"Point","coordinates":[-149.6914215,59.7]}},{"properties":{"latitude":60.532299,"column_5":1,"date":{"end_time":"2004/06/28 00:00:00 -0400","original":"6/27/2004","granularity":"day","time":"2004/06/27 00:00:00 -0400"},"longitude":-149.5462036,"id":"adv9lss4ngpl","location":"Tern Lake-MP S37 Seward/Sterling Hwys. junc.(Kenai Penin. Boro.)"},"type":"Feature","geometry":{"type":"Point","coordinates":[-149.5462036,60.532299]}},{"properties":{"latitude":60.4073982,"column_5":1,"date":{"end_time":"2004/06/29 00:00:00 -0400","original":"6/28/2004","granularity":"day","time":"2004/06/28 00:00:00 -0400"},"longitude":-150.3007965,"id":"adv9lt50uhwm","location":"Skilak Lake (Kenai Peninsula)"},"type":"Feature","geometry":{"type":"Point","coordinates":[-150.3007965,60.4073982]}},{"properties":{"latitude":59.6130805,"column_5":1,"date":{"end_time":"2004/06/30 00:00:00 -0400","original":"6/29/2004","granularity":"day","time":"2004/06/29 00:00:00 -0400"},"longitude":-151.4467049,"id":"adv9lt1azhm3","location":"Homer Spit"},"type":"Feature","geometry":{"type":"Point","coordinates":[-151.4467049,59.6130805]}},{"properties":{"latitude":62.3489506,"column_5":1,"date":{"end_time":"2004/07/02 00:00:00 -0400","original":"7/1/2004","granularity":"day","time":"2004/07/01 00:00:00 -0400"},"longitude":-150.5922454,"id":"adv9lt5sw0t2","location":"Trapper Creek--Petersville Rd. (Parks Hwy. MP A115)(M-S Boro.)"},"type":"Feature","geometry":{"type":"Point","coordinates":[-150.5922454,62.3489506]}},{"properties":{"latitude":62.7075362,"column_5":1,"date":{"end_time":"2004/07/03 00:00:00 -0400","original":"7/2/2004","granularity":"day","time":"2004/07/02 00:00:00 -0400"},"longitude":-150.0842285,"id":"adv9lt59qtux","location":"Denali State Park (M-S Boro.)"},"type":"Feature","geometry":{"type":"Point","coordinates":[-150.0842285,62.7075362]}},{"properties":{"latitude":63.736786,"column_5":1,"date":{"end_time":"2004/07/04 00:00:00 -0400","original":"7/3/2004","granularity":"day","time":"2004/07/03 00:00:00 -0400"},"longitude":-148.8974905,"id":"adv9lsyujti1","location":"Denali NP--Visitor Center"},"type":"Feature","geometry":{"type":"Point","coordinates":[-148.8974905,63.736786]}},{"properties":{"latitude":63.4528205,"column_5":1,"date":{"end_time":"2004/07/05 00:00:00 -0400","original":"7/4/2004","granularity":"day","time":"2004/07/04 00:00:00 -0400"},"longitude":-150.8756304,"id":"adv9lsvxwhkg","location":"Denali NP--Wonder Lake Campground"},"type":"Feature","geometry":{"type":"Point","coordinates":[-150.8756304,63.4528205]}},{"properties":{"latitude":63.8417279,"column_5":1,"date":{"end_time":"2004/07/05 00:00:00 -0400","original":"7/4/2004","granularity":"day","time":"2004/07/04 00:00:00 -0400"},"longitude":-149.0373516,"id":"adv9lsv0jy1c","location":"Healy--Otto Lake"},"type":"Feature","geometry":{"type":"Point","coordinates":[-149.0373516,63.8417279]}},{"properties":{"latitude":63.5366977,"column_5":1,"date":{"end_time":"2004/07/05 00:00:00 -0400","original":"7/4/2004","granularity":"day","time":"2004/07/04 00:00:00 -0400"},"longitude":-149.8135185,"id":"adv9lsupqi8a","location":"Denali NP--Polychrome Pass area"},"type":"Feature","geometry":{"type":"Point","coordinates":[-149.8135185,63.5366977]}},{"properties":{"latitude":61.1530512,"column_5":1,"date":{"end_time":"2004/07/08 00:00:00 -0400","original":"7/7/2004","granularity":"day","time":"2004/07/07 00:00:00 -0400"},"longitude":-150.0387812,"id":"adv9lt074dba","location":"Anchorage--Kincaid Park"},"type":"Feature","geometry":{"type":"Point","coordinates":[-150.0387812,61.1530512]}},{"properties":{"latitude":34.9101471,"column_5":1,"date":{"end_time":"2004/08/17 00:00:00 -0400","original":"8/16/2004","granularity":"day","time":"2004/08/16 00:00:00 -0400"},"longitude":-102.1138,"id":"adv9lt5y4fvm","location":"Buffalo Lake NWR (PHP 039)"},"type":"Feature","geometry":{"type":"Point","coordinates":[-102.1138,34.9101471]}},{"properties":{"latitude":34.98036,"column_5":1,"date":{"end_time":"2004/08/17 00:00:00 -0400","original":"8/16/2004","granularity":"day","time":"2004/08/16 00:00:00 -0400"},"longitude":-101.91847,"id":"adv9lt39erej","location":"Canyon"},"type":"Feature","geometry":{"type":"Point","coordinates":[-101.91847,34.98036]}},{"properties":{"latitude":35.7791592,"column_5":1,"date":{"end_time":"2004/08/18 00:00:00 -0400","original":"8/17/2004","granularity":"day","time":"2004/08/17 00:00:00 -0400"},"longitude":-106.270524,"id":"adv9lt0nc4wy","location":"Bandelier NM -- Visitor Center"},"type":"Feature","geometry":{"type":"Point","coordinates":[-106.270524,35.7791592]}},{"properties":{"latitude":35.820335,"column_5":1,"date":{"end_time":"2004/08/18 00:00:00 -0400","original":"8/17/2004","granularity":"day","time":"2004/08/17 00:00:00 -0400"},"longitude":-106.6052396,"id":"adv9lswc470o","location":"Jemez Falls"},"type":"Feature","geometry":{"type":"Point","coordinates":[-106.6052396,35.820335]}},{"properties":{"latitude":32.887,"column_5":1,"date":{"end_time":"2004/10/04 00:00:00 -0400","original":"10/3/2004","granularity":"day","time":"2004/10/03 00:00:00 -0400"},"longitude":-113.549,"id":"adv9lswtnldh","location":"Dateland Shrimp Farms"},"type":"Feature","geometry":{"type":"Point","coordinates":[-113.549,32.887]}},{"properties":{"latitude":31.5172708,"column_5":1,"date":{"end_time":"2005/04/24 00:00:00 -0400","original":"4/23/2005","granularity":"day","time":"2005/04/23 00:00:00 -0400"},"longitude":-110.3887872,"id":"adv9lswqst9b","location":"Huachuca Canyon"},"type":"Feature","geometry":{"type":"Point","coordinates":[-110.3887872,31.5172708]}},{"properties":{"latitude":31.55449,"column_5":1,"date":{"end_time":"2005/05/02 00:00:00 -0400","original":"5/1/2005","granularity":"day","time":"2005/05/01 00:00:00 -0400"},"longitude":-110.30364,"id":"adv9lt0xwooy","location":"Sierra Vista"},"type":"Feature","geometry":{"type":"Point","coordinates":[-110.30364,31.55449]}},{"properties":{"latitude":32.35038,"column_5":1,"date":{"end_time":"2005/05/13 00:00:00 -0400","original":"5/12/2005","granularity":"day","time":"2005/05/12 00:00:00 -0400"},"longitude":-108.70861,"id":"adv9lt00kerw","location":"Lordsburg"},"type":"Feature","geometry":{"type":"Point","coordinates":[-108.70861,32.35038]}},{"properties":{"latitude":30.4489356,"column_5":1,"date":{"end_time":"2005/05/14 00:00:00 -0400","original":"5/13/2005","granularity":"day","time":"2005/05/13 00:00:00 -0400"},"longitude":-99.8142467,"id":"adv9lt45ndt8","location":"South Llano River SP (HOTW 093)"},"type":"Feature","geometry":{"type":"Point","coordinates":[-99.8142467,30.4489356]}},{"properties":{"latitude":29.6607586,"column_5":1,"date":{"end_time":"2005/05/15 00:00:00 -0400","original":"5/14/2005","granularity":"day","time":"2005/05/14 00:00:00 -0400"},"longitude":-96.2848663,"id":"adv9lswc0iuq","location":"Attwater Prairie Chicken NWR (CTC 004)"},"type":"Feature","geometry":{"type":"Point","coordinates":[-96.2848663,29.6607586]}},{"properties":{"latitude":29.31744,"column_5":1,"date":{"end_time":"2005/05/15 00:00:00 -0400","original":"5/14/2005","granularity":"day","time":"2005/05/14 00:00:00 -0400"},"longitude":-99.46642,"id":"adv9lt013pps","location":"Sabinal"},"type":"Feature","geometry":{"type":"Point","coordinates":[-99.46642,29.31744]}},{"properties":{"latitude":29.8155087,"column_5":1,"date":{"end_time":"2005/05/15 00:00:00 -0400","original":"5/14/2005","granularity":"day","time":"2005/05/14 00:00:00 -0400"},"longitude":-99.5762582,"id":"adv9lstfh3go","location":"Lost Maples SNA (HOTW 061)"},"type":"Feature","geometry":{"type":"Point","coordinates":[-99.5762582,29.8155087]}},{"properties":{"latitude":30.063,"column_5":1,"date":{"end_time":"2005/05/15 00:00:00 -0400","original":"5/14/2005","granularity":"day","time":"2005/05/14 00:00:00 -0400"},"longitude":-99.505,"id":"adv9lt0j07c7","location":"Kerr WMA"},"type":"Feature","geometry":{"type":"Point","coordinates":[-99.505,30.063]}},{"properties":{"latitude":29.3711371,"column_5":1,"date":{"end_time":"2005/05/16 00:00:00 -0400","original":"5/15/2005","granularity":"day","time":"2005/05/15 00:00:00 -0400"},"longitude":-94.7287083,"id":"adv9lsyyj42k","location":"Bolivar Flats Shorebird Sanctuary (UTC 058)"},"type":"Feature","geometry":{"type":"Point","coordinates":[-94.7287083,29.3711371]}},{"properties":{"latitude":29.33169,"column_5":1,"date":{"end_time":"2005/05/16 00:00:00 -0400","original":"5/15/2005","granularity":"day","time":"2005/05/15 00:00:00 -0400"},"longitude":-94.73242,"id":"adv9lt6twvyh","location":"Galveston- Apffel Park / East Beach (UTC 062)"},"type":"Feature","geometry":{"type":"Point","coordinates":[-94.73242,29.33169]}},{"properties":{"latitude":29.4950424,"column_5":1,"date":{"end_time":"2005/05/16 00:00:00 -0400","original":"5/15/2005","granularity":"day","time":"2005/05/15 00:00:00 -0400"},"longitude":-99.7121051,"id":"adv9lsspxdoq","location":"Neal's Lodges area (Concan) (HOTW 029)"},"type":"Feature","geometry":{"type":"Point","coordinates":[-99.7121051,29.4950424]}},{"properties":{"latitude":29.8794934,"column_5":1,"date":{"end_time":"2005/05/17 00:00:00 -0400","original":"5/16/2005","granularity":"day","time":"2005/05/16 00:00:00 -0400"},"longitude":-93.4256659,"id":"adv9lsuzm2r1","location":"Sabine NWR"},"type":"Feature","geometry":{"type":"Point","coordinates":[-93.4256659,29.8794934]}},{"properties":{"latitude":30.024,"column_5":1,"date":{"end_time":"2005/05/17 00:00:00 -0400","original":"5/16/2005","granularity":"day","time":"2005/05/16 00:00:00 -0400"},"longitude":-95.295,"id":"adv9lsxjo2j6","location":"Jesse H. Jones County Park (UTC 038)"},"type":"Feature","geometry":{"type":"Point","coordinates":[-95.295,30.024]}},{"properties":{"latitude":29.697222,"column_5":1,"date":{"end_time":"2005/05/17 00:00:00 -0400","original":"5/16/2005","granularity":"day","time":"2005/05/16 00:00:00 -0400"},"longitude":-93.94945,"id":"adv9lsxvmq70","location":"Sabine Woods (UTC 026)"},"type":"Feature","geometry":{"type":"Point","coordinates":[-93.94945,29.697222]}},{"properties":{"latitude":33.763367,"column_5":1,"date":{"end_time":"2005/05/18 00:00:00 -0400","original":"5/17/2005","granularity":"day","time":"2005/05/17 00:00:00 -0400"},"longitude":-90.1432932,"id":"adv9lt11hpwq","location":"Tallahatchie NWR"},"type":"Feature","geometry":{"type":"Point","coordinates":[-90.1432932,33.763367]}},{"properties":{"latitude":46.892779,"column_5":1,"date":{"end_time":"2005/06/10 00:00:00 -0400","original":"6/9/2005","granularity":"day","time":"2005/06/09 00:00:00 -0400"},"longitude":-120.629115,"id":"adv9lt4li0t5","location":"Umtanum Falls"},"type":"Feature","geometry":{"type":"Point","coordinates":[-120.629115,46.892779]}},{"properties":{"latitude":46.9053628,"column_5":1,"date":{"end_time":"2005/06/10 00:00:00 -0400","original":"6/9/2005","granularity":"day","time":"2005/06/09 00:00:00 -0400"},"longitude":-120.8048487,"id":"adv9lstvllca","location":"Wenas Campground"},"type":"Feature","geometry":{"type":"Point","coordinates":[-120.8048487,46.9053628]}},{"properties":{"latitude":47.9639126,"column_5":1,"date":{"end_time":"2005/06/12 00:00:00 -0400","original":"6/11/2005","granularity":"day","time":"2005/06/11 00:00:00 -0400"},"longitude":-116.5727108,"id":"adv9lswkhtbi","location":"Farragut SP"},"type":"Feature","geometry":{"type":"Point","coordinates":[-116.5727108,47.9639126]}},{"properties":{"latitude":37.6222146,"column_5":1,"date":{"end_time":"2005/07/13 00:00:00 -0400","original":"7/12/2005","granularity":"day","time":"2005/07/12 00:00:00 -0400"},"longitude":-100.3622289,"id":"adv9lss8x15c","location":"KS: Highway 56 S of Dodge City"},"type":"Feature","geometry":{"type":"Point","coordinates":[-100.3622289,37.6222146]}},{"properties":{"latitude":37.04931,"column_5":1,"date":{"end_time":"2005/07/14 00:00:00 -0400","original":"7/13/2005","granularity":"day","time":"2005/07/13 00:00:00 -0400"},"longitude":-101.89906,"id":"adv9lt2kmbh2","location":"Cimarron NG--Turnerville Work Center"},"type":"Feature","geometry":{"type":"Point","coordinates":[-101.89906,37.04931]}},{"properties":{"latitude":31.4044991,"column_5":1,"date":{"end_time":"2005/07/17 00:00:00 -0400","original":"7/16/2005","granularity":"day","time":"2005/07/16 00:00:00 -0400"},"longitude":-110.2967987,"id":"adv9lstsn247","location":"Miller Canyon--upper"},"type":"Feature","geometry":{"type":"Point","coordinates":[-110.2967987,31.4044991]}},{"properties":{"latitude":39.59773,"column_5":1,"date":{"end_time":"2005/07/27 00:00:00 -0400","original":"7/26/2005","granularity":"day","time":"2005/07/26 00:00:00 -0400"},"longitude":-105.6445,"id":"adv9lszx53hu","location":"Mt. Evans--Summit Lake"},"type":"Feature","geometry":{"type":"Point","coordinates":[-105.6445,39.59773]}},{"properties":{"latitude":31.6732995,"column_5":1,"date":{"end_time":"2005/11/21 00:00:00 -0500","original":"11/20/2005","granularity":"day","time":"2005/11/20 00:00:00 -0500"},"longitude":-110.5629845,"id":"adv9lsurhgfg","location":"Lower Elgin Road"},"type":"Feature","geometry":{"type":"Point","coordinates":[-110.5629845,31.6732995]}},{"properties":{"latitude":38.8949742,"column_5":1,"date":{"end_time":"2005/11/26 00:00:00 -0500","original":"11/25/2005","granularity":"day","time":"2005/11/25 00:00:00 -0500"},"longitude":-92.210784,"id":"adv9lsvmh3t8","location":"Bradford Farm"},"type":"Feature","geometry":{"type":"Point","coordinates":[-92.210784,38.8949742]}},{"properties":{"latitude":39.9042174,"column_5":1,"date":{"end_time":"2005/12/28 00:00:00 -0500","original":"12/27/2005","granularity":"day","time":"2005/12/27 00:00:00 -0500"},"longitude":-91.4271924,"id":"adv9lss2qg2v","location":"Quincy Lock and Dam 21 (Adams Co.)"},"type":"Feature","geometry":{"type":"Point","coordinates":[-91.4271924,39.9042174]}},{"properties":{"latitude":38.8645898,"column_5":1,"date":{"end_time":"2006/01/02 00:00:00 -0500","original":"1/1/2006","granularity":"day","time":"2006/01/01 00:00:00 -0500"},"longitude":-90.5214558,"id":"adv9lt36looe","location":"MO: St. Charles County--South Shores"},"type":"Feature","geometry":{"type":"Point","coordinates":[-90.5214558,38.8645898]}},{"properties":{"latitude":38.8690503,"column_5":1,"date":{"end_time":"2006/01/02 00:00:00 -0500","original":"1/1/2006","granularity":"day","time":"2006/01/01 00:00:00 -0500"},"longitude":-90.5105377,"id":"adv9lt2s85kz","location":"Church Rd. &amp; Seeburger Rd. Feedlot"},"type":"Feature","geometry":{"type":"Point","coordinates":[-90.5105377,38.8690503]}},{"properties":{"latitude":32.4270744,"column_5":1,"date":{"end_time":"2006/02/05 00:00:00 -0500","original":"2/4/2006","granularity":"day","time":"2006/02/04 00:00:00 -0500"},"longitude":-110.4903717,"id":"adv9lt0ira87","location":"AZ: Redington"},"type":"Feature","geometry":{"type":"Point","coordinates":[-110.4903717,32.4270744]}},{"properties":{"latitude":31.7480633,"column_5":1,"date":{"end_time":"2006/03/05 00:00:00 -0500","original":"3/4/2006","granularity":"day","time":"2006/03/04 00:00:00 -0500"},"longitude":-110.9967747,"id":"adv9lt518bmg","location":"Elephant Head Pond"},"type":"Feature","geometry":{"type":"Point","coordinates":[-110.9967747,31.7480633]}},{"properties":{"latitude":33.39426,"column_5":1,"date":{"end_time":"2006/05/05 00:00:00 -0400","original":"5/4/2006","granularity":"day","time":"2006/05/04 00:00:00 -0400"},"longitude":-110.78667,"id":"adv9lt4uvm4q","location":"Globe"},"type":"Feature","geometry":{"type":"Point","coordinates":[-110.78667,33.39426]}},{"properties":{"latitude":33.39925,"column_5":1,"date":{"end_time":"2006/05/05 00:00:00 -0400","original":"5/4/2006","granularity":"day","time":"2006/05/04 00:00:00 -0400"},"longitude":-110.86867,"id":"adv9lt4pch3z","location":"Miami"},"type":"Feature","geometry":{"type":"Point","coordinates":[-110.86867,33.39925]}},{"properties":{"latitude":33.2822014,"column_5":1,"date":{"end_time":"2006/05/05 00:00:00 -0400","original":"5/4/2006","granularity":"day","time":"2006/05/04 00:00:00 -0400"},"longitude":-110.8211602,"id":"adv9lstrg4u8","location":"Pinal Peak"},"type":"Feature","geometry":{"type":"Point","coordinates":[-110.8211602,33.2822014]}},{"properties":{"latitude":38.81505,"column_5":1,"date":{"end_time":"2006/05/20 00:00:00 -0400","original":"5/19/2006","granularity":"day","time":"2006/05/19 00:00:00 -0400"},"longitude":-90.95594,"id":"adv9lsrtp2vk","location":"Foristell"},"type":"Feature","geometry":{"type":"Point","coordinates":[-90.95594,38.81505]}},{"properties":{"latitude":37.1279367,"column_5":1,"date":{"end_time":"2006/05/21 00:00:00 -0400","original":"5/20/2006","granularity":"day","time":"2006/05/20 00:00:00 -0400"},"longitude":-93.2385888,"id":"adv9lsz5d6al","location":"Springfield CNC"},"type":"Feature","geometry":{"type":"Point","coordinates":[-93.2385888,37.1279367]}},{"properties":{"latitude":37.12005,"column_5":1,"date":{"end_time":"2006/05/21 00:00:00 -0400","original":"5/20/2006","granularity":"day","time":"2006/05/20 00:00:00 -0400"},"longitude":-93.48019,"id":"adv9lsyh5dqi","location":"Republic"},"type":"Feature","geometry":{"type":"Point","coordinates":[-93.48019,37.12005]}},{"properties":{"latitude":39.9772,"column_5":1,"date":{"end_time":"2006/05/24 00:00:00 -0400","original":"5/23/2006","granularity":"day","time":"2006/05/23 00:00:00 -0400"},"longitude":-95.56196,"id":"adv9lt6wixdi","location":"Reserve"},"type":"Feature","geometry":{"type":"Point","coordinates":[-95.56196,39.9772]}},{"properties":{"latitude":39.46529,"column_5":1,"date":{"end_time":"2006/05/24 00:00:00 -0400","original":"5/23/2006","granularity":"day","time":"2006/05/23 00:00:00 -0400"},"longitude":-95.73636,"id":"adv9lt0nyadc","location":"Holton"},"type":"Feature","geometry":{"type":"Point","coordinates":[-95.73636,39.46529]}},{"properties":{"latitude":40.0519,"column_5":1,"date":{"end_time":"2006/05/24 00:00:00 -0400","original":"5/23/2006","granularity":"day","time":"2006/05/23 00:00:00 -0400"},"longitude":-95.42696,"id":"adv9lsy8vezu","location":"Rulo"},"type":"Feature","geometry":{"type":"Point","coordinates":[-95.42696,40.0519]}},{"properties":{"latitude":39.69394,"column_5":1,"date":{"end_time":"2006/05/24 00:00:00 -0400","original":"5/23/2006","granularity":"day","time":"2006/05/23 00:00:00 -0400"},"longitude":-92.04297,"id":"adv9lsz5962b","location":"Shelbina"},"type":"Feature","geometry":{"type":"Point","coordinates":[-92.04297,39.69394]}},{"properties":{"latitude":39.8525,"column_5":1,"date":{"end_time":"2006/05/24 00:00:00 -0400","original":"5/23/2006","granularity":"day","time":"2006/05/23 00:00:00 -0400"},"longitude":-95.53586,"id":"adv9lsqpyk0t","location":"Hiawatha"},"type":"Feature","geometry":{"type":"Point","coordinates":[-95.53586,39.8525]}},{"properties":{"latitude":40.0608,"column_5":1,"date":{"end_time":"2006/05/24 00:00:00 -0400","original":"5/23/2006","granularity":"day","time":"2006/05/23 00:00:00 -0400"},"longitude":-95.60196,"id":"adv9lsxbpwgw","location":"Falls City"},"type":"Feature","geometry":{"type":"Point","coordinates":[-95.60196,40.0608]}},{"properties":{"latitude":38.8983,"column_5":1,"date":{"end_time":"2006/05/24 00:00:00 -0400","original":"5/23/2006","granularity":"day","time":"2006/05/23 00:00:00 -0400"},"longitude":-97.87502,"id":"adv9lt6onyhs","location":"Glendale"},"type":"Feature","geometry":{"type":"Point","coordinates":[-97.87502,38.8983]}},{"properties":{"latitude":39.3061,"column_5":1,"date":{"end_time":"2006/05/25 00:00:00 -0400","original":"5/24/2006","granularity":"day","time":"2006/05/24 00:00:00 -0400"},"longitude":-102.26947,"id":"adv9lt20tyk3","location":"Burlington"},"type":"Feature","geometry":{"type":"Point","coordinates":[-102.26947,39.3061]}},{"properties":{"latitude":39.3331,"column_5":1,"date":{"end_time":"2006/05/25 00:00:00 -0400","original":"5/24/2006","granularity":"day","time":"2006/05/24 00:00:00 -0400"},"longitude":-102.03746,"id":"adv9lt2vnyjc","location":"Kanorado"},"type":"Feature","geometry":{"type":"Point","coordinates":[-102.03746,39.3331]}},{"properties":{"latitude":40.3929771,"column_5":1,"date":{"end_time":"2006/05/26 00:00:00 -0400","original":"5/25/2006","granularity":"day","time":"2006/05/25 00:00:00 -0400"},"longitude":-105.7071015,"id":"adv9lswzzkxf","location":"RMNP--Trail Ridge Road"},"type":"Feature","geometry":{"type":"Point","coordinates":[-105.7071015,40.3929771]}},{"properties":{"latitude":40.58248,"column_5":1,"date":{"end_time":"2006/05/27 00:00:00 -0400","original":"5/26/2006","granularity":"day","time":"2006/05/26 00:00:00 -0400"},"longitude":-104.73152,"id":"adv9lsr3pxr6","location":"Ault"},"type":"Feature","geometry":{"type":"Point","coordinates":[-104.73152,40.58248]}},{"properties":{"latitude":40.6443418,"column_5":1,"date":{"end_time":"2006/05/27 00:00:00 -0400","original":"5/26/2006","granularity":"day","time":"2006/05/26 00:00:00 -0400"},"longitude":-104.3433166,"id":"adv9lt299ar3","location":"Pawnee NG--Crow Valley Campground"},"type":"Feature","geometry":{"type":"Point","coordinates":[-104.3433166,40.6443418]}},{"properties":{"latitude":40.28337,"column_5":1,"date":{"end_time":"2006/05/28 00:00:00 -0400","original":"5/27/2006","granularity":"day","time":"2006/05/27 00:00:00 -0400"},"longitude":-104.63199,"id":"adv9lssmbg8d","location":"Beebe Draw"},"type":"Feature","geometry":{"type":"Point","coordinates":[-104.63199,40.28337]}},{"properties":{"latitude":40.3345066,"column_5":1,"date":{"end_time":"2006/05/28 00:00:00 -0400","original":"5/27/2006","granularity":"day","time":"2006/05/27 00:00:00 -0400"},"longitude":-104.6397114,"id":"adv9lt1amgtu","location":"Lower Latham Reservoir area"},"type":"Feature","geometry":{"type":"Point","coordinates":[-104.6397114,40.3345066]}},{"properties":{"latitude":32.02818,"column_5":1,"date":{"end_time":"2006/06/11 00:00:00 -0400","original":"6/10/2006","granularity":"day","time":"2006/06/10 00:00:00 -0400"},"longitude":-110.03862,"id":"adv9lt1lra4g","location":"Dragoon"},"type":"Feature","geometry":{"type":"Point","coordinates":[-110.03862,32.02818]}},{"properties":{"latitude":31.8496756,"column_5":1,"date":{"end_time":"2006/06/11 00:00:00 -0400","original":"6/10/2006","granularity":"day","time":"2006/06/10 00:00:00 -0400"},"longitude":-109.3256991,"id":"adv9lt10uicc","location":"West Turkey Creek/Morse Canyon"},"type":"Feature","geometry":{"type":"Point","coordinates":[-109.3256991,31.8496756]}},{"properties":{"latitude":32.2401477,"column_5":1,"date":{"end_time":"2006/06/11 00:00:00 -0400","original":"6/10/2006","granularity":"day","time":"2006/06/10 00:00:00 -0400"},"longitude":-110.7894286,"id":"adv9lt2xqkn4","location":"AZ: Tucson--Wrightstown Rd."},"type":"Feature","geometry":{"type":"Point","coordinates":[-110.7894286,32.2401477]}},{"properties":{"latitude":31.62789,"column_5":1,"date":{"end_time":"2006/07/02 00:00:00 -0400","original":"7/1/2006","granularity":"day","time":"2006/07/01 00:00:00 -0400"},"longitude":-110.33363,"id":"adv9lt2wn6jj","location":"Huachuca City"},"type":"Feature","geometry":{"type":"Point","coordinates":[-110.33363,31.62789]}},{"properties":{"latitude":31.4174417,"column_5":1,"date":{"end_time":"2006/07/05 00:00:00 -0400","original":"7/4/2006","granularity":"day","time":"2006/07/04 00:00:00 -0400"},"longitude":-110.8507861,"id":"adv9lt5safkw","location":"AZ: Nogales Airport"},"type":"Feature","geometry":{"type":"Point","coordinates":[-110.8507861,31.4174417]}},{"properties":{"latitude":39.0698567,"column_5":1,"date":{"end_time":"2006/07/24 00:00:00 -0400","original":"7/23/2006","granularity":"day","time":"2006/07/23 00:00:00 -0400"},"longitude":-90.7352993,"id":"adv9lsxzdyus","location":"MO: Kings Lake"},"type":"Feature","geometry":{"type":"Point","coordinates":[-90.7352993,39.0698567]}},{"properties":{"latitude":37.99724,"column_5":1,"date":{"end_time":"2006/07/25 00:00:00 -0400","original":"7/24/2006","granularity":"day","time":"2006/07/24 00:00:00 -0400"},"longitude":-91.61436,"id":"adv9lt6rfwg9","location":"Saint James"},"type":"Feature","geometry":{"type":"Point","coordinates":[-91.61436,37.99724]}},{"properties":{"latitude":37.3631402,"column_5":1,"date":{"end_time":"2006/07/26 00:00:00 -0400","original":"7/25/2006","granularity":"day","time":"2006/07/25 00:00:00 -0400"},"longitude":-91.4952997,"id":"adv9lt1li8g0","location":"Ozark National Scenic Riverway--Akers Ferry to Pulltite Campground"},"type":"Feature","geometry":{"type":"Point","coordinates":[-91.4952997,37.3631402]}},{"properties":{"latitude":37.96814,"column_5":1,"date":{"end_time":"2006/07/26 00:00:00 -0400","original":"7/25/2006","granularity":"day","time":"2006/07/25 00:00:00 -0400"},"longitude":-91.35485,"id":"adv9lsv3nm51","location":"Steelville"},"type":"Feature","geometry":{"type":"Point","coordinates":[-91.35485,37.96814]}},{"properties":{"latitude":38.97754,"column_5":1,"date":{"end_time":"2006/07/26 00:00:00 -0400","original":"7/25/2006","granularity":"day","time":"2006/07/25 00:00:00 -0400"},"longitude":-91.50486,"id":"adv9lt1xesut","location":"Montgomery City"},"type":"Feature","geometry":{"type":"Point","coordinates":[-91.50486,38.97754]}},{"properties":{"latitude":37.3355146,"column_5":1,"date":{"end_time":"2006/07/26 00:00:00 -0400","original":"7/25/2006","granularity":"day","time":"2006/07/25 00:00:00 -0400"},"longitude":-91.4825985,"id":"adv9lsuoqde5","location":"Ozark National Scenic Riverways--Pulltite Campground"},"type":"Feature","geometry":{"type":"Point","coordinates":[-91.4825985,37.3355146]}},{"properties":{"latitude":38.00945,"column_5":1,"date":{"end_time":"2006/07/29 00:00:00 -0400","original":"7/28/2006","granularity":"day","time":"2006/07/28 00:00:00 -0400"},"longitude":-90.21792,"id":"adv9lsthui7q","location":"Bloomsdale"},"type":"Feature","geometry":{"type":"Point","coordinates":[-90.21792,38.00945]}},{"properties":{"latitude":38.6689873,"column_5":1,"date":{"end_time":"2006/07/29 00:00:00 -0400","original":"7/28/2006","granularity":"day","time":"2006/07/28 00:00:00 -0400"},"longitude":-90.4006541,"id":"adv9lsv27aot","location":"MO: Creve Coeur--Monsanto Campus"},"type":"Feature","geometry":{"type":"Point","coordinates":[-90.4006541,38.6689873]}},{"properties":{"latitude":37.72425,"column_5":1,"date":{"end_time":"2006/07/29 00:00:00 -0400","original":"7/28/2006","granularity":"day","time":"2006/07/28 00:00:00 -0400"},"longitude":-89.86121,"id":"adv9lss82awe","location":"Perryville"},"type":"Feature","geometry":{"type":"Point","coordinates":[-89.86121,37.72425]}},{"properties":{"latitude":36.6588995,"column_5":1,"date":{"end_time":"2006/07/30 00:00:00 -0400","original":"7/29/2006","granularity":"day","time":"2006/07/29 00:00:00 -0400"},"longitude":-89.4156536,"id":"adv9lstpwq13","location":"MO: New Madrid Levee Roads"},"type":"Feature","geometry":{"type":"Point","coordinates":[-89.4156536,36.6588995]}},{"properties":{"latitude":36.7585777,"column_5":1,"date":{"end_time":"2006/07/30 00:00:00 -0400","original":"7/29/2006","granularity":"day","time":"2006/07/29 00:00:00 -0400"},"longitude":-89.7466391,"id":"adv9lt5v0erh","location":"Dexter Rice Fields"},"type":"Feature","geometry":{"type":"Point","coordinates":[-89.7466391,36.7585777]}},{"properties":{"latitude":36.8724416,"column_5":1,"date":{"end_time":"2006/07/30 00:00:00 -0400","original":"7/29/2006","granularity":"day","time":"2006/07/29 00:00:00 -0400"},"longitude":-89.5283285,"id":"adv9lt4gwvah","location":"MO: Sikeston Sod Farms"},"type":"Feature","geometry":{"type":"Point","coordinates":[-89.5283285,36.8724416]}},{"properties":{"latitude":36.66476,"column_5":1,"date":{"end_time":"2006/07/30 00:00:00 -0400","original":"7/29/2006","granularity":"day","time":"2006/07/29 00:00:00 -0400"},"longitude":-90.47231,"id":"adv9lszpvo2k","location":"Harviell"},"type":"Feature","geometry":{"type":"Point","coordinates":[-90.47231,36.66476]}},{"properties":{"latitude":36.6644728,"column_5":1,"date":{"end_time":"2006/07/30 00:00:00 -0400","original":"7/29/2006","granularity":"day","time":"2006/07/29 00:00:00 -0400"},"longitude":-90.4205711,"id":"adv9lszyvy4h","location":"MO: Hwy. 142 &amp; Hwy. 158"},"type":"Feature","geometry":{"type":"Point","coordinates":[-90.4205711,36.6644728]}},{"properties":{"latitude":36.65926,"column_5":1,"date":{"end_time":"2006/07/30 00:00:00 -0400","original":"7/29/2006","granularity":"day","time":"2006/07/29 00:00:00 -0400"},"longitude":-90.0968,"id":"adv9lsrmhyvt","location":"Powe"},"type":"Feature","geometry":{"type":"Point","coordinates":[-90.0968,36.65926]}},{"properties":{"latitude":36.6771488,"column_5":1,"date":{"end_time":"2006/07/30 00:00:00 -0400","original":"7/29/2006","granularity":"day","time":"2006/07/29 00:00:00 -0400"},"longitude":-90.3370025,"id":"adv9lt640wzp","location":"MO: Hwy. 53 &amp; CR 320"},"type":"Feature","geometry":{"type":"Point","coordinates":[-90.3370025,36.6771488]}},{"properties":{"latitude":38.95284,"column_5":1,"date":{"end_time":"2006/08/05 00:00:00 -0400","original":"8/4/2006","granularity":"day","time":"2006/08/04 00:00:00 -0400"},"longitude":-91.93908,"id":"adv9lsvymcc2","location":"Kingdom City"},"type":"Feature","geometry":{"type":"Point","coordinates":[-91.93908,38.95284]}},{"properties":{"latitude":38.86122,"column_5":1,"date":{"end_time":"2006/08/05 00:00:00 -0400","original":"8/4/2006","granularity":"day","time":"2006/08/04 00:00:00 -0400"},"longitude":-97.1272,"id":"adv9lsvpz71t","location":"Dickinson"},"type":"Feature","geometry":{"type":"Point","coordinates":[-97.1272,38.86122]}},{"properties":{"latitude":40.08468,"column_5":1,"date":{"end_time":"2006/08/07 00:00:00 -0400","original":"8/6/2006","granularity":"day","time":"2006/08/06 00:00:00 -0400"},"longitude":-104.81353,"id":"adv9lt394sle","location":"Fort Lupton"},"type":"Feature","geometry":{"type":"Point","coordinates":[-104.81353,40.08468]}},{"properties":{"latitude":40.6404523,"column_5":1,"date":{"end_time":"2006/08/09 00:00:00 -0400","original":"8/8/2006","granularity":"day","time":"2006/08/08 00:00:00 -0400"},"longitude":-106.2767773,"id":"adv9lswvga47","location":"Arapaho NWR"},"type":"Feature","geometry":{"type":"Point","coordinates":[-106.2767773,40.6404523]}},{"properties":{"latitude":40.7339,"column_5":1,"date":{"end_time":"2006/08/09 00:00:00 -0400","original":"8/8/2006","granularity":"day","time":"2006/08/08 00:00:00 -0400"},"longitude":-106.3046,"id":"adv9lt2njoin","location":"Walden Reservoir"},"type":"Feature","geometry":{"type":"Point","coordinates":[-106.3046,40.7339]}},{"properties":{"latitude":40.5804812,"column_5":1,"date":{"end_time":"2006/08/09 00:00:00 -0400","original":"8/8/2006","granularity":"day","time":"2006/08/08 00:00:00 -0400"},"longitude":-106.0718576,"id":"adv9lswmlqp5","location":"CO: Hwy. 14--Cameron Pass to Walden"},"type":"Feature","geometry":{"type":"Point","coordinates":[-106.0718576,40.5804812]}},{"properties":{"latitude":41.00807,"column_5":1,"date":{"end_time":"2006/08/09 00:00:00 -0400","original":"8/8/2006","granularity":"day","time":"2006/08/08 00:00:00 -0400"},"longitude":-106.17257,"id":"adv9lsy10y01","location":"Mountain Home"},"type":"Feature","geometry":{"type":"Point","coordinates":[-106.17257,41.00807]}},{"properties":{"latitude":41.11057,"column_5":1,"date":{"end_time":"2006/08/09 00:00:00 -0400","original":"8/8/2006","granularity":"day","time":"2006/08/08 00:00:00 -0400"},"longitude":-106.01356,"id":"adv9lsu012l2","location":"Woods Landing"},"type":"Feature","geometry":{"type":"Point","coordinates":[-106.01356,41.11057]}},{"properties":{"latitude":40.3708806,"column_5":1,"date":{"end_time":"2006/08/10 00:00:00 -0400","original":"8/9/2006","granularity":"day","time":"2006/08/09 00:00:00 -0400"},"longitude":-105.23265,"id":"adv9lt0xlmz0","location":"CO: Loveland--Flatiron Reservoir"},"type":"Feature","geometry":{"type":"Point","coordinates":[-105.23265,40.3708806]}},{"properties":{"latitude":40.39778,"column_5":1,"date":{"end_time":"2006/08/10 00:00:00 -0400","original":"8/9/2006","granularity":"day","time":"2006/08/09 00:00:00 -0400"},"longitude":-105.07454,"id":"adv9lt0fexpl","location":"Loveland"},"type":"Feature","geometry":{"type":"Point","coordinates":[-105.07454,40.39778]}},{"properties":{"latitude":40.3629611,"column_5":1,"date":{"end_time":"2006/08/10 00:00:00 -0400","original":"8/9/2006","granularity":"day","time":"2006/08/09 00:00:00 -0400"},"longitude":-105.2831861,"id":"adv9lt770e2w","location":"CO: Loveland--Pinewood Lake"},"type":"Feature","geometry":{"type":"Point","coordinates":[-105.2831861,40.3629611]}},{"properties":{"latitude":41.86285,"column_5":1,"date":{"end_time":"2006/08/11 00:00:00 -0400","original":"8/10/2006","granularity":"day","time":"2006/08/10 00:00:00 -0400"},"longitude":-104.1313417,"id":"adv9lszx2ap1","location":"Table Mountain SWA"},"type":"Feature","geometry":{"type":"Point","coordinates":[-104.1313417,41.86285]}},{"properties":{"latitude":41.8282083,"column_5":1,"date":{"end_time":"2006/08/11 00:00:00 -0400","original":"8/10/2006","granularity":"day","time":"2006/08/10 00:00:00 -0400"},"longitude":-103.7076194,"id":"adv9lswrv0zo","location":"Scotts Bluff NM"},"type":"Feature","geometry":{"type":"Point","coordinates":[-103.7076194,41.8282083]}},{"properties":{"latitude":41.1399803,"column_5":1,"date":{"end_time":"2006/08/11 00:00:00 -0400","original":"8/10/2006","granularity":"day","time":"2006/08/10 00:00:00 -0400"},"longitude":-104.8205185,"id":"adv9lt5anuxf","location":"Cheyenne"},"type":"Feature","geometry":{"type":"Point","coordinates":[-104.8205185,41.1399803]}},{"properties":{"latitude":40.53028,"column_5":1,"date":{"end_time":"2006/08/11 00:00:00 -0400","original":"8/10/2006","granularity":"day","time":"2006/08/10 00:00:00 -0400"},"longitude":-104.71152,"id":"adv9lt098gn3","location":"Eaton"},"type":"Feature","geometry":{"type":"Point","coordinates":[-104.71152,40.53028]}},{"properties":{"latitude":41.54358,"column_5":1,"date":{"end_time":"2006/08/11 00:00:00 -0400","original":"8/10/2006","granularity":"day","time":"2006/08/10 00:00:00 -0400"},"longitude":-104.31951,"id":"adv9lt50wvk4","location":"Meriden"},"type":"Feature","geometry":{"type":"Point","coordinates":[-104.31951,41.54358]}},{"properties":{"latitude":41.6988,"column_5":1,"date":{"end_time":"2006/08/12 00:00:00 -0400","original":"8/11/2006","granularity":"day","time":"2006/08/11 00:00:00 -0400"},"longitude":-102.4014,"id":"adv9lsvq4f6b","location":"Crescent Lake"},"type":"Feature","geometry":{"type":"Point","coordinates":[-102.4014,41.6988]}},{"properties":{"latitude":41.2369995,"column_5":1,"date":{"end_time":"2006/08/12 00:00:00 -0400","original":"8/11/2006","granularity":"day","time":"2006/08/11 00:00:00 -0400"},"longitude":-101.6669998,"id":"adv9lstevphd","location":"Lake McConaughy"},"type":"Feature","geometry":{"type":"Point","coordinates":[-101.6669998,41.2369995]}},{"properties":{"latitude":42.49819,"column_5":1,"date":{"end_time":"2006/08/12 00:00:00 -0400","original":"8/11/2006","granularity":"day","time":"2006/08/11 00:00:00 -0400"},"longitude":-103.72988,"id":"adv9lsvzco0q","location":"Sioux"},"type":"Feature","geometry":{"type":"Point","coordinates":[-103.72988,42.49819]}},{"properties":{"latitude":42.7237613,"column_5":1,"date":{"end_time":"2006/08/12 00:00:00 -0400","original":"8/11/2006","granularity":"day","time":"2006/08/11 00:00:00 -0400"},"longitude":-103.8466418,"id":"adv9lsurqejf","location":"Sowbelly Canyon"},"type":"Feature","geometry":{"type":"Point","coordinates":[-103.8466418,42.7237613]}},{"properties":{"latitude":41.86667,"column_5":1,"date":{"end_time":"2006/08/12 00:00:00 -0400","original":"8/11/2006","granularity":"day","time":"2006/08/11 00:00:00 -0400"},"longitude":-103.6675,"id":"adv9lt3h2a5m","location":"Scottsbluff"},"type":"Feature","geometry":{"type":"Point","coordinates":[-103.6675,41.86667]}},{"properties":{"latitude":41.40498,"column_5":1,"date":{"end_time":"2006/08/12 00:00:00 -0400","original":"8/11/2006","granularity":"day","time":"2006/08/11 00:00:00 -0400"},"longitude":-102.34447,"id":"adv9lstfmlyl","location":"Oshkosh"},"type":"Feature","geometry":{"type":"Point","coordinates":[-102.34447,41.40498]}},{"properties":{"latitude":41.12809,"column_5":1,"date":{"end_time":"2006/08/12 00:00:00 -0400","original":"8/11/2006","granularity":"day","time":"2006/08/11 00:00:00 -0400"},"longitude":-101.71945,"id":"adv9lt68mlh9","location":"Ogallala"},"type":"Feature","geometry":{"type":"Point","coordinates":[-101.71945,41.12809]}},{"properties":{"latitude":42.4257556,"column_5":1,"date":{"end_time":"2006/08/12 00:00:00 -0400","original":"8/11/2006","granularity":"day","time":"2006/08/11 00:00:00 -0400"},"longitude":-103.7331694,"id":"adv9lsxw7dll","location":"Agate Fossil Beds NM"},"type":"Feature","geometry":{"type":"Point","coordinates":[-103.7331694,42.4257556]}},{"properties":{"latitude":40.92941,"column_5":1,"date":{"end_time":"2006/08/13 00:00:00 -0400","original":"8/12/2006","granularity":"day","time":"2006/08/12 00:00:00 -0400"},"longitude":-100.1604,"id":"adv9lt0csai0","location":"Gothenburg"},"type":"Feature","geometry":{"type":"Point","coordinates":[-100.1604,40.92941]}},{"properties":{"latitude":40.85971,"column_5":1,"date":{"end_time":"2006/08/13 00:00:00 -0400","original":"8/12/2006","granularity":"day","time":"2006/08/12 00:00:00 -0400"},"longitude":-99.9873,"id":"adv9lt5wqgxb","location":"Cozad"},"type":"Feature","geometry":{"type":"Point","coordinates":[-99.9873,40.85971]}},{"properties":{"latitude":38.661,"column_5":1,"date":{"end_time":"2006/08/14 00:00:00 -0400","original":"8/13/2006","granularity":"day","time":"2006/08/13 00:00:00 -0400"},"longitude":-90.758,"id":"adv9lt6r25oc","location":"Weldon Spring CA--Lost Valley Trail"},"type":"Feature","geometry":{"type":"Point","coordinates":[-90.758,38.661]}},{"properties":{"latitude":32.26866,"column_5":1,"date":{"end_time":"2006/08/27 00:00:00 -0400","original":"8/26/2006","granularity":"day","time":"2006/08/26 00:00:00 -0400"},"longitude":-112.7387,"id":"adv9lt09gwmx","location":"Why"},"type":"Feature","geometry":{"type":"Point","coordinates":[-112.7387,32.26866]}},{"properties":{"latitude":30.77806,"column_5":1,"date":{"end_time":"2006/09/03 00:00:00 -0400","original":"9/2/2006","granularity":"day","time":"2006/09/02 00:00:00 -0400"},"longitude":-110.85639,"id":"adv9lssmwj0l","location":"Imuris"},"type":"Feature","geometry":{"type":"Point","coordinates":[-110.85639,30.77806]}},{"properties":{"latitude":30.9672834,"column_5":1,"date":{"end_time":"2006/09/03 00:00:00 -0400","original":"9/2/2006","granularity":"day","time":"2006/09/02 00:00:00 -0400"},"longitude":-110.1567212,"id":"adv9lt5ksmed","location":"SON: Hwy. 89 S of Cananea"},"type":"Feature","geometry":{"type":"Point","coordinates":[-110.1567212,30.9672834]}},{"properties":{"latitude":30.98194,"column_5":1,"date":{"end_time":"2006/09/03 00:00:00 -0400","original":"9/2/2006","granularity":"day","time":"2006/09/02 00:00:00 -0400"},"longitude":-110.30056,"id":"adv9lsya7gpj","location":"Cananea"},"type":"Feature","geometry":{"type":"Point","coordinates":[-110.30056,30.98194]}},{"properties":{"latitude":30.9975,"column_5":1,"date":{"end_time":"2006/09/03 00:00:00 -0400","original":"9/2/2006","granularity":"day","time":"2006/09/02 00:00:00 -0400"},"longitude":-110.48694,"id":"adv9lt1gamij","location":"Cuitaca"},"type":"Feature","geometry":{"type":"Point","coordinates":[-110.48694,30.9975]}},{"properties":{"latitude":31.31861,"column_5":1,"date":{"end_time":"2006/09/03 00:00:00 -0400","original":"9/2/2006","granularity":"day","time":"2006/09/02 00:00:00 -0400"},"longitude":-110.94583,"id":"adv9lt5liw5e","location":"Heroica Nogales"},"type":"Feature","geometry":{"type":"Point","coordinates":[-110.94583,31.31861]}},{"properties":{"latitude":30.7722222,"column_5":1,"date":{"end_time":"2006/09/03 00:00:00 -0400","original":"9/2/2006","granularity":"day","time":"2006/09/02 00:00:00 -0400"},"longitude":-110.8527778,"id":"adv9lst02wpm","location":"Terrenate, Rio Magdalena wet crossing"},"type":"Feature","geometry":{"type":"Point","coordinates":[-110.8527778,30.7722222]}},{"properties":{"latitude":32.3479858,"column_5":1,"date":{"end_time":"2006/09/25 00:00:00 -0400","original":"9/24/2006","granularity":"day","time":"2006/09/24 00:00:00 -0400"},"longitude":-110.8544855,"id":"adv9lt1brbco","location":"Ventana Canyon"},"type":"Feature","geometry":{"type":"Point","coordinates":[-110.8544855,32.3479858]}},{"properties":{"latitude":31.7974086,"column_5":1,"date":{"end_time":"2006/10/08 00:00:00 -0400","original":"10/7/2006","granularity":"day","time":"2006/10/07 00:00:00 -0400"},"longitude":-110.7868486,"id":"adv9lsysl0pd","location":"Greaterville Road"},"type":"Feature","geometry":{"type":"Point","coordinates":[-110.7868486,31.7974086]}},{"properties":{"latitude":32.063394,"column_5":1,"date":{"end_time":"2006/10/08 00:00:00 -0400","original":"10/7/2006","granularity":"day","time":"2006/10/07 00:00:00 -0400"},"longitude":-110.7729772,"id":"adv9lsyli072","location":"AZ: Tucson--Houghton &amp; I-10"},"type":"Feature","geometry":{"type":"Point","coordinates":[-110.7729772,32.063394]}},{"properties":{"latitude":33.84815,"column_5":1,"date":{"end_time":"2006/10/15 00:00:00 -0400","original":"10/14/2006","granularity":"day","time":"2006/10/14 00:00:00 -0400"},"longitude":-109.14363,"id":"adv9lssgvikp","location":"Alpine"},"type":"Feature","geometry":{"type":"Point","coordinates":[-109.14363,33.84815]}},{"properties":{"latitude":32.84927,"column_5":1,"date":{"end_time":"2006/10/15 00:00:00 -0400","original":"10/14/2006","granularity":"day","time":"2006/10/14 00:00:00 -0400"},"longitude":-109.75964,"id":"adv9lt58vql6","location":"Thatcher"},"type":"Feature","geometry":{"type":"Point","coordinates":[-109.75964,32.84927]}},{"properties":{"latitude":33.3288296,"column_5":1,"date":{"end_time":"2006/10/15 00:00:00 -0400","original":"10/14/2006","granularity":"day","time":"2006/10/14 00:00:00 -0400"},"longitude":-109.3510515,"id":"adv9lsu9jklp","location":"AZ: Hwy. 191--Greenlee Co."},"type":"Feature","geometry":{"type":"Point","coordinates":[-109.3510515,33.3288296]}},{"properties":{"latitude":33.7199569,"column_5":1,"date":{"end_time":"2006/10/15 00:00:00 -0400","original":"10/14/2006","granularity":"day","time":"2006/10/14 00:00:00 -0400"},"longitude":-109.274986,"id":"adv9lt0xv1nh","location":"Apache-Sitgreaves NF--Beaver Creek"},"type":"Feature","geometry":{"type":"Point","coordinates":[-109.274986,33.7199569]}},{"properties":{"latitude":33.05086,"column_5":1,"date":{"end_time":"2006/10/15 00:00:00 -0400","original":"10/14/2006","granularity":"day","time":"2006/10/14 00:00:00 -0400"},"longitude":-109.29663,"id":"adv9lsrvegjv","location":"Clifton"},"type":"Feature","geometry":{"type":"Point","coordinates":[-109.29663,33.05086]}},{"properties":{"latitude":34.0331111,"column_5":1,"date":{"end_time":"2006/10/15 00:00:00 -0400","original":"10/14/2006","granularity":"day","time":"2006/10/14 00:00:00 -0400"},"longitude":-109.2382056,"id":"adv9lt0kcxcc","location":"Sipe White Mountain WA"},"type":"Feature","geometry":{"type":"Point","coordinates":[-109.2382056,34.0331111]}},{"properties":{"latitude":34.0360261,"column_5":1,"date":{"end_time":"2006/10/16 00:00:00 -0400","original":"10/15/2006","granularity":"day","time":"2006/10/15 00:00:00 -0400"},"longitude":-109.4409211,"id":"adv9lsu2rzfb","location":"Greer Lakes"},"type":"Feature","geometry":{"type":"Point","coordinates":[-109.4409211,34.0360261]}},{"properties":{"latitude":34.1573984,"column_5":1,"date":{"end_time":"2006/10/16 00:00:00 -0400","original":"10/15/2006","granularity":"day","time":"2006/10/15 00:00:00 -0400"},"longitude":-109.9815841,"id":"adv9lsw3boel","location":"Rainbow Reservoir"},"type":"Feature","geometry":{"type":"Point","coordinates":[-109.9815841,34.1573984]}},{"properties":{"latitude":34.1905296,"column_5":1,"date":{"end_time":"2006/10/16 00:00:00 -0400","original":"10/15/2006","granularity":"day","time":"2006/10/15 00:00:00 -0400"},"longitude":-110.0027334,"id":"adv9lt6r4r9e","location":"Show Low Lake"},"type":"Feature","geometry":{"type":"Point","coordinates":[-110.0027334,34.1905296]}},{"properties":{"latitude":34.1755122,"column_5":1,"date":{"end_time":"2006/10/16 00:00:00 -0400","original":"10/15/2006","granularity":"day","time":"2006/10/15 00:00:00 -0400"},"longitude":-109.9589536,"id":"adv9lsz2i8h1","location":"Scott Reservoir"},"type":"Feature","geometry":{"type":"Point","coordinates":[-109.9589536,34.1755122]}},{"properties":{"latitude":34.11115,"column_5":1,"date":{"end_time":"2006/10/16 00:00:00 -0400","original":"10/15/2006","granularity":"day","time":"2006/10/15 00:00:00 -0400"},"longitude":-109.29164,"id":"adv9lsvojvnc","location":"Eagar"},"type":"Feature","geometry":{"type":"Point","coordinates":[-109.29164,34.11115]}},{"properties":{"latitude":34.2260016,"column_5":1,"date":{"end_time":"2006/10/22 00:00:00 -0400","original":"10/21/2006","granularity":"day","time":"2006/10/21 00:00:00 -0400"},"longitude":-114.1991232,"id":"adv9lswv7pmp","location":"CA: Hwy. 105--Parker Dam to Parker"},"type":"Feature","geometry":{"type":"Point","coordinates":[-114.1991232,34.2260016]}},{"properties":{"latitude":32.467804,"column_5":1,"date":{"end_time":"2006/11/11 00:00:00 -0500","original":"11/10/2006","granularity":"day","time":"2006/11/10 00:00:00 -0500"},"longitude":-110.89894,"id":"adv9lt2wc2rw","location":"AZ: Doug J's House"},"type":"Feature","geometry":{"type":"Point","coordinates":[-110.89894,32.467804]}},{"properties":{"latitude":34.8481,"column_5":1,"date":{"end_time":"2006/11/12 00:00:00 -0500","original":"11/11/2006","granularity":"day","time":"2006/11/11 00:00:00 -0500"},"longitude":-114.6138,"id":"adv9lsu9hbuc","location":"Needles"},"type":"Feature","geometry":{"type":"Point","coordinates":[-114.6138,34.8481]}},{"properties":{"latitude":34.1465028,"column_5":1,"date":{"end_time":"2006/11/13 00:00:00 -0500","original":"11/12/2006","granularity":"day","time":"2006/11/12 00:00:00 -0500"},"longitude":-114.30875,"id":"adv9lsqruijr","location":"Parker Oasis"},"type":"Feature","geometry":{"type":"Point","coordinates":[-114.30875,34.1465028]}},{"properties":{"latitude":33.1617833,"column_5":1,"date":{"end_time":"2006/11/14 00:00:00 -0500","original":"11/13/2006","granularity":"day","time":"2006/11/13 00:00:00 -0500"},"longitude":-111.1637667,"id":"adv9lsx13g5n","location":"Box Canyon/Martinez Canyon (Pinal Co.)"},"type":"Feature","geometry":{"type":"Point","coordinates":[-111.1637667,33.1617833]}},{"properties":{"latitude":33.052106,"column_5":1,"date":{"end_time":"2006/11/17 00:00:00 -0500","original":"11/16/2006","granularity":"day","time":"2006/11/16 00:00:00 -0500"},"longitude":-110.89822,"id":"adv9lt0tmxsj","location":"Kearny Lake"},"type":"Feature","geometry":{"type":"Point","coordinates":[-110.89822,33.052106]}},{"properties":{"latitude":33.047518,"column_5":1,"date":{"end_time":"2006/11/19 00:00:00 -0500","original":"11/18/2006","granularity":"day","time":"2006/11/18 00:00:00 -0500"},"longitude":-109.098946,"id":"adv9lt3kn8eh","location":"AZ: Hwy. 78--Border to 191"},"type":"Feature","geometry":{"type":"Point","coordinates":[-109.098946,33.047518]}},{"properties":{"latitude":33.32343,"column_5":1,"date":{"end_time":"2006/11/19 00:00:00 -0500","original":"11/18/2006","granularity":"day","time":"2006/11/18 00:00:00 -0500"},"longitude":-108.641988,"id":"adv9lt17aioo","location":"Gila NF -- Whitewater Baldy"},"type":"Feature","geometry":{"type":"Point","coordinates":[-108.641988,33.32343]}},{"properties":{"latitude":33.31676,"column_5":1,"date":{"end_time":"2006/11/19 00:00:00 -0500","original":"11/18/2006","granularity":"day","time":"2006/11/18 00:00:00 -0500"},"longitude":-108.88262,"id":"adv9lsznh94v","location":"Glenwood"},"type":"Feature","geometry":{"type":"Point","coordinates":[-108.88262,33.31676]}},{"properties":{"latitude":33.12197,"column_5":1,"date":{"end_time":"2006/11/19 00:00:00 -0500","original":"11/18/2006","granularity":"day","time":"2006/11/18 00:00:00 -0500"},"longitude":-108.95662,"id":"adv9lsz6mhi0","location":"Mule Creek"},"type":"Feature","geometry":{"type":"Point","coordinates":[-108.95662,33.12197]}},{"properties":{"latitude":39.3964796,"column_5":1,"date":{"end_time":"2006/11/26 00:00:00 -0500","original":"11/25/2006","granularity":"day","time":"2006/11/25 00:00:00 -0500"},"longitude":-94.5550346,"id":"adv9lsrahc5w","location":"Smithville Lake"},"type":"Feature","geometry":{"type":"Point","coordinates":[-94.5550346,39.3964796]}},{"properties":{"latitude":39.9523972,"column_5":1,"date":{"end_time":"2006/11/26 00:00:00 -0500","original":"11/25/2006","granularity":"day","time":"2006/11/25 00:00:00 -0500"},"longitude":-93.6747111,"id":"adv9lsx098e3","location":"Poosey CA"},"type":"Feature","geometry":{"type":"Point","coordinates":[-93.6747111,39.9523972]}},{"properties":{"latitude":39.41834,"column_5":1,"date":{"end_time":"2006/11/26 00:00:00 -0500","original":"11/25/2006","granularity":"day","time":"2006/11/25 00:00:00 -0500"},"longitude":-92.43828,"id":"adv9lt3mtd8l","location":"Moberly"},"type":"Feature","geometry":{"type":"Point","coordinates":[-92.43828,39.41834]}},{"properties":{"latitude":39.44063,"column_5":1,"date":{"end_time":"2006/11/26 00:00:00 -0500","original":"11/25/2006","granularity":"day","time":"2006/11/25 00:00:00 -0500"},"longitude":-92.54518,"id":"adv9lsxbx957","location":"Huntsville"},"type":"Feature","geometry":{"type":"Point","coordinates":[-92.54518,39.44063]}},{"properties":{"latitude":32.2784568,"column_5":1,"date":{"end_time":"2006/12/12 00:00:00 -0500","original":"12/11/2006","granularity":"day","time":"2006/12/11 00:00:00 -0500"},"longitude":-110.9507239,"id":"adv9lsx1ux8j","location":"AZ: Tucson--Rich Hoyer's House"},"type":"Feature","geometry":{"type":"Point","coordinates":[-110.9507239,32.2784568]}},{"properties":{"latitude":40.1310997,"column_5":1,"date":{"end_time":"2006/12/18 00:00:00 -0500","original":"12/17/2006","granularity":"day","time":"2006/12/17 00:00:00 -0500"},"longitude":-95.2316513,"id":"adv9lt24igi9","location":"Mound City"},"type":"Feature","geometry":{"type":"Point","coordinates":[-95.2316513,40.1310997]}},{"properties":{"latitude":39.7222,"column_5":1,"date":{"end_time":"2006/12/18 00:00:00 -0500","original":"12/17/2006","granularity":"day","time":"2006/12/17 00:00:00 -0500"},"longitude":-94.64164,"id":"adv9lt2uismg","location":"Easton"},"type":"Feature","geometry":{"type":"Point","coordinates":[-94.64164,39.7222]}},{"properties":{"latitude":39.15675,"column_5":1,"date":{"end_time":"2006/12/22 00:00:00 -0500","original":"12/21/2006","granularity":"day","time":"2006/12/21 00:00:00 -0500"},"longitude":-90.61792,"id":"adv9lt4jg9h2","location":"Hardin"},"type":"Feature","geometry":{"type":"Point","coordinates":[-90.61792,39.15675]}},{"properties":{"latitude":39.2000678,"column_5":1,"date":{"end_time":"2006/12/22 00:00:00 -0500","original":"12/21/2006","granularity":"day","time":"2006/12/21 00:00:00 -0500"},"longitude":-90.6100845,"id":"adv9lsy921o6","location":"IL: Godar-Diamond WMA"},"type":"Feature","geometry":{"type":"Point","coordinates":[-90.6100845,39.2000678]}},{"properties":{"latitude":38.84835,"column_5":1,"date":{"end_time":"2007/01/03 00:00:00 -0500","original":"1/2/2007","granularity":"day","time":"2007/01/02 00:00:00 -0500"},"longitude":-90.07621,"id":"adv9lsxnifat","location":"Roxana"},"type":"Feature","geometry":{"type":"Point","coordinates":[-90.07621,38.84835]}},{"properties":{"latitude":36.1749687,"column_5":1,"date":{"end_time":"2007/01/07 00:00:00 -0500","original":"1/6/2007","granularity":"day","time":"2007/01/06 00:00:00 -0500"},"longitude":-115.1368332,"id":"adv9lsyh278u","location":"Las Vegas"},"type":"Feature","geometry":{"type":"Point","coordinates":[-115.1368332,36.1749687]}},{"properties":{"latitude":31.8069409,"column_5":1,"date":{"end_time":"2007/01/10 00:00:00 -0500","original":"1/9/2007","granularity":"day","time":"2007/01/09 00:00:00 -0500"},"longitude":-106.559186,"id":"adv9lt72xe15","location":"El Paso -- Sunland Park Racetrack"},"type":"Feature","geometry":{"type":"Point","coordinates":[-106.559186,31.8069409]}},{"properties":{"latitude":31.8211005,"column_5":1,"date":{"end_time":"2007/01/10 00:00:00 -0500","original":"1/9/2007","granularity":"day","time":"2007/01/09 00:00:00 -0500"},"longitude":-106.5596067,"id":"adv9lstjcvyy","location":"Keystone Heritage Park (FWTX 6)"},"type":"Feature","geometry":{"type":"Point","coordinates":[-106.5596067,31.8211005]}},{"properties":{"latitude":31.9772111,"column_5":1,"date":{"end_time":"2007/01/10 00:00:00 -0500","original":"1/9/2007","granularity":"day","time":"2007/01/09 00:00:00 -0500"},"longitude":-108.6268902,"id":"adv9lsr4ezrp","location":"NM: Playas Valley"},"type":"Feature","geometry":{"type":"Point","coordinates":[-108.6268902,31.9772111]}},{"properties":{"latitude":31.94899,"column_5":1,"date":{"end_time":"2007/01/10 00:00:00 -0500","original":"1/9/2007","granularity":"day","time":"2007/01/09 00:00:00 -0500"},"longitude":-108.80761,"id":"adv9lt5upxyf","location":"Animas"},"type":"Feature","geometry":{"type":"Point","coordinates":[-108.80761,31.94899]}},{"properties":{"latitude":32.31229,"column_5":1,"date":{"end_time":"2007/01/10 00:00:00 -0500","original":"1/9/2007","granularity":"day","time":"2007/01/09 00:00:00 -0500"},"longitude":-106.77856,"id":"adv9lt0wxpq7","location":"Las Cruces"},"type":"Feature","geometry":{"type":"Point","coordinates":[-106.77856,32.31229]}},{"properties":{"latitude":31.8248499,"column_5":1,"date":{"end_time":"2007/01/10 00:00:00 -0500","original":"1/9/2007","granularity":"day","time":"2007/01/09 00:00:00 -0500"},"longitude":-107.6408367,"id":"adv9lt4z85mm","location":"Pancho Villa SP"},"type":"Feature","geometry":{"type":"Point","coordinates":[-107.6408367,31.8248499]}},{"properties":{"latitude":32.2625316,"column_5":1,"date":{"end_time":"2007/01/11 00:00:00 -0500","original":"1/10/2007","granularity":"day","time":"2007/01/10 00:00:00 -0500"},"longitude":-111.2786293,"id":"adv9lsrzai51","location":"AZ: Avra Valley--north end"},"type":"Feature","geometry":{"type":"Point","coordinates":[-111.2786293,32.2625316]}},{"properties":{"latitude":33.3519677,"column_5":1,"date":{"end_time":"2007/01/13 00:00:00 -0500","original":"1/12/2007","granularity":"day","time":"2007/01/12 00:00:00 -0500"},"longitude":-112.4316788,"id":"adv9lsz6ravz","location":"Estrella Mountain Ranch Golf Club"},"type":"Feature","geometry":{"type":"Point","coordinates":[-112.4316788,33.3519677]}},{"properties":{"latitude":33.333827,"column_5":1,"date":{"end_time":"2007/01/13 00:00:00 -0500","original":"1/12/2007","granularity":"day","time":"2007/01/12 00:00:00 -0500"},"longitude":-112.6944065,"id":"adv9lt6tpvsr","location":"AZ: Palo Verde--Narramore Rd. area"},"type":"Feature","geometry":{"type":"Point","coordinates":[-112.6944065,33.333827]}},{"properties":{"latitude":33.3750279,"column_5":1,"date":{"end_time":"2007/01/13 00:00:00 -0500","original":"1/12/2007","granularity":"day","time":"2007/01/12 00:00:00 -0500"},"longitude":-112.7702946,"id":"adv9lt53kvbk","location":"Baseline Rd/Salome Hwy (Thrasher Spot)"},"type":"Feature","geometry":{"type":"Point","coordinates":[-112.7702946,33.3750279]}},{"properties":{"latitude":32.7127114,"column_5":1,"date":{"end_time":"2007/01/13 00:00:00 -0500","original":"1/12/2007","granularity":"day","time":"2007/01/12 00:00:00 -0500"},"longitude":-113.9035892,"id":"adv9lsw2jivy","location":"Tacna Migrant Trap"},"type":"Feature","geometry":{"type":"Point","coordinates":[-113.9035892,32.7127114]}},{"properties":{"latitude":31.8886356,"column_5":1,"date":{"end_time":"2007/01/16 00:00:00 -0500","original":"1/15/2007","granularity":"day","time":"2007/01/15 00:00:00 -0500"},"longitude":-110.9454346,"id":"adv9lstbb6w8","location":"Quail Creek Country Club"},"type":"Feature","geometry":{"type":"Point","coordinates":[-110.9454346,31.8886356]}},{"properties":{"latitude":33.1869128,"column_5":1,"date":{"end_time":"2007/01/22 00:00:00 -0500","original":"1/21/2007","granularity":"day","time":"2007/01/21 00:00:00 -0500"},"longitude":-110.4407501,"id":"adv9lsxccw6t","location":"San Carlos Lake (Graham Co.)"},"type":"Feature","geometry":{"type":"Point","coordinates":[-110.4407501,33.1869128]}},{"properties":{"latitude":31.88257,"column_5":1,"date":{"end_time":"2007/01/25 00:00:00 -0500","original":"1/24/2007","granularity":"day","time":"2007/01/24 00:00:00 -0500"},"longitude":-112.81571,"id":"adv9lsvt8rjt","location":"Lukeville"},"type":"Feature","geometry":{"type":"Point","coordinates":[-112.81571,31.88257]}},{"properties":{"latitude":31.727,"column_5":1,"date":{"end_time":"2007/01/29 00:00:00 -0500","original":"1/28/2007","granularity":"day","time":"2007/01/28 00:00:00 -0500"},"longitude":-110.88,"id":"adv9lswkhqnz","location":"Madera Canyon--Madera Picnic Area"},"type":"Feature","geometry":{"type":"Point","coordinates":[-110.88,31.727]}},{"properties":{"latitude":32.43677,"column_5":1,"date":{"end_time":"2007/02/08 00:00:00 -0500","original":"2/7/2007","granularity":"day","time":"2007/02/07 00:00:00 -0500"},"longitude":-111.22566,"id":"adv9lt4fqwvk","location":"Marana"},"type":"Feature","geometry":{"type":"Point","coordinates":[-111.22566,32.43677]}},{"properties":{"latitude":31.65979,"column_5":1,"date":{"end_time":"2007/02/15 00:00:00 -0500","original":"2/14/2007","granularity":"day","time":"2007/02/14 00:00:00 -0500"},"longitude":-110.52563,"id":"adv9lsr4h3o4","location":"Elgin"},"type":"Feature","geometry":{"type":"Point","coordinates":[-110.52563,31.65979]}},{"properties":{"latitude":31.8539397,"column_5":1,"date":{"end_time":"2007/02/19 00:00:00 -0500","original":"2/18/2007","granularity":"day","time":"2007/02/18 00:00:00 -0500"},"longitude":-108.8037872,"id":"adv9lt46cmiu","location":"Animas Valley"},"type":"Feature","geometry":{"type":"Point","coordinates":[-108.8037872,31.8539397]}},{"properties":{"latitude":31.518628,"column_5":1,"date":{"end_time":"2007/02/19 00:00:00 -0500","original":"2/18/2007","granularity":"day","time":"2007/02/18 00:00:00 -0500"},"longitude":-109.0053371,"id":"adv9lsz4nj4h","location":"Clanton Canyon"},"type":"Feature","geometry":{"type":"Point","coordinates":[-109.0053371,31.518628]}},{"properties":{"latitude":31.3445,"column_5":1,"date":{"end_time":"2007/02/19 00:00:00 -0500","original":"2/18/2007","granularity":"day","time":"2007/02/18 00:00:00 -0500"},"longitude":-109.54562,"id":"adv9lstp42wk","location":"Douglas"},"type":"Feature","geometry":{"type":"Point","coordinates":[-109.54562,31.3445]}},{"properties":{"latitude":31.6257,"column_5":1,"date":{"end_time":"2007/02/25 00:00:00 -0500","original":"2/24/2007","granularity":"day","time":"2007/02/24 00:00:00 -0500"},"longitude":-110.1735992,"id":"adv9lstb3p3v","location":"San Pedro RNCA--Charleston Bridge"},"type":"Feature","geometry":{"type":"Point","coordinates":[-110.1735992,31.6257]}},{"properties":{"latitude":34.0507216,"column_5":1,"date":{"end_time":"2007/03/13 00:00:00 -0400","original":"3/12/2007","granularity":"day","time":"2007/03/12 00:00:00 -0400"},"longitude":-116.5693831,"id":"adv9lstdhoj3","location":"Big Morongo Canyon Preserve"},"type":"Feature","geometry":{"type":"Point","coordinates":[-116.5693831,34.0507216]}},{"properties":{"latitude":33.1774666,"column_5":1,"date":{"end_time":"2007/03/14 00:00:00 -0400","original":"3/13/2007","granularity":"day","time":"2007/03/13 00:00:00 -0400"},"longitude":-115.6150961,"id":"adv9lt1kbu9s","location":"Salton Sea NWR--Unit 2 / Visitor Center"},"type":"Feature","geometry":{"type":"Point","coordinates":[-115.6150961,33.1774666]}},{"properties":{"latitude":33.0765879,"column_5":1,"date":{"end_time":"2007/03/14 00:00:00 -0400","original":"3/13/2007","granularity":"day","time":"2007/03/13 00:00:00 -0400"},"longitude":-115.5110643,"id":"adv9lsub927r","location":"Ramer Lake"},"type":"Feature","geometry":{"type":"Point","coordinates":[-115.5110643,33.0765879]}},{"properties":{"latitude":33.2806736,"column_5":1,"date":{"end_time":"2007/03/14 00:00:00 -0400","original":"3/13/2007","granularity":"day","time":"2007/03/13 00:00:00 -0400"},"longitude":-115.5796909,"id":"adv9lt2siabc","location":"Salton Sea--Wister Unit"},"type":"Feature","geometry":{"type":"Point","coordinates":[-115.5796909,33.2806736]}},{"properties":{"latitude":33.0972222,"column_5":1,"date":{"end_time":"2007/03/14 00:00:00 -0400","original":"3/13/2007","granularity":"day","time":"2007/03/13 00:00:00 -0400"},"longitude":-115.7527256,"id":"adv9lsrb6wo1","location":"Salton Sea--Poe Rd."},"type":"Feature","geometry":{"type":"Point","coordinates":[-115.7527256,33.0972222]}},{"properties":{"latitude":33.40423,"column_5":1,"date":{"end_time":"2007/03/14 00:00:00 -0400","original":"3/13/2007","granularity":"day","time":"2007/03/13 00:00:00 -0400"},"longitude":-116.03984,"id":"adv9lt0pado5","location":"Desert Shores"},"type":"Feature","geometry":{"type":"Point","coordinates":[-116.03984,33.40423]}},{"properties":{"latitude":33.063,"column_5":1,"date":{"end_time":"2007/03/15 00:00:00 -0400","original":"3/14/2007","granularity":"day","time":"2007/03/14 00:00:00 -0400"},"longitude":-117.119,"id":"adv9lssx5eo3","location":"Lake Hodges--Del Dios area"},"type":"Feature","geometry":{"type":"Point","coordinates":[-117.119,33.063]}},{"properties":{"latitude":32.6985809,"column_5":1,"date":{"end_time":"2007/03/16 00:00:00 -0400","original":"3/15/2007","granularity":"day","time":"2007/03/15 00:00:00 -0400"},"longitude":-117.2452163,"id":"adv9lssgnkzw","location":"Point Loma--general area"},"type":"Feature","geometry":{"type":"Point","coordinates":[-117.2452163,32.6985809]}},{"properties":{"latitude":32.7302163,"column_5":1,"date":{"end_time":"2007/03/16 00:00:00 -0400","original":"3/15/2007","granularity":"day","time":"2007/03/15 00:00:00 -0400"},"longitude":-117.2565866,"id":"adv9lt5nkz1b","location":"Sunset Cliffs"},"type":"Feature","geometry":{"type":"Point","coordinates":[-117.2565866,32.7302163]}},{"properties":{"latitude":33.0072018,"column_5":1,"date":{"end_time":"2007/03/16 00:00:00 -0400","original":"3/15/2007","granularity":"day","time":"2007/03/15 00:00:00 -0400"},"longitude":-117.2717335,"id":"adv9lt489kmt","location":"San Elijo Lagoon--west"},"type":"Feature","geometry":{"type":"Point","coordinates":[-117.2717335,33.0072018]}},{"properties":{"latitude":32.850955,"column_5":1,"date":{"end_time":"2007/03/16 00:00:00 -0400","original":"3/15/2007","granularity":"day","time":"2007/03/15 00:00:00 -0400"},"longitude":-117.2734281,"id":"adv9lt1q5kvj","location":"Point La Jolla"},"type":"Feature","geometry":{"type":"Point","coordinates":[-117.2734281,32.850955]}},{"properties":{"latitude":33.3397787,"column_5":1,"date":{"end_time":"2007/03/17 00:00:00 -0400","original":"3/16/2007","granularity":"day","time":"2007/03/16 00:00:00 -0400"},"longitude":-116.9043159,"id":"adv9lsvkvm9d","location":"Palomar Mountain SP"},"type":"Feature","geometry":{"type":"Point","coordinates":[-116.9043159,33.3397787]}},{"properties":{"latitude":33.2414872,"column_5":1,"date":{"end_time":"2007/03/17 00:00:00 -0400","original":"3/16/2007","granularity":"day","time":"2007/03/16 00:00:00 -0400"},"longitude":-116.7566872,"id":"adv9lsvms19u","location":"Lake Henshaw"},"type":"Feature","geometry":{"type":"Point","coordinates":[-116.7566872,33.2414872]}},{"properties":{"latitude":33.3572013,"column_5":1,"date":{"end_time":"2007/03/17 00:00:00 -0400","original":"3/16/2007","granularity":"day","time":"2007/03/16 00:00:00 -0400"},"longitude":-116.8644905,"id":"adv9lt28g37d","location":"Palomar Observatory"},"type":"Feature","geometry":{"type":"Point","coordinates":[-116.8644905,33.3572013]}},{"properties":{"latitude":32.7566723,"column_5":1,"date":{"end_time":"2007/03/18 00:00:00 -0400","original":"3/17/2007","granularity":"day","time":"2007/03/17 00:00:00 -0400"},"longitude":-117.2405199,"id":"adv9lswkjy93","location":"San Diego River--west of bridges"},"type":"Feature","geometry":{"type":"Point","coordinates":[-117.2405199,32.7566723]}},{"properties":{"latitude":32.5710707,"column_5":1,"date":{"end_time":"2007/03/18 00:00:00 -0400","original":"3/17/2007","granularity":"day","time":"2007/03/17 00:00:00 -0400"},"longitude":-117.1290303,"id":"adv9lsw51q2p","location":"Tijuana Slough NWR"},"type":"Feature","geometry":{"type":"Point","coordinates":[-117.1290303,32.5710707]}},{"properties":{"latitude":32.764037,"column_5":1,"date":{"end_time":"2007/03/18 00:00:00 -0400","original":"3/17/2007","granularity":"day","time":"2007/03/17 00:00:00 -0400"},"longitude":-115.7021713,"id":"adv9lswpxpb8","location":"Fig Lagoon"},"type":"Feature","geometry":{"type":"Point","coordinates":[-115.7021713,32.764037]}},{"properties":{"latitude":32.53472,"column_5":1,"date":{"end_time":"2007/03/18 00:00:00 -0400","original":"3/17/2007","granularity":"day","time":"2007/03/17 00:00:00 -0400"},"longitude":-117.04361,"id":"adv9lt6hujxj","location":"Tijuana"},"type":"Feature","geometry":{"type":"Point","coordinates":[-117.04361,32.53472]}},{"properties":{"latitude":32.6931324,"column_5":1,"date":{"end_time":"2007/03/25 00:00:00 -0400","original":"3/24/2007","granularity":"day","time":"2007/03/24 00:00:00 -0400"},"longitude":-110.8808899,"id":"adv9lt0atd00","location":"AZ: Willow Spring Rd."},"type":"Feature","geometry":{"type":"Point","coordinates":[-110.8808899,32.6931324]}},{"properties":{"latitude":31.4253006,"column_5":1,"date":{"end_time":"2007/03/26 00:00:00 -0400","original":"3/25/2007","granularity":"day","time":"2007/03/25 00:00:00 -0400"},"longitude":-110.4540024,"id":"adv9lszj1f37","location":"Parker Canyon Lake"},"type":"Feature","geometry":{"type":"Point","coordinates":[-110.4540024,31.4253006]}},{"properties":{"latitude":31.45,"column_5":1,"date":{"end_time":"2007/03/26 00:00:00 -0400","original":"3/25/2007","granularity":"day","time":"2007/03/25 00:00:00 -0400"},"longitude":-110.4,"id":"adv9lsykhena","location":"Scotia Canyon"},"type":"Feature","geometry":{"type":"Point","coordinates":[-110.4,31.45]}},{"properties":{"latitude":31.442,"column_5":1,"date":{"end_time":"2007/03/26 00:00:00 -0400","original":"3/25/2007","granularity":"day","time":"2007/03/25 00:00:00 -0400"},"longitude":-110.396,"id":"adv9lt1bgcbb","location":"Sunnyside Canyon"},"type":"Feature","geometry":{"type":"Point","coordinates":[-110.396,31.442]}},{"properties":{"latitude":27.9209379,"column_5":1,"date":{"end_time":"2007/04/01 00:00:00 -0400","original":"3/31/2007","granularity":"day","time":"2007/03/31 00:00:00 -0400"},"longitude":-110.9181404,"id":"adv9lt3787w1","location":"Guaymas"},"type":"Feature","geometry":{"type":"Point","coordinates":[-110.9181404,27.9209379]}},{"properties":{"latitude":27.955591,"column_5":1,"date":{"end_time":"2007/04/02 00:00:00 -0400","original":"4/1/2007","granularity":"day","time":"2007/04/01 00:00:00 -0400"},"longitude":-110.9763336,"id":"adv9lsyfbj8w","location":"Estero de Soldado, San Carlos"},"type":"Feature","geometry":{"type":"Point","coordinates":[-110.9763336,27.955591]}},{"properties":{"latitude":28.63972,"column_5":1,"date":{"end_time":"2007/04/02 00:00:00 -0400","original":"4/1/2007","granularity":"day","time":"2007/04/01 00:00:00 -0400"},"longitude":-111.52639,"id":"adv9lsrxbopq","location":"Hermosillo"},"type":"Feature","geometry":{"type":"Point","coordinates":[-111.52639,28.63972]}},{"properties":{"latitude":32.2090248,"column_5":1,"date":{"end_time":"2007/04/14 00:00:00 -0400","original":"4/13/2007","granularity":"day","time":"2007/04/13 00:00:00 -0400"},"longitude":-110.9941006,"id":"adv9lt75916l","location":"Sentinel Peak Park"},"type":"Feature","geometry":{"type":"Point","coordinates":[-110.9941006,32.2090248]}},{"properties":{"latitude":31.4088134,"column_5":1,"date":{"end_time":"2007/04/26 00:00:00 -0400","original":"4/25/2007","granularity":"day","time":"2007/04/25 00:00:00 -0400"},"longitude":-110.1067829,"id":"adv9lsszfn8z","location":"Casa de San Pedro B&amp;B"},"type":"Feature","geometry":{"type":"Point","coordinates":[-110.1067829,31.4088134]}},{"properties":{"latitude":31.91369,"column_5":1,"date":{"end_time":"2007/05/07 00:00:00 -0400","original":"5/6/2007","granularity":"day","time":"2007/05/06 00:00:00 -0400"},"longitude":-109.14162,"id":"adv9lt2wq0vj","location":"Portal"},"type":"Feature","geometry":{"type":"Point","coordinates":[-109.14162,31.91369]}},{"properties":{"latitude":31.9350554,"column_5":1,"date":{"end_time":"2007/05/07 00:00:00 -0400","original":"5/6/2007","granularity":"day","time":"2007/05/06 00:00:00 -0400"},"longitude":-109.2191966,"id":"adv9lsy2cpvy","location":"Paradise--George Walker House"},"type":"Feature","geometry":{"type":"Point","coordinates":[-109.2191966,31.9350554]}},{"properties":{"latitude":31.7828999,"column_5":1,"date":{"end_time":"2007/05/07 00:00:00 -0400","original":"5/6/2007","granularity":"day","time":"2007/05/06 00:00:00 -0400"},"longitude":-110.8856964,"id":"adv9lsvtd8j5","location":"Florida Wash"},"type":"Feature","geometry":{"type":"Point","coordinates":[-110.8856964,31.7828999]}},{"properties":{"latitude":38.8925192,"column_5":1,"date":{"end_time":"2007/05/17 00:00:00 -0400","original":"5/16/2007","granularity":"day","time":"2007/05/16 00:00:00 -0400"},"longitude":-92.4479556,"id":"adv9lsvwvxgj","location":"McBaine Wetland Cells"},"type":"Feature","geometry":{"type":"Point","coordinates":[-92.4479556,38.8925192]}},{"properties":{"latitude":38.948985,"column_5":1,"date":{"end_time":"2007/05/18 00:00:00 -0400","original":"5/17/2007","granularity":"day","time":"2007/05/17 00:00:00 -0400"},"longitude":-91.995095,"id":"adv9lsw8lqsw","location":"Tucker Prairie"},"type":"Feature","geometry":{"type":"Point","coordinates":[-91.995095,38.948985]}},{"properties":{"latitude":38.342767,"column_5":1,"date":{"end_time":"2007/05/19 00:00:00 -0400","original":"5/18/2007","granularity":"day","time":"2007/05/18 00:00:00 -0400"},"longitude":-93.0818367,"id":"adv9lt6u16re","location":"Big Buffalo Creek CA"},"type":"Feature","geometry":{"type":"Point","coordinates":[-93.0818367,38.342767]}},{"properties":{"latitude":38.5515049,"column_5":1,"date":{"end_time":"2007/05/19 00:00:00 -0400","original":"5/18/2007","granularity":"day","time":"2007/05/18 00:00:00 -0400"},"longitude":-93.2971859,"id":"adv9lsrskh9v","location":"Friendly Prairie CA"},"type":"Feature","geometry":{"type":"Point","coordinates":[-93.2971859,38.5515049]}},{"properties":{"latitude":38.565717,"column_5":1,"date":{"end_time":"2007/05/19 00:00:00 -0400","original":"5/18/2007","granularity":"day","time":"2007/05/18 00:00:00 -0400"},"longitude":-93.3038807,"id":"adv9lstzhkgr","location":"Grandfather Prairie CA"},"type":"Feature","geometry":{"type":"Point","coordinates":[-93.3038807,38.565717]}},{"properties":{"latitude":38.38353,"column_5":1,"date":{"end_time":"2007/05/22 00:00:00 -0400","original":"5/21/2007","granularity":"day","time":"2007/05/21 00:00:00 -0400"},"longitude":-93.79645,"id":"adv9lsqu20mj","location":"Henry"},"type":"Feature","geometry":{"type":"Point","coordinates":[-93.79645,38.38353]}},{"properties":{"latitude":38.3047484,"column_5":1,"date":{"end_time":"2007/05/22 00:00:00 -0400","original":"5/21/2007","granularity":"day","time":"2007/05/21 00:00:00 -0400"},"longitude":-93.9582531,"id":"adv9lsuev1xp","location":"Montrose CA"},"type":"Feature","geometry":{"type":"Point","coordinates":[-93.9582531,38.3047484]}},{"properties":{"latitude":38.5335974,"column_5":1,"date":{"end_time":"2007/05/22 00:00:00 -0400","original":"5/21/2007","granularity":"day","time":"2007/05/21 00:00:00 -0400"},"longitude":-93.293066,"id":"adv9lt46lq2g","location":"Drover's Prairie CA"},"type":"Feature","geometry":{"type":"Point","coordinates":[-93.293066,38.5335974]}},{"properties":{"latitude":37.1821338,"column_5":1,"date":{"end_time":"2007/05/24 00:00:00 -0400","original":"5/23/2007","granularity":"day","time":"2007/05/23 00:00:00 -0400"},"longitude":-91.1752796,"id":"adv9lsuzjsmr","location":"Ozark National Scenic Riverways--Powder Mill"},"type":"Feature","geometry":{"type":"Point","coordinates":[-91.1752796,37.1821338]}},{"properties":{"latitude":36.9521553,"column_5":1,"date":{"end_time":"2007/05/25 00:00:00 -0400","original":"5/24/2007","granularity":"day","time":"2007/05/24 00:00:00 -0400"},"longitude":-90.993855,"id":"adv9lsvuy0pe","location":"Ozark National Scenic Riverways--Big Spring"},"type":"Feature","geometry":{"type":"Point","coordinates":[-90.993855,36.9521553]}},{"properties":{"latitude":37.1661305,"column_5":1,"date":{"end_time":"2007/05/26 00:00:00 -0400","original":"5/25/2007","granularity":"day","time":"2007/05/25 00:00:00 -0400"},"longitude":-91.1623406,"id":"adv9lsxt5o5e","location":"Ozark National Scenic Riverways--Blue Spring"},"type":"Feature","geometry":{"type":"Point","coordinates":[-91.1623406,37.1661305]}},{"properties":{"latitude":38.6581021,"column_5":1,"date":{"end_time":"2007/05/30 00:00:00 -0400","original":"5/29/2007","granularity":"day","time":"2007/05/29 00:00:00 -0400"},"longitude":-93.5113335,"id":"adv9lt5ztrk4","location":"Kearn WA"},"type":"Feature","geometry":{"type":"Point","coordinates":[-93.5113335,38.6581021]}},{"properties":{"latitude":38.62032,"column_5":1,"date":{"end_time":"2007/05/30 00:00:00 -0400","original":"5/29/2007","granularity":"day","time":"2007/05/29 00:00:00 -0400"},"longitude":-93.40941,"id":"adv9lt4scfay","location":"Green Ridge"},"type":"Feature","geometry":{"type":"Point","coordinates":[-93.40941,38.62032]}},{"properties":{"latitude":38.6008239,"column_5":1,"date":{"end_time":"2007/05/30 00:00:00 -0400","original":"5/29/2007","granularity":"day","time":"2007/05/29 00:00:00 -0400"},"longitude":-93.4729242,"id":"adv9lt3d4xxz","location":"Kearn CA"},"type":"Feature","geometry":{"type":"Point","coordinates":[-93.4729242,38.6008239]}},{"properties":{"latitude":38.8089315,"column_5":1,"date":{"end_time":"2007/05/30 00:00:00 -0400","original":"5/29/2007","granularity":"day","time":"2007/05/29 00:00:00 -0400"},"longitude":-93.1733966,"id":"adv9lsqsta3u","location":"MO: Pinhook Access"},"type":"Feature","geometry":{"type":"Point","coordinates":[-93.1733966,38.8089315]}},{"properties":{"latitude":38.5725283,"column_5":1,"date":{"end_time":"2007/05/31 00:00:00 -0400","original":"5/30/2007","granularity":"day","time":"2007/05/30 00:00:00 -0400"},"longitude":-93.2162046,"id":"adv9lt3tetps","location":"MO: Goodnight Henry Prairie"},"type":"Feature","geometry":{"type":"Point","coordinates":[-93.2162046,38.5725283]}},{"properties":{"latitude":38.2683085,"column_5":1,"date":{"end_time":"2007/05/31 00:00:00 -0400","original":"5/30/2007","granularity":"day","time":"2007/05/30 00:00:00 -0400"},"longitude":-93.3970928,"id":"adv9lt2170yh","location":"Harry S. Truman Reservoir Visitor Center"},"type":"Feature","geometry":{"type":"Point","coordinates":[-93.3970928,38.2683085]}},{"properties":{"latitude":38.6066358,"column_5":1,"date":{"end_time":"2007/06/02 00:00:00 -0400","original":"6/1/2007","granularity":"day","time":"2007/06/01 00:00:00 -0400"},"longitude":-90.2582139,"id":"adv9lt3d2oq3","location":"Tower Grove Park"},"type":"Feature","geometry":{"type":"Point","coordinates":[-90.2582139,38.6066358]}},{"properties":{"latitude":38.58335,"column_5":1,"date":{"end_time":"2007/06/02 00:00:00 -0400","original":"6/1/2007","granularity":"day","time":"2007/06/01 00:00:00 -0400"},"longitude":-90.40682,"id":"adv9lt0hiklh","location":"Kirkwood"},"type":"Feature","geometry":{"type":"Point","coordinates":[-90.40682,38.58335]}},{"properties":{"latitude":38.6767324,"column_5":1,"date":{"end_time":"2007/06/02 00:00:00 -0400","original":"6/1/2007","granularity":"day","time":"2007/06/01 00:00:00 -0400"},"longitude":-90.1974106,"id":"adv9lt3izg4j","location":"MO: St. Louis--Proctor and Gamble"},"type":"Feature","geometry":{"type":"Point","coordinates":[-90.1974106,38.6767324]}},{"properties":{"latitude":38.6600458,"column_5":1,"date":{"end_time":"2007/06/02 00:00:00 -0400","original":"6/1/2007","granularity":"day","time":"2007/06/01 00:00:00 -0400"},"longitude":-90.7437229,"id":"adv9lt45v2bs","location":"Weldon Spring CA--Katy Trail Access"},"type":"Feature","geometry":{"type":"Point","coordinates":[-90.7437229,38.6600458]}},{"properties":{"latitude":37.9769845,"column_5":1,"date":{"end_time":"2007/06/02 00:00:00 -0400","original":"6/1/2007","granularity":"day","time":"2007/06/01 00:00:00 -0400"},"longitude":-90.0294399,"id":"adv9lsrxh766","location":"MO: Ste. Genevieve--Marina"},"type":"Feature","geometry":{"type":"Point","coordinates":[-90.0294399,37.9769845]}},{"properties":{"latitude":38.6389068,"column_5":1,"date":{"end_time":"2007/06/02 00:00:00 -0400","original":"6/1/2007","granularity":"day","time":"2007/06/01 00:00:00 -0400"},"longitude":-90.2853806,"id":"adv9lt5pp2gk","location":"Forest Park"},"type":"Feature","geometry":{"type":"Point","coordinates":[-90.2853806,38.6389068]}},{"properties":{"latitude":38.6844917,"column_5":1,"date":{"end_time":"2007/06/02 00:00:00 -0400","original":"6/1/2007","granularity":"day","time":"2007/06/01 00:00:00 -0400"},"longitude":-90.7154722,"id":"adv9lsspzcjm","location":"Weldon Spring CA"},"type":"Feature","geometry":{"type":"Point","coordinates":[-90.7154722,38.6844917]}},{"properties":{"latitude":37.831531,"column_5":1,"date":{"end_time":"2007/06/02 00:00:00 -0400","original":"6/1/2007","granularity":"day","time":"2007/06/01 00:00:00 -0400"},"longitude":-89.7692013,"id":"adv9lt4yt5ca","location":"MO: Perry County--Hwy. C Barn Owl"},"type":"Feature","geometry":{"type":"Point","coordinates":[-89.7692013,37.831531]}},{"properties":{"latitude":36.60316,"column_5":1,"date":{"end_time":"2007/06/07 00:00:00 -0400","original":"6/6/2007","granularity":"day","time":"2007/06/06 00:00:00 -0400"},"longitude":-92.42826,"id":"adv9lst9e7ju","location":"Gainesville"},"type":"Feature","geometry":{"type":"Point","coordinates":[-92.42826,36.60316]}},{"properties":{"latitude":37.25085,"column_5":1,"date":{"end_time":"2007/06/08 00:00:00 -0400","original":"6/7/2007","granularity":"day","time":"2007/06/07 00:00:00 -0400"},"longitude":-92.51047,"id":"adv9lt25yhth","location":"Hartville"},"type":"Feature","geometry":{"type":"Point","coordinates":[-92.51047,37.25085]}},{"properties":{"latitude":38.8821471,"column_5":1,"date":{"end_time":"2007/06/08 00:00:00 -0400","original":"6/7/2007","granularity":"day","time":"2007/06/07 00:00:00 -0400"},"longitude":-90.9298897,"id":"adv9lt0chsfy","location":"MO: Indian Camp Creek Park"},"type":"Feature","geometry":{"type":"Point","coordinates":[-90.9298897,38.8821471]}},{"properties":{"latitude":38.5142919,"column_5":1,"date":{"end_time":"2007/06/12 00:00:00 -0400","original":"6/11/2007","granularity":"day","time":"2007/06/11 00:00:00 -0400"},"longitude":-90.675745,"id":"adv9lsynabeo","location":"MO: Six Flags St. Louis"},"type":"Feature","geometry":{"type":"Point","coordinates":[-90.675745,38.5142919]}},{"properties":{"latitude":38.903064,"column_5":1,"date":{"end_time":"2007/06/16 00:00:00 -0400","original":"6/15/2007","granularity":"day","time":"2007/06/15 00:00:00 -0400"},"longitude":-91.576316,"id":"adv9lsrgak2z","location":"Graham Cave SP"},"type":"Feature","geometry":{"type":"Point","coordinates":[-91.576316,38.903064]}},{"properties":{"latitude":38.81065,"column_5":1,"date":{"end_time":"2007/06/18 00:00:00 -0400","original":"6/17/2007","granularity":"day","time":"2007/06/17 00:00:00 -0400"},"longitude":-90.69983,"id":"adv9lstjqd53","location":"O'Fallon"},"type":"Feature","geometry":{"type":"Point","coordinates":[-90.69983,38.81065]}},{"properties":{"latitude":38.25862,"column_5":1,"date":{"end_time":"2007/06/20 00:00:00 -0400","original":"6/19/2007","granularity":"day","time":"2007/06/19 00:00:00 -0400"},"longitude":-94.33053,"id":"adv9lt0cbq04","location":"Butler"},"type":"Feature","geometry":{"type":"Point","coordinates":[-94.33053,38.25862]}},{"properties":{"latitude":38.80191,"column_5":1,"date":{"end_time":"2007/06/20 00:00:00 -0400","original":"6/19/2007","granularity":"day","time":"2007/06/19 00:00:00 -0400"},"longitude":-94.45273,"id":"adv9lt3t9sj9","location":"Raymore"},"type":"Feature","geometry":{"type":"Point","coordinates":[-94.45273,38.80191]}},{"properties":{"latitude":36.72816,"column_5":1,"date":{"end_time":"2007/06/22 00:00:00 -0400","original":"6/21/2007","granularity":"day","time":"2007/06/21 00:00:00 -0400"},"longitude":-91.85235,"id":"adv9lt53ajsn","location":"West Plains"},"type":"Feature","geometry":{"type":"Point","coordinates":[-91.85235,36.72816]}},{"properties":{"latitude":36.61646,"column_5":1,"date":{"end_time":"2007/06/22 00:00:00 -0400","original":"6/21/2007","granularity":"day","time":"2007/06/21 00:00:00 -0400"},"longitude":-92.06265,"id":"adv9lsvyn9uv","location":"Arditta"},"type":"Feature","geometry":{"type":"Point","coordinates":[-92.06265,36.61646]}},{"properties":{"latitude":36.7336565,"column_5":1,"date":{"end_time":"2007/06/22 00:00:00 -0400","original":"6/21/2007","granularity":"day","time":"2007/06/21 00:00:00 -0400"},"longitude":-92.7203178,"id":"adv9lt4bpejn","location":"MO: Baskin Bald"},"type":"Feature","geometry":{"type":"Point","coordinates":[-92.7203178,36.7336565]}},{"properties":{"latitude":39.44895,"column_5":1,"date":{"end_time":"2007/06/24 00:00:00 -0400","original":"6/23/2007","granularity":"day","time":"2007/06/23 00:00:00 -0400"},"longitude":-91.05154,"id":"adv9lt2ythja","location":"Louisiana"},"type":"Feature","geometry":{"type":"Point","coordinates":[-91.05154,39.44895]}},{"properties":{"latitude":36.6444657,"column_5":1,"date":{"end_time":"2007/06/28 00:00:00 -0400","original":"6/27/2007","granularity":"day","time":"2007/06/27 00:00:00 -0400"},"longitude":-89.2867215,"id":"adv9lsw6sics","location":"Big Oak Tree SP"},"type":"Feature","geometry":{"type":"Point","coordinates":[-89.2867215,36.6444657]}},{"properties":{"latitude":36.6146389,"column_5":1,"date":{"end_time":"2007/06/28 00:00:00 -0400","original":"6/27/2007","granularity":"day","time":"2007/06/27 00:00:00 -0400"},"longitude":-89.2896583,"id":"adv9lt55mmlc","location":"Seven Island CA"},"type":"Feature","geometry":{"type":"Point","coordinates":[-89.2896583,36.6146389]}},{"properties":{"latitude":36.5784546,"column_5":1,"date":{"end_time":"2007/06/28 00:00:00 -0400","original":"6/27/2007","granularity":"day","time":"2007/06/27 00:00:00 -0400"},"longitude":-89.5558906,"id":"adv9lsw0l2ww","location":"MO: New Madrid Bend Access"},"type":"Feature","geometry":{"type":"Point","coordinates":[-89.5558906,36.5784546]}},{"properties":{"latitude":36.19317,"column_5":1,"date":{"end_time":"2007/06/29 00:00:00 -0400","original":"6/28/2007","granularity":"day","time":"2007/06/28 00:00:00 -0400"},"longitude":-89.65568,"id":"adv9lt2ll2h3","location":"Caruthersville"},"type":"Feature","geometry":{"type":"Point","coordinates":[-89.65568,36.19317]}},{"properties":{"latitude":36.2323227,"column_5":1,"date":{"end_time":"2007/06/29 00:00:00 -0400","original":"6/28/2007","granularity":"day","time":"2007/06/28 00:00:00 -0400"},"longitude":-89.7028005,"id":"adv9lswasupi","location":"MO: Triangle Boat Club Access"},"type":"Feature","geometry":{"type":"Point","coordinates":[-89.7028005,36.2323227]}},{"properties":{"latitude":38.40895,"column_5":1,"date":{"end_time":"2007/06/29 00:00:00 -0400","original":"6/28/2007","granularity":"day","time":"2007/06/28 00:00:00 -0400"},"longitude":-90.57012,"id":"adv9lsth4d4z","location":"House Springs"},"type":"Feature","geometry":{"type":"Point","coordinates":[-90.57012,38.40895]}},{"properties":{"latitude":38.97363,"column_5":1,"date":{"end_time":"2007/07/02 00:00:00 -0400","original":"7/1/2007","granularity":"day","time":"2007/07/01 00:00:00 -0400"},"longitude":-92.74329,"id":"adv9lszk7pa5","location":"Boonville"},"type":"Feature","geometry":{"type":"Point","coordinates":[-92.74329,38.97363]}},{"properties":{"latitude":39.5378247,"column_5":1,"date":{"end_time":"2007/07/03 00:00:00 -0400","original":"7/2/2007","granularity":"day","time":"2007/07/02 00:00:00 -0400"},"longitude":-95.0568473,"id":"adv9lsyw72oz","location":"Lewis and Clark SP"},"type":"Feature","geometry":{"type":"Point","coordinates":[-95.0568473,39.5378247]}},{"properties":{"latitude":39.7223722,"column_5":1,"date":{"end_time":"2007/07/03 00:00:00 -0400","original":"7/2/2007","granularity":"day","time":"2007/07/02 00:00:00 -0400"},"longitude":-94.9126053,"id":"adv9lt64y7f5","location":"Lake Contrary"},"type":"Feature","geometry":{"type":"Point","coordinates":[-94.9126053,39.7223722]}},{"properties":{"latitude":39.49725,"column_5":1,"date":{"end_time":"2007/07/03 00:00:00 -0400","original":"7/2/2007","granularity":"day","time":"2007/07/02 00:00:00 -0400"},"longitude":-95.0213028,"id":"adv9lsziugjq","location":"Little Bean Marsh CA"},"type":"Feature","geometry":{"type":"Point","coordinates":[-95.0213028,39.49725]}},{"properties":{"latitude":39.8536194,"column_5":1,"date":{"end_time":"2007/07/03 00:00:00 -0400","original":"7/2/2007","granularity":"day","time":"2007/07/02 00:00:00 -0400"},"longitude":-94.9360056,"id":"adv9lstq22ff","location":"Worthwine Island CA"},"type":"Feature","geometry":{"type":"Point","coordinates":[-94.9360056,39.8536194]}},{"properties":{"latitude":39.4746237,"column_5":1,"date":{"end_time":"2007/07/03 00:00:00 -0400","original":"7/2/2007","granularity":"day","time":"2007/07/02 00:00:00 -0400"},"longitude":-95.026904,"id":"adv9lsy1y7ic","location":"Bean Lake"},"type":"Feature","geometry":{"type":"Point","coordinates":[-95.026904,39.4746237]}},{"properties":{"latitude":39.3878565,"column_5":1,"date":{"end_time":"2007/07/03 00:00:00 -0400","original":"7/2/2007","granularity":"day","time":"2007/07/02 00:00:00 -0400"},"longitude":-94.8745823,"id":"adv9lssokfub","location":"Weston Bend SP"},"type":"Feature","geometry":{"type":"Point","coordinates":[-94.8745823,39.3878565]}},{"properties":{"latitude":39.9568361,"column_5":1,"date":{"end_time":"2007/07/03 00:00:00 -0400","original":"7/2/2007","granularity":"day","time":"2007/07/02 00:00:00 -0400"},"longitude":-94.9738722,"id":"adv9lsud3vrk","location":"Honey Creek CA"},"type":"Feature","geometry":{"type":"Point","coordinates":[-94.9738722,39.9568361]}},{"properties":{"latitude":39.61985,"column_5":1,"date":{"end_time":"2007/07/03 00:00:00 -0400","original":"7/2/2007","granularity":"day","time":"2007/07/02 00:00:00 -0400"},"longitude":-94.9426639,"id":"adv9lt3j50nu","location":"Bluffwoods CA"},"type":"Feature","geometry":{"type":"Point","coordinates":[-94.9426639,39.61985]}},{"properties":{"latitude":39.9378083,"column_5":1,"date":{"end_time":"2007/07/03 00:00:00 -0400","original":"7/2/2007","granularity":"day","time":"2007/07/02 00:00:00 -0400"},"longitude":-95.1297528,"id":"adv9lsvaddn6","location":"Riverbreaks CA"},"type":"Feature","geometry":{"type":"Point","coordinates":[-95.1297528,39.9378083]}},{"properties":{"latitude":39.9324791,"column_5":1,"date":{"end_time":"2007/07/03 00:00:00 -0400","original":"7/2/2007","granularity":"day","time":"2007/07/02 00:00:00 -0400"},"longitude":-95.0123405,"id":"adv9lsy8zdy8","location":"MO: Monkey Mountain CA"},"type":"Feature","geometry":{"type":"Point","coordinates":[-95.0123405,39.9324791]}},{"properties":{"latitude":40.0779,"column_5":1,"date":{"end_time":"2007/07/04 00:00:00 -0400","original":"7/3/2007","granularity":"day","time":"2007/07/03 00:00:00 -0400"},"longitude":-95.346115,"id":"adv9lt4xv4vk","location":"Big Lake SP"},"type":"Feature","geometry":{"type":"Point","coordinates":[-95.346115,40.0779]}},{"properties":{"latitude":40.0932078,"column_5":1,"date":{"end_time":"2007/07/04 00:00:00 -0400","original":"7/3/2007","granularity":"day","time":"2007/07/03 00:00:00 -0400"},"longitude":-95.047102,"id":"adv9lsvjrbqa","location":"Nodaway Valley CA--Randy Herzog Wetland Unit"},"type":"Feature","geometry":{"type":"Point","coordinates":[-95.047102,40.0932078]}},{"properties":{"latitude":40.0885786,"column_5":1,"date":{"end_time":"2007/07/04 00:00:00 -0400","original":"7/3/2007","granularity":"day","time":"2007/07/03 00:00:00 -0400"},"longitude":-95.0674438,"id":"adv9lt42yzaj","location":"Nodaway Valley CA--Ronald J. Stites Wetland Unit"},"type":"Feature","geometry":{"type":"Point","coordinates":[-95.0674438,40.0885786]}},{"properties":{"latitude":39.9577194,"column_5":1,"date":{"end_time":"2007/07/04 00:00:00 -0400","original":"7/3/2007","granularity":"day","time":"2007/07/03 00:00:00 -0400"},"longitude":-95.2439306,"id":"adv9lstlk0br","location":"Bob Brown CA"},"type":"Feature","geometry":{"type":"Point","coordinates":[-95.2439306,39.9577194]}},{"properties":{"latitude":39.35832,"column_5":1,"date":{"end_time":"2007/07/04 00:00:00 -0400","original":"7/3/2007","granularity":"day","time":"2007/07/03 00:00:00 -0400"},"longitude":-93.49581,"id":"adv9lsur96bu","location":"Carrollton"},"type":"Feature","geometry":{"type":"Point","coordinates":[-93.49581,39.35832]}},{"properties":{"latitude":39.2875556,"column_5":1,"date":{"end_time":"2007/07/05 00:00:00 -0400","original":"7/4/2007","granularity":"day","time":"2007/07/04 00:00:00 -0400"},"longitude":-93.3177694,"id":"adv9lt2t5yod","location":"Grand Pass CA"},"type":"Feature","geometry":{"type":"Point","coordinates":[-93.3177694,39.2875556]}},{"properties":{"latitude":39.2645472,"column_5":1,"date":{"end_time":"2007/07/05 00:00:00 -0400","original":"7/4/2007","granularity":"day","time":"2007/07/04 00:00:00 -0400"},"longitude":-93.2669858,"id":"adv9lswbexs5","location":"Van Meter SP"},"type":"Feature","geometry":{"type":"Point","coordinates":[-93.2669858,39.2645472]}},{"properties":{"latitude":39.2207375,"column_5":1,"date":{"end_time":"2007/07/05 00:00:00 -0400","original":"7/4/2007","granularity":"day","time":"2007/07/04 00:00:00 -0400"},"longitude":-93.5856705,"id":"adv9lsyknf48","location":"Baltimore Bend CA"},"type":"Feature","geometry":{"type":"Point","coordinates":[-93.5856705,39.2207375]}},{"properties":{"latitude":39.64645,"column_5":1,"date":{"end_time":"2007/07/07 00:00:00 -0400","original":"7/6/2007","granularity":"day","time":"2007/07/06 00:00:00 -0400"},"longitude":-91.26824,"id":"adv9lt5tlabz","location":"Saverton"},"type":"Feature","geometry":{"type":"Point","coordinates":[-91.26824,39.64645]}},{"properties":{"latitude":36.2575628,"column_5":1,"date":{"end_time":"2007/07/10 00:00:00 -0400","original":"7/9/2007","granularity":"day","time":"2007/07/09 00:00:00 -0400"},"longitude":-89.6754742,"id":"adv9lst7b4fm","location":"MO: Gayoso Bend CA"},"type":"Feature","geometry":{"type":"Point","coordinates":[-89.6754742,36.2575628]}},{"properties":{"latitude":36.3125316,"column_5":1,"date":{"end_time":"2007/07/10 00:00:00 -0400","original":"7/9/2007","granularity":"day","time":"2007/07/09 00:00:00 -0400"},"longitude":-89.6428156,"id":"adv9lstaokfn","location":"Wolf Bayou CA"},"type":"Feature","geometry":{"type":"Point","coordinates":[-89.6428156,36.3125316]}},{"properties":{"latitude":36.2438578,"column_5":1,"date":{"end_time":"2007/07/10 00:00:00 -0400","original":"7/9/2007","granularity":"day","time":"2007/07/09 00:00:00 -0400"},"longitude":-89.9600887,"id":"adv9lsyd5j9u","location":"Little River CA"},"type":"Feature","geometry":{"type":"Point","coordinates":[-89.9600887,36.2438578]}},{"properties":{"latitude":36.5463583,"column_5":1,"date":{"end_time":"2007/07/10 00:00:00 -0400","original":"7/9/2007","granularity":"day","time":"2007/07/09 00:00:00 -0400"},"longitude":-89.4337306,"id":"adv9lt4u3mee","location":"Donaldson Point CA"},"type":"Feature","geometry":{"type":"Point","coordinates":[-89.4337306,36.5463583]}},{"properties":{"latitude":36.23617,"column_5":1,"date":{"end_time":"2007/07/10 00:00:00 -0400","original":"7/9/2007","granularity":"day","time":"2007/07/09 00:00:00 -0400"},"longitude":-90.05569,"id":"adv9lsz19i04","location":"Kennett"},"type":"Feature","geometry":{"type":"Point","coordinates":[-90.05569,36.23617]}},{"properties":{"latitude":36.23397,"column_5":1,"date":{"end_time":"2007/07/10 00:00:00 -0400","original":"7/9/2007","granularity":"day","time":"2007/07/09 00:00:00 -0400"},"longitude":-89.76948,"id":"adv9lsvu44vv","location":"Hayti Heights"},"type":"Feature","geometry":{"type":"Point","coordinates":[-89.76948,36.23397]}},{"properties":{"latitude":36.26817,"column_5":1,"date":{"end_time":"2007/07/10 00:00:00 -0400","original":"7/9/2007","granularity":"day","time":"2007/07/09 00:00:00 -0400"},"longitude":-89.91089,"id":"adv9lss5f87b","location":"Bragg City"},"type":"Feature","geometry":{"type":"Point","coordinates":[-89.91089,36.26817]}},{"properties":{"latitude":36.67116,"column_5":1,"date":{"end_time":"2007/07/10 00:00:00 -0400","original":"7/9/2007","granularity":"day","time":"2007/07/09 00:00:00 -0400"},"longitude":-89.57398,"id":"adv9lt2uramt","location":"Kewanee"},"type":"Feature","geometry":{"type":"Point","coordinates":[-89.57398,36.67116]}},{"properties":{"latitude":36.23397,"column_5":1,"date":{"end_time":"2007/07/10 00:00:00 -0400","original":"7/9/2007","granularity":"day","time":"2007/07/09 00:00:00 -0400"},"longitude":-89.91789,"id":"adv9lt1e6b53","location":"Bakerville"},"type":"Feature","geometry":{"type":"Point","coordinates":[-89.91789,36.23397]}},{"properties":{"latitude":36.3722995,"column_5":1,"date":{"end_time":"2007/07/10 00:00:00 -0400","original":"7/9/2007","granularity":"day","time":"2007/07/09 00:00:00 -0400"},"longitude":-89.5902872,"id":"adv9lsskl1m9","location":"Twin Borrow Pits CA"},"type":"Feature","geometry":{"type":"Point","coordinates":[-89.5902872,36.3722995]}},{"properties":{"latitude":36.940151,"column_5":1,"date":{"end_time":"2007/07/11 00:00:00 -0400","original":"7/10/2007","granularity":"day","time":"2007/07/10 00:00:00 -0400"},"longitude":-89.9764824,"id":"adv9lssig8y7","location":"Crowleys Ridge CA"},"type":"Feature","geometry":{"type":"Point","coordinates":[-89.9764824,36.940151]}},{"properties":{"latitude":38.53335,"column_5":1,"date":{"end_time":"2007/07/11 00:00:00 -0400","original":"7/10/2007","granularity":"day","time":"2007/07/10 00:00:00 -0400"},"longitude":-90.27931,"id":"adv9lss8l25e","location":"Lemay"},"type":"Feature","geometry":{"type":"Point","coordinates":[-90.27931,38.53335]}},{"properties":{"latitude":36.45176,"column_5":1,"date":{"end_time":"2007/07/11 00:00:00 -0400","original":"7/10/2007","granularity":"day","time":"2007/07/10 00:00:00 -0400"},"longitude":-89.96699,"id":"adv9lt2gwi3y","location":"Clarkton"},"type":"Feature","geometry":{"type":"Point","coordinates":[-89.96699,36.45176]}},{"properties":{"latitude":36.45196,"column_5":1,"date":{"end_time":"2007/07/11 00:00:00 -0400","original":"7/10/2007","granularity":"day","time":"2007/07/10 00:00:00 -0400"},"longitude":-89.91929,"id":"adv9lt5hritg","location":"Gideon"},"type":"Feature","geometry":{"type":"Point","coordinates":[-89.91929,36.45196]}},{"properties":{"latitude":37.3217108,"column_5":1,"date":{"end_time":"2007/07/19 00:00:00 -0400","original":"7/18/2007","granularity":"day","time":"2007/07/18 00:00:00 -0400"},"longitude":-91.4374924,"id":"adv9lt69i76x","location":"MO: Presley Center"},"type":"Feature","geometry":{"type":"Point","coordinates":[-91.4374924,37.3217108]}},{"properties":{"latitude":37.2516558,"column_5":1,"date":{"end_time":"2007/07/19 00:00:00 -0400","original":"7/18/2007","granularity":"day","time":"2007/07/18 00:00:00 -0400"},"longitude":-91.3976777,"id":"adv9lswefz5y","location":"Pioneer Forest"},"type":"Feature","geometry":{"type":"Point","coordinates":[-91.3976777,37.2516558]}},{"properties":{"latitude":39.1142006,"column_5":1,"date":{"end_time":"2007/07/24 00:00:00 -0400","original":"7/23/2007","granularity":"day","time":"2007/07/23 00:00:00 -0400"},"longitude":-94.6274338,"id":"adv9lt4e2dpl","location":"Kansas City"},"type":"Feature","geometry":{"type":"Point","coordinates":[-94.6274338,39.1142006]}},{"properties":{"latitude":48.0466443,"column_5":1,"date":{"end_time":"2007/07/29 00:00:00 -0400","original":"7/28/2007","granularity":"day","time":"2007/07/28 00:00:00 -0400"},"longitude":-115.1034164,"id":"adv9lt2bzygo","location":"Thompson Chain of Lakes"},"type":"Feature","geometry":{"type":"Point","coordinates":[-115.1034164,48.0466443]}},{"properties":{"latitude":38.0100645,"column_5":1,"date":{"end_time":"2007/08/08 00:00:00 -0400","original":"8/7/2007","granularity":"day","time":"2007/08/07 00:00:00 -0400"},"longitude":-94.0720497,"id":"adv9lstrfpz7","location":"Schell-Osage CA"},"type":"Feature","geometry":{"type":"Point","coordinates":[-94.0720497,38.0100645]}},{"properties":{"latitude":38.4570917,"column_5":1,"date":{"end_time":"2007/08/09 00:00:00 -0400","original":"8/8/2007","granularity":"day","time":"2007/08/08 00:00:00 -0400"},"longitude":-94.1724889,"id":"adv9lsuzdipa","location":"Settle's Ford CA"},"type":"Feature","geometry":{"type":"Point","coordinates":[-94.1724889,38.4570917]}},{"properties":{"latitude":38.43532,"column_5":1,"date":{"end_time":"2007/08/09 00:00:00 -0400","original":"8/8/2007","granularity":"day","time":"2007/08/08 00:00:00 -0400"},"longitude":-93.93462,"id":"adv9lsqwfhq4","location":"Hartwell"},"type":"Feature","geometry":{"type":"Point","coordinates":[-93.93462,38.43532]}},{"properties":{"latitude":38.39752,"column_5":1,"date":{"end_time":"2007/08/09 00:00:00 -0400","original":"8/8/2007","granularity":"day","time":"2007/08/08 00:00:00 -0400"},"longitude":-94.35163,"id":"adv9lsy9l5oy","location":"Adrian"},"type":"Feature","geometry":{"type":"Point","coordinates":[-94.35163,38.39752]}},{"properties":{"latitude":32.249176,"column_5":1,"date":{"end_time":"2007/09/25 00:00:00 -0400","original":"9/24/2007","granularity":"day","time":"2007/09/24 00:00:00 -0400"},"longitude":-111.2581158,"id":"adv9lsxk1gl6","location":"CAP Recharge Basin--Mile Wide Rd"},"type":"Feature","geometry":{"type":"Point","coordinates":[-111.2581158,32.249176]}},{"properties":{"latitude":31.54289,"column_5":1,"date":{"end_time":"2007/10/02 00:00:00 -0400","original":"10/1/2007","granularity":"day","time":"2007/10/01 00:00:00 -0400"},"longitude":-110.51464,"id":"adv9lsx21h2n","location":"Canelo"},"type":"Feature","geometry":{"type":"Point","coordinates":[-110.51464,31.54289]}},{"properties":{"latitude":32.61087,"column_5":1,"date":{"end_time":"2007/10/22 00:00:00 -0400","original":"10/21/2007","granularity":"day","time":"2007/10/21 00:00:00 -0400"},"longitude":-110.77066,"id":"adv9lsvy649n","location":"Oracle"},"type":"Feature","geometry":{"type":"Point","coordinates":[-110.77066,32.61087]}},{"properties":{"latitude":32.607812,"column_5":1,"date":{"end_time":"2007/10/22 00:00:00 -0400","original":"10/21/2007","granularity":"day","time":"2007/10/21 00:00:00 -0400"},"longitude":-110.746468,"id":"adv9lstgqkxn","location":"Oracle SP"},"type":"Feature","geometry":{"type":"Point","coordinates":[-110.746468,32.607812]}},{"properties":{"latitude":32.2227493,"column_5":1,"date":{"end_time":"2007/11/13 00:00:00 -0500","original":"11/12/2007","granularity":"day","time":"2007/11/12 00:00:00 -0500"},"longitude":-109.611454,"id":"adv9lt4fuws2","location":"AZ: Dos Cabezas Mountains"},"type":"Feature","geometry":{"type":"Point","coordinates":[-109.611454,32.2227493]}},{"properties":{"latitude":31.9575806,"column_5":1,"date":{"end_time":"2007/11/18 00:00:00 -0500","original":"11/17/2007","granularity":"day","time":"2007/11/17 00:00:00 -0500"},"longitude":-110.9556503,"id":"adv9lt0bd5pj","location":"Sahuarita"},"type":"Feature","geometry":{"type":"Point","coordinates":[-110.9556503,31.9575806]}},{"properties":{"latitude":31.8071233,"column_5":1,"date":{"end_time":"2007/11/18 00:00:00 -0500","original":"11/17/2007","granularity":"day","time":"2007/11/17 00:00:00 -0500"},"longitude":-110.8408928,"id":"adv9lt1ej92s","location":"AZ: Santa Rita Experimental Range"},"type":"Feature","geometry":{"type":"Point","coordinates":[-110.8408928,31.8071233]}},{"properties":{"latitude":31.8424201,"column_5":1,"date":{"end_time":"2007/11/20 00:00:00 -0500","original":"11/19/2007","granularity":"day","time":"2007/11/19 00:00:00 -0500"},"longitude":-110.2214098,"id":"adv9lt2njmet","location":"St. David Cienega"},"type":"Feature","geometry":{"type":"Point","coordinates":[-110.2214098,31.8424201]}},{"properties":{"latitude":38.77144,"column_5":1,"date":{"end_time":"2007/11/24 00:00:00 -0500","original":"11/23/2007","granularity":"day","time":"2007/11/23 00:00:00 -0500"},"longitude":-89.22552,"id":"adv9lsxynzqo","location":"Carlyle Lake WMA, Fayette Co."},"type":"Feature","geometry":{"type":"Point","coordinates":[-89.22552,38.77144]}},{"properties":{"latitude":38.6073469,"column_5":1,"date":{"end_time":"2007/11/24 00:00:00 -0500","original":"11/23/2007","granularity":"day","time":"2007/11/23 00:00:00 -0500"},"longitude":-89.3542099,"id":"adv9lt0wrwwp","location":"Carlyle Sewage Ponds (Clinton Co.)"},"type":"Feature","geometry":{"type":"Point","coordinates":[-89.3542099,38.6073469]}},{"properties":{"latitude":39.1604143,"column_5":1,"date":{"end_time":"2007/11/25 00:00:00 -0500","original":"11/24/2007","granularity":"day","time":"2007/11/24 00:00:00 -0500"},"longitude":-90.8002424,"id":"adv9lsui9tr9","location":"MO: Elsberry City Cemetery"},"type":"Feature","geometry":{"type":"Point","coordinates":[-90.8002424,39.1604143]}},{"properties":{"latitude":32.7560194,"column_5":1,"date":{"end_time":"2007/12/03 00:00:00 -0500","original":"12/2/2007","granularity":"day","time":"2007/12/02 00:00:00 -0500"},"longitude":-109.7031805,"id":"adv9lt2l8077","location":"Roper Lake SP"},"type":"Feature","geometry":{"type":"Point","coordinates":[-109.7031805,32.7560194]}},{"properties":{"latitude":32.365,"column_5":1,"date":{"end_time":"2007/12/03 00:00:00 -0500","original":"12/2/2007","granularity":"day","time":"2007/12/02 00:00:00 -0500"},"longitude":-109.934,"id":"adv9lstjihfv","location":"Sulphur Springs Valley--north of Willcox (Cochise Co.)"},"type":"Feature","geometry":{"type":"Point","coordinates":[-109.934,32.365]}},{"properties":{"latitude":32.4616879,"column_5":1,"date":{"end_time":"2007/12/03 00:00:00 -0500","original":"12/2/2007","granularity":"day","time":"2007/12/02 00:00:00 -0500"},"longitude":-109.9535751,"id":"adv9lssplw8k","location":"Sulphur Springs Valley--Graham County"},"type":"Feature","geometry":{"type":"Point","coordinates":[-109.9535751,32.4616879]}},{"properties":{"latitude":34.2254113,"column_5":1,"date":{"end_time":"2007/12/09 00:00:00 -0500","original":"12/8/2007","granularity":"day","time":"2007/12/08 00:00:00 -0500"},"longitude":-114.1934395,"id":"adv9lsxntvk7","location":"La Paz County Park"},"type":"Feature","geometry":{"type":"Point","coordinates":[-114.1934395,34.2254113]}},{"properties":{"latitude":34.30055,"column_5":1,"date":{"end_time":"2007/12/09 00:00:00 -0500","original":"12/8/2007","granularity":"day","time":"2007/12/08 00:00:00 -0500"},"longitude":-114.1365337,"id":"adv9lt77op5p","location":"Lake Havasu--Take-off Point"},"type":"Feature","geometry":{"type":"Point","coordinates":[-114.1365337,34.30055]}},{"properties":{"latitude":33.078397,"column_5":1,"date":{"end_time":"2007/12/10 00:00:00 -0500","original":"12/9/2007","granularity":"day","time":"2007/12/09 00:00:00 -0500"},"longitude":-113.021824,"id":"adv9lsxysns6","location":"Painted Rock Dam"},"type":"Feature","geometry":{"type":"Point","coordinates":[-113.021824,33.078397]}},{"properties":{"latitude":35.1678,"column_5":1,"date":{"end_time":"2007/12/10 00:00:00 -0500","original":"12/9/2007","granularity":"day","time":"2007/12/09 00:00:00 -0500"},"longitude":-114.5728,"id":"adv9lt3206ia","location":"Laughlin"},"type":"Feature","geometry":{"type":"Point","coordinates":[-114.5728,35.1678]}},{"properties":{"latitude":35.1478,"column_5":1,"date":{"end_time":"2007/12/10 00:00:00 -0500","original":"12/9/2007","granularity":"day","time":"2007/12/09 00:00:00 -0500"},"longitude":-114.5688,"id":"adv9lstnfeud","location":"Bullhead City"},"type":"Feature","geometry":{"type":"Point","coordinates":[-114.5688,35.1478]}},{"properties":{"latitude":35.216103,"column_5":1,"date":{"end_time":"2007/12/10 00:00:00 -0500","original":"12/9/2007","granularity":"day","time":"2007/12/09 00:00:00 -0500"},"longitude":-114.5646572,"id":"adv9lsu5yk7n","location":"Lake Mead NRA--Katherine Landing"},"type":"Feature","geometry":{"type":"Point","coordinates":[-114.5646572,35.216103]}},{"properties":{"latitude":35.1981497,"column_5":1,"date":{"end_time":"2007/12/10 00:00:00 -0500","original":"12/9/2007","granularity":"day","time":"2007/12/09 00:00:00 -0500"},"longitude":-114.5685196,"id":"adv9lt6ck741","location":"Davis Dam (AZ)"},"type":"Feature","geometry":{"type":"Point","coordinates":[-114.5685196,35.1981497]}},{"properties":{"latitude":39.062249,"column_5":1,"date":{"end_time":"2007/12/19 00:00:00 -0500","original":"12/18/2007","granularity":"day","time":"2007/12/18 00:00:00 -0500"},"longitude":-90.6861734,"id":"adv9lt41hrd6","location":"IL: Two Rivers NWR--Batchtown"},"type":"Feature","geometry":{"type":"Point","coordinates":[-90.6861734,39.062249]}},{"properties":{"latitude":38.87795,"column_5":1,"date":{"end_time":"2008/01/07 00:00:00 -0500","original":"1/6/2008","granularity":"day","time":"2008/01/06 00:00:00 -0500"},"longitude":-90.16273,"id":"adv9lt4abhk7","location":"Melvin Price Lock and Dam 26 (Alton)"},"type":"Feature","geometry":{"type":"Point","coordinates":[-90.16273,38.87795]}},{"properties":{"latitude":39.74194,"column_5":1,"date":{"end_time":"2008/01/10 00:00:00 -0500","original":"1/9/2008","granularity":"day","time":"2008/01/09 00:00:00 -0500"},"longitude":-92.25848,"id":"adv9lst6t8w2","location":"Clarence"},"type":"Feature","geometry":{"type":"Point","coordinates":[-92.25848,39.74194]}},{"properties":{"latitude":32.2265432,"column_5":1,"date":{"end_time":"2008/01/19 00:00:00 -0500","original":"1/18/2008","granularity":"day","time":"2008/01/18 00:00:00 -0500"},"longitude":-110.9826422,"id":"adv9lsudqicu","location":"Santa Cruz River Park--Speedway to Congress"},"type":"Feature","geometry":{"type":"Point","coordinates":[-110.9826422,32.2265432]}},{"properties":{"latitude":33.2601945,"column_5":1,"date":{"end_time":"2008/01/20 00:00:00 -0500","original":"1/19/2008","granularity":"day","time":"2008/01/19 00:00:00 -0500"},"longitude":-111.8873191,"id":"adv9lt4v95md","location":"Chandler--Price Rd/Queen Creek Rd pond"},"type":"Feature","geometry":{"type":"Point","coordinates":[-111.8873191,33.2601945]}},{"properties":{"latitude":33.496,"column_5":1,"date":{"end_time":"2008/01/22 00:00:00 -0500","original":"1/21/2008","granularity":"day","time":"2008/01/21 00:00:00 -0500"},"longitude":-111.91,"id":"adv9lt0bh1ws","location":"Scottsdale--Indian School Park"},"type":"Feature","geometry":{"type":"Point","coordinates":[-111.91,33.496]}},{"properties":{"latitude":33.42175,"column_5":1,"date":{"end_time":"2008/01/22 00:00:00 -0500","original":"1/21/2008","granularity":"day","time":"2008/01/21 00:00:00 -0500"},"longitude":-112.0733,"id":"adv9lt4ql1p0","location":"Rio Salado Project"},"type":"Feature","geometry":{"type":"Point","coordinates":[-112.0733,33.42175]}},{"properties":{"latitude":32.8915794,"column_5":1,"date":{"end_time":"2008/02/02 00:00:00 -0500","original":"2/1/2008","granularity":"day","time":"2008/02/01 00:00:00 -0500"},"longitude":-107.2956401,"id":"adv9lsxitns3","location":"Caballo Lake SP -- Below Dam"},"type":"Feature","geometry":{"type":"Point","coordinates":[-107.2956401,32.8915794]}},{"properties":{"latitude":33.2971201,"column_5":1,"date":{"end_time":"2008/02/02 00:00:00 -0500","original":"2/1/2008","granularity":"day","time":"2008/02/01 00:00:00 -0500"},"longitude":-107.1783553,"id":"adv9lsr4vo5v","location":"Elephant Butte SP -- South Monticello Pt."},"type":"Feature","geometry":{"type":"Point","coordinates":[-107.1783553,33.2971201]}},{"properties":{"latitude":32.8694772,"column_5":1,"date":{"end_time":"2008/02/02 00:00:00 -0500","original":"2/1/2008","granularity":"day","time":"2008/02/01 00:00:00 -0500"},"longitude":-107.3049332,"id":"adv9lss8qigj","location":"Percha Dam SP"},"type":"Feature","geometry":{"type":"Point","coordinates":[-107.3049332,32.8694772]}},{"properties":{"latitude":32.97675,"column_5":1,"date":{"end_time":"2008/02/02 00:00:00 -0500","original":"2/1/2008","granularity":"day","time":"2008/02/01 00:00:00 -0500"},"longitude":-107.384544,"id":"adv9lt0al7wh","location":"Las Animas Creek (Sierra Co.)"},"type":"Feature","geometry":{"type":"Point","coordinates":[-107.384544,32.97675]}},{"properties":{"latitude":35.13,"column_5":1,"date":{"end_time":"2008/02/03 00:00:00 -0500","original":"2/2/2008","granularity":"day","time":"2008/02/02 00:00:00 -0500"},"longitude":-106.683,"id":"adv9lt3bkevh","location":"Rio Grande Nature Center"},"type":"Feature","geometry":{"type":"Point","coordinates":[-106.683,35.13]}},{"properties":{"latitude":35.0844498,"column_5":1,"date":{"end_time":"2008/02/03 00:00:00 -0500","original":"2/2/2008","granularity":"day","time":"2008/02/02 00:00:00 -0500"},"longitude":-106.6515808,"id":"adv9lstjmnwz","location":"Albuquerque"},"type":"Feature","geometry":{"type":"Point","coordinates":[-106.6515808,35.0844498]}},{"properties":{"latitude":35.1479858,"column_5":1,"date":{"end_time":"2008/02/03 00:00:00 -0500","original":"2/2/2008","granularity":"day","time":"2008/02/02 00:00:00 -0500"},"longitude":-106.3600159,"id":"adv9lt3jhcjn","location":"NM: I-40 to the Sandia Crest"},"type":"Feature","geometry":{"type":"Point","coordinates":[-106.3600159,35.1479858]}},{"properties":{"latitude":35.2103004,"column_5":1,"date":{"end_time":"2008/02/03 00:00:00 -0500","original":"2/2/2008","granularity":"day","time":"2008/02/02 00:00:00 -0500"},"longitude":-106.4487,"id":"adv9lsr62dpg","location":"Cibola NF -- Sandia Crest"},"type":"Feature","geometry":{"type":"Point","coordinates":[-106.4487,35.2103004]}},{"properties":{"latitude":32.3616486,"column_5":1,"date":{"end_time":"2008/02/09 00:00:00 -0500","original":"2/8/2008","granularity":"day","time":"2008/02/08 00:00:00 -0500"},"longitude":-110.9258201,"id":"adv9lt2techu","location":"Pima Canyon"},"type":"Feature","geometry":{"type":"Point","coordinates":[-110.9258201,32.3616486]}},{"properties":{"latitude":33.3880229,"column_5":1,"date":{"end_time":"2008/03/03 00:00:00 -0500","original":"3/2/2008","granularity":"day","time":"2008/03/02 00:00:00 -0500"},"longitude":-110.4194641,"id":"adv9lsu22gc5","location":"Talkalai Lake"},"type":"Feature","geometry":{"type":"Point","coordinates":[-110.4194641,33.3880229]}},{"properties":{"latitude":32.87946,"column_5":1,"date":{"end_time":"2008/03/21 00:00:00 -0400","original":"3/20/2008","granularity":"day","time":"2008/03/20 00:00:00 -0400"},"longitude":-111.75769,"id":"adv9lt3634ms","location":"Casa Grande"},"type":"Feature","geometry":{"type":"Point","coordinates":[-111.75769,32.87946]}},{"properties":{"latitude":31.5683002,"column_5":1,"date":{"end_time":"2008/05/09 00:00:00 -0400","original":"5/8/2008","granularity":"day","time":"2008/05/08 00:00:00 -0400"},"longitude":-111.0495987,"id":"adv9lt15l0u8","location":"Tumacacori NHP"},"type":"Feature","geometry":{"type":"Point","coordinates":[-111.0495987,31.5683002]}},{"properties":{"latitude":32.9599939,"column_5":1,"date":{"end_time":"2008/05/11 00:00:00 -0400","original":"5/10/2008","granularity":"day","time":"2008/05/10 00:00:00 -0400"},"longitude":-111.6468215,"id":"adv9lt1cjua7","location":"Central Arizona College--Signal Peak Campus"},"type":"Feature","geometry":{"type":"Point","coordinates":[-111.6468215,32.9599939]}},{"properties":{"latitude":32.0054606,"column_5":1,"date":{"end_time":"2008/05/16 00:00:00 -0400","original":"5/15/2008","granularity":"day","time":"2008/05/15 00:00:00 -0400"},"longitude":-109.3566656,"id":"adv9lt756x2t","location":"Chiricahua National Monument"},"type":"Feature","geometry":{"type":"Point","coordinates":[-109.3566656,32.0054606]}},{"properties":{"latitude":32.26788,"column_5":1,"date":{"end_time":"2008/05/16 00:00:00 -0400","original":"5/15/2008","granularity":"day","time":"2008/05/15 00:00:00 -0400"},"longitude":-109.22762,"id":"adv9lszf9rc2","location":"San Simon"},"type":"Feature","geometry":{"type":"Point","coordinates":[-109.22762,32.26788]}},{"properties":{"latitude":56.5776409,"column_5":1,"date":{"end_time":"2008/09/28 00:00:00 -0400","original":"9/27/2008","granularity":"day","time":"2008/09/27 00:00:00 -0400"},"longitude":-169.6069336,"id":"adv9lt5g4pr6","location":"St. George Island (Pribilof Islands-Bering Sea)"},"type":"Feature","geometry":{"type":"Point","coordinates":[-169.6069336,56.5776409]}},{"properties":{"latitude":38.5651816,"column_5":1,"date":{"end_time":"2008/10/01 00:00:00 -0400","original":"9/30/2008","granularity":"day","time":"2008/09/30 00:00:00 -0400"},"longitude":-90.6678431,"id":"adv9lt6mpdcg","location":"Rockwoods Reservation"},"type":"Feature","geometry":{"type":"Point","coordinates":[-90.6678431,38.5651816]}},{"properties":{"latitude":35.52615,"column_5":1,"date":{"end_time":"2008/10/07 00:00:00 -0400","original":"10/6/2008","granularity":"day","time":"2008/10/06 00:00:00 -0400"},"longitude":-98.70755,"id":"adv9lt2co2as","location":"Weatherford"},"type":"Feature","geometry":{"type":"Point","coordinates":[-98.70755,35.52615]}},{"properties":{"latitude":34.4343548,"column_5":1,"date":{"end_time":"2008/10/08 00:00:00 -0400","original":"10/7/2008","granularity":"day","time":"2008/10/07 00:00:00 -0400"},"longitude":-103.7991207,"id":"adv9lt17onp7","location":"Melrose Woods"},"type":"Feature","geometry":{"type":"Point","coordinates":[-103.7991207,34.4343548]}},{"properties":{"latitude":33.8786641,"column_5":1,"date":{"end_time":"2008/10/25 00:00:00 -0400","original":"10/24/2008","granularity":"day","time":"2008/10/24 00:00:00 -0400"},"longitude":-109.4202232,"id":"adv9lt0kckkw","location":"Big Lake Recreation Area"},"type":"Feature","geometry":{"type":"Point","coordinates":[-109.4202232,33.8786641]}},{"properties":{"latitude":32.9695355,"column_5":1,"date":{"end_time":"2008/10/31 00:00:00 -0400","original":"10/30/2008","granularity":"day","time":"2008/10/30 00:00:00 -0400"},"longitude":-113.341645,"id":"adv9lsyuwkkj","location":"Children of Light commune"},"type":"Feature","geometry":{"type":"Point","coordinates":[-113.341645,32.9695355]}},{"properties":{"latitude":32.8763795,"column_5":1,"date":{"end_time":"2008/11/01 00:00:00 -0400","original":"10/31/2008","granularity":"day","time":"2008/10/31 00:00:00 -0400"},"longitude":-114.4798136,"id":"adv9lt4guuwn","location":"West Pond"},"type":"Feature","geometry":{"type":"Point","coordinates":[-114.4798136,32.8763795]}},{"properties":{"latitude":32.8418624,"column_5":1,"date":{"end_time":"2008/11/01 00:00:00 -0400","original":"10/31/2008","granularity":"day","time":"2008/10/31 00:00:00 -0400"},"longitude":-117.0860946,"id":"adv9lsygrdsu","location":"CA: Paul Lehman's House"},"type":"Feature","geometry":{"type":"Point","coordinates":[-117.0860946,32.8418624]}},{"properties":{"latitude":32.7010777,"column_5":1,"date":{"end_time":"2008/11/02 00:00:00 -0400","original":"11/1/2008","granularity":"day","time":"2008/11/01 00:00:00 -0400"},"longitude":-117.2311592,"id":"adv9lsr5hhfy","location":"CA: San Diego Bay--Shelter Island to Point Loma"},"type":"Feature","geometry":{"type":"Point","coordinates":[-117.2311592,32.7010777]}},{"properties":{"latitude":32.6833082,"column_5":1,"date":{"end_time":"2008/11/02 00:00:00 -0400","original":"11/1/2008","granularity":"day","time":"2008/11/01 00:00:00 -0400"},"longitude":-117.6086426,"id":"adv9lt2lx1ac","location":"CA: San Diego Pelagic--San Diego County"},"type":"Feature","geometry":{"type":"Point","coordinates":[-117.6086426,32.6833082]}},{"properties":{"latitude":32.8193785,"column_5":1,"date":{"end_time":"2008/11/04 00:00:00 -0500","original":"11/3/2008","granularity":"day","time":"2008/11/03 00:00:00 -0500"},"longitude":-113.4410477,"id":"adv9lsvuz1y9","location":"Aztec Sludge Ponds"},"type":"Feature","geometry":{"type":"Point","coordinates":[-113.4410477,32.8193785]}},{"properties":{"latitude":32.698333,"column_5":1,"date":{"end_time":"2008/11/04 00:00:00 -0500","original":"11/3/2008","granularity":"day","time":"2008/11/03 00:00:00 -0500"},"longitude":-113.9534569,"id":"adv9lssu31zk","location":"AZ: Tacna"},"type":"Feature","geometry":{"type":"Point","coordinates":[-113.9534569,32.698333]}},{"properties":{"latitude":32.67285,"column_5":1,"date":{"end_time":"2008/11/04 00:00:00 -0500","original":"11/3/2008","granularity":"day","time":"2008/11/03 00:00:00 -0500"},"longitude":-114.14677,"id":"adv9lt6futao","location":"Wellton"},"type":"Feature","geometry":{"type":"Point","coordinates":[-114.14677,32.67285]}},{"properties":{"latitude":32.6786846,"column_5":1,"date":{"end_time":"2008/11/04 00:00:00 -0500","original":"11/3/2008","granularity":"day","time":"2008/11/03 00:00:00 -0500"},"longitude":-114.1969264,"id":"adv9lssv9ldi","location":"Wellton--Effie May Riparian Area"},"type":"Feature","geometry":{"type":"Point","coordinates":[-114.1969264,32.6786846]}},{"properties":{"latitude":32.8932816,"column_5":1,"date":{"end_time":"2008/11/04 00:00:00 -0500","original":"11/3/2008","granularity":"day","time":"2008/11/03 00:00:00 -0500"},"longitude":-113.0409908,"id":"adv9lt6ibufu","location":"AZ: I-8--MP 97"},"type":"Feature","geometry":{"type":"Point","coordinates":[-113.0409908,32.8932816]}},{"properties":{"latitude":32.79638,"column_5":1,"date":{"end_time":"2008/11/04 00:00:00 -0500","original":"11/3/2008","granularity":"day","time":"2008/11/03 00:00:00 -0500"},"longitude":-113.540278,"id":"adv9lstitqai","location":"Dateland"},"type":"Feature","geometry":{"type":"Point","coordinates":[-113.540278,32.79638]}},{"properties":{"latitude":32.7327795,"column_5":1,"date":{"end_time":"2008/11/04 00:00:00 -0500","original":"11/3/2008","granularity":"day","time":"2008/11/03 00:00:00 -0500"},"longitude":-113.9602375,"id":"adv9lt25nqle","location":"Quigley WA"},"type":"Feature","geometry":{"type":"Point","coordinates":[-113.9602375,32.7327795]}},{"properties":{"latitude":38.7168568,"column_5":1,"date":{"end_time":"2008/11/26 00:00:00 -0500","original":"11/25/2008","granularity":"day","time":"2008/11/25 00:00:00 -0500"},"longitude":-90.4842083,"id":"adv9lt2ipygf","location":"Creve Coeur Lake and County Park"},"type":"Feature","geometry":{"type":"Point","coordinates":[-90.4842083,38.7168568]}},{"properties":{"latitude":34.05221,"column_5":1,"date":{"end_time":"2008/12/08 00:00:00 -0500","original":"12/7/2008","granularity":"day","time":"2008/12/07 00:00:00 -0500"},"longitude":-118.24391,"id":"adv9lsuv6z82","location":"Los Angeles"},"type":"Feature","geometry":{"type":"Point","coordinates":[-118.24391,34.05221]}},{"properties":{"latitude":10.1087,"column_5":1,"date":{"end_time":"2008/12/10 00:00:00 -0500","original":"12/9/2008","granularity":"day","time":"2008/12/09 00:00:00 -0500"},"longitude":99.0889,"id":"adv9lt3l0p76","location":"TH: Thung Tako"},"type":"Feature","geometry":{"type":"Point","coordinates":[99.0889,10.1087]}},{"properties":{"latitude":8.494,"column_5":1,"date":{"end_time":"2008/12/12 00:00:00 -0500","original":"12/11/2008","granularity":"day","time":"2008/12/11 00:00:00 -0500"},"longitude":98.5162,"id":"adv9lstj2uux","location":"TH: Phang-na"},"type":"Feature","geometry":{"type":"Point","coordinates":[98.5162,8.494]}},{"properties":{"latitude":8.0813,"column_5":1,"date":{"end_time":"2008/12/12 00:00:00 -0500","original":"12/11/2008","granularity":"day","time":"2008/12/11 00:00:00 -0500"},"longitude":98.9206,"id":"adv9lt13gulf","location":"Krabi--mangrove boardwalk"},"type":"Feature","geometry":{"type":"Point","coordinates":[98.9206,8.0813]}},{"properties":{"latitude":10.2953,"column_5":1,"date":{"end_time":"2008/12/13 00:00:00 -0500","original":"12/12/2008","granularity":"day","time":"2008/12/12 00:00:00 -0500"},"longitude":99.0909,"id":"adv9lsvxa7ab","location":"TH: KM 21, Hwy. 41"},"type":"Feature","geometry":{"type":"Point","coordinates":[99.0909,10.2953]}},{"properties":{"latitude":8.9157,"column_5":1,"date":{"end_time":"2008/12/13 00:00:00 -0500","original":"12/12/2008","granularity":"day","time":"2008/12/12 00:00:00 -0500"},"longitude":98.5275,"id":"adv9lt59tqvn","location":"Khao Sok NP"},"type":"Feature","geometry":{"type":"Point","coordinates":[98.5275,8.9157]}},{"properties":{"latitude":9.2668,"column_5":1,"date":{"end_time":"2008/12/13 00:00:00 -0500","original":"12/12/2008","granularity":"day","time":"2008/12/12 00:00:00 -0500"},"longitude":99.153,"id":"adv9lszvtlzn","location":"TH: Tha Chang"},"type":"Feature","geometry":{"type":"Point","coordinates":[99.153,9.2668]}},{"properties":{"latitude":13.1457,"column_5":1,"date":{"end_time":"2008/12/14 00:00:00 -0500","original":"12/13/2008","granularity":"day","time":"2008/12/13 00:00:00 -0500"},"longitude":100.0631,"id":"adv9lt6tjijr","location":"Pak Thale"},"type":"Feature","geometry":{"type":"Point","coordinates":[100.0631,13.1457]}},{"properties":{"latitude":14.6524,"column_5":1,"date":{"end_time":"2008/12/18 00:00:00 -0500","original":"12/17/2008","granularity":"day","time":"2008/12/17 00:00:00 -0500"},"longitude":100.979,"id":"adv9lsurkogd","location":"Wat Phra Phuttabath Noi"},"type":"Feature","geometry":{"type":"Point","coordinates":[100.979,14.6524]}},{"properties":{"latitude":20.2561,"column_5":1,"date":{"end_time":"2008/12/19 00:00:00 -0500","original":"12/18/2008","granularity":"day","time":"2008/12/18 00:00:00 -0500"},"longitude":100.0493,"id":"adv9lsrrvhqz","location":"Chiang Saen Lake"},"type":"Feature","geometry":{"type":"Point","coordinates":[100.0493,20.2561]}},{"properties":{"latitude":20.3026,"column_5":1,"date":{"end_time":"2008/12/19 00:00:00 -0500","original":"12/18/2008","granularity":"day","time":"2008/12/18 00:00:00 -0500"},"longitude":100.1003,"id":"adv9lsuhrnkx","location":"LAO: Laos (Chiang Saen)"},"type":"Feature","geometry":{"type":"Point","coordinates":[100.1003,20.3026]}},{"properties":{"latitude":19.3336,"column_5":1,"date":{"end_time":"2008/12/19 00:00:00 -0500","original":"12/18/2008","granularity":"day","time":"2008/12/18 00:00:00 -0500"},"longitude":99.8218,"id":"adv9lt51h5w5","location":"TH: Mae Chai"},"type":"Feature","geometry":{"type":"Point","coordinates":[99.8218,19.3336]}},{"properties":{"latitude":19.171,"column_5":1,"date":{"end_time":"2008/12/19 00:00:00 -0500","original":"12/18/2008","granularity":"day","time":"2008/12/18 00:00:00 -0500"},"longitude":99.9066,"id":"adv9lt00slau","location":"TH: Phayao"},"type":"Feature","geometry":{"type":"Point","coordinates":[99.9066,19.171]}},{"properties":{"latitude":19.3408,"column_5":1,"date":{"end_time":"2008/12/22 00:00:00 -0500","original":"12/21/2008","granularity":"day","time":"2008/12/21 00:00:00 -0500"},"longitude":98.9596,"id":"adv9lswbulvg","location":"TH: Chiang Dao"},"type":"Feature","geometry":{"type":"Point","coordinates":[98.9596,19.3408]}},{"properties":{"latitude":18.8797,"column_5":1,"date":{"end_time":"2008/12/24 00:00:00 -0500","original":"12/23/2008","granularity":"day","time":"2008/12/23 00:00:00 -0500"},"longitude":99.2164,"id":"adv9lt2w6xz0","location":"Huai Hong Krai Royal Project"},"type":"Feature","geometry":{"type":"Point","coordinates":[99.2164,18.8797]}},{"properties":{"latitude":18.5355,"column_5":1,"date":{"end_time":"2008/12/25 00:00:00 -0500","original":"12/24/2008","granularity":"day","time":"2008/12/24 00:00:00 -0500"},"longitude":98.8654,"id":"adv9lt1g36yt","location":"TH: KM 34, Hwy. 108"},"type":"Feature","geometry":{"type":"Point","coordinates":[98.8654,18.5355]}},{"properties":{"latitude":20.0493,"column_5":1,"date":{"end_time":"2008/12/26 00:00:00 -0500","original":"12/25/2008","granularity":"day","time":"2008/12/25 00:00:00 -0500"},"longitude":99.381,"id":"adv9lt42k8sq","location":"Tha Ton"},"type":"Feature","geometry":{"type":"Point","coordinates":[99.381,20.0493]}},{"properties":{"latitude":20.124287,"column_5":1,"date":{"end_time":"2008/12/27 00:00:00 -0500","original":"12/26/2008","granularity":"day","time":"2008/12/26 00:00:00 -0500"},"longitude":99.1588211,"id":"adv9lt08i12y","location":"Doi Lang"},"type":"Feature","geometry":{"type":"Point","coordinates":[99.1588211,20.124287]}},{"properties":{"latitude":20.1124,"column_5":1,"date":{"end_time":"2008/12/27 00:00:00 -0500","original":"12/26/2008","granularity":"day","time":"2008/12/26 00:00:00 -0500"},"longitude":99.1167,"id":"adv9lswr1l8n","location":"MM: Myanmar (Doi Lang)"},"type":"Feature","geometry":{"type":"Point","coordinates":[99.1167,20.1124]}},{"properties":{"latitude":16.7368,"column_5":1,"date":{"end_time":"2008/12/28 00:00:00 -0500","original":"12/27/2008","granularity":"day","time":"2008/12/27 00:00:00 -0500"},"longitude":101.5762,"id":"adv9lt31oq49","location":"Nam Nao NP"},"type":"Feature","geometry":{"type":"Point","coordinates":[101.5762,16.7368]}},{"properties":{"latitude":16.0993814,"column_5":1,"date":{"end_time":"2008/12/29 00:00:00 -0500","original":"12/28/2008","granularity":"day","time":"2008/12/28 00:00:00 -0500"},"longitude":99.1076875,"id":"adv9lt48yf2d","location":"Mae Wong NP--upper campsite vicinity (1300m)"},"type":"Feature","geometry":{"type":"Point","coordinates":[99.1076875,16.0993814]}},{"properties":{"latitude":13.5468,"column_5":1,"date":{"end_time":"2008/12/30 00:00:00 -0500","original":"12/29/2008","granularity":"day","time":"2008/12/29 00:00:00 -0500"},"longitude":100.6389,"id":"adv9lsxu8rnw","location":"Muang Boran Fish Ponds"},"type":"Feature","geometry":{"type":"Point","coordinates":[100.6389,13.5468]}},{"properties":{"latitude":13.7852,"column_5":1,"date":{"end_time":"2008/12/31 00:00:00 -0500","original":"12/30/2008","granularity":"day","time":"2008/12/30 00:00:00 -0500"},"longitude":103.3049,"id":"adv9lsrm3725","location":"Ang Trapeang Thmor"},"type":"Feature","geometry":{"type":"Point","coordinates":[103.3049,13.7852]}},{"properties":{"latitude":13.4125,"column_5":1,"date":{"end_time":"2008/12/31 00:00:00 -0500","original":"12/30/2008","granularity":"day","time":"2008/12/30 00:00:00 -0500"},"longitude":103.8668,"id":"adv9lt48l89t","location":"Angkor Wat"},"type":"Feature","geometry":{"type":"Point","coordinates":[103.8668,13.4125]}},{"properties":{"latitude":13.6368,"column_5":1,"date":{"end_time":"2008/12/31 00:00:00 -0500","original":"12/30/2008","granularity":"day","time":"2008/12/30 00:00:00 -0500"},"longitude":102.5857,"id":"adv9lsuwewg5","location":"KH: Poipet"},"type":"Feature","geometry":{"type":"Point","coordinates":[102.5857,13.6368]}},{"properties":{"latitude":13.1732,"column_5":1,"date":{"end_time":"2009/01/01 00:00:00 -0500","original":"12/31/2008","granularity":"day","time":"2008/12/31 00:00:00 -0500"},"longitude":103.5385,"id":"adv9lt6yw9tx","location":"Prek Toal Preserve, Tonle Sap Lake"},"type":"Feature","geometry":{"type":"Point","coordinates":[103.5385,13.1732]}},{"properties":{"latitude":13.2485,"column_5":1,"date":{"end_time":"2009/01/02 00:00:00 -0500","original":"1/1/2009","granularity":"day","time":"2009/01/01 00:00:00 -0500"},"longitude":104.0667,"id":"adv9lszpjglz","location":"KH: Florican Grasslands"},"type":"Feature","geometry":{"type":"Point","coordinates":[104.0667,13.2485]}},{"properties":{"latitude":12.6454,"column_5":1,"date":{"end_time":"2009/01/04 00:00:00 -0500","original":"1/3/2009","granularity":"day","time":"2009/01/03 00:00:00 -0500"},"longitude":104.8593,"id":"adv9lt2vp9u2","location":"Kompong Thom grasslands"},"type":"Feature","geometry":{"type":"Point","coordinates":[104.8593,12.6454]}},{"properties":{"latitude":12.6067,"column_5":1,"date":{"end_time":"2009/01/05 00:00:00 -0500","original":"1/4/2009","granularity":"day","time":"2009/01/04 00:00:00 -0500"},"longitude":106.0177,"id":"adv9lsxa55bd","location":"Kratie--boat trip"},"type":"Feature","geometry":{"type":"Point","coordinates":[106.0177,12.6067]}},{"properties":{"latitude":4.2057,"column_5":1,"date":{"end_time":"2009/01/18 00:00:00 -0500","original":"1/17/2009","granularity":"day","time":"2009/01/17 00:00:00 -0500"},"longitude":101.9795,"id":"adv9lsr60ltl","location":"MY: Malaysia"},"type":"Feature","geometry":{"type":"Point","coordinates":[101.9795,4.2057]}},{"properties":{"latitude":2.7427,"column_5":1,"date":{"end_time":"2009/01/18 00:00:00 -0500","original":"1/17/2009","granularity":"day","time":"2009/01/17 00:00:00 -0500"},"longitude":101.7207,"id":"adv9lsy1b5ss","location":"MY: Kuala Lumpur International Airport"},"type":"Feature","geometry":{"type":"Point","coordinates":[101.7207,2.7427]}},{"properties":{"latitude":37.4493,"column_5":1,"date":{"end_time":"2009/01/27 00:00:00 -0500","original":"1/26/2009","granularity":"day","time":"2009/01/26 00:00:00 -0500"},"longitude":126.4507,"id":"adv9lt1gk59r","location":"KR: Seoul-Incheon International Airport"},"type":"Feature","geometry":{"type":"Point","coordinates":[126.4507,37.4493]}},{"properties":{"latitude":31.3371,"column_5":1,"date":{"end_time":"2009/02/28 00:00:00 -0500","original":"2/27/2009","granularity":"day","time":"2009/02/27 00:00:00 -0500"},"longitude":-109.2787,"id":"adv9lsqw1oed","location":"Slaughter Ranch"},"type":"Feature","geometry":{"type":"Point","coordinates":[-109.2787,31.3371]}},{"properties":{"latitude":31.8562726,"column_5":1,"date":{"end_time":"2009/02/28 00:00:00 -0500","original":"2/27/2009","granularity":"day","time":"2009/02/27 00:00:00 -0500"},"longitude":-107.8692627,"id":"adv9lsxu3gzk","location":"NM: Hermanas Valley"},"type":"Feature","geometry":{"type":"Point","coordinates":[-107.8692627,31.8562726]}},{"properties":{"latitude":32.180752,"column_5":1,"date":{"end_time":"2009/03/08 00:00:00 -0500","original":"3/7/2009","granularity":"day","time":"2009/03/07 00:00:00 -0500"},"longitude":-110.719749,"id":"adv9lsrcxdyd","location":"Saguaro NP--Rincon Mountains Unit"},"type":"Feature","geometry":{"type":"Point","coordinates":[-110.719749,32.180752]}},{"properties":{"latitude":39.1392667,"column_5":1,"date":{"end_time":"2009/04/01 00:00:00 -0400","original":"3/31/2009","granularity":"day","time":"2009/03/31 00:00:00 -0400"},"longitude":-90.7373444,"id":"adv9lswjvzfq","location":"BK Leach CA"},"type":"Feature","geometry":{"type":"Point","coordinates":[-90.7373444,39.1392667]}},{"properties":{"latitude":37.0425722,"column_5":1,"date":{"end_time":"2009/04/05 00:00:00 -0400","original":"4/4/2009","granularity":"day","time":"2009/04/04 00:00:00 -0400"},"longitude":-90.0908194,"id":"adv9lsstl7o4","location":"Duck Creek CA"},"type":"Feature","geometry":{"type":"Point","coordinates":[-90.0908194,37.0425722]}},{"properties":{"latitude":36.9817121,"column_5":1,"date":{"end_time":"2009/04/05 00:00:00 -0400","original":"4/4/2009","granularity":"day","time":"2009/04/04 00:00:00 -0400"},"longitude":-90.1524353,"id":"adv9lstor7mr","location":"Mingo NWR--Stoddard Co."},"type":"Feature","geometry":{"type":"Point","coordinates":[-90.1524353,36.9817121]}},{"properties":{"latitude":32.8986147,"column_5":1,"date":{"end_time":"2009/04/07 00:00:00 -0400","original":"4/6/2009","granularity":"day","time":"2009/04/06 00:00:00 -0400"},"longitude":-97.0415497,"id":"adv9lst687zp","location":"Dallas-Fort Worth Airport"},"type":"Feature","geometry":{"type":"Point","coordinates":[-97.0415497,32.8986147]}},{"properties":{"latitude":35.31121,"column_5":1,"date":{"end_time":"2009/05/03 00:00:00 -0400","original":"5/2/2009","granularity":"day","time":"2009/05/02 00:00:00 -0400"},"longitude":-98.71278,"id":"adv9lt2164px","location":"Oklahoma"},"type":"Feature","geometry":{"type":"Point","coordinates":[-98.71278,35.31121]}},{"properties":{"latitude":38.5562873,"column_5":1,"date":{"end_time":"2009/05/06 00:00:00 -0400","original":"5/5/2009","granularity":"day","time":"2009/05/05 00:00:00 -0400"},"longitude":-90.428381,"id":"adv9lsu3r7px","location":"Powder Valley CNC"},"type":"Feature","geometry":{"type":"Point","coordinates":[-90.428381,38.5562873]}},{"properties":{"latitude":-2.4478329,"column_5":1,"date":{"end_time":"2009/09/20 00:00:00 -0400","original":"9/19/2009","granularity":"day","time":"2009/09/19 00:00:00 -0400"},"longitude":-79.7497559,"id":"adv9lsx8ulha","location":"Reserva Ecolgica Manglares Churute"},"type":"Feature","geometry":{"type":"Point","coordinates":[-79.7497559,-2.4478329]}},{"properties":{"latitude":-2.141835,"column_5":1,"date":{"end_time":"2009/09/20 00:00:00 -0400","original":"9/19/2009","granularity":"day","time":"2009/09/19 00:00:00 -0400"},"longitude":-79.9049377,"id":"adv9lt5jtfmd","location":"EC: Guayaquil"},"type":"Feature","geometry":{"type":"Point","coordinates":[-79.9049377,-2.141835]}},{"properties":{"latitude":-3.2625482,"column_5":1,"date":{"end_time":"2009/09/20 00:00:00 -0400","original":"9/19/2009","granularity":"day","time":"2009/09/19 00:00:00 -0400"},"longitude":-79.9557495,"id":"adv9lt4nyair","location":"EC: Machala"},"type":"Feature","geometry":{"type":"Point","coordinates":[-79.9557495,-3.2625482]}},{"properties":{"latitude":-4.2666429,"column_5":1,"date":{"end_time":"2009/09/24 00:00:00 -0400","original":"9/23/2009","granularity":"day","time":"2009/09/23 00:00:00 -0400"},"longitude":-79.2261887,"id":"adv9lsyr7xv5","location":"Vilcabamba--vicinity"},"type":"Feature","geometry":{"type":"Point","coordinates":[-79.2261887,-4.2666429]}},{"properties":{"latitude":-4.4948845,"column_5":1,"date":{"end_time":"2009/09/24 00:00:00 -0400","original":"9/23/2009","granularity":"day","time":"2009/09/23 00:00:00 -0400"},"longitude":-79.1325474,"id":"adv9lt41wahk","location":"Reserva Tapichalaca"},"type":"Feature","geometry":{"type":"Point","coordinates":[-79.1325474,-4.4948845]}},{"properties":{"latitude":-4.0661588,"column_5":1,"date":{"end_time":"2009/09/25 00:00:00 -0400","original":"9/24/2009","granularity":"day","time":"2009/09/24 00:00:00 -0400"},"longitude":-78.9535904,"id":"adv9lt3gn3ak","location":"EC: Zamora"},"type":"Feature","geometry":{"type":"Point","coordinates":[-78.9535904,-4.0661588]}},{"properties":{"latitude":-3.605254,"column_5":1,"date":{"end_time":"2009/09/28 00:00:00 -0400","original":"9/27/2009","granularity":"day","time":"2009/09/27 00:00:00 -0400"},"longitude":-79.2100525,"id":"adv9lsuw40ar","location":"EC: San Lucas"},"type":"Feature","geometry":{"type":"Point","coordinates":[-79.2100525,-3.605254]}},{"properties":{"latitude":-2.83,"column_5":1,"date":{"end_time":"2009/09/30 00:00:00 -0400","original":"9/29/2009","granularity":"day","time":"2009/09/29 00:00:00 -0400"},"longitude":-79.2097222,"id":"adv9lt5ma7w2","location":"PN El Cajas"},"type":"Feature","geometry":{"type":"Point","coordinates":[-79.2097222,-2.83]}},{"properties":{"latitude":-2.2034171,"column_5":1,"date":{"end_time":"2009/10/01 00:00:00 -0400","original":"9/30/2009","granularity":"day","time":"2009/09/30 00:00:00 -0400"},"longitude":-78.8464737,"id":"adv9lt2nch7a","location":"EC: Alausi"},"type":"Feature","geometry":{"type":"Point","coordinates":[-78.8464737,-2.2034171]}},{"properties":{"latitude":-0.9008418,"column_5":1,"date":{"end_time":"2009/10/05 00:00:00 -0400","original":"10/4/2009","granularity":"day","time":"2009/10/04 00:00:00 -0400"},"longitude":-77.7231216,"id":"adv9lt759dmj","location":"EC: Tena--Whitewater Rafting"},"type":"Feature","geometry":{"type":"Point","coordinates":[-77.7231216,-0.9008418]}},{"properties":{"latitude":-1.0418413,"column_5":1,"date":{"end_time":"2009/10/06 00:00:00 -0400","original":"10/5/2009","granularity":"day","time":"2009/10/05 00:00:00 -0400"},"longitude":-77.5786686,"id":"adv9lsx7yioz","location":"Payachicta"},"type":"Feature","geometry":{"type":"Point","coordinates":[-77.5786686,-1.0418413]}},{"properties":{"latitude":-0.5796906,"column_5":1,"date":{"end_time":"2009/10/07 00:00:00 -0400","original":"10/6/2009","granularity":"day","time":"2009/10/06 00:00:00 -0400"},"longitude":-77.8666306,"id":"adv9lt4e61o8","location":"EC: Cosanga"},"type":"Feature","geometry":{"type":"Point","coordinates":[-77.8666306,-0.5796906]}},{"properties":{"latitude":-0.2968012,"column_5":1,"date":{"end_time":"2009/10/08 00:00:00 -0400","original":"10/7/2009","granularity":"day","time":"2009/10/07 00:00:00 -0400"},"longitude":-77.7480125,"id":"adv9lt2i4nmo","location":"Bombon"},"type":"Feature","geometry":{"type":"Point","coordinates":[-77.7480125,-0.2968012]}},{"properties":{"latitude":-0.3709576,"column_5":1,"date":{"end_time":"2009/10/08 00:00:00 -0400","original":"10/7/2009","granularity":"day","time":"2009/10/07 00:00:00 -0400"},"longitude":-78.0815987,"id":"adv9lsy3e6nw","location":"Guango Lodge"},"type":"Feature","geometry":{"type":"Point","coordinates":[-78.0815987,-0.3709576]}},{"properties":{"latitude":-0.3291159,"column_5":1,"date":{"end_time":"2009/10/09 00:00:00 -0400","original":"10/8/2009","granularity":"day","time":"2009/10/08 00:00:00 -0400"},"longitude":-78.2095234,"id":"adv9lt6gagcs","location":"Papallacta--pass &amp; vicinity"},"type":"Feature","geometry":{"type":"Point","coordinates":[-78.2095234,-0.3291159]}},{"properties":{"latitude":-0.3768369,"column_5":1,"date":{"end_time":"2009/10/09 00:00:00 -0400","original":"10/8/2009","granularity":"day","time":"2009/10/08 00:00:00 -0400"},"longitude":-78.1414604,"id":"adv9lt227qsq","location":"EC: Papallacta"},"type":"Feature","geometry":{"type":"Point","coordinates":[-78.1414604,-0.3768369]}},{"properties":{"latitude":-0.3776523,"column_5":1,"date":{"end_time":"2009/10/09 00:00:00 -0400","original":"10/8/2009","granularity":"day","time":"2009/10/08 00:00:00 -0400"},"longitude":-78.1613731,"id":"adv9lt6g9zgv","location":"Lago Papallacta"},"type":"Feature","geometry":{"type":"Point","coordinates":[-78.1613731,-0.3776523]}},{"properties":{"latitude":-0.1946636,"column_5":1,"date":{"end_time":"2009/10/10 00:00:00 -0400","original":"10/9/2009","granularity":"day","time":"2009/10/09 00:00:00 -0400"},"longitude":-78.4942245,"id":"adv9lsr2clet","location":"EC: Quito"},"type":"Feature","geometry":{"type":"Point","coordinates":[-78.4942245,-0.1946636]}},{"properties":{"latitude":-0.0489235,"column_5":1,"date":{"end_time":"2009/10/11 00:00:00 -0400","original":"10/10/2009","granularity":"day","time":"2009/10/10 00:00:00 -0400"},"longitude":-78.7674236,"id":"adv9lt1u0rxs","location":"Mindo--Yellow House Trails"},"type":"Feature","geometry":{"type":"Point","coordinates":[-78.7674236,-0.0489235]}},{"properties":{"latitude":-0.0604248,"column_5":1,"date":{"end_time":"2009/10/12 00:00:00 -0400","original":"10/11/2009","granularity":"day","time":"2009/10/11 00:00:00 -0400"},"longitude":-78.7846756,"id":"adv9lswtoz8j","location":"Mindo--Waterfall Trail"},"type":"Feature","geometry":{"type":"Point","coordinates":[-78.7846756,-0.0604248]}},{"properties":{"latitude":-0.0295258,"column_5":1,"date":{"end_time":"2009/10/14 00:00:00 -0400","original":"10/13/2009","granularity":"day","time":"2009/10/13 00:00:00 -0400"},"longitude":-78.707428,"id":"adv9lt76qvue","location":"Bellavista Cloud Forest Lodge"},"type":"Feature","geometry":{"type":"Point","coordinates":[-78.707428,-0.0295258]}},{"properties":{"latitude":-0.0173146,"column_5":1,"date":{"end_time":"2009/10/14 00:00:00 -0400","original":"10/13/2009","granularity":"day","time":"2009/10/13 00:00:00 -0400"},"longitude":-78.6828655,"id":"adv9lt6dp7k7","location":"Tandayapa--upper valley (TandayapaBellavista)"},"type":"Feature","geometry":{"type":"Point","coordinates":[-78.6828655,-0.0173146]}},{"properties":{"latitude":-0.0279808,"column_5":1,"date":{"end_time":"2009/10/14 00:00:00 -0400","original":"10/13/2009","granularity":"day","time":"2009/10/13 00:00:00 -0400"},"longitude":-78.6930084,"id":"adv9lt3v9uaf","location":"Nono-Mindo Road--Tony Nunnery's yard"},"type":"Feature","geometry":{"type":"Point","coordinates":[-78.6930084,-0.0279808]}},{"properties":{"latitude":0.2087398,"column_5":1,"date":{"end_time":"2009/10/15 00:00:00 -0400","original":"10/14/2009","granularity":"day","time":"2009/10/14 00:00:00 -0400"},"longitude":-78.7369537,"id":"adv9lsxb49ox","location":"Chontal--Oilbird Cave (Finca Morales/Cueva de los Tayos)"},"type":"Feature","geometry":{"type":"Point","coordinates":[-78.7369537,0.2087398]}},{"properties":{"latitude":0.1431887,"column_5":1,"date":{"end_time":"2009/10/16 00:00:00 -0400","original":"10/15/2009","granularity":"day","time":"2009/10/15 00:00:00 -0400"},"longitude":-79.1346782,"id":"adv9lsvccl5a","location":"Rio Silanche Bird Sanctuary"},"type":"Feature","geometry":{"type":"Point","coordinates":[-79.1346782,0.1431887]}},{"properties":{"latitude":0.02018,"column_5":1,"date":{"end_time":"2009/10/18 00:00:00 -0400","original":"10/17/2009","granularity":"day","time":"2009/10/17 00:00:00 -0400"},"longitude":-78.70721,"id":"adv9lt0c23mw","location":"Nanegalito--Refugio Paz de las Aves"},"type":"Feature","geometry":{"type":"Point","coordinates":[-78.70721,0.02018]}},{"properties":{"latitude":0.0042057,"column_5":1,"date":{"end_time":"2009/10/19 00:00:00 -0400","original":"10/18/2009","granularity":"day","time":"2009/10/18 00:00:00 -0400"},"longitude":-78.48768,"id":"adv9lswvsis3","location":"Calicali"},"type":"Feature","geometry":{"type":"Point","coordinates":[-78.48768,0.0042057]}},{"properties":{"latitude":38.49592,"column_5":1,"date":{"end_time":"2009/10/29 00:00:00 -0400","original":"10/28/2009","granularity":"day","time":"2009/10/28 00:00:00 -0400"},"longitude":-98.32603,"id":"adv9lsyervy5","location":"Kansas"},"type":"Feature","geometry":{"type":"Point","coordinates":[-98.32603,38.49592]}},{"properties":{"latitude":40.1694087,"column_5":1,"date":{"end_time":"2009/10/30 00:00:00 -0400","original":"10/29/2009","granularity":"day","time":"2009/10/29 00:00:00 -0400"},"longitude":-105.1385843,"id":"adv9lsy7vtb3","location":"Longmont--Golden Ponds"},"type":"Feature","geometry":{"type":"Point","coordinates":[-105.1385843,40.1694087]}},{"properties":{"latitude":40.1818008,"column_5":1,"date":{"end_time":"2009/10/30 00:00:00 -0400","original":"10/29/2009","granularity":"day","time":"2009/10/29 00:00:00 -0400"},"longitude":-105.0372009,"id":"adv9lt44l88c","location":"Union Reservoir"},"type":"Feature","geometry":{"type":"Point","coordinates":[-105.0372009,40.1818008]}},{"properties":{"latitude":39.9964235,"column_5":1,"date":{"end_time":"2009/10/31 00:00:00 -0400","original":"10/30/2009","granularity":"day","time":"2009/10/30 00:00:00 -0400"},"longitude":-105.2053332,"id":"adv9lt5wteb4","location":"Baseline Reservoir"},"type":"Feature","geometry":{"type":"Point","coordinates":[-105.2053332,39.9964235]}},{"properties":{"latitude":40.0782795,"column_5":1,"date":{"end_time":"2009/10/31 00:00:00 -0400","original":"10/30/2009","granularity":"day","time":"2009/10/30 00:00:00 -0400"},"longitude":-105.222127,"id":"adv9lsu9zple","location":"Boulder Reservoir complex--Boulder Res"},"type":"Feature","geometry":{"type":"Point","coordinates":[-105.222127,40.0782795]}},{"properties":{"latitude":34.17154,"column_5":1,"date":{"end_time":"2009/11/01 00:00:00 -0400","original":"10/31/2009","granularity":"day","time":"2009/10/31 00:00:00 -0400"},"longitude":-106.02382,"id":"adv9lswhshlv","location":"New Mexico"},"type":"Feature","geometry":{"type":"Point","coordinates":[-106.02382,34.17154]}},{"properties":{"latitude":-33.872696,"column_5":1,"date":{"end_time":"2009/11/10 00:00:00 -0500","original":"11/9/2009","granularity":"day","time":"2009/11/09 00:00:00 -0500"},"longitude":151.2089539,"id":"adv9lt0i5gir","location":"NSW: Sydney"},"type":"Feature","geometry":{"type":"Point","coordinates":[151.2089539,-33.872696]}},{"properties":{"latitude":-32.5429061,"column_5":1,"date":{"end_time":"2009/11/11 00:00:00 -0500","original":"11/10/2009","granularity":"day","time":"2009/11/10 00:00:00 -0500"},"longitude":152.3106766,"id":"adv9lt5v2tey","location":"Myall Lakes NP"},"type":"Feature","geometry":{"type":"Point","coordinates":[152.3106766,-32.5429061]}},{"properties":{"latitude":-32.8686301,"column_5":1,"date":{"end_time":"2009/11/11 00:00:00 -0500","original":"11/10/2009","granularity":"day","time":"2009/11/10 00:00:00 -0500"},"longitude":151.7060852,"id":"adv9lssx6szh","location":"NSW: Newcastle"},"type":"Feature","geometry":{"type":"Point","coordinates":[151.7060852,-32.8686301]}},{"properties":{"latitude":-29.7136995,"column_5":1,"date":{"end_time":"2009/11/12 00:00:00 -0500","original":"11/11/2009","granularity":"day","time":"2009/11/11 00:00:00 -0500"},"longitude":152.9489136,"id":"adv9lt400x53","location":"NSW: Grafton"},"type":"Feature","geometry":{"type":"Point","coordinates":[152.9489136,-29.7136995]}},{"properties":{"latitude":-29.0729747,"column_5":1,"date":{"end_time":"2009/11/12 00:00:00 -0500","original":"11/11/2009","granularity":"day","time":"2009/11/11 00:00:00 -0500"},"longitude":153.3403015,"id":"adv9lsxhz3f4","location":"NSW: Woodburn"},"type":"Feature","geometry":{"type":"Point","coordinates":[153.3403015,-29.0729747]}},{"properties":{"latitude":-21.1406286,"column_5":1,"date":{"end_time":"2009/11/13 00:00:00 -0500","original":"11/12/2009","granularity":"day","time":"2009/11/12 00:00:00 -0500"},"longitude":148.6307716,"id":"adv9lsrlrglg","location":"QLD: Finch Hatton"},"type":"Feature","geometry":{"type":"Point","coordinates":[148.6307716,-21.1406286]}},{"properties":{"latitude":-21.0700241,"column_5":1,"date":{"end_time":"2009/11/14 00:00:00 -0500","original":"11/13/2009","granularity":"day","time":"2009/11/13 00:00:00 -0500"},"longitude":148.6372197,"id":"adv9lt3c629n","location":"Finch Hatton Gorge"},"type":"Feature","geometry":{"type":"Point","coordinates":[148.6372197,-21.0700241]}},{"properties":{"latitude":-20.0159358,"column_5":1,"date":{"end_time":"2009/11/15 00:00:00 -0500","original":"11/14/2009","granularity":"day","time":"2009/11/14 00:00:00 -0500"},"longitude":148.219986,"id":"adv9lt5qq3ab","location":"QLD: Bowen"},"type":"Feature","geometry":{"type":"Point","coordinates":[148.219986,-20.0159358]}},{"properties":{"latitude":-21.1290203,"column_5":1,"date":{"end_time":"2009/11/15 00:00:00 -0500","original":"11/14/2009","granularity":"day","time":"2009/11/14 00:00:00 -0500"},"longitude":149.2199135,"id":"adv9lt6n0zc0","location":"QLD: MacKay"},"type":"Feature","geometry":{"type":"Point","coordinates":[149.2199135,-21.1290203]}},{"properties":{"latitude":-19.2777673,"column_5":1,"date":{"end_time":"2009/11/15 00:00:00 -0500","original":"11/14/2009","granularity":"day","time":"2009/11/14 00:00:00 -0500"},"longitude":146.7871284,"id":"adv9lt4zubhi","location":"QLD: Townsville"},"type":"Feature","geometry":{"type":"Point","coordinates":[146.7871284,-19.2777673]}},{"properties":{"latitude":-20.4025591,"column_5":1,"date":{"end_time":"2009/11/15 00:00:00 -0500","original":"11/14/2009","granularity":"day","time":"2009/11/14 00:00:00 -0500"},"longitude":148.5863113,"id":"adv9lsu32ego","location":"QLD: Proserpine"},"type":"Feature","geometry":{"type":"Point","coordinates":[148.5863113,-20.4025591]}},{"properties":{"latitude":-21.1589599,"column_5":1,"date":{"end_time":"2009/11/15 00:00:00 -0500","original":"11/14/2009","granularity":"day","time":"2009/11/14 00:00:00 -0500"},"longitude":148.8625145,"id":"adv9lsyewjy8","location":"QLD: Mirani"},"type":"Feature","geometry":{"type":"Point","coordinates":[148.8625145,-21.1589599]}},{"properties":{"latitude":-19.0462168,"column_5":1,"date":{"end_time":"2009/11/15 00:00:00 -0500","original":"11/14/2009","granularity":"day","time":"2009/11/14 00:00:00 -0500"},"longitude":146.390419,"id":"adv9lsw2umm9","location":"QLD: Rollingstone"},"type":"Feature","geometry":{"type":"Point","coordinates":[146.390419,-19.0462168]}},{"properties":{"latitude":-17.9996316,"column_5":1,"date":{"end_time":"2009/11/16 00:00:00 -0500","original":"11/15/2009","granularity":"day","time":"2009/11/15 00:00:00 -0500"},"longitude":145.9368896,"id":"adv9lt1dtp1m","location":"QLD: Euramo"},"type":"Feature","geometry":{"type":"Point","coordinates":[145.9368896,-17.9996316]}},{"properties":{"latitude":-18.2652178,"column_5":1,"date":{"end_time":"2009/11/16 00:00:00 -0500","original":"11/15/2009","granularity":"day","time":"2009/11/15 00:00:00 -0500"},"longitude":146.0206604,"id":"adv9lt5omvnt","location":"QLD: Cardwell"},"type":"Feature","geometry":{"type":"Point","coordinates":[146.0206604,-18.2652178]}},{"properties":{"latitude":-19.2024842,"column_5":1,"date":{"end_time":"2009/11/19 00:00:00 -0500","original":"11/18/2009","granularity":"day","time":"2009/11/18 00:00:00 -0500"},"longitude":146.7519379,"id":"adv9lsvbi5ld","location":"Townsville Town Common"},"type":"Feature","geometry":{"type":"Point","coordinates":[146.7519379,-19.2024842]}},{"properties":{"latitude":-24.8711359,"column_5":1,"date":{"end_time":"2009/11/20 00:00:00 -0500","original":"11/19/2009","granularity":"day","time":"2009/11/19 00:00:00 -0500"},"longitude":151.8502378,"id":"adv9lsy75mn9","location":"Lake Monduran"},"type":"Feature","geometry":{"type":"Point","coordinates":[151.8502378,-24.8711359]}},{"properties":{"latitude":-24.9933708,"column_5":1,"date":{"end_time":"2009/11/20 00:00:00 -0500","original":"11/19/2009","granularity":"day","time":"2009/11/19 00:00:00 -0500"},"longitude":151.9579124,"id":"adv9lswyakgm","location":"QLD: Gin Gin"},"type":"Feature","geometry":{"type":"Point","coordinates":[151.9579124,-24.9933708]}},{"properties":{"latitude":-26.838374,"column_5":1,"date":{"end_time":"2009/11/21 00:00:00 -0500","original":"11/20/2009","granularity":"day","time":"2009/11/20 00:00:00 -0500"},"longitude":152.9594707,"id":"adv9lsr9877c","location":"Glass House Mountains NP--Australia Zoo"},"type":"Feature","geometry":{"type":"Point","coordinates":[152.9594707,-26.838374]}},{"properties":{"latitude":-27.7224359,"column_5":1,"date":{"end_time":"2009/11/22 00:00:00 -0500","original":"11/21/2009","granularity":"day","time":"2009/11/21 00:00:00 -0500"},"longitude":154.2123413,"id":"adv9lsv8cexu","location":"QLD: Southport Pelagic"},"type":"Feature","geometry":{"type":"Point","coordinates":[154.2123413,-27.7224359]}},{"properties":{"latitude":-27.9605183,"column_5":1,"date":{"end_time":"2009/11/22 00:00:00 -0500","original":"11/21/2009","granularity":"day","time":"2009/11/21 00:00:00 -0500"},"longitude":153.4258983,"id":"adv9lt5mawdc","location":"Seaworld, Southport"},"type":"Feature","geometry":{"type":"Point","coordinates":[153.4258983,-27.9605183]}},{"properties":{"latitude":-28.231186,"column_5":1,"date":{"end_time":"2009/11/23 00:00:00 -0500","original":"11/22/2009","granularity":"day","time":"2009/11/22 00:00:00 -0500"},"longitude":153.1358528,"id":"adv9lsuot5mp","location":"Lamington NP--O'Reilly's"},"type":"Feature","geometry":{"type":"Point","coordinates":[153.1358528,-28.231186]}},{"properties":{"latitude":-27.3405122,"column_5":1,"date":{"end_time":"2009/11/24 00:00:00 -0500","original":"11/23/2009","granularity":"day","time":"2009/11/23 00:00:00 -0500"},"longitude":153.0780029,"id":"adv9lt5sn8sn","location":"Boondall Wetlands"},"type":"Feature","geometry":{"type":"Point","coordinates":[153.0780029,-27.3405122]}},{"properties":{"latitude":-28.5441162,"column_5":1,"date":{"end_time":"2009/11/26 00:00:00 -0500","original":"11/25/2009","granularity":"day","time":"2009/11/25 00:00:00 -0500"},"longitude":150.30756,"id":"adv9lsxjrlt9","location":"QLD: Goondiwindi"},"type":"Feature","geometry":{"type":"Point","coordinates":[150.30756,-28.5441162]}},{"properties":{"latitude":-22.1024998,"column_5":1,"date":{"end_time":"2009/12/02 00:00:00 -0500","original":"12/1/2009","granularity":"day","time":"2009/12/01 00:00:00 -0500"},"longitude":166.6892052,"id":"adv9lt1zagy0","location":"Parc de la Rivire Bleue (Blue River NP)"},"type":"Feature","geometry":{"type":"Point","coordinates":[166.6892052,-22.1024998]}},{"properties":{"latitude":-21.6483738,"column_5":1,"date":{"end_time":"2009/12/03 00:00:00 -0500","original":"12/2/2009","granularity":"day","time":"2009/12/02 00:00:00 -0500"},"longitude":165.7811058,"id":"adv9lszzja2u","location":"Refugio de Farino"},"type":"Feature","geometry":{"type":"Point","coordinates":[165.7811058,-21.6483738]}},{"properties":{"latitude":-22.1777534,"column_5":1,"date":{"end_time":"2009/12/03 00:00:00 -0500","original":"12/2/2009","granularity":"day","time":"2009/12/02 00:00:00 -0500"},"longitude":166.5065253,"id":"adv9lsvv8xak","location":"Mont Koghi"},"type":"Feature","geometry":{"type":"Point","coordinates":[166.5065253,-22.1777534]}},{"properties":{"latitude":-22.1543394,"column_5":1,"date":{"end_time":"2009/12/03 00:00:00 -0500","original":"12/2/2009","granularity":"day","time":"2009/12/02 00:00:00 -0500"},"longitude":166.4466476,"id":"adv9lsxqphl1","location":"NWC: Dumbea"},"type":"Feature","geometry":{"type":"Point","coordinates":[166.4466476,-22.1543394]}},{"properties":{"latitude":-20.9385148,"column_5":1,"date":{"end_time":"2009/12/04 00:00:00 -0500","original":"12/3/2009","granularity":"day","time":"2009/12/03 00:00:00 -0500"},"longitude":165.3344536,"id":"adv9lszvifru","location":"NWC: Poindimie"},"type":"Feature","geometry":{"type":"Point","coordinates":[165.3344536,-20.9385148]}},{"properties":{"latitude":-21.6403561,"column_5":1,"date":{"end_time":"2009/12/04 00:00:00 -0500","original":"12/3/2009","granularity":"day","time":"2009/12/03 00:00:00 -0500"},"longitude":165.8468628,"id":"adv9lt6b8v6i","location":"Sarramea"},"type":"Feature","geometry":{"type":"Point","coordinates":[165.8468628,-21.6403561]}},{"properties":{"latitude":-20.7939919,"column_5":1,"date":{"end_time":"2009/12/04 00:00:00 -0500","original":"12/3/2009","granularity":"day","time":"2009/12/03 00:00:00 -0500"},"longitude":165.2550602,"id":"adv9lt3u5800","location":"NWC: Touho"},"type":"Feature","geometry":{"type":"Point","coordinates":[165.2550602,-20.7939919]}},{"properties":{"latitude":-21.6283086,"column_5":1,"date":{"end_time":"2009/12/04 00:00:00 -0500","original":"12/3/2009","granularity":"day","time":"2009/12/03 00:00:00 -0500"},"longitude":165.7613754,"id":"adv9lszta5wu","location":"Parc les Grandes Fougeres"},"type":"Feature","geometry":{"type":"Point","coordinates":[165.7613754,-21.6283086]}},{"properties":{"latitude":-21.6765721,"column_5":1,"date":{"end_time":"2009/12/07 00:00:00 -0500","original":"12/6/2009","granularity":"day","time":"2009/12/06 00:00:00 -0500"},"longitude":165.4187393,"id":"adv9lt5bomgl","location":"Pelagic trip from Poe Beach"},"type":"Feature","geometry":{"type":"Point","coordinates":[165.4187393,-21.6765721]}},{"properties":{"latitude":-21.6928425,"column_5":1,"date":{"end_time":"2009/12/08 00:00:00 -0500","original":"12/7/2009","granularity":"day","time":"2009/12/07 00:00:00 -0500"},"longitude":165.6767464,"id":"adv9lt1fhn0k","location":"NWC: Moindou"},"type":"Feature","geometry":{"type":"Point","coordinates":[165.6767464,-21.6928425]}},{"properties":{"latitude":-33.7519263,"column_5":1,"date":{"end_time":"2009/12/09 00:00:00 -0500","original":"12/8/2009","granularity":"day","time":"2009/12/08 00:00:00 -0500"},"longitude":151.0904431,"id":"adv9lt3uhp27","location":"Pennant Hills Park, Pennant Hills"},"type":"Feature","geometry":{"type":"Point","coordinates":[151.0904431,-33.7519263]}},{"properties":{"latitude":-34.6715821,"column_5":1,"date":{"end_time":"2009/12/10 00:00:00 -0500","original":"12/9/2009","granularity":"day","time":"2009/12/09 00:00:00 -0500"},"longitude":150.7114363,"id":"adv9lt3wkw4m","location":"NSW: Barren Grounds Nature Reserve"},"type":"Feature","geometry":{"type":"Point","coordinates":[150.7114363,-34.6715821]}},{"properties":{"latitude":-35.3152302,"column_5":1,"date":{"end_time":"2009/12/11 00:00:00 -0500","original":"12/10/2009","granularity":"day","time":"2009/12/10 00:00:00 -0500"},"longitude":149.1617846,"id":"adv9lszeq1cg","location":"Jerrabomberra Wetlands"},"type":"Feature","geometry":{"type":"Point","coordinates":[149.1617846,-35.3152302]}},{"properties":{"latitude":-35.2780499,"column_5":1,"date":{"end_time":"2009/12/11 00:00:00 -0500","original":"12/10/2009","granularity":"day","time":"2009/12/10 00:00:00 -0500"},"longitude":149.1101575,"id":"adv9lsvxlgyl","location":"Australian National Botanic Gardens (ANBG)"},"type":"Feature","geometry":{"type":"Point","coordinates":[149.1101575,-35.2780499]}},{"properties":{"latitude":-34.6643464,"column_5":1,"date":{"end_time":"2009/12/11 00:00:00 -0500","original":"12/10/2009","granularity":"day","time":"2009/12/10 00:00:00 -0500"},"longitude":150.6847,"id":"adv9lsvbhhaa","location":"Budderoo NP"},"type":"Feature","geometry":{"type":"Point","coordinates":[150.6847,-34.6643464]}},{"properties":{"latitude":-36.0688394,"column_5":1,"date":{"end_time":"2009/12/12 00:00:00 -0500","original":"12/11/2009","granularity":"day","time":"2009/12/11 00:00:00 -0500"},"longitude":146.8542051,"id":"adv9lswdn3vm","location":"Wonga Wetlands"},"type":"Feature","geometry":{"type":"Point","coordinates":[146.8542051,-36.0688394]}},{"properties":{"latitude":-36.4712699,"column_5":1,"date":{"end_time":"2009/12/14 00:00:00 -0500","original":"12/13/2009","granularity":"day","time":"2009/12/13 00:00:00 -0500"},"longitude":143.7540436,"id":"adv9lss8mtmq","location":"Mt. Korong Scenic Reserve"},"type":"Feature","geometry":{"type":"Point","coordinates":[143.7540436,-36.4712699]}},{"properties":{"latitude":-36.0568708,"column_5":1,"date":{"end_time":"2009/12/14 00:00:00 -0500","original":"12/13/2009","granularity":"day","time":"2009/12/13 00:00:00 -0500"},"longitude":145.2038956,"id":"adv9lszqaiei","location":"VIC: Nathalia"},"type":"Feature","geometry":{"type":"Point","coordinates":[145.2038956,-36.0568708]}},{"properties":{"latitude":-36.5996463,"column_5":1,"date":{"end_time":"2009/12/14 00:00:00 -0500","original":"12/13/2009","granularity":"day","time":"2009/12/13 00:00:00 -0500"},"longitude":143.9376783,"id":"adv9lssweimy","location":"VIC: Bridgewater on Loddon"},"type":"Feature","geometry":{"type":"Point","coordinates":[143.9376783,-36.5996463]}},{"properties":{"latitude":-36.3553659,"column_5":1,"date":{"end_time":"2009/12/14 00:00:00 -0500","original":"12/13/2009","granularity":"day","time":"2009/12/13 00:00:00 -0500"},"longitude":143.7030602,"id":"adv9lsu2ojbh","location":"VIC: Korong Vale"},"type":"Feature","geometry":{"type":"Point","coordinates":[143.7030602,-36.3553659]}},{"properties":{"latitude":-37.4076646,"column_5":1,"date":{"end_time":"2009/12/15 00:00:00 -0500","original":"12/14/2009","granularity":"day","time":"2009/12/14 00:00:00 -0500"},"longitude":144.006815,"id":"adv9lt2937si","location":"Newlyn Reservoir"},"type":"Feature","geometry":{"type":"Point","coordinates":[144.006815,-37.4076646]}},{"properties":{"latitude":-37.0521631,"column_5":1,"date":{"end_time":"2009/12/15 00:00:00 -0500","original":"12/14/2009","granularity":"day","time":"2009/12/14 00:00:00 -0500"},"longitude":144.2162418,"id":"adv9lt64xauw","location":"Castlemaine Botanical Garden"},"type":"Feature","geometry":{"type":"Point","coordinates":[144.2162418,-37.0521631]}},{"properties":{"latitude":-36.2981099,"column_5":1,"date":{"end_time":"2009/12/15 00:00:00 -0500","original":"12/14/2009","granularity":"day","time":"2009/12/14 00:00:00 -0500"},"longitude":143.6856794,"id":"adv9lstc3vri","location":"The Granites Scenic Reserve"},"type":"Feature","geometry":{"type":"Point","coordinates":[143.6856794,-36.2981099]}},{"properties":{"latitude":-37.8695686,"column_5":1,"date":{"end_time":"2009/12/16 00:00:00 -0500","original":"12/15/2009","granularity":"day","time":"2009/12/15 00:00:00 -0500"},"longitude":144.8038387,"id":"adv9lt3kweiq","location":"Altona--Truganina wetlands"},"type":"Feature","geometry":{"type":"Point","coordinates":[144.8038387,-37.8695686]}},{"properties":{"latitude":-37.8723466,"column_5":1,"date":{"end_time":"2009/12/16 00:00:00 -0500","original":"12/15/2009","granularity":"day","time":"2009/12/15 00:00:00 -0500"},"longitude":144.8240948,"id":"adv9lt08zhi6","location":"VIC: Altona Beach"},"type":"Feature","geometry":{"type":"Point","coordinates":[144.8240948,-37.8723466]}},{"properties":{"latitude":-37.942573,"column_5":1,"date":{"end_time":"2009/12/16 00:00:00 -0500","original":"12/15/2009","granularity":"day","time":"2009/12/15 00:00:00 -0500"},"longitude":145.6282425,"id":"adv9lt634owc","location":"Bunyip SP"},"type":"Feature","geometry":{"type":"Point","coordinates":[145.6282425,-37.942573]}},{"properties":{"latitude":-37.7491958,"column_5":1,"date":{"end_time":"2009/12/16 00:00:00 -0500","original":"12/15/2009","granularity":"day","time":"2009/12/15 00:00:00 -0500"},"longitude":145.0893223,"id":"adv9lt1ta7u5","location":"Banyule Flats Reserve"},"type":"Feature","geometry":{"type":"Point","coordinates":[145.0893223,-37.7491958]}},{"properties":{"latitude":-37.8120386,"column_5":1,"date":{"end_time":"2009/12/16 00:00:00 -0500","original":"12/15/2009","granularity":"day","time":"2009/12/15 00:00:00 -0500"},"longitude":145.5061913,"id":"adv9lsuj67it","location":"Yellingbo Forest Preserve"},"type":"Feature","geometry":{"type":"Point","coordinates":[145.5061913,-37.8120386]}},{"properties":{"latitude":-37.9979213,"column_5":1,"date":{"end_time":"2009/12/17 00:00:00 -0500","original":"12/16/2009","granularity":"day","time":"2009/12/16 00:00:00 -0500"},"longitude":144.5917511,"id":"adv9lt36bda9","location":"Werribee--Western Treatment Plant (WTP)"},"type":"Feature","geometry":{"type":"Point","coordinates":[144.5917511,-37.9979213]}},{"properties":{"latitude":-37.8643005,"column_5":1,"date":{"end_time":"2009/12/17 00:00:00 -0500","original":"12/16/2009","granularity":"day","time":"2009/12/16 00:00:00 -0500"},"longitude":144.8090315,"id":"adv9lt19zaba","location":"Altona--St. Joseph Pond"},"type":"Feature","geometry":{"type":"Point","coordinates":[144.8090315,-37.8643005]}},{"properties":{"latitude":-38.5174148,"column_5":1,"date":{"end_time":"2009/12/18 00:00:00 -0500","original":"12/17/2009","granularity":"day","time":"2009/12/17 00:00:00 -0500"},"longitude":145.1179361,"id":"adv9lss83mam","location":"Philip Island--The Nobbies Center"},"type":"Feature","geometry":{"type":"Point","coordinates":[145.1179361,-38.5174148]}},{"properties":{"latitude":-38.5429293,"column_5":1,"date":{"end_time":"2009/12/18 00:00:00 -0500","original":"12/17/2009","granularity":"day","time":"2009/12/17 00:00:00 -0500"},"longitude":145.3403664,"id":"adv9lt3n6eca","location":"Philip Island--Cape Woolamai Scenic Reserve"},"type":"Feature","geometry":{"type":"Point","coordinates":[145.3403664,-38.5429293]}},{"properties":{"latitude":-37.8059865,"column_5":1,"date":{"end_time":"2009/12/18 00:00:00 -0500","original":"12/17/2009","granularity":"day","time":"2009/12/17 00:00:00 -0500"},"longitude":144.9652863,"id":"adv9lsyctp6r","location":"VIC: Melbourne"},"type":"Feature","geometry":{"type":"Point","coordinates":[144.9652863,-37.8059865]}},{"properties":{"latitude":-38.4685089,"column_5":1,"date":{"end_time":"2009/12/19 00:00:00 -0500","original":"12/18/2009","granularity":"day","time":"2009/12/18 00:00:00 -0500"},"longitude":144.1047478,"id":"adv9lsvgjxr4","location":"Great Ocean Road--Cape Aireys"},"type":"Feature","geometry":{"type":"Point","coordinates":[144.1047478,-38.4685089]}},{"properties":{"latitude":-38.3947852,"column_5":1,"date":{"end_time":"2009/12/19 00:00:00 -0500","original":"12/18/2009","granularity":"day","time":"2009/12/18 00:00:00 -0500"},"longitude":144.2525053,"id":"adv9lsx7itzc","location":"Great Ocean Road--Pt. Addis"},"type":"Feature","geometry":{"type":"Point","coordinates":[144.2525053,-38.3947852]}},{"properties":{"latitude":-38.387957,"column_5":1,"date":{"end_time":"2009/12/20 00:00:00 -0500","original":"12/19/2009","granularity":"day","time":"2009/12/19 00:00:00 -0500"},"longitude":142.4858093,"id":"adv9lt3vvh6a","location":"VIC: Great Ocean Road"},"type":"Feature","geometry":{"type":"Point","coordinates":[142.4858093,-38.387957]}},{"properties":{"latitude":-38.0150992,"column_5":1,"date":{"end_time":"2009/12/20 00:00:00 -0500","original":"12/19/2009","granularity":"day","time":"2009/12/19 00:00:00 -0500"},"longitude":140.9195709,"id":"adv9lt52plyd","location":"SA: Great Ocean Road"},"type":"Feature","geometry":{"type":"Point","coordinates":[140.9195709,-38.0150992]}},{"properties":{"latitude":-36.0113389,"column_5":1,"date":{"end_time":"2009/12/21 00:00:00 -0500","original":"12/20/2009","granularity":"day","time":"2009/12/20 00:00:00 -0500"},"longitude":139.5291138,"id":"adv9lsv0od8z","location":"Coorong NP"},"type":"Feature","geometry":{"type":"Point","coordinates":[139.5291138,-36.0113389]}},{"properties":{"latitude":-37.1146098,"column_5":1,"date":{"end_time":"2009/12/21 00:00:00 -0500","original":"12/20/2009","granularity":"day","time":"2009/12/20 00:00:00 -0500"},"longitude":140.6988144,"id":"adv9lt74096s","location":"Bool Lagoon Game Reserve"},"type":"Feature","geometry":{"type":"Point","coordinates":[140.6988144,-37.1146098]}},{"properties":{"latitude":-34.8333559,"column_5":1,"date":{"end_time":"2009/12/22 00:00:00 -0500","original":"12/21/2009","granularity":"day","time":"2009/12/21 00:00:00 -0500"},"longitude":138.5732174,"id":"adv9lsxgndog","location":"Dry Creek--Barker Inlet Wetlands"},"type":"Feature","geometry":{"type":"Point","coordinates":[138.5732174,-34.8333559]}},{"properties":{"latitude":-35.048057,"column_5":1,"date":{"end_time":"2009/12/23 00:00:00 -0500","original":"12/22/2009","granularity":"day","time":"2009/12/22 00:00:00 -0500"},"longitude":141.7216587,"id":"adv9lstgbqn5","location":"Murray-Sunset NP--Pink Lakes"},"type":"Feature","geometry":{"type":"Point","coordinates":[141.7216587,-35.048057]}},{"properties":{"latitude":-35.5343216,"column_5":1,"date":{"end_time":"2009/12/23 00:00:00 -0500","original":"12/22/2009","granularity":"day","time":"2009/12/22 00:00:00 -0500"},"longitude":142.5288963,"id":"adv9lt3wsu8a","location":"VIC: Gama"},"type":"Feature","geometry":{"type":"Point","coordinates":[142.5288963,-35.5343216]}},{"properties":{"latitude":-35.4465468,"column_5":1,"date":{"end_time":"2009/12/24 00:00:00 -0500","original":"12/23/2009","granularity":"day","time":"2009/12/23 00:00:00 -0500"},"longitude":142.8652668,"id":"adv9lt5p7a9w","location":"Lake Tyrrell Lookout"},"type":"Feature","geometry":{"type":"Point","coordinates":[142.8652668,-35.4465468]}},{"properties":{"latitude":-31.9539101,"column_5":1,"date":{"end_time":"2009/12/26 00:00:00 -0500","original":"12/25/2009","granularity":"day","time":"2009/12/25 00:00:00 -0500"},"longitude":141.467514,"id":"adv9lt4xvpp1","location":"NSW: Broken Hill"},"type":"Feature","geometry":{"type":"Point","coordinates":[141.467514,-31.9539101]}},{"properties":{"latitude":-28.8734643,"column_5":1,"date":{"end_time":"2009/12/30 00:00:00 -0500","original":"12/29/2009","granularity":"day","time":"2009/12/29 00:00:00 -0500"},"longitude":138.4924936,"id":"adv9lt2mky5d","location":"Birdsville Track--Marree to Mungerannie"},"type":"Feature","geometry":{"type":"Point","coordinates":[138.4924936,-28.8734643]}},{"properties":{"latitude":-25.9000745,"column_5":1,"date":{"end_time":"2009/12/31 00:00:00 -0500","original":"12/30/2009","granularity":"day","time":"2009/12/30 00:00:00 -0500"},"longitude":139.065156,"id":"adv9lstdrk02","location":"Simpson Desert NP"},"type":"Feature","geometry":{"type":"Point","coordinates":[139.065156,-25.9000745]}},{"properties":{"latitude":-25.8982215,"column_5":1,"date":{"end_time":"2010/01/01 00:00:00 -0500","original":"12/31/2009","granularity":"day","time":"2009/12/31 00:00:00 -0500"},"longitude":139.3535042,"id":"adv9lsrtreze","location":"QLD: Birdsville"},"type":"Feature","geometry":{"type":"Point","coordinates":[139.3535042,-25.8982215]}},{"properties":{"latitude":-24.2695012,"column_5":1,"date":{"end_time":"2010/01/02 00:00:00 -0500","original":"1/1/2010","granularity":"day","time":"2010/01/01 00:00:00 -0500"},"longitude":139.4247437,"id":"adv9lt343hap","location":"QLD: Birdsville to Boulia"},"type":"Feature","geometry":{"type":"Point","coordinates":[139.4247437,-24.2695012]}},{"properties":{"latitude":-21.6995415,"column_5":1,"date":{"end_time":"2010/01/02 00:00:00 -0500","original":"1/1/2010","granularity":"day","time":"2010/01/01 00:00:00 -0500"},"longitude":139.5195007,"id":"adv9lsttkn1l","location":"QLD: Boulia to Mt. Isa"},"type":"Feature","geometry":{"type":"Point","coordinates":[139.5195007,-21.6995415]}},{"properties":{"latitude":-20.5882574,"column_5":1,"date":{"end_time":"2010/01/03 00:00:00 -0500","original":"1/2/2010","granularity":"day","time":"2010/01/02 00:00:00 -0500"},"longitude":139.5760417,"id":"adv9lsqsr8rz","location":"Lake Moondarra"},"type":"Feature","geometry":{"type":"Point","coordinates":[139.5760417,-20.5882574]}},{"properties":{"latitude":-20.8221535,"column_5":1,"date":{"end_time":"2010/01/03 00:00:00 -0500","original":"1/2/2010","granularity":"day","time":"2010/01/02 00:00:00 -0500"},"longitude":139.4572306,"id":"adv9lt1sz23f","location":"Mica Creek, Mt. Isa"},"type":"Feature","geometry":{"type":"Point","coordinates":[139.4572306,-20.8221535]}},{"properties":{"latitude":-20.3100182,"column_5":1,"date":{"end_time":"2010/01/03 00:00:00 -0500","original":"1/2/2010","granularity":"day","time":"2010/01/02 00:00:00 -0500"},"longitude":139.1367817,"id":"adv9lt62wv7p","location":"McNamaras Road (Carpentarian Grasswren site)"},"type":"Feature","geometry":{"type":"Point","coordinates":[139.1367817,-20.3100182]}},{"properties":{"latitude":-22.6443731,"column_5":1,"date":{"end_time":"2010/01/04 00:00:00 -0500","original":"1/3/2010","granularity":"day","time":"2010/01/03 00:00:00 -0500"},"longitude":133.3452702,"id":"adv9lt6vsjnr","location":"NT: Aileron"},"type":"Feature","geometry":{"type":"Point","coordinates":[133.3452702,-22.6443731]}},{"properties":{"latitude":-23.5141,"column_5":1,"date":{"end_time":"2010/01/04 00:00:00 -0500","original":"1/3/2010","granularity":"day","time":"2010/01/03 00:00:00 -0500"},"longitude":133.5844,"id":"adv9lswvqjr5","location":"Kunoth Well"},"type":"Feature","geometry":{"type":"Point","coordinates":[133.5844,-23.5141]}},{"properties":{"latitude":-23.633182,"column_5":1,"date":{"end_time":"2010/01/05 00:00:00 -0500","original":"1/4/2010","granularity":"day","time":"2010/01/04 00:00:00 -0500"},"longitude":132.7277398,"id":"adv9lsyhpxr0","location":"Ormiston Gorge"},"type":"Feature","geometry":{"type":"Point","coordinates":[132.7277398,-23.633182]}},{"properties":{"latitude":-27.3077229,"column_5":1,"date":{"end_time":"2010/01/06 00:00:00 -0500","original":"1/5/2010","granularity":"day","time":"2010/01/05 00:00:00 -0500"},"longitude":133.6239624,"id":"adv9lsva1dnd","location":"SA: Marla"},"type":"Feature","geometry":{"type":"Point","coordinates":[133.6239624,-27.3077229]}},{"properties":{"latitude":-25.3570441,"column_5":1,"date":{"end_time":"2010/01/06 00:00:00 -0500","original":"1/5/2010","granularity":"day","time":"2010/01/05 00:00:00 -0500"},"longitude":131.044414,"id":"adv9lt0is3l7","location":"Uluru-Kata Tjuta NP"},"type":"Feature","geometry":{"type":"Point","coordinates":[131.044414,-25.3570441]}},{"properties":{"latitude":-31.4497077,"column_5":1,"date":{"end_time":"2010/01/07 00:00:00 -0500","original":"1/6/2010","granularity":"day","time":"2010/01/06 00:00:00 -0500"},"longitude":130.8960915,"id":"adv9lt44an7r","location":"Nullarbor Roadhouse"},"type":"Feature","geometry":{"type":"Point","coordinates":[130.8960915,-31.4497077]}},{"properties":{"latitude":-33.1152683,"column_5":1,"date":{"end_time":"2010/01/07 00:00:00 -0500","original":"1/6/2010","granularity":"day","time":"2010/01/06 00:00:00 -0500"},"longitude":136.601944,"id":"adv9lstc1j52","location":"Lake Gilles Conservation Park"},"type":"Feature","geometry":{"type":"Point","coordinates":[136.601944,-33.1152683]}},{"properties":{"latitude":-33.8088202,"column_5":1,"date":{"end_time":"2010/01/08 00:00:00 -0500","original":"1/7/2010","granularity":"day","time":"2010/01/07 00:00:00 -0500"},"longitude":119.3156433,"id":"adv9lt54d5qi","location":"WAU: South Coast Highway"},"type":"Feature","geometry":{"type":"Point","coordinates":[119.3156433,-33.8088202]}},{"properties":{"latitude":-33.8627186,"column_5":1,"date":{"end_time":"2010/01/08 00:00:00 -0500","original":"1/7/2010","granularity":"day","time":"2010/01/07 00:00:00 -0500"},"longitude":121.8902206,"id":"adv9lswcepsu","location":"WAU: Esperance"},"type":"Feature","geometry":{"type":"Point","coordinates":[121.8902206,-33.8627186]}},{"properties":{"latitude":-33.7762936,"column_5":1,"date":{"end_time":"2010/01/08 00:00:00 -0500","original":"1/7/2010","granularity":"day","time":"2010/01/07 00:00:00 -0500"},"longitude":121.5242386,"id":"adv9lt57d1y1","location":"Esperance--Lake Gore"},"type":"Feature","geometry":{"type":"Point","coordinates":[121.5242386,-33.7762936]}},{"properties":{"latitude":-32.3602433,"column_5":1,"date":{"end_time":"2010/01/08 00:00:00 -0500","original":"1/7/2010","granularity":"day","time":"2010/01/07 00:00:00 -0500"},"longitude":124.3515015,"id":"adv9lt5vsm91","location":"WAU: Newman Rocks"},"type":"Feature","geometry":{"type":"Point","coordinates":[124.3515015,-32.3602433]}},{"properties":{"latitude":-34.8891124,"column_5":1,"date":{"end_time":"2010/01/09 00:00:00 -0500","original":"1/8/2010","granularity":"day","time":"2010/01/08 00:00:00 -0500"},"longitude":118.3331269,"id":"adv9lt3qphsk","location":"Waychinicup NP"},"type":"Feature","geometry":{"type":"Point","coordinates":[118.3331269,-34.8891124]}},{"properties":{"latitude":-35.0219838,"column_5":1,"date":{"end_time":"2010/01/09 00:00:00 -0500","original":"1/8/2010","granularity":"day","time":"2010/01/08 00:00:00 -0500"},"longitude":117.8831291,"id":"adv9lsww1n44","location":"WAU: Albany"},"type":"Feature","geometry":{"type":"Point","coordinates":[117.8831291,-35.0219838]}},{"properties":{"latitude":-35.0155169,"column_5":1,"date":{"end_time":"2010/01/10 00:00:00 -0500","original":"1/9/2010","granularity":"day","time":"2010/01/09 00:00:00 -0500"},"longitude":117.2181129,"id":"adv9lsvet2fy","location":"William Bay NP"},"type":"Feature","geometry":{"type":"Point","coordinates":[117.2181129,-35.0155169]}},{"properties":{"latitude":-34.884426,"column_5":1,"date":{"end_time":"2010/01/10 00:00:00 -0500","original":"1/9/2010","granularity":"day","time":"2010/01/09 00:00:00 -0500"},"longitude":118.4047222,"id":"adv9lt4i29hv","location":"Cheyne Beach--caravan park &amp; adjacent heath"},"type":"Feature","geometry":{"type":"Point","coordinates":[118.4047222,-34.884426]}},{"properties":{"latitude":-34.9786388,"column_5":1,"date":{"end_time":"2010/01/10 00:00:00 -0500","original":"1/9/2010","granularity":"day","time":"2010/01/09 00:00:00 -0500"},"longitude":116.8935871,"id":"adv9lt0v68ge","location":"Walpole-Nornalup NP--Valley of the Giants"},"type":"Feature","geometry":{"type":"Point","coordinates":[116.8935871,-34.9786388]}},{"properties":{"latitude":-32.7054834,"column_5":1,"date":{"end_time":"2010/01/11 00:00:00 -0500","original":"1/10/2010","granularity":"day","time":"2010/01/10 00:00:00 -0500"},"longitude":115.7136512,"id":"adv9lt3vlypc","location":"Lake McLarty"},"type":"Feature","geometry":{"type":"Point","coordinates":[115.7136512,-32.7054834]}},{"properties":{"latitude":-32.2006002,"column_5":1,"date":{"end_time":"2010/01/11 00:00:00 -0500","original":"1/10/2010","granularity":"day","time":"2010/01/10 00:00:00 -0500"},"longitude":116.0635185,"id":"adv9lt6e4ry4","location":"Wungong Dam"},"type":"Feature","geometry":{"type":"Point","coordinates":[116.0635185,-32.2006002]}},{"properties":{"latitude":-32.7848212,"column_5":1,"date":{"end_time":"2010/01/12 00:00:00 -0500","original":"1/11/2010","granularity":"day","time":"2010/01/11 00:00:00 -0500"},"longitude":116.9726372,"id":"adv9lt2rakgg","location":"Dryandra SF"},"type":"Feature","geometry":{"type":"Point","coordinates":[116.9726372,-32.7848212]}},{"properties":{"latitude":-33.3300621,"column_5":1,"date":{"end_time":"2010/01/13 00:00:00 -0500","original":"1/12/2010","granularity":"day","time":"2010/01/12 00:00:00 -0500"},"longitude":115.6365967,"id":"adv9lswpyao9","location":"WAU: Bunbury"},"type":"Feature","geometry":{"type":"Point","coordinates":[115.6365967,-33.3300621]}},{"properties":{"latitude":-34.3740454,"column_5":1,"date":{"end_time":"2010/01/13 00:00:00 -0500","original":"1/12/2010","granularity":"day","time":"2010/01/12 00:00:00 -0500"},"longitude":115.1355171,"id":"adv9lsu0tmic","location":"Cape Leeuwin Lighthouse"},"type":"Feature","geometry":{"type":"Point","coordinates":[115.1355171,-34.3740454]}},{"properties":{"latitude":-36.8818176,"column_5":1,"date":{"end_time":"2010/01/14 00:00:00 -0500","original":"1/13/2010","granularity":"day","time":"2010/01/13 00:00:00 -0500"},"longitude":174.7842407,"id":"adv9lt26dzyf","location":"NZ: Auckland"},"type":"Feature","geometry":{"type":"Point","coordinates":[174.7842407,-36.8818176]}},{"properties":{"latitude":-36.6049175,"column_5":1,"date":{"end_time":"2010/01/15 00:00:00 -0500","original":"1/14/2010","granularity":"day","time":"2010/01/14 00:00:00 -0500"},"longitude":174.8144531,"id":"adv9lt2b1soq","location":"Shakespeare Regional Park"},"type":"Feature","geometry":{"type":"Point","coordinates":[174.8144531,-36.6049175]}},{"properties":{"latitude":-36.3713,"column_5":1,"date":{"end_time":"2010/01/15 00:00:00 -0500","original":"1/14/2010","granularity":"day","time":"2010/01/14 00:00:00 -0500"},"longitude":174.848,"id":"adv9lt2x1tyn","location":"Tawharanui Regional Park"},"type":"Feature","geometry":{"type":"Point","coordinates":[174.848,-36.3713]}},{"properties":{"latitude":-36.6244831,"column_5":1,"date":{"end_time":"2010/01/15 00:00:00 -0500","original":"1/14/2010","granularity":"day","time":"2010/01/14 00:00:00 -0500"},"longitude":174.7863865,"id":"adv9lstej661","location":"NZ: Gulf Harbor"},"type":"Feature","geometry":{"type":"Point","coordinates":[174.7863865,-36.6244831]}},{"properties":{"latitude":-36.6007143,"column_5":1,"date":{"end_time":"2010/01/15 00:00:00 -0500","original":"1/14/2010","granularity":"day","time":"2010/01/14 00:00:00 -0500"},"longitude":174.89007,"id":"adv9lt1lfj7y","location":"Tiritiri Matangi Island--general"},"type":"Feature","geometry":{"type":"Point","coordinates":[174.89007,-36.6007143]}},{"properties":{"latitude":-36.5452253,"column_5":1,"date":{"end_time":"2010/01/15 00:00:00 -0500","original":"1/14/2010","granularity":"day","time":"2010/01/14 00:00:00 -0500"},"longitude":174.7073364,"id":"adv9lsrmf3fv","location":"NZ: Waiwera"},"type":"Feature","geometry":{"type":"Point","coordinates":[174.7073364,-36.5452253]}},{"properties":{"latitude":-37.8875894,"column_5":1,"date":{"end_time":"2010/01/17 00:00:00 -0500","original":"1/16/2010","granularity":"day","time":"2010/01/16 00:00:00 -0500"},"longitude":176.7585182,"id":"adv9lsxdj7sl","location":"Matata Lagoons"},"type":"Feature","geometry":{"type":"Point","coordinates":[176.7585182,-37.8875894]}},{"properties":{"latitude":-37.1667,"column_5":1,"date":{"end_time":"2010/01/17 00:00:00 -0500","original":"1/16/2010","granularity":"day","time":"2010/01/16 00:00:00 -0500"},"longitude":175.312,"id":"adv9lt35y524","location":"Firth of Thames--Miranda Shorebird Centre"},"type":"Feature","geometry":{"type":"Point","coordinates":[175.312,-37.1667]}},{"properties":{"latitude":-38.0529575,"column_5":1,"date":{"end_time":"2010/01/17 00:00:00 -0500","original":"1/16/2010","granularity":"day","time":"2010/01/16 00:00:00 -0500"},"longitude":176.5887451,"id":"adv9lsuztwpn","location":"Lake Rotoma"},"type":"Feature","geometry":{"type":"Point","coordinates":[176.5887451,-38.0529575]}},{"properties":{"latitude":-38.3933389,"column_5":1,"date":{"end_time":"2010/01/17 00:00:00 -0500","original":"1/16/2010","granularity":"day","time":"2010/01/16 00:00:00 -0500"},"longitude":176.0119629,"id":"adv9lst0pjl5","location":"NZ: Atiamuri"},"type":"Feature","geometry":{"type":"Point","coordinates":[176.0119629,-38.3933389]}},{"properties":{"latitude":-37.7826547,"column_5":1,"date":{"end_time":"2010/01/17 00:00:00 -0500","original":"1/16/2010","granularity":"day","time":"2010/01/16 00:00:00 -0500"},"longitude":176.3209534,"id":"adv9lsr9np2r","location":"NZ: Te Puke"},"type":"Feature","geometry":{"type":"Point","coordinates":[176.3209534,-37.7826547]}},{"properties":{"latitude":-37.6486263,"column_5":1,"date":{"end_time":"2010/01/17 00:00:00 -0500","original":"1/16/2010","granularity":"day","time":"2010/01/16 00:00:00 -0500"},"longitude":175.9819221,"id":"adv9lsz3gk9c","location":"NZ: Apata"},"type":"Feature","geometry":{"type":"Point","coordinates":[175.9819221,-37.6486263]}},{"properties":{"latitude":-39.3225958,"column_5":1,"date":{"end_time":"2010/01/18 00:00:00 -0500","original":"1/17/2010","granularity":"day","time":"2010/01/17 00:00:00 -0500"},"longitude":175.2339506,"id":"adv9lt4tu1js","location":"NZ: Manganui A Te Ao River"},"type":"Feature","geometry":{"type":"Point","coordinates":[175.2339506,-39.3225958]}},{"properties":{"latitude":-41.2571606,"column_5":1,"date":{"end_time":"2010/01/19 00:00:00 -0500","original":"1/18/2010","granularity":"day","time":"2010/01/18 00:00:00 -0500"},"longitude":174.4172735,"id":"adv9lt6gcw4i","location":"Cook Strait--Ferry"},"type":"Feature","geometry":{"type":"Point","coordinates":[174.4172735,-41.2571606]}},{"properties":{"latitude":-41.216667,"column_5":1,"date":{"end_time":"2010/01/19 00:00:00 -0500","original":"1/18/2010","granularity":"day","time":"2010/01/18 00:00:00 -0500"},"longitude":174.169444,"id":"adv9lt68vt25","location":"Queen Charlotte Sound"},"type":"Feature","geometry":{"type":"Point","coordinates":[174.169444,-41.216667]}},{"properties":{"latitude":-45.1223845,"column_5":1,"date":{"end_time":"2010/01/20 00:00:00 -0500","original":"1/19/2010","granularity":"day","time":"2010/01/19 00:00:00 -0500"},"longitude":170.9791088,"id":"adv9lt3ccvca","location":"Bushy Beach Scenic Reserve"},"type":"Feature","geometry":{"type":"Point","coordinates":[170.9791088,-45.1223845]}},{"properties":{"latitude":-44.469444,"column_5":1,"date":{"end_time":"2010/01/24 00:00:00 -0500","original":"1/23/2010","granularity":"day","time":"2010/01/23 00:00:00 -0500"},"longitude":169.988056,"id":"adv9lsz37kex","location":"Ahuriri Bridge Conservation Area"},"type":"Feature","geometry":{"type":"Point","coordinates":[169.988056,-44.469444]}},{"properties":{"latitude":-44.974028,"column_5":1,"date":{"end_time":"2010/01/24 00:00:00 -0500","original":"1/23/2010","granularity":"day","time":"2010/01/23 00:00:00 -0500"},"longitude":169.257431,"id":"adv9lt6vxzvo","location":"Lake Dunstan"},"type":"Feature","geometry":{"type":"Point","coordinates":[169.257431,-44.974028]}},{"properties":{"latitude":-43.734,"column_5":1,"date":{"end_time":"2010/01/25 00:00:00 -0500","original":"1/24/2010","granularity":"day","time":"2010/01/24 00:00:00 -0500"},"longitude":170.0977,"id":"adv9lt75jadf","location":"Aoraki/Mount Cook NP -- Mt Cook Village"},"type":"Feature","geometry":{"type":"Point","coordinates":[170.0977,-43.734]}},{"properties":{"latitude":-41.7518487,"column_5":1,"date":{"end_time":"2010/01/27 00:00:00 -0500","original":"1/26/2010","granularity":"day","time":"2010/01/26 00:00:00 -0500"},"longitude":171.4687729,"id":"adv9lswi6udk","location":"Cape Foulwind"},"type":"Feature","geometry":{"type":"Point","coordinates":[171.4687729,-41.7518487]}},{"properties":{"latitude":-41.1145381,"column_5":1,"date":{"end_time":"2010/01/28 00:00:00 -0500","original":"1/27/2010","granularity":"day","time":"2010/01/27 00:00:00 -0500"},"longitude":173.001709,"id":"adv9lt0m7gv1","location":"NZ: Motueka"},"type":"Feature","geometry":{"type":"Point","coordinates":[173.001709,-41.1145381]}},{"properties":{"latitude":-35.9941535,"column_5":1,"date":{"end_time":"2010/01/30 00:00:00 -0500","original":"1/29/2010","granularity":"day","time":"2010/01/29 00:00:00 -0500"},"longitude":174.4813013,"id":"adv9lt0jsnys","location":"Waipu Wildlife Refuge"},"type":"Feature","geometry":{"type":"Point","coordinates":[174.4813013,-35.9941535]}},{"properties":{"latitude":-35.4418619,"column_5":1,"date":{"end_time":"2010/01/30 00:00:00 -0500","original":"1/29/2010","granularity":"day","time":"2010/01/29 00:00:00 -0500"},"longitude":174.3655372,"id":"adv9lsrkmvz0","location":"Helena Bay"},"type":"Feature","geometry":{"type":"Point","coordinates":[174.3655372,-35.4418619]}},{"properties":{"latitude":-36.3481,"column_5":1,"date":{"end_time":"2010/01/31 00:00:00 -0500","original":"1/30/2010","granularity":"day","time":"2010/01/30 00:00:00 -0500"},"longitude":175.0751,"id":"adv9lt39fyi1","location":"Pelagic into Hauraki Gulf from Sandspit"},"type":"Feature","geometry":{"type":"Point","coordinates":[175.0751,-36.3481]}},{"properties":{"latitude":-35.9055979,"column_5":1,"date":{"end_time":"2010/01/31 00:00:00 -0500","original":"1/30/2010","granularity":"day","time":"2010/01/30 00:00:00 -0500"},"longitude":175.1117706,"id":"adv9lsw6psmn","location":"Mokohinau Islands"},"type":"Feature","geometry":{"type":"Point","coordinates":[175.1117706,-35.9055979]}},{"properties":{"latitude":-42.9186736,"column_5":1,"date":{"end_time":"2010/02/02 00:00:00 -0500","original":"2/1/2010","granularity":"day","time":"2010/02/01 00:00:00 -0500"},"longitude":147.2688317,"id":"adv9lt1je2e1","location":"TAS: Hall's Gap"},"type":"Feature","geometry":{"type":"Point","coordinates":[147.2688317,-42.9186736]}},{"properties":{"latitude":-42.8243652,"column_5":1,"date":{"end_time":"2010/02/02 00:00:00 -0500","original":"2/1/2010","granularity":"day","time":"2010/02/01 00:00:00 -0500"},"longitude":147.5060463,"id":"adv9lsr2t7ob","location":"TAS: Seven Mile Beach area"},"type":"Feature","geometry":{"type":"Point","coordinates":[147.5060463,-42.8243652]}},{"properties":{"latitude":-42.7646267,"column_5":1,"date":{"end_time":"2010/02/03 00:00:00 -0500","original":"2/2/2010","granularity":"day","time":"2010/02/02 00:00:00 -0500"},"longitude":147.2414303,"id":"adv9lt5sobwl","location":"Gould's Lagoon Sanctuary"},"type":"Feature","geometry":{"type":"Point","coordinates":[147.2414303,-42.7646267]}},{"properties":{"latitude":-42.8962772,"column_5":1,"date":{"end_time":"2010/02/03 00:00:00 -0500","original":"2/2/2010","granularity":"day","time":"2010/02/02 00:00:00 -0500"},"longitude":147.2367954,"id":"adv9lswjn0ot","location":"Mt. Wellington"},"type":"Feature","geometry":{"type":"Point","coordinates":[147.2367954,-42.8962772]}},{"properties":{"latitude":-42.1227368,"column_5":1,"date":{"end_time":"2010/02/04 00:00:00 -0500","original":"2/3/2010","granularity":"day","time":"2010/02/03 00:00:00 -0500"},"longitude":148.3423805,"id":"adv9lt45afee","location":"Freycinet NP"},"type":"Feature","geometry":{"type":"Point","coordinates":[148.3423805,-42.1227368]}},{"properties":{"latitude":-42.7931333,"column_5":1,"date":{"end_time":"2010/02/04 00:00:00 -0500","original":"2/3/2010","granularity":"day","time":"2010/02/03 00:00:00 -0500"},"longitude":147.5422668,"id":"adv9lsz934mk","location":"TAS: Sorell"},"type":"Feature","geometry":{"type":"Point","coordinates":[147.5422668,-42.7931333]}},{"properties":{"latitude":-41.1640524,"column_5":1,"date":{"end_time":"2010/02/06 00:00:00 -0500","original":"2/5/2010","granularity":"day","time":"2010/02/05 00:00:00 -0500"},"longitude":146.2506866,"id":"adv9lsqr2wwg","location":"Forth River Estuary"},"type":"Feature","geometry":{"type":"Point","coordinates":[146.2506866,-41.1640524]}},{"properties":{"latitude":-42.1557685,"column_5":1,"date":{"end_time":"2010/02/06 00:00:00 -0500","original":"2/5/2010","granularity":"day","time":"2010/02/05 00:00:00 -0500"},"longitude":145.2890396,"id":"adv9lsv6bspu","location":"Strahan Airfield"},"type":"Feature","geometry":{"type":"Point","coordinates":[145.2890396,-42.1557685]}},{"properties":{"latitude":-41.6504048,"column_5":1,"date":{"end_time":"2010/02/06 00:00:00 -0500","original":"2/5/2010","granularity":"day","time":"2010/02/05 00:00:00 -0500"},"longitude":145.9613514,"id":"adv9lswvxdev","location":"Cradle Mountain NP"},"type":"Feature","geometry":{"type":"Point","coordinates":[145.9613514,-41.6504048]}},{"properties":{"latitude":-42.8651524,"column_5":1,"date":{"end_time":"2010/02/07 00:00:00 -0500","original":"2/6/2010","granularity":"day","time":"2010/02/06 00:00:00 -0500"},"longitude":147.3300719,"id":"adv9lsze2lr0","location":"Tasmanian National Botanical Gardens"},"type":"Feature","geometry":{"type":"Point","coordinates":[147.3300719,-42.8651524]}},{"properties":{"latitude":35.70176,"column_5":1,"date":{"end_time":"2010/02/25 00:00:00 -0500","original":"2/24/2010","granularity":"day","time":"2010/02/24 00:00:00 -0500"},"longitude":-96.8809,"id":"adv9lt58qmy1","location":"Chandler"},"type":"Feature","geometry":{"type":"Point","coordinates":[-96.8809,35.70176]}},{"properties":{"latitude":14.2049,"column_5":1,"date":{"end_time":"2010/03/05 00:00:00 -0500","original":"3/4/2010","granularity":"day","time":"2010/03/04 00:00:00 -0500"},"longitude":-87.1167,"id":"adv9lsynsyjy","location":"Parque Nacional La Tigra"},"type":"Feature","geometry":{"type":"Point","coordinates":[-87.1167,14.2049]}},{"properties":{"latitude":14.5541,"column_5":1,"date":{"end_time":"2010/03/06 00:00:00 -0500","original":"3/5/2010","granularity":"day","time":"2010/03/05 00:00:00 -0500"},"longitude":-86.5682,"id":"adv9lsxpjryh","location":"Campamento Fish Ponds"},"type":"Feature","geometry":{"type":"Point","coordinates":[-86.5682,14.5541]}},{"properties":{"latitude":15.330214,"column_5":1,"date":{"end_time":"2010/03/06 00:00:00 -0500","original":"3/5/2010","granularity":"day","time":"2010/03/05 00:00:00 -0500"},"longitude":-85.3431702,"id":"adv9lsrr58dv","location":"HN: Bonanza (Olancho Province)"},"type":"Feature","geometry":{"type":"Point","coordinates":[-85.3431702,15.330214]}},{"properties":{"latitude":15.3345183,"column_5":1,"date":{"end_time":"2010/03/06 00:00:00 -0500","original":"3/5/2010","granularity":"day","time":"2010/03/05 00:00:00 -0500"},"longitude":-85.4187012,"id":"adv9lsx436rj","location":"HN: Las Marias (Olancho Province)"},"type":"Feature","geometry":{"type":"Point","coordinates":[-85.4187012,15.3345183]}},{"properties":{"latitude":14.4186,"column_5":1,"date":{"end_time":"2010/03/06 00:00:00 -0500","original":"3/5/2010","granularity":"day","time":"2010/03/05 00:00:00 -0500"},"longitude":-87.0819,"id":"adv9lszr0fth","location":"HN: Talanga"},"type":"Feature","geometry":{"type":"Point","coordinates":[-87.0819,14.4186]}},{"properties":{"latitude":14.5900694,"column_5":1,"date":{"end_time":"2010/03/06 00:00:00 -0500","original":"3/5/2010","granularity":"day","time":"2010/03/05 00:00:00 -0500"},"longitude":-85.96426,"id":"adv9lsr0xxvp","location":"Olancho"},"type":"Feature","geometry":{"type":"Point","coordinates":[-85.96426,14.5900694]}},{"properties":{"latitude":15.333525,"column_5":1,"date":{"end_time":"2010/03/07 00:00:00 -0500","original":"3/6/2010","granularity":"day","time":"2010/03/06 00:00:00 -0500"},"longitude":-85.2837753,"id":"adv9lt1w3335","location":"HN: Rio Platano BR--Bonanza to Lancetillal Camp"},"type":"Feature","geometry":{"type":"Point","coordinates":[-85.2837753,15.333525]}},{"properties":{"latitude":15.3917908,"column_5":1,"date":{"end_time":"2010/03/08 00:00:00 -0500","original":"3/7/2010","granularity":"day","time":"2010/03/07 00:00:00 -0500"},"longitude":-85.1933956,"id":"adv9lt4yqj4i","location":"HN: Rio Platano BR--Lancetillal Camp to La Cueva Camp"},"type":"Feature","geometry":{"type":"Point","coordinates":[-85.1933956,15.3917908]}},{"properties":{"latitude":15.3493345,"column_5":1,"date":{"end_time":"2010/03/09 00:00:00 -0500","original":"3/8/2010","granularity":"day","time":"2010/03/08 00:00:00 -0500"},"longitude":-85.2490997,"id":"adv9lsxobmn0","location":"Rio Platano Biosphere Reserve"},"type":"Feature","geometry":{"type":"Point","coordinates":[-85.2490997,15.3493345]}},{"properties":{"latitude":15.4116504,"column_5":1,"date":{"end_time":"2010/03/10 00:00:00 -0500","original":"3/9/2010","granularity":"day","time":"2010/03/09 00:00:00 -0500"},"longitude":-85.1557159,"id":"adv9lsyach9t","location":"HN: Rio Platano BR--La Cueva Camp to Chilmeca Creek Camp"},"type":"Feature","geometry":{"type":"Point","coordinates":[-85.1557159,15.4116504]}},{"properties":{"latitude":15.4351484,"column_5":1,"date":{"end_time":"2010/03/11 00:00:00 -0500","original":"3/10/2010","granularity":"day","time":"2010/03/10 00:00:00 -0500"},"longitude":-85.1093674,"id":"adv9lsr3mmu7","location":"HN: Rio Platano BR--Chilmeca Creek Camp to El Subterraneo Camp"},"type":"Feature","geometry":{"type":"Point","coordinates":[-85.1093674,15.4351484]}},{"properties":{"latitude":15.4914006,"column_5":1,"date":{"end_time":"2010/03/12 00:00:00 -0500","original":"3/11/2010","granularity":"day","time":"2010/03/11 00:00:00 -0500"},"longitude":-84.9607086,"id":"adv9lt6z1nmi","location":"HN: Rio Platano BR--El Subterraneo Camp to Kawakil Camp"},"type":"Feature","geometry":{"type":"Point","coordinates":[-84.9607086,15.4914006]}},{"properties":{"latitude":15.5430067,"column_5":1,"date":{"end_time":"2010/03/13 00:00:00 -0500","original":"3/12/2010","granularity":"day","time":"2010/03/12 00:00:00 -0500"},"longitude":-84.9868011,"id":"adv9lsrxj35j","location":"HN: Rio Platano BR--Kawakil Camp to Cuyamel Camp"},"type":"Feature","geometry":{"type":"Point","coordinates":[-84.9868011,15.5430067]}},{"properties":{"latitude":15.6074962,"column_5":1,"date":{"end_time":"2010/03/14 00:00:00 -0500","original":"3/13/2010","granularity":"day","time":"2010/03/13 00:00:00 -0500"},"longitude":-84.9253464,"id":"adv9lt3pm9j7","location":"HN: Rio Platano BR--Cuyamel Camp to Las Marias"},"type":"Feature","geometry":{"type":"Point","coordinates":[-84.9253464,15.6074962]}},{"properties":{"latitude":15.7783778,"column_5":1,"date":{"end_time":"2010/03/15 00:00:00 -0400","original":"3/14/2010","granularity":"day","time":"2010/03/14 00:00:00 -0500"},"longitude":-84.754715,"id":"adv9lsxuoyw3","location":"HN: Las Marias--village to the coast"},"type":"Feature","geometry":{"type":"Point","coordinates":[-84.754715,15.7783778]}},{"properties":{"latitude":15.417339,"column_5":1,"date":{"end_time":"2010/03/17 00:00:00 -0400","original":"3/16/2010","granularity":"day","time":"2010/03/16 00:00:00 -0400"},"longitude":-87.8158343,"id":"adv9lsxxcjtk","location":"El Progresso Sewage Ponds"},"type":"Feature","geometry":{"type":"Point","coordinates":[-87.8158343,15.417339]}},{"properties":{"latitude":15.4901289,"column_5":1,"date":{"end_time":"2010/03/17 00:00:00 -0400","original":"3/16/2010","granularity":"day","time":"2010/03/16 00:00:00 -0400"},"longitude":-87.9829788,"id":"adv9lt23sdv6","location":"HN: San Pedro Sula--Metrotel Hotel"},"type":"Feature","geometry":{"type":"Point","coordinates":[-87.9829788,15.4901289]}},{"properties":{"latitude":15.4531839,"column_5":1,"date":{"end_time":"2010/03/18 00:00:00 -0400","original":"3/17/2010","granularity":"day","time":"2010/03/17 00:00:00 -0400"},"longitude":-87.9251289,"id":"adv9lsqyiuqs","location":"HN: San Pedro Sula International Airport"},"type":"Feature","geometry":{"type":"Point","coordinates":[-87.9251289,15.4531839]}},{"properties":{"latitude":39.37065,"column_5":1,"date":{"end_time":"2010/04/01 00:00:00 -0400","original":"3/31/2010","granularity":"day","time":"2010/03/31 00:00:00 -0400"},"longitude":-90.90513,"id":"adv9lt70edlv","location":"Clarksville"},"type":"Feature","geometry":{"type":"Point","coordinates":[-90.90513,39.37065]}},{"properties":{"latitude":35.2501716,"column_5":1,"date":{"end_time":"2010/04/02 00:00:00 -0400","original":"4/1/2010","granularity":"day","time":"2010/04/01 00:00:00 -0400"},"longitude":-91.5827289,"id":"adv9lt1uxcq1","location":"Bald Knob NWR"},"type":"Feature","geometry":{"type":"Point","coordinates":[-91.5827289,35.2501716]}},{"properties":{"latitude":34.74649,"column_5":1,"date":{"end_time":"2010/04/02 00:00:00 -0400","original":"4/1/2010","granularity":"day","time":"2010/04/01 00:00:00 -0400"},"longitude":-92.28955,"id":"adv9lt1c7svf","location":"Little Rock"},"type":"Feature","geometry":{"type":"Point","coordinates":[-92.28955,34.74649]}},{"properties":{"latitude":33.7045,"column_5":1,"date":{"end_time":"2010/04/03 00:00:00 -0400","original":"4/2/2010","granularity":"day","time":"2010/04/02 00:00:00 -0400"},"longitude":-93.9385,"id":"adv9lstc3uq9","location":"Millwood Lake--Beard's Bluff Recreation Area"},"type":"Feature","geometry":{"type":"Point","coordinates":[-93.9385,33.7045]}},{"properties":{"latitude":30.5304296,"column_5":1,"date":{"end_time":"2010/04/03 00:00:00 -0400","original":"4/2/2010","granularity":"day","time":"2010/04/02 00:00:00 -0400"},"longitude":-95.5756259,"id":"adv9lt5y3j3q","location":"TX: Sam Houston NF--R-c Woodpecker Viewing Area"},"type":"Feature","geometry":{"type":"Point","coordinates":[-95.5756259,30.5304296]}},{"properties":{"latitude":27.5159092,"column_5":1,"date":{"end_time":"2010/04/04 00:00:00 -0400","original":"4/3/2010","granularity":"day","time":"2010/04/03 00:00:00 -0400"},"longitude":-97.8560791,"id":"adv9lsr5q3ey","location":"Kingsville"},"type":"Feature","geometry":{"type":"Point","coordinates":[-97.8560791,27.5159092]}},{"properties":{"latitude":29.7633305,"column_5":1,"date":{"end_time":"2010/04/04 00:00:00 -0400","original":"4/3/2010","granularity":"day","time":"2010/04/03 00:00:00 -0400"},"longitude":-95.3633194,"id":"adv9lsrmz4yi","location":"Houston"},"type":"Feature","geometry":{"type":"Point","coordinates":[-95.3633194,29.7633305]}},{"properties":{"latitude":28.03669,"column_5":1,"date":{"end_time":"2010/04/04 00:00:00 -0400","original":"4/3/2010","granularity":"day","time":"2010/04/03 00:00:00 -0400"},"longitude":-97.50917,"id":"adv9lt2u755j","location":"Sinton"},"type":"Feature","geometry":{"type":"Point","coordinates":[-97.50917,28.03669]}},{"properties":{"latitude":26.2126082,"column_5":1,"date":{"end_time":"2010/04/05 00:00:00 -0400","original":"4/4/2010","granularity":"day","time":"2010/04/04 00:00:00 -0400"},"longitude":-97.6890993,"id":"adv9lt4pv4jj","location":"TX: Harlingen--7th Street and Rio Hondo"},"type":"Feature","geometry":{"type":"Point","coordinates":[-97.6890993,26.2126082]}},{"properties":{"latitude":26.1260304,"column_5":1,"date":{"end_time":"2010/04/06 00:00:00 -0400","original":"4/5/2010","granularity":"day","time":"2010/04/05 00:00:00 -0400"},"longitude":-97.9559173,"id":"adv9lsvr4kfp","location":"Estero Llano Grande SP WBC (LTC 054)"},"type":"Feature","geometry":{"type":"Point","coordinates":[-97.9559173,26.1260304]}},{"properties":{"latitude":26.5148584,"column_5":1,"date":{"end_time":"2010/04/08 00:00:00 -0400","original":"4/7/2010","granularity":"day","time":"2010/04/07 00:00:00 -0400"},"longitude":-99.1162062,"id":"adv9lsxdlpgf","location":"Salineo (LTC 080)"},"type":"Feature","geometry":{"type":"Point","coordinates":[-99.1162062,26.5148584]}},{"properties":{"latitude":26.513,"column_5":1,"date":{"end_time":"2010/04/08 00:00:00 -0400","original":"4/7/2010","granularity":"day","time":"2010/04/07 00:00:00 -0400"},"longitude":-99.131,"id":"adv9lszzqpfc","location":"La Gloria, Tamps. (across from Salineo, TX)"},"type":"Feature","geometry":{"type":"Point","coordinates":[-99.131,26.513]}},{"properties":{"latitude":29.1809226,"column_5":1,"date":{"end_time":"2010/04/09 00:00:00 -0400","original":"4/8/2010","granularity":"day","time":"2010/04/08 00:00:00 -0400"},"longitude":-102.9557133,"id":"adv9lsty6zki","location":"Big Bend NP--Rio Grande Village (FWTX 44)"},"type":"Feature","geometry":{"type":"Point","coordinates":[-102.9557133,29.1809226]}},{"properties":{"latitude":29.1879477,"column_5":1,"date":{"end_time":"2010/04/09 00:00:00 -0400","original":"4/8/2010","granularity":"day","time":"2010/04/08 00:00:00 -0400"},"longitude":-102.9350924,"id":"adv9lt4b3ypm","location":"COA: Boquillas del Carmen"},"type":"Feature","geometry":{"type":"Point","coordinates":[-102.9350924,29.1879477]}},{"properties":{"latitude":31.7134193,"column_5":1,"date":{"end_time":"2010/04/15 00:00:00 -0400","original":"4/14/2010","granularity":"day","time":"2010/04/14 00:00:00 -0400"},"longitude":-110.7869911,"id":"adv9lszzk57o","location":"Cave Canyon"},"type":"Feature","geometry":{"type":"Point","coordinates":[-110.7869911,31.7134193]}},{"properties":{"latitude":31.9735298,"column_5":1,"date":{"end_time":"2010/04/17 00:00:00 -0400","original":"4/16/2010","granularity":"day","time":"2010/04/16 00:00:00 -0400"},"longitude":-110.7965988,"id":"adv9lt2ohpfy","location":"Corona de Tucson WTP"},"type":"Feature","geometry":{"type":"Point","coordinates":[-110.7965988,31.9735298]}},{"properties":{"latitude":32.374833,"column_5":1,"date":{"end_time":"2010/04/19 00:00:00 -0400","original":"4/18/2010","granularity":"day","time":"2010/04/18 00:00:00 -0400"},"longitude":-110.949651,"id":"adv9lsxxb43w","location":"Pusch Peak Trail"},"type":"Feature","geometry":{"type":"Point","coordinates":[-110.949651,32.374833]}},{"properties":{"latitude":38.2544,"column_5":1,"date":{"end_time":"2010/05/06 00:00:00 -0400","original":"5/5/2010","granularity":"day","time":"2010/05/05 00:00:00 -0400"},"longitude":-104.60953,"id":"adv9lt403i7y","location":"Pueblo"},"type":"Feature","geometry":{"type":"Point","coordinates":[-104.60953,38.2544]}},{"properties":{"latitude":43.594,"column_5":1,"date":{"end_time":"2010/05/15 00:00:00 -0400","original":"5/14/2010","granularity":"day","time":"2010/05/14 00:00:00 -0400"},"longitude":-103.461,"id":"adv9lsuz48x2","location":"Wind Cave NP"},"type":"Feature","geometry":{"type":"Point","coordinates":[-103.461,43.594]}},{"properties":{"latitude":46.1907642,"column_5":1,"date":{"end_time":"2010/05/16 00:00:00 -0400","original":"5/15/2010","granularity":"day","time":"2010/05/15 00:00:00 -0400"},"longitude":-112.7748299,"id":"adv9lstmabzr","location":"Warm Springs WMA"},"type":"Feature","geometry":{"type":"Point","coordinates":[-112.7748299,46.1907642]}},{"properties":{"latitude":48.6006791,"column_5":1,"date":{"end_time":"2010/05/17 00:00:00 -0400","original":"5/16/2010","granularity":"day","time":"2010/05/16 00:00:00 -0400"},"longitude":-114.1632271,"id":"adv9lt75uyot","location":"MT: Flathead NF--Big Creek Campground"},"type":"Feature","geometry":{"type":"Point","coordinates":[-114.1632271,48.6006791]}},{"properties":{"latitude":48.6798541,"column_5":1,"date":{"end_time":"2010/05/18 00:00:00 -0400","original":"5/17/2010","granularity":"day","time":"2010/05/17 00:00:00 -0400"},"longitude":-114.9070358,"id":"adv9lst6et95","location":"Kootenai NF--Dickey Lake"},"type":"Feature","geometry":{"type":"Point","coordinates":[-114.9070358,48.6798541]}},{"properties":{"latitude":48.9568899,"column_5":1,"date":{"end_time":"2010/05/19 00:00:00 -0400","original":"5/18/2010","granularity":"day","time":"2010/05/18 00:00:00 -0400"},"longitude":-115.6447506,"id":"adv9lsuchusf","location":"MT: Kootenai NF--Yaak River Valley"},"type":"Feature","geometry":{"type":"Point","coordinates":[-115.6447506,48.9568899]}},{"properties":{"latitude":48.4700191,"column_5":1,"date":{"end_time":"2010/05/20 00:00:00 -0400","original":"5/19/2010","granularity":"day","time":"2010/05/19 00:00:00 -0400"},"longitude":-116.9560719,"id":"adv9lt6uvnmw","location":"ID: Kaniksu NF--Priest Lake area"},"type":"Feature","geometry":{"type":"Point","coordinates":[-116.9560719,48.4700191]}},{"properties":{"latitude":47.0111621,"column_5":1,"date":{"end_time":"2010/05/30 00:00:00 -0400","original":"5/29/2010","granularity":"day","time":"2010/05/29 00:00:00 -0400"},"longitude":-116.632576,"id":"adv9lt17qb8n","location":"ID: St. Joe NF--Strychnine Creek area"},"type":"Feature","geometry":{"type":"Point","coordinates":[-116.632576,47.0111621]}},{"properties":{"latitude":46.8409374,"column_5":1,"date":{"end_time":"2010/06/01 00:00:00 -0400","original":"5/31/2010","granularity":"day","time":"2010/05/31 00:00:00 -0400"},"longitude":-115.6194305,"id":"adv9lsysny5i","location":"ID: Clearwater NF--North Fork Clearwater River area"},"type":"Feature","geometry":{"type":"Point","coordinates":[-115.6194305,46.8409374]}},{"properties":{"latitude":46.375833,"column_5":1,"date":{"end_time":"2010/06/02 00:00:00 -0400","original":"6/1/2010","granularity":"day","time":"2010/06/01 00:00:00 -0400"},"longitude":-115.9397507,"id":"adv9lt0q9ve5","location":"ID: Weippe"},"type":"Feature","geometry":{"type":"Point","coordinates":[-115.9397507,46.375833]}},{"properties":{"latitude":47.2498731,"column_5":1,"date":{"end_time":"2010/06/04 00:00:00 -0400","original":"6/3/2010","granularity":"day","time":"2010/06/03 00:00:00 -0400"},"longitude":-115.798645,"id":"adv9lsthjwy1","location":"ID: St. Joe NF--St. Joe River area"},"type":"Feature","geometry":{"type":"Point","coordinates":[-115.798645,47.2498731]}},{"properties":{"latitude":49.23183,"column_5":1,"date":{"end_time":"2010/06/08 00:00:00 -0400","original":"6/7/2010","granularity":"day","time":"2010/06/07 00:00:00 -0400"},"longitude":-116.63524,"id":"adv9lswe2hix","location":"Creston - Duck Lake"},"type":"Feature","geometry":{"type":"Point","coordinates":[-116.63524,49.23183]}},{"properties":{"latitude":49.0619445,"column_5":1,"date":{"end_time":"2010/06/08 00:00:00 -0400","original":"6/7/2010","granularity":"day","time":"2010/06/07 00:00:00 -0400"},"longitude":-117.0389843,"id":"adv9lsywhyaa","location":"Stagleap Provincial Park"},"type":"Feature","geometry":{"type":"Point","coordinates":[-117.0389843,49.0619445]}},{"properties":{"latitude":48.9975643,"column_5":1,"date":{"end_time":"2010/06/09 00:00:00 -0400","original":"6/8/2010","granularity":"day","time":"2010/06/08 00:00:00 -0400"},"longitude":-116.5518093,"id":"adv9lsznz89z","location":"Boundary Creek WMA"},"type":"Feature","geometry":{"type":"Point","coordinates":[-116.5518093,48.9975643]}},{"properties":{"latitude":49.1197222,"column_5":1,"date":{"end_time":"2010/06/09 00:00:00 -0400","original":"6/8/2010","granularity":"day","time":"2010/06/08 00:00:00 -0400"},"longitude":-116.6313889,"id":"adv9lsrosa3a","location":"Creston Valley Wildlife Centre"},"type":"Feature","geometry":{"type":"Point","coordinates":[-116.6313889,49.1197222]}},{"properties":{"latitude":49.2578344,"column_5":1,"date":{"end_time":"2010/06/09 00:00:00 -0400","original":"6/8/2010","granularity":"day","time":"2010/06/08 00:00:00 -0400"},"longitude":-116.6613722,"id":"adv9lt3oggam","location":"Creston--south end of Kootenay Lake"},"type":"Feature","geometry":{"type":"Point","coordinates":[-116.6613722,49.2578344]}},{"properties":{"latitude":49.1358099,"column_5":1,"date":{"end_time":"2010/06/09 00:00:00 -0400","original":"6/8/2010","granularity":"day","time":"2010/06/08 00:00:00 -0400"},"longitude":-116.794914,"id":"adv9lsxhjrv0","location":"BC: Hwy. 3--Blaze Creek Rest Area"},"type":"Feature","geometry":{"type":"Point","coordinates":[-116.794914,49.1358099]}},{"properties":{"latitude":48.8303171,"column_5":1,"date":{"end_time":"2010/06/16 00:00:00 -0400","original":"6/15/2010","granularity":"day","time":"2010/06/15 00:00:00 -0400"},"longitude":-115.7664156,"id":"adv9lsul5ybv","location":"MT: Kootenai NF--Pete Creek area"},"type":"Feature","geometry":{"type":"Point","coordinates":[-115.7664156,48.8303171]}},{"properties":{"latitude":46.5404253,"column_5":1,"date":{"end_time":"2010/07/01 00:00:00 -0400","original":"6/30/2010","granularity":"day","time":"2010/06/30 00:00:00 -0400"},"longitude":-114.0935417,"id":"adv9lt4k9lg0","location":"Lee Metcalf NWR"},"type":"Feature","geometry":{"type":"Point","coordinates":[-114.0935417,46.5404253]}},{"properties":{"latitude":46.1841091,"column_5":1,"date":{"end_time":"2010/07/06 00:00:00 -0400","original":"7/5/2010","granularity":"day","time":"2010/07/05 00:00:00 -0400"},"longitude":-113.2803726,"id":"adv9lsvi0u31","location":"Beaverhead NF--Georgetown Lake"},"type":"Feature","geometry":{"type":"Point","coordinates":[-113.2803726,46.1841091]}},{"properties":{"latitude":45.5442304,"column_5":1,"date":{"end_time":"2010/07/10 00:00:00 -0400","original":"7/9/2010","granularity":"day","time":"2010/07/09 00:00:00 -0400"},"longitude":-113.0827904,"id":"adv9lt3u8xap","location":"MT: Beaverhead NF--Wise River area"},"type":"Feature","geometry":{"type":"Point","coordinates":[-113.0827904,45.5442304]}},{"properties":{"latitude":44.8536784,"column_5":1,"date":{"end_time":"2010/07/14 00:00:00 -0400","original":"7/13/2010","granularity":"day","time":"2010/07/13 00:00:00 -0400"},"longitude":-111.3733864,"id":"adv9lstufgav","location":"MT: Gallatin NF--Earthquake Lake"},"type":"Feature","geometry":{"type":"Point","coordinates":[-111.3733864,44.8536784]}},{"properties":{"latitude":42.83306,"column_5":1,"date":{"end_time":"2010/07/15 00:00:00 -0400","original":"7/14/2010","granularity":"day","time":"2010/07/14 00:00:00 -0400"},"longitude":-108.73067,"id":"adv9lsyras1s","location":"Lander"},"type":"Feature","geometry":{"type":"Point","coordinates":[-108.73067,42.83306]}},{"properties":{"latitude":40.077887,"column_5":1,"date":{"end_time":"2010/07/20 00:00:00 -0400","original":"7/19/2010","granularity":"day","time":"2010/07/19 00:00:00 -0400"},"longitude":-105.57454,"id":"adv9lt4hpcr5","location":"Brainard Lake"},"type":"Feature","geometry":{"type":"Point","coordinates":[-105.57454,40.077887]}},{"properties":{"latitude":40.0738681,"column_5":1,"date":{"end_time":"2010/07/20 00:00:00 -0400","original":"7/19/2010","granularity":"day","time":"2010/07/19 00:00:00 -0400"},"longitude":-105.4165649,"id":"adv9lt0b8j3p","location":"CO: Boulder--Left Hand Canyon"},"type":"Feature","geometry":{"type":"Point","coordinates":[-105.4165649,40.0738681]}},{"properties":{"latitude":29.3754438,"column_5":1,"date":{"end_time":"2010/08/02 00:00:00 -0400","original":"8/1/2010","granularity":"day","time":"2010/08/01 00:00:00 -0400"},"longitude":-107.7260971,"id":"adv9lt47s351","location":"CHIH: Gomez Farias"},"type":"Feature","geometry":{"type":"Point","coordinates":[-107.7260971,29.3754438]}},{"properties":{"latitude":30.8895567,"column_5":1,"date":{"end_time":"2010/08/02 00:00:00 -0400","original":"8/1/2010","granularity":"day","time":"2010/08/01 00:00:00 -0400"},"longitude":-108.1909561,"id":"adv9lt1jq9wq","location":"CHIH: Janos"},"type":"Feature","geometry":{"type":"Point","coordinates":[-108.1909561,30.8895567]}},{"properties":{"latitude":29.3294444,"column_5":1,"date":{"end_time":"2010/08/02 00:00:00 -0400","original":"8/1/2010","granularity":"day","time":"2010/08/01 00:00:00 -0400"},"longitude":-108.1852778,"id":"adv9lswbn7xa","location":"Chihuahua--Ejido Grande, Cinco Millas"},"type":"Feature","geometry":{"type":"Point","coordinates":[-108.1852778,29.3294444]}},{"properties":{"latitude":29.1905328,"column_5":1,"date":{"end_time":"2010/08/03 00:00:00 -0400","original":"8/2/2010","granularity":"day","time":"2010/08/02 00:00:00 -0400"},"longitude":-108.1432343,"id":"adv9lsud3bzz","location":"CHIH: Madera"},"type":"Feature","geometry":{"type":"Point","coordinates":[-108.1432343,29.1905328]}},{"properties":{"latitude":25.2993376,"column_5":1,"date":{"end_time":"2010/08/03 00:00:00 -0400","original":"8/2/2010","granularity":"day","time":"2010/08/02 00:00:00 -0400"},"longitude":-104.645462,"id":"adv9lsrnz7zp","location":"DGO: Abasolo"},"type":"Feature","geometry":{"type":"Point","coordinates":[-104.645462,25.2993376]}},{"properties":{"latitude":23.7776476,"column_5":1,"date":{"end_time":"2010/08/03 00:00:00 -0400","original":"8/2/2010","granularity":"day","time":"2010/08/02 00:00:00 -0400"},"longitude":-105.3626633,"id":"adv9lssjosnq","location":"DGO: El Salto"},"type":"Feature","geometry":{"type":"Point","coordinates":[-105.3626633,23.7776476]}},{"properties":{"latitude":28.69645,"column_5":1,"date":{"end_time":"2010/08/03 00:00:00 -0400","original":"8/2/2010","granularity":"day","time":"2010/08/02 00:00:00 -0400"},"longitude":-106.21827,"id":"adv9lsuox4qj","location":"Chihuahua"},"type":"Feature","geometry":{"type":"Point","coordinates":[-106.21827,28.69645]}},{"properties":{"latitude":23.4426411,"column_5":1,"date":{"end_time":"2010/08/04 00:00:00 -0400","original":"8/3/2010","granularity":"day","time":"2010/08/03 00:00:00 -0400"},"longitude":-105.8331066,"id":"adv9lt5xd6o9","location":"La Petaca Rd."},"type":"Feature","geometry":{"type":"Point","coordinates":[-105.8331066,23.4426411]}},{"properties":{"latitude":23.5720337,"column_5":1,"date":{"end_time":"2010/08/04 00:00:00 -0400","original":"8/3/2010","granularity":"day","time":"2010/08/03 00:00:00 -0400"},"longitude":-105.8511961,"id":"adv9lt392jbj","location":"Barranca Rancho Liebre"},"type":"Feature","geometry":{"type":"Point","coordinates":[-105.8511961,23.5720337]}},{"properties":{"latitude":23.6530155,"column_5":1,"date":{"end_time":"2010/08/04 00:00:00 -0400","original":"8/3/2010","granularity":"day","time":"2010/08/03 00:00:00 -0400"},"longitude":-105.7767105,"id":"adv9lt55u5vy","location":"DGO: Durango Hwy"},"type":"Feature","geometry":{"type":"Point","coordinates":[-105.7767105,23.6530155]}},{"properties":{"latitude":21.5850572,"column_5":1,"date":{"end_time":"2010/08/05 00:00:00 -0400","original":"8/4/2010","granularity":"day","time":"2010/08/04 00:00:00 -0400"},"longitude":-105.2903938,"id":"adv9lss4uxut","location":"NAY: San Blas--Shrimp Ponds Rd."},"type":"Feature","geometry":{"type":"Point","coordinates":[-105.2903938,21.5850572]}},{"properties":{"latitude":23.3604981,"column_5":1,"date":{"end_time":"2010/08/05 00:00:00 -0400","original":"8/4/2010","granularity":"day","time":"2010/08/04 00:00:00 -0400"},"longitude":-105.9606886,"id":"adv9lt5c7top","location":"SIN: Durango Hwy--KM 265"},"type":"Feature","geometry":{"type":"Point","coordinates":[-105.9606886,23.3604981]}},{"properties":{"latitude":21.88036,"column_5":1,"date":{"end_time":"2010/08/05 00:00:00 -0400","original":"8/4/2010","granularity":"day","time":"2010/08/04 00:00:00 -0400"},"longitude":-105.2962,"id":"adv9lsxpg4m8","location":"Nayarit"},"type":"Feature","geometry":{"type":"Point","coordinates":[-105.2962,21.88036]}},{"properties":{"latitude":23.4019705,"column_5":1,"date":{"end_time":"2010/08/05 00:00:00 -0400","original":"8/4/2010","granularity":"day","time":"2010/08/04 00:00:00 -0400"},"longitude":-105.9368853,"id":"adv9lt5hzfsr","location":"Copala/Panuco Road"},"type":"Feature","geometry":{"type":"Point","coordinates":[-105.9368853,23.4019705]}},{"properties":{"latitude":23.2272284,"column_5":1,"date":{"end_time":"2010/08/05 00:00:00 -0400","original":"8/4/2010","granularity":"day","time":"2010/08/04 00:00:00 -0400"},"longitude":-106.1394632,"id":"adv9lsvwgm3b","location":"Pantitlan Road area"},"type":"Feature","geometry":{"type":"Point","coordinates":[-106.1394632,23.2272284]}},{"properties":{"latitude":21.5337126,"column_5":1,"date":{"end_time":"2010/08/06 00:00:00 -0400","original":"8/5/2010","granularity":"day","time":"2010/08/05 00:00:00 -0400"},"longitude":-105.2530539,"id":"adv9lsv2kbme","location":"San Blas--La Tovara boat trip"},"type":"Feature","geometry":{"type":"Point","coordinates":[-105.2530539,21.5337126]}},{"properties":{"latitude":21.5807872,"column_5":1,"date":{"end_time":"2010/08/06 00:00:00 -0400","original":"8/5/2010","granularity":"day","time":"2010/08/05 00:00:00 -0400"},"longitude":-105.2405584,"id":"adv9lt5sswsf","location":"San Blas--Singayta Road"},"type":"Feature","geometry":{"type":"Point","coordinates":[-105.2405584,21.5807872]}},{"properties":{"latitude":21.5324718,"column_5":1,"date":{"end_time":"2010/08/07 00:00:00 -0400","original":"8/6/2010","granularity":"day","time":"2010/08/06 00:00:00 -0400"},"longitude":-105.2716398,"id":"adv9lt3eob71","location":"San Blas--WTP Road"},"type":"Feature","geometry":{"type":"Point","coordinates":[-105.2716398,21.5324718]}},{"properties":{"latitude":21.5065213,"column_5":1,"date":{"end_time":"2010/08/07 00:00:00 -0400","original":"8/6/2010","granularity":"day","time":"2010/08/06 00:00:00 -0400"},"longitude":-105.1516968,"id":"adv9lt0qvfu6","location":"La Bajada"},"type":"Feature","geometry":{"type":"Point","coordinates":[-105.1516968,21.5065213]}},{"properties":{"latitude":21.4255859,"column_5":1,"date":{"end_time":"2010/08/07 00:00:00 -0400","original":"8/6/2010","granularity":"day","time":"2010/08/06 00:00:00 -0400"},"longitude":-105.1855087,"id":"adv9lsvfos77","location":"NAY: Santa Cruz"},"type":"Feature","geometry":{"type":"Point","coordinates":[-105.1855087,21.4255859]}},{"properties":{"latitude":19.1562984,"column_5":1,"date":{"end_time":"2010/08/08 00:00:00 -0400","original":"8/7/2010","granularity":"day","time":"2010/08/07 00:00:00 -0400"},"longitude":-104.5590188,"id":"adv9lstgt8pm","location":"Manzanillo Airport Marshes"},"type":"Feature","geometry":{"type":"Point","coordinates":[-104.5590188,19.1562984]}},{"properties":{"latitude":19.3409374,"column_5":1,"date":{"end_time":"2010/08/08 00:00:00 -0400","original":"8/7/2010","granularity":"day","time":"2010/08/07 00:00:00 -0400"},"longitude":-104.7292166,"id":"adv9lt0i6lf8","location":"Barranca El Choncho"},"type":"Feature","geometry":{"type":"Point","coordinates":[-104.7292166,19.3409374]}},{"properties":{"latitude":19.180818,"column_5":1,"date":{"end_time":"2010/08/08 00:00:00 -0400","original":"8/7/2010","granularity":"day","time":"2010/08/07 00:00:00 -0400"},"longitude":-103.6915684,"id":"adv9lt50kl09","location":"Microondas La Cumbre (cumbre/top)"},"type":"Feature","geometry":{"type":"Point","coordinates":[-103.6915684,19.180818]}},{"properties":{"latitude":20.08488,"column_5":1,"date":{"end_time":"2010/08/09 00:00:00 -0400","original":"8/8/2010","granularity":"day","time":"2010/08/08 00:00:00 -0400"},"longitude":-103.51127,"id":"adv9lt6mpfzn","location":"Laguna Sayula"},"type":"Feature","geometry":{"type":"Point","coordinates":[-103.51127,20.08488]}},{"properties":{"latitude":19.43197,"column_5":1,"date":{"end_time":"2010/08/09 00:00:00 -0400","original":"8/8/2010","granularity":"day","time":"2010/08/08 00:00:00 -0400"},"longitude":-103.69822,"id":"adv9lt2dqtkh","location":"El Jacal de San Antonio"},"type":"Feature","geometry":{"type":"Point","coordinates":[-103.69822,19.43197]}},{"properties":{"latitude":19.5342207,"column_5":1,"date":{"end_time":"2010/08/09 00:00:00 -0400","original":"8/8/2010","granularity":"day","time":"2010/08/08 00:00:00 -0400"},"longitude":-103.5405421,"id":"adv9lt4fbz56","location":"JAL: Volcan de Fuego"},"type":"Feature","geometry":{"type":"Point","coordinates":[-103.5405421,19.5342207]}},{"properties":{"latitude":19.3269379,"column_5":1,"date":{"end_time":"2010/08/09 00:00:00 -0400","original":"8/8/2010","granularity":"day","time":"2010/08/08 00:00:00 -0400"},"longitude":-103.7559128,"id":"adv9lszwhz9v","location":"COL: Comala"},"type":"Feature","geometry":{"type":"Point","coordinates":[-103.7559128,19.3269379]}},{"properties":{"latitude":23.1933872,"column_5":1,"date":{"end_time":"2010/08/10 00:00:00 -0400","original":"8/9/2010","granularity":"day","time":"2010/08/09 00:00:00 -0400"},"longitude":-102.8347778,"id":"adv9lt14ecgn","location":"ZAC: Fresnillo"},"type":"Feature","geometry":{"type":"Point","coordinates":[-102.8347778,23.1933872]}},{"properties":{"latitude":46.541034,"column_5":1,"date":{"end_time":"2010/08/27 00:00:00 -0400","original":"8/26/2010","granularity":"day","time":"2010/08/26 00:00:00 -0400"},"longitude":-85.0408959,"id":"adv9lt3btn3q","location":"Tahquamenon--Lone Pine Rd"},"type":"Feature","geometry":{"type":"Point","coordinates":[-85.0408959,46.541034]}},{"properties":{"latitude":43.90062,"column_5":1,"date":{"end_time":"2010/11/19 00:00:00 -0500","original":"11/18/2010","granularity":"day","time":"2010/11/18 00:00:00 -0500"},"longitude":-85.25814,"id":"adv9lt6439nf","location":"Evart"},"type":"Feature","geometry":{"type":"Point","coordinates":[-85.25814,43.90062]}},{"properties":{"latitude":51.4716267,"column_5":1,"date":{"end_time":"2010/11/27 00:00:00 -0500","original":"11/26/2010","granularity":"day","time":"2010/11/26 00:00:00 -0500"},"longitude":-0.4878616,"id":"adv9lsz160x9","location":"GB: London-Heathrow International Airport"},"type":"Feature","geometry":{"type":"Point","coordinates":[-0.4878616,51.4716267]}},{"properties":{"latitude":-26.139104,"column_5":1,"date":{"end_time":"2010/11/28 00:00:00 -0500","original":"11/27/2010","granularity":"day","time":"2010/11/27 00:00:00 -0500"},"longitude":28.2456779,"id":"adv9lszax7z1","location":"ZA: OR Tambo International Airport"},"type":"Feature","geometry":{"type":"Point","coordinates":[28.2456779,-26.139104]}},{"properties":{"latitude":-18.8025619,"column_5":1,"date":{"end_time":"2010/11/30 00:00:00 -0500","original":"11/29/2010","granularity":"day","time":"2010/11/29 00:00:00 -0500"},"longitude":48.4275627,"id":"adv9lsvh8rae","location":"Mantadia NP"},"type":"Feature","geometry":{"type":"Point","coordinates":[48.4275627,-18.8025619]}},{"properties":{"latitude":-20.9926951,"column_5":1,"date":{"end_time":"2010/12/01 00:00:00 -0500","original":"11/30/2010","granularity":"day","time":"2010/11/30 00:00:00 -0500"},"longitude":47.1460247,"id":"adv9lsvcdyde","location":"MG: Vohiposa"},"type":"Feature","geometry":{"type":"Point","coordinates":[47.1460247,-20.9926951]}},{"properties":{"latitude":-22.5572693,"column_5":1,"date":{"end_time":"2010/12/03 00:00:00 -0500","original":"12/2/2010","granularity":"day","time":"2010/12/02 00:00:00 -0500"},"longitude":45.4137039,"id":"adv9lt4bv0az","location":"MG: Ranohira"},"type":"Feature","geometry":{"type":"Point","coordinates":[45.4137039,-22.5572693]}},{"properties":{"latitude":-22.4809959,"column_5":1,"date":{"end_time":"2010/12/04 00:00:00 -0500","original":"12/3/2010","granularity":"day","time":"2010/12/03 00:00:00 -0500"},"longitude":45.3330231,"id":"adv9lsxyba1x","location":"Isalo NP"},"type":"Feature","geometry":{"type":"Point","coordinates":[45.3330231,-22.4809959]}},{"properties":{"latitude":-16.9471265,"column_5":1,"date":{"end_time":"2010/12/09 00:00:00 -0500","original":"12/8/2010","granularity":"day","time":"2010/12/08 00:00:00 -0500"},"longitude":46.8309402,"id":"adv9lsugp8ku","location":"MG: Maevatanana"},"type":"Feature","geometry":{"type":"Point","coordinates":[46.8309402,-16.9471265]}},{"properties":{"latitude":-16.3656037,"column_5":1,"date":{"end_time":"2010/12/09 00:00:00 -0500","original":"12/8/2010","granularity":"day","time":"2010/12/08 00:00:00 -0500"},"longitude":47.0472336,"id":"adv9lt32ijok","location":"MG: Tsaramandroso"},"type":"Feature","geometry":{"type":"Point","coordinates":[47.0472336,-16.3656037]}},{"properties":{"latitude":-18.3150924,"column_5":1,"date":{"end_time":"2010/12/09 00:00:00 -0500","original":"12/8/2010","granularity":"day","time":"2010/12/08 00:00:00 -0500"},"longitude":47.119503,"id":"adv9lsqwrs1t","location":"MG: Ankazobe"},"type":"Feature","geometry":{"type":"Point","coordinates":[47.119503,-18.3150924]}},{"properties":{"latitude":-22.6922695,"column_5":1,"date":{"end_time":"2010/12/13 00:00:00 -0500","original":"12/12/2010","granularity":"day","time":"2010/12/12 00:00:00 -0500"},"longitude":31.0168505,"id":"adv9lszbqo3n","location":"Kruger NP--Punda Maria Camp"},"type":"Feature","geometry":{"type":"Point","coordinates":[31.0168505,-22.6922695]}},{"properties":{"latitude":-23.0092013,"column_5":1,"date":{"end_time":"2010/12/13 00:00:00 -0500","original":"12/12/2010","granularity":"day","time":"2010/12/12 00:00:00 -0500"},"longitude":30.2590084,"id":"adv9lt5yd8xk","location":"Entabeni Forest Reserve"},"type":"Feature","geometry":{"type":"Point","coordinates":[30.2590084,-23.0092013]}},{"properties":{"latitude":-22.9833651,"column_5":1,"date":{"end_time":"2010/12/13 00:00:00 -0500","original":"12/12/2010","granularity":"day","time":"2010/12/12 00:00:00 -0500"},"longitude":30.4571915,"id":"adv9lt5hcfpr","location":"ZA: Thohoyandou"},"type":"Feature","geometry":{"type":"Point","coordinates":[30.4571915,-22.9833651]}},{"properties":{"latitude":-22.4383216,"column_5":1,"date":{"end_time":"2010/12/14 00:00:00 -0500","original":"12/13/2010","granularity":"day","time":"2010/12/13 00:00:00 -0500"},"longitude":31.2689782,"id":"adv9lsw1y7nf","location":"Kruger NP--Pafuri area"},"type":"Feature","geometry":{"type":"Point","coordinates":[31.2689782,-22.4383216]}},{"properties":{"latitude":-22.4246757,"column_5":1,"date":{"end_time":"2010/12/14 00:00:00 -0500","original":"12/13/2010","granularity":"day","time":"2010/12/13 00:00:00 -0500"},"longitude":31.3092327,"id":"adv9lsub1k8q","location":"MZ: Crooks Corner (Mozambique)"},"type":"Feature","geometry":{"type":"Point","coordinates":[31.3092327,-22.4246757]}},{"properties":{"latitude":-22.4101557,"column_5":1,"date":{"end_time":"2010/12/14 00:00:00 -0500","original":"12/13/2010","granularity":"day","time":"2010/12/13 00:00:00 -0500"},"longitude":31.3094902,"id":"adv9lsyuo72d","location":"ZW: Crooks Corner (Zimbabwe)"},"type":"Feature","geometry":{"type":"Point","coordinates":[31.3094902,-22.4101557]}},{"properties":{"latitude":-23.853814,"column_5":1,"date":{"end_time":"2010/12/15 00:00:00 -0500","original":"12/14/2010","granularity":"day","time":"2010/12/14 00:00:00 -0500"},"longitude":31.575737,"id":"adv9lt6p1xly","location":"Kruger NP--Letaba Camp"},"type":"Feature","geometry":{"type":"Point","coordinates":[31.575737,-23.853814]}},{"properties":{"latitude":-24.9932541,"column_5":1,"date":{"end_time":"2010/12/16 00:00:00 -0500","original":"12/15/2010","granularity":"day","time":"2010/12/15 00:00:00 -0500"},"longitude":31.5920877,"id":"adv9lss6kj08","location":"Kruger NP--Skukuza Camp"},"type":"Feature","geometry":{"type":"Point","coordinates":[31.5920877,-24.9932541]}},{"properties":{"latitude":-25.4207958,"column_5":1,"date":{"end_time":"2010/12/17 00:00:00 -0500","original":"12/16/2010","granularity":"day","time":"2010/12/16 00:00:00 -0500"},"longitude":30.1027107,"id":"adv9lsuzg9s7","location":"Dullstroom"},"type":"Feature","geometry":{"type":"Point","coordinates":[30.1027107,-25.4207958]}},{"properties":{"latitude":-26.0685025,"column_5":1,"date":{"end_time":"2010/12/17 00:00:00 -0500","original":"12/16/2010","granularity":"day","time":"2010/12/16 00:00:00 -0500"},"longitude":30.1128387,"id":"adv9lsw0xz11","location":"ZA: Carolina"},"type":"Feature","geometry":{"type":"Point","coordinates":[30.1128387,-26.0685025]}},{"properties":{"latitude":-25.7964524,"column_5":1,"date":{"end_time":"2010/12/17 00:00:00 -0500","original":"12/16/2010","granularity":"day","time":"2010/12/16 00:00:00 -0500"},"longitude":31.1460686,"id":"adv9lt0rt6tp","location":"Peddlar's Bush"},"type":"Feature","geometry":{"type":"Point","coordinates":[31.1460686,-25.7964524]}},{"properties":{"latitude":-28.387776,"column_5":1,"date":{"end_time":"2010/12/19 00:00:00 -0500","original":"12/18/2010","granularity":"day","time":"2010/12/18 00:00:00 -0500"},"longitude":32.4048615,"id":"adv9lsxrgvc3","location":"St. Lucia estuary"},"type":"Feature","geometry":{"type":"Point","coordinates":[32.4048615,-28.387776]}},{"properties":{"latitude":-28.773377,"column_5":1,"date":{"end_time":"2010/12/19 00:00:00 -0500","original":"12/18/2010","granularity":"day","time":"2010/12/18 00:00:00 -0500"},"longitude":31.4699936,"id":"adv9lswhag0k","location":"ZA: Lake Phobane"},"type":"Feature","geometry":{"type":"Point","coordinates":[31.4699936,-28.773377]}},{"properties":{"latitude":-28.9547566,"column_5":1,"date":{"end_time":"2010/12/19 00:00:00 -0500","original":"12/18/2010","granularity":"day","time":"2010/12/18 00:00:00 -0500"},"longitude":31.7494583,"id":"adv9lsveignl","location":"ZA: Mtunzini"},"type":"Feature","geometry":{"type":"Point","coordinates":[31.7494583,-28.9547566]}},{"properties":{"latitude":-28.8947327,"column_5":1,"date":{"end_time":"2010/12/20 00:00:00 -0500","original":"12/19/2010","granularity":"day","time":"2010/12/19 00:00:00 -0500"},"longitude":31.4483643,"id":"adv9lstfmw4r","location":"Eshowe--Dlinza Forest"},"type":"Feature","geometry":{"type":"Point","coordinates":[31.4483643,-28.8947327]}},{"properties":{"latitude":-29.8567239,"column_5":1,"date":{"end_time":"2010/12/20 00:00:00 -0500","original":"12/19/2010","granularity":"day","time":"2010/12/19 00:00:00 -0500"},"longitude":31.0068512,"id":"adv9lsyd6gze","location":"ZA: Durban"},"type":"Feature","geometry":{"type":"Point","coordinates":[31.0068512,-29.8567239]}},{"properties":{"latitude":-30.3884246,"column_5":1,"date":{"end_time":"2010/12/21 00:00:00 -0500","original":"12/20/2010","granularity":"day","time":"2010/12/20 00:00:00 -0500"},"longitude":28.8091993,"id":"adv9lt2ty0w2","location":"Matatiele Mountain"},"type":"Feature","geometry":{"type":"Point","coordinates":[28.8091993,-30.3884246]}},{"properties":{"latitude":-30.7322083,"column_5":1,"date":{"end_time":"2010/12/21 00:00:00 -0500","original":"12/20/2010","granularity":"day","time":"2010/12/20 00:00:00 -0500"},"longitude":28.1372738,"id":"adv9lt1b1nq0","location":"Naudesnek Pass"},"type":"Feature","geometry":{"type":"Point","coordinates":[28.1372738,-30.7322083]}},{"properties":{"latitude":-30.5445217,"column_5":1,"date":{"end_time":"2010/12/21 00:00:00 -0500","original":"12/20/2010","granularity":"day","time":"2010/12/20 00:00:00 -0500"},"longitude":29.4193268,"id":"adv9lsrzxgyl","location":"ZA: Kokstad"},"type":"Feature","geometry":{"type":"Point","coordinates":[29.4193268,-30.5445217]}},{"properties":{"latitude":-30.6897402,"column_5":1,"date":{"end_time":"2010/12/21 00:00:00 -0500","original":"12/20/2010","granularity":"day","time":"2010/12/20 00:00:00 -0500"},"longitude":28.50214,"id":"adv9lswxm3l4","location":"ZA: Mount Fletcher"},"type":"Feature","geometry":{"type":"Point","coordinates":[28.50214,-30.6897402]}},{"properties":{"latitude":-31.7020282,"column_5":1,"date":{"end_time":"2010/12/21 00:00:00 -0500","original":"12/20/2010","granularity":"day","time":"2010/12/20 00:00:00 -0500"},"longitude":27.2320175,"id":"adv9lsy1i4oj","location":"ZA: Lady Frere"},"type":"Feature","geometry":{"type":"Point","coordinates":[27.2320175,-31.7020282]}},{"properties":{"latitude":-34.0347371,"column_5":1,"date":{"end_time":"2010/12/22 00:00:00 -0500","original":"12/21/2010","granularity":"day","time":"2010/12/21 00:00:00 -0500"},"longitude":23.0050278,"id":"adv9lswni97u","location":"ZA: Knysna"},"type":"Feature","geometry":{"type":"Point","coordinates":[23.0050278,-34.0347371]}},{"properties":{"latitude":-33.9319665,"column_5":1,"date":{"end_time":"2010/12/22 00:00:00 -0500","original":"12/21/2010","granularity":"day","time":"2010/12/21 00:00:00 -0500"},"longitude":25.5679321,"id":"adv9lt4x69mv","location":"ZA: Port Elizabeth"},"type":"Feature","geometry":{"type":"Point","coordinates":[25.5679321,-33.9319665]}},{"properties":{"latitude":-32.5374432,"column_5":1,"date":{"end_time":"2010/12/22 00:00:00 -0500","original":"12/21/2010","granularity":"day","time":"2010/12/21 00:00:00 -0500"},"longitude":27.3633385,"id":"adv9lt6ycrtv","location":"Kologha Forest Reserve"},"type":"Feature","geometry":{"type":"Point","coordinates":[27.3633385,-32.5374432]}},{"properties":{"latitude":-33.9846484,"column_5":1,"date":{"end_time":"2010/12/22 00:00:00 -0500","original":"12/21/2010","granularity":"day","time":"2010/12/21 00:00:00 -0500"},"longitude":20.8153152,"id":"adv9lsrdk9dy","location":"Grootvadersbosch Nature Reserve"},"type":"Feature","geometry":{"type":"Point","coordinates":[20.8153152,-33.9846484]}},{"properties":{"latitude":-33.989559,"column_5":1,"date":{"end_time":"2010/12/22 00:00:00 -0500","original":"12/21/2010","granularity":"day","time":"2010/12/21 00:00:00 -0500"},"longitude":22.5512409,"id":"adv9lswu0z1m","location":"ZA: Kaimanns River Mouth"},"type":"Feature","geometry":{"type":"Point","coordinates":[22.5512409,-33.989559]}},{"properties":{"latitude":-34.279347,"column_5":1,"date":{"end_time":"2010/12/23 00:00:00 -0500","original":"12/22/2010","granularity":"day","time":"2010/12/22 00:00:00 -0500"},"longitude":20.218277,"id":"adv9lsrlv4nq","location":"Agulhas Plain Loop"},"type":"Feature","geometry":{"type":"Point","coordinates":[20.218277,-34.279347]}},{"properties":{"latitude":-34.3654731,"column_5":1,"date":{"end_time":"2010/12/23 00:00:00 -0500","original":"12/22/2010","granularity":"day","time":"2010/12/22 00:00:00 -0500"},"longitude":18.8887167,"id":"adv9lt4urhky","location":"Betty's Bay"},"type":"Feature","geometry":{"type":"Point","coordinates":[18.8887167,-34.3654731]}},{"properties":{"latitude":-34.0827348,"column_5":1,"date":{"end_time":"2010/12/24 00:00:00 -0500","original":"12/23/2010","granularity":"day","time":"2010/12/23 00:00:00 -0500"},"longitude":18.5131645,"id":"adv9lstvj9zq","location":"Strandfontein WTP"},"type":"Feature","geometry":{"type":"Point","coordinates":[18.5131645,-34.0827348]}},{"properties":{"latitude":-34.2969338,"column_5":1,"date":{"end_time":"2010/12/24 00:00:00 -0500","original":"12/23/2010","granularity":"day","time":"2010/12/23 00:00:00 -0500"},"longitude":18.4350586,"id":"adv9lsxgk7jv","location":"Cape Peninsula NP"},"type":"Feature","geometry":{"type":"Point","coordinates":[18.4350586,-34.2969338]}},{"properties":{"latitude":-34.1389463,"column_5":1,"date":{"end_time":"2010/12/24 00:00:00 -0500","original":"12/23/2010","granularity":"day","time":"2010/12/23 00:00:00 -0500"},"longitude":18.9315462,"id":"adv9lsu67ps5","location":"Sir Lowry's Pass"},"type":"Feature","geometry":{"type":"Point","coordinates":[18.9315462,-34.1389463]}},{"properties":{"latitude":-33.1014285,"column_5":1,"date":{"end_time":"2010/12/25 00:00:00 -0500","original":"12/24/2010","granularity":"day","time":"2010/12/24 00:00:00 -0500"},"longitude":19.7719145,"id":"adv9lsv6mifr","location":"Eierkop"},"type":"Feature","geometry":{"type":"Point","coordinates":[19.7719145,-33.1014285]}},{"properties":{"latitude":-33.6858356,"column_5":1,"date":{"end_time":"2010/12/25 00:00:00 -0500","original":"12/24/2010","granularity":"day","time":"2010/12/24 00:00:00 -0500"},"longitude":18.9811134,"id":"adv9lsy8sg31","location":"Paarl Bird Sanctuary"},"type":"Feature","geometry":{"type":"Point","coordinates":[18.9811134,-33.6858356]}},{"properties":{"latitude":-33.6274844,"column_5":1,"date":{"end_time":"2010/12/25 00:00:00 -0500","original":"12/24/2010","granularity":"day","time":"2010/12/24 00:00:00 -0500"},"longitude":19.4509506,"id":"adv9lt19fh3p","location":"ZA: Worcester"},"type":"Feature","geometry":{"type":"Point","coordinates":[19.4509506,-33.6274844]}},{"properties":{"latitude":-32.4923886,"column_5":1,"date":{"end_time":"2010/12/25 00:00:00 -0500","original":"12/24/2010","granularity":"day","time":"2010/12/24 00:00:00 -0500"},"longitude":19.8241425,"id":"adv9lt2x10iq","location":"Road P2250"},"type":"Feature","geometry":{"type":"Point","coordinates":[19.8241425,-32.4923886]}},{"properties":{"latitude":-32.8815334,"column_5":1,"date":{"end_time":"2010/12/25 00:00:00 -0500","original":"12/24/2010","granularity":"day","time":"2010/12/24 00:00:00 -0500"},"longitude":19.7371101,"id":"adv9lt6d9eys","location":"Skitterykloof"},"type":"Feature","geometry":{"type":"Point","coordinates":[19.7371101,-32.8815334]}},{"properties":{"latitude":-33.1818127,"column_5":1,"date":{"end_time":"2010/12/26 00:00:00 -0500","original":"12/25/2010","granularity":"day","time":"2010/12/25 00:00:00 -0500"},"longitude":18.117485,"id":"adv9lt3enhfy","location":"West Coast NP"},"type":"Feature","geometry":{"type":"Point","coordinates":[18.117485,-33.1818127]}},{"properties":{"latitude":-33.976677,"column_5":1,"date":{"end_time":"2010/12/26 00:00:00 -0500","original":"12/25/2010","granularity":"day","time":"2010/12/25 00:00:00 -0500"},"longitude":18.6036301,"id":"adv9lsxzwos1","location":"ZA: Cape Town Intl Airport"},"type":"Feature","geometry":{"type":"Point","coordinates":[18.6036301,-33.976677]}},{"properties":{"latitude":-26.586071,"column_5":1,"date":{"end_time":"2010/12/27 00:00:00 -0500","original":"12/26/2010","granularity":"day","time":"2010/12/26 00:00:00 -0500"},"longitude":18.1384277,"id":"adv9lswg0bt4","location":"NA: Keetmanshoop"},"type":"Feature","geometry":{"type":"Point","coordinates":[18.1384277,-26.586071]}},{"properties":{"latitude":-29.1280218,"column_5":1,"date":{"end_time":"2010/12/27 00:00:00 -0500","original":"12/26/2010","granularity":"day","time":"2010/12/26 00:00:00 -0500"},"longitude":19.395504,"id":"adv9lswi577s","location":"ZA: Pofadder"},"type":"Feature","geometry":{"type":"Point","coordinates":[19.395504,-29.1280218]}},{"properties":{"latitude":-22.5379274,"column_5":1,"date":{"end_time":"2010/12/28 00:00:00 -0500","original":"12/27/2010","granularity":"day","time":"2010/12/27 00:00:00 -0500"},"longitude":16.9457245,"id":"adv9lsuzp7ea","location":"Daan Viljoen Game Park"},"type":"Feature","geometry":{"type":"Point","coordinates":[16.9457245,-22.5379274]}},{"properties":{"latitude":-21.780543,"column_5":1,"date":{"end_time":"2010/12/28 00:00:00 -0500","original":"12/27/2010","granularity":"day","time":"2010/12/27 00:00:00 -0500"},"longitude":15.9430504,"id":"adv9lsybhasz","location":"Hwy 33--Kahn River crossing"},"type":"Feature","geometry":{"type":"Point","coordinates":[15.9430504,-21.780543]}},{"properties":{"latitude":-23.1823416,"column_5":1,"date":{"end_time":"2010/12/29 00:00:00 -0500","original":"12/28/2010","granularity":"day","time":"2010/12/28 00:00:00 -0500"},"longitude":14.6502686,"id":"adv9lsqwgz5q","location":"Rooibank"},"type":"Feature","geometry":{"type":"Point","coordinates":[14.6502686,-23.1823416]}},{"properties":{"latitude":-23.0137043,"column_5":1,"date":{"end_time":"2010/12/29 00:00:00 -0500","original":"12/28/2010","granularity":"day","time":"2010/12/28 00:00:00 -0500"},"longitude":14.4281387,"id":"adv9lsr88s1x","location":"Walvis Bay"},"type":"Feature","geometry":{"type":"Point","coordinates":[14.4281387,-23.0137043]}},{"properties":{"latitude":-21.8352091,"column_5":1,"date":{"end_time":"2010/12/30 00:00:00 -0500","original":"12/29/2010","granularity":"day","time":"2010/12/29 00:00:00 -0500"},"longitude":15.1759386,"id":"adv9lsqshwfe","location":"Grosse Spitzkoppe Nature Reserve"},"type":"Feature","geometry":{"type":"Point","coordinates":[15.1759386,-21.8352091]}},{"properties":{"latitude":-20.5138564,"column_5":1,"date":{"end_time":"2010/12/31 00:00:00 -0500","original":"12/30/2010","granularity":"day","time":"2010/12/30 00:00:00 -0500"},"longitude":17.2444153,"id":"adv9lt5js8h8","location":"Waterberg Plateau NP"},"type":"Feature","geometry":{"type":"Point","coordinates":[17.2444153,-20.5138564]}},{"properties":{"latitude":-20.1081681,"column_5":1,"date":{"end_time":"2010/12/31 00:00:00 -0500","original":"12/30/2010","granularity":"day","time":"2010/12/30 00:00:00 -0500"},"longitude":16.149559,"id":"adv9lstbvvg9","location":"NA: Outjo"},"type":"Feature","geometry":{"type":"Point","coordinates":[16.149559,-20.1081681]}},{"properties":{"latitude":-19.1809926,"column_5":1,"date":{"end_time":"2011/01/01 00:00:00 -0500","original":"12/31/2010","granularity":"day","time":"2010/12/31 00:00:00 -0500"},"longitude":15.9162258,"id":"adv9lt2tzict","location":"Etosha NP--Okaukuejo Camp"},"type":"Feature","geometry":{"type":"Point","coordinates":[15.9162258,-19.1809926]}},{"properties":{"latitude":-18.8083305,"column_5":1,"date":{"end_time":"2011/01/02 00:00:00 -0500","original":"1/1/2011","granularity":"day","time":"2011/01/01 00:00:00 -0500"},"longitude":16.9405746,"id":"adv9lt1e5q2x","location":"Etosha NP--Namutoni Camp"},"type":"Feature","geometry":{"type":"Point","coordinates":[16.9405746,-18.8083305]}},{"properties":{"latitude":-19.2791244,"column_5":1,"date":{"end_time":"2011/01/02 00:00:00 -0500","original":"1/1/2011","granularity":"day","time":"2011/01/01 00:00:00 -0500"},"longitude":18.4356165,"id":"adv9lsz5wczq","location":"Roy's Camp"},"type":"Feature","geometry":{"type":"Point","coordinates":[18.4356165,-19.2791244]}},{"properties":{"latitude":-18.1199947,"column_5":1,"date":{"end_time":"2011/01/03 00:00:00 -0500","original":"1/2/2011","granularity":"day","time":"2011/01/02 00:00:00 -0500"},"longitude":21.5820408,"id":"adv9lt28nbo9","location":"Popa Falls"},"type":"Feature","geometry":{"type":"Point","coordinates":[21.5820408,-18.1199947]}},{"properties":{"latitude":-18.0417885,"column_5":1,"date":{"end_time":"2011/01/03 00:00:00 -0500","original":"1/2/2011","granularity":"day","time":"2011/01/02 00:00:00 -0500"},"longitude":19.6244252,"id":"adv9lt686yu3","location":"Rundu--radio tower"},"type":"Feature","geometry":{"type":"Point","coordinates":[19.6244252,-18.0417885]}},{"properties":{"latitude":-18.1990221,"column_5":1,"date":{"end_time":"2011/01/04 00:00:00 -0500","original":"1/3/2011","granularity":"day","time":"2011/01/03 00:00:00 -0500"},"longitude":21.7398834,"id":"adv9lswqx2y3","location":"Mahango Game Reserve"},"type":"Feature","geometry":{"type":"Point","coordinates":[21.7398834,-18.1990221]}},{"properties":{"latitude":-17.9526065,"column_5":1,"date":{"end_time":"2011/01/04 00:00:00 -0500","original":"1/3/2011","granularity":"day","time":"2011/01/03 00:00:00 -0500"},"longitude":22.5741577,"id":"adv9lsy0smxf","location":"Caprivi Game Park"},"type":"Feature","geometry":{"type":"Point","coordinates":[22.5741577,-17.9526065]}},{"properties":{"latitude":-17.7592724,"column_5":1,"date":{"end_time":"2011/01/05 00:00:00 -0500","original":"1/4/2011","granularity":"day","time":"2011/01/04 00:00:00 -0500"},"longitude":23.3448744,"id":"adv9lt6y3njb","location":"Susuwe Camp"},"type":"Feature","geometry":{"type":"Point","coordinates":[23.3448744,-17.7592724]}},{"properties":{"latitude":-17.4857241,"column_5":1,"date":{"end_time":"2011/01/05 00:00:00 -0500","original":"1/4/2011","granularity":"day","time":"2011/01/04 00:00:00 -0500"},"longitude":24.3388796,"id":"adv9lsshhy73","location":"ZM: Katima Mulilo (Zambia)"},"type":"Feature","geometry":{"type":"Point","coordinates":[24.3388796,-17.4857241]}},{"properties":{"latitude":-17.7932323,"column_5":1,"date":{"end_time":"2011/01/07 00:00:00 -0500","original":"1/6/2011","granularity":"day","time":"2011/01/06 00:00:00 -0500"},"longitude":25.1427269,"id":"adv9lt4t7x80","location":"NA: Kasane (Namibia)"},"type":"Feature","geometry":{"type":"Point","coordinates":[25.1427269,-17.7932323]}},{"properties":{"latitude":-20.2106562,"column_5":1,"date":{"end_time":"2011/01/09 00:00:00 -0500","original":"1/8/2011","granularity":"day","time":"2011/01/08 00:00:00 -0500"},"longitude":26.1814499,"id":"adv9lssf8fio","location":"BW: Nata"},"type":"Feature","geometry":{"type":"Point","coordinates":[26.1814499,-20.2106562]}},{"properties":{"latitude":-20.5353988,"column_5":1,"date":{"end_time":"2011/01/10 00:00:00 -0500","original":"1/9/2011","granularity":"day","time":"2011/01/09 00:00:00 -0500"},"longitude":26.0757065,"id":"adv9lt4yvoyu","location":"Sua Pan"},"type":"Feature","geometry":{"type":"Point","coordinates":[26.0757065,-20.5353988]}},{"properties":{"latitude":-22.9960073,"column_5":1,"date":{"end_time":"2011/01/10 00:00:00 -0500","original":"1/9/2011","granularity":"day","time":"2011/01/09 00:00:00 -0500"},"longitude":27.9363441,"id":"adv9lsxc35fd","location":"BW: Martin's Drift"},"type":"Feature","geometry":{"type":"Point","coordinates":[27.9363441,-22.9960073]}},{"properties":{"latitude":-21.1728869,"column_5":1,"date":{"end_time":"2011/01/10 00:00:00 -0500","original":"1/9/2011","granularity":"day","time":"2011/01/09 00:00:00 -0500"},"longitude":27.5118256,"id":"adv9lt2409x6","location":"BW: Francistown"},"type":"Feature","geometry":{"type":"Point","coordinates":[27.5118256,-21.1728869]}},{"properties":{"latitude":-23.0092013,"column_5":1,"date":{"end_time":"2011/01/10 00:00:00 -0500","original":"1/9/2011","granularity":"day","time":"2011/01/09 00:00:00 -0500"},"longitude":27.9469872,"id":"adv9lsw9exio","location":"ZA: Grobler's Bridge"},"type":"Feature","geometry":{"type":"Point","coordinates":[27.9469872,-23.0092013]}},{"properties":{"latitude":-20.8299351,"column_5":1,"date":{"end_time":"2011/01/10 00:00:00 -0500","original":"1/9/2011","granularity":"day","time":"2011/01/09 00:00:00 -0500"},"longitude":27.0747757,"id":"adv9lt0d0qyx","location":"A3--Boulder-Chat location"},"type":"Feature","geometry":{"type":"Point","coordinates":[27.0747757,-20.8299351]}},{"properties":{"latitude":-24.6532579,"column_5":1,"date":{"end_time":"2011/01/11 00:00:00 -0500","original":"1/10/2011","granularity":"day","time":"2011/01/10 00:00:00 -0500"},"longitude":28.6928558,"id":"adv9lsuvhpva","location":"Nylsvley Nature Reserve"},"type":"Feature","geometry":{"type":"Point","coordinates":[28.6928558,-24.6532579]}},{"properties":{"latitude":-23.8308903,"column_5":1,"date":{"end_time":"2011/01/11 00:00:00 -0500","original":"1/10/2011","granularity":"day","time":"2011/01/10 00:00:00 -0500"},"longitude":29.9934483,"id":"adv9lt22f0mc","location":"Magoebaskloof"},"type":"Feature","geometry":{"type":"Point","coordinates":[29.9934483,-23.8308903]}},{"properties":{"latitude":-24.9403433,"column_5":1,"date":{"end_time":"2011/01/12 00:00:00 -0500","original":"1/11/2011","granularity":"day","time":"2011/01/11 00:00:00 -0500"},"longitude":30.7142973,"id":"adv9lst0u45r","location":"Mt. Sheba Lodge"},"type":"Feature","geometry":{"type":"Point","coordinates":[30.7142973,-24.9403433]}},{"properties":{"latitude":-24.4506461,"column_5":1,"date":{"end_time":"2011/01/12 00:00:00 -0500","original":"1/11/2011","granularity":"day","time":"2011/01/11 00:00:00 -0500"},"longitude":30.607481,"id":"adv9lsthu2z5","location":"Strijdom Tunnel"},"type":"Feature","geometry":{"type":"Point","coordinates":[30.607481,-24.4506461]}},{"properties":{"latitude":-24.8766256,"column_5":1,"date":{"end_time":"2011/01/12 00:00:00 -0500","original":"1/11/2011","granularity":"day","time":"2011/01/11 00:00:00 -0500"},"longitude":30.8880615,"id":"adv9lstptyf4","location":"Motiatse Canyon PNR--God's Window"},"type":"Feature","geometry":{"type":"Point","coordinates":[30.8880615,-24.8766256]}},{"properties":{"latitude":-26.2262948,"column_5":1,"date":{"end_time":"2011/01/13 00:00:00 -0500","original":"1/12/2011","granularity":"day","time":"2011/01/12 00:00:00 -0500"},"longitude":28.1692886,"id":"adv9lsvmzsu0","location":"ZA: Germiston"},"type":"Feature","geometry":{"type":"Point","coordinates":[28.1692886,-26.2262948]}},{"properties":{"latitude":48.3525987,"column_5":1,"date":{"end_time":"2011/01/17 00:00:00 -0500","original":"1/16/2011","granularity":"day","time":"2011/01/16 00:00:00 -0500"},"longitude":11.7814636,"id":"adv9lt45x327","location":"GER: Munich International Airport"},"type":"Feature","geometry":{"type":"Point","coordinates":[11.7814636,48.3525987]}},{"properties":{"latitude":9.79916,"column_5":1,"date":{"end_time":"2011/01/28 00:00:00 -0500","original":"1/27/2011","granularity":"day","time":"2011/01/27 00:00:00 -0500"},"longitude":-84.60504,"id":"adv9lsxj1za3","location":"Carara--Puente Ro  Trcoles"},"type":"Feature","geometry":{"type":"Point","coordinates":[-84.60504,9.79916]}},{"properties":{"latitude":8.6443289,"column_5":1,"date":{"end_time":"2011/02/02 00:00:00 -0500","original":"2/1/2011","granularity":"day","time":"2011/02/01 00:00:00 -0500"},"longitude":-83.4618902,"id":"adv9lt5d6907","location":"CR: La Palma"},"type":"Feature","geometry":{"type":"Point","coordinates":[-83.4618902,8.6443289]}},{"properties":{"latitude":8.6890556,"column_5":1,"date":{"end_time":"2011/03/08 00:00:00 -0500","original":"3/7/2011","granularity":"day","time":"2011/03/07 00:00:00 -0500"},"longitude":-83.4760833,"id":"adv9lsz9rxs3","location":"Rio Rincn bridge &amp; environs"},"type":"Feature","geometry":{"type":"Point","coordinates":[-83.4760833,8.6890556]}},{"properties":{"latitude":8.5429127,"column_5":1,"date":{"end_time":"2011/03/08 00:00:00 -0500","original":"3/7/2011","granularity":"day","time":"2011/03/07 00:00:00 -0500"},"longitude":-83.3617687,"id":"adv9lt2kheuc","location":"CR: Gallardo"},"type":"Feature","geometry":{"type":"Point","coordinates":[-83.3617687,8.5429127]}},{"properties":{"latitude":8.9624865,"column_5":1,"date":{"end_time":"2011/03/26 00:00:00 -0400","original":"3/25/2011","granularity":"day","time":"2011/03/25 00:00:00 -0400"},"longitude":-83.4589291,"id":"adv9lsu5dnbk","location":"CR: Palmar Norte"},"type":"Feature","geometry":{"type":"Point","coordinates":[-83.4589291,8.9624865]}},{"properties":{"latitude":9.8667166,"column_5":1,"date":{"end_time":"2011/03/26 00:00:00 -0400","original":"3/25/2011","granularity":"day","time":"2011/03/25 00:00:00 -0400"},"longitude":-83.9437866,"id":"adv9lsyjys4y","location":"CR: Cartago"},"type":"Feature","geometry":{"type":"Point","coordinates":[-83.9437866,9.8667166]}},{"properties":{"latitude":9.5475356,"column_5":1,"date":{"end_time":"2011/03/27 00:00:00 -0400","original":"3/26/2011","granularity":"day","time":"2011/03/26 00:00:00 -0400"},"longitude":-83.810041,"id":"adv9lt49pzb9","location":"San Gerardo de Dota"},"type":"Feature","geometry":{"type":"Point","coordinates":[-83.810041,9.5475356]}},{"properties":{"latitude":9.5545396,"column_5":1,"date":{"end_time":"2011/03/27 00:00:00 -0400","original":"3/26/2011","granularity":"day","time":"2011/03/26 00:00:00 -0400"},"longitude":-83.7560749,"id":"adv9lsr0y9rx","location":"PN Los Quetzales--communication towers"},"type":"Feature","geometry":{"type":"Point","coordinates":[-83.7560749,9.5545396]}},{"properties":{"latitude":9.773866,"column_5":1,"date":{"end_time":"2011/03/28 00:00:00 -0400","original":"3/27/2011","granularity":"day","time":"2011/03/27 00:00:00 -0400"},"longitude":-83.7953746,"id":"adv9lt1g0vaj","location":"Kiri Lodge"},"type":"Feature","geometry":{"type":"Point","coordinates":[-83.7953746,9.773866]}},{"properties":{"latitude":9.5582003,"column_5":1,"date":{"end_time":"2011/03/28 00:00:00 -0400","original":"3/27/2011","granularity":"day","time":"2011/03/27 00:00:00 -0400"},"longitude":-83.7239313,"id":"adv9lsxrp9gq","location":"Restaurante La Georgina"},"type":"Feature","geometry":{"type":"Point","coordinates":[-83.7239313,9.5582003]}},{"properties":{"latitude":9.746449,"column_5":1,"date":{"end_time":"2011/03/29 00:00:00 -0400","original":"3/28/2011","granularity":"day","time":"2011/03/28 00:00:00 -0400"},"longitude":-83.796673,"id":"adv9lt0y3jpq","location":"PN Tapanti--Tapanti"},"type":"Feature","geometry":{"type":"Point","coordinates":[-83.796673,9.746449]}},{"properties":{"latitude":9.8251575,"column_5":1,"date":{"end_time":"2011/03/30 00:00:00 -0400","original":"3/29/2011","granularity":"day","time":"2011/03/29 00:00:00 -0400"},"longitude":-83.5724509,"id":"adv9lt009h4u","location":"Tuis River"},"type":"Feature","geometry":{"type":"Point","coordinates":[-83.5724509,9.8251575]}},{"properties":{"latitude":10.0089546,"column_5":1,"date":{"end_time":"2011/03/31 00:00:00 -0400","original":"3/30/2011","granularity":"day","time":"2011/03/30 00:00:00 -0400"},"longitude":-84.2587048,"id":"adv9lsx803xp","location":"CR: Kevin Easley's House"},"type":"Feature","geometry":{"type":"Point","coordinates":[-84.2587048,10.0089546]}},{"properties":{"latitude":40.6448289,"column_5":1,"date":{"end_time":"2011/04/01 00:00:00 -0400","original":"3/31/2011","granularity":"day","time":"2011/03/31 00:00:00 -0400"},"longitude":-73.783493,"id":"adv9lss91nrm","location":"John F Kennedy International Airport (JFK)"},"type":"Feature","geometry":{"type":"Point","coordinates":[-73.783493,40.6448289]}},{"properties":{"latitude":42.3422245,"column_5":1,"date":{"end_time":"2011/04/18 00:00:00 -0400","original":"4/17/2011","granularity":"day","time":"2011/04/17 00:00:00 -0400"},"longitude":-79.5971157,"id":"adv9lt3xcd8i","location":"Barcelona Harbor"},"type":"Feature","geometry":{"type":"Point","coordinates":[-79.5971157,42.3422245]}},{"properties":{"latitude":43.0860971,"column_5":1,"date":{"end_time":"2011/04/18 00:00:00 -0400","original":"4/17/2011","granularity":"day","time":"2011/04/17 00:00:00 -0400"},"longitude":-79.068625,"id":"adv9lt3jsp8j","location":"Niagara Falls SP"},"type":"Feature","geometry":{"type":"Point","coordinates":[-79.068625,43.0860971]}},{"properties":{"latitude":42.9833651,"column_5":1,"date":{"end_time":"2011/04/18 00:00:00 -0400","original":"4/17/2011","granularity":"day","time":"2011/04/17 00:00:00 -0400"},"longitude":-76.7562389,"id":"adv9lsrw3ewm","location":"Montezuma NWR"},"type":"Feature","geometry":{"type":"Point","coordinates":[-76.7562389,42.9833651]}},{"properties":{"latitude":43.15392,"column_5":1,"date":{"end_time":"2011/04/18 00:00:00 -0400","original":"4/17/2011","granularity":"day","time":"2011/04/17 00:00:00 -0400"},"longitude":-77.67848,"id":"adv9lsu33vpg","location":"Monroe"},"type":"Feature","geometry":{"type":"Point","coordinates":[-77.67848,43.15392]}},{"properties":{"latitude":43.072619,"column_5":1,"date":{"end_time":"2011/04/18 00:00:00 -0400","original":"4/17/2011","granularity":"day","time":"2011/04/17 00:00:00 -0400"},"longitude":-79.074761,"id":"adv9lt1u957i","location":"Niagara--Upper Falls (ON)"},"type":"Feature","geometry":{"type":"Point","coordinates":[-79.074761,43.072619]}},{"properties":{"latitude":42.4791969,"column_5":1,"date":{"end_time":"2011/04/19 00:00:00 -0400","original":"4/18/2011","granularity":"day","time":"2011/04/18 00:00:00 -0400"},"longitude":-76.4513778,"id":"adv9lstci38t","location":"Sapsucker Woods"},"type":"Feature","geometry":{"type":"Point","coordinates":[-76.4513778,42.4791969]}},{"properties":{"latitude":42.4613266,"column_5":1,"date":{"end_time":"2011/04/19 00:00:00 -0400","original":"4/18/2011","granularity":"day","time":"2011/04/18 00:00:00 -0400"},"longitude":-76.5059255,"id":"adv9lsrzjceh","location":"Stewart Park"},"type":"Feature","geometry":{"type":"Point","coordinates":[-76.5059255,42.4613266]}},{"properties":{"latitude":41.4994507,"column_5":1,"date":{"end_time":"2011/04/20 00:00:00 -0400","original":"4/19/2011","granularity":"day","time":"2011/04/19 00:00:00 -0400"},"longitude":-81.6954498,"id":"adv9lsqvsow0","location":"Cleveland"},"type":"Feature","geometry":{"type":"Point","coordinates":[-81.6954498,41.4994507]}},{"properties":{"latitude":42.44067,"column_5":1,"date":{"end_time":"2011/04/20 00:00:00 -0400","original":"4/19/2011","granularity":"day","time":"2011/04/19 00:00:00 -0400"},"longitude":-76.49656,"id":"adv9lsrobqkw","location":"Ithaca"},"type":"Feature","geometry":{"type":"Point","coordinates":[-76.49656,42.44067]}},{"properties":{"latitude":38.9210373,"column_5":1,"date":{"end_time":"2011/04/27 00:00:00 -0400","original":"4/26/2011","granularity":"day","time":"2011/04/26 00:00:00 -0400"},"longitude":-95.2327411,"id":"adv9lt6w6yvx","location":"Baker Wetlands"},"type":"Feature","geometry":{"type":"Point","coordinates":[-95.2327411,38.9210373]}},{"properties":{"latitude":39.0694,"column_5":1,"date":{"end_time":"2011/04/27 00:00:00 -0400","original":"4/26/2011","granularity":"day","time":"2011/04/26 00:00:00 -0400"},"longitude":-96.16637,"id":"adv9lsv9rcnw","location":"Paxico"},"type":"Feature","geometry":{"type":"Point","coordinates":[-96.16637,39.0694]}},{"properties":{"latitude":39.11251,"column_5":1,"date":{"end_time":"2011/04/28 00:00:00 -0400","original":"4/27/2011","granularity":"day","time":"2011/04/27 00:00:00 -0400"},"longitude":-100.35841,"id":"adv9lsz8g6a7","location":"Park"},"type":"Feature","geometry":{"type":"Point","coordinates":[-100.35841,39.11251]}},{"properties":{"latitude":39.4934439,"column_5":1,"date":{"end_time":"2011/05/05 00:00:00 -0400","original":"5/4/2011","granularity":"day","time":"2011/05/04 00:00:00 -0400"},"longitude":-108.7485123,"id":"adv9lsz7hgyf","location":"CO: Douglas Pass area"},"type":"Feature","geometry":{"type":"Point","coordinates":[-108.7485123,39.4934439]}},{"properties":{"latitude":38.7527446,"column_5":1,"date":{"end_time":"2011/05/06 00:00:00 -0400","original":"5/5/2011","granularity":"day","time":"2011/05/05 00:00:00 -0400"},"longitude":-108.757782,"id":"adv9lsv2wdo7","location":"CO: Unaweep Canyon"},"type":"Feature","geometry":{"type":"Point","coordinates":[-108.757782,38.7527446]}},{"properties":{"latitude":40.91804,"column_5":1,"date":{"end_time":"2011/05/07 00:00:00 -0400","original":"5/6/2011","granularity":"day","time":"2011/05/06 00:00:00 -0400"},"longitude":-111.87177,"id":"adv9lt3w4av7","location":"Centerville"},"type":"Feature","geometry":{"type":"Point","coordinates":[-111.87177,40.91804]}},{"properties":{"latitude":38.96999,"column_5":1,"date":{"end_time":"2011/05/07 00:00:00 -0400","original":"5/6/2011","granularity":"day","time":"2011/05/06 00:00:00 -0400"},"longitude":-109.32067,"id":"adv9lsvvkldj","location":"Cisco"},"type":"Feature","geometry":{"type":"Point","coordinates":[-109.32067,38.96999]}},{"properties":{"latitude":39.187059,"column_5":1,"date":{"end_time":"2011/05/07 00:00:00 -0400","original":"5/6/2011","granularity":"day","time":"2011/05/06 00:00:00 -0400"},"longitude":-109.019087,"id":"adv9lt0vv3jb","location":"Rabbit Valley"},"type":"Feature","geometry":{"type":"Point","coordinates":[-109.019087,39.187059]}},{"properties":{"latitude":37.82278,"column_5":1,"date":{"end_time":"2011/05/16 00:00:00 -0400","original":"5/15/2011","granularity":"day","time":"2011/05/15 00:00:00 -0400"},"longitude":-112.43576,"id":"adv9lt2g4q5a","location":"Panguitch"},"type":"Feature","geometry":{"type":"Point","coordinates":[-112.43576,37.82278]}},{"properties":{"latitude":40.8318656,"column_5":1,"date":{"end_time":"2011/05/17 00:00:00 -0400","original":"5/16/2011","granularity":"day","time":"2011/05/16 00:00:00 -0400"},"longitude":-108.9722729,"id":"adv9lszzyj3w","location":"Browns Park NWR"},"type":"Feature","geometry":{"type":"Point","coordinates":[-108.9722729,40.8318656]}},{"properties":{"latitude":40.0538988,"column_5":1,"date":{"end_time":"2011/07/04 00:00:00 -0400","original":"7/3/2011","granularity":"day","time":"2011/07/03 00:00:00 -0400"},"longitude":-107.049408,"id":"adv9lt3ap5qi","location":"CO: Routt NF"},"type":"Feature","geometry":{"type":"Point","coordinates":[-107.049408,40.0538988]}},{"properties":{"latitude":21.9811,"column_5":1,"date":{"end_time":"2011/07/07 00:00:00 -0400","original":"7/6/2011","granularity":"day","time":"2011/07/06 00:00:00 -0400"},"longitude":-159.371,"id":"adv9lt5ufi15","location":"Lihue"},"type":"Feature","geometry":{"type":"Point","coordinates":[-159.371,21.9811]}},{"properties":{"latitude":22.0714028,"column_5":1,"date":{"end_time":"2011/07/08 00:00:00 -0400","original":"7/7/2011","granularity":"day","time":"2011/07/07 00:00:00 -0400"},"longitude":-159.6619892,"id":"adv9lt3dprlk","location":"Waimea Canyon"},"type":"Feature","geometry":{"type":"Point","coordinates":[-159.6619892,22.0714028]}},{"properties":{"latitude":21.9679024,"column_5":1,"date":{"end_time":"2011/07/10 00:00:00 -0400","original":"7/9/2011","granularity":"day","time":"2011/07/09 00:00:00 -0400"},"longitude":-159.3431067,"id":"adv9lt3gbji9","location":"Kauai Lagoons Golf Course"},"type":"Feature","geometry":{"type":"Point","coordinates":[-159.3431067,21.9679024]}},{"properties":{"latitude":22.2106496,"column_5":1,"date":{"end_time":"2011/07/11 00:00:00 -0400","original":"7/10/2011","granularity":"day","time":"2011/07/10 00:00:00 -0400"},"longitude":-159.4732361,"id":"adv9lsz4xc5u","location":"Hanalei NWR"},"type":"Feature","geometry":{"type":"Point","coordinates":[-159.4732361,22.2106496]}},{"properties":{"latitude":22.2320374,"column_5":1,"date":{"end_time":"2011/07/11 00:00:00 -0400","original":"7/10/2011","granularity":"day","time":"2011/07/10 00:00:00 -0400"},"longitude":-159.4022757,"id":"adv9lsxcmtzr","location":"Kilauea Point NWR"},"type":"Feature","geometry":{"type":"Point","coordinates":[-159.4022757,22.2320374]}},{"properties":{"latitude":21.3199211,"column_5":1,"date":{"end_time":"2011/07/13 00:00:00 -0400","original":"7/12/2011","granularity":"day","time":"2011/07/12 00:00:00 -0400"},"longitude":-157.9264927,"id":"adv9lt5wwsdd","location":"Honolulu Int'l AP"},"type":"Feature","geometry":{"type":"Point","coordinates":[-157.9264927,21.3199211]}},{"properties":{"latitude":18.9282926,"column_5":1,"date":{"end_time":"2011/07/15 00:00:00 -0400","original":"7/14/2011","granularity":"day","time":"2011/07/14 00:00:00 -0400"},"longitude":-155.6740388,"id":"adv9lt4o8m2p","location":"South Point"},"type":"Feature","geometry":{"type":"Point","coordinates":[-155.6740388,18.9282926]}},{"properties":{"latitude":19.3623283,"column_5":1,"date":{"end_time":"2011/07/17 00:00:00 -0400","original":"7/16/2011","granularity":"day","time":"2011/07/16 00:00:00 -0400"},"longitude":-154.9666214,"id":"adv9lsqsaczc","location":"HI: Kalapana area"},"type":"Feature","geometry":{"type":"Point","coordinates":[-154.9666214,19.3623283]}},{"properties":{"latitude":19.7596054,"column_5":1,"date":{"end_time":"2011/07/18 00:00:00 -0400","original":"7/17/2011","granularity":"day","time":"2011/07/17 00:00:00 -0400"},"longitude":-155.4553413,"id":"adv9lswaaqig","location":"Halepohaku and the Mauka Kea Visitor Center"},"type":"Feature","geometry":{"type":"Point","coordinates":[-155.4553413,19.7596054]}},{"properties":{"latitude":19.7297,"column_5":1,"date":{"end_time":"2011/07/18 00:00:00 -0400","original":"7/17/2011","granularity":"day","time":"2011/07/17 00:00:00 -0400"},"longitude":-155.09,"id":"adv9lsxda8uo","location":"Hilo"},"type":"Feature","geometry":{"type":"Point","coordinates":[-155.09,19.7297]}},{"properties":{"latitude":19.6482527,"column_5":1,"date":{"end_time":"2011/07/18 00:00:00 -0400","original":"7/17/2011","granularity":"day","time":"2011/07/17 00:00:00 -0400"},"longitude":-155.3710127,"id":"adv9lsxcgowp","location":"Powerline Road and further Pu'u O'o Trail"},"type":"Feature","geometry":{"type":"Point","coordinates":[-155.3710127,19.6482527]}},{"properties":{"latitude":20.0828,"column_5":1,"date":{"end_time":"2011/07/19 00:00:00 -0400","original":"7/18/2011","granularity":"day","time":"2011/07/18 00:00:00 -0400"},"longitude":-155.473,"id":"adv9lt22f8uq","location":"Honokaa"},"type":"Feature","geometry":{"type":"Point","coordinates":[-155.473,20.0828]}},{"properties":{"latitude":21.2828007,"column_5":1,"date":{"end_time":"2011/07/19 00:00:00 -0400","original":"7/18/2011","granularity":"day","time":"2011/07/18 00:00:00 -0400"},"longitude":-157.8289948,"id":"adv9lt14174h","location":"Waikiki"},"type":"Feature","geometry":{"type":"Point","coordinates":[-157.8289948,21.2828007]}},{"properties":{"latitude":21.3681354,"column_5":1,"date":{"end_time":"2011/07/20 00:00:00 -0400","original":"7/19/2011","granularity":"day","time":"2011/07/19 00:00:00 -0400"},"longitude":-157.9388321,"id":"adv9lstg1zd4","location":"Pearl Harbor--WWII Valor in the Pacific NM"},"type":"Feature","geometry":{"type":"Point","coordinates":[-157.9388321,21.3681354]}},{"properties":{"latitude":21.2629407,"column_5":1,"date":{"end_time":"2011/07/21 00:00:00 -0400","original":"7/20/2011","granularity":"day","time":"2011/07/20 00:00:00 -0400"},"longitude":-157.8047848,"id":"adv9lstbdl2b","location":"Diamond Head Crater Park"},"type":"Feature","geometry":{"type":"Point","coordinates":[-157.8047848,21.2629407]}},{"properties":{"latitude":37.621302,"column_5":1,"date":{"end_time":"2011/07/22 00:00:00 -0400","original":"7/21/2011","granularity":"day","time":"2011/07/21 00:00:00 -0400"},"longitude":-122.3808289,"id":"adv9lt611wop","location":"CA: San Francisco Int'l Airport"},"type":"Feature","geometry":{"type":"Point","coordinates":[-122.3808289,37.621302]}},{"properties":{"latitude":46.8194451,"column_5":1,"date":{"end_time":"2011/10/19 00:00:00 -0400","original":"10/18/2011","granularity":"day","time":"2011/10/18 00:00:00 -0400"},"longitude":-84.4091606,"id":"adv9lsydfcpk","location":"Haviland Bay"},"type":"Feature","geometry":{"type":"Point","coordinates":[-84.4091606,46.8194451]}},{"properties":{"latitude":47.59795,"column_5":1,"date":{"end_time":"2011/10/19 00:00:00 -0400","original":"10/18/2011","granularity":"day","time":"2011/10/18 00:00:00 -0400"},"longitude":-84.7567389,"id":"adv9lsusqm3m","location":"Lake Superior Provincial Park"},"type":"Feature","geometry":{"type":"Point","coordinates":[-84.7567389,47.59795]}},{"properties":{"latitude":46.52395,"column_5":1,"date":{"end_time":"2011/10/19 00:00:00 -0400","original":"10/18/2011","granularity":"day","time":"2011/10/18 00:00:00 -0400"},"longitude":-84.327373,"id":"adv9lsrn2u5m","location":"Sault Ste Marie"},"type":"Feature","geometry":{"type":"Point","coordinates":[-84.327373,46.52395]}},{"properties":{"latitude":46.40532,"column_5":1,"date":{"end_time":"2011/10/19 00:00:00 -0400","original":"10/18/2011","granularity":"day","time":"2011/10/18 00:00:00 -0400"},"longitude":-84.57225,"id":"adv9lss0q8mp","location":"Brimley"},"type":"Feature","geometry":{"type":"Point","coordinates":[-84.57225,46.40532]}},{"properties":{"latitude":45.8455428,"column_5":1,"date":{"end_time":"2011/11/21 00:00:00 -0500","original":"11/20/2011","granularity":"day","time":"2011/11/20 00:00:00 -0500"},"longitude":-84.7231293,"id":"adv9lsu7kmk0","location":"MI: Mackinac Bridge"},"type":"Feature","geometry":{"type":"Point","coordinates":[-84.7231293,45.8455428]}},{"properties":{"latitude":40.1480897,"column_5":1,"date":{"end_time":"2011/11/22 00:00:00 -0500","original":"11/21/2011","granularity":"day","time":"2011/11/21 00:00:00 -0500"},"longitude":-88.8772917,"id":"adv9lt3ffzyy","location":"Clinton Lake SRA--West Side Day Use &amp; Boat Access (De Witt Co.)"},"type":"Feature","geometry":{"type":"Point","coordinates":[-88.8772917,40.1480897]}},{"properties":{"latitude":18.0112333,"column_5":1,"date":{"end_time":"2011/12/03 00:00:00 -0500","original":"12/2/2011","granularity":"day","time":"2011/12/02 00:00:00 -0500"},"longitude":-67.109,"id":"adv9lt540c2d","location":"Laguna Cartegena - West End"},"type":"Feature","geometry":{"type":"Point","coordinates":[-67.109,18.0112333]}},{"properties":{"latitude":17.9379249,"column_5":1,"date":{"end_time":"2011/12/03 00:00:00 -0500","original":"12/2/2011","granularity":"day","time":"2011/12/02 00:00:00 -0500"},"longitude":-67.1893375,"id":"adv9lsr1ogmh","location":"PR: Cabo Rojo"},"type":"Feature","geometry":{"type":"Point","coordinates":[-67.1893375,17.9379249]}},{"properties":{"latitude":17.97142,"column_5":1,"date":{"end_time":"2011/12/03 00:00:00 -0500","original":"12/2/2011","granularity":"day","time":"2011/12/02 00:00:00 -0500"},"longitude":-66.8686,"id":"adv9lt2ipywi","location":"Bosque Estatal de Gunica"},"type":"Feature","geometry":{"type":"Point","coordinates":[-66.8686,17.97142]}},{"properties":{"latitude":17.9762091,"column_5":1,"date":{"end_time":"2011/12/03 00:00:00 -0500","original":"12/2/2011","granularity":"day","time":"2011/12/02 00:00:00 -0500"},"longitude":-67.0537663,"id":"adv9lt4t4y8w","location":"La Parguera--town and nearest environs"},"type":"Feature","geometry":{"type":"Point","coordinates":[-67.0537663,17.9762091]}},{"properties":{"latitude":18.0115505,"column_5":1,"date":{"end_time":"2011/12/03 00:00:00 -0500","original":"12/2/2011","granularity":"day","time":"2011/12/02 00:00:00 -0500"},"longitude":-66.8862769,"id":"adv9lsrhntfm","location":"PR: Palomas"},"type":"Feature","geometry":{"type":"Point","coordinates":[-66.8862769,18.0115505]}},{"properties":{"latitude":18.4891345,"column_5":1,"date":{"end_time":"2011/12/04 00:00:00 -0500","original":"12/3/2011","granularity":"day","time":"2011/12/03 00:00:00 -0500"},"longitude":-66.8677464,"id":"adv9lt0rv732","location":"Charca Salobre Los Amadores"},"type":"Feature","geometry":{"type":"Point","coordinates":[-66.8677464,18.4891345]}},{"properties":{"latitude":18.4842504,"column_5":1,"date":{"end_time":"2011/12/04 00:00:00 -0500","original":"12/3/2011","granularity":"day","time":"2011/12/03 00:00:00 -0500"},"longitude":-66.7793318,"id":"adv9lsv1mueo","location":"PR: Arecibo"},"type":"Feature","geometry":{"type":"Point","coordinates":[-66.7793318,18.4842504]}},{"properties":{"latitude":18.15033,"column_5":1,"date":{"end_time":"2011/12/04 00:00:00 -0500","original":"12/3/2011","granularity":"day","time":"2011/12/03 00:00:00 -0500"},"longitude":-66.99281,"id":"adv9lsyeltms","location":"Bosque Estatal de Maricao"},"type":"Feature","geometry":{"type":"Point","coordinates":[-66.99281,18.15033]}},{"properties":{"latitude":18.2220854,"column_5":1,"date":{"end_time":"2011/12/04 00:00:00 -0500","original":"12/3/2011","granularity":"day","time":"2011/12/03 00:00:00 -0500"},"longitude":-66.2024546,"id":"adv9lssv6brd","location":"Escolar Superior Sabana (Plain Pigeon spot)"},"type":"Feature","geometry":{"type":"Point","coordinates":[-66.2024546,18.2220854]}},{"properties":{"latitude":18.34048,"column_5":1,"date":{"end_time":"2011/12/04 00:00:00 -0500","original":"12/3/2011","granularity":"day","time":"2011/12/03 00:00:00 -0500"},"longitude":-66.70874,"id":"adv9lt26gl8b","location":"Bosque Estatal de Ro Abajo"},"type":"Feature","geometry":{"type":"Point","coordinates":[-66.70874,18.34048]}},{"properties":{"latitude":18.0788778,"column_5":1,"date":{"end_time":"2011/12/04 00:00:00 -0500","original":"12/3/2011","granularity":"day","time":"2011/12/03 00:00:00 -0500"},"longitude":-66.9628378,"id":"adv9lsu2tm0i","location":"PR: Sabana Grande"},"type":"Feature","geometry":{"type":"Point","coordinates":[-66.9628378,18.0788778]}},{"properties":{"latitude":18.1504139,"column_5":1,"date":{"end_time":"2011/12/05 00:00:00 -0500","original":"12/4/2011","granularity":"day","time":"2011/12/04 00:00:00 -0500"},"longitude":-65.7714861,"id":"adv9lsutqi8f","location":"Humacao Wildlife Refuge"},"type":"Feature","geometry":{"type":"Point","coordinates":[-65.7714861,18.1504139]}},{"properties":{"latitude":18.328049,"column_5":1,"date":{"end_time":"2011/12/05 00:00:00 -0500","original":"12/4/2011","granularity":"day","time":"2011/12/04 00:00:00 -0500"},"longitude":-65.6511732,"id":"adv9lt42d2qx","location":"PR: Fajardo"},"type":"Feature","geometry":{"type":"Point","coordinates":[-65.6511732,18.328049]}},{"properties":{"latitude":18.3651667,"column_5":1,"date":{"end_time":"2011/12/06 00:00:00 -0500","original":"12/5/2011","granularity":"day","time":"2011/12/05 00:00:00 -0500"},"longitude":-65.6332833,"id":"adv9lswi5mbi","location":"Las Croabas"},"type":"Feature","geometry":{"type":"Point","coordinates":[-65.6332833,18.3651667]}},{"properties":{"latitude":18.3310623,"column_5":1,"date":{"end_time":"2011/12/07 00:00:00 -0500","original":"12/6/2011","granularity":"day","time":"2011/12/06 00:00:00 -0500"},"longitude":-65.7638168,"id":"adv9lt525gi4","location":"Bosque Nacional El Yunque"},"type":"Feature","geometry":{"type":"Point","coordinates":[-65.7638168,18.3310623]}},{"properties":{"latitude":9.1692122,"column_5":1,"date":{"end_time":"2011/12/09 00:00:00 -0500","original":"12/8/2011","granularity":"day","time":"2011/12/08 00:00:00 -0500"},"longitude":-78.796393,"id":"adv9lt4fqlob","location":"Bayano Lake bridge"},"type":"Feature","geometry":{"type":"Point","coordinates":[-78.796393,9.1692122]}},{"properties":{"latitude":9.1606646,"column_5":1,"date":{"end_time":"2011/12/09 00:00:00 -0500","original":"12/8/2011","granularity":"day","time":"2011/12/08 00:00:00 -0500"},"longitude":-78.704429,"id":"adv9lt0g2s6f","location":"PAN: Bayano Lake trails"},"type":"Feature","geometry":{"type":"Point","coordinates":[-78.704429,9.1606646]}},{"properties":{"latitude":8.3354245,"column_5":1,"date":{"end_time":"2011/12/10 00:00:00 -0500","original":"12/9/2011","granularity":"day","time":"2011/12/09 00:00:00 -0500"},"longitude":-77.8154806,"id":"adv9lt3w6xgn","location":"PAN: El Salto Forest"},"type":"Feature","geometry":{"type":"Point","coordinates":[-77.8154806,8.3354245]}},{"properties":{"latitude":8.2171501,"column_5":1,"date":{"end_time":"2011/12/10 00:00:00 -0500","original":"12/9/2011","granularity":"day","time":"2011/12/09 00:00:00 -0500"},"longitude":-77.7518371,"id":"adv9lswme0l1","location":"Yaviza wetlands"},"type":"Feature","geometry":{"type":"Point","coordinates":[-77.7518371,8.2171501]}},{"properties":{"latitude":8.1762872,"column_5":1,"date":{"end_time":"2011/12/10 00:00:00 -0500","original":"12/9/2011","granularity":"day","time":"2011/12/09 00:00:00 -0500"},"longitude":-77.7094797,"id":"adv9lt1utnbw","location":"Yaviza forest"},"type":"Feature","geometry":{"type":"Point","coordinates":[-77.7094797,8.1762872]}},{"properties":{"latitude":8.4992084,"column_5":1,"date":{"end_time":"2011/12/10 00:00:00 -0500","original":"12/9/2011","granularity":"day","time":"2011/12/09 00:00:00 -0500"},"longitude":-77.9730657,"id":"adv9lssgsf85","location":"PAN: Meteti"},"type":"Feature","geometry":{"type":"Point","coordinates":[-77.9730657,8.4992084]}},{"properties":{"latitude":9.2140443,"column_5":1,"date":{"end_time":"2011/12/11 00:00:00 -0500","original":"12/10/2011","granularity":"day","time":"2011/12/10 00:00:00 -0500"},"longitude":-78.9790872,"id":"adv9lt2wc7wp","location":"PAN: Nusagandi rice fields"},"type":"Feature","geometry":{"type":"Point","coordinates":[-78.9790872,9.2140443]}},{"properties":{"latitude":9.063493,"column_5":1,"date":{"end_time":"2011/12/12 00:00:00 -0500","original":"12/11/2011","granularity":"day","time":"2011/12/11 00:00:00 -0500"},"longitude":-79.3611611,"id":"adv9lt6z6kw2","location":"Tocumen Marsh"},"type":"Feature","geometry":{"type":"Point","coordinates":[-79.3611611,9.063493]}},{"properties":{"latitude":9.0096583,"column_5":1,"date":{"end_time":"2011/12/14 00:00:00 -0500","original":"12/13/2011","granularity":"day","time":"2011/12/13 00:00:00 -0500"},"longitude":-79.4691889,"id":"adv9lt00wi4v","location":"Ciudad de Panama--Costa del Este"},"type":"Feature","geometry":{"type":"Point","coordinates":[-79.4691889,9.0096583]}},{"properties":{"latitude":8.9397322,"column_5":1,"date":{"end_time":"2011/12/14 00:00:00 -0500","original":"12/13/2011","granularity":"day","time":"2011/12/13 00:00:00 -0500"},"longitude":-79.5547107,"id":"adv9lt6ma7hn","location":"PAN: Panama City--Amador"},"type":"Feature","geometry":{"type":"Point","coordinates":[-79.5547107,8.9397322]}},{"properties":{"latitude":8.111682,"column_5":1,"date":{"end_time":"2011/12/15 00:00:00 -0500","original":"12/14/2011","granularity":"day","time":"2011/12/14 00:00:00 -0500"},"longitude":-80.583836,"id":"adv9lssewfkz","location":"Cienaga Las Macanas"},"type":"Feature","geometry":{"type":"Point","coordinates":[-80.583836,8.111682]}},{"properties":{"latitude":8.2029632,"column_5":1,"date":{"end_time":"2011/12/15 00:00:00 -0500","original":"12/14/2011","granularity":"day","time":"2011/12/14 00:00:00 -0500"},"longitude":-80.508161,"id":"adv9lsw7yq1e","location":"Aguadulce salt ponds"},"type":"Feature","geometry":{"type":"Point","coordinates":[-80.508161,8.2029632]}},{"properties":{"latitude":7.9905469,"column_5":1,"date":{"end_time":"2011/12/15 00:00:00 -0500","original":"12/14/2011","granularity":"day","time":"2011/12/14 00:00:00 -0500"},"longitude":-80.4063014,"id":"adv9lt6q5vpx","location":"PAN: Chitre--Airport and Playa Agallito"},"type":"Feature","geometry":{"type":"Point","coordinates":[-80.4063014,7.9905469]}},{"properties":{"latitude":8.4659202,"column_5":1,"date":{"end_time":"2011/12/16 00:00:00 -0500","original":"12/15/2011","granularity":"day","time":"2011/12/15 00:00:00 -0500"},"longitude":-80.4018596,"id":"adv9lsxf8qpo","location":"PAN: Penonome grasslands"},"type":"Feature","geometry":{"type":"Point","coordinates":[-80.4018596,8.4659202]}},{"properties":{"latitude":8.6680405,"column_5":1,"date":{"end_time":"2011/12/16 00:00:00 -0500","original":"12/15/2011","granularity":"day","time":"2011/12/15 00:00:00 -0500"},"longitude":-80.5926247,"id":"adv9lt5yp4a1","location":"PN Omar Torrijos (El Cope)"},"type":"Feature","geometry":{"type":"Point","coordinates":[-80.5926247,8.6680405]}},{"properties":{"latitude":8.9949993,"column_5":1,"date":{"end_time":"2011/12/17 00:00:00 -0500","original":"12/16/2011","granularity":"day","time":"2011/12/16 00:00:00 -0500"},"longitude":-79.5459294,"id":"adv9lt71x7hb","location":"Parque Natural Metropolitano"},"type":"Feature","geometry":{"type":"Point","coordinates":[-79.5459294,8.9949993]}},{"properties":{"latitude":8.9674722,"column_5":1,"date":{"end_time":"2011/12/17 00:00:00 -0500","original":"12/16/2011","granularity":"day","time":"2011/12/16 00:00:00 -0500"},"longitude":-79.5722361,"id":"adv9lsy66rtv","location":"Ciudad de Panama--Manglares de Diablo"},"type":"Feature","geometry":{"type":"Point","coordinates":[-79.5722361,8.9674722]}},{"properties":{"latitude":8.5497559,"column_5":1,"date":{"end_time":"2011/12/17 00:00:00 -0500","original":"12/16/2011","granularity":"day","time":"2011/12/16 00:00:00 -0500"},"longitude":-80.1597742,"id":"adv9lt1q4tnc","location":"PAN: El Valle Road"},"type":"Feature","geometry":{"type":"Point","coordinates":[-80.1597742,8.5497559]}},{"properties":{"latitude":8.7255375,"column_5":1,"date":{"end_time":"2011/12/18 00:00:00 -0500","original":"12/17/2011","granularity":"day","time":"2011/12/17 00:00:00 -0500"},"longitude":-79.2987207,"id":"adv9lsy740zc","location":"Pearl Islands ferry"},"type":"Feature","geometry":{"type":"Point","coordinates":[-79.2987207,8.7255375]}},{"properties":{"latitude":8.453,"column_5":1,"date":{"end_time":"2011/12/18 00:00:00 -0500","original":"12/17/2011","granularity":"day","time":"2011/12/17 00:00:00 -0500"},"longitude":-78.936,"id":"adv9lsuop9g7","location":"San Miguel, Isla del Rey"},"type":"Feature","geometry":{"type":"Point","coordinates":[-78.936,8.453]}},{"properties":{"latitude":9.176025,"column_5":1,"date":{"end_time":"2011/12/19 00:00:00 -0500","original":"12/18/2011","granularity":"day","time":"2011/12/18 00:00:00 -0500"},"longitude":-79.7677611,"id":"adv9lt0riw7i","location":"Pipeline Road  (Camino Oleoducto)"},"type":"Feature","geometry":{"type":"Point","coordinates":[-79.7677611,9.176025]}},{"properties":{"latitude":9.0616264,"column_5":1,"date":{"end_time":"2011/12/20 00:00:00 -0500","original":"12/19/2011","granularity":"day","time":"2011/12/19 00:00:00 -0500"},"longitude":-79.6495271,"id":"adv9lsy4ksyd","location":"Summit Ponds"},"type":"Feature","geometry":{"type":"Point","coordinates":[-79.6495271,9.0616264]}},{"properties":{"latitude":9.116227,"column_5":1,"date":{"end_time":"2011/12/20 00:00:00 -0500","original":"12/19/2011","granularity":"day","time":"2011/12/19 00:00:00 -0500"},"longitude":-79.701943,"id":"adv9lsybvy2q","location":"Gamboa"},"type":"Feature","geometry":{"type":"Point","coordinates":[-79.701943,9.116227]}},{"properties":{"latitude":9.06846,"column_5":1,"date":{"end_time":"2011/12/20 00:00:00 -0500","original":"12/19/2011","granularity":"day","time":"2011/12/19 00:00:00 -0500"},"longitude":-79.3866113,"id":"adv9lt281bly","location":"PAN: Tocumen International Airport"},"type":"Feature","geometry":{"type":"Point","coordinates":[-79.3866113,9.06846]}},{"properties":{"latitude":39.01691,"column_5":1,"date":{"end_time":"2011/12/22 00:00:00 -0500","original":"12/21/2011","granularity":"day","time":"2011/12/21 00:00:00 -0500"},"longitude":-94.28163,"id":"adv9lt1srb9g","location":"Blue Springs"},"type":"Feature","geometry":{"type":"Point","coordinates":[-94.28163,39.01691]}},{"properties":{"latitude":39.3958,"column_5":1,"date":{"end_time":"2011/12/22 00:00:00 -0500","original":"12/21/2011","granularity":"day","time":"2011/12/21 00:00:00 -0500"},"longitude":-101.05243,"id":"adv9lsykn4t8","location":"Colby"},"type":"Feature","geometry":{"type":"Point","coordinates":[-101.05243,39.3958]}},{"properties":{"latitude":50.0595816,"column_5":1,"date":{"end_time":"2012/01/04 00:00:00 -0500","original":"1/3/2012","granularity":"day","time":"2012/01/03 00:00:00 -0500"},"longitude":8.5790363,"id":"adv9lt1fit2w","location":"GER: Frankfurt-am-main International Airport"},"type":"Feature","geometry":{"type":"Point","coordinates":[8.5790363,50.0595816]}},{"properties":{"latitude":40.9780837,"column_5":1,"date":{"end_time":"2012/01/04 00:00:00 -0500","original":"1/3/2012","granularity":"day","time":"2012/01/03 00:00:00 -0500"},"longitude":28.8173103,"id":"adv9lt4hprox","location":"Atatrk Airport"},"type":"Feature","geometry":{"type":"Point","coordinates":[28.8173103,40.9780837]}},{"properties":{"latitude":37.9414392,"column_5":1,"date":{"end_time":"2012/01/05 00:00:00 -0500","original":"1/4/2012","granularity":"day","time":"2012/01/04 00:00:00 -0500"},"longitude":27.3420846,"id":"adv9lsrhc288","location":"Efes"},"type":"Feature","geometry":{"type":"Point","coordinates":[27.3420846,37.9414392]}},{"properties":{"latitude":37.9527772,"column_5":1,"date":{"end_time":"2012/01/05 00:00:00 -0500","original":"1/4/2012","granularity":"day","time":"2012/01/04 00:00:00 -0500"},"longitude":27.3668901,"id":"adv9lsx92ro6","location":"Selcuk--St. John's Basilica"},"type":"Feature","geometry":{"type":"Point","coordinates":[27.3668901,37.9527772]}},{"properties":{"latitude":37.9112994,"column_5":1,"date":{"end_time":"2012/01/05 00:00:00 -0500","original":"1/4/2012","granularity":"day","time":"2012/01/04 00:00:00 -0500"},"longitude":27.3344135,"id":"adv9lt12ez11","location":"The Virgin Mary's Natural and Cultural Park"},"type":"Feature","geometry":{"type":"Point","coordinates":[27.3344135,37.9112994]}},{"properties":{"latitude":38.8143705,"column_5":1,"date":{"end_time":"2012/01/06 00:00:00 -0500","original":"1/5/2012","granularity":"day","time":"2012/01/05 00:00:00 -0500"},"longitude":26.9797607,"id":"adv9lsy4kb8k","location":"TR: Aliaga"},"type":"Feature","geometry":{"type":"Point","coordinates":[26.9797607,38.8143705]}},{"properties":{"latitude":38.4412924,"column_5":1,"date":{"end_time":"2012/01/06 00:00:00 -0500","original":"1/5/2012","granularity":"day","time":"2012/01/05 00:00:00 -0500"},"longitude":27.175798,"id":"adv9lt6r32y8","location":"TR: Izmir"},"type":"Feature","geometry":{"type":"Point","coordinates":[27.175798,38.4412924]}},{"properties":{"latitude":39.1311305,"column_5":1,"date":{"end_time":"2012/01/06 00:00:00 -0500","original":"1/5/2012","granularity":"day","time":"2012/01/05 00:00:00 -0500"},"longitude":27.1841236,"id":"adv9lt21mgy2","location":"Pergamon--Acropolis and Asclepion"},"type":"Feature","geometry":{"type":"Point","coordinates":[27.1841236,39.1311305]}},{"properties":{"latitude":39.3158149,"column_5":1,"date":{"end_time":"2012/01/07 00:00:00 -0500","original":"1/6/2012","granularity":"day","time":"2012/01/06 00:00:00 -0500"},"longitude":26.6944603,"id":"adv9lt29t34p","location":"TR: Ayvalik"},"type":"Feature","geometry":{"type":"Point","coordinates":[26.6944603,39.3158149]}},{"properties":{"latitude":39.9563379,"column_5":1,"date":{"end_time":"2012/01/08 00:00:00 -0500","original":"1/7/2012","granularity":"day","time":"2012/01/07 00:00:00 -0500"},"longitude":26.2416168,"id":"adv9lt2ne5is","location":"Troya Tarihi Milli Park"},"type":"Feature","geometry":{"type":"Point","coordinates":[26.2416168,39.9563379]}},{"properties":{"latitude":40.2313564,"column_5":1,"date":{"end_time":"2012/01/09 00:00:00 -0500","original":"1/8/2012","granularity":"day","time":"2012/01/08 00:00:00 -0500"},"longitude":26.2873654,"id":"adv9lt09l7as","location":"Gallipoli Peninsula Historical NP"},"type":"Feature","geometry":{"type":"Point","coordinates":[26.2873654,40.2313564]}},{"properties":{"latitude":41.0119324,"column_5":1,"date":{"end_time":"2012/01/10 00:00:00 -0500","original":"1/9/2012","granularity":"day","time":"2012/01/09 00:00:00 -0500"},"longitude":28.9836502,"id":"adv9lsqvt7m6","location":"Istanbul--Topkapi Palace"},"type":"Feature","geometry":{"type":"Point","coordinates":[28.9836502,41.0119324]}},{"properties":{"latitude":41.0278304,"column_5":1,"date":{"end_time":"2012/01/11 00:00:00 -0500","original":"1/10/2012","granularity":"day","time":"2012/01/10 00:00:00 -0500"},"longitude":28.9973831,"id":"adv9lsuuazxs","location":"Istanbul--IBA Bogazii (Bosphorus)"},"type":"Feature","geometry":{"type":"Point","coordinates":[28.9973831,41.0278304]}},{"properties":{"latitude":41.0481636,"column_5":1,"date":{"end_time":"2012/01/15 00:00:00 -0500","original":"1/14/2012","granularity":"day","time":"2012/01/14 00:00:00 -0500"},"longitude":29.0152355,"id":"adv9lsr2fm7k","location":"Istanbul--Yildiz Park"},"type":"Feature","geometry":{"type":"Point","coordinates":[29.0152355,41.0481636]}},{"properties":{"latitude":40.720206,"column_5":1,"date":{"end_time":"2012/01/16 00:00:00 -0500","original":"1/15/2012","granularity":"day","time":"2012/01/15 00:00:00 -0500"},"longitude":32.0630832,"id":"adv9lsrbh6sv","location":"Dortdivan area"},"type":"Feature","geometry":{"type":"Point","coordinates":[32.0630832,40.720206]}},{"properties":{"latitude":40.7176689,"column_5":1,"date":{"end_time":"2012/01/16 00:00:00 -0500","original":"1/15/2012","granularity":"day","time":"2012/01/15 00:00:00 -0500"},"longitude":30.2602096,"id":"adv9lsy4a12w","location":"Lake Sapanca"},"type":"Feature","geometry":{"type":"Point","coordinates":[30.2602096,40.7176689]}},{"properties":{"latitude":40.8047085,"column_5":1,"date":{"end_time":"2012/01/16 00:00:00 -0500","original":"1/15/2012","granularity":"day","time":"2012/01/15 00:00:00 -0500"},"longitude":32.1926615,"id":"adv9lsz7xpkl","location":"Gerede--Hotel Esentepe"},"type":"Feature","geometry":{"type":"Point","coordinates":[32.1926615,40.8047085]}},{"properties":{"latitude":40.0855167,"column_5":1,"date":{"end_time":"2012/01/17 00:00:00 -0500","original":"1/16/2012","granularity":"day","time":"2012/01/16 00:00:00 -0500"},"longitude":31.6365913,"id":"adv9lsqucgcd","location":"Sariyar Baraji--Cayirhan arm"},"type":"Feature","geometry":{"type":"Point","coordinates":[31.6365913,40.0855167]}},{"properties