{"type":"FeatureCollection","data_type":"Dataset","url_type":null,"permissions":[{"permissions":{"download":true,"view":true},"group_id":"everyone"}],"classification":null,"title":"L. Harter eBird map","count":1434,"stream_id":351143,"contributor":{"url":"http://geocommons.com/users/70808","name":"lbharter"},"data_attributes":null,"calculation_params":null,"icon_link":null,"link":"http://geocommons.com/overlays/351143.json","extent":[-157.939,9.54754,-66.9526,48.5728],"geometry_types":["point"],"unique_name":null,"name":"L. Harter eBird map","feature_count":1434,"description":"A map of my eBird locations","next_feature":null,"is_raster":false,"short_classification":"Y","stats":{"column_5":{"max":366,"variance":179.668246775297,"mean":3.43584379358438,"stdev":13.404038450232,"min":1,"median":1},"latitude":{"max":48.5728456,"variance":32.2814893135913,"mean":35.8312562546025,"stdev":5.68168014882845,"min":9.5475356,"median":35.0116506},"date":{"max":"2013/04/19 00:00:00 -0400","variance":6.74420245463386e+15,"mean":"2009/11/06 12:44:36 -0500","stdev":82123093.3089704,"min":"1996/08/11 00:00:00 -0400","median":"2010/05/31 00:00:00 -0400"},"longitude":{"max":-66.9525743,"variance":123.562490766226,"mean":-112.380201837936,"stdev":11.1158666223658,"min":-157.9388321,"median":-114.4490433}},"features":[{"properties":{"latitude":10.28173,"column_5":366,"date":{"end_time":"2009/02/14 00:00:00 -0500","original":"2/13/2009","granularity":"day","time":"2009/02/13 00:00:00 -0500"},"longitude":-84.04489,"id":"advbt5zl6evw","location":"Rara Avis"},"type":"Feature","geometry":{"type":"Point","coordinates":[-84.04489,10.28173]}},{"properties":{"latitude":34.4639664,"column_5":173,"date":{"end_time":"2008/10/09 00:00:00 -0400","original":"10/8/2008","granularity":"day","time":"2008/10/08 00:00:00 -0400"},"longitude":-114.3436432,"id":"advbt5r4wupf","location":"Lake Havasu City--Rotary Park"},"type":"Feature","geometry":{"type":"Point","coordinates":[-114.3436432,34.4639664]}},{"properties":{"latitude":35.1896977,"column_5":164,"date":{"end_time":"2004/06/14 00:00:00 -0400","original":"6/13/2004","granularity":"day","time":"2004/06/13 00:00:00 -0400"},"longitude":-111.655941,"id":"advbt661omxc","location":"NAU Campus"},"type":"Feature","geometry":{"type":"Point","coordinates":[-111.655941,35.1896977]}},{"properties":{"latitude":34.5206616,"column_5":115,"date":{"end_time":"2008/12/04 00:00:00 -0500","original":"12/3/2008","granularity":"day","time":"2008/12/03 00:00:00 -0500"},"longitude":-114.3709052,"id":"advbt5qqb6h6","location":"Lake Havasu--North end viewpoint"},"type":"Feature","geometry":{"type":"Point","coordinates":[-114.3709052,34.5206616]}},{"properties":{"latitude":34.2915899,"column_5":74,"date":{"end_time":"2010/02/19 00:00:00 -0500","original":"2/18/2010","granularity":"day","time":"2010/02/18 00:00:00 -0500"},"longitude":-114.1051766,"id":"advbt5t3w003","location":"Bill Williams NWR--Headquarters"},"type":"Feature","geometry":{"type":"Point","coordinates":[-114.1051766,34.2915899]}},{"properties":{"latitude":34.460145,"column_5":72,"date":{"end_time":"2008/12/04 00:00:00 -0500","original":"12/3/2008","granularity":"day","time":"2008/12/03 00:00:00 -0500"},"longitude":-114.3728685,"id":"advbt61sod41","location":"Lake Havasu City--N Pittsburgh Pt"},"type":"Feature","geometry":{"type":"Point","coordinates":[-114.3728685,34.460145]}},{"properties":{"latitude":44.5568802,"column_5":70,"date":{"end_time":"2008/05/17 00:00:00 -0400","original":"5/16/2008","granularity":"day","time":"2008/05/16 00:00:00 -0400"},"longitude":-67.4355054,"id":"advbt60gobo8","location":"Brothers Island"},"type":"Feature","geometry":{"type":"Point","coordinates":[-67.4355054,44.5568802]}},{"properties":{"latitude":34.3014718,"column_5":69,"date":{"end_time":"2010/12/20 00:00:00 -0500","original":"12/19/2010","granularity":"day","time":"2010/12/19 00:00:00 -0500"},"longitude":-114.0979528,"id":"advbt64oc885","location":"Bill Williams River NWR (Mohave Co.)"},"type":"Feature","geometry":{"type":"Point","coordinates":[-114.0979528,34.3014718]}},{"properties":{"latitude":34.2817396,"column_5":64,"date":{"end_time":"2011/02/22 00:00:00 -0500","original":"2/21/2011","granularity":"day","time":"2011/02/21 00:00:00 -0500"},"longitude":-114.0692,"id":"advbt5z7vpgg","location":"Bill Williams NWR--Mosquito Flat (mile 2.0)"},"type":"Feature","geometry":{"type":"Point","coordinates":[-114.0692,34.2817396]}},{"properties":{"latitude":34.451493,"column_5":62,"date":{"end_time":"2008/09/25 00:00:00 -0400","original":"9/24/2008","granularity":"day","time":"2008/09/24 00:00:00 -0400"},"longitude":-114.3715382,"id":"advbt5yzzrsq","location":"Lake Havasu--Site 6"},"type":"Feature","geometry":{"type":"Point","coordinates":[-114.3715382,34.451493]}},{"properties":{"latitude":34.4852996,"column_5":56,"date":{"end_time":"2010/12/13 00:00:00 -0500","original":"12/12/2010","granularity":"day","time":"2010/12/12 00:00:00 -0500"},"longitude":-114.3048155,"id":"advbt5wqb7yw","location":"2841 McCulloch Blvd LHC"},"type":"Feature","geometry":{"type":"Point","coordinates":[-114.3048155,34.4852996]}},{"properties":{"latitude":34.4740146,"column_5":51,"date":{"end_time":"2010/11/23 00:00:00 -0500","original":"11/22/2010","granularity":"day","time":"2010/11/22 00:00:00 -0500"},"longitude":-114.3972015,"id":"advbt5xi4gr7","location":"Lake Havasu (CA)"},"type":"Feature","geometry":{"type":"Point","coordinates":[-114.3972015,34.4740146]}},{"properties":{"latitude":34.132,"column_5":48,"date":{"end_time":"2011/01/09 00:00:00 -0500","original":"1/8/2011","granularity":"day","time":"2011/01/08 00:00:00 -0500"},"longitude":-114.333,"id":"advbt65qh15p","location":"Ahakhav Tribal Preserve"},"type":"Feature","geometry":{"type":"Point","coordinates":[-114.333,34.132]}},{"properties":{"latitude":34.4621619,"column_5":43,"date":{"end_time":"2011/01/12 00:00:00 -0500","original":"1/11/2011","granularity":"day","time":"2011/01/11 00:00:00 -0500"},"longitude":-114.3579769,"id":"advbt5zipmo5","location":"Lake Havasu City WTP"},"type":"Feature","geometry":{"type":"Point","coordinates":[-114.3579769,34.4621619]}},{"properties":{"latitude":33.935574,"column_5":42,"date":{"end_time":"2010/01/30 00:00:00 -0500","original":"1/29/2010","granularity":"day","time":"2010/01/29 00:00:00 -0500"},"longitude":-114.4262701,"id":"advbt5pmervj","location":"Colorado River Indian Reservation"},"type":"Feature","geometry":{"type":"Point","coordinates":[-114.4262701,33.935574]}},{"properties":{"latitude":34.294122,"column_5":42,"date":{"end_time":"2010/10/18 00:00:00 -0400","original":"10/17/2010","granularity":"day","time":"2010/10/17 00:00:00 -0400"},"longitude":-114.140623,"id":"advbt5ujslcx","location":"Parker Dam (CA)"},"type":"Feature","geometry":{"type":"Point","coordinates":[-114.140623,34.294122]}},{"properties":{"latitude":34.2672185,"column_5":40,"date":{"end_time":"2010/12/30 00:00:00 -0500","original":"12/29/2010","granularity":"day","time":"2010/12/29 00:00:00 -0500"},"longitude":-114.0457249,"id":"advbt649sr9e","location":"Bill Williams NWR - end of rd to Kohen Ranch (LP)"},"type":"Feature","geometry":{"type":"Point","coordinates":[-114.0457249,34.2672185]}},{"properties":{"latitude":34.5157068,"column_5":36,"date":{"end_time":"2011/01/04 00:00:00 -0500","original":"1/3/2011","granularity":"day","time":"2011/01/03 00:00:00 -0500"},"longitude":-114.3438363,"id":"advbt5rlb2jl","location":"Nautilus Elementary"},"type":"Feature","geometry":{"type":"Point","coordinates":[-114.3438363,34.5157068]}},{"properties":{"latitude":34.8931622,"column_5":34,"date":{"end_time":"2003/04/30 00:00:00 -0400","original":"4/29/2003","granularity":"day","time":"2003/04/29 00:00:00 -0400"},"longitude":-117.0314312,"id":"advbt620qpm1","location":"Barstow"},"type":"Feature","geometry":{"type":"Point","coordinates":[-117.0314312,34.8931622]}},{"properties":{"latitude":34.8360021,"column_5":33,"date":{"end_time":"2010/12/25 00:00:00 -0500","original":"12/24/2010","granularity":"day","time":"2010/12/24 00:00:00 -0500"},"longitude":-114.5187539,"id":"advbt61j0yda","location":"Havasu NWR--Pintail Slough/North Dike"},"type":"Feature","geometry":{"type":"Point","coordinates":[-114.5187539,34.8360021]}},{"properties":{"latitude":35.1837267,"column_5":32,"date":{"end_time":"2005/07/25 00:00:00 -0400","original":"7/24/2005","granularity":"day","time":"2005/07/24 00:00:00 -0400"},"longitude":-111.6315597,"id":"advbt617224j","location":"Rio de Flag--Willow Bend/Urban Trail"},"type":"Feature","geometry":{"type":"Point","coordinates":[-111.6315597,35.1837267]}},{"properties":{"latitude":34.2970718,"column_5":32,"date":{"end_time":"2010/11/22 00:00:00 -0500","original":"11/21/2010","granularity":"day","time":"2010/11/21 00:00:00 -0500"},"longitude":-114.1379466,"id":"advbt65tbdd3","location":"Parker Dam (AZ)"},"type":"Feature","geometry":{"type":"Point","coordinates":[-114.1379466,34.2970718]}},{"properties":{"latitude":34.4450698,"column_5":31,"date":{"end_time":"2011/01/12 00:00:00 -0500","original":"1/11/2011","granularity":"day","time":"2011/01/11 00:00:00 -0500"},"longitude":-114.3713665,"id":"advbt5s8awqu","location":"Lake Havasu--Site 6 (CA)"},"type":"Feature","geometry":{"type":"Point","coordinates":[-114.3713665,34.4450698]}},{"properties":{"latitude":34.891922,"column_5":28,"date":{"end_time":"2003/05/11 00:00:00 -0400","original":"5/10/2003","granularity":"day","time":"2003/05/10 00:00:00 -0400"},"longitude":-117.04377,"id":"advbt642m63x","location":"Foglesong Park"},"type":"Feature","geometry":{"type":"Point","coordinates":[-117.04377,34.891922]}},{"properties":{"latitude":35.112,"column_5":28,"date":{"end_time":"2004/10/17 00:00:00 -0400","original":"10/16/2004","granularity":"day","time":"2004/10/16 00:00:00 -0400"},"longitude":-111.69,"id":"advbt5z5cp1i","location":"Kachina Wetlands"},"type":"Feature","geometry":{"type":"Point","coordinates":[-111.69,35.112]}},{"properties":{"latitude":34.2091996,"column_5":28,"date":{"end_time":"2010/02/19 00:00:00 -0500","original":"2/18/2010","granularity":"day","time":"2010/02/18 00:00:00 -0500"},"longitude":-114.2248598,"id":"advbt5y3en5f","location":"Emerald Cove ponds"},"type":"Feature","geometry":{"type":"Point","coordinates":[-114.2248598,34.2091996]}},{"properties":{"latitude":34.2851211,"column_5":27,"date":{"end_time":"2009/11/19 00:00:00 -0500","original":"11/18/2009","granularity":"day","time":"2009/11/18 00:00:00 -0500"},"longitude":-119.2743312,"id":"advbt5wpjjwf","location":"1683 Buena Vista St"},"type":"Feature","geometry":{"type":"Point","coordinates":[-119.2743312,34.2851211]}},{"properties":{"latitude":40.9595163,"column_5":25,"date":{"end_time":"2009/08/27 00:00:00 -0400","original":"8/26/2009","granularity":"day","time":"2009/08/26 00:00:00 -0400"},"longitude":-83.657155,"id":"advbt5rz52fi","location":"Camp Berry"},"type":"Feature","geometry":{"type":"Point","coordinates":[-83.657155,40.9595163]}},{"properties":{"latitude":34.7657301,"column_5":24,"date":{"end_time":"2011/01/22 00:00:00 -0500","original":"1/21/2011","granularity":"day","time":"2011/01/21 00:00:00 -0500"},"longitude":-114.5350027,"id":"advbt6316tjv","location":"Havasu NWR--Beal Lake"},"type":"Feature","geometry":{"type":"Point","coordinates":[-114.5350027,34.7657301]}},{"properties":{"latitude":34.298352,"column_5":23,"date":{"end_time":"2011/05/15 00:00:00 -0400","original":"5/14/2011","granularity":"day","time":"2011/05/14 00:00:00 -0400"},"longitude":-114.1214705,"id":"advbt5y0owox","location":"Havasu Springs Resort"},"type":"Feature","geometry":{"type":"Point","coordinates":[-114.1214705,34.298352]}},{"properties":{"latitude":34.2965616,"column_5":22,"date":{"end_time":"2010/12/20 00:00:00 -0500","original":"12/19/2010","granularity":"day","time":"2010/12/19 00:00:00 -0500"},"longitude":-114.1405463,"id":"advbt62ffx3z","location":"Parker Dam--above (CA)"},"type":"Feature","geometry":{"type":"Point","coordinates":[-114.1405463,34.2965616]}},{"properties":{"latitude":34.1465028,"column_5":20,"date":{"end_time":"2008/09/26 00:00:00 -0400","original":"9/25/2008","granularity":"day","time":"2008/09/25 00:00:00 -0400"},"longitude":-114.30875,"id":"advbt5suk0xv","location":"Parker Oasis"},"type":"Feature","geometry":{"type":"Point","coordinates":[-114.30875,34.1465028]}},{"properties":{"latitude":34.7427586,"column_5":19,"date":{"end_time":"2009/11/18 00:00:00 -0500","original":"11/17/2009","granularity":"day","time":"2009/11/17 00:00:00 -0500"},"longitude":-114.4876456,"id":"advbt5upddga","location":"Havasu NWR--Catfish Paradise"},"type":"Feature","geometry":{"type":"Point","coordinates":[-114.4876456,34.7427586]}},{"properties":{"latitude":34.296,"column_5":18,"date":{"end_time":"2008/09/25 00:00:00 -0400","original":"9/24/2008","granularity":"day","time":"2008/09/24 00:00:00 -0400"},"longitude":-114.1,"id":"advbt5tw4k29","location":"Bill Williams River NWR (La Paz Co.)"},"type":"Feature","geometry":{"type":"Point","coordinates":[-114.1,34.296]}},{"properties":{"latitude":33.5928515,"column_5":18,"date":{"end_time":"2011/04/25 00:00:00 -0400","original":"4/24/2011","granularity":"day","time":"2011/04/24 00:00:00 -0400"},"longitude":-114.5979166,"id":"advbt5yoaklz","location":"Blythe WTP"},"type":"Feature","geometry":{"type":"Point","coordinates":[-114.5979166,33.5928515]}},{"properties":{"latitude":34.296792,"column_5":17,"date":{"end_time":"2008/12/04 00:00:00 -0500","original":"12/3/2008","granularity":"day","time":"2008/12/03 00:00:00 -0500"},"longitude":-114.1030598,"id":"advbt60ob8cr","location":"Bill Williams Delta La Paz/Mohave County"},"type":"Feature","geometry":{"type":"Point","coordinates":[-114.1030598,34.296792]}},{"properties":{"latitude":34.1699142,"column_5":17,"date":{"end_time":"2011/01/16 00:00:00 -0500","original":"1/15/2011","granularity":"day","time":"2011/01/15 00:00:00 -0500"},"longitude":-114.2724037,"id":"advbt5xlx83q","location":"Moovalya Lake/Headgate Dam (AZ)"},"type":"Feature","geometry":{"type":"Point","coordinates":[-114.2724037,34.1699142]}},{"properties":{"latitude":34.766,"column_5":16,"date":{"end_time":"2006/04/19 00:00:00 -0400","original":"4/18/2006","granularity":"day","time":"2006/04/18 00:00:00 -0400"},"longitude":-111.894,"id":"advbt5tj7e86","location":"Page Springs Fish Hatchery"},"type":"Feature","geometry":{"type":"Point","coordinates":[-111.894,34.766]}},{"properties":{"latitude":34.2678107,"column_5":16,"date":{"end_time":"2008/10/26 00:00:00 -0400","original":"10/25/2008","granularity":"day","time":"2008/10/25 00:00:00 -0400"},"longitude":-119.2347551,"id":"advbt5ujhvum","location":"Camino Real Park"},"type":"Feature","geometry":{"type":"Point","coordinates":[-119.2347551,34.2678107]}},{"properties":{"latitude":34.8662148,"column_5":16,"date":{"end_time":"2011/01/06 00:00:00 -0500","original":"1/5/2011","granularity":"day","time":"2011/01/05 00:00:00 -0500"},"longitude":-114.5714378,"id":"advbt5tqloo9","location":"Courtwright Rd"},"type":"Feature","geometry":{"type":"Point","coordinates":[-114.5714378,34.8662148]}},{"properties":{"latitude":35.0206708,"column_5":15,"date":{"end_time":"2004/09/19 00:00:00 -0400","original":"9/18/2004","granularity":"day","time":"2004/09/18 00:00:00 -0400"},"longitude":-111.4031728,"id":"advbt5qewk45","location":"Ashurst Lake"},"type":"Feature","geometry":{"type":"Point","coordinates":[-111.4031728,35.0206708]}},{"properties":{"latitude":35.0963162,"column_5":15,"date":{"end_time":"2011/02/05 00:00:00 -0500","original":"2/4/2011","granularity":"day","time":"2011/02/04 00:00:00 -0500"},"longitude":-113.8858223,"id":"advbt62e4diw","location":"Hualapai Mountain Park"},"type":"Feature","geometry":{"type":"Point","coordinates":[-113.8858223,35.0963162]}},{"properties":{"latitude":33.6901385,"column_5":15,"date":{"end_time":"2011/04/25 00:00:00 -0400","original":"4/24/2011","granularity":"day","time":"2011/04/24 00:00:00 -0400"},"longitude":-114.5309258,"id":"advbt62c3jim","location":"Palo Verde Ecological Reserve"},"type":"Feature","geometry":{"type":"Point","coordinates":[-114.5309258,33.6901385]}},{"properties":{"latitude":35.0123184,"column_5":14,"date":{"end_time":"2003/05/11 00:00:00 -0400","original":"5/10/2003","granularity":"day","time":"2003/05/10 00:00:00 -0400"},"longitude":-117.2989655,"id":"advbt616etjd","location":"Harper Dry Lake"},"type":"Feature","geometry":{"type":"Point","coordinates":[-117.2989655,35.0123184]}},{"properties":{"latitude":34.5316132,"column_5":14,"date":{"end_time":"2003/05/19 00:00:00 -0400","original":"5/18/2003","granularity":"day","time":"2003/05/18 00:00:00 -0400"},"longitude":-117.284568,"id":"advbt5wo1yyt","location":"Lewis Center"},"type":"Feature","geometry":{"type":"Point","coordinates":[-117.284568,34.5316132]}},{"properties":{"latitude":35.0508811,"column_5":14,"date":{"end_time":"2006/06/01 00:00:00 -0400","original":"5/31/2006","granularity":"day","time":"2006/05/31 00:00:00 -0400"},"longitude":-112.0388298,"id":"advbt5y6ofn0","location":"Kaibab NF--Williams--survey 15550007"},"type":"Feature","geometry":{"type":"Point","coordinates":[-112.0388298,35.0508811]}},{"properties":{"latitude":35.216103,"column_5":14,"date":{"end_time":"2010/12/25 00:00:00 -0500","original":"12/24/2010","granularity":"day","time":"2010/12/24 00:00:00 -0500"},"longitude":-114.5646572,"id":"advbt5soha1t","location":"Lake Mead NRA--Katherine Landing"},"type":"Feature","geometry":{"type":"Point","coordinates":[-114.5646572,35.216103]}},{"properties":{"latitude":34.3082073,"column_5":14,"date":{"end_time":"2011/03/11 00:00:00 -0500","original":"3/10/2011","granularity":"day","time":"2011/03/10 00:00:00 -0500"},"longitude":-114.1231441,"id":"advbt5xbm6g6","location":"Bill Williams Delta--Mohave Co"},"type":"Feature","geometry":{"type":"Point","coordinates":[-114.1231441,34.3082073]}},{"properties":{"latitude":35.1988394,"column_5":13,"date":{"end_time":"2005/09/12 00:00:00 -0400","original":"9/11/2005","granularity":"day","time":"2005/09/11 00:00:00 -0400"},"longitude":-111.5826058,"id":"advbt654vuw9","location":"Country Club Lakes"},"type":"Feature","geometry":{"type":"Point","coordinates":[-111.5826058,35.1988394]}},{"properties":{"latitude":33.3614502,"column_5":13,"date":{"end_time":"2006/12/25 00:00:00 -0500","original":"12/24/2006","granularity":"day","time":"2006/12/24 00:00:00 -0500"},"longitude":-111.7339478,"id":"advbt64gtutm","location":"Riparian Preserve at Gilbert Water Ranch"},"type":"Feature","geometry":{"type":"Point","coordinates":[-111.7339478,33.3614502]}},{"properties":{"latitude":34.2494126,"column_5":13,"date":{"end_time":"2007/10/07 00:00:00 -0400","original":"10/6/2007","granularity":"day","time":"2007/10/06 00:00:00 -0400"},"longitude":-119.2673206,"id":"advbt65wawby","location":"Ventura Harbor"},"type":"Feature","geometry":{"type":"Point","coordinates":[-119.2673206,34.2494126]}},{"properties":{"latitude":34.7339949,"column_5":13,"date":{"end_time":"2009/11/18 00:00:00 -0500","original":"11/17/2009","granularity":"day","time":"2009/11/17 00:00:00 -0500"},"longitude":-114.4825172,"id":"advbt60fbfhm","location":"Havasu NWR--New South Dike"},"type":"Feature","geometry":{"type":"Point","coordinates":[-114.4825172,34.7339949]}},{"properties":{"latitude":34.2875949,"column_5":13,"date":{"end_time":"2010/12/13 00:00:00 -0500","original":"12/12/2010","granularity":"day","time":"2010/12/12 00:00:00 -0500"},"longitude":-114.144001,"id":"advbt5qjlec9","location":"Parker Dam--residential area (CA)"},"type":"Feature","geometry":{"type":"Point","coordinates":[-114.144001,34.2875949]}},{"properties":{"latitude":34.5129928,"column_5":12,"date":{"end_time":"2003/03/16 00:00:00 -0500","original":"3/15/2003","granularity":"day","time":"2003/03/15 00:00:00 -0500"},"longitude":-117.2708559,"id":"advbt5r92ktb","location":"Mojave Narrows Regional Park"},"type":"Feature","geometry":{"type":"Point","coordinates":[-117.2708559,34.5129928]}},{"properties":{"latitude":34.6784996,"column_5":12,"date":{"end_time":"2005/03/20 00:00:00 -0500","original":"3/19/2005","granularity":"day","time":"2005/03/19 00:00:00 -0500"},"longitude":-111.7001867,"id":"advbt65ctlon","location":"Wet Beaver Creek WA--Bell Trail"},"type":"Feature","geometry":{"type":"Point","coordinates":[-111.7001867,34.6784996]}},{"properties":{"latitude":34.7889772,"column_5":12,"date":{"end_time":"2011/02/06 00:00:00 -0500","original":"2/5/2011","granularity":"day","time":"2011/02/05 00:00:00 -0500"},"longitude":-114.5604515,"id":"advbt5xsfbkf","location":"Havasu NWR--Bermuda Pasture"},"type":"Feature","geometry":{"type":"Point","coordinates":[-114.5604515,34.7889772]}},{"properties":{"latitude":34.2859289,"column_5":12,"date":{"end_time":"2011/12/19 00:00:00 -0500","original":"12/18/2011","granularity":"day","time":"2011/12/18 00:00:00 -0500"},"longitude":-114.0620682,"id":"advbt5yx0x2m","location":"Bill Williams NWR--Crossriver/North Burn/Fox Wash (MOH)"},"type":"Feature","geometry":{"type":"Point","coordinates":[-114.0620682,34.2859289]}},{"properties":{"latitude":34.8765664,"column_5":11,"date":{"end_time":"2003/03/20 00:00:00 -0500","original":"3/19/2003","granularity":"day","time":"2003/03/19 00:00:00 -0500"},"longitude":-116.9445705,"id":"advbt60s1ugl","location":"Tees and Trees--Barstow Ponds"},"type":"Feature","geometry":{"type":"Point","coordinates":[-116.9445705,34.8765664]}},{"properties":{"latitude":36.4054691,"column_5":11,"date":{"end_time":"2006/06/17 00:00:00 -0400","original":"6/16/2006","granularity":"day","time":"2006/06/16 00:00:00 -0400"},"longitude":-112.208552,"id":"advbt648v8ar","location":"Kaibab NF--North Kaibab--survey 30950028"},"type":"Feature","geometry":{"type":"Point","coordinates":[-112.208552,36.4054691]}},{"properties":{"latitude":33.68996,"column_5":11,"date":{"end_time":"2010/10/13 00:00:00 -0400","original":"10/12/2010","granularity":"day","time":"2010/10/12 00:00:00 -0400"},"longitude":-112.0029652,"id":"advbt62sg247","location":"3610 E Donald Dr"},"type":"Feature","geometry":{"type":"Point","coordinates":[-112.0029652,33.68996]}},{"properties":{"latitude":34.119254,"column_5":11,"date":{"end_time":"2010/11/23 00:00:00 -0500","original":"11/22/2010","granularity":"day","time":"2010/11/22 00:00:00 -0500"},"longitude":-114.3416083,"id":"advbt5wrx4v5","location":"Parker Valley--Northern"},"type":"Feature","geometry":{"type":"Point","coordinates":[-114.3416083,34.119254]}},{"properties":{"latitude":34.4775,"column_5":11,"date":{"end_time":"2011/01/01 00:00:00 -0500","original":"12/31/2010","granularity":"day","time":"2010/12/31 00:00:00 -0500"},"longitude":-114.3631,"id":"advbt5ruqvgw","location":"Lake Havasu"},"type":"Feature","geometry":{"type":"Point","coordinates":[-114.3631,34.4775]}},{"properties":{"latitude":34.463763,"column_5":11,"date":{"end_time":"2011/01/15 00:00:00 -0500","original":"1/14/2011","granularity":"day","time":"2011/01/14 00:00:00 -0500"},"longitude":-114.329052,"id":"advbt5rlo80b","location":"LHC - Mulberry Ave STP"},"type":"Feature","geometry":{"type":"Point","coordinates":[-114.329052,34.463763]}},{"properties":{"latitude":34.3082073,"column_5":11,"date":{"end_time":"2011/02/22 00:00:00 -0500","original":"2/21/2011","granularity":"day","time":"2011/02/21 00:00:00 -0500"},"longitude":-114.1231441,"id":"advbt5qr1fth","location":"Bill Williams Delta--outer, Mohave Co"},"type":"Feature","geometry":{"type":"Point","coordinates":[-114.1231441,34.3082073]}},{"properties":{"latitude":33.2811926,"column_5":11,"date":{"end_time":"2011/04/25 00:00:00 -0400","original":"4/24/2011","granularity":"day","time":"2011/04/24 00:00:00 -0400"},"longitude":-114.666152,"id":"advbt5wl5397","location":"Cibola NWR--Hart Mine Marsh"},"type":"Feature","geometry":{"type":"Point","coordinates":[-114.666152,33.2811926]}},{"properties":{"latitude":35.0728121,"column_5":10,"date":{"end_time":"2005/07/24 00:00:00 -0400","original":"7/23/2005","granularity":"day","time":"2005/07/23 00:00:00 -0400"},"longitude":-111.5269432,"id":"advbt62ycb94","location":"Lakes Mary"},"type":"Feature","geometry":{"type":"Point","coordinates":[-111.5269432,35.0728121]}},{"properties":{"latitude":35.9569289,"column_5":10,"date":{"end_time":"2006/05/19 00:00:00 -0400","original":"5/18/2006","granularity":"day","time":"2006/05/18 00:00:00 -0400"},"longitude":-111.9642491,"id":"advbt5sdvlbr","location":"Kaibab NF--Tusayan--survey 40920008"},"type":"Feature","geometry":{"type":"Point","coordinates":[-111.9642491,35.9569289]}},{"properties":{"latitude":35.9206927,"column_5":10,"date":{"end_time":"2006/05/20 00:00:00 -0400","original":"5/19/2006","granularity":"day","time":"2006/05/19 00:00:00 -0400"},"longitude":-112.1374685,"id":"advbt5vttyj3","location":"Kaibab NF--Tusayan--survey 40370009"},"type":"Feature","geometry":{"type":"Point","coordinates":[-112.1374685,35.9206927]}},{"properties":{"latitude":41.0168379,"column_5":10,"date":{"end_time":"2009/08/28 00:00:00 -0400","original":"8/27/2009","granularity":"day","time":"2009/08/27 00:00:00 -0400"},"longitude":-83.5709681,"id":"advbt5vi4wge","location":"Findlay Reservoirs"},"type":"Feature","geometry":{"type":"Point","coordinates":[-83.5709681,41.0168379]}},{"properties":{"latitude":34.260057,"column_5":10,"date":{"end_time":"2010/02/19 00:00:00 -0500","original":"2/18/2010","granularity":"day","time":"2010/02/18 00:00:00 -0500"},"longitude":-114.1580696,"id":"advbt5z4q22p","location":"Quail Hollow"},"type":"Feature","geometry":{"type":"Point","coordinates":[-114.1580696,34.260057]}},{"properties":{"latitude":34.30055,"column_5":10,"date":{"end_time":"2010/12/20 00:00:00 -0500","original":"12/19/2010","granularity":"day","time":"2010/12/19 00:00:00 -0500"},"longitude":-114.1365337,"id":"advbt5x3duwk","location":"Lake Havasu--Take-off Point"},"type":"Feature","geometry":{"type":"Point","coordinates":[-114.1365337,34.30055]}},{"properties":{"latitude":34.2670057,"column_5":10,"date":{"end_time":"2010/12/30 00:00:00 -0500","original":"12/29/2010","granularity":"day","time":"2010/12/29 00:00:00 -0500"},"longitude":-114.0322495,"id":"advbt5wsiy1h","location":"Bill Williams NWR - Kohen Ranch"},"type":"Feature","geometry":{"type":"Point","coordinates":[-114.0322495,34.2670057]}},{"properties":{"latitude":34.4582305,"column_5":10,"date":{"end_time":"2011/12/13 00:00:00 -0500","original":"12/12/2011","granularity":"day","time":"2011/12/12 00:00:00 -0500"},"longitude":-114.3490953,"id":"advbt5t9u57m","location":"Lake Havasu City - The Nautical"},"type":"Feature","geometry":{"type":"Point","coordinates":[-114.3490953,34.4582305]}},{"properties":{"latitude":33.5445217,"column_5":10,"date":{"end_time":"2012/08/22 00:00:00 -0400","original":"8/21/2012","granularity":"day","time":"2012/08/21 00:00:00 -0400"},"longitude":-114.6784437,"id":"advbt5t2gdgp","location":"22nd Ave Oasis"},"type":"Feature","geometry":{"type":"Point","coordinates":[-114.6784437,33.5445217]}},{"properties":{"latitude":33.933,"column_5":9,"date":{"end_time":"2003/03/09 00:00:00 -0500","original":"3/8/2003","granularity":"day","time":"2003/03/08 00:00:00 -0500"},"longitude":-112.693,"id":"advbt5qtj7oi","location":"Hassayampa River Preserve"},"type":"Feature","geometry":{"type":"Point","coordinates":[-112.693,33.933]}},{"properties":{"latitude":34.951604,"column_5":9,"date":{"end_time":"2005/07/24 00:00:00 -0400","original":"7/23/2005","granularity":"day","time":"2005/07/23 00:00:00 -0400"},"longitude":-111.4380898,"id":"advbt656vx04","location":"Mormon Lake"},"type":"Feature","geometry":{"type":"Point","coordinates":[-111.4380898,34.951604]}},{"properties":{"latitude":31.739938,"column_5":9,"date":{"end_time":"2005/08/20 00:00:00 -0400","original":"8/19/2005","granularity":"day","time":"2005/08/19 00:00:00 -0400"},"longitude":-110.886147,"id":"advbt5q4796n","location":"Madera Canyon--Proctor Rd."},"type":"Feature","geometry":{"type":"Point","coordinates":[-110.886147,31.739938]}},{"properties":{"latitude":36.4875751,"column_5":9,"date":{"end_time":"2006/05/25 00:00:00 -0400","original":"5/24/2006","granularity":"day","time":"2006/05/24 00:00:00 -0400"},"longitude":-112.2496139,"id":"advbt5uqkxgb","location":"Kaibab NF--North Kaibab--survey 30910030"},"type":"Feature","geometry":{"type":"Point","coordinates":[-112.2496139,36.4875751]}},{"properties":{"latitude":35.1208889,"column_5":9,"date":{"end_time":"2006/06/02 00:00:00 -0400","original":"6/1/2006","granularity":"day","time":"2006/06/01 00:00:00 -0400"},"longitude":-112.0959937,"id":"advbt64gtyj0","location":"Kaibab NF--Williams--survey 15370011"},"type":"Feature","geometry":{"type":"Point","coordinates":[-112.0959937,35.1208889]}},{"properties":{"latitude":36.3657522,"column_5":9,"date":{"end_time":"2006/06/23 00:00:00 -0400","original":"6/22/2006","granularity":"day","time":"2006/06/22 00:00:00 -0400"},"longitude":-112.1804059,"id":"advbt64dnu0w","location":"Kaibab NF--North Kaibab--survey 31040028"},"type":"Feature","geometry":{"type":"Point","coordinates":[-112.1804059,36.3657522]}},{"properties":{"latitude":36.6117713,"column_5":9,"date":{"end_time":"2006/06/24 00:00:00 -0400","original":"6/23/2006","granularity":"day","time":"2006/06/23 00:00:00 -0400"},"longitude":-112.2108692,"id":"advbt5zrdws5","location":"Kaibab NF--North Kaibab--survey 30680019"},"type":"Feature","geometry":{"type":"Point","coordinates":[-112.2108692,36.6117713]}},{"properties":{"latitude":35.1981497,"column_5":9,"date":{"end_time":"2010/12/25 00:00:00 -0500","original":"12/24/2010","granularity":"day","time":"2010/12/24 00:00:00 -0500"},"longitude":-114.5685196,"id":"advbt602cwc9","location":"Davis Dam (AZ)"},"type":"Feature","geometry":{"type":"Point","coordinates":[-114.5685196,35.1981497]}},{"properties":{"latitude":33.4114544,"column_5":9,"date":{"end_time":"2011/04/24 00:00:00 -0400","original":"4/23/2011","granularity":"day","time":"2011/04/23 00:00:00 -0400"},"longitude":-114.6662807,"id":"advbt61nbk3e","location":"Cibola NWR--CVCA"},"type":"Feature","geometry":{"type":"Point","coordinates":[-114.6662807,33.4114544]}},{"properties":{"latitude":33.9260995,"column_5":9,"date":{"end_time":"2011/04/25 00:00:00 -0400","original":"4/24/2011","granularity":"day","time":"2011/04/24 00:00:00 -0400"},"longitude":-114.4324994,"id":"advbt5t79iyq","location":"Parker Valley - Mohave and Peterson"},"type":"Feature","geometry":{"type":"Point","coordinates":[-114.4324994,33.9260995]}},{"properties":{"latitude":34.2795107,"column_5":9,"date":{"end_time":"2011/12/19 00:00:00 -0500","original":"12/18/2011","granularity":"day","time":"2011/12/18 00:00:00 -0500"},"longitude":-114.0590212,"id":"advbt5v2m3wk","location":"Bill Williams NWR--Crossriver (La Paz)"},"type":"Feature","geometry":{"type":"Point","coordinates":[-114.0590212,34.2795107]}},{"properties":{"latitude":34.5822319,"column_5":8,"date":{"end_time":"2004/10/10 00:00:00 -0400","original":"10/9/2004","granularity":"day","time":"2004/10/09 00:00:00 -0400"},"longitude":-112.4259328,"id":"advbt5z25cnf","location":"Watson Lake and Riparian Preserve"},"type":"Feature","geometry":{"type":"Point","coordinates":[-112.4259328,34.5822319]}},{"properties":{"latitude":35.1981087,"column_5":8,"date":{"end_time":"2005/05/15 00:00:00 -0400","original":"5/14/2005","granularity":"day","time":"2005/05/14 00:00:00 -0400"},"longitude":-111.6517181,"id":"advbt60a85z3","location":"Flagstaff"},"type":"Feature","geometry":{"type":"Point","coordinates":[-111.6517181,35.1981087]}},{"properties":{"latitude":35.7143224,"column_5":8,"date":{"end_time":"2005/08/26 00:00:00 -0400","original":"8/25/2005","granularity":"day","time":"2005/08/25 00:00:00 -0400"},"longitude":-111.4750099,"id":"advbt5s6e3l8","location":"Rimmy Jim Tank"},"type":"Feature","geometry":{"type":"Point","coordinates":[-111.4750099,35.7143224]}},{"properties":{"latitude":34.8872334,"column_5":8,"date":{"end_time":"2006/04/26 00:00:00 -0400","original":"4/25/2006","granularity":"day","time":"2006/04/25 00:00:00 -0400"},"longitude":-111.7314291,"id":"advbt5tohnj1","location":"Grasshopper Point"},"type":"Feature","geometry":{"type":"Point","coordinates":[-111.7314291,34.8872334]}},{"properties":{"latitude":36.6810463,"column_5":8,"date":{"end_time":"2006/05/26 00:00:00 -0400","original":"5/25/2006","granularity":"day","time":"2006/05/25 00:00:00 -0400"},"longitude":-112.2535761,"id":"advbt5y67vel","location":"Kaibab NF--North Kaibab--survey 30610137"},"type":"Feature","geometry":{"type":"Point","coordinates":[-112.2535761,36.6810463]}},{"properties":{"latitude":36.4007235,"column_5":8,"date":{"end_time":"2008/03/20 00:00:00 -0400","original":"3/19/2008","granularity":"day","time":"2008/03/19 00:00:00 -0400"},"longitude":-113.1348467,"id":"advbt5scbn8v","location":"Mount Trumbull"},"type":"Feature","geometry":{"type":"Point","coordinates":[-113.1348467,36.4007235]}},{"properties":{"latitude":10.4288,"column_5":8,"date":{"end_time":"2009/03/03 00:00:00 -0500","original":"3/2/2009","granularity":"day","time":"2009/03/02 00:00:00 -0500"},"longitude":-84.0128,"id":"advbt5z1352j","location":"La Selva (OTS Reserve)"},"type":"Feature","geometry":{"type":"Point","coordinates":[-84.0128,10.4288]}},{"properties":{"latitude":40.9540552,"column_5":8,"date":{"end_time":"2009/08/28 00:00:00 -0400","original":"8/27/2009","granularity":"day","time":"2009/08/27 00:00:00 -0400"},"longitude":-83.8174653,"id":"advbt5v5oydy","location":"Kaleidoscope Tree Farm"},"type":"Feature","geometry":{"type":"Point","coordinates":[-83.8174653,40.9540552]}},{"properties":{"latitude":40.9509923,"column_5":8,"date":{"end_time":"2009/09/12 00:00:00 -0400","original":"9/11/2009","granularity":"day","time":"2009/09/11 00:00:00 -0400"},"longitude":-83.5477638,"id":"advbt62xxk17","location":"Rieck Center"},"type":"Feature","geometry":{"type":"Point","coordinates":[-83.5477638,40.9509923]}},{"properties":{"latitude":34.1744471,"column_5":8,"date":{"end_time":"2010/02/19 00:00:00 -0500","original":"2/18/2010","granularity":"day","time":"2010/02/18 00:00:00 -0500"},"longitude":-114.272815,"id":"advbt62so6ar","location":"Bluewater"},"type":"Feature","geometry":{"type":"Point","coordinates":[-114.272815,34.1744471]}},{"properties":{"latitude":33.7774827,"column_5":8,"date":{"end_time":"2010/11/23 00:00:00 -0500","original":"11/22/2010","granularity":"day","time":"2010/11/22 00:00:00 -0500"},"longitude":-114.4686037,"id":"advbt5ux4sfd","location":"Parker Valley--Southern"},"type":"Feature","geometry":{"type":"Point","coordinates":[-114.4686037,33.7774827]}},{"properties":{"latitude":34.507759,"column_5":8,"date":{"end_time":"2010/12/03 00:00:00 -0500","original":"12/2/2010","granularity":"day","time":"2010/12/02 00:00:00 -0500"},"longitude":-114.3678474,"id":"advbt5zgph7k","location":"Lake Havasu--Mesquite Bay South"},"type":"Feature","geometry":{"type":"Point","coordinates":[-114.3678474,34.507759]}},{"properties":{"latitude":34.4759604,"column_5":8,"date":{"end_time":"2010/12/23 00:00:00 -0500","original":"12/22/2010","granularity":"day","time":"2010/12/22 00:00:00 -0500"},"longitude":-114.3551874,"id":"advbt5twrg2d","location":"Lake Havasu SP -- Site 4"},"type":"Feature","geometry":{"type":"Point","coordinates":[-114.3551874,34.4759604]}},{"properties":{"latitude":34.4565357,"column_5":8,"date":{"end_time":"2011/01/03 00:00:00 -0500","original":"1/2/2011","granularity":"day","time":"2011/01/02 00:00:00 -0500"},"longitude":-114.2867804,"id":"advbt5tm0ri9","location":"Lake Havasu City--South"},"type":"Feature","geometry":{"type":"Point","coordinates":[-114.2867804,34.4565357]}},{"properties":{"latitude":35.1909077,"column_5":8,"date":{"end_time":"2011/01/20 00:00:00 -0500","original":"1/19/2011","granularity":"day","time":"2011/01/19 00:00:00 -0500"},"longitude":-114.0606701,"id":"advbt5ztkp8y","location":"Kingman--Metcalfe Park"},"type":"Feature","geometry":{"type":"Point","coordinates":[-114.0606701,35.1909077]}},{"properties":{"latitude":34.2648068,"column_5":8,"date":{"end_time":"2011/02/04 00:00:00 -0500","original":"2/3/2011","granularity":"day","time":"2011/02/03 00:00:00 -0500"},"longitude":-114.137392,"id":"advbt5zlbnue","location":"Riverlodge Resort"},"type":"Feature","geometry":{"type":"Point","coordinates":[-114.137392,34.2648068]}},{"properties":{"latitude":34.47753,"column_5":8,"date":{"end_time":"2011/07/10 00:00:00 -0400","original":"7/9/2011","granularity":"day","time":"2011/07/09 00:00:00 -0400"},"longitude":-114.3379998,"id":"advbt60iwqir","location":"Lake Havasu City--Central"},"type":"Feature","geometry":{"type":"Point","coordinates":[-114.3379998,34.47753]}},{"properties":{"latitude":33.6614604,"column_5":8,"date":{"end_time":"2012/03/07 00:00:00 -0500","original":"3/6/2012","granularity":"day","time":"2012/03/06 00:00:00 -0500"},"longitude":-114.5244455,"id":"advbt5w4wk3y","location":"The River Estates"},"type":"Feature","geometry":{"type":"Point","coordinates":[-114.5244455,33.6614604]}},{"properties":{"latitude":33.7311925,"column_5":8,"date":{"end_time":"2012/03/15 00:00:00 -0400","original":"3/14/2012","granularity":"day","time":"2012/03/14 00:00:00 -0400"},"longitude":-114.5124722,"id":"advbt5s9t6je","location":"Palo Verde Diversion Dam"},"type":"Feature","geometry":{"type":"Point","coordinates":[-114.5124722,33.7311925]}},{"properties":{"latitude":34.7731959,"column_5":7,"date":{"end_time":"2004/02/22 00:00:00 -0500","original":"2/21/2004","granularity":"day","time":"2004/02/21 00:00:00 -0500"},"longitude":-117.2683458,"id":"advbt64485h9","location":"Route 66 between Victorville and Barstow"},"type":"Feature","geometry":{"type":"Point","coordinates":[-117.2683458,34.7731959]}},{"properties":{"latitude":35.0084448,"column_5":7,"date":{"end_time":"2006/04/26 00:00:00 -0400","original":"4/25/2006","granularity":"day","time":"2006/04/25 00:00:00 -0400"},"longitude":-111.7370715,"id":"advbt61rcmto","location":"Oak Creek Canyon--Cave Springs CG"},"type":"Feature","geometry":{"type":"Point","coordinates":[-111.7370715,35.0084448]}},{"properties":{"latitude":36.4899344,"column_5":7,"date":{"end_time":"2006/06/22 00:00:00 -0400","original":"6/21/2006","granularity":"day","time":"2006/06/21 00:00:00 -0400"},"longitude":-112.2211499,"id":"advbt5utd3jw","location":"Kaibab NF--North Kaibab--survey 30890160"},"type":"Feature","geometry":{"type":"Point","coordinates":[-112.2211499,36.4899344]}},{"properties":{"latitude":34.1763611,"column_5":7,"date":{"end_time":"2007/10/09 00:00:00 -0400","original":"10/8/2007","granularity":"day","time":"2007/10/08 00:00:00 -0400"},"longitude":-119.1194722,"id":"advbt5rmn4hp","location":"Laguna Rd. tamarisks"},"type":"Feature","geometry":{"type":"Point","coordinates":[-119.1194722,34.1763611]}},{"properties":{"latitude":34.2517893,"column_5":7,"date":{"end_time":"2008/01/06 00:00:00 -0500","original":"1/5/2008","granularity":"day","time":"2008/01/05 00:00:00 -0500"},"longitude":-119.216069,"id":"advbt638w99x","location":"Ivy Lawn Cemetery"},"type":"Feature","geometry":{"type":"Point","coordinates":[-119.216069,34.2517893]}},{"properties":{"latitude":34.1113782,"column_5":7,"date":{"end_time":"2008/09/06 00:00:00 -0400","original":"9/5/2008","granularity":"day","time":"2008/09/05 00:00:00 -0400"},"longitude":-119.111495,"id":"advbt5yov5iq","location":"Pt. Mugu Naval Air Station"},"type":"Feature","geometry":{"type":"Point","coordinates":[-119.111495,34.1113782]}},{"properties":{"latitude":34.5125508,"column_5":7,"date":{"end_time":"2008/09/25 00:00:00 -0400","original":"9/24/2008","granularity":"day","time":"2008/09/24 00:00:00 -0400"},"longitude":-114.3686521,"id":"advbt64ui2yl","location":"Lake Havasu--Mesquite Bay North"},"type":"Feature","geometry":{"type":"Point","coordinates":[-114.3686521,34.5125508]}},{"properties":{"latitude":10.3387737,"column_5":7,"date":{"end_time":"2009/02/14 00:00:00 -0500","original":"2/13/2009","granularity":"day","time":"2009/02/13 00:00:00 -0500"},"longitude":-83.9993191,"id":"advbt65hqf5a","location":"Road to Rara Avis"},"type":"Feature","geometry":{"type":"Point","coordinates":[-83.9993191,10.3387737]}},{"properties":{"latitude":43.2654648,"column_5":7,"date":{"end_time":"2009/05/24 00:00:00 -0400","original":"5/23/2009","granularity":"day","time":"2009/05/23 00:00:00 -0400"},"longitude":-118.8440412,"id":"advbt5wclbvx","location":"Malheur NWR--Headquarters"},"type":"Feature","geometry":{"type":"Point","coordinates":[-118.8440412,43.2654648]}},{"properties":{"latitude":33.0224549,"column_5":7,"date":{"end_time":"2010/12/16 00:00:00 -0500","original":"12/15/2010","granularity":"day","time":"2010/12/15 00:00:00 -0500"},"longitude":-114.6142888,"id":"advbt5vckvev","location":"Picacho SRA"},"type":"Feature","geometry":{"type":"Point","coordinates":[-114.6142888,33.0224549]}},{"properties":{"latitude":34.7365342,"column_5":7,"date":{"end_time":"2010/12/25 00:00:00 -0500","original":"12/24/2010","granularity":"day","time":"2010/12/24 00:00:00 -0500"},"longitude":-114.4825172,"id":"advbt5qqpupw","location":"Havasu NWR--South Dike"},"type":"Feature","geometry":{"type":"Point","coordinates":[-114.4825172,34.7365342]}},{"properties":{"latitude":35.1721596,"column_5":7,"date":{"end_time":"2010/12/25 00:00:00 -0500","original":"12/24/2010","granularity":"day","time":"2010/12/24 00:00:00 -0500"},"longitude":-114.5680904,"id":"advbt5xlw6w4","location":"Bullhead City-Laughlin Bridge (AZ)"},"type":"Feature","geometry":{"type":"Point","coordinates":[-114.5680904,35.1721596]}},{"properties":{"latitude":34.2094557,"column_5":7,"date":{"end_time":"2011/05/09 00:00:00 -0400","original":"5/8/2011","granularity":"day","time":"2011/05/08 00:00:00 -0400"},"longitude":-113.6827576,"id":"advbt5ycyeyp","location":"Bill Williams River--Lincoln Ranch"},"type":"Feature","geometry":{"type":"Point","coordinates":[-113.6827576,34.2094557]}},{"properties":{"latitude":34.4900573,"column_5":7,"date":{"end_time":"2011/10/27 00:00:00 -0400","original":"10/26/2011","granularity":"day","time":"2011/10/26 00:00:00 -0400"},"longitude":-114.3610883,"id":"advbt5vuhlp0","location":"Lake Havasu SP--Windsor Beach"},"type":"Feature","geometry":{"type":"Point","coordinates":[-114.3610883,34.4900573]}},{"properties":{"latitude":34.0229718,"column_5":7,"date":{"end_time":"2012/01/30 00:00:00 -0500","original":"1/29/2012","granularity":"day","time":"2012/01/29 00:00:00 -0500"},"longitude":-114.3919487,"id":"advbt5voxv6q","location":"Poston Wetlands"},"type":"Feature","geometry":{"type":"Point","coordinates":[-114.3919487,34.0229718]}},{"properties":{"latitude":33.6590266,"column_5":7,"date":{"end_time":"2012/03/06 00:00:00 -0500","original":"3/5/2012","granularity":"day","time":"2012/03/05 00:00:00 -0500"},"longitude":-114.5262903,"id":"advbt65j5t3p","location":"Blythe Field House"},"type":"Feature","geometry":{"type":"Point","coordinates":[-114.5262903,33.6590266]}},{"properties":{"latitude":34.7975941,"column_5":7,"date":{"end_time":"2013/03/13 00:00:00 -0400","original":"3/12/2013","granularity":"day","time":"2013/03/12 00:00:00 -0400"},"longitude":-114.5420408,"id":"advbt5pl6wcu","location":"Havasu NWR--Glory Hole Tam areas"},"type":"Feature","geometry":{"type":"Point","coordinates":[-114.5420408,34.7975941]}},{"properties":{"latitude":31.4951992,"column_5":6,"date":{"end_time":"2005/08/18 00:00:00 -0400","original":"8/17/2005","granularity":"day","time":"2005/08/17 00:00:00 -0400"},"longitude":-110.8566971,"id":"advbt65dspzm","location":"Patagonia Lake State Park"},"type":"Feature","geometry":{"type":"Point","coordinates":[-110.8566971,31.4951992]}},{"properties":{"latitude":36.4745634,"column_5":6,"date":{"end_time":"2006/05/27 00:00:00 -0400","original":"5/26/2006","granularity":"day","time":"2006/05/26 00:00:00 -0400"},"longitude":-112.1486798,"id":"advbt5ukaced","location":"Kaibab NF--North Kaibab--survey 30880112"},"type":"Feature","geometry":{"type":"Point","coordinates":[-112.1486798,36.4745634]}},{"properties":{"latitude":36.5576837,"column_5":6,"date":{"end_time":"2006/06/16 00:00:00 -0400","original":"6/15/2006","granularity":"day","time":"2006/06/15 00:00:00 -0400"},"longitude":-112.1785814,"id":"advbt61ct4x6","location":"Kaibab NF--North Kaibab--survey 30720032"},"type":"Feature","geometry":{"type":"Point","coordinates":[-112.1785814,36.5576837]}},{"properties":{"latitude":36.4449486,"column_5":6,"date":{"end_time":"2006/06/21 00:00:00 -0400","original":"6/20/2006","granularity":"day","time":"2006/06/20 00:00:00 -0400"},"longitude":-112.2063635,"id":"advbt622n930","location":"Kaibab NF--North Kaibab--survey 30970114"},"type":"Feature","geometry":{"type":"Point","coordinates":[-112.2063635,36.4449486]}},{"properties":{"latitude":35.1083941,"column_5":6,"date":{"end_time":"2007/02/24 00:00:00 -0500","original":"2/23/2007","granularity":"day","time":"2007/02/23 00:00:00 -0500"},"longitude":-111.5798092,"id":"advbt60q8iei","location":"Lower Lake Mary"},"type":"Feature","geometry":{"type":"Point","coordinates":[-111.5798092,35.1083941]}},{"properties":{"latitude":36.7158249,"column_5":6,"date":{"end_time":"2008/09/14 00:00:00 -0400","original":"9/13/2008","granularity":"day","time":"2008/09/13 00:00:00 -0400"},"longitude":-122.0627976,"id":"advbt63ww826","location":"Monterey Bay pelagic (MTY Co.)"},"type":"Feature","geometry":{"type":"Point","coordinates":[-122.0627976,36.7158249]}},{"properties":{"latitude":32.8763795,"column_5":6,"date":{"end_time":"2008/12/18 00:00:00 -0500","original":"12/17/2008","granularity":"day","time":"2008/12/17 00:00:00 -0500"},"longitude":-114.4798136,"id":"advbt614w4ub","location":"West Pond"},"type":"Feature","geometry":{"type":"Point","coordinates":[-114.4798136,32.8763795]}},{"properties":{"latitude":40.7366083,"column_5":6,"date":{"end_time":"2009/09/10 00:00:00 -0400","original":"9/9/2009","granularity":"day","time":"2009/09/09 00:00:00 -0400"},"longitude":-83.8867521,"id":"advbt5vrzjhi","location":"J and J's Woodland"},"type":"Feature","geometry":{"type":"Point","coordinates":[-83.8867521,40.7366083]}},{"properties":{"latitude":33.2795082,"column_5":6,"date":{"end_time":"2010/11/05 00:00:00 -0400","original":"11/4/2010","granularity":"day","time":"2010/11/04 00:00:00 -0400"},"longitude":-111.158756,"id":"advbt5rvquwb","location":"Boyce Thompson Arboretum SP"},"type":"Feature","geometry":{"type":"Point","coordinates":[-111.158756,33.2795082]}},{"properties":{"latitude":32.9777081,"column_5":6,"date":{"end_time":"2010/12/16 00:00:00 -0500","original":"12/15/2010","granularity":"day","time":"2010/12/15 00:00:00 -0500"},"longitude":-114.5027733,"id":"advbt63ffhg7","location":"Ferguson Lake"},"type":"Feature","geometry":{"type":"Point","coordinates":[-114.5027733,32.9777081]}},{"properties":{"latitude":34.5690936,"column_5":6,"date":{"end_time":"2010/12/18 00:00:00 -0500","original":"12/17/2010","granularity":"day","time":"2010/12/17 00:00:00 -0500"},"longitude":-114.3998408,"id":"advbt5r8vq1w","location":"Crystal Beach"},"type":"Feature","geometry":{"type":"Point","coordinates":[-114.3998408,34.5690936]}},{"properties":{"latitude":34.845455,"column_5":6,"date":{"end_time":"2010/12/25 00:00:00 -0500","original":"12/24/2010","granularity":"day","time":"2010/12/24 00:00:00 -0500"},"longitude":-114.5898485,"id":"advbt5v2beag","location":"River Hwy development"},"type":"Feature","geometry":{"type":"Point","coordinates":[-114.5898485,34.845455]}},{"properties":{"latitude":34.2803399,"column_5":6,"date":{"end_time":"2010/12/30 00:00:00 -0500","original":"12/29/2010","granularity":"day","time":"2010/12/29 00:00:00 -0500"},"longitude":-114.0693283,"id":"advbt5vu0dv2","location":"Bill Williams River NWR--Planet Ranch Rd"},"type":"Feature","geometry":{"type":"Point","coordinates":[-114.0693283,34.2803399]}},{"properties":{"latitude":34.2386279,"column_5":6,"date":{"end_time":"2011/02/04 00:00:00 -0500","original":"2/3/2011","granularity":"day","time":"2011/02/03 00:00:00 -0500"},"longitude":-114.184792,"id":"advbt629vpvn","location":"Bullfrog Day Use Area"},"type":"Feature","geometry":{"type":"Point","coordinates":[-114.184792,34.2386279]}},{"properties":{"latitude":34.9528,"column_5":6,"date":{"end_time":"2011/02/06 00:00:00 -0500","original":"2/5/2011","granularity":"day","time":"2011/02/05 00:00:00 -0500"},"longitude":-114.65337,"id":"advbt610hufc","location":"Fort Mohave (CA)"},"type":"Feature","geometry":{"type":"Point","coordinates":[-114.65337,34.9528]}},{"properties":{"latitude":34.535268,"column_5":6,"date":{"end_time":"2011/02/28 00:00:00 -0500","original":"2/27/2011","granularity":"day","time":"2011/02/27 00:00:00 -0500"},"longitude":-113.452549,"id":"advbt65fhh5x","location":"Burro Creek CG"},"type":"Feature","geometry":{"type":"Point","coordinates":[-113.452549,34.535268]}},{"properties":{"latitude":33.3540467,"column_5":6,"date":{"end_time":"2011/05/01 00:00:00 -0400","original":"4/30/2011","granularity":"day","time":"2011/04/30 00:00:00 -0400"},"longitude":-114.6835303,"id":"advbt5vf4ziw","location":"Cibola NWR--Goose Loop auto tour"},"type":"Feature","geometry":{"type":"Point","coordinates":[-114.6835303,33.3540467]}},{"properties":{"latitude":34.7274942,"column_5":6,"date":{"end_time":"2011/09/21 00:00:00 -0400","original":"9/20/2011","granularity":"day","time":"2011/09/20 00:00:00 -0400"},"longitude":-114.3164456,"id":"advbt5zpalkn","location":"I-40--exit 9 (Hwy 95)"},"type":"Feature","geometry":{"type":"Point","coordinates":[-114.3164456,34.7274942]}},{"properties":{"latitude":33.4996059,"column_5":6,"date":{"end_time":"2012/08/21 00:00:00 -0400","original":"8/20/2012","granularity":"day","time":"2012/08/20 00:00:00 -0400"},"longitude":-114.7087669,"id":"advbt5q8o4ba","location":"Hwy 78 (RIV Co.)"},"type":"Feature","geometry":{"type":"Point","coordinates":[-114.7087669,33.4996059]}},{"properties":{"latitude":29.1939193,"column_5":5,"date":{"end_time":"2001/03/16 00:00:00 -0500","original":"3/15/2001","granularity":"day","time":"2001/03/15 00:00:00 -0500"},"longitude":-98.6041869,"id":"advbt5r0t1hm","location":"Savannah Heights"},"type":"Feature","geometry":{"type":"Point","coordinates":[-98.6041869,29.1939193]}},{"properties":{"latitude":35.235,"column_5":5,"date":{"end_time":"2005/07/24 00:00:00 -0400","original":"7/23/2005","granularity":"day","time":"2005/07/23 00:00:00 -0400"},"longitude":-111.665,"id":"advbt5wu0z4e","location":"Rio de Flag--Museum of Northern Arizona"},"type":"Feature","geometry":{"type":"Point","coordinates":[-111.665,35.235]}},{"properties":{"latitude":31.508,"column_5":5,"date":{"end_time":"2005/08/18 00:00:00 -0400","original":"8/17/2005","granularity":"day","time":"2005/08/17 00:00:00 -0400"},"longitude":-110.802,"id":"advbt5yfbeho","location":"Patagonia Roadside Rest Area"},"type":"Feature","geometry":{"type":"Point","coordinates":[-110.802,31.508]}},{"properties":{"latitude":34.8855437,"column_5":5,"date":{"end_time":"2006/04/26 00:00:00 -0400","original":"4/25/2006","granularity":"day","time":"2006/04/25 00:00:00 -0400"},"longitude":-111.741643,"id":"advbt60g8e07","location":"Huckaby Trail"},"type":"Feature","geometry":{"type":"Point","coordinates":[-111.741643,34.8855437]}},{"properties":{"latitude":35.0799541,"column_5":5,"date":{"end_time":"2006/05/15 00:00:00 -0400","original":"5/14/2006","granularity":"day","time":"2006/05/14 00:00:00 -0400"},"longitude":-111.5327071,"id":"advbt6215w33","location":"Upper Lake Mary"},"type":"Feature","geometry":{"type":"Point","coordinates":[-111.5327071,35.0799541]}},{"properties":{"latitude":33.42175,"column_5":5,"date":{"end_time":"2007/03/20 00:00:00 -0400","original":"3/19/2007","granularity":"day","time":"2007/03/19 00:00:00 -0400"},"longitude":-112.0733,"id":"advbt5ri4z0d","location":"Rio Salado Project"},"type":"Feature","geometry":{"type":"Point","coordinates":[-112.0733,33.42175]}},{"properties":{"latitude":34.4171771,"column_5":5,"date":{"end_time":"2007/05/17 00:00:00 -0400","original":"5/16/2007","granularity":"day","time":"2007/05/16 00:00:00 -0400"},"longitude":-111.1542177,"id":"advbt65ybye5","location":"14/5/8"},"type":"Feature","geometry":{"type":"Point","coordinates":[-111.1542177,34.4171771]}},{"properties":{"latitude":34.0854055,"column_5":5,"date":{"end_time":"2007/08/16 00:00:00 -0400","original":"8/15/2007","granularity":"day","time":"2007/08/15 00:00:00 -0400"},"longitude":-119.0603364,"id":"advbt61c1l4m","location":"Pt. Mugu"},"type":"Feature","geometry":{"type":"Point","coordinates":[-119.0603364,34.0854055]}},{"properties":{"latitude":34.6350692,"column_5":5,"date":{"end_time":"2008/10/30 00:00:00 -0400","original":"10/29/2008","granularity":"day","time":"2008/10/29 00:00:00 -0400"},"longitude":-119.29987,"id":"advbt5vk0969","location":"Pine Mtn."},"type":"Feature","geometry":{"type":"Point","coordinates":[-119.29987,34.6350692]}},{"properties":{"latitude":33.7395437,"column_5":5,"date":{"end_time":"2008/11/27 00:00:00 -0500","original":"11/26/2008","granularity":"day","time":"2008/11/26 00:00:00 -0500"},"longitude":-115.3928375,"id":"advbt62zlzdy","location":"Desert Center--Lake Tamarisk Golf Course"},"type":"Feature","geometry":{"type":"Point","coordinates":[-115.3928375,33.7395437]}},{"properties":{"latitude":41.1325124,"column_5":5,"date":{"end_time":"2009/08/30 00:00:00 -0400","original":"8/29/2009","granularity":"day","time":"2009/08/29 00:00:00 -0400"},"longitude":-83.6218357,"id":"advbt611kgf0","location":"Van Buren State Park - East"},"type":"Feature","geometry":{"type":"Point","coordinates":[-83.6218357,41.1325124]}},{"properties":{"latitude":41.1322538,"column_5":5,"date":{"end_time":"2009/09/04 00:00:00 -0400","original":"9/3/2009","granularity":"day","time":"2009/09/03 00:00:00 -0400"},"longitude":-83.6415768,"id":"advbt63299x8","location":"Van Buren State Park West"},"type":"Feature","geometry":{"type":"Point","coordinates":[-83.6415768,41.1322538]}},{"properties":{"latitude":41.142313,"column_5":5,"date":{"end_time":"2009/09/09 00:00:00 -0400","original":"9/8/2009","granularity":"day","time":"2009/09/08 00:00:00 -0400"},"longitude":-83.4268358,"id":"advbt61to972","location":"Lake Mosier"},"type":"Feature","geometry":{"type":"Point","coordinates":[-83.4268358,41.142313]}},{"properties":{"latitude":46.2309601,"column_5":5,"date":{"end_time":"2010/01/24 00:00:00 -0500","original":"1/23/2010","granularity":"day","time":"2010/01/23 00:00:00 -0500"},"longitude":-119.1958022,"id":"advbt60n7u74","location":"Columbia Park (Kennewick)"},"type":"Feature","geometry":{"type":"Point","coordinates":[-119.1958022,46.2309601]}},{"properties":{"latitude":10.3411801,"column_5":5,"date":{"end_time":"2010/04/15 00:00:00 -0400","original":"4/14/2010","granularity":"day","time":"2010/04/14 00:00:00 -0400"},"longitude":-83.9550304,"id":"advbt5swc48s","location":"Horquetas"},"type":"Feature","geometry":{"type":"Point","coordinates":[-83.9550304,10.3411801]}},{"properties":{"latitude":34.3511603,"column_5":5,"date":{"end_time":"2010/12/27 00:00:00 -0500","original":"12/26/2010","granularity":"day","time":"2010/12/26 00:00:00 -0500"},"longitude":-114.1957569,"id":"advbt5yt4na7","location":"Black Meadow Landing"},"type":"Feature","geometry":{"type":"Point","coordinates":[-114.1957569,34.3511603]}},{"properties":{"latitude":34.4713965,"column_5":5,"date":{"end_time":"2011/01/04 00:00:00 -0500","original":"1/3/2011","granularity":"day","time":"2011/01/03 00:00:00 -0500"},"longitude":-114.3474627,"id":"advbt5xletae","location":"Lake Havasu City - London Bridge"},"type":"Feature","geometry":{"type":"Point","coordinates":[-114.3474627,34.4713965]}},{"properties":{"latitude":33.9559978,"column_5":5,"date":{"end_time":"2011/01/09 00:00:00 -0500","original":"1/8/2011","granularity":"day","time":"2011/01/08 00:00:00 -0500"},"longitude":-114.5020008,"id":"advbt5znfcnw","location":"McCabe Rd cottonwoods"},"type":"Feature","geometry":{"type":"Point","coordinates":[-114.5020008,33.9559978]}},{"properties":{"latitude":34.52254,"column_5":5,"date":{"end_time":"2011/01/23 00:00:00 -0500","original":"1/22/2011","granularity":"day","time":"2011/01/22 00:00:00 -0500"},"longitude":-114.3836403,"id":"advbt5rcy7ty","location":"Lake Havasu (Ca) north end by boat"},"type":"Feature","geometry":{"type":"Point","coordinates":[-114.3836403,34.52254]}},{"properties":{"latitude":35.1710019,"column_5":5,"date":{"end_time":"2011/01/30 00:00:00 -0500","original":"1/29/2011","granularity":"day","time":"2011/01/29 00:00:00 -0500"},"longitude":-114.5726395,"id":"advbt5xdmurh","location":"Laughlin/Bullhead City Birdge - park"},"type":"Feature","geometry":{"type":"Point","coordinates":[-114.5726395,35.1710019]}},{"properties":{"latitude":35.1445381,"column_5":5,"date":{"end_time":"2011/02/06 00:00:00 -0500","original":"2/5/2011","granularity":"day","time":"2011/02/05 00:00:00 -0500"},"longitude":-114.5758367,"id":"advbt5tlu9k8","location":"Laughlin--Harrah's Casino"},"type":"Feature","geometry":{"type":"Point","coordinates":[-114.5758367,35.1445381]}},{"properties":{"latitude":34.6979431,"column_5":5,"date":{"end_time":"2011/02/28 00:00:00 -0500","original":"2/27/2011","granularity":"day","time":"2011/02/27 00:00:00 -0500"},"longitude":-113.5958862,"id":"advbt60ga551","location":"Big Sandy River @ Wikieup"},"type":"Feature","geometry":{"type":"Point","coordinates":[-113.5958862,34.6979431]}},{"properties":{"latitude":34.5098585,"column_5":5,"date":{"end_time":"2011/09/21 00:00:00 -0400","original":"9/20/2011","granularity":"day","time":"2011/09/20 00:00:00 -0400"},"longitude":-114.3155122,"id":"advbt5zlaz4h","location":"Havasupai Elementary"},"type":"Feature","geometry":{"type":"Point","coordinates":[-114.3155122,34.5098585]}},{"properties":{"latitude":34.9205412,"column_5":5,"date":{"end_time":"2011/11/26 00:00:00 -0500","original":"11/25/2011","granularity":"day","time":"2011/11/25 00:00:00 -0500"},"longitude":-114.5714593,"id":"advbt60k05ja","location":"Mohave Valley--northeastern"},"type":"Feature","geometry":{"type":"Point","coordinates":[-114.5714593,34.9205412]}},{"properties":{"latitude":34.128329,"column_5":5,"date":{"end_time":"2012/01/06 00:00:00 -0500","original":"1/5/2012","granularity":"day","time":"2012/01/05 00:00:00 -0500"},"longitude":-114.3101491,"id":"advbt62ezxu3","location":"CRIT HQ"},"type":"Feature","geometry":{"type":"Point","coordinates":[-114.3101491,34.128329]}},{"properties":{"latitude":32.9701287,"column_5":5,"date":{"end_time":"2012/03/11 00:00:00 -0500","original":"3/10/2012","granularity":"day","time":"2012/03/10 00:00:00 -0500"},"longitude":-114.4642391,"id":"advbt61s4cum","location":"Martinez Lake--Fishers Landing"},"type":"Feature","geometry":{"type":"Point","coordinates":[-114.4642391,32.9701287]}},{"properties":{"latitude":34.483748,"column_5":5,"date":{"end_time":"2012/11/29 00:00:00 -0500","original":"11/28/2012","granularity":"day","time":"2012/11/28 00:00:00 -0500"},"longitude":-114.355492,"id":"advbt5vzy9t9","location":"Lake Havasu State Park--Cactus Garden"},"type":"Feature","geometry":{"type":"Point","coordinates":[-114.355492,34.483748]}},{"properties":{"latitude":36.5188971,"column_5":5,"date":{"end_time":"2013/01/18 00:00:00 -0500","original":"1/17/2013","granularity":"day","time":"2013/01/17 00:00:00 -0500"},"longitude":-114.4211912,"id":"advbt63ulznf","location":"Overton WMA"},"type":"Feature","geometry":{"type":"Point","coordinates":[-114.4211912,36.5188971]}},{"properties":{"latitude":31.528,"column_5":4,"date":{"end_time":"2005/08/20 00:00:00 -0400","original":"8/19/2005","granularity":"day","time":"2005/08/19 00:00:00 -0400"},"longitude":-110.775,"id":"advbt626s1vl","location":"Patagonia-Sonoita Creek Preserve"},"type":"Feature","geometry":{"type":"Point","coordinates":[-110.775,31.528]}},{"properties":{"latitude":32.2298515,"column_5":4,"date":{"end_time":"2006/04/28 00:00:00 -0400","original":"4/27/2006","granularity":"day","time":"2006/04/27 00:00:00 -0400"},"longitude":-109.8243175,"id":"advbt62iwpeg","location":"Willcox--Lake Cochise and Twin Lakes Golf Course"},"type":"Feature","geometry":{"type":"Point","coordinates":[-109.8243175,32.2298515]}},{"properties":{"latitude":36.6432881,"column_5":4,"date":{"end_time":"2006/06/14 00:00:00 -0400","original":"6/13/2006","granularity":"day","time":"2006/06/13 00:00:00 -0400"},"longitude":-112.3749593,"id":"advbt60lhvfv","location":"Kaibab NF--North Kaibab--survey 30160088"},"type":"Feature","geometry":{"type":"Point","coordinates":[-112.3749593,36.6432881]}},{"properties":{"latitude":35.0943499,"column_5":4,"date":{"end_time":"2006/12/17 00:00:00 -0500","original":"12/16/2006","granularity":"day","time":"2006/12/16 00:00:00 -0500"},"longitude":-111.5245342,"id":"advbt61myuw6","location":"Anderson Mesa Observatory"},"type":"Feature","geometry":{"type":"Point","coordinates":[-111.5245342,35.0943499]}},{"properties":{"latitude":35.1875583,"column_5":4,"date":{"end_time":"2007/02/22 00:00:00 -0500","original":"2/21/2007","granularity":"day","time":"2007/02/21 00:00:00 -0500"},"longitude":-111.5871263,"id":"advbt5wygk8j","location":"Lake Elaine"},"type":"Feature","geometry":{"type":"Point","coordinates":[-111.5871263,35.1875583]}},{"properties":{"latitude":32.278549,"column_5":4,"date":{"end_time":"2007/03/18 00:00:00 -0400","original":"3/17/2007","granularity":"day","time":"2007/03/17 00:00:00 -0400"},"longitude":-111.022495,"id":"advbt5qyhpbe","location":"Sweetwater Wetlands"},"type":"Feature","geometry":{"type":"Point","coordinates":[-111.022495,32.278549]}},{"properties":{"latitude":33.9906131,"column_5":4,"date":{"end_time":"2007/04/14 00:00:00 -0400","original":"4/13/2007","granularity":"day","time":"2007/04/13 00:00:00 -0400"},"longitude":-112.6894176,"id":"advbt5vowivk","location":"Wickenberg, Yavapai County"},"type":"Feature","geometry":{"type":"Point","coordinates":[-112.6894176,33.9906131]}},{"properties":{"latitude":34.0729256,"column_5":4,"date":{"end_time":"2007/08/16 00:00:00 -0400","original":"8/15/2007","granularity":"day","time":"2007/08/15 00:00:00 -0400"},"longitude":-119.0135515,"id":"advbt5vjfkb6","location":"Sycamore Canyon (VEN Co.)"},"type":"Feature","geometry":{"type":"Point","coordinates":[-119.0135515,34.0729256]}},{"properties":{"latitude":31.712726,"column_5":4,"date":{"end_time":"2008/01/23 00:00:00 -0500","original":"1/22/2008","granularity":"day","time":"2008/01/22 00:00:00 -0500"},"longitude":-110.874989,"id":"advbt5x8oe7i","location":"Madera Canyon--upper canyon"},"type":"Feature","geometry":{"type":"Point","coordinates":[-110.874989,31.712726]}},{"properties":{"latitude":35.8753596,"column_5":4,"date":{"end_time":"2008/04/18 00:00:00 -0400","original":"4/17/2008","granularity":"day","time":"2008/04/17 00:00:00 -0400"},"longitude":-111.4072412,"id":"advbt64jiy9s","location":"Cameron Seep"},"type":"Feature","geometry":{"type":"Point","coordinates":[-111.4072412,35.8753596]}},{"properties":{"latitude":34.605,"column_5":4,"date":{"end_time":"2008/04/24 00:00:00 -0400","original":"4/23/2008","granularity":"day","time":"2008/04/23 00:00:00 -0400"},"longitude":-112.438,"id":"advbt5r3fogv","location":"Prescott--Willow Lake"},"type":"Feature","geometry":{"type":"Point","coordinates":[-112.438,34.605]}},{"properties":{"latitude":34.235222,"column_5":4,"date":{"end_time":"2008/09/04 00:00:00 -0400","original":"9/3/2008","granularity":"day","time":"2008/09/03 00:00:00 -0400"},"longitude":-119.2618275,"id":"advbt5pqvr8c","location":"Santa Clara River Estuary"},"type":"Feature","geometry":{"type":"Point","coordinates":[-119.2618275,34.235222]}},{"properties":{"latitude":35.1081132,"column_5":4,"date":{"end_time":"2008/09/13 00:00:00 -0400","original":"9/12/2008","granularity":"day","time":"2008/09/12 00:00:00 -0400"},"longitude":-120.6256771,"id":"advbt5x4bfhl","location":"Oceano Lagoon"},"type":"Feature","geometry":{"type":"Point","coordinates":[-120.6256771,35.1081132]}},{"properties":{"latitude":36.9026855,"column_5":4,"date":{"end_time":"2008/09/14 00:00:00 -0400","original":"9/13/2008","granularity":"day","time":"2008/09/13 00:00:00 -0400"},"longitude":-122.2270203,"id":"advbt5y41i0g","location":"Offshore (SCZ Co.)"},"type":"Feature","geometry":{"type":"Point","coordinates":[-122.2270203,36.9026855]}},{"properties":{"latitude":34.1291066,"column_5":4,"date":{"end_time":"2008/10/22 00:00:00 -0400","original":"10/21/2008","granularity":"day","time":"2008/10/21 00:00:00 -0400"},"longitude":-119.1537666,"id":"advbt5q1bk09","location":"Arnold Rd"},"type":"Feature","geometry":{"type":"Point","coordinates":[-119.1537666,34.1291066]}},{"properties":{"latitude":34.2470358,"column_5":4,"date":{"end_time":"2008/10/27 00:00:00 -0400","original":"10/26/2008","granularity":"day","time":"2008/10/26 00:00:00 -0400"},"longitude":-119.1667378,"id":"advbt65g3fn1","location":"River View Park"},"type":"Feature","geometry":{"type":"Point","coordinates":[-119.1667378,34.2470358]}},{"properties":{"latitude":34.2761503,"column_5":4,"date":{"end_time":"2008/11/19 00:00:00 -0500","original":"11/18/2008","granularity":"day","time":"2008/11/18 00:00:00 -0500"},"longitude":-119.3099996,"id":"advbt5yr3ooy","location":"Ventura River Estuary"},"type":"Feature","geometry":{"type":"Point","coordinates":[-119.3099996,34.2761503]}},{"properties":{"latitude":32.9067338,"column_5":4,"date":{"end_time":"2008/12/18 00:00:00 -0500","original":"12/17/2008","granularity":"day","time":"2008/12/17 00:00:00 -0500"},"longitude":-114.4802499,"id":"advbt5vlydgj","location":"Senator Wash Reservoir"},"type":"Feature","geometry":{"type":"Point","coordinates":[-114.4802499,32.9067338]}},{"properties":{"latitude":41.1321569,"column_5":4,"date":{"end_time":"2009/09/09 00:00:00 -0400","original":"9/8/2009","granularity":"day","time":"2009/09/08 00:00:00 -0400"},"longitude":-83.4517909,"id":"advbt5s2o5x9","location":"Veterans Memorial Lake"},"type":"Feature","geometry":{"type":"Point","coordinates":[-83.4517909,41.1321569]}},{"properties":{"latitude":40.9042691,"column_5":4,"date":{"end_time":"2009/09/15 00:00:00 -0400","original":"9/14/2009","granularity":"day","time":"2009/09/14 00:00:00 -0400"},"longitude":-83.6078453,"id":"advbt5uw8gv2","location":"Site 7 - Hancock County"},"type":"Feature","geometry":{"type":"Point","coordinates":[-83.6078453,40.9042691]}},{"properties":{"latitude":33.1722397,"column_5":4,"date":{"end_time":"2009/12/23 00:00:00 -0500","original":"12/22/2009","granularity":"day","time":"2009/12/22 00:00:00 -0500"},"longitude":-115.6427077,"id":"advbt5t41dsp","location":"Salton Sea--Obsidian Butte"},"type":"Feature","geometry":{"type":"Point","coordinates":[-115.6427077,33.1722397]}},{"properties":{"latitude":36.9029257,"column_5":4,"date":{"end_time":"2010/01/26 00:00:00 -0500","original":"1/25/2010","granularity":"day","time":"2010/01/25 00:00:00 -0500"},"longitude":-113.9345956,"id":"advbt5xn3nds","location":"Beaver Dam Wash"},"type":"Feature","geometry":{"type":"Point","coordinates":[-113.9345956,36.9029257]}},{"properties":{"latitude":10.5386111,"column_5":4,"date":{"end_time":"2010/04/13 00:00:00 -0400","original":"4/12/2010","granularity":"day","time":"2010/04/12 00:00:00 -0400"},"longitude":-83.5025,"id":"advbt61m887e","location":"Tortuguero"},"type":"Feature","geometry":{"type":"Point","coordinates":[-83.5025,10.5386111]}},{"properties":{"latitude":43.3995598,"column_5":4,"date":{"end_time":"2010/05/28 00:00:00 -0400","original":"5/27/2010","granularity":"day","time":"2010/05/27 00:00:00 -0400"},"longitude":-118.9826202,"id":"advbt5t43nn8","location":"Highway 205 between Burns and Malheur Lake"},"type":"Feature","geometry":{"type":"Point","coordinates":[-118.9826202,43.3995598]}},{"properties":{"latitude":42.2640982,"column_5":4,"date":{"end_time":"2010/05/30 00:00:00 -0400","original":"5/29/2010","granularity":"day","time":"2010/05/29 00:00:00 -0400"},"longitude":-118.6732864,"id":"advbt5znq8sp","location":"Fields Oasis"},"type":"Feature","geometry":{"type":"Point","coordinates":[-118.6732864,42.2640982]}},{"properties":{"latitude":42.827796,"column_5":4,"date":{"end_time":"2010/06/12 00:00:00 -0400","original":"6/11/2010","granularity":"day","time":"2010/06/11 00:00:00 -0400"},"longitude":-118.887434,"id":"advbt5udrcfh","location":"Malheur NWR--P Ranch"},"type":"Feature","geometry":{"type":"Point","coordinates":[-118.887434,42.827796]}},{"properties":{"latitude":42.87742,"column_5":4,"date":{"end_time":"2010/06/24 00:00:00 -0400","original":"6/23/2010","granularity":"day","time":"2010/06/23 00:00:00 -0400"},"longitude":-118.8861,"id":"advbt5tdkred","location":"Malheur NWR--South CPR"},"type":"Feature","geometry":{"type":"Point","coordinates":[-118.8861,42.87742]}},{"properties":{"latitude":33.9555409,"column_5":4,"date":{"end_time":"2010/11/23 00:00:00 -0500","original":"11/22/2010","granularity":"day","time":"2010/11/22 00:00:00 -0500"},"longitude":-114.4176891,"id":"advbt64tj3gz","location":"Parker Valley--McCabe Rd"},"type":"Feature","geometry":{"type":"Point","coordinates":[-114.4176891,33.9555409]}},{"properties":{"latitude":32.6541181,"column_5":4,"date":{"end_time":"2010/12/05 00:00:00 -0500","original":"12/4/2010","granularity":"day","time":"2010/12/04 00:00:00 -0500"},"longitude":-111.5948296,"id":"advbt5ypp3mp","location":"Evergreen Turf Sod Farm--Tweedy/Pretzer"},"type":"Feature","geometry":{"type":"Point","coordinates":[-111.5948296,32.6541181]}},{"properties":{"latitude":34.2728219,"column_5":4,"date":{"end_time":"2011/01/03 00:00:00 -0500","original":"1/2/2011","granularity":"day","time":"2011/01/02 00:00:00 -0500"},"longitude":-114.0452957,"id":"advbt64xrulg","location":"Bill Williams River NWR"},"type":"Feature","geometry":{"type":"Point","coordinates":[-114.0452957,34.2728219]}},{"properties":{"latitude":34.8434298,"column_5":4,"date":{"end_time":"2011/01/06 00:00:00 -0500","original":"1/5/2011","granularity":"day","time":"2011/01/05 00:00:00 -0500"},"longitude":-114.6015644,"id":"advbt5qm4r6i","location":"Needles Municipal Golf Course"},"type":"Feature","geometry":{"type":"Point","coordinates":[-114.6015644,34.8434298]}},{"properties":{"latitude":34.1237778,"column_5":4,"date":{"end_time":"2011/01/16 00:00:00 -0500","original":"1/15/2011","granularity":"day","time":"2011/01/15 00:00:00 -0500"},"longitude":-114.3598652,"id":"advbt5t03ms9","location":"Big River--state line pond (AZ)"},"type":"Feature","geometry":{"type":"Point","coordinates":[-114.3598652,34.1237778]}},{"properties":{"latitude":34.1763052,"column_5":4,"date":{"end_time":"2011/01/16 00:00:00 -0500","original":"1/15/2011","granularity":"day","time":"2011/01/15 00:00:00 -0500"},"longitude":-114.2736912,"id":"advbt5tz325i","location":"Moovalya Lake (CA)"},"type":"Feature","geometry":{"type":"Point","coordinates":[-114.2736912,34.1763052]}},{"properties":{"latitude":34.2931048,"column_5":4,"date":{"end_time":"2011/01/18 00:00:00 -0500","original":"1/17/2011","granularity":"day","time":"2011/01/17 00:00:00 -0500"},"longitude":-113.5531425,"id":"advbt63glamg","location":"Alamo Lake--Upper"},"type":"Feature","geometry":{"type":"Point","coordinates":[-113.5531425,34.2931048]}},{"properties":{"latitude":34.5265,"column_5":4,"date":{"end_time":"2011/01/23 00:00:00 -0500","original":"1/22/2011","granularity":"day","time":"2011/01/22 00:00:00 -0500"},"longitude":-114.3757868,"id":"advbt5wm04ne","location":"Lake Havasu (Az) north end by boat"},"type":"Feature","geometry":{"type":"Point","coordinates":[-114.3757868,34.5265]}},{"properties":{"latitude":35.1444767,"column_5":4,"date":{"end_time":"2011/02/21 00:00:00 -0500","original":"2/20/2011","granularity":"day","time":"2011/02/20 00:00:00 -0500"},"longitude":-114.5726824,"id":"advbt5xdv7z2","location":"Bullhead City - end of 2nd st"},"type":"Feature","geometry":{"type":"Point","coordinates":[-114.5726824,35.1444767]}},{"properties":{"latitude":34.307073,"column_5":4,"date":{"end_time":"2011/03/02 00:00:00 -0500","original":"3/1/2011","granularity":"day","time":"2011/03/01 00:00:00 -0500"},"longitude":-114.1354179,"id":"advbt5x4413b","location":"Take off Point Mohave"},"type":"Feature","geometry":{"type":"Point","coordinates":[-114.1354179,34.307073]}},{"properties":{"latitude":35.3296915,"column_5":4,"date":{"end_time":"2011/07/17 00:00:00 -0400","original":"7/16/2011","granularity":"day","time":"2011/07/16 00:00:00 -0400"},"longitude":-113.9007568,"id":"advbt5wv3r6y","location":"Rt 66 Walapai area"},"type":"Feature","geometry":{"type":"Point","coordinates":[-113.9007568,35.3296915]}},{"properties":{"latitude":35.0912487,"column_5":4,"date":{"end_time":"2011/10/17 00:00:00 -0400","original":"10/16/2011","granularity":"day","time":"2011/10/16 00:00:00 -0400"},"longitude":-114.6182907,"id":"advbt5xmud8r","location":"Bullhead City--Rotary Park STP"},"type":"Feature","geometry":{"type":"Point","coordinates":[-114.6182907,35.0912487]}},{"properties":{"latitude":34.4574911,"column_5":4,"date":{"end_time":"2011/11/27 00:00:00 -0500","original":"11/26/2011","granularity":"day","time":"2011/11/26 00:00:00 -0500"},"longitude":-114.3459177,"id":"advbt5vt3je6","location":"Thompson Bay"},"type":"Feature","geometry":{"type":"Point","coordinates":[-114.3459177,34.4574911]}},{"properties":{"latitude":36.2111068,"column_5":4,"date":{"end_time":"2012/01/01 00:00:00 -0500","original":"12/31/2011","granularity":"day","time":"2011/12/31 00:00:00 -0500"},"longitude":-119.2602544,"id":"advbt5s9ogge","location":"Tulare-area ag fields"},"type":"Feature","geometry":{"type":"Point","coordinates":[-119.2602544,36.2111068]}},{"properties":{"latitude":34.0421341,"column_5":4,"date":{"end_time":"2012/01/30 00:00:00 -0500","original":"1/29/2012","granularity":"day","time":"2012/01/29 00:00:00 -0500"},"longitude":-114.414711,"id":"advbt65tjoie","location":"Parker Valley Wilson Rd west"},"type":"Feature","geometry":{"type":"Point","coordinates":[-114.414711,34.0421341]}},{"properties":{"latitude":35.5342417,"column_5":4,"date":{"end_time":"2012/02/05 00:00:00 -0500","original":"2/4/2012","granularity":"day","time":"2012/02/04 00:00:00 -0500"},"longitude":-114.05,"id":"advbt5uofanx","location":"Hualapai Valley--Western"},"type":"Feature","geometry":{"type":"Point","coordinates":[-114.05,35.5342417]}},{"properties":{"latitude":35.5012929,"column_5":4,"date":{"end_time":"2012/02/06 00:00:00 -0500","original":"2/5/2012","granularity":"day","time":"2012/02/05 00:00:00 -0500"},"longitude":-114.5268058,"id":"advbt5vajrv9","location":"Black Mountains--Cottonwood Rd Pass"},"type":"Feature","geometry":{"type":"Point","coordinates":[-114.5268058,35.5012929]}},{"properties":{"latitude":33.6622248,"column_5":4,"date":{"end_time":"2012/03/09 00:00:00 -0500","original":"3/8/2012","granularity":"day","time":"2012/03/08 00:00:00 -0500"},"longitude":-114.533392,"id":"advbt6173st9","location":"6th Avenue"},"type":"Feature","geometry":{"type":"Point","coordinates":[-114.533392,33.6622248]}},{"properties":{"latitude":34.829798,"column_5":4,"date":{"end_time":"2013/04/15 00:00:00 -0400","original":"4/14/2013","granularity":"day","time":"2013/04/14 00:00:00 -0400"},"longitude":-114.557104,"id":"advbt5u2b6e2","location":"Havasu NWR north wilderness"},"type":"Feature","geometry":{"type":"Point","coordinates":[-114.557104,34.829798]}},{"properties":{"latitude":26.1787023,"column_5":3,"date":{"end_time":"2001/02/19 00:00:00 -0500","original":"2/18/2001","granularity":"day","time":"2001/02/18 00:00:00 -0500"},"longitude":-98.3860016,"id":"advbt5toaxl3","location":"Bentsen-Rio Grande Val. SP WBC (Mission) (LTC 069)"},"type":"Feature","geometry":{"type":"Point","coordinates":[-98.3860016,26.1787023]}},{"properties":{"latitude":35.26498,"column_5":3,"date":{"end_time":"2003/09/21 00:00:00 -0400","original":"9/20/2003","granularity":"day","time":"2003/09/20 00:00:00 -0400"},"longitude":-116.07485,"id":"advbt5yihgdx","location":"Baker"},"type":"Feature","geometry":{"type":"Point","coordinates":[-116.07485,35.26498]}},{"properties":{"latitude":35.772964,"column_5":3,"date":{"end_time":"2003/09/21 00:00:00 -0400","original":"9/20/2003","granularity":"day","time":"2003/09/20 00:00:00 -0400"},"longitude":-115.88819,"id":"advbt63i8wtk","location":"Horse Thief Springs"},"type":"Feature","geometry":{"type":"Point","coordinates":[-115.88819,35.772964]}},{"properties":{"latitude":35.669,"column_5":3,"date":{"end_time":"2004/01/11 00:00:00 -0500","original":"1/10/2004","granularity":"day","time":"2004/01/10 00:00:00 -0500"},"longitude":-118.306,"id":"advbt64gpm37","location":"Kern River Preserve--Headquarters"},"type":"Feature","geometry":{"type":"Point","coordinates":[-118.306,35.669]}},{"properties":{"latitude":34.82719,"column_5":3,"date":{"end_time":"2004/01/18 00:00:00 -0500","original":"1/17/2004","granularity":"day","time":"2004/01/17 00:00:00 -0500"},"longitude":-116.68886,"id":"advbt5qnfbrh","location":"Newberry Springs"},"type":"Feature","geometry":{"type":"Point","coordinates":[-116.68886,34.82719]}},{"properties":{"latitude":31.3769,"column_5":3,"date":{"end_time":"2005/08/18 00:00:00 -0400","original":"8/17/2005","granularity":"day","time":"2005/08/17 00:00:00 -0400"},"longitude":-110.8543,"id":"advbt5ra62x8","location":"Kino Springs"},"type":"Feature","geometry":{"type":"Point","coordinates":[-110.8543,31.3769]}},{"properties":{"latitude":31.4456005,"column_5":3,"date":{"end_time":"2005/08/19 00:00:00 -0400","original":"8/18/2005","granularity":"day","time":"2005/08/18 00:00:00 -0400"},"longitude":-110.3124008,"id":"advbt5r9r1ox","location":"Ramsey Canyon Preserve"},"type":"Feature","geometry":{"type":"Point","coordinates":[-110.3124008,31.4456005]}},{"properties":{"latitude":31.5478992,"column_5":3,"date":{"end_time":"2005/08/19 00:00:00 -0400","original":"8/18/2005","granularity":"day","time":"2005/08/18 00:00:00 -0400"},"longitude":-110.1408997,"id":"advbt5v11q7v","location":"San Pedro RNCA--San Pedro House"},"type":"Feature","geometry":{"type":"Point","coordinates":[-110.1408997,31.5478992]}},{"properties":{"latitude":33.1965376,"column_5":3,"date":{"end_time":"2006/11/20 00:00:00 -0500","original":"11/19/2006","granularity":"day","time":"2006/11/19 00:00:00 -0500"},"longitude":-115.6128216,"id":"advbt5u8varg","location":"Salton Sea--Red Hill area"},"type":"Feature","geometry":{"type":"Point","coordinates":[-115.6128216,33.1965376]}},{"properties":{"latitude":34.6794657,"column_5":3,"date":{"end_time":"2007/01/01 00:00:00 -0500","original":"12/31/2006","granularity":"day","time":"2006/12/31 00:00:00 -0500"},"longitude":-111.7232966,"id":"advbt5pxud1h","location":"Red Tank Draw"},"type":"Feature","geometry":{"type":"Point","coordinates":[-111.7232966,34.6794657]}},{"properties":{"latitude":31.4421997,"column_5":3,"date":{"end_time":"2007/03/23 00:00:00 -0400","original":"3/22/2007","granularity":"day","time":"2007/03/22 00:00:00 -0400"},"longitude":-110.2855988,"id":"advbt5ty3n3t","location":"Carr Canyon"},"type":"Feature","geometry":{"type":"Point","coordinates":[-110.2855988,31.4421997]}},{"properties":{"latitude":34.6492745,"column_5":3,"date":{"end_time":"2007/05/13 00:00:00 -0400","original":"5/12/2007","granularity":"day","time":"2007/05/12 00:00:00 -0400"},"longitude":-111.7516972,"id":"advbt608tydz","location":"Montezuma Castle NM--Montezuma Well"},"type":"Feature","geometry":{"type":"Point","coordinates":[-111.7516972,34.6492745]}},{"properties":{"latitude":34.4136013,"column_5":3,"date":{"end_time":"2007/08/17 00:00:00 -0400","original":"8/16/2007","granularity":"day","time":"2007/08/16 00:00:00 -0400"},"longitude":-119.8756027,"id":"advbt5te6mcs","location":"Devereux Slough"},"type":"Feature","geometry":{"type":"Point","coordinates":[-119.8756027,34.4136013]}},{"properties":{"latitude":36.1281698,"column_5":3,"date":{"end_time":"2007/09/02 00:00:00 -0400","original":"9/1/2007","granularity":"day","time":"2007/09/01 00:00:00 -0400"},"longitude":-111.2120247,"id":"advbt5v407c6","location":"Pasture Canyon"},"type":"Feature","geometry":{"type":"Point","coordinates":[-111.2120247,36.1281698]}},{"properties":{"latitude":33.3624704,"column_5":3,"date":{"end_time":"2007/11/24 00:00:00 -0500","original":"11/23/2007","granularity":"day","time":"2007/11/23 00:00:00 -0500"},"longitude":-112.6889563,"id":"advbt5swe7m1","location":"Lower River Road Ponds"},"type":"Feature","geometry":{"type":"Point","coordinates":[-112.6889563,33.3624704]}},{"properties":{"latitude":34.13035,"column_5":3,"date":{"end_time":"2008/09/04 00:00:00 -0400","original":"9/3/2008","granularity":"day","time":"2008/09/03 00:00:00 -0400"},"longitude":-119.1446257,"id":"advbt5suqs6c","location":"Casper Rd."},"type":"Feature","geometry":{"type":"Point","coordinates":[-119.1446257,34.13035]}},{"properties":{"latitude":36.8200041,"column_5":3,"date":{"end_time":"2008/09/16 00:00:00 -0400","original":"9/15/2008","granularity":"day","time":"2008/09/15 00:00:00 -0400"},"longitude":-122.0137024,"id":"advbt5wio6dw","location":"Monterey Bay pelagic (SCZ Co.)"},"type":"Feature","geometry":{"type":"Point","coordinates":[-122.0137024,36.8200041]}},{"properties":{"latitude":34.1472578,"column_5":3,"date":{"end_time":"2008/10/26 00:00:00 -0400","original":"10/25/2008","granularity":"day","time":"2008/10/25 00:00:00 -0400"},"longitude":-119.1490931,"id":"advbt5vzkdig","location":"Hueneme Rd.--Arnold Rd. to Casper Rd."},"type":"Feature","geometry":{"type":"Point","coordinates":[-119.1490931,34.1472578]}},{"properties":{"latitude":34.2733696,"column_5":3,"date":{"end_time":"2008/10/27 00:00:00 -0400","original":"10/26/2008","granularity":"day","time":"2008/10/26 00:00:00 -0400"},"longitude":-119.1251398,"id":"advbt62f025p","location":"Saticoy Spreading Ponds"},"type":"Feature","geometry":{"type":"Point","coordinates":[-119.1251398,34.2733696]}},{"properties":{"latitude":34.2665092,"column_5":3,"date":{"end_time":"2008/11/11 00:00:00 -0500","original":"11/10/2008","granularity":"day","time":"2008/11/10 00:00:00 -0500"},"longitude":-118.7640953,"id":"advbt5qqvosw","location":"Rancho Simi Community Park"},"type":"Feature","geometry":{"type":"Point","coordinates":[-118.7640953,34.2665092]}},{"properties":{"latitude":9.5475356,"column_5":3,"date":{"end_time":"2009/03/24 00:00:00 -0400","original":"3/23/2009","granularity":"day","time":"2009/03/23 00:00:00 -0400"},"longitude":-83.810041,"id":"advbt5xh04eu","location":"San Gerardo de Dota"},"type":"Feature","geometry":{"type":"Point","coordinates":[-83.810041,9.5475356]}},{"properties":{"latitude":10.3392381,"column_5":3,"date":{"end_time":"2009/04/28 00:00:00 -0400","original":"4/27/2009","granularity":"day","time":"2009/04/27 00:00:00 -0400"},"longitude":-83.9690208,"id":"advbt5r5xdv9","location":"Road to Rara Avis - low down"},"type":"Feature","geometry":{"type":"Point","coordinates":[-83.9690208,10.3392381]}},{"properties":{"latitude":45.5615,"column_5":3,"date":{"end_time":"2009/05/16 00:00:00 -0400","original":"5/15/2009","granularity":"day","time":"2009/05/15 00:00:00 -0400"},"longitude":-123.5091841,"id":"advbt605m82t","location":"Ben Smith Moderate"},"type":"Feature","geometry":{"type":"Point","coordinates":[-123.5091841,45.5615]}},{"properties":{"latitude":42.9566738,"column_5":3,"date":{"end_time":"2009/06/06 00:00:00 -0400","original":"6/5/2009","granularity":"day","time":"2009/06/05 00:00:00 -0400"},"longitude":-118.8657188,"id":"advbt608u61x","location":"Malheur NWR--Benson Pond"},"type":"Feature","geometry":{"type":"Point","coordinates":[-118.8657188,42.9566738]}},{"properties":{"latitude":40.9260622,"column_5":3,"date":{"end_time":"2009/08/29 00:00:00 -0400","original":"8/28/2009","granularity":"day","time":"2009/08/28 00:00:00 -0400"},"longitude":-83.5556173,"id":"advbt61p41ku","location":"Site 11A Hancock Co"},"type":"Feature","geometry":{"type":"Point","coordinates":[-83.5556173,40.9260622]}},{"properties":{"latitude":41.0327189,"column_5":3,"date":{"end_time":"2009/08/29 00:00:00 -0400","original":"8/28/2009","granularity":"day","time":"2009/08/28 00:00:00 -0400"},"longitude":-83.5562611,"id":"advbt5y6w0dk","location":"Riverbend Park"},"type":"Feature","geometry":{"type":"Point","coordinates":[-83.5562611,41.0327189]}},{"properties":{"latitude":39.6099313,"column_5":3,"date":{"end_time":"2009/11/04 00:00:00 -0500","original":"11/3/2009","granularity":"day","time":"2009/11/03 00:00:00 -0500"},"longitude":-106.0554886,"id":"advbt5tr3c5a","location":"Dillon Reservoir"},"type":"Feature","geometry":{"type":"Point","coordinates":[-106.0554886,39.6099313]}},{"properties":{"latitude":48.5377214,"column_5":3,"date":{"end_time":"2010/01/13 00:00:00 -0500","original":"1/12/2010","granularity":"day","time":"2010/01/12 00:00:00 -0500"},"longitude":-122.4649,"id":"advbt5vxvpe8","location":"Samish Flats"},"type":"Feature","geometry":{"type":"Point","coordinates":[-122.4649,48.5377214]}},{"properties":{"latitude":48.2196404,"column_5":3,"date":{"end_time":"2010/01/15 00:00:00 -0500","original":"1/14/2010","granularity":"day","time":"2010/01/14 00:00:00 -0500"},"longitude":-122.3355103,"id":"advbt5wmbv1c","location":"Stillaguamish River Delta"},"type":"Feature","geometry":{"type":"Point","coordinates":[-122.3355103,48.2196404]}},{"properties":{"latitude":33.5515871,"column_5":3,"date":{"end_time":"2010/02/17 00:00:00 -0500","original":"2/16/2010","granularity":"day","time":"2010/02/16 00:00:00 -0500"},"longitude":-111.9241528,"id":"advbt5s99j97","location":"McCormick Ranch--Camelback Lake"},"type":"Feature","geometry":{"type":"Point","coordinates":[-111.9241528,33.5515871]}},{"properties":{"latitude":33.5273153,"column_5":3,"date":{"end_time":"2010/02/18 00:00:00 -0500","original":"2/17/2010","granularity":"day","time":"2010/02/17 00:00:00 -0500"},"longitude":-112.0237595,"id":"advbt5zqzu80","location":"Arizona Biltmore"},"type":"Feature","geometry":{"type":"Point","coordinates":[-112.0237595,33.5273153]}},{"properties":{"latitude":9.9387548,"column_5":3,"date":{"end_time":"2010/03/04 00:00:00 -0500","original":"3/3/2010","granularity":"day","time":"2010/03/03 00:00:00 -0500"},"longitude":-84.0681687,"id":"advbt5qgka20","location":"Hotel Aranjuez"},"type":"Feature","geometry":{"type":"Point","coordinates":[-84.0681687,9.9387548]}},{"properties":{"latitude":43.5672909,"column_5":3,"date":{"end_time":"2010/05/26 00:00:00 -0400","original":"5/25/2010","granularity":"day","time":"2010/05/25 00:00:00 -0400"},"longitude":-119.0676928,"id":"advbt5ybmsip","location":"Burns Sewage Ponds"},"type":"Feature","geometry":{"type":"Point","coordinates":[-119.0676928,43.5672909]}},{"properties":{"latitude":42.5003265,"column_5":3,"date":{"end_time":"2010/06/20 00:00:00 -0400","original":"6/19/2010","granularity":"day","time":"2010/06/19 00:00:00 -0400"},"longitude":-119.6904874,"id":"advbt5z9wug8","location":"Hart Mountain Hot Springs"},"type":"Feature","geometry":{"type":"Point","coordinates":[-119.6904874,42.5003265]}},{"properties":{"latitude":42.924438,"column_5":3,"date":{"end_time":"2010/07/03 00:00:00 -0400","original":"7/2/2010","granularity":"day","time":"2010/07/02 00:00:00 -0400"},"longitude":-118.870406,"id":"advbt5x0dcki","location":"Malheur NWR--Dredger Pond"},"type":"Feature","geometry":{"type":"Point","coordinates":[-118.870406,42.924438]}},{"properties":{"latitude":33.522882,"column_5":3,"date":{"end_time":"2010/10/14 00:00:00 -0400","original":"10/13/2010","granularity":"day","time":"2010/10/13 00:00:00 -0400"},"longitude":-111.8430412,"id":"advbt64est8m","location":"Rousseau Sod Farm"},"type":"Feature","geometry":{"type":"Point","coordinates":[-111.8430412,33.522882]}},{"properties":{"latitude":33.5386762,"column_5":3,"date":{"end_time":"2010/11/05 00:00:00 -0400","original":"11/4/2010","granularity":"day","time":"2010/11/04 00:00:00 -0400"},"longitude":-111.4302921,"id":"advbt5rm4waz","location":"Canyon Lake"},"type":"Feature","geometry":{"type":"Point","coordinates":[-111.4302921,33.5386762]}},{"properties":{"latitude":33.5242237,"column_5":3,"date":{"end_time":"2010/11/09 00:00:00 -0500","original":"11/8/2010","granularity":"day","time":"2010/11/08 00:00:00 -0500"},"longitude":-112.286582,"id":"advbt5wo338s","location":"Glendale Recharge Ponds"},"type":"Feature","geometry":{"type":"Point","coordinates":[-112.286582,33.5242237]}},{"properties":{"latitude":33.1178563,"column_5":3,"date":{"end_time":"2010/11/17 00:00:00 -0500","original":"11/16/2010","granularity":"day","time":"2010/11/16 00:00:00 -0500"},"longitude":-115.6789112,"id":"advbt6050dm3","location":"Salton Sea--W Bowles Rd. - west end"},"type":"Feature","geometry":{"type":"Point","coordinates":[-115.6789112,33.1178563]}},{"properties":{"latitude":34.3204717,"column_5":3,"date":{"end_time":"2010/12/20 00:00:00 -0500","original":"12/19/2010","granularity":"day","time":"2010/12/19 00:00:00 -0500"},"longitude":-114.1627121,"id":"advbt5s5n5ac","location":"Lake Havasu--south (CA)"},"type":"Feature","geometry":{"type":"Point","coordinates":[-114.1627121,34.3204717]}},{"properties":{"latitude":34.4922149,"column_5":3,"date":{"end_time":"2011/01/02 00:00:00 -0500","original":"1/1/2011","granularity":"day","time":"2011/01/01 00:00:00 -0500"},"longitude":-114.3337727,"id":"advbt5rtg3ap","location":"Lake Havasu City--West/North Acoma"},"type":"Feature","geometry":{"type":"Point","coordinates":[-114.3337727,34.4922149]}},{"properties":{"latitude":34.0935038,"column_5":3,"date":{"end_time":"2011/01/09 00:00:00 -0500","original":"1/8/2011","granularity":"day","time":"2011/01/08 00:00:00 -0500"},"longitude":-114.390378,"id":"advbt5sb0u68","location":"Parker Valley - Little and 10th"},"type":"Feature","geometry":{"type":"Point","coordinates":[-114.390378,34.0935038]}},{"properties":{"latitude":34.2375281,"column_5":3,"date":{"end_time":"2011/01/27 00:00:00 -0500","original":"1/26/2011","granularity":"day","time":"2011/01/26 00:00:00 -0500"},"longitude":-114.180007,"id":"advbt5qw5x7r","location":"Parker Strip--opposite Bull Frog"},"type":"Feature","geometry":{"type":"Point","coordinates":[-114.180007,34.2375281]}},{"properties":{"latitude":35.1956774,"column_5":3,"date":{"end_time":"2011/01/30 00:00:00 -0500","original":"1/29/2011","granularity":"day","time":"2011/01/29 00:00:00 -0500"},"longitude":-114.5729399,"id":"advbt63alxgk","location":"Davis Dam (NV)"},"type":"Feature","geometry":{"type":"Point","coordinates":[-114.5729399,35.1956774]}},{"properties":{"latitude":35.476573,"column_5":3,"date":{"end_time":"2011/01/31 00:00:00 -0500","original":"1/30/2011","granularity":"day","time":"2011/01/30 00:00:00 -0500"},"longitude":-114.6607447,"id":"advbt5tvkwsh","location":"Lake Mohave--Carp Cove"},"type":"Feature","geometry":{"type":"Point","coordinates":[-114.6607447,35.476573]}},{"properties":{"latitude":35.5149195,"column_5":3,"date":{"end_time":"2011/01/31 00:00:00 -0500","original":"1/30/2011","granularity":"day","time":"2011/01/30 00:00:00 -0500"},"longitude":-114.6641564,"id":"advbt632plmu","location":"Lake Mohave--Arizona Cove"},"type":"Feature","geometry":{"type":"Point","coordinates":[-114.6641564,35.5149195]}},{"properties":{"latitude":35.4646198,"column_5":3,"date":{"end_time":"2011/01/31 00:00:00 -0500","original":"1/30/2011","granularity":"day","time":"2011/01/30 00:00:00 -0500"},"longitude":-114.6394587,"id":"advbt5t8rtrw","location":"Lake Mohave--Pot Cove"},"type":"Feature","geometry":{"type":"Point","coordinates":[-114.6394587,35.4646198]}},{"properties":{"latitude":35.123173,"column_5":3,"date":{"end_time":"2011/02/06 00:00:00 -0500","original":"2/5/2011","granularity":"day","time":"2011/02/05 00:00:00 -0500"},"longitude":-114.6284723,"id":"advbt604lzku","location":"Laughlin Bay"},"type":"Feature","geometry":{"type":"Point","coordinates":[-114.6284723,35.123173]}},{"properties":{"latitude":34.8266275,"column_5":3,"date":{"end_time":"2011/03/27 00:00:00 -0400","original":"3/26/2011","granularity":"day","time":"2011/03/26 00:00:00 -0400"},"longitude":-114.5770168,"id":"advbt62xx10c","location":"Mohave Valley--Levee Rd cottonwoods"},"type":"Feature","geometry":{"type":"Point","coordinates":[-114.5770168,34.8266275]}},{"properties":{"latitude":34.8359801,"column_5":3,"date":{"end_time":"2011/04/10 00:00:00 -0400","original":"4/9/2011","granularity":"day","time":"2011/04/09 00:00:00 -0400"},"longitude":-114.5900846,"id":"advbt5rg5d00","location":"Needles--Jack Smith Park"},"type":"Feature","geometry":{"type":"Point","coordinates":[-114.5900846,34.8359801]}},{"properties":{"latitude":33.8830369,"column_5":3,"date":{"end_time":"2011/05/02 00:00:00 -0400","original":"5/1/2011","granularity":"day","time":"2011/05/01 00:00:00 -0400"},"longitude":-114.4538713,"id":"advbt60m063p","location":"Parker Valley - Nez and Mohave Rd"},"type":"Feature","geometry":{"type":"Point","coordinates":[-114.4538713,33.8830369]}},{"properties":{"latitude":33.2444304,"column_5":3,"date":{"end_time":"2011/06/06 00:00:00 -0400","original":"6/5/2011","granularity":"day","time":"2011/06/05 00:00:00 -0400"},"longitude":-114.6668816,"id":"advbt5vpym58","location":"Cibola NWR--Cibola Lake"},"type":"Feature","geometry":{"type":"Point","coordinates":[-114.6668816,33.2444304]}},{"properties":{"latitude":33.6746623,"column_5":3,"date":{"end_time":"2011/07/22 00:00:00 -0400","original":"7/21/2011","granularity":"day","time":"2011/07/21 00:00:00 -0400"},"longitude":-113.7673545,"id":"advbt5xcuwnv","location":"Vicksburg Rd farms"},"type":"Feature","geometry":{"type":"Point","coordinates":[-113.7673545,33.6746623]}},{"properties":{"latitude":35.0090495,"column_5":3,"date":{"end_time":"2011/08/28 00:00:00 -0400","original":"8/27/2011","granularity":"day","time":"2011/08/27 00:00:00 -0400"},"longitude":-114.6327209,"id":"advbt62i0x5w","location":"Colorado River below Aztec Rd (AZ)"},"type":"Feature","geometry":{"type":"Point","coordinates":[-114.6327209,35.0090495]}},{"properties":{"latitude":34.4669772,"column_5":3,"date":{"end_time":"2011/09/23 00:00:00 -0400","original":"9/22/2011","granularity":"day","time":"2011/09/22 00:00:00 -0400"},"longitude":-114.3478435,"id":"advbt62ictbc","location":"Lake Havasu City--London Bridge Park"},"type":"Feature","geometry":{"type":"Point","coordinates":[-114.3478435,34.4669772]}},{"properties":{"latitude":34.8999406,"column_5":3,"date":{"end_time":"2011/11/17 00:00:00 -0500","original":"11/16/2011","granularity":"day","time":"2011/11/16 00:00:00 -0500"},"longitude":-114.5624685,"id":"advbt5wuisk5","location":"Vanderslice Rd - Between Laguna and Willow"},"type":"Feature","geometry":{"type":"Point","coordinates":[-114.5624685,34.8999406]}},{"properties":{"latitude":32.9804442,"column_5":3,"date":{"end_time":"2012/03/13 00:00:00 -0400","original":"3/12/2012","granularity":"day","time":"2012/03/12 00:00:00 -0400"},"longitude":-114.4705009,"id":"advbt5wbvezv","location":"Martinez Lake"},"type":"Feature","geometry":{"type":"Point","coordinates":[-114.4705009,32.9804442]}},{"properties":{"latitude":32.9977944,"column_5":3,"date":{"end_time":"2012/03/14 00:00:00 -0400","original":"3/13/2012","granularity":"day","time":"2012/03/13 00:00:00 -0400"},"longitude":-114.4927311,"id":"advbt5wuqa7b","location":"Imperial NWR (Yuma Co.)"},"type":"Feature","geometry":{"type":"Point","coordinates":[-114.4927311,32.9977944]}},{"properties":{"latitude":34.82,"column_5":3,"date":{"end_time":"2012/03/20 00:00:00 -0400","original":"3/19/2012","granularity":"day","time":"2012/03/19 00:00:00 -0400"},"longitude":-114.55,"id":"advbt5tv0hfg","location":"Havasu NWR"},"type":"Feature","geometry":{"type":"Point","coordinates":[-114.55,34.82]}},{"properties":{"latitude":33.5162249,"column_5":3,"date":{"end_time":"2012/05/07 00:00:00 -0400","original":"5/6/2012","granularity":"day","time":"2012/05/06 00:00:00 -0400"},"longitude":-114.5639243,"id":"advbt5wl3fjg","location":"Peter McIntyre County Park"},"type":"Feature","geometry":{"type":"Point","coordinates":[-114.5639243,33.5162249]}},{"properties":{"latitude":31.428,"column_5":3,"date":{"end_time":"2012/05/12 00:00:00 -0400","original":"5/11/2012","granularity":"day","time":"2012/05/11 00:00:00 -0400"},"longitude":-110.291,"id":"advbt5rvzmju","location":"Carr Canyon--Reef Townsite CG"},"type":"Feature","geometry":{"type":"Point","coordinates":[-110.291,31.428]}},{"properties":{"latitude":31.9171803,"column_5":3,"date":{"end_time":"2012/05/13 00:00:00 -0400","original":"5/12/2012","granularity":"day","time":"2012/05/12 00:00:00 -0400"},"longitude":-111.8687069,"id":"advbt64y8c35","location":"Sells, AZ"},"type":"Feature","geometry":{"type":"Point","coordinates":[-111.8687069,31.9171803]}},{"properties":{"latitude":31.9539069,"column_5":3,"date":{"end_time":"2012/05/13 00:00:00 -0400","original":"5/12/2012","granularity":"day","time":"2012/05/12 00:00:00 -0400"},"longitude":-112.7996361,"id":"advbt62590kk","location":"Organ Pipe Cactus NM"},"type":"Feature","geometry":{"type":"Point","coordinates":[-112.7996361,31.9539069]}},{"properties":{"latitude":34.2749797,"column_5":3,"date":{"end_time":"2012/05/18 00:00:00 -0400","original":"5/17/2012","granularity":"day","time":"2012/05/17 00:00:00 -0400"},"longitude":-114.0480575,"id":"advbt5v1e6ht","location":"Bill Williams River NWR--Sandy Wash (MOH)"},"type":"Feature","geometry":{"type":"Point","coordinates":[-114.0480575,34.2749797]}},{"properties":{"latitude":39.6597731,"column_5":3,"date":{"end_time":"2012/08/13 00:00:00 -0400","original":"8/12/2012","granularity":"day","time":"2012/08/12 00:00:00 -0400"},"longitude":-105.6046221,"id":"advbt5qgvruv","location":"Echo Lake area"},"type":"Feature","geometry":{"type":"Point","coordinates":[-105.6046221,39.6597731]}},{"properties":{"latitude":34.126846,"column_5":3,"date":{"end_time":"2012/10/03 00:00:00 -0400","original":"10/2/2012","granularity":"day","time":"2012/10/02 00:00:00 -0400"},"longitude":-114.3070684,"id":"advbt5rsvl42","location":"Mohave Rd Oasis"},"type":"Feature","geometry":{"type":"Point","coordinates":[-114.3070684,34.126846]}},{"properties":{"latitude":34.6103232,"column_5":3,"date":{"end_time":"2012/12/25 00:00:00 -0500","original":"12/24/2012","granularity":"day","time":"2012/12/24 00:00:00 -0500"},"longitude":-120.0399256,"id":"advbt60ozfl7","location":"Armour Ranch Rd."},"type":"Feature","geometry":{"type":"Point","coordinates":[-120.0399256,34.6103232]}},{"properties":{"latitude":33.89747,"column_5":3,"date":{"end_time":"2013/01/17 00:00:00 -0500","original":"1/16/2013","granularity":"day","time":"2013/01/16 00:00:00 -0500"},"longitude":-114.45603,"id":"advbt5z1kezs","location":"Parker valley - Navajo Rd west"},"type":"Feature","geometry":{"type":"Point","coordinates":[-114.45603,33.89747]}},{"properties":{"latitude":34.4664411,"column_5":3,"date":{"end_time":"2013/03/12 00:00:00 -0400","original":"3/11/2013","granularity":"day","time":"2013/03/11 00:00:00 -0400"},"longitude":-114.2773578,"id":"advbt62lwyuz","location":"GBBO--Medicine Bow Field House--LHC"},"type":"Feature","geometry":{"type":"Point","coordinates":[-114.2773578,34.4664411]}},{"properties":{"latitude":40.3763669,"column_5":2,"date":{"end_time":"1998/07/03 00:00:00 -0400","original":"7/2/1998","granularity":"day","time":"1998/07/02 00:00:00 -0400"},"longitude":-105.6520844,"id":"advbt5vlvmf8","location":"Rocky Mountain NP"},"type":"Feature","geometry":{"type":"Point","coordinates":[-105.6520844,40.3763669]}},{"properties":{"latitude":29.456112,"column_5":2,"date":{"end_time":"2001/05/07 00:00:00 -0400","original":"5/6/2001","granularity":"day","time":"2001/05/06 00:00:00 -0400"},"longitude":-98.47611,"id":"advbt5t939nl","location":"San Antonio- Brackenridge Park (Avenue A)"},"type":"Feature","geometry":{"type":"Point","coordinates":[-98.47611,29.456112]}},{"properties":{"latitude":27.791317,"column_5":2,"date":{"end_time":"2002/10/02 00:00:00 -0400","original":"10/1/2002","granularity":"day","time":"2002/10/01 00:00:00 -0400"},"longitude":-97.399174,"id":"advbt646t0sz","location":"Corpus Christi- Blucher Park (CTC 071)"},"type":"Feature","geometry":{"type":"Point","coordinates":[-97.399174,27.791317]}},{"properties":{"latitude":33.9576699,"column_5":2,"date":{"end_time":"2003/03/15 00:00:00 -0500","original":"3/14/2003","granularity":"day","time":"2003/03/14 00:00:00 -0500"},"longitude":-118.4533632,"id":"advbt5wq3tlx","location":"The Ocean, LA County"},"type":"Feature","geometry":{"type":"Point","coordinates":[-118.4533632,33.9576699]}},{"properties":{"latitude":37.7696461,"column_5":2,"date":{"end_time":"2003/03/30 00:00:00 -0500","original":"3/29/2003","granularity":"day","time":"2003/03/29 00:00:00 -0500"},"longitude":-122.4841261,"id":"advbt63sra7r","location":"Golden Gate Park"},"type":"Feature","geometry":{"type":"Point","coordinates":[-122.4841261,37.7696461]}},{"properties":{"latitude":34.97703,"column_5":2,"date":{"end_time":"2003/04/06 00:00:00 -0500","original":"4/5/2003","granularity":"day","time":"2003/04/05 00:00:00 -0500"},"longitude":-117.046585,"id":"advbt5zpzmy0","location":"Rainbow Basin"},"type":"Feature","geometry":{"type":"Point","coordinates":[-117.046585,34.97703]}},{"properties":{"latitude":35.16,"column_5":2,"date":{"end_time":"2003/04/28 00:00:00 -0400","original":"4/27/2003","granularity":"day","time":"2003/04/27 00:00:00 -0400"},"longitude":-111.733,"id":"advbt5s2317h","location":"The Arboretum at Flagstaff"},"type":"Feature","geometry":{"type":"Point","coordinates":[-111.733,35.16]}},{"properties":{"latitude":35.95424,"column_5":2,"date":{"end_time":"2003/06/08 00:00:00 -0400","original":"6/7/2003","granularity":"day","time":"2003/06/07 00:00:00 -0400"},"longitude":-118.48113,"id":"advbt64dxcrt","location":"Sequoia National Forest"},"type":"Feature","geometry":{"type":"Point","coordinates":[-118.48113,35.95424]}},{"properties":{"latitude":35.672219,"column_5":2,"date":{"end_time":"2003/06/08 00:00:00 -0400","original":"6/7/2003","granularity":"day","time":"2003/06/07 00:00:00 -0400"},"longitude":-118.307476,"id":"advbt5tx4087","location":"South Fork Kern River Valley--general area"},"type":"Feature","geometry":{"type":"Point","coordinates":[-118.307476,35.672219]}},{"properties":{"latitude":35.2830664,"column_5":2,"date":{"end_time":"2003/08/03 00:00:00 -0400","original":"8/2/2003","granularity":"day","time":"2003/08/02 00:00:00 -0400"},"longitude":-112.1521124,"id":"advbt5z18inn","location":"Kaibab NF--Kaibab Lake CG"},"type":"Feature","geometry":{"type":"Point","coordinates":[-112.1521124,35.2830664]}},{"properties":{"latitude":44.9069039,"column_5":2,"date":{"end_time":"2003/08/20 00:00:00 -0400","original":"8/19/2003","granularity":"day","time":"2003/08/19 00:00:00 -0400"},"longitude":-92.9096149,"id":"advbt5t04xm6","location":"Colby Lake"},"type":"Feature","geometry":{"type":"Point","coordinates":[-92.9096149,44.9069039]}},{"properties":{"latitude":34.463806,"column_5":2,"date":{"end_time":"2003/10/05 00:00:00 -0400","original":"10/4/2003","granularity":"day","time":"2003/10/04 00:00:00 -0400"},"longitude":-117.248695,"id":"advbt5rp3a6l","location":"Rio Vista Elementary School"},"type":"Feature","geometry":{"type":"Point","coordinates":[-117.248695,34.463806]}},{"properties":{"latitude":34.947807,"column_5":2,"date":{"end_time":"2003/10/12 00:00:00 -0400","original":"10/11/2003","granularity":"day","time":"2003/10/11 00:00:00 -0400"},"longitude":-116.86591,"id":"advbt5rs94h4","location":"Calico Ghost Town"},"type":"Feature","geometry":{"type":"Point","coordinates":[-116.86591,34.947807]}},{"properties":{"latitude":29.8414256,"column_5":2,"date":{"end_time":"2003/12/27 00:00:00 -0500","original":"12/26/2003","granularity":"day","time":"2003/12/26 00:00:00 -0500"},"longitude":-94.5410872,"id":"advbt5uimj5n","location":"Chambers Co.- Jenkins Rd Ponds (Private Do Not Block gates)"},"type":"Feature","geometry":{"type":"Point","coordinates":[-94.5410872,29.8414256]}},{"properties":{"latitude":35.61805,"column_5":2,"date":{"end_time":"2004/01/11 00:00:00 -0500","original":"1/10/2004","granularity":"day","time":"2004/01/10 00:00:00 -0500"},"longitude":-118.47292,"id":"advbt5rcugn4","location":"Lake Isabella"},"type":"Feature","geometry":{"type":"Point","coordinates":[-118.47292,35.61805]}},{"properties":{"latitude":33.9903418,"column_5":2,"date":{"end_time":"2004/03/28 00:00:00 -0500","original":"3/27/2004","granularity":"day","time":"2004/03/27 00:00:00 -0500"},"longitude":-116.0914993,"id":"advbt5tyrf3u","location":"Joshua Tree NP"},"type":"Feature","geometry":{"type":"Point","coordinates":[-116.0914993,33.9903418]}},{"properties":{"latitude":33.1774666,"column_5":2,"date":{"end_time":"2004/04/14 00:00:00 -0400","original":"4/13/2004","granularity":"day","time":"2004/04/13 00:00:00 -0400"},"longitude":-115.6150961,"id":"advbt5vmkesh","location":"Salton Sea NWR--Unit 2 / Visitor Center"},"type":"Feature","geometry":{"type":"Point","coordinates":[-115.6150961,33.1774666]}},{"properties":{"latitude":34.2224927,"column_5":2,"date":{"end_time":"2004/05/25 00:00:00 -0400","original":"5/24/2004","granularity":"day","time":"2004/05/24 00:00:00 -0400"},"longitude":-116.9701159,"id":"advbt6158jlk","location":"Champion Lodgepole Pine Trail"},"type":"Feature","geometry":{"type":"Point","coordinates":[-116.9701159,34.2224927]}},{"properties":{"latitude":35.7549756,"column_5":2,"date":{"end_time":"2004/06/28 00:00:00 -0400","original":"6/27/2004","granularity":"day","time":"2004/06/27 00:00:00 -0400"},"longitude":-118.4249783,"id":"advbt5xs8olj","location":"Kernville--business and residential areas"},"type":"Feature","geometry":{"type":"Point","coordinates":[-118.4249783,35.7549756]}},{"properties":{"latitude":44.720024,"column_5":2,"date":{"end_time":"2004/07/27 00:00:00 -0400","original":"7/26/2004","granularity":"day","time":"2004/07/26 00:00:00 -0400"},"longitude":-93.422572,"id":"advbt62xh197","location":"Prior Lake--Lakefront Park"},"type":"Feature","geometry":{"type":"Point","coordinates":[-93.422572,44.720024]}},{"properties":{"latitude":29.3144516,"column_5":2,"date":{"end_time":"2004/12/30 00:00:00 -0500","original":"12/29/2004","granularity":"day","time":"2004/12/29 00:00:00 -0500"},"longitude":-98.6698991,"id":"advbt5xwtanf","location":"Aaron's Neighborhood"},"type":"Feature","geometry":{"type":"Point","coordinates":[-98.6698991,29.3144516]}},{"properties":{"latitude":44.71326,"column_5":2,"date":{"end_time":"2005/05/19 00:00:00 -0400","original":"5/18/2005","granularity":"day","time":"2005/05/18 00:00:00 -0400"},"longitude":-93.42273,"id":"advbt657vmwc","location":"Prior Lake"},"type":"Feature","geometry":{"type":"Point","coordinates":[-93.42273,44.71326]}},{"properties":{"latitude":31.727,"column_5":2,"date":{"end_time":"2005/08/20 00:00:00 -0400","original":"8/19/2005","granularity":"day","time":"2005/08/19 00:00:00 -0400"},"longitude":-110.88,"id":"advbt646qbok","location":"Madera Canyon--Madera Picnic Area"},"type":"Feature","geometry":{"type":"Point","coordinates":[-110.88,31.727]}},{"properties":{"latitude":35.8758,"column_5":2,"date":{"end_time":"2005/08/26 00:00:00 -0400","original":"8/25/2005","granularity":"day","time":"2005/08/25 00:00:00 -0400"},"longitude":-111.4127,"id":"advbt63dyv7i","location":"Cameron"},"type":"Feature","geometry":{"type":"Point","coordinates":[-111.4127,35.8758]}},{"properties":{"latitude":44.92387,"column_5":2,"date":{"end_time":"2006/01/04 00:00:00 -0500","original":"1/3/2006","granularity":"day","time":"2006/01/03 00:00:00 -0500"},"longitude":-92.95941,"id":"advbt5wdseww","location":"Woodbury"},"type":"Feature","geometry":{"type":"Point","coordinates":[-92.95941,44.92387]}},{"properties":{"latitude":34.333629,"column_5":2,"date":{"end_time":"2006/03/06 00:00:00 -0500","original":"3/5/2006","granularity":"day","time":"2006/03/05 00:00:00 -0500"},"longitude":-111.9137954,"id":"advbt5twqpnl","location":"Dugas Road"},"type":"Feature","geometry":{"type":"Point","coordinates":[-111.9137954,34.333629]}},{"properties":{"latitude":31.8835432,"column_5":2,"date":{"end_time":"2006/04/29 00:00:00 -0400","original":"4/28/2006","granularity":"day","time":"2006/04/28 00:00:00 -0400"},"longitude":-109.2058731,"id":"advbt5w4akbu","location":"Cave Creek Canyon--Southwestern Research Station"},"type":"Feature","geometry":{"type":"Point","coordinates":[-109.2058731,31.8835432]}},{"properties":{"latitude":19.1387984,"column_5":2,"date":{"end_time":"2006/10/06 00:00:00 -0400","original":"10/5/2006","granularity":"day","time":"2006/10/05 00:00:00 -0400"},"longitude":-96.103264,"id":"advbt5tta1n1","location":"Veracruz  - Hotel Mocombo"},"type":"Feature","geometry":{"type":"Point","coordinates":[-96.103264,19.1387984]}},{"properties":{"latitude":18.4166104,"column_5":2,"date":{"end_time":"2006/10/09 00:00:00 -0400","original":"10/8/2006","granularity":"day","time":"2006/10/08 00:00:00 -0400"},"longitude":-95.108428,"id":"advbt64dsodh","location":"Catemaco--Laguna de Catemaco"},"type":"Feature","geometry":{"type":"Point","coordinates":[-95.108428,18.4166104]}},{"properties":{"latitude":33.2283494,"column_5":2,"date":{"end_time":"2006/12/21 00:00:00 -0500","original":"12/20/2006","granularity":"day","time":"2006/12/20 00:00:00 -0500"},"longitude":-115.5130005,"id":"advbt63k2kht","location":"Niland"},"type":"Feature","geometry":{"type":"Point","coordinates":[-115.5130005,33.2283494]}},{"properties":{"latitude":35.1806836,"column_5":2,"date":{"end_time":"2006/12/23 00:00:00 -0500","original":"12/22/2006","granularity":"day","time":"2006/12/22 00:00:00 -0500"},"longitude":-111.6021359,"id":"advbt5t9p73q","location":"Herold Ranch"},"type":"Feature","geometry":{"type":"Point","coordinates":[-111.6021359,35.1806836]}},{"properties":{"latitude":31.72,"column_5":2,"date":{"end_time":"2007/03/21 00:00:00 -0400","original":"3/20/2007","granularity":"day","time":"2007/03/20 00:00:00 -0400"},"longitude":-110.75,"id":"advbt5zlq6cy","location":"Gardner Canyon"},"type":"Feature","geometry":{"type":"Point","coordinates":[-110.75,31.72]}},{"properties":{"latitude":31.7202119,"column_5":2,"date":{"end_time":"2007/03/21 00:00:00 -0400","original":"3/20/2007","granularity":"day","time":"2007/03/20 00:00:00 -0400"},"longitude":-110.8773279,"id":"advbt60su0aj","location":"Madera Canyon--Santa Cruz Co."},"type":"Feature","geometry":{"type":"Point","coordinates":[-110.8773279,31.7202119]}},{"properties":{"latitude":31.7828999,"column_5":2,"date":{"end_time":"2007/03/21 00:00:00 -0400","original":"3/20/2007","granularity":"day","time":"2007/03/20 00:00:00 -0400"},"longitude":-110.8856964,"id":"advbt63srmrf","location":"Florida Wash"},"type":"Feature","geometry":{"type":"Point","coordinates":[-110.8856964,31.7828999]}},{"properties":{"latitude":31.539,"column_5":2,"date":{"end_time":"2007/03/22 00:00:00 -0400","original":"3/21/2007","granularity":"day","time":"2007/03/21 00:00:00 -0400"},"longitude":-110.761,"id":"advbt5userfl","location":"Patagonia--Patons' yard"},"type":"Feature","geometry":{"type":"Point","coordinates":[-110.761,31.539]}},{"properties":{"latitude":34.6694644,"column_5":2,"date":{"end_time":"2007/05/13 00:00:00 -0400","original":"5/12/2007","granularity":"day","time":"2007/05/12 00:00:00 -0400"},"longitude":-111.7140698,"id":"advbt5tce7hh","location":"Wet Beaver Campground and Picnic Area"},"type":"Feature","geometry":{"type":"Point","coordinates":[-111.7140698,34.6694644]}},{"properties":{"latitude":34.4220271,"column_5":2,"date":{"end_time":"2007/06/15 00:00:00 -0400","original":"6/14/2007","granularity":"day","time":"2007/06/14 00:00:00 -0400"},"longitude":-111.1683154,"id":"advbt5wbeorl","location":"Jct 218/218C"},"type":"Feature","geometry":{"type":"Point","coordinates":[-111.1683154,34.4220271]}},{"properties":{"latitude":34.1549999,"column_5":2,"date":{"end_time":"2007/10/07 00:00:00 -0400","original":"10/6/2007","granularity":"day","time":"2007/10/06 00:00:00 -0400"},"longitude":-119.4543457,"id":"advbt5v0i61y","location":"Santa Barbara Channel Ven/SB counties"},"type":"Feature","geometry":{"type":"Point","coordinates":[-119.4543457,34.1549999]}},{"properties":{"latitude":34.1484474,"column_5":2,"date":{"end_time":"2007/10/08 00:00:00 -0400","original":"10/7/2007","granularity":"day","time":"2007/10/07 00:00:00 -0400"},"longitude":-119.1434562,"id":"advbt661e1gt","location":"Hueneme Rd sod fields"},"type":"Feature","geometry":{"type":"Point","coordinates":[-119.1434562,34.1484474]}},{"properties":{"latitude":32.9204706,"column_5":2,"date":{"end_time":"2007/11/13 00:00:00 -0500","original":"11/12/2007","granularity":"day","time":"2007/11/12 00:00:00 -0500"},"longitude":-111.7807174,"id":"advbt5v8r97k","location":"Dave White Golf Course"},"type":"Feature","geometry":{"type":"Point","coordinates":[-111.7807174,32.9204706]}},{"properties":{"latitude":35.3173663,"column_5":2,"date":{"end_time":"2007/12/19 00:00:00 -0500","original":"12/18/2007","granularity":"day","time":"2007/12/18 00:00:00 -0500"},"longitude":-111.2525368,"id":"advbt5y8ss5u","location":"Trina Goetz's house"},"type":"Feature","geometry":{"type":"Point","coordinates":[-111.2525368,35.3173663]}},{"properties":{"latitude":36.6063012,"column_5":2,"date":{"end_time":"2008/01/10 00:00:00 -0500","original":"1/9/2008","granularity":"day","time":"2008/01/09 00:00:00 -0500"},"longitude":-121.8912935,"id":"advbt5ztghpc","location":"Monterey Harbor"},"type":"Feature","geometry":{"type":"Point","coordinates":[-121.8912935,36.6063012]}},{"properties":{"latitude":31.6714585,"column_5":2,"date":{"end_time":"2008/01/23 00:00:00 -0500","original":"1/22/2008","granularity":"day","time":"2008/01/22 00:00:00 -0500"},"longitude":-110.941082,"id":"advbt5vdmnew","location":"Montosa Canyon"},"type":"Feature","geometry":{"type":"Point","coordinates":[-110.941082,31.6714585]}},{"properties":{"latitude":34.8245526,"column_5":2,"date":{"end_time":"2008/02/04 00:00:00 -0500","original":"2/3/2008","granularity":"day","time":"2008/02/03 00:00:00 -0500"},"longitude":-111.8166087,"id":"advbt64f4wd3","location":"Sedona - Livingston Lane"},"type":"Feature","geometry":{"type":"Point","coordinates":[-111.8166087,34.8245526]}},{"properties":{"latitude":36.9970003,"column_5":2,"date":{"end_time":"2008/03/20 00:00:00 -0400","original":"3/19/2008","granularity":"day","time":"2008/03/19 00:00:00 -0400"},"longitude":-112.9739141,"id":"advbt62zb8k4","location":"Colorado City--Cottonwood Park"},"type":"Feature","geometry":{"type":"Point","coordinates":[-112.9739141,36.9970003]}},{"properties":{"latitude":34.9715003,"column_5":2,"date":{"end_time":"2008/05/01 00:00:00 -0400","original":"4/30/2008","granularity":"day","time":"2008/04/30 00:00:00 -0400"},"longitude":-110.6418514,"id":"advbt61rmgx7","location":"McHood Park"},"type":"Feature","geometry":{"type":"Point","coordinates":[-110.6418514,34.9715003]}},{"properties":{"latitude":23.4299623,"column_5":2,"date":{"end_time":"2008/08/19 00:00:00 -0400","original":"8/18/2008","granularity":"day","time":"2008/08/18 00:00:00 -0400"},"longitude":-106.332947,"id":"advbt63cn3c8","location":"La Noria Rd."},"type":"Feature","geometry":{"type":"Point","coordinates":[-106.332947,23.4299623]}},{"properties":{"latitude":23.4426411,"column_5":2,"date":{"end_time":"2008/08/21 00:00:00 -0400","original":"8/20/2008","granularity":"day","time":"2008/08/20 00:00:00 -0400"},"longitude":-105.8331066,"id":"advbt6543hct","location":"La Petaca Rd."},"type":"Feature","geometry":{"type":"Point","coordinates":[-105.8331066,23.4426411]}},{"properties":{"latitude":23.5720337,"column_5":2,"date":{"end_time":"2008/08/21 00:00:00 -0400","original":"8/20/2008","granularity":"day","time":"2008/08/20 00:00:00 -0400"},"longitude":-105.8511961,"id":"advbt61ss1p1","location":"Barranca Rancho Liebre"},"type":"Feature","geometry":{"type":"Point","coordinates":[-105.8511961,23.5720337]}},{"properties":{"latitude":23.7193541,"column_5":2,"date":{"end_time":"2008/08/23 00:00:00 -0400","original":"8/22/2008","granularity":"day","time":"2008/08/22 00:00:00 -0400"},"longitude":-105.5617905,"id":"advbt5xjlv20","location":"Chavarria Road"},"type":"Feature","geometry":{"type":"Point","coordinates":[-105.5617905,23.7193541]}},{"properties":{"latitude":33.3808023,"column_5":2,"date":{"end_time":"2008/08/29 00:00:00 -0400","original":"8/28/2008","granularity":"day","time":"2008/08/28 00:00:00 -0400"},"longitude":-112.6824546,"id":"advbt5yqx4x1","location":"Palo Verde Sludge Ponds"},"type":"Feature","geometry":{"type":"Point","coordinates":[-112.6824546,33.3808023]}},{"properties":{"latitude":34.1356784,"column_5":2,"date":{"end_time":"2008/09/04 00:00:00 -0400","original":"9/3/2008","granularity":"day","time":"2008/09/03 00:00:00 -0400"},"longitude":-119.153595,"id":"advbt5qvgh4l","location":"Arnold Rd."},"type":"Feature","geometry":{"type":"Point","coordinates":[-119.153595,34.1356784]}},{"properties":{"latitude":37.0157122,"column_5":2,"date":{"end_time":"2008/09/14 00:00:00 -0400","original":"9/13/2008","granularity":"day","time":"2008/09/13 00:00:00 -0400"},"longitude":-122.6953125,"id":"advbt5q1m5uj","location":"Offshore (southern SM Co.)"},"type":"Feature","geometry":{"type":"Point","coordinates":[-122.6953125,37.0157122]}},{"properties":{"latitude":34.4484938,"column_5":2,"date":{"end_time":"2008/09/25 00:00:00 -0400","original":"9/24/2008","granularity":"day","time":"2008/09/24 00:00:00 -0400"},"longitude":-114.3263108,"id":"advbt5vznqp8","location":"Lake Havasu--Boston Lighthouse Trail"},"type":"Feature","geometry":{"type":"Point","coordinates":[-114.3263108,34.4484938]}},{"properties":{"latitude":34.148918,"column_5":2,"date":{"end_time":"2008/10/22 00:00:00 -0400","original":"10/21/2008","granularity":"day","time":"2008/10/21 00:00:00 -0400"},"longitude":-119.1053098,"id":"advbt5u7n81t","location":"Hueneme Rd Tams"},"type":"Feature","geometry":{"type":"Point","coordinates":[-119.1053098,34.148918]}},{"properties":{"latitude":36.075326,"column_5":2,"date":{"end_time":"2008/11/04 00:00:00 -0500","original":"11/3/2008","granularity":"day","time":"2008/11/03 00:00:00 -0500"},"longitude":-118.9141273,"id":"advbt5y04ysb","location":"Lake Success"},"type":"Feature","geometry":{"type":"Point","coordinates":[-118.9141273,36.075326]}},{"properties":{"latitude":34.3718847,"column_5":2,"date":{"end_time":"2008/11/11 00:00:00 -0500","original":"11/10/2008","granularity":"day","time":"2008/11/10 00:00:00 -0500"},"longitude":-119.0574217,"id":"advbt5rx8cps","location":"Wilson Ranch"},"type":"Feature","geometry":{"type":"Point","coordinates":[-119.0574217,34.3718847]}},{"properties":{"latitude":34.3930997,"column_5":2,"date":{"end_time":"2008/11/11 00:00:00 -0500","original":"11/10/2008","granularity":"day","time":"2008/11/10 00:00:00 -0500"},"longitude":-118.8850307,"id":"advbt5z9vd54","location":"Fillmore Fish Hatchery"},"type":"Feature","geometry":{"type":"Point","coordinates":[-118.8850307,34.3930997]}},{"properties":{"latitude":34.3535696,"column_5":2,"date":{"end_time":"2008/11/11 00:00:00 -0500","original":"11/10/2008","granularity":"day","time":"2008/11/10 00:00:00 -0500"},"longitude":-119.0799522,"id":"advbt5rk8vjm","location":"Santa Paula Cemetery"},"type":"Feature","geometry":{"type":"Point","coordinates":[-119.0799522,34.3535696]}},{"properties":{"latitude":35.3170687,"column_5":2,"date":{"end_time":"2008/11/21 00:00:00 -0500","original":"11/20/2008","granularity":"day","time":"2008/11/20 00:00:00 -0500"},"longitude":-120.85271,"id":"advbt629elhh","location":"Pecho Rd.--willows"},"type":"Feature","geometry":{"type":"Point","coordinates":[-120.85271,35.3170687]}},{"properties":{"latitude":35.3693972,"column_5":2,"date":{"end_time":"2008/11/21 00:00:00 -0500","original":"11/20/2008","granularity":"day","time":"2008/11/20 00:00:00 -0500"},"longitude":-120.8670566,"id":"advbt61knu2o","location":"Morro Rock"},"type":"Feature","geometry":{"type":"Point","coordinates":[-120.8670566,35.3693972]}},{"properties":{"latitude":38.223648,"column_5":2,"date":{"end_time":"2008/11/23 00:00:00 -0500","original":"11/22/2008","granularity":"day","time":"2008/11/22 00:00:00 -0500"},"longitude":-121.03236,"id":"advbt5xxxo12","location":"Mokelumne Day Use Area/Fish Hatchery"},"type":"Feature","geometry":{"type":"Point","coordinates":[-121.03236,38.223648]}},{"properties":{"latitude":34.573446,"column_5":2,"date":{"end_time":"2008/11/29 00:00:00 -0500","original":"11/28/2008","granularity":"day","time":"2008/11/28 00:00:00 -0500"},"longitude":-112.4292174,"id":"advbt60mpsm9","location":"Sundog Ranch Rd Sewage Ponds"},"type":"Feature","geometry":{"type":"Point","coordinates":[-112.4292174,34.573446]}},{"properties":{"latitude":34.2966236,"column_5":2,"date":{"end_time":"2008/12/04 00:00:00 -0500","original":"12/3/2008","granularity":"day","time":"2008/12/03 00:00:00 -0500"},"longitude":-114.1394252,"id":"advbt64bd07o","location":"Parker Dam Az/Ca"},"type":"Feature","geometry":{"type":"Point","coordinates":[-114.1394252,34.2966236]}},{"properties":{"latitude":34.2385556,"column_5":2,"date":{"end_time":"2008/12/13 00:00:00 -0500","original":"12/12/2008","granularity":"day","time":"2008/12/12 00:00:00 -0500"},"longitude":-119.2590278,"id":"advbt5qjomkp","location":"Ventura Settling Ponds"},"type":"Feature","geometry":{"type":"Point","coordinates":[-119.2590278,34.2385556]}},{"properties":{"latitude":34.2905165,"column_5":2,"date":{"end_time":"2008/12/13 00:00:00 -0500","original":"12/12/2008","granularity":"day","time":"2008/12/12 00:00:00 -0500"},"longitude":-119.2259502,"id":"advbt5v658se","location":"Arroyo Verde Park"},"type":"Feature","geometry":{"type":"Point","coordinates":[-119.2259502,34.2905165]}},{"properties":{"latitude":32.764037,"column_5":2,"date":{"end_time":"2008/12/18 00:00:00 -0500","original":"12/17/2008","granularity":"day","time":"2008/12/17 00:00:00 -0500"},"longitude":-115.7021713,"id":"advbt64yesua","location":"Fig Lagoon"},"type":"Feature","geometry":{"type":"Point","coordinates":[-115.7021713,32.764037]}},{"properties":{"latitude":32.8268076,"column_5":2,"date":{"end_time":"2008/12/18 00:00:00 -0500","original":"12/17/2008","granularity":"day","time":"2008/12/17 00:00:00 -0500"},"longitude":-114.4490433,"id":"advbt607d959","location":"Mittry Lake"},"type":"Feature","geometry":{"type":"Point","coordinates":[-114.4490433,32.8268076]}},{"properties":{"latitude":32.8819198,"column_5":2,"date":{"end_time":"2008/12/18 00:00:00 -0500","original":"12/17/2008","granularity":"day","time":"2008/12/17 00:00:00 -0500"},"longitude":-114.4665626,"id":"advbt5xtpc60","location":"Imperial Dam"},"type":"Feature","geometry":{"type":"Point","coordinates":[-114.4665626,32.8819198]}},{"properties":{"latitude":32.8194716,"column_5":2,"date":{"end_time":"2008/12/18 00:00:00 -0500","original":"12/17/2008","granularity":"day","time":"2008/12/17 00:00:00 -0500"},"longitude":-114.4882978,"id":"advbt63o3dob","location":"Betty's Kitchen/Laguna Dam"},"type":"Feature","geometry":{"type":"Point","coordinates":[-114.4882978,32.8194716]}},{"properties":{"latitude":34.3445699,"column_5":2,"date":{"end_time":"2009/01/05 00:00:00 -0500","original":"1/4/2009","granularity":"day","time":"2009/01/04 00:00:00 -0500"},"longitude":-119.2783928,"id":"advbt5uh3brv","location":"Canada Larga Rd."},"type":"Feature","geometry":{"type":"Point","coordinates":[-119.2783928,34.3445699]}},{"properties":{"latitude":34.4195844,"column_5":2,"date":{"end_time":"2009/01/06 00:00:00 -0500","original":"1/5/2009","granularity":"day","time":"2009/01/05 00:00:00 -0500"},"longitude":-119.6481514,"id":"advbt612uaro","location":"Montecito--Butterfly Ln."},"type":"Feature","geometry":{"type":"Point","coordinates":[-119.6481514,34.4195844]}},{"properties":{"latitude":34.2327383,"column_5":2,"date":{"end_time":"2009/01/23 00:00:00 -0500","original":"1/22/2009","granularity":"day","time":"2009/01/22 00:00:00 -0500"},"longitude":-118.8788939,"id":"advbt5wqmfis","location":"CLU"},"type":"Feature","geometry":{"type":"Point","coordinates":[-118.8788939,34.2327383]}},{"properties":{"latitude":34.1544317,"column_5":2,"date":{"end_time":"2009/01/25 00:00:00 -0500","original":"1/24/2009","granularity":"day","time":"2009/01/24 00:00:00 -0500"},"longitude":-119.3767548,"id":"advbt64xfea0","location":"Santa Barbara Channel--east channel (VEN Co.)"},"type":"Feature","geometry":{"type":"Point","coordinates":[-119.3767548,34.1544317]}},{"properties":{"latitude":9.79916,"column_5":2,"date":{"end_time":"2009/05/01 00:00:00 -0400","original":"4/30/2009","granularity":"day","time":"2009/04/30 00:00:00 -0400"},"longitude":-84.60504,"id":"advbt5ywwxtg","location":"Carara--Puente Ro  Trcoles"},"type":"Feature","geometry":{"type":"Point","coordinates":[-84.60504,9.79916]}},{"properties":{"latitude":45.5217439,"column_5":2,"date":{"end_time":"2009/05/11 00:00:00 -0400","original":"5/10/2009","granularity":"day","time":"2009/05/10 00:00:00 -0400"},"longitude":-123.9484406,"id":"advbt5uuaxmg","location":"Bayocean Spit--bay (east) side"},"type":"Feature","geometry":{"type":"Point","coordinates":[-123.9484406,45.5217439]}},{"properties":{"latitude":45.4329127,"column_5":2,"date":{"end_time":"2009/05/11 00:00:00 -0400","original":"5/10/2009","granularity":"day","time":"2009/05/10 00:00:00 -0400"},"longitude":-123.9479256,"id":"advbt5zgdw3v","location":"Netarts and Bay entrance"},"type":"Feature","geometry":{"type":"Point","coordinates":[-123.9479256,45.4329127]}},{"properties":{"latitude":45.4742463,"column_5":2,"date":{"end_time":"2009/05/11 00:00:00 -0400","original":"5/10/2009","granularity":"day","time":"2009/05/10 00:00:00 -0400"},"longitude":-123.8427722,"id":"advbt65l3mag","location":"Shilo Inn"},"type":"Feature","geometry":{"type":"Point","coordinates":[-123.8427722,45.4742463]}},{"properties":{"latitude":45.6094694,"column_5":2,"date":{"end_time":"2009/05/19 00:00:00 -0400","original":"5/18/2009","granularity":"day","time":"2009/05/18 00:00:00 -0400"},"longitude":-123.601504,"id":"advbt5wjosj2","location":"Deer Diamond Control"},"type":"Feature","geometry":{"type":"Point","coordinates":[-123.601504,45.6094694]}},{"properties":{"latitude":42.6567921,"column_5":2,"date":{"end_time":"2009/05/24 00:00:00 -0400","original":"5/23/2009","granularity":"day","time":"2009/05/23 00:00:00 -0400"},"longitude":-118.9861518,"id":"advbt5rc8tbf","location":"Roaring Springs Ranch"},"type":"Feature","geometry":{"type":"Point","coordinates":[-118.9861518,42.6567921]}},{"properties":{"latitude":45.566823,"column_5":2,"date":{"end_time":"2009/05/28 00:00:00 -0400","original":"5/27/2009","granularity":"day","time":"2009/05/27 00:00:00 -0400"},"longitude":-123.494001,"id":"advbt5vf45cv","location":"Ben Smith Control"},"type":"Feature","geometry":{"type":"Point","coordinates":[-123.494001,45.566823]}},{"properties":{"latitude":45.5492445,"column_5":2,"date":{"end_time":"2009/06/01 00:00:00 -0400","original":"5/31/2009","granularity":"day","time":"2009/05/31 00:00:00 -0400"},"longitude":-123.4086853,"id":"advbt64s69v1","location":"C-Line Control"},"type":"Feature","geometry":{"type":"Point","coordinates":[-123.4086853,45.5492445]}},{"properties":{"latitude":36.6217017,"column_5":2,"date":{"end_time":"2009/08/01 00:00:00 -0400","original":"7/31/2009","granularity":"day","time":"2009/07/31 00:00:00 -0400"},"longitude":-121.9037615,"id":"advbt5vpjh8w","location":"Monterey Bay pelagic--inshore Monterey Harbor to Pt. Pinos"},"type":"Feature","geometry":{"type":"Point","coordinates":[-121.9037615,36.6217017]}},{"properties":{"latitude":36.474638,"column_5":2,"date":{"end_time":"2009/08/01 00:00:00 -0400","original":"7/31/2009","granularity":"day","time":"2009/07/31 00:00:00 -0400"},"longitude":-122.1186676,"id":"advbt5sp0j3w","location":"Monterey pelagic--within Calif. current to Pt. Sur (MTY Co.)"},"type":"Feature","geometry":{"type":"Point","coordinates":[-122.1186676,36.474638]}},{"properties":{"latitude":38.7852176,"column_5":2,"date":{"end_time":"2009/08/23 00:00:00 -0400","original":"8/22/2009","granularity":"day","time":"2009/08/22 00:00:00 -0400"},"longitude":-92.1256614,"id":"advbt5ubniie","location":"Dry Fork Campground - Callaway County"},"type":"Feature","geometry":{"type":"Point","coordinates":[-92.1256614,38.7852176]}},{"properties":{"latitude":41.6277095,"column_5":2,"date":{"end_time":"2009/09/02 00:00:00 -0400","original":"9/1/2009","granularity":"day","time":"2009/09/01 00:00:00 -0400"},"longitude":-83.191884,"id":"advbt5uqjf2g","location":"Magee Marsh Wildlife Area--Boardwalk"},"type":"Feature","geometry":{"type":"Point","coordinates":[-83.191884,41.6277095]}},{"properties":{"latitude":41.6278682,"column_5":2,"date":{"end_time":"2009/09/02 00:00:00 -0400","original":"9/1/2009","granularity":"day","time":"2009/09/01 00:00:00 -0400"},"longitude":-83.1856916,"id":"advbt5z0yrsr","location":"Magee Marsh Wildlife Area--Beach West"},"type":"Feature","geometry":{"type":"Point","coordinates":[-83.1856916,41.6278682]}},{"properties":{"latitude":41.1194198,"column_5":2,"date":{"end_time":"2009/09/09 00:00:00 -0400","original":"9/8/2009","granularity":"day","time":"2009/09/08 00:00:00 -0400"},"longitude":-83.4450952,"id":"advbt5uy9o8q","location":"Lake LeComte"},"type":"Feature","geometry":{"type":"Point","coordinates":[-83.4450952,41.1194198]}},{"properties":{"latitude":40.9697134,"column_5":2,"date":{"end_time":"2009/09/17 00:00:00 -0400","original":"9/16/2009","granularity":"day","time":"2009/09/16 00:00:00 -0400"},"longitude":-83.7974274,"id":"advbt60evm5r","location":"Site 2 Hancock County"},"type":"Feature","geometry":{"type":"Point","coordinates":[-83.7974274,40.9697134]}},{"properties":{"latitude":41.0216141,"column_5":2,"date":{"end_time":"2009/09/22 00:00:00 -0400","original":"9/21/2009","granularity":"day","time":"2009/09/21 00:00:00 -0400"},"longitude":-83.6862946,"id":"advbt5xrwbha","location":"Oakwoods Nature Preserve"},"type":"Feature","geometry":{"type":"Point","coordinates":[-83.6862946,41.0216141]}},{"properties":{"latitude":41.3976,"column_5":2,"date":{"end_time":"2009/09/28 00:00:00 -0400","original":"9/27/2009","granularity":"day","time":"2009/09/27 00:00:00 -0400"},"longitude":-82.55249,"id":"advbt5zjoqyu","location":"Huron Harbor West Pier"},"type":"Feature","geometry":{"type":"Point","coordinates":[-82.55249,41.3976]}},{"properties":{"latitude":41.1212305,"column_5":2,"date":{"end_time":"2009/10/04 00:00:00 -0400","original":"10/3/2009","granularity":"day","time":"2009/10/03 00:00:00 -0400"},"longitude":-83.6745787,"id":"advbt5w31i1c","location":"Hancock County Landfill - new wetlands"},"type":"Feature","geometry":{"type":"Point","coordinates":[-83.6745787,41.1212305]}},{"properties":{"latitude":40.8175579,"column_5":2,"date":{"end_time":"2009/10/13 00:00:00 -0400","original":"10/12/2009","granularity":"day","time":"2009/10/12 00:00:00 -0400"},"longitude":-83.9112201,"id":"advbt61kralj","location":"Site 35 - Allen Co"},"type":"Feature","geometry":{"type":"Point","coordinates":[-83.9112201,40.8175579]}},{"properties":{"latitude":33.5374599,"column_5":2,"date":{"end_time":"2009/11/11 00:00:00 -0500","original":"11/10/2009","granularity":"day","time":"2009/11/10 00:00:00 -0500"},"longitude":-112.0193481,"id":"advbt5um5htn","location":"Phoenix Mountains Park--Piestewa Peak"},"type":"Feature","geometry":{"type":"Point","coordinates":[-112.0193481,33.5374599]}},{"properties":{"latitude":34.2415844,"column_5":2,"date":{"end_time":"2009/11/19 00:00:00 -0500","original":"11/18/2009","granularity":"day","time":"2009/11/18 00:00:00 -0500"},"longitude":-119.2467999,"id":"advbt60p4lll","location":"Olivas Park Golf Course"},"type":"Feature","geometry":{"type":"Point","coordinates":[-119.2467999,34.2415844]}},{"properties":{"latitude":35.8622568,"column_5":2,"date":{"end_time":"2009/11/20 00:00:00 -0500","original":"11/19/2009","granularity":"day","time":"2009/11/19 00:00:00 -0500"},"longitude":-119.5734143,"id":"advbt64ed43u","location":"6th Ave.--Kern Co. line N to Virginia Ave. (KIN Co.)"},"type":"Feature","geometry":{"type":"Point","coordinates":[-119.5734143,35.8622568]}},{"properties":{"latitude":38.4396402,"column_5":2,"date":{"end_time":"2009/11/21 00:00:00 -0500","original":"11/20/2009","granularity":"day","time":"2009/11/20 00:00:00 -0500"},"longitude":-121.4932108,"id":"advbt630eaxf","location":"Bufferlands--West of I-5"},"type":"Feature","geometry":{"type":"Point","coordinates":[-121.4932108,38.4396402]}},{"properties":{"latitude":36.9529441,"column_5":2,"date":{"end_time":"2009/11/24 00:00:00 -0500","original":"11/23/2009","granularity":"day","time":"2009/11/23 00:00:00 -0500"},"longitude":-122.0371413,"id":"advbt6526zg4","location":"West Cliff Dr.--Woodrow Ave."},"type":"Feature","geometry":{"type":"Point","coordinates":[-122.0371413,36.9529441]}},{"properties":{"latitude":34.3677757,"column_5":2,"date":{"end_time":"2009/12/01 00:00:00 -0500","original":"11/30/2009","granularity":"day","time":"2009/11/30 00:00:00 -0500"},"longitude":-119.0630007,"id":"advbt5uslrmw","location":"Hwy 150 at Say Rd."},"type":"Feature","geometry":{"type":"Point","coordinates":[-119.0630007,34.3677757]}},{"properties":{"latitude":29.94634,"column_5":2,"date":{"end_time":"2009/12/12 00:00:00 -0500","original":"12/11/2009","granularity":"day","time":"2009/12/11 00:00:00 -0500"},"longitude":-93.08441,"id":"advbt5qh4xb2","location":"Cameron Prairie NWR"},"type":"Feature","geometry":{"type":"Point","coordinates":[-93.08441,29.94634]}},{"properties":{"latitude":34.2781051,"column_5":2,"date":{"end_time":"2009/12/18 00:00:00 -0500","original":"12/17/2009","granularity":"day","time":"2009/12/17 00:00:00 -0500"},"longitude":-119.2231462,"id":"advbt65bw2fw","location":"Arundell Barranca"},"type":"Feature","geometry":{"type":"Point","coordinates":[-119.2231462,34.2781051]}},{"properties":{"latitude":33.2127442,"column_5":2,"date":{"end_time":"2009/12/23 00:00:00 -0500","original":"12/22/2009","granularity":"day","time":"2009/12/22 00:00:00 -0500"},"longitude":-115.6134152,"id":"advbt5s93b84","location":"Salton Sea--Alamo River mouth - north"},"type":"Feature","geometry":{"type":"Point","coordinates":[-115.6134152,33.2127442]}},{"properties":{"latitude":36.9552561,"column_5":2,"date":{"end_time":"2010/01/06 00:00:00 -0500","original":"1/5/2010","granularity":"day","time":"2010/01/05 00:00:00 -0500"},"longitude":-122.0597584,"id":"advbt5ttvsv9","location":"Antonelli Pond"},"type":"Feature","geometry":{"type":"Point","coordinates":[-122.0597584,36.9552561]}},{"properties":{"latitude":48.4209038,"column_5":2,"date":{"end_time":"2010/01/12 00:00:00 -0500","original":"1/11/2010","granularity":"day","time":"2010/01/11 00:00:00 -0500"},"longitude":-122.4816191,"id":"advbt63fgk8m","location":"Skagit Flats--Downey Rd"},"type":"Feature","geometry":{"type":"Point","coordinates":[-122.4816191,48.4209038]}},{"properties":{"latitude":46.2406574,"column_5":2,"date":{"end_time":"2010/01/22 00:00:00 -0500","original":"1/21/2010","granularity":"day","time":"2010/01/21 00:00:00 -0500"},"longitude":-119.2355783,"id":"advbt642kqdh","location":"Yakima River Delta"},"type":"Feature","geometry":{"type":"Point","coordinates":[-119.2355783,46.2406574]}},{"properties":{"latitude":34.1408821,"column_5":2,"date":{"end_time":"2010/02/14 00:00:00 -0500","original":"2/13/2010","granularity":"day","time":"2010/02/13 00:00:00 -0500"},"longitude":-119.1872406,"id":"advbt63pw2z7","location":"Ormond Beach - Sewage Pond"},"type":"Feature","geometry":{"type":"Point","coordinates":[-119.1872406,34.1408821]}},{"properties":{"latitude":33.5203597,"column_5":2,"date":{"end_time":"2010/02/16 00:00:00 -0500","original":"2/15/2010","granularity":"day","time":"2010/02/15 00:00:00 -0500"},"longitude":-113.0691862,"id":"advbt5vgl3rc","location":"I-10 Rest Area - West Maricopa County Az"},"type":"Feature","geometry":{"type":"Point","coordinates":[-113.0691862,33.5203597]}},{"properties":{"latitude":33.6614962,"column_5":2,"date":{"end_time":"2010/02/16 00:00:00 -0500","original":"2/15/2010","granularity":"day","time":"2010/02/15 00:00:00 -0500"},"longitude":-115.7210755,"id":"advbt5xr3bu6","location":"Chiriaco Summit"},"type":"Feature","geometry":{"type":"Point","coordinates":[-115.7210755,33.6614962]}},{"properties":{"latitude":33.5110032,"column_5":2,"date":{"end_time":"2010/02/17 00:00:00 -0500","original":"2/16/2010","granularity":"day","time":"2010/02/16 00:00:00 -0500"},"longitude":-111.906631,"id":"advbt5sfkawc","location":"Scottsdale--Chaparral Park"},"type":"Feature","geometry":{"type":"Point","coordinates":[-111.906631,33.5110032]}},{"properties":{"latitude":10.3206192,"column_5":2,"date":{"end_time":"2010/05/03 00:00:00 -0400","original":"5/2/2010","granularity":"day","time":"2010/05/02 00:00:00 -0400"},"longitude":-84.0256691,"id":"advbt617nlj6","location":"Road to Rara Avis - Lecheria"},"type":"Feature","geometry":{"type":"Point","coordinates":[-84.0256691,10.3206192]}},{"properties":{"latitude":10.4901187,"column_5":2,"date":{"end_time":"2010/05/16 00:00:00 -0400","original":"5/15/2010","granularity":"day","time":"2010/05/15 00:00:00 -0400"},"longitude":-84.0918589,"id":"advbt5slqory","location":"Tierra Hermosa"},"type":"Feature","geometry":{"type":"Point","coordinates":[-84.0918589,10.4901187]}},{"properties":{"latitude":36.2335775,"column_5":2,"date":{"end_time":"2010/05/21 00:00:00 -0400","original":"5/20/2010","granularity":"day","time":"2010/05/20 00:00:00 -0400"},"longitude":-119.824748,"id":"advbt5q279q0","location":"Jersey Ave. to Kent Ave.--ponds"},"type":"Feature","geometry":{"type":"Point","coordinates":[-119.824748,36.2335775]}},{"properties":{"latitude":42.5807466,"column_5":2,"date":{"end_time":"2010/05/23 00:00:00 -0400","original":"5/22/2010","granularity":"day","time":"2010/05/22 00:00:00 -0400"},"longitude":-121.9327068,"id":"advbt5qhpbv4","location":"Wood River Wetland"},"type":"Feature","geometry":{"type":"Point","coordinates":[-121.9327068,42.5807466]}},{"properties":{"latitude":43.198001,"column_5":2,"date":{"end_time":"2010/05/26 00:00:00 -0400","original":"5/25/2010","granularity":"day","time":"2010/05/25 00:00:00 -0400"},"longitude":-119.16424,"id":"advbt62skn38","location":"South Harney Lake"},"type":"Feature","geometry":{"type":"Point","coordinates":[-119.16424,43.198001]}},{"properties":{"latitude":42.9544647,"column_5":2,"date":{"end_time":"2010/06/09 00:00:00 -0400","original":"6/8/2010","granularity":"day","time":"2010/06/08 00:00:00 -0400"},"longitude":-118.8061345,"id":"advbt5xkrc2m","location":"Malheur NWR - Krumbo Reservoir"},"type":"Feature","geometry":{"type":"Point","coordinates":[-118.8061345,42.9544647]}},{"properties":{"latitude":43.01611,"column_5":2,"date":{"end_time":"2010/06/12 00:00:00 -0400","original":"6/11/2010","granularity":"day","time":"2010/06/11 00:00:00 -0400"},"longitude":-118.84927,"id":"advbt5tn1z79","location":"Malheur NWR--Grain Camp"},"type":"Feature","geometry":{"type":"Point","coordinates":[-118.84927,43.01611]}},{"properties":{"latitude":42.889999,"column_5":2,"date":{"end_time":"2010/06/16 00:00:00 -0400","original":"6/15/2010","granularity":"day","time":"2010/06/15 00:00:00 -0400"},"longitude":-118.869999,"id":"advbt60ile8v","location":"Malheur NWR--Knox Pond"},"type":"Feature","geometry":{"type":"Point","coordinates":[-118.869999,42.889999]}},{"properties":{"latitude":42.86568,"column_5":2,"date":{"end_time":"2010/06/17 00:00:00 -0400","original":"6/16/2010","granularity":"day","time":"2010/06/16 00:00:00 -0400"},"longitude":-118.91189,"id":"advbt5zjqbwi","location":"Malheur NWR-South Meadow Field and Highway 205"},"type":"Feature","geometry":{"type":"Point","coordinates":[-118.91189,42.86568]}},{"properties":{"latitude":43.2091797,"column_5":2,"date":{"end_time":"2010/07/07 00:00:00 -0400","original":"7/6/2010","granularity":"day","time":"2010/07/06 00:00:00 -0400"},"longitude":-118.9057159,"id":"advbt5xooe4j","location":"Malheur NWR--Ibis Pond"},"type":"Feature","geometry":{"type":"Point","coordinates":[-118.9057159,43.2091797]}},{"properties":{"latitude":43.0672732,"column_5":2,"date":{"end_time":"2010/07/11 00:00:00 -0400","original":"7/10/2010","granularity":"day","time":"2010/07/10 00:00:00 -0400"},"longitude":-118.8632083,"id":"advbt5px0jjp","location":"Malheur NWR--Buena Vista Ponds"},"type":"Feature","geometry":{"type":"Point","coordinates":[-118.8632083,43.0672732]}},{"properties":{"latitude":42.8790539,"column_5":2,"date":{"end_time":"2010/07/24 00:00:00 -0400","original":"7/23/2010","granularity":"day","time":"2010/07/23 00:00:00 -0400"},"longitude":-122.0376831,"id":"advbt63dxmr9","location":"Crater Lake National Park - Lost Creek Campground"},"type":"Feature","geometry":{"type":"Point","coordinates":[-122.0376831,42.8790539]}},{"properties":{"latitude":36.1457764,"column_5":2,"date":{"end_time":"2010/08/03 00:00:00 -0400","original":"8/2/2010","granularity":"day","time":"2010/08/02 00:00:00 -0400"},"longitude":-119.5545959,"id":"advbt5qa50j7","location":"Corcoran Reservoir"},"type":"Feature","geometry":{"type":"Point","coordinates":[-119.5545959,36.1457764]}},{"properties":{"latitude":36.0479886,"column_5":2,"date":{"end_time":"2010/08/03 00:00:00 -0400","original":"8/2/2010","granularity":"day","time":"2010/08/02 00:00:00 -0400"},"longitude":-119.5082474,"id":"advbt5x3vjjf","location":"Tule River--Hwy 43 to Ave. 144"},"type":"Feature","geometry":{"type":"Point","coordinates":[-119.5082474,36.0479886]}},{"properties":{"latitude":33.7026531,"column_5":2,"date":{"end_time":"2010/08/10 00:00:00 -0400","original":"8/9/2010","granularity":"day","time":"2010/08/09 00:00:00 -0400"},"longitude":-118.050735,"id":"advbt63c6xhk","location":"Bolsa Chica Ecological Reserve"},"type":"Feature","geometry":{"type":"Point","coordinates":[-118.050735,33.7026531]}},{"properties":{"latitude":9.7908333,"column_5":2,"date":{"end_time":"2010/09/21 00:00:00 -0400","original":"9/20/2010","granularity":"day","time":"2010/09/20 00:00:00 -0400"},"longitude":-84.5961111,"id":"advbt5z9kvzj","location":"PN Carara"},"type":"Feature","geometry":{"type":"Point","coordinates":[-84.5961111,9.7908333]}},{"properties":{"latitude":34.379242,"column_5":2,"date":{"end_time":"2010/09/28 00:00:00 -0400","original":"9/27/2010","granularity":"day","time":"2010/09/27 00:00:00 -0400"},"longitude":-119.47431,"id":"advbt5wvdu5y","location":"Bates Rd. Bridge"},"type":"Feature","geometry":{"type":"Point","coordinates":[-119.47431,34.379242]}},{"properties":{"latitude":37.4138004,"column_5":2,"date":{"end_time":"2010/10/03 00:00:00 -0400","original":"10/2/2010","granularity":"day","time":"2010/10/02 00:00:00 -0400"},"longitude":-122.7062988,"id":"advbt62cgalb","location":"Offshore (northern SM Co.)"},"type":"Feature","geometry":{"type":"Point","coordinates":[-122.7062988,37.4138004]}},{"properties":{"latitude":37.4975376,"column_5":2,"date":{"end_time":"2010/10/03 00:00:00 -0400","original":"10/2/2010","granularity":"day","time":"2010/10/02 00:00:00 -0400"},"longitude":-122.4906063,"id":"advbt5qqmhh4","location":"Pillar Pt. Harbor"},"type":"Feature","geometry":{"type":"Point","coordinates":[-122.4906063,37.4975376]}},{"properties":{"latitude":33.4124574,"column_5":2,"date":{"end_time":"2010/10/15 00:00:00 -0400","original":"10/14/2010","granularity":"day","time":"2010/10/14 00:00:00 -0400"},"longitude":-112.6914024,"id":"advbt5u357w1","location":"Buckeye Airport ponds #1"},"type":"Feature","geometry":{"type":"Point","coordinates":[-112.6914024,33.4124574]}},{"properties":{"latitude":38.7085647,"column_5":2,"date":{"end_time":"2010/10/29 00:00:00 -0400","original":"10/28/2010","granularity":"day","time":"2010/10/28 00:00:00 -0400"},"longitude":-77.0871073,"id":"advbt5xpr5bz","location":"Mt. Vernon"},"type":"Feature","geometry":{"type":"Point","coordinates":[-77.0871073,38.7085647]}},{"properties":{"latitude":38.7826585,"column_5":2,"date":{"end_time":"2010/10/29 00:00:00 -0400","original":"10/28/2010","granularity":"day","time":"2010/10/28 00:00:00 -0400"},"longitude":-77.013731,"id":"advbt60vqex9","location":"National Harbor"},"type":"Feature","geometry":{"type":"Point","coordinates":[-77.013731,38.7826585]}},{"properties":{"latitude":33.2806736,"column_5":2,"date":{"end_time":"2010/11/17 00:00:00 -0500","original":"11/16/2010","granularity":"day","time":"2010/11/16 00:00:00 -0500"},"longitude":-115.5796909,"id":"advbt5vm6dr6","location":"Salton Sea--Wister Unit"},"type":"Feature","geometry":{"type":"Point","coordinates":[-115.5796909,33.2806736]}},{"properties":{"latitude":34.2576421,"column_5":2,"date":{"end_time":"2010/11/22 00:00:00 -0500","original":"11/21/2010","granularity":"day","time":"2010/11/21 00:00:00 -0500"},"longitude":-114.1321993,"id":"advbt63lblev","location":"Parker Strip--Red Hills overlook"},"type":"Feature","geometry":{"type":"Point","coordinates":[-114.1321993,34.2576421]}},{"properties":{"latitude":37.4391903,"column_5":2,"date":{"end_time":"2010/11/25 00:00:00 -0500","original":"11/24/2010","granularity":"day","time":"2010/11/24 00:00:00 -0500"},"longitude":-118.5650969,"id":"advbt5rdkco6","location":"Birchim Canyon"},"type":"Feature","geometry":{"type":"Point","coordinates":[-118.5650969,37.4391903]}},{"properties":{"latitude":37.3670876,"column_5":2,"date":{"end_time":"2010/11/28 00:00:00 -0500","original":"11/27/2010","granularity":"day","time":"2010/11/27 00:00:00 -0500"},"longitude":-118.391118,"id":"advbt5sep0rb","location":"Bishop City Park"},"type":"Feature","geometry":{"type":"Point","coordinates":[-118.391118,37.3670876]}},{"properties":{"latitude":33.2533311,"column_5":2,"date":{"end_time":"2010/12/04 00:00:00 -0500","original":"12/3/2010","granularity":"day","time":"2010/12/03 00:00:00 -0500"},"longitude":-111.7181683,"id":"advbt60w2yef","location":"Gilbert--Higley Rd/Ocotillo Rd ponds"},"type":"Feature","geometry":{"type":"Point","coordinates":[-111.7181683,33.2533311]}},{"properties":{"latitude":34.2910483,"column_5":2,"date":{"end_time":"2010/12/13 00:00:00 -0500","original":"12/12/2010","granularity":"day","time":"2010/12/12 00:00:00 -0500"},"longitude":-114.1466618,"id":"advbt5pxmgsz","location":"Desilt Wash"},"type":"Feature","geometry":{"type":"Point","coordinates":[-114.1466618,34.2910483]}},{"properties":{"latitude":32.8324332,"column_5":2,"date":{"end_time":"2010/12/19 00:00:00 -0500","original":"12/18/2010","granularity":"day","time":"2010/12/18 00:00:00 -0500"},"longitude":-114.5363331,"id":"advbt5rvcgvh","location":"Bard Valley - AA canal"},"type":"Feature","geometry":{"type":"Point","coordinates":[-114.5363331,32.8324332]}},{"properties":{"latitude":32.829368,"column_5":2,"date":{"end_time":"2010/12/19 00:00:00 -0500","original":"12/18/2010","granularity":"day","time":"2010/12/18 00:00:00 -0500"},"longitude":-114.5425987,"id":"advbt62vfmqh","location":"North Bard Valley riparian area"},"type":"Feature","geometry":{"type":"Point","coordinates":[-114.5425987,32.829368]}},{"properties":{"latitude":34.7193574,"column_5":2,"date":{"end_time":"2010/12/25 00:00:00 -0500","original":"12/24/2010","granularity":"day","time":"2010/12/24 00:00:00 -0500"},"longitude":-114.4829249,"id":"advbt5ypwfjc","location":"Topock Marina"},"type":"Feature","geometry":{"type":"Point","coordinates":[-114.4829249,34.7193574]}},{"properties":{"latitude":34.5387678,"column_5":2,"date":{"end_time":"2011/01/02 00:00:00 -0500","original":"1/1/2011","granularity":"day","time":"2011/01/01 00:00:00 -0500"},"longitude":-114.3668604,"id":"advbt62d26gb","location":"Desert Hills"},"type":"Feature","geometry":{"type":"Point","coordinates":[-114.3668604,34.5387678]}},{"properties":{"latitude":34.5243786,"column_5":2,"date":{"end_time":"2011/01/02 00:00:00 -0500","original":"1/1/2011","granularity":"day","time":"2011/01/01 00:00:00 -0500"},"longitude":-114.3496084,"id":"advbt5wugjvn","location":"Lake Havasu City--North"},"type":"Feature","geometry":{"type":"Point","coordinates":[-114.3496084,34.5243786]}},{"properties":{"latitude":34.1147003,"column_5":2,"date":{"end_time":"2011/01/08 00:00:00 -0500","original":"1/7/2011","granularity":"day","time":"2011/01/07 00:00:00 -0500"},"longitude":-114.4085741,"id":"advbt5wqurtc","location":"Big River - Rio del Sol Rv Park"},"type":"Feature","geometry":{"type":"Point","coordinates":[-114.4085741,34.1147003]}},{"properties":{"latitude":34.1105254,"column_5":2,"date":{"end_time":"2011/01/08 00:00:00 -0500","original":"1/7/2011","granularity":"day","time":"2011/01/07 00:00:00 -0500"},"longitude":-114.4047546,"id":"advbt64lrocl","location":"Big River - Az side"},"type":"Feature","geometry":{"type":"Point","coordinates":[-114.4047546,34.1105254]}},{"properties":{"latitude":34.1368861,"column_5":2,"date":{"end_time":"2011/01/09 00:00:00 -0500","original":"1/8/2011","granularity":"day","time":"2011/01/08 00:00:00 -0500"},"longitude":-114.3286228,"id":"advbt5yu1t7b","location":"Earp - river"},"type":"Feature","geometry":{"type":"Point","coordinates":[-114.3286228,34.1368861]}},{"properties":{"latitude":34.2180836,"column_5":2,"date":{"end_time":"2011/01/09 00:00:00 -0500","original":"1/8/2011","granularity":"day","time":"2011/01/08 00:00:00 -0500"},"longitude":-114.1966152,"id":"advbt62ypov8","location":"La Paz Golf Course - Ponds"},"type":"Feature","geometry":{"type":"Point","coordinates":[-114.1966152,34.2180836]}},{"properties":{"latitude":34.0133605,"column_5":2,"date":{"end_time":"2011/01/09 00:00:00 -0500","original":"1/8/2011","granularity":"day","time":"2011/01/08 00:00:00 -0500"},"longitude":-114.4321132,"id":"advbt5rpnreu","location":"CRIT - Patrick Rd"},"type":"Feature","geometry":{"type":"Point","coordinates":[-114.4321132,34.0133605]}},{"properties":{"latitude":34.1775834,"column_5":2,"date":{"end_time":"2011/01/09 00:00:00 -0500","original":"1/8/2011","granularity":"day","time":"2011/01/08 00:00:00 -0500"},"longitude":-114.2378998,"id":"advbt5v0vjm3","location":"Parker Stirp - incidental sightings"},"type":"Feature","geometry":{"type":"Point","coordinates":[-114.2378998,34.1775834]}},{"properties":{"latitude":33.9810543,"column_5":2,"date":{"end_time":"2011/01/09 00:00:00 -0500","original":"1/8/2011","granularity":"day","time":"2011/01/08 00:00:00 -0500"},"longitude":-114.4339049,"id":"advbt5xggvyh","location":"CRIT-15th Ave former sod farms"},"type":"Feature","geometry":{"type":"Point","coordinates":[-114.4339049,33.9810543]}},{"properties":{"latitude":34.1195353,"column_5":2,"date":{"end_time":"2011/01/16 00:00:00 -0500","original":"1/15/2011","granularity":"day","time":"2011/01/15 00:00:00 -0500"},"longitude":-114.3681641,"id":"advbt64tlz1q","location":"Big River - State Line Pond (CA)"},"type":"Feature","geometry":{"type":"Point","coordinates":[-114.3681641,34.1195353]}},{"properties":{"latitude":34.2370491,"column_5":2,"date":{"end_time":"2011/01/18 00:00:00 -0500","original":"1/17/2011","granularity":"day","time":"2011/01/17 00:00:00 -0500"},"longitude":-113.5845137,"id":"advbt63r1qcm","location":"Alamo Lake SP (La Paz Co.)"},"type":"Feature","geometry":{"type":"Point","coordinates":[-113.5845137,34.2370491]}},{"properties":{"latitude":34.2567199,"column_5":2,"date":{"end_time":"2011/01/18 00:00:00 -0500","original":"1/17/2011","granularity":"day","time":"2011/01/17 00:00:00 -0500"},"longitude":-113.5685921,"id":"advbt5t9n6kr","location":"Alamo Lake SP--Cholla Rd access"},"type":"Feature","geometry":{"type":"Point","coordinates":[-113.5685921,34.2567199]}},{"properties":{"latitude":34.110632,"column_5":2,"date":{"end_time":"2011/01/18 00:00:00 -0500","original":"1/17/2011","granularity":"day","time":"2011/01/17 00:00:00 -0500"},"longitude":-114.0139246,"id":"advbt5roqxap","location":"CAP canal--Swansea Rd"},"type":"Feature","geometry":{"type":"Point","coordinates":[-114.0139246,34.110632]}},{"properties":{"latitude":34.2721127,"column_5":2,"date":{"end_time":"2011/01/18 00:00:00 -0500","original":"1/17/2011","granularity":"day","time":"2011/01/17 00:00:00 -0500"},"longitude":-113.5758018,"id":"advbt5w10j8g","location":"Alamo Lake SP (Mohave Co.)"},"type":"Feature","geometry":{"type":"Point","coordinates":[-113.5758018,34.2721127]}},{"properties":{"latitude":35.2073197,"column_5":2,"date":{"end_time":"2011/01/20 00:00:00 -0500","original":"1/19/2011","granularity":"day","time":"2011/01/19 00:00:00 -0500"},"longitude":-114.0429139,"id":"advbt5rtddi7","location":"Kingman Municipal Golf Course"},"type":"Feature","geometry":{"type":"Point","coordinates":[-114.0429139,35.2073197]}},{"properties":{"latitude":35.2008763,"column_5":2,"date":{"end_time":"2011/01/20 00:00:00 -0500","original":"1/19/2011","granularity":"day","time":"2011/01/19 00:00:00 -0500"},"longitude":-114.025898,"id":"advbt5ve2by7","location":"Kingman--Lewis Kingman Park"},"type":"Feature","geometry":{"type":"Point","coordinates":[-114.025898,35.2008763]}},{"properties":{"latitude":34.2162205,"column_5":2,"date":{"end_time":"2011/01/23 00:00:00 -0500","original":"1/22/2011","granularity":"day","time":"2011/01/22 00:00:00 -0500"},"longitude":-114.204576,"id":"advbt62vmsx3","location":"Patria Flats Day Use Area"},"type":"Feature","geometry":{"type":"Point","coordinates":[-114.204576,34.2162205]}},{"properties":{"latitude":35.0439551,"column_5":2,"date":{"end_time":"2011/01/30 00:00:00 -0500","original":"1/29/2011","granularity":"day","time":"2011/01/29 00:00:00 -0500"},"longitude":-114.3848205,"id":"advbt5s6puk5","location":"Oatman Highway - MP 27"},"type":"Feature","geometry":{"type":"Point","coordinates":[-114.3848205,35.0439551]}},{"properties":{"latitude":34.9762828,"column_5":2,"date":{"end_time":"2011/01/30 00:00:00 -0500","original":"1/29/2011","granularity":"day","time":"2011/01/29 00:00:00 -0500"},"longitude":-114.5240593,"id":"advbt5ywzceo","location":"Boundary Cone Rd"},"type":"Feature","geometry":{"type":"Point","coordinates":[-114.5240593,34.9762828]}},{"properties":{"latitude":35.1193294,"column_5":2,"date":{"end_time":"2011/01/30 00:00:00 -0500","original":"1/29/2011","granularity":"day","time":"2011/01/29 00:00:00 -0500"},"longitude":-114.2280722,"id":"advbt5qsj1s7","location":"Golden Valley - Tombstone Tr and Sacramento Wash"},"type":"Feature","geometry":{"type":"Point","coordinates":[-114.2280722,35.1193294]}},{"properties":{"latitude":36.0345593,"column_5":2,"date":{"end_time":"2011/01/31 00:00:00 -0500","original":"1/30/2011","granularity":"day","time":"2011/01/30 00:00:00 -0500"},"longitude":-114.3221426,"id":"advbt5pwzgo7","location":"Lake Mead NRA--Temple Bar"},"type":"Feature","geometry":{"type":"Point","coordinates":[-114.3221426,36.0345593]}},{"properties":{"latitude":35.4998102,"column_5":2,"date":{"end_time":"2011/01/31 00:00:00 -0500","original":"1/30/2011","granularity":"day","time":"2011/01/30 00:00:00 -0500"},"longitude":-114.4222641,"id":"advbt61mnhlu","location":"Sacramento Valley--Cottonwood Rd"},"type":"Feature","geometry":{"type":"Point","coordinates":[-114.4222641,35.4998102]}},{"properties":{"latitude":35.1474419,"column_5":2,"date":{"end_time":"2011/02/05 00:00:00 -0500","original":"2/4/2011","granularity":"day","time":"2011/02/04 00:00:00 -0500"},"longitude":-113.9403892,"id":"advbt61miths","location":"Hualapai Mountains - Wash in town"},"type":"Feature","geometry":{"type":"Point","coordinates":[-113.9403892,35.1474419]}},{"properties":{"latitude":35.1565124,"column_5":2,"date":{"end_time":"2011/02/05 00:00:00 -0500","original":"2/4/2011","granularity":"day","time":"2011/02/04 00:00:00 -0500"},"longitude":-113.9551735,"id":"advbt5q98oeq","location":"Hualapai Mountain Rd - below town"},"type":"Feature","geometry":{"type":"Point","coordinates":[-113.9551735,35.1565124]}},{"properties":{"latitude":35.072998,"column_5":2,"date":{"end_time":"2011/02/06 00:00:00 -0500","original":"2/5/2011","granularity":"day","time":"2011/02/05 00:00:00 -0500"},"longitude":-114.6066284,"id":"advbt5q0e6s9","location":"Colorado R. south of Laughlin (NV)"},"type":"Feature","geometry":{"type":"Point","coordinates":[-114.6066284,35.072998]}},{"properties":{"latitude":34.1886776,"column_5":2,"date":{"end_time":"2011/02/14 00:00:00 -0500","original":"2/13/2011","granularity":"day","time":"2011/02/13 00:00:00 -0500"},"longitude":-114.2251539,"id":"advbt60476mo","location":"Parker Strip--Cienega Springs"},"type":"Feature","geometry":{"type":"Point","coordinates":[-114.2251539,34.1886776]}},{"properties":{"latitude":35.2649109,"column_5":2,"date":{"end_time":"2011/02/21 00:00:00 -0500","original":"2/20/2011","granularity":"day","time":"2011/02/20 00:00:00 -0500"},"longitude":-114.5833683,"id":"advbt5svkhoo","location":"Lake Mead NRA--Princess Cove"},"type":"Feature","geometry":{"type":"Point","coordinates":[-114.5833683,35.2649109]}},{"properties":{"latitude":34.5101991,"column_5":2,"date":{"end_time":"2011/02/28 00:00:00 -0500","original":"2/27/2011","granularity":"day","time":"2011/02/27 00:00:00 -0500"},"longitude":-113.6006069,"id":"advbt64cbsnb","location":"Big Sandy River @ Signal Rd"},"type":"Feature","geometry":{"type":"Point","coordinates":[-113.6006069,34.5101991]}},{"properties":{"latitude":34.9266861,"column_5":2,"date":{"end_time":"2011/02/28 00:00:00 -0500","original":"2/27/2011","granularity":"day","time":"2011/02/27 00:00:00 -0500"},"longitude":-113.639617,"id":"advbt627zk4m","location":"Upper Trout Creek Rd"},"type":"Feature","geometry":{"type":"Point","coordinates":[-113.639617,34.9266861]}},{"properties":{"latitude":36.9069407,"column_5":2,"date":{"end_time":"2011/03/20 00:00:00 -0400","original":"3/19/2011","granularity":"day","time":"2011/03/19 00:00:00 -0400"},"longitude":-121.4207697,"id":"advbt637tjsx","location":"Hwy 156--San Benito County"},"type":"Feature","geometry":{"type":"Point","coordinates":[-121.4207697,36.9069407]}},{"properties":{"latitude":36.9522925,"column_5":2,"date":{"end_time":"2011/03/21 00:00:00 -0400","original":"3/20/2011","granularity":"day","time":"2011/03/20 00:00:00 -0400"},"longitude":-122.0420551,"id":"advbt5t889me","location":"West Cliff Dr.--western (Lighthouse Pt. to Swanton Blvd.)"},"type":"Feature","geometry":{"type":"Point","coordinates":[-122.0420551,36.9522925]}},{"properties":{"latitude":34.7206625,"column_5":2,"date":{"end_time":"2011/04/14 00:00:00 -0400","original":"4/13/2011","granularity":"day","time":"2011/04/13 00:00:00 -0400"},"longitude":-114.4905853,"id":"advbt5zwc5vk","location":"GBBO Site 9113"},"type":"Feature","geometry":{"type":"Point","coordinates":[-114.4905853,34.7206625]}},{"properties":{"latitude":35.1331845,"column_5":2,"date":{"end_time":"2011/04/22 00:00:00 -0400","original":"4/21/2011","granularity":"day","time":"2011/04/21 00:00:00 -0400"},"longitude":-113.9203906,"id":"advbt5pupqr8","location":"Hualapai Mountains - Atherton Rd"},"type":"Feature","geometry":{"type":"Point","coordinates":[-113.9203906,35.1331845]}},{"properties":{"latitude":35.0919135,"column_5":2,"date":{"end_time":"2011/04/22 00:00:00 -0400","original":"4/21/2011","granularity":"day","time":"2011/04/21 00:00:00 -0400"},"longitude":-113.8765633,"id":"advbt5ydxv4f","location":"Hualapai Mountain Resort"},"type":"Feature","geometry":{"type":"Point","coordinates":[-113.8765633,35.0919135]}},{"properties":{"latitude":33.9117613,"column_5":2,"date":{"end_time":"2011/05/02 00:00:00 -0400","original":"5/1/2011","granularity":"day","time":"2011/05/01 00:00:00 -0400"},"longitude":-114.4431317,"id":"advbt64lt0tw","location":"Parker Valley - Mark Rd"},"type":"Feature","geometry":{"type":"Point","coordinates":[-114.4431317,33.9117613]}},{"properties":{"latitude":33.2705019,"column_5":2,"date":{"end_time":"2011/05/02 00:00:00 -0400","original":"5/1/2011","granularity":"day","time":"2011/05/01 00:00:00 -0400"},"longitude":-114.6876204,"id":"advbt60o6h1z","location":"GBBO Site 6115"},"type":"Feature","geometry":{"type":"Point","coordinates":[-114.6876204,33.2705019]}},{"properties":{"latitude":34.26038,"column_5":2,"date":{"end_time":"2011/05/15 00:00:00 -0400","original":"5/14/2011","granularity":"day","time":"2011/05/14 00:00:00 -0400"},"longitude":-114.1295654,"id":"advbt5ty8qfk","location":"Parker Strip--Holiday Harbour"},"type":"Feature","geometry":{"type":"Point","coordinates":[-114.1295654,34.26038]}},{"properties":{"latitude":33.4886319,"column_5":2,"date":{"end_time":"2011/06/06 00:00:00 -0400","original":"6/5/2011","granularity":"day","time":"2011/06/05 00:00:00 -0400"},"longitude":-114.6562171,"id":"advbt5tbf71f","location":"Neighbours Blvd - Riv"},"type":"Feature","geometry":{"type":"Point","coordinates":[-114.6562171,33.4886319]}},{"properties":{"latitude":33.36505,"column_5":2,"date":{"end_time":"2011/06/12 00:00:00 -0400","original":"6/11/2011","granularity":"day","time":"2011/06/11 00:00:00 -0400"},"longitude":-114.67832,"id":"advbt62b6ism","location":"Cibola NWR--Cornfield Nature Trail"},"type":"Feature","geometry":{"type":"Point","coordinates":[-114.67832,33.36505]}},{"properties":{"latitude":33.2621316,"column_5":2,"date":{"end_time":"2011/06/13 00:00:00 -0400","original":"6/12/2011","granularity":"day","time":"2011/06/12 00:00:00 -0400"},"longitude":-114.6888113,"id":"advbt5u6x6zs","location":"Cibola NWR - Imperial Co portion"},"type":"Feature","geometry":{"type":"Point","coordinates":[-114.6888113,33.2621316]}},{"properties":{"latitude":35.0642871,"column_5":2,"date":{"end_time":"2011/07/03 00:00:00 -0400","original":"7/2/2011","granularity":"day","time":"2011/07/02 00:00:00 -0400"},"longitude":-113.8704586,"id":"advbt5tx4z7i","location":"Wild Cow Springs Campground"},"type":"Feature","geometry":{"type":"Point","coordinates":[-113.8704586,35.0642871]}},{"properties":{"latitude":34.902456,"column_5":2,"date":{"end_time":"2011/07/07 00:00:00 -0400","original":"7/6/2011","granularity":"day","time":"2011/07/06 00:00:00 -0400"},"longitude":-114.5892048,"id":"advbt5sm9p84","location":"Mohave Valley--Willow Valley"},"type":"Feature","geometry":{"type":"Point","coordinates":[-114.5892048,34.902456]}},{"properties":{"latitude":35.4858337,"column_5":2,"date":{"end_time":"2011/07/17 00:00:00 -0400","original":"7/16/2011","granularity":"day","time":"2011/07/16 00:00:00 -0400"},"longitude":-113.5636568,"id":"advbt5t6do0w","location":"Truxton"},"type":"Feature","geometry":{"type":"Point","coordinates":[-113.5636568,35.4858337]}},{"properties":{"latitude":35.524822,"column_5":2,"date":{"end_time":"2011/07/17 00:00:00 -0400","original":"7/16/2011","granularity":"day","time":"2011/07/16 00:00:00 -0400"},"longitude":-113.4743071,"id":"advbt60vqdmy","location":"Buck and Doe Rd and Rt 66"},"type":"Feature","geometry":{"type":"Point","coordinates":[-113.4743071,35.524822]}},{"properties":{"latitude":36.6709225,"column_5":2,"date":{"end_time":"2011/08/07 00:00:00 -0400","original":"8/6/2011","granularity":"day","time":"2011/08/06 00:00:00 -0400"},"longitude":-114.011693,"id":"advbt6392ucg","location":"Lime Kiln Canyon"},"type":"Feature","geometry":{"type":"Point","coordinates":[-114.011693,36.6709225]}},{"properties":{"latitude":36.8845076,"column_5":2,"date":{"end_time":"2011/08/07 00:00:00 -0400","original":"8/6/2011","granularity":"day","time":"2011/08/06 00:00:00 -0400"},"longitude":-113.9314198,"id":"advbt5zngolv","location":"Littlefield"},"type":"Feature","geometry":{"type":"Point","coordinates":[-113.9314198,36.8845076]}},{"properties":{"latitude":31.7088259,"column_5":2,"date":{"end_time":"2011/08/18 00:00:00 -0400","original":"8/17/2011","granularity":"day","time":"2011/08/17 00:00:00 -0400"},"longitude":-111.0074151,"id":"advbt63sztlh","location":"Mt. Hopkins Rd"},"type":"Feature","geometry":{"type":"Point","coordinates":[-111.0074151,31.7088259]}},{"properties":{"latitude":31.9815,"column_5":2,"date":{"end_time":"2011/08/19 00:00:00 -0400","original":"8/18/2011","granularity":"day","time":"2011/08/18 00:00:00 -0400"},"longitude":-110.2924,"id":"advbt62hagn8","location":"Benson STP"},"type":"Feature","geometry":{"type":"Point","coordinates":[-110.2924,31.9815]}},{"properties":{"latitude":31.876683,"column_5":2,"date":{"end_time":"2011/08/19 00:00:00 -0400","original":"8/18/2011","granularity":"day","time":"2011/08/18 00:00:00 -0400"},"longitude":-110.2126819,"id":"advbt64b0hak","location":"St. David--Holy Trinity Monastery"},"type":"Feature","geometry":{"type":"Point","coordinates":[-110.2126819,31.876683]}},{"properties":{"latitude":31.6257,"column_5":2,"date":{"end_time":"2011/08/19 00:00:00 -0400","original":"8/18/2011","granularity":"day","time":"2011/08/18 00:00:00 -0400"},"longitude":-110.1735992,"id":"advbt6562tpv","location":"San Pedro RNCA--Charleston Bridge"},"type":"Feature","geometry":{"type":"Point","coordinates":[-110.1735992,31.6257]}},{"properties":{"latitude":31.4521999,"column_5":2,"date":{"end_time":"2011/08/20 00:00:00 -0400","original":"8/19/2011","granularity":"day","time":"2011/08/19 00:00:00 -0400"},"longitude":-110.3761978,"id":"advbt63s2bal","location":"Sawmill Canyon"},"type":"Feature","geometry":{"type":"Point","coordinates":[-110.3761978,31.4521999]}},{"properties":{"latitude":35.0116506,"column_5":2,"date":{"end_time":"2011/08/28 00:00:00 -0400","original":"8/27/2011","granularity":"day","time":"2011/08/27 00:00:00 -0400"},"longitude":-114.6389866,"id":"advbt620n8hr","location":"LCRV - Below Aztec Rd"},"type":"Feature","geometry":{"type":"Point","coordinates":[-114.6389866,35.0116506]}},{"properties":{"latitude":34.4585238,"column_5":2,"date":{"end_time":"2011/10/05 00:00:00 -0400","original":"10/4/2011","granularity":"day","time":"2011/10/04 00:00:00 -0400"},"longitude":-114.3556488,"id":"advbt604if16","location":"Lake Havasu City--The Nautical Resort"},"type":"Feature","geometry":{"type":"Point","coordinates":[-114.3556488,34.4585238]}},{"properties":{"latitude":35.4055746,"column_5":2,"date":{"end_time":"2011/10/11 00:00:00 -0400","original":"10/10/2011","granularity":"day","time":"2011/10/10 00:00:00 -0400"},"longitude":-113.8601375,"id":"advbt5xmhytw","location":"Valle Vista Country Club"},"type":"Feature","geometry":{"type":"Point","coordinates":[-113.8601375,35.4055746]}},{"properties":{"latitude":36.4243213,"column_5":2,"date":{"end_time":"2011/11/21 00:00:00 -0500","original":"11/20/2011","granularity":"day","time":"2011/11/20 00:00:00 -0500"},"longitude":-113.0587149,"id":"advbt5ur583p","location":"North Torowep Valley"},"type":"Feature","geometry":{"type":"Point","coordinates":[-113.0587149,36.4243213]}},{"properties":{"latitude":36.3694659,"column_5":2,"date":{"end_time":"2011/11/21 00:00:00 -0500","original":"11/20/2011","granularity":"day","time":"2011/11/20 00:00:00 -0500"},"longitude":-113.204155,"id":"advbt61my1ts","location":"Mount Logan"},"type":"Feature","geometry":{"type":"Point","coordinates":[-113.204155,36.3694659]}},{"properties":{"latitude":34.448027,"column_5":2,"date":{"end_time":"2011/12/03 00:00:00 -0500","original":"12/2/2011","granularity":"day","time":"2011/12/02 00:00:00 -0500"},"longitude":-114.3394726,"id":"advbt63ei5q4","location":"Lake Havasu--Thompson Bay (Ca)"},"type":"Feature","geometry":{"type":"Point","coordinates":[-114.3394726,34.448027]}},{"properties":{"latitude":34.1705533,"column_5":2,"date":{"end_time":"2011/12/04 00:00:00 -0500","original":"12/3/2011","granularity":"day","time":"2011/12/03 00:00:00 -0500"},"longitude":-114.2724037,"id":"advbt5rn5t68","location":"Colorado River, Moovalya Lake (AZ)"},"type":"Feature","geometry":{"type":"Point","coordinates":[-114.2724037,34.1705533]}},{"properties":{"latitude":36.1107215,"column_5":2,"date":{"end_time":"2012/01/05 00:00:00 -0500","original":"1/4/2012","granularity":"day","time":"2012/01/04 00:00:00 -0500"},"longitude":-114.4493879,"id":"advbt5v1anmp","location":"Lake Mead NRA (AZ)"},"type":"Feature","geometry":{"type":"Point","coordinates":[-114.4493879,36.1107215]}},{"properties":{"latitude":33.391,"column_5":2,"date":{"end_time":"2012/01/22 00:00:00 -0500","original":"1/21/2012","granularity":"day","time":"2012/01/21 00:00:00 -0500"},"longitude":-112.239,"id":"advbt63rfg2q","location":"Tres Rios Wetlands--Hayfield Site (historical)"},"type":"Feature","geometry":{"type":"Point","coordinates":[-112.239,33.391]}},{"properties":{"latitude":33.4740415,"column_5":2,"date":{"end_time":"2012/01/22 00:00:00 -0500","original":"1/21/2012","granularity":"day","time":"2012/01/21 00:00:00 -0500"},"longitude":-112.0898581,"id":"advbt5ufftyd","location":"Encanto Park"},"type":"Feature","geometry":{"type":"Point","coordinates":[-112.0898581,33.4740415]}},{"properties":{"latitude":35.1405814,"column_5":2,"date":{"end_time":"2012/02/06 00:00:00 -0500","original":"2/5/2012","granularity":"day","time":"2012/02/05 00:00:00 -0500"},"longitude":-114.571116,"id":"advbt5pz4g1y","location":"Bullhead City--Community Park"},"type":"Feature","geometry":{"type":"Point","coordinates":[-114.571116,35.1405814]}},{"properties":{"latitude":35.4484385,"column_5":2,"date":{"end_time":"2012/02/06 00:00:00 -0500","original":"2/5/2012","granularity":"day","time":"2012/02/05 00:00:00 -0500"},"longitude":-114.340451,"id":"advbt62v5eco","location":"Detrital Valley--Southern"},"type":"Feature","geometry":{"type":"Point","coordinates":[-114.340451,35.4484385]}},{"properties":{"latitude":34.0862756,"column_5":2,"date":{"end_time":"2012/02/20 00:00:00 -0500","original":"2/19/2012","granularity":"day","time":"2012/02/19 00:00:00 -0500"},"longitude":-114.3900617,"id":"advbt5vbb227","location":"Parker Valley--Burns Rd"},"type":"Feature","geometry":{"type":"Point","coordinates":[-114.3900617,34.0862756]}},{"properties":{"latitude":34.4690229,"column_5":2,"date":{"end_time":"2012/02/26 00:00:00 -0500","original":"2/25/2012","granularity":"day","time":"2012/02/25 00:00:00 -0500"},"longitude":-114.3343917,"id":"advbt5rnrfqr","location":"Lake Havasu City--Pima Wash Walkway"},"type":"Feature","geometry":{"type":"Point","coordinates":[-114.3343917,34.4690229]}},{"properties":{"latitude":34.1502586,"column_5":2,"date":{"end_time":"2012/03/06 00:00:00 -0500","original":"3/5/2012","granularity":"day","time":"2012/03/05 00:00:00 -0500"},"longitude":-114.2888236,"id":"advbt5va1r4c","location":"Terrible's Gas Station"},"type":"Feature","geometry":{"type":"Point","coordinates":[-114.2888236,34.1502586]}},{"properties":{"latitude":32.8846038,"column_5":2,"date":{"end_time":"2012/03/12 00:00:00 -0400","original":"3/11/2012","granularity":"day","time":"2012/03/11 00:00:00 -0500"},"longitude":-114.4689997,"id":"advbt5y4z4o5","location":"Phil Swing Park"},"type":"Feature","geometry":{"type":"Point","coordinates":[-114.4689997,32.8846038]}},{"properties":{"latitude":34.2633335,"column_5":2,"date":{"end_time":"2012/03/22 00:00:00 -0400","original":"3/21/2012","granularity":"day","time":"2012/03/21 00:00:00 -0400"},"longitude":-114.0248631,"id":"advbt5z89q68","location":"Bill Williams NWR--Cougar Point (La Paz)"},"type":"Feature","geometry":{"type":"Point","coordinates":[-114.0248631,34.2633335]}},{"properties":{"latitude":32.8746061,"column_5":2,"date":{"end_time":"2012/04/19 00:00:00 -0400","original":"4/18/2012","granularity":"day","time":"2012/04/18 00:00:00 -0400"},"longitude":-114.4578629,"id":"advbt5s3etrq","location":"Imperial Dam--marshes (AZ)"},"type":"Feature","geometry":{"type":"Point","coordinates":[-114.4578629,32.8746061]}},{"properties":{"latitude":33.6995959,"column_5":2,"date":{"end_time":"2012/04/20 00:00:00 -0400","original":"4/19/2012","granularity":"day","time":"2012/04/19 00:00:00 -0400"},"longitude":-114.5519574,"id":"advbt5ulur1y","location":"PVER - Ag fields nearby"},"type":"Feature","geometry":{"type":"Point","coordinates":[-114.5519574,33.6995959]}},{"properties":{"latitude":34.4706929,"column_5":2,"date":{"end_time":"2012/04/28 00:00:00 -0400","original":"4/27/2012","granularity":"day","time":"2012/04/27 00:00:00 -0400"},"longitude":-113.6361743,"id":"advbt5qpb24f","location":"Signal Spring"},"type":"Feature","geometry":{"type":"Point","coordinates":[-113.6361743,34.4706929]}},{"properties":{"latitude":34.6020729,"column_5":2,"date":{"end_time":"2012/04/29 00:00:00 -0400","original":"4/28/2012","granularity":"day","time":"2012/04/28 00:00:00 -0400"},"longitude":-113.5503959,"id":"advbt5y7u318","location":"Signal Road"},"type":"Feature","geometry":{"type":"Point","coordinates":[-113.5503959,34.6020729]}},{"properties":{"latitude":32.7636877,"column_5":2,"date":{"end_time":"2012/05/06 00:00:00 -0400","original":"5/5/2012","granularity":"day","time":"2012/05/05 00:00:00 -0400"},"longitude":-114.5288291,"id":"advbt65qgliu","location":"Riparian/ag north of Fort Yuma Res"},"type":"Feature","geometry":{"type":"Point","coordinates":[-114.5288291,32.7636877]}},{"properties":{"latitude":33.0460401,"column_5":2,"date":{"end_time":"2012/05/07 00:00:00 -0400","original":"5/6/2012","granularity":"day","time":"2012/05/06 00:00:00 -0400"},"longitude":-114.6532993,"id":"advbt5vd9rb0","location":"Adobe Lake"},"type":"Feature","geometry":{"type":"Point","coordinates":[-114.6532993,33.0460401]}},{"properties":{"latitude":31.7251514,"column_5":2,"date":{"end_time":"2012/05/11 00:00:00 -0400","original":"5/10/2012","granularity":"day","time":"2012/05/10 00:00:00 -0400"},"longitude":-110.8801067,"id":"advbt5uog0t2","location":"Madera Canyon--Santa Rita Lodge"},"type":"Feature","geometry":{"type":"Point","coordinates":[-110.8801067,31.7251514]}},{"properties":{"latitude":32.7310326,"column_5":2,"date":{"end_time":"2012/05/21 00:00:00 -0400","original":"5/20/2012","granularity":"day","time":"2012/05/20 00:00:00 -0400"},"longitude":-114.6186916,"id":"advbt600ap9x","location":"Quechan Walking Trail Park"},"type":"Feature","geometry":{"type":"Point","coordinates":[-114.6186916,32.7310326]}},{"properties":{"latitude":35.2568688,"column_5":2,"date":{"end_time":"2012/05/25 00:00:00 -0400","original":"5/24/2012","granularity":"day","time":"2012/05/24 00:00:00 -0400"},"longitude":-116.0720801,"id":"advbt62js1ar","location":"Baker WTP"},"type":"Feature","geometry":{"type":"Point","coordinates":[-116.0720801,35.2568688]}},{"properties":{"latitude":35.02107,"column_5":2,"date":{"end_time":"2012/05/25 00:00:00 -0400","original":"5/24/2012","granularity":"day","time":"2012/05/24 00:00:00 -0400"},"longitude":-115.1321054,"id":"advbt5stioe5","location":"Mojave National Preserve--Lanfair Valley"},"type":"Feature","geometry":{"type":"Point","coordinates":[-115.1321054,35.02107]}},{"properties":{"latitude":35.274531,"column_5":2,"date":{"end_time":"2012/05/25 00:00:00 -0400","original":"5/24/2012","granularity":"day","time":"2012/05/24 00:00:00 -0400"},"longitude":-116.06263,"id":"advbt5tho786","location":"Chet Huffman Park"},"type":"Feature","geometry":{"type":"Point","coordinates":[-116.06263,35.274531]}},{"properties":{"latitude":36.4597219,"column_5":2,"date":{"end_time":"2012/05/26 00:00:00 -0400","original":"5/25/2012","granularity":"day","time":"2012/05/25 00:00:00 -0400"},"longitude":-116.8732095,"id":"advbt64zsq98","location":"Death Valley NP--Furnace Creek Golf Course"},"type":"Feature","geometry":{"type":"Point","coordinates":[-116.8732095,36.4597219]}},{"properties":{"latitude":35.7950665,"column_5":2,"date":{"end_time":"2012/05/26 00:00:00 -0400","original":"5/25/2012","granularity":"day","time":"2012/05/25 00:00:00 -0400"},"longitude":-115.961763,"id":"advbt5xuk6ha","location":"Crystal Spring (INY Co.)"},"type":"Feature","geometry":{"type":"Point","coordinates":[-115.961763,35.7950665]}},{"properties":{"latitude":36.6071223,"column_5":2,"date":{"end_time":"2012/05/26 00:00:00 -0400","original":"5/25/2012","granularity":"day","time":"2012/05/25 00:00:00 -0400"},"longitude":-117.1443844,"id":"advbt66328y9","location":"Death Valley NP--Stovepipe Wells"},"type":"Feature","geometry":{"type":"Point","coordinates":[-117.1443844,36.6071223]}},{"properties":{"latitude":33.4111979,"column_5":2,"date":{"end_time":"2012/06/06 00:00:00 -0400","original":"6/5/2012","granularity":"day","time":"2012/06/05 00:00:00 -0400"},"longitude":-114.6852229,"id":"advbt5yvxeua","location":"CVCA - Phase 6"},"type":"Feature","geometry":{"type":"Point","coordinates":[-114.6852229,33.4111979]}},{"properties":{"latitude":33.36248,"column_5":2,"date":{"end_time":"2012/07/02 00:00:00 -0400","original":"7/1/2012","granularity":"day","time":"2012/07/01 00:00:00 -0400"},"longitude":-114.702515,"id":"advbt5tiv8m3","location":"Palo Verde--old restoration site"},"type":"Feature","geometry":{"type":"Point","coordinates":[-114.702515,33.36248]}},{"properties":{"latitude":33.50678,"column_5":2,"date":{"end_time":"2012/07/02 00:00:00 -0400","original":"7/1/2012","granularity":"day","time":"2012/07/01 00:00:00 -0400"},"longitude":-114.6320349,"id":"advbt5xezx47","location":"Blythe--28th Ave"},"type":"Feature","geometry":{"type":"Point","coordinates":[-114.6320349,33.50678]}},{"properties":{"latitude":33.5670778,"column_5":2,"date":{"end_time":"2012/08/30 00:00:00 -0400","original":"8/29/2012","granularity":"day","time":"2012/08/29 00:00:00 -0400"},"longitude":-114.7586974,"id":"advbt5r6i8im","location":"Mule Mtns area"},"type":"Feature","geometry":{"type":"Point","coordinates":[-114.7586974,33.5670778]}},{"properties":{"latitude":34.7942109,"column_5":2,"date":{"end_time":"2012/09/10 00:00:00 -0400","original":"9/9/2012","granularity":"day","time":"2012/09/09 00:00:00 -0400"},"longitude":-114.5058632,"id":"advbt5s54z2u","location":"Havasu NWR--Five Mile Landing"},"type":"Feature","geometry":{"type":"Point","coordinates":[-114.5058632,34.7942109]}},{"properties":{"latitude":34.84266,"column_5":2,"date":{"end_time":"2012/09/10 00:00:00 -0400","original":"9/9/2012","granularity":"day","time":"2012/09/09 00:00:00 -0400"},"longitude":-114.60703,"id":"advbt65nzqan","location":"Ed Parry Park"},"type":"Feature","geometry":{"type":"Point","coordinates":[-114.60703,34.84266]}},{"properties":{"latitude":38.2289099,"column_5":2,"date":{"end_time":"2012/09/28 00:00:00 -0400","original":"9/27/2012","granularity":"day","time":"2012/09/27 00:00:00 -0400"},"longitude":-122.5980878,"id":"advbt5ug65vj","location":"Shollenberger Park"},"type":"Feature","geometry":{"type":"Point","coordinates":[-122.5980878,38.2289099]}},{"properties":{"latitude":38.3098072,"column_5":2,"date":{"end_time":"2012/09/28 00:00:00 -0400","original":"9/27/2012","granularity":"day","time":"2012/09/27 00:00:00 -0400"},"longitude":-123.0619812,"id":"advbt5uw03h7","location":"Owl Canyon"},"type":"Feature","geometry":{"type":"Point","coordinates":[-123.0619812,38.3098072]}},{"properties":{"latitude":32.927366,"column_5":2,"date":{"end_time":"2012/12/16 00:00:00 -0500","original":"12/15/2012","granularity":"day","time":"2012/12/15 00:00:00 -0500"},"longitude":-114.516588,"id":"advbt65ujl3i","location":"Washes north of Senator Wash"},"type":"Feature","geometry":{"type":"Point","coordinates":[-114.516588,32.927366]}},{"properties":{"latitude":34.4087848,"column_5":2,"date":{"end_time":"2012/12/24 00:00:00 -0500","original":"12/23/2012","granularity":"day","time":"2012/12/23 00:00:00 -0500"},"longitude":-119.5516894,"id":"advbt5xapsoz","location":"Santa Claus Ln."},"type":"Feature","geometry":{"type":"Point","coordinates":[-119.5516894,34.4087848]}},{"properties":{"latitude":34.476761,"column_5":2,"date":{"end_time":"2013/01/16 00:00:00 -0500","original":"1/15/2013","granularity":"day","time":"2013/01/15 00:00:00 -0500"},"longitude":-114.322525,"id":"advbt61nf3cg","location":"Lake Havasu City--McCulloch and Acoma"},"type":"Feature","geometry":{"type":"Point","coordinates":[-114.322525,34.476761]}},{"properties":{"latitude":33.7337966,"column_5":2,"date":{"end_time":"2013/01/17 00:00:00 -0500","original":"1/16/2013","granularity":"day","time":"2013/01/16 00:00:00 -0500"},"longitude":-114.5106385,"id":"advbt64unnd9","location":"Palo Verde Dam"},"type":"Feature","geometry":{"type":"Point","coordinates":[-114.5106385,33.7337966]}},{"properties":{"latitude":35.1767374,"column_5":2,"date":{"end_time":"2013/01/30 00:00:00 -0500","original":"1/29/2013","granularity":"day","time":"2013/01/29 00:00:00 -0500"},"longitude":-114.8495293,"id":"advbt5reqmlr","location":"Hwy 95--CA/NV state line (NV)"},"type":"Feature","geometry":{"type":"Point","coordinates":[-114.8495293,35.1767374]}},{"properties":{"latitude":34.287367,"column_5":2,"date":{"end_time":"2013/02/08 00:00:00 -0500","original":"2/7/2013","granularity":"day","time":"2013/02/07 00:00:00 -0500"},"longitude":-114.076721,"id":"advbt5r5aypg","location":"Bill Williams River NWR--Saguaro Slot"},"type":"Feature","geometry":{"type":"Point","coordinates":[-114.076721,34.287367]}},{"properties":{"latitude":33.3758513,"column_5":2,"date":{"end_time":"2013/03/02 00:00:00 -0500","original":"3/1/2013","granularity":"day","time":"2013/03/01 00:00:00 -0500"},"longitude":-114.6742631,"id":"advbt5z58f0z","location":"Cibola Valley - Baseline Pond"},"type":"Feature","geometry":{"type":"Point","coordinates":[-114.6742631,33.3758513]}},{"properties":{"latitude":33.638547,"column_5":2,"date":{"end_time":"2013/03/02 00:00:00 -0500","original":"3/1/2013","granularity":"day","time":"2013/03/01 00:00:00 -0500"},"longitude":-114.595874,"id":"advbt5rn7tqi","location":"Blythe Fish Ponds"},"type":"Feature","geometry":{"type":"Point","coordinates":[-114.595874,33.638547]}},{"properties":{"latitude":34.045216,"column_5":2,"date":{"end_time":"2013/03/03 00:00:00 -0500","original":"3/2/2013","granularity":"day","time":"2013/03/02 00:00:00 -0500"},"longitude":-117.2103453,"id":"advbt62tochp","location":"Redlands - Brookside Park"},"type":"Feature","geometry":{"type":"Point","coordinates":[-117.2103453,34.045216]}},{"properties":{"latitude":36.607589,"column_5":2,"date":{"end_time":"2013/03/05 00:00:00 -0500","original":"3/4/2013","granularity":"day","time":"2013/03/04 00:00:00 -0500"},"longitude":-114.323,"id":"advbt5qz6vaa","location":"Virgin River east of Mormon Mesa"},"type":"Feature","geometry":{"type":"Point","coordinates":[-114.323,36.607589]}},{"properties":{"latitude":35.96135,"column_5":2,"date":{"end_time":"2013/03/05 00:00:00 -0500","original":"3/4/2013","granularity":"day","time":"2013/03/04 00:00:00 -0500"},"longitude":-114.83593,"id":"advbt61en5m1","location":"Boulder City, 796 Marita Drive"},"type":"Feature","geometry":{"type":"Point","coordinates":[-114.83593,35.96135]}},{"properties":{"latitude":35.954875,"column_5":2,"date":{"end_time":"2013/03/09 00:00:00 -0500","original":"3/8/2013","granularity":"day","time":"2013/03/08 00:00:00 -0500"},"longitude":-114.847675,"id":"advbt65n0baa","location":"Boulder City--Veterans Memorial Park"},"type":"Feature","geometry":{"type":"Point","coordinates":[-114.847675,35.954875]}},{"properties":{"latitude":34.272536,"column_5":2,"date":{"end_time":"2013/03/21 00:00:00 -0400","original":"3/20/2013","granularity":"day","time":"2013/03/20 00:00:00 -0400"},"longitude":-114.041209,"id":"advbt5pv5smc","location":"Bill Williams River NWR--Black Rail Marsh/Gibraltar Rock"},"type":"Feature","geometry":{"type":"Point","coordinates":[-114.041209,34.272536]}},{"properties":{"latitude":34.253891,"column_5":2,"date":{"end_time":"2013/04/11 00:00:00 -0400","original":"4/10/2013","granularity":"day","time":"2013/04/10 00:00:00 -0400"},"longitude":-114.0101266,"id":"advbt5ri8ukk","location":"Bill Williams River NWR--Mineral Wash (La Paz Co.)"},"type":"Feature","geometry":{"type":"Point","coordinates":[-114.0101266,34.253891]}},{"properties":{"latitude":37.7419423,"column_5":1,"date":{"end_time":"1996/08/12 00:00:00 -0400","original":"8/11/1996","granularity":"day","time":"1996/08/11 00:00:00 -0400"},"longitude":-119.5810318,"id":"advbt6024qnn","location":"Yosemite NP"},"type":"Feature","geometry":{"type":"Point","coordinates":[-119.5810318,37.7419423]}},{"properties":{"latitude":21.3681354,"column_5":1,"date":{"end_time":"1997/06/01 00:00:00 -0400","original":"5/31/1997","granularity":"day","time":"1997/05/31 00:00:00 -0400"},"longitude":-157.9388321,"id":"advbt5s9z9al","location":"Pearl Harbor--WWII Valor in the Pacific NM"},"type":"Feature","geometry":{"type":"Point","coordinates":[-157.9388321,21.3681354]}},{"properties":{"latitude":21.2894543,"column_5":1,"date":{"end_time":"1997/08/18 00:00:00 -0400","original":"8/17/1997","granularity":"day","time":"1997/08/17 00:00:00 -0400"},"longitude":-157.8464985,"id":"advbt5t0hgfn","location":"Ala Moana Park and State Recreation Area"},"type":"Feature","geometry":{"type":"Point","coordinates":[-157.8464985,21.2894543]}},{"properties":{"latitude":36.6474871,"column_5":1,"date":{"end_time":"1997/10/21 00:00:00 -0400","original":"10/20/1997","granularity":"day","time":"1997/10/20 00:00:00 -0400"},"longitude":-117.0414734,"id":"advbt608oz1z","location":"Death Valley NP"},"type":"Feature","geometry":{"type":"Point","coordinates":[-117.0414734,36.6474871]}},{"properties":{"latitude":40.3779361,"column_5":1,"date":{"end_time":"1998/07/04 00:00:00 -0400","original":"7/3/1998","granularity":"day","time":"1998/07/03 00:00:00 -0400"},"longitude":-105.5199051,"id":"advbt5stseg9","location":"Estes Park area"},"type":"Feature","geometry":{"type":"Point","coordinates":[-105.5199051,40.3779361]}},{"properties":{"latitude":30.4735322,"column_5":1,"date":{"end_time":"1998/07/22 00:00:00 -0400","original":"7/21/1998","granularity":"day","time":"1998/07/21 00:00:00 -0400"},"longitude":-94.3416595,"id":"advbt5shry9q","location":"Big Thicket NR"},"type":"Feature","geometry":{"type":"Point","coordinates":[-94.3416595,30.4735322]}},{"properties":{"latitude":36.7820671,"column_5":1,"date":{"end_time":"1998/07/23 00:00:00 -0400","original":"7/22/1998","granularity":"day","time":"1998/07/22 00:00:00 -0400"},"longitude":-103.975296,"id":"advbt61ijgnw","location":"Capulin NM"},"type":"Feature","geometry":{"type":"Point","coordinates":[-103.975296,36.7820671]}},{"properties":{"latitude":43.7676229,"column_5":1,"date":{"end_time":"1998/08/16 00:00:00 -0400","original":"8/15/1998","granularity":"day","time":"1998/08/15 00:00:00 -0400"},"longitude":-103.5974693,"id":"advbt5w0sxvf","location":"Custer (town)"},"type":"Feature","geometry":{"type":"Point","coordinates":[-103.5974693,43.7676229]}},{"properties":{"latitude":42.0620384,"column_5":1,"date":{"end_time":"1998/08/16 00:00:00 -0400","original":"8/15/1998","granularity":"day","time":"1998/08/15 00:00:00 -0400"},"longitude":-104.1836929,"id":"advbt657hr0a","location":"Torrington area"},"type":"Feature","geometry":{"type":"Point","coordinates":[-104.1836929,42.0620384]}},{"properties":{"latitude":43.594,"column_5":1,"date":{"end_time":"1998/08/16 00:00:00 -0400","original":"8/15/1998","granularity":"day","time":"1998/08/15 00:00:00 -0400"},"longitude":-103.461,"id":"advbt5qqoxhm","location":"Wind Cave NP"},"type":"Feature","geometry":{"type":"Point","coordinates":[-103.461,43.594]}},{"properties":{"latitude":43.7537044,"column_5":1,"date":{"end_time":"1998/08/17 00:00:00 -0400","original":"8/16/1998","granularity":"day","time":"1998/08/16 00:00:00 -0400"},"longitude":-101.9366241,"id":"advbt5qwm3ay","location":"Badlands National Park"},"type":"Feature","geometry":{"type":"Point","coordinates":[-101.9366241,43.7537044]}},{"properties":{"latitude":41.1700291,"column_5":1,"date":{"end_time":"1999/03/09 00:00:00 -0500","original":"3/8/1999","granularity":"day","time":"1999/03/08 00:00:00 -0500"},"longitude":-104.0667486,"id":"advbt5x3dtar","location":"Pine Bluffs"},"type":"Feature","geometry":{"type":"Point","coordinates":[-104.0667486,41.1700291]}},{"properties":{"latitude":29.2947829,"column_5":1,"date":{"end_time":"2001/06/11 00:00:00 -0400","original":"6/10/2001","granularity":"day","time":"2001/06/10 00:00:00 -0400"},"longitude":-98.4948778,"id":"advbt5zrdgui","location":"Mitchell Lake (HOTE 103)"},"type":"Feature","geometry":{"type":"Point","coordinates":[-98.4948778,29.2947829]}},{"properties":{"latitude":30.20373,"column_5":1,"date":{"end_time":"2001/12/09 00:00:00 -0500","original":"12/8/2001","granularity":"day","time":"2001/12/08 00:00:00 -0500"},"longitude":-91.90114,"id":"advbt5qha2m7","location":"Lake Martin (Lake la Pointe)-Cypress Island Preserve"},"type":"Feature","geometry":{"type":"Point","coordinates":[-91.90114,30.20373]}},{"properties":{"latitude":29.90351,"column_5":1,"date":{"end_time":"2001/12/29 00:00:00 -0500","original":"12/28/2001","granularity":"day","time":"2001/12/28 00:00:00 -0500"},"longitude":-91.91042,"id":"advbt5rr9nrf","location":"Avery Island"},"type":"Feature","geometry":{"type":"Point","coordinates":[-91.91042,29.90351]}},{"properties":{"latitude":34.8389,"column_5":1,"date":{"end_time":"2002/04/11 00:00:00 -0400","original":"4/10/2002","granularity":"day","time":"2002/04/10 00:00:00 -0400"},"longitude":-92.4711,"id":"advbt5xl249b","location":"Pinnacle Mountain SP"},"type":"Feature","geometry":{"type":"Point","coordinates":[-92.4711,34.8389]}},{"properties":{"latitude":26.5326942,"column_5":1,"date":{"end_time":"2002/05/24 00:00:00 -0400","original":"5/23/2002","granularity":"day","time":"2002/05/23 00:00:00 -0400"},"longitude":-99.1487913,"id":"advbt5ty138p","location":"El Rio RV Park"},"type":"Feature","geometry":{"type":"Point","coordinates":[-99.1487913,26.5326942]}},{"properties":{"latitude":27.0443993,"column_5":1,"date":{"end_time":"2002/05/24 00:00:00 -0400","original":"5/23/2002","granularity":"day","time":"2002/05/23 00:00:00 -0400"},"longitude":-99.4403,"id":"advbt63iprw6","location":"San Ygnacio (LTC 087)"},"type":"Feature","geometry":{"type":"Point","coordinates":[-99.4403,27.0443993]}},{"properties":{"latitude":26.1384105,"column_5":1,"date":{"end_time":"2002/05/24 00:00:00 -0400","original":"5/23/2002","granularity":"day","time":"2002/05/23 00:00:00 -0400"},"longitude":-98.3327866,"id":"advbt5zx2xzh","location":"Anzalduas County Pk (LTC 068)"},"type":"Feature","geometry":{"type":"Point","coordinates":[-98.3327866,26.1384105]}},{"properties":{"latitude":34.3325366,"column_5":1,"date":{"end_time":"2003/03/23 00:00:00 -0500","original":"3/22/2003","granularity":"day","time":"2003/03/22 00:00:00 -0500"},"longitude":-116.8303299,"id":"advbt6591f1a","location":"Hwy 18 switchbacks"},"type":"Feature","geometry":{"type":"Point","coordinates":[-116.8303299,34.3325366]}},{"properties":{"latitude":34.2895592,"column_5":1,"date":{"end_time":"2003/03/23 00:00:00 -0500","original":"3/22/2003","granularity":"day","time":"2003/03/22 00:00:00 -0500"},"longitude":-116.8175411,"id":"advbt641d0vb","location":"Baldwin Lake Ecological Reserve"},"type":"Feature","geometry":{"type":"Point","coordinates":[-116.8175411,34.2895592]}},{"properties":{"latitude":34.8897981,"column_5":1,"date":{"end_time":"2003/05/04 00:00:00 -0400","original":"5/3/2003","granularity":"day","time":"2003/05/03 00:00:00 -0400"},"longitude":-117.022934,"id":"advbt5vcj2k7","location":"Barstow--Dana Park"},"type":"Feature","geometry":{"type":"Point","coordinates":[-117.022934,34.8897981]}},{"properties":{"latitude":33.2008517,"column_5":1,"date":{"end_time":"2003/05/12 00:00:00 -0400","original":"5/11/2003","granularity":"day","time":"2003/05/11 00:00:00 -0400"},"longitude":-115.5965236,"id":"advbt65l5quf","location":"Salton Sea--south end"},"type":"Feature","geometry":{"type":"Point","coordinates":[-115.5965236,33.2008517]}},{"properties":{"latitude":34.4243753,"column_5":1,"date":{"end_time":"2003/06/01 00:00:00 -0400","original":"5/31/2003","granularity":"day","time":"2003/05/31 00:00:00 -0400"},"longitude":-118.5971178,"id":"advbt6139x33","location":"Magic Mountain"},"type":"Feature","geometry":{"type":"Point","coordinates":[-118.5971178,34.4243753]}},{"properties":{"latitude":35.067482,"column_5":1,"date":{"end_time":"2003/07/20 00:00:00 -0400","original":"7/19/2003","granularity":"day","time":"2003/07/19 00:00:00 -0400"},"longitude":-115.43902,"id":"advbt5w4yo9l","location":"mojave national preserve"},"type":"Feature","geometry":{"type":"Point","coordinates":[-115.43902,35.067482]}},{"properties":{"latitude":38.6269421,"column_5":1,"date":{"end_time":"2003/07/26 00:00:00 -0400","original":"7/25/2003","granularity":"day","time":"2003/07/25 00:00:00 -0400"},"longitude":-121.2749183,"id":"advbt63iie6w","location":"American River Parkway--Lower Sunrise"},"type":"Feature","geometry":{"type":"Point","coordinates":[-121.2749183,38.6269421]}},{"properties":{"latitude":34.8850157,"column_5":1,"date":{"end_time":"2003/10/10 00:00:00 -0400","original":"10/9/2003","granularity":"day","time":"2003/10/09 00:00:00 -0400"},"longitude":-116.9822502,"id":"advbt64dl04h","location":"Barstow WTP"},"type":"Feature","geometry":{"type":"Point","coordinates":[-116.9822502,34.8850157]}},{"properties":{"latitude":34.093678,"column_5":1,"date":{"end_time":"2003/10/13 00:00:00 -0400","original":"10/12/2003","granularity":"day","time":"2003/10/12 00:00:00 -0400"},"longitude":-118.58496,"id":"advbt5zxa89x","location":"Topanga SP"},"type":"Feature","geometry":{"type":"Point","coordinates":[-118.58496,34.093678]}},{"properties":{"latitude":35.0371473,"column_5":1,"date":{"end_time":"2003/10/14 00:00:00 -0400","original":"10/13/2003","granularity":"day","time":"2003/10/13 00:00:00 -0400"},"longitude":-116.3848901,"id":"advbt5v2qudx","location":"Afton Canyon"},"type":"Feature","geometry":{"type":"Point","coordinates":[-116.3848901,35.0371473]}},{"properties":{"latitude":34.5008,"column_5":1,"date":{"end_time":"2003/12/22 00:00:00 -0500","original":"12/21/2003","granularity":"day","time":"2003/12/21 00:00:00 -0500"},"longitude":-117.18588,"id":"advbt61mx82h","location":"Apple Valley"},"type":"Feature","geometry":{"type":"Point","coordinates":[-117.18588,34.5008]}},{"properties":{"latitude":34.953617,"column_5":1,"date":{"end_time":"2003/12/29 00:00:00 -0500","original":"12/28/2003","granularity":"day","time":"2003/12/28 00:00:00 -0500"},"longitude":-104.64592,"id":"advbt5su0si3","location":"santa rosa lake state park"},"type":"Feature","geometry":{"type":"Point","coordinates":[-104.64592,34.953617]}},{"properties":{"latitude":35.504707,"column_5":1,"date":{"end_time":"2004/01/11 00:00:00 -0500","original":"1/10/2004","granularity":"day","time":"2004/01/10 00:00:00 -0500"},"longitude":-118.69142,"id":"advbt606l34w","location":"Kern River - 178"},"type":"Feature","geometry":{"type":"Point","coordinates":[-118.69142,35.504707]}},{"properties":{"latitude":34.4614022,"column_5":1,"date":{"end_time":"2004/02/29 00:00:00 -0500","original":"2/28/2004","granularity":"day","time":"2004/02/28 00:00:00 -0500"},"longitude":-117.2364501,"id":"advbt5qdxp4t","location":"Jess Ranch Lakes"},"type":"Feature","geometry":{"type":"Point","coordinates":[-117.2364501,34.4614022]}},{"properties":{"latitude":34.8709492,"column_5":1,"date":{"end_time":"2004/03/12 00:00:00 -0500","original":"3/11/2004","granularity":"day","time":"2004/03/11 00:00:00 -0500"},"longitude":-117.0247918,"id":"advbt5z4io4m","location":"Barstow College"},"type":"Feature","geometry":{"type":"Point","coordinates":[-117.0247918,34.8709492]}},{"properties":{"latitude":33.7521,"column_5":1,"date":{"end_time":"2004/03/15 00:00:00 -0500","original":"3/14/2004","granularity":"day","time":"2004/03/14 00:00:00 -0500"},"longitude":-116.05248,"id":"advbt63y0ygf","location":"Riverside"},"type":"Feature","geometry":{"type":"Point","coordinates":[-116.05248,33.7521]}},{"properties":{"latitude":34.6216991,"column_5":1,"date":{"end_time":"2004/04/04 00:00:00 -0500","original":"4/3/2004","granularity":"day","time":"2004/04/03 00:00:00 -0500"},"longitude":-116.9468229,"id":"advbt642wbcj","location":"Rocky Spring"},"type":"Feature","geometry":{"type":"Point","coordinates":[-116.9468229,34.6216991]}},{"properties":{"latitude":34.0481001,"column_5":1,"date":{"end_time":"2004/04/13 00:00:00 -0400","original":"4/12/2004","granularity":"day","time":"2004/04/12 00:00:00 -0400"},"longitude":-118.043672,"id":"advbt5skarc1","location":"Greater El Monte Community Hospital"},"type":"Feature","geometry":{"type":"Point","coordinates":[-118.043672,34.0481001]}},{"properties":{"latitude":34.0079889,"column_5":1,"date":{"end_time":"2004/04/29 00:00:00 -0400","original":"4/28/2004","granularity":"day","time":"2004/04/28 00:00:00 -0400"},"longitude":-118.4995651,"id":"advbt62efuth","location":"Santa Monica Pier"},"type":"Feature","geometry":{"type":"Point","coordinates":[-118.4995651,34.0079889]}},{"properties":{"latitude":32.627119,"column_5":1,"date":{"end_time":"2004/05/26 00:00:00 -0400","original":"5/25/2004","granularity":"day","time":"2004/05/25 00:00:00 -0400"},"longitude":-117.1197981,"id":"advbt5s5pofi","location":"San Diego Bay"},"type":"Feature","geometry":{"type":"Point","coordinates":[-117.1197981,32.627119]}},{"properties":{"latitude":33.458199,"column_5":1,"date":{"end_time":"2004/06/13 00:00:00 -0400","original":"6/12/2004","granularity":"day","time":"2004/06/12 00:00:00 -0400"},"longitude":-111.6495297,"id":"advbt60gb4nx","location":"Mesa outskirts"},"type":"Feature","geometry":{"type":"Point","coordinates":[-111.6495297,33.458199]}},{"properties":{"latitude":35.670127,"column_5":1,"date":{"end_time":"2004/06/27 00:00:00 -0400","original":"6/26/2004","granularity":"day","time":"2004/06/26 00:00:00 -0400"},"longitude":-118.305244,"id":"advbt5r5lh3q","location":"Kern River Preserve"},"type":"Feature","geometry":{"type":"Point","coordinates":[-118.305244,35.670127]}},{"properties":{"latitude":35.676,"column_5":1,"date":{"end_time":"2004/06/28 00:00:00 -0400","original":"6/27/2004","granularity":"day","time":"2004/06/27 00:00:00 -0400"},"longitude":-118.326,"id":"advbt5ssbtq3","location":"Kern River Preserve--Migrant Corner Trail"},"type":"Feature","geometry":{"type":"Point","coordinates":[-118.326,35.676]}},{"properties":{"latitude":35.6690115,"column_5":1,"date":{"end_time":"2004/06/28 00:00:00 -0400","original":"6/27/2004","granularity":"day","time":"2004/06/27 00:00:00 -0400"},"longitude":-118.3275604,"id":"advbt5qzmeei","location":"Prince Pond"},"type":"Feature","geometry":{"type":"Point","coordinates":[-118.3275604,35.6690115]}},{"properties":{"latitude":35.6909167,"column_5":1,"date":{"end_time":"2004/06/28 00:00:00 -0400","original":"6/27/2004","granularity":"day","time":"2004/06/27 00:00:00 -0400"},"longitude":-118.2196111,"id":"advbt5t6c2m2","location":"Scodie Park"},"type":"Feature","geometry":{"type":"Point","coordinates":[-118.2196111,35.6909167]}},{"properties":{"latitude":35.9758703,"column_5":1,"date":{"end_time":"2004/06/29 00:00:00 -0400","original":"6/28/2004","granularity":"day","time":"2004/06/28 00:00:00 -0400"},"longitude":-118.500638,"id":"advbt5vubwy3","location":"Sequoia NF--Mtn. 99 (mile 2.0-3.0)"},"type":"Feature","geometry":{"type":"Point","coordinates":[-118.500638,35.9758703]}},{"properties":{"latitude":35.9683857,"column_5":1,"date":{"end_time":"2004/06/29 00:00:00 -0400","original":"6/28/2004","granularity":"day","time":"2004/06/28 00:00:00 -0400"},"longitude":-118.4866261,"id":"advbt61n5w5c","location":"Sequoia NF--Mtn. 99 (mile 3.0-5.0)"},"type":"Feature","geometry":{"type":"Point","coordinates":[-118.4866261,35.9683857]}},{"properties":{"latitude":35.9769383,"column_5":1,"date":{"end_time":"2004/06/29 00:00:00 -0400","original":"6/28/2004","granularity":"day","time":"2004/06/28 00:00:00 -0400"},"longitude":-118.5962641,"id":"advbt5tcjcg1","location":"Sequoia NF--Trail of 100 Giants"},"type":"Feature","geometry":{"type":"Point","coordinates":[-118.5962641,35.9769383]}},{"properties":{"latitude":36.0193228,"column_5":1,"date":{"end_time":"2004/06/30 00:00:00 -0400","original":"6/29/2004","granularity":"day","time":"2004/06/29 00:00:00 -0400"},"longitude":-118.2530594,"id":"advbt5uvn7hw","location":"Sequoia NF--Bald Mtn./Lookout/FS 22S77"},"type":"Feature","geometry":{"type":"Point","coordinates":[-118.2530594,36.0193228]}},{"properties":{"latitude":35.8388291,"column_5":1,"date":{"end_time":"2004/06/30 00:00:00 -0400","original":"6/29/2004","granularity":"day","time":"2004/06/29 00:00:00 -0400"},"longitude":-118.0419159,"id":"advbt5rajp4w","location":"Chimney Creek Campground"},"type":"Feature","geometry":{"type":"Point","coordinates":[-118.0419159,35.8388291]}},{"properties":{"latitude":35.7068889,"column_5":1,"date":{"end_time":"2004/06/30 00:00:00 -0400","original":"6/29/2004","granularity":"day","time":"2004/06/29 00:00:00 -0400"},"longitude":-117.8482222,"id":"advbt5tm09fp","location":"Inyokern--Middlemiss"},"type":"Feature","geometry":{"type":"Point","coordinates":[-117.8482222,35.7068889]}},{"properties":{"latitude":36.0931526,"column_5":1,"date":{"end_time":"2004/06/30 00:00:00 -0400","original":"6/29/2004","granularity":"day","time":"2004/06/29 00:00:00 -0400"},"longitude":-118.2635415,"id":"advbt5pp28rg","location":"Blackrock Ranger Station"},"type":"Feature","geometry":{"type":"Point","coordinates":[-118.2635415,36.0931526]}},{"properties":{"latitude":36.0641111,"column_5":1,"date":{"end_time":"2004/06/30 00:00:00 -0400","original":"6/29/2004","granularity":"day","time":"2004/06/29 00:00:00 -0400"},"longitude":-118.2392778,"id":"advbt5z5vn4h","location":"Kern Plateau--Beach Meadows Rd. (FR 22S05)--Troy Meadow and Campground"},"type":"Feature","geometry":{"type":"Point","coordinates":[-118.2392778,36.0641111]}},{"properties":{"latitude":36.0058001,"column_5":1,"date":{"end_time":"2004/06/30 00:00:00 -0400","original":"6/29/2004","granularity":"day","time":"2004/06/29 00:00:00 -0400"},"longitude":-118.1169319,"id":"advbt64kyaac","location":"Kennedy Meadows"},"type":"Feature","geometry":{"type":"Point","coordinates":[-118.1169319,36.0058001]}},{"properties":{"latitude":35.1100111,"column_5":1,"date":{"end_time":"2004/07/03 00:00:00 -0400","original":"7/2/2004","granularity":"day","time":"2004/07/02 00:00:00 -0400"},"longitude":-118.5007063,"id":"advbt5w1rhoh","location":"Brite Valley Recreation Area"},"type":"Feature","geometry":{"type":"Point","coordinates":[-118.5007063,35.1100111]}},{"properties":{"latitude":35.1633062,"column_5":1,"date":{"end_time":"2004/07/03 00:00:00 -0400","original":"7/2/2004","granularity":"day","time":"2004/07/02 00:00:00 -0400"},"longitude":-118.4872981,"id":"advbt61q7a83","location":"Tehachapi Loop Road"},"type":"Feature","geometry":{"type":"Point","coordinates":[-118.4872981,35.1633062]}},{"properties":{"latitude":35.0715492,"column_5":1,"date":{"end_time":"2004/07/03 00:00:00 -0400","original":"7/2/2004","granularity":"day","time":"2004/07/02 00:00:00 -0400"},"longitude":-118.484298,"id":"advbt5y002h9","location":"Tehachapi Mountain Park"},"type":"Feature","geometry":{"type":"Point","coordinates":[-118.484298,35.0715492]}},{"properties":{"latitude":44.8513874,"column_5":1,"date":{"end_time":"2004/07/31 00:00:00 -0400","original":"7/30/2004","granularity":"day","time":"2004/07/30 00:00:00 -0400"},"longitude":-93.2085292,"id":"advbt63e6a3r","location":"Minnesota Valley NWR--Visitor Center"},"type":"Feature","geometry":{"type":"Point","coordinates":[-93.2085292,44.8513874]}},{"properties":{"latitude":40.5780264,"column_5":1,"date":{"end_time":"2004/08/02 00:00:00 -0400","original":"8/1/2004","granularity":"day","time":"2004/08/01 00:00:00 -0400"},"longitude":-74.4481013,"id":"advbt5y8djh9","location":"New Market Pond"},"type":"Feature","geometry":{"type":"Point","coordinates":[-74.4481013,40.5780264]}},{"properties":{"latitude":40.4392518,"column_5":1,"date":{"end_time":"2004/08/03 00:00:00 -0400","original":"8/2/2004","granularity":"day","time":"2004/08/02 00:00:00 -0400"},"longitude":-73.9869263,"id":"advbt5rpbhn6","location":"Sandy Hook"},"type":"Feature","geometry":{"type":"Point","coordinates":[-73.9869263,40.4392518]}},{"properties":{"latitude":39.4551493,"column_5":1,"date":{"end_time":"2004/08/04 00:00:00 -0400","original":"8/3/2004","granularity":"day","time":"2004/08/03 00:00:00 -0400"},"longitude":-74.4200134,"id":"advbt5qho8xa","location":"Edwin B. Forsythe NWR"},"type":"Feature","geometry":{"type":"Point","coordinates":[-74.4200134,39.4551493]}},{"properties":{"latitude":40.7138227,"column_5":1,"date":{"end_time":"2004/08/04 00:00:00 -0400","original":"8/3/2004","granularity":"day","time":"2004/08/03 00:00:00 -0400"},"longitude":-74.463013,"id":"advbt64z01v5","location":"Great Swamp NWR"},"type":"Feature","geometry":{"type":"Point","coordinates":[-74.463013,40.7138227]}},{"properties":{"latitude":39.0270763,"column_5":1,"date":{"end_time":"2004/08/05 00:00:00 -0400","original":"8/4/2004","granularity":"day","time":"2004/08/04 00:00:00 -0400"},"longitude":-74.7776286,"id":"advbt5q50r10","location":"Stone Harbor Point"},"type":"Feature","geometry":{"type":"Point","coordinates":[-74.7776286,39.0270763]}},{"properties":{"latitude":40.7438982,"column_5":1,"date":{"end_time":"2004/08/06 00:00:00 -0400","original":"8/5/2004","granularity":"day","time":"2004/08/05 00:00:00 -0400"},"longitude":-74.5516463,"id":"advbt5z3tapl","location":"Scherman-Hoffman Wildlife Sanctuary"},"type":"Feature","geometry":{"type":"Point","coordinates":[-74.5516463,40.7438982]}},{"properties":{"latitude":40.002445,"column_5":1,"date":{"end_time":"2004/08/07 00:00:00 -0400","original":"8/6/2004","granularity":"day","time":"2004/08/06 00:00:00 -0400"},"longitude":-75.045456,"id":"advbt5xredif","location":"Palmyra Cove Nature Park"},"type":"Feature","geometry":{"type":"Point","coordinates":[-75.045456,40.002445]}},{"properties":{"latitude":40.7833,"column_5":1,"date":{"end_time":"2004/08/09 00:00:00 -0400","original":"8/8/2004","granularity":"day","time":"2004/08/08 00:00:00 -0400"},"longitude":-74.1025167,"id":"advbt64wdr3m","location":"Richard W. DeKorte Park"},"type":"Feature","geometry":{"type":"Point","coordinates":[-74.1025167,40.7833]}},{"properties":{"latitude":33.4502094,"column_5":1,"date":{"end_time":"2004/08/14 00:00:00 -0400","original":"8/13/2004","granularity":"day","time":"2004/08/13 00:00:00 -0400"},"longitude":-112.4270172,"id":"advbt5uw0mcn","location":"Goodyear"},"type":"Feature","geometry":{"type":"Point","coordinates":[-112.4270172,33.4502094]}},{"properties":{"latitude":33.384,"column_5":1,"date":{"end_time":"2004/08/15 00:00:00 -0400","original":"8/14/2004","granularity":"day","time":"2004/08/14 00:00:00 -0400"},"longitude":-112.374,"id":"advbt5qwqwkk","location":"Estrella Mountain Regional Park"},"type":"Feature","geometry":{"type":"Point","coordinates":[-112.374,33.384]}},{"properties":{"latitude":36.0575541,"column_5":1,"date":{"end_time":"2004/10/04 00:00:00 -0400","original":"10/3/2004","granularity":"day","time":"2004/10/03 00:00:00 -0400"},"longitude":-112.1677308,"id":"advbt65hwqtg","location":"Grand Canyon NP--South Rim"},"type":"Feature","geometry":{"type":"Point","coordinates":[-112.1677308,36.0575541]}},{"properties":{"latitude":29.8155087,"column_5":1,"date":{"end_time":"2005/01/02 00:00:00 -0500","original":"1/1/2005","granularity":"day","time":"2005/01/01 00:00:00 -0500"},"longitude":-99.5762582,"id":"advbt63f0y0x","location":"Lost Maples SNA (HOTW 061)"},"type":"Feature","geometry":{"type":"Point","coordinates":[-99.5762582,29.8155087]}},{"properties":{"latitude":35.2847755,"column_5":1,"date":{"end_time":"2005/06/20 00:00:00 -0400","original":"6/19/2005","granularity":"day","time":"2005/06/19 00:00:00 -0400"},"longitude":-111.6430645,"id":"advbt5qb2i0u","location":"Weatherford Trail"},"type":"Feature","geometry":{"type":"Point","coordinates":[-111.6430645,35.2847755]}},{"properties":{"latitude":34.898061,"column_5":1,"date":{"end_time":"2005/07/24 00:00:00 -0400","original":"7/23/2005","granularity":"day","time":"2005/07/23 00:00:00 -0400"},"longitude":-111.4399148,"id":"advbt5zutjgc","location":"Mormon Lake Village"},"type":"Feature","geometry":{"type":"Point","coordinates":[-111.4399148,34.898061]}},{"properties":{"latitude":35.3283435,"column_5":1,"date":{"end_time":"2005/07/24 00:00:00 -0400","original":"7/23/2005","granularity":"day","time":"2005/07/23 00:00:00 -0400"},"longitude":-111.6875267,"id":"advbt5xff2qb","location":"Arizona Snowbowl"},"type":"Feature","geometry":{"type":"Point","coordinates":[-111.6875267,35.3283435]}},{"properties":{"latitude":35.2514297,"column_5":1,"date":{"end_time":"2005/07/24 00:00:00 -0400","original":"7/23/2005","granularity":"day","time":"2005/07/23 00:00:00 -0400"},"longitude":-111.6355463,"id":"advbt61hipa8","location":"Brookbank Trail"},"type":"Feature","geometry":{"type":"Point","coordinates":[-111.6355463,35.2514297]}},{"properties":{"latitude":35.1824847,"column_5":1,"date":{"end_time":"2005/07/25 00:00:00 -0400","original":"7/24/2005","granularity":"day","time":"2005/07/24 00:00:00 -0400"},"longitude":-111.6300346,"id":"advbt5s6xxl6","location":"Arizona Trail"},"type":"Feature","geometry":{"type":"Point","coordinates":[-111.6300346,35.1824847]}},{"properties":{"latitude":31.4679656,"column_5":1,"date":{"end_time":"2005/08/18 00:00:00 -0400","original":"8/17/2005","granularity":"day","time":"2005/08/17 00:00:00 -0400"},"longitude":-110.9918475,"id":"advbt5zcsm1r","location":"De Anza Trail--Rio Rico"},"type":"Feature","geometry":{"type":"Point","coordinates":[-110.9918475,31.4679656]}},{"properties":{"latitude":31.3904516,"column_5":1,"date":{"end_time":"2005/08/19 00:00:00 -0400","original":"8/18/2005","granularity":"day","time":"2005/08/18 00:00:00 -0400"},"longitude":-110.2392496,"id":"advbt601lbvc","location":"Ash Canyon B&amp;B"},"type":"Feature","geometry":{"type":"Point","coordinates":[-110.2392496,31.3904516]}},{"properties":{"latitude":31.5200639,"column_5":1,"date":{"end_time":"2005/08/19 00:00:00 -0400","original":"8/18/2005","granularity":"day","time":"2005/08/18 00:00:00 -0400"},"longitude":-110.3466807,"id":"advbt5zdd59c","location":"Fort Huachuca"},"type":"Feature","geometry":{"type":"Point","coordinates":[-110.3466807,31.5200639]}},{"properties":{"latitude":31.4156019,"column_5":1,"date":{"end_time":"2005/08/19 00:00:00 -0400","original":"8/18/2005","granularity":"day","time":"2005/08/18 00:00:00 -0400"},"longitude":-110.2765277,"id":"advbt5x7xtsl","location":"Miller Canyon--Beatty's Guest Ranch"},"type":"Feature","geometry":{"type":"Point","coordinates":[-110.2765277,31.4156019]}},{"properties":{"latitude":35.4045027,"column_5":1,"date":{"end_time":"2005/08/22 00:00:00 -0400","original":"8/21/2005","granularity":"day","time":"2005/08/21 00:00:00 -0400"},"longitude":-111.8437759,"id":"advbt602w6r7","location":"Kendrick Peak"},"type":"Feature","geometry":{"type":"Point","coordinates":[-111.8437759,35.4045027]}},{"properties":{"latitude":35.3097613,"column_5":1,"date":{"end_time":"2005/09/11 00:00:00 -0400","original":"9/10/2005","granularity":"day","time":"2005/09/10 00:00:00 -0400"},"longitude":-111.7625571,"id":"advbt5sgz94i","location":"La Roux Burn"},"type":"Feature","geometry":{"type":"Point","coordinates":[-111.7625571,35.3097613]}},{"properties":{"latitude":35.2620013,"column_5":1,"date":{"end_time":"2005/09/12 00:00:00 -0400","original":"9/11/2005","granularity":"day","time":"2005/09/11 00:00:00 -0400"},"longitude":-111.6113652,"id":"advbt5u5lxow","location":"Mt Elden"},"type":"Feature","geometry":{"type":"Point","coordinates":[-111.6113652,35.2620013]}},{"properties":{"latitude":44.56247,"column_5":1,"date":{"end_time":"2006/01/05 00:00:00 -0500","original":"1/4/2006","granularity":"day","time":"2006/01/04 00:00:00 -0500"},"longitude":-92.53379,"id":"advbt622b7hi","location":"Red Wing"},"type":"Feature","geometry":{"type":"Point","coordinates":[-92.53379,44.56247]}},{"properties":{"latitude":37.364487,"column_5":1,"date":{"end_time":"2006/02/12 00:00:00 -0500","original":"2/11/2006","granularity":"day","time":"2006/02/11 00:00:00 -0500"},"longitude":-108.530594,"id":"advbt61b11t3","location":"Totten Reservoir"},"type":"Feature","geometry":{"type":"Point","coordinates":[-108.530594,37.364487]}},{"properties":{"latitude":32.3382984,"column_5":1,"date":{"end_time":"2006/04/28 00:00:00 -0400","original":"4/27/2006","granularity":"day","time":"2006/04/27 00:00:00 -0400"},"longitude":-110.9804286,"id":"advbt5qdvrlg","location":"Tohono Chul Park"},"type":"Feature","geometry":{"type":"Point","coordinates":[-110.9804286,32.3382984]}},{"properties":{"latitude":32.6459059,"column_5":1,"date":{"end_time":"2006/04/28 00:00:00 -0400","original":"4/27/2006","granularity":"day","time":"2006/04/27 00:00:00 -0400"},"longitude":-111.4046129,"id":"advbt5qj6w49","location":"Picacho Peak SP"},"type":"Feature","geometry":{"type":"Point","coordinates":[-111.4046129,32.6459059]}},{"properties":{"latitude":31.921224,"column_5":1,"date":{"end_time":"2006/04/29 00:00:00 -0400","original":"4/28/2006","granularity":"day","time":"2006/04/28 00:00:00 -0400"},"longitude":-109.1282621,"id":"advbt5xnxihv","location":"Portal--Jasper's yard"},"type":"Feature","geometry":{"type":"Point","coordinates":[-109.1282621,31.921224]}},{"properties":{"latitude":19.4592476,"column_5":1,"date":{"end_time":"2006/10/11 00:00:00 -0400","original":"10/10/2006","granularity":"day","time":"2006/10/10 00:00:00 -0400"},"longitude":-96.9601013,"id":"advbt5q5yxng","location":"Coatepec Coffee Plantations"},"type":"Feature","geometry":{"type":"Point","coordinates":[-96.9601013,19.4592476]}},{"properties":{"latitude":33.1762668,"column_5":1,"date":{"end_time":"2006/11/20 00:00:00 -0500","original":"11/19/2006","granularity":"day","time":"2006/11/19 00:00:00 -0500"},"longitude":-115.5188142,"id":"advbt5w9leb6","location":"Sinclair Rd. at Hwy 111"},"type":"Feature","geometry":{"type":"Point","coordinates":[-115.5188142,33.1762668]}},{"properties":{"latitude":33.2324058,"column_5":1,"date":{"end_time":"2006/12/20 00:00:00 -0500","original":"12/19/2006","granularity":"day","time":"2006/12/19 00:00:00 -0500"},"longitude":-115.512743,"id":"advbt5vfk5qr","location":"Niland--International Rd."},"type":"Feature","geometry":{"type":"Point","coordinates":[-115.512743,33.2324058]}},{"properties":{"latitude":33.1255661,"column_5":1,"date":{"end_time":"2006/12/21 00:00:00 -0500","original":"12/20/2006","granularity":"day","time":"2006/12/20 00:00:00 -0500"},"longitude":-115.5406346,"id":"advbt60qg1m0","location":"Sperry Rd. at Eddins Rd."},"type":"Feature","geometry":{"type":"Point","coordinates":[-115.5406346,33.1255661]}},{"properties":{"latitude":35.1915215,"column_5":1,"date":{"end_time":"2007/01/06 00:00:00 -0500","original":"1/5/2007","granularity":"day","time":"2007/01/05 00:00:00 -0500"},"longitude":-111.5827703,"id":"advbt5za7bk6","location":"Mt Pleasant Ponds"},"type":"Feature","geometry":{"type":"Point","coordinates":[-111.5827703,35.1915215]}},{"properties":{"latitude":31.5614979,"column_5":1,"date":{"end_time":"2007/02/19 00:00:00 -0500","original":"2/18/2007","granularity":"day","time":"2007/02/18 00:00:00 -0500"},"longitude":-109.7200191,"id":"advbt64l96wy","location":"Whitewater Draw WA"},"type":"Feature","geometry":{"type":"Point","coordinates":[-109.7200191,31.5614979]}},{"properties":{"latitude":35.1833581,"column_5":1,"date":{"end_time":"2007/02/20 00:00:00 -0500","original":"2/19/2007","granularity":"day","time":"2007/02/19 00:00:00 -0500"},"longitude":-111.6746843,"id":"advbt5sog2az","location":"My yard"},"type":"Feature","geometry":{"type":"Point","coordinates":[-111.6746843,35.1833581]}},{"properties":{"latitude":34.9748037,"column_5":1,"date":{"end_time":"2007/03/19 00:00:00 -0400","original":"3/18/2007","granularity":"day","time":"2007/03/18 00:00:00 -0400"},"longitude":-111.754606,"id":"advbt64300bp","location":"Oak Creek Canyon"},"type":"Feature","geometry":{"type":"Point","coordinates":[-111.754606,34.9748037]}},{"properties":{"latitude":31.6732995,"column_5":1,"date":{"end_time":"2007/03/22 00:00:00 -0400","original":"3/21/2007","granularity":"day","time":"2007/03/21 00:00:00 -0400"},"longitude":-110.5629845,"id":"advbt61xv8rk","location":"Lower Elgin Road"},"type":"Feature","geometry":{"type":"Point","coordinates":[-110.5629845,31.6732995]}},{"properties":{"latitude":31.5599995,"column_5":1,"date":{"end_time":"2007/03/24 00:00:00 -0400","original":"3/23/2007","granularity":"day","time":"2007/03/23 00:00:00 -0400"},"longitude":-110.1994019,"id":"advbt6104iw7","location":"Sierra Vista EOP"},"type":"Feature","geometry":{"type":"Point","coordinates":[-110.1994019,31.5599995]}},{"properties":{"latitude":31.4384285,"column_5":1,"date":{"end_time":"2007/03/24 00:00:00 -0400","original":"3/23/2007","granularity":"day","time":"2007/03/23 00:00:00 -0400"},"longitude":-110.1076526,"id":"advbt5rpa4nx","location":"San Pedro RNCA--Hereford Bridge"},"type":"Feature","geometry":{"type":"Point","coordinates":[-110.1076526,31.4384285]}},{"properties":{"latitude":31.4177935,"column_5":1,"date":{"end_time":"2007/03/24 00:00:00 -0400","original":"3/23/2007","granularity":"day","time":"2007/03/23 00:00:00 -0400"},"longitude":-110.0970863,"id":"advbt5uv2ask","location":"San Pedro River Inn"},"type":"Feature","geometry":{"type":"Point","coordinates":[-110.0970863,31.4177935]}},{"properties":{"latitude":31.3902234,"column_5":1,"date":{"end_time":"2007/03/25 00:00:00 -0400","original":"3/24/2007","granularity":"day","time":"2007/03/24 00:00:00 -0400"},"longitude":-110.9572148,"id":"advbt61ze9f7","location":"Las Lagunas (Drive-in Ponds)"},"type":"Feature","geometry":{"type":"Point","coordinates":[-110.9572148,31.3902234]}},{"properties":{"latitude":31.6126807,"column_5":1,"date":{"end_time":"2007/03/25 00:00:00 -0400","original":"3/24/2007","granularity":"day","time":"2007/03/24 00:00:00 -0400"},"longitude":-111.0470892,"id":"advbt5xegvru","location":"Tubac"},"type":"Feature","geometry":{"type":"Point","coordinates":[-111.0470892,31.6126807]}},{"properties":{"latitude":32.2437113,"column_5":1,"date":{"end_time":"2007/03/25 00:00:00 -0400","original":"3/24/2007","granularity":"day","time":"2007/03/24 00:00:00 -0400"},"longitude":-111.168125,"id":"advbt5w7ookx","location":"Arizona-Sonora Desert Museum"},"type":"Feature","geometry":{"type":"Point","coordinates":[-111.168125,32.2437113]}},{"properties":{"latitude":34.829,"column_5":1,"date":{"end_time":"2007/05/13 00:00:00 -0400","original":"5/12/2007","granularity":"day","time":"2007/05/12 00:00:00 -0400"},"longitude":-111.8964,"id":"advbt5tzh7so","location":"Sedona Wetlands Preserve"},"type":"Feature","geometry":{"type":"Point","coordinates":[-111.8964,34.829]}},{"properties":{"latitude":34.7201334,"column_5":1,"date":{"end_time":"2007/05/13 00:00:00 -0400","original":"5/12/2007","granularity":"day","time":"2007/05/12 00:00:00 -0400"},"longitude":-111.9417572,"id":"advbt61hcsj1","location":"Cornville Grasslands"},"type":"Feature","geometry":{"type":"Point","coordinates":[-111.9417572,34.7201334]}},{"properties":{"latitude":34.423,"column_5":1,"date":{"end_time":"2007/07/20 00:00:00 -0400","original":"7/19/2007","granularity":"day","time":"2007/07/19 00:00:00 -0400"},"longitude":-111.573,"id":"advbt5rwatw5","location":"Tonto NF--Fossil Creek"},"type":"Feature","geometry":{"type":"Point","coordinates":[-111.573,34.423]}},{"properties":{"latitude":44.8587887,"column_5":1,"date":{"end_time":"2007/08/07 00:00:00 -0400","original":"8/6/2007","granularity":"day","time":"2007/08/06 00:00:00 -0400"},"longitude":-92.7773926,"id":"advbt5y7czmt","location":"Afton SP"},"type":"Feature","geometry":{"type":"Point","coordinates":[-92.7773926,44.8587887]}},{"properties":{"latitude":44.7681259,"column_5":1,"date":{"end_time":"2007/08/08 00:00:00 -0400","original":"8/7/2007","granularity":"day","time":"2007/08/07 00:00:00 -0400"},"longitude":-93.6164331,"id":"advbt61hoh87","location":"Minnesota Valley NWR - Chaska Unit"},"type":"Feature","geometry":{"type":"Point","coordinates":[-93.6164331,44.7681259]}},{"properties":{"latitude":44.7942314,"column_5":1,"date":{"end_time":"2007/08/08 00:00:00 -0400","original":"8/7/2007","granularity":"day","time":"2007/08/07 00:00:00 -0400"},"longitude":-93.4103537,"id":"advbt5tcokkp","location":"Minnesota Valley NWR--Wilkie Unit"},"type":"Feature","geometry":{"type":"Point","coordinates":[-93.4103537,44.7942314]}},{"properties":{"latitude":44.8597018,"column_5":1,"date":{"end_time":"2007/08/08 00:00:00 -0400","original":"8/7/2007","granularity":"day","time":"2007/08/07 00:00:00 -0400"},"longitude":-93.2141876,"id":"advbt5tzy3hj","location":"Minnesota Valley NWR--Headquarters"},"type":"Feature","geometry":{"type":"Point","coordinates":[-93.2141876,44.8597018]}},{"properties":{"latitude":34.4176949,"column_5":1,"date":{"end_time":"2007/08/17 00:00:00 -0400","original":"8/16/2007","granularity":"day","time":"2007/08/16 00:00:00 -0400"},"longitude":-119.8297906,"id":"advbt5w8ghof","location":"Goleta Beach"},"type":"Feature","geometry":{"type":"Point","coordinates":[-119.8297906,34.4176949]}},{"properties":{"latitude":36.1369043,"column_5":1,"date":{"end_time":"2007/09/02 00:00:00 -0400","original":"9/1/2007","granularity":"day","time":"2007/09/01 00:00:00 -0400"},"longitude":-111.2353706,"id":"advbt62agf7h","location":"Tuba CIty"},"type":"Feature","geometry":{"type":"Point","coordinates":[-111.2353706,36.1369043]}},{"properties":{"latitude":34.8874,"column_5":1,"date":{"end_time":"2007/09/04 00:00:00 -0400","original":"9/3/2007","granularity":"day","time":"2007/09/03 00:00:00 -0400"},"longitude":-111.7315,"id":"advbt60tak3g","location":"Oak Creek Canyon--Grasshopper Point"},"type":"Feature","geometry":{"type":"Point","coordinates":[-111.7315,34.8874]}},{"properties":{"latitude":35.244848,"column_5":1,"date":{"end_time":"2007/09/04 00:00:00 -0400","original":"9/3/2007","granularity":"day","time":"2007/09/03 00:00:00 -0400"},"longitude":-111.4890862,"id":"advbt5t9ho84","location":"Rio de Flag--Logan's Crossing/East Rio"},"type":"Feature","geometry":{"type":"Point","coordinates":[-111.4890862,35.244848]}},{"properties":{"latitude":34.8866363,"column_5":1,"date":{"end_time":"2007/09/04 00:00:00 -0400","original":"9/3/2007","granularity":"day","time":"2007/09/03 00:00:00 -0400"},"longitude":-111.6819808,"id":"advbt5spbwfk","location":"Schnebly Hill Rd"},"type":"Feature","geometry":{"type":"Point","coordinates":[-111.6819808,34.8866363]}},{"properties":{"latitude":35.3095571,"column_5":1,"date":{"end_time":"2007/09/04 00:00:00 -0400","original":"9/3/2007","granularity":"day","time":"2007/09/03 00:00:00 -0400"},"longitude":-111.7194986,"id":"advbt5pli5zh","location":"Lamar Haines WA"},"type":"Feature","geometry":{"type":"Point","coordinates":[-111.7194986,35.3095571]}},{"properties":{"latitude":35.3403178,"column_5":1,"date":{"end_time":"2007/09/04 00:00:00 -0400","original":"9/3/2007","granularity":"day","time":"2007/09/03 00:00:00 -0400"},"longitude":-111.7063679,"id":"advbt61v3bhs","location":"Humphrey's Trail"},"type":"Feature","geometry":{"type":"Point","coordinates":[-111.7063679,35.3403178]}},{"properties":{"latitude":35.3294114,"column_5":1,"date":{"end_time":"2007/10/01 00:00:00 -0400","original":"9/30/2007","granularity":"day","time":"2007/09/30 00:00:00 -0400"},"longitude":-111.538868,"id":"advbt60g7gcl","location":"Cinder Hills"},"type":"Feature","geometry":{"type":"Point","coordinates":[-111.538868,35.3294114]}},{"properties":{"latitude":35.2442171,"column_5":1,"date":{"end_time":"2007/10/01 00:00:00 -0400","original":"9/30/2007","granularity":"day","time":"2007/09/30 00:00:00 -0400"},"longitude":-111.5517426,"id":"advbt5sh7wu7","location":"Townsend-Winona Rd"},"type":"Feature","geometry":{"type":"Point","coordinates":[-111.5517426,35.2442171]}},{"properties":{"latitude":34.8995182,"column_5":1,"date":{"end_time":"2007/10/05 00:00:00 -0400","original":"10/4/2007","granularity":"day","time":"2007/10/04 00:00:00 -0400"},"longitude":-111.7321157,"id":"advbt634ppoz","location":"Encinosa Picnic Area"},"type":"Feature","geometry":{"type":"Point","coordinates":[-111.7321157,34.8995182]}},{"properties":{"latitude":34.0187319,"column_5":1,"date":{"end_time":"2007/10/07 00:00:00 -0400","original":"10/6/2007","granularity":"day","time":"2007/10/06 00:00:00 -0400"},"longitude":-119.6821404,"id":"advbt5vr79g3","location":"Santa Cruz Island--Prisoners Harbor"},"type":"Feature","geometry":{"type":"Point","coordinates":[-119.6821404,34.0187319]}},{"properties":{"latitude":35.2214321,"column_5":1,"date":{"end_time":"2007/10/14 00:00:00 -0400","original":"10/13/2007","granularity":"day","time":"2007/10/13 00:00:00 -0400"},"longitude":-111.6319621,"id":"advbt60h56mh","location":"Buffalo Park"},"type":"Feature","geometry":{"type":"Point","coordinates":[-111.6319621,35.2214321]}},{"properties":{"latitude":35.7458,"column_5":1,"date":{"end_time":"2007/11/05 00:00:00 -0500","original":"11/4/2007","granularity":"day","time":"2007/11/04 00:00:00 -0400"},"longitude":-111.4737,"id":"advbt5x6oovf","location":"Gray Mountain"},"type":"Feature","geometry":{"type":"Point","coordinates":[-111.4737,35.7458]}},{"properties":{"latitude":33.5740415,"column_5":1,"date":{"end_time":"2007/11/19 00:00:00 -0500","original":"11/18/2007","granularity":"day","time":"2007/11/18 00:00:00 -0500"},"longitude":-111.5377575,"id":"advbt60yvwy0","location":"Saguaro Lake"},"type":"Feature","geometry":{"type":"Point","coordinates":[-111.5377575,33.5740415]}},{"properties":{"latitude":33.5758784,"column_5":1,"date":{"end_time":"2007/11/19 00:00:00 -0500","original":"11/18/2007","granularity":"day","time":"2007/11/18 00:00:00 -0500"},"longitude":-111.5154147,"id":"advbt5x83i4e","location":"Saguaro Lake--Butcher Jones Beach"},"type":"Feature","geometry":{"type":"Point","coordinates":[-111.5154147,33.5758784]}},{"properties":{"latitude":34.9956913,"column_5":1,"date":{"end_time":"2007/12/09 00:00:00 -0500","original":"12/8/2007","granularity":"day","time":"2007/12/08 00:00:00 -0500"},"longitude":-111.7520285,"id":"advbt5xf0dal","location":"Oak Creek Canyon--West Fork"},"type":"Feature","geometry":{"type":"Point","coordinates":[-111.7520285,34.9956913]}},{"properties":{"latitude":34.7830735,"column_5":1,"date":{"end_time":"2007/12/17 00:00:00 -0500","original":"12/16/2007","granularity":"day","time":"2007/12/16 00:00:00 -0500"},"longitude":-112.0389175,"id":"advbt63egx4e","location":"Peck's Lake"},"type":"Feature","geometry":{"type":"Point","coordinates":[-112.0389175,34.7830735]}},{"properties":{"latitude":35.1788596,"column_5":1,"date":{"end_time":"2007/12/30 00:00:00 -0500","original":"12/29/2007","granularity":"day","time":"2007/12/29 00:00:00 -0500"},"longitude":-111.6567993,"id":"advbt60rkniu","location":"Flagstaff CBC--SW Section"},"type":"Feature","geometry":{"type":"Point","coordinates":[-111.6567993,35.1788596]}},{"properties":{"latitude":32.6767071,"column_5":1,"date":{"end_time":"2008/01/24 00:00:00 -0500","original":"1/23/2008","granularity":"day","time":"2008/01/23 00:00:00 -0500"},"longitude":-111.5850217,"id":"advbt63io0g3","location":"Santa Cruz Flats Travel Count"},"type":"Feature","geometry":{"type":"Point","coordinates":[-111.5850217,32.6767071]}},{"properties":{"latitude":32.2265432,"column_5":1,"date":{"end_time":"2008/01/24 00:00:00 -0500","original":"1/23/2008","granularity":"day","time":"2008/01/23 00:00:00 -0500"},"longitude":-110.9826422,"id":"advbt5rfa86j","location":"Santa Cruz River Park--Speedway to Congress"},"type":"Feature","geometry":{"type":"Point","coordinates":[-110.9826422,32.2265432]}},{"properties":{"latitude":34.7497935,"column_5":1,"date":{"end_time":"2008/02/04 00:00:00 -0500","original":"2/3/2008","granularity":"day","time":"2008/02/03 00:00:00 -0500"},"longitude":-112.0269012,"id":"advbt5ucwqpu","location":"Cottonwood Jail Trail"},"type":"Feature","geometry":{"type":"Point","coordinates":[-112.0269012,34.7497935]}},{"properties":{"latitude":34.8297157,"column_5":1,"date":{"end_time":"2008/02/18 00:00:00 -0500","original":"2/17/2008","granularity":"day","time":"2008/02/17 00:00:00 -0500"},"longitude":-111.8981802,"id":"advbt5xmjdcf","location":"Sedona WTP (closed access)"},"type":"Feature","geometry":{"type":"Point","coordinates":[-111.8981802,34.8297157]}},{"properties":{"latitude":34.8703579,"column_5":1,"date":{"end_time":"2008/02/18 00:00:00 -0500","original":"2/17/2008","granularity":"day","time":"2008/02/17 00:00:00 -0500"},"longitude":-111.7595422,"id":"advbt61ggdbb","location":"Sedona"},"type":"Feature","geometry":{"type":"Point","coordinates":[-111.7595422,34.8703579]}},{"properties":{"latitude":34.8622428,"column_5":1,"date":{"end_time":"2008/02/18 00:00:00 -0500","original":"2/17/2008","granularity":"day","time":"2008/02/17 00:00:00 -0500"},"longitude":-111.8179444,"id":"advbt5q385nz","location":"Sedona Public Library"},"type":"Feature","geometry":{"type":"Point","coordinates":[-111.8179444,34.8622428]}},{"properties":{"latitude":34.884623,"column_5":1,"date":{"end_time":"2008/02/18 00:00:00 -0500","original":"2/17/2008","granularity":"day","time":"2008/02/17 00:00:00 -0500"},"longitude":-111.7380969,"id":"advbt5zp8wgt","location":"Oak Creek Canyon--low elevation"},"type":"Feature","geometry":{"type":"Point","coordinates":[-111.7380969,34.884623]}},{"properties":{"latitude":34.751972,"column_5":1,"date":{"end_time":"2008/03/10 00:00:00 -0400","original":"3/9/2008","granularity":"day","time":"2008/03/09 00:00:00 -0500"},"longitude":-112.0131749,"id":"advbt5pm8alc","location":"Dead Horse Ranch SP"},"type":"Feature","geometry":{"type":"Point","coordinates":[-112.0131749,34.751972]}},{"properties":{"latitude":36.8171698,"column_5":1,"date":{"end_time":"2008/03/18 00:00:00 -0400","original":"3/17/2008","granularity":"day","time":"2008/03/17 00:00:00 -0400"},"longitude":-111.6301489,"id":"advbt5sjc00t","location":"Glen Canyon NRA--Navajo Bridge"},"type":"Feature","geometry":{"type":"Point","coordinates":[-111.6301489,36.8171698]}},{"properties":{"latitude":36.6437567,"column_5":1,"date":{"end_time":"2008/03/20 00:00:00 -0400","original":"3/19/2008","granularity":"day","time":"2008/03/19 00:00:00 -0400"},"longitude":-113.0739069,"id":"advbt5wr9lib","location":"Arizona Strip - Clayhole Valley"},"type":"Feature","geometry":{"type":"Point","coordinates":[-113.0739069,36.6437567]}},{"properties":{"latitude":36.2208447,"column_5":1,"date":{"end_time":"2008/03/20 00:00:00 -0400","original":"3/19/2008","granularity":"day","time":"2008/03/19 00:00:00 -0400"},"longitude":-113.0598307,"id":"advbt5qor65n","location":"Toroweap Overlook"},"type":"Feature","geometry":{"type":"Point","coordinates":[-113.0598307,36.2208447]}},{"properties":{"latitude":35.1488631,"column_5":1,"date":{"end_time":"2008/03/23 00:00:00 -0400","original":"3/22/2008","granularity":"day","time":"2008/03/22 00:00:00 -0400"},"longitude":-112.1787357,"id":"advbt5y8otgy","location":"Coleman Lake"},"type":"Feature","geometry":{"type":"Point","coordinates":[-112.1787357,35.1488631]}},{"properties":{"latitude":35.1985004,"column_5":1,"date":{"end_time":"2008/03/23 00:00:00 -0400","original":"3/22/2008","granularity":"day","time":"2008/03/22 00:00:00 -0400"},"longitude":-112.0097351,"id":"advbt5pn81uc","location":"Scholz Lake"},"type":"Feature","geometry":{"type":"Point","coordinates":[-112.0097351,35.1985004]}},{"properties":{"latitude":35.2101424,"column_5":1,"date":{"end_time":"2008/03/23 00:00:00 -0400","original":"3/22/2008","granularity":"day","time":"2008/03/22 00:00:00 -0400"},"longitude":-112.1259499,"id":"advbt61sb60o","location":"Dogtown Reservoir"},"type":"Feature","geometry":{"type":"Point","coordinates":[-112.1259499,35.2101424]}},{"properties":{"latitude":35.506518,"column_5":1,"date":{"end_time":"2008/03/23 00:00:00 -0400","original":"3/22/2008","granularity":"day","time":"2008/03/22 00:00:00 -0400"},"longitude":-113.0369568,"id":"advbt5yfvloe","location":"Aubrey Valley"},"type":"Feature","geometry":{"type":"Point","coordinates":[-113.0369568,35.506518]}},{"properties":{"latitude":35.3013969,"column_5":1,"date":{"end_time":"2008/04/02 00:00:00 -0400","original":"4/1/2008","granularity":"day","time":"2008/04/01 00:00:00 -0400"},"longitude":-111.7199707,"id":"advbt63lti39","location":"Snow Bowl Road"},"type":"Feature","geometry":{"type":"Point","coordinates":[-111.7199707,35.3013969]}},{"properties":{"latitude":35.1182987,"column_5":1,"date":{"end_time":"2008/04/17 00:00:00 -0400","original":"4/16/2008","granularity":"day","time":"2008/04/16 00:00:00 -0400"},"longitude":-111.5342705,"id":"advbt5w6xbt6","location":"Coconino NF--Marshall Lake"},"type":"Feature","geometry":{"type":"Point","coordinates":[-111.5342705,35.1182987]}},{"properties":{"latitude":35.1513544,"column_5":1,"date":{"end_time":"2008/04/19 00:00:00 -0400","original":"4/18/2008","granularity":"day","time":"2008/04/18 00:00:00 -0400"},"longitude":-111.7879486,"id":"advbt6255jeu","location":"Roger's Lake"},"type":"Feature","geometry":{"type":"Point","coordinates":[-111.7879486,35.1513544]}},{"properties":{"latitude":34.6958966,"column_5":1,"date":{"end_time":"2008/04/24 00:00:00 -0400","original":"4/23/2008","granularity":"day","time":"2008/04/23 00:00:00 -0400"},"longitude":-112.1290398,"id":"advbt65p0kw9","location":"Mingus Mountain"},"type":"Feature","geometry":{"type":"Point","coordinates":[-112.1290398,34.6958966]}},{"properties":{"latitude":35.2289344,"column_5":1,"date":{"end_time":"2008/04/29 00:00:00 -0400","original":"4/28/2008","granularity":"day","time":"2008/04/28 00:00:00 -0400"},"longitude":-111.5534592,"id":"advbt5u48dmx","location":"Rio de Flag--Picture Canyon"},"type":"Feature","geometry":{"type":"Point","coordinates":[-111.5534592,35.2289344]}},{"properties":{"latitude":44.3403019,"column_5":1,"date":{"end_time":"2008/05/15 00:00:00 -0400","original":"5/14/2008","granularity":"day","time":"2008/05/14 00:00:00 -0400"},"longitude":-68.0582428,"id":"advbt5th8fwd","location":"Acadia NP--Schoodic Peninsula"},"type":"Feature","geometry":{"type":"Point","coordinates":[-68.0582428,44.3403019]}},{"properties":{"latitude":44.2415712,"column_5":1,"date":{"end_time":"2008/06/26 00:00:00 -0400","original":"6/25/2008","granularity":"day","time":"2008/06/25 00:00:00 -0400"},"longitude":-68.3114004,"id":"advbt5x646hi","location":"Seawall area"},"type":"Feature","geometry":{"type":"Point","coordinates":[-68.3114004,44.2415712]}},{"properties":{"latitude":44.2338231,"column_5":1,"date":{"end_time":"2008/06/27 00:00:00 -0400","original":"6/26/2008","granularity":"day","time":"2008/06/26 00:00:00 -0400"},"longitude":-68.323288,"id":"advbt64un9dx","location":"Ship Harbor/Big Heath"},"type":"Feature","geometry":{"type":"Point","coordinates":[-68.323288,44.2338231]}},{"properties":{"latitude":44.367175,"column_5":1,"date":{"end_time":"2008/07/31 00:00:00 -0400","original":"7/30/2008","granularity":"day","time":"2008/07/30 00:00:00 -0400"},"longitude":-67.864624,"id":"advbt60yxbwi","location":"Petit Manan NWR--Petit Manan Island"},"type":"Feature","geometry":{"type":"Point","coordinates":[-67.864624,44.367175]}},{"properties":{"latitude":44.8560167,"column_5":1,"date":{"end_time":"2008/08/02 00:00:00 -0400","original":"8/1/2008","granularity":"day","time":"2008/08/01 00:00:00 -0400"},"longitude":-68.7408667,"id":"advbt5qx46dx","location":"Bangor City Forest"},"type":"Feature","geometry":{"type":"Point","coordinates":[-68.7408667,44.8560167]}},{"properties":{"latitude":44.8668876,"column_5":1,"date":{"end_time":"2008/08/02 00:00:00 -0400","original":"8/1/2008","granularity":"day","time":"2008/08/01 00:00:00 -0400"},"longitude":-68.7271266,"id":"advbt5vqgxj2","location":"Orono Bog"},"type":"Feature","geometry":{"type":"Point","coordinates":[-68.7271266,44.8668876]}},{"properties":{"latitude":44.4542139,"column_5":1,"date":{"end_time":"2008/08/03 00:00:00 -0400","original":"8/2/2008","granularity":"day","time":"2008/08/02 00:00:00 -0400"},"longitude":-67.5707294,"id":"advbt5rwoztk","location":"Great Wass Island TNC"},"type":"Feature","geometry":{"type":"Point","coordinates":[-67.5707294,44.4542139]}},{"properties":{"latitude":44.813908,"column_5":1,"date":{"end_time":"2008/08/03 00:00:00 -0400","original":"8/2/2008","granularity":"day","time":"2008/08/02 00:00:00 -0400"},"longitude":-66.9525743,"id":"advbt5zp1d5u","location":"West Quoddy Head SP"},"type":"Feature","geometry":{"type":"Point","coordinates":[-66.9525743,44.813908]}},{"properties":{"latitude":45.9754792,"column_5":1,"date":{"end_time":"2008/08/05 00:00:00 -0400","original":"8/4/2008","granularity":"day","time":"2008/08/04 00:00:00 -0400"},"longitude":-68.9351746,"id":"advbt5puw9ue","location":"Baxter State Park"},"type":"Feature","geometry":{"type":"Point","coordinates":[-68.9351746,45.9754792]}},{"properties":{"latitude":23.1308886,"column_5":1,"date":{"end_time":"2008/08/19 00:00:00 -0400","original":"8/18/2008","granularity":"day","time":"2008/08/18 00:00:00 -0400"},"longitude":-106.3146973,"id":"advbt61sqaj5","location":"Isla de La Piedra Road"},"type":"Feature","geometry":{"type":"Point","coordinates":[-106.3146973,23.1308886]}},{"properties":{"latitude":23.567134,"column_5":1,"date":{"end_time":"2008/08/20 00:00:00 -0400","original":"8/19/2008","granularity":"day","time":"2008/08/19 00:00:00 -0400"},"longitude":-105.8558464,"id":"advbt62zxuqu","location":"Road above Barranca Rancho Libre"},"type":"Feature","geometry":{"type":"Point","coordinates":[-105.8558464,23.567134]}},{"properties":{"latitude":23.4090663,"column_5":1,"date":{"end_time":"2008/08/21 00:00:00 -0400","original":"8/20/2008","granularity":"day","time":"2008/08/20 00:00:00 -0400"},"longitude":-105.892067,"id":"advbt5rdmkpl","location":"Panuco Road"},"type":"Feature","geometry":{"type":"Point","coordinates":[-105.892067,23.4090663]}},{"properties":{"latitude":23.4766304,"column_5":1,"date":{"end_time":"2008/08/21 00:00:00 -0400","original":"8/20/2008","granularity":"day","time":"2008/08/20 00:00:00 -0400"},"longitude":-105.8348179,"id":"advbt5tb3odp","location":"Mirador Loberas"},"type":"Feature","geometry":{"type":"Point","coordinates":[-105.8348179,23.4766304]}},{"properties":{"latitude":23.7218686,"column_5":1,"date":{"end_time":"2008/08/22 00:00:00 -0400","original":"8/21/2008","granularity":"day","time":"2008/08/21 00:00:00 -0400"},"longitude":-105.7241821,"id":"advbt5za2z39","location":"Road to Neveros at KM 149.5"},"type":"Feature","geometry":{"type":"Point","coordinates":[-105.7241821,23.7218686]}},{"properties":{"latitude":23.5488022,"column_5":1,"date":{"end_time":"2008/08/23 00:00:00 -0400","original":"8/22/2008","granularity":"day","time":"2008/08/22 00:00:00 -0400"},"longitude":-105.8436584,"id":"advbt5yatvpz","location":"KM point 206"},"type":"Feature","geometry":{"type":"Point","coordinates":[-105.8436584,23.5488022]}},{"properties":{"latitude":23.3982749,"column_5":1,"date":{"end_time":"2008/08/24 00:00:00 -0400","original":"8/23/2008","granularity":"day","time":"2008/08/23 00:00:00 -0400"},"longitude":-105.9283733,"id":"advbt5t0ni13","location":"La Guasirra Rd"},"type":"Feature","geometry":{"type":"Point","coordinates":[-105.9283733,23.3982749]}},{"properties":{"latitude":23.47789,"column_5":1,"date":{"end_time":"2008/08/24 00:00:00 -0400","original":"8/23/2008","granularity":"day","time":"2008/08/23 00:00:00 -0400"},"longitude":-106.3209629,"id":"advbt5wrg5e0","location":"Los Ebanos Road"},"type":"Feature","geometry":{"type":"Point","coordinates":[-106.3209629,23.47789]}},{"properties":{"latitude":24.151766,"column_5":1,"date":{"end_time":"2008/08/24 00:00:00 -0400","original":"8/23/2008","granularity":"day","time":"2008/08/23 00:00:00 -0400"},"longitude":-106.9766235,"id":"advbt5qg5ddn","location":"Km 139"},"type":"Feature","geometry":{"type":"Point","coordinates":[-106.9766235,24.151766]}},{"properties":{"latitude":33.078397,"column_5":1,"date":{"end_time":"2008/08/29 00:00:00 -0400","original":"8/28/2008","granularity":"day","time":"2008/08/28 00:00:00 -0400"},"longitude":-113.021824,"id":"advbt62i4eg9","location":"Painted Rock Dam"},"type":"Feature","geometry":{"type":"Point","coordinates":[-113.021824,33.078397]}},{"properties":{"latitude":34.4307706,"column_5":1,"date":{"end_time":"2008/09/02 00:00:00 -0400","original":"9/1/2008","granularity":"day","time":"2008/09/01 00:00:00 -0400"},"longitude":-119.8139334,"id":"advbt5s8az01","location":"S. Patterson Ag at Ekwill Drive"},"type":"Feature","geometry":{"type":"Point","coordinates":[-119.8139334,34.4307706]}},{"properties":{"latitude":34.3864773,"column_5":1,"date":{"end_time":"2008/09/06 00:00:00 -0400","original":"9/5/2008","granularity":"day","time":"2008/09/05 00:00:00 -0400"},"longitude":-119.5013809,"id":"advbt5spcbmk","location":"Carpinteria Bluffs Open Space"},"type":"Feature","geometry":{"type":"Point","coordinates":[-119.5013809,34.3864773]}},{"properties":{"latitude":37.1939632,"column_5":1,"date":{"end_time":"2008/09/21 00:00:00 -0400","original":"9/20/2008","granularity":"day","time":"2008/09/20 00:00:00 -0400"},"longitude":-122.0382786,"id":"advbt64pcdoq","location":"Skyline Blvd.--Bear Creek Rd. to Black Rd. (SCL Co.)"},"type":"Feature","geometry":{"type":"Point","coordinates":[-122.0382786,37.1939632]}},{"properties":{"latitude":33.9059798,"column_5":1,"date":{"end_time":"2008/09/28 00:00:00 -0400","original":"9/27/2008","granularity":"day","time":"2008/09/27 00:00:00 -0400"},"longitude":-111.4079265,"id":"advbt653dl82","location":"Mt. Ord (Gila Co.)"},"type":"Feature","geometry":{"type":"Point","coordinates":[-111.4079265,33.9059798]}},{"properties":{"latitude":34.2438785,"column_5":1,"date":{"end_time":"2008/09/29 00:00:00 -0400","original":"9/28/2008","granularity":"day","time":"2008/09/28 00:00:00 -0400"},"longitude":-110.7991362,"id":"advbt5t5vja7","location":"FR 188, Valentine Ridge"},"type":"Feature","geometry":{"type":"Point","coordinates":[-110.7991362,34.2438785]}},{"properties":{"latitude":34.4273017,"column_5":1,"date":{"end_time":"2008/09/30 00:00:00 -0400","original":"9/29/2008","granularity":"day","time":"2008/09/29 00:00:00 -0400"},"longitude":-111.0815191,"id":"advbt5umdh1h","location":"Ohaco 2"},"type":"Feature","geometry":{"type":"Point","coordinates":[-111.0815191,34.4273017]}},{"properties":{"latitude":34.4198323,"column_5":1,"date":{"end_time":"2008/09/30 00:00:00 -0400","original":"9/29/2008","granularity":"day","time":"2008/09/29 00:00:00 -0400"},"longitude":-111.1745811,"id":"advbt5ttvyhy","location":"E3"},"type":"Feature","geometry":{"type":"Point","coordinates":[-111.1745811,34.4198323]}},{"properties":{"latitude":34.0042178,"column_5":1,"date":{"end_time":"2008/10/01 00:00:00 -0400","original":"9/30/2008","granularity":"day","time":"2008/09/30 00:00:00 -0400"},"longitude":-109.5097876,"id":"advbt61r1epz","location":"White Mountain Reservoir"},"type":"Feature","geometry":{"type":"Point","coordinates":[-109.5097876,34.0042178]}},{"properties":{"latitude":34.1868849,"column_5":1,"date":{"end_time":"2008/10/01 00:00:00 -0400","original":"9/30/2008","granularity":"day","time":"2008/09/30 00:00:00 -0400"},"longitude":-109.9833155,"id":"advbt5u56ws8","location":"Jacques Marsh"},"type":"Feature","geometry":{"type":"Point","coordinates":[-109.9833155,34.1868849]}},{"properties":{"latitude":34.1278366,"column_5":1,"date":{"end_time":"2008/10/01 00:00:00 -0400","original":"9/30/2008","granularity":"day","time":"2008/09/30 00:00:00 -0400"},"longitude":-109.9526954,"id":"advbt626618f","location":"Pinetop--Woodland Lake Park"},"type":"Feature","geometry":{"type":"Point","coordinates":[-109.9526954,34.1278366]}},{"properties":{"latitude":34.3052296,"column_5":1,"date":{"end_time":"2008/10/01 00:00:00 -0400","original":"9/30/2008","granularity":"day","time":"2008/09/30 00:00:00 -0400"},"longitude":-110.027647,"id":"advbt5xxfxnu","location":"Pintail Lake"},"type":"Feature","geometry":{"type":"Point","coordinates":[-110.027647,34.3052296]}},{"properties":{"latitude":34.1873109,"column_5":1,"date":{"end_time":"2008/10/02 00:00:00 -0400","original":"10/1/2008","granularity":"day","time":"2008/10/01 00:00:00 -0400"},"longitude":-109.3044806,"id":"advbt65n1tg1","location":"Wenima WA"},"type":"Feature","geometry":{"type":"Point","coordinates":[-109.3044806,34.1873109]}},{"properties":{"latitude":34.1555035,"column_5":1,"date":{"end_time":"2008/10/02 00:00:00 -0400","original":"10/1/2008","granularity":"day","time":"2008/10/01 00:00:00 -0400"},"longitude":-109.3061496,"id":"advbt5tg6vmo","location":"Becker Lake"},"type":"Feature","geometry":{"type":"Point","coordinates":[-109.3061496,34.1555035]}},{"properties":{"latitude":34.0827203,"column_5":1,"date":{"end_time":"2008/10/02 00:00:00 -0400","original":"10/1/2008","granularity":"day","time":"2008/10/01 00:00:00 -0400"},"longitude":-109.4139009,"id":"advbt60ed86q","location":"Little Colorado River--South Fork"},"type":"Feature","geometry":{"type":"Point","coordinates":[-109.4139009,34.0827203]}},{"properties":{"latitude":38.0019501,"column_5":1,"date":{"end_time":"2008/10/17 00:00:00 -0400","original":"10/16/2008","granularity":"day","time":"2008/10/16 00:00:00 -0400"},"longitude":-122.7596014,"id":"advbt5y46vpf","location":"Five Brooks Pond"},"type":"Feature","geometry":{"type":"Point","coordinates":[-122.7596014,38.0019501]}},{"properties":{"latitude":38.1534573,"column_5":1,"date":{"end_time":"2008/10/18 00:00:00 -0400","original":"10/17/2008","granularity":"day","time":"2008/10/17 00:00:00 -0400"},"longitude":-123.4973145,"id":"advbt625j5ib","location":"Bodega Canyon/Cordell Bank Pelagic (Sonoma and Marin Counties)"},"type":"Feature","geometry":{"type":"Point","coordinates":[-123.4973145,38.1534573]}},{"properties":{"latitude":34.6985782,"column_5":1,"date":{"end_time":"2008/10/30 00:00:00 -0400","original":"10/29/2008","granularity":"day","time":"2008/10/29 00:00:00 -0400"},"longitude":-119.3168449,"id":"advbt5qz6w6b","location":"High Jack Ranch"},"type":"Feature","geometry":{"type":"Point","coordinates":[-119.3168449,34.6985782]}},{"properties":{"latitude":34.6916977,"column_5":1,"date":{"end_time":"2008/10/30 00:00:00 -0400","original":"10/29/2008","granularity":"day","time":"2008/10/29 00:00:00 -0400"},"longitude":-119.1324538,"id":"advbt65cefx4","location":"Pine Springs Campground"},"type":"Feature","geometry":{"type":"Point","coordinates":[-119.1324538,34.6916977]}},{"properties":{"latitude":36.9417288,"column_5":1,"date":{"end_time":"2008/11/04 00:00:00 -0500","original":"11/3/2008","granularity":"day","time":"2008/11/03 00:00:00 -0500"},"longitude":-120.1645947,"id":"advbt63fozsv","location":"Madera WTP"},"type":"Feature","geometry":{"type":"Point","coordinates":[-120.1645947,36.9417288]}},{"properties":{"latitude":36.4085733,"column_5":1,"date":{"end_time":"2008/11/04 00:00:00 -0500","original":"11/3/2008","granularity":"day","time":"2008/11/03 00:00:00 -0500"},"longitude":-119.0912819,"id":"advbt5yzjsvc","location":"Bravo Lake"},"type":"Feature","geometry":{"type":"Point","coordinates":[-119.0912819,36.4085733]}},{"properties":{"latitude":35.9065191,"column_5":1,"date":{"end_time":"2008/11/04 00:00:00 -0500","original":"11/3/2008","granularity":"day","time":"2008/11/03 00:00:00 -0500"},"longitude":-119.3758535,"id":"advbt5tq7qbs","location":"Pixley NWR"},"type":"Feature","geometry":{"type":"Point","coordinates":[-119.3758535,35.9065191]}},{"properties":{"latitude":35.1432134,"column_5":1,"date":{"end_time":"2008/11/21 00:00:00 -0500","original":"11/20/2008","granularity":"day","time":"2008/11/20 00:00:00 -0500"},"longitude":-120.5512619,"id":"advbt63nm98t","location":"Cheryl Lish House"},"type":"Feature","geometry":{"type":"Point","coordinates":[-120.5512619,35.1432134]}},{"properties":{"latitude":39.2170933,"column_5":1,"date":{"end_time":"2008/11/22 00:00:00 -0500","original":"11/21/2008","granularity":"day","time":"2008/11/21 00:00:00 -0500"},"longitude":-121.8370056,"id":"advbt5pupswn","location":"Sutter Buttes"},"type":"Feature","geometry":{"type":"Point","coordinates":[-121.8370056,39.2170933]}},{"properties":{"latitude":37.85,"column_5":1,"date":{"end_time":"2008/11/23 00:00:00 -0500","original":"11/22/2008","granularity":"day","time":"2008/11/22 00:00:00 -0500"},"longitude":-120.86,"id":"advbt61nmai6","location":"Woodward Reservoir Regional Park"},"type":"Feature","geometry":{"type":"Point","coordinates":[-120.86,37.85]}},{"properties":{"latitude":38.0908333,"column_5":1,"date":{"end_time":"2008/11/24 00:00:00 -0500","original":"11/23/2008","granularity":"day","time":"2008/11/23 00:00:00 -0500"},"longitude":-121.3872222,"id":"advbt5w4wfq0","location":"White Slough WTP"},"type":"Feature","geometry":{"type":"Point","coordinates":[-121.3872222,38.0908333]}},{"properties":{"latitude":34.1231637,"column_5":1,"date":{"end_time":"2008/11/26 00:00:00 -0500","original":"11/25/2008","granularity":"day","time":"2008/11/25 00:00:00 -0500"},"longitude":-119.1560752,"id":"advbt5s6e6u7","location":"Arnold Rd.--SW terminus"},"type":"Feature","geometry":{"type":"Point","coordinates":[-119.1560752,34.1231637]}},{"properties":{"latitude":34.0829954,"column_5":1,"date":{"end_time":"2008/11/26 00:00:00 -0500","original":"11/25/2008","granularity":"day","time":"2008/11/25 00:00:00 -0500"},"longitude":-119.0948868,"id":"advbt64i8cg8","location":"Offshore Mugu Lagoon"},"type":"Feature","geometry":{"type":"Point","coordinates":[-119.0948868,34.0829954]}},{"properties":{"latitude":34.4981747,"column_5":1,"date":{"end_time":"2008/11/29 00:00:00 -0500","original":"11/28/2008","granularity":"day","time":"2008/11/28 00:00:00 -0500"},"longitude":-112.4489737,"id":"advbt5uyg8sw","location":"Prescott--Goldwater Lakes"},"type":"Feature","geometry":{"type":"Point","coordinates":[-112.4489737,34.4981747]}},{"properties":{"latitude":34.5221157,"column_5":1,"date":{"end_time":"2008/11/29 00:00:00 -0500","original":"11/28/2008","granularity":"day","time":"2008/11/28 00:00:00 -0500"},"longitude":-112.385931,"id":"advbt6267agz","location":"Prescott--Lynx Lake"},"type":"Feature","geometry":{"type":"Point","coordinates":[-112.385931,34.5221157]}},{"properties":{"latitude":34.2725737,"column_5":1,"date":{"end_time":"2008/12/13 00:00:00 -0500","original":"12/12/2008","granularity":"day","time":"2008/12/12 00:00:00 -0500"},"longitude":-119.2853451,"id":"advbt63io955","location":"San Jon Outflow"},"type":"Feature","geometry":{"type":"Point","coordinates":[-119.2853451,34.2725737]}},{"properties":{"latitude":34.0448722,"column_5":1,"date":{"end_time":"2008/12/16 00:00:00 -0500","original":"12/15/2008","granularity":"day","time":"2008/12/15 00:00:00 -0500"},"longitude":-118.0629873,"id":"advbt60rqsol","location":"Whittier Narrows--Area B"},"type":"Feature","geometry":{"type":"Point","coordinates":[-118.0629873,34.0448722]}},{"properties":{"latitude":32.728688,"column_5":1,"date":{"end_time":"2008/12/18 00:00:00 -0500","original":"12/17/2008","granularity":"day","time":"2008/12/17 00:00:00 -0500"},"longitude":-114.3113959,"id":"advbt60egyw0","location":"Dome Valley Dairy"},"type":"Feature","geometry":{"type":"Point","coordinates":[-114.3113959,32.728688]}},{"properties":{"latitude":34.3546682,"column_5":1,"date":{"end_time":"2008/12/22 00:00:00 -0500","original":"12/21/2008","granularity":"day","time":"2008/12/21 00:00:00 -0500"},"longitude":-119.3120746,"id":"advbt5pxq4xx","location":"Foster Park"},"type":"Feature","geometry":{"type":"Point","coordinates":[-119.3120746,34.3546682]}},{"properties":{"latitude":34.41528,"column_5":1,"date":{"end_time":"2009/01/04 00:00:00 -0500","original":"1/3/2009","granularity":"day","time":"2009/01/03 00:00:00 -0500"},"longitude":-119.68577,"id":"advbt5ybod5n","location":"Garden St.--willows"},"type":"Feature","geometry":{"type":"Point","coordinates":[-119.68577,34.41528]}},{"properties":{"latitude":34.4127959,"column_5":1,"date":{"end_time":"2009/01/04 00:00:00 -0500","original":"1/3/2009","granularity":"day","time":"2009/01/03 00:00:00 -0500"},"longitude":-119.6869361,"id":"advbt64quplg","location":"Mission Creek outflow (SBA Co.)"},"type":"Feature","geometry":{"type":"Point","coordinates":[-119.6869361,34.4127959]}},{"properties":{"latitude":34.438363,"column_5":1,"date":{"end_time":"2009/01/06 00:00:00 -0500","original":"1/5/2009","granularity":"day","time":"2009/01/05 00:00:00 -0500"},"longitude":-119.8836064,"id":"advbt62q9dbf","location":"Bella Vista OSP"},"type":"Feature","geometry":{"type":"Point","coordinates":[-119.8836064,34.438363]}},{"properties":{"latitude":33.250069,"column_5":1,"date":{"end_time":"2009/01/09 00:00:00 -0500","original":"1/8/2009","granularity":"day","time":"2009/01/08 00:00:00 -0500"},"longitude":-119.510708,"id":"advbt65i3xb3","location":"San Nicolas Island (VEN Co.)"},"type":"Feature","geometry":{"type":"Point","coordinates":[-119.510708,33.250069]}},{"properties":{"latitude":10.3940962,"column_5":1,"date":{"end_time":"2009/03/05 00:00:00 -0500","original":"3/4/2009","granularity":"day","time":"2009/03/04 00:00:00 -0500"},"longitude":-84.1370344,"id":"advbt610rew3","location":"Rancho Leona"},"type":"Feature","geometry":{"type":"Point","coordinates":[-84.1370344,10.3940962]}},{"properties":{"latitude":10.3313009,"column_5":1,"date":{"end_time":"2009/03/07 00:00:00 -0500","original":"3/6/2009","granularity":"day","time":"2009/03/06 00:00:00 -0500"},"longitude":-83.9492798,"id":"advbt5tcpsh0","location":"Pierella Ecology Gardens"},"type":"Feature","geometry":{"type":"Point","coordinates":[-83.9492798,10.3313009]}},{"properties":{"latitude":10.4044167,"column_5":1,"date":{"end_time":"2009/03/07 00:00:00 -0500","original":"3/6/2009","granularity":"day","time":"2009/03/06 00:00:00 -0500"},"longitude":-84.1321421,"id":"advbt60086tk","location":"La Virgen"},"type":"Feature","geometry":{"type":"Point","coordinates":[-84.1321421,10.4044167]}},{"properties":{"latitude":9.5657371,"column_5":1,"date":{"end_time":"2009/03/23 00:00:00 -0400","original":"3/22/2009","granularity":"day","time":"2009/03/22 00:00:00 -0400"},"longitude":-83.8001728,"id":"advbt65q2pfu","location":"Savegre Valley"},"type":"Feature","geometry":{"type":"Point","coordinates":[-83.8001728,9.5657371]}},{"properties":{"latitude":9.5513233,"column_5":1,"date":{"end_time":"2009/03/25 00:00:00 -0400","original":"3/24/2009","granularity":"day","time":"2009/03/24 00:00:00 -0400"},"longitude":-83.7807083,"id":"advbt5xuypui","location":"Cerro de la Muerte to San Gerado de dota"},"type":"Feature","geometry":{"type":"Point","coordinates":[-83.7807083,9.5513233]}},{"properties":{"latitude":9.773866,"column_5":1,"date":{"end_time":"2009/04/29 00:00:00 -0400","original":"4/28/2009","granularity":"day","time":"2009/04/28 00:00:00 -0400"},"longitude":-83.7953746,"id":"advbt6463cmr","location":"Kiri Lodge"},"type":"Feature","geometry":{"type":"Point","coordinates":[-83.7953746,9.773866]}},{"properties":{"latitude":9.7719099,"column_5":1,"date":{"end_time":"2009/04/29 00:00:00 -0400","original":"4/28/2009","granularity":"day","time":"2009/04/28 00:00:00 -0400"},"longitude":-83.8376999,"id":"advbt5r20xfc","location":"Palomas"},"type":"Feature","geometry":{"type":"Point","coordinates":[-83.8376999,9.7719099]}},{"properties":{"latitude":9.7679344,"column_5":1,"date":{"end_time":"2009/04/30 00:00:00 -0400","original":"4/29/2009","granularity":"day","time":"2009/04/29 00:00:00 -0400"},"longitude":-83.7983894,"id":"advbt5sgypht","location":"entrance rd to Tapanti National Park"},"type":"Feature","geometry":{"type":"Point","coordinates":[-83.7983894,9.7679344]}},{"properties":{"latitude":9.746449,"column_5":1,"date":{"end_time":"2009/04/30 00:00:00 -0400","original":"4/29/2009","granularity":"day","time":"2009/04/29 00:00:00 -0400"},"longitude":-83.796673,"id":"advbt5r9yatr","location":"PN Tapanti--Tapanti"},"type":"Feature","geometry":{"type":"Point","coordinates":[-83.796673,9.746449]}},{"properties":{"latitude":9.7733479,"column_5":1,"date":{"end_time":"2009/05/01 00:00:00 -0400","original":"4/30/2009","granularity":"day","time":"2009/04/30 00:00:00 -0400"},"longitude":-84.6042538,"id":"advbt63zfg0o","location":"PN Carara--Sendero Quebrada Bonita"},"type":"Feature","geometry":{"type":"Point","coordinates":[-84.6042538,9.7733479]}},{"properties":{"latitude":37.6497363,"column_5":1,"date":{"end_time":"2009/05/05 00:00:00 -0400","original":"5/4/2009","granularity":"day","time":"2009/05/04 00:00:00 -0400"},"longitude":-120.9644759,"id":"advbt65esazl","location":"East La Loma Park"},"type":"Feature","geometry":{"type":"Point","coordinates":[-120.9644759,37.6497363]}},{"properties":{"latitude":40.5786141,"column_5":1,"date":{"end_time":"2009/05/05 00:00:00 -0400","original":"5/4/2009","granularity":"day","time":"2009/05/04 00:00:00 -0400"},"longitude":-122.3682125,"id":"advbt5zgbhjg","location":"Kutras Lake"},"type":"Feature","geometry":{"type":"Point","coordinates":[-122.3682125,40.5786141]}},{"properties":{"latitude":39.1864415,"column_5":1,"date":{"end_time":"2009/05/06 00:00:00 -0400","original":"5/5/2009","granularity":"day","time":"2009/05/05 00:00:00 -0400"},"longitude":-122.0441835,"id":"advbt5zg8d1p","location":"Colusa NWR"},"type":"Feature","geometry":{"type":"Point","coordinates":[-122.0441835,39.1864415]}},{"properties":{"latitude":44.9614021,"column_5":1,"date":{"end_time":"2009/05/10 00:00:00 -0400","original":"5/9/2009","granularity":"day","time":"2009/05/09 00:00:00 -0400"},"longitude":-123.257246,"id":"advbt5z8ne14","location":"Baskett Slough NWR"},"type":"Feature","geometry":{"type":"Point","coordinates":[-123.257246,44.9614021]}},{"properties":{"latitude":45.486132,"column_5":1,"date":{"end_time":"2009/05/11 00:00:00 -0400","original":"5/10/2009","granularity":"day","time":"2009/05/10 00:00:00 -0400"},"longitude":-123.9721298,"id":"advbt5w55qs1","location":"Cape Meares"},"type":"Feature","geometry":{"type":"Point","coordinates":[-123.9721298,45.486132]}},{"properties":{"latitude":45.56952,"column_5":1,"date":{"end_time":"2009/05/11 00:00:00 -0400","original":"5/10/2009","granularity":"day","time":"2009/05/10 00:00:00 -0400"},"longitude":-123.949414,"id":"advbt5xa0jsj","location":"Tillamook Bay--Barview Jetty"},"type":"Feature","geometry":{"type":"Point","coordinates":[-123.949414,45.56952]}},{"properties":{"latitude":45.4642,"column_5":1,"date":{"end_time":"2009/05/11 00:00:00 -0400","original":"5/10/2009","granularity":"day","time":"2009/05/10 00:00:00 -0400"},"longitude":-123.9867,"id":"advbt5zvu5pq","location":"Three Arch Rocks NWR (restricted access)"},"type":"Feature","geometry":{"type":"Point","coordinates":[-123.9867,45.4642]}},{"properties":{"latitude":45.5667079,"column_5":1,"date":{"end_time":"2009/05/12 00:00:00 -0400","original":"5/11/2009","granularity":"day","time":"2009/05/11 00:00:00 -0400"},"longitude":-123.4937096,"id":"advbt61k74fs","location":"Ben Smith plot Control"},"type":"Feature","geometry":{"type":"Point","coordinates":[-123.4937096,45.5667079]}},{"properties":{"latitude":45.560849,"column_5":1,"date":{"end_time":"2009/05/13 00:00:00 -0400","original":"5/12/2009","granularity":"day","time":"2009/05/12 00:00:00 -0400"},"longitude":-123.5018206,"id":"advbt60d4w59","location":"Ben Smith Plot Heavy"},"type":"Feature","geometry":{"type":"Point","coordinates":[-123.5018206,45.560849]}},{"properties":{"latitude":45.6088419,"column_5":1,"date":{"end_time":"2009/05/14 00:00:00 -0400","original":"5/13/2009","granularity":"day","time":"2009/05/13 00:00:00 -0400"},"longitude":-123.6007404,"id":"advbt64kd4qu","location":"Deer Diamond Plot - Control"},"type":"Feature","geometry":{"type":"Point","coordinates":[-123.6007404,45.6088419]}},{"properties":{"latitude":45.5492115,"column_5":1,"date":{"end_time":"2009/05/15 00:00:00 -0400","original":"5/14/2009","granularity":"day","time":"2009/05/14 00:00:00 -0400"},"longitude":-123.4115911,"id":"advbt5smgrwi","location":"C-Line Plot - Moderate/Control"},"type":"Feature","geometry":{"type":"Point","coordinates":[-123.4115911,45.5492115]}},{"properties":{"latitude":41.9127955,"column_5":1,"date":{"end_time":"2009/05/24 00:00:00 -0400","original":"5/23/2009","granularity":"day","time":"2009/05/23 00:00:00 -0400"},"longitude":-119.4580007,"id":"advbt62ptoq7","location":"Sheldon NWR--Catnip Reservoir"},"type":"Feature","geometry":{"type":"Point","coordinates":[-119.4580007,41.9127955]}},{"properties":{"latitude":41.8676433,"column_5":1,"date":{"end_time":"2009/05/24 00:00:00 -0400","original":"5/23/2009","granularity":"day","time":"2009/05/23 00:00:00 -0400"},"longitude":-119.0157509,"id":"advbt5y2olh3","location":"Sheldon NWR"},"type":"Feature","geometry":{"type":"Point","coordinates":[-119.0157509,41.8676433]}},{"properties":{"latitude":41.9941909,"column_5":1,"date":{"end_time":"2009/05/25 00:00:00 -0400","original":"5/24/2009","granularity":"day","time":"2009/05/24 00:00:00 -0400"},"longitude":-120.3235781,"id":"advbt62oxes2","location":"Goose Lake State Recreation Area (Oregon)"},"type":"Feature","geometry":{"type":"Point","coordinates":[-120.3235781,41.9941909]}},{"properties":{"latitude":41.4575229,"column_5":1,"date":{"end_time":"2009/05/25 00:00:00 -0400","original":"5/24/2009","granularity":"day","time":"2009/05/24 00:00:00 -0400"},"longitude":-120.5219078,"id":"advbt650idis","location":"Modoc NWR"},"type":"Feature","geometry":{"type":"Point","coordinates":[-120.5219078,41.4575229]}},{"properties":{"latitude":45.5877548,"column_5":1,"date":{"end_time":"2009/05/29 00:00:00 -0400","original":"5/28/2009","granularity":"day","time":"2009/05/28 00:00:00 -0400"},"longitude":-123.5514128,"id":"advbt5t7na94","location":"Smith Homestead Area"},"type":"Feature","geometry":{"type":"Point","coordinates":[-123.5514128,45.5877548]}},{"properties":{"latitude":45.6073328,"column_5":1,"date":{"end_time":"2009/05/31 00:00:00 -0400","original":"5/30/2009","granularity":"day","time":"2009/05/30 00:00:00 -0400"},"longitude":-123.5966456,"id":"advbt5szn9qo","location":"Deer Diamond Moderate"},"type":"Feature","geometry":{"type":"Point","coordinates":[-123.5966456,45.6073328]}},{"properties":{"latitude":45.5600627,"column_5":1,"date":{"end_time":"2009/06/02 00:00:00 -0400","original":"6/1/2009","granularity":"day","time":"2009/06/01 00:00:00 -0400"},"longitude":-123.5047728,"id":"advbt5z1six7","location":"Ben Smith Heavy"},"type":"Feature","geometry":{"type":"Point","coordinates":[-123.5047728,45.5600627]}},{"properties":{"latitude":42.3240318,"column_5":1,"date":{"end_time":"2009/06/06 00:00:00 -0400","original":"6/5/2009","granularity":"day","time":"2009/06/05 00:00:00 -0400"},"longitude":-118.6066818,"id":"advbt64d9njw","location":"Borax Lake"},"type":"Feature","geometry":{"type":"Point","coordinates":[-118.6066818,42.3240318]}},{"properties":{"latitude":42.5552497,"column_5":1,"date":{"end_time":"2009/06/06 00:00:00 -0400","original":"6/5/2009","granularity":"day","time":"2009/06/05 00:00:00 -0400"},"longitude":-118.5563529,"id":"advbt5rc0cgh","location":"Orchard above Alvord Hot Springs"},"type":"Feature","geometry":{"type":"Point","coordinates":[-118.5563529,42.5552497]}},{"properties":{"latitude":43.1618672,"column_5":1,"date":{"end_time":"2009/06/07 00:00:00 -0400","original":"6/6/2009","granularity":"day","time":"2009/06/06 00:00:00 -0400"},"longitude":-118.6592102,"id":"advbt5tvvkjn","location":"Barton Lake"},"type":"Feature","geometry":{"type":"Point","coordinates":[-118.6592102,43.1618672]}},{"properties":{"latitude":45.7148777,"column_5":1,"date":{"end_time":"2009/06/09 00:00:00 -0400","original":"6/8/2009","granularity":"day","time":"2009/06/08 00:00:00 -0400"},"longitude":-123.8854755,"id":"advbt6300fzs","location":"Nehalem Meadows"},"type":"Feature","geometry":{"type":"Point","coordinates":[-123.8854755,45.7148777]}},{"properties":{"latitude":45.5239689,"column_5":1,"date":{"end_time":"2009/06/09 00:00:00 -0400","original":"6/8/2009","granularity":"day","time":"2009/06/08 00:00:00 -0400"},"longitude":-123.8946891,"id":"advbt5qiign3","location":"Bay City Oyster Company"},"type":"Feature","geometry":{"type":"Point","coordinates":[-123.8946891,45.5239689]}},{"properties":{"latitude":45.5557207,"column_5":1,"date":{"end_time":"2009/06/11 00:00:00 -0400","original":"6/10/2009","granularity":"day","time":"2009/06/10 00:00:00 -0400"},"longitude":-123.4225041,"id":"advbt5vxxlug","location":"C-Line Heavy"},"type":"Feature","geometry":{"type":"Point","coordinates":[-123.4225041,45.5557207]}},{"properties":{"latitude":45.5486144,"column_5":1,"date":{"end_time":"2009/06/30 00:00:00 -0400","original":"6/29/2009","granularity":"day","time":"2009/06/29 00:00:00 -0400"},"longitude":-123.4141982,"id":"advbt5qh6dfi","location":"C-Line plot - Moderate"},"type":"Feature","geometry":{"type":"Point","coordinates":[-123.4141982,45.5486144]}},{"properties":{"latitude":44.3895666,"column_5":1,"date":{"end_time":"2009/07/02 00:00:00 -0400","original":"7/1/2009","granularity":"day","time":"2009/07/01 00:00:00 -0400"},"longitude":-123.3003867,"id":"advbt5xioub9","location":"William L. Finley NWR--Bruce Rd."},"type":"Feature","geometry":{"type":"Point","coordinates":[-123.3003867,44.3895666]}},{"properties":{"latitude":38.27745,"column_5":1,"date":{"end_time":"2009/07/06 00:00:00 -0400","original":"7/5/2009","granularity":"day","time":"2009/07/05 00:00:00 -0400"},"longitude":-120.30706,"id":"advbt5znwes0","location":"Calaveras Big Trees SP"},"type":"Feature","geometry":{"type":"Point","coordinates":[-120.30706,38.27745]}},{"properties":{"latitude":37.252247,"column_5":1,"date":{"end_time":"2009/07/19 00:00:00 -0400","original":"7/18/2009","granularity":"day","time":"2009/07/18 00:00:00 -0400"},"longitude":-122.218544,"id":"advbt5pomd7r","location":"Portola Redwood SP"},"type":"Feature","geometry":{"type":"Point","coordinates":[-122.218544,37.252247]}},{"properties":{"latitude":37.1063481,"column_5":1,"date":{"end_time":"2009/07/21 00:00:00 -0400","original":"7/20/2009","granularity":"day","time":"2009/07/20 00:00:00 -0400"},"longitude":-121.8462539,"id":"advbt5yqsafb","location":"Loma Prieta area (SCL Co.)"},"type":"Feature","geometry":{"type":"Point","coordinates":[-121.8462539,37.1063481]}},{"properties":{"latitude":37.6780464,"column_5":1,"date":{"end_time":"2009/07/23 00:00:00 -0400","original":"7/22/2009","granularity":"day","time":"2009/07/22 00:00:00 -0400"},"longitude":-119.6334743,"id":"advbt65kw20g","location":"Yosemite NP--McGurk Meadow"},"type":"Feature","geometry":{"type":"Point","coordinates":[-119.6334743,37.6780464]}},{"properties":{"latitude":37.5307612,"column_5":1,"date":{"end_time":"2009/07/25 00:00:00 -0400","original":"7/24/2009","granularity":"day","time":"2009/07/24 00:00:00 -0400"},"longitude":-119.6469927,"id":"advbt64i062z","location":"Wawona Meadow"},"type":"Feature","geometry":{"type":"Point","coordinates":[-119.6469927,37.5307612]}},{"properties":{"latitude":37.8705172,"column_5":1,"date":{"end_time":"2009/07/25 00:00:00 -0400","original":"7/24/2009","granularity":"day","time":"2009/07/24 00:00:00 -0400"},"longitude":-119.6471214,"id":"advbt640esdo","location":"Yosemite NP--White Wolf"},"type":"Feature","geometry":{"type":"Point","coordinates":[-119.6471214,37.8705172]}},{"properties":{"latitude":37.9356685,"column_5":1,"date":{"end_time":"2009/07/25 00:00:00 -0400","original":"7/24/2009","granularity":"day","time":"2009/07/24 00:00:00 -0400"},"longitude":-119.2329884,"id":"advbt5qw7sl9","location":"Ellery Lake"},"type":"Feature","geometry":{"type":"Point","coordinates":[-119.2329884,37.9356685]}},{"properties":{"latitude":34.2346543,"column_5":1,"date":{"end_time":"2009/07/29 00:00:00 -0400","original":"7/28/2009","granularity":"day","time":"2009/07/28 00:00:00 -0400"},"longitude":-119.2102432,"id":"advbt5zsybzg","location":"Santa Clara River--Strathmore (Nature Conservancy)"},"type":"Feature","geometry":{"type":"Point","coordinates":[-119.2102432,34.2346543]}},{"properties":{"latitude":36.3682219,"column_5":1,"date":{"end_time":"2009/08/01 00:00:00 -0400","original":"7/31/2009","granularity":"day","time":"2009/07/31 00:00:00 -0400"},"longitude":-122.3300171,"id":"advbt63qsu4p","location":"Monterey pelagic--to offshore Pt. Sur (MTY Co.)"},"type":"Feature","geometry":{"type":"Point","coordinates":[-122.3300171,36.3682219]}},{"properties":{"latitude":36.6025196,"column_5":1,"date":{"end_time":"2009/08/03 00:00:00 -0400","original":"8/2/2009","granularity":"day","time":"2009/08/02 00:00:00 -0400"},"longitude":-122.5014496,"id":"advbt5qevl5s","location":"Monterey Seavalley pelagic (MTY Co.)"},"type":"Feature","geometry":{"type":"Point","coordinates":[-122.5014496,36.6025196]}},{"properties":{"latitude":38.9389497,"column_5":1,"date":{"end_time":"2009/08/12 00:00:00 -0400","original":"8/11/2009","granularity":"day","time":"2009/08/11 00:00:00 -0400"},"longitude":-120.0017738,"id":"advbt5z7oxp6","location":"Upper Truckee River--marsh trail and offshore"},"type":"Feature","geometry":{"type":"Point","coordinates":[-120.0017738,38.9389497]}},{"properties":{"latitude":40.6566806,"column_5":1,"date":{"end_time":"2009/08/13 00:00:00 -0400","original":"8/12/2009","granularity":"day","time":"2009/08/12 00:00:00 -0400"},"longitude":-115.744915,"id":"advbt6022lsx","location":"South Fork State Recreation Area"},"type":"Feature","geometry":{"type":"Point","coordinates":[-115.744915,40.6566806]}},{"properties":{"latitude":41.1357446,"column_5":1,"date":{"end_time":"2009/08/13 00:00:00 -0400","original":"8/12/2009","granularity":"day","time":"2009/08/12 00:00:00 -0400"},"longitude":-115.0004196,"id":"advbt63tlgm3","location":"Well's Old Sewer Ponds"},"type":"Feature","geometry":{"type":"Point","coordinates":[-115.0004196,41.1357446]}},{"properties":{"latitude":43.44298,"column_5":1,"date":{"end_time":"2009/08/14 00:00:00 -0400","original":"8/13/2009","granularity":"day","time":"2009/08/13 00:00:00 -0400"},"longitude":-112.8110075,"id":"advbt64be886","location":"Atomic City"},"type":"Feature","geometry":{"type":"Point","coordinates":[-112.8110075,43.44298]}},{"properties":{"latitude":43.50897,"column_5":1,"date":{"end_time":"2009/08/17 00:00:00 -0400","original":"8/16/2009","granularity":"day","time":"2009/08/16 00:00:00 -0400"},"longitude":-110.7493973,"id":"advbt5vh68bh","location":"National Elk Refuge"},"type":"Feature","geometry":{"type":"Point","coordinates":[-110.7493973,43.50897]}},{"properties":{"latitude":43.5973005,"column_5":1,"date":{"end_time":"2009/08/18 00:00:00 -0400","original":"8/17/2009","granularity":"day","time":"2009/08/17 00:00:00 -0400"},"longitude":-110.8712339,"id":"advbt5wuq6r4","location":"Teton Village Tram"},"type":"Feature","geometry":{"type":"Point","coordinates":[-110.8712339,43.5973005]}},{"properties":{"latitude":42.047763,"column_5":1,"date":{"end_time":"2009/08/19 00:00:00 -0400","original":"8/18/2009","granularity":"day","time":"2009/08/18 00:00:00 -0400"},"longitude":-109.4368744,"id":"advbt5ujok5v","location":"Eden"},"type":"Feature","geometry":{"type":"Point","coordinates":[-109.4368744,42.047763]}},{"properties":{"latitude":39.9739136,"column_5":1,"date":{"end_time":"2009/08/20 00:00:00 -0400","original":"8/19/2009","granularity":"day","time":"2009/08/19 00:00:00 -0400"},"longitude":-105.2748799,"id":"advbt5s2y9av","location":"Bear Canyon - Boulder"},"type":"Feature","geometry":{"type":"Point","coordinates":[-105.2748799,39.9739136]}},{"properties":{"latitude":40.54796,"column_5":1,"date":{"end_time":"2009/08/21 00:00:00 -0400","original":"8/20/2009","granularity":"day","time":"2009/08/20 00:00:00 -0400"},"longitude":-104.95986,"id":"advbt62j0y20","location":"Timnath Reservoir"},"type":"Feature","geometry":{"type":"Point","coordinates":[-104.95986,40.54796]}},{"properties":{"latitude":40.3345066,"column_5":1,"date":{"end_time":"2009/08/21 00:00:00 -0400","original":"8/20/2009","granularity":"day","time":"2009/08/20 00:00:00 -0400"},"longitude":-104.6397114,"id":"advbt64tud9g","location":"Lower Latham Reservoir area"},"type":"Feature","geometry":{"type":"Point","coordinates":[-104.6397114,40.3345066]}},{"properties":{"latitude":40.7875169,"column_5":1,"date":{"end_time":"2009/08/21 00:00:00 -0400","original":"8/20/2009","granularity":"day","time":"2009/08/20 00:00:00 -0400"},"longitude":-104.3735934,"id":"advbt623ffvu","location":"Pawnee National Grassland"},"type":"Feature","geometry":{"type":"Point","coordinates":[-104.3735934,40.7875169]}},{"properties":{"latitude":40.6443418,"column_5":1,"date":{"end_time":"2009/08/21 00:00:00 -0400","original":"8/20/2009","granularity":"day","time":"2009/08/20 00:00:00 -0400"},"longitude":-104.3433166,"id":"advbt5tdrqi0","location":"Pawnee NG--Crow Valley Campground"},"type":"Feature","geometry":{"type":"Point","coordinates":[-104.3433166,40.6443418]}},{"properties":{"latitude":39.3734,"column_5":1,"date":{"end_time":"2009/08/22 00:00:00 -0400","original":"8/21/2009","granularity":"day","time":"2009/08/21 00:00:00 -0400"},"longitude":-100.11,"id":"advbt5vhqclt","location":"Antelope Lake"},"type":"Feature","geometry":{"type":"Point","coordinates":[-100.11,39.3734]}},{"properties":{"latitude":39.3556043,"column_5":1,"date":{"end_time":"2009/08/22 00:00:00 -0400","original":"8/21/2009","granularity":"day","time":"2009/08/21 00:00:00 -0400"},"longitude":-100.1437283,"id":"advbt5zaawzr","location":"Ave 110 and Highway 24 Graham County"},"type":"Feature","geometry":{"type":"Point","coordinates":[-100.1437283,39.3556043]}},{"properties":{"latitude":39.2291124,"column_5":1,"date":{"end_time":"2009/08/23 00:00:00 -0400","original":"8/22/2009","granularity":"day","time":"2009/08/22 00:00:00 -0400"},"longitude":-96.1524618,"id":"advbt5wk8aug","location":"Oregon Trail Nature Park"},"type":"Feature","geometry":{"type":"Point","coordinates":[-96.1524618,39.2291124]}},{"properties":{"latitude":39.0838384,"column_5":1,"date":{"end_time":"2009/08/23 00:00:00 -0400","original":"8/22/2009","granularity":"day","time":"2009/08/22 00:00:00 -0400"},"longitude":-96.5905952,"id":"advbt5vy80me","location":"Konza Prairie"},"type":"Feature","geometry":{"type":"Point","coordinates":[-96.5905952,39.0838384]}},{"properties":{"latitude":39.5240378,"column_5":1,"date":{"end_time":"2009/08/23 00:00:00 -0400","original":"8/22/2009","granularity":"day","time":"2009/08/22 00:00:00 -0400"},"longitude":-98.3808732,"id":"advbt5qobwtj","location":"Granite Creek Campground - Mitchell County"},"type":"Feature","geometry":{"type":"Point","coordinates":[-98.3808732,39.5240378]}},{"properties":{"latitude":38.9556712,"column_5":1,"date":{"end_time":"2009/08/23 00:00:00 -0400","original":"8/22/2009","granularity":"day","time":"2009/08/22 00:00:00 -0400"},"longitude":-98.3942413,"id":"advbt5xd4kx7","location":"Highway 181 near Wilson Lake"},"type":"Feature","geometry":{"type":"Point","coordinates":[-98.3942413,38.9556712]}},{"properties":{"latitude":39.6046962,"column_5":1,"date":{"end_time":"2009/08/24 00:00:00 -0400","original":"8/23/2009","granularity":"day","time":"2009/08/23 00:00:00 -0400"},"longitude":-90.5273867,"id":"advbt5y4zjjn","location":"Witwer Road - Scott County"},"type":"Feature","geometry":{"type":"Point","coordinates":[-90.5273867,39.6046962]}},{"properties":{"latitude":39.5429,"column_5":1,"date":{"end_time":"2009/08/24 00:00:00 -0400","original":"8/23/2009","granularity":"day","time":"2009/08/23 00:00:00 -0400"},"longitude":-91.1650694,"id":"advbt63uev0e","location":"Ted Shanks CA"},"type":"Feature","geometry":{"type":"Point","coordinates":[-91.1650694,39.5429]}},{"properties":{"latitude":39.3022253,"column_5":1,"date":{"end_time":"2009/08/24 00:00:00 -0400","original":"8/23/2009","granularity":"day","time":"2009/08/23 00:00:00 -0400"},"longitude":-90.3627205,"id":"advbt5qgnq5s","location":"Highway 108 - Greene Co"},"type":"Feature","geometry":{"type":"Point","coordinates":[-90.3627205,39.3022253]}},{"properties":{"latitude":39.6307132,"column_5":1,"date":{"end_time":"2009/08/24 00:00:00 -0400","original":"8/23/2009","granularity":"day","time":"2009/08/23 00:00:00 -0400"},"longitude":-90.59515,"id":"advbt61koi0l","location":"Rt 106 and CR 350 - Scott County"},"type":"Feature","geometry":{"type":"Point","coordinates":[-90.59515,39.6307132]}},{"properties":{"latitude":39.5073519,"column_5":1,"date":{"end_time":"2009/08/24 00:00:00 -0400","original":"8/23/2009","granularity":"day","time":"2009/08/23 00:00:00 -0400"},"longitude":-90.5193615,"id":"advbt5qc5ewt","location":"Hillview and Rd 2710 N"},"type":"Feature","geometry":{"type":"Point","coordinates":[-90.5193615,39.5073519]}},{"properties":{"latitude":38.9703201,"column_5":1,"date":{"end_time":"2009/08/24 00:00:00 -0400","original":"8/23/2009","granularity":"day","time":"2009/08/23 00:00:00 -0400"},"longitude":-98.497324,"id":"advbt65jojd9","location":"Wilson Lake - Bur Oak Nature Trail"},"type":"Feature","geometry":{"type":"Point","coordinates":[-98.497324,38.9703201]}},{"properties":{"latitude":39.590477,"column_5":1,"date":{"end_time":"2009/08/24 00:00:00 -0400","original":"8/23/2009","granularity":"day","time":"2009/08/23 00:00:00 -0400"},"longitude":-90.5263996,"id":"advbt5r16dt5","location":"Hillview and 475N - Scott County"},"type":"Feature","geometry":{"type":"Point","coordinates":[-90.5263996,39.590477]}},{"properties":{"latitude":39.2782446,"column_5":1,"date":{"end_time":"2009/08/24 00:00:00 -0400","original":"8/23/2009","granularity":"day","time":"2009/08/23 00:00:00 -0400"},"longitude":-89.880867,"id":"advbt5ppze1e","location":"Carlinville"},"type":"Feature","geometry":{"type":"Point","coordinates":[-89.880867,39.2782446]}},{"properties":{"latitude":41.4181104,"column_5":1,"date":{"end_time":"2009/09/02 00:00:00 -0400","original":"9/1/2009","granularity":"day","time":"2009/09/01 00:00:00 -0400"},"longitude":-82.9512903,"id":"advbt5ssecvo","location":"Pickerel Creek Wildlife Area"},"type":"Feature","geometry":{"type":"Point","coordinates":[-82.9512903,41.4181104]}},{"properties":{"latitude":40.7118252,"column_5":1,"date":{"end_time":"2009/09/06 00:00:00 -0400","original":"9/5/2009","granularity":"day","time":"2009/09/05 00:00:00 -0400"},"longitude":-83.3001208,"id":"advbt5rtte9d","location":"C115 west side pond - Wyandot County"},"type":"Feature","geometry":{"type":"Point","coordinates":[-83.3001208,40.7118252]}},{"properties":{"latitude":40.7234536,"column_5":1,"date":{"end_time":"2009/09/06 00:00:00 -0400","original":"9/5/2009","granularity":"day","time":"2009/09/05 00:00:00 -0400"},"longitude":-83.3228016,"id":"advbt5pt88vk","location":"T108 and C71 - Wyandot County"},"type":"Feature","geometry":{"type":"Point","coordinates":[-83.3228016,40.7234536]}},{"properties":{"latitude":41.6183298,"column_5":1,"date":{"end_time":"2009/09/28 00:00:00 -0400","original":"9/27/2009","granularity":"day","time":"2009/09/27 00:00:00 -0400"},"longitude":-83.1824684,"id":"advbt5yjl1s8","location":"Magee Marsh Wildlife Area--Causeway (Ottawa Co.)"},"type":"Feature","geometry":{"type":"Point","coordinates":[-83.1824684,41.6183298]}},{"properties":{"latitude":41.6051585,"column_5":1,"date":{"end_time":"2009/09/28 00:00:00 -0400","original":"9/27/2009","granularity":"day","time":"2009/09/27 00:00:00 -0400"},"longitude":-83.1933045,"id":"advbt5sarla7","location":"Magee Marsh Wildlife Area--Black Swamp Bird Observatory"},"type":"Feature","geometry":{"type":"Point","coordinates":[-83.1933045,41.6051585]}},{"properties":{"latitude":40.5008779,"column_5":1,"date":{"end_time":"2009/10/01 00:00:00 -0400","original":"9/30/2009","granularity":"day","time":"2009/09/30 00:00:00 -0400"},"longitude":-83.9114714,"id":"advbt645eayn","location":"Indian Lake SP--Old Field"},"type":"Feature","geometry":{"type":"Point","coordinates":[-83.9114714,40.5008779]}},{"properties":{"latitude":40.509786,"column_5":1,"date":{"end_time":"2009/10/01 00:00:00 -0400","original":"9/30/2009","granularity":"day","time":"2009/09/30 00:00:00 -0400"},"longitude":-83.8962364,"id":"advbt5rebjap","location":"Indian Lake State Park - Campground"},"type":"Feature","geometry":{"type":"Point","coordinates":[-83.8962364,40.509786]}},{"properties":{"latitude":41.5905,"column_5":1,"date":{"end_time":"2009/10/06 00:00:00 -0400","original":"10/5/2009","granularity":"day","time":"2009/10/05 00:00:00 -0400"},"longitude":-83.0643332,"id":"advbt62gi34b","location":"BSBO banding area"},"type":"Feature","geometry":{"type":"Point","coordinates":[-83.0643332,41.5905]}},{"properties":{"latitude":41.6081267,"column_5":1,"date":{"end_time":"2009/10/06 00:00:00 -0400","original":"10/5/2009","granularity":"day","time":"2009/10/05 00:00:00 -0400"},"longitude":-83.2374001,"id":"advbt5qaypdw","location":"Ottawa NWR (Ottawa Co.)"},"type":"Feature","geometry":{"type":"Point","coordinates":[-83.2374001,41.6081267]}},{"properties":{"latitude":41.1152817,"column_5":1,"date":{"end_time":"2009/10/08 00:00:00 -0400","original":"10/7/2009","granularity":"day","time":"2009/10/07 00:00:00 -0400"},"longitude":-83.6792135,"id":"advbt60euwr3","location":"Hancock County Landfill"},"type":"Feature","geometry":{"type":"Point","coordinates":[-83.6792135,41.1152817]}},{"properties":{"latitude":41.1221681,"column_5":1,"date":{"end_time":"2009/10/08 00:00:00 -0400","original":"10/7/2009","granularity":"day","time":"2009/10/07 00:00:00 -0400"},"longitude":-83.6767673,"id":"advbt5wllvya","location":"Hancock County Landfill - Old wetlands"},"type":"Feature","geometry":{"type":"Point","coordinates":[-83.6767673,41.1221681]}},{"properties":{"latitude":40.8696079,"column_5":1,"date":{"end_time":"2009/10/09 00:00:00 -0400","original":"10/8/2009","granularity":"day","time":"2009/10/08 00:00:00 -0400"},"longitude":-83.5926917,"id":"advbt5wmv9de","location":"Site 33 - Hancock County"},"type":"Feature","geometry":{"type":"Point","coordinates":[-83.5926917,40.8696079]}},{"properties":{"latitude":40.84736,"column_5":1,"date":{"end_time":"2009/10/09 00:00:00 -0400","original":"10/8/2009","granularity":"day","time":"2009/10/08 00:00:00 -0400"},"longitude":-83.5573194,"id":"advbt64fd964","location":"Site 11 - Hancock County"},"type":"Feature","geometry":{"type":"Point","coordinates":[-83.5573194,40.84736]}},{"properties":{"latitude":40.8637879,"column_5":1,"date":{"end_time":"2009/10/09 00:00:00 -0400","original":"10/8/2009","granularity":"day","time":"2009/10/08 00:00:00 -0400"},"longitude":-83.6815716,"id":"advbt6074n6x","location":"Site 42 - Hancock County"},"type":"Feature","geometry":{"type":"Point","coordinates":[-83.6815716,40.8637879]}},{"properties":{"latitude":41.1239084,"column_5":1,"date":{"end_time":"2009/10/18 00:00:00 -0400","original":"10/17/2009","granularity":"day","time":"2009/10/17 00:00:00 -0400"},"longitude":-83.6093384,"id":"advbt63xhg7h","location":"Site 41 - Hancock Co"},"type":"Feature","geometry":{"type":"Point","coordinates":[-83.6093384,41.1239084]}},{"properties":{"latitude":41.0185058,"column_5":1,"date":{"end_time":"2009/10/23 00:00:00 -0400","original":"10/22/2009","granularity":"day","time":"2009/10/22 00:00:00 -0400"},"longitude":-83.6577988,"id":"advbt5voh3pk","location":"Lake Cascades"},"type":"Feature","geometry":{"type":"Point","coordinates":[-83.6577988,41.0185058]}},{"properties":{"latitude":41.0538547,"column_5":1,"date":{"end_time":"2009/10/24 00:00:00 -0400","original":"10/23/2009","granularity":"day","time":"2009/10/23 00:00:00 -0400"},"longitude":-83.6111927,"id":"advbt648wlgh","location":"Findlay Mall area"},"type":"Feature","geometry":{"type":"Point","coordinates":[-83.6111927,41.0538547]}},{"properties":{"latitude":41.5038208,"column_5":1,"date":{"end_time":"2009/10/25 00:00:00 -0400","original":"10/24/2009","granularity":"day","time":"2009/10/24 00:00:00 -0400"},"longitude":-82.0581293,"id":"advbt5sw1jvl","location":"Miller Rd. Park (Avon Lake Power Plant)"},"type":"Feature","geometry":{"type":"Point","coordinates":[-82.0581293,41.5038208]}},{"properties":{"latitude":41.0550494,"column_5":1,"date":{"end_time":"2009/10/26 00:00:00 -0400","original":"10/25/2009","granularity":"day","time":"2009/10/25 00:00:00 -0400"},"longitude":-83.7677434,"id":"advbt5y9y4fm","location":"Litzenberg Memorial Woods--South"},"type":"Feature","geometry":{"type":"Point","coordinates":[-83.7677434,41.0550494]}},{"properties":{"latitude":41.0607259,"column_5":1,"date":{"end_time":"2009/10/26 00:00:00 -0400","original":"10/25/2009","granularity":"day","time":"2009/10/25 00:00:00 -0400"},"longitude":-83.7635547,"id":"advbt5q7xnp7","location":"Litzenberg Memorial Woods--North"},"type":"Feature","geometry":{"type":"Point","coordinates":[-83.7635547,41.0607259]}},{"properties":{"latitude":41.023001,"column_5":1,"date":{"end_time":"2009/10/26 00:00:00 -0400","original":"10/25/2009","granularity":"day","time":"2009/10/25 00:00:00 -0400"},"longitude":-83.7894662,"id":"advbt65c6clr","location":"Site 31 - Hancock County"},"type":"Feature","geometry":{"type":"Point","coordinates":[-83.7894662,41.023001]}},{"properties":{"latitude":40.5273704,"column_5":1,"date":{"end_time":"2009/11/01 00:00:00 -0400","original":"10/31/2009","granularity":"day","time":"2009/10/31 00:00:00 -0400"},"longitude":-84.4136238,"id":"advbt5wptyeg","location":"St. Marys State Fish Hatchery"},"type":"Feature","geometry":{"type":"Point","coordinates":[-84.4136238,40.5273704]}},{"properties":{"latitude":40.4896459,"column_5":1,"date":{"end_time":"2009/11/01 00:00:00 -0400","original":"10/31/2009","granularity":"day","time":"2009/10/31 00:00:00 -0400"},"longitude":-84.5449848,"id":"advbt5rz5q86","location":"Montezuma Church - Ohio"},"type":"Feature","geometry":{"type":"Point","coordinates":[-84.5449848,40.4896459]}},{"properties":{"latitude":40.5443414,"column_5":1,"date":{"end_time":"2009/11/01 00:00:00 -0400","original":"10/31/2009","granularity":"day","time":"2009/10/31 00:00:00 -0400"},"longitude":-84.5697255,"id":"advbt60jsmo4","location":"North End Dam - Grand St Mary's Lake"},"type":"Feature","geometry":{"type":"Point","coordinates":[-84.5697255,40.5443414]}},{"properties":{"latitude":38.2615245,"column_5":1,"date":{"end_time":"2009/11/02 00:00:00 -0500","original":"11/1/2009","granularity":"day","time":"2009/11/01 00:00:00 -0400"},"longitude":-96.2423744,"id":"advbt5sg5dol","location":"Pond Rd 70 &amp; G - Flint Hills Region"},"type":"Feature","geometry":{"type":"Point","coordinates":[-96.2423744,38.2615245]}},{"properties":{"latitude":38.1104736,"column_5":1,"date":{"end_time":"2009/11/02 00:00:00 -0500","original":"11/1/2009","granularity":"day","time":"2009/11/01 00:00:00 -0400"},"longitude":-96.4431753,"id":"advbt5us6u3p","location":"Madison Rd - Flint Hills"},"type":"Feature","geometry":{"type":"Point","coordinates":[-96.4431753,38.1104736]}},{"properties":{"latitude":38.1268374,"column_5":1,"date":{"end_time":"2009/11/02 00:00:00 -0500","original":"11/1/2009","granularity":"day","time":"2009/11/01 00:00:00 -0400"},"longitude":-96.4584045,"id":"advbt6365sf0","location":"WP Rd - Flint Hills"},"type":"Feature","geometry":{"type":"Point","coordinates":[-96.4584045,38.1268374]}},{"properties":{"latitude":38.1447641,"column_5":1,"date":{"end_time":"2009/11/02 00:00:00 -0500","original":"11/1/2009","granularity":"day","time":"2009/11/01 00:00:00 -0400"},"longitude":-96.4374075,"id":"advbt5ruszzn","location":"Microwave Tower - Flint Hills"},"type":"Feature","geometry":{"type":"Point","coordinates":[-96.4374075,38.1447641]}},{"properties":{"latitude":38.0821941,"column_5":1,"date":{"end_time":"2009/11/02 00:00:00 -0500","original":"11/1/2009","granularity":"day","time":"2009/11/01 00:00:00 -0400"},"longitude":-96.401413,"id":"advbt5v75y8s","location":"Road south of Madison Rd - Flint Hills"},"type":"Feature","geometry":{"type":"Point","coordinates":[-96.401413,38.0821941]}},{"properties":{"latitude":38.2421687,"column_5":1,"date":{"end_time":"2009/11/02 00:00:00 -0500","original":"11/1/2009","granularity":"day","time":"2009/11/01 00:00:00 -0400"},"longitude":-96.2652941,"id":"advbt649uiu8","location":"Road F - Flint Hills region"},"type":"Feature","geometry":{"type":"Point","coordinates":[-96.2652941,38.2421687]}},{"properties":{"latitude":38.4851729,"column_5":1,"date":{"end_time":"2009/11/03 00:00:00 -0500","original":"11/2/2009","granularity":"day","time":"2009/11/02 00:00:00 -0500"},"longitude":-98.654995,"id":"advbt63jr60o","location":"Cheyenne Bottoms SWA"},"type":"Feature","geometry":{"type":"Point","coordinates":[-98.654995,38.4851729]}},{"properties":{"latitude":38.4996163,"column_5":1,"date":{"end_time":"2009/11/03 00:00:00 -0500","original":"11/2/2009","granularity":"day","time":"2009/11/02 00:00:00 -0500"},"longitude":-98.7240028,"id":"advbt65mftlo","location":"TNC--Cheyenne Bottoms"},"type":"Feature","geometry":{"type":"Point","coordinates":[-98.7240028,38.4996163]}},{"properties":{"latitude":39.2936,"column_5":1,"date":{"end_time":"2009/11/03 00:00:00 -0500","original":"11/2/2009","granularity":"day","time":"2009/11/02 00:00:00 -0500"},"longitude":-102.9861,"id":"advbt5twow5x","location":"Flagler Reservoir SWA"},"type":"Feature","geometry":{"type":"Point","coordinates":[-102.9861,39.2936]}},{"properties":{"latitude":39.665534,"column_5":1,"date":{"end_time":"2009/11/04 00:00:00 -0500","original":"11/3/2009","granularity":"day","time":"2009/11/03 00:00:00 -0500"},"longitude":-105.205556,"id":"advbt5qwkc2l","location":"Red Rocks Park"},"type":"Feature","geometry":{"type":"Point","coordinates":[-105.205556,39.665534]}},{"properties":{"latitude":39.70361,"column_5":1,"date":{"end_time":"2009/11/04 00:00:00 -0500","original":"11/3/2009","granularity":"day","time":"2009/11/03 00:00:00 -0500"},"longitude":-105.6984,"id":"advbt5zyh7aw","location":"Georgetown"},"type":"Feature","geometry":{"type":"Point","coordinates":[-105.6984,39.70361]}},{"properties":{"latitude":39.6956412,"column_5":1,"date":{"end_time":"2009/11/04 00:00:00 -0500","original":"11/3/2009","granularity":"day","time":"2009/11/03 00:00:00 -0500"},"longitude":-105.7261044,"id":"advbt5ye7yf8","location":"Silver Plume"},"type":"Feature","geometry":{"type":"Point","coordinates":[-105.7261044,39.6956412]}},{"properties":{"latitude":39.66464,"column_5":1,"date":{"end_time":"2009/11/04 00:00:00 -0500","original":"11/3/2009","granularity":"day","time":"2009/11/03 00:00:00 -0500"},"longitude":-105.87891,"id":"advbt5wimkn1","location":"Loveland Pass--Clear Creek Co."},"type":"Feature","geometry":{"type":"Point","coordinates":[-105.87891,39.66464]}},{"properties":{"latitude":39.6981811,"column_5":1,"date":{"end_time":"2009/11/04 00:00:00 -0500","original":"11/3/2009","granularity":"day","time":"2009/11/03 00:00:00 -0500"},"longitude":-105.2914131,"id":"advbt5s0sjpd","location":"Genesee Mountain Park--south of I-70"},"type":"Feature","geometry":{"type":"Point","coordinates":[-105.2914131,39.6981811]}},{"properties":{"latitude":39.6368882,"column_5":1,"date":{"end_time":"2009/11/05 00:00:00 -0500","original":"11/4/2009","granularity":"day","time":"2009/11/04 00:00:00 -0500"},"longitude":-104.7653116,"id":"advbt61o5bso","location":"Austin's house"},"type":"Feature","geometry":{"type":"Point","coordinates":[-104.7653116,39.6368882]}},{"properties":{"latitude":39.9964235,"column_5":1,"date":{"end_time":"2009/11/06 00:00:00 -0500","original":"11/5/2009","granularity":"day","time":"2009/11/05 00:00:00 -0500"},"longitude":-105.2053332,"id":"advbt64agdch","location":"Baseline Reservoir"},"type":"Feature","geometry":{"type":"Point","coordinates":[-105.2053332,39.9964235]}},{"properties":{"latitude":40.0341016,"column_5":1,"date":{"end_time":"2009/11/06 00:00:00 -0500","original":"11/5/2009","granularity":"day","time":"2009/11/05 00:00:00 -0500"},"longitude":-105.3158811,"id":"advbt64z4b07","location":"Sunshine Canyon"},"type":"Feature","geometry":{"type":"Point","coordinates":[-105.3158811,40.0341016]}},{"properties":{"latitude":40.1942,"column_5":1,"date":{"end_time":"2009/11/06 00:00:00 -0500","original":"11/5/2009","granularity":"day","time":"2009/11/05 00:00:00 -0500"},"longitude":-105.527,"id":"advbt5sqeulr","location":"Allenspark"},"type":"Feature","geometry":{"type":"Point","coordinates":[-105.527,40.1942]}},{"properties":{"latitude":35.2090671,"column_5":1,"date":{"end_time":"2009/11/09 00:00:00 -0500","original":"11/8/2009","granularity":"day","time":"2009/11/08 00:00:00 -0500"},"longitude":-111.5790009,"id":"advbt61z3toc","location":"Athletic Club ponds"},"type":"Feature","geometry":{"type":"Point","coordinates":[-111.5790009,35.2090671]}},{"properties":{"latitude":35.2028488,"column_5":1,"date":{"end_time":"2009/11/09 00:00:00 -0500","original":"11/8/2009","granularity":"day","time":"2009/11/08 00:00:00 -0500"},"longitude":-111.5699387,"id":"advbt64kjclq","location":"Walnut Canyon Lakes"},"type":"Feature","geometry":{"type":"Point","coordinates":[-111.5699387,35.2028488]}},{"properties":{"latitude":33.4618165,"column_5":1,"date":{"end_time":"2009/11/12 00:00:00 -0500","original":"11/11/2009","granularity":"day","time":"2009/11/11 00:00:00 -0500"},"longitude":-111.9436349,"id":"advbt5pkjcbn","location":"Desert Botanical Garden"},"type":"Feature","geometry":{"type":"Point","coordinates":[-111.9436349,33.4618165]}},{"properties":{"latitude":34.8287647,"column_5":1,"date":{"end_time":"2009/11/14 00:00:00 -0500","original":"11/13/2009","granularity":"day","time":"2009/11/13 00:00:00 -0500"},"longitude":-111.7738545,"id":"advbt5x2vmz2","location":"Indian Cliffs"},"type":"Feature","geometry":{"type":"Point","coordinates":[-111.7738545,34.8287647]}},{"properties":{"latitude":34.3523709,"column_5":1,"date":{"end_time":"2009/11/19 00:00:00 -0500","original":"11/18/2009","granularity":"day","time":"2009/11/18 00:00:00 -0500"},"longitude":-119.3083361,"id":"advbt63yzgsc","location":"Foster Park Bridge"},"type":"Feature","geometry":{"type":"Point","coordinates":[-119.3083361,34.3523709]}},{"properties":{"latitude":35.7475386,"column_5":1,"date":{"end_time":"2009/11/20 00:00:00 -0500","original":"11/19/2009","granularity":"day","time":"2009/11/19 00:00:00 -0500"},"longitude":-119.5944929,"id":"advbt5yeiq2r","location":"Kern NWR"},"type":"Feature","geometry":{"type":"Point","coordinates":[-119.5944929,35.7475386]}},{"properties":{"latitude":35.9329036,"column_5":1,"date":{"end_time":"2009/11/20 00:00:00 -0500","original":"11/19/2009","granularity":"day","time":"2009/11/19 00:00:00 -0500"},"longitude":-119.5671237,"id":"advbt656hkbk","location":"6th and Utica - Kings County"},"type":"Feature","geometry":{"type":"Point","coordinates":[-119.5671237,35.9329036]}},{"properties":{"latitude":35.9671469,"column_5":1,"date":{"end_time":"2009/11/20 00:00:00 -0500","original":"11/19/2009","granularity":"day","time":"2009/11/19 00:00:00 -0500"},"longitude":-119.5718122,"id":"advbt63t7hlx","location":"Kings Co 6th Ave Random"},"type":"Feature","geometry":{"type":"Point","coordinates":[-119.5718122,35.9671469]}},{"properties":{"latitude":38.453987,"column_5":1,"date":{"end_time":"2009/11/21 00:00:00 -0500","original":"11/20/2009","granularity":"day","time":"2009/11/20 00:00:00 -0500"},"longitude":-121.47631,"id":"advbt5tcim76","location":"Sacramento Co. Bufferlands"},"type":"Feature","geometry":{"type":"Point","coordinates":[-121.47631,38.453987]}},{"properties":{"latitude":38.4087592,"column_5":1,"date":{"end_time":"2009/11/21 00:00:00 -0500","original":"11/20/2009","granularity":"day","time":"2009/11/20 00:00:00 -0500"},"longitude":-121.489284,"id":"advbt5xpb9ar","location":"Stone Lakes NWR"},"type":"Feature","geometry":{"type":"Point","coordinates":[-121.489284,38.4087592]}},{"properties":{"latitude":38.1576924,"column_5":1,"date":{"end_time":"2009/11/22 00:00:00 -0500","original":"11/21/2009","granularity":"day","time":"2009/11/21 00:00:00 -0500"},"longitude":-121.4437401,"id":"advbt5ws649a","location":"Woodbridge Ecological Reserve (Isenberg Crane Reserve)"},"type":"Feature","geometry":{"type":"Point","coordinates":[-121.4437401,38.1576924]}},{"properties":{"latitude":38.2658235,"column_5":1,"date":{"end_time":"2009/11/23 00:00:00 -0500","original":"11/22/2009","granularity":"day","time":"2009/11/22 00:00:00 -0500"},"longitude":-121.4394915,"id":"advbt5s2lve3","location":"Cosumnes River Preserve"},"type":"Feature","geometry":{"type":"Point","coordinates":[-121.4394915,38.2658235]}},{"properties":{"latitude":38.2446517,"column_5":1,"date":{"end_time":"2009/11/23 00:00:00 -0500","original":"11/22/2009","granularity":"day","time":"2009/11/22 00:00:00 -0500"},"longitude":-120.9992981,"id":"advbt5w900e4","location":"Camanche Parkway"},"type":"Feature","geometry":{"type":"Point","coordinates":[-120.9992981,38.2446517]}},{"properties":{"latitude":38.1975848,"column_5":1,"date":{"end_time":"2009/11/23 00:00:00 -0500","original":"11/22/2009","granularity":"day","time":"2009/11/22 00:00:00 -0500"},"longitude":-121.0638857,"id":"advbt5ubwtw4","location":"Hwy 12--pond"},"type":"Feature","geometry":{"type":"Point","coordinates":[-121.0638857,38.1975848]}},{"properties":{"latitude":36.8119469,"column_5":1,"date":{"end_time":"2009/11/24 00:00:00 -0500","original":"11/23/2009","granularity":"day","time":"2009/11/23 00:00:00 -0500"},"longitude":-121.7887588,"id":"advbt5u3w7kr","location":"Moss Landing Harbor--via Jetty Road etc"},"type":"Feature","geometry":{"type":"Point","coordinates":[-121.7887588,36.8119469]}},{"properties":{"latitude":34.2794682,"column_5":1,"date":{"end_time":"2009/11/28 00:00:00 -0500","original":"11/27/2009","granularity":"day","time":"2009/11/27 00:00:00 -0500"},"longitude":-119.2678828,"id":"advbt5tztx8e","location":"Random Ventura Co Poli"},"type":"Feature","geometry":{"type":"Point","coordinates":[-119.2678828,34.2794682]}},{"properties":{"latitude":34.2974716,"column_5":1,"date":{"end_time":"2009/11/28 00:00:00 -0500","original":"11/27/2009","granularity":"day","time":"2009/11/27 00:00:00 -0500"},"longitude":-119.17007,"id":"advbt61leh8i","location":"Woodside Linear Park"},"type":"Feature","geometry":{"type":"Point","coordinates":[-119.17007,34.2974716]}},{"properties":{"latitude":34.285062,"column_5":1,"date":{"end_time":"2009/11/28 00:00:00 -0500","original":"11/27/2009","granularity":"day","time":"2009/11/27 00:00:00 -0500"},"longitude":-119.2180259,"id":"advbt60ibnvx","location":"Random Ventura Co Foothill"},"type":"Feature","geometry":{"type":"Point","coordinates":[-119.2180259,34.285062]}},{"properties":{"latitude":34.2608447,"column_5":1,"date":{"end_time":"2009/11/29 00:00:00 -0500","original":"11/28/2009","granularity":"day","time":"2009/11/28 00:00:00 -0500"},"longitude":-119.2635725,"id":"advbt65g0119","location":"Random Ventura Co Harbor"},"type":"Feature","geometry":{"type":"Point","coordinates":[-119.2635725,34.2608447]}},{"properties":{"latitude":34.2452429,"column_5":1,"date":{"end_time":"2009/11/29 00:00:00 -0500","original":"11/28/2009","granularity":"day","time":"2009/11/28 00:00:00 -0500"},"longitude":-119.2235984,"id":"advbt64ok00a","location":"Random Ventura Co Olivas Park"},"type":"Feature","geometry":{"type":"Point","coordinates":[-119.2235984,34.2452429]}},{"properties":{"latitude":34.2676522,"column_5":1,"date":{"end_time":"2009/11/29 00:00:00 -0500","original":"11/28/2009","granularity":"day","time":"2009/11/28 00:00:00 -0500"},"longitude":-119.1934971,"id":"advbt5q1312p","location":"Random Ventura Co Ramelli at Telephone"},"type":"Feature","geometry":{"type":"Point","coordinates":[-119.1934971,34.2676522]}},{"properties":{"latitude":34.2828192,"column_5":1,"date":{"end_time":"2009/12/06 00:00:00 -0500","original":"12/5/2009","granularity":"day","time":"2009/12/05 00:00:00 -0500"},"longitude":-119.1981366,"id":"advbt5r6ybf0","location":"Harmon Barranca - N Linear Park"},"type":"Feature","geometry":{"type":"Point","coordinates":[-119.1981366,34.2828192]}},{"properties":{"latitude":34.2909302,"column_5":1,"date":{"end_time":"2009/12/06 00:00:00 -0500","original":"12/5/2009","granularity":"day","time":"2009/12/05 00:00:00 -0500"},"longitude":-119.2072088,"id":"advbt5ypa8b8","location":"Via Arroyo"},"type":"Feature","geometry":{"type":"Point","coordinates":[-119.2072088,34.2909302]}},{"properties":{"latitude":30.0215333,"column_5":1,"date":{"end_time":"2009/12/12 00:00:00 -0500","original":"12/11/2009","granularity":"day","time":"2009/12/11 00:00:00 -0500"},"longitude":-92.5068119,"id":"advbt5u67vuz","location":"Marie Michel Rd."},"type":"Feature","geometry":{"type":"Point","coordinates":[-92.5068119,30.0215333]}},{"properties":{"latitude":30.1395124,"column_5":1,"date":{"end_time":"2009/12/12 00:00:00 -0500","original":"12/11/2009","granularity":"day","time":"2009/12/11 00:00:00 -0500"},"longitude":-92.3623802,"id":"advbt630wbkc","location":"Hwy 13 N of Faulk Rd"},"type":"Feature","geometry":{"type":"Point","coordinates":[-92.3623802,30.1395124]}},{"properties":{"latitude":30.0819838,"column_5":1,"date":{"end_time":"2009/12/12 00:00:00 -0500","original":"12/11/2009","granularity":"day","time":"2009/12/11 00:00:00 -0500"},"longitude":-93.0793615,"id":"advbt5roy1hc","location":"Hwy 27 at Lionel DeRoun Rd"},"type":"Feature","geometry":{"type":"Point","coordinates":[-93.0793615,30.0819838]}},{"properties":{"latitude":34.3350378,"column_5":1,"date":{"end_time":"2009/12/17 00:00:00 -0500","original":"12/16/2009","granularity":"day","time":"2009/12/16 00:00:00 -0500"},"longitude":-119.1396904,"id":"advbt5we63bk","location":"Wheeler Canyon Rd."},"type":"Feature","geometry":{"type":"Point","coordinates":[-119.1396904,34.3350378]}},{"properties":{"latitude":34.3514187,"column_5":1,"date":{"end_time":"2009/12/17 00:00:00 -0500","original":"12/16/2009","granularity":"day","time":"2009/12/16 00:00:00 -0500"},"longitude":-119.079066,"id":"advbt5tgidnd","location":"Fagan Barranca"},"type":"Feature","geometry":{"type":"Point","coordinates":[-119.079066,34.3514187]}},{"properties":{"latitude":34.2542014,"column_5":1,"date":{"end_time":"2009/12/18 00:00:00 -0500","original":"12/17/2009","granularity":"day","time":"2009/12/17 00:00:00 -0500"},"longitude":-119.2683935,"id":"advbt5tk1y00","location":"Marina Park (VEN Co.)"},"type":"Feature","geometry":{"type":"Point","coordinates":[-119.2683935,34.2542014]}},{"properties":{"latitude":34.2019192,"column_5":1,"date":{"end_time":"2009/12/19 00:00:00 -0500","original":"12/18/2009","granularity":"day","time":"2009/12/18 00:00:00 -0500"},"longitude":-118.8541601,"id":"advbt6219ztw","location":"Conejo Creek North Park"},"type":"Feature","geometry":{"type":"Point","coordinates":[-118.8541601,34.2019192]}},{"properties":{"latitude":33.2046054,"column_5":1,"date":{"end_time":"2009/12/23 00:00:00 -0500","original":"12/22/2009","granularity":"day","time":"2009/12/22 00:00:00 -0500"},"longitude":-115.6097281,"id":"advbt65pzav3","location":"Salton Sea--end of Schrimpf Rd."},"type":"Feature","geometry":{"type":"Point","coordinates":[-115.6097281,33.2046054]}},{"properties":{"latitude":33.519188,"column_5":1,"date":{"end_time":"2009/12/23 00:00:00 -0500","original":"12/22/2009","granularity":"day","time":"2009/12/22 00:00:00 -0500"},"longitude":-115.9372401,"id":"advbt5un79g5","location":"Salton Sea--old Yacht Club"},"type":"Feature","geometry":{"type":"Point","coordinates":[-115.9372401,33.519188]}},{"properties":{"latitude":33.4762513,"column_5":1,"date":{"end_time":"2009/12/23 00:00:00 -0500","original":"12/22/2009","granularity":"day","time":"2009/12/22 00:00:00 -0500"},"longitude":-115.8892221,"id":"advbt5r66bsb","location":"Salton Sea--Corvina State Beach"},"type":"Feature","geometry":{"type":"Point","coordinates":[-115.8892221,33.4762513]}},{"properties":{"latitude":33.7081511,"column_5":1,"date":{"end_time":"2009/12/30 00:00:00 -0500","original":"12/29/2009","granularity":"day","time":"2009/12/29 00:00:00 -0500"},"longitude":-118.2768774,"id":"advbt5y6wsgl","location":"San Pedro Fishing Pier"},"type":"Feature","geometry":{"type":"Point","coordinates":[-118.2768774,33.7081511]}},{"properties":{"latitude":34.587915,"column_5":1,"date":{"end_time":"2009/12/30 00:00:00 -0500","original":"12/29/2009","granularity":"day","time":"2009/12/29 00:00:00 -0500"},"longitude":-120.0052321,"id":"advbt657pvlo","location":"Lone Star Ranch"},"type":"Feature","geometry":{"type":"Point","coordinates":[-120.0052321,34.587915]}},{"properties":{"latitude":34.8930417,"column_5":1,"date":{"end_time":"2009/12/30 00:00:00 -0500","original":"12/29/2009","granularity":"day","time":"2009/12/29 00:00:00 -0500"},"longitude":-120.5043125,"id":"advbt5wae6r0","location":"Laguna County Sanitation District--WTP (restricted access)"},"type":"Feature","geometry":{"type":"Point","coordinates":[-120.5043125,34.8930417]}},{"properties":{"latitude":30.1609214,"column_5":1,"date":{"end_time":"2010/01/03 00:00:00 -0500","original":"1/2/2010","granularity":"day","time":"2010/01/02 00:00:00 -0500"},"longitude":-92.1534866,"id":"advbt65hw61t","location":"Judice Park"},"type":"Feature","geometry":{"type":"Point","coordinates":[-92.1534866,30.1609214]}},{"properties":{"latitude":37.2255,"column_5":1,"date":{"end_time":"2010/01/06 00:00:00 -0500","original":"1/5/2010","granularity":"day","time":"2010/01/05 00:00:00 -0500"},"longitude":-122.409,"id":"advbt5v044n5","location":"Bean Hollow SB"},"type":"Feature","geometry":{"type":"Point","coordinates":[-122.409,37.2255]}},{"properties":{"latitude":37.2807153,"column_5":1,"date":{"end_time":"2010/01/06 00:00:00 -0500","original":"1/5/2010","granularity":"day","time":"2010/01/05 00:00:00 -0500"},"longitude":-122.4082077,"id":"advbt5z09d7g","location":"Cliffs N of Pescadero SB"},"type":"Feature","geometry":{"type":"Point","coordinates":[-122.4082077,37.2807153]}},{"properties":{"latitude":37.0968935,"column_5":1,"date":{"end_time":"2010/01/06 00:00:00 -0500","original":"1/5/2010","granularity":"day","time":"2010/01/05 00:00:00 -0500"},"longitude":-122.28001,"id":"advbt63b1y9p","location":"Waddell SB"},"type":"Feature","geometry":{"type":"Point","coordinates":[-122.28001,37.0968935]}},{"properties":{"latitude":38.5280245,"column_5":1,"date":{"end_time":"2010/01/06 00:00:00 -0500","original":"1/5/2010","granularity":"day","time":"2010/01/05 00:00:00 -0500"},"longitude":-122.8597641,"id":"advbt5sp6d19","location":"Riverfront County Park"},"type":"Feature","geometry":{"type":"Point","coordinates":[-122.8597641,38.5280245]}},{"properties":{"latitude":37.8037613,"column_5":1,"date":{"end_time":"2010/01/06 00:00:00 -0500","original":"1/5/2010","granularity":"day","time":"2010/01/05 00:00:00 -0500"},"longitude":-122.4774715,"id":"advbt5qegrpl","location":"Presidio--Battery Godfrey"},"type":"Feature","geometry":{"type":"Point","coordinates":[-122.4774715,37.8037613]}},{"properties":{"latitude":39.2355108,"column_5":1,"date":{"end_time":"2010/01/07 00:00:00 -0500","original":"1/6/2010","granularity":"day","time":"2010/01/06 00:00:00 -0500"},"longitude":-123.1729603,"id":"advbt65msz61","location":"Lake Mendocino--north end"},"type":"Feature","geometry":{"type":"Point","coordinates":[-123.1729603,39.2355108]}},{"properties":{"latitude":39.1255326,"column_5":1,"date":{"end_time":"2010/01/07 00:00:00 -0500","original":"1/6/2010","granularity":"day","time":"2010/01/06 00:00:00 -0500"},"longitude":-123.1620169,"id":"advbt5tczkys","location":"Beckstoffer Pond--Tindall Ranch Rd."},"type":"Feature","geometry":{"type":"Point","coordinates":[-123.1620169,39.1255326]}},{"properties":{"latitude":39.2779124,"column_5":1,"date":{"end_time":"2010/01/07 00:00:00 -0500","original":"1/6/2010","granularity":"day","time":"2010/01/06 00:00:00 -0500"},"longitude":-123.066659,"id":"advbt62mrt6n","location":"Burris Ln.--pond"},"type":"Feature","geometry":{"type":"Point","coordinates":[-123.066659,39.2779124]}},{"properties":{"latitude":39.1204554,"column_5":1,"date":{"end_time":"2010/01/07 00:00:00 -0500","original":"1/6/2010","granularity":"day","time":"2010/01/06 00:00:00 -0500"},"longitude":-123.1615019,"id":"advbt5x0tu3p","location":"Gielow Ln.--pond"},"type":"Feature","geometry":{"type":"Point","coordinates":[-123.1615019,39.1204554]}},{"properties":{"latitude":39.3862257,"column_5":1,"date":{"end_time":"2010/01/07 00:00:00 -0500","original":"1/6/2010","granularity":"day","time":"2010/01/06 00:00:00 -0500"},"longitude":-123.1165051,"id":"advbt5t8gmh2","location":"Van Arsdale Dam"},"type":"Feature","geometry":{"type":"Point","coordinates":[-123.1165051,39.3862257]}},{"properties":{"latitude":39.3025242,"column_5":1,"date":{"end_time":"2010/01/07 00:00:00 -0500","original":"1/6/2010","granularity":"day","time":"2010/01/06 00:00:00 -0500"},"longitude":-123.1088448,"id":"advbt63manjn","location":"Potter Valley--pond north of cemetery"},"type":"Feature","geometry":{"type":"Point","coordinates":[-123.1088448,39.3025242]}},{"properties":{"latitude":39.2779872,"column_5":1,"date":{"end_time":"2010/01/07 00:00:00 -0500","original":"1/6/2010","granularity":"day","time":"2010/01/06 00:00:00 -0500"},"longitude":-123.0865717,"id":"advbt63axhzq","location":"Burris Ln."},"type":"Feature","geometry":{"type":"Point","coordinates":[-123.0865717,39.2779872]}},{"properties":{"latitude":39.2788709,"column_5":1,"date":{"end_time":"2010/01/07 00:00:00 -0500","original":"1/6/2010","granularity":"day","time":"2010/01/06 00:00:00 -0500"},"longitude":-123.0937741,"id":"advbt5sna80a","location":"Potter Valley - Brady Farm"},"type":"Feature","geometry":{"type":"Point","coordinates":[-123.0937741,39.2788709]}},{"properties":{"latitude":39.297576,"column_5":1,"date":{"end_time":"2010/01/07 00:00:00 -0500","original":"1/6/2010","granularity":"day","time":"2010/01/06 00:00:00 -0500"},"longitude":-123.1078792,"id":"advbt5tfz56n","location":"Potter Valley Cemetery"},"type":"Feature","geometry":{"type":"Point","coordinates":[-123.1078792,39.297576]}},{"properties":{"latitude":39.3488346,"column_5":1,"date":{"end_time":"2010/01/07 00:00:00 -0500","original":"1/6/2010","granularity":"day","time":"2010/01/06 00:00:00 -0500"},"longitude":-123.1497002,"id":"advbt63ody6y","location":"Potter Valley Rodeo Grounds"},"type":"Feature","geometry":{"type":"Point","coordinates":[-123.1497002,39.3488346]}},{"properties":{"latitude":39.3818639,"column_5":1,"date":{"end_time":"2010/01/07 00:00:00 -0500","original":"1/6/2010","granularity":"day","time":"2010/01/06 00:00:00 -0500"},"longitude":-123.0983305,"id":"advbt62y7xsl","location":"Eel River--Pioneer Bridge"},"type":"Feature","geometry":{"type":"Point","coordinates":[-123.0983305,39.3818639]}},{"properties":{"latitude":40.7260554,"column_5":1,"date":{"end_time":"2010/01/08 00:00:00 -0500","original":"1/7/2010","granularity":"day","time":"2010/01/07 00:00:00 -0500"},"longitude":-124.2211032,"id":"advbt5ud9t1a","location":"Humboldt Bay--Fields Landing Boat Ramp"},"type":"Feature","geometry":{"type":"Point","coordinates":[-124.2211032,40.7260554]}},{"properties":{"latitude":40.8584622,"column_5":1,"date":{"end_time":"2010/01/08 00:00:00 -0500","original":"1/7/2010","granularity":"day","time":"2010/01/07 00:00:00 -0500"},"longitude":-124.0905225,"id":"advbt5w9lzug","location":"Arcata Marsh-Log Pond"},"type":"Feature","geometry":{"type":"Point","coordinates":[-124.0905225,40.8584622]}},{"properties":{"latitude":41.7446766,"column_5":1,"date":{"end_time":"2010/01/08 00:00:00 -0500","original":"1/7/2010","granularity":"day","time":"2010/01/07 00:00:00 -0500"},"longitude":-124.1870499,"id":"advbt61vt7vo","location":"Crescent City Harbor"},"type":"Feature","geometry":{"type":"Point","coordinates":[-124.1870499,41.7446766]}},{"properties":{"latitude":41.7439081,"column_5":1,"date":{"end_time":"2010/01/08 00:00:00 -0500","original":"1/7/2010","granularity":"day","time":"2010/01/07 00:00:00 -0500"},"longitude":-124.1976929,"id":"advbt61l4zo9","location":"Crescent City Harbor--B Street Pier"},"type":"Feature","geometry":{"type":"Point","coordinates":[-124.1976929,41.7439081]}},{"properties":{"latitude":41.7487337,"column_5":1,"date":{"end_time":"2010/01/08 00:00:00 -0500","original":"1/7/2010","granularity":"day","time":"2010/01/07 00:00:00 -0500"},"longitude":-124.2062952,"id":"advbt5tljgex","location":"Crescent City--end of 4th St"},"type":"Feature","geometry":{"type":"Point","coordinates":[-124.2062952,41.7487337]}},{"properties":{"latitude":40.7643076,"column_5":1,"date":{"end_time":"2010/01/08 00:00:00 -0500","original":"1/7/2010","granularity":"day","time":"2010/01/07 00:00:00 -0500"},"longitude":-124.243505,"id":"advbt615y4lt","location":"Humboldt Bay--South Spit jetty"},"type":"Feature","geometry":{"type":"Point","coordinates":[-124.243505,40.7643076]}},{"properties":{"latitude":40.7251448,"column_5":1,"date":{"end_time":"2010/01/08 00:00:00 -0500","original":"1/7/2010","granularity":"day","time":"2010/01/07 00:00:00 -0500"},"longitude":-124.2533112,"id":"advbt64u5t2j","location":"Humboldt Bay--South Spit"},"type":"Feature","geometry":{"type":"Point","coordinates":[-124.2533112,40.7251448]}},{"properties":{"latitude":40.8652213,"column_5":1,"date":{"end_time":"2010/01/08 00:00:00 -0500","original":"1/7/2010","granularity":"day","time":"2010/01/07 00:00:00 -0500"},"longitude":-124.1497993,"id":"advbt60m8p2k","location":"Humboldt Bay--Mad River Slough"},"type":"Feature","geometry":{"type":"Point","coordinates":[-124.1497993,40.8652213]}},{"properties":{"latitude":41.5122034,"column_5":1,"date":{"end_time":"2010/01/08 00:00:00 -0500","original":"1/7/2010","granularity":"day","time":"2010/01/07 00:00:00 -0500"},"longitude":-124.0322573,"id":"advbt63xo9sb","location":"Klamath Beach Rd"},"type":"Feature","geometry":{"type":"Point","coordinates":[-124.0322573,41.5122034]}},{"properties":{"latitude":40.6688801,"column_5":1,"date":{"end_time":"2010/01/08 00:00:00 -0500","original":"1/7/2010","granularity":"day","time":"2010/01/07 00:00:00 -0500"},"longitude":-124.1968668,"id":"advbt624yhr8","location":"Holgerson Dairy"},"type":"Feature","geometry":{"type":"Point","coordinates":[-124.1968668,40.6688801]}},{"properties":{"latitude":40.8109185,"column_5":1,"date":{"end_time":"2010/01/08 00:00:00 -0500","original":"1/7/2010","granularity":"day","time":"2010/01/07 00:00:00 -0500"},"longitude":-124.1588545,"id":"advbt5zjvmj9","location":"Woodley Island-Entrance"},"type":"Feature","geometry":{"type":"Point","coordinates":[-124.1588545,40.8109185]}},{"properties":{"latitude":40.6966889,"column_5":1,"date":{"end_time":"2010/01/08 00:00:00 -0500","original":"1/7/2010","granularity":"day","time":"2010/01/07 00:00:00 -0500"},"longitude":-124.275552,"id":"advbt64sftd4","location":"Table Bluff overlook"},"type":"Feature","geometry":{"type":"Point","coordinates":[-124.275552,40.6966889]}},{"properties":{"latitude":43.1222404,"column_5":1,"date":{"end_time":"2010/01/09 00:00:00 -0500","original":"1/8/2010","granularity":"day","time":"2010/01/08 00:00:00 -0500"},"longitude":-124.4282663,"id":"advbt5y4xsca","location":"Coquille River--South Jetty"},"type":"Feature","geometry":{"type":"Point","coordinates":[-124.4282663,43.1222404]}},{"properties":{"latitude":42.9038274,"column_5":1,"date":{"end_time":"2010/01/09 00:00:00 -0500","original":"1/8/2010","granularity":"day","time":"2010/01/08 00:00:00 -0500"},"longitude":-124.5049667,"id":"advbt5wfq6km","location":"Floras Lake"},"type":"Feature","geometry":{"type":"Point","coordinates":[-124.5049667,42.9038274]}},{"properties":{"latitude":43.1162521,"column_5":1,"date":{"end_time":"2010/01/09 00:00:00 -0500","original":"1/8/2010","granularity":"day","time":"2010/01/08 00:00:00 -0500"},"longitude":-124.4327793,"id":"advbt5yvrwqi","location":"Bandon--End of 8th St"},"type":"Feature","geometry":{"type":"Point","coordinates":[-124.4327793,43.1162521]}},{"properties":{"latitude":42.068482,"column_5":1,"date":{"end_time":"2010/01/09 00:00:00 -0500","original":"1/8/2010","granularity":"day","time":"2010/01/08 00:00:00 -0500"},"longitude":-124.3106461,"id":"advbt5r1ld7n","location":"Harris Beach SP"},"type":"Feature","geometry":{"type":"Point","coordinates":[-124.3106461,42.068482]}},{"properties":{"latitude":42.4219676,"column_5":1,"date":{"end_time":"2010/01/09 00:00:00 -0500","original":"1/8/2010","granularity":"day","time":"2010/01/08 00:00:00 -0500"},"longitude":-124.4292641,"id":"advbt6532fzu","location":"Rogue River mouth"},"type":"Feature","geometry":{"type":"Point","coordinates":[-124.4292641,42.4219676]}},{"properties":{"latitude":42.0658404,"column_5":1,"date":{"end_time":"2010/01/09 00:00:00 -0500","original":"1/8/2010","granularity":"day","time":"2010/01/08 00:00:00 -0500"},"longitude":-124.3026119,"id":"advbt610s7vn","location":"Brookings Rest Area"},"type":"Feature","geometry":{"type":"Point","coordinates":[-124.3026119,42.0658404]}},{"properties":{"latitude":42.0510161,"column_5":1,"date":{"end_time":"2010/01/09 00:00:00 -0500","original":"1/8/2010","granularity":"day","time":"2010/01/08 00:00:00 -0500"},"longitude":-124.2932524,"id":"advbt62s1deo","location":"Brookings--Mill Beach Rd"},"type":"Feature","geometry":{"type":"Point","coordinates":[-124.2932524,42.0510161]}},{"properties":{"latitude":44.6231604,"column_5":1,"date":{"end_time":"2010/01/10 00:00:00 -0500","original":"1/9/2010","granularity":"day","time":"2010/01/09 00:00:00 -0500"},"longitude":-124.0434766,"id":"advbt5wbp5zs","location":"Mark Hatfield Marine Science Center"},"type":"Feature","geometry":{"type":"Point","coordinates":[-124.0434766,44.6231604]}},{"properties":{"latitude":45.1634665,"column_5":1,"date":{"end_time":"2010/01/10 00:00:00 -0500","original":"1/9/2010","granularity":"day","time":"2010/01/09 00:00:00 -0500"},"longitude":-123.951399,"id":"advbt64p65yr","location":"Nestucca Bay NWR"},"type":"Feature","geometry":{"type":"Point","coordinates":[-123.951399,45.1634665]}},{"properties":{"latitude":44.6262136,"column_5":1,"date":{"end_time":"2010/01/10 00:00:00 -0500","original":"1/9/2010","granularity":"day","time":"2010/01/09 00:00:00 -0500"},"longitude":-124.0254092,"id":"advbt5rb8y7e","location":"Yaquina Bay--Sally's Bend-LNG Facility"},"type":"Feature","geometry":{"type":"Point","coordinates":[-124.0254092,44.6262136]}},{"properties":{"latitude":44.6158891,"column_5":1,"date":{"end_time":"2010/01/10 00:00:00 -0500","original":"1/9/2010","granularity":"day","time":"2010/01/09 00:00:00 -0500"},"longitude":-124.0618658,"id":"advbt5w2p5fg","location":"Yaquina River--SE Jetty Way"},"type":"Feature","geometry":{"type":"Point","coordinates":[-124.0618658,44.6158891]}},{"properties":{"latitude":44.8314957,"column_5":1,"date":{"end_time":"2010/01/10 00:00:00 -0500","original":"1/9/2010","granularity":"day","time":"2010/01/09 00:00:00 -0500"},"longitude":-124.0638399,"id":"advbt5wb2uk9","location":"Boiler Bay"},"type":"Feature","geometry":{"type":"Point","coordinates":[-124.0638399,44.8314957]}},{"properties":{"latitude":44.6326069,"column_5":1,"date":{"end_time":"2010/01/10 00:00:00 -0500","original":"1/9/2010","granularity":"day","time":"2010/01/09 00:00:00 -0500"},"longitude":-124.0466715,"id":"advbt5qo98mj","location":"Newport--Bay and Eads"},"type":"Feature","geometry":{"type":"Point","coordinates":[-124.0466715,44.6326069]}},{"properties":{"latitude":46.6665913,"column_5":1,"date":{"end_time":"2010/01/11 00:00:00 -0500","original":"1/10/2010","granularity":"day","time":"2010/01/10 00:00:00 -0500"},"longitude":-123.8112465,"id":"advbt5s6899m","location":"Raymond--Coast Seafood"},"type":"Feature","geometry":{"type":"Point","coordinates":[-123.8112465,46.6665913]}},{"properties":{"latitude":48.4985214,"column_5":1,"date":{"end_time":"2010/01/11 00:00:00 -0500","original":"1/10/2010","granularity":"day","time":"2010/01/10 00:00:00 -0500"},"longitude":-122.6997757,"id":"advbt6433otb","location":"Washington Park"},"type":"Feature","geometry":{"type":"Point","coordinates":[-122.6997757,48.4985214]}},{"properties":{"latitude":48.3867722,"column_5":1,"date":{"end_time":"2010/01/12 00:00:00 -0500","original":"1/11/2010","granularity":"day","time":"2010/01/11 00:00:00 -0500"},"longitude":-122.4222243,"id":"advbt6569b2w","location":"Skagit Flats--Bradshaw Rd"},"type":"Feature","geometry":{"type":"Point","coordinates":[-122.4222243,48.3867722]}},{"properties":{"latitude":48.3989118,"column_5":1,"date":{"end_time":"2010/01/12 00:00:00 -0500","original":"1/11/2010","granularity":"day","time":"2010/01/11 00:00:00 -0500"},"longitude":-122.4321806,"id":"advbt64x4pc0","location":"Skagit Flats--Calhoun Rd"},"type":"Feature","geometry":{"type":"Point","coordinates":[-122.4321806,48.3989118]}},{"properties":{"latitude":48.3657063,"column_5":1,"date":{"end_time":"2010/01/12 00:00:00 -0500","original":"1/11/2010","granularity":"day","time":"2010/01/11 00:00:00 -0500"},"longitude":-122.4171603,"id":"advbt60nzwth","location":"Skagit Flats--Summers Dr"},"type":"Feature","geometry":{"type":"Point","coordinates":[-122.4171603,48.3657063]}},{"properties":{"latitude":48.4209797,"column_5":1,"date":{"end_time":"2010/01/12 00:00:00 -0500","original":"1/11/2010","granularity":"day","time":"2010/01/11 00:00:00 -0500"},"longitude":-122.4008359,"id":"advbt5qzzq36","location":"Skagit Flats--Beaver Marsh Rd"},"type":"Feature","geometry":{"type":"Point","coordinates":[-122.4008359,48.4209797]}},{"properties":{"latitude":48.4085701,"column_5":1,"date":{"end_time":"2010/01/12 00:00:00 -0500","original":"1/11/2010","granularity":"day","time":"2010/01/11 00:00:00 -0500"},"longitude":-122.4437249,"id":"advbt5yzjoy6","location":"Skagit Flats--Best Rd"},"type":"Feature","geometry":{"type":"Point","coordinates":[-122.4437249,48.4085701]}},{"properties":{"latitude":48.4064809,"column_5":1,"date":{"end_time":"2010/01/12 00:00:00 -0500","original":"1/11/2010","granularity":"day","time":"2010/01/11 00:00:00 -0500"},"longitude":-122.3844248,"id":"advbt63dar0y","location":"Skagit Flats--Jungquist Rd"},"type":"Feature","geometry":{"type":"Point","coordinates":[-122.3844248,48.4064809]}},{"properties":{"latitude":48.3993107,"column_5":1,"date":{"end_time":"2010/01/12 00:00:00 -0500","original":"1/11/2010","granularity":"day","time":"2010/01/11 00:00:00 -0500"},"longitude":-122.3662627,"id":"advbt64u649f","location":"Skagit Flats--Penn Rd"},"type":"Feature","geometry":{"type":"Point","coordinates":[-122.3662627,48.3993107]}},{"properties":{"latitude":48.4208184,"column_5":1,"date":{"end_time":"2010/01/12 00:00:00 -0500","original":"1/11/2010","granularity":"day","time":"2010/01/11 00:00:00 -0500"},"longitude":-122.4567711,"id":"advbt5uxtpwb","location":"Skagit Flats--McLean Rd"},"type":"Feature","geometry":{"type":"Point","coordinates":[-122.4567711,48.4208184]}},{"properties":{"latitude":48.436694,"column_5":1,"date":{"end_time":"2010/01/12 00:00:00 -0500","original":"1/11/2010","granularity":"day","time":"2010/01/11 00:00:00 -0500"},"longitude":-122.371147,"id":"advbt610t1nq","location":"Skagit Flats--River Bend Rd"},"type":"Feature","geometry":{"type":"Point","coordinates":[-122.371147,48.436694]}},{"properties":{"latitude":48.3901351,"column_5":1,"date":{"end_time":"2010/01/12 00:00:00 -0500","original":"1/11/2010","granularity":"day","time":"2010/01/11 00:00:00 -0500"},"longitude":-122.3842871,"id":"advbt622f4e1","location":"Skagit Flats--Kamb Rd"},"type":"Feature","geometry":{"type":"Point","coordinates":[-122.3842871,48.3901351]}},{"properties":{"latitude":48.5541192,"column_5":1,"date":{"end_time":"2010/01/13 00:00:00 -0500","original":"1/12/2010","granularity":"day","time":"2010/01/12 00:00:00 -0500"},"longitude":-122.4549499,"id":"advbt5rmw146","location":"Samish Flats--Bayview Edison Rd at Samish River"},"type":"Feature","geometry":{"type":"Point","coordinates":[-122.4549499,48.5541192]}},{"properties":{"latitude":48.5451988,"column_5":1,"date":{"end_time":"2010/01/13 00:00:00 -0500","original":"1/12/2010","granularity":"day","time":"2010/01/12 00:00:00 -0500"},"longitude":-122.4198774,"id":"advbt5xb9i67","location":"Samish Flats--Sunset Rd"},"type":"Feature","geometry":{"type":"Point","coordinates":[-122.4198774,48.5451988]}},{"properties":{"latitude":48.5728456,"column_5":1,"date":{"end_time":"2010/01/13 00:00:00 -0500","original":"1/12/2010","granularity":"day","time":"2010/01/12 00:00:00 -0500"},"longitude":-122.5308866,"id":"advbt5so2v7t","location":"Samish Island"},"type":"Feature","geometry":{"type":"Point","coordinates":[-122.5308866,48.5728456]}},{"properties":{"latitude":48.5306834,"column_5":1,"date":{"end_time":"2010/01/13 00:00:00 -0500","original":"1/12/2010","granularity":"day","time":"2010/01/12 00:00:00 -0500"},"longitude":-122.4270397,"id":"advbt5xi4z0x","location":"Samish Flats--Field Rd"},"type":"Feature","geometry":{"type":"Point","coordinates":[-122.4270397,48.5306834]}},{"properties":{"latitude":48.5476481,"column_5":1,"date":{"end_time":"2010/01/13 00:00:00 -0500","original":"1/12/2010","granularity":"day","time":"2010/01/12 00:00:00 -0500"},"longitude":-122.4876237,"id":"advbt62r4w1r","location":"Samish Flats--West 90"},"type":"Feature","geometry":{"type":"Point","coordinates":[-122.4876237,48.5476481]}},{"properties":{"latitude":48.4400773,"column_5":1,"date":{"end_time":"2010/01/14 00:00:00 -0500","original":"1/13/2010","granularity":"day","time":"2010/01/13 00:00:00 -0500"},"longitude":-122.4980307,"id":"advbt5xf8ldf","location":"Channel Drive"},"type":"Feature","geometry":{"type":"Point","coordinates":[-122.4980307,48.4400773]}},{"properties":{"latitude":48.3394212,"column_5":1,"date":{"end_time":"2010/01/14 00:00:00 -0500","original":"1/13/2010","granularity":"day","time":"2010/01/13 00:00:00 -0500"},"longitude":-122.4120712,"id":"advbt5y8nmlh","location":"Hayton Reserve"},"type":"Feature","geometry":{"type":"Point","coordinates":[-122.4120712,48.3394212]}},{"properties":{"latitude":48.5134773,"column_5":1,"date":{"end_time":"2010/01/14 00:00:00 -0500","original":"1/13/2010","granularity":"day","time":"2010/01/13 00:00:00 -0500"},"longitude":-122.6010704,"id":"advbt5y7u3lk","location":"Cap Sant Park"},"type":"Feature","geometry":{"type":"Point","coordinates":[-122.6010704,48.5134773]}},{"properties":{"latitude":48.3495851,"column_5":1,"date":{"end_time":"2010/01/15 00:00:00 -0500","original":"1/14/2010","granularity":"day","time":"2010/01/14 00:00:00 -0500"},"longitude":-122.3848969,"id":"advbt5vidaoh","location":"Skagit Flats--Dry Slough Rd"},"type":"Feature","geometry":{"type":"Point","coordinates":[-122.3848969,48.3495851]}},{"properties":{"latitude":48.2391899,"column_5":1,"date":{"end_time":"2010/01/15 00:00:00 -0500","original":"1/14/2010","granularity":"day","time":"2010/01/14 00:00:00 -0500"},"longitude":-122.348801,"id":"advbt5tag7e2","location":"Stanwood Park and Ride"},"type":"Feature","geometry":{"type":"Point","coordinates":[-122.348801,48.2391899]}},{"properties":{"latitude":48.5084309,"column_5":1,"date":{"end_time":"2010/01/17 00:00:00 -0500","original":"1/16/2010","granularity":"day","time":"2010/01/16 00:00:00 -0500"},"longitude":-122.627517,"id":"advbt5rshsur","location":"Volunteer Park (Anacortes)"},"type":"Feature","geometry":{"type":"Point","coordinates":[-122.627517,48.5084309]}},{"properties":{"latitude":48.0623184,"column_5":1,"date":{"end_time":"2010/01/18 00:00:00 -0500","original":"1/17/2010","granularity":"day","time":"2010/01/17 00:00:00 -0500"},"longitude":-123.0416377,"id":"advbt606j3ki","location":"John Wayne Marina"},"type":"Feature","geometry":{"type":"Point","coordinates":[-123.0416377,48.0623184]}},{"properties":{"latitude":48.1442626,"column_5":1,"date":{"end_time":"2010/01/18 00:00:00 -0500","original":"1/17/2010","granularity":"day","time":"2010/01/17 00:00:00 -0500"},"longitude":-122.7539778,"id":"advbt5vgtje0","location":"Point Wilson"},"type":"Feature","geometry":{"type":"Point","coordinates":[-122.7539778,48.1442626]}},{"properties":{"latitude":48.1308379,"column_5":1,"date":{"end_time":"2010/01/18 00:00:00 -0500","original":"1/17/2010","granularity":"day","time":"2010/01/17 00:00:00 -0500"},"longitude":-123.1480694,"id":"advbt64lkx24","location":"Olympic Game Farm"},"type":"Feature","geometry":{"type":"Point","coordinates":[-123.1480694,48.1308379]}},{"properties":{"latitude":48.1374564,"column_5":1,"date":{"end_time":"2010/01/18 00:00:00 -0500","original":"1/17/2010","granularity":"day","time":"2010/01/17 00:00:00 -0500"},"longitude":-122.7817257,"id":"advbt5wr69gj","location":"City of Port Townsend Dept of Public Works"},"type":"Feature","geometry":{"type":"Point","coordinates":[-122.7817257,48.1374564]}},{"properties":{"latitude":48.14035,"column_5":1,"date":{"end_time":"2010/01/18 00:00:00 -0500","original":"1/17/2010","granularity":"day","time":"2010/01/17 00:00:00 -0500"},"longitude":-123.44711,"id":"advbt5qdyfe9","location":"Ediz Hook"},"type":"Feature","geometry":{"type":"Point","coordinates":[-123.44711,48.14035]}},{"properties":{"latitude":48.1358502,"column_5":1,"date":{"end_time":"2010/01/18 00:00:00 -0500","original":"1/17/2010","granularity":"day","time":"2010/01/17 00:00:00 -0500"},"longitude":-122.7138519,"id":"advbt5xe0fji","location":"Port Townsend-Keystone Ferry"},"type":"Feature","geometry":{"type":"Point","coordinates":[-122.7138519,48.1358502]}},{"properties":{"latitude":48.0636236,"column_5":1,"date":{"end_time":"2010/01/18 00:00:00 -0500","original":"1/17/2010","granularity":"day","time":"2010/01/17 00:00:00 -0500"},"longitude":-123.4262529,"id":"advbt62xaz7x","location":"Hurricane Ridge Rd - Lower"},"type":"Feature","geometry":{"type":"Point","coordinates":[-123.4262529,48.0636236]}},{"properties":{"latitude":48.1221831,"column_5":1,"date":{"end_time":"2010/01/18 00:00:00 -0500","original":"1/17/2010","granularity":"day","time":"2010/01/17 00:00:00 -0500"},"longitude":-123.4363215,"id":"advbt638xzvb","location":"Port Angeles City Pier"},"type":"Feature","geometry":{"type":"Point","coordinates":[-123.4363215,48.1221831]}},{"properties":{"latitude":48.4988626,"column_5":1,"date":{"end_time":"2010/01/19 00:00:00 -0500","original":"1/18/2010","granularity":"day","time":"2010/01/18 00:00:00 -0500"},"longitude":-122.5581551,"id":"advbt5zznb9f","location":"March Point"},"type":"Feature","geometry":{"type":"Point","coordinates":[-122.5581551,48.4988626]}},{"properties":{"latitude":48.4000277,"column_5":1,"date":{"end_time":"2010/01/20 00:00:00 -0500","original":"1/19/2010","granularity":"day","time":"2010/01/19 00:00:00 -0500"},"longitude":-122.6643831,"id":"advbt5wgh4ov","location":"Deception Pass SP -- West Beach"},"type":"Feature","geometry":{"type":"Point","coordinates":[-122.6643831,48.4000277]}},{"properties":{"latitude":46.6983637,"column_5":1,"date":{"end_time":"2010/01/21 00:00:00 -0500","original":"1/20/2010","granularity":"day","time":"2010/01/20 00:00:00 -0500"},"longitude":-120.4447899,"id":"advbt5whakgb","location":"Selah Canyon Rest Area"},"type":"Feature","geometry":{"type":"Point","coordinates":[-120.4447899,46.6983637]}},{"properties":{"latitude":46.2642338,"column_5":1,"date":{"end_time":"2010/01/23 00:00:00 -0500","original":"1/22/2010","granularity":"day","time":"2010/01/22 00:00:00 -0500"},"longitude":-119.3065703,"id":"advbt5vl1zgo","location":"Yakima River--Duportail Access"},"type":"Feature","geometry":{"type":"Point","coordinates":[-119.3065703,46.2642338]}},{"properties":{"latitude":46.2658434,"column_5":1,"date":{"end_time":"2010/01/23 00:00:00 -0500","original":"1/22/2010","granularity":"day","time":"2010/01/22 00:00:00 -0500"},"longitude":-119.3053928,"id":"advbt5vkafmk","location":"Riverpointe Apartments, Richland"},"type":"Feature","geometry":{"type":"Point","coordinates":[-119.3053928,46.2658434]}},{"properties":{"latitude":33.5097926,"column_5":1,"date":{"end_time":"2010/01/29 00:00:00 -0500","original":"1/28/2010","granularity":"day","time":"2010/01/28 00:00:00 -0500"},"longitude":-111.9945681,"id":"advbt5t75jqx","location":"Arizona Canal"},"type":"Feature","geometry":{"type":"Point","coordinates":[-111.9945681,33.5097926]}},{"properties":{"latitude":34.2873328,"column_5":1,"date":{"end_time":"2010/02/04 00:00:00 -0500","original":"2/3/2010","granularity":"day","time":"2010/02/03 00:00:00 -0500"},"longitude":-119.2917104,"id":"advbt63c65ds","location":"Grant Park"},"type":"Feature","geometry":{"type":"Point","coordinates":[-119.2917104,34.2873328]}},{"properties":{"latitude":34.1472694,"column_5":1,"date":{"end_time":"2010/02/08 00:00:00 -0500","original":"2/7/2010","granularity":"day","time":"2010/02/07 00:00:00 -0500"},"longitude":-118.290115,"id":"advbt5s2r0nk","location":"Los Angeles Zoo"},"type":"Feature","geometry":{"type":"Point","coordinates":[-118.290115,34.1472694]}},{"properties":{"latitude":34.3951537,"column_5":1,"date":{"end_time":"2010/02/14 00:00:00 -0500","original":"2/13/2010","granularity":"day","time":"2010/02/13 00:00:00 -0500"},"longitude":-119.3388176,"id":"advbt64v2f1q","location":"Lake Casitas"},"type":"Feature","geometry":{"type":"Point","coordinates":[-119.3388176,34.3951537]}},{"properties":{"latitude":34.4327617,"column_5":1,"date":{"end_time":"2010/02/14 00:00:00 -0500","original":"2/13/2010","granularity":"day","time":"2010/02/13 00:00:00 -0500"},"longitude":-119.9170804,"id":"advbt5q15kfr","location":"SBA Night Heron spot by Sandpiper Golf Course"},"type":"Feature","geometry":{"type":"Point","coordinates":[-119.9170804,34.4327617]}},{"properties":{"latitude":33.496,"column_5":1,"date":{"end_time":"2010/02/17 00:00:00 -0500","original":"2/16/2010","granularity":"day","time":"2010/02/16 00:00:00 -0500"},"longitude":-111.91,"id":"advbt661qwpz","location":"Scottsdale--Indian School Park"},"type":"Feature","geometry":{"type":"Point","coordinates":[-111.91,33.496]}},{"properties":{"latitude":33.5324095,"column_5":1,"date":{"end_time":"2010/02/17 00:00:00 -0500","original":"2/16/2010","granularity":"day","time":"2010/02/16 00:00:00 -0500"},"longitude":-112.036517,"id":"advbt5xycscq","location":"Granada Park"},"type":"Feature","geometry":{"type":"Point","coordinates":[-112.036517,33.5324095]}},{"properties":{"latitude":34.1177736,"column_5":1,"date":{"end_time":"2010/02/21 00:00:00 -0500","original":"2/20/2010","granularity":"day","time":"2010/02/20 00:00:00 -0500"},"longitude":-119.1360855,"id":"advbt5tsiprx","location":"Ventura County Game Preserve"},"type":"Feature","geometry":{"type":"Point","coordinates":[-119.1360855,34.1177736]}},{"properties":{"latitude":9.9405619,"column_5":1,"date":{"end_time":"2010/03/04 00:00:00 -0500","original":"3/3/2010","granularity":"day","time":"2010/03/03 00:00:00 -0500"},"longitude":-84.0685335,"id":"advbt5wmdbjj","location":"Aranjuez Parque Atletico"},"type":"Feature","geometry":{"type":"Point","coordinates":[-84.0685335,9.9405619]}},{"properties":{"latitude":10.3034348,"column_5":1,"date":{"end_time":"2010/03/23 00:00:00 -0400","original":"3/22/2010","granularity":"day","time":"2010/03/22 00:00:00 -0400"},"longitude":-84.0351105,"id":"advbt60sjz65","location":"El Plastico"},"type":"Feature","geometry":{"type":"Point","coordinates":[-84.0351105,10.3034348]}},{"properties":{"latitude":10.4462789,"column_5":1,"date":{"end_time":"2010/04/12 00:00:00 -0400","original":"4/11/2010","granularity":"day","time":"2010/04/11 00:00:00 -0400"},"longitude":-84.1054827,"id":"advbt64i29qb","location":"Rio Sarapiqui bajo Chilamate"},"type":"Feature","geometry":{"type":"Point","coordinates":[-84.1054827,10.4462789]}},{"properties":{"latitude":10.602303,"column_5":1,"date":{"end_time":"2010/04/14 00:00:00 -0400","original":"4/13/2010","granularity":"day","time":"2010/04/13 00:00:00 -0400"},"longitude":-83.5701048,"id":"advbt5yuexgp","location":"Canals from Tortuguero to Pavona"},"type":"Feature","geometry":{"type":"Point","coordinates":[-83.5701048,10.602303]}},{"properties":{"latitude":10.3256329,"column_5":1,"date":{"end_time":"2010/05/03 00:00:00 -0400","original":"5/2/2010","granularity":"day","time":"2010/05/02 00:00:00 -0400"},"longitude":-84.0231049,"id":"advbt60yclr4","location":"Road to Rara Avis - Between Lecheria and Yatama"},"type":"Feature","geometry":{"type":"Point","coordinates":[-84.0231049,10.3256329]}},{"properties":{"latitude":10.1609413,"column_5":1,"date":{"end_time":"2010/05/17 00:00:00 -0400","original":"5/16/2010","granularity":"day","time":"2010/05/16 00:00:00 -0400"},"longitude":-83.9376926,"id":"advbt5q84nwa","location":"PN Braulio Carrillo--Quebrada Gonzalez"},"type":"Feature","geometry":{"type":"Point","coordinates":[-83.9376926,10.1609413]}},{"properties":{"latitude":10.1743758,"column_5":1,"date":{"end_time":"2010/05/17 00:00:00 -0400","original":"5/16/2010","granularity":"day","time":"2010/05/16 00:00:00 -0400"},"longitude":-83.9303423,"id":"advbt5wtilw3","location":"Jardin de Colibris"},"type":"Feature","geometry":{"type":"Point","coordinates":[-83.9303423,10.1743758]}},{"properties":{"latitude":34.0703534,"column_5":1,"date":{"end_time":"2010/05/19 00:00:00 -0400","original":"5/18/2010","granularity":"day","time":"2010/05/18 00:00:00 -0400"},"longitude":-119.0137446,"id":"advbt5vkanrh","location":"Sycamore Cove"},"type":"Feature","geometry":{"type":"Point","coordinates":[-119.0137446,34.0703534]}},{"properties":{"latitude":34.2616856,"column_5":1,"date":{"end_time":"2010/05/20 00:00:00 -0400","original":"5/19/2010","granularity":"day","time":"2010/05/19 00:00:00 -0400"},"longitude":-119.2334175,"id":"advbt5txfv8k","location":"Kinko's Shoppin Center - Ventura"},"type":"Feature","geometry":{"type":"Point","coordinates":[-119.2334175,34.2616856]}},{"properties":{"latitude":39.3620084,"column_5":1,"date":{"end_time":"2010/05/22 00:00:00 -0400","original":"5/21/2010","granularity":"day","time":"2010/05/21 00:00:00 -0400"},"longitude":-122.5057554,"id":"advbt60lanr6","location":"East Park Reservoir"},"type":"Feature","geometry":{"type":"Point","coordinates":[-122.5057554,39.3620084]}},{"properties":{"latitude":39.2645567,"column_5":1,"date":{"end_time":"2010/05/22 00:00:00 -0400","original":"5/21/2010","granularity":"day","time":"2010/05/21 00:00:00 -0400"},"longitude":-122.4793625,"id":"advbt64jn25f","location":"Leesville Lodoga Rd."},"type":"Feature","geometry":{"type":"Point","coordinates":[-122.4793625,39.2645567]}},{"properties":{"latitude":41.6424517,"column_5":1,"date":{"end_time":"2010/05/22 00:00:00 -0400","original":"5/21/2010","granularity":"day","time":"2010/05/21 00:00:00 -0400"},"longitude":-122.1676254,"id":"advbt64hwwd9","location":"Hwy 97--Grass Lake Rest Area"},"type":"Feature","geometry":{"type":"Point","coordinates":[-122.1676254,41.6424517]}},{"properties":{"latitude":43.303863,"column_5":1,"date":{"end_time":"2010/05/27 00:00:00 -0400","original":"5/26/2010","granularity":"day","time":"2010/05/26 00:00:00 -0400"},"longitude":-118.604938,"id":"advbt5x4pabr","location":"Windy Point Marsh"},"type":"Feature","geometry":{"type":"Point","coordinates":[-118.604938,43.303863]}},{"properties":{"latitude":43.5005138,"column_5":1,"date":{"end_time":"2010/05/27 00:00:00 -0400","original":"5/26/2010","granularity":"day","time":"2010/05/26 00:00:00 -0400"},"longitude":-119.0810376,"id":"advbt5qkpwja","location":"Potter Swamp"},"type":"Feature","geometry":{"type":"Point","coordinates":[-119.0810376,43.5005138]}},{"properties":{"latitude":43.430965,"column_5":1,"date":{"end_time":"2010/05/28 00:00:00 -0400","original":"5/27/2010","granularity":"day","time":"2010/05/27 00:00:00 -0400"},"longitude":-118.78047,"id":"advbt5whkeek","location":"Lawen colony # 12"},"type":"Feature","geometry":{"type":"Point","coordinates":[-118.78047,43.430965]}},{"properties":{"latitude":43.417091,"column_5":1,"date":{"end_time":"2010/05/29 00:00:00 -0400","original":"5/28/2010","granularity":"day","time":"2010/05/28 00:00:00 -0400"},"longitude":-118.933368,"id":"advbt659hidp","location":"Island Ranch NW"},"type":"Feature","geometry":{"type":"Point","coordinates":[-118.933368,43.417091]}},{"properties":{"latitude":42.7768814,"column_5":1,"date":{"end_time":"2010/05/29 00:00:00 -0400","original":"5/28/2010","granularity":"day","time":"2010/05/28 00:00:00 -0400"},"longitude":-117.8535604,"id":"advbt5wj4n13","location":"Burns Junction"},"type":"Feature","geometry":{"type":"Point","coordinates":[-117.8535604,42.7768814]}},{"properties":{"latitude":42.2964053,"column_5":1,"date":{"end_time":"2010/05/31 00:00:00 -0400","original":"5/30/2010","granularity":"day","time":"2010/05/30 00:00:00 -0400"},"longitude":-118.2716632,"id":"advbt5rwr8jt","location":"Whitehorse Ranch Rd at Willow Creek"},"type":"Feature","geometry":{"type":"Point","coordinates":[-118.2716632,42.2964053]}},{"properties":{"latitude":42.2753956,"column_5":1,"date":{"end_time":"2010/05/31 00:00:00 -0400","original":"5/30/2010","granularity":"day","time":"2010/05/30 00:00:00 -0400"},"longitude":-118.2656443,"id":"advbt5vhxbzv","location":"Willow Creek Hotsprings"},"type":"Feature","geometry":{"type":"Point","coordinates":[-118.2656443,42.2753956]}},{"properties":{"latitude":43.433971,"column_5":1,"date":{"end_time":"2010/06/01 00:00:00 -0400","original":"5/31/2010","granularity":"day","time":"2010/05/31 00:00:00 -0400"},"longitude":-118.823133,"id":"advbt6526t7d","location":"Lawen colony  No.  11"},"type":"Feature","geometry":{"type":"Point","coordinates":[-118.823133,43.433971]}},{"properties":{"latitude":43.2076783,"column_5":1,"date":{"end_time":"2010/06/01 00:00:00 -0400","original":"5/31/2010","granularity":"day","time":"2010/05/31 00:00:00 -0400"},"longitude":-119.0231323,"id":"advbt60igirp","location":"South Harney Rd"},"type":"Feature","geometry":{"type":"Point","coordinates":[-119.0231323,43.2076783]}},{"properties":{"latitude":43.441837,"column_5":1,"date":{"end_time":"2010/06/02 00:00:00 -0400","original":"6/1/2010","granularity":"day","time":"2010/06/01 00:00:00 -0400"},"longitude":-118.841912,"id":"advbt5xk5iur","location":"Squarewell"},"type":"Feature","geometry":{"type":"Point","coordinates":[-118.841912,43.441837]}},{"properties":{"latitude":43.433971,"column_5":1,"date":{"end_time":"2010/06/02 00:00:00 -0400","original":"6/1/2010","granularity":"day","time":"2010/06/01 00:00:00 -0400"},"longitude":-118.823133,"id":"advbt65kt9bd","location":"Lawen colony  No.  12"},"type":"Feature","geometry":{"type":"Point","coordinates":[-118.823133,43.433971]}},{"properties":{"latitude":43.4081,"column_5":1,"date":{"end_time":"2010/06/04 00:00:00 -0400","original":"6/3/2010","granularity":"day","time":"2010/06/03 00:00:00 -0400"},"longitude":-118.9049,"id":"advbt5xifklq","location":"Big Red S"},"type":"Feature","geometry":{"type":"Point","coordinates":[-118.9049,43.4081]}},{"properties":{"latitude":43.4053,"column_5":1,"date":{"end_time":"2010/06/04 00:00:00 -0400","original":"6/3/2010","granularity":"day","time":"2010/06/03 00:00:00 -0400"},"longitude":-118.9624,"id":"advbt5ziica7","location":"Volger Swamp"},"type":"Feature","geometry":{"type":"Point","coordinates":[-118.9624,43.4053]}},{"properties":{"latitude":43.0661915,"column_5":1,"date":{"end_time":"2010/06/05 00:00:00 -0400","original":"6/4/2010","granularity":"day","time":"2010/06/04 00:00:00 -0400"},"longitude":-118.8678646,"id":"advbt64k9bzs","location":"Malheur NWR--Buena Vista Ponds Buildings"},"type":"Feature","geometry":{"type":"Point","coordinates":[-118.8678646,43.0661915]}},{"properties":{"latitude":41.9906186,"column_5":1,"date":{"end_time":"2010/06/07 00:00:00 -0400","original":"6/6/2010","granularity":"day","time":"2010/06/06 00:00:00 -0400"},"longitude":-118.6338723,"id":"advbt61ppb6h","location":"Denio - NV"},"type":"Feature","geometry":{"type":"Point","coordinates":[-118.6338723,41.9906186]}},{"properties":{"latitude":42.068,"column_5":1,"date":{"end_time":"2010/06/07 00:00:00 -0400","original":"6/6/2010","granularity":"day","time":"2010/06/06 00:00:00 -0400"},"longitude":-118.3161,"id":"advbt63y5fao","location":"Trout Creek Mountain Woodlands"},"type":"Feature","geometry":{"type":"Point","coordinates":[-118.3161,42.068]}},{"properties":{"latitude":42.1590771,"column_5":1,"date":{"end_time":"2010/06/07 00:00:00 -0400","original":"6/6/2010","granularity":"day","time":"2010/06/06 00:00:00 -0400"},"longitude":-118.6171961,"id":"advbt5q0z40z","location":"Cottonwood Creek"},"type":"Feature","geometry":{"type":"Point","coordinates":[-118.6171961,42.1590771]}},{"properties":{"latitude":42.0496432,"column_5":1,"date":{"end_time":"2010/06/07 00:00:00 -0400","original":"6/6/2010","granularity":"day","time":"2010/06/06 00:00:00 -0400"},"longitude":-118.5073328,"id":"advbt5yjz01i","location":"Cottonwood-Fields Rd"},"type":"Feature","geometry":{"type":"Point","coordinates":[-118.5073328,42.0496432]}},{"properties":{"latitude":42.9621,"column_5":1,"date":{"end_time":"2010/06/09 00:00:00 -0400","original":"6/8/2010","granularity":"day","time":"2010/06/08 00:00:00 -0400"},"longitude":-118.8484,"id":"advbt5wpsoax","location":"Malheur NWR--Krumbo Swamp"},"type":"Feature","geometry":{"type":"Point","coordinates":[-118.8484,42.9621]}},{"properties":{"latitude":42.95462,"column_5":1,"date":{"end_time":"2010/06/09 00:00:00 -0400","original":"6/8/2010","granularity":"day","time":"2010/06/08 00:00:00 -0400"},"longitude":-118.82617,"id":"advbt5xr9aa6","location":"Malheur NWR--Below Krumbo"},"type":"Feature","geometry":{"type":"Point","coordinates":[-118.82617,42.95462]}},{"properties":{"latitude":43.2932003,"column_5":1,"date":{"end_time":"2010/06/09 00:00:00 -0400","original":"6/8/2010","granularity":"day","time":"2010/06/08 00:00:00 -0400"},"longitude":-118.9489746,"id":"advbt5qplum0","location":"Malheur NWR--Narrows"},"type":"Feature","geometry":{"type":"Point","coordinates":[-118.9489746,43.2932003]}},{"properties":{"latitude":43.2438272,"column_5":1,"date":{"end_time":"2010/06/12 00:00:00 -0400","original":"6/11/2010","granularity":"day","time":"2010/06/11 00:00:00 -0400"},"longitude":-118.894558,"id":"advbt5xazr58","location":"Malheur Field Station"},"type":"Feature","geometry":{"type":"Point","coordinates":[-118.894558,43.2438272]}},{"properties":{"latitude":42.85843,"column_5":1,"date":{"end_time":"2010/06/17 00:00:00 -0400","original":"6/16/2010","granularity":"day","time":"2010/06/16 00:00:00 -0400"},"longitude":-118.90013,"id":"advbt5sffd5z","location":"Malheur NWR--South Meadow Field"},"type":"Feature","geometry":{"type":"Point","coordinates":[-118.90013,42.85843]}},{"properties":{"latitude":42.85743,"column_5":1,"date":{"end_time":"2010/06/17 00:00:00 -0400","original":"6/16/2010","granularity":"day","time":"2010/06/16 00:00:00 -0400"},"longitude":-118.89327,"id":"advbt5vav4sk","location":"Malheur NWR--East S. Meadow Field"},"type":"Feature","geometry":{"type":"Point","coordinates":[-118.89327,42.85743]}},{"properties":{"latitude":42.885711,"column_5":1,"date":{"end_time":"2010/06/18 00:00:00 -0400","original":"6/17/2010","granularity":"day","time":"2010/06/17 00:00:00 -0400"},"longitude":-118.86646,"id":"advbt5q5v84j","location":"Malheur NWR--East Knox Pond"},"type":"Feature","geometry":{"type":"Point","coordinates":[-118.86646,42.885711]}},{"properties":{"latitude":43.03523,"column_5":1,"date":{"end_time":"2010/06/24 00:00:00 -0400","original":"6/23/2010","granularity":"day","time":"2010/06/23 00:00:00 -0400"},"longitude":-118.794959,"id":"advbt5wvspk0","location":"Malheur NWR--Diamond Swamp"},"type":"Feature","geometry":{"type":"Point","coordinates":[-118.794959,43.03523]}},{"properties":{"latitude":42.91536,"column_5":1,"date":{"end_time":"2010/06/24 00:00:00 -0400","original":"6/23/2010","granularity":"day","time":"2010/06/23 00:00:00 -0400"},"longitude":-118.87495,"id":"advbt5uhznza","location":"Malheur NWR--Dredger Field/North Jones"},"type":"Feature","geometry":{"type":"Point","coordinates":[-118.87495,42.91536]}},{"properties":{"latitude":43.07372,"column_5":1,"date":{"end_time":"2010/06/24 00:00:00 -0400","original":"6/23/2010","granularity":"day","time":"2010/06/23 00:00:00 -0400"},"longitude":-118.8061,"id":"advbt5zejb0g","location":"Diamond Crater Pond"},"type":"Feature","geometry":{"type":"Point","coordinates":[-118.8061,43.07372]}},{"properties":{"latitude":42.979844,"column_5":1,"date":{"end_time":"2010/06/28 00:00:00 -0400","original":"6/27/2010","granularity":"day","time":"2010/06/27 00:00:00 -0400"},"longitude":-118.861077,"id":"advbt62zac05","location":"Malheur NWR--Crane Pond"},"type":"Feature","geometry":{"type":"Point","coordinates":[-118.861077,42.979844]}},{"properties":{"latitude":43.2564243,"column_5":1,"date":{"end_time":"2010/06/29 00:00:00 -0400","original":"6/28/2010","granularity":"day","time":"2010/06/28 00:00:00 -0400"},"longitude":-118.8796663,"id":"advbt5xc1hus","location":"Malheur NWR--Sodhouse Marsh"},"type":"Feature","geometry":{"type":"Point","coordinates":[-118.8796663,43.2564243]}},{"properties":{"latitude":43.2561671,"column_5":1,"date":{"end_time":"2010/06/29 00:00:00 -0400","original":"6/28/2010","granularity":"day","time":"2010/06/28 00:00:00 -0400"},"longitude":-118.8716626,"id":"advbt5uff554","location":"Malheur NWR--Sod House Ranch"},"type":"Feature","geometry":{"type":"Point","coordinates":[-118.8716626,43.2561671]}},{"properties":{"latitude":43.346653,"column_5":1,"date":{"end_time":"2010/06/30 00:00:00 -0400","original":"6/29/2010","granularity":"day","time":"2010/06/29 00:00:00 -0400"},"longitude":-118.797226,"id":"advbt60becwf","location":"Malheur NWR--Malheur Lake"},"type":"Feature","geometry":{"type":"Point","coordinates":[-118.797226,43.346653]}},{"properties":{"latitude":43.2667063,"column_5":1,"date":{"end_time":"2010/06/30 00:00:00 -0400","original":"6/29/2010","granularity":"day","time":"2010/06/29 00:00:00 -0400"},"longitude":-118.8861465,"id":"advbt5spq6tq","location":"Upper Sodhouse Marsh"},"type":"Feature","geometry":{"type":"Point","coordinates":[-118.8861465,43.2667063]}},{"properties":{"latitude":43.3859632,"column_5":1,"date":{"end_time":"2010/07/02 00:00:00 -0400","original":"7/1/2010","granularity":"day","time":"2010/07/01 00:00:00 -0400"},"longitude":-118.807869,"id":"advbt5z8euwd","location":"Malheur NWR--North Side Hunter's Parking"},"type":"Feature","geometry":{"type":"Point","coordinates":[-118.807869,43.3859632]}},{"properties":{"latitude":43.3608825,"column_5":1,"date":{"end_time":"2010/07/02 00:00:00 -0400","original":"7/1/2010","granularity":"day","time":"2010/07/01 00:00:00 -0400"},"longitude":-118.7996292,"id":"advbt658tccl","location":"Mouth of the Silvies East"},"type":"Feature","geometry":{"type":"Point","coordinates":[-118.7996292,43.3608825]}},{"properties":{"latitude":43.27112,"column_5":1,"date":{"end_time":"2010/07/06 00:00:00 -0400","original":"7/5/2010","granularity":"day","time":"2010/07/05 00:00:00 -0400"},"longitude":-119.21792,"id":"advbt5xffnn2","location":"Malheur NWR--Carp Pond"},"type":"Feature","geometry":{"type":"Point","coordinates":[-119.21792,43.27112]}},{"properties":{"latitude":43.5551186,"column_5":1,"date":{"end_time":"2010/07/08 00:00:00 -0400","original":"7/7/2010","granularity":"day","time":"2010/07/07 00:00:00 -0400"},"longitude":-119.0707684,"id":"advbt5pq1qe4","location":"Hotchkiss Ln.--WTP"},"type":"Feature","geometry":{"type":"Point","coordinates":[-119.0707684,43.5551186]}},{"properties":{"latitude":43.5569458,"column_5":1,"date":{"end_time":"2010/07/08 00:00:00 -0400","original":"7/7/2010","granularity":"day","time":"2010/07/07 00:00:00 -0400"},"longitude":-119.0611339,"id":"advbt63wup1w","location":"Hotchkiss Ln. and Eagen Ln.--Pond"},"type":"Feature","geometry":{"type":"Point","coordinates":[-119.0611339,43.5569458]}},{"properties":{"latitude":42.890021,"column_5":1,"date":{"end_time":"2010/07/10 00:00:00 -0400","original":"7/9/2010","granularity":"day","time":"2010/07/09 00:00:00 -0400"},"longitude":-118.879978,"id":"advbt5wmdaip","location":"Malhuer NWR--West Knox Pond"},"type":"Feature","geometry":{"type":"Point","coordinates":[-118.879978,42.890021]}},{"properties":{"latitude":42.911837,"column_5":1,"date":{"end_time":"2010/07/12 00:00:00 -0400","original":"7/11/2010","granularity":"day","time":"2010/07/11 00:00:00 -0400"},"longitude":-118.85517,"id":"advbt5qev6rj","location":"Malheur NWR--Boca Lake"},"type":"Feature","geometry":{"type":"Point","coordinates":[-118.85517,42.911837]}},{"properties":{"latitude":43.303015,"column_5":1,"date":{"end_time":"2010/07/13 00:00:00 -0400","original":"7/12/2010","granularity":"day","time":"2010/07/12 00:00:00 -0400"},"longitude":-119.30629,"id":"advbt5z56voo","location":"Malheur NWR--"},"type":"Feature","geometry":{"type":"Point","coordinates":[-119.30629,43.303015]}},{"properties":{"latitude":43.4026155,"column_5":1,"date":{"end_time":"2010/07/19 00:00:00 -0400","original":"7/18/2010","granularity":"day","time":"2010/07/18 00:00:00 -0400"},"longitude":-118.8626719,"id":"advbt5whxhfs","location":"Lawen area Gun Club"},"type":"Feature","geometry":{"type":"Point","coordinates":[-118.8626719,43.4026155]}},{"properties":{"latitude":43.45124,"column_5":1,"date":{"end_time":"2010/07/19 00:00:00 -0400","original":"7/18/2010","granularity":"day","time":"2010/07/18 00:00:00 -0400"},"longitude":-118.875618,"id":"advbt65y7u20","location":"East Fork Silvies River"},"type":"Feature","geometry":{"type":"Point","coordinates":[-118.875618,43.45124]}},{"properties":{"latitude":42.6462393,"column_5":1,"date":{"end_time":"2010/07/23 00:00:00 -0400","original":"7/22/2010","granularity":"day","time":"2010/07/22 00:00:00 -0400"},"longitude":-121.9848061,"id":"advbt5y1yddx","location":"Wood River--Weed Road"},"type":"Feature","geometry":{"type":"Point","coordinates":[-121.9848061,42.6462393]}},{"properties":{"latitude":42.9259487,"column_5":1,"date":{"end_time":"2010/07/24 00:00:00 -0400","original":"7/23/2010","granularity":"day","time":"2010/07/23 00:00:00 -0400"},"longitude":-122.057848,"id":"advbt5u9cec8","location":"Crater Lake National Park - Pumice Castle"},"type":"Feature","geometry":{"type":"Point","coordinates":[-122.057848,42.9259487]}},{"properties":{"latitude":42.9796055,"column_5":1,"date":{"end_time":"2010/07/24 00:00:00 -0400","original":"7/23/2010","granularity":"day","time":"2010/07/23 00:00:00 -0400"},"longitude":-122.0834041,"id":"advbt642j9l4","location":"Crater Lake NP--Cleetwood Trail"},"type":"Feature","geometry":{"type":"Point","coordinates":[-122.0834041,42.9796055]}},{"properties":{"latitude":42.9110754,"column_5":1,"date":{"end_time":"2010/07/24 00:00:00 -0400","original":"7/23/2010","granularity":"day","time":"2010/07/23 00:00:00 -0400"},"longitude":-122.1471441,"id":"advbt60ul84j","location":"Crater Lake National Park - Rim Village"},"type":"Feature","geometry":{"type":"Point","coordinates":[-122.1471441,42.9110754]}},{"properties":{"latitude":42.9243775,"column_5":1,"date":{"end_time":"2010/07/25 00:00:00 -0400","original":"7/24/2010","granularity":"day","time":"2010/07/24 00:00:00 -0400"},"longitude":-122.0263481,"id":"advbt5y5tlyx","location":"Crater Lake NP--Mt Scott"},"type":"Feature","geometry":{"type":"Point","coordinates":[-122.0263481,42.9243775]}},{"properties":{"latitude":42.9419415,"column_5":1,"date":{"end_time":"2010/07/25 00:00:00 -0400","original":"7/24/2010","granularity":"day","time":"2010/07/24 00:00:00 -0400"},"longitude":-122.1710157,"id":"advbt5rfngs8","location":"Crater Lake NP--The Watchman"},"type":"Feature","geometry":{"type":"Point","coordinates":[-122.1710157,42.9419415]}},{"properties":{"latitude":42.9423499,"column_5":1,"date":{"end_time":"2010/07/25 00:00:00 -0400","original":"7/24/2010","granularity":"day","time":"2010/07/24 00:00:00 -0400"},"longitude":-122.1240234,"id":"advbt5u5g9dz","location":"Crater Lake NP"},"type":"Feature","geometry":{"type":"Point","coordinates":[-122.1240234,42.9423499]}},{"properties":{"latitude":42.6774191,"column_5":1,"date":{"end_time":"2010/07/26 00:00:00 -0400","original":"7/25/2010","granularity":"day","time":"2010/07/25 00:00:00 -0400"},"longitude":-122.0823526,"id":"advbt5ygutu8","location":"Winema  NF - Rd 33"},"type":"Feature","geometry":{"type":"Point","coordinates":[-122.0823526,42.6774191]}},{"properties":{"latitude":42.8937306,"column_5":1,"date":{"end_time":"2010/07/26 00:00:00 -0400","original":"7/25/2010","granularity":"day","time":"2010/07/25 00:00:00 -0400"},"longitude":-122.1329927,"id":"advbt5x88zzr","location":"Crater Lake NP--Castle Crest Wildflower Trail"},"type":"Feature","geometry":{"type":"Point","coordinates":[-122.1329927,42.8937306]}},{"properties":{"latitude":42.8496667,"column_5":1,"date":{"end_time":"2010/07/26 00:00:00 -0400","original":"7/25/2010","granularity":"day","time":"2010/07/25 00:00:00 -0400"},"longitude":-122.0066071,"id":"advbt5r022b9","location":"Crater Lake National Park - Pinnacles"},"type":"Feature","geometry":{"type":"Point","coordinates":[-122.0066071,42.8496667]}},{"properties":{"latitude":40.1663468,"column_5":1,"date":{"end_time":"2010/07/28 00:00:00 -0400","original":"7/27/2010","granularity":"day","time":"2010/07/27 00:00:00 -0400"},"longitude":-122.2220421,"id":"advbt5zlem7k","location":"Red Bluff- Sacramento River and I-5"},"type":"Feature","geometry":{"type":"Point","coordinates":[-122.2220421,40.1663468]}},{"properties":{"latitude":36.2580733,"column_5":1,"date":{"end_time":"2010/07/29 00:00:00 -0400","original":"7/28/2010","granularity":"day","time":"2010/07/28 00:00:00 -0400"},"longitude":-119.3130898,"id":"advbt61e8e5e","location":"Highway 63 and Rd 252~Tulare County"},"type":"Feature","geometry":{"type":"Point","coordinates":[-119.3130898,36.2580733]}},{"properties":{"latitude":36.05096,"column_5":1,"date":{"end_time":"2010/08/03 00:00:00 -0400","original":"8/2/2010","granularity":"day","time":"2010/08/02 00:00:00 -0400"},"longitude":-119.46178,"id":"advbt5y8cvxt","location":"Fancy Ranch Pond on Highway 190"},"type":"Feature","geometry":{"type":"Point","coordinates":[-119.46178,36.05096]}},{"properties":{"latitude":36.3002543,"column_5":1,"date":{"end_time":"2010/08/03 00:00:00 -0400","original":"8/2/2010","granularity":"day","time":"2010/08/02 00:00:00 -0400"},"longitude":-119.4687438,"id":"advbt5t07xaf","location":"Houston Ave. at Rd. 48 ponds"},"type":"Feature","geometry":{"type":"Point","coordinates":[-119.4687438,36.3002543]}},{"properties":{"latitude":36.2579089,"column_5":1,"date":{"end_time":"2010/08/03 00:00:00 -0400","original":"8/2/2010","granularity":"day","time":"2010/08/02 00:00:00 -0400"},"longitude":-119.461813,"id":"advbt5q2wsqq","location":"Stockyard Pond"},"type":"Feature","geometry":{"type":"Point","coordinates":[-119.461813,36.2579089]}},{"properties":{"latitude":36.0543555,"column_5":1,"date":{"end_time":"2010/08/03 00:00:00 -0400","original":"8/2/2010","granularity":"day","time":"2010/08/02 00:00:00 -0400"},"longitude":-119.4070315,"id":"advbt63s8vbr","location":"Toledo Pits"},"type":"Feature","geometry":{"type":"Point","coordinates":[-119.4070315,36.0543555]}},{"properties":{"latitude":36.1820864,"column_5":1,"date":{"end_time":"2010/08/06 00:00:00 -0400","original":"8/5/2010","granularity":"day","time":"2010/08/05 00:00:00 -0400"},"longitude":-119.3714333,"id":"advbt61quyjd","location":"Tulare WTP"},"type":"Feature","geometry":{"type":"Point","coordinates":[-119.3714333,36.1820864]}},{"properties":{"latitude":36.3294745,"column_5":1,"date":{"end_time":"2010/08/06 00:00:00 -0400","original":"8/5/2010","granularity":"day","time":"2010/08/05 00:00:00 -0400"},"longitude":-119.8931551,"id":"advbt65848pc","location":"Jack Stone ponds"},"type":"Feature","geometry":{"type":"Point","coordinates":[-119.8931551,36.3294745]}},{"properties":{"latitude":36.2949826,"column_5":1,"date":{"end_time":"2010/08/06 00:00:00 -0400","original":"8/5/2010","granularity":"day","time":"2010/08/05 00:00:00 -0400"},"longitude":-119.4921626,"id":"advbt5rika3d","location":"2nd Ave and Houston"},"type":"Feature","geometry":{"type":"Point","coordinates":[-119.4921626,36.2949826]}},{"properties":{"latitude":36.1810588,"column_5":1,"date":{"end_time":"2010/08/06 00:00:00 -0400","original":"8/5/2010","granularity":"day","time":"2010/08/05 00:00:00 -0400"},"longitude":-119.4735414,"id":"advbt65fyka5","location":"Paige Ave and Hwy 137"},"type":"Feature","geometry":{"type":"Point","coordinates":[-119.4735414,36.1810588]}},{"properties":{"latitude":36.4515618,"column_5":1,"date":{"end_time":"2010/08/06 00:00:00 -0400","original":"8/5/2010","granularity":"day","time":"2010/08/05 00:00:00 -0400"},"longitude":-119.5745087,"id":"advbt5q3ck33","location":"Burris Park--Burris Park Dr."},"type":"Feature","geometry":{"type":"Point","coordinates":[-119.5745087,36.4515618]}},{"properties":{"latitude":34.4071929,"column_5":1,"date":{"end_time":"2010/08/06 00:00:00 -0400","original":"8/5/2010","granularity":"day","time":"2010/08/05 00:00:00 -0400"},"longitude":-118.7776566,"id":"advbt64pmv8x","location":"Upper Santa Clara River Valley"},"type":"Feature","geometry":{"type":"Point","coordinates":[-118.7776566,34.4071929]}},{"properties":{"latitude":34.2742405,"column_5":1,"date":{"end_time":"2010/08/07 00:00:00 -0400","original":"8/6/2010","granularity":"day","time":"2010/08/06 00:00:00 -0400"},"longitude":-119.2521286,"id":"advbt5soall6","location":"5 points Neighborhood"},"type":"Feature","geometry":{"type":"Point","coordinates":[-119.2521286,34.2742405]}},{"properties":{"latitude":34.1259805,"column_5":1,"date":{"end_time":"2010/08/10 00:00:00 -0400","original":"8/9/2010","granularity":"day","time":"2010/08/09 00:00:00 -0400"},"longitude":-118.0814409,"id":"advbt5r9ifm6","location":"Rancho Mangana Rd"},"type":"Feature","geometry":{"type":"Point","coordinates":[-118.0814409,34.1259805]}},{"properties":{"latitude":33.6849473,"column_5":1,"date":{"end_time":"2010/08/10 00:00:00 -0400","original":"8/9/2010","granularity":"day","time":"2010/08/09 00:00:00 -0400"},"longitude":-118.0223304,"id":"advbt6319f8n","location":"Harriett M. Wieder Regional Park"},"type":"Feature","geometry":{"type":"Point","coordinates":[-118.0223304,33.6849473]}},{"properties":{"latitude":34.1335648,"column_5":1,"date":{"end_time":"2010/08/10 00:00:00 -0400","original":"8/9/2010","granularity":"day","time":"2010/08/09 00:00:00 -0400"},"longitude":-118.1315017,"id":"advbt5r0kvuc","location":"S. Mentor Ave"},"type":"Feature","geometry":{"type":"Point","coordinates":[-118.1315017,34.1335648]}},{"properties":{"latitude":34.2821454,"column_5":1,"date":{"end_time":"2010/08/13 00:00:00 -0400","original":"8/12/2010","granularity":"day","time":"2010/08/12 00:00:00 -0400"},"longitude":-119.2864886,"id":"advbt60aoo6o","location":"Poli St. Ventura"},"type":"Feature","geometry":{"type":"Point","coordinates":[-119.2864886,34.2821454]}},{"properties":{"latitude":34.5085,"column_5":1,"date":{"end_time":"2010/08/16 00:00:00 -0400","original":"8/15/2010","granularity":"day","time":"2010/08/15 00:00:00 -0400"},"longitude":-119.3841833,"id":"advbt63c5cnq","location":"Matilija Canyon (Trail)"},"type":"Feature","geometry":{"type":"Point","coordinates":[-119.3841833,34.5085]}},{"properties":{"latitude":9.9333599,"column_5":1,"date":{"end_time":"2010/08/19 00:00:00 -0400","original":"8/18/2010","granularity":"day","time":"2010/08/18 00:00:00 -0400"},"longitude":-84.0721491,"id":"advbt62m2675","location":"San Jose east-central"},"type":"Feature","geometry":{"type":"Point","coordinates":[-84.0721491,9.9333599]}},{"properties":{"latitude":9.7965234,"column_5":1,"date":{"end_time":"2010/09/21 00:00:00 -0400","original":"9/20/2010","granularity":"day","time":"2010/09/20 00:00:00 -0400"},"longitude":-84.596529,"id":"advbt5ymx4nm","location":"PN Carara--Sendero La Meandrica"},"type":"Feature","geometry":{"type":"Point","coordinates":[-84.596529,9.7965234]}},{"properties":{"latitude":35.2743278,"column_5":1,"date":{"end_time":"2010/09/29 00:00:00 -0400","original":"9/28/2010","granularity":"day","time":"2010/09/28 00:00:00 -0400"},"longitude":-120.8861828,"id":"advbt5uvv49g","location":"Montana del Oro SP--Islay Creek"},"type":"Feature","geometry":{"type":"Point","coordinates":[-120.8861828,35.2743278]}},{"properties":{"latitude":35.3317572,"column_5":1,"date":{"end_time":"2010/09/29 00:00:00 -0400","original":"9/28/2010","granularity":"day","time":"2010/09/28 00:00:00 -0400"},"longitude":-120.8168006,"id":"advbt5savoq4","location":"Turri Rd Willows"},"type":"Feature","geometry":{"type":"Point","coordinates":[-120.8168006,35.3317572]}},{"properties":{"latitude":36.2819875,"column_5":1,"date":{"end_time":"2010/10/01 00:00:00 -0400","original":"9/30/2010","granularity":"day","time":"2010/09/30 00:00:00 -0400"},"longitude":-121.8595805,"id":"advbt5zmmkr9","location":"Andrew Molera SP--Big Sur River mouth"},"type":"Feature","geometry":{"type":"Point","coordinates":[-121.8595805,36.2819875]}},{"properties":{"latitude":35.5683274,"column_5":1,"date":{"end_time":"2010/10/01 00:00:00 -0400","original":"9/30/2010","granularity":"day","time":"2010/09/30 00:00:00 -0400"},"longitude":-121.1102353,"id":"advbt5psqatn","location":"Santa Rosa Creek mouth"},"type":"Feature","geometry":{"type":"Point","coordinates":[-121.1102353,35.5683274]}},{"properties":{"latitude":35.6627706,"column_5":1,"date":{"end_time":"2010/10/01 00:00:00 -0400","original":"9/30/2010","granularity":"day","time":"2010/09/30 00:00:00 -0400"},"longitude":-121.2567043,"id":"advbt5xn6ayw","location":"Pt. Piedras Blancas--elephant seal colony"},"type":"Feature","geometry":{"type":"Point","coordinates":[-121.2567043,35.6627706]}},{"properties":{"latitude":36.2703745,"column_5":1,"date":{"end_time":"2010/10/01 00:00:00 -0400","original":"9/30/2010","granularity":"day","time":"2010/09/30 00:00:00 -0400"},"longitude":-121.8082362,"id":"advbt5qls7v9","location":"Big Sur - Burrito Bar"},"type":"Feature","geometry":{"type":"Point","coordinates":[-121.8082362,36.2703745]}},{"properties":{"latitude":36.9523782,"column_5":1,"date":{"end_time":"2010/10/02 00:00:00 -0400","original":"10/1/2010","granularity":"day","time":"2010/10/01 00:00:00 -0400"},"longitude":-122.0567107,"id":"advbt64pgdpj","location":"Natural Bridges SB"},"type":"Feature","geometry":{"type":"Point","coordinates":[-122.0567107,36.9523782]}},{"properties":{"latitude":36.9640205,"column_5":1,"date":{"end_time":"2010/10/02 00:00:00 -0400","original":"10/1/2010","granularity":"day","time":"2010/10/01 00:00:00 -0400"},"longitude":-122.1197319,"id":"advbt64vvbpp","location":"Bluffs south of Baldwin Creek"},"type":"Feature","geometry":{"type":"Point","coordinates":[-122.1197319,36.9640205]}},{"properties":{"latitude":37.3919819,"column_5":1,"date":{"end_time":"2010/10/03 00:00:00 -0400","original":"10/2/2010","granularity":"day","time":"2010/10/02 00:00:00 -0400"},"longitude":-123.0303955,"id":"advbt5tqwiqu","location":"Pioneer Sea Canyon (SF Co.)"},"type":"Feature","geometry":{"type":"Point","coordinates":[-123.0303955,37.3919819]}},{"properties":{"latitude":36.6368817,"column_5":1,"date":{"end_time":"2010/10/05 00:00:00 -0400","original":"10/4/2010","granularity":"day","time":"2010/10/04 00:00:00 -0400"},"longitude":-121.933549,"id":"advbt65ly2ny","location":"Pt. Pinos (general area)"},"type":"Feature","geometry":{"type":"Point","coordinates":[-121.933549,36.6368817]}},{"properties":{"latitude":36.9041954,"column_5":1,"date":{"end_time":"2010/10/05 00:00:00 -0400","original":"10/4/2010","granularity":"day","time":"2010/10/04 00:00:00 -0400"},"longitude":-121.7845631,"id":"advbt644uod9","location":"Watsonville/Struve Slough--Lee Rd."},"type":"Feature","geometry":{"type":"Point","coordinates":[-121.7845631,36.9041954]}},{"properties":{"latitude":34.0333146,"column_5":1,"date":{"end_time":"2010/10/09 00:00:00 -0400","original":"10/8/2010","granularity":"day","time":"2010/10/08 00:00:00 -0400"},"longitude":-118.0384827,"id":"advbt5w4jej2","location":"San Gabriel River--Peck Rd."},"type":"Feature","geometry":{"type":"Point","coordinates":[-118.0384827,34.0333146]}},{"properties":{"latitude":33.9433125,"column_5":1,"date":{"end_time":"2010/10/09 00:00:00 -0400","original":"10/8/2010","granularity":"day","time":"2010/10/08 00:00:00 -0400"},"longitude":-113.1750727,"id":"advbt5ywka3f","location":"Aguila area"},"type":"Feature","geometry":{"type":"Point","coordinates":[-113.1750727,33.9433125]}},{"properties":{"latitude":33.9716471,"column_5":1,"date":{"end_time":"2010/10/09 00:00:00 -0400","original":"10/8/2010","granularity":"day","time":"2010/10/08 00:00:00 -0400"},"longitude":-113.1414378,"id":"advbt5s9gngy","location":"Hwy 71 N of Aguila"},"type":"Feature","geometry":{"type":"Point","coordinates":[-113.1414378,33.9716471]}},{"properties":{"latitude":34.4271837,"column_5":1,"date":{"end_time":"2010/10/11 00:00:00 -0400","original":"10/10/2010","granularity":"day","time":"2010/10/10 00:00:00 -0400"},"longitude":-112.2991812,"id":"advbt627hbjr","location":"Grapevine Creek"},"type":"Feature","geometry":{"type":"Point","coordinates":[-112.2991812,34.4271837]}},{"properties":{"latitude":34.3400343,"column_5":1,"date":{"end_time":"2010/10/12 00:00:00 -0400","original":"10/11/2010","granularity":"day","time":"2010/10/11 00:00:00 -0400"},"longitude":-112.1360779,"id":"advbt5v06zhc","location":"Highway 69 between Spring Valley and I-17"},"type":"Feature","geometry":{"type":"Point","coordinates":[-112.1360779,34.3400343]}},{"properties":{"latitude":33.4208037,"column_5":1,"date":{"end_time":"2010/10/15 00:00:00 -0400","original":"10/14/2010","granularity":"day","time":"2010/10/14 00:00:00 -0400"},"longitude":-112.6991701,"id":"advbt62vom91","location":"Buckeye Airport ponds #2"},"type":"Feature","geometry":{"type":"Point","coordinates":[-112.6991701,33.4208037]}},{"properties":{"latitude":33.5063515,"column_5":1,"date":{"end_time":"2010/10/16 00:00:00 -0400","original":"10/15/2010","granularity":"day","time":"2010/10/15 00:00:00 -0400"},"longitude":-116.0558152,"id":"advbt5qm9561","location":"Salton Sea--Whitewater River Delta"},"type":"Feature","geometry":{"type":"Point","coordinates":[-116.0558152,33.5063515]}},{"properties":{"latitude":33.7225639,"column_5":1,"date":{"end_time":"2010/10/17 00:00:00 -0400","original":"10/16/2010","granularity":"day","time":"2010/10/16 00:00:00 -0400"},"longitude":-116.3622844,"id":"advbt62d808j","location":"Embassy Suites hotel, Palm Desert"},"type":"Feature","geometry":{"type":"Point","coordinates":[-116.3622844,33.7225639]}},{"properties":{"latitude":33.7216001,"column_5":1,"date":{"end_time":"2010/10/17 00:00:00 -0400","original":"10/16/2010","granularity":"day","time":"2010/10/16 00:00:00 -0400"},"longitude":-116.3647628,"id":"advbt5zb0h5q","location":"Panda Express, Palm Desert"},"type":"Feature","geometry":{"type":"Point","coordinates":[-116.3647628,33.7216001]}},{"properties":{"latitude":33.9312885,"column_5":1,"date":{"end_time":"2010/10/19 00:00:00 -0400","original":"10/18/2010","granularity":"day","time":"2010/10/18 00:00:00 -0400"},"longitude":-114.0146144,"id":"advbt5t0sjef","location":"Bouse Homesite"},"type":"Feature","geometry":{"type":"Point","coordinates":[-114.0146144,33.9312885]}},{"properties":{"latitude":33.6203254,"column_5":1,"date":{"end_time":"2010/10/21 00:00:00 -0400","original":"10/20/2010","granularity":"day","time":"2010/10/20 00:00:00 -0400"},"longitude":-111.9491208,"id":"advbt5zcga3l","location":"Crossed Arrows Park"},"type":"Feature","geometry":{"type":"Point","coordinates":[-111.9491208,33.6203254]}},{"properties":{"latitude":33.612463,"column_5":1,"date":{"end_time":"2010/10/21 00:00:00 -0400","original":"10/20/2010","granularity":"day","time":"2010/10/20 00:00:00 -0400"},"longitude":-111.8989956,"id":"advbt5zse0t1","location":"Northsight Park"},"type":"Feature","geometry":{"type":"Point","coordinates":[-111.8989956,33.612463]}},{"properties":{"latitude":38.8963103,"column_5":1,"date":{"end_time":"2010/10/24 00:00:00 -0400","original":"10/23/2010","granularity":"day","time":"2010/10/23 00:00:00 -0400"},"longitude":-77.0500803,"id":"advbt5rnhj3y","location":"Double tree to Lincoln Memorial"},"type":"Feature","geometry":{"type":"Point","coordinates":[-77.0500803,38.8963103]}},{"properties":{"latitude":38.9680179,"column_5":1,"date":{"end_time":"2010/10/24 00:00:00 -0400","original":"10/23/2010","granularity":"day","time":"2010/10/23 00:00:00 -0400"},"longitude":-77.4485064,"id":"advbt65g0j1s","location":"Dulles Airport - Rent a Car area"},"type":"Feature","geometry":{"type":"Point","coordinates":[-77.4485064,38.9680179]}},{"properties":{"latitude":42.21188,"column_5":1,"date":{"end_time":"2010/10/24 00:00:00 -0400","original":"10/23/2010","granularity":"day","time":"2010/10/23 00:00:00 -0400"},"longitude":-83.35047,"id":"advbt5q7pbll","location":"Detroit Metro Airport (restricted access)"},"type":"Feature","geometry":{"type":"Point","coordinates":[-83.35047,42.21188]}},{"properties":{"latitude":38.8897301,"column_5":1,"date":{"end_time":"2010/10/25 00:00:00 -0400","original":"10/24/2010","granularity":"day","time":"2010/10/24 00:00:00 -0400"},"longitude":-77.0102119,"id":"advbt5w4rvp6","location":"United States Capitol"},"type":"Feature","geometry":{"type":"Point","coordinates":[-77.0102119,38.8897301]}},{"properties":{"latitude":38.8975294,"column_5":1,"date":{"end_time":"2010/10/25 00:00:00 -0400","original":"10/24/2010","granularity":"day","time":"2010/10/24 00:00:00 -0400"},"longitude":-77.0364976,"id":"advbt5wvsx1e","location":"The White House"},"type":"Feature","geometry":{"type":"Point","coordinates":[-77.0364976,38.8975294]}},{"properties":{"latitude":38.8901142,"column_5":1,"date":{"end_time":"2010/10/27 00:00:00 -0400","original":"10/26/2010","granularity":"day","time":"2010/10/26 00:00:00 -0400"},"longitude":-77.043364,"id":"advbt5plh2g2","location":"Constitution Gardens - Reflecting Pool"},"type":"Feature","geometry":{"type":"Point","coordinates":[-77.043364,38.8901142]}},{"properties":{"latitude":38.8842907,"column_5":1,"date":{"end_time":"2010/10/27 00:00:00 -0400","original":"10/26/2010","granularity":"day","time":"2010/10/26 00:00:00 -0400"},"longitude":-77.044711,"id":"advbt5xzume2","location":"West Potomac Park--Tidal Basin"},"type":"Feature","geometry":{"type":"Point","coordinates":[-77.044711,38.8842907]}},{"properties":{"latitude":38.7895,"column_5":1,"date":{"end_time":"2010/10/29 00:00:00 -0400","original":"10/28/2010","granularity":"day","time":"2010/10/28 00:00:00 -0400"},"longitude":-77.0514,"id":"advbt5su04y0","location":"Hunting Creek Bridge"},"type":"Feature","geometry":{"type":"Point","coordinates":[-77.0514,38.7895]}},{"properties":{"latitude":38.929366,"column_5":1,"date":{"end_time":"2010/10/30 00:00:00 -0400","original":"10/29/2010","granularity":"day","time":"2010/10/29 00:00:00 -0400"},"longitude":-77.050554,"id":"advbt5zs6hot","location":"National Zoological Park"},"type":"Feature","geometry":{"type":"Point","coordinates":[-77.050554,38.929366]}},{"properties":{"latitude":38.7936304,"column_5":1,"date":{"end_time":"2010/11/01 00:00:00 -0400","original":"10/31/2010","granularity":"day","time":"2010/10/31 00:00:00 -0400"},"longitude":-78.1820583,"id":"advbt64ax5kv","location":"Hogwallow Flats Overlook - SNP"},"type":"Feature","geometry":{"type":"Point","coordinates":[-78.1820583,38.7936304]}},{"properties":{"latitude":38.8712,"column_5":1,"date":{"end_time":"2010/11/01 00:00:00 -0400","original":"10/31/2010","granularity":"day","time":"2010/10/31 00:00:00 -0400"},"longitude":-78.2046,"id":"advbt62cmzqz","location":"Fox Hollow Discovery Trail - Shenandoah National Park - MSD01"},"type":"Feature","geometry":{"type":"Point","coordinates":[-78.2046,38.8712]}},{"properties":{"latitude":38.8423984,"column_5":1,"date":{"end_time":"2010/11/01 00:00:00 -0400","original":"10/31/2010","granularity":"day","time":"2010/10/31 00:00:00 -0400"},"longitude":-78.2076359,"id":"advbt5wx17yk","location":"Gooney Run Overlook - SNP"},"type":"Feature","geometry":{"type":"Point","coordinates":[-78.2076359,38.8423984]}},{"properties":{"latitude":38.5836332,"column_5":1,"date":{"end_time":"2010/11/01 00:00:00 -0400","original":"10/31/2010","granularity":"day","time":"2010/10/31 00:00:00 -0400"},"longitude":-78.3805203,"id":"advbt60vtae8","location":"Shenandoah NP--White Oak Canyon Trail"},"type":"Feature","geometry":{"type":"Point","coordinates":[-78.3805203,38.5836332]}},{"properties":{"latitude":38.8902646,"column_5":1,"date":{"end_time":"2010/11/01 00:00:00 -0400","original":"10/31/2010","granularity":"day","time":"2010/10/31 00:00:00 -0400"},"longitude":-78.2030439,"id":"advbt5w5ch7x","location":"Shenandoah Valley Overlook - SNP"},"type":"Feature","geometry":{"type":"Point","coordinates":[-78.2030439,38.8902646]}},{"properties":{"latitude":38.3719771,"column_5":1,"date":{"end_time":"2010/11/02 00:00:00 -0400","original":"11/1/2010","granularity":"day","time":"2010/11/01 00:00:00 -0400"},"longitude":-78.5298228,"id":"advbt5td3h0d","location":"SNP - Hensley Hollow Pullout"},"type":"Feature","geometry":{"type":"Point","coordinates":[-78.5298228,38.3719771]}},{"properties":{"latitude":38.6763974,"column_5":1,"date":{"end_time":"2010/11/02 00:00:00 -0400","original":"11/1/2010","granularity":"day","time":"2010/11/01 00:00:00 -0400"},"longitude":-78.0084229,"id":"advbt5trkxbw","location":"Amissvile area"},"type":"Feature","geometry":{"type":"Point","coordinates":[-78.0084229,38.6763974]}},{"properties":{"latitude":38.518,"column_5":1,"date":{"end_time":"2010/11/02 00:00:00 -0400","original":"11/1/2010","granularity":"day","time":"2010/11/01 00:00:00 -0400"},"longitude":-78.4321,"id":"advbt5r2tq5j","location":"Dark Hollow Falls Trail, SNP - MSD04"},"type":"Feature","geometry":{"type":"Point","coordinates":[-78.4321,38.518]}},{"properties":{"latitude":38.5272,"column_5":1,"date":{"end_time":"2010/11/02 00:00:00 -0400","original":"11/1/2010","granularity":"day","time":"2010/11/01 00:00:00 -0400"},"longitude":-78.4387,"id":"advbt65s1h0v","location":"Shenandoah NP--Big Meadows"},"type":"Feature","geometry":{"type":"Point","coordinates":[-78.4387,38.5272]}},{"properties":{"latitude":33.3878796,"column_5":1,"date":{"end_time":"2010/11/05 00:00:00 -0400","original":"11/4/2010","granularity":"day","time":"2010/11/04 00:00:00 -0400"},"longitude":-111.8916321,"id":"advbt62d8owh","location":"101 and 60 - Maricopa"},"type":"Feature","geometry":{"type":"Point","coordinates":[-111.8916321,33.3878796]}},{"properties":{"latitude":33.538975,"column_5":1,"date":{"end_time":"2010/11/06 00:00:00 -0400","original":"11/5/2010","granularity":"day","time":"2010/11/05 00:00:00 -0400"},"longitude":-111.8907,"id":"advbt5y9vuir","location":"Scottsdale Pavilions"},"type":"Feature","geometry":{"type":"Point","coordinates":[-111.8907,33.538975]}},{"properties":{"latitude":33.5831632,"column_5":1,"date":{"end_time":"2010/11/10 00:00:00 -0500","original":"11/9/2010","granularity":"day","time":"2010/11/09 00:00:00 -0500"},"longitude":-112.0663404,"id":"advbt61n4wwj","location":"North Mountain Park, Phoenix"},"type":"Feature","geometry":{"type":"Point","coordinates":[-112.0663404,33.5831632]}},{"properties":{"latitude":33.7274211,"column_5":1,"date":{"end_time":"2010/11/12 00:00:00 -0500","original":"11/11/2010","granularity":"day","time":"2010/11/11 00:00:00 -0500"},"longitude":-111.8645221,"id":"advbt5uzqoid","location":"Pinnacle Peak"},"type":"Feature","geometry":{"type":"Point","coordinates":[-111.8645221,33.7274211]}},{"properties":{"latitude":33.8349181,"column_5":1,"date":{"end_time":"2010/11/15 00:00:00 -0500","original":"11/14/2010","granularity":"day","time":"2010/11/14 00:00:00 -0500"},"longitude":-112.276926,"id":"advbt5ycxn0w","location":"Morgan City Wash"},"type":"Feature","geometry":{"type":"Point","coordinates":[-112.276926,33.8349181]}},{"properties":{"latitude":33.0826963,"column_5":1,"date":{"end_time":"2010/11/17 00:00:00 -0500","original":"11/16/2010","granularity":"day","time":"2010/11/16 00:00:00 -0500"},"longitude":-115.7097244,"id":"advbt5s4ca5m","location":"Salton Sea NWR--Unit 1"},"type":"Feature","geometry":{"type":"Point","coordinates":[-115.7097244,33.0826963]}},{"properties":{"latitude":33.1474887,"column_5":1,"date":{"end_time":"2010/11/17 00:00:00 -0500","original":"11/16/2010","granularity":"day","time":"2010/11/16 00:00:00 -0500"},"longitude":-115.6479886,"id":"advbt65eqmh1","location":"Salton Sea--Lack Rd. at Lindsey Rd."},"type":"Feature","geometry":{"type":"Point","coordinates":[-115.6479886,33.1474887]}},{"properties":{"latitude":33.1989437,"column_5":1,"date":{"end_time":"2010/11/17 00:00:00 -0500","original":"11/16/2010","granularity":"day","time":"2010/11/16 00:00:00 -0500"},"longitude":-115.5902481,"id":"advbt5sic4lu","location":"Salton Sea--Schrimpf Rd. Cove"},"type":"Feature","geometry":{"type":"Point","coordinates":[-115.5902481,33.1989437]}},{"properties":{"latitude":33.6576384,"column_5":1,"date":{"end_time":"2010/11/17 00:00:00 -0500","original":"11/16/2010","granularity":"day","time":"2010/11/16 00:00:00 -0500"},"longitude":-114.2443371,"id":"advbt5y4kc09","location":"Quartzite - Love's Gas Station"},"type":"Feature","geometry":{"type":"Point","coordinates":[-114.2443371,33.6576384]}},{"properties":{"latitude":33.2304315,"column_5":1,"date":{"end_time":"2010/11/17 00:00:00 -0500","original":"11/16/2010","granularity":"day","time":"2010/11/16 00:00:00 -0500"},"longitude":-115.5797768,"id":"advbt62usz9n","location":"Salton Sea--Davis Rd."},"type":"Feature","geometry":{"type":"Point","coordinates":[-115.5797768,33.2304315]}},{"properties":{"latitude":33.8539844,"column_5":1,"date":{"end_time":"2010/11/23 00:00:00 -0500","original":"11/22/2010","granularity":"day","time":"2010/11/22 00:00:00 -0500"},"longitude":-114.4679645,"id":"advbt5yjhr2k","location":"Parker Valley--Tsosie Rd"},"type":"Feature","geometry":{"type":"Point","coordinates":[-114.4679645,33.8539844]}},{"properties":{"latitude":33.7577423,"column_5":1,"date":{"end_time":"2010/11/24 00:00:00 -0500","original":"11/23/2010","granularity":"day","time":"2010/11/23 00:00:00 -0500"},"longitude":-118.1481743,"id":"advbt5t2ka5n","location":"Belmont Pier and shore"},"type":"Feature","geometry":{"type":"Point","coordinates":[-118.1481743,33.7577423]}},{"properties":{"latitude":33.7619167,"column_5":1,"date":{"end_time":"2010/11/24 00:00:00 -0500","original":"11/23/2010","granularity":"day","time":"2010/11/23 00:00:00 -0500"},"longitude":-118.1616497,"id":"advbt5ppkckp","location":"Bluff Park"},"type":"Feature","geometry":{"type":"Point","coordinates":[-118.1616497,33.7619167]}},{"properties":{"latitude":36.0457997,"column_5":1,"date":{"end_time":"2010/11/24 00:00:00 -0500","original":"11/23/2010","granularity":"day","time":"2010/11/23 00:00:00 -0500"},"longitude":-117.9471651,"id":"advbt60lpcfy","location":"Coso Jct"},"type":"Feature","geometry":{"type":"Point","coordinates":[-117.9471651,36.0457997]}},{"properties":{"latitude":37.23806,"column_5":1,"date":{"end_time":"2010/11/25 00:00:00 -0500","original":"11/24/2010","granularity":"day","time":"2010/11/24 00:00:00 -0500"},"longitude":-118.5975,"id":"advbt5rbirm1","location":"Aspendell"},"type":"Feature","geometry":{"type":"Point","coordinates":[-118.5975,37.23806]}},{"properties":{"latitude":37.2059957,"column_5":1,"date":{"end_time":"2010/11/26 00:00:00 -0500","original":"11/25/2010","granularity":"day","time":"2010/11/25 00:00:00 -0500"},"longitude":-118.3045578,"id":"advbt6474olx","location":"Klondike Lake"},"type":"Feature","geometry":{"type":"Point","coordinates":[-118.3045578,37.2059957]}},{"properties":{"latitude":37.6471312,"column_5":1,"date":{"end_time":"2010/11/27 00:00:00 -0500","original":"11/26/2010","granularity":"day","time":"2010/11/26 00:00:00 -0500"},"longitude":-118.7381744,"id":"advbt5vm13b7","location":"Lake Crowley--north side"},"type":"Feature","geometry":{"type":"Point","coordinates":[-118.7381744,37.6471312]}},{"properties":{"latitude":37.5817456,"column_5":1,"date":{"end_time":"2010/11/27 00:00:00 -0500","original":"11/26/2010","granularity":"day","time":"2010/11/26 00:00:00 -0500"},"longitude":-118.7322822,"id":"advbt617atqz","location":"Lake Crowley--marina"},"type":"Feature","geometry":{"type":"Point","coordinates":[-118.7322822,37.5817456]}},{"properties":{"latitude":37.4211626,"column_5":1,"date":{"end_time":"2010/11/27 00:00:00 -0500","original":"11/26/2010","granularity":"day","time":"2010/11/26 00:00:00 -0500"},"longitude":-118.5774994,"id":"advbt63e8ace","location":"Round Valley"},"type":"Feature","geometry":{"type":"Point","coordinates":[-118.5774994,37.4211626]}},{"properties":{"latitude":37.3445732,"column_5":1,"date":{"end_time":"2010/11/28 00:00:00 -0500","original":"11/27/2010","granularity":"day","time":"2010/11/27 00:00:00 -0500"},"longitude":-118.4000015,"id":"advbt5vb9kjr","location":"Bishop Golf Club"},"type":"Feature","geometry":{"type":"Point","coordinates":[-118.4000015,37.3445732]}},{"properties":{"latitude":36.577412,"column_5":1,"date":{"end_time":"2010/11/29 00:00:00 -0500","original":"11/28/2010","granularity":"day","time":"2010/11/28 00:00:00 -0500"},"longitude":-118.0597472,"id":"advbt5w63x0h","location":"Mt Whitney Golf Course"},"type":"Feature","geometry":{"type":"Point","coordinates":[-118.0597472,36.577412]}},{"properties":{"latitude":37.0601088,"column_5":1,"date":{"end_time":"2010/11/29 00:00:00 -0500","original":"11/28/2010","granularity":"day","time":"2010/11/28 00:00:00 -0500"},"longitude":-118.2279968,"id":"advbt5xx4j3x","location":"Tinemaha Reservoir"},"type":"Feature","geometry":{"type":"Point","coordinates":[-118.2279968,37.0601088]}},{"properties":{"latitude":35.9402121,"column_5":1,"date":{"end_time":"2010/11/29 00:00:00 -0500","original":"11/28/2010","granularity":"day","time":"2010/11/28 00:00:00 -0500"},"longitude":-117.9078484,"id":"advbt5qtixgd","location":"Little Lake"},"type":"Feature","geometry":{"type":"Point","coordinates":[-117.9078484,35.9402121]}},{"properties":{"latitude":36.5623243,"column_5":1,"date":{"end_time":"2010/11/29 00:00:00 -0500","original":"11/28/2010","granularity":"day","time":"2010/11/28 00:00:00 -0500"},"longitude":-118.0559921,"id":"advbt5zz4cbk","location":"Diaz Lake"},"type":"Feature","geometry":{"type":"Point","coordinates":[-118.0559921,36.5623243]}},{"properties":{"latitude":36.1504547,"column_5":1,"date":{"end_time":"2010/11/29 00:00:00 -0500","original":"11/28/2010","granularity":"day","time":"2010/11/28 00:00:00 -0500"},"longitude":-117.9877138,"id":"advbt5v2rz57","location":"Haiwee Canyon Rd"},"type":"Feature","geometry":{"type":"Point","coordinates":[-117.9877138,36.1504547]}},{"properties":{"latitude":33.236,"column_5":1,"date":{"end_time":"2010/12/04 00:00:00 -0500","original":"12/3/2010","granularity":"day","time":"2010/12/03 00:00:00 -0500"},"longitude":-111.7682,"id":"advbt65qbvin","location":"Veterans Oasis Park"},"type":"Feature","geometry":{"type":"Point","coordinates":[-111.7682,33.236]}},{"properties":{"latitude":33.7337622,"column_5":1,"date":{"end_time":"2010/12/09 00:00:00 -0500","original":"12/8/2010","granularity":"day","time":"2010/12/08 00:00:00 -0500"},"longitude":-113.7639427,"id":"advbt5zde5av","location":"Vicksburg - CAP"},"type":"Feature","geometry":{"type":"Point","coordinates":[-113.7639427,33.7337622]}},{"properties":{"latitude":32.796686,"column_5":1,"date":{"end_time":"2010/12/14 00:00:00 -0500","original":"12/13/2010","granularity":"day","time":"2010/12/13 00:00:00 -0500"},"longitude":-114.5646679,"id":"advbt64db6nc","location":"Bard--9th and Ave E"},"type":"Feature","geometry":{"type":"Point","coordinates":[-114.5646679,32.796686]}},{"properties":{"latitude":32.7478727,"column_5":1,"date":{"end_time":"2010/12/14 00:00:00 -0500","original":"12/13/2010","granularity":"day","time":"2010/12/13 00:00:00 -0500"},"longitude":-114.0511698,"id":"advbt5q2za4r","location":"Dome Valley--Streak-backed Oriole spot"},"type":"Feature","geometry":{"type":"Point","coordinates":[-114.0511698,32.7478727]}},{"properties":{"latitude":32.77028,"column_5":1,"date":{"end_time":"2010/12/14 00:00:00 -0500","original":"12/13/2010","granularity":"day","time":"2010/12/13 00:00:00 -0500"},"longitude":-114.332056,"id":"advbt5s7epop","location":"Dome Valley--north end of Ave 18E"},"type":"Feature","geometry":{"type":"Point","coordinates":[-114.332056,32.77028]}},{"properties":{"latitude":32.7062598,"column_5":1,"date":{"end_time":"2010/12/14 00:00:00 -0500","original":"12/13/2010","granularity":"day","time":"2010/12/13 00:00:00 -0500"},"longitude":-114.5516109,"id":"advbt62lid2d","location":"Yuma--College Acres"},"type":"Feature","geometry":{"type":"Point","coordinates":[-114.5516109,32.7062598]}},{"properties":{"latitude":33.0970784,"column_5":1,"date":{"end_time":"2010/12/15 00:00:00 -0500","original":"12/14/2010","granularity":"day","time":"2010/12/14 00:00:00 -0500"},"longitude":-115.6837177,"id":"advbt5zjold5","location":"Salton Sea--Brouchard Duck Club"},"type":"Feature","geometry":{"type":"Point","coordinates":[-115.6837177,33.0970784]}},{"properties":{"latitude":33.1018239,"column_5":1,"date":{"end_time":"2010/12/15 00:00:00 -0500","original":"12/14/2010","granularity":"day","time":"2010/12/14 00:00:00 -0500"},"longitude":-115.6627321,"id":"advbt621kwyz","location":"Wiley Reservoir"},"type":"Feature","geometry":{"type":"Point","coordinates":[-115.6627321,33.1018239]}},{"properties":{"latitude":33.0858246,"column_5":1,"date":{"end_time":"2010/12/15 00:00:00 -0500","original":"12/14/2010","granularity":"day","time":"2010/12/14 00:00:00 -0500"},"longitude":-115.6231642,"id":"advbt65o7sw1","location":"New River Marsh Restoration"},"type":"Feature","geometry":{"type":"Point","coordinates":[-115.6231642,33.0858246]}},{"properties":{"latitude":33.2095007,"column_5":1,"date":{"end_time":"2010/12/15 00:00:00 -0500","original":"12/14/2010","granularity":"day","time":"2010/12/14 00:00:00 -0500"},"longitude":-115.5318832,"id":"advbt5rjld92","location":"Imperial Irrigation District Managed Wetland Project--Niland"},"type":"Feature","geometry":{"type":"Point","coordinates":[-115.5318832,33.2095007]}},{"properties":{"latitude":32.9773369,"column_5":1,"date":{"end_time":"2010/12/15 00:00:00 -0500","original":"12/14/2010","granularity":"day","time":"2010/12/14 00:00:00 -0500"},"longitude":-115.5472764,"id":"advbt5sbaaq4","location":"Brawley--Warbler alley"},"type":"Feature","geometry":{"type":"Point","coordinates":[-115.5472764,32.9773369]}},{"properties":{"latitude":32.7909003,"column_5":1,"date":{"end_time":"2010/12/16 00:00:00 -0500","original":"12/15/2010","granularity":"day","time":"2010/12/15 00:00:00 -0500"},"longitude":-115.5192876,"id":"advbt5yc21jt","location":"Evergreen Cemetery (IMP Co.)"},"type":"Feature","geometry":{"type":"Point","coordinates":[-115.5192876,32.7909003]}},{"properties":{"latitude":32.8149423,"column_5":1,"date":{"end_time":"2010/12/19 00:00:00 -0500","original":"12/18/2010","granularity":"day","time":"2010/12/18 00:00:00 -0500"},"longitude":-114.5568037,"id":"advbt5ulgkqj","location":"Bard - Collins Rd"},"type":"Feature","geometry":{"type":"Point","coordinates":[-114.5568037,32.8149423]}},{"properties":{"latitude":32.8190719,"column_5":1,"date":{"end_time":"2010/12/19 00:00:00 -0500","original":"12/18/2010","granularity":"day","time":"2010/12/18 00:00:00 -0500"},"longitude":-114.5414615,"id":"advbt5ufqvpg","location":"Bard Valley - Mehring Rd house"},"type":"Feature","geometry":{"type":"Point","coordinates":[-114.5414615,32.8190719]}},{"properties":{"latitude":32.9559609,"column_5":1,"date":{"end_time":"2010/12/19 00:00:00 -0500","original":"12/18/2010","granularity":"day","time":"2010/12/18 00:00:00 -0500"},"longitude":-114.5092964,"id":"advbt5rfavon","location":"Ferguson Washes - Northern"},"type":"Feature","geometry":{"type":"Point","coordinates":[-114.5092964,32.9559609]}},{"properties":{"latitude":32.9625504,"column_5":1,"date":{"end_time":"2010/12/19 00:00:00 -0500","original":"12/18/2010","granularity":"day","time":"2010/12/18 00:00:00 -0500"},"longitude":-114.5020866,"id":"advbt5ysie5d","location":"Southern Ferguson Washes"},"type":"Feature","geometry":{"type":"Point","coordinates":[-114.5020866,32.9625504]}},{"properties":{"latitude":32.8604114,"column_5":1,"date":{"end_time":"2010/12/19 00:00:00 -0500","original":"12/18/2010","granularity":"day","time":"2010/12/18 00:00:00 -0500"},"longitude":-114.4411469,"id":"advbt5s1bps5","location":"Yuma Proving Ground - Residential"},"type":"Feature","geometry":{"type":"Point","coordinates":[-114.4411469,32.8604114]}},{"properties":{"latitude":35.2331059,"column_5":1,"date":{"end_time":"2010/12/25 00:00:00 -0500","original":"12/24/2010","granularity":"day","time":"2010/12/24 00:00:00 -0500"},"longitude":-114.5707083,"id":"advbt5w4dhro","location":"Lake Mead NRA--Telephone Cove"},"type":"Feature","geometry":{"type":"Point","coordinates":[-114.5707083,35.2331059]}},{"properties":{"latitude":34.5113661,"column_5":1,"date":{"end_time":"2010/12/27 00:00:00 -0500","original":"12/26/2010","granularity":"day","time":"2010/12/26 00:00:00 -0500"},"longitude":-114.3903351,"id":"advbt5r2yhkb","location":"Havasu Landing--north side"},"type":"Feature","geometry":{"type":"Point","coordinates":[-114.3903351,34.5113661]}},{"properties":{"latitude":34.4004299,"column_5":1,"date":{"end_time":"2010/12/27 00:00:00 -0500","original":"12/26/2010","granularity":"day","time":"2010/12/26 00:00:00 -0500"},"longitude":-114.2789268,"id":"advbt5ycw46d","location":"Havasu Palms"},"type":"Feature","geometry":{"type":"Point","coordinates":[-114.2789268,34.4004299]}},{"properties":{"latitude":34.30055,"column_5":1,"date":{"end_time":"2010/12/27 00:00:00 -0500","original":"12/26/2010","granularity":"day","time":"2010/12/26 00:00:00 -0500"},"longitude":-114.1727543,"id":"advbt5tavh53","location":"Gene Wash Reservoir"},"type":"Feature","geometry":{"type":"Point","coordinates":[-114.1727543,34.30055]}},{"properties":{"latitude":34.484203,"column_5":1,"date":{"end_time":"2010/12/27 00:00:00 -0500","original":"12/26/2010","granularity":"day","time":"2010/12/26 00:00:00 -0500"},"longitude":-114.4110203,"id":"advbt5ykmpfe","location":"Havasu Landing"},"type":"Feature","geometry":{"type":"Point","coordinates":[-114.4110203,34.484203]}},{"properties":{"latitude":34.5699329,"column_5":1,"date":{"end_time":"2011/01/02 00:00:00 -0500","original":"1/1/2011","granularity":"day","time":"2011/01/01 00:00:00 -0500"},"longitude":-114.36656,"id":"advbt63d4e2m","location":"The Shops at Lake Havasu"},"type":"Feature","geometry":{"type":"Point","coordinates":[-114.36656,34.5699329]}},{"properties":{"latitude":34.1225033,"column_5":1,"date":{"end_time":"2011/01/08 00:00:00 -0500","original":"1/7/2011","granularity":"day","time":"2011/01/07 00:00:00 -0500"},"longitude":-114.3712431,"id":"advbt5vf6ruw","location":"Big River Family Park"},"type":"Feature","geometry":{"type":"Point","coordinates":[-114.3712431,34.1225033]}},{"properties":{"latitude":34.1293376,"column_5":1,"date":{"end_time":"2011/01/08 00:00:00 -0500","original":"1/7/2011","granularity":"day","time":"2011/01/07 00:00:00 -0500"},"longitude":-114.3980169,"id":"advbt63lkru4","location":"Big River - Papago and Del Rey"},"type":"Feature","geometry":{"type":"Point","coordinates":[-114.3980169,34.1293376]}},{"properties":{"latitude":33.4352651,"column_5":1,"date":{"end_time":"2011/01/10 00:00:00 -0500","original":"1/9/2011","granularity":"day","time":"2011/01/09 00:00:00 -0500"},"longitude":-111.9057083,"id":"advbt62hnimd","location":"Tempe Town Lake--marsh"},"type":"Feature","geometry":{"type":"Point","coordinates":[-111.9057083,33.4352651]}},{"properties":{"latitude":34.5145841,"column_5":1,"date":{"end_time":"2011/01/14 00:00:00 -0500","original":"1/13/2011","granularity":"day","time":"2011/01/13 00:00:00 -0500"},"longitude":-114.3613887,"id":"advbt5zektcn","location":"Lake Havasu City Memorial Gardens"},"type":"Feature","geometry":{"type":"Point","coordinates":[-114.3613887,34.5145841]}},{"properties":{"latitude":34.4929047,"column_5":1,"date":{"end_time":"2011/01/15 00:00:00 -0500","original":"1/14/2011","granularity":"day","time":"2011/01/14 00:00:00 -0500"},"longitude":-114.3160486,"id":"advbt65n3is2","location":"Lake Havasu City--Palo Verde S"},"type":"Feature","geometry":{"type":"Point","coordinates":[-114.3160486,34.4929047]}},{"properties":{"latitude":35.175628,"column_5":1,"date":{"end_time":"2011/01/20 00:00:00 -0500","original":"1/19/2011","granularity":"day","time":"2011/01/19 00:00:00 -0500"},"longitude":-114.0626979,"id":"advbt653q7eu","location":"Kingman--Downtown Wastewater Treatment Ponds"},"type":"Feature","geometry":{"type":"Point","coordinates":[-114.0626979,35.175628]}},{"properties":{"latitude":35.1844717,"column_5":1,"date":{"end_time":"2011/01/20 00:00:00 -0500","original":"1/19/2011","granularity":"day","time":"2011/01/19 00:00:00 -0500"},"longitude":-114.0540719,"id":"advbt62cd5qf","location":"Kingman--Old Trails Rd"},"type":"Feature","geometry":{"type":"Point","coordinates":[-114.0540719,35.1844717]}},{"properties":{"latitude":34.2254113,"column_5":1,"date":{"end_time":"2011/01/27 00:00:00 -0500","original":"1/26/2011","granularity":"day","time":"2011/01/26 00:00:00 -0500"},"longitude":-114.1934395,"id":"advbt5teqg4m","location":"La Paz County Park"},"type":"Feature","geometry":{"type":"Point","coordinates":[-114.1934395,34.2254113]}},{"properties":{"latitude":34.2225903,"column_5":1,"date":{"end_time":"2011/01/27 00:00:00 -0500","original":"1/26/2011","granularity":"day","time":"2011/01/26 00:00:00 -0500"},"longitude":-114.2024517,"id":"advbt645joc7","location":"Empire Landing"},"type":"Feature","geometry":{"type":"Point","coordinates":[-114.2024517,34.2225903]}},{"properties":{"latitude":35.1697215,"column_5":1,"date":{"end_time":"2011/01/30 00:00:00 -0500","original":"1/29/2011","granularity":"day","time":"2011/01/29 00:00:00 -0500"},"longitude":-114.5676827,"id":"advbt5x1m8r4","location":"Bullhead City/Laughlin Bridge - restoration area"},"type":"Feature","geometry":{"type":"Point","coordinates":[-114.5676827,35.1697215]}},{"properties":{"latitude":35.1702652,"column_5":1,"date":{"end_time":"2011/01/30 00:00:00 -0500","original":"1/29/2011","granularity":"day","time":"2011/01/29 00:00:00 -0500"},"longitude":-114.2361832,"id":"advbt5r8idi8","location":"Golden Valley - Colorado and Unkar"},"type":"Feature","geometry":{"type":"Point","coordinates":[-114.2361832,35.1702652]}},{"properties":{"latitude":35.0689939,"column_5":1,"date":{"end_time":"2011/01/30 00:00:00 -0500","original":"1/29/2011","granularity":"day","time":"2011/01/29 00:00:00 -0500"},"longitude":-114.2817163,"id":"advbt62evfsq","location":"Golden Valley - Dawson Rd"},"type":"Feature","geometry":{"type":"Point","coordinates":[-114.2817163,35.0689939]}},{"properties":{"latitude":35.8696,"column_5":1,"date":{"end_time":"2011/01/31 00:00:00 -0500","original":"1/30/2011","granularity":"day","time":"2011/01/30 00:00:00 -0500"},"longitude":-114.6604,"id":"advbt60y5ukg","location":"Lake Mead NRA--Willow Beach"},"type":"Feature","geometry":{"type":"Point","coordinates":[-114.6604,35.8696]}},{"properties":{"latitude":36.0634625,"column_5":1,"date":{"end_time":"2011/01/31 00:00:00 -0500","original":"1/30/2011","granularity":"day","time":"2011/01/30 00:00:00 -0500"},"longitude":-114.4664669,"id":"advbt5uxohv3","location":"Lake Mead NRA--Bonelli Bay"},"type":"Feature","geometry":{"type":"Point","coordinates":[-114.4664669,36.0634625]}},{"properties":{"latitude":36.0915921,"column_5":1,"date":{"end_time":"2011/01/31 00:00:00 -0500","original":"1/30/2011","granularity":"day","time":"2011/01/30 00:00:00 -0500"},"longitude":-114.4818735,"id":"advbt6084saj","location":"Lake Mead NRA--Bonelli Landing"},"type":"Feature","geometry":{"type":"Point","coordinates":[-114.4818735,36.0915921]}},{"properties":{"latitude":35.5057669,"column_5":1,"date":{"end_time":"2011/01/31 00:00:00 -0500","original":"1/30/2011","granularity":"day","time":"2011/01/30 00:00:00 -0500"},"longitude":-114.6765161,"id":"advbt5y6dd9c","location":"Lake Mohave--opposite Cottonwood Cove"},"type":"Feature","geometry":{"type":"Point","coordinates":[-114.6765161,35.5057669]}},{"properties":{"latitude":36.0415519,"column_5":1,"date":{"end_time":"2011/01/31 00:00:00 -0500","original":"1/30/2011","granularity":"day","time":"2011/01/30 00:00:00 -0500"},"longitude":-114.5192313,"id":"advbt5sph534","location":"Lake Mead NRA--Bonelli Landing Rd"},"type":"Feature","geometry":{"type":"Point","coordinates":[-114.5192313,36.0415519]}},{"properties":{"latitude":34.264523,"column_5":1,"date":{"end_time":"2011/02/04 00:00:00 -0500","original":"2/3/2011","granularity":"day","time":"2011/02/03 00:00:00 -0500"},"longitude":-114.1466618,"id":"advbt5zkayne","location":"Cable Car day use"},"type":"Feature","geometry":{"type":"Point","coordinates":[-114.1466618,34.264523]}},{"properties":{"latitude":34.2120151,"column_5":1,"date":{"end_time":"2011/02/04 00:00:00 -0500","original":"2/3/2011","granularity":"day","time":"2011/02/03 00:00:00 -0500"},"longitude":-114.2166138,"id":"advbt62a0l17","location":"Crossroads CG"},"type":"Feature","geometry":{"type":"Point","coordinates":[-114.2166138,34.2120151]}},{"properties":{"latitude":34.514752,"column_5":1,"date":{"end_time":"2011/02/11 00:00:00 -0500","original":"2/10/2011","granularity":"day","time":"2011/02/10 00:00:00 -0500"},"longitude":-114.3636632,"id":"advbt5yvrz4t","location":"LHC - Sailing Hawks Walking Trail"},"type":"Feature","geometry":{"type":"Point","coordinates":[-114.3636632,34.514752]}},{"properties":{"latitude":34.2096062,"column_5":1,"date":{"end_time":"2011/02/14 00:00:00 -0500","original":"2/13/2011","granularity":"day","time":"2011/02/13 00:00:00 -0500"},"longitude":-114.2116731,"id":"advbt5x6q7oh","location":"Parker Strip--opposite Crossroads"},"type":"Feature","geometry":{"type":"Point","coordinates":[-114.2116731,34.2096062]}},{"properties":{"latitude":35.2650336,"column_5":1,"date":{"end_time":"2011/02/21 00:00:00 -0500","original":"2/20/2011","granularity":"day","time":"2011/02/20 00:00:00 -0500"},"longitude":-114.5923805,"id":"advbt5upg28d","location":"Lake Mead NRA--Princess Cove (NV)"},"type":"Feature","geometry":{"type":"Point","coordinates":[-114.5923805,35.2650336]}},{"properties":{"latitude":34.2841696,"column_5":1,"date":{"end_time":"2011/02/22 00:00:00 -0500","original":"2/21/2011","granularity":"day","time":"2011/02/21 00:00:00 -0500"},"longitude":-114.132328,"id":"advbt5umz47y","location":"Parker Strip--north"},"type":"Feature","geometry":{"type":"Point","coordinates":[-114.132328,34.2841696]}},{"properties":{"latitude":34.4830167,"column_5":1,"date":{"end_time":"2011/02/28 00:00:00 -0500","original":"2/27/2011","granularity":"day","time":"2011/02/27 00:00:00 -0500"},"longitude":-113.4482667,"id":"advbt5pupiey","location":"Poachie Mtns Random 1"},"type":"Feature","geometry":{"type":"Point","coordinates":[-113.4482667,34.4830167]}},{"properties":{"latitude":34.4791667,"column_5":1,"date":{"end_time":"2011/02/28 00:00:00 -0500","original":"2/27/2011","granularity":"day","time":"2011/02/27 00:00:00 -0500"},"longitude":-113.5420167,"id":"advbt64i1odu","location":"Poachie Mtns Random 3"},"type":"Feature","geometry":{"type":"Point","coordinates":[-113.5420167,34.4791667]}},{"properties":{"latitude":34.4780167,"column_5":1,"date":{"end_time":"2011/02/28 00:00:00 -0500","original":"2/27/2011","granularity":"day","time":"2011/02/27 00:00:00 -0500"},"longitude":-113.4929667,"id":"advbt64n6tco","location":"Poachie Mtns Random 2"},"type":"Feature","geometry":{"type":"Point","coordinates":[-113.4929667,34.4780167]}},{"properties":{"latitude":34.0714311,"column_5":1,"date":{"end_time":"2011/03/02 00:00:00 -0500","original":"3/1/2011","granularity":"day","time":"2011/03/01 00:00:00 -0500"},"longitude":-114.3033457,"id":"advbt5vvq9g3","location":"Parker Valley - end of 1st"},"type":"Feature","geometry":{"type":"Point","coordinates":[-114.3033457,34.0714311]}},{"properties":{"latitude":33.278653,"column_5":1,"date":{"end_time":"2011/03/13 00:00:00 -0500","original":"3/12/2011","granularity":"day","time":"2011/03/12 00:00:00 -0500"},"longitude":-112.7731141,"id":"advbt5pm7u63","location":"Arlington WA"},"type":"Feature","geometry":{"type":"Point","coordinates":[-112.7731141,33.278653]}},{"properties":{"latitude":33.3485329,"column_5":1,"date":{"end_time":"2011/03/13 00:00:00 -0500","original":"3/12/2011","granularity":"day","time":"2011/03/12 00:00:00 -0500"},"longitude":-112.7118194,"id":"advbt5rcts3p","location":"Arlington Valley--Hwy 80 and 307th"},"type":"Feature","geometry":{"type":"Point","coordinates":[-112.7118194,33.3485329]}},{"properties":{"latitude":33.3046606,"column_5":1,"date":{"end_time":"2011/03/13 00:00:00 -0500","original":"3/12/2011","granularity":"day","time":"2011/03/12 00:00:00 -0500"},"longitude":-112.7809989,"id":"advbt5ycznfx","location":"Arlington Valley--Arlington School Rd"},"type":"Feature","geometry":{"type":"Point","coordinates":[-112.7809989,33.3046606]}},{"properties":{"latitude":33.3962187,"column_5":1,"date":{"end_time":"2011/03/13 00:00:00 -0500","original":"3/12/2011","granularity":"day","time":"2011/03/12 00:00:00 -0500"},"longitude":-112.6773691,"id":"advbt5xp6hr8","location":"Buckeye--South Palo Verde Rd"},"type":"Feature","geometry":{"type":"Point","coordinates":[-112.6773691,33.3962187]}},{"properties":{"latitude":33.4063447,"column_5":1,"date":{"end_time":"2011/03/13 00:00:00 -0500","original":"3/12/2011","granularity":"day","time":"2011/03/12 00:00:00 -0500"},"longitude":-112.6255059,"id":"advbt62ubq11","location":"Buckeye--Oglesby Rd"},"type":"Feature","geometry":{"type":"Point","coordinates":[-112.6255059,33.4063447]}},{"properties":{"latitude":37.0562046,"column_5":1,"date":{"end_time":"2011/03/20 00:00:00 -0400","original":"3/19/2011","granularity":"day","time":"2011/03/19 00:00:00 -0400"},"longitude":-120.8040333,"id":"advbt5zhrasg","location":"Los Banos area"},"type":"Feature","geometry":{"type":"Point","coordinates":[-120.8040333,37.0562046]}},{"properties":{"latitude":37.0751758,"column_5":1,"date":{"end_time":"2011/03/20 00:00:00 -0400","original":"3/19/2011","granularity":"day","time":"2011/03/19 00:00:00 -0400"},"longitude":-121.0822105,"id":"advbt607w9b3","location":"San Luis Reservoir SRA"},"type":"Feature","geometry":{"type":"Point","coordinates":[-121.0822105,37.0751758]}},{"properties":{"latitude":37.0534304,"column_5":1,"date":{"end_time":"2011/03/20 00:00:00 -0400","original":"3/19/2011","granularity":"day","time":"2011/03/19 00:00:00 -0400"},"longitude":-120.5589437,"id":"advbt5wh09lg","location":"Hwy 152--Merced County"},"type":"Feature","geometry":{"type":"Point","coordinates":[-120.5589437,37.0534304]}},{"properties":{"latitude":37.012354,"column_5":1,"date":{"end_time":"2011/03/20 00:00:00 -0400","original":"3/19/2011","granularity":"day","time":"2011/03/19 00:00:00 -0400"},"longitude":-121.3457108,"id":"advbt5xp3lnx","location":"Hwy 152--Santa Clara County"},"type":"Feature","geometry":{"type":"Point","coordinates":[-121.3457108,37.012354]}},{"properties":{"latitude":36.982792,"column_5":1,"date":{"end_time":"2011/03/21 00:00:00 -0400","original":"3/20/2011","granularity":"day","time":"2011/03/20 00:00:00 -0400"},"longitude":-122.0608842,"id":"advbt65xyfa4","location":"UC Santa Cruz--Arboretum"},"type":"Feature","geometry":{"type":"Point","coordinates":[-122.0608842,36.982792]}},{"properties":{"latitude":36.9822606,"column_5":1,"date":{"end_time":"2011/03/22 00:00:00 -0400","original":"3/21/2011","granularity":"day","time":"2011/03/21 00:00:00 -0400"},"longitude":-121.461668,"id":"advbt5rpa8bk","location":"San Felipe Lake / Soap Lake"},"type":"Feature","geometry":{"type":"Point","coordinates":[-121.461668,36.9822606]}},{"properties":{"latitude":36.9866485,"column_5":1,"date":{"end_time":"2011/03/22 00:00:00 -0400","original":"3/21/2011","granularity":"day","time":"2011/03/21 00:00:00 -0400"},"longitude":-121.4648438,"id":"advbt5um78rw","location":"San Felipe Lake--Santa Clara County"},"type":"Feature","geometry":{"type":"Point","coordinates":[-121.4648438,36.9866485]}},{"properties":{"latitude":37.0645185,"column_5":1,"date":{"end_time":"2011/03/22 00:00:00 -0400","original":"3/21/2011","granularity":"day","time":"2011/03/21 00:00:00 -0400"},"longitude":-121.1709552,"id":"advbt62icoj0","location":"San Luis Reservoir SRA--Dinosaur Pt."},"type":"Feature","geometry":{"type":"Point","coordinates":[-121.1709552,37.0645185]}},{"properties":{"latitude":36.971804,"column_5":1,"date":{"end_time":"2011/03/22 00:00:00 -0400","original":"3/21/2011","granularity":"day","time":"2011/03/21 00:00:00 -0400"},"longitude":-122.0501876,"id":"advbt5ztbnaz","location":"Santa Cruz--Nobel Dr"},"type":"Feature","geometry":{"type":"Point","coordinates":[-122.0501876,36.971804]}},{"properties":{"latitude":33.6127629,"column_5":1,"date":{"end_time":"2011/04/24 00:00:00 -0400","original":"4/23/2011","granularity":"day","time":"2011/04/23 00:00:00 -0400"},"longitude":-114.5798761,"id":"advbt5poycl9","location":"Blythe - Ocean View Apartments"},"type":"Feature","geometry":{"type":"Point","coordinates":[-114.5798761,33.6127629]}},{"properties":{"latitude":33.3633955,"column_5":1,"date":{"end_time":"2011/05/01 00:00:00 -0400","original":"4/30/2011","granularity":"day","time":"2011/04/30 00:00:00 -0400"},"longitude":-114.6694511,"id":"advbt5po6f4s","location":"Cibola NWR -- HQ"},"type":"Feature","geometry":{"type":"Point","coordinates":[-114.6694511,33.3633955]}},{"properties":{"latitude":33.9988989,"column_5":1,"date":{"end_time":"2011/05/02 00:00:00 -0400","original":"5/1/2011","granularity":"day","time":"2011/05/01 00:00:00 -0400"},"longitude":-114.4196033,"id":"advbt5tz4ldt","location":"Parker Valley - Scott Rd"},"type":"Feature","geometry":{"type":"Point","coordinates":[-114.4196033,33.9988989]}},{"properties":{"latitude":35.1115581,"column_5":1,"date":{"end_time":"2011/05/08 00:00:00 -0400","original":"5/7/2011","granularity":"day","time":"2011/05/07 00:00:00 -0400"},"longitude":-113.9022267,"id":"advbt5r0uxku","location":"Hualapai Mountain Rd--Rd 7101C"},"type":"Feature","geometry":{"type":"Point","coordinates":[-113.9022267,35.1115581]}},{"properties":{"latitude":34.8845146,"column_5":1,"date":{"end_time":"2011/05/08 00:00:00 -0400","original":"5/7/2011","granularity":"day","time":"2011/05/07 00:00:00 -0400"},"longitude":-114.0296531,"id":"advbt612pkiz","location":"Yucca--Carrow Rd"},"type":"Feature","geometry":{"type":"Point","coordinates":[-114.0296531,34.8845146]}},{"properties":{"latitude":34.210893,"column_5":1,"date":{"end_time":"2011/05/09 00:00:00 -0400","original":"5/8/2011","granularity":"day","time":"2011/05/08 00:00:00 -0400"},"longitude":-113.6889589,"id":"advbt5vih8se","location":"Bill Williams River--Lincoln Ranch (MOH)"},"type":"Feature","geometry":{"type":"Point","coordinates":[-113.6889589,34.210893]}},{"properties":{"latitude":34.1269355,"column_5":1,"date":{"end_time":"2011/05/09 00:00:00 -0400","original":"5/8/2011","granularity":"day","time":"2011/05/08 00:00:00 -0400"},"longitude":-113.8216141,"id":"advbt5pnc9lw","location":"Swansea Rd--CBTH"},"type":"Feature","geometry":{"type":"Point","coordinates":[-113.8216141,34.1269355]}},{"properties":{"latitude":34.2569327,"column_5":1,"date":{"end_time":"2011/05/15 00:00:00 -0400","original":"5/14/2011","granularity":"day","time":"2011/05/14 00:00:00 -0400"},"longitude":-114.1623688,"id":"advbt5rkr74g","location":"Buckskin Mountain SP"},"type":"Feature","geometry":{"type":"Point","coordinates":[-114.1623688,34.2569327]}},{"properties":{"latitude":34.7749499,"column_5":1,"date":{"end_time":"2011/05/20 00:00:00 -0400","original":"5/19/2011","granularity":"day","time":"2011/05/19 00:00:00 -0400"},"longitude":-114.5381784,"id":"advbt63hiwci","location":"Havasu NWR - Beal Lake Restoration area"},"type":"Feature","geometry":{"type":"Point","coordinates":[-114.5381784,34.7749499]}},{"properties":{"latitude":34.9732856,"column_5":1,"date":{"end_time":"2011/05/23 00:00:00 -0400","original":"5/22/2011","granularity":"day","time":"2011/05/22 00:00:00 -0400"},"longitude":-114.4155478,"id":"advbt62zt6p6","location":"Oatman-Topock Hwy"},"type":"Feature","geometry":{"type":"Point","coordinates":[-114.4155478,34.9732856]}},{"properties":{"latitude":34.561168,"column_5":1,"date":{"end_time":"2011/05/29 00:00:00 -0400","original":"5/28/2011","granularity":"day","time":"2011/05/28 00:00:00 -0400"},"longitude":-113.3519983,"id":"advbt5znh5r3","location":"Burro Creek--6-mile Crossing"},"type":"Feature","geometry":{"type":"Point","coordinates":[-113.3519983,34.561168]}},{"properties":{"latitude":34.6161415,"column_5":1,"date":{"end_time":"2011/05/29 00:00:00 -0400","original":"5/28/2011","granularity":"day","time":"2011/05/28 00:00:00 -0400"},"longitude":-113.4238386,"id":"advbt60uar3m","location":"Burro Creek Crossing Rd"},"type":"Feature","geometry":{"type":"Point","coordinates":[-113.4238386,34.6161415]}},{"properties":{"latitude":33.9550995,"column_5":1,"date":{"end_time":"2011/06/06 00:00:00 -0400","original":"6/5/2011","granularity":"day","time":"2011/06/05 00:00:00 -0400"},"longitude":-114.4211268,"id":"advbt5zdjm1a","location":"Parker Valley - McCabe Oasis"},"type":"Feature","geometry":{"type":"Point","coordinates":[-114.4211268,33.9550995]}},{"properties":{"latitude":35.1427572,"column_5":1,"date":{"end_time":"2011/07/03 00:00:00 -0400","original":"7/2/2011","granularity":"day","time":"2011/07/02 00:00:00 -0400"},"longitude":-113.9315271,"id":"advbt5z2ko12","location":"Between Lazy YU and DW"},"type":"Feature","geometry":{"type":"Point","coordinates":[-113.9315271,35.1427572]}},{"properties":{"latitude":35.081708,"column_5":1,"date":{"end_time":"2011/07/03 00:00:00 -0400","original":"7/2/2011","granularity":"day","time":"2011/07/02 00:00:00 -0400"},"longitude":-113.8750076,"id":"advbt6479t8l","location":"Flag Mine Rd"},"type":"Feature","geometry":{"type":"Point","coordinates":[-113.8750076,35.081708]}},{"properties":{"latitude":35.5520519,"column_5":1,"date":{"end_time":"2011/07/17 00:00:00 -0400","original":"7/16/2011","granularity":"day","time":"2011/07/16 00:00:00 -0400"},"longitude":-113.3122051,"id":"advbt64rplo7","location":"Rt 66 and Rd 18 COC"},"type":"Feature","geometry":{"type":"Point","coordinates":[-113.3122051,35.5520519]}},{"properties":{"latitude":35.58333,"column_5":1,"date":{"end_time":"2011/07/17 00:00:00 -0400","original":"7/16/2011","granularity":"day","time":"2011/07/16 00:00:00 -0400"},"longitude":-113.54945,"id":"advbt5vix6kp","location":"Buck and Doe pt2"},"type":"Feature","geometry":{"type":"Point","coordinates":[-113.54945,35.58333]}},{"properties":{"latitude":35.4984563,"column_5":1,"date":{"end_time":"2011/07/17 00:00:00 -0400","original":"7/16/2011","granularity":"day","time":"2011/07/16 00:00:00 -0400"},"longitude":-113.169415,"id":"advbt5zu58sn","location":"Rt 66 near the Yav and Coc County line YAV"},"type":"Feature","geometry":{"type":"Point","coordinates":[-113.169415,35.4984563]}},{"properties":{"latitude":35.6002294,"column_5":1,"date":{"end_time":"2011/07/17 00:00:00 -0400","original":"7/16/2011","granularity":"day","time":"2011/07/16 00:00:00 -0400"},"longitude":-113.591423,"id":"advbt5pwctpr","location":"Buck and Doe Rd"},"type":"Feature","geometry":{"type":"Point","coordinates":[-113.591423,35.6002294]}},{"properties":{"latitude":35.5443,"column_5":1,"date":{"end_time":"2011/07/17 00:00:00 -0400","original":"7/16/2011","granularity":"day","time":"2011/07/16 00:00:00 -0400"},"longitude":-113.52354,"id":"advbt5sbyxv2","location":"Buck and Doe pt1"},"type":"Feature","geometry":{"type":"Point","coordinates":[-113.52354,35.5443]}},{"properties":{"latitude":35.4874411,"column_5":1,"date":{"end_time":"2011/07/17 00:00:00 -0400","original":"7/16/2011","granularity":"day","time":"2011/07/16 00:00:00 -0400"},"longitude":-113.1520343,"id":"advbt5woig8e","location":"Rt 66 mp 120 YAV"},"type":"Feature","geometry":{"type":"Point","coordinates":[-113.1520343,35.4874411]}},{"properties":{"latitude":35.3979885,"column_5":1,"date":{"end_time":"2011/07/17 00:00:00 -0400","original":"7/16/2011","granularity":"day","time":"2011/07/16 00:00:00 -0400"},"longitude":-113.6545944,"id":"advbt5wk1ukp","location":"Near Valentine MOH"},"type":"Feature","geometry":{"type":"Point","coordinates":[-113.6545944,35.3979885]}},{"properties":{"latitude":33.4332333,"column_5":1,"date":{"end_time":"2011/07/22 00:00:00 -0400","original":"7/21/2011","granularity":"day","time":"2011/07/21 00:00:00 -0400"},"longitude":-111.9186044,"id":"advbt5waoj5l","location":"Tempe Town Lake"},"type":"Feature","geometry":{"type":"Point","coordinates":[-111.9186044,33.4332333]}},{"properties":{"latitude":34.7241193,"column_5":1,"date":{"end_time":"2011/07/23 00:00:00 -0400","original":"7/22/2011","granularity":"day","time":"2011/07/22 00:00:00 -0400"},"longitude":-118.1683445,"id":"advbt5yvllgj","location":"Amargosa Creek Flood Basin--20th St. at W Ave. G8"},"type":"Feature","geometry":{"type":"Point","coordinates":[-118.1683445,34.7241193]}},{"properties":{"latitude":34.9964647,"column_5":1,"date":{"end_time":"2011/07/23 00:00:00 -0400","original":"7/22/2011","granularity":"day","time":"2011/07/22 00:00:00 -0400"},"longitude":-117.5440979,"id":"advbt65y34ah","location":"Kramer Junction"},"type":"Feature","geometry":{"type":"Point","coordinates":[-117.5440979,34.9964647]}},{"properties":{"latitude":34.2223052,"column_5":1,"date":{"end_time":"2011/07/24 00:00:00 -0400","original":"7/23/2011","granularity":"day","time":"2011/07/23 00:00:00 -0400"},"longitude":-119.2608421,"id":"advbt644hyus","location":"McGrath SB"},"type":"Feature","geometry":{"type":"Point","coordinates":[-119.2608421,34.2223052]}},{"properties":{"latitude":34.1384632,"column_5":1,"date":{"end_time":"2011/07/24 00:00:00 -0400","original":"7/23/2011","granularity":"day","time":"2011/07/23 00:00:00 -0400"},"longitude":-119.1842666,"id":"advbt5xgv9r5","location":"Ormond Beach--end of Perkins Rd."},"type":"Feature","geometry":{"type":"Point","coordinates":[-119.1842666,34.1384632]}},{"properties":{"latitude":34.8769184,"column_5":1,"date":{"end_time":"2011/07/31 00:00:00 -0400","original":"7/30/2011","granularity":"day","time":"2011/07/30 00:00:00 -0400"},"longitude":-114.0389442,"id":"advbt60bgtug","location":"Yucca - Suzette and Mary Beth Dr"},"type":"Feature","geometry":{"type":"Point","coordinates":[-114.0389442,34.8769184]}},{"properties":{"latitude":36.8183333,"column_5":1,"date":{"end_time":"2011/08/07 00:00:00 -0400","original":"8/6/2011","granularity":"day","time":"2011/08/06 00:00:00 -0400"},"longitude":-114.0368199,"id":"advbt5rxauhv","location":"Mesquite--Peppermill Palms"},"type":"Feature","geometry":{"type":"Point","coordinates":[-114.0368199,36.8183333]}},{"properties":{"latitude":36.713481,"column_5":1,"date":{"end_time":"2011/08/07 00:00:00 -0400","original":"8/6/2011","granularity":"day","time":"2011/08/06 00:00:00 -0400"},"longitude":-114.0285587,"id":"advbt5t8rh6h","location":"Lime Kiln Canyon Rd--lower (AZ)"},"type":"Feature","geometry":{"type":"Point","coordinates":[-114.0285587,36.713481]}},{"properties":{"latitude":36.658881,"column_5":1,"date":{"end_time":"2011/08/07 00:00:00 -0400","original":"8/6/2011","granularity":"day","time":"2011/08/06 00:00:00 -0400"},"longitude":-113.4436226,"id":"advbt5tyc3ym","location":"Main Street Valley"},"type":"Feature","geometry":{"type":"Point","coordinates":[-113.4436226,36.658881]}},{"properties":{"latitude":36.7379854,"column_5":1,"date":{"end_time":"2011/08/07 00:00:00 -0400","original":"8/6/2011","granularity":"day","time":"2011/08/06 00:00:00 -0400"},"longitude":-113.5502243,"id":"advbt5qzrz74","location":"Wolf Hole Valley"},"type":"Feature","geometry":{"type":"Point","coordinates":[-113.5502243,36.7379854]}},{"properties":{"latitude":36.4677819,"column_5":1,"date":{"end_time":"2011/08/07 00:00:00 -0400","original":"8/6/2011","granularity":"day","time":"2011/08/06 00:00:00 -0400"},"longitude":-113.3488655,"id":"advbt609q5sx","location":"Upper Hurricane Valley"},"type":"Feature","geometry":{"type":"Point","coordinates":[-113.3488655,36.4677819]}},{"properties":{"latitude":31.9857109,"column_5":1,"date":{"end_time":"2011/08/19 00:00:00 -0400","original":"8/18/2011","granularity":"day","time":"2011/08/18 00:00:00 -0400"},"longitude":-110.2995801,"id":"advbt5qqxia4","location":"Benson -- grassy lot by the Transfer station"},"type":"Feature","geometry":{"type":"Point","coordinates":[-110.2995801,31.9857109]}},{"properties":{"latitude":31.8907126,"column_5":1,"date":{"end_time":"2011/08/19 00:00:00 -0400","original":"8/18/2011","granularity":"day","time":"2011/08/18 00:00:00 -0400"},"longitude":-110.2194357,"id":"advbt5wygt43","location":"St. David -- Golden Bell Rd"},"type":"Feature","geometry":{"type":"Point","coordinates":[-110.2194357,31.8907126]}},{"properties":{"latitude":31.4596996,"column_5":1,"date":{"end_time":"2011/08/20 00:00:00 -0400","original":"8/19/2011","granularity":"day","time":"2011/08/19 00:00:00 -0400"},"longitude":-110.3644028,"id":"advbt5u37amd","location":"Garden Canyon"},"type":"Feature","geometry":{"type":"Point","coordinates":[-110.3644028,31.4596996]}},{"properties":{"latitude":35.0277473,"column_5":1,"date":{"end_time":"2011/08/28 00:00:00 -0400","original":"8/27/2011","granularity":"day","time":"2011/08/27 00:00:00 -0400"},"longitude":-114.6352959,"id":"advbt5x2lukz","location":"Colorado River above Aztec Rd"},"type":"Feature","geometry":{"type":"Point","coordinates":[-114.6352959,35.0277473]}},{"properties":{"latitude":34.866679,"column_5":1,"date":{"end_time":"2011/10/06 00:00:00 -0400","original":"10/5/2011","granularity":"day","time":"2011/10/05 00:00:00 -0400"},"longitude":-114.5338762,"id":"advbt5v20qaq","location":"Mohave Valley--power plant"},"type":"Feature","geometry":{"type":"Point","coordinates":[-114.5338762,34.866679]}},{"properties":{"latitude":34.6767832,"column_5":1,"date":{"end_time":"2011/10/11 00:00:00 -0400","original":"10/10/2011","granularity":"day","time":"2011/10/10 00:00:00 -0400"},"longitude":-113.5785699,"id":"advbt60bwfd3","location":"Cholla Canyon Ranch Rd"},"type":"Feature","geometry":{"type":"Point","coordinates":[-113.5785699,34.6767832]}},{"properties":{"latitude":34.2572164,"column_5":1,"date":{"end_time":"2011/10/24 00:00:00 -0400","original":"10/23/2011","granularity":"day","time":"2011/10/23 00:00:00 -0400"},"longitude":-112.0639801,"id":"advbt625ia4o","location":"Agua Fria NM--Horseshoe Ford"},"type":"Feature","geometry":{"type":"Point","coordinates":[-112.0639801,34.2572164]}},{"properties":{"latitude":33.5639217,"column_5":1,"date":{"end_time":"2011/10/25 00:00:00 -0400","original":"10/24/2011","granularity":"day","time":"2011/10/24 00:00:00 -0400"},"longitude":-112.2572708,"id":"advbt60qf3c9","location":"Phoenix--101 Glendale-area"},"type":"Feature","geometry":{"type":"Point","coordinates":[-112.2572708,33.5639217]}},{"properties":{"latitude":34.8,"column_5":1,"date":{"end_time":"2011/10/28 00:00:00 -0400","original":"10/27/2011","granularity":"day","time":"2011/10/27 00:00:00 -0400"},"longitude":-114.52,"id":"advbt5sgwcew","location":"Havasu NWR--Topock Marsh"},"type":"Feature","geometry":{"type":"Point","coordinates":[-114.52,34.8]}},{"properties":{"latitude":33.8801071,"column_5":1,"date":{"end_time":"2011/11/07 00:00:00 -0500","original":"11/6/2011","granularity":"day","time":"2011/11/06 00:00:00 -0400"},"longitude":-111.6166306,"id":"advbt601ic9a","location":"Bartlett Res - Bartlett Flats"},"type":"Feature","geometry":{"type":"Point","coordinates":[-111.6166306,33.8801071]}},{"properties":{"latitude":36.7921804,"column_5":1,"date":{"end_time":"2011/11/20 00:00:00 -0500","original":"11/19/2011","granularity":"day","time":"2011/11/19 00:00:00 -0500"},"longitude":-114.0924275,"id":"advbt64a2iya","location":"Mesquite STP"},"type":"Feature","geometry":{"type":"Point","coordinates":[-114.0924275,36.7921804]}},{"properties":{"latitude":36.899082,"column_5":1,"date":{"end_time":"2011/11/20 00:00:00 -0500","original":"11/19/2011","granularity":"day","time":"2011/11/19 00:00:00 -0500"},"longitude":-113.9316988,"id":"advbt65pxp4k","location":"Beaver Dam Golf Course"},"type":"Feature","geometry":{"type":"Point","coordinates":[-113.9316988,36.899082]}},{"properties":{"latitude":36.9731411,"column_5":1,"date":{"end_time":"2011/11/20 00:00:00 -0500","original":"11/19/2011","granularity":"day","time":"2011/11/19 00:00:00 -0500"},"longitude":-112.9952431,"id":"advbt64s542v","location":"Colorado City - Ag areas"},"type":"Feature","geometry":{"type":"Point","coordinates":[-112.9952431,36.9731411]}},{"properties":{"latitude":37.1839118,"column_5":1,"date":{"end_time":"2011/11/21 00:00:00 -0500","original":"11/20/2011","granularity":"day","time":"2011/11/20 00:00:00 -0500"},"longitude":-113.3954716,"id":"advbt61ufd79","location":"Quail Creek Reservoir &amp; SP"},"type":"Feature","geometry":{"type":"Point","coordinates":[-113.3954716,37.1839118]}},{"properties":{"latitude":36.8056081,"column_5":1,"date":{"end_time":"2011/11/21 00:00:00 -0500","original":"11/20/2011","granularity":"day","time":"2011/11/20 00:00:00 -0500"},"longitude":-113.0612898,"id":"advbt5whj9fr","location":"Flattop Reservoir"},"type":"Feature","geometry":{"type":"Point","coordinates":[-113.0612898,36.8056081]}},{"properties":{"latitude":37.1596325,"column_5":1,"date":{"end_time":"2011/11/21 00:00:00 -0500","original":"11/20/2011","granularity":"day","time":"2011/11/20 00:00:00 -0500"},"longitude":-113.3902359,"id":"advbt5vpbpcg","location":"Hurricane -- SR9 WTP"},"type":"Feature","geometry":{"type":"Point","coordinates":[-113.3902359,37.1596325]}},{"properties":{"latitude":36.6653897,"column_5":1,"date":{"end_time":"2011/11/21 00:00:00 -0500","original":"11/20/2011","granularity":"day","time":"2011/11/20 00:00:00 -0500"},"longitude":-113.0796146,"id":"advbt5pujh0v","location":"Little Clayhole Reservoir"},"type":"Feature","geometry":{"type":"Point","coordinates":[-113.0796146,36.6653897]}},{"properties":{"latitude":36.3665632,"column_5":1,"date":{"end_time":"2011/11/21 00:00:00 -0500","original":"11/20/2011","granularity":"day","time":"2011/11/20 00:00:00 -0500"},"longitude":-113.1673336,"id":"advbt61ykod3","location":"Mount Logan Rd - mid"},"type":"Feature","geometry":{"type":"Point","coordinates":[-113.1673336,36.3665632]}},{"properties":{"latitude":36.740191,"column_5":1,"date":{"end_time":"2011/11/21 00:00:00 -0500","original":"11/20/2011","granularity":"day","time":"2011/11/20 00:00:00 -0500"},"longitude":-113.0209494,"id":"advbt5u3vbbw","location":"Big Warren Reservoir"},"type":"Feature","geometry":{"type":"Point","coordinates":[-113.0209494,36.740191]}},{"properties":{"latitude":36.3805921,"column_5":1,"date":{"end_time":"2011/11/21 00:00:00 -0500","original":"11/20/2011","granularity":"day","time":"2011/11/20 00:00:00 -0500"},"longitude":-113.1602526,"id":"advbt61l2kfv","location":"Mount Logan Rd - lower"},"type":"Feature","geometry":{"type":"Point","coordinates":[-113.1602526,36.3805921]}},{"properties":{"latitude":36.9464621,"column_5":1,"date":{"end_time":"2011/11/21 00:00:00 -0500","original":"11/20/2011","granularity":"day","time":"2011/11/20 00:00:00 -0500"},"longitude":-113.0019379,"id":"advbt5wp0p8i","location":"Colorado City - south of"},"type":"Feature","geometry":{"type":"Point","coordinates":[-113.0019379,36.9464621]}},{"properties":{"latitude":36.3917858,"column_5":1,"date":{"end_time":"2011/11/21 00:00:00 -0500","original":"11/20/2011","granularity":"day","time":"2011/11/20 00:00:00 -0500"},"longitude":-113.1513476,"id":"advbt65ru3sb","location":"Mount Trumbull - Trailhead"},"type":"Feature","geometry":{"type":"Point","coordinates":[-113.1513476,36.3917858]}},{"properties":{"latitude":36.5708034,"column_5":1,"date":{"end_time":"2011/11/21 00:00:00 -0500","original":"11/20/2011","granularity":"day","time":"2011/11/20 00:00:00 -0500"},"longitude":-113.0706024,"id":"advbt5waacjt","location":"Black Canyon Reservoir"},"type":"Feature","geometry":{"type":"Point","coordinates":[-113.0706024,36.5708034]}},{"properties":{"latitude":36.358822,"column_5":1,"date":{"end_time":"2011/11/21 00:00:00 -0500","original":"11/20/2011","granularity":"day","time":"2011/11/20 00:00:00 -0500"},"longitude":-113.1876755,"id":"advbt64vs0in","location":"Mount Logan Rd - upper"},"type":"Feature","geometry":{"type":"Point","coordinates":[-113.1876755,36.358822]}},{"properties":{"latitude":33.7426294,"column_5":1,"date":{"end_time":"2011/12/04 00:00:00 -0500","original":"12/3/2011","granularity":"day","time":"2011/12/03 00:00:00 -0500"},"longitude":-113.4601198,"id":"advbt5ulk9d3","location":"Socorro Mine Canyon"},"type":"Feature","geometry":{"type":"Point","coordinates":[-113.4601198,33.7426294]}},{"properties":{"latitude":33.7451425,"column_5":1,"date":{"end_time":"2011/12/04 00:00:00 -0500","original":"12/3/2011","granularity":"day","time":"2011/12/03 00:00:00 -0500"},"longitude":-113.4528888,"id":"advbt5r8ss0z","location":"Canyon de BUMI"},"type":"Feature","geometry":{"type":"Point","coordinates":[-113.4528888,33.7451425]}},{"properties":{"latitude":33.7467644,"column_5":1,"date":{"end_time":"2011/12/04 00:00:00 -0500","original":"12/3/2011","granularity":"day","time":"2011/12/03 00:00:00 -0500"},"longitude":-113.4442533,"id":"advbt5prpika","location":"AZPLT Canyon"},"type":"Feature","geometry":{"type":"Point","coordinates":[-113.4442533,33.7467644]}},{"properties":{"latitude":35.2829823,"column_5":1,"date":{"end_time":"2011/12/12 00:00:00 -0500","original":"12/11/2011","granularity":"day","time":"2011/12/11 00:00:00 -0500"},"longitude":-113.9937135,"id":"advbt5z5q8dq","location":"Kingman Airport Wilderness"},"type":"Feature","geometry":{"type":"Point","coordinates":[-113.9937135,35.2829823]}},{"properties":{"latitude":34.5053151,"column_5":1,"date":{"end_time":"2011/12/22 00:00:00 -0500","original":"12/21/2011","granularity":"day","time":"2011/12/21 00:00:00 -0500"},"longitude":-114.3654671,"id":"advbt61r7oyl","location":"Lake Havasu--viewpoint north of SP"},"type":"Feature","geometry":{"type":"Point","coordinates":[-114.3654671,34.5053151]}},{"properties":{"latitude":33.459802,"column_5":1,"date":{"end_time":"2011/12/25 00:00:00 -0500","original":"12/24/2011","granularity":"day","time":"2011/12/24 00:00:00 -0500"},"longitude":-117.6989365,"id":"advbt5vnll4b","location":"Dana Point Harbor"},"type":"Feature","geometry":{"type":"Point","coordinates":[-117.6989365,33.459802]}},{"properties":{"latitude":34.0958849,"column_5":1,"date":{"end_time":"2011/12/28 00:00:00 -0500","original":"12/27/2011","granularity":"day","time":"2011/12/27 00:00:00 -0500"},"longitude":-119.0756178,"id":"advbt5wkr5r8","location":"Mugu Lagoon--east arm"},"type":"Feature","geometry":{"type":"Point","coordinates":[-119.0756178,34.0958849]}},{"properties":{"latitude":34.1330994,"column_5":1,"date":{"end_time":"2011/12/28 00:00:00 -0500","original":"12/27/2011","granularity":"day","time":"2011/12/27 00:00:00 -0500"},"longitude":-119.0996786,"id":"advbt694g0ch","location":"Pt. Mugu--Missile Park"},"type":"Feature","geometry":{"type":"Point","coordinates":[-119.0996786,34.1330994]}},{"properties":{"latitude":34.1701637,"column_5":1,"date":{"end_time":"2011/12/28 00:00:00 -0500","original":"12/27/2011","granularity":"day","time":"2011/12/27 00:00:00 -0500"},"longitude":-119.0954256,"id":"advbt6kg2ue4","location":"Revlon Ditch--Wood Rd."},"type":"Feature","geometry":{"type":"Point","coordinates":[-119.0954256,34.1701637]}},{"properties":{"latitude":34.7701368,"column_5":1,"date":{"end_time":"2011/12/29 00:00:00 -0500","original":"12/28/2011","granularity":"day","time":"2011/12/28 00:00:00 -0500"},"longitude":-118.7521648,"id":"advbt6dhgkkh","location":"Quail Lake"},"type":"Feature","geometry":{"type":"Point","coordinates":[-118.7521648,34.7701368]}},{"properties":{"latitude":36.0214054,"column_5":1,"date":{"end_time":"2012/01/01 00:00:00 -0500","original":"12/31/2011","granularity":"day","time":"2011/12/31 00:00:00 -0500"},"longitude":-119.4776058,"id":"advbt67bc0v1","location":"Pixley NWR--Dead Pig Pond"},"type":"Feature","geometry":{"type":"Point","coordinates":[-119.4776058,36.0214054]}},{"properties":{"latitude":35.998563,"column_5":1,"date":{"end_time":"2012/01/01 00:00:00 -0500","original":"12/31/2011","granularity":"day","time":"2011/12/31 00:00:00 -0500"},"longitude":-119.6981049,"id":"advbt6eckvo9","location":"Tulare Lake Bed"},"type":"Feature","geometry":{"type":"Point","coordinates":[-119.6981049,35.998563]}},{"properties":{"latitude":36.016893,"column_5":1,"date":{"end_time":"2012/01/01 00:00:00 -0500","original":"12/31/2011","granularity":"day","time":"2011/12/31 00:00:00 -0500"},"longitude":-119.4976044,"id":"advbt6l958uo","location":"Hwy 43 Corridor (TUL Co.)"},"type":"Feature","geometry":{"type":"Point","coordinates":[-119.4976044,36.016893]}},{"properties":{"latitude":39.1851525,"column_5":1,"date":{"end_time":"2012/01/02 00:00:00 -0500","original":"1/1/2012","granularity":"day","time":"2012/01/01 00:00:00 -0500"},"longitude":-122.0507795,"id":"advbt6f3u2l0","location":"Colusa NWR--Auto Tour Route"},"type":"Feature","geometry":{"type":"Point","coordinates":[-122.0507795,39.1851525]}},{"properties":{"latitude":39.1887724,"column_5":1,"date":{"end_time":"2012/01/02 00:00:00 -0500","original":"1/1/2012","granularity":"day","time":"2012/01/01 00:00:00 -0500"},"longitude":-122.0460537,"id":"advbt6jgpnih","location":"Colusa NWR--viewing platform pond"},"type":"Feature","geometry":{"type":"Point","coordinates":[-122.0460537,39.1887724]}},{"properties":{"latitude":36.9902186,"column_5":1,"date":{"end_time":"2012/01/03 00:00:00 -0500","original":"1/2/2012","granularity":"day","time":"2012/01/02 00:00:00 -0500"},"longitude":-119.7135498,"id":"advbt6fefsmb","location":"Friant bridge (FRE)"},"type":"Feature","geometry":{"type":"Point","coordinates":[-119.7135498,36.9902186]}},{"properties":{"latitude":36.9908877,"column_5":1,"date":{"end_time":"2012/01/03 00:00:00 -0500","original":"1/2/2012","granularity":"day","time":"2012/01/02 00:00:00 -0500"},"longitude":-119.7144083,"id":"advbt6dhtm6c","location":"Friant bridge (Madera Co)"},"type":"Feature","geometry":{"type":"Point","coordinates":[-119.7144083,36.9908877]}},{"properties":{"latitude":36.1603683,"column_5":1,"date":{"end_time":"2012/01/05 00:00:00 -0500","original":"1/4/2012","granularity":"day","time":"2012/01/04 00:00:00 -0500"},"longitude":-114.3989216,"id":"advbt68dhyp9","location":"Lake Mead NRA (NV)"},"type":"Feature","geometry":{"type":"Point","coordinates":[-114.3989216,36.1603683]}},{"properties":{"latitude":33.8612307,"column_5":1,"date":{"end_time":"2012/01/22 00:00:00 -0500","original":"1/21/2012","granularity":"day","time":"2012/01/21 00:00:00 -0500"},"longitude":-112.1366411,"id":"advbt6gtz5s3","location":"Anthem Community Park"},"type":"Feature","geometry":{"type":"Point","coordinates":[-112.1366411,33.8612307]}},{"properties":{"latitude":33.2903058,"column_5":1,"date":{"end_time":"2012/01/22 00:00:00 -0500","original":"1/21/2012","granularity":"day","time":"2012/01/21 00:00:00 -0500"},"longitude":-112.4872417,"id":"advbt6jzbnuq","location":"Buckeye--Tuthill ag fields (Smith's Longspur spot)"},"type":"Feature","geometry":{"type":"Point","coordinates":[-112.4872417,33.2903058]}},{"properties":{"latitude":35.5073114,"column_5":1,"date":{"end_time":"2012/02/06 00:00:00 -0500","original":"2/5/2012","granularity":"day","time":"2012/02/05 00:00:00 -0500"},"longitude":-114.6805138,"id":"advbt68epfch","location":"Lake Mohave -- Cottonwood Cove north (NV side)"},"type":"Feature","geometry":{"type":"Point","coordinates":[-114.6805138,35.5073114]}},{"properties":{"latitude":34.5635356,"column_5":1,"date":{"end_time":"2012/02/19 00:00:00 -0500","original":"2/18/2012","granularity":"day","time":"2012/02/18 00:00:00 -0500"},"longitude":-114.3954912,"id":"advbt671h7e5","location":"Lake Havasu--Castle Rock Bay"},"type":"Feature","geometry":{"type":"Point","coordinates":[-114.3954912,34.5635356]}},{"properties":{"latitude":33.6747709,"column_5":1,"date":{"end_time":"2012/03/06 00:00:00 -0500","original":"3/5/2012","granularity":"day","time":"2012/03/05 00:00:00 -0500"},"longitude":-114.2170353,"id":"advbt6doeyas","location":"Quartzsite"},"type":"Feature","geometry":{"type":"Point","coordinates":[-114.2170353,33.6747709]}},{"properties":{"latitude":33.6902456,"column_5":1,"date":{"end_time":"2012/03/07 00:00:00 -0500","original":"3/6/2012","granularity":"day","time":"2012/03/06 00:00:00 -0500"},"longitude":-114.5126867,"id":"advbt6k2qzoq","location":"Blythe - End of 2nd Ave (Az)"},"type":"Feature","geometry":{"type":"Point","coordinates":[-114.5126867,33.6902456]}},{"properties":{"latitude":33.6623318,"column_5":1,"date":{"end_time":"2012/03/09 00:00:00 -0500","original":"3/8/2012","granularity":"day","time":"2012/03/08 00:00:00 -0500"},"longitude":-114.5718235,"id":"advbt67mczph","location":"Blythe--north side ag"},"type":"Feature","geometry":{"type":"Point","coordinates":[-114.5718235,33.6623318]}},{"properties":{"latitude":32.9941526,"column_5":1,"date":{"end_time":"2012/03/14 00:00:00 -0400","original":"3/13/2012","granularity":"day","time":"2012/03/13 00:00:00 -0400"},"longitude":-114.4975852,"id":"advbt6mhdxhz","location":"Colorado River at Imperial NWR"},"type":"Feature","geometry":{"type":"Point","coordinates":[-114.4975852,32.9941526]}},{"properties":{"latitude":34.8422058,"column_5":1,"date":{"end_time":"2012/03/20 00:00:00 -0400","original":"3/19/2012","granularity":"day","time":"2012/03/19 00:00:00 -0400"},"longitude":-114.5710731,"id":"advbt6iark9b","location":"Aquarius Rd."},"type":"Feature","geometry":{"type":"Point","coordinates":[-114.5710731,34.8422058]}},{"properties":{"latitude":33.0972222,"column_5":1,"date":{"end_time":"2012/04/15 00:00:00 -0400","original":"4/14/2012","granularity":"day","time":"2012/04/14 00:00:00 -0400"},"longitude":-115.7527256,"id":"advbt6agijkd","location":"Salton Sea--Poe Rd."},"type":"Feature","geometry":{"type":"Point","coordinates":[-115.7527256,33.0972222]}},{"properties":{"latitude":33.0765879,"column_5":1,"date":{"end_time":"2012/04/15 00:00:00 -0400","original":"4/14/2012","granularity":"day","time":"2012/04/14 00:00:00 -0400"},"longitude":-115.5110643,"id":"advbt6g00n7t","location":"Ramer Lake"},"type":"Feature","geometry":{"type":"Point","coordinates":[-115.5110643,33.0765879]}},{"properties":{"latitude":32.7818446,"column_5":1,"date":{"end_time":"2012/04/15 00:00:00 -0400","original":"4/14/2012","granularity":"day","time":"2012/04/14 00:00:00 -0400"},"longitude":-115.6841469,"id":"advbt6inrafe","location":"Sunbeam Lake County Park"},"type":"Feature","geometry":{"type":"Point","coordinates":[-115.6841469,32.7818446]}},{"properties":{"latitude":32.7527083,"column_5":1,"date":{"end_time":"2012/04/15 00:00:00 -0400","original":"4/14/2012","granularity":"day","time":"2012/04/14 00:00:00 -0400"},"longitude":-115.535796,"id":"advbt6hpgtke","location":"Ken Kurland's Yard"},"type":"Feature","geometry":{"type":"Point","coordinates":[-115.535796,32.7527083]}},{"properties":{"latitude":32.994703,"column_5":1,"date":{"end_time":"2012/04/15 00:00:00 -0400","original":"4/14/2012","granularity":"day","time":"2012/04/14 00:00:00 -0400"},"longitude":-115.094377,"id":"advbt6m8celk","location":"Glamis Dunes"},"type":"Feature","geometry":{"type":"Point","coordinates":[-115.094377,32.994703]}},{"properties":{"latitude":32.890597,"column_5":1,"date":{"end_time":"2012/04/15 00:00:00 -0400","original":"4/14/2012","granularity":"day","time":"2012/04/14 00:00:00 -0400"},"longitude":-115.6255245,"id":"advbt6ehsta7","location":"Sheldon Reservoir"},"type":"Feature","geometry":{"type":"Point","coordinates":[-115.6255245,32.890597]}},{"properties":{"latitude":33.253878,"column_5":1,"date":{"end_time":"2012/04/15 00:00:00 -0400","original":"4/14/2012","granularity":"day","time":"2012/04/14 00:00:00 -0400"},"longitude":-115.472436,"id":"advbt6lg6m5d","location":"Salvation Mountain"},"type":"Feature","geometry":{"type":"Point","coordinates":[-115.472436,33.253878]}},{"properties":{"latitude":33.6261086,"column_5":1,"date":{"end_time":"2012/04/15 00:00:00 -0400","original":"4/14/2012","granularity":"day","time":"2012/04/14 00:00:00 -0400"},"longitude":-115.3251708,"id":"advbt67efvsm","location":"Corn Springs"},"type":"Feature","geometry":{"type":"Point","coordinates":[-115.3251708,33.6261086]}},{"properties":{"latitude":33.4903725,"column_5":1,"date":{"end_time":"2012/04/15 00:00:00 -0400","original":"4/14/2012","granularity":"day","time":"2012/04/14 00:00:00 -0400"},"longitude":-115.9019852,"id":"advbt6ict96k","location":"Salton Sea SRA--Mecca Beach Campground"},"type":"Feature","geometry":{"type":"Point","coordinates":[-115.9019852,33.4903725]}},{"properties":{"latitude":32.9001297,"column_5":1,"date":{"end_time":"2012/04/19 00:00:00 -0400","original":"4/18/2012","granularity":"day","time":"2012/04/18 00:00:00 -0400"},"longitude":-114.4745812,"id":"advbt6llpgjk","location":"Squaw Lake"},"type":"Feature","geometry":{"type":"Point","coordinates":[-114.4745812,32.9001297]}},{"properties":{"latitude":32.726095,"column_5":1,"date":{"end_time":"2012/04/19 00:00:00 -0400","original":"4/18/2012","granularity":"day","time":"2012/04/18 00:00:00 -0400"},"longitude":-114.572809,"id":"advbt6aa1en1","location":"Unnamed Lake"},"type":"Feature","geometry":{"type":"Point","coordinates":[-114.572809,32.726095]}},{"properties":{"latitude":33.7174438,"column_5":1,"date":{"end_time":"2012/04/20 00:00:00 -0400","original":"4/19/2012","granularity":"day","time":"2012/04/19 00:00:00 -0400"},"longitude":-114.4971176,"id":"advbt67l61am","location":"PVER - n. end Levee Rd"},"type":"Feature","geometry":{"type":"Point","coordinates":[-114.4971176,33.7174438]}},{"properties":{"latitude":33.6997237,"column_5":1,"date":{"end_time":"2012/04/20 00:00:00 -0400","original":"4/19/2012","granularity":"day","time":"2012/04/19 00:00:00 -0400"},"longitude":-114.4989152,"id":"advbt67ijlha","location":"Blythe--end of 2nd Ave."},"type":"Feature","geometry":{"type":"Point","coordinates":[-114.4989152,33.6997237]}},{"properties":{"latitude":34.2952319,"column_5":1,"date":{"end_time":"2012/04/27 00:00:00 -0400","original":"4/26/2012","granularity":"day","time":"2012/04/26 00:00:00 -0400"},"longitude":-114.1387,"id":"advbt69g71in","location":"Parker Dam -- AZ below dam"},"type":"Feature","geometry":{"type":"Point","coordinates":[-114.1387,34.2952319]}},{"properties":{"latitude":34.2614541,"column_5":1,"date":{"end_time":"2012/04/27 00:00:00 -0400","original":"4/26/2012","granularity":"day","time":"2012/04/26 00:00:00 -0400"},"longitude":-114.1397411,"id":"advbt6mcu5ln","location":"Parker Strip -- River Lodge Resort"},"type":"Feature","geometry":{"type":"Point","coordinates":[-114.1397411,34.2614541]}},{"properties":{"latitude":35.1381923,"column_5":1,"date":{"end_time":"2012/04/28 00:00:00 -0400","original":"4/27/2012","granularity":"day","time":"2012/04/27 00:00:00 -0400"},"longitude":-113.5522748,"id":"advbt6khowl0","location":"Willow Creek Preserve"},"type":"Feature","geometry":{"type":"Point","coordinates":[-113.5522748,35.1381923]}},{"properties":{"latitude":35.146686,"column_5":1,"date":{"end_time":"2012/04/28 00:00:00 -0400","original":"4/27/2012","granularity":"day","time":"2012/04/27 00:00:00 -0400"},"longitude":-113.5645639,"id":"advbt683dq68","location":"Silver Springs Road"},"type":"Feature","geometry":{"type":"Point","coordinates":[-113.5645639,35.146686]}},{"properties":{"latitude":32.728024,"column_5":1,"date":{"end_time":"2012/05/05 00:00:00 -0400","original":"5/4/2012","granularity":"day","time":"2012/05/04 00:00:00 -0400"},"longitude":-114.618374,"id":"advbt6a2dt4n","location":"Yuma--Gateway Park"},"type":"Feature","geometry":{"type":"Point","coordinates":[-114.618374,32.728024]}},{"properties":{"latitude":32.7306138,"column_5":1,"date":{"end_time":"2012/05/06 00:00:00 -0400","original":"5/5/2012","granularity":"day","time":"2012/05/05 00:00:00 -0400"},"longitude":-114.6386325,"id":"advbt6k57x5x","location":"Yuma West Wetlands"},"type":"Feature","geometry":{"type":"Point","coordinates":[-114.6386325,32.7306138]}},{"properties":{"latitude":31.4043999,"column_5":1,"date":{"end_time":"2012/05/11 00:00:00 -0400","original":"5/10/2012","granularity":"day","time":"2012/05/10 00:00:00 -0400"},"longitude":-111.0858002,"id":"advbt6dmdnl3","location":"Pena Blanca Lake"},"type":"Feature","geometry":{"type":"Point","coordinates":[-111.0858002,31.4043999]}},{"properties":{"latitude":31.3942323,"column_5":1,"date":{"end_time":"2012/05/11 00:00:00 -0400","original":"5/10/2012","granularity":"day","time":"2012/05/10 00:00:00 -0400"},"longitude":-111.0442552,"id":"advbt6hjbfaf","location":"Ruby Road"},"type":"Feature","geometry":{"type":"Point","coordinates":[-111.0442552,31.3942323]}},{"properties":{"latitude":31.4724011,"column_5":1,"date":{"end_time":"2012/05/12 00:00:00 -0400","original":"5/11/2012","granularity":"day","time":"2012/05/11 00:00:00 -0400"},"longitude":-110.9867749,"id":"advbt6i772qt","location":"Rio Rico Pond"},"type":"Feature","geometry":{"type":"Point","coordinates":[-110.9867749,31.4724011]}},{"properties":{"latitude":31.720328,"column_5":1,"date":{"end_time":"2012/05/12 00:00:00 -0400","original":"5/11/2012","granularity":"day","time":"2012/05/11 00:00:00 -0400"},"longitude":-110.879045,"id":"advbt6fg9yw5","location":"Madera Canyon--Madera Kubo B&amp;B"},"type":"Feature","geometry":{"type":"Point","coordinates":[-110.879045,31.720328]}},{"properties":{"latitude":32.0197728,"column_5":1,"date":{"end_time":"2012/05/13 00:00:00 -0400","original":"5/12/2012","granularity":"day","time":"2012/05/12 00:00:00 -0400"},"longitude":-111.6139657,"id":"advbt66lfppt","location":"Hwy 86--West of Kitt Peak"},"type":"Feature","geometry":{"type":"Point","coordinates":[-111.6139657,32.0197728]}},{"properties":{"latitude":31.4482569,"column_5":1,"date":{"end_time":"2012/05/13 00:00:00 -0400","original":"5/12/2012","granularity":"day","time":"2012/05/12 00:00:00 -0400"},"longitude":-110.3067604,"id":"advbt67rmjrf","location":"Ramsey Canyon Inn"},"type":"Feature","geometry":{"type":"Point","coordinates":[-110.3067604,31.4482569]}},{"properties":{"latitude":32.0314583,"column_5":1,"date":{"end_time":"2012/05/13 00:00:00 -0400","original":"5/12/2012","granularity":"day","time":"2012/05/12 00:00:00 -0400"},"longitude":-112.9260222,"id":"advbt6fhygvu","location":"Organ Pipe Cactus NM--Puerto Blanco Drive"},"type":"Feature","geometry":{"type":"Point","coordinates":[-112.9260222,32.0314583]}},{"properties":{"latitude":31.4274006,"column_5":1,"date":{"end_time":"2012/05/13 00:00:00 -0400","original":"5/12/2012","granularity":"day","time":"2012/05/12 00:00:00 -0400"},"longitude":-110.3087997,"id":"advbt6fzvfm2","location":"Carr Canyon--Comfort Spring"},"type":"Feature","geometry":{"type":"Point","coordinates":[-110.3087997,31.4274006]}},{"properties":{"latitude":32.0670167,"column_5":1,"date":{"end_time":"2012/05/14 00:00:00 -0400","original":"5/13/2012","granularity":"day","time":"2012/05/13 00:00:00 -0400"},"longitude":-112.7145806,"id":"advbt696xvkb","location":"Organ Pipe Cactus NM--Alamo Canyon"},"type":"Feature","geometry":{"type":"Point","coordinates":[-112.7145806,32.0670167]}},{"properties":{"latitude":34.4391221,"column_5":1,"date":{"end_time":"2012/05/17 00:00:00 -0400","original":"5/16/2012","granularity":"day","time":"2012/05/16 00:00:00 -0400"},"longitude":-114.3642966,"id":"advbt67vyxjt","location":"Lake Havasu--Coves opposite Site Six (CA)"},"type":"Feature","geometry":{"type":"Point","coordinates":[-114.3642966,34.4391221]}},{"properties":{"latitude":34.2747463,"column_5":1,"date":{"end_time":"2012/05/18 00:00:00 -0400","original":"5/17/2012","granularity":"day","time":"2012/05/17 00:00:00 -0400"},"longitude":-114.0520486,"id":"advbt6gffddv","location":"Bill Williams River NWR--Tunnel (LAP)"},"type":"Feature","geometry":{"type":"Point","coordinates":[-114.0520486,34.2747463]}},{"properties":{"latitude":35.2682747,"column_5":1,"date":{"end_time":"2012/05/25 00:00:00 -0400","original":"5/24/2012","granularity":"day","time":"2012/05/24 00:00:00 -0400"},"longitude":-115.2926946,"id":"advbt6iz3pij","location":"Mojave National Preserve--New York Mtns.-Keystone Canyon"},"type":"Feature","geometry":{"type":"Point","coordinates":[-115.2926946,35.2682747]}},{"properties":{"latitude":35.1425159,"column_5":1,"date":{"end_time":"2012/05/25 00:00:00 -0400","original":"5/24/2012","granularity":"day","time":"2012/05/24 00:00:00 -0400"},"longitude":-116.1043149,"id":"advbt6cbnem5","location":"Zzyzx--Desert Studies Center"},"type":"Feature","geometry":{"type":"Point","coordinates":[-116.1043149,35.1425159]}},{"properties":{"latitude":35.8009772,"column_5":1,"date":{"end_time":"2012/05/26 00:00:00 -0400","original":"5/25/2012","granularity":"day","time":"2012/05/25 00:00:00 -0400"},"longitude":-116.1945391,"id":"advbt6d318fy","location":"China Ranch Date Farm"},"type":"Feature","geometry":{"type":"Point","coordinates":[-116.1945391,35.8009772]}},{"properties":{"latitude":36.4205659,"column_5":1,"date":{"end_time":"2012/05/26 00:00:00 -0400","original":"5/25/2012","granularity":"day","time":"2012/05/25 00:00:00 -0400"},"longitude":-116.3292557,"id":"advbt6f2mudl","location":"Ash Meadows NWR--Crystal Boardwalk"},"type":"Feature","geometry":{"type":"Point","coordinates":[-116.3292557,36.4205659]}},{"properties":{"latitude":35.97992,"column_5":1,"date":{"end_time":"2012/05/26 00:00:00 -0400","original":"5/25/2012","granularity":"day","time":"2012/05/25 00:00:00 -0400"},"longitude":-116.272784,"id":"advbt6h7mkik","location":"Shoshone"},"type":"Feature","geometry":{"type":"Point","coordinates":[-116.272784,35.97992]}},{"properties":{"latitude":35.800318,"column_5":1,"date":{"end_time":"2012/05/26 00:00:00 -0400","original":"5/25/2012","granularity":"day","time":"2012/05/25 00:00:00 -0400"},"longitude":-116.101703,"id":"advbt6jo0805","location":"Heavy Metal Mine"},"type":"Feature","geometry":{"type":"Point","coordinates":[-116.101703,35.800318]}},{"properties":{"latitude":37.3733972,"column_5":1,"date":{"end_time":"2012/05/27 00:00:00 -0400","original":"5/26/2012","granularity":"day","time":"2012/05/26 00:00:00 -0400"},"longitude":-117.9840231,"id":"advbt6fyky64","location":"Deep Springs College (restricted access)"},"type":"Feature","geometry":{"type":"Point","coordinates":[-117.9840231,37.3733972]}},{"properties":{"latitude":37.4887523,"column_5":1,"date":{"end_time":"2012/05/27 00:00:00 -0400","original":"5/26/2012","granularity":"day","time":"2012/05/26 00:00:00 -0400"},"longitude":-117.9166566,"id":"advbt6bcvjz1","location":"Oasis Ranch"},"type":"Feature","geometry":{"type":"Point","coordinates":[-117.9166566,37.4887523]}},{"properties":{"latitude":36.9640875,"column_5":1,"date":{"end_time":"2012/05/27 00:00:00 -0400","original":"5/26/2012","granularity":"day","time":"2012/05/26 00:00:00 -0400"},"longitude":-117.3665068,"id":"advbt66ondv2","location":"Death Valley NP--Mesquite Springs"},"type":"Feature","geometry":{"type":"Point","coordinates":[-117.3665068,36.9640875]}},{"properties":{"latitude":37.442988,"column_5":1,"date":{"end_time":"2012/05/27 00:00:00 -0400","original":"5/26/2012","granularity":"day","time":"2012/05/26 00:00:00 -0400"},"longitude":-117.4161376,"id":"advbt6kmmlyd","location":"Esmeralda County, NV"},"type":"Feature","geometry":{"type":"Point","coordinates":[-117.4161376,37.442988]}},{"properties":{"latitude":37.0311223,"column_5":1,"date":{"end_time":"2012/05/27 00:00:00 -0400","original":"5/26/2012","granularity":"day","time":"2012/05/26 00:00:00 -0400"},"longitude":-117.3425898,"id":"advbt69wdh8p","location":"Death Valley NP--Scotty's Castle"},"type":"Feature","geometry":{"type":"Point","coordinates":[-117.3425898,37.0311223]}},{"properties":{"latitude":37.4557659,"column_5":1,"date":{"end_time":"2012/05/27 00:00:00 -0400","original":"5/26/2012","granularity":"day","time":"2012/05/26 00:00:00 -0400"},"longitude":-117.4995625,"id":"advbt6ikexo1","location":"Lida"},"type":"Feature","geometry":{"type":"Point","coordinates":[-117.4995625,37.4557659]}},{"properties":{"latitude":35.3817725,"column_5":1,"date":{"end_time":"2012/05/28 00:00:00 -0400","original":"5/27/2012","granularity":"day","time":"2012/05/27 00:00:00 -0400"},"longitude":-118.113327,"id":"advbt6hdt5j0","location":"Butterbredt Spring"},"type":"Feature","geometry":{"type":"Point","coordinates":[-118.113327,35.3817725]}},{"properties":{"latitude":35.3158522,"column_5":1,"date":{"end_time":"2012/05/28 00:00:00 -0400","original":"5/27/2012","granularity":"day","time":"2012/05/27 00:00:00 -0400"},"longitude":-118.0470222,"id":"advbt6g5cxv3","location":"Jawbone DWP"},"type":"Feature","geometry":{"type":"Point","coordinates":[-118.0470222,35.3158522]}},{"properties":{"latitude":35.5673521,"column_5":1,"date":{"end_time":"2012/05/28 00:00:00 -0400","original":"5/27/2012","granularity":"day","time":"2012/05/27 00:00:00 -0400"},"longitude":-117.6706123,"id":"advbt6ldr9tv","location":"Cerro Coso Community College"},"type":"Feature","geometry":{"type":"Point","coordinates":[-117.6706123,35.5673521]}},{"properties":{"latitude":35.464827,"column_5":1,"date":{"end_time":"2012/05/28 00:00:00 -0400","original":"5/27/2012","granularity":"day","time":"2012/05/27 00:00:00 -0400"},"longitude":-114.918927,"id":"advbt6dw78ur","location":"Searchlight"},"type":"Feature","geometry":{"type":"Point","coordinates":[-114.918927,35.464827]}},{"properties":{"latitude":35.32302,"column_5":1,"date":{"end_time":"2012/05/28 00:00:00 -0400","original":"5/27/2012","granularity":"day","time":"2012/05/27 00:00:00 -0400"},"longitude":-118.1111,"id":"advbt6gvnlfb","location":"Jawbone Canyon LCTH Spot"},"type":"Feature","geometry":{"type":"Point","coordinates":[-118.1111,35.32302]}},{"properties":{"latitude":33.0336031,"column_5":1,"date":{"end_time":"2012/06/05 00:00:00 -0400","original":"6/4/2012","granularity":"day","time":"2012/06/04 00:00:00 -0400"},"longitude":-114.6552956,"id":"advbt6bxedmm","location":"Picacho SRA - Paddlewheeler Camp"},"type":"Feature","geometry":{"type":"Point","coordinates":[-114.6552956,33.0336031]}},{"properties":{"latitude":33.7666516,"column_5":1,"date":{"end_time":"2012/07/02 00:00:00 -0400","original":"7/1/2012","granularity":"day","time":"2012/07/01 00:00:00 -0400"},"longitude":-114.4634898,"id":"advbt6j363pn","location":"Parker Valley - Welsh Rd"},"type":"Feature","geometry":{"type":"Point","coordinates":[-114.4634898,33.7666516]}},{"properties":{"latitude":40.828359,"column_5":1,"date":{"end_time":"2012/07/06 00:00:00 -0400","original":"7/5/2012","granularity":"day","time":"2012/07/05 00:00:00 -0400"},"longitude":-111.9680222,"id":"advbt6ffmhby","location":"3200 West (SLC Airport to 3200 N)"},"type":"Feature","geometry":{"type":"Point","coordinates":[-111.9680222,40.828359]}},{"properties":{"latitude":39.7474539,"column_5":1,"date":{"end_time":"2012/07/07 00:00:00 -0400","original":"7/6/2012","granularity":"day","time":"2012/07/06 00:00:00 -0400"},"longitude":-104.9455476,"id":"advbt6boks0e","location":"Denver--City Park"},"type":"Feature","geometry":{"type":"Point","coordinates":[-104.9455476,39.7474539]}},{"properties":{"latitude":39.79985,"column_5":1,"date":{"end_time":"2012/07/08 00:00:00 -0400","original":"7/7/2012","granularity":"day","time":"2012/07/07 00:00:00 -0400"},"longitude":-104.86557,"id":"advbt6kvmdyx","location":"Rocky Mountain Arsenal NWR"},"type":"Feature","geometry":{"type":"Point","coordinates":[-104.86557,39.79985]}},{"properties":{"latitude":33.9491643,"column_5":1,"date":{"end_time":"2012/08/06 00:00:00 -0400","original":"8/5/2012","granularity":"day","time":"2012/08/05 00:00:00 -0400"},"longitude":-114.5353954,"id":"advbt6ib90rr","location":"Hwy 95 north of Waterwheel"},"type":"Feature","geometry":{"type":"Point","coordinates":[-114.5353954,33.9491643]}},{"properties":{"latitude":39.623834,"column_5":1,"date":{"end_time":"2012/08/08 00:00:00 -0400","original":"8/7/2012","granularity":"day","time":"2012/08/07 00:00:00 -0400"},"longitude":-104.896954,"id":"advbt6dkg1p3","location":"Denver Tech Center"},"type":"Feature","geometry":{"type":"Point","coordinates":[-104.896954,39.623834]}},{"properties":{"latitude":39.6395376,"column_5":1,"date":{"end_time":"2012/08/10 00:00:00 -0400","original":"8/9/2012","granularity":"day","time":"2012/08/09 00:00:00 -0400"},"longitude":-104.8425293,"id":"advbt6am55c2","location":"Cherry Creek State Park"},"type":"Feature","geometry":{"type":"Point","coordinates":[-104.8425293,39.6395376]}},{"properties":{"latitude":39.6217719,"column_5":1,"date":{"end_time":"2012/08/11 00:00:00 -0400","original":"8/10/2012","granularity":"day","time":"2012/08/10 00:00:00 -0400"},"longitude":-105.0423603,"id":"advbt6jgnoys","location":"Austin's Aunt House"},"type":"Feature","geometry":{"type":"Point","coordinates":[-105.0423603,39.6217719]}},{"properties":{"latitude":39.5867068,"column_5":1,"date":{"end_time":"2012/08/13 00:00:00 -0400","original":"8/12/2012","granularity":"day","time":"2012/08/12 00:00:00 -0400"},"longitude":-105.643158,"id":"advbt6kc2tl9","location":"Mt. Evans"},"type":"Feature","geometry":{"type":"Point","coordinates":[-105.643158,39.5867068]}},{"properties":{"latitude":39.59773,"column_5":1,"date":{"end_time":"2012/08/13 00:00:00 -0400","original":"8/12/2012","granularity":"day","time":"2012/08/12 00:00:00 -0400"},"longitude":-105.6445,"id":"advbt6bmrcj5","location":"Mt. Evans--Summit Lake"},"type":"Feature","geometry":{"type":"Point","coordinates":[-105.6445,39.59773]}},{"properties":{"latitude":33.3693695,"column_5":1,"date":{"end_time":"2012/09/16 00:00:00 -0400","original":"9/15/2012","granularity":"day","time":"2012/09/15 00:00:00 -0400"},"longitude":-111.6886908,"id":"advbt69hxfec","location":"Gilbert--Power &amp; Guadalupe Rd. Pond"},"type":"Feature","geometry":{"type":"Point","coordinates":[-111.6886908,33.3693695]}},{"properties":{"latitude":33.5138839,"column_5":1,"date":{"end_time":"2012/09/16 00:00:00 -0400","original":"9/15/2012","granularity":"day","time":"2012/09/15 00:00:00 -0400"},"longitude":-111.6830875,"id":"advbt6mc0xct","location":"Salt River--Granite Reef Recreation Area"},"type":"Feature","geometry":{"type":"Point","coordinates":[-111.6830875,33.5138839]}},{"properties":{"latitude":33.5533408,"column_5":1,"date":{"end_time":"2012/09/16 00:00:00 -0400","original":"9/15/2012","granularity":"day","time":"2012/09/15 00:00:00 -0400"},"longitude":-111.5876198,"id":"advbt6egvbey","location":"Salt River--Foxtail/Sheeps Crossing Recreation Sites"},"type":"Feature","geometry":{"type":"Point","coordinates":[-111.5876198,33.5533408]}},{"properties":{"latitude":37.7656261,"column_5":1,"date":{"end_time":"2012/09/26 00:00:00 -0400","original":"9/25/2012","granularity":"day","time":"2012/09/25 00:00:00 -0400"},"longitude":-122.2744846,"id":"advbt6k7b8n9","location":"Crown Memorial SB"},"type":"Feature","geometry":{"type":"Point","coordinates":[-122.2744846,37.7656261]}},{"properties":{"latitude":37.9209857,"column_5":1,"date":{"end_time":"2012/09/26 00:00:00 -0400","original":"9/25/2012","granularity":"day","time":"2012/09/25 00:00:00 -0400"},"longitude":-122.6904202,"id":"advbt6kutlbf","location":"Bolinas Lagoon--Pine Gulch"},"type":"Feature","geometry":{"type":"Point","coordinates":[-122.6904202,37.9209857]}},{"properties":{"latitude":37.7525975,"column_5":1,"date":{"end_time":"2012/09/26 00:00:00 -0400","original":"9/25/2012","granularity":"day","time":"2012/09/25 00:00:00 -0400"},"longitude":-122.2473836,"id":"advbt68oen60","location":"Elsie Roemer Bird Sanctuary"},"type":"Feature","geometry":{"type":"Point","coordinates":[-122.2473836,37.7525975]}},{"properties":{"latitude":37.9098045,"column_5":1,"date":{"end_time":"2012/09/26 00:00:00 -0400","original":"9/25/2012","granularity":"day","time":"2012/09/25 00:00:00 -0400"},"longitude":-122.3525047,"id":"advbt68r26cn","location":"Richmond Marina"},"type":"Feature","geometry":{"type":"Point","coordinates":[-122.3525047,37.9098045]}},{"properties":{"latitude":38.0423924,"column_5":1,"date":{"end_time":"2012/09/27 00:00:00 -0400","original":"9/26/2012","granularity":"day","time":"2012/09/26 00:00:00 -0400"},"longitude":-122.979189,"id":"advbt6gkorkx","location":"Pt. Reyes--Spaletta Ranch (C Ranch)"},"type":"Feature","geometry":{"type":"Point","coordinates":[-122.979189,38.0423924]}},{"properties":{"latitude":37.9128434,"column_5":1,"date":{"end_time":"2012/09/27 00:00:00 -0400","original":"9/26/2012","granularity":"day","time":"2012/09/26 00:00:00 -0400"},"longitude":-122.7081228,"id":"advbt6dycvsi","location":"Bolinas--Mesa Rd"},"type":"Feature","geometry":{"type":"Point","coordinates":[-122.7081228,37.9128434]}},{"properties":{"latitude":38.0331013,"column_5":1,"date":{"end_time":"2012/09/27 00:00:00 -0400","original":"9/26/2012","granularity":"day","time":"2012/09/26 00:00:00 -0400"},"longitude":-122.9612589,"id":"advbt6ahiegz","location":"Pt. Reyes--D Ranch pond"},"type":"Feature","geometry":{"type":"Point","coordinates":[-122.9612589,38.0331013]}},{"properties":{"latitude":37.9956216,"column_5":1,"date":{"end_time":"2012/09/27 00:00:00 -0400","original":"9/26/2012","granularity":"day","time":"2012/09/26 00:00:00 -0400"},"longitude":-122.9782104,"id":"advbt6m788u3","location":"Pt. Reyes--Fish Docks"},"type":"Feature","geometry":{"type":"Point","coordinates":[-122.9782104,37.9956216]}},{"properties":{"latitude":38.0271821,"column_5":1,"date":{"end_time":"2012/09/27 00:00:00 -0400","original":"9/26/2012","granularity":"day","time":"2012/09/26 00:00:00 -0400"},"longitude":-122.9615507,"id":"advbt67zuiuf","location":"Pt. Reyes--Drakes Beach"},"type":"Feature","geometry":{"type":"Point","coordinates":[-122.9615507,38.0271821]}},{"properties":{"latitude":38.0842687,"column_5":1,"date":{"end_time":"2012/09/27 00:00:00 -0400","original":"9/26/2012","granularity":"day","time":"2012/09/26 00:00:00 -0400"},"longitude":-122.9548109,"id":"advbt67qnnpk","location":"Pt. Reyes--abandoned ranch"},"type":"Feature","geometry":{"type":"Point","coordinates":[-122.9548109,38.0842687]}},{"properties":{"latitude":37.996,"column_5":1,"date":{"end_time":"2012/09/27 00:00:00 -0400","original":"9/26/2012","granularity":"day","time":"2012/09/26 00:00:00 -0400"},"longitude":-123.022,"id":"advbt6f2r8m7","location":"Pt. Reyes--Lighthouse"},"type":"Feature","geometry":{"type":"Point","coordinates":[-123.022,37.996]}},{"properties":{"latitude":38.0164178,"column_5":1,"date":{"end_time":"2012/09/27 00:00:00 -0400","original":"9/26/2012","granularity":"day","time":"2012/09/26 00:00:00 -0400"},"longitude":-122.9882956,"id":"advbt6bxs2s7","location":"Pt. Reyes--Mendoza Ranch (B Ranch)"},"type":"Feature","geometry":{"type":"Point","coordinates":[-122.9882956,38.0164178]}},{"properties":{"latitude":38.0001533,"column_5":1,"date":{"end_time":"2012/09/27 00:00:00 -0400","original":"9/26/2012","granularity":"day","time":"2012/09/26 00:00:00 -0400"},"longitude":-122.9959291,"id":"advbt6g95thz","location":"Pt. Reyes--Nunes Ranch (A Ranch)"},"type":"Feature","geometry":{"type":"Point","coordinates":[-122.9959291,38.0001533]}},{"properties":{"latitude":37.9707769,"column_5":1,"date":{"end_time":"2012/09/27 00:00:00 -0400","original":"9/26/2012","granularity":"day","time":"2012/09/26 00:00:00 -0400"},"longitude":-122.7309538,"id":"advbt6bl7ul7","location":"PRBO Wetlands Center"},"type":"Feature","geometry":{"type":"Point","coordinates":[-122.7309538,37.9707769]}},{"properties":{"latitude":38.0798944,"column_5":1,"date":{"end_time":"2012/09/27 00:00:00 -0400","original":"9/26/2012","granularity":"day","time":"2012/09/26 00:00:00 -0400"},"longitude":-122.9616774,"id":"advbt6hg9sgq","location":"Pt. Reyes--middle"},"type":"Feature","geometry":{"type":"Point","coordinates":[-122.9616774,38.0798944]}},{"properties":{"latitude":38.3169795,"column_5":1,"date":{"end_time":"2012/09/28 00:00:00 -0400","original":"9/27/2012","granularity":"day","time":"2012/09/27 00:00:00 -0400"},"longitude":-123.0572176,"id":"advbt6eelduq","location":"Bodega Marine Lab--residence entrance"},"type":"Feature","geometry":{"type":"Point","coordinates":[-123.0572176,38.3169795]}},{"properties":{"latitude":38.3137807,"column_5":1,"date":{"end_time":"2012/09/28 00:00:00 -0400","original":"9/27/2012","granularity":"day","time":"2012/09/27 00:00:00 -0400"},"longitude":-123.0604792,"id":"advbt6cey3sc","location":"Bodega Marine Lab entrance--cypress grove"},"type":"Feature","geometry":{"type":"Point","coordinates":[-123.0604792,38.3137807]}},{"properties":{"latitude":38.2924127,"column_5":1,"date":{"end_time":"2012/09/28 00:00:00 -0400","original":"9/27/2012","granularity":"day","time":"2012/09/27 00:00:00 -0400"},"longitude":-122.8339505,"id":"advbt6c9da7l","location":"Carmody Rd--Sonoma Co"},"type":"Feature","geometry":{"type":"Point","coordinates":[-122.8339505,38.2924127]}},{"properties":{"latitude":38.225033,"column_5":1,"date":{"end_time":"2012/09/29 00:00:00 -0400","original":"9/28/2012","granularity":"day","time":"2012/09/28 00:00:00 -0400"},"longitude":-122.5786686,"id":"advbt6ito5y2","location":"Ellis Creek Water Recycling Facility"},"type":"Feature","geometry":{"type":"Point","coordinates":[-122.5786686,38.225033]}},{"properties":{"latitude":38.0274109,"column_5":1,"date":{"end_time":"2012/09/30 00:00:00 -0400","original":"9/29/2012","granularity":"day","time":"2012/09/29 00:00:00 -0400"},"longitude":-122.515583,"id":"advbt67od3qy","location":"Las Gallinas Valley Sanitary District"},"type":"Feature","geometry":{"type":"Point","coordinates":[-122.515583,38.0274109]}},{"properties":{"latitude":36.9123452,"column_5":1,"date":{"end_time":"2012/09/30 00:00:00 -0400","original":"9/29/2012","granularity":"day","time":"2012/09/29 00:00:00 -0400"},"longitude":-121.7700791,"id":"advbt6iz8g66","location":"Watsonville Slough--upper"},"type":"Feature","geometry":{"type":"Point","coordinates":[-121.7700791,36.9123452]}},{"properties":{"latitude":34.8363992,"column_5":1,"date":{"end_time":"2012/10/07 00:00:00 -0400","original":"10/6/2012","granularity":"day","time":"2012/10/06 00:00:00 -0400"},"longitude":-114.6004946,"id":"advbt69lbhc3","location":"Needles"},"type":"Feature","geometry":{"type":"Point","coordinates":[-114.6004946,34.8363992]}},{"properties":{"latitude":35.879141,"column_5":1,"date":{"end_time":"2012/10/24 00:00:00 -0400","original":"10/23/2012","granularity":"day","time":"2012/10/23 00:00:00 -0400"},"longitude":-114.932399,"id":"advbt67utam3","location":"El Dorado Playa"},"type":"Feature","geometry":{"type":"Point","coordinates":[-114.932399,35.879141]}},{"properties":{"latitude":35.1128175,"column_5":1,"date":{"end_time":"2012/10/24 00:00:00 -0400","original":"10/23/2012","granularity":"day","time":"2012/10/23 00:00:00 -0400"},"longitude":-114.9721706,"id":"advbt6i1rn8a","location":"Mojave National Preserve--Piute Springs riparian area"},"type":"Feature","geometry":{"type":"Point","coordinates":[-114.9721706,35.1128175]}},{"properties":{"latitude":33.685868,"column_5":1,"date":{"end_time":"2012/10/26 00:00:00 -0400","original":"10/25/2012","granularity":"day","time":"2012/10/25 00:00:00 -0400"},"longitude":-114.5166779,"id":"advbt6g65jh4","location":"La Paz Co., AZ, across from Palo Verde Ecological Reserve"},"type":"Feature","geometry":{"type":"Point","coordinates":[-114.5166779,33.685868]}},{"properties":{"latitude":36.3228361,"column_5":1,"date":{"end_time":"2012/11/05 00:00:00 -0500","original":"11/4/2012","granularity":"day","time":"2012/11/04 00:00:00 -0400"},"longitude":-115.2660012,"id":"advbt6ha3nbm","location":"Floyd Lamb Park at Tule Springs"},"type":"Feature","geometry":{"type":"Point","coordinates":[-115.2660012,36.3228361]}},{"properties":{"latitude":35.4912848,"column_5":1,"date":{"end_time":"2012/11/05 00:00:00 -0500","original":"11/4/2012","granularity":"day","time":"2012/11/04 00:00:00 -0400"},"longitude":-114.6857643,"id":"advbt679kqmr","location":"Cottonwood Cove Resort &amp; Marina"},"type":"Feature","geometry":{"type":"Point","coordinates":[-114.6857643,35.4912848]}},{"properties":{"latitude":35.4787203,"column_5":1,"date":{"end_time":"2012/11/05 00:00:00 -0500","original":"11/4/2012","granularity":"day","time":"2012/11/04 00:00:00 -0400"},"longitude":-114.7760582,"id":"advbt6k4nox9","location":"Cottonwood Cove Rd"},"type":"Feature","geometry":{"type":"Point","coordinates":[-114.7760582,35.4787203]}},{"properties":{"latitude":34.256712,"column_5":1,"date":{"end_time":"2012/12/15 00:00:00 -0500","original":"12/14/2012","granularity":"day","time":"2012/12/14 00:00:00 -0500"},"longitude":-114.145075,"id":"advbt6dh8yag","location":"Castle Rock Shores"},"type":"Feature","geometry":{"type":"Point","coordinates":[-114.145075,34.256712]}},{"properties":{"latitude":32.820618,"column_5":1,"date":{"end_time":"2012/12/16 00:00:00 -0500","original":"12/15/2012","granularity":"day","time":"2012/12/15 00:00:00 -0500"},"longitude":-114.530386,"id":"advbt6ekt0ti","location":"Heyser Rd Canal"},"type":"Feature","geometry":{"type":"Point","coordinates":[-114.530386,32.820618]}},{"properties":{"latitude":33.007705,"column_5":1,"date":{"end_time":"2012/12/16 00:00:00 -0500","original":"12/15/2012","granularity":"day","time":"2012/12/15 00:00:00 -0500"},"longitude":-114.2857374,"id":"advbt6l9hl1l","location":"Hwy 95--Yuma Co"},"type":"Feature","geometry":{"type":"Point","coordinates":[-114.2857374,33.007705]}},{"properties":{"latitude":33.1618044,"column_5":1,"date":{"end_time":"2012/12/18 00:00:00 -0500","original":"12/17/2012","granularity":"day","time":"2012/12/17 00:00:00 -0500"},"longitude":-115.6486988,"id":"advbt6i5o2ay","location":"Salton Sea--Lack Rd. at Grubel Rd. seawall"},"type":"Feature","geometry":{"type":"Point","coordinates":[-115.6486988,33.1618044]}},{"properties":{"latitude":32.9786224,"column_5":1,"date":{"end_time":"2012/12/18 00:00:00 -0500","original":"12/17/2012","granularity":"day","time":"2012/12/17 00:00:00 -0500"},"longitude":-115.5302524,"id":"advbt6iq2o6c","location":"Brawley"},"type":"Feature","geometry":{"type":"Point","coordinates":[-115.5302524,32.9786224]}},{"properties":{"latitude":34.8683627,"column_5":1,"date":{"end_time":"2012/12/23 00:00:00 -0500","original":"12/22/2012","granularity":"day","time":"2012/12/22 00:00:00 -0500"},"longitude":-116.7683172,"id":"advbt6edeff1","location":"Minneola Rd."},"type":"Feature","geometry":{"type":"Point","coordinates":[-116.7683172,34.8683627]}},{"properties":{"latitude":35.159731,"column_5":1,"date":{"end_time":"2012/12/25 00:00:00 -0500","original":"12/24/2012","granularity":"day","time":"2012/12/24 00:00:00 -0500"},"longitude":-120.686261,"id":"advbt69spb77","location":"Spyglass Park"},"type":"Feature","geometry":{"type":"Point","coordinates":[-120.686261,35.159731]}},{"properties":{"latitude":34.5487018,"column_5":1,"date":{"end_time":"2012/12/25 00:00:00 -0500","original":"12/24/2012","granularity":"day","time":"2012/12/24 00:00:00 -0500"},"longitude":-119.8936719,"id":"advbt685g4jz","location":"Cachuma Lake--east end"},"type":"Feature","geometry":{"type":"Point","coordinates":[-119.8936719,34.5487018]}},{"properties":{"latitude":34.9339641,"column_5":1,"date":{"end_time":"2012/12/25 00:00:00 -0500","original":"12/24/2012","granularity":"day","time":"2012/12/24 00:00:00 -0500"},"longitude":-120.4175806,"id":"advbt6fiulsg","location":"Hwy 101--Santa Maria"},"type":"Feature","geometry":{"type":"Point","coordinates":[-120.4175806,34.9339641]}},{"properties":{"latitude":34.8307289,"column_5":1,"date":{"end_time":"2012/12/25 00:00:00 -0500","original":"12/24/2012","granularity":"day","time":"2012/12/24 00:00:00 -0500"},"longitude":-120.362649,"id":"advbt6d6tuyg","location":"Hwy 101--Solomon Hills"},"type":"Feature","geometry":{"type":"Point","coordinates":[-120.362649,34.8307289]}},{"properties":{"latitude":34.420691,"column_5":1,"date":{"end_time":"2012/12/25 00:00:00 -0500","original":"12/24/2012","granularity":"day","time":"2012/12/24 00:00:00 -0500"},"longitude":-119.620081,"id":"advbt6lc2ebl","location":"Fernald Point Ln"},"type":"Feature","geometry":{"type":"Point","coordinates":[-119.620081,34.420691]}},{"properties":{"latitude":34.416808,"column_5":1,"date":{"end_time":"2012/12/25 00:00:00 -0500","original":"12/24/2012","granularity":"day","time":"2012/12/24 00:00:00 -0500"},"longitude":-119.641809,"id":"advbt6cwbz0a","location":"Upper Butterfly Lane"},"type":"Feature","geometry":{"type":"Point","coordinates":[-119.641809,34.416808]}},{"properties":{"latitude":34.3789382,"column_5":1,"date":{"end_time":"2012/12/25 00:00:00 -0500","original":"12/24/2012","granularity":"day","time":"2012/12/24 00:00:00 -0500"},"longitude":-119.47534,"id":"advbt6l0fkxe","location":"Bates Rd. Bridge--VEN"},"type":"Feature","geometry":{"type":"Point","coordinates":[-119.47534,34.3789382]}},{"properties":{"latitude":34.588361,"column_5":1,"date":{"end_time":"2012/12/27 00:00:00 -0500","original":"12/26/2012","granularity":"day","time":"2012/12/26 00:00:00 -0500"},"longitude":-120.0291538,"id":"advbt677oc83","location":"Hwy 154--Santa Ynez River bridge"},"type":"Feature","geometry":{"type":"Point","coordinates":[-120.0291538,34.588361]}},{"properties":{"latitude":35.1092367,"column_5":1,"date":{"end_time":"2012/12/27 00:00:00 -0500","original":"12/26/2012","granularity":"day","time":"2012/12/26 00:00:00 -0500"},"longitude":-120.626986,"id":"advbt6ewhdga","location":"Pismo SB--Oceano Campground"},"type":"Feature","geometry":{"type":"Point","coordinates":[-120.626986,35.1092367]}},{"properties":{"latitude":35.0302072,"column_5":1,"date":{"end_time":"2012/12/27 00:00:00 -0500","original":"12/26/2012","granularity":"day","time":"2012/12/26 00:00:00 -0500"},"longitude":-120.6207848,"id":"advbt6k1f3eg","location":"Oso Flaco Lake"},"type":"Feature","geometry":{"type":"Point","coordinates":[-120.6207848,35.0302072]}},{"properties":{"latitude":35.1817709,"column_5":1,"date":{"end_time":"2012/12/27 00:00:00 -0500","original":"12/26/2012","granularity":"day","time":"2012/12/26 00:00:00 -0500"},"longitude":-120.7364416,"id":"advbt67pbozu","location":"San Luis Obispo Creek mouth"},"type":"Feature","geometry":{"type":"Point","coordinates":[-120.7364416,35.1817709]}},{"properties":{"latitude":35.1770149,"column_5":1,"date":{"end_time":"2012/12/27 00:00:00 -0500","original":"12/26/2012","granularity":"day","time":"2012/12/26 00:00:00 -0500"},"longitude":-120.7413109,"id":"advbt6d835bu","location":"Avila Beach--Cal Poly Pier"},"type":"Feature","geometry":{"type":"Point","coordinates":[-120.7413109,35.1770149]}},{"properties":{"latitude":35.137458,"column_5":1,"date":{"end_time":"2012/12/27 00:00:00 -0500","original":"12/26/2012","granularity":"day","time":"2012/12/26 00:00:00 -0500"},"longitude":-120.646534,"id":"advbt6l2um88","location":"Pismo Beach Pier"},"type":"Feature","geometry":{"type":"Point","coordinates":[-120.646534,35.137458]}},{"properties":{"latitude":34.5843937,"column_5":1,"date":{"end_time":"2012/12/27 00:00:00 -0500","original":"12/26/2012","granularity":"day","time":"2012/12/26 00:00:00 -0500"},"longitude":-119.9770546,"id":"advbt66mb3z6","location":"Cachuma Lake--west end"},"type":"Feature","geometry":{"type":"Point","coordinates":[-119.9770546,34.5843937]}},{"properties":{"latitude":34.922554,"column_5":1,"date":{"end_time":"2012/12/27 00:00:00 -0500","original":"12/26/2012","granularity":"day","time":"2012/12/26 00:00:00 -0500"},"longitude":-120.561177,"id":"advbt6kjhgpw","location":"Hwy 1 south of Guadalupe"},"type":"Feature","geometry":{"type":"Point","coordinates":[-120.561177,34.922554]}},{"properties":{"latitude":35.014037,"column_5":1,"date":{"end_time":"2012/12/27 00:00:00 -0500","original":"12/26/2012","granularity":"day","time":"2012/12/26 00:00:00 -0500"},"longitude":-120.581969,"id":"advbt6dskewa","location":"Oso Flaco Lake Rd"},"type":"Feature","geometry":{"type":"Point","coordinates":[-120.581969,35.014037]}},{"properties":{"latitude":34.6666891,"column_5":1,"date":{"end_time":"2012/12/27 00:00:00 -0500","original":"12/26/2012","granularity":"day","time":"2012/12/26 00:00:00 -0500"},"longitude":-120.1213246,"id":"advbt67s2a0s","location":"Los Olivos--Steele St"},"type":"Feature","geometry":{"type":"Point","coordinates":[-120.1213246,34.6666891]}},{"properties":{"latitude":34.2433087,"column_5":1,"date":{"end_time":"2012/12/29 00:00:00 -0500","original":"12/28/2012","granularity":"day","time":"2012/12/28 00:00:00 -0500"},"longitude":-119.2431673,"id":"advbt6gsmg8s","location":"Olivas Adobe"},"type":"Feature","geometry":{"type":"Point","coordinates":[-119.2431673,34.2433087]}},{"properties":{"latitude":33.9463861,"column_5":1,"date":{"end_time":"2012/12/31 00:00:00 -0500","original":"12/30/2012","granularity":"day","time":"2012/12/30 00:00:00 -0500"},"longitude":-117.6506138,"id":"advbt6e2nehs","location":"Prado Regional Park"},"type":"Feature","geometry":{"type":"Point","coordinates":[-117.6506138,33.9463861]}},{"properties":{"latitude":34.031892,"column_5":1,"date":{"end_time":"2012/12/31 00:00:00 -0500","original":"12/30/2012","granularity":"day","time":"2012/12/30 00:00:00 -0500"},"longitude":-118.060112,"id":"advbt6fw8of9","location":"Whittier Narrows--Legg Lake"},"type":"Feature","geometry":{"type":"Point","coordinates":[-118.060112,34.031892]}},{"properties":{"latitude":34.291099,"column_5":1,"date":{"end_time":"2012/12/31 00:00:00 -0500","original":"12/30/2012","granularity":"day","time":"2012/12/30 00:00:00 -0500"},"longitude":-117.449634,"id":"advbt6cjiug4","location":"Cajon Pass"},"type":"Feature","geometry":{"type":"Point","coordinates":[-117.449634,34.291099]}},{"properties":{"latitude":33.997286,"column_5":1,"date":{"end_time":"2012/12/31 00:00:00 -0500","original":"12/30/2012","granularity":"day","time":"2012/12/30 00:00:00 -0500"},"longitude":-117.718192,"id":"advbt6et1m3x","location":"Chino--InNOut"},"type":"Feature","geometry":{"type":"Point","coordinates":[-117.718192,33.997286]}},{"properties":{"latitude":34.244465,"column_5":1,"date":{"end_time":"2013/01/09 00:00:00 -0500","original":"1/8/2013","granularity":"day","time":"2013/01/08 00:00:00 -0500"},"longitude":-114.173874,"id":"advbt6ff60dv","location":"Fox's Landing"},"type":"Feature","geometry":{"type":"Point","coordinates":[-114.173874,34.244465]}},{"properties":{"latitude":34.1675236,"column_5":1,"date":{"end_time":"2013/01/09 00:00:00 -0500","original":"1/8/2013","granularity":"day","time":"2013/01/08 00:00:00 -0500"},"longitude":-114.2767114,"id":"advbt6ag38wr","location":"Headgate Dam - Below"},"type":"Feature","geometry":{"type":"Point","coordinates":[-114.2767114,34.1675236]}},{"properties":{"latitude":34.1703957,"column_5":1,"date":{"end_time":"2013/01/09 00:00:00 -0500","original":"1/8/2013","granularity":"day","time":"2013/01/08 00:00:00 -0500"},"longitude":-114.2817097,"id":"advbt6i32qzz","location":"Headgate Dam - state line pond (AZ)"},"type":"Feature","geometry":{"type":"Point","coordinates":[-114.2817097,34.1703957]}},{"properties":{"latitude":34.509879,"column_5":1,"date":{"end_time":"2013/01/11 00:00:00 -0500","original":"1/10/2013","granularity":"day","time":"2013/01/10 00:00:00 -0500"},"longitude":-114.33671,"id":"advbt672f3wk","location":"AW Recycling Center"},"type":"Feature","geometry":{"type":"Point","coordinates":[-114.33671,34.509879]}},{"properties":{"latitude":33.898135,"column_5":1,"date":{"end_time":"2013/01/17 00:00:00 -0500","original":"1/16/2013","granularity":"day","time":"2013/01/16 00:00:00 -0500"},"longitude":-114.46397,"id":"advbt69rse99","location":"Parker Valley--Navajo Road"},"type":"Feature","geometry":{"type":"Point","coordinates":[-114.46397,33.898135]}},{"properties":{"latitude":34.156422,"column_5":1,"date":{"end_time":"2013/01/17 00:00:00 -0500","original":"1/16/2013","granularity":"day","time":"2013/01/16 00:00:00 -0500"},"longitude":-114.277786,"id":"advbt6kfy1rr","location":"Parker--Walmart Parking Lot"},"type":"Feature","geometry":{"type":"Point","coordinates":[-114.277786,34.156422]}},{"properties":{"latitude":36.5750433,"column_5":1,"date":{"end_time":"2013/01/18 00:00:00 -0500","original":"1/17/2013","granularity":"day","time":"2013/01/17 00:00:00 -0500"},"longitude":-114.4653216,"id":"advbt6fshl0b","location":"Moapa Valley"},"type":"Feature","geometry":{"type":"Point","coordinates":[-114.4653216,36.5750433]}},{"properties":{"latitude":34.089842,"column_5":1,"date":{"end_time":"2013/01/20 00:00:00 -0500","original":"1/19/2013","granularity":"day","time":"2013/01/19 00:00:00 -0500"},"longitude":-114.43308,"id":"advbt6jkzn22","location":"SBe Marsh"},"type":"Feature","geometry":{"type":"Point","coordinates":[-114.43308,34.089842]}},{"properties":{"latitude":34.440186,"column_5":1,"date":{"end_time":"2013/01/21 00:00:00 -0500","original":"1/20/2013","granularity":"day","time":"2013/01/20 00:00:00 -0500"},"longitude":-114.321241,"id":"advbt66orzuq","location":"Lake Havasu--Below Thompson Bay (AZ)"},"type":"Feature","geometry":{"type":"Point","coordinates":[-114.321241,34.440186]}},{"properties":{"latitude":34.536111,"column_5":1,"date":{"end_time":"2013/01/23 00:00:00 -0500","original":"1/22/2013","granularity":"day","time":"2013/01/22 00:00:00 -0500"},"longitude":-114.3721113,"id":"advbt6exoia5","location":"The Refuge Golf Club"},"type":"Feature","geometry":{"type":"Point","coordinates":[-114.3721113,34.536111]}},{"properties":{"latitude":35.1696513,"column_5":1,"date":{"end_time":"2013/01/30 00:00:00 -0500","original":"1/29/2013","granularity":"day","time":"2013/01/29 00:00:00 -0500"},"longitude":-114.7538066,"id":"advbt6fxoyrj","location":"Wash south of Laughlin Hwy"},"type":"Feature","geometry":{"type":"Point","coordinates":[-114.7538066,35.1696513]}},{"properties":{"latitude":35.1754746,"column_5":1,"date":{"end_time":"2013/01/30 00:00:00 -0500","original":"1/29/2013","granularity":"day","time":"2013/01/29 00:00:00 -0500"},"longitude":-114.8493791,"id":"advbt68smm79","location":"Hwy 95--CA/NV state line (CA)"},"type":"Feature","geometry":{"type":"Point","coordinates":[-114.8493791,35.1754746]}},{"properties":{"latitude":35.2419565,"column_5":1,"date":{"end_time":"2013/01/31 00:00:00 -0500","original":"1/30/2013","granularity":"day","time":"2013/01/30 00:00:00 -0500"},"longitude":-114.6727931,"id":"advbt6ag5xlq","location":"Sacatone Springs"},"type":"Feature","geometry":{"type":"Point","coordinates":[-114.6727931,35.2419565]}},{"properties":{"latitude":35.2258,"column_5":1,"date":{"end_time":"2013/01/31 00:00:00 -0500","original":"1/30/2013","granularity":"day","time":"2013/01/30 00:00:00 -0500"},"longitude":-114.6807,"id":"advbt6d0npgd","location":"Grapevine Canyon"},"type":"Feature","geometry":{"type":"Point","coordinates":[-114.6807,35.2258]}},{"properties":{"latitude":34.8557211,"column_5":1,"date":{"end_time":"2013/02/04 00:00:00 -0500","original":"2/3/2013","granularity":"day","time":"2013/02/03 00:00:00 -0500"},"longitude":-114.5954704,"id":"advbt69q4v8q","location":"Barrackman Rd Ag"},"type":"Feature","geometry":{"type":"Point","coordinates":[-114.5954704,34.8557211]}},{"properties":{"latitude":34.2441623,"column_5":1,"date":{"end_time":"2013/02/18 00:00:00 -0500","original":"2/17/2013","granularity":"day","time":"2013/02/17 00:00:00 -0500"},"longitude":-114.1815948,"id":"advbt69e086c","location":"Parker Strip (CA)"},"type":"Feature","geometry":{"type":"Point","coordinates":[-114.1815948,34.2441623]}},{"properties":{"latitude":34.50887,"column_5":1,"date":{"end_time":"2013/02/20 00:00:00 -0500","original":"2/19/2013","granularity":"day","time":"2013/02/19 00:00:00 -0500"},"longitude":-114.34667,"id":"advbt6jw0iop","location":"LHC - recycling"},"type":"Feature","geometry":{"type":"Point","coordinates":[-114.34667,34.50887]}},{"properties":{"latitude":34.431337,"column_5":1,"date":{"end_time":"2013/02/23 00:00:00 -0500","original":"2/22/2013","granularity":"day","time":"2013/02/22 00:00:00 -0500"},"longitude":-114.2723179,"id":"advbt685ib4z","location":"Sara's Crack"},"type":"Feature","geometry":{"type":"Point","coordinates":[-114.2723179,34.431337]}},{"properties":{"latitude":34.8664965,"column_5":1,"date":{"end_time":"2013/02/24 00:00:00 -0500","original":"2/23/2013","granularity":"day","time":"2013/02/23 00:00:00 -0500"},"longitude":-112.4701309,"id":"advbt68770i0","location":"Paulden area"},"type":"Feature","geometry":{"type":"Point","coordinates":[-112.4701309,34.8664965]}},{"properties":{"latitude":34.6970257,"column_5":1,"date":{"end_time":"2013/02/24 00:00:00 -0500","original":"2/23/2013","granularity":"day","time":"2013/02/23 00:00:00 -0500"},"longitude":-112.5072098,"id":"advbt6gaqflv","location":"Chino Valley--Outer Loop Rd"},"type":"Feature","geometry":{"type":"Point","coordinates":[-112.5072098,34.6970257]}},{"properties":{"latitude":34.7502167,"column_5":1,"date":{"end_time":"2013/02/24 00:00:00 -0500","original":"2/23/2013","granularity":"day","time":"2013/02/23 00:00:00 -0500"},"longitude":-112.4656677,"id":"advbt67hrenm","location":"Chino Valley--rural roads"},"type":"Feature","geometry":{"type":"Point","coordinates":[-112.4656677,34.7502167]}},{"properties":{"latitude":34.7602302,"column_5":1,"date":{"end_time":"2013/02/24 00:00:00 -0500","original":"2/23/2013","granularity":"day","time":"2013/02/23 00:00:00 -0500"},"longitude":-112.4533081,"id":"advbt6exwueo","location":"Chino Valley"},"type":"Feature","geometry":{"type":"Point","coordinates":[-112.4533081,34.7602302]}},{"properties":{"latitude":35.3403344,"column_5":1,"date":{"end_time":"2013/02/25 00:00:00 -0500","original":"2/24/2013","granularity":"day","time":"2013/02/24 00:00:00 -0500"},"longitude":-112.9511261,"id":"advbt6m2gnsl","location":"Seligman area"},"type":"Feature","geometry":{"type":"Point","coordinates":[-112.9511261,35.3403344]}},{"properties":{"latitude":35.4497632,"column_5":1,"date":{"end_time":"2013/02/25 00:00:00 -0500","original":"2/24/2013","granularity":"day","time":"2013/02/24 00:00:00 -0500"},"longitude":-113.4887695,"id":"advbt6efk9nj","location":"FR 7037"},"type":"Feature","geometry":{"type":"Point","coordinates":[-113.4887695,35.4497632]}},{"properties":{"latitude":35.4854144,"column_5":1,"date":{"end_time":"2013/02/25 00:00:00 -0500","original":"2/24/2013","granularity":"day","time":"2013/02/24 00:00:00 -0500"},"longitude":-113.5040474,"id":"advbt6h0ggyi","location":"Cherokee"},"type":"Feature","geometry":{"type":"Point","coordinates":[-113.5040474,35.4854144]}},{"properties":{"latitude":34.764884,"column_5":1,"date":{"end_time":"2013/02/25 00:00:00 -0500","original":"2/24/2013","granularity":"day","time":"2013/02/24 00:00:00 -0500"},"longitude":-112.369709,"id":"advbt6gy1iyu","location":"Chino Valley--Perkinsville Rd"},"type":"Feature","geometry":{"type":"Point","coordinates":[-112.369709,34.764884]}},{"properties":{"latitude":34.5453782,"column_5":1,"date":{"end_time":"2013/02/25 00:00:00 -0500","original":"2/24/2013","granularity":"day","time":"2013/02/24 00:00:00 -0500"},"longitude":-112.4508405,"id":"advbt6k8vu5h","location":"Prescott--Best Western"},"type":"Feature","geometry":{"type":"Point","coordinates":[-112.4508405,34.5453782]}},{"properties":{"latitude":33.598571,"column_5":1,"date":{"end_time":"2013/03/02 00:00:00 -0500","original":"3/1/2013","granularity":"day","time":"2013/03/01 00:00:00 -0500"},"longitude":-114.5773172,"id":"advbt68y3ov1","location":"Blythe--D Canal Ponds"},"type":"Feature","geometry":{"type":"Point","coordinates":[-114.5773172,33.598571]}},{"properties":{"latitude":33.3991784,"column_5":1,"date":{"end_time":"2013/03/02 00:00:00 -0500","original":"3/1/2013","granularity":"day","time":"2013/03/01 00:00:00 -0500"},"longitude":-114.7250009,"id":"advbt6h91zqa","location":"Palo Verde County Park"},"type":"Feature","geometry":{"type":"Point","coordinates":[-114.7250009,33.3991784]}},{"properties":{"latitude":33.5446212,"column_5":1,"date":{"end_time":"2013/03/02 00:00:00 -0500","original":"3/1/2013","granularity":"day","time":"2013/03/01 00:00:00 -0500"},"longitude":-114.6781461,"id":"advbt6all3zz","location":"22nd Ave.--oasis west of Stephenson Blvd."},"type":"Feature","geometry":{"type":"Point","coordinates":[-114.6781461,33.5446212]}},{"properties":{"latitude":33.6316294,"column_5":1,"date":{"end_time":"2013/03/02 00:00:00 -0500","original":"3/1/2013","granularity":"day","time":"2013/03/01 00:00:00 -0500"},"longitude":-114.6004915,"id":"advbt6h2bre8","location":"Palo Verde Cemetery"},"type":"Feature","geometry":{"type":"Point","coordinates":[-114.6004915,33.6316294]}},{"properties":{"latitude":33.714594,"column_5":1,"date":{"end_time":"2013/03/02 00:00:00 -0500","original":"3/1/2013","granularity":"day","time":"2013/03/01 00:00:00 -0500"},"longitude":-116.173724,"id":"advbt6kdi93f","location":"Coachella--Dillon Rd"},"type":"Feature","geometry":{"type":"Point","coordinates":[-116.173724,33.714594]}},{"properties":{"latitude":33.76665,"column_5":1,"date":{"end_time":"2013/03/02 00:00:00 -0500","original":"3/1/2013","granularity":"day","time":"2013/03/01 00:00:00 -0500"},"longitude":-114.46349,"id":"advbt6eqrumz","location":"Parker Valley - Welsh R"},"type":"Feature","geometry":{"type":"Point","coordinates":[-114.46349,33.76665]}},{"properties":{"latitude":33.840916,"column_5":1,"date":{"end_time":"2013/03/03 00:00:00 -0500","original":"3/2/2013","granularity":"day","time":"2013/03/02 00:00:00 -0500"},"longitude":-117.093374,"id":"advbt6jovx4j","location":"Ramona Expressway--Bootsma Dairy pond"},"type":"Feature","geometry":{"type":"Point","coordinates":[-117.093374,33.840916]}},{"properties":{"latitude":36.60197,"column_5":1,"date":{"end_time":"2013/03/06 00:00:00 -0500","original":"3/5/2013","granularity":"day","time":"2013/03/05 00:00:00 -0500"},"longitude":-114.32398,"id":"advbt6dmhvee","location":"Virgin River - Mormon Mesa"},"type":"Feature","geometry":{"type":"Point","coordinates":[-114.32398,36.60197]}},{"properties":{"latitude":36.5420533,"column_5":1,"date":{"end_time":"2013/03/06 00:00:00 -0500","original":"3/5/2013","granularity":"day","time":"2013/03/05 00:00:00 -0500"},"longitude":-114.4432068,"id":"advbt6a7ebdi","location":"Overton NV"},"type":"Feature","geometry":{"type":"Point","coordinates":[-114.4432068,36.5420533]}},{"properties":{"latitude":36.54995,"column_5":1,"date":{"end_time":"2013/03/06 00:00:00 -0500","original":"3/5/2013","granularity":"day","time":"2013/03/05 00:00:00 -0500"},"longitude":-114.44333,"id":"advbt6ljmxq3","location":"Overton - Cooper Ave"},"type":"Feature","geometry":{"type":"Point","coordinates":[-114.44333,36.54995]}},{"properties":{"latitude":40.6550853,"column_5":1,"date":{"end_time":"2013/03/08 00:00:00 -0500","original":"3/7/2013","granularity":"day","time":"2013/03/07 00:00:00 -0500"},"longitude":-111.9232339,"id":"advbt6i5man4","location":"Mill Race Pond &amp; Park"},"type":"Feature","geometry":{"type":"Point","coordinates":[-111.9232339,40.6550853]}},{"properties":{"latitude":40.6381206,"column_5":1,"date":{"end_time":"2013/03/08 00:00:00 -0500","original":"3/7/2013","granularity":"day","time":"2013/03/07 00:00:00 -0500"},"longitude":-111.9169521,"id":"advbt6g43qbl","location":"Willow Pond Park"},"type":"Feature","geometry":{"type":"Point","coordinates":[-111.9169521,40.6381206]}},{"properties":{"latitude":38.9791614,"column_5":1,"date":{"end_time":"2013/03/08 00:00:00 -0500","original":"3/7/2013","granularity":"day","time":"2013/03/07 00:00:00 -0500"},"longitude":-112.3386383,"id":"advbt6h31j1y","location":"Fillmore area"},"type":"Feature","geometry":{"type":"Point","coordinates":[-112.3386383,38.9791614]}},{"properties":{"latitude":40.10083,"column_5":1,"date":{"end_time":"2013/03/08 00:00:00 -0500","original":"3/7/2013","granularity":"day","time":"2013/03/07 00:00:00 -0500"},"longitude":-111.68724,"id":"advbt6h8hy5d","location":"Highway 15 - Spanish Fork North of 115"},"type":"Feature","geometry":{"type":"Point","coordinates":[-111.68724,40.10083]}},{"properties":{"latitude":34.331977,"column_5":1,"date":{"end_time":"2013/03/19 00:00:00 -0400","original":"3/18/2013","granularity":"day","time":"2013/03/18 00:00:00 -0400"},"longitude":-114.151041,"id":"advbt6jd5vmu","location":"Wash of Little Foxes"},"type":"Feature","geometry":{"type":"Point","coordinates":[-114.151041,34.331977]}},{"properties":{"latitude":33.608835,"column_5":1,"date":{"end_time":"2013/04/03 00:00:00 -0400","original":"4/2/2013","granularity":"day","time":"2013/04/02 00:00:00 -0400"},"longitude":-114.605568,"id":"advbt6ataij3","location":"Jack in the Box--Blythe"},"type":"Feature","geometry":{"type":"Point","coordinates":[-114.605568,33.608835]}},{"properties":{"latitude":34.3330887,"column_5":1,"date":{"end_time":"2013/04/06 00:00:00 -0400","original":"4/5/2013","granularity":"day","time":"2013/04/05 00:00:00 -0400"},"longitude":-114.2191887,"id":"advbt6bmp6jd","location":"Black Metal Wash - 2"},"type":"Feature","geometry":{"type":"Point","coordinates":[-114.2191887,34.3330887]}},{"properties":{"latitude":34.32358,"column_5":1,"date":{"end_time":"2013/04/06 00:00:00 -0400","original":"4/5/2013","granularity":"day","time":"2013/04/05 00:00:00 -0400"},"longitude":-114.22398,"id":"advbt6k7fqze","location":"Black Metal Wash - 4"},"type":"Feature","geometry":{"type":"Point","coordinates":[-114.22398,34.32358]}},{"properties":{"latitude":34.33515,"column_5":1,"date":{"end_time":"2013/04/06 00:00:00 -0400","original":"4/5/2013","granularity":"day","time":"2013/04/05 00:00:00 -0400"},"longitude":-114.21559,"id":"advbt68uagbi","location":"Black Metal Wash - 1"},"type":"Feature","geometry":{"type":"Point","coordinates":[-114.21559,34.33515]}},{"properties":{"latitude":34.3288,"column_5":1,"date":{"end_time":"2013/04/06 00:00:00 -0400","original":"4/5/2013","granularity":"day","time":"2013/04/05 00:00:00 -0400"},"longitude":-114.22268,"id":"advbt67rxz8g","location":"Black Metal Wash - 3"},"type":"Feature","geometry":{"type":"Point","coordinates":[-114.22268,34.3288]}},{"properties":{"latitude":33.994475,"column_5":1,"date":{"end_time":"2013/04/07 00:00:00 -0400","original":"4/6/2013","granularity":"day","time":"2013/04/06 00:00:00 -0400"},"longitude":-114.21623,"id":"advbt6dlc33s","location":"Hwy 95/72 east of Parker"},"type":"Feature","geometry":{"type":"Point","coordinates":[-114.21623,33.994475]}},{"properties":{"latitude":34.115233,"column_5":1,"date":{"end_time":"2013/04/11 00:00:00 -0400","original":"4/10/2013","granularity":"day","time":"2013/04/10 00:00:00 -0400"},"longitude":-114.136093,"id":"advbt6ikdu22","location":"Shea Rd south of CAP"},"type":"Feature","geometry":{"type":"Point","coordinates":[-114.136093,34.115233]}},{"properties":{"latitude":34.93641,"column_5":1,"date":{"end_time":"2013/04/12 00:00:00 -0400","original":"4/11/2013","granularity":"day","time":"2013/04/11 00:00:00 -0400"},"longitude":-114.641004,"id":"advbt6k0n427","location":"Needles Ag--Tam Jungle"},"type":"Feature","geometry":{"type":"Point","coordinates":[-114.641004,34.93641]}},{"properties":{"latitude":34.743903,"column_5":1,"date":{"end_time":"2013/04/13 00:00:00 -0400","original":"4/12/2013","granularity":"day","time":"2013/04/12 00:00:00 -0400"},"longitude":-114.509776,"id":"advbt6eh33sb","location":"Havasu NWR--Lost Lake area"},"type":"Feature","geometry":{"type":"Point","coordinates":[-114.509776,34.743903]}},{"properties":{"latitude":34.43938,"column_5":1,"date":{"end_time":"2013/04/16 00:00:00 -0400","original":"4/15/2013","granularity":"day","time":"2013/04/15 00:00:00 -0400"},"longitude":-114.22624,"id":"advbt67ewmwm","location":"Big Johnsons pullout"},"type":"Feature","geometry":{"type":"Point","coordinates":[-114.22624,34.43938]}},{"properties":{"latitude":34.1736843,"column_5":1,"date":{"end_time":"2013/04/20 00:00:00 -0400","original":"4/19/2013","granularity":"day","time":"2013/04/19 00:00:00 -0400"},"longitude":-114.2805036,"id":"advbt6jcu4lx","location":"Headgate Dam - state line pond (Ca)"},"type":"Feature","geometry":{"type":"Point","coordinates":[-114.2805036,34.1736843]}}],"is_temporal":true,"author":{"url":"","metadata":"","contact_name":"","contact_address":"","source":"","contact_phone":""},"source":"","pagination":{"sort":null,"start":0,"total":1434,"limit":1000000},"state":"complete","tags":"ebird","published":"2013-04-25T16:00:00Z","id":351143}