{"type":"FeatureCollection","data_type":"Dataset","url_type":null,"permissions":[{"permissions":{"download":true,"view":true},"group_id":"everyone"}],"classification":null,"title":"BirdMap","count":883,"stream_id":361302,"contributor":{"url":"http://geocommons.com/users/73176","name":"TDHudgins"},"data_attributes":null,"calculation_params":null,"icon_link":null,"link":"http://geocommons.com/overlays/361302.json","extent":[-124.361,-2.15303,116.616,51.5176],"geometry_types":["point"],"unique_name":null,"name":"BirdMap","feature_count":883,"description":"","next_feature":null,"is_raster":false,"short_classification":"Y","stats":{"column_5":{"max":71,"variance":12.223480558701,"mean":1.91166477916195,"stdev":3.49620945578222,"min":1,"median":1},"latitude":{"max":51.5175883,"variance":67.6215657973393,"mean":35.5895642251415,"stdev":8.22323329337915,"min":-2.153028,"median":36.32595},"date":{"max":"2013/05/26 00:00:00 -0400","variance":4.95861840748895e+15,"mean":"2010/08/30 01:09:06 -0400","stdev":70417458.1157894,"min":"2004/06/27 00:00:00 -0400","median":"2011/01/09 00:00:00 -0500"},"longitude":{"max":116.6164924,"variance":2752.52751623375,"mean":-63.9569239542469,"stdev":52.4645357954661,"min":-124.3614364,"median":-77.432}},"features":[{"properties":{"latitude":39.3296004,"column_5":71,"date":{"end_time":"2008/08/20 00:00:00 -0400","original":"8/19/2008","granularity":"day","time":"2008/08/19 00:00:00 -0400"},"longitude":-76.6225576,"id":"aeltf1sp822b","location":"Johns Hopkins University-Homewood"},"type":"Feature","geometry":{"type":"Point","coordinates":[-76.6225576,39.3296004]}},{"properties":{"latitude":36.0679765,"column_5":39,"date":{"end_time":"2004/06/29 00:00:00 -0400","original":"6/28/2004","granularity":"day","time":"2004/06/28 00:00:00 -0400"},"longitude":-80.4034156,"id":"aeltf1tgok6w","location":"Carters Grove Rd, Clemmons, NC"},"type":"Feature","geometry":{"type":"Point","coordinates":[-80.4034156,36.0679765]}},{"properties":{"latitude":39.3574128,"column_5":34,"date":{"end_time":"2010/06/12 00:00:00 -0400","original":"6/11/2010","granularity":"day","time":"2010/06/11 00:00:00 -0400"},"longitude":-76.6683376,"id":"aeltf1p3uc3y","location":"W Rogers Ave"},"type":"Feature","geometry":{"type":"Point","coordinates":[-76.6683376,39.3574128]}},{"properties":{"latitude":39.3826766,"column_5":21,"date":{"end_time":"2010/04/12 00:00:00 -0400","original":"4/11/2010","granularity":"day","time":"2010/04/11 00:00:00 -0400"},"longitude":-76.690321,"id":"aeltf1rgd1fw","location":"Quarry Lake"},"type":"Feature","geometry":{"type":"Point","coordinates":[-76.690321,39.3826766]}},{"properties":{"latitude":36.016407,"column_5":19,"date":{"end_time":"2005/06/29 00:00:00 -0400","original":"6/28/2005","granularity":"day","time":"2005/06/28 00:00:00 -0400"},"longitude":-80.4116821,"id":"aeltf1uctdzu","location":"Tanglewood County Park"},"type":"Feature","geometry":{"type":"Point","coordinates":[-80.4116821,36.016407]}},{"properties":{"latitude":39.3242148,"column_5":19,"date":{"end_time":"2012/09/29 00:00:00 -0400","original":"9/28/2012","granularity":"day","time":"2012/09/28 00:00:00 -0400"},"longitude":-76.6179871,"id":"aeltf1xfhwii","location":"Wyman Park Dell"},"type":"Feature","geometry":{"type":"Point","coordinates":[-76.6179871,39.3242148]}},{"properties":{"latitude":36.033952,"column_5":18,"date":{"end_time":"2010/12/20 00:00:00 -0500","original":"12/19/2010","granularity":"day","time":"2010/12/19 00:00:00 -0500"},"longitude":-80.7347059,"id":"aeltf1saonog","location":"Hunting Creek Preserve"},"type":"Feature","geometry":{"type":"Point","coordinates":[-80.7347059,36.033952]}},{"properties":{"latitude":39.23068,"column_5":15,"date":{"end_time":"2010/05/17 00:00:00 -0400","original":"5/16/2010","granularity":"day","time":"2010/05/16 00:00:00 -0400"},"longitude":-76.94221,"id":"aeltf1tpd1nb","location":"Howard"},"type":"Feature","geometry":{"type":"Point","coordinates":[-76.94221,39.23068]}},{"properties":{"latitude":36.4916418,"column_5":13,"date":{"end_time":"2006/08/05 00:00:00 -0400","original":"8/4/2006","granularity":"day","time":"2006/08/04 00:00:00 -0400"},"longitude":-104.9742563,"id":"aeltf1t0acc6","location":"Philmont Scout Ranch"},"type":"Feature","geometry":{"type":"Point","coordinates":[-104.9742563,36.4916418]}},{"properties":{"latitude":36.75975,"column_5":12,"date":{"end_time":"2009/03/11 00:00:00 -0400","original":"3/10/2009","granularity":"day","time":"2009/03/10 00:00:00 -0400"},"longitude":-81.97007,"id":"aeltf1witkdr","location":"Washington"},"type":"Feature","geometry":{"type":"Point","coordinates":[-81.97007,36.75975]}},{"properties":{"latitude":39.5044049,"column_5":12,"date":{"end_time":"2010/10/30 00:00:00 -0400","original":"10/29/2010","granularity":"day","time":"2010/10/29 00:00:00 -0400"},"longitude":-76.6224289,"id":"aeltf1rswlyp","location":"Loch Raven Reservoir--Paper Mill Flats"},"type":"Feature","geometry":{"type":"Point","coordinates":[-76.6224289,39.5044049]}},{"properties":{"latitude":36.0402506,"column_5":11,"date":{"end_time":"2009/02/01 00:00:00 -0500","original":"1/31/2009","granularity":"day","time":"2009/01/31 00:00:00 -0500"},"longitude":-80.3019691,"id":"aeltf21or91y","location":"Archie Elledge Treatment Plant"},"type":"Feature","geometry":{"type":"Point","coordinates":[-80.3019691,36.0402506]}},{"properties":{"latitude":35.9921222,"column_5":10,"date":{"end_time":"2007/05/13 00:00:00 -0400","original":"5/12/2007","granularity":"day","time":"2007/05/12 00:00:00 -0400"},"longitude":-80.4239345,"id":"aeltf204dxsg","location":"Davie from Tanglewood"},"type":"Feature","geometry":{"type":"Point","coordinates":[-80.4239345,35.9921222]}},{"properties":{"latitude":36.04599,"column_5":10,"date":{"end_time":"2009/12/30 00:00:00 -0500","original":"12/29/2009","granularity":"day","time":"2009/12/29 00:00:00 -0500"},"longitude":-78.86087,"id":"aeltf2436hbz","location":"Durham"},"type":"Feature","geometry":{"type":"Point","coordinates":[-78.86087,36.04599]}},{"properties":{"latitude":39.46971,"column_5":10,"date":{"end_time":"2010/05/17 00:00:00 -0400","original":"5/16/2010","granularity":"day","time":"2010/05/16 00:00:00 -0400"},"longitude":-77.39608,"id":"aeltf21xytg1","location":"Frederick"},"type":"Feature","geometry":{"type":"Point","coordinates":[-77.39608,39.46971]}},{"properties":{"latitude":38.9685,"column_5":10,"date":{"end_time":"2010/06/11 00:00:00 -0400","original":"6/10/2010","granularity":"day","time":"2010/06/10 00:00:00 -0400"},"longitude":-76.63351,"id":"aeltf1xs8hku","location":"Anne Arundel"},"type":"Feature","geometry":{"type":"Point","coordinates":[-76.63351,38.9685]}},{"properties":{"latitude":36.4748589,"column_5":9,"date":{"end_time":"2005/04/17 00:00:00 -0400","original":"4/16/2005","granularity":"day","time":"2005/04/16 00:00:00 -0400"},"longitude":-80.8464575,"id":"aeltf1xytaaq","location":"Camp Raven Knob"},"type":"Feature","geometry":{"type":"Point","coordinates":[-80.8464575,36.4748589]}},{"properties":{"latitude":36.096551,"column_5":9,"date":{"end_time":"2008/01/24 00:00:00 -0500","original":"1/23/2008","granularity":"day","time":"2008/01/23 00:00:00 -0500"},"longitude":-80.1878357,"id":"aeltf1ygw9yn","location":"Salem Lake"},"type":"Feature","geometry":{"type":"Point","coordinates":[-80.1878357,36.096551]}},{"properties":{"latitude":39.46464,"column_5":9,"date":{"end_time":"2010/02/27 00:00:00 -0500","original":"2/26/2010","granularity":"day","time":"2010/02/26 00:00:00 -0500"},"longitude":-76.63066,"id":"aeltf1ou0tj5","location":"Baltimore"},"type":"Feature","geometry":{"type":"Point","coordinates":[-76.63066,39.46464]}},{"properties":{"latitude":36.0968342,"column_5":9,"date":{"end_time":"2010/03/18 00:00:00 -0400","original":"3/17/2010","granularity":"day","time":"2010/03/17 00:00:00 -0400"},"longitude":-80.5193996,"id":"aeltf1sy8jir","location":"Dinkins Bottom"},"type":"Feature","geometry":{"type":"Point","coordinates":[-80.5193996,36.0968342]}},{"properties":{"latitude":39.3846668,"column_5":9,"date":{"end_time":"2011/12/12 00:00:00 -0500","original":"12/11/2011","granularity":"day","time":"2011/12/11 00:00:00 -0500"},"longitude":-76.6443157,"id":"aeltf1wp5ixs","location":"Lake Roland"},"type":"Feature","geometry":{"type":"Point","coordinates":[-76.6443157,39.3846668]}},{"properties":{"latitude":39.49721,"column_5":9,"date":{"end_time":"2011/12/12 00:00:00 -0500","original":"12/11/2011","granularity":"day","time":"2011/12/11 00:00:00 -0500"},"longitude":-76.652798,"id":"aeltf25056hv","location":"Hunt Valley Towne Centre"},"type":"Feature","geometry":{"type":"Point","coordinates":[-76.652798,39.49721]}},{"properties":{"latitude":36.1027059,"column_5":8,"date":{"end_time":"2004/07/19 00:00:00 -0400","original":"7/18/2004","granularity":"day","time":"2004/07/18 00:00:00 -0400"},"longitude":-80.3887224,"id":"aeltf1tut89j","location":"Forsyth Country Day School"},"type":"Feature","geometry":{"type":"Point","coordinates":[-80.3887224,36.1027059]}},{"properties":{"latitude":36.1266446,"column_5":8,"date":{"end_time":"2006/05/14 00:00:00 -0400","original":"5/13/2006","granularity":"day","time":"2006/05/13 00:00:00 -0400"},"longitude":-80.2826786,"id":"aeltf22b3nq4","location":"Reynolda"},"type":"Feature","geometry":{"type":"Point","coordinates":[-80.2826786,36.1266446]}},{"properties":{"latitude":39.31515,"column_5":8,"date":{"end_time":"2008/08/22 00:00:00 -0400","original":"8/21/2008","granularity":"day","time":"2008/08/21 00:00:00 -0400"},"longitude":-77.8804,"id":"aeltf1ukxof6","location":"Jefferson"},"type":"Feature","geometry":{"type":"Point","coordinates":[-77.8804,39.31515]}},{"properties":{"latitude":35.9937629,"column_5":8,"date":{"end_time":"2010/05/26 00:00:00 -0400","original":"5/25/2010","granularity":"day","time":"2010/05/25 00:00:00 -0400"},"longitude":-79.9618113,"id":"aeltf23eqxxl","location":"Kenmare Court"},"type":"Feature","geometry":{"type":"Point","coordinates":[-79.9618113,35.9937629]}},{"properties":{"latitude":39.353746,"column_5":8,"date":{"end_time":"2010/09/06 00:00:00 -0400","original":"9/5/2010","granularity":"day","time":"2010/09/05 00:00:00 -0400"},"longitude":-76.6519976,"id":"aeltf1vxf3gv","location":"Cylburn Arboretum"},"type":"Feature","geometry":{"type":"Point","coordinates":[-76.6519976,39.353746]}},{"properties":{"latitude":35.5183777,"column_5":7,"date":{"end_time":"2004/11/21 00:00:00 -0500","original":"11/20/2004","granularity":"day","time":"2004/11/20 00:00:00 -0500"},"longitude":-80.9176111,"id":"aeltf1xrb8vv","location":"Lake Norman Yacht Club"},"type":"Feature","geometry":{"type":"Point","coordinates":[-80.9176111,35.5183777]}},{"properties":{"latitude":39.13984,"column_5":7,"date":{"end_time":"2008/08/20 00:00:00 -0400","original":"8/19/2008","granularity":"day","time":"2008/08/19 00:00:00 -0400"},"longitude":-77.20286,"id":"aeltf1yah1o8","location":"Montgomery"},"type":"Feature","geometry":{"type":"Point","coordinates":[-77.20286,39.13984]}},{"properties":{"latitude":35.79345,"column_5":7,"date":{"end_time":"2009/12/30 00:00:00 -0500","original":"12/29/2009","granularity":"day","time":"2009/12/29 00:00:00 -0500"},"longitude":-78.62641,"id":"aeltf1s6fz58","location":"Wake"},"type":"Feature","geometry":{"type":"Point","coordinates":[-78.62641,35.79345]}},{"properties":{"latitude":43.00576,"column_5":7,"date":{"end_time":"2010/07/11 00:00:00 -0400","original":"7/10/2010","granularity":"day","time":"2010/07/10 00:00:00 -0400"},"longitude":-71.09158,"id":"aeltf23ofrv3","location":"Rockingham"},"type":"Feature","geometry":{"type":"Point","coordinates":[-71.09158,43.00576]}},{"properties":{"latitude":39.4138497,"column_5":7,"date":{"end_time":"2013/01/28 00:00:00 -0500","original":"1/27/2013","granularity":"day","time":"2013/01/27 00:00:00 -0500"},"longitude":-76.8400955,"id":"aeltf239adq1","location":"Soldiers Delight NEA"},"type":"Feature","geometry":{"type":"Point","coordinates":[-76.8400955,39.4138497]}},{"properties":{"latitude":34.6562628,"column_5":6,"date":{"end_time":"2005/01/02 00:00:00 -0500","original":"1/1/2005","granularity":"day","time":"2005/01/01 00:00:00 -0500"},"longitude":-77.0520759,"id":"aeltf23v4cld","location":"Emerald Isle- Janell Lane Beach"},"type":"Feature","geometry":{"type":"Point","coordinates":[-77.0520759,34.6562628]}},{"properties":{"latitude":36.1020991,"column_5":6,"date":{"end_time":"2009/03/12 00:00:00 -0400","original":"3/11/2009","granularity":"day","time":"2009/03/11 00:00:00 -0400"},"longitude":-80.3603554,"id":"aeltf1u66rxh","location":"Muddy Creek Greenway"},"type":"Feature","geometry":{"type":"Point","coordinates":[-80.3603554,36.1020991]}},{"properties":{"latitude":36.04496,"column_5":6,"date":{"end_time":"2009/12/30 00:00:00 -0500","original":"12/29/2009","granularity":"day","time":"2009/12/29 00:00:00 -0500"},"longitude":-79.11069,"id":"aeltf23nke6n","location":"Orange"},"type":"Feature","geometry":{"type":"Point","coordinates":[-79.11069,36.04496]}},{"properties":{"latitude":35.95574,"column_5":6,"date":{"end_time":"2010/03/17 00:00:00 -0400","original":"3/16/2010","granularity":"day","time":"2010/03/16 00:00:00 -0400"},"longitude":-80.00536,"id":"aeltf1yzm70z","location":"High Point"},"type":"Feature","geometry":{"type":"Point","coordinates":[-80.00536,35.95574]}},{"properties":{"latitude":39.2094705,"column_5":6,"date":{"end_time":"2011/01/17 00:00:00 -0500","original":"1/16/2011","granularity":"day","time":"2011/01/16 00:00:00 -0500"},"longitude":-76.5330899,"id":"aeltf24xkfv5","location":"Fort Armistead Park (Baltimore City)"},"type":"Feature","geometry":{"type":"Point","coordinates":[-76.5330899,39.2094705]}},{"properties":{"latitude":39.1934881,"column_5":6,"date":{"end_time":"2012/01/21 00:00:00 -0500","original":"1/20/2012","granularity":"day","time":"2012/01/20 00:00:00 -0500"},"longitude":-76.5353537,"id":"aeltf1uy8hrl","location":"Swan Creek Wetland--Cox Creek DMCF"},"type":"Feature","geometry":{"type":"Point","coordinates":[-76.5353537,39.1934881]}},{"properties":{"latitude":39.43142,"column_5":6,"date":{"end_time":"2012/11/20 00:00:00 -0500","original":"11/19/2012","granularity":"day","time":"2012/11/19 00:00:00 -0500"},"longitude":-76.5434647,"id":"aeltf1ydjmmw","location":"Loch Raven Reservoir--Primary Dam"},"type":"Feature","geometry":{"type":"Point","coordinates":[-76.5434647,39.43142]}},{"properties":{"latitude":34.6645582,"column_5":5,"date":{"end_time":"2004/06/28 00:00:00 -0400","original":"6/27/2004","granularity":"day","time":"2004/06/27 00:00:00 -0400"},"longitude":-77.0393944,"id":"aeltf1p2684u","location":"Emerald Isle"},"type":"Feature","geometry":{"type":"Point","coordinates":[-77.0393944,34.6645582]}},{"properties":{"latitude":36.0988049,"column_5":5,"date":{"end_time":"2004/07/21 00:00:00 -0400","original":"7/20/2004","granularity":"day","time":"2004/07/20 00:00:00 -0400"},"longitude":-81.8467283,"id":"aeltf1xm1ad5","location":"Grandfather Golf and Country Club"},"type":"Feature","geometry":{"type":"Point","coordinates":[-81.8467283,36.0988049]}},{"properties":{"latitude":35.8776453,"column_5":5,"date":{"end_time":"2008/07/10 00:00:00 -0400","original":"7/9/2008","granularity":"day","time":"2008/07/09 00:00:00 -0400"},"longitude":-78.7863922,"id":"aeltf238orug","location":"Raleigh-Durham International Airport"},"type":"Feature","geometry":{"type":"Point","coordinates":[-78.7863922,35.8776453]}},{"properties":{"latitude":39.54843,"column_5":5,"date":{"end_time":"2009/04/19 00:00:00 -0400","original":"4/18/2009","granularity":"day","time":"2009/04/18 00:00:00 -0400"},"longitude":-76.32467,"id":"aeltf1xsvjar","location":"Harford"},"type":"Feature","geometry":{"type":"Point","coordinates":[-76.32467,39.54843]}},{"properties":{"latitude":39.2848219,"column_5":5,"date":{"end_time":"2009/12/12 00:00:00 -0500","original":"12/11/2009","granularity":"day","time":"2009/12/11 00:00:00 -0500"},"longitude":-76.6069794,"id":"aeltf1yldv3q","location":"Baltimore Inner Harbor"},"type":"Feature","geometry":{"type":"Point","coordinates":[-76.6069794,39.2848219]}},{"properties":{"latitude":38.83046,"column_5":5,"date":{"end_time":"2010/01/07 00:00:00 -0500","original":"1/6/2010","granularity":"day","time":"2010/01/06 00:00:00 -0500"},"longitude":-76.88211,"id":"aeltf22fzw7t","location":"Prince Georges"},"type":"Feature","geometry":{"type":"Point","coordinates":[-76.88211,38.83046]}},{"properties":{"latitude":35.89813,"column_5":5,"date":{"end_time":"2010/03/16 00:00:00 -0400","original":"3/15/2010","granularity":"day","time":"2010/03/15 00:00:00 -0400"},"longitude":-80.53362,"id":"aeltf22r0bqt","location":"Davie"},"type":"Feature","geometry":{"type":"Point","coordinates":[-80.53362,35.89813]}},{"properties":{"latitude":39.52656,"column_5":5,"date":{"end_time":"2010/05/17 00:00:00 -0400","original":"5/16/2010","granularity":"day","time":"2010/05/16 00:00:00 -0400"},"longitude":-77.05014,"id":"aeltf236th5q","location":"Carroll"},"type":"Feature","geometry":{"type":"Point","coordinates":[-77.05014,39.52656]}},{"properties":{"latitude":36.16099,"column_5":5,"date":{"end_time":"2010/05/25 00:00:00 -0400","original":"5/24/2010","granularity":"day","time":"2010/05/24 00:00:00 -0400"},"longitude":-80.6589,"id":"aeltf1ufehkb","location":"Yadkin"},"type":"Feature","geometry":{"type":"Point","coordinates":[-80.6589,36.16099]}},{"properties":{"latitude":36.1137478,"column_5":5,"date":{"end_time":"2010/06/04 00:00:00 -0400","original":"6/3/2010","granularity":"day","time":"2010/06/03 00:00:00 -0400"},"longitude":-80.6355989,"id":"aeltf23fb0yg","location":"Yadkin County Park"},"type":"Feature","geometry":{"type":"Point","coordinates":[-80.6355989,36.1137478]}},{"properties":{"latitude":36.0010975,"column_5":5,"date":{"end_time":"2010/06/09 00:00:00 -0400","original":"6/8/2010","granularity":"day","time":"2010/06/08 00:00:00 -0400"},"longitude":-79.9547625,"id":"aeltf1zw95ka","location":"Piedmont Environmental Center"},"type":"Feature","geometry":{"type":"Point","coordinates":[-79.9547625,36.0010975]}},{"properties":{"latitude":39.06167,"column_5":5,"date":{"end_time":"2010/09/19 00:00:00 -0400","original":"9/18/2010","granularity":"day","time":"2010/09/18 00:00:00 -0400"},"longitude":-76.06391,"id":"aeltf1q2lpdg","location":"Queen Annes"},"type":"Feature","geometry":{"type":"Point","coordinates":[-76.06391,39.06167]}},{"properties":{"latitude":36.05794,"column_5":5,"date":{"end_time":"2011/01/03 00:00:00 -0500","original":"1/2/2011","granularity":"day","time":"2011/01/02 00:00:00 -0500"},"longitude":-80.71699,"id":"aeltf1xwer78","location":"Lone Hickory"},"type":"Feature","geometry":{"type":"Point","coordinates":[-80.71699,36.05794]}},{"properties":{"latitude":35.864075,"column_5":4,"date":{"end_time":"2006/12/27 00:00:00 -0500","original":"12/26/2006","granularity":"day","time":"2006/12/26 00:00:00 -0500"},"longitude":-75.86201,"id":"aeltf21vjzju","location":"Alligator River NWR"},"type":"Feature","geometry":{"type":"Point","coordinates":[-75.86201,35.864075]}},{"properties":{"latitude":36.3405719,"column_5":4,"date":{"end_time":"2007/04/30 00:00:00 -0400","original":"4/29/2007","granularity":"day","time":"2007/04/29 00:00:00 -0400"},"longitude":-80.4772568,"id":"aeltf1pxhnuj","location":"Pilot Mountain SP--Mountain"},"type":"Feature","geometry":{"type":"Point","coordinates":[-80.4772568,36.3405719]}},{"properties":{"latitude":37.78206,"column_5":4,"date":{"end_time":"2008/06/24 00:00:00 -0400","original":"6/23/2008","granularity":"day","time":"2008/06/23 00:00:00 -0400"},"longitude":-79.44836,"id":"aeltf1oua3h9","location":"Lexington"},"type":"Feature","geometry":{"type":"Point","coordinates":[-79.44836,37.78206]}},{"properties":{"latitude":39.55156,"column_5":4,"date":{"end_time":"2009/04/19 00:00:00 -0400","original":"4/18/2009","granularity":"day","time":"2009/04/18 00:00:00 -0400"},"longitude":-76.00274,"id":"aeltf1va5evn","location":"Cecil"},"type":"Feature","geometry":{"type":"Point","coordinates":[-76.00274,39.55156]}},{"properties":{"latitude":32.29875,"column_5":4,"date":{"end_time":"2009/06/11 00:00:00 -0400","original":"6/10/2009","granularity":"day","time":"2009/06/10 00:00:00 -0400"},"longitude":-90.18479,"id":"aeltf1w0w6st","location":"Jackson"},"type":"Feature","geometry":{"type":"Point","coordinates":[-90.18479,32.29875]}},{"properties":{"latitude":39.1817075,"column_5":4,"date":{"end_time":"2009/08/22 00:00:00 -0400","original":"8/21/2009","granularity":"day","time":"2009/08/21 00:00:00 -0400"},"longitude":-76.6739273,"id":"aeltf2429y12","location":"BWI Airport"},"type":"Feature","geometry":{"type":"Point","coordinates":[-76.6739273,39.1817075]}},{"properties":{"latitude":39.3213176,"column_5":4,"date":{"end_time":"2009/12/09 00:00:00 -0500","original":"12/8/2009","granularity":"day","time":"2009/12/08 00:00:00 -0500"},"longitude":-76.644187,"id":"aeltf1vh2p1i","location":"Druid Hill Park"},"type":"Feature","geometry":{"type":"Point","coordinates":[-76.644187,39.3213176]}},{"properties":{"latitude":36.0417,"column_5":4,"date":{"end_time":"2010/01/03 00:00:00 -0500","original":"1/2/2010","granularity":"day","time":"2010/01/02 00:00:00 -0500"},"longitude":-79.38923,"id":"aeltf1vfdu4y","location":"Alamance"},"type":"Feature","geometry":{"type":"Point","coordinates":[-79.38923,36.0417]}},{"properties":{"latitude":36.354,"column_5":4,"date":{"end_time":"2010/01/07 00:00:00 -0500","original":"1/6/2010","granularity":"day","time":"2010/01/06 00:00:00 -0500"},"longitude":-78.39973,"id":"aeltf1y853oa","location":"Vance"},"type":"Feature","geometry":{"type":"Point","coordinates":[-78.39973,36.354]}},{"properties":{"latitude":36.28025,"column_5":4,"date":{"end_time":"2010/01/07 00:00:00 -0500","original":"1/6/2010","granularity":"day","time":"2010/01/06 00:00:00 -0500"},"longitude":-78.63431,"id":"aeltf1t4zjy4","location":"Granville"},"type":"Feature","geometry":{"type":"Point","coordinates":[-78.63431,36.28025]}},{"properties":{"latitude":-0.4710657,"column_5":4,"date":{"end_time":"2010/01/20 00:00:00 -0500","original":"1/19/2010","granularity":"day","time":"2010/01/19 00:00:00 -0500"},"longitude":-76.4591897,"id":"aeltf1wsjd6d","location":"Sacha Lodge"},"type":"Feature","geometry":{"type":"Point","coordinates":[-76.4591897,-0.4710657]}},{"properties":{"latitude":36.21037,"column_5":4,"date":{"end_time":"2010/08/05 00:00:00 -0400","original":"8/4/2010","granularity":"day","time":"2010/08/04 00:00:00 -0400"},"longitude":-81.20829,"id":"aeltf1qdkrtu","location":"Wilkes"},"type":"Feature","geometry":{"type":"Point","coordinates":[-81.20829,36.21037]}},{"properties":{"latitude":38.85591,"column_5":4,"date":{"end_time":"2010/08/27 00:00:00 -0400","original":"8/26/2010","granularity":"day","time":"2010/08/26 00:00:00 -0400"},"longitude":-78.5842,"id":"aeltf1uwearv","location":"Shenandoah"},"type":"Feature","geometry":{"type":"Point","coordinates":[-78.5842,38.85591]}},{"properties":{"latitude":39.4329779,"column_5":4,"date":{"end_time":"2010/11/15 00:00:00 -0500","original":"11/14/2010","granularity":"day","time":"2010/11/14 00:00:00 -0500"},"longitude":-76.7636418,"id":"aeltf1swr1a0","location":"Irvine Nature Center"},"type":"Feature","geometry":{"type":"Point","coordinates":[-76.7636418,39.4329779]}},{"properties":{"latitude":39.3998567,"column_5":4,"date":{"end_time":"2010/12/15 00:00:00 -0500","original":"12/14/2010","granularity":"day","time":"2010/12/14 00:00:00 -0500"},"longitude":-76.9872093,"id":"aeltf1ssyyko","location":"Piney Run Park"},"type":"Feature","geometry":{"type":"Point","coordinates":[-76.9872093,39.3998567]}},{"properties":{"latitude":36.0891558,"column_5":4,"date":{"end_time":"2010/12/22 00:00:00 -0500","original":"12/21/2010","granularity":"day","time":"2010/12/21 00:00:00 -0500"},"longitude":-80.4173255,"id":"aeltf1yvce6x","location":"Jack Warren Park"},"type":"Feature","geometry":{"type":"Point","coordinates":[-80.4173255,36.0891558]}},{"properties":{"latitude":39.3691853,"column_5":4,"date":{"end_time":"2011/04/06 00:00:00 -0400","original":"4/5/2011","granularity":"day","time":"2011/04/05 00:00:00 -0400"},"longitude":-76.6504097,"id":"aeltf22wksba","location":"Mt. Washington Mill"},"type":"Feature","geometry":{"type":"Point","coordinates":[-76.6504097,39.3691853]}},{"properties":{"latitude":39.522482,"column_5":4,"date":{"end_time":"2011/12/01 00:00:00 -0500","original":"11/30/2011","granularity":"day","time":"2011/11/30 00:00:00 -0500"},"longitude":-76.11444,"id":"aeltf1xixulz","location":"Swan Harbor Farm Park"},"type":"Feature","geometry":{"type":"Point","coordinates":[-76.11444,39.522482]}},{"properties":{"latitude":39.2035098,"column_5":4,"date":{"end_time":"2012/01/21 00:00:00 -0500","original":"1/20/2012","granularity":"day","time":"2012/01/20 00:00:00 -0500"},"longitude":-76.5276933,"id":"aeltf237bnwd","location":"Fort Armistead Park (Anne Arundel Co.)"},"type":"Feature","geometry":{"type":"Point","coordinates":[-76.5276933,39.2035098]}},{"properties":{"latitude":25.0488294,"column_5":4,"date":{"end_time":"2012/06/16 00:00:00 -0400","original":"6/15/2012","granularity":"day","time":"2012/06/15 00:00:00 -0400"},"longitude":102.7037897,"id":"aeltf1u7vkg8","location":"Cuihu Park"},"type":"Feature","geometry":{"type":"Point","coordinates":[102.7037897,25.0488294]}},{"properties":{"latitude":25.0527701,"column_5":4,"date":{"end_time":"2012/06/28 00:00:00 -0400","original":"6/27/2012","granularity":"day","time":"2012/06/27 00:00:00 -0400"},"longitude":102.702687,"id":"aeltf1umafga","location":"Yunnan University"},"type":"Feature","geometry":{"type":"Point","coordinates":[102.702687,25.0527701]}},{"properties":{"latitude":36.0008027,"column_5":4,"date":{"end_time":"2012/11/23 00:00:00 -0500","original":"11/22/2012","granularity":"day","time":"2012/11/22 00:00:00 -0500"},"longitude":-79.8829248,"id":"aeltf21egy1d","location":"Grandover"},"type":"Feature","geometry":{"type":"Point","coordinates":[-79.8829248,36.0008027]}},{"properties":{"latitude":38.8399597,"column_5":4,"date":{"end_time":"2012/12/23 00:00:00 -0500","original":"12/22/2012","granularity":"day","time":"2012/12/22 00:00:00 -0500"},"longitude":-77.280101,"id":"aeltf1vnj598","location":"Fairfax"},"type":"Feature","geometry":{"type":"Point","coordinates":[-77.280101,38.8399597]}},{"properties":{"latitude":35.6325176,"column_5":3,"date":{"end_time":"2004/07/16 00:00:00 -0400","original":"7/15/2004","granularity":"day","time":"2004/07/15 00:00:00 -0400"},"longitude":-79.7581458,"id":"aeltf1rtjkf3","location":"North Carolina Zoo"},"type":"Feature","geometry":{"type":"Point","coordinates":[-79.7581458,35.6325176]}},{"properties":{"latitude":36.0961724,"column_5":3,"date":{"end_time":"2004/07/22 00:00:00 -0400","original":"7/21/2004","granularity":"day","time":"2004/07/21 00:00:00 -0400"},"longitude":-81.8315578,"id":"aeltf24ltj7e","location":"Grandfather Mountain"},"type":"Feature","geometry":{"type":"Point","coordinates":[-81.8315578,36.0961724]}},{"properties":{"latitude":35.7175756,"column_5":3,"date":{"end_time":"2006/12/28 00:00:00 -0500","original":"12/27/2006","granularity":"day","time":"2006/12/27 00:00:00 -0500"},"longitude":-75.4985794,"id":"aeltf1syel78","location":"Pea Island NWR--North Pond"},"type":"Feature","geometry":{"type":"Point","coordinates":[-75.4985794,35.7175756]}},{"properties":{"latitude":37.9653805,"column_5":3,"date":{"end_time":"2008/06/22 00:00:00 -0400","original":"6/21/2008","granularity":"day","time":"2008/06/21 00:00:00 -0400"},"longitude":-79.4463444,"id":"aeltf1yg03wm","location":"Goshen Scout Reservation"},"type":"Feature","geometry":{"type":"Point","coordinates":[-79.4463444,37.9653805]}},{"properties":{"latitude":51.4969636,"column_5":3,"date":{"end_time":"2008/07/11 00:00:00 -0400","original":"7/10/2008","granularity":"day","time":"2008/07/10 00:00:00 -0400"},"longitude":-0.1005502,"id":"aeltf23hhfh1","location":"London"},"type":"Feature","geometry":{"type":"Point","coordinates":[-0.1005502,51.4969636]}},{"properties":{"latitude":39.99251,"column_5":3,"date":{"end_time":"2008/08/21 00:00:00 -0400","original":"8/20/2008","granularity":"day","time":"2008/08/20 00:00:00 -0400"},"longitude":-75.12561,"id":"aeltf1qc2lp2","location":"Philadelphia"},"type":"Feature","geometry":{"type":"Point","coordinates":[-75.12561,39.99251]}},{"properties":{"latitude":35.01088,"column_5":3,"date":{"end_time":"2009/06/07 00:00:00 -0400","original":"6/6/2009","granularity":"day","time":"2009/06/06 00:00:00 -0400"},"longitude":-81.6162,"id":"aeltf214bmk9","location":"Cherokee"},"type":"Feature","geometry":{"type":"Point","coordinates":[-81.6162,35.01088]}},{"properties":{"latitude":32.6011957,"column_5":3,"date":{"end_time":"2009/06/11 00:00:00 -0400","original":"6/10/2009","granularity":"day","time":"2009/06/10 00:00:00 -0400"},"longitude":-90.0683427,"id":"aeltf24wnxyz","location":"Canton MS La Quinta"},"type":"Feature","geometry":{"type":"Point","coordinates":[-90.0683427,32.6011957]}},{"properties":{"latitude":34.94891,"column_5":3,"date":{"end_time":"2009/12/27 00:00:00 -0500","original":"12/26/2009","granularity":"day","time":"2009/12/26 00:00:00 -0500"},"longitude":-77.92506,"id":"aeltf1rwvemz","location":"Duplin"},"type":"Feature","geometry":{"type":"Point","coordinates":[-77.92506,34.94891]}},{"properties":{"latitude":38.01398,"column_5":3,"date":{"end_time":"2010/01/07 00:00:00 -0500","original":"1/6/2010","granularity":"day","time":"2010/01/06 00:00:00 -0500"},"longitude":-77.36049,"id":"aeltf24vb4wg","location":"Caroline"},"type":"Feature","geometry":{"type":"Point","coordinates":[-77.36049,38.01398]}},{"properties":{"latitude":38.72142,"column_5":3,"date":{"end_time":"2010/01/07 00:00:00 -0500","original":"1/6/2010","granularity":"day","time":"2010/01/06 00:00:00 -0500"},"longitude":-77.47398,"id":"aeltf1rmx081","location":"Prince William"},"type":"Feature","geometry":{"type":"Point","coordinates":[-77.47398,38.72142]}},{"properties":{"latitude":38.18915,"column_5":3,"date":{"end_time":"2010/01/07 00:00:00 -0500","original":"1/6/2010","granularity":"day","time":"2010/01/06 00:00:00 -0500"},"longitude":-77.66398,"id":"aeltf1q0h56o","location":"Spotsylvania"},"type":"Feature","geometry":{"type":"Point","coordinates":[-77.66398,38.18915]}},{"properties":{"latitude":38.41966,"column_5":3,"date":{"end_time":"2010/01/07 00:00:00 -0500","original":"1/6/2010","granularity":"day","time":"2010/01/06 00:00:00 -0500"},"longitude":-77.46238,"id":"aeltf1zfp37s","location":"Stafford"},"type":"Feature","geometry":{"type":"Point","coordinates":[-77.46238,38.41966]}},{"properties":{"latitude":36.71799,"column_5":3,"date":{"end_time":"2010/01/07 00:00:00 -0500","original":"1/6/2010","granularity":"day","time":"2010/01/06 00:00:00 -0500"},"longitude":-78.38641,"id":"aeltf21dk6ba","location":"Mecklenburg"},"type":"Feature","geometry":{"type":"Point","coordinates":[-78.38641,36.71799]}},{"properties":{"latitude":36.37459,"column_5":3,"date":{"end_time":"2010/01/07 00:00:00 -0500","original":"1/6/2010","granularity":"day","time":"2010/01/06 00:00:00 -0500"},"longitude":-78.10977,"id":"aeltf1xdb9a6","location":"Warren"},"type":"Feature","geometry":{"type":"Point","coordinates":[-78.10977,36.37459]}},{"properties":{"latitude":36.11265,"column_5":3,"date":{"end_time":"2010/03/19 00:00:00 -0400","original":"3/18/2010","granularity":"day","time":"2010/03/18 00:00:00 -0400"},"longitude":-80.26673,"id":"aeltf1rxpq3c","location":"Forsyth"},"type":"Feature","geometry":{"type":"Point","coordinates":[-80.26673,36.11265]}},{"properties":{"latitude":39.12248,"column_5":3,"date":{"end_time":"2010/05/17 00:00:00 -0400","original":"5/16/2010","granularity":"day","time":"2010/05/16 00:00:00 -0400"},"longitude":-77.99249,"id":"aeltf1zlsxc3","location":"Clarke"},"type":"Feature","geometry":{"type":"Point","coordinates":[-77.99249,39.12248]}},{"properties":{"latitude":35.76347,"column_5":3,"date":{"end_time":"2010/05/21 00:00:00 -0400","original":"5/20/2010","granularity":"day","time":"2010/05/20 00:00:00 -0400"},"longitude":-80.25853,"id":"aeltf1sgldby","location":"Davidson"},"type":"Feature","geometry":{"type":"Point","coordinates":[-80.25853,35.76347]}},{"properties":{"latitude":36.40077,"column_5":3,"date":{"end_time":"2010/05/30 00:00:00 -0400","original":"5/29/2010","granularity":"day","time":"2010/05/29 00:00:00 -0400"},"longitude":-80.23831,"id":"aeltf1ztht9t","location":"Stokes"},"type":"Feature","geometry":{"type":"Point","coordinates":[-80.23831,36.40077]}},{"properties":{"latitude":36.2605734,"column_5":3,"date":{"end_time":"2010/06/05 00:00:00 -0400","original":"6/4/2010","granularity":"day","time":"2010/06/04 00:00:00 -0400"},"longitude":-80.499959,"id":"aeltf1pldmyp","location":"Pilot Mountain SP--Yadkin River"},"type":"Feature","geometry":{"type":"Point","coordinates":[-80.499959,36.2605734]}},{"properties":{"latitude":43.7655658,"column_5":3,"date":{"end_time":"2010/07/04 00:00:00 -0400","original":"7/3/2010","granularity":"day","time":"2010/07/03 00:00:00 -0400"},"longitude":-71.4794755,"id":"aeltf1xdff7l","location":"Squam Lake"},"type":"Feature","geometry":{"type":"Point","coordinates":[-71.4794755,43.7655658]}},{"properties":{"latitude":35.53246,"column_5":3,"date":{"end_time":"2010/08/14 00:00:00 -0400","original":"8/13/2010","granularity":"day","time":"2010/08/13 00:00:00 -0400"},"longitude":-78.38687,"id":"aeltf22nwj52","location":"Johnston"},"type":"Feature","geometry":{"type":"Point","coordinates":[-78.38687,35.53246]}},{"properties":{"latitude":34.80241,"column_5":3,"date":{"end_time":"2010/08/15 00:00:00 -0400","original":"8/14/2010","granularity":"day","time":"2010/08/14 00:00:00 -0400"},"longitude":-76.72564,"id":"aeltf23zmnqr","location":"Carteret"},"type":"Feature","geometry":{"type":"Point","coordinates":[-76.72564,34.80241]}},{"properties":{"latitude":38.18381,"column_5":3,"date":{"end_time":"2010/08/27 00:00:00 -0400","original":"8/26/2010","granularity":"day","time":"2010/08/26 00:00:00 -0400"},"longitude":-79.12648,"id":"aeltf1otgtun","location":"Augusta"},"type":"Feature","geometry":{"type":"Point","coordinates":[-79.12648,38.18381]}},{"properties":{"latitude":37.2709475,"column_5":3,"date":{"end_time":"2010/08/27 00:00:00 -0400","original":"8/26/2010","granularity":"day","time":"2010/08/26 00:00:00 -0400"},"longitude":-80.0692349,"id":"aeltf1wyewca","location":"Roanoke"},"type":"Feature","geometry":{"type":"Point","coordinates":[-80.0692349,37.2709475]}},{"properties":{"latitude":39.0195838,"column_5":3,"date":{"end_time":"2010/09/05 00:00:00 -0400","original":"9/4/2010","granularity":"day","time":"2010/09/04 00:00:00 -0400"},"longitude":-76.5779686,"id":"aeltf1ve287p","location":"Renfest"},"type":"Feature","geometry":{"type":"Point","coordinates":[-76.5779686,39.0195838]}},{"properties":{"latitude":38.47995,"column_5":3,"date":{"end_time":"2010/10/18 00:00:00 -0400","original":"10/17/2010","granularity":"day","time":"2010/10/17 00:00:00 -0400"},"longitude":-76.00051,"id":"aeltf21w3b5b","location":"Dorchester"},"type":"Feature","geometry":{"type":"Point","coordinates":[-76.00051,38.47995]}},{"properties":{"latitude":38.76014,"column_5":3,"date":{"end_time":"2010/10/19 00:00:00 -0400","original":"10/18/2010","granularity":"day","time":"2010/10/18 00:00:00 -0400"},"longitude":-76.1256,"id":"aeltf1xgkof6","location":"Talbot"},"type":"Feature","geometry":{"type":"Point","coordinates":[-76.1256,38.76014]}},{"properties":{"latitude":36.2483,"column_5":3,"date":{"end_time":"2010/12/25 00:00:00 -0500","original":"12/24/2010","granularity":"day","time":"2010/12/24 00:00:00 -0500"},"longitude":-81.68081,"id":"aeltf23e4xbf","location":"Watauga"},"type":"Feature","geometry":{"type":"Point","coordinates":[-81.68081,36.2483]}},{"properties":{"latitude":36.0998383,"column_5":3,"date":{"end_time":"2011/01/04 00:00:00 -0500","original":"1/3/2011","granularity":"day","time":"2011/01/03 00:00:00 -0500"},"longitude":-80.2441711,"id":"aeltf220tglv","location":"Winston-Salem"},"type":"Feature","geometry":{"type":"Point","coordinates":[-80.2441711,36.0998383]}},{"properties":{"latitude":35.8093674,"column_5":3,"date":{"end_time":"2011/01/05 00:00:00 -0500","original":"1/4/2011","granularity":"day","time":"2011/01/04 00:00:00 -0500"},"longitude":-80.5631331,"id":"aeltf21o7r6z","location":"Riverpark at Cooleemee Falls-Rowan"},"type":"Feature","geometry":{"type":"Point","coordinates":[-80.5631331,35.8093674]}},{"properties":{"latitude":35.9059803,"column_5":3,"date":{"end_time":"2011/01/05 00:00:00 -0500","original":"1/4/2011","granularity":"day","time":"2011/01/04 00:00:00 -0500"},"longitude":-80.5625296,"id":"aeltf1pgefqd","location":"Rich Park"},"type":"Feature","geometry":{"type":"Point","coordinates":[-80.5625296,35.9059803]}},{"properties":{"latitude":35.94124,"column_5":3,"date":{"end_time":"2011/01/05 00:00:00 -0500","original":"1/4/2011","granularity":"day","time":"2011/01/04 00:00:00 -0500"},"longitude":-80.40918,"id":"aeltf24pghrh","location":"Advance"},"type":"Feature","geometry":{"type":"Point","coordinates":[-80.40918,35.94124]}},{"properties":{"latitude":39.98971,"column_5":3,"date":{"end_time":"2011/01/07 00:00:00 -0500","original":"1/6/2011","granularity":"day","time":"2011/01/06 00:00:00 -0500"},"longitude":-75.75695,"id":"aeltf2124lv4","location":"Chester"},"type":"Feature","geometry":{"type":"Point","coordinates":[-75.75695,39.98971]}},{"properties":{"latitude":39.97436,"column_5":3,"date":{"end_time":"2011/01/10 00:00:00 -0500","original":"1/9/2011","granularity":"day","time":"2011/01/09 00:00:00 -0500"},"longitude":-76.68795,"id":"aeltf1z85c7i","location":"York"},"type":"Feature","geometry":{"type":"Point","coordinates":[-76.68795,39.97436]}},{"properties":{"latitude":39.4037,"column_5":3,"date":{"end_time":"2011/01/26 00:00:00 -0500","original":"1/25/2011","granularity":"day","time":"2011/01/25 00:00:00 -0500"},"longitude":-76.9503,"id":"aeltf249qgxa","location":"Eldersburg"},"type":"Feature","geometry":{"type":"Point","coordinates":[-76.9503,39.4037]}},{"properties":{"latitude":36.0120679,"column_5":3,"date":{"end_time":"2011/03/22 00:00:00 -0400","original":"3/21/2011","granularity":"day","time":"2011/03/21 00:00:00 -0400"},"longitude":-80.4337406,"id":"aeltf1u59ar6","location":"Kinderton Village"},"type":"Feature","geometry":{"type":"Point","coordinates":[-80.4337406,36.0120679]}},{"properties":{"latitude":39.321384,"column_5":3,"date":{"end_time":"2011/04/08 00:00:00 -0400","original":"4/7/2011","granularity":"day","time":"2011/04/07 00:00:00 -0400"},"longitude":-76.6302395,"id":"aeltf1zgki8r","location":"Jones Falls Trail"},"type":"Feature","geometry":{"type":"Point","coordinates":[-76.6302395,39.321384]}},{"properties":{"latitude":39.3615376,"column_5":3,"date":{"end_time":"2011/04/10 00:00:00 -0400","original":"4/9/2011","granularity":"day","time":"2011/04/09 00:00:00 -0400"},"longitude":-76.6154337,"id":"aeltf255hze4","location":"Rosebank Avenue"},"type":"Feature","geometry":{"type":"Point","coordinates":[-76.6154337,39.3615376]}},{"properties":{"latitude":39.296,"column_5":3,"date":{"end_time":"2011/05/06 00:00:00 -0400","original":"5/5/2011","granularity":"day","time":"2011/05/05 00:00:00 -0400"},"longitude":-77.432,"id":"aeltf1zs0ris","location":"Lilypons Water Gardens"},"type":"Feature","geometry":{"type":"Point","coordinates":[-77.432,39.296]}},{"properties":{"latitude":39.2896713,"column_5":3,"date":{"end_time":"2011/05/18 00:00:00 -0400","original":"5/17/2011","granularity":"day","time":"2011/05/17 00:00:00 -0400"},"longitude":-76.5798569,"id":"aeltf1qglm5h","location":"Patterson Park"},"type":"Feature","geometry":{"type":"Point","coordinates":[-76.5798569,39.2896713]}},{"properties":{"latitude":35.68934,"column_5":3,"date":{"end_time":"2011/06/03 00:00:00 -0400","original":"6/2/2011","granularity":"day","time":"2011/06/02 00:00:00 -0400"},"longitude":-79.23028,"id":"aeltf1zgi57y","location":"Chatham"},"type":"Feature","geometry":{"type":"Point","coordinates":[-79.23028,35.68934]}},{"properties":{"latitude":39.3188444,"column_5":3,"date":{"end_time":"2011/12/11 00:00:00 -0500","original":"12/10/2011","granularity":"day","time":"2011/12/10 00:00:00 -0500"},"longitude":-76.6280238,"id":"aeltf1xsq75n","location":"W 29th Street"},"type":"Feature","geometry":{"type":"Point","coordinates":[-76.6280238,39.3188444]}},{"properties":{"latitude":39.3798437,"column_5":3,"date":{"end_time":"2012/01/11 00:00:00 -0500","original":"1/10/2012","granularity":"day","time":"2012/01/10 00:00:00 -0500"},"longitude":-76.6436839,"id":"aeltf21r50z3","location":"Robert E. Lee Park--Boardwalk"},"type":"Feature","geometry":{"type":"Point","coordinates":[-76.6436839,39.3798437]}},{"properties":{"latitude":39.2951704,"column_5":3,"date":{"end_time":"2012/01/13 00:00:00 -0500","original":"1/12/2012","granularity":"day","time":"2012/01/12 00:00:00 -0500"},"longitude":-77.4572717,"id":"aeltf1v1w5vo","location":"Oland Road"},"type":"Feature","geometry":{"type":"Point","coordinates":[-77.4572717,39.2951704]}},{"properties":{"latitude":39.016,"column_5":3,"date":{"end_time":"2012/01/18 00:00:00 -0500","original":"1/17/2012","granularity":"day","time":"2012/01/17 00:00:00 -0500"},"longitude":-76.402,"id":"aeltf1tuckq2","location":"Sandy Point State Park"},"type":"Feature","geometry":{"type":"Point","coordinates":[-76.402,39.016]}},{"properties":{"latitude":39.2361091,"column_5":3,"date":{"end_time":"2012/02/24 00:00:00 -0500","original":"2/23/2012","granularity":"day","time":"2012/02/23 00:00:00 -0500"},"longitude":-76.6265917,"id":"aeltf1q2j90b","location":"Southwest Area Park"},"type":"Feature","geometry":{"type":"Point","coordinates":[-76.6265917,39.2361091]}},{"properties":{"latitude":39.3411216,"column_5":3,"date":{"end_time":"2012/05/21 00:00:00 -0400","original":"5/20/2012","granularity":"day","time":"2012/05/20 00:00:00 -0400"},"longitude":-76.6394782,"id":"aeltf1udyxsc","location":"Falls Road"},"type":"Feature","geometry":{"type":"Point","coordinates":[-76.6394782,39.3411216]}},{"properties":{"latitude":25.6875061,"column_5":3,"date":{"end_time":"2012/06/30 00:00:00 -0400","original":"6/29/2012","granularity":"day","time":"2012/06/29 00:00:00 -0400"},"longitude":100.1634921,"id":"aeltf1wpfrkc","location":"Dali"},"type":"Feature","geometry":{"type":"Point","coordinates":[100.1634921,25.6875061]}},{"properties":{"latitude":19.8965037,"column_5":3,"date":{"end_time":"2012/07/27 00:00:00 -0400","original":"7/26/2012","granularity":"day","time":"2012/07/26 00:00:00 -0400"},"longitude":102.143299,"id":"aeltf1rm80hg","location":"Luang Prabang"},"type":"Feature","geometry":{"type":"Point","coordinates":[102.143299,19.8965037]}},{"properties":{"latitude":39.41951,"column_5":3,"date":{"end_time":"2012/08/31 00:00:00 -0400","original":"8/30/2012","granularity":"day","time":"2012/08/30 00:00:00 -0400"},"longitude":-76.7803,"id":"aeltf1ve2o26","location":"Owings Mills"},"type":"Feature","geometry":{"type":"Point","coordinates":[-76.7803,39.41951]}},{"properties":{"latitude":39.417,"column_5":3,"date":{"end_time":"2012/09/09 00:00:00 -0400","original":"9/8/2012","granularity":"day","time":"2012/09/08 00:00:00 -0400"},"longitude":-76.547,"id":"aeltf21av8ki","location":"Cromwell Valley Park"},"type":"Feature","geometry":{"type":"Point","coordinates":[-76.547,39.417]}},{"properties":{"latitude":38.81958,"column_5":3,"date":{"end_time":"2012/12/23 00:00:00 -0500","original":"12/22/2012","granularity":"day","time":"2012/12/22 00:00:00 -0500"},"longitude":-77.09014,"id":"aeltf1ypsmm2","location":"Alexandria"},"type":"Feature","geometry":{"type":"Point","coordinates":[-77.09014,38.81958]}},{"properties":{"latitude":39.3984639,"column_5":3,"date":{"end_time":"2013/02/24 00:00:00 -0500","original":"2/23/2013","granularity":"day","time":"2013/02/23 00:00:00 -0500"},"longitude":-76.7827606,"id":"aeltf1p6c87f","location":"McDonogh School Pond"},"type":"Feature","geometry":{"type":"Point","coordinates":[-76.7827606,39.3984639]}},{"properties":{"latitude":35.497833,"column_5":3,"date":{"end_time":"2013/03/23 00:00:00 -0400","original":"3/22/2013","granularity":"day","time":"2013/03/22 00:00:00 -0400"},"longitude":-80.868642,"id":"aeltf1w0s6nz","location":"I-77 Lake Norman Bridge"},"type":"Feature","geometry":{"type":"Point","coordinates":[-80.868642,35.497833]}},{"properties":{"latitude":32.38553,"column_5":3,"date":{"end_time":"2013/05/26 00:00:00 -0400","original":"5/25/2013","granularity":"day","time":"2013/05/25 00:00:00 -0400"},"longitude":-80.72513,"id":"aeltf23wnpst","location":"Beaufort"},"type":"Feature","geometry":{"type":"Point","coordinates":[-80.72513,32.38553]}},{"properties":{"latitude":36.0766094,"column_5":2,"date":{"end_time":"2004/07/11 00:00:00 -0400","original":"7/10/2004","granularity":"day","time":"2004/07/10 00:00:00 -0400"},"longitude":-80.3890657,"id":"aeltf1tgyk2j","location":"Lewisville-Clemmons Rd, NC"},"type":"Feature","geometry":{"type":"Point","coordinates":[-80.3890657,36.0766094]}},{"properties":{"latitude":34.2023437,"column_5":2,"date":{"end_time":"2005/09/10 00:00:00 -0400","original":"9/9/2005","granularity":"day","time":"2005/09/09 00:00:00 -0400"},"longitude":-77.7977085,"id":"aeltf23cjcbn","location":"Blockade Runner"},"type":"Feature","geometry":{"type":"Point","coordinates":[-77.7977085,34.2023437]}},{"properties":{"latitude":35.503793,"column_5":2,"date":{"end_time":"2006/03/27 00:00:00 -0500","original":"3/26/2006","granularity":"day","time":"2006/03/26 00:00:00 -0500"},"longitude":-80.9309578,"id":"aeltf1wyryx1","location":"N-27"},"type":"Feature","geometry":{"type":"Point","coordinates":[-80.9309578,35.503793]}},{"properties":{"latitude":35.967,"column_5":2,"date":{"end_time":"2006/07/29 00:00:00 -0400","original":"7/28/2006","granularity":"day","time":"2006/07/28 00:00:00 -0400"},"longitude":-83.18768,"id":"aeltf1qg9rl8","location":"Newport"},"type":"Feature","geometry":{"type":"Point","coordinates":[-83.18768,35.967]}},{"properties":{"latitude":35.63198,"column_5":2,"date":{"end_time":"2006/08/01 00:00:00 -0400","original":"7/31/2006","granularity":"day","time":"2006/07/31 00:00:00 -0400"},"longitude":-112.04342,"id":"aeltf1zlykpc","location":"Coconino"},"type":"Feature","geometry":{"type":"Point","coordinates":[-112.04342,35.63198]}},{"properties":{"latitude":35.78593,"column_5":2,"date":{"end_time":"2006/12/27 00:00:00 -0500","original":"12/26/2006","granularity":"day","time":"2006/12/26 00:00:00 -0500"},"longitude":-76.21702,"id":"aeltf24da88j","location":"Tyrrell"},"type":"Feature","geometry":{"type":"Point","coordinates":[-76.21702,35.78593]}},{"properties":{"latitude":35.7176325,"column_5":2,"date":{"end_time":"2006/12/28 00:00:00 -0500","original":"12/27/2006","granularity":"day","time":"2006/12/27 00:00:00 -0500"},"longitude":-75.4931116,"id":"aeltf221sdwp","location":"Pea Island NWR- North Pond Beach"},"type":"Feature","geometry":{"type":"Point","coordinates":[-75.4931116,35.7176325]}},{"properties":{"latitude":35.767247,"column_5":2,"date":{"end_time":"2006/12/28 00:00:00 -0500","original":"12/27/2006","granularity":"day","time":"2006/12/27 00:00:00 -0500"},"longitude":-75.522541,"id":"aeltf1wbmk3r","location":"Pea Island NWR--Old Coast Guard Station"},"type":"Feature","geometry":{"type":"Point","coordinates":[-75.522541,35.767247]}},{"properties":{"latitude":36.1557564,"column_5":2,"date":{"end_time":"2006/12/31 00:00:00 -0500","original":"12/30/2006","granularity":"day","time":"2006/12/30 00:00:00 -0500"},"longitude":-80.3140068,"id":"aeltf1svjs1m","location":"Bethabara Wetlands"},"type":"Feature","geometry":{"type":"Point","coordinates":[-80.3140068,36.1557564]}},{"properties":{"latitude":36.6238689,"column_5":2,"date":{"end_time":"2007/06/27 00:00:00 -0400","original":"6/26/2007","granularity":"day","time":"2007/06/26 00:00:00 -0400"},"longitude":-81.4998436,"id":"aeltf1qbhm1r","location":"Grayson Highlands State Park - MMR07"},"type":"Feature","geometry":{"type":"Point","coordinates":[-81.4998436,36.6238689]}},{"properties":{"latitude":36.6353,"column_5":2,"date":{"end_time":"2007/07/01 00:00:00 -0400","original":"6/30/2007","granularity":"day","time":"2007/06/30 00:00:00 -0400"},"longitude":-81.7921,"id":"aeltf21eo0eu","location":"Virginia Creeper Trail--Damascus - MSH01"},"type":"Feature","geometry":{"type":"Point","coordinates":[-81.7921,36.6353]}},{"properties":{"latitude":46.8503299,"column_5":2,"date":{"end_time":"2007/07/16 00:00:00 -0400","original":"7/15/2007","granularity":"day","time":"2007/07/15 00:00:00 -0400"},"longitude":-121.7524849,"id":"aeltf1vtlxzk","location":"Mount Rainier National Park"},"type":"Feature","geometry":{"type":"Point","coordinates":[-121.7524849,46.8503299]}},{"properties":{"latitude":42.3583984,"column_5":2,"date":{"end_time":"2008/02/28 00:00:00 -0500","original":"2/27/2008","granularity":"day","time":"2008/02/27 00:00:00 -0500"},"longitude":-71.0597992,"id":"aeltf23xnsed","location":"Boston"},"type":"Feature","geometry":{"type":"Point","coordinates":[-71.0597992,42.3583984]}},{"properties":{"latitude":42.3750992,"column_5":2,"date":{"end_time":"2008/03/02 00:00:00 -0500","original":"3/1/2008","granularity":"day","time":"2008/03/01 00:00:00 -0500"},"longitude":-71.1055984,"id":"aeltf1vk4at0","location":"Cambridge"},"type":"Feature","geometry":{"type":"Point","coordinates":[-71.1055984,42.3750992]}},{"properties":{"latitude":51.5061075,"column_5":2,"date":{"end_time":"2008/07/11 00:00:00 -0400","original":"7/10/2008","granularity":"day","time":"2008/07/10 00:00:00 -0400"},"longitude":-0.0955789,"id":"aeltf1qvsz5o","location":"Tate Modern"},"type":"Feature","geometry":{"type":"Point","coordinates":[-0.0955789,51.5061075]}},{"properties":{"latitude":51.4991103,"column_5":2,"date":{"end_time":"2008/07/11 00:00:00 -0400","original":"7/10/2008","granularity":"day","time":"2008/07/10 00:00:00 -0400"},"longitude":-0.1272006,"id":"aeltf211xyes","location":"Westminster Abbey"},"type":"Feature","geometry":{"type":"Point","coordinates":[-0.1272006,51.4991103]}},{"properties":{"latitude":51.5031329,"column_5":2,"date":{"end_time":"2008/07/12 00:00:00 -0400","original":"7/11/2008","granularity":"day","time":"2008/07/11 00:00:00 -0400"},"longitude":-0.1338959,"id":"aeltf236w8xr","location":"St. James Park"},"type":"Feature","geometry":{"type":"Point","coordinates":[-0.1338959,51.5031329]}},{"properties":{"latitude":38.9066717,"column_5":2,"date":{"end_time":"2008/08/20 00:00:00 -0400","original":"8/19/2008","granularity":"day","time":"2008/08/19 00:00:00 -0400"},"longitude":-77.0752317,"id":"aeltf1vi29gy","location":"Georgetown University"},"type":"Feature","geometry":{"type":"Point","coordinates":[-77.0752317,38.9066717]}},{"properties":{"latitude":32.0866015,"column_5":2,"date":{"end_time":"2009/06/13 00:00:00 -0400","original":"6/12/2009","granularity":"day","time":"2009/06/12 00:00:00 -0400"},"longitude":-90.7988906,"id":"aeltf1s0yhor","location":"Rocky Springs Natchez Trace"},"type":"Feature","geometry":{"type":"Point","coordinates":[-90.7988906,32.0866015]}},{"properties":{"latitude":34.9086455,"column_5":2,"date":{"end_time":"2009/06/28 00:00:00 -0400","original":"6/27/2009","granularity":"day","time":"2009/06/27 00:00:00 -0400"},"longitude":-75.3057861,"id":"aeltf1x974mb","location":"Pelagic off Hatteras"},"type":"Feature","geometry":{"type":"Point","coordinates":[-75.3057861,34.9086455]}},{"properties":{"latitude":35.819076,"column_5":2,"date":{"end_time":"2009/06/30 00:00:00 -0400","original":"6/29/2009","granularity":"day","time":"2009/06/29 00:00:00 -0400"},"longitude":-75.562966,"id":"aeltf1yjel3l","location":"Bodie Island Lighthouse &amp; Pond"},"type":"Feature","geometry":{"type":"Point","coordinates":[-75.562966,35.819076]}},{"properties":{"latitude":44.8762518,"column_5":2,"date":{"end_time":"2009/07/08 00:00:00 -0400","original":"7/7/2009","granularity":"day","time":"2009/07/07 00:00:00 -0400"},"longitude":-63.524388,"id":"aeltf1zlail4","location":"Halifax Stanfield International Airport"},"type":"Feature","geometry":{"type":"Point","coordinates":[-63.524388,44.8762518]}},{"properties":{"latitude":46.4440055,"column_5":2,"date":{"end_time":"2009/07/13 00:00:00 -0400","original":"7/12/2009","granularity":"day","time":"2009/07/12 00:00:00 -0400"},"longitude":-62.6931084,"id":"aeltf24t7h6n","location":"Prince Edward Island National Park, Greenwich"},"type":"Feature","geometry":{"type":"Point","coordinates":[-62.6931084,46.4440055]}},{"properties":{"latitude":46.2901504,"column_5":2,"date":{"end_time":"2009/07/14 00:00:00 -0400","original":"7/13/2009","granularity":"day","time":"2009/07/13 00:00:00 -0400"},"longitude":-62.5198318,"id":"aeltf1qy26kq","location":"Kings"},"type":"Feature","geometry":{"type":"Point","coordinates":[-62.5198318,46.2901504]}},{"properties":{"latitude":46.6296356,"column_5":2,"date":{"end_time":"2009/07/15 00:00:00 -0400","original":"7/14/2009","granularity":"day","time":"2009/07/14 00:00:00 -0400"},"longitude":-61.0084534,"id":"aeltf1w9gx03","location":"Cheticamp"},"type":"Feature","geometry":{"type":"Point","coordinates":[-61.0084534,46.6296356]}},{"properties":{"latitude":36.0734703,"column_5":2,"date":{"end_time":"2009/12/21 00:00:00 -0500","original":"12/20/2009","granularity":"day","time":"2009/12/20 00:00:00 -0500"},"longitude":-80.3605485,"id":"aeltf1zjkn3t","location":"421 Peace Haven Exit"},"type":"Feature","geometry":{"type":"Point","coordinates":[-80.3605485,36.0734703]}},{"properties":{"latitude":36.1677966,"column_5":2,"date":{"end_time":"2009/12/22 00:00:00 -0500","original":"12/21/2009","granularity":"day","time":"2009/12/21 00:00:00 -0500"},"longitude":-79.8382151,"id":"aeltf1teuc9t","location":"Lake Brandt--Marina"},"type":"Feature","geometry":{"type":"Point","coordinates":[-79.8382151,36.1677966]}},{"properties":{"latitude":34.72068,"column_5":2,"date":{"end_time":"2009/12/27 00:00:00 -0500","original":"12/26/2009","granularity":"day","time":"2009/12/26 00:00:00 -0500"},"longitude":-77.4093,"id":"aeltf1p6aur6","location":"Onslow"},"type":"Feature","geometry":{"type":"Point","coordinates":[-77.4093,34.72068]}},{"properties":{"latitude":37.07498,"column_5":2,"date":{"end_time":"2010/01/07 00:00:00 -0500","original":"1/6/2010","granularity":"day","time":"2010/01/06 00:00:00 -0500"},"longitude":-77.65222,"id":"aeltf1re6rh6","location":"Dinwiddie"},"type":"Feature","geometry":{"type":"Point","coordinates":[-77.65222,37.07498]}},{"properties":{"latitude":36.79122,"column_5":2,"date":{"end_time":"2010/01/07 00:00:00 -0500","original":"1/6/2010","granularity":"day","time":"2010/01/06 00:00:00 -0500"},"longitude":-77.85475,"id":"aeltf1yucvfv","location":"Brunswick"},"type":"Feature","geometry":{"type":"Point","coordinates":[-77.85475,36.79122]}},{"properties":{"latitude":-0.2068944,"column_5":2,"date":{"end_time":"2010/01/12 00:00:00 -0500","original":"1/11/2010","granularity":"day","time":"2010/01/11 00:00:00 -0500"},"longitude":-78.4908128,"id":"aeltf1wxvgwt","location":"Hotel Sierra Madre"},"type":"Feature","geometry":{"type":"Point","coordinates":[-78.4908128,-0.2068944]}},{"properties":{"latitude":0.2355187,"column_5":2,"date":{"end_time":"2010/01/13 00:00:00 -0500","original":"1/12/2010","granularity":"day","time":"2010/01/12 00:00:00 -0500"},"longitude":-78.2660866,"id":"aeltf1w22sg2","location":"Las Palmeras Inn"},"type":"Feature","geometry":{"type":"Point","coordinates":[-78.2660866,0.2355187]}},{"properties":{"latitude":-0.4500915,"column_5":2,"date":{"end_time":"2010/01/20 00:00:00 -0500","original":"1/19/2010","granularity":"day","time":"2010/01/19 00:00:00 -0500"},"longitude":-76.5022659,"id":"aeltf1qp3s6z","location":"Rio Napo"},"type":"Feature","geometry":{"type":"Point","coordinates":[-76.5022659,-0.4500915]}},{"properties":{"latitude":39.389642,"column_5":2,"date":{"end_time":"2010/04/12 00:00:00 -0400","original":"4/11/2010","granularity":"day","time":"2010/04/11 00:00:00 -0400"},"longitude":-76.6536713,"id":"aeltf1x8rwr9","location":"Robert E. Lee Park"},"type":"Feature","geometry":{"type":"Point","coordinates":[-76.6536713,39.389642]}},{"properties":{"latitude":39.17069,"column_5":2,"date":{"end_time":"2010/05/17 00:00:00 -0400","original":"5/16/2010","granularity":"day","time":"2010/05/16 00:00:00 -0400"},"longitude":-78.16886,"id":"aeltf1t34rrx","location":"Winchester"},"type":"Feature","geometry":{"type":"Point","coordinates":[-78.16886,39.17069]}},{"properties":{"latitude":36.0917655,"column_5":2,"date":{"end_time":"2010/05/20 00:00:00 -0400","original":"5/19/2010","granularity":"day","time":"2010/05/19 00:00:00 -0400"},"longitude":-80.2548373,"id":"aeltf1qe1p56","location":"BB&amp;T Ballpark"},"type":"Feature","geometry":{"type":"Point","coordinates":[-80.2548373,36.0917655]}},{"properties":{"latitude":36.1273378,"column_5":2,"date":{"end_time":"2010/06/04 00:00:00 -0400","original":"6/3/2010","granularity":"day","time":"2010/06/03 00:00:00 -0400"},"longitude":-80.6616211,"id":"aeltf1tf7crr","location":"Yadkinville"},"type":"Feature","geometry":{"type":"Point","coordinates":[-80.6616211,36.1273378]}},{"properties":{"latitude":36.38654,"column_5":2,"date":{"end_time":"2010/06/05 00:00:00 -0400","original":"6/4/2010","granularity":"day","time":"2010/06/04 00:00:00 -0400"},"longitude":-80.46948,"id":"aeltf1qcblw0","location":"Pilot Mountain"},"type":"Feature","geometry":{"type":"Point","coordinates":[-80.46948,36.38654]}},{"properties":{"latitude":35.12685,"column_5":2,"date":{"end_time":"2010/08/15 00:00:00 -0400","original":"8/14/2010","granularity":"day","time":"2010/08/14 00:00:00 -0400"},"longitude":-77.04953,"id":"aeltf252neg2","location":"Craven"},"type":"Feature","geometry":{"type":"Point","coordinates":[-77.04953,35.12685]}},{"properties":{"latitude":34.6751027,"column_5":2,"date":{"end_time":"2010/08/15 00:00:00 -0400","original":"8/14/2010","granularity":"day","time":"2010/08/14 00:00:00 -0400"},"longitude":-76.9704831,"id":"aeltf1y9qykj","location":"3903 Emerald Dr Beach"},"type":"Feature","geometry":{"type":"Point","coordinates":[-76.9704831,34.6751027]}},{"properties":{"latitude":35.00727,"column_5":2,"date":{"end_time":"2010/08/15 00:00:00 -0400","original":"8/14/2010","granularity":"day","time":"2010/08/14 00:00:00 -0400"},"longitude":-77.39015,"id":"aeltf1v4wxyh","location":"Jones"},"type":"Feature","geometry":{"type":"Point","coordinates":[-77.39015,35.00727]}},{"properties":{"latitude":34.9346,"column_5":2,"date":{"end_time":"2010/08/16 00:00:00 -0400","original":"8/15/2010","granularity":"day","time":"2010/08/15 00:00:00 -0400"},"longitude":-78.3898,"id":"aeltf23zl81d","location":"Sampson"},"type":"Feature","geometry":{"type":"Point","coordinates":[-78.3898,34.9346]}},{"properties":{"latitude":38.36072,"column_5":2,"date":{"end_time":"2010/10/17 00:00:00 -0400","original":"10/16/2010","granularity":"day","time":"2010/10/16 00:00:00 -0400"},"longitude":-75.59935,"id":"aeltf230ykn2","location":"Salisbury"},"type":"Feature","geometry":{"type":"Point","coordinates":[-75.59935,38.36072]}},{"properties":{"latitude":35.3714422,"column_5":2,"date":{"end_time":"2010/12/23 00:00:00 -0500","original":"12/22/2010","granularity":"day","time":"2010/12/22 00:00:00 -0500"},"longitude":-80.9744294,"id":"aeltf1rpasns","location":"Cowan's Ford Wildlife Refuge"},"type":"Feature","geometry":{"type":"Point","coordinates":[-80.9744294,35.3714422]}},{"properties":{"latitude":35.3557362,"column_5":2,"date":{"end_time":"2010/12/23 00:00:00 -0500","original":"12/22/2010","granularity":"day","time":"2010/12/22 00:00:00 -0500"},"longitude":-80.9093285,"id":"aeltf23baypc","location":"Latta Plantation Nature Preserve"},"type":"Feature","geometry":{"type":"Point","coordinates":[-80.9093285,35.3557362]}},{"properties":{"latitude":35.28134,"column_5":2,"date":{"end_time":"2010/12/23 00:00:00 -0500","original":"12/22/2010","granularity":"day","time":"2010/12/22 00:00:00 -0500"},"longitude":-81.18548,"id":"aeltf1vl25h8","location":"Gaston"},"type":"Feature","geometry":{"type":"Point","coordinates":[-81.18548,35.28134]}},{"properties":{"latitude":36.11984,"column_5":2,"date":{"end_time":"2010/12/24 00:00:00 -0500","original":"12/23/2010","granularity":"day","time":"2010/12/23 00:00:00 -0500"},"longitude":-80.07366,"id":"aeltf21mi3d4","location":"Kernersville"},"type":"Feature","geometry":{"type":"Point","coordinates":[-80.07366,36.11984]}},{"properties":{"latitude":36.02154,"column_5":2,"date":{"end_time":"2011/01/02 00:00:00 -0500","original":"1/1/2011","granularity":"day","time":"2011/01/01 00:00:00 -0500"},"longitude":-80.38198,"id":"aeltf1ucnh08","location":"Clemmons"},"type":"Feature","geometry":{"type":"Point","coordinates":[-80.38198,36.02154]}},{"properties":{"latitude":35.9896482,"column_5":2,"date":{"end_time":"2011/01/05 00:00:00 -0500","original":"1/4/2011","granularity":"day","time":"2011/01/04 00:00:00 -0500"},"longitude":-80.4895306,"id":"aeltf1sunyln","location":"I-40 Davie County Rest Area"},"type":"Feature","geometry":{"type":"Point","coordinates":[-80.4895306,35.9896482]}},{"properties":{"latitude":35.8111836,"column_5":2,"date":{"end_time":"2011/01/05 00:00:00 -0500","original":"1/4/2011","granularity":"day","time":"2011/01/04 00:00:00 -0500"},"longitude":-80.5604267,"id":"aeltf1yl5d7p","location":"Riverpark at Cooleemee Falls-Davie"},"type":"Feature","geometry":{"type":"Point","coordinates":[-80.5604267,35.8111836]}},{"properties":{"latitude":35.7821707,"column_5":2,"date":{"end_time":"2011/01/05 00:00:00 -0500","original":"1/4/2011","granularity":"day","time":"2011/01/04 00:00:00 -0500"},"longitude":-80.5098724,"id":"aeltf1qusljx","location":"Highway 601 Boat Access"},"type":"Feature","geometry":{"type":"Point","coordinates":[-80.5098724,35.7821707]}},{"properties":{"latitude":39.328617,"column_5":2,"date":{"end_time":"2011/04/02 00:00:00 -0400","original":"4/1/2011","granularity":"day","time":"2011/04/01 00:00:00 -0400"},"longitude":-76.6250414,"id":"aeltf216oofo","location":"Wyman Park"},"type":"Feature","geometry":{"type":"Point","coordinates":[-76.6250414,39.328617]}},{"properties":{"latitude":39.0111144,"column_5":2,"date":{"end_time":"2011/04/10 00:00:00 -0400","original":"4/9/2011","granularity":"day","time":"2011/04/09 00:00:00 -0400"},"longitude":-76.9092107,"id":"aeltf1sebtj8","location":"Greenbelt Metro"},"type":"Feature","geometry":{"type":"Point","coordinates":[-76.9092107,39.0111144]}},{"properties":{"latitude":39.0803767,"column_5":2,"date":{"end_time":"2011/05/06 00:00:00 -0400","original":"5/5/2011","granularity":"day","time":"2011/05/05 00:00:00 -0400"},"longitude":-77.4035096,"id":"aeltf1p4u251","location":"Hughes Hollow - McKee Beshers WMA"},"type":"Feature","geometry":{"type":"Point","coordinates":[-77.4035096,39.0803767]}},{"properties":{"latitude":36.69598,"column_5":2,"date":{"end_time":"2011/05/21 00:00:00 -0400","original":"5/20/2011","granularity":"day","time":"2011/05/20 00:00:00 -0400"},"longitude":-79.9838,"id":"aeltf1sf7xou","location":"Henry"},"type":"Feature","geometry":{"type":"Point","coordinates":[-79.9838,36.69598]}},{"properties":{"latitude":36.3923842,"column_5":2,"date":{"end_time":"2011/06/07 00:00:00 -0400","original":"6/6/2011","granularity":"day","time":"2011/06/06 00:00:00 -0400"},"longitude":-80.2676319,"id":"aeltf21jqa3m","location":"Hanging Rock SP"},"type":"Feature","geometry":{"type":"Point","coordinates":[-80.2676319,36.3923842]}},{"properties":{"latitude":34.7192692,"column_5":2,"date":{"end_time":"2011/06/09 00:00:00 -0400","original":"6/8/2011","granularity":"day","time":"2011/06/08 00:00:00 -0400"},"longitude":-76.7139673,"id":"aeltf1r501qn","location":"Morehead City Waterfront"},"type":"Feature","geometry":{"type":"Point","coordinates":[-76.7139673,34.7192692]}},{"properties":{"latitude":35.90859,"column_5":2,"date":{"end_time":"2011/06/09 00:00:00 -0400","original":"6/8/2011","granularity":"day","time":"2011/06/08 00:00:00 -0400"},"longitude":-77.58595,"id":"aeltf1wcearw","location":"Edgecombe"},"type":"Feature","geometry":{"type":"Point","coordinates":[-77.58595,35.90859]}},{"properties":{"latitude":34.6655377,"column_5":2,"date":{"end_time":"2011/06/10 00:00:00 -0400","original":"6/9/2011","granularity":"day","time":"2011/06/09 00:00:00 -0400"},"longitude":-77.0494473,"id":"aeltf22s671t","location":"Emerald Plantation"},"type":"Feature","geometry":{"type":"Point","coordinates":[-77.0494473,34.6655377]}},{"properties":{"latitude":34.6876602,"column_5":2,"date":{"end_time":"2011/06/10 00:00:00 -0400","original":"6/9/2011","granularity":"day","time":"2011/06/09 00:00:00 -0400"},"longitude":-77.119072,"id":"aeltf1sfymfr","location":"Swansboro"},"type":"Feature","geometry":{"type":"Point","coordinates":[-77.119072,34.6876602]}},{"properties":{"latitude":35.818417,"column_5":2,"date":{"end_time":"2011/08/07 00:00:00 -0400","original":"8/6/2011","granularity":"day","time":"2011/08/06 00:00:00 -0400"},"longitude":-81.185905,"id":"aeltf1wm3qad","location":"Riverbend Park"},"type":"Feature","geometry":{"type":"Point","coordinates":[-81.185905,35.818417]}},{"properties":{"latitude":38.7743187,"column_5":2,"date":{"end_time":"2011/12/05 00:00:00 -0500","original":"12/4/2011","granularity":"day","time":"2011/12/04 00:00:00 -0500"},"longitude":-76.0763626,"id":"aeltf21wdm3h","location":"Easton"},"type":"Feature","geometry":{"type":"Point","coordinates":[-76.0763626,38.7743187]}},{"properties":{"latitude":39.450709,"column_5":2,"date":{"end_time":"2011/12/07 00:00:00 -0500","original":"12/6/2011","granularity":"day","time":"2011/12/06 00:00:00 -0500"},"longitude":-76.5523052,"id":"aeltf209roen","location":"Loch Raven Reservoir--Loch Raven Point"},"type":"Feature","geometry":{"type":"Point","coordinates":[-76.5523052,39.450709]}},{"properties":{"latitude":39.5471399,"column_5":2,"date":{"end_time":"2011/12/07 00:00:00 -0500","original":"12/6/2011","granularity":"day","time":"2011/12/06 00:00:00 -0500"},"longitude":-76.0492516,"id":"aeltf21vytwh","location":"Perryville Community Park"},"type":"Feature","geometry":{"type":"Point","coordinates":[-76.0492516,39.5471399]}},{"properties":{"latitude":39.50951,"column_5":2,"date":{"end_time":"2011/12/13 00:00:00 -0500","original":"12/12/2011","granularity":"day","time":"2011/12/12 00:00:00 -0500"},"longitude":-76.16408,"id":"aeltf21n9ir6","location":"Aberdeen"},"type":"Feature","geometry":{"type":"Point","coordinates":[-76.16408,39.50951]}},{"properties":{"latitude":39.192365,"column_5":2,"date":{"end_time":"2012/05/13 00:00:00 -0400","original":"5/12/2012","granularity":"day","time":"2012/05/12 00:00:00 -0400"},"longitude":-77.295757,"id":"aeltf1w198w0","location":"Black Hill Regional Park"},"type":"Feature","geometry":{"type":"Point","coordinates":[-77.295757,39.192365]}},{"properties":{"latitude":35.2270393,"column_5":2,"date":{"end_time":"2012/05/29 00:00:00 -0400","original":"5/28/2012","granularity":"day","time":"2012/05/28 00:00:00 -0400"},"longitude":-80.8430862,"id":"aeltf1ypoc53","location":"Charlotte"},"type":"Feature","geometry":{"type":"Point","coordinates":[-80.8430862,35.2270393]}},{"properties":{"latitude":40.053908,"column_5":2,"date":{"end_time":"2012/06/14 00:00:00 -0400","original":"6/13/2012","granularity":"day","time":"2012/06/13 00:00:00 -0400"},"longitude":116.6164924,"id":"aeltf1p7rdpy","location":"Beijing Capital International Airport"},"type":"Feature","geometry":{"type":"Point","coordinates":[116.6164924,40.053908]}},{"properties":{"latitude":25.0537961,"column_5":2,"date":{"end_time":"2012/06/15 00:00:00 -0400","original":"6/14/2012","granularity":"day","time":"2012/06/14 00:00:00 -0400"},"longitude":102.6987418,"id":"aeltf1uepd2s","location":"Yunnan University Hotel"},"type":"Feature","geometry":{"type":"Point","coordinates":[102.6987418,25.0537961]}},{"properties":{"latitude":24.9167251,"column_5":2,"date":{"end_time":"2012/06/20 00:00:00 -0400","original":"6/19/2012","granularity":"day","time":"2012/06/19 00:00:00 -0400"},"longitude":102.4943199,"id":"aeltf1owttsw","location":"Anning"},"type":"Feature","geometry":{"type":"Point","coordinates":[102.4943199,24.9167251]}},{"properties":{"latitude":25.0609056,"column_5":2,"date":{"end_time":"2012/06/23 00:00:00 -0400","original":"6/22/2012","granularity":"day","time":"2012/06/22 00:00:00 -0400"},"longitude":102.6939675,"id":"aeltf1xiiu4c","location":"Baini Shan Park"},"type":"Feature","geometry":{"type":"Point","coordinates":[102.6939675,25.0609056]}},{"properties":{"latitude":27.1761915,"column_5":2,"date":{"end_time":"2012/07/08 00:00:00 -0400","original":"7/7/2012","granularity":"day","time":"2012/07/07 00:00:00 -0400"},"longitude":100.088773,"id":"aeltf24tu2ly","location":"Tiger Leaping Gorge"},"type":"Feature","geometry":{"type":"Point","coordinates":[100.088773,27.1761915]}},{"properties":{"latitude":19.1642962,"column_5":2,"date":{"end_time":"2012/07/20 00:00:00 -0400","original":"7/19/2012","granularity":"day","time":"2012/07/19 00:00:00 -0400"},"longitude":98.6909412,"id":"aeltf1pi5ajy","location":"Chiang Mai Mushroom Research Center"},"type":"Feature","geometry":{"type":"Point","coordinates":[98.6909412,19.1642962]}},{"properties":{"latitude":20.046286,"column_5":2,"date":{"end_time":"2012/07/21 00:00:00 -0400","original":"7/20/2012","granularity":"day","time":"2012/07/20 00:00:00 -0400"},"longitude":99.8932927,"id":"aeltf1vaoxg8","location":"Mae Fah Luang University"},"type":"Feature","geometry":{"type":"Point","coordinates":[99.8932927,20.046286]}},{"properties":{"latitude":17.9567938,"column_5":2,"date":{"end_time":"2012/07/31 00:00:00 -0400","original":"7/30/2012","granularity":"day","time":"2012/07/30 00:00:00 -0400"},"longitude":102.6119058,"id":"aeltf1qez1lq","location":"Vientiane"},"type":"Feature","geometry":{"type":"Point","coordinates":[102.6119058,17.9567938]}},{"properties":{"latitude":35.5148322,"column_5":2,"date":{"end_time":"2012/08/17 00:00:00 -0400","original":"8/16/2012","granularity":"day","time":"2012/08/16 00:00:00 -0400"},"longitude":-83.3026743,"id":"aeltf1qtp66z","location":"Great Smoky Mountains NP--Oconoluftee"},"type":"Feature","geometry":{"type":"Point","coordinates":[-83.3026743,35.5148322]}},{"properties":{"latitude":35.5767609,"column_5":2,"date":{"end_time":"2012/08/17 00:00:00 -0400","original":"8/16/2012","granularity":"day","time":"2012/08/16 00:00:00 -0400"},"longitude":-83.3619055,"id":"aeltf1ww94j0","location":"Great Smoky Mountains NP--Swain Co., NC"},"type":"Feature","geometry":{"type":"Point","coordinates":[-83.3619055,35.5767609]}},{"properties":{"latitude":35.32289,"column_5":2,"date":{"end_time":"2012/08/18 00:00:00 -0400","original":"8/17/2012","granularity":"day","time":"2012/08/17 00:00:00 -0400"},"longitude":-83.8074,"id":"aeltf1ti3cq9","location":"Robbinsville"},"type":"Feature","geometry":{"type":"Point","coordinates":[-83.8074,35.32289]}},{"properties":{"latitude":35.15578,"column_5":2,"date":{"end_time":"2012/08/18 00:00:00 -0400","original":"8/17/2012","granularity":"day","time":"2012/08/17 00:00:00 -0400"},"longitude":-83.42279,"id":"aeltf236zudn","location":"Macon"},"type":"Feature","geometry":{"type":"Point","coordinates":[-83.42279,35.15578]}},{"properties":{"latitude":39.3210852,"column_5":2,"date":{"end_time":"2012/08/28 00:00:00 -0400","original":"8/27/2012","granularity":"day","time":"2012/08/27 00:00:00 -0400"},"longitude":-77.733078,"id":"aeltf1y2rck5","location":"Harper's Ferry National Historical Park"},"type":"Feature","geometry":{"type":"Point","coordinates":[-77.733078,39.3210852]}},{"properties":{"latitude":38.7103954,"column_5":2,"date":{"end_time":"2012/09/09 00:00:00 -0400","original":"9/8/2012","granularity":"day","time":"2012/09/08 00:00:00 -0400"},"longitude":-76.5265989,"id":"aeltf1xj7sou","location":"North Beach--Calvert waters"},"type":"Feature","geometry":{"type":"Point","coordinates":[-76.5265989,38.7103954]}},{"properties":{"latitude":38.7154998,"column_5":2,"date":{"end_time":"2012/09/09 00:00:00 -0400","original":"9/8/2012","granularity":"day","time":"2012/09/08 00:00:00 -0400"},"longitude":-76.5255747,"id":"aeltf21el9g4","location":"North Beach--Anne Arundel waters"},"type":"Feature","geometry":{"type":"Point","coordinates":[-76.5255747,38.7154998]}},{"properties":{"latitude":39.2073817,"column_5":2,"date":{"end_time":"2012/09/10 00:00:00 -0400","original":"9/9/2012","granularity":"day","time":"2012/09/09 00:00:00 -0400"},"longitude":-77.0086842,"id":"aeltf1q5tm47","location":"Triadelphia Reservoir (Howard County)"},"type":"Feature","geometry":{"type":"Point","coordinates":[-77.0086842,39.2073817]}},{"properties":{"latitude":39.1981388,"column_5":2,"date":{"end_time":"2012/09/10 00:00:00 -0400","original":"9/9/2012","granularity":"day","time":"2012/09/09 00:00:00 -0400"},"longitude":-77.0156622,"id":"aeltf1y9xquw","location":"Triadelphia Reservoir--Greenbridge Rd."},"type":"Feature","geometry":{"type":"Point","coordinates":[-77.0156622,39.1981388]}},{"properties":{"latitude":38.7198885,"column_5":2,"date":{"end_time":"2012/10/13 00:00:00 -0400","original":"10/12/2012","granularity":"day","time":"2012/10/12 00:00:00 -0400"},"longitude":-76.333276,"id":"aeltf1sp1lzo","location":"Knapps Narrows Marina"},"type":"Feature","geometry":{"type":"Point","coordinates":[-76.333276,38.7198885]}},{"properties":{"latitude":39.772488,"column_5":2,"date":{"end_time":"2012/10/28 00:00:00 -0400","original":"10/27/2012","granularity":"day","time":"2012/10/27 00:00:00 -0400"},"longitude":-76.664619,"id":"aeltf1wapxl0","location":"Shrewsbury Cracker Barrel"},"type":"Feature","geometry":{"type":"Point","coordinates":[-76.664619,39.772488]}},{"properties":{"latitude":39.3822769,"column_5":2,"date":{"end_time":"2012/11/17 00:00:00 -0500","original":"11/16/2012","granularity":"day","time":"2012/11/16 00:00:00 -0500"},"longitude":-76.7243682,"id":"aeltf1r0jrta","location":"Druid Ridge Cemetery"},"type":"Feature","geometry":{"type":"Point","coordinates":[-76.7243682,39.3822769]}},{"properties":{"latitude":38.42995,"column_5":2,"date":{"end_time":"2012/11/22 00:00:00 -0500","original":"11/21/2012","granularity":"day","time":"2012/11/21 00:00:00 -0500"},"longitude":-78.87385,"id":"aeltf24h4rro","location":"Harrisonburg"},"type":"Feature","geometry":{"type":"Point","coordinates":[-78.87385,38.42995]}},{"properties":{"latitude":37.55125,"column_5":2,"date":{"end_time":"2012/11/26 00:00:00 -0500","original":"11/25/2012","granularity":"day","time":"2012/11/25 00:00:00 -0500"},"longitude":-79.79085,"id":"aeltf240bx59","location":"Botetourt"},"type":"Feature","geometry":{"type":"Point","coordinates":[-79.79085,37.55125]}},{"properties":{"latitude":37.81195,"column_5":2,"date":{"end_time":"2012/11/26 00:00:00 -0500","original":"11/25/2012","granularity":"day","time":"2012/11/25 00:00:00 -0500"},"longitude":-79.4124,"id":"aeltf1rq3ymo","location":"Rockbridge"},"type":"Feature","geometry":{"type":"Point","coordinates":[-79.4124,37.81195]}},{"properties":{"latitude":39.3243254,"column_5":2,"date":{"end_time":"2012/12/20 00:00:00 -0500","original":"12/19/2012","granularity":"day","time":"2012/12/19 00:00:00 -0500"},"longitude":-76.6479206,"id":"aeltf1tk92au","location":"Druid Hill Park--Maryland Zoo"},"type":"Feature","geometry":{"type":"Point","coordinates":[-76.6479206,39.3243254]}},{"properties":{"latitude":37.38917,"column_5":2,"date":{"end_time":"2012/12/23 00:00:00 -0500","original":"12/22/2012","granularity":"day","time":"2012/12/22 00:00:00 -0500"},"longitude":-77.56253,"id":"aeltf1q341bb","location":"Chesterfield"},"type":"Feature","geometry":{"type":"Point","coordinates":[-77.56253,37.38917]}},{"properties":{"latitude":37.26588,"column_5":2,"date":{"end_time":"2012/12/23 00:00:00 -0500","original":"12/22/2012","granularity":"day","time":"2012/12/22 00:00:00 -0500"},"longitude":-77.4086,"id":"aeltf1xpol34","location":"Colonial Heights"},"type":"Feature","geometry":{"type":"Point","coordinates":[-77.4086,37.26588]}},{"properties":{"latitude":37.20513,"column_5":2,"date":{"end_time":"2012/12/23 00:00:00 -0500","original":"12/22/2012","granularity":"day","time":"2012/12/22 00:00:00 -0500"},"longitude":-77.39772,"id":"aeltf21h0vip","location":"Petersburg"},"type":"Feature","geometry":{"type":"Point","coordinates":[-77.39772,37.20513]}},{"properties":{"latitude":37.53076,"column_5":2,"date":{"end_time":"2012/12/23 00:00:00 -0500","original":"12/22/2012","granularity":"day","time":"2012/12/22 00:00:00 -0500"},"longitude":-77.30247,"id":"aeltf1wft9t0","location":"Henrico"},"type":"Feature","geometry":{"type":"Point","coordinates":[-77.30247,37.53076]}},{"properties":{"latitude":37.52294,"column_5":2,"date":{"end_time":"2012/12/23 00:00:00 -0500","original":"12/22/2012","granularity":"day","time":"2012/12/22 00:00:00 -0500"},"longitude":-77.49392,"id":"aeltf22osy6d","location":"Richmond City"},"type":"Feature","geometry":{"type":"Point","coordinates":[-77.49392,37.52294]}},{"properties":{"latitude":37.77566,"column_5":2,"date":{"end_time":"2012/12/23 00:00:00 -0500","original":"12/22/2012","granularity":"day","time":"2012/12/22 00:00:00 -0500"},"longitude":-77.46294,"id":"aeltf1u2il4s","location":"Hanover"},"type":"Feature","geometry":{"type":"Point","coordinates":[-77.46294,37.77566]}},{"properties":{"latitude":39.3989738,"column_5":2,"date":{"end_time":"2013/02/20 00:00:00 -0500","original":"2/19/2013","granularity":"day","time":"2013/02/19 00:00:00 -0500"},"longitude":-76.7751324,"id":"aeltf1t94887","location":"McDonogh School"},"type":"Feature","geometry":{"type":"Point","coordinates":[-76.7751324,39.3989738]}},{"properties":{"latitude":39.6563445,"column_5":2,"date":{"end_time":"2013/02/21 00:00:00 -0500","original":"2/20/2013","granularity":"day","time":"2013/02/20 00:00:00 -0500"},"longitude":-76.5118521,"id":"aeltf1pp07kx","location":"Newark Farms"},"type":"Feature","geometry":{"type":"Point","coordinates":[-76.5118521,39.6563445]}},{"properties":{"latitude":39.589,"column_5":2,"date":{"end_time":"2013/02/21 00:00:00 -0500","original":"2/20/2013","granularity":"day","time":"2013/02/20 00:00:00 -0500"},"longitude":-76.66329,"id":"aeltf1uzt41g","location":"Hereford"},"type":"Feature","geometry":{"type":"Point","coordinates":[-76.66329,39.589]}},{"properties":{"latitude":39.384588,"column_5":2,"date":{"end_time":"2013/02/23 00:00:00 -0500","original":"2/22/2013","granularity":"day","time":"2013/02/22 00:00:00 -0500"},"longitude":-76.733538,"id":"aeltf1wrset2","location":"Pikesville - 39.3848x-76.7343"},"type":"Feature","geometry":{"type":"Point","coordinates":[-76.733538,39.384588]}},{"properties":{"latitude":39.203489,"column_5":2,"date":{"end_time":"2013/03/03 00:00:00 -0500","original":"3/2/2013","granularity":"day","time":"2013/03/02 00:00:00 -0500"},"longitude":-76.63627,"id":"aeltf1v1af66","location":"39.2035x-76.6363"},"type":"Feature","geometry":{"type":"Point","coordinates":[-76.63627,39.203489]}},{"properties":{"latitude":39.384604,"column_5":2,"date":{"end_time":"2013/03/19 00:00:00 -0400","original":"3/18/2013","granularity":"day","time":"2013/03/18 00:00:00 -0400"},"longitude":-76.581137,"id":"aeltf1wsjy7f","location":"Loch Raven IHOP"},"type":"Feature","geometry":{"type":"Point","coordinates":[-76.581137,39.384604]}},{"properties":{"latitude":35.594239,"column_5":2,"date":{"end_time":"2013/03/23 00:00:00 -0400","original":"3/22/2013","granularity":"day","time":"2013/03/22 00:00:00 -0400"},"longitude":-80.858544,"id":"aeltf216bacf","location":"Mooresville"},"type":"Feature","geometry":{"type":"Point","coordinates":[-80.858544,35.594239]}},{"properties":{"latitude":35.2248328,"column_5":2,"date":{"end_time":"2013/03/23 00:00:00 -0400","original":"3/22/2013","granularity":"day","time":"2013/03/22 00:00:00 -0400"},"longitude":-80.955795,"id":"aeltf2503gz3","location":"Charlotte/Douglas International Airport--Overlook Park"},"type":"Feature","geometry":{"type":"Point","coordinates":[-80.955795,35.2248328]}},{"properties":{"latitude":38.003665,"column_5":2,"date":{"end_time":"2013/04/14 00:00:00 -0400","original":"4/13/2013","granularity":"day","time":"2013/04/13 00:00:00 -0400"},"longitude":-76.046378,"id":"aeltf1zzl78x","location":"Martin NWR"},"type":"Feature","geometry":{"type":"Point","coordinates":[-76.046378,38.003665]}},{"properties":{"latitude":38.0485698,"column_5":2,"date":{"end_time":"2013/04/14 00:00:00 -0400","original":"4/13/2013","granularity":"day","time":"2013/04/13 00:00:00 -0400"},"longitude":-76.3231802,"id":"aeltf21v30de","location":"Point Lookout State Park"},"type":"Feature","geometry":{"type":"Point","coordinates":[-76.3231802,38.0485698]}},{"properties":{"latitude":38.0156401,"column_5":2,"date":{"end_time":"2013/04/14 00:00:00 -0400","original":"4/13/2013","granularity":"day","time":"2013/04/13 00:00:00 -0400"},"longitude":-76.1407471,"id":"aeltf1v462a5","location":"Point Lookout - Smith Island boat (Somerset Co.)"},"type":"Feature","geometry":{"type":"Point","coordinates":[-76.1407471,38.0156401]}},{"properties":{"latitude":38.0275405,"column_5":2,"date":{"end_time":"2013/04/14 00:00:00 -0400","original":"4/13/2013","granularity":"day","time":"2013/04/13 00:00:00 -0400"},"longitude":-76.2602234,"id":"aeltf1ssjajh","location":"Point Lookout - Smith Island boat (St. Mary's Co.)"},"type":"Feature","geometry":{"type":"Point","coordinates":[-76.2602234,38.0275405]}},{"properties":{"latitude":33.44039,"column_5":2,"date":{"end_time":"2013/05/26 00:00:00 -0400","original":"5/25/2013","granularity":"day","time":"2013/05/25 00:00:00 -0400"},"longitude":-80.79395,"id":"aeltf1snphcw","location":"Orangeburg"},"type":"Feature","geometry":{"type":"Point","coordinates":[-80.79395,33.44039]}},{"properties":{"latitude":32.79038,"column_5":2,"date":{"end_time":"2013/05/26 00:00:00 -0400","original":"5/25/2013","granularity":"day","time":"2013/05/25 00:00:00 -0400"},"longitude":-81.12408,"id":"aeltf1s61o35","location":"Hampton"},"type":"Feature","geometry":{"type":"Point","coordinates":[-81.12408,32.79038]}},{"properties":{"latitude":33.6714,"column_5":2,"date":{"end_time":"2013/05/26 00:00:00 -0400","original":"5/25/2013","granularity":"day","time":"2013/05/25 00:00:00 -0400"},"longitude":-80.77354,"id":"aeltf1u5tr0t","location":"Calhoun"},"type":"Feature","geometry":{"type":"Point","coordinates":[-80.77354,33.6714]}},{"properties":{"latitude":32.84053,"column_5":2,"date":{"end_time":"2013/05/26 00:00:00 -0400","original":"5/25/2013","granularity":"day","time":"2013/05/25 00:00:00 -0400"},"longitude":-80.72698,"id":"aeltf1tl54bo","location":"Colleton"},"type":"Feature","geometry":{"type":"Point","coordinates":[-80.72698,32.84053]}},{"properties":{"latitude":33.99839,"column_5":2,"date":{"end_time":"2013/05/26 00:00:00 -0400","original":"5/25/2013","granularity":"day","time":"2013/05/25 00:00:00 -0400"},"longitude":-80.96693,"id":"aeltf1upnv6g","location":"Richland"},"type":"Feature","geometry":{"type":"Point","coordinates":[-80.96693,33.99839]}},{"properties":{"latitude":32.387893,"column_5":2,"date":{"end_time":"2013/05/26 00:00:00 -0400","original":"5/25/2013","granularity":"day","time":"2013/05/25 00:00:00 -0400"},"longitude":-80.688219,"id":"aeltf1wzt8h6","location":"Laurel Hill Apartments"},"type":"Feature","geometry":{"type":"Point","coordinates":[-80.688219,32.387893]}},{"properties":{"latitude":34.37033,"column_5":2,"date":{"end_time":"2013/05/26 00:00:00 -0400","original":"5/25/2013","granularity":"day","time":"2013/05/25 00:00:00 -0400"},"longitude":-81.09478,"id":"aeltf1z207se","location":"Fairfield"},"type":"Feature","geometry":{"type":"Point","coordinates":[-81.09478,34.37033]}},{"properties":{"latitude":36.1007121,"column_5":1,"date":{"end_time":"2004/07/17 00:00:00 -0400","original":"7/16/2004","granularity":"day","time":"2004/07/16 00:00:00 -0400"},"longitude":-79.9423599,"id":"aeltf22e3sis","location":"Piedmont Triad International Airport"},"type":"Feature","geometry":{"type":"Point","coordinates":[-79.9423599,36.1007121]}},{"properties":{"latitude":36.1079328,"column_5":1,"date":{"end_time":"2004/07/18 00:00:00 -0400","original":"7/17/2004","granularity":"day","time":"2004/07/17 00:00:00 -0400"},"longitude":-80.40326,"id":"aeltf22fwh02","location":"Shiloh Lutheran Church"},"type":"Feature","geometry":{"type":"Point","coordinates":[-80.40326,36.1079328]}},{"properties":{"latitude":42.0237775,"column_5":1,"date":{"end_time":"2004/08/02 00:00:00 -0400","original":"8/1/2004","granularity":"day","time":"2004/08/01 00:00:00 -0400"},"longitude":-93.6461949,"id":"aeltf1yxnctb","location":"Iowa State University"},"type":"Feature","geometry":{"type":"Point","coordinates":[-93.6461949,42.0237775]}},{"properties":{"latitude":39.1142006,"column_5":1,"date":{"end_time":"2004/08/06 00:00:00 -0400","original":"8/5/2004","granularity":"day","time":"2004/08/05 00:00:00 -0400"},"longitude":-94.6274338,"id":"aeltf1oyzq0o","location":"Kansas City"},"type":"Feature","geometry":{"type":"Point","coordinates":[-94.6274338,39.1142006]}},{"properties":{"latitude":38.6259678,"column_5":1,"date":{"end_time":"2004/08/07 00:00:00 -0400","original":"8/6/2004","granularity":"day","time":"2004/08/06 00:00:00 -0400"},"longitude":-90.1853703,"id":"aeltf20u8r56","location":"Gateway Arch"},"type":"Feature","geometry":{"type":"Point","coordinates":[-90.1853703,38.6259678]}},{"properties":{"latitude":36.40056,"column_5":1,"date":{"end_time":"2004/08/10 00:00:00 -0400","original":"8/9/2004","granularity":"day","time":"2004/08/09 00:00:00 -0400"},"longitude":-93.7415314,"id":"aeltf24y7ska","location":"Eureka Springs"},"type":"Feature","geometry":{"type":"Point","coordinates":[-93.7415314,36.40056]}},{"properties":{"latitude":36.5365364,"column_5":1,"date":{"end_time":"2004/08/11 00:00:00 -0400","original":"8/10/2004","granularity":"day","time":"2004/08/10 00:00:00 -0400"},"longitude":-93.2751274,"id":"aeltf24eijwu","location":"Big Cedar Lodge"},"type":"Feature","geometry":{"type":"Point","coordinates":[-93.2751274,36.5365364]}},{"properties":{"latitude":35.70074,"column_5":1,"date":{"end_time":"2005/06/13 00:00:00 -0400","original":"6/12/2005","granularity":"day","time":"2005/06/12 00:00:00 -0400"},"longitude":-80.8881,"id":"aeltf1pod1jz","location":"Troutman"},"type":"Feature","geometry":{"type":"Point","coordinates":[-80.8881,35.70074]}},{"properties":{"latitude":33.7833333,"column_5":1,"date":{"end_time":"2005/07/19 00:00:00 -0400","original":"7/18/2005","granularity":"day","time":"2005/07/18 00:00:00 -0400"},"longitude":-80.7833333,"id":"aeltf1tbfjdf","location":"Congaree NP (Congaree Swamp)"},"type":"Feature","geometry":{"type":"Point","coordinates":[-80.7833333,33.7833333]}},{"properties":{"latitude":33.02,"column_5":1,"date":{"end_time":"2005/07/20 00:00:00 -0400","original":"7/19/2005","granularity":"day","time":"2005/07/19 00:00:00 -0400"},"longitude":-79.563,"id":"aeltf244myxu","location":"Cape Romain NWR"},"type":"Feature","geometry":{"type":"Point","coordinates":[-79.563,33.02]}},{"properties":{"latitude":33.218,"column_5":1,"date":{"end_time":"2005/07/20 00:00:00 -0400","original":"7/19/2005","granularity":"day","time":"2005/07/19 00:00:00 -0400"},"longitude":-80.347,"id":"aeltf1roru79","location":"Francis Beidler Forest Audubon Center &amp; Sanctuary"},"type":"Feature","geometry":{"type":"Point","coordinates":[-80.347,33.218]}},{"properties":{"latitude":32.77658,"column_5":1,"date":{"end_time":"2005/07/20 00:00:00 -0400","original":"7/19/2005","granularity":"day","time":"2005/07/19 00:00:00 -0400"},"longitude":-79.93091,"id":"aeltf1pjd89x","location":"Charleston"},"type":"Feature","geometry":{"type":"Point","coordinates":[-79.93091,32.77658]}},{"properties":{"latitude":32.8746855,"column_5":1,"date":{"end_time":"2005/07/21 00:00:00 -0400","original":"7/20/2005","granularity":"day","time":"2005/07/20 00:00:00 -0400"},"longitude":-80.0863409,"id":"aeltf1xs75z2","location":"Magnolia Gardens"},"type":"Feature","geometry":{"type":"Point","coordinates":[-80.0863409,32.8746855]}},{"properties":{"latitude":36.08463,"column_5":1,"date":{"end_time":"2005/08/23 00:00:00 -0400","original":"8/22/2005","granularity":"day","time":"2005/08/22 00:00:00 -0400"},"longitude":-80.3526735,"id":"aeltf1shnk4x","location":"Calvary Baptist Church"},"type":"Feature","geometry":{"type":"Point","coordinates":[-80.3526735,36.08463]}},{"properties":{"latitude":32.7521994,"column_5":1,"date":{"end_time":"2005/11/20 00:00:00 -0500","original":"11/19/2005","granularity":"day","time":"2005/11/19 00:00:00 -0500"},"longitude":-79.8748112,"id":"aeltf1pkvbb5","location":"Fort Sumter"},"type":"Feature","geometry":{"type":"Point","coordinates":[-79.8748112,32.7521994]}},{"properties":{"latitude":36.16323,"column_5":1,"date":{"end_time":"2005/12/29 00:00:00 -0500","original":"12/28/2005","granularity":"day","time":"2005/12/28 00:00:00 -0500"},"longitude":-81.87154,"id":"aeltf1rteoin","location":"Banner Elk"},"type":"Feature","geometry":{"type":"Point","coordinates":[-81.87154,36.16323]}},{"properties":{"latitude":36.40404,"column_5":1,"date":{"end_time":"2006/04/24 00:00:00 -0400","original":"4/23/2006","granularity":"day","time":"2006/04/23 00:00:00 -0400"},"longitude":-79.33614,"id":"aeltf1qqkow4","location":"Yanceyville"},"type":"Feature","geometry":{"type":"Point","coordinates":[-79.33614,36.40404]}},{"properties":{"latitude":35.5855026,"column_5":1,"date":{"end_time":"2006/05/07 00:00:00 -0400","original":"5/6/2006","granularity":"day","time":"2006/05/06 00:00:00 -0400"},"longitude":-81.6489315,"id":"aeltf25aabxw","location":"South Mountains SP"},"type":"Feature","geometry":{"type":"Point","coordinates":[-81.6489315,35.5855026]}},{"properties":{"latitude":35.4919138,"column_5":1,"date":{"end_time":"2006/06/15 00:00:00 -0400","original":"6/14/2006","granularity":"day","time":"2006/06/14 00:00:00 -0400"},"longitude":-80.9221172,"id":"aeltf1qrf8k0","location":"Bird Island"},"type":"Feature","geometry":{"type":"Point","coordinates":[-80.9221172,35.4919138]}},{"properties":{"latitude":35.4321765,"column_5":1,"date":{"end_time":"2006/06/17 00:00:00 -0400","original":"6/16/2006","granularity":"day","time":"2006/06/16 00:00:00 -0400"},"longitude":-82.2495747,"id":"aeltf1r8os8j","location":"Chimney Rock SP"},"type":"Feature","geometry":{"type":"Point","coordinates":[-82.2495747,35.4321765]}},{"properties":{"latitude":36.0862513,"column_5":1,"date":{"end_time":"2006/06/28 00:00:00 -0400","original":"6/27/2006","granularity":"day","time":"2006/06/27 00:00:00 -0400"},"longitude":-80.2836013,"id":"aeltf1sdesdu","location":"Miller Park"},"type":"Feature","geometry":{"type":"Point","coordinates":[-80.2836013,36.0862513]}},{"properties":{"latitude":36.1401881,"column_5":1,"date":{"end_time":"2006/07/03 00:00:00 -0400","original":"7/2/2006","granularity":"day","time":"2006/07/02 00:00:00 -0400"},"longitude":-80.3882933,"id":"aeltf1rwyqyd","location":"Vienna Elementary School"},"type":"Feature","geometry":{"type":"Point","coordinates":[-80.3882933,36.1401881]}},{"properties":{"latitude":35.88088,"column_5":1,"date":{"end_time":"2006/07/29 00:00:00 -0400","original":"7/28/2006","granularity":"day","time":"2006/07/28 00:00:00 -0400"},"longitude":-84.50853,"id":"aeltf1ww13i9","location":"Kingston"},"type":"Feature","geometry":{"type":"Point","coordinates":[-84.50853,35.88088]}},{"properties":{"latitude":36.01539,"column_5":1,"date":{"end_time":"2006/07/29 00:00:00 -0400","original":"7/28/2006","granularity":"day","time":"2006/07/28 00:00:00 -0400"},"longitude":-83.41489,"id":"aeltf20bii8m","location":"Dandridge"},"type":"Feature","geometry":{"type":"Point","coordinates":[-83.41489,36.01539]}},{"properties":{"latitude":34.77979,"column_5":1,"date":{"end_time":"2006/07/30 00:00:00 -0400","original":"7/29/2006","granularity":"day","time":"2006/07/29 00:00:00 -0400"},"longitude":-92.12875,"id":"aeltf1ycw3ng","location":"Galloway"},"type":"Feature","geometry":{"type":"Point","coordinates":[-92.12875,34.77979]}},{"properties":{"latitude":35.38898,"column_5":1,"date":{"end_time":"2006/07/30 00:00:00 -0400","original":"7/29/2006","granularity":"day","time":"2006/07/29 00:00:00 -0400"},"longitude":-94.4297111,"id":"aeltf1uwil5h","location":"Fort Smith NHS"},"type":"Feature","geometry":{"type":"Point","coordinates":[-94.4297111,35.38898]}},{"properties":{"latitude":34.91289,"column_5":1,"date":{"end_time":"2006/07/30 00:00:00 -0400","original":"7/29/2006","granularity":"day","time":"2006/07/29 00:00:00 -0400"},"longitude":-91.11012,"id":"aeltf1zt0cvu","location":"Wheatley"},"type":"Feature","geometry":{"type":"Point","coordinates":[-91.11012,34.91289]}},{"properties":{"latitude":34.88789,"column_5":1,"date":{"end_time":"2006/07/30 00:00:00 -0400","original":"7/29/2006","granularity":"day","time":"2006/07/29 00:00:00 -0400"},"longitude":-91.19452,"id":"aeltf225l2ug","location":"Brinkley"},"type":"Feature","geometry":{"type":"Point","coordinates":[-91.19452,34.88789]}},{"properties":{"latitude":35.41195,"column_5":1,"date":{"end_time":"2006/07/30 00:00:00 -0400","original":"7/29/2006","granularity":"day","time":"2006/07/29 00:00:00 -0400"},"longitude":-99.40427,"id":"aeltf1si03io","location":"Elk City"},"type":"Feature","geometry":{"type":"Point","coordinates":[-99.40427,35.41195]}},{"properties":{"latitude":35.4387506,"column_5":1,"date":{"end_time":"2006/07/30 00:00:00 -0400","original":"7/29/2006","granularity":"day","time":"2006/07/29 00:00:00 -0400"},"longitude":-95.7890628,"id":"aeltf1uq4ckp","location":"McIntosh County I-40 Rest Stop"},"type":"Feature","geometry":{"type":"Point","coordinates":[-95.7890628,35.4387506]}},{"properties":{"latitude":35.42119,"column_5":1,"date":{"end_time":"2006/07/30 00:00:00 -0400","original":"7/29/2006","granularity":"day","time":"2006/07/29 00:00:00 -0400"},"longitude":-94.51462,"id":"aeltf2071i9c","location":"Roland"},"type":"Feature","geometry":{"type":"Point","coordinates":[-94.51462,35.42119]}},{"properties":{"latitude":35.43729,"column_5":1,"date":{"end_time":"2006/07/30 00:00:00 -0400","original":"7/29/2006","granularity":"day","time":"2006/07/29 00:00:00 -0400"},"longitude":-93.67299,"id":"aeltf1u18yyv","location":"Coal Hill"},"type":"Feature","geometry":{"type":"Point","coordinates":[-93.67299,35.43729]}},{"properties":{"latitude":35.51565,"column_5":1,"date":{"end_time":"2006/07/30 00:00:00 -0400","original":"7/29/2006","granularity":"day","time":"2006/07/29 00:00:00 -0400"},"longitude":-98.96726,"id":"aeltf22v6nto","location":"Clinton"},"type":"Feature","geometry":{"type":"Point","coordinates":[-98.96726,35.51565]}},{"properties":{"latitude":35.4734314,"column_5":1,"date":{"end_time":"2006/07/30 00:00:00 -0400","original":"7/29/2006","granularity":"day","time":"2006/07/29 00:00:00 -0400"},"longitude":-97.5165661,"id":"aeltf1ykbi4j","location":"Oklahoma City National Memorial"},"type":"Feature","geometry":{"type":"Point","coordinates":[-97.5165661,35.4734314]}},{"properties":{"latitude":35.4701,"column_5":1,"date":{"end_time":"2006/07/30 00:00:00 -0400","original":"7/29/2006","granularity":"day","time":"2006/07/29 00:00:00 -0400"},"longitude":-95.52306,"id":"aeltf1qbygte","location":"Checotah"},"type":"Feature","geometry":{"type":"Point","coordinates":[-95.52306,35.4701]}},{"properties":{"latitude":35.1963193,"column_5":1,"date":{"end_time":"2006/07/30 00:00:00 -0400","original":"7/29/2006","granularity":"day","time":"2006/07/29 00:00:00 -0400"},"longitude":-100.8038091,"id":"aeltf20ce4kb","location":"Gray County Safety Rest Area"},"type":"Feature","geometry":{"type":"Point","coordinates":[-100.8038091,35.1963193]}},{"properties":{"latitude":35.60115,"column_5":1,"date":{"end_time":"2006/07/30 00:00:00 -0400","original":"7/29/2006","granularity":"day","time":"2006/07/29 00:00:00 -0400"},"longitude":-98.11863,"id":"aeltf1vpd1j4","location":"Calumet"},"type":"Feature","geometry":{"type":"Point","coordinates":[-98.11863,35.60115]}},{"properties":{"latitude":35.22195,"column_5":1,"date":{"end_time":"2006/07/31 00:00:00 -0400","original":"7/30/2006","granularity":"day","time":"2006/07/30 00:00:00 -0400"},"longitude":-101.83146,"id":"aeltf1u5nb20","location":"Amarillo"},"type":"Feature","geometry":{"type":"Point","coordinates":[-101.83146,35.22195]}},{"properties":{"latitude":35.10756,"column_5":1,"date":{"end_time":"2006/07/31 00:00:00 -0400","original":"7/30/2006","granularity":"day","time":"2006/07/30 00:00:00 -0400"},"longitude":-103.32851,"id":"aeltf1y05f16","location":"San Jon"},"type":"Feature","geometry":{"type":"Point","coordinates":[-103.32851,35.10756]}},{"properties":{"latitude":34.65636,"column_5":1,"date":{"end_time":"2006/07/31 00:00:00 -0400","original":"7/30/2006","granularity":"day","time":"2006/07/30 00:00:00 -0400"},"longitude":-105.87025,"id":"aeltf1w9zv9p","location":"Torrance"},"type":"Feature","geometry":{"type":"Point","coordinates":[-105.87025,34.65636]}},{"properties":{"latitude":35.17176,"column_5":1,"date":{"end_time":"2006/07/31 00:00:00 -0400","original":"7/30/2006","granularity":"day","time":"2006/07/30 00:00:00 -0400"},"longitude":-103.72452,"id":"aeltf1yyr8qq","location":"Tucumcari"},"type":"Feature","geometry":{"type":"Point","coordinates":[-103.72452,35.17176]}},{"properties":{"latitude":35.0844498,"column_5":1,"date":{"end_time":"2006/07/31 00:00:00 -0400","original":"7/30/2006","granularity":"day","time":"2006/07/30 00:00:00 -0400"},"longitude":-106.6515808,"id":"aeltf20g67be","location":"Albuquerque"},"type":"Feature","geometry":{"type":"Point","coordinates":[-106.6515808,35.0844498]}},{"properties":{"latitude":35.52812,"column_5":1,"date":{"end_time":"2006/07/31 00:00:00 -0400","original":"7/30/2006","granularity":"day","time":"2006/07/30 00:00:00 -0400"},"longitude":-108.74264,"id":"aeltf21nskk0","location":"Gallup"},"type":"Feature","geometry":{"type":"Point","coordinates":[-108.74264,35.52812]}},{"properties":{"latitude":35.23862,"column_5":1,"date":{"end_time":"2006/07/31 00:00:00 -0400","original":"7/30/2006","granularity":"day","time":"2006/07/30 00:00:00 -0400"},"longitude":-109.52186,"id":"aeltf2398uuo","location":"Apache"},"type":"Feature","geometry":{"type":"Point","coordinates":[-109.52186,35.23862]}},{"properties":{"latitude":36.0612422,"column_5":1,"date":{"end_time":"2006/08/01 00:00:00 -0400","original":"7/31/2006","granularity":"day","time":"2006/07/31 00:00:00 -0400"},"longitude":-112.1084833,"id":"aeltf22wyb9k","location":"Grand Canyon NP--Mather Point"},"type":"Feature","geometry":{"type":"Point","coordinates":[-112.1084833,36.0612422]}},{"properties":{"latitude":35.1981087,"column_5":1,"date":{"end_time":"2006/08/01 00:00:00 -0400","original":"7/31/2006","granularity":"day","time":"2006/07/31 00:00:00 -0400"},"longitude":-111.6517181,"id":"aeltf1r85d9p","location":"Flagstaff"},"type":"Feature","geometry":{"type":"Point","coordinates":[-111.6517181,35.1981087]}},{"properties":{"latitude":37.34889,"column_5":1,"date":{"end_time":"2006/08/02 00:00:00 -0400","original":"8/1/2006","granularity":"day","time":"2006/08/01 00:00:00 -0400"},"longitude":-108.58565,"id":"aeltf222ceuk","location":"Cortez"},"type":"Feature","geometry":{"type":"Point","coordinates":[-108.58565,37.34889]}},{"properties":{"latitude":35.28901,"column_5":1,"date":{"end_time":"2006/08/02 00:00:00 -0400","original":"8/1/2006","granularity":"day","time":"2006/08/01 00:00:00 -0400"},"longitude":-110.2836,"id":"aeltf1ozwg9d","location":"Navajo"},"type":"Feature","geometry":{"type":"Point","coordinates":[-110.2836,35.28901]}},{"properties":{"latitude":36.6795845,"column_5":1,"date":{"end_time":"2006/08/03 00:00:00 -0400","original":"8/2/2006","granularity":"day","time":"2006/08/02 00:00:00 -0400"},"longitude":-106.6866989,"id":"aeltf1t03q58","location":"Heron Lake SP"},"type":"Feature","geometry":{"type":"Point","coordinates":[-106.6866989,36.6795845]}},{"properties":{"latitude":37.1847222,"column_5":1,"date":{"end_time":"2006/08/03 00:00:00 -0400","original":"8/2/2006","granularity":"day","time":"2006/08/02 00:00:00 -0400"},"longitude":-108.4877778,"id":"aeltf1qsc4kt","location":"Mesa Verde NP"},"type":"Feature","geometry":{"type":"Point","coordinates":[-108.4877778,37.1847222]}},{"properties":{"latitude":37.31499,"column_5":1,"date":{"end_time":"2006/08/03 00:00:00 -0400","original":"8/2/2006","granularity":"day","time":"2006/08/02 00:00:00 -0400"},"longitude":-107.92247,"id":"aeltf21h9o55","location":"La Plata"},"type":"Feature","geometry":{"type":"Point","coordinates":[-107.92247,37.31499]}},{"properties":{"latitude":36.40723,"column_5":1,"date":{"end_time":"2006/08/04 00:00:00 -0400","original":"8/3/2006","granularity":"day","time":"2006/08/03 00:00:00 -0400"},"longitude":-105.57357,"id":"aeltf22c1ts1","location":"Taos"},"type":"Feature","geometry":{"type":"Point","coordinates":[-105.57357,36.40723]}},{"properties":{"latitude":36.72921,"column_5":1,"date":{"end_time":"2006/08/04 00:00:00 -0400","original":"8/3/2006","granularity":"day","time":"2006/08/03 00:00:00 -0400"},"longitude":-106.56959,"id":"aeltf23o26x7","location":"Los Ojos"},"type":"Feature","geometry":{"type":"Point","coordinates":[-106.56959,36.72921]}},{"properties":{"latitude":36.7142356,"column_5":1,"date":{"end_time":"2006/08/04 00:00:00 -0400","original":"8/3/2006","granularity":"day","time":"2006/08/03 00:00:00 -0400"},"longitude":-106.2350922,"id":"aeltf23rier6","location":"Carson NF"},"type":"Feature","geometry":{"type":"Point","coordinates":[-106.2350922,36.7142356]}},{"properties":{"latitude":36.5321227,"column_5":1,"date":{"end_time":"2006/08/05 00:00:00 -0400","original":"8/4/2006","granularity":"day","time":"2006/08/04 00:00:00 -0400"},"longitude":-105.1654243,"id":"aeltf1zc5d60","location":"Cimarron Canyon State Park"},"type":"Feature","geometry":{"type":"Point","coordinates":[-105.1654243,36.5321227]}},{"properties":{"latitude":33.4467359,"column_5":1,"date":{"end_time":"2006/08/17 00:00:00 -0400","original":"8/16/2006","granularity":"day","time":"2006/08/16 00:00:00 -0400"},"longitude":-104.4049001,"id":"aeltf245fg6a","location":"Bitter Lake NWR"},"type":"Feature","geometry":{"type":"Point","coordinates":[-104.4049001,33.4467359]}},{"properties":{"latitude":33.3943,"column_5":1,"date":{"end_time":"2006/08/17 00:00:00 -0400","original":"8/16/2006","granularity":"day","time":"2006/08/16 00:00:00 -0400"},"longitude":-104.52252,"id":"aeltf20zcpz6","location":"Roswell"},"type":"Feature","geometry":{"type":"Point","coordinates":[-104.52252,33.3943]}},{"properties":{"latitude":31.9973202,"column_5":1,"date":{"end_time":"2006/08/18 00:00:00 -0400","original":"8/17/2006","granularity":"day","time":"2006/08/17 00:00:00 -0400"},"longitude":-102.0784073,"id":"aeltf215h2qk","location":"Midland"},"type":"Feature","geometry":{"type":"Point","coordinates":[-102.0784073,31.9973202]}},{"properties":{"latitude":32.1769218,"column_5":1,"date":{"end_time":"2006/08/18 00:00:00 -0400","original":"8/17/2006","granularity":"day","time":"2006/08/17 00:00:00 -0400"},"longitude":-104.4373627,"id":"aeltf1xrjo88","location":"Carlsbad Caverns NP -- Cavern Entrance"},"type":"Feature","geometry":{"type":"Point","coordinates":[-104.4373627,32.1769218]}},{"properties":{"latitude":32.7557364,"column_5":1,"date":{"end_time":"2006/08/19 00:00:00 -0400","original":"8/18/2006","granularity":"day","time":"2006/08/18 00:00:00 -0400"},"longitude":-97.0705605,"id":"aeltf1w1rtfz","location":"Six Flags Over Texas"},"type":"Feature","geometry":{"type":"Point","coordinates":[-97.0705605,32.7557364]}},{"properties":{"latitude":35.1461779,"column_5":1,"date":{"end_time":"2006/08/20 00:00:00 -0400","original":"8/19/2006","granularity":"day","time":"2006/08/19 00:00:00 -0400"},"longitude":-90.0586349,"id":"aeltf20zerwc","location":"Mud Island River Park"},"type":"Feature","geometry":{"type":"Point","coordinates":[-90.0586349,35.1461779]}},{"properties":{"latitude":32.78343,"column_5":1,"date":{"end_time":"2006/08/20 00:00:00 -0400","original":"8/19/2006","granularity":"day","time":"2006/08/19 00:00:00 -0400"},"longitude":-96.80028,"id":"aeltf23uysv5","location":"Dallas"},"type":"Feature","geometry":{"type":"Point","coordinates":[-96.80028,32.78343]}},{"properties":{"latitude":33.9487101,"column_5":1,"date":{"end_time":"2006/09/03 00:00:00 -0400","original":"9/2/2006","granularity":"day","time":"2006/09/02 00:00:00 -0400"},"longitude":-83.3744732,"id":"aeltf1rrvigg","location":"University of Georgia"},"type":"Feature","geometry":{"type":"Point","coordinates":[-83.3744732,33.9487101]}},{"properties":{"latitude":35.1189257,"column_5":1,"date":{"end_time":"2006/09/17 00:00:00 -0400","original":"9/16/2006","granularity":"day","time":"2006/09/16 00:00:00 -0400"},"longitude":-81.334362,"id":"aeltf21zefhr","location":"Kings Mountain SP"},"type":"Feature","geometry":{"type":"Point","coordinates":[-81.334362,35.1189257]}},{"properties":{"latitude":34.6915213,"column_5":1,"date":{"end_time":"2006/11/19 00:00:00 -0500","original":"11/18/2006","granularity":"day","time":"2006/11/18 00:00:00 -0500"},"longitude":-77.0870197,"id":"aeltf1uhmwhh","location":"Croatan National Forest Cedar Point Campground"},"type":"Feature","geometry":{"type":"Point","coordinates":[-77.0870197,34.6915213]}},{"properties":{"latitude":34.7032354,"column_5":1,"date":{"end_time":"2006/11/19 00:00:00 -0500","original":"11/18/2006","granularity":"day","time":"2006/11/18 00:00:00 -0500"},"longitude":-76.6983032,"id":"aeltf23dyfso","location":"Fort Macon SP"},"type":"Feature","geometry":{"type":"Point","coordinates":[-76.6983032,34.7032354]}},{"properties":{"latitude":35.95737,"column_5":1,"date":{"end_time":"2006/12/27 00:00:00 -0500","original":"12/26/2006","granularity":"day","time":"2006/12/26 00:00:00 -0500"},"longitude":-75.62402,"id":"aeltf1vnooxq","location":"Nags Head"},"type":"Feature","geometry":{"type":"Point","coordinates":[-75.62402,35.95737]}},{"properties":{"latitude":35.252658,"column_5":1,"date":{"end_time":"2006/12/29 00:00:00 -0500","original":"12/28/2006","granularity":"day","time":"2006/12/28 00:00:00 -0500"},"longitude":-75.533991,"id":"aeltf22vfrgt","location":"Cape Hatteras--Buxton Woods Trail"},"type":"Feature","geometry":{"type":"Point","coordinates":[-75.533991,35.252658]}},{"properties":{"latitude":35.2334915,"column_5":1,"date":{"end_time":"2006/12/29 00:00:00 -0500","original":"12/28/2006","granularity":"day","time":"2006/12/28 00:00:00 -0500"},"longitude":-75.527401,"id":"aeltf1wjtz8j","location":"Cape Hatteras near Cape Point"},"type":"Feature","geometry":{"type":"Point","coordinates":[-75.527401,35.2334915]}},{"properties":{"latitude":35.3476156,"column_5":1,"date":{"end_time":"2007/04/21 00:00:00 -0400","original":"4/20/2007","granularity":"day","time":"2007/04/20 00:00:00 -0400"},"longitude":-79.5659065,"id":"aeltf24xp5ov","location":"Camp Durant"},"type":"Feature","geometry":{"type":"Point","coordinates":[-79.5659065,35.3476156]}},{"properties":{"latitude":36.105081,"column_5":1,"date":{"end_time":"2007/04/29 00:00:00 -0400","original":"4/28/2007","granularity":"day","time":"2007/04/28 00:00:00 -0400"},"longitude":-80.2644396,"id":"aeltf1u33n5h","location":"Methodist Children's Home"},"type":"Feature","geometry":{"type":"Point","coordinates":[-80.2644396,36.105081]}},{"properties":{"latitude":34.5,"column_5":1,"date":{"end_time":"2007/06/03 00:00:00 -0400","original":"6/2/2007","granularity":"day","time":"2007/06/02 00:00:00 -0400"},"longitude":-80.2166667,"id":"aeltf20nn3qv","location":"Carolina Sandhills NWR"},"type":"Feature","geometry":{"type":"Point","coordinates":[-80.2166667,34.5]}},{"properties":{"latitude":34.9014541,"column_5":1,"date":{"end_time":"2007/06/03 00:00:00 -0400","original":"6/2/2007","granularity":"day","time":"2007/06/02 00:00:00 -0400"},"longitude":-80.5477667,"id":"aeltf248f87v","location":"Joe Collins Road"},"type":"Feature","geometry":{"type":"Point","coordinates":[-80.5477667,34.9014541]}},{"properties":{"latitude":35.10846,"column_5":1,"date":{"end_time":"2007/06/10 00:00:00 -0400","original":"6/9/2007","granularity":"day","time":"2007/06/09 00:00:00 -0400"},"longitude":-77.04407,"id":"aeltf21bjkn0","location":"New Bern"},"type":"Feature","geometry":{"type":"Point","coordinates":[-77.04407,35.10846]}},{"properties":{"latitude":36.7202333,"column_5":1,"date":{"end_time":"2007/06/24 00:00:00 -0400","original":"6/23/2007","granularity":"day","time":"2007/06/23 00:00:00 -0400"},"longitude":-81.4616489,"id":"aeltf2492luh","location":"Dickey Gap, Appalachian Trail"},"type":"Feature","geometry":{"type":"Point","coordinates":[-81.4616489,36.7202333]}},{"properties":{"latitude":36.7028338,"column_5":1,"date":{"end_time":"2007/06/25 00:00:00 -0400","original":"6/24/2007","granularity":"day","time":"2007/06/24 00:00:00 -0400"},"longitude":-81.5035772,"id":"aeltf21lptwt","location":"Fox Creek to Scales, Appalachian Trail"},"type":"Feature","geometry":{"type":"Point","coordinates":[-81.5035772,36.7028338]}},{"properties":{"latitude":36.6502416,"column_5":1,"date":{"end_time":"2007/06/26 00:00:00 -0400","original":"6/25/2007","granularity":"day","time":"2007/06/25 00:00:00 -0400"},"longitude":-81.5037918,"id":"aeltf22646dl","location":"Scales to Grayson Highlands SP, Appalachian Trail"},"type":"Feature","geometry":{"type":"Point","coordinates":[-81.5037918,36.6502416]}},{"properties":{"latitude":36.6597,"column_5":1,"date":{"end_time":"2007/06/28 00:00:00 -0400","original":"6/27/2007","granularity":"day","time":"2007/06/27 00:00:00 -0400"},"longitude":-81.5447,"id":"aeltf1p05qj7","location":"Mt. Rogers - VA Rt. 600 - Mt. Rogers NRA - MMR08"},"type":"Feature","geometry":{"type":"Point","coordinates":[-81.5447,36.6597]}},{"properties":{"latitude":45.5770421,"column_5":1,"date":{"end_time":"2007/07/12 00:00:00 -0400","original":"7/11/2007","granularity":"day","time":"2007/07/11 00:00:00 -0400"},"longitude":-122.1178436,"id":"aeltf204yuip","location":"Multnomah Falls"},"type":"Feature","geometry":{"type":"Point","coordinates":[-122.1178436,45.5770421]}},{"properties":{"latitude":45.52344,"column_5":1,"date":{"end_time":"2007/07/12 00:00:00 -0400","original":"7/11/2007","granularity":"day","time":"2007/07/11 00:00:00 -0400"},"longitude":-122.67621,"id":"aeltf2542pec","location":"Portland"},"type":"Feature","geometry":{"type":"Point","coordinates":[-122.67621,45.52344]}},{"properties":{"latitude":43.1416011,"column_5":1,"date":{"end_time":"2007/07/13 00:00:00 -0400","original":"7/12/2007","granularity":"day","time":"2007/07/12 00:00:00 -0400"},"longitude":-123.4276416,"id":"aeltf1xecanm","location":"Wildlife Safari"},"type":"Feature","geometry":{"type":"Point","coordinates":[-123.4276416,43.1416011]}},{"properties":{"latitude":43.21654,"column_5":1,"date":{"end_time":"2007/07/13 00:00:00 -0400","original":"7/12/2007","granularity":"day","time":"2007/07/12 00:00:00 -0400"},"longitude":-123.34218,"id":"aeltf1zsxlz0","location":"Roseburg"},"type":"Feature","geometry":{"type":"Point","coordinates":[-123.34218,43.21654]}},{"properties":{"latitude":42.9423499,"column_5":1,"date":{"end_time":"2007/07/14 00:00:00 -0400","original":"7/13/2007","granularity":"day","time":"2007/07/13 00:00:00 -0400"},"longitude":-122.1240234,"id":"aeltf20p84jn","location":"Crater Lake NP"},"type":"Feature","geometry":{"type":"Point","coordinates":[-122.1240234,42.9423499]}},{"properties":{"latitude":44.1043515,"column_5":1,"date":{"end_time":"2007/07/15 00:00:00 -0400","original":"7/14/2007","granularity":"day","time":"2007/07/14 00:00:00 -0400"},"longitude":-124.1242218,"id":"aeltf1vcidx3","location":"Sea Lion Caves"},"type":"Feature","geometry":{"type":"Point","coordinates":[-124.1242218,44.1043515]}},{"properties":{"latitude":44.3036802,"column_5":1,"date":{"end_time":"2007/07/15 00:00:00 -0400","original":"7/14/2007","granularity":"day","time":"2007/07/14 00:00:00 -0400"},"longitude":-124.1083658,"id":"aeltf1v9dfct","location":"Heceta Head Lighthouse"},"type":"Feature","geometry":{"type":"Point","coordinates":[-124.1083658,44.3036802]}},{"properties":{"latitude":43.695444,"column_5":1,"date":{"end_time":"2007/07/15 00:00:00 -0400","original":"7/14/2007","granularity":"day","time":"2007/07/14 00:00:00 -0400"},"longitude":-124.038931,"id":"aeltf1tmqbd1","location":"Dean Creek Elk Viewing Area"},"type":"Feature","geometry":{"type":"Point","coordinates":[-124.038931,43.695444]}},{"properties":{"latitude":43.8364312,"column_5":1,"date":{"end_time":"2007/07/15 00:00:00 -0400","original":"7/14/2007","granularity":"day","time":"2007/07/14 00:00:00 -0400"},"longitude":-124.1630495,"id":"aeltf1w6kw6r","location":"Oregon Dunes Overlook"},"type":"Feature","geometry":{"type":"Point","coordinates":[-124.1630495,43.8364312]}},{"properties":{"latitude":45.80004,"column_5":1,"date":{"end_time":"2007/07/16 00:00:00 -0400","original":"7/15/2007","granularity":"day","time":"2007/07/15 00:00:00 -0400"},"longitude":-122.51647,"id":"aeltf1ta8f0w","location":"Clark"},"type":"Feature","geometry":{"type":"Point","coordinates":[-122.51647,45.80004]}},{"properties":{"latitude":48.07951,"column_5":1,"date":{"end_time":"2007/07/17 00:00:00 -0400","original":"7/16/2007","granularity":"day","time":"2007/07/16 00:00:00 -0400"},"longitude":-123.10229,"id":"aeltf1vfnkul","location":"Sequim"},"type":"Feature","geometry":{"type":"Point","coordinates":[-123.10229,48.07951]}},{"properties":{"latitude":48.1358788,"column_5":1,"date":{"end_time":"2007/07/17 00:00:00 -0400","original":"7/16/2007","granularity":"day","time":"2007/07/16 00:00:00 -0400"},"longitude":-123.1915855,"id":"aeltf1pa4xsn","location":"Dungeness Recreation Area"},"type":"Feature","geometry":{"type":"Point","coordinates":[-123.1915855,48.1358788]}},{"properties":{"latitude":47.978072,"column_5":1,"date":{"end_time":"2007/07/17 00:00:00 -0400","original":"7/16/2007","granularity":"day","time":"2007/07/16 00:00:00 -0400"},"longitude":-123.5205743,"id":"aeltf21l8q1k","location":"Olympic NP--Hurricane Ridge"},"type":"Feature","geometry":{"type":"Point","coordinates":[-123.5205743,47.978072]}},{"properties":{"latitude":48.429821,"column_5":1,"date":{"end_time":"2007/07/18 00:00:00 -0400","original":"7/17/2007","granularity":"day","time":"2007/07/17 00:00:00 -0400"},"longitude":-123.3712997,"id":"aeltf1s365wl","location":"Victoria"},"type":"Feature","geometry":{"type":"Point","coordinates":[-123.3712997,48.429821]}},{"properties":{"latitude":48.1592153,"column_5":1,"date":{"end_time":"2007/07/18 00:00:00 -0400","original":"7/17/2007","granularity":"day","time":"2007/07/17 00:00:00 -0400"},"longitude":-123.3860779,"id":"aeltf1rmjvdc","location":"Port Angeles-Victoria Ferry (US side)"},"type":"Feature","geometry":{"type":"Point","coordinates":[-123.3860779,48.1592153]}},{"properties":{"latitude":47.5674054,"column_5":1,"date":{"end_time":"2007/07/18 00:00:00 -0400","original":"7/17/2007","granularity":"day","time":"2007/07/17 00:00:00 -0400"},"longitude":-124.3614364,"id":"aeltf1yca5iy","location":"Olympic NP--South Beach"},"type":"Feature","geometry":{"type":"Point","coordinates":[-124.3614364,47.5674054]}},{"properties":{"latitude":47.8540969,"column_5":1,"date":{"end_time":"2007/07/18 00:00:00 -0400","original":"7/17/2007","granularity":"day","time":"2007/07/17 00:00:00 -0400"},"longitude":-123.9388149,"id":"aeltf24fdgvz","location":"Olympic NP--Hoh Rain Forest"},"type":"Feature","geometry":{"type":"Point","coordinates":[-123.9388149,47.8540969]}},{"properties":{"latitude":45.8166667,"column_5":1,"date":{"end_time":"2007/07/20 00:00:00 -0400","original":"7/19/2007","granularity":"day","time":"2007/07/19 00:00:00 -0400"},"longitude":-122.7666667,"id":"aeltf20p8b38","location":"Ridgefield NWR"},"type":"Feature","geometry":{"type":"Point","coordinates":[-122.7666667,45.8166667]}},{"properties":{"latitude":46.2950461,"column_5":1,"date":{"end_time":"2007/07/20 00:00:00 -0400","original":"7/19/2007","granularity":"day","time":"2007/07/19 00:00:00 -0400"},"longitude":-122.81775,"id":"aeltf1s0c1am","location":"Mount St. Helens Visitor Center"},"type":"Feature","geometry":{"type":"Point","coordinates":[-122.81775,46.2950461]}},{"properties":{"latitude":45.5270035,"column_5":1,"date":{"end_time":"2007/07/20 00:00:00 -0400","original":"7/19/2007","granularity":"day","time":"2007/07/19 00:00:00 -0400"},"longitude":-122.7303525,"id":"aeltf1ztftha","location":"Pittock Bird Sanctuary"},"type":"Feature","geometry":{"type":"Point","coordinates":[-122.7303525,45.5270035]}},{"properties":{"latitude":39.0528642,"column_5":1,"date":{"end_time":"2007/07/21 00:00:00 -0400","original":"7/20/2007","granularity":"day","time":"2007/07/20 00:00:00 -0400"},"longitude":-84.6719966,"id":"aeltf1zcatqv","location":"Cincinnati-Northern Kentucky International Airport"},"type":"Feature","geometry":{"type":"Point","coordinates":[-84.6719966,39.0528642]}},{"properties":{"latitude":35.7649006,"column_5":1,"date":{"end_time":"2007/08/17 00:00:00 -0400","original":"8/16/2007","granularity":"day","time":"2007/08/16 00:00:00 -0400"},"longitude":-82.2697449,"id":"aeltf20yutdg","location":"Mount Mitchell SP"},"type":"Feature","geometry":{"type":"Point","coordinates":[-82.2697449,35.7649006]}},{"properties":{"latitude":34.2181165,"column_5":1,"date":{"end_time":"2007/11/18 00:00:00 -0500","original":"11/17/2007","granularity":"day","time":"2007/11/17 00:00:00 -0500"},"longitude":-83.9504637,"id":"aeltf22gwu3c","location":"Lake Lanier Sailing Club"},"type":"Feature","geometry":{"type":"Point","coordinates":[-83.9504637,34.2181165]}},{"properties":{"latitude":34.6908155,"column_5":1,"date":{"end_time":"2007/12/31 00:00:00 -0500","original":"12/30/2007","granularity":"day","time":"2007/12/30 00:00:00 -0500"},"longitude":-76.532135,"id":"aeltf1rh1weh","location":"Cape Lookout NS--Harker's Island"},"type":"Feature","geometry":{"type":"Point","coordinates":[-76.532135,34.6908155]}},{"properties":{"latitude":35.7501171,"column_5":1,"date":{"end_time":"2008/02/04 00:00:00 -0500","original":"2/3/2008","granularity":"day","time":"2008/02/03 00:00:00 -0500"},"longitude":-81.2008524,"id":"aeltf1zeu7xn","location":"Duggan Household"},"type":"Feature","geometry":{"type":"Point","coordinates":[-81.2008524,35.7501171]}},{"properties":{"latitude":42.3354734,"column_5":1,"date":{"end_time":"2008/02/28 00:00:00 -0500","original":"2/27/2008","granularity":"day","time":"2008/02/27 00:00:00 -0500"},"longitude":-71.1705256,"id":"aeltf1y96alv","location":"Boston College"},"type":"Feature","geometry":{"type":"Point","coordinates":[-71.1705256,42.3354734]}},{"properties":{"latitude":41.9445,"column_5":1,"date":{"end_time":"2008/02/29 00:00:00 -0500","original":"2/28/2008","granularity":"day","time":"2008/02/28 00:00:00 -0500"},"longitude":-71.2856,"id":"aeltf1pm57a2","location":"Attleboro"},"type":"Feature","geometry":{"type":"Point","coordinates":[-71.2856,41.9445]}},{"properties":{"latitude":41.8240013,"column_5":1,"date":{"end_time":"2008/02/29 00:00:00 -0500","original":"2/28/2008","granularity":"day","time":"2008/02/28 00:00:00 -0500"},"longitude":-71.4128036,"id":"aeltf1safonp","location":"Providence"},"type":"Feature","geometry":{"type":"Point","coordinates":[-71.4128036,41.8240013]}},{"properties":{"latitude":42.36237,"column_5":1,"date":{"end_time":"2008/02/29 00:00:00 -0500","original":"2/28/2008","granularity":"day","time":"2008/02/28 00:00:00 -0500"},"longitude":-71.89098,"id":"aeltf24ivnht","location":"Worcester"},"type":"Feature","geometry":{"type":"Point","coordinates":[-71.89098,42.36237]}},{"properties":{"latitude":42.2515985,"column_5":1,"date":{"end_time":"2008/02/29 00:00:00 -0500","original":"2/28/2008","granularity":"day","time":"2008/02/28 00:00:00 -0500"},"longitude":-71.8234766,"id":"aeltf1yj28b4","location":"Clark University"},"type":"Feature","geometry":{"type":"Point","coordinates":[-71.8234766,42.2515985]}},{"properties":{"latitude":42.3713112,"column_5":1,"date":{"end_time":"2008/03/01 00:00:00 -0500","original":"2/29/2008","granularity":"day","time":"2008/02/29 00:00:00 -0500"},"longitude":-72.5165969,"id":"aeltf1s39t7q","location":"Amherst College"},"type":"Feature","geometry":{"type":"Point","coordinates":[-72.5165969,42.3713112]}},{"properties":{"latitude":42.34179,"column_5":1,"date":{"end_time":"2008/03/01 00:00:00 -0500","original":"2/29/2008","granularity":"day","time":"2008/02/29 00:00:00 -0500"},"longitude":-72.58843,"id":"aeltf259l3m9","location":"Hadley"},"type":"Feature","geometry":{"type":"Point","coordinates":[-72.58843,42.34179]}},{"properties":{"latitude":35.94289,"column_5":1,"date":{"end_time":"2008/03/21 00:00:00 -0400","original":"3/20/2008","granularity":"day","time":"2008/03/20 00:00:00 -0400"},"longitude":-83.10291,"id":"aeltf209cr28","location":"Cocke"},"type":"Feature","geometry":{"type":"Point","coordinates":[-83.10291,35.94289]}},{"properties":{"latitude":36.143688,"column_5":1,"date":{"end_time":"2008/03/22 00:00:00 -0400","original":"3/21/2008","granularity":"day","time":"2008/03/21 00:00:00 -0400"},"longitude":-86.8038787,"id":"aeltf20csdkb","location":"Vanderbilt University"},"type":"Feature","geometry":{"type":"Point","coordinates":[-86.8038787,36.143688]}},{"properties":{"latitude":36.9,"column_5":1,"date":{"end_time":"2008/03/22 00:00:00 -0400","original":"3/21/2008","granularity":"day","time":"2008/03/21 00:00:00 -0400"},"longitude":-87.50232,"id":"aeltf1w1j5sn","location":"Christian"},"type":"Feature","geometry":{"type":"Point","coordinates":[-87.50232,36.9]}},{"properties":{"latitude":37.20292,"column_5":1,"date":{"end_time":"2008/03/22 00:00:00 -0400","original":"3/21/2008","granularity":"day","time":"2008/03/21 00:00:00 -0400"},"longitude":-88.71166,"id":"aeltf1pf1wue","location":"Massac"},"type":"Feature","geometry":{"type":"Point","coordinates":[-88.71166,37.20292]}},{"properties":{"latitude":38.6389068,"column_5":1,"date":{"end_time":"2008/03/23 00:00:00 -0400","original":"3/22/2008","granularity":"day","time":"2008/03/22 00:00:00 -0400"},"longitude":-90.2853806,"id":"aeltf255ja93","location":"Forest Park"},"type":"Feature","geometry":{"type":"Point","coordinates":[-90.2853806,38.6389068]}},{"properties":{"latitude":39.74807,"column_5":1,"date":{"end_time":"2008/03/23 00:00:00 -0400","original":"3/22/2008","granularity":"day","time":"2008/03/22 00:00:00 -0400"},"longitude":-89.51201,"id":"aeltf1xx99pf","location":"Illinois"},"type":"Feature","geometry":{"type":"Point","coordinates":[-89.51201,39.74807]}},{"properties":{"latitude":37.81926,"column_5":1,"date":{"end_time":"2008/03/23 00:00:00 -0400","original":"3/22/2008","granularity":"day","time":"2008/03/22 00:00:00 -0400"},"longitude":-85.76394,"id":"aeltf1pwf5pu","location":"Kentucky"},"type":"Feature","geometry":{"type":"Point","coordinates":[-85.76394,37.81926]}},{"properties":{"latitude":38.352,"column_5":1,"date":{"end_time":"2008/03/23 00:00:00 -0400","original":"3/22/2008","granularity":"day","time":"2008/03/22 00:00:00 -0400"},"longitude":-87.65253,"id":"aeltf1x4m4ra","location":"Gibson"},"type":"Feature","geometry":{"type":"Point","coordinates":[-87.65253,38.352]}},{"properties":{"latitude":39.77084,"column_5":1,"date":{"end_time":"2008/03/23 00:00:00 -0400","original":"3/22/2008","granularity":"day","time":"2008/03/22 00:00:00 -0400"},"longitude":-86.44448,"id":"aeltf20n2qyn","location":"Indiana"},"type":"Feature","geometry":{"type":"Point","coordinates":[-86.44448,39.77084]}},{"properties":{"latitude":38.05408,"column_5":1,"date":{"end_time":"2008/03/23 00:00:00 -0400","original":"3/22/2008","granularity":"day","time":"2008/03/22 00:00:00 -0400"},"longitude":-86.63439,"id":"aeltf1thww2c","location":"Perry"},"type":"Feature","geometry":{"type":"Point","coordinates":[-86.63439,38.05408]}},{"properties":{"latitude":36.43752,"column_5":1,"date":{"end_time":"2008/06/15 00:00:00 -0400","original":"6/14/2008","granularity":"day","time":"2008/06/14 00:00:00 -0400"},"longitude":-81.84999,"id":"aeltf1q8tr6m","location":"Johnson"},"type":"Feature","geometry":{"type":"Point","coordinates":[-81.84999,36.43752]}},{"properties":{"latitude":37.7826971,"column_5":1,"date":{"end_time":"2008/06/27 00:00:00 -0400","original":"6/26/2008","granularity":"day","time":"2008/06/26 00:00:00 -0400"},"longitude":-79.9937403,"id":"aeltf24e5uxl","location":"Covington Lumberjacks Stadium"},"type":"Feature","geometry":{"type":"Point","coordinates":[-79.9937403,37.7826971]}},{"properties":{"latitude":51.5058311,"column_5":1,"date":{"end_time":"2008/07/11 00:00:00 -0400","original":"7/10/2008","granularity":"day","time":"2008/07/10 00:00:00 -0400"},"longitude":-0.1208873,"id":"aeltf1rl3luw","location":"Golden Jubilee Bridge"},"type":"Feature","geometry":{"type":"Point","coordinates":[-0.1208873,51.5058311]}},{"properties":{"latitude":51.4697391,"column_5":1,"date":{"end_time":"2008/07/11 00:00:00 -0400","original":"7/10/2008","granularity":"day","time":"2008/07/10 00:00:00 -0400"},"longitude":-0.453647,"id":"aeltf251rx1n","location":"Heathrow Airport"},"type":"Feature","geometry":{"type":"Point","coordinates":[-0.453647,51.4697391]}},{"properties":{"latitude":51.4774807,"column_5":1,"date":{"end_time":"2008/07/13 00:00:00 -0400","original":"7/12/2008","granularity":"day","time":"2008/07/12 00:00:00 -0400"},"longitude":-0.0006008,"id":"aeltf1q6fbhp","location":"Greenwich Park"},"type":"Feature","geometry":{"type":"Point","coordinates":[-0.0006008,51.4774807]}},{"properties":{"latitude":51.5175883,"column_5":1,"date":{"end_time":"2008/07/14 00:00:00 -0400","original":"7/13/2008","granularity":"day","time":"2008/07/13 00:00:00 -0400"},"longitude":-0.0967112,"id":"aeltf1tens67","location":"Museum of London"},"type":"Feature","geometry":{"type":"Point","coordinates":[-0.0967112,51.5175883]}},{"properties":{"latitude":51.5042914,"column_5":1,"date":{"end_time":"2008/07/14 00:00:00 -0400","original":"7/13/2008","granularity":"day","time":"2008/07/13 00:00:00 -0400"},"longitude":-0.0762118,"id":"aeltf1qrbr68","location":"Tower Bridge"},"type":"Feature","geometry":{"type":"Point","coordinates":[-0.0762118,51.5042914]}},{"properties":{"latitude":51.5051999,"column_5":1,"date":{"end_time":"2008/07/16 00:00:00 -0400","original":"7/15/2008","granularity":"day","time":"2008/07/15 00:00:00 -0400"},"longitude":-0.02293,"id":"aeltf24iwgy1","location":"Canary Wharf"},"type":"Feature","geometry":{"type":"Point","coordinates":[-0.02293,51.5051999]}},{"properties":{"latitude":51.5088985,"column_5":1,"date":{"end_time":"2008/07/17 00:00:00 -0400","original":"7/16/2008","granularity":"day","time":"2008/07/16 00:00:00 -0400"},"longitude":-0.0938659,"id":"aeltf21v4258","location":"Millennium Bridge"},"type":"Feature","geometry":{"type":"Point","coordinates":[-0.0938659,51.5088985]}},{"properties":{"latitude":51.4035429,"column_5":1,"date":{"end_time":"2008/07/20 00:00:00 -0400","original":"7/19/2008","granularity":"day","time":"2008/07/19 00:00:00 -0400"},"longitude":-0.3349543,"id":"aeltf24fgpcw","location":"Hampton Court Palace"},"type":"Feature","geometry":{"type":"Point","coordinates":[-0.3349543,51.4035429]}},{"properties":{"latitude":39.56665,"column_5":1,"date":{"end_time":"2008/08/20 00:00:00 -0400","original":"8/19/2008","granularity":"day","time":"2008/08/19 00:00:00 -0400"},"longitude":-75.60142,"id":"aeltf22xds82","location":"New Castle"},"type":"Feature","geometry":{"type":"Point","coordinates":[-75.60142,39.56665]}},{"properties":{"latitude":40.696213,"column_5":1,"date":{"end_time":"2008/08/21 00:00:00 -0400","original":"8/20/2008","granularity":"day","time":"2008/08/20 00:00:00 -0400"},"longitude":-74.05503,"id":"aeltf1v8x8i5","location":"Liberty State Park"},"type":"Feature","geometry":{"type":"Point","coordinates":[-74.05503,40.696213]}},{"properties":{"latitude":40.8509,"column_5":1,"date":{"end_time":"2008/08/21 00:00:00 -0400","original":"8/20/2008","granularity":"day","time":"2008/08/20 00:00:00 -0400"},"longitude":-73.97018,"id":"aeltf1xpm3hf","location":"Fort Lee"},"type":"Feature","geometry":{"type":"Point","coordinates":[-73.97018,40.8509]}},{"properties":{"latitude":40.8081909,"column_5":1,"date":{"end_time":"2008/08/22 00:00:00 -0400","original":"8/21/2008","granularity":"day","time":"2008/08/21 00:00:00 -0400"},"longitude":-73.961678,"id":"aeltf1t0lrxz","location":"Columbia University"},"type":"Feature","geometry":{"type":"Point","coordinates":[-73.961678,40.8081909]}},{"properties":{"latitude":40.78822,"column_5":1,"date":{"end_time":"2008/08/22 00:00:00 -0400","original":"8/21/2008","granularity":"day","time":"2008/08/21 00:00:00 -0400"},"longitude":-74.24535,"id":"aeltf233om46","location":"Essex"},"type":"Feature","geometry":{"type":"Point","coordinates":[-74.24535,40.78822]}},{"properties":{"latitude":40.99325,"column_5":1,"date":{"end_time":"2008/08/22 00:00:00 -0400","original":"8/21/2008","granularity":"day","time":"2008/08/21 00:00:00 -0400"},"longitude":-77.61335,"id":"aeltf1sr6qql","location":"Pennsylvania"},"type":"Feature","geometry":{"type":"Point","coordinates":[-77.61335,40.99325]}},{"properties":{"latitude":37.2244195,"column_5":1,"date":{"end_time":"2009/01/18 00:00:00 -0500","original":"1/17/2009","granularity":"day","time":"2009/01/17 00:00:00 -0500"},"longitude":-76.7846471,"id":"aeltf1p5vpdh","location":"Jamestown Settlement"},"type":"Feature","geometry":{"type":"Point","coordinates":[-76.7846471,37.2244195]}},{"properties":{"latitude":37.1860316,"column_5":1,"date":{"end_time":"2009/01/18 00:00:00 -0500","original":"1/17/2009","granularity":"day","time":"2009/01/17 00:00:00 -0500"},"longitude":-76.7837906,"id":"aeltf1zfqasd","location":"Scotland Ferry"},"type":"Feature","geometry":{"type":"Point","coordinates":[-76.7837906,37.1860316]}},{"properties":{"latitude":37.2231581,"column_5":1,"date":{"end_time":"2009/01/18 00:00:00 -0500","original":"1/17/2009","granularity":"day","time":"2009/01/17 00:00:00 -0500"},"longitude":-76.7882538,"id":"aeltf1p7546h","location":"Jamestown--Scotland Ferry to Jamestown Beach"},"type":"Feature","geometry":{"type":"Point","coordinates":[-76.7882538,37.2231581]}},{"properties":{"latitude":37.1802,"column_5":1,"date":{"end_time":"2009/01/18 00:00:00 -0500","original":"1/17/2009","granularity":"day","time":"2009/01/17 00:00:00 -0500"},"longitude":-76.5476,"id":"aeltf226wf00","location":"Newport News City Park - CLP07"},"type":"Feature","geometry":{"type":"Point","coordinates":[-76.5476,37.1802]}},{"properties":{"latitude":37.2723415,"column_5":1,"date":{"end_time":"2009/01/19 00:00:00 -0500","original":"1/18/2009","granularity":"day","time":"2009/01/18 00:00:00 -0500"},"longitude":-76.7006765,"id":"aeltf1yabzhz","location":"Colonial Williamsburg"},"type":"Feature","geometry":{"type":"Point","coordinates":[-76.7006765,37.2723415]}},{"properties":{"latitude":37.2325,"column_5":1,"date":{"end_time":"2009/01/20 00:00:00 -0500","original":"1/19/2009","granularity":"day","time":"2009/01/19 00:00:00 -0500"},"longitude":-76.5032,"id":"aeltf23x5vde","location":"Yorktown Colonial Park - CLP05"},"type":"Feature","geometry":{"type":"Point","coordinates":[-76.5032,37.2325]}},{"properties":{"latitude":36.109207,"column_5":1,"date":{"end_time":"2009/02/17 00:00:00 -0500","original":"2/16/2009","granularity":"day","time":"2009/02/16 00:00:00 -0500"},"longitude":-80.3712988,"id":"aeltf1xj47r7","location":"Brookberry Farm"},"type":"Feature","geometry":{"type":"Point","coordinates":[-80.3712988,36.109207]}},{"properties":{"latitude":36.6108428,"column_5":1,"date":{"end_time":"2009/03/11 00:00:00 -0400","original":"3/10/2009","granularity":"day","time":"2009/03/10 00:00:00 -0400"},"longitude":-82.0017815,"id":"aeltf211us9q","location":"South Holston Lake- Brown's Dairy Farm"},"type":"Feature","geometry":{"type":"Point","coordinates":[-82.0017815,36.6108428]}},{"properties":{"latitude":36.4408946,"column_5":1,"date":{"end_time":"2009/03/11 00:00:00 -0400","original":"3/10/2009","granularity":"day","time":"2009/03/10 00:00:00 -0400"},"longitude":-82.4381447,"id":"aeltf1qwgvfi","location":"Boone Dam"},"type":"Feature","geometry":{"type":"Point","coordinates":[-82.4381447,36.4408946]}},{"properties":{"latitude":36.5912571,"column_5":1,"date":{"end_time":"2009/03/11 00:00:00 -0400","original":"3/10/2009","granularity":"day","time":"2009/03/10 00:00:00 -0400"},"longitude":-82.0298696,"id":"aeltf1w3dr5w","location":"Musick's Campground"},"type":"Feature","geometry":{"type":"Point","coordinates":[-82.0298696,36.5912571]}},{"properties":{"latitude":36.5019895,"column_5":1,"date":{"end_time":"2009/03/11 00:00:00 -0400","original":"3/10/2009","granularity":"day","time":"2009/03/10 00:00:00 -0400"},"longitude":-82.4927978,"id":"aeltf1r8qy2l","location":"Warriors Path SP"},"type":"Feature","geometry":{"type":"Point","coordinates":[-82.4927978,36.5019895]}},{"properties":{"latitude":36.34932,"column_5":1,"date":{"end_time":"2009/03/11 00:00:00 -0400","original":"3/10/2009","granularity":"day","time":"2009/03/10 00:00:00 -0400"},"longitude":-81.74563,"id":"aeltf2173td4","location":"Trade"},"type":"Feature","geometry":{"type":"Point","coordinates":[-81.74563,36.34932]}},{"properties":{"latitude":36.59511,"column_5":1,"date":{"end_time":"2009/03/11 00:00:00 -0400","original":"3/10/2009","granularity":"day","time":"2009/03/10 00:00:00 -0400"},"longitude":-82.18876,"id":"aeltf1udh55b","location":"Bristol"},"type":"Feature","geometry":{"type":"Point","coordinates":[-82.18876,36.59511]}},{"properties":{"latitude":39.7778039,"column_5":1,"date":{"end_time":"2009/04/19 00:00:00 -0400","original":"4/18/2009","granularity":"day","time":"2009/04/18 00:00:00 -0400"},"longitude":-75.4983044,"id":"aeltf1v9cbbu","location":"Bellevue State Park"},"type":"Feature","geometry":{"type":"Point","coordinates":[-75.4983044,39.7778039]}},{"properties":{"latitude":39.8157225,"column_5":1,"date":{"end_time":"2009/04/19 00:00:00 -0400","original":"4/18/2009","granularity":"day","time":"2009/04/18 00:00:00 -0400"},"longitude":-75.4533291,"id":"aeltf20fafpx","location":"Claymont"},"type":"Feature","geometry":{"type":"Point","coordinates":[-75.4533291,39.8157225]}},{"properties":{"latitude":35.0746049,"column_5":1,"date":{"end_time":"2009/05/13 00:00:00 -0400","original":"5/12/2009","granularity":"day","time":"2009/05/12 00:00:00 -0400"},"longitude":-80.7745957,"id":"aeltf2403p7x","location":"Charlotte Latin"},"type":"Feature","geometry":{"type":"Point","coordinates":[-80.7745957,35.0746049]}},{"properties":{"latitude":34.5450462,"column_5":1,"date":{"end_time":"2009/06/07 00:00:00 -0400","original":"6/6/2009","granularity":"day","time":"2009/06/06 00:00:00 -0400"},"longitude":-82.8961895,"id":"aeltf25b0j6h","location":"Dobbins Farm, Townville SC"},"type":"Feature","geometry":{"type":"Point","coordinates":[-82.8961895,34.5450462]}},{"properties":{"latitude":34.537827,"column_5":1,"date":{"end_time":"2009/06/07 00:00:00 -0400","original":"6/6/2009","granularity":"day","time":"2009/06/06 00:00:00 -0400"},"longitude":-82.823659,"id":"aeltf21mtw8e","location":"I-85 Lake Hartwell Bridge"},"type":"Feature","geometry":{"type":"Point","coordinates":[-82.823659,34.537827]}},{"properties":{"latitude":36.0853496,"column_5":1,"date":{"end_time":"2009/06/08 00:00:00 -0400","original":"6/7/2009","granularity":"day","time":"2009/06/07 00:00:00 -0400"},"longitude":-80.2255583,"id":"aeltf1p99x01","location":"Civitan Park"},"type":"Feature","geometry":{"type":"Point","coordinates":[-80.2255583,36.0853496]}},{"properties":{"latitude":32.4387098,"column_5":1,"date":{"end_time":"2009/06/11 00:00:00 -0400","original":"6/10/2009","granularity":"day","time":"2009/06/10 00:00:00 -0400"},"longitude":-88.4361327,"id":"aeltf1ps1spg","location":"I-20 Mississippi Welcome Center"},"type":"Feature","geometry":{"type":"Point","coordinates":[-88.4361327,32.4387098]}},{"properties":{"latitude":32.62467,"column_5":1,"date":{"end_time":"2009/06/11 00:00:00 -0400","original":"6/10/2009","granularity":"day","time":"2009/06/10 00:00:00 -0400"},"longitude":-86.68351,"id":"aeltf1ymx589","location":"Alabama"},"type":"Feature","geometry":{"type":"Point","coordinates":[-86.68351,32.62467]}},{"properties":{"latitude":32.68067,"column_5":1,"date":{"end_time":"2009/06/11 00:00:00 -0400","original":"6/10/2009","granularity":"day","time":"2009/06/10 00:00:00 -0400"},"longitude":-83.25196,"id":"aeltf202u1ec","location":"Georgia"},"type":"Feature","geometry":{"type":"Point","coordinates":[-83.25196,32.68067]}},{"properties":{"latitude":33.71535,"column_5":1,"date":{"end_time":"2009/06/11 00:00:00 -0400","original":"6/10/2009","granularity":"day","time":"2009/06/10 00:00:00 -0400"},"longitude":-85.59687,"id":"aeltf1rtloh2","location":"Cleburne"},"type":"Feature","geometry":{"type":"Point","coordinates":[-85.59687,33.71535]}},{"properties":{"latitude":32.64625,"column_5":1,"date":{"end_time":"2009/06/11 00:00:00 -0400","original":"6/10/2009","granularity":"day","time":"2009/06/10 00:00:00 -0400"},"longitude":-90.08487,"id":"aeltf1pri9gn","location":"Madison"},"type":"Feature","geometry":{"type":"Point","coordinates":[-90.08487,32.64625]}},{"properties":{"latitude":32.40411,"column_5":1,"date":{"end_time":"2009/06/11 00:00:00 -0400","original":"6/10/2009","granularity":"day","time":"2009/06/10 00:00:00 -0400"},"longitude":-88.65521,"id":"aeltf1xbjah6","location":"Lauderdale"},"type":"Feature","geometry":{"type":"Point","coordinates":[-88.65521,32.40411]}},{"properties":{"latitude":32.6093028,"column_5":1,"date":{"end_time":"2009/06/11 00:00:00 -0400","original":"6/10/2009","granularity":"day","time":"2009/06/10 00:00:00 -0400"},"longitude":-90.032959,"id":"aeltf1vlhqzi","location":"Downtown Canton"},"type":"Feature","geometry":{"type":"Point","coordinates":[-90.032959,32.6093028]}},{"properties":{"latitude":32.64902,"column_5":1,"date":{"end_time":"2009/06/11 00:00:00 -0400","original":"6/10/2009","granularity":"day","time":"2009/06/10 00:00:00 -0400"},"longitude":-88.13129,"id":"aeltf1t4l7cd","location":"Sumter"},"type":"Feature","geometry":{"type":"Point","coordinates":[-88.13129,32.64902]}},{"properties":{"latitude":33.05763,"column_5":1,"date":{"end_time":"2009/06/12 00:00:00 -0400","original":"6/11/2009","granularity":"day","time":"2009/06/11 00:00:00 -0400"},"longitude":-89.58758,"id":"aeltf1uggfzx","location":"Kosciusko"},"type":"Feature","geometry":{"type":"Point","coordinates":[-89.58758,33.05763]}},{"properties":{"latitude":32.543286,"column_5":1,"date":{"end_time":"2009/06/12 00:00:00 -0400","original":"6/11/2009","granularity":"day","time":"2009/06/11 00:00:00 -0400"},"longitude":-90.3242683,"id":"aeltf22tmnsd","location":"Mississippi Petrified Forest"},"type":"Feature","geometry":{"type":"Point","coordinates":[-90.3242683,32.543286]}},{"properties":{"latitude":31.5527704,"column_5":1,"date":{"end_time":"2009/06/13 00:00:00 -0400","original":"6/12/2009","granularity":"day","time":"2009/06/12 00:00:00 -0400"},"longitude":-91.3862085,"id":"aeltf1rt8t4j","location":"Monmouth Plantation"},"type":"Feature","geometry":{"type":"Point","coordinates":[-91.3862085,31.5527704]}},{"properties":{"latitude":32.01015,"column_5":1,"date":{"end_time":"2009/06/13 00:00:00 -0400","original":"6/12/2009","granularity":"day","time":"2009/06/12 00:00:00 -0400"},"longitude":-90.97852,"id":"aeltf1pt4k53","location":"Claiborne"},"type":"Feature","geometry":{"type":"Point","coordinates":[-90.97852,32.01015]}},{"properties":{"latitude":31.5661451,"column_5":1,"date":{"end_time":"2009/06/13 00:00:00 -0400","original":"6/12/2009","granularity":"day","time":"2009/06/12 00:00:00 -0400"},"longitude":-91.42811,"id":"aeltf1u4bf7x","location":"S Spruce St, Vidalia, LA"},"type":"Feature","geometry":{"type":"Point","coordinates":[-91.42811,31.5661451]}},{"properties":{"latitude":31.5626851,"column_5":1,"date":{"end_time":"2009/06/13 00:00:00 -0400","original":"6/12/2009","granularity":"day","time":"2009/06/12 00:00:00 -0400"},"longitude":-91.4001828,"id":"aeltf1sgv89u","location":"Stanton Hall"},"type":"Feature","geometry":{"type":"Point","coordinates":[-91.4001828,31.5626851]}},{"properties":{"latitude":32.6039524,"column_5":1,"date":{"end_time":"2009/06/14 00:00:00 -0400","original":"6/13/2009","granularity":"day","time":"2009/06/13 00:00:00 -0400"},"longitude":-90.0176811,"id":"aeltf1u92qbh","location":"Center Terrace Baptist Church"},"type":"Feature","geometry":{"type":"Point","coordinates":[-90.0176811,32.6039524]}},{"properties":{"latitude":32.8688193,"column_5":1,"date":{"end_time":"2009/06/14 00:00:00 -0400","original":"6/13/2009","granularity":"day","time":"2009/06/13 00:00:00 -0400"},"longitude":-89.6778023,"id":"aeltf219g2fd","location":"Wake Forest Cemetary Thomastown MS"},"type":"Feature","geometry":{"type":"Point","coordinates":[-89.6778023,32.8688193]}},{"properties":{"latitude":33.6953784,"column_5":1,"date":{"end_time":"2009/06/15 00:00:00 -0400","original":"6/14/2009","granularity":"day","time":"2009/06/14 00:00:00 -0400"},"longitude":-85.1468968,"id":"aeltf1ww4eeb","location":"Bremen Quality Inn"},"type":"Feature","geometry":{"type":"Point","coordinates":[-85.1468968,33.6953784]}},{"properties":{"latitude":36.1307348,"column_5":1,"date":{"end_time":"2009/06/25 00:00:00 -0400","original":"6/24/2009","granularity":"day","time":"2009/06/24 00:00:00 -0400"},"longitude":-80.2956605,"id":"aeltf2129mj5","location":"Speas Elementary School"},"type":"Feature","geometry":{"type":"Point","coordinates":[-80.2956605,36.1307348]}},{"properties":{"latitude":35.69718,"column_5":1,"date":{"end_time":"2009/06/27 00:00:00 -0400","original":"6/26/2009","granularity":"day","time":"2009/06/26 00:00:00 -0400"},"longitude":-77.15866,"id":"aeltf1r79x7p","location":"Bear Grass VOA site"},"type":"Feature","geometry":{"type":"Point","coordinates":[-77.15866,35.69718]}},{"properties":{"latitude":35.2667855,"column_5":1,"date":{"end_time":"2009/06/28 00:00:00 -0400","original":"6/27/2009","granularity":"day","time":"2009/06/27 00:00:00 -0400"},"longitude":-75.5183029,"id":"aeltf22i99jc","location":"Cape Hatteras NS"},"type":"Feature","geometry":{"type":"Point","coordinates":[-75.5183029,35.2667855]}},{"properties":{"latitude":35.2330007,"column_5":1,"date":{"end_time":"2009/06/29 00:00:00 -0400","original":"6/28/2009","granularity":"day","time":"2009/06/28 00:00:00 -0400"},"longitude":-75.5270576,"id":"aeltf20tqrzv","location":"Cape Hatteras Beaches near Cape Point"},"type":"Feature","geometry":{"type":"Point","coordinates":[-75.5270576,35.2330007]}},{"properties":{"latitude":35.2300561,"column_5":1,"date":{"end_time":"2009/06/29 00:00:00 -0400","original":"6/28/2009","granularity":"day","time":"2009/06/28 00:00:00 -0400"},"longitude":-75.5322504,"id":"aeltf1xoec23","location":"Cape Hatteras--Salt Pond"},"type":"Feature","geometry":{"type":"Point","coordinates":[-75.5322504,35.2300561]}},{"properties":{"latitude":35.9296487,"column_5":1,"date":{"end_time":"2009/07/01 00:00:00 -0400","original":"6/30/2009","granularity":"day","time":"2009/06/30 00:00:00 -0400"},"longitude":-76.1537933,"id":"aeltf1xgjllj","location":"Newfoundland Farm"},"type":"Feature","geometry":{"type":"Point","coordinates":[-76.1537933,35.9296487]}},{"properties":{"latitude":35.8936393,"column_5":1,"date":{"end_time":"2009/07/01 00:00:00 -0400","original":"6/30/2009","granularity":"day","time":"2009/06/30 00:00:00 -0400"},"longitude":-75.9395599,"id":"aeltf24smvf3","location":"Alligator River NWR- Brier Hall Rd"},"type":"Feature","geometry":{"type":"Point","coordinates":[-75.9395599,35.8936393]}},{"properties":{"latitude":35.7991934,"column_5":1,"date":{"end_time":"2009/07/03 00:00:00 -0400","original":"7/2/2009","granularity":"day","time":"2009/07/02 00:00:00 -0400"},"longitude":-78.6892962,"id":"aeltf1rr8qpp","location":"Meredith College"},"type":"Feature","geometry":{"type":"Point","coordinates":[-78.6892962,35.7991934]}},{"properties":{"latitude":36.0643037,"column_5":1,"date":{"end_time":"2009/07/05 00:00:00 -0400","original":"7/4/2009","granularity":"day","time":"2009/07/04 00:00:00 -0400"},"longitude":-80.3090394,"id":"aeltf1wz8nuo","location":"S Stratford Rd, I-40 Winston-Salem, NC"},"type":"Feature","geometry":{"type":"Point","coordinates":[-80.3090394,36.0643037]}},{"properties":{"latitude":44.49208,"column_5":1,"date":{"end_time":"2009/07/08 00:00:00 -0400","original":"7/7/2009","granularity":"day","time":"2009/07/07 00:00:00 -0400"},"longitude":-63.91667,"id":"aeltf20xjbkf","location":"Peggy's Cove"},"type":"Feature","geometry":{"type":"Point","coordinates":[-63.91667,44.49208]}},{"properties":{"latitude":44.6429128,"column_5":1,"date":{"end_time":"2009/07/08 00:00:00 -0400","original":"7/7/2009","granularity":"day","time":"2009/07/07 00:00:00 -0400"},"longitude":-63.5822947,"id":"aeltf1uaccy9","location":"Halifax--Public Gardens"},"type":"Feature","geometry":{"type":"Point","coordinates":[-63.5822947,44.6429128]}},{"properties":{"latitude":44.6464295,"column_5":1,"date":{"end_time":"2009/07/08 00:00:00 -0400","original":"7/7/2009","granularity":"day","time":"2009/07/07 00:00:00 -0400"},"longitude":-63.5795975,"id":"aeltf1r7k6eh","location":"Halifax Citadel NHS"},"type":"Feature","geometry":{"type":"Point","coordinates":[-63.5795975,44.6464295]}},{"properties":{"latitude":44.38008,"column_5":1,"date":{"end_time":"2009/07/09 00:00:00 -0400","original":"7/8/2009","granularity":"day","time":"2009/07/08 00:00:00 -0400"},"longitude":-64.31937,"id":"aeltf1sk9cx1","location":"Lunenburg"},"type":"Feature","geometry":{"type":"Point","coordinates":[-64.31937,44.38008]}},{"properties":{"latitude":44.4110497,"column_5":1,"date":{"end_time":"2009/07/09 00:00:00 -0400","original":"7/8/2009","granularity":"day","time":"2009/07/08 00:00:00 -0400"},"longitude":-65.26266,"id":"aeltf1r3yetf","location":"Kejimkujik NP"},"type":"Feature","geometry":{"type":"Point","coordinates":[-65.26266,44.4110497]}},{"properties":{"latitude":44.2754422,"column_5":1,"date":{"end_time":"2009/07/10 00:00:00 -0400","original":"7/9/2009","granularity":"day","time":"2009/07/09 00:00:00 -0400"},"longitude":-66.3248062,"id":"aeltf1x08o5u","location":"Long Island--Freeport"},"type":"Feature","geometry":{"type":"Point","coordinates":[-66.3248062,44.2754422]}},{"properties":{"latitude":44.8258001,"column_5":1,"date":{"end_time":"2009/07/10 00:00:00 -0400","original":"7/9/2009","granularity":"day","time":"2009/07/09 00:00:00 -0400"},"longitude":-65.499718,"id":"aeltf1slmhy2","location":"Parker's Cove"},"type":"Feature","geometry":{"type":"Point","coordinates":[-65.499718,44.8258001]}},{"properties":{"latitude":44.5256226,"column_5":1,"date":{"end_time":"2009/07/10 00:00:00 -0400","original":"7/9/2009","granularity":"day","time":"2009/07/09 00:00:00 -0400"},"longitude":-66.8383503,"id":"aeltf22rc1oi","location":"Brier Island Whalewatch-NB"},"type":"Feature","geometry":{"type":"Point","coordinates":[-66.8383503,44.5256226]}},{"properties":{"latitude":44.3091667,"column_5":1,"date":{"end_time":"2009/07/10 00:00:00 -0400","original":"7/9/2009","granularity":"day","time":"2009/07/09 00:00:00 -0400"},"longitude":-66.3655556,"id":"aeltf1p2kpib","location":"Brier Island--Bay of Fundy Whalewatch"},"type":"Feature","geometry":{"type":"Point","coordinates":[-66.3655556,44.3091667]}},{"properties":{"latitude":44.7445996,"column_5":1,"date":{"end_time":"2009/07/11 00:00:00 -0400","original":"7/10/2009","granularity":"day","time":"2009/07/10 00:00:00 -0400"},"longitude":-65.5087709,"id":"aeltf1s48lzr","location":"Annapolis Royal Marsh"},"type":"Feature","geometry":{"type":"Point","coordinates":[-65.5087709,44.7445996]}},{"properties":{"latitude":45.111134,"column_5":1,"date":{"end_time":"2009/07/11 00:00:00 -0400","original":"7/10/2009","granularity":"day","time":"2009/07/10 00:00:00 -0400"},"longitude":-64.3097729,"id":"aeltf1wkk1nc","location":"Grand-Pr National Historic Site"},"type":"Feature","geometry":{"type":"Point","coordinates":[-64.3097729,45.111134]}},{"properties":{"latitude":45.3532219,"column_5":1,"date":{"end_time":"2009/07/11 00:00:00 -0400","original":"7/10/2009","granularity":"day","time":"2009/07/10 00:00:00 -0400"},"longitude":-63.2684183,"id":"aeltf1u0k92q","location":"Victoria Park"},"type":"Feature","geometry":{"type":"Point","coordinates":[-63.2684183,45.3532219]}},{"properties":{"latitude":44.7168717,"column_5":1,"date":{"end_time":"2009/07/11 00:00:00 -0400","original":"7/10/2009","granularity":"day","time":"2009/07/10 00:00:00 -0400"},"longitude":-65.6034607,"id":"aeltf24bl2n5","location":"Port Royal"},"type":"Feature","geometry":{"type":"Point","coordinates":[-65.6034607,44.7168717]}},{"properties":{"latitude":45.8187441,"column_5":1,"date":{"end_time":"2009/07/12 00:00:00 -0400","original":"7/11/2009","granularity":"day","time":"2009/07/11 00:00:00 -0400"},"longitude":-64.5749184,"id":"aeltf1upaxrn","location":"Hopewell Rocks"},"type":"Feature","geometry":{"type":"Point","coordinates":[-64.5749184,45.8187441]}},{"properties":{"latitude":45.6949363,"column_5":1,"date":{"end_time":"2009/07/12 00:00:00 -0400","original":"7/11/2009","granularity":"day","time":"2009/07/11 00:00:00 -0400"},"longitude":-64.4502254,"id":"aeltf1x3xxkl","location":"Joggins Fossil Cliffs"},"type":"Feature","geometry":{"type":"Point","coordinates":[-64.4502254,45.6949363]}},{"properties":{"latitude":45.3993376,"column_5":1,"date":{"end_time":"2009/07/12 00:00:00 -0400","original":"7/11/2009","granularity":"day","time":"2009/07/11 00:00:00 -0400"},"longitude":-64.3243242,"id":"aeltf21pbhwx","location":"Fundy Geological Museum"},"type":"Feature","geometry":{"type":"Point","coordinates":[-64.3243242,45.3993376]}},{"properties":{"latitude":45.7931876,"column_5":1,"date":{"end_time":"2009/07/12 00:00:00 -0400","original":"7/11/2009","granularity":"day","time":"2009/07/11 00:00:00 -0400"},"longitude":-64.2598271,"id":"aeltf1w5pjx2","location":"Chignecto NWA--Amherst Point Bird Sanctuary"},"type":"Feature","geometry":{"type":"Point","coordinates":[-64.2598271,45.7931876]}},{"properties":{"latitude":46.5325476,"column_5":1,"date":{"end_time":"2009/07/13 00:00:00 -0400","original":"7/12/2009","granularity":"day","time":"2009/07/12 00:00:00 -0400"},"longitude":-64.6932795,"id":"aeltf1z0n35a","location":"La Dune de Bouctouche"},"type":"Feature","geometry":{"type":"Point","coordinates":[-64.6932795,46.5325476]}},{"properties":{"latitude":46.549695,"column_5":1,"date":{"end_time":"2009/07/13 00:00:00 -0400","original":"7/12/2009","granularity":"day","time":"2009/07/12 00:00:00 -0400"},"longitude":-64.7130111,"id":"aeltf1y94x39","location":"Saint-douard-de-Kent"},"type":"Feature","geometry":{"type":"Point","coordinates":[-64.7130111,46.549695]}},{"properties":{"latitude":46.2550857,"column_5":1,"date":{"end_time":"2009/07/13 00:00:00 -0400","original":"7/12/2009","granularity":"day","time":"2009/07/12 00:00:00 -0400"},"longitude":-63.6961618,"id":"aeltf1z7ary9","location":"Borden-Carleton Visitor Information Centre"},"type":"Feature","geometry":{"type":"Point","coordinates":[-63.6961618,46.2550857]}},{"properties":{"latitude":46.4180364,"column_5":1,"date":{"end_time":"2009/07/13 00:00:00 -0400","original":"7/12/2009","granularity":"day","time":"2009/07/12 00:00:00 -0400"},"longitude":-62.5796699,"id":"aeltf1wsvt4b","location":"Saint Peters Bay"},"type":"Feature","geometry":{"type":"Point","coordinates":[-62.5796699,46.4180364]}},{"properties":{"latitude":46.445682,"column_5":1,"date":{"end_time":"2009/07/14 00:00:00 -0400","original":"7/13/2009","granularity":"day","time":"2009/07/13 00:00:00 -0400"},"longitude":-61.9719444,"id":"aeltf1pmegv4","location":"East Point, PEI"},"type":"Feature","geometry":{"type":"Point","coordinates":[-61.9719444,46.445682]}},{"properties":{"latitude":46.3847163,"column_5":1,"date":{"end_time":"2009/07/14 00:00:00 -0400","original":"7/13/2009","granularity":"day","time":"2009/07/13 00:00:00 -0400"},"longitude":-62.1207129,"id":"aeltf25374tc","location":"Basin Head Provincial Park"},"type":"Feature","geometry":{"type":"Point","coordinates":[-62.1207129,46.3847163]}},{"properties":{"latitude":45.9552179,"column_5":1,"date":{"end_time":"2009/07/15 00:00:00 -0400","original":"7/14/2009","granularity":"day","time":"2009/07/14 00:00:00 -0400"},"longitude":-62.748525,"id":"aeltf21dgakt","location":"Wood Islands Ferry"},"type":"Feature","geometry":{"type":"Point","coordinates":[-62.748525,45.9552179]}},{"properties":{"latitude":45.7386567,"column_5":1,"date":{"end_time":"2009/07/15 00:00:00 -0400","original":"7/14/2009","granularity":"day","time":"2009/07/14 00:00:00 -0400"},"longitude":-62.6867867,"id":"aeltf1s8rhhg","location":"Caribou"},"type":"Feature","geometry":{"type":"Point","coordinates":[-62.6867867,45.7386567]}},{"properties":{"latitude":46.7421546,"column_5":1,"date":{"end_time":"2009/07/15 00:00:00 -0400","original":"7/14/2009","granularity":"day","time":"2009/07/14 00:00:00 -0400"},"longitude":-60.8274579,"id":"aeltf240jf67","location":"Cape Breton Highlands NP- Bog Trail"},"type":"Feature","geometry":{"type":"Point","coordinates":[-60.8274579,46.7421546]}},{"properties":{"latitude":45.62007,"column_5":1,"date":{"end_time":"2009/07/15 00:00:00 -0400","original":"7/14/2009","granularity":"day","time":"2009/07/14 00:00:00 -0400"},"longitude":-61.99929,"id":"aeltf1ox3k0w","location":"Antigonish"},"type":"Feature","geometry":{"type":"Point","coordinates":[-61.99929,45.62007]}},{"properties":{"latitude":46.7384489,"column_5":1,"date":{"end_time":"2009/07/16 00:00:00 -0400","original":"7/15/2009","granularity":"day","time":"2009/07/15 00:00:00 -0400"},"longitude":-60.6376648,"id":"aeltf23bznq3","location":"Cape Breton Highlands NP"},"type":"Feature","geometry":{"type":"Point","coordinates":[-60.6376648,46.7384489]}},{"properties":{"latitude":47.0265517,"column_5":1,"date":{"end_time":"2009/07/16 00:00:00 -0400","original":"7/15/2009","granularity":"day","time":"2009/07/15 00:00:00 -0400"},"longitude":-60.5588293,"id":"aeltf23dbdls","location":"Meat Cove"},"type":"Feature","geometry":{"type":"Point","coordinates":[-60.5588293,47.0265517]}},{"properties":{"latitude":46.7382136,"column_5":1,"date":{"end_time":"2009/07/16 00:00:00 -0400","original":"7/15/2009","granularity":"day","time":"2009/07/15 00:00:00 -0400"},"longitude":-60.8076096,"id":"aeltf1xe5uje","location":"Cape Breton Highlands NP- Benjie's Lake"},"type":"Feature","geometry":{"type":"Point","coordinates":[-60.8076096,46.7382136]}},{"properties":{"latitude":46.413953,"column_5":1,"date":{"end_time":"2009/07/17 00:00:00 -0400","original":"7/16/2009","granularity":"day","time":"2009/07/16 00:00:00 -0400"},"longitude":-60.4754961,"id":"aeltf2530jc9","location":"Plaster Provincial Park"},"type":"Feature","geometry":{"type":"Point","coordinates":[-60.4754961,46.413953]}},{"properties":{"latitude":46.2318061,"column_5":1,"date":{"end_time":"2009/07/17 00:00:00 -0400","original":"7/16/2009","granularity":"day","time":"2009/07/16 00:00:00 -0400"},"longitude":-60.608654,"id":"aeltf1ueh9m9","location":"West Bay"},"type":"Feature","geometry":{"type":"Point","coordinates":[-60.608654,46.2318061]}},{"properties":{"latitude":36.1076814,"column_5":1,"date":{"end_time":"2009/08/13 00:00:00 -0400","original":"8/12/2009","granularity":"day","time":"2009/08/12 00:00:00 -0400"},"longitude":-82.1087372,"id":"aeltf1q28s21","location":"Carver's Gap TN Side"},"type":"Feature","geometry":{"type":"Point","coordinates":[-82.1087372,36.1076814]}},{"properties":{"latitude":36.1057051,"column_5":1,"date":{"end_time":"2009/08/13 00:00:00 -0400","original":"8/12/2009","granularity":"day","time":"2009/08/12 00:00:00 -0400"},"longitude":-82.1040916,"id":"aeltf1xtg62t","location":"Carver's Gap NC Side"},"type":"Feature","geometry":{"type":"Point","coordinates":[-82.1040916,36.1057051]}},{"properties":{"latitude":39.7526403,"column_5":1,"date":{"end_time":"2009/08/23 00:00:00 -0400","original":"8/22/2009","granularity":"day","time":"2009/08/22 00:00:00 -0400"},"longitude":-77.4901275,"id":"aeltf1qonuop","location":"Michaux State Forest"},"type":"Feature","geometry":{"type":"Point","coordinates":[-77.4901275,39.7526403]}},{"properties":{"latitude":39.7204159,"column_5":1,"date":{"end_time":"2009/08/24 00:00:00 -0400","original":"8/23/2009","granularity":"day","time":"2009/08/23 00:00:00 -0400"},"longitude":-77.5066928,"id":"aeltf1vt6wir","location":"Pen Mar"},"type":"Feature","geometry":{"type":"Point","coordinates":[-77.5066928,39.7204159]}},{"properties":{"latitude":39.2839084,"column_5":1,"date":{"end_time":"2009/09/02 00:00:00 -0400","original":"9/1/2009","granularity":"day","time":"2009/09/01 00:00:00 -0400"},"longitude":-76.6212487,"id":"aeltf20anqxo","location":"Camden Yards"},"type":"Feature","geometry":{"type":"Point","coordinates":[-76.6212487,39.2839084]}},{"properties":{"latitude":39.4089591,"column_5":1,"date":{"end_time":"2009/11/22 00:00:00 -0500","original":"11/21/2009","granularity":"day","time":"2009/11/21 00:00:00 -0500"},"longitude":-76.6913509,"id":"aeltf21t9vsk","location":"St. Timothy's School"},"type":"Feature","geometry":{"type":"Point","coordinates":[-76.6913509,39.4089591]}},{"properties":{"latitude":36.5883103,"column_5":1,"date":{"end_time":"2009/12/20 00:00:00 -0500","original":"12/19/2009","granularity":"day","time":"2009/12/19 00:00:00 -0500"},"longitude":-78.1646347,"id":"aeltf2447e1x","location":"Lake Gaston I-85 Crossing"},"type":"Feature","geometry":{"type":"Point","coordinates":[-78.1646347,36.5883103]}},{"properties":{"latitude":36.0700535,"column_5":1,"date":{"end_time":"2009/12/20 00:00:00 -0500","original":"12/19/2009","granularity":"day","time":"2009/12/19 00:00:00 -0500"},"longitude":-78.7792683,"id":"aeltf1qn65qe","location":"Falls Lake--I-85 Crossing"},"type":"Feature","geometry":{"type":"Point","coordinates":[-78.7792683,36.0700535]}},{"properties":{"latitude":36.5152929,"column_5":1,"date":{"end_time":"2009/12/20 00:00:00 -0500","original":"12/19/2009","granularity":"day","time":"2009/12/19 00:00:00 -0500"},"longitude":-78.2071745,"id":"aeltf24d42ui","location":"I-85 NC Welcome Center"},"type":"Feature","geometry":{"type":"Point","coordinates":[-78.2071745,36.5152929]}},{"properties":{"latitude":34.7144188,"column_5":1,"date":{"end_time":"2009/12/25 00:00:00 -0500","original":"12/24/2009","granularity":"day","time":"2009/12/24 00:00:00 -0500"},"longitude":-76.6608381,"id":"aeltf21za4um","location":"Beaufort Waterfront"},"type":"Feature","geometry":{"type":"Point","coordinates":[-76.6608381,34.7144188]}},{"properties":{"latitude":34.7222498,"column_5":1,"date":{"end_time":"2009/12/25 00:00:00 -0500","original":"12/24/2009","granularity":"day","time":"2009/12/24 00:00:00 -0500"},"longitude":-76.6719103,"id":"aeltf1w1m0kh","location":"Beaufort 70 Bridge"},"type":"Feature","geometry":{"type":"Point","coordinates":[-76.6719103,34.7222498]}},{"properties":{"latitude":34.6905332,"column_5":1,"date":{"end_time":"2009/12/25 00:00:00 -0500","original":"12/24/2009","granularity":"day","time":"2009/12/24 00:00:00 -0500"},"longitude":-76.8598366,"id":"aeltf1r1nrqh","location":"Salter Path"},"type":"Feature","geometry":{"type":"Point","coordinates":[-76.8598366,34.6905332]}},{"properties":{"latitude":34.6877103,"column_5":1,"date":{"end_time":"2009/12/25 00:00:00 -0500","original":"12/24/2009","granularity":"day","time":"2009/12/24 00:00:00 -0500"},"longitude":-76.8950272,"id":"aeltf1ygmlp7","location":"Indian Beach"},"type":"Feature","geometry":{"type":"Point","coordinates":[-76.8950272,34.6877103]}},{"properties":{"latitude":34.6916536,"column_5":1,"date":{"end_time":"2009/12/26 00:00:00 -0500","original":"12/25/2009","granularity":"day","time":"2009/12/25 00:00:00 -0500"},"longitude":-77.1290123,"id":"aeltf1r1139l","location":"St. Mildred Catholic Church"},"type":"Feature","geometry":{"type":"Point","coordinates":[-77.1290123,34.6916536]}},{"properties":{"latitude":34.6875691,"column_5":1,"date":{"end_time":"2009/12/27 00:00:00 -0500","original":"12/26/2009","granularity":"day","time":"2009/12/26 00:00:00 -0500"},"longitude":-77.1164703,"id":"aeltf24ijbi5","location":"Swansboro 24 Bridge"},"type":"Feature","geometry":{"type":"Point","coordinates":[-77.1164703,34.6875691]}},{"properties":{"latitude":34.6682291,"column_5":1,"date":{"end_time":"2009/12/27 00:00:00 -0500","original":"12/26/2009","granularity":"day","time":"2009/12/26 00:00:00 -0500"},"longitude":-77.0601654,"id":"aeltf1ujf1ig","location":"Emerald Isle 58 Bridge"},"type":"Feature","geometry":{"type":"Point","coordinates":[-77.0601654,34.6682291]}},{"properties":{"latitude":36.07264,"column_5":1,"date":{"end_time":"2009/12/27 00:00:00 -0500","original":"12/26/2009","granularity":"day","time":"2009/12/26 00:00:00 -0500"},"longitude":-79.79195,"id":"aeltf1tbets7","location":"Greensboro"},"type":"Feature","geometry":{"type":"Point","coordinates":[-79.79195,36.07264]}},{"properties":{"latitude":35.540302,"column_5":1,"date":{"end_time":"2009/12/31 00:00:00 -0500","original":"12/30/2009","granularity":"day","time":"2009/12/30 00:00:00 -0500"},"longitude":-82.5517094,"id":"aeltf1ptj87q","location":"Biltmore Estate"},"type":"Feature","geometry":{"type":"Point","coordinates":[-82.5517094,35.540302]}},{"properties":{"latitude":36.0678681,"column_5":1,"date":{"end_time":"2010/01/05 00:00:00 -0500","original":"1/4/2010","granularity":"day","time":"2010/01/04 00:00:00 -0500"},"longitude":-80.3359365,"id":"aeltf236nki9","location":"Kester Mill Wallmart Parking Lot"},"type":"Feature","geometry":{"type":"Point","coordinates":[-80.3359365,36.0678681]}},{"properties":{"latitude":37.75904,"column_5":1,"date":{"end_time":"2010/01/07 00:00:00 -0500","original":"1/6/2010","granularity":"day","time":"2010/01/06 00:00:00 -0500"},"longitude":-77.48001,"id":"aeltf23hv3w4","location":"Ashland"},"type":"Feature","geometry":{"type":"Point","coordinates":[-77.48001,37.75904]}},{"properties":{"latitude":0.2949129,"column_5":1,"date":{"end_time":"2010/01/13 00:00:00 -0500","original":"1/12/2010","granularity":"day","time":"2010/01/12 00:00:00 -0500"},"longitude":-78.360157,"id":"aeltf20v42mz","location":"Laguna de Quicocha"},"type":"Feature","geometry":{"type":"Point","coordinates":[-78.360157,0.2949129]}},{"properties":{"latitude":0.0449753,"column_5":1,"date":{"end_time":"2010/01/13 00:00:00 -0500","original":"1/12/2010","granularity":"day","time":"2010/01/12 00:00:00 -0500"},"longitude":-78.2353592,"id":"aeltf24fzpdl","location":"Tabacundo"},"type":"Feature","geometry":{"type":"Point","coordinates":[-78.2353592,0.0449753]}},{"properties":{"latitude":0.0597222,"column_5":1,"date":{"end_time":"2010/01/13 00:00:00 -0500","original":"1/12/2010","granularity":"day","time":"2010/01/12 00:00:00 -0500"},"longitude":-78.2997222,"id":"aeltf1pihvka","location":"Cochasqui"},"type":"Feature","geometry":{"type":"Point","coordinates":[-78.2997222,0.0597222]}},{"properties":{"latitude":0.234403,"column_5":1,"date":{"end_time":"2010/01/15 00:00:00 -0500","original":"1/14/2010","granularity":"day","time":"2010/01/14 00:00:00 -0500"},"longitude":-78.2586193,"id":"aeltf23nm1ia","location":"Otavalo--general area"},"type":"Feature","geometry":{"type":"Point","coordinates":[-78.2586193,0.234403]}},{"properties":{"latitude":0.2980028,"column_5":1,"date":{"end_time":"2010/01/15 00:00:00 -0500","original":"1/14/2010","granularity":"day","time":"2010/01/14 00:00:00 -0500"},"longitude":-78.2817078,"id":"aeltf1x8775p","location":"Cotacachi"},"type":"Feature","geometry":{"type":"Point","coordinates":[-78.2817078,0.2980028]}},{"properties":{"latitude":-0.0872039,"column_5":1,"date":{"end_time":"2010/01/15 00:00:00 -0500","original":"1/14/2010","granularity":"day","time":"2010/01/14 00:00:00 -0500"},"longitude":-78.4859848,"id":"aeltf1tv9gmk","location":"Museo del Sitio Intian"},"type":"Feature","geometry":{"type":"Point","coordinates":[-78.4859848,-0.0872039]}},{"properties":{"latitude":0.0920105,"column_5":1,"date":{"end_time":"2010/01/15 00:00:00 -0500","original":"1/14/2010","granularity":"day","time":"2010/01/14 00:00:00 -0500"},"longitude":-78.1711578,"id":"aeltf1vszet7","location":"San Juan Mill"},"type":"Feature","geometry":{"type":"Point","coordinates":[-78.1711578,0.0920105]}},{"properties":{"latitude":-0.9056477,"column_5":1,"date":{"end_time":"2010/01/16 00:00:00 -0500","original":"1/15/2010","granularity":"day","time":"2010/01/15 00:00:00 -0500"},"longitude":-89.5303345,"id":"aeltf1x0modw","location":"Isla San Cristbal"},"type":"Feature","geometry":{"type":"Point","coordinates":[-89.5303345,-0.9056477]}},{"properties":{"latitude":-2.153028,"column_5":1,"date":{"end_time":"2010/01/16 00:00:00 -0500","original":"1/15/2010","granularity":"day","time":"2010/01/15 00:00:00 -0500"},"longitude":-79.8830509,"id":"aeltf1w0fk5f","location":"Jos Joaqun de Olmedo International Airport"},"type":"Feature","geometry":{"type":"Point","coordinates":[-79.8830509,-2.153028]}},{"properties":{"latitude":-1.2261265,"column_5":1,"date":{"end_time":"2010/01/17 00:00:00 -0500","original":"1/16/2010","granularity":"day","time":"2010/01/16 00:00:00 -0500"},"longitude":-90.4283381,"id":"aeltf1tv7te8","location":"Floreana--Punta Cormorant"},"type":"Feature","geometry":{"type":"Point","coordinates":[-90.4283381,-1.2261265]}},{"properties":{"latitude":-1.3715292,"column_5":1,"date":{"end_time":"2010/01/17 00:00:00 -0500","original":"1/16/2010","granularity":"day","time":"2010/01/16 00:00:00 -0500"},"longitude":-89.7439885,"id":"aeltf1qzq82p","location":"Isla Espanola--Punta Suarez"},"type":"Feature","geometry":{"type":"Point","coordinates":[-89.7439885,-1.3715292]}},{"properties":{"latitude":-1.3511931,"column_5":1,"date":{"end_time":"2010/01/17 00:00:00 -0500","original":"1/16/2010","granularity":"day","time":"2010/01/16 00:00:00 -0500"},"longitude":-90.0878906,"id":"aeltf1uwh36m","location":"Galapagos National Park"},"type":"Feature","geometry":{"type":"Point","coordinates":[-90.0878906,-1.3511931]}},{"properties":{"latitude":-0.05054,"column_5":1,"date":{"end_time":"2010/01/18 00:00:00 -0500","original":"1/17/2010","granularity":"day","time":"2010/01/17 00:00:00 -0500"},"longitude":-91.5629783,"id":"aeltf1yin0x0","location":"Isabela--northwest"},"type":"Feature","geometry":{"type":"Point","coordinates":[-91.5629783,-0.05054]}},{"properties":{"latitude":-0.2645507,"column_5":1,"date":{"end_time":"2010/01/18 00:00:00 -0500","original":"1/17/2010","granularity":"day","time":"2010/01/17 00:00:00 -0500"},"longitude":-91.4459467,"id":"aeltf1vfmqgg","location":"Isla Fernandina--Espinoza Point"},"type":"Feature","geometry":{"type":"Point","coordinates":[-91.4459467,-0.2645507]}},{"properties":{"latitude":-0.7033648,"column_5":1,"date":{"end_time":"2010/01/19 00:00:00 -0500","original":"1/18/2010","granularity":"day","time":"2010/01/18 00:00:00 -0500"},"longitude":-90.3263283,"id":"aeltf1vy73hx","location":"Isla Santa Cruz"},"type":"Feature","geometry":{"type":"Point","coordinates":[-90.3263283,-0.7033648]}},{"properties":{"latitude":-0.7416423,"column_5":1,"date":{"end_time":"2010/01/19 00:00:00 -0500","original":"1/18/2010","granularity":"day","time":"2010/01/18 00:00:00 -0500"},"longitude":-90.3051281,"id":"aeltf1x6kcup","location":"Puerto Ayora--Charles Darwin Research Station"},"type":"Feature","geometry":{"type":"Point","coordinates":[-90.3051281,-0.7416423]}},{"properties":{"latitude":-0.4696191,"column_5":1,"date":{"end_time":"2010/01/20 00:00:00 -0500","original":"1/19/2010","granularity":"day","time":"2010/01/19 00:00:00 -0500"},"longitude":-76.9602776,"id":"aeltf1txu54o","location":"Coca"},"type":"Feature","geometry":{"type":"Point","coordinates":[-76.9602776,-0.4696191]}},{"properties":{"latitude":-0.462884,"column_5":1,"date":{"end_time":"2010/01/23 00:00:00 -0500","original":"1/22/2010","granularity":"day","time":"2010/01/22 00:00:00 -0500"},"longitude":-76.987536,"id":"aeltf21jhik0","location":"Francisco de Orellana Airport"},"type":"Feature","geometry":{"type":"Point","coordinates":[-76.987536,-0.462884]}},{"properties":{"latitude":39.3396414,"column_5":1,"date":{"end_time":"2010/02/05 00:00:00 -0500","original":"2/4/2010","granularity":"day","time":"2010/02/04 00:00:00 -0500"},"longitude":-76.6295958,"id":"aeltf1vyr5as","location":"West University-Keswick"},"type":"Feature","geometry":{"type":"Point","coordinates":[-76.6295958,39.3396414]}},{"properties":{"latitude":35.5490513,"column_5":1,"date":{"end_time":"2010/05/21 00:00:00 -0400","original":"5/20/2010","granularity":"day","time":"2010/05/20 00:00:00 -0400"},"longitude":-80.4947716,"id":"aeltf1xivvq3","location":"Tiger World"},"type":"Feature","geometry":{"type":"Point","coordinates":[-80.4947716,35.5490513]}},{"properties":{"latitude":35.67342,"column_5":1,"date":{"end_time":"2010/05/21 00:00:00 -0400","original":"5/20/2010","granularity":"day","time":"2010/05/20 00:00:00 -0400"},"longitude":-80.4738,"id":"aeltf23zris9","location":"Rowan"},"type":"Feature","geometry":{"type":"Point","coordinates":[-80.4738,35.67342]}},{"properties":{"latitude":35.34738,"column_5":1,"date":{"end_time":"2010/05/21 00:00:00 -0400","original":"5/20/2010","granularity":"day","time":"2010/05/20 00:00:00 -0400"},"longitude":-80.53702,"id":"aeltf1oul4of","location":"Cabarrus"},"type":"Feature","geometry":{"type":"Point","coordinates":[-80.53702,35.34738]}},{"properties":{"latitude":36.1164529,"column_5":1,"date":{"end_time":"2010/05/23 00:00:00 -0400","original":"5/22/2010","granularity":"day","time":"2010/05/22 00:00:00 -0400"},"longitude":-81.785574,"id":"aeltf1tvce11","location":"Grandfather Mountain SP- Watauga"},"type":"Feature","geometry":{"type":"Point","coordinates":[-81.785574,36.1164529]}},{"properties":{"latitude":36.14593,"column_5":1,"date":{"end_time":"2010/05/23 00:00:00 -0400","original":"5/22/2010","granularity":"day","time":"2010/05/22 00:00:00 -0400"},"longitude":-81.16061,"id":"aeltf1zxdtyu","location":"Wilkesboro"},"type":"Feature","geometry":{"type":"Point","coordinates":[-81.16061,36.14593]}},{"properties":{"latitude":36.1113219,"column_5":1,"date":{"end_time":"2010/05/23 00:00:00 -0400","original":"5/22/2010","granularity":"day","time":"2010/05/22 00:00:00 -0400"},"longitude":-81.7957878,"id":"aeltf1p7fwy5","location":"Grandfather Mountain SP- Caldwell"},"type":"Feature","geometry":{"type":"Point","coordinates":[-81.7957878,36.1113219]}},{"properties":{"latitude":36.21683,"column_5":1,"date":{"end_time":"2010/05/24 00:00:00 -0400","original":"5/23/2010","granularity":"day","time":"2010/05/23 00:00:00 -0400"},"longitude":-81.67453,"id":"aeltf1yr1w0l","location":"Boone"},"type":"Feature","geometry":{"type":"Point","coordinates":[-81.67453,36.21683]}},{"properties":{"latitude":36.0162682,"column_5":1,"date":{"end_time":"2010/05/28 00:00:00 -0400","original":"5/27/2010","granularity":"day","time":"2010/05/27 00:00:00 -0400"},"longitude":-80.4204369,"id":"aeltf1rhnp4b","location":"BB&amp;T Soccer Park"},"type":"Feature","geometry":{"type":"Point","coordinates":[-80.4204369,36.0162682]}},{"properties":{"latitude":36.3642478,"column_5":1,"date":{"end_time":"2010/05/30 00:00:00 -0400","original":"5/29/2010","granularity":"day","time":"2010/05/29 00:00:00 -0400"},"longitude":-80.7689953,"id":"aeltf1ychicl","location":"Shelton Vineyards"},"type":"Feature","geometry":{"type":"Point","coordinates":[-80.7689953,36.3642478]}},{"properties":{"latitude":36.39968,"column_5":1,"date":{"end_time":"2010/05/30 00:00:00 -0400","original":"5/29/2010","granularity":"day","time":"2010/05/29 00:00:00 -0400"},"longitude":-80.70033,"id":"aeltf1q5amek","location":"Surry"},"type":"Feature","geometry":{"type":"Point","coordinates":[-80.70033,36.39968]}},{"properties":{"latitude":36.91711,"column_5":1,"date":{"end_time":"2010/05/31 00:00:00 -0400","original":"5/30/2010","granularity":"day","time":"2010/05/30 00:00:00 -0400"},"longitude":-80.3651,"id":"aeltf1vquiqs","location":"Floyd"},"type":"Feature","geometry":{"type":"Point","coordinates":[-80.3651,36.91711]}},{"properties":{"latitude":36.71179,"column_5":1,"date":{"end_time":"2010/05/31 00:00:00 -0400","original":"5/30/2010","granularity":"day","time":"2010/05/30 00:00:00 -0400"},"longitude":-80.33098,"id":"aeltf1pyz6cs","location":"Patrick"},"type":"Feature","geometry":{"type":"Point","coordinates":[-80.33098,36.71179]}},{"properties":{"latitude":36.092459,"column_5":1,"date":{"end_time":"2010/06/02 00:00:00 -0400","original":"6/1/2010","granularity":"day","time":"2010/06/01 00:00:00 -0400"},"longitude":-80.5166531,"id":"aeltf1wq7qq4","location":"Shallowford Rd Yadkin Bridge"},"type":"Feature","geometry":{"type":"Point","coordinates":[-80.5166531,36.092459]}},{"properties":{"latitude":43.7616722,"column_5":1,"date":{"end_time":"2010/07/04 00:00:00 -0400","original":"7/3/2010","granularity":"day","time":"2010/07/03 00:00:00 -0400"},"longitude":-71.4791107,"id":"aeltf1oudg4r","location":"Squam Lake-Carroll"},"type":"Feature","geometry":{"type":"Point","coordinates":[-71.4791107,43.7616722]}},{"properties":{"latitude":43.79037,"column_5":1,"date":{"end_time":"2010/07/04 00:00:00 -0400","original":"7/3/2010","granularity":"day","time":"2010/07/03 00:00:00 -0400"},"longitude":-71.41122,"id":"aeltf21qaab5","location":"Sandwich"},"type":"Feature","geometry":{"type":"Point","coordinates":[-71.41122,43.79037]}},{"properties":{"latitude":43.65757,"column_5":1,"date":{"end_time":"2010/07/06 00:00:00 -0400","original":"7/5/2010","granularity":"day","time":"2010/07/05 00:00:00 -0400"},"longitude":-71.50032,"id":"aeltf1r45cni","location":"Meredith"},"type":"Feature","geometry":{"type":"Point","coordinates":[-71.50032,43.65757]}},{"properties":{"latitude":43.7327784,"column_5":1,"date":{"end_time":"2010/07/06 00:00:00 -0400","original":"7/5/2010","granularity":"day","time":"2010/07/05 00:00:00 -0400"},"longitude":-71.5891027,"id":"aeltf21it7vs","location":"Squam Lake Natural Science Center"},"type":"Feature","geometry":{"type":"Point","coordinates":[-71.5891027,43.7327784]}},{"properties":{"latitude":43.75477,"column_5":1,"date":{"end_time":"2010/07/09 00:00:00 -0400","original":"7/8/2010","granularity":"day","time":"2010/07/08 00:00:00 -0400"},"longitude":-71.39672,"id":"aeltf1rp6qbw","location":"Moultonborough"},"type":"Feature","geometry":{"type":"Point","coordinates":[-71.39672,43.75477]}},{"properties":{"latitude":43.7808857,"column_5":1,"date":{"end_time":"2010/07/10 00:00:00 -0400","original":"7/9/2010","granularity":"day","time":"2010/07/09 00:00:00 -0400"},"longitude":-71.5419388,"id":"aeltf1zayjp8","location":"West Rattlesnake"},"type":"Feature","geometry":{"type":"Point","coordinates":[-71.5419388,43.7808857]}},{"properties":{"latitude":42.95132,"column_5":1,"date":{"end_time":"2010/07/11 00:00:00 -0400","original":"7/10/2010","granularity":"day","time":"2010/07/10 00:00:00 -0400"},"longitude":-71.65057,"id":"aeltf22nx03u","location":"Hillsborough"},"type":"Feature","geometry":{"type":"Point","coordinates":[-71.65057,42.95132]}},{"properties":{"latitude":43.30711,"column_5":1,"date":{"end_time":"2010/07/11 00:00:00 -0400","original":"7/10/2010","granularity":"day","time":"2010/07/10 00:00:00 -0400"},"longitude":-71.66669,"id":"aeltf23nm8uh","location":"Merrimack"},"type":"Feature","geometry":{"type":"Point","coordinates":[-71.66669,43.30711]}},{"properties":{"latitude":43.51751,"column_5":1,"date":{"end_time":"2010/07/11 00:00:00 -0400","original":"7/10/2010","granularity":"day","time":"2010/07/10 00:00:00 -0400"},"longitude":-71.44705,"id":"aeltf250q21z","location":"Belknap"},"type":"Feature","geometry":{"type":"Point","coordinates":[-71.44705,43.51751]}},{"properties":{"latitude":36.09832,"column_5":1,"date":{"end_time":"2010/08/05 00:00:00 -0400","original":"8/4/2010","granularity":"day","time":"2010/08/04 00:00:00 -0400"},"longitude":-81.90485,"id":"aeltf20oteex","location":"Avery"},"type":"Feature","geometry":{"type":"Point","coordinates":[-81.90485,36.09832]}},{"properties":{"latitude":35.6550646,"column_5":1,"date":{"end_time":"2010/08/13 00:00:00 -0400","original":"8/12/2010","granularity":"day","time":"2010/08/12 00:00:00 -0400"},"longitude":-80.2949524,"id":"aeltf1p889ku","location":"High Rock Lake"},"type":"Feature","geometry":{"type":"Point","coordinates":[-80.2949524,35.6550646]}},{"properties":{"latitude":35.14731,"column_5":1,"date":{"end_time":"2010/08/15 00:00:00 -0400","original":"8/14/2010","granularity":"day","time":"2010/08/14 00:00:00 -0400"},"longitude":-76.74817,"id":"aeltf1tcetd9","location":"Pamlico"},"type":"Feature","geometry":{"type":"Point","coordinates":[-76.74817,35.14731]}},{"properties":{"latitude":35.853,"column_5":1,"date":{"end_time":"2010/08/19 00:00:00 -0400","original":"8/18/2010","granularity":"day","time":"2010/08/18 00:00:00 -0400"},"longitude":-78.747,"id":"aeltf1p2ojod","location":"William B. Umstead SP"},"type":"Feature","geometry":{"type":"Point","coordinates":[-78.747,35.853]}},{"properties":{"latitude":35.9138358,"column_5":1,"date":{"end_time":"2010/08/23 00:00:00 -0400","original":"8/22/2010","granularity":"day","time":"2010/08/22 00:00:00 -0400"},"longitude":-81.0833931,"id":"aeltf1zz9vz5","location":"Hiddenite"},"type":"Feature","geometry":{"type":"Point","coordinates":[-81.0833931,35.9138358]}},{"properties":{"latitude":38.949883,"column_5":1,"date":{"end_time":"2010/09/19 00:00:00 -0400","original":"9/18/2010","granularity":"day","time":"2010/09/18 00:00:00 -0400"},"longitude":-76.23053,"id":"aeltf1rnbwvr","location":"Chesapeake Bay Environmental Center (Horsehead)"},"type":"Feature","geometry":{"type":"Point","coordinates":[-76.23053,38.949883]}},{"properties":{"latitude":39.502948,"column_5":1,"date":{"end_time":"2010/10/11 00:00:00 -0400","original":"10/10/2010","granularity":"day","time":"2010/10/10 00:00:00 -0400"},"longitude":-76.6332865,"id":"aeltf22pobe0","location":"NCRR Trail Paper Mill Road"},"type":"Feature","geometry":{"type":"Point","coordinates":[-76.6332865,39.502948]}},{"properties":{"latitude":38.40829,"column_5":1,"date":{"end_time":"2010/10/18 00:00:00 -0400","original":"10/17/2010","granularity":"day","time":"2010/10/17 00:00:00 -0400"},"longitude":-75.60551,"id":"aeltf24ol42q","location":"Wicomico"},"type":"Feature","geometry":{"type":"Point","coordinates":[-75.60551,38.40829]}},{"properties":{"latitude":39.4215911,"column_5":1,"date":{"end_time":"2010/10/25 00:00:00 -0400","original":"10/24/2010","granularity":"day","time":"2010/10/24 00:00:00 -0400"},"longitude":-76.7123687,"id":"aeltf22lrt70","location":"North Run Farm"},"type":"Feature","geometry":{"type":"Point","coordinates":[-76.7123687,39.4215911]}},{"properties":{"latitude":39.6058204,"column_5":1,"date":{"end_time":"2010/12/15 00:00:00 -0500","original":"12/14/2010","granularity":"day","time":"2010/12/14 00:00:00 -0500"},"longitude":-76.8632913,"id":"aeltf22je3i2","location":"Panther x Shiloh Rd - Carroll"},"type":"Feature","geometry":{"type":"Point","coordinates":[-76.8632913,39.6058204]}},{"properties":{"latitude":35.3697265,"column_5":1,"date":{"end_time":"2010/12/23 00:00:00 -0500","original":"12/22/2010","granularity":"day","time":"2010/12/22 00:00:00 -0500"},"longitude":-80.9332108,"id":"aeltf1xpctdp","location":"Neck Road Boating Access Area"},"type":"Feature","geometry":{"type":"Point","coordinates":[-80.9332108,35.3697265]}},{"properties":{"latitude":35.6311268,"column_5":1,"date":{"end_time":"2010/12/23 00:00:00 -0500","original":"12/22/2010","granularity":"day","time":"2010/12/22 00:00:00 -0500"},"longitude":-80.86357,"id":"aeltf1swrzz1","location":"Iredell I-77 Rest Stop"},"type":"Feature","geometry":{"type":"Point","coordinates":[-80.86357,35.6311268]}},{"properties":{"latitude":35.4281026,"column_5":1,"date":{"end_time":"2010/12/23 00:00:00 -0500","original":"12/22/2010","granularity":"day","time":"2010/12/22 00:00:00 -0500"},"longitude":-80.9597647,"id":"aeltf22xo29k","location":"Dam Viewing Parking Lot"},"type":"Feature","geometry":{"type":"Point","coordinates":[-80.9597647,35.4281026]}},{"properties":{"latitude":35.78021,"column_5":1,"date":{"end_time":"2010/12/23 00:00:00 -0500","original":"12/22/2010","granularity":"day","time":"2010/12/22 00:00:00 -0500"},"longitude":-80.89903,"id":"aeltf1plhcb0","location":"Iredell"},"type":"Feature","geometry":{"type":"Point","coordinates":[-80.89903,35.78021]}},{"properties":{"latitude":36.1511131,"column_5":1,"date":{"end_time":"2011/01/04 00:00:00 -0500","original":"1/3/2011","granularity":"day","time":"2011/01/03 00:00:00 -0500"},"longitude":-80.2993298,"id":"aeltf1r4zrcb","location":"Bethabara City Park"},"type":"Feature","geometry":{"type":"Point","coordinates":[-80.2993298,36.1511131]}},{"properties":{"latitude":35.7994631,"column_5":1,"date":{"end_time":"2011/01/05 00:00:00 -0500","original":"1/4/2011","granularity":"day","time":"2011/01/04 00:00:00 -0500"},"longitude":-80.467751,"id":"aeltf212di1a","location":"Boone's Cave Park"},"type":"Feature","geometry":{"type":"Point","coordinates":[-80.467751,35.7994631]}},{"properties":{"latitude":36.07074,"column_5":1,"date":{"end_time":"2011/01/06 00:00:00 -0500","original":"1/5/2011","granularity":"day","time":"2011/01/05 00:00:00 -0500"},"longitude":-79.78635,"id":"aeltf209pzjn","location":"Guilford"},"type":"Feature","geometry":{"type":"Point","coordinates":[-79.78635,36.07074]}},{"properties":{"latitude":36.09594,"column_5":1,"date":{"end_time":"2011/01/06 00:00:00 -0500","original":"1/5/2011","granularity":"day","time":"2011/01/05 00:00:00 -0500"},"longitude":-79.26694,"id":"aeltf1rfsett","location":"Mebane"},"type":"Feature","geometry":{"type":"Point","coordinates":[-79.26694,36.09594]}},{"properties":{"latitude":40.02002,"column_5":1,"date":{"end_time":"2011/01/07 00:00:00 -0500","original":"1/6/2011","granularity":"day","time":"2011/01/06 00:00:00 -0500"},"longitude":-76.31263,"id":"aeltf1pkutxd","location":"Lancaster"},"type":"Feature","geometry":{"type":"Point","coordinates":[-76.31263,40.02002]}},{"properties":{"latitude":40.1018,"column_5":1,"date":{"end_time":"2011/01/08 00:00:00 -0500","original":"1/7/2011","granularity":"day","time":"2011/01/07 00:00:00 -0500"},"longitude":-76.08527,"id":"aeltf1uk3knd","location":"New Holland"},"type":"Feature","geometry":{"type":"Point","coordinates":[-76.08527,40.1018]}},{"properties":{"latitude":40.214149,"column_5":1,"date":{"end_time":"2011/01/09 00:00:00 -0500","original":"1/8/2011","granularity":"day","time":"2011/01/08 00:00:00 -0500"},"longitude":-76.3301057,"id":"aeltf21my303","location":"Wolf Sanctuary of PA"},"type":"Feature","geometry":{"type":"Point","coordinates":[-76.3301057,40.214149]}},{"properties":{"latitude":39.5326896,"column_5":1,"date":{"end_time":"2011/01/14 00:00:00 -0500","original":"1/13/2011","granularity":"day","time":"2011/01/13 00:00:00 -0500"},"longitude":-77.3075241,"id":"aeltf1xw1uac","location":"Woodsboro Park"},"type":"Feature","geometry":{"type":"Point","coordinates":[-77.3075241,39.5326896]}},{"properties":{"latitude":39.163,"column_5":1,"date":{"end_time":"2011/01/17 00:00:00 -0500","original":"1/16/2011","granularity":"day","time":"2011/01/16 00:00:00 -0500"},"longitude":-76.48,"id":"aeltf20no3bx","location":"Fort Smallwood Park"},"type":"Feature","geometry":{"type":"Point","coordinates":[-76.48,39.163]}},{"properties":{"latitude":39.23937,"column_5":1,"date":{"end_time":"2011/01/18 00:00:00 -0500","original":"1/17/2011","granularity":"day","time":"2011/01/17 00:00:00 -0500"},"longitude":-76.09656,"id":"aeltf2344hqd","location":"Kent"},"type":"Feature","geometry":{"type":"Point","coordinates":[-76.09656,39.23937]}},{"properties":{"latitude":39.1790795,"column_5":1,"date":{"end_time":"2011/01/18 00:00:00 -0500","original":"1/17/2011","granularity":"day","time":"2011/01/17 00:00:00 -0500"},"longitude":-76.182332,"id":"aeltf1rc7k4r","location":"Chesapeake Farms"},"type":"Feature","geometry":{"type":"Point","coordinates":[-76.182332,39.1790795]}},{"properties":{"latitude":39.0347918,"column_5":1,"date":{"end_time":"2011/01/18 00:00:00 -0500","original":"1/17/2011","granularity":"day","time":"2011/01/17 00:00:00 -0500"},"longitude":-76.2258053,"id":"aeltf1sfa4wq","location":"Eastern Neck National Wildlife Refuge"},"type":"Feature","geometry":{"type":"Point","coordinates":[-76.2258053,39.0347918]}},{"properties":{"latitude":38.9804292,"column_5":1,"date":{"end_time":"2011/01/18 00:00:00 -0500","original":"1/17/2011","granularity":"day","time":"2011/01/17 00:00:00 -0500"},"longitude":-76.333952,"id":"aeltf1p7i90j","location":"Bay Bridge-Hemingway's"},"type":"Feature","geometry":{"type":"Point","coordinates":[-76.333952,38.9804292]}},{"properties":{"latitude":39.4851,"column_5":1,"date":{"end_time":"2011/01/23 00:00:00 -0500","original":"1/22/2011","granularity":"day","time":"2011/01/22 00:00:00 -0500"},"longitude":-77.2403,"id":"aeltf1wi9dv6","location":"Libertytown"},"type":"Feature","geometry":{"type":"Point","coordinates":[-77.2403,39.4851]}},{"properties":{"latitude":39.3443875,"column_5":1,"date":{"end_time":"2011/03/11 00:00:00 -0500","original":"3/10/2011","granularity":"day","time":"2011/03/10 00:00:00 -0500"},"longitude":-76.6155195,"id":"aeltf20bhtxa","location":"Cold Spring Reservoir"},"type":"Feature","geometry":{"type":"Point","coordinates":[-76.6155195,39.3443875]}},{"properties":{"latitude":36.257286,"column_5":1,"date":{"end_time":"2011/03/25 00:00:00 -0400","original":"3/24/2011","granularity":"day","time":"2011/03/24 00:00:00 -0400"},"longitude":-80.5036926,"id":"aeltf1pag2wo","location":"Pilot Mountain SP- Yadkin County"},"type":"Feature","geometry":{"type":"Point","coordinates":[-80.5036926,36.257286]}},{"properties":{"latitude":39.4614117,"column_5":1,"date":{"end_time":"2011/04/11 00:00:00 -0400","original":"4/10/2011","granularity":"day","time":"2011/04/10 00:00:00 -0400"},"longitude":-76.6561604,"id":"aeltf22w2sxx","location":"Cockeysville Quarry"},"type":"Feature","geometry":{"type":"Point","coordinates":[-76.6561604,39.4614117]}},{"properties":{"latitude":37.4693489,"column_5":1,"date":{"end_time":"2011/05/21 00:00:00 -0400","original":"5/20/2011","granularity":"day","time":"2011/05/20 00:00:00 -0400"},"longitude":-79.8119724,"id":"aeltf255tx9q","location":"Botetourt I-81 Rest Stop"},"type":"Feature","geometry":{"type":"Point","coordinates":[-79.8119724,37.4693489]}},{"properties":{"latitude":35.6417778,"column_5":1,"date":{"end_time":"2011/05/26 00:00:00 -0400","original":"5/25/2011","granularity":"day","time":"2011/05/25 00:00:00 -0400"},"longitude":-80.6580806,"id":"aeltf2107xvw","location":"Kerr Mill Park"},"type":"Feature","geometry":{"type":"Point","coordinates":[-80.6580806,35.6417778]}},{"properties":{"latitude":35.7770876,"column_5":1,"date":{"end_time":"2011/05/26 00:00:00 -0400","original":"5/25/2011","granularity":"day","time":"2011/05/25 00:00:00 -0400"},"longitude":-80.5056667,"id":"aeltf24pfsv1","location":"Highway 601 Boat Access-Rowan"},"type":"Feature","geometry":{"type":"Point","coordinates":[-80.5056667,35.7770876]}},{"properties":{"latitude":35.65844,"column_5":1,"date":{"end_time":"2011/05/26 00:00:00 -0400","original":"5/25/2011","granularity":"day","time":"2011/05/25 00:00:00 -0400"},"longitude":-80.72669,"id":"aeltf24zr436","location":"Mount Ulla"},"type":"Feature","geometry":{"type":"Point","coordinates":[-80.72669,35.65844]}},{"properties":{"latitude":36.4159642,"column_5":1,"date":{"end_time":"2011/06/01 00:00:00 -0400","original":"5/31/2011","granularity":"day","time":"2011/05/31 00:00:00 -0400"},"longitude":-81.3868904,"id":"aeltf23umovb","location":"New River SP--Wagoner Access/Bill Bledsoe Rd."},"type":"Feature","geometry":{"type":"Point","coordinates":[-81.3868904,36.4159642]}},{"properties":{"latitude":36.46924,"column_5":1,"date":{"end_time":"2011/06/01 00:00:00 -0400","original":"5/31/2011","granularity":"day","time":"2011/05/31 00:00:00 -0400"},"longitude":-81.1253,"id":"aeltf20u9q3s","location":"Alleghany"},"type":"Feature","geometry":{"type":"Point","coordinates":[-81.1253,36.46924]}},{"properties":{"latitude":36.3914749,"column_5":1,"date":{"end_time":"2011/06/01 00:00:00 -0400","original":"5/31/2011","granularity":"day","time":"2011/05/31 00:00:00 -0400"},"longitude":-81.032238,"id":"aeltf1oun0hb","location":"Stone Mountain SP- Alleghany"},"type":"Feature","geometry":{"type":"Point","coordinates":[-81.032238,36.3914749]}},{"properties":{"latitude":36.243581,"column_5":1,"date":{"end_time":"2011/06/01 00:00:00 -0400","original":"5/31/2011","granularity":"day","time":"2011/05/31 00:00:00 -0400"},"longitude":-81.4548683,"id":"aeltf1s70jyj","location":"E. B. Jeffress Park"},"type":"Feature","geometry":{"type":"Point","coordinates":[-81.4548683,36.243581]}},{"properties":{"latitude":36.30843,"column_5":1,"date":{"end_time":"2011/06/01 00:00:00 -0400","original":"5/31/2011","granularity":"day","time":"2011/05/31 00:00:00 -0400"},"longitude":-81.38702,"id":"aeltf215tx6l","location":"Obids"},"type":"Feature","geometry":{"type":"Point","coordinates":[-81.38702,36.30843]}},{"properties":{"latitude":36.1348767,"column_5":1,"date":{"end_time":"2011/06/01 00:00:00 -0400","original":"5/31/2011","granularity":"day","time":"2011/05/31 00:00:00 -0400"},"longitude":-81.1222637,"id":"aeltf1sasp98","location":"Wilkes 421 Rest Stop"},"type":"Feature","geometry":{"type":"Point","coordinates":[-81.1222637,36.1348767]}},{"properties":{"latitude":36.235291,"column_5":1,"date":{"end_time":"2011/06/01 00:00:00 -0400","original":"5/31/2011","granularity":"day","time":"2011/05/31 00:00:00 -0400"},"longitude":-81.5007126,"id":"aeltf24s5hg6","location":"Elk Mountain Overview"},"type":"Feature","geometry":{"type":"Point","coordinates":[-81.5007126,36.235291]}},{"properties":{"latitude":36.14903,"column_5":1,"date":{"end_time":"2011/06/01 00:00:00 -0400","original":"5/31/2011","granularity":"day","time":"2011/05/31 00:00:00 -0400"},"longitude":-81.32061,"id":"aeltf1qxinof","location":"Mount Pleasant"},"type":"Feature","geometry":{"type":"Point","coordinates":[-81.32061,36.14903]}},{"properties":{"latitude":35.4819199,"column_5":1,"date":{"end_time":"2011/06/03 00:00:00 -0400","original":"6/2/2011","granularity":"day","time":"2011/06/02 00:00:00 -0400"},"longitude":-79.1249514,"id":"aeltf21po0cc","location":"San-Lee Park"},"type":"Feature","geometry":{"type":"Point","coordinates":[-79.1249514,35.4819199]}},{"properties":{"latitude":35.47985,"column_5":1,"date":{"end_time":"2011/06/03 00:00:00 -0400","original":"6/2/2011","granularity":"day","time":"2011/06/02 00:00:00 -0400"},"longitude":-79.18034,"id":"aeltf1ta6qqi","location":"Sanford"},"type":"Feature","geometry":{"type":"Point","coordinates":[-79.18034,35.47985]}},{"properties":{"latitude":35.1559334,"column_5":1,"date":{"end_time":"2011/06/03 00:00:00 -0400","original":"6/2/2011","granularity":"day","time":"2011/06/02 00:00:00 -0400"},"longitude":-79.3689194,"id":"aeltf1pwweo5","location":"Weymouth Woods Nature Preserve"},"type":"Feature","geometry":{"type":"Point","coordinates":[-79.3689194,35.1559334]}},{"properties":{"latitude":35.27535,"column_5":1,"date":{"end_time":"2011/06/03 00:00:00 -0400","original":"6/2/2011","granularity":"day","time":"2011/06/02 00:00:00 -0400"},"longitude":-79.4302,"id":"aeltf1q6wz8x","location":"Moore"},"type":"Feature","geometry":{"type":"Point","coordinates":[-79.4302,35.27535]}},{"properties":{"latitude":35.5141335,"column_5":1,"date":{"end_time":"2011/06/03 00:00:00 -0400","original":"6/2/2011","granularity":"day","time":"2011/06/02 00:00:00 -0400"},"longitude":-79.7843456,"id":"aeltf237aaeq","location":"Randolph I-73 Rest Stop"},"type":"Feature","geometry":{"type":"Point","coordinates":[-79.7843456,35.5141335]}},{"properties":{"latitude":36.29544,"column_5":1,"date":{"end_time":"2011/06/07 00:00:00 -0400","original":"6/6/2011","granularity":"day","time":"2011/06/06 00:00:00 -0400"},"longitude":-80.14167,"id":"aeltf22anxzf","location":"Walnut Cove"},"type":"Feature","geometry":{"type":"Point","coordinates":[-80.14167,36.29544]}},{"properties":{"latitude":35.3705751,"column_5":1,"date":{"end_time":"2011/06/09 00:00:00 -0400","original":"6/8/2011","granularity":"day","time":"2011/06/08 00:00:00 -0400"},"longitude":-78.2975006,"id":"aeltf1ya1bhm","location":"Howell Woods Env. Learning Center"},"type":"Feature","geometry":{"type":"Point","coordinates":[-78.2975006,35.3705751]}},{"properties":{"latitude":35.96068,"column_5":1,"date":{"end_time":"2011/06/09 00:00:00 -0400","original":"6/8/2011","granularity":"day","time":"2011/06/08 00:00:00 -0400"},"longitude":-77.97724,"id":"aeltf1vs7b33","location":"Nash"},"type":"Feature","geometry":{"type":"Point","coordinates":[-77.97724,35.96068]}},{"properties":{"latitude":35.9527629,"column_5":1,"date":{"end_time":"2011/06/09 00:00:00 -0400","original":"6/8/2011","granularity":"day","time":"2011/06/08 00:00:00 -0400"},"longitude":-77.8179753,"id":"aeltf1voyg6q","location":"Sunset Park"},"type":"Feature","geometry":{"type":"Point","coordinates":[-77.8179753,35.9527629]}},{"properties":{"latitude":34.8065448,"column_5":1,"date":{"end_time":"2011/06/09 00:00:00 -0400","original":"6/8/2011","granularity":"day","time":"2011/06/08 00:00:00 -0400"},"longitude":-77.164793,"id":"aeltf22ylb1a","location":"Croatan NF- Long Point Rd"},"type":"Feature","geometry":{"type":"Point","coordinates":[-77.164793,34.8065448]}},{"properties":{"latitude":35.497,"column_5":1,"date":{"end_time":"2011/06/09 00:00:00 -0400","original":"6/8/2011","granularity":"day","time":"2011/06/08 00:00:00 -0400"},"longitude":-77.65193,"id":"aeltf1t61h3f","location":"Greene"},"type":"Feature","geometry":{"type":"Point","coordinates":[-77.65193,35.497]}},{"properties":{"latitude":35.21135,"column_5":1,"date":{"end_time":"2011/06/09 00:00:00 -0400","original":"6/8/2011","granularity":"day","time":"2011/06/08 00:00:00 -0400"},"longitude":-77.61106,"id":"aeltf21okihy","location":"Lenoir"},"type":"Feature","geometry":{"type":"Point","coordinates":[-77.61106,35.21135]}},{"properties":{"latitude":35.57615,"column_5":1,"date":{"end_time":"2011/06/09 00:00:00 -0400","original":"6/8/2011","granularity":"day","time":"2011/06/08 00:00:00 -0400"},"longitude":-77.40073,"id":"aeltf1ra010y","location":"Pitt"},"type":"Feature","geometry":{"type":"Point","coordinates":[-77.40073,35.57615]}},{"properties":{"latitude":35.71453,"column_5":1,"date":{"end_time":"2011/06/09 00:00:00 -0400","original":"6/8/2011","granularity":"day","time":"2011/06/08 00:00:00 -0400"},"longitude":-77.92878,"id":"aeltf1s5k9bj","location":"Wilson"},"type":"Feature","geometry":{"type":"Point","coordinates":[-77.92878,35.71453]}},{"properties":{"latitude":35.4564468,"column_5":1,"date":{"end_time":"2011/06/09 00:00:00 -0400","original":"6/8/2011","granularity":"day","time":"2011/06/08 00:00:00 -0400"},"longitude":-77.6704726,"id":"aeltf23x9akm","location":"Scout Park"},"type":"Feature","geometry":{"type":"Point","coordinates":[-77.6704726,35.4564468]}},{"properties":{"latitude":34.6705586,"column_5":1,"date":{"end_time":"2011/06/11 00:00:00 -0400","original":"6/10/2011","granularity":"day","time":"2011/06/10 00:00:00 -0400"},"longitude":-77.1422195,"id":"aeltf1txixmh","location":"Hammocks Beach SP"},"type":"Feature","geometry":{"type":"Point","coordinates":[-77.1422195,34.6705586]}},{"properties":{"latitude":34.68766,"column_5":1,"date":{"end_time":"2011/06/11 00:00:00 -0400","original":"6/10/2011","granularity":"day","time":"2011/06/10 00:00:00 -0400"},"longitude":-77.07247,"id":"aeltf2105fhn","location":"Cedar Point"},"type":"Feature","geometry":{"type":"Point","coordinates":[-77.07247,34.68766]}},{"properties":{"latitude":34.92377,"column_5":1,"date":{"end_time":"2011/06/12 00:00:00 -0400","original":"6/11/2011","granularity":"day","time":"2011/06/11 00:00:00 -0400"},"longitude":-77.7739,"id":"aeltf1pv6oc3","location":"Beulaville"},"type":"Feature","geometry":{"type":"Point","coordinates":[-77.7739,34.92377]}},{"properties":{"latitude":34.89936,"column_5":1,"date":{"end_time":"2011/06/12 00:00:00 -0400","original":"6/11/2011","granularity":"day","time":"2011/06/11 00:00:00 -0400"},"longitude":-77.54659,"id":"aeltf1qnohb4","location":"Richlands"},"type":"Feature","geometry":{"type":"Point","coordinates":[-77.54659,34.89936]}},{"properties":{"latitude":35.44486,"column_5":1,"date":{"end_time":"2011/06/12 00:00:00 -0400","original":"6/11/2011","granularity":"day","time":"2011/06/11 00:00:00 -0400"},"longitude":-78.42693,"id":"aeltf20zizpo","location":"Four Oaks"},"type":"Feature","geometry":{"type":"Point","coordinates":[-78.42693,35.44486]}},{"properties":{"latitude":36.0037839,"column_5":1,"date":{"end_time":"2011/06/19 00:00:00 -0400","original":"6/18/2011","granularity":"day","time":"2011/06/18 00:00:00 -0400"},"longitude":-79.9748522,"id":"aeltf20b87k1","location":"Wellfleet Dr"},"type":"Feature","geometry":{"type":"Point","coordinates":[-79.9748522,36.0037839]}},{"properties":{"latitude":35.828809,"column_5":1,"date":{"end_time":"2011/08/07 00:00:00 -0400","original":"8/6/2011","granularity":"day","time":"2011/08/06 00:00:00 -0400"},"longitude":-81.1810684,"id":"aeltf1t1jt8g","location":"Alexander from Riverbend Park"},"type":"Feature","geometry":{"type":"Point","coordinates":[-81.1810684,35.828809]}},{"properties":{"latitude":36.3487091,"column_5":1,"date":{"end_time":"2011/08/16 00:00:00 -0400","original":"8/15/2011","granularity":"day","time":"2011/08/15 00:00:00 -0400"},"longitude":-82.2106476,"id":"aeltf21xwn3p","location":"Elizabethton"},"type":"Feature","geometry":{"type":"Point","coordinates":[-82.2106476,36.3487091]}},{"properties":{"latitude":36.107274,"column_5":1,"date":{"end_time":"2011/08/16 00:00:00 -0400","original":"8/15/2011","granularity":"day","time":"2011/08/15 00:00:00 -0400"},"longitude":-82.1095258,"id":"aeltf1zwdt3j","location":"Cherokee National Forest--Carver's Gap (TN)"},"type":"Feature","geometry":{"type":"Point","coordinates":[-82.1095258,36.107274]}},{"properties":{"latitude":36.1482716,"column_5":1,"date":{"end_time":"2011/08/22 00:00:00 -0400","original":"8/21/2011","granularity":"day","time":"2011/08/21 00:00:00 -0400"},"longitude":-79.8540401,"id":"aeltf1rsgq56","location":"Lake Brandt--Horsepasture Creek Mudflats"},"type":"Feature","geometry":{"type":"Point","coordinates":[-79.8540401,36.1482716]}},{"properties":{"latitude":39.1829051,"column_5":1,"date":{"end_time":"2011/11/13 00:00:00 -0500","original":"11/12/2011","granularity":"day","time":"2011/11/12 00:00:00 -0500"},"longitude":-76.8410397,"id":"aeltf1y4tw0x","location":"Lake Elkhorn"},"type":"Feature","geometry":{"type":"Point","coordinates":[-76.8410397,39.1829051]}},{"properties":{"latitude":35.8188434,"column_5":1,"date":{"end_time":"2011/11/27 00:00:00 -0500","original":"11/26/2011","granularity":"day","time":"2011/11/26 00:00:00 -0500"},"longitude":-81.1959991,"id":"aeltf1pupw9k","location":"Lake Hickory - Oxford Access Area"},"type":"Feature","geometry":{"type":"Point","coordinates":[-81.1959991,35.8188434]}},{"properties":{"latitude":39.6610162,"column_5":1,"date":{"end_time":"2011/12/04 00:00:00 -0500","original":"12/3/2011","granularity":"day","time":"2011/12/03 00:00:00 -0500"},"longitude":-77.7604778,"id":"aeltf20iuya5","location":"Hagers Crossing Drive"},"type":"Feature","geometry":{"type":"Point","coordinates":[-77.7604778,39.6610162]}},{"properties":{"latitude":39.4042868,"column_5":1,"date":{"end_time":"2011/12/04 00:00:00 -0500","original":"12/3/2011","granularity":"day","time":"2011/12/03 00:00:00 -0500"},"longitude":-77.6387201,"id":"aeltf1zrb9s1","location":"Gathland State Park-Frederick"},"type":"Feature","geometry":{"type":"Point","coordinates":[-77.6387201,39.4042868]}},{"properties":{"latitude":39.4052959,"column_5":1,"date":{"end_time":"2011/12/04 00:00:00 -0500","original":"12/3/2011","granularity":"day","time":"2011/12/03 00:00:00 -0500"},"longitude":-77.6408352,"id":"aeltf1p6zdbd","location":"Gathland State Park-Washington"},"type":"Feature","geometry":{"type":"Point","coordinates":[-77.6408352,39.4052959]}},{"properties":{"latitude":39.6418,"column_5":1,"date":{"end_time":"2011/12/04 00:00:00 -0500","original":"12/3/2011","granularity":"day","time":"2011/12/03 00:00:00 -0500"},"longitude":-77.72002,"id":"aeltf22u5x4t","location":"Hagerstown"},"type":"Feature","geometry":{"type":"Point","coordinates":[-77.72002,39.6418]}},{"properties":{"latitude":38.4443124,"column_5":1,"date":{"end_time":"2011/12/05 00:00:00 -0500","original":"12/4/2011","granularity":"day","time":"2011/12/04 00:00:00 -0500"},"longitude":-76.1232376,"id":"aeltf1zdegr7","location":"Blackwater NWR--Wildlife Drive"},"type":"Feature","geometry":{"type":"Point","coordinates":[-76.1232376,38.4443124]}},{"properties":{"latitude":38.5121764,"column_5":1,"date":{"end_time":"2011/12/05 00:00:00 -0500","original":"12/4/2011","granularity":"day","time":"2011/12/04 00:00:00 -0500"},"longitude":-76.1029387,"id":"aeltf20swe2g","location":"Egypt Road"},"type":"Feature","geometry":{"type":"Point","coordinates":[-76.1029387,38.5121764]}},{"properties":{"latitude":38.3995276,"column_5":1,"date":{"end_time":"2011/12/05 00:00:00 -0500","original":"12/4/2011","granularity":"day","time":"2011/12/04 00:00:00 -0500"},"longitude":-76.0648727,"id":"aeltf1wgppss","location":"Shorter's Wharf Road"},"type":"Feature","geometry":{"type":"Point","coordinates":[-76.0648727,38.3995276]}},{"properties":{"latitude":38.3236461,"column_5":1,"date":{"end_time":"2011/12/05 00:00:00 -0500","original":"12/4/2011","granularity":"day","time":"2011/12/04 00:00:00 -0500"},"longitude":-76.0690784,"id":"aeltf2059qvg","location":"Cedar Creek Rd. (Dorchester Co)"},"type":"Feature","geometry":{"type":"Point","coordinates":[-76.0690784,38.3236461]}},{"properties":{"latitude":38.4449343,"column_5":1,"date":{"end_time":"2011/12/05 00:00:00 -0500","original":"12/4/2011","granularity":"day","time":"2011/12/04 00:00:00 -0500"},"longitude":-76.1194181,"id":"aeltf1pxy6r1","location":"Blackwater NWR--Visitors Center"},"type":"Feature","geometry":{"type":"Point","coordinates":[-76.1194181,38.4449343]}},{"properties":{"latitude":38.439926,"column_5":1,"date":{"end_time":"2011/12/05 00:00:00 -0500","original":"12/4/2011","granularity":"day","time":"2011/12/04 00:00:00 -0500"},"longitude":-76.0898495,"id":"aeltf1yzjftx","location":"Blackwater NWR--Marsh Edge Trail"},"type":"Feature","geometry":{"type":"Point","coordinates":[-76.0898495,38.439926]}},{"properties":{"latitude":39.5588059,"column_5":1,"date":{"end_time":"2011/12/07 00:00:00 -0500","original":"12/6/2011","granularity":"day","time":"2011/12/06 00:00:00 -0500"},"longitude":-76.0929615,"id":"aeltf20rft6z","location":"Thomas J. Hatern Memorial Bridge"},"type":"Feature","geometry":{"type":"Point","coordinates":[-76.0929615,39.5588059]}},{"properties":{"latitude":36.1774269,"column_5":1,"date":{"end_time":"2011/12/20 00:00:00 -0500","original":"12/19/2011","granularity":"day","time":"2011/12/19 00:00:00 -0500"},"longitude":-79.7975731,"id":"aeltf1s47g0p","location":"Plainfield Marsh"},"type":"Feature","geometry":{"type":"Point","coordinates":[-79.7975731,36.1774269]}},{"properties":{"latitude":36.2002718,"column_5":1,"date":{"end_time":"2011/12/20 00:00:00 -0500","original":"12/19/2011","granularity":"day","time":"2011/12/19 00:00:00 -0500"},"longitude":-79.744823,"id":"aeltf24vdvua","location":"Doggett Rd.; NE Causeway"},"type":"Feature","geometry":{"type":"Point","coordinates":[-79.744823,36.2002718]}},{"properties":{"latitude":36.3030883,"column_5":1,"date":{"end_time":"2011/12/23 00:00:00 -0500","original":"12/22/2011","granularity":"day","time":"2011/12/22 00:00:00 -0500"},"longitude":-80.0129767,"id":"aeltf217suy3","location":"Carolina Marina, Belews Lake"},"type":"Feature","geometry":{"type":"Point","coordinates":[-80.0129767,36.3030883]}},{"properties":{"latitude":36.2802932,"column_5":1,"date":{"end_time":"2011/12/23 00:00:00 -0500","original":"12/22/2011","granularity":"day","time":"2011/12/22 00:00:00 -0500"},"longitude":-80.0363227,"id":"aeltf1q883is","location":"Humphrey's Ridge Family Campground"},"type":"Feature","geometry":{"type":"Point","coordinates":[-80.0363227,36.2802932]}},{"properties":{"latitude":36.31824,"column_5":1,"date":{"end_time":"2011/12/23 00:00:00 -0500","original":"12/22/2011","granularity":"day","time":"2011/12/22 00:00:00 -0500"},"longitude":-79.93056,"id":"aeltf1zfe2j4","location":"Gold Hill"},"type":"Feature","geometry":{"type":"Point","coordinates":[-79.93056,36.31824]}},{"properties":{"latitude":36.40934,"column_5":1,"date":{"end_time":"2011/12/23 00:00:00 -0500","original":"12/22/2011","granularity":"day","time":"2011/12/22 00:00:00 -0500"},"longitude":-80.20587,"id":"aeltf1y4zt8x","location":"Danbury"},"type":"Feature","geometry":{"type":"Point","coordinates":[-80.20587,36.40934]}},{"properties":{"latitude":36.30001,"column_5":1,"date":{"end_time":"2011/12/23 00:00:00 -0500","original":"12/22/2011","granularity":"day","time":"2011/12/22 00:00:00 -0500"},"longitude":-80.0532875,"id":"aeltf23fbzy5","location":"Pine Hall Access Area"},"type":"Feature","geometry":{"type":"Point","coordinates":[-80.0532875,36.30001]}},{"properties":{"latitude":36.06653,"column_5":1,"date":{"end_time":"2011/12/25 00:00:00 -0500","original":"12/24/2011","granularity":"day","time":"2011/12/24 00:00:00 -0500"},"longitude":-81.87043,"id":"aeltf1sxz092","location":"Linville"},"type":"Feature","geometry":{"type":"Point","coordinates":[-81.87043,36.06653]}},{"properties":{"latitude":36.42504,"column_5":1,"date":{"end_time":"2011/12/29 00:00:00 -0500","original":"12/28/2011","granularity":"day","time":"2011/12/28 00:00:00 -0500"},"longitude":-76.70669,"id":"aeltf1z81wyo","location":"Gates"},"type":"Feature","geometry":{"type":"Point","coordinates":[-76.70669,36.42504]}},{"properties":{"latitude":36.17403,"column_5":1,"date":{"end_time":"2011/12/29 00:00:00 -0500","original":"12/28/2011","granularity":"day","time":"2011/12/28 00:00:00 -0500"},"longitude":-76.65329,"id":"aeltf2505g7l","location":"Chowan"},"type":"Feature","geometry":{"type":"Point","coordinates":[-76.65329,36.17403]}},{"properties":{"latitude":36.3587073,"column_5":1,"date":{"end_time":"2011/12/29 00:00:00 -0500","original":"12/28/2011","granularity":"day","time":"2011/12/28 00:00:00 -0500"},"longitude":-75.9451379,"id":"aeltf1wnmf79","location":"Coinjock Boat Access"},"type":"Feature","geometry":{"type":"Point","coordinates":[-75.9451379,36.3587073]}},{"properties":{"latitude":36.433437,"column_5":1,"date":{"end_time":"2011/12/29 00:00:00 -0500","original":"12/28/2011","granularity":"day","time":"2011/12/28 00:00:00 -0500"},"longitude":-76.683712,"id":"aeltf244rou0","location":"Merchants Millpond SP"},"type":"Feature","geometry":{"type":"Point","coordinates":[-76.683712,36.433437]}},{"properties":{"latitude":36.35968,"column_5":1,"date":{"end_time":"2011/12/29 00:00:00 -0500","original":"12/28/2011","granularity":"day","time":"2011/12/28 00:00:00 -0500"},"longitude":-77.48796,"id":"aeltf20cxuxb","location":"Northampton"},"type":"Feature","geometry":{"type":"Point","coordinates":[-77.48796,36.35968]}},{"properties":{"latitude":36.31515,"column_5":1,"date":{"end_time":"2011/12/29 00:00:00 -0500","original":"12/28/2011","granularity":"day","time":"2011/12/28 00:00:00 -0500"},"longitude":-75.95091,"id":"aeltf1w0ptwu","location":"Currituck"},"type":"Feature","geometry":{"type":"Point","coordinates":[-75.95091,36.31515]}},{"properties":{"latitude":36.25245,"column_5":1,"date":{"end_time":"2011/12/29 00:00:00 -0500","original":"12/28/2011","granularity":"day","time":"2011/12/28 00:00:00 -0500"},"longitude":-77.62336,"id":"aeltf22el0ih","location":"Halifax"},"type":"Feature","geometry":{"type":"Point","coordinates":[-77.62336,36.25245]}},{"properties":{"latitude":36.39341,"column_5":1,"date":{"end_time":"2011/12/29 00:00:00 -0500","original":"12/28/2011","granularity":"day","time":"2011/12/28 00:00:00 -0500"},"longitude":-76.96226,"id":"aeltf1q12wfv","location":"Hertford"},"type":"Feature","geometry":{"type":"Point","coordinates":[-76.96226,36.39341]}},{"properties":{"latitude":36.3268996,"column_5":1,"date":{"end_time":"2011/12/29 00:00:00 -0500","original":"12/28/2011","granularity":"day","time":"2011/12/28 00:00:00 -0500"},"longitude":-76.2173209,"id":"aeltf1rpwu9c","location":"Fenwick-Hollowell Memorial Wetland Area"},"type":"Feature","geometry":{"type":"Point","coordinates":[-76.2173209,36.3268996]}},{"properties":{"latitude":36.32595,"column_5":1,"date":{"end_time":"2011/12/29 00:00:00 -0500","original":"12/28/2011","granularity":"day","time":"2011/12/28 00:00:00 -0500"},"longitude":-76.30725,"id":"aeltf22nf51g","location":"Pasquotank"},"type":"Feature","geometry":{"type":"Point","coordinates":[-76.30725,36.32595]}},{"properties":{"latitude":36.227,"column_5":1,"date":{"end_time":"2011/12/29 00:00:00 -0500","original":"12/28/2011","granularity":"day","time":"2011/12/28 00:00:00 -0500"},"longitude":-76.43466,"id":"aeltf1u00n9q","location":"Perquimans"},"type":"Feature","geometry":{"type":"Point","coordinates":[-76.43466,36.227]}},{"properties":{"latitude":36.36305,"column_5":1,"date":{"end_time":"2011/12/29 00:00:00 -0500","original":"12/28/2011","granularity":"day","time":"2011/12/28 00:00:00 -0500"},"longitude":-76.18465,"id":"aeltf22dylxq","location":"Camden"},"type":"Feature","geometry":{"type":"Point","coordinates":[-76.18465,36.36305]}},{"properties":{"latitude":35.1869513,"column_5":1,"date":{"end_time":"2011/12/30 00:00:00 -0500","original":"12/29/2011","granularity":"day","time":"2011/12/29 00:00:00 -0500"},"longitude":-75.7687999,"id":"aeltf23ugi1k","location":"Hatteras Inlet-Hyde"},"type":"Feature","geometry":{"type":"Point","coordinates":[-75.7687999,35.1869513]}},{"properties":{"latitude":35.21938,"column_5":1,"date":{"end_time":"2011/12/30 00:00:00 -0500","original":"12/29/2011","granularity":"day","time":"2011/12/29 00:00:00 -0500"},"longitude":-75.69021,"id":"aeltf1tdv8eo","location":"Hatteras"},"type":"Feature","geometry":{"type":"Point","coordinates":[-75.69021,35.21938]}},{"properties":{"latitude":35.8867126,"column_5":1,"date":{"end_time":"2011/12/31 00:00:00 -0500","original":"12/30/2011","granularity":"day","time":"2011/12/30 00:00:00 -0500"},"longitude":-75.7174602,"id":"aeltf2271kpj","location":"Croatan Sound"},"type":"Feature","geometry":{"type":"Point","coordinates":[-75.7174602,35.8867126]}},{"properties":{"latitude":35.8869212,"column_5":1,"date":{"end_time":"2011/12/31 00:00:00 -0500","original":"12/30/2011","granularity":"day","time":"2011/12/30 00:00:00 -0500"},"longitude":-77.0219682,"id":"aeltf1pd11ql","location":"Kuralt Trail"},"type":"Feature","geometry":{"type":"Point","coordinates":[-77.0219682,35.8869212]}},{"properties":{"latitude":35.8598518,"column_5":1,"date":{"end_time":"2011/12/31 00:00:00 -0500","original":"12/30/2011","granularity":"day","time":"2011/12/30 00:00:00 -0500"},"longitude":-77.0406121,"id":"aeltf215k0om","location":"Williamston Boat Access"},"type":"Feature","geometry":{"type":"Point","coordinates":[-77.0406121,35.8598518]}},{"properties":{"latitude":35.219123,"column_5":1,"date":{"end_time":"2011/12/31 00:00:00 -0500","original":"12/30/2011","granularity":"day","time":"2011/12/30 00:00:00 -0500"},"longitude":-75.6912893,"id":"aeltf1qzxke4","location":"Hatteras Marlin Motel"},"type":"Feature","geometry":{"type":"Point","coordinates":[-75.6912893,35.219123]}},{"properties":{"latitude":35.85921,"column_5":1,"date":{"end_time":"2011/12/31 00:00:00 -0500","original":"12/30/2011","granularity":"day","time":"2011/12/30 00:00:00 -0500"},"longitude":-77.09387,"id":"aeltf24sgbow","location":"Martin"},"type":"Feature","geometry":{"type":"Point","coordinates":[-77.09387,35.85921]}},{"properties":{"latitude":35.88485,"column_5":1,"date":{"end_time":"2011/12/31 00:00:00 -0500","original":"12/30/2011","granularity":"day","time":"2011/12/30 00:00:00 -0500"},"longitude":-78.26502,"id":"aeltf1solpum","location":"Pilot"},"type":"Feature","geometry":{"type":"Point","coordinates":[-78.26502,35.88485]}},{"properties":{"latitude":39.3631365,"column_5":1,"date":{"end_time":"2012/01/13 00:00:00 -0500","original":"1/12/2012","granularity":"day","time":"2012/01/12 00:00:00 -0500"},"longitude":-77.640574,"id":"aeltf1wnb4r8","location":"Kershner's Pond"},"type":"Feature","geometry":{"type":"Point","coordinates":[-77.640574,39.3631365]}},{"properties":{"latitude":39.4178615,"column_5":1,"date":{"end_time":"2012/01/13 00:00:00 -0500","original":"1/12/2012","granularity":"day","time":"2012/01/12 00:00:00 -0500"},"longitude":-77.2069788,"id":"aeltf1qeu8gb","location":"Audrey Carroll Audubon Sanctuary"},"type":"Feature","geometry":{"type":"Point","coordinates":[-77.2069788,39.4178615]}},{"properties":{"latitude":39.6634276,"column_5":1,"date":{"end_time":"2012/01/16 00:00:00 -0500","original":"1/15/2012","granularity":"day","time":"2012/01/15 00:00:00 -0500"},"longitude":-77.2384576,"id":"aeltf20x5a0h","location":"Bullfrog Road, Taneytown"},"type":"Feature","geometry":{"type":"Point","coordinates":[-77.2384576,39.6634276]}},{"properties":{"latitude":39.2382364,"column_5":1,"date":{"end_time":"2012/01/18 00:00:00 -0500","original":"1/17/2012","granularity":"day","time":"2012/01/17 00:00:00 -0500"},"longitude":-76.0149193,"id":"aeltf1syilrj","location":"Buckingham Public Landing"},"type":"Feature","geometry":{"type":"Point","coordinates":[-76.0149193,39.2382364]}},{"properties":{"latitude":39.295249,"column_5":1,"date":{"end_time":"2012/02/22 00:00:00 -0500","original":"2/21/2012","granularity":"day","time":"2012/02/21 00:00:00 -0500"},"longitude":-77.0969214,"id":"aeltf1qagl9s","location":"Jennings Chapel Cemetery"},"type":"Feature","geometry":{"type":"Point","coordinates":[-77.0969214,39.295249]}},{"properties":{"latitude":39.1138774,"column_5":1,"date":{"end_time":"2012/05/05 00:00:00 -0400","original":"5/4/2012","granularity":"day","time":"2012/05/04 00:00:00 -0400"},"longitude":-76.5620226,"id":"aeltf22iiubx","location":"Lake Waterford Park"},"type":"Feature","geometry":{"type":"Point","coordinates":[-76.5620226,39.1138774]}},{"properties":{"latitude":39.2054849,"column_5":1,"date":{"end_time":"2012/05/10 00:00:00 -0400","original":"5/9/2012","granularity":"day","time":"2012/05/09 00:00:00 -0400"},"longitude":-76.5374383,"id":"aeltf1smhv9u","location":"Swan Creek Wetland (Baltimore County)"},"type":"Feature","geometry":{"type":"Point","coordinates":[-76.5374383,39.2054849]}},{"properties":{"latitude":39.6193754,"column_5":1,"date":{"end_time":"2012/05/18 00:00:00 -0400","original":"5/17/2012","granularity":"day","time":"2012/05/17 00:00:00 -0400"},"longitude":-76.1586857,"id":"aeltf1u82y5x","location":"Susquehanna SP--Picnic Area"},"type":"Feature","geometry":{"type":"Point","coordinates":[-76.1586857,39.6193754]}},{"properties":{"latitude":39.6082671,"column_5":1,"date":{"end_time":"2012/05/18 00:00:00 -0400","original":"5/17/2012","granularity":"day","time":"2012/05/17 00:00:00 -0400"},"longitude":-76.1432362,"id":"aeltf1wh5av0","location":"Susquehanna SP--Rock Run"},"type":"Feature","geometry":{"type":"Point","coordinates":[-76.1432362,39.6082671]}},{"properties":{"latitude":39.3232976,"column_5":1,"date":{"end_time":"2012/05/22 00:00:00 -0400","original":"5/21/2012","granularity":"day","time":"2012/05/21 00:00:00 -0400"},"longitude":-77.7104693,"id":"aeltf1wjimuq","location":"Potomac River- 340 Crossing"},"type":"Feature","geometry":{"type":"Point","coordinates":[-77.7104693,39.3232976]}},{"properties":{"latitude":36.5597311,"column_5":1,"date":{"end_time":"2012/05/22 00:00:00 -0400","original":"5/21/2012","granularity":"day","time":"2012/05/21 00:00:00 -0400"},"longitude":-80.7472501,"id":"aeltf1qsqi7r","location":"I-77 NC Welcome Center"},"type":"Feature","geometry":{"type":"Point","coordinates":[-80.7472501,36.5597311]}},{"properties":{"latitude":39.08474,"column_5":1,"date":{"end_time":"2012/05/22 00:00:00 -0400","original":"5/21/2012","granularity":"day","time":"2012/05/21 00:00:00 -0400"},"longitude":-77.64295,"id":"aeltf1zgemne","location":"Loudoun"},"type":"Feature","geometry":{"type":"Point","coordinates":[-77.64295,39.08474]}},{"properties":{"latitude":36.01574,"column_5":1,"date":{"end_time":"2012/05/26 00:00:00 -0400","original":"5/25/2012","granularity":"day","time":"2012/05/25 00:00:00 -0400"},"longitude":-80.53228,"id":"aeltf228d2nn","location":"Farmington"},"type":"Feature","geometry":{"type":"Point","coordinates":[-80.53228,36.01574]}},{"properties":{"latitude":35.5579592,"column_5":1,"date":{"end_time":"2012/05/28 00:00:00 -0400","original":"5/27/2012","granularity":"day","time":"2012/05/27 00:00:00 -0400"},"longitude":-78.9267819,"id":"aeltf1sa8u2x","location":"Kidd's Place"},"type":"Feature","geometry":{"type":"Point","coordinates":[-78.9267819,35.5579592]}},{"properties":{"latitude":35.1435226,"column_5":1,"date":{"end_time":"2012/05/29 00:00:00 -0400","original":"5/28/2012","granularity":"day","time":"2012/05/28 00:00:00 -0400"},"longitude":-80.9144577,"id":"aeltf1r08qbz","location":"Green Ridge Dr. Marsh"},"type":"Feature","geometry":{"type":"Point","coordinates":[-80.9144577,35.1435226]}},{"properties":{"latitude":35.3403901,"column_5":1,"date":{"end_time":"2012/05/29 00:00:00 -0400","original":"5/28/2012","granularity":"day","time":"2012/05/28 00:00:00 -0400"},"longitude":-80.7120148,"id":"aeltf24qb6ct","location":"Tanners Court"},"type":"Feature","geometry":{"type":"Point","coordinates":[-80.7120148,35.3403901]}},{"properties":{"latitude":35.32374,"column_5":1,"date":{"end_time":"2012/05/29 00:00:00 -0400","original":"5/28/2012","granularity":"day","time":"2012/05/28 00:00:00 -0400"},"longitude":-80.65589,"id":"aeltf24thybm","location":"Harrisburg"},"type":"Feature","geometry":{"type":"Point","coordinates":[-80.65589,35.32374]}},{"properties":{"latitude":35.456625,"column_5":1,"date":{"end_time":"2012/05/29 00:00:00 -0400","original":"5/28/2012","granularity":"day","time":"2012/05/28 00:00:00 -0400"},"longitude":-80.5946989,"id":"aeltf228yoqw","location":"Cabarrus I-85 Rest Stop"},"type":"Feature","geometry":{"type":"Point","coordinates":[-80.5946989,35.456625]}},{"properties":{"latitude":40.6448289,"column_5":1,"date":{"end_time":"2012/06/13 00:00:00 -0400","original":"6/12/2012","granularity":"day","time":"2012/06/12 00:00:00 -0400"},"longitude":-73.783493,"id":"aeltf1xnctvc","location":"John F Kennedy International Airport (JFK)"},"type":"Feature","geometry":{"type":"Point","coordinates":[-73.783493,40.6448289]}},{"properties":{"latitude":24.9935309,"column_5":1,"date":{"end_time":"2012/06/15 00:00:00 -0400","original":"6/14/2012","granularity":"day","time":"2012/06/14 00:00:00 -0400"},"longitude":102.7501812,"id":"aeltf21cyjrw","location":"Kunming Wujiaba Airport"},"type":"Feature","geometry":{"type":"Point","coordinates":[102.7501812,24.9935309]}},{"properties":{"latitude":25.0549332,"column_5":1,"date":{"end_time":"2012/06/16 00:00:00 -0400","original":"6/15/2012","granularity":"day","time":"2012/06/15 00:00:00 -0400"},"longitude":102.7081242,"id":"aeltf23vgxwd","location":"Kunming Zoo"},"type":"Feature","geometry":{"type":"Point","coordinates":[102.7081242,25.0549332]}},{"properties":{"latitude":24.9672091,"column_5":1,"date":{"end_time":"2012/06/17 00:00:00 -0400","original":"6/16/2012","granularity":"day","time":"2012/06/16 00:00:00 -0400"},"longitude":102.6661341,"id":"aeltf1vppls6","location":"Haigeng Minigolf Park"},"type":"Feature","geometry":{"type":"Point","coordinates":[102.6661341,24.9672091]}},{"properties":{"latitude":25.0125887,"column_5":1,"date":{"end_time":"2012/06/17 00:00:00 -0400","original":"6/16/2012","granularity":"day","time":"2012/06/16 00:00:00 -0400"},"longitude":102.6627197,"id":"aeltf24k41y8","location":"Dianchi Lake"},"type":"Feature","geometry":{"type":"Point","coordinates":[102.6627197,25.0125887]}},{"properties":{"latitude":25.0665307,"column_5":1,"date":{"end_time":"2012/06/23 00:00:00 -0400","original":"6/22/2012","granularity":"day","time":"2012/06/22 00:00:00 -0400"},"longitude":102.6899498,"id":"aeltf1xpvpmw","location":"Kunming Metallurgy College"},"type":"Feature","geometry":{"type":"Point","coordinates":[102.6899498,25.0665307]}},{"properties":{"latitude":24.8240231,"column_5":1,"date":{"end_time":"2012/06/24 00:00:00 -0400","original":"6/23/2012","granularity":"day","time":"2012/06/23 00:00:00 -0400"},"longitude":103.3239591,"id":"aeltf1wh0nfo","location":"Shilin (Stone Forest)"},"type":"Feature","geometry":{"type":"Point","coordinates":[103.3239591,24.8240231]}},{"properties":{"latitude":24.9395913,"column_5":1,"date":{"end_time":"2012/06/24 00:00:00 -0400","original":"6/23/2012","granularity":"day","time":"2012/06/23 00:00:00 -0400"},"longitude":102.9784238,"id":"aeltf22ob2el","location":"Qidianxiang"},"type":"Feature","geometry":{"type":"Point","coordinates":[102.9784238,24.9395913]}},{"properties":{"latitude":25.1185542,"column_5":1,"date":{"end_time":"2012/06/25 00:00:00 -0400","original":"6/24/2012","granularity":"day","time":"2012/06/24 00:00:00 -0400"},"longitude":102.7020493,"id":"aeltf1x7ujcg","location":"Changchongshan Ecology Park"},"type":"Feature","geometry":{"type":"Point","coordinates":[102.7020493,25.1185542]}},{"properties":{"latitude":24.7813278,"column_5":1,"date":{"end_time":"2012/06/28 00:00:00 -0400","original":"6/27/2012","granularity":"day","time":"2012/06/27 00:00:00 -0400"},"longitude":102.8112732,"id":"aeltf1z2rnpl","location":"Majinpuxiang"},"type":"Feature","geometry":{"type":"Point","coordinates":[102.8112732,24.7813278]}},{"properties":{"latitude":24.6665143,"column_5":1,"date":{"end_time":"2012/06/28 00:00:00 -0400","original":"6/27/2012","granularity":"day","time":"2012/06/27 00:00:00 -0400"},"longitude":102.9072037,"id":"aeltf1ykuwrl","location":"Chengjiang"},"type":"Feature","geometry":{"type":"Point","coordinates":[102.9072037,24.6665143]}},{"properties":{"latitude":24.6579807,"column_5":1,"date":{"end_time":"2012/06/28 00:00:00 -0400","original":"6/27/2012","granularity":"day","time":"2012/06/27 00:00:00 -0400"},"longitude":102.9676701,"id":"aeltf1vvu51f","location":"Maotianshan National Geological Park"},"type":"Feature","geometry":{"type":"Point","coordinates":[102.9676701,24.6579807]}},{"properties":{"latitude":24.933738,"column_5":1,"date":{"end_time":"2012/06/30 00:00:00 -0400","original":"6/29/2012","granularity":"day","time":"2012/06/29 00:00:00 -0400"},"longitude":102.3810386,"id":"aeltf22b24xv","location":"Caopuzhen"},"type":"Feature","geometry":{"type":"Point","coordinates":[102.3810386,24.933738]}},{"properties":{"latitude":25.4991136,"column_5":1,"date":{"end_time":"2012/06/30 00:00:00 -0400","original":"6/29/2012","granularity":"day","time":"2012/06/29 00:00:00 -0400"},"longitude":100.5500641,"id":"aeltf1u6c7jn","location":"Xiangyun"},"type":"Feature","geometry":{"type":"Point","coordinates":[100.5500641,25.4991136]}},{"properties":{"latitude":25.0562766,"column_5":1,"date":{"end_time":"2012/06/30 00:00:00 -0400","original":"6/29/2012","granularity":"day","time":"2012/06/29 00:00:00 -0400"},"longitude":101.5511169,"id":"aeltf21tzuu4","location":"Chuxiong"},"type":"Feature","geometry":{"type":"Point","coordinates":[101.5511169,25.0562766]}},{"properties":{"latitude":25.1934603,"column_5":1,"date":{"end_time":"2012/06/30 00:00:00 -0400","original":"6/29/2012","granularity":"day","time":"2012/06/29 00:00:00 -0400"},"longitude":101.2547149,"id":"aeltf24gzytw","location":"Nanhua"},"type":"Feature","geometry":{"type":"Point","coordinates":[101.2547149,25.1934603]}},{"properties":{"latitude":24.7098741,"column_5":1,"date":{"end_time":"2012/07/02 00:00:00 -0400","original":"7/1/2012","granularity":"day","time":"2012/07/01 00:00:00 -0400"},"longitude":100.1389542,"id":"aeltf1u8kqc8","location":"Mekong River near Mitong"},"type":"Feature","geometry":{"type":"Point","coordinates":[100.1389542,24.7098741]}},{"properties":{"latitude":25.524676,"column_5":1,"date":{"end_time":"2012/07/02 00:00:00 -0400","original":"7/1/2012","granularity":"day","time":"2012/07/01 00:00:00 -0400"},"longitude":100.2652588,"id":"aeltf1yp0muy","location":"Dafengba"},"type":"Feature","geometry":{"type":"Point","coordinates":[100.2652588,25.524676]}},{"properties":{"latitude":24.740262,"column_5":1,"date":{"end_time":"2012/07/02 00:00:00 -0400","original":"7/1/2012","granularity":"day","time":"2012/07/01 00:00:00 -0400"},"longitude":100.3566446,"id":"aeltf1pjakv1","location":"Xiyi"},"type":"Feature","geometry":{"type":"Point","coordinates":[100.3566446,24.740262]}},{"properties":{"latitude":24.6828713,"column_5":1,"date":{"end_time":"2012/07/02 00:00:00 -0400","original":"7/1/2012","granularity":"day","time":"2012/07/01 00:00:00 -0400"},"longitude":100.0980129,"id":"aeltf1z0839c","location":"Xiaowan Dam"},"type":"Feature","geometry":{"type":"Point","coordinates":[100.0980129,24.6828713]}},{"properties":{"latitude":25.254655,"column_5":1,"date":{"end_time":"2012/07/02 00:00:00 -0400","original":"7/1/2012","granularity":"day","time":"2012/07/01 00:00:00 -0400"},"longitude":100.2994969,"id":"aeltf1u8yugy","location":"Weishan"},"type":"Feature","geometry":{"type":"Point","coordinates":[100.2994969,25.254655]}},{"properties":{"latitude":25.8040084,"column_5":1,"date":{"end_time":"2012/07/03 00:00:00 -0400","original":"7/2/2012","granularity":"day","time":"2012/07/02 00:00:00 -0400"},"longitude":100.1448765,"id":"aeltf1ywlqkw","location":"Xinxiyi"},"type":"Feature","geometry":{"type":"Point","coordinates":[100.1448765,25.8040084]}},{"properties":{"latitude":25.8512124,"column_5":1,"date":{"end_time":"2012/07/03 00:00:00 -0400","original":"7/2/2012","granularity":"day","time":"2012/07/02 00:00:00 -0400"},"longitude":100.1364651,"id":"aeltf253o2h6","location":"Xizhou"},"type":"Feature","geometry":{"type":"Point","coordinates":[100.1364651,25.8512124]}},{"properties":{"latitude":25.7084945,"column_5":1,"date":{"end_time":"2012/07/03 00:00:00 -0400","original":"7/2/2012","granularity":"day","time":"2012/07/02 00:00:00 -0400"},"longitude":100.145885,"id":"aeltf1ps4atz","location":"Three Pagodas"},"type":"Feature","geometry":{"type":"Point","coordinates":[100.145885,25.7084945]}},{"properties":{"latitude":24.9640515,"column_5":1,"date":{"end_time":"2012/07/06 00:00:00 -0400","original":"7/5/2012","granularity":"day","time":"2012/07/05 00:00:00 -0400"},"longitude":102.6484999,"id":"aeltf23isbso","location":"Dianchi Lake Management Facility"},"type":"Feature","geometry":{"type":"Point","coordinates":[102.6484999,24.9640515]}},{"properties":{"latitude":25.0173689,"column_5":1,"date":{"end_time":"2012/07/06 00:00:00 -0400","original":"7/5/2012","granularity":"day","time":"2012/07/05 00:00:00 -0400"},"longitude":102.6722799,"id":"aeltf1zp3nxi","location":"Grand View Park"},"type":"Feature","geometry":{"type":"Point","coordinates":[102.6722799,25.0173689]}},{"properties":{"latitude":27.2007436,"column_5":1,"date":{"end_time":"2012/07/08 00:00:00 -0400","original":"7/7/2012","granularity":"day","time":"2012/07/07 00:00:00 -0400"},"longitude":100.0449024,"id":"aeltf1zktkh3","location":"Yangjiahe"},"type":"Feature","geometry":{"type":"Point","coordinates":[100.0449024,27.2007436]}},{"properties":{"latitude":27.383658,"column_5":1,"date":{"end_time":"2012/07/08 00:00:00 -0400","original":"7/7/2012","granularity":"day","time":"2012/07/07 00:00:00 -0400"},"longitude":99.8794167,"id":"aeltf22tv3rc","location":"Wangu"},"type":"Feature","geometry":{"type":"Point","coordinates":[99.8794167,27.383658]}},{"properties":{"latitude":27.3152712,"column_5":1,"date":{"end_time":"2012/07/08 00:00:00 -0400","original":"7/7/2012","granularity":"day","time":"2012/07/07 00:00:00 -0400"},"longitude":99.9892817,"id":"aeltf1z3xxjy","location":"Paiba"},"type":"Feature","geometry":{"type":"Point","coordinates":[99.9892817,27.3152712]}},{"properties":{"latitude":19.9524217,"column_5":1,"date":{"end_time":"2012/07/15 00:00:00 -0400","original":"7/14/2012","granularity":"day","time":"2012/07/14 00:00:00 -0400"},"longitude":99.8862545,"id":"aeltf24ydc9z","location":"Chiang Rai International Airport"},"type":"Feature","geometry":{"type":"Point","coordinates":[99.8862545,19.9524217]}},{"properties":{"latitude":13.7988529,"column_5":1,"date":{"end_time":"2012/07/16 00:00:00 -0400","original":"7/15/2012","granularity":"day","time":"2012/07/15 00:00:00 -0400"},"longitude":100.5503047,"id":"aeltf1yvuvuo","location":"Chatuchak Weekend Market"},"type":"Feature","geometry":{"type":"Point","coordinates":[100.5503047,13.7988529]}},{"properties":{"latitude":13.7235749,"column_5":1,"date":{"end_time":"2012/07/16 00:00:00 -0400","original":"7/15/2012","granularity":"day","time":"2012/07/15 00:00:00 -0400"},"longitude":100.5482137,"id":"aeltf1ydijgq","location":"Pinnacle Lumpinee Hotel"},"type":"Feature","geometry":{"type":"Point","coordinates":[100.5482137,13.7235749]}},{"properties":{"latitude":13.7221128,"column_5":1,"date":{"end_time":"2012/07/16 00:00:00 -0400","original":"7/15/2012","granularity":"day","time":"2012/07/15 00:00:00 -0400"},"longitude":100.5165196,"id":"aeltf1vogbto","location":"Rama V Park"},"type":"Feature","geometry":{"type":"Point","coordinates":[100.5165196,13.7221128]}},{"properties":{"latitude":13.7195512,"column_5":1,"date":{"end_time":"2012/07/16 00:00:00 -0400","original":"7/15/2012","granularity":"day","time":"2012/07/15 00:00:00 -0400"},"longitude":100.5159885,"id":"aeltf1v2bwof","location":"Charoen Wieng Pochana"},"type":"Feature","geometry":{"type":"Point","coordinates":[100.5159885,13.7195512]}},{"properties":{"latitude":14.3433543,"column_5":1,"date":{"end_time":"2012/07/17 00:00:00 -0400","original":"7/16/2012","granularity":"day","time":"2012/07/16 00:00:00 -0400"},"longitude":100.5421042,"id":"aeltf1sstcur","location":"Wat Chaiwatthanaram"},"type":"Feature","geometry":{"type":"Point","coordinates":[100.5421042,14.3433543]}},{"properties":{"latitude":13.7335108,"column_5":1,"date":{"end_time":"2012/07/17 00:00:00 -0400","original":"7/16/2012","granularity":"day","time":"2012/07/16 00:00:00 -0400"},"longitude":100.5104101,"id":"aeltf1vli05u","location":"Chao Praya River"},"type":"Feature","geometry":{"type":"Point","coordinates":[100.5104101,13.7335108]}},{"properties":{"latitude":13.743697,"column_5":1,"date":{"end_time":"2012/07/17 00:00:00 -0400","original":"7/16/2012","granularity":"day","time":"2012/07/16 00:00:00 -0400"},"longitude":100.4890257,"id":"aeltf1ydghcb","location":"Wat Arun"},"type":"Feature","geometry":{"type":"Point","coordinates":[100.4890257,13.743697]}},{"properties":{"latitude":14.3587335,"column_5":1,"date":{"end_time":"2012/07/17 00:00:00 -0400","original":"7/16/2012","granularity":"day","time":"2012/07/16 00:00:00 -0400"},"longitude":100.5676397,"id":"aeltf1u8a6yg","location":"Wat Ratchaburana"},"type":"Feature","geometry":{"type":"Point","coordinates":[100.5676397,14.3587335]}},{"properties":{"latitude":14.2443732,"column_5":1,"date":{"end_time":"2012/07/17 00:00:00 -0400","original":"7/16/2012","granularity":"day","time":"2012/07/16 00:00:00 -0400"},"longitude":100.6137562,"id":"aeltf1su0434","location":"Bang Pa-in"},"type":"Feature","geometry":{"type":"Point","coordinates":[100.6137562,14.2443732]}},{"properties":{"latitude":14.3570731,"column_5":1,"date":{"end_time":"2012/07/17 00:00:00 -0400","original":"7/16/2012","granularity":"day","time":"2012/07/16 00:00:00 -0400"},"longitude":100.5605156,"id":"aeltf1zh93br","location":"Ayutthaya"},"type":"Feature","geometry":{"type":"Point","coordinates":[100.5605156,14.3570731]}},{"properties":{"latitude":13.7313789,"column_5":1,"date":{"end_time":"2012/07/18 00:00:00 -0400","original":"7/17/2012","granularity":"day","time":"2012/07/17 00:00:00 -0400"},"longitude":100.5417091,"id":"aeltf25624qt","location":"Bangkok--Lumphini Park"},"type":"Feature","geometry":{"type":"Point","coordinates":[100.5417091,13.7313789]}},{"properties":{"latitude":13.6967017,"column_5":1,"date":{"end_time":"2012/07/18 00:00:00 -0400","original":"7/17/2012","granularity":"day","time":"2012/07/17 00:00:00 -0400"},"longitude":100.6272733,"id":"aeltf1ye8sa6","location":"Keatpaiyaw"},"type":"Feature","geometry":{"type":"Point","coordinates":[100.6272733,13.6967017]}},{"properties":{"latitude":18.5381997,"column_5":1,"date":{"end_time":"2012/07/19 00:00:00 -0400","original":"7/18/2012","granularity":"day","time":"2012/07/18 00:00:00 -0400"},"longitude":99.2458547,"id":"aeltf1zetw3z","location":"Khuntan Railway Station"},"type":"Feature","geometry":{"type":"Point","coordinates":[99.2458547,18.5381997]}},{"properties":{"latitude":18.3075601,"column_5":1,"date":{"end_time":"2012/07/19 00:00:00 -0400","original":"7/18/2012","granularity":"day","time":"2012/07/18 00:00:00 -0400"},"longitude":99.4617854,"id":"aeltf1x1w3k0","location":"Bo Haeo"},"type":"Feature","geometry":{"type":"Point","coordinates":[99.4617854,18.3075601]}},{"properties":{"latitude":18.2448579,"column_5":1,"date":{"end_time":"2012/07/19 00:00:00 -0400","original":"7/18/2012","granularity":"day","time":"2012/07/18 00:00:00 -0400"},"longitude":99.5001619,"id":"aeltf1pz60r5","location":"Nanc Wua Thao Railway Station"},"type":"Feature","geometry":{"type":"Point","coordinates":[99.5001619,18.2448579]}},{"properties":{"latitude":18.4618702,"column_5":1,"date":{"end_time":"2012/07/19 00:00:00 -0400","original":"7/18/2012","granularity":"day","time":"2012/07/18 00:00:00 -0400"},"longitude":99.1391588,"id":"aeltf1s68mmf","location":"Mae Tha Railway Station"},"type":"Feature","geometry":{"type":"Point","coordinates":[99.1391588,18.4618702]}},{"properties":{"latitude":18.2799197,"column_5":1,"date":{"end_time":"2012/07/19 00:00:00 -0400","original":"7/18/2012","granularity":"day","time":"2012/07/18 00:00:00 -0400"},"longitude":99.4727589,"id":"aeltf21ahdfz","location":"Nakhon Lampang Railway"},"type":"Feature","geometry":{"type":"Point","coordinates":[99.4727589,18.2799197]}},{"properties":{"latitude":18.8052431,"column_5":1,"date":{"end_time":"2012/07/19 00:00:00 -0400","original":"7/18/2012","granularity":"day","time":"2012/07/18 00:00:00 -0400"},"longitude":98.9217567,"id":"aeltf20za307","location":"Doi Suthep"},"type":"Feature","geometry":{"type":"Point","coordinates":[98.9217567,18.8052431]}},{"properties":{"latitude":18.3353669,"column_5":1,"date":{"end_time":"2012/07/19 00:00:00 -0400","original":"7/18/2012","granularity":"day","time":"2012/07/18 00:00:00 -0400"},"longitude":99.3690392,"id":"aeltf22asoqr","location":"Hang Chat Railway Station"},"type":"Feature","geometry":{"type":"Point","coordinates":[99.3690392,18.3353669]}},{"properties":{"latitude":18.2783976,"column_5":1,"date":{"end_time":"2012/07/19 00:00:00 -0400","original":"7/18/2012","granularity":"day","time":"2012/07/18 00:00:00 -0400"},"longitude":99.6560289,"id":"aeltf251ayfi","location":"Mae Mo"},"type":"Feature","geometry":{"type":"Point","coordinates":[99.6560289,18.2783976]}},{"properties":{"latitude":18.4613913,"column_5":1,"date":{"end_time":"2012/07/19 00:00:00 -0400","original":"7/18/2012","granularity":"day","time":"2012/07/18 00:00:00 -0400"},"longitude":99.0575127,"id":"aeltf1rq46sk","location":"Nong Lom Railway Station"},"type":"Feature","geometry":{"type":"Point","coordinates":[99.0575127,18.4613913]}},{"properties":{"latitude":18.8103589,"column_5":1,"date":{"end_time":"2012/07/20 00:00:00 -0400","original":"7/19/2012","granularity":"day","time":"2012/07/19 00:00:00 -0400"},"longitude":98.9480136,"id":"aeltf1y9niy2","location":"Chiang Mai Zoo"},"type":"Feature","geometry":{"type":"Point","coordinates":[98.9480136,18.8103589]}},{"properties":{"latitude":20.4368525,"column_5":1,"date":{"end_time":"2012/07/22 00:00:00 -0400","original":"7/21/2012","granularity":"day","time":"2012/07/21 00:00:00 -0400"},"longitude":99.8874084,"id":"aeltf1s73oh0","location":"Mae Sai"},"type":"Feature","geometry":{"type":"Point","coordinates":[99.8874084,20.4368525]}},{"properties":{"latitude":20.4462399,"column_5":1,"date":{"end_time":"2012/07/22 00:00:00 -0400","original":"7/21/2012","granularity":"day","time":"2012/07/21 00:00:00 -0400"},"longitude":99.8795395,"id":"aeltf24ton51","location":"Tachileik"},"type":"Feature","geometry":{"type":"Point","coordinates":[99.8795395,20.4462399]}},{"properties":{"latitude":20.2752081,"column_5":1,"date":{"end_time":"2012/07/24 00:00:00 -0400","original":"7/23/2012","granularity":"day","time":"2012/07/23 00:00:00 -0400"},"longitude":100.0839988,"id":"aeltf1qqxso1","location":"Chiang Saen"},"type":"Feature","geometry":{"type":"Point","coordinates":[100.0839988,20.2752081]}},{"properties":{"latitude":20.20408,"column_5":1,"date":{"end_time":"2012/07/25 00:00:00 -0400","original":"7/24/2012","granularity":"day","time":"2012/07/24 00:00:00 -0400"},"longitude":100.4493416,"id":"aeltf1sbgjfk","location":"Pak Ing Tai"},"type":"Feature","geometry":{"type":"Point","coordinates":[100.4493416,20.20408]}},{"properties":{"latitude":20.2759408,"column_5":1,"date":{"end_time":"2012/07/25 00:00:00 -0400","original":"7/24/2012","granularity":"day","time":"2012/07/24 00:00:00 -0400"},"longitude":100.4112469,"id":"aeltf1zeb00a","location":"Huay Xai"},"type":"Feature","geometry":{"type":"Point","coordinates":[100.4112469,20.2759408]}},{"properties":{"latitude":20.1465284,"column_5":1,"date":{"end_time":"2012/07/26 00:00:00 -0400","original":"7/25/2012","granularity":"day","time":"2012/07/25 00:00:00 -0400"},"longitude":100.5896187,"id":"aeltf1tyiepn","location":"Mekong River, Boko Province"},"type":"Feature","geometry":{"type":"Point","coordinates":[100.5896187,20.1465284]}},{"properties":{"latitude":19.829775,"column_5":1,"date":{"end_time":"2012/07/26 00:00:00 -0400","original":"7/25/2012","granularity":"day","time":"2012/07/25 00:00:00 -0400"},"longitude":101.4214897,"id":"aeltf21oyxs9","location":"Mekong River, Oudmxai"},"type":"Feature","geometry":{"type":"Point","coordinates":[101.4214897,19.829775]}},{"properties":{"latitude":19.8345387,"column_5":1,"date":{"end_time":"2012/07/26 00:00:00 -0400","original":"7/25/2012","granularity":"day","time":"2012/07/25 00:00:00 -0400"},"longitude":101.6262817,"id":"aeltf23yhof0","location":"Mekong River, Xaignabouli"},"type":"Feature","geometry":{"type":"Point","coordinates":[101.6262817,19.8345387]}},{"properties":{"latitude":20.0518427,"column_5":1,"date":{"end_time":"2012/07/26 00:00:00 -0400","original":"7/25/2012","granularity":"day","time":"2012/07/25 00:00:00 -0400"},"longitude":102.2079152,"id":"aeltf1w4xrtn","location":"Pak Ou Caves"},"type":"Feature","geometry":{"type":"Point","coordinates":[102.2079152,20.0518427]}},{"properties":{"latitude":19.8734331,"column_5":1,"date":{"end_time":"2012/07/28 00:00:00 -0400","original":"7/27/2012","granularity":"day","time":"2012/07/27 00:00:00 -0400"},"longitude":102.2503418,"id":"aeltf1zqljgv","location":"Elephant Village"},"type":"Feature","geometry":{"type":"Point","coordinates":[102.2503418,19.8734331]}},{"properties":{"latitude":19.7525931,"column_5":1,"date":{"end_time":"2012/07/30 00:00:00 -0400","original":"7/29/2012","granularity":"day","time":"2012/07/29 00:00:00 -0400"},"longitude":101.9961074,"id":"aeltf204mucg","location":"Kuang Si Waterfall"},"type":"Feature","geometry":{"type":"Point","coordinates":[101.9961074,19.7525931]}},{"properties":{"latitude":17.97667,"column_5":1,"date":{"end_time":"2012/07/31 00:00:00 -0400","original":"7/30/2012","granularity":"day","time":"2012/07/30 00:00:00 -0400"},"longitude":102.6365265,"id":"aeltf21zh41h","location":"That Luang"},"type":"Feature","geometry":{"type":"Point","coordinates":[102.6365265,17.97667]}},{"properties":{"latitude":17.9806158,"column_5":1,"date":{"end_time":"2012/08/02 00:00:00 -0400","original":"8/1/2012","granularity":"day","time":"2012/08/01 00:00:00 -0400"},"longitude":102.5685518,"id":"aeltf1yjydwb","location":"Vientiane Airport"},"type":"Feature","geometry":{"type":"Point","coordinates":[102.5685518,17.9806158]}},{"properties":{"latitude":33.9428695,"column_5":1,"date":{"end_time":"2012/08/05 00:00:00 -0400","original":"8/4/2012","granularity":"day","time":"2012/08/04 00:00:00 -0400"},"longitude":-118.4141491,"id":"aeltf241e0xi","location":"LAX Airport"},"type":"Feature","geometry":{"type":"Point","coordinates":[-118.4141491,33.9428695]}},{"properties":{"latitude":35.5668374,"column_5":1,"date":{"end_time":"2012/08/12 00:00:00 -0400","original":"8/11/2012","granularity":"day","time":"2012/08/11 00:00:00 -0400"},"longitude":-79.0857757,"id":"aeltf1zju24b","location":"Deep River Sporting Clays"},"type":"Feature","geometry":{"type":"Point","coordinates":[-79.0857757,35.5668374]}},{"properties":{"latitude":36.1699761,"column_5":1,"date":{"end_time":"2012/08/15 00:00:00 -0400","original":"8/14/2012","granularity":"day","time":"2012/08/14 00:00:00 -0400"},"longitude":-81.6473139,"id":"aeltf1p3eto7","location":"Tweetsie Railroad"},"type":"Feature","geometry":{"type":"Point","coordinates":[-81.6473139,36.1699761]}},{"properties":{"latitude":36.1478557,"column_5":1,"date":{"end_time":"2012/08/15 00:00:00 -0400","original":"8/14/2012","granularity":"day","time":"2012/08/14 00:00:00 -0400"},"longitude":-81.7101288,"id":"aeltf1tnd5bv","location":"Moses H. Cone Memorial Park"},"type":"Feature","geometry":{"type":"Point","coordinates":[-81.7101288,36.1478557]}},{"properties":{"latitude":35.7312852,"column_5":1,"date":{"end_time":"2012/08/16 00:00:00 -0400","original":"8/15/2012","granularity":"day","time":"2012/08/15 00:00:00 -0400"},"longitude":-81.9030398,"id":"aeltf24ket7b","location":"Lake James SP--Catawba River Area"},"type":"Feature","geometry":{"type":"Point","coordinates":[-81.9030398,35.7312852]}},{"properties":{"latitude":35.61792,"column_5":1,"date":{"end_time":"2012/08/16 00:00:00 -0400","original":"8/15/2012","granularity":"day","time":"2012/08/15 00:00:00 -0400"},"longitude":-82.32124,"id":"aeltf1py9glr","location":"Black Mountain"},"type":"Feature","geometry":{"type":"Point","coordinates":[-82.32124,35.61792]}},{"properties":{"latitude":35.7741,"column_5":1,"date":{"end_time":"2012/08/16 00:00:00 -0400","original":"8/15/2012","granularity":"day","time":"2012/08/15 00:00:00 -0400"},"longitude":-81.68095,"id":"aeltf20j6pva","location":"Burke"},"type":"Feature","geometry":{"type":"Point","coordinates":[-81.68095,35.7741]}},{"properties":{"latitude":35.7547318,"column_5":1,"date":{"end_time":"2012/08/16 00:00:00 -0400","original":"8/15/2012","granularity":"day","time":"2012/08/15 00:00:00 -0400"},"longitude":-81.8850517,"id":"aeltf1u5fmqx","location":"Lake James SP"},"type":"Feature","geometry":{"type":"Point","coordinates":[-81.8850517,35.7547318]}},{"properties":{"latitude":35.7302909,"column_5":1,"date":{"end_time":"2012/08/16 00:00:00 -0400","original":"8/15/2012","granularity":"day","time":"2012/08/15 00:00:00 -0400"},"longitude":-81.1276715,"id":"aeltf1sqvp55","location":"Catawba I-40 Rest Stop"},"type":"Feature","geometry":{"type":"Point","coordinates":[-81.1276715,35.7302909]}},{"properties":{"latitude":35.54141,"column_5":1,"date":{"end_time":"2012/08/16 00:00:00 -0400","original":"8/15/2012","granularity":"day","time":"2012/08/15 00:00:00 -0400"},"longitude":-83.00137,"id":"aeltf1qm3twq","location":"Haywood"},"type":"Feature","geometry":{"type":"Point","coordinates":[-83.00137,35.54141]}},{"properties":{"latitude":35.73711,"column_5":1,"date":{"end_time":"2012/08/16 00:00:00 -0400","original":"8/15/2012","granularity":"day","time":"2012/08/15 00:00:00 -0400"},"longitude":-82.05331,"id":"aeltf24yjm23","location":"McDowell"},"type":"Feature","geometry":{"type":"Point","coordinates":[-82.05331,35.73711]}},{"properties":{"latitude":35.6884112,"column_5":1,"date":{"end_time":"2012/08/16 00:00:00 -0400","original":"8/15/2012","granularity":"day","time":"2012/08/15 00:00:00 -0400"},"longitude":-82.9421639,"id":"aeltf1yaa2r7","location":"Max Patch Rd."},"type":"Feature","geometry":{"type":"Point","coordinates":[-82.9421639,35.6884112]}},{"properties":{"latitude":35.7911949,"column_5":1,"date":{"end_time":"2012/08/16 00:00:00 -0400","original":"8/15/2012","granularity":"day","time":"2012/08/15 00:00:00 -0400"},"longitude":-82.9594501,"id":"aeltf24rrzbc","location":"Max Patch Rd.- Madison"},"type":"Feature","geometry":{"type":"Point","coordinates":[-82.9594501,35.7911949]}},{"properties":{"latitude":35.70653,"column_5":1,"date":{"end_time":"2012/08/16 00:00:00 -0400","original":"8/15/2012","granularity":"day","time":"2012/08/15 00:00:00 -0400"},"longitude":-81.2187,"id":"aeltf1tj6a2l","location":"Conover"},"type":"Feature","geometry":{"type":"Point","coordinates":[-81.2187,35.70653]}},{"properties":{"latitude":35.7034805,"column_5":1,"date":{"end_time":"2012/08/16 00:00:00 -0400","original":"8/15/2012","granularity":"day","time":"2012/08/15 00:00:00 -0400"},"longitude":-83.0411641,"id":"aeltf1unqgva","location":"Haywood I-40 Welcome Center"},"type":"Feature","geometry":{"type":"Point","coordinates":[-83.0411641,35.7034805]}},{"properties":{"latitude":35.7965548,"column_5":1,"date":{"end_time":"2012/08/16 00:00:00 -0400","original":"8/15/2012","granularity":"day","time":"2012/08/15 00:00:00 -0400"},"longitude":-82.9576125,"id":"aeltf1wmo5wu","location":"Max Patch Bald"},"type":"Feature","geometry":{"type":"Point","coordinates":[-82.9576125,35.7965548]}},{"properties":{"latitude":35.4801318,"column_5":1,"date":{"end_time":"2012/08/17 00:00:00 -0400","original":"8/16/2012","granularity":"day","time":"2012/08/16 00:00:00 -0400"},"longitude":-83.318703,"id":"aeltf24uh1k7","location":"Oconaluftee Islands Park"},"type":"Feature","geometry":{"type":"Point","coordinates":[-83.318703,35.4801318]}},{"properties":{"latitude":35.4961528,"column_5":1,"date":{"end_time":"2012/08/17 00:00:00 -0400","original":"8/16/2012","granularity":"day","time":"2012/08/16 00:00:00 -0400"},"longitude":-83.3093279,"id":"aeltf1yzehfb","location":"Cherokee Baymont Inn"},"type":"Feature","geometry":{"type":"Point","coordinates":[-83.3093279,35.4961528]}},{"properties":{"latitude":35.5507823,"column_5":1,"date":{"end_time":"2012/08/17 00:00:00 -0400","original":"8/16/2012","granularity":"day","time":"2012/08/16 00:00:00 -0400"},"longitude":-83.1654342,"id":"aeltf1z1dtw8","location":"Heintooga Ridge Rd.- Polls Gap"},"type":"Feature","geometry":{"type":"Point","coordinates":[-83.1654342,35.5507823]}},{"properties":{"latitude":35.515956,"column_5":1,"date":{"end_time":"2012/08/17 00:00:00 -0400","original":"8/16/2012","granularity":"day","time":"2012/08/16 00:00:00 -0400"},"longitude":-83.1940976,"id":"aeltf22nvh3e","location":"Jenkin's Ridge Overlook"},"type":"Feature","geometry":{"type":"Point","coordinates":[-83.1940976,35.515956]}},{"properties":{"latitude":35.547728,"column_5":1,"date":{"end_time":"2012/08/17 00:00:00 -0400","original":"8/16/2012","granularity":"day","time":"2012/08/16 00:00:00 -0400"},"longitude":-83.4915201,"id":"aeltf1owxw1p","location":"Great Smoky Mountains NP--Andrew's Bald Trail"},"type":"Feature","geometry":{"type":"Point","coordinates":[-83.4915201,35.547728]}},{"properties":{"latitude":35.5594623,"column_5":1,"date":{"end_time":"2012/08/17 00:00:00 -0400","original":"8/16/2012","granularity":"day","time":"2012/08/16 00:00:00 -0400"},"longitude":-83.3119011,"id":"aeltf1thxngp","location":"Great Smoky Mountains NP--Smokemont"},"type":"Feature","geometry":{"type":"Point","coordinates":[-83.3119011,35.5594623]}},{"properties":{"latitude":35.5346752,"column_5":1,"date":{"end_time":"2012/08/17 00:00:00 -0400","original":"8/16/2012","granularity":"day","time":"2012/08/16 00:00:00 -0400"},"longitude":-83.1715786,"id":"aeltf2157ggs","location":"Heintooga Ridge Rd.- Black Camp Gap"},"type":"Feature","geometry":{"type":"Point","coordinates":[-83.1715786,35.5346752]}},{"properties":{"latitude":35.5096439,"column_5":1,"date":{"end_time":"2012/08/17 00:00:00 -0400","original":"8/16/2012","granularity":"day","time":"2012/08/16 00:00:00 -0400"},"longitude":-83.1887614,"id":"aeltf1s9obf5","location":"Bunches Bald Overlook"},"type":"Feature","geometry":{"type":"Point","coordinates":[-83.1887614,35.5096439]}},{"properties":{"latitude":35.5109366,"column_5":1,"date":{"end_time":"2012/08/17 00:00:00 -0400","original":"8/16/2012","granularity":"day","time":"2012/08/16 00:00:00 -0400"},"longitude":-83.1785095,"id":"aeltf1ttztff","location":"Heintooga Ridge Rd.- Haywood"},"type":"Feature","geometry":{"type":"Point","coordinates":[-83.1785095,35.5109366]}},{"properties":{"latitude":35.5679132,"column_5":1,"date":{"end_time":"2012/08/17 00:00:00 -0400","original":"8/16/2012","granularity":"day","time":"2012/08/16 00:00:00 -0400"},"longitude":-83.1759868,"id":"aeltf22bibre","location":"Great Smoky Mountains NP--Balsam Mountain Campground"},"type":"Feature","geometry":{"type":"Point","coordinates":[-83.1759868,35.5679132]}},{"properties":{"latitude":35.5193208,"column_5":1,"date":{"end_time":"2012/08/17 00:00:00 -0400","original":"8/16/2012","granularity":"day","time":"2012/08/16 00:00:00 -0400"},"longitude":-83.1785507,"id":"aeltf1tds8ss","location":"Heintooga Ridge Rd.- Mile High Overlook"},"type":"Feature","geometry":{"type":"Point","coordinates":[-83.1785507,35.5193208]}},{"properties":{"latitude":35.5648485,"column_5":1,"date":{"end_time":"2012/08/17 00:00:00 -0400","original":"8/16/2012","granularity":"day","time":"2012/08/16 00:00:00 -0400"},"longitude":-83.4993212,"id":"aeltf1xeih31","location":"Great Smoky Mountains NP- Clingmans Dome TN"},"type":"Feature","geometry":{"type":"Point","coordinates":[-83.4993212,35.5648485]}},{"properties":{"latitude":35.5569312,"column_5":1,"date":{"end_time":"2012/08/17 00:00:00 -0400","original":"8/16/2012","granularity":"day","time":"2012/08/16 00:00:00 -0400"},"longitude":-83.4961581,"id":"aeltf242brcx","location":"Great Smoky Mountains NP--Clingman's Dome"},"type":"Feature","geometry":{"type":"Point","coordinates":[-83.4961581,35.5569312]}},{"properties":{"latitude":35.29076,"column_5":1,"date":{"end_time":"2012/08/18 00:00:00 -0400","original":"8/17/2012","granularity":"day","time":"2012/08/17 00:00:00 -0400"},"longitude":-82.16111,"id":"aeltf1uxkm81","location":"Polk"},"type":"Feature","geometry":{"type":"Point","coordinates":[-82.16111,35.29076]}},{"properties":{"latitude":35.0946697,"column_5":1,"date":{"end_time":"2012/08/18 00:00:00 -0400","original":"8/17/2012","granularity":"day","time":"2012/08/17 00:00:00 -0400"},"longitude":-83.8586283,"id":"aeltf22i207a","location":"Fires Creek Campground"},"type":"Feature","geometry":{"type":"Point","coordinates":[-83.8586283,35.0946697]}},{"properties":{"latitude":35.68357,"column_5":1,"date":{"end_time":"2012/08/18 00:00:00 -0400","original":"8/17/2012","granularity":"day","time":"2012/08/17 00:00:00 -0400"},"longitude":-81.22726,"id":"aeltf1s3b9mn","location":"Catawba"},"type":"Feature","geometry":{"type":"Point","coordinates":[-81.22726,35.68357]}},{"properties":{"latitude":35.22122,"column_5":1,"date":{"end_time":"2012/08/18 00:00:00 -0400","original":"8/17/2012","granularity":"day","time":"2012/08/17 00:00:00 -0400"},"longitude":-82.81091,"id":"aeltf210gt5s","location":"Transylvania"},"type":"Feature","geometry":{"type":"Point","coordinates":[-82.81091,35.22122]}},{"properties":{"latitude":35.36428,"column_5":1,"date":{"end_time":"2012/08/18 00:00:00 -0400","original":"8/17/2012","granularity":"day","time":"2012/08/17 00:00:00 -0400"},"longitude":-81.5382,"id":"aeltf1zehymv","location":"Cleveland"},"type":"Feature","geometry":{"type":"Point","coordinates":[-81.5382,35.36428]}},{"properties":{"latitude":35.32244,"column_5":1,"date":{"end_time":"2012/08/18 00:00:00 -0400","original":"8/17/2012","granularity":"day","time":"2012/08/17 00:00:00 -0400"},"longitude":-82.50084,"id":"aeltf1zuubdu","location":"Henderson"},"type":"Feature","geometry":{"type":"Point","coordinates":[-82.50084,35.32244]}},{"properties":{"latitude":35.47949,"column_5":1,"date":{"end_time":"2012/08/18 00:00:00 -0400","original":"8/17/2012","granularity":"day","time":"2012/08/17 00:00:00 -0400"},"longitude":-81.23273,"id":"aeltf1rkid1y","location":"Lincoln"},"type":"Feature","geometry":{"type":"Point","coordinates":[-81.23273,35.47949]}},{"properties":{"latitude":35.39222,"column_5":1,"date":{"end_time":"2012/08/18 00:00:00 -0400","original":"8/17/2012","granularity":"day","time":"2012/08/17 00:00:00 -0400"},"longitude":-81.98135,"id":"aeltf1w9xqmi","location":"Rutherford"},"type":"Feature","geometry":{"type":"Point","coordinates":[-81.98135,35.39222]}},{"properties":{"latitude":35.08758,"column_5":1,"date":{"end_time":"2012/08/18 00:00:00 -0400","original":"8/17/2012","granularity":"day","time":"2012/08/17 00:00:00 -0400"},"longitude":-84.03461,"id":"aeltf1pxza27","location":"Murphy"},"type":"Feature","geometry":{"type":"Point","coordinates":[-84.03461,35.08758]}},{"properties":{"latitude":35.2053508,"column_5":1,"date":{"end_time":"2012/08/18 00:00:00 -0400","original":"8/17/2012","granularity":"day","time":"2012/08/17 00:00:00 -0400"},"longitude":-83.829613,"id":"aeltf1s20ezo","location":"Andrews Rest Stop"},"type":"Feature","geometry":{"type":"Point","coordinates":[-83.829613,35.2053508]}},{"properties":{"latitude":35.06865,"column_5":1,"date":{"end_time":"2012/08/18 00:00:00 -0400","original":"8/17/2012","granularity":"day","time":"2012/08/17 00:00:00 -0400"},"longitude":-83.75067,"id":"aeltf21009xy","location":"Clay"},"type":"Feature","geometry":{"type":"Point","coordinates":[-83.75067,35.06865]}},{"properties":{"latitude":35.0541612,"column_5":1,"date":{"end_time":"2012/08/18 00:00:00 -0400","original":"8/17/2012","granularity":"day","time":"2012/08/17 00:00:00 -0400"},"longitude":-83.1881976,"id":"aeltf1rrxr10","location":"Highlands Biological Station"},"type":"Feature","geometry":{"type":"Point","coordinates":[-83.1881976,35.0541612]}},{"properties":{"latitude":35.0387066,"column_5":1,"date":{"end_time":"2012/08/18 00:00:00 -0400","original":"8/17/2012","granularity":"day","time":"2012/08/17 00:00:00 -0400"},"longitude":-83.9629672,"id":"aeltf1sypbfb","location":"Campbell Folk School"},"type":"Feature","geometry":{"type":"Point","coordinates":[-83.9629672,35.0387066]}},{"properties":{"latitude":35.35778,"column_5":1,"date":{"end_time":"2012/08/18 00:00:00 -0400","original":"8/17/2012","granularity":"day","time":"2012/08/17 00:00:00 -0400"},"longitude":-83.71861,"id":"aeltf20jsdt3","location":"Appalachian Trail--Stecoah Gap"},"type":"Feature","geometry":{"type":"Point","coordinates":[-83.71861,35.35778]}},{"properties":{"latitude":39.3242115,"column_5":1,"date":{"end_time":"2012/08/28 00:00:00 -0400","original":"8/27/2012","granularity":"day","time":"2012/08/27 00:00:00 -0400"},"longitude":-77.7260828,"id":"aeltf224uz6r","location":"C&amp;O Canal--Harpers Ferry"},"type":"Feature","geometry":{"type":"Point","coordinates":[-77.7260828,39.3242115]}},{"properties":{"latitude":39.3332694,"column_5":1,"date":{"end_time":"2012/08/28 00:00:00 -0400","original":"8/27/2012","granularity":"day","time":"2012/08/27 00:00:00 -0400"},"longitude":-77.7386999,"id":"aeltf1vw5r8o","location":"C&amp;O Canal--Lock 34"},"type":"Feature","geometry":{"type":"Point","coordinates":[-77.7386999,39.3332694]}},{"properties":{"latitude":39.4501419,"column_5":1,"date":{"end_time":"2012/09/02 00:00:00 -0400","original":"9/1/2012","granularity":"day","time":"2012/09/01 00:00:00 -0400"},"longitude":-76.0083771,"id":"aeltf1yho8nf","location":"Elk Neck SP--Turkey Pt."},"type":"Feature","geometry":{"type":"Point","coordinates":[-76.0083771,39.4501419]}},{"properties":{"latitude":39.60011,"column_5":1,"date":{"end_time":"2012/09/02 00:00:00 -0400","original":"9/1/2012","granularity":"day","time":"2012/09/01 00:00:00 -0400"},"longitude":-75.94137,"id":"aeltf1wfq4mv","location":"North East"},"type":"Feature","geometry":{"type":"Point","coordinates":[-75.94137,39.60011]}},{"properties":{"latitude":39.56011,"column_5":1,"date":{"end_time":"2012/09/02 00:00:00 -0400","original":"9/1/2012","granularity":"day","time":"2012/09/01 00:00:00 -0400"},"longitude":-76.07137,"id":"aeltf20xxdpq","location":"Perryville"},"type":"Feature","geometry":{"type":"Point","coordinates":[-76.07137,39.56011]}},{"properties":{"latitude":38.7278737,"column_5":1,"date":{"end_time":"2012/09/09 00:00:00 -0400","original":"9/8/2012","granularity":"day","time":"2012/09/08 00:00:00 -0400"},"longitude":-76.5446663,"id":"aeltf1v1mzep","location":"Herrington Harbor"},"type":"Feature","geometry":{"type":"Point","coordinates":[-76.5446663,38.7278737]}},{"properties":{"latitude":38.7119023,"column_5":1,"date":{"end_time":"2012/09/09 00:00:00 -0400","original":"9/8/2012","granularity":"day","time":"2012/09/08 00:00:00 -0400"},"longitude":-76.5312767,"id":"aeltf1vahgyt","location":"North Beach--marsh"},"type":"Feature","geometry":{"type":"Point","coordinates":[-76.5312767,38.7119023]}},{"properties":{"latitude":38.8089482,"column_5":1,"date":{"end_time":"2012/09/09 00:00:00 -0400","original":"9/8/2012","granularity":"day","time":"2012/09/08 00:00:00 -0400"},"longitude":-76.5544081,"id":"aeltf23xyhdt","location":"Central Sod Farm--Swamp Circle Rd."},"type":"Feature","geometry":{"type":"Point","coordinates":[-76.5544081,38.8089482]}},{"properties":{"latitude":39.2110417,"column_5":1,"date":{"end_time":"2012/09/10 00:00:00 -0400","original":"9/9/2012","granularity":"day","time":"2012/09/09 00:00:00 -0400"},"longitude":-76.9095926,"id":"aeltf1yi7456","location":"Middle Patuxent Environmental Area"},"type":"Feature","geometry":{"type":"Point","coordinates":[-76.9095926,39.2110417]}},{"properties":{"latitude":39.3593373,"column_5":1,"date":{"end_time":"2012/10/01 00:00:00 -0400","original":"9/30/2012","granularity":"day","time":"2012/09/30 00:00:00 -0400"},"longitude":-76.7455959,"id":"aeltf1z7pijt","location":"Milford Mill Park"},"type":"Feature","geometry":{"type":"Point","coordinates":[-76.7455959,39.3593373]}},{"properties":{"latitude":39.4168337,"column_5":1,"date":{"end_time":"2012/10/06 00:00:00 -0400","original":"10/5/2012","granularity":"day","time":"2012/10/05 00:00:00 -0400"},"longitude":-77.4232721,"id":"aeltf21zqrci","location":"Baker Park,  Frederick"},"type":"Feature","geometry":{"type":"Point","coordinates":[-77.4232721,39.4168337]}},{"properties":{"latitude":39.2501871,"column_5":1,"date":{"end_time":"2012/10/06 00:00:00 -0400","original":"10/5/2012","granularity":"day","time":"2012/10/05 00:00:00 -0400"},"longitude":-77.4826312,"id":"aeltf1z3u9yx","location":"C&amp;O Canal--Nolands Ferry"},"type":"Feature","geometry":{"type":"Point","coordinates":[-77.4826312,39.2501871]}},{"properties":{"latitude":39.189427,"column_5":1,"date":{"end_time":"2012/10/06 00:00:00 -0400","original":"10/5/2012","granularity":"day","time":"2012/10/05 00:00:00 -0400"},"longitude":-77.309455,"id":"aeltf1vhyxdb","location":"Black Hill RP--Little Seneca Lake, Rte.121"},"type":"Feature","geometry":{"type":"Point","coordinates":[-77.309455,39.189427]}},{"properties":{"latitude":39.2207,"column_5":1,"date":{"end_time":"2012/10/06 00:00:00 -0400","original":"10/5/2012","granularity":"day","time":"2012/10/05 00:00:00 -0400"},"longitude":-77.37751,"id":"aeltf1r34306","location":"Barnesville"},"type":"Feature","geometry":{"type":"Point","coordinates":[-77.37751,39.2207]}},{"properties":{"latitude":38.6795927,"column_5":1,"date":{"end_time":"2012/10/13 00:00:00 -0400","original":"10/12/2012","granularity":"day","time":"2012/10/12 00:00:00 -0400"},"longitude":-76.3433933,"id":"aeltf1rvbggh","location":"Black Walnut Point"},"type":"Feature","geometry":{"type":"Point","coordinates":[-76.3433933,38.6795927]}},{"properties":{"latitude":38.78512,"column_5":1,"date":{"end_time":"2012/10/13 00:00:00 -0400","original":"10/12/2012","granularity":"day","time":"2012/10/12 00:00:00 -0400"},"longitude":-76.22437,"id":"aeltf1v5r3j5","location":"Saint Michaels"},"type":"Feature","geometry":{"type":"Point","coordinates":[-76.22437,38.78512]}},{"properties":{"latitude":38.8251452,"column_5":1,"date":{"end_time":"2012/10/13 00:00:00 -0400","original":"10/12/2012","granularity":"day","time":"2012/10/12 00:00:00 -0400"},"longitude":-76.3011167,"id":"aeltf1wesdij","location":"Wades Point"},"type":"Feature","geometry":{"type":"Point","coordinates":[-76.3011167,38.8251452]}},{"properties":{"latitude":38.7648589,"column_5":1,"date":{"end_time":"2012/10/13 00:00:00 -0400","original":"10/12/2012","granularity":"day","time":"2012/10/12 00:00:00 -0400"},"longitude":-76.3814163,"id":"aeltf1zp0jpp","location":"Poplar Island"},"type":"Feature","geometry":{"type":"Point","coordinates":[-76.3814163,38.7648589]}},{"properties":{"latitude":38.8236099,"column_5":1,"date":{"end_time":"2012/10/13 00:00:00 -0400","original":"10/12/2012","granularity":"day","time":"2012/10/12 00:00:00 -0400"},"longitude":-76.0403774,"id":"aeltf1t01wib","location":"Cordova Road"},"type":"Feature","geometry":{"type":"Point","coordinates":[-76.0403774,38.8236099]}},{"properties":{"latitude":38.71702,"column_5":1,"date":{"end_time":"2012/10/13 00:00:00 -0400","original":"10/12/2012","granularity":"day","time":"2012/10/12 00:00:00 -0400"},"longitude":-76.33437,"id":"aeltf1xonq2d","location":"Tilghman"},"type":"Feature","geometry":{"type":"Point","coordinates":[-76.33437,38.71702]}},{"properties":{"latitude":39.6396698,"column_5":1,"date":{"end_time":"2012/10/21 00:00:00 -0400","original":"10/20/2012","granularity":"day","time":"2012/10/20 00:00:00 -0400"},"longitude":-76.415062,"id":"aeltf24ews2v","location":"Rocks State Park"},"type":"Feature","geometry":{"type":"Point","coordinates":[-76.415062,39.6396698]}},{"properties":{"latitude":39.24,"column_5":1,"date":{"end_time":"2012/10/21 00:00:00 -0400","original":"10/20/2012","granularity":"day","time":"2012/10/20 00:00:00 -0400"},"longitude":-76.86,"id":"aeltf1qmt6m4","location":"Centennial Lake"},"type":"Feature","geometry":{"type":"Point","coordinates":[-76.86,39.24]}},{"properties":{"latitude":39.53591,"column_5":1,"date":{"end_time":"2012/10/21 00:00:00 -0400","original":"10/20/2012","granularity":"day","time":"2012/10/20 00:00:00 -0400"},"longitude":-76.34828,"id":"aeltf23kjgfv","location":"Bel Air"},"type":"Feature","geometry":{"type":"Point","coordinates":[-76.34828,39.53591]}},{"properties":{"latitude":39.11121,"column_5":1,"date":{"end_time":"2012/10/21 00:00:00 -0400","original":"10/20/2012","granularity":"day","time":"2012/10/20 00:00:00 -0400"},"longitude":-76.9325,"id":"aeltf2581ivj","location":"Burtonsville"},"type":"Feature","geometry":{"type":"Point","coordinates":[-76.9325,39.11121]}},{"properties":{"latitude":39.6444793,"column_5":1,"date":{"end_time":"2012/10/28 00:00:00 -0400","original":"10/27/2012","granularity":"day","time":"2012/10/27 00:00:00 -0400"},"longitude":-76.7722405,"id":"aeltf1ugak37","location":"Manchester--Beckleysville Rd"},"type":"Feature","geometry":{"type":"Point","coordinates":[-76.7722405,39.6444793]}},{"properties":{"latitude":39.6862836,"column_5":1,"date":{"end_time":"2012/10/28 00:00:00 -0400","original":"10/27/2012","granularity":"day","time":"2012/10/27 00:00:00 -0400"},"longitude":-76.7769171,"id":"aeltf1sttzap","location":"Mount Tabor Cemetery"},"type":"Feature","geometry":{"type":"Point","coordinates":[-76.7769171,39.6862836]}},{"properties":{"latitude":39.326256,"column_5":1,"date":{"end_time":"2012/10/29 00:00:00 -0400","original":"10/28/2012","granularity":"day","time":"2012/10/28 00:00:00 -0400"},"longitude":-76.8656761,"id":"aeltf22u1mx3","location":"Birders' Cavey Lane Location"},"type":"Feature","geometry":{"type":"Point","coordinates":[-76.8656761,39.326256]}},{"properties":{"latitude":39.673965,"column_5":1,"date":{"end_time":"2012/11/02 00:00:00 -0400","original":"11/1/2012","granularity":"day","time":"2012/11/01 00:00:00 -0400"},"longitude":-76.1755085,"id":"aeltf1zjexs1","location":"Exelon Conowingo Recreation Area"},"type":"Feature","geometry":{"type":"Point","coordinates":[-76.1755085,39.673965]}},{"properties":{"latitude":39.6575133,"column_5":1,"date":{"end_time":"2012/11/02 00:00:00 -0400","original":"11/1/2012","granularity":"day","time":"2012/11/01 00:00:00 -0400"},"longitude":-76.1810875,"id":"aeltf231mqkl","location":"Conowingo Lake (Harford Co.)"},"type":"Feature","geometry":{"type":"Point","coordinates":[-76.1810875,39.6575133]}},{"properties":{"latitude":39.256616,"column_5":1,"date":{"end_time":"2012/11/03 00:00:00 -0400","original":"11/2/2012","granularity":"day","time":"2012/11/02 00:00:00 -0400"},"longitude":-76.6107376,"id":"aeltf21nhthi","location":"Ferry Bar Park"},"type":"Feature","geometry":{"type":"Point","coordinates":[-76.6107376,39.256616]}},{"properties":{"latitude":39.506349,"column_5":1,"date":{"end_time":"2012/11/04 00:00:00 -0400","original":"11/3/2012","granularity":"day","time":"2012/11/03 00:00:00 -0400"},"longitude":-76.4771557,"id":"aeltf1ydxku3","location":"Pleasant Knoll Farm"},"type":"Feature","geometry":{"type":"Point","coordinates":[-76.4771557,39.506349]}},{"properties":{"latitude":38.994312,"column_5":1,"date":{"end_time":"2012/11/10 00:00:00 -0500","original":"11/9/2012","granularity":"day","time":"2012/11/09 00:00:00 -0500"},"longitude":-76.322945,"id":"aeltf1r7wi4d","location":"Terrapin Nature Park"},"type":"Feature","geometry":{"type":"Point","coordinates":[-76.322945,38.994312]}},{"properties":{"latitude":39.2625631,"column_5":1,"date":{"end_time":"2012/11/10 00:00:00 -0500","original":"11/9/2012","granularity":"day","time":"2012/11/09 00:00:00 -0500"},"longitude":-76.5791702,"id":"aeltf1ydr91a","location":"Fort McHenry NM"},"type":"Feature","geometry":{"type":"Point","coordinates":[-76.5791702,39.2625631]}},{"properties":{"latitude":38.9849343,"column_5":1,"date":{"end_time":"2012/11/10 00:00:00 -0500","original":"11/9/2012","granularity":"day","time":"2012/11/09 00:00:00 -0500"},"longitude":-76.3444934,"id":"aeltf1uw2wta","location":"Bay Bridge- Queen Anne's Side"},"type":"Feature","geometry":{"type":"Point","coordinates":[-76.3444934,38.9849343]}},{"properties":{"latitude":39.441441,"column_5":1,"date":{"end_time":"2012/11/11 00:00:00 -0500","original":"11/10/2012","granularity":"day","time":"2012/11/10 00:00:00 -0500"},"longitude":-76.294864,"id":"aeltf24v6oxv","location":"Home Depot Pond (Harford Co.)"},"type":"Feature","geometry":{"type":"Point","coordinates":[-76.294864,39.441441]}},{"properties":{"latitude":39.446666,"column_5":1,"date":{"end_time":"2012/11/11 00:00:00 -0500","original":"11/10/2012","granularity":"day","time":"2012/11/10 00:00:00 -0500"},"longitude":-76.3152409,"id":"aeltf21kg2wo","location":"Lakeside Ponds"},"type":"Feature","geometry":{"type":"Point","coordinates":[-76.3152409,39.446666]}},{"properties":{"latitude":39.46231,"column_5":1,"date":{"end_time":"2012/11/11 00:00:00 -0500","original":"11/10/2012","granularity":"day","time":"2012/11/10 00:00:00 -0500"},"longitude":-76.27908,"id":"aeltf1td05hd","location":"Abingdon"},"type":"Feature","geometry":{"type":"Point","coordinates":[-76.27908,39.46231]}},{"properties":{"latitude":38.3792895,"column_5":1,"date":{"end_time":"2012/11/22 00:00:00 -0500","original":"11/21/2012","granularity":"day","time":"2012/11/21 00:00:00 -0500"},"longitude":-78.9333988,"id":"aeltf1y8eqe7","location":"Oakwood Drive Pond"},"type":"Feature","geometry":{"type":"Point","coordinates":[-78.9333988,38.3792895]}},{"properties":{"latitude":39.0647481,"column_5":1,"date":{"end_time":"2012/11/22 00:00:00 -0500","original":"11/21/2012","granularity":"day","time":"2012/11/21 00:00:00 -0500"},"longitude":-78.0644703,"id":"aeltf1tz3ob2","location":"Blandy Experimental Farm / State Arboretum of Virginia - MFR06"},"type":"Feature","geometry":{"type":"Point","coordinates":[-78.0644703,39.0647481]}},{"properties":{"latitude":37.9183535,"column_5":1,"date":{"end_time":"2012/11/26 00:00:00 -0500","original":"11/25/2012","granularity":"day","time":"2012/11/25 00:00:00 -0500"},"longitude":-79.2331195,"id":"aeltf1t6959y","location":"Willow Lake"},"type":"Feature","geometry":{"type":"Point","coordinates":[-79.2331195,37.9183535]}},{"properties":{"latitude":37.12772,"column_5":1,"date":{"end_time":"2012/11/26 00:00:00 -0500","original":"11/25/2012","granularity":"day","time":"2012/11/25 00:00:00 -0500"},"longitude":-80.56468,"id":"aeltf23hpx9q","location":"Radford"},"type":"Feature","geometry":{"type":"Point","coordinates":[-80.56468,37.12772]}},{"properties":{"latitude":36.91522,"column_5":1,"date":{"end_time":"2012/11/26 00:00:00 -0500","original":"11/25/2012","granularity":"day","time":"2012/11/25 00:00:00 -0500"},"longitude":-81.05787,"id":"aeltf1vij2z5","location":"Wythe"},"type":"Feature","geometry":{"type":"Point","coordinates":[-81.05787,36.91522]}},{"properties":{"latitude":36.5651962,"column_5":1,"date":{"end_time":"2012/11/26 00:00:00 -0500","original":"11/25/2012","granularity":"day","time":"2012/11/25 00:00:00 -0500"},"longitude":-80.7422447,"id":"aeltf1v2tu1n","location":"I-77 Virginia Welcome Center"},"type":"Feature","geometry":{"type":"Point","coordinates":[-80.7422447,36.5651962]}},{"properties":{"latitude":37.06535,"column_5":1,"date":{"end_time":"2012/11/26 00:00:00 -0500","original":"11/25/2012","granularity":"day","time":"2012/11/25 00:00:00 -0500"},"longitude":-80.72364,"id":"aeltf1yhb46y","location":"Pulaski"},"type":"Feature","geometry":{"type":"Point","coordinates":[-80.72364,37.06535]}},{"properties":{"latitude":38.0383186,"column_5":1,"date":{"end_time":"2012/11/26 00:00:00 -0500","original":"11/25/2012","granularity":"day","time":"2012/11/25 00:00:00 -0500"},"longitude":-78.9744449,"id":"aeltf1wpaoi7","location":"Hall School Rd."},"type":"Feature","geometry":{"type":"Point","coordinates":[-78.9744449,38.0383186]}},{"properties":{"latitude":38.06876,"column_5":1,"date":{"end_time":"2012/11/26 00:00:00 -0500","original":"11/25/2012","granularity":"day","time":"2012/11/25 00:00:00 -0500"},"longitude":-78.89005,"id":"aeltf23clrt3","location":"Waynesboro"},"type":"Feature","geometry":{"type":"Point","coordinates":[-78.89005,38.06876]}},{"properties":{"latitude":39.4456898,"column_5":1,"date":{"end_time":"2012/12/02 00:00:00 -0500","original":"12/1/2012","granularity":"day","time":"2012/12/01 00:00:00 -0500"},"longitude":-76.5806723,"id":"aeltf1tdmsuh","location":"Pine Ridge Golf Course"},"type":"Feature","geometry":{"type":"Point","coordinates":[-76.5806723,39.4456898]}},{"properties":{"latitude":39.5332,"column_5":1,"date":{"end_time":"2012/12/02 00:00:00 -0500","original":"12/1/2012","granularity":"day","time":"2012/12/01 00:00:00 -0500"},"longitude":-77.31471,"id":"aeltf22u8cjt","location":"Woodsboro"},"type":"Feature","geometry":{"type":"Point","coordinates":[-77.31471,39.5332]}},{"properties":{"latitude":39.2041813,"column_5":1,"date":{"end_time":"2012/12/09 00:00:00 -0500","original":"12/8/2012","granularity":"day","time":"2012/12/08 00:00:00 -0500"},"longitude":-76.8649211,"id":"aeltf242t6we","location":"Columbia--Sebring Dr"},"type":"Feature","geometry":{"type":"Point","coordinates":[-76.8649211,39.2041813]}},{"properties":{"latitude":39.2153553,"column_5":1,"date":{"end_time":"2012/12/09 00:00:00 -0500","original":"12/8/2012","granularity":"day","time":"2012/12/08 00:00:00 -0500"},"longitude":-76.8614986,"id":"aeltf1qw0a6m","location":"The Mall in Columbia"},"type":"Feature","geometry":{"type":"Point","coordinates":[-76.8614986,39.2153553]}},{"properties":{"latitude":38.9698363,"column_5":1,"date":{"end_time":"2012/12/19 00:00:00 -0500","original":"12/18/2012","granularity":"day","time":"2012/12/18 00:00:00 -0500"},"longitude":-76.2390822,"id":"aeltf1u2sd1r","location":"Kent Narrows--Holiday Inn Express"},"type":"Feature","geometry":{"type":"Point","coordinates":[-76.2390822,38.9698363]}},{"properties":{"latitude":38.5912822,"column_5":1,"date":{"end_time":"2012/12/19 00:00:00 -0500","original":"12/18/2012","granularity":"day","time":"2012/12/18 00:00:00 -0500"},"longitude":-76.0465049,"id":"aeltf1p86y9g","location":"Choptank River--Rte. 50 Bridge (Talbot Co.)"},"type":"Feature","geometry":{"type":"Point","coordinates":[-76.0465049,38.5912822]}},{"properties":{"latitude":38.5713562,"column_5":1,"date":{"end_time":"2012/12/19 00:00:00 -0500","original":"12/18/2012","granularity":"day","time":"2012/12/18 00:00:00 -0500"},"longitude":-76.0625588,"id":"aeltf1vktm9r","location":"Bill Burton Fishing Pier State Park"},"type":"Feature","geometry":{"type":"Point","coordinates":[-76.0625588,38.5713562]}},{"properties":{"latitude":39.4577922,"column_5":1,"date":{"end_time":"2012/12/22 00:00:00 -0500","original":"12/21/2012","granularity":"day","time":"2012/12/21 00:00:00 -0500"},"longitude":-76.5871375,"id":"aeltf1vstin1","location":"Loch Raven Reservoir--Deadman's Cove Trail"},"type":"Feature","geometry":{"type":"Point","coordinates":[-76.5871375,39.4577922]}},{"properties":{"latitude":39.42121,"column_5":1,"date":{"end_time":"2012/12/22 00:00:00 -0500","original":"12/21/2012","granularity":"day","time":"2012/12/21 00:00:00 -0500"},"longitude":-76.62609,"id":"aeltf1rcery1","location":"Lutherville"},"type":"Feature","geometry":{"type":"Point","coordinates":[-76.62609,39.42121]}},{"properties":{"latitude":38.28576,"column_5":1,"date":{"end_time":"2012/12/23 00:00:00 -0500","original":"12/22/2012","granularity":"day","time":"2012/12/22 00:00:00 -0500"},"longitude":-77.46747,"id":"aeltf1xk19w2","location":"Fredericksburg"},"type":"Feature","geometry":{"type":"Point","coordinates":[-77.46747,38.28576]}},{"properties":{"latitude":36.1181049,"column_5":1,"date":{"end_time":"2012/12/28 00:00:00 -0500","original":"12/27/2012","granularity":"day","time":"2012/12/27 00:00:00 -0500"},"longitude":-79.8551527,"id":"aeltf1wulw00","location":"Westminster Gardens Cemetery"},"type":"Feature","geometry":{"type":"Point","coordinates":[-79.8551527,36.1181049]}},{"properties":{"latitude":39.6127586,"column_5":1,"date":{"end_time":"2013/01/28 00:00:00 -0500","original":"1/27/2013","granularity":"day","time":"2013/01/27 00:00:00 -0500"},"longitude":-77.2705012,"id":"aeltf203w2g2","location":"Keysville Rd S x Forest &amp; Stream Club Rd"},"type":"Feature","geometry":{"type":"Point","coordinates":[-77.2705012,39.6127586]}},{"properties":{"latitude":39.5686465,"column_5":1,"date":{"end_time":"2013/02/21 00:00:00 -0500","original":"2/20/2013","granularity":"day","time":"2013/02/20 00:00:00 -0500"},"longitude":-76.6104555,"id":"aeltf1wg9750","location":"Merryman Park"},"type":"Feature","geometry":{"type":"Point","coordinates":[-76.6104555,39.5686465]}},{"properties":{"latitude":39.0287153,"column_5":1,"date":{"end_time":"2013/02/21 00:00:00 -0500","original":"2/20/2013","granularity":"day","time":"2013/02/20 00:00:00 -0500"},"longitude":-76.800254,"id":"aeltf1ql16py","location":"Patuxent Research Refuge--South Tract"},"type":"Feature","geometry":{"type":"Point","coordinates":[-76.800254,39.0287153]}},{"properties":{"latitude":39.2188056,"column_5":1,"date":{"end_time":"2013/02/21 00:00:00 -0500","original":"2/20/2013","granularity":"day","time":"2013/02/20 00:00:00 -0500"},"longitude":-76.7017365,"id":"aeltf1rgin5j","location":"I-195 South Exit 3"},"type":"Feature","geometry":{"type":"Point","coordinates":[-76.7017365,39.2188056]}},{"properties":{"latitude":39.412753,"column_5":1,"date":{"end_time":"2013/02/23 00:00:00 -0500","original":"2/22/2013","granularity":"day","time":"2013/02/22 00:00:00 -0500"},"longitude":-76.770555,"id":"aeltf200lr58","location":"US-MD-Garrison-3-9 Garrison View Rd"},"type":"Feature","geometry":{"type":"Point","coordinates":[-76.770555,39.412753]}},{"properties":{"latitude":39.37219,"column_5":1,"date":{"end_time":"2013/02/23 00:00:00 -0500","original":"2/22/2013","granularity":"day","time":"2013/02/22 00:00:00 -0500"},"longitude":-76.682387,"id":"aeltf1pjlaof","location":"US-MD-Baltimore-2514-2590 Willow Glen Dr"},"type":"Feature","geometry":{"type":"Point","coordinates":[-76.682387,39.37219]}},{"properties":{"latitude":39.4948167,"column_5":1,"date":{"end_time":"2013/02/23 00:00:00 -0500","original":"2/22/2013","granularity":"day","time":"2013/02/22 00:00:00 -0500"},"longitude":-76.689453,"id":"aeltf1zain00","location":"Oregon Ridge Park"},"type":"Feature","geometry":{"type":"Point","coordinates":[-76.689453,39.4948167]}},{"properties":{"latitude":39.422004,"column_5":1,"date":{"end_time":"2013/02/24 00:00:00 -0500","original":"2/23/2013","granularity":"day","time":"2013/02/23 00:00:00 -0500"},"longitude":-76.77838,"id":"aeltf2496apo","location":"US-MD-Owings Mills-10401 Owings Mills Blvd"},"type":"Feature","geometry":{"type":"Point","coordinates":[-76.77838,39.422004]}},{"properties":{"latitude":39.409315,"column_5":1,"date":{"end_time":"2013/02/24 00:00:00 -0500","original":"2/23/2013","granularity":"day","time":"2013/02/23 00:00:00 -0500"},"longitude":-76.766224,"id":"aeltf1q5xe6y","location":"US-MD-Garrison - 39.4093x-76.7662 - Feb 23, 2013, 2:59 PM"},"type":"Feature","geometry":{"type":"Point","coordinates":[-76.766224,39.409315]}},{"properties":{"latitude":39.332121,"column_5":1,"date":{"end_time":"2013/02/24 00:00:00 -0500","original":"2/23/2013","granularity":"day","time":"2013/02/23 00:00:00 -0500"},"longitude":-76.641845,"id":"aeltf1qzwej4","location":"US-MD-Baltimore-1618-1650 Union Ave"},"type":"Feature","geometry":{"type":"Point","coordinates":[-76.641845,39.332121]}},{"properties":{"latitude":39.649207,"column_5":1,"date":{"end_time":"2013/02/25 00:00:00 -0500","original":"2/24/2013","granularity":"day","time":"2013/02/24 00:00:00 -0500"},"longitude":-76.54027,"id":"aeltf1uecsmq","location":"2957 Bradenbaugh Rd, White Hall"},"type":"Feature","geometry":{"type":"Point","coordinates":[-76.54027,39.649207]}},{"properties":{"latitude":39.75225,"column_5":1,"date":{"end_time":"2013/02/25 00:00:00 -0500","original":"2/24/2013","granularity":"day","time":"2013/02/24 00:00:00 -0500"},"longitude":-76.661395,"id":"aeltf1wb1ynw","location":"PA I-83 Welcome Center"},"type":"Feature","geometry":{"type":"Point","coordinates":[-76.661395,39.75225]}},{"properties":{"latitude":39.182395,"column_5":1,"date":{"end_time":"2013/03/03 00:00:00 -0500","original":"3/2/2013","granularity":"day","time":"2013/03/02 00:00:00 -0500"},"longitude":-76.633016,"id":"aeltf1x61c8p","location":"The Village at Waugh Chapel"},"type":"Feature","geometry":{"type":"Point","coordinates":[-76.633016,39.182395]}},{"properties":{"latitude":38.6271638,"column_5":1,"date":{"end_time":"2013/03/03 00:00:00 -0500","original":"3/2/2013","granularity":"day","time":"2013/03/02 00:00:00 -0500"},"longitude":-76.6752577,"id":"aeltf1v2ricz","location":"Kings Landing Park"},"type":"Feature","geometry":{"type":"Point","coordinates":[-76.6752577,38.6271638]}},{"properties":{"latitude":38.7067466,"column_5":1,"date":{"end_time":"2013/03/03 00:00:00 -0500","original":"3/2/2013","granularity":"day","time":"2013/03/02 00:00:00 -0500"},"longitude":-76.5311413,"id":"aeltf1wx0ux0","location":"North Beach--fishing pier"},"type":"Feature","geometry":{"type":"Point","coordinates":[-76.5311413,38.7067466]}},{"properties":{"latitude":38.957141,"column_5":1,"date":{"end_time":"2013/03/03 00:00:00 -0500","original":"3/2/2013","granularity":"day","time":"2013/03/02 00:00:00 -0500"},"longitude":-76.71728,"id":"aeltf1xi4u8n","location":"4500 Crain Hwy, Bowie"},"type":"Feature","geometry":{"type":"Point","coordinates":[-76.71728,38.957141]}},{"properties":{"latitude":38.999888,"column_5":1,"date":{"end_time":"2013/03/03 00:00:00 -0500","original":"3/2/2013","granularity":"day","time":"2013/03/02 00:00:00 -0500"},"longitude":-76.698583,"id":"aeltf1r4x8ad","location":"US-MD-Crofton-1681 Wilkshire Dr"},"type":"Feature","geometry":{"type":"Point","coordinates":[-76.698583,38.999888]}},{"properties":{"latitude":38.6904298,"column_5":1,"date":{"end_time":"2013/03/03 00:00:00 -0500","original":"3/2/2013","granularity":"day","time":"2013/03/02 00:00:00 -0500"},"longitude":-76.5332723,"id":"aeltf225ejil","location":"Chesapeake Beach Marina"},"type":"Feature","geometry":{"type":"Point","coordinates":[-76.5332723,38.6904298]}},{"properties":{"latitude":39.03684,"column_5":1,"date":{"end_time":"2013/03/03 00:00:00 -0500","original":"3/2/2013","granularity":"day","time":"2013/03/02 00:00:00 -0500"},"longitude":-76.678582,"id":"aeltf1wahbwo","location":"Gambrills"},"type":"Feature","geometry":{"type":"Point","coordinates":[-76.678582,39.03684]}},{"properties":{"latitude":38.6359808,"column_5":1,"date":{"end_time":"2013/03/03 00:00:00 -0500","original":"3/2/2013","granularity":"day","time":"2013/03/02 00:00:00 -0500"},"longitude":-76.6708803,"id":"aeltf1qldn3a","location":"Huntingtown NRMA"},"type":"Feature","geometry":{"type":"Point","coordinates":[-76.6708803,38.6359808]}},{"properties":{"latitude":38.65803,"column_5":1,"date":{"end_time":"2013/03/03 00:00:00 -0500","original":"3/2/2013","granularity":"day","time":"2013/03/02 00:00:00 -0500"},"longitude":-76.625611,"id":"aeltf1v164ix","location":"US-MD-Huntingtown-1014 Fornia Dr"},"type":"Feature","geometry":{"type":"Point","coordinates":[-76.625611,38.65803]}},{"properties":{"latitude":39.13265,"column_5":1,"date":{"end_time":"2013/03/03 00:00:00 -0500","original":"3/2/2013","granularity":"day","time":"2013/03/02 00:00:00 -0500"},"longitude":-76.643659,"id":"aeltf1vimern","location":"US-MD-Glen Burnie-7981 Covington Ave"},"type":"Feature","geometry":{"type":"Point","coordinates":[-76.643659,39.13265]}},{"properties":{"latitude":38.5904303,"column_5":1,"date":{"end_time":"2013/03/03 00:00:00 -0500","original":"3/2/2013","granularity":"day","time":"2013/03/02 00:00:00 -0500"},"longitude":-76.6555649,"id":"aeltf1vrpml3","location":"New Enterprise Court"},"type":"Feature","geometry":{"type":"Point","coordinates":[-76.6555649,38.5904303]}},{"properties":{"latitude":39.419549,"column_5":1,"date":{"end_time":"2013/03/04 00:00:00 -0500","original":"3/3/2013","granularity":"day","time":"2013/03/03 00:00:00 -0500"},"longitude":-76.668911,"id":"aeltf1xdk7nf","location":"Poulet"},"type":"Feature","geometry":{"type":"Point","coordinates":[-76.668911,39.419549]}},{"properties":{"latitude":39.47024,"column_5":1,"date":{"end_time":"2013/03/05 00:00:00 -0500","original":"3/4/2013","granularity":"day","time":"2013/03/04 00:00:00 -0500"},"longitude":-76.64109,"id":"aeltf1xhbulq","location":"Baltimore County Center for Maryland Agriculture and Farm Park"},"type":"Feature","geometry":{"type":"Point","coordinates":[-76.64109,39.47024]}},{"properties":{"latitude":39.360317,"column_5":1,"date":{"end_time":"2013/03/09 00:00:00 -0500","original":"3/8/2013","granularity":"day","time":"2013/03/08 00:00:00 -0500"},"longitude":-76.649825,"id":"aeltf201knnx","location":"I-83 Ditch"},"type":"Feature","geometry":{"type":"Point","coordinates":[-76.649825,39.360317]}},{"properties":{"latitude":39.2404099,"column_5":1,"date":{"end_time":"2013/03/17 00:00:00 -0400","original":"3/16/2013","granularity":"day","time":"2013/03/16 00:00:00 -0400"},"longitude":-76.8394012,"id":"aeltf1oyiiu9","location":"Columbia"},"type":"Feature","geometry":{"type":"Point","coordinates":[-76.8394012,39.2404099]}},{"properties":{"latitude":39.301674,"column_5":1,"date":{"end_time":"2013/03/25 00:00:00 -0400","original":"3/24/2013","granularity":"day","time":"2013/03/24 00:00:00 -0400"},"longitude":-76.494523,"id":"aeltf24wum9k","location":"Back River--Diamond Point Rd."},"type":"Feature","geometry":{"type":"Point","coordinates":[-76.494523,39.301674]}},{"properties":{"latitude":39.295901,"column_5":1,"date":{"end_time":"2013/03/25 00:00:00 -0400","original":"3/24/2013","granularity":"day","time":"2013/03/24 00:00:00 -0400"},"longitude":-76.50849,"id":"aeltf1tfk8q4","location":"US-MD-Baltimore-7900-7920 MD-150"},"type":"Feature","geometry":{"type":"Point","coordinates":[-76.50849,39.295901]}},{"properties":{"latitude":39.288977,"column_5":1,"date":{"end_time":"2013/03/25 00:00:00 -0400","original":"3/24/2013","granularity":"day","time":"2013/03/24 00:00:00 -0400"},"longitude":-76.526867,"id":"aeltf1q3fqsi","location":"US-MD-Baltimore-7101-7197 MD-150"},"type":"Feature","geometry":{"type":"Point","coordinates":[-76.526867,39.288977]}},{"properties":{"latitude":39.420508,"column_5":1,"date":{"end_time":"2013/03/27 00:00:00 -0400","original":"3/26/2013","granularity":"day","time":"2013/03/26 00:00:00 -0400"},"longitude":-76.643777,"id":"aeltf2324uxp","location":"US-MD-Towson - 39.4205x-76.6438"},"type":"Feature","geometry":{"type":"Point","coordinates":[-76.643777,39.420508]}},{"properties":{"latitude":39.378976,"column_5":1,"date":{"end_time":"2013/03/30 00:00:00 -0400","original":"3/29/2013","granularity":"day","time":"2013/03/29 00:00:00 -0400"},"longitude":-76.582064,"id":"aeltf245z700","location":"US-MD-Baltimore-6704 Canongate Rd"},"type":"Feature","geometry":{"type":"Point","coordinates":[-76.582064,39.378976]}},{"properties":{"latitude":39.700941,"column_5":1,"date":{"end_time":"2013/03/31 00:00:00 -0400","original":"3/30/2013","granularity":"day","time":"2013/03/30 00:00:00 -0400"},"longitude":-75.718187,"id":"aeltf1z4gjc1","location":"257 Delaplane Ave, Newark"},"type":"Feature","geometry":{"type":"Point","coordinates":[-75.718187,39.700941]}},{"properties":{"latitude":39.755089,"column_5":1,"date":{"end_time":"2013/03/31 00:00:00 -0400","original":"3/30/2013","granularity":"day","time":"2013/03/30 00:00:00 -0400"},"longitude":-75.548596,"id":"aeltf1pwggx6","location":"Brandywine Zoo"},"type":"Feature","geometry":{"type":"Point","coordinates":[-75.548596,39.755089]}},{"properties":{"latitude":39.266,"column_5":1,"date":{"end_time":"2013/03/31 00:00:00 -0400","original":"3/30/2013","granularity":"day","time":"2013/03/30 00:00:00 -0400"},"longitude":-75.449,"id":"aeltf2369rw9","location":"Bombay Hook NWR"},"type":"Feature","geometry":{"type":"Point","coordinates":[-75.449,39.266]}},{"properties":{"latitude":39.701872,"column_5":1,"date":{"end_time":"2013/03/31 00:00:00 -0400","original":"3/30/2013","granularity":"day","time":"2013/03/30 00:00:00 -0400"},"longitude":-75.607593,"id":"aeltf1zd14qe","location":"US-DE - 39.7019x-75.6076"},"type":"Feature","geometry":{"type":"Point","coordinates":[-75.607593,39.701872]}},{"properties":{"latitude":39.601924,"column_5":1,"date":{"end_time":"2013/03/31 00:00:00 -0400","original":"3/30/2013","granularity":"day","time":"2013/03/30 00:00:00 -0400"},"longitude":-75.825663,"id":"aeltf1s6u8aj","location":"Elkton"},"type":"Feature","geometry":{"type":"Point","coordinates":[-75.825663,39.601924]}},{"properties":{"latitude":39.290389,"column_5":1,"date":{"end_time":"2013/03/31 00:00:00 -0400","original":"3/30/2013","granularity":"day","time":"2013/03/30 00:00:00 -0400"},"longitude":-75.611899,"id":"aeltf20z2hy2","location":"Smyrna"},"type":"Feature","geometry":{"type":"Point","coordinates":[-75.611899,39.290389]}},{"properties":{"latitude":39.469192,"column_5":1,"date":{"end_time":"2013/03/31 00:00:00 -0400","original":"3/30/2013","granularity":"day","time":"2013/03/30 00:00:00 -0400"},"longitude":-75.650556,"id":"aeltf1wmp9e7","location":"US-DE-Middletown - 39.4692x-75.6506"},"type":"Feature","geometry":{"type":"Point","coordinates":[-75.650556,39.469192]}},{"properties":{"latitude":39.632827,"column_5":1,"date":{"end_time":"2013/03/31 00:00:00 -0400","original":"3/30/2013","granularity":"day","time":"2013/03/30 00:00:00 -0400"},"longitude":-75.655731,"id":"aeltf20m5olw","location":"Glasgow Shopping District"},"type":"Feature","geometry":{"type":"Point","coordinates":[-75.655731,39.632827]}},{"properties":{"latitude":39.660974,"column_5":1,"date":{"end_time":"2013/03/31 00:00:00 -0400","original":"3/30/2013","granularity":"day","time":"2013/03/30 00:00:00 -0400"},"longitude":-75.748783,"id":"aeltf1yqjmsq","location":"Newark"},"type":"Feature","geometry":{"type":"Point","coordinates":[-75.748783,39.660974]}},{"properties":{"latitude":38.88544,"column_5":1,"date":{"end_time":"2013/04/07 00:00:00 -0400","original":"4/6/2013","granularity":"day","time":"2013/04/06 00:00:00 -0400"},"longitude":-76.962032,"id":"aeltf2457eq6","location":"US-DC-Washington"},"type":"Feature","geometry":{"type":"Point","coordinates":[-76.962032,38.88544]}},{"properties":{"latitude":38.6455061,"column_5":1,"date":{"end_time":"2013/04/07 00:00:00 -0400","original":"4/6/2013","granularity":"day","time":"2013/04/06 00:00:00 -0400"},"longitude":-77.2361183,"id":"aeltf203j930","location":"Occoquan Bay NWR - CPW02"},"type":"Feature","geometry":{"type":"Point","coordinates":[-77.2361183,38.6455061]}},{"properties":{"latitude":38.653029,"column_5":1,"date":{"end_time":"2013/04/07 00:00:00 -0400","original":"4/6/2013","granularity":"day","time":"2013/04/06 00:00:00 -0400"},"longitude":-77.28662,"id":"aeltf219aovz","location":"US-VA-Woodbridge-2425 Prince William Pkwy"},"type":"Feature","geometry":{"type":"Point","coordinates":[-77.28662,38.653029]}},{"properties":{"latitude":39.325096,"column_5":1,"date":{"end_time":"2013/04/07 00:00:00 -0400","original":"4/6/2013","granularity":"day","time":"2013/04/06 00:00:00 -0400"},"longitude":-76.670681,"id":"aeltf203qfro","location":"US-MD-Baltimore-3407 Hilton Rd"},"type":"Feature","geometry":{"type":"Point","coordinates":[-76.670681,39.325096]}},{"properties":{"latitude":38.698077,"column_5":1,"date":{"end_time":"2013/04/07 00:00:00 -0400","original":"4/6/2013","granularity":"day","time":"2013/04/06 00:00:00 -0400"},"longitude":-77.254901,"id":"aeltf1zkc4f6","location":"Workhouse Arts Center"},"type":"Feature","geometry":{"type":"Point","coordinates":[-77.254901,38.698077]}},{"properties":{"latitude":39.067376,"column_5":1,"date":{"end_time":"2013/04/07 00:00:00 -0400","original":"4/6/2013","granularity":"day","time":"2013/04/06 00:00:00 -0400"},"longitude":-76.910974,"id":"aeltf24q2z7o","location":"US-MD - 39.0674x-76.9110"},"type":"Feature","geometry":{"type":"Point","coordinates":[-76.910974,39.067376]}},{"properties":{"latitude":39.362565,"column_5":1,"date":{"end_time":"2013/04/10 00:00:00 -0400","original":"4/9/2013","granularity":"day","time":"2013/04/09 00:00:00 -0400"},"longitude":-76.880602,"id":"aeltf24rm66d","location":"Patapsco Valley SP-McKeldin Area (Baltimore)"},"type":"Feature","geometry":{"type":"Point","coordinates":[-76.880602,39.362565]}},{"properties":{"latitude":39.3548743,"column_5":1,"date":{"end_time":"2013/04/10 00:00:00 -0400","original":"4/9/2013","granularity":"day","time":"2013/04/09 00:00:00 -0400"},"longitude":-76.8930531,"id":"aeltf1pmrys4","location":"Patapsco Valley SP--McKeldin Area"},"type":"Feature","geometry":{"type":"Point","coordinates":[-76.8930531,39.3548743]}},{"properties":{"latitude":38.899063,"column_5":1,"date":{"end_time":"2013/04/14 00:00:00 -0400","original":"4/13/2013","granularity":"day","time":"2013/04/13 00:00:00 -0400"},"longitude":-76.849702,"id":"aeltf1tculfw","location":"US-MD-Upper Marlboro - 38.8991x-76.8497 - Apr 13, 2013, 5:48 PM"},"type":"Feature","geometry":{"type":"Point","coordinates":[-76.849702,38.899063]}},{"properties":{"latitude":38.31329,"column_5":1,"date":{"end_time":"2013/04/14 00:00:00 -0400","original":"4/13/2013","granularity":"day","time":"2013/04/13 00:00:00 -0400"},"longitude":-76.535794,"id":"aeltf20rsacb","location":"US-MD-Hollywood - 38.3133x-76.5358"},"type":"Feature","geometry":{"type":"Point","coordinates":[-76.535794,38.31329]}},{"properties":{"latitude":37.9865573,"column_5":1,"date":{"end_time":"2013/04/14 00:00:00 -0400","original":"4/13/2013","granularity":"day","time":"2013/04/13 00:00:00 -0400"},"longitude":-76.044445,"id":"aeltf1x4b2vb","location":"Smith Island"},"type":"Feature","geometry":{"type":"Point","coordinates":[-76.044445,37.9865573]}},{"properties":{"latitude":38.0614053,"column_5":1,"date":{"end_time":"2013/04/14 00:00:00 -0400","original":"4/13/2013","granularity":"day","time":"2013/04/13 00:00:00 -0400"},"longitude":-76.3264847,"id":"aeltf1ssnn6b","location":"Point Lookout SP--The Causeway"},"type":"Feature","geometry":{"type":"Point","coordinates":[-76.3264847,38.0614053]}},{"properties":{"latitude":38.149428,"column_5":1,"date":{"end_time":"2013/04/14 00:00:00 -0400","original":"4/13/2013","granularity":"day","time":"2013/04/13 00:00:00 -0400"},"longitude":-76.367515,"id":"aeltf1u2ezcy","location":"US-MD-Lexington Park-17534 Three Notch Rd"},"type":"Feature","geometry":{"type":"Point","coordinates":[-76.367515,38.149428]}},{"properties":{"latitude":38.195528,"column_5":1,"date":{"end_time":"2013/04/14 00:00:00 -0400","original":"4/13/2013","granularity":"day","time":"2013/04/13 00:00:00 -0400"},"longitude":-76.393264,"id":"aeltf1uxcpvs","location":"US-MD-California-23171-23225 MD-235"},"type":"Feature","geometry":{"type":"Point","coordinates":[-76.393264,38.195528]}},{"properties":{"latitude":38.684764,"column_5":1,"date":{"end_time":"2013/04/14 00:00:00 -0400","original":"4/13/2013","granularity":"day","time":"2013/04/13 00:00:00 -0400"},"longitude":-76.87175,"id":"aeltf214fu0o","location":"US-MD-Brandywine - 38.6848x-76.8717"},"type":"Feature","geometry":{"type":"Point","coordinates":[-76.87175,38.684764]}},{"properties":{"latitude":38.662474,"column_5":1,"date":{"end_time":"2013/04/14 00:00:00 -0400","original":"4/13/2013","granularity":"day","time":"2013/04/13 00:00:00 -0400"},"longitude":-76.878784,"id":"aeltf1teyfcl","location":"US-MD-Brandywine-16305 McKendree Rd"},"type":"Feature","geometry":{"type":"Point","coordinates":[-76.878784,38.662474]}},{"properties":{"latitude":38.554843,"column_5":1,"date":{"end_time":"2013/04/14 00:00:00 -0400","original":"4/13/2013","granularity":"day","time":"2013/04/13 00:00:00 -0400"},"longitude":-76.840045,"id":"aeltf1smipn8","location":"US-MD-Bryantown-6622 Leonardtown Rd"},"type":"Feature","geometry":{"type":"Point","coordinates":[-76.840045,38.554843]}},{"properties":{"latitude":37.00634,"column_5":1,"date":{"end_time":"2013/05/11 00:00:00 -0400","original":"5/10/2013","granularity":"day","time":"2013/05/10 00:00:00 -0400"},"longitude":-79.91794,"id":"aeltf24dbu0v","location":"Franklin"},"type":"Feature","geometry":{"type":"Point","coordinates":[-79.91794,37.00634]}},{"properties":{"latitude":37.27233,"column_5":1,"date":{"end_time":"2013/05/11 00:00:00 -0400","original":"5/10/2013","granularity":"day","time":"2013/05/10 00:00:00 -0400"},"longitude":-79.95223,"id":"aeltf1x4kqm9","location":"Roanoke City"},"type":"Feature","geometry":{"type":"Point","coordinates":[-79.95223,37.27233]}},{"properties":{"latitude":38.14953,"column_5":1,"date":{"end_time":"2013/05/11 00:00:00 -0400","original":"5/10/2013","granularity":"day","time":"2013/05/10 00:00:00 -0400"},"longitude":-79.07165,"id":"aeltf20mavyw","location":"Staunton"},"type":"Feature","geometry":{"type":"Point","coordinates":[-79.07165,38.14953]}},{"properties":{"latitude":36.076115,"column_5":1,"date":{"end_time":"2013/05/19 00:00:00 -0400","original":"5/18/2013","granularity":"day","time":"2013/05/18 00:00:00 -0400"},"longitude":-80.366551,"id":"aeltf24qqeaz","location":"US-NC-Lewisville - 36.0761x-80.3666 - May 18, 2013, 8:56 AM"},"type":"Feature","geometry":{"type":"Point","coordinates":[-80.366551,36.076115]}},{"properties":{"latitude":36.083596,"column_5":1,"date":{"end_time":"2013/05/23 00:00:00 -0400","original":"5/22/2013","granularity":"day","time":"2013/05/22 00:00:00 -0400"},"longitude":-79.191328,"id":"aeltf238ex8h","location":"Efland-Cheeks Community School Park"},"type":"Feature","geometry":{"type":"Point","coordinates":[-79.191328,36.083596]}},{"properties":{"latitude":36.086536,"column_5":1,"date":{"end_time":"2013/05/23 00:00:00 -0400","original":"5/22/2013","granularity":"day","time":"2013/05/22 00:00:00 -0400"},"longitude":-79.283859,"id":"aeltf1u84aj1","location":"Fair Oaks Park"},"type":"Feature","geometry":{"type":"Point","coordinates":[-79.283859,36.086536]}},{"properties":{"latitude":36.058667,"column_5":1,"date":{"end_time":"2013/05/23 00:00:00 -0400","original":"5/22/2013","granularity":"day","time":"2013/05/22 00:00:00 -0400"},"longitude":-79.637823,"id":"aeltf1z1d2p5","location":"I-40 Alamance Rest Stop"},"type":"Feature","geometry":{"type":"Point","coordinates":[-79.637823,36.058667]}},{"properties":{"latitude":36.068433,"column_5":1,"date":{"end_time":"2013/05/25 00:00:00 -0400","original":"5/24/2013","granularity":"day","time":"2013/05/24 00:00:00 -0400"},"longitude":-80.145488,"id":"aeltf241wmjd","location":"US-NC-Winston-Salem-4057 Glenn Hi Rd"},"type":"Feature","geometry":{"type":"Point","coordinates":[-80.145488,36.068433]}},{"properties":{"latitude":32.40962,"column_5":1,"date":{"end_time":"2013/05/26 00:00:00 -0400","original":"5/25/2013","granularity":"day","time":"2013/05/25 00:00:00 -0400"},"longitude":-81.04808,"id":"aeltf1qg2m0k","location":"Jasper"},"type":"Feature","geometry":{"type":"Point","coordinates":[-81.04808,32.40962]}},{"properties":{"latitude":32.0835114,"column_5":1,"date":{"end_time":"2013/05/26 00:00:00 -0400","original":"5/25/2013","granularity":"day","time":"2013/05/25 00:00:00 -0400"},"longitude":-81.0998306,"id":"aeltf1y9a5pm","location":"Savannah"},"type":"Feature","geometry":{"type":"Point","coordinates":[-81.0998306,32.0835114]}},{"properties":{"latitude":33.854752,"column_5":1,"date":{"end_time":"2013/05/26 00:00:00 -0400","original":"5/25/2013","granularity":"day","time":"2013/05/25 00:00:00 -0400"},"longitude":-81.028246,"id":"aeltf1pphwkt","location":"Calhoun I-26 Rest Stop"},"type":"Feature","geometry":{"type":"Point","coordinates":[-81.028246,33.854752]}},{"properties":{"latitude":32.4203087,"column_5":1,"date":{"end_time":"2013/05/27 00:00:00 -0400","original":"5/26/2013","granularity":"day","time":"2013/05/26 00:00:00 -0400"},"longitude":-80.6625223,"id":"aeltf20l6p0w","location":"Lady's Island Boat Landing"},"type":"Feature","geometry":{"type":"Point","coordinates":[-80.6625223,32.4203087]}}],"is_temporal":true,"author":{"url":"","metadata":"","contact_name":"","contact_address":"","source":"","contact_phone":""},"source":"","pagination":{"sort":null,"start":0,"total":883,"limit":1000000},"state":"complete","tags":"","published":"2013-05-27T16:00:00Z","id":361302}