{"type":"FeatureCollection","data_type":"Dataset","url_type":null,"permissions":[{"permissions":{"download":true,"view":true},"group_id":"everyone"}],"classification":null,"title":"Opening dates of Wal-Mart stores and Supercenters, 1962-Jan 31, 2006 (Alaska and Hawaii excluded)","count":3176,"stream_id":133211,"contributor":{"url":"http://geocommons.com/users/29590","name":"TomCarden"},"data_attributes":null,"calculation_params":null,"icon_link":null,"link":"http://geocommons.com/overlays/133211.json","extent":[-124.391,25.4505,-67.8406,48.7678],"geometry_types":null,"unique_name":null,"name":"Opening dates of Wal-Mart stores and Supercenters, 1962-Jan 31, 2006 (Alaska and Hawaii excluded)","feature_count":3176,"description":"File used in paper The Diffusion of Wal-Mart and Economies of Density,” Econometrica, Vol. 79, No. 1 (January, 2011), 253-302","next_feature":null,"is_raster":false,"short_classification":"Y","stats":{"date_super":{"max":"2006/01/31 00:00:00 -0500","variance":1.30597213658425e+16,"mean":"2001/01/20 20:25:14 -0500","stdev":114279137.929206,"min":"1988/03/01 00:00:00 -0500","median":"2001/09/19 00:00:00 -0400"},"conversion":{"max":1,"count":2,"variance":0.160988102347372,"mean":0.798484848484848,"counts_by_value":{"0":399,"1":1581},"list":[1,0],"stdev":0.401233226873563,"min":0,"median":1},"type_store":{"count":2,"counts_by_value":{"Wal-Mart":1196,"Supercenter":1980},"list":["Supercenter","Wal-Mart"]},"opendate":{"max":"2006/01/31 00:00:00 -0500","variance":7.14120097371871e+16,"mean":"1991/09/01 01:43:54 -0400","stdev":267230256.028742,"min":"1962/07/01 00:00:00 -0400","median":"1991/07/02 00:00:00 -0400"},"storenum":{"max":5498,"variance":1843026.80534788,"mean":1860.03557934509,"stdev":1357.58123342505,"min":1,"median":1633}},"features":[{"properties":{"st":"05","streetaddr":"2110 WEST WALNUT","zipcode":"72756","county":"007","date_super":{"end_time":"1997/03/02 00:00:00 -0500","original":"3/1/1997 ","granularity":"day","time":"1997/03/01 00:00:00 -0500"},"geo_score":0.865,"strstate":"AR","conversion":1,"type_store":"Supercenter","opendate":{"end_time":"1962/07/02 00:00:00 -0400","original":"7/1/1962 ","granularity":"day","time":"1962/07/01 00:00:00 -0400"},"id":"a61znt8z6xtr","geo_precision":"range","storenum":1,"strcity":"Rogers"},"type":"Feature","geometry":{"type":"Point","coordinates":[-94.148036,36.334145]}},{"properties":{"st":"05","streetaddr":"1417 HWY 62/65 N","zipcode":"72601","county":"009","date_super":{"end_time":"1996/03/02 00:00:00 -0500","original":"3/1/1996 ","granularity":"day","time":"1996/03/01 00:00:00 -0500"},"geo_score":0.402,"strstate":"AR","conversion":1,"type_store":"Supercenter","opendate":{"end_time":"1964/08/02 00:00:00 -0400","original":"8/1/1964 ","granularity":"day","time":"1964/08/01 00:00:00 -0400"},"id":"a61znt05yy31","geo_precision":"range","storenum":2,"strcity":"Harrison"},"type":"Feature","geometry":{"type":"Point","coordinates":[-92.966037,36.203334]}},{"properties":{"st":"13","streetaddr":"30983 HWY 441 SOUTH","zipcode":"30529","county":"011","date_super":{"end_time":"2000/03/02 00:00:00 -0500","original":"3/1/2000 ","granularity":"day","time":"2000/03/01 00:00:00 -0500"},"geo_score":0.874,"strstate":"GA","conversion":1,"type_store":"Supercenter","opendate":{"end_time":"1988/04/13 00:00:00 -0400","original":"4/12/1988 ","granularity":"day","time":"1988/04/12 00:00:00 -0400"},"id":"a61znt843jlc","geo_precision":"range","storenum":3,"strcity":"Commerce"},"type":"Feature","geometry":{"type":"Point","coordinates":[-83.459929,34.24863]}},{"properties":{"st":"05","streetaddr":"2901 HWY 412 EAST","zipcode":"72761","county":"007","date_super":{"end_time":"2002/03/02 00:00:00 -0500","original":"3/1/2002 ","granularity":"day","time":"2002/03/01 00:00:00 -0500"},"geo_score":0.685,"strstate":"AR","conversion":1,"type_store":"Supercenter","opendate":{"end_time":"1965/08/02 00:00:00 -0400","original":"8/1/1965 ","granularity":"day","time":"1965/08/01 00:00:00 -0400"},"id":"a61znt7q2f8s","geo_precision":"street","storenum":4,"strcity":"Siloam Springs"},"type":"Feature","geometry":{"type":"Point","coordinates":[-94.513179,36.181117]}},{"properties":{"st":"05","streetaddr":"1155 HWY 65 NORTH","zipcode":"72032","county":"045","date_super":{"end_time":"1994/03/02 00:00:00 -0500","original":"3/1/1994 ","granularity":"day","time":"1994/03/01 00:00:00 -0500"},"geo_score":0.902,"strstate":"AR","conversion":1,"type_store":"Supercenter","opendate":{"end_time":"1972/05/02 00:00:00 -0400","original":"5/1/1972 ","granularity":"day","time":"1972/05/01 00:00:00 -0400"},"id":"a61znt8cdkz9","geo_precision":"range","storenum":5,"strcity":"Conway"},"type":"Feature","geometry":{"type":"Point","coordinates":[-92.439708,35.110687]}},{"properties":{"st":"05","streetaddr":"3801 CAMP ROBINSON RD.","zipcode":"72118","county":"119","date_super":null,"geo_score":0.915,"strstate":"AR","conversion":null,"type_store":"Wal-Mart","opendate":{"end_time":"1967/10/02 00:00:00 -0400","original":"10/1/1967 ","granularity":"day","time":"1967/10/01 00:00:00 -0400"},"id":"a61znt7p75xd","geo_precision":"range","storenum":7,"strcity":"North Little Rock"},"type":"Feature","geometry":{"type":"Point","coordinates":[-92.275897,34.790476]}},{"properties":{"st":"05","streetaddr":"1621 NORTH BUSINESS 9","zipcode":"72110","county":"029","date_super":{"end_time":"1993/03/02 00:00:00 -0500","original":"3/1/1993 ","granularity":"day","time":"1993/03/01 00:00:00 -0500"},"geo_score":0.532,"strstate":"AR","conversion":1,"type_store":"Supercenter","opendate":{"end_time":"1967/10/02 00:00:00 -0400","original":"10/1/1967 ","granularity":"day","time":"1967/10/01 00:00:00 -0400"},"id":"a61znsueijcc","geo_precision":"street","storenum":8,"strcity":"Morrilton"},"type":"Feature","geometry":{"type":"Point","coordinates":[-92.72818,35.131691]}},{"properties":{"st":"29","streetaddr":"1303 SOUTH MAIN","zipcode":"63801","county":"143","date_super":{"end_time":"2000/03/02 00:00:00 -0500","original":"3/1/2000 ","granularity":"day","time":"2000/03/01 00:00:00 -0500"},"geo_score":0.625,"strstate":"MO","conversion":1,"type_store":"Supercenter","opendate":{"end_time":"1968/03/02 00:00:00 -0500","original":"3/1/1968 ","granularity":"day","time":"1968/03/01 00:00:00 -0500"},"id":"a61znt9ha93u","geo_precision":"street","storenum":9,"strcity":"Sikeston"},"type":"Feature","geometry":{"type":"Point","coordinates":[-89.579482,36.86933]}},{"properties":{"st":"40","streetaddr":"2020 SOUTH MUSKOGEE","zipcode":"74464","county":"021","date_super":{"end_time":"1998/03/02 00:00:00 -0500","original":"3/1/1998 ","granularity":"day","time":"1998/03/01 00:00:00 -0500"},"geo_score":0.829,"strstate":"OK","conversion":1,"type_store":"Supercenter","opendate":{"end_time":"1968/07/02 00:00:00 -0400","original":"7/1/1968 ","granularity":"day","time":"1968/07/01 00:00:00 -0400"},"id":"a61znszwktqc","geo_precision":"range","storenum":10,"strcity":"Tahlequah"},"type":"Feature","geometry":{"type":"Point","coordinates":[-94.977187,35.890855]}},{"properties":{"st":"05","streetaddr":"65 WAL-MART DRIVE","zipcode":"72653","county":"005","date_super":{"end_time":"2002/02/21 00:00:00 -0500","original":"2/20/2002 ","granularity":"day","time":"2002/02/20 00:00:00 -0500"},"geo_score":0.593,"strstate":"AR","conversion":1,"type_store":"Supercenter","opendate":{"end_time":"1968/03/02 00:00:00 -0500","original":"3/1/1968 ","granularity":"day","time":"1968/03/01 00:00:00 -0500"},"id":"a61znszdjaaw","geo_precision":"zip","storenum":11,"strcity":"Mountain Home"},"type":"Feature","geometry":{"type":"Point","coordinates":[-92.465717,36.452566]}},{"properties":{"st":"40","streetaddr":"1500 LYNN RIGGS BLVD","zipcode":"74017","county":"131","date_super":{"end_time":"1994/03/02 00:00:00 -0500","original":"3/1/1994 ","granularity":"day","time":"1994/03/01 00:00:00 -0500"},"geo_score":0.892,"strstate":"OK","conversion":1,"type_store":"Supercenter","opendate":{"end_time":"1968/07/02 00:00:00 -0400","original":"7/1/1968 ","granularity":"day","time":"1968/07/01 00:00:00 -0400"},"id":"a61znt9be7to","geo_precision":"range","storenum":12,"strcity":"Claremore"},"type":"Feature","geometry":{"type":"Point","coordinates":[-95.60734,36.32548]}},{"properties":{"st":"29","streetaddr":"2705 GRAND AVE","zipcode":"64836","county":"097","date_super":{"end_time":"1996/03/02 00:00:00 -0500","original":"3/1/1996 ","granularity":"day","time":"1996/03/01 00:00:00 -0500"},"geo_score":0.894,"strstate":"MO","conversion":1,"type_store":"Supercenter","opendate":{"end_time":"1968/11/02 00:00:00 -0500","original":"11/1/1968 ","granularity":"day","time":"1968/11/01 00:00:00 -0500"},"id":"a61znsybo7ov","geo_precision":"range","storenum":13,"strcity":"Carthage"},"type":"Feature","geometry":{"type":"Point","coordinates":[-94.310477,37.141918]}},{"properties":{"st":"29","streetaddr":"1800 S JEFFERSON","zipcode":"65536","county":"105","date_super":{"end_time":"1999/03/02 00:00:00 -0500","original":"3/1/1999 ","granularity":"day","time":"1999/03/01 00:00:00 -0500"},"geo_score":0.849,"strstate":"MO","conversion":1,"type_store":"Supercenter","opendate":{"end_time":"1969/04/02 00:00:00 -0500","original":"4/1/1969 ","granularity":"day","time":"1969/04/01 00:00:00 -0500"},"id":"a61znta8zkvv","geo_precision":"range","storenum":14,"strcity":"Lebanon"},"type":"Feature","geometry":{"type":"Point","coordinates":[-92.649472,37.658495]}},{"properties":{"st":"29","streetaddr":"1310 PREACHER RD/HGWY 160","zipcode":"65775","county":"091","date_super":{"end_time":"1995/03/02 00:00:00 -0500","original":"3/1/1995 ","granularity":"day","time":"1995/03/01 00:00:00 -0500"},"geo_score":0.729,"strstate":"MO","conversion":1,"type_store":"Supercenter","opendate":{"end_time":"1969/05/02 00:00:00 -0400","original":"5/1/1969 ","granularity":"day","time":"1969/05/01 00:00:00 -0400"},"id":"a61znt48iu79","geo_precision":"street","storenum":15,"strcity":"West Plains"},"type":"Feature","geometry":{"type":"Point","coordinates":[-91.860475,36.727714]}},{"properties":{"st":"05","streetaddr":"2214 FAYETTEVILLE RD","zipcode":"72956","county":"033","date_super":{"end_time":"2000/03/02 00:00:00 -0500","original":"3/1/2000 ","granularity":"day","time":"2000/03/01 00:00:00 -0500"},"geo_score":0.902,"strstate":"AR","conversion":1,"type_store":"Supercenter","opendate":{"end_time":"1969/04/02 00:00:00 -0500","original":"4/1/1969 ","granularity":"day","time":"1969/04/01 00:00:00 -0500"},"id":"a61znt2n9zrz","geo_precision":"range","storenum":16,"strcity":"Van Buren"},"type":"Feature","geometry":{"type":"Point","coordinates":[-94.356251,35.469947]}},{"properties":{"st":"29","streetaddr":"3200 LUSK DRIVE","zipcode":"64850","county":"145","date_super":{"end_time":"1993/03/02 00:00:00 -0500","original":"3/1/1993 ","granularity":"day","time":"1993/03/01 00:00:00 -0500"},"geo_score":0.72,"strstate":"MO","conversion":1,"type_store":"Supercenter","opendate":{"end_time":"1969/05/02 00:00:00 -0400","original":"5/1/1969 ","granularity":"day","time":"1969/05/01 00:00:00 -0400"},"id":"a61znt2fpm71","geo_precision":"street","storenum":17,"strcity":"Neosho"},"type":"Feature","geometry":{"type":"Point","coordinates":[-94.394421,36.841485]}},{"properties":{"st":"05","streetaddr":"2500 MALCOLM ST/HWY 67 NORTH","zipcode":"72112","county":"067","date_super":null,"geo_score":0.806,"strstate":"AR","conversion":null,"type_store":"Wal-Mart","opendate":{"end_time":"1969/11/02 00:00:00 -0500","original":"11/1/1969 ","granularity":"day","time":"1969/11/01 00:00:00 -0500"},"id":"a61znt0h841f","geo_precision":"street","storenum":18,"strcity":"Newport"},"type":"Feature","geometry":{"type":"Point","coordinates":[-91.21215,35.71028]}},{"properties":{"st":"29","streetaddr":"333 S WESTWOOD","zipcode":"63901","county":"023","date_super":{"end_time":"1990/04/04 00:00:00 -0400","original":"4/3/1990 ","granularity":"day","time":"1990/04/03 00:00:00 -0400"},"geo_score":0.812,"strstate":"MO","conversion":0,"type_store":"Supercenter","opendate":{"end_time":"1990/04/04 00:00:00 -0400","original":"4/3/1990 ","granularity":"day","time":"1990/04/03 00:00:00 -0400"},"id":"a61znstwjo6f","geo_precision":"range","storenum":19,"strcity":"Poplar Bluff"},"type":"Feature","geometry":{"type":"Point","coordinates":[-90.408144,36.755411]}},{"properties":{"st":"29","streetaddr":"1712 EAST OHIO","zipcode":"64735","county":"083","date_super":{"end_time":"1999/03/02 00:00:00 -0500","original":"3/1/1999 ","granularity":"day","time":"1999/03/01 00:00:00 -0500"},"geo_score":0.831,"strstate":"MO","conversion":1,"type_store":"Supercenter","opendate":{"end_time":"1970/10/02 00:00:00 -0400","original":"10/1/1970 ","granularity":"day","time":"1970/10/01 00:00:00 -0400"},"id":"a61znsvfasjj","geo_precision":"range","storenum":20,"strcity":"Clinton"},"type":"Feature","geometry":{"type":"Point","coordinates":[-93.749461,38.366172]}},{"properties":{"st":"29","streetaddr":"185 ST ROBERT BLVD","zipcode":"65584","county":"169","date_super":{"end_time":"2001/08/23 00:00:00 -0400","original":"8/22/2001 ","granularity":"day","time":"2001/08/22 00:00:00 -0400"},"geo_score":0.79,"strstate":"MO","conversion":1,"type_store":"Supercenter","opendate":{"end_time":"1970/03/02 00:00:00 -0500","original":"3/1/1970 ","granularity":"day","time":"1970/03/01 00:00:00 -0500"},"id":"a61znt6wgda3","geo_precision":"street","storenum":21,"strcity":"St. Robert"},"type":"Feature","geometry":{"type":"Point","coordinates":[-92.146829,37.82642]}},{"properties":{"st":"40","streetaddr":"4901 SO. MILL ROAD","zipcode":"74361","county":"097","date_super":{"end_time":"2005/05/19 00:00:00 -0400","original":"5/18/2005 ","granularity":"day","time":"2005/05/18 00:00:00 -0400"},"geo_score":0.52,"strstate":"OK","conversion":1,"type_store":"Supercenter","opendate":{"end_time":"1970/10/02 00:00:00 -0400","original":"10/1/1970 ","granularity":"day","time":"1970/10/01 00:00:00 -0400"},"id":"a61znt7ivmku","geo_precision":"street","storenum":22,"strcity":"Pryor"},"type":"Feature","geometry":{"type":"Point","coordinates":[-95.319049,36.3062]}},{"properties":{"st":"22","streetaddr":"1201 N SERVICE ROAD EAST","zipcode":"71270","county":"061","date_super":{"end_time":"1994/03/02 00:00:00 -0500","original":"3/1/1994 ","granularity":"day","time":"1994/03/01 00:00:00 -0500"},"geo_score":0.415,"strstate":"LA","conversion":1,"type_store":"Supercenter","opendate":{"end_time":"1970/11/02 00:00:00 -0500","original":"11/1/1970 ","granularity":"day","time":"1970/11/01 00:00:00 -0500"},"id":"a61znsxni08h","geo_precision":"street","storenum":23,"strcity":"Ruston"},"type":"Feature","geometry":{"type":"Point","coordinates":[-92.0807,32.516689]}},{"properties":{"st":"05","streetaddr":"2000 JOHN HARDEN DR","zipcode":"72076","county":"119","date_super":{"end_time":"1999/03/02 00:00:00 -0500","original":"3/1/1999 ","granularity":"day","time":"1999/03/01 00:00:00 -0500"},"geo_score":0.943,"strstate":"AR","conversion":1,"type_store":"Supercenter","opendate":{"end_time":"1971/04/02 00:00:00 -0500","original":"4/1/1971 ","granularity":"day","time":"1971/04/01 00:00:00 -0500"},"id":"a61znt08fe5k","geo_precision":"range","storenum":24,"strcity":"Jacksonville"},"type":"Feature","geometry":{"type":"Point","coordinates":[-92.11035,34.883828]}},{"properties":{"st":"29","streetaddr":"4820 SO. CLARK ST","zipcode":"65265","county":"007","date_super":{"end_time":"2005/05/19 00:00:00 -0400","original":"5/18/2005 ","granularity":"day","time":"2005/05/18 00:00:00 -0400"},"geo_score":0.5,"strstate":"MO","conversion":1,"type_store":"Supercenter","opendate":{"end_time":"1971/02/02 00:00:00 -0500","original":"2/1/1971 ","granularity":"day","time":"1971/02/01 00:00:00 -0500"},"id":"a61znt8fqzt9","geo_precision":"street","storenum":25,"strcity":"Mexico"},"type":"Feature","geometry":{"type":"Point","coordinates":[-91.884766,39.170871]}},{"properties":{"st":"20","streetaddr":"3450 S. 4TH TRAFFICWAY","zipcode":"66048","county":"103","date_super":null,"geo_score":0.513,"strstate":"KS","conversion":null,"type_store":"Wal-Mart","opendate":{"end_time":"1970/11/02 00:00:00 -0500","original":"11/1/1970 ","granularity":"day","time":"1970/11/01 00:00:00 -0500"},"id":"a61znszoa47y","geo_precision":"street","storenum":26,"strcity":"Leavenworth"},"type":"Feature","geometry":{"type":"Point","coordinates":[-94.914155,39.319931]}},{"properties":{"st":"29","streetaddr":"1101 HWY 32 WEST","zipcode":"65560","county":"065","date_super":{"end_time":"1999/03/02 00:00:00 -0500","original":"3/1/1999 ","granularity":"day","time":"1999/03/01 00:00:00 -0500"},"geo_score":0.743,"strstate":"MO","conversion":1,"type_store":"Supercenter","opendate":{"end_time":"1971/02/02 00:00:00 -0500","original":"2/1/1971 ","granularity":"day","time":"1971/02/01 00:00:00 -0500"},"id":"a61znt36ar3g","geo_precision":"range","storenum":27,"strcity":"Salem"},"type":"Feature","geometry":{"type":"Point","coordinates":[-91.546032,37.636087]}},{"properties":{"st":"40","streetaddr":"2415 N.W. MAIN ST","zipcode":"74354","county":"115","date_super":{"end_time":"2002/03/02 00:00:00 -0500","original":"3/1/2002 ","granularity":"day","time":"2002/03/01 00:00:00 -0500"},"geo_score":0.524,"strstate":"OK","conversion":1,"type_store":"Supercenter","opendate":{"end_time":"1971/05/02 00:00:00 -0400","original":"5/1/1971 ","granularity":"day","time":"1971/05/01 00:00:00 -0400"},"id":"a61znsusvs03","geo_precision":"street","storenum":28,"strcity":"Miami"},"type":"Feature","geometry":{"type":"Point","coordinates":[-94.85117,36.976639]}},{"properties":{"st":"29","streetaddr":"724 STADIUM WEST BLVD","zipcode":"65109","county":"051","date_super":{"end_time":"1989/03/02 00:00:00 -0500","original":"3/1/1989 ","granularity":"day","time":"1989/03/01 00:00:00 -0500"},"geo_score":0.976,"strstate":"MO","conversion":1,"type_store":"Supercenter","opendate":{"end_time":"1971/08/02 00:00:00 -0400","original":"8/1/1971 ","granularity":"day","time":"1971/08/01 00:00:00 -0400"},"id":"a61znt61up8g","geo_precision":"range","storenum":29,"strcity":"Jefferson City"},"type":"Feature","geometry":{"type":"Point","coordinates":[-92.185145,38.564489]}},{"properties":{"st":"29","streetaddr":"2025 BUS. HWY 60 WEST","zipcode":"63841","county":"207","date_super":{"end_time":"2005/05/19 00:00:00 -0400","original":"5/18/2005 ","granularity":"day","time":"2005/05/18 00:00:00 -0400"},"geo_score":0.575,"strstate":"MO","conversion":1,"type_store":"Supercenter","opendate":{"end_time":"1971/11/02 00:00:00 -0500","original":"11/1/1971 ","granularity":"day","time":"1971/11/01 00:00:00 -0500"},"id":"a61znsyxfaxc","geo_precision":"street","storenum":30,"strcity":"Dexter"},"type":"Feature","geometry":{"type":"Point","coordinates":[-89.953355,36.79946]}},{"properties":{"st":"40","streetaddr":"3108 N BROADWAY","zipcode":"74953","county":"079","date_super":{"end_time":"1995/03/02 00:00:00 -0500","original":"3/1/1995 ","granularity":"day","time":"1995/03/01 00:00:00 -0500"},"geo_score":0.691,"strstate":"OK","conversion":1,"type_store":"Supercenter","opendate":{"end_time":"1971/06/02 00:00:00 -0400","original":"6/1/1971 ","granularity":"day","time":"1971/06/01 00:00:00 -0400"},"id":"a61znt3z4li3","geo_precision":"street","storenum":31,"strcity":"Poteau"},"type":"Feature","geometry":{"type":"Point","coordinates":[-94.632948,35.045605]}},{"properties":{"st":"29","streetaddr":"2050 WEST HWY 76","zipcode":"65616","county":"213","date_super":null,"geo_score":0.78,"strstate":"MO","conversion":null,"type_store":"Wal-Mart","opendate":{"end_time":"1971/06/02 00:00:00 -0400","original":"6/1/1971 ","granularity":"day","time":"1971/06/01 00:00:00 -0400"},"id":"a61znt3ebr0u","geo_precision":"range","storenum":32,"strcity":"Branson"},"type":"Feature","geometry":{"type":"Point","coordinates":[-93.259842,36.640851]}},{"properties":{"st":"05","streetaddr":"1710 SO. 4TH ST","zipcode":"71852","county":"061","date_super":{"end_time":"2003/09/18 00:00:00 -0400","original":"9/17/2003 ","granularity":"day","time":"2003/09/17 00:00:00 -0400"},"geo_score":0.53,"strstate":"AR","conversion":1,"type_store":"Supercenter","opendate":{"end_time":"1971/06/02 00:00:00 -0400","original":"6/1/1971 ","granularity":"day","time":"1971/06/01 00:00:00 -0400"},"id":"a61znt9ye6vf","geo_precision":"street","storenum":33,"strcity":"Nashville"},"type":"Feature","geometry":{"type":"Point","coordinates":[-93.788686,34.045389]}},{"properties":{"st":"29","streetaddr":"2250 LINCOLN AVENUE","zipcode":"64772","county":"217","date_super":{"end_time":"2003/05/22 00:00:00 -0400","original":"5/21/2003 ","granularity":"day","time":"2003/05/21 00:00:00 -0400"},"geo_score":0.522,"strstate":"MO","conversion":1,"type_store":"Supercenter","opendate":{"end_time":"1971/11/02 00:00:00 -0500","original":"11/1/1971 ","granularity":"day","time":"1971/11/01 00:00:00 -0500"},"id":"a61znt7bpubx","geo_precision":"street","storenum":34,"strcity":"Nevada"},"type":"Feature","geometry":{"type":"Point","coordinates":[-94.099869,37.391323]}},{"properties":{"st":"20","streetaddr":"101 EAST BLUEMONT AVENUE","zipcode":"66502","county":"161","date_super":{"end_time":"2004/03/18 00:00:00 -0500","original":"3/17/2004 ","granularity":"day","time":"2004/03/17 00:00:00 -0500"},"geo_score":0.9,"strstate":"KS","conversion":1,"type_store":"Supercenter","opendate":{"end_time":"1971/10/02 00:00:00 -0400","original":"10/1/1971 ","granularity":"day","time":"1971/10/01 00:00:00 -0400"},"id":"a61znt1xjlmh","geo_precision":"range","storenum":35,"strcity":"Manhattan"},"type":"Feature","geometry":{"type":"Point","coordinates":[-96.558692,39.186668]}},{"properties":{"st":"05","streetaddr":"2802 WEST KINGS HIGHWAY","zipcode":"72450","county":"055","date_super":{"end_time":"1996/03/02 00:00:00 -0500","original":"3/1/1996 ","granularity":"day","time":"1996/03/01 00:00:00 -0500"},"geo_score":0.924,"strstate":"AR","conversion":1,"type_store":"Supercenter","opendate":{"end_time":"1971/11/02 00:00:00 -0500","original":"11/1/1971 ","granularity":"day","time":"1971/11/01 00:00:00 -0500"},"id":"a61znsv1nddn","geo_precision":"range","storenum":36,"strcity":"Paragould"},"type":"Feature","geometry":{"type":"Point","coordinates":[-90.524918,36.059925]}},{"properties":{"st":"29","streetaddr":"701 WALTON DRIVE","zipcode":"63640","county":"187","date_super":{"end_time":"1989/03/02 00:00:00 -0500","original":"3/1/1989 ","granularity":"day","time":"1989/03/01 00:00:00 -0500"},"geo_score":0.922,"strstate":"MO","conversion":1,"type_store":"Supercenter","opendate":{"end_time":"1971/09/02 00:00:00 -0400","original":"9/1/1971 ","granularity":"day","time":"1971/09/01 00:00:00 -0400"},"id":"a61znsvmypn4","geo_precision":"range","storenum":37,"strcity":"Farmington"},"type":"Feature","geometry":{"type":"Point","coordinates":[-90.435012,37.787944]}},{"properties":{"st":"40","streetaddr":"1907 SE WASHINGTON ST.","zipcode":"74745","county":"089","date_super":{"end_time":"2004/03/18 00:00:00 -0500","original":"3/17/2004 ","granularity":"day","time":"2004/03/17 00:00:00 -0500"},"geo_score":0.902,"strstate":"OK","conversion":1,"type_store":"Supercenter","opendate":{"end_time":"1971/12/10 00:00:00 -0500","original":"12/9/1971 ","granularity":"day","time":"1971/12/09 00:00:00 -0500"},"id":"a61znt3efagd","geo_precision":"range","storenum":38,"strcity":"Idabel"},"type":"Feature","geometry":{"type":"Point","coordinates":[-94.800283,33.89552]}},{"properties":{"st":"20","streetaddr":"2400 SOUTH MAIN","zipcode":"66701","county":"011","date_super":null,"geo_score":0.834,"strstate":"KS","conversion":null,"type_store":"Wal-Mart","opendate":{"end_time":"1972/03/02 00:00:00 -0500","original":"3/1/1972 ","granularity":"day","time":"1972/03/01 00:00:00 -0500"},"id":"a61znsugurw3","geo_precision":"range","storenum":39,"strcity":"Fort Scott"},"type":"Feature","geometry":{"type":"Point","coordinates":[-94.705373,37.810235]}},{"properties":{"st":"29","streetaddr":"1301 HWY 24 EAST","zipcode":"65270","county":"175","date_super":{"end_time":"1995/03/02 00:00:00 -0500","original":"3/1/1995 ","granularity":"day","time":"1995/03/01 00:00:00 -0500"},"geo_score":0.634,"strstate":"MO","conversion":1,"type_store":"Supercenter","opendate":{"end_time":"1971/11/02 00:00:00 -0500","original":"11/1/1971 ","granularity":"day","time":"1971/11/01 00:00:00 -0500"},"id":"a61znsv8nhed","geo_precision":"street","storenum":40,"strcity":"Moberly"},"type":"Feature","geometry":{"type":"Point","coordinates":[-92.454,39.43233]}},{"properties":{"st":"40","streetaddr":"4000 GREEN COUNTRY RD","zipcode":"74006","county":"147","date_super":{"end_time":"1994/03/02 00:00:00 -0500","original":"3/1/1994 ","granularity":"day","time":"1994/03/01 00:00:00 -0500"},"geo_score":0.963,"strstate":"OK","conversion":1,"type_store":"Supercenter","opendate":{"end_time":"1972/05/02 00:00:00 -0400","original":"5/1/1972 ","granularity":"day","time":"1972/05/01 00:00:00 -0400"},"id":"a61znt6ho8gm","geo_precision":"range","storenum":41,"strcity":"Bartlesville"},"type":"Feature","geometry":{"type":"Point","coordinates":[-95.932435,36.739207]}},{"properties":{"st":"20","streetaddr":"1705 WEST 11TH STREET","zipcode":"67337","county":"125","date_super":null,"geo_score":0.89,"strstate":"KS","conversion":null,"type_store":"Wal-Mart","opendate":{"end_time":"1973/02/02 00:00:00 -0500","original":"2/1/1973 ","granularity":"day","time":"1973/02/01 00:00:00 -0500"},"id":"a61znswp2jyx","geo_precision":"range","storenum":42,"strcity":"Coffeyville"},"type":"Feature","geometry":{"type":"Point","coordinates":[-95.643001,37.033267]}},{"properties":{"st":"20","streetaddr":"521 EAST CHESTNUT ST","zipcode":"66441","county":"061","date_super":{"end_time":"2000/03/02 00:00:00 -0500","original":"3/1/2000 ","granularity":"day","time":"2000/03/01 00:00:00 -0500"},"geo_score":0.916,"strstate":"KS","conversion":1,"type_store":"Supercenter","opendate":{"end_time":"1972/05/02 00:00:00 -0400","original":"5/1/1972 ","granularity":"day","time":"1972/05/01 00:00:00 -0400"},"id":"a61znt62wuso","geo_precision":"range","storenum":43,"strcity":"Junction City"},"type":"Feature","geometry":{"type":"Point","coordinates":[-96.825073,39.021883]}},{"properties":{"st":"29","streetaddr":"1802 SOUTH BUSINESS HWY 54","zipcode":"65026","county":"131","date_super":null,"geo_score":0.743,"strstate":"MO","conversion":null,"type_store":"Wal-Mart","opendate":{"end_time":"1972/02/02 00:00:00 -0500","original":"2/1/1972 ","granularity":"day","time":"1972/02/01 00:00:00 -0500"},"id":"a61znt3wfc7e","geo_precision":"street","storenum":44,"strcity":"Eldon"},"type":"Feature","geometry":{"type":"Point","coordinates":[-92.565568,38.333763]}},{"properties":{"st":"05","streetaddr":"1815 EAST HIGHLAND DRIVE","zipcode":"72401","county":"031","date_super":{"end_time":"1994/03/02 00:00:00 -0500","original":"3/1/1994 ","granularity":"day","time":"1994/03/01 00:00:00 -0500"},"geo_score":0.957,"strstate":"AR","conversion":1,"type_store":"Supercenter","opendate":{"end_time":"1972/08/02 00:00:00 -0400","original":"8/1/1972 ","granularity":"day","time":"1972/08/01 00:00:00 -0400"},"id":"a61znt45qk1f","geo_precision":"range","storenum":45,"strcity":"Jonesboro"},"type":"Feature","geometry":{"type":"Point","coordinates":[-90.685164,35.821221]}},{"properties":{"st":"29","streetaddr":"2451 S. SPRINGFIELD","zipcode":"65613","county":"167","date_super":{"end_time":"1999/03/02 00:00:00 -0500","original":"3/1/1999 ","granularity":"day","time":"1999/03/01 00:00:00 -0500"},"geo_score":0.523,"strstate":"MO","conversion":1,"type_store":"Supercenter","opendate":{"end_time":"1972/08/02 00:00:00 -0400","original":"8/1/1972 ","granularity":"day","time":"1972/08/01 00:00:00 -0400"},"id":"a61znsy5q2x9","geo_precision":"street","storenum":46,"strcity":"Bolivar"},"type":"Feature","geometry":{"type":"Point","coordinates":[-93.396757,37.594649]}},{"properties":{"st":"40","streetaddr":"1101 WEST RUTH AVE","zipcode":"74955","county":"135","date_super":{"end_time":"2001/03/15 00:00:00 -0500","original":"3/14/2001 ","granularity":"day","time":"2001/03/14 00:00:00 -0500"},"geo_score":0.732,"strstate":"OK","conversion":1,"type_store":"Supercenter","opendate":{"end_time":"1972/07/02 00:00:00 -0400","original":"7/1/1972 ","granularity":"day","time":"1972/07/01 00:00:00 -0400"},"id":"a61znsvc89p6","geo_precision":"street","storenum":47,"strcity":"Sallisaw"},"type":"Feature","geometry":{"type":"Point","coordinates":[-94.812222,35.44892]}},{"properties":{"st":"29","streetaddr":"885 HIGHWAY 60","zipcode":"65708","county":"009","date_super":{"end_time":"1999/03/02 00:00:00 -0500","original":"3/1/1999 ","granularity":"day","time":"1999/03/01 00:00:00 -0500"},"geo_score":0.794,"strstate":"MO","conversion":1,"type_store":"Supercenter","opendate":{"end_time":"1972/11/02 00:00:00 -0500","original":"11/1/1972 ","granularity":"day","time":"1972/11/01 00:00:00 -0500"},"id":"a61znsyd4n0z","geo_precision":"range","storenum":48,"strcity":"Monett"},"type":"Feature","geometry":{"type":"Point","coordinates":[-93.947829,36.915901]}},{"properties":{"st":"40","streetaddr":"1911 E.JACKSON ST.","zipcode":"74743","county":"023","date_super":{"end_time":"2002/03/02 00:00:00 -0500","original":"3/1/2002 ","granularity":"day","time":"2002/03/01 00:00:00 -0500"},"geo_score":0.471,"strstate":"OK","conversion":1,"type_store":"Supercenter","opendate":{"end_time":"1972/10/02 00:00:00 -0400","original":"10/1/1972 ","granularity":"day","time":"1972/10/01 00:00:00 -0400"},"id":"a61znsu7qrev","geo_precision":"street","storenum":49,"strcity":"Hugo"},"type":"Feature","geometry":{"type":"Point","coordinates":[-95.510044,34.010795]}},{"properties":{"st":"40","streetaddr":"268 SO. 7TH ST.","zipcode":"74301","county":"035","date_super":{"end_time":"2003/01/23 00:00:00 -0500","original":"1/22/2003 ","granularity":"day","time":"2003/01/22 00:00:00 -0500"},"geo_score":0.536,"strstate":"OK","conversion":1,"type_store":"Supercenter","opendate":{"end_time":"1973/09/02 00:00:00 -0400","original":"9/1/1973 ","granularity":"day","time":"1973/09/01 00:00:00 -0400"},"id":"a61znt9piz6d","geo_precision":"street","storenum":50,"strcity":"Vinita"},"type":"Feature","geometry":{"type":"Point","coordinates":[-95.143509,36.63598]}},{"properties":{"st":"29","streetaddr":"1701 NORTH BLUFF STREET","zipcode":"65251","county":"027","date_super":{"end_time":"1998/03/02 00:00:00 -0500","original":"3/1/1998 ","granularity":"day","time":"1998/03/01 00:00:00 -0500"},"geo_score":0.911,"strstate":"MO","conversion":1,"type_store":"Supercenter","opendate":{"end_time":"1973/05/02 00:00:00 -0400","original":"5/1/1973 ","granularity":"day","time":"1973/05/01 00:00:00 -0400"},"id":"a61znt4g0v3i","geo_precision":"range","storenum":51,"strcity":"Fulton"},"type":"Feature","geometry":{"type":"Point","coordinates":[-91.943907,38.86403]}},{"properties":{"st":"05","streetaddr":"1601 ALBERT PIKE BLV","zipcode":"71913","county":"051","date_super":{"end_time":"2000/03/02 00:00:00 -0500","original":"3/1/2000 ","granularity":"day","time":"2000/03/01 00:00:00 -0500"},"geo_score":0.845,"strstate":"AR","conversion":1,"type_store":"Supercenter","opendate":{"end_time":"1972/07/02 00:00:00 -0400","original":"7/1/1972 ","granularity":"day","time":"1972/07/01 00:00:00 -0400"},"id":"a61znsuiyamc","geo_precision":"range","storenum":52,"strcity":"Hot Springs"},"type":"Feature","geometry":{"type":"Point","coordinates":[-93.089517,34.493086]}},{"properties":{"st":"05","streetaddr":"2004 SOUTH PLEASANT","zipcode":"72764","county":"143","date_super":{"end_time":"1992/03/02 00:00:00 -0500","original":"3/1/1992 ","granularity":"day","time":"1992/03/01 00:00:00 -0500"},"geo_score":0.922,"strstate":"AR","conversion":1,"type_store":"Supercenter","opendate":{"end_time":"1972/06/02 00:00:00 -0400","original":"6/1/1972 ","granularity":"day","time":"1972/06/01 00:00:00 -0400"},"id":"a61znsvf9q9m","geo_precision":"range","storenum":54,"strcity":"Springdale"},"type":"Feature","geometry":{"type":"Point","coordinates":[-94.143611,36.167274]}},{"properties":{"st":"05","streetaddr":"1555 EAST MAIN","zipcode":"72927","county":"083","date_super":null,"geo_score":0.829,"strstate":"AR","conversion":null,"type_store":"Wal-Mart","opendate":{"end_time":"1972/10/02 00:00:00 -0400","original":"10/1/1972 ","granularity":"day","time":"1972/10/01 00:00:00 -0400"},"id":"a61znt55vfke","geo_precision":"range","storenum":55,"strcity":"Booneville"},"type":"Feature","geometry":{"type":"Point","coordinates":[-93.902379,35.141897]}},{"properties":{"st":"29","streetaddr":"1309 NW 12TH AVE","zipcode":"65608","county":"067","date_super":{"end_time":"2004/03/18 00:00:00 -0500","original":"3/17/2004 ","granularity":"day","time":"2004/03/17 00:00:00 -0500"},"geo_score":0.653,"strstate":"MO","conversion":1,"type_store":"Supercenter","opendate":{"end_time":"1973/08/02 00:00:00 -0400","original":"8/1/1973 ","granularity":"day","time":"1973/08/01 00:00:00 -0400"},"id":"a61znt21eavs","geo_precision":"street","storenum":56,"strcity":"Ava"},"type":"Feature","geometry":{"type":"Point","coordinates":[-92.676769,36.962221]}},{"properties":{"st":"05","streetaddr":"1600 WEST MAIN","zipcode":"72476","county":"075","date_super":null,"geo_score":0.837,"strstate":"AR","conversion":null,"type_store":"Wal-Mart","opendate":{"end_time":"1972/10/02 00:00:00 -0400","original":"10/1/1972 ","granularity":"day","time":"1972/10/01 00:00:00 -0400"},"id":"a61zntaa7b09","geo_precision":"range","storenum":57,"strcity":"Walnut Ridge"},"type":"Feature","geometry":{"type":"Point","coordinates":[-90.971722,36.07489]}},{"properties":{"st":"05","streetaddr":"2409 EAST MAIN STREET","zipcode":"72802","county":"115","date_super":{"end_time":"2005/10/27 00:00:00 -0400","original":"10/26/2005 ","granularity":"day","time":"2005/10/26 00:00:00 -0400"},"geo_score":1.0,"strstate":"AR","conversion":1,"type_store":"Supercenter","opendate":{"end_time":"1973/05/02 00:00:00 -0400","original":"5/1/1973 ","granularity":"day","time":"1973/05/01 00:00:00 -0400"},"id":"a61znt7zu3cf","geo_precision":"range","storenum":58,"strcity":"Russellville"},"type":"Feature","geometry":{"type":"Point","coordinates":[-93.106773,35.278174]}},{"properties":{"st":"29","streetaddr":"1501 SOUTH RANGELINE ROAD","zipcode":"64804","county":"097","date_super":{"end_time":"1996/03/02 00:00:00 -0500","original":"3/1/1996 ","granularity":"day","time":"1996/03/01 00:00:00 -0500"},"geo_score":0.946,"strstate":"MO","conversion":1,"type_store":"Supercenter","opendate":{"end_time":"1972/05/02 00:00:00 -0400","original":"5/1/1972 ","granularity":"day","time":"1972/05/01 00:00:00 -0400"},"id":"a61znt0g9xra","geo_precision":"range","storenum":59,"strcity":"Joplin"},"type":"Feature","geometry":{"type":"Point","coordinates":[-94.477694,37.07405]}},{"properties":{"st":"29","streetaddr":"101 HWY 47 EAST","zipcode":"63379","county":"113","date_super":{"end_time":"1996/03/02 00:00:00 -0500","original":"3/1/1996 ","granularity":"day","time":"1996/03/01 00:00:00 -0500"},"geo_score":0.799,"strstate":"MO","conversion":1,"type_store":"Supercenter","opendate":{"end_time":"1975/03/02 00:00:00 -0400","original":"3/1/1975 ","granularity":"day","time":"1975/03/01 00:00:00 -0400"},"id":"a61znt8ycw17","geo_precision":"range","storenum":60,"strcity":"Troy"},"type":"Feature","geometry":{"type":"Point","coordinates":[-90.980646,38.97841]}},{"properties":{"st":"29","streetaddr":"301 E. COOPER AVENUE","zipcode":"64093","county":"101","date_super":{"end_time":"1993/03/02 00:00:00 -0500","original":"3/1/1993 ","granularity":"day","time":"1993/03/01 00:00:00 -0500"},"geo_score":0.488,"strstate":"MO","conversion":1,"type_store":"Supercenter","opendate":{"end_time":"1972/11/02 00:00:00 -0500","original":"11/1/1972 ","granularity":"day","time":"1972/11/01 00:00:00 -0500"},"id":"a61znt3ljwji","geo_precision":"street","storenum":61,"strcity":"Warrensburg"},"type":"Feature","geometry":{"type":"Point","coordinates":[-93.737229,38.779135]}},{"properties":{"st":"05","streetaddr":"3700 EAST HWY 18","zipcode":"72315","county":"093","date_super":{"end_time":"1999/03/02 00:00:00 -0500","original":"3/1/1999 ","granularity":"day","time":"1999/03/01 00:00:00 -0500"},"geo_score":0.515,"strstate":"AR","conversion":1,"type_store":"Supercenter","opendate":{"end_time":"1972/11/02 00:00:00 -0500","original":"11/1/1972 ","granularity":"day","time":"1972/11/01 00:00:00 -0500"},"id":"a61znt8y3d43","geo_precision":"street","storenum":62,"strcity":"Blytheville"},"type":"Feature","geometry":{"type":"Point","coordinates":[-89.856079,35.928492]}},{"properties":{"st":"40","streetaddr":"410 SOUTH DEWEY","zipcode":"74467","county":"145","date_super":{"end_time":"1988/03/02 00:00:00 -0500","original":"3/1/1988 ","granularity":"day","time":"1988/03/01 00:00:00 -0500"},"geo_score":0.819,"strstate":"OK","conversion":1,"type_store":"Supercenter","opendate":{"end_time":"1973/09/02 00:00:00 -0400","original":"9/1/1973 ","granularity":"day","time":"1973/09/01 00:00:00 -0400"},"id":"a61znt1kltv7","geo_precision":"range","storenum":63,"strcity":"Wagoner"},"type":"Feature","geometry":{"type":"Point","coordinates":[-95.395139,35.957489]}},{"properties":{"st":"47","streetaddr":"100 SOUTH DUPREE","zipcode":"38012","county":"075","date_super":null,"geo_score":0.846,"strstate":"TN","conversion":null,"type_store":"Wal-Mart","opendate":{"end_time":"1973/02/02 00:00:00 -0500","original":"2/1/1973 ","granularity":"day","time":"1973/02/01 00:00:00 -0500"},"id":"a61znt9h6uqc","geo_precision":"range","storenum":64,"strcity":"Brownsville"},"type":"Feature","geometry":{"type":"Point","coordinates":[-89.240636,35.592466]}},{"properties":{"st":"29","streetaddr":"350 PARKRIDGE ROAD","zipcode":"63080","county":"071","date_super":{"end_time":"1994/03/02 00:00:00 -0500","original":"3/1/1994 ","granularity":"day","time":"1994/03/01 00:00:00 -0500"},"geo_score":0.967,"strstate":"MO","conversion":1,"type_store":"Supercenter","opendate":{"end_time":"1973/07/04 00:00:00 -0400","original":"7/3/1973 ","granularity":"day","time":"1973/07/03 00:00:00 -0400"},"id":"a61znt6ra4oq","geo_precision":"range","storenum":65,"strcity":"Sullivan"},"type":"Feature","geometry":{"type":"Point","coordinates":[-91.15795,38.221185]}},{"properties":{"st":"05","streetaddr":"1230 MARKET STREET","zipcode":"72830","county":"071","date_super":{"end_time":"2002/07/18 00:00:00 -0400","original":"7/17/2002 ","granularity":"day","time":"2002/07/17 00:00:00 -0400"},"geo_score":0.902,"strstate":"AR","conversion":1,"type_store":"Supercenter","opendate":{"end_time":"1973/08/02 00:00:00 -0400","original":"8/1/1973 ","granularity":"day","time":"1973/08/01 00:00:00 -0400"},"id":"a61znt9445mv","geo_precision":"range","storenum":66,"strcity":"Clarksville"},"type":"Feature","geometry":{"type":"Point","coordinates":[-93.456641,35.44847]}},{"properties":{"st":"05","streetaddr":"600 HWY 71 NORTH","zipcode":"71953","county":"113","date_super":{"end_time":"1995/03/02 00:00:00 -0500","original":"3/1/1995 ","granularity":"day","time":"1995/03/01 00:00:00 -0500"},"geo_score":0.81,"strstate":"AR","conversion":1,"type_store":"Supercenter","opendate":{"end_time":"1973/07/02 00:00:00 -0400","original":"7/1/1973 ","granularity":"day","time":"1973/07/01 00:00:00 -0400"},"id":"a61znt07nom1","geo_precision":"range","storenum":67,"strcity":"Mena"},"type":"Feature","geometry":{"type":"Point","coordinates":[-94.225727,34.58631]}},{"properties":{"st":"05","streetaddr":"800 HWY 64 EAST","zipcode":"72396","county":"037","date_super":{"end_time":"2003/08/21 00:00:00 -0400","original":"8/20/2003 ","granularity":"day","time":"2003/08/20 00:00:00 -0400"},"geo_score":0.609,"strstate":"AR","conversion":1,"type_store":"Supercenter","opendate":{"end_time":"1973/08/02 00:00:00 -0400","original":"8/1/1973 ","granularity":"day","time":"1973/08/01 00:00:00 -0400"},"id":"a61znt3hnbdr","geo_precision":"street","storenum":68,"strcity":"Wynne"},"type":"Feature","geometry":{"type":"Point","coordinates":[-90.751552,35.244479]}},{"properties":{"st":"29","streetaddr":"650 SOUTH TRUMAN BLVD","zipcode":"63028","county":"099","date_super":{"end_time":"1993/03/02 00:00:00 -0500","original":"3/1/1993 ","granularity":"day","time":"1993/03/01 00:00:00 -0500"},"geo_score":0.919,"strstate":"MO","conversion":1,"type_store":"Supercenter","opendate":{"end_time":"1973/12/02 00:00:00 -0500","original":"12/1/1973 ","granularity":"day","time":"1973/12/01 00:00:00 -0500"},"id":"a61znt6q5w4u","geo_precision":"range","storenum":69,"strcity":"Festus"},"type":"Feature","geometry":{"type":"Point","coordinates":[-90.391083,38.212753]}},{"properties":{"st":"05","streetaddr":"798 WEST SERVICE ROAD","zipcode":"72301","county":"035","date_super":{"end_time":"1997/03/02 00:00:00 -0500","original":"3/1/1997 ","granularity":"day","time":"1997/03/01 00:00:00 -0500"},"geo_score":0.477,"strstate":"AR","conversion":1,"type_store":"Supercenter","opendate":{"end_time":"1974/07/02 00:00:00 -0400","original":"7/1/1974 ","granularity":"day","time":"1974/07/01 00:00:00 -0400"},"id":"a61znsy2s250","geo_precision":"street","storenum":70,"strcity":"West Memphis"},"type":"Feature","geometry":{"type":"Point","coordinates":[-90.148524,35.154948]}},{"properties":{"st":"05","streetaddr":"1415 HWY 67 SOUTH","zipcode":"72455","county":"121","date_super":{"end_time":"1994/03/02 00:00:00 -0500","original":"3/1/1994 ","granularity":"day","time":"1994/03/01 00:00:00 -0500"},"geo_score":0.727,"strstate":"AR","conversion":1,"type_store":"Supercenter","opendate":{"end_time":"1973/11/02 00:00:00 -0500","original":"11/1/1973 ","granularity":"day","time":"1973/11/01 00:00:00 -0500"},"id":"a61znsvds93h","geo_precision":"street","storenum":71,"strcity":"Pocahontas"},"type":"Feature","geometry":{"type":"Point","coordinates":[-90.95828,36.248073]}},{"properties":{"st":"20","streetaddr":"2710 N BROADWAY","zipcode":"66762","county":"037","date_super":{"end_time":"1994/03/02 00:00:00 -0500","original":"3/1/1994 ","granularity":"day","time":"1994/03/01 00:00:00 -0500"},"geo_score":0.849,"strstate":"KS","conversion":1,"type_store":"Supercenter","opendate":{"end_time":"1974/01/02 00:00:00 -0500","original":"1/1/1974 ","granularity":"day","time":"1974/01/01 00:00:00 -0500"},"id":"a61znt6bsc0p","geo_precision":"range","storenum":72,"strcity":"Pittsburg"},"type":"Feature","geometry":{"type":"Point","coordinates":[-94.704909,37.433371]}},{"properties":{"st":"40","streetaddr":"1002 WEST TAFT","zipcode":"74066","county":"037","date_super":{"end_time":"1999/03/02 00:00:00 -0500","original":"3/1/1999 ","granularity":"day","time":"1999/03/01 00:00:00 -0500"},"geo_score":0.683,"strstate":"OK","conversion":1,"type_store":"Supercenter","opendate":{"end_time":"1974/10/02 00:00:00 -0400","original":"10/1/1974 ","granularity":"day","time":"1974/10/01 00:00:00 -0400"},"id":"a61znsye1i5z","geo_precision":"street","storenum":73,"strcity":"Sapulpa"},"type":"Feature","geometry":{"type":"Point","coordinates":[-96.160018,35.98849]}},{"properties":{"st":"05","streetaddr":"1051 WEST KEISER AVENUE","zipcode":"72370","county":"093","date_super":null,"geo_score":0.916,"strstate":"AR","conversion":null,"type_store":"Wal-Mart","opendate":{"end_time":"1973/11/02 00:00:00 -0500","original":"11/1/1973 ","granularity":"day","time":"1973/11/01 00:00:00 -0500"},"id":"a61znt0evw81","geo_precision":"range","storenum":74,"strcity":"Osceola"},"type":"Feature","geometry":{"type":"Point","coordinates":[-89.984357,35.697714]}},{"properties":{"st":"22","streetaddr":"3636 MONROE HIGHWAY","zipcode":"71360","county":"079","date_super":{"end_time":"1998/03/02 00:00:00 -0500","original":"3/1/1998 ","granularity":"day","time":"1998/03/01 00:00:00 -0500"},"geo_score":0.92,"strstate":"LA","conversion":1,"type_store":"Supercenter","opendate":{"end_time":"1984/11/14 00:00:00 -0500","original":"11/13/1984 ","granularity":"day","time":"1984/11/13 00:00:00 -0500"},"id":"a61znt3d79qg","geo_precision":"range","storenum":75,"strcity":"Pineville"},"type":"Feature","geometry":{"type":"Point","coordinates":[-92.410009,31.366854]}},{"properties":{"st":"05","streetaddr":"1000 WEST TRIMBLE","zipcode":"72616","county":"015","date_super":{"end_time":"1993/03/02 00:00:00 -0500","original":"3/1/1993 ","granularity":"day","time":"1993/03/01 00:00:00 -0500"},"geo_score":0.745,"strstate":"AR","conversion":1,"type_store":"Supercenter","opendate":{"end_time":"1973/11/02 00:00:00 -0500","original":"11/1/1973 ","granularity":"day","time":"1973/11/01 00:00:00 -0500"},"id":"a61znt184ris","geo_precision":"street","storenum":76,"strcity":"Berryville"},"type":"Feature","geometry":{"type":"Point","coordinates":[-93.585117,36.377735]}},{"properties":{"st":"48","streetaddr":"3701 NORTH MAIN ST.","zipcode":"76574","county":"491","date_super":{"end_time":"2004/07/22 00:00:00 -0400","original":"7/21/2004 ","granularity":"day","time":"2004/07/21 00:00:00 -0400"},"geo_score":0.939,"strstate":"TX","conversion":1,"type_store":"Supercenter","opendate":{"end_time":"1979/10/31 00:00:00 -0500","original":"10/30/1979 ","granularity":"day","time":"1979/10/30 00:00:00 -0500"},"id":"a61znt8hj6ou","geo_precision":"range","storenum":77,"strcity":"Taylor"},"type":"Feature","geometry":{"type":"Point","coordinates":[-97.41592,30.599448]}},{"properties":{"st":"29","streetaddr":"1331 SPUR DR/ BUS. RT US HWY66","zipcode":"65706","county":"225","date_super":null,"geo_score":0.557,"strstate":"MO","conversion":null,"type_store":"Wal-Mart","opendate":{"end_time":"1973/09/02 00:00:00 -0400","original":"9/1/1973 ","granularity":"day","time":"1973/09/01 00:00:00 -0400"},"id":"a61znt8nt8cc","geo_precision":"street","storenum":78,"strcity":"Marshfield"},"type":"Feature","geometry":{"type":"Point","coordinates":[-92.921458,37.336332]}},{"properties":{"st":"29","streetaddr":"2623 WEST 7TH STREET","zipcode":"64801","county":"097","date_super":{"end_time":"1999/03/02 00:00:00 -0500","original":"3/1/1999 ","granularity":"day","time":"1999/03/01 00:00:00 -0500"},"geo_score":0.805,"strstate":"MO","conversion":1,"type_store":"Supercenter","opendate":{"end_time":"1974/04/02 00:00:00 -0400","original":"4/1/1974 ","granularity":"day","time":"1974/04/01 00:00:00 -0400"},"id":"a61znt7g16yx","geo_precision":"range","storenum":79,"strcity":"Joplin"},"type":"Feature","geometry":{"type":"Point","coordinates":[-94.546108,37.084652]}},{"properties":{"st":"29","streetaddr":"401 N STADIUM BL/BISCAYNE MALL","zipcode":"65201","county":"019","date_super":null,"geo_score":0.75,"strstate":"MO","conversion":null,"type_store":"Wal-Mart","opendate":{"end_time":"1973/06/02 00:00:00 -0400","original":"6/1/1973 ","granularity":"day","time":"1973/06/01 00:00:00 -0400"},"id":"a61znta6fl6u","geo_precision":"street","storenum":80,"strcity":"Columbia"},"type":"Feature","geometry":{"type":"Point","coordinates":[-92.33425,38.937799]}},{"properties":{"st":"40","streetaddr":"ROUTE 6 BOX 1895","zipcode":"74960","county":"001","date_super":{"end_time":"2005/10/27 00:00:00 -0400","original":"10/26/2005 ","granularity":"day","time":"2005/10/26 00:00:00 -0400"},"geo_score":0.483,"strstate":"OK","conversion":1,"type_store":"Supercenter","opendate":{"end_time":"1973/06/02 00:00:00 -0400","original":"6/1/1973 ","granularity":"day","time":"1973/06/01 00:00:00 -0400"},"id":"a61znt4odkxk","geo_precision":"street","storenum":81,"strcity":"Stilwell"},"type":"Feature","geometry":{"type":"Point","coordinates":[-94.63366,35.817263]}},{"properties":{"st":"29","streetaddr":"1750 S. PERRYVILLE","zipcode":"63775","county":"157","date_super":{"end_time":"1998/03/02 00:00:00 -0500","original":"3/1/1998 ","granularity":"day","time":"1998/03/01 00:00:00 -0500"},"geo_score":0.471,"strstate":"MO","conversion":1,"type_store":"Supercenter","opendate":{"end_time":"1974/04/02 00:00:00 -0400","original":"4/1/1974 ","granularity":"day","time":"1974/04/01 00:00:00 -0400"},"id":"a61znt7rd1hd","geo_precision":"street","storenum":82,"strcity":"Perryville"},"type":"Feature","geometry":{"type":"Point","coordinates":[-89.885699,37.722972]}},{"properties":{"st":"05","streetaddr":"60 79-BYPASS NORTH","zipcode":"71753","county":"027","date_super":{"end_time":"2003/08/21 00:00:00 -0400","original":"8/20/2003 ","granularity":"day","time":"2003/08/20 00:00:00 -0400"},"geo_score":0.598,"strstate":"AR","conversion":1,"type_store":"Supercenter","opendate":{"end_time":"1974/08/02 00:00:00 -0400","original":"8/1/1974 ","granularity":"day","time":"1974/08/01 00:00:00 -0400"},"id":"a61znt24c4by","geo_precision":"zip","storenum":83,"strcity":"Magnolia"},"type":"Feature","geometry":{"type":"Point","coordinates":[-93.225167,33.226519]}},{"properties":{"st":"05","streetaddr":"PINECREST PLAZA SHOPPING CTR","zipcode":"72021","county":"095","date_super":null,"geo_score":0.491,"strstate":"AR","conversion":null,"type_store":"Wal-Mart","opendate":{"end_time":"1974/05/02 00:00:00 -0400","original":"5/1/1974 ","granularity":"day","time":"1974/05/01 00:00:00 -0400"},"id":"a61znt86ytn9","geo_precision":"street","storenum":84,"strcity":"Brinkley"},"type":"Feature","geometry":{"type":"Point","coordinates":[-92.413473,35.127358]}},{"properties":{"st":"05","streetaddr":"17309 I-30","zipcode":"72015","county":"125","date_super":{"end_time":"1996/03/02 00:00:00 -0500","original":"3/1/1996 ","granularity":"day","time":"1996/03/01 00:00:00 -0500"},"geo_score":0.902,"strstate":"AR","conversion":1,"type_store":"Supercenter","opendate":{"end_time":"1974/04/02 00:00:00 -0400","original":"4/1/1974 ","granularity":"day","time":"1974/04/01 00:00:00 -0400"},"id":"a61znt0eru19","geo_precision":"range","storenum":85,"strcity":"Benton"},"type":"Feature","geometry":{"type":"Point","coordinates":[-92.577651,34.581553]}},{"properties":{"st":"29","streetaddr":"2825 N KANSAS EXPRESSWAY","zipcode":"65803","county":"077","date_super":{"end_time":"1994/03/02 00:00:00 -0500","original":"3/1/1994 ","granularity":"day","time":"1994/03/01 00:00:00 -0500"},"geo_score":0.915,"strstate":"MO","conversion":1,"type_store":"Supercenter","opendate":{"end_time":"1973/12/02 00:00:00 -0500","original":"12/1/1973 ","granularity":"day","time":"1973/12/01 00:00:00 -0500"},"id":"a61znt34qrlg","geo_precision":"range","storenum":86,"strcity":"Springfield"},"type":"Feature","geometry":{"type":"Point","coordinates":[-93.310875,37.24721]}},{"properties":{"st":"22","streetaddr":"1379 HOMER ROAD","zipcode":"71055","county":"119","date_super":{"end_time":"1999/03/02 00:00:00 -0500","original":"3/1/1999 ","granularity":"day","time":"1999/03/01 00:00:00 -0500"},"geo_score":0.919,"strstate":"LA","conversion":1,"type_store":"Supercenter","opendate":{"end_time":"1974/07/02 00:00:00 -0400","original":"7/1/1974 ","granularity":"day","time":"1974/07/01 00:00:00 -0400"},"id":"a61znsxqo6sq","geo_precision":"range","storenum":87,"strcity":"Minden"},"type":"Feature","geometry":{"type":"Point","coordinates":[-93.248095,32.627691]}},{"properties":{"st":"29","streetaddr":"2100 NORTH MAIN","zipcode":"65711","county":"229","date_super":{"end_time":"1994/03/02 00:00:00 -0500","original":"3/1/1994 ","granularity":"day","time":"1994/03/01 00:00:00 -0500"},"geo_score":0.833,"strstate":"MO","conversion":1,"type_store":"Supercenter","opendate":{"end_time":"1974/02/02 00:00:00 -0400","original":"2/1/1974 ","granularity":"day","time":"1974/02/01 00:00:00 -0400"},"id":"a61znt8znyo9","geo_precision":"range","storenum":88,"strcity":"Mt. Grove"},"type":"Feature","geometry":{"type":"Point","coordinates":[-92.26275,37.149916]}},{"properties":{"st":"29","streetaddr":"94 CECIL STREET","zipcode":"65020","county":"029","date_super":{"end_time":"2005/04/14 00:00:00 -0400","original":"4/13/2005 ","granularity":"day","time":"2005/04/13 00:00:00 -0400"},"geo_score":0.596,"strstate":"MO","conversion":1,"type_store":"Supercenter","opendate":{"end_time":"1974/02/02 00:00:00 -0400","original":"2/1/1974 ","granularity":"day","time":"1974/02/01 00:00:00 -0400"},"id":"a61znt0p8pwb","geo_precision":"zip","storenum":89,"strcity":"Camdenton"},"type":"Feature","geometry":{"type":"Point","coordinates":[-92.845464,37.935869]}},{"properties":{"st":"40","streetaddr":"2115 S MAIN ST","zipcode":"74344","county":"041","date_super":{"end_time":"1995/03/02 00:00:00 -0500","original":"3/1/1995 ","granularity":"day","time":"1995/03/01 00:00:00 -0500"},"geo_score":0.8,"strstate":"OK","conversion":1,"type_store":"Supercenter","opendate":{"end_time":"1974/04/02 00:00:00 -0400","original":"4/1/1974 ","granularity":"day","time":"1974/04/01 00:00:00 -0400"},"id":"a61znt9drvh3","geo_precision":"range","storenum":90,"strcity":"Grove"},"type":"Feature","geometry":{"type":"Point","coordinates":[-94.769081,36.57897]}},{"properties":{"st":"05","streetaddr":"205 DEADRICK ROAD","zipcode":"72335","county":"123","date_super":{"end_time":"1994/03/02 00:00:00 -0500","original":"3/1/1994 ","granularity":"day","time":"1994/03/01 00:00:00 -0500"},"geo_score":0.894,"strstate":"AR","conversion":1,"type_store":"Supercenter","opendate":{"end_time":"1974/09/02 00:00:00 -0400","original":"9/1/1974 ","granularity":"day","time":"1974/09/01 00:00:00 -0400"},"id":"a61znsyaruzy","geo_precision":"range","storenum":91,"strcity":"Forrest City"},"type":"Feature","geometry":{"type":"Point","coordinates":[-90.790971,35.029877]}},{"properties":{"st":"29","streetaddr":"3020 SOUTH ELLIOTT","zipcode":"65605","county":"109","date_super":null,"geo_score":0.835,"strstate":"MO","conversion":null,"type_store":"Wal-Mart","opendate":{"end_time":"1974/04/02 00:00:00 -0400","original":"4/1/1974 ","granularity":"day","time":"1974/04/01 00:00:00 -0400"},"id":"a61znt0dqqiv","geo_precision":"range","storenum":92,"strcity":"Aurora"},"type":"Feature","geometry":{"type":"Point","coordinates":[-93.718573,36.947616]}},{"properties":{"st":"47","streetaddr":"975 US HIGHWAY 51 NORTH","zipcode":"38019","county":"167","date_super":null,"geo_score":0.912,"strstate":"TN","conversion":null,"type_store":"Wal-Mart","opendate":{"end_time":"1974/10/02 00:00:00 -0400","original":"10/1/1974 ","granularity":"day","time":"1974/10/01 00:00:00 -0400"},"id":"a61znsvzcguj","geo_precision":"range","storenum":93,"strcity":"Covington"},"type":"Feature","geometry":{"type":"Point","coordinates":[-89.640142,35.583664]}},{"properties":{"st":"47","streetaddr":"8445 HWY 51 NORTH","zipcode":"38053","county":"157","date_super":{"end_time":"1997/03/02 00:00:00 -0500","original":"3/1/1997 ","granularity":"day","time":"1997/03/01 00:00:00 -0500"},"geo_score":0.668,"strstate":"TN","conversion":1,"type_store":"Supercenter","opendate":{"end_time":"1974/07/02 00:00:00 -0400","original":"7/1/1974 ","granularity":"day","time":"1974/07/01 00:00:00 -0400"},"id":"a61znt78w2op","geo_precision":"street","storenum":94,"strcity":"Millington"},"type":"Feature","geometry":{"type":"Point","coordinates":[-89.855783,35.390412]}},{"properties":{"st":"29","streetaddr":"407 NO. STATE ST","zipcode":"63601","county":"187","date_super":{"end_time":"2003/05/22 00:00:00 -0400","original":"5/21/2003 ","granularity":"day","time":"2003/05/21 00:00:00 -0400"},"geo_score":0.493,"strstate":"MO","conversion":1,"type_store":"Supercenter","opendate":{"end_time":"1974/10/02 00:00:00 -0400","original":"10/1/1974 ","granularity":"day","time":"1974/10/01 00:00:00 -0400"},"id":"a61znt37q4xc","geo_precision":"street","storenum":95,"strcity":"Desloge"},"type":"Feature","geometry":{"type":"Point","coordinates":[-90.511653,37.872662]}},{"properties":{"st":"29","streetaddr":"1700 NORTH 291 HIGHWAY","zipcode":"64701","county":"037","date_super":{"end_time":"1994/03/02 00:00:00 -0500","original":"3/1/1994 ","granularity":"day","time":"1994/03/01 00:00:00 -0500"},"geo_score":0.547,"strstate":"MO","conversion":1,"type_store":"Supercenter","opendate":{"end_time":"1974/10/02 00:00:00 -0400","original":"10/1/1974 ","granularity":"day","time":"1974/10/01 00:00:00 -0400"},"id":"a61znt0etj7h","geo_precision":"street","storenum":96,"strcity":"Harrisonville"},"type":"Feature","geometry":{"type":"Point","coordinates":[-94.349423,38.588583]}},{"properties":{"st":"47","streetaddr":"628 HWY 51 BYPASS","zipcode":"38063","county":"097","date_super":{"end_time":"1994/03/02 00:00:00 -0500","original":"3/1/1994 ","granularity":"day","time":"1994/03/01 00:00:00 -0500"},"geo_score":0.764,"strstate":"TN","conversion":1,"type_store":"Supercenter","opendate":{"end_time":"1974/11/02 00:00:00 -0500","original":"11/1/1974 ","granularity":"day","time":"1974/11/01 00:00:00 -0500"},"id":"a61znt52d7hq","geo_precision":"range","storenum":97,"strcity":"Ripley"},"type":"Feature","geometry":{"type":"Point","coordinates":[-89.553434,35.747529]}},{"properties":{"st":"22","streetaddr":"2030 EAST MADISON","zipcode":"71220","county":"067","date_super":null,"geo_score":0.833,"strstate":"LA","conversion":null,"type_store":"Wal-Mart","opendate":{"end_time":"1975/02/02 00:00:00 -0500","original":"2/1/1975 ","granularity":"day","time":"1975/02/01 00:00:00 -0500"},"id":"a61znt5798ej","geo_precision":"range","storenum":98,"strcity":"Bastrop"},"type":"Feature","geometry":{"type":"Point","coordinates":[-91.887364,32.777717]}},{"properties":{"st":"29","streetaddr":"1445 E CENTRAL","zipcode":"63084","county":"071","date_super":{"end_time":"1995/03/02 00:00:00 -0500","original":"3/1/1995 ","granularity":"day","time":"1995/03/01 00:00:00 -0500"},"geo_score":0.863,"strstate":"MO","conversion":1,"type_store":"Supercenter","opendate":{"end_time":"1976/02/02 00:00:00 -0500","original":"2/1/1976 ","granularity":"day","time":"1976/02/01 00:00:00 -0500"},"id":"a61znsu9bkc6","geo_precision":"range","storenum":99,"strcity":"Union"},"type":"Feature","geometry":{"type":"Point","coordinates":[-90.972254,38.433333]}},{"properties":{"st":"05","streetaddr":"406 SOUTH WALTON BLVD","zipcode":"72712","county":"007","date_super":{"end_time":"1992/03/02 00:00:00 -0500","original":"3/1/1992 ","granularity":"day","time":"1992/03/01 00:00:00 -0500"},"geo_score":0.911,"strstate":"AR","conversion":1,"type_store":"Supercenter","opendate":{"end_time":"1974/10/02 00:00:00 -0400","original":"10/1/1974 ","granularity":"day","time":"1974/10/01 00:00:00 -0400"},"id":"a61znt4ng1iv","geo_precision":"range","storenum":100,"strcity":"Bentonville"},"type":"Feature","geometry":{"type":"Point","coordinates":[-94.221623,36.368584]}},{"properties":{"st":"29","streetaddr":"500 SOUTH BISHOP","zipcode":"65401","county":"161","date_super":{"end_time":"1994/03/02 00:00:00 -0500","original":"3/1/1994 ","granularity":"day","time":"1994/03/01 00:00:00 -0500"},"geo_score":0.827,"strstate":"MO","conversion":1,"type_store":"Supercenter","opendate":{"end_time":"1976/02/02 00:00:00 -0500","original":"2/1/1976 ","granularity":"day","time":"1976/02/01 00:00:00 -0500"},"id":"a61znsvpnje6","geo_precision":"range","storenum":101,"strcity":"Rolla"},"type":"Feature","geometry":{"type":"Point","coordinates":[-91.777317,37.939184]}},{"properties":{"st":"05","streetaddr":"406 E 22ND STREET","zipcode":"72160","county":"001","date_super":{"end_time":"1995/03/02 00:00:00 -0500","original":"3/1/1995 ","granularity":"day","time":"1995/03/01 00:00:00 -0500"},"geo_score":0.84,"strstate":"AR","conversion":1,"type_store":"Supercenter","opendate":{"end_time":"1974/09/02 00:00:00 -0400","original":"9/1/1974 ","granularity":"day","time":"1974/09/01 00:00:00 -0400"},"id":"a61znt2266lc","geo_precision":"range","storenum":102,"strcity":"Stuttgart"},"type":"Feature","geometry":{"type":"Point","coordinates":[-91.548729,34.479278]}},{"properties":{"st":"40","streetaddr":"196 SHAWNEE MALL DRIVE","zipcode":"74804","county":"125","date_super":{"end_time":"2004/08/26 00:00:00 -0400","original":"8/25/2004 ","granularity":"day","time":"2004/08/25 00:00:00 -0400"},"geo_score":0.709,"strstate":"OK","conversion":1,"type_store":"Supercenter","opendate":{"end_time":"1975/08/02 00:00:00 -0400","original":"8/1/1975 ","granularity":"day","time":"1975/08/01 00:00:00 -0400"},"id":"a61znt6epci7","geo_precision":"street","storenum":103,"strcity":"Shawnee"},"type":"Feature","geometry":{"type":"Point","coordinates":[-96.920932,35.384301]}},{"properties":{"st":"47","streetaddr":"15427 SO. FIRST STREET","zipcode":"38358","county":"053","date_super":null,"geo_score":0.5,"strstate":"TN","conversion":null,"type_store":"Wal-Mart","opendate":{"end_time":"1974/07/02 00:00:00 -0400","original":"7/1/1974 ","granularity":"day","time":"1974/07/01 00:00:00 -0400"},"id":"a61znsyg0uh8","geo_precision":"street","storenum":104,"strcity":"Milan"},"type":"Feature","geometry":{"type":"Point","coordinates":[-88.745002,35.872336]}},{"properties":{"st":"28","streetaddr":"2301 HARPER ROAD","zipcode":"38834","county":"003","date_super":{"end_time":"1994/03/02 00:00:00 -0500","original":"3/1/1994 ","granularity":"day","time":"1994/03/01 00:00:00 -0500"},"geo_score":0.87,"strstate":"MS","conversion":1,"type_store":"Supercenter","opendate":{"end_time":"1974/08/02 00:00:00 -0400","original":"8/1/1974 ","granularity":"day","time":"1974/08/01 00:00:00 -0400"},"id":"a61znt8o184o","geo_precision":"range","storenum":105,"strcity":"Corinth"},"type":"Feature","geometry":{"type":"Point","coordinates":[-88.535216,34.908824]}},{"properties":{"st":"21","streetaddr":"1405 MIDDLE ROAD","zipcode":"42041","county":"075","date_super":{"end_time":"2004/10/21 00:00:00 -0400","original":"10/20/2004 ","granularity":"day","time":"2004/10/20 00:00:00 -0400"},"geo_score":0.708,"strstate":"KY","conversion":1,"type_store":"Supercenter","opendate":{"end_time":"1974/08/02 00:00:00 -0400","original":"8/1/1974 ","granularity":"day","time":"1974/08/01 00:00:00 -0400"},"id":"a61znsz3fxlf","geo_precision":"street","storenum":106,"strcity":"Fulton"},"type":"Feature","geometry":{"type":"Point","coordinates":[-88.895748,36.514801]}},{"properties":{"st":"47","streetaddr":"850 WAL-MART DRIVE","zipcode":"38237","county":"183","date_super":null,"geo_score":0.683,"strstate":"TN","conversion":null,"type_store":"Wal-Mart","opendate":{"end_time":"1974/10/02 00:00:00 -0400","original":"10/1/1974 ","granularity":"day","time":"1974/10/01 00:00:00 -0400"},"id":"a61znsuj407w","geo_precision":"zip","storenum":107,"strcity":"Martin"},"type":"Feature","geometry":{"type":"Point","coordinates":[-88.782561,36.324103]}},{"properties":{"st":"40","streetaddr":"1618 SOUTH DIVISION","zipcode":"73044","county":"083","date_super":null,"geo_score":0.6,"strstate":"OK","conversion":null,"type_store":"Wal-Mart","opendate":{"end_time":"1975/02/02 00:00:00 -0500","original":"2/1/1975 ","granularity":"day","time":"1975/02/01 00:00:00 -0500"},"id":"a61znsv9yas8","geo_precision":"street","storenum":108,"strcity":"Guthrie"},"type":"Feature","geometry":{"type":"Point","coordinates":[-97.425418,35.854994]}},{"properties":{"st":"29","streetaddr":"2000 NORTH WALNUT","zipcode":"64429","county":"063","date_super":{"end_time":"1995/03/02 00:00:00 -0500","original":"3/1/1995 ","granularity":"day","time":"1995/03/01 00:00:00 -0500"},"geo_score":0.865,"strstate":"MO","conversion":1,"type_store":"Supercenter","opendate":{"end_time":"1975/02/02 00:00:00 -0500","original":"2/1/1975 ","granularity":"day","time":"1975/02/01 00:00:00 -0500"},"id":"a61znsysdh06","geo_precision":"range","storenum":109,"strcity":"Cameron"},"type":"Feature","geometry":{"type":"Point","coordinates":[-94.234316,39.75388]}},{"properties":{"st":"20","streetaddr":"2700 SOUTH SANTA FE","zipcode":"66720","county":"133","date_super":{"end_time":"2003/06/26 00:00:00 -0400","original":"6/25/2003 ","granularity":"day","time":"2003/06/25 00:00:00 -0400"},"geo_score":0.823,"strstate":"KS","conversion":1,"type_store":"Supercenter","opendate":{"end_time":"1975/11/02 00:00:00 -0500","original":"11/1/1975 ","granularity":"day","time":"1975/11/01 00:00:00 -0500"},"id":"a61znt67ewp6","geo_precision":"range","storenum":111,"strcity":"Chanute"},"type":"Feature","geometry":{"type":"Point","coordinates":[-95.452631,37.653335]}},{"properties":{"st":"28","streetaddr":"1010 HWY 12 WEST","zipcode":"39759","county":"105","date_super":{"end_time":"2002/03/02 00:00:00 -0500","original":"3/1/2002 ","granularity":"day","time":"2002/03/01 00:00:00 -0500"},"geo_score":0.932,"strstate":"MS","conversion":1,"type_store":"Supercenter","opendate":{"end_time":"1975/04/02 00:00:00 -0400","original":"4/1/1975 ","granularity":"day","time":"1975/04/01 00:00:00 -0400"},"id":"a61znsy3iw11","geo_precision":"range","storenum":112,"strcity":"Starkville"},"type":"Feature","geometry":{"type":"Point","coordinates":[-88.851806,33.441823]}},{"properties":{"st":"40","streetaddr":"2001 SO. 1ST ST.","zipcode":"73018","county":"051","date_super":{"end_time":"2006/01/28 00:00:00 -0500","original":"1/27/2006 ","granularity":"day","time":"2006/01/27 00:00:00 -0500"},"geo_score":0.5,"strstate":"OK","conversion":1,"type_store":"Supercenter","opendate":{"end_time":"1975/07/02 00:00:00 -0400","original":"7/1/1975 ","granularity":"day","time":"1975/07/01 00:00:00 -0400"},"id":"a61znt9i03ld","geo_precision":"street","storenum":113,"strcity":"Chickasha"},"type":"Feature","geometry":{"type":"Point","coordinates":[-97.933058,35.051213]}},{"properties":{"st":"28","streetaddr":"200 WALMART CIRCLE","zipcode":"38829","county":"117","date_super":null,"geo_score":0.902,"strstate":"MS","conversion":null,"type_store":"Wal-Mart","opendate":{"end_time":"1975/04/02 00:00:00 -0400","original":"4/1/1975 ","granularity":"day","time":"1975/04/01 00:00:00 -0400"},"id":"a61znt2llv1h","geo_precision":"range","storenum":114,"strcity":"Booneville"},"type":"Feature","geometry":{"type":"Point","coordinates":[-88.562734,34.676487]}},{"properties":{"st":"28","streetaddr":"1445 HWY 45 NORTH","zipcode":"39773","county":"025","date_super":null,"geo_score":0.924,"strstate":"MS","conversion":null,"type_store":"Wal-Mart","opendate":{"end_time":"1976/09/02 00:00:00 -0400","original":"9/1/1976 ","granularity":"day","time":"1976/09/01 00:00:00 -0400"},"id":"a61znt29tdsi","geo_precision":"range","storenum":115,"strcity":"West Point"},"type":"Feature","geometry":{"type":"Point","coordinates":[-88.659436,33.631959]}},{"properties":{"st":"22","streetaddr":"929 SOUTH PINE STREET","zipcode":"71082","county":"017","date_super":null,"geo_score":0.821,"strstate":"LA","conversion":null,"type_store":"Wal-Mart","opendate":{"end_time":"1975/08/02 00:00:00 -0400","original":"8/1/1975 ","granularity":"day","time":"1975/08/01 00:00:00 -0400"},"id":"a61znt79jk4z","geo_precision":"range","storenum":116,"strcity":"Vivian"},"type":"Feature","geometry":{"type":"Point","coordinates":[-93.984754,32.857636]}},{"properties":{"st":"40","streetaddr":"501 SOUTH PARK DRIVE","zipcode":"74728","county":"089","date_super":null,"geo_score":0.913,"strstate":"OK","conversion":null,"type_store":"Wal-Mart","opendate":{"end_time":"1975/06/02 00:00:00 -0400","original":"6/1/1975 ","granularity":"day","time":"1975/06/01 00:00:00 -0400"},"id":"a61znsxu5724","geo_precision":"range","storenum":117,"strcity":"Broken Bow"},"type":"Feature","geometry":{"type":"Point","coordinates":[-94.739572,34.022301]}},{"properties":{"st":"28","streetaddr":"1515 US HWY 278 EAST","zipcode":"38821","county":"095","date_super":{"end_time":"1993/03/02 00:00:00 -0500","original":"3/1/1993 ","granularity":"day","time":"1993/03/01 00:00:00 -0500"},"geo_score":0.902,"strstate":"MS","conversion":1,"type_store":"Supercenter","opendate":{"end_time":"1976/04/02 00:00:00 -0500","original":"4/1/1976 ","granularity":"day","time":"1976/04/01 00:00:00 -0500"},"id":"a61znsyziq5l","geo_precision":"range","storenum":118,"strcity":"Amory"},"type":"Feature","geometry":{"type":"Point","coordinates":[-88.459403,33.967824]}},{"properties":{"st":"05","streetaddr":"3150 HARRISON STREET","zipcode":"72501","county":"063","date_super":{"end_time":"1994/03/02 00:00:00 -0500","original":"3/1/1994 ","granularity":"day","time":"1994/03/01 00:00:00 -0500"},"geo_score":0.912,"strstate":"AR","conversion":1,"type_store":"Supercenter","opendate":{"end_time":"1976/03/02 00:00:00 -0500","original":"3/1/1976 ","granularity":"day","time":"1976/03/01 00:00:00 -0500"},"id":"a61znt9ucr57","geo_precision":"range","storenum":119,"strcity":"Batesville"},"type":"Feature","geometry":{"type":"Point","coordinates":[-91.613941,35.764825]}},{"properties":{"st":"47","streetaddr":"2716 NORTH CENTRAL AVENUE","zipcode":"38343","county":"053","date_super":null,"geo_score":0.913,"strstate":"TN","conversion":null,"type_store":"Wal-Mart","opendate":{"end_time":"1976/03/02 00:00:00 -0500","original":"3/1/1976 ","granularity":"day","time":"1976/03/01 00:00:00 -0500"},"id":"a61znsue29ff","geo_precision":"range","storenum":120,"strcity":"Humboldt"},"type":"Feature","geometry":{"type":"Point","coordinates":[-88.91491,35.841499]}},{"properties":{"st":"40","streetaddr":"1800 SOUTH WOOD DRIVE","zipcode":"74447","county":"111","date_super":{"end_time":"1994/03/02 00:00:00 -0500","original":"3/1/1994 ","granularity":"day","time":"1994/03/01 00:00:00 -0500"},"geo_score":0.915,"strstate":"OK","conversion":1,"type_store":"Supercenter","opendate":{"end_time":"1975/09/02 00:00:00 -0400","original":"9/1/1975 ","granularity":"day","time":"1975/09/01 00:00:00 -0400"},"id":"a61znt7j67rf","geo_precision":"range","storenum":121,"strcity":"Okmulgee"},"type":"Feature","geometry":{"type":"Point","coordinates":[-95.96181,35.608125]}},{"properties":{"st":"29","streetaddr":"3051 EAST JACKSON BLVD.","zipcode":"63755","county":"031","date_super":{"end_time":"1999/03/02 00:00:00 -0500","original":"3/1/1999 ","granularity":"day","time":"1999/03/01 00:00:00 -0500"},"geo_score":0.916,"strstate":"MO","conversion":1,"type_store":"Supercenter","opendate":{"end_time":"1975/11/02 00:00:00 -0500","original":"11/1/1975 ","granularity":"day","time":"1975/11/01 00:00:00 -0500"},"id":"a61znt2daokp","geo_precision":"range","storenum":122,"strcity":"Jackson"},"type":"Feature","geometry":{"type":"Point","coordinates":[-89.632978,37.364007]}},{"properties":{"st":"40","streetaddr":"1500 E. WRANGLER BLVD","zipcode":"74868","county":"133","date_super":{"end_time":"2003/10/30 00:00:00 -0500","original":"10/29/2003 ","granularity":"day","time":"2003/10/29 00:00:00 -0500"},"geo_score":0.525,"strstate":"OK","conversion":1,"type_store":"Supercenter","opendate":{"end_time":"1975/06/02 00:00:00 -0400","original":"6/1/1975 ","granularity":"day","time":"1975/06/01 00:00:00 -0400"},"id":"a61znta18qgv","geo_precision":"street","storenum":123,"strcity":"Seminole"},"type":"Feature","geometry":{"type":"Point","coordinates":[-96.652692,35.246473]}},{"properties":{"st":"05","streetaddr":"8801 BASELINE ROAD","zipcode":"72209","county":"119","date_super":{"end_time":"1999/03/02 00:00:00 -0500","original":"3/1/1999 ","granularity":"day","time":"1999/03/01 00:00:00 -0500"},"geo_score":1.0,"strstate":"AR","conversion":1,"type_store":"Supercenter","opendate":{"end_time":"1975/03/02 00:00:00 -0400","original":"3/1/1975 ","granularity":"day","time":"1975/03/01 00:00:00 -0400"},"id":"a61znsvy8dsm","geo_precision":"range","storenum":124,"strcity":"Little Rock"},"type":"Feature","geometry":{"type":"Point","coordinates":[-92.375747,34.670081]}},{"properties":{"st":"05","streetaddr":"2425 SOUTH ZERO ST","zipcode":"72901","county":"131","date_super":{"end_time":"1999/03/02 00:00:00 -0500","original":"3/1/1999 ","granularity":"day","time":"1999/03/01 00:00:00 -0500"},"geo_score":0.645,"strstate":"AR","conversion":1,"type_store":"Supercenter","opendate":{"end_time":"1975/04/02 00:00:00 -0400","original":"4/1/1975 ","granularity":"day","time":"1975/04/01 00:00:00 -0400"},"id":"a61znsu5z3ho","geo_precision":"street","storenum":125,"strcity":"Fort Smith"},"type":"Feature","geometry":{"type":"Point","coordinates":[-94.410748,35.327836]}},{"properties":{"st":"05","streetaddr":"700 SOUTH BOWMAN BLV","zipcode":"72211","county":"119","date_super":null,"geo_score":0.912,"strstate":"AR","conversion":null,"type_store":"Wal-Mart","opendate":{"end_time":"1976/03/02 00:00:00 -0500","original":"3/1/1976 ","granularity":"day","time":"1976/03/01 00:00:00 -0500"},"id":"a61znta7p60y","geo_precision":"range","storenum":126,"strcity":"Little Rock"},"type":"Feature","geometry":{"type":"Point","coordinates":[-92.407155,34.747626]}},{"properties":{"st":"05","streetaddr":"1910 MARTIN LUTHER KING BLVD","zipcode":"72104","county":"059","date_super":{"end_time":"2005/04/14 00:00:00 -0400","original":"4/13/2005 ","granularity":"day","time":"2005/04/13 00:00:00 -0400"},"geo_score":0.727,"strstate":"AR","conversion":1,"type_store":"Supercenter","opendate":{"end_time":"1976/02/02 00:00:00 -0500","original":"2/1/1976 ","granularity":"day","time":"1976/02/01 00:00:00 -0500"},"id":"a61znszsrvtp","geo_precision":"street","storenum":127,"strcity":"Malvern"},"type":"Feature","geometry":{"type":"Point","coordinates":[-92.828072,34.385231]}},{"properties":{"st":"05","streetaddr":"1911 WEST PARKER RD","zipcode":"72404","county":"031","date_super":{"end_time":"1998/03/02 00:00:00 -0500","original":"3/1/1998 ","granularity":"day","time":"1998/03/01 00:00:00 -0500"},"geo_score":1.0,"strstate":"AR","conversion":1,"type_store":"Supercenter","opendate":{"end_time":"1978/08/02 00:00:00 -0400","original":"8/1/1978 ","granularity":"day","time":"1978/08/01 00:00:00 -0400"},"id":"a61znt597caj","geo_precision":"range","storenum":128,"strcity":"Jonesboro"},"type":"Feature","geometry":{"type":"Point","coordinates":[-90.675056,35.806744]}},{"properties":{"st":"40","streetaddr":"1715 NORTH COMMERCE STREET","zipcode":"73401","county":"019","date_super":{"end_time":"1994/03/02 00:00:00 -0500","original":"3/1/1994 ","granularity":"day","time":"1994/03/01 00:00:00 -0500"},"geo_score":0.806,"strstate":"OK","conversion":1,"type_store":"Supercenter","opendate":{"end_time":"1975/07/02 00:00:00 -0400","original":"7/1/1975 ","granularity":"day","time":"1975/07/01 00:00:00 -0400"},"id":"a61znt66lzxc","geo_precision":"street","storenum":129,"strcity":"Ardmore"},"type":"Feature","geometry":{"type":"Point","coordinates":[-97.143036,34.153414]}},{"properties":{"st":"40","streetaddr":"1000 WEST SHAWNEE ST","zipcode":"74403","county":"101","date_super":{"end_time":"2004/08/26 00:00:00 -0400","original":"8/25/2004 ","granularity":"day","time":"2004/08/25 00:00:00 -0400"},"geo_score":0.717,"strstate":"OK","conversion":1,"type_store":"Supercenter","opendate":{"end_time":"1975/07/02 00:00:00 -0400","original":"7/1/1975 ","granularity":"day","time":"1975/07/01 00:00:00 -0400"},"id":"a61znt76ag5f","geo_precision":"street","storenum":130,"strcity":"Muskogee"},"type":"Feature","geometry":{"type":"Point","coordinates":[-95.322847,35.770263]}},{"properties":{"st":"48","streetaddr":"2311 SOUTH JEFFERSON","zipcode":"75455","county":"449","date_super":{"end_time":"1990/03/02 00:00:00 -0500","original":"3/1/1990 ","granularity":"day","time":"1990/03/01 00:00:00 -0500"},"geo_score":0.66,"strstate":"TX","conversion":1,"type_store":"Supercenter","opendate":{"end_time":"1975/11/02 00:00:00 -0500","original":"11/1/1975 ","granularity":"day","time":"1975/11/01 00:00:00 -0500"},"id":"a61znsxes23f","geo_precision":"street","storenum":131,"strcity":"Mt. Pleasant"},"type":"Feature","geometry":{"type":"Point","coordinates":[-94.968192,33.136035]}},{"properties":{"st":"40","streetaddr":"1213 SOUTH MAIN STREET","zipcode":"73750","county":"073","date_super":null,"geo_score":1.0,"strstate":"OK","conversion":null,"type_store":"Wal-Mart","opendate":{"end_time":"1976/02/02 00:00:00 -0500","original":"2/1/1976 ","granularity":"day","time":"1976/02/01 00:00:00 -0500"},"id":"a61znt94udld","geo_precision":"range","storenum":132,"strcity":"Kingfisher"},"type":"Feature","geometry":{"type":"Point","coordinates":[-97.932608,35.848903]}},{"properties":{"st":"05","streetaddr":"1040 S CONSTITUTION","zipcode":"71822","county":"081","date_super":null,"geo_score":0.872,"strstate":"AR","conversion":null,"type_store":"Wal-Mart","opendate":{"end_time":"1976/05/02 00:00:00 -0400","original":"5/1/1976 ","granularity":"day","time":"1976/05/01 00:00:00 -0400"},"id":"a61znsuzvdb9","geo_precision":"range","storenum":133,"strcity":"Ashdown"},"type":"Feature","geometry":{"type":"Point","coordinates":[-94.117647,33.659928]}},{"properties":{"st":"40","streetaddr":"3105 WEST 3RD","zipcode":"73644","county":"009","date_super":null,"geo_score":0.718,"strstate":"OK","conversion":null,"type_store":"Wal-Mart","opendate":{"end_time":"1976/08/02 00:00:00 -0400","original":"8/1/1976 ","granularity":"day","time":"1976/08/01 00:00:00 -0400"},"id":"a61znsyq3sfw","geo_precision":"range","storenum":134,"strcity":"Elk City"},"type":"Feature","geometry":{"type":"Point","coordinates":[-99.443183,35.411701]}},{"properties":{"st":"29","streetaddr":"1000 GRAVES ST.","zipcode":"64601","county":"117","date_super":{"end_time":"2004/10/28 00:00:00 -0400","original":"10/27/2004 ","granularity":"day","time":"2004/10/27 00:00:00 -0400"},"geo_score":0.902,"strstate":"MO","conversion":1,"type_store":"Supercenter","opendate":{"end_time":"1976/04/02 00:00:00 -0500","original":"4/1/1976 ","granularity":"day","time":"1976/04/01 00:00:00 -0500"},"id":"a61znsuwq19v","geo_precision":"range","storenum":135,"strcity":"Chillicothe"},"type":"Feature","geometry":{"type":"Point","coordinates":[-93.554045,39.777542]}},{"properties":{"st":"40","streetaddr":"1219 WEST DOOLIN","zipcode":"74631","county":"071","date_super":null,"geo_score":0.912,"strstate":"OK","conversion":null,"type_store":"Wal-Mart","opendate":{"end_time":"1976/04/02 00:00:00 -0500","original":"4/1/1976 ","granularity":"day","time":"1976/04/01 00:00:00 -0500"},"id":"a61znsys0u1z","geo_precision":"range","storenum":136,"strcity":"Blackwell"},"type":"Feature","geometry":{"type":"Point","coordinates":[-97.29936,36.81142]}},{"properties":{"st":"40","streetaddr":"111 NORTH PERKINS ROAD","zipcode":"74075","county":"119","date_super":{"end_time":"1994/03/02 00:00:00 -0500","original":"3/1/1994 ","granularity":"day","time":"1994/03/01 00:00:00 -0500"},"geo_score":1.0,"strstate":"OK","conversion":1,"type_store":"Supercenter","opendate":{"end_time":"1976/10/02 00:00:00 -0400","original":"10/1/1976 ","granularity":"day","time":"1976/10/01 00:00:00 -0400"},"id":"a61znsxx09y5","geo_precision":"range","storenum":137,"strcity":"Stillwater"},"type":"Feature","geometry":{"type":"Point","coordinates":[-97.051458,36.123412]}},{"properties":{"st":"29","streetaddr":"1923 EAST KEARNEY","zipcode":"65803","county":"077","date_super":null,"geo_score":0.856,"strstate":"MO","conversion":null,"type_store":"Wal-Mart","opendate":{"end_time":"1977/11/02 00:00:00 -0500","original":"11/1/1977 ","granularity":"day","time":"1977/11/01 00:00:00 -0500"},"id":"a61znt1u13ir","geo_precision":"range","storenum":138,"strcity":"Springfield"},"type":"Feature","geometry":{"type":"Point","coordinates":[-93.258547,37.239942]}},{"properties":{"st":"40","streetaddr":"1620 NORTH GREEN AVENUE","zipcode":"73080","county":"087","date_super":null,"geo_score":0.916,"strstate":"OK","conversion":null,"type_store":"Wal-Mart","opendate":{"end_time":"1976/07/02 00:00:00 -0400","original":"7/1/1976 ","granularity":"day","time":"1976/07/01 00:00:00 -0400"},"id":"a61znt2hvyd1","geo_precision":"range","storenum":139,"strcity":"Purcell"},"type":"Feature","geometry":{"type":"Point","coordinates":[-97.366159,35.029998]}},{"properties":{"st":"48","streetaddr":"2500 DANIEL MCCALL DRIVE","zipcode":"75901","county":"005","date_super":{"end_time":"2002/07/18 00:00:00 -0400","original":"7/17/2002 ","granularity":"day","time":"2002/07/17 00:00:00 -0400"},"geo_score":0.553,"strstate":"TX","conversion":1,"type_store":"Supercenter","opendate":{"end_time":"1976/09/02 00:00:00 -0400","original":"9/1/1976 ","granularity":"day","time":"1976/09/01 00:00:00 -0400"},"id":"a61znszttwcj","geo_precision":"street","storenum":140,"strcity":"Lufkin"},"type":"Feature","geometry":{"type":"Point","coordinates":[-94.71564,31.358708]}},{"properties":{"st":"05","streetaddr":"8301 ROGERS AVENUE","zipcode":"72903","county":"131","date_super":{"end_time":"1997/03/02 00:00:00 -0500","original":"3/1/1997 ","granularity":"day","time":"1997/03/01 00:00:00 -0500"},"geo_score":1.0,"strstate":"AR","conversion":1,"type_store":"Supercenter","opendate":{"end_time":"1976/05/02 00:00:00 -0400","original":"5/1/1976 ","granularity":"day","time":"1976/05/01 00:00:00 -0400"},"id":"a61znt63ii8p","geo_precision":"range","storenum":141,"strcity":"Fort Smith"},"type":"Feature","geometry":{"type":"Point","coordinates":[-94.341961,35.348672]}},{"properties":{"st":"48","streetaddr":"2204 HWY 82 WEST","zipcode":"75426","county":"387","date_super":null,"geo_score":0.583,"strstate":"TX","conversion":null,"type_store":"Wal-Mart","opendate":{"end_time":"1976/05/02 00:00:00 -0400","original":"5/1/1976 ","granularity":"day","time":"1976/05/01 00:00:00 -0400"},"id":"a61znszgf7le","geo_precision":"street","storenum":142,"strcity":"Clarksville"},"type":"Feature","geometry":{"type":"Point","coordinates":[-95.071379,33.611759]}},{"properties":{"st":"21","streetaddr":"310 WEST 5TH STREET","zipcode":"42025","county":"157","date_super":{"end_time":"2000/03/02 00:00:00 -0500","original":"3/1/2000 ","granularity":"day","time":"2000/03/01 00:00:00 -0500"},"geo_score":0.805,"strstate":"KY","conversion":1,"type_store":"Supercenter","opendate":{"end_time":"1976/06/02 00:00:00 -0400","original":"6/1/1976 ","granularity":"day","time":"1976/06/01 00:00:00 -0400"},"id":"a61znt14ka8u","geo_precision":"range","storenum":143,"strcity":"Benton"},"type":"Feature","geometry":{"type":"Point","coordinates":[-88.359032,36.866705]}},{"properties":{"st":"05","streetaddr":"2875 WEST 6TH STREET","zipcode":"72704","county":"143","date_super":{"end_time":"1994/03/02 00:00:00 -0500","original":"3/1/1994 ","granularity":"day","time":"1994/03/01 00:00:00 -0500"},"geo_score":0.902,"strstate":"AR","conversion":1,"type_store":"Supercenter","opendate":{"end_time":"1976/09/02 00:00:00 -0400","original":"9/1/1976 ","granularity":"day","time":"1976/09/01 00:00:00 -0400"},"id":"a61znt12rx7q","geo_precision":"range","storenum":144,"strcity":"Fayetteville"},"type":"Feature","geometry":{"type":"Point","coordinates":[-94.200566,36.052306]}},{"properties":{"st":"29","streetaddr":"3310 W GEORGIA STREET","zipcode":"63353","county":"163","date_super":null,"geo_score":0.773,"strstate":"MO","conversion":null,"type_store":"Wal-Mart","opendate":{"end_time":"1976/10/02 00:00:00 -0400","original":"10/1/1976 ","granularity":"day","time":"1976/10/01 00:00:00 -0400"},"id":"a61znt01rv11","geo_precision":"range","storenum":145,"strcity":"Louisiana"},"type":"Feature","geometry":{"type":"Point","coordinates":[-91.07074,39.433396]}},{"properties":{"st":"48","streetaddr":"1923 NORTH WOOD","zipcode":"75644","county":"459","date_super":{"end_time":"1997/03/02 00:00:00 -0500","original":"3/1/1997 ","granularity":"day","time":"1997/03/01 00:00:00 -0500"},"geo_score":0.732,"strstate":"TX","conversion":1,"type_store":"Supercenter","opendate":{"end_time":"1976/03/02 00:00:00 -0500","original":"3/1/1976 ","granularity":"day","time":"1976/03/01 00:00:00 -0500"},"id":"a61znt0pctlo","geo_precision":"range","storenum":146,"strcity":"Gilmer"},"type":"Feature","geometry":{"type":"Point","coordinates":[-94.940109,32.746034]}},{"properties":{"st":"48","streetaddr":"401 NORTH US HWY 75","zipcode":"75020","county":"181","date_super":{"end_time":"1995/03/02 00:00:00 -0500","original":"3/1/1995 ","granularity":"day","time":"1995/03/01 00:00:00 -0500"},"geo_score":0.682,"strstate":"TX","conversion":1,"type_store":"Supercenter","opendate":{"end_time":"1976/07/02 00:00:00 -0400","original":"7/1/1976 ","granularity":"day","time":"1976/07/01 00:00:00 -0400"},"id":"a61znsu5xr52","geo_precision":"street","storenum":147,"strcity":"Denison"},"type":"Feature","geometry":{"type":"Point","coordinates":[-96.589689,33.707891]}},{"properties":{"st":"48","streetaddr":"3855 LAMAR AVENUE","zipcode":"75460","county":"277","date_super":{"end_time":"1996/03/02 00:00:00 -0500","original":"3/1/1996 ","granularity":"day","time":"1996/03/01 00:00:00 -0500"},"geo_score":0.728,"strstate":"TX","conversion":1,"type_store":"Supercenter","opendate":{"end_time":"1976/06/02 00:00:00 -0400","original":"6/1/1976 ","granularity":"day","time":"1976/06/01 00:00:00 -0400"},"id":"a61znt576l5k","geo_precision":"street","storenum":148,"strcity":"Paris"},"type":"Feature","geometry":{"type":"Point","coordinates":[-95.509797,33.661538]}},{"properties":{"st":"22","streetaddr":"184 OLD WINFIELD RD","zipcode":"71251","county":"049","date_super":{"end_time":"2000/03/02 00:00:00 -0500","original":"3/1/2000 ","granularity":"day","time":"2000/03/01 00:00:00 -0500"},"geo_score":0.882,"strstate":"LA","conversion":1,"type_store":"Supercenter","opendate":{"end_time":"1977/03/02 00:00:00 -0500","original":"3/1/1977 ","granularity":"day","time":"1977/03/01 00:00:00 -0500"},"id":"a61znsuco07a","geo_precision":"range","storenum":149,"strcity":"Jonesboro"},"type":"Feature","geometry":{"type":"Point","coordinates":[-92.708368,32.227875]}},{"properties":{"st":"40","streetaddr":"3215 WILLIAMS AVENUE","zipcode":"73801","county":"153","date_super":{"end_time":"1998/03/02 00:00:00 -0500","original":"3/1/1998 ","granularity":"day","time":"1998/03/01 00:00:00 -0500"},"geo_score":0.915,"strstate":"OK","conversion":1,"type_store":"Supercenter","opendate":{"end_time":"1976/10/02 00:00:00 -0400","original":"10/1/1976 ","granularity":"day","time":"1976/10/01 00:00:00 -0400"},"id":"a61znsupyoiu","geo_precision":"range","storenum":150,"strcity":"Woodward"},"type":"Feature","geometry":{"type":"Point","coordinates":[-99.381687,36.414557]}},{"properties":{"st":"40","streetaddr":"432 SOUTH GEORGE NIGH EXWY","zipcode":"74501","county":"121","date_super":{"end_time":"1994/03/02 00:00:00 -0500","original":"3/1/1994 ","granularity":"day","time":"1994/03/01 00:00:00 -0500"},"geo_score":0.894,"strstate":"OK","conversion":1,"type_store":"Supercenter","opendate":{"end_time":"1977/03/02 00:00:00 -0500","original":"3/1/1977 ","granularity":"day","time":"1977/03/01 00:00:00 -0500"},"id":"a61znsw8cw0w","geo_precision":"range","storenum":151,"strcity":"McAlester"},"type":"Feature","geometry":{"type":"Point","coordinates":[-95.745164,34.913535]}},{"properties":{"st":"29","streetaddr":"12862 STATE ROAD 21","zipcode":"63020","county":"099","date_super":{"end_time":"2004/10/28 00:00:00 -0400","original":"10/27/2004 ","granularity":"day","time":"2004/10/27 00:00:00 -0400"},"geo_score":0.664,"strstate":"MO","conversion":1,"type_store":"Supercenter","opendate":{"end_time":"1976/12/02 00:00:00 -0500","original":"12/1/1976 ","granularity":"day","time":"1976/12/01 00:00:00 -0500"},"id":"a61znsus3q0p","geo_precision":"street","storenum":152,"strcity":"De Soto"},"type":"Feature","geometry":{"type":"Point","coordinates":[-90.574939,38.154223]}},{"properties":{"st":"28","streetaddr":"202 PARK PLAZA","zipcode":"38652","county":"145","date_super":{"end_time":"1994/03/02 00:00:00 -0500","original":"3/1/1994 ","granularity":"day","time":"1994/03/01 00:00:00 -0500"},"geo_score":0.527,"strstate":"MS","conversion":1,"type_store":"Supercenter","opendate":{"end_time":"1976/10/02 00:00:00 -0400","original":"10/1/1976 ","granularity":"day","time":"1976/10/01 00:00:00 -0400"},"id":"a61znt6u9tti","geo_precision":"street","storenum":153,"strcity":"New Albany"},"type":"Feature","geometry":{"type":"Point","coordinates":[-89.980849,34.832285]}},{"properties":{"st":"28","streetaddr":"5219 HWY 51 NORTH","zipcode":"38668","county":"137","date_super":{"end_time":"1994/03/02 00:00:00 -0500","original":"3/1/1994 ","granularity":"day","time":"1994/03/01 00:00:00 -0500"},"geo_score":0.604,"strstate":"MS","conversion":1,"type_store":"Supercenter","opendate":{"end_time":"1977/08/02 00:00:00 -0400","original":"8/1/1977 ","granularity":"day","time":"1977/08/01 00:00:00 -0400"},"id":"a61znt44dha9","geo_precision":"street","storenum":155,"strcity":"Senatobia"},"type":"Feature","geometry":{"type":"Point","coordinates":[-89.968554,34.624603]}},{"properties":{"st":"29","streetaddr":"STATE HWY 84 WEST","zipcode":"63830","county":"155","date_super":null,"geo_score":0.839,"strstate":"MO","conversion":null,"type_store":"Wal-Mart","opendate":{"end_time":"1977/01/02 00:00:00 -0500","original":"1/1/1977 ","granularity":"day","time":"1977/01/01 00:00:00 -0500"},"id":"a61znt8alpia","geo_precision":"street","storenum":156,"strcity":"Caruthersville"},"type":"Feature","geometry":{"type":"Point","coordinates":[-89.664318,36.19748]}},{"properties":{"st":"05","streetaddr":"3509 EAST RACE AVENUE","zipcode":"72143","county":"145","date_super":{"end_time":"1994/03/02 00:00:00 -0500","original":"3/1/1994 ","granularity":"day","time":"1994/03/01 00:00:00 -0500"},"geo_score":0.902,"strstate":"AR","conversion":1,"type_store":"Supercenter","opendate":{"end_time":"1977/01/02 00:00:00 -0500","original":"1/1/1977 ","granularity":"day","time":"1977/01/01 00:00:00 -0500"},"id":"a61znt9u3i4y","geo_precision":"range","storenum":157,"strcity":"Searcy"},"type":"Feature","geometry":{"type":"Point","coordinates":[-91.694259,35.250431]}},{"properties":{"st":"48","streetaddr":"2021 NORTH HWY 121","zipcode":"75418","county":"147","date_super":{"end_time":"1997/03/02 00:00:00 -0500","original":"3/1/1997 ","granularity":"day","time":"1997/03/01 00:00:00 -0500"},"geo_score":0.641,"strstate":"TX","conversion":1,"type_store":"Supercenter","opendate":{"end_time":"1977/05/02 00:00:00 -0400","original":"5/1/1977 ","granularity":"day","time":"1977/05/01 00:00:00 -0400"},"id":"a61znt85295k","geo_precision":"street","storenum":158,"strcity":"Bonham"},"type":"Feature","geometry":{"type":"Point","coordinates":[-96.192354,33.592867]}},{"properties":{"st":"29","streetaddr":"415 CONLEY ROAD","zipcode":"65201","county":"019","date_super":{"end_time":"1998/03/02 00:00:00 -0500","original":"3/1/1998 ","granularity":"day","time":"1998/03/01 00:00:00 -0500"},"geo_score":0.902,"strstate":"MO","conversion":1,"type_store":"Supercenter","opendate":{"end_time":"1977/03/02 00:00:00 -0500","original":"3/1/1977 ","granularity":"day","time":"1977/03/01 00:00:00 -0500"},"id":"a61znt3qjt5d","geo_precision":"range","storenum":159,"strcity":"Columbia"},"type":"Feature","geometry":{"type":"Point","coordinates":[-92.294135,38.956096]}},{"properties":{"st":"05","streetaddr":"219 HIGHWAY 412","zipcode":"72513","county":"135","date_super":{"end_time":"1994/03/02 00:00:00 -0500","original":"3/1/1994 ","granularity":"day","time":"1994/03/01 00:00:00 -0500"},"geo_score":0.635,"strstate":"AR","conversion":1,"type_store":"Supercenter","opendate":{"end_time":"1977/01/02 00:00:00 -0500","original":"1/1/1977 ","granularity":"day","time":"1977/01/01 00:00:00 -0500"},"id":"a61znt6l08cp","geo_precision":"street","storenum":160,"strcity":"Ashflat"},"type":"Feature","geometry":{"type":"Point","coordinates":[-91.618789,36.25054]}},{"properties":{"st":"47","streetaddr":"180 VETERANS DRIVE N","zipcode":"38344","county":"017","date_super":{"end_time":"2002/02/21 00:00:00 -0500","original":"2/20/2002 ","granularity":"day","time":"2002/02/20 00:00:00 -0500"},"geo_score":0.78,"strstate":"TN","conversion":1,"type_store":"Supercenter","opendate":{"end_time":"1977/05/02 00:00:00 -0400","original":"5/1/1977 ","granularity":"day","time":"1977/05/01 00:00:00 -0400"},"id":"a61znt05k5dl","geo_precision":"range","storenum":161,"strcity":"Huntingdon"},"type":"Feature","geometry":{"type":"Point","coordinates":[-88.446906,36.001984]}},{"properties":{"st":"40","streetaddr":"1201 WEST PETREE RD","zipcode":"73005","county":"015","date_super":{"end_time":"1997/03/02 00:00:00 -0500","original":"3/1/1997 ","granularity":"day","time":"1997/03/01 00:00:00 -0500"},"geo_score":0.683,"strstate":"OK","conversion":1,"type_store":"Supercenter","opendate":{"end_time":"1977/06/02 00:00:00 -0400","original":"6/1/1977 ","granularity":"day","time":"1977/06/01 00:00:00 -0400"},"id":"a61znsvxx1ko","geo_precision":"street","storenum":162,"strcity":"Anadarko"},"type":"Feature","geometry":{"type":"Point","coordinates":[-98.244438,35.057896]}},{"properties":{"st":"48","streetaddr":"4810 NORTH STREET","zipcode":"75965","county":"347","date_super":{"end_time":"1993/03/02 00:00:00 -0500","original":"3/1/1993 ","granularity":"day","time":"1993/03/01 00:00:00 -0500"},"geo_score":0.833,"strstate":"TX","conversion":1,"type_store":"Supercenter","opendate":{"end_time":"1977/02/02 00:00:00 -0500","original":"2/1/1977 ","granularity":"day","time":"1977/02/01 00:00:00 -0500"},"id":"a61znt25n4zl","geo_precision":"range","storenum":163,"strcity":"Nacogdoches"},"type":"Feature","geometry":{"type":"Point","coordinates":[-94.655301,31.649003]}},{"properties":{"st":"28","streetaddr":"350 WAL-MART CIRCLE","zipcode":"38863","county":"115","date_super":null,"geo_score":0.915,"strstate":"MS","conversion":null,"type_store":"Wal-Mart","opendate":{"end_time":"1977/02/02 00:00:00 -0500","original":"2/1/1977 ","granularity":"day","time":"1977/02/01 00:00:00 -0500"},"id":"a61znt0bnxmg","geo_precision":"range","storenum":164,"strcity":"Pontotoc"},"type":"Feature","geometry":{"type":"Point","coordinates":[-89.02213,34.250798]}},{"properties":{"st":"48","streetaddr":"2121 HWY 79 SOUTH","zipcode":"75654","county":"401","date_super":{"end_time":"1996/03/02 00:00:00 -0500","original":"3/1/1996 ","granularity":"day","time":"1996/03/01 00:00:00 -0500"},"geo_score":0.671,"strstate":"TX","conversion":1,"type_store":"Supercenter","opendate":{"end_time":"1977/05/02 00:00:00 -0400","original":"5/1/1977 ","granularity":"day","time":"1977/05/01 00:00:00 -0400"},"id":"a61znt6rdt2m","geo_precision":"street","storenum":165,"strcity":"Henderson"},"type":"Feature","geometry":{"type":"Point","coordinates":[-94.784436,32.159326]}},{"properties":{"st":"29","streetaddr":"1433 SO. SAM HOUSTON BLVD","zipcode":"65483","county":"215","date_super":{"end_time":"2002/10/31 00:00:00 -0500","original":"10/30/2002 ","granularity":"day","time":"2002/10/30 00:00:00 -0500"},"geo_score":0.571,"strstate":"MO","conversion":1,"type_store":"Supercenter","opendate":{"end_time":"1977/03/02 00:00:00 -0500","original":"3/1/1977 ","granularity":"day","time":"1977/03/01 00:00:00 -0500"},"id":"a61znt1yb0cd","geo_precision":"street","storenum":166,"strcity":"Houston"},"type":"Feature","geometry":{"type":"Point","coordinates":[-91.894033,37.259569]}},{"properties":{"st":"05","streetaddr":"910 UNITY ROAD","zipcode":"71635","county":"003","date_super":{"end_time":"2005/01/27 00:00:00 -0500","original":"1/26/2005 ","granularity":"day","time":"2005/01/26 00:00:00 -0500"},"geo_score":0.6,"strstate":"AR","conversion":1,"type_store":"Supercenter","opendate":{"end_time":"1977/04/02 00:00:00 -0500","original":"4/1/1977 ","granularity":"day","time":"1977/04/01 00:00:00 -0500"},"id":"a61znt5qizz7","geo_precision":"street","storenum":167,"strcity":"Crossett"},"type":"Feature","geometry":{"type":"Point","coordinates":[-91.952974,33.136169]}},{"properties":{"st":"40","streetaddr":"12101 E 96TH ST. N","zipcode":"74055","county":"143","date_super":{"end_time":"2000/03/02 00:00:00 -0500","original":"3/1/2000 ","granularity":"day","time":"2000/03/01 00:00:00 -0500"},"geo_score":0.633,"strstate":"OK","conversion":1,"type_store":"Supercenter","opendate":{"end_time":"1978/02/08 00:00:00 -0500","original":"2/7/1978 ","granularity":"day","time":"1978/02/07 00:00:00 -0500"},"id":"a61znt6486da","geo_precision":"street","storenum":168,"strcity":"Owasso"},"type":"Feature","geometry":{"type":"Point","coordinates":[-95.884116,36.293026]}},{"properties":{"st":"05","streetaddr":"1400 NORTH CENTER","zipcode":"72086","county":"085","date_super":null,"geo_score":0.848,"strstate":"AR","conversion":null,"type_store":"Wal-Mart","opendate":{"end_time":"1977/09/02 00:00:00 -0400","original":"9/1/1977 ","granularity":"day","time":"1977/09/01 00:00:00 -0400"},"id":"a61znsz310ov","geo_precision":"range","storenum":169,"strcity":"Lonoke"},"type":"Feature","geometry":{"type":"Point","coordinates":[-91.895726,34.795082]}},{"properties":{"st":"22","streetaddr":"925 KEYSER AVE","zipcode":"71457","county":"069","date_super":{"end_time":"1995/03/02 00:00:00 -0500","original":"3/1/1995 ","granularity":"day","time":"1995/03/01 00:00:00 -0500"},"geo_score":0.919,"strstate":"LA","conversion":1,"type_store":"Supercenter","opendate":{"end_time":"1977/10/02 00:00:00 -0400","original":"10/1/1977 ","granularity":"day","time":"1977/10/01 00:00:00 -0400"},"id":"a61znsuia4fz","geo_precision":"range","storenum":170,"strcity":"Natchitoches"},"type":"Feature","geometry":{"type":"Point","coordinates":[-93.067716,31.752704]}},{"properties":{"st":"05","streetaddr":"1270 STATE HWY 4 BYPASS SW","zipcode":"71701","county":"103","date_super":null,"geo_score":0.872,"strstate":"AR","conversion":null,"type_store":"Wal-Mart","opendate":{"end_time":"1977/11/02 00:00:00 -0500","original":"11/1/1977 ","granularity":"day","time":"1977/11/01 00:00:00 -0500"},"id":"a61znt7ra2oj","geo_precision":"range","storenum":171,"strcity":"Camden"},"type":"Feature","geometry":{"type":"Point","coordinates":[-92.853593,33.585066]}},{"properties":{"st":"29","streetaddr":"5886 HWY 100","zipcode":"63090","county":"071","date_super":{"end_time":"1988/03/02 00:00:00 -0500","original":"3/1/1988 ","granularity":"day","time":"1988/03/01 00:00:00 -0500"},"geo_score":0.912,"strstate":"MO","conversion":1,"type_store":"Supercenter","opendate":{"end_time":"1977/07/02 00:00:00 -0400","original":"7/1/1977 ","granularity":"day","time":"1977/07/01 00:00:00 -0400"},"id":"a61znt3rlghd","geo_precision":"range","storenum":172,"strcity":"Washington"},"type":"Feature","geometry":{"type":"Point","coordinates":[-91.030836,38.546345]}},{"properties":{"st":"29","streetaddr":"#1 MEMORIAL DRIVE","zipcode":"63664","county":"221","date_super":{"end_time":"2003/05/22 00:00:00 -0400","original":"5/21/2003 ","granularity":"day","time":"2003/05/21 00:00:00 -0400"},"geo_score":0.61,"strstate":"MO","conversion":1,"type_store":"Supercenter","opendate":{"end_time":"1977/10/02 00:00:00 -0400","original":"10/1/1977 ","granularity":"day","time":"1977/10/01 00:00:00 -0400"},"id":"a61znsz5qk1s","geo_precision":"street","storenum":173,"strcity":"Potosi"},"type":"Feature","geometry":{"type":"Point","coordinates":[-90.046548,37.985054]}},{"properties":{"st":"12","streetaddr":"2700 CLEARLAKE ROAD","zipcode":"32922","county":"009","date_super":{"end_time":"2005/01/27 00:00:00 -0500","original":"1/26/2005 ","granularity":"day","time":"2005/01/26 00:00:00 -0500"},"geo_score":0.902,"strstate":"FL","conversion":1,"type_store":"Supercenter","opendate":{"end_time":"1985/10/16 00:00:00 -0400","original":"10/15/1985 ","granularity":"day","time":"1985/10/15 00:00:00 -0400"},"id":"a61znsxzbk3b","geo_precision":"range","storenum":174,"strcity":"Rockledge"},"type":"Feature","geometry":{"type":"Point","coordinates":[-80.755079,28.394482]}},{"properties":{"st":"47","streetaddr":"560 WEST POPLAR AVE","zipcode":"38017","county":"157","date_super":{"end_time":"1996/03/02 00:00:00 -0500","original":"3/1/1996 ","granularity":"day","time":"1996/03/01 00:00:00 -0500"},"geo_score":0.919,"strstate":"TN","conversion":1,"type_store":"Supercenter","opendate":{"end_time":"1977/11/02 00:00:00 -0500","original":"11/1/1977 ","granularity":"day","time":"1977/11/01 00:00:00 -0500"},"id":"a61znt2o3qc6","geo_precision":"range","storenum":175,"strcity":"Collierville"},"type":"Feature","geometry":{"type":"Point","coordinates":[-89.680555,35.0459]}},{"properties":{"st":"28","streetaddr":"822 CITY AVENUE SOUTH","zipcode":"38663","county":"139","date_super":null,"geo_score":0.927,"strstate":"MS","conversion":null,"type_store":"Wal-Mart","opendate":{"end_time":"1977/07/02 00:00:00 -0400","original":"7/1/1977 ","granularity":"day","time":"1977/07/01 00:00:00 -0400"},"id":"a61znszkvyxv","geo_precision":"range","storenum":176,"strcity":"Ripley"},"type":"Feature","geometry":{"type":"Point","coordinates":[-88.949519,34.722679]}},{"properties":{"st":"47","streetaddr":"1210 MINERAL WELL AV","zipcode":"38242","county":"079","date_super":{"end_time":"1997/03/02 00:00:00 -0500","original":"3/1/1997 ","granularity":"day","time":"1997/03/01 00:00:00 -0500"},"geo_score":0.863,"strstate":"TN","conversion":1,"type_store":"Supercenter","opendate":{"end_time":"1977/11/02 00:00:00 -0500","original":"11/1/1977 ","granularity":"day","time":"1977/11/01 00:00:00 -0500"},"id":"a61znt112bkr","geo_precision":"range","storenum":177,"strcity":"Paris"},"type":"Feature","geometry":{"type":"Point","coordinates":[-88.307303,36.283453]}},{"properties":{"st":"40","streetaddr":"914 E OKLAHOMA BLVD","zipcode":"73717","county":"151","date_super":{"end_time":"1997/03/02 00:00:00 -0500","original":"3/1/1997 ","granularity":"day","time":"1997/03/01 00:00:00 -0500"},"geo_score":0.721,"strstate":"OK","conversion":1,"type_store":"Supercenter","opendate":{"end_time":"1977/11/02 00:00:00 -0500","original":"11/1/1977 ","granularity":"day","time":"1977/11/01 00:00:00 -0500"},"id":"a61znt2xwec1","geo_precision":"street","storenum":178,"strcity":"Alva"},"type":"Feature","geometry":{"type":"Point","coordinates":[-98.648058,36.797537]}},{"properties":{"st":"29","streetaddr":"3520 W SUNSHINE ST.","zipcode":"65807","county":"077","date_super":{"end_time":"2001/03/15 00:00:00 -0500","original":"3/14/2001 ","granularity":"day","time":"2001/03/14 00:00:00 -0500"},"geo_score":1.0,"strstate":"MO","conversion":1,"type_store":"Supercenter","opendate":{"end_time":"1977/02/02 00:00:00 -0500","original":"2/1/1977 ","granularity":"day","time":"1977/02/01 00:00:00 -0500"},"id":"a61znt5py7vr","geo_precision":"range","storenum":179,"strcity":"Springfield"},"type":"Feature","geometry":{"type":"Point","coordinates":[-93.350579,37.182903]}},{"properties":{"st":"48","streetaddr":"1311 SOUTH JACKSON","zipcode":"75766","county":"073","date_super":{"end_time":"1994/03/02 00:00:00 -0500","original":"3/1/1994 ","granularity":"day","time":"1994/03/01 00:00:00 -0500"},"geo_score":0.852,"strstate":"TX","conversion":1,"type_store":"Supercenter","opendate":{"end_time":"1978/03/15 00:00:00 -0500","original":"3/14/1978 ","granularity":"day","time":"1978/03/14 00:00:00 -0500"},"id":"a61znt971abe","geo_precision":"range","storenum":180,"strcity":"Jacksonville"},"type":"Feature","geometry":{"type":"Point","coordinates":[-95.264717,31.953321]}},{"properties":{"st":"48","streetaddr":"800 JAMES BOWIE DRIVE","zipcode":"75570","county":"037","date_super":{"end_time":"2005/05/19 00:00:00 -0400","original":"5/18/2005 ","granularity":"day","time":"2005/05/18 00:00:00 -0400"},"geo_score":0.645,"strstate":"TX","conversion":1,"type_store":"Supercenter","opendate":{"end_time":"1978/08/09 00:00:00 -0400","original":"8/8/1978 ","granularity":"day","time":"1978/08/08 00:00:00 -0400"},"id":"a61znsz7x3v3","geo_precision":"street","storenum":181,"strcity":"New Boston"},"type":"Feature","geometry":{"type":"Point","coordinates":[-94.42351,33.448665]}},{"properties":{"st":"28","streetaddr":"1831 S DR MARTIN L. KING BLVD","zipcode":"38701","county":"151","date_super":{"end_time":"2001/07/19 00:00:00 -0400","original":"7/18/2001 ","granularity":"day","time":"2001/07/18 00:00:00 -0400"},"geo_score":0.584,"strstate":"MS","conversion":1,"type_store":"Supercenter","opendate":{"end_time":"1979/06/02 00:00:00 -0400","original":"6/1/1979 ","granularity":"day","time":"1979/06/01 00:00:00 -0400"},"id":"a61znswsa8l5","geo_precision":"street","storenum":182,"strcity":"Greenville"},"type":"Feature","geometry":{"type":"Point","coordinates":[-91.037917,33.405817]}},{"properties":{"st":"28","streetaddr":"159 HIGHWAY 15 SOUTH","zipcode":"39339","county":"159","date_super":{"end_time":"2004/08/26 00:00:00 -0400","original":"8/25/2004 ","granularity":"day","time":"2004/08/25 00:00:00 -0400"},"geo_score":0.551,"strstate":"MS","conversion":1,"type_store":"Supercenter","opendate":{"end_time":"1977/10/02 00:00:00 -0400","original":"10/1/1977 ","granularity":"day","time":"1977/10/01 00:00:00 -0400"},"id":"a61znt904ydk","geo_precision":"street","storenum":183,"strcity":"Louisville"},"type":"Feature","geometry":{"type":"Point","coordinates":[-89.114342,33.175272]}},{"properties":{"st":"29","streetaddr":"600 N.E. CORONADO DRIVE","zipcode":"64014","county":"095","date_super":{"end_time":"2005/05/26 00:00:00 -0400","original":"5/25/2005 ","granularity":"day","time":"2005/05/25 00:00:00 -0400"},"geo_score":0.633,"strstate":"MO","conversion":1,"type_store":"Supercenter","opendate":{"end_time":"1978/02/02 00:00:00 -0500","original":"2/1/1978 ","granularity":"day","time":"1978/02/01 00:00:00 -0500"},"id":"a61znsycwsys","geo_precision":"street","storenum":184,"strcity":"Blue Springs"},"type":"Feature","geometry":{"type":"Point","coordinates":[-94.255951,39.038534]}},{"properties":{"st":"48","streetaddr":"1800 LAWRENCE ST.","zipcode":"76240","county":"097","date_super":{"end_time":"2002/03/02 00:00:00 -0500","original":"3/1/2002 ","granularity":"day","time":"2002/03/01 00:00:00 -0500"},"geo_score":0.92,"strstate":"TX","conversion":1,"type_store":"Supercenter","opendate":{"end_time":"1993/07/22 00:00:00 -0400","original":"7/21/1993 ","granularity":"day","time":"1993/07/21 00:00:00 -0400"},"id":"a61znt7cq9m1","geo_precision":"range","storenum":185,"strcity":"Gainesville"},"type":"Feature","geometry":{"type":"Point","coordinates":[-97.137213,33.641145]}},{"properties":{"st":"20","streetaddr":"301 SO. VILLAGE ROAD","zipcode":"67042","county":"015","date_super":{"end_time":"2004/10/28 00:00:00 -0400","original":"10/27/2004 ","granularity":"day","time":"2004/10/27 00:00:00 -0400"},"geo_score":0.524,"strstate":"KS","conversion":1,"type_store":"Supercenter","opendate":{"end_time":"1977/11/02 00:00:00 -0500","original":"11/1/1977 ","granularity":"day","time":"1977/11/01 00:00:00 -0500"},"id":"a61znt1ndepg","geo_precision":"street","storenum":186,"strcity":"El Dorado"},"type":"Feature","geometry":{"type":"Point","coordinates":[-96.849791,37.882633]}},{"properties":{"st":"29","streetaddr":"3439 WILLIAMS STREET","zipcode":"63701","county":"031","date_super":{"end_time":"1994/03/02 00:00:00 -0500","original":"3/1/1994 ","granularity":"day","time":"1994/03/01 00:00:00 -0500"},"geo_score":0.61,"strstate":"MO","conversion":1,"type_store":"Supercenter","opendate":{"end_time":"1977/07/02 00:00:00 -0400","original":"7/1/1977 ","granularity":"day","time":"1977/07/01 00:00:00 -0400"},"id":"a61znt30vsjc","geo_precision":"street","storenum":188,"strcity":"Cape Girardeau"},"type":"Feature","geometry":{"type":"Point","coordinates":[-89.884439,37.831215]}},{"properties":{"st":"29","streetaddr":"2206 NORTH BALTIMORE","zipcode":"63501","county":"001","date_super":{"end_time":"1993/03/02 00:00:00 -0500","original":"3/1/1993 ","granularity":"day","time":"1993/03/01 00:00:00 -0500"},"geo_score":0.863,"strstate":"MO","conversion":1,"type_store":"Supercenter","opendate":{"end_time":"1977/07/02 00:00:00 -0400","original":"7/1/1977 ","granularity":"day","time":"1977/07/01 00:00:00 -0400"},"id":"a61znt5yui5v","geo_precision":"range","storenum":189,"strcity":"Kirksville"},"type":"Feature","geometry":{"type":"Point","coordinates":[-92.582368,40.214976]}},{"properties":{"st":"29","streetaddr":"1500 EAST FIRST ST","zipcode":"63857","county":"069","date_super":{"end_time":"1995/03/02 00:00:00 -0500","original":"3/1/1995 ","granularity":"day","time":"1995/03/01 00:00:00 -0500"},"geo_score":0.745,"strstate":"MO","conversion":1,"type_store":"Supercenter","opendate":{"end_time":"1977/07/02 00:00:00 -0400","original":"7/1/1977 ","granularity":"day","time":"1977/07/01 00:00:00 -0400"},"id":"a61znta7fhwg","geo_precision":"range","storenum":190,"strcity":"Kennett"},"type":"Feature","geometry":{"type":"Point","coordinates":[-90.040789,36.236614]}},{"properties":{"st":"47","streetaddr":"2200 BROOKMEAD DRIVE","zipcode":"38401","county":"119","date_super":{"end_time":"2002/03/21 00:00:00 -0500","original":"3/20/2002 ","granularity":"day","time":"2002/03/20 00:00:00 -0500"},"geo_score":0.78,"strstate":"TN","conversion":1,"type_store":"Supercenter","opendate":{"end_time":"1981/09/16 00:00:00 -0400","original":"9/15/1981 ","granularity":"day","time":"1981/09/15 00:00:00 -0400"},"id":"a61znsyjiwep","geo_precision":"street","storenum":192,"strcity":"Columbia"},"type":"Feature","geometry":{"type":"Point","coordinates":[-87.053601,35.596441]}},{"properties":{"st":"48","streetaddr":"4900 GARTH ROAD","zipcode":"77520","county":"201","date_super":{"end_time":"2001/07/19 00:00:00 -0400","original":"7/18/2001 ","granularity":"day","time":"2001/07/18 00:00:00 -0400"},"geo_score":0.707,"strstate":"TX","conversion":1,"type_store":"Supercenter","opendate":{"end_time":"1985/01/23 00:00:00 -0500","original":"1/22/1985 ","granularity":"day","time":"1985/01/22 00:00:00 -0500"},"id":"a61znt4nwva8","geo_precision":"street","storenum":194,"strcity":"Baytown"},"type":"Feature","geometry":{"type":"Point","coordinates":[-94.977095,29.749644]}},{"properties":{"st":"29","streetaddr":"2203 PATSY LANE","zipcode":"64024","county":"047","date_super":null,"geo_score":0.921,"strstate":"MO","conversion":null,"type_store":"Wal-Mart","opendate":{"end_time":"1977/07/02 00:00:00 -0400","original":"7/1/1977 ","granularity":"day","time":"1977/07/01 00:00:00 -0400"},"id":"a61znt8pc085","geo_precision":"range","storenum":195,"strcity":"Excelsior Springs"},"type":"Feature","geometry":{"type":"Point","coordinates":[-94.2633,39.331554]}},{"properties":{"st":"17","streetaddr":"1450 EAST MAIN","zipcode":"62901","county":"077","date_super":{"end_time":"1993/03/02 00:00:00 -0500","original":"3/1/1993 ","granularity":"day","time":"1993/03/01 00:00:00 -0500"},"geo_score":0.66,"strstate":"IL","conversion":1,"type_store":"Supercenter","opendate":{"end_time":"1977/07/02 00:00:00 -0400","original":"7/1/1977 ","granularity":"day","time":"1977/07/01 00:00:00 -0400"},"id":"a61znt7o4bla","geo_precision":"street","storenum":196,"strcity":"Carbondale"},"type":"Feature","geometry":{"type":"Point","coordinates":[-89.186425,37.73534]}},{"properties":{"st":"17","streetaddr":"1730 E JACKSON ROAD","zipcode":"61455","county":"109","date_super":{"end_time":"2003/08/28 00:00:00 -0400","original":"8/27/2003 ","granularity":"day","time":"2003/08/27 00:00:00 -0400"},"geo_score":0.941,"strstate":"IL","conversion":1,"type_store":"Supercenter","opendate":{"end_time":"1977/07/02 00:00:00 -0400","original":"7/1/1977 ","granularity":"day","time":"1977/07/01 00:00:00 -0400"},"id":"a61znt8nbxfj","geo_precision":"range","storenum":197,"strcity":"Macomb"},"type":"Feature","geometry":{"type":"Point","coordinates":[-90.641222,40.458596]}},{"properties":{"st":"17","streetaddr":"1870 WEST MAIN ST.","zipcode":"62881","county":"121","date_super":{"end_time":"2003/04/17 00:00:00 -0400","original":"4/16/2003 ","granularity":"day","time":"2003/04/16 00:00:00 -0400"},"geo_score":0.902,"strstate":"IL","conversion":1,"type_store":"Supercenter","opendate":{"end_time":"1977/07/02 00:00:00 -0400","original":"7/1/1977 ","granularity":"day","time":"1977/07/01 00:00:00 -0400"},"id":"a61znt95y805","geo_precision":"range","storenum":198,"strcity":"Salem"},"type":"Feature","geometry":{"type":"Point","coordinates":[-88.987588,38.622524]}},{"properties":{"st":"17","streetaddr":"1501 WOODLAWN ROAD","zipcode":"62656","county":"107","date_super":null,"geo_score":0.878,"strstate":"IL","conversion":null,"type_store":"Wal-Mart","opendate":{"end_time":"1977/07/02 00:00:00 -0400","original":"7/1/1977 ","granularity":"day","time":"1977/07/01 00:00:00 -0400"},"id":"a61znt067kfg","geo_precision":"range","storenum":199,"strcity":"Lincoln"},"type":"Feature","geometry":{"type":"Point","coordinates":[-89.397723,40.157926]}},{"properties":{"st":"17","streetaddr":"1205 W MORTON ROAD","zipcode":"62650","county":"137","date_super":null,"geo_score":0.884,"strstate":"IL","conversion":null,"type_store":"Wal-Mart","opendate":{"end_time":"1977/07/02 00:00:00 -0400","original":"7/1/1977 ","granularity":"day","time":"1977/07/01 00:00:00 -0400"},"id":"a61znt48dvnd","geo_precision":"range","storenum":200,"strcity":"Jacksonville"},"type":"Feature","geometry":{"type":"Point","coordinates":[-90.244319,39.723223]}},{"properties":{"st":"17","streetaddr":"120 CARLYLE PLAZA DRIVE","zipcode":"62221","county":"163","date_super":null,"geo_score":0.861,"strstate":"IL","conversion":null,"type_store":"Wal-Mart","opendate":{"end_time":"1977/07/02 00:00:00 -0400","original":"7/1/1977 ","granularity":"day","time":"1977/07/01 00:00:00 -0400"},"id":"a61znsyj3b0l","geo_precision":"range","storenum":201,"strcity":"Belleville"},"type":"Feature","geometry":{"type":"Point","coordinates":[-89.954797,38.514528]}},{"properties":{"st":"29","streetaddr":"937 PARK CIRCLE DR","zipcode":"64628","county":"115","date_super":{"end_time":"1998/03/02 00:00:00 -0500","original":"3/1/1998 ","granularity":"day","time":"1998/03/01 00:00:00 -0500"},"geo_score":0.61,"strstate":"MO","conversion":1,"type_store":"Supercenter","opendate":{"end_time":"1978/08/30 00:00:00 -0400","original":"8/29/1978 ","granularity":"day","time":"1978/08/29 00:00:00 -0400"},"id":"a61znt9pyvhh","geo_precision":"street","storenum":203,"strcity":"Brookfield"},"type":"Feature","geometry":{"type":"Point","coordinates":[-93.070888,39.790852]}},{"properties":{"st":"21","streetaddr":"500 US HWY 62 WEST","zipcode":"42445","county":"033","date_super":null,"geo_score":0.866,"strstate":"KY","conversion":null,"type_store":"Wal-Mart","opendate":{"end_time":"1978/02/15 00:00:00 -0500","original":"2/14/1978 ","granularity":"day","time":"1978/02/14 00:00:00 -0500"},"id":"a61znt1h9m8u","geo_precision":"range","storenum":204,"strcity":"Princeton"},"type":"Feature","geometry":{"type":"Point","coordinates":[-87.885889,37.110323]}},{"properties":{"st":"28","streetaddr":"1002 BEACON STREET","zipcode":"39350","county":"099","date_super":{"end_time":"1994/03/02 00:00:00 -0500","original":"3/1/1994 ","granularity":"day","time":"1994/03/01 00:00:00 -0500"},"geo_score":0.723,"strstate":"MS","conversion":1,"type_store":"Supercenter","opendate":{"end_time":"1978/03/29 00:00:00 -0500","original":"3/28/1978 ","granularity":"day","time":"1978/03/28 00:00:00 -0500"},"id":"a61znt3mg8c5","geo_precision":"street","storenum":205,"strcity":"Philadelphia"},"type":"Feature","geometry":{"type":"Point","coordinates":[-89.103355,32.771188]}},{"properties":{"st":"48","streetaddr":"2041 REDBUD BLVD","zipcode":"75069","county":"085","date_super":{"end_time":"2005/07/21 00:00:00 -0400","original":"7/20/2005 ","granularity":"day","time":"2005/07/20 00:00:00 -0400"},"geo_score":0.702,"strstate":"TX","conversion":1,"type_store":"Supercenter","opendate":{"end_time":"1978/03/29 00:00:00 -0500","original":"3/28/1978 ","granularity":"day","time":"1978/03/28 00:00:00 -0500"},"id":"a61znsxgrrvh","geo_precision":"street","storenum":206,"strcity":"McKinney"},"type":"Feature","geometry":{"type":"Point","coordinates":[-96.627313,33.222766]}},{"properties":{"st":"40","streetaddr":"1004 NORTH BROADWAY","zipcode":"74020","county":"117","date_super":null,"geo_score":0.86,"strstate":"OK","conversion":null,"type_store":"Wal-Mart","opendate":{"end_time":"1978/03/22 00:00:00 -0500","original":"3/21/1978 ","granularity":"day","time":"1978/03/21 00:00:00 -0500"},"id":"a61znt381wvj","geo_precision":"range","storenum":207,"strcity":"Cleveland"},"type":"Feature","geometry":{"type":"Point","coordinates":[-96.464213,36.317854]}},{"properties":{"st":"20","streetaddr":"2970 MILITARY AVENUE","zipcode":"66713","county":"021","date_super":null,"geo_score":0.91,"strstate":"KS","conversion":null,"type_store":"Wal-Mart","opendate":{"end_time":"1978/04/05 00:00:00 -0500","original":"4/4/1978 ","granularity":"day","time":"1978/04/04 00:00:00 -0500"},"id":"a61znswdrsco","geo_precision":"range","storenum":208,"strcity":"Baxter Springs"},"type":"Feature","geometry":{"type":"Point","coordinates":[-94.739412,37.006126]}},{"properties":{"st":"05","streetaddr":"1516 NORTH 18TH STREET","zipcode":"72949","county":"047","date_super":null,"geo_score":0.831,"strstate":"AR","conversion":null,"type_store":"Wal-Mart","opendate":{"end_time":"1978/06/02 00:00:00 -0400","original":"6/1/1978 ","granularity":"day","time":"1978/06/01 00:00:00 -0400"},"id":"a61znt55aek0","geo_precision":"range","storenum":209,"strcity":"Ozark"},"type":"Feature","geometry":{"type":"Point","coordinates":[-93.844736,35.502268]}},{"properties":{"st":"40","streetaddr":"500 EAST HIGHWAY 270","zipcode":"74848","county":"063","date_super":null,"geo_score":0.643,"strstate":"OK","conversion":null,"type_store":"Wal-Mart","opendate":{"end_time":"1978/07/19 00:00:00 -0400","original":"7/18/1978 ","granularity":"day","time":"1978/07/18 00:00:00 -0400"},"id":"a61znt0jvph0","geo_precision":"street","storenum":210,"strcity":"Holdenville"},"type":"Feature","geometry":{"type":"Point","coordinates":[-96.247637,35.072406]}},{"properties":{"st":"48","streetaddr":"401 COKE STREET","zipcode":"76645","county":"217","date_super":{"end_time":"1998/03/02 00:00:00 -0500","original":"3/1/1998 ","granularity":"day","time":"1998/03/01 00:00:00 -0500"},"geo_score":0.799,"strstate":"TX","conversion":1,"type_store":"Supercenter","opendate":{"end_time":"1978/09/13 00:00:00 -0400","original":"9/12/1978 ","granularity":"day","time":"1978/09/12 00:00:00 -0400"},"id":"a61znszoyl8a","geo_precision":"range","storenum":211,"strcity":"Hillsboro"},"type":"Feature","geometry":{"type":"Point","coordinates":[-97.0988,32.007636]}},{"properties":{"st":"40","streetaddr":"333 INTERSTATE DRIVE","zipcode":"73069","county":"027","date_super":{"end_time":"1999/03/02 00:00:00 -0500","original":"3/1/1999 ","granularity":"day","time":"1999/03/01 00:00:00 -0500"},"geo_score":0.891,"strstate":"OK","conversion":1,"type_store":"Supercenter","opendate":{"end_time":"1977/11/02 00:00:00 -0500","original":"11/1/1977 ","granularity":"day","time":"1977/11/01 00:00:00 -0500"},"id":"a61znsw0v4n4","geo_precision":"range","storenum":212,"strcity":"Norman"},"type":"Feature","geometry":{"type":"Point","coordinates":[-97.48443,35.220425]}},{"properties":{"st":"17","streetaddr":"1205 WEST FERDON ST","zipcode":"62056","county":"135","date_super":{"end_time":"1999/03/02 00:00:00 -0500","original":"3/1/1999 ","granularity":"day","time":"1999/03/01 00:00:00 -0500"},"geo_score":0.902,"strstate":"IL","conversion":1,"type_store":"Supercenter","opendate":{"end_time":"1978/05/17 00:00:00 -0400","original":"5/16/1978 ","granularity":"day","time":"1978/05/16 00:00:00 -0400"},"id":"a61znt8hs3ww","geo_precision":"range","storenum":213,"strcity":"Litchfield"},"type":"Feature","geometry":{"type":"Point","coordinates":[-89.667248,39.182687]}},{"properties":{"st":"48","streetaddr":"800 WEST GIBSON","zipcode":"75951","county":"241","date_super":{"end_time":"1994/03/02 00:00:00 -0500","original":"3/1/1994 ","granularity":"day","time":"1994/03/01 00:00:00 -0500"},"geo_score":0.854,"strstate":"TX","conversion":1,"type_store":"Supercenter","opendate":{"end_time":"1978/10/11 00:00:00 -0400","original":"10/10/1978 ","granularity":"day","time":"1978/10/10 00:00:00 -0400"},"id":"a61znt8ebh6a","geo_precision":"range","storenum":214,"strcity":"Jasper"},"type":"Feature","geometry":{"type":"Point","coordinates":[-94.015091,30.905547]}},{"properties":{"st":"28","streetaddr":"620 SOUTH APPLEGATE ST","zipcode":"38967","county":"097","date_super":null,"geo_score":0.78,"strstate":"MS","conversion":null,"type_store":"Wal-Mart","opendate":{"end_time":"1979/05/16 00:00:00 -0400","original":"5/15/1979 ","granularity":"day","time":"1979/05/15 00:00:00 -0400"},"id":"a61znt82vjjd","geo_precision":"range","storenum":215,"strcity":"Winona"},"type":"Feature","geometry":{"type":"Point","coordinates":[-89.735503,33.471565]}},{"properties":{"st":"17","streetaddr":"2705 WALTON WAY","zipcode":"62959","county":"199","date_super":null,"geo_score":0.902,"strstate":"IL","conversion":null,"type_store":"Wal-Mart","opendate":{"end_time":"1979/03/28 00:00:00 -0500","original":"3/27/1979 ","granularity":"day","time":"1979/03/27 00:00:00 -0500"},"id":"a61znt1q1rct","geo_precision":"range","storenum":216,"strcity":"Marion"},"type":"Feature","geometry":{"type":"Point","coordinates":[-88.969827,37.74193]}},{"properties":{"st":"48","streetaddr":"801 WEST MAIN","zipcode":"75067","county":"121","date_super":{"end_time":"1999/03/02 00:00:00 -0500","original":"3/1/1999 ","granularity":"day","time":"1999/03/01 00:00:00 -0500"},"geo_score":0.851,"strstate":"TX","conversion":1,"type_store":"Supercenter","opendate":{"end_time":"1978/09/06 00:00:00 -0400","original":"9/5/1978 ","granularity":"day","time":"1978/09/05 00:00:00 -0400"},"id":"a61znt03604o","geo_precision":"range","storenum":217,"strcity":"Lewisville"},"type":"Feature","geometry":{"type":"Point","coordinates":[-97.012005,33.045681]}},{"properties":{"st":"47","streetaddr":"1017 MULBERRY AVENUE","zipcode":"38375","county":"109","date_super":{"end_time":"1998/03/02 00:00:00 -0500","original":"3/1/1998 ","granularity":"day","time":"1998/03/01 00:00:00 -0500"},"geo_score":0.935,"strstate":"TN","conversion":1,"type_store":"Supercenter","opendate":{"end_time":"1979/04/11 00:00:00 -0500","original":"4/10/1979 ","granularity":"day","time":"1979/04/10 00:00:00 -0500"},"id":"a61znt615jd4","geo_precision":"range","storenum":218,"strcity":"Selmer"},"type":"Feature","geometry":{"type":"Point","coordinates":[-88.571497,35.139496]}},{"properties":{"st":"29","streetaddr":"3201 WEST BROADWAY","zipcode":"65301","county":"159","date_super":{"end_time":"1993/03/02 00:00:00 -0500","original":"3/1/1993 ","granularity":"day","time":"1993/03/01 00:00:00 -0500"},"geo_score":0.822,"strstate":"MO","conversion":1,"type_store":"Supercenter","opendate":{"end_time":"1978/10/04 00:00:00 -0400","original":"10/3/1978 ","granularity":"day","time":"1978/10/03 00:00:00 -0400"},"id":"a61znswl22mv","geo_precision":"range","storenum":219,"strcity":"Sedalia"},"type":"Feature","geometry":{"type":"Point","coordinates":[-93.267125,38.709207]}},{"properties":{"st":"48","streetaddr":"951 SW WILSHIRE BLVD","zipcode":"76028","county":"251","date_super":{"end_time":"1995/03/02 00:00:00 -0500","original":"3/1/1995 ","granularity":"day","time":"1995/03/01 00:00:00 -0500"},"geo_score":0.927,"strstate":"TX","conversion":1,"type_store":"Supercenter","opendate":{"end_time":"1978/10/18 00:00:00 -0400","original":"10/17/1978 ","granularity":"day","time":"1978/10/17 00:00:00 -0400"},"id":"a61znt1re5bx","geo_precision":"range","storenum":220,"strcity":"Burleson"},"type":"Feature","geometry":{"type":"Point","coordinates":[-97.339667,32.529497]}},{"properties":{"st":"40","streetaddr":"1200 GARTH BROOKS BLVD","zipcode":"73099","county":"017","date_super":{"end_time":"1994/03/02 00:00:00 -0500","original":"3/1/1994 ","granularity":"day","time":"1994/03/01 00:00:00 -0500"},"geo_score":0.817,"strstate":"OK","conversion":1,"type_store":"Supercenter","opendate":{"end_time":"1978/11/01 00:00:00 -0500","original":"10/31/1978 ","granularity":"day","time":"1978/10/31 00:00:00 -0500"},"id":"a61znswnzj8x","geo_precision":"range","storenum":221,"strcity":"Yukon"},"type":"Feature","geometry":{"type":"Point","coordinates":[-97.760235,35.49673]}},{"properties":{"st":"17","streetaddr":"1410 N MARKET ST","zipcode":"62286","county":"157","date_super":{"end_time":"1996/03/02 00:00:00 -0500","original":"3/1/1996 ","granularity":"day","time":"1996/03/01 00:00:00 -0500"},"geo_score":0.916,"strstate":"IL","conversion":1,"type_store":"Supercenter","opendate":{"end_time":"1978/12/06 00:00:00 -0500","original":"12/5/1978 ","granularity":"day","time":"1978/12/05 00:00:00 -0500"},"id":"a61znt49gkyh","geo_precision":"range","storenum":222,"strcity":"Sparta"},"type":"Feature","geometry":{"type":"Point","coordinates":[-89.703527,38.140855]}},{"properties":{"st":"17","streetaddr":"110 DAVIDSON AVENUE","zipcode":"62864","county":"081","date_super":{"end_time":"1997/03/02 00:00:00 -0500","original":"3/1/1997 ","granularity":"day","time":"1997/03/01 00:00:00 -0500"},"geo_score":0.831,"strstate":"IL","conversion":1,"type_store":"Supercenter","opendate":{"end_time":"1978/06/14 00:00:00 -0400","original":"6/13/1978 ","granularity":"day","time":"1978/06/13 00:00:00 -0400"},"id":"a61znt1bt5h8","geo_precision":"range","storenum":224,"strcity":"Mount Vernon"},"type":"Feature","geometry":{"type":"Point","coordinates":[-88.960256,38.312227]}},{"properties":{"st":"40","streetaddr":"2108 WEST BROADWAY","zipcode":"73086","county":"099","date_super":null,"geo_score":0.877,"strstate":"OK","conversion":null,"type_store":"Wal-Mart","opendate":{"end_time":"1978/10/25 00:00:00 -0400","original":"10/24/1978 ","granularity":"day","time":"1978/10/24 00:00:00 -0400"},"id":"a61znsxdc4i2","geo_precision":"range","storenum":225,"strcity":"Sulphur"},"type":"Feature","geometry":{"type":"Point","coordinates":[-96.994754,34.506304]}},{"properties":{"st":"48","streetaddr":"201 US HWY 59 LOOP","zipcode":"75551","county":"067","date_super":{"end_time":"1997/03/02 00:00:00 -0500","original":"3/1/1997 ","granularity":"day","time":"1997/03/01 00:00:00 -0500"},"geo_score":0.824,"strstate":"TX","conversion":1,"type_store":"Supercenter","opendate":{"end_time":"1978/10/18 00:00:00 -0400","original":"10/17/1978 ","granularity":"day","time":"1978/10/17 00:00:00 -0400"},"id":"a61znt894f34","geo_precision":"range","storenum":226,"strcity":"Atlanta"},"type":"Feature","geometry":{"type":"Point","coordinates":[-94.182678,33.113989]}},{"properties":{"st":"40","streetaddr":"2400 SOUTH COUNTRY CLUB ROAD","zipcode":"73036","county":"017","date_super":{"end_time":"1995/03/02 00:00:00 -0500","original":"3/1/1995 ","granularity":"day","time":"1995/03/01 00:00:00 -0500"},"geo_score":0.902,"strstate":"OK","conversion":1,"type_store":"Supercenter","opendate":{"end_time":"1978/10/11 00:00:00 -0400","original":"10/10/1978 ","granularity":"day","time":"1978/10/10 00:00:00 -0400"},"id":"a61znsw1kxf3","geo_precision":"range","storenum":227,"strcity":"El Reno"},"type":"Feature","geometry":{"type":"Point","coordinates":[-97.972644,35.510946]}},{"properties":{"st":"48","streetaddr":"1616 WEST HENDERSON","zipcode":"76031","county":"251","date_super":{"end_time":"1995/03/02 00:00:00 -0500","original":"3/1/1995 ","granularity":"day","time":"1995/03/01 00:00:00 -0500"},"geo_score":0.829,"strstate":"TX","conversion":1,"type_store":"Supercenter","opendate":{"end_time":"1978/09/20 00:00:00 -0400","original":"9/19/1978 ","granularity":"day","time":"1978/09/19 00:00:00 -0400"},"id":"a61znt7h8ket","geo_precision":"range","storenum":228,"strcity":"Cleburne"},"type":"Feature","geometry":{"type":"Point","coordinates":[-97.360422,32.360272]}},{"properties":{"st":"05","streetaddr":"512 INDUSTRIAL DRIVE","zipcode":"72472","county":"111","date_super":{"end_time":"2004/09/16 00:00:00 -0400","original":"9/15/2004 ","granularity":"day","time":"2004/09/15 00:00:00 -0400"},"geo_score":0.73,"strstate":"AR","conversion":1,"type_store":"Supercenter","opendate":{"end_time":"1978/11/01 00:00:00 -0500","original":"10/31/1978 ","granularity":"day","time":"1978/10/31 00:00:00 -0500"},"id":"a61znt8lk2w0","geo_precision":"street","storenum":229,"strcity":"Trumann"},"type":"Feature","geometry":{"type":"Point","coordinates":[-90.536864,35.690659]}},{"properties":{"st":"05","streetaddr":"1501 EAST WALNUT STREET","zipcode":"72855","county":"083","date_super":null,"geo_score":0.927,"strstate":"AR","conversion":null,"type_store":"Wal-Mart","opendate":{"end_time":"1978/12/06 00:00:00 -0500","original":"12/5/1978 ","granularity":"day","time":"1978/12/05 00:00:00 -0500"},"id":"a61znt9p0n6v","geo_precision":"range","storenum":230,"strcity":"Paris"},"type":"Feature","geometry":{"type":"Point","coordinates":[-93.71448,35.291909]}},{"properties":{"st":"40","streetaddr":"1419 N. COUNTRY CLUB RD.","zipcode":"74820","county":"123","date_super":{"end_time":"1995/03/02 00:00:00 -0500","original":"3/1/1995 ","granularity":"day","time":"1995/03/01 00:00:00 -0500"},"geo_score":0.495,"strstate":"OK","conversion":1,"type_store":"Supercenter","opendate":{"end_time":"1978/09/20 00:00:00 -0400","original":"9/19/1978 ","granularity":"day","time":"1978/09/19 00:00:00 -0400"},"id":"a61znt3a3b6c","geo_precision":"street","storenum":231,"strcity":"Ada"},"type":"Feature","geometry":{"type":"Point","coordinates":[-96.645828,34.781583]}},{"properties":{"st":"40","streetaddr":"1901 SOUTH MISSISSIPPI","zipcode":"74525","county":"005","date_super":null,"geo_score":0.844,"strstate":"OK","conversion":null,"type_store":"Wal-Mart","opendate":{"end_time":"1978/09/20 00:00:00 -0400","original":"9/19/1978 ","granularity":"day","time":"1978/09/19 00:00:00 -0400"},"id":"a61znt93u4q0","geo_precision":"range","storenum":232,"strcity":"Atoka"},"type":"Feature","geometry":{"type":"Point","coordinates":[-96.137671,34.370641]}},{"properties":{"st":"17","streetaddr":"300 LEIGH AVE","zipcode":"62906","county":"181","date_super":{"end_time":"1998/03/02 00:00:00 -0500","original":"3/1/1998 ","granularity":"day","time":"1998/03/01 00:00:00 -0500"},"geo_score":0.734,"strstate":"IL","conversion":1,"type_store":"Supercenter","opendate":{"end_time":"1978/11/22 00:00:00 -0500","original":"11/21/1978 ","granularity":"day","time":"1978/11/21 00:00:00 -0500"},"id":"a61znsvymn04","geo_precision":"street","storenum":233,"strcity":"Anna"},"type":"Feature","geometry":{"type":"Point","coordinates":[-89.222618,37.463057]}},{"properties":{"st":"29","streetaddr":"8301 NO. CHURCH ROAD","zipcode":"64158","county":"047","date_super":{"end_time":"2004/03/02 00:00:00 -0500","original":"3/1/2004 ","granularity":"day","time":"2004/03/01 00:00:00 -0500"},"geo_score":0.505,"strstate":"MO","conversion":1,"type_store":"Supercenter","opendate":{"end_time":"1978/12/06 00:00:00 -0500","original":"12/5/1978 ","granularity":"day","time":"1978/12/05 00:00:00 -0500"},"id":"a61znt97ynvh","geo_precision":"street","storenum":234,"strcity":"Liberty"},"type":"Feature","geometry":{"type":"Point","coordinates":[-94.471038,39.22342]}},{"properties":{"st":"05","streetaddr":"1900 WEST MAIN","zipcode":"72422","county":"021","date_super":null,"geo_score":0.837,"strstate":"AR","conversion":null,"type_store":"Wal-Mart","opendate":{"end_time":"1978/11/29 00:00:00 -0500","original":"11/28/1978 ","granularity":"day","time":"1978/11/28 00:00:00 -0500"},"id":"a61znt2mhr2d","geo_precision":"range","storenum":235,"strcity":"Corning"},"type":"Feature","geometry":{"type":"Point","coordinates":[-90.595304,36.411387]}},{"properties":{"st":"48","streetaddr":"1225 E LOOP 304","zipcode":"75835","county":"225","date_super":{"end_time":"1998/03/02 00:00:00 -0500","original":"3/1/1998 ","granularity":"day","time":"1998/03/01 00:00:00 -0500"},"geo_score":0.78,"strstate":"TX","conversion":1,"type_store":"Supercenter","opendate":{"end_time":"1979/02/02 00:00:00 -0500","original":"2/1/1979 ","granularity":"day","time":"1979/02/01 00:00:00 -0500"},"id":"a61znt1qedop","geo_precision":"range","storenum":236,"strcity":"Crockett"},"type":"Feature","geometry":{"type":"Point","coordinates":[-95.436583,31.316108]}},{"properties":{"st":"17","streetaddr":"16 ARROWHEAD POINT SHPCNTR","zipcode":"62946","county":"165","date_super":null,"geo_score":0.498,"strstate":"IL","conversion":null,"type_store":"Wal-Mart","opendate":{"end_time":"1978/11/15 00:00:00 -0500","original":"11/14/1978 ","granularity":"day","time":"1978/11/14 00:00:00 -0500"},"id":"a61znt0b9g8u","geo_precision":"street","storenum":237,"strcity":"Harrisburg"},"type":"Feature","geometry":{"type":"Point","coordinates":[-89.167463,37.354718]}},{"properties":{"st":"47","streetaddr":"1655 WEST COLLEGE STREET","zipcode":"38478","county":"055","date_super":{"end_time":"1999/03/02 00:00:00 -0500","original":"3/1/1999 ","granularity":"day","time":"1999/03/01 00:00:00 -0500"},"geo_score":0.93,"strstate":"TN","conversion":1,"type_store":"Supercenter","opendate":{"end_time":"1979/02/14 00:00:00 -0500","original":"2/13/1979 ","granularity":"day","time":"1979/02/13 00:00:00 -0500"},"id":"a61znt1r39yw","geo_precision":"range","storenum":238,"strcity":"Pulaski"},"type":"Feature","geometry":{"type":"Point","coordinates":[-87.060804,35.204108]}},{"properties":{"st":"28","streetaddr":"220 VETERAN MEM DR","zipcode":"39090","county":"007","date_super":{"end_time":"1998/03/02 00:00:00 -0500","original":"3/1/1998 ","granularity":"day","time":"1998/03/01 00:00:00 -0500"},"geo_score":0.585,"strstate":"MS","conversion":1,"type_store":"Supercenter","opendate":{"end_time":"1979/08/01 00:00:00 -0400","original":"7/31/1979 ","granularity":"day","time":"1979/07/31 00:00:00 -0400"},"id":"a61znsu1gu35","geo_precision":"zip","storenum":239,"strcity":"Kosciusko"},"type":"Feature","geometry":{"type":"Point","coordinates":[-89.380071,32.97513]}},{"properties":{"st":"48","streetaddr":"2701 HWY 50","zipcode":"75428","county":"231","date_super":{"end_time":"2000/03/02 00:00:00 -0500","original":"3/1/2000 ","granularity":"day","time":"2000/03/01 00:00:00 -0500"},"geo_score":0.585,"strstate":"TX","conversion":1,"type_store":"Supercenter","opendate":{"end_time":"1979/06/20 00:00:00 -0400","original":"6/19/1979 ","granularity":"day","time":"1979/06/19 00:00:00 -0400"},"id":"a61znswhpd0a","geo_precision":"street","storenum":240,"strcity":"Commerce"},"type":"Feature","geometry":{"type":"Point","coordinates":[-95.90001,33.257922]}},{"properties":{"st":"20","streetaddr":"310 HEDGE LANE","zipcode":"66071","county":"121","date_super":{"end_time":"1998/03/02 00:00:00 -0500","original":"3/1/1998 ","granularity":"day","time":"1998/03/01 00:00:00 -0500"},"geo_score":0.732,"strstate":"KS","conversion":1,"type_store":"Supercenter","opendate":{"end_time":"1979/09/19 00:00:00 -0400","original":"9/18/1979 ","granularity":"day","time":"1979/09/18 00:00:00 -0400"},"id":"a61znt9g2oxk","geo_precision":"street","storenum":242,"strcity":"Paola"},"type":"Feature","geometry":{"type":"Point","coordinates":[-94.843616,38.694721]}},{"properties":{"st":"29","streetaddr":"1971 WENTZVILLE PKWY","zipcode":"63385","county":"183","date_super":null,"geo_score":0.947,"strstate":"MO","conversion":null,"type_store":"Wal-Mart","opendate":{"end_time":"1980/10/16 00:00:00 -0400","original":"10/15/1980 ","granularity":"day","time":"1980/10/15 00:00:00 -0400"},"id":"a61znt0vug2t","geo_precision":"range","storenum":243,"strcity":"Wentzville"},"type":"Feature","geometry":{"type":"Point","coordinates":[-90.875475,38.813636]}},{"properties":{"st":"22","streetaddr":"5940 HWY 167 NORTH","zipcode":"71483","county":"127","date_super":{"end_time":"1999/03/02 00:00:00 -0500","original":"3/1/1999 ","granularity":"day","time":"1999/03/01 00:00:00 -0500"},"geo_score":0.793,"strstate":"LA","conversion":1,"type_store":"Supercenter","opendate":{"end_time":"1979/08/01 00:00:00 -0400","original":"7/31/1979 ","granularity":"day","time":"1979/07/31 00:00:00 -0400"},"id":"a61znt0fuovl","geo_precision":"range","storenum":244,"strcity":"Winnfield"},"type":"Feature","geometry":{"type":"Point","coordinates":[-92.653644,31.936231]}},{"properties":{"st":"40","streetaddr":"823 WEST ROGERS BLVD","zipcode":"74070","county":"113","date_super":{"end_time":"2005/08/25 00:00:00 -0400","original":"8/24/2005 ","granularity":"day","time":"2005/08/24 00:00:00 -0400"},"geo_score":1.0,"strstate":"OK","conversion":1,"type_store":"Supercenter","opendate":{"end_time":"1979/09/19 00:00:00 -0400","original":"9/18/1979 ","granularity":"day","time":"1979/09/18 00:00:00 -0400"},"id":"a61znsyjzghu","geo_precision":"range","storenum":246,"strcity":"Skiatook"},"type":"Feature","geometry":{"type":"Point","coordinates":[-96.010725,36.368576]}},{"properties":{"st":"40","streetaddr":"605 EAST MAIN","zipcode":"74437","county":"111","date_super":null,"geo_score":0.837,"strstate":"OK","conversion":null,"type_store":"Wal-Mart","opendate":{"end_time":"1979/03/14 00:00:00 -0500","original":"3/13/1979 ","granularity":"day","time":"1979/03/13 00:00:00 -0500"},"id":"a61znsykveuw","geo_precision":"range","storenum":247,"strcity":"Henryetta"},"type":"Feature","geometry":{"type":"Point","coordinates":[-95.974971,35.439822]}},{"properties":{"st":"48","streetaddr":"1406 EAST MILAM","zipcode":"76667","county":"293","date_super":{"end_time":"2000/03/02 00:00:00 -0500","original":"3/1/2000 ","granularity":"day","time":"2000/03/01 00:00:00 -0500"},"geo_score":0.838,"strstate":"TX","conversion":1,"type_store":"Supercenter","opendate":{"end_time":"1979/08/29 00:00:00 -0400","original":"8/28/1979 ","granularity":"day","time":"1979/08/28 00:00:00 -0400"},"id":"a61znt5g30zf","geo_precision":"range","storenum":248,"strcity":"Mexia"},"type":"Feature","geometry":{"type":"Point","coordinates":[-96.457597,31.685669]}},{"properties":{"st":"48","streetaddr":"831 HWY 59 SOUTH","zipcode":"77327","county":"291","date_super":{"end_time":"2000/03/02 00:00:00 -0500","original":"3/1/2000 ","granularity":"day","time":"2000/03/01 00:00:00 -0500"},"geo_score":0.608,"strstate":"TX","conversion":1,"type_store":"Supercenter","opendate":{"end_time":"1979/03/07 00:00:00 -0500","original":"3/6/1979 ","granularity":"day","time":"1979/03/06 00:00:00 -0500"},"id":"a61znswwd6ag","geo_precision":"street","storenum":249,"strcity":"Cleveland"},"type":"Feature","geometry":{"type":"Point","coordinates":[-95.099342,30.335157]}},{"properties":{"st":"29","streetaddr":"103 WEST POLK ST","zipcode":"65355","county":"015","date_super":{"end_time":"2003/10/30 00:00:00 -0500","original":"10/29/2003 ","granularity":"day","time":"2003/10/29 00:00:00 -0500"},"geo_score":0.685,"strstate":"MO","conversion":1,"type_store":"Supercenter","opendate":{"end_time":"1979/03/28 00:00:00 -0500","original":"3/27/1979 ","granularity":"day","time":"1979/03/27 00:00:00 -0500"},"id":"a61znsu290wn","geo_precision":"street","storenum":250,"strcity":"Warsaw"},"type":"Feature","geometry":{"type":"Point","coordinates":[-93.384076,38.242914]}},{"properties":{"st":"48","streetaddr":"135 NE LOOP 564","zipcode":"75773","county":"499","date_super":{"end_time":"1994/03/02 00:00:00 -0500","original":"3/1/1994 ","granularity":"day","time":"1994/03/01 00:00:00 -0500"},"geo_score":0.965,"strstate":"TX","conversion":1,"type_store":"Supercenter","opendate":{"end_time":"1979/07/11 00:00:00 -0400","original":"7/10/1979 ","granularity":"day","time":"1979/07/10 00:00:00 -0400"},"id":"a61znswbyaux","geo_precision":"range","storenum":251,"strcity":"Mineola"},"type":"Feature","geometry":{"type":"Point","coordinates":[-95.482294,32.688034]}},{"properties":{"st":"17","streetaddr":"215 GRANT WAY","zipcode":"62832","county":"145","date_super":{"end_time":"1999/03/02 00:00:00 -0500","original":"3/1/1999 ","granularity":"day","time":"1999/03/01 00:00:00 -0500"},"geo_score":0.602,"strstate":"IL","conversion":1,"type_store":"Supercenter","opendate":{"end_time":"1980/03/19 00:00:00 -0500","original":"3/18/1980 ","granularity":"day","time":"1980/03/18 00:00:00 -0500"},"id":"a61znsxcvt4o","geo_precision":"street","storenum":252,"strcity":"Du Quoin"},"type":"Feature","geometry":{"type":"Point","coordinates":[-89.238858,38.02354]}},{"properties":{"st":"17","streetaddr":"1316 SOUTH STATE STREET","zipcode":"62052","county":"083","date_super":{"end_time":"1997/03/02 00:00:00 -0500","original":"3/1/1997 ","granularity":"day","time":"1997/03/01 00:00:00 -0500"},"geo_score":0.902,"strstate":"IL","conversion":1,"type_store":"Supercenter","opendate":{"end_time":"1986/12/31 00:00:00 -0500","original":"12/30/1986 ","granularity":"day","time":"1986/12/30 00:00:00 -0500"},"id":"a61znt8dd9tt","geo_precision":"range","storenum":253,"strcity":"Jerseyville"},"type":"Feature","geometry":{"type":"Point","coordinates":[-90.315406,39.104947]}},{"properties":{"st":"17","streetaddr":"1001 NORTH WEST","zipcode":"62450","county":"159","date_super":{"end_time":"1998/03/02 00:00:00 -0500","original":"3/1/1998 ","granularity":"day","time":"1998/03/01 00:00:00 -0500"},"geo_score":0.703,"strstate":"IL","conversion":1,"type_store":"Supercenter","opendate":{"end_time":"1979/11/14 00:00:00 -0500","original":"11/13/1979 ","granularity":"day","time":"1979/11/13 00:00:00 -0500"},"id":"a61znsx9t20e","geo_precision":"range","storenum":254,"strcity":"Olney"},"type":"Feature","geometry":{"type":"Point","coordinates":[-88.094511,38.739478]}},{"properties":{"st":"17","streetaddr":"400 JUNCTION DRIVE","zipcode":"62034","county":"119","date_super":null,"geo_score":1.0,"strstate":"IL","conversion":null,"type_store":"Wal-Mart","opendate":{"end_time":"1979/08/22 00:00:00 -0400","original":"8/21/1979 ","granularity":"day","time":"1979/08/21 00:00:00 -0400"},"id":"a61znt3hhe7y","geo_precision":"range","storenum":256,"strcity":"Glen Carbon"},"type":"Feature","geometry":{"type":"Point","coordinates":[-89.958252,38.777707]}},{"properties":{"st":"21","streetaddr":"901 U.S. HWY 60 EAST","zipcode":"42437","county":"225","date_super":{"end_time":"1999/03/02 00:00:00 -0500","original":"3/1/1999 ","granularity":"day","time":"1999/03/01 00:00:00 -0500"},"geo_score":0.502,"strstate":"KY","conversion":1,"type_store":"Supercenter","opendate":{"end_time":"1979/10/31 00:00:00 -0500","original":"10/30/1979 ","granularity":"day","time":"1979/10/30 00:00:00 -0500"},"id":"a61znsvu1dm4","geo_precision":"street","storenum":257,"strcity":"Morganfield"},"type":"Feature","geometry":{"type":"Point","coordinates":[-87.91782,37.682787]}},{"properties":{"st":"28","streetaddr":"3929 N GLOSTER STREET","zipcode":"38804","county":"081","date_super":{"end_time":"1994/03/02 00:00:00 -0500","original":"3/1/1994 ","granularity":"day","time":"1994/03/01 00:00:00 -0500"},"geo_score":1.0,"strstate":"MS","conversion":1,"type_store":"Supercenter","opendate":{"end_time":"1980/02/13 00:00:00 -0500","original":"2/12/1980 ","granularity":"day","time":"1980/02/12 00:00:00 -0500"},"id":"a61znsusevzr","geo_precision":"range","storenum":258,"strcity":"Tupelo"},"type":"Feature","geometry":{"type":"Point","coordinates":[-88.706773,34.314085]}},{"properties":{"st":"48","streetaddr":"782 INTERSTATE 30","zipcode":"75087","county":"397","date_super":{"end_time":"1996/03/02 00:00:00 -0500","original":"3/1/1996 ","granularity":"day","time":"1996/03/01 00:00:00 -0500"},"geo_score":0.585,"strstate":"TX","conversion":1,"type_store":"Supercenter","opendate":{"end_time":"1979/08/29 00:00:00 -0400","original":"8/28/1979 ","granularity":"day","time":"1979/08/28 00:00:00 -0400"},"id":"a61znt45xah6","geo_precision":"range","storenum":259,"strcity":"Rockwall"},"type":"Feature","geometry":{"type":"Point","coordinates":[-96.562685,32.853534]}},{"properties":{"st":"48","streetaddr":"1200 NO. HWY 77","zipcode":"75165","county":"139","date_super":{"end_time":"1996/03/02 00:00:00 -0500","original":"3/1/1996 ","granularity":"day","time":"1996/03/01 00:00:00 -0500"},"geo_score":0.429,"strstate":"TX","conversion":1,"type_store":"Supercenter","opendate":{"end_time":"1979/07/18 00:00:00 -0400","original":"7/17/1979 ","granularity":"day","time":"1979/07/17 00:00:00 -0400"},"id":"a61znswnrjnf","geo_precision":"street","storenum":260,"strcity":"Waxahachie"},"type":"Feature","geometry":{"type":"Point","coordinates":[-96.848818,32.386291]}},{"properties":{"st":"05","streetaddr":"4019 CENTRAL AVENUE","zipcode":"71913","county":"051","date_super":{"end_time":"2001/05/17 00:00:00 -0400","original":"5/16/2001 ","granularity":"day","time":"2001/05/16 00:00:00 -0400"},"geo_score":0.912,"strstate":"AR","conversion":1,"type_store":"Supercenter","opendate":{"end_time":"1981/12/02 00:00:00 -0500","original":"12/1/1981 ","granularity":"day","time":"1981/12/01 00:00:00 -0500"},"id":"a61znt608xdt","geo_precision":"range","storenum":261,"strcity":"Hot Springs"},"type":"Feature","geometry":{"type":"Point","coordinates":[-93.063281,34.455934]}},{"properties":{"st":"17","streetaddr":"919 GIACONE DRIVE","zipcode":"62812","county":"055","date_super":{"end_time":"2004/01/29 00:00:00 -0500","original":"1/28/2004 ","granularity":"day","time":"2004/01/28 00:00:00 -0500"},"geo_score":0.61,"strstate":"IL","conversion":1,"type_store":"Supercenter","opendate":{"end_time":"1979/08/01 00:00:00 -0400","original":"7/31/1979 ","granularity":"day","time":"1979/07/31 00:00:00 -0400"},"id":"a61znt396d8a","geo_precision":"zip","storenum":262,"strcity":"Benton"},"type":"Feature","geometry":{"type":"Point","coordinates":[-88.935069,37.993939]}},{"properties":{"st":"47","streetaddr":"175 BEASLEY DRIVE","zipcode":"37055","county":"043","date_super":{"end_time":"1993/03/02 00:00:00 -0500","original":"3/1/1993 ","granularity":"day","time":"1993/03/01 00:00:00 -0500"},"geo_score":0.916,"strstate":"TN","conversion":1,"type_store":"Supercenter","opendate":{"end_time":"1979/06/27 00:00:00 -0400","original":"6/26/1979 ","granularity":"day","time":"1979/06/26 00:00:00 -0400"},"id":"a61znsz4271z","geo_precision":"range","storenum":264,"strcity":"Dickson"},"type":"Feature","geometry":{"type":"Point","coordinates":[-87.380157,36.062288]}},{"properties":{"st":"48","streetaddr":"1900 WEST MOORE AVE","zipcode":"75160","county":"257","date_super":{"end_time":"1997/03/02 00:00:00 -0500","original":"3/1/1997 ","granularity":"day","time":"1997/03/01 00:00:00 -0500"},"geo_score":0.916,"strstate":"TX","conversion":1,"type_store":"Supercenter","opendate":{"end_time":"1979/09/26 00:00:00 -0400","original":"9/25/1979 ","granularity":"day","time":"1979/09/25 00:00:00 -0400"},"id":"a61znt17gbm9","geo_precision":"range","storenum":265,"strcity":"Terrell"},"type":"Feature","geometry":{"type":"Point","coordinates":[-96.303092,32.737185]}},{"properties":{"st":"48","streetaddr":"1601 WEST STATE HIGHWAY 114","zipcode":"76051","county":"439","date_super":{"end_time":"2003/10/30 00:00:00 -0500","original":"10/29/2003 ","granularity":"day","time":"2003/10/29 00:00:00 -0500"},"geo_score":0.902,"strstate":"TX","conversion":1,"type_store":"Supercenter","opendate":{"end_time":"1980/06/25 00:00:00 -0400","original":"6/24/1980 ","granularity":"day","time":"1980/06/24 00:00:00 -0400"},"id":"a61znszgzfyp","geo_precision":"street","storenum":266,"strcity":"Grapevine"},"type":"Feature","geometry":{"type":"Point","coordinates":[-97.095407,32.931013]}},{"properties":{"st":"29","streetaddr":"1212 SOUTH MADISON","zipcode":"64870","county":"097","date_super":{"end_time":"1999/03/02 00:00:00 -0500","original":"3/1/1999 ","granularity":"day","time":"1999/03/01 00:00:00 -0500"},"geo_score":0.844,"strstate":"MO","conversion":1,"type_store":"Supercenter","opendate":{"end_time":"1980/05/02 00:00:00 -0400","original":"5/1/1980 ","granularity":"day","time":"1980/05/01 00:00:00 -0400"},"id":"a61znsuokpc0","geo_precision":"range","storenum":267,"strcity":"Webb City"},"type":"Feature","geometry":{"type":"Point","coordinates":[-94.475182,37.13358]}},{"properties":{"st":"47","streetaddr":"175 J.I. BELL LANE","zipcode":"38372","county":"071","date_super":{"end_time":"2002/10/17 00:00:00 -0400","original":"10/16/2002 ","granularity":"day","time":"2002/10/16 00:00:00 -0400"},"geo_score":0.442,"strstate":"TN","conversion":1,"type_store":"Supercenter","opendate":{"end_time":"1979/10/24 00:00:00 -0400","original":"10/23/1979 ","granularity":"day","time":"1979/10/23 00:00:00 -0400"},"id":"a61znt1a3nt9","geo_precision":"street","storenum":268,"strcity":"Savannah"},"type":"Feature","geometry":{"type":"Point","coordinates":[-88.235245,35.202992]}},{"properties":{"st":"40","streetaddr":"1002 NW SHERIDAN RD","zipcode":"73505","county":"031","date_super":{"end_time":"1997/03/02 00:00:00 -0500","original":"3/1/1997 ","granularity":"day","time":"1997/03/01 00:00:00 -0500"},"geo_score":1.0,"strstate":"OK","conversion":1,"type_store":"Supercenter","opendate":{"end_time":"1979/10/30 00:00:00 -0500","original":"10/29/1979 ","granularity":"day","time":"1979/10/29 00:00:00 -0500"},"id":"a61znsxb381y","geo_precision":"range","storenum":269,"strcity":"Lawton"},"type":"Feature","geometry":{"type":"Point","coordinates":[-98.422383,34.619294]}},{"properties":{"st":"22","streetaddr":"906 WEST MAIN STREET","zipcode":"71040","county":"027","date_super":null,"geo_score":0.625,"strstate":"LA","conversion":null,"type_store":"Wal-Mart","opendate":{"end_time":"1981/08/05 00:00:00 -0400","original":"8/4/1981 ","granularity":"day","time":"1981/08/04 00:00:00 -0400"},"id":"a61znt7c3cn2","geo_precision":"street","storenum":270,"strcity":"Homer"},"type":"Feature","geometry":{"type":"Point","coordinates":[-93.05554,32.800239]}},{"properties":{"st":"48","streetaddr":"8420 US HWY 287 NO.","zipcode":"76230","county":"337","date_super":{"end_time":"2004/08/26 00:00:00 -0400","original":"8/25/2004 ","granularity":"day","time":"2004/08/25 00:00:00 -0400"},"geo_score":0.66,"strstate":"TX","conversion":1,"type_store":"Supercenter","opendate":{"end_time":"1979/08/08 00:00:00 -0400","original":"8/7/1979 ","granularity":"day","time":"1979/08/07 00:00:00 -0400"},"id":"a61znt2bx8g7","geo_precision":"street","storenum":271,"strcity":"Bowie"},"type":"Feature","geometry":{"type":"Point","coordinates":[-97.78748,33.470038]}},{"properties":{"st":"47","streetaddr":"3600 MALLORY LANE","zipcode":"37067","county":"187","date_super":{"end_time":"2001/03/15 00:00:00 -0500","original":"3/14/2001 ","granularity":"day","time":"2001/03/14 00:00:00 -0500"},"geo_score":0.805,"strstate":"TN","conversion":1,"type_store":"Supercenter","opendate":{"end_time":"1979/08/22 00:00:00 -0400","original":"8/21/1979 ","granularity":"day","time":"1979/08/21 00:00:00 -0400"},"id":"a61znt9w53uh","geo_precision":"street","storenum":272,"strcity":"Franklin"},"type":"Feature","geometry":{"type":"Point","coordinates":[-86.819722,35.947623]}},{"properties":{"st":"28","streetaddr":"100 INTERCHANGE DRIVE","zipcode":"38843","county":"057","date_super":{"end_time":"1999/03/02 00:00:00 -0500","original":"3/1/1999 ","granularity":"day","time":"1999/03/01 00:00:00 -0500"},"geo_score":0.618,"strstate":"MS","conversion":1,"type_store":"Supercenter","opendate":{"end_time":"1979/07/04 00:00:00 -0400","original":"7/3/1979 ","granularity":"day","time":"1979/07/03 00:00:00 -0400"},"id":"a61znsuejgdv","geo_precision":"zip","storenum":273,"strcity":"Fulton"},"type":"Feature","geometry":{"type":"Point","coordinates":[-88.351989,34.186772]}},{"properties":{"st":"28","streetaddr":"1110 BATTLEGROUND DRIVE","zipcode":"38852","county":"141","date_super":null,"geo_score":0.919,"strstate":"MS","conversion":null,"type_store":"Wal-Mart","opendate":{"end_time":"1979/08/22 00:00:00 -0400","original":"8/21/1979 ","granularity":"day","time":"1979/08/21 00:00:00 -0400"},"id":"a61znta3rt78","geo_precision":"range","storenum":274,"strcity":"Iuka"},"type":"Feature","geometry":{"type":"Point","coordinates":[-88.20244,34.804522]}},{"properties":{"st":"48","streetaddr":"1620 WEST CHURCH","zipcode":"77351","county":"373","date_super":{"end_time":"1995/03/02 00:00:00 -0500","original":"3/1/1995 ","granularity":"day","time":"1995/03/01 00:00:00 -0500"},"geo_score":0.837,"strstate":"TX","conversion":1,"type_store":"Supercenter","opendate":{"end_time":"1979/10/24 00:00:00 -0400","original":"10/23/1979 ","granularity":"day","time":"1979/10/23 00:00:00 -0400"},"id":"a61znswfm7bi","geo_precision":"range","storenum":275,"strcity":"Livingston"},"type":"Feature","geometry":{"type":"Point","coordinates":[-94.951247,30.711104]}},{"properties":{"st":"40","streetaddr":"OKLAHOMA HWY 9 EAST","zipcode":"74462","county":"061","date_super":null,"geo_score":0.614,"strstate":"OK","conversion":null,"type_store":"Wal-Mart","opendate":{"end_time":"1981/02/19 00:00:00 -0500","original":"2/18/1981 ","granularity":"day","time":"1981/02/18 00:00:00 -0500"},"id":"a61znswcd7dh","geo_precision":"street","storenum":276,"strcity":"Stigler"},"type":"Feature","geometry":{"type":"Point","coordinates":[-95.124472,35.253884]}},{"properties":{"st":"40","streetaddr":"501 SW 19TH STREET","zipcode":"73160","county":"027","date_super":{"end_time":"1995/03/02 00:00:00 -0500","original":"3/1/1995 ","granularity":"day","time":"1995/03/01 00:00:00 -0500"},"geo_score":0.805,"strstate":"OK","conversion":1,"type_store":"Supercenter","opendate":{"end_time":"1980/03/05 00:00:00 -0500","original":"3/4/1980 ","granularity":"day","time":"1980/03/04 00:00:00 -0500"},"id":"a61znt4to04o","geo_precision":"range","storenum":277,"strcity":"Moore"},"type":"Feature","geometry":{"type":"Point","coordinates":[-97.493206,35.31996]}},{"properties":{"st":"22","streetaddr":"1645 EAST INDUSTRIAL","zipcode":"71105","county":"017","date_super":{"end_time":"1998/03/02 00:00:00 -0500","original":"3/1/1998 ","granularity":"day","time":"1998/03/01 00:00:00 -0500"},"geo_score":0.537,"strstate":"LA","conversion":1,"type_store":"Supercenter","opendate":{"end_time":"1981/07/01 00:00:00 -0400","original":"6/30/1981 ","granularity":"day","time":"1981/06/30 00:00:00 -0400"},"id":"a61znt6bt8rl","geo_precision":"street","storenum":278,"strcity":"Shreveport"},"type":"Feature","geometry":{"type":"Point","coordinates":[-93.691677,32.52245]}},{"properties":{"st":"05","streetaddr":"926 E. COLLIN RAYE DR.","zipcode":"71832","county":"133","date_super":{"end_time":"2004/03/18 00:00:00 -0500","original":"3/17/2004 ","granularity":"day","time":"2004/03/17 00:00:00 -0500"},"geo_score":0.489,"strstate":"AR","conversion":1,"type_store":"Supercenter","opendate":{"end_time":"1980/02/13 00:00:00 -0500","original":"2/12/1980 ","granularity":"day","time":"1980/02/12 00:00:00 -0500"},"id":"a61znszzi0bj","geo_precision":"street","storenum":279,"strcity":"De Queen"},"type":"Feature","geometry":{"type":"Point","coordinates":[-94.413202,34.047941]}},{"properties":{"st":"48","streetaddr":"709 WEST HWY 79","zipcode":"76567","county":"331","date_super":{"end_time":"2005/03/24 00:00:00 -0500","original":"3/23/2005 ","granularity":"day","time":"2005/03/23 00:00:00 -0500"},"geo_score":0.841,"strstate":"TX","conversion":1,"type_store":"Supercenter","opendate":{"end_time":"1979/10/31 00:00:00 -0500","original":"10/30/1979 ","granularity":"day","time":"1979/10/30 00:00:00 -0500"},"id":"a61znsuh26qn","geo_precision":"range","storenum":280,"strcity":"Rockdale"},"type":"Feature","geometry":{"type":"Point","coordinates":[-97.008993,30.652157]}},{"properties":{"st":"05","streetaddr":"1500 HWY 25B NORTH","zipcode":"72543","county":"023","date_super":{"end_time":"1998/03/02 00:00:00 -0500","original":"3/1/1998 ","granularity":"day","time":"1998/03/01 00:00:00 -0500"},"geo_score":0.878,"strstate":"AR","conversion":1,"type_store":"Supercenter","opendate":{"end_time":"1979/10/31 00:00:00 -0500","original":"10/30/1979 ","granularity":"day","time":"1979/10/30 00:00:00 -0500"},"id":"a61znsxro7wp","geo_precision":"range","storenum":281,"strcity":"Heber Springs"},"type":"Feature","geometry":{"type":"Point","coordinates":[-92.029373,35.507387]}},{"properties":{"st":"21","streetaddr":"1550 NASHVILLE ROAD","zipcode":"42134","county":"213","date_super":{"end_time":"1999/03/02 00:00:00 -0500","original":"3/1/1999 ","granularity":"day","time":"1999/03/01 00:00:00 -0500"},"geo_score":0.912,"strstate":"KY","conversion":1,"type_store":"Supercenter","opendate":{"end_time":"1980/10/01 00:00:00 -0400","original":"9/30/1980 ","granularity":"day","time":"1980/09/30 00:00:00 -0400"},"id":"a61znsyzrqr3","geo_precision":"range","storenum":282,"strcity":"Franklin"},"type":"Feature","geometry":{"type":"Point","coordinates":[-86.57136,36.696825]}},{"properties":{"st":"48","streetaddr":"795 TX AVE","zipcode":"77611","county":"361","date_super":null,"geo_score":0.554,"strstate":"TX","conversion":null,"type_store":"Wal-Mart","opendate":{"end_time":"1980/02/27 00:00:00 -0500","original":"2/26/1980 ","granularity":"day","time":"1980/02/26 00:00:00 -0500"},"id":"a61znt6y644i","geo_precision":"street","storenum":283,"strcity":"Bridge City"},"type":"Feature","geometry":{"type":"Point","coordinates":[-93.838805,30.022938]}},{"properties":{"st":"48","streetaddr":"930 N WALNUT CREEK DRIVE","zipcode":"76063","county":"439","date_super":{"end_time":"1998/03/02 00:00:00 -0500","original":"3/1/1998 ","granularity":"day","time":"1998/03/01 00:00:00 -0500"},"geo_score":0.938,"strstate":"TX","conversion":1,"type_store":"Supercenter","opendate":{"end_time":"1979/09/26 00:00:00 -0400","original":"9/25/1979 ","granularity":"day","time":"1979/09/25 00:00:00 -0400"},"id":"a61znsw5n9zl","geo_precision":"range","storenum":284,"strcity":"Mansfield"},"type":"Feature","geometry":{"type":"Point","coordinates":[-97.132479,32.579046]}},{"properties":{"st":"48","streetaddr":"141 INTER STATE 45 SOUTH","zipcode":"77320","county":"471","date_super":{"end_time":"1994/03/02 00:00:00 -0500","original":"3/1/1994 ","granularity":"day","time":"1994/03/01 00:00:00 -0500"},"geo_score":0.43,"strstate":"TX","conversion":1,"type_store":"Supercenter","opendate":{"end_time":"1979/09/26 00:00:00 -0400","original":"9/25/1979 ","granularity":"day","time":"1979/09/25 00:00:00 -0400"},"id":"a61znt0rlujk","geo_precision":"street","storenum":285,"strcity":"Huntsville"},"type":"Feature","geometry":{"type":"Point","coordinates":[-94.942365,30.722199]}},{"properties":{"st":"48","streetaddr":"700 EAST ENNIS AVE.","zipcode":"75119","county":"139","date_super":{"end_time":"2002/10/17 00:00:00 -0400","original":"10/16/2002 ","granularity":"day","time":"2002/10/16 00:00:00 -0400"},"geo_score":0.919,"strstate":"TX","conversion":1,"type_store":"Supercenter","opendate":{"end_time":"1979/12/05 00:00:00 -0500","original":"12/4/1979 ","granularity":"day","time":"1979/12/04 00:00:00 -0500"},"id":"a61znsydfzy3","geo_precision":"range","storenum":286,"strcity":"Ennis"},"type":"Feature","geometry":{"type":"Point","coordinates":[-96.620744,32.330973]}},{"properties":{"st":"01","streetaddr":"1801 HWY 78 EAST","zipcode":"35501","county":"127","date_super":{"end_time":"1994/03/02 00:00:00 -0500","original":"3/1/1994 ","granularity":"day","time":"1994/03/01 00:00:00 -0500"},"geo_score":0.611,"strstate":"AL","conversion":1,"type_store":"Supercenter","opendate":{"end_time":"1979/11/28 00:00:00 -0500","original":"11/27/1979 ","granularity":"day","time":"1979/11/27 00:00:00 -0500"},"id":"a61znt5scjep","geo_precision":"street","storenum":287,"strcity":"Jasper"},"type":"Feature","geometry":{"type":"Point","coordinates":[-87.568571,33.904134]}},{"properties":{"st":"48","streetaddr":"115 COBB MILL ROAD","zipcode":"75979","county":"457","date_super":{"end_time":"2005/01/27 00:00:00 -0500","original":"1/26/2005 ","granularity":"day","time":"2005/01/26 00:00:00 -0500"},"geo_score":1.0,"strstate":"TX","conversion":1,"type_store":"Supercenter","opendate":{"end_time":"1979/10/31 00:00:00 -0500","original":"10/30/1979 ","granularity":"day","time":"1979/10/30 00:00:00 -0500"},"id":"a61znt1jm94p","geo_precision":"range","storenum":288,"strcity":"Woodville"},"type":"Feature","geometry":{"type":"Point","coordinates":[-94.426614,30.766353]}},{"properties":{"st":"05","streetaddr":"US 65 SOUTH","zipcode":"71654","county":"041","date_super":null,"geo_score":0.696,"strstate":"AR","conversion":null,"type_store":"Wal-Mart","opendate":{"end_time":"1979/10/31 00:00:00 -0500","original":"10/30/1979 ","granularity":"day","time":"1979/10/30 00:00:00 -0500"},"id":"a61znt4n4mds","geo_precision":"street","storenum":289,"strcity":"McGehee"},"type":"Feature","geometry":{"type":"Point","coordinates":[-91.38329,33.61007]}},{"properties":{"st":"48","streetaddr":"US 90A &amp; ROBERTSON ST","zipcode":"78629","county":"177","date_super":null,"geo_score":0.68,"strstate":"TX","conversion":null,"type_store":"Wal-Mart","opendate":{"end_time":"1980/07/02 00:00:00 -0400","original":"7/1/1980 ","granularity":"day","time":"1980/07/01 00:00:00 -0400"},"id":"a61znt0trf3w","geo_precision":"street","storenum":290,"strcity":"Gonzales"},"type":"Feature","geometry":{"type":"Point","coordinates":[-97.460945,29.515445]}},{"properties":{"st":"48","streetaddr":"1703 SOUTH COLORADO STREET","zipcode":"78644","county":"055","date_super":null,"geo_score":0.902,"strstate":"TX","conversion":null,"type_store":"Wal-Mart","opendate":{"end_time":"1980/08/13 00:00:00 -0400","original":"8/12/1980 ","granularity":"day","time":"1980/08/12 00:00:00 -0400"},"id":"a61znt4wearh","geo_precision":"range","storenum":292,"strcity":"Lockhart"},"type":"Feature","geometry":{"type":"Point","coordinates":[-97.668555,29.863313]}},{"properties":{"st":"48","streetaddr":"1712 EAST WASHINGTON","zipcode":"77868","county":"185","date_super":null,"geo_score":0.547,"strstate":"TX","conversion":null,"type_store":"Wal-Mart","opendate":{"end_time":"1980/05/29 00:00:00 -0400","original":"5/28/1980 ","granularity":"day","time":"1980/05/28 00:00:00 -0400"},"id":"a61znsxq6tz6","geo_precision":"street","storenum":293,"strcity":"Navasota"},"type":"Feature","geometry":{"type":"Point","coordinates":[-96.070721,30.397168]}},{"properties":{"st":"21","streetaddr":"1725 WEST EVERELY BROTHERS BLV","zipcode":"42330","county":"177","date_super":{"end_time":"1997/03/02 00:00:00 -0500","original":"3/1/1997 ","granularity":"day","time":"1997/03/01 00:00:00 -0500"},"geo_score":0.752,"strstate":"KY","conversion":1,"type_store":"Supercenter","opendate":{"end_time":"1980/07/30 00:00:00 -0400","original":"7/29/1980 ","granularity":"day","time":"1980/07/29 00:00:00 -0400"},"id":"a61znsxkajet","geo_precision":"range","storenum":294,"strcity":"Central City"},"type":"Feature","geometry":{"type":"Point","coordinates":[-87.105483,37.288826]}},{"properties":{"st":"29","streetaddr":"131 ERKA TWN CNTR DR","zipcode":"63025","county":"189","date_super":{"end_time":"1995/03/02 00:00:00 -0500","original":"3/1/1995 ","granularity":"day","time":"1995/03/01 00:00:00 -0500"},"geo_score":0.83,"strstate":"MO","conversion":1,"type_store":"Supercenter","opendate":{"end_time":"1980/04/02 00:00:00 -0500","original":"4/1/1980 ","granularity":"day","time":"1980/04/01 00:00:00 -0500"},"id":"a61znt2jb4jr","geo_precision":"range","storenum":295,"strcity":"Eureka"},"type":"Feature","geometry":{"type":"Point","coordinates":[-90.656645,38.506004]}},{"properties":{"st":"05","streetaddr":"1172 NO. HWY 7","zipcode":"72834","county":"149","date_super":{"end_time":"2005/10/27 00:00:00 -0400","original":"10/26/2005 ","granularity":"day","time":"2005/10/26 00:00:00 -0400"},"geo_score":0.51,"strstate":"AR","conversion":1,"type_store":"Supercenter","opendate":{"end_time":"1980/08/29 00:00:00 -0400","original":"8/28/1980 ","granularity":"day","time":"1980/08/28 00:00:00 -0400"},"id":"a61znswdyict","geo_precision":"street","storenum":296,"strcity":"Dardanelle"},"type":"Feature","geometry":{"type":"Point","coordinates":[-93.16404,35.230807]}},{"properties":{"st":"48","streetaddr":"23561 US HWY 59","zipcode":"77365","county":"339","date_super":{"end_time":"2000/03/02 00:00:00 -0500","original":"3/1/2000 ","granularity":"day","time":"2000/03/01 00:00:00 -0500"},"geo_score":0.911,"strstate":"TX","conversion":1,"type_store":"Supercenter","opendate":{"end_time":"1981/09/02 00:00:00 -0400","original":"9/1/1981 ","granularity":"day","time":"1981/09/01 00:00:00 -0400"},"id":"a61znt30ilsf","geo_precision":"range","storenum":297,"strcity":"Porter"},"type":"Feature","geometry":{"type":"Point","coordinates":[-95.235631,30.105493]}},{"properties":{"st":"01","streetaddr":"1972 HWY 431","zipcode":"35957","county":"095","date_super":{"end_time":"2003/03/20 00:00:00 -0500","original":"3/19/2003 ","granularity":"day","time":"2003/03/19 00:00:00 -0500"},"geo_score":0.829,"strstate":"AL","conversion":1,"type_store":"Supercenter","opendate":{"end_time":"1980/08/13 00:00:00 -0400","original":"8/12/1980 ","granularity":"day","time":"1980/08/12 00:00:00 -0400"},"id":"a61znt9pe7rz","geo_precision":"range","storenum":298,"strcity":"Boaz"},"type":"Feature","geometry":{"type":"Point","coordinates":[-86.156364,34.214275]}},{"properties":{"st":"21","streetaddr":"150 WALTON AVENUE","zipcode":"42104","county":"227","date_super":{"end_time":"1995/03/02 00:00:00 -0500","original":"3/1/1995 ","granularity":"day","time":"1995/03/01 00:00:00 -0500"},"geo_score":0.902,"strstate":"KY","conversion":1,"type_store":"Supercenter","opendate":{"end_time":"1980/10/01 00:00:00 -0400","original":"9/30/1980 ","granularity":"day","time":"1980/09/30 00:00:00 -0400"},"id":"a61znt4ngus6","geo_precision":"range","storenum":299,"strcity":"Bowling Green"},"type":"Feature","geometry":{"type":"Point","coordinates":[-86.43503,36.951395]}},{"properties":{"st":"01","streetaddr":"1625 PELHAM SOUTH","zipcode":"36265","county":"015","date_super":{"end_time":"2005/01/27 00:00:00 -0500","original":"1/26/2005 ","granularity":"day","time":"2005/01/26 00:00:00 -0500"},"geo_score":0.837,"strstate":"AL","conversion":1,"type_store":"Supercenter","opendate":{"end_time":"1980/10/15 00:00:00 -0400","original":"10/14/1980 ","granularity":"day","time":"1980/10/14 00:00:00 -0400"},"id":"a61znsu4iwbl","geo_precision":"range","storenum":300,"strcity":"Jacksonville"},"type":"Feature","geometry":{"type":"Point","coordinates":[-85.761648,33.782651]}},{"properties":{"st":"01","streetaddr":"340 EAST MEIGHAN BLVD","zipcode":"35903","county":"055","date_super":{"end_time":"2005/04/14 00:00:00 -0400","original":"4/13/2005 ","granularity":"day","time":"2005/04/13 00:00:00 -0400"},"geo_score":0.912,"strstate":"AL","conversion":1,"type_store":"Supercenter","opendate":{"end_time":"1980/08/13 00:00:00 -0400","original":"8/12/1980 ","granularity":"day","time":"1980/08/12 00:00:00 -0400"},"id":"a61znsu780ci","geo_precision":"range","storenum":301,"strcity":"Gadsden"},"type":"Feature","geometry":{"type":"Point","coordinates":[-85.988924,34.009877]}},{"properties":{"st":"17","streetaddr":"550 E. INDUSTRIAL PARK RD #11","zipcode":"62966","county":"077","date_super":null,"geo_score":0.654,"strstate":"IL","conversion":null,"type_store":"Wal-Mart","opendate":{"end_time":"1980/10/01 00:00:00 -0400","original":"9/30/1980 ","granularity":"day","time":"1980/09/30 00:00:00 -0400"},"id":"a61znt49cnrd","geo_precision":"range","storenum":302,"strcity":"Murphysboro"},"type":"Feature","geometry":{"type":"Point","coordinates":[-89.313314,37.789031]}},{"properties":{"st":"28","streetaddr":"950 MACKIE DRIVE","zipcode":"38635","county":"093","date_super":{"end_time":"2004/08/26 00:00:00 -0400","original":"8/25/2004 ","granularity":"day","time":"2004/08/25 00:00:00 -0400"},"geo_score":0.5,"strstate":"MS","conversion":1,"type_store":"Supercenter","opendate":{"end_time":"1980/09/04 00:00:00 -0400","original":"9/3/1980 ","granularity":"day","time":"1980/09/03 00:00:00 -0400"},"id":"a61znswertey","geo_precision":"street","storenum":303,"strcity":"Holly Springs"},"type":"Feature","geometry":{"type":"Point","coordinates":[-89.958081,34.622123]}},{"properties":{"st":"47","streetaddr":"3360 TOM AUSTIN HWY","zipcode":"37172","county":"147","date_super":{"end_time":"2002/07/18 00:00:00 -0400","original":"7/17/2002 ","granularity":"day","time":"2002/07/17 00:00:00 -0400"},"geo_score":0.938,"strstate":"TN","conversion":1,"type_store":"Supercenter","opendate":{"end_time":"1979/10/24 00:00:00 -0400","original":"10/23/1979 ","granularity":"day","time":"1979/10/23 00:00:00 -0400"},"id":"a61znt6dmw37","geo_precision":"range","storenum":304,"strcity":"Springfield"},"type":"Feature","geometry":{"type":"Point","coordinates":[-86.886783,36.482569]}},{"properties":{"st":"28","streetaddr":"905 HWY 16 WEST","zipcode":"39051","county":"079","date_super":{"end_time":"1999/03/02 00:00:00 -0500","original":"3/1/1999 ","granularity":"day","time":"1999/03/01 00:00:00 -0500"},"geo_score":0.629,"strstate":"MS","conversion":1,"type_store":"Supercenter","opendate":{"end_time":"1979/11/21 00:00:00 -0500","original":"11/20/1979 ","granularity":"day","time":"1979/11/20 00:00:00 -0500"},"id":"a61znsxaktt3","geo_precision":"range","storenum":305,"strcity":"Carthage"},"type":"Feature","geometry":{"type":"Point","coordinates":[-89.546376,32.7286]}},{"properties":{"st":"01","streetaddr":"1450 NO. BRINDLEE MTN. PKWY","zipcode":"35016","county":"095","date_super":{"end_time":"2003/04/17 00:00:00 -0400","original":"4/16/2003 ","granularity":"day","time":"2003/04/16 00:00:00 -0400"},"geo_score":0.579,"strstate":"AL","conversion":1,"type_store":"Supercenter","opendate":{"end_time":"1980/02/27 00:00:00 -0500","original":"2/26/1980 ","granularity":"day","time":"1980/02/26 00:00:00 -0500"},"id":"a61znt7h5kee","geo_precision":"street","storenum":306,"strcity":"Arab"},"type":"Feature","geometry":{"type":"Point","coordinates":[-86.565334,34.3158]}},{"properties":{"st":"22","streetaddr":"1025 GLENWOOD DRIVE","zipcode":"71291","county":"073","date_super":{"end_time":"1995/03/02 00:00:00 -0500","original":"3/1/1995 ","granularity":"day","time":"1995/03/01 00:00:00 -0500"},"geo_score":0.922,"strstate":"LA","conversion":1,"type_store":"Supercenter","opendate":{"end_time":"1982/11/17 00:00:00 -0500","original":"11/16/1982 ","granularity":"day","time":"1982/11/16 00:00:00 -0500"},"id":"a61znsvj1z0w","geo_precision":"range","storenum":307,"strcity":"West Monroe"},"type":"Feature","geometry":{"type":"Point","coordinates":[-92.150163,32.501848]}},{"properties":{"st":"47","streetaddr":"2518 HILLSBORO BLVD","zipcode":"37355","county":"031","date_super":{"end_time":"2001/03/15 00:00:00 -0500","original":"3/14/2001 ","granularity":"day","time":"2001/03/14 00:00:00 -0500"},"geo_score":0.912,"strstate":"TN","conversion":1,"type_store":"Supercenter","opendate":{"end_time":"1981/02/11 00:00:00 -0500","original":"2/10/1981 ","granularity":"day","time":"1981/02/10 00:00:00 -0500"},"id":"a61znsvrzroz","geo_precision":"range","storenum":308,"strcity":"Manchester"},"type":"Feature","geometry":{"type":"Point","coordinates":[-86.045845,35.455293]}},{"properties":{"st":"22","streetaddr":"3005 CHARITY ST","zipcode":"70510","county":"113","date_super":{"end_time":"2001/03/15 00:00:00 -0500","original":"3/14/2001 ","granularity":"day","time":"2001/03/14 00:00:00 -0500"},"geo_score":0.913,"strstate":"LA","conversion":1,"type_store":"Supercenter","opendate":{"end_time":"1980/10/29 00:00:00 -0500","original":"10/28/1980 ","granularity":"day","time":"1980/10/28 00:00:00 -0500"},"id":"a61znt7qabp9","geo_precision":"range","storenum":309,"strcity":"Abbeville"},"type":"Feature","geometry":{"type":"Point","coordinates":[-92.096269,29.97034]}},{"properties":{"st":"22","streetaddr":"729 ODDFELLOWS RD.","zipcode":"70526","county":"001","date_super":{"end_time":"1996/03/02 00:00:00 -0500","original":"3/1/1996 ","granularity":"day","time":"1996/03/01 00:00:00 -0500"},"geo_score":0.916,"strstate":"LA","conversion":1,"type_store":"Supercenter","opendate":{"end_time":"1980/10/01 00:00:00 -0400","original":"9/30/1980 ","granularity":"day","time":"1980/09/30 00:00:00 -0400"},"id":"a61znt8oql8a","geo_precision":"range","storenum":310,"strcity":"Crowley"},"type":"Feature","geometry":{"type":"Point","coordinates":[-92.364425,30.2307]}},{"properties":{"st":"22","streetaddr":"200 NORTHWEST BLVD","zipcode":"70538","county":"101","date_super":null,"geo_score":0.771,"strstate":"LA","conversion":null,"type_store":"Wal-Mart","opendate":{"end_time":"1980/10/14 00:00:00 -0400","original":"10/13/1980 ","granularity":"day","time":"1980/10/13 00:00:00 -0400"},"id":"a61znsv2z08l","geo_precision":"range","storenum":311,"strcity":"Franklin"},"type":"Feature","geometry":{"type":"Point","coordinates":[-91.513567,29.812711]}},{"properties":{"st":"22","streetaddr":"891 E LA SALLE ST","zipcode":"70586","county":"039","date_super":{"end_time":"2005/07/21 00:00:00 -0400","original":"7/20/2005 ","granularity":"day","time":"2005/07/20 00:00:00 -0400"},"geo_score":0.532,"strstate":"LA","conversion":1,"type_store":"Supercenter","opendate":{"end_time":"1980/11/19 00:00:00 -0500","original":"11/18/1980 ","granularity":"day","time":"1980/11/18 00:00:00 -0500"},"id":"a61znsw5cv4d","geo_precision":"street","storenum":312,"strcity":"Ville Platte"},"type":"Feature","geometry":{"type":"Point","coordinates":[-92.277124,30.69783]}},{"properties":{"st":"29","streetaddr":"4550 GRAVOIS ROAD","zipcode":"63051","county":"099","date_super":null,"geo_score":0.919,"strstate":"MO","conversion":null,"type_store":"Wal-Mart","opendate":{"end_time":"1981/04/08 00:00:00 -0500","original":"4/7/1981 ","granularity":"day","time":"1981/04/07 00:00:00 -0500"},"id":"a61znt9p71ud","geo_precision":"range","storenum":313,"strcity":"House Springs"},"type":"Feature","geometry":{"type":"Point","coordinates":[-90.570608,38.410447]}},{"properties":{"st":"47","streetaddr":"1224 HUNTSVILLE WAY","zipcode":"37334","county":"103","date_super":{"end_time":"1996/03/02 00:00:00 -0500","original":"3/1/1996 ","granularity":"day","time":"1996/03/01 00:00:00 -0500"},"geo_score":0.866,"strstate":"TN","conversion":1,"type_store":"Supercenter","opendate":{"end_time":"1979/11/21 00:00:00 -0500","original":"11/20/1979 ","granularity":"day","time":"1979/11/20 00:00:00 -0500"},"id":"a61znszdnt1w","geo_precision":"range","storenum":314,"strcity":"Fayetteville"},"type":"Feature","geometry":{"type":"Point","coordinates":[-86.567999,35.140415]}},{"properties":{"st":"01","streetaddr":"2453 2ND AVENUE EAST","zipcode":"35121","county":"009","date_super":{"end_time":"1996/03/02 00:00:00 -0500","original":"3/1/1996 ","granularity":"day","time":"1996/03/01 00:00:00 -0500"},"geo_score":0.831,"strstate":"AL","conversion":1,"type_store":"Supercenter","opendate":{"end_time":"1980/10/15 00:00:00 -0400","original":"10/14/1980 ","granularity":"day","time":"1980/10/14 00:00:00 -0400"},"id":"a61znt8e1jcs","geo_precision":"range","storenum":315,"strcity":"Oneonta"},"type":"Feature","geometry":{"type":"Point","coordinates":[-86.45029,33.971239]}},{"properties":{"st":"01","streetaddr":"973 GILBERT FERRY ROAD SE","zipcode":"35954","county":"055","date_super":{"end_time":"2004/08/26 00:00:00 -0400","original":"8/25/2004 ","granularity":"day","time":"2004/08/25 00:00:00 -0400"},"geo_score":0.913,"strstate":"AL","conversion":1,"type_store":"Supercenter","opendate":{"end_time":"1980/11/19 00:00:00 -0500","original":"11/18/1980 ","granularity":"day","time":"1980/11/18 00:00:00 -0500"},"id":"a61znswdh487","geo_precision":"range","storenum":316,"strcity":"Attalla"},"type":"Feature","geometry":{"type":"Point","coordinates":[-86.091264,33.997147]}},{"properties":{"st":"17","streetaddr":"201 NO. MATTES AVENUE","zipcode":"62471","county":"051","date_super":{"end_time":"2004/05/20 00:00:00 -0400","original":"5/19/2004 ","granularity":"day","time":"2004/05/19 00:00:00 -0400"},"geo_score":0.333,"strstate":"IL","conversion":1,"type_store":"Supercenter","opendate":{"end_time":"1981/09/16 00:00:00 -0400","original":"9/15/1981 ","granularity":"day","time":"1981/09/15 00:00:00 -0400"},"id":"a61znt0lowna","geo_precision":"street","storenum":317,"strcity":"Vandalia"},"type":"Feature","geometry":{"type":"Point","coordinates":[-88.740381,39.06167]}},{"properties":{"st":"05","streetaddr":"109 W.P. MALONE DR","zipcode":"71923","county":"019","date_super":{"end_time":"2000/03/02 00:00:00 -0500","original":"3/1/2000 ","granularity":"day","time":"2000/03/01 00:00:00 -0500"},"geo_score":0.371,"strstate":"AR","conversion":1,"type_store":"Supercenter","opendate":{"end_time":"1980/04/16 00:00:00 -0500","original":"4/15/1980 ","granularity":"day","time":"1980/04/15 00:00:00 -0500"},"id":"a61znt35bs3o","geo_precision":"street","storenum":318,"strcity":"Arkadelphia"},"type":"Feature","geometry":{"type":"Point","coordinates":[-94.446312,34.64201]}},{"properties":{"st":"29","streetaddr":"2015 WEST FOXWOOD DR","zipcode":"64083","county":"037","date_super":{"end_time":"2000/03/02 00:00:00 -0500","original":"3/1/2000 ","granularity":"day","time":"2000/03/01 00:00:00 -0500"},"geo_score":1.0,"strstate":"MO","conversion":1,"type_store":"Supercenter","opendate":{"end_time":"1980/06/25 00:00:00 -0400","original":"6/24/1980 ","granularity":"day","time":"1980/06/24 00:00:00 -0400"},"id":"a61znsx1octw","geo_precision":"range","storenum":319,"strcity":"Raymore"},"type":"Feature","geometry":{"type":"Point","coordinates":[-94.492649,38.81278]}},{"properties":{"st":"48","streetaddr":"TEXAS HWY 6 &amp; 7 EAST BYPASS","zipcode":"76661","county":"145","date_super":null,"geo_score":0.473,"strstate":"TX","conversion":null,"type_store":"Wal-Mart","opendate":{"end_time":"1980/10/15 00:00:00 -0400","original":"10/14/1980 ","granularity":"day","time":"1980/10/14 00:00:00 -0400"},"id":"a61znsynmnka","geo_precision":"street","storenum":320,"strcity":"Marlin"},"type":"Feature","geometry":{"type":"Point","coordinates":[-96.899313,31.306295]}},{"properties":{"st":"48","streetaddr":"203 US LOOP 290 WEST","zipcode":"77833","county":"477","date_super":{"end_time":"1995/03/02 00:00:00 -0500","original":"3/1/1995 ","granularity":"day","time":"1995/03/01 00:00:00 -0500"},"geo_score":0.479,"strstate":"TX","conversion":1,"type_store":"Supercenter","opendate":{"end_time":"1980/11/12 00:00:00 -0500","original":"11/11/1980 ","granularity":"day","time":"1980/11/11 00:00:00 -0500"},"id":"a61znswpqdgu","geo_precision":"street","storenum":321,"strcity":"Brenham"},"type":"Feature","geometry":{"type":"Point","coordinates":[-96.411065,30.150335]}},{"properties":{"st":"48","streetaddr":"2200 BRIARCREST DRVE","zipcode":"77802","county":"041","date_super":{"end_time":"1994/03/02 00:00:00 -0500","original":"3/1/1994 ","granularity":"day","time":"1994/03/01 00:00:00 -0500"},"geo_score":0.958,"strstate":"TX","conversion":1,"type_store":"Supercenter","opendate":{"end_time":"1982/06/30 00:00:00 -0400","original":"6/29/1982 ","granularity":"day","time":"1982/06/29 00:00:00 -0400"},"id":"a61znt2sv6q6","geo_precision":"range","storenum":322,"strcity":"Bryan"},"type":"Feature","geometry":{"type":"Point","coordinates":[-96.332769,30.658718]}},{"properties":{"st":"22","streetaddr":"1043 WASHINGTON","zipcode":"71052","county":"031","date_super":null,"geo_score":0.846,"strstate":"LA","conversion":null,"type_store":"Wal-Mart","opendate":{"end_time":"1980/09/04 00:00:00 -0400","original":"9/3/1980 ","granularity":"day","time":"1980/09/03 00:00:00 -0400"},"id":"a61znsutqrs8","geo_precision":"range","storenum":323,"strcity":"Mansfield"},"type":"Feature","geometry":{"type":"Point","coordinates":[-93.710773,32.031006]}},{"properties":{"st":"40","streetaddr":"HWY 16 &amp; 66 &amp; 48","zipcode":"74010","county":"037","date_super":null,"geo_score":0.565,"strstate":"OK","conversion":null,"type_store":"Wal-Mart","opendate":{"end_time":"1981/11/04 00:00:00 -0500","original":"11/3/1981 ","granularity":"day","time":"1981/11/03 00:00:00 -0500"},"id":"a61znswxw0pc","geo_precision":"street","storenum":324,"strcity":"Bristow"},"type":"Feature","geometry":{"type":"Point","coordinates":[-96.391073,35.828294]}},{"properties":{"st":"29","streetaddr":"908 WALTON WAY","zipcode":"64085","county":"177","date_super":{"end_time":"2001/04/19 00:00:00 -0400","original":"4/18/2001 ","granularity":"day","time":"2001/04/18 00:00:00 -0400"},"geo_score":0.512,"strstate":"MO","conversion":1,"type_store":"Supercenter","opendate":{"end_time":"1980/10/15 00:00:00 -0400","original":"10/14/1980 ","granularity":"day","time":"1980/10/14 00:00:00 -0400"},"id":"a61znt0gfl3t","geo_precision":"street","storenum":325,"strcity":"Richmond"},"type":"Feature","geometry":{"type":"Point","coordinates":[-94.074012,38.99639]}},{"properties":{"st":"29","streetaddr":"HWY 13 &amp; 19TH STREET","zipcode":"64037","county":"107","date_super":null,"geo_score":0.733,"strstate":"MO","conversion":null,"type_store":"Wal-Mart","opendate":{"end_time":"1980/10/22 00:00:00 -0400","original":"10/21/1980 ","granularity":"day","time":"1980/10/21 00:00:00 -0400"},"id":"a61znsyuxaop","geo_precision":"street","storenum":326,"strcity":"Higginsville"},"type":"Feature","geometry":{"type":"Point","coordinates":[-93.718329,39.076045]}},{"properties":{"st":"40","streetaddr":"1107 SOUTH MAIN STREET","zipcode":"74346","county":"041","date_super":null,"geo_score":0.902,"strstate":"OK","conversion":null,"type_store":"Wal-Mart","opendate":{"end_time":"1980/08/06 00:00:00 -0400","original":"8/5/1980 ","granularity":"day","time":"1980/08/05 00:00:00 -0400"},"id":"a61znt9t1nis","geo_precision":"range","storenum":327,"strcity":"Jay"},"type":"Feature","geometry":{"type":"Point","coordinates":[-94.805651,36.418203]}},{"properties":{"st":"17","streetaddr":"961 N MARKET STREET","zipcode":"62298","county":"133","date_super":{"end_time":"1997/03/02 00:00:00 -0500","original":"3/1/1997 ","granularity":"day","time":"1997/03/01 00:00:00 -0500"},"geo_score":0.738,"strstate":"IL","conversion":1,"type_store":"Supercenter","opendate":{"end_time":"1981/04/22 00:00:00 -0500","original":"4/21/1981 ","granularity":"day","time":"1981/04/21 00:00:00 -0500"},"id":"a61znsx3ms1s","geo_precision":"street","storenum":328,"strcity":"Waterloo"},"type":"Feature","geometry":{"type":"Point","coordinates":[-90.153926,38.360853]}},{"properties":{"st":"01","streetaddr":"5560 MCCLELLAN BLVD","zipcode":"36206","county":"015","date_super":{"end_time":"2005/09/08 00:00:00 -0400","original":"9/7/2005 ","granularity":"day","time":"2005/09/07 00:00:00 -0400"},"geo_score":1.0,"strstate":"AL","conversion":1,"type_store":"Supercenter","opendate":{"end_time":"1980/04/16 00:00:00 -0500","original":"4/15/1980 ","granularity":"day","time":"1980/04/15 00:00:00 -0500"},"id":"a61znswed3yn","geo_precision":"range","storenum":329,"strcity":"Anniston"},"type":"Feature","geometry":{"type":"Point","coordinates":[-85.818398,33.7183]}},{"properties":{"st":"48","streetaddr":"9002 NORTH NAVARRO","zipcode":"77904","county":"469","date_super":{"end_time":"1994/03/02 00:00:00 -0500","original":"3/1/1994 ","granularity":"day","time":"1994/03/01 00:00:00 -0500"},"geo_score":0.941,"strstate":"TX","conversion":1,"type_store":"Supercenter","opendate":{"end_time":"1980/11/12 00:00:00 -0500","original":"11/11/1980 ","granularity":"day","time":"1980/11/11 00:00:00 -0500"},"id":"a61znt4r3u7v","geo_precision":"range","storenum":330,"strcity":"Victoria"},"type":"Feature","geometry":{"type":"Point","coordinates":[-96.997161,28.877441]}},{"properties":{"st":"22","streetaddr":"525 NORTH CITY SERVICE HWY","zipcode":"70663","county":"019","date_super":{"end_time":"1995/03/02 00:00:00 -0500","original":"3/1/1995 ","granularity":"day","time":"1995/03/01 00:00:00 -0500"},"geo_score":0.863,"strstate":"LA","conversion":1,"type_store":"Supercenter","opendate":{"end_time":"1981/02/11 00:00:00 -0500","original":"2/10/1981 ","granularity":"day","time":"1981/02/10 00:00:00 -0500"},"id":"a61znt7o6o42","geo_precision":"range","storenum":331,"strcity":"Sulphur"},"type":"Feature","geometry":{"type":"Point","coordinates":[-93.325516,30.232566]}},{"properties":{"st":"01","streetaddr":"6140A UNIV DRIVE","zipcode":"35806","county":"089","date_super":{"end_time":"1995/03/02 00:00:00 -0500","original":"3/1/1995 ","granularity":"day","time":"1995/03/01 00:00:00 -0500"},"geo_score":0.594,"strstate":"AL","conversion":1,"type_store":"Supercenter","opendate":{"end_time":"1981/10/14 00:00:00 -0400","original":"10/13/1981 ","granularity":"day","time":"1981/10/13 00:00:00 -0400"},"id":"a61znt1ptv5p","geo_precision":"zip","storenum":332,"strcity":"Huntsville"},"type":"Feature","geometry":{"type":"Point","coordinates":[-86.706386,34.769813]}},{"properties":{"st":"21","streetaddr":"1701 NORTH MAIN","zipcode":"42320","county":"183","date_super":{"end_time":"2000/03/02 00:00:00 -0500","original":"3/1/2000 ","granularity":"day","time":"2000/03/01 00:00:00 -0500"},"geo_score":0.624,"strstate":"KY","conversion":1,"type_store":"Supercenter","opendate":{"end_time":"1981/02/04 00:00:00 -0500","original":"2/3/1981 ","granularity":"day","time":"1981/02/03 00:00:00 -0500"},"id":"a61znt917thc","geo_precision":"street","storenum":333,"strcity":"Beaver Dam"},"type":"Feature","geometry":{"type":"Point","coordinates":[-86.877488,37.414584]}},{"properties":{"st":"17","streetaddr":"1030 W MAIN","zipcode":"62626","county":"117","date_super":null,"geo_score":0.712,"strstate":"IL","conversion":null,"type_store":"Wal-Mart","opendate":{"end_time":"1980/11/12 00:00:00 -0500","original":"11/11/1980 ","granularity":"day","time":"1980/11/11 00:00:00 -0500"},"id":"a61znstx3l0w","geo_precision":"street","storenum":334,"strcity":"Carlinville"},"type":"Feature","geometry":{"type":"Point","coordinates":[-89.901694,39.279782]}},{"properties":{"st":"47","streetaddr":"2196 EMPORIUM DRIVE","zipcode":"38305","county":"113","date_super":{"end_time":"1995/03/02 00:00:00 -0500","original":"3/1/1995 ","granularity":"day","time":"1995/03/01 00:00:00 -0500"},"geo_score":1.0,"strstate":"TN","conversion":1,"type_store":"Supercenter","opendate":{"end_time":"1980/11/12 00:00:00 -0500","original":"11/11/1980 ","granularity":"day","time":"1980/11/11 00:00:00 -0500"},"id":"a61znsx9jq6x","geo_precision":"range","storenum":335,"strcity":"Jackson"},"type":"Feature","geometry":{"type":"Point","coordinates":[-88.854223,35.667654]}},{"properties":{"st":"05","streetaddr":"1308 SOUTH ROCK STREET","zipcode":"72150","county":"053","date_super":null,"geo_score":0.721,"strstate":"AR","conversion":null,"type_store":"Wal-Mart","opendate":{"end_time":"1980/08/05 00:00:00 -0400","original":"8/4/1980 ","granularity":"day","time":"1980/08/04 00:00:00 -0400"},"id":"a61znt4veavp","geo_precision":"street","storenum":336,"strcity":"Sheridan"},"type":"Feature","geometry":{"type":"Point","coordinates":[-92.398912,34.289155]}},{"properties":{"st":"29","streetaddr":"1025 WALTON DRIVE","zipcode":"63645","county":"123","date_super":{"end_time":"2005/08/25 00:00:00 -0400","original":"8/24/2005 ","granularity":"day","time":"2005/08/24 00:00:00 -0400"},"geo_score":0.611,"strstate":"MO","conversion":1,"type_store":"Supercenter","opendate":{"end_time":"1980/11/19 00:00:00 -0500","original":"11/18/1980 ","granularity":"day","time":"1980/11/18 00:00:00 -0500"},"id":"a61znszsnzxt","geo_precision":"street","storenum":337,"strcity":"Fredericktown"},"type":"Feature","geometry":{"type":"Point","coordinates":[-90.433984,37.78946]}},{"properties":{"st":"29","streetaddr":"29 S.W. 1ST LANE","zipcode":"64759","county":"011","date_super":{"end_time":"2004/07/22 00:00:00 -0400","original":"7/21/2004 ","granularity":"day","time":"2004/07/21 00:00:00 -0400"},"geo_score":0.538,"strstate":"MO","conversion":1,"type_store":"Supercenter","opendate":{"end_time":"1980/09/10 00:00:00 -0400","original":"9/9/1980 ","granularity":"day","time":"1980/09/09 00:00:00 -0400"},"id":"a61znt9jb4vk","geo_precision":"street","storenum":338,"strcity":"Lamar"},"type":"Feature","geometry":{"type":"Point","coordinates":[-94.296861,37.508334]}},{"properties":{"st":"05","streetaddr":"1123 HIGHWAY 79 / 167 BYPASS","zipcode":"71742","county":"039","date_super":null,"geo_score":0.477,"strstate":"AR","conversion":null,"type_store":"Wal-Mart","opendate":{"end_time":"1980/11/19 00:00:00 -0500","original":"11/18/1980 ","granularity":"day","time":"1980/11/18 00:00:00 -0500"},"id":"a61znt1j4jsn","geo_precision":"street","storenum":339,"strcity":"Fordyce"},"type":"Feature","geometry":{"type":"Point","coordinates":[-92.396949,33.833459]}},{"properties":{"st":"40","streetaddr":"1110 WEST GENTRY","zipcode":"74426","county":"091","date_super":null,"geo_score":0.51,"strstate":"OK","conversion":null,"type_store":"Wal-Mart","opendate":{"end_time":"1981/07/01 00:00:00 -0400","original":"6/30/1981 ","granularity":"day","time":"1981/06/30 00:00:00 -0400"},"id":"a61znszgcl8i","geo_precision":"street","storenum":340,"strcity":"Checotah"},"type":"Feature","geometry":{"type":"Point","coordinates":[-95.529621,35.471623]}},{"properties":{"st":"20","streetaddr":"1174 PONY EXPRESS HWY","zipcode":"66508","county":"117","date_super":{"end_time":"2005/04/14 00:00:00 -0400","original":"4/13/2005 ","granularity":"day","time":"2005/04/13 00:00:00 -0400"},"geo_score":0.916,"strstate":"KS","conversion":1,"type_store":"Supercenter","opendate":{"end_time":"1980/11/19 00:00:00 -0500","original":"11/18/1980 ","granularity":"day","time":"1980/11/18 00:00:00 -0500"},"id":"a61znszjxivj","geo_precision":"range","storenum":341,"strcity":"Marysville"},"type":"Feature","geometry":{"type":"Point","coordinates":[-96.605302,39.84182]}},{"properties":{"st":"20","streetaddr":"2207 IOWA","zipcode":"66434","county":"013","date_super":null,"geo_score":0.673,"strstate":"KS","conversion":null,"type_store":"Wal-Mart","opendate":{"end_time":"1980/11/19 00:00:00 -0500","original":"11/18/1980 ","granularity":"day","time":"1980/11/18 00:00:00 -0500"},"id":"a61znt382o83","geo_precision":"street","storenum":342,"strcity":"Hiawatha"},"type":"Feature","geometry":{"type":"Point","coordinates":[-95.508326,39.848765]}},{"properties":{"st":"17","streetaddr":"1530 W. SPRINGFIELD RD","zipcode":"62568","county":"021","date_super":{"end_time":"1999/03/02 00:00:00 -0500","original":"3/1/1999 ","granularity":"day","time":"1999/03/01 00:00:00 -0500"},"geo_score":0.485,"strstate":"IL","conversion":1,"type_store":"Supercenter","opendate":{"end_time":"1981/06/03 00:00:00 -0400","original":"6/2/1981 ","granularity":"day","time":"1981/06/02 00:00:00 -0400"},"id":"a61znt1ue69m","geo_precision":"street","storenum":343,"strcity":"Taylorville"},"type":"Feature","geometry":{"type":"Point","coordinates":[-89.298183,39.558586]}},{"properties":{"st":"48","streetaddr":"3413 WEST LOOP","zipcode":"77437","county":"481","date_super":{"end_time":"2004/03/18 00:00:00 -0500","original":"3/17/2004 ","granularity":"day","time":"2004/03/17 00:00:00 -0500"},"geo_score":0.658,"strstate":"TX","conversion":1,"type_store":"Supercenter","opendate":{"end_time":"1981/10/21 00:00:00 -0400","original":"10/20/1981 ","granularity":"day","time":"1981/10/20 00:00:00 -0400"},"id":"a61znsuvb7cy","geo_precision":"street","storenum":344,"strcity":"El Campo"},"type":"Feature","geometry":{"type":"Point","coordinates":[-96.288709,29.217384]}},{"properties":{"st":"48","streetaddr":"2223 SOUTH LOOP 256","zipcode":"75801","county":"001","date_super":{"end_time":"1994/03/02 00:00:00 -0500","original":"3/1/1994 ","granularity":"day","time":"1994/03/01 00:00:00 -0500"},"geo_score":0.744,"strstate":"TX","conversion":1,"type_store":"Supercenter","opendate":{"end_time":"1982/08/04 00:00:00 -0400","original":"8/3/1982 ","granularity":"day","time":"1982/08/03 00:00:00 -0400"},"id":"a61znt2uj0zu","geo_precision":"street","storenum":345,"strcity":"Palestine"},"type":"Feature","geometry":{"type":"Point","coordinates":[-95.612415,31.73453]}},{"properties":{"st":"20","streetaddr":"1618 NORTH OHIO STREET","zipcode":"67010","county":"015","date_super":null,"geo_score":0.585,"strstate":"KS","conversion":null,"type_store":"Wal-Mart","opendate":{"end_time":"1980/12/03 00:00:00 -0500","original":"12/2/1980 ","granularity":"day","time":"1980/12/02 00:00:00 -0500"},"id":"a61znt8rjcgw","geo_precision":"street","storenum":346,"strcity":"Augusta"},"type":"Feature","geometry":{"type":"Point","coordinates":[-97.109203,37.788982]}},{"properties":{"st":"28","streetaddr":"633 HIGHWAY 82 WEST","zipcode":"38751","county":"133","date_super":{"end_time":"2006/02/01 00:00:00 -0500","original":"1/31/2006 ","granularity":"day","time":"2006/01/31 00:00:00 -0500"},"geo_score":0.851,"strstate":"MS","conversion":1,"type_store":"Supercenter","opendate":{"end_time":"1982/02/03 00:00:00 -0500","original":"2/2/1982 ","granularity":"day","time":"1982/02/02 00:00:00 -0500"},"id":"a61znsu6r2g7","geo_precision":"range","storenum":347,"strcity":"Indianola"},"type":"Feature","geometry":{"type":"Point","coordinates":[-90.659502,33.457907]}},{"properties":{"st":"05","streetaddr":"427 HWY 425 NORTH","zipcode":"71655","county":"043","date_super":{"end_time":"1994/03/02 00:00:00 -0500","original":"3/1/1994 ","granularity":"day","time":"1994/03/01 00:00:00 -0500"},"geo_score":0.748,"strstate":"AR","conversion":1,"type_store":"Supercenter","opendate":{"end_time":"1980/11/19 00:00:00 -0500","original":"11/18/1980 ","granularity":"day","time":"1980/11/18 00:00:00 -0500"},"id":"a61znt6u0lzc","geo_precision":"range","storenum":348,"strcity":"Monticello"},"type":"Feature","geometry":{"type":"Point","coordinates":[-91.802762,33.62415]}},{"properties":{"st":"05","streetaddr":"HIGHWAY 65 SOUTH","zipcode":"71639","county":"041","date_super":null,"geo_score":0.873,"strstate":"AR","conversion":null,"type_store":"Wal-Mart","opendate":{"end_time":"1980/11/19 00:00:00 -0500","original":"11/18/1980 ","granularity":"day","time":"1980/11/18 00:00:00 -0500"},"id":"a61znsveg6of","geo_precision":"street","storenum":349,"strcity":"Dumas"},"type":"Feature","geometry":{"type":"Point","coordinates":[-91.38306,33.601099]}},{"properties":{"st":"31","streetaddr":"101 EAST DAVID DRIVE","zipcode":"68467","county":"185","date_super":{"end_time":"2005/04/14 00:00:00 -0400","original":"4/13/2005 ","granularity":"day","time":"2005/04/13 00:00:00 -0400"},"geo_score":0.963,"strstate":"NE","conversion":1,"type_store":"Supercenter","opendate":{"end_time":"1984/10/31 00:00:00 -0500","original":"10/30/1984 ","granularity":"day","time":"1984/10/30 00:00:00 -0500"},"id":"a61znt7ssyoy","geo_precision":"range","storenum":350,"strcity":"York"},"type":"Feature","geometry":{"type":"Point","coordinates":[-97.597771,40.826699]}},{"properties":{"st":"17","streetaddr":"HWY 150/2206 STATE ST","zipcode":"62233","county":"157","date_super":null,"geo_score":0.717,"strstate":"IL","conversion":null,"type_store":"Wal-Mart","opendate":{"end_time":"1980/11/19 00:00:00 -0500","original":"11/18/1980 ","granularity":"day","time":"1980/11/18 00:00:00 -0500"},"id":"a61znsw3ycq0","geo_precision":"range","storenum":352,"strcity":"Chester"},"type":"Feature","geometry":{"type":"Point","coordinates":[-89.807025,37.924822]}},{"properties":{"st":"48","streetaddr":"2121 HWY 16 SOUTH","zipcode":"76450","county":"503","date_super":{"end_time":"2005/10/27 00:00:00 -0400","original":"10/26/2005 ","granularity":"day","time":"2005/10/26 00:00:00 -0400"},"geo_score":0.824,"strstate":"TX","conversion":1,"type_store":"Supercenter","opendate":{"end_time":"1981/06/03 00:00:00 -0400","original":"6/2/1981 ","granularity":"day","time":"1981/06/02 00:00:00 -0400"},"id":"a61znszl3shv","geo_precision":"range","storenum":353,"strcity":"Graham"},"type":"Feature","geometry":{"type":"Point","coordinates":[-98.5831,33.082052]}},{"properties":{"st":"29","streetaddr":"1208 WEST HIGHWSY 28","zipcode":"65066","county":"073","date_super":null,"geo_score":0.561,"strstate":"MO","conversion":null,"type_store":"Wal-Mart","opendate":{"end_time":"1981/07/01 00:00:00 -0400","original":"6/30/1981 ","granularity":"day","time":"1981/06/30 00:00:00 -0400"},"id":"a61znt8vgkqk","geo_precision":"street","storenum":354,"strcity":"Owensville"},"type":"Feature","geometry":{"type":"Point","coordinates":[-91.526961,38.332654]}},{"properties":{"st":"01","streetaddr":"2900 PEPPERRELL PKWY","zipcode":"36801","county":"081","date_super":{"end_time":"2002/05/16 00:00:00 -0400","original":"5/15/2002 ","granularity":"day","time":"2002/05/15 00:00:00 -0400"},"geo_score":0.908,"strstate":"AL","conversion":1,"type_store":"Supercenter","opendate":{"end_time":"1980/11/19 00:00:00 -0500","original":"11/18/1980 ","granularity":"day","time":"1980/11/18 00:00:00 -0500"},"id":"a61znt325vn4","geo_precision":"range","storenum":355,"strcity":"Opelika"},"type":"Feature","geometry":{"type":"Point","coordinates":[-85.420469,32.635618]}},{"properties":{"st":"01","streetaddr":"1717 SOUTH COLLEGE STREET","zipcode":"36830","county":"081","date_super":{"end_time":"2000/03/02 00:00:00 -0500","original":"3/1/2000 ","granularity":"day","time":"2000/03/01 00:00:00 -0500"},"geo_score":0.805,"strstate":"AL","conversion":1,"type_store":"Supercenter","opendate":{"end_time":"1981/09/02 00:00:00 -0400","original":"9/1/1981 ","granularity":"day","time":"1981/09/01 00:00:00 -0400"},"id":"a61znszx58an","geo_precision":"street","storenum":356,"strcity":"Auburn"},"type":"Feature","geometry":{"type":"Point","coordinates":[-85.484816,32.588862]}},{"properties":{"st":"29","streetaddr":"PO BOX 12 1003 WEST NEWTON","zipcode":"65084","county":"141","date_super":null,"geo_score":0.576,"strstate":"MO","conversion":null,"type_store":"Wal-Mart","opendate":{"end_time":"1981/07/22 00:00:00 -0400","original":"7/21/1981 ","granularity":"day","time":"1981/07/21 00:00:00 -0400"},"id":"a61znt3cfok6","geo_precision":"street","storenum":357,"strcity":"Versailles"},"type":"Feature","geometry":{"type":"Point","coordinates":[-92.8431,38.43165]}},{"properties":{"st":"05","streetaddr":"200 HIGHWAY 64 WEST","zipcode":"72921","county":"033","date_super":null,"geo_score":0.612,"strstate":"AR","conversion":null,"type_store":"Wal-Mart","opendate":{"end_time":"1981/06/03 00:00:00 -0400","original":"6/2/1981 ","granularity":"day","time":"1981/06/02 00:00:00 -0400"},"id":"a61znt4b72q0","geo_precision":"street","storenum":358,"strcity":"Alma"},"type":"Feature","geometry":{"type":"Point","coordinates":[-94.22097,35.485448]}},{"properties":{"st":"05","streetaddr":"3919 NO. MALL AVE","zipcode":"72703","county":"143","date_super":{"end_time":"1998/03/02 00:00:00 -0500","original":"3/1/1998 ","granularity":"day","time":"1998/03/01 00:00:00 -0500"},"geo_score":0.625,"strstate":"AR","conversion":1,"type_store":"Supercenter","opendate":{"end_time":"1981/11/18 00:00:00 -0500","original":"11/17/1981 ","granularity":"day","time":"1981/11/17 00:00:00 -0500"},"id":"a61znstyvn8i","geo_precision":"street","storenum":359,"strcity":"Fayetteville"},"type":"Feature","geometry":{"type":"Point","coordinates":[-94.149785,36.123675]}},{"properties":{"st":"40","streetaddr":"2004 EAST MAIN","zipcode":"74023","county":"119","date_super":null,"geo_score":0.831,"strstate":"OK","conversion":null,"type_store":"Wal-Mart","opendate":{"end_time":"1981/07/01 00:00:00 -0400","original":"6/30/1981 ","granularity":"day","time":"1981/06/30 00:00:00 -0400"},"id":"a61znt59m3eh","geo_precision":"range","storenum":360,"strcity":"Cushing"},"type":"Feature","geometry":{"type":"Point","coordinates":[-96.738535,35.985615]}},{"properties":{"st":"17","streetaddr":"601 BELT LINE ROAD","zipcode":"62234","county":"119","date_super":null,"geo_score":0.925,"strstate":"IL","conversion":null,"type_store":"Wal-Mart","opendate":{"end_time":"1981/07/09 00:00:00 -0400","original":"7/8/1981 ","granularity":"day","time":"1981/07/08 00:00:00 -0400"},"id":"a61znt0cgdnh","geo_precision":"range","storenum":361,"strcity":"Collinsville"},"type":"Feature","geometry":{"type":"Point","coordinates":[-89.977267,38.690981]}},{"properties":{"st":"01","streetaddr":"2365 HIGHWAY 43 WEST","zipcode":"35594","county":"093","date_super":null,"geo_score":0.777,"strstate":"AL","conversion":null,"type_store":"Wal-Mart","opendate":{"end_time":"1981/08/19 00:00:00 -0400","original":"8/18/1981 ","granularity":"day","time":"1981/08/18 00:00:00 -0400"},"id":"a61znt275g4n","geo_precision":"range","storenum":362,"strcity":"Winfield"},"type":"Feature","geometry":{"type":"Point","coordinates":[-87.823281,33.856473]}},{"properties":{"st":"29","streetaddr":"855 S CHEROKEE DRIVE","zipcode":"65340","county":"195","date_super":{"end_time":"2005/03/24 00:00:00 -0500","original":"3/23/2005 ","granularity":"day","time":"2005/03/23 00:00:00 -0500"},"geo_score":0.925,"strstate":"MO","conversion":1,"type_store":"Supercenter","opendate":{"end_time":"1981/12/02 00:00:00 -0500","original":"12/1/1981 ","granularity":"day","time":"1981/12/01 00:00:00 -0500"},"id":"a61znt6t39zd","geo_precision":"range","storenum":363,"strcity":"Marshall"},"type":"Feature","geometry":{"type":"Point","coordinates":[-93.213377,39.112976]}},{"properties":{"st":"48","streetaddr":"810 HURST STREET","zipcode":"75935","county":"419","date_super":{"end_time":"2005/01/27 00:00:00 -0500","original":"1/26/2005 ","granularity":"day","time":"2005/01/26 00:00:00 -0500"},"geo_score":0.805,"strstate":"TX","conversion":1,"type_store":"Supercenter","opendate":{"end_time":"1981/04/01 00:00:00 -0500","original":"3/31/1981 ","granularity":"day","time":"1981/03/31 00:00:00 -0500"},"id":"a61znt9vy4fb","geo_precision":"street","storenum":364,"strcity":"Center"},"type":"Feature","geometry":{"type":"Point","coordinates":[-94.191628,31.806006]}},{"properties":{"st":"28","streetaddr":"5520 HWY 80 EAST","zipcode":"39208","county":"121","date_super":{"end_time":"1999/03/02 00:00:00 -0500","original":"3/1/1999 ","granularity":"day","time":"1999/03/01 00:00:00 -0500"},"geo_score":0.958,"strstate":"MS","conversion":1,"type_store":"Supercenter","opendate":{"end_time":"1981/04/01 00:00:00 -0500","original":"3/31/1981 ","granularity":"day","time":"1981/03/31 00:00:00 -0500"},"id":"a61znt1nfcaw","geo_precision":"range","storenum":365,"strcity":"Pearl"},"type":"Feature","geometry":{"type":"Point","coordinates":[-90.047346,32.283711]}},{"properties":{"st":"47","streetaddr":"4525 HWY 411","zipcode":"37354","county":"123","date_super":{"end_time":"1999/03/02 00:00:00 -0500","original":"3/1/1999 ","granularity":"day","time":"1999/03/01 00:00:00 -0500"},"geo_score":0.643,"strstate":"TN","conversion":1,"type_store":"Supercenter","opendate":{"end_time":"1983/02/02 00:00:00 -0500","original":"2/1/1983 ","granularity":"day","time":"1983/02/01 00:00:00 -0500"},"id":"a61znta8io8d","geo_precision":"street","storenum":366,"strcity":"Madisonville"},"type":"Feature","geometry":{"type":"Point","coordinates":[-84.379288,35.505072]}},{"properties":{"st":"20","streetaddr":"300 MAIN STREET","zipcode":"67357","county":"099","date_super":null,"geo_score":0.709,"strstate":"KS","conversion":null,"type_store":"Wal-Mart","opendate":{"end_time":"1980/11/12 00:00:00 -0500","original":"11/11/1980 ","granularity":"day","time":"1980/11/11 00:00:00 -0500"},"id":"a61znt9qwqhq","geo_precision":"street","storenum":368,"strcity":"Parsons"},"type":"Feature","geometry":{"type":"Point","coordinates":[-95.237915,37.340299]}},{"properties":{"st":"20","streetaddr":"2202 PIKE RD","zipcode":"67156","county":"035","date_super":null,"geo_score":0.927,"strstate":"KS","conversion":null,"type_store":"Wal-Mart","opendate":{"end_time":"1980/11/19 00:00:00 -0500","original":"11/18/1980 ","granularity":"day","time":"1980/11/18 00:00:00 -0500"},"id":"a61znsyw97uv","geo_precision":"range","storenum":369,"strcity":"Winfield"},"type":"Feature","geometry":{"type":"Point","coordinates":[-96.995748,37.226692]}},{"properties":{"st":"20","streetaddr":"1201 W 8TH","zipcode":"67152","county":"191","date_super":null,"geo_score":0.707,"strstate":"KS","conversion":null,"type_store":"Wal-Mart","opendate":{"end_time":"1980/11/19 00:00:00 -0500","original":"11/18/1980 ","granularity":"day","time":"1980/11/18 00:00:00 -0500"},"id":"a61znt6zgc31","geo_precision":"range","storenum":370,"strcity":"Wellington"},"type":"Feature","geometry":{"type":"Point","coordinates":[-97.411838,37.267309]}},{"properties":{"st":"48","streetaddr":"735 HWY 377 EAST","zipcode":"76048","county":"221","date_super":{"end_time":"1995/03/02 00:00:00 -0500","original":"3/1/1995 ","granularity":"day","time":"1995/03/01 00:00:00 -0500"},"geo_score":0.831,"strstate":"TX","conversion":1,"type_store":"Supercenter","opendate":{"end_time":"1981/09/30 00:00:00 -0400","original":"9/29/1981 ","granularity":"day","time":"1981/09/29 00:00:00 -0400"},"id":"a61znt3un1w5","geo_precision":"range","storenum":371,"strcity":"Granbury"},"type":"Feature","geometry":{"type":"Point","coordinates":[-97.794721,32.433889]}},{"properties":{"st":"20","streetaddr":"1905 NORTH 14 AVE","zipcode":"67801","county":"057","date_super":{"end_time":"1997/03/02 00:00:00 -0500","original":"3/1/1997 ","granularity":"day","time":"1997/03/01 00:00:00 -0500"},"geo_score":0.849,"strstate":"KS","conversion":1,"type_store":"Supercenter","opendate":{"end_time":"1981/03/11 00:00:00 -0500","original":"3/10/1981 ","granularity":"day","time":"1981/03/10 00:00:00 -0500"},"id":"a61znt035iaq","geo_precision":"range","storenum":372,"strcity":"Dodge City"},"type":"Feature","geometry":{"type":"Point","coordinates":[-100.032825,37.767305]}},{"properties":{"st":"05","streetaddr":"EAST LEE STREET","zipcode":"72740","county":"087","date_super":null,"geo_score":0.586,"strstate":"AR","conversion":null,"type_store":"Wal-Mart","opendate":{"end_time":"1981/03/11 00:00:00 -0500","original":"3/10/1981 ","granularity":"day","time":"1981/03/10 00:00:00 -0500"},"id":"a61znsyhxtap","geo_precision":"street","storenum":373,"strcity":"Huntsville"},"type":"Feature","geometry":{"type":"Point","coordinates":[-93.738632,36.08544]}},{"properties":{"st":"40","streetaddr":"13795 SOUTH STATE HIGHWAY 51","zipcode":"74429","county":"145","date_super":null,"geo_score":0.705,"strstate":"OK","conversion":null,"type_store":"Wal-Mart","opendate":{"end_time":"1981/07/22 00:00:00 -0400","original":"7/21/1981 ","granularity":"day","time":"1981/07/21 00:00:00 -0400"},"id":"a61znswincxd","geo_precision":"street","storenum":374,"strcity":"Coweta"},"type":"Feature","geometry":{"type":"Point","coordinates":[-95.632288,35.951831]}},{"properties":{"st":"01","streetaddr":"2900 S. MEM PKWY(DRAKE AVE)","zipcode":"35801","county":"089","date_super":null,"geo_score":0.486,"strstate":"AL","conversion":null,"type_store":"Wal-Mart","opendate":{"end_time":"1981/08/12 00:00:00 -0400","original":"8/11/1981 ","granularity":"day","time":"1981/08/11 00:00:00 -0400"},"id":"a61znt2i4i3a","geo_precision":"street","storenum":375,"strcity":"Huntsville"},"type":"Feature","geometry":{"type":"Point","coordinates":[-86.569876,34.705239]}},{"properties":{"st":"22","streetaddr":"2536 AIRLINE DR","zipcode":"71111","county":"015","date_super":{"end_time":"1996/03/02 00:00:00 -0500","original":"3/1/1996 ","granularity":"day","time":"1996/03/01 00:00:00 -0500"},"geo_score":1.0,"strstate":"LA","conversion":1,"type_store":"Supercenter","opendate":{"end_time":"1981/04/22 00:00:00 -0500","original":"4/21/1981 ","granularity":"day","time":"1981/04/21 00:00:00 -0500"},"id":"a61znsvgxom5","geo_precision":"range","storenum":376,"strcity":"Bossier City"},"type":"Feature","geometry":{"type":"Point","coordinates":[-93.708091,32.539454]}},{"properties":{"st":"01","streetaddr":"US HIGHWAY 11","zipcode":"35470","county":"119","date_super":null,"geo_score":0.857,"strstate":"AL","conversion":null,"type_store":"Wal-Mart","opendate":{"end_time":"1981/12/02 00:00:00 -0500","original":"12/1/1981 ","granularity":"day","time":"1981/12/01 00:00:00 -0500"},"id":"a61znt0ij100","geo_precision":"street","storenum":377,"strcity":"Livingston"},"type":"Feature","geometry":{"type":"Point","coordinates":[-88.182856,32.592301]}},{"properties":{"st":"20","streetaddr":"209 ARIZONA AVENUE","zipcode":"66436","county":"085","date_super":null,"geo_score":0.912,"strstate":"KS","conversion":null,"type_store":"Wal-Mart","opendate":{"end_time":"1981/09/30 00:00:00 -0400","original":"9/29/1981 ","granularity":"day","time":"1981/09/29 00:00:00 -0400"},"id":"a61znsyinmls","geo_precision":"range","storenum":378,"strcity":"Holton"},"type":"Feature","geometry":{"type":"Point","coordinates":[-95.747914,39.45899]}},{"properties":{"st":"29","streetaddr":"2004 WEST MARLER LANE","zipcode":"65721","county":"043","date_super":{"end_time":"2004/04/15 00:00:00 -0400","original":"4/14/2004 ","granularity":"day","time":"2004/04/14 00:00:00 -0400"},"geo_score":0.599,"strstate":"MO","conversion":1,"type_store":"Supercenter","opendate":{"end_time":"1981/10/21 00:00:00 -0400","original":"10/20/1981 ","granularity":"day","time":"1981/10/20 00:00:00 -0400"},"id":"a61znsxlgdpf","geo_precision":"zip","storenum":379,"strcity":"Ozark"},"type":"Feature","geometry":{"type":"Point","coordinates":[-93.230183,36.96811]}},{"properties":{"st":"05","streetaddr":"1359 WEST 2ND STREET","zipcode":"72958","county":"127","date_super":null,"geo_score":0.622,"strstate":"AR","conversion":null,"type_store":"Wal-Mart","opendate":{"end_time":"1982/02/03 00:00:00 -0500","original":"2/2/1982 ","granularity":"day","time":"1982/02/02 00:00:00 -0500"},"id":"a61znsuguowg","geo_precision":"street","storenum":380,"strcity":"Waldron"},"type":"Feature","geometry":{"type":"Point","coordinates":[-94.106811,34.900424]}},{"properties":{"st":"48","streetaddr":"2720 EAST HWY 190","zipcode":"76522","county":"099","date_super":{"end_time":"1995/03/02 00:00:00 -0500","original":"3/1/1995 ","granularity":"day","time":"1995/03/01 00:00:00 -0500"},"geo_score":0.927,"strstate":"TX","conversion":1,"type_store":"Supercenter","opendate":{"end_time":"1981/08/05 00:00:00 -0400","original":"8/4/1981 ","granularity":"day","time":"1981/08/04 00:00:00 -0400"},"id":"a61znsyou0ri","geo_precision":"range","storenum":381,"strcity":"Copperas Cove"},"type":"Feature","geometry":{"type":"Point","coordinates":[-97.871911,31.120622]}},{"properties":{"st":"20","streetaddr":"2101 PRINCETON RD","zipcode":"66067","county":"059","date_super":{"end_time":"1995/03/02 00:00:00 -0500","original":"3/1/1995 ","granularity":"day","time":"1995/03/01 00:00:00 -0500"},"geo_score":0.829,"strstate":"KS","conversion":1,"type_store":"Supercenter","opendate":{"end_time":"1981/03/04 00:00:00 -0500","original":"3/3/1981 ","granularity":"day","time":"1981/03/03 00:00:00 -0500"},"id":"a61znt41dxux","geo_precision":"range","storenum":382,"strcity":"Ottawa"},"type":"Feature","geometry":{"type":"Point","coordinates":[-95.267769,38.583198]}},{"properties":{"st":"48","streetaddr":"1100 NO. HIGHWAY 96","zipcode":"77656","county":"199","date_super":{"end_time":"2004/04/15 00:00:00 -0400","original":"4/14/2004 ","granularity":"day","time":"2004/04/14 00:00:00 -0400"},"geo_score":0.571,"strstate":"TX","conversion":1,"type_store":"Supercenter","opendate":{"end_time":"1981/07/09 00:00:00 -0400","original":"7/8/1981 ","granularity":"day","time":"1981/07/08 00:00:00 -0400"},"id":"a61znt35tkp1","geo_precision":"street","storenum":383,"strcity":"Silsbee"},"type":"Feature","geometry":{"type":"Point","coordinates":[-94.178879,30.348039]}},{"properties":{"st":"48","streetaddr":"100 NO. LHS DRIVE","zipcode":"77657","county":"199","date_super":{"end_time":"2004/04/15 00:00:00 -0400","original":"4/14/2004 ","granularity":"day","time":"2004/04/14 00:00:00 -0400"},"geo_score":0.643,"strstate":"TX","conversion":1,"type_store":"Supercenter","opendate":{"end_time":"1981/12/02 00:00:00 -0500","original":"12/1/1981 ","granularity":"day","time":"1981/12/01 00:00:00 -0500"},"id":"a61znt765t7p","geo_precision":"street","storenum":384,"strcity":"Lumberton"},"type":"Feature","geometry":{"type":"Point","coordinates":[-94.221722,30.264329]}},{"properties":{"st":"48","streetaddr":"1202 E BROADWAY","zipcode":"77954","county":"123","date_super":null,"geo_score":0.861,"strstate":"TX","conversion":null,"type_store":"Wal-Mart","opendate":{"end_time":"1981/07/29 00:00:00 -0400","original":"7/28/1981 ","granularity":"day","time":"1981/07/28 00:00:00 -0400"},"id":"a61znt11k1an","geo_precision":"range","storenum":385,"strcity":"Cuero"},"type":"Feature","geometry":{"type":"Point","coordinates":[-97.270427,29.087744]}},{"properties":{"st":"22","streetaddr":"303 INTERSTATE DR","zipcode":"70546","county":"053","date_super":{"end_time":"1995/03/02 00:00:00 -0500","original":"3/1/1995 ","granularity":"day","time":"1995/03/01 00:00:00 -0500"},"geo_score":0.977,"strstate":"LA","conversion":1,"type_store":"Supercenter","opendate":{"end_time":"1983/07/02 00:00:00 -0400","original":"7/1/1983 ","granularity":"day","time":"1983/07/01 00:00:00 -0400"},"id":"a61znt88sfhp","geo_precision":"range","storenum":386,"strcity":"Jennings"},"type":"Feature","geometry":{"type":"Point","coordinates":[-92.655425,30.244353]}},{"properties":{"st":"40","streetaddr":"1700 EAST FIRST STREET","zipcode":"74834","county":"081","date_super":null,"geo_score":0.72,"strstate":"OK","conversion":null,"type_store":"Wal-Mart","opendate":{"end_time":"1982/09/22 00:00:00 -0400","original":"9/21/1982 ","granularity":"day","time":"1982/09/21 00:00:00 -0400"},"id":"a61znt922ppl","geo_precision":"street","storenum":387,"strcity":"Chandler"},"type":"Feature","geometry":{"type":"Point","coordinates":[-96.861279,35.70978]}},{"properties":{"st":"05","streetaddr":"2600 MIDLAND BLVD","zipcode":"72904","county":"131","date_super":null,"geo_score":0.978,"strstate":"AR","conversion":null,"type_store":"Wal-Mart","opendate":{"end_time":"1982/09/01 00:00:00 -0400","original":"8/31/1982 ","granularity":"day","time":"1982/08/31 00:00:00 -0400"},"id":"a61znt2nuhb0","geo_precision":"range","storenum":388,"strcity":"Ft. Smith"},"type":"Feature","geometry":{"type":"Point","coordinates":[-94.399057,35.405139]}},{"properties":{"st":"40","streetaddr":"3200 SOUTH BROADWAY","zipcode":"73013","county":"109","date_super":null,"geo_score":0.922,"strstate":"OK","conversion":null,"type_store":"Wal-Mart","opendate":{"end_time":"1981/11/18 00:00:00 -0500","original":"11/17/1981 ","granularity":"day","time":"1981/11/17 00:00:00 -0500"},"id":"a61znt9cco3l","geo_precision":"range","storenum":389,"strcity":"Edmond"},"type":"Feature","geometry":{"type":"Point","coordinates":[-97.485904,35.624061]}},{"properties":{"st":"47","streetaddr":"275 WALTON DR","zipcode":"37185","county":"085","date_super":{"end_time":"2003/08/21 00:00:00 -0400","original":"8/20/2003 ","granularity":"day","time":"2003/08/20 00:00:00 -0400"},"geo_score":0.61,"strstate":"TN","conversion":1,"type_store":"Supercenter","opendate":{"end_time":"1981/03/11 00:00:00 -0500","original":"3/10/1981 ","granularity":"day","time":"1981/03/10 00:00:00 -0500"},"id":"a61znt5g8k1t","geo_precision":"street","storenum":390,"strcity":"Waverly"},"type":"Feature","geometry":{"type":"Point","coordinates":[-86.387259,35.833563]}},{"properties":{"st":"28","streetaddr":"2270 WEST MAIN STREET","zipcode":"38801","county":"081","date_super":{"end_time":"1997/03/02 00:00:00 -0500","original":"3/1/1997 ","granularity":"day","time":"1997/03/01 00:00:00 -0500"},"geo_score":0.829,"strstate":"MS","conversion":1,"type_store":"Supercenter","opendate":{"end_time":"1981/06/03 00:00:00 -0400","original":"6/2/1981 ","granularity":"day","time":"1981/06/02 00:00:00 -0400"},"id":"a61znt8yhl7v","geo_precision":"range","storenum":391,"strcity":"Tupelo"},"type":"Feature","geometry":{"type":"Point","coordinates":[-88.740315,34.255924]}},{"properties":{"st":"40","streetaddr":"800 EAST MAIN STREET","zipcode":"73096","county":"039","date_super":null,"geo_score":1.0,"strstate":"OK","conversion":null,"type_store":"Wal-Mart","opendate":{"end_time":"1981/06/03 00:00:00 -0400","original":"6/2/1981 ","granularity":"day","time":"1981/06/02 00:00:00 -0400"},"id":"a61znsunukac","geo_precision":"range","storenum":392,"strcity":"Weatherford"},"type":"Feature","geometry":{"type":"Point","coordinates":[-98.698625,35.526036]}},{"properties":{"st":"47","streetaddr":"2171 SOUTH HIGHLAND AVE","zipcode":"38301","county":"113","date_super":{"end_time":"2004/03/18 00:00:00 -0500","original":"3/17/2004 ","granularity":"day","time":"2004/03/17 00:00:00 -0500"},"geo_score":0.915,"strstate":"TN","conversion":1,"type_store":"Supercenter","opendate":{"end_time":"1981/09/02 00:00:00 -0400","original":"9/1/1981 ","granularity":"day","time":"1981/09/01 00:00:00 -0400"},"id":"a61znt0abdih","geo_precision":"range","storenum":393,"strcity":"Jackson"},"type":"Feature","geometry":{"type":"Point","coordinates":[-88.807537,35.550885]}},{"properties":{"st":"01","streetaddr":"15445 HIGHWAY 24","zipcode":"35650","county":"079","date_super":{"end_time":"2005/01/27 00:00:00 -0500","original":"1/26/2005 ","granularity":"day","time":"2005/01/26 00:00:00 -0500"},"geo_score":0.682,"strstate":"AL","conversion":1,"type_store":"Supercenter","opendate":{"end_time":"1981/12/02 00:00:00 -0500","original":"12/1/1981 ","granularity":"day","time":"1981/12/01 00:00:00 -0500"},"id":"a61znsuu8b1h","geo_precision":"range","storenum":394,"strcity":"Moulton"},"type":"Feature","geometry":{"type":"Point","coordinates":[-87.274311,34.493092]}},{"properties":{"st":"48","streetaddr":"2410 EAST EXPRESSWAY 83","zipcode":"78572","county":"215","date_super":{"end_time":"1994/03/02 00:00:00 -0500","original":"3/1/1994 ","granularity":"day","time":"1994/03/01 00:00:00 -0500"},"geo_score":0.913,"strstate":"TX","conversion":1,"type_store":"Supercenter","opendate":{"end_time":"1981/11/04 00:00:00 -0500","original":"11/3/1981 ","granularity":"day","time":"1981/11/03 00:00:00 -0500"},"id":"a61znt3nlgjw","geo_precision":"range","storenum":395,"strcity":"Mission"},"type":"Feature","geometry":{"type":"Point","coordinates":[-98.295955,26.196499]}},{"properties":{"st":"45","streetaddr":"3812 LIBERTY HWY","zipcode":"29621","county":"007","date_super":{"end_time":"1998/03/02 00:00:00 -0500","original":"3/1/1998 ","granularity":"day","time":"1998/03/01 00:00:00 -0500"},"geo_score":1.0,"strstate":"SC","conversion":1,"type_store":"Supercenter","opendate":{"end_time":"1984/03/07 00:00:00 -0500","original":"3/6/1984 ","granularity":"day","time":"1984/03/06 00:00:00 -0500"},"id":"a61znt6w2s29","geo_precision":"range","storenum":396,"strcity":"Anderson"},"type":"Feature","geometry":{"type":"Point","coordinates":[-82.682347,34.556328]}},{"properties":{"st":"48","streetaddr":"1200 E. JACKSON AVE.","zipcode":"78503","county":"215","date_super":{"end_time":"1998/03/02 00:00:00 -0500","original":"3/1/1998 ","granularity":"day","time":"1998/03/01 00:00:00 -0500"},"geo_score":0.593,"strstate":"TX","conversion":1,"type_store":"Supercenter","opendate":{"end_time":"1981/11/18 00:00:00 -0500","original":"11/17/1981 ","granularity":"day","time":"1981/11/17 00:00:00 -0500"},"id":"a61znt26zow0","geo_precision":"street","storenum":397,"strcity":"McAllen (S)"},"type":"Feature","geometry":{"type":"Point","coordinates":[-98.205526,26.190704]}},{"properties":{"st":"48","streetaddr":"515 E LOOP 281","zipcode":"75605","county":"183","date_super":{"end_time":"1993/03/02 00:00:00 -0500","original":"3/1/1993 ","granularity":"day","time":"1993/03/01 00:00:00 -0500"},"geo_score":1.0,"strstate":"TX","conversion":1,"type_store":"Supercenter","opendate":{"end_time":"1982/05/05 00:00:00 -0400","original":"5/4/1982 ","granularity":"day","time":"1982/05/04 00:00:00 -0400"},"id":"a61znt04gg1k","geo_precision":"range","storenum":398,"strcity":"Longview"},"type":"Feature","geometry":{"type":"Point","coordinates":[-94.730693,32.540684]}},{"properties":{"st":"48","streetaddr":"2440 GILMER ROAD","zipcode":"75604","county":"183","date_super":{"end_time":"2004/08/26 00:00:00 -0400","original":"8/25/2004 ","granularity":"day","time":"2004/08/25 00:00:00 -0400"},"geo_score":0.932,"strstate":"TX","conversion":1,"type_store":"Supercenter","opendate":{"end_time":"1981/12/02 00:00:00 -0500","original":"12/1/1981 ","granularity":"day","time":"1981/12/01 00:00:00 -0500"},"id":"a61znt0pqqig","geo_precision":"range","storenum":399,"strcity":"Longview"},"type":"Feature","geometry":{"type":"Point","coordinates":[-94.788633,32.532145]}},{"properties":{"st":"48","streetaddr":"1407 LOOP 336 WEST","zipcode":"77304","county":"339","date_super":{"end_time":"1996/03/02 00:00:00 -0500","original":"3/1/1996 ","granularity":"day","time":"1996/03/01 00:00:00 -0500"},"geo_score":0.695,"strstate":"TX","conversion":1,"type_store":"Supercenter","opendate":{"end_time":"1983/10/19 00:00:00 -0400","original":"10/18/1983 ","granularity":"day","time":"1983/10/18 00:00:00 -0400"},"id":"a61znt4he7we","geo_precision":"street","storenum":400,"strcity":"Conroe"},"type":"Feature","geometry":{"type":"Point","coordinates":[-95.489077,30.330806]}},{"properties":{"st":"22","streetaddr":"58485 BELLVIEW ROAD","zipcode":"70764","county":"047","date_super":null,"geo_score":0.84,"strstate":"LA","conversion":null,"type_store":"Wal-Mart","opendate":{"end_time":"1981/09/30 00:00:00 -0400","original":"9/29/1981 ","granularity":"day","time":"1981/09/29 00:00:00 -0400"},"id":"a61znt4q9uh7","geo_precision":"range","storenum":401,"strcity":"Plaquemine"},"type":"Feature","geometry":{"type":"Point","coordinates":[-91.236667,30.27436]}},{"properties":{"st":"22","streetaddr":"1400 REES STREET","zipcode":"70517","county":"099","date_super":null,"geo_score":0.919,"strstate":"LA","conversion":null,"type_store":"Wal-Mart","opendate":{"end_time":"1981/12/02 00:00:00 -0500","original":"12/1/1981 ","granularity":"day","time":"1981/12/01 00:00:00 -0500"},"id":"a61znt3odg5j","geo_precision":"range","storenum":402,"strcity":"Breaux Bridge"},"type":"Feature","geometry":{"type":"Point","coordinates":[-91.906075,30.284979]}},{"properties":{"st":"01","streetaddr":"13675 HWY 43","zipcode":"35653","county":"059","date_super":{"end_time":"2005/01/27 00:00:00 -0500","original":"1/26/2005 ","granularity":"day","time":"2005/01/26 00:00:00 -0500"},"geo_score":0.631,"strstate":"AL","conversion":1,"type_store":"Supercenter","opendate":{"end_time":"1981/11/04 00:00:00 -0500","original":"11/3/1981 ","granularity":"day","time":"1981/11/03 00:00:00 -0500"},"id":"a61znt84r0zl","geo_precision":"street","storenum":403,"strcity":"Russellville"},"type":"Feature","geometry":{"type":"Point","coordinates":[-87.723038,34.496537]}},{"properties":{"st":"48","streetaddr":"1015 HWY 80","zipcode":"78666","county":"209","date_super":{"end_time":"1996/03/02 00:00:00 -0500","original":"3/1/1996 ","granularity":"day","time":"1996/03/01 00:00:00 -0500"},"geo_score":0.767,"strstate":"TX","conversion":1,"type_store":"Supercenter","opendate":{"end_time":"1982/03/03 00:00:00 -0500","original":"3/2/1982 ","granularity":"day","time":"1982/03/02 00:00:00 -0500"},"id":"a61znsumfe8b","geo_precision":"range","storenum":404,"strcity":"San Marcos"},"type":"Feature","geometry":{"type":"Point","coordinates":[-97.91561,29.881646]}},{"properties":{"st":"22","streetaddr":"2204 SOUTH FIFTH ST","zipcode":"71446","county":"115","date_super":{"end_time":"1998/03/02 00:00:00 -0500","original":"3/1/1998 ","granularity":"day","time":"1998/03/01 00:00:00 -0500"},"geo_score":0.859,"strstate":"LA","conversion":1,"type_store":"Supercenter","opendate":{"end_time":"1982/08/18 00:00:00 -0400","original":"8/17/1982 ","granularity":"day","time":"1982/08/17 00:00:00 -0400"},"id":"a61znt2gi8od","geo_precision":"range","storenum":405,"strcity":"Leesville"},"type":"Feature","geometry":{"type":"Point","coordinates":[-93.268628,31.121821]}},{"properties":{"st":"47","streetaddr":"570 ENON SPRINGS ROAD","zipcode":"37167","county":"149","date_super":{"end_time":"1995/03/02 00:00:00 -0500","original":"3/1/1995 ","granularity":"day","time":"1995/03/01 00:00:00 -0500"},"geo_score":0.894,"strstate":"TN","conversion":1,"type_store":"Supercenter","opendate":{"end_time":"1981/11/04 00:00:00 -0500","original":"11/3/1981 ","granularity":"day","time":"1981/11/03 00:00:00 -0500"},"id":"a61znsxnc2je","geo_precision":"range","storenum":406,"strcity":"Smyrna"},"type":"Feature","geometry":{"type":"Point","coordinates":[-86.51354,35.975342]}},{"properties":{"st":"48","streetaddr":"1400 LOWE'S BLVD.","zipcode":"76542","county":"027","date_super":{"end_time":"1999/03/02 00:00:00 -0500","original":"3/1/1999 ","granularity":"day","time":"1999/03/01 00:00:00 -0500"},"geo_score":0.902,"strstate":"TX","conversion":1,"type_store":"Supercenter","opendate":{"end_time":"1981/12/02 00:00:00 -0500","original":"12/1/1981 ","granularity":"day","time":"1981/12/01 00:00:00 -0500"},"id":"a61znt4qat58","geo_precision":"range","storenum":407,"strcity":"Killeen"},"type":"Feature","geometry":{"type":"Point","coordinates":[-97.728272,31.09129]}},{"properties":{"st":"48","streetaddr":"8585 MEMORIAL BLVD","zipcode":"77642","county":"245","date_super":{"end_time":"2002/02/21 00:00:00 -0500","original":"2/20/2002 ","granularity":"day","time":"2002/02/20 00:00:00 -0500"},"geo_score":0.61,"strstate":"TX","conversion":1,"type_store":"Supercenter","opendate":{"end_time":"1982/07/14 00:00:00 -0400","original":"7/13/1982 ","granularity":"day","time":"1982/07/13 00:00:00 -0400"},"id":"a61znt8mm34o","geo_precision":"street","storenum":408,"strcity":"Nederland"},"type":"Feature","geometry":{"type":"Point","coordinates":[-93.95115,29.915132]}},{"properties":{"st":"01","streetaddr":"42417 HWY 195","zipcode":"35565","county":"133","date_super":null,"geo_score":0.515,"strstate":"AL","conversion":null,"type_store":"Wal-Mart","opendate":{"end_time":"1981/10/14 00:00:00 -0400","original":"10/13/1981 ","granularity":"day","time":"1981/10/13 00:00:00 -0400"},"id":"a61znsutjafp","geo_precision":"street","storenum":409,"strcity":"Haleyville"},"type":"Feature","geometry":{"type":"Point","coordinates":[-87.584828,34.245079]}},{"properties":{"st":"21","streetaddr":"809 NORTH 12TH STREET","zipcode":"42071","county":"035","date_super":{"end_time":"1996/03/02 00:00:00 -0500","original":"3/1/1996 ","granularity":"day","time":"1996/03/01 00:00:00 -0500"},"geo_score":0.819,"strstate":"KY","conversion":1,"type_store":"Supercenter","opendate":{"end_time":"1981/10/07 00:00:00 -0400","original":"10/6/1981 ","granularity":"day","time":"1981/10/06 00:00:00 -0400"},"id":"a61znsw3s92o","geo_precision":"range","storenum":410,"strcity":"Murray"},"type":"Feature","geometry":{"type":"Point","coordinates":[-88.314628,36.625678]}},{"properties":{"st":"28","streetaddr":"660 EAST MADISON","zipcode":"38851","county":"017","date_super":null,"geo_score":0.872,"strstate":"MS","conversion":null,"type_store":"Wal-Mart","opendate":{"end_time":"1982/08/04 00:00:00 -0400","original":"8/3/1982 ","granularity":"day","time":"1982/08/03 00:00:00 -0400"},"id":"a61znsuwtarc","geo_precision":"range","storenum":411,"strcity":"Houston"},"type":"Feature","geometry":{"type":"Point","coordinates":[-88.989636,33.896097]}},{"properties":{"st":"48","streetaddr":"1405 EAST TYLER","zipcode":"75751","county":"213","date_super":{"end_time":"1995/03/02 00:00:00 -0500","original":"3/1/1995 ","granularity":"day","time":"1995/03/01 00:00:00 -0500"},"geo_score":0.841,"strstate":"TX","conversion":1,"type_store":"Supercenter","opendate":{"end_time":"1983/05/25 00:00:00 -0400","original":"5/24/1983 ","granularity":"day","time":"1983/05/24 00:00:00 -0400"},"id":"a61znt8l6gdn","geo_precision":"range","storenum":412,"strcity":"Athens"},"type":"Feature","geometry":{"type":"Point","coordinates":[-95.830723,32.209545]}},{"properties":{"st":"48","streetaddr":"1401 WEST HWY 100","zipcode":"78578","county":"061","date_super":{"end_time":"2005/05/19 00:00:00 -0400","original":"5/18/2005 ","granularity":"day","time":"2005/05/18 00:00:00 -0400"},"geo_score":0.769,"strstate":"TX","conversion":1,"type_store":"Supercenter","opendate":{"end_time":"1982/05/19 00:00:00 -0400","original":"5/18/1982 ","granularity":"day","time":"1982/05/18 00:00:00 -0400"},"id":"a61znt6nsi3n","geo_precision":"range","storenum":413,"strcity":"Port Isabel"},"type":"Feature","geometry":{"type":"Point","coordinates":[-97.222158,26.071566]}},{"properties":{"st":"48","streetaddr":"106 S RED RIVER EXPRESSWAY","zipcode":"76354","county":"485","date_super":null,"geo_score":0.955,"strstate":"TX","conversion":null,"type_store":"Wal-Mart","opendate":{"end_time":"1982/06/30 00:00:00 -0400","original":"6/29/1982 ","granularity":"day","time":"1982/06/29 00:00:00 -0400"},"id":"a61znsy5m7xb","geo_precision":"range","storenum":414,"strcity":"Burkburnett"},"type":"Feature","geometry":{"type":"Point","coordinates":[-98.557289,34.093185]}},{"properties":{"st":"22","streetaddr":"2310 N MAIN","zipcode":"70582","county":"099","date_super":null,"geo_score":0.664,"strstate":"LA","conversion":null,"type_store":"Wal-Mart","opendate":{"end_time":"1982/03/03 00:00:00 -0500","original":"3/2/1982 ","granularity":"day","time":"1982/03/02 00:00:00 -0500"},"id":"a61znt4hgkvv","geo_precision":"street","storenum":415,"strcity":"St. Martinville"},"type":"Feature","geometry":{"type":"Point","coordinates":[-91.831899,30.214556]}},{"properties":{"st":"48","streetaddr":"1750 S. BROADWAY","zipcode":"75482","county":"223","date_super":{"end_time":"1994/03/02 00:00:00 -0500","original":"3/1/1994 ","granularity":"day","time":"1994/03/01 00:00:00 -0500"},"geo_score":0.478,"strstate":"TX","conversion":1,"type_store":"Supercenter","opendate":{"end_time":"1983/05/04 00:00:00 -0400","original":"5/3/1983 ","granularity":"day","time":"1983/05/03 00:00:00 -0400"},"id":"a61znszkv1b0","geo_precision":"street","storenum":417,"strcity":"Sulpher Springs"},"type":"Feature","geometry":{"type":"Point","coordinates":[-95.596241,33.119489]}},{"properties":{"st":"31","streetaddr":"1501 K STREET","zipcode":"68352","county":"095","date_super":null,"geo_score":0.902,"strstate":"NE","conversion":null,"type_store":"Wal-Mart","opendate":{"end_time":"1982/08/04 00:00:00 -0400","original":"8/3/1982 ","granularity":"day","time":"1982/08/03 00:00:00 -0400"},"id":"a61znt400t67","geo_precision":"range","storenum":418,"strcity":"Fairbury"},"type":"Feature","geometry":{"type":"Point","coordinates":[-97.171163,40.147655]}},{"properties":{"st":"20","streetaddr":"2003 EAST 1ST ST","zipcode":"67124","county":"151","date_super":{"end_time":"2003/05/22 00:00:00 -0400","original":"5/21/2003 ","granularity":"day","time":"2003/05/21 00:00:00 -0400"},"geo_score":0.648,"strstate":"KS","conversion":1,"type_store":"Supercenter","opendate":{"end_time":"1982/08/18 00:00:00 -0400","original":"8/17/1982 ","granularity":"day","time":"1982/08/17 00:00:00 -0400"},"id":"a61znt65a3f0","geo_precision":"street","storenum":419,"strcity":"Pratt"},"type":"Feature","geometry":{"type":"Point","coordinates":[-98.717807,37.645751]}},{"properties":{"st":"48","streetaddr":"2700 CENTRAL FREEWAY","zipcode":"76305","county":"485","date_super":{"end_time":"2000/03/02 00:00:00 -0500","original":"3/1/2000 ","granularity":"day","time":"2000/03/01 00:00:00 -0500"},"geo_score":0.72,"strstate":"TX","conversion":1,"type_store":"Supercenter","opendate":{"end_time":"1982/06/01 00:00:00 -0400","original":"5/31/1982 ","granularity":"day","time":"1982/05/31 00:00:00 -0400"},"id":"a61znswxwgkm","geo_precision":"street","storenum":420,"strcity":"Wichita Falls"},"type":"Feature","geometry":{"type":"Point","coordinates":[-98.520468,33.939447]}},{"properties":{"st":"48","streetaddr":"800 S US HWY 81/287","zipcode":"76234","county":"497","date_super":{"end_time":"1995/03/02 00:00:00 -0500","original":"3/1/1995 ","granularity":"day","time":"1995/03/01 00:00:00 -0500"},"geo_score":0.876,"strstate":"TX","conversion":1,"type_store":"Supercenter","opendate":{"end_time":"1982/06/30 00:00:00 -0400","original":"6/29/1982 ","granularity":"day","time":"1982/06/29 00:00:00 -0400"},"id":"a61znt2hm3d5","geo_precision":"range","storenum":421,"strcity":"Decatur"},"type":"Feature","geometry":{"type":"Point","coordinates":[-97.597075,33.236029]}},{"properties":{"st":"17","streetaddr":"1304 EAST MAIN STREET","zipcode":"62454","county":"033","date_super":null,"geo_score":0.915,"strstate":"IL","conversion":null,"type_store":"Wal-Mart","opendate":{"end_time":"1982/08/04 00:00:00 -0400","original":"8/3/1982 ","granularity":"day","time":"1982/08/03 00:00:00 -0400"},"id":"a61znt61zwhx","geo_precision":"range","storenum":422,"strcity":"Robinson"},"type":"Feature","geometry":{"type":"Point","coordinates":[-87.725656,39.005983]}},{"properties":{"st":"01","streetaddr":"630 COLONIAL PROMENADE PKWY","zipcode":"35007","county":"117","date_super":{"end_time":"2005/08/25 00:00:00 -0400","original":"8/24/2005 ","granularity":"day","time":"2005/08/24 00:00:00 -0400"},"geo_score":0.566,"strstate":"AL","conversion":1,"type_store":"Supercenter","opendate":{"end_time":"1981/12/02 00:00:00 -0500","original":"12/1/1981 ","granularity":"day","time":"1981/12/01 00:00:00 -0500"},"id":"a61znt1gzjtv","geo_precision":"street","storenum":423,"strcity":"Pelham"},"type":"Feature","geometry":{"type":"Point","coordinates":[-86.833945,33.255131]}},{"properties":{"st":"01","streetaddr":"1415 7TH STREET SOUTH","zipcode":"35045","county":"021","date_super":{"end_time":"1994/03/02 00:00:00 -0500","original":"3/1/1994 ","granularity":"day","time":"1994/03/01 00:00:00 -0500"},"geo_score":0.818,"strstate":"AL","conversion":1,"type_store":"Supercenter","opendate":{"end_time":"1982/08/04 00:00:00 -0400","original":"8/3/1982 ","granularity":"day","time":"1982/08/03 00:00:00 -0400"},"id":"a61znt9fovor","geo_precision":"range","storenum":424,"strcity":"Clanton"},"type":"Feature","geometry":{"type":"Point","coordinates":[-86.608861,32.818873]}},{"properties":{"st":"01","streetaddr":"30 WALNUT STREET","zipcode":"35034","county":"007","date_super":null,"geo_score":0.805,"strstate":"AL","conversion":null,"type_store":"Wal-Mart","opendate":{"end_time":"1982/08/04 00:00:00 -0400","original":"8/3/1982 ","granularity":"day","time":"1982/08/03 00:00:00 -0400"},"id":"a61znt75zkni","geo_precision":"range","storenum":425,"strcity":"Brent"},"type":"Feature","geometry":{"type":"Point","coordinates":[-86.592746,34.080187]}},{"properties":{"st":"48","streetaddr":"4691 STATE HWY 121","zipcode":"75056","county":"121","date_super":{"end_time":"1998/03/02 00:00:00 -0500","original":"3/1/1998 ","granularity":"day","time":"1998/03/01 00:00:00 -0500"},"geo_score":1.0,"strstate":"TX","conversion":1,"type_store":"Supercenter","opendate":{"end_time":"1982/12/01 00:00:00 -0500","original":"11/30/1982 ","granularity":"day","time":"1982/11/30 00:00:00 -0500"},"id":"a61znsys4is2","geo_precision":"range","storenum":426,"strcity":"The Colony"},"type":"Feature","geometry":{"type":"Point","coordinates":[-96.876843,33.071763]}},{"properties":{"st":"48","streetaddr":"7401 INTERSTATE 30","zipcode":"75402","county":"231","date_super":{"end_time":"1994/03/02 00:00:00 -0500","original":"3/1/1994 ","granularity":"day","time":"1994/03/01 00:00:00 -0500"},"geo_score":0.465,"strstate":"TX","conversion":1,"type_store":"Supercenter","opendate":{"end_time":"1982/10/06 00:00:00 -0400","original":"10/5/1982 ","granularity":"day","time":"1982/10/05 00:00:00 -0400"},"id":"a61znt69s9y5","geo_precision":"street","storenum":427,"strcity":"Greenville"},"type":"Feature","geometry":{"type":"Point","coordinates":[-96.151878,33.065629]}},{"properties":{"st":"22","streetaddr":"5801 MAIN STREET","zipcode":"70791","county":"033","date_super":{"end_time":"1996/03/02 00:00:00 -0500","original":"3/1/1996 ","granularity":"day","time":"1996/03/01 00:00:00 -0500"},"geo_score":0.916,"strstate":"LA","conversion":1,"type_store":"Supercenter","opendate":{"end_time":"1983/10/05 00:00:00 -0400","original":"10/4/1983 ","granularity":"day","time":"1983/10/04 00:00:00 -0400"},"id":"a61znszukti8","geo_precision":"range","storenum":428,"strcity":"Zachary"},"type":"Feature","geometry":{"type":"Point","coordinates":[-91.143552,30.648448]}},{"properties":{"st":"48","streetaddr":"1724 W UNIVERSITY DRIVE","zipcode":"78539","county":"215","date_super":{"end_time":"1994/03/02 00:00:00 -0500","original":"3/1/1994 ","granularity":"day","time":"1994/03/01 00:00:00 -0500"},"geo_score":0.913,"strstate":"TX","conversion":1,"type_store":"Supercenter","opendate":{"end_time":"1981/11/04 00:00:00 -0500","original":"11/3/1981 ","granularity":"day","time":"1981/11/03 00:00:00 -0500"},"id":"a61znt93e9lm","geo_precision":"range","storenum":429,"strcity":"Edinburg"},"type":"Feature","geometry":{"type":"Point","coordinates":[-98.180103,26.303988]}},{"properties":{"st":"21","streetaddr":"1225 PARIS ROAD","zipcode":"42066","county":"083","date_super":{"end_time":"1996/03/02 00:00:00 -0500","original":"3/1/1996 ","granularity":"day","time":"1996/03/01 00:00:00 -0500"},"geo_score":0.912,"strstate":"KY","conversion":1,"type_store":"Supercenter","opendate":{"end_time":"1981/09/02 00:00:00 -0400","original":"9/1/1981 ","granularity":"day","time":"1981/09/01 00:00:00 -0400"},"id":"a61znsup8grf","geo_precision":"range","storenum":430,"strcity":"Mayfield"},"type":"Feature","geometry":{"type":"Point","coordinates":[-88.628286,36.724478]}},{"properties":{"st":"21","streetaddr":"3220 IRVING COBB DRIVE","zipcode":"42003","county":"145","date_super":{"end_time":"1995/03/02 00:00:00 -0500","original":"3/1/1995 ","granularity":"day","time":"1995/03/01 00:00:00 -0500"},"geo_score":0.976,"strstate":"KY","conversion":1,"type_store":"Supercenter","opendate":{"end_time":"1981/08/19 00:00:00 -0400","original":"8/18/1981 ","granularity":"day","time":"1981/08/18 00:00:00 -0400"},"id":"a61znt5lslad","geo_precision":"range","storenum":431,"strcity":"Paducah"},"type":"Feature","geometry":{"type":"Point","coordinates":[-88.569262,37.053191]}},{"properties":{"st":"01","streetaddr":"214 HAYNES STREET","zipcode":"35160","county":"121","date_super":{"end_time":"2004/04/22 00:00:00 -0400","original":"4/21/2004 ","granularity":"day","time":"2004/04/21 00:00:00 -0400"},"geo_score":0.935,"strstate":"AL","conversion":1,"type_store":"Supercenter","opendate":{"end_time":"1981/08/19 00:00:00 -0400","original":"8/18/1981 ","granularity":"day","time":"1981/08/18 00:00:00 -0400"},"id":"a61znswwgdwd","geo_precision":"range","storenum":432,"strcity":"Talladega"},"type":"Feature","geometry":{"type":"Point","coordinates":[-86.081362,33.435023]}},{"properties":{"st":"01","streetaddr":"2200 SPARKMAN DRIVE","zipcode":"35810","county":"089","date_super":{"end_time":"2004/03/18 00:00:00 -0500","original":"3/17/2004 ","granularity":"day","time":"2004/03/17 00:00:00 -0500"},"geo_score":0.863,"strstate":"AL","conversion":1,"type_store":"Supercenter","opendate":{"end_time":"1981/08/12 00:00:00 -0400","original":"8/11/1981 ","granularity":"day","time":"1981/08/11 00:00:00 -0400"},"id":"a61znt06b8sd","geo_precision":"range","storenum":433,"strcity":"Huntsville"},"type":"Feature","geometry":{"type":"Point","coordinates":[-86.593406,34.763019]}},{"properties":{"st":"01","streetaddr":"11610 MEMORIAL PKWY SOUTH","zipcode":"35803","county":"089","date_super":{"end_time":"1996/03/02 00:00:00 -0500","original":"3/1/1996 ","granularity":"day","time":"1996/03/01 00:00:00 -0500"},"geo_score":0.908,"strstate":"AL","conversion":1,"type_store":"Supercenter","opendate":{"end_time":"1981/08/12 00:00:00 -0400","original":"8/11/1981 ","granularity":"day","time":"1981/08/11 00:00:00 -0400"},"id":"a61znsvqidxm","geo_precision":"range","storenum":434,"strcity":"Huntsville"},"type":"Feature","geometry":{"type":"Point","coordinates":[-86.567313,34.61721]}},{"properties":{"st":"17","streetaddr":"12495 STATE RTE 143","zipcode":"62249","county":"119","date_super":{"end_time":"2001/03/15 00:00:00 -0500","original":"3/14/2001 ","granularity":"day","time":"2001/03/14 00:00:00 -0500"},"geo_score":0.902,"strstate":"IL","conversion":1,"type_store":"Supercenter","opendate":{"end_time":"1982/09/22 00:00:00 -0400","original":"9/21/1982 ","granularity":"day","time":"1982/09/21 00:00:00 -0400"},"id":"a61znt5sg59t","geo_precision":"range","storenum":435,"strcity":"Highland"},"type":"Feature","geometry":{"type":"Point","coordinates":[-89.686235,38.759139]}},{"properties":{"st":"17","streetaddr":"2517 FRANKLIN ST","zipcode":"62231","county":"027","date_super":null,"geo_score":0.922,"strstate":"IL","conversion":null,"type_store":"Wal-Mart","opendate":{"end_time":"1982/09/22 00:00:00 -0400","original":"9/21/1982 ","granularity":"day","time":"1982/09/21 00:00:00 -0400"},"id":"a61znsxi4qco","geo_precision":"range","storenum":436,"strcity":"Carlyle"},"type":"Feature","geometry":{"type":"Point","coordinates":[-89.389294,38.610049]}},{"properties":{"st":"48","streetaddr":"2200 HIGHWAY 36 SOUTH","zipcode":"77474","county":"015","date_super":null,"geo_score":0.743,"strstate":"TX","conversion":null,"type_store":"Wal-Mart","opendate":{"end_time":"1982/09/22 00:00:00 -0400","original":"9/21/1982 ","granularity":"day","time":"1982/09/21 00:00:00 -0400"},"id":"a61znt5fk196","geo_precision":"range","storenum":437,"strcity":"Sealy"},"type":"Feature","geometry":{"type":"Point","coordinates":[-96.161913,29.806195]}},{"properties":{"st":"48","streetaddr":"3732 WEST WALKER","zipcode":"76424","county":"429","date_super":null,"geo_score":0.74,"strstate":"TX","conversion":null,"type_store":"Wal-Mart","opendate":{"end_time":"1984/02/02 00:00:00 -0500","original":"2/1/1984 ","granularity":"day","time":"1984/02/01 00:00:00 -0500"},"id":"a61znt7yupq7","geo_precision":"street","storenum":438,"strcity":"Breckenridge"},"type":"Feature","geometry":{"type":"Point","coordinates":[-98.945702,32.759305]}},{"properties":{"st":"48","streetaddr":"2401 HWY 35 NORTH","zipcode":"78382","county":"007","date_super":{"end_time":"2004/10/28 00:00:00 -0400","original":"10/27/2004 ","granularity":"day","time":"2004/10/27 00:00:00 -0400"},"geo_score":0.915,"strstate":"TX","conversion":1,"type_store":"Supercenter","opendate":{"end_time":"1982/09/01 00:00:00 -0400","original":"8/31/1982 ","granularity":"day","time":"1982/08/31 00:00:00 -0400"},"id":"a61znsvlvt3h","geo_precision":"range","storenum":440,"strcity":"Rockport"},"type":"Feature","geometry":{"type":"Point","coordinates":[-97.042436,28.047316]}},{"properties":{"st":"48","streetaddr":"1133 E GEN'L CAVAZOS BLVD","zipcode":"78363","county":"273","date_super":{"end_time":"1996/03/02 00:00:00 -0500","original":"3/1/1996 ","granularity":"day","time":"1996/03/01 00:00:00 -0500"},"geo_score":0.498,"strstate":"TX","conversion":1,"type_store":"Supercenter","opendate":{"end_time":"1982/04/21 00:00:00 -0500","original":"4/20/1982 ","granularity":"day","time":"1982/04/20 00:00:00 -0500"},"id":"a61znszv6hcz","geo_precision":"street","storenum":442,"strcity":"Kingsville"},"type":"Feature","geometry":{"type":"Point","coordinates":[-97.874347,27.531722]}},{"properties":{"st":"48","streetaddr":"103 19TH STREET","zipcode":"78861","county":"325","date_super":null,"geo_score":0.823,"strstate":"TX","conversion":null,"type_store":"Wal-Mart","opendate":{"end_time":"1982/10/06 00:00:00 -0400","original":"10/5/1982 ","granularity":"day","time":"1982/10/05 00:00:00 -0400"},"id":"a61znsv9kmeo","geo_precision":"range","storenum":443,"strcity":"Hondo"},"type":"Feature","geometry":{"type":"Point","coordinates":[-99.128055,29.348251]}},{"properties":{"st":"29","streetaddr":"3315 SOUTH CAMPBELL","zipcode":"65807","county":"077","date_super":{"end_time":"2002/05/23 00:00:00 -0400","original":"5/22/2002 ","granularity":"day","time":"2002/05/22 00:00:00 -0400"},"geo_score":0.927,"strstate":"MO","conversion":1,"type_store":"Supercenter","opendate":{"end_time":"1982/07/14 00:00:00 -0400","original":"7/13/1982 ","granularity":"day","time":"1982/07/13 00:00:00 -0400"},"id":"a61znsw5jasl","geo_precision":"range","storenum":444,"strcity":"Springfield"},"type":"Feature","geometry":{"type":"Point","coordinates":[-93.295618,37.155281]}},{"properties":{"st":"21","streetaddr":"1801 ELIZABETHTOWN ROAD","zipcode":"42754","county":"085","date_super":{"end_time":"2003/08/21 00:00:00 -0400","original":"8/20/2003 ","granularity":"day","time":"2003/08/20 00:00:00 -0400"},"geo_score":0.902,"strstate":"KY","conversion":1,"type_store":"Supercenter","opendate":{"end_time":"1982/10/06 00:00:00 -0400","original":"10/5/1982 ","granularity":"day","time":"1982/10/05 00:00:00 -0400"},"id":"a61znt7llnkp","geo_precision":"range","storenum":445,"strcity":"Leitchfield"},"type":"Feature","geometry":{"type":"Point","coordinates":[-86.264718,37.488179]}},{"properties":{"st":"48","streetaddr":"1620 EAST MAIN","zipcode":"77864","county":"313","date_super":null,"geo_score":0.642,"strstate":"TX","conversion":null,"type_store":"Wal-Mart","opendate":{"end_time":"1984/04/04 00:00:00 -0500","original":"4/3/1984 ","granularity":"day","time":"1984/04/03 00:00:00 -0500"},"id":"a61znsweafkv","geo_precision":"street","storenum":446,"strcity":"Madisonville"},"type":"Feature","geometry":{"type":"Point","coordinates":[-95.896767,30.956287]}},{"properties":{"st":"48","streetaddr":"2410 DODSON ST","zipcode":"78840","county":"465","date_super":{"end_time":"2002/05/16 00:00:00 -0400","original":"5/15/2002 ","granularity":"day","time":"2002/05/15 00:00:00 -0400"},"geo_score":0.585,"strstate":"TX","conversion":1,"type_store":"Supercenter","opendate":{"end_time":"1982/11/17 00:00:00 -0500","original":"11/16/1982 ","granularity":"day","time":"1982/11/16 00:00:00 -0500"},"id":"a61znswphuyv","geo_precision":"zip","storenum":447,"strcity":"Del Rio"},"type":"Feature","geometry":{"type":"Point","coordinates":[-100.774543,29.917987]}},{"properties":{"st":"22","streetaddr":"6235 WESTPORT AVE","zipcode":"71129","county":"017","date_super":{"end_time":"1998/03/02 00:00:00 -0500","original":"3/1/1998 ","granularity":"day","time":"1998/03/01 00:00:00 -0500"},"geo_score":1.0,"strstate":"LA","conversion":1,"type_store":"Supercenter","opendate":{"end_time":"1982/08/04 00:00:00 -0400","original":"8/3/1982 ","granularity":"day","time":"1982/08/03 00:00:00 -0400"},"id":"a61znsvpavkw","geo_precision":"range","storenum":448,"strcity":"Shreveport"},"type":"Feature","geometry":{"type":"Point","coordinates":[-93.866701,32.449005]}},{"properties":{"st":"48","streetaddr":"4999 TWIN CITY HWY","zipcode":"77642","county":"245","date_super":{"end_time":"2003/05/22 00:00:00 -0400","original":"5/21/2003 ","granularity":"day","time":"2003/05/21 00:00:00 -0400"},"geo_score":0.919,"strstate":"TX","conversion":1,"type_store":"Supercenter","opendate":{"end_time":"1983/05/04 00:00:00 -0400","original":"5/3/1983 ","granularity":"day","time":"1983/05/03 00:00:00 -0400"},"id":"a61znt8n0rh9","geo_precision":"range","storenum":449,"strcity":"Groves"},"type":"Feature","geometry":{"type":"Point","coordinates":[-93.940506,29.94126]}},{"properties":{"st":"22","streetaddr":"9550 MANSFIELD RD","zipcode":"71118","county":"017","date_super":{"end_time":"2002/03/02 00:00:00 -0500","original":"3/1/2002 ","granularity":"day","time":"2002/03/01 00:00:00 -0500"},"geo_score":1.0,"strstate":"LA","conversion":1,"type_store":"Supercenter","opendate":{"end_time":"1982/11/17 00:00:00 -0500","original":"11/16/1982 ","granularity":"day","time":"1982/11/16 00:00:00 -0500"},"id":"a61znsuupqz6","geo_precision":"range","storenum":450,"strcity":"Shreveport"},"type":"Feature","geometry":{"type":"Point","coordinates":[-93.815733,32.388247]}},{"properties":{"st":"29","streetaddr":"405 NIFONG BLVD","zipcode":"65201","county":"019","date_super":null,"geo_score":0.876,"strstate":"MO","conversion":null,"type_store":"Wal-Mart","opendate":{"end_time":"1982/02/03 00:00:00 -0500","original":"2/2/1982 ","granularity":"day","time":"1982/02/02 00:00:00 -0500"},"id":"a61znszbmx0p","geo_precision":"range","storenum":451,"strcity":"Columbia"},"type":"Feature","geometry":{"type":"Point","coordinates":[-92.334783,38.91019]}},{"properties":{"st":"48","streetaddr":"4001 NORTH 23RD","zipcode":"78504","county":"215","date_super":null,"geo_score":0.554,"strstate":"TX","conversion":null,"type_store":"Wal-Mart","opendate":{"end_time":"1982/04/21 00:00:00 -0500","original":"4/20/1982 ","granularity":"day","time":"1982/04/20 00:00:00 -0500"},"id":"a61znt2zjo98","geo_precision":"street","storenum":452,"strcity":"McAllen (N)"},"type":"Feature","geometry":{"type":"Point","coordinates":[-98.230656,26.288406]}},{"properties":{"st":"29","streetaddr":"1007 NORTH DOUGLAS","zipcode":"63863","county":"069","date_super":null,"geo_score":0.941,"strstate":"MO","conversion":null,"type_store":"Wal-Mart","opendate":{"end_time":"1982/03/17 00:00:00 -0500","original":"3/16/1982 ","granularity":"day","time":"1982/03/16 00:00:00 -0500"},"id":"a61znt6bn752","geo_precision":"range","storenum":453,"strcity":"Malden"},"type":"Feature","geometry":{"type":"Point","coordinates":[-89.970629,36.570079]}},{"properties":{"st":"17","streetaddr":"150 COMMERCE DRIVE","zipcode":"62837","county":"191","date_super":{"end_time":"2005/04/14 00:00:00 -0400","original":"4/13/2005 ","granularity":"day","time":"2005/04/13 00:00:00 -0400"},"geo_score":0.746,"strstate":"IL","conversion":1,"type_store":"Supercenter","opendate":{"end_time":"1982/03/03 00:00:00 -0500","original":"3/2/1982 ","granularity":"day","time":"1982/03/02 00:00:00 -0500"},"id":"a61znt0xly54","geo_precision":"range","storenum":454,"strcity":"Fairfield"},"type":"Feature","geometry":{"type":"Point","coordinates":[-88.186146,38.076863]}},{"properties":{"st":"48","streetaddr":"3500 W ALTON GLOOR BLVD","zipcode":"78520","county":"061","date_super":{"end_time":"2001/03/15 00:00:00 -0500","original":"3/14/2001 ","granularity":"day","time":"2001/03/14 00:00:00 -0500"},"geo_score":0.902,"strstate":"TX","conversion":1,"type_store":"Supercenter","opendate":{"end_time":"1982/10/06 00:00:00 -0400","original":"10/5/1982 ","granularity":"day","time":"1982/10/05 00:00:00 -0400"},"id":"a61znt8vy1zu","geo_precision":"range","storenum":456,"strcity":"Brownsville"},"type":"Feature","geometry":{"type":"Point","coordinates":[-97.538814,25.968336]}},{"properties":{"st":"48","streetaddr":"1350 NORTH MAIN","zipcode":"77662","county":"361","date_super":null,"geo_score":0.819,"strstate":"TX","conversion":null,"type_store":"Wal-Mart","opendate":{"end_time":"1983/03/02 00:00:00 -0500","original":"3/1/1983 ","granularity":"day","time":"1983/03/01 00:00:00 -0500"},"id":"a61znt96vpzq","geo_precision":"range","storenum":457,"strcity":"Vidor"},"type":"Feature","geometry":{"type":"Point","coordinates":[-94.016113,30.143463]}},{"properties":{"st":"48","streetaddr":"2501 WEST WHEELER","zipcode":"78336","county":"409","date_super":{"end_time":"2001/03/15 00:00:00 -0500","original":"3/14/2001 ","granularity":"day","time":"2001/03/14 00:00:00 -0500"},"geo_score":0.92,"strstate":"TX","conversion":1,"type_store":"Supercenter","opendate":{"end_time":"1982/11/03 00:00:00 -0500","original":"11/2/1982 ","granularity":"day","time":"1982/11/02 00:00:00 -0500"},"id":"a61znt6zfhem","geo_precision":"range","storenum":458,"strcity":"Aransas Pass"},"type":"Feature","geometry":{"type":"Point","coordinates":[-97.176606,27.92463]}},{"properties":{"st":"13","streetaddr":"9218 HWY 278 NE","zipcode":"30014","county":"217","date_super":null,"geo_score":1.0,"strstate":"GA","conversion":null,"type_store":"Wal-Mart","opendate":{"end_time":"1983/11/30 00:00:00 -0500","original":"11/29/1983 ","granularity":"day","time":"1983/11/29 00:00:00 -0500"},"id":"a61znt8i4dfc","geo_precision":"range","storenum":459,"strcity":"Covington"},"type":"Feature","geometry":{"type":"Point","coordinates":[-83.833218,33.599281]}},{"properties":{"st":"17","streetaddr":"10 WEST SECOND","zipcode":"62557","county":"021","date_super":null,"geo_score":0.514,"strstate":"IL","conversion":null,"type_store":"Wal-Mart","opendate":{"end_time":"1983/11/30 00:00:00 -0500","original":"11/29/1983 ","granularity":"day","time":"1983/11/29 00:00:00 -0500"},"id":"a61znt0kklc4","geo_precision":"street","storenum":460,"strcity":"Pana"},"type":"Feature","geometry":{"type":"Point","coordinates":[-89.085665,39.389765]}},{"properties":{"st":"48","streetaddr":"496 SOUTH BIBB ST.","zipcode":"78852","county":"323","date_super":{"end_time":"2002/10/31 00:00:00 -0500","original":"10/30/2002 ","granularity":"day","time":"2002/10/30 00:00:00 -0500"},"geo_score":0.804,"strstate":"TX","conversion":1,"type_store":"Supercenter","opendate":{"end_time":"1982/08/18 00:00:00 -0400","original":"8/17/1982 ","granularity":"day","time":"1982/08/17 00:00:00 -0400"},"id":"a61znt12q1ki","geo_precision":"range","storenum":461,"strcity":"Eagle Pass"},"type":"Feature","geometry":{"type":"Point","coordinates":[-100.483477,28.700617]}},{"properties":{"st":"48","streetaddr":"400 SOUTH BYPASS 35","zipcode":"77511","county":"039","date_super":{"end_time":"2001/05/17 00:00:00 -0400","original":"5/16/2001 ","granularity":"day","time":"2001/05/16 00:00:00 -0400"},"geo_score":0.593,"strstate":"TX","conversion":1,"type_store":"Supercenter","opendate":{"end_time":"1982/10/06 00:00:00 -0400","original":"10/5/1982 ","granularity":"day","time":"1982/10/05 00:00:00 -0400"},"id":"a61znt14ajbc","geo_precision":"street","storenum":462,"strcity":"Alvin"},"type":"Feature","geometry":{"type":"Point","coordinates":[-95.232976,29.409478]}},{"properties":{"st":"48","streetaddr":"2201 NORTH SAINT MARY","zipcode":"78102","county":"025","date_super":null,"geo_score":0.464,"strstate":"TX","conversion":null,"type_store":"Wal-Mart","opendate":{"end_time":"1982/09/01 00:00:00 -0400","original":"8/31/1982 ","granularity":"day","time":"1982/08/31 00:00:00 -0400"},"id":"a61znt1aqtxy","geo_precision":"street","storenum":463,"strcity":"Beeville"},"type":"Feature","geometry":{"type":"Point","coordinates":[-97.735385,28.391192]}},{"properties":{"st":"48","streetaddr":"3829 US HWY 77","zipcode":"78410","county":"355","date_super":{"end_time":"1994/03/02 00:00:00 -0500","original":"3/1/1994 ","granularity":"day","time":"1994/03/01 00:00:00 -0500"},"geo_score":1.0,"strstate":"TX","conversion":1,"type_store":"Supercenter","opendate":{"end_time":"1982/10/06 00:00:00 -0400","original":"10/5/1982 ","granularity":"day","time":"1982/10/05 00:00:00 -0400"},"id":"a61znsvabfhq","geo_precision":"range","storenum":464,"strcity":"Corpus Christi"},"type":"Feature","geometry":{"type":"Point","coordinates":[-97.630858,27.853599]}},{"properties":{"st":"48","streetaddr":"534 10TH STREET","zipcode":"78114","county":"493","date_super":null,"geo_score":0.814,"strstate":"TX","conversion":null,"type_store":"Wal-Mart","opendate":{"end_time":"1982/11/17 00:00:00 -0500","original":"11/16/1982 ","granularity":"day","time":"1982/11/16 00:00:00 -0500"},"id":"a61znt7rq1nj","geo_precision":"range","storenum":465,"strcity":"Floresville"},"type":"Feature","geometry":{"type":"Point","coordinates":[-98.164182,29.151735]}},{"properties":{"st":"47","streetaddr":"1604 WEST MARKET ST.","zipcode":"38008","county":"069","date_super":{"end_time":"2002/10/31 00:00:00 -0500","original":"10/30/2002 ","granularity":"day","time":"2002/10/30 00:00:00 -0500"},"geo_score":0.71,"strstate":"TN","conversion":1,"type_store":"Supercenter","opendate":{"end_time":"1982/11/17 00:00:00 -0500","original":"11/16/1982 ","granularity":"day","time":"1982/11/16 00:00:00 -0500"},"id":"a61znt0qvhms","geo_precision":"street","storenum":466,"strcity":"Bolivar"},"type":"Feature","geometry":{"type":"Point","coordinates":[-89.011575,35.265482]}},{"properties":{"st":"48","streetaddr":"1515 SOUTH LOOP 288","zipcode":"76208","county":"121","date_super":{"end_time":"1996/03/02 00:00:00 -0500","original":"3/1/1996 ","granularity":"day","time":"1996/03/01 00:00:00 -0500"},"geo_score":0.708,"strstate":"TX","conversion":1,"type_store":"Supercenter","opendate":{"end_time":"1982/11/17 00:00:00 -0500","original":"11/16/1982 ","granularity":"day","time":"1982/11/16 00:00:00 -0500"},"id":"a61znsunai5f","geo_precision":"street","storenum":467,"strcity":"Denton"},"type":"Feature","geometry":{"type":"Point","coordinates":[-97.08993,33.228239]}},{"properties":{"st":"05","streetaddr":"133 ARKANSAS BLVD","zipcode":"71854","county":"091","date_super":{"end_time":"2002/04/25 00:00:00 -0400","original":"4/24/2002 ","granularity":"day","time":"2002/04/24 00:00:00 -0400"},"geo_score":1.0,"strstate":"AR","conversion":1,"type_store":"Supercenter","opendate":{"end_time":"1982/11/17 00:00:00 -0500","original":"11/16/1982 ","granularity":"day","time":"1982/11/16 00:00:00 -0500"},"id":"a61znt1wrbyt","geo_precision":"range","storenum":468,"strcity":"Texarkana"},"type":"Feature","geometry":{"type":"Point","coordinates":[-94.042591,33.460491]}},{"properties":{"st":"22","streetaddr":"3415 US 14","zipcode":"70607","county":"019","date_super":{"end_time":"1994/03/02 00:00:00 -0500","original":"3/1/1994 ","granularity":"day","time":"1994/03/01 00:00:00 -0500"},"geo_score":0.766,"strstate":"LA","conversion":1,"type_store":"Supercenter","opendate":{"end_time":"1982/11/03 00:00:00 -0500","original":"11/2/1982 ","granularity":"day","time":"1982/11/02 00:00:00 -0500"},"id":"a61znt957g01","geo_precision":"range","storenum":469,"strcity":"Lake Charles"},"type":"Feature","geometry":{"type":"Point","coordinates":[-93.157503,30.158227]}},{"properties":{"st":"48","streetaddr":"1821 SOUTH PADRE ISLAND DR","zipcode":"78416","county":"355","date_super":{"end_time":"1996/03/02 00:00:00 -0500","original":"3/1/1996 ","granularity":"day","time":"1996/03/01 00:00:00 -0500"},"geo_score":1.0,"strstate":"TX","conversion":1,"type_store":"Supercenter","opendate":{"end_time":"1982/10/06 00:00:00 -0400","original":"10/5/1982 ","granularity":"day","time":"1982/10/05 00:00:00 -0400"},"id":"a61znsw5llzt","geo_precision":"range","storenum":470,"strcity":"Corpus Christi"},"type":"Feature","geometry":{"type":"Point","coordinates":[-97.440219,27.74147]}},{"properties":{"st":"48","streetaddr":"150 NORTH BECKLEY","zipcode":"75146","county":"113","date_super":{"end_time":"1999/03/02 00:00:00 -0500","original":"3/1/1999 ","granularity":"day","time":"1999/03/01 00:00:00 -0500"},"geo_score":0.941,"strstate":"TX","conversion":1,"type_store":"Supercenter","opendate":{"end_time":"1982/10/06 00:00:00 -0400","original":"10/5/1982 ","granularity":"day","time":"1982/10/05 00:00:00 -0400"},"id":"a61znszy3dho","geo_precision":"range","storenum":471,"strcity":"Lancaster"},"type":"Feature","geometry":{"type":"Point","coordinates":[-96.82203,32.591803]}},{"properties":{"st":"40","streetaddr":"2301 WEST KENOSHA ST","zipcode":"74012","county":"143","date_super":{"end_time":"1999/03/02 00:00:00 -0500","original":"3/1/1999 ","granularity":"day","time":"1999/03/01 00:00:00 -0500"},"geo_score":0.92,"strstate":"OK","conversion":1,"type_store":"Supercenter","opendate":{"end_time":"1986/04/30 00:00:00 -0400","original":"4/29/1986 ","granularity":"day","time":"1986/04/29 00:00:00 -0400"},"id":"a61znt23pp9s","geo_precision":"range","storenum":472,"strcity":"Broken Arrow"},"type":"Feature","geometry":{"type":"Point","coordinates":[-95.820382,36.060865]}},{"properties":{"st":"48","streetaddr":"US HWY 290/2374 E AUSTIN","zipcode":"78942","county":"287","date_super":null,"geo_score":0.667,"strstate":"TX","conversion":null,"type_store":"Wal-Mart","opendate":{"end_time":"1983/04/06 00:00:00 -0500","original":"4/5/1983 ","granularity":"day","time":"1983/04/05 00:00:00 -0500"},"id":"a61znsz472w8","geo_precision":"street","storenum":473,"strcity":"Giddings"},"type":"Feature","geometry":{"type":"Point","coordinates":[-96.921694,30.180111]}},{"properties":{"st":"48","streetaddr":"1002 NORTH WELLS","zipcode":"77957","county":"239","date_super":null,"geo_score":0.65,"strstate":"TX","conversion":null,"type_store":"Wal-Mart","opendate":{"end_time":"1982/11/03 00:00:00 -0500","original":"11/2/1982 ","granularity":"day","time":"1982/11/02 00:00:00 -0500"},"id":"a61znt57n6a1","geo_precision":"street","storenum":474,"strcity":"Edna"},"type":"Feature","geometry":{"type":"Point","coordinates":[-96.650283,28.984983]}},{"properties":{"st":"48","streetaddr":"2701 SOUTH IH-35","zipcode":"78664","county":"491","date_super":{"end_time":"1995/03/02 00:00:00 -0500","original":"3/1/1995 ","granularity":"day","time":"1995/03/01 00:00:00 -0500"},"geo_score":0.463,"strstate":"TX","conversion":1,"type_store":"Supercenter","opendate":{"end_time":"1982/12/01 00:00:00 -0500","original":"11/30/1982 ","granularity":"day","time":"1982/11/30 00:00:00 -0500"},"id":"a61znt14k9zd","geo_precision":"street","storenum":475,"strcity":"Round Rock"},"type":"Feature","geometry":{"type":"Point","coordinates":[-97.691933,30.540148]}},{"properties":{"st":"48","streetaddr":"2805 SO. HWY 36","zipcode":"76528","county":"099","date_super":{"end_time":"2005/05/19 00:00:00 -0400","original":"5/18/2005 ","granularity":"day","time":"2005/05/18 00:00:00 -0400"},"geo_score":0.525,"strstate":"TX","conversion":1,"type_store":"Supercenter","opendate":{"end_time":"1983/07/02 00:00:00 -0400","original":"7/1/1983 ","granularity":"day","time":"1983/07/01 00:00:00 -0400"},"id":"a61znszwp70l","geo_precision":"street","storenum":476,"strcity":"Gatesville"},"type":"Feature","geometry":{"type":"Point","coordinates":[-97.705979,31.433179]}},{"properties":{"st":"47","streetaddr":"9334 DAYTON PIKE","zipcode":"37379","county":"065","date_super":{"end_time":"2005/04/14 00:00:00 -0400","original":"4/13/2005 ","granularity":"day","time":"2005/04/13 00:00:00 -0400"},"geo_score":0.81,"strstate":"TN","conversion":1,"type_store":"Supercenter","opendate":{"end_time":"1982/11/17 00:00:00 -0500","original":"11/16/1982 ","granularity":"day","time":"1982/11/16 00:00:00 -0500"},"id":"a61znsvogpom","geo_precision":"street","storenum":477,"strcity":"Soddy-Daisy"},"type":"Feature","geometry":{"type":"Point","coordinates":[-85.203953,35.23384]}},{"properties":{"st":"48","streetaddr":"819 N OAK STREET","zipcode":"78061","county":"163","date_super":null,"geo_score":0.902,"strstate":"TX","conversion":null,"type_store":"Wal-Mart","opendate":{"end_time":"1984/03/07 00:00:00 -0500","original":"3/6/1984 ","granularity":"day","time":"1984/03/06 00:00:00 -0500"},"id":"a61znstycm0j","geo_precision":"range","storenum":478,"strcity":"Pearsall"},"type":"Feature","geometry":{"type":"Point","coordinates":[-99.093112,28.898901]}},{"properties":{"st":"40","streetaddr":"2500 NORTH MAIN","zipcode":"73521","county":"065","date_super":{"end_time":"1995/03/02 00:00:00 -0500","original":"3/1/1995 ","granularity":"day","time":"1995/03/01 00:00:00 -0500"},"geo_score":0.83,"strstate":"OK","conversion":1,"type_store":"Supercenter","opendate":{"end_time":"1982/09/22 00:00:00 -0400","original":"9/21/1982 ","granularity":"day","time":"1982/09/21 00:00:00 -0400"},"id":"a61znt17nr9z","geo_precision":"range","storenum":479,"strcity":"Altus"},"type":"Feature","geometry":{"type":"Point","coordinates":[-99.334036,34.665383]}},{"properties":{"st":"17","streetaddr":"US 36 &amp; 151 SHETLAND DRIVE","zipcode":"62363","county":"149","date_super":null,"geo_score":0.629,"strstate":"IL","conversion":null,"type_store":"Wal-Mart","opendate":{"end_time":"1982/12/01 00:00:00 -0500","original":"11/30/1982 ","granularity":"day","time":"1982/11/30 00:00:00 -0500"},"id":"a61znswz18xj","geo_precision":"range","storenum":480,"strcity":"Pittsfield"},"type":"Feature","geometry":{"type":"Point","coordinates":[-90.824102,39.60442]}},{"properties":{"st":"17","streetaddr":"101 DETTRO DRIVE","zipcode":"61938","county":"029","date_super":{"end_time":"1994/03/02 00:00:00 -0500","original":"3/1/1994 ","granularity":"day","time":"1994/03/01 00:00:00 -0500"},"geo_score":0.915,"strstate":"IL","conversion":1,"type_store":"Supercenter","opendate":{"end_time":"1982/11/03 00:00:00 -0500","original":"11/2/1982 ","granularity":"day","time":"1982/11/02 00:00:00 -0500"},"id":"a61znt2b6p1d","geo_precision":"range","storenum":481,"strcity":"Mattoon"},"type":"Feature","geometry":{"type":"Point","coordinates":[-88.334949,39.476713]}},{"properties":{"st":"48","streetaddr":"301 N COLUMBIA DR","zipcode":"77486","county":"039","date_super":null,"geo_score":0.984,"strstate":"TX","conversion":null,"type_store":"Wal-Mart","opendate":{"end_time":"1984/07/18 00:00:00 -0400","original":"7/17/1984 ","granularity":"day","time":"1984/07/17 00:00:00 -0400"},"id":"a61znt3r1diz","geo_precision":"range","storenum":482,"strcity":"West Columbia"},"type":"Feature","geometry":{"type":"Point","coordinates":[-95.659639,29.1498]}},{"properties":{"st":"01","streetaddr":"1903 COBBS FORD RD","zipcode":"36066","county":"001","date_super":{"end_time":"1996/03/02 00:00:00 -0500","original":"3/1/1996 ","granularity":"day","time":"1996/03/01 00:00:00 -0500"},"geo_score":1.0,"strstate":"AL","conversion":1,"type_store":"Supercenter","opendate":{"end_time":"1982/10/06 00:00:00 -0400","original":"10/5/1982 ","granularity":"day","time":"1982/10/05 00:00:00 -0400"},"id":"a61znszuedcc","geo_precision":"range","storenum":483,"strcity":"Prattville"},"type":"Feature","geometry":{"type":"Point","coordinates":[-86.418075,32.460489]}},{"properties":{"st":"20","streetaddr":"3300 IOWA STREET","zipcode":"66046","county":"045","date_super":null,"geo_score":1.0,"strstate":"KS","conversion":null,"type_store":"Wal-Mart","opendate":{"end_time":"1983/02/02 00:00:00 -0500","original":"2/1/1983 ","granularity":"day","time":"1983/02/01 00:00:00 -0500"},"id":"a61znt7t3pp2","geo_precision":"range","storenum":484,"strcity":"Lawrence"},"type":"Feature","geometry":{"type":"Point","coordinates":[-95.260463,38.924551]}},{"properties":{"st":"22","streetaddr":"37000 HWY 3089","zipcode":"70346","county":"005","date_super":{"end_time":"2005/06/16 00:00:00 -0400","original":"6/15/2005 ","granularity":"day","time":"2005/06/15 00:00:00 -0400"},"geo_score":0.519,"strstate":"LA","conversion":1,"type_store":"Supercenter","opendate":{"end_time":"1983/08/03 00:00:00 -0400","original":"8/2/1983 ","granularity":"day","time":"1983/08/02 00:00:00 -0400"},"id":"a61znt924aqt","geo_precision":"street","storenum":485,"strcity":"Donaldsonville"},"type":"Feature","geometry":{"type":"Point","coordinates":[-90.945194,30.086295]}},{"properties":{"st":"20","streetaddr":"12801 KANSAS AVENUE","zipcode":"66012","county":"209","date_super":{"end_time":"2002/10/31 00:00:00 -0500","original":"10/30/2002 ","granularity":"day","time":"2002/10/30 00:00:00 -0500"},"geo_score":0.94,"strstate":"KS","conversion":1,"type_store":"Supercenter","opendate":{"end_time":"1983/10/05 00:00:00 -0400","original":"10/4/1983 ","granularity":"day","time":"1983/10/04 00:00:00 -0400"},"id":"a61znt4inmpf","geo_precision":"range","storenum":486,"strcity":"Bonner Springs"},"type":"Feature","geometry":{"type":"Point","coordinates":[-94.879553,39.087077]}},{"properties":{"st":"17","streetaddr":"10 CLINTON PLAZA HWY 54 WEST","zipcode":"61727","county":"039","date_super":null,"geo_score":0.793,"strstate":"IL","conversion":null,"type_store":"Wal-Mart","opendate":{"end_time":"1983/03/02 00:00:00 -0500","original":"3/1/1983 ","granularity":"day","time":"1983/03/01 00:00:00 -0500"},"id":"a61znt58htmw","geo_precision":"range","storenum":487,"strcity":"Clinton"},"type":"Feature","geometry":{"type":"Point","coordinates":[-88.975299,40.148567]}},{"properties":{"st":"12","streetaddr":"1940 PAT THOMAS PKWY","zipcode":"32351","county":"039","date_super":{"end_time":"2002/10/17 00:00:00 -0400","original":"10/16/2002 ","granularity":"day","time":"2002/10/16 00:00:00 -0400"},"geo_score":0.919,"strstate":"FL","conversion":1,"type_store":"Supercenter","opendate":{"end_time":"1982/11/17 00:00:00 -0500","original":"11/16/1982 ","granularity":"day","time":"1982/11/16 00:00:00 -0500"},"id":"a61znt7jl9y1","geo_precision":"range","storenum":488,"strcity":"Quincy"},"type":"Feature","geometry":{"type":"Point","coordinates":[-84.592851,30.557574]}},{"properties":{"st":"22","streetaddr":"2799 WEST THOMAS STREET","zipcode":"70401","county":"105","date_super":{"end_time":"1994/03/02 00:00:00 -0500","original":"3/1/1994 ","granularity":"day","time":"1994/03/01 00:00:00 -0500"},"geo_score":0.917,"strstate":"LA","conversion":1,"type_store":"Supercenter","opendate":{"end_time":"1983/08/03 00:00:00 -0400","original":"8/2/1983 ","granularity":"day","time":"1983/08/02 00:00:00 -0400"},"id":"a61znsu74unh","geo_precision":"range","storenum":489,"strcity":"Hammond"},"type":"Feature","geometry":{"type":"Point","coordinates":[-90.491604,30.502339]}},{"properties":{"st":"48","streetaddr":"10241 SOUTH PADRE ISLAND DRIVE","zipcode":"78418","county":"355","date_super":null,"geo_score":0.91,"strstate":"TX","conversion":null,"type_store":"Wal-Mart","opendate":{"end_time":"1983/03/30 00:00:00 -0500","original":"3/29/1983 ","granularity":"day","time":"1983/03/29 00:00:00 -0500"},"id":"a61znsuwb78e","geo_precision":"range","storenum":490,"strcity":"Corpus Christi"},"type":"Feature","geometry":{"type":"Point","coordinates":[-97.28379,27.668997]}},{"properties":{"st":"21","streetaddr":"5130 HINKLEVILLE ROAD","zipcode":"42001","county":"145","date_super":{"end_time":"1993/03/02 00:00:00 -0500","original":"3/1/1993 ","granularity":"day","time":"1993/03/01 00:00:00 -0500"},"geo_score":0.915,"strstate":"KY","conversion":1,"type_store":"Supercenter","opendate":{"end_time":"1983/03/02 00:00:00 -0500","original":"3/1/1983 ","granularity":"day","time":"1983/03/01 00:00:00 -0500"},"id":"a61znt360mef","geo_precision":"range","storenum":491,"strcity":"Paducah"},"type":"Feature","geometry":{"type":"Point","coordinates":[-88.687963,37.076278]}},{"properties":{"st":"18","streetaddr":"650 KIMMEL RD","zipcode":"47591","county":"083","date_super":{"end_time":"1996/03/02 00:00:00 -0500","original":"3/1/1996 ","granularity":"day","time":"1996/03/01 00:00:00 -0500"},"geo_score":0.919,"strstate":"IN","conversion":1,"type_store":"Supercenter","opendate":{"end_time":"1983/10/19 00:00:00 -0400","original":"10/18/1983 ","granularity":"day","time":"1983/10/18 00:00:00 -0400"},"id":"a61znt3tgyvz","geo_precision":"range","storenum":492,"strcity":"Vicennes"},"type":"Feature","geometry":{"type":"Point","coordinates":[-87.495984,38.667744]}},{"properties":{"st":"21","streetaddr":"2000 PARIS BYPASS","zipcode":"40361","county":"017","date_super":null,"geo_score":0.573,"strstate":"KY","conversion":null,"type_store":"Wal-Mart","opendate":{"end_time":"1983/04/06 00:00:00 -0500","original":"4/5/1983 ","granularity":"day","time":"1983/04/05 00:00:00 -0500"},"id":"a61znsxt2lrp","geo_precision":"range","storenum":493,"strcity":"Paris"},"type":"Feature","geometry":{"type":"Point","coordinates":[-84.174401,38.013307]}},{"properties":{"st":"13","streetaddr":"1025 BULLSBORO DR","zipcode":"30265","county":"077","date_super":{"end_time":"1996/03/02 00:00:00 -0500","original":"3/1/1996 ","granularity":"day","time":"1996/03/01 00:00:00 -0500"},"geo_score":0.61,"strstate":"GA","conversion":1,"type_store":"Supercenter","opendate":{"end_time":"1982/10/06 00:00:00 -0400","original":"10/5/1982 ","granularity":"day","time":"1982/10/05 00:00:00 -0400"},"id":"a61znsyqwnze","geo_precision":"street","storenum":494,"strcity":"Newnan"},"type":"Feature","geometry":{"type":"Point","coordinates":[-84.760821,33.395714]}},{"properties":{"st":"28","streetaddr":"1913 HWY 45 NORTH","zipcode":"39701","county":"087","date_super":{"end_time":"2000/03/02 00:00:00 -0500","original":"3/1/2000 ","granularity":"day","time":"2000/03/01 00:00:00 -0500"},"geo_score":0.61,"strstate":"MS","conversion":1,"type_store":"Supercenter","opendate":{"end_time":"1983/08/03 00:00:00 -0400","original":"8/2/1983 ","granularity":"day","time":"1983/08/02 00:00:00 -0400"},"id":"a61znt422qy9","geo_precision":"street","storenum":495,"strcity":"Columbus"},"type":"Feature","geometry":{"type":"Point","coordinates":[-88.43677,33.528639]}},{"properties":{"st":"21","streetaddr":"500 TAYLORSVILLE RD","zipcode":"40065","county":"211","date_super":{"end_time":"1997/03/02 00:00:00 -0500","original":"3/1/1997 ","granularity":"day","time":"1997/03/01 00:00:00 -0500"},"geo_score":0.911,"strstate":"KY","conversion":1,"type_store":"Supercenter","opendate":{"end_time":"1983/03/02 00:00:00 -0500","original":"3/1/1983 ","granularity":"day","time":"1983/03/01 00:00:00 -0500"},"id":"a61znta0htcm","geo_precision":"range","storenum":497,"strcity":"Shelbyville"},"type":"Feature","geometry":{"type":"Point","coordinates":[-85.276062,38.189188]}},{"properties":{"st":"22","streetaddr":"2426 EAST OAK STREET","zipcode":"71342","county":"059","date_super":null,"geo_score":0.729,"strstate":"LA","conversion":null,"type_store":"Wal-Mart","opendate":{"end_time":"1983/08/03 00:00:00 -0400","original":"8/2/1983 ","granularity":"day","time":"1983/08/02 00:00:00 -0400"},"id":"a61znsx4nlwa","geo_precision":"street","storenum":498,"strcity":"Jena"},"type":"Feature","geometry":{"type":"Point","coordinates":[-92.106343,31.674041]}},{"properties":{"st":"40","streetaddr":"5505 W OWEN K. GARRIOTT RD","zipcode":"73703","county":"047","date_super":{"end_time":"2003/08/21 00:00:00 -0400","original":"8/20/2003 ","granularity":"day","time":"2003/08/20 00:00:00 -0400"},"geo_score":0.643,"strstate":"OK","conversion":1,"type_store":"Supercenter","opendate":{"end_time":"1983/07/02 00:00:00 -0400","original":"7/1/1983 ","granularity":"day","time":"1983/07/01 00:00:00 -0400"},"id":"a61znszhimsj","geo_precision":"street","storenum":499,"strcity":"Enid"},"type":"Feature","geometry":{"type":"Point","coordinates":[-97.907266,36.381571]}},{"properties":{"st":"48","streetaddr":"4530 WOODROW BEAN TRANSMTN DR.","zipcode":"79924","county":"141","date_super":{"end_time":"2000/03/02 00:00:00 -0500","original":"3/1/2000 ","granularity":"day","time":"2000/03/01 00:00:00 -0500"},"geo_score":0.921,"strstate":"TX","conversion":1,"type_store":"Supercenter","opendate":{"end_time":"1984/08/03 00:00:00 -0400","original":"8/2/1984 ","granularity":"day","time":"1984/08/02 00:00:00 -0400"},"id":"a61znt1t7fuj","geo_precision":"range","storenum":500,"strcity":"El Paso"},"type":"Feature","geometry":{"type":"Point","coordinates":[-106.439181,31.89846]}},{"properties":{"st":"28","streetaddr":"1621 HWY 15 NORTH","zipcode":"39440","county":"067","date_super":{"end_time":"2000/03/02 00:00:00 -0500","original":"3/1/2000 ","granularity":"day","time":"2000/03/01 00:00:00 -0500"},"geo_score":0.909,"strstate":"MS","conversion":1,"type_store":"Supercenter","opendate":{"end_time":"1985/05/15 00:00:00 -0400","original":"5/14/1985 ","granularity":"day","time":"1985/05/14 00:00:00 -0400"},"id":"a61znt3eou69","geo_precision":"range","storenum":501,"strcity":"Laurel"},"type":"Feature","geometry":{"type":"Point","coordinates":[-89.14864,31.709182]}},{"properties":{"st":"22","streetaddr":"16759 HWY 3235","zipcode":"70354","county":"057","date_super":{"end_time":"1995/03/02 00:00:00 -0500","original":"3/1/1995 ","granularity":"day","time":"1995/03/01 00:00:00 -0500"},"geo_score":0.805,"strstate":"LA","conversion":1,"type_store":"Supercenter","opendate":{"end_time":"1983/07/02 00:00:00 -0400","original":"7/1/1983 ","granularity":"day","time":"1983/07/01 00:00:00 -0400"},"id":"a61znsxo74nq","geo_precision":"street","storenum":502,"strcity":"Galliano"},"type":"Feature","geometry":{"type":"Point","coordinates":[-90.31335,29.446818]}},{"properties":{"st":"48","streetaddr":"2103 MILAM STREET","zipcode":"78934","county":"089","date_super":null,"geo_score":0.802,"strstate":"TX","conversion":null,"type_store":"Wal-Mart","opendate":{"end_time":"1983/08/03 00:00:00 -0400","original":"8/2/1983 ","granularity":"day","time":"1983/08/02 00:00:00 -0400"},"id":"a61znsxdcfi1","geo_precision":"range","storenum":503,"strcity":"Columbus"},"type":"Feature","geometry":{"type":"Point","coordinates":[-96.540284,29.694746]}},{"properties":{"st":"48","streetaddr":"6702 SEAWALL BLVD","zipcode":"77551","county":"167","date_super":{"end_time":"1995/03/02 00:00:00 -0500","original":"3/1/1995 ","granularity":"day","time":"1995/03/01 00:00:00 -0500"},"geo_score":0.922,"strstate":"TX","conversion":1,"type_store":"Supercenter","opendate":{"end_time":"1983/08/03 00:00:00 -0400","original":"8/2/1983 ","granularity":"day","time":"1983/08/02 00:00:00 -0400"},"id":"a61znta2wzr2","geo_precision":"range","storenum":504,"strcity":"Galveston"},"type":"Feature","geometry":{"type":"Point","coordinates":[-94.831348,29.263653]}},{"properties":{"st":"22","streetaddr":"1125 NORTH PINE","zipcode":"70634","county":"011","date_super":{"end_time":"1993/03/02 00:00:00 -0500","original":"3/1/1993 ","granularity":"day","time":"1993/03/01 00:00:00 -0500"},"geo_score":0.83,"strstate":"LA","conversion":1,"type_store":"Supercenter","opendate":{"end_time":"1983/11/02 00:00:00 -0500","original":"11/1/1983 ","granularity":"day","time":"1983/11/01 00:00:00 -0500"},"id":"a61znt68dq19","geo_precision":"range","storenum":505,"strcity":"Deridder"},"type":"Feature","geometry":{"type":"Point","coordinates":[-93.285729,30.864985]}},{"properties":{"st":"17","streetaddr":"US HWY 50 &amp; HWY 1","zipcode":"62839","county":"025","date_super":null,"geo_score":0.732,"strstate":"IL","conversion":null,"type_store":"Wal-Mart","opendate":{"end_time":"1983/04/06 00:00:00 -0500","original":"4/5/1983 ","granularity":"day","time":"1983/04/05 00:00:00 -0500"},"id":"a61znsz79w7u","geo_precision":"street","storenum":506,"strcity":"Flora"},"type":"Feature","geometry":{"type":"Point","coordinates":[-88.573152,38.650807]}},{"properties":{"st":"21","streetaddr":"224 WEST PARK SHOP CTR","zipcode":"40342","county":"005","date_super":null,"geo_score":0.544,"strstate":"KY","conversion":null,"type_store":"Wal-Mart","opendate":{"end_time":"1983/08/03 00:00:00 -0400","original":"8/2/1983 ","granularity":"day","time":"1983/08/02 00:00:00 -0400"},"id":"a61znt0f5j03","geo_precision":"street","storenum":507,"strcity":"Lawrenceburg"},"type":"Feature","geometry":{"type":"Point","coordinates":[-84.899215,38.022265]}},{"properties":{"st":"48","streetaddr":"1216 JUNCTION HWY","zipcode":"78028","county":"265","date_super":{"end_time":"1995/03/02 00:00:00 -0500","original":"3/1/1995 ","granularity":"day","time":"1995/03/01 00:00:00 -0500"},"geo_score":0.924,"strstate":"TX","conversion":1,"type_store":"Supercenter","opendate":{"end_time":"1983/04/06 00:00:00 -0500","original":"4/5/1983 ","granularity":"day","time":"1983/04/05 00:00:00 -0500"},"id":"a61znt1xl0rh","geo_precision":"range","storenum":508,"strcity":"Kerrville"},"type":"Feature","geometry":{"type":"Point","coordinates":[-99.168143,30.060845]}},{"properties":{"st":"13","streetaddr":"400 SHALLOWFORD ROAD","zipcode":"30504","county":"139","date_super":{"end_time":"1994/03/02 00:00:00 -0500","original":"3/1/1994 ","granularity":"day","time":"1994/03/01 00:00:00 -0500"},"geo_score":0.952,"strstate":"GA","conversion":1,"type_store":"Supercenter","opendate":{"end_time":"1983/08/17 00:00:00 -0400","original":"8/16/1983 ","granularity":"day","time":"1983/08/16 00:00:00 -0400"},"id":"a61znszsn6zj","geo_precision":"range","storenum":510,"strcity":"Gainsville"},"type":"Feature","geometry":{"type":"Point","coordinates":[-83.847351,34.292711]}},{"properties":{"st":"45","streetaddr":"1283 BROAD ST","zipcode":"29150","county":"085","date_super":{"end_time":"2003/05/22 00:00:00 -0400","original":"5/21/2003 ","granularity":"day","time":"2003/05/21 00:00:00 -0400"},"geo_score":0.946,"strstate":"SC","conversion":1,"type_store":"Supercenter","opendate":{"end_time":"1981/07/05 00:00:00 -0400","original":"7/4/1981 ","granularity":"day","time":"1981/07/04 00:00:00 -0400"},"id":"a61znt36rro1","geo_precision":"range","storenum":511,"strcity":"Sumter"},"type":"Feature","geometry":{"type":"Point","coordinates":[-80.388897,33.956907]}},{"properties":{"st":"48","streetaddr":"10727 GATEWAY BLVD WEST","zipcode":"79935","county":"141","date_super":{"end_time":"2003/08/21 00:00:00 -0400","original":"8/20/2003 ","granularity":"day","time":"2003/08/20 00:00:00 -0400"},"geo_score":1.0,"strstate":"TX","conversion":1,"type_store":"Supercenter","opendate":{"end_time":"1984/08/03 00:00:00 -0400","original":"8/2/1984 ","granularity":"day","time":"1984/08/02 00:00:00 -0400"},"id":"a61znt8yd790","geo_precision":"range","storenum":512,"strcity":"El Paso"},"type":"Feature","geometry":{"type":"Point","coordinates":[-106.341143,31.750407]}},{"properties":{"st":"48","streetaddr":"201 WEST MARCY","zipcode":"79720","county":"227","date_super":{"end_time":"1995/03/02 00:00:00 -0500","original":"3/1/1995 ","granularity":"day","time":"1995/03/01 00:00:00 -0500"},"geo_score":0.882,"strstate":"TX","conversion":1,"type_store":"Supercenter","opendate":{"end_time":"1983/08/17 00:00:00 -0400","original":"8/16/1983 ","granularity":"day","time":"1983/08/16 00:00:00 -0400"},"id":"a61znt4nak7f","geo_precision":"range","storenum":513,"strcity":"Big Spring"},"type":"Feature","geometry":{"type":"Point","coordinates":[-101.471059,32.229209]}},{"properties":{"st":"45","streetaddr":"2035 WHISKEY ROAD","zipcode":"29803","county":"003","date_super":{"end_time":"1995/03/02 00:00:00 -0500","original":"3/1/1995 ","granularity":"day","time":"1995/03/01 00:00:00 -0500"},"geo_score":0.913,"strstate":"SC","conversion":1,"type_store":"Supercenter","opendate":{"end_time":"1981/07/05 00:00:00 -0400","original":"7/4/1981 ","granularity":"day","time":"1981/07/04 00:00:00 -0400"},"id":"a61znsvtinvy","geo_precision":"range","storenum":514,"strcity":"Aiken"},"type":"Feature","geometry":{"type":"Point","coordinates":[-81.715023,33.51502]}},{"properties":{"st":"37","streetaddr":"2330 HIGHWAY 19","zipcode":"28906","county":"039","date_super":{"end_time":"2000/03/02 00:00:00 -0500","original":"3/1/2000 ","granularity":"day","time":"2000/03/01 00:00:00 -0500"},"geo_score":0.819,"strstate":"NC","conversion":1,"type_store":"Supercenter","opendate":{"end_time":"1983/08/17 00:00:00 -0400","original":"8/16/1983 ","granularity":"day","time":"1983/08/16 00:00:00 -0400"},"id":"a61znt3i9354","geo_precision":"range","storenum":515,"strcity":"Murphy"},"type":"Feature","geometry":{"type":"Point","coordinates":[-84.08839,35.039986]}},{"properties":{"st":"48","streetaddr":"1200 WEST MAIN","zipcode":"75156","county":"213","date_super":{"end_time":"1994/03/02 00:00:00 -0500","original":"3/1/1994 ","granularity":"day","time":"1994/03/01 00:00:00 -0500"},"geo_score":0.719,"strstate":"TX","conversion":1,"type_store":"Supercenter","opendate":{"end_time":"1983/10/05 00:00:00 -0400","original":"10/4/1983 ","granularity":"day","time":"1983/10/04 00:00:00 -0400"},"id":"a61znt3qyfw4","geo_precision":"range","storenum":516,"strcity":"Gun Barrel City"},"type":"Feature","geometry":{"type":"Point","coordinates":[-96.129007,32.330886]}},{"properties":{"st":"40","streetaddr":"951 EAST STATE HWY 152","zipcode":"73064","county":"017","date_super":{"end_time":"2003/05/22 00:00:00 -0400","original":"5/21/2003 ","granularity":"day","time":"2003/05/21 00:00:00 -0400"},"geo_score":0.976,"strstate":"OK","conversion":1,"type_store":"Supercenter","opendate":{"end_time":"1983/08/03 00:00:00 -0400","original":"8/2/1983 ","granularity":"day","time":"1983/08/02 00:00:00 -0400"},"id":"a61znt32rrcp","geo_precision":"range","storenum":517,"strcity":"Mustang"},"type":"Feature","geometry":{"type":"Point","coordinates":[-97.743945,35.391724]}},{"properties":{"st":"13","streetaddr":"1550 RIVERSTONE PWKY","zipcode":"30114","county":"057","date_super":{"end_time":"1996/03/02 00:00:00 -0500","original":"3/1/1996 ","granularity":"day","time":"1996/03/01 00:00:00 -0500"},"geo_score":0.897,"strstate":"GA","conversion":1,"type_store":"Supercenter","opendate":{"end_time":"1983/11/02 00:00:00 -0500","original":"11/1/1983 ","granularity":"day","time":"1983/11/01 00:00:00 -0500"},"id":"a61znt2efanp","geo_precision":"range","storenum":518,"strcity":"Canton"},"type":"Feature","geometry":{"type":"Point","coordinates":[-84.464221,34.257931]}},{"properties":{"st":"21","streetaddr":"900 SOUTH COLLEGE","zipcode":"40330","county":"167","date_super":null,"geo_score":0.862,"strstate":"KY","conversion":null,"type_store":"Wal-Mart","opendate":{"end_time":"1983/11/02 00:00:00 -0500","original":"11/1/1983 ","granularity":"day","time":"1983/11/01 00:00:00 -0500"},"id":"a61znt8d6pka","geo_precision":"range","storenum":519,"strcity":"Harrodsburg"},"type":"Feature","geometry":{"type":"Point","coordinates":[-84.841483,37.745066]}},{"properties":{"st":"13","streetaddr":"440 ATLANTA HWY N.W.","zipcode":"30680","county":"013","date_super":{"end_time":"2002/02/21 00:00:00 -0500","original":"2/20/2002 ","granularity":"day","time":"2002/02/20 00:00:00 -0500"},"geo_score":0.507,"strstate":"GA","conversion":1,"type_store":"Supercenter","opendate":{"end_time":"1984/02/02 00:00:00 -0500","original":"2/1/1984 ","granularity":"day","time":"1984/02/01 00:00:00 -0500"},"id":"a61znsu4mkfv","geo_precision":"street","storenum":520,"strcity":"Winder"},"type":"Feature","geometry":{"type":"Point","coordinates":[-83.804245,34.002518]}},{"properties":{"st":"22","streetaddr":"2500 N. MARTIN LUTHER KING HWY","zipcode":"70601","county":"019","date_super":{"end_time":"2003/03/20 00:00:00 -0500","original":"3/19/2003 ","granularity":"day","time":"2003/03/19 00:00:00 -0500"},"geo_score":0.532,"strstate":"LA","conversion":1,"type_store":"Supercenter","opendate":{"end_time":"1984/03/21 00:00:00 -0500","original":"3/20/1984 ","granularity":"day","time":"1984/03/20 00:00:00 -0500"},"id":"a61znt1pe3bc","geo_precision":"street","storenum":521,"strcity":"Moss Bluff"},"type":"Feature","geometry":{"type":"Point","coordinates":[-93.184715,30.231258]}},{"properties":{"st":"48","streetaddr":"14215 FM 2100","zipcode":"77532","county":"201","date_super":{"end_time":"2004/04/15 00:00:00 -0400","original":"4/14/2004 ","granularity":"day","time":"2004/04/14 00:00:00 -0400"},"geo_score":0.916,"strstate":"TX","conversion":1,"type_store":"Supercenter","opendate":{"end_time":"1984/03/21 00:00:00 -0500","original":"3/20/1984 ","granularity":"day","time":"1984/03/20 00:00:00 -0500"},"id":"a61znt69hr8n","geo_precision":"range","storenum":522,"strcity":"Crosby"},"type":"Feature","geometry":{"type":"Point","coordinates":[-95.063361,29.893088]}},{"properties":{"st":"48","streetaddr":"423 W LOOP 436","zipcode":"75633","county":"365","date_super":null,"geo_score":0.342,"strstate":"TX","conversion":null,"type_store":"Wal-Mart","opendate":{"end_time":"1983/11/30 00:00:00 -0500","original":"11/29/1983 ","granularity":"day","time":"1983/11/29 00:00:00 -0500"},"id":"a61znt4zejja","geo_precision":"street","storenum":523,"strcity":"Carthage"},"type":"Feature","geometry":{"type":"Point","coordinates":[-94.79262,32.012645]}},{"properties":{"st":"48","streetaddr":"337 N SUNSET","zipcode":"78119","county":"255","date_super":null,"geo_score":0.544,"strstate":"TX","conversion":null,"type_store":"Wal-Mart","opendate":{"end_time":"1983/08/17 00:00:00 -0400","original":"8/16/1983 ","granularity":"day","time":"1983/08/16 00:00:00 -0400"},"id":"a61znt4rm311","geo_precision":"street","storenum":524,"strcity":"Kenedy"},"type":"Feature","geometry":{"type":"Point","coordinates":[-97.856529,28.826352]}},{"properties":{"st":"21","streetaddr":"3706 DIANN MARIE ROAD","zipcode":"40241","county":"111","date_super":{"end_time":"1997/03/02 00:00:00 -0500","original":"3/1/1997 ","granularity":"day","time":"1997/03/01 00:00:00 -0500"},"geo_score":0.984,"strstate":"KY","conversion":1,"type_store":"Supercenter","opendate":{"end_time":"1983/05/25 00:00:00 -0400","original":"5/24/1983 ","granularity":"day","time":"1983/05/24 00:00:00 -0400"},"id":"a61znsus1lh6","geo_precision":"range","storenum":526,"strcity":"Louisville (NE)"},"type":"Feature","geometry":{"type":"Point","coordinates":[-85.542865,38.299554]}},{"properties":{"st":"48","streetaddr":"1801 N VELASCO","zipcode":"77515","county":"039","date_super":{"end_time":"1994/03/02 00:00:00 -0500","original":"3/1/1994 ","granularity":"day","time":"1994/03/01 00:00:00 -0500"},"geo_score":0.852,"strstate":"TX","conversion":1,"type_store":"Supercenter","opendate":{"end_time":"1983/05/04 00:00:00 -0400","original":"5/3/1983 ","granularity":"day","time":"1983/05/03 00:00:00 -0400"},"id":"a61znta2rkom","geo_precision":"range","storenum":527,"strcity":"Angleton"},"type":"Feature","geometry":{"type":"Point","coordinates":[-95.433791,29.194918]}},{"properties":{"st":"12","streetaddr":"2911 53RD AVENUE EAST","zipcode":"34203","county":"081","date_super":{"end_time":"1997/03/02 00:00:00 -0500","original":"3/1/1997 ","granularity":"day","time":"1997/03/01 00:00:00 -0500"},"geo_score":0.917,"strstate":"FL","conversion":1,"type_store":"Supercenter","opendate":{"end_time":"1983/05/18 00:00:00 -0400","original":"5/17/1983 ","granularity":"day","time":"1983/05/17 00:00:00 -0400"},"id":"a61znsvuhc2o","geo_precision":"range","storenum":528,"strcity":"Brandenton"},"type":"Feature","geometry":{"type":"Point","coordinates":[-82.531243,27.447422]}},{"properties":{"st":"48","streetaddr":"6410 I-45","zipcode":"77568","county":"167","date_super":{"end_time":"2003/04/17 00:00:00 -0400","original":"4/16/2003 ","granularity":"day","time":"2003/04/16 00:00:00 -0400"},"geo_score":0.913,"strstate":"TX","conversion":1,"type_store":"Supercenter","opendate":{"end_time":"1983/07/02 00:00:00 -0400","original":"7/1/1983 ","granularity":"day","time":"1983/07/01 00:00:00 -0400"},"id":"a61znszs7o6y","geo_precision":"range","storenum":529,"strcity":"Texas City"},"type":"Feature","geometry":{"type":"Point","coordinates":[-95.034303,29.403463]}},{"properties":{"st":"05","streetaddr":"2730 NORTHWEST AVE","zipcode":"71730","county":"139","date_super":{"end_time":"1996/03/02 00:00:00 -0500","original":"3/1/1996 ","granularity":"day","time":"1996/03/01 00:00:00 -0500"},"geo_score":0.493,"strstate":"AR","conversion":1,"type_store":"Supercenter","opendate":{"end_time":"1983/07/02 00:00:00 -0400","original":"7/1/1983 ","granularity":"day","time":"1983/07/01 00:00:00 -0400"},"id":"a61znt5sv60g","geo_precision":"street","storenum":530,"strcity":"El Dorado"},"type":"Feature","geometry":{"type":"Point","coordinates":[-92.157314,33.058821]}},{"properties":{"st":"22","streetaddr":"3142 AMBASSADOR CAFFERY PKWY","zipcode":"70506","county":"055","date_super":{"end_time":"2001/04/19 00:00:00 -0400","original":"4/18/2001 ","granularity":"day","time":"2001/04/18 00:00:00 -0400"},"geo_score":1.0,"strstate":"LA","conversion":1,"type_store":"Supercenter","opendate":{"end_time":"1985/03/06 00:00:00 -0500","original":"3/5/1985 ","granularity":"day","time":"1985/03/05 00:00:00 -0500"},"id":"a61znsx8wm35","geo_precision":"range","storenum":531,"strcity":"Lafayette"},"type":"Feature","geometry":{"type":"Point","coordinates":[-92.075017,30.187424]}},{"properties":{"st":"22","streetaddr":"308 N AIRLINE HWY","zipcode":"70737","county":"005","date_super":{"end_time":"2000/03/02 00:00:00 -0500","original":"3/1/2000 ","granularity":"day","time":"2000/03/01 00:00:00 -0500"},"geo_score":0.932,"strstate":"LA","conversion":1,"type_store":"Supercenter","opendate":{"end_time":"1983/07/02 00:00:00 -0400","original":"7/1/1983 ","granularity":"day","time":"1983/07/01 00:00:00 -0400"},"id":"a61znsy9tcxg","geo_precision":"range","storenum":532,"strcity":"Gonzales"},"type":"Feature","geometry":{"type":"Point","coordinates":[-90.910032,30.234462]}},{"properties":{"st":"22","streetaddr":"1205 E ADMIRAL DOYLE","zipcode":"70560","county":"045","date_super":{"end_time":"2002/03/02 00:00:00 -0500","original":"3/1/2002 ","granularity":"day","time":"2002/03/01 00:00:00 -0500"},"geo_score":0.763,"strstate":"LA","conversion":1,"type_store":"Supercenter","opendate":{"end_time":"1983/05/18 00:00:00 -0400","original":"5/17/1983 ","granularity":"day","time":"1983/05/17 00:00:00 -0400"},"id":"a61znt93jhiy","geo_precision":"range","storenum":533,"strcity":"New Iberia"},"type":"Feature","geometry":{"type":"Point","coordinates":[-91.814929,29.982547]}},{"properties":{"st":"22","streetaddr":"1229 NE EVANGELINE THRUWAY","zipcode":"70501","county":"055","date_super":{"end_time":"2000/03/02 00:00:00 -0500","original":"3/1/2000 ","granularity":"day","time":"2000/03/01 00:00:00 -0500"},"geo_score":0.985,"strstate":"LA","conversion":1,"type_store":"Supercenter","opendate":{"end_time":"1983/05/18 00:00:00 -0400","original":"5/17/1983 ","granularity":"day","time":"1983/05/17 00:00:00 -0400"},"id":"a61znt958934","geo_precision":"range","storenum":534,"strcity":"Lafayette"},"type":"Feature","geometry":{"type":"Point","coordinates":[-92.006586,30.219494]}},{"properties":{"st":"48","streetaddr":"4350 SOUTHWEST DR","zipcode":"79606","county":"441","date_super":{"end_time":"1996/03/02 00:00:00 -0500","original":"3/1/1996 ","granularity":"day","time":"1996/03/01 00:00:00 -0500"},"geo_score":0.814,"strstate":"TX","conversion":1,"type_store":"Supercenter","opendate":{"end_time":"1983/05/04 00:00:00 -0400","original":"5/3/1983 ","granularity":"day","time":"1983/05/03 00:00:00 -0400"},"id":"a61znswdo2iv","geo_precision":"range","storenum":535,"strcity":"Abilene"},"type":"Feature","geometry":{"type":"Point","coordinates":[-99.779479,32.409405]}},{"properties":{"st":"48","streetaddr":"1650 STATE HWY 351","zipcode":"79601","county":"441","date_super":{"end_time":"2005/08/25 00:00:00 -0400","original":"8/24/2005 ","granularity":"day","time":"2005/08/24 00:00:00 -0400"},"geo_score":0.902,"strstate":"TX","conversion":1,"type_store":"Supercenter","opendate":{"end_time":"1983/05/04 00:00:00 -0400","original":"5/3/1983 ","granularity":"day","time":"1983/05/03 00:00:00 -0400"},"id":"a61znt750911","geo_precision":"range","storenum":536,"strcity":"Abilene"},"type":"Feature","geometry":{"type":"Point","coordinates":[-99.698151,32.478166]}},{"properties":{"st":"48","streetaddr":"4210 JOHN BEN SHEPHERD PKWY","zipcode":"79762","county":"135","date_super":{"end_time":"1994/03/02 00:00:00 -0500","original":"3/1/1994 ","granularity":"day","time":"1994/03/01 00:00:00 -0500"},"geo_score":0.985,"strstate":"TX","conversion":1,"type_store":"Supercenter","opendate":{"end_time":"1983/06/08 00:00:00 -0400","original":"6/7/1983 ","granularity":"day","time":"1983/06/07 00:00:00 -0400"},"id":"a61znsyfilbg","geo_precision":"range","storenum":537,"strcity":"Odessa"},"type":"Feature","geometry":{"type":"Point","coordinates":[-102.334183,31.893937]}},{"properties":{"st":"12","streetaddr":"2649 NW 13TH STREET","zipcode":"32609","county":"001","date_super":null,"geo_score":0.927,"strstate":"FL","conversion":null,"type_store":"Wal-Mart","opendate":{"end_time":"1983/05/18 00:00:00 -0400","original":"5/17/1983 ","granularity":"day","time":"1983/05/17 00:00:00 -0400"},"id":"a61znt739wtc","geo_precision":"range","storenum":538,"strcity":"Gainesville"},"type":"Feature","geometry":{"type":"Point","coordinates":[-82.339114,29.676986]}},{"properties":{"st":"22","streetaddr":"2050 NORTH MALL BLVD","zipcode":"71301","county":"079","date_super":{"end_time":"1999/03/02 00:00:00 -0500","original":"3/1/1999 ","granularity":"day","time":"1999/03/01 00:00:00 -0500"},"geo_score":0.782,"strstate":"LA","conversion":1,"type_store":"Supercenter","opendate":{"end_time":"1983/05/20 00:00:00 -0400","original":"5/19/1983 ","granularity":"day","time":"1983/05/19 00:00:00 -0400"},"id":"a61znta5q0m3","geo_precision":"range","storenum":539,"strcity":"Alexandria"},"type":"Feature","geometry":{"type":"Point","coordinates":[-92.452948,31.277148]}},{"properties":{"st":"22","streetaddr":"973 HWY 90 EAST","zipcode":"70380","county":"101","date_super":{"end_time":"1995/03/02 00:00:00 -0500","original":"3/1/1995 ","granularity":"day","time":"1995/03/01 00:00:00 -0500"},"geo_score":0.797,"strstate":"LA","conversion":1,"type_store":"Supercenter","opendate":{"end_time":"1983/05/18 00:00:00 -0400","original":"5/17/1983 ","granularity":"day","time":"1983/05/17 00:00:00 -0400"},"id":"a61znszjdyw7","geo_precision":"range","storenum":540,"strcity":"Bayou Vista"},"type":"Feature","geometry":{"type":"Point","coordinates":[-91.268275,29.681437]}},{"properties":{"st":"22","streetaddr":"880 N HWY 190","zipcode":"70433","county":"103","date_super":{"end_time":"1995/03/02 00:00:00 -0500","original":"3/1/1995 ","granularity":"day","time":"1995/03/01 00:00:00 -0500"},"geo_score":0.902,"strstate":"LA","conversion":1,"type_store":"Supercenter","opendate":{"end_time":"1983/10/05 00:00:00 -0400","original":"10/4/1983 ","granularity":"day","time":"1983/10/04 00:00:00 -0400"},"id":"a61znsx56fq4","geo_precision":"range","storenum":541,"strcity":"Covington"},"type":"Feature","geometry":{"type":"Point","coordinates":[-90.082389,30.443048]}},{"properties":{"st":"22","streetaddr":"1633 MARTIN LUTHER KING BLVD","zipcode":"70360","county":"109","date_super":{"end_time":"1996/03/02 00:00:00 -0500","original":"3/1/1996 ","granularity":"day","time":"1996/03/01 00:00:00 -0500"},"geo_score":0.927,"strstate":"LA","conversion":1,"type_store":"Supercenter","opendate":{"end_time":"1983/05/18 00:00:00 -0400","original":"5/17/1983 ","granularity":"day","time":"1983/05/17 00:00:00 -0400"},"id":"a61znt6rj89l","geo_precision":"range","storenum":542,"strcity":"Houma"},"type":"Feature","geometry":{"type":"Point","coordinates":[-90.751615,29.610503]}},{"properties":{"st":"22","streetaddr":"1629 EAST CRESSWELL LANE","zipcode":"70570","county":"097","date_super":{"end_time":"2002/04/18 00:00:00 -0400","original":"4/17/2002 ","granularity":"day","time":"2002/04/17 00:00:00 -0400"},"geo_score":0.878,"strstate":"LA","conversion":1,"type_store":"Supercenter","opendate":{"end_time":"1983/06/08 00:00:00 -0400","original":"6/7/1983 ","granularity":"day","time":"1983/06/07 00:00:00 -0400"},"id":"a61znsviuf1l","geo_precision":"range","storenum":543,"strcity":"Opelousas"},"type":"Feature","geometry":{"type":"Point","coordinates":[-92.070439,30.518942]}},{"properties":{"st":"40","streetaddr":"7500 EAST RENO","zipcode":"73110","county":"109","date_super":null,"geo_score":0.89,"strstate":"OK","conversion":null,"type_store":"Wal-Mart","opendate":{"end_time":"1983/07/02 00:00:00 -0400","original":"7/1/1983 ","granularity":"day","time":"1983/07/01 00:00:00 -0400"},"id":"a61znsuha30r","geo_precision":"range","storenum":544,"strcity":"Midwest City"},"type":"Feature","geometry":{"type":"Point","coordinates":[-97.39406,35.464057]}},{"properties":{"st":"21","streetaddr":"240 MANCHESTER SQUARE","zipcode":"40962","county":"051","date_super":null,"geo_score":0.659,"strstate":"KY","conversion":null,"type_store":"Wal-Mart","opendate":{"end_time":"1983/11/16 00:00:00 -0500","original":"11/15/1983 ","granularity":"day","time":"1983/11/15 00:00:00 -0500"},"id":"a61znt663maz","geo_precision":"range","storenum":545,"strcity":"Manchester"},"type":"Feature","geometry":{"type":"Point","coordinates":[-83.89083,36.871607]}},{"properties":{"st":"48","streetaddr":"5330 FM1640","zipcode":"77469","county":"157","date_super":{"end_time":"1993/03/02 00:00:00 -0500","original":"3/1/1993 ","granularity":"day","time":"1993/03/01 00:00:00 -0500"},"geo_score":0.707,"strstate":"TX","conversion":1,"type_store":"Supercenter","opendate":{"end_time":"1983/10/05 00:00:00 -0400","original":"10/4/1983 ","granularity":"day","time":"1983/10/04 00:00:00 -0400"},"id":"a61znt1mro8d","geo_precision":"range","storenum":546,"strcity":"Richmond"},"type":"Feature","geometry":{"type":"Point","coordinates":[-95.759419,29.480238]}},{"properties":{"st":"12","streetaddr":"2602 JIM REDMAN PARKWAY","zipcode":"33566","county":"057","date_super":{"end_time":"1997/03/02 00:00:00 -0500","original":"3/1/1997 ","granularity":"day","time":"1997/03/01 00:00:00 -0500"},"geo_score":0.385,"strstate":"FL","conversion":1,"type_store":"Supercenter","opendate":{"end_time":"1983/10/05 00:00:00 -0400","original":"10/4/1983 ","granularity":"day","time":"1983/10/04 00:00:00 -0400"},"id":"a61znt4szloo","geo_precision":"street","storenum":547,"strcity":"Plant City"},"type":"Feature","geometry":{"type":"Point","coordinates":[-82.55324,28.18167]}},{"properties":{"st":"13","streetaddr":"630 COLLINS HILL RD","zipcode":"30045","county":"135","date_super":{"end_time":"2004/03/02 00:00:00 -0500","original":"3/1/2004 ","granularity":"day","time":"2004/03/01 00:00:00 -0500"},"geo_score":1.0,"strstate":"GA","conversion":1,"type_store":"Supercenter","opendate":{"end_time":"1983/10/19 00:00:00 -0400","original":"10/18/1983 ","granularity":"day","time":"1983/10/18 00:00:00 -0400"},"id":"a61znt9gwi2k","geo_precision":"range","storenum":548,"strcity":"Lawrenceville"},"type":"Feature","geometry":{"type":"Point","coordinates":[-83.993228,33.97314]}},{"properties":{"st":"35","streetaddr":"3800 LOVINGTON HWY","zipcode":"88240","county":"025","date_super":{"end_time":"2002/02/21 00:00:00 -0500","original":"2/20/2002 ","granularity":"day","time":"2002/02/20 00:00:00 -0500"},"geo_score":0.88,"strstate":"NM","conversion":1,"type_store":"Supercenter","opendate":{"end_time":"1983/10/17 00:00:00 -0400","original":"10/16/1983 ","granularity":"day","time":"1983/10/16 00:00:00 -0400"},"id":"a61znt6iet2r","geo_precision":"range","storenum":549,"strcity":"Hobbs"},"type":"Feature","geometry":{"type":"Point","coordinates":[-103.161193,32.740598]}},{"properties":{"st":"17","streetaddr":"2610 WEST HAVEN ROAD","zipcode":"62439","county":"101","date_super":null,"geo_score":0.917,"strstate":"IL","conversion":null,"type_store":"Wal-Mart","opendate":{"end_time":"1984/02/02 00:00:00 -0500","original":"2/1/1984 ","granularity":"day","time":"1984/02/01 00:00:00 -0500"},"id":"a61znt2eq66o","geo_precision":"range","storenum":550,"strcity":"Lawrenceville"},"type":"Feature","geometry":{"type":"Point","coordinates":[-87.699188,38.727794]}},{"properties":{"st":"12","streetaddr":"1024 SO. STATE ROAD #19","zipcode":"32177","county":"107","date_super":{"end_time":"2002/10/17 00:00:00 -0400","original":"10/16/2002 ","granularity":"day","time":"2002/10/16 00:00:00 -0400"},"geo_score":0.554,"strstate":"FL","conversion":1,"type_store":"Supercenter","opendate":{"end_time":"1984/10/24 00:00:00 -0400","original":"10/23/1984 ","granularity":"day","time":"1984/10/23 00:00:00 -0400"},"id":"a61znt74pi6w","geo_precision":"street","storenum":551,"strcity":"Palatka"},"type":"Feature","geometry":{"type":"Point","coordinates":[-81.65351,29.63082]}},{"properties":{"st":"21","streetaddr":"350 WHITESBURG PLAZA","zipcode":"41858","county":"133","date_super":null,"geo_score":0.624,"strstate":"KY","conversion":null,"type_store":"Wal-Mart","opendate":{"end_time":"1984/10/17 00:00:00 -0400","original":"10/16/1984 ","granularity":"day","time":"1984/10/16 00:00:00 -0400"},"id":"a61znt5a1818","geo_precision":"zip","storenum":552,"strcity":"Whitesburg"},"type":"Feature","geometry":{"type":"Point","coordinates":[-82.851271,37.119542]}},{"properties":{"st":"22","streetaddr":"39142 NATCHEZ DRIVE","zipcode":"70461","county":"103","date_super":{"end_time":"2004/01/29 00:00:00 -0500","original":"1/28/2004 ","granularity":"day","time":"2004/01/28 00:00:00 -0500"},"geo_score":0.807,"strstate":"LA","conversion":1,"type_store":"Supercenter","opendate":{"end_time":"1983/05/18 00:00:00 -0400","original":"5/17/1983 ","granularity":"day","time":"1983/05/17 00:00:00 -0400"},"id":"a61znt4l1cor","geo_precision":"street","storenum":553,"strcity":"Slidell"},"type":"Feature","geometry":{"type":"Point","coordinates":[-89.746259,30.281329]}},{"properties":{"st":"48","streetaddr":"5610 SAN BERNARDO AVE","zipcode":"78041","county":"479","date_super":null,"geo_score":1.0,"strstate":"TX","conversion":null,"type_store":"Wal-Mart","opendate":{"end_time":"1983/06/08 00:00:00 -0400","original":"6/7/1983 ","granularity":"day","time":"1983/06/07 00:00:00 -0400"},"id":"a61znsy1usf6","geo_precision":"range","storenum":554,"strcity":"Laredo"},"type":"Feature","geometry":{"type":"Point","coordinates":[-99.504215,27.553054]}},{"properties":{"st":"13","streetaddr":"2101 VETERANS BLVD","zipcode":"31021","county":"175","date_super":null,"geo_score":0.732,"strstate":"GA","conversion":null,"type_store":"Wal-Mart","opendate":{"end_time":"1983/07/02 00:00:00 -0400","original":"7/1/1983 ","granularity":"day","time":"1983/07/01 00:00:00 -0400"},"id":"a61znt2ar0wu","geo_precision":"street","storenum":555,"strcity":"Dublin"},"type":"Feature","geometry":{"type":"Point","coordinates":[-82.959954,32.54338]}},{"properties":{"st":"13","streetaddr":"2425 MEMORIAL DRIVE","zipcode":"31501","county":"299","date_super":{"end_time":"1996/03/02 00:00:00 -0500","original":"3/1/1996 ","granularity":"day","time":"1996/03/01 00:00:00 -0500"},"geo_score":0.718,"strstate":"GA","conversion":1,"type_store":"Supercenter","opendate":{"end_time":"1983/07/02 00:00:00 -0400","original":"7/1/1983 ","granularity":"day","time":"1983/07/01 00:00:00 -0400"},"id":"a61znt56hah9","geo_precision":"street","storenum":556,"strcity":"Waycross"},"type":"Feature","geometry":{"type":"Point","coordinates":[-82.333624,31.20355]}},{"properties":{"st":"20","streetaddr":"2301 INDUSTRIAL ROAD","zipcode":"66801","county":"111","date_super":{"end_time":"2000/03/02 00:00:00 -0500","original":"3/1/2000 ","granularity":"day","time":"2000/03/01 00:00:00 -0500"},"geo_score":0.915,"strstate":"KS","conversion":1,"type_store":"Supercenter","opendate":{"end_time":"1983/06/08 00:00:00 -0400","original":"6/7/1983 ","granularity":"day","time":"1983/06/07 00:00:00 -0400"},"id":"a61znt8t1gjs","geo_precision":"range","storenum":557,"strcity":"Emporia"},"type":"Feature","geometry":{"type":"Point","coordinates":[-96.217062,38.425862]}},{"properties":{"st":"20","streetaddr":"2900 SOUTH 9TH ST","zipcode":"67401","county":"169","date_super":{"end_time":"1999/03/02 00:00:00 -0500","original":"3/1/1999 ","granularity":"day","time":"1999/03/01 00:00:00 -0500"},"geo_score":0.805,"strstate":"KS","conversion":1,"type_store":"Supercenter","opendate":{"end_time":"1983/06/08 00:00:00 -0400","original":"6/7/1983 ","granularity":"day","time":"1983/06/07 00:00:00 -0400"},"id":"a61znt6qog4s","geo_precision":"range","storenum":558,"strcity":"Salina"},"type":"Feature","geometry":{"type":"Point","coordinates":[-97.612864,38.785894]}},{"properties":{"st":"19","streetaddr":"3003 NORTH HWY 61","zipcode":"52761","county":"139","date_super":{"end_time":"1997/03/02 00:00:00 -0500","original":"3/1/1997 ","granularity":"day","time":"1997/03/01 00:00:00 -0500"},"geo_score":0.838,"strstate":"IA","conversion":1,"type_store":"Supercenter","opendate":{"end_time":"1983/07/02 00:00:00 -0400","original":"7/1/1983 ","granularity":"day","time":"1983/07/01 00:00:00 -0400"},"id":"a61znsvilc89","geo_precision":"range","storenum":559,"strcity":"Muscatine"},"type":"Feature","geometry":{"type":"Point","coordinates":[-91.0861,41.392696]}},{"properties":{"st":"29","streetaddr":"4201 N BELT HIGHWAY","zipcode":"64506","county":"021","date_super":{"end_time":"1995/03/02 00:00:00 -0500","original":"3/1/1995 ","granularity":"day","time":"1995/03/01 00:00:00 -0500"},"geo_score":0.912,"strstate":"MO","conversion":1,"type_store":"Supercenter","opendate":{"end_time":"1983/07/02 00:00:00 -0400","original":"7/1/1983 ","granularity":"day","time":"1983/07/01 00:00:00 -0400"},"id":"a61znswhjius","geo_precision":"range","storenum":560,"strcity":"St. Joseph"},"type":"Feature","geometry":{"type":"Point","coordinates":[-94.814994,39.802308]}},{"properties":{"st":"48","streetaddr":"1410 E. MAIN ST.","zipcode":"76448","county":"133","date_super":{"end_time":"2005/10/27 00:00:00 -0400","original":"10/26/2005 ","granularity":"day","time":"2005/10/26 00:00:00 -0400"},"geo_score":0.543,"strstate":"TX","conversion":1,"type_store":"Supercenter","opendate":{"end_time":"1983/10/05 00:00:00 -0400","original":"10/4/1983 ","granularity":"day","time":"1983/10/04 00:00:00 -0400"},"id":"a61znsy7ahzh","geo_precision":"street","storenum":561,"strcity":"Eastland"},"type":"Feature","geometry":{"type":"Point","coordinates":[-98.816396,32.401764]}},{"properties":{"st":"01","streetaddr":"8551 WHITFIELD AVE","zipcode":"35094","county":"115","date_super":{"end_time":"2000/03/02 00:00:00 -0500","original":"3/1/2000 ","granularity":"day","time":"2000/03/01 00:00:00 -0500"},"geo_score":0.634,"strstate":"AL","conversion":1,"type_store":"Supercenter","opendate":{"end_time":"1983/11/02 00:00:00 -0500","original":"11/1/1983 ","granularity":"day","time":"1983/11/01 00:00:00 -0500"},"id":"a61znt1fqx9b","geo_precision":"street","storenum":562,"strcity":"Leeds"},"type":"Feature","geometry":{"type":"Point","coordinates":[-86.523268,33.557955]}},{"properties":{"st":"12","streetaddr":"2400 VETERANS MEMORIAL PRKWY","zipcode":"32763","county":"127","date_super":{"end_time":"2001/03/15 00:00:00 -0500","original":"3/14/2001 ","granularity":"day","time":"2001/03/14 00:00:00 -0500"},"geo_score":0.954,"strstate":"FL","conversion":1,"type_store":"Supercenter","opendate":{"end_time":"1983/10/19 00:00:00 -0400","original":"10/18/1983 ","granularity":"day","time":"1983/10/18 00:00:00 -0400"},"id":"a61znt1hxo9l","geo_precision":"range","storenum":563,"strcity":"Orange City"},"type":"Feature","geometry":{"type":"Point","coordinates":[-81.281504,28.913389]}},{"properties":{"st":"40","streetaddr":"6100 WEST RENO AVE","zipcode":"73127","county":"109","date_super":{"end_time":"1998/03/02 00:00:00 -0500","original":"3/1/1998 ","granularity":"day","time":"1998/03/01 00:00:00 -0500"},"geo_score":1.0,"strstate":"OK","conversion":1,"type_store":"Supercenter","opendate":{"end_time":"1983/11/02 00:00:00 -0500","original":"11/1/1983 ","granularity":"day","time":"1983/11/01 00:00:00 -0500"},"id":"a61znswilz1s","geo_precision":"range","storenum":564,"strcity":"Oklahoma City"},"type":"Feature","geometry":{"type":"Point","coordinates":[-97.622242,35.464166]}},{"properties":{"st":"48","streetaddr":"3801 WEST HWY 31","zipcode":"75110","county":"349","date_super":{"end_time":"2003/08/21 00:00:00 -0400","original":"8/20/2003 ","granularity":"day","time":"2003/08/20 00:00:00 -0400"},"geo_score":0.902,"strstate":"TX","conversion":1,"type_store":"Supercenter","opendate":{"end_time":"1983/10/19 00:00:00 -0400","original":"10/18/1983 ","granularity":"day","time":"1983/10/18 00:00:00 -0400"},"id":"a61znt34gr8c","geo_precision":"range","storenum":565,"strcity":"Corsicana"},"type":"Feature","geometry":{"type":"Point","coordinates":[-96.506518,32.069187]}},{"properties":{"st":"18","streetaddr":"1115 AMERICAN WAY","zipcode":"47601","county":"173","date_super":{"end_time":"2004/01/29 00:00:00 -0500","original":"1/28/2004 ","granularity":"day","time":"2004/01/28 00:00:00 -0500"},"geo_score":0.744,"strstate":"IN","conversion":1,"type_store":"Supercenter","opendate":{"end_time":"1984/03/07 00:00:00 -0500","original":"3/6/1984 ","granularity":"day","time":"1984/03/06 00:00:00 -0500"},"id":"a61znsym11d5","geo_precision":"street","storenum":566,"strcity":"Boonville"},"type":"Feature","geometry":{"type":"Point","coordinates":[-87.305445,38.051493]}},{"properties":{"st":"48","streetaddr":"475 STATE HIGHWAY 36 N","zipcode":"77836","county":"051","date_super":null,"geo_score":0.876,"strstate":"TX","conversion":null,"type_store":"Wal-Mart","opendate":{"end_time":"1984/04/04 00:00:00 -0500","original":"4/3/1984 ","granularity":"day","time":"1984/04/03 00:00:00 -0500"},"id":"a61znt68tpfd","geo_precision":"range","storenum":567,"strcity":"Caldwell"},"type":"Feature","geometry":{"type":"Point","coordinates":[-96.687323,30.531067]}},{"properties":{"st":"47","streetaddr":"59 DIXON SPRINGS HIGHWAY","zipcode":"37030","county":"159","date_super":null,"geo_score":0.912,"strstate":"TN","conversion":null,"type_store":"Wal-Mart","opendate":{"end_time":"1984/05/02 00:00:00 -0400","original":"5/1/1984 ","granularity":"day","time":"1984/05/01 00:00:00 -0400"},"id":"a61znt1r0876","geo_precision":"range","storenum":568,"strcity":"Carthage"},"type":"Feature","geometry":{"type":"Point","coordinates":[-85.95489,36.262909]}},{"properties":{"st":"21","streetaddr":"809 JAMESTOWN STREET","zipcode":"42728","county":"001","date_super":null,"geo_score":0.656,"strstate":"KY","conversion":null,"type_store":"Wal-Mart","opendate":{"end_time":"1984/11/30 00:00:00 -0500","original":"11/29/1984 ","granularity":"day","time":"1984/11/29 00:00:00 -0500"},"id":"a61znt0jdfb0","geo_precision":"street","storenum":569,"strcity":"Columbia"},"type":"Feature","geometry":{"type":"Point","coordinates":[-85.302253,37.096866]}},{"properties":{"st":"21","streetaddr":"112 OSBORNE WAY","zipcode":"40324","county":"209","date_super":{"end_time":"2002/02/21 00:00:00 -0500","original":"2/20/2002 ","granularity":"day","time":"2002/02/20 00:00:00 -0500"},"geo_score":0.902,"strstate":"KY","conversion":1,"type_store":"Supercenter","opendate":{"end_time":"1984/04/04 00:00:00 -0500","original":"4/3/1984 ","granularity":"day","time":"1984/04/03 00:00:00 -0500"},"id":"a61znt61anh8","geo_precision":"range","storenum":571,"strcity":"Georgetown"},"type":"Feature","geometry":{"type":"Point","coordinates":[-84.536161,38.231379]}},{"properties":{"st":"48","streetaddr":"1201 STONE STREET","zipcode":"75662","county":"183","date_super":{"end_time":"2003/03/20 00:00:00 -0500","original":"3/19/2003 ","granularity":"day","time":"2003/03/19 00:00:00 -0500"},"geo_score":0.84,"strstate":"TX","conversion":1,"type_store":"Supercenter","opendate":{"end_time":"1984/06/06 00:00:00 -0400","original":"6/5/1984 ","granularity":"day","time":"1984/06/05 00:00:00 -0400"},"id":"a61znt1ldxfq","geo_precision":"range","storenum":572,"strcity":"Kilgore"},"type":"Feature","geometry":{"type":"Point","coordinates":[-94.866577,32.391981]}},{"properties":{"st":"29","streetaddr":"1000 NE SAM WALTON LANE","zipcode":"64086","county":"095","date_super":{"end_time":"2001/06/28 00:00:00 -0400","original":"6/27/2001 ","granularity":"day","time":"2001/06/27 00:00:00 -0400"},"geo_score":1.0,"strstate":"MO","conversion":1,"type_store":"Supercenter","opendate":{"end_time":"1984/04/04 00:00:00 -0500","original":"4/3/1984 ","granularity":"day","time":"1984/04/03 00:00:00 -0500"},"id":"a61znt7bfdif","geo_precision":"range","storenum":573,"strcity":"Lee's Summit"},"type":"Feature","geometry":{"type":"Point","coordinates":[-94.362485,38.931145]}},{"properties":{"st":"45","streetaddr":"2751 BEAVER RUN BLVD","zipcode":"29575","county":"051","date_super":{"end_time":"1996/03/02 00:00:00 -0500","original":"3/1/1996 ","granularity":"day","time":"1996/03/01 00:00:00 -0500"},"geo_score":1.0,"strstate":"SC","conversion":1,"type_store":"Supercenter","opendate":{"end_time":"1984/06/30 00:00:00 -0400","original":"6/29/1984 ","granularity":"day","time":"1984/06/29 00:00:00 -0400"},"id":"a61znszizlt8","geo_precision":"range","storenum":574,"strcity":"Surfside Beach"},"type":"Feature","geometry":{"type":"Point","coordinates":[-78.983347,33.644416]}},{"properties":{"st":"13","streetaddr":"12182 HWY 92","zipcode":"30188","county":"057","date_super":{"end_time":"2004/05/20 00:00:00 -0400","original":"5/19/2004 ","granularity":"day","time":"2004/05/19 00:00:00 -0400"},"geo_score":0.767,"strstate":"GA","conversion":1,"type_store":"Supercenter","opendate":{"end_time":"1984/05/23 00:00:00 -0400","original":"5/22/1984 ","granularity":"day","time":"1984/05/22 00:00:00 -0400"},"id":"a61znt69ii2l","geo_precision":"range","storenum":575,"strcity":"Woodstock"},"type":"Feature","geometry":{"type":"Point","coordinates":[-84.481259,34.087324]}},{"properties":{"st":"40","streetaddr":"207 S MEMORIAL DRIVE","zipcode":"74112","county":"143","date_super":{"end_time":"1994/03/02 00:00:00 -0500","original":"3/1/1994 ","granularity":"day","time":"1994/03/01 00:00:00 -0500"},"geo_score":0.902,"strstate":"OK","conversion":1,"type_store":"Supercenter","opendate":{"end_time":"1983/10/05 00:00:00 -0400","original":"10/4/1983 ","granularity":"day","time":"1983/10/04 00:00:00 -0400"},"id":"a61znt8wls3b","geo_precision":"range","storenum":576,"strcity":"Tulsa"},"type":"Feature","geometry":{"type":"Point","coordinates":[-95.886698,36.159688]}},{"properties":{"st":"20","streetaddr":"13600 S. ALDEN ST.","zipcode":"66062","county":"091","date_super":{"end_time":"2001/07/12 00:00:00 -0400","original":"7/11/2001 ","granularity":"day","time":"2001/07/11 00:00:00 -0400"},"geo_score":0.633,"strstate":"KS","conversion":1,"type_store":"Supercenter","opendate":{"end_time":"1984/08/03 00:00:00 -0400","original":"8/2/1984 ","granularity":"day","time":"1984/08/02 00:00:00 -0400"},"id":"a61znszobbpg","geo_precision":"street","storenum":577,"strcity":"Olathe"},"type":"Feature","geometry":{"type":"Point","coordinates":[-94.757144,38.919328]}},{"properties":{"st":"47","streetaddr":"1414 PARKWAY","zipcode":"37862","county":"155","date_super":{"end_time":"1995/03/02 00:00:00 -0500","original":"3/1/1995 ","granularity":"day","time":"1995/03/01 00:00:00 -0500"},"geo_score":0.795,"strstate":"TN","conversion":1,"type_store":"Supercenter","opendate":{"end_time":"1983/10/19 00:00:00 -0400","original":"10/18/1983 ","granularity":"day","time":"1983/10/18 00:00:00 -0400"},"id":"a61znt76c2it","geo_precision":"range","storenum":578,"strcity":"Sevierville"},"type":"Feature","geometry":{"type":"Point","coordinates":[-83.570793,35.839894]}},{"properties":{"st":"12","streetaddr":"2355 US HWY #1SOUTH","zipcode":"32086","county":"109","date_super":{"end_time":"1997/03/02 00:00:00 -0500","original":"3/1/1997 ","granularity":"day","time":"1997/03/01 00:00:00 -0500"},"geo_score":0.868,"strstate":"FL","conversion":1,"type_store":"Supercenter","opendate":{"end_time":"1983/11/30 00:00:00 -0500","original":"11/29/1983 ","granularity":"day","time":"1983/11/29 00:00:00 -0500"},"id":"a61znsyv3v9v","geo_precision":"street","storenum":579,"strcity":"St. Augustine"},"type":"Feature","geometry":{"type":"Point","coordinates":[-81.325172,29.881176]}},{"properties":{"st":"12","streetaddr":"1050 VAN FLEET DRIVE","zipcode":"33830","county":"105","date_super":{"end_time":"1997/03/02 00:00:00 -0500","original":"3/1/1997 ","granularity":"day","time":"1997/03/01 00:00:00 -0500"},"geo_score":0.698,"strstate":"FL","conversion":1,"type_store":"Supercenter","opendate":{"end_time":"1983/11/30 00:00:00 -0500","original":"11/29/1983 ","granularity":"day","time":"1983/11/29 00:00:00 -0500"},"id":"a61znt0utwaf","geo_precision":"street","storenum":580,"strcity":"Bartow"},"type":"Feature","geometry":{"type":"Point","coordinates":[-81.832692,27.902644]}},{"properties":{"st":"19","streetaddr":"2802 S CENTER STREET","zipcode":"50158","county":"127","date_super":{"end_time":"2002/09/05 00:00:00 -0400","original":"9/4/2002 ","granularity":"day","time":"2002/09/04 00:00:00 -0400"},"geo_score":0.911,"strstate":"IA","conversion":1,"type_store":"Supercenter","opendate":{"end_time":"1983/10/05 00:00:00 -0400","original":"10/4/1983 ","granularity":"day","time":"1983/10/04 00:00:00 -0400"},"id":"a61znt1fhy0i","geo_precision":"range","storenum":581,"strcity":"Marshalltown"},"type":"Feature","geometry":{"type":"Point","coordinates":[-92.912278,42.013131]}},{"properties":{"st":"12","streetaddr":"1590 DUNLAWTON AVE","zipcode":"32127","county":"127","date_super":{"end_time":"1998/03/02 00:00:00 -0500","original":"3/1/1998 ","granularity":"day","time":"1998/03/01 00:00:00 -0500"},"geo_score":1.0,"strstate":"FL","conversion":1,"type_store":"Supercenter","opendate":{"end_time":"1983/11/30 00:00:00 -0500","original":"11/29/1983 ","granularity":"day","time":"1983/11/29 00:00:00 -0500"},"id":"a61znsuiv8en","geo_precision":"range","storenum":582,"strcity":"Port Orange"},"type":"Feature","geometry":{"type":"Point","coordinates":[-81.02436,29.115246]}},{"properties":{"st":"47","streetaddr":"19740 ALBERTA STREET","zipcode":"37841","county":"151","date_super":{"end_time":"1999/03/02 00:00:00 -0500","original":"3/1/1999 ","granularity":"day","time":"1999/03/01 00:00:00 -0500"},"geo_score":0.922,"strstate":"TN","conversion":1,"type_store":"Supercenter","opendate":{"end_time":"1984/05/23 00:00:00 -0400","original":"5/22/1984 ","granularity":"day","time":"1984/05/22 00:00:00 -0400"},"id":"a61znsy78qhv","geo_precision":"range","storenum":583,"strcity":"Oneida"},"type":"Feature","geometry":{"type":"Point","coordinates":[-84.486699,36.534016]}},{"properties":{"st":"21","streetaddr":"20 FERGUSON BLVD.","zipcode":"41035","county":"081","date_super":{"end_time":"1999/03/02 00:00:00 -0500","original":"3/1/1999 ","granularity":"day","time":"1999/03/01 00:00:00 -0500"},"geo_score":0.598,"strstate":"KY","conversion":1,"type_store":"Supercenter","opendate":{"end_time":"1984/10/17 00:00:00 -0400","original":"10/16/1984 ","granularity":"day","time":"1984/10/16 00:00:00 -0400"},"id":"a61znsxl75tu","geo_precision":"zip","storenum":584,"strcity":"Dry Ridge"},"type":"Feature","geometry":{"type":"Point","coordinates":[-84.596609,38.732567]}},{"properties":{"st":"45","streetaddr":"2377 DAVE LYLE BLVD.","zipcode":"29730","county":"091","date_super":{"end_time":"2002/03/02 00:00:00 -0500","original":"3/1/2002 ","granularity":"day","time":"2002/03/01 00:00:00 -0500"},"geo_score":0.915,"strstate":"SC","conversion":1,"type_store":"Supercenter","opendate":{"end_time":"1984/02/02 00:00:00 -0500","original":"2/1/1984 ","granularity":"day","time":"1984/02/01 00:00:00 -0500"},"id":"a61znt38w9jm","geo_precision":"range","storenum":585,"strcity":"Rock Hill"},"type":"Feature","geometry":{"type":"Point","coordinates":[-80.961787,34.94168]}},{"properties":{"st":"45","streetaddr":"2709-A CHURCH STREET","zipcode":"29526","county":"051","date_super":{"end_time":"1998/03/02 00:00:00 -0500","original":"3/1/1998 ","granularity":"day","time":"1998/03/01 00:00:00 -0500"},"geo_score":0.884,"strstate":"SC","conversion":1,"type_store":"Supercenter","opendate":{"end_time":"1988/06/03 00:00:00 -0400","original":"6/2/1988 ","granularity":"day","time":"1988/06/02 00:00:00 -0400"},"id":"a61znt81w12w","geo_precision":"range","storenum":586,"strcity":"Conway"},"type":"Feature","geometry":{"type":"Point","coordinates":[-79.08906,33.859839]}},{"properties":{"st":"47","streetaddr":"202 SAM WALTON DRIVE","zipcode":"38583","county":"185","date_super":{"end_time":"2004/03/02 00:00:00 -0500","original":"3/1/2004 ","granularity":"day","time":"2004/03/01 00:00:00 -0500"},"geo_score":0.672,"strstate":"TN","conversion":1,"type_store":"Supercenter","opendate":{"end_time":"1984/05/23 00:00:00 -0400","original":"5/22/1984 ","granularity":"day","time":"1984/05/22 00:00:00 -0400"},"id":"a61znt7vs5jh","geo_precision":"range","storenum":587,"strcity":"Sparta"},"type":"Feature","geometry":{"type":"Point","coordinates":[-85.79877,36.178932]}},{"properties":{"st":"13","streetaddr":"2825 LEDO ROAD","zipcode":"31707","county":"177","date_super":{"end_time":"2004/03/02 00:00:00 -0500","original":"3/1/2004 ","granularity":"day","time":"2004/03/01 00:00:00 -0500"},"geo_score":0.69,"strstate":"GA","conversion":1,"type_store":"Supercenter","opendate":{"end_time":"1984/03/07 00:00:00 -0500","original":"3/6/1984 ","granularity":"day","time":"1984/03/06 00:00:00 -0500"},"id":"a61znt3dsz6z","geo_precision":"street","storenum":588,"strcity":"Albany"},"type":"Feature","geometry":{"type":"Point","coordinates":[-84.218859,31.62256]}},{"properties":{"st":"21","streetaddr":"11901 STANDIFORD PLAZA ROAD","zipcode":"40229","county":"111","date_super":{"end_time":"1999/03/02 00:00:00 -0500","original":"3/1/1999 ","granularity":"day","time":"1999/03/01 00:00:00 -0500"},"geo_score":0.87,"strstate":"KY","conversion":1,"type_store":"Supercenter","opendate":{"end_time":"1984/02/02 00:00:00 -0500","original":"2/1/1984 ","granularity":"day","time":"1984/02/01 00:00:00 -0500"},"id":"a61znt5fzo5t","geo_precision":"range","storenum":589,"strcity":"Louisville"},"type":"Feature","geometry":{"type":"Point","coordinates":[-85.667819,38.089533]}},{"properties":{"st":"48","streetaddr":"6300 OAKMONT BLVD (HULEN)","zipcode":"76132","county":"439","date_super":{"end_time":"2004/04/22 00:00:00 -0400","original":"4/21/2004 ","granularity":"day","time":"2004/04/21 00:00:00 -0400"},"geo_score":0.808,"strstate":"TX","conversion":1,"type_store":"Supercenter","opendate":{"end_time":"1984/09/01 00:00:00 -0400","original":"8/31/1984 ","granularity":"day","time":"1984/08/31 00:00:00 -0400"},"id":"a61znt87x48x","geo_precision":"street","storenum":590,"strcity":"Ft. Worth"},"type":"Feature","geometry":{"type":"Point","coordinates":[-97.394131,32.679435]}},{"properties":{"st":"21","streetaddr":"US 27 SOUTH","zipcode":"41031","county":"097","date_super":null,"geo_score":0.628,"strstate":"KY","conversion":null,"type_store":"Wal-Mart","opendate":{"end_time":"1984/09/19 00:00:00 -0400","original":"9/18/1984 ","granularity":"day","time":"1984/09/18 00:00:00 -0400"},"id":"a61znt65oq2x","geo_precision":"street","storenum":591,"strcity":"Cynthiana"},"type":"Feature","geometry":{"type":"Point","coordinates":[-84.297613,38.389095]}},{"properties":{"st":"20","streetaddr":"2020 NORTH SE BLVD","zipcode":"67037","county":"173","date_super":{"end_time":"1997/03/02 00:00:00 -0500","original":"3/1/1997 ","granularity":"day","time":"1997/03/01 00:00:00 -0500"},"geo_score":0.526,"strstate":"KS","conversion":1,"type_store":"Supercenter","opendate":{"end_time":"1984/08/03 00:00:00 -0400","original":"8/2/1984 ","granularity":"day","time":"1984/08/02 00:00:00 -0400"},"id":"a61znta1u61w","geo_precision":"street","storenum":592,"strcity":"Derby"},"type":"Feature","geometry":{"type":"Point","coordinates":[-97.500756,37.604015]}},{"properties":{"st":"13","streetaddr":"1450 SOUTHEAST BOWENS MILL RD","zipcode":"31533","county":"069","date_super":{"end_time":"1996/03/02 00:00:00 -0500","original":"3/1/1996 ","granularity":"day","time":"1996/03/01 00:00:00 -0500"},"geo_score":0.875,"strstate":"GA","conversion":1,"type_store":"Supercenter","opendate":{"end_time":"1984/10/17 00:00:00 -0400","original":"10/16/1984 ","granularity":"day","time":"1984/10/16 00:00:00 -0400"},"id":"a61znt22j6uf","geo_precision":"range","storenum":593,"strcity":"Douglas"},"type":"Feature","geometry":{"type":"Point","coordinates":[-82.877349,31.527836]}},{"properties":{"st":"13","streetaddr":"125 PAVILLION PARKWAY","zipcode":"30214","county":"113","date_super":{"end_time":"1996/03/02 00:00:00 -0500","original":"3/1/1996 ","granularity":"day","time":"1996/03/01 00:00:00 -0500"},"geo_score":0.904,"strstate":"GA","conversion":1,"type_store":"Supercenter","opendate":{"end_time":"1984/04/18 00:00:00 -0500","original":"4/17/1984 ","granularity":"day","time":"1984/04/17 00:00:00 -0500"},"id":"a61znswseyks","geo_precision":"range","storenum":594,"strcity":"Fayetteville"},"type":"Feature","geometry":{"type":"Point","coordinates":[-84.439328,33.48031]}},{"properties":{"st":"48","streetaddr":"1801 WEST LINCOLN AVE","zipcode":"78552","county":"061","date_super":{"end_time":"1994/03/02 00:00:00 -0500","original":"3/1/1994 ","granularity":"day","time":"1994/03/01 00:00:00 -0500"},"geo_score":0.778,"strstate":"TX","conversion":1,"type_store":"Supercenter","opendate":{"end_time":"1984/10/03 00:00:00 -0400","original":"10/2/1984 ","granularity":"day","time":"1984/10/02 00:00:00 -0400"},"id":"a61znsummy9x","geo_precision":"street","storenum":595,"strcity":"Harlingen"},"type":"Feature","geometry":{"type":"Point","coordinates":[-97.759918,26.223224]}},{"properties":{"st":"17","streetaddr":"1713 SOUTH PARK AVENUE","zipcode":"62948","county":"199","date_super":null,"geo_score":0.913,"strstate":"IL","conversion":null,"type_store":"Wal-Mart","opendate":{"end_time":"1984/10/17 00:00:00 -0400","original":"10/16/1984 ","granularity":"day","time":"1984/10/16 00:00:00 -0400"},"id":"a61znsww20dr","geo_precision":"range","storenum":596,"strcity":"Herrin"},"type":"Feature","geometry":{"type":"Point","coordinates":[-89.02751,37.787277]}},{"properties":{"st":"48","streetaddr":"7075 FM 1960 RD WEST","zipcode":"77069","county":"201","date_super":{"end_time":"1999/03/02 00:00:00 -0500","original":"3/1/1999 ","granularity":"day","time":"1999/03/01 00:00:00 -0500"},"geo_score":0.935,"strstate":"TX","conversion":1,"type_store":"Supercenter","opendate":{"end_time":"1984/09/19 00:00:00 -0400","original":"9/18/1984 ","granularity":"day","time":"1984/09/18 00:00:00 -0400"},"id":"a61znt0ks6jh","geo_precision":"range","storenum":597,"strcity":"Houston"},"type":"Feature","geometry":{"type":"Point","coordinates":[-95.534165,29.96808]}},{"properties":{"st":"31","streetaddr":"5411 N. SECOND AVENUE","zipcode":"68847","county":"019","date_super":{"end_time":"1995/03/02 00:00:00 -0500","original":"3/1/1995 ","granularity":"day","time":"1995/03/01 00:00:00 -0500"},"geo_score":0.512,"strstate":"NE","conversion":1,"type_store":"Supercenter","opendate":{"end_time":"1984/10/17 00:00:00 -0400","original":"10/16/1984 ","granularity":"day","time":"1984/10/16 00:00:00 -0400"},"id":"a61znt39dxu4","geo_precision":"street","storenum":598,"strcity":"Kearney"},"type":"Feature","geometry":{"type":"Point","coordinates":[-99.085918,40.669404]}},{"properties":{"st":"47","streetaddr":"3200 FT HENRY DRIVE","zipcode":"37664","county":"163","date_super":{"end_time":"1995/03/02 00:00:00 -0500","original":"3/1/1995 ","granularity":"day","time":"1995/03/01 00:00:00 -0500"},"geo_score":0.864,"strstate":"TN","conversion":1,"type_store":"Supercenter","opendate":{"end_time":"1984/09/01 00:00:00 -0400","original":"8/31/1984 ","granularity":"day","time":"1984/08/31 00:00:00 -0400"},"id":"a61znt32bz5c","geo_precision":"range","storenum":599,"strcity":"Kingsport"},"type":"Feature","geometry":{"type":"Point","coordinates":[-82.516054,36.509681]}},{"properties":{"st":"48","streetaddr":"2801 NO. CHARLES ST.","zipcode":"79065","county":"179","date_super":{"end_time":"2004/10/28 00:00:00 -0400","original":"10/27/2004 ","granularity":"day","time":"2004/10/27 00:00:00 -0400"},"geo_score":0.492,"strstate":"TX","conversion":1,"type_store":"Supercenter","opendate":{"end_time":"1984/07/18 00:00:00 -0400","original":"7/17/1984 ","granularity":"day","time":"1984/07/17 00:00:00 -0400"},"id":"a61znt3r3biv","geo_precision":"street","storenum":600,"strcity":"Pampa"},"type":"Feature","geometry":{"type":"Point","coordinates":[-100.966337,35.544869]}},{"properties":{"st":"48","streetaddr":"5501 SHERWOOD WAY","zipcode":"76904","county":"451","date_super":{"end_time":"1994/03/02 00:00:00 -0500","original":"3/1/1994 ","granularity":"day","time":"1994/03/01 00:00:00 -0500"},"geo_score":0.902,"strstate":"TX","conversion":1,"type_store":"Supercenter","opendate":{"end_time":"1984/09/01 00:00:00 -0400","original":"8/31/1984 ","granularity":"day","time":"1984/08/31 00:00:00 -0400"},"id":"a61znsxmca27","geo_precision":"range","storenum":601,"strcity":"San Angelo"},"type":"Feature","geometry":{"type":"Point","coordinates":[-100.511042,31.428215]}},{"properties":{"st":"48","streetaddr":"610 SAWDUST ROAD","zipcode":"77380","county":"339","date_super":null,"geo_score":1.0,"strstate":"TX","conversion":null,"type_store":"Wal-Mart","opendate":{"end_time":"1984/04/04 00:00:00 -0500","original":"4/3/1984 ","granularity":"day","time":"1984/04/03 00:00:00 -0500"},"id":"a61znt9nn86l","geo_precision":"range","storenum":602,"strcity":"The Woodlands"},"type":"Feature","geometry":{"type":"Point","coordinates":[-95.451852,30.126704]}},{"properties":{"st":"17","streetaddr":"3320 VETERANS DRIVE","zipcode":"61554","county":"179","date_super":{"end_time":"2004/04/15 00:00:00 -0400","original":"4/14/2004 ","granularity":"day","time":"2004/04/14 00:00:00 -0400"},"geo_score":0.731,"strstate":"IL","conversion":1,"type_store":"Supercenter","opendate":{"end_time":"1985/10/09 00:00:00 -0400","original":"10/8/1985 ","granularity":"day","time":"1985/10/08 00:00:00 -0400"},"id":"a61znsv58e6w","geo_precision":"street","storenum":603,"strcity":"Pekin"},"type":"Feature","geometry":{"type":"Point","coordinates":[-89.59527,40.541464]}},{"properties":{"st":"01","streetaddr":"4310 MONTGOMERY HWY","zipcode":"36303","county":"069","date_super":{"end_time":"2002/10/17 00:00:00 -0400","original":"10/16/2002 ","granularity":"day","time":"2002/10/16 00:00:00 -0400"},"geo_score":0.912,"strstate":"AL","conversion":1,"type_store":"Supercenter","opendate":{"end_time":"1983/11/16 00:00:00 -0500","original":"11/15/1983 ","granularity":"day","time":"1983/11/15 00:00:00 -0500"},"id":"a61znt52encd","geo_precision":"range","storenum":604,"strcity":"Dothan"},"type":"Feature","geometry":{"type":"Point","coordinates":[-85.440708,31.264171]}},{"properties":{"st":"13","streetaddr":"1955 E. MONTGOMERY CROSSROADS","zipcode":"31406","county":"051","date_super":{"end_time":"2004/07/22 00:00:00 -0400","original":"7/21/2004 ","granularity":"day","time":"2004/07/21 00:00:00 -0400"},"geo_score":0.462,"strstate":"GA","conversion":1,"type_store":"Supercenter","opendate":{"end_time":"1983/11/26 00:00:00 -0500","original":"11/25/1983 ","granularity":"day","time":"1983/11/25 00:00:00 -0500"},"id":"a61znszothd5","geo_precision":"street","storenum":605,"strcity":"Savannah"},"type":"Feature","geometry":{"type":"Point","coordinates":[-81.121658,31.998215]}},{"properties":{"st":"13","streetaddr":"4725 EAST HWY 80","zipcode":"31410","county":"051","date_super":null,"geo_score":0.848,"strstate":"GA","conversion":null,"type_store":"Wal-Mart","opendate":{"end_time":"1983/11/26 00:00:00 -0500","original":"11/25/1983 ","granularity":"day","time":"1983/11/25 00:00:00 -0500"},"id":"a61znt1q0rhc","geo_precision":"range","storenum":606,"strcity":"Savannah"},"type":"Feature","geometry":{"type":"Point","coordinates":[-81.009469,32.043349]}},{"properties":{"st":"40","streetaddr":"923 WEST 11 STREET (HWY 9)","zipcode":"73651","county":"075","date_super":null,"geo_score":0.68,"strstate":"OK","conversion":null,"type_store":"Wal-Mart","opendate":{"end_time":"1984/06/30 00:00:00 -0400","original":"6/29/1984 ","granularity":"day","time":"1984/06/29 00:00:00 -0400"},"id":"a61znsz61aix","geo_precision":"street","storenum":607,"strcity":"Hobart"},"type":"Feature","geometry":{"type":"Point","coordinates":[-99.093809,35.015646]}},{"properties":{"st":"48","streetaddr":"4517 NORTH MIDLAND DRIVE","zipcode":"79707","county":"329","date_super":{"end_time":"1994/03/02 00:00:00 -0500","original":"3/1/1994 ","granularity":"day","time":"1994/03/01 00:00:00 -0500"},"geo_score":1.0,"strstate":"TX","conversion":1,"type_store":"Supercenter","opendate":{"end_time":"1984/06/30 00:00:00 -0400","original":"6/29/1984 ","granularity":"day","time":"1984/06/29 00:00:00 -0400"},"id":"a61znsxjkehm","geo_precision":"range","storenum":608,"strcity":"Midland"},"type":"Feature","geometry":{"type":"Point","coordinates":[-102.145789,32.029465]}},{"properties":{"st":"29","streetaddr":"3650 STAR DUST DRIVE","zipcode":"63401","county":"127","date_super":{"end_time":"2002/03/21 00:00:00 -0500","original":"3/20/2002 ","granularity":"day","time":"2002/03/20 00:00:00 -0500"},"geo_score":0.725,"strstate":"MO","conversion":1,"type_store":"Supercenter","opendate":{"end_time":"1984/09/19 00:00:00 -0400","original":"9/18/1984 ","granularity":"day","time":"1984/09/18 00:00:00 -0400"},"id":"a61znsxa1td0","geo_precision":"street","storenum":609,"strcity":"Hannibal"},"type":"Feature","geometry":{"type":"Point","coordinates":[-91.392187,39.7228]}},{"properties":{"st":"48","streetaddr":"2765 W WASHINGTON","zipcode":"76401","county":"143","date_super":{"end_time":"1994/03/02 00:00:00 -0500","original":"3/1/1994 ","granularity":"day","time":"1994/03/01 00:00:00 -0500"},"geo_score":0.887,"strstate":"TX","conversion":1,"type_store":"Supercenter","opendate":{"end_time":"1984/04/04 00:00:00 -0500","original":"4/3/1984 ","granularity":"day","time":"1984/04/03 00:00:00 -0500"},"id":"a61znsxr8y2v","geo_precision":"range","storenum":610,"strcity":"Stephenville"},"type":"Feature","geometry":{"type":"Point","coordinates":[-98.233022,32.206039]}},{"properties":{"st":"35","streetaddr":"4500 \"A\" NORTH MAIN","zipcode":"88201","county":"005","date_super":{"end_time":"2003/03/20 00:00:00 -0500","original":"3/19/2003 ","granularity":"day","time":"2003/03/19 00:00:00 -0500"},"geo_score":0.532,"strstate":"NM","conversion":1,"type_store":"Supercenter","opendate":{"end_time":"1984/04/04 00:00:00 -0500","original":"4/3/1984 ","granularity":"day","time":"1984/04/03 00:00:00 -0500"},"id":"a61znt0fbv7r","geo_precision":"street","storenum":611,"strcity":"Roswell"},"type":"Feature","geometry":{"type":"Point","coordinates":[-104.554009,33.62722]}},{"properties":{"st":"17","streetaddr":"2250 LINCOLN AVENUE","zipcode":"61920","county":"029","date_super":{"end_time":"2002/03/02 00:00:00 -0500","original":"3/1/2002 ","granularity":"day","time":"2002/03/01 00:00:00 -0500"},"geo_score":0.747,"strstate":"IL","conversion":1,"type_store":"Supercenter","opendate":{"end_time":"1984/02/05 00:00:00 -0500","original":"2/4/1984 ","granularity":"day","time":"1984/02/04 00:00:00 -0500"},"id":"a61znt2xmfyc","geo_precision":"street","storenum":612,"strcity":"Charleston"},"type":"Feature","geometry":{"type":"Point","coordinates":[-88.160688,39.485147]}},{"properties":{"st":"12","streetaddr":"1521 W GRANADA BLVD","zipcode":"32174","county":"127","date_super":{"end_time":"1996/03/02 00:00:00 -0500","original":"3/1/1996 ","granularity":"day","time":"1996/03/01 00:00:00 -0500"},"geo_score":1.0,"strstate":"FL","conversion":1,"type_store":"Supercenter","opendate":{"end_time":"1984/04/04 00:00:00 -0500","original":"4/3/1984 ","granularity":"day","time":"1984/04/03 00:00:00 -0500"},"id":"a61znta8qvaw","geo_precision":"range","storenum":613,"strcity":"Ormond Beach"},"type":"Feature","geometry":{"type":"Point","coordinates":[-81.113508,29.25763]}},{"properties":{"st":"13","streetaddr":"803 NEW FRANKLIN RD","zipcode":"30240","county":"285","date_super":{"end_time":"2004/07/15 00:00:00 -0400","original":"7/14/2004 ","granularity":"day","time":"2004/07/14 00:00:00 -0400"},"geo_score":0.915,"strstate":"GA","conversion":1,"type_store":"Supercenter","opendate":{"end_time":"1984/05/23 00:00:00 -0400","original":"5/22/1984 ","granularity":"day","time":"1984/05/22 00:00:00 -0400"},"id":"a61znt89v8d0","geo_precision":"range","storenum":614,"strcity":"La Grange"},"type":"Feature","geometry":{"type":"Point","coordinates":[-85.028376,33.066495]}},{"properties":{"st":"13","streetaddr":"101 MARKET PLACE BLVD","zipcode":"30121","county":"015","date_super":{"end_time":"1995/03/02 00:00:00 -0500","original":"3/1/1995 ","granularity":"day","time":"1995/03/01 00:00:00 -0500"},"geo_score":0.941,"strstate":"GA","conversion":1,"type_store":"Supercenter","opendate":{"end_time":"1984/11/14 00:00:00 -0500","original":"11/13/1984 ","granularity":"day","time":"1984/11/13 00:00:00 -0500"},"id":"a61znt5n1lsc","geo_precision":"range","storenum":615,"strcity":"Cartersville"},"type":"Feature","geometry":{"type":"Point","coordinates":[-84.790607,34.203382]}},{"properties":{"st":"45","streetaddr":"2795 NORTH ROAD","zipcode":"29115","county":"075","date_super":{"end_time":"1997/03/02 00:00:00 -0500","original":"3/1/1997 ","granularity":"day","time":"1997/03/01 00:00:00 -0500"},"geo_score":0.55,"strstate":"SC","conversion":1,"type_store":"Supercenter","opendate":{"end_time":"1984/09/01 00:00:00 -0400","original":"8/31/1984 ","granularity":"day","time":"1984/08/31 00:00:00 -0400"},"id":"a61znt956hgb","geo_precision":"street","storenum":616,"strcity":"Orangeberg"},"type":"Feature","geometry":{"type":"Point","coordinates":[-80.930858,33.553351]}},{"properties":{"st":"18","streetaddr":"757 WEST WOLF STREET","zipcode":"47882","county":"153","date_super":null,"geo_score":0.866,"strstate":"IN","conversion":null,"type_store":"Wal-Mart","opendate":{"end_time":"1985/11/13 00:00:00 -0500","original":"11/12/1985 ","granularity":"day","time":"1985/11/12 00:00:00 -0500"},"id":"a61znt9r37ka","geo_precision":"range","storenum":617,"strcity":"Sullivan"},"type":"Feature","geometry":{"type":"Point","coordinates":[-87.423001,39.102934]}},{"properties":{"st":"13","streetaddr":"4166 JIMMY LEE SMITH PKWY","zipcode":"30141","county":"223","date_super":{"end_time":"1995/03/02 00:00:00 -0500","original":"3/1/1995 ","granularity":"day","time":"1995/03/01 00:00:00 -0500"},"geo_score":1.0,"strstate":"GA","conversion":1,"type_store":"Supercenter","opendate":{"end_time":"1984/08/03 00:00:00 -0400","original":"8/2/1984 ","granularity":"day","time":"1984/08/02 00:00:00 -0400"},"id":"a61znt0n604c","geo_precision":"range","storenum":618,"strcity":"Hiram"},"type":"Feature","geometry":{"type":"Point","coordinates":[-84.758296,33.892429]}},{"properties":{"st":"47","streetaddr":"3034 RHEA COUNTY HWY","zipcode":"37321","county":"143","date_super":{"end_time":"2003/08/21 00:00:00 -0400","original":"8/20/2003 ","granularity":"day","time":"2003/08/20 00:00:00 -0400"},"geo_score":0.634,"strstate":"TN","conversion":1,"type_store":"Supercenter","opendate":{"end_time":"1984/10/17 00:00:00 -0400","original":"10/16/1984 ","granularity":"day","time":"1984/10/16 00:00:00 -0400"},"id":"a61znt50obhh","geo_precision":"street","storenum":619,"strcity":"Dayton"},"type":"Feature","geometry":{"type":"Point","coordinates":[-85.046286,35.460147]}},{"properties":{"st":"47","streetaddr":"220 CENTURY BLVD","zipcode":"37620","county":"163","date_super":{"end_time":"2003/10/30 00:00:00 -0500","original":"10/29/2003 ","granularity":"day","time":"2003/10/29 00:00:00 -0500"},"geo_score":0.645,"strstate":"TN","conversion":1,"type_store":"Supercenter","opendate":{"end_time":"1984/11/14 00:00:00 -0500","original":"11/13/1984 ","granularity":"day","time":"1984/11/13 00:00:00 -0500"},"id":"a61znt9duaup","geo_precision":"range","storenum":620,"strcity":"Bristol"},"type":"Feature","geometry":{"type":"Point","coordinates":[-82.400393,36.467699]}},{"properties":{"st":"45","streetaddr":"230 KELLEY STREET","zipcode":"29560","county":"041","date_super":null,"geo_score":0.913,"strstate":"SC","conversion":null,"type_store":"Wal-Mart","opendate":{"end_time":"1981/07/05 00:00:00 -0400","original":"7/4/1981 ","granularity":"day","time":"1981/07/04 00:00:00 -0400"},"id":"a61znsxpzt5y","geo_precision":"range","storenum":621,"strcity":"Lake City"},"type":"Feature","geometry":{"type":"Point","coordinates":[-79.756106,33.877233]}},{"properties":{"st":"40","streetaddr":"7800 N.W. EXPRESSWAY","zipcode":"73132","county":"109","date_super":{"end_time":"2000/03/02 00:00:00 -0500","original":"3/1/2000 ","granularity":"day","time":"2000/03/01 00:00:00 -0500"},"geo_score":0.536,"strstate":"OK","conversion":1,"type_store":"Supercenter","opendate":{"end_time":"1984/11/14 00:00:00 -0500","original":"11/13/1984 ","granularity":"day","time":"1984/11/13 00:00:00 -0500"},"id":"a61znt9js020","geo_precision":"street","storenum":622,"strcity":"Oklahoma City"},"type":"Feature","geometry":{"type":"Point","coordinates":[-97.536521,35.521948]}},{"properties":{"st":"12","streetaddr":"545 PINE ISLAND RD","zipcode":"33903","county":"071","date_super":{"end_time":"1996/03/02 00:00:00 -0500","original":"3/1/1996 ","granularity":"day","time":"1996/03/01 00:00:00 -0500"},"geo_score":0.922,"strstate":"FL","conversion":1,"type_store":"Supercenter","opendate":{"end_time":"1984/08/22 00:00:00 -0400","original":"8/21/1984 ","granularity":"day","time":"1984/08/21 00:00:00 -0400"},"id":"a61znt02e938","geo_precision":"range","storenum":623,"strcity":"N. Ft. Meyers"},"type":"Feature","geometry":{"type":"Point","coordinates":[-81.898675,26.681991]}},{"properties":{"st":"45","streetaddr":"2812 MAIN ST","zipcode":"29108","county":"071","date_super":{"end_time":"2000/03/02 00:00:00 -0500","original":"3/1/2000 ","granularity":"day","time":"2000/03/01 00:00:00 -0500"},"geo_score":0.902,"strstate":"SC","conversion":1,"type_store":"Supercenter","opendate":{"end_time":"1981/07/05 00:00:00 -0400","original":"7/4/1981 ","granularity":"day","time":"1981/07/04 00:00:00 -0400"},"id":"a61znszjn0li","geo_precision":"range","storenum":624,"strcity":"Newberry"},"type":"Feature","geometry":{"type":"Point","coordinates":[-81.590175,34.28268]}},{"properties":{"st":"45","streetaddr":"1310 NORTH FRASER","zipcode":"29440","county":"043","date_super":{"end_time":"1996/03/02 00:00:00 -0500","original":"3/1/1996 ","granularity":"day","time":"1996/03/01 00:00:00 -0500"},"geo_score":0.652,"strstate":"SC","conversion":1,"type_store":"Supercenter","opendate":{"end_time":"1981/07/05 00:00:00 -0400","original":"7/4/1981 ","granularity":"day","time":"1981/07/04 00:00:00 -0400"},"id":"a61znsucg09l","geo_precision":"street","storenum":625,"strcity":"Georgetown"},"type":"Feature","geometry":{"type":"Point","coordinates":[-79.288983,33.387651]}},{"properties":{"st":"48","streetaddr":"2000 HOBBS HIGHWAY","zipcode":"79360","county":"165","date_super":null,"geo_score":0.683,"strstate":"TX","conversion":null,"type_store":"Wal-Mart","opendate":{"end_time":"1984/10/03 00:00:00 -0400","original":"10/2/1984 ","granularity":"day","time":"1984/10/02 00:00:00 -0400"},"id":"a61znt8mke14","geo_precision":"zip","storenum":626,"strcity":"Seminole"},"type":"Feature","geometry":{"type":"Point","coordinates":[-102.805355,32.671912]}},{"properties":{"st":"45","streetaddr":"536 RADFORD BLVD","zipcode":"29536","county":"033","date_super":null,"geo_score":0.919,"strstate":"SC","conversion":null,"type_store":"Wal-Mart","opendate":{"end_time":"1981/07/05 00:00:00 -0400","original":"7/4/1981 ","granularity":"day","time":"1981/07/04 00:00:00 -0400"},"id":"a61znt6fy0gm","geo_precision":"range","storenum":627,"strcity":"Dillon"},"type":"Feature","geometry":{"type":"Point","coordinates":[-79.369733,34.435917]}},{"properties":{"st":"45","streetaddr":"9880 DORCHESTER ROAD","zipcode":"29418","county":"035","date_super":{"end_time":"2000/03/02 00:00:00 -0500","original":"3/1/2000 ","granularity":"day","time":"2000/03/01 00:00:00 -0500"},"geo_score":0.752,"strstate":"SC","conversion":1,"type_store":"Supercenter","opendate":{"end_time":"1981/07/05 00:00:00 -0400","original":"7/4/1981 ","granularity":"day","time":"1981/07/04 00:00:00 -0400"},"id":"a61znsyj2o8a","geo_precision":"street","storenum":628,"strcity":"Summerville"},"type":"Feature","geometry":{"type":"Point","coordinates":[-80.123561,32.923752]}},{"properties":{"st":"45","streetaddr":"441 N DUNCAN BYPASS/SUITE A","zipcode":"29379","county":"087","date_super":null,"geo_score":0.543,"strstate":"SC","conversion":null,"type_store":"Wal-Mart","opendate":{"end_time":"1981/07/05 00:00:00 -0400","original":"7/4/1981 ","granularity":"day","time":"1981/07/04 00:00:00 -0400"},"id":"a61znt0ioknq","geo_precision":"street","storenum":629,"strcity":"Union"},"type":"Feature","geometry":{"type":"Point","coordinates":[-81.634898,34.707343]}},{"properties":{"st":"45","streetaddr":"2530 DAVID H MCLEOD BLVD","zipcode":"29501","county":"041","date_super":null,"geo_score":0.915,"strstate":"SC","conversion":null,"type_store":"Wal-Mart","opendate":{"end_time":"1982/03/02 00:00:00 -0500","original":"3/1/1982 ","granularity":"day","time":"1982/03/01 00:00:00 -0500"},"id":"a61znt5hqydh","geo_precision":"range","storenum":630,"strcity":"Florence"},"type":"Feature","geometry":{"type":"Point","coordinates":[-79.823448,34.187924]}},{"properties":{"st":"45","streetaddr":"1023 SOUTH PENDELTON STREET","zipcode":"29642","county":"077","date_super":null,"geo_score":0.951,"strstate":"SC","conversion":null,"type_store":"Wal-Mart","opendate":{"end_time":"1981/07/05 00:00:00 -0400","original":"7/4/1981 ","granularity":"day","time":"1981/07/04 00:00:00 -0400"},"id":"a61znt5qxwh5","geo_precision":"range","storenum":631,"strcity":"Easley"},"type":"Feature","geometry":{"type":"Point","coordinates":[-82.602127,34.813032]}},{"properties":{"st":"45","streetaddr":"1481 US HWY 17 NORTH","zipcode":"29464","county":"019","date_super":null,"geo_score":0.884,"strstate":"SC","conversion":null,"type_store":"Wal-Mart","opendate":{"end_time":"1982/07/14 00:00:00 -0400","original":"7/13/1982 ","granularity":"day","time":"1982/07/13 00:00:00 -0400"},"id":"a61znt4apgr3","geo_precision":"range","storenum":632,"strcity":"Mount Pleasant"},"type":"Feature","geometry":{"type":"Point","coordinates":[-79.854014,32.813224]}},{"properties":{"st":"17","streetaddr":"730 TENNEY ST","zipcode":"61443","county":"073","date_super":{"end_time":"1995/03/02 00:00:00 -0500","original":"3/1/1995 ","granularity":"day","time":"1995/03/01 00:00:00 -0500"},"geo_score":1.0,"strstate":"IL","conversion":1,"type_store":"Supercenter","opendate":{"end_time":"1984/10/24 00:00:00 -0400","original":"10/23/1984 ","granularity":"day","time":"1984/10/23 00:00:00 -0400"},"id":"a61znswo3ozh","geo_precision":"range","storenum":633,"strcity":"Kewanee"},"type":"Feature","geometry":{"type":"Point","coordinates":[-89.926293,41.222206]}},{"properties":{"st":"45","streetaddr":"2240 WEST DEKALB ST.","zipcode":"29020","county":"055","date_super":{"end_time":"1998/03/02 00:00:00 -0500","original":"3/1/1998 ","granularity":"day","time":"1998/03/01 00:00:00 -0500"},"geo_score":0.939,"strstate":"SC","conversion":1,"type_store":"Supercenter","opendate":{"end_time":"1981/07/05 00:00:00 -0400","original":"7/4/1981 ","granularity":"day","time":"1981/07/04 00:00:00 -0400"},"id":"a61znt0vdfwt","geo_precision":"range","storenum":634,"strcity":"Camden"},"type":"Feature","geometry":{"type":"Point","coordinates":[-80.647433,34.249183]}},{"properties":{"st":"13","streetaddr":"6000 OGEECHEE ROAD","zipcode":"31419","county":"051","date_super":{"end_time":"2001/03/15 00:00:00 -0500","original":"3/14/2001 ","granularity":"day","time":"2001/03/14 00:00:00 -0500"},"geo_score":0.989,"strstate":"GA","conversion":1,"type_store":"Supercenter","opendate":{"end_time":"1981/07/05 00:00:00 -0400","original":"7/4/1981 ","granularity":"day","time":"1981/07/04 00:00:00 -0400"},"id":"a61znt490tt4","geo_precision":"range","storenum":635,"strcity":"Savannah (S)"},"type":"Feature","geometry":{"type":"Point","coordinates":[-81.257133,31.997565]}},{"properties":{"st":"17","streetaddr":"2111 CLAUDE BAILEY PKWY","zipcode":"61356","county":"011","date_super":{"end_time":"2002/10/17 00:00:00 -0400","original":"10/16/2002 ","granularity":"day","time":"2002/10/16 00:00:00 -0400"},"geo_score":0.525,"strstate":"IL","conversion":1,"type_store":"Supercenter","opendate":{"end_time":"1985/03/06 00:00:00 -0500","original":"3/5/1985 ","granularity":"day","time":"1985/03/05 00:00:00 -0500"},"id":"a61znt55rrop","geo_precision":"street","storenum":636,"strcity":"Princeton"},"type":"Feature","geometry":{"type":"Point","coordinates":[-89.473361,41.394746]}},{"properties":{"st":"31","streetaddr":"200 FRONTIER STREET","zipcode":"68850","county":"047","date_super":{"end_time":"2004/03/18 00:00:00 -0500","original":"3/17/2004 ","granularity":"day","time":"2004/03/17 00:00:00 -0500"},"geo_score":0.683,"strstate":"NE","conversion":1,"type_store":"Supercenter","opendate":{"end_time":"1985/02/06 00:00:00 -0500","original":"2/5/1985 ","granularity":"day","time":"1985/02/05 00:00:00 -0500"},"id":"a61znsuq1zoh","geo_precision":"zip","storenum":637,"strcity":"Lexington"},"type":"Feature","geometry":{"type":"Point","coordinates":[-99.718408,40.873227]}},{"properties":{"st":"45","streetaddr":"165 WALTON DRIVE","zipcode":"29341","county":"021","date_super":{"end_time":"2000/03/02 00:00:00 -0500","original":"3/1/2000 ","granularity":"day","time":"2000/03/01 00:00:00 -0500"},"geo_score":0.675,"strstate":"SC","conversion":1,"type_store":"Supercenter","opendate":{"end_time":"1981/07/05 00:00:00 -0400","original":"7/4/1981 ","granularity":"day","time":"1981/07/04 00:00:00 -0400"},"id":"a61znsvluxaw","geo_precision":"range","storenum":638,"strcity":"Gaffney"},"type":"Feature","geometry":{"type":"Point","coordinates":[-82.027465,34.960603]}},{"properties":{"st":"13","streetaddr":"150 ALTAMA CONNECTOR","zipcode":"31525","county":"127","date_super":{"end_time":"1997/03/02 00:00:00 -0500","original":"3/1/1997 ","granularity":"day","time":"1997/03/01 00:00:00 -0500"},"geo_score":0.809,"strstate":"GA","conversion":1,"type_store":"Supercenter","opendate":{"end_time":"1981/07/05 00:00:00 -0400","original":"7/4/1981 ","granularity":"day","time":"1981/07/04 00:00:00 -0400"},"id":"a61znszqd2us","geo_precision":"street","storenum":639,"strcity":"Brunswick"},"type":"Feature","geometry":{"type":"Point","coordinates":[-81.480436,31.214688]}},{"properties":{"st":"45","streetaddr":"1451 WOODRUFF ROAD","zipcode":"29607","county":"045","date_super":{"end_time":"1998/03/02 00:00:00 -0500","original":"3/1/1998 ","granularity":"day","time":"1998/03/01 00:00:00 -0500"},"geo_score":0.911,"strstate":"SC","conversion":1,"type_store":"Supercenter","opendate":{"end_time":"1981/07/05 00:00:00 -0400","original":"7/4/1981 ","granularity":"day","time":"1981/07/04 00:00:00 -0400"},"id":"a61znswl1fld","geo_precision":"range","storenum":640,"strcity":"Greenville"},"type":"Feature","geometry":{"type":"Point","coordinates":[-82.281086,34.820794]}},{"properties":{"st":"45","streetaddr":"6134 WHITE HORSE ROAD","zipcode":"29611","county":"045","date_super":{"end_time":"2000/03/02 00:00:00 -0500","original":"3/1/2000 ","granularity":"day","time":"2000/03/01 00:00:00 -0500"},"geo_score":0.726,"strstate":"SC","conversion":1,"type_store":"Supercenter","opendate":{"end_time":"1981/07/05 00:00:00 -0400","original":"7/4/1981 ","granularity":"day","time":"1981/07/04 00:00:00 -0400"},"id":"a61znstzddh4","geo_precision":"street","storenum":641,"strcity":"Greenville"},"type":"Feature","geometry":{"type":"Point","coordinates":[-82.457108,34.85575]}},{"properties":{"st":"45","streetaddr":"801 CHESTERFIELD HWY","zipcode":"29520","county":"025","date_super":null,"geo_score":0.726,"strstate":"SC","conversion":null,"type_store":"Wal-Mart","opendate":{"end_time":"1981/07/05 00:00:00 -0400","original":"7/4/1981 ","granularity":"day","time":"1981/07/04 00:00:00 -0400"},"id":"a61znt1frjko","geo_precision":"street","storenum":642,"strcity":"Cheraw"},"type":"Feature","geometry":{"type":"Point","coordinates":[-79.909697,34.693166]}},{"properties":{"st":"45","streetaddr":"10820 N. KINGS HWY","zipcode":"29572","county":"051","date_super":{"end_time":"1998/03/02 00:00:00 -0500","original":"3/1/1998 ","granularity":"day","time":"1998/03/01 00:00:00 -0500"},"geo_score":0.633,"strstate":"SC","conversion":1,"type_store":"Supercenter","opendate":{"end_time":"1981/07/05 00:00:00 -0400","original":"7/4/1981 ","granularity":"day","time":"1981/07/04 00:00:00 -0400"},"id":"a61znt9a0os4","geo_precision":"street","storenum":643,"strcity":"Myrtle Beach"},"type":"Feature","geometry":{"type":"Point","coordinates":[-78.790067,33.764983]}},{"properties":{"st":"45","streetaddr":"651 HWY 28 BYPASS","zipcode":"29624","county":"007","date_super":{"end_time":"1998/03/02 00:00:00 -0500","original":"3/1/1998 ","granularity":"day","time":"1998/03/01 00:00:00 -0500"},"geo_score":0.842,"strstate":"SC","conversion":1,"type_store":"Supercenter","opendate":{"end_time":"1981/07/05 00:00:00 -0400","original":"7/4/1981 ","granularity":"day","time":"1981/07/04 00:00:00 -0400"},"id":"a61znt67en4l","geo_precision":"range","storenum":644,"strcity":"Anderson"},"type":"Feature","geometry":{"type":"Point","coordinates":[-82.649407,34.499762]}},{"properties":{"st":"31","streetaddr":"2400 PASEWALK AVE","zipcode":"68701","county":"119","date_super":{"end_time":"1996/03/02 00:00:00 -0500","original":"3/1/1996 ","granularity":"day","time":"1996/03/01 00:00:00 -0500"},"geo_score":0.93,"strstate":"NE","conversion":1,"type_store":"Supercenter","opendate":{"end_time":"1984/08/03 00:00:00 -0400","original":"8/2/1984 ","granularity":"day","time":"1984/08/02 00:00:00 -0400"},"id":"a61znsvpn116","geo_precision":"range","storenum":645,"strcity":"Norfolk"},"type":"Feature","geometry":{"type":"Point","coordinates":[-97.443413,42.023651]}},{"properties":{"st":"19","streetaddr":"102 CHAMBER DRIVE","zipcode":"52205","county":"105","date_super":null,"geo_score":0.913,"strstate":"IA","conversion":null,"type_store":"Wal-Mart","opendate":{"end_time":"1984/10/17 00:00:00 -0400","original":"10/16/1984 ","granularity":"day","time":"1984/10/16 00:00:00 -0400"},"id":"a61znt8uv5kt","geo_precision":"range","storenum":646,"strcity":"Anamosa"},"type":"Feature","geometry":{"type":"Point","coordinates":[-91.265282,42.103519]}},{"properties":{"st":"19","streetaddr":"208 WEST STREET SOUTH","zipcode":"50112","county":"157","date_super":null,"geo_score":0.813,"strstate":"IA","conversion":null,"type_store":"Wal-Mart","opendate":{"end_time":"1985/02/06 00:00:00 -0500","original":"2/5/1985 ","granularity":"day","time":"1985/02/05 00:00:00 -0500"},"id":"a61znswm7ghj","geo_precision":"range","storenum":647,"strcity":"Grinnell"},"type":"Feature","geometry":{"type":"Point","coordinates":[-92.727286,41.733175]}},{"properties":{"st":"29","streetaddr":"1661 JUNGERMAN RD","zipcode":"63304","county":"183","date_super":null,"geo_score":0.78,"strstate":"MO","conversion":null,"type_store":"Wal-Mart","opendate":{"end_time":"1984/11/30 00:00:00 -0500","original":"11/29/1984 ","granularity":"day","time":"1984/11/29 00:00:00 -0500"},"id":"a61znsx1772m","geo_precision":"range","storenum":648,"strcity":"St. Peters"},"type":"Feature","geometry":{"type":"Point","coordinates":[-90.57835,38.778301]}},{"properties":{"st":"12","streetaddr":"3175 CHENEY HWY","zipcode":"32780","county":"009","date_super":{"end_time":"1996/03/02 00:00:00 -0500","original":"3/1/1996 ","granularity":"day","time":"1996/03/01 00:00:00 -0500"},"geo_score":0.0,"strstate":"FL","conversion":1,"type_store":"Supercenter","opendate":{"end_time":"1984/08/22 00:00:00 -0400","original":"8/21/1984 ","granularity":"day","time":"1984/08/21 00:00:00 -0400"},"id":"a61znt6v765d","geo_precision":"unmatched","storenum":649,"strcity":"Titusville"},"type":"Feature","geometry":null},{"properties":{"st":"51","streetaddr":"1941 NEELEY ROAD","zipcode":"24219","county":"195","date_super":null,"geo_score":0.0,"strstate":"VA","conversion":null,"type_store":"Wal-Mart","opendate":{"end_time":"1984/09/19 00:00:00 -0400","original":"9/18/1984 ","granularity":"day","time":"1984/09/18 00:00:00 -0400"},"id":"a61znt0wsb6q","geo_precision":"unmatched","storenum":650,"strcity":"Big Stone Gap"},"type":"Feature","geometry":null},{"properties":{"st":"48","streetaddr":"4145 NORTH DOWLEN ROAD","zipcode":"77706","county":"245","date_super":{"end_time":"1995/03/02 00:00:00 -0500","original":"3/1/1995 ","granularity":"day","time":"1995/03/01 00:00:00 -0500"},"geo_score":0.883,"strstate":"TX","conversion":1,"type_store":"Supercenter","opendate":{"end_time":"1984/06/30 00:00:00 -0400","original":"6/29/1984 ","granularity":"day","time":"1984/06/29 00:00:00 -0400"},"id":"a61znsu8uee8","geo_precision":"range","storenum":651,"strcity":"Beaumont"},"type":"Feature","geometry":{"type":"Point","coordinates":[-94.164167,30.12181]}},{"properties":{"st":"20","streetaddr":"3101 EAST KANSAS AVE","zipcode":"67846","county":"055","date_super":{"end_time":"1997/03/02 00:00:00 -0500","original":"3/1/1997 ","granularity":"day","time":"1997/03/01 00:00:00 -0500"},"geo_score":0.0,"strstate":"KS","conversion":1,"type_store":"Supercenter","opendate":{"end_time":"1984/10/17 00:00:00 -0400","original":"10/16/1984 ","granularity":"day","time":"1984/10/16 00:00:00 -0400"},"id":"a61znt1ba28y","geo_precision":"unmatched","storenum":652,"strcity":"Garden City"},"type":"Feature","geometry":null},{"properties":{"st":"21","streetaddr":"300 CLINIC DRIVE","zipcode":"42240","county":"047","date_super":{"end_time":"1995/03/02 00:00:00 -0500","original":"3/1/1995 ","granularity":"day","time":"1995/03/01 00:00:00 -0500"},"geo_score":0.911,"strstate":"KY","conversion":1,"type_store":"Supercenter","opendate":{"end_time":"1981/07/05 00:00:00 -0400","original":"7/4/1981 ","granularity":"day","time":"1981/07/04 00:00:00 -0400"},"id":"a61znt8sji95","geo_precision":"range","storenum":653,"strcity":"Hopinsville"},"type":"Feature","geometry":{"type":"Point","coordinates":[-87.470671,36.831327]}},{"properties":{"st":"21","streetaddr":"1756  EAST CENTER ST","zipcode":"42431","county":"107","date_super":{"end_time":"1995/03/02 00:00:00 -0500","original":"3/1/1995 ","granularity":"day","time":"1995/03/01 00:00:00 -0500"},"geo_score":0.911,"strstate":"KY","conversion":1,"type_store":"Supercenter","opendate":{"end_time":"1987/04/29 00:00:00 -0400","original":"4/28/1987 ","granularity":"day","time":"1987/04/28 00:00:00 -0400"},"id":"a61znt93nma0","geo_precision":"range","storenum":655,"strcity":"Madisonville"},"type":"Feature","geometry":{"type":"Point","coordinates":[-87.474035,37.326283]}},{"properties":{"st":"47","streetaddr":"1880 NORTH MAIN ST","zipcode":"37160","county":"003","date_super":{"end_time":"2003/05/22 00:00:00 -0400","original":"5/21/2003 ","granularity":"day","time":"2003/05/21 00:00:00 -0400"},"geo_score":0.911,"strstate":"TN","conversion":1,"type_store":"Supercenter","opendate":{"end_time":"1981/07/05 00:00:00 -0400","original":"7/4/1981 ","granularity":"day","time":"1981/07/04 00:00:00 -0400"},"id":"a61znszs194l","geo_precision":"range","storenum":656,"strcity":"Shelbyville"},"type":"Feature","geometry":{"type":"Point","coordinates":[-86.455623,35.513778]}},{"properties":{"st":"47","streetaddr":"768 SOUTH JEFFERSON AVE","zipcode":"38501","county":"141","date_super":{"end_time":"1994/03/02 00:00:00 -0500","original":"3/1/1994 ","granularity":"day","time":"1994/03/01 00:00:00 -0500"},"geo_score":0.922,"strstate":"TN","conversion":1,"type_store":"Supercenter","opendate":{"end_time":"1981/07/05 00:00:00 -0400","original":"7/4/1981 ","granularity":"day","time":"1981/07/04 00:00:00 -0400"},"id":"a61znt6t4sti","geo_precision":"range","storenum":657,"strcity":"Cookeville"},"type":"Feature","geometry":{"type":"Point","coordinates":[-85.500953,36.144455]}},{"properties":{"st":"13","streetaddr":"2510 REDMOND CIRCLE","zipcode":"30165","county":"115","date_super":{"end_time":"1994/03/02 00:00:00 -0500","original":"3/1/1994 ","granularity":"day","time":"1994/03/01 00:00:00 -0500"},"geo_score":1.0,"strstate":"GA","conversion":1,"type_store":"Supercenter","opendate":{"end_time":"1981/07/05 00:00:00 -0400","original":"7/4/1981 ","granularity":"day","time":"1981/07/04 00:00:00 -0400"},"id":"a61znt0h4f03","geo_precision":"range","storenum":658,"strcity":"Rome"},"type":"Feature","geometry":{"type":"Point","coordinates":[-85.228016,34.274618]}},{"properties":{"st":"47","streetaddr":"7044 CHARLOTTE PIKE","zipcode":"37209","county":"037","date_super":{"end_time":"1998/03/02 00:00:00 -0500","original":"3/1/1998 ","granularity":"day","time":"1998/03/01 00:00:00 -0500"},"geo_score":0.0,"strstate":"TN","conversion":1,"type_store":"Supercenter","opendate":{"end_time":"1981/07/05 00:00:00 -0400","original":"7/4/1981 ","granularity":"day","time":"1981/07/04 00:00:00 -0400"},"id":"a61znsupq0sr","geo_precision":"unmatched","storenum":659,"strcity":"Nashville"},"type":"Feature","geometry":null},{"properties":{"st":"01","streetaddr":"517 WEST AVALON AVE","zipcode":"35661","county":"033","date_super":{"end_time":"1995/03/02 00:00:00 -0500","original":"3/1/1995 ","granularity":"day","time":"1995/03/01 00:00:00 -0500"},"geo_score":0.916,"strstate":"AL","conversion":1,"type_store":"Supercenter","opendate":{"end_time":"1981/07/05 00:00:00 -0400","original":"7/4/1981 ","granularity":"day","time":"1981/07/04 00:00:00 -0400"},"id":"a61znt0thgi2","geo_precision":"range","storenum":660,"strcity":"Muscle Shoals"},"type":"Feature","geometry":{"type":"Point","coordinates":[-87.694946,34.745215]}},{"properties":{"st":"01","streetaddr":"1011 U.S. HWY 72 EAST","zipcode":"35611","county":"083","date_super":{"end_time":"1996/03/02 00:00:00 -0500","original":"3/1/1996 ","granularity":"day","time":"1996/03/01 00:00:00 -0500"},"geo_score":0.514,"strstate":"AL","conversion":1,"type_store":"Supercenter","opendate":{"end_time":"1981/07/05 00:00:00 -0400","original":"7/4/1981 ","granularity":"day","time":"1981/07/04 00:00:00 -0400"},"id":"a61znt5z1qkc","geo_precision":"street","storenum":661,"strcity":"Athens"},"type":"Feature","geometry":{"type":"Point","coordinates":[-86.968498,34.789771]}},{"properties":{"st":"01","streetaddr":"2800 SPRING AVN. S.W","zipcode":"35603","county":"103","date_super":{"end_time":"2000/03/02 00:00:00 -0500","original":"3/1/2000 ","granularity":"day","time":"2000/03/01 00:00:00 -0500"},"geo_score":0.614,"strstate":"AL","conversion":1,"type_store":"Supercenter","opendate":{"end_time":"1981/07/05 00:00:00 -0400","original":"7/4/1981 ","granularity":"day","time":"1981/07/04 00:00:00 -0400"},"id":"a61znta0d766","geo_precision":"street","storenum":662,"strcity":"Decatur"},"type":"Feature","geometry":{"type":"Point","coordinates":[-87.000151,34.557584]}},{"properties":{"st":"47","streetaddr":"1815 DECATUR PIKE","zipcode":"37303","county":"107","date_super":{"end_time":"2005/06/16 00:00:00 -0400","original":"6/15/2005 ","granularity":"day","time":"2005/06/15 00:00:00 -0400"},"geo_score":0.739,"strstate":"TN","conversion":1,"type_store":"Supercenter","opendate":{"end_time":"1981/07/05 00:00:00 -0400","original":"7/4/1981 ","granularity":"day","time":"1981/07/04 00:00:00 -0400"},"id":"a61znt5wiley","geo_precision":"street","storenum":663,"strcity":"Athens"},"type":"Feature","geometry":{"type":"Point","coordinates":[-84.626852,35.452684]}},{"properties":{"st":"20","streetaddr":"4301 VINE STREET","zipcode":"67601","county":"051","date_super":{"end_time":"2000/03/02 00:00:00 -0500","original":"3/1/2000 ","granularity":"day","time":"2000/03/01 00:00:00 -0500"},"geo_score":0.708,"strstate":"KS","conversion":1,"type_store":"Supercenter","opendate":{"end_time":"1984/10/31 00:00:00 -0500","original":"10/30/1984 ","granularity":"day","time":"1984/10/30 00:00:00 -0500"},"id":"a61znt2fxcdp","geo_precision":"street","storenum":664,"strcity":"Hays"},"type":"Feature","geometry":{"type":"Point","coordinates":[-99.317811,38.898261]}},{"properties":{"st":"21","streetaddr":"725 CAMPBELLSVILLE BYPASS","zipcode":"42718","county":"217","date_super":{"end_time":"1996/03/02 00:00:00 -0500","original":"3/1/1996 ","granularity":"day","time":"1996/03/01 00:00:00 -0500"},"geo_score":0.909,"strstate":"KY","conversion":1,"type_store":"Supercenter","opendate":{"end_time":"1981/07/05 00:00:00 -0400","original":"7/4/1981 ","granularity":"day","time":"1981/07/04 00:00:00 -0400"},"id":"a61znt2db40r","geo_precision":"range","storenum":665,"strcity":"Campbellsville"},"type":"Feature","geometry":{"type":"Point","coordinates":[-85.371455,37.346188]}},{"properties":{"st":"12","streetaddr":"3525 US HWY 27 NORTH","zipcode":"33870","county":"055","date_super":{"end_time":"1998/03/02 00:00:00 -0500","original":"3/1/1998 ","granularity":"day","time":"1998/03/01 00:00:00 -0500"},"geo_score":0.885,"strstate":"FL","conversion":1,"type_store":"Supercenter","opendate":{"end_time":"1984/11/30 00:00:00 -0500","original":"11/29/1984 ","granularity":"day","time":"1984/11/29 00:00:00 -0500"},"id":"a61znswwaylq","geo_precision":"range","storenum":666,"strcity":"Sebring"},"type":"Feature","geometry":{"type":"Point","coordinates":[-81.437188,27.466829]}},{"properties":{"st":"47","streetaddr":"2111 NORTH JACKSON STREET","zipcode":"37388","county":"031","date_super":{"end_time":"1995/03/02 00:00:00 -0500","original":"3/1/1995 ","granularity":"day","time":"1995/03/01 00:00:00 -0500"},"geo_score":0.913,"strstate":"TN","conversion":1,"type_store":"Supercenter","opendate":{"end_time":"1981/07/05 00:00:00 -0400","original":"7/4/1981 ","granularity":"day","time":"1981/07/04 00:00:00 -0400"},"id":"a61znt08qs50","geo_precision":"range","storenum":667,"strcity":"Tullahoma"},"type":"Feature","geometry":{"type":"Point","coordinates":[-86.239488,35.39175]}},{"properties":{"st":"47","streetaddr":"915 NO. CHANCERY ST, SUITE 100","zipcode":"37110","county":"177","date_super":{"end_time":"1996/03/02 00:00:00 -0500","original":"3/1/1996 ","granularity":"day","time":"1996/03/01 00:00:00 -0500"},"geo_score":0.468,"strstate":"TN","conversion":1,"type_store":"Supercenter","opendate":{"end_time":"1981/07/05 00:00:00 -0400","original":"7/4/1981 ","granularity":"day","time":"1981/07/04 00:00:00 -0400"},"id":"a61znt1aj3mo","geo_precision":"street","storenum":668,"strcity":"McMinnville"},"type":"Feature","geometry":{"type":"Point","coordinates":[-85.774544,35.680512]}},{"properties":{"st":"13","streetaddr":"2545 E WALNUT AVE","zipcode":"30721","county":"313","date_super":{"end_time":"1996/03/02 00:00:00 -0500","original":"3/1/1996 ","granularity":"day","time":"1996/03/01 00:00:00 -0500"},"geo_score":1.0,"strstate":"GA","conversion":1,"type_store":"Supercenter","opendate":{"end_time":"1981/07/05 00:00:00 -0400","original":"7/4/1981 ","granularity":"day","time":"1981/07/04 00:00:00 -0400"},"id":"a61znszz66zb","geo_precision":"range","storenum":669,"strcity":"Dalton"},"type":"Feature","geometry":{"type":"Point","coordinates":[-84.923698,34.770894]}},{"properties":{"st":"01","streetaddr":"626 OLIVE STREET SW","zipcode":"35055","county":"043","date_super":{"end_time":"2002/04/18 00:00:00 -0400","original":"4/17/2002 ","granularity":"day","time":"2002/04/17 00:00:00 -0400"},"geo_score":0.722,"strstate":"AL","conversion":1,"type_store":"Supercenter","opendate":{"end_time":"1981/07/05 00:00:00 -0400","original":"7/4/1981 ","granularity":"day","time":"1981/07/04 00:00:00 -0400"},"id":"a61znt5sx1ug","geo_precision":"street","storenum":670,"strcity":"Cullman"},"type":"Feature","geometry":{"type":"Point","coordinates":[-86.83404,34.15151]}},{"properties":{"st":"47","streetaddr":"615 S CUMBERLAND ST","zipcode":"37087","county":"189","date_super":{"end_time":"1995/03/02 00:00:00 -0500","original":"3/1/1995 ","granularity":"day","time":"1995/03/01 00:00:00 -0500"},"geo_score":0.916,"strstate":"TN","conversion":1,"type_store":"Supercenter","opendate":{"end_time":"1981/07/05 00:00:00 -0400","original":"7/4/1981 ","granularity":"day","time":"1981/07/04 00:00:00 -0400"},"id":"a61znt131gsf","geo_precision":"range","storenum":671,"strcity":"Lebanon"},"type":"Feature","geometry":{"type":"Point","coordinates":[-86.29456,36.191873]}},{"properties":{"st":"47","streetaddr":"1030 HUNTERS CROSSING DRIVE","zipcode":"37701","county":"009","date_super":{"end_time":"1996/03/02 00:00:00 -0500","original":"3/1/1996 ","granularity":"day","time":"1996/03/01 00:00:00 -0500"},"geo_score":0.444,"strstate":"TN","conversion":1,"type_store":"Supercenter","opendate":{"end_time":"1981/07/05 00:00:00 -0400","original":"7/4/1981 ","granularity":"day","time":"1981/07/04 00:00:00 -0400"},"id":"a61znsv27jpx","geo_precision":"street","storenum":672,"strcity":"Alcoa"},"type":"Feature","geometry":{"type":"Point","coordinates":[-84.137882,35.798514]}},{"properties":{"st":"47","streetaddr":"3050 WILMA RUDOLPH BLVD","zipcode":"37040","county":"125","date_super":{"end_time":"1995/03/02 00:00:00 -0500","original":"3/1/1995 ","granularity":"day","time":"1995/03/01 00:00:00 -0500"},"geo_score":0.92,"strstate":"TN","conversion":1,"type_store":"Supercenter","opendate":{"end_time":"1987/06/03 00:00:00 -0400","original":"6/2/1987 ","granularity":"day","time":"1987/06/02 00:00:00 -0400"},"id":"a61znt4ssyfz","geo_precision":"range","storenum":673,"strcity":"Clarksville"},"type":"Feature","geometry":{"type":"Point","coordinates":[-87.290151,36.592302]}},{"properties":{"st":"47","streetaddr":"1112 NASHVILLE PIKE","zipcode":"37066","county":"165","date_super":{"end_time":"1997/03/02 00:00:00 -0500","original":"3/1/1997 ","granularity":"day","time":"1997/03/01 00:00:00 -0500"},"geo_score":0.92,"strstate":"TN","conversion":1,"type_store":"Supercenter","opendate":{"end_time":"1981/08/13 00:00:00 -0400","original":"8/12/1981 ","granularity":"day","time":"1981/08/12 00:00:00 -0400"},"id":"a61znsyq7knr","geo_precision":"range","storenum":674,"strcity":"Gallatin"},"type":"Feature","geometry":{"type":"Point","coordinates":[-86.46892,36.377775]}},{"properties":{"st":"47","streetaddr":"1601 W REELFOOT AVE","zipcode":"38261","county":"131","date_super":{"end_time":"1995/03/02 00:00:00 -0500","original":"3/1/1995 ","granularity":"day","time":"1995/03/01 00:00:00 -0500"},"geo_score":0.924,"strstate":"TN","conversion":1,"type_store":"Supercenter","opendate":{"end_time":"1981/07/05 00:00:00 -0400","original":"7/4/1981 ","granularity":"day","time":"1981/07/04 00:00:00 -0400"},"id":"a61znt6f0m26","geo_precision":"range","storenum":675,"strcity":"Union City"},"type":"Feature","geometry":{"type":"Point","coordinates":[-89.077604,36.412606]}},{"properties":{"st":"47","streetaddr":"1102 NO. GATEWAY AVE","zipcode":"37854","county":"145","date_super":{"end_time":"2001/03/15 00:00:00 -0500","original":"3/14/2001 ","granularity":"day","time":"2001/03/14 00:00:00 -0500"},"geo_score":0.468,"strstate":"TN","conversion":1,"type_store":"Supercenter","opendate":{"end_time":"1981/07/05 00:00:00 -0400","original":"7/4/1981 ","granularity":"day","time":"1981/07/04 00:00:00 -0400"},"id":"a61znt0zhhc7","geo_precision":"street","storenum":676,"strcity":"Rockwood"},"type":"Feature","geometry":{"type":"Point","coordinates":[-84.684002,35.867889]}},{"properties":{"st":"47","streetaddr":"2650 LAKE ROAD","zipcode":"38024","county":"045","date_super":{"end_time":"1994/03/02 00:00:00 -0500","original":"3/1/1994 ","granularity":"day","time":"1994/03/01 00:00:00 -0500"},"geo_score":0.913,"strstate":"TN","conversion":1,"type_store":"Supercenter","opendate":{"end_time":"1981/07/05 00:00:00 -0400","original":"7/4/1981 ","granularity":"day","time":"1981/07/04 00:00:00 -0400"},"id":"a61znsyayhtr","geo_precision":"range","storenum":677,"strcity":"Dyersburg"},"type":"Feature","geometry":{"type":"Point","coordinates":[-89.395806,36.063421]}},{"properties":{"st":"47","streetaddr":"1075 COSBY HWY","zipcode":"37821","county":"029","date_super":{"end_time":"1995/03/02 00:00:00 -0500","original":"3/1/1995 ","granularity":"day","time":"1995/03/01 00:00:00 -0500"},"geo_score":0.911,"strstate":"TN","conversion":1,"type_store":"Supercenter","opendate":{"end_time":"1981/07/05 00:00:00 -0400","original":"7/4/1981 ","granularity":"day","time":"1981/07/04 00:00:00 -0400"},"id":"a61znt5pnjyr","geo_precision":"range","storenum":678,"strcity":"Newport"},"type":"Feature","geometry":{"type":"Point","coordinates":[-83.209443,35.942189]}},{"properties":{"st":"47","streetaddr":"3755 E ANDREW JOHNSON HWY","zipcode":"37745","county":"059","date_super":{"end_time":"2005/04/14 00:00:00 -0400","original":"4/13/2005 ","granularity":"day","time":"2005/04/13 00:00:00 -0400"},"geo_score":0.808,"strstate":"TN","conversion":1,"type_store":"Supercenter","opendate":{"end_time":"1981/07/05 00:00:00 -0400","original":"7/4/1981 ","granularity":"day","time":"1981/07/04 00:00:00 -0400"},"id":"a61znt62umpl","geo_precision":"street","storenum":680,"strcity":"Greeneville"},"type":"Feature","geometry":{"type":"Point","coordinates":[-82.76181,36.185767]}},{"properties":{"st":"01","streetaddr":"11697 U.S. HWY 431","zipcode":"35976","county":"095","date_super":{"end_time":"1996/03/02 00:00:00 -0500","original":"3/1/1996 ","granularity":"day","time":"1996/03/01 00:00:00 -0500"},"geo_score":0.494,"strstate":"AL","conversion":1,"type_store":"Supercenter","opendate":{"end_time":"1981/07/05 00:00:00 -0400","original":"7/4/1981 ","granularity":"day","time":"1981/07/04 00:00:00 -0400"},"id":"a61znt2s6a2u","geo_precision":"street","storenum":681,"strcity":"Guntersville"},"type":"Feature","geometry":{"type":"Point","coordinates":[-86.292442,34.359465]}},{"properties":{"st":"47","streetaddr":"2000 OLD FORT PARKWAY","zipcode":"37129","county":"149","date_super":{"end_time":"1995/03/02 00:00:00 -0500","original":"3/1/1995 ","granularity":"day","time":"1995/03/01 00:00:00 -0500"},"geo_score":1.0,"strstate":"TN","conversion":1,"type_store":"Supercenter","opendate":{"end_time":"1981/07/05 00:00:00 -0400","original":"7/4/1981 ","granularity":"day","time":"1981/07/04 00:00:00 -0400"},"id":"a61znt25ubsq","geo_precision":"range","storenum":682,"strcity":"Murfreesboro"},"type":"Feature","geometry":{"type":"Point","coordinates":[-86.427338,35.846252]}},{"properties":{"st":"47","streetaddr":"2130 NO.LOCUST AVE","zipcode":"38464","county":"099","date_super":{"end_time":"1996/03/02 00:00:00 -0500","original":"3/1/1996 ","granularity":"day","time":"1996/03/01 00:00:00 -0500"},"geo_score":0.538,"strstate":"TN","conversion":1,"type_store":"Supercenter","opendate":{"end_time":"1981/07/05 00:00:00 -0400","original":"7/4/1981 ","granularity":"day","time":"1981/07/04 00:00:00 -0400"},"id":"a61znsyhgvww","geo_precision":"street","storenum":683,"strcity":"Lawrenceburg"},"type":"Feature","geometry":{"type":"Point","coordinates":[-87.330182,35.2414]}},{"properties":{"st":"47","streetaddr":"547 WEST CHURCH ST.","zipcode":"38351","county":"077","date_super":{"end_time":"2002/10/17 00:00:00 -0400","original":"10/16/2002 ","granularity":"day","time":"2002/10/16 00:00:00 -0400"},"geo_score":0.789,"strstate":"TN","conversion":1,"type_store":"Supercenter","opendate":{"end_time":"1981/07/05 00:00:00 -0400","original":"7/4/1981 ","granularity":"day","time":"1981/07/04 00:00:00 -0400"},"id":"a61znt6dpaiq","geo_precision":"range","storenum":684,"strcity":"Lexington"},"type":"Feature","geometry":{"type":"Point","coordinates":[-88.407925,35.656506]}},{"properties":{"st":"47","streetaddr":"475 SO. DAVY CROCKETT PKWY","zipcode":"37813","county":"063","date_super":{"end_time":"2001/07/19 00:00:00 -0400","original":"7/18/2001 ","granularity":"day","time":"2001/07/18 00:00:00 -0400"},"geo_score":0.622,"strstate":"TN","conversion":1,"type_store":"Supercenter","opendate":{"end_time":"1981/07/05 00:00:00 -0400","original":"7/4/1981 ","granularity":"day","time":"1981/07/04 00:00:00 -0400"},"id":"a61znt2y8din","geo_precision":"street","storenum":685,"strcity":"Morristown"},"type":"Feature","geometry":{"type":"Point","coordinates":[-83.257458,36.216156]}},{"properties":{"st":"13","streetaddr":"120 BENJAMIN H HILL DR. SW","zipcode":"31750","county":"017","date_super":{"end_time":"2004/03/18 00:00:00 -0500","original":"3/17/2004 ","granularity":"day","time":"2004/03/17 00:00:00 -0500"},"geo_score":0.504,"strstate":"GA","conversion":1,"type_store":"Supercenter","opendate":{"end_time":"1985/02/06 00:00:00 -0500","original":"2/5/1985 ","granularity":"day","time":"1985/02/05 00:00:00 -0500"},"id":"a61znt9tj5t9","geo_precision":"street","storenum":686,"strcity":"Fitzgerald"},"type":"Feature","geometry":{"type":"Point","coordinates":[-83.263577,31.713502]}},{"properties":{"st":"47","streetaddr":"2542 NORTH MAIN STREET","zipcode":"38555","county":"035","date_super":{"end_time":"1996/03/02 00:00:00 -0500","original":"3/1/1996 ","granularity":"day","time":"1996/03/01 00:00:00 -0500"},"geo_score":0.912,"strstate":"TN","conversion":1,"type_store":"Supercenter","opendate":{"end_time":"1981/07/05 00:00:00 -0400","original":"7/4/1981 ","granularity":"day","time":"1981/07/04 00:00:00 -0400"},"id":"a61znt4gzjpe","geo_precision":"range","storenum":687,"strcity":"Crossville"},"type":"Feature","geometry":{"type":"Point","coordinates":[-85.038579,35.982151]}},{"properties":{"st":"47","streetaddr":"5520 NOLENSVILLE PIKE","zipcode":"37211","county":"037","date_super":null,"geo_score":0.913,"strstate":"TN","conversion":null,"type_store":"Wal-Mart","opendate":{"end_time":"1981/07/05 00:00:00 -0400","original":"7/4/1981 ","granularity":"day","time":"1981/07/04 00:00:00 -0400"},"id":"a61znt64mnat","geo_precision":"range","storenum":688,"strcity":"Nashville"},"type":"Feature","geometry":{"type":"Point","coordinates":[-86.71378,36.049308]}},{"properties":{"st":"21","streetaddr":"177 WASHINGTON DRIVE","zipcode":"42503","county":"199","date_super":{"end_time":"2000/03/02 00:00:00 -0500","original":"3/1/2000 ","granularity":"day","time":"2000/03/01 00:00:00 -0500"},"geo_score":0.683,"strstate":"KY","conversion":1,"type_store":"Supercenter","opendate":{"end_time":"1981/07/05 00:00:00 -0400","original":"7/4/1981 ","granularity":"day","time":"1981/07/04 00:00:00 -0400"},"id":"a61znt3xlt7c","geo_precision":"zip","storenum":689,"strcity":"Somerset"},"type":"Feature","geometry":{"type":"Point","coordinates":[-84.518445,37.131938]}},{"properties":{"st":"47","streetaddr":"1001 OVER MOUNTAIN AVENUE","zipcode":"37643","county":"019","date_super":{"end_time":"2005/01/27 00:00:00 -0500","original":"1/26/2005 ","granularity":"day","time":"2005/01/26 00:00:00 -0500"},"geo_score":0.49,"strstate":"TN","conversion":1,"type_store":"Supercenter","opendate":{"end_time":"1981/07/05 00:00:00 -0400","original":"7/4/1981 ","granularity":"day","time":"1981/07/04 00:00:00 -0400"},"id":"a61znt987cyf","geo_precision":"street","storenum":690,"strcity":"Elizabethton"},"type":"Feature","geometry":{"type":"Point","coordinates":[-82.225994,36.380523]}},{"properties":{"st":"01","streetaddr":"2001 GLENN BLDV SW","zipcode":"35968","county":"049","date_super":{"end_time":"1996/03/02 00:00:00 -0500","original":"3/1/1996 ","granularity":"day","time":"1996/03/01 00:00:00 -0500"},"geo_score":0.947,"strstate":"AL","conversion":1,"type_store":"Supercenter","opendate":{"end_time":"1981/07/05 00:00:00 -0400","original":"7/4/1981 ","granularity":"day","time":"1981/07/04 00:00:00 -0400"},"id":"a61znt3moebm","geo_precision":"range","storenum":691,"strcity":"Fort Payne"},"type":"Feature","geometry":{"type":"Point","coordinates":[-85.758957,34.438506]}},{"properties":{"st":"21","streetaddr":"100 WALTON AVE","zipcode":"40422","county":"021","date_super":{"end_time":"1995/03/02 00:00:00 -0500","original":"3/1/1995 ","granularity":"day","time":"1995/03/01 00:00:00 -0500"},"geo_score":0.956,"strstate":"KY","conversion":1,"type_store":"Supercenter","opendate":{"end_time":"1981/07/05 00:00:00 -0400","original":"7/4/1981 ","granularity":"day","time":"1981/07/04 00:00:00 -0400"},"id":"a61znsxvfnjw","geo_precision":"range","storenum":692,"strcity":"Danville"},"type":"Feature","geometry":{"type":"Point","coordinates":[-84.772962,37.613944]}},{"properties":{"st":"21","streetaddr":"1589 KENTUCKY / HWY 15 SOUTH","zipcode":"41339","county":"025","date_super":null,"geo_score":0.74,"strstate":"KY","conversion":null,"type_store":"Wal-Mart","opendate":{"end_time":"1985/07/17 00:00:00 -0400","original":"7/16/1985 ","granularity":"day","time":"1985/07/16 00:00:00 -0400"},"id":"a61znstzgs18","geo_precision":"street","storenum":693,"strcity":"Jackson"},"type":"Feature","geometry":{"type":"Point","coordinates":[-83.378637,37.554735]}},{"properties":{"st":"21","streetaddr":"2480 US HWY 41 NORTH","zipcode":"42420","county":"101","date_super":null,"geo_score":0.888,"strstate":"KY","conversion":null,"type_store":"Wal-Mart","opendate":{"end_time":"1981/07/05 00:00:00 -0400","original":"7/4/1981 ","granularity":"day","time":"1981/07/04 00:00:00 -0400"},"id":"a61znt3hmwkw","geo_precision":"range","storenum":694,"strcity":"Henderson"},"type":"Feature","geometry":{"type":"Point","coordinates":[-87.569792,37.87191]}},{"properties":{"st":"47","streetaddr":"2232 GALLATIN PIKE NORTH","zipcode":"37115","county":"037","date_super":null,"geo_score":0.913,"strstate":"TN","conversion":null,"type_store":"Wal-Mart","opendate":{"end_time":"1981/07/05 00:00:00 -0400","original":"7/4/1981 ","granularity":"day","time":"1981/07/04 00:00:00 -0400"},"id":"a61znt0mip2h","geo_precision":"range","storenum":695,"strcity":"Nashville"},"type":"Feature","geometry":{"type":"Point","coordinates":[-86.686504,36.306389]}},{"properties":{"st":"21","streetaddr":"477 VILLAGE DRIVE","zipcode":"41653","county":"071","date_super":null,"geo_score":0.602,"strstate":"KY","conversion":null,"type_store":"Wal-Mart","opendate":{"end_time":"1985/09/11 00:00:00 -0400","original":"9/10/1985 ","granularity":"day","time":"1985/09/10 00:00:00 -0400"},"id":"a61znsvap7jy","geo_precision":"zip","storenum":696,"strcity":"Prestonsburg"},"type":"Feature","geometry":{"type":"Point","coordinates":[-82.652656,37.635654]}},{"properties":{"st":"12","streetaddr":"2600 SW 19TH AVE","zipcode":"34474","county":"083","date_super":{"end_time":"2001/04/19 00:00:00 -0400","original":"4/18/2001 ","granularity":"day","time":"2001/04/18 00:00:00 -0400"},"geo_score":0.741,"strstate":"FL","conversion":1,"type_store":"Supercenter","opendate":{"end_time":"1984/10/17 00:00:00 -0400","original":"10/16/1984 ","granularity":"day","time":"1984/10/16 00:00:00 -0400"},"id":"a61znt7p5u4g","geo_precision":"street","storenum":697,"strcity":"Ocala"},"type":"Feature","geometry":{"type":"Point","coordinates":[-82.156669,29.172714]}},{"properties":{"st":"47","streetaddr":"4495 KEITH ST N.W.","zipcode":"37312","county":"011","date_super":{"end_time":"1995/03/02 00:00:00 -0500","original":"3/1/1995 ","granularity":"day","time":"1995/03/01 00:00:00 -0500"},"geo_score":0.571,"strstate":"TN","conversion":1,"type_store":"Supercenter","opendate":{"end_time":"1981/07/05 00:00:00 -0400","original":"7/4/1981 ","granularity":"day","time":"1981/07/04 00:00:00 -0400"},"id":"a61znt4ktuuo","geo_precision":"street","storenum":698,"strcity":"Cleveland"},"type":"Feature","geometry":{"type":"Point","coordinates":[-84.857362,35.19438]}},{"properties":{"st":"28","streetaddr":"2530 WEST JACKSON AVENUE","zipcode":"38655","county":"071","date_super":{"end_time":"2002/08/15 00:00:00 -0400","original":"8/14/2002 ","granularity":"day","time":"2002/08/14 00:00:00 -0400"},"geo_score":0.727,"strstate":"MS","conversion":1,"type_store":"Supercenter","opendate":{"end_time":"1981/07/05 00:00:00 -0400","original":"7/4/1981 ","granularity":"day","time":"1981/07/04 00:00:00 -0400"},"id":"a61znsvzbc36","geo_precision":"street","storenum":699,"strcity":"Oxford"},"type":"Feature","geometry":{"type":"Point","coordinates":[-89.571109,34.361253]}},{"properties":{"st":"01","streetaddr":"1501 HWY 14 EAST","zipcode":"36703","county":"047","date_super":{"end_time":"1995/03/02 00:00:00 -0500","original":"3/1/1995 ","granularity":"day","time":"1995/03/01 00:00:00 -0500"},"geo_score":0.737,"strstate":"AL","conversion":1,"type_store":"Supercenter","opendate":{"end_time":"1981/07/05 00:00:00 -0400","original":"7/4/1981 ","granularity":"day","time":"1981/07/04 00:00:00 -0400"},"id":"a61znt2h6sqs","geo_precision":"range","storenum":700,"strcity":"Selma"},"type":"Feature","geometry":{"type":"Point","coordinates":[-87.010711,32.431475]}},{"properties":{"st":"21","streetaddr":"5031 FREDERICA STREET","zipcode":"42301","county":"059","date_super":{"end_time":"1997/03/02 00:00:00 -0500","original":"3/1/1997 ","granularity":"day","time":"1997/03/01 00:00:00 -0500"},"geo_score":0.924,"strstate":"KY","conversion":1,"type_store":"Supercenter","opendate":{"end_time":"1981/07/05 00:00:00 -0400","original":"7/4/1981 ","granularity":"day","time":"1981/07/04 00:00:00 -0400"},"id":"a61znt67i4t6","geo_precision":"range","storenum":701,"strcity":"Owensboro"},"type":"Feature","geometry":{"type":"Point","coordinates":[-87.124443,37.719909]}},{"properties":{"st":"21","streetaddr":"1859 BYPASS RD","zipcode":"40391","county":"049","date_super":{"end_time":"1997/03/02 00:00:00 -0500","original":"3/1/1997 ","granularity":"day","time":"1997/03/01 00:00:00 -0500"},"geo_score":0.809,"strstate":"KY","conversion":1,"type_store":"Supercenter","opendate":{"end_time":"1981/07/05 00:00:00 -0400","original":"7/4/1981 ","granularity":"day","time":"1981/07/04 00:00:00 -0400"},"id":"a61znt0oepj5","geo_precision":"range","storenum":702,"strcity":"Winchester"},"type":"Feature","geometry":{"type":"Point","coordinates":[-84.209341,37.988757]}},{"properties":{"st":"48","streetaddr":"27650 TOMBALL PKWY","zipcode":"77375","county":"201","date_super":{"end_time":"1999/03/02 00:00:00 -0500","original":"3/1/1999 ","granularity":"day","time":"1999/03/01 00:00:00 -0500"},"geo_score":0.817,"strstate":"TX","conversion":1,"type_store":"Supercenter","opendate":{"end_time":"1984/10/17 00:00:00 -0400","original":"10/16/1984 ","granularity":"day","time":"1984/10/16 00:00:00 -0400"},"id":"a61znt9fttmz","geo_precision":"range","storenum":703,"strcity":"Tomball"},"type":"Feature","geometry":{"type":"Point","coordinates":[-95.625259,30.070881]}},{"properties":{"st":"12","streetaddr":"17030 US HWY 441","zipcode":"32757","county":"069","date_super":{"end_time":"1997/03/02 00:00:00 -0500","original":"3/1/1997 ","granularity":"day","time":"1997/03/01 00:00:00 -0500"},"geo_score":0.738,"strstate":"FL","conversion":1,"type_store":"Supercenter","opendate":{"end_time":"1984/09/19 00:00:00 -0400","original":"9/18/1984 ","granularity":"day","time":"1984/09/18 00:00:00 -0400"},"id":"a61znt756alb","geo_precision":"street","storenum":705,"strcity":"Mount Dora"},"type":"Feature","geometry":{"type":"Point","coordinates":[-81.676332,28.82107]}},{"properties":{"st":"12","streetaddr":"7631 GALL BOULEVARD","zipcode":"33540","county":"101","date_super":{"end_time":"2002/09/19 00:00:00 -0400","original":"9/18/2002 ","granularity":"day","time":"2002/09/18 00:00:00 -0400"},"geo_score":0.626,"strstate":"FL","conversion":1,"type_store":"Supercenter","opendate":{"end_time":"1984/09/01 00:00:00 -0400","original":"8/31/1984 ","granularity":"day","time":"1984/08/31 00:00:00 -0400"},"id":"a61znsxobdq3","geo_precision":"street","storenum":706,"strcity":"Zephyrhills"},"type":"Feature","geometry":{"type":"Point","coordinates":[-82.183832,28.20918]}},{"properties":{"st":"28","streetaddr":"1000 SO. STATE STREET","zipcode":"38614","county":"027","date_super":{"end_time":"2005/01/27 00:00:00 -0500","original":"1/26/2005 ","granularity":"day","time":"2005/01/26 00:00:00 -0500"},"geo_score":0.496,"strstate":"MS","conversion":1,"type_store":"Supercenter","opendate":{"end_time":"1981/07/05 00:00:00 -0400","original":"7/4/1981 ","granularity":"day","time":"1981/07/04 00:00:00 -0400"},"id":"a61znt88g4ot","geo_precision":"street","storenum":707,"strcity":"Clarksdale"},"type":"Feature","geometry":{"type":"Point","coordinates":[-90.570869,34.192355]}},{"properties":{"st":"28","streetaddr":"2150 IOWA BLVD","zipcode":"39180","county":"149","date_super":{"end_time":"1998/03/02 00:00:00 -0500","original":"3/1/1998 ","granularity":"day","time":"1998/03/01 00:00:00 -0500"},"geo_score":0.913,"strstate":"MS","conversion":1,"type_store":"Supercenter","opendate":{"end_time":"1985/05/15 00:00:00 -0400","original":"5/14/1985 ","granularity":"day","time":"1985/05/14 00:00:00 -0400"},"id":"a61znsy5t8pl","geo_precision":"range","storenum":708,"strcity":"Vicksburg"},"type":"Feature","geometry":{"type":"Point","coordinates":[-90.891844,32.306432]}},{"properties":{"st":"21","streetaddr":"100 WAL-MART DRIVE","zipcode":"42701","county":"093","date_super":{"end_time":"1996/03/02 00:00:00 -0500","original":"3/1/1996 ","granularity":"day","time":"1996/03/01 00:00:00 -0500"},"geo_score":0.932,"strstate":"KY","conversion":1,"type_store":"Supercenter","opendate":{"end_time":"1981/07/05 00:00:00 -0400","original":"7/4/1981 ","granularity":"day","time":"1981/07/04 00:00:00 -0400"},"id":"a61znsvl7rxq","geo_precision":"range","storenum":709,"strcity":"Elizabethtown"},"type":"Feature","geometry":{"type":"Point","coordinates":[-85.885464,37.731244]}},{"properties":{"st":"47","streetaddr":"4424 LEBANON PIKE","zipcode":"37076","county":"037","date_super":{"end_time":"2004/01/29 00:00:00 -0500","original":"1/28/2004 ","granularity":"day","time":"2004/01/28 00:00:00 -0500"},"geo_score":0.965,"strstate":"TN","conversion":1,"type_store":"Supercenter","opendate":{"end_time":"1981/07/05 00:00:00 -0400","original":"7/4/1981 ","granularity":"day","time":"1981/07/04 00:00:00 -0400"},"id":"a61znsu8b6yi","geo_precision":"range","storenum":710,"strcity":"Hermitage"},"type":"Feature","geometry":{"type":"Point","coordinates":[-86.610512,36.208968]}},{"properties":{"st":"21","streetaddr":"2345 HAPPY VALLEY ROAD","zipcode":"42141","county":"009","date_super":{"end_time":"2005/04/14 00:00:00 -0400","original":"4/13/2005 ","granularity":"day","time":"2005/04/13 00:00:00 -0400"},"geo_score":0.912,"strstate":"KY","conversion":1,"type_store":"Supercenter","opendate":{"end_time":"1981/07/05 00:00:00 -0400","original":"7/4/1981 ","granularity":"day","time":"1981/07/04 00:00:00 -0400"},"id":"a61znswlmw2b","geo_precision":"range","storenum":711,"strcity":"Glasgow"},"type":"Feature","geometry":{"type":"Point","coordinates":[-85.933994,37.022278]}},{"properties":{"st":"01","streetaddr":"24833 JOHNT REIDPRKW","zipcode":"35768","county":"071","date_super":{"end_time":"1999/03/02 00:00:00 -0500","original":"3/1/1999 ","granularity":"day","time":"1999/03/01 00:00:00 -0500"},"geo_score":0.866,"strstate":"AL","conversion":1,"type_store":"Supercenter","opendate":{"end_time":"1981/07/05 00:00:00 -0400","original":"7/4/1981 ","granularity":"day","time":"1981/07/04 00:00:00 -0400"},"id":"a61znta44p6c","geo_precision":"range","storenum":712,"strcity":"Scottsboro"},"type":"Feature","geometry":{"type":"Point","coordinates":[-86.00753,34.671991]}},{"properties":{"st":"12","streetaddr":"12650 HWY 301 SOUTH","zipcode":"33525","county":"101","date_super":null,"geo_score":0.802,"strstate":"FL","conversion":null,"type_store":"Wal-Mart","opendate":{"end_time":"1984/10/24 00:00:00 -0400","original":"10/23/1984 ","granularity":"day","time":"1984/10/23 00:00:00 -0400"},"id":"a61znt2iin3b","geo_precision":"range","storenum":713,"strcity":"Dade City"},"type":"Feature","geometry":{"type":"Point","coordinates":[-82.187565,28.341526]}},{"properties":{"st":"05","streetaddr":"602 SHELIA STREET","zipcode":"72390","county":"107","date_super":{"end_time":"1994/03/02 00:00:00 -0500","original":"3/1/1994 ","granularity":"day","time":"1994/03/01 00:00:00 -0500"},"geo_score":0.513,"strstate":"AR","conversion":1,"type_store":"Supercenter","opendate":{"end_time":"1981/07/05 00:00:00 -0400","original":"7/4/1981 ","granularity":"day","time":"1981/07/04 00:00:00 -0400"},"id":"a61znswrklys","geo_precision":"street","storenum":714,"strcity":"West Helena5119"},"type":"Feature","geometry":{"type":"Point","coordinates":[-90.148769,35.506313]}},{"properties":{"st":"01","streetaddr":"1501 SKYLAND BLVD E","zipcode":"35405","county":"125","date_super":{"end_time":"1994/03/02 00:00:00 -0500","original":"3/1/1994 ","granularity":"day","time":"1994/03/01 00:00:00 -0500"},"geo_score":1.0,"strstate":"AL","conversion":1,"type_store":"Supercenter","opendate":{"end_time":"1981/07/05 00:00:00 -0400","original":"7/4/1981 ","granularity":"day","time":"1981/07/04 00:00:00 -0400"},"id":"a61znt6xx4lq","geo_precision":"range","storenum":715,"strcity":"Tuscaloosa"},"type":"Feature","geometry":{"type":"Point","coordinates":[-87.516711,33.16847]}},{"properties":{"st":"28","streetaddr":"2302 HWY 82 WEST","zipcode":"38930","county":"083","date_super":null,"geo_score":0.913,"strstate":"MS","conversion":null,"type_store":"Wal-Mart","opendate":{"end_time":"1981/07/05 00:00:00 -0400","original":"7/4/1981 ","granularity":"day","time":"1981/07/04 00:00:00 -0400"},"id":"a61znsw0qzz1","geo_precision":"range","storenum":716,"strcity":"Greenwood"},"type":"Feature","geometry":{"type":"Point","coordinates":[-90.230223,33.529739]}},{"properties":{"st":"12","streetaddr":"2120 US HWY 92 WEST","zipcode":"33823","county":"105","date_super":{"end_time":"2004/05/20 00:00:00 -0400","original":"5/19/2004 ","granularity":"day","time":"2004/05/19 00:00:00 -0400"},"geo_score":0.89,"strstate":"FL","conversion":1,"type_store":"Supercenter","opendate":{"end_time":"1984/11/14 00:00:00 -0500","original":"11/13/1984 ","granularity":"day","time":"1984/11/13 00:00:00 -0500"},"id":"a61znt08y8vu","geo_precision":"range","storenum":718,"strcity":"Auburndale"},"type":"Feature","geometry":{"type":"Point","coordinates":[-81.821183,28.056651]}},{"properties":{"st":"21","streetaddr":"820 EASTERN BYPASS","zipcode":"40475","county":"151","date_super":{"end_time":"1996/03/02 00:00:00 -0500","original":"3/1/1996 ","granularity":"day","time":"1996/03/01 00:00:00 -0500"},"geo_score":0.902,"strstate":"KY","conversion":1,"type_store":"Supercenter","opendate":{"end_time":"1981/07/05 00:00:00 -0400","original":"7/4/1981 ","granularity":"day","time":"1981/07/04 00:00:00 -0400"},"id":"a61znt6w5q3m","geo_precision":"range","storenum":719,"strcity":"Richmond"},"type":"Feature","geometry":{"type":"Point","coordinates":[-84.274684,37.733307]}},{"properties":{"st":"21","streetaddr":"301 LEONARDWOOD DRIVE","zipcode":"40601","county":"073","date_super":{"end_time":"1997/03/02 00:00:00 -0500","original":"3/1/1997 ","granularity":"day","time":"1997/03/01 00:00:00 -0500"},"geo_score":0.902,"strstate":"KY","conversion":1,"type_store":"Supercenter","opendate":{"end_time":"1981/07/05 00:00:00 -0400","original":"7/4/1981 ","granularity":"day","time":"1981/07/04 00:00:00 -0400"},"id":"a61znsxt4qq5","geo_precision":"range","storenum":720,"strcity":"Frankfort"},"type":"Feature","geometry":{"type":"Point","coordinates":[-84.900117,38.159391]}},{"properties":{"st":"12","streetaddr":"19100 MURDOCK CIRCLE","zipcode":"33948","county":"015","date_super":{"end_time":"1995/03/02 00:00:00 -0500","original":"3/1/1995 ","granularity":"day","time":"1995/03/01 00:00:00 -0500"},"geo_score":0.807,"strstate":"FL","conversion":1,"type_store":"Supercenter","opendate":{"end_time":"1985/01/23 00:00:00 -0500","original":"1/22/1985 ","granularity":"day","time":"1985/01/22 00:00:00 -0500"},"id":"a61znt9gwxdb","geo_precision":"street","storenum":721,"strcity":"Port Charlotte"},"type":"Feature","geometry":{"type":"Point","coordinates":[-82.141655,27.014357]}},{"properties":{"st":"13","streetaddr":"1735 SOUTH PARK STREET","zipcode":"30117","county":"045","date_super":{"end_time":"2006/01/24 00:00:00 -0500","original":"1/23/2006 ","granularity":"day","time":"2006/01/23 00:00:00 -0500"},"geo_score":0.727,"strstate":"GA","conversion":1,"type_store":"Supercenter","opendate":{"end_time":"1981/07/05 00:00:00 -0400","original":"7/4/1981 ","granularity":"day","time":"1981/07/04 00:00:00 -0400"},"id":"a61znsxo27cu","geo_precision":"street","storenum":722,"strcity":"Carrollton"},"type":"Feature","geometry":{"type":"Point","coordinates":[-85.073298,33.561112]}},{"properties":{"st":"01","streetaddr":"1420 US 231 SOUTH","zipcode":"36081","county":"109","date_super":{"end_time":"1999/03/02 00:00:00 -0500","original":"3/1/1999 ","granularity":"day","time":"1999/03/01 00:00:00 -0500"},"geo_score":0.572,"strstate":"AL","conversion":1,"type_store":"Supercenter","opendate":{"end_time":"1981/07/05 00:00:00 -0400","original":"7/4/1981 ","granularity":"day","time":"1981/07/04 00:00:00 -0400"},"id":"a61znsxciodk","geo_precision":"street","storenum":723,"strcity":"Troy"},"type":"Feature","geometry":{"type":"Point","coordinates":[-85.947451,31.780796]}},{"properties":{"st":"47","streetaddr":"630 EAST BROADWAY","zipcode":"37760","county":"089","date_super":{"end_time":"1995/03/02 00:00:00 -0500","original":"3/1/1995 ","granularity":"day","time":"1995/03/01 00:00:00 -0500"},"geo_score":0.82,"strstate":"TN","conversion":1,"type_store":"Supercenter","opendate":{"end_time":"1984/11/14 00:00:00 -0500","original":"11/13/1984 ","granularity":"day","time":"1984/11/13 00:00:00 -0500"},"id":"a61znsvf41t2","geo_precision":"range","storenum":724,"strcity":"Jefferson City"},"type":"Feature","geometry":{"type":"Point","coordinates":[-83.467489,36.127334]}},{"properties":{"st":"12","streetaddr":"36205 US HIGHWAY 27","zipcode":"33844","county":"105","date_super":{"end_time":"1999/03/02 00:00:00 -0500","original":"3/1/1999 ","granularity":"day","time":"1999/03/01 00:00:00 -0500"},"geo_score":0.724,"strstate":"FL","conversion":1,"type_store":"Supercenter","opendate":{"end_time":"1984/10/17 00:00:00 -0400","original":"10/16/1984 ","granularity":"day","time":"1984/10/16 00:00:00 -0400"},"id":"a61znsuglezh","geo_precision":"street","storenum":725,"strcity":"Haines City"},"type":"Feature","geometry":{"type":"Point","coordinates":[-81.636881,28.060048]}},{"properties":{"st":"01","streetaddr":"2643 HWY 280 WEST","zipcode":"35010","county":"123","date_super":{"end_time":"1996/03/02 00:00:00 -0500","original":"3/1/1996 ","granularity":"day","time":"1996/03/01 00:00:00 -0500"},"geo_score":0.8,"strstate":"AL","conversion":1,"type_store":"Supercenter","opendate":{"end_time":"1981/07/05 00:00:00 -0400","original":"7/4/1981 ","granularity":"day","time":"1981/07/04 00:00:00 -0400"},"id":"a61znsvb1akz","geo_precision":"range","storenum":726,"strcity":"Alexander City"},"type":"Feature","geometry":{"type":"Point","coordinates":[-85.971831,32.934204]}},{"properties":{"st":"13","streetaddr":"109 DAVIS ROAD","zipcode":"30125","county":"233","date_super":null,"geo_score":0.586,"strstate":"GA","conversion":null,"type_store":"Wal-Mart","opendate":{"end_time":"1981/07/05 00:00:00 -0400","original":"7/4/1981 ","granularity":"day","time":"1981/07/04 00:00:00 -0400"},"id":"a61znt58c08e","geo_precision":"street","storenum":727,"strcity":"Cedartown"},"type":"Feature","geometry":{"type":"Point","coordinates":[-85.228152,34.043932]}},{"properties":{"st":"45","streetaddr":"25 PEMBROKE DRIVE","zipcode":"29926","county":"013","date_super":null,"geo_score":0.988,"strstate":"SC","conversion":null,"type_store":"Wal-Mart","opendate":{"end_time":"1985/01/23 00:00:00 -0500","original":"1/22/1985 ","granularity":"day","time":"1985/01/22 00:00:00 -0500"},"id":"a61znsuau8no","geo_precision":"range","storenum":728,"strcity":"Hilton Hd Island"},"type":"Feature","geometry":{"type":"Point","coordinates":[-80.723944,32.209078]}},{"properties":{"st":"21","streetaddr":"3795 E. JOHN ROWAN BLVD","zipcode":"40004","county":"179","date_super":{"end_time":"2004/10/28 00:00:00 -0400","original":"10/27/2004 ","granularity":"day","time":"2004/10/27 00:00:00 -0400"},"geo_score":0.507,"strstate":"KY","conversion":1,"type_store":"Supercenter","opendate":{"end_time":"1981/07/05 00:00:00 -0400","original":"7/4/1981 ","granularity":"day","time":"1981/07/04 00:00:00 -0400"},"id":"a61znt2c9qik","geo_precision":"street","storenum":729,"strcity":"Bardstown"},"type":"Feature","geometry":{"type":"Point","coordinates":[-85.458379,37.825448]}},{"properties":{"st":"01","streetaddr":"41301 U.S. HWY 280","zipcode":"35150","county":"121","date_super":{"end_time":"1996/03/02 00:00:00 -0500","original":"3/1/1996 ","granularity":"day","time":"1996/03/01 00:00:00 -0500"},"geo_score":0.518,"strstate":"AL","conversion":1,"type_store":"Supercenter","opendate":{"end_time":"1981/07/05 00:00:00 -0400","original":"7/4/1981 ","granularity":"day","time":"1981/07/04 00:00:00 -0400"},"id":"a61znsz7o3b8","geo_precision":"street","storenum":730,"strcity":"Sylacauga"},"type":"Feature","geometry":{"type":"Point","coordinates":[-86.344988,33.256696]}},{"properties":{"st":"01","streetaddr":"969 US HWY 80 WEST","zipcode":"36732","county":"091","date_super":{"end_time":"2006/01/24 00:00:00 -0500","original":"1/23/2006 ","granularity":"day","time":"2006/01/23 00:00:00 -0500"},"geo_score":0.682,"strstate":"AL","conversion":1,"type_store":"Supercenter","opendate":{"end_time":"1981/07/05 00:00:00 -0400","original":"7/4/1981 ","granularity":"day","time":"1981/07/04 00:00:00 -0400"},"id":"a61znsw79v3h","geo_precision":"street","storenum":731,"strcity":"Demopolis"},"type":"Feature","geometry":{"type":"Point","coordinates":[-87.823794,32.503315]}},{"properties":{"st":"01","streetaddr":"3501 20TH AV","zipcode":"36854","county":"017","date_super":{"end_time":"1997/03/02 00:00:00 -0500","original":"3/1/1997 ","granularity":"day","time":"1997/03/01 00:00:00 -0500"},"geo_score":0.793,"strstate":"AL","conversion":1,"type_store":"Supercenter","opendate":{"end_time":"1981/07/05 00:00:00 -0400","original":"7/4/1981 ","granularity":"day","time":"1981/07/04 00:00:00 -0400"},"id":"a61znt1u3m6x","geo_precision":"range","storenum":733,"strcity":"Valley"},"type":"Feature","geometry":{"type":"Point","coordinates":[-85.156651,32.787582]}},{"properties":{"st":"01","streetaddr":"600 BOLL WEEVIL CIRCLE","zipcode":"36330","county":"031","date_super":{"end_time":"1994/03/02 00:00:00 -0500","original":"3/1/1994 ","granularity":"day","time":"1994/03/01 00:00:00 -0500"},"geo_score":0.912,"strstate":"AL","conversion":1,"type_store":"Supercenter","opendate":{"end_time":"1981/07/05 00:00:00 -0400","original":"7/4/1981 ","granularity":"day","time":"1981/07/04 00:00:00 -0400"},"id":"a61znt9dh60p","geo_precision":"range","storenum":734,"strcity":"Enterprise"},"type":"Feature","geometry":{"type":"Point","coordinates":[-85.86491,31.33345]}},{"properties":{"st":"47","streetaddr":"2675 DECHERD BLVD","zipcode":"37398","county":"051","date_super":{"end_time":"1995/03/02 00:00:00 -0500","original":"3/1/1995 ","granularity":"day","time":"1995/03/01 00:00:00 -0500"},"geo_score":0.96,"strstate":"TN","conversion":1,"type_store":"Supercenter","opendate":{"end_time":"1981/07/05 00:00:00 -0400","original":"7/4/1981 ","granularity":"day","time":"1981/07/04 00:00:00 -0400"},"id":"a61znt0apcap","geo_precision":"range","storenum":735,"strcity":"Winchester"},"type":"Feature","geometry":{"type":"Point","coordinates":[-86.100605,35.218471]}},{"properties":{"st":"21","streetaddr":"120 SAM WALTON DRIVE","zipcode":"42276","county":"141","date_super":{"end_time":"2006/01/28 00:00:00 -0500","original":"1/27/2006 ","granularity":"day","time":"2006/01/27 00:00:00 -0500"},"geo_score":0.469,"strstate":"KY","conversion":1,"type_store":"Supercenter","opendate":{"end_time":"1981/07/05 00:00:00 -0400","original":"7/4/1981 ","granularity":"day","time":"1981/07/04 00:00:00 -0400"},"id":"a61znt2torqd","geo_precision":"street","storenum":736,"strcity":"Russellville"},"type":"Feature","geometry":{"type":"Point","coordinates":[-86.756304,36.982378]}},{"properties":{"st":"47","streetaddr":"1334 NO. ELLINGTON PARKWAY","zipcode":"37091","county":"117","date_super":{"end_time":"2005/05/26 00:00:00 -0400","original":"5/25/2005 ","granularity":"day","time":"2005/05/25 00:00:00 -0400"},"geo_score":0.506,"strstate":"TN","conversion":1,"type_store":"Supercenter","opendate":{"end_time":"1981/07/05 00:00:00 -0400","original":"7/4/1981 ","granularity":"day","time":"1981/07/04 00:00:00 -0400"},"id":"a61znt0u0acb","geo_precision":"street","storenum":737,"strcity":"Lewisburg"},"type":"Feature","geometry":{"type":"Point","coordinates":[-86.77713,35.451803]}},{"properties":{"st":"47","streetaddr":"190 HWY 641 NORTH","zipcode":"38320","county":"005","date_super":null,"geo_score":0.837,"strstate":"TN","conversion":null,"type_store":"Wal-Mart","opendate":{"end_time":"1981/07/05 00:00:00 -0400","original":"7/4/1981 ","granularity":"day","time":"1981/07/04 00:00:00 -0400"},"id":"a61znt4k8k5n","geo_precision":"range","storenum":738,"strcity":"Camden"},"type":"Feature","geometry":{"type":"Point","coordinates":[-88.115125,36.063932]}},{"properties":{"st":"21","streetaddr":"US HWY 441 HWY 25E","zipcode":"40965","county":"013","date_super":{"end_time":"1995/03/02 00:00:00 -0500","original":"3/1/1995 ","granularity":"day","time":"1995/03/01 00:00:00 -0500"},"geo_score":0.682,"strstate":"KY","conversion":1,"type_store":"Supercenter","opendate":{"end_time":"1981/07/05 00:00:00 -0400","original":"7/4/1981 ","granularity":"day","time":"1981/07/04 00:00:00 -0400"},"id":"a61znt5ilc6g","geo_precision":"street","storenum":739,"strcity":"Middlesboro"},"type":"Feature","geometry":{"type":"Point","coordinates":[-83.701883,36.609598]}},{"properties":{"st":"01","streetaddr":"1537 HWY 231 SOUTH","zipcode":"36360","county":"045","date_super":{"end_time":"2003/04/10 00:00:00 -0400","original":"4/9/2003 ","granularity":"day","time":"2003/04/09 00:00:00 -0400"},"geo_score":0.68,"strstate":"AL","conversion":1,"type_store":"Supercenter","opendate":{"end_time":"1981/07/05 00:00:00 -0400","original":"7/4/1981 ","granularity":"day","time":"1981/07/04 00:00:00 -0400"},"id":"a61znt46o1rl","geo_precision":"range","storenum":740,"strcity":"Ozark"},"type":"Feature","geometry":{"type":"Point","coordinates":[-85.637269,31.436409]}},{"properties":{"st":"47","streetaddr":"911 HWY 321 NORTH","zipcode":"37771","county":"105","date_super":{"end_time":"1998/03/02 00:00:00 -0500","original":"3/1/1998 ","granularity":"day","time":"1998/03/01 00:00:00 -0500"},"geo_score":0.611,"strstate":"TN","conversion":1,"type_store":"Supercenter","opendate":{"end_time":"1981/07/05 00:00:00 -0400","original":"7/4/1981 ","granularity":"day","time":"1981/07/04 00:00:00 -0400"},"id":"a61znsvirov0","geo_precision":"street","storenum":741,"strcity":"Lenoir City"},"type":"Feature","geometry":{"type":"Point","coordinates":[-84.28293,35.830661]}},{"properties":{"st":"47","streetaddr":"2500 W STONE DRIVE","zipcode":"37660","county":"163","date_super":{"end_time":"2001/08/23 00:00:00 -0400","original":"8/22/2001 ","granularity":"day","time":"2001/08/22 00:00:00 -0400"},"geo_score":0.729,"strstate":"TN","conversion":1,"type_store":"Supercenter","opendate":{"end_time":"1984/09/01 00:00:00 -0400","original":"8/31/1984 ","granularity":"day","time":"1984/08/31 00:00:00 -0400"},"id":"a61znt0cj1ve","geo_precision":"street","storenum":742,"strcity":"Kingsport"},"type":"Feature","geometry":{"type":"Point","coordinates":[-82.599458,36.555527]}},{"properties":{"st":"40","streetaddr":"100 EAST I-240 SERVICE ROAD","zipcode":"73149","county":"109","date_super":{"end_time":"2002/04/18 00:00:00 -0400","original":"4/17/2002 ","granularity":"day","time":"2002/04/17 00:00:00 -0400"},"geo_score":0.419,"strstate":"OK","conversion":1,"type_store":"Supercenter","opendate":{"end_time":"1984/09/01 00:00:00 -0400","original":"8/31/1984 ","granularity":"day","time":"1984/08/31 00:00:00 -0400"},"id":"a61znt15fubv","geo_precision":"street","storenum":743,"strcity":"Oklahoma City"},"type":"Feature","geometry":{"type":"Point","coordinates":[-97.506789,35.392054]}},{"properties":{"st":"48","streetaddr":"6626 FM 1960 EAST","zipcode":"77346","county":"201","date_super":{"end_time":"2002/10/17 00:00:00 -0400","original":"10/16/2002 ","granularity":"day","time":"2002/10/16 00:00:00 -0400"},"geo_score":0.805,"strstate":"TX","conversion":1,"type_store":"Supercenter","opendate":{"end_time":"1984/10/17 00:00:00 -0400","original":"10/16/1984 ","granularity":"day","time":"1984/10/16 00:00:00 -0400"},"id":"a61znt63v6u1","geo_precision":"street","storenum":744,"strcity":"Atascocita"},"type":"Feature","geometry":{"type":"Point","coordinates":[-95.160827,29.999025]}},{"properties":{"st":"13","streetaddr":"5600 N. HENRY BLVD.","zipcode":"30281","county":"151","date_super":{"end_time":"1996/03/02 00:00:00 -0500","original":"3/1/1996 ","granularity":"day","time":"1996/03/01 00:00:00 -0500"},"geo_score":0.497,"strstate":"GA","conversion":1,"type_store":"Supercenter","opendate":{"end_time":"1984/10/03 00:00:00 -0400","original":"10/2/1984 ","granularity":"day","time":"1984/10/02 00:00:00 -0400"},"id":"a61znt6fh9bm","geo_precision":"street","storenum":745,"strcity":"Stockbridge"},"type":"Feature","geometry":{"type":"Point","coordinates":[-84.195875,33.525234]}},{"properties":{"st":"48","streetaddr":"3401 S. 31ST STREET","zipcode":"76502","county":"027","date_super":{"end_time":"2002/03/02 00:00:00 -0500","original":"3/1/2002 ","granularity":"day","time":"2002/03/01 00:00:00 -0500"},"geo_score":0.633,"strstate":"TX","conversion":1,"type_store":"Supercenter","opendate":{"end_time":"1984/05/23 00:00:00 -0400","original":"5/22/1984 ","granularity":"day","time":"1984/05/22 00:00:00 -0400"},"id":"a61znt6xgt3u","geo_precision":"street","storenum":746,"strcity":"Temple"},"type":"Feature","geometry":{"type":"Point","coordinates":[-97.367657,31.074282]}},{"properties":{"st":"17","streetaddr":"1511 CAMP JACKSON ROAD","zipcode":"62206","county":"163","date_super":null,"geo_score":0.91,"strstate":"IL","conversion":null,"type_store":"Wal-Mart","opendate":{"end_time":"1985/02/06 00:00:00 -0500","original":"2/5/1985 ","granularity":"day","time":"1985/02/05 00:00:00 -0500"},"id":"a61znt02luml","geo_precision":"range","storenum":747,"strcity":"Cahokia"},"type":"Feature","geometry":{"type":"Point","coordinates":[-90.167758,38.555376]}},{"properties":{"st":"19","streetaddr":"300 EAST 31ST STREET SOUTH","zipcode":"50208","county":"099","date_super":{"end_time":"1999/03/02 00:00:00 -0500","original":"3/1/1999 ","granularity":"day","time":"1999/03/01 00:00:00 -0500"},"geo_score":0.839,"strstate":"IA","conversion":1,"type_store":"Supercenter","opendate":{"end_time":"1985/02/06 00:00:00 -0500","original":"2/5/1985 ","granularity":"day","time":"1985/02/05 00:00:00 -0500"},"id":"a61znsvkmkdl","geo_precision":"range","storenum":748,"strcity":"Newton"},"type":"Feature","geometry":{"type":"Point","coordinates":[-93.014482,41.697338]}},{"properties":{"st":"19","streetaddr":"3015 GRAND AVE","zipcode":"50010","county":"169","date_super":null,"geo_score":0.0,"strstate":"IA","conversion":null,"type_store":"Wal-Mart","opendate":{"end_time":"1985/07/03 00:00:00 -0400","original":"7/2/1985 ","granularity":"day","time":"1985/07/02 00:00:00 -0400"},"id":"a61znt5gk02d","geo_precision":"unmatched","storenum":749,"strcity":"Ames"},"type":"Feature","geometry":null},{"properties":{"st":"19","streetaddr":"302 ENTERPRISE DRIVE SW","zipcode":"50644","county":"019","date_super":{"end_time":"2006/01/24 00:00:00 -0500","original":"1/23/2006 ","granularity":"day","time":"2006/01/23 00:00:00 -0500"},"geo_score":0.683,"strstate":"IA","conversion":1,"type_store":"Supercenter","opendate":{"end_time":"1984/10/03 00:00:00 -0400","original":"10/2/1984 ","granularity":"day","time":"1984/10/02 00:00:00 -0400"},"id":"a61znsuyq1tw","geo_precision":"street","storenum":750,"strcity":"Independence"},"type":"Feature","geometry":{"type":"Point","coordinates":[-91.899273,42.450635]}},{"properties":{"st":"19","streetaddr":"403 EAST OSKALOOSA","zipcode":"50219","county":"125","date_super":null,"geo_score":0.902,"strstate":"IA","conversion":null,"type_store":"Wal-Mart","opendate":{"end_time":"1984/10/17 00:00:00 -0400","original":"10/16/1984 ","granularity":"day","time":"1984/10/16 00:00:00 -0400"},"id":"a61znt4zcp8o","geo_precision":"range","storenum":751,"strcity":"Pella"},"type":"Feature","geometry":{"type":"Point","coordinates":[-92.900837,41.397245]}},{"properties":{"st":"48","streetaddr":"5200 FAIRMONT PKWY.","zipcode":"77505","county":"201","date_super":{"end_time":"2004/10/28 00:00:00 -0400","original":"10/27/2004 ","granularity":"day","time":"2004/10/27 00:00:00 -0400"},"geo_score":1.0,"strstate":"TX","conversion":1,"type_store":"Supercenter","opendate":{"end_time":"1984/03/21 00:00:00 -0500","original":"3/20/1984 ","granularity":"day","time":"1984/03/20 00:00:00 -0500"},"id":"a61znszg2ijl","geo_precision":"range","storenum":752,"strcity":"Pasadena"},"type":"Feature","geometry":{"type":"Point","coordinates":[-95.162848,29.6496]}},{"properties":{"st":"19","streetaddr":"525 BRANDILYNN BLVD","zipcode":"50613","county":"013","date_super":{"end_time":"2003/10/30 00:00:00 -0500","original":"10/29/2003 ","granularity":"day","time":"2003/10/29 00:00:00 -0500"},"geo_score":0.78,"strstate":"IA","conversion":1,"type_store":"Supercenter","opendate":{"end_time":"1984/06/06 00:00:00 -0400","original":"6/5/1984 ","granularity":"day","time":"1984/06/05 00:00:00 -0400"},"id":"a61znt181mb8","geo_precision":"range","storenum":753,"strcity":"Cedar Falls"},"type":"Feature","geometry":{"type":"Point","coordinates":[-92.438952,42.485104]}},{"properties":{"st":"13","streetaddr":"730 NORTHSIDE DRIVE EAST","zipcode":"30458","county":"031","date_super":{"end_time":"1996/03/02 00:00:00 -0500","original":"3/1/1996 ","granularity":"day","time":"1996/03/01 00:00:00 -0500"},"geo_score":0.912,"strstate":"GA","conversion":1,"type_store":"Supercenter","opendate":{"end_time":"1984/04/04 00:00:00 -0500","original":"4/3/1984 ","granularity":"day","time":"1984/04/03 00:00:00 -0500"},"id":"a61znt4urbmr","geo_precision":"range","storenum":754,"strcity":"Statesboro"},"type":"Feature","geometry":{"type":"Point","coordinates":[-81.755819,32.434062]}},{"properties":{"st":"48","streetaddr":"4610 SOUTH COULTER","zipcode":"79121","county":"381","date_super":{"end_time":"1994/03/02 00:00:00 -0500","original":"3/1/1994 ","granularity":"day","time":"1994/03/01 00:00:00 -0500"},"geo_score":0.844,"strstate":"TX","conversion":1,"type_store":"Supercenter","opendate":{"end_time":"1984/05/02 00:00:00 -0400","original":"5/1/1984 ","granularity":"day","time":"1984/05/01 00:00:00 -0400"},"id":"a61znt5qguw1","geo_precision":"range","storenum":755,"strcity":"Amarillo"},"type":"Feature","geometry":{"type":"Point","coordinates":[-101.920175,35.161416]}},{"properties":{"st":"13","streetaddr":"13427 HWY 27","zipcode":"30753","county":"055","date_super":{"end_time":"2004/03/18 00:00:00 -0500","original":"3/17/2004 ","granularity":"day","time":"2004/03/17 00:00:00 -0500"},"geo_score":0.807,"strstate":"GA","conversion":1,"type_store":"Supercenter","opendate":{"end_time":"1984/04/18 00:00:00 -0500","original":"4/17/1984 ","granularity":"day","time":"1984/04/17 00:00:00 -0500"},"id":"a61znszyuewt","geo_precision":"range","storenum":756,"strcity":"Summerville"},"type":"Feature","geometry":{"type":"Point","coordinates":[-85.314675,34.519829]}},{"properties":{"st":"48","streetaddr":"2151 WEST OAKLAWN","zipcode":"78064","county":"013","date_super":{"end_time":"1999/03/02 00:00:00 -0500","original":"3/1/1999 ","granularity":"day","time":"1999/03/01 00:00:00 -0500"},"geo_score":0.854,"strstate":"TX","conversion":1,"type_store":"Supercenter","opendate":{"end_time":"1984/10/03 00:00:00 -0400","original":"10/2/1984 ","granularity":"day","time":"1984/10/02 00:00:00 -0400"},"id":"a61znt5gqrkq","geo_precision":"range","storenum":757,"strcity":"Pleasanton"},"type":"Feature","geometry":{"type":"Point","coordinates":[-98.513495,28.939655]}},{"properties":{"st":"13","streetaddr":"1711 E LAMAR STREET","zipcode":"31709","county":"261","date_super":{"end_time":"1995/03/02 00:00:00 -0500","original":"3/1/1995 ","granularity":"day","time":"1995/03/01 00:00:00 -0500"},"geo_score":0.721,"strstate":"GA","conversion":1,"type_store":"Supercenter","opendate":{"end_time":"1984/11/14 00:00:00 -0500","original":"11/13/1984 ","granularity":"day","time":"1984/11/13 00:00:00 -0500"},"id":"a61znt1gj6ay","geo_precision":"street","storenum":758,"strcity":"Americus"},"type":"Feature","geometry":{"type":"Point","coordinates":[-84.211337,32.071174]}},{"properties":{"st":"12","streetaddr":"1480 US HWY 17 N","zipcode":"33873","county":"049","date_super":{"end_time":"2001/07/19 00:00:00 -0400","original":"7/18/2001 ","granularity":"day","time":"2001/07/18 00:00:00 -0400"},"geo_score":0.72,"strstate":"FL","conversion":1,"type_store":"Supercenter","opendate":{"end_time":"1984/10/17 00:00:00 -0400","original":"10/16/1984 ","granularity":"day","time":"1984/10/16 00:00:00 -0400"},"id":"a61znsx937h1","geo_precision":"street","storenum":759,"strcity":"Wauchula"},"type":"Feature","geometry":{"type":"Point","coordinates":[-81.81595,27.569388]}},{"properties":{"st":"21","streetaddr":"US 60","zipcode":"40143","county":"027","date_super":null,"geo_score":0.699,"strstate":"KY","conversion":null,"type_store":"Wal-Mart","opendate":{"end_time":"1985/02/06 00:00:00 -0500","original":"2/5/1985 ","granularity":"day","time":"1985/02/05 00:00:00 -0500"},"id":"a61znt4ap24h","geo_precision":"street","storenum":760,"strcity":"Hardinsburg"},"type":"Feature","geometry":{"type":"Point","coordinates":[-86.438313,37.760211]}},{"properties":{"st":"22","streetaddr":"4876 HWY 1 SOUTH","zipcode":"70375","county":"057","date_super":null,"geo_score":0.624,"strstate":"LA","conversion":null,"type_store":"Wal-Mart","opendate":{"end_time":"1985/05/01 00:00:00 -0400","original":"4/30/1985 ","granularity":"day","time":"1985/04/30 00:00:00 -0400"},"id":"a61znt12emmd","geo_precision":"range","storenum":761,"strcity":"Mathews"},"type":"Feature","geometry":{"type":"Point","coordinates":[-91.0278,29.944816]}},{"properties":{"st":"01","streetaddr":"9248 PARKWAY EAST","zipcode":"35206","county":"073","date_super":{"end_time":"2004/01/29 00:00:00 -0500","original":"1/28/2004 ","granularity":"day","time":"2004/01/28 00:00:00 -0500"},"geo_score":0.823,"strstate":"AL","conversion":1,"type_store":"Supercenter","opendate":{"end_time":"1984/11/14 00:00:00 -0500","original":"11/13/1984 ","granularity":"day","time":"1984/11/13 00:00:00 -0500"},"id":"a61znsv95cdj","geo_precision":"range","storenum":762,"strcity":"Birmingham"},"type":"Feature","geometry":{"type":"Point","coordinates":[-86.700028,33.587473]}},{"properties":{"st":"01","streetaddr":"7100 AARON ARONOV DRIVE","zipcode":"35064","county":"073","date_super":null,"geo_score":0.902,"strstate":"AL","conversion":null,"type_store":"Wal-Mart","opendate":{"end_time":"1984/11/14 00:00:00 -0500","original":"11/13/1984 ","granularity":"day","time":"1984/11/13 00:00:00 -0500"},"id":"a61znt7wzc3i","geo_precision":"range","storenum":763,"strcity":"Fairfield"},"type":"Feature","geometry":{"type":"Point","coordinates":[-86.917763,33.467986]}},{"properties":{"st":"01","streetaddr":"750 ACADEMY DRIVE","zipcode":"35022","county":"073","date_super":{"end_time":"1995/03/02 00:00:00 -0500","original":"3/1/1995 ","granularity":"day","time":"1995/03/01 00:00:00 -0500"},"geo_score":1.0,"strstate":"AL","conversion":1,"type_store":"Supercenter","opendate":{"end_time":"1984/11/14 00:00:00 -0500","original":"11/13/1984 ","granularity":"day","time":"1984/11/13 00:00:00 -0500"},"id":"a61znswbt6aj","geo_precision":"range","storenum":764,"strcity":"Bessemer"},"type":"Feature","geometry":{"type":"Point","coordinates":[-87.002726,33.36711]}},{"properties":{"st":"48","streetaddr":"16503 NACOGDOCHES ROAD","zipcode":"78247","county":"029","date_super":{"end_time":"2002/03/02 00:00:00 -0500","original":"3/1/2002 ","granularity":"day","time":"2002/03/01 00:00:00 -0500"},"geo_score":1.0,"strstate":"TX","conversion":1,"type_store":"Supercenter","opendate":{"end_time":"1984/11/30 00:00:00 -0500","original":"11/29/1984 ","granularity":"day","time":"1984/11/29 00:00:00 -0500"},"id":"a61znt1fn6yq","geo_precision":"range","storenum":765,"strcity":"San Antonio"},"type":"Feature","geometry":{"type":"Point","coordinates":[-98.355244,29.590106]}},{"properties":{"st":"01","streetaddr":"3100 HOUGH RD","zipcode":"35630","county":"077","date_super":{"end_time":"1996/03/02 00:00:00 -0500","original":"3/1/1996 ","granularity":"day","time":"1996/03/01 00:00:00 -0500"},"geo_score":0.962,"strstate":"AL","conversion":1,"type_store":"Supercenter","opendate":{"end_time":"1984/11/14 00:00:00 -0500","original":"11/13/1984 ","granularity":"day","time":"1984/11/13 00:00:00 -0500"},"id":"a61znt0slrww","geo_precision":"range","storenum":766,"strcity":"Florence"},"type":"Feature","geometry":{"type":"Point","coordinates":[-87.625678,34.836123]}},{"properties":{"st":"12","streetaddr":"2767 W US HWY 90","zipcode":"32055","county":"023","date_super":{"end_time":"1995/03/02 00:00:00 -0500","original":"3/1/1995 ","granularity":"day","time":"1995/03/01 00:00:00 -0500"},"geo_score":0.78,"strstate":"FL","conversion":1,"type_store":"Supercenter","opendate":{"end_time":"1985/01/23 00:00:00 -0500","original":"1/22/1985 ","granularity":"day","time":"1985/01/22 00:00:00 -0500"},"id":"a61znsu1urch","geo_precision":"range","storenum":767,"strcity":"Lake City"},"type":"Feature","geometry":{"type":"Point","coordinates":[-82.65833,30.181999]}},{"properties":{"st":"48","streetaddr":"1313 FRY ROAD","zipcode":"77449","county":"201","date_super":{"end_time":"2001/05/24 00:00:00 -0400","original":"5/23/2001 ","granularity":"day","time":"2001/05/23 00:00:00 -0400"},"geo_score":1.0,"strstate":"TX","conversion":1,"type_store":"Supercenter","opendate":{"end_time":"1984/10/24 00:00:00 -0400","original":"10/23/1984 ","granularity":"day","time":"1984/10/23 00:00:00 -0400"},"id":"a61znt4p1x2a","geo_precision":"range","storenum":768,"strcity":"Katy"},"type":"Feature","geometry":{"type":"Point","coordinates":[-95.718906,29.787293]}},{"properties":{"st":"12","streetaddr":"4150 S TAMIAMI TRAIL","zipcode":"34293","county":"115","date_super":{"end_time":"1995/03/02 00:00:00 -0500","original":"3/1/1995 ","granularity":"day","time":"1995/03/01 00:00:00 -0500"},"geo_score":0.807,"strstate":"FL","conversion":1,"type_store":"Supercenter","opendate":{"end_time":"1985/06/05 00:00:00 -0400","original":"6/4/1985 ","granularity":"day","time":"1985/06/04 00:00:00 -0400"},"id":"a61znsxdgjv3","geo_precision":"range","storenum":769,"strcity":"Venice"},"type":"Feature","geometry":{"type":"Point","coordinates":[-82.398849,27.049892]}},{"properties":{"st":"20","streetaddr":"3503 TENTH STREET","zipcode":"67530","county":"009","date_super":{"end_time":"2004/04/15 00:00:00 -0400","original":"4/14/2004 ","granularity":"day","time":"2004/04/14 00:00:00 -0400"},"geo_score":0.827,"strstate":"KS","conversion":1,"type_store":"Supercenter","opendate":{"end_time":"1985/05/01 00:00:00 -0400","original":"4/30/1985 ","granularity":"day","time":"1985/04/30 00:00:00 -0400"},"id":"a61znt5p0w8q","geo_precision":"range","storenum":770,"strcity":"Great Bend"},"type":"Feature","geometry":{"type":"Point","coordinates":[-98.785795,38.361799]}},{"properties":{"st":"12","streetaddr":"1500 E MERRITT ISLAND CSWY","zipcode":"32952","county":"009","date_super":{"end_time":"1995/03/02 00:00:00 -0500","original":"3/1/1995 ","granularity":"day","time":"1995/03/01 00:00:00 -0500"},"geo_score":0.917,"strstate":"FL","conversion":1,"type_store":"Supercenter","opendate":{"end_time":"1985/05/22 00:00:00 -0400","original":"5/21/1985 ","granularity":"day","time":"1985/05/21 00:00:00 -0400"},"id":"a61znsxick3y","geo_precision":"range","storenum":771,"strcity":"Merritt Island"},"type":"Feature","geometry":{"type":"Point","coordinates":[-80.669938,28.357318]}},{"properties":{"st":"48","streetaddr":"3506 S. HWY 6 SOUTH","zipcode":"77082","county":"201","date_super":{"end_time":"2003/10/30 00:00:00 -0500","original":"10/29/2003 ","granularity":"day","time":"2003/10/29 00:00:00 -0500"},"geo_score":0.619,"strstate":"TX","conversion":1,"type_store":"Supercenter","opendate":{"end_time":"1985/10/23 00:00:00 -0400","original":"10/22/1985 ","granularity":"day","time":"1985/10/22 00:00:00 -0400"},"id":"a61znsy20uxg","geo_precision":"street","storenum":772,"strcity":"Houston"},"type":"Feature","geometry":{"type":"Point","coordinates":[-95.644052,29.766322]}},{"properties":{"st":"22","streetaddr":"1960 W. LAUREL STREET","zipcode":"70535","county":"097","date_super":null,"geo_score":0.471,"strstate":"LA","conversion":null,"type_store":"Wal-Mart","opendate":{"end_time":"1985/08/31 00:00:00 -0400","original":"8/30/1985 ","granularity":"day","time":"1985/08/30 00:00:00 -0400"},"id":"a61znt60v49z","geo_precision":"street","storenum":773,"strcity":"Eunice"},"type":"Feature","geometry":{"type":"Point","coordinates":[-92.415191,30.494909]}},{"properties":{"st":"31","streetaddr":"818 EAST 23RD ST.","zipcode":"68601","county":"141","date_super":{"end_time":"2005/04/14 00:00:00 -0400","original":"4/13/2005 ","granularity":"day","time":"2005/04/13 00:00:00 -0400"},"geo_score":0.634,"strstate":"NE","conversion":1,"type_store":"Supercenter","opendate":{"end_time":"1985/05/01 00:00:00 -0400","original":"4/30/1985 ","granularity":"day","time":"1985/04/30 00:00:00 -0400"},"id":"a61znt65jdff","geo_precision":"range","storenum":774,"strcity":"Columbus"},"type":"Feature","geometry":{"type":"Point","coordinates":[-97.335275,41.438394]}},{"properties":{"st":"17","streetaddr":"2031 NATIONAL BLVD","zipcode":"61401","county":"095","date_super":null,"geo_score":0.923,"strstate":"IL","conversion":null,"type_store":"Wal-Mart","opendate":{"end_time":"1985/10/02 00:00:00 -0400","original":"10/1/1985 ","granularity":"day","time":"1985/10/01 00:00:00 -0400"},"id":"a61znsyy6cal","geo_precision":"range","storenum":775,"strcity":"Galesburg"},"type":"Feature","geometry":{"type":"Point","coordinates":[-90.38243,40.973143]}},{"properties":{"st":"31","streetaddr":"3010 E  23RD AVE N","zipcode":"68025","county":"053","date_super":{"end_time":"1996/03/02 00:00:00 -0500","original":"3/1/1996 ","granularity":"day","time":"1996/03/01 00:00:00 -0500"},"geo_score":0.664,"strstate":"NE","conversion":1,"type_store":"Supercenter","opendate":{"end_time":"1985/06/05 00:00:00 -0400","original":"6/4/1985 ","granularity":"day","time":"1985/06/04 00:00:00 -0400"},"id":"a61znt2r9nym","geo_precision":"street","storenum":776,"strcity":"Fremont"},"type":"Feature","geometry":{"type":"Point","coordinates":[-96.445008,41.451308]}},{"properties":{"st":"48","streetaddr":"3115 EDGAR BROWN DR","zipcode":"77630","county":"361","date_super":{"end_time":"1996/03/02 00:00:00 -0500","original":"3/1/1996 ","granularity":"day","time":"1996/03/01 00:00:00 -0500"},"geo_score":0.82,"strstate":"TX","conversion":1,"type_store":"Supercenter","opendate":{"end_time":"1985/07/03 00:00:00 -0400","original":"7/2/1985 ","granularity":"day","time":"1985/07/02 00:00:00 -0400"},"id":"a61znt0fkszm","geo_precision":"range","storenum":777,"strcity":"West Orange"},"type":"Feature","geometry":{"type":"Point","coordinates":[-93.766695,30.093007]}},{"properties":{"st":"12","streetaddr":"3811 TAMIAMI TRAIL","zipcode":"33950","county":"015","date_super":null,"geo_score":0.92,"strstate":"FL","conversion":null,"type_store":"Wal-Mart","opendate":{"end_time":"1985/05/22 00:00:00 -0400","original":"5/21/1985 ","granularity":"day","time":"1985/05/21 00:00:00 -0400"},"id":"a61znsw1clm0","geo_precision":"range","storenum":778,"strcity":"Punta Gorda"},"type":"Feature","geometry":{"type":"Point","coordinates":[-82.030143,26.897965]}},{"properties":{"st":"12","streetaddr":"3501 S FLORIDA AVE","zipcode":"33803","county":"105","date_super":null,"geo_score":0.915,"strstate":"FL","conversion":null,"type_store":"Wal-Mart","opendate":{"end_time":"1985/05/01 00:00:00 -0400","original":"4/30/1985 ","granularity":"day","time":"1985/04/30 00:00:00 -0400"},"id":"a61znt24c6cu","geo_precision":"range","storenum":779,"strcity":"Lakeland"},"type":"Feature","geometry":{"type":"Point","coordinates":[-81.957075,27.999994]}},{"properties":{"st":"13","streetaddr":"2050 WEST SPRING ST","zipcode":"30655","county":"297","date_super":{"end_time":"2004/05/20 00:00:00 -0400","original":"5/19/2004 ","granularity":"day","time":"2004/05/19 00:00:00 -0400"},"geo_score":0.595,"strstate":"GA","conversion":1,"type_store":"Supercenter","opendate":{"end_time":"1985/05/22 00:00:00 -0400","original":"5/21/1985 ","granularity":"day","time":"1985/05/21 00:00:00 -0400"},"id":"a61znt46u0jo","geo_precision":"street","storenum":780,"strcity":"Monroe"},"type":"Feature","geometry":{"type":"Point","coordinates":[-83.738719,33.791765]}},{"properties":{"st":"48","streetaddr":"2700 HIGHWAY 281 NORTH","zipcode":"78654","county":"053","date_super":{"end_time":"1995/03/02 00:00:00 -0500","original":"3/1/1995 ","granularity":"day","time":"1995/03/01 00:00:00 -0500"},"geo_score":0.793,"strstate":"TX","conversion":1,"type_store":"Supercenter","opendate":{"end_time":"1985/07/17 00:00:00 -0400","original":"7/16/1985 ","granularity":"day","time":"1985/07/16 00:00:00 -0400"},"id":"a61znt80ddx7","geo_precision":"range","storenum":781,"strcity":"Marble Falls"},"type":"Feature","geometry":{"type":"Point","coordinates":[-98.284862,30.528091]}},{"properties":{"st":"48","streetaddr":"3100 EAST MAIN","zipcode":"78801","county":"463","date_super":{"end_time":"2004/10/28 00:00:00 -0400","original":"10/27/2004 ","granularity":"day","time":"2004/10/27 00:00:00 -0400"},"geo_score":0.522,"strstate":"TX","conversion":1,"type_store":"Supercenter","opendate":{"end_time":"1985/08/21 00:00:00 -0400","original":"8/20/1985 ","granularity":"day","time":"1985/08/20 00:00:00 -0400"},"id":"a61znt6qa5cc","geo_precision":"street","storenum":782,"strcity":"Uvalde"},"type":"Feature","geometry":{"type":"Point","coordinates":[-99.755926,29.229993]}},{"properties":{"st":"29","streetaddr":"705 EAST BRIGGS DRIVE","zipcode":"63552","county":"121","date_super":null,"geo_score":0.902,"strstate":"MO","conversion":null,"type_store":"Wal-Mart","opendate":{"end_time":"1985/07/03 00:00:00 -0400","original":"7/2/1985 ","granularity":"day","time":"1985/07/02 00:00:00 -0400"},"id":"a61znt32s2sv","geo_precision":"range","storenum":783,"strcity":"Macon"},"type":"Feature","geometry":{"type":"Point","coordinates":[-92.464337,39.752124]}},{"properties":{"st":"19","streetaddr":"1045 NO. GRAND AVENUE","zipcode":"52641","county":"087","date_super":{"end_time":"2004/03/18 00:00:00 -0500","original":"3/17/2004 ","granularity":"day","time":"2004/03/17 00:00:00 -0500"},"geo_score":0.476,"strstate":"IA","conversion":1,"type_store":"Supercenter","opendate":{"end_time":"1985/05/01 00:00:00 -0400","original":"4/30/1985 ","granularity":"day","time":"1985/04/30 00:00:00 -0400"},"id":"a61znt7c9ohh","geo_precision":"street","storenum":784,"strcity":"Mt. Pleasant"},"type":"Feature","geometry":{"type":"Point","coordinates":[-91.539256,40.964528]}},{"properties":{"st":"28","streetaddr":"1350 AZALEA DRIVE","zipcode":"39367","county":"153","date_super":{"end_time":"2002/04/11 00:00:00 -0400","original":"4/10/2002 ","granularity":"day","time":"2002/04/10 00:00:00 -0400"},"geo_score":0.912,"strstate":"MS","conversion":1,"type_store":"Supercenter","opendate":{"end_time":"1985/06/05 00:00:00 -0400","original":"6/4/1985 ","granularity":"day","time":"1985/06/04 00:00:00 -0400"},"id":"a61znt2ylvkf","geo_precision":"range","storenum":785,"strcity":"Waynesboro"},"type":"Feature","geometry":{"type":"Point","coordinates":[-88.632646,31.685818]}},{"properties":{"st":"17","streetaddr":"2300 SYCAMORE ROAD","zipcode":"60115","county":"037","date_super":{"end_time":"1997/03/02 00:00:00 -0500","original":"3/1/1997 ","granularity":"day","time":"1997/03/01 00:00:00 -0500"},"geo_score":0.919,"strstate":"IL","conversion":1,"type_store":"Supercenter","opendate":{"end_time":"1986/01/01 00:00:00 -0500","original":"12/31/1985 ","granularity":"day","time":"1985/12/31 00:00:00 -0500"},"id":"a61znsuhyry5","geo_precision":"range","storenum":786,"strcity":"De Kalb"},"type":"Feature","geometry":{"type":"Point","coordinates":[-88.726171,41.951901]}},{"properties":{"st":"13","streetaddr":"7050 HIGHWAY 85","zipcode":"30274","county":"063","date_super":{"end_time":"2004/10/21 00:00:00 -0400","original":"10/20/2004 ","granularity":"day","time":"2004/10/20 00:00:00 -0400"},"geo_score":0.766,"strstate":"GA","conversion":1,"type_store":"Supercenter","opendate":{"end_time":"1985/07/31 00:00:00 -0400","original":"7/30/1985 ","granularity":"day","time":"1985/07/30 00:00:00 -0400"},"id":"a61znt3l2qf5","geo_precision":"range","storenum":787,"strcity":"Riverdale"},"type":"Feature","geometry":{"type":"Point","coordinates":[-84.411854,33.578944]}},{"properties":{"st":"05","streetaddr":"1966 HWY 65 SOUTH","zipcode":"72031","county":"141","date_super":{"end_time":"2001/04/19 00:00:00 -0400","original":"4/18/2001 ","granularity":"day","time":"2001/04/18 00:00:00 -0400"},"geo_score":0.617,"strstate":"AR","conversion":1,"type_store":"Supercenter","opendate":{"end_time":"1985/09/11 00:00:00 -0400","original":"9/10/1985 ","granularity":"day","time":"1985/09/10 00:00:00 -0400"},"id":"a61znt472eiv","geo_precision":"street","storenum":788,"strcity":"Clinton"},"type":"Feature","geometry":{"type":"Point","coordinates":[-92.463168,35.597905]}},{"properties":{"st":"48","streetaddr":"200 U.S. HWY 80 EAST","zipcode":"75149","county":"113","date_super":{"end_time":"1999/03/02 00:00:00 -0500","original":"3/1/1999 ","granularity":"day","time":"1999/03/01 00:00:00 -0500"},"geo_score":0.5,"strstate":"TX","conversion":1,"type_store":"Supercenter","opendate":{"end_time":"1985/10/30 00:00:00 -0500","original":"10/29/1985 ","granularity":"day","time":"1985/10/29 00:00:00 -0500"},"id":"a61znszajii8","geo_precision":"street","storenum":789,"strcity":"Mesquite"},"type":"Feature","geometry":{"type":"Point","coordinates":[-96.596584,32.790225]}},{"properties":{"st":"31","streetaddr":"1902 WEST B","zipcode":"69001","county":"145","date_super":{"end_time":"1995/03/02 00:00:00 -0500","original":"3/1/1995 ","granularity":"day","time":"1995/03/01 00:00:00 -0500"},"geo_score":0.659,"strstate":"NE","conversion":1,"type_store":"Supercenter","opendate":{"end_time":"1985/07/17 00:00:00 -0400","original":"7/16/1985 ","granularity":"day","time":"1985/07/16 00:00:00 -0400"},"id":"a61znt4wceoy","geo_precision":"street","storenum":790,"strcity":"McCook"},"type":"Feature","geometry":{"type":"Point","coordinates":[-100.642146,40.199023]}},{"properties":{"st":"48","streetaddr":"2701 EAST MAIN","zipcode":"78332","county":"249","date_super":{"end_time":"2004/05/20 00:00:00 -0400","original":"5/19/2004 ","granularity":"day","time":"2004/05/19 00:00:00 -0400"},"geo_score":0.847,"strstate":"TX","conversion":1,"type_store":"Supercenter","opendate":{"end_time":"1985/07/17 00:00:00 -0400","original":"7/16/1985 ","granularity":"day","time":"1985/07/16 00:00:00 -0400"},"id":"a61znt1jmqdi","geo_precision":"range","storenum":791,"strcity":"Alice"},"type":"Feature","geometry":{"type":"Point","coordinates":[-98.040833,27.767767]}},{"properties":{"st":"17","streetaddr":"1500 SE 5TH STREET","zipcode":"61231","county":"131","date_super":null,"geo_score":0.847,"strstate":"IL","conversion":null,"type_store":"Wal-Mart","opendate":{"end_time":"1985/07/03 00:00:00 -0400","original":"7/2/1985 ","granularity":"day","time":"1985/07/02 00:00:00 -0400"},"id":"a61znt6patnf","geo_precision":"range","storenum":792,"strcity":"Aledo"},"type":"Feature","geometry":{"type":"Point","coordinates":[-90.727977,41.197614]}},{"properties":{"st":"48","streetaddr":"1701 NORTH 23RD ST","zipcode":"79015","county":"381","date_super":{"end_time":"2005/03/24 00:00:00 -0500","original":"3/23/2005 ","granularity":"day","time":"2005/03/23 00:00:00 -0500"},"geo_score":0.659,"strstate":"TX","conversion":1,"type_store":"Supercenter","opendate":{"end_time":"1985/10/02 00:00:00 -0400","original":"10/1/1985 ","granularity":"day","time":"1985/10/01 00:00:00 -0400"},"id":"a61znszggb38","geo_precision":"street","storenum":793,"strcity":"Canyon"},"type":"Feature","geometry":{"type":"Point","coordinates":[-101.919464,34.970475]}},{"properties":{"st":"20","streetaddr":"1905 E 17TH STREET","zipcode":"67501","county":"155","date_super":{"end_time":"2002/10/24 00:00:00 -0400","original":"10/23/2002 ","granularity":"day","time":"2002/10/23 00:00:00 -0400"},"geo_score":0.72,"strstate":"KS","conversion":1,"type_store":"Supercenter","opendate":{"end_time":"1985/07/17 00:00:00 -0400","original":"7/16/1985 ","granularity":"day","time":"1985/07/16 00:00:00 -0400"},"id":"a61znt1gh352","geo_precision":"range","storenum":794,"strcity":"Hutchinson"},"type":"Feature","geometry":{"type":"Point","coordinates":[-97.888,38.072269]}},{"properties":{"st":"45","streetaddr":"11391 DUNBARTON BLVD","zipcode":"29812","county":"011","date_super":{"end_time":"1997/03/02 00:00:00 -0500","original":"3/1/1997 ","granularity":"day","time":"1997/03/01 00:00:00 -0500"},"geo_score":0.915,"strstate":"SC","conversion":1,"type_store":"Supercenter","opendate":{"end_time":"1985/05/15 00:00:00 -0400","original":"5/14/1985 ","granularity":"day","time":"1985/05/14 00:00:00 -0400"},"id":"a61znsw2lz0e","geo_precision":"range","storenum":795,"strcity":"Barnwell"},"type":"Feature","geometry":{"type":"Point","coordinates":[-81.391125,33.240378]}},{"properties":{"st":"17","streetaddr":"1650 38TH STREET","zipcode":"61354","county":"099","date_super":null,"geo_score":0.902,"strstate":"IL","conversion":null,"type_store":"Wal-Mart","opendate":{"end_time":"1986/04/02 00:00:00 -0500","original":"4/1/1986 ","granularity":"day","time":"1986/04/01 00:00:00 -0500"},"id":"a61znt4wowam","geo_precision":"range","storenum":796,"strcity":"Peru"},"type":"Feature","geometry":{"type":"Point","coordinates":[-89.128426,41.358221]}},{"properties":{"st":"19","streetaddr":"324 WEST AGENCY ROAD","zipcode":"52655","county":"057","date_super":{"end_time":"1997/03/02 00:00:00 -0500","original":"3/1/1997 ","granularity":"day","time":"1997/03/01 00:00:00 -0500"},"geo_score":0.927,"strstate":"IA","conversion":1,"type_store":"Supercenter","opendate":{"end_time":"1985/09/11 00:00:00 -0400","original":"9/10/1985 ","granularity":"day","time":"1985/09/10 00:00:00 -0400"},"id":"a61znt1jzvde","geo_precision":"range","storenum":797,"strcity":"Burlington"},"type":"Feature","geometry":{"type":"Point","coordinates":[-91.159164,40.812974]}},{"properties":{"st":"17","streetaddr":"1608 IL HWY #1","zipcode":"62441","county":"023","date_super":null,"geo_score":0.415,"strstate":"IL","conversion":null,"type_store":"Wal-Mart","opendate":{"end_time":"1985/08/31 00:00:00 -0400","original":"8/30/1985 ","granularity":"day","time":"1985/08/30 00:00:00 -0400"},"id":"a61znt4s92o0","geo_precision":"street","storenum":798,"strcity":"Marshall"},"type":"Feature","geometry":{"type":"Point","coordinates":[-88.054678,38.731919]}},{"properties":{"st":"20","streetaddr":"250 EAST TUCKER ROAD","zipcode":"67901","county":"175","date_super":{"end_time":"1998/03/02 00:00:00 -0500","original":"3/1/1998 ","granularity":"day","time":"1998/03/01 00:00:00 -0500"},"geo_score":0.651,"strstate":"KS","conversion":1,"type_store":"Supercenter","opendate":{"end_time":"1985/07/03 00:00:00 -0400","original":"7/2/1985 ","granularity":"day","time":"1985/07/02 00:00:00 -0400"},"id":"a61znsvteoqv","geo_precision":"street","storenum":799,"strcity":"Liberal"},"type":"Feature","geometry":{"type":"Point","coordinates":[-100.796101,37.068206]}},{"properties":{"st":"12","streetaddr":"2501 N CITRUS BLVD","zipcode":"34748","county":"069","date_super":{"end_time":"1998/03/02 00:00:00 -0500","original":"3/1/1998 ","granularity":"day","time":"1998/03/01 00:00:00 -0500"},"geo_score":0.973,"strstate":"FL","conversion":1,"type_store":"Supercenter","opendate":{"end_time":"1985/09/11 00:00:00 -0400","original":"9/10/1985 ","granularity":"day","time":"1985/09/10 00:00:00 -0400"},"id":"a61znt244rib","geo_precision":"range","storenum":800,"strcity":"Leesburg"},"type":"Feature","geometry":{"type":"Point","coordinates":[-81.896965,28.843305]}},{"properties":{"st":"29","streetaddr":"1605 S MAIN ST","zipcode":"64468","county":"147","date_super":{"end_time":"2000/03/02 00:00:00 -0500","original":"3/1/2000 ","granularity":"day","time":"2000/03/01 00:00:00 -0500"},"geo_score":0.913,"strstate":"MO","conversion":1,"type_store":"Supercenter","opendate":{"end_time":"1985/10/09 00:00:00 -0400","original":"10/8/1985 ","granularity":"day","time":"1985/10/08 00:00:00 -0400"},"id":"a61znsx1s4os","geo_precision":"range","storenum":801,"strcity":"Maryville"},"type":"Feature","geometry":{"type":"Point","coordinates":[-94.873872,40.330534]}},{"properties":{"st":"55","streetaddr":"424 WEST 8TH STREET","zipcode":"53566","county":"045","date_super":null,"geo_score":0.821,"strstate":"WI","conversion":null,"type_store":"Wal-Mart","opendate":{"end_time":"1985/07/17 00:00:00 -0400","original":"7/16/1985 ","granularity":"day","time":"1985/07/16 00:00:00 -0400"},"id":"a61znt9epf5s","geo_precision":"range","storenum":802,"strcity":"Monroe"},"type":"Feature","geometry":{"type":"Point","coordinates":[-89.662927,42.603531]}},{"properties":{"st":"22","streetaddr":"218 CUMBERLAND","zipcode":"70427","county":"117","date_super":null,"geo_score":0.854,"strstate":"LA","conversion":null,"type_store":"Wal-Mart","opendate":{"end_time":"1985/08/31 00:00:00 -0400","original":"8/30/1985 ","granularity":"day","time":"1985/08/30 00:00:00 -0400"},"id":"a61znsv6kgfo","geo_precision":"range","storenum":803,"strcity":"Bogalusa"},"type":"Feature","geometry":{"type":"Point","coordinates":[-89.86413,30.789718]}},{"properties":{"st":"48","streetaddr":"601 NO. FM 1821","zipcode":"76067","county":"363","date_super":{"end_time":"2005/08/25 00:00:00 -0400","original":"8/24/2005 ","granularity":"day","time":"2005/08/24 00:00:00 -0400"},"geo_score":0.44,"strstate":"TX","conversion":1,"type_store":"Supercenter","opendate":{"end_time":"1985/08/31 00:00:00 -0400","original":"8/30/1985 ","granularity":"day","time":"1985/08/30 00:00:00 -0400"},"id":"a61znt8t2jaw","geo_precision":"street","storenum":804,"strcity":"Mineral Wells"},"type":"Feature","geometry":{"type":"Point","coordinates":[-98.082921,32.813761]}},{"properties":{"st":"29","streetaddr":"653 GRAVOIS BLUFFS BLVD","zipcode":"63026","county":"189","date_super":null,"geo_score":0.902,"strstate":"MO","conversion":null,"type_store":"Wal-Mart","opendate":{"end_time":"1983/09/03 00:00:00 -0400","original":"9/2/1983 ","granularity":"day","time":"1983/09/02 00:00:00 -0400"},"id":"a61znsy8nbk5","geo_precision":"range","storenum":805,"strcity":"Fenton"},"type":"Feature","geometry":{"type":"Point","coordinates":[-90.440171,38.508079]}},{"properties":{"st":"35","streetaddr":"571 S. WALTON BLVD.","zipcode":"88001","county":"013","date_super":{"end_time":"1998/03/02 00:00:00 -0500","original":"3/1/1998 ","granularity":"day","time":"1998/03/01 00:00:00 -0500"},"geo_score":0.448,"strstate":"NM","conversion":1,"type_store":"Supercenter","opendate":{"end_time":"1985/08/31 00:00:00 -0400","original":"8/30/1985 ","granularity":"day","time":"1985/08/30 00:00:00 -0400"},"id":"a61znt9w5ksk","geo_precision":"street","storenum":806,"strcity":"Las Cruces"},"type":"Feature","geometry":{"type":"Point","coordinates":[-106.75364,32.300289]}},{"properties":{"st":"48","streetaddr":"6401 NE LOOP 820","zipcode":"76180","county":"439","date_super":{"end_time":"1999/03/02 00:00:00 -0500","original":"3/1/1999 ","granularity":"day","time":"1999/03/01 00:00:00 -0500"},"geo_score":0.93,"strstate":"TX","conversion":1,"type_store":"Supercenter","opendate":{"end_time":"1985/10/30 00:00:00 -0500","original":"10/29/1985 ","granularity":"day","time":"1985/10/29 00:00:00 -0500"},"id":"a61znt8bq553","geo_precision":"range","storenum":807,"strcity":"North Richland Hills"},"type":"Feature","geometry":{"type":"Point","coordinates":[-97.249918,32.840649]}},{"properties":{"st":"48","streetaddr":"121 HWY 332 WEST","zipcode":"77566","county":"039","date_super":{"end_time":"1994/03/02 00:00:00 -0500","original":"3/1/1994 ","granularity":"day","time":"1994/03/01 00:00:00 -0500"},"geo_score":0.97,"strstate":"TX","conversion":1,"type_store":"Supercenter","opendate":{"end_time":"1985/11/13 00:00:00 -0500","original":"11/12/1985 ","granularity":"day","time":"1985/11/12 00:00:00 -0500"},"id":"a61znsy3zr0a","geo_precision":"range","storenum":808,"strcity":"Lake Jackson"},"type":"Feature","geometry":{"type":"Point","coordinates":[-95.45712,29.047464]}},{"properties":{"st":"01","streetaddr":"92 PLAZA LANE","zipcode":"36203","county":"015","date_super":{"end_time":"1997/03/02 00:00:00 -0500","original":"3/1/1997 ","granularity":"day","time":"1997/03/01 00:00:00 -0500"},"geo_score":0.648,"strstate":"AL","conversion":1,"type_store":"Supercenter","opendate":{"end_time":"1985/08/31 00:00:00 -0400","original":"8/30/1985 ","granularity":"day","time":"1985/08/30 00:00:00 -0400"},"id":"a61znt7sfj5e","geo_precision":"street","storenum":809,"strcity":"Oxford"},"type":"Feature","geometry":{"type":"Point","coordinates":[-85.831604,33.600442]}},{"properties":{"st":"19","streetaddr":"4151 FOURTH STREET SW","zipcode":"50401","county":"033","date_super":{"end_time":"2002/07/18 00:00:00 -0400","original":"7/17/2002 ","granularity":"day","time":"2002/07/17 00:00:00 -0400"},"geo_score":0.819,"strstate":"IA","conversion":1,"type_store":"Supercenter","opendate":{"end_time":"1985/06/05 00:00:00 -0400","original":"6/4/1985 ","granularity":"day","time":"1985/06/04 00:00:00 -0400"},"id":"a61znsv3dkc0","geo_precision":"range","storenum":810,"strcity":"Mason City"},"type":"Feature","geometry":{"type":"Point","coordinates":[-93.262574,43.148346]}},{"properties":{"st":"12","streetaddr":"2725 SOUTHEAST HWY 70","zipcode":"34266","county":"027","date_super":{"end_time":"2003/03/20 00:00:00 -0500","original":"3/19/2003 ","granularity":"day","time":"2003/03/19 00:00:00 -0500"},"geo_score":0.51,"strstate":"FL","conversion":1,"type_store":"Supercenter","opendate":{"end_time":"1985/07/17 00:00:00 -0400","original":"7/16/1985 ","granularity":"day","time":"1985/07/16 00:00:00 -0400"},"id":"a61znt3sz354","geo_precision":"street","storenum":811,"strcity":"Arcadia"},"type":"Feature","geometry":{"type":"Point","coordinates":[-81.84722,27.210839]}},{"properties":{"st":"48","streetaddr":"2003 SOUTH DUMAS AVENUE","zipcode":"79029","county":"341","date_super":{"end_time":"2004/03/18 00:00:00 -0500","original":"3/17/2004 ","granularity":"day","time":"2004/03/17 00:00:00 -0500"},"geo_score":0.709,"strstate":"TX","conversion":1,"type_store":"Supercenter","opendate":{"end_time":"1985/07/17 00:00:00 -0400","original":"7/16/1985 ","granularity":"day","time":"1985/07/16 00:00:00 -0400"},"id":"a61znt0uslr4","geo_precision":"street","storenum":812,"strcity":"Dumas"},"type":"Feature","geometry":{"type":"Point","coordinates":[-101.973451,35.842866]}},{"properties":{"st":"48","streetaddr":"401 W COMMERCE","zipcode":"76801","county":"049","date_super":{"end_time":"1994/03/02 00:00:00 -0500","original":"3/1/1994 ","granularity":"day","time":"1994/03/01 00:00:00 -0500"},"geo_score":0.849,"strstate":"TX","conversion":1,"type_store":"Supercenter","opendate":{"end_time":"1985/10/09 00:00:00 -0400","original":"10/8/1985 ","granularity":"day","time":"1985/10/08 00:00:00 -0400"},"id":"a61znt85yvjm","geo_precision":"range","storenum":813,"strcity":"Brownwood"},"type":"Feature","geometry":{"type":"Point","coordinates":[-98.982824,31.728623]}},{"properties":{"st":"12","streetaddr":"2101 SOUTH PARROT AVE","zipcode":"34974","county":"093","date_super":{"end_time":"1999/03/02 00:00:00 -0500","original":"3/1/1999 ","granularity":"day","time":"1999/03/01 00:00:00 -0500"},"geo_score":0.779,"strstate":"FL","conversion":1,"type_store":"Supercenter","opendate":{"end_time":"1985/07/17 00:00:00 -0400","original":"7/16/1985 ","granularity":"day","time":"1985/07/16 00:00:00 -0400"},"id":"a61znsyz3roq","geo_precision":"street","storenum":814,"strcity":"Okeechobee"},"type":"Feature","geometry":{"type":"Point","coordinates":[-80.829876,27.221784]}},{"properties":{"st":"29","streetaddr":"4252 HWY 54","zipcode":"65065","county":"029","date_super":{"end_time":"1996/03/02 00:00:00 -0500","original":"3/1/1996 ","granularity":"day","time":"1996/03/01 00:00:00 -0500"},"geo_score":0.872,"strstate":"MO","conversion":1,"type_store":"Supercenter","opendate":{"end_time":"1985/08/31 00:00:00 -0400","original":"8/30/1985 ","granularity":"day","time":"1985/08/30 00:00:00 -0400"},"id":"a61znszhr8ug","geo_precision":"range","storenum":815,"strcity":"Osage Beach"},"type":"Feature","geometry":{"type":"Point","coordinates":[-92.620587,38.148015]}},{"properties":{"st":"28","streetaddr":"960 BROOKWAY BLVD","zipcode":"39601","county":"085","date_super":{"end_time":"1994/03/02 00:00:00 -0500","original":"3/1/1994 ","granularity":"day","time":"1994/03/01 00:00:00 -0500"},"geo_score":0.902,"strstate":"MS","conversion":1,"type_store":"Supercenter","opendate":{"end_time":"1985/10/09 00:00:00 -0400","original":"10/8/1985 ","granularity":"day","time":"1985/10/08 00:00:00 -0400"},"id":"a61znt5mztds","geo_precision":"range","storenum":816,"strcity":"Brookhaven"},"type":"Feature","geometry":{"type":"Point","coordinates":[-90.46472,31.578971]}},{"properties":{"st":"12","streetaddr":"4444 WEST VINE","zipcode":"34746","county":"097","date_super":{"end_time":"1996/03/02 00:00:00 -0500","original":"3/1/1996 ","granularity":"day","time":"1996/03/01 00:00:00 -0500"},"geo_score":0.794,"strstate":"FL","conversion":1,"type_store":"Supercenter","opendate":{"end_time":"1985/10/09 00:00:00 -0400","original":"10/8/1985 ","granularity":"day","time":"1985/10/08 00:00:00 -0400"},"id":"a61znsumh6od","geo_precision":"range","storenum":817,"strcity":"Kissimmee"},"type":"Feature","geometry":{"type":"Point","coordinates":[-81.46003,28.303964]}},{"properties":{"st":"12","streetaddr":"10270 FRONT BEACH RD","zipcode":"32407","county":"005","date_super":{"end_time":"1996/03/02 00:00:00 -0500","original":"3/1/1996 ","granularity":"day","time":"1996/03/01 00:00:00 -0500"},"geo_score":0.922,"strstate":"FL","conversion":1,"type_store":"Supercenter","opendate":{"end_time":"1986/01/01 00:00:00 -0500","original":"12/31/1985 ","granularity":"day","time":"1985/12/31 00:00:00 -0500"},"id":"a61znt4pfkyn","geo_precision":"range","storenum":818,"strcity":"Panama City Beach"},"type":"Feature","geometry":{"type":"Point","coordinates":[-85.805595,30.177957]}},{"properties":{"st":"12","streetaddr":"1619 DEL PRADO BLVD","zipcode":"33990","county":"071","date_super":{"end_time":"1995/03/02 00:00:00 -0500","original":"3/1/1995 ","granularity":"day","time":"1995/03/01 00:00:00 -0500"},"geo_score":0.902,"strstate":"FL","conversion":1,"type_store":"Supercenter","opendate":{"end_time":"1985/07/31 00:00:00 -0400","original":"7/30/1985 ","granularity":"day","time":"1985/07/30 00:00:00 -0400"},"id":"a61znt70i576","geo_precision":"range","storenum":819,"strcity":"Cape Coral"},"type":"Feature","geometry":{"type":"Point","coordinates":[-81.940701,26.622066]}},{"properties":{"st":"29","streetaddr":"1920 MAIN STREET","zipcode":"65233","county":"053","date_super":null,"geo_score":0.902,"strstate":"MO","conversion":null,"type_store":"Wal-Mart","opendate":{"end_time":"1985/08/31 00:00:00 -0400","original":"8/30/1985 ","granularity":"day","time":"1985/08/30 00:00:00 -0400"},"id":"a61znt6dfy1x","geo_precision":"range","storenum":820,"strcity":"Boonville"},"type":"Feature","geometry":{"type":"Point","coordinates":[-92.740711,38.957415]}},{"properties":{"st":"35","streetaddr":"3728 N PRINCE STREET","zipcode":"88101","county":"009","date_super":{"end_time":"1998/03/02 00:00:00 -0500","original":"3/1/1998 ","granularity":"day","time":"1998/03/01 00:00:00 -0500"},"geo_score":0.913,"strstate":"NM","conversion":1,"type_store":"Supercenter","opendate":{"end_time":"1985/10/17 00:00:00 -0400","original":"10/16/1985 ","granularity":"day","time":"1985/10/16 00:00:00 -0400"},"id":"a61znt8dnhfu","geo_precision":"range","storenum":821,"strcity":"Clovis"},"type":"Feature","geometry":{"type":"Point","coordinates":[-103.196483,34.43615]}},{"properties":{"st":"48","streetaddr":"3700 I-40 EAST","zipcode":"79103","county":"375","date_super":{"end_time":"1994/03/02 00:00:00 -0500","original":"3/1/1994 ","granularity":"day","time":"1994/03/01 00:00:00 -0500"},"geo_score":0.659,"strstate":"TX","conversion":1,"type_store":"Supercenter","opendate":{"end_time":"1986/01/22 00:00:00 -0500","original":"1/21/1986 ","granularity":"day","time":"1986/01/21 00:00:00 -0500"},"id":"a61znsy19zke","geo_precision":"range","storenum":822,"strcity":"Amarillo"},"type":"Feature","geometry":{"type":"Point","coordinates":[-101.794377,35.221924]}},{"properties":{"st":"40","streetaddr":"1101 EAST PROSPECT","zipcode":"74601","county":"071","date_super":{"end_time":"1994/03/02 00:00:00 -0500","original":"3/1/1994 ","granularity":"day","time":"1994/03/01 00:00:00 -0500"},"geo_score":0.829,"strstate":"OK","conversion":1,"type_store":"Supercenter","opendate":{"end_time":"1985/11/13 00:00:00 -0500","original":"11/12/1985 ","granularity":"day","time":"1985/11/12 00:00:00 -0500"},"id":"a61znt5pczll","geo_precision":"range","storenum":823,"strcity":"Ponca City"},"type":"Feature","geometry":{"type":"Point","coordinates":[-97.071113,36.738557]}},{"properties":{"st":"35","streetaddr":"8000 ACADEMY ROAD NE","zipcode":"87111","county":"001","date_super":null,"geo_score":1.0,"strstate":"NM","conversion":null,"type_store":"Wal-Mart","opendate":{"end_time":"1985/07/03 00:00:00 -0400","original":"7/2/1985 ","granularity":"day","time":"1985/07/02 00:00:00 -0400"},"id":"a61znt0ctztq","geo_precision":"range","storenum":824,"strcity":"Albuquerque"},"type":"Feature","geometry":{"type":"Point","coordinates":[-106.553852,35.146124]}},{"properties":{"st":"21","streetaddr":"1283 US HIGHWAY 27 NORTH","zipcode":"40484","county":"137","date_super":{"end_time":"2005/07/21 00:00:00 -0400","original":"7/20/2005 ","granularity":"day","time":"2005/07/20 00:00:00 -0400"},"geo_score":0.679,"strstate":"KY","conversion":1,"type_store":"Supercenter","opendate":{"end_time":"1986/08/20 00:00:00 -0400","original":"8/19/1986 ","granularity":"day","time":"1986/08/19 00:00:00 -0400"},"id":"a61znt1lutie","geo_precision":"street","storenum":825,"strcity":"Stanford"},"type":"Feature","geometry":{"type":"Point","coordinates":[-84.650325,37.543251]}},{"properties":{"st":"35","streetaddr":"4600 EAST MAIN","zipcode":"87402","county":"045","date_super":{"end_time":"2002/03/14 00:00:00 -0500","original":"3/13/2002 ","granularity":"day","time":"2002/03/13 00:00:00 -0500"},"geo_score":0.916,"strstate":"NM","conversion":1,"type_store":"Supercenter","opendate":{"end_time":"1985/07/03 00:00:00 -0400","original":"7/2/1985 ","granularity":"day","time":"1985/07/02 00:00:00 -0400"},"id":"a61znt8lmt8b","geo_precision":"range","storenum":826,"strcity":"Farmington"},"type":"Feature","geometry":{"type":"Point","coordinates":[-108.152909,36.764769]}},{"properties":{"st":"48","streetaddr":"603 HWY 243 EAST","zipcode":"75103","county":"467","date_super":{"end_time":"1996/03/02 00:00:00 -0500","original":"3/1/1996 ","granularity":"day","time":"1996/03/01 00:00:00 -0500"},"geo_score":0.785,"strstate":"TX","conversion":1,"type_store":"Supercenter","opendate":{"end_time":"1985/08/31 00:00:00 -0400","original":"8/30/1985 ","granularity":"day","time":"1985/08/30 00:00:00 -0400"},"id":"a61znt72vvxc","geo_precision":"range","storenum":827,"strcity":"Canton"},"type":"Feature","geometry":{"type":"Point","coordinates":[-95.876187,32.543228]}},{"properties":{"st":"18","streetaddr":"2373 E MAIN STREET","zipcode":"46168","county":"063","date_super":{"end_time":"2005/10/27 00:00:00 -0400","original":"10/26/2005 ","granularity":"day","time":"2005/10/26 00:00:00 -0400"},"geo_score":0.797,"strstate":"IN","conversion":1,"type_store":"Supercenter","opendate":{"end_time":"1985/10/23 00:00:00 -0400","original":"10/22/1985 ","granularity":"day","time":"1985/10/22 00:00:00 -0400"},"id":"a61znsxphtra","geo_precision":"range","storenum":828,"strcity":"Indianapolis"},"type":"Feature","geometry":{"type":"Point","coordinates":[-86.370236,39.712772]}},{"properties":{"st":"35","streetaddr":"3251 CERILLOS RD","zipcode":"87505","county":"049","date_super":null,"geo_score":0.779,"strstate":"NM","conversion":null,"type_store":"Wal-Mart","opendate":{"end_time":"1985/07/03 00:00:00 -0400","original":"7/2/1985 ","granularity":"day","time":"1985/07/02 00:00:00 -0400"},"id":"a61znsvnjeu6","geo_precision":"street","storenum":829,"strcity":"Santa Fe"},"type":"Feature","geometry":{"type":"Point","coordinates":[-105.985311,35.658525]}},{"properties":{"st":"17","streetaddr":"1901 FIRST AVENUE","zipcode":"61071","county":"195","date_super":null,"geo_score":0.818,"strstate":"IL","conversion":null,"type_store":"Wal-Mart","opendate":{"end_time":"1986/01/22 00:00:00 -0500","original":"1/21/1986 ","granularity":"day","time":"1986/01/21 00:00:00 -0500"},"id":"a61znsygqqa0","geo_precision":"range","storenum":830,"strcity":"Rock Falls"},"type":"Feature","geometry":{"type":"Point","coordinates":[-89.689464,41.76369]}},{"properties":{"st":"35","streetaddr":"301 SAN MATEO BLVD SE","zipcode":"87108","county":"001","date_super":{"end_time":"2003/04/24 00:00:00 -0400","original":"4/23/2003 ","granularity":"day","time":"2003/04/23 00:00:00 -0400"},"geo_score":1.0,"strstate":"NM","conversion":1,"type_store":"Supercenter","opendate":{"end_time":"1985/07/03 00:00:00 -0400","original":"7/2/1985 ","granularity":"day","time":"1985/07/02 00:00:00 -0400"},"id":"a61znsxoqh67","geo_precision":"range","storenum":831,"strcity":"Albuquerque"},"type":"Feature","geometry":{"type":"Point","coordinates":[-106.586238,35.075706]}},{"properties":{"st":"17","streetaddr":"1344 ILLINOIS HWY #1","zipcode":"62821","county":"193","date_super":{"end_time":"2002/10/31 00:00:00 -0500","original":"10/30/2002 ","granularity":"day","time":"2002/10/30 00:00:00 -0500"},"geo_score":0.506,"strstate":"IL","conversion":1,"type_store":"Supercenter","opendate":{"end_time":"1985/10/09 00:00:00 -0400","original":"10/8/1985 ","granularity":"day","time":"1985/10/08 00:00:00 -0400"},"id":"a61znt0ie3un","geo_precision":"street","storenum":833,"strcity":"Carmi"},"type":"Feature","geometry":{"type":"Point","coordinates":[-88.177801,38.090322]}},{"properties":{"st":"29","streetaddr":"810 SO. 37TH ST.","zipcode":"64424","county":"081","date_super":{"end_time":"2004/10/28 00:00:00 -0400","original":"10/27/2004 ","granularity":"day","time":"2004/10/27 00:00:00 -0400"},"geo_score":0.357,"strstate":"MO","conversion":1,"type_store":"Supercenter","opendate":{"end_time":"1985/11/13 00:00:00 -0500","original":"11/12/1985 ","granularity":"day","time":"1985/11/12 00:00:00 -0500"},"id":"a61znt9u0rrf","geo_precision":"street","storenum":834,"strcity":"Bethany"},"type":"Feature","geometry":{"type":"Point","coordinates":[-94.966004,40.129338]}},{"properties":{"st":"35","streetaddr":"400 EUBANK BLVD NE","zipcode":"87123","county":"001","date_super":{"end_time":"2002/09/04 00:00:00 -0400","original":"9/3/2002 ","granularity":"day","time":"2002/09/03 00:00:00 -0400"},"geo_score":1.0,"strstate":"NM","conversion":1,"type_store":"Supercenter","opendate":{"end_time":"1985/07/03 00:00:00 -0400","original":"7/2/1985 ","granularity":"day","time":"1985/07/02 00:00:00 -0400"},"id":"a61znt8crqer","geo_precision":"range","storenum":835,"strcity":"Albuquerque"},"type":"Feature","geometry":{"type":"Point","coordinates":[-106.532327,35.078253]}},{"properties":{"st":"13","streetaddr":"6586 HWY 40 EAST","zipcode":"31558","county":"039","date_super":{"end_time":"2004/03/02 00:00:00 -0500","original":"3/1/2004 ","granularity":"day","time":"2004/03/01 00:00:00 -0500"},"geo_score":0.512,"strstate":"GA","conversion":1,"type_store":"Supercenter","opendate":{"end_time":"1985/07/31 00:00:00 -0400","original":"7/30/1985 ","granularity":"day","time":"1985/07/30 00:00:00 -0400"},"id":"a61znt586j11","geo_precision":"street","storenum":836,"strcity":"St. Marys"},"type":"Feature","geometry":{"type":"Point","coordinates":[-81.591788,30.755437]}},{"properties":{"st":"29","streetaddr":"333 EAST WALNUT","zipcode":"65791","county":"149","date_super":null,"geo_score":0.89,"strstate":"MO","conversion":null,"type_store":"Wal-Mart","opendate":{"end_time":"1985/10/02 00:00:00 -0400","original":"10/1/1985 ","granularity":"day","time":"1985/10/01 00:00:00 -0400"},"id":"a61znta7drux","geo_precision":"range","storenum":837,"strcity":"Thayer"},"type":"Feature","geometry":{"type":"Point","coordinates":[-91.54063,36.523399]}},{"properties":{"st":"40","streetaddr":"220 SO. STATE HWY 97","zipcode":"74063","county":"143","date_super":{"end_time":"2003/08/21 00:00:00 -0400","original":"8/20/2003 ","granularity":"day","time":"2003/08/20 00:00:00 -0400"},"geo_score":0.489,"strstate":"OK","conversion":1,"type_store":"Supercenter","opendate":{"end_time":"1986/01/22 00:00:00 -0500","original":"1/21/1986 ","granularity":"day","time":"1986/01/21 00:00:00 -0500"},"id":"a61znt32m36j","geo_precision":"street","storenum":838,"strcity":"Sand Springs"},"type":"Feature","geometry":{"type":"Point","coordinates":[-96.101183,36.136843]}},{"properties":{"st":"22","streetaddr":"9350 CORTANA PLACE","zipcode":"70815","county":"033","date_super":{"end_time":"2004/01/29 00:00:00 -0500","original":"1/28/2004 ","granularity":"day","time":"2004/01/28 00:00:00 -0500"},"geo_score":0.92,"strstate":"LA","conversion":1,"type_store":"Supercenter","opendate":{"end_time":"1985/11/13 00:00:00 -0500","original":"11/12/1985 ","granularity":"day","time":"1985/11/12 00:00:00 -0500"},"id":"a61znsx9s0ue","geo_precision":"range","storenum":839,"strcity":"Baton Rouge"},"type":"Feature","geometry":{"type":"Point","coordinates":[-91.090842,30.460601]}},{"properties":{"st":"19","streetaddr":"1126 HIGHWAY 38 NORTH","zipcode":"52772","county":"031","date_super":null,"geo_score":0.738,"strstate":"IA","conversion":null,"type_store":"Wal-Mart","opendate":{"end_time":"1985/10/02 00:00:00 -0400","original":"10/1/1985 ","granularity":"day","time":"1985/10/01 00:00:00 -0400"},"id":"a61znswm8zyy","geo_precision":"range","storenum":841,"strcity":"Tipton"},"type":"Feature","geometry":{"type":"Point","coordinates":[-91.128397,41.777435]}},{"properties":{"st":"08","streetaddr":"4200 DILLION DRIVE","zipcode":"81008","county":"101","date_super":{"end_time":"1998/03/02 00:00:00 -0500","original":"3/1/1998 ","granularity":"day","time":"1998/03/01 00:00:00 -0500"},"geo_score":0.886,"strstate":"CO","conversion":1,"type_store":"Supercenter","opendate":{"end_time":"1985/10/02 00:00:00 -0400","original":"10/1/1985 ","granularity":"day","time":"1985/10/01 00:00:00 -0400"},"id":"a61znt4lyylx","geo_precision":"range","storenum":842,"strcity":"Pueblo"},"type":"Feature","geometry":{"type":"Point","coordinates":[-104.606895,38.307176]}},{"properties":{"st":"13","streetaddr":"131 N US 19 AND SYLVESTER RD","zipcode":"31730","county":"205","date_super":null,"geo_score":0.587,"strstate":"GA","conversion":null,"type_store":"Wal-Mart","opendate":{"end_time":"1985/09/11 00:00:00 -0400","original":"9/10/1985 ","granularity":"day","time":"1985/09/10 00:00:00 -0400"},"id":"a61znt30zhrz","geo_precision":"street","storenum":843,"strcity":"Camilla"},"type":"Feature","geometry":{"type":"Point","coordinates":[-84.197803,31.233138]}},{"properties":{"st":"17","streetaddr":"333 EAST ROUTE 6","zipcode":"60450","county":"063","date_super":{"end_time":"1998/03/02 00:00:00 -0500","original":"3/1/1998 ","granularity":"day","time":"1998/03/01 00:00:00 -0500"},"geo_score":0.766,"strstate":"IL","conversion":1,"type_store":"Supercenter","opendate":{"end_time":"1986/09/03 00:00:00 -0400","original":"9/2/1986 ","granularity":"day","time":"1986/09/02 00:00:00 -0400"},"id":"a61znt4hclzf","geo_precision":"range","storenum":844,"strcity":"Morris"},"type":"Feature","geometry":{"type":"Point","coordinates":[-88.415712,41.306802]}},{"properties":{"st":"29","streetaddr":"1250 WEST DALLAS","zipcode":"65622","county":"059","date_super":null,"geo_score":0.544,"strstate":"MO","conversion":null,"type_store":"Wal-Mart","opendate":{"end_time":"1985/10/02 00:00:00 -0400","original":"10/1/1985 ","granularity":"day","time":"1985/10/01 00:00:00 -0400"},"id":"a61znt56uz9s","geo_precision":"street","storenum":845,"strcity":"Buffalo"},"type":"Feature","geometry":{"type":"Point","coordinates":[-93.086149,37.640088]}},{"properties":{"st":"48","streetaddr":"2125 WEST TRAVIS","zipcode":"78945","county":"149","date_super":null,"geo_score":0.855,"strstate":"TX","conversion":null,"type_store":"Wal-Mart","opendate":{"end_time":"1985/10/16 00:00:00 -0400","original":"10/15/1985 ","granularity":"day","time":"1985/10/15 00:00:00 -0400"},"id":"a61znt7pntlm","geo_precision":"range","storenum":846,"strcity":"Lagrange"},"type":"Feature","geometry":{"type":"Point","coordinates":[-96.908488,29.903939]}},{"properties":{"st":"55","streetaddr":"1209 JOSEPH ST","zipcode":"53533","county":"049","date_super":null,"geo_score":0.917,"strstate":"WI","conversion":null,"type_store":"Wal-Mart","opendate":{"end_time":"1985/09/18 00:00:00 -0400","original":"9/17/1985 ","granularity":"day","time":"1985/09/17 00:00:00 -0400"},"id":"a61znt7ojzks","geo_precision":"range","storenum":847,"strcity":"Dodgeville"},"type":"Feature","geometry":{"type":"Point","coordinates":[-90.136839,42.972854]}},{"properties":{"st":"28","streetaddr":"6811 SOUTHCREST PKWY","zipcode":"38671","county":"033","date_super":{"end_time":"1998/03/02 00:00:00 -0500","original":"3/1/1998 ","granularity":"day","time":"1998/03/01 00:00:00 -0500"},"geo_score":1.0,"strstate":"MS","conversion":1,"type_store":"Supercenter","opendate":{"end_time":"1985/11/13 00:00:00 -0500","original":"11/12/1985 ","granularity":"day","time":"1985/11/12 00:00:00 -0500"},"id":"a61znt49u1jr","geo_precision":"range","storenum":848,"strcity":"Southaven"},"type":"Feature","geometry":{"type":"Point","coordinates":[-89.994489,34.962973]}},{"properties":{"st":"48","streetaddr":"155 L0UETTA CROSSING","zipcode":"77373","county":"201","date_super":{"end_time":"1999/03/02 00:00:00 -0500","original":"3/1/1999 ","granularity":"day","time":"1999/03/01 00:00:00 -0500"},"geo_score":0.429,"strstate":"TX","conversion":1,"type_store":"Supercenter","opendate":{"end_time":"1986/02/05 00:00:00 -0500","original":"2/4/1986 ","granularity":"day","time":"1986/02/04 00:00:00 -0500"},"id":"a61znsya7ahf","geo_precision":"street","storenum":849,"strcity":"Spring"},"type":"Feature","geometry":{"type":"Point","coordinates":[-95.739917,30.218086]}},{"properties":{"st":"35","streetaddr":"2701 CARLISLE BLVD NE","zipcode":"87110","county":"001","date_super":{"end_time":"2004/05/20 00:00:00 -0400","original":"5/19/2004 ","granularity":"day","time":"2004/05/19 00:00:00 -0400"},"geo_score":1.0,"strstate":"NM","conversion":1,"type_store":"Supercenter","opendate":{"end_time":"1985/07/03 00:00:00 -0400","original":"7/2/1985 ","granularity":"day","time":"1985/07/02 00:00:00 -0400"},"id":"a61znt9abafr","geo_precision":"range","storenum":850,"strcity":"Albuquerque"},"type":"Feature","geometry":{"type":"Point","coordinates":[-106.604189,35.111084]}},{"properties":{"st":"35","streetaddr":"1800 W HWY 70","zipcode":"88346","county":"027","date_super":{"end_time":"1998/03/02 00:00:00 -0500","original":"3/1/1998 ","granularity":"day","time":"1998/03/01 00:00:00 -0500"},"geo_score":0.876,"strstate":"NM","conversion":1,"type_store":"Supercenter","opendate":{"end_time":"1986/03/05 00:00:00 -0500","original":"3/4/1986 ","granularity":"day","time":"1986/03/04 00:00:00 -0500"},"id":"a61znsxouijx","geo_precision":"range","storenum":851,"strcity":"Ruidoso"},"type":"Feature","geometry":{"type":"Point","coordinates":[-105.612315,33.325956]}},{"properties":{"st":"17","streetaddr":"2901 N COLUMBUS","zipcode":"61350","county":"099","date_super":null,"geo_score":0.833,"strstate":"IL","conversion":null,"type_store":"Wal-Mart","opendate":{"end_time":"1986/01/01 00:00:00 -0500","original":"12/31/1985 ","granularity":"day","time":"1985/12/31 00:00:00 -0500"},"id":"a61znt0weuew","geo_precision":"range","storenum":852,"strcity":"Ottawa"},"type":"Feature","geometry":{"type":"Point","coordinates":[-88.836073,41.371577]}},{"properties":{"st":"01","streetaddr":"685 SCHILLINGER RD","zipcode":"36695","county":"097","date_super":{"end_time":"1997/03/02 00:00:00 -0500","original":"3/1/1997 ","granularity":"day","time":"1997/03/01 00:00:00 -0500"},"geo_score":0.882,"strstate":"AL","conversion":1,"type_store":"Supercenter","opendate":{"end_time":"1985/08/21 00:00:00 -0400","original":"8/20/1985 ","granularity":"day","time":"1985/08/20 00:00:00 -0400"},"id":"a61znt2nnnvc","geo_precision":"range","storenum":853,"strcity":"Mobile"},"type":"Feature","geometry":{"type":"Point","coordinates":[-88.225461,30.670152]}},{"properties":{"st":"18","streetaddr":"2460 EAST WABASH","zipcode":"46041","county":"023","date_super":{"end_time":"2002/10/31 00:00:00 -0500","original":"10/30/2002 ","granularity":"day","time":"2002/10/30 00:00:00 -0500"},"geo_score":0.848,"strstate":"IN","conversion":1,"type_store":"Supercenter","opendate":{"end_time":"1986/01/22 00:00:00 -0500","original":"1/21/1986 ","granularity":"day","time":"1986/01/21 00:00:00 -0500"},"id":"a61znt7cw298","geo_precision":"range","storenum":854,"strcity":"Frankfort"},"type":"Feature","geometry":{"type":"Point","coordinates":[-86.480694,40.278847]}},{"properties":{"st":"13","streetaddr":"4375 JONESBORO ROAD","zipcode":"30291","county":"121","date_super":{"end_time":"2005/06/16 00:00:00 -0400","original":"6/15/2005 ","granularity":"day","time":"2005/06/15 00:00:00 -0400"},"geo_score":1.0,"strstate":"GA","conversion":1,"type_store":"Supercenter","opendate":{"end_time":"1986/01/22 00:00:00 -0500","original":"1/21/1986 ","granularity":"day","time":"1986/01/21 00:00:00 -0500"},"id":"a61znt7p0279","geo_precision":"range","storenum":855,"strcity":"Union City"},"type":"Feature","geometry":{"type":"Point","coordinates":[-84.533129,33.566986]}},{"properties":{"st":"13","streetaddr":"404 HWY 27 NO. BYPASS","zipcode":"30110","county":"143","date_super":{"end_time":"2003/08/21 00:00:00 -0400","original":"8/20/2003 ","granularity":"day","time":"2003/08/20 00:00:00 -0400"},"geo_score":0.657,"strstate":"GA","conversion":1,"type_store":"Supercenter","opendate":{"end_time":"1985/10/02 00:00:00 -0400","original":"10/1/1985 ","granularity":"day","time":"1985/10/01 00:00:00 -0400"},"id":"a61znt0jj6ok","geo_precision":"street","storenum":856,"strcity":"Bremen"},"type":"Feature","geometry":{"type":"Point","coordinates":[-85.176914,33.771718]}},{"properties":{"st":"12","streetaddr":"3653 ORLANDO DR","zipcode":"32773","county":"117","date_super":{"end_time":"2002/05/23 00:00:00 -0400","original":"5/22/2002 ","granularity":"day","time":"2002/05/22 00:00:00 -0400"},"geo_score":0.971,"strstate":"FL","conversion":1,"type_store":"Supercenter","opendate":{"end_time":"1985/10/02 00:00:00 -0400","original":"10/1/1985 ","granularity":"day","time":"1985/10/01 00:00:00 -0400"},"id":"a61znsudichn","geo_precision":"range","storenum":857,"strcity":"Sanford"},"type":"Feature","geometry":{"type":"Point","coordinates":[-81.285697,28.759509]}},{"properties":{"st":"13","streetaddr":"361 8TH AVENUE NE","zipcode":"39828","county":"131","date_super":{"end_time":"2005/03/24 00:00:00 -0500","original":"3/23/2005 ","granularity":"day","time":"2005/03/23 00:00:00 -0500"},"geo_score":0.927,"strstate":"GA","conversion":1,"type_store":"Supercenter","opendate":{"end_time":"1985/11/13 00:00:00 -0500","original":"11/12/1985 ","granularity":"day","time":"1985/11/12 00:00:00 -0500"},"id":"a61znswfuy8y","geo_precision":"range","storenum":858,"strcity":"Cairo"},"type":"Feature","geometry":{"type":"Point","coordinates":[-84.20354,30.885569]}},{"properties":{"st":"12","streetaddr":"2000 STATE ROAD 60 EAST","zipcode":"33898","county":"105","date_super":{"end_time":"1999/03/02 00:00:00 -0500","original":"3/1/1999 ","granularity":"day","time":"1999/03/01 00:00:00 -0500"},"geo_score":0.883,"strstate":"FL","conversion":1,"type_store":"Supercenter","opendate":{"end_time":"1985/11/13 00:00:00 -0500","original":"11/12/1985 ","granularity":"day","time":"1985/11/12 00:00:00 -0500"},"id":"a61znt6ss72f","geo_precision":"range","storenum":859,"strcity":"Lake Wales"},"type":"Feature","geometry":{"type":"Point","coordinates":[-81.554593,27.894178]}},{"properties":{"st":"12","streetaddr":"1699 NO. WOODLAND BLVD","zipcode":"32720","county":"127","date_super":{"end_time":"2003/10/30 00:00:00 -0500","original":"10/29/2003 ","granularity":"day","time":"2003/10/29 00:00:00 -0500"},"geo_score":0.518,"strstate":"FL","conversion":1,"type_store":"Supercenter","opendate":{"end_time":"1986/01/01 00:00:00 -0500","original":"12/31/1985 ","granularity":"day","time":"1985/12/31 00:00:00 -0500"},"id":"a61znsyqgvqz","geo_precision":"street","storenum":860,"strcity":"Deland"},"type":"Feature","geometry":{"type":"Point","coordinates":[-81.303446,29.028975]}},{"properties":{"st":"48","streetaddr":"4215 SOUTH LOOP 289","zipcode":"79423","county":"303","date_super":{"end_time":"1996/03/02 00:00:00 -0500","original":"3/1/1996 ","granularity":"day","time":"1996/03/01 00:00:00 -0500"},"geo_score":1.0,"strstate":"TX","conversion":1,"type_store":"Supercenter","opendate":{"end_time":"1985/11/13 00:00:00 -0500","original":"11/12/1985 ","granularity":"day","time":"1985/11/12 00:00:00 -0500"},"id":"a61znt0jlasd","geo_precision":"range","storenum":861,"strcity":"Lubbock"},"type":"Feature","geometry":{"type":"Point","coordinates":[-101.900827,33.529164]}},{"properties":{"st":"13","streetaddr":"751 W OGLETHORPE HWY","zipcode":"31313","county":"179","date_super":{"end_time":"2000/03/02 00:00:00 -0500","original":"3/1/2000 ","granularity":"day","time":"2000/03/01 00:00:00 -0500"},"geo_score":0.902,"strstate":"GA","conversion":1,"type_store":"Supercenter","opendate":{"end_time":"1986/01/01 00:00:00 -0500","original":"12/31/1985 ","granularity":"day","time":"1985/12/31 00:00:00 -0500"},"id":"a61znsye8qan","geo_precision":"range","storenum":862,"strcity":"Hinesville"},"type":"Feature","geometry":{"type":"Point","coordinates":[-81.599724,31.821608]}},{"properties":{"st":"01","streetaddr":"4180 US HWY 431","zipcode":"36274","county":"111","date_super":{"end_time":"2004/03/18 00:00:00 -0500","original":"3/17/2004 ","granularity":"day","time":"2004/03/17 00:00:00 -0500"},"geo_score":0.72,"strstate":"AL","conversion":1,"type_store":"Supercenter","opendate":{"end_time":"1985/10/16 00:00:00 -0400","original":"10/15/1985 ","granularity":"day","time":"1985/10/15 00:00:00 -0400"},"id":"a61znt71llv1","geo_precision":"street","storenum":863,"strcity":"Roanoke"},"type":"Feature","geometry":{"type":"Point","coordinates":[-85.395546,33.178275]}},{"properties":{"st":"13","streetaddr":"3109 EAST 1ST STREET","zipcode":"30474","county":"279","date_super":{"end_time":"2000/03/02 00:00:00 -0500","original":"3/1/2000 ","granularity":"day","time":"2000/03/01 00:00:00 -0500"},"geo_score":0.727,"strstate":"GA","conversion":1,"type_store":"Supercenter","opendate":{"end_time":"1985/10/30 00:00:00 -0500","original":"10/29/1985 ","granularity":"day","time":"1985/10/29 00:00:00 -0500"},"id":"a61znt8sdjdx","geo_precision":"range","storenum":864,"strcity":"Vidalia"},"type":"Feature","geometry":{"type":"Point","coordinates":[-82.403806,32.162321]}},{"properties":{"st":"48","streetaddr":"1209 IH-35 SOUTH","zipcode":"78130","county":"091","date_super":{"end_time":"1996/03/02 00:00:00 -0500","original":"3/1/1996 ","granularity":"day","time":"1996/03/01 00:00:00 -0500"},"geo_score":0.6,"strstate":"TX","conversion":1,"type_store":"Supercenter","opendate":{"end_time":"1986/01/22 00:00:00 -0500","original":"1/21/1986 ","granularity":"day","time":"1986/01/21 00:00:00 -0500"},"id":"a61znt3e669c","geo_precision":"zip","storenum":865,"strcity":"New Braunfalls"},"type":"Feature","geometry":{"type":"Point","coordinates":[-98.170843,29.665781]}},{"properties":{"st":"01","streetaddr":"5245 SER RD SOUTH","zipcode":"36619","county":"097","date_super":{"end_time":"1998/03/02 00:00:00 -0500","original":"3/1/1998 ","granularity":"day","time":"1998/03/01 00:00:00 -0500"},"geo_score":0.5,"strstate":"AL","conversion":1,"type_store":"Supercenter","opendate":{"end_time":"1988/07/01 00:00:00 -0400","original":"6/30/1988 ","granularity":"day","time":"1988/06/30 00:00:00 -0400"},"id":"a61znt54fiv0","geo_precision":"street","storenum":866,"strcity":"Mobile"},"type":"Feature","geometry":{"type":"Point","coordinates":[-88.147577,30.6433]}},{"properties":{"st":"31","streetaddr":"3322 AVENUE \"I\"","zipcode":"69361","county":"157","date_super":{"end_time":"2002/10/31 00:00:00 -0500","original":"10/30/2002 ","granularity":"day","time":"2002/10/30 00:00:00 -0500"},"geo_score":0.536,"strstate":"NE","conversion":1,"type_store":"Supercenter","opendate":{"end_time":"1986/03/06 00:00:00 -0500","original":"3/5/1986 ","granularity":"day","time":"1986/03/05 00:00:00 -0500"},"id":"a61znsyhyr35","geo_precision":"street","storenum":867,"strcity":"Scottsbluff"},"type":"Feature","geometry":{"type":"Point","coordinates":[-103.675246,41.856223]}},{"properties":{"st":"35","streetaddr":"2401 S. CANAL ST","zipcode":"88220","county":"015","date_super":{"end_time":"1999/03/02 00:00:00 -0500","original":"3/1/1999 ","granularity":"day","time":"1999/03/01 00:00:00 -0500"},"geo_score":0.577,"strstate":"NM","conversion":1,"type_store":"Supercenter","opendate":{"end_time":"1986/03/06 00:00:00 -0500","original":"3/5/1986 ","granularity":"day","time":"1986/03/05 00:00:00 -0500"},"id":"a61znsuetzfb","geo_precision":"street","storenum":868,"strcity":"Carlsbad"},"type":"Feature","geometry":{"type":"Point","coordinates":[-104.228969,32.42151]}},{"properties":{"st":"08","streetaddr":"3333 CLARK STREET","zipcode":"81101","county":"003","date_super":{"end_time":"2001/04/19 00:00:00 -0400","original":"4/18/2001 ","granularity":"day","time":"2001/04/18 00:00:00 -0400"},"geo_score":0.708,"strstate":"CO","conversion":1,"type_store":"Supercenter","opendate":{"end_time":"1986/01/22 00:00:00 -0500","original":"1/21/1986 ","granularity":"day","time":"1986/01/21 00:00:00 -0500"},"id":"a61znsx5pp5p","geo_precision":"street","storenum":869,"strcity":"Alamosa"},"type":"Feature","geometry":{"type":"Point","coordinates":[-105.893671,37.480201]}},{"properties":{"st":"18","streetaddr":"4040 NEWTON STREET","zipcode":"47546","county":"037","date_super":{"end_time":"1999/03/02 00:00:00 -0500","original":"3/1/1999 ","granularity":"day","time":"1999/03/01 00:00:00 -0500"},"geo_score":0.919,"strstate":"IN","conversion":1,"type_store":"Supercenter","opendate":{"end_time":"1985/10/23 00:00:00 -0400","original":"10/22/1985 ","granularity":"day","time":"1985/10/22 00:00:00 -0400"},"id":"a61znt906unf","geo_precision":"range","storenum":870,"strcity":"Jasper"},"type":"Feature","geometry":{"type":"Point","coordinates":[-86.937938,38.428204]}},{"properties":{"st":"29","streetaddr":"101 W HIGHWAY 60","zipcode":"65548","county":"091","date_super":null,"geo_score":0.846,"strstate":"MO","conversion":null,"type_store":"Wal-Mart","opendate":{"end_time":"1985/10/02 00:00:00 -0400","original":"10/1/1985 ","granularity":"day","time":"1985/10/01 00:00:00 -0400"},"id":"a61znsvyi9jr","geo_precision":"range","storenum":871,"strcity":"Mountain View"},"type":"Feature","geometry":{"type":"Point","coordinates":[-91.702391,37.00161]}},{"properties":{"st":"48","streetaddr":"1919 NORTH MAIN","zipcode":"77581","county":"039","date_super":{"end_time":"2005/09/15 00:00:00 -0400","original":"9/14/2005 ","granularity":"day","time":"2005/09/14 00:00:00 -0400"},"geo_score":0.837,"strstate":"TX","conversion":1,"type_store":"Supercenter","opendate":{"end_time":"1986/04/02 00:00:00 -0500","original":"4/1/1986 ","granularity":"day","time":"1986/04/01 00:00:00 -0500"},"id":"a61znt659a8p","geo_precision":"range","storenum":872,"strcity":"Pearland"},"type":"Feature","geometry":{"type":"Point","coordinates":[-95.286164,29.570863]}},{"properties":{"st":"35","streetaddr":"926 PASEO DEL PUEBLO SUR","zipcode":"87571","county":"055","date_super":null,"geo_score":0.755,"strstate":"NM","conversion":null,"type_store":"Wal-Mart","opendate":{"end_time":"1986/03/05 00:00:00 -0500","original":"3/4/1986 ","granularity":"day","time":"1986/03/04 00:00:00 -0500"},"id":"a61znt0a67hf","geo_precision":"range","storenum":873,"strcity":"Taos"},"type":"Feature","geometry":{"type":"Point","coordinates":[-105.584679,36.38711]}},{"properties":{"st":"28","streetaddr":"314 SGT. S. PRENTISS DR.","zipcode":"39120","county":"001","date_super":{"end_time":"1995/03/02 00:00:00 -0500","original":"3/1/1995 ","granularity":"day","time":"1995/03/01 00:00:00 -0500"},"geo_score":0.49,"strstate":"MS","conversion":1,"type_store":"Supercenter","opendate":{"end_time":"1985/11/13 00:00:00 -0500","original":"11/12/1985 ","granularity":"day","time":"1985/11/12 00:00:00 -0500"},"id":"a61znsxpj0ij","geo_precision":"street","storenum":874,"strcity":"Natchez"},"type":"Feature","geometry":{"type":"Point","coordinates":[-91.383879,31.57559]}},{"properties":{"st":"28","streetaddr":"815 S. WHEATLEY ROAD","zipcode":"39157","county":"089","date_super":{"end_time":"2004/10/21 00:00:00 -0400","original":"10/20/2004 ","granularity":"day","time":"2004/10/20 00:00:00 -0400"},"geo_score":0.61,"strstate":"MS","conversion":1,"type_store":"Supercenter","opendate":{"end_time":"1986/04/30 00:00:00 -0400","original":"4/29/1986 ","granularity":"day","time":"1986/04/29 00:00:00 -0400"},"id":"a61znt42q4xo","geo_precision":"street","storenum":875,"strcity":"Ridgeland"},"type":"Feature","geometry":{"type":"Point","coordinates":[-90.132128,32.422311]}},{"properties":{"st":"22","streetaddr":"155 SAN ANTONIO AVE","zipcode":"71449","county":"085","date_super":null,"geo_score":0.902,"strstate":"LA","conversion":null,"type_store":"Wal-Mart","opendate":{"end_time":"1986/04/30 00:00:00 -0400","original":"4/29/1986 ","granularity":"day","time":"1986/04/29 00:00:00 -0400"},"id":"a61znt2vr65a","geo_precision":"range","storenum":876,"strcity":"Many"},"type":"Feature","geometry":{"type":"Point","coordinates":[-93.490726,31.566293]}},{"properties":{"st":"37","streetaddr":"2406 W ROOSEVELT BLV","zipcode":"28110","county":"179","date_super":{"end_time":"2000/03/02 00:00:00 -0500","original":"3/1/2000 ","granularity":"day","time":"2000/03/01 00:00:00 -0500"},"geo_score":0.89,"strstate":"NC","conversion":1,"type_store":"Supercenter","opendate":{"end_time":"1986/03/05 00:00:00 -0500","original":"3/4/1986 ","granularity":"day","time":"1986/03/04 00:00:00 -0500"},"id":"a61znswzek58","geo_precision":"range","storenum":877,"strcity":"Monroe"},"type":"Feature","geometry":{"type":"Point","coordinates":[-80.564546,35.010727]}},{"properties":{"st":"13","streetaddr":"1500 MARKETPLACE BLVD.","zipcode":"30041","county":"117","date_super":{"end_time":"1997/03/02 00:00:00 -0500","original":"3/1/1997 ","granularity":"day","time":"1997/03/01 00:00:00 -0500"},"geo_score":0.988,"strstate":"GA","conversion":1,"type_store":"Supercenter","opendate":{"end_time":"1985/10/30 00:00:00 -0500","original":"10/29/1985 ","granularity":"day","time":"1985/10/29 00:00:00 -0500"},"id":"a61znsuyse6p","geo_precision":"range","storenum":878,"strcity":"Cummings"},"type":"Feature","geometry":{"type":"Point","coordinates":[-84.130642,34.18401]}},{"properties":{"st":"47","streetaddr":"419 HWY 52 BYPASS W","zipcode":"37083","county":"111","date_super":{"end_time":"2000/03/02 00:00:00 -0500","original":"3/1/2000 ","granularity":"day","time":"2000/03/01 00:00:00 -0500"},"geo_score":0.805,"strstate":"TN","conversion":1,"type_store":"Supercenter","opendate":{"end_time":"1986/01/01 00:00:00 -0500","original":"12/31/1985 ","granularity":"day","time":"1985/12/31 00:00:00 -0500"},"id":"a61znt7w43ll","geo_precision":"range","storenum":879,"strcity":"Lafayette"},"type":"Feature","geometry":{"type":"Point","coordinates":[-86.036453,36.520788]}},{"properties":{"st":"48","streetaddr":"4100 WEST AIRPORT FREEWAY","zipcode":"75061","county":"113","date_super":{"end_time":"2003/10/30 00:00:00 -0500","original":"10/29/2003 ","granularity":"day","time":"2003/10/29 00:00:00 -0500"},"geo_score":0.805,"strstate":"TX","conversion":1,"type_store":"Supercenter","opendate":{"end_time":"1986/11/12 00:00:00 -0500","original":"11/11/1986 ","granularity":"day","time":"1986/11/11 00:00:00 -0500"},"id":"a61znt8znvhm","geo_precision":"street","storenum":880,"strcity":"Irving"},"type":"Feature","geometry":{"type":"Point","coordinates":[-96.955873,32.836697]}},{"properties":{"st":"45","streetaddr":"5556 SUNSET BLVD","zipcode":"29072","county":"063","date_super":{"end_time":"1997/03/02 00:00:00 -0500","original":"3/1/1997 ","granularity":"day","time":"1997/03/01 00:00:00 -0500"},"geo_score":0.913,"strstate":"SC","conversion":1,"type_store":"Supercenter","opendate":{"end_time":"1985/11/13 00:00:00 -0500","original":"11/12/1985 ","granularity":"day","time":"1985/11/12 00:00:00 -0500"},"id":"a61znt351hoo","geo_precision":"range","storenum":881,"strcity":"Lexington"},"type":"Feature","geometry":{"type":"Point","coordinates":[-81.223628,33.995801]}},{"properties":{"st":"55","streetaddr":"38020 U.S. HIGHWAY 18","zipcode":"53821","county":"023","date_super":{"end_time":"2002/03/21 00:00:00 -0500","original":"3/20/2002 ","granularity":"day","time":"2002/03/20 00:00:00 -0500"},"geo_score":0.52,"strstate":"WI","conversion":1,"type_store":"Supercenter","opendate":{"end_time":"1986/02/05 00:00:00 -0500","original":"2/4/1986 ","granularity":"day","time":"1986/02/04 00:00:00 -0500"},"id":"a61zntaawhze","geo_precision":"street","storenum":882,"strcity":"Prairie du Chien"},"type":"Feature","geometry":{"type":"Point","coordinates":[-91.151091,43.048959]}},{"properties":{"st":"48","streetaddr":"14091 FM 490","zipcode":"78580","county":"489","date_super":{"end_time":"2005/10/27 00:00:00 -0400","original":"10/26/2005 ","granularity":"day","time":"2005/10/26 00:00:00 -0400"},"geo_score":0.585,"strstate":"TX","conversion":1,"type_store":"Supercenter","opendate":{"end_time":"1986/02/05 00:00:00 -0500","original":"2/4/1986 ","granularity":"day","time":"1986/02/04 00:00:00 -0500"},"id":"a61znta7qll7","geo_precision":"zip","storenum":883,"strcity":"Raymondville"},"type":"Feature","geometry":{"type":"Point","coordinates":[-97.618877,26.455624]}},{"properties":{"st":"18","streetaddr":"2500 PROGRESS PARKWAY","zipcode":"46176","county":"145","date_super":{"end_time":"2003/10/30 00:00:00 -0500","original":"10/29/2003 ","granularity":"day","time":"2003/10/29 00:00:00 -0500"},"geo_score":0.621,"strstate":"IN","conversion":1,"type_store":"Supercenter","opendate":{"end_time":"1986/03/19 00:00:00 -0500","original":"3/18/1986 ","granularity":"day","time":"1986/03/18 00:00:00 -0500"},"id":"a61znt7o8yfh","geo_precision":"street","storenum":884,"strcity":"Shelbyville"},"type":"Feature","geometry":{"type":"Point","coordinates":[-85.742663,39.523578]}},{"properties":{"st":"31","streetaddr":"1326 280TH ROAD","zipcode":"68434","county":"159","date_super":{"end_time":"2005/04/14 00:00:00 -0400","original":"4/13/2005 ","granularity":"day","time":"2005/04/13 00:00:00 -0400"},"geo_score":0.835,"strstate":"NE","conversion":1,"type_store":"Supercenter","opendate":{"end_time":"1986/04/02 00:00:00 -0500","original":"4/1/1986 ","granularity":"day","time":"1986/04/01 00:00:00 -0500"},"id":"a61znswdqoa6","geo_precision":"range","storenum":885,"strcity":"Seward"},"type":"Feature","geometry":{"type":"Point","coordinates":[-97.101632,40.876239]}},{"properties":{"st":"19","streetaddr":"3036 1ST AVE. SOUTH","zipcode":"50501","county":"187","date_super":{"end_time":"1998/03/02 00:00:00 -0500","original":"3/1/1998 ","granularity":"day","time":"1998/03/01 00:00:00 -0500"},"geo_score":0.535,"strstate":"IA","conversion":1,"type_store":"Supercenter","opendate":{"end_time":"1986/03/12 00:00:00 -0500","original":"3/11/1986 ","granularity":"day","time":"1986/03/11 00:00:00 -0500"},"id":"a61znswm491u","geo_precision":"street","storenum":886,"strcity":"Ft. Dodge"},"type":"Feature","geometry":{"type":"Point","coordinates":[-94.126925,42.446058]}},{"properties":{"st":"28","streetaddr":"805 HIGHWAY 42","zipcode":"39465","county":"035","date_super":{"end_time":"2002/05/16 00:00:00 -0400","original":"5/15/2002 ","granularity":"day","time":"2002/05/15 00:00:00 -0400"},"geo_score":0.902,"strstate":"MS","conversion":1,"type_store":"Supercenter","opendate":{"end_time":"1987/02/04 00:00:00 -0500","original":"2/3/1987 ","granularity":"day","time":"1987/02/03 00:00:00 -0500"},"id":"a61znt2ue4ne","geo_precision":"range","storenum":887,"strcity":"Petal"},"type":"Feature","geometry":{"type":"Point","coordinates":[-89.235132,31.349247]}},{"properties":{"st":"29","streetaddr":"1005 W FT SCOTT","zipcode":"64730","county":"013","date_super":null,"geo_score":0.642,"strstate":"MO","conversion":null,"type_store":"Wal-Mart","opendate":{"end_time":"1986/06/18 00:00:00 -0400","original":"6/17/1986 ","granularity":"day","time":"1986/06/17 00:00:00 -0400"},"id":"a61znsvjs5a5","geo_precision":"street","storenum":888,"strcity":"Butler"},"type":"Feature","geometry":{"type":"Point","coordinates":[-94.346123,38.25693]}},{"properties":{"st":"13","streetaddr":"15328 US 19 SOUTH","zipcode":"31757","county":"275","date_super":{"end_time":"1996/03/02 00:00:00 -0500","original":"3/1/1996 ","granularity":"day","time":"1996/03/01 00:00:00 -0500"},"geo_score":0.695,"strstate":"GA","conversion":1,"type_store":"Supercenter","opendate":{"end_time":"1986/03/12 00:00:00 -0500","original":"3/11/1986 ","granularity":"day","time":"1986/03/11 00:00:00 -0500"},"id":"a61znt196sx6","geo_precision":"street","storenum":889,"strcity":"Thomasville"},"type":"Feature","geometry":{"type":"Point","coordinates":[-83.911003,30.754288]}},{"properties":{"st":"12","streetaddr":"11250 E. COLONIAL DR","zipcode":"32817","county":"095","date_super":{"end_time":"1999/03/02 00:00:00 -0500","original":"3/1/1999 ","granularity":"day","time":"1999/03/01 00:00:00 -0500"},"geo_score":0.483,"strstate":"FL","conversion":1,"type_store":"Supercenter","opendate":{"end_time":"1986/05/21 00:00:00 -0400","original":"5/20/1986 ","granularity":"day","time":"1986/05/20 00:00:00 -0400"},"id":"a61znt6e2szl","geo_precision":"street","storenum":890,"strcity":"Orlando"},"type":"Feature","geometry":{"type":"Point","coordinates":[-81.275669,28.568367]}},{"properties":{"st":"17","streetaddr":"4115 E LINCOLN WAY","zipcode":"61081","county":"195","date_super":{"end_time":"1998/03/02 00:00:00 -0500","original":"3/1/1998 ","granularity":"day","time":"1998/03/01 00:00:00 -0500"},"geo_score":0.915,"strstate":"IL","conversion":1,"type_store":"Supercenter","opendate":{"end_time":"1987/02/04 00:00:00 -0500","original":"2/3/1987 ","granularity":"day","time":"1987/02/03 00:00:00 -0500"},"id":"a61znszatm6f","geo_precision":"range","storenum":891,"strcity":"Sterling"},"type":"Feature","geometry":{"type":"Point","coordinates":[-89.653021,41.812719]}},{"properties":{"st":"19","streetaddr":"1002 SE NATIONAL DR","zipcode":"50021","county":"153","date_super":{"end_time":"1999/03/02 00:00:00 -0500","original":"3/1/1999 ","granularity":"day","time":"1999/03/01 00:00:00 -0500"},"geo_score":0.915,"strstate":"IA","conversion":1,"type_store":"Supercenter","opendate":{"end_time":"1986/03/12 00:00:00 -0500","original":"3/11/1986 ","granularity":"day","time":"1986/03/11 00:00:00 -0500"},"id":"a61znt9mv26y","geo_precision":"range","storenum":892,"strcity":"Ankeny"},"type":"Feature","geometry":{"type":"Point","coordinates":[-93.582537,41.704854]}},{"properties":{"st":"40","streetaddr":"401 LINWOOD PLAZA","zipcode":"73052","county":"049","date_super":null,"geo_score":0.572,"strstate":"OK","conversion":null,"type_store":"Wal-Mart","opendate":{"end_time":"1986/06/04 00:00:00 -0400","original":"6/3/1986 ","granularity":"day","time":"1986/06/03 00:00:00 -0400"},"id":"a61znt3neaim","geo_precision":"street","storenum":893,"strcity":"Lindsay"},"type":"Feature","geometry":{"type":"Point","coordinates":[-97.6046,34.849973]}},{"properties":{"st":"40","streetaddr":"7777 EAST 42ND PLACE SOUTH","zipcode":"74145","county":"143","date_super":null,"geo_score":0.875,"strstate":"OK","conversion":null,"type_store":"Wal-Mart","opendate":{"end_time":"1986/08/06 00:00:00 -0400","original":"8/5/1986 ","granularity":"day","time":"1986/08/05 00:00:00 -0400"},"id":"a61znt7j454y","geo_precision":"range","storenum":894,"strcity":"Tulsa"},"type":"Feature","geometry":{"type":"Point","coordinates":[-95.890785,36.101775]}},{"properties":{"st":"29","streetaddr":"100 OZARK DR","zipcode":"65453","county":"055","date_super":null,"geo_score":0.902,"strstate":"MO","conversion":null,"type_store":"Wal-Mart","opendate":{"end_time":"1986/07/02 00:00:00 -0400","original":"7/1/1986 ","granularity":"day","time":"1986/07/01 00:00:00 -0400"},"id":"a61znt7iqm33","geo_precision":"range","storenum":895,"strcity":"Cuba"},"type":"Feature","geometry":{"type":"Point","coordinates":[-91.402688,38.07381]}},{"properties":{"st":"48","streetaddr":"2225 W INTERSTATE 20","zipcode":"75052","county":"439","date_super":{"end_time":"2001/06/21 00:00:00 -0400","original":"6/20/2001 ","granularity":"day","time":"2001/06/20 00:00:00 -0400"},"geo_score":0.581,"strstate":"TX","conversion":1,"type_store":"Supercenter","opendate":{"end_time":"1986/09/03 00:00:00 -0400","original":"9/2/1986 ","granularity":"day","time":"1986/09/02 00:00:00 -0400"},"id":"a61znsxm5s7h","geo_precision":"street","storenum":896,"strcity":"Grand Prairie"},"type":"Feature","geometry":{"type":"Point","coordinates":[-97.03667,32.675913]}},{"properties":{"st":"48","streetaddr":"1700 WEST DICKINSON","zipcode":"79735","county":"371","date_super":null,"geo_score":0.9,"strstate":"TX","conversion":null,"type_store":"Wal-Mart","opendate":{"end_time":"1986/03/06 00:00:00 -0500","original":"3/5/1986 ","granularity":"day","time":"1986/03/05 00:00:00 -0500"},"id":"a61znt4zy7wv","geo_precision":"range","storenum":897,"strcity":"Ft. Stockton"},"type":"Feature","geometry":{"type":"Point","coordinates":[-102.896744,30.893925]}},{"properties":{"st":"48","streetaddr":"1903 SOUTH CEDAR","zipcode":"79772","county":"389","date_super":null,"geo_score":0.871,"strstate":"TX","conversion":null,"type_store":"Wal-Mart","opendate":{"end_time":"1986/05/21 00:00:00 -0400","original":"5/20/1986 ","granularity":"day","time":"1986/05/20 00:00:00 -0400"},"id":"a61znt4llozy","geo_precision":"range","storenum":898,"strcity":"Pecos"},"type":"Feature","geometry":{"type":"Point","coordinates":[-103.486503,31.408993]}},{"properties":{"st":"13","streetaddr":"340 NORMAN DRIVE","zipcode":"31601","county":"185","date_super":{"end_time":"2004/08/26 00:00:00 -0400","original":"8/25/2004 ","granularity":"day","time":"2004/08/25 00:00:00 -0400"},"geo_score":0.902,"strstate":"GA","conversion":1,"type_store":"Supercenter","opendate":{"end_time":"1986/06/04 00:00:00 -0400","original":"6/3/1986 ","granularity":"day","time":"1986/06/03 00:00:00 -0400"},"id":"a61znt8kesb1","geo_precision":"range","storenum":899,"strcity":"Valdosta"},"type":"Feature","geometry":{"type":"Point","coordinates":[-83.318745,30.828561]}},{"properties":{"st":"48","streetaddr":"2211 AVENUE F NORTHWEST","zipcode":"79201","county":"075","date_super":null,"geo_score":0.728,"strstate":"TX","conversion":null,"type_store":"Wal-Mart","opendate":{"end_time":"1986/06/04 00:00:00 -0400","original":"6/3/1986 ","granularity":"day","time":"1986/06/03 00:00:00 -0400"},"id":"a61znsuzbmuc","geo_precision":"street","storenum":900,"strcity":"Childress"},"type":"Feature","geometry":{"type":"Point","coordinates":[-100.232881,34.437014]}},{"properties":{"st":"48","streetaddr":"550 SOUTH 123 BYPASS","zipcode":"78155","county":"187","date_super":{"end_time":"1995/03/02 00:00:00 -0500","original":"3/1/1995 ","granularity":"day","time":"1995/03/01 00:00:00 -0500"},"geo_score":0.53,"strstate":"TX","conversion":1,"type_store":"Supercenter","opendate":{"end_time":"1986/03/19 00:00:00 -0500","original":"3/18/1986 ","granularity":"day","time":"1986/03/18 00:00:00 -0500"},"id":"a61znt6ukvwq","geo_precision":"street","storenum":901,"strcity":"Sequin"},"type":"Feature","geometry":{"type":"Point","coordinates":[-97.949301,29.551237]}},{"properties":{"st":"18","streetaddr":"1750 E INDIANAPOLIS","zipcode":"46135","county":"133","date_super":{"end_time":"2001/05/17 00:00:00 -0400","original":"5/16/2001 ","granularity":"day","time":"2001/05/16 00:00:00 -0400"},"geo_score":0.862,"strstate":"IN","conversion":1,"type_store":"Supercenter","opendate":{"end_time":"1986/03/05 00:00:00 -0500","original":"3/4/1986 ","granularity":"day","time":"1986/03/04 00:00:00 -0500"},"id":"a61znsuhscdg","geo_precision":"range","storenum":902,"strcity":"Greencastle"},"type":"Feature","geometry":{"type":"Point","coordinates":[-86.820036,39.64618]}},{"properties":{"st":"28","streetaddr":"2711 GREENWAY DRIVE","zipcode":"39204","county":"049","date_super":{"end_time":"1998/03/02 00:00:00 -0500","original":"3/1/1998 ","granularity":"day","time":"1998/03/01 00:00:00 -0500"},"geo_score":1.0,"strstate":"MS","conversion":1,"type_store":"Supercenter","opendate":{"end_time":"1986/04/30 00:00:00 -0400","original":"4/29/1986 ","granularity":"day","time":"1986/04/29 00:00:00 -0400"},"id":"a61znt19iumi","geo_precision":"range","storenum":903,"strcity":"Jackson"},"type":"Feature","geometry":{"type":"Point","coordinates":[-90.266577,32.290755]}},{"properties":{"st":"01","streetaddr":"2200 SOUTH MCKENZIE ST","zipcode":"36535","county":"003","date_super":{"end_time":"1994/03/02 00:00:00 -0500","original":"3/1/1994 ","granularity":"day","time":"1994/03/01 00:00:00 -0500"},"geo_score":0.973,"strstate":"AL","conversion":1,"type_store":"Supercenter","opendate":{"end_time":"1986/01/22 00:00:00 -0500","original":"1/21/1986 ","granularity":"day","time":"1986/01/21 00:00:00 -0500"},"id":"a61znt5hx8tj","geo_precision":"range","storenum":904,"strcity":"Foley"},"type":"Feature","geometry":{"type":"Point","coordinates":[-87.683161,30.379647]}},{"properties":{"st":"08","streetaddr":"800 SOUTH HOVER ROAD","zipcode":"80501","county":"013","date_super":null,"geo_score":0.805,"strstate":"CO","conversion":null,"type_store":"Wal-Mart","opendate":{"end_time":"1986/06/11 00:00:00 -0400","original":"6/10/1986 ","granularity":"day","time":"1986/06/10 00:00:00 -0400"},"id":"a61znsxhotgu","geo_precision":"range","storenum":905,"strcity":"Longmont"},"type":"Feature","geometry":{"type":"Point","coordinates":[-105.130679,40.153433]}},{"properties":{"st":"35","streetaddr":"1650 WEST MALONEY AVE.","zipcode":"87301","county":"031","date_super":{"end_time":"1999/03/02 00:00:00 -0500","original":"3/1/1999 ","granularity":"day","time":"1999/03/01 00:00:00 -0500"},"geo_score":0.719,"strstate":"NM","conversion":1,"type_store":"Supercenter","opendate":{"end_time":"1986/07/16 00:00:00 -0400","original":"7/15/1986 ","granularity":"day","time":"1986/07/15 00:00:00 -0400"},"id":"a61znt6z9mka","geo_precision":"street","storenum":906,"strcity":"Gallup"},"type":"Feature","geometry":{"type":"Point","coordinates":[-108.759967,35.530271]}},{"properties":{"st":"13","streetaddr":"120 NORTH LEE STREET","zipcode":"31029","county":"207","date_super":null,"geo_score":0.902,"strstate":"GA","conversion":null,"type_store":"Wal-Mart","opendate":{"end_time":"1986/04/30 00:00:00 -0400","original":"4/29/1986 ","granularity":"day","time":"1986/04/29 00:00:00 -0400"},"id":"a61znsyirfez","geo_precision":"range","storenum":907,"strcity":"Forsyth"},"type":"Feature","geometry":{"type":"Point","coordinates":[-83.938435,33.037099]}},{"properties":{"st":"12","streetaddr":"8101 SOUTH JOHN YOUNG PARKWAY","zipcode":"32819","county":"095","date_super":{"end_time":"1999/03/02 00:00:00 -0500","original":"3/1/1999 ","granularity":"day","time":"1999/03/01 00:00:00 -0500"},"geo_score":1.0,"strstate":"FL","conversion":1,"type_store":"Supercenter","opendate":{"end_time":"1986/07/16 00:00:00 -0400","original":"7/15/1986 ","granularity":"day","time":"1986/07/15 00:00:00 -0400"},"id":"a61znt0ro2ay","geo_precision":"range","storenum":908,"strcity":"Orlando"},"type":"Feature","geometry":{"type":"Point","coordinates":[-81.427674,28.452324]}},{"properties":{"st":"22","streetaddr":"8101 W. JUDGE PEREZ DR.","zipcode":"70043","county":"087","date_super":{"end_time":"2005/06/16 00:00:00 -0400","original":"6/15/2005 ","granularity":"day","time":"2005/06/15 00:00:00 -0400"},"geo_score":0.553,"strstate":"LA","conversion":1,"type_store":"Supercenter","opendate":{"end_time":"1986/06/11 00:00:00 -0400","original":"6/10/1986 ","granularity":"day","time":"1986/06/10 00:00:00 -0400"},"id":"a61znt9ptssg","geo_precision":"street","storenum":909,"strcity":"Chalmette"},"type":"Feature","geometry":{"type":"Point","coordinates":[-89.96473,29.942926]}},{"propertie