{"type":"FeatureCollection","data_type":"Dataset","url_type":null,"permissions":[{"permissions":{"download":true,"view":true},"group_id":"everyone"}],"classification":null,"title":"Ataques de granadas vs. muertos y heridos","count":89,"stream_id":147339,"contributor":{"url":"http://geocommons.com/users/30872","name":"PaulaShan"},"data_attributes":null,"calculation_params":null,"icon_link":null,"link":"http://geocommons.com/overlays/147339.json","extent":[-111.338,16.7492,-87.3394,28.9489],"geometry_types":["point"],"unique_name":null,"name":"Ataques de granadas vs. muertos y heridos","feature_count":89,"description":"Mapa interactivo que muestra los ataques de granadas de 2005 a mayo de 2011, así como las cifras de muertos y heridos en cada ataque","next_feature":null,"is_raster":false,"short_classification":"Y","stats":{"fecha":{"max":"2011/05/31 00:00:00 -0400","mean":"2010/02/14 05:38:25 -0500","variance":1.42129380944372e+15,"stdev":37700050.5230924,"min":"2005/08/02 00:00:00 -0400","median":"2010/07/19 00:00:00 -0400"},"muertos":{"max":18,"mean":1.06741573033708,"variance":8.08631256384066,"stdev":2.84364424002734,"min":0,"median":0},"longitud":{"max":-87.33936035,"mean":-100.588161549888,"variance":15.1095136157761,"stdev":3.88709578165706,"min":-111.3375284,"median":-100.3175449},"latitud":{"max":28.94887714,"mean":23.4875538925843,"variance":9.37243525549251,"stdev":3.06144332880629,"min":16.74919044,"median":25.26532393},"heridos":{"max":101,"mean":3.8876404494382,"variance":141.350868232891,"stdev":11.8891071251331,"min":0,"median":0}},"features":[{"properties":{"fecha":{"end_time":"2005/08/03 00:00:00 -0400","original":"08/02/05","granularity":"day","time":"2005/08/02 00:00:00 -0400"},"muertos":4,"longitud":-103.248204,"latitud":20.57694571,"id":"a62kubpwh6rh","heridos":25,"pais":"Mexico","estado":"Jalisco"},"type":"Feature","geometry":{"type":"Point","coordinates":[-103.248204,20.57694571]}},{"properties":{"fecha":{"end_time":"2006/02/07 00:00:00 -0500","original":"02/06/06","granularity":"day","time":"2006/02/06 00:00:00 -0500"},"muertos":0,"longitud":-99.71271753,"latitud":27.45226759,"id":"a62kubg59t9v","heridos":0,"pais":"Mexico","estado":"Tamaulipas"},"type":"Feature","geometry":{"type":"Point","coordinates":[-99.71271753,27.45226759]}},{"properties":{"fecha":{"end_time":"2007/04/16 00:00:00 -0400","original":"04/15/07","granularity":"day","time":"2007/04/15 00:00:00 -0400"},"muertos":0,"longitud":-111.3375284,"latitud":28.88221087,"id":"a62kubk3e46n","heridos":0,"pais":"Mexico","estado":"Sonora"},"type":"Feature","geometry":{"type":"Point","coordinates":[-111.3375284,28.88221087]}},{"properties":{"fecha":{"end_time":"2007/04/18 00:00:00 -0400","original":"04/17/07","granularity":"day","time":"2007/04/17 00:00:00 -0400"},"muertos":0,"longitud":-111.3375284,"latitud":28.88221087,"id":"a62kubipo6jz","heridos":0,"pais":"Mexico","estado":"Sonora"},"type":"Feature","geometry":{"type":"Point","coordinates":[-111.3375284,28.88221087]}},{"properties":{"fecha":{"end_time":"2007/05/02 00:00:00 -0400","original":"05/01/07","granularity":"day","time":"2007/05/01 00:00:00 -0400"},"muertos":6,"longitud":-101.0508739,"latitud":18.98661689,"id":"a62kubpskgly","heridos":3,"pais":"Mexico","estado":"Michoacan"},"type":"Feature","geometry":{"type":"Point","coordinates":[-101.0508739,18.98661689]}},{"properties":{"fecha":{"end_time":"2007/05/17 00:00:00 -0400","original":"05/16/07","granularity":"day","time":"2007/05/16 00:00:00 -0400"},"muertos":0,"longitud":-111.3375284,"latitud":28.88221087,"id":"a62kubpdi0vs","heridos":0,"pais":"Mexico","estado":"Sonora"},"type":"Feature","geometry":{"type":"Point","coordinates":[-111.3375284,28.88221087]}},{"properties":{"fecha":{"end_time":"2008/09/16 00:00:00 -0400","original":"09/15/08","granularity":"day","time":"2008/09/15 00:00:00 -0400"},"muertos":8,"longitud":-101.2856551,"latitud":19.63395608,"id":"a62kubi9wot0","heridos":101,"pais":"Mexico","estado":"Michoacan"},"type":"Feature","geometry":{"type":"Point","coordinates":[-101.2856551,19.63395608]}},{"properties":{"fecha":{"end_time":"2008/10/09 00:00:00 -0400","original":"10/08/08","granularity":"day","time":"2008/10/08 00:00:00 -0400"},"muertos":5,"longitud":-101.9146369,"latitud":21.50809965,"id":"a62kubpd3m2y","heridos":3,"pais":"Mexico","estado":"Jalisco"},"type":"Feature","geometry":{"type":"Point","coordinates":[-101.9146369,21.50809965]}},{"properties":{"fecha":{"end_time":"2008/10/12 00:00:00 -0400","original":"10/11/08","granularity":"day","time":"2008/10/11 00:00:00 -0400"},"muertos":0,"longitud":-100.3175449,"latitud":25.67136019,"id":"a62kubq41hp6","heridos":0,"pais":"Mexico","estado":"Nuevo Leon"},"type":"Feature","geometry":{"type":"Point","coordinates":[-100.3175449,25.67136019]}},{"properties":{"fecha":{"end_time":"2008/10/13 00:00:00 -0400","original":"10/12/08","granularity":"day","time":"2008/10/12 00:00:00 -0400"},"muertos":0,"longitud":-103.3725994,"latitud":20.62911931,"id":"a62kubrxx97n","heridos":3,"pais":"Mexico","estado":"Jalisco"},"type":"Feature","geometry":{"type":"Point","coordinates":[-103.3725994,20.62911931]}},{"properties":{"fecha":{"end_time":"2008/10/13 00:00:00 -0400","original":"10/12/08","granularity":"day","time":"2008/10/12 00:00:00 -0400"},"muertos":0,"longitud":-103.3725994,"latitud":20.62911931,"id":"a62kubppmlse","heridos":3,"pais":"Mexico","estado":"Jalisco"},"type":"Feature","geometry":{"type":"Point","coordinates":[-103.3725994,20.62911931]}},{"properties":{"fecha":{"end_time":"2008/10/16 00:00:00 -0400","original":"10/15/08","granularity":"day","time":"2008/10/15 00:00:00 -0400"},"muertos":0,"longitud":-98.15668804,"latitud":20.8283935,"id":"a62kuboeh9bz","heridos":0,"pais":"Mexico","estado":"Federal District"},"type":"Feature","geometry":{"type":"Point","coordinates":[-98.15668804,20.8283935]}},{"properties":{"fecha":{"end_time":"2009/01/03 00:00:00 -0500","original":"01/02/09","granularity":"day","time":"2009/01/02 00:00:00 -0500"},"muertos":0,"longitud":-103.3233243,"latitud":25.26532393,"id":"a62kuboht8xc","heridos":8,"pais":"Mexico","estado":"Coahuila"},"type":"Feature","geometry":{"type":"Point","coordinates":[-103.3233243,25.26532393]}},{"properties":{"fecha":{"end_time":"2009/01/07 00:00:00 -0500","original":"01/06/09","granularity":"day","time":"2009/01/06 00:00:00 -0500"},"muertos":0,"longitud":-100.3175449,"latitud":25.67136019,"id":"a62kubpttntv","heridos":0,"pais":"Mexico","estado":"Nuevo Leon"},"type":"Feature","geometry":{"type":"Point","coordinates":[-100.3175449,25.67136019]}},{"properties":{"fecha":{"end_time":"2009/02/04 00:00:00 -0500","original":"02/03/09","granularity":"day","time":"2009/02/03 00:00:00 -0500"},"muertos":0,"longitud":-103.3233243,"latitud":25.26532393,"id":"a62kubs9m2s1","heridos":0,"pais":"Mexico","estado":"Coahuila"},"type":"Feature","geometry":{"type":"Point","coordinates":[-103.3233243,25.26532393]}},{"properties":{"fecha":{"end_time":"2009/02/13 00:00:00 -0500","original":"02/12/09","granularity":"day","time":"2009/02/12 00:00:00 -0500"},"muertos":0,"longitud":-87.33936035,"latitud":21.12887483,"id":"a62kubssw585","heridos":6,"pais":"Mexico","estado":"Michoacan"},"type":"Feature","geometry":{"type":"Point","coordinates":[-87.33936035,21.12887483]}},{"properties":{"fecha":{"end_time":"2009/02/14 00:00:00 -0500","original":"02/13/09","granularity":"day","time":"2009/02/13 00:00:00 -0500"},"muertos":0,"longitud":-87.33936035,"latitud":21.12887483,"id":"a62kubnglmbr","heridos":2,"pais":"Mexico","estado":"Michoacan"},"type":"Feature","geometry":{"type":"Point","coordinates":[-87.33936035,21.12887483]}},{"properties":{"fecha":{"end_time":"2009/02/14 00:00:00 -0500","original":"02/13/09","granularity":"day","time":"2009/02/13 00:00:00 -0500"},"muertos":0,"longitud":-87.33936035,"latitud":21.12887483,"id":"a62kubnkd410","heridos":2,"pais":"Mexico","estado":"Michoacan"},"type":"Feature","geometry":{"type":"Point","coordinates":[-87.33936035,21.12887483]}},{"properties":{"fecha":{"end_time":"2009/03/03 00:00:00 -0500","original":"03/02/09","granularity":"day","time":"2009/03/02 00:00:00 -0500"},"muertos":0,"longitud":-102.1525583,"latitud":19.40714582,"id":"a62kubnb4hv6","heridos":5,"pais":"Mexico","estado":"Michoacan"},"type":"Feature","geometry":{"type":"Point","coordinates":[-102.1525583,19.40714582]}},{"properties":{"fecha":{"end_time":"2009/03/16 00:00:00 -0400","original":"03/15/09","granularity":"day","time":"2009/03/15 00:00:00 -0400"},"muertos":0,"longitud":-100.3175449,"latitud":25.67136019,"id":"a62kubpyjs86","heridos":3,"pais":"Mexico","estado":"Nuevo Leon"},"type":"Feature","geometry":{"type":"Point","coordinates":[-100.3175449,25.67136019]}},{"properties":{"fecha":{"end_time":"2009/04/01 00:00:00 -0400","original":"03/31/09","granularity":"day","time":"2009/03/31 00:00:00 -0400"},"muertos":0,"longitud":-97.88084425,"latitud":22.24915809,"id":"a62kubhj8dn2","heridos":0,"pais":"Mexico","estado":"Tamaulipas"},"type":"Feature","geometry":{"type":"Point","coordinates":[-97.88084425,22.24915809]}},{"properties":{"fecha":{"end_time":"2009/06/07 00:00:00 -0400","original":"06/06/09","granularity":"day","time":"2009/06/06 00:00:00 -0400"},"muertos":18,"longitud":-99.72334549,"latitud":16.96585583,"id":"a62kubhwfwed","heridos":6,"pais":"Mexico","estado":"Guerrero"},"type":"Feature","geometry":{"type":"Point","coordinates":[-99.72334549,16.96585583]}},{"properties":{"fecha":{"end_time":"2009/06/10 00:00:00 -0400","original":"06/09/09","granularity":"day","time":"2009/06/09 00:00:00 -0400"},"muertos":6,"longitud":-104.8667935,"latitud":23.92595982,"id":"a62kubimznla","heridos":3,"pais":"Mexico","estado":"Durango"},"type":"Feature","geometry":{"type":"Point","coordinates":[-104.8667935,23.92595982]}},{"properties":{"fecha":{"end_time":"2009/06/12 00:00:00 -0400","original":"06/11/09","granularity":"day","time":"2009/06/11 00:00:00 -0400"},"muertos":2,"longitud":-102.1525583,"latitud":19.40714582,"id":"a62kubs0btvz","heridos":4,"pais":"Mexico","estado":"Michoacan"},"type":"Feature","geometry":{"type":"Point","coordinates":[-102.1525583,19.40714582]}},{"properties":{"fecha":{"end_time":"2009/10/21 00:00:00 -0400","original":"10/20/09","granularity":"day","time":"2009/10/20 00:00:00 -0400"},"muertos":3,"longitud":-98.37045489,"latitud":25.82570711,"id":"a62kubvv7pou","heridos":0,"pais":"Mexico","estado":"Tamaulipas"},"type":"Feature","geometry":{"type":"Point","coordinates":[-98.37045489,25.82570711]}},{"properties":{"fecha":{"end_time":"2009/10/29 00:00:00 -0400","original":"10/28/09","granularity":"day","time":"2009/10/28 00:00:00 -0400"},"muertos":0,"longitud":-106.2423893,"latitud":28.94887714,"id":"a62kubp7282v","heridos":0,"pais":"Mexico","estado":"Chihuahua"},"type":"Feature","geometry":{"type":"Point","coordinates":[-106.2423893,28.94887714]}},{"properties":{"fecha":{"end_time":"2009/12/14 00:00:00 -0500","original":"12/13/09","granularity":"day","time":"2009/12/13 00:00:00 -0500"},"muertos":0,"longitud":-104.8667935,"latitud":23.92595982,"id":"a62kubjrlgq4","heridos":3,"pais":"Mexico","estado":"Durango"},"type":"Feature","geometry":{"type":"Point","coordinates":[-104.8667935,23.92595982]}},{"properties":{"fecha":{"end_time":"2009/12/14 00:00:00 -0500","original":"12/13/09","granularity":"day","time":"2009/12/13 00:00:00 -0500"},"muertos":0,"longitud":-104.8667935,"latitud":23.92595982,"id":"a62kubo9y8qe","heridos":0,"pais":"Mexico","estado":"Durango"},"type":"Feature","geometry":{"type":"Point","coordinates":[-104.8667935,23.92595982]}},{"properties":{"fecha":{"end_time":"2009/12/15 00:00:00 -0500","original":"12/14/09","granularity":"day","time":"2009/12/14 00:00:00 -0500"},"muertos":0,"longitud":-101.2856551,"latitud":19.63395608,"id":"a62kubw8g0ym","heridos":0,"pais":"Mexico","estado":"Michoacan"},"type":"Feature","geometry":{"type":"Point","coordinates":[-101.2856551,19.63395608]}},{"properties":{"fecha":{"end_time":"2010/01/21 00:00:00 -0500","original":"01/20/10","granularity":"day","time":"2010/01/20 00:00:00 -0500"},"muertos":1,"longitud":-102.1525583,"latitud":19.40714582,"id":"a62kubvwvt59","heridos":1,"pais":"Mexico","estado":"Michoacan"},"type":"Feature","geometry":{"type":"Point","coordinates":[-102.1525583,19.40714582]}},{"properties":{"fecha":{"end_time":"2010/01/28 00:00:00 -0500","original":"01/27/10","granularity":"day","time":"2010/01/27 00:00:00 -0500"},"muertos":0,"longitud":-100.3175449,"latitud":25.67136019,"id":"a62kubnj4e8k","heridos":0,"pais":"Mexico","estado":"Nuevo Leon"},"type":"Feature","geometry":{"type":"Point","coordinates":[-100.3175449,25.67136019]}},{"properties":{"fecha":{"end_time":"2010/01/29 00:00:00 -0500","original":"01/28/10","granularity":"day","time":"2010/01/28 00:00:00 -0500"},"muertos":3,"longitud":-97.88084425,"latitud":22.24915809,"id":"a62kubtqdeza","heridos":0,"pais":"Mexico","estado":"Tamaulipas"},"type":"Feature","geometry":{"type":"Point","coordinates":[-97.88084425,22.24915809]}},{"properties":{"fecha":{"end_time":"2010/02/07 00:00:00 -0500","original":"02/06/10","granularity":"day","time":"2010/02/06 00:00:00 -0500"},"muertos":0,"longitud":-100.3175449,"latitud":25.67136019,"id":"a62kubv7eubw","heridos":0,"pais":"Mexico","estado":"Nuevo Leon"},"type":"Feature","geometry":{"type":"Point","coordinates":[-100.3175449,25.67136019]}},{"properties":{"fecha":{"end_time":"2010/02/28 00:00:00 -0500","original":"02/27/10","granularity":"day","time":"2010/02/27 00:00:00 -0500"},"muertos":0,"longitud":-100.3175449,"latitud":25.67136019,"id":"a62kubw02h1v","heridos":0,"pais":"Mexico","estado":"Nuevo Leon"},"type":"Feature","geometry":{"type":"Point","coordinates":[-100.3175449,25.67136019]}},{"properties":{"fecha":{"end_time":"2010/02/28 00:00:00 -0500","original":"02/27/10","granularity":"day","time":"2010/02/27 00:00:00 -0500"},"muertos":0,"longitud":-100.3175449,"latitud":25.67136019,"id":"a62kubhoyfu2","heridos":0,"pais":"Mexico","estado":"Nuevo Leon"},"type":"Feature","geometry":{"type":"Point","coordinates":[-100.3175449,25.67136019]}},{"properties":{"fecha":{"end_time":"2010/02/28 00:00:00 -0500","original":"02/27/10","granularity":"day","time":"2010/02/27 00:00:00 -0500"},"muertos":0,"longitud":-100.3175449,"latitud":25.67136019,"id":"a62kubgfh1vq","heridos":0,"pais":"Mexico","estado":"Nuevo Leon"},"type":"Feature","geometry":{"type":"Point","coordinates":[-100.3175449,25.67136019]}},{"properties":{"fecha":{"end_time":"2010/03/13 00:00:00 -0500","original":"03/12/10","granularity":"day","time":"2010/03/12 00:00:00 -0500"},"muertos":0,"longitud":-101.208844,"latitud":25.03295814,"id":"a62kubmep9uf","heridos":1,"pais":"Mexico","estado":"Coahuila"},"type":"Feature","geometry":{"type":"Point","coordinates":[-101.208844,25.03295814]}},{"properties":{"fecha":{"end_time":"2010/03/14 00:00:00 -0500","original":"03/13/10","granularity":"day","time":"2010/03/13 00:00:00 -0500"},"muertos":1,"longitud":-93.12942292,"latitud":16.74919044,"id":"a62kubm44i9t","heridos":0,"pais":"Mexico","estado":"Chiapas"},"type":"Feature","geometry":{"type":"Point","coordinates":[-93.12942292,16.74919044]}},{"properties":{"fecha":{"end_time":"2010/03/14 00:00:00 -0500","original":"03/13/10","granularity":"day","time":"2010/03/13 00:00:00 -0500"},"muertos":0,"longitud":-93.12942292,"latitud":16.74919044,"id":"a62kubnj3qtl","heridos":0,"pais":"Mexico","estado":"Chiapas"},"type":"Feature","geometry":{"type":"Point","coordinates":[-93.12942292,16.74919044]}},{"properties":{"fecha":{"end_time":"2010/04/25 00:00:00 -0400","original":"04/24/10","granularity":"day","time":"2010/04/24 00:00:00 -0400"},"muertos":4,"longitud":-101.2856551,"latitud":19.63395608,"id":"a62kubkx9w5m","heridos":10,"pais":"Mexico","estado":"Michoacan"},"type":"Feature","geometry":{"type":"Point","coordinates":[-101.2856551,19.63395608]}},{"properties":{"fecha":{"end_time":"2010/04/25 00:00:00 -0400","original":"04/24/10","granularity":"day","time":"2010/04/24 00:00:00 -0400"},"muertos":0,"longitud":-101.2856551,"latitud":19.63395608,"id":"a62kubrsqzon","heridos":0,"pais":"Mexico","estado":"Michoacan"},"type":"Feature","geometry":{"type":"Point","coordinates":[-101.2856551,19.63395608]}},{"properties":{"fecha":{"end_time":"2010/06/06 00:00:00 -0400","original":"06/05/10","granularity":"day","time":"2010/06/05 00:00:00 -0400"},"muertos":0,"longitud":-104.8667935,"latitud":23.92595982,"id":"a62kubsuqado","heridos":6,"pais":"Mexico","estado":"Durango"},"type":"Feature","geometry":{"type":"Point","coordinates":[-104.8667935,23.92595982]}},{"properties":{"fecha":{"end_time":"2010/07/16 00:00:00 -0400","original":"07/15/10","granularity":"day","time":"2010/07/15 00:00:00 -0400"},"muertos":0,"longitud":-100.1107828,"latitud":25.61532187,"id":"a62kubw4w2mk","heridos":7,"pais":"Mexico","estado":"Chihuahua"},"type":"Feature","geometry":{"type":"Point","coordinates":[-100.1107828,25.61532187]}},{"properties":{"fecha":{"end_time":"2010/07/20 00:00:00 -0400","original":"07/19/10","granularity":"day","time":"2010/07/19 00:00:00 -0400"},"muertos":0,"longitud":-99.23276866,"latitud":18.89434691,"id":"a62kubtuuxsw","heridos":0,"pais":"Mexico","estado":"Morelos"},"type":"Feature","geometry":{"type":"Point","coordinates":[-99.23276866,18.89434691]}},{"properties":{"fecha":{"end_time":"2010/07/20 00:00:00 -0400","original":"07/19/10","granularity":"day","time":"2010/07/19 00:00:00 -0400"},"muertos":0,"longitud":-99.23276866,"latitud":18.89434691,"id":"a62kubt86dax","heridos":0,"pais":"Mexico","estado":"Morelos"},"type":"Feature","geometry":{"type":"Point","coordinates":[-99.23276866,18.89434691]}},{"properties":{"fecha":{"end_time":"2010/08/15 00:00:00 -0400","original":"08/14/10","granularity":"day","time":"2010/08/14 00:00:00 -0400"},"muertos":0,"longitud":-97.53930036,"latitud":25.52184416,"id":"a62kubvh1rpi","heridos":0,"pais":"Mexico","estado":"Tamaulipas"},"type":"Feature","geometry":{"type":"Point","coordinates":[-97.53930036,25.52184416]}},{"properties":{"fecha":{"end_time":"2010/08/16 00:00:00 -0400","original":"08/15/10","granularity":"day","time":"2010/08/15 00:00:00 -0400"},"muertos":0,"longitud":-100.3175449,"latitud":25.67136019,"id":"a62kubtpx30v","heridos":0,"pais":"Mexico","estado":"Nuevo Leon"},"type":"Feature","geometry":{"type":"Point","coordinates":[-100.3175449,25.67136019]}},{"properties":{"fecha":{"end_time":"2010/09/24 00:00:00 -0400","original":"09/23/10","granularity":"day","time":"2010/09/23 00:00:00 -0400"},"muertos":1,"longitud":-99.72334549,"latitud":16.96585583,"id":"a62kubvx8s7v","heridos":0,"pais":"Mexico","estado":"Guerrero"},"type":"Feature","geometry":{"type":"Point","coordinates":[-99.72334549,16.96585583]}},{"properties":{"fecha":{"end_time":"2010/09/30 00:00:00 -0400","original":"09/29/10","granularity":"day","time":"2010/09/29 00:00:00 -0400"},"muertos":0,"longitud":-97.53930036,"latitud":25.52184416,"id":"a62kubj2riol","heridos":2,"pais":"Mexico","estado":"Tamaulipas"},"type":"Feature","geometry":{"type":"Point","coordinates":[-97.53930036,25.52184416]}},{"properties":{"fecha":{"end_time":"2010/10/02 00:00:00 -0400","original":"10/01/10","granularity":"day","time":"2010/10/01 00:00:00 -0400"},"muertos":0,"longitud":-100.3175449,"latitud":25.67136019,"id":"a62kubga70lm","heridos":1,"pais":"Mexico","estado":"Nuevo Leon"},"type":"Feature","geometry":{"type":"Point","coordinates":[-100.3175449,25.67136019]}},{"properties":{"fecha":{"end_time":"2010/10/02 00:00:00 -0400","original":"10/01/10","granularity":"day","time":"2010/10/01 00:00:00 -0400"},"muertos":0,"longitud":-100.3175449,"latitud":25.67136019,"id":"a62kubo52t8v","heridos":0,"pais":"Mexico","estado":"Nuevo Leon"},"type":"Feature","geometry":{"type":"Point","coordinates":[-100.3175449,25.67136019]}},{"properties":{"fecha":{"end_time":"2010/10/02 00:00:00 -0400","original":"10/01/10","granularity":"day","time":"2010/10/01 00:00:00 -0400"},"muertos":0,"longitud":-100.3175449,"latitud":25.67136019,"id":"a62kubgrhtz3","heridos":0,"pais":"Mexico","estado":"Nuevo Leon"},"type":"Feature","geometry":{"type":"Point","coordinates":[-100.3175449,25.67136019]}},{"properties":{"fecha":{"end_time":"2010/10/03 00:00:00 -0400","original":"10/02/10","granularity":"day","time":"2010/10/02 00:00:00 -0400"},"muertos":0,"longitud":-100.3175449,"latitud":25.67136019,"id":"a62kubsgrbe3","heridos":14,"pais":"Mexico","estado":"Nuevo Leon"},"type":"Feature","geometry":{"type":"Point","coordinates":[-100.3175449,25.67136019]}},{"properties":{"fecha":{"end_time":"2010/10/04 00:00:00 -0400","original":"10/03/10","granularity":"day","time":"2010/10/03 00:00:00 -0400"},"muertos":2,"longitud":-102.4288851,"latitud":18.938308,"id":"a62kubt7wlsx","heridos":15,"pais":"Mexico","estado":"Michoacan"},"type":"Feature","geometry":{"type":"Point","coordinates":[-102.4288851,18.938308]}},{"properties":{"fecha":{"end_time":"2010/10/15 00:00:00 -0400","original":"10/14/10","granularity":"day","time":"2010/10/14 00:00:00 -0400"},"muertos":3,"longitud":-100.3175449,"latitud":25.67136019,"id":"a62kubvp1itm","heridos":2,"pais":"Mexico","estado":"Nuevo Leon"},"type":"Feature","geometry":{"type":"Point","coordinates":[-100.3175449,25.67136019]}},{"properties":{"fecha":{"end_time":"2010/10/21 00:00:00 -0400","original":"10/20/10","granularity":"day","time":"2010/10/20 00:00:00 -0400"},"muertos":0,"longitud":-97.53930036,"latitud":25.52184416,"id":"a62kublj6udd","heridos":6,"pais":"Mexico","estado":"Tamaulipas"},"type":"Feature","geometry":{"type":"Point","coordinates":[-97.53930036,25.52184416]}},{"properties":{"fecha":{"end_time":"2010/10/28 00:00:00 -0400","original":"10/27/10","granularity":"day","time":"2010/10/27 00:00:00 -0400"},"muertos":0,"longitud":-97.80958863,"latitud":22.25978605,"id":"a62kublrhe78","heridos":6,"pais":"Mexico","estado":"Tamaulipas"},"type":"Feature","geometry":{"type":"Point","coordinates":[-97.80958863,22.25978605]}},{"properties":{"fecha":{"end_time":"2010/10/29 00:00:00 -0400","original":"10/28/10","granularity":"day","time":"2010/10/28 00:00:00 -0400"},"muertos":0,"longitud":-103.5032749,"latitud":20.7300849,"id":"a62kubisa8pd","heridos":5,"pais":"Mexico","estado":"Jalisco"},"type":"Feature","geometry":{"type":"Point","coordinates":[-103.5032749,20.7300849]}},{"properties":{"fecha":{"end_time":"2010/11/05 00:00:00 -0400","original":"11/04/10","granularity":"day","time":"2010/11/04 00:00:00 -0400"},"muertos":0,"longitud":-100.3175449,"latitud":25.67136019,"id":"a62kubkhwdyh","heridos":0,"pais":"Mexico","estado":"Nuevo Leon"},"type":"Feature","geometry":{"type":"Point","coordinates":[-100.3175449,25.67136019]}},{"properties":{"fecha":{"end_time":"2010/11/06 00:00:00 -0400","original":"11/05/10","granularity":"day","time":"2010/11/05 00:00:00 -0400"},"muertos":10,"longitud":-97.53930036,"latitud":25.52184416,"id":"a62kubqi0gmx","heridos":0,"pais":"Mexico","estado":"Tamaulipas"},"type":"Feature","geometry":{"type":"Point","coordinates":[-97.53930036,25.52184416]}},{"properties":{"fecha":{"end_time":"2010/11/08 00:00:00 -0500","original":"11/07/10","granularity":"day","time":"2010/11/07 00:00:00 -0400"},"muertos":0,"longitud":-100.3175449,"latitud":25.67136019,"id":"a62kubj3g2ic","heridos":2,"pais":"Mexico","estado":"Nuevo Leon"},"type":"Feature","geometry":{"type":"Point","coordinates":[-100.3175449,25.67136019]}},{"properties":{"fecha":{"end_time":"2010/11/08 00:00:00 -0500","original":"11/07/10","granularity":"day","time":"2010/11/07 00:00:00 -0400"},"muertos":0,"longitud":-100.3175449,"latitud":25.67136019,"id":"a62kubuigc81","heridos":2,"pais":"Mexico","estado":"Nuevo Leon"},"type":"Feature","geometry":{"type":"Point","coordinates":[-100.3175449,25.67136019]}},{"properties":{"fecha":{"end_time":"2010/11/08 00:00:00 -0500","original":"11/07/10","granularity":"day","time":"2010/11/07 00:00:00 -0400"},"muertos":0,"longitud":-97.53930036,"latitud":25.52184416,"id":"a62kubh1y3pm","heridos":1,"pais":"Mexico","estado":"Nuevo Leon"},"type":"Feature","geometry":{"type":"Point","coordinates":[-97.53930036,25.52184416]}},{"properties":{"fecha":{"end_time":"2010/11/15 00:00:00 -0500","original":"11/14/10","granularity":"day","time":"2010/11/14 00:00:00 -0500"},"muertos":0,"longitud":-104.8609964,"latitud":21.58491079,"id":"a62kubo24y3y","heridos":0,"pais":"Mexico","estado":"Nayarit"},"type":"Feature","geometry":{"type":"Point","coordinates":[-104.8609964,21.58491079]}},{"properties":{"fecha":{"end_time":"2010/12/11 00:00:00 -0500","original":"12/10/10","granularity":"day","time":"2010/12/10 00:00:00 -0500"},"muertos":11,"longitud":-104.0230787,"latitud":20.24095734,"id":"a62kubqhcpke","heridos":22,"pais":"Mexico","estado":"Jalisco"},"type":"Feature","geometry":{"type":"Point","coordinates":[-104.0230787,20.24095734]}},{"properties":{"fecha":{"end_time":"2010/12/23 00:00:00 -0500","original":"12/22/10","granularity":"day","time":"2010/12/22 00:00:00 -0500"},"muertos":0,"longitud":-99.18421822,"latitud":23.64673441,"id":"a62kubqsfbq1","heridos":2,"pais":"Mexico","estado":"Tamaulipas"},"type":"Feature","geometry":{"type":"Point","coordinates":[-99.18421822,23.64673441]}},{"properties":{"fecha":{"end_time":"2010/12/30 00:00:00 -0500","original":"12/29/10","granularity":"day","time":"2010/12/29 00:00:00 -0500"},"muertos":0,"longitud":-100.3175449,"latitud":25.67136019,"id":"a62kubpykksf","heridos":0,"pais":"Mexico","estado":"Nuevo Leon"},"type":"Feature","geometry":{"type":"Point","coordinates":[-100.3175449,25.67136019]}},{"properties":{"fecha":{"end_time":"2011/01/03 00:00:00 -0500","original":"01/02/11","granularity":"day","time":"2011/01/02 00:00:00 -0500"},"muertos":0,"longitud":-100.3175449,"latitud":25.67136019,"id":"a62kubgfza2s","heridos":0,"pais":"Mexico","estado":"Nuevo Leon"},"type":"Feature","geometry":{"type":"Point","coordinates":[-100.3175449,25.67136019]}},{"properties":{"fecha":{"end_time":"2011/01/07 00:00:00 -0500","original":"01/06/11","granularity":"day","time":"2011/01/06 00:00:00 -0500"},"muertos":0,"longitud":-100.3175449,"latitud":25.67136019,"id":"a62kubtk0crz","heridos":0,"pais":"Mexico","estado":"Nuevo Leon"},"type":"Feature","geometry":{"type":"Point","coordinates":[-100.3175449,25.67136019]}},{"properties":{"fecha":{"end_time":"2011/01/27 00:00:00 -0500","original":"01/26/11","granularity":"day","time":"2011/01/26 00:00:00 -0500"},"muertos":0,"longitud":-99.71271753,"latitud":27.45226759,"id":"a62kubgcvzh9","heridos":0,"pais":"Mexico","estado":"Tamaulipas"},"type":"Feature","geometry":{"type":"Point","coordinates":[-99.71271753,27.45226759]}},{"properties":{"fecha":{"end_time":"2011/01/28 00:00:00 -0500","original":"01/27/11","granularity":"day","time":"2011/01/27 00:00:00 -0500"},"muertos":0,"longitud":-100.3175449,"latitud":25.67136019,"id":"a62kubiijls9","heridos":2,"pais":"Mexico","estado":"Nuevo Leon"},"type":"Feature","geometry":{"type":"Point","coordinates":[-100.3175449,25.67136019]}},{"properties":{"fecha":{"end_time":"2011/02/01 00:00:00 -0500","original":"01/31/11","granularity":"day","time":"2011/01/31 00:00:00 -0500"},"muertos":0,"longitud":-100.3175449,"latitud":25.67136019,"id":"a62kublz2921","heridos":5,"pais":"Mexico","estado":"Nuevo Leon"},"type":"Feature","geometry":{"type":"Point","coordinates":[-100.3175449,25.67136019]}},{"properties":{"fecha":{"end_time":"2011/02/01 00:00:00 -0500","original":"01/31/11","granularity":"day","time":"2011/01/31 00:00:00 -0500"},"muertos":0,"longitud":-100.3175449,"latitud":25.67136019,"id":"a62kubua4qmt","heridos":0,"pais":"Mexico","estado":"Nuevo Leon"},"type":"Feature","geometry":{"type":"Point","coordinates":[-100.3175449,25.67136019]}},{"properties":{"fecha":{"end_time":"2011/02/02 00:00:00 -0500","original":"02/01/11","granularity":"day","time":"2011/02/01 00:00:00 -0500"},"muertos":0,"longitud":-103.3725994,"latitud":20.62911931,"id":"a62kubt62kcu","heridos":0,"pais":"Mexico","estado":"Jalisco"},"type":"Feature","geometry":{"type":"Point","coordinates":[-103.3725994,20.62911931]}},{"properties":{"fecha":{"end_time":"2011/02/02 00:00:00 -0500","original":"02/01/11","granularity":"day","time":"2011/02/01 00:00:00 -0500"},"muertos":0,"longitud":-103.248204,"latitud":20.57694571,"id":"a62kubqhe2qr","heridos":0,"pais":"Mexico","estado":"Jalisco"},"type":"Feature","geometry":{"type":"Point","coordinates":[-103.248204,20.57694571]}},{"properties":{"fecha":{"end_time":"2011/02/08 00:00:00 -0500","original":"02/07/11","granularity":"day","time":"2011/02/07 00:00:00 -0500"},"muertos":0,"longitud":-100.3175449,"latitud":25.67136019,"id":"a62kuboj6zyh","heridos":0,"pais":"Mexico","estado":"Nuevo Leon"},"type":"Feature","geometry":{"type":"Point","coordinates":[-100.3175449,25.67136019]}},{"properties":{"fecha":{"end_time":"2011/02/13 00:00:00 -0500","original":"02/12/11","granularity":"day","time":"2011/02/12 00:00:00 -0500"},"muertos":6,"longitud":-103.5032749,"latitud":20.7300849,"id":"a62kubmxssbi","heridos":37,"pais":"Mexico","estado":"Jalisco"},"type":"Feature","geometry":{"type":"Point","coordinates":[-103.5032749,20.7300849]}},{"properties":{"fecha":{"end_time":"2011/02/15 00:00:00 -0500","original":"02/14/11","granularity":"day","time":"2011/02/14 00:00:00 -0500"},"muertos":0,"longitud":-97.53930036,"latitud":25.52184416,"id":"a62kubk2vrf6","heridos":9,"pais":"Mexico","estado":"Tamaulipas"},"type":"Feature","geometry":{"type":"Point","coordinates":[-97.53930036,25.52184416]}},{"properties":{"fecha":{"end_time":"2011/03/05 00:00:00 -0500","original":"03/04/11","granularity":"day","time":"2011/03/04 00:00:00 -0500"},"muertos":1,"longitud":-100.1107828,"latitud":25.61532187,"id":"a62kubuhftxn","heridos":1,"pais":"Mexico","estado":"Chihuahua"},"type":"Feature","geometry":{"type":"Point","coordinates":[-100.1107828,25.61532187]}},{"properties":{"fecha":{"end_time":"2011/03/05 00:00:00 -0500","original":"03/04/11","granularity":"day","time":"2011/03/04 00:00:00 -0500"},"muertos":0,"longitud":-101.208844,"latitud":25.03295814,"id":"a62kubmb0hl2","heridos":0,"pais":"Mexico","estado":"Coahuila"},"type":"Feature","geometry":{"type":"Point","coordinates":[-101.208844,25.03295814]}},{"properties":{"fecha":{"end_time":"2011/03/10 00:00:00 -0500","original":"03/09/11","granularity":"day","time":"2011/03/09 00:00:00 -0500"},"muertos":0,"longitud":-100.3175449,"latitud":25.67136019,"id":"a62kublxad39","heridos":0,"pais":"Mexico","estado":"Nuevo Leon"},"type":"Feature","geometry":{"type":"Point","coordinates":[-100.3175449,25.67136019]}},{"properties":{"fecha":{"end_time":"2011/03/23 00:00:00 -0400","original":"03/22/11","granularity":"day","time":"2011/03/22 00:00:00 -0400"},"muertos":0,"longitud":-99.18421822,"latitud":23.64673441,"id":"a62kubvgbt4h","heridos":0,"pais":"Mexico","estado":"Tamaulipas"},"type":"Feature","geometry":{"type":"Point","coordinates":[-99.18421822,23.64673441]}},{"properties":{"fecha":{"end_time":"2011/04/02 00:00:00 -0400","original":"04/01/11","granularity":"day","time":"2011/04/01 00:00:00 -0400"},"muertos":0,"longitud":-100.3175449,"latitud":25.67136019,"id":"a62kubqfyyj1","heridos":0,"pais":"Mexico","estado":"Nuevo Leon"},"type":"Feature","geometry":{"type":"Point","coordinates":[-100.3175449,25.67136019]}},{"properties":{"fecha":{"end_time":"2011/04/04 00:00:00 -0400","original":"04/03/11","granularity":"day","time":"2011/04/03 00:00:00 -0400"},"muertos":0,"longitud":-103.1085913,"latitud":20.58056887,"id":"a62kubs17qj0","heridos":0,"pais":"Mexico","estado":"Jalisco"},"type":"Feature","geometry":{"type":"Point","coordinates":[-103.1085913,20.58056887]}},{"properties":{"fecha":{"end_time":"2011/04/05 00:00:00 -0400","original":"04/04/11","granularity":"day","time":"2011/04/04 00:00:00 -0400"},"muertos":0,"longitud":-100.3175449,"latitud":25.67136019,"id":"a62kubmwuuwh","heridos":1,"pais":"Mexico","estado":"Nuevo Leon"},"type":"Feature","geometry":{"type":"Point","coordinates":[-100.3175449,25.67136019]}},{"properties":{"fecha":{"end_time":"2011/04/13 00:00:00 -0400","original":"04/12/11","granularity":"day","time":"2011/04/12 00:00:00 -0400"},"muertos":0,"longitud":-103.5032749,"latitud":20.7300849,"id":"a62kubnx6nth","heridos":1,"pais":"Mexico","estado":"Jalisco"},"type":"Feature","geometry":{"type":"Point","coordinates":[-103.5032749,20.7300849]}},{"properties":{"fecha":{"end_time":"2011/04/25 00:00:00 -0400","original":"04/24/11","granularity":"day","time":"2011/04/24 00:00:00 -0400"},"muertos":0,"longitud":-97.80958863,"latitud":22.25978605,"id":"a62kubkyfw95","heridos":4,"pais":"Mexico","estado":"Tamaulipas"},"type":"Feature","geometry":{"type":"Point","coordinates":[-97.80958863,22.25978605]}},{"properties":{"fecha":{"end_time":"2011/05/31 00:00:00 -0400","original":"05/30/11","granularity":"day","time":"2011/05/30 00:00:00 -0400"},"muertos":0,"longitud":-101.208844,"latitud":25.03295814,"id":"a62kubvjvt2a","heridos":0,"pais":"Mexico","estado":"Coahuila"},"type":"Feature","geometry":{"type":"Point","coordinates":[-101.208844,25.03295814]}},{"properties":{"fecha":{"end_time":"2011/06/01 00:00:00 -0400","original":"05/31/11","granularity":"day","time":"2011/05/31 00:00:00 -0400"},"muertos":0,"longitud":-100.3175449,"latitud":25.67136019,"id":"a62kubs6u3xf","heridos":1,"pais":"Mexico","estado":"Nuevo Leon"},"type":"Feature","geometry":{"type":"Point","coordinates":[-100.3175449,25.67136019]}}],"is_temporal":true,"author":{"url":"","metadata":"","contact_name":"Fundación Mepi","contact_address":"fundacionmepi.org\r\n\r\nfmepi.blogspot.com\r\n\r\nSíguenos en Twitter: @fmepi","source":"","contact_phone":""},"source":"","pagination":{"sort":null,"start":0,"total":89,"limit":1000000},"state":"complete","tags":"crimen,explosión,granadas,heridos,méxico,muertos,organizado","published":"2014-08-13T09:16:01-04:00","id":147339}