{"type":"FeatureCollection","data_type":"Dataset","url_type":null,"permissions":[{"permissions":{"download":true,"view":true},"group_id":"everyone"}],"classification":null,"title":"september 1-28","count":256,"stream_id":161695,"contributor":{"url":"http://geocommons.com/users/33607","name":"Mission Local Crime"},"data_attributes":null,"calculation_params":null,"icon_link":null,"link":"http://geocommons.com/overlays/161695.json","extent":[-160.243,21.8378,7.19205,64.8369],"geometry_types":["point"],"unique_name":null,"name":"september 1-28","feature_count":256,"description":"","next_feature":null,"is_raster":false,"short_classification":"Y","stats":{"latitude":{"max":64.836899,"mean":38.5930910765625,"variance":23.6160071241309,"stdev":4.85963034850707,"min":21.837811,"median":37.7602375},"time":{"max":"2030/01/12 00:00:00 -0500","mean":"2030/01/01 13:00:30 -0500","variance":3870590315.29412,"stdev":62214.0684676233,"min":"2030/01/01 00:01:00 -0500","median":"2030/01/01 12:00:00 -0500"},"date":{"max":"2011/09/28 00:00:00 -0400","mean":"2011/09/15 15:22:30 -0400","variance":476145520941.176,"stdev":690032.985400826,"min":"2011/09/01 00:00:00 -0400","median":"2011/09/17 00:00:00 -0400"},"longitude":{"max":7.19205,"mean":-116.958851400781,"variance":253.06546151726,"stdev":15.9080313526615,"min":-160.243027,"median":-122.4184567}},"features":[{"properties":{"latitude":37.7571691,"time":{"end_time":"2030/01/01 09:00:00 -0500","original":"8:00 a.m.","granularity":"hour","time":"2030/01/01 08:00:00 -0500"},"date":{"end_time":"2011/09/02 00:00:00 -0400","original":"9/1/11","granularity":"day","time":"2011/09/01 00:00:00 -0400"},"description":"Stolen Auto","longitude":-122.4167288,"crime type":"Auto Theft","id":"a6o8ttscn85p","address":"21st Street and South Van Ness, San Francisco, CA"},"type":"Feature","geometry":{"type":"Point","coordinates":[-122.4167288,37.7571691]}},{"properties":{"latitude":37.752601,"time":{"end_time":"2030/01/01 07:06:00 -0500","original":"7:05 a.m.","granularity":"min","time":"2030/01/01 07:05:00 -0500"},"date":{"end_time":"2011/09/02 00:00:00 -0400","original":"9/1/11","granularity":"day","time":"2011/09/01 00:00:00 -0400"},"description":"Battery","longitude":-122.412464,"crime type":"Battery","id":"a6o8tu2hytwe","address":"24th Street and Balmy, San Francisco, CA"},"type":"Feature","geometry":{"type":"Point","coordinates":[-122.412464,37.752601]}},{"properties":{"latitude":37.7593748,"time":{"end_time":"2030/01/01 21:00:00 -0500","original":"8:00 p.m.","granularity":"hour","time":"2030/01/01 20:00:00 -0500"},"date":{"end_time":"2011/09/02 00:00:00 -0400","original":"9/1/11","granularity":"day","time":"2011/09/01 00:00:00 -0400"},"description":"Burglary","longitude":-122.4068748,"crime type":"Burglary - Home","id":"a6o8ttpu0n75","address":"20th Street and Potrero, San Francisco, CA"},"type":"Feature","geometry":{"type":"Point","coordinates":[-122.4068748,37.7593748]}},{"properties":{"latitude":37.755576,"time":{"end_time":"2030/01/01 00:21:00 -0500","original":"12:20 a.m.","granularity":"min","time":"2030/01/01 00:20:00 -0500"},"date":{"end_time":"2011/09/02 00:00:00 -0400","original":"9/1/11","granularity":"day","time":"2011/09/01 00:00:00 -0400"},"description":"Theft of unattended cell phone","longitude":-122.4165773,"crime type":"Theft","id":"a6o8ttt3wh5q","address":"22nd Street and South Van Ness, San Francisco, CA"},"type":"Feature","geometry":{"type":"Point","coordinates":[-122.4165773,37.755576]}},{"properties":{"latitude":37.7602375,"time":{"end_time":"2030/01/01 03:00:00 -0500","original":"2:00 a.m.","granularity":"hour","time":"2030/01/01 02:00:00 -0500"},"date":{"end_time":"2011/09/02 00:00:00 -0400","original":"9/1/11","granularity":"day","time":"2011/09/01 00:00:00 -0400"},"description":"Theft of unattended purse in bar","longitude":-122.4192191,"crime type":"Theft","id":"a6o8ttvcpjz9","address":"19th Stret and Mission, San Francisco, CA"},"type":"Feature","geometry":{"type":"Point","coordinates":[-122.4192191,37.7602375]}},{"properties":{"latitude":37.760601,"time":{"end_time":"2030/01/01 11:00:00 -0500","original":"10:00 a.m.","granularity":"hour","time":"2030/01/01 10:00:00 -0500"},"date":{"end_time":"2011/09/03 00:00:00 -0400","original":"9/2/11","granularity":"day","time":"2011/09/02 00:00:00 -0400"},"description":"Stolen Auto","longitude":-122.408064,"crime type":"Auto Theft","id":"a6o8ttzh0atd","address":"19th Street and Hampshire, San Francisco, CA"},"type":"Feature","geometry":{"type":"Point","coordinates":[-122.408064,37.760601]}},{"properties":{"latitude":37.7525047,"time":{"end_time":"2030/01/01 13:43:00 -0500","original":"1:42 p.m.","granularity":"min","time":"2030/01/01 13:42:00 -0500"},"date":{"end_time":"2011/09/03 00:00:00 -0400","original":"9/2/11","granularity":"day","time":"2011/09/02 00:00:00 -0400"},"description":"Criminal threats, battery","longitude":-122.414068,"crime type":"Battery","id":"a6o8tu2ue0rz","address":"24th Street and Folsom, San Francisco, CA"},"type":"Feature","geometry":{"type":"Point","coordinates":[-122.414068,37.7525047]}},{"properties":{"latitude":37.7571691,"time":{"end_time":"2030/01/01 21:00:00 -0500","original":"8:00 p.m.","granularity":"hour","time":"2030/01/01 20:00:00 -0500"},"date":{"end_time":"2011/09/03 00:00:00 -0400","original":"9/2/11","granularity":"day","time":"2011/09/02 00:00:00 -0400"},"description":"Bicycle theft","longitude":-122.4167288,"crime type":"Bicycle Theft","id":"a6o8ttngjdog","address":"21st Street and South Van Ness, San Francisco, CA"},"type":"Feature","geometry":{"type":"Point","coordinates":[-122.4167288,37.7571691]}},{"properties":{"latitude":37.761423,"time":{"end_time":"2030/01/01 07:46:00 -0500","original":"7:45 a.m.","granularity":"min","time":"2030/01/01 07:45:00 -0500"},"date":{"end_time":"2011/09/03 00:00:00 -0400","original":"9/2/11","granularity":"day","time":"2011/09/02 00:00:00 -0400"},"description":"Burglary, garage","longitude":-122.4260224,"crime type":"Burglary - Home","id":"a6o8tu121k6d","address":"18th Street and Dolores, San Francisco, CA"},"type":"Feature","geometry":{"type":"Point","coordinates":[-122.4260224,37.761423]}},{"properties":{"latitude":37.7518942,"time":{"end_time":"2030/01/01 11:21:00 -0500","original":"11:20 a.m.","granularity":"min","time":"2030/01/01 11:20:00 -0500"},"date":{"end_time":"2011/09/03 00:00:00 -0400","original":"9/2/11","granularity":"day","time":"2011/09/02 00:00:00 -0400"},"description":"Burglary","longitude":-122.4033961,"crime type":"Burglary - Home","id":"a6o8ttzfqkph","address":"25th Street and Vermont, San Francisco, CA"},"type":"Feature","geometry":{"type":"Point","coordinates":[-122.4033961,37.7518942]}},{"properties":{"latitude":37.7633,"time":{"end_time":"2030/01/01 08:00:00 -0500","original":"7:00 a.m.","granularity":"hour","time":"2030/01/01 07:00:00 -0500"},"date":{"end_time":"2011/09/03 00:00:00 -0400","original":"9/2/11","granularity":"day","time":"2011/09/02 00:00:00 -0400"},"description":"Auto burglary","longitude":-122.421732,"crime type":"Burglary - Vehicle","id":"a6o8ttydro8b","address":"17th Street and Valencia, San Francisco, CA"},"type":"Feature","geometry":{"type":"Point","coordinates":[-122.421732,37.7633]}},{"properties":{"latitude":37.7545752,"time":{"end_time":"2030/01/01 04:00:00 -0500","original":"3:00 a.m.","granularity":"hour","time":"2030/01/01 03:00:00 -0500"},"date":{"end_time":"2011/09/03 00:00:00 -0400","original":"9/2/11","granularity":"day","time":"2011/09/02 00:00:00 -0400"},"description":"Domestic violence","longitude":-122.4064317,"crime type":"Domestic Violence","id":"a6o8ttrl32jd","address":"23rd Street and Potrero, San Francisco, CA"},"type":"Feature","geometry":{"type":"Point","coordinates":[-122.4064317,37.7545752]}},{"properties":{"latitude":37.74806,"time":{"end_time":"2030/01/01 13:00:00 -0500","original":"12:00 p.m.","granularity":"hour","time":"2030/01/01 12:00:00 -0500"},"date":{"end_time":"2011/09/03 00:00:00 -0400","original":"9/2/11","granularity":"day","time":"2011/09/02 00:00:00 -0400"},"description":"Criminal threats","longitude":-122.4202659,"crime type":"Unknown","id":"a6o8ttxwqj5f","address":"Valencia Street and Cesar Chavez, San Francisco, CA"},"type":"Feature","geometry":{"type":"Point","coordinates":[-122.4202659,37.74806]}},{"properties":{"latitude":37.7491151,"time":{"end_time":"2030/01/01 00:57:00 -0500","original":"12:56 a.m.","granularity":"min","time":"2030/01/01 00:56:00 -0500"},"date":{"end_time":"2011/09/04 00:00:00 -0400","original":"9/3/11","granularity":"day","time":"2011/09/03 00:00:00 -0400"},"description":"Aggravated assault, knife","longitude":-122.4170407,"crime type":"Aggravated Assault","id":"a6o8ttv34rz7","address":"26th Street and Capp, San Francisco, CA"},"type":"Feature","geometry":{"type":"Point","coordinates":[-122.4170407,37.7491151]}},{"properties":{"latitude":37.7570986,"time":{"end_time":"2030/01/01 23:00:00 -0500","original":"10:00 p.m.","granularity":"hour","time":"2030/01/01 22:00:00 -0500"},"date":{"end_time":"2011/09/05 00:00:00 -0400","original":"9/4/11","granularity":"day","time":"2011/09/04 00:00:00 -0400"},"description":"Stolen Auto","longitude":-122.4178225,"crime type":"Auto Theft","id":"a6o8tu1zokv9","address":"21st Street and Capp, San Francisco, CA"},"type":"Feature","geometry":{"type":"Point","coordinates":[-122.4178225,37.7570986]}},{"properties":{"latitude":37.7649169,"time":{"end_time":"2030/01/01 00:36:00 -0500","original":"12:35 a.m.","granularity":"min","time":"2030/01/01 00:35:00 -0500"},"date":{"end_time":"2011/09/05 00:00:00 -0400","original":"9/4/11","granularity":"day","time":"2011/09/04 00:00:00 -0400"},"description":"Battery","longitude":-122.421886,"crime type":"Battery","id":"a6o8ttrnvd3m","address":"16th Street and Valencia, San Francisco, CA"},"type":"Feature","geometry":{"type":"Point","coordinates":[-122.421886,37.7649169]}},{"properties":{"latitude":37.7602375,"time":{"end_time":"2030/01/01 03:00:00 -0500","original":"2:00 a.m.","granularity":"hour","time":"2030/01/01 02:00:00 -0500"},"date":{"end_time":"2011/09/05 00:00:00 -0400","original":"9/4/11","granularity":"day","time":"2011/09/04 00:00:00 -0400"},"description":"Burglary, Hotel Room","longitude":-122.4192191,"crime type":"Burglary - Home","id":"a6o8ttso7acj","address":"19th Street and Mission, San Francisco, CA"},"type":"Feature","geometry":{"type":"Point","coordinates":[-122.4192191,37.7602375]}},{"properties":{"latitude":37.7634959,"time":{"end_time":"2030/01/01 23:21:00 -0500","original":"11:20 p.m.","granularity":"min","time":"2030/01/01 23:20:00 -0500"},"date":{"end_time":"2011/09/05 00:00:00 -0400","original":"9/4/11","granularity":"day","time":"2011/09/04 00:00:00 -0400"},"description":"Burglary, apartment","longitude":-122.418484,"crime type":"Burglary - Home","id":"a6o8ttyscnpw","address":"17th Street and Capp, San Francisco, CA"},"type":"Feature","geometry":{"type":"Point","coordinates":[-122.418484,37.7634959]}},{"properties":{"latitude":37.7558329,"time":{"end_time":"2030/01/01 13:00:00 -0500","original":"12:00 p.m.","granularity":"hour","time":"2030/01/01 12:00:00 -0500"},"date":{"end_time":"2011/09/05 00:00:00 -0400","original":"9/4/11","granularity":"day","time":"2011/09/04 00:00:00 -0400"},"description":"Auto burglary","longitude":-122.412198,"crime type":"Burglary - Vehicle","id":"a6o8tts2nyz6","address":"22nd Street and Harrison, San Francisco, CA"},"type":"Feature","geometry":{"type":"Point","coordinates":[-122.412198,37.7558329]}},{"properties":{"latitude":37.768298,"time":{"end_time":"2030/01/01 08:00:00 -0500","original":"7:00 a.m.","granularity":"hour","time":"2030/01/01 07:00:00 -0500"},"date":{"end_time":"2011/09/05 00:00:00 -0400","original":"9/4/11","granularity":"day","time":"2011/09/04 00:00:00 -0400"},"description":"Stolen Motorcycle","longitude":-122.408744,"crime type":"Motorcycle Theft","id":"a6o8ttrk1aot","address":"Alameda and Hampshire, San Francisco, CA"},"type":"Feature","geometry":{"type":"Point","coordinates":[-122.408744,37.768298]}},{"properties":{"latitude":37.7540389,"time":{"end_time":"2030/01/01 09:00:00 -0500","original":"8:00 a.m.","granularity":"hour","time":"2030/01/01 08:00:00 -0500"},"date":{"end_time":"2011/09/05 00:00:00 -0400","original":"9/4/11","granularity":"day","time":"2011/09/04 00:00:00 -0400"},"description":"Stolen Motorcycle","longitude":-122.41532,"crime type":"Motorcycle Theft","id":"a6o8ttsjn71y","address":"23rd Street and Shotwell, San Francisco, CA"},"type":"Feature","geometry":{"type":"Point","coordinates":[-122.41532,37.7540389]}},{"properties":{"latitude":37.7649169,"time":{"end_time":"2030/01/01 11:31:00 -0500","original":"11:30 a.m.","granularity":"min","time":"2030/01/01 11:30:00 -0500"},"date":{"end_time":"2011/09/05 00:00:00 -0400","original":"9/4/11","granularity":"day","time":"2011/09/04 00:00:00 -0400"},"description":"Theft of wallet from unattended purse in bar","longitude":-122.421886,"crime type":"Theft","id":"a6o8ttzkl2h1","address":"16th Street and Valencia, San Francisco, CA"},"type":"Feature","geometry":{"type":"Point","coordinates":[-122.421886,37.7649169]}},{"properties":{"latitude":37.769953,"time":{"end_time":"2030/01/01 16:46:00 -0500","original":"4:45 p.m.","granularity":"min","time":"2030/01/01 16:45:00 -0500"},"date":{"end_time":"2011/09/05 00:00:00 -0400","original":"9/4/11","granularity":"day","time":"2011/09/04 00:00:00 -0400"},"description":"Theft from building","longitude":-122.420947,"crime type":"Theft","id":"a6o8ttrjcs0f","address":"Duboce and Woodward, San Francisco, CA"},"type":"Feature","geometry":{"type":"Point","coordinates":[-122.420947,37.769953]}},{"properties":{"latitude":37.7593094,"time":{"end_time":"2030/01/01 03:00:00 -0500","original":"2:00 a.m.","granularity":"hour","time":"2030/01/01 02:00:00 -0500"},"date":{"end_time":"2011/09/05 00:00:00 -0400","original":"9/4/11","granularity":"day","time":"2011/09/04 00:00:00 -0400"},"description":"Malicious Mischief, graffiti","longitude":-122.40794,"crime type":"Vandalism","id":"a6o8ttzuol09","address":"20th Street and Hampshire, San Francisco, CA"},"type":"Feature","geometry":{"type":"Point","coordinates":[-122.40794,37.7593094]}},{"properties":{"latitude":37.7586337,"time":{"end_time":"2030/01/01 00:57:00 -0500","original":"12:56 a.m.","granularity":"min","time":"2030/01/01 00:56:00 -0500"},"date":{"end_time":"2011/09/06 00:00:00 -0400","original":"9/5/11","granularity":"day","time":"2011/09/05 00:00:00 -0400"},"description":"Aggragated assault","longitude":-122.4190627,"crime type":"Aggravated Assault","id":"a6o8ttqym7i1","address":"20th Street and Mission, San Francisco, CA"},"type":"Feature","geometry":{"type":"Point","coordinates":[-122.4190627,37.7586337]}},{"properties":{"latitude":37.7598227,"time":{"end_time":"2030/01/01 07:16:00 -0500","original":"7:15 a.m.","granularity":"min","time":"2030/01/01 07:15:00 -0500"},"date":{"end_time":"2011/09/06 00:00:00 -0400","original":"9/5/11","granularity":"day","time":"2011/09/05 00:00:00 -0400"},"description":"Stolen Auto","longitude":-122.4260048,"crime type":"Auto Theft","id":"a6o8ttp9hhye","address":"19th Street and Dolores, San Francisco, CA"},"type":"Feature","geometry":{"type":"Point","coordinates":[-122.4260048,37.7598227]}},{"properties":{"latitude":37.7634959,"time":{"end_time":"2030/01/01 10:00:00 -0500","original":"9:00 a.m.","granularity":"hour","time":"2030/01/01 09:00:00 -0500"},"date":{"end_time":"2011/09/06 00:00:00 -0400","original":"9/5/11","granularity":"day","time":"2011/09/05 00:00:00 -0400"},"description":"Stolen truck","longitude":-122.418484,"crime type":"Auto Theft","id":"a6o8tu0mbogb","address":"17th Street and Capp, San Francisco, CA"},"type":"Feature","geometry":{"type":"Point","coordinates":[-122.418484,37.7634959]}},{"properties":{"latitude":37.7586337,"time":{"end_time":"2030/01/01 07:51:00 -0500","original":"7:50 a.m.","granularity":"min","time":"2030/01/01 07:50:00 -0500"},"date":{"end_time":"2011/09/06 00:00:00 -0400","original":"9/5/11","granularity":"day","time":"2011/09/05 00:00:00 -0400"},"description":"Bicycle theft","longitude":-122.4190627,"crime type":"Bicycle Theft","id":"a6o8ttuacdyj","address":"20th Street and Mission, San Francisco, CA"},"type":"Feature","geometry":{"type":"Point","coordinates":[-122.4190627,37.7586337]}},{"properties":{"latitude":37.7601889,"time":{"end_time":"2030/01/01 11:11:00 -0500","original":"11:10 a.m.","granularity":"min","time":"2030/01/01 11:10:00 -0500"},"date":{"end_time":"2011/09/06 00:00:00 -0400","original":"9/5/11","granularity":"day","time":"2011/09/05 00:00:00 -0400"},"description":"Auto burglary","longitude":-122.419975,"crime type":"Burglary - Vehicle","id":"a6o8ttncjp0i","address":"19th Street and San Carlos, San Francisco, CA"},"type":"Feature","geometry":{"type":"Point","coordinates":[-122.419975,37.7601889]}},{"properties":{"latitude":37.75423,"time":{"end_time":"2030/01/01 23:16:00 -0500","original":"11:15 p.m.","granularity":"min","time":"2030/01/01 23:15:00 -0500"},"date":{"end_time":"2011/09/06 00:00:00 -0400","original":"9/5/11","granularity":"day","time":"2011/09/05 00:00:00 -0400"},"description":"Auto burglary","longitude":-122.412047,"crime type":"Burglary - Vehicle","id":"a6o8ttx5cxsb","address":"23rd Street and Harrison, San Francisco, CA"},"type":"Feature","geometry":{"type":"Point","coordinates":[-122.412047,37.75423]}},{"properties":{"latitude":37.7694819,"time":{"end_time":"2030/01/01 18:45:00 -0500","original":"6:44 p.m.","granularity":"min","time":"2030/01/01 18:44:00 -0500"},"date":{"end_time":"2011/09/06 00:00:00 -0400","original":"9/5/11","granularity":"day","time":"2011/09/05 00:00:00 -0400"},"description":"Auto burglary","longitude":-122.4133685,"crime type":"Burglary - Vehicle","id":"a6o8ttyylqw7","address":"13th Street and Harrison, San Francisco, CA"},"type":"Feature","geometry":{"type":"Point","coordinates":[-122.4133685,37.7694819]}},{"properties":{"latitude":37.7586337,"time":{"end_time":"2030/01/01 02:20:00 -0500","original":"2:19 a.m.","granularity":"min","time":"2030/01/01 02:19:00 -0500"},"date":{"end_time":"2011/09/06 00:00:00 -0400","original":"9/5/11","granularity":"day","time":"2011/09/05 00:00:00 -0400"},"description":"Homicide, gun","longitude":-122.4190627,"crime type":"Homicide","id":"a6o8tu12yhe6","address":"20th Street and Mission, San Francisco, CA"},"type":"Feature","geometry":{"type":"Point","coordinates":[-122.4190627,37.7586337]}},{"properties":{"latitude":37.7522494,"time":{"end_time":"2030/01/01 19:10:00 -0500","original":"7:09 p.m.","granularity":"min","time":"2030/01/01 19:09:00 -0500"},"date":{"end_time":"2011/09/06 00:00:00 -0400","original":"9/5/11","granularity":"day","time":"2011/09/05 00:00:00 -0400"},"description":"Attempted grand theft, con","longitude":-122.4184567,"crime type":"Theft","id":"a6o8ttxn6olr","address":"24th Street and Mission, San Francisco, CA"},"type":"Feature","geometry":{"type":"Point","coordinates":[-122.4184567,37.7522494]}},{"properties":{"latitude":37.7545752,"time":{"end_time":"2030/01/01 04:56:00 -0500","original":"4:55 a.m.","granularity":"min","time":"2030/01/01 04:55:00 -0500"},"date":{"end_time":"2011/09/06 00:00:00 -0400","original":"9/5/11","granularity":"day","time":"2011/09/05 00:00:00 -0400"},"description":"Malicious mischief, windows","longitude":-122.4064317,"crime type":"Vandalism","id":"a6o8ttnph55s","address":"23rd Street and Potrero, San Francisco, CA"},"type":"Feature","geometry":{"type":"Point","coordinates":[-122.4064317,37.7545752]}},{"properties":{"latitude":37.7633,"time":{"end_time":"2030/01/01 10:51:00 -0500","original":"10:50 a.m.","granularity":"min","time":"2030/01/01 10:50:00 -0500"},"date":{"end_time":"2011/09/06 00:00:00 -0400","original":"9/5/11","granularity":"day","time":"2011/09/05 00:00:00 -0400"},"description":"Malicious mischief","longitude":-122.421732,"crime type":"Vandalism","id":"a6o8tttqi0oo","address":"17th Street and Valencia, San Francisco, CA"},"type":"Feature","geometry":{"type":"Point","coordinates":[-122.421732,37.7633]}},{"properties":{"latitude":37.7521823,"time":{"end_time":"2030/01/01 06:46:00 -0500","original":"6:45 a.m.","granularity":"min","time":"2030/01/01 06:45:00 -0500"},"date":{"end_time":"2011/09/07 00:00:00 -0400","original":"9/6/11","granularity":"day","time":"2011/09/06 00:00:00 -0400"},"description":"Stolen Auto","longitude":-122.419546,"crime type":"Auto Theft","id":"a6o8ttwrkdy7","address":"24th Street and Bartlett, San Francisco, CA"},"type":"Feature","geometry":{"type":"Point","coordinates":[-122.419546,37.7521823]}},{"properties":{"latitude":37.7543749,"time":{"end_time":"2030/01/01 07:00:00 -0500","original":"6:00 a.m.","granularity":"hour","time":"2030/01/01 06:00:00 -0500"},"date":{"end_time":"2011/09/07 00:00:00 -0400","original":"9/6/11","granularity":"day","time":"2011/09/06 00:00:00 -0400"},"description":"Bicycle theft from garage","longitude":-122.423062,"crime type":"Bicycle Theft","id":"a6o8ttx4g9il","address":"Alvarado Street and Guerrero, San Francisco, CA"},"type":"Feature","geometry":{"type":"Point","coordinates":[-122.423062,37.7543749]}},{"properties":{"latitude":37.7682031,"time":{"end_time":"2030/01/01 07:00:00 -0500","original":"6:00 a.m.","granularity":"hour","time":"2030/01/01 06:00:00 -0500"},"date":{"end_time":"2011/09/07 00:00:00 -0400","original":"9/6/11","granularity":"day","time":"2011/09/06 00:00:00 -0400"},"description":"Auto Burglary","longitude":-122.4213719,"crime type":"Burglary - Vehicle","id":"a6o8tu2bzmr8","address":"14th Street and Stevenson, San Francisco, CA"},"type":"Feature","geometry":{"type":"Point","coordinates":[-122.4213719,37.7682031]}},{"properties":{"latitude":37.7664112,"time":{"end_time":"2030/01/01 22:00:00 -0500","original":"9:00 p.m.","granularity":"hour","time":"2030/01/01 21:00:00 -0500"},"date":{"end_time":"2011/09/07 00:00:00 -0400","original":"9/6/11","granularity":"day","time":"2011/09/06 00:00:00 -0400"},"description":"Auto burglary","longitude":-122.4243098,"crime type":"Burglary - Vehicle","id":"a6o8ttsv2yj5","address":"15th Street and Guerrero, San Francisco, CA"},"type":"Feature","geometry":{"type":"Point","coordinates":[-122.4243098,37.7664112]}},{"properties":{"latitude":37.7668709,"time":{"end_time":"2030/01/01 10:07:00 -0500","original":"10:06 a.m.","granularity":"min","time":"2030/01/01 10:06:00 -0500"},"date":{"end_time":"2011/09/07 00:00:00 -0400","original":"9/6/11","granularity":"day","time":"2011/09/06 00:00:00 -0400"},"description":"Civil sidewalks written warning","longitude":-122.4165614,"crime type":"Civil Sidewalks","id":"a6o8ttyvvf3v","address":"15th Street and Shotwell, San Francisco, CA"},"type":"Feature","geometry":{"type":"Point","coordinates":[-122.4165614,37.7668709]}},{"properties":{"latitude":37.7668709,"time":{"end_time":"2030/01/01 10:07:00 -0500","original":"10:06 a.m.","granularity":"min","time":"2030/01/01 10:06:00 -0500"},"date":{"end_time":"2011/09/07 00:00:00 -0400","original":"9/6/11","granularity":"day","time":"2011/09/06 00:00:00 -0400"},"description":"Civil sidewalks written warning","longitude":-122.4165614,"crime type":"Civil Sidewalks","id":"a6o8ttu5ourn","address":"15th Street and Shotwell, San Francisco, CA"},"type":"Feature","geometry":{"type":"Point","coordinates":[-122.4165614,37.7668709]}},{"properties":{"latitude":37.7602375,"time":{"end_time":"2030/01/01 02:26:00 -0500","original":"2:25 a.m.","granularity":"min","time":"2030/01/01 02:25:00 -0500"},"date":{"end_time":"2011/09/07 00:00:00 -0400","original":"9/6/11","granularity":"day","time":"2011/09/06 00:00:00 -0400"},"description":"Robbery, force","longitude":-122.4192191,"crime type":"Robbery","id":"a6o8ttpnzl9c","address":"19th Street and Mission, San Francisco, CA"},"type":"Feature","geometry":{"type":"Point","coordinates":[-122.4192191,37.7602375]}},{"properties":{"latitude":37.7685494,"time":{"end_time":"2030/01/01 08:10:00 -0500","original":"8:09 a.m.","granularity":"min","time":"2030/01/01 08:09:00 -0500"},"date":{"end_time":"2011/09/07 00:00:00 -0400","original":"9/6/11","granularity":"day","time":"2011/09/06 00:00:00 -0400"},"description":"Petty theft, shoplifting","longitude":-122.4156202,"crime type":"Theft","id":"a6o8ttzsdlqq","address":"14th Street and Folsom, San Francisco, CA"},"type":"Feature","geometry":{"type":"Point","coordinates":[-122.4156202,37.7685494]}},{"properties":{"latitude":37.7553071,"time":{"end_time":"2030/01/01 23:11:00 -0500","original":"11:10 p.m.","granularity":"min","time":"2030/01/01 23:10:00 -0500"},"date":{"end_time":"2011/09/07 00:00:00 -0400","original":"9/6/11","granularity":"day","time":"2011/09/06 00:00:00 -0400"},"description":"Trespassing","longitude":-122.4209695,"crime type":"Unknown","id":"a6o8tu1zqnwu","address":"22nd Street and Valencia, San Francisco, CA"},"type":"Feature","geometry":{"type":"Point","coordinates":[-122.4209695,37.7553071]}},{"properties":{"latitude":37.7620332,"time":{"end_time":"2030/01/01 23:46:00 -0500","original":"11:45 p.m.","granularity":"min","time":"2030/01/01 23:45:00 -0500"},"date":{"end_time":"2011/09/07 00:00:00 -0400","original":"9/6/11","granularity":"day","time":"2011/09/06 00:00:00 -0400"},"description":"Suspicious acts toward female","longitude":-122.4161017,"crime type":"Unknown","id":"a6o8ttvn5nca","address":"18th Street and Shotwell, San Francisco, CA"},"type":"Feature","geometry":{"type":"Point","coordinates":[-122.4161017,37.7620332]}},{"properties":{"latitude":37.7693666,"time":{"end_time":"2030/01/01 09:00:00 -0500","original":"8:00 a.m.","granularity":"hour","time":"2030/01/01 08:00:00 -0500"},"date":{"end_time":"2011/09/07 00:00:00 -0400","original":"9/6/11","granularity":"day","time":"2011/09/06 00:00:00 -0400"},"description":"Malicious mischief, vehicle","longitude":-122.4156119,"crime type":"Vandalism","id":"a6o8ttsjyevw","address":"Erie Street and Folsom, San Francisco, CA"},"type":"Feature","geometry":{"type":"Point","coordinates":[-122.4156119,37.7693666]}},{"properties":{"latitude":37.760148,"time":{"end_time":"2030/01/01 00:50:00 -0500","original":"12:49 a.m.","granularity":"min","time":"2030/01/01 00:49:00 -0500"},"date":{"end_time":"2011/09/08 00:00:00 -0400","original":"9/7/11","granularity":"day","time":"2011/09/07 00:00:00 -0400"},"description":"Aggragated assault","longitude":-122.42066,"crime type":"Aggravated Assault","id":"a6o8ttv9o4kj","address":"19th Street and Lexington, San Francisco, CA"},"type":"Feature","geometry":{"type":"Point","coordinates":[-122.42066,37.760148]}},{"properties":{"latitude":37.7522494,"time":{"end_time":"2030/01/01 11:51:00 -0500","original":"11:50 a.m.","granularity":"min","time":"2030/01/01 11:50:00 -0500"},"date":{"end_time":"2011/09/08 00:00:00 -0400","original":"9/7/11","granularity":"day","time":"2011/09/07 00:00:00 -0400"},"description":"Aggravated assault, gun","longitude":-122.4184567,"crime type":"Aggravated Assault","id":"a6o8tu1ik1hy","address":"24th Street and Mission, San Francisco, CA"},"type":"Feature","geometry":{"type":"Point","coordinates":[-122.4184567,37.7522494]}},{"properties":{"latitude":37.7556351,"time":{"end_time":"2030/01/01 22:56:00 -0500","original":"10:55 p.m.","granularity":"min","time":"2030/01/01 22:55:00 -0500"},"date":{"end_time":"2011/09/08 00:00:00 -0400","original":"9/7/11","granularity":"day","time":"2011/09/07 00:00:00 -0400"},"description":"Battery","longitude":-122.4154823,"crime type":"Battery","id":"a6o8ttt2ke9d","address":"22nd Street and Shotwell, San Francisco, CA"},"type":"Feature","geometry":{"type":"Point","coordinates":[-122.4154823,37.7556351]}},{"properties":{"latitude":37.7506796,"time":{"end_time":"2030/01/01 20:00:00 -0500","original":"7:00 p.m.","granularity":"hour","time":"2030/01/01 19:00:00 -0500"},"date":{"end_time":"2011/09/08 00:00:00 -0400","original":"9/7/11","granularity":"day","time":"2011/09/07 00:00:00 -0400"},"description":"Burglary, apartment","longitude":-122.4177341,"crime type":"Burglary - Home","id":"a6o8ttw3wkdy","address":"25th Street and Lilac, San Francisco, CA"},"type":"Feature","geometry":{"type":"Point","coordinates":[-122.4177341,37.7506796]}},{"properties":{"latitude":37.7749295,"time":{"end_time":"2030/01/01 11:46:00 -0500","original":"11:45 a.m.","granularity":"min","time":"2030/01/01 11:45:00 -0500"},"date":{"end_time":"2011/09/08 00:00:00 -0400","original":"9/7/11","granularity":"day","time":"2011/09/07 00:00:00 -0400"},"description":"Auto burglary","longitude":-122.4194155,"crime type":"Burglary - Vehicle","id":"a6o8ttu0ofye","address":"Alabama Street and Harrison, San Francisco, CA"},"type":"Feature","geometry":{"type":"Point","coordinates":[-122.4194155,37.7749295]}},{"properties":{"latitude":37.7647864,"time":{"end_time":"2030/01/01 06:41:00 -0500","original":"6:40 a.m.","granularity":"min","time":"2030/01/01 06:40:00 -0500"},"date":{"end_time":"2011/09/08 00:00:00 -0400","original":"9/7/11","granularity":"day","time":"2011/09/07 00:00:00 -0400"},"description":"Theft of unattended purse","longitude":-122.4240587,"crime type":"Theft","id":"a6o8tu2daxct","address":"16th Street and Guerrero, San Francisco, CA"},"type":"Feature","geometry":{"type":"Point","coordinates":[-122.4240587,37.7647864]}},{"properties":{"latitude":37.7518503,"time":{"end_time":"2030/01/01 11:06:00 -0500","original":"11:05 a.m.","granularity":"min","time":"2030/01/01 11:05:00 -0500"},"date":{"end_time":"2011/09/08 00:00:00 -0400","original":"9/7/11","granularity":"day","time":"2011/09/07 00:00:00 -0400"},"description":"Theft of ring from faculty bathroom","longitude":-122.4042472,"crime type":"Theft","id":"a6o8ttnthge9","address":"25th Street and San Bruno, San Francisco, CA"},"type":"Feature","geometry":{"type":"Point","coordinates":[-122.4042472,37.7518503]}},{"properties":{"latitude":37.7634362,"time":{"end_time":"2030/01/01 16:06:00 -0500","original":"4:05 p.m.","granularity":"min","time":"2030/01/01 16:05:00 -0500"},"date":{"end_time":"2011/09/08 00:00:00 -0400","original":"9/7/11","granularity":"day","time":"2011/09/07 00:00:00 -0400"},"description":"Theft from unlocked vehicle","longitude":-122.4195226,"crime type":"Theft","id":"a6o8ttva1ox3","address":"17th Street and Mission, San Francisco, CA"},"type":"Feature","geometry":{"type":"Point","coordinates":[-122.4195226,37.7634362]}},{"properties":{"latitude":37.7649169,"time":{"end_time":"2030/01/01 23:57:00 -0500","original":"11:56 p.m.","granularity":"min","time":"2030/01/01 23:56:00 -0500"},"date":{"end_time":"2011/09/09 00:00:00 -0400","original":"9/8/11","granularity":"day","time":"2011/09/08 00:00:00 -0400"},"description":"Aggragated assault","longitude":-122.421886,"crime type":"Aggravated Assault","id":"a6o8ttvfkx9t","address":"16th Street and Valencia, San Francisco, CA"},"type":"Feature","geometry":{"type":"Point","coordinates":[-122.421886,37.7649169]}},{"properties":{"latitude":37.7618996,"time":{"end_time":"2030/01/01 18:32:00 -0500","original":"6:31 p.m.","granularity":"min","time":"2030/01/01 18:31:00 -0500"},"date":{"end_time":"2011/09/09 00:00:00 -0400","original":"9/8/11","granularity":"day","time":"2011/09/08 00:00:00 -0400"},"description":"Bicycle theft","longitude":-122.4182904,"crime type":"Bicycle Theft","id":"a6o8tu3p6s4i","address":"18th Street and Capp, San Francisco, CA"},"type":"Feature","geometry":{"type":"Point","coordinates":[-122.4182904,37.7618996]}},{"properties":{"latitude":37.7602375,"time":{"end_time":"2030/01/01 12:16:00 -0500","original":"12:15 p.m.","granularity":"min","time":"2030/01/01 12:15:00 -0500"},"date":{"end_time":"2011/09/09 00:00:00 -0400","original":"9/8/11","granularity":"day","time":"2011/09/08 00:00:00 -0400"},"description":"Auto burglary","longitude":-122.4192191,"crime type":"Burglary - Vehicle","id":"a6o8ttonsn6f","address":"19th Street and Mission, San Francisco, CA"},"type":"Feature","geometry":{"type":"Point","coordinates":[-122.4192191,37.7602375]}},{"properties":{"latitude":37.7558329,"time":{"end_time":"2030/01/01 03:11:00 -0500","original":"3:10 a.m.","granularity":"min","time":"2030/01/01 03:10:00 -0500"},"date":{"end_time":"2011/09/09 00:00:00 -0400","original":"9/8/11","granularity":"day","time":"2011/09/08 00:00:00 -0400"},"description":"Disturbing the peace, fighting","longitude":-122.412198,"crime type":"Disturbing the Peace","id":"a6o8tu16nu6l","address":"22nd Street and Harrison, San Francisco, CA"},"type":"Feature","geometry":{"type":"Point","coordinates":[-122.412198,37.7558329]}},{"properties":{"latitude":37.7529917,"time":{"end_time":"2030/01/01 19:59:00 -0500","original":"7:58 p.m.","granularity":"min","time":"2030/01/01 19:58:00 -0500"},"date":{"end_time":"2011/09/09 00:00:00 -0400","original":"9/8/11","granularity":"day","time":"2011/09/08 00:00:00 -0400"},"description":"Possession of counterfeit","longitude":-122.4062731,"crime type":"Fraud","id":"a6o8tu2d81uh","address":"24th Street and Potrero, San Francisco, CA"},"type":"Feature","geometry":{"type":"Point","coordinates":[-122.4062731,37.7529917]}},{"properties":{"latitude":37.7602375,"time":{"end_time":"2030/01/01 13:00:00 -0500","original":"12:00","granularity":"hour","time":"2030/01/01 12:00:00 -0500"},"date":{"end_time":"2011/09/09 00:00:00 -0400","original":"9/8/11","granularity":"day","time":"2011/09/08 00:00:00 -0400"},"description":"Theft from hotel room","longitude":-122.4192191,"crime type":"Theft","id":"a6o8tu2nc6kq","address":"19th Street and Mission, San Francisco, CA"},"type":"Feature","geometry":{"type":"Point","coordinates":[-122.4192191,37.7602375]}},{"properties":{"latitude":37.760101,"time":{"end_time":"2030/01/01 02:00:00 -0500","original":"1:00 a.m.","granularity":"hour","time":"2030/01/01 01:00:00 -0500"},"date":{"end_time":"2011/09/09 00:00:00 -0400","original":"9/8/11","granularity":"day","time":"2011/09/08 00:00:00 -0400"},"description":"Phone stolen from unattended coat (in bar)","longitude":-122.421425,"crime type":"Theft","id":"a6o8ttx0g3br","address":"19th Street and Valencia, San Francisco, CA"},"type":"Feature","geometry":{"type":"Point","coordinates":[-122.421425,37.760101]}},{"properties":{"latitude":37.754337,"time":{"end_time":"2030/01/01 19:00:00 -0500","original":"6:00 p.m.","granularity":"hour","time":"2030/01/01 18:00:00 -0500"},"date":{"end_time":"2011/09/09 00:00:00 -0400","original":"9/8/11","granularity":"day","time":"2011/09/08 00:00:00 -0400"},"description":"Pickpocket","longitude":-122.405454,"crime type":"Theft","id":"a6o8ttyptu94","address":"23rd Street and Utah, San Francisco, CA"},"type":"Feature","geometry":{"type":"Point","coordinates":[-122.405454,37.754337]}},{"properties":{"latitude":37.76654,"time":{"end_time":"2030/01/01 18:41:00 -0500","original":"6:40 p.m.","granularity":"min","time":"2030/01/01 18:40:00 -0500"},"date":{"end_time":"2011/09/09 00:00:00 -0400","original":"9/8/11","granularity":"day","time":"2011/09/08 00:00:00 -0400"},"description":"Theft from room by acquaintance","longitude":-122.422044,"crime type":"Theft","id":"a6o8ttwostgv","address":"15th Street and Valencia, San Francisco, CA"},"type":"Feature","geometry":{"type":"Point","coordinates":[-122.422044,37.76654]}},{"properties":{"latitude":37.7617009,"time":{"end_time":"2030/01/01 20:16:00 -0500","original":"8:15 p.m.","granularity":"min","time":"2030/01/01 20:15:00 -0500"},"date":{"end_time":"2011/09/09 00:00:00 -0400","original":"9/8/11","granularity":"day","time":"2011/09/08 00:00:00 -0400"},"description":"Theft from unattended purse","longitude":-122.421578,"crime type":"Theft","id":"a6o8ttxa673q","address":"18th Street and Valencia, San Francisco, CA"},"type":"Feature","geometry":{"type":"Point","coordinates":[-122.421578,37.7617009]}},{"properties":{"latitude":37.75423,"time":{"end_time":"2030/01/01 22:11:00 -0500","original":"10:10 p.m.","granularity":"min","time":"2030/01/01 22:10:00 -0500"},"date":{"end_time":"2011/09/10 00:00:00 -0400","original":"9/9/11","granularity":"day","time":"2011/09/09 00:00:00 -0400"},"description":"Aggravated assault, force","longitude":-122.412047,"crime type":"Aggravated Assault","id":"a6o8ttrnf83q","address":"23rd Street and Harrison, San Francisco, CA"},"type":"Feature","geometry":{"type":"Point","coordinates":[-122.412047,37.75423]}},{"properties":{"latitude":37.754337,"time":{"end_time":"2030/01/01 09:00:00 -0500","original":"8:00 a.m.","granularity":"hour","time":"2030/01/01 08:00:00 -0500"},"date":{"end_time":"2011/09/10 00:00:00 -0400","original":"9/9/11","granularity":"day","time":"2011/09/09 00:00:00 -0400"},"description":"Stolen Auto","longitude":-122.405454,"crime type":"Auto Theft","id":"a6o8tu066dod","address":"23rd Street and Utah, San Francisco, CA"},"type":"Feature","geometry":{"type":"Point","coordinates":[-122.405454,37.754337]}},{"properties":{"latitude":37.7531616,"time":{"end_time":"2030/01/01 08:31:00 -0500","original":"8:30 a.m.","granularity":"min","time":"2030/01/01 08:30:00 -0500"},"date":{"end_time":"2011/09/10 00:00:00 -0400","original":"9/9/11","granularity":"day","time":"2011/09/09 00:00:00 -0400"},"description":"Stolen Auto","longitude":-122.4298156,"crime type":"Auto Theft","id":"a6o8ttp7sxzi","address":"23rd Street and Sanchez, San Francisco, CA"},"type":"Feature","geometry":{"type":"Point","coordinates":[-122.4298156,37.7531616]}},{"properties":{"latitude":37.7678713,"time":{"end_time":"2030/01/01 20:31:00 -0500","original":"8:30 p.m.","granularity":"min","time":"2030/01/01 20:30:00 -0500"},"date":{"end_time":"2011/09/10 00:00:00 -0400","original":"9/9/11","granularity":"day","time":"2011/09/09 00:00:00 -0400"},"description":"Bicycle theft","longitude":-122.4267868,"crime type":"Bicycle Theft","id":"a6o8ttuin9pi","address":"14th Street and Dolores, San Francisco, CA"},"type":"Feature","geometry":{"type":"Point","coordinates":[-122.4267868,37.7678713]}},{"properties":{"latitude":37.7694819,"time":{"end_time":"2030/01/01 14:00:00 -0500","original":"1:00 p.m.","granularity":"hour","time":"2030/01/01 13:00:00 -0500"},"date":{"end_time":"2011/09/10 00:00:00 -0400","original":"9/9/11","granularity":"day","time":"2011/09/09 00:00:00 -0400"},"description":"Auto burglary","longitude":-122.4133685,"crime type":"Burglary - Vehicle","id":"a6o8ttvrqqqu","address":"13th Street and Harrison, San Francisco, CA"},"type":"Feature","geometry":{"type":"Point","coordinates":[-122.4133685,37.7694819]}},{"properties":{"latitude":37.7650543,"time":{"end_time":"2030/01/01 02:11:00 -0500","original":"2:10 a.m.","granularity":"min","time":"2030/01/01 02:10:00 -0500"},"date":{"end_time":"2011/09/10 00:00:00 -0400","original":"9/9/11","granularity":"day","time":"2011/09/09 00:00:00 -0400"},"description":"Robbery, Phone, Gun Simulated","longitude":-122.4196761,"crime type":"Robbery","id":"a6o8ttvel7f2","address":"16th Street and Mission, San Francisco, CA"},"type":"Feature","geometry":{"type":"Point","coordinates":[-122.4196761,37.7650543]}},{"properties":{"latitude":37.7618358,"time":{"end_time":"2030/01/01 03:59:00 -0500","original":"3:58 a.m.","granularity":"min","time":"2030/01/01 03:58:00 -0500"},"date":{"end_time":"2011/09/10 00:00:00 -0400","original":"9/9/11","granularity":"day","time":"2011/09/09 00:00:00 -0400"},"description":"Robbery, knife","longitude":-122.4193724,"crime type":"Robbery","id":"a6o8tu09y2ad","address":"18th Street and Mission, San Francisco, CA"},"type":"Feature","geometry":{"type":"Point","coordinates":[-122.4193724,37.7618358]}},{"properties":{"latitude":37.752629,"time":{"end_time":"2030/01/01 10:46:00 -0500","original":"10:45 a.m.","granularity":"min","time":"2030/01/01 10:45:00 -0500"},"date":{"end_time":"2011/09/10 00:00:00 -0400","original":"9/9/11","granularity":"day","time":"2011/09/09 00:00:00 -0400"},"description":"Skil Saw Stolen from bed of pickup","longitude":-122.4119,"crime type":"Theft","id":"a6o8tts5swks","address":"24th Street and Harrison, San Francisco, CA"},"type":"Feature","geometry":{"type":"Point","coordinates":[-122.4119,37.752629]}},{"properties":{"latitude":37.7649169,"time":{"end_time":"2030/01/01 02:12:00 -0500","original":"2:11 a.m.","granularity":"min","time":"2030/01/01 02:11:00 -0500"},"date":{"end_time":"2011/09/10 00:00:00 -0400","original":"9/9/11","granularity":"day","time":"2011/09/09 00:00:00 -0400"},"description":"Malicious Mischief, Windows","longitude":-122.421886,"crime type":"Vandalism","id":"a6o8ttwfedi6","address":"16th Street and Valencia, San Francisco, CA"},"type":"Feature","geometry":{"type":"Point","coordinates":[-122.421886,37.7649169]}},{"properties":{"latitude":37.7650543,"time":{"end_time":"2030/01/01 02:46:00 -0500","original":"2:45 a.m.","granularity":"min","time":"2030/01/01 02:45:00 -0500"},"date":{"end_time":"2011/09/11 00:00:00 -0400","original":"9/10/11","granularity":"day","time":"2011/09/10 00:00:00 -0400"},"description":"Aggravated assault, knife","longitude":-122.4196761,"crime type":"Aggravated Assault","id":"a6o8ttz4e5pc","address":"16th Street and Mission, San Francisco, CA"},"type":"Feature","geometry":{"type":"Point","coordinates":[-122.4196761,37.7650543]}},{"properties":{"latitude":37.7651169,"time":{"end_time":"2030/01/01 23:00:00 -0500","original":"10:00 p.m.","granularity":"hour","time":"2030/01/01 22:00:00 -0500"},"date":{"end_time":"2011/09/11 00:00:00 -0400","original":"9/10/11","granularity":"day","time":"2011/09/10 00:00:00 -0400"},"description":"Stolen Auto","longitude":-122.418579,"crime type":"Auto Theft","id":"a6o8ttw6rd8w","address":"16th Street and Capp, San Francisco, CA"},"type":"Feature","geometry":{"type":"Point","coordinates":[-122.418579,37.7651169]}},{"properties":{"latitude":37.7604354,"time":{"end_time":"2030/01/02 00:00:00 -0500","original":"11:59 p.m.","granularity":"min","time":"2030/01/01 23:59:00 -0500"},"date":{"end_time":"2011/09/11 00:00:00 -0400","original":"9/10/11","granularity":"day","time":"2011/09/10 00:00:00 -0400"},"description":"Stolen auto","longitude":-122.4109673,"crime type":"Auto Theft","id":"a6o8tu35bx5b","address":"19th Street and Florida, San Francisco, CA"},"type":"Feature","geometry":{"type":"Point","coordinates":[-122.4109673,37.7604354]}},{"properties":{"latitude":37.765183,"time":{"end_time":"2030/01/01 01:10:00 -0500","original":"1:09 a.m.","granularity":"min","time":"2030/01/01 01:09:00 -0500"},"date":{"end_time":"2011/09/11 00:00:00 -0400","original":"9/10/11","granularity":"day","time":"2011/09/10 00:00:00 -0400"},"description":"Battery","longitude":-122.417487,"crime type":"Battery","id":"a6o8ttr9jfmb","address":"16th Street and South Van Ness, San Francisco, CA"},"type":"Feature","geometry":{"type":"Point","coordinates":[-122.417487,37.765183]}},{"properties":{"latitude":37.7618358,"time":{"end_time":"2030/01/01 15:16:00 -0500","original":"3:15 p.m.","granularity":"min","time":"2030/01/01 15:15:00 -0500"},"date":{"end_time":"2011/09/11 00:00:00 -0400","original":"9/10/11","granularity":"day","time":"2011/09/10 00:00:00 -0400"},"description":"Battery","longitude":-122.4193724,"crime type":"Battery","id":"a6o8ttvb5b7z","address":"18th Street and Mission, San Francisco, CA"},"type":"Feature","geometry":{"type":"Point","coordinates":[-122.4193724,37.7618358]}},{"properties":{"latitude":37.7666739,"time":{"end_time":"2030/01/01 20:26:00 -0500","original":"8:25 p.m.","granularity":"min","time":"2030/01/01 20:25:00 -0500"},"date":{"end_time":"2011/09/11 00:00:00 -0400","original":"9/10/11","granularity":"day","time":"2011/09/10 00:00:00 -0400"},"description":"Auto burglary","longitude":-122.4198259,"crime type":"Burglary - Vehicle","id":"a6o8ttv8mv0z","address":"15th Street and Mission, San Francisco, CA"},"type":"Feature","geometry":{"type":"Point","coordinates":[-122.4198259,37.7666739]}},{"properties":{"latitude":37.7522494,"time":{"end_time":"2030/01/01 10:00:00 -0500","original":"9:00 a.m.","granularity":"hour","time":"2030/01/01 09:00:00 -0500"},"date":{"end_time":"2011/09/11 00:00:00 -0400","original":"9/10/11","granularity":"day","time":"2011/09/10 00:00:00 -0400"},"description":"Domestic violence","longitude":-122.4184567,"crime type":"Domestic Violence","id":"a6o8tu10hmib","address":"24th Street and Mission, San Francisco, CA"},"type":"Feature","geometry":{"type":"Point","coordinates":[-122.4184567,37.7522494]}},{"properties":{"latitude":37.7681639,"time":{"end_time":"2030/01/01 10:24:00 -0500","original":"10:23 a.m.","granularity":"min","time":"2030/01/01 10:23:00 -0500"},"date":{"end_time":"2011/09/11 00:00:00 -0400","original":"9/10/11","granularity":"day","time":"2011/09/10 00:00:00 -0400"},"description":"Grand theft, shoptlifting","longitude":-122.4107525,"crime type":"Theft","id":"a6o8ttrn5d2t","address":"1500 Bryant, San Francisco, CA"},"type":"Feature","geometry":{"type":"Point","coordinates":[-122.4107525,37.7681639]}},{"properties":{"latitude":37.74806,"time":{"end_time":"2030/01/01 12:46:00 -0500","original":"12:45 p.m.","granularity":"min","time":"2030/01/01 12:45:00 -0500"},"date":{"end_time":"2011/09/11 00:00:00 -0400","original":"9/10/11","granularity":"day","time":"2011/09/10 00:00:00 -0400"},"description":"Theft from unlocked vehicle","longitude":-122.4202659,"crime type":"Theft","id":"a6o8ttz8s9rj","address":"Valencia and Cesar Chavez, San Francisco, CA"},"type":"Feature","geometry":{"type":"Point","coordinates":[-122.4202659,37.74806]}},{"properties":{"latitude":37.7521823,"time":{"end_time":"2030/01/01 16:45:00 -0500","original":"4:44 p.m.","granularity":"min","time":"2030/01/01 16:44:00 -0500"},"date":{"end_time":"2011/09/11 00:00:00 -0400","original":"9/10/11","granularity":"day","time":"2011/09/10 00:00:00 -0400"},"description":"Theft of unattended coin purse","longitude":-122.419546,"crime type":"Theft","id":"a6o8tttqdtzl","address":"24th Street and Bartlett, San Francisco, CA"},"type":"Feature","geometry":{"type":"Point","coordinates":[-122.419546,37.7521823]}},{"properties":{"latitude":37.7662781,"time":{"end_time":"2030/01/01 23:00:00 -0500","original":"10:00 p.m.","granularity":"hour","time":"2030/01/01 22:00:00 -0500"},"date":{"end_time":"2011/09/11 00:00:00 -0400","original":"9/10/11","granularity":"day","time":"2011/09/10 00:00:00 -0400"},"description":"Theft of wallet by acquaintance","longitude":-122.4264618,"crime type":"Theft","id":"a6o8ttwgrrl9","address":"15th Street and Dolores, San Francisco, CA"},"type":"Feature","geometry":{"type":"Point","coordinates":[-122.4264618,37.7662781]}},{"properties":{"latitude":37.7655479,"time":{"end_time":"2030/01/01 13:27:00 -0500","original":"1:26 p.m.","granularity":"min","time":"2030/01/01 13:26:00 -0500"},"date":{"end_time":"2011/09/11 00:00:00 -0400","original":"9/10/11","granularity":"day","time":"2011/09/10 00:00:00 -0400"},"description":"Criminal threats","longitude":-122.411455,"crime type":"Unknown","id":"a6o8ttpq77xg","address":"16th Street and Florida, San Francisco, CA"},"type":"Feature","geometry":{"type":"Point","coordinates":[-122.411455,37.7655479]}},{"properties":{"latitude":37.7634362,"time":{"end_time":"2030/01/01 17:03:00 -0500","original":"5:02 p.m.","granularity":"min","time":"2030/01/01 17:02:00 -0500"},"date":{"end_time":"2011/09/11 00:00:00 -0400","original":"9/10/11","granularity":"day","time":"2011/09/10 00:00:00 -0400"},"description":"Trespassing, fighting","longitude":-122.4195226,"crime type":"Unknown","id":"a6o8ttokk6nh","address":"17th Street and Mission, San Francisco, CA"},"type":"Feature","geometry":{"type":"Point","coordinates":[-122.4195226,37.7634362]}},{"properties":{"latitude":37.7618358,"time":{"end_time":"2030/01/01 14:06:00 -0500","original":"2:05 p.m.","granularity":"min","time":"2030/01/01 14:05:00 -0500"},"date":{"end_time":"2011/09/11 00:00:00 -0400","original":"9/10/11","granularity":"day","time":"2011/09/10 00:00:00 -0400"},"description":"Violation of Court Stay-away Order","longitude":-122.4193724,"crime type":"Violation of Court Order","id":"a6o8ttpzsgto","address":"18th Street and Mission, San Francisco, CA"},"type":"Feature","geometry":{"type":"Point","coordinates":[-122.4193724,37.7618358]}},{"properties":{"latitude":37.7627621,"time":{"end_time":"2030/01/01 11:31:00 -0500","original":"11:30 a.m.","granularity":"min","time":"2030/01/01 11:30:00 -0500"},"date":{"end_time":"2011/09/12 00:00:00 -0400","original":"9/11/11","granularity":"day","time":"2011/09/11 00:00:00 -0400"},"description":"Auto Theft","longitude":-122.4307496,"crime type":"Auto Theft","id":"a6o8ttrhoxwd","address":"17th Street and Sanchez, San Francisco, CA"},"type":"Feature","geometry":{"type":"Point","coordinates":[-122.4307496,37.7627621]}},{"properties":{"latitude":37.7612889,"time":{"end_time":"2030/01/01 23:46:00 -0500","original":"11:45 p.m.","granularity":"min","time":"2030/01/01 23:45:00 -0500"},"date":{"end_time":"2011/09/12 00:00:00 -0400","original":"9/11/11","granularity":"day","time":"2011/09/11 00:00:00 -0400"},"description":"Battery","longitude":-122.4283998,"crime type":"Battery","id":"a6o8tu2p1zt3","address":"18th Street and Church, San Francisco, CA"},"type":"Feature","geometry":{"type":"Point","coordinates":[-122.4283998,37.7612889]}},{"properties":{"latitude":37.7634362,"time":{"end_time":"2030/01/01 18:36:00 -0500","original":"6:35 p.m.","granularity":"min","time":"2030/01/01 18:35:00 -0500"},"date":{"end_time":"2011/09/12 00:00:00 -0400","original":"9/11/11","granularity":"day","time":"2011/09/11 00:00:00 -0400"},"description":"Domestic violence","longitude":-122.4195226,"crime type":"Domestic Violence","id":"a6o8tu1mhn8f","address":"17th Street and Mission, San Francisco, CA"},"type":"Feature","geometry":{"type":"Point","coordinates":[-122.4195226,37.7634362]}},{"properties":{"latitude":37.7525047,"time":{"end_time":"2030/01/01 05:11:00 -0500","original":"5:10 a.m.","granularity":"min","time":"2030/01/01 05:10:00 -0500"},"date":{"end_time":"2011/09/12 00:00:00 -0400","original":"9/11/11","granularity":"day","time":"2011/09/11 00:00:00 -0400"},"description":"Robbery, knife","longitude":-122.414068,"crime type":"Robbery","id":"a6o8tu31e1rs","address":"24th Street and Folsom, San Francisco, CA"},"type":"Feature","geometry":{"type":"Point","coordinates":[-122.414068,37.7525047]}},{"properties":{"latitude":37.7509364,"time":{"end_time":"2030/01/01 17:31:00 -0500","original":"5:30 p.m.","granularity":"min","time":"2030/01/01 17:30:00 -0500"},"date":{"end_time":"2011/09/12 00:00:00 -0400","original":"9/11/11","granularity":"day","time":"2011/09/11 00:00:00 -0400"},"description":"Robbery","longitude":-122.4133703,"crime type":"Robbery","id":"a6o8ttystxax","address":"25th Street and Lucky, San Francisco, CA"},"type":"Feature","geometry":{"type":"Point","coordinates":[-122.4133703,37.7509364]}},{"properties":{"latitude":37.7586991,"time":{"end_time":"2030/01/01 23:26:00 -0500","original":"11:25 p.m.","granularity":"min","time":"2030/01/01 23:25:00 -0500"},"date":{"end_time":"2011/09/12 00:00:00 -0400","original":"9/11/11","granularity":"day","time":"2011/09/11 00:00:00 -0400"},"description":"Attempted robbery, pandering","longitude":-122.41798,"crime type":"Robbery","id":"a6o8ttqoj7zv","address":"20th Street and Capp, San Francisco, CA"},"type":"Feature","geometry":{"type":"Point","coordinates":[-122.41798,37.7586991]}},{"properties":{"latitude":37.76654,"time":{"end_time":"2030/01/01 02:13:00 -0500","original":"2:12 a.m.","granularity":"min","time":"2030/01/01 02:12:00 -0500"},"date":{"end_time":"2011/09/13 00:00:00 -0400","original":"9/12/11","granularity":"day","time":"2011/09/12 00:00:00 -0400"},"description":"Aggravated assault, force","longitude":-122.422044,"crime type":"Aggravated Assault","id":"a6o8ttv23x4y","address":"15th Street and Valencia, San Francisco, CA"},"type":"Feature","geometry":{"type":"Point","coordinates":[-122.422044,37.76654]}},{"properties":{"latitude":37.7620332,"time":{"end_time":"2030/01/01 07:46:00 -0500","original":"7:45 a.m.","granularity":"min","time":"2030/01/01 07:45:00 -0500"},"date":{"end_time":"2011/09/13 00:00:00 -0400","original":"9/12/11","granularity":"day","time":"2011/09/12 00:00:00 -0400"},"description":"Stolen Auto","longitude":-122.4161017,"crime type":"Auto Theft","id":"a6o8tu1ctmxl","address":"18th Street and Shotwell, San Francisco, CA"},"type":"Feature","geometry":{"type":"Point","coordinates":[-122.4161017,37.7620332]}},{"properties":{"latitude":37.7642534,"time":{"end_time":"2030/01/01 10:00:00 -0500","original":"9:00 a.m.","granularity":"hour","time":"2030/01/01 09:00:00 -0500"},"date":{"end_time":"2011/09/13 00:00:00 -0400","original":"9/12/11","granularity":"day","time":"2011/09/12 00:00:00 -0400"},"description":"Stolen Auto","longitude":-122.4113277,"crime type":"Auto Theft","id":"a6o8ttosli04","address":"17th Street and Florida, San Francisco, CA"},"type":"Feature","geometry":{"type":"Point","coordinates":[-122.4113277,37.7642534]}},{"properties":{"latitude":37.7531616,"time":{"end_time":"2030/01/01 19:00:00 -0500","original":"6:00 p.m.","granularity":"hour","time":"2030/01/01 18:00:00 -0500"},"date":{"end_time":"2011/09/13 00:00:00 -0400","original":"9/12/11","granularity":"day","time":"2011/09/12 00:00:00 -0400"},"description":"Burglary","longitude":-122.4298156,"crime type":"Burglary - Home","id":"a6o8ttpzx2cp","address":"23rd Street and Sanchez, San Francisco, CA"},"type":"Feature","geometry":{"type":"Point","coordinates":[-122.4298156,37.7531616]}},{"properties":{"latitude":37.7519079,"time":{"end_time":"2030/01/01 07:51:00 -0500","original":"7:50 a.m.","granularity":"min","time":"2030/01/01 07:50:00 -0500"},"date":{"end_time":"2011/09/13 00:00:00 -0400","original":"9/12/11","granularity":"day","time":"2011/09/12 00:00:00 -0400"},"description":"Stolen Motorcycle","longitude":-122.4239868,"crime type":"Motorcycle Theft","id":"a6o8tu1lu71q","address":"24th Street and Fair Oaks, San Francisco, CA"},"type":"Feature","geometry":{"type":"Point","coordinates":[-122.4239868,37.7519079]}},{"properties":{"latitude":37.752907,"time":{"end_time":"2030/01/01 00:21:00 -0500","original":"12:20 a.m.","granularity":"min","time":"2030/01/01 00:20:00 -0500"},"date":{"end_time":"2011/09/13 00:00:00 -0400","original":"9/12/11","granularity":"day","time":"2011/09/12 00:00:00 -0400"},"description":"Robbery - cell phone","longitude":-122.407291,"crime type":"Robbery","id":"a6o8ttugk8fi","address":"24th Street and Hampshire, San Francisco, CA"},"type":"Feature","geometry":{"type":"Point","coordinates":[-122.407291,37.752907]}},{"properties":{"latitude":37.7586991,"time":{"end_time":"2030/01/01 14:46:00 -0500","original":"2:45 p.m.","granularity":"min","time":"2030/01/01 14:45:00 -0500"},"date":{"end_time":"2011/09/13 00:00:00 -0400","original":"9/12/11","granularity":"day","time":"2011/09/12 00:00:00 -0400"},"description":"Grand theft, person","longitude":-122.41798,"crime type":"Theft","id":"a6o8ttz37hjt","address":"20th Street and Capp, San Francisco, CA"},"type":"Feature","geometry":{"type":"Point","coordinates":[-122.41798,37.7586991]}},{"properties":{"latitude":37.7650543,"time":{"end_time":"2030/01/01 03:27:00 -0500","original":"3:26 a.m.","granularity":"min","time":"2030/01/01 03:26:00 -0500"},"date":{"end_time":"2011/09/13 00:00:00 -0400","original":"9/12/11","granularity":"day","time":"2011/09/12 00:00:00 -0400"},"description":"Grand theft, purse snatch","longitude":-122.4196761,"crime type":"Theft","id":"a6o8ttuj6lqk","address":"16th Street and Mission, San Francisco, CA"},"type":"Feature","geometry":{"type":"Point","coordinates":[-122.4196761,37.7650543]}},{"properties":{"latitude":37.7554415,"time":{"end_time":"2030/01/01 18:42:00 -0500","original":"6:41 p.m.","granularity":"min","time":"2030/01/01 18:41:00 -0500"},"date":{"end_time":"2011/09/13 00:00:00 -0400","original":"9/12/11","granularity":"day","time":"2011/09/12 00:00:00 -0400"},"description":"Petty theft, shoplifting","longitude":-122.4187616,"crime type":"Theft","id":"a6o8tu08xjx5","address":"22nd Street and Mission, San Francisco, CA"},"type":"Feature","geometry":{"type":"Point","coordinates":[-122.4187616,37.7554415]}},{"properties":{"latitude":37.7619356,"time":{"end_time":"2030/01/01 10:16:00 -0500","original":"10:15 a.m.","granularity":"min","time":"2030/01/01 10:15:00 -0500"},"date":{"end_time":"2011/09/13 00:00:00 -0400","original":"9/12/11","granularity":"day","time":"2011/09/12 00:00:00 -0400"},"description":"Criminal threats","longitude":-122.4072485,"crime type":"Unknown","id":"a6o8ttqrk7bi","address":"18th Street and Potrero, San Francisco, CA"},"type":"Feature","geometry":{"type":"Point","coordinates":[-122.4072485,37.7619356]}},{"properties":{"latitude":37.7570986,"time":{"end_time":"2030/01/01 02:31:00 -0500","original":"2:30 a.m.","granularity":"min","time":"2030/01/01 02:30:00 -0500"},"date":{"end_time":"2011/09/13 00:00:00 -0400","original":"9/12/11","granularity":"day","time":"2011/09/12 00:00:00 -0400"},"description":"Malicious mischief, vehicle","longitude":-122.4178225,"crime type":"Vandalism","id":"a6o8tts8sqlf","address":"21st Street and Capp, San Francisco, CA"},"type":"Feature","geometry":{"type":"Point","coordinates":[-122.4178225,37.7570986]}},{"properties":{"latitude":37.7649169,"time":{"end_time":"2030/01/01 00:53:00 -0500","original":"12:52 a.m.","granularity":"min","time":"2030/01/01 00:52:00 -0500"},"date":{"end_time":"2011/09/14 00:00:00 -0400","original":"9/13/11","granularity":"day","time":"2011/09/13 00:00:00 -0400"},"description":"Aggravated assault, knife","longitude":-122.421886,"crime type":"Aggravated Assault","id":"a6o8ttqfx8es","address":"16th Street and Valencia, San Francisco, CA"},"type":"Feature","geometry":{"type":"Point","coordinates":[-122.421886,37.7649169]}},{"properties":{"latitude":37.7522494,"time":{"end_time":"2030/01/01 15:31:00 -0500","original":"3:30 p.m.","granularity":"min","time":"2030/01/01 15:30:00 -0500"},"date":{"end_time":"2011/09/14 00:00:00 -0400","original":"9/13/11","granularity":"day","time":"2011/09/13 00:00:00 -0400"},"description":"Possession of Stolen Property","longitude":-122.4184567,"crime type":"Theft","id":"a6o8ttyogtz1","address":"24th Street and Mission, San Francisco, CA"},"type":"Feature","geometry":{"type":"Point","coordinates":[-122.4184567,37.7522494]}},{"properties":{"latitude":37.753703,"time":{"end_time":"2030/01/01 18:31:00 -0500","original":"6:30 p.m.","granularity":"min","time":"2030/01/01 18:30:00 -0500"},"date":{"end_time":"2011/09/14 00:00:00 -0400","original":"9/13/11","granularity":"day","time":"2011/09/13 00:00:00 -0400"},"description":"Petty theft, Shoplifting","longitude":-122.420812,"crime type":"Theft","id":"a6o8ttqg0zp8","address":"23rd Street and Valencia, San Francisco, CA"},"type":"Feature","geometry":{"type":"Point","coordinates":[-122.420812,37.753703]}},{"properties":{"latitude":37.7566263,"time":{"end_time":"2030/01/01 08:46:00 -0500","original":"8:45 a.m.","granularity":"min","time":"2030/01/01 08:45:00 -0500"},"date":{"end_time":"2011/09/15 00:00:00 -0400","original":"9/14/11","granularity":"day","time":"2011/09/14 00:00:00 -0400"},"description":"Stolen Auto","longitude":-122.4256808,"crime type":"Auto Theft","id":"a6o8ttrxntcx","address":"21st Street and Dolores, San Francisco, CA"},"type":"Feature","geometry":{"type":"Point","coordinates":[-122.4256808,37.7566263]}},{"properties":{"latitude":37.762158,"time":{"end_time":"2030/01/01 20:00:00 -0500","original":"7:00 p.m.","granularity":"hour","time":"2030/01/01 19:00:00 -0500"},"date":{"end_time":"2011/09/15 00:00:00 -0400","original":"9/14/11","granularity":"day","time":"2011/09/14 00:00:00 -0400"},"description":"Bicycle theft","longitude":-122.4140561,"crime type":"Bicycle Theft","id":"a6o8ttzut5oa","address":"18th Street and Treat, San Francisco, CA"},"type":"Feature","geometry":{"type":"Point","coordinates":[-122.4140561,37.762158]}},{"properties":{"latitude":37.7617009,"time":{"end_time":"2030/01/01 02:34:00 -0500","original":"2:33 a.m.","granularity":"min","time":"2030/01/01 02:33:00 -0500"},"date":{"end_time":"2011/09/15 00:00:00 -0400","original":"9/14/11","granularity":"day","time":"2011/09/14 00:00:00 -0400"},"description":"Burglary,Hot Prowl","longitude":-122.421578,"crime type":"Burglary - Home","id":"a6o8ttul0sb6","address":"18th Street and Valencia, San Francisco, CA"},"type":"Feature","geometry":{"type":"Point","coordinates":[-122.421578,37.7617009]}},{"properties":{"latitude":37.7492383,"time":{"end_time":"2030/01/01 13:05:00 -0500","original":"1:04 p.m.","granularity":"min","time":"2030/01/01 13:04:00 -0500"},"date":{"end_time":"2011/09/15 00:00:00 -0400","original":"9/14/11","granularity":"day","time":"2011/09/14 00:00:00 -0400"},"description":"Attempted burglary","longitude":-122.414869,"crime type":"Burglary - Home","id":"a6o8tu0ql99a","address":"26th Street and Shotwell, San Francisco, CA"},"type":"Feature","geometry":{"type":"Point","coordinates":[-122.414869,37.7492383]}},{"properties":{"latitude":37.7489739,"time":{"end_time":"2030/01/01 16:30:00 -0500","original":"4:29 p.m.","granularity":"min","time":"2030/01/01 16:29:00 -0500"},"date":{"end_time":"2011/09/15 00:00:00 -0400","original":"9/14/11","granularity":"day","time":"2011/09/14 00:00:00 -0400"},"description":"Burglary, apartment","longitude":-122.419247,"crime type":"Burglary - Home","id":"a6o8tu3ualnz","address":"26th Street and Bartlett, San Francisco, CA"},"type":"Feature","geometry":{"type":"Point","coordinates":[-122.419247,37.7489739]}},{"properties":{"latitude":37.768016,"time":{"end_time":"2030/01/01 16:51:00 -0500","original":"4:50 p.m.","granularity":"min","time":"2030/01/01 16:50:00 -0500"},"date":{"end_time":"2011/09/15 00:00:00 -0400","original":"9/14/11","granularity":"day","time":"2011/09/14 00:00:00 -0400"},"description":"Burglary, apartment","longitude":-122.4243503,"crime type":"Burglary - Home","id":"a6o8tu04p8qv","address":"14th Street and Guerrero, San Francisco, CA"},"type":"Feature","geometry":{"type":"Point","coordinates":[-122.4243503,37.768016]}},{"properties":{"latitude":37.7543388,"time":{"end_time":"2030/01/01 09:46:00 -0500","original":"9:45 a.m.","granularity":"min","time":"2030/01/01 09:45:00 -0500"},"date":{"end_time":"2011/09/15 00:00:00 -0400","original":"9/14/11","granularity":"day","time":"2011/09/14 00:00:00 -0400"},"description":"Auto burglary","longitude":-122.4102306,"crime type":"Burglary - Vehicle","id":"a6o8ttw2pds9","address":"23rd Street and Florida, San Francisco, CA"},"type":"Feature","geometry":{"type":"Point","coordinates":[-122.4102306,37.7543388]}},{"properties":{"latitude":37.7612889,"time":{"end_time":"2030/01/01 20:00:00 -0500","original":"7:00 p.m.","granularity":"hour","time":"2030/01/01 19:00:00 -0500"},"date":{"end_time":"2011/09/15 00:00:00 -0400","original":"9/14/11","granularity":"day","time":"2011/09/14 00:00:00 -0400"},"description":"Auto burglary","longitude":-122.4283998,"crime type":"Burglary - Vehicle","id":"a6o8ttrswlmf","address":"18th Street and Church, San Francisco, CA"},"type":"Feature","geometry":{"type":"Point","coordinates":[-122.4283998,37.7612889]}},{"properties":{"latitude":37.7649169,"time":{"end_time":"2030/01/01 01:21:00 -0500","original":"1:20 a.m.","granularity":"min","time":"2030/01/01 01:20:00 -0500"},"date":{"end_time":"2011/09/15 00:00:00 -0400","original":"9/14/11","granularity":"day","time":"2011/09/14 00:00:00 -0400"},"description":"Petty theft, tip jar","longitude":-122.421886,"crime type":"Theft","id":"a6o8ttx9vh1f","address":"16th Street and Valencia, San Francisco, CA"},"type":"Feature","geometry":{"type":"Point","coordinates":[-122.421886,37.7649169]}},{"properties":{"latitude":37.764755,"time":{"end_time":"2030/01/01 14:16:00 -0500","original":"2:15 p.m.","granularity":"min","time":"2030/01/01 14:15:00 -0500"},"date":{"end_time":"2011/09/15 00:00:00 -0400","original":"9/14/11","granularity":"day","time":"2011/09/14 00:00:00 -0400"},"description":"Theft of unattended purse","longitude":-122.424574,"crime type":"Theft","id":"a6o8ttrbtswn","address":"16th Street and Spencer, San Francisco, CA"},"type":"Feature","geometry":{"type":"Point","coordinates":[-122.424574,37.764755]}},{"properties":{"latitude":37.753845,"time":{"end_time":"2030/01/01 22:30:00 -0500","original":"10:29 p.m.","granularity":"min","time":"2030/01/01 22:29:00 -0500"},"date":{"end_time":"2011/09/15 00:00:00 -0400","original":"9/14/11","granularity":"day","time":"2011/09/14 00:00:00 -0400"},"description":"Petty theft, shoplifting","longitude":-122.4186025,"crime type":"Theft","id":"a6o8tty7mlyw","address":"23rd Street and Mission, San Francisco, CA"},"type":"Feature","geometry":{"type":"Point","coordinates":[-122.4186025,37.753845]}},{"properties":{"latitude":37.7491151,"time":{"end_time":"2030/01/01 10:53:00 -0500","original":"10:52 a.m.","granularity":"min","time":"2030/01/01 10:52:00 -0500"},"date":{"end_time":"2011/09/16 00:00:00 -0400","original":"9/15/11","granularity":"day","time":"2011/09/15 00:00:00 -0400"},"description":"Civil sidewalks written warning","longitude":-122.4170407,"crime type":"Civil Sidewalks","id":"a6o8ttwyx8ig","address":"26th Street and Capp, San Francisco, CA"},"type":"Feature","geometry":{"type":"Point","coordinates":[-122.4170407,37.7491151]}},{"properties":{"latitude":37.750771,"time":{"end_time":"2030/01/01 02:20:00 -0500","original":"2:19 a.m.","granularity":"min","time":"2030/01/01 02:19:00 -0500"},"date":{"end_time":"2011/09/16 00:00:00 -0400","original":"9/15/11","granularity":"day","time":"2011/09/15 00:00:00 -0400"},"description":"Investigative detention","longitude":-122.4161173,"crime type":"Unknown","id":"a6o8ttxgknwc","address":"25th Street and South Van Ness, San Francisco, CA"},"type":"Feature","geometry":{"type":"Point","coordinates":[-122.4161173,37.750771]}},{"properties":{"latitude":37.76431,"time":{"end_time":"2030/01/01 23:16:00 -0500","original":"11:15 p.m.","granularity":"min","time":"2030/01/01 23:15:00 -0500"},"date":{"end_time":"2011/09/17 00:00:00 -0400","original":"9/16/11","granularity":"day","time":"2011/09/16 00:00:00 -0400"},"description":"Auto burglary","longitude":-122.410364,"crime type":"Burglary - Vehicle","id":"a6o8tts6a3c2","address":"17th Street and Bryant, San Francisco, CA"},"type":"Feature","geometry":{"type":"Point","coordinates":[-122.410364,37.76431]}},{"properties":{"latitude":37.7519696,"time":{"end_time":"2030/01/01 14:11:00 -0500","original":"2:10 p.m.","granularity":"min","time":"2030/01/01 14:10:00 -0500"},"date":{"end_time":"2011/09/17 00:00:00 -0400","original":"9/16/11","granularity":"day","time":"2011/09/16 00:00:00 -0400"},"description":"Robbery, force","longitude":-122.42294,"crime type":"Robbery","id":"a6o8ttqp3878","address":"24th Street and Guerrero, San Francisco, CA"},"type":"Feature","geometry":{"type":"Point","coordinates":[-122.42294,37.7519696]}},{"properties":{"latitude":37.7560022,"time":{"end_time":"2030/01/01 09:00:00 -0500","original":"8:00 a.m.","granularity":"hour","time":"2030/01/01 08:00:00 -0500"},"date":{"end_time":"2011/09/17 00:00:00 -0400","original":"9/16/11","granularity":"day","time":"2011/09/16 00:00:00 -0400"},"description":"Stolen laptop","longitude":-122.4094673,"crime type":"Theft","id":"a6o8ttztgeg2","address":"22nd Street and Bryant, San Francisco, CA"},"type":"Feature","geometry":{"type":"Point","coordinates":[-122.4094673,37.7560022]}},{"properties":{"latitude":37.7650543,"time":{"end_time":"2030/01/01 15:41:00 -0500","original":"3:40 p.m.","granularity":"min","time":"2030/01/01 15:40:00 -0500"},"date":{"end_time":"2011/09/17 00:00:00 -0400","original":"9/16/11","granularity":"day","time":"2011/09/16 00:00:00 -0400"},"description":"Criminal threats","longitude":-122.4196761,"crime type":"Unknown","id":"a6o8ttrsnc1s","address":"16th Street and Mission, San Francisco, CA"},"type":"Feature","geometry":{"type":"Point","coordinates":[-122.4196761,37.7650543]}},{"properties":{"latitude":37.7539738,"time":{"end_time":"2030/01/01 09:25:00 -0500","original":"9:24 a.m.","granularity":"min","time":"2030/01/01 09:24:00 -0500"},"date":{"end_time":"2011/09/17 00:00:00 -0400","original":"9/16/11","granularity":"day","time":"2011/09/16 00:00:00 -0400"},"description":"Malicoius mischief, vehicle","longitude":-122.4164228,"crime type":"Vandalism","id":"a6o8tu12pat4","address":"23rd Street and South Van Ness, San Francisco, CA"},"type":"Feature","geometry":{"type":"Point","coordinates":[-122.4164228,37.7539738]}},{"properties":{"latitude":37.754165,"time":{"end_time":"2030/01/01 09:16:00 -0500","original":"9:15 a.m.","granularity":"min","time":"2030/01/01 09:15:00 -0500"},"date":{"end_time":"2011/09/18 00:00:00 -0400","original":"9/17/11","granularity":"day","time":"2011/09/17 00:00:00 -0400"},"description":"Auto burglary","longitude":-122.413141,"crime type":"Burglary - Vehicle","id":"a6o8ttqslxwj","address":"23rd Steet and Treat, San Francisco, CA"},"type":"Feature","geometry":{"type":"Point","coordinates":[-122.413141,37.754165]}},{"properties":{"latitude":37.7617009,"time":{"end_time":"2030/01/01 02:31:00 -0500","original":"2:30 a.m.","granularity":"min","time":"2030/01/01 02:30:00 -0500"},"date":{"end_time":"2011/09/18 00:00:00 -0400","original":"9/17/11","granularity":"day","time":"2011/09/17 00:00:00 -0400"},"description":"Disturbing the peace, fighting","longitude":-122.421578,"crime type":"Disturbing the Peace","id":"a6o8tttmrlw5","address":"18th Street and Valencia, San Francisco, CA"},"type":"Feature","geometry":{"type":"Point","coordinates":[-122.421578,37.7617009]}},{"properties":{"latitude":37.757298,"time":{"end_time":"2030/01/01 00:55:00 -0500","original":"12:54 a.m.","granularity":"min","time":"2030/01/01 00:54:00 -0500"},"date":{"end_time":"2011/09/18 00:00:00 -0400","original":"9/17/11","granularity":"day","time":"2011/09/17 00:00:00 -0400"},"description":"Robbery, force","longitude":-122.414541,"crime type":"Robbery","id":"a6o8ttwibrbj","address":"21st Street and Folsom, San Francisco, CA"},"type":"Feature","geometry":{"type":"Point","coordinates":[-122.414541,37.757298]}},{"properties":{"latitude":37.7522494,"time":{"end_time":"2030/01/01 11:00:00 -0500","original":"10:00 a.m.","granularity":"hour","time":"2030/01/01 10:00:00 -0500"},"date":{"end_time":"2011/09/18 00:00:00 -0400","original":"9/17/11","granularity":"day","time":"2011/09/17 00:00:00 -0400"},"description":"Robbery of a smoothie","longitude":-122.4184567,"crime type":"Robbery","id":"a6o8ttzx0clv","address":"24th Street and Mission, San Francisco, CA"},"type":"Feature","geometry":{"type":"Point","coordinates":[-122.4184567,37.7522494]}},{"properties":{"latitude":37.757298,"time":{"end_time":"2030/01/01 20:56:00 -0500","original":"8:55 p.m.","granularity":"min","time":"2030/01/01 20:55:00 -0500"},"date":{"end_time":"2011/09/18 00:00:00 -0400","original":"9/17/11","granularity":"day","time":"2011/09/17 00:00:00 -0400"},"description":"Attempted robbery","longitude":-122.414541,"crime type":"Robbery","id":"a6o8ttr55wga","address":"21st Street and Folsom, San Francisco, CA"},"type":"Feature","geometry":{"type":"Point","coordinates":[-122.414541,37.757298]}},{"properties":{"latitude":37.7602375,"time":{"end_time":"2030/01/01 00:02:00 -0500","original":"12:01 a.m.","granularity":"min","time":"2030/01/01 00:01:00 -0500"},"date":{"end_time":"2011/09/18 00:00:00 -0400","original":"9/17/11","granularity":"day","time":"2011/09/17 00:00:00 -0400"},"description":"Theft of unattended purse in bar","longitude":-122.4192191,"crime type":"Theft","id":"a6o8ttr3qkrj","address":"19th Street and Mission, San Francisco, CA"},"type":"Feature","geometry":{"type":"Point","coordinates":[-122.4192191,37.7602375]}},{"properties":{"latitude":37.7660378,"time":{"end_time":"2030/01/01 20:46:00 -0500","original":"8:45 p.m.","granularity":"min","time":"2030/01/01 20:45:00 -0500"},"date":{"end_time":"2011/09/18 00:00:00 -0400","original":"9/17/11","granularity":"day","time":"2011/09/17 00:00:00 -0400"},"description":"Theft of unattended purse","longitude":-122.4306933,"crime type":"Theft","id":"a6o8ttuc2n01","address":"15th Street and Market, San Francisco, CA"},"type":"Feature","geometry":{"type":"Point","coordinates":[-122.4306933,37.7660378]}},{"properties":{"latitude":37.7597548,"time":{"end_time":"2030/01/01 18:52:00 -0500","original":"6:51 p.m.","granularity":"min","time":"2030/01/01 18:51:00 -0500"},"date":{"end_time":"2011/09/18 00:00:00 -0400","original":"9/17/11","granularity":"day","time":"2011/09/17 00:00:00 -0400"},"description":"Dog bite","longitude":-122.4270638,"crime type":"Unknown","id":"a6o8ttvzvq9k","address":"Dolores Park, San Francisco, CA"},"type":"Feature","geometry":{"type":"Point","coordinates":[-122.4270638,37.7597548]}},{"properties":{"latitude":37.7649169,"time":{"end_time":"2030/01/01 23:00:00 -0500","original":"10:00 p.m.","granularity":"hour","time":"2030/01/01 22:00:00 -0500"},"date":{"end_time":"2011/09/18 00:00:00 -0400","original":"9/17/11","granularity":"day","time":"2011/09/17 00:00:00 -0400"},"description":"Malicious mischief, vehicle","longitude":-122.421886,"crime type":"Vandalism","id":"a6o8tu003bkp","address":"16th Street and Valencia, San Francisco, CA"},"type":"Feature","geometry":{"type":"Point","coordinates":[-122.421886,37.7649169]}},{"properties":{"latitude":37.7522494,"time":{"end_time":"2030/01/01 13:11:00 -0500","original":"1:10 p.m.","granularity":"min","time":"2030/01/01 13:10:00 -0500"},"date":{"end_time":"2011/09/19 00:00:00 -0400","original":"9/18/11","granularity":"day","time":"2011/09/18 00:00:00 -0400"},"description":"Aggravated assault, force","longitude":-122.4184567,"crime type":"Aggravated Assault","id":"a6o8ttxkjcj6","address":"24th Street and Mission, San Francisco, CA"},"type":"Feature","geometry":{"type":"Point","coordinates":[-122.4184567,37.7522494]}},{"properties":{"latitude":37.7599661,"time":{"end_time":"2030/01/01 07:31:00 -0500","original":"7:30 a.m.","granularity":"min","time":"2030/01/01 07:30:00 -0500"},"date":{"end_time":"2011/09/19 00:00:00 -0400","original":"9/18/11","granularity":"day","time":"2011/09/18 00:00:00 -0400"},"description":"Stolen Auto","longitude":-122.4236983,"crime type":"Auto Theft","id":"a6o8tty6lfil","address":"19th Street and Guerrero, San Francisco, CA"},"type":"Feature","geometry":{"type":"Point","coordinates":[-122.4236983,37.7599661]}},{"properties":{"latitude":37.7540389,"time":{"end_time":"2030/01/01 12:16:00 -0500","original":"12:15 p.m.","granularity":"min","time":"2030/01/01 12:15:00 -0500"},"date":{"end_time":"2011/09/19 00:00:00 -0400","original":"9/18/11","granularity":"day","time":"2011/09/18 00:00:00 -0400"},"description":"Battery","longitude":-122.41532,"crime type":"Battery","id":"a6o8ttyd5tbq","address":"23rd Street and Shotwell, San Francisco, CA"},"type":"Feature","geometry":{"type":"Point","coordinates":[-122.41532,37.7540389]}},{"properties":{"latitude":37.7634959,"time":{"end_time":"2030/01/01 04:00:00 -0500","original":"3:00 a.m.","granularity":"hour","time":"2030/01/01 03:00:00 -0500"},"date":{"end_time":"2011/09/19 00:00:00 -0400","original":"9/18/11","granularity":"day","time":"2011/09/18 00:00:00 -0400"},"description":"Bicycle theft","longitude":-122.418484,"crime type":"Bicycle Theft","id":"a6o8ttnd7brb","address":"17th Street and Capp, San Francisco, CA"},"type":"Feature","geometry":{"type":"Point","coordinates":[-122.418484,37.7634959]}},{"properties":{"latitude":37.7586337,"time":{"end_time":"2030/01/01 16:31:00 -0500","original":"4:30 p.m.","granularity":"min","time":"2030/01/01 16:30:00 -0500"},"date":{"end_time":"2011/09/19 00:00:00 -0400","original":"9/18/11","granularity":"day","time":"2011/09/18 00:00:00 -0400"},"description":"Bicycle theft","longitude":-122.4190627,"crime type":"Bicycle Theft","id":"a6o8tttdfez5","address":"20th Street and Mission, San Francisco, CA"},"type":"Feature","geometry":{"type":"Point","coordinates":[-122.4190627,37.7586337]}},{"properties":{"latitude":37.7570986,"time":{"end_time":"2030/01/01 04:31:00 -0500","original":"4:30 a.m.","granularity":"min","time":"2030/01/01 04:30:00 -0500"},"date":{"end_time":"2011/09/19 00:00:00 -0400","original":"9/18/11","granularity":"day","time":"2011/09/18 00:00:00 -0400"},"description":"Auto burglary","longitude":-122.4178225,"crime type":"Burglary - Vehicle","id":"a6o8ttu4pfm2","address":"21st Street and Capp, San Francisco, CA"},"type":"Feature","geometry":{"type":"Point","coordinates":[-122.4178225,37.7570986]}},{"properties":{"latitude":37.7634362,"time":{"end_time":"2030/01/01 07:50:00 -0500","original":"7:49 a.m.","granularity":"min","time":"2030/01/01 07:49:00 -0500"},"date":{"end_time":"2011/09/19 00:00:00 -0400","original":"9/18/11","granularity":"day","time":"2011/09/18 00:00:00 -0400"},"description":"Domestic violence","longitude":-122.4195226,"crime type":"Domestic Violence","id":"a6o8tu00p53e","address":"17th Street and Mission, San Francisco, CA"},"type":"Feature","geometry":{"type":"Point","coordinates":[-122.4195226,37.7634362]}},{"properties":{"latitude":37.7484894,"time":{"end_time":"2030/01/01 10:31:00 -0500","original":"10:30 a.m.","granularity":"min","time":"2030/01/01 10:30:00 -0500"},"date":{"end_time":"2011/09/19 00:00:00 -0400","original":"9/18/11","granularity":"day","time":"2011/09/18 00:00:00 -0400"},"description":"Stolen Motorcycle","longitude":-122.4077793,"crime type":"Motorcycle Theft","id":"a6o8ttsayvch","address":"York Street and Cesar Chavez, San Francisco, CA"},"type":"Feature","geometry":{"type":"Point","coordinates":[-122.4077793,37.7484894]}},{"properties":{"latitude":37.7634362,"time":{"end_time":"2030/01/01 02:00:00 -0500","original":"1:00 a.m.","granularity":"hour","time":"2030/01/01 01:00:00 -0500"},"date":{"end_time":"2011/09/19 00:00:00 -0400","original":"9/18/11","granularity":"day","time":"2011/09/18 00:00:00 -0400"},"description":"Robbery, knife","longitude":-122.4195226,"crime type":"Robbery","id":"a6o8ttq2nqi7","address":"17th Street and Mission, San Francisco, CA"},"type":"Feature","geometry":{"type":"Point","coordinates":[-122.4195226,37.7634362]}},{"properties":{"latitude":37.7654522,"time":{"end_time":"2030/01/01 02:56:00 -0500","original":"2:55 a.m.","granularity":"min","time":"2030/01/01 02:55:00 -0500"},"date":{"end_time":"2011/09/19 00:00:00 -0400","original":"9/18/11","granularity":"day","time":"2011/09/18 00:00:00 -0400"},"description":"Malicious Mischief, graffiti","longitude":-122.4131332,"crime type":"Vandalism","id":"a6o8tu0rfgpf","address":"16th Street and Harrison, San Francisco, CA"},"type":"Feature","geometry":{"type":"Point","coordinates":[-122.4131332,37.7654522]}},{"properties":{"latitude":37.768016,"time":{"end_time":"2030/01/01 19:28:00 -0500","original":"7:27 p.m.","granularity":"min","time":"2030/01/01 19:27:00 -0500"},"date":{"end_time":"2011/09/20 00:00:00 -0400","original":"9/19/11","granularity":"day","time":"2011/09/19 00:00:00 -0400"},"description":"Aggravated assault, gun","longitude":-122.4243503,"crime type":"Aggravated Assault","id":"a6o8ttol7g1q","address":"14th Street and Guerrero, San Francisco, CA"},"type":"Feature","geometry":{"type":"Point","coordinates":[-122.4243503,37.768016]}},{"properties":{"latitude":37.7749295,"time":{"end_time":"2030/01/01 09:00:00 -0500","original":"8:00 a.m.","granularity":"hour","time":"2030/01/01 08:00:00 -0500"},"date":{"end_time":"2011/09/20 00:00:00 -0400","original":"9/19/11","granularity":"day","time":"2011/09/19 00:00:00 -0400"},"description":"Stolen Auto","longitude":-122.4194155,"crime type":"Auto Theft","id":"a6o8ttui77oc","address":"23rd Street and San Jose, San Francisco, CA"},"type":"Feature","geometry":{"type":"Point","coordinates":[-122.4194155,37.7749295]}},{"properties":{"latitude":37.7569019,"time":{"end_time":"2030/01/01 12:41:00 -0500","original":"12:40 p.m.","granularity":"min","time":"2030/01/01 12:40:00 -0500"},"date":{"end_time":"2011/09/20 00:00:00 -0400","original":"9/19/11","granularity":"day","time":"2011/09/19 00:00:00 -0400"},"description":"Stolen Auto","longitude":-122.421118,"crime type":"Auto Theft","id":"a6o8ttymihki","address":"21st Street and Valencia, San Francisco, CA"},"type":"Feature","geometry":{"type":"Point","coordinates":[-122.421118,37.7569019]}},{"properties":{"latitude":37.76654,"time":{"end_time":"2030/01/01 11:14:00 -0500","original":"11:13 a.m.","granularity":"min","time":"2030/01/01 11:13:00 -0500"},"date":{"end_time":"2011/09/20 00:00:00 -0400","original":"9/19/11","granularity":"day","time":"2011/09/19 00:00:00 -0400"},"description":"Criminal threats","longitude":-122.422044,"crime type":"Unknown","id":"a6o8tu00qwfy","address":"15th Street and Valencia, San Francisco, CA"},"type":"Feature","geometry":{"type":"Point","coordinates":[-122.422044,37.76654]}},{"properties":{"latitude":37.7633,"time":{"end_time":"2030/01/01 21:11:00 -0500","original":"9:10 p.m.","granularity":"min","time":"2030/01/01 21:10:00 -0500"},"date":{"end_time":"2011/09/20 00:00:00 -0400","original":"9/19/11","granularity":"day","time":"2011/09/19 00:00:00 -0400"},"description":"Criminal threats","longitude":-122.421732,"crime type":"Unknown","id":"a6o8ttvxkyl1","address":"17th Street and Valencia, San Francisco, CA"},"type":"Feature","geometry":{"type":"Point","coordinates":[-122.421732,37.7633]}},{"properties":{"latitude":37.757298,"time":{"end_time":"2030/01/01 17:31:00 -0500","original":"5:30 p.m.","granularity":"min","time":"2030/01/01 17:30:00 -0500"},"date":{"end_time":"2011/09/21 00:00:00 -0400","original":"9/20/11","granularity":"day","time":"2011/09/20 00:00:00 -0400"},"description":"Burglary of garage","longitude":-122.414541,"crime type":"Burglary - Home","id":"a6o8ttnzvkbp","address":"21st Street and Folsom, San Francisco, CA"},"type":"Feature","geometry":{"type":"Point","coordinates":[-122.414541,37.757298]}},{"properties":{"latitude":37.7633,"time":{"end_time":"2030/01/01 20:41:00 -0500","original":"8:40 p.m.","granularity":"min","time":"2030/01/01 20:40:00 -0500"},"date":{"end_time":"2011/09/21 00:00:00 -0400","original":"9/20/11","granularity":"day","time":"2011/09/20 00:00:00 -0400"},"description":"Auto burglary","longitude":-122.421732,"crime type":"Burglary - Vehicle","id":"a6o8ttwk5rrj","address":"17th Street and Valencia, San Francisco, CA"},"type":"Feature","geometry":{"type":"Point","coordinates":[-122.421732,37.7633]}},{"properties":{"latitude":37.753776,"time":{"end_time":"2030/01/01 20:41:00 -0500","original":"8:40 p.m.","granularity":"min","time":"2030/01/01 20:40:00 -0500"},"date":{"end_time":"2011/09/21 00:00:00 -0400","original":"9/20/11","granularity":"day","time":"2011/09/20 00:00:00 -0400"},"description":"Auto burglary","longitude":-122.4197059,"crime type":"Burglary - Vehicle","id":"a6o8ttryucfx","address":"23rd Street and Bartlett, San Francisco, CA"},"type":"Feature","geometry":{"type":"Point","coordinates":[-122.4197059,37.753776]}},{"properties":{"latitude":37.7522494,"time":{"end_time":"2030/01/01 23:06:00 -0500","original":"11:05 p.m.","granularity":"min","time":"2030/01/01 23:05:00 -0500"},"date":{"end_time":"2011/09/21 00:00:00 -0400","original":"9/20/11","granularity":"day","time":"2011/09/20 00:00:00 -0400"},"description":"Robbery, restaurant","longitude":-122.4184567,"crime type":"Robbery","id":"a6o8ttttrvke","address":"24th Street and Mission, San Francisco, CA"},"type":"Feature","geometry":{"type":"Point","coordinates":[-122.4184567,37.7522494]}},{"properties":{"latitude":37.7602375,"time":{"end_time":"2030/01/01 00:16:00 -0500","original":"12:15 a.m.","granularity":"min","time":"2030/01/01 00:15:00 -0500"},"date":{"end_time":"2011/09/21 00:00:00 -0400","original":"9/20/11","granularity":"day","time":"2011/09/20 00:00:00 -0400"},"description":"Theft of unattended laptop in bar","longitude":-122.4192191,"crime type":"Theft","id":"a6o8ttzjq4wa","address":"19th Street and Mission, San Francisco, CA"},"type":"Feature","geometry":{"type":"Point","coordinates":[-122.4192191,37.7602375]}},{"properties":{"latitude":37.76654,"time":{"end_time":"2030/01/01 08:21:00 -0500","original":"8:20 a.m.","granularity":"min","time":"2030/01/01 08:20:00 -0500"},"date":{"end_time":"2011/09/21 00:00:00 -0400","original":"9/20/11","granularity":"day","time":"2011/09/20 00:00:00 -0400"},"description":"Criminal threats","longitude":-122.422044,"crime type":"Unknown","id":"a6o8ttwyrak3","address":"15th Street and Valencia, San Francisco, CA"},"type":"Feature","geometry":{"type":"Point","coordinates":[-122.422044,37.76654]}},{"properties":{"latitude":37.7570986,"time":{"end_time":"2030/01/01 21:31:00 -0500","original":"9:30 p.m.","granularity":"min","time":"2030/01/01 21:30:00 -0500"},"date":{"end_time":"2011/09/21 00:00:00 -0400","original":"9/20/11","granularity":"day","time":"2011/09/20 00:00:00 -0400"},"description":"Malicious mischief, bb gun","longitude":-122.4178225,"crime type":"Unknown","id":"a6o8ttvh1e20","address":"21st Street and Capp, San Francisco, CA"},"type":"Feature","geometry":{"type":"Point","coordinates":[-122.4178225,37.7570986]}},{"properties":{"latitude":37.7599661,"time":{"end_time":"2030/01/01 15:31:00 -0500","original":"3:30 p.m.","granularity":"min","time":"2030/01/01 15:30:00 -0500"},"date":{"end_time":"2011/09/21 00:00:00 -0400","original":"9/20/11","granularity":"day","time":"2011/09/20 00:00:00 -0400"},"description":"Malicious mischief","longitude":-122.4236983,"crime type":"Vandalism","id":"a6o8ttnqryyg","address":"19th Street and Guerrero, San Francisco, CA"},"type":"Feature","geometry":{"type":"Point","coordinates":[-122.4236983,37.7599661]}},{"properties":{"latitude":37.7603666,"time":{"end_time":"2030/01/01 16:51:00 -0500","original":"4:50 p.m.","granularity":"min","time":"2030/01/01 16:50:00 -0500"},"date":{"end_time":"2011/09/22 00:00:00 -0400","original":"9/21/11","granularity":"day","time":"2011/09/21 00:00:00 -0400"},"description":"Aggravated assault","longitude":-122.417033,"crime type":"Aggravated Assault","id":"a6o8ttsxv9fe","address":"19th Street and South Van Ness, San Francisco, CA"},"type":"Feature","geometry":{"type":"Point","coordinates":[-122.417033,37.7603666]}},{"properties":{"latitude":37.75244,"time":{"end_time":"2030/01/01 00:09:00 -0500","original":"12:08 a.m.","granularity":"min","time":"2030/01/01 00:08:00 -0500"},"date":{"end_time":"2011/09/22 00:00:00 -0400","original":"9/21/11","granularity":"day","time":"2011/09/21 00:00:00 -0400"},"description":"Sale of alcohol to a minor","longitude":-122.415172,"crime type":"Alcohol","id":"a6o8tto62b6g","address":"24th Street and Shotwell, San Francisco, CA"},"type":"Feature","geometry":{"type":"Point","coordinates":[-122.415172,37.75244]}},{"properties":{"latitude":37.74806,"time":{"end_time":"2030/01/01 22:00:00 -0500","original":"9:00 p.m.","granularity":"hour","time":"2030/01/01 21:00:00 -0500"},"date":{"end_time":"2011/09/22 00:00:00 -0400","original":"9/21/11","granularity":"day","time":"2011/09/21 00:00:00 -0400"},"description":"Stolen Auto","longitude":-122.4202659,"crime type":"Auto Theft","id":"a6o8ttqc6wpr","address":"Valencia Street and Cesar Chavez, San Francisco, CA"},"type":"Feature","geometry":{"type":"Point","coordinates":[-122.4202659,37.74806]}},{"properties":{"latitude":37.753776,"time":{"end_time":"2030/01/01 15:33:00 -0500","original":"3:32 p.m.","granularity":"min","time":"2030/01/01 15:32:00 -0500"},"date":{"end_time":"2011/09/22 00:00:00 -0400","original":"9/21/11","granularity":"day","time":"2011/09/21 00:00:00 -0400"},"description":"Bicycle theft","longitude":-122.4197059,"crime type":"Bicycle Theft","id":"a6o8tto5m41z","address":"23rd Street and Bartlett, San Francisco, CA"},"type":"Feature","geometry":{"type":"Point","coordinates":[-122.4197059,37.753776]}},{"properties":{"latitude":37.757233,"time":{"end_time":"2030/01/01 22:48:00 -0500","original":"10:47 p.m.","granularity":"min","time":"2030/01/01 22:47:00 -0500"},"date":{"end_time":"2011/09/22 00:00:00 -0400","original":"9/21/11","granularity":"day","time":"2011/09/21 00:00:00 -0400"},"description":"Burglary, Non-residential","longitude":-122.4156458,"crime type":"Burglary - Commercial","id":"a6o8tto3ae0i","address":"21st Street and Shotwell, San Francisco, CA"},"type":"Feature","geometry":{"type":"Point","coordinates":[-122.4156458,37.757233]}},{"properties":{"latitude":37.75423,"time":{"end_time":"2030/01/01 06:21:00 -0500","original":"6:20 a.m.","granularity":"min","time":"2030/01/01 06:20:00 -0500"},"date":{"end_time":"2011/09/22 00:00:00 -0400","original":"9/21/11","granularity":"day","time":"2011/09/21 00:00:00 -0400"},"description":"Auto burglary","longitude":-122.412047,"crime type":"Burglary - Vehicle","id":"a6o8tu36m5so","address":"23rd Street and Harrison, San Francisco, CA"},"type":"Feature","geometry":{"type":"Point","coordinates":[-122.412047,37.75423]}},{"properties":{"latitude":37.757298,"time":{"end_time":"2030/01/01 09:31:00 -0500","original":"9:30 a.m.","granularity":"min","time":"2030/01/01 09:30:00 -0500"},"date":{"end_time":"2011/09/22 00:00:00 -0400","original":"9/21/11","granularity":"day","time":"2011/09/21 00:00:00 -0400"},"description":"Auto burglary","longitude":-122.414541,"crime type":"Burglary - Vehicle","id":"a6o8ttv0izdf","address":"21st Street and Folsom, San Francisco, CA"},"type":"Feature","geometry":{"type":"Point","coordinates":[-122.414541,37.757298]}},{"properties":{"latitude":37.764977,"time":{"end_time":"2030/01/01 02:00:00 -0500","original":"1:00 a.m.","granularity":"hour","time":"2030/01/01 01:00:00 -0500"},"date":{"end_time":"2011/09/22 00:00:00 -0400","original":"9/21/11","granularity":"day","time":"2011/09/21 00:00:00 -0400"},"description":"Auto burglary","longitude":-122.420901,"crime type":"Burglary - Vehicle","id":"a6o8tttore1f","address":"16th Street and Julian, San Francisco, CA"},"type":"Feature","geometry":{"type":"Point","coordinates":[-122.420901,37.764977]}},{"properties":{"latitude":37.760429,"time":{"end_time":"2030/01/01 16:00:00 -0500","original":"3:00 p.m.","granularity":"hour","time":"2030/01/01 15:00:00 -0500"},"date":{"end_time":"2011/09/22 00:00:00 -0400","original":"9/21/11","granularity":"day","time":"2011/09/21 00:00:00 -0400"},"description":"Auto burglary","longitude":-122.4159465,"crime type":"Burglary - Vehicle","id":"a6o8ttxjugyf","address":"19th Street and Shotwell, San Francisco, CA"},"type":"Feature","geometry":{"type":"Point","coordinates":[-122.4159465,37.760429]}},{"properties":{"latitude":37.7634362,"time":{"end_time":"2030/01/01 17:36:00 -0500","original":"5:35 p.m.","granularity":"min","time":"2030/01/01 17:35:00 -0500"},"date":{"end_time":"2011/09/22 00:00:00 -0400","original":"9/21/11","granularity":"day","time":"2011/09/21 00:00:00 -0400"},"description":"Domestic violence","longitude":-122.4195226,"crime type":"Domestic Violence","id":"a6o8ttwpep72","address":"17th Street and Mission, San Francisco, CA"},"type":"Feature","geometry":{"type":"Point","coordinates":[-122.4195226,37.7634362]}},{"properties":{"latitude":37.7682114,"time":{"end_time":"2030/01/01 09:16:00 -0500","original":"9:15 a.m.","granularity":"min","time":"2030/01/01 09:15:00 -0500"},"date":{"end_time":"2011/09/22 00:00:00 -0400","original":"9/21/11","granularity":"day","time":"2011/09/21 00:00:00 -0400"},"description":"Defrauding a merchant","longitude":-122.4212167,"crime type":"Fraud","id":"a6o8ttyugsuk","address":"14th Street and Julian, San Francisco, CA"},"type":"Feature","geometry":{"type":"Point","coordinates":[-122.4212167,37.7682114]}},{"properties":{"latitude":37.755699,"time":{"end_time":"2030/01/01 10:31:00 -0500","original":"10:30 a.m.","granularity":"min","time":"2030/01/01 10:30:00 -0500"},"date":{"end_time":"2011/09/22 00:00:00 -0400","original":"9/21/11","granularity":"day","time":"2011/09/21 00:00:00 -0400"},"description":"Theft from vending machine","longitude":-122.414388,"crime type":"Theft","id":"a6o8ttyha82o","address":"22nd Street and Folsom, San Francisco, CA"},"type":"Feature","geometry":{"type":"Point","coordinates":[-122.414388,37.755699]}},{"properties":{"latitude":37.7634362,"time":{"end_time":"2030/01/01 02:41:00 -0500","original":"2:40 a.m.","granularity":"min","time":"2030/01/01 02:40:00 -0500"},"date":{"end_time":"2011/09/23 00:00:00 -0400","original":"9/22/11","granularity":"day","time":"2011/09/22 00:00:00 -0400"},"description":"Aggragated assault","longitude":-122.4195226,"crime type":"Aggravated Assault","id":"a6o8ttt3pccz","address":"17th Street and Mission, San Francisco, CA"},"type":"Feature","geometry":{"type":"Point","coordinates":[-122.4195226,37.7634362]}},{"properties":{"latitude":37.7749295,"time":{"end_time":"2030/01/01 09:31:00 -0500","original":"9:30 a.m.","granularity":"min","time":"2030/01/01 09:30:00 -0500"},"date":{"end_time":"2011/09/23 00:00:00 -0400","original":"9/22/11","granularity":"day","time":"2011/09/22 00:00:00 -0400"},"description":"Stolen Auto","longitude":-122.4194155,"crime type":"Auto Theft","id":"a6o8ttp6seqk","address":"20th Street and Bartlett, San Francisco, CA"},"type":"Feature","geometry":{"type":"Point","coordinates":[-122.4194155,37.7749295]}},{"properties":{"latitude":37.7522494,"time":{"end_time":"2030/01/01 15:00:00 -0500","original":"2:00 p.m.","granularity":"hour","time":"2030/01/01 14:00:00 -0500"},"date":{"end_time":"2011/09/23 00:00:00 -0400","original":"9/22/11","granularity":"day","time":"2011/09/22 00:00:00 -0400"},"description":"Bicycle theft","longitude":-122.4184567,"crime type":"Bicycle Theft","id":"a6o8ttsnms7u","address":"24th Street and Mission, San Francisco, CA"},"type":"Feature","geometry":{"type":"Point","coordinates":[-122.4184567,37.7522494]}},{"properties":{"latitude":37.7633241,"time":{"end_time":"2030/01/01 21:57:00 -0500","original":"9:56 p.m.","granularity":"min","time":"2030/01/01 21:56:00 -0500"},"date":{"end_time":"2011/09/23 00:00:00 -0400","original":"9/22/11","granularity":"day","time":"2011/09/22 00:00:00 -0400"},"description":"Attempted burglary","longitude":-122.4055851,"crime type":"Burglary - Home","id":"a6o8ttu3d623","address":"Mariposa Street and San Bruno, San Francisco, CA"},"type":"Feature","geometry":{"type":"Point","coordinates":[-122.4055851,37.7633241]}},{"properties":{"latitude":37.7634362,"time":{"end_time":"2030/01/01 12:21:00 -0500","original":"12:20 p.m.","granularity":"min","time":"2030/01/01 12:20:00 -0500"},"date":{"end_time":"2011/09/23 00:00:00 -0400","original":"9/22/11","granularity":"day","time":"2011/09/22 00:00:00 -0400"},"description":"Auto burglary","longitude":-122.4195226,"crime type":"Burglary - Vehicle","id":"a6o8ttpwx1yf","address":"17th Street and Mission, San Francisco, CA"},"type":"Feature","geometry":{"type":"Point","coordinates":[-122.4195226,37.7634362]}},{"properties":{"latitude":37.754337,"time":{"end_time":"2030/01/01 23:00:00 -0500","original":"10:00 p.m.","granularity":"hour","time":"2030/01/01 22:00:00 -0500"},"date":{"end_time":"2011/09/23 00:00:00 -0400","original":"9/22/11","granularity":"day","time":"2011/09/22 00:00:00 -0400"},"description":"Stolen Motorcycle","longitude":-122.405454,"crime type":"Motorcycle Theft","id":"a6o8ttumaigh","address":"23rd Street and Utah, San Francisco, CA"},"type":"Feature","geometry":{"type":"Point","coordinates":[-122.405454,37.754337]}},{"properties":{"latitude":37.752214,"time":{"end_time":"2030/01/01 07:16:00 -0500","original":"7:15 a.m.","granularity":"min","time":"2030/01/01 07:15:00 -0500"},"date":{"end_time":"2011/09/23 00:00:00 -0400","original":"9/22/11","granularity":"day","time":"2011/09/22 00:00:00 -0400"},"description":"Theft of unattended laptop in bar","longitude":-122.4190191,"crime type":"Theft","id":"a6o8ttwju5xb","address":"24th Street and Osage, San Francisco, CA"},"type":"Feature","geometry":{"type":"Point","coordinates":[-122.4190191,37.752214]}},{"properties":{"latitude":37.7633,"time":{"end_time":"2030/01/01 16:04:00 -0500","original":"4:03 p.m.","granularity":"min","time":"2030/01/01 16:03:00 -0500"},"date":{"end_time":"2011/09/23 00:00:00 -0400","original":"9/22/11","granularity":"day","time":"2011/09/22 00:00:00 -0400"},"description":"Petty theft, shoplifting","longitude":-122.421732,"crime type":"Theft","id":"a6o8ttt8o1ga","address":"17th Street and Valencia, San Francisco, CA"},"type":"Feature","geometry":{"type":"Point","coordinates":[-122.421732,37.7633]}},{"properties":{"latitude":37.7620986,"time":{"end_time":"2030/01/01 16:31:00 -0500","original":"4:30 p.m.","granularity":"min","time":"2030/01/01 16:30:00 -0500"},"date":{"end_time":"2011/09/23 00:00:00 -0400","original":"9/22/11","granularity":"day","time":"2011/09/22 00:00:00 -0400"},"description":"Theft of ladders","longitude":-122.415008,"crime type":"Theft","id":"a6o8ttubte01","address":"18th Street and Folsom, San Francisco, CA"},"type":"Feature","geometry":{"type":"Point","coordinates":[-122.415008,37.7620986]}},{"properties":{"latitude":37.7643703,"time":{"end_time":"2030/01/01 08:00:00 -0500","original":"7:00 a.m.","granularity":"hour","time":"2030/01/01 07:00:00 -0500"},"date":{"end_time":"2011/09/23 00:00:00 -0400","original":"9/22/11","granularity":"day","time":"2011/09/22 00:00:00 -0400"},"description":"Malicoius mischief, vehicle","longitude":-122.430904,"crime type":"Vandalism","id":"a6o8tu29aw8p","address":"16th Street and Sanchez, San Francisco, CA"},"type":"Feature","geometry":{"type":"Point","coordinates":[-122.430904,37.7643703]}},{"properties":{"latitude":37.7567582,"time":{"end_time":"2030/01/01 07:11:00 -0500","original":"7:10 a.m.","granularity":"min","time":"2030/01/01 07:10:00 -0500"},"date":{"end_time":"2011/09/23 00:00:00 -0400","original":"9/22/11","granularity":"day","time":"2011/09/22 00:00:00 -0400"},"description":"Malicious mischief","longitude":-122.42341,"crime type":"Vandalism","id":"a6o8tu1f9gzy","address":"21st Street and Guerrero, San Francisco, CA"},"type":"Feature","geometry":{"type":"Point","coordinates":[-122.42341,37.7567582]}},{"properties":{"latitude":38.68155,"time":{"end_time":"2030/01/01 15:31:00 -0500","original":"3:30 p.m.","granularity":"min","time":"2030/01/01 15:30:00 -0500"},"date":{"end_time":"2011/09/24 00:00:00 -0400","original":"9/23/11","granularity":"day","time":"2011/09/23 00:00:00 -0400"},"description":"Stolen Auto","longitude":-121.163264,"crime type":"Auto Theft","id":"a6o8ttvyc779","address":"Folsom &amp; Cesar Chavez, San Francisco, CA"},"type":"Feature","geometry":{"type":"Point","coordinates":[-121.163264,38.68155]}},{"properties":{"latitude":35.325272,"time":{"end_time":"2030/01/01 08:00:00 -0500","original":"7:00 a.m.","granularity":"hour","time":"2030/01/01 07:00:00 -0500"},"date":{"end_time":"2011/09/24 00:00:00 -0400","original":"9/23/11","granularity":"day","time":"2011/09/23 00:00:00 -0400"},"description":"Stolen Auto","longitude":-94.412758,"crime type":"Auto Theft","id":"a6o8tu09q7en","address":"21st &amp; Hampshire , San Francisco, CA"},"type":"Feature","geometry":{"type":"Point","coordinates":[-94.412758,35.325272]}},{"properties":{"latitude":35.325272,"time":{"end_time":"2030/01/01 17:00:00 -0500","original":"4 p.m.","granularity":"hour","time":"2030/01/01 16:00:00 -0500"},"date":{"end_time":"2011/09/24 00:00:00 -0400","original":"9/23/11","granularity":"day","time":"2011/09/23 00:00:00 -0400"},"description":"Stolen Auto","longitude":-94.412758,"crime type":"Auto Theft","id":"a6o8ttqbi8sy","address":"21st &amp; Hampshire, San Francisco, CA"},"type":"Feature","geometry":{"type":"Point","coordinates":[-94.412758,35.325272]}},{"properties":{"latitude":40.738808,"time":{"end_time":"2030/01/01 13:31:00 -0500","original":"01:30 p.m.","granularity":"min","time":"2030/01/01 13:30:00 -0500"},"date":{"end_time":"2011/09/24 00:00:00 -0400","original":"9/23/11","granularity":"day","time":"2011/09/23 00:00:00 -0400"},"description":"Stolen Auto","longitude":-73.983086,"crime type":"Auto Theft","id":"a6o8ttpl5pto","address":"23rd &amp; Harrison , San Francisco, CA"},"type":"Feature","geometry":{"type":"Point","coordinates":[-73.983086,40.738808]}},{"properties":{"latitude":37.639495,"time":{"end_time":"2030/01/01 09:00:00 -0500","original":"8:00 a.m.","granularity":"hour","time":"2030/01/01 08