{"type":"FeatureCollection","data_type":"Dataset Analysis","url_type":null,"permissions":[{"permissions":{"download":true,"view":true},"group_id":"everyone"}],"classification":null,"title":"Dataset from 'U.S. Special Operations in Afghanistan since 2001 ' with a 5miles buffer","count":147,"stream_id":180234,"contributor":{"url":"http://geocommons.com/users/36343","name":"NJH24"},"data_attributes":null,"calculation_params":[{"calculation":"buffer","input":{"ds1":"179656","unit":"miles","distance":"5"}}],"icon_link":null,"link":"http://geocommons.com/overlays/180234.json","extent":[62.0456,31.0463,74.2577,37.3334],"geometry_types":["area"],"unique_name":null,"name":"Dataset from 'U.S. Special Operations in Afghanistan since 2001 ' with a 5miles buffer","feature_count":147,"description":"Dataset created by adding a buffer of 5miles around the features in 'U.S. Special Operations in Afghanistan since 2001 '","next_feature":null,"is_raster":false,"short_classification":"Y","stats":{"latitude":{"max":37.26093815,"variance":2.32029402122011,"mean":33.3417570340262,"stdev":1.52325113530899,"min":31.1187944,"median":33.33445},"date":{"max":"2030/12/01 00:00:00 -0500","variance":7.38083575794477e+16,"mean":"2009/04/23 02:14:17 -0400","stdev":271676936.046194,"min":"2001/06/18 00:00:00 -0400","median":"2008/08/13 00:00:00 -0400"},"longitude":{"max":74.18518066,"variance":5.80497233552318,"mean":67.0727288852413,"stdev":2.40935101957419,"min":62.11807251,"median":66.26953125}},"features":[{"properties":{"militants killed":"2","latitude":32.54912838,"civilians killed":"Not available","mission type":"Direct action","date":{"end_time":"2001/06/19 00:00:00 -0400","original":"6/18/01","granularity":"day","time":"2001/06/18 00:00:00 -0400"},"what was employed":"AC-130 cannon fire","notes":"U.S. and allied forces came under small arms fire, then called in air support","captured/wounded":"Not available","types of units":"Afghan Allied Forces","area":"Shkin","contractors' involvement":"Not available","longitude":69.2578125,"id":"0","marker icon":"small_red","source":"6/18/02, \"U.S. Troops Kill Two in Afghan Clash,\" Agence France-Presse","u.s. personnel killed":"0"},"type":"Feature","geometry":{"type":"Polygon","coordinates":[[[69.3303054730133,32.54912838],[69.3289125408641,32.5349857025509],[69.3247872740179,32.5213865202649],[69.318088204166,32.5088534420907],[69.3090727728061,32.4978681071939],[69.2980874379093,32.488852675834],[69.2855543597351,32.4821536059821],[69.2719551774491,32.4780283391359],[69.2578125,32.4766354069867],[69.2436698225509,32.4780283391359],[69.2300706402649,32.4821536059821],[69.2175375620907,32.488852675834],[69.2065522271939,32.4978681071939],[69.197536795834,32.5088534420907],[69.1908377259821,32.5213865202649],[69.1867124591359,32.5349857025509],[69.1853195269867,32.54912838],[69.1867124591359,32.5632710574491],[69.1908377259821,32.5768702397351],[69.197536795834,32.5894033179093],[69.2065522271939,32.6003886528061],[69.2175375620907,32.609404084166],[69.2300706402649,32.6161031540179],[69.2436698225509,32.6202284208641],[69.2578125,32.6216213530133],[69.2719551774491,32.6202284208641],[69.2855543597351,32.6161031540179],[69.2980874379093,32.609404084166],[69.3090727728061,32.6003886528061],[69.318088204166,32.5894033179093],[69.3247872740179,32.5768702397351],[69.3289125408641,32.5632710574491],[69.3303054730133,32.54912838]]]}},{"properties":{"militants killed":"0","latitude":34.52918707,"civilians killed":"0","mission type":"Counterterrorism","date":{"end_time":"2001/09/27 00:00:00 -0400","original":"9/26/01","granularity":"day","time":"2001/09/26 00:00:00 -0400"},"what was employed":"Soviet MI-17 helicopter; $3 million in suitcases","notes":"Bribed local warlords","captured/wounded":"0","types of units":null,"area":"Kabul","contractors' involvement":"Not available","longitude":69.16786194,"id":"1","marker icon":"small_green","source":"02/03/2003, Time, \"CIA's Secret Army\"","u.s. personnel killed":"0"},"type":"Feature","geometry":{"type":"Polygon","coordinates":[[[69.2403549130133,34.52918707],[69.2389619808641,34.5150443925509],[69.2348367140178,34.5014452102649],[69.228137644166,34.4889121320907],[69.2191222128061,34.4779267971939],[69.2081368779093,34.468911365834],[69.1956037997351,34.4622122959821],[69.1820046174491,34.4580870291359],[69.16786194,34.4566940969867],[69.1537192625509,34.4580870291359],[69.1401200802649,34.4622122959821],[69.1275870020907,34.468911365834],[69.1166016671939,34.4779267971939],[69.107586235834,34.4889121320907],[69.1008871659821,34.5014452102649],[69.0967618991359,34.5150443925509],[69.0953689669867,34.52918707],[69.0967618991359,34.5433297474491],[69.1008871659821,34.5569289297351],[69.107586235834,34.5694620079093],[69.1166016671939,34.5804473428061],[69.1275870020907,34.589462774166],[69.1401200802649,34.5961618440179],[69.1537192625509,34.6002871108641],[69.16786194,34.6016800430133],[69.1820046174491,34.6002871108641],[69.1956037997351,34.5961618440179],[69.2081368779093,34.589462774166],[69.2191222128061,34.5804473428061],[69.228137644166,34.5694620079093],[69.2348367140178,34.5569289297351],[69.2389619808641,34.5433297474491],[69.2403549130133,34.52918707]]]}},{"properties":{"militants killed":"Not available","latitude":31.60865647,"civilians killed":"Not available","mission type":"Direct action","date":{"end_time":"2001/10/11 00:00:00 -0400","original":"10/10/01","granularity":"day","time":"2001/10/10 00:00:00 -0400"},"what was employed":"War planes, photo-reconnaissance Canberra PR9 aircraft","notes":"Daylight raids; first time RAFs were used","captured/wounded":"0","types of units":"unspecified US Military","area":"Kandahar","contractors' involvement":"Not available","longitude":65.76141357,"id":"2","marker icon":"small_red","source":"10/10/01, The Citizen, \"Fresh Daylight Raids on Taliban\"","u.s. personnel killed":"0"},"type":"Feature","geometry":{"type":"Polygon","coordinates":[[[65.8339065430133,31.60865647],[65.8325136108641,31.5945137925509],[65.8283883440179,31.5809146102649],[65.821689274166,31.5683815320907],[65.8126738428061,31.5573961971939],[65.8016885079093,31.548380765834],[65.7891554297351,31.5416816959821],[65.7755562474491,31.5375564291359],[65.76141357,31.5361634969867],[65.7472708925509,31.5375564291359],[65.7336717102649,31.5416816959821],[65.7211386320907,31.548380765834],[65.7101532971939,31.5573961971939],[65.701137865834,31.5683815320907],[65.6944387959822,31.5809146102649],[65.6903135291359,31.5945137925509],[65.6889205969867,31.60865647],[65.6903135291359,31.6227991474491],[65.6944387959822,31.6363983297351],[65.701137865834,31.6489314079093],[65.7101532971939,31.6599167428061],[65.7211386320907,31.668932174166],[65.7336717102649,31.6756312440179],[65.7472708925509,31.6797565108641],[65.76141357,31.6811494430133],[65.7755562474491,31.6797565108641],[65.7891554297351,31.6756312440179],[65.8016885079093,31.668932174166],[65.8126738428061,31.6599167428061],[65.821689274166,31.6489314079093],[65.8283883440179,31.6363983297351],[65.8325136108641,31.6227991474491],[65.8339065430133,31.60865647]]]}},{"properties":{"militants killed":"Unknown","latitude":31.60865647,"civilians killed":"0","mission type":"Direct action","date":{"end_time":"2001/10/16 00:00:00 -0400","original":"10/15/01","granularity":"day","time":"2001/10/15 00:00:00 -0400"},"what was employed":"AC-130 gunship, Predator, Global Hawk","notes":"Two AC-130s hit a Taliban military complex near Kandahar; one of the first public accounts of U.S. Special Operations in the region","captured/wounded":"0","types of units":null,"area":"Kandahar","contractors' involvement":"Not available","longitude":65.76141357,"id":"3","marker icon":"small_red","source":"10/16/01, ABC News' World News Tonight Newscast, \"Airplanes and Missiles Being Used in Afghanistan\"","u.s. personnel killed":"0"},"type":"Feature","geometry":{"type":"Polygon","coordinates":[[[65.8339065430133,31.60865647],[65.8325136108641,31.5945137925509],[65.8283883440179,31.5809146102649],[65.821689274166,31.5683815320907],[65.8126738428061,31.5573961971939],[65.8016885079093,31.548380765834],[65.7891554297351,31.5416816959821],[65.7755562474491,31.5375564291359],[65.76141357,31.5361634969867],[65.7472708925509,31.5375564291359],[65.7336717102649,31.5416816959821],[65.7211386320907,31.548380765834],[65.7101532971939,31.5573961971939],[65.701137865834,31.5683815320907],[65.6944387959822,31.5809146102649],[65.6903135291359,31.5945137925509],[65.6889205969867,31.60865647],[65.6903135291359,31.6227991474491],[65.6944387959822,31.6363983297351],[65.701137865834,31.6489314079093],[65.7101532971939,31.6599167428061],[65.7211386320907,31.668932174166],[65.7336717102649,31.6756312440179],[65.7472708925509,31.6797565108641],[65.76141357,31.6811494430133],[65.7755562474491,31.6797565108641],[65.7891554297351,31.6756312440179],[65.8016885079093,31.668932174166],[65.8126738428061,31.6599167428061],[65.821689274166,31.6489314079093],[65.8283883440179,31.6363983297351],[65.8325136108641,31.6227991474491],[65.8339065430133,31.60865647]]]}},{"properties":{"militants killed":"0","latitude":34.54870089,"civilians killed":"0","mission type":"Direct action","date":{"end_time":"2001/10/20 00:00:00 -0400","original":"10/19/01","granularity":"day","time":"2001/10/19 00:00:00 -0400"},"what was employed":"Ground troops","notes":"Launch of raids marked first engagement of U.S. against Taliban","captured/wounded":"0","types of units":null,"area":null,"contractors' involvement":"Not available","longitude":65.72845459,"id":"4","marker icon":"small_red","source":"10/19/01, Financial Times (UK), \"U.S. Elite Forces Start Ground War in Afghanistan\"","u.s. personnel killed":"0"},"type":"Feature","geometry":{"type":"Polygon","coordinates":[[[65.8009475630133,34.54870089],[65.7995546308641,34.5345582125509],[65.7954293640178,34.5209590302649],[65.788730294166,34.5084259520907],[65.7797148628061,34.4974406171939],[65.7687295279093,34.488425185834],[65.7561964497351,34.4817261159821],[65.7425972674491,34.4776008491359],[65.72845459,34.4762079169867],[65.7143119125509,34.4776008491359],[65.7007127302649,34.4817261159821],[65.6881796520907,34.488425185834],[65.6771943171939,34.4974406171939],[65.668178885834,34.5084259520907],[65.6614798159821,34.5209590302649],[65.6573545491359,34.5345582125509],[65.6559616169867,34.54870089],[65.6573545491359,34.5628435674491],[65.6614798159821,34.5764427497351],[65.668178885834,34.5889758279093],[65.6771943171939,34.5999611628061],[65.6881796520907,34.608976594166],[65.7007127302649,34.6156756640179],[65.7143119125509,34.6198009308641],[65.72845459,34.6211938630133],[65.7425972674491,34.6198009308641],[65.7561964497351,34.6156756640179],[65.7687295279093,34.608976594166],[65.7797148628061,34.5999611628061],[65.788730294166,34.5889758279093],[65.7954293640178,34.5764427497351],[65.7995546308641,34.5628435674491],[65.8009475630133,34.54870089]]]}},{"properties":{"militants killed":"25 Taliban fighters","latitude":31.1187944,"civilians killed":"0","mission type":"Direct Action","date":{"end_time":"2001/10/21 00:00:00 -0400","original":"10/20/01","granularity":"day","time":"2001/10/20 00:00:00 -0400"},"what was employed":"180 SOF (including over 100 Rangers) AC-130s, C-130s","notes":"First successful large scale night-time raid inside Taliban territory. Troops parachuted in and conducted operations taking out Taliban fighters","captured/wounded":"0","types of units":"Army Rangers","area":null,"contractors' involvement":"Not available","longitude":65.48400879,"id":"5","marker icon":"small_red","source":"10/21/01, The Sunday Herald, \"U.S. hails ground mission success; Video released after 180 paratroopers stage night raid in Taliban territory\"","u.s. personnel killed":"0"},"type":"Feature","geometry":{"type":"Polygon","coordinates":[[[65.5565017630133,31.1187944],[65.5551088308641,31.1046517225509],[65.5509835640179,31.0910525402649],[65.544284494166,31.0785194620907],[65.5352690628061,31.0675341271939],[65.5242837279093,31.058518695834],[65.5117506497351,31.0518196259821],[65.4981514674491,31.0476943591359],[65.48400879,31.0463014269867],[65.4698661125509,31.0476943591359],[65.4562669302649,31.0518196259821],[65.4437338520907,31.058518695834],[65.4327485171939,31.0675341271939],[65.423733085834,31.0785194620907],[65.4170340159822,31.0910525402649],[65.4129087491359,31.1046517225509],[65.4115158169867,31.1187944],[65.4129087491359,31.1329370774491],[65.4170340159822,31.1465362597351],[65.423733085834,31.1590693379093],[65.4327485171939,31.1700546728061],[65.4437338520907,31.179070104166],[65.4562669302649,31.1857691740179],[65.4698661125509,31.1898944408641],[65.48400879,31.1912873730133],[65.4981514674491,31.1898944408641],[65.5117506497351,31.1857691740179],[65.5242837279093,31.179070104166],[65.5352690628061,31.1700546728061],[65.544284494166,31.1590693379093],[65.5509835640179,31.1465362597351],[65.5551088308641,31.1329370774491],[65.5565017630133,31.1187944]]]}},{"properties":{"militants killed":"0","latitude":36.79279037,"civilians killed":"0","mission type":"Psychological Operations","date":{"end_time":"2030/11/02 00:00:00 -0400","original":"1-Nov","granularity":"day","time":"2030/11/01 00:00:00 -0400"},"what was employed":"Leaflets, radio broadcasts","notes":"Radio shows were broadcast from Commando Solo aircraft","captured/wounded":"0","types of units":null,"area":"Konduz","contractors' involvement":"Not available","longitude":68.80050659,"id":"6","marker icon":"small_purple","source":"10/15/01, Aviation Week, \"U.S. Stalks Taliban\"","u.s. personnel killed":"0"},"type":"Feature","geometry":{"type":"Polygon","coordinates":[[[68.8729995630133,36.79279037],[68.8716066308641,36.7786476925509],[68.8674813640178,36.7650485102649],[68.860782294166,36.7525154320907],[68.8517668628061,36.7415300971939],[68.8407815279093,36.732514665834],[68.8282484497351,36.7258155959821],[68.8146492674491,36.7216903291359],[68.80050659,36.7202973969867],[68.7863639125509,36.7216903291359],[68.7727647302649,36.7258155959821],[68.7602316520907,36.732514665834],[68.7492463171939,36.7415300971939],[68.740230885834,36.7525154320907],[68.7335318159821,36.7650485102649],[68.7294065491359,36.7786476925509],[68.7280136169867,36.79279037],[68.7294065491359,36.8069330474491],[68.7335318159821,36.8205322297351],[68.740230885834,36.8330653079093],[68.7492463171939,36.8440506428061],[68.7602316520907,36.853066074166],[68.7727647302649,36.8597651440179],[68.7863639125509,36.8638904108641],[68.80050659,36.8652833430133],[68.8146492674491,36.8638904108641],[68.8282484497351,36.8597651440179],[68.8407815279093,36.853066074166],[68.8517668628061,36.8440506428061],[68.860782294166,36.8330653079093],[68.8674813640178,36.8205322297351],[68.8716066308641,36.8069330474491],[68.8729995630133,36.79279037]]]}},{"properties":{"militants killed":"At least 500 Taliban fighters","latitude":36.71907232,"civilians killed":"Not available","mission type":"Direct action","date":{"end_time":"2001/11/12 00:00:00 -0500","original":"11/11/01","granularity":"day","time":"2001/11/11 00:00:00 -0500"},"what was employed":"Air strikes, Katyusha rockets","notes":"U.S. Special Forces worked with Northern Alliance to take over Taliban-run city","captured/wounded":"Not available","types of units":null,"area":"Mazar-e-Sharif","contractors' involvement":"Not available","longitude":67.11135864,"id":"7","marker icon":"small_red","source":"11/11/01, ABC News: World News Sunday, \"Newscast;\" 11/16/01, The Washington Post, \"Taliban Under Assault\"","u.s. personnel killed":"0"},"type":"Feature","geometry":{"type":"Polygon","coordinates":[[[67.1838516130133,36.71907232],[67.1824586808641,36.7049296425509],[67.1783334140179,36.6913304602649],[67.171634344166,36.6787973820907],[67.1626189128061,36.6678120471939],[67.1516335779093,36.658796615834],[67.1391004997351,36.6520975459821],[67.1255013174491,36.6479722791359],[67.11135864,36.6465793469867],[67.0972159625509,36.6479722791359],[67.0836167802649,36.6520975459821],[67.0710837020907,36.658796615834],[67.0600983671939,36.6678120471939],[67.051082935834,36.6787973820907],[67.0443838659822,36.6913304602649],[67.0402585991359,36.7049296425509],[67.0388656669867,36.71907232],[67.0402585991359,36.7332149974491],[67.0443838659822,36.7468141797351],[67.051082935834,36.7593472579093],[67.0600983671939,36.7703325928061],[67.0710837020907,36.779348024166],[67.0836167802649,36.7860470940179],[67.0972159625509,36.7901723608641],[67.11135864,36.7915652930133],[67.1255013174491,36.7901723608641],[67.1391004997351,36.7860470940179],[67.1516335779093,36.779348024166],[67.1626189128061,36.7703325928061],[67.171634344166,36.7593472579093],[67.1783334140179,36.7468141797351],[67.1824586808641,36.7332149974491],[67.1838516130133,36.71907232]]]}},{"properties":{"militants killed":"0","latitude":34.52918707,"civilians killed":"0","mission type":"Special Reconnaissance","date":{"end_time":"2001/11/16 00:00:00 -0500","original":"11/15/01","granularity":"day","time":"2001/11/15 00:00:00 -0500"},"what was employed":"Thre U.S. helicopters","notes":"Eight individuals, including two Americans, accused of preaching Christianity and held by Taliban for three months were rescued, and Special Operations soldiers took them to Islamabad","captured/wounded":"0","types of units":null,"area":"Kabul","contractors' involvement":"Not available","longitude":69.16786194,"id":"8","marker icon":"small_purple","source":"11/15/01, ABC New, \"Newscast;\" 11/15/01 Agence France Presse, \"Aid Workers Rescued;\" 12/10/01, A.P., \"Aid workers jailed in Afghanistan;\" 11/15/01, The Atlanta Journal-Constitution, \"Aid Workers Rescued\"","u.s. personnel killed":"0"},"type":"Feature","geometry":{"type":"Polygon","coordinates":[[[69.2403549130133,34.52918707],[69.2389619808641,34.5150443925509],[69.2348367140178,34.5014452102649],[69.228137644166,34.4889121320907],[69.2191222128061,34.4779267971939],[69.2081368779093,34.468911365834],[69.1956037997351,34.4622122959821],[69.1820046174491,34.4580870291359],[69.16786194,34.4566940969867],[69.1537192625509,34.4580870291359],[69.1401200802649,34.4622122959821],[69.1275870020907,34.468911365834],[69.1166016671939,34.4779267971939],[69.107586235834,34.4889121320907],[69.1008871659821,34.5014452102649],[69.0967618991359,34.5150443925509],[69.0953689669867,34.52918707],[69.0967618991359,34.5433297474491],[69.1008871659821,34.5569289297351],[69.107586235834,34.5694620079093],[69.1166016671939,34.5804473428061],[69.1275870020907,34.589462774166],[69.1401200802649,34.5961618440179],[69.1537192625509,34.6002871108641],[69.16786194,34.6016800430133],[69.1820046174491,34.6002871108641],[69.1956037997351,34.5961618440179],[69.2081368779093,34.589462774166],[69.2191222128061,34.5804473428061],[69.228137644166,34.5694620079093],[69.2348367140178,34.5569289297351],[69.2389619808641,34.5433297474491],[69.2403549130133,34.52918707]]]}},{"properties":{"militants killed":"Not available","latitude":31.60865647,"civilians killed":"Not available","mission type":"Counterterrorism","date":{"end_time":"2001/12/06 00:00:00 -0500","original":"12/5/01","granularity":"day","time":"2001/12/05 00:00:00 -0500"},"what was employed":"Air power, satellite-powered bombs","notes":"Friendly fire incident","captured/wounded":"37 Afghans and Americans wounded","types of units":null,"area":"Kandahar","contractors' involvement":"Not available","longitude":65.76141357,"id":"9","marker icon":"small_green","source":"08/11/03, CBS News, \"Fog of War;\" 12/6/01, The Sun,\"Friendly Fire kills 3 US Troops\"","u.s. personnel killed":"23 Afghan fighters; 3 Americans: Sgt. Daniel Petithory, Master Sgt. Jefferson Davis, Sgt. Cody Prosser"},"type":"Feature","geometry":{"type":"Polygon","coordinates":[[[65.8339065430133,31.60865647],[65.8325136108641,31.5945137925509],[65.8283883440179,31.5809146102649],[65.821689274166,31.5683815320907],[65.8126738428061,31.5573961971939],[65.8016885079093,31.548380765834],[65.7891554297351,31.5416816959821],[65.7755562474491,31.5375564291359],[65.76141357,31.5361634969867],[65.7472708925509,31.5375564291359],[65.7336717102649,31.5416816959821],[65.7211386320907,31.548380765834],[65.7101532971939,31.5573961971939],[65.701137865834,31.5683815320907],[65.6944387959822,31.5809146102649],[65.6903135291359,31.5945137925509],[65.6889205969867,31.60865647],[65.6903135291359,31.6227991474491],[65.6944387959822,31.6363983297351],[65.701137865834,31.6489314079093],[65.7101532971939,31.6599167428061],[65.7211386320907,31.668932174166],[65.7336717102649,31.6756312440179],[65.7472708925509,31.6797565108641],[65.76141357,31.6811494430133],[65.7755562474491,31.6797565108641],[65.7891554297351,31.6756312440179],[65.8016885079093,31.668932174166],[65.8126738428061,31.6599167428061],[65.821689274166,31.6489314079093],[65.8283883440179,31.6363983297351],[65.8325136108641,31.6227991474491],[65.8339065430133,31.60865647]]]}},{"properties":{"militants killed":"Dozens of Al Qaeda fighters killed in air strikes","latitude":34.54870089,"civilians killed":"0","mission type":"Counterterrorism","date":{"end_time":"2001/12/13 00:00:00 -0500","original":"12/12/01","granularity":"day","time":"2001/12/12 00:00:00 -0500"},"what was employed":"U.S. air strikes, hunter-killer tams","notes":"Osama bin Laden escaped from U.S. forces in the Tora Bora region","captured/wounded":"Not available","types of units":null,"area":"Tora Bora","contractors' involvement":"Not available","longitude":65.72845459,"id":"10","marker icon":"small_green","source":"12/22/09, The New Republic, \"The Battle for Tora Bora\"","u.s. personnel killed":"0"},"type":"Feature","geometry":{"type":"Polygon","coordinates":[[[65.8009475630133,34.54870089],[65.7995546308641,34.5345582125509],[65.7954293640178,34.5209590302649],[65.788730294166,34.5084259520907],[65.7797148628061,34.4974406171939],[65.7687295279093,34.488425185834],[65.7561964497351,34.4817261159821],[65.7425972674491,34.4776008491359],[65.72845459,34.4762079169867],[65.7143119125509,34.4776008491359],[65.7007127302649,34.4817261159821],[65.6881796520907,34.488425185834],[65.6771943171939,34.4974406171939],[65.668178885834,34.5084259520907],[65.6614798159821,34.5209590302649],[65.6573545491359,34.5345582125509],[65.6559616169867,34.54870089],[65.6573545491359,34.5628435674491],[65.6614798159821,34.5764427497351],[65.668178885834,34.5889758279093],[65.6771943171939,34.5999611628061],[65.6881796520907,34.608976594166],[65.7007127302649,34.6156756640179],[65.7143119125509,34.6198009308641],[65.72845459,34.6211938630133],[65.7425972674491,34.6198009308641],[65.7561964497351,34.6156756640179],[65.7687295279093,34.608976594166],[65.7797148628061,34.5999611628061],[65.788730294166,34.5889758279093],[65.7954293640178,34.5764427497351],[65.7995546308641,34.5628435674491],[65.8009475630133,34.54870089]]]}},{"properties":{"militants killed":"0","latitude":34.47146728,"civilians killed":"0","mission type":"Counterterrorism","date":{"end_time":"2001/12/29 00:00:00 -0500","original":"12/28/01","granularity":"day","time":"2001/12/28 00:00:00 -0500"},"what was employed":"Enemy forces launched rockets, fired guns","notes":"Al Qaeda attacked an Afghan-U.S. base","captured/wounded":"0","types of units":null,"area":"Jalalabad","contractors' involvement":"Not available","longitude":70.45532227,"id":"11","marker icon":"small_green","source":"12/29/01, Boston Globe, \"Call for End to Afghan Bombing\"","u.s. personnel killed":"0"},"type":"Feature","geometry":{"type":"Polygon","coordinates":[[[70.5278152430133,34.47146728],[70.5264223108641,34.4573246025509],[70.5222970440178,34.4437254202649],[70.515597974166,34.4311923420907],[70.5065825428061,34.4202070071939],[70.4955972079093,34.411191575834],[70.4830641297351,34.4044925059821],[70.4694649474491,34.4003672391359],[70.45532227,34.3989743069867],[70.4411795925509,34.4003672391359],[70.4275804102649,34.4044925059821],[70.4150473320907,34.411191575834],[70.4040619971939,34.4202070071939],[70.395046565834,34.4311923420907],[70.3883474959821,34.4437254202649],[70.3842222291359,34.4573246025509],[70.3828292969867,34.47146728],[70.3842222291359,34.4856099574491],[70.3883474959821,34.4992091397351],[70.395046565834,34.5117422179093],[70.4040619971939,34.5227275528061],[70.4150473320907,34.531742984166],[70.4275804102649,34.5384420540179],[70.4411795925509,34.5425673208641],[70.45532227,34.5439602530133],[70.4694649474491,34.5425673208641],[70.4830641297351,34.5384420540179],[70.4955972079093,34.531742984166],[70.5065825428061,34.5227275528061],[70.515597974166,34.5117422179093],[70.5222970440178,34.4992091397351],[70.5264223108641,34.4856099574491],[70.5278152430133,34.47146728]]]}},{"properties":{"militants killed":"0","latitude":31.60865647,"civilians killed":"Not available","mission type":"Direct action","date":{"end_time":"2001/10/20 00:00:00 -0400","original":"10/19/01","granularity":"day","time":"2001/10/19 00:00:00 -0400"},"what was employed":"AC-130 warplanes, helicopters","notes":"Over 100 Special Forces, mostly Army Rangers, targeted airstrip near Kandahar and a command center that Taliban leader Mullah Omar was believed to have used; officials said the soldiers \"collected intelligence,\" implying they had taken prisoners; the operation was overseen from USS Kitty Hawk in Arabian Sea","captured/wounded":"Possible captures by U.S.","types of units":"Army Rangers","area":"Kandahar","contractors' involvement":"Not available","longitude":65.76141357,"id":"12","marker icon":"small_red","source":"10/21/01, Hindustan Times, \"Commandos Hit Taliban Targets\"","u.s. personnel killed":"0"},"type":"Feature","geometry":{"type":"Polygon","coordinates":[[[65.8339065430133,31.60865647],[65.8325136108641,31.5945137925509],[65.8283883440179,31.5809146102649],[65.821689274166,31.5683815320907],[65.8126738428061,31.5573961971939],[65.8016885079093,31.548380765834],[65.7891554297351,31.5416816959821],[65.7755562474491,31.5375564291359],[65.76141357,31.5361634969867],[65.7472708925509,31.5375564291359],[65.7336717102649,31.5416816959821],[65.7211386320907,31.548380765834],[65.7101532971939,31.5573961971939],[65.701137865834,31.5683815320907],[65.6944387959822,31.5809146102649],[65.6903135291359,31.5945137925509],[65.6889205969867,31.60865647],[65.6903135291359,31.6227991474491],[65.6944387959822,31.6363983297351],[65.701137865834,31.6489314079093],[65.7101532971939,31.6599167428061],[65.7211386320907,31.668932174166],[65.7336717102649,31.6756312440179],[65.7472708925509,31.6797565108641],[65.76141357,31.6811494430133],[65.7755562474491,31.6797565108641],[65.7891554297351,31.6756312440179],[65.8016885079093,31.668932174166],[65.8126738428061,31.6599167428061],[65.821689274166,31.6489314079093],[65.8283883440179,31.6363983297351],[65.8325136108641,31.6227991474491],[65.8339065430133,31.60865647]]]}},{"properties":{"militants killed":"0","latitude":31.191658,"civilians killed":"0","mission type":"Counterterrorism","date":{"end_time":"2001/12/05 00:00:00 -0500","original":"12/4/01","granularity":"day","time":"2001/12/04 00:00:00 -0500"},"what was employed":"Not available","notes":"Soldiers and Marines attmpted to cut off Taliban and al Qaeda supply-and-escape routes","captured/wounded":"0","types of units":"Marines","area":null,"contractors' involvement":"Not available","longitude":64.20410156,"id":"14","marker icon":"small_green","source":"12/5/01, The Herald, \"U.S. Marines begin search and destroy missions\"","u.s. personnel killed":"0"},"type":"Feature","geometry":{"type":"Polygon","coordinates":[[[64.2765945330133,31.191658],[64.2752016008641,31.1775153225509],[64.2710763340178,31.1639161402649],[64.264377264166,31.1513830620907],[64.2553618328061,31.1403977271939],[64.2443764979093,31.131382295834],[64.2318434197351,31.1246832259821],[64.2182442374491,31.1205579591359],[64.20410156,31.1191650269867],[64.1899588825509,31.1205579591359],[64.1763597002649,31.1246832259821],[64.1638266220907,31.131382295834],[64.1528412871939,31.1403977271939],[64.143825855834,31.1513830620907],[64.1371267859821,31.1639161402649],[64.1330015191359,31.1775153225509],[64.1316085869867,31.191658],[64.1330015191359,31.2058006774491],[64.1371267859821,31.2193998597351],[64.143825855834,31.2319329379093],[64.1528412871939,31.2429182728061],[64.1638266220907,31.251933704166],[64.1763597002649,31.2586327740179],[64.1899588825509,31.2627580408641],[64.20410156,31.2641509730133],[64.2182442374491,31.2627580408641],[64.2318434197351,31.2586327740179],[64.2443764979093,31.251933704166],[64.2553618328061,31.2429182728061],[64.264377264166,31.2319329379093],[64.2710763340178,31.2193998597351],[64.2752016008641,31.2058006774491],[64.2765945330133,31.191658]]]}},{"properties":{"militants killed":"0","latitude":31.1187944,"civilians killed":"0","mission type":"Direct Action","date":{"end_time":"2001/11/04 00:00:00 -0500","original":"11/3/01","granularity":"day","time":"2001/11/03 00:00:00 -0500"},"what was employed":"Troops, AC-130 helicopters","notes":"100 Delta Force and 200 Rangers   carried out a humiliating retreat after suffering heavy casualties during their first raid on the Taliban","captured/wounded":"12","types of units":"Army Delta Force, Army Rangers","area":null,"contractors' involvement":"0","longitude":65.48400879,"id":"15","marker icon":"small_red","source":"11/04/0, The Scotsman Sunday, \"US Special Forces Fled After Raid Went Wrong\" T","u.s. personnel killed":"0"},"type":"Feature","geometry":{"type":"Polygon","coordinates":[[[65.5565017630133,31.1187944],[65.5551088308641,31.1046517225509],[65.5509835640179,31.0910525402649],[65.544284494166,31.0785194620907],[65.5352690628061,31.0675341271939],[65.5242837279093,31.058518695834],[65.5117506497351,31.0518196259821],[65.4981514674491,31.0476943591359],[65.48400879,31.0463014269867],[65.4698661125509,31.0476943591359],[65.4562669302649,31.0518196259821],[65.4437338520907,31.058518695834],[65.4327485171939,31.0675341271939],[65.423733085834,31.0785194620907],[65.4170340159822,31.0910525402649],[65.4129087491359,31.1046517225509],[65.4115158169867,31.1187944],[65.4129087491359,31.1329370774491],[65.4170340159822,31.1465362597351],[65.423733085834,31.1590693379093],[65.4327485171939,31.1700546728061],[65.4437338520907,31.179070104166],[65.4562669302649,31.1857691740179],[65.4698661125509,31.1898944408641],[65.48400879,31.1912873730133],[65.4981514674491,31.1898944408641],[65.5117506497351,31.1857691740179],[65.5242837279093,31.179070104166],[65.5352690628061,31.1700546728061],[65.544284494166,31.1590693379093],[65.5509835640179,31.1465362597351],[65.5551088308641,31.1329370774491],[65.5565017630133,31.1187944]]]}},{"properties":{"militants killed":"5","latitude":31.60865647,"civilians killed":"0","mission type":"Direct Action","date":{"end_time":"2002/05/14 00:00:00 -0400","original":"5/13/02","granularity":"day","time":"2002/05/13 00:00:00 -0400"},"what was employed":"Not available","notes":"Americans attacked a  Taliban stronghold","captured/wounded":"32","types of units":null,"area":"Kandahar","contractors' involvement":"Not available","longitude":65.76141357,"id":"16","marker icon":"small_red","source":"5/13/02 Agence France-Presse, \"U.S. Forces Raid Compound North of Kandahar, Killing 5\"","u.s. personnel killed":"0"},"type":"Feature","geometry":{"type":"Polygon","coordinates":[[[65.8339065430133,31.60865647],[65.8325136108641,31.5945137925509],[65.8283883440179,31.5809146102649],[65.821689274166,31.5683815320907],[65.8126738428061,31.5573961971939],[65.8016885079093,31.548380765834],[65.7891554297351,31.5416816959821],[65.7755562474491,31.5375564291359],[65.76141357,31.5361634969867],[65.7472708925509,31.5375564291359],[65.7336717102649,31.5416816959821],[65.7211386320907,31.548380765834],[65.7101532971939,31.5573961971939],[65.701137865834,31.5683815320907],[65.6944387959822,31.5809146102649],[65.6903135291359,31.5945137925509],[65.6889205969867,31.60865647],[65.6903135291359,31.6227991474491],[65.6944387959822,31.6363983297351],[65.701137865834,31.6489314079093],[65.7101532971939,31.6599167428061],[65.7211386320907,31.668932174166],[65.7336717102649,31.6756312440179],[65.7472708925509,31.6797565108641],[65.76141357,31.6811494430133],[65.7755562474491,31.6797565108641],[65.7891554297351,31.6756312440179],[65.8016885079093,31.668932174166],[65.8126738428061,31.6599167428061],[65.821689274166,31.6489314079093],[65.8283883440179,31.6363983297351],[65.8325136108641,31.6227991474491],[65.8339065430133,31.60865647]]]}},{"properties":{"militants killed":"0","latitude":33.37182503,"civilians killed":"0","mission type":"Foreign Internal Defense","date":{"end_time":"2002/01/06 00:00:00 -0500","original":"1/5/02","granularity":"day","time":"2002/01/05 00:00:00 -0500"},"what was employed":"Not available","notes":"U.S. Special Operations soldier was killed while on a mission to work with local tribes near Gardez and Khowst; his unit was ambushed.","captured/wounded":"0","types of units":"CIA Operatives, Green Berets, Delta Force","area":"Khost","contractors' involvement":"Not available","longitude":69.86343384,"id":"17","marker icon":"small_yellow","source":"1/5/02, The Scotsman, \"American soldier dies in ambush;\" 1/7/02, CNN, \"U.S. Special Forces soldier killed by hostile fire\"","u.s. personnel killed":"1 American"},"type":"Feature","geometry":{"type":"Polygon","coordinates":[[[69.9359268130133,33.37182503],[69.9345338808641,33.3576823525509],[69.9304086140178,33.3440831702649],[69.923709544166,33.3315500920907],[69.9146941128061,33.3205647571939],[69.9037087779093,33.311549325834],[69.8911756997351,33.3048502559821],[69.8775765174491,33.3007249891359],[69.86343384,33.2993320569867],[69.8492911625509,33.3007249891359],[69.8356919802649,33.3048502559821],[69.8231589020907,33.311549325834],[69.8121735671939,33.3205647571939],[69.803158135834,33.3315500920907],[69.7964590659821,33.3440831702649],[69.7923337991359,33.3576823525509],[69.7909408669867,33.37182503],[69.7923337991359,33.3859677074491],[69.7964590659821,33.3995668897351],[69.803158135834,33.4120999679093],[69.8121735671939,33.4230853028061],[69.8231589020907,33.432100734166],[69.8356919802649,33.4387998040179],[69.8492911625509,33.4429250708641],[69.86343384,33.4443180030133],[69.8775765174491,33.4429250708641],[69.8911756997351,33.4387998040179],[69.9037087779093,33.432100734166],[69.9146941128061,33.4230853028061],[69.923709544166,33.4120999679093],[69.9304086140178,33.3995668897351],[69.9345338808641,33.3859677074491],[69.9359268130133,33.37182503]]]}},{"properties":{"militants killed":"0","latitude":33.33445,"civilians killed":"0","mission type":"Counterterrorism","date":{"end_time":"2002/01/09 00:00:00 -0500","original":"1/8/02","granularity":"day","time":"2002/01/08 00:00:00 -0500"},"what was employed":"Not available","notes":"Forces capture 14 al Qaeda fighters, including two who were ranked high enough in the terrorist organization to be able to supply intelligence","captured/wounded":"14","types of units":null,"area":null,"contractors' involvement":"Not available","longitude":69.920151,"id":"18","marker icon":"small_green","source":"01/09/02, The Macon Telegraph,\"Pentagon: U.S. Forces Captured 14 Al-Qaida Fighters\"","u.s. personnel killed":"0"},"type":"Feature","geometry":{"type":"Polygon","coordinates":[[[69.9926439730133,33.33445],[69.9912510408641,33.3203073225509],[69.9871257740179,33.3067081402649],[69.980426704166,33.2941750620907],[69.9714112728061,33.2831897271939],[69.9604259379093,33.274174295834],[69.9478928597351,33.2674752259821],[69.9342936774491,33.2633499591359],[69.920151,33.2619570269867],[69.9060083225509,33.2633499591359],[69.8924091402649,33.2674752259821],[69.8798760620907,33.274174295834],[69.8688907271939,33.2831897271939],[69.859875295834,33.2941750620907],[69.8531762259822,33.3067081402649],[69.8490509591359,33.3203073225509],[69.8476580269867,33.33445],[69.8490509591359,33.3485926774491],[69.8531762259822,33.3621918597351],[69.859875295834,33.3747249379093],[69.8688907271939,33.3857102728061],[69.8798760620907,33.394725704166],[69.8924091402649,33.4014247740179],[69.9060083225509,33.4055500408641],[69.920151,33.4069429730133],[69.9342936774491,33.4055500408641],[69.9478928597351,33.4014247740179],[69.9604259379093,33.394725704166],[69.9714112728061,33.3857102728061],[69.980426704166,33.3747249379093],[69.9871257740179,33.3621918597351],[69.9912510408641,33.3485926774491],[69.9926439730133,33.33445]]]}},{"properties":{"militants killed":"0","latitude":31.1329014,"civilians killed":"0","mission type":"Counterterrorism","date":{"end_time":"2002/01/12 00:00:00 -0500","original":"1/11/02","granularity":"day","time":"2002/01/11 00:00:00 -0500"},"what was employed":"Not available","notes":"Special Forces sealed a key border crossing into Pakistan to keep tribesmen from bringing weapons into the country","captured/wounded":"0","types of units":null,"area":"Spinboldak","contractors' involvement":"Not available","longitude":65.47851563,"id":"19","marker icon":"small_green","source":"01/12/02 Associated Press, \"Special Forces to Hel Disarm Afghan Town\"","u.s. personnel killed":"0"},"type":"Feature","geometry":{"type":"Polygon","coordinates":[[[65.5510086030133,31.1329014],[65.5496156708641,31.1187587225509],[65.5454904040179,31.1051595402649],[65.538791334166,31.0926264620907],[65.5297759028061,31.0816411271939],[65.5187905679093,31.072625695834],[65.5062574897351,31.0659266259821],[65.4926583074491,31.0618013591359],[65.47851563,31.0604084269867],[65.4643729525509,31.0618013591359],[65.4507737702649,31.0659266259821],[65.4382406920907,31.072625695834],[65.4272553571939,31.0816411271939],[65.418239925834,31.0926264620907],[65.4115408559822,31.1051595402649],[65.4074155891359,31.1187587225509],[65.4060226569867,31.1329014],[65.4074155891359,31.1470440774491],[65.4115408559822,31.1606432597351],[65.418239925834,31.1731763379093],[65.4272553571939,31.1841616728061],[65.4382406920907,31.193177104166],[65.4507737702649,31.1998761740179],[65.4643729525509,31.2040014408641],[65.47851563,31.2053943730133],[65.4926583074491,31.2040014408641],[65.5062574897351,31.1998761740179],[65.5187905679093,31.193177104166],[65.5297759028061,31.1841616728061],[65.538791334166,31.1731763379093],[65.5454904040179,31.1606432597351],[65.5496156708641,31.1470440774491],[65.5510086030133,31.1329014]]]}},{"properties":{"militants killed":"21","latitude":33.33511775,"civilians killed":"0","mission type":"Direct Action","date":{"end_time":"2002/01/25 00:00:00 -0500","original":"1/24/02","granularity":"day","time":"2002/01/24 00:00:00 -0500"},"what was employed":"Not available","notes":"Residents of the central Afghanistan village of Hazar Qadam, apparently raided by U.S . Special Forces, claimed that the 21 men who died and 27 captured were not Taliban; instead, they were working for  Afghan leader Hamid Karzai","captured/wounded":"27","types of units":null,"area":"Hazar Qadam","contractors' involvement":"Not available","longitude":66.24755859,"id":"20","marker icon":"small_red","source":"1/28/02, The State, \"Villagers Say Men Killed in U.S. Raid were Anti-Taliban Fighters\"","u.s. personnel killed":"0"},"type":"Feature","geometry":{"type":"Polygon","coordinates":[[[66.3200515630133,33.33511775],[66.3186586308641,33.3209750725509],[66.3145333640178,33.3073758902649],[66.307834294166,33.2948428120907],[66.2988188628061,33.2838574771939],[66.2878335279093,33.274842045834],[66.2753004497351,33.2681429759821],[66.2617012674491,33.2640177091359],[66.24755859,33.2626247769867],[66.2334159125509,33.2640177091359],[66.2198167302649,33.2681429759821],[66.2072836520907,33.274842045834],[66.1962983171939,33.2838574771939],[66.187282885834,33.2948428120907],[66.1805838159821,33.3073758902649],[66.1764585491359,33.3209750725509],[66.1750656169867,33.33511775],[66.1764585491359,33.3492604274491],[66.1805838159821,33.3628596097351],[66.187282885834,33.3753926879093],[66.1962983171939,33.3863780228061],[66.2072836520907,33.395393454166],[66.2198167302649,33.4020925240179],[66.2334159125509,33.4062177908641],[66.24755859,33.4076107230133],[66.2617012674491,33.4062177908641],[66.2753004497351,33.4020925240179],[66.2878335279093,33.395393454166],[66.2988188628061,33.3863780228061],[66.307834294166,33.3753926879093],[66.3145333640178,33.3628596097351],[66.3186586308641,33.3492604274491],[66.3200515630133,33.33511775]]]}},{"properties":{"militants killed":"Not available","latitude":31.60865647,"civilians killed":"Not available","mission type":"Direct Action","date":{"end_time":"2002/01/29 00:00:00 -0500","original":"1/28/02","granularity":"day","time":"2002/01/28 00:00:00 -0500"},"what was employed":"Not available","notes":"U.S. special forces entered a hospital where up to 6 armed al-Qaeda fighters had been hiding since Taliban fled the city last year","captured/wounded":"Not available","types of units":"Afghan Troops","area":"Kandahar","contractors' involvement":"Not available","longitude":65.76141357,"id":"21","marker icon":"small_red","source":"1/28/02, Agence France-Presse, \"U.S. special forces storm hospital in Kandahar\"","u.s. personnel killed":"Not available"},"type":"Feature","geometry":{"type":"Polygon","coordinates":[[[65.8339065430133,31.60865647],[65.8325136108641,31.5945137925509],[65.8283883440179,31.5809146102649],[65.821689274166,31.5683815320907],[65.8126738428061,31.5573961971939],[65.8016885079093,31.548380765834],[65.7891554297351,31.5416816959821],[65.7755562474491,31.5375564291359],[65.76141357,31.5361634969867],[65.7472708925509,31.5375564291359],[65.7336717102649,31.5416816959821],[65.7211386320907,31.548380765834],[65.7101532971939,31.5573961971939],[65.701137865834,31.5683815320907],[65.6944387959822,31.5809146102649],[65.6903135291359,31.5945137925509],[65.6889205969867,31.60865647],[65.6903135291359,31.6227991474491],[65.6944387959822,31.6363983297351],[65.701137865834,31.6489314079093],[65.7101532971939,31.6599167428061],[65.7211386320907,31.668932174166],[65.7336717102649,31.6756312440179],[65.7472708925509,31.6797565108641],[65.76141357,31.6811494430133],[65.7755562474491,31.6797565108641],[65.7891554297351,31.6756312440179],[65.8016885079093,31.668932174166],[65.8126738428061,31.6599167428061],[65.821689274166,31.6489314079093],[65.8283883440179,31.6363983297351],[65.8325136108641,31.6227991474491],[65.8339065430133,31.60865647]]]}},{"properties":{"militants killed":"0","latitude":33.67178278,"civilians killed":"0","mission type":"Foreign Internal Defense","date":{"end_time":"2030/02/02 00:00:00 -0500","original":"2-Feb","granularity":"day","time":"2030/02/01 00:00:00 -0500"},"what was employed":"Helicopter","notes":"Dropped oxygen tanks, but equipment shattered; one hospitalized boy died.","captured/wounded":"0","types of units":null,"area":"Gardez","contractors' involvement":"Not available","longitude":69.24682617,"id":"22","marker icon":"small_yellow","source":"At War With Ourselves (Oxford University Press), Michael Hirsh","u.s. personnel killed":"0"},"type":"Feature","geometry":{"type":"Polygon","coordinates":[[[69.3193191430133,33.67178278],[69.3179262108641,33.6576401025509],[69.3138009440179,33.6440409202649],[69.307101874166,33.6315078420907],[69.2980864428061,33.6205225071939],[69.2871011079093,33.611507075834],[69.2745680297351,33.6048080059821],[69.2609688474491,33.6006827391359],[69.24682617,33.5992898069867],[69.2326834925509,33.6006827391359],[69.2190843102649,33.6048080059821],[69.2065512320907,33.611507075834],[69.1955658971939,33.6205225071939],[69.186550465834,33.6315078420907],[69.1798513959822,33.6440409202649],[69.1757261291359,33.6576401025509],[69.1743331969867,33.67178278],[69.1757261291359,33.6859254574491],[69.1798513959822,33.6995246397351],[69.186550465834,33.7120577179093],[69.1955658971939,33.7230430528061],[69.2065512320907,33.732058484166],[69.2190843102649,33.7387575540179],[69.2326834925509,33.7428828208641],[69.24682617,33.7442757530133],[69.2609688474491,33.7428828208641],[69.2745680297351,33.7387575540179],[69.2871011079093,33.732058484166],[69.2980864428061,33.7230430528061],[69.307101874166,33.7120577179093],[69.3138009440179,33.6995246397351],[69.3179262108641,33.6859254574491],[69.3193191430133,33.67178278]]]}},{"properties":{"militants killed":"Several Al Qaeda fighters","latitude":32.57922064,"civilians killed":"Not available","mission type":"Direct Action","date":{"end_time":"2002/03/05 00:00:00 -0500","original":"3/4/02","granularity":"day","time":"2002/03/04 00:00:00 -0500"},"what was employed":"MH-47E helicopter","notes":"Special Operations forces were part of Operation Anaconda - which was designed to take out a Taliban stronghold on Takur Ghar mountain.","captured/wounded":"Not available","types of units":null,"area":null,"contractors' involvement":"Not available","longitude":68.72497559,"id":"23","marker icon":"small_red","source":"05/24/04, Defense Department, \"Executive Summary;\" 5/6/02, The Times, \"How Americans fell foul of al-Qaeda's last stand\"","u.s. personnel killed":"7 U.S. servicemen"},"type":"Feature","geometry":{"type":"Polygon","coordinates":[[[68.7974685630133,32.57922064],[68.7960756308641,32.5650779625509],[68.7919503640179,32.5514787802649],[68.785251294166,32.5389457020907],[68.7762358628061,32.5279603671939],[68.7652505279093,32.518944935834],[68.7527174497351,32.5122458659821],[68.7391182674491,32.5081205991359],[68.72497559,32.5067276669867],[68.7108329125509,32.5081205991359],[68.6972337302649,32.5122458659821],[68.6847006520907,32.518944935834],[68.6737153171939,32.5279603671939],[68.664699885834,32.5389457020907],[68.6580008159821,32.5514787802649],[68.6538755491359,32.5650779625509],[68.6524826169867,32.57922064],[68.6538755491359,32.5933633174491],[68.6580008159821,32.6069624997351],[68.664699885834,32.6194955779093],[68.6737153171939,32.6304809128061],[68.6847006520907,32.639496344166],[68.6972337302649,32.6461954140179],[68.7108329125509,32.6503206808641],[68.72497559,32.6517136130133],[68.7391182674491,32.6503206808641],[68.7527174497351,32.6461954140179],[68.7652505279093,32.639496344166],[68.7762358628061,32.6304809128061],[68.785251294166,32.6194955779093],[68.7919503640179,32.6069624997351],[68.7960756308641,32.5933633174491],[68.7974685630133,32.57922064]]]}},{"properties":{"militants killed":"0","latitude":35.46066995,"civilians killed":"0","mission type":"Counterterrorism","date":{"end_time":"2002/04/24 00:00:00 -0400","original":"4/23/02","granularity":"day","time":"2002/04/23 00:00:00 -0400"},"what was employed":"Not available","notes":"U.S. convoy searched two houses, dug up a garden and found three truckloads of weapons and ammunition left by the Taliban.","captured/wounded":"0","types of units":null,"area":"Talak","contractors' involvement":"Not available","longitude":65.75317383,"id":"24","marker icon":"small_green","source":"4/30/02, The Atlantic City, \"U.S. Dents Taliban Supplies by Finding, Seizing Weapons\"","u.s. personnel killed":"0"},"type":"Feature","geometry":{"type":"Polygon","coordinates":[[[65.8256668030133,35.46066995],[65.8242738708641,35.4465272725509],[65.8201486040178,35.4329280902649],[65.813449534166,35.4203950120907],[65.8044341028061,35.4094096771939],[65.7934487679093,35.400394245834],[65.7809156897351,35.3936951759821],[65.7673165074491,35.3895699091359],[65.75317383,35.3881769769867],[65.7390311525509,35.3895699091359],[65.7254319702649,35.3936951759821],[65.7128988920907,35.400394245834],[65.7019135571939,35.4094096771939],[65.692898125834,35.4203950120907],[65.6861990559821,35.4329280902649],[65.6820737891359,35.4465272725509],[65.6806808569867,35.46066995],[65.6820737891359,35.4748126274491],[65.6861990559821,35.4884118097351],[65.692898125834,35.5009448879093],[65.7019135571939,35.5119302228061],[65.7128988920907,35.520945654166],[65.7254319702649,35.5276447240179],[65.7390311525509,35.5317699908641],[65.75317383,35.5331629230133],[65.7673165074491,35.5317699908641],[65.7809156897351,35.5276447240179],[65.7934487679093,35.520945654166],[65.8044341028061,35.5119302228061],[65.813449534166,35.5009448879093],[65.8201486040178,35.4884118097351],[65.8242738708641,35.4748126274491],[65.8256668030133,35.46066995]]]}},{"properties":{"militants killed":"0","latitude":32.57922064,"civilians killed":"0","mission type":"Direct Action","date":{"end_time":"2002/05/13 00:00:00 -0400","original":"5/12/02","granularity":"day","time":"2002/05/12 00:00:00 -0400"},"what was employed":"Not available","notes":"Afghan forces, Special Operations troops and U.S. air support supported Coalition Forces in destroying a weapons cache as part of Operation Mountain Lion.","captured/wounded":"0","types of units":"Afghan Troops","area":null,"contractors' involvement":"Not available","longitude":68.72497559,"id":"25","marker icon":"small_red","source":"5/13/02, Belfast News Letter, \"Al Qaida munitions dump blown up\"","u.s. personnel killed":"0"},"type":"Feature","geometry":{"type":"Polygon","coordinates":[[[68.7974685630133,32.57922064],[68.7960756308641,32.5650779625509],[68.7919503640179,32.5514787802649],[68.785251294166,32.5389457020907],[68.7762358628061,32.5279603671939],[68.7652505279093,32.518944935834],[68.7527174497351,32.5122458659821],[68.7391182674491,32.5081205991359],[68.72497559,32.5067276669867],[68.7108329125509,32.5081205991359],[68.6972337302649,32.5122458659821],[68.6847006520907,32.518944935834],[68.6737153171939,32.5279603671939],[68.664699885834,32.5389457020907],[68.6580008159821,32.5514787802649],[68.6538755491359,32.5650779625509],[68.6524826169867,32.57922064],[68.6538755491359,32.5933633174491],[68.6580008159821,32.6069624997351],[68.664699885834,32.6194955779093],[68.6737153171939,32.6304809128061],[68.6847006520907,32.639496344166],[68.6972337302649,32.6461954140179],[68.7108329125509,32.6503206808641],[68.72497559,32.6517136130133],[68.7391182674491,32.6503206808641],[68.7527174497351,32.6461954140179],[68.7652505279093,32.639496344166],[68.7762358628061,32.6304809128061],[68.785251294166,32.6194955779093],[68.7919503640179,32.6069624997351],[68.7960756308641,32.5933633174491],[68.7974685630133,32.57922064]]]}},{"properties":{"militants killed":"0","latitude":33.67178278,"civilians killed":"Not available","mission type":"Not Available","date":{"end_time":"2002/06/13 00:00:00 -0400","original":"6/12/02","granularity":"day","time":"2002/06/12 00:00:00 -0400"},"what was employed":"MC-130 Special Operations aircraft","notes":"More than 10 people were in the aircraft Combat Talon when it crashed","captured/wounded":"Not available","types of units":null,"area":"Gardez","contractors' involvement":"Not available","longitude":69.24682617,"id":"26","marker icon":"small_purple","source":"6/12/02 Reuters News, \"U.S. Special Operations Plane Crashed in Afghanistan\"","u.s. personnel killed":"Not available"},"type":"Feature","geometry":{"type":"Polygon","coordinates":[[[69.3193191430133,33.67178278],[69.3179262108641,33.6576401025509],[69.3138009440179,33.6440409202649],[69.307101874166,33.6315078420907],[69.2980864428061,33.6205225071939],[69.2871011079093,33.611507075834],[69.2745680297351,33.6048080059821],[69.2609688474491,33.6006827391359],[69.24682617,33.5992898069867],[69.2326834925509,33.6006827391359],[69.2190843102649,33.6048080059821],[69.2065512320907,33.611507075834],[69.1955658971939,33.6205225071939],[69.186550465834,33.6315078420907],[69.1798513959822,33.6440409202649],[69.1757261291359,33.6576401025509],[69.1743331969867,33.67178278],[69.1757261291359,33.6859254574491],[69.1798513959822,33.6995246397351],[69.186550465834,33.7120577179093],[69.1955658971939,33.7230430528061],[69.2065512320907,33.732058484166],[69.2190843102649,33.7387575540179],[69.2326834925509,33.7428828208641],[69.24682617,33.7442757530133],[69.2609688474491,33.7428828208641],[69.2745680297351,33.7387575540179],[69.2871011079093,33.732058484166],[69.2980864428061,33.7230430528061],[69.307101874166,33.7120577179093],[69.3138009440179,33.6995246397351],[69.3179262108641,33.6859254574491],[69.3193191430133,33.67178278]]]}},{"properties":{"militants killed":"Not available","latitude":35.29943548,"civilians killed":"0","mission type":"Direct Action","date":{"end_time":"2002/06/25 00:00:00 -0400","original":"6/24/02","granularity":"day","time":"2002/06/24 00:00:00 -0400"},"what was employed":"F-18 jets, bombs, mortars","notes":"U.S. forces returned fire when attacked and called in air support.","captured/wounded":"Not available","types of units":null,"area":null,"contractors' involvement":"Not available","longitude":71.00463867,"id":"27","marker icon":"small_red","source":"6/25/02, Agence France-Presse, \"Mortars, rockets fired at U.S. special forces in eastern Afghanistan\"","u.s. personnel killed":"0"},"type":"Feature","geometry":{"type":"Polygon","coordinates":[[[71.0771316430133,35.29943548],[71.0757387108641,35.2852928025509],[71.0716134440179,35.2716936202649],[71.064914374166,35.2591605420907],[71.0558989428061,35.2481752071939],[71.0449136079093,35.239159775834],[71.0323805297351,35.2324607059821],[71.0187813474491,35.2283354391359],[71.00463867,35.2269425069867],[70.9904959925509,35.2283354391359],[70.9768968102649,35.2324607059821],[70.9643637320907,35.239159775834],[70.9533783971939,35.2481752071939],[70.944362965834,35.2591605420907],[70.9376638959822,35.2716936202649],[70.9335386291359,35.2852928025509],[70.9321456969867,35.29943548],[70.9335386291359,35.3135781574491],[70.9376638959822,35.3271773397351],[70.944362965834,35.3397104179093],[70.9533783971939,35.3506957528061],[70.9643637320907,35.359711184166],[70.9768968102649,35.3664102540179],[70.9904959925509,35.3705355208641],[71.00463867,35.3719284530133],[71.0187813474491,35.3705355208641],[71.0323805297351,35.3664102540179],[71.0449136079093,35.359711184166],[71.0558989428061,35.3506957528061],[71.064914374166,35.3397104179093],[71.0716134440179,35.3271773397351],[71.0757387108641,35.3135781574491],[71.0771316430133,35.29943548]]]}},{"properties":{"militants killed":"0","latitude":34.55859746,"civilians killed":"0","mission type":"Foreign Internal Defense","date":{"end_time":"2030/07/02 00:00:00 -0400","original":"2-Jul","granularity":"day","time":"2030/07/01 00:00:00 -0400"},"what was employed":"Not specified","notes":"U.S. forces protected Afghan President Hamid Karzai and helped to train his bodyguards (after the assasination of vice-president Haji Abdul Qadir)","captured/wounded":"0","types of units":null,"area":"Kabul","contractors' involvement":"0","longitude":69.17953491,"id":"28","marker icon":"small_yellow","source":"7/24/02 Financial Times,  \"Afghan President to be Guarded by U.S. Special Forces\"","u.s. personnel killed":"0"},"type":"Feature","geometry":{"type":"Polygon","coordinates":[[[69.2520278830133,34.55859746],[69.2506349508641,34.5444547825509],[69.2465096840179,34.5308556002649],[69.239810614166,34.5183225220907],[69.2307951828061,34.5073371871939],[69.2198098479093,34.498321755834],[69.2072767697351,34.4916226859821],[69.1936775874491,34.4874974191359],[69.17953491,34.4861044869867],[69.1653922325509,34.4874974191359],[69.1517930502649,34.4916226859821],[69.1392599720907,34.498321755834],[69.1282746371939,34.5073371871939],[69.119259205834,34.5183225220907],[69.1125601359822,34.5308556002649],[69.1084348691359,34.5444547825509],[69.1070419369867,34.55859746],[69.1084348691359,34.5727401374491],[69.1125601359822,34.5863393197351],[69.119259205834,34.5988723979093],[69.1282746371939,34.6098577328061],[69.1392599720907,34.618873164166],[69.1517930502649,34.6255722340179],[69.1653922325509,34.6296975008641],[69.17953491,34.6310904330133],[69.1936775874491,34.6296975008641],[69.2072767697351,34.6255722340179],[69.2198098479093,34.618873164166],[69.2307951828061,34.6098577328061],[69.239810614166,34.5988723979093],[69.2465096840179,34.5863393197351],[69.2506349508641,34.5727401374491],[69.2520278830133,34.55859746]]]}},{"properties":{"militants killed":"0","latitude":34.89832151,"civilians killed":"0","mission type":"Counterterrorism","date":{"end_time":"2002/08/24 00:00:00 -0400","original":"8/23/02","granularity":"day","time":"2002/08/23 00:00:00 -0400"},"what was employed":"Not available","notes":"Special Forces captured four men after several rocket-propelled grenades were fired at a U.S. special operations base","captured/wounded":"4 detained","types of units":"Coalition Troops","area":"(near) Asadabad","contractors' involvement":"Not available","longitude":71.15364075,"id":"29","marker icon":"small_green","source":"08/25/02 Record-Journal (Meriden, CT) \"Coalition forces detain 16 in weapons sweeps\"","u.s. personnel killed":"0"},"type":"Feature","geometry":{"type":"Polygon","coordinates":[[[71.2261337230133,34.89832151],[71.2247407908641,34.8841788325509],[71.2206155240178,34.8705796502649],[71.213916454166,34.8580465720907],[71.2049010228061,34.8470612371939],[71.1939156879093,34.838045805834],[71.1813826097351,34.8313467359821],[71.1677834274491,34.8272214691359],[71.15364075,34.8258285369867],[71.1394980725509,34.8272214691359],[71.1258988902649,34.8313467359821],[71.1133658120907,34.838045805834],[71.1023804771939,34.8470612371939],[71.093365045834,34.8580465720907],[71.0866659759821,34.8705796502649],[71.0825407091359,34.8841788325509],[71.0811477769867,34.89832151],[71.0825407091359,34.9124641874491],[71.0866659759821,34.9260633697351],[71.093365045834,34.9385964479093],[71.1023804771939,34.9495817828061],[71.1133658120907,34.958597214166],[71.1258988902649,34.9652962840179],[71.1394980725509,34.9694215508641],[71.15364075,34.9708144830133],[71.1677834274491,34.9694215508641],[71.1813826097351,34.9652962840179],[71.1939156879093,34.958597214166],[71.2049010228061,34.9495817828061],[71.213916454166,34.9385964479093],[71.2206155240178,34.9260633697351],[71.2247407908641,34.9124641874491],[71.2261337230133,34.89832151]]]}},{"properties":{"militants killed":"0","latitude":32.24997446,"civilians killed":"0","mission type":"Counterterrorism","date":{"end_time":"2002/08/24 00:00:00 -0400","original":"8/23/02","granularity":"day","time":"2002/08/23 00:00:00 -0400"},"what was employed":"Not available","notes":"Special Forces on patrol found mortar rounds, five rockets, and grenades for a rocket-propelled launcher in a partially collapsed cave as part of Operation Mountain Sweep.","captured/wounded":"0","types of units":null,"area":null,"contractors' involvement":"Not available","longitude":67.18963623,"id":"30","marker icon":"small_green","source":"08/25/02 Record-Journal (Meriden, CT) \"Coalition forces detain 16 in weapons sweeps\"","u.s. personnel killed":"0"},"type":"Feature","geometry":{"type":"Polygon","coordinates":[[[67.2621292030133,32.24997446],[67.2607362708641,32.2358317825509],[67.2566110040179,32.2222326002649],[67.249911934166,32.2096995220907],[67.2408965028061,32.1987141871939],[67.2299111679093,32.189698755834],[67.2173780897351,32.1829996859821],[67.2037789074491,32.1788744191359],[67.18963623,32.1774814869867],[67.1754935525509,32.1788744191359],[67.1618943702649,32.1829996859821],[67.1493612920907,32.189698755834],[67.1383759571939,32.1987141871939],[67.129360525834,32.2096995220907],[67.1226614559822,32.2222326002649],[67.1185361891359,32.2358317825509],[67.1171432569867,32.24997446],[67.1185361891359,32.2641171374491],[67.1226614559822,32.2777163197351],[67.129360525834,32.2902493979093],[67.1383759571939,32.3012347328061],[67.1493612920907,32.310250164166],[67.1618943702649,32.3169492340179],[67.1754935525509,32.3210745008641],[67.18963623,32.3224674330133],[67.2037789074491,32.3210745008641],[67.2173780897351,32.3169492340179],[67.2299111679093,32.310250164166],[67.2408965028061,32.3012347328061],[67.249911934166,32.2902493979093],[67.2566110040179,32.2777163197351],[67.2607362708641,32.2641171374491],[67.2621292030133,32.24997446]]]}},{"properties":{"militants killed":"Mohammed Sayari","latitude":33.42800305,"civilians killed":"0","mission type":"Information Operations","date":{"end_time":"2002/08/29 00:00:00 -0400","original":"8/28/02","granularity":"day","time":"2002/08/28 00:00:00 -0400"},"what was employed":"Firearms","notes":"Suspected aggressor Mohammed Sayari was supposedly killed, but investigators later believed he was murdered by Special Forces on 01/06/06; criminal investigation was launched into \"possible war crime\"","captured/wounded":"0","types of units":null,"area":"Lwar Ghar","contractors' involvement":"0","longitude":69.73022461,"id":"31","marker icon":"small_purple","source":"01/06/05, Human Rights First, \"Commander's Responsibility\"","u.s. personnel killed":"0"},"type":"Feature","geometry":{"type":"Polygon","coordinates":[[[69.8027175830133,33.42800305],[69.8013246508641,33.4138603725509],[69.7971993840178,33.4002611902649],[69.790500314166,33.3877281120907],[69.7814848828061,33.3767427771939],[69.7704995479093,33.367727345834],[69.7579664697351,33.3610282759821],[69.7443672874491,33.3569030091359],[69.73022461,33.3555100769867],[69.7160819325509,33.3569030091359],[69.7024827502649,33.3610282759821],[69.6899496720907,33.367727345834],[69.6789643371939,33.3767427771939],[69.669948905834,33.3877281120907],[69.6632498359821,33.4002611902649],[69.6591245691359,33.4138603725509],[69.6577316369867,33.42800305],[69.6591245691359,33.4421457274491],[69.6632498359821,33.4557449097351],[69.669948905834,33.4682779879093],[69.6789643371939,33.4792633228061],[69.6899496720907,33.488278754166],[69.7024827502649,33.4949778240179],[69.7160819325509,33.4991030908641],[69.73022461,33.5004960230133],[69.7443672874491,33.4991030908641],[69.7579664697351,33.4949778240179],[69.7704995479093,33.488278754166],[69.7814848828061,33.4792633228061],[69.790500314166,33.4682779879093],[69.7971993840178,33.4557449097351],[69.8013246508641,33.4421457274491],[69.8027175830133,33.42800305]]]}},{"properties":{"militants killed":"1, attempted assasin","latitude":31.60865647,"civilians killed":"0","mission type":"Direct Action","date":{"end_time":"2002/09/07 00:00:00 -0400","original":"9/6/02","granularity":"day","time":"2002/09/06 00:00:00 -0400"},"what was employed":"Firearms","notes":"Man wearing an army uniform opened fire on President Hamid Karzai's car; special Operators shot and killed assailant","captured/wounded":"0","types of units":null,"area":"Kandahar","contractors' involvement":"Not available","longitude":65.76141357,"id":"32","marker icon":"small_red","source":"9/6/02, NBC News: Today, \"Afghanistan president survives assassination attempt\"","u.s. personnel killed":"0"},"type":"Feature","geometry":{"type":"Polygon","coordinates":[[[65.8339065430133,31.60865647],[65.8325136108641,31.5945137925509],[65.8283883440179,31.5809146102649],[65.821689274166,31.5683815320907],[65.8126738428061,31.5573961971939],[65.8016885079093,31.548380765834],[65.7891554297351,31.5416816959821],[65.7755562474491,31.5375564291359],[65.76141357,31.5361634969867],[65.7472708925509,31.5375564291359],[65.7336717102649,31.5416816959821],[65.7211386320907,31.548380765834],[65.7101532971939,31.5573961971939],[65.701137865834,31.5683815320907],[65.6944387959822,31.5809146102649],[65.6903135291359,31.5945137925509],[65.6889205969867,31.60865647],[65.6903135291359,31.6227991474491],[65.6944387959822,31.6363983297351],[65.701137865834,31.6489314079093],[65.7101532971939,31.6599167428061],[65.7211386320907,31.668932174166],[65.7336717102649,31.6756312440179],[65.7472708925509,31.6797565108641],[65.76141357,31.6811494430133],[65.7755562474491,31.6797565108641],[65.7891554297351,31.6756312440179],[65.8016885079093,31.668932174166],[65.8126738428061,31.6599167428061],[65.821689274166,31.6489314079093],[65.8283883440179,31.6363983297351],[65.8325136108641,31.6227991474491],[65.8339065430133,31.60865647]]]}},{"properties":{"militants killed":"Not available","latitude":33.42800305,"civilians killed":"Not available","mission type":"Direct Action","date":{"end_time":"2002/09/21 00:00:00 -0400","original":"9/20/02","granularity":"day","time":"2002/09/20 00:00:00 -0400"},"what was employed":"Guns, mortar rounds, A-10 Groundhog aircraft, bombs","notes":"Americans responded to mortar fire and called in air support","captured/wounded":"0","types of units":null,"area":"Lwar Ghar","contractors' involvement":"Not available","longitude":69.73022461,"id":"33","marker icon":"small_red","source":"9/12/02, Western Morning News, \"Rockets Fired at U.S. Soldiers\"","u.s. personnel killed":"0"},"type":"Feature","geometry":{"type":"Polygon","coordinates":[[[69.8027175830133,33.42800305],[69.8013246508641,33.4138603725509],[69.7971993840178,33.4002611902649],[69.790500314166,33.3877281120907],[69.7814848828061,33.3767427771939],[69.7704995479093,33.367727345834],[69.7579664697351,33.3610282759821],[69.7443672874491,33.3569030091359],[69.73022461,33.3555100769867],[69.7160819325509,33.3569030091359],[69.7024827502649,33.3610282759821],[69.6899496720907,33.367727345834],[69.6789643371939,33.3767427771939],[69.669948905834,33.3877281120907],[69.6632498359821,33.4002611902649],[69.6591245691359,33.4138603725509],[69.6577316369867,33.42800305],[69.6591245691359,33.4421457274491],[69.6632498359821,33.4557449097351],[69.669948905834,33.4682779879093],[69.6789643371939,33.4792633228061],[69.6899496720907,33.488278754166],[69.7024827502649,33.4949778240179],[69.7160819325509,33.4991030908641],[69.73022461,33.5004960230133],[69.7443672874491,33.4991030908641],[69.7579664697351,33.4949778240179],[69.7704995479093,33.488278754166],[69.7814848828061,33.4792633228061],[69.790500314166,33.4682779879093],[69.7971993840178,33.4557449097351],[69.8013246508641,33.4421457274491],[69.8027175830133,33.42800305]]]}},{"properties":{"militants killed":"1","latitude":32.71104439,"civilians killed":"0","mission type":"Counterterrorism","date":{"end_time":"2002/11/09 00:00:00 -0500","original":"11/8/02","granularity":"day","time":"2002/11/08 00:00:00 -0500"},"what was employed":"Not available","notes":"Forces shot and killed an armed militant.","captured/wounded":"0","types of units":null,"area":"Deh Rawood","contractors' involvement":"Not available","longitude":65.47576904,"id":"34","marker icon":"small_green","source":"11/8/02, The Chanute Tribune, \"U.S. Special Forces in Afghanistan Kill One Attacker\"","u.s. personnel killed":"0"},"type":"Feature","geometry":{"type":"Polygon","coordinates":[[[65.5482620130133,32.71104439],[65.5468690808641,32.6969017125509],[65.5427438140179,32.6833025302649],[65.536044744166,32.6707694520907],[65.5270293128061,32.6597841171939],[65.5160439779093,32.650768685834],[65.5035108997351,32.6440696159821],[65.4899117174491,32.6399443491359],[65.47576904,32.6385514169867],[65.4616263625509,32.6399443491359],[65.4480271802649,32.6440696159821],[65.4354941020907,32.650768685834],[65.4245087671939,32.6597841171939],[65.415493335834,32.6707694520907],[65.4087942659822,32.6833025302649],[65.4046689991359,32.6969017125509],[65.4032760669867,32.71104439],[65.4046689991359,32.7251870674491],[65.4087942659822,32.7387862497351],[65.415493335834,32.7513193279093],[65.4245087671939,32.7623046628061],[65.4354941020907,32.771320094166],[65.4480271802649,32.7780191640179],[65.4616263625509,32.7821444308641],[65.47576904,32.7835373630133],[65.4899117174491,32.7821444308641],[65.5035108997351,32.7780191640179],[65.5160439779093,32.771320094166],[65.5270293128061,32.7623046628061],[65.536044744166,32.7513193279093],[65.5427438140179,32.7387862497351],[65.5468690808641,32.7251870674491],[65.5482620130133,32.71104439]]]}},{"properties":{"militants killed":"0","latitude":34.89832151,"civilians killed":"0","mission type":"Not Available","date":{"end_time":"2002/12/22 00:00:00 -0500","original":"12/21/02","granularity":"day","time":"2002/12/21 00:00:00 -0500"},"what was employed":"Not available","notes":"One US Special Operations soldier was wounded in a rocket attack on a compound.","captured/wounded":"1 American wounded","types of units":null,"area":"Asadabad","contractors' involvement":"Not available","longitude":71.15364075,"id":"35","marker icon":"small_purple","source":"12/22/02, The Star-Ledger, \"Afghan Battle Kills Sergeant\"","u.s. personnel killed":"0"},"type":"Feature","geometry":{"type":"Polygon","coordinates":[[[71.2261337230133,34.89832151],[71.2247407908641,34.8841788325509],[71.2206155240178,34.8705796502649],[71.213916454166,34.8580465720907],[71.2049010228061,34.8470612371939],[71.1939156879093,34.838045805834],[71.1813826097351,34.8313467359821],[71.1677834274491,34.8272214691359],[71.15364075,34.8258285369867],[71.1394980725509,34.8272214691359],[71.1258988902649,34.8313467359821],[71.1133658120907,34.838045805834],[71.1023804771939,34.8470612371939],[71.093365045834,34.8580465720907],[71.0866659759821,34.8705796502649],[71.0825407091359,34.8841788325509],[71.0811477769867,34.89832151],[71.0825407091359,34.9124641874491],[71.0866659759821,34.9260633697351],[71.093365045834,34.9385964479093],[71.1023804771939,34.9495817828061],[71.1133658120907,34.958597214166],[71.1258988902649,34.9652962840179],[71.1394980725509,34.9694215508641],[71.15364075,34.9708144830133],[71.1677834274491,34.9694215508641],[71.1813826097351,34.9652962840179],[71.1939156879093,34.958597214166],[71.2049010228061,34.9495817828061],[71.213916454166,34.9385964479093],[71.2206155240178,34.9260633697351],[71.2247407908641,34.9124641874491],[71.2261337230133,34.89832151]]]}},{"properties":{"militants killed":"2","latitude":31.60865647,"civilians killed":"0","mission type":"Direct Action","date":{"end_time":"2002/06/19 00:00:00 -0400","original":"6/18/02","granularity":"day","time":"2002/06/18 00:00:00 -0400"},"what was employed":"Not available","notes":"Forces opened fire on 2 people while on patrol in a Taliban stronghold.","captured/wounded":"0","types of units":null,"area":"Kandahar","contractors' involvement":"0","longitude":65.76141357,"id":"36","marker icon":"small_red","source":"6/18/02 Agence France-Presse (AFPR) ,\"US Troops Kill Two in Afghan Clash\"","u.s. personnel killed":"0"},"type":"Feature","geometry":{"type":"Polygon","coordinates":[[[65.8339065430133,31.60865647],[65.8325136108641,31.5945137925509],[65.8283883440179,31.5809146102649],[65.821689274166,31.5683815320907],[65.8126738428061,31.5573961971939],[65.8016885079093,31.548380765834],[65.7891554297351,31.5416816959821],[65.7755562474491,31.5375564291359],[65.76141357,31.5361634969867],[65.7472708925509,31.5375564291359],[65.7336717102649,31.5416816959821],[65.7211386320907,31.548380765834],[65.7101532971939,31.5573961971939],[65.701137865834,31.5683815320907],[65.6944387959822,31.5809146102649],[65.6903135291359,31.5945137925509],[65.6889205969867,31.60865647],[65.6903135291359,31.6227991474491],[65.6944387959822,31.6363983297351],[65.701137865834,31.6489314079093],[65.7101532971939,31.6599167428061],[65.7211386320907,31.668932174166],[65.7336717102649,31.6756312440179],[65.7472708925509,31.6797565108641],[65.76141357,31.6811494430133],[65.7755562474491,31.6797565108641],[65.7891554297351,31.6756312440179],[65.8016885079093,31.668932174166],[65.8126738428061,31.6599167428061],[65.821689274166,31.6489314079093],[65.8283883440179,31.6363983297351],[65.8325136108641,31.6227991474491],[65.8339065430133,31.60865647]]]}},{"properties":{"militants killed":"Not available","latitude":34.41144164,"civilians killed":"possibly 48","mission type":"Direct Action","date":{"end_time":"2002/07/01 00:00:00 -0400","original":"6/30/02","granularity":"day","time":"2002/06/30 00:00:00 -0400"},"what was employed":"bombs","notes":"US investigators probed a bombing raid on a wedding party; Afghan authorities claim 48 people were killed; US only confirmed the forces had been led to an ammunitions and weapons cache by a AMF.","captured/wounded":"Not available","types of units":null,"area":null,"contractors' involvement":"Not available","longitude":67.03857422,"id":"37","marker icon":"small_red","source":"7/17/02, Agence France-Presse, \"US investigators travel to Uzbekistan to probe wedding bombing\"","u.s. personnel killed":"0"},"type":"Feature","geometry":{"type":"Polygon","coordinates":[[[67.1110671930133,34.41144164],[67.1096742608641,34.3972989625509],[67.1055489940179,34.3836997802649],[67.098849924166,34.3711667020907],[67.0898344928061,34.3601813671939],[67.0788491579093,34.351165935834],[67.0663160797351,34.3444668659821],[67.0527168974491,34.3403415991359],[67.03857422,34.3389486669867],[67.0244315425509,34.3403415991359],[67.0108323602649,34.3444668659821],[66.9982992820907,34.351165935834],[66.9873139471939,34.3601813671939],[66.978298515834,34.3711667020907],[66.9715994459822,34.3836997802649],[66.9674741791359,34.3972989625509],[66.9660812469867,34.41144164],[66.9674741791359,34.4255843174491],[66.9715994459822,34.4391834997351],[66.978298515834,34.4517165779093],[66.9873139471939,34.4627019128061],[66.9982992820907,34.471717344166],[67.0108323602649,34.4784164140179],[67.0244315425509,34.4825416808641],[67.03857422,34.4839346130133],[67.0527168974491,34.4825416808641],[67.0663160797351,34.4784164140179],[67.0788491579093,34.471717344166],[67.0898344928061,34.4627019128061],[67.098849924166,34.4517165779093],[67.1055489940179,34.4391834997351],[67.1096742608641,34.4255843174491],[67.1110671930133,34.41144164]]]}},{"properties":{"militants killed":"Not available","latitude":32.11035049,"civilians killed":"Not available","mission type":"Direct Action","date":{"end_time":"2002/04/30 00:00:00 -0400","original":"4/29/02","granularity":"day","time":"2002/04/29 00:00:00 -0400"},"what was employed":"US air power","notes":"US military supported Birtish-led \"Operation Snipe\" with air power and Speical Forces; operation sweeping mountains for Al Qeada operatives.","captured/wounded":"Not available","types of units":"US Military, British Forces","area":null,"contractors' involvement":"Not available","longitude":66.89944267,"id":"38","marker icon":"small_red","source":"5/2/02, Coventry Evening Telegraph, \"1,000 allied troops in key al Qaida area\"","u.s. personnel killed":"Not available"},"type":"Feature","geometry":{"type":"Polygon","coordinates":[[[66.9719356430133,32.11035049],[66.9705427108641,32.0962078125509],[66.9664174440178,32.0826086302649],[66.959718374166,32.0700755520907],[66.9507029428061,32.0590902171939],[66.9397176079093,32.050074785834],[66.9271845297351,32.0433757159821],[66.9135853474491,32.0392504491359],[66.89944267,32.0378575169867],[66.8852999925509,32.0392504491359],[66.8717008102649,32.0433757159821],[66.8591677320907,32.050074785834],[66.8481823971939,32.0590902171939],[66.839166965834,32.0700755520907],[66.8324678959821,32.0826086302649],[66.8283426291359,32.0962078125509],[66.8269496969867,32.11035049],[66.8283426291359,32.1244931674491],[66.8324678959821,32.1380923497351],[66.839166965834,32.1506254279093],[66.8481823971939,32.1616107628061],[66.8591677320907,32.170626194166],[66.8717008102649,32.1773252640179],[66.8852999925509,32.1814505308641],[66.89944267,32.1828434630133],[66.9135853474491,32.1814505308641],[66.9271845297351,32.1773252640179],[66.9397176079093,32.170626194166],[66.9507029428061,32.1616107628061],[66.959718374166,32.1506254279093],[66.9664174440178,32.1380923497351],[66.9705427108641,32.1244931674491],[66.9719356430133,32.11035049]]]}},{"properties":{"militants killed":"0","latitude":31.191658,"civilians killed":"0","mission type":"Direct Action","date":{"end_time":"2002/08/24 00:00:00 -0400","original":"8/23/02","granularity":"day","time":"2002/08/23 00:00:00 -0400"},"what was employed":"Not specified","notes":"Special Operations seized a pile of Taliban documents found along with a major weapons cache (including 1,400 107mm rockets, 200 mines, 15 recoiless rifles and assorted small arms and ammunition) in a fundamentalist militia's former stronghold.","captured/wounded":"0","types of units":null,"area":null,"contractors' involvement":"Not available","longitude":64.20410156,"id":"39","marker icon":"small_red","source":"8/23/02, Agence France-Presse, \"US forces seize stash of Taliban documents in former stronghold\"","u.s. personnel killed":"0"},"type":"Feature","geometry":{"type":"Polygon","coordinates":[[[64.2765945330133,31.191658],[64.2752016008641,31.1775153225509],[64.2710763340178,31.1639161402649],[64.264377264166,31.1513830620907],[64.2553618328061,31.1403977271939],[64.2443764979093,31.131382295834],[64.2318434197351,31.1246832259821],[64.2182442374491,31.1205579591359],[64.20410156,31.1191650269867],[64.1899588825509,31.1205579591359],[64.1763597002649,31.1246832259821],[64.1638266220907,31.131382295834],[64.1528412871939,31.1403977271939],[64.143825855834,31.1513830620907],[64.1371267859821,31.1639161402649],[64.1330015191359,31.1775153225509],[64.1316085869867,31.191658],[64.1330015191359,31.2058006774491],[64.1371267859821,31.2193998597351],[64.143825855834,31.2319329379093],[64.1528412871939,31.2429182728061],[64.1638266220907,31.251933704166],[64.1763597002649,31.2586327740179],[64.1899588825509,31.2627580408641],[64.20410156,31.2641509730133],[64.2182442374491,31.2627580408641],[64.2318434197351,31.2586327740179],[64.2443764979093,31.251933704166],[64.2553618328061,31.2429182728061],[64.264377264166,31.2319329379093],[64.2710763340178,31.2193998597351],[64.2752016008641,31.2058006774491],[64.2765945330133,31.191658]]]}},{"properties":{"militants killed":"0","latitude":33.339707,"civilians killed":"5","mission type":"Direct Action","date":{"end_time":"2002/05/13 00:00:00 -0400","original":"5/12/02","granularity":"day","time":"2002/05/12 00:00:00 -0400"},"what was employed":"Air support, including one plane, at least a dozen choppers, Field Rockets","notes":"American Special Forces raided small farming village.","captured/wounded":"0","types of units":null,"area":null,"contractors' involvement":"0","longitude":66.19812012,"id":"40","marker icon":"small_red","source":"05/20/02, The New York Times, \"Afghans Say 5 Killed in a U.S. Raid Were Farmers\"","u.s. personnel killed":"0"},"type":"Feature","geometry":{"type":"Polygon","coordinates":[[[66.2706130930133,33.339707],[66.2692201608641,33.3255643225509],[66.2650948940178,33.3119651402649],[66.258395824166,33.2994320620907],[66.2493803928061,33.2884467271939],[66.2383950579093,33.279431295834],[66.2258619797351,33.2727322259821],[66.2122627974491,33.2686069591359],[66.19812012,33.2672140269867],[66.1839774425509,33.2686069591359],[66.1703782602649,33.2727322259821],[66.1578451820907,33.279431295834],[66.1468598471939,33.2884467271939],[66.137844415834,33.2994320620907],[66.1311453459821,33.3119651402649],[66.1270200791359,33.3255643225509],[66.1256271469867,33.339707],[66.1270200791359,33.3538496774491],[66.1311453459821,33.3674488597351],[66.137844415834,33.3799819379093],[66.1468598471939,33.3909672728061],[66.1578451820907,33.399982704166],[66.1703782602649,33.4066817740179],[66.1839774425509,33.4108070408641],[66.19812012,33.4121999730133],[66.2122627974491,33.4108070408641],[66.2258619797351,33.4066817740179],[66.2383950579093,33.399982704166],[66.2493803928061,33.3909672728061],[66.258395824166,33.3799819379093],[66.2650948940178,33.3674488597351],[66.2692201608641,33.3538496774491],[66.2706130930133,33.339707]]]}},{"properties":{"militants killed":"Not available","latitude":31.48489339,"civilians killed":"Not available","mission type":"Direct Action","date":{"end_time":"2003/03/29 00:00:00 -0500","original":"3/28/03","granularity":"day","time":"2003/03/28 00:00:00 -0500"},"what was employed":"Four-vehicle convoy","notes":"Reconnaisance","captured/wounded":"3 Afghan soldiers wounded","types of units":null,"area":null,"contractors' involvement":"Not available","longitude":63.94042969,"id":"41","marker icon":"small_red","source":"03/21/03, Herald-Sun, \"Afghan Ambush\"","u.s. personnel killed":"2 Americans killed"},"type":"Feature","geometry":{"type":"Polygon","coordinates":[[[64.0129226630133,31.48489339],[64.0115297308641,31.4707507125509],[64.0074044640179,31.4571515302649],[64.000705394166,31.4446184520907],[63.9916899628061,31.4336331171939],[63.9807046279093,31.424617685834],[63.9681715497351,31.4179186159821],[63.9545723674491,31.4137933491359],[63.94042969,31.4124004169867],[63.9262870125509,31.4137933491359],[63.9126878302649,31.4179186159821],[63.9001547520907,31.424617685834],[63.8891694171939,31.4336331171939],[63.880153985834,31.4446184520907],[63.8734549159821,31.4571515302649],[63.8693296491359,31.4707507125509],[63.8679367169867,31.48489339],[63.8693296491359,31.4990360674491],[63.8734549159821,31.5126352497351],[63.880153985834,31.5251683279093],[63.8891694171939,31.5361536628061],[63.9001547520907,31.545169094166],[63.9126878302649,31.5518681640179],[63.9262870125509,31.5559934308641],[63.94042969,31.5573863630133],[63.9545723674491,31.5559934308641],[63.9681715497351,31.5518681640179],[63.9807046279093,31.545169094166],[63.9916899628061,31.5361536628061],[64.000705394166,31.5251683279093],[64.0074044640179,31.5126352497351],[64.0115297308641,31.4990360674491],[64.0129226630133,31.48489339]]]}},{"properties":{"militants killed":"0","latitude":31.60865647,"civilians killed":"0","mission type":"Foreign Internal Defense","date":{"end_time":"2003/03/30 00:00:00 -0500","original":"3/29/03","granularity":"day","time":"2003/03/29 00:00:00 -0500"},"what was employed":"Apache helicopters, F-16s","notes":"U.S. Special Forces observing Afghan militia operations in  Kandahar province were attacked; they called in Apache helicopters and F-16s for air support","captured/wounded":"0","types of units":"Afghan Troops","area":"Kandahar","contractors' involvement":"Not available","longitude":65.76141357,"id":"42","marker icon":"small_yellow","source":"3/30/03, Agence France-Presse, \"ISAF compound hit in Kabul rocket attack, no casualties reported\"","u.s. personnel killed":"0"},"type":"Feature","geometry":{"type":"Polygon","coordinates":[[[65.8339065430133,31.60865647],[65.8325136108641,31.5945137925509],[65.8283883440179,31.5809146102649],[65.821689274166,31.5683815320907],[65.8126738428061,31.5573961971939],[65.8016885079093,31.548380765834],[65.7891554297351,31.5416816959821],[65.7755562474491,31.5375564291359],[65.76141357,31.5361634969867],[65.7472708925509,31.5375564291359],[65.7336717102649,31.5416816959821],[65.7211386320907,31.548380765834],[65.7101532971939,31.5573961971939],[65.701137865834,31.5683815320907],[65.6944387959822,31.5809146102649],[65.6903135291359,31.5945137925509],[65.6889205969867,31.60865647],[65.6903135291359,31.6227991474491],[65.6944387959822,31.6363983297351],[65.701137865834,31.6489314079093],[65.7101532971939,31.6599167428061],[65.7211386320907,31.668932174166],[65.7336717102649,31.6756312440179],[65.7472708925509,31.6797565108641],[65.76141357,31.6811494430133],[65.7755562474491,31.6797565108641],[65.7891554297351,31.6756312440179],[65.8016885079093,31.668932174166],[65.8126738428061,31.6599167428061],[65.821689274166,31.6489314079093],[65.8283883440179,31.6363983297351],[65.8325136108641,31.6227991474491],[65.8339065430133,31.60865647]]]}},{"properties":{"militants killed":"0","latitude":31.48489339,"civilians killed":"0","mission type":"Special Reconnaissance","date":{"end_time":"2003/03/30 00:00:00 -0500","original":"3/29/03","granularity":"day","time":"2003/03/29 00:00:00 -0500"},"what was employed":"Not available","notes":"Two U.S. Special Operations Forces members were killed and one critically wounded when their unit was ambushed by gunmen on motorcycle","captured/wounded":"1 American critically wonunded","types of units":null,"area":null,"contractors' involvement":"Not available","longitude":63.94042969,"id":"43","marker icon":"small_purple","source":"3/30/03, Office of Congressman Charles B. Rangel, \"Sgt. Orlando Morales\"","u.s. personnel killed":"2 Americans killed"},"type":"Feature","geometry":{"type":"Polygon","coordinates":[[[64.0129226630133,31.48489339],[64.0115297308641,31.4707507125509],[64.0074044640179,31.4571515302649],[64.000705394166,31.4446184520907],[63.9916899628061,31.4336331171939],[63.9807046279093,31.424617685834],[63.9681715497351,31.4179186159821],[63.9545723674491,31.4137933491359],[63.94042969,31.4124004169867],[63.9262870125509,31.4137933491359],[63.9126878302649,31.4179186159821],[63.9001547520907,31.424617685834],[63.8891694171939,31.4336331171939],[63.880153985834,31.4446184520907],[63.8734549159821,31.4571515302649],[63.8693296491359,31.4707507125509],[63.8679367169867,31.48489339],[63.8693296491359,31.4990360674491],[63.8734549159821,31.5126352497351],[63.880153985834,31.5251683279093],[63.8891694171939,31.5361536628061],[63.9001547520907,31.545169094166],[63.9126878302649,31.5518681640179],[63.9262870125509,31.5559934308641],[63.94042969,31.5573863630133],[63.9545723674491,31.5559934308641],[63.9681715497351,31.5518681640179],[63.9807046279093,31.545169094166],[63.9916899628061,31.5361536628061],[64.000705394166,31.5251683279093],[64.0074044640179,31.5126352497351],[64.0115297308641,31.4990360674491],[64.0129226630133,31.48489339]]]}},{"properties":{"militants killed":"0","latitude":34.46240957,"civilians killed":"0","mission type":"Counterterrorism","date":{"end_time":"2003/05/10 00:00:00 -0400","original":"5/9/03","granularity":"day","time":"2003/05/09 00:00:00 -0400"},"what was employed":"Not available","notes":"A US Special Operations Forces unit recovered a cache of weapons near the eastern city of Jalalabad that included 33 cases of 14.5mm ammunition and 12 rifles; stockpiled for later use","captured/wounded":"0","types of units":null,"area":"Jalalabad","contractors' involvement":"Not available","longitude":70.46630859,"id":"44","marker icon":"small_green","source":"5/23/03, Agence France-Presse, \"US forces attacked in southeast Afghanistan\"","u.s. personnel killed":"0"},"type":"Feature","geometry":{"type":"Polygon","coordinates":[[[70.5388015630133,34.46240957],[70.5374086308641,34.4482668925509],[70.5332833640178,34.4346677102649],[70.526584294166,34.4221346320907],[70.5175688628061,34.4111492971939],[70.5065835279093,34.402133865834],[70.4940504497351,34.3954347959821],[70.4804512674491,34.3913095291359],[70.46630859,34.3899165969867],[70.4521659125509,34.3913095291359],[70.4385667302649,34.3954347959821],[70.4260336520907,34.402133865834],[70.4150483171939,34.4111492971939],[70.406032885834,34.4221346320907],[70.3993338159821,34.4346677102649],[70.3952085491359,34.4482668925509],[70.3938156169867,34.46240957],[70.3952085491359,34.4765522474491],[70.3993338159821,34.4901514297351],[70.406032885834,34.5026845079093],[70.4150483171939,34.5136698428061],[70.4260336520907,34.522685274166],[70.4385667302649,34.5293843440179],[70.4521659125509,34.5335096108641],[70.46630859,34.5349025430133],[70.4804512674491,34.5335096108641],[70.4940504497351,34.5293843440179],[70.5065835279093,34.522685274166],[70.5175688628061,34.5136698428061],[70.526584294166,34.5026845079093],[70.5332833640178,34.4901514297351],[70.5374086308641,34.4765522474491],[70.5388015630133,34.46240957]]]}},{"properties":{"militants killed":"0","latitude":33.67178278,"civilians killed":"0","mission type":"Direct Action","date":{"end_time":"2003/05/21 00:00:00 -0400","original":"5/20/03","granularity":"day","time":"2003/05/20 00:00:00 -0400"},"what was employed":"Not available","notes":"A U.S. Special Operations Forces soldier was slightly injured by shrapnel when an explosive device detonated near his vehicle","captured/wounded":"1 American","types of units":null,"area":"Gardez","contractors' involvement":"Not available","longitude":69.24682617,"id":"45","marker icon":"small_red","source":"5/22/03, Agence France Presse, \"U.S. forces kill up to five in clash in southeast Afghanistan\"","u.s. personnel killed":"0"},"type":"Feature","geometry":{"type":"Polygon","coordinates":[[[69.3193191430133,33.67178278],[69.3179262108641,33.6576401025509],[69.3138009440179,33.6440409202649],[69.307101874166,33.6315078420907],[69.2980864428061,33.6205225071939],[69.2871011079093,33.611507075834],[69.2745680297351,33.6048080059821],[69.2609688474491,33.6006827391359],[69.24682617,33.5992898069867],[69.2326834925509,33.6006827391359],[69.2190843102649,33.6048080059821],[69.2065512320907,33.611507075834],[69.1955658971939,33.6205225071939],[69.186550465834,33.6315078420907],[69.1798513959822,33.6440409202649],[69.1757261291359,33.6576401025509],[69.1743331969867,33.67178278],[69.1757261291359,33.6859254574491],[69.1798513959822,33.6995246397351],[69.186550465834,33.7120577179093],[69.1955658971939,33.7230430528061],[69.2065512320907,33.732058484166],[69.2190843102649,33.7387575540179],[69.2326834925509,33.7428828208641],[69.24682617,33.7442757530133],[69.2609688474491,33.7428828208641],[69.2745680297351,33.7387575540179],[69.2871011079093,33.732058484166],[69.2980864428061,33.7230430528061],[69.307101874166,33.7120577179093],[69.3138009440179,33.6995246397351],[69.3179262108641,33.6859254574491],[69.3193191430133,33.67178278]]]}},{"properties":{"militants killed":"0","latitude":33.37182503,"civilians killed":"0","mission type":"Direct Action","date":{"end_time":"2003/05/29 00:00:00 -0400","original":"5/28/03","granularity":"day","time":"2003/05/28 00:00:00 -0400"},"what was employed":"Vehicle; IED","notes":"Vehicle was hit by remote controlled IED on roadside during border checkpoint reconnaissance","captured/wounded":"0","types of units":null,"area":"Khowst","contractors' involvement":"Not available","longitude":69.86343384,"id":"46","marker icon":"small_red","source":"5/28/03, Agence France Presse, \"U.S. Military Vehicle Hit by Afghan Bomb Blast\"","u.s. personnel killed":"0"},"type":"Feature","geometry":{"type":"Polygon","coordinates":[[[69.9359268130133,33.37182503],[69.9345338808641,33.3576823525509],[69.9304086140178,33.3440831702649],[69.923709544166,33.3315500920907],[69.9146941128061,33.3205647571939],[69.9037087779093,33.311549325834],[69.8911756997351,33.3048502559821],[69.8775765174491,33.3007249891359],[69.86343384,33.2993320569867],[69.8492911625509,33.3007249891359],[69.8356919802649,33.3048502559821],[69.8231589020907,33.311549325834],[69.8121735671939,33.3205647571939],[69.803158135834,33.3315500920907],[69.7964590659821,33.3440831702649],[69.7923337991359,33.3576823525509],[69.7909408669867,33.37182503],[69.7923337991359,33.3859677074491],[69.7964590659821,33.3995668897351],[69.803158135834,33.4120999679093],[69.8121735671939,33.4230853028061],[69.8231589020907,33.432100734166],[69.8356919802649,33.4387998040179],[69.8492911625509,33.4429250708641],[69.86343384,33.4443180030133],[69.8775765174491,33.4429250708641],[69.8911756997351,33.4387998040179],[69.9037087779093,33.432100734166],[69.9146941128061,33.4230853028061],[69.923709544166,33.4120999679093],[69.9304086140178,33.3995668897351],[69.9345338808641,33.3859677074491],[69.9359268130133,33.37182503]]]}},{"properties":{"militants killed":"Not available","latitude":31.8218,"civilians killed":"Not available","mission type":"Direct action","date":{"end_time":"2003/05/29 00:00:00 -0400","original":"5/28/03","granularity":"day","time":"2003/05/28 00:00:00 -0400"},"what was employed":"Not available","notes":"A group of gunmen attacked a U.S. Special Operations Forces unit; the special operators survived","captured/wounded":"Not available","types of units":null,"area":"Geresk","contractors' involvement":"Not available","longitude":64.55,"id":"47","marker icon":"small_red","source":"5/29/03, Agence France Presse, \"U.S. troops attacked in southwest Afghanistan\"","u.s. personnel killed":"0"},"type":"Feature","geometry":{"type":"Polygon","coordinates":[[[64.6224929730133,31.8218],[64.6211000408641,31.8076573225509],[64.6169747740178,31.7940581402649],[64.610275704166,31.7815250620907],[64.6012602728061,31.7705397271939],[64.5902749379093,31.761524295834],[64.5777418597351,31.7548252259821],[64.5641426774491,31.7506999591359],[64.55,31.7493070269867],[64.5358573225509,31.7506999591359],[64.5222581402649,31.7548252259821],[64.5097250620907,31.761524295834],[64.4987397271939,31.7705397271939],[64.489724295834,31.7815250620907],[64.4830252259821,31.7940581402649],[64.4788999591359,31.8076573225509],[64.4775070269867,31.8218],[64.4788999591359,31.8359426774491],[64.4830252259821,31.8495418597351],[64.489724295834,31.8620749379093],[64.4987397271939,31.8730602728061],[64.5097250620907,31.882075704166],[64.5222581402649,31.8887747740179],[64.5358573225509,31.8929000408641],[64.55,31.8942929730133],[64.5641426774491,31.8929000408641],[64.5777418597351,31.8887747740179],[64.5902749379093,31.882075704166],[64.6012602728061,31.8730602728061],[64.610275704166,31.8620749379093],[64.6169747740178,31.8495418597351],[64.6211000408641,31.8359426774491],[64.6224929730133,31.8218]]]}},{"properties":{"militants killed":"0","latitude":33.37182503,"civilians killed":"0","mission type":"Direct Action","date":{"end_time":"2003/06/04 00:00:00 -0400","original":"6/3/03","granularity":"day","time":"2003/06/03 00:00:00 -0400"},"what was employed":"Not available","notes":"A U.S. Special Operations Forces vehicle was hit by a remote-controlled bomb; no one was injured","captured/wounded":"0","types of units":null,"area":null,"contractors' involvement":"Not available","longitude":69.86343384,"id":"48","marker icon":"small_red","source":"6/5/03, Agence France Presse, \"Bomb blast hits U.S. convoy in southeast Afghanistan\"","u.s. personnel killed":"0"},"type":"Feature","geometry":{"type":"Polygon","coordinates":[[[69.9359268130133,33.37182503],[69.9345338808641,33.3576823525509],[69.9304086140178,33.3440831702649],[69.923709544166,33.3315500920907],[69.9146941128061,33.3205647571939],[69.9037087779093,33.311549325834],[69.8911756997351,33.3048502559821],[69.8775765174491,33.3007249891359],[69.86343384,33.2993320569867],[69.8492911625509,33.3007249891359],[69.8356919802649,33.3048502559821],[69.8231589020907,33.311549325834],[69.8121735671939,33.3205647571939],[69.803158135834,33.3315500920907],[69.7964590659821,33.3440831702649],[69.7923337991359,33.3576823525509],[69.7909408669867,33.37182503],[69.7923337991359,33.3859677074491],[69.7964590659821,33.3995668897351],[69.803158135834,33.4120999679093],[69.8121735671939,33.4230853028061],[69.8231589020907,33.432100734166],[69.8356919802649,33.4387998040179],[69.8492911625509,33.4429250708641],[69.86343384,33.4443180030133],[69.8775765174491,33.4429250708641],[69.8911756997351,33.4387998040179],[69.9037087779093,33.432100734166],[69.9146941128061,33.4230853028061],[69.923709544166,33.4120999679093],[69.9304086140178,33.3995668897351],[69.9345338808641,33.3859677074491],[69.9359268130133,33.37182503]]]}},{"properties":{"militants killed":"0","latitude":33.67178278,"civilians killed":"0","mission type":"Direct Action","date":{"end_time":"2003/06/05 00:00:00 -0400","original":"6/4/03","granularity":"day","time":"2003/06/04 00:00:00 -0400"},"what was employed":"Not available","notes":"A U.S. Special Forces convoy was hit by a bomb blast while travelling in the province of Paktia","captured/wounded":"0","types of units":null,"area":"Gardez","contractors' involvement":"Not available","longitude":69.24682617,"id":"49","marker icon":"small_red","source":"6/5/03, Agence France Presse, \"Bomb blast hits U.S. convoy in southeast Afghanistan\"","u.s. personnel killed":"0"},"type":"Feature","geometry":{"type":"Polygon","coordinates":[[[69.3193191430133,33.67178278],[69.3179262108641,33.6576401025509],[69.3138009440179,33.6440409202649],[69.307101874166,33.6315078420907],[69.2980864428061,33.6205225071939],[69.2871011079093,33.611507075834],[69.2745680297351,33.6048080059821],[69.2609688474491,33.6006827391359],[69.24682617,33.5992898069867],[69.2326834925509,33.6006827391359],[69.2190843102649,33.6048080059821],[69.2065512320907,33.611507075834],[69.1955658971939,33.6205225071939],[69.186550465834,33.6315078420907],[69.1798513959822,33.6440409202649],[69.1757261291359,33.6576401025509],[69.1743331969867,33.67178278],[69.1757261291359,33.6859254574491],[69.1798513959822,33.6995246397351],[69.186550465834,33.7120577179093],[69.1955658971939,33.7230430528061],[69.2065512320907,33.732058484166],[69.2190843102649,33.7387575540179],[69.2326834925509,33.7428828208641],[69.24682617,33.7442757530133],[69.2609688474491,33.7428828208641],[69.2745680297351,33.7387575540179],[69.2871011079093,33.732058484166],[69.2980864428061,33.7230430528061],[69.307101874166,33.7120577179093],[69.3138009440179,33.6995246397351],[69.3179262108641,33.6859254574491],[69.3193191430133,33.67178278]]]}},{"properties":{"militants killed":"0","latitude":34.9028267,"civilians killed":"0","mission type":"Direct action","date":{"end_time":"2003/06/07 00:00:00 -0400","original":"6/6/03","granularity":"day","time":"2003/06/06 00:00:00 -0400"},"what was employed":"Blowpipe surface-to-air missles","notes":"US Special Operations Forces found three Blowpipe surface-to-air missiles near a coalition base.","captured/wounded":"0","types of units":null,"area":"Asadabad","contractors' involvement":"Not available","longitude":71.15570068,"id":"50","marker icon":"small_red","source":"6/10/03, Agence France Presse, \"US troops find Blowpipe missiles near base in eastern Afghanistan\"","u.s. personnel killed":"0"},"type":"Feature","geometry":{"type":"Polygon","coordinates":[[[71.2281936530133,34.9028267],[71.2268007208641,34.8886840225509],[71.2226754540178,34.8750848402649],[71.215976384166,34.8625517620907],[71.2069609528061,34.8515664271939],[71.1959756179093,34.842550995834],[71.1834425397351,34.8358519259821],[71.1698433574491,34.8317266591359],[71.15570068,34.8303337269867],[71.1415580025509,34.8317266591359],[71.1279588202649,34.8358519259821],[71.1154257420907,34.842550995834],[71.1044404071939,34.8515664271939],[71.095424975834,34.8625517620907],[71.0887259059821,34.8750848402649],[71.0846006391359,34.8886840225509],[71.0832077069867,34.9028267],[71.0846006391359,34.9169693774491],[71.0887259059821,34.9305685597351],[71.095424975834,34.9431016379093],[71.1044404071939,34.9540869728061],[71.1154257420907,34.963102404166],[71.1279588202649,34.9698014740179],[71.1415580025509,34.9739267408641],[71.15570068,34.9753196730133],[71.1698433574491,34.9739267408641],[71.1834425397351,34.9698014740179],[71.1959756179093,34.963102404166],[71.2069609528061,34.9540869728061],[71.215976384166,34.9431016379093],[71.2226754540178,34.9305685597351],[71.2268007208641,34.9169693774491],[71.2281936530133,34.9028267]]]}},{"properties":{"militants killed":"0","latitude":34.53654064,"civilians killed":"0","mission type":"Counterterrorism","date":{"end_time":"2003/07/04 00:00:00 -0400","original":"7/3/03","granularity":"day","time":"2003/07/03 00:00:00 -0400"},"what was employed":"Hand grenades","notes":"Two U.S. soldiers were wounded in an accidental explosion while training Afghan troops","captured/wounded":"2 U.S. soldiers wounded","types of units":"Afghan Troops","area":"Kabul","contractors' involvement":"Not available","longitude":69.17163849,"id":"51","marker icon":"small_green","source":"3/8/03, Agence France Presse, \"U.S. soldiers injured in accidental Afghan grenade blast\"","u.s. personnel killed":"0"},"type":"Feature","geometry":{"type":"Polygon","coordinates":[[[69.2441314630133,34.53654064],[69.2427385308641,34.5223979625509],[69.2386132640179,34.5087987802649],[69.231914194166,34.4962657020907],[69.2228987628061,34.4852803671939],[69.2119134279093,34.476264935834],[69.1993803497351,34.4695658659821],[69.1857811674491,34.4654405991359],[69.17163849,34.4640476669867],[69.1574958125509,34.4654405991359],[69.1438966302649,34.4695658659821],[69.1313635520907,34.476264935834],[69.1203782171939,34.4852803671939],[69.111362785834,34.4962657020907],[69.1046637159822,34.5087987802649],[69.1005384491359,34.5223979625509],[69.0991455169867,34.53654064],[69.1005384491359,34.5506833174491],[69.1046637159822,34.5642824997351],[69.111362785834,34.5768155779093],[69.1203782171939,34.5878009128061],[69.1313635520907,34.596816344166],[69.1438966302649,34.6035154140179],[69.1574958125509,34.6076406808641],[69.17163849,34.6090336130133],[69.1857811674491,34.6076406808641],[69.1993803497351,34.6035154140179],[69.2119134279093,34.596816344166],[69.2228987628061,34.5878009128061],[69.231914194166,34.5768155779093],[69.2386132640179,34.5642824997351],[69.2427385308641,34.5506833174491],[69.2441314630133,34.53654064]]]}},{"properties":{"militants killed":"Not available","latitude":32.59310597,"civilians killed":"Not available","mission type":"Direct Action","date":{"end_time":"2003/08/21 00:00:00 -0400","original":"8/20/03","granularity":"day","time":"2003/08/20 00:00:00 -0400"},"what was employed":"Not available","notes":"A U.S. Special Operations soldier was killed while on combat operations in the Urgon district.","captured/wounded":"Not available","types of units":null,"area":"Urgon district","contractors' involvement":"Not available","longitude":68.73046875,"id":"52","marker icon":"small_red","source":"8/22/03, Agence France-Presse, \"U.S.-led troops attacked in southeast Afghanistan\"","u.s. personnel killed":"1 American"},"type":"Feature","geometry":{"type":"Polygon","coordinates":[[[68.8029617230133,32.59310597],[68.8015687908641,32.5789632925509],[68.7974435240179,32.5653641102649],[68.790744454166,32.5528310320907],[68.7817290228061,32.5418456971939],[68.7707436879093,32.532830265834],[68.7582106097351,32.5261311959821],[68.7446114274491,32.5220059291359],[68.73046875,32.5206129969867],[68.7163260725509,32.5220059291359],[68.7027268902649,32.5261311959821],[68.6901938120907,32.532830265834],[68.6792084771939,32.5418456971939],[68.670193045834,32.5528310320907],[68.6634939759821,32.5653641102649],[68.6593687091359,32.5789632925509],[68.6579757769867,32.59310597],[68.6593687091359,32.6072486474491],[68.6634939759821,32.6208478297351],[68.670193045834,32.6333809079093],[68.6792084771939,32.6443662428061],[68.6901938120907,32.653381674166],[68.7027268902649,32.6600807440179],[68.7163260725509,32.6642060108641],[68.73046875,32.6655989430133],[68.7446114274491,32.6642060108641],[68.7582106097351,32.6600807440179],[68.7707436879093,32.653381674166],[68.7817290228061,32.6443662428061],[68.790744454166,32.6333809079093],[68.7974435240179,32.6208478297351],[68.8015687908641,32.6072486474491],[68.8029617230133,32.59310597]]]}},{"properties":{"militants killed":"at least 33 militants","latitude":34.54870089,"civilians killed":"0","mission type":"Direct Action","date":{"end_time":"2003/08/30 00:00:00 -0400","original":"8/29/03","granularity":"day","time":"2003/08/29 00:00:00 -0400"},"what was employed":"Not available","notes":"Special Operations soldier died of injuries from falling during a night combat assault near Daychopan","captured/wounded":"1 soldier","types of units":null,"area":null,"contractors' involvement":"Not available","longitude":65.72845459,"id":"53","marker icon":"small_red","source":"8/30/03, Agence France-Presse, \"U.S.-backed forces have killed at least 33 in Afghan fighting;\" 9/1/03, The Independent, \"U.S. soldiers killed in attack on Taliban\"","u.s. personnel killed":"1 American"},"type":"Feature","geometry":{"type":"Polygon","coordinates":[[[65.8009475630133,34.54870089],[65.7995546308641,34.5345582125509],[65.7954293640178,34.5209590302649],[65.788730294166,34.5084259520907],[65.7797148628061,34.4974406171939],[65.7687295279093,34.488425185834],[65.7561964497351,34.4817261159821],[65.7425972674491,34.4776008491359],[65.72845459,34.4762079169867],[65.7143119125509,34.4776008491359],[65.7007127302649,34.4817261159821],[65.6881796520907,34.488425185834],[65.6771943171939,34.4974406171939],[65.668178885834,34.5084259520907],[65.6614798159821,34.5209590302649],[65.6573545491359,34.5345582125509],[65.6559616169867,34.54870089],[65.6573545491359,34.5628435674491],[65.6614798159821,34.5764427497351],[65.668178885834,34.5889758279093],[65.6771943171939,34.5999611628061],[65.6881796520907,34.608976594166],[65.7007127302649,34.6156756640179],[65.7143119125509,34.6198009308641],[65.72845459,34.6211938630133],[65.7425972674491,34.6198009308641],[65.7561964497351,34.6156756640179],[65.7687295279093,34.608976594166],[65.7797148628061,34.5999611628061],[65.788730294166,34.5889758279093],[65.7954293640178,34.5764427497351],[65.7995546308641,34.5628435674491],[65.8009475630133,34.54870089]]]}},{"properties":{"militants killed":"0","latitude":32.13375716,"civilians killed":"Not available","mission type":"Direct Action","date":{"end_time":"2003/09/04 00:00:00 -0400","original":"9/3/03","granularity":"day","time":"2003/09/03 00:00:00 -0400"},"what was employed":"War planes, helicopter gunships","notes":"US special operations forces and soldiers from the 10th Mountain Division, as well as close air support, had been involved in an 8-day offensive in overrruning Taliban positions in southern mountains in Operation Mountain Viper","captured/wounded":"Not available","types of units":"10th Mountain Division","area":"Qalat","contractors' involvement":"Not available","longitude":66.9039917,"id":"54","marker icon":"small_red","source":"9/3/03, Canberra Times, \"Afghan, US forces move on Taliban hideouts;\" 9/3/03, The Irish Examiner, \"US planes bomb Taliban holdouts\"","u.s. personnel killed":"Not available"},"type":"Feature","geometry":{"type":"Polygon","coordinates":[[[66.9764846730133,32.13375716],[66.9750917408641,32.1196144825509],[66.9709664740179,32.1060153002649],[66.964267404166,32.0934822220907],[66.9552519728061,32.0824968871939],[66.9442666379093,32.073481455834],[66.9317335597351,32.0667823859821],[66.9181343774491,32.0626571191359],[66.9039917,32.0612641869867],[66.8898490225509,32.0626571191359],[66.8762498402649,32.0667823859821],[66.8637167620907,32.073481455834],[66.8527314271939,32.0824968871939],[66.843715995834,32.0934822220907],[66.8370169259822,32.1060153002649],[66.8328916591359,32.1196144825509],[66.8314987269867,32.13375716],[66.8328916591359,32.1478998374491],[66.8370169259822,32.1614990197351],[66.843715995834,32.1740320979093],[66.8527314271939,32.1850174328061],[66.8637167620907,32.194032864166],[66.8762498402649,32.2007319340179],[66.8898490225509,32.2048572008641],[66.9039917,32.2062501330133],[66.9181343774491,32.2048572008641],[66.9317335597351,32.2007319340179],[66.9442666379093,32.194032864166],[66.9552519728061,32.1850174328061],[66.964267404166,32.1740320979093],[66.9709664740179,32.1614990197351],[66.9750917408641,32.1478998374491],[66.9764846730133,32.13375716]]]}},{"properties":{"militants killed":"Not available","latitude":32.71335535,"civilians killed":"Not available","mission type":"Direct action","date":{"end_time":"2003/10/15 00:00:00 -0400","original":"10/14/03","granularity":"day","time":"2003/10/14 00:00:00 -0400"},"what was employed":"Aircraft","notes":"U.S. Special Operations Forces and aircraft were called in after militants attacked Afghan soldiers near coalition military base in Deh Rawood. American officials stated that the aircraft \"expended ordnance on the enemy\"","captured/wounded":"Not available","types of units":null,"area":"Deh Rawood","contractors' involvement":"Not available","longitude":65.45928955,"id":"55","marker icon":"small_red","source":"10/15/03, Agence France Presse, \"Fighting continues as U.S. aircraft attack militants in central Afghanistan\"","u.s. personnel killed":"0"},"type":"Feature","geometry":{"type":"Polygon","coordinates":[[[65.5317825230133,32.71335535],[65.5303895908641,32.6992126725509],[65.5262643240178,32.6856134902649],[65.519565254166,32.6730804120907],[65.5105498228061,32.6620950771939],[65.4995644879093,32.653079645834],[65.4870314097351,32.6463805759821],[65.4734322274491,32.6422553091359],[65.45928955,32.6408623769867],[65.4451468725509,32.6422553091359],[65.4315476902649,32.6463805759821],[65.4190146120907,32.653079645834],[65.4080292771939,32.6620950771939],[65.399013845834,32.6730804120907],[65.3923147759821,32.6856134902649],[65.3881895091359,32.6992126725509],[65.3867965769867,32.71335535],[65.3881895091359,32.7274980274491],[65.3923147759821,32.7410972097351],[65.399013845834,32.7536302879093],[65.4080292771939,32.7646156228061],[65.4190146120907,32.773631054166],[65.4315476902649,32.7803301240179],[65.4451468725509,32.7844553908641],[65.45928955,32.7858483230133],[65.4734322274491,32.7844553908641],[65.4870314097351,32.7803301240179],[65.4995644879093,32.773631054166],[65.5105498228061,32.7646156228061],[65.519565254166,32.7536302879093],[65.5262643240178,32.7410972097351],[65.5303895908641,32.7274980274491],[65.5317825230133,32.71335535]]]}},{"properties":{"militants killed":"Not available","latitude":33.69463755,"civilians killed":"Not available","mission type":"Direct Action","date":{"end_time":"2003/10/26 00:00:00 -0400","original":"10/25/03","granularity":"day","time":"2003/10/25 00:00:00 -0400"},"what was employed":"Not available","notes":"U.S. Special Operations forces and Afghan government troops fought against Taliban and al-Qaeda; two CIA operatives were killed during these operations","captured/wounded":"Not available","types of units":"Afghan Troops, CIA agents","area":null,"contractors' involvement":"Not available","longitude":69.48303223,"id":"56","marker icon":"small_red","source":"10/29/03, Xinhua, \"2 U.S. agents killed in east Afghanistan\"","u.s. personnel killed":"2"},"type":"Feature","geometry":{"type":"Polygon","coordinates":[[[69.5555252030133,33.69463755],[69.5541322708641,33.6804948725509],[69.5500070040179,33.6668956902649],[69.543307934166,33.6543626120907],[69.5342925028061,33.6433772771939],[69.5233071679093,33.634361845834],[69.5107740897351,33.6276627759821],[69.4971749074491,33.6235375091359],[69.48303223,33.6221445769867],[69.4688895525509,33.6235375091359],[69.4552903702649,33.6276627759821],[69.4427572920907,33.634361845834],[69.4317719571939,33.6433772771939],[69.422756525834,33.6543626120907],[69.4160574559822,33.6668956902649],[69.4119321891359,33.6804948725509],[69.4105392569867,33.69463755],[69.4119321891359,33.7087802274491],[69.4160574559822,33.7223794097351],[69.422756525834,33.7349124879093],[69.4317719571939,33.7458978228061],[69.4427572920907,33.754913254166],[69.4552903702649,33.7616123240179],[69.4688895525509,33.7657375908641],[69.48303223,33.7671305230133],[69.4971749074491,33.7657375908641],[69.5107740897351,33.7616123240179],[69.5233071679093,33.754913254166],[69.5342925028061,33.7458978228061],[69.543307934166,33.7349124879093],[69.5500070040179,33.7223794097351],[69.5541322708641,33.7087802274491],[69.5555252030133,33.69463755]]]}},{"properties":{"militants killed":"Not available","latitude":32.71335535,"civilians killed":"0","mission type":"Direct action","date":{"end_time":"2003/10/31 00:00:00 -0500","original":"10/30/03","granularity":"day","time":"2003/10/30 00:00:00 -0500"},"what was employed":"Not available","notes":"One U.S. special operator died of wounds received during a gun battle with 10 to 15 members of the Taliban at the US-led Deh Rawood base.","captured/wounded":"Not available","types of units":null,"area":"US-led Deh Rawood base","contractors' involvement":"Not available","longitude":65.45928955,"id":"57","marker icon":"small_red","source":"11/5/03, Agence France Presse","u.s. personnel killed":"1 American"},"type":"Feature","geometry":{"type":"Polygon","coordinates":[[[65.5317825230133,32.71335535],[65.5303895908641,32.6992126725509],[65.5262643240178,32.6856134902649],[65.519565254166,32.6730804120907],[65.5105498228061,32.6620950771939],[65.4995644879093,32.653079645834],[65.4870314097351,32.6463805759821],[65.4734322274491,32.6422553091359],[65.45928955,32.6408623769867],[65.4451468725509,32.6422553091359],[65.4315476902649,32.6463805759821],[65.4190146120907,32.653079645834],[65.4080292771939,32.6620950771939],[65.399013845834,32.6730804120907],[65.3923147759821,32.6856134902649],[65.3881895091359,32.6992126725509],[65.3867965769867,32.71335535],[65.3881895091359,32.7274980274491],[65.3923147759821,32.7410972097351],[65.399013845834,32.7536302879093],[65.4080292771939,32.7646156228061],[65.4190146120907,32.773631054166],[65.4315476902649,32.7803301240179],[65.4451468725509,32.7844553908641],[65.45928955,32.7858483230133],[65.4734322274491,32.7844553908641],[65.4870314097351,32.7803301240179],[65.4995644879093,32.773631054166],[65.5105498228061,32.7646156228061],[65.519565254166,32.7536302879093],[65.5262643240178,32.7410972097351],[65.5303895908641,32.7274980274491],[65.5317825230133,32.71335535]]]}},{"properties":{"militants killed":"Not available","latitude":34.9028267,"civilians killed":"0","mission type":"Direct Action","date":{"end_time":"2003/11/15 00:00:00 -0500","original":"11/14/03","granularity":"day","time":"2003/11/14 00:00:00 -0500"},"what was employed":"Not available","notes":"Special operator was soldier died of injuries from an IED that hit a Humvee","captured/wounded":"0","types of units":null,"area":"Asadabad","contractors' involvement":"Not available","longitude":71.15570068,"id":"58","marker icon":"small_red","source":"11/14/03, Dow Jones International News, \"U.S. Special Operations Soldier Killed In Afghanistan\"","u.s. personnel killed":"1 American"},"type":"Feature","geometry":{"type":"Polygon","coordinates":[[[71.2281936530133,34.9028267],[71.2268007208641,34.8886840225509],[71.2226754540178,34.8750848402649],[71.215976384166,34.8625517620907],[71.2069609528061,34.8515664271939],[71.1959756179093,34.842550995834],[71.1834425397351,34.8358519259821],[71.1698433574491,34.8317266591359],[71.15570068,34.8303337269867],[71.1415580025509,34.8317266591359],[71.1279588202649,34.8358519259821],[71.1154257420907,34.842550995834],[71.1044404071939,34.8515664271939],[71.095424975834,34.8625517620907],[71.0887259059821,34.8750848402649],[71.0846006391359,34.8886840225509],[71.0832077069867,34.9028267],[71.0846006391359,34.9169693774491],[71.0887259059821,34.9305685597351],[71.095424975834,34.9431016379093],[71.1044404071939,34.9540869728061],[71.1154257420907,34.963102404166],[71.1279588202649,34.9698014740179],[71.1415580025509,34.9739267408641],[71.15570068,34.9753196730133],[71.1698433574491,34.9739267408641],[71.1834425397351,34.9698014740179],[71.1959756179093,34.963102404166],[71.2069609528061,34.9540869728061],[71.215976384166,34.9431016379093],[71.2226754540178,34.9305685597351],[71.2268007208641,34.9169693774491],[71.2281936530133,34.9028267]]]}},{"properties":{"militants killed":"24 alleged Taliban fighters","latitude":32.11035049,"civilians killed":"0","mission type":"Direct Action","date":{"end_time":"2003/07/21 00:00:00 -0400","original":"7/20/03","granularity":"day","time":"2003/07/20 00:00:00 -0400"},"what was employed":"AH-64 Apache helicopters","notes":"Following an attack on a US special forces convoy near Spin Boldak in Kandahar province, more than 2 dozen alleged Taliban fighters were killed in southern Afghanistan.","captured/wounded":"0","types of units":null,"area":null,"contractors' involvement":"Not available","longitude":66.89944267,"id":"59","marker icon":"small_red","source":"Volume 58, Issue 1, Middle East Journal, \"Chronology: Afghanistan;\" 7/21/03, Agence France Presse, \"Taliban increase attacks on US-led forces in Afghanistan\"","u.s. personnel killed":"0"},"type":"Feature","geometry":{"type":"Polygon","coordinates":[[[66.9719356430133,32.11035049],[66.9705427108641,32.0962078125509],[66.9664174440178,32.0826086302649],[66.959718374166,32.0700755520907],[66.9507029428061,32.0590902171939],[66.9397176079093,32.050074785834],[66.9271845297351,32.0433757159821],[66.9135853474491,32.0392504491359],[66.89944267,32.0378575169867],[66.8852999925509,32.0392504491359],[66.8717008102649,32.0433757159821],[66.8591677320907,32.050074785834],[66.8481823971939,32.0590902171939],[66.839166965834,32.0700755520907],[66.8324678959821,32.0826086302649],[66.8283426291359,32.0962078125509],[66.8269496969867,32.11035049],[66.8283426291359,32.1244931674491],[66.8324678959821,32.1380923497351],[66.839166965834,32.1506254279093],[66.8481823971939,32.1616107628061],[66.8591677320907,32.170626194166],[66.8717008102649,32.1773252640179],[66.8852999925509,32.1814505308641],[66.89944267,32.1828434630133],[66.9135853474491,32.1814505308641],[66.9271845297351,32.1773252640179],[66.9397176079093,32.170626194166],[66.9507029428061,32.1616107628061],[66.959718374166,32.1506254279093],[66.9664174440178,32.1380923497351],[66.9705427108641,32.1244931674491],[66.9719356430133,32.11035049]]]}},{"properties":{"militants killed":"0","latitude":33.38673294,"civilians killed":"0","mission type":"Direct Action","date":{"end_time":"2004/04/23 00:00:00 -0400","original":"4/22/04","granularity":"day","time":"2004/04/22 00:00:00 -0400"},"what was employed":"Not available","notes":"One U.S. soldier was killed and two others were injured in a friendly-fire incident after their convoy was ambushed by the Taliban","captured/wounded":"2 U.S. soldiers wounded","types of units":"Army Second Batalion,75th Ranger Regiment","area":"Sperah","contractors' involvement":"Not available","longitude":69.85244751,"id":"60","marker icon":"small_red","source":"4/24/04, Xinhua News Agency","u.s. personnel killed":"Patrick Tilman, Army Second Battalion,75th Ranger Regiment"},"type":"Feature","geometry":{"type":"Polygon","coordinates":[[[69.9249404830133,33.38673294],[69.9235475508641,33.3725902625509],[69.9194222840179,33.3589910802649],[69.912723214166,33.3464580020907],[69.9037077828061,33.3354726671939],[69.8927224479093,33.326457235834],[69.8801893697351,33.3197581659821],[69.8665901874491,33.3156328991359],[69.85244751,33.3142399669867],[69.8383048325509,33.3156328991359],[69.8247056502649,33.3197581659821],[69.8121725720907,33.326457235834],[69.8011872371939,33.3354726671939],[69.792171805834,33.3464580020907],[69.7854727359822,33.3589910802649],[69.7813474691359,33.3725902625509],[69.7799545369867,33.38673294],[69.7813474691359,33.4008756174491],[69.7854727359822,33.4144747997351],[69.792171805834,33.4270078779093],[69.8011872371939,33.4379932128061],[69.8121725720907,33.447008644166],[69.8247056502649,33.4537077140179],[69.8383048325509,33.4578329808641],[69.85244751,33.4592259130133],[69.8665901874491,33.4578329808641],[69.8801893697351,33.4537077140179],[69.8927224479093,33.447008644166],[69.9037077828061,33.4379932128061],[69.912723214166,33.4270078779093],[69.9194222840179,33.4144747997351],[69.9235475508641,33.4008756174491],[69.9249404830133,33.38673294]]]}},{"properties":{"militants killed":"0","latitude":32.10922363,"civilians killed":"0","mission type":"Direct Action","date":{"end_time":"2004/05/30 00:00:00 -0400","original":"5/29/04","granularity":"day","time":"2004/05/29 00:00:00 -0400"},"what was employed":"Not available","notes":"Four U.S. Special Operations soldiers were killed when their vehicle hit a land mine","captured/wounded":"0","types of units":null,"area":"Qalat","contractors' involvement":"Not available","longitude":66.89944267,"id":"61","marker icon":"small_red","source":"6/4/04, Agence France-Presse, \"Thirteen suspected Taliban killed in southern Afghanistan\"","u.s. personnel killed":"4 Special Operations soldiers"},"type":"Feature","geometry":{"type":"Polygon","coordinates":[[[66.9719356430133,32.10922363],[66.9705427108641,32.0950809525509],[66.9664174440178,32.0814817702649],[66.959718374166,32.0689486920907],[66.9507029428061,32.0579633571939],[66.9397176079093,32.048947925834],[66.9271845297351,32.0422488559821],[66.9135853474491,32.0381235891359],[66.89944267,32.0367306569867],[66.8852999925509,32.0381235891359],[66.8717008102649,32.0422488559821],[66.8591677320907,32.048947925834],[66.8481823971939,32.0579633571939],[66.839166965834,32.0689486920907],[66.8324678959821,32.0814817702649],[66.8283426291359,32.0950809525509],[66.8269496969867,32.10922363],[66.8283426291359,32.1233663074491],[66.8324678959821,32.1369654897351],[66.839166965834,32.1494985679093],[66.8481823971939,32.1604839028061],[66.8591677320907,32.169499334166],[66.8717008102649,32.1761984040179],[66.8852999925509,32.1803236708641],[66.89944267,32.1817166030133],[66.9135853474491,32.1803236708641],[66.9271845297351,32.1761984040179],[66.9397176079093,32.169499334166],[66.9507029428061,32.1604839028061],[66.959718374166,32.1494985679093],[66.9664174440178,32.1369654897351],[66.9705427108641,32.1233663074491],[66.9719356430133,32.10922363]]]}},{"properties":{"militants killed":"9 suspected Taliban fighters","latitude":34.53187403,"civilians killed":"0","mission type":"Direct Action","date":{"end_time":"2004/03/07 00:00:00 -0500","original":"3/6/04","granularity":"day","time":"2004/03/06 00:00:00 -0500"},"what was employed":"Firearms","notes":"US special-operations snipers killed nine suspected Taliban fighters.","captured/wounded":"0","types of units":null,"area":null,"contractors' involvement":"Not available","longitude":69.17163849,"id":"62","marker icon":"small_red","source":"3/7/04, The Independent, \"Meanwhile, Task Force 121 steps up hunt for Bin Laden\"","u.s. personnel killed":"0"},"type":"Feature","geometry":{"type":"Polygon","coordinates":[[[69.2441314630133,34.53187403],[69.2427385308641,34.5177313525509],[69.2386132640179,34.5041321702649],[69.231914194166,34.4915990920907],[69.2228987628061,34.4806137571939],[69.2119134279093,34.471598325834],[69.1993803497351,34.4648992559821],[69.1857811674491,34.4607739891359],[69.17163849,34.4593810569867],[69.1574958125509,34.4607739891359],[69.1438966302649,34.4648992559821],[69.1313635520907,34.471598325834],[69.1203782171939,34.4806137571939],[69.111362785834,34.4915990920907],[69.1046637159822,34.5041321702649],[69.1005384491359,34.5177313525509],[69.0991455169867,34.53187403],[69.1005384491359,34.5460167074491],[69.1046637159822,34.5596158897351],[69.111362785834,34.5721489679093],[69.1203782171939,34.5831343028061],[69.1313635520907,34.592149734166],[69.1438966302649,34.5988488040179],[69.1574958125509,34.6029740708641],[69.17163849,34.6043670030133],[69.1857811674491,34.6029740708641],[69.1993803497351,34.5988488040179],[69.2119134279093,34.592149734166],[69.2228987628061,34.5831343028061],[69.231914194166,34.5721489679093],[69.2386132640179,34.5596158897351],[69.2427385308641,34.5460167074491],[69.2441314630133,34.53187403]]]}},{"properties":{"militants killed":"30-40","latitude":35.30616001,"civilians killed":"0","mission type":"Direct Action","date":{"end_time":"2004/06/29 00:00:00 -0400","original":"6/28/04","granularity":"day","time":"2004/06/28 00:00:00 -0400"},"what was employed":"Four-man team, M-4 rifles","notes":"Rescue team's helicopter crashed","captured/wounded":"40","types of units":"Navy SEALs","area":"Hindu Kush","contractors' involvement":"Not available","longitude":71.00189209,"id":"63","marker icon":"small_red","source":"10/23/07, Virginian-Pilot, \"Nation gives thanks;\" 04/16/07, Daily News, \"Navy SEAL\"","u.s. personnel killed":"19, including Navy Lt. Michael Murphy"},"type":"Feature","geometry":{"type":"Polygon","coordinates":[[[71.0743850630133,35.30616001],[71.0729921308641,35.2920173325509],[71.0688668640178,35.2784181502649],[71.062167794166,35.2658850720907],[71.0531523628061,35.2548997371939],[71.0421670279093,35.245884305834],[71.0296339497351,35.2391852359821],[71.0160347674491,35.2350599691359],[71.00189209,35.2336670369867],[70.9877494125509,35.2350599691359],[70.9741502302649,35.2391852359821],[70.9616171520907,35.245884305834],[70.9506318171939,35.2548997371939],[70.941616385834,35.2658850720907],[70.9349173159821,35.2784181502649],[70.9307920491359,35.2920173325509],[70.9293991169867,35.30616001],[70.9307920491359,35.3203026874491],[70.9349173159821,35.3339018697351],[70.941616385834,35.3464349479093],[70.9506318171939,35.3574202828061],[70.9616171520907,35.366435714166],[70.9741502302649,35.3731347840179],[70.9877494125509,35.3772600508641],[71.00189209,35.3786529830133],[71.0160347674491,35.3772600508641],[71.0296339497351,35.3731347840179],[71.0421670279093,35.366435714166],[71.0531523628061,35.3574202828061],[71.062167794166,35.3464349479093],[71.0688668640178,35.3339018697351],[71.0729921308641,35.3203026874491],[71.0743850630133,35.30616001]]]}},{"properties":{"militants killed":"6","latitude":33.69463755,"civilians killed":"0","mission type":"Counterterrorism","date":{"end_time":"2005/12/22 00:00:00 -0500","original":"12/21/05","granularity":"day","time":"2005/12/21 00:00:00 -0500"},"what was employed":"B-52s, A-10s","notes":"Special operators chase militants across the border into Pakistan","captured/wounded":"1","types of units":null,"area":null,"contractors' involvement":"Not available","longitude":69.48303223,"id":"64","marker icon":"small_green","source":"07/25/10, The Guardian / Afghanistan War Logs, \"U.S. Special Forces attack militants\"","u.s. personnel killed":"0"},"type":"Feature","geometry":{"type":"Polygon","coordinates":[[[69.5555252030133,33.69463755],[69.5541322708641,33.6804948725509],[69.5500070040179,33.6668956902649],[69.543307934166,33.6543626120907],[69.5342925028061,33.6433772771939],[69.5233071679093,33.634361845834],[69.5107740897351,33.6276627759821],[69.4971749074491,33.6235375091359],[69.48303223,33.6221445769867],[69.4688895525509,33.6235375091359],[69.4552903702649,33.6276627759821],[69.4427572920907,33.634361845834],[69.4317719571939,33.6433772771939],[69.422756525834,33.6543626120907],[69.4160574559822,33.6668956902649],[69.4119321891359,33.6804948725509],[69.4105392569867,33.69463755],[69.4119321891359,33.7087802274491],[69.4160574559822,33.7223794097351],[69.422756525834,33.7349124879093],[69.4317719571939,33.7458978228061],[69.4427572920907,33.754913254166],[69.4552903702649,33.7616123240179],[69.4688895525509,33.7657375908641],[69.48303223,33.7671305230133],[69.4971749074491,33.7657375908641],[69.5107740897351,33.7616123240179],[69.5233071679093,33.754913254166],[69.5342925028061,33.7458978228061],[69.543307934166,33.7349124879093],[69.5500070040179,33.7223794097351],[69.5541322708641,33.7087802274491],[69.5555252030133,33.69463755]]]}},{"properties":{"militants killed":"100s of militants","latitude":34.54870089,"civilians killed":"0","mission type":"Direct Action","date":{"end_time":"2030/09/02 00:00:00 -0400","original":"6-Sep","granularity":"day","time":"2030/09/01 00:00:00 -0400"},"what was employed":"Not available","notes":"In a Canadian-led mission, British and U.S. Special Operations Forces fought the Taliban; NATO officials claimed later that the troops killed several hundred Taliban fighters","captured/wounded":"14 British servicemen, 5 Canadians","types of units":"NATO troops: Canadian, Danish and Dutch troops, British Special Operations","area":null,"contractors' involvement":"Not available","longitude":65.72845459,"id":"65","marker icon":"small_red","source":"9/10/06, The Sunday Times, \"Troops die as UK holds back Afghan reinforcements\"","u.s. personnel killed":"0"},"type":"Feature","geometry":{"type":"Polygon","coordinates":[[[65.8009475630133,34.54870089],[65.7995546308641,34.5345582125509],[65.7954293640178,34.5209590302649],[65.788730294166,34.5084259520907],[65.7797148628061,34.4974406171939],[65.7687295279093,34.488425185834],[65.7561964497351,34.4817261159821],[65.7425972674491,34.4776008491359],[65.72845459,34.4762079169867],[65.7143119125509,34.4776008491359],[65.7007127302649,34.4817261159821],[65.6881796520907,34.488425185834],[65.6771943171939,34.4974406171939],[65.668178885834,34.5084259520907],[65.6614798159821,34.5209590302649],[65.6573545491359,34.5345582125509],[65.6559616169867,34.54870089],[65.6573545491359,34.5628435674491],[65.6614798159821,34.5764427497351],[65.668178885834,34.5889758279093],[65.6771943171939,34.5999611628061],[65.6881796520907,34.608976594166],[65.7007127302649,34.6156756640179],[65.7143119125509,34.6198009308641],[65.72845459,34.6211938630133],[65.7425972674491,34.6198009308641],[65.7561964497351,34.6156756640179],[65.7687295279093,34.608976594166],[65.7797148628061,34.5999611628061],[65.788730294166,34.5889758279093],[65.7954293640178,34.5764427497351],[65.7995546308641,34.5628435674491],[65.8009475630133,34.54870089]]]}},{"properties":{"militants killed":"Mullah Akhtar Mohammad Osmani (Taliban treasurer)","latitude":34.54870089,"civilians killed":"0","mission type":"Direct Action","date":{"end_time":"2006/12/24 00:00:00 -0500","original":"12/23/06","granularity":"day","time":"2006/12/23 00:00:00 -0500"},"what was employed":"RAF aircraft, smart bomb","notes":"Delta Force soldiers intercepted Taliban member Osmani's satellite telephone call, and a U.S. airplane dropped a bomb on his vehicle; afterwards, the Taliban issued a statement that the bomb had instead killed Mullah Abdul Zahir, a district commander","captured/wounded":"0","types of units":"Army Delta Force","area":null,"contractors' involvement":"Not available","longitude":65.72845459,"id":"66","marker icon":"small_red","source":"12/24/06, The Sunday Times, \"Taliban leader 'killed' after RAF tracks phone\"","u.s. personnel killed":"0"},"type":"Feature","geometry":{"type":"Polygon","coordinates":[[[65.8009475630133,34.54870089],[65.7995546308641,34.5345582125509],[65.7954293640178,34.5209590302649],[65.788730294166,34.5084259520907],[65.7797148628061,34.4974406171939],[65.7687295279093,34.488425185834],[65.7561964497351,34.4817261159821],[65.7425972674491,34.4776008491359],[65.72845459,34.4762079169867],[65.7143119125509,34.4776008491359],[65.7007127302649,34.4817261159821],[65.6881796520907,34.488425185834],[65.6771943171939,34.4974406171939],[65.668178885834,34.5084259520907],[65.6614798159821,34.5209590302649],[65.6573545491359,34.5345582125509],[65.6559616169867,34.54870089],[65.6573545491359,34.5628435674491],[65.6614798159821,34.5764427497351],[65.668178885834,34.5889758279093],[65.6771943171939,34.5999611628061],[65.6881796520907,34.608976594166],[65.7007127302649,34.6156756640179],[65.7143119125509,34.6198009308641],[65.72845459,34.6211938630133],[65.7425972674491,34.6198009308641],[65.7561964497351,34.6156756640179],[65.7687295279093,34.608976594166],[65.7797148628061,34.5999611628061],[65.788730294166,34.5889758279093],[65.7954293640178,34.5764427497351],[65.7995546308641,34.5628435674491],[65.8009475630133,34.54870089]]]}},{"properties":{"militants killed":"Not available","latitude":34.19703724,"civilians killed":"8 Afghans","mission type":"Direct Action","date":{"end_time":"2030/03/02 00:00:00 -0500","original":"7-Mar","granularity":"day","time":"2030/03/01 00:00:00 -0500"},"what was employed":"Firearms","notes":"Afghans claimed that U.S. forces fired on civilians who were riding cars and walking along a six-mile stretch of road shortly after a Marine convoy was attacked by a suicide bomber; journalists who attempted to cover the story said U.S. troops took their cameras and deleted their photos and videotapes of the aftermath and warned them not to publish any images of the event","captured/wounded":"1 Marine wounded; 34 Afghans wounded","types of units":"Marine Special Operations Forces","area":"Nangarhar","contractors' involvement":"Not available","longitude":70.62286377,"id":"67","marker icon":"small_red","source":"3/5/07, The Irish Examiner, \"U.S. troops 'confiscated bomb attack photos'\"","u.s. personnel killed":"0"},"type":"Feature","geometry":{"type":"Polygon","coordinates":[[[70.6953567430133,34.19703724],[70.6939638108641,34.1828945625509],[70.6898385440178,34.1692953802649],[70.683139474166,34.1567623020907],[70.6741240428061,34.1457769671939],[70.6631387079093,34.136761535834],[70.6506056297351,34.1300624659821],[70.6370064474491,34.1259371991359],[70.62286377,34.1245442669867],[70.6087210925509,34.1259371991359],[70.5951219102649,34.1300624659821],[70.5825888320907,34.136761535834],[70.5716034971939,34.1457769671939],[70.562588065834,34.1567623020907],[70.5558889959821,34.1692953802649],[70.5517637291359,34.1828945625509],[70.5503707969867,34.19703724],[70.5517637291359,34.2111799174491],[70.5558889959821,34.2247790997351],[70.562588065834,34.2373121779093],[70.5716034971939,34.2482975128061],[70.5825888320907,34.257312944166],[70.5951219102649,34.2640120140179],[70.6087210925509,34.2681372808641],[70.62286377,34.2695302130133],[70.6370064474491,34.2681372808641],[70.6506056297351,34.2640120140179],[70.6631387079093,34.257312944166],[70.6741240428061,34.2482975128061],[70.683139474166,34.2373121779093],[70.6898385440178,34.2247790997351],[70.6939638108641,34.2111799174491],[70.6953567430133,34.19703724]]]}},{"properties":{"militants killed":"0","latitude":34.19703724,"civilians killed":"12 Afghans","mission type":"Direct Action","date":{"end_time":"2007/03/05 00:00:00 -0500","original":"3/4/07","granularity":"day","time":"2007/03/04 00:00:00 -0500"},"what was employed":"Firearms","notes":"Marines shot at vehicles; Article 15-6 investigation started; April 2007: Afghan probe concluded Marines used excessive force","captured/wounded":"35 wounded","types of units":"Marine Special Operations Forces","area":"Nangarhar","contractors' involvement":"Not available","longitude":70.62286377,"id":"68","marker icon":"small_red","source":"03/24/07, Washington Post, \"Marine Unit Is Told To Leave Afghanistan;\" 4/14/07, Agence France-Presse, \"Afghan probe finds US used 'excessive force'\"","u.s. personnel killed":"0"},"type":"Feature","geometry":{"type":"Polygon","coordinates":[[[70.6953567430133,34.19703724],[70.6939638108641,34.1828945625509],[70.6898385440178,34.1692953802649],[70.683139474166,34.1567623020907],[70.6741240428061,34.1457769671939],[70.6631387079093,34.136761535834],[70.6506056297351,34.1300624659821],[70.6370064474491,34.1259371991359],[70.62286377,34.1245442669867],[70.6087210925509,34.1259371991359],[70.5951219102649,34.1300624659821],[70.5825888320907,34.136761535834],[70.5716034971939,34.1457769671939],[70.562588065834,34.1567623020907],[70.5558889959821,34.1692953802649],[70.5517637291359,34.1828945625509],[70.5503707969867,34.19703724],[70.5517637291359,34.2111799174491],[70.5558889959821,34.2247790997351],[70.562588065834,34.2373121779093],[70.5716034971939,34.2482975128061],[70.5825888320907,34.257312944166],[70.5951219102649,34.2640120140179],[70.6087210925509,34.2681372808641],[70.62286377,34.2695302130133],[70.6370064474491,34.2681372808641],[70.6506056297351,34.2640120140179],[70.6631387079093,34.257312944166],[70.6741240428061,34.2482975128061],[70.683139474166,34.2373121779093],[70.6898385440178,34.2247790997351],[70.6939638108641,34.2111799174491],[70.6953567430133,34.19703724]]]}},{"properties":{"militants killed":"0","latitude":34.3753914,"civilians killed":"50, including women and children","mission type":"Direct Action","date":{"end_time":"2007/04/28 00:00:00 -0400","original":"4/27/07","granularity":"day","time":"2007/04/27 00:00:00 -0400"},"what was employed":"Air strikes","notes":"Afghan and UN officials said about 50 civilians were killed on April 27 and 29 as U.S. special operators called in air strikes","captured/wounded":"Not available","types of units":null,"area":"Herat","contractors' involvement":"Not available","longitude":62.1790123,"id":"69","marker icon":"small_red","source":"5/18/07, Agence France-Presse, \"NATO re-examines tactics amid Afghan civilian deaths\"","u.s. personnel killed":"0"},"type":"Feature","geometry":{"type":"Polygon","coordinates":[[[62.2515052730133,34.3753914],[62.2501123408641,34.3612487225509],[62.2459870740179,34.3476495402649],[62.239288004166,34.3351164620907],[62.2302725728061,34.3241311271939],[62.2192872379093,34.315115695834],[62.2067541597351,34.3084166259821],[62.1931549774491,34.3042913591359],[62.1790123,34.3028984269867],[62.1648696225509,34.3042913591359],[62.1512704402649,34.3084166259821],[62.1387373620907,34.315115695834],[62.1277520271939,34.3241311271939],[62.118736595834,34.3351164620907],[62.1120375259821,34.3476495402649],[62.1079122591359,34.3612487225509],[62.1065193269867,34.3753914],[62.1079122591359,34.3895340774491],[62.1120375259821,34.4031332597351],[62.118736595834,34.4156663379093],[62.1277520271939,34.4266516728061],[62.1387373620907,34.435667104166],[62.1512704402649,34.4423661740179],[62.1648696225509,34.4464914408641],[62.1790123,34.4478843730133],[62.1931549774491,34.4464914408641],[62.2067541597351,34.4423661740179],[62.2192872379093,34.435667104166],[62.2302725728061,34.4266516728061],[62.239288004166,34.4156663379093],[62.2459870740179,34.4031332597351],[62.2501123408641,34.3895340774491],[62.2515052730133,34.3753914]]]}},{"properties":{"militants killed":"0","latitude":34.47146728,"civilians killed":"7 Afghan police officers killed","mission type":"Direct Action","date":{"end_time":"2007/06/12 00:00:00 -0400","original":"6/11/07","granularity":"day","time":"2007/06/11 00:00:00 -0400"},"what was employed":"AC-130 gunship, cannon fire","notes":"U.S. forces hit the wrong target while in pursuit of Taliban leader","captured/wounded":"4 Afghan police officers wounded","types of units":null,"area":"Jalalabad","contractors' involvement":"Not available","longitude":70.45532227,"id":"70","marker icon":"small_red","source":"07/25/10, Guardian, \"Afghanistan war logs\"","u.s. personnel killed":"0"},"type":"Feature","geometry":{"type":"Polygon","coordinates":[[[70.5278152430133,34.47146728],[70.5264223108641,34.4573246025509],[70.5222970440178,34.4437254202649],[70.515597974166,34.4311923420907],[70.5065825428061,34.4202070071939],[70.4955972079093,34.411191575834],[70.4830641297351,34.4044925059821],[70.4694649474491,34.4003672391359],[70.45532227,34.3989743069867],[70.4411795925509,34.4003672391359],[70.4275804102649,34.4044925059821],[70.4150473320907,34.411191575834],[70.4040619971939,34.4202070071939],[70.395046565834,34.4311923420907],[70.3883474959821,34.4437254202649],[70.3842222291359,34.4573246025509],[70.3828292969867,34.47146728],[70.3842222291359,34.4856099574491],[70.3883474959821,34.4992091397351],[70.395046565834,34.5117422179093],[70.4040619971939,34.5227275528061],[70.4150473320907,34.531742984166],[70.4275804102649,34.5384420540179],[70.4411795925509,34.5425673208641],[70.45532227,34.5439602530133],[70.4694649474491,34.5425673208641],[70.4830641297351,34.5384420540179],[70.4955972079093,34.531742984166],[70.5065825428061,34.5227275528061],[70.515597974166,34.5117422179093],[70.5222970440178,34.4992091397351],[70.5264223108641,34.4856099574491],[70.5278152430133,34.47146728]]]}},{"properties":{"militants killed":"Several Al Qaeda suspects","latitude":33.69463755,"civilians killed":"7 children","mission type":"Direct Action","date":{"end_time":"2007/06/17 00:00:00 -0400","original":"6/16/07","granularity":"day","time":"2007/06/16 00:00:00 -0400"},"what was employed":"Rockets","notes":"U.S. targeted a compound of suspected Al Qaeda militants; US claimed the militants had been under surveillance and there were no signs of children present","captured/wounded":"Not available","types of units":null,"area":null,"contractors' involvement":"Not available","longitude":69.48303223,"id":"71","marker icon":"small_red","source":"6/18/07, NBC News: Nightly News, \"U.S. forces kill insurgents, boys at safehouse in Afghanistan\"","u.s. personnel killed":"0"},"type":"Feature","geometry":{"type":"Polygon","coordinates":[[[69.5555252030133,33.69463755],[69.5541322708641,33.6804948725509],[69.5500070040179,33.6668956902649],[69.543307934166,33.6543626120907],[69.5342925028061,33.6433772771939],[69.5233071679093,33.634361845834],[69.5107740897351,33.6276627759821],[69.4971749074491,33.6235375091359],[69.48303223,33.6221445769867],[69.4688895525509,33.6235375091359],[69.4552903702649,33.6276627759821],[69.4427572920907,33.634361845834],[69.4317719571939,33.6433772771939],[69.422756525834,33.6543626120907],[69.4160574559822,33.6668956902649],[69.4119321891359,33.6804948725509],[69.4105392569867,33.69463755],[69.4119321891359,33.7087802274491],[69.4160574559822,33.7223794097351],[69.422756525834,33.7349124879093],[69.4317719571939,33.7458978228061],[69.4427572920907,33.754913254166],[69.4552903702649,33.7616123240179],[69.4688895525509,33.7657375908641],[69.48303223,33.7671305230133],[69.4971749074491,33.7657375908641],[69.5107740897351,33.7616123240179],[69.5233071679093,33.754913254166],[69.5342925028061,33.7458978228061],[69.543307934166,33.7349124879093],[69.5500070040179,33.7223794097351],[69.5541322708641,33.7087802274491],[69.5555252030133,33.69463755]]]}},{"properties":{"militants killed":"6","latitude":33.18698467,"civilians killed":"7","mission type":"Direct Action","date":{"end_time":"2007/06/18 00:00:00 -0400","original":"6/17/07","granularity":"day","time":"2007/06/17 00:00:00 -0400"},"what was employed":"AC-130 airship, 5 rockets","notes":"Targeted senior Al Qaeda military commander, Abu Layith al Libi, but afterwards he was not found in the rubble","captured/wounded":"7","types of units":"Army Delta Force, Navy SEALs","area":"Zareh Sharan","contractors' involvement":"Not available","longitude":68.7991333,"id":"72","marker icon":"small_red","source":"6/17/07, WikiLeaks, acessed via New York Times, \"INCIDENT REPORT: Botched Night Raid\"","u.s. personnel killed":"0"},"type":"Feature","geometry":{"type":"Polygon","coordinates":[[[68.8716262730133,33.18698467],[68.8702333408641,33.1728419925509],[68.8661080740178,33.1592428102649],[68.859409004166,33.1467097320907],[68.8503935728061,33.1357243971939],[68.8394082379093,33.126708965834],[68.8268751597351,33.1200098959821],[68.8132759774491,33.1158846291359],[68.7991333,33.1144916969867],[68.7849906225509,33.1158846291359],[68.7713914402649,33.1200098959821],[68.7588583620907,33.126708965834],[68.7478730271939,33.1357243971939],[68.738857595834,33.1467097320907],[68.7321585259821,33.1592428102649],[68.7280332591359,33.1728419925509],[68.7266403269867,33.18698467],[68.7280332591359,33.2011273474491],[68.7321585259821,33.2147265297351],[68.738857595834,33.2272596079093],[68.7478730271939,33.2382449428061],[68.7588583620907,33.247260374166],[68.7713914402649,33.2539594440179],[68.7849906225509,33.2580847108641],[68.7991333,33.2594776430133],[68.8132759774491,33.2580847108641],[68.8268751597351,33.2539594440179],[68.8394082379093,33.247260374166],[68.8503935728061,33.2382449428061],[68.859409004166,33.2272596079093],[68.8661080740178,33.2147265297351],[68.8702333408641,33.2011273474491],[68.8716262730133,33.18698467]]]}},{"properties":{"militants killed":"0","latitude":31.47083898,"civilians killed":"0","mission type":"Direct Action","date":{"end_time":"2007/08/03 00:00:00 -0400","original":"8/2/07","granularity":"day","time":"2007/08/02 00:00:00 -0400"},"what was employed":"6  (guided bomb unite) GBU-31 (2000 lbs) precision guided munitions","notes":"Two senior Taliban commanders  were targeted while in the midst of a shura; the \"target site\" was destroyed","captured/wounded":"0","types of units":null,"area":"Baghni Valley","contractors' involvement":"Not available","longitude":63.96789551,"id":"73","marker icon":"small_red","source":"9/15/2010,  WikiLeaks, accessed via Guardian, Afghanistan War Logs, \"Strike on meeting of Taliban leaders\"","u.s. personnel killed":"0"},"type":"Feature","geometry":{"type":"Polygon","coordinates":[[[64.0403884830133,31.47083898],[64.0389955508641,31.4566963025509],[64.0348702840179,31.4430971202649],[64.028171214166,31.4305640420907],[64.0191557828061,31.4195787071939],[64.0081704479093,31.410563275834],[63.9956373697351,31.4038642059821],[63.9820381874491,31.3997389391359],[63.96789551,31.3983460069867],[63.9537528325509,31.3997389391359],[63.9401536502649,31.4038642059821],[63.9276205720907,31.410563275834],[63.9166352371939,31.4195787071939],[63.907619805834,31.4305640420907],[63.9009207359821,31.4430971202649],[63.8967954691359,31.4566963025509],[63.8954025369867,31.47083898],[63.8967954691359,31.4849816574491],[63.9009207359821,31.4985808397351],[63.907619805834,31.5111139179093],[63.9166352371939,31.5220992528061],[63.9276205720907,31.531114684166],[63.9401536502649,31.5378137540179],[63.9537528325509,31.5419390208641],[63.96789551,31.5433319530133],[63.9820381874491,31.5419390208641],[63.9956373697351,31.5378137540179],[64.0081704479093,31.531114684166],[64.0191557828061,31.5220992528061],[64.028171214166,31.5111139179093],[64.0348702840179,31.4985808397351],[64.0389955508641,31.4849816574491],[64.0403884830133,31.47083898]]]}},{"properties":{"militants killed":"4","latitude":34.47146728,"civilians killed":"4","mission type":"Direct Action","date":{"end_time":"2007/11/07 00:00:00 -0500","original":"11/6/07","granularity":"day","time":"2007/11/06 00:00:00 -0500"},"what was employed":"AC-130 gunship","notes":"While pursuing Taliban commander, a U.S. special forces gunship fires at enemy","captured/wounded":"7","types of units":null,"area":"Jalalabad","contractors' involvement":"Not available","longitude":70.45532227,"id":"74","marker icon":"small_red","source":"10/18/2010, WikiLeaks, accessed through Guardian, Afghanistan War Logs,\"US special forces gunship shoots 15 police\"","u.s. personnel killed":"0"},"type":"Feature","geometry":{"type":"Polygon","coordinates":[[[70.5278152430133,34.47146728],[70.5264223108641,34.4573246025509],[70.5222970440178,34.4437254202649],[70.515597974166,34.4311923420907],[70.5065825428061,34.4202070071939],[70.4955972079093,34.411191575834],[70.4830641297351,34.4044925059821],[70.4694649474491,34.4003672391359],[70.45532227,34.3989743069867],[70.4411795925509,34.4003672391359],[70.4275804102649,34.4044925059821],[70.4150473320907,34.411191575834],[70.4040619971939,34.4202070071939],[70.395046565834,34.4311923420907],[70.3883474959821,34.4437254202649],[70.3842222291359,34.4573246025509],[70.3828292969867,34.47146728],[70.3842222291359,34.4856099574491],[70.3883474959821,34.4992091397351],[70.395046565834,34.5117422179093],[70.4040619971939,34.5227275528061],[70.4150473320907,34.531742984166],[70.4275804102649,34.5384420540179],[70.4411795925509,34.5425673208641],[70.45532227,34.5439602530133],[70.4694649474491,34.5425673208641],[70.4830641297351,34.5384420540179],[70.4955972079093,34.531742984166],[70.5065825428061,34.5227275528061],[70.515597974166,34.5117422179093],[70.5222970440178,34.4992091397351],[70.5264223108641,34.4856099574491],[70.5278152430133,34.47146728]]]}},{"properties":{"militants killed":"Afghan man shot","latitude":34.54870089,"civilians killed":"0","mission type":"Direct Action","date":{"end_time":"2008/03/06 00:00:00 -0500","original":"3/5/08","granularity":"day","time":"2008/03/05 00:00:00 -0500"},"what was employed":"Firearms","notes":"Army Master Sgt. Joseph D. Newell, 38, charged with murder","captured/wounded":"0","types of units":"Army Special Forces","area":"Hyderabad","contractors' involvement":"Not available","longitude":65.72845459,"id":"75","marker icon":"small_red","source":"02/19/09, Associated Press, \"Green Beret faces jury\"","u.s. personnel killed":"0"},"type":"Feature","geometry":{"type":"Polygon","coordinates":[[[65.8009475630133,34.54870089],[65.7995546308641,34.5345582125509],[65.7954293640178,34.5209590302649],[65.788730294166,34.5084259520907],[65.7797148628061,34.4974406171939],[65.7687295279093,34.488425185834],[65.7561964497351,34.4817261159821],[65.7425972674491,34.4776008491359],[65.72845459,34.4762079169867],[65.7143119125509,34.4776008491359],[65.7007127302649,34.4817261159821],[65.6881796520907,34.488425185834],[65.6771943171939,34.4974406171939],[65.668178885834,34.5084259520907],[65.6614798159821,34.5209590302649],[65.6573545491359,34.5345582125509],[65.6559616169867,34.54870089],[65.6573545491359,34.5628435674491],[65.6614798159821,34.5764427497351],[65.668178885834,34.5889758279093],[65.6771943171939,34.5999611628061],[65.6881796520907,34.608976594166],[65.7007127302649,34.6156756640179],[65.7143119125509,34.6198009308641],[65.72845459,34.6211938630133],[65.7425972674491,34.6198009308641],[65.7561964497351,34.6156756640179],[65.7687295279093,34.608976594166],[65.7797148628061,34.5999611628061],[65.788730294166,34.5889758279093],[65.7954293640178,34.5764427497351],[65.7995546308641,34.5628435674491],[65.8009475630133,34.54870089]]]}},{"properties":{"militants killed":"Not available","latitude":34.54870089,"civilians killed":"Not available","mission type":"Direct Action","date":{"end_time":"2008/05/30 00:00:00 -0400","original":"5/29/08","granularity":"day","time":"2008/05/29 00:00:00 -0400"},"what was employed":"Machine gun, other artillary","notes":"Sixty insurgents attacked after ambushing U.S. forces; Nunez awarded Silver Star posthumously","captured/wounded":"Not available","types of units":null,"area":"Shewan","contractors' involvement":"Not available","longitude":65.72845459,"id":"76","marker icon":"small_red","source":"08/16/10, AP, \"Special Forces;\" 08/16/10, CNN","u.s. personnel killed":"Sgt. 1st Class David Nunez, 27"},"type":"Feature","geometry":{"type":"Polygon","coordinates":[[[65.8009475630133,34.54870089],[65.7995546308641,34.5345582125509],[65.7954293640178,34.5209590302649],[65.788730294166,34.5084259520907],[65.7797148628061,34.4974406171939],[65.7687295279093,34.488425185834],[65.7561964497351,34.4817261159821],[65.7425972674491,34.4776008491359],[65.72845459,34.4762079169867],[65.7143119125509,34.4776008491359],[65.7007127302649,34.4817261159821],[65.6881796520907,34.488425185834],[65.6771943171939,34.4974406171939],[65.668178885834,34.5084259520907],[65.6614798159821,34.5209590302649],[65.6573545491359,34.5345582125509],[65.6559616169867,34.54870089],[65.6573545491359,34.5628435674491],[65.6614798159821,34.5764427497351],[65.668178885834,34.5889758279093],[65.6771943171939,34.5999611628061],[65.6881796520907,34.608976594166],[65.7007127302649,34.6156756640179],[65.7143119125509,34.6198009308641],[65.72845459,34.6211938630133],[65.7425972674491,34.6198009308641],[65.7561964497351,34.6156756640179],[65.7687295279093,34.608976594166],[65.7797148628061,34.5999611628061],[65.788730294166,34.5889758279093],[65.7954293640178,34.5764427497351],[65.7995546308641,34.5628435674491],[65.8009475630133,34.54870089]]]}},{"properties":{"militants killed":"Not available","latitude":34.3753914,"civilians killed":"0","mission type":"Direct Action","date":{"end_time":"2008/06/27 00:00:00 -0400","original":"6/26/08","granularity":"day","time":"2008/06/26 00:00:00 -0400"},"what was employed":"Air strikes called in","notes":"U.S. unit was pinned down; Sgt. 1st Class Jonathan Clouse awarded Silver Star","captured/wounded":"4 U.S. soldiers","types of units":null,"area":"Herat","contractors' involvement":"Not available","longitude":62.1790123,"id":"77","marker icon":"small_red","source":"08/17/10, Fayetteville Observer, \"Silver Stars for 7 Special Forces Soldiers\"","u.s. personnel killed":"0"},"type":"Feature","geometry":{"type":"Polygon","coordinates":[[[62.2515052730133,34.3753914],[62.2501123408641,34.3612487225509],[62.2459870740179,34.3476495402649],[62.239288004166,34.3351164620907],[62.2302725728061,34.3241311271939],[62.2192872379093,34.315115695834],[62.2067541597351,34.3084166259821],[62.1931549774491,34.3042913591359],[62.1790123,34.3028984269867],[62.1648696225509,34.3042913591359],[62.1512704402649,34.3084166259821],[62.1387373620907,34.315115695834],[62.1277520271939,34.3241311271939],[62.118736595834,34.3351164620907],[62.1120375259821,34.3476495402649],[62.1079122591359,34.3612487225509],[62.1065193269867,34.3753914],[62.1079122591359,34.3895340774491],[62.1120375259821,34.4031332597351],[62.118736595834,34.4156663379093],[62.1277520271939,34.4266516728061],[62.1387373620907,34.435667104166],[62.1512704402649,34.4423661740179],[62.1648696225509,34.4464914408641],[62.1790123,34.4478843730133],[62.1931549774491,34.4464914408641],[62.2067541597351,34.4423661740179],[62.2192872379093,34.435667104166],[62.2302725728061,34.4266516728061],[62.239288004166,34.4156663379093],[62.2459870740179,34.4031332597351],[62.2501123408641,34.3895340774491],[62.2515052730133,34.3753914]]]}},{"properties":{"militants killed":"0","latitude":34.53272252,"civilians killed":"0","mission type":"Foreign Internal Defense","date":{"end_time":"2030/08/02 00:00:00 -0400","original":"8-Aug","granularity":"day","time":"2030/08/01 00:00:00 -0400"},"what was employed":"Mortars, M-4 assault rifles","notes":"Afghan soldiers learn skills at Camp Morehead","captured/wounded":"0","types of units":null,"area":"Kabul","contractors' involvement":"Not available","longitude":69.17163849,"id":"78","marker icon":"small_yellow","source":"08/11/08, NPR, \"U.S. Troops Train Afghans\"","u.s. personnel killed":"0"},"type":"Feature","geometry":{"type":"Polygon","coordinates":[[[69.2441314630133,34.53272252],[69.2427385308641,34.5185798425509],[69.2386132640179,34.5049806602649],[69.231914194166,34.4924475820907],[69.2228987628061,34.4814622471939],[69.2119134279093,34.472446815834],[69.1993803497351,34.4657477459821],[69.1857811674491,34.4616224791359],[69.17163849,34.4602295469867],[69.1574958125509,34.4616224791359],[69.1438966302649,34.4657477459821],[69.1313635520907,34.472446815834],[69.1203782171939,34.4814622471939],[69.111362785834,34.4924475820907],[69.1046637159822,34.5049806602649],[69.1005384491359,34.5185798425509],[69.0991455169867,34.53272252],[69.1005384491359,34.5468651974491],[69.1046637159822,34.5604643797351],[69.111362785834,34.5729974579093],[69.1203782171939,34.5839827928061],[69.1313635520907,34.592998224166],[69.1438966302649,34.5996972940179],[69.1574958125509,34.6038225608641],[69.17163849,34.6052154930133],[69.1857811674491,34.6038225608641],[69.1993803497351,34.5996972940179],[69.2119134279093,34.592998224166],[69.2228987628061,34.5839827928061],[69.231914194166,34.5729974579093],[69.2386132640179,34.5604643797351],[69.2427385308641,34.5468651974491],[69.2441314630133,34.53272252]]]}},{"properties":{"militants killed":"2","latitude":34.53484372,"civilians killed":"0","mission type":"Direct Action","date":{"end_time":"2008/10/15 00:00:00 -0400","original":"10/14/08","granularity":"day","time":"2008/10/14 00:00:00 -0400"},"what was employed":"Not specified","notes":"Freed a kidnapped civilian working for Army Corps Engineers","captured/wounded":"0","types of units":null,"area":"west of Kabul","contractors' involvement":"0","longitude":69.17507172,"id":"79","marker icon":"small_red","source":"10/23/08 Agence France Presse, \"Kidnapped American Freed in Afghanistan\"","u.s. personnel killed":"0"},"type":"Feature","geometry":{"type":"Polygon","coordinates":[[[69.2475646930133,34.53484372],[69.2461717608641,34.5207010425509],[69.2420464940179,34.5071018602649],[69.235347424166,34.4945687820907],[69.2263319928061,34.4835834471939],[69.2153466579093,34.474568015834],[69.2028135797351,34.4678689459821],[69.1892143974491,34.4637436791359],[69.17507172,34.4623507469867],[69.1609290425509,34.4637436791359],[69.1473298602649,34.4678689459821],[69.1347967820907,34.474568015834],[69.1238114471939,34.4835834471939],[69.114796015834,34.4945687820907],[69.1080969459822,34.5071018602649],[69.1039716791359,34.5207010425509],[69.1025787469867,34.53484372],[69.1039716791359,34.5489863974491],[69.1080969459822,34.5625855797351],[69.114796015834,34.5751186579093],[69.1238114471939,34.5861039928061],[69.1347967820907,34.595119424166],[69.1473298602649,34.6018184940179],[69.1609290425509,34.6059437608641],[69.17507172,34.6073366930133],[69.1892143974491,34.6059437608641],[69.2028135797351,34.6018184940179],[69.2153466579093,34.595119424166],[69.2263319928061,34.5861039928061],[69.235347424166,34.5751186579093],[69.2420464940179,34.5625855797351],[69.2461717608641,34.5489863974491],[69.2475646930133,34.53484372]]]}},{"properties":{"militants killed":"6 Afghan police officers","latitude":32.1084,"civilians killed":"0","mission type":"Direct Action","date":{"end_time":"2030/12/02 00:00:00 -0500","original":"8-Dec","granularity":"day","time":"2030/12/01 00:00:00 -0500"},"what was employed":"Firearms","notes":"Friendly fire incident","captured/wounded":"0","types of units":null,"area":"Qalat","contractors' involvement":"Not available","longitude":66.8994,"id":"80","marker icon":"small_red","source":"06/05/10, The Times (London), \"Obama steps up \"black ops'\"","u.s. personnel killed":"0"},"type":"Feature","geometry":{"type":"Polygon","coordinates":[[[66.9718929730133,32.1084],[66.9705000408641,32.0942573225509],[66.9663747740179,32.0806581402649],[66.959675704166,32.0681250620907],[66.9506602728061,32.0571397271939],[66.9396749379093,32.048124295834],[66.9271418597351,32.0414252259821],[66.9135426774491,32.0372999591359],[66.8994,32.0359070269867],[66.8852573225509,32.0372999591359],[66.8716581402649,32.0414252259821],[66.8591250620907,32.048124295834],[66.8481397271939,32.0571397271939],[66.839124295834,32.0681250620907],[66.8324252259821,32.0806581402649],[66.8282999591359,32.0942573225509],[66.8269070269867,32.1084],[66.8282999591359,32.1225426774491],[66.8324252259821,32.1361418597351],[66.839124295834,32.1486749379093],[66.8481397271939,32.1596602728061],[66.8591250620907,32.168675704166],[66.8716581402649,32.1753747740179],[66.8852573225509,32.1795000408641],[66.8994,32.1808929730133],[66.9135426774491,32.1795000408641],[66.9271418597351,32.1753747740179],[66.9396749379093,32.168675704166],[66.9506602728061,32.1596602728061],[66.959675704166,32.1486749379093],[66.9663747740179,32.1361418597351],[66.9705000408641,32.1225426774491],[66.9718929730133,32.1084]]]}},{"properties":{"militants killed":"0","latitude":34.37560392,"civilians killed":"Not available","mission type":"Foreign Internal Defense","date":{"end_time":"2008/08/14 00:00:00 -0400","original":"8/13/08","granularity":"day","time":"2008/08/13 00:00:00 -0400"},"what was employed":"Not available","notes":"A team of Afghan National Army Commandos, advised by US Special Operations Forces, attacked a Taliban sanctuary freeing 16 locals in the stronghold established by a Taliban commander and destroying several Taliban weapons caches","captured/wounded":"Freed 16 local men held captive","types of units":"Afghan National Army Commandos","area":null,"contractors' involvement":"Not available","longitude":62.17909813,"id":"81","marker icon":"small_yellow","source":"8/13/08, Pajhwok Afghan News, \"16 freed as rebel stronghold attacked;\" 8/13/08, BBC Monitoring, \"Sixteen freed as Afghan Taleban stronghold attacked\"","u.s. personnel killed":"Not available"},"type":"Feature","geometry":{"type":"Polygon","coordinates":[[[62.2515911030133,34.37560392],[62.2501981708641,34.3614612425509],[62.2460729040179,34.3478620602649],[62.239373834166,34.3353289820907],[62.2303584028061,34.3243436471939],[62.2193730679093,34.315328215834],[62.2068399897351,34.3086291459821],[62.1932408074491,34.3045038791359],[62.17909813,34.3031109469867],[62.1649554525509,34.3045038791359],[62.1513562702649,34.3086291459821],[62.1388231920907,34.315328215834],[62.1278378571939,34.3243436471939],[62.118822425834,34.3353289820907],[62.1121233559821,34.3478620602649],[62.1079980891359,34.3614612425509],[62.1066051569867,34.37560392],[62.1079980891359,34.3897465974491],[62.1121233559821,34.4033457797351],[62.118822425834,34.4158788579093],[62.1278378571939,34.4268641928061],[62.1388231920907,34.435879624166],[62.1513562702649,34.4425786940179],[62.1649554525509,34.4467039608641],[62.17909813,34.4480968930133],[62.1932408074491,34.4467039608641],[62.2068399897351,34.4425786940179],[62.2193730679093,34.435879624166],[62.2303584028061,34.4268641928061],[62.239373834166,34.4158788579093],[62.2460729040179,34.4033457797351],[62.2501981708641,34.3897465974491],[62.2515911030133,34.37560392]]]}},{"properties":{"militants killed":"25 Taliban fighters","latitude":36.76721713,"civilians killed":"Dozens of Afghans, including women and children","mission type":"Counterterrorism","date":{"end_time":"2009/05/06 00:00:00 -0400","original":"5/5/09","granularity":"day","time":"2009/05/05 00:00:00 -0400"},"what was employed":"U.S. Air Force jets","notes":"U.S. air strike was misdirected","captured/wounded":"Not available","types of units":"Marines","area":"Balkh","contractors' involvement":"Not available","longitude":66.89094543,"id":"82","marker icon":"small_green","source":"05/07/09, The Independent, \"120 die as U.S. Bombs Village\"","u.s. personnel killed":"0"},"type":"Feature","geometry":{"type":"Polygon","coordinates":[[[66.9634384030133,36.76721713],[66.9620454708641,36.7530744525509],[66.9579202040179,36.7394752702649],[66.951221134166,36.7269421920907],[66.9422057028061,36.7159568571939],[66.9312203679093,36.706941425834],[66.9186872897351,36.7002423559821],[66.9050881074491,36.6961170891359],[66.89094543,36.6947241569867],[66.8768027525509,36.6961170891359],[66.8632035702649,36.7002423559821],[66.8506704920907,36.706941425834],[66.8396851571939,36.7159568571939],[66.830669725834,36.7269421920907],[66.8239706559822,36.7394752702649],[66.8198453891359,36.7530744525509],[66.8184524569867,36.76721713],[66.8198453891359,36.7813598074491],[66.8239706559822,36.7949589897351],[66.830669725834,36.8074920679093],[66.8396851571939,36.8184774028061],[66.8506704920907,36.827492834166],[66.8632035702649,36.8341919040179],[66.8768027525509,36.8383171708641],[66.89094543,36.8397101030133],[66.9050881074491,36.8383171708641],[66.9186872897351,36.8341919040179],[66.9312203679093,36.827492834166],[66.9422057028061,36.8184774028061],[66.951221134166,36.8074920679093],[66.9579202040179,36.7949589897351],[66.9620454708641,36.7813598074491],[66.9634384030133,36.76721713]]]}},{"properties":{"militants killed":"0","latitude":31.60865647,"civilians killed":"10 Afghan police, including Police Chief Matiullah Qati","mission type":"Direct Action","date":{"end_time":"2009/06/30 00:00:00 -0400","original":"6/29/09","granularity":"day","time":"2009/06/29 00:00:00 -0400"},"what was employed":"Firearms","notes":"Contractors attacked police officers; U.S. Special Forces denied responsibility","captured/wounded":"Not available","types of units":null,"area":"Kandahar","contractors' involvement":"41 private guards employed by U.S. Special Forces","longitude":65.76141357,"id":"83","marker icon":"small_red","source":"06/29/09, CBS, \"Police Chief Dies;\" 09/09, NYU, \"Public Cost of Private Security\"","u.s. personnel killed":"0"},"type":"Feature","geometry":{"type":"Polygon","coordinates":[[[65.8339065430133,31.60865647],[65.8325136108641,31.5945137925509],[65.8283883440179,31.5809146102649],[65.821689274166,31.5683815320907],[65.8126738428061,31.5573961971939],[65.8016885079093,31.548380765834],[65.7891554297351,31.5416816959821],[65.7755562474491,31.5375564291359],[65.76141357,31.5361634969867],[65.7472708925509,31.5375564291359],[65.7336717102649,31.5416816959821],[65.7211386320907,31.548380765834],[65.7101532971939,31.5573961971939],[65.701137865834,31.5683815320907],[65.6944387959822,31.5809146102649],[65.6903135291359,31.5945137925509],[65.6889205969867,31.60865647],[65.6903135291359,31.6227991474491],[65.6944387959822,31.6363983297351],[65.701137865834,31.6489314079093],[65.7101532971939,31.6599167428061],[65.7211386320907,31.668932174166],[65.7336717102649,31.6756312440179],[65.7472708925509,31.6797565108641],[65.76141357,31.6811494430133],[65.7755562474491,31.6797565108641],[65.7891554297351,31.6756312440179],[65.8016885079093,31.668932174166],[65.8126738428061,31.6599167428061],[65.821689274166,31.6489314079093],[65.8283883440179,31.6363983297351],[65.8325136108641,31.6227991474491],[65.8339065430133,31.60865647]]]}},{"properties":{"militants killed":"0","latitude":34.99287873,"civilians killed":"0","mission type":"Counterterrorism","date":{"end_time":"2010/01/01 00:00:00 -0500","original":"2009","granularity":"year","time":"2009/01/01 00:00:00 -0500"},"what was employed":"Secret facilities or \"black jails\"","notes":"Special operators allegedly mistreated teenagers Issa Mohammad, Abdul Rashid","captured/wounded":"2 detainees","types of units":null,"area":"Bagram","contractors' involvement":"Not available","longitude":69.28527832,"id":"84","marker icon":"small_green","source":"11/28/09, Washington Post, \"Two Afghans allege abuse;\" 01/08/10, Washington Post, \"U.S. military probing claims\"","u.s. personnel killed":"0"},"type":"Feature","geometry":{"type":"Polygon","coordinates":[[[69.3577712930133,34.99287873],[69.3563783608641,34.9787360525509],[69.3522530940179,34.9651368702649],[69.345554024166,34.9526037920907],[69.3365385928061,34.9416184571939],[69.3255532579093,34.932603025834],[69.3130201797351,34.9259039559821],[69.2994209974491,34.9217786891359],[69.28527832,34.9203857569867],[69.2711356425509,34.9217786891359],[69.2575364602649,34.9259039559821],[69.2450033820907,34.932603025834],[69.2340180471939,34.9416184571939],[69.225002615834,34.9526037920907],[69.2183035459822,34.9651368702649],[69.2141782791359,34.9787360525509],[69.2127853469867,34.99287873],[69.2141782791359,35.0070214074491],[69.2183035459822,35.0206205897351],[69.225002615834,35.0331536679093],[69.2340180471939,35.0441390028061],[69.2450033820907,35.053154434166],[69.2575364602649,35.0598535040179],[69.2711356425509,35.0639787708641],[69.28527832,35.0653717030133],[69.2994209974491,35.0639787708641],[69.3130201797351,35.0598535040179],[69.3255532579093,35.053154434166],[69.3365385928061,35.0441390028061],[69.345554024166,35.0331536679093],[69.3522530940179,35.0206205897351],[69.3563783608641,35.0070214074491],[69.3577712930133,34.99287873]]]}},{"properties":{"militants killed":"5","latitude":34.04014266,"civilians killed":"0","mission type":"Direct Action","date":{"end_time":"2009/03/15 00:00:00 -0400","original":"3/14/09","granularity":"day","time":"2009/03/14 00:00:00 -0400"},"what was employed":"Helicopters","notes":"Helicopter mission kills 5 in raid. Villagers claim the dead were civilians","captured/wounded":"0","types of units":"Afghan Special Forces","area":null,"contractors' involvement":"Not available","longitude":69.19189453,"id":"85","marker icon":"small_red","source":"03/14/2009 Associated Press \"5 killed in Afghan operation targeting bomb-maker\"","u.s. personnel killed":"0"},"type":"Feature","geometry":{"type":"Polygon","coordinates":[[[69.2643875030133,34.04014266],[69.2629945708641,34.0259999825509],[69.2588693040178,34.0124008002649],[69.252170234166,33.9998677220907],[69.2431548028061,33.9888823871939],[69.2321694679093,33.979866955834],[69.2196363897351,33.9731678859821],[69.2060372074491,33.9690426191359],[69.19189453,33.9676496869867],[69.1777518525509,33.9690426191359],[69.1641526702649,33.9731678859821],[69.1516195920907,33.979866955834],[69.1406342571939,33.9888823871939],[69.131618825834,33.9998677220907],[69.1249197559821,34.0124008002649],[69.1207944891359,34.0259999825509],[69.1194015569867,34.04014266],[69.1207944891359,34.0542853374491],[69.1249197559821,34.0678845197351],[69.131618825834,34.0804175979093],[69.1406342571939,34.0914029328061],[69.1516195920907,34.100418364166],[69.1641526702649,34.1071174340179],[69.1777518525509,34.1112427008641],[69.19189453,34.1126356330133],[69.2060372074491,34.1112427008641],[69.2196363897351,34.1071174340179],[69.2321694679093,34.100418364166],[69.2431548028061,34.0914029328061],[69.252170234166,34.0804175979093],[69.2588693040178,34.0678845197351],[69.2629945708641,34.0542853374491],[69.2643875030133,34.04014266]]]}},{"properties":{"militants killed":"0","latitude":34.95574426,"civilians killed":"0","mission type":"Civil Affairs","date":{"end_time":"2009/03/16 00:00:00 -0400","original":"3/15/09","granularity":"day","time":"2009/03/15 00:00:00 -0400"},"what was employed":"Not available","notes":"Troops from the Combined Joint Special Operations Task Force  Afghanistan delivered gifts including toys, clothes and school supplies to a primary school","captured/wounded":"0","types of units":null,"area":"Bagram Airfield","contractors' involvement":"Not available","longitude":69.27429199,"id":"86","marker icon":"small_blue","source":"3/20/09, USFOR-A Public Affairs, \"Special operations troops deliver smiles to Bagram schoolchildren\"","u.s. personnel killed":"0"},"type":"Feature","geometry":{"type":"Polygon","coordinates":[[[69.3467849630133,34.95574426],[69.3453920308641,34.9416015825509],[69.3412667640178,34.9280024002649],[69.334567694166,34.9154693220907],[69.3255522628061,34.9044839871939],[69.3145669279093,34.895468555834],[69.3020338497351,34.8887694859821],[69.2884346674491,34.8846442191359],[69.27429199,34.8832512869867],[69.2601493125509,34.8846442191359],[69.2465501302649,34.8887694859821],[69.2340170520907,34.895468555834],[69.2230317171939,34.9044839871939],[69.214016285834,34.9154693220907],[69.2073172159821,34.9280024002649],[69.2031919491359,34.9416015825509],[69.2017990169867,34.95574426],[69.2031919491359,34.9698869374491],[69.2073172159821,34.9834861197351],[69.214016285834,34.9960191979093],[69.2230317171939,35.0070045328061],[69.2340170520907,35.016019964166],[69.2465501302649,35.0227190340179],[69.2601493125509,35.0268443008641],[69.27429199,35.0282372330133],[69.2884346674491,35.0268443008641],[69.3020338497351,35.0227190340179],[69.3145669279093,35.016019964166],[69.3255522628061,35.0070045328061],[69.334567694166,34.9960191979093],[69.3412667640178,34.9834861197351],[69.3453920308641,34.9698869374491],[69.3467849630133,34.95574426]]]}},{"properties":{"militants killed":"0","latitude":33.36035567,"civilians killed":"0","mission type":"Civil Affairs","date":{"end_time":"2009/04/16 00:00:00 -0400","original":"4/15/09","granularity":"day","time":"2009/04/15 00:00:00 -0400"},"what was employed":"Not available","notes":"A Combined Joint Special Operations Task Force-Afghanistan dental team at a Special Operations Forces clinic","captured/wounded":"0","types of units":null,"area":"Shindand district","contractors' involvement":"Not available","longitude":62.14691162,"id":"87","marker icon":"small_blue","source":"4/15/09, USFOR-Afghanistan Public Affairs, \"Dental team keeps mission going for SOF troops\"","u.s. personnel killed":"0"},"type":"Feature","geometry":{"type":"Polygon","coordinates":[[[62.2194045930133,33.36035567],[62.2180116608641,33.3462129925509],[62.2138863940179,33.3326138102649],[62.207187324166,33.3200807320907],[62.1981718928061,33.3090953971939],[62.1871865579093,33.300079965834],[62.1746534797351,33.2933808959821],[62.1610542974491,33.2892556291359],[62.14691162,33.2878626969867],[62.1327689425509,33.2892556291359],[62.1191697602649,33.2933808959821],[62.1066366820907,33.300079965834],[62.0956513471939,33.3090953971939],[62.086635915834,33.3200807320907],[62.0799368459821,33.3326138102649],[62.0758115791359,33.3462129925509],[62.0744186469867,33.36035567],[62.0758115791359,33.3744983474491],[62.0799368459821,33.3880975297351],[62.086635915834,33.4006306079093],[62.0956513471939,33.4116159428061],[62.1066366820907,33.420631374166],[62.1191697602649,33.4273304440179],[62.1327689425509,33.4314557108641],[62.14691162,33.4328486430133],[62.1610542974491,33.4314557108641],[62.1746534797351,33.4273304440179],[62.1871865579093,33.420631374166],[62.1981718928061,33.4116159428061],[62.207187324166,33.4006306079093],[62.2138863940179,33.3880975297351],[62.2180116608641,33.3744983474491],[62.2194045930133,33.36035567]]]}},{"properties":{"militants killed":"0","latitude":31.82280431,"civilians killed":"0","mission type":"Civil Affairs","date":{"end_time":"2009/05/11 00:00:00 -0400","original":"5/10/09","granularity":"day","time":"2009/05/10 00:00:00 -0400"},"what was employed":"Not available","notes":"A Special Operations Forces team treated and medically evacuating 19 civilians","captured/wounded":"0","types of units":null,"area":"Gereshk District","contractors' involvement":"Not available","longitude":64.54987049,"id":"88","marker icon":"small_blue","source":"5/12/09, USFOR-A Public Affairs, \"Special Operations Forces save lives after suicide bombers strike\"","u.s. personnel killed":"0"},"type":"Feature","geometry":{"type":"Polygon","coordinates":[[[64.6223634630133,31.82280431],[64.6209705308641,31.8086616325509],[64.6168452640179,31.7950624502649],[64.610146194166,31.7825293720907],[64.6011307628061,31.7715440371939],[64.5901454279093,31.762528605834],[64.5776123497351,31.7558295359821],[64.5640131674491,31.7517042691359],[64.54987049,31.7503113369867],[64.5357278125509,31.7517042691359],[64.5221286302649,31.7558295359821],[64.5095955520907,31.762528605834],[64.4986102171939,31.7715440371939],[64.489594785834,31.7825293720907],[64.4828957159822,31.7950624502649],[64.4787704491359,31.8086616325509],[64.4773775169867,31.82280431],[64.4787704491359,31.8369469874491],[64.4828957159822,31.8505461697351],[64.489594785834,31.8630792479093],[64.4986102171939,31.8740645828061],[64.5095955520907,31.883080014166],[64.5221286302649,31.8897790840179],[64.5357278125509,31.8939043508641],[64.54987049,31.8952972830133],[64.5640131674491,31.8939043508641],[64.5776123497351,31.8897790840179],[64.5901454279093,31.883080014166],[64.6011307628061,31.8740645828061],[64.610146194166,31.8630792479093],[64.6168452640179,31.8505461697351],[64.6209705308641,31.8369469874491],[64.6223634630133,31.82280431]]]}},{"properties":{"militants killed":"5 militants","latitude":33.36035567,"civilians killed":"0","mission type":"Direct Action","date":{"end_time":"2009/05/13 00:00:00 -0400","original":"5/12/09","granularity":"day","time":"2009/05/12 00:00:00 -0400"},"what was employed":"Not available","notes":"Afghan National Army Commandos with the 207th Corps, assisted by Special Operations Forces, killed five militants and wounded six others after a supply convoy was attacked","captured/wounded":"6 militants wounded","types of units":"207th Corps ANA","area":"Shindand district","contractors' involvement":"Not available","longitude":62.14691162,"id":"89","marker icon":"small_red","source":"5/12/09, USFOR-A Public Affairs, \"Afghan Commandos, Special Operations forces\"","u.s. personnel killed":"0"},"type":"Feature","geometry":{"type":"Polygon","coordinates":[[[62.2194045930133,33.36035567],[62.2180116608641,33.3462129925509],[62.2138863940179,33.3326138102649],[62.207187324166,33.3200807320907],[62.1981718928061,33.3090953971939],[62.1871865579093,33.300079965834],[62.1746534797351,33.2933808959821],[62.1610542974491,33.2892556291359],[62.14691162,33.2878626969867],[62.1327689425509,33.2892556291359],[62.1191697602649,33.2933808959821],[62.1066366820907,33.300079965834],[62.0956513471939,33.3090953971939],[62.086635915834,33.3200807320907],[62.0799368459821,33.3326138102649],[62.0758115791359,33.3462129925509],[62.0744186469867,33.36035567],[62.0758115791359,33.3744983474491],[62.0799368459821,33.3880975297351],[62.086635915834,33.4006306079093],[62.0956513471939,33.4116159428061],[62.1066366820907,33.420631374166],[62.1191697602649,33.4273304440179],[62.1327689425509,33.4314557108641],[62.14691162,33.4328486430133],[62.1610542974491,33.4314557108641],[62.1746534797351,33.4273304440179],[62.1871865579093,33.420631374166],[62.1981718928061,33.4116159428061],[62.207187324166,33.4006306079093],[62.2138863940179,33.3880975297351],[62.2180116608641,33.3744983474491],[62.2194045930133,33.36035567]]]}},{"properties":{"militants killed":"0","latitude":32.35676318,"civilians killed":"0","mission type":"Direct Action","date":{"end_time":"2009/05/17 00:00:00 -0400","original":"5/16/09","granularity":"day","time":"2009/05/16 00:00:00 -0400"},"what was employed":"Not available","notes":"Afghan National Police, assisted by Special Operations Forces,  discovered a Taliban base camp in the Jani Kheyl District while conducting a combat reconnaissance patrol.","captured/wounded":"7","types of units":"ANP","area":"Jani Kheyl District","contractors' involvement":"Not available","longitude":68.30474854,"id":"90","marker icon":"small_red","source":"5/18/09, USFOR-A Public Affairs, \"ANP, Special Operations Forces detain 7 insurgents\"","u.s. personnel killed":"0"},"type":"Feature","geometry":{"type":"Polygon","coordinates":[[[68.3772415130133,32.35676318],[68.3758485808641,32.3426205025509],[68.3717233140179,32.3290213202649],[68.365024244166,32.3164882420907],[68.3560088128061,32.3055029071939],[68.3450234779093,32.296487475834],[68.3324903997351,32.2897884059821],[68.3188912174491,32.2856631391359],[68.30474854,32.2842702069867],[68.2906058625509,32.2856631391359],[68.2770066802649,32.2897884059821],[68.2644736020907,32.296487475834],[68.2534882671939,32.3055029071939],[68.244472835834,32.3164882420907],[68.2377737659822,32.3290213202649],[68.2336484991359,32.3426205025509],[68.2322555669867,32.35676318],[68.2336484991359,32.3709058574491],[68.2377737659822,32.3845050397351],[68.244472835834,32.3970381179093],[68.2534882671939,32.4080234528061],[68.2644736020907,32.417038884166],[68.2770066802649,32.4237379540179],[68.2906058625509,32.4278632208641],[68.30474854,32.4292561530133],[68.3188912174491,32.4278632208641],[68.3324903997351,32.4237379540179],[68.3450234779093,32.417038884166],[68.3560088128061,32.4080234528061],[68.365024244166,32.3970381179093],[68.3717233140179,32.3845050397351],[68.3758485808641,32.3709058574491],[68.3772415130133,32.35676318]]]}},{"properties":{"militants killed":"0","latitude":34.24132423,"civilians killed":"0","mission type":"Civil Affairs","date":{"end_time":"2009/05/18 00:00:00 -0400","original":"5/17/09","granularity":"day","time":"2009/05/17 00:00:00 -0400"},"what was employed":"Not available","notes":"Afghan National Security Force members, assisted by Special Operations Forces, provided medical treatment and provided humanitarian aid to villagers","captured/wounded":"0","types of units":"ANSF","area":null,"contractors' involvement":"Not available","longitude":70.64208984,"id":"91","marker icon":"small_blue","source":"5/18/09, USFOR-A Public Affairs, \"ANP, Special Operations Forces\"","u.s. personnel killed":"0"},"type":"Feature","geometry":{"type":"Polygon","coordinates":[[[70.7145828130133,34.24132423],[70.7131898808641,34.2271815525509],[70.7090646140178,34.2135823702649],[70.702365544166,34.2010492920907],[70.6933501128061,34.1900639571939],[70.6823647779093,34.181048525834],[70.6698316997351,34.1743494559821],[70.6562325174491,34.1702241891359],[70.64208984,34.1688312569867],[70.6279471625509,34.1702241891359],[70.6143479802649,34.1743494559821],[70.6018149020907,34.181048525834],[70.5908295671939,34.1900639571939],[70.581814135834,34.2010492920907],[70.5751150659821,34.2135823702649],[70.5709897991359,34.2271815525509],[70.5695968669867,34.24132423],[70.5709897991359,34.2554669074491],[70.5751150659821,34.2690660897351],[70.581814135834,34.2815991679093],[70.5908295671939,34.2925845028061],[70.6018149020907,34.301599934166],[70.6143479802649,34.3082990040179],[70.6279471625509,34.3124242708641],[70.64208984,34.3138172030133],[70.6562325174491,34.3124242708641],[70.6698316997351,34.3082990040179],[70.6823647779093,34.301599934166],[70.6933501128061,34.2925845028061],[70.702365544166,34.2815991679093],[70.7090646140178,34.2690660897351],[70.7131898808641,34.2554669074491],[70.7145828130133,34.24132423]]]}},{"properties":{"militants killed":"40 Taliban militants","latitude":33.31216784,"civilians killed":"0","mission type":"Direct Action","date":{"end_time":"2009/06/05 00:00:00 -0400","original":"6/4/09","granularity":"day","time":"2009/06/04 00:00:00 -0400"},"what was employed":"Not available","notes":"U.S. Special Operations assisted Afghan and Dutch troops in a battle against the Taliban","captured/wounded":"Not available","types of units":"Afghan and Dutch Troops","area":null,"contractors' involvement":"Not available","longitude":66.26953125,"id":"92","marker icon":"small_red","source":"6/11/09, Angence France-Presse, \"Taliban killed in Afghan operations\"","u.s. personnel killed":"0"},"type":"Feature","geometry":{"type":"Polygon","coordinates":[[[66.3420242230133,33.31216784],[66.3406312908641,33.2980251625509],[66.3365060240179,33.2844259802649],[66.329806954166,33.2718929020907],[66.3207915228061,33.2609075671939],[66.3098061879093,33.251892135834],[66.2972731097351,33.2451930659821],[66.2836739274491,33.2410677991359],[66.26953125,33.2396748669867],[66.2553885725509,33.2410677991359],[66.2417893902649,33.2451930659821],[66.2292563120907,33.251892135834],[66.2182709771939,33.2609075671939],[66.209255545834,33.2718929020907],[66.2025564759821,33.2844259802649],[66.1984312091359,33.2980251625509],[66.1970382769867,33.31216784],[66.1984312091359,33.3263105174491],[66.2025564759821,33.3399096997351],[66.209255545834,33.3524427779093],[66.2182709771939,33.3634281128061],[66.2292563120907,33.372443544166],[66.2417893902649,33.3791426140179],[66.2553885725509,33.3832678808641],[66.26953125,33.3846608130133],[66.2836739274491,33.3832678808641],[66.2972731097351,33.3791426140179],[66.3098061879093,33.372443544166],[66.3207915228061,33.3634281128061],[66.329806954166,33.3524427779093],[66.3365060240179,33.3399096997351],[66.3406312908641,33.3263105174491],[66.3420242230133,33.31216784]]]}},{"properties":{"militants killed":"0","latitude":32.71335535,"civilians killed":"0","mission type":"Civil Affairs","date":{"end_time":"2030/07/02 00:00:00 -0400","original":"9-Jul","granularity":"day","time":"2030/07/01 00:00:00 -0400"},"what was employed":"Not available","notes":"A Special Forces team teach local Afghan children four hours every day in a schoolhouse setting","captured/wounded":"0","types of units":null,"area":"Deh Rawood","contractors' involvement":"Not available","longitude":65.45928955,"id":"93","marker icon":"small_blue","source":"7/22/09, CJSOTF-A Public Affairs, \"Special operations soldiers bring gift of education to Afghan children\"","u.s. personnel killed":"0"},"type":"Feature","geometry":{"type":"Polygon","coordinates":[[[65.5317825230133,32.71335535],[65.5303895908641,32.6992126725509],[65.5262643240178,32.6856134902649],[65.519565254166,32.6730804120907],[65.5105498228061,32.6620950771939],[65.4995644879093,32.653079645834],[65.4870314097351,32.6463805759821],[65.4734322274491,32.6422553091359],[65.45928955,32.6408623769867],[65.4451468725509,32.6422553091359],[65.4315476902649,32.6463805759821],[65.4190146120907,32.653079645834],[65.4080292771939,32.6620950771939],[65.399013845834,32.6730804120907],[65.3923147759821,32.6856134902649],[65.3881895091359,32.6992126725509],[65.3867965769867,32.71335535],[65.3881895091359,32.7274980274491],[65.3923147759821,32.7410972097351],[65.399013845834,32.7536302879093],[65.4080292771939,32.7646156228061],[65.4190146120907,32.773631054166],[65.4315476902649,32.7803301240179],[65.4451468725509,32.7844553908641],[65.45928955,32.7858483230133],[65.4734322274491,32.7844553908641],[65.4870314097351,32.7803301240179],[65.4995644879093,32.773631054166],[65.5105498228061,32.7646156228061],[65.519565254166,32.7536302879093],[65.5262643240178,32.7410972097351],[65.5303895908641,32.7274980274491],[65.5317825230133,32.71335535]]]}},{"properties":{"militants killed":"7","latitude":32.25694277,"civilians killed":"0","mission type":"Counterterrorism","date":{"end_time":"2009/08/10 00:00:00 -0400","original":"8/9/09","granularity":"day","time":"2009/08/09 00:00:00 -0400"},"what was employed":"Not available","notes":"Forces conducted joint sweeps, recovering large caches of firearms","captured/wounded":"5","types of units":"Coalition Troops, Afghan National Army Troops","area":null,"contractors' involvement":"Not available","longitude":67.1786499,"id":"94","marker icon":"small_green","source":"08/0/10, Pajhwok Afghan News, \"7 suspects killed, 5 detained\"","u.s. personnel killed":"0"},"type":"Feature","geometry":{"type":"Polygon","coordinates":[[[67.2511428730133,32.25694277],[67.2497499408641,32.2428000925509],[67.2456246740178,32.2292009102649],[67.238925604166,32.2166678320907],[67.2299101728061,32.2056824971939],[67.2189248379093,32.196667065834],[67.2063917597351,32.1899679959821],[67.1927925774491,32.1858427291359],[67.1786499,32.1844497969867],[67.1645072225509,32.1858427291359],[67.1509080402649,32.1899679959821],[67.1383749620907,32.196667065834],[67.1273896271939,32.2056824971939],[67.118374195834,32.2166678320907],[67.1116751259821,32.2292009102649],[67.1075498591359,32.2428000925509],[67.1061569269867,32.25694277],[67.1075498591359,32.2710854474491],[67.1116751259821,32.2846846297351],[67.118374195834,32.2972177079093],[67.1273896271939,32.3082030428061],[67.1383749620907,32.317218474166],[67.1509080402649,32.3239175440179],[67.1645072225509,32.3280428108641],[67.1786499,32.3294357430133],[67.1927925774491,32.3280428108641],[67.2063917597351,32.3239175440179],[67.2189248379093,32.317218474166],[67.2299101728061,32.3082030428061],[67.238925604166,32.2972177079093],[67.2456246740178,32.2846846297351],[67.2497499408641,32.2710854474491],[67.2511428730133,32.25694277]]]}},{"properties":{"militants killed":"6 Taliban, including a commander","latitude":32.40199432,"civilians killed":"0","mission type":"Direct Action","date":{"end_time":"2009/08/12 00:00:00 -0400","original":"8/11/09","granularity":"day","time":"2009/08/11 00:00:00 -0400"},"what was employed":"Firearms","notes":null,"captured/wounded":"1 Taliban wounded","types of units":null,"area":null,"contractors' involvement":"Not available","longitude":62.11807251,"id":"95","marker icon":"small_red","source":"09/12/09, AFP, \"US, Afghan troops launch operation\"","u.s. personnel killed":"0"},"type":"Feature","geometry":{"type":"Polygon","coordinates":[[[62.1905654830133,32.40199432],[62.1891725508641,32.3878516425509],[62.1850472840179,32.3742524602649],[62.178348214166,32.3617193820907],[62.1693327828061,32.3507340471939],[62.1583474479093,32.341718615834],[62.1458143697351,32.3350195459821],[62.1322151874491,32.3308942791359],[62.11807251,32.3295013469867],[62.1039298325509,32.3308942791359],[62.0903306502649,32.3350195459821],[62.0777975720907,32.341718615834],[62.0668122371939,32.3507340471939],[62.057796805834,32.3617193820907],[62.0510977359821,32.3742524602649],[62.0469724691359,32.3878516425509],[62.0455795369867,32.40199432],[62.0469724691359,32.4161369974491],[62.0510977359821,32.4297361797351],[62.057796805834,32.4422692579093],[62.0668122371939,32.4532545928061],[62.0777975720907,32.462270024166],[62.0903306502649,32.4689690940179],[62.1039298325509,32.4730943608641],[62.11807251,32.4744872930133],[62.1322151874491,32.4730943608641],[62.1458143697351,32.4689690940179],[62.1583474479093,32.462270024166],[62.1693327828061,32.4532545928061],[62.178348214166,32.4422692579093],[62.1850472840179,32.4297361797351],[62.1891725508641,32.4161369974491],[62.1905654830133,32.40199432]]]}},{"properties":{"militants killed":"150 Taliban fighters","latitude":36.82247761,"civilians killed":"Not available","mission type":"Direct Action","date":{"end_time":"2030/09/02 00:00:00 -0400","original":"9-Sep","granularity":"day","time":"2030/09/01 00:00:00 -0400"},"what was employed":"Not available","notes":"Secretive units from U.S.  Special Operations forces killed Taliban fighters","captured/wounded":"Not available","types of units":null,"area":"Kunduz","contractors' involvement":"Not available","longitude":68.80187988,"id":"96","marker icon":"small_red","source":"12/29/09, The Pak Banker, \"Pakistan: US Special operations forces expand in Afghanistan\"","u.s. personnel killed":"0"},"type":"Feature","geometry":{"type":"Polygon","coordinates":[[[68.8743728530133,36.82247761],[68.8729799208641,36.8083349325509],[68.8688546540179,36.7947357502649],[68.862155584166,36.7822026720907],[68.8531401528061,36.7712173371939],[68.8421548179093,36.762201905834],[68.8296217397351,36.7555028359821],[68.8160225574491,36.7513775691359],[68.80187988,36.7499846369867],[68.7877372025509,36.7513775691359],[68.7741380202649,36.7555028359821],[68.7616049420907,36.762201905834],[68.7506196071939,36.7712173371939],[68.741604175834,36.7822026720907],[68.7349051059822,36.7947357502649],[68.7307798391359,36.8083349325509],[68.7293869069867,36.82247761],[68.7307798391359,36.8366202874491],[68.7349051059822,36.8502194697351],[68.741604175834,36.8627525479093],[68.7506196071939,36.8737378828061],[68.7616049420907,36.882753314166],[68.7741380202649,36.8894523840179],[68.7877372025509,36.8935776508641],[68.80187988,36.8949705830133],[68.8160225574491,36.8935776508641],[68.8296217397351,36.8894523840179],[68.8421548179093,36.882753314166],[68.8531401528061,36.8737378828061],[68.862155584166,36.8627525479093],[68.8688546540179,36.8502194697351],[68.8729799208641,36.8366202874491],[68.8743728530133,36.82247761]]]}},{"properties":{"militants killed":"Not available","latitude":31.57853543,"civilians killed":"Not available","mission type":"Direct Action","date":{"end_time":"2030/09/02 00:00:00 -0400","original":"9-Sep","granularity":"day","time":"2030/09/01 00:00:00 -0400"},"what was employed":"Not available","notes":"Secretive units from U.S. Special Operations killed an unknown number of Taliban fighters","captured/wounded":"Not available","types of units":null,"area":"Marja","contractors' involvement":"Not available","longitude":64.11621094,"id":"97","marker icon":"small_red","source":"12/29/09, Daily The Pak Banker, \"Pakistan: U.S. Special operations forces expand in Afghanistan\"","u.s. personnel killed":"0"},"type":"Feature","geometry":{"type":"Polygon","coordinates":[[[64.1887039130133,31.57853543],[64.1873109808641,31.5643927525509],[64.1831857140179,31.5507935702649],[64.176486644166,31.5382604920907],[64.1674712128061,31.5272751571939],[64.1564858779093,31.518259725834],[64.1439527997351,31.5115606559821],[64.1303536174491,31.5074353891359],[64.11621094,31.5060424569867],[64.1020682625509,31.5074353891359],[64.0884690802649,31.5115606559821],[64.0759360020907,31.518259725834],[64.0649506671939,31.5272751571939],[64.055935235834,31.5382604920907],[64.0492361659822,31.5507935702649],[64.0451108991359,31.5643927525509],[64.0437179669867,31.57853543],[64.0451108991359,31.5926781074491],[64.0492361659822,31.6062772897351],[64.055935235834,31.6188103679093],[64.0649506671939,31.6297957028061],[64.0759360020907,31.638811134166],[64.0884690802649,31.6455102040179],[64.1020682625509,31.6496354708641],[64.11621094,31.6510284030133],[64.1303536174491,31.6496354708641],[64.1439527997351,31.6455102040179],[64.1564858779093,31.638811134166],[64.1674712128061,31.6297957028061],[64.176486644166,31.6188103679093],[64.1831857140179,31.6062772897351],[64.1873109808641,31.5926781074491],[64.1887039130133,31.57853543]]]}},{"properties":{"militants killed":"0","latitude":35.29943548,"civilians killed":"9 boarding-school students","mission type":"Direct Action","date":{"end_time":"2009/12/27 00:00:00 -0500","original":"12/26/09","granularity":"day","time":"2009/12/26 00:00:00 -0500"},"what was employed":"Firearms","notes":"U.S. hit wrong target in night raid","captured/wounded":"Not available","types of units":null,"area":null,"contractors' involvement":"Not available","longitude":71.01837158,"id":"98","marker icon":"small_red","source":"03/16/10, New York Times, \"U.S. Is Reining in Special Forces\"","u.s. personnel killed":"0"},"type":"Feature","geometry":{"type":"Polygon","coordinates":[[[71.0908645530133,35.29943548],[71.0894716208641,35.2852928025509],[71.0853463540178,35.2716936202649],[71.078647284166,35.2591605420907],[71.0696318528061,35.2481752071939],[71.0586465179093,35.239159775834],[71.0461134397351,35.2324607059821],[71.0325142574491,35.2283354391359],[71.01837158,35.2269425069867],[71.0042289025509,35.2283354391359],[70.9906297202649,35.2324607059821],[70.9780966420907,35.239159775834],[70.9671113071939,35.2481752071939],[70.958095875834,35.2591605420907],[70.9513968059821,35.2716936202649],[70.9472715391359,35.2852928025509],[70.9458786069867,35.29943548],[70.9472715391359,35.3135781574491],[70.9513968059821,35.3271773397351],[70.958095875834,35.3397104179093],[70.9671113071939,35.3506957528061],[70.9780966420907,35.359711184166],[70.9906297202649,35.3664102540179],[71.0042289025509,35.3705355208641],[71.01837158,35.3719284530133],[71.0325142574491,35.3705355208641],[71.0461134397351,35.3664102540179],[71.0586465179093,35.359711184166],[71.0696318528061,35.3506957528061],[71.078647284166,35.3397104179093],[71.0853463540178,35.3271773397351],[71.0894716208641,35.3135781574491],[71.0908645530133,35.29943548]]]}},{"properties":{"militants killed":"More than 12 insurgents","latitude":34.37560392,"civilians killed":"0","mission type":"Direct Action","date":{"end_time":"2009/10/27 00:00:00 -0400","original":"10/26/09","granularity":"day","time":"2009/10/26 00:00:00 -0400"},"what was employed":"Transport helicopters","notes":"American Special Ops, Afghan commandos and US DEA agents engaged in an operation in western Afghanistan in which they killed more than 12 insurgents; headed back to base, one helicopter crashed. Taliban claimed responsibility, US investigation opened","captured/wounded":"26 Afghans and Americans injured","types of units":"Afghan commandos and US DEA agents","area":null,"contractors' involvement":"Not available","longitude":62.17909813,"id":"99","marker icon":"small_red","source":"12/27/09, NBC News: Today, \"Deadliest day for the US in Afghanistan in more than four years when 14 are killed in two separate chopper crashes\"","u.s. personnel killed":"7 US servicemen and 3 government agents"},"type":"Feature","geometry":{"type":"Polygon","coordinates":[[[62.2515911030133,34.37560392],[62.2501981708641,34.3614612425509],[62.2460729040179,34.3478620602649],[62.239373834166,34.3353289820907],[62.2303584028061,34.3243436471939],[62.2193730679093,34.315328215834],[62.2068399897351,34.3086291459821],[62.1932408074491,34.3045038791359],[62.17909813,34.3031109469867],[62.1649554525509,34.3045038791359],[62.1513562702649,34.3086291459821],[62.1388231920907,34.315328215834],[62.1278378571939,34.3243436471939],[62.118822425834,34.3353289820907],[62.1121233559821,34.3478620602649],[62.1079980891359,34.3614612425509],[62.1066051569867,34.37560392],[62.1079980891359,34.3897465974491],[62.1121233559821,34.4033457797351],[62.118822425834,34.4158788579093],[62.1278378571939,34.4268641928061],[62.1388231920907,34.435879624166],[62.1513562702649,34.4425786940179],[62.1649554525509,34.4467039608641],[62.17909813,34.4480968930133],[62.1932408074491,34.4467039608641],[62.2068399897351,34.4425786940179],[62.2193730679093,34.435879624166],[62.2303584028061,34.4268641928061],[62.239373834166,34.4158788579093],[62.2460729040179,34.4033457797351],[62.2501981708641,34.3897465974491],[62.2515911030133,34.37560392]]]}},{"properties":{"militants killed":"8","latitude":34.30374066,"civilians killed":"0","mission type":"Direct Action","date":{"end_time":"2009/02/17 00:00:00 -0500","original":"2/16/09","granularity":"day","time":"2009/02/16 00:00:00 -0500"},"what was employed":"4 X (guided bomb unit) GBU-38 from 2 X US F-15.","notes":"Target elimination","captured/wounded":"0","types of units":null,"area":"Pashtun Zarghun","contractors' involvement":"Not available","longitude":62.61383057,"id":"100","marker icon":"small_red","source":"accessed 9/15/2010  The Guardian - Afghanistan War Logs, \"Top Taliban bombed\"","u.s. personnel killed":"0"},"type":"Feature","geometry":{"type":"Polygon","coordinates":[[[62.6863235430133,34.30374066],[62.6849306108641,34.2895979825509],[62.6808053440179,34.2759988002649],[62.674106274166,34.2634657220907],[62.6650908428061,34.2524803871939],[62.6541055079093,34.243464955834],[62.6415724297351,34.2367658859821],[62.6279732474491,34.2326406191359],[62.61383057,34.2312476869867],[62.5996878925509,34.2326406191359],[62.5860887102649,34.2367658859821],[62.5735556320907,34.243464955834],[62.5625702971939,34.2524803871939],[62.553554865834,34.2634657220907],[62.5468557959821,34.2759988002649],[62.5427305291359,34.2895979825509],[62.5413375969867,34.30374066],[62.5427305291359,34.3178833374491],[62.5468557959821,34.3314825197351],[62.553554865834,34.3440155979093],[62.5625702971939,34.3550009328061],[62.5735556320907,34.364016364166],[62.5860887102649,34.3707154340179],[62.5996878925509,34.3748407008641],[62.61383057,34.3762336330133],[62.6279732474491,34.3748407008641],[62.6415724297351,34.3707154340179],[62.6541055079093,34.364016364166],[62.6650908428061,34.3550009328061],[62.674106274166,34.3440155979093],[62.6808053440179,34.3314825197351],[62.6849306108641,34.3178833374491],[62.6863235430133,34.30374066]]]}},{"properties":{"militants killed":"0","latitude":31.65411202,"civilians killed":"1","mission type":"Counterterrorism","date":{"end_time":"2009/12/12 00:00:00 -0500","original":"12/11/09","granularity":"day","time":"2009/12/11 00:00:00 -0500"},"what was employed":"Firearms","notes":"Force fired upon civilian acting upon suspicions.  4 fired rounds, one of which wounded the man and another killing a civilian woman","captured/wounded":"1","types of units":null,"area":"Arghandab","contractors' involvement":"Not available","longitude":65.65069199,"id":"101","marker icon":"small_green","source":"accessed 9/15/2010  The Guardian - Afghanistan War Logs, \"Woman killed, man hurt, by special forces searchers\"","u.s. personnel killed":"0"},"type":"Feature","geometry":{"type":"Polygon","coordinates":[[[65.7231849630133,31.65411202],[65.7217920308641,31.6399693425509],[65.7176667640178,31.6263701602649],[65.710967694166,31.6138370820907],[65.7019522628061,31.6028517471939],[65.6909669279093,31.593836315834],[65.6784338497351,31.5871372459821],[65.6648346674491,31.5830119791359],[65.65069199,31.5816190469867],[65.6365493125509,31.5830119791359],[65.6229501302649,31.5871372459821],[65.6104170520907,31.593836315834],[65.5994317171939,31.6028517471939],[65.590416285834,31.6138370820907],[65.5837172159821,31.6263701602649],[65.5795919491359,31.6399693425509],[65.5781990169867,31.65411202],[65.5795919491359,31.6682546974491],[65.5837172159821,31.6818538797351],[65.590416285834,31.6943869579093],[65.5994317171939,31.7053722928061],[65.6104170520907,31.714387724166],[65.6229501302649,31.7210867940179],[65.6365493125509,31.7252120608641],[65.65069199,31.7266049930133],[65.6648346674491,31.7252120608641],[65.6784338497351,31.7210867940179],[65.6909669279093,31.714387724166],[65.7019522628061,31.7053722928061],[65.710967694166,31.6943869579093],[65.7176667640178,31.6818538797351],[65.7217920308641,31.6682546974491],[65.7231849630133,31.65411202]]]}},{"properties":{"militants killed":"8","latitude":34.30714386,"civilians killed":"0","mission type":"Direct Action","date":{"end_time":"2009/12/17 00:00:00 -0500","original":"12/16/09","granularity":"day","time":"2009/12/16 00:00:00 -0500"},"what was employed":"4 X (guided bomb unit) GBU-38 from 2 X US F-15.","notes":"Target elimination","captured/wounded":"0","types of units":null,"area":"Pashtun Zarghun","contractors' involvement":"Not available","longitude":62.61520386,"id":"102","marker icon":"small_red","source":"accessed 9/15/2010  The Guardian - Afghanistan War Logs, \"Top Taliban bombed\"","u.s. personnel killed":"0"},"type":"Feature","geometry":{"type":"Polygon","coordinates":[[[62.6876968330133,34.30714386],[62.6863039008641,34.2930011825509],[62.6821786340179,34.2794020002649],[62.675479564166,34.2668689220907],[62.6664641328061,34.2558835871939],[62.6554787979093,34.246868155834],[62.6429457197351,34.2401690859821],[62.6293465374491,34.2360438191359],[62.61520386,34.2346508869867],[62.6010611825509,34.2360438191359],[62.5874620002649,34.2401690859821],[62.5749289220907,34.246868155834],[62.5639435871939,34.2558835871939],[62.554928155834,34.2668689220907],[62.5482290859821,34.2794020002649],[62.5441038191359,34.2930011825509],[62.5427108869867,34.30714386],[62.5441038191359,34.3212865374491],[62.5482290859821,34.3348857197351],[62.554928155834,34.3474187979093],[62.5639435871939,34.3584041328061],[62.5749289220907,34.367419564166],[62.5874620002649,34.3741186340179],[62.6010611825509,34.3782439008641],[62.61520386,34.3796368330133],[62.6293465374491,34.3782439008641],[62.6429457197351,34.3741186340179],[62.6554787979093,34.367419564166],[62.6664641328061,34.3584041328061],[62.675479564166,34.3474187979093],[62.6821786340179,34.3348857197351],[62.6863039008641,34.3212865374491],[62.6876968330133,34.30714386]]]}},{"properties":{"militants killed":"Not available","latitude":36.82247761,"civilians killed":"Not available","mission type":"Direct Action","date":{"end_time":"2011/01/01 00:00:00 -0500","original":"2010","granularity":"year","time":"2010/01/01 00:00:00 -0500"},"what was employed":"Nine mid- and senior-level Taliban, including Mullah Khan Mohammad","notes":"Special operators conducted series of night raids","captured/wounded":"Not available","types of units":null,"area":"Kunduz","contractors' involvement":"Not available","longitude":68.80187988,"id":"103","marker icon":"small_red","source":"05/03/10, The Times (London), German soldiers in line of fire","u.s. personnel killed":"Not available"},"type":"Feature","geometry":{"type":"Polygon","coordinates":[[[68.8743728530133,36.82247761],[68.8729799208641,36.8083349325509],[68.8688546540179,36.7947357502649],[68.862155584166,36.7822026720907],[68.8531401528061,36.7712173371939],[68.8421548179093,36.762201905834],[68.8296217397351,36.7555028359821],[68.8160225574491,36.7513775691359],[68.80187988,36.7499846369867],[68.7877372025509,36.7513775691359],[68.7741380202649,36.7555028359821],[68.7616049420907,36.762201905834],[68.7506196071939,36.7712173371939],[68.741604175834,36.7822026720907],[68.7349051059822,36.7947357502649],[68.7307798391359,36.8083349325509],[68.7293869069867,36.82247761],[68.7307798391359,36.8366202874491],[68.7349051059822,36.8502194697351],[68.741604175834,36.8627525479093],[68.7506196071939,36.8737378828061],[68.7616049420907,36.882753314166],[68.7741380202649,36.8894523840179],[68.7877372025509,36.8935776508641],[68.80187988,36.8949705830133],[68.8160225574491,36.8935776508641],[68.8296217397351,36.8894523840179],[68.8421548179093,36.882753314166],[68.8531401528061,36.8737378828061],[68.862155584166,36.8627525479093],[68.8688546540179,36.8502194697351],[68.8729799208641,36.8366202874491],[68.8743728530133,36.82247761]]]}},{"properties":{"militants killed":"3 militants, including commander Baz Mohammud","latitude":36.82687474,"civilians killed":"0","mission type":"Counterterrorism","date":{"end_time":"2010/01/07 00:00:00 -0500","original":"1/6/10","granularity":"day","time":"2010/01/06 00:00:00 -0500"},"what was employed":"Not available","notes":"During a search, special operators killed 3 militants, including commander Baz Mohammud (responsible for abduction of 2 journalists in September 2009,1/6/10","captured/wounded":"0","types of units":"Army","area":"Chardara district","contractors' involvement":"Not available","longitude":68.79089355,"id":"104","marker icon":"small_green","source":"Xinhua","u.s. personnel killed":"0"},"type":"Feature","geometry":{"type":"Polygon","coordinates":[[[68.8633865230133,36.82687474],[68.8619935908641,36.8127320625509],[68.8578683240179,36.7991328802649],[68.851169254166,36.7865998020907],[68.8421538228061,36.7756144671939],[68.8311684879093,36.766599035834],[68.8186354097351,36.7598999659821],[68.8050362274491,36.7557746991359],[68.79089355,36.7543817669867],[68.7767508725509,36.7557746991359],[68.7631516902649,36.7598999659821],[68.7506186120907,36.766599035834],[68.7396332771939,36.7756144671939],[68.730617845834,36.7865998020907],[68.7239187759822,36.7991328802649],[68.7197935091359,36.8127320625509],[68.7184005769867,36.82687474],[68.7197935091359,36.8410174174491],[68.7239187759822,36.8546165997351],[68.730617845834,36.8671496779093],[68.7396332771939,36.8781350128061],[68.7506186120907,36.887150444166],[68.7631516902649,36.8938495140179],[68.7767508725509,36.8979747808641],[68.79089355,36.8993677130133],[68.8050362274491,36.8979747808641],[68.8186354097351,36.8938495140179],[68.8311684879093,36.887150444166],[68.8421538228061,36.8781350128061],[68.851169254166,36.8671496779093],[68.8578683240179,36.8546165997351],[68.8619935908641,36.8410174174491],[68.8633865230133,36.82687474]]]}},{"properties":{"militants killed":"0","latitude":31.65805727,"civilians killed":"0","mission type":"Counterterrorism","date":{"end_time":"2030/02/02 00:00:00 -0500","original":"10-Feb","granularity":"day","time":"2030/02/01 00:00:00 -0500"},"what was employed":"Not available","notes":"U.S. missions were made public as a psychological tactic designed to intimidate Taliban force","captured/wounded":"0","types of units":"Royal Special Forces","area":"Marja","contractors' involvement":"Not available","longitude":64.13269043,"id":"105","marker icon":"small_green","source":"2/7/10, The Sunday Times Special forces assassins infiltrate Taliban stronghold in Afghanistan","u.s. personnel killed":"0"},"type":"Feature","geometry":{"type":"Polygon","coordinates":[[[64.2051834030133,31.65805727],[64.2037904708641,31.6439145925509],[64.1996652040178,31.6303154102649],[64.192966134166,31.6177823320907],[64.1839507028061,31.6067969971939],[64.1729653679093,31.597781565834],[64.1604322897351,31.5910824959821],[64.1468331074491,31.5869572291359],[64.13269043,31.5855642969867],[64.1185477525509,31.5869572291359],[64.1049485702649,31.5910824959821],[64.0924154920907,31.597781565834],[64.0814301571939,31.6067969971939],[64.072414725834,31.6177823320907],[64.0657156559821,31.6303154102649],[64.0615903891359,31.6439145925509],[64.0601974569867,31.65805727],[64.0615903891359,31.6721999474491],[64.0657156559821,31.6857991297351],[64.072414725834,31.6983322079093],[64.0814301571939,31.7093175428061],[64.0924154920907,31.718332974166],[64.1049485702649,31.7250320440179],[64.1185477525509,31.7291573108641],[64.13269043,31.7305502430133],[64.1468331074491,31.7291573108641],[64.1604322897351,31.7250320440179],[64.1729653679093,31.718332974166],[64.1839507028061,31.7093175428061],[64.192966134166,31.6983322079093],[64.1996652040178,31.6857991297351],[64.2037904708641,31.6721999474491],[64.2051834030133,31.65805727]]]}},{"properties":{"militants killed":"0","latitude":33.60832899,"civilians killed":"3 women, district prosecutor, police chief","mission type":"Direct Action","date":{"end_time":"2010/02/13 00:00:00 -0500","original":"2/12/10","granularity":"day","time":"2010/02/12 00:00:00 -0500"},"what was employed":"Firearms","notes":"Special operators allegedly removed bullets from bodies to cover up crimes after night raid; investigation started","captured/wounded":"Not available","types of units":null,"area":"Gardez","contractors' involvement":"Not available","longitude":69.22554016,"id":"106","marker icon":"small_red","source":"04/06/10, International Herald Tribune, U.S. admits forces killed women","u.s. personnel killed":"0"},"type":"Feature","geometry":{"type":"Polygon","coordinates":[[[69.2980331330133,33.60832899],[69.2966402008641,33.5941863125509],[69.2925149340178,33.5805871302649],[69.285815864166,33.5680540520907],[69.2768004328061,33.5570687171939],[69.2658150979093,33.548053285834],[69.2532820197351,33.5413542159821],[69.2396828374491,33.5372289491359],[69.22554016,33.5358360169867],[69.2113974825509,33.5372289491359],[69.1977983002649,33.5413542159821],[69.1852652220907,33.548053285834],[69.1742798871939,33.5570687171939],[69.165264455834,33.5680540520907],[69.1585653859821,33.5805871302649],[69.1544401191359,33.5941863125509],[69.1530471869867,33.60832899],[69.1544401191359,33.6224716674491],[69.1585653859821,33.6360708497351],[69.165264455834,33.6486039279093],[69.1742798871939,33.6595892628061],[69.1852652220907,33.668604694166],[69.1977983002649,33.6753037640179],[69.2113974825509,33.6794290308641],[69.22554016,33.6808219630133],[69.2396828374491,33.6794290308641],[69.2532820197351,33.6753037640179],[69.2658150979093,33.668604694166],[69.2768004328061,33.6595892628061],[69.285815864166,33.6486039279093],[69.2925149340178,33.6360708497351],[69.2966402008641,33.6224716674491],[69.2980331330133,33.60832899]]]}},{"properties":{"militants killed":"0","latitude":33.31216784,"civilians killed":"27","mission type":"Direct Action","date":{"end_time":"2010/02/22 00:00:00 -0500","original":"2/21/10","granularity":"day","time":"2010/02/21 00:00:00 -0500"},"what was employed":"Drone aircraft, Hellfire missile, aerial rockets","notes":"Wrong people were targeted","captured/wounded":"Several women and 2 children, ages six and nine","types of units":null,"area":null,"contractors' involvement":"Not available","longitude":66.26953125,"id":"107","marker icon":"small_red","source":"02/22/10, Guardian, Afghan ministers voice anger; 03/16/10, New York Times, U.S. Is Reining in Special Forces","u.s. personnel killed":"0"},"type":"Feature","geometry":{"type":"Polygon","coordinates":[[[66.3420242230133,33.31216784],[66.3406312908641,33.2980251625509],[66.3365060240179,33.2844259802649],[66.329806954166,33.2718929020907],[66.3207915228061,33.2609075671939],[66.3098061879093,33.251892135834],[66.2972731097351,33.2451930659821],[66.2836739274491,33.2410677991359],[66.26953125,33.2396748669867],[66.2553885725509,33.2410677991359],[66.2417893902649,33.2451930659821],[66.2292563120907,33.251892135834],[66.2182709771939,33.2609075671939],[66.209255545834,33.2718929020907],[66.2025564759821,33.2844259802649],[66.1984312091359,33.2980251625509],[66.1970382769867,33.31216784],[66.1984312091359,33.3263105174491],[66.2025564759821,33.3399096997351],[66.209255545834,33.3524427779093],[66.2182709771939,33.3634281128061],[66.2292563120907,33.372443544166],[66.2417893902649,33.3791426140179],[66.2553885725509,33.3832678808641],[66.26953125,33.3846608130133],[66.2836739274491,33.3832678808641],[66.2972731097351,33.3791426140179],[66.3098061879093,33.372443544166],[66.3207915228061,33.3634281128061],[66.329806954166,33.3524427779093],[66.3365060240179,33.3399096997351],[66.3406312908641,33.3263105174491],[66.3420242230133,33.31216784]]]}},{"properties":{"militants killed":"0","latitude":31.48020882,"civilians killed":"0","mission type":"Civil Affairs","date":{"end_time":"2010/03/06 00:00:00 -0500","original":"3/5/10","granularity":"day","time":"2010/03/05 00:00:00 -0500"},"what was employed":"Not available","notes":"Workers in a Special Forces clinic helped an ANA hospital to provide surgery for a badly burned Afghan boy","captured/wounded":"0","types of units":"Afghan National Army","area":null,"contractors' involvement":"Not available","longitude":63.96789551,"id":"108","marker icon":"small_blue","source":"3/5/10, CJSOTF-A Public Affairs Office, \"Child receives life-changing surgery in Kandahar province\"","u.s. personnel killed":"0"},"type":"Feature","geometry":{"type":"Polygon","coordinates":[[[64.0403884830133,31.48020882],[64.0389955508641,31.4660661425509],[64.0348702840179,31.4524669602649],[64.028171214166,31.4399338820907],[64.0191557828061,31.4289485471939],[64.0081704479093,31.419933115834],[63.9956373697351,31.4132340459821],[63.9820381874491,31.4091087791359],[63.96789551,31.4077158469867],[63.9537528325509,31.4091087791359],[63.9401536502649,31.4132340459821],[63.9276205720907,31.419933115834],[63.9166352371939,31.4289485471939],[63.907619805834,31.4399338820907],[63.9009207359821,31.4524669602649],[63.8967954691359,31.4660661425509],[63.8954025369867,31.48020882],[63.8967954691359,31.4943514974491],[63.9009207359821,31.5079506797351],[63.907619805834,31.5204837579093],[63.9166352371939,31.5314690928061],[63.9276205720907,31.540484524166],[63.9401536502649,31.5471835940179],[63.9537528325509,31.5513088608641],[63.96789551,31.5527017930133],[63.9820381874491,31.5513088608641],[63.9956373697351,31.5471835940179],[64.0081704479093,31.540484524166],[64.0191557828061,31.5314690928061],[64.028171214166,31.5204837579093],[64.0348702840179,31.5079506797351],[64.0389955508641,31.4943514974491],[64.0403884830133,31.48020882]]]}},{"properties":{"militants killed":"0","latitude":32.25462006,"civilians killed":"0","mission type":"Civil Affairs","date":{"end_time":"2010/03/12 00:00:00 -0500","original":"3/11/10","granularity":"day","time":"2010/03/11 00:00:00 -0500"},"what was employed":"Not available","notes":"Special Forces Operation Detachment Alpha team helped locals on a 20-day project to clean local waterways and also provided medical assistance to people living in the area","captured/wounded":"0","types of units":"Adirah region elders","area":"Arghandab district","contractors' involvement":"Not available","longitude":67.19512939,"id":"109","marker icon":"small_blue","source":"4/6/10, CJSOTF-A Public Affairs, \"USSF assist local nationals in southern Afghanistan\"","u.s. personnel killed":"0"},"type":"Feature","geometry":{"type":"Polygon","coordinates":[[[67.2676223630133,32.25462006],[67.2662294308641,32.2404773825509],[67.2621041640179,32.2268782002649],[67.255405094166,32.2143451220907],[67.2463896628061,32.2033597871939],[67.2354043279093,32.194344355834],[67.2228712497351,32.1876452859821],[67.2092720674491,32.1835200191359],[67.19512939,32.1821270869867],[67.1809867125509,32.1835200191359],[67.1673875302649,32.1876452859821],[67.1548544520907,32.194344355834],[67.1438691171939,32.2033597871939],[67.134853685834,32.2143451220907],[67.1281546159822,32.2268782002649],[67.1240293491359,32.2404773825509],[67.1226364169867,32.25462006],[67.1240293491359,32.2687627374491],[67.1281546159822,32.2823619197351],[67.134853685834,32.2948949979093],[67.1438691171939,32.3058803328061],[67.1548544520907,32.314895764166],[67.1673875302649,32.3215948340179],[67.1809867125509,32.3257201008641],[67.19512939,32.3271130330133],[67.2092720674491,32.3257201008641],[67.2228712497351,32.3215948340179],[67.2354043279093,32.314895764166],[67.2463896628061,32.3058803328061],[67.255405094166,32.2948949979093],[67.2621041640179,32.2823619197351],[67.2662294308641,32.2687627374491],[67.2676223630133,32.25462006]]]}},{"properties":{"militants killed":"0","latitude":33.32593851,"civilians killed":"0","mission type":"Civil Affairs","date":{"end_time":"2010/03/27 00:00:00 -0400","original":"3/26/10","granularity":"day","time":"2010/03/26 00:00:00 -0400"},"what was employed":"Not available","notes":"Special Forces medics treated a 10-year old Afghan who was brought to their firebase near Char Chine district","captured/wounded":"0","types of units":null,"area":"Char Chine distric","contractors' involvement":"Not available","longitude":66.24206543,"id":"110","marker icon":"small_blue","source":"4/1/10, CJSOTF-A Public Affairs, \"Special Forces medics treat, medevac Afghan child\"","u.s. personnel killed":"0"},"type":"Feature","geometry":{"type":"Polygon","coordinates":[[[66.3145584030133,33.32593851],[66.3131654708641,33.3117958325509],[66.3090402040178,33.2981966502649],[66.302341134166,33.2856635720907],[66.2933257028061,33.2746782371939],[66.2823403679093,33.265662805834],[66.2698072897351,33.2589637359821],[66.2562081074491,33.2548384691359],[66.24206543,33.2534455369867],[66.2279227525509,33.2548384691359],[66.2143235702649,33.2589637359821],[66.2017904920907,33.265662805834],[66.1908051571939,33.2746782371939],[66.181789725834,33.2856635720907],[66.1750906559821,33.2981966502649],[66.1709653891359,33.3117958325509],[66.1695724569867,33.32593851],[66.1709653891359,33.3400811874491],[66.1750906559821,33.3536803697351],[66.181789725834,33.3662134479093],[66.1908051571939,33.3771987828061],[66.2017904920907,33.386214214166],[66.2143235702649,33.3929132840179],[66.2279227525509,33.3970385508641],[66.24206543,33.3984314830133],[66.2562081074491,33.3970385508641],[66.2698072897351,33.3929132840179],[66.2823403679093,33.386214214166],[66.2933257028061,33.3771987828061],[66.302341134166,33.3662134479093],[66.3090402040178,33.3536803697351],[66.3131654708641,33.3400811874491],[66.3145584030133,33.32593851]]]}},{"properties":{"militants killed":"0","latitude":33.32593851,"civilians killed":"0","mission type":"Civil Affairs","date":{"end_time":"2010/03/29 00:00:00 -0400","original":"3/28/10","granularity":"day","time":"2010/03/28 00:00:00 -0400"},"what was employed":"Two UH-60 blackhawk helicopters","notes":"Special Forces soldiers transported civilians from Nai Baghban, Uruzgan Province, to Kabul for medical care","captured/wounded":"0","types of units":"Government of the Islamic Republic of Afghanistan","area":"Nai Baghban","contractors' involvement":"Not available","longitude":66.24206543,"id":"111","marker icon":"small_blue","source":"4/1/10, CJSOTF-A Public Affairs, \"Special Forces help move Afghan patients\"","u.s. personnel killed":"0"},"type":"Feature","geometry":{"type":"Polygon","coordinates":[[[66.3145584030133,33.32593851],[66.3131654708641,33.3117958325509],[66.3090402040178,33.2981966502649],[66.302341134166,33.2856635720907],[66.2933257028061,33.2746782371939],[66.2823403679093,33.265662805834],[66.2698072897351,33.2589637359821],[66.2562081074491,33.2548384691359],[66.24206543,33.2534455369867],[66.2279227525509,33.2548384691359],[66.2143235702649,33.2589637359821],[66.2017904920907,33.265662805834],[66.1908051571939,33.2746782371939],[66.181789725834,33.2856635720907],[66.1750906559821,33.2981966502649],[66.1709653891359,33.3117958325509],[66.1695724569867,33.32593851],[66.1709653891359,33.3400811874491],[66.1750906559821,33.3536803697351],[66.181789725834,33.3662134479093],[66.1908051571939,33.3771987828061],[66.2017904920907,33.386214214166],[66.2143235702649,33.3929132840179],[66.2279227525509,33.3970385508641],[66.24206543,33.3984314830133],[66.2562081074491,33.3970385508641],[66.2698072897351,33.3929132840179],[66.2823403679093,33.386214214166],[66.2933257028061,33.3771987828061],[66.302341134166,33.3662134479093],[66.3090402040178,33.3536803697351],[66.3131654708641,33.3400811874491],[66.3145584030133,33.32593851]]]}},{"properties":{"militants killed":"0","latitude":33.32593851,"civilians killed":"0","mission type":"Civil Affairs","date":{"end_time":"2010/04/01 00:00:00 -0400","original":"3/31/10","granularity":"day","time":"2010/03/31 00:00:00 -0400"},"what was employed":"Not available","notes":"Afghan National Security Forces, working with Special Forces counterparts, set up a medical clinic","captured/wounded":"0","types of units":"Afghan National Security Forces (ANSF)","area":"Shahidi Hassas district","contractors' involvement":"Not available","longitude":66.24206543,"id":"112","marker icon":"small_blue","source":"4/6/10, CJSOTF-A Public Affairs, \"Afghan National Security Forces, Special Forces host clinic\"","u.s. personnel killed":"0"},"type":"Feature","geometry":{"type":"Polygon","coordinates":[[[66.3145584030133,33.32593851],[66.3131654708641,33.3117958325509],[66.3090402040178,33.2981966502649],[66.302341134166,33.2856635720907],[66.2933257028061,33.2746782371939],[66.2823403679093,33.265662805834],[66.2698072897351,33.2589637359821],[66.2562081074491,33.2548384691359],[66.24206543,33.2534455369867],[66.2279227525509,33.2548384691359],[66.2143235702649,33.2589637359821],[66.2017904920907,33.265662805834],[66.1908051571939,33.2746782371939],[66.181789725834,33.2856635720907],[66.1750906559821,33.2981966502649],[66.1709653891359,33.3117958325509],[66.1695724569867,33.32593851],[66.1709653891359,33.3400811874491],[66.1750906559821,33.3536803697351],[66.181789725834,33.3662134479093],[66.1908051571939,33.3771987828061],[66.2017904920907,33.386214214166],[66.2143235702649,33.3929132840179],[66.2279227525509,33.3970385508641],[66.24206543,33.3984314830133],[66.2562081074491,33.3970385508641],[66.2698072897351,33.3929132840179],[66.2823403679093,33.386214214166],[66.2933257028061,33.3771987828061],[66.302341134166,33.3662134479093],[66.3090402040178,33.3536803697351],[66.3131654708641,33.3400811874491],[66.3145584030133,33.32593851]]]}},{"properties":{"militants killed":"0","latitude":31.63935236,"civilians killed":"0","mission type":"Psychological Operations","date":{"end_time":"2030/04/02 00:00:00 -0400","original":"10-Apr","granularity":"day","time":"2030/04/01 00:00:00 -0400"},"what was employed":"Heavy metal / rock (ie Metallica)","notes":"Music blasted \"to piss off the Taliban\"","captured/wounded":"0","types of units":null,"area":"Marja","contractors' involvement":"Not available","longitude":64.10522461,"id":"113","marker icon":"small_purple","source":"04/08/10, The Age (Australia), \"U.S. Fight Taliban\"","u.s. personnel killed":"0"},"type":"Feature","geometry":{"type":"Polygon","coordinates":[[[64.1777175830133,31.63935236],[64.1763246508641,31.6252096825509],[64.1721993840178,31.6116105002649],[64.165500314166,31.5990774220907],[64.1564848828061,31.5880920871939],[64.1454995479093,31.579076655834],[64.1329664697351,31.5723775859821],[64.1193672874491,31.5682523191359],[64.10522461,31.5668593869867],[64.0910819325509,31.5682523191359],[64.0774827502649,31.5723775859821],[64.0649496720907,31.579076655834],[64.0539643371939,31.5880920871939],[64.044948905834,31.5990774220907],[64.0382498359821,31.6116105002649],[64.0341245691359,31.6252096825509],[64.0327316369867,31.63935236],[64.0341245691359,31.6534950374491],[64.0382498359821,31.6670942197351],[64.044948905834,31.6796272979093],[64.0539643371939,31.6906126328061],[64.0649496720907,31.699628064166],[64.0774827502649,31.7063271340179],[64.0910819325509,31.7104524008641],[64.10522461,31.7118453330133],[64.1193672874491,31.7104524008641],[64.1329664697351,31.7063271340179],[64.1454995479093,31.699628064166],[64.1564848828061,31.6906126328061],[64.165500314166,31.6796272979093],[64.1721993840178,31.6670942197351],[64.1763246508641,31.6534950374491],[64.1777175830133,31.63935236]]]}},{"properties":{"militants killed":"Not specified","latitude":31.60865647,"civilians killed":"Not available","mission type":"Direct Action","date":{"end_time":"2030/04/02 00:00:00 -0400","original":"10-Apr","granularity":"day","time":"2030/04/01 00:00:00 -0400"},"what was employed":"Not specified","notes":"Special Forces operating with increasing intensity \"picking up or picking off insurgent leaders to weaken the Taliban in advance of major operations\"","captured/wounded":"Not available","types of units":null,"area":"Kandahar","contractors' involvement":"Not available","longitude":65.76141357,"id":"114","marker icon":"small_red","source":"4/26/10, Boston Globe, \"Elite US Forces Target Kandahar\"","u.s. personnel killed":"Not available"},"type":"Feature","geometry":{"type":"Polygon","coordinates":[[[65.8339065430133,31.60865647],[65.8325136108641,31.5945137925509],[65.8283883440179,31.5809146102649],[65.821689274166,31.5683815320907],[65.8126738428061,31.5573961971939],[65.8016885079093,31.548380765834],[65.7891554297351,31.5416816959821],[65.7755562474491,31.5375564291359],[65.76141357,31.5361634969867],[65.7472708925509,31.5375564291359],[65.7336717102649,31.5416816959821],[65.7211386320907,31.548380765834],[65.7101532971939,31.5573961971939],[65.701137865834,31.5683815320907],[65.6944387959822,31.5809146102649],[65.6903135291359,31.5945137925509],[65.6889205969867,31.60865647],[65.6903135291359,31.6227991474491],[65.6944387959822,31.6363983297351],[65.701137865834,31.6489314079093],[65.7101532971939,31.6599167428061],[65.7211386320907,31.668932174166],[65.7336717102649,31.6756312440179],[65.7472708925509,31.6797565108641],[65.76141357,31.6811494430133],[65.7755562474491,31.6797565108641],[65.7891554297351,31.6756312440179],[65.8016885079093,31.668932174166],[65.8126738428061,31.6599167428061],[65.821689274166,31.6489314079093],[65.8283883440179,31.6363983297351],[65.8325136108641,31.6227991474491],[65.8339065430133,31.60865647]]]}},{"properties":{"militants killed":"0","latitude":34.54870089,"civilians killed":"0","mission type":"Civil Affairs","date":{"end_time":"2030/04/02 00:00:00 -0400","original":"10-Apr","granularity":"day","time":"2030/04/01 00:00:00 -0400"},"what was employed":"Not available","notes":"Special Forces soldiers, accompanied by Afghan National Police, provided medical, dental and veterinary care to villagers","captured/wounded":"0","types of units":null,"area":"Shoragaz village","contractors' involvement":"Not available","longitude":65.72845459,"id":"115","marker icon":"small_blue","source":"4/21/10, USASOC News Service, \"Medical outreach in Shoragaz Village\"","u.s. personnel killed":"0"},"type":"Feature","geometry":{"type":"Polygon","coordinates":[[[65.8009475630133,34.54870089],[65.7995546308641,34.5345582125509],[65.7954293640178,34.5209590302649],[65.788730294166,34.5084259520907],[65.7797148628061,34.4974406171939],[65.7687295279093,34.488425185834],[65.7561964497351,34.4817261159821],[65.7425972674491,34.4776008491359],[65.72845459,34.4762079169867],[65.7143119125509,34.4776008491359],[65.7007127302649,34.4817261159821],[65.6881796520907,34.488425185834],[65.6771943171939,34.4974406171939],[65.668178885834,34.5084259520907],[65.6614798159821,34.5209590302649],[65.6573545491359,34.5345582125509],[65.6559616169867,34.54870089],[65.6573545491359,34.5628435674491],[65.6614798159821,34.5764427497351],[65.668178885834,34.5889758279093],[65.6771943171939,34.5999611628061],[65.6881796520907,34.608976594166],[65.7007127302649,34.6156756640179],[65.7143119125509,34.6198009308641],[65.72845459,34.6211938630133],[65.7425972674491,34.6198009308641],[65.7561964497351,34.6156756640179],[65.7687295279093,34.608976594166],[65.7797148628061,34.5999611628061],[65.788730294166,34.5889758279093],[65.7954293640178,34.5764427497351],[65.7995546308641,34.5628435674491],[65.8009475630133,34.54870089]]]}},{"properties":{"militants killed":"0","latitude":32.01972036,"civilians killed":"0","mission type":"Civil Affairs","date":{"end_time":"2010/04/06 00:00:00 -0400","original":"4/5/10","granularity":"day","time":"2010/04/05 00:00:00 -0400"},"what was employed":"Not available","notes":"Special Forces Operational Detachment Alpha team members helped set up a government-led medical seminar","captured/wounded":"0","types of units":"Government of Islamic Republic of Afghanistan","area":"Shin Kay","contractors' involvement":"Not available","longitude":67.42584229,"id":"116","marker icon":"small_blue","source":"4/5/10, ISAF Public Affairs, \"Medics Teach Afghans to Help Themselves\"","u.s. personnel killed":"0"},"type":"Feature","geometry":{"type":"Polygon","coordinates":[[[67.4983352630133,32.01972036],[67.4969423308641,32.0055776825509],[67.4928170640179,31.9919785002649],[67.486117994166,31.9794454220907],[67.4771025628061,31.9684600871939],[67.4661172279093,31.959444655834],[67.4535841497351,31.9527455859821],[67.4399849674491,31.9486203191359],[67.42584229,31.9472273869867],[67.4116996125509,31.9486203191359],[67.3981004302649,31.9527455859821],[67.3855673520907,31.959444655834],[67.3745820171939,31.9684600871939],[67.365566585834,31.9794454220907],[67.3588675159822,31.9919785002649],[67.3547422491359,32.0055776825509],[67.3533493169867,32.01972036],[67.3547422491359,32.0338630374491],[67.3588675159822,32.0474622197351],[67.365566585834,32.0599952979093],[67.3745820171939,32.0709806328061],[67.3855673520907,32.079996064166],[67.3981004302649,32.0866951340179],[67.4116996125509,32.0908204008641],[67.42584229,32.0922133330133],[67.4399849674491,32.0908204008641],[67.4535841497351,32.0866951340179],[67.4661172279093,32.079996064166],[67.4771025628061,32.0709806328061],[67.486117994166,32.0599952979093],[67.4928170640179,32.0474622197351],[67.4969423308641,32.0338630374491],[67.4983352630133,32.01972036]]]}},{"properties":{"militants killed":"0","latitude":33.32593851,"civilians killed":"0","mission type":"Civil Affairs","date":{"end_time":"2010/04/06 00:00:00 -0400","original":"4/5/10","granularity":"day","time":"2010/04/05 00:00:00 -0400"},"what was employed":"Not available","notes":"Special Forces conducted a three-day veterinary and medical outreach program","captured/wounded":"0","types of units":null,"area":null,"contractors' involvement":"Not available","longitude":66.24206543,"id":"117","marker icon":"small_blue","source":"4/7/10, ISAF Joint Command-Afghanistan Public Affairs, \"Special Forces conclude veterinary mission in Uruzgan province\"","u.s. personnel killed":"0"},"type":"Feature","geometry":{"type":"Polygon","coordinates":[[[66.3145584030133,33.32593851],[66.3131654708641,33.3117958325509],[66.3090402040178,33.2981966502649],[66.302341134166,33.2856635720907],[66.2933257028061,33.2746782371939],[66.2823403679093,33.265662805834],[66.2698072897351,33.2589637359821],[66.2562081074491,33.2548384691359],[66.24206543,33.2534455369867],[66.2279227525509,33.2548384691359],[66.2143235702649,33.2589637359821],[66.2017904920907,33.265662805834],[66.1908051571939,33.2746782371939],[66.181789725834,33.2856635720907],[66.1750906559821,33.2981966502649],[66.1709653891359,33.3117958325509],[66.1695724569867,33.32593851],[66.1709653891359,33.3400811874491],[66.1750906559821,33.3536803697351],[66.181789725834,33.3662134479093],[66.1908051571939,33.3771987828061],[66.2017904920907,33.386214214166],[66.2143235702649,33.3929132840179],[66.2279227525509,33.3970385508641],[66.24206543,33.3984314830133],[66.2562081074491,33.3970385508641],[66.2698072897351,33.3929132840179],[66.2823403679093,33.386214214166],[66.2933257028061,33.3771987828061],[66.302341134166,33.3662134479093],[66.3090402040178,33.3536803697351],[66.3131654708641,33.3400811874491],[66.3145584030133,33.32593851]]]}},{"properties":{"militants killed":"3","latitude":36.92354768,"civilians killed":"0","mission type":"Direct Action","date":{"end_time":"2010/04/09 00:00:00 -0400","original":"4/8/10","granularity":"day","time":"2010/04/08 00:00:00 -0400"},"what was employed":"Not available","notes":"Special Operations killed Taliban fighters","captured/wounded":"0","types of units":null,"area":null,"contractors' involvement":"Not available","longitude":68.71673584,"id":"118","marker icon":"small_red","source":"04/09/10, BBC Monitoring South Asia, \"US special forces kill three Taliban\"","u.s. personnel killed":"0"},"type":"Feature","geometry":{"type":"Polygon","coordinates":[[[68.7892288130133,36.92354768],[68.7878358808641,36.9094050025509],[68.7837106140178,36.8958058202649],[68.777011544166,36.8832727420907],[68.7679961128061,36.8722874071939],[68.7570107779093,36.863271975834],[68.7444776997351,36.8565729059821],[68.7308785174491,36.8524476391359],[68.71673584,36.8510547069867],[68.7025931625509,36.8524476391359],[68.6889939802649,36.8565729059821],[68.6764609020907,36.863271975834],[68.6654755671939,36.8722874071939],[68.656460135834,36.8832727420907],[68.6497610659821,36.8958058202649],[68.6456357991359,36.9094050025509],[68.6442428669867,36.92354768],[68.6456357991359,36.9376903574491],[68.6497610659821,36.9512895397351],[68.656460135834,36.9638226179093],[68.6654755671939,36.9748079528061],[68.6764609020907,36.983823384166],[68.6889939802649,36.9905224540179],[68.7025931625509,36.9946477208641],[68.71673584,36.9960406530133],[68.7308785174491,36.9946477208641],[68.7444776997351,36.9905224540179],[68.7570107779093,36.983823384166],[68.7679961128061,36.9748079528061],[68.777011544166,36.9638226179093],[68.7837106140178,36.9512895397351],[68.7878358808641,36.9376903574491],[68.7892288130133,36.92354768]]]}},{"properties":{"militants killed":"0","latitude":32.1105686,"civilians killed":"0","mission type":"Civil Affairs","date":{"end_time":"2010/04/22 00:00:00 -0400","original":"4/21/10","granularity":"day","time":"2010/04/21 00:00:00 -0400"},"what was employed":"radio station","notes":"Afghans, with support from United States Special Forces, began broadcasting from a new radio station.","captured/wounded":"0","types of units":null,"area":"Qalat district","contractors' involvement":"Not available","longitude":66.89901352,"id":"119","marker icon":"small_blue","source":"4/23/03, CJSOTF-A Public Affairs, \"Afghans stand up new radio station In Zabul Province\"","u.s. personnel killed":"0"},"type":"Feature","geometry":{"type":"Polygon","coordinates":[[[66.9715064930133,32.1105686],[66.9701135608641,32.0964259225509],[66.9659882940178,32.0828267402649],[66.959289224166,32.0702936620907],[66.9502737928061,32.0593083271939],[66.9392884579093,32.050292895834],[66.9267553797351,32.0435938259821],[66.9131561974491,32.0394685591359],[66.89901352,32.0380756269867],[66.8848708425509,32.0394685591359],[66.8712716602649,32.0435938259821],[66.8587385820907,32.050292895834],[66.8477532471939,32.0593083271939],[66.838737815834,32.0702936620907],[66.8320387459821,32.0828267402649],[66.8279134791359,32.0964259225509],[66.8265205469867,32.1105686],[66.8279134791359,32.1247112774491],[66.8320387459821,32.1383104597351],[66.838737815834,32.1508435379093],[66.8477532471939,32.1618288728061],[66.8587385820907,32.170844304166],[66.8712716602649,32.1775433740179],[66.8848708425509,32.1816686408641],[66.89901352,32.1830615730133],[66.9131561974491,32.1816686408641],[66.9267553797351,32.1775433740179],[66.9392884579093,32.170844304166],[66.9502737928061,32.1618288728061],[66.959289224166,32.1508435379093],[66.9659882940178,32.1383104597351],[66.9701135608641,32.1247112774491],[66.9715064930133,32.1105686]]]}},{"properties":{"militants killed":"0","latitude":32.76418138,"civilians killed":"0","mission type":"Civil Affairs","date":{"end_time":"2010/04/22 00:00:00 -0400","original":"4/21/10","granularity":"day","time":"2010/04/21 00:00:00 -0400"},"what was employed":"seeds","notes":"Afghan National Security Forces, advised and assisted by U.S. Special Forces, distributed seed packets and bags of di-ammonium phosphate fertilizer to farmers","captured/wounded":"0","types of units":"Afghan National Security Forces (ANSF)","area":"Deh Rawood","contractors' involvement":"Not available","longitude":65.4510498,"id":"120","marker icon":"small_blue","source":"4/23/10, CJSOTF-A Public Affairs, \"Afghans, U.S. SOF provide security, distribute aid'","u.s. personnel killed":"0"},"type":"Feature","geometry":{"type":"Polygon","coordinates":[[[65.5235427730133,32.76418138],[65.5221498408641,32.7500387025509],[65.5180245740179,32.7364395202649],[65.511325504166,32.7239064420907],[65.5023100728061,32.7129211071939],[65.4913247379093,32.703905675834],[65.4787916597351,32.6972066059821],[65.4651924774491,32.6930813391359],[65.4510498,32.6916884069867],[65.4369071225509,32.6930813391359],[65.4233079402649,32.6972066059821],[65.4107748620907,32.703905675834],[65.3997895271939,32.7129211071939],[65.390774095834,32.7239064420907],[65.3840750259822,32.7364395202649],[65.3799497591359,32.7500387025509],[65.3785568269867,32.76418138],[65.3799497591359,32.7783240574491],[65.3840750259822,32.7919232397351],[65.390774095834,32.8044563179093],[65.3997895271939,32.8154416528061],[65.4107748620907,32.824457084166],[65.4233079402649,32.8311561540179],[65.4369071225509,32.8352814208641],[65.4510498,32.8366743530133],[65.4651924774491,32.8352814208641],[65.4787916597351,32.8311561540179],[65.4913247379093,32.824457084166],[65.5023100728061,32.8154416528061],[65.511325504166,32.8044563179093],[65.5180245740179,32.7919232397351],[65.5221498408641,32.7783240574491],[65.5235427730133,32.76418138]]]}},{"properties":{"militants killed":"2","latitude":36.91696023,"civilians killed":"0","mission type":"Direct Action","date":{"end_time":"2010/04/30 00:00:00 -0400","original":"4/29/10","granularity":"day","time":"2010/04/29 00:00:00 -0400"},"what was employed":"Not available","notes":"Special operators killed Taliban commander Mullah Daud along with one of his bodyguards","captured/wounded":"4","types of units":"Afghan Special Forces","area":"Chardara district","contractors' involvement":"Not available","longitude":68.71398926,"id":"121","marker icon":"small_red","source":"4/29/10, Xinhua, \"1st Ld Writethru: Taliban Key Commander Killed in N. Afghanistan\"","u.s. personnel killed":"0"},"type":"Feature","geometry":{"type":"Polygon","coordinates":[[[68.7864822330133,36.91696023],[68.7850893008641,36.9028175525509],[68.7809640340179,36.8892183702649],[68.774264964166,36.8766852920907],[68.7652495328061,36.8656999571939],[68.7542641979093,36.856684525834],[68.7417311197351,36.8499854559821],[68.7281319374491,36.8458601891359],[68.71398926,36.8444672569867],[68.6998465825509,36.8458601891359],[68.6862474002649,36.8499854559821],[68.6737143220907,36.856684525834],[68.6627289871939,36.8656999571939],[68.653713555834,36.8766852920907],[68.6470144859822,36.8892183702649],[68.6428892191359,36.9028175525509],[68.6414962869867,36.91696023],[68.6428892191359,36.9311029074491],[68.6470144859822,36.9447020897351],[68.653713555834,36.9572351679093],[68.6627289871939,36.9682205028061],[68.6737143220907,36.977235934166],[68.6862474002649,36.9839350040179],[68.6998465825509,36.9880602708641],[68.71398926,36.9894532030133],[68.7281319374491,36.9880602708641],[68.7417311197351,36.9839350040179],[68.7542641979093,36.977235934166],[68.7652495328061,36.9682205028061],[68.774264964166,36.9572351679093],[68.7809640340179,36.9447020897351],[68.7850893008641,36.9311029074491],[68.7864822330133,36.91696023]]]}},{"properties":{"militants killed":"0","latitude":32.76418138,"civilians killed":"0","mission type":"Civil Affairs","date":{"end_time":"2010/05/03 00:00:00 -0400","original":"5/2/10","granularity":"day","time":"2010/05/02 00:00:00 -0400"},"what was employed":"Not available","notes":"ANP, members of the Government of the Islamic Republic of Afghanistan, U.S. Special Operations Forces and Oshay village elders gathered to discuss governance and future projects in the area.","captured/wounded":"0","types of units":"Afghan National Police, members of the Government of the Islamic Republic of Afghanistan","area":"Oshay Village","contractors' involvement":"Not available","longitude":65.4510498,"id":"122","marker icon":"small_blue","source":"5/3/10, CJSOTF-A Public Affairs, \"Special Operations Forces distribute seeds at Shura\"","u.s. personnel killed":"0"},"type":"Feature","geometry":{"type":"Polygon","coordinates":[[[65.5235427730133,32.76418138],[65.5221498408641,32.7500387025509],[65.5180245740179,32.7364395202649],[65.511325504166,32.7239064420907],[65.5023100728061,32.7129211071939],[65.4913247379093,32.703905675834],[65.4787916597351,32.6972066059821],[65.4651924774491,32.6930813391359],[65.4510498,32.6916884069867],[65.4369071225509,32.6930813391359],[65.4233079402649,32.6972066059821],[65.4107748620907,32.703905675834],[65.3997895271939,32.7129211071939],[65.390774095834,32.7239064420907],[65.3840750259822,32.7364395202649],[65.3799497591359,32.7500387025509],[65.3785568269867,32.76418138],[65.3799497591359,32.7783240574491],[65.3840750259822,32.7919232397351],[65.390774095834,32.8044563179093],[65.3997895271939,32.8154416528061],[65.4107748620907,32.824457084166],[65.4233079402649,32.8311561540179],[65.4369071225509,32.8352814208641],[65.4510498,32.8366743530133],[65.4651924774491,32.8352814208641],[65.4787916597351,32.8311561540179],[65.4913247379093,32.824457084166],[65.5023100728061,32.8154416528061],[65.511325504166,32.8044563179093],[65.5180245740179,32.7919232397351],[65.5221498408641,32.7783240574491],[65.5235427730133,32.76418138]]]}},{"properties":{"militants killed":"0","latitude":34.40237742,"civilians killed":"0","mission type":"Counterterrorism","date":{"end_time":"2010/05/14 00:00:00 -0400","original":"5/13/10","granularity":"day","time":"2010/05/13 00:00:00 -0400"},"what was employed":"Firearms","notes":"Training Afghan National Army Special Forces in eight-week counterinsurgency program","captured/wounded":"0","types of units":null,"area":null,"contractors' involvement":"Not available","longitude":68.24707031,"id":"123","marker icon":"small_green","source":"05/27/10, Army Times, No easy task","u.s. personnel killed":"0"},"type":"Feature","geometry":{"type":"Polygon","coordinates":[[[68.3195632830133,34.40237742],[68.3181703508641,34.3882347425509],[68.3140450840178,34.3746355602649],[68.307346014166,34.3621024820907],[68.2983305828061,34.3511171471939],[68.2873452479093,34.342101715834],[68.2748121697351,34.3354026459821],[68.2612129874491,34.3312773791359],[68.24707031,34.3298844469867],[68.2329276325509,34.3312773791359],[68.2193284502649,34.3354026459821],[68.2067953720907,34.342101715834],[68.1958100371939,34.3511171471939],[68.186794605834,34.3621024820907],[68.1800955359821,34.3746355602649],[68.1759702691359,34.3882347425509],[68.1745773369867,34.40237742],[68.1759702691359,34.4165200974491],[68.1800955359821,34.4301192797351],[68.186794605834,34.4426523579093],[68.1958100371939,34.4536376928061],[68.2067953720907,34.462653124166],[68.2193284502649,34.4693521940179],[68.2329276325509,34.4734774608641],[68.24707031,34.4748703930133],[68.2612129874491,34.4734774608641],[68.2748121697351,34.4693521940179],[68.2873452479093,34.462653124166],[68.2983305828061,34.4536376928061],[68.307346014166,34.4426523579093],[68.3140450840178,34.4301192797351],[68.3181703508641,34.4165200974491],[68.3195632830133,34.40237742]]]}},{"properties":{"militants killed":"8, including Taliban commander Qari Shamsuddin, according to U.S. military","latitude":34.54870089,"civilians killed":"9, including Habibuddin, 16, son of Rafiuddin Kushkaki, according to Afghan villagers","mission type":"Direct Action","date":{"end_time":"2010/05/15 00:00:00 -0400","original":"5/14/10","granularity":"day","time":"2010/05/14 00:00:00 -0400"},"what was employed":"Firearms","notes":"House raid in Surkhrod.","captured/wounded":"Not available","types of units":null,"area":"Surkhrod","contractors' involvement":"Not available","longitude":65.72845459,"id":"124","marker icon":"small_red","source":"05/24/10, Los Angeles Times, Two outlooks collide in the Afghan night","u.s. personnel killed":"0"},"type":"Feature","geometry":{"type":"Polygon","coordinates":[[[65.8009475630133,34.54870089],[65.7995546308641,34.5345582125509],[65.7954293640178,34.5209590302649],[65.788730294166,34.5084259520907],[65.7797148628061,34.4974406171939],[65.7687295279093,34.488425185834],[65.7561964497351,34.4817261159821],[65.7425972674491,34.4776008491359],[65.72845459,34.4762079169867],[65.7143119125509,34.4776008491359],[65.7007127302649,34.4817261159821],[65.6881796520907,34.488425185834],[65.6771943171939,34.4974406171939],[65.668178885834,34.5084259520907],[65.6614798159821,34.5209590302649],[65.6573545491359,34.5345582125509],[65.6559616169867,34.54870089],[65.6573545491359,34.5628435674491],[65.6614798159821,34.5764427497351],[65.668178885834,34.5889758279093],[65.6771943171939,34.5999611628061],[65.6881796520907,34.608976594166],[65.7007127302649,34.6156756640179],[65.7143119125509,34.6198009308641],[65.72845459,34.6211938630133],[65.7425972674491,34.6198009308641],[65.7561964497351,34.6156756640179],[65.7687295279093,34.608976594166],[65.7797148628061,34.5999611628061],[65.788730294166,34.5889758279093],[65.7954293640178,34.5764427497351],[65.7995546308641,34.5628435674491],[65.8009475630133,34.54870089]]]}},{"properties":{"militants killed":"0","latitude":31.60485532,"civilians killed":"0","mission type":"Civil Affairs","date":{"end_time":"2030/06/02 00:00:00 -0400","original":"10-Jun","granularity":"day","time":"2030/06/01 00:00:00 -0400"},"what was employed":"Not available","notes":"Members of the Afghan National Armys 8th Commando Kandak, advised and assisted by U.S. Special Operations Forces, provided medical care, focusing on preventative medicine and hygiene while treating more than 50 children and 10 adults.","captured/wounded":"0","types of units":"Afghan National Army's 8th Commando Kandak","area":null,"contractors' involvement":"Not available","longitude":65.76115608,"id":"125","marker icon":"small_blue","source":"6/7/10, ISAF Joint Command-Afghanistan, \"Combined force provides medical care in Kandahar\"","u.s. personnel killed":"0"},"type":"Feature","geometry":{"type":"Polygon","coordinates":[[[65.8336490530133,31.60485532],[65.8322561208641,31.5907126425509],[65.8281308540179,31.5771134602649],[65.821431784166,31.5645803820907],[65.8124163528061,31.5535950471939],[65.8014310179093,31.544579615834],[65.7888979397351,31.5378805459821],[65.7752987574491,31.5337552791359],[65.76115608,31.5323623469867],[65.7470134025509,31.5337552791359],[65.7334142202649,31.5378805459821],[65.7208811420907,31.544579615834],[65.7098958071939,31.5535950471939],[65.700880375834,31.5645803820907],[65.6941813059822,31.5771134602649],[65.6900560391359,31.5907126425509],[65.6886631069867,31.60485532],[65.6900560391359,31.6189979974491],[65.6941813059822,31.6325971797351],[65.700880375834,31.6451302579093],[65.7098958071939,31.6561155928061],[65.7208811420907,31.665131024166],[65.7334142202649,31.6718300940179],[65.7470134025509,31.6759553608641],[65.76115608,31.6773482930133],[65.7752987574491,31.6759553608641],[65.7888979397351,31.6718300940179],[65.8014310179093,31.665131024166],[65.8124163528061,31.6561155928061],[65.821431784166,31.6451302579093],[65.8281308540179,31.6325971797351],[65.8322561208641,31.6189979974491],[65.8336490530133,31.60485532]]]}},{"properties":{"militants killed":"killed or captured 235 insurgent leaders, killed 1066 insurgents","latitude":34.54870089,"civilians killed":"Not available","mission type":"Direct Action","date":{"end_time":"2030/06/02 00:00:00 -0400","original":"10-Jun","granularity":"day","time":"2030/06/01 00:00:00 -0400"},"what was employed":"Not available","notes":"U.S. special operations task force in Afghanistan has made its priority the disruption and dismantlement of the Haqqani network (a Pashtun insurgent group active in eastern Afghanistan led by Jalaluddin Haqqani); task force has about 5,000 personnel; in 90 days preceding 30 Aug 10, conducted over 500 missions","captured/wounded":"Not available","types of units":null,"area":null,"contractors' involvement":"Not available","longitude":65.72845459,"id":"126","marker icon":"small_red","source":"9/20/10, Army Times, \"The Deadliest Insurgents JSOC Task Force Battles Haqqani Militants\"","u.s. personnel killed":"Chief Special Warfare Operator (SEAL) Collin Thomas (18 Aug 10); Spc. Christopher Shane Wright (Ranger) (19 Aug 10); Sgt. Martin Anthony Lugo (Ranger) (19 Aug 10)"},"type":"Feature","geometry":{"type":"Polygon","coordinates":[[[65.8009475630133,34.54870089],[65.7995546308641,34.5345582125509],[65.7954293640178,34.5209590302649],[65.788730294166,34.5084259520907],[65.7797148628061,34.4974406171939],[65.7687295279093,34.488425185834],[65.7561964497351,34.4817261159821],[65.7425972674491,34.4776008491359],[65.72845459,34.4762079169867],[65.7143119125509,34.4776008491359],[65.7007127302649,34.4817261159821],[65.6881796520907,34.488425185834],[65.6771943171939,34.4974406171939],[65.668178885834,34.5084259520907],[65.6614798159821,34.5209590302649],[65.6573545491359,34.5345582125509],[65.6559616169867,34.54870089],[65.6573545491359,34.5628435674491],[65.6614798159821,34.5764427497351],[65.668178885834,34.5889758279093],[65.6771943171939,34.5999611628061],[65.6881796520907,34.608976594166],[65.7007127302649,34.6156756640179],[65.7143119125509,34.6198009308641],[65.72845459,34.6211938630133],[65.7425972674491,34.6198009308641],[65.7561964497351,34.6156756640179],[65.7687295279093,34.608976594166],[65.7797148628061,34.5999611628061],[65.788730294166,34.5889758279093],[65.7954293640178,34.5764427497351],[65.7995546308641,34.5628435674491],[65.8009475630133,34.54870089]]]}},{"properties":{"militants killed":"0","latitude":33.32593851,"civilians killed":"0","mission type":"Direct Action","date":{"end_time":"2010/06/06 00:00:00 -0400","original":"6/5/10","granularity":"day","time":"2010/06/05 00:00:00 -0400"},"what was employed":"Not specified","notes":"Weapons cache containing  10 rocket-propelled grenades, 12 SPG-9 recoilless rifle rounds, 200 7.62mm PKM machine-gun rounds and more than 20 107mm rockets and fuses safely destroyed by Speical Forces and ANSF","captured/wounded":"0","types of units":"Afghan National Security Forces (ANSF)","area":null,"contractors' involvement":"Not available","longitude":66.24206543,"id":"127","marker icon":"small_red","source":"6/5/10, Pajhwok Afghan News, \"Large weapons cache found in Uruzgan\"","u.s. personnel killed":"0"},"type":"Feature","geometry":{"type":"Polygon","coordinates":[[[66.3145584030133,33.32593851],[66.3131654708641,33.3117958325509],[66.3090402040178,33.2981966502649],[66.302341134166,33.2856635720907],[66.2933257028061,33.2746782371939],[66.2823403679093,33.265662805834],[66.2698072897351,33.2589637359821],[66.2562081074491,33.2548384691359],[66.24206543,33.2534455369867],[66.2279227525509,33.2548384691359],[66.2143235702649,33.2589637359821],[66.2017904920907,33.265662805834],[66.1908051571939,33.2746782371939],[66.181789725834,33.2856635720907],[66.1750906559821,33.2981966502649],[66.1709653891359,33.3117958325509],[66.1695724569867,33.32593851],[66.1709653891359,33.3400811874491],[66.1750906559821,33.3536803697351],[66.181789725834,33.3662134479093],[66.1908051571939,33.3771987828061],[66.2017904920907,33.386214214166],[66.2143235702649,33.3929132840179],[66.2279227525509,33.3970385508641],[66.24206543,33.3984314830133],[66.2562081074491,33.3970385508641],[66.2698072897351,33.3929132840179],[66.2823403679093,33.386214214166],[66.2933257028061,33.3771987828061],[66.302341134166,33.3662134479093],[66.3090402040178,33.3536803697351],[66.3131654708641,33.3400811874491],[66.3145584030133,33.32593851]]]}},{"properties":{"militants killed":"0","latitude":31.60485532,"civilians killed":"0","mission type":"Civil Affairs","date":{"end_time":"2010/06/10 00:00:00 -0400","original":"6/9/10","granularity":"day","time":"2010/06/09 00:00:00 -0400"},"what was employed":"Not available","notes":"In response to a large explosion Wednesday evening at a wedding party, members of Combined Joint Special Operations Task Force  Afghanistan, along with Coalition forces, were called to provide medical assistance and security.","captured/wounded":"0","types of units":"Coalition Forces","area":"Nagahan village, Arghandab distric","contractors' involvement":"Not available","longitude":65.7614994,"id":"128","marker icon":"small_blue","source":"6/11/10, CJSOTF-A Public Affairs, \"U.S. Special Forces treat Afghans wounded at wedding party\"","u.s. personnel killed":"0"},"type":"Feature","geometry":{"type":"Polygon","coordinates":[[[65.8339923730133,31.60485532],[65.8325994408641,31.5907126425509],[65.8284741740179,31.5771134602649],[65.821775104166,31.5645803820907],[65.8127596728061,31.5535950471939],[65.8017743379093,31.544579615834],[65.7892412597351,31.5378805459821],[65.7756420774491,31.5337552791359],[65.7614994,31.5323623469867],[65.7473567225509,31.5337552791359],[65.7337575402649,31.5378805459821],[65.7212244620907,31.544579615834],[65.7102391271939,31.5535950471939],[65.701223695834,31.5645803820907],[65.6945246259822,31.5771134602649],[65.6903993591359,31.5907126425509],[65.6890064269867,31.60485532],[65.6903993591359,31.6189979974491],[65.6945246259822,31.6325971797351],[65.701223695834,31.6451302579093],[65.7102391271939,31.6561155928061],[65.7212244620907,31.665131024166],[65.7337575402649,31.6718300940179],[65.7473567225509,31.6759553608641],[65.7614994,31.6773482930133],[65.7756420774491,31.6759553608641],[65.7892412597351,31.6718300940179],[65.8017743379093,31.665131024166],[65.8127596728061,31.6561155928061],[65.821775104166,31.6451302579093],[65.8284741740179,31.6325971797351],[65.8325994408641,31.6189979974491],[65.8339923730133,31.60485532]]]}},{"properties":{"militants killed":"0","latitude":31.60478222,"civilians killed":"0","mission type":"Civil Affairs","date":{"end_time":"2010/07/04 00:00:00 -0400","original":"7/3/10","granularity":"day","time":"2010/07/03 00:00:00 -0400"},"what was employed":"Not available","notes":"The Afghan National Police, assisted by international security forces, destroyed an improvised explosive device planted in a soccer field in an effort of ANP with Special Operations to improve safety and security for residents of Kandahar province.","captured/wounded":"0","types of units":"Afghan National Security Police","area":"Khakrez district","contractors' involvement":"Not available","longitude":65.76141357,"id":"129","marker icon":"small_blue","source":"7/7/10, ISAF Command Public Affairs, \"Afghan, International Forces find IED, protect children in Kandahar\"","u.s. personnel killed":"0"},"type":"Feature","geometry":{"type":"Polygon","coordinates":[[[65.8339065430133,31.60478222],[65.8325136108641,31.5906395425509],[65.8283883440179,31.5770403602649],[65.821689274166,31.5645072820907],[65.8126738428061,31.5535219471939],[65.8016885079093,31.544506515834],[65.7891554297351,31.5378074459821],[65.7755562474491,31.5336821791359],[65.76141357,31.5322892469867],[65.7472708925509,31.5336821791359],[65.7336717102649,31.5378074459821],[65.7211386320907,31.544506515834],[65.7101532971939,31.5535219471939],[65.701137865834,31.5645072820907],[65.6944387959822,31.5770403602649],[65.6903135291359,31.5906395425509],[65.6889205969867,31.60478222],[65.6903135291359,31.6189248974491],[65.6944387959822,31.6325240797351],[65.701137865834,31.6450571579093],[65.7101532971939,31.6560424928061],[65.7211386320907,31.665057924166],[65.7336717102649,31.6717569940179],[65.7472708925509,31.6758822608641],[65.76141357,31.6772751930133],[65.7755562474491,31.6758822608641],[65.7891554297351,31.6717569940179],[65.8016885079093,31.665057924166],[65.8126738428061,31.6560424928061],[65.821689274166,31.6450571579093],[65.8283883440179,31.6325240797351],[65.8325136108641,31.6189248974491],[65.8339065430133,31.60478222]]]}},{"properties":{"militants killed":"0","latitude":31.60478222,"civilians killed":"0","mission type":"Counterterrorism","date":{"end_time":"2010/07/07 00:00:00 -0400","original":"7/6/10","granularity":"day","time":"2010/07/06 00:00:00 -0400"},"what was employed":"Not available","notes":"Special Forces suposedly raided home of Ahghan business man Haji Mohammad Zahir.","captured/wounded":"0","types of units":null,"area":"Kandahar City","contractors' involvement":"Not available","longitude":65.76141357,"id":"130","marker icon":"small_green","source":"06/08/10 Afghanistan Television, \"US forces reportedly raid businessman house in Afghan south\"","u.s. personnel killed":"0"},"type":"Feature","geometry":{"type":"Polygon","coordinates":[[[65.8339065430133,31.60478222],[65.8325136108641,31.5906395425509],[65.8283883440179,31.5770403602649],[65.821689274166,31.5645072820907],[65.8126738428061,31.5535219471939],[65.8016885079093,31.544506515834],[65.7891554297351,31.5378074459821],[65.7755562474491,31.5336821791359],[65.76141357,31.5322892469867],[65.7472708925509,31.5336821791359],[65.7336717102649,31.5378074459821],[65.7211386320907,31.544506515834],[65.7101532971939,31.5535219471939],[65.701137865834,31.5645072820907],[65.6944387959822,31.5770403602649],[65.6903135291359,31.5906395425509],[65.6889205969867,31.60478222],[65.6903135291359,31.6189248974491],[65.6944387959822,31.6325240797351],[65.701137865834,31.6450571579093],[65.7101532971939,31.6560424928061],[65.7211386320907,31.665057924166],[65.7336717102649,31.6717569940179],[65.7472708925509,31.6758822608641],[65.76141357,31.6772751930133],[65.7755562474491,31.6758822608641],[65.7891554297351,31.6717569940179],[65.8016885079093,31.665057924166],[65.8126738428061,31.6560424928061],[65.821689274166,31.6450571579093],[65.8283883440179,31.6325240797351],[65.8325136108641,31.6189248974491],[65.8339065430133,31.60478222]]]}},{"properties":{"militants killed":"0","latitude":31.60478222,"civilians killed":"0","mission type":"Civil Affairs","date":{"end_time":"2010/07/09 00:00:00 -0400","original":"7/8/10","granularity":"day","time":"2010/07/08 00:00:00 -0400"},"what was employed":"Not available","notes":"Members of a U.S. Special Operations team delivered enough supplies and classroom furniture to outfit 90 students at an Afghan school in northern Kandahar province as part of an ongoing civil affairs initiative to assist local Afghan citizens with security, governance, and development.","captured/wounded":"0","types of units":null,"area":"Shah Wali Kot district","contractors' involvement":"Not available","longitude":65.76141357,"id":"131","marker icon":"small_blue","source":"7/12/10, CJSOTF-A Public Affairs, \"U.S. Special Operations Teams deliver goods, double-up Afghan schools occupancy rate in Kandahar\"","u.s. personnel killed":"0"},"type":"Feature","geometry":{"type":"Polygon","coordinates":[[[65.8339065430133,31.60478222],[65.8325136108641,31.5906395425509],[65.8283883440179,31.5770403602649],[65.821689274166,31.5645072820907],[65.8126738428061,31.5535219471939],[65.8016885079093,31.544506515834],[65.7891554297351,31.5378074459821],[65.7755562474491,31.5336821791359],[65.76141357,31.5322892469867],[65.7472708925509,31.5336821791359],[65.7336717102649,31.5378074459821],[65.7211386320907,31.544506515834],[65.7101532971939,31.5535219471939],[65.701137865834,31.5645072820907],[65.6944387959822,31.5770403602649],[65.6903135291359,31.5906395425509],[65.6889205969867,31.60478222],[65.6903135291359,31.6189248974491],[65.6944387959822,31.6325240797351],[65.701137865834,31.6450571579093],[65.7101532971939,31.6560424928061],[65.7211386320907,31.665057924166],[65.7336717102649,31.6717569940179],[65.7472708925509,31.6758822608641],[65.76141357,31.6772751930133],[65.7755562474491,31.6758822608641],[65.7891554297351,31.6717569940179],[65.8016885079093,31.665057924166],[65.8126738428061,31.6560424928061],[65.821689274166,31.6450571579093],[65.8283883440179,31.6325240797351],[65.8325136108641,31.6189248974491],[65.8339065430133,31.60478222]]]}},{"properties":{"militants killed":"Not available","latitude":32.01972036,"civilians killed":"Not available","mission type":"Counterterrorism","date":{"end_time":"2010/07/11 00:00:00 -0400","original":"7/10/10","granularity":"day","time":"2010/07/10 00:00:00 -0400"},"what was employed":"Not available","notes":"Forces located and destroyed two improvised explosive devices (IEDs) placed on a highway","captured/wounded":"Not available","types of units":"Afghan National Security Forces (ANSF)","area":"Shin Kay","contractors' involvement":"Not available","longitude":67.42584229,"id":"132","marker icon":"small_green","source":"7/13/10,\rUS Fed News, \"Afghan, US Forces Destroy Roadside Bombs In Zabul\"","u.s. personnel killed":"Not available"},"type":"Feature","geometry":{"type":"Polygon","coordinates":[[[67.4983352630133,32.01972036],[67.4969423308641,32.0055776825509],[67.4928170640179,31.9919785002649],[67.486117994166,31.9794454220907],[67.4771025628061,31.9684600871939],[67.4661172279093,31.959444655834],[67.4535841497351,31.9527455859821],[67.4399849674491,31.9486203191359],[67.42584229,31.9472273869867],[67.4116996125509,31.9486203191359],[67.3981004302649,31.9527455859821],[67.3855673520907,31.959444655834],[67.3745820171939,31.9684600871939],[67.365566585834,31.9794454220907],[67.3588675159822,31.9919785002649],[67.3547422491359,32.0055776825509],[67.3533493169867,32.01972036],[67.3547422491359,32.0338630374491],[67.3588675159822,32.0474622197351],[67.365566585834,32.0599952979093],[67.3745820171939,32.0709806328061],[67.3855673520907,32.079996064166],[67.3981004302649,32.0866951340179],[67.4116996125509,32.0908204008641],[67.42584229,32.0922133330133],[67.4399849674491,32.0908204008641],[67.4535841497351,32.0866951340179],[67.4661172279093,32.079996064166],[67.4771025628061,32.0709806328061],[67.486117994166,32.0599952979093],[67.4928170640179,32.0474622197351],[67.4969423308641,32.0338630374491],[67.4983352630133,32.01972036]]]}},{"properties":{"militants killed":"0","latitude":31.60478222,"civilians killed":"0","mission type":"Counterterrorism","date":{"end_time":"2010/07/13 00:00:00 -0400","original":"7/12/10","granularity":"day","time":"2010/07/12 00:00:00 -0400"},"what was employed":"Not available","notes":"Over 500 pounds of explosive material was found along with tools for manufacturing improvised explosive devices (IEDs); all material, including a motorcycles rigged with explosives, was destroyed by the combined force","captured/wounded":"0","types of units":"Afghan National Army Commandos","area":"Panjawi distrcit","contractors' involvement":"0","longitude":65.76141357,"id":"133","marker icon":"small_green","source":"7/15/10,\rUS Fed News, \"Afghan, US Special Forces Destroy Insurgent Munitions\"","u.s. personnel killed":"0"},"type":"Feature","geometry":{"type":"Polygon","coordinates":[[[65.8339065430133,31.60478222],[65.8325136108641,31.5906395425509],[65.8283883440179,31.5770403602649],[65.821689274166,31.5645072820907],[65.8126738428061,31.5535219471939],[65.8016885079093,31.544506515834],[65.7891554297351,31.5378074459821],[65.7755562474491,31.5336821791359],[65.76141357,31.5322892469867],[65.7472708925509,31.5336821791359],[65.7336717102649,31.5378074459821],[65.7211386320907,31.544506515834],[65.7101532971939,31.5535219471939],[65.701137865834,31.5645072820907],[65.6944387959822,31.5770403602649],[65.6903135291359,31.5906395425509],[65.6889205969867,31.60478222],[65.6903135291359,31.6189248974491],[65.6944387959822,31.6325240797351],[65.701137865834,31.6450571579093],[65.7101532971939,31.6560424928061],[65.7211386320907,31.665057924166],[65.7336717102649,31.6717569940179],[65.7472708925509,31.6758822608641],[65.76141357,31.6772751930133],[65.7755562474491,31.6758822608641],[65.7891554297351,31.6717569940179],[65.8016885079093,31.665057924166],[65.8126738428061,31.6560424928061],[65.821689274166,31.6450571579093],[65.8283883440179,31.6325240797351],[65.8325136108641,31.6189248974491],[65.8339065430133,31.60478222]]]}},{"properties":{"militants killed":null,"latitude":31.9137018,"civilians killed":null,"mission type":"Counterterrorism","date":{"end_time":"2010/07/30 00:00:00 -0400","original":"7/29/10","granularity":"day","time":"2010/07/29 00:00:00 -0400"},"what was employed":"Fayetteville Observer","notes":null,"captured/wounded":null,"types of units":"1st Battalion, 3rd Special Forces Group (Airborne,Not available,0,2,0,0,Not available,Two Special Forces soldiers from Fort Bragg died Thursday in Afghanistan when their vehicle struck a bomb during a combat reconnaissance patrol,8/1/10","area":"Tsagay","contractors' involvement":null,"longitude":66.3306427,"id":"134","marker icon":"small_green","source":"\"\"2 Special Forces soldiers killed in Afghanistan\"\"\"","u.s. personnel killed":null},"type":"Feature","geometry":{"type":"Polygon","coordinates":[[[66.4031356730133,31.9137018],[66.4017427408641,31.8995591225509],[66.3976174740178,31.8859599402649],[66.390918404166,31.8734268620907],[66.3819029728061,31.8624415271939],[66.3709176379093,31.853426095834],[66.3583845597351,31.8467270259821],[66.3447853774491,31.8426017591359],[66.3306427,31.8412088269867],[66.3165000225509,31.8426017591359],[66.3029008402649,31.8467270259821],[66.2903677620907,31.853426095834],[66.2793824271939,31.8624415271939],[66.270366995834,31.8734268620907],[66.2636679259821,31.8859599402649],[66.2595426591359,31.8995591225509],[66.2581497269867,31.9137018],[66.2595426591359,31.9278444774491],[66.2636679259821,31.9414436597351],[66.270366995834,31.9539767379093],[66.2793824271939,31.9649620728061],[66.2903677620907,31.973977504166],[66.3029008402649,31.9806765740179],[66.3165000225509,31.9848018408641],[66.3306427,31.9861947730133],[66.3447853774491,31.9848018408641],[66.3583845597351,31.9806765740179],[66.3709176379093,31.973977504166],[66.3819029728061,31.9649620728061],[66.390918404166,31.9539767379093],[66.3976174740178,31.9414436597351],[66.4017427408641,31.9278444774491],[66.4031356730133,31.9137018]]]}},{"properties":{"militants killed":"0","latitude":31.60478222,"civilians killed":"0","mission type":"Foreign Internal Defense","date":{"end_time":"2010/08/09 00:00:00 -0400","original":"8/8/10","granularity":"day","time":"2010/08/08 00:00:00 -0400"},"what was employed":"Not available","notes":"Afghan government officials and Afghan National Army Special Forces joined U.S. Special Forces in an operation Aug. 8 to assess the security of the main route leading from Kandahar City to the Khakrez District Center determining additional checkpoints are needed for security.","captured/wounded":"0","types of units":"Afghan government officials, Afghan National Army Special Forces","area":"Kandahar","contractors' involvement":"Not available","longitude":65.76141357,"id":"135","marker icon":"small_yellow","source":"8/16/10, Combined Joint Special Operations Task Force  Afghanistan Media Operations Center, \"Afghan Leaders partner with U.S. SOF to improve route security\"","u.s. personnel killed":"0"},"type":"Feature","geometry":{"type":"Polygon","coordinates":[[[65.8339065430133,31.60478222],[65.8325136108641,31.5906395425509],[65.8283883440179,31.5770403602649],[65.821689274166,31.5645072820907],[65.8126738428061,31.5535219471939],[65.8016885079093,31.544506515834],[65.7891554297351,31.5378074459821],[65.7755562474491,31.5336821791359],[65.76141357,31.5322892469867],[65.7472708925509,31.5336821791359],[65.7336717102649,31.5378074459821],[65.7211386320907,31.544506515834],[65.7101532971939,31.5535219471939],[65.701137865834,31.5645072820907],[65.6944387959822,31.5770403602649],[65.6903135291359,31.5906395425509],[65.6889205969867,31.60478222],[65.6903135291359,31.6189248974491],[65.6944387959822,31.6325240797351],[65.701137865834,31.6450571579093],[65.7101532971939,31.6560424928061],[65.7211386320907,31.665057924166],[65.7336717102649,31.6717569940179],[65.7472708925509,31.6758822608641],[65.76141357,31.6772751930133],[65.7755562474491,31.6758822608641],[65.7891554297351,31.6717569940179],[65.8016885079093,31.665057924166],[65.8126738428061,31.6560424928061],[65.821689274166,31.6450571579093],[65.8283883440179,31.6325240797351],[65.8325136108641,31.6189248974491],[65.8339065430133,31.60478222]]]}},{"properties":{"militants killed":"0","latitude":32.01972036,"civilians killed":"0","mission type":"Civil Affairs","date":{"end_time":"2010/08/10 00:00:00 -0400","original":"8/9/10","granularity":"day","time":"2010/08/09 00:00:00 -0400"},"what was employed":"Not available","notes":"U.S. Special Operations Forces medics provided life saving care to an Afghan boy after a farming accident and arranged a medevac to to a nearby Coalition forward surgical team for treatment.","captured/wounded":"0","types of units":null,"area":"Zabul","contractors' involvement":"Not available","longitude":67.42584229,"id":"136","marker icon":"small_blue","source":"8/16/10, Combined Joint Special Operations Task Force  Afghanistan Media Operations Center, \"ANA, coalition forces donate blood; provide life-saving care to Afghan boy in farming accident\"","u.s. personnel killed":"0"},"type":"Feature","geometry":{"type":"Polygon","coordinates":[[[67.4983352630133,32.01972036],[67.4969423308641,32.0055776825509],[67.4928170640179,31.9919785002649],[67.486117994166,31.9794454220907],[67.4771025628061,31.9684600871939],[67.4661172279093,31.959444655834],[67.4535841497351,31.9527455859821],[67.4399849674491,31.9486203191359],[67.42584229,31.9472273869867],[67.4116996125509,31.9486203191359],[67.3981004302649,31.9527455859821],[67.3855673520907,31.959444655834],[67.3745820171939,31.9684600871939],[67.365566585834,31.9794454220907],[67.3588675159822,31.9919785002649],[67.3547422491359,32.0055776825509],[67.3533493169867,32.01972036],[67.3547422491359,32.0338630374491],[67.3588675159822,32.0474622197351],[67.365566585834,32.0599952979093],[67.3745820171939,32.0709806328061],[67.3855673520907,32.079996064166],[67.3981004302649,32.0866951340179],[67.4116996125509,32.0908204008641],[67.42584229,32.0922133330133],[67.4399849674491,32.0908204008641],[67.4535841497351,32.0866951340179],[67.4661172279093,32.079996064166],[67.4771025628061,32.0709806328061],[67.486117994166,32.0599952979093],[67.4928170640179,32.0474622197351],[67.4969423308641,32.0338630374491],[67.4983352630133,32.01972036]]]}},{"properties":{"militants killed":"7","latitude":31.60485532,"civilians killed":"0","mission type":"Counterterrorism","date":{"end_time":"2010/08/10 00:00:00 -0400","original":"8/9/10","granularity":"day","time":"2010/08/09 00:00:00 -0400"},"what was employed":"Not available","notes":"Forces conducted a joint sweeps recovering large caches of firearms","captured/wounded":"5","types of units":"Coalition Troops, Afghan National Army troops","area":null,"contractors' involvement":"Not available","longitude":65.76141357,"id":"137","marker icon":"small_green","source":"8/9/10,\rPajhwok Afghan News, \"Seven suspects killed, five detained\"","u.s. personnel killed":"0"},"type":"Feature","geometry":{"type":"Polygon","coordinates":[[[65.8339065430133,31.60485532],[65.8325136108641,31.5907126425509],[65.8283883440179,31.5771134602649],[65.821689274166,31.5645803820907],[65.8126738428061,31.5535950471939],[65.8016885079093,31.544579615834],[65.7891554297351,31.5378805459821],[65.7755562474491,31.5337552791359],[65.76141357,31.5323623469867],[65.7472708925509,31.5337552791359],[65.7336717102649,31.5378805459821],[65.7211386320907,31.544579615834],[65.7101532971939,31.5535950471939],[65.701137865834,31.5645803820907],[65.6944387959822,31.5771134602649],[65.6903135291359,31.5907126425509],[65.6889205969867,31.60485532],[65.6903135291359,31.6189979974491],[65.6944387959822,31.6325971797351],[65.701137865834,31.6451302579093],[65.7101532971939,31.6561155928061],[65.7211386320907,31.665131024166],[65.7336717102649,31.6718300940179],[65.7472708925509,31.6759553608641],[65.76141357,31.6773482930133],[65.7755562474491,31.6759553608641],[65.7891554297351,31.6718300940179],[65.8016885079093,31.665131024166],[65.8126738428061,31.6561155928061],[65.821689274166,31.6451302579093],[65.8283883440179,31.6325971797351],[65.8325136108641,31.6189979974491],[65.8339065430133,31.60485532]]]}},{"properties":{"militants killed":"Not available","latitude":33.32593851,"civilians killed":"Not available","mission type":"Direct Action","date":{"end_time":"2010/08/21 00:00:00 -0400","original":"8/20/10","granularity":"day","time":"2010/08/20 00:00:00 -0400"},"what was employed":"Grenades, firearms","notes":"US forces ambushed, two special operators awarded Silver Stars","captured/wounded":"One U.S. soldier, three Afghan soldiers","types of units":null,"area":null,"contractors' involvement":"Not available","longitude":66.24206543,"id":"138","marker icon":"small_red","source":"08/16/10, AP, \"Special Forces;\" 08/16/10, CNN","u.s. personnel killed":"0"},"type":"Feature","geometry":{"type":"Polygon","coordinates":[[[66.3145584030133,33.32593851],[66.3131654708641,33.3117958325509],[66.3090402040178,33.2981966502649],[66.302341134166,33.2856635720907],[66.2933257028061,33.2746782371939],[66.2823403679093,33.265662805834],[66.2698072897351,33.2589637359821],[66.2562081074491,33.2548384691359],[66.24206543,33.2534455369867],[66.2279227525509,33.2548384691359],[66.2143235702649,33.2589637359821],[66.2017904920907,33.265662805834],[66.1908051571939,33.2746782371939],[66.181789725834,33.2856635720907],[66.1750906559821,33.2981966502649],[66.1709653891359,33.3117958325509],[66.1695724569867,33.32593851],[66.1709653891359,33.3400811874491],[66.1750906559821,33.3536803697351],[66.181789725834,33.3662134479093],[66.1908051571939,33.3771987828061],[66.2017904920907,33.386214214166],[66.2143235702649,33.3929132840179],[66.2279227525509,33.3970385508641],[66.24206543,33.3984314830133],[66.2562081074491,33.3970385508641],[66.2698072897351,33.3929132840179],[66.2823403679093,33.386214214166],[66.2933257028061,33.3771987828061],[66.302341134166,33.3662134479093],[66.3090402040178,33.3536803697351],[66.3131654708641,33.3400811874491],[66.3145584030133,33.32593851]]]}},{"properties":{"militants killed":"0","latitude":33.69006708,"civilians killed":"0","mission type":"Civil Affairs","date":{"end_time":"2010/08/24 00:00:00 -0400","original":"8/23/10","granularity":"day","time":"2010/08/23 00:00:00 -0400"},"what was employed":"Not available","notes":"U.S. Special Forces medical personnel medically evacuated a local civilian man after he was brought to a fire base in the area with near-fatal wounds.","captured/wounded":"0","types of units":null,"area":null,"contractors' involvement":"Not available","longitude":69.48577881,"id":"139","marker icon":"small_blue","source":"8/26/10, Combined Joint Special Operations Task Force  Afghanistan Media Operations Center, \"U.S. Special Forces medics save injured man\"","u.s. personnel killed":"0"},"type":"Feature","geometry":{"type":"Polygon","coordinates":[[[69.5582717830133,33.69006708],[69.5568788508641,33.6759244025509],[69.5527535840179,33.6623252202649],[69.546054514166,33.6497921420907],[69.5370390828061,33.6388068071939],[69.5260537479093,33.629791375834],[69.5135206697351,33.6230923059821],[69.4999214874491,33.6189670391359],[69.48577881,33.6175741069867],[69.4716361325509,33.6189670391359],[69.4580369502649,33.6230923059821],[69.4455038720907,33.629791375834],[69.4345185371939,33.6388068071939],[69.425503105834,33.6497921420907],[69.4188040359821,33.6623252202649],[69.4146787691359,33.6759244025509],[69.4132858369867,33.69006708],[69.4146787691359,33.7042097574491],[69.4188040359821,33.7178089397351],[69.425503105834,33.7303420179093],[69.4345185371939,33.7413273528061],[69.4455038720907,33.750342784166],[69.4580369502649,33.7570418540179],[69.4716361325509,33.7611671208641],[69.48577881,33.7625600530133],[69.4999214874491,33.7611671208641],[69.5135206697351,33.7570418540179],[69.5260537479093,33.750342784166],[69.5370390828061,33.7413273528061],[69.546054514166,33.7303420179093],[69.5527535840179,33.7178089397351],[69.5568788508641,33.7042097574491],[69.5582717830133,33.69006708]]]}},{"properties":{"militants killed":"0","latitude":31.60500152,"civilians killed":"0","mission type":"Civil Affairs","date":{"end_time":"2010/08/28 00:00:00 -0400","original":"8/27/10","granularity":"day","time":"2010/08/27 00:00:00 -0400"},"what was employed":"Not available","notes":"USSF team treated water wells and kariz systems in four different villages and treated a total of 200 patients in a 48-hour period with medicine from the Mirwais Hospital in Kandahar City.","captured/wounded":"0","types of units":null,"area":"Marfu District","contractors' involvement":"Not available","longitude":65.7614994,"id":"140","marker icon":"small_blue","source":"8/31/10, CJSOTF-A Media Center, \"District Governor, U.S. Special Forces react quickly to water-borne illnesses in east Kandahar\"","u.s. personnel killed":"0"},"type":"Feature","geometry":{"type":"Polygon","coordinates":[[[65.8339923730133,31.60500152],[65.8325994408641,31.5908588425509],[65.8284741740179,31.5772596602649],[65.821775104166,31.5647265820907],[65.8127596728061,31.5537412471939],[65.8017743379093,31.544725815834],[65.7892412597351,31.5380267459821],[65.7756420774491,31.5339014791359],[65.7614994,31.5325085469867],[65.7473567225509,31.5339014791359],[65.7337575402649,31.5380267459821],[65.7212244620907,31.544725815834],[65.7102391271939,31.5537412471939],[65.701223695834,31.5647265820907],[65.6945246259822,31.5772596602649],[65.6903993591359,31.5908588425509],[65.6890064269867,31.60500152],[65.6903993591359,31.6191441974491],[65.6945246259822,31.6327433797351],[65.701223695834,31.6452764579093],[65.7102391271939,31.6562617928061],[65.7212244620907,31.665277224166],[65.7337575402649,31.6719762940179],[65.7473567225509,31.6761015608641],[65.7614994,31.6774944930133],[65.7756420774491,31.6761015608641],[65.7892412597351,31.6719762940179],[65.8017743379093,31.665277224166],[65.8127596728061,31.6562617928061],[65.821775104166,31.6452764579093],[65.8284741740179,31.6327433797351],[65.8325994408641,31.6191441974491],[65.8339923730133,31.60500152]]]}},{"properties":{"militants killed":"0","latitude":37.26093815,"civilians killed":"0","mission type":"Special Reconnaissance","date":{"end_time":"2010/08/28 00:00:00 -0400","original":"8/27/10","granularity":"day","time":"2010/08/27 00:00:00 -0400"},"what was employed":null,"notes":"Forces found and destroyed a large weapons cache","captured/wounded":"0","types of units":"5th Commando Kandak, Drug Enforcement Agency agents, Afghan National Interdiction Unit","area":null,"contractors' involvement":"Not available","longitude":74.18518066,"id":"141","marker icon":"small_purple","source":null,"u.s. personnel killed":"0"},"type":"Feature","geometry":{"type":"Polygon","coordinates":[[[74.2576736330133,37.26093815],[74.2562807008641,37.2467954725509],[74.2521554340179,37.2331962902649],[74.245456364166,37.2206632120907],[74.2364409328061,37.2096778771939],[74.2254555979093,37.200662445834],[74.2129225197351,37.1939633759821],[74.1993233374491,37.1898381091359],[74.18518066,37.1884451769867],[74.1710379825509,37.1898381091359],[74.1574388002649,37.1939633759821],[74.1449057220907,37.200662445834],[74.1339203871939,37.2096778771939],[74.124904955834,37.2206632120907],[74.1182058859821,37.2331962902649],[74.1140806191359,37.2467954725509],[74.1126876869867,37.26093815],[74.1140806191359,37.2750808274491],[74.1182058859821,37.2886800097351],[74.124904955834,37.3012130879093],[74.1339203871939,37.3121984228061],[74.1449057220907,37.321213854166],[74.1574388002649,37.3279129240179],[74.1710379825509,37.3320381908641],[74.18518066,37.3334311230133],[74.1993233374491,37.3320381908641],[74.2129225197351,37.3279129240179],[74.2254555979093,37.321213854166],[74.2364409328061,37.3121984228061],[74.245456364166,37.3012130879093],[74.2521554340179,37.2886800097351],[74.2562807008641,37.2750808274491],[74.2576736330133,37.26093815]]]}},{"properties":{"militants killed":"0","latitude":31.60478222,"civilians killed":"0","mission type":"Counterterrorism","date":{"end_time":"2030/09/02 00:00:00 -0400","original":"10-Sep","granularity":"day","time":"2030/09/01 00:00:00 -0400"},"what was employed":"Not available","notes":"Ongoing operation as of September 29.","captured/wounded":"0","types of units":"Afghan Allied Forces","area":"Kandahar","contractors' involvement":"Not available","longitude":65.76141357,"id":"142","marker icon":"small_green","source":"9/26/10, New York Times, \"American and Afghan Troops Begin Combat for Kandahar\"","u.s. personnel killed":"16"},"type":"Feature","geometry":{"type":"Polygon","coordinates":[[[65.8339065430133,31.60478222],[65.8325136108641,31.5906395425509],[65.8283883440179,31.5770403602649],[65.821689274166,31.5645072820907],[65.8126738428061,31.5535219471939],[65.8016885079093,31.544506515834],[65.7891554297351,31.5378074459821],[65.7755562474491,31.5336821791359],[65.76141357,31.5322892469867],[65.7472708925509,31.5336821791359],[65.7336717102649,31.5378074459821],[65.7211386320907,31.544506515834],[65.7101532971939,31.5535219471939],[65.701137865834,31.5645072820907],[65.6944387959822,31.5770403602649],[65.6903135291359,31.5906395425509],[65.6889205969867,31.60478222],[65.6903135291359,31.6189248974491],[65.6944387959822,31.6325240797351],[65.701137865834,31.6450571579093],[65.7101532971939,31.6560424928061],[65.7211386320907,31.665057924166],[65.7336717102649,31.6717569940179],[65.7472708925509,31.6758822608641],[65.76141357,31.6772751930133],[65.7755562474491,31.6758822608641],[65.7891554297351,31.6717569940179],[65.8016885079093,31.665057924166],[65.8126738428061,31.6560424928061],[65.821689274166,31.6450571579093],[65.8283883440179,31.6325240797351],[65.8325136108641,31.6189248974491],[65.8339065430133,31.60478222]]]}},{"properties":{"militants killed":"0","latitude":35.32184842,"civilians killed":"0","mission type":"Direct Action","date":{"end_time":"2010/09/27 00:00:00 -0400","original":"9/26/10","granularity":"day","time":"2010/09/26 00:00:00 -0400"},"what was employed":"Not available","notes":"Search for a British aid worker and 3 Afghan co-workers kidnapped at gunpoint while traveling in convoy.","captured/wounded":"0","types of units":"Afghan Allied Forces","area":null,"contractors' involvement":"Not available","longitude":70.99639893,"id":"143","marker icon":"small_red","source":"27/9/10, Guardian, \"US forces join search for British woman kidnapped in Afghanistan","u.s. personnel killed":"0"},"type":"Feature","geometry":{"type":"Polygon","coordinates":[[[71.0688919030133,35.32184842],[71.0674989708641,35.3077057425509],[71.0633737040178,35.2941065602649],[71.056674634166,35.2815734820907],[71.0476592028061,35.2705881471939],[71.0366738679093,35.261572715834],[71.0241407897351,35.2548736459821],[71.0105416074491,35.2507483791359],[70.99639893,35.2493554469867],[70.9822562525509,35.2507483791359],[70.9686570702649,35.2548736459821],[70.9561239920907,35.261572715834],[70.9451386571939,35.2705881471939],[70.936123225834,35.2815734820907],[70.9294241559821,35.2941065602649],[70.9252988891359,35.3077057425509],[70.9239059569867,35.32184842],[70.9252988891359,35.3359910974491],[70.9294241559821,35.3495902797351],[70.936123225834,35.3621233579093],[70.9451386571939,35.3731086928061],[70.9561239920907,35.382124124166],[70.9686570702649,35.3888231940179],[70.9822562525509,35.3929484608641],[70.99639893,35.3943413930133],[71.0105416074491,35.3929484608641],[71.0241407897351,35.3888231940179],[71.0366738679093,35.382124124166],[71.0476592028061,35.3731086928061],[71.056674634166,35.3621233579093],[71.0633737040178,35.3495902797351],[71.0674989708641,35.3359910974491],[71.0688919030133,35.32184842]]]}},{"properties":{"militants killed":"0","latitude":33.31216784,"civilians killed":"0","mission type":"Civil Affairs","date":{"end_time":"2010/10/17 00:00:00 -0400","original":"10/16/10","granularity":"day","time":"2010/10/16 00:00:00 -0400"},"what was employed":"Not available","notes":"Afghan National Army Special Forces and U.S. Special Forces members provided veterinarian care during a Village Medical Outreach Program event Oct. 23, treating more than 162 animals with various ailments in the Khas Uruzgan district.","captured/wounded":"0","types of units":"Afghan National Army Special Forces","area":null,"contractors' involvement":"Not available","longitude":66.25305176,"id":"144","marker icon":"small_blue","source":"11/1/10, Combined Joint Special Operations Task Force- Afghanistan Media Operations Center, \"ANA and US Special Forces members help treat village animals\"","u.s. personnel killed":"0"},"type":"Feature","geometry":{"type":"Polygon","coordinates":[[[66.3255447330133,33.31216784],[66.3241518008641,33.2980251625509],[66.3200265340179,33.2844259802649],[66.313327464166,33.2718929020907],[66.3043120328061,33.2609075671939],[66.2933266979093,33.251892135834],[66.2807936197351,33.2451930659821],[66.2671944374491,33.2410677991359],[66.25305176,33.2396748669867],[66.2389090825509,33.2410677991359],[66.2253099002649,33.2451930659821],[66.2127768220907,33.251892135834],[66.2017914871939,33.2609075671939],[66.192776055834,33.2718929020907],[66.1860769859822,33.2844259802649],[66.1819517191359,33.2980251625509],[66.1805587869867,33.31216784],[66.1819517191359,33.3263105174491],[66.1860769859822,33.3399096997351],[66.192776055834,33.3524427779093],[66.2017914871939,33.3634281128061],[66.2127768220907,33.372443544166],[66.2253099002649,33.3791426140179],[66.2389090825509,33.3832678808641],[66.25305176,33.3846608130133],[66.2671944374491,33.3832678808641],[66.2807936197351,33.3791426140179],[66.2933266979093,33.372443544166],[66.3043120328061,33.3634281128061],[66.313327464166,33.3524427779093],[66.3200265340179,33.3399096997351],[66.3241518008641,33.3263105174491],[66.3255447330133,33.31216784]]]}},{"properties":{"militants killed":"0","latitude":31.191658,"civilians killed":"0","mission type":"Civil Affairs","date":{"end_time":"2030/07/02 00:00:00 -0400","original":"10-Jul","granularity":"day","time":"2030/07/01 00:00:00 -0400"},"what was employed":"Not available","notes":"U.S. Special Operations Forces helped establish the radio network throughout southern Afghanistan and provided technical support to Afghan radio announcers.","captured/wounded":"0","types of units":"International Security Forces, Afghan district and provincial leaders","area":null,"contractors' involvement":"Not available","longitude":64.20410156,"id":"145","marker icon":"small_blue","source":"7/12/10, CJSOTF-A Public Affairs, \"US supported radio network connects Afghan citizens, leaders in southern Afghanistan\"","u.s. personnel killed":"0"},"type":"Feature","geometry":{"type":"Polygon","coordinates":[[[64.2765945330133,31.191658],[64.2752016008641,31.1775153225509],[64.2710763340178,31.1639161402649],[64.264377264166,31.1513830620907],[64.2553618328061,31.1403977271939],[64.2443764979093,31.131382295834],[64.2318434197351,31.1246832259821],[64.2182442374491,31.1205579591359],[64.20410156,31.1191650269867],[64.1899588825509,31.1205579591359],[64.1763597002649,31.1246832259821],[64.1638266220907,31.131382295834],[64.1528412871939,31.1403977271939],[64.143825855834,31.1513830620907],[64.1371267859821,31.1639161402649],[64.1330015191359,31.1775153225509],[64.1316085869867,31.191658],[64.1330015191359,31.2058006774491],[64.1371267859821,31.2193998597351],[64.143825855834,31.2319329379093],[64.1528412871939,31.2429182728061],[64.1638266220907,31.251933704166],[64.1763597002649,31.2586327740179],[64.1899588825509,31.2627580408641],[64.20410156,31.2641509730133],[64.2182442374491,31.2627580408641],[64.2318434197351,31.2586327740179],[64.2443764979093,31.251933704166],[64.2553618328061,31.2429182728061],[64.264377264166,31.2319329379093],[64.2710763340178,31.2193998597351],[64.2752016008641,31.2058006774491],[64.2765945330133,31.191658]]]}},{"properties":{"militants killed":"0","latitude":34.41144164,"civilians killed":"3","mission type":"Direct Action","date":{"end_time":"2010/08/12 00:00:00 -0400","original":"8/11/10","granularity":"day","time":"2010/08/11 00:00:00 -0400"},"what was employed":"Not available","notes":"Forces raided a home and announced that they'd killed three suspected militants; the next morning, hundreds of people blocked the highway nearby, protesting that the young men were college students home for the holy month of Ramadan","captured/wounded":"0","types of units":"Afghan interpreters","area":"Wardak","contractors' involvement":"Not available","longitude":68.24432373,"id":"146","marker icon":"small_red","source":"25 August 2010\rNPR: All Things Considered \"Deadly U.S. Raid Sparks Furor Among Afghan Civilians\"","u.s. personnel killed":"0"},"type":"Feature","geometry":{"type":"Polygon","coordinates":[[[68.3168167030133,34.41144164],[68.3154237708641,34.3972989625509],[68.3112985040179,34.3836997802649],[68.304599434166,34.3711667020907],[68.2955840028061,34.3601813671939],[68.2845986679093,34.351165935834],[68.2720655897351,34.3444668659821],[68.2584664074491,34.3403415991359],[68.24432373,34.3389486669867],[68.2301810525509,34.3403415991359],[68.2165818702649,34.3444668659821],[68.2040487920907,34.351165935834],[68.1930634571939,34.3601813671939],[68.184048025834,34.3711667020907],[68.1773489559822,34.3836997802649],[68.1732236891359,34.3972989625509],[68.1718307569867,34.41144164],[68.1732236891359,34.4255843174491],[68.1773489559822,34.4391834997351],[68.184048025834,34.4517165779093],[68.1930634571939,34.4627019128061],[68.2040487920907,34.471717344166],[68.2165818702649,34.4784164140179],[68.2301810525509,34.4825416808641],[68.24432373,34.4839346130133],[68.2584664074491,34.4825416808641],[68.2720655897351,34.4784164140179],[68.2845986679093,34.471717344166],[68.2955840028061,34.4627019128061],[68.304599434166,34.4517165779093],[68.3112985040179,34.4391834997351],[68.3154237708641,34.4255843174491],[68.3168167030133,34.41144164]]]}},{"properties":{"militants killed":"0","latitude":33.1398510418607,"civilians killed":"0","mission type":"Counterterrorism","date":{"end_time":"2001/09/14 00:00:00 -0400","original":"9/13/2001","granularity":"day","time":"2001/09/13 00:00:00 -0400"},"what was employed":"Not available","notes":"Teams of three to five soldiers, supported by Black Hawk MH-60K helicopters, searched for Osama bin Laden.","captured/wounded":"0","types of units":null,"area":"Quetta, Afghanistan","contractors' involvement":null,"longitude":66.1349487304688,"id":"147","marker icon":"small_green","source":"10/1/01, Herald-Sun, \"Elite Forces Slip Over Border\"","u.s. personnel killed":"0"},"type":"Feature","geometry":{"type":"Polygon","coordinates":[[[66.207441703482,33.1398510418607],[66.2060487713328,33.1257083644116],[66.2019235044866,33.1121091821256],[66.1952244346348,33.0995761039514],[66.1862090032748,33.0885907690546],[66.175223668378,33.0795753376947],[66.1626905902038,33.0728762678428],[66.1490914079178,33.0687510009966],[66.1349487304688,33.0673580688474],[66.1208060530197,33.0687510009966],[66.1072068707337,33.0728762678428],[66.0946737925595,33.0795753376947],[66.0836884576627,33.0885907690546],[66.0746730263027,33.0995761039514],[66.0679739564509,33.1121091821256],[66.0638486896047,33.1257083644116],[66.0624557574555,33.1398510418607],[66.0638486896047,33.1539937193098],[66.0679739564509,33.1675929015958],[66.0746730263027,33.18012597977],[66.0836884576627,33.1911113146668],[66.0946737925595,33.2001267460267],[66.1072068707337,33.2068258158786],[66.1208060530197,33.2109510827248],[66.1349487304688,33.212344014874],[66.1490914079178,33.2109510827248],[66.1626905902038,33.2068258158786],[66.175223668378,33.2001267460267],[66.1862090032748,33.1911113146668],[66.1952244346348,33.18012597977],[66.2019235044866,33.1675929015958],[66.2060487713328,33.1539937193098],[66.207441703482,33.1398510418607]]]}}],"is_temporal":true,"author":{"url":null,"metadata":null,"contact_name":null,"contact_address":null,"source":null,"contact_phone":null},"source":null,"pagination":{"sort":null,"start":0,"total":147,"limit":1000000},"state":"complete","tags":"","published":"2014-08-12T21:17:20-04:00","id":180234}