{"type":"FeatureCollection","data_type":"Dataset Analysis","url_type":null,"permissions":[{"permissions":{"download":true,"view":true},"group_id":"everyone"}],"classification":null,"title":"Dataset from 'VIOLENCE AGAINST JOURNALISTS IN AFGHANISTAN 2001-2011' with a 2 to 4 miles buffer","count":265,"stream_id":228722,"contributor":{"url":"http://geocommons.com/users/43018","name":"fanny60624"},"data_attributes":null,"calculation_params":{"calculation":"donut_buffer","input":{"min_distance":"2","unit":"miles","distance":"4","id":"138644"}},"icon_link":null,"link":"http://geocommons.com/overlays/228722.json","extent":[62.072,30.982,71.148,36.898],"geometry_types":["area"],"unique_name":null,"name":"Dataset from 'VIOLENCE AGAINST JOURNALISTS IN AFGHANISTAN 2001-2011' with a 2 to 4 miles buffer","feature_count":265,"description":"Dataset created by adding a buffer of 2 to 4 miles around the features in 'VIOLENCE AGAINST JOURNALISTS IN AFGHANISTAN 2001-2011'","next_feature":null,"is_raster":false,"short_classification":"Y","stats":{"month":{"max":12,"mean":6.26,"variance":11.759437751004,"stdev":3.42920366134821,"min":1,"median":6},"latitude":{"max":36.84,"mean":34.1207924528302,"variance":1.88102474842767,"stdev":1.37150455647354,"min":31.04,"median":34.55},"unique_id":{"max":265,"mean":133.0,"variance":5874.16666666667,"stdev":76.643112323722,"min":1,"median":133},"date":{"max":"2011/10/09 00:00:00 -0400","mean":"2008/05/13 23:30:06 -0400","variance":3.96837219611041e+15,"stdev":62995017.2324003,"min":"2001/07/03 00:00:00 -0400","median":"2008/06/23 00:00:00 -0400"},"day":{"max":31,"mean":16.0657894736842,"variance":77.1454324136332,"stdev":8.78324725905136,"min":1,"median":15},"year":{"max":2011,"mean":2007.6679245283,"variance":3.38930817610061,"stdev":1.84100738078385,"min":2001,"median":2008},"longitude":{"max":71.09,"mean":67.9723773584905,"variance":6.62575076615209,"stdev":2.57405337282506,"min":62.13,"median":69.33}},"features":[{"properties":{"occupation":"Journalist","home_town":"Unclear","month":11,"latitude":34.27,"suspected_attacker":"Unknown","unique_id":1,"date":{"end_time":"2001/11/20 00:00:00 -0500","original":"11/19/2001","granularity":"day","time":"2001/11/19 00:00:00 -0500"},"investigation_result":null,"gender":"Male","incident_reason":"Unclear","day":19,"incident_province":"Nangarhar","incident_type":"Killed","year":2001,"longitude":70.48,"organization":"Reuters","id":"0","incident_town":"Unclear","incident_district":"Unclear","age":null,"home_province":"Foreigner","notes_other_details":null},"type":"Feature","geometry":{"type":"Polygon","coordinates":[[[70.5379943784106,34.27],[70.5368800326913,34.2586858580407],[70.5335798192143,34.2478065122119],[70.5282205633328,34.2377800496726],[70.5210082182449,34.2289917817552],[70.5122199503274,34.2217794366672],[70.5021934877881,34.2164201807857],[70.4913141419593,34.2131199673087],[70.48,34.2120056215894],[70.4686858580408,34.2131199673087],[70.4578065122119,34.2164201807857],[70.4477800496726,34.2217794366672],[70.4389917817552,34.2289917817552],[70.4317794366672,34.2377800496726],[70.4264201807857,34.2478065122119],[70.4231199673087,34.2586858580407],[70.4220056215894,34.27],[70.4231199673087,34.2813141419593],[70.4264201807857,34.2921934877881],[70.4317794366672,34.3022199503274],[70.4389917817551,34.3110082182449],[70.4477800496726,34.3182205633328],[70.4578065122119,34.3235798192143],[70.4686858580408,34.3268800326913],[70.48,34.3279943784106],[70.4913141419593,34.3268800326913],[70.5021934877881,34.3235798192143],[70.5122199503274,34.3182205633328],[70.5210082182448,34.3110082182449],[70.5282205633328,34.3022199503274],[70.5335798192143,34.2921934877881],[70.5368800326913,34.2813141419593],[70.5379943784106,34.27]]]}},{"properties":{"occupation":"Journalist","home_town":"Unclear","month":11,"latitude":34.27,"suspected_attacker":"Unknown","unique_id":2,"date":{"end_time":"2001/11/20 00:00:00 -0500","original":"11/19/2001","granularity":"day","time":"2001/11/19 00:00:00 -0500"},"investigation_result":null,"gender":"Male","incident_reason":"Unclear","day":19,"incident_province":"Nangarhar","incident_type":"Killed","year":2001,"longitude":70.48,"organization":"Reuters","id":"1","incident_town":"Unclear","incident_district":"Unclear","age":null,"home_province":"Afghan","notes_other_details":null},"type":"Feature","geometry":{"type":"Polygon","coordinates":[[[70.5379943784106,34.27],[70.5368800326913,34.2586858580407],[70.5335798192143,34.2478065122119],[70.5282205633328,34.2377800496726],[70.5210082182449,34.2289917817552],[70.5122199503274,34.2217794366672],[70.5021934877881,34.2164201807857],[70.4913141419593,34.2131199673087],[70.48,34.2120056215894],[70.4686858580408,34.2131199673087],[70.4578065122119,34.2164201807857],[70.4477800496726,34.2217794366672],[70.4389917817552,34.2289917817552],[70.4317794366672,34.2377800496726],[70.4264201807857,34.2478065122119],[70.4231199673087,34.2586858580407],[70.4220056215894,34.27],[70.4231199673087,34.2813141419593],[70.4264201807857,34.2921934877881],[70.4317794366672,34.3022199503274],[70.4389917817551,34.3110082182449],[70.4477800496726,34.3182205633328],[70.4578065122119,34.3235798192143],[70.4686858580408,34.3268800326913],[70.48,34.3279943784106],[70.4913141419593,34.3268800326913],[70.5021934877881,34.3235798192143],[70.5122199503274,34.3182205633328],[70.5210082182448,34.3110082182449],[70.5282205633328,34.3022199503274],[70.5335798192143,34.2921934877881],[70.5368800326913,34.2813141419593],[70.5379943784106,34.27]]]}},{"properties":{"occupation":"Journalist","home_town":"Unclear","month":11,"latitude":34.27,"suspected_attacker":"Unknown","unique_id":3,"date":{"end_time":"2001/11/20 00:00:00 -0500","original":"11/19/2001","granularity":"day","time":"2001/11/19 00:00:00 -0500"},"investigation_result":null,"gender":"Female","incident_reason":"Unclear","day":19,"incident_province":"Nangarhar","incident_type":"Killed","year":2001,"longitude":70.48,"organization":"Unclear","id":"2","incident_town":"Unclear","incident_district":"Unclear","age":null,"home_province":"Italy","notes_other_details":null},"type":"Feature","geometry":{"type":"Polygon","coordinates":[[[70.5379943784106,34.27],[70.5368800326913,34.2586858580407],[70.5335798192143,34.2478065122119],[70.5282205633328,34.2377800496726],[70.5210082182449,34.2289917817552],[70.5122199503274,34.2217794366672],[70.5021934877881,34.2164201807857],[70.4913141419593,34.2131199673087],[70.48,34.2120056215894],[70.4686858580408,34.2131199673087],[70.4578065122119,34.2164201807857],[70.4477800496726,34.2217794366672],[70.4389917817552,34.2289917817552],[70.4317794366672,34.2377800496726],[70.4264201807857,34.2478065122119],[70.4231199673087,34.2586858580407],[70.4220056215894,34.27],[70.4231199673087,34.2813141419593],[70.4264201807857,34.2921934877881],[70.4317794366672,34.3022199503274],[70.4389917817551,34.3110082182449],[70.4477800496726,34.3182205633328],[70.4578065122119,34.3235798192143],[70.4686858580408,34.3268800326913],[70.48,34.3279943784106],[70.4913141419593,34.3268800326913],[70.5021934877881,34.3235798192143],[70.5122199503274,34.3182205633328],[70.5210082182448,34.3110082182449],[70.5282205633328,34.3022199503274],[70.5335798192143,34.2921934877881],[70.5368800326913,34.2813141419593],[70.5379943784106,34.27]]]}},{"properties":{"occupation":"Journalist","home_town":"Unclear","month":11,"latitude":34.27,"suspected_attacker":"Unknown","unique_id":4,"date":{"end_time":"2001/11/20 00:00:00 -0500","original":"11/19/2001","granularity":"day","time":"2001/11/19 00:00:00 -0500"},"investigation_result":null,"gender":"Female","incident_reason":"Unclear","day":19,"incident_province":"Nangarhar","incident_type":"Killed","year":2001,"longitude":70.48,"organization":"Unclear","id":"3","incident_town":"Unclear","incident_district":"Unclear","age":null,"home_province":"Spain","notes_other_details":null},"type":"Feature","geometry":{"type":"Polygon","coordinates":[[[70.5379943784106,34.27],[70.5368800326913,34.2586858580407],[70.5335798192143,34.2478065122119],[70.5282205633328,34.2377800496726],[70.5210082182449,34.2289917817552],[70.5122199503274,34.2217794366672],[70.5021934877881,34.2164201807857],[70.4913141419593,34.2131199673087],[70.48,34.2120056215894],[70.4686858580408,34.2131199673087],[70.4578065122119,34.2164201807857],[70.4477800496726,34.2217794366672],[70.4389917817552,34.2289917817552],[70.4317794366672,34.2377800496726],[70.4264201807857,34.2478065122119],[70.4231199673087,34.2586858580407],[70.4220056215894,34.27],[70.4231199673087,34.2813141419593],[70.4264201807857,34.2921934877881],[70.4317794366672,34.3022199503274],[70.4389917817551,34.3110082182449],[70.4477800496726,34.3182205633328],[70.4578065122119,34.3235798192143],[70.4686858580408,34.3268800326913],[70.48,34.3279943784106],[70.4913141419593,34.3268800326913],[70.5021934877881,34.3235798192143],[70.5122199503274,34.3182205633328],[70.5210082182448,34.3110082182449],[70.5282205633328,34.3022199503274],[70.5335798192143,34.2921934877881],[70.5368800326913,34.2813141419593],[70.5379943784106,34.27]]]}},{"properties":{"occupation":"Journalist","home_town":"Unclear","month":11,"latitude":34.27,"suspected_attacker":"Unknown","unique_id":5,"date":{"end_time":"2001/11/28 00:00:00 -0500","original":"11/27/2001","granularity":"day","time":"2001/11/27 00:00:00 -0500"},"investigation_result":null,"gender":"Male","incident_reason":"Unclear","day":27,"incident_province":"Nangarhar","incident_type":"Killed","year":2001,"longitude":70.48,"organization":"Freelance","id":"4","incident_town":"Unclear","incident_district":"Unclear","age":null,"home_province":"Sweden","notes_other_details":null},"type":"Feature","geometry":{"type":"Polygon","coordinates":[[[70.5379943784106,34.27],[70.5368800326913,34.2586858580407],[70.5335798192143,34.2478065122119],[70.5282205633328,34.2377800496726],[70.5210082182449,34.2289917817552],[70.5122199503274,34.2217794366672],[70.5021934877881,34.2164201807857],[70.4913141419593,34.2131199673087],[70.48,34.2120056215894],[70.4686858580408,34.2131199673087],[70.4578065122119,34.2164201807857],[70.4477800496726,34.2217794366672],[70.4389917817552,34.2289917817552],[70.4317794366672,34.2377800496726],[70.4264201807857,34.2478065122119],[70.4231199673087,34.2586858580407],[70.4220056215894,34.27],[70.4231199673087,34.2813141419593],[70.4264201807857,34.2921934877881],[70.4317794366672,34.3022199503274],[70.4389917817551,34.3110082182449],[70.4477800496726,34.3182205633328],[70.4578065122119,34.3235798192143],[70.4686858580408,34.3268800326913],[70.48,34.3279943784106],[70.4913141419593,34.3268800326913],[70.5021934877881,34.3235798192143],[70.5122199503274,34.3182205633328],[70.5210082182448,34.3110082182449],[70.5282205633328,34.3022199503274],[70.5335798192143,34.2921934877881],[70.5368800326913,34.2813141419593],[70.5379943784106,34.27]]]}},{"properties":{"occupation":"Journalist","home_town":"Unclear","month":8,"latitude":34.55,"suspected_attacker":"Unknown","unique_id":6,"date":{"end_time":"2002/08/29 00:00:00 -0400","original":"8/28/2002","granularity":"day","time":"2002/08/28 00:00:00 -0400"},"investigation_result":null,"gender":"Male","incident_reason":"Unclear","day":28,"incident_province":"Kabul","incident_type":"Killed","year":2002,"longitude":69.33,"organization":"Freelance","id":"5","incident_town":"Unclear","incident_district":"Unclear","age":null,"home_province":"New Zealand","notes_other_details":null},"type":"Feature","geometry":{"type":"Polygon","coordinates":[[[69.3879943784106,34.55],[69.3868800326913,34.5386858580407],[69.3835798192143,34.5278065122119],[69.3782205633328,34.5177800496726],[69.3710082182449,34.5089917817551],[69.3622199503274,34.5017794366672],[69.3521934877881,34.4964201807857],[69.3413141419592,34.4931199673087],[69.33,34.4920056215894],[69.3186858580408,34.4931199673087],[69.3078065122119,34.4964201807857],[69.2977800496726,34.5017794366672],[69.2889917817552,34.5089917817551],[69.2817794366672,34.5177800496726],[69.2764201807857,34.5278065122119],[69.2731199673087,34.5386858580407],[69.2720056215894,34.55],[69.2731199673087,34.5613141419593],[69.2764201807857,34.5721934877881],[69.2817794366672,34.5822199503274],[69.2889917817551,34.5910082182448],[69.2977800496726,34.5982205633328],[69.3078065122119,34.6035798192143],[69.3186858580408,34.6068800326913],[69.33,34.6079943784106],[69.3413141419592,34.6068800326913],[69.3521934877881,34.6035798192143],[69.3622199503274,34.5982205633328],[69.3710082182448,34.5910082182448],[69.3782205633328,34.5822199503274],[69.3835798192143,34.5721934877881],[69.3868800326913,34.5613141419593],[69.3879943784106,34.55]]]}},{"properties":{"occupation":"Journalist","home_town":"Kabul","month":8,"latitude":34.55,"suspected_attacker":"Unknown","unique_id":7,"date":{"end_time":"2004/08/04 00:00:00 -0400","original":"8/3/2004","granularity":"day","time":"2004/08/03 00:00:00 -0400"},"investigation_result":null,"gender":"Male","incident_reason":"Reporting","day":3,"incident_province":"Kabul","incident_type":"Threatened","year":2004,"longitude":69.33,"organization":"Salam Watandar","id":"6","incident_town":"Kabul","incident_district":"Kabul","age":null,"home_province":"Kabul","notes_other_details":null},"type":"Feature","geometry":{"type":"Polygon","coordinates":[[[69.3879943784106,34.55],[69.3868800326913,34.5386858580407],[69.3835798192143,34.5278065122119],[69.3782205633328,34.5177800496726],[69.3710082182449,34.5089917817551],[69.3622199503274,34.5017794366672],[69.3521934877881,34.4964201807857],[69.3413141419592,34.4931199673087],[69.33,34.4920056215894],[69.3186858580408,34.4931199673087],[69.3078065122119,34.4964201807857],[69.2977800496726,34.5017794366672],[69.2889917817552,34.5089917817551],[69.2817794366672,34.5177800496726],[69.2764201807857,34.5278065122119],[69.2731199673087,34.5386858580407],[69.2720056215894,34.55],[69.2731199673087,34.5613141419593],[69.2764201807857,34.5721934877881],[69.2817794366672,34.5822199503274],[69.2889917817551,34.5910082182448],[69.2977800496726,34.5982205633328],[69.3078065122119,34.6035798192143],[69.3186858580408,34.6068800326913],[69.33,34.6079943784106],[69.3413141419592,34.6068800326913],[69.3521934877881,34.6035798192143],[69.3622199503274,34.5982205633328],[69.3710082182448,34.5910082182448],[69.3782205633328,34.5822199503274],[69.3835798192143,34.5721934877881],[69.3868800326913,34.5613141419593],[69.3879943784106,34.55]]]}},{"properties":{"occupation":"Journalist","home_town":"Taluqan","month":5,"latitude":36.7,"suspected_attacker":"Unknown","unique_id":8,"date":{"end_time":"2005/05/05 00:00:00 -0400","original":"5/4/2005","granularity":"day","time":"2005/05/04 00:00:00 -0400"},"investigation_result":null,"gender":"Male","incident_reason":"Reporting","day":4,"incident_province":"Takhar","incident_type":"Threatened","year":2005,"longitude":69.78,"organization":"Tkharestan FM","id":"7","incident_town":"Taluqan City","incident_district":"Taluqan City","age":null,"home_province":"Takhar","notes_other_details":null},"type":"Feature","geometry":{"type":"Polygon","coordinates":[[[69.8379943784106,36.7],[69.8368800326913,36.6886858580407],[69.8335798192143,36.6778065122119],[69.8282205633328,36.6677800496726],[69.8210082182449,36.6589917817552],[69.8122199503274,36.6517794366672],[69.8021934877881,36.6464201807857],[69.7913141419592,36.6431199673087],[69.78,36.6420056215894],[69.7686858580408,36.6431199673087],[69.7578065122119,36.6464201807857],[69.7477800496726,36.6517794366672],[69.7389917817552,36.6589917817552],[69.7317794366672,36.6677800496726],[69.7264201807857,36.6778065122119],[69.7231199673087,36.6886858580407],[69.7220056215894,36.7],[69.7231199673087,36.7113141419593],[69.7264201807857,36.7221934877881],[69.7317794366672,36.7322199503274],[69.7389917817551,36.7410082182449],[69.7477800496726,36.7482205633328],[69.7578065122119,36.7535798192143],[69.7686858580408,36.7568800326913],[69.78,36.7579943784106],[69.7913141419592,36.7568800326913],[69.8021934877881,36.7535798192143],[69.8122199503274,36.7482205633328],[69.8210082182448,36.7410082182449],[69.8282205633328,36.7322199503274],[69.8335798192143,36.7221934877881],[69.8368800326913,36.7113141419593],[69.8379943784106,36.7]]]}},{"properties":{"occupation":"Journalist","home_town":"Sheberghan","month":5,"latitude":36.83,"suspected_attacker":"Unknown","unique_id":9,"date":{"end_time":"2005/05/05 00:00:00 -0400","original":"5/4/2005","granularity":"day","time":"2005/05/04 00:00:00 -0400"},"investigation_result":null,"gender":"Male","incident_reason":"Reporting","day":4,"incident_province":"Jawzjan","incident_type":"Beaten","year":2005,"longitude":65.85,"organization":"Aina TV","id":"8","incident_town":"Shberghan","incident_district":"Shberghan","age":null,"home_province":"Jawzjan","notes_other_details":null},"type":"Feature","geometry":{"type":"Polygon","coordinates":[[[65.9079943784106,36.83],[65.9068800326913,36.8186858580407],[65.9035798192143,36.8078065122119],[65.8982205633328,36.7977800496726],[65.8910082182448,36.7889917817552],[65.8822199503274,36.7817794366672],[65.8721934877881,36.7764201807857],[65.8613141419592,36.7731199673087],[65.85,36.7720056215894],[65.8386858580407,36.7731199673087],[65.8278065122119,36.7764201807857],[65.8177800496726,36.7817794366672],[65.8089917817552,36.7889917817552],[65.8017794366672,36.7977800496726],[65.7964201807857,36.8078065122119],[65.7931199673087,36.8186858580407],[65.7920056215894,36.83],[65.7931199673087,36.8413141419593],[65.7964201807857,36.8521934877881],[65.8017794366672,36.8622199503274],[65.8089917817551,36.8710082182448],[65.8177800496726,36.8782205633328],[65.8278065122119,36.8835798192143],[65.8386858580407,36.8868800326913],[65.85,36.8879943784106],[65.8613141419592,36.8868800326913],[65.8721934877881,36.8835798192143],[65.8822199503274,36.8782205633328],[65.8910082182448,36.8710082182448],[65.8982205633328,36.8622199503274],[65.9035798192143,36.8521934877881],[65.9068800326913,36.8413141419593],[65.9079943784106,36.83]]]}},{"properties":{"occupation":"TV Presenter","home_town":"Kabul","month":4,"latitude":34.55,"suspected_attacker":"Unknown","unique_id":10,"date":{"end_time":"2005/04/19 00:00:00 -0400","original":"4/18/2005","granularity":"day","time":"2005/04/18 00:00:00 -0400"},"investigation_result":null,"gender":"Female","incident_reason":"Woman on TV","day":18,"incident_province":"Kabul","incident_type":"Killed","year":2005,"longitude":69.33,"organization":"Tolo TV","id":"9","incident_town":"Kabul","incident_district":"Kabul","age":null,"home_province":"Kabul","notes_other_details":null},"type":"Feature","geometry":{"type":"Polygon","coordinates":[[[69.3879943784106,34.55],[69.3868800326913,34.5386858580407],[69.3835798192143,34.5278065122119],[69.3782205633328,34.5177800496726],[69.3710082182449,34.5089917817551],[69.3622199503274,34.5017794366672],[69.3521934877881,34.4964201807857],[69.3413141419592,34.4931199673087],[69.33,34.4920056215894],[69.3186858580408,34.4931199673087],[69.3078065122119,34.4964201807857],[69.2977800496726,34.5017794366672],[69.2889917817552,34.5089917817551],[69.2817794366672,34.5177800496726],[69.2764201807857,34.5278065122119],[69.2731199673087,34.5386858580407],[69.2720056215894,34.55],[69.2731199673087,34.5613141419593],[69.2764201807857,34.5721934877881],[69.2817794366672,34.5822199503274],[69.2889917817551,34.5910082182448],[69.2977800496726,34.5982205633328],[69.3078065122119,34.6035798192143],[69.3186858580408,34.6068800326913],[69.33,34.6079943784106],[69.3413141419592,34.6068800326913],[69.3521934877881,34.6035798192143],[69.3622199503274,34.5982205633328],[69.3710082182448,34.5910082182448],[69.3782205633328,34.5822199503274],[69.3835798192143,34.5721934877881],[69.3868800326913,34.5613141419593],[69.3879943784106,34.55]]]}},{"properties":{"occupation":"TV Presenter","home_town":"Kabul","month":7,"latitude":34.55,"suspected_attacker":"Government","unique_id":11,"date":{"end_time":"2005/07/04 00:00:00 -0400","original":"7/3/2005","granularity":"day","time":"2005/07/03 00:00:00 -0400"},"investigation_result":null,"gender":"Male","incident_reason":"Seen on TV in new style","day":3,"incident_province":"Kabul","incident_type":"Beaten","year":2005,"longitude":69.33,"organization":"Tolo TV","id":"10","incident_town":"Kabul City","incident_district":"Kabul City","age":null,"home_province":"Kabul","notes_other_details":null},"type":"Feature","geometry":{"type":"Polygon","coordinates":[[[69.3879943784106,34.55],[69.3868800326913,34.5386858580407],[69.3835798192143,34.5278065122119],[69.3782205633328,34.5177800496726],[69.3710082182449,34.5089917817551],[69.3622199503274,34.5017794366672],[69.3521934877881,34.4964201807857],[69.3413141419592,34.4931199673087],[69.33,34.4920056215894],[69.3186858580408,34.4931199673087],[69.3078065122119,34.4964201807857],[69.2977800496726,34.5017794366672],[69.2889917817552,34.5089917817551],[69.2817794366672,34.5177800496726],[69.2764201807857,34.5278065122119],[69.2731199673087,34.5386858580407],[69.2720056215894,34.55],[69.2731199673087,34.5613141419593],[69.2764201807857,34.5721934877881],[69.2817794366672,34.5822199503274],[69.2889917817551,34.5910082182448],[69.2977800496726,34.5982205633328],[69.3078065122119,34.6035798192143],[69.3186858580408,34.6068800326913],[69.33,34.6079943784106],[69.3413141419592,34.6068800326913],[69.3521934877881,34.6035798192143],[69.3622199503274,34.5982205633328],[69.3710082182448,34.5910082182448],[69.3782205633328,34.5822199503274],[69.3835798192143,34.5721934877881],[69.3868800326913,34.5613141419593],[69.3879943784106,34.55]]]}},{"properties":{"occupation":"Reporter","home_town":"Kabul","month":7,"latitude":34.55,"suspected_attacker":"Unknown","unique_id":12,"date":{"end_time":"2001/07/04 00:00:00 -0400","original":"7/3/2001","granularity":"day","time":"2001/07/03 00:00:00 -0400"},"investigation_result":null,"gender":"Male","incident_reason":"Publishing an article","day":3,"incident_province":"Kabul","incident_type":"Beaten","year":2001,"longitude":69.33,"organization":"Aftab Weekly","id":"11","incident_town":"Kabul City","incident_district":"Kabul City","age":null,"home_province":"Kabul","notes_other_details":null},"type":"Feature","geometry":{"type":"Polygon","coordinates":[[[69.3879943784106,34.55],[69.3868800326913,34.5386858580407],[69.3835798192143,34.5278065122119],[69.3782205633328,34.5177800496726],[69.3710082182449,34.5089917817551],[69.3622199503274,34.5017794366672],[69.3521934877881,34.4964201807857],[69.3413141419592,34.4931199673087],[69.33,34.4920056215894],[69.3186858580408,34.4931199673087],[69.3078065122119,34.4964201807857],[69.2977800496726,34.5017794366672],[69.2889917817552,34.5089917817551],[69.2817794366672,34.5177800496726],[69.2764201807857,34.5278065122119],[69.2731199673087,34.5386858580407],[69.2720056215894,34.55],[69.2731199673087,34.5613141419593],[69.2764201807857,34.5721934877881],[69.2817794366672,34.5822199503274],[69.2889917817551,34.5910082182448],[69.2977800496726,34.5982205633328],[69.3078065122119,34.6035798192143],[69.3186858580408,34.6068800326913],[69.33,34.6079943784106],[69.3413141419592,34.6068800326913],[69.3521934877881,34.6035798192143],[69.3622199503274,34.5982205633328],[69.3710082182448,34.5910082182448],[69.3782205633328,34.5822199503274],[69.3835798192143,34.5721934877881],[69.3868800326913,34.5613141419593],[69.3879943784106,34.55]]]}},{"properties":{"occupation":"Reporter","home_town":"Kabul","month":7,"latitude":34.55,"suspected_attacker":"Government","unique_id":13,"date":{"end_time":"2005/07/04 00:00:00 -0400","original":"7/3/2005","granularity":"day","time":"2005/07/03 00:00:00 -0400"},"investigation_result":null,"gender":"Male","incident_reason":"Reporting","day":3,"incident_province":"Kabul","incident_type":"Threatened","year":2005,"longitude":69.33,"organization":"Pajhwok","id":"12","incident_town":"Kabul","incident_district":"Kabul","age":null,"home_province":"Kabul","notes_other_details":null},"type":"Feature","geometry":{"type":"Polygon","coordinates":[[[69.3879943784106,34.55],[69.3868800326913,34.5386858580407],[69.3835798192143,34.5278065122119],[69.3782205633328,34.5177800496726],[69.3710082182449,34.5089917817551],[69.3622199503274,34.5017794366672],[69.3521934877881,34.4964201807857],[69.3413141419592,34.4931199673087],[69.33,34.4920056215894],[69.3186858580408,34.4931199673087],[69.3078065122119,34.4964201807857],[69.2977800496726,34.5017794366672],[69.2889917817552,34.5089917817551],[69.2817794366672,34.5177800496726],[69.2764201807857,34.5278065122119],[69.2731199673087,34.5386858580407],[69.2720056215894,34.55],[69.2731199673087,34.5613141419593],[69.2764201807857,34.5721934877881],[69.2817794366672,34.5822199503274],[69.2889917817551,34.5910082182448],[69.2977800496726,34.5982205633328],[69.3078065122119,34.6035798192143],[69.3186858580408,34.6068800326913],[69.33,34.6079943784106],[69.3413141419592,34.6068800326913],[69.3521934877881,34.6035798192143],[69.3622199503274,34.5982205633328],[69.3710082182448,34.5910082182448],[69.3782205633328,34.5822199503274],[69.3835798192143,34.5721934877881],[69.3868800326913,34.5613141419593],[69.3879943784106,34.55]]]}},{"properties":{"occupation":"Reporter","home_town":"Kabul","month":7,"latitude":34.55,"suspected_attacker":"Government","unique_id":14,"date":{"end_time":"2005/07/06 00:00:00 -0400","original":"7/5/2005","granularity":"day","time":"2005/07/05 00:00:00 -0400"},"investigation_result":null,"gender":"Male","incident_reason":"Reporting","day":5,"incident_province":"Kabul","incident_type":"Threatened","year":2005,"longitude":69.33,"organization":"Pajhwok","id":"13","incident_town":"Kabul City","incident_district":"Kabul City","age":null,"home_province":"Kabul","notes_other_details":null},"type":"Feature","geometry":{"type":"Polygon","coordinates":[[[69.3879943784106,34.55],[69.3868800326913,34.5386858580407],[69.3835798192143,34.5278065122119],[69.3782205633328,34.5177800496726],[69.3710082182449,34.5089917817551],[69.3622199503274,34.5017794366672],[69.3521934877881,34.4964201807857],[69.3413141419592,34.4931199673087],[69.33,34.4920056215894],[69.3186858580408,34.4931199673087],[69.3078065122119,34.4964201807857],[69.2977800496726,34.5017794366672],[69.2889917817552,34.5089917817551],[69.2817794366672,34.5177800496726],[69.2764201807857,34.5278065122119],[69.2731199673087,34.5386858580407],[69.2720056215894,34.55],[69.2731199673087,34.5613141419593],[69.2764201807857,34.5721934877881],[69.2817794366672,34.5822199503274],[69.2889917817551,34.5910082182448],[69.2977800496726,34.5982205633328],[69.3078065122119,34.6035798192143],[69.3186858580408,34.6068800326913],[69.33,34.6079943784106],[69.3413141419592,34.6068800326913],[69.3521934877881,34.6035798192143],[69.3622199503274,34.5982205633328],[69.3710082182448,34.5910082182448],[69.3782205633328,34.5822199503274],[69.3835798192143,34.5721934877881],[69.3868800326913,34.5613141419593],[69.3879943784106,34.55]]]}},{"properties":{"occupation":"Journalist","home_town":"Kabul","month":7,"latitude":34.55,"suspected_attacker":"Government","unique_id":15,"date":{"end_time":"2005/07/14 00:00:00 -0400","original":"7/13/2005","granularity":"day","time":"2005/07/13 00:00:00 -0400"},"investigation_result":null,"gender":"Male","incident_reason":"Reporting","day":13,"incident_province":"Kabul","incident_type":"Beaten","year":2005,"longitude":69.33,"organization":"Chye dagh Weekly","id":"14","incident_town":"Kabul City","incident_district":"Kabul City","age":null,"home_province":"Kabul","notes_other_details":null},"type":"Feature","geometry":{"type":"Polygon","coordinates":[[[69.3879943784106,34.55],[69.3868800326913,34.5386858580407],[69.3835798192143,34.5278065122119],[69.3782205633328,34.5177800496726],[69.3710082182449,34.5089917817551],[69.3622199503274,34.5017794366672],[69.3521934877881,34.4964201807857],[69.3413141419592,34.4931199673087],[69.33,34.4920056215894],[69.3186858580408,34.4931199673087],[69.3078065122119,34.4964201807857],[69.2977800496726,34.5017794366672],[69.2889917817552,34.5089917817551],[69.2817794366672,34.5177800496726],[69.2764201807857,34.5278065122119],[69.2731199673087,34.5386858580407],[69.2720056215894,34.55],[69.2731199673087,34.5613141419593],[69.2764201807857,34.5721934877881],[69.2817794366672,34.5822199503274],[69.2889917817551,34.5910082182448],[69.2977800496726,34.5982205633328],[69.3078065122119,34.6035798192143],[69.3186858580408,34.6068800326913],[69.33,34.6079943784106],[69.3413141419592,34.6068800326913],[69.3521934877881,34.6035798192143],[69.3622199503274,34.5982205633328],[69.3710082182448,34.5910082182448],[69.3782205633328,34.5822199503274],[69.3835798192143,34.5721934877881],[69.3868800326913,34.5613141419593],[69.3879943784106,34.55]]]}},{"properties":{"occupation":"Journalist","home_town":"Kabul","month":9,"latitude":34.55,"suspected_attacker":"Government","unique_id":16,"date":{"end_time":"2005/09/09 00:00:00 -0400","original":"9/8/2005","granularity":"day","time":"2005/09/08 00:00:00 -0400"},"investigation_result":null,"gender":"Male","incident_reason":"Reporting","day":8,"incident_province":"Kabul","incident_type":"Beaten","year":2005,"longitude":69.33,"organization":"Sadaye afghan news agency","id":"15","incident_town":"Kabul City","incident_district":"Kabul City","age":null,"home_province":"Kabul","notes_other_details":null},"type":"Feature","geometry":{"type":"Polygon","coordinates":[[[69.3879943784106,34.55],[69.3868800326913,34.5386858580407],[69.3835798192143,34.5278065122119],[69.3782205633328,34.5177800496726],[69.3710082182449,34.5089917817551],[69.3622199503274,34.5017794366672],[69.3521934877881,34.4964201807857],[69.3413141419592,34.4931199673087],[69.33,34.4920056215894],[69.3186858580408,34.4931199673087],[69.3078065122119,34.4964201807857],[69.2977800496726,34.5017794366672],[69.2889917817552,34.5089917817551],[69.2817794366672,34.5177800496726],[69.2764201807857,34.5278065122119],[69.2731199673087,34.5386858580407],[69.2720056215894,34.55],[69.2731199673087,34.5613141419593],[69.2764201807857,34.5721934877881],[69.2817794366672,34.5822199503274],[69.2889917817551,34.5910082182448],[69.2977800496726,34.5982205633328],[69.3078065122119,34.6035798192143],[69.3186858580408,34.6068800326913],[69.33,34.6079943784106],[69.3413141419592,34.6068800326913],[69.3521934877881,34.6035798192143],[69.3622199503274,34.5982205633328],[69.3710082182448,34.5910082182448],[69.3782205633328,34.5822199503274],[69.3835798192143,34.5721934877881],[69.3868800326913,34.5613141419593],[69.3879943784106,34.55]]]}},{"properties":{"occupation":"Journalist","home_town":"Kabul","month":9,"latitude":34.55,"suspected_attacker":"Government","unique_id":17,"date":{"end_time":"2005/09/09 00:00:00 -0400","original":"9/8/2005","granularity":"day","time":"2005/09/08 00:00:00 -0400"},"investigation_result":null,"gender":"Male","incident_reason":"Reporting","day":8,"incident_province":"Kabul","incident_type":"Beaten","year":2005,"longitude":69.33,"organization":"Sadaye afghan news agency","id":"16","incident_town":"Kabul City","incident_district":"Kabul City","age":null,"home_province":"Kabul","notes_other_details":null},"type":"Feature","geometry":{"type":"Polygon","coordinates":[[[69.3879943784106,34.55],[69.3868800326913,34.5386858580407],[69.3835798192143,34.5278065122119],[69.3782205633328,34.5177800496726],[69.3710082182449,34.5089917817551],[69.3622199503274,34.5017794366672],[69.3521934877881,34.4964201807857],[69.3413141419592,34.4931199673087],[69.33,34.4920056215894],[69.3186858580408,34.4931199673087],[69.3078065122119,34.4964201807857],[69.2977800496726,34.5017794366672],[69.2889917817552,34.5089917817551],[69.2817794366672,34.5177800496726],[69.2764201807857,34.5278065122119],[69.2731199673087,34.5386858580407],[69.2720056215894,34.55],[69.2731199673087,34.5613141419593],[69.2764201807857,34.5721934877881],[69.2817794366672,34.5822199503274],[69.2889917817551,34.5910082182448],[69.2977800496726,34.5982205633328],[69.3078065122119,34.6035798192143],[69.3186858580408,34.6068800326913],[69.33,34.6079943784106],[69.3413141419592,34.6068800326913],[69.3521934877881,34.6035798192143],[69.3622199503274,34.5982205633328],[69.3710082182448,34.5910082182448],[69.3782205633328,34.5822199503274],[69.3835798192143,34.5721934877881],[69.3868800326913,34.5613141419593],[69.3879943784106,34.55]]]}},{"properties":{"occupation":"Journalist","home_town":"Kabul","month":9,"latitude":35.42,"suspected_attacker":"un known armed men","unique_id":18,"date":{"end_time":"2005/09/15 00:00:00 -0400","original":"9/14/2005","granularity":"day","time":"2005/09/14 00:00:00 -0400"},"investigation_result":null,"gender":"Male","incident_reason":"Reporting","day":14,"incident_province":"Nuristan","incident_type":"Kidnapped","year":2005,"longitude":70.79,"organization":"Bamiyan Weekly","id":"17","incident_town":"Waigal District","incident_district":"Waigal District","age":null,"home_province":"Kabul","notes_other_details":null},"type":"Feature","geometry":{"type":"Polygon","coordinates":[[[70.8479943784106,35.42],[70.8468800326913,35.4086858580407],[70.8435798192143,35.3978065122119],[70.8382205633328,35.3877800496726],[70.8310082182449,35.3789917817552],[70.8222199503274,35.3717794366672],[70.8121934877881,35.3664201807857],[70.8013141419593,35.3631199673087],[70.79,35.3620056215894],[70.7786858580408,35.3631199673087],[70.7678065122119,35.3664201807857],[70.7577800496726,35.3717794366672],[70.7489917817552,35.3789917817552],[70.7417794366672,35.3877800496726],[70.7364201807857,35.3978065122119],[70.7331199673087,35.4086858580407],[70.7320056215894,35.42],[70.7331199673087,35.4313141419593],[70.7364201807857,35.4421934877881],[70.7417794366672,35.4522199503274],[70.7489917817552,35.4610082182448],[70.7577800496726,35.4682205633328],[70.7678065122119,35.4735798192143],[70.7786858580408,35.4768800326913],[70.79,35.4779943784106],[70.8013141419593,35.4768800326913],[70.8121934877881,35.4735798192143],[70.8222199503274,35.4682205633328],[70.8310082182448,35.4610082182448],[70.8382205633328,35.4522199503274],[70.8435798192143,35.4421934877881],[70.8468800326913,35.4313141419593],[70.8479943784106,35.42]]]}},{"properties":{"occupation":"Journalist","home_town":"Kabul","month":7,"latitude":34.55,"suspected_attacker":"Government","unique_id":19,"date":{"end_time":"2005/07/15 00:00:00 -0400","original":"7/14/2005","granularity":"day","time":"2005/07/14 00:00:00 -0400"},"investigation_result":null,"gender":"Male","incident_reason":"Reporting","day":14,"incident_province":"Kabul","incident_type":"Beaten","year":2005,"longitude":69.33,"organization":"Aina TV","id":"18","incident_town":"Kabul City","incident_district":"Kabul City","age":null,"home_province":"Kabul","notes_other_details":null},"type":"Feature","geometry":{"type":"Polygon","coordinates":[[[69.3879943784106,34.55],[69.3868800326913,34.5386858580407],[69.3835798192143,34.5278065122119],[69.3782205633328,34.5177800496726],[69.3710082182449,34.5089917817551],[69.3622199503274,34.5017794366672],[69.3521934877881,34.4964201807857],[69.3413141419592,34.4931199673087],[69.33,34.4920056215894],[69.3186858580408,34.4931199673087],[69.3078065122119,34.4964201807857],[69.2977800496726,34.5017794366672],[69.2889917817552,34.5089917817551],[69.2817794366672,34.5177800496726],[69.2764201807857,34.5278065122119],[69.2731199673087,34.5386858580407],[69.2720056215894,34.55],[69.2731199673087,34.5613141419593],[69.2764201807857,34.5721934877881],[69.2817794366672,34.5822199503274],[69.2889917817551,34.5910082182448],[69.2977800496726,34.5982205633328],[69.3078065122119,34.6035798192143],[69.3186858580408,34.6068800326913],[69.33,34.6079943784106],[69.3413141419592,34.6068800326913],[69.3521934877881,34.6035798192143],[69.3622199503274,34.5982205633328],[69.3710082182448,34.5910082182448],[69.3782205633328,34.5822199503274],[69.3835798192143,34.5721934877881],[69.3868800326913,34.5613141419593],[69.3879943784106,34.55]]]}},{"properties":{"occupation":"Journalist","home_town":"Kabul","month":7,"latitude":34.55,"suspected_attacker":"Government","unique_id":20,"date":{"end_time":"2005/07/15 00:00:00 -0400","original":"7/14/2005","granularity":"day","time":"2005/07/14 00:00:00 -0400"},"investigation_result":null,"gender":"Male","incident_reason":"Reporting","day":14,"incident_province":"Kabul","incident_type":"Beaten","year":2005,"longitude":69.33,"organization":"Aina TV","id":"19","incident_town":"Kabul City","incident_district":"Kabul City","age":null,"home_province":"Kabul","notes_other_details":null},"type":"Feature","geometry":{"type":"Polygon","coordinates":[[[69.3879943784106,34.55],[69.3868800326913,34.5386858580407],[69.3835798192143,34.5278065122119],[69.3782205633328,34.5177800496726],[69.3710082182449,34.5089917817551],[69.3622199503274,34.5017794366672],[69.3521934877881,34.4964201807857],[69.3413141419592,34.4931199673087],[69.33,34.4920056215894],[69.3186858580408,34.4931199673087],[69.3078065122119,34.4964201807857],[69.2977800496726,34.5017794366672],[69.2889917817552,34.5089917817551],[69.2817794366672,34.5177800496726],[69.2764201807857,34.5278065122119],[69.2731199673087,34.5386858580407],[69.2720056215894,34.55],[69.2731199673087,34.5613141419593],[69.2764201807857,34.5721934877881],[69.2817794366672,34.5822199503274],[69.2889917817551,34.5910082182448],[69.2977800496726,34.5982205633328],[69.3078065122119,34.6035798192143],[69.3186858580408,34.6068800326913],[69.33,34.6079943784106],[69.3413141419592,34.6068800326913],[69.3521934877881,34.6035798192143],[69.3622199503274,34.5982205633328],[69.3710082182448,34.5910082182448],[69.3782205633328,34.5822199503274],[69.3835798192143,34.5721934877881],[69.3868800326913,34.5613141419593],[69.3879943784106,34.55]]]}},{"properties":{"occupation":"Journalist","home_town":"Kabul","month":10,"latitude":34.55,"suspected_attacker":"Government","unique_id":21,"date":{"end_time":"2005/10/02 00:00:00 -0400","original":"10/1/2005","granularity":"day","time":"2005/10/01 00:00:00 -0400"},"investigation_result":null,"gender":"Male","incident_reason":"Publishing an article about apostasy","day":1,"incident_province":"Kabul","incident_type":"Arrested","year":2005,"longitude":69.33,"organization":"Women's Rights Magazine","id":"20","incident_town":"Kabul City","incident_district":"Kabul City","age":null,"home_province":"Kabul","notes_other_details":null},"type":"Feature","geometry":{"type":"Polygon","coordinates":[[[69.3879943784106,34.55],[69.3868800326913,34.5386858580407],[69.3835798192143,34.5278065122119],[69.3782205633328,34.5177800496726],[69.3710082182449,34.5089917817551],[69.3622199503274,34.5017794366672],[69.3521934877881,34.4964201807857],[69.3413141419592,34.4931199673087],[69.33,34.4920056215894],[69.3186858580408,34.4931199673087],[69.3078065122119,34.4964201807857],[69.2977800496726,34.5017794366672],[69.2889917817552,34.5089917817551],[69.2817794366672,34.5177800496726],[69.2764201807857,34.5278065122119],[69.2731199673087,34.5386858580407],[69.2720056215894,34.55],[69.2731199673087,34.5613141419593],[69.2764201807857,34.5721934877881],[69.2817794366672,34.5822199503274],[69.2889917817551,34.5910082182448],[69.2977800496726,34.5982205633328],[69.3078065122119,34.6035798192143],[69.3186858580408,34.6068800326913],[69.33,34.6079943784106],[69.3413141419592,34.6068800326913],[69.3521934877881,34.6035798192143],[69.3622199503274,34.5982205633328],[69.3710082182448,34.5910082182448],[69.3782205633328,34.5822199503274],[69.3835798192143,34.5721934877881],[69.3868800326913,34.5613141419593],[69.3879943784106,34.55]]]}},{"properties":{"occupation":"Journalist","home_town":"Khost City","month":11,"latitude":33.38,"suspected_attacker":null,"unique_id":22,"date":{"end_time":"2005/12/01 00:00:00 -0500","original":"11/30/2005","granularity":"day","time":"2005/11/30 00:00:00 -0500"},"investigation_result":null,"gender":"Male","incident_reason":"Roadside bomb near army base","day":30,"incident_province":"Khost","incident_type":"Killed","year":2005,"longitude":69.83,"organization":"Soli Paygham Radio","id":"21","incident_town":"Haidar Khil District","incident_district":"Haidar Khil District","age":null,"home_province":"Khost","notes_other_details":null},"type":"Feature","geometry":{"type":"Polygon","coordinates":[[[69.8879943784106,33.38],[69.8868800326913,33.3686858580407],[69.8835798192143,33.3578065122119],[69.8782205633328,33.3477800496726],[69.8710082182449,33.3389917817552],[69.8622199503274,33.3317794366672],[69.8521934877881,33.3264201807857],[69.8413141419592,33.3231199673087],[69.83,33.3220056215894],[69.8186858580408,33.3231199673087],[69.8078065122119,33.3264201807857],[69.7977800496726,33.3317794366672],[69.7889917817552,33.3389917817552],[69.7817794366672,33.3477800496726],[69.7764201807857,33.3578065122119],[69.7731199673087,33.3686858580407],[69.7720056215894,33.38],[69.7731199673087,33.3913141419593],[69.7764201807857,33.4021934877881],[69.7817794366672,33.4122199503274],[69.7889917817551,33.4210082182449],[69.7977800496726,33.4282205633328],[69.8078065122119,33.4335798192143],[69.8186858580408,33.4368800326913],[69.83,33.4379943784106],[69.8413141419592,33.4368800326913],[69.8521934877881,33.4335798192143],[69.8622199503274,33.4282205633328],[69.8710082182448,33.4210082182449],[69.8782205633328,33.4122199503274],[69.8835798192143,33.4021934877881],[69.8868800326913,33.3913141419593],[69.8879943784106,33.38]]]}},{"properties":{"occupation":"Journalist","home_town":"Unclear","month":11,"latitude":35.8,"suspected_attacker":"Baghlan police comonder","unique_id":23,"date":{"end_time":"2005/12/01 00:00:00 -0500","original":"11/30/2005","granularity":"day","time":"2005/11/30 00:00:00 -0500"},"investigation_result":null,"gender":"Male","incident_reason":"Asking question from Baghlan police commander about a bomb blast","day":30,"incident_province":"Baghlan","incident_type":"Threatened","year":2005,"longitude":68.91,"organization":"Pajhwok","id":"22","incident_town":"Pol-e-Khomri City","incident_district":"Pol-e-Khomri City","age":null,"home_province":"Panjshir","notes_other_details":null},"type":"Feature","geometry":{"type":"Polygon","coordinates":[[[68.9679943784106,35.8],[68.9668800326913,35.7886858580407],[68.9635798192143,35.7778065122119],[68.9582205633328,35.7677800496726],[68.9510082182449,35.7589917817551],[68.9422199503274,35.7517794366672],[68.9321934877881,35.7464201807857],[68.9213141419592,35.7431199673087],[68.91,35.7420056215894],[68.8986858580407,35.7431199673087],[68.8878065122119,35.7464201807857],[68.8777800496726,35.7517794366672],[68.8689917817552,35.7589917817551],[68.8617794366672,35.7677800496726],[68.8564201807857,35.7778065122119],[68.8531199673087,35.7886858580407],[68.8520056215894,35.8],[68.8531199673087,35.8113141419593],[68.8564201807857,35.8221934877881],[68.8617794366672,35.8322199503274],[68.8689917817551,35.8410082182448],[68.8777800496726,35.8482205633328],[68.8878065122119,35.8535798192143],[68.8986858580407,35.8568800326913],[68.91,35.8579943784106],[68.9213141419592,35.8568800326913],[68.9321934877881,35.8535798192143],[68.9422199503274,35.8482205633328],[68.9510082182448,35.8410082182448],[68.9582205633328,35.8322199503274],[68.9635798192143,35.8221934877881],[68.9668800326913,35.8113141419593],[68.9679943784106,35.8]]]}},{"properties":{"occupation":"Journalist","home_town":"Kabul City","month":12,"latitude":34.55,"suspected_attacker":"Police","unique_id":24,"date":{"end_time":"2005/12/13 00:00:00 -0500","original":"12/12/2005","granularity":"day","time":"2005/12/12 00:00:00 -0500"},"investigation_result":null,"gender":"Male","incident_reason":"Reporting from demonstration","day":12,"incident_province":"Kabul","incident_type":"Beaten","year":2005,"longitude":69.33,"organization":"Aryana TV","id":"23","incident_town":"Kabul City","incident_district":"Kabul City","age":null,"home_province":"Kabul","notes_other_details":null},"type":"Feature","geometry":{"type":"Polygon","coordinates":[[[69.3879943784106,34.55],[69.3868800326913,34.5386858580407],[69.3835798192143,34.5278065122119],[69.3782205633328,34.5177800496726],[69.3710082182449,34.5089917817551],[69.3622199503274,34.5017794366672],[69.3521934877881,34.4964201807857],[69.3413141419592,34.4931199673087],[69.33,34.4920056215894],[69.3186858580408,34.4931199673087],[69.3078065122119,34.4964201807857],[69.2977800496726,34.5017794366672],[69.2889917817552,34.5089917817551],[69.2817794366672,34.5177800496726],[69.2764201807857,34.5278065122119],[69.2731199673087,34.5386858580407],[69.2720056215894,34.55],[69.2731199673087,34.5613141419593],[69.2764201807857,34.5721934877881],[69.2817794366672,34.5822199503274],[69.2889917817551,34.5910082182448],[69.2977800496726,34.5982205633328],[69.3078065122119,34.6035798192143],[69.3186858580408,34.6068800326913],[69.33,34.6079943784106],[69.3413141419592,34.6068800326913],[69.3521934877881,34.6035798192143],[69.3622199503274,34.5982205633328],[69.3710082182448,34.5910082182448],[69.3782205633328,34.5822199503274],[69.3835798192143,34.5721934877881],[69.3868800326913,34.5613141419593],[69.3879943784106,34.55]]]}},{"properties":{"occupation":"Camera Man","home_town":"Kabul City","month":12,"latitude":34.55,"suspected_attacker":"Police","unique_id":25,"date":{"end_time":"2005/12/13 00:00:00 -0500","original":"12/12/2005","granularity":"day","time":"2005/12/12 00:00:00 -0500"},"investigation_result":null,"gender":"Male","incident_reason":"Reporting from demonstration","day":12,"incident_province":"Kabul","incident_type":"Beaten","year":2005,"longitude":69.33,"organization":"Aryana TV","id":"24","incident_town":"Kabul City","incident_district":"Kabul City","age":null,"home_province":"Kabul","notes_other_details":null},"type":"Feature","geometry":{"type":"Polygon","coordinates":[[[69.3879943784106,34.55],[69.3868800326913,34.5386858580407],[69.3835798192143,34.5278065122119],[69.3782205633328,34.5177800496726],[69.3710082182449,34.5089917817551],[69.3622199503274,34.5017794366672],[69.3521934877881,34.4964201807857],[69.3413141419592,34.4931199673087],[69.33,34.4920056215894],[69.3186858580408,34.4931199673087],[69.3078065122119,34.4964201807857],[69.2977800496726,34.5017794366672],[69.2889917817552,34.5089917817551],[69.2817794366672,34.5177800496726],[69.2764201807857,34.5278065122119],[69.2731199673087,34.5386858580407],[69.2720056215894,34.55],[69.2731199673087,34.5613141419593],[69.2764201807857,34.5721934877881],[69.2817794366672,34.5822199503274],[69.2889917817551,34.5910082182448],[69.2977800496726,34.5982205633328],[69.3078065122119,34.6035798192143],[69.3186858580408,34.6068800326913],[69.33,34.6079943784106],[69.3413141419592,34.6068800326913],[69.3521934877881,34.6035798192143],[69.3622199503274,34.5982205633328],[69.3710082182448,34.5910082182448],[69.3782205633328,34.5822199503274],[69.3835798192143,34.5721934877881],[69.3868800326913,34.5613141419593],[69.3879943784106,34.55]]]}},{"properties":{"occupation":"Journalist","home_town":"Kabul City","month":1,"latitude":34.55,"suspected_attacker":"CFC Coalition forces","unique_id":26,"date":{"end_time":"2006/01/02 00:00:00 -0500","original":"1/1/2006","granularity":"day","time":"2006/01/01 00:00:00 -0500"},"investigation_result":null,"gender":"Male","incident_reason":"Filming in the vicinity of Camp Eggers in Kabul","day":1,"incident_province":"Kabul","incident_type":"Arrested","year":2006,"longitude":69.33,"organization":"Al Jazeera","id":"25","incident_town":"Kabul City","incident_district":"Kabul City","age":null,"home_province":"Kabul","notes_other_details":null},"type":"Feature","geometry":{"type":"Polygon","coordinates":[[[69.3879943784106,34.55],[69.3868800326913,34.5386858580407],[69.3835798192143,34.5278065122119],[69.3782205633328,34.5177800496726],[69.3710082182449,34.5089917817551],[69.3622199503274,34.5017794366672],[69.3521934877881,34.4964201807857],[69.3413141419592,34.4931199673087],[69.33,34.4920056215894],[69.3186858580408,34.4931199673087],[69.3078065122119,34.4964201807857],[69.2977800496726,34.5017794366672],[69.2889917817552,34.5089917817551],[69.2817794366672,34.5177800496726],[69.2764201807857,34.5278065122119],[69.2731199673087,34.5386858580407],[69.2720056215894,34.55],[69.2731199673087,34.5613141419593],[69.2764201807857,34.5721934877881],[69.2817794366672,34.5822199503274],[69.2889917817551,34.5910082182448],[69.2977800496726,34.5982205633328],[69.3078065122119,34.6035798192143],[69.3186858580408,34.6068800326913],[69.33,34.6079943784106],[69.3413141419592,34.6068800326913],[69.3521934877881,34.6035798192143],[69.3622199503274,34.5982205633328],[69.3710082182448,34.5910082182448],[69.3782205633328,34.5822199503274],[69.3835798192143,34.5721934877881],[69.3868800326913,34.5613141419593],[69.3879943784106,34.55]]]}},{"properties":{"occupation":"Journalist","home_town":"Kabul City","month":1,"latitude":34.55,"suspected_attacker":"CFC Coalition forces","unique_id":27,"date":{"end_time":"2006/01/02 00:00:00 -0500","original":"1/1/2006","granularity":"day","time":"2006/01/01 00:00:00 -0500"},"investigation_result":null,"gender":"Male","incident_reason":"Filming in the vicinity of Camp Eggers in Kabul","day":1,"incident_province":"Kabul","incident_type":"Arrested","year":2006,"longitude":69.33,"organization":"Al Jazeera","id":"26","incident_town":"Kabul City","incident_district":"Kabul City","age":null,"home_province":"Kabul","notes_other_details":null},"type":"Feature","geometry":{"type":"Polygon","coordinates":[[[69.3879943784106,34.55],[69.3868800326913,34.5386858580407],[69.3835798192143,34.5278065122119],[69.3782205633328,34.5177800496726],[69.3710082182449,34.5089917817551],[69.3622199503274,34.5017794366672],[69.3521934877881,34.4964201807857],[69.3413141419592,34.4931199673087],[69.33,34.4920056215894],[69.3186858580408,34.4931199673087],[69.3078065122119,34.4964201807857],[69.2977800496726,34.5017794366672],[69.2889917817552,34.5089917817551],[69.2817794366672,34.5177800496726],[69.2764201807857,34.5278065122119],[69.2731199673087,34.5386858580407],[69.2720056215894,34.55],[69.2731199673087,34.5613141419593],[69.2764201807857,34.5721934877881],[69.2817794366672,34.5822199503274],[69.2889917817551,34.5910082182448],[69.2977800496726,34.5982205633328],[69.3078065122119,34.6035798192143],[69.3186858580408,34.6068800326913],[69.33,34.6079943784106],[69.3413141419592,34.6068800326913],[69.3521934877881,34.6035798192143],[69.3622199503274,34.5982205633328],[69.3710082182448,34.5910082182448],[69.3782205633328,34.5822199503274],[69.3835798192143,34.5721934877881],[69.3868800326913,34.5613141419593],[69.3879943784106,34.55]]]}},{"properties":{"occupation":"Journalist","home_town":"Kandahar City","month":1,"latitude":31.04,"suspected_attacker":"CFC Coalition forces","unique_id":28,"date":{"end_time":"2006/01/10 00:00:00 -0500","original":"1/9/2006","granularity":"day","time":"2006/01/09 00:00:00 -0500"},"investigation_result":null,"gender":"Male","incident_reason":"Unclear","day":9,"incident_province":"Kandahar","incident_type":"Arrested","year":2006,"longitude":65.71,"organization":"Narenj Magazine","id":"27","incident_town":"Kandahar","incident_district":"Kandahar","age":null,"home_province":"Kandahar","notes_other_details":null},"type":"Feature","geometry":{"type":"Polygon","coordinates":[[[65.7679943784106,31.04],[65.7668800326913,31.0286858580407],[65.7635798192143,31.0178065122119],[65.7582205633328,31.0077800496726],[65.7510082182448,30.9989917817552],[65.7422199503274,30.9917794366672],[65.7321934877881,30.9864201807857],[65.7213141419592,30.9831199673087],[65.71,30.9820056215894],[65.6986858580407,30.9831199673087],[65.6878065122119,30.9864201807857],[65.6777800496726,30.9917794366672],[65.6689917817552,30.9989917817552],[65.6617794366672,31.0077800496726],[65.6564201807857,31.0178065122119],[65.6531199673087,31.0286858580407],[65.6520056215894,31.04],[65.6531199673087,31.0513141419593],[65.6564201807857,31.0621934877881],[65.6617794366672,31.0722199503274],[65.6689917817551,31.0810082182448],[65.6777800496726,31.0882205633328],[65.6878065122119,31.0935798192143],[65.6986858580407,31.0968800326913],[65.71,31.0979943784106],[65.7213141419592,31.0968800326913],[65.7321934877881,31.0935798192143],[65.7422199503274,31.0882205633328],[65.7510082182448,31.0810082182448],[65.7582205633328,31.0722199503274],[65.7635798192143,31.0621934877881],[65.7668800326913,31.0513141419593],[65.7679943784106,31.04]]]}},{"properties":{"occupation":"Journalist","home_town":"Hirat City","month":2,"latitude":34.2,"suspected_attacker":"Police","unique_id":29,"date":{"end_time":"2006/02/10 00:00:00 -0500","original":"2/9/2006","granularity":"day","time":"2006/02/09 00:00:00 -0500"},"investigation_result":null,"gender":"Male","incident_reason":"Reporting from Shia and Sunni riot in Hirat","day":9,"incident_province":"Hirat","incident_type":"Beaten","year":2006,"longitude":62.13,"organization":"Tolo TV","id":"28","incident_town":"Hirat City","incident_district":"Hirat City","age":null,"home_province":"Hirat","notes_other_details":null},"type":"Feature","geometry":{"type":"Polygon","coordinates":[[[62.1879943784106,34.2],[62.1868800326913,34.1886858580407],[62.1835798192143,34.1778065122119],[62.1782205633328,34.1677800496726],[62.1710082182449,34.1589917817552],[62.1622199503274,34.1517794366672],[62.1521934877881,34.1464201807857],[62.1413141419593,34.1431199673087],[62.13,34.1420056215894],[62.1186858580407,34.1431199673087],[62.1078065122119,34.1464201807857],[62.0977800496726,34.1517794366672],[62.0889917817552,34.1589917817552],[62.0817794366672,34.1677800496726],[62.0764201807857,34.1778065122119],[62.0731199673087,34.1886858580407],[62.0720056215894,34.2],[62.0731199673087,34.2113141419593],[62.0764201807857,34.2221934877881],[62.0817794366672,34.2322199503274],[62.0889917817552,34.2410082182449],[62.0977800496726,34.2482205633328],[62.1078065122119,34.2535798192143],[62.1186858580407,34.2568800326913],[62.13,34.2579943784106],[62.1413141419593,34.2568800326913],[62.1521934877881,34.2535798192143],[62.1622199503274,34.2482205633328],[62.1710082182449,34.2410082182449],[62.1782205633328,34.2322199503274],[62.1835798192143,34.2221934877881],[62.1868800326913,34.2113141419593],[62.1879943784106,34.2]]]}},{"properties":{"occupation":"Journalist","home_town":"Hirat City","month":2,"latitude":34.2,"suspected_attacker":"Police","unique_id":30,"date":{"end_time":"2006/02/10 00:00:00 -0500","original":"2/9/2006","granularity":"day","time":"2006/02/09 00:00:00 -0500"},"investigation_result":null,"gender":"Male","incident_reason":"Reporting from Shia and Sunni riot in Hirat","day":9,"incident_province":"Hirat","incident_type":"Beaten","year":2006,"longitude":62.13,"organization":"Pajhwok","id":"29","incident_town":"Hirat City","incident_district":"Hirat City","age":null,"home_province":"Hirat","notes_other_details":null},"type":"Feature","geometry":{"type":"Polygon","coordinates":[[[62.1879943784106,34.2],[62.1868800326913,34.1886858580407],[62.1835798192143,34.1778065122119],[62.1782205633328,34.1677800496726],[62.1710082182449,34.1589917817552],[62.1622199503274,34.1517794366672],[62.1521934877881,34.1464201807857],[62.1413141419593,34.1431199673087],[62.13,34.1420056215894],[62.1186858580407,34.1431199673087],[62.1078065122119,34.1464201807857],[62.0977800496726,34.1517794366672],[62.0889917817552,34.1589917817552],[62.0817794366672,34.1677800496726],[62.0764201807857,34.1778065122119],[62.0731199673087,34.1886858580407],[62.0720056215894,34.2],[62.0731199673087,34.2113141419593],[62.0764201807857,34.2221934877881],[62.0817794366672,34.2322199503274],[62.0889917817552,34.2410082182449],[62.0977800496726,34.2482205633328],[62.1078065122119,34.2535798192143],[62.1186858580407,34.2568800326913],[62.13,34.2579943784106],[62.1413141419593,34.2568800326913],[62.1521934877881,34.2535798192143],[62.1622199503274,34.2482205633328],[62.1710082182449,34.2410082182449],[62.1782205633328,34.2322199503274],[62.1835798192143,34.2221934877881],[62.1868800326913,34.2113141419593],[62.1879943784106,34.2]]]}},{"properties":{"occupation":"Journalist","home_town":"Hirat City","month":2,"latitude":34.2,"suspected_attacker":"Police","unique_id":31,"date":{"end_time":"2006/02/10 00:00:00 -0500","original":"2/9/2006","granularity":"day","time":"2006/02/09 00:00:00 -0500"},"investigation_result":null,"gender":"Male","incident_reason":"Reporting from Shia and Sunni riot in Hirat","day":9,"incident_province":"Hirat","incident_type":"Threatened","year":2006,"longitude":62.13,"organization":"Radio Ashna","id":"30","incident_town":"Hirat City","incident_district":"Hirat City","age":null,"home_province":"Hirat","notes_other_details":null},"type":"Feature","geometry":{"type":"Polygon","coordinates":[[[62.1879943784106,34.2],[62.1868800326913,34.1886858580407],[62.1835798192143,34.1778065122119],[62.1782205633328,34.1677800496726],[62.1710082182449,34.1589917817552],[62.1622199503274,34.1517794366672],[62.1521934877881,34.1464201807857],[62.1413141419593,34.1431199673087],[62.13,34.1420056215894],[62.1186858580407,34.1431199673087],[62.1078065122119,34.1464201807857],[62.0977800496726,34.1517794366672],[62.0889917817552,34.1589917817552],[62.0817794366672,34.1677800496726],[62.0764201807857,34.1778065122119],[62.0731199673087,34.1886858580407],[62.0720056215894,34.2],[62.0731199673087,34.2113141419593],[62.0764201807857,34.2221934877881],[62.0817794366672,34.2322199503274],[62.0889917817552,34.2410082182449],[62.0977800496726,34.2482205633328],[62.1078065122119,34.2535798192143],[62.1186858580407,34.2568800326913],[62.13,34.2579943784106],[62.1413141419593,34.2568800326913],[62.1521934877881,34.2535798192143],[62.1622199503274,34.2482205633328],[62.1710082182449,34.2410082182449],[62.1782205633328,34.2322199503274],[62.1835798192143,34.2221934877881],[62.1868800326913,34.2113141419593],[62.1879943784106,34.2]]]}},{"properties":{"occupation":"Journalist","home_town":"Hirat City","month":2,"latitude":34.2,"suspected_attacker":"Police","unique_id":32,"date":{"end_time":"2006/02/10 00:00:00 -0500","original":"2/9/2006","granularity":"day","time":"2006/02/09 00:00:00 -0500"},"investigation_result":null,"gender":"Male","incident_reason":"Reporting from Shia and Sunni riot in Hirat","day":9,"incident_province":"Hirat","incident_type":"Beaten","year":2006,"longitude":62.13,"organization":"Azadi Radio","id":"31","incident_town":"Hirat City","incident_district":"Hirat City","age":null,"home_province":"Hirat","notes_other_details":null},"type":"Feature","geometry":{"type":"Polygon","coordinates":[[[62.1879943784106,34.2],[62.1868800326913,34.1886858580407],[62.1835798192143,34.1778065122119],[62.1782205633328,34.1677800496726],[62.1710082182449,34.1589917817552],[62.1622199503274,34.1517794366672],[62.1521934877881,34.1464201807857],[62.1413141419593,34.1431199673087],[62.13,34.1420056215894],[62.1186858580407,34.1431199673087],[62.1078065122119,34.1464201807857],[62.0977800496726,34.1517794366672],[62.0889917817552,34.1589917817552],[62.0817794366672,34.1677800496726],[62.0764201807857,34.1778065122119],[62.0731199673087,34.1886858580407],[62.0720056215894,34.2],[62.0731199673087,34.2113141419593],[62.0764201807857,34.2221934877881],[62.0817794366672,34.2322199503274],[62.0889917817552,34.2410082182449],[62.0977800496726,34.2482205633328],[62.1078065122119,34.2535798192143],[62.1186858580407,34.2568800326913],[62.13,34.2579943784106],[62.1413141419593,34.2568800326913],[62.1521934877881,34.2535798192143],[62.1622199503274,34.2482205633328],[62.1710082182449,34.2410082182449],[62.1782205633328,34.2322199503274],[62.1835798192143,34.2221934877881],[62.1868800326913,34.2113141419593],[62.1879943784106,34.2]]]}},{"properties":{"occupation":"Journalist","home_town":"Jabulsaraj District","month":2,"latitude":34.55,"suspected_attacker":"Government","unique_id":33,"date":{"end_time":"2011/02/07 00:00:00 -0500","original":"2/6/2011","granularity":"day","time":"2011/02/06 00:00:00 -0500"},"investigation_result":null,"gender":"Male","incident_reason":"To an attempted murder","day":null,"incident_province":"Kabul","incident_type":"Arrested","year":2006,"longitude":69.33,"organization":"Sadaye Sulh FM","id":"32","incident_town":"Kabul City","incident_district":"Kabul City","age":null,"home_province":"Parwan","notes_other_details":null},"type":"Feature","geometry":{"type":"Polygon","coordinates":[[[69.3879943784106,34.55],[69.3868800326913,34.5386858580407],[69.3835798192143,34.5278065122119],[69.3782205633328,34.5177800496726],[69.3710082182449,34.5089917817551],[69.3622199503274,34.5017794366672],[69.3521934877881,34.4964201807857],[69.3413141419592,34.4931199673087],[69.33,34.4920056215894],[69.3186858580408,34.4931199673087],[69.3078065122119,34.4964201807857],[69.2977800496726,34.5017794366672],[69.2889917817552,34.5089917817551],[69.2817794366672,34.5177800496726],[69.2764201807857,34.5278065122119],[69.2731199673087,34.5386858580407],[69.2720056215894,34.55],[69.2731199673087,34.5613141419593],[69.2764201807857,34.5721934877881],[69.2817794366672,34.5822199503274],[69.2889917817551,34.5910082182448],[69.2977800496726,34.5982205633328],[69.3078065122119,34.6035798192143],[69.3186858580408,34.6068800326913],[69.33,34.6079943784106],[69.3413141419592,34.6068800326913],[69.3521934877881,34.6035798192143],[69.3622199503274,34.5982205633328],[69.3710082182448,34.5910082182448],[69.3782205633328,34.5822199503274],[69.3835798192143,34.5721934877881],[69.3868800326913,34.5613141419593],[69.3879943784106,34.55]]]}},{"properties":{"occupation":"Journalist","home_town":"Kabul City","month":5,"latitude":34.55,"suspected_attacker":"member of parliament","unique_id":34,"date":{"end_time":"2006/05/10 00:00:00 -0400","original":"5/9/2006","granularity":"day","time":"2006/05/09 00:00:00 -0400"},"investigation_result":null,"gender":"Male","incident_reason":"Filming from Parliament","day":9,"incident_province":"Kabul","incident_type":"Beaten","year":2006,"longitude":69.33,"organization":"Tolo TV","id":"33","incident_town":"Kabul City","incident_district":"Kabul City","age":null,"home_province":"Kabul","notes_other_details":null},"type":"Feature","geometry":{"type":"Polygon","coordinates":[[[69.3879943784106,34.55],[69.3868800326913,34.5386858580407],[69.3835798192143,34.5278065122119],[69.3782205633328,34.5177800496726],[69.3710082182449,34.5089917817551],[69.3622199503274,34.5017794366672],[69.3521934877881,34.4964201807857],[69.3413141419592,34.4931199673087],[69.33,34.4920056215894],[69.3186858580408,34.4931199673087],[69.3078065122119,34.4964201807857],[69.2977800496726,34.5017794366672],[69.2889917817552,34.5089917817551],[69.2817794366672,34.5177800496726],[69.2764201807857,34.5278065122119],[69.2731199673087,34.5386858580407],[69.2720056215894,34.55],[69.2731199673087,34.5613141419593],[69.2764201807857,34.5721934877881],[69.2817794366672,34.5822199503274],[69.2889917817551,34.5910082182448],[69.2977800496726,34.5982205633328],[69.3078065122119,34.6035798192143],[69.3186858580408,34.6068800326913],[69.33,34.6079943784106],[69.3413141419592,34.6068800326913],[69.3521934877881,34.6035798192143],[69.3622199503274,34.5982205633328],[69.3710082182448,34.5910082182448],[69.3782205633328,34.5822199503274],[69.3835798192143,34.5721934877881],[69.3868800326913,34.5613141419593],[69.3879943784106,34.55]]]}},{"properties":{"occupation":"Journalist","home_town":"Kabul City","month":5,"latitude":34.55,"suspected_attacker":"president security officers","unique_id":35,"date":{"end_time":"2006/05/28 00:00:00 -0400","original":"5/27/2006","granularity":"day","time":"2006/05/27 00:00:00 -0400"},"investigation_result":null,"gender":"Male","incident_reason":"On the way from office to Parliament","day":27,"incident_province":"Kabul","incident_type":"Beaten","year":2006,"longitude":69.33,"organization":"Aina TV","id":"34","incident_town":"Kabul City","incident_district":"Kabul City","age":null,"home_province":"Kabul","notes_other_details":null},"type":"Feature","geometry":{"type":"Polygon","coordinates":[[[69.3879943784106,34.55],[69.3868800326913,34.5386858580407],[69.3835798192143,34.5278065122119],[69.3782205633328,34.5177800496726],[69.3710082182449,34.5089917817551],[69.3622199503274,34.5017794366672],[69.3521934877881,34.4964201807857],[69.3413141419592,34.4931199673087],[69.33,34.4920056215894],[69.3186858580408,34.4931199673087],[69.3078065122119,34.4964201807857],[69.2977800496726,34.5017794366672],[69.2889917817552,34.5089917817551],[69.2817794366672,34.5177800496726],[69.2764201807857,34.5278065122119],[69.2731199673087,34.5386858580407],[69.2720056215894,34.55],[69.2731199673087,34.5613141419593],[69.2764201807857,34.5721934877881],[69.2817794366672,34.5822199503274],[69.2889917817551,34.5910082182448],[69.2977800496726,34.5982205633328],[69.3078065122119,34.6035798192143],[69.3186858580408,34.6068800326913],[69.33,34.6079943784106],[69.3413141419592,34.6068800326913],[69.3521934877881,34.6035798192143],[69.3622199503274,34.5982205633328],[69.3710082182448,34.5910082182448],[69.3782205633328,34.5822199503274],[69.3835798192143,34.5721934877881],[69.3868800326913,34.5613141419593],[69.3879943784106,34.55]]]}},{"properties":{"occupation":"Journalist","home_town":"Kabul City","month":5,"latitude":34.55,"suspected_attacker":"president security officers","unique_id":36,"date":{"end_time":"2006/05/28 00:00:00 -0400","original":"5/27/2006","granularity":"day","time":"2006/05/27 00:00:00 -0400"},"investigation_result":null,"gender":"Male","incident_reason":"On the way from office to Parliament","day":27,"incident_province":"Kabul","incident_type":"Beaten","year":2006,"longitude":69.33,"organization":"Aina TV","id":"35","incident_town":"Kabul City","incident_district":"Kabul City","age":null,"home_province":"Kabul","notes_other_details":null},"type":"Feature","geometry":{"type":"Polygon","coordinates":[[[69.3879943784106,34.55],[69.3868800326913,34.5386858580407],[69.3835798192143,34.5278065122119],[69.3782205633328,34.5177800496726],[69.3710082182449,34.5089917817551],[69.3622199503274,34.5017794366672],[69.3521934877881,34.4964201807857],[69.3413141419592,34.4931199673087],[69.33,34.4920056215894],[69.3186858580408,34.4931199673087],[69.3078065122119,34.4964201807857],[69.2977800496726,34.5017794366672],[69.2889917817552,34.5089917817551],[69.2817794366672,34.5177800496726],[69.2764201807857,34.5278065122119],[69.2731199673087,34.5386858580407],[69.2720056215894,34.55],[69.2731199673087,34.5613141419593],[69.2764201807857,34.5721934877881],[69.2817794366672,34.5822199503274],[69.2889917817551,34.5910082182448],[69.2977800496726,34.5982205633328],[69.3078065122119,34.6035798192143],[69.3186858580408,34.6068800326913],[69.33,34.6079943784106],[69.3413141419592,34.6068800326913],[69.3521934877881,34.6035798192143],[69.3622199503274,34.5982205633328],[69.3710082182448,34.5910082182448],[69.3782205633328,34.5822199503274],[69.3835798192143,34.5721934877881],[69.3868800326913,34.5613141419593],[69.3879943784106,34.55]]]}},{"properties":{"occupation":"Journalist","home_town":"Kabul City","month":5,"latitude":34.55,"suspected_attacker":"president security officers","unique_id":37,"date":{"end_time":"2006/05/28 00:00:00 -0400","original":"5/27/2006","granularity":"day","time":"2006/05/27 00:00:00 -0400"},"investigation_result":null,"gender":"Male","incident_reason":"On the way from office to Parliament","day":27,"incident_province":"Kabul","incident_type":"Beaten","year":2006,"longitude":69.33,"organization":"Aina TV","id":"36","incident_town":"Kabul City","incident_district":"Kabul City","age":null,"home_province":"Kabul","notes_other_details":null},"type":"Feature","geometry":{"type":"Polygon","coordinates":[[[69.3879943784106,34.55],[69.3868800326913,34.5386858580407],[69.3835798192143,34.5278065122119],[69.3782205633328,34.5177800496726],[69.3710082182449,34.5089917817551],[69.3622199503274,34.5017794366672],[69.3521934877881,34.4964201807857],[69.3413141419592,34.4931199673087],[69.33,34.4920056215894],[69.3186858580408,34.4931199673087],[69.3078065122119,34.4964201807857],[69.2977800496726,34.5017794366672],[69.2889917817552,34.5089917817551],[69.2817794366672,34.5177800496726],[69.2764201807857,34.5278065122119],[69.2731199673087,34.5386858580407],[69.2720056215894,34.55],[69.2731199673087,34.5613141419593],[69.2764201807857,34.5721934877881],[69.2817794366672,34.5822199503274],[69.2889917817551,34.5910082182448],[69.2977800496726,34.5982205633328],[69.3078065122119,34.6035798192143],[69.3186858580408,34.6068800326913],[69.33,34.6079943784106],[69.3413141419592,34.6068800326913],[69.3521934877881,34.6035798192143],[69.3622199503274,34.5982205633328],[69.3710082182448,34.5910082182448],[69.3782205633328,34.5822199503274],[69.3835798192143,34.5721934877881],[69.3868800326913,34.5613141419593],[69.3879943784106,34.55]]]}},{"properties":{"occupation":"Journalist","home_town":"Khost City","month":6,"latitude":33.38,"suspected_attacker":"Khost Governor","unique_id":38,"date":{"end_time":"2011/06/07 00:00:00 -0400","original":"6/6/2011","granularity":"day","time":"2011/06/06 00:00:00 -0400"},"investigation_result":null,"gender":"Male","incident_reason":"Reporting","day":null,"incident_province":"Khost","incident_type":"Threatened","year":2006,"longitude":69.83,"organization":"Jawan Ghagh","id":"37","incident_town":"Khost City","incident_district":"Khost City","age":null,"home_province":"Khost","notes_other_details":null},"type":"Feature","geometry":{"type":"Polygon","coordinates":[[[69.8879943784106,33.38],[69.8868800326913,33.3686858580407],[69.8835798192143,33.3578065122119],[69.8782205633328,33.3477800496726],[69.8710082182449,33.3389917817552],[69.8622199503274,33.3317794366672],[69.8521934877881,33.3264201807857],[69.8413141419592,33.3231199673087],[69.83,33.3220056215894],[69.8186858580408,33.3231199673087],[69.8078065122119,33.3264201807857],[69.7977800496726,33.3317794366672],[69.7889917817552,33.3389917817552],[69.7817794366672,33.3477800496726],[69.7764201807857,33.3578065122119],[69.7731199673087,33.3686858580407],[69.7720056215894,33.38],[69.7731199673087,33.3913141419593],[69.7764201807857,33.4021934877881],[69.7817794366672,33.4122199503274],[69.7889917817551,33.4210082182449],[69.7977800496726,33.4282205633328],[69.8078065122119,33.4335798192143],[69.8186858580408,33.4368800326913],[69.83,33.4379943784106],[69.8413141419592,33.4368800326913],[69.8521934877881,33.4335798192143],[69.8622199503274,33.4282205633328],[69.8710082182448,33.4210082182449],[69.8782205633328,33.4122199503274],[69.8835798192143,33.4021934877881],[69.8868800326913,33.3913141419593],[69.8879943784106,33.38]]]}},{"properties":{"occupation":"Radio Manager","home_town":"Said Abad District","month":6,"latitude":34.3,"suspected_attacker":"Taliban","unique_id":39,"date":{"end_time":"2011/06/07 00:00:00 -0400","original":"6/6/2011","granularity":"day","time":"2011/06/06 00:00:00 -0400"},"investigation_result":null,"gender":"Male","incident_reason":"Radio Broadcasting","day":null,"incident_province":"Wardak","incident_type":"Threatened","year":2006,"longitude":68.22,"organization":"Radio Yawali Ghazh","id":"38","incident_town":"Said Abad District","incident_district":"Said Abad District","age":null,"home_province":"Wardak","notes_other_details":null},"type":"Feature","geometry":{"type":"Polygon","coordinates":[[[68.2779943784106,34.3],[68.2768800326913,34.2886858580407],[68.2735798192143,34.2778065122119],[68.2682205633328,34.2677800496726],[68.2610082182449,34.2589917817551],[68.2522199503274,34.2517794366672],[68.2421934877881,34.2464201807857],[68.2313141419592,34.2431199673087],[68.22,34.2420056215894],[68.2086858580408,34.2431199673087],[68.1978065122119,34.2464201807857],[68.1877800496726,34.2517794366672],[68.1789917817552,34.2589917817551],[68.1717794366672,34.2677800496726],[68.1664201807857,34.2778065122119],[68.1631199673087,34.2886858580407],[68.1620056215894,34.3],[68.1631199673087,34.3113141419593],[68.1664201807857,34.3221934877881],[68.1717794366672,34.3322199503274],[68.1789917817551,34.3410082182448],[68.1877800496726,34.3482205633328],[68.1978065122119,34.3535798192143],[68.2086858580408,34.3568800326913],[68.22,34.3579943784106],[68.2313141419592,34.3568800326913],[68.2421934877881,34.3535798192143],[68.2522199503274,34.3482205633328],[68.2610082182448,34.3410082182448],[68.2682205633328,34.3322199503274],[68.2735798192143,34.3221934877881],[68.2768800326913,34.3113141419593],[68.2779943784106,34.3]]]}},{"properties":{"occupation":"Journalist","home_town":"Jalalabad","month":6,"latitude":34.27,"suspected_attacker":"Taliban","unique_id":40,"date":{"end_time":"2006/06/17 00:00:00 -0400","original":"6/16/2006","granularity":"day","time":"2006/06/16 00:00:00 -0400"},"investigation_result":null,"gender":"Male","incident_reason":"Publishing an article","day":16,"incident_province":"Nangarhar","incident_type":"Threatened","year":2006,"longitude":70.48,"organization":"Afghan Islamic News Agency","id":"39","incident_town":"Jalalabad","incident_district":"Jalalabad","age":null,"home_province":"Nangarhar","notes_other_details":null},"type":"Feature","geometry":{"type":"Polygon","coordinates":[[[70.5379943784106,34.27],[70.5368800326913,34.2586858580407],[70.5335798192143,34.2478065122119],[70.5282205633328,34.2377800496726],[70.5210082182449,34.2289917817552],[70.5122199503274,34.2217794366672],[70.5021934877881,34.2164201807857],[70.4913141419593,34.2131199673087],[70.48,34.2120056215894],[70.4686858580408,34.2131199673087],[70.4578065122119,34.2164201807857],[70.4477800496726,34.2217794366672],[70.4389917817552,34.2289917817552],[70.4317794366672,34.2377800496726],[70.4264201807857,34.2478065122119],[70.4231199673087,34.2586858580407],[70.4220056215894,34.27],[70.4231199673087,34.2813141419593],[70.4264201807857,34.2921934877881],[70.4317794366672,34.3022199503274],[70.4389917817551,34.3110082182449],[70.4477800496726,34.3182205633328],[70.4578065122119,34.3235798192143],[70.4686858580408,34.3268800326913],[70.48,34.3279943784106],[70.4913141419593,34.3268800326913],[70.5021934877881,34.3235798192143],[70.5122199503274,34.3182205633328],[70.5210082182448,34.3110082182449],[70.5282205633328,34.3022199503274],[70.5335798192143,34.2921934877881],[70.5368800326913,34.2813141419593],[70.5379943784106,34.27]]]}},{"properties":{"occupation":"Journalist","home_town":"Kabul City","month":7,"latitude":34.55,"suspected_attacker":"Unknown","unique_id":41,"date":{"end_time":"2006/07/30 00:00:00 -0400","original":"7/29/2006","granularity":"day","time":"2006/07/29 00:00:00 -0400"},"investigation_result":null,"gender":"Male","incident_reason":"Reporting","day":29,"incident_province":"Kabul","incident_type":"Beaten","year":2006,"longitude":69.33,"organization":"Tolo TV","id":"40","incident_town":"Kabul City","incident_district":"Kabul City","age":null,"home_province":"Kabul","notes_other_details":null},"type":"Feature","geometry":{"type":"Polygon","coordinates":[[[69.3879943784106,34.55],[69.3868800326913,34.5386858580407],[69.3835798192143,34.5278065122119],[69.3782205633328,34.5177800496726],[69.3710082182449,34.5089917817551],[69.3622199503274,34.5017794366672],[69.3521934877881,34.4964201807857],[69.3413141419592,34.4931199673087],[69.33,34.4920056215894],[69.3186858580408,34.4931199673087],[69.3078065122119,34.4964201807857],[69.2977800496726,34.5017794366672],[69.2889917817552,34.5089917817551],[69.2817794366672,34.5177800496726],[69.2764201807857,34.5278065122119],[69.2731199673087,34.5386858580407],[69.2720056215894,34.55],[69.2731199673087,34.5613141419593],[69.2764201807857,34.5721934877881],[69.2817794366672,34.5822199503274],[69.2889917817551,34.5910082182448],[69.2977800496726,34.5982205633328],[69.3078065122119,34.6035798192143],[69.3186858580408,34.6068800326913],[69.33,34.6079943784106],[69.3413141419592,34.6068800326913],[69.3521934877881,34.6035798192143],[69.3622199503274,34.5982205633328],[69.3710082182448,34.5910082182448],[69.3782205633328,34.5822199503274],[69.3835798192143,34.5721934877881],[69.3868800326913,34.5613141419593],[69.3879943784106,34.55]]]}},{"properties":{"occupation":"Camera Man","home_town":"Kandahar City","month":7,"latitude":31.04,"suspected_attacker":"Taliban","unique_id":42,"date":{"end_time":"2006/07/23 00:00:00 -0400","original":"7/22/2006","granularity":"day","time":"2006/07/22 00:00:00 -0400"},"investigation_result":null,"gender":"Male","incident_reason":"In a suicide attack in Kandahar City","day":22,"incident_province":"Kandahar","incident_type":"Killed","year":2006,"longitude":65.71,"organization":"Aryana TV","id":"41","incident_town":"Kandahar City","incident_district":"Kandahar City","age":null,"home_province":"Kandahar","notes_other_details":null},"type":"Feature","geometry":{"type":"Polygon","coordinates":[[[65.7679943784106,31.04],[65.7668800326913,31.0286858580407],[65.7635798192143,31.0178065122119],[65.7582205633328,31.0077800496726],[65.7510082182448,30.9989917817552],[65.7422199503274,30.9917794366672],[65.7321934877881,30.9864201807857],[65.7213141419592,30.9831199673087],[65.71,30.9820056215894],[65.6986858580407,30.9831199673087],[65.6878065122119,30.9864201807857],[65.6777800496726,30.9917794366672],[65.6689917817552,30.9989917817552],[65.6617794366672,31.0077800496726],[65.6564201807857,31.0178065122119],[65.6531199673087,31.0286858580407],[65.6520056215894,31.04],[65.6531199673087,31.0513141419593],[65.6564201807857,31.0621934877881],[65.6617794366672,31.0722199503274],[65.6689917817551,31.0810082182448],[65.6777800496726,31.0882205633328],[65.6878065122119,31.0935798192143],[65.6986858580407,31.0968800326913],[65.71,31.0979943784106],[65.7213141419592,31.0968800326913],[65.7321934877881,31.0935798192143],[65.7422199503274,31.0882205633328],[65.7510082182448,31.0810082182448],[65.7582205633328,31.0722199503274],[65.7635798192143,31.0621934877881],[65.7668800326913,31.0513141419593],[65.7679943784106,31.04]]]}},{"properties":{"occupation":"Journalist","home_town":"Lashkargah City","month":7,"latitude":31.12,"suspected_attacker":"Government","unique_id":43,"date":{"end_time":"2006/07/14 00:00:00 -0400","original":"7/13/2006","granularity":"day","time":"2006/07/13 00:00:00 -0400"},"investigation_result":null,"gender":"Male","incident_reason":"Reporting","day":13,"incident_province":"Hilmand","incident_type":"Threatened","year":2006,"longitude":64.02,"organization":"Azadi Radio","id":"42","incident_town":"Lashkargah City","incident_district":"Lashkargah City","age":null,"home_province":"Hilmand","notes_other_details":null},"type":"Feature","geometry":{"type":"Polygon","coordinates":[[[64.0779943784106,31.12],[64.0768800326913,31.1086858580407],[64.0735798192143,31.0978065122119],[64.0682205633328,31.0877800496726],[64.0610082182449,31.0789917817552],[64.0522199503274,31.0717794366672],[64.0421934877881,31.0664201807857],[64.0313141419592,31.0631199673087],[64.02,31.0620056215894],[64.0086858580407,31.0631199673087],[63.9978065122119,31.0664201807857],[63.9877800496726,31.0717794366672],[63.9789917817551,31.0789917817552],[63.9717794366672,31.0877800496726],[63.9664201807857,31.0978065122119],[63.9631199673087,31.1086858580407],[63.9620056215894,31.12],[63.9631199673087,31.1313141419593],[63.9664201807857,31.1421934877881],[63.9717794366672,31.1522199503274],[63.9789917817551,31.1610082182448],[63.9877800496726,31.1682205633328],[63.9978065122119,31.1735798192143],[64.0086858580407,31.1768800326913],[64.02,31.1779943784106],[64.0313141419592,31.1768800326913],[64.0421934877881,31.1735798192143],[64.0522199503274,31.1682205633328],[64.0610082182448,31.1610082182448],[64.0682205633328,31.1522199503274],[64.0735798192143,31.1421934877881],[64.0768800326913,31.1313141419593],[64.0779943784106,31.12]]]}},{"properties":{"occupation":"Journalist","home_town":"Khost City","month":8,"latitude":33.38,"suspected_attacker":"Unknown Individuals","unique_id":44,"date":{"end_time":"2006/08/14 00:00:00 -0400","original":"8/13/2006","granularity":"day","time":"2006/08/13 00:00:00 -0400"},"investigation_result":null,"gender":"Male","incident_reason":"Reporting","day":13,"incident_province":"Khost","incident_type":"Beaten","year":2006,"longitude":69.83,"organization":"Freelance","id":"43","incident_town":"Khost City","incident_district":"Khost City","age":null,"home_province":"Khost","notes_other_details":null},"type":"Feature","geometry":{"type":"Polygon","coordinates":[[[69.8879943784106,33.38],[69.8868800326913,33.3686858580407],[69.8835798192143,33.3578065122119],[69.8782205633328,33.3477800496726],[69.8710082182449,33.3389917817552],[69.8622199503274,33.3317794366672],[69.8521934877881,33.3264201807857],[69.8413141419592,33.3231199673087],[69.83,33.3220056215894],[69.8186858580408,33.3231199673087],[69.8078065122119,33.3264201807857],[69.7977800496726,33.3317794366672],[69.7889917817552,33.3389917817552],[69.7817794366672,33.3477800496726],[69.7764201807857,33.3578065122119],[69.7731199673087,33.3686858580407],[69.7720056215894,33.38],[69.7731199673087,33.3913141419593],[69.7764201807857,33.4021934877881],[69.7817794366672,33.4122199503274],[69.7889917817551,33.4210082182449],[69.7977800496726,33.4282205633328],[69.8078065122119,33.4335798192143],[69.8186858580408,33.4368800326913],[69.83,33.4379943784106],[69.8413141419592,33.4368800326913],[69.8521934877881,33.4335798192143],[69.8622199503274,33.4282205633328],[69.8710082182448,33.4210082182449],[69.8782205633328,33.4122199503274],[69.8835798192143,33.4021934877881],[69.8868800326913,33.3913141419593],[69.8879943784106,33.38]]]}},{"properties":{"occupation":"Journalist","home_town":"Gardiz City","month":7,"latitude":33.63,"suspected_attacker":"Taliban","unique_id":45,"date":{"end_time":"2011/07/07 00:00:00 -0400","original":"7/6/2011","granularity":"day","time":"2011/07/06 00:00:00 -0400"},"investigation_result":null,"gender":"Male","incident_reason":"Reporting","day":null,"incident_province":"Paktya","incident_type":"Beaten","year":2006,"longitude":69.39,"organization":"Soli Paygham Radio","id":"44","incident_town":"Gardiz","incident_district":"Gardiz","age":null,"home_province":"Paktia","notes_other_details":null},"type":"Feature","geometry":{"type":"Polygon","coordinates":[[[69.4479943784106,33.63],[69.4468800326913,33.6186858580407],[69.4435798192143,33.6078065122119],[69.4382205633328,33.5977800496726],[69.4310082182449,33.5889917817552],[69.4222199503274,33.5817794366672],[69.4121934877881,33.5764201807857],[69.4013141419592,33.5731199673087],[69.39,33.5720056215894],[69.3786858580408,33.5731199673087],[69.3678065122119,33.5764201807857],[69.3577800496726,33.5817794366672],[69.3489917817552,33.5889917817552],[69.3417794366672,33.5977800496726],[69.3364201807857,33.6078065122119],[69.3331199673087,33.6186858580407],[69.3320056215894,33.63],[69.3331199673087,33.6413141419593],[69.3364201807857,33.6521934877881],[69.3417794366672,33.6622199503274],[69.3489917817551,33.6710082182449],[69.3577800496726,33.6782205633328],[69.3678065122119,33.6835798192143],[69.3786858580408,33.6868800326913],[69.39,33.6879943784106],[69.4013141419592,33.6868800326913],[69.4121934877881,33.6835798192143],[69.4222199503274,33.6782205633328],[69.4310082182448,33.6710082182449],[69.4382205633328,33.6622199503274],[69.4435798192143,33.6521934877881],[69.4468800326913,33.6413141419593],[69.4479943784106,33.63]]]}},{"properties":{"occupation":"Journalist","home_town":"Gardiz City","month":7,"latitude":33.63,"suspected_attacker":"Taliban","unique_id":46,"date":{"end_time":"2011/07/07 00:00:00 -0400","original":"7/6/2011","granularity":"day","time":"2011/07/06 00:00:00 -0400"},"investigation_result":null,"gender":"Male","incident_reason":"Reporting from a suicide attack","day":null,"incident_province":"Paktya","incident_type":"Beaten","year":2006,"longitude":69.39,"organization":"RTA","id":"45","incident_town":"Gardiz","incident_district":"Gardiz","age":null,"home_province":"Paktia","notes_other_details":null},"type":"Feature","geometry":{"type":"Polygon","coordinates":[[[69.4479943784106,33.63],[69.4468800326913,33.6186858580407],[69.4435798192143,33.6078065122119],[69.4382205633328,33.5977800496726],[69.4310082182449,33.5889917817552],[69.4222199503274,33.5817794366672],[69.4121934877881,33.5764201807857],[69.4013141419592,33.5731199673087],[69.39,33.5720056215894],[69.3786858580408,33.5731199673087],[69.3678065122119,33.5764201807857],[69.3577800496726,33.5817794366672],[69.3489917817552,33.5889917817552],[69.3417794366672,33.5977800496726],[69.3364201807857,33.6078065122119],[69.3331199673087,33.6186858580407],[69.3320056215894,33.63],[69.3331199673087,33.6413141419593],[69.3364201807857,33.6521934877881],[69.3417794366672,33.6622199503274],[69.3489917817551,33.6710082182449],[69.3577800496726,33.6782205633328],[69.3678065122119,33.6835798192143],[69.3786858580408,33.6868800326913],[69.39,33.6879943784106],[69.4013141419592,33.6868800326913],[69.4121934877881,33.6835798192143],[69.4222199503274,33.6782205633328],[69.4310082182448,33.6710082182449],[69.4382205633328,33.6622199503274],[69.4435798192143,33.6521934877881],[69.4468800326913,33.6413141419593],[69.4479943784106,33.63]]]}},{"properties":{"occupation":"Journalist","home_town":"Gardiz City","month":null,"latitude":33.63,"suspected_attacker":"Unknown Individuals","unique_id":47,"date":{"end_time":"2007/01/01 00:00:00 -0500","original":"2006","granularity":"year","time":"2006/01/01 00:00:00 -0500"},"investigation_result":null,"gender":"Male","incident_reason":"Reporting from a suicide attack","day":null,"incident_province":"Paktya","incident_type":"Threatened","year":2006,"longitude":69.39,"organization":"RTA","id":"46","incident_town":"Gardiz","incident_district":"Gardiz","age":null,"home_province":"Paktia","notes_other_details":null},"type":"Feature","geometry":{"type":"Polygon","coordinates":[[[69.4479943784106,33.63],[69.4468800326913,33.6186858580407],[69.4435798192143,33.6078065122119],[69.4382205633328,33.5977800496726],[69.4310082182449,33.5889917817552],[69.4222199503274,33.5817794366672],[69.4121934877881,33.5764201807857],[69.4013141419592,33.5731199673087],[69.39,33.5720056215894],[69.3786858580408,33.5731199673087],[69.3678065122119,33.5764201807857],[69.3577800496726,33.5817794366672],[69.3489917817552,33.5889917817552],[69.3417794366672,33.5977800496726],[69.3364201807857,33.6078065122119],[69.3331199673087,33.6186858580407],[69.3320056215894,33.63],[69.3331199673087,33.6413141419593],[69.3364201807857,33.6521934877881],[69.3417794366672,33.6622199503274],[69.3489917817551,33.6710082182449],[69.3577800496726,33.6782205633328],[69.3678065122119,33.6835798192143],[69.3786858580408,33.6868800326913],[69.39,33.6879943784106],[69.4013141419592,33.6868800326913],[69.4121934877881,33.6835798192143],[69.4222199503274,33.6782205633328],[69.4310082182448,33.6710082182449],[69.4382205633328,33.6622199503274],[69.4435798192143,33.6521934877881],[69.4468800326913,33.6413141419593],[69.4479943784106,33.63]]]}},{"properties":{"occupation":"Journalist","home_town":"Gardiz City","month":9,"latitude":33.63,"suspected_attacker":"Government","unique_id":48,"date":{"end_time":"2011/09/07 00:00:00 -0400","original":"9/6/2011","granularity":"day","time":"2011/09/06 00:00:00 -0400"},"investigation_result":null,"gender":"Male","incident_reason":"Reporting","day":null,"incident_province":"Paktya","incident_type":"Beaten","year":2006,"longitude":69.39,"organization":"Soli Paygham Radio","id":"47","incident_town":"Gardiz","incident_district":"Gardiz","age":null,"home_province":"Paktia","notes_other_details":null},"type":"Feature","geometry":{"type":"Polygon","coordinates":[[[69.4479943784106,33.63],[69.4468800326913,33.6186858580407],[69.4435798192143,33.6078065122119],[69.4382205633328,33.5977800496726],[69.4310082182449,33.5889917817552],[69.4222199503274,33.5817794366672],[69.4121934877881,33.5764201807857],[69.4013141419592,33.5731199673087],[69.39,33.5720056215894],[69.3786858580408,33.5731199673087],[69.3678065122119,33.5764201807857],[69.3577800496726,33.5817794366672],[69.3489917817552,33.5889917817552],[69.3417794366672,33.5977800496726],[69.3364201807857,33.6078065122119],[69.3331199673087,33.6186858580407],[69.3320056215894,33.63],[69.3331199673087,33.6413141419593],[69.3364201807857,33.6521934877881],[69.3417794366672,33.6622199503274],[69.3489917817551,33.6710082182449],[69.3577800496726,33.6782205633328],[69.3678065122119,33.6835798192143],[69.3786858580408,33.6868800326913],[69.39,33.6879943784106],[69.4013141419592,33.6868800326913],[69.4121934877881,33.6835798192143],[69.4222199503274,33.6782205633328],[69.4310082182448,33.6710082182449],[69.4382205633328,33.6622199503274],[69.4435798192143,33.6521934877881],[69.4468800326913,33.6413141419593],[69.4479943784106,33.63]]]}},{"properties":{"occupation":"Manager","home_town":"Kabul City","month":8,"latitude":34.55,"suspected_attacker":"Government","unique_id":49,"date":{"end_time":"2006/08/24 00:00:00 -0400","original":"8/23/2006","granularity":"day","time":"2006/08/23 00:00:00 -0400"},"investigation_result":null,"gender":"Male","incident_reason":"Publishing an article","day":23,"incident_province":"Kabul","incident_type":"Arrested","year":2006,"longitude":69.33,"organization":"Arman Mili Daily","id":"48","incident_town":"Kabul City","incident_district":"Kabul City","age":null,"home_province":"Kabul","notes_other_details":null},"type":"Feature","geometry":{"type":"Polygon","coordinates":[[[69.3879943784106,34.55],[69.3868800326913,34.5386858580407],[69.3835798192143,34.5278065122119],[69.3782205633328,34.5177800496726],[69.3710082182449,34.5089917817551],[69.3622199503274,34.5017794366672],[69.3521934877881,34.4964201807857],[69.3413141419592,34.4931199673087],[69.33,34.4920056215894],[69.3186858580408,34.4931199673087],[69.3078065122119,34.4964201807857],[69.2977800496726,34.5017794366672],[69.2889917817552,34.5089917817551],[69.2817794366672,34.5177800496726],[69.2764201807857,34.5278065122119],[69.2731199673087,34.5386858580407],[69.2720056215894,34.55],[69.2731199673087,34.5613141419593],[69.2764201807857,34.5721934877881],[69.2817794366672,34.5822199503274],[69.2889917817551,34.5910082182448],[69.2977800496726,34.5982205633328],[69.3078065122119,34.6035798192143],[69.3186858580408,34.6068800326913],[69.33,34.6079943784106],[69.3413141419592,34.6068800326913],[69.3521934877881,34.6035798192143],[69.3622199503274,34.5982205633328],[69.3710082182448,34.5910082182448],[69.3782205633328,34.5822199503274],[69.3835798192143,34.5721934877881],[69.3868800326913,34.5613141419593],[69.3879943784106,34.55]]]}},{"properties":{"occupation":"Journalist","home_town":"Italian","month":10,"latitude":31.04,"suspected_attacker":"Unknown Individuals","unique_id":50,"date":{"end_time":"2006/10/13 00:00:00 -0400","original":"10/12/2006","granularity":"day","time":"2006/10/12 00:00:00 -0400"},"investigation_result":null,"gender":"Male","incident_reason":"Reporting","day":12,"incident_province":"Kandahar","incident_type":"Kidnapped","year":2006,"longitude":65.71,"organization":"Freelance","id":"49","incident_town":null,"incident_district":null,"age":null,"home_province":"Italy","notes_other_details":null},"type":"Feature","geometry":{"type":"Polygon","coordinates":[[[65.7679943784106,31.04],[65.7668800326913,31.0286858580407],[65.7635798192143,31.0178065122119],[65.7582205633328,31.0077800496726],[65.7510082182448,30.9989917817552],[65.7422199503274,30.9917794366672],[65.7321934877881,30.9864201807857],[65.7213141419592,30.9831199673087],[65.71,30.9820056215894],[65.6986858580407,30.9831199673087],[65.6878065122119,30.9864201807857],[65.6777800496726,30.9917794366672],[65.6689917817552,30.9989917817552],[65.6617794366672,31.0077800496726],[65.6564201807857,31.0178065122119],[65.6531199673087,31.0286858580407],[65.6520056215894,31.04],[65.6531199673087,31.0513141419593],[65.6564201807857,31.0621934877881],[65.6617794366672,31.0722199503274],[65.6689917817551,31.0810082182448],[65.6777800496726,31.0882205633328],[65.6878065122119,31.0935798192143],[65.6986858580407,31.0968800326913],[65.71,31.0979943784106],[65.7213141419592,31.0968800326913],[65.7321934877881,31.0935798192143],[65.7422199503274,31.0882205633328],[65.7510082182448,31.0810082182448],[65.7582205633328,31.0722199503274],[65.7635798192143,31.0621934877881],[65.7668800326913,31.0513141419593],[65.7679943784106,31.04]]]}},{"properties":{"occupation":"Journalist","home_town":"Unclear","month":10,"latitude":35.8,"suspected_attacker":"Unknown Individuals","unique_id":51,"date":{"end_time":"2006/10/29 00:00:00 -0400","original":"10/28/2006","granularity":"day","time":"2006/10/28 00:00:00 -0400"},"investigation_result":null,"gender":"Male","incident_reason":"Reporting","day":28,"incident_province":"Baghlan","incident_type":"Killed","year":2006,"longitude":68.91,"organization":"DW","id":"50","incident_town":null,"incident_district":null,"age":null,"home_province":"Germany","notes_other_details":null},"type":"Feature","geometry":{"type":"Polygon","coordinates":[[[68.9679943784106,35.8],[68.9668800326913,35.7886858580407],[68.9635798192143,35.7778065122119],[68.9582205633328,35.7677800496726],[68.9510082182449,35.7589917817551],[68.9422199503274,35.7517794366672],[68.9321934877881,35.7464201807857],[68.9213141419592,35.7431199673087],[68.91,35.7420056215894],[68.8986858580407,35.7431199673087],[68.8878065122119,35.7464201807857],[68.8777800496726,35.7517794366672],[68.8689917817552,35.7589917817551],[68.8617794366672,35.7677800496726],[68.8564201807857,35.7778065122119],[68.8531199673087,35.7886858580407],[68.8520056215894,35.8],[68.8531199673087,35.8113141419593],[68.8564201807857,35.8221934877881],[68.8617794366672,35.8322199503274],[68.8689917817551,35.8410082182448],[68.8777800496726,35.8482205633328],[68.8878065122119,35.8535798192143],[68.8986858580407,35.8568800326913],[68.91,35.8579943784106],[68.9213141419592,35.8568800326913],[68.9321934877881,35.8535798192143],[68.9422199503274,35.8482205633328],[68.9510082182448,35.8410082182448],[68.9582205633328,35.8322199503274],[68.9635798192143,35.8221934877881],[68.9668800326913,35.8113141419593],[68.9679943784106,35.8]]]}},{"properties":{"occupation":"Journalist","home_town":"Unclear","month":10,"latitude":35.8,"suspected_attacker":"Unknown Individuals","unique_id":52,"date":{"end_time":"2006/10/29 00:00:00 -0400","original":"10/28/2006","granularity":"day","time":"2006/10/28 00:00:00 -0400"},"investigation_result":null,"gender":"Male","incident_reason":"Reporting","day":28,"incident_province":"Baghlan","incident_type":"Killed","year":2006,"longitude":68.91,"organization":"Dochiwele","id":"51","incident_town":null,"incident_district":null,"age":null,"home_province":"Germany","notes_other_details":null},"type":"Feature","geometry":{"type":"Polygon","coordinates":[[[68.9679943784106,35.8],[68.9668800326913,35.7886858580407],[68.9635798192143,35.7778065122119],[68.9582205633328,35.7677800496726],[68.9510082182449,35.7589917817551],[68.9422199503274,35.7517794366672],[68.9321934877881,35.7464201807857],[68.9213141419592,35.7431199673087],[68.91,35.7420056215894],[68.8986858580407,35.7431199673087],[68.8878065122119,35.7464201807857],[68.8777800496726,35.7517794366672],[68.8689917817552,35.7589917817551],[68.8617794366672,35.7677800496726],[68.8564201807857,35.7778065122119],[68.8531199673087,35.7886858580407],[68.8520056215894,35.8],[68.8531199673087,35.8113141419593],[68.8564201807857,35.8221934877881],[68.8617794366672,35.8322199503274],[68.8689917817551,35.8410082182448],[68.8777800496726,35.8482205633328],[68.8878065122119,35.8535798192143],[68.8986858580407,35.8568800326913],[68.91,35.8579943784106],[68.9213141419592,35.8568800326913],[68.9321934877881,35.8535798192143],[68.9422199503274,35.8482205633328],[68.9510082182448,35.8410082182448],[68.9582205633328,35.8322199503274],[68.9635798192143,35.8221934877881],[68.9668800326913,35.8113141419593],[68.9679943784106,35.8]]]}},{"properties":{"occupation":"Journalist","home_town":"Hirat City","month":10,"latitude":34.2,"suspected_attacker":"General Attorney","unique_id":53,"date":{"end_time":"2006/10/05 00:00:00 -0400","original":"10/4/2006","granularity":"day","time":"2006/10/04 00:00:00 -0400"},"investigation_result":null,"gender":"Male","incident_reason":"Reporting","day":4,"incident_province":"Hirat","incident_type":"Threatened","year":2006,"longitude":62.13,"organization":"Aryana TV","id":"52","incident_town":"Hirat City","incident_district":"Hirat City","age":null,"home_province":"Hirat","notes_other_details":null},"type":"Feature","geometry":{"type":"Polygon","coordinates":[[[62.1879943784106,34.2],[62.1868800326913,34.1886858580407],[62.1835798192143,34.1778065122119],[62.1782205633328,34.1677800496726],[62.1710082182449,34.1589917817552],[62.1622199503274,34.1517794366672],[62.1521934877881,34.1464201807857],[62.1413141419593,34.1431199673087],[62.13,34.1420056215894],[62.1186858580407,34.1431199673087],[62.1078065122119,34.1464201807857],[62.0977800496726,34.1517794366672],[62.0889917817552,34.1589917817552],[62.0817794366672,34.1677800496726],[62.0764201807857,34.1778065122119],[62.0731199673087,34.1886858580407],[62.0720056215894,34.2],[62.0731199673087,34.2113141419593],[62.0764201807857,34.2221934877881],[62.0817794366672,34.2322199503274],[62.0889917817552,34.2410082182449],[62.0977800496726,34.2482205633328],[62.1078065122119,34.2535798192143],[62.1186858580407,34.2568800326913],[62.13,34.2579943784106],[62.1413141419593,34.2568800326913],[62.1521934877881,34.2535798192143],[62.1622199503274,34.2482205633328],[62.1710082182449,34.2410082182449],[62.1782205633328,34.2322199503274],[62.1835798192143,34.2221934877881],[62.1868800326913,34.2113141419593],[62.1879943784106,34.2]]]}},{"properties":{"occupation":"ATV Manager","home_town":"Kabul City","month":10,"latitude":34.2,"suspected_attacker":"General Attorney","unique_id":54,"date":{"end_time":"2006/10/05 00:00:00 -0400","original":"10/4/2006","granularity":"day","time":"2006/10/04 00:00:00 -0400"},"investigation_result":null,"gender":"Male","incident_reason":"Reporting","day":4,"incident_province":"Hirat","incident_type":"Threatened","year":2006,"longitude":62.13,"organization":"Aryana TV","id":"53","incident_town":"Hirat City","incident_district":"Hirat City","age":null,"home_province":"Kabul","notes_other_details":null},"type":"Feature","geometry":{"type":"Polygon","coordinates":[[[62.1879943784106,34.2],[62.1868800326913,34.1886858580407],[62.1835798192143,34.1778065122119],[62.1782205633328,34.1677800496726],[62.1710082182449,34.1589917817552],[62.1622199503274,34.1517794366672],[62.1521934877881,34.1464201807857],[62.1413141419593,34.1431199673087],[62.13,34.1420056215894],[62.1186858580407,34.1431199673087],[62.1078065122119,34.1464201807857],[62.0977800496726,34.1517794366672],[62.0889917817552,34.1589917817552],[62.0817794366672,34.1677800496726],[62.0764201807857,34.1778065122119],[62.0731199673087,34.1886858580407],[62.0720056215894,34.2],[62.0731199673087,34.2113141419593],[62.0764201807857,34.2221934877881],[62.0817794366672,34.2322199503274],[62.0889917817552,34.2410082182449],[62.0977800496726,34.2482205633328],[62.1078065122119,34.2535798192143],[62.1186858580407,34.2568800326913],[62.13,34.2579943784106],[62.1413141419593,34.2568800326913],[62.1521934877881,34.2535798192143],[62.1622199503274,34.2482205633328],[62.1710082182449,34.2410082182449],[62.1782205633328,34.2322199503274],[62.1835798192143,34.2221934877881],[62.1868800326913,34.2113141419593],[62.1879943784106,34.2]]]}},{"properties":{"occupation":"Journalist","home_town":"Kabul City","month":10,"latitude":34.55,"suspected_attacker":"Police","unique_id":55,"date":{"end_time":"2006/10/18 00:00:00 -0400","original":"10/17/2006","granularity":"day","time":"2006/10/17 00:00:00 -0400"},"investigation_result":null,"gender":"Male","incident_reason":"Covering press conference of an AF minister","day":17