{"type":"FeatureCollection","data_type":"Dataset Analysis","url_type":null,"permissions":[{"permissions":{"download":true,"view":true},"group_id":"everyone"}],"classification":null,"title":"Dataset from 'VIOLENCE AGAINST JOURNALISTS IN AFGHANISTAN 2001-2011' with a 12m buffer","count":265,"stream_id":246606,"contributor":{"url":"http://geocommons.com/users/46585","name":"morandini.fabio"},"data_attributes":null,"calculation_params":{"input":{"min_distance":null,"unit":"m","distance":"12","id":"138644"},"calculation":"buffer"},"icon_link":null,"link":"http://geocommons.com/overlays/246606.json","extent":[62.1299,31.0399,71.0901,36.8401],"geometry_types":["area"],"unique_name":null,"name":"Dataset from 'VIOLENCE AGAINST JOURNALISTS IN AFGHANISTAN 2001-2011' with a 12m buffer","feature_count":265,"description":"Dataset created by adding a buffer of 12m around the features in 'VIOLENCE AGAINST JOURNALISTS IN AFGHANISTAN 2001-2011'","next_feature":null,"is_raster":false,"short_classification":"Y","stats":{"month":{"max":12,"variance":11.759437751004,"mean":6.26,"stdev":3.42920366134821,"min":1,"median":6},"latitude":{"max":36.84,"variance":1.88102474842767,"mean":34.1207924528302,"stdev":1.37150455647354,"min":31.04,"median":34.55},"unique_id":{"max":265,"variance":5874.16666666667,"mean":133.0,"stdev":76.643112323722,"min":1,"median":133},"date":{"max":"2011/10/09 00:00:00 -0400","variance":3.96837219611041e+15,"mean":"2008/05/13 23:30:06 -0400","stdev":62995017.2324003,"min":"2001/07/03 00:00:00 -0400","median":"2008/06/23 00:00:00 -0400"},"day":{"max":31,"variance":77.1454324136332,"mean":16.0657894736842,"stdev":8.78324725905136,"min":1,"median":15},"year":{"max":2011,"variance":3.38930817610061,"mean":2007.6679245283,"stdev":1.84100738078385,"min":2001,"median":2008},"longitude":{"max":71.09,"variance":6.62575076615209,"mean":67.9723773584905,"stdev":2.57405337282506,"min":62.13,"median":69.33}},"features":[{"properties":{"occupation":"Journalist","home_town":"Unclear","month":11,"latitude":34.27,"suspected_attacker":"Unknown","unique_id":1,"date":{"end_time":"2001/11/20 00:00:00 -0500","original":"11/19/2001","granularity":"day","time":"2001/11/19 00:00:00 -0500"},"investigation_result":null,"gender":"Male","incident_reason":"Unclear","day":19,"incident_province":"Nangarhar","incident_type":"Killed","year":2001,"longitude":70.48,"organization":"Reuters","id":"0","incident_town":"Unclear","incident_district":"Unclear","age":null,"home_province":"Foreigner","notes_other_details":null},"type":"Feature","geometry":{"type":"Polygon","coordinates":[[[70.4801081081081,34.27],[70.4801060308411,34.2699789091544],[70.4800998788684,34.2699586288181],[70.4800898886067,34.2699399383532],[70.4800764439763,34.2699235560237],[70.4800600616468,34.2699101113933],[70.4800413711819,34.2699001211316],[70.4800210908456,34.2698939691589],[70.48,34.2698918918919],[70.4799789091544,34.2698939691589],[70.4799586288181,34.2699001211316],[70.4799399383532,34.2699101113933],[70.4799235560237,34.2699235560237],[70.4799101113933,34.2699399383532],[70.4799001211316,34.2699586288181],[70.4798939691589,34.2699789091544],[70.4798918918919,34.27],[70.4798939691589,34.2700210908456],[70.4799001211316,34.2700413711819],[70.4799101113933,34.2700600616468],[70.4799235560237,34.2700764439764],[70.4799399383532,34.2700898886067],[70.4799586288181,34.2700998788684],[70.4799789091544,34.2701060308411],[70.48,34.2701081081081],[70.4800210908456,34.2701060308411],[70.4800413711819,34.2700998788684],[70.4800600616468,34.2700898886067],[70.4800764439763,34.2700764439764],[70.4800898886067,34.2700600616468],[70.4800998788684,34.2700413711819],[70.4801060308411,34.2700210908456],[70.4801081081081,34.27]]]}},{"properties":{"occupation":"Journalist","home_town":"Unclear","month":11,"latitude":34.27,"suspected_attacker":"Unknown","unique_id":2,"date":{"end_time":"2001/11/20 00:00:00 -0500","original":"11/19/2001","granularity":"day","time":"2001/11/19 00:00:00 -0500"},"investigation_result":null,"gender":"Male","incident_reason":"Unclear","day":19,"incident_province":"Nangarhar","incident_type":"Killed","year":2001,"longitude":70.48,"organization":"Reuters","id":"1","incident_town":"Unclear","incident_district":"Unclear","age":null,"home_province":"Afghan","notes_other_details":null},"type":"Feature","geometry":{"type":"Polygon","coordinates":[[[70.4801081081081,34.27],[70.4801060308411,34.2699789091544],[70.4800998788684,34.2699586288181],[70.4800898886067,34.2699399383532],[70.4800764439763,34.2699235560237],[70.4800600616468,34.2699101113933],[70.4800413711819,34.2699001211316],[70.4800210908456,34.2698939691589],[70.48,34.2698918918919],[70.4799789091544,34.2698939691589],[70.4799586288181,34.2699001211316],[70.4799399383532,34.2699101113933],[70.4799235560237,34.2699235560237],[70.4799101113933,34.2699399383532],[70.4799001211316,34.2699586288181],[70.4798939691589,34.2699789091544],[70.4798918918919,34.27],[70.4798939691589,34.2700210908456],[70.4799001211316,34.2700413711819],[70.4799101113933,34.2700600616468],[70.4799235560237,34.2700764439764],[70.4799399383532,34.2700898886067],[70.4799586288181,34.2700998788684],[70.4799789091544,34.2701060308411],[70.48,34.2701081081081],[70.4800210908456,34.2701060308411],[70.4800413711819,34.2700998788684],[70.4800600616468,34.2700898886067],[70.4800764439763,34.2700764439764],[70.4800898886067,34.2700600616468],[70.4800998788684,34.2700413711819],[70.4801060308411,34.2700210908456],[70.4801081081081,34.27]]]}},{"properties":{"occupation":"Journalist","home_town":"Unclear","month":11,"latitude":34.27,"suspected_attacker":"Unknown","unique_id":3,"date":{"end_time":"2001/11/20 00:00:00 -0500","original":"11/19/2001","granularity":"day","time":"2001/11/19 00:00:00 -0500"},"investigation_result":null,"gender":"Female","incident_reason":"Unclear","day":19,"incident_province":"Nangarhar","incident_type":"Killed","year":2001,"longitude":70.48,"organization":"Unclear","id":"2","incident_town":"Unclear","incident_district":"Unclear","age":null,"home_province":"Italy","notes_other_details":null},"type":"Feature","geometry":{"type":"Polygon","coordinates":[[[70.4801081081081,34.27],[70.4801060308411,34.2699789091544],[70.4800998788684,34.2699586288181],[70.4800898886067,34.2699399383532],[70.4800764439763,34.2699235560237],[70.4800600616468,34.2699101113933],[70.4800413711819,34.2699001211316],[70.4800210908456,34.2698939691589],[70.48,34.2698918918919],[70.4799789091544,34.2698939691589],[70.4799586288181,34.2699001211316],[70.4799399383532,34.2699101113933],[70.4799235560237,34.2699235560237],[70.4799101113933,34.2699399383532],[70.4799001211316,34.2699586288181],[70.4798939691589,34.2699789091544],[70.4798918918919,34.27],[70.4798939691589,34.2700210908456],[70.4799001211316,34.2700413711819],[70.4799101113933,34.2700600616468],[70.4799235560237,34.2700764439764],[70.4799399383532,34.2700898886067],[70.4799586288181,34.2700998788684],[70.4799789091544,34.2701060308411],[70.48,34.2701081081081],[70.4800210908456,34.2701060308411],[70.4800413711819,34.2700998788684],[70.4800600616468,34.2700898886067],[70.4800764439763,34.2700764439764],[70.4800898886067,34.2700600616468],[70.4800998788684,34.2700413711819],[70.4801060308411,34.2700210908456],[70.4801081081081,34.27]]]}},{"properties":{"occupation":"Journalist","home_town":"Unclear","month":11,"latitude":34.27,"suspected_attacker":"Unknown","unique_id":4,"date":{"end_time":"2001/11/20 00:00:00 -0500","original":"11/19/2001","granularity":"day","time":"2001/11/19 00:00:00 -0500"},"investigation_result":null,"gender":"Female","incident_reason":"Unclear","day":19,"incident_province":"Nangarhar","incident_type":"Killed","year":2001,"longitude":70.48,"organization":"Unclear","id":"3","incident_town":"Unclear","incident_district":"Unclear","age":null,"home_province":"Spain","notes_other_details":null},"type":"Feature","geometry":{"type":"Polygon","coordinates":[[[70.4801081081081,34.27],[70.4801060308411,34.2699789091544],[70.4800998788684,34.2699586288181],[70.4800898886067,34.2699399383532],[70.4800764439763,34.2699235560237],[70.4800600616468,34.2699101113933],[70.4800413711819,34.2699001211316],[70.4800210908456,34.2698939691589],[70.48,34.2698918918919],[70.4799789091544,34.2698939691589],[70.4799586288181,34.2699001211316],[70.4799399383532,34.2699101113933],[70.4799235560237,34.2699235560237],[70.4799101113933,34.2699399383532],[70.4799001211316,34.2699586288181],[70.4798939691589,34.2699789091544],[70.4798918918919,34.27],[70.4798939691589,34.2700210908456],[70.4799001211316,34.2700413711819],[70.4799101113933,34.2700600616468],[70.4799235560237,34.2700764439764],[70.4799399383532,34.2700898886067],[70.4799586288181,34.2700998788684],[70.4799789091544,34.2701060308411],[70.48,34.2701081081081],[70.4800210908456,34.2701060308411],[70.4800413711819,34.2700998788684],[70.4800600616468,34.2700898886067],[70.4800764439763,34.2700764439764],[70.4800898886067,34.2700600616468],[70.4800998788684,34.2700413711819],[70.4801060308411,34.2700210908456],[70.4801081081081,34.27]]]}},{"properties":{"occupation":"Journalist","home_town":"Unclear","month":11,"latitude":34.27,"suspected_attacker":"Unknown","unique_id":5,"date":{"end_time":"2001/11/28 00:00:00 -0500","original":"11/27/2001","granularity":"day","time":"2001/11/27 00:00:00 -0500"},"investigation_result":null,"gender":"Male","incident_reason":"Unclear","day":27,"incident_province":"Nangarhar","incident_type":"Killed","year":2001,"longitude":70.48,"organization":"Freelance","id":"4","incident_town":"Unclear","incident_district":"Unclear","age":null,"home_province":"Sweden","notes_other_details":null},"type":"Feature","geometry":{"type":"Polygon","coordinates":[[[70.4801081081081,34.27],[70.4801060308411,34.2699789091544],[70.4800998788684,34.2699586288181],[70.4800898886067,34.2699399383532],[70.4800764439763,34.2699235560237],[70.4800600616468,34.2699101113933],[70.4800413711819,34.2699001211316],[70.4800210908456,34.2698939691589],[70.48,34.2698918918919],[70.4799789091544,34.2698939691589],[70.4799586288181,34.2699001211316],[70.4799399383532,34.2699101113933],[70.4799235560237,34.2699235560237],[70.4799101113933,34.2699399383532],[70.4799001211316,34.2699586288181],[70.4798939691589,34.2699789091544],[70.4798918918919,34.27],[70.4798939691589,34.2700210908456],[70.4799001211316,34.2700413711819],[70.4799101113933,34.2700600616468],[70.4799235560237,34.2700764439764],[70.4799399383532,34.2700898886067],[70.4799586288181,34.2700998788684],[70.4799789091544,34.2701060308411],[70.48,34.2701081081081],[70.4800210908456,34.2701060308411],[70.4800413711819,34.2700998788684],[70.4800600616468,34.2700898886067],[70.4800764439763,34.2700764439764],[70.4800898886067,34.2700600616468],[70.4800998788684,34.2700413711819],[70.4801060308411,34.2700210908456],[70.4801081081081,34.27]]]}},{"properties":{"occupation":"Journalist","home_town":"Unclear","month":8,"latitude":34.55,"suspected_attacker":"Unknown","unique_id":6,"date":{"end_time":"2002/08/29 00:00:00 -0400","original":"8/28/2002","granularity":"day","time":"2002/08/28 00:00:00 -0400"},"investigation_result":null,"gender":"Male","incident_reason":"Unclear","day":28,"incident_province":"Kabul","incident_type":"Killed","year":2002,"longitude":69.33,"organization":"Freelance","id":"5","incident_town":"Unclear","incident_district":"Unclear","age":null,"home_province":"New Zealand","notes_other_details":null},"type":"Feature","geometry":{"type":"Polygon","coordinates":[[[69.3301081081081,34.55],[69.3301060308411,34.5499789091544],[69.3300998788684,34.5499586288181],[69.3300898886067,34.5499399383532],[69.3300764439763,34.5499235560236],[69.3300600616468,34.5499101113933],[69.3300413711819,34.5499001211316],[69.3300210908456,34.5498939691589],[69.33,34.5498918918919],[69.3299789091544,34.5498939691589],[69.3299586288181,34.5499001211316],[69.3299399383532,34.5499101113933],[69.3299235560237,34.5499235560236],[69.3299101113933,34.5499399383532],[69.3299001211316,34.5499586288181],[69.3298939691589,34.5499789091544],[69.3298918918919,34.55],[69.3298939691589,34.5500210908456],[69.3299001211316,34.5500413711819],[69.3299101113933,34.5500600616468],[69.3299235560237,34.5500764439763],[69.3299399383532,34.5500898886067],[69.3299586288181,34.5500998788684],[69.3299789091544,34.5501060308411],[69.33,34.5501081081081],[69.3300210908456,34.5501060308411],[69.3300413711819,34.5500998788684],[69.3300600616468,34.5500898886067],[69.3300764439763,34.5500764439763],[69.3300898886067,34.5500600616468],[69.3300998788684,34.5500413711819],[69.3301060308411,34.5500210908456],[69.3301081081081,34.55]]]}},{"properties":{"occupation":"Journalist","home_town":"Kabul","month":8,"latitude":34.55,"suspected_attacker":"Unknown","unique_id":7,"date":{"end_time":"2004/08/04 00:00:00 -0400","original":"8/3/2004","granularity":"day","time":"2004/08/03 00:00:00 -0400"},"investigation_result":null,"gender":"Male","incident_reason":"Reporting","day":3,"incident_province":"Kabul","incident_type":"Threatened","year":2004,"longitude":69.33,"organization":"Salam Watandar","id":"6","incident_town":"Kabul","incident_district":"Kabul","age":null,"home_province":"Kabul","notes_other_details":null},"type":"Feature","geometry":{"type":"Polygon","coordinates":[[[69.3301081081081,34.55],[69.3301060308411,34.5499789091544],[69.3300998788684,34.5499586288181],[69.3300898886067,34.5499399383532],[69.3300764439763,34.5499235560236],[69.3300600616468,34.5499101113933],[69.3300413711819,34.5499001211316],[69.3300210908456,34.5498939691589],[69.33,34.5498918918919],[69.3299789091544,34.5498939691589],[69.3299586288181,34.5499001211316],[69.3299399383532,34.5499101113933],[69.3299235560237,34.5499235560236],[69.3299101113933,34.5499399383532],[69.3299001211316,34.5499586288181],[69.3298939691589,34.5499789091544],[69.3298918918919,34.55],[69.3298939691589,34.5500210908456],[69.3299001211316,34.5500413711819],[69.3299101113933,34.5500600616468],[69.3299235560237,34.5500764439763],[69.3299399383532,34.5500898886067],[69.3299586288181,34.5500998788684],[69.3299789091544,34.5501060308411],[69.33,34.5501081081081],[69.3300210908456,34.5501060308411],[69.3300413711819,34.5500998788684],[69.3300600616468,34.5500898886067],[69.3300764439763,34.5500764439763],[69.3300898886067,34.5500600616468],[69.3300998788684,34.5500413711819],[69.3301060308411,34.5500210908456],[69.3301081081081,34.55]]]}},{"properties":{"occupation":"Journalist","home_town":"Taluqan","month":5,"latitude":36.7,"suspected_attacker":"Unknown","unique_id":8,"date":{"end_time":"2005/05/05 00:00:00 -0400","original":"5/4/2005","granularity":"day","time":"2005/05/04 00:00:00 -0400"},"investigation_result":null,"gender":"Male","incident_reason":"Reporting","day":4,"incident_province":"Takhar","incident_type":"Threatened","year":2005,"longitude":69.78,"organization":"Tkharestan FM","id":"7","incident_town":"Taluqan City","incident_district":"Taluqan City","age":null,"home_province":"Takhar","notes_other_details":null},"type":"Feature","geometry":{"type":"Polygon","coordinates":[[[69.7801081081081,36.7],[69.7801060308411,36.6999789091544],[69.7800998788684,36.6999586288181],[69.7800898886067,36.6999399383532],[69.7800764439763,36.6999235560237],[69.7800600616468,36.6999101113933],[69.7800413711819,36.6999001211316],[69.7800210908456,36.6998939691589],[69.78,36.6998918918919],[69.7799789091544,36.6998939691589],[69.7799586288181,36.6999001211316],[69.7799399383532,36.6999101113933],[69.7799235560237,36.6999235560237],[69.7799101113933,36.6999399383532],[69.7799001211316,36.6999586288181],[69.7798939691589,36.6999789091544],[69.7798918918919,36.7],[69.7798939691589,36.7000210908456],[69.7799001211316,36.7000413711819],[69.7799101113933,36.7000600616468],[69.7799235560237,36.7000764439764],[69.7799399383532,36.7000898886067],[69.7799586288181,36.7000998788684],[69.7799789091544,36.7001060308411],[69.78,36.7001081081081],[69.7800210908456,36.7001060308411],[69.7800413711819,36.7000998788684],[69.7800600616468,36.7000898886067],[69.7800764439763,36.7000764439764],[69.7800898886067,36.7000600616468],[69.7800998788684,36.7000413711819],[69.7801060308411,36.7000210908456],[69.7801081081081,36.7]]]}},{"properties":{"occupation":"Journalist","home_town":"Sheberghan","month":5,"latitude":36.83,"suspected_attacker":"Unknown","unique_id":9,"date":{"end_time":"2005/05/05 00:00:00 -0400","original":"5/4/2005","granularity":"day","time":"2005/05/04 00:00:00 -0400"},"investigation_result":null,"gender":"Male","incident_reason":"Reporting","day":4,"incident_province":"Jawzjan","incident_type":"Beaten","year":2005,"longitude":65.85,"organization":"Aina TV","id":"8","incident_town":"Shberghan","incident_district":"Shberghan","age":null,"home_province":"Jawzjan","notes_other_details":null},"type":"Feature","geometry":{"type":"Polygon","coordinates":[[[65.8501081081081,36.83],[65.8501060308411,36.8299789091544],[65.8500998788684,36.8299586288181],[65.8500898886067,36.8299399383532],[65.8500764439763,36.8299235560237],[65.8500600616468,36.8299101113933],[65.8500413711819,36.8299001211316],[65.8500210908456,36.8298939691589],[65.85,36.8298918918919],[65.8499789091544,36.8298939691589],[65.8499586288181,36.8299001211316],[65.8499399383532,36.8299101113933],[65.8499235560237,36.8299235560237],[65.8499101113933,36.8299399383532],[65.8499001211316,36.8299586288181],[65.8498939691589,36.8299789091544],[65.8498918918919,36.83],[65.8498939691589,36.8300210908456],[65.8499001211316,36.8300413711819],[65.8499101113933,36.8300600616468],[65.8499235560237,36.8300764439763],[65.8499399383532,36.8300898886067],[65.8499586288181,36.8300998788684],[65.8499789091544,36.8301060308411],[65.85,36.8301081081081],[65.8500210908456,36.8301060308411],[65.8500413711819,36.8300998788684],[65.8500600616468,36.8300898886067],[65.8500764439763,36.8300764439763],[65.8500898886067,36.8300600616468],[65.8500998788684,36.8300413711819],[65.8501060308411,36.8300210908456],[65.8501081081081,36.83]]]}},{"properties":{"occupation":"TV Presenter","home_town":"Kabul","month":4,"latitude":34.55,"suspected_attacker":"Unknown","unique_id":10,"date":{"end_time":"2005/04/19 00:00:00 -0400","original":"4/18/2005","granularity":"day","time":"2005/04/18 00:00:00 -0400"},"investigation_result":null,"gender":"Female","incident_reason":"Woman on TV","day":18,"incident_province":"Kabul","incident_type":"Killed","year":2005,"longitude":69.33,"organization":"Tolo TV","id":"9","incident_town":"Kabul","incident_district":"Kabul","age":null,"home_province":"Kabul","notes_other_details":null},"type":"Feature","geometry":{"type":"Polygon","coordinates":[[[69.3301081081081,34.55],[69.3301060308411,34.5499789091544],[69.3300998788684,34.5499586288181],[69.3300898886067,34.5499399383532],[69.3300764439763,34.5499235560236],[69.3300600616468,34.5499101113933],[69.3300413711819,34.5499001211316],[69.3300210908456,34.5498939691589],[69.33,34.5498918918919],[69.3299789091544,34.5498939691589],[69.3299586288181,34.5499001211316],[69.3299399383532,34.5499101113933],[69.3299235560237,34.5499235560236],[69.3299101113933,34.5499399383532],[69.3299001211316,34.5499586288181],[69.3298939691589,34.5499789091544],[69.3298918918919,34.55],[69.3298939691589,34.5500210908456],[69.3299001211316,34.5500413711819],[69.3299101113933,34.5500600616468],[69.3299235560237,34.5500764439763],[69.3299399383532,34.5500898886067],[69.3299586288181,34.5500998788684],[69.3299789091544,34.5501060308411],[69.33,34.5501081081081],[69.3300210908456,34.5501060308411],[69.3300413711819,34.5500998788684],[69.3300600616468,34.5500898886067],[69.3300764439763,34.5500764439763],[69.3300898886067,34.5500600616468],[69.3300998788684,34.5500413711819],[69.3301060308411,34.5500210908456],[69.3301081081081,34.55]]]}},{"properties":{"occupation":"TV Presenter","home_town":"Kabul","month":7,"latitude":34.55,"suspected_attacker":"Government","unique_id":11,"date":{"end_time":"2005/07/04 00:00:00 -0400","original":"7/3/2005","granularity":"day","time":"2005/07/03 00:00:00 -0400"},"investigation_result":null,"gender":"Male","incident_reason":"Seen on TV in new style","day":3,"incident_province":"Kabul","incident_type":"Beaten","year":2005,"longitude":69.33,"organization":"Tolo TV","id":"10","incident_town":"Kabul City","incident_district":"Kabul City","age":null,"home_province":"Kabul","notes_other_details":null},"type":"Feature","geometry":{"type":"Polygon","coordinates":[[[69.3301081081081,34.55],[69.3301060308411,34.5499789091544],[69.3300998788684,34.5499586288181],[69.3300898886067,34.5499399383532],[69.3300764439763,34.5499235560236],[69.3300600616468,34.5499101113933],[69.3300413711819,34.5499001211316],[69.3300210908456,34.5498939691589],[69.33,34.5498918918919],[69.3299789091544,34.5498939691589],[69.3299586288181,34.5499001211316],[69.3299399383532,34.5499101113933],[69.3299235560237,34.5499235560236],[69.3299101113933,34.5499399383532],[69.3299001211316,34.5499586288181],[69.3298939691589,34.5499789091544],[69.3298918918919,34.55],[69.3298939691589,34.5500210908456],[69.3299001211316,34.5500413711819],[69.3299101113933,34.5500600616468],[69.3299235560237,34.5500764439763],[69.3299399383532,34.5500898886067],[69.3299586288181,34.5500998788684],[69.3299789091544,34.5501060308411],[69.33,34.5501081081081],[69.3300210908456,34.5501060308411],[69.3300413711819,34.5500998788684],[69.3300600616468,34.5500898886067],[69.3300764439763,34.5500764439763],[69.3300898886067,34.5500600616468],[69.3300998788684,34.5500413711819],[69.3301060308411,34.5500210908456],[69.3301081081081,34.55]]]}},{"properties":{"occupation":"Reporter","home_town":"Kabul","month":7,"latitude":34.55,"suspected_attacker":"Unknown","unique_id":12,"date":{"end_time":"2001/07/04 00:00:00 -0400","original":"7/3/2001","granularity":"day","time":"2001/07/03 00:00:00 -0400"},"investigation_result":null,"gender":"Male","incident_reason":"Publishing an article","day":3,"incident_province":"Kabul","incident_type":"Beaten","year":2001,"longitude":69.33,"organization":"Aftab Weekly","id":"11","incident_town":"Kabul City","incident_district":"Kabul City","age":null,"home_province":"Kabul","notes_other_details":null},"type":"Feature","geometry":{"type":"Polygon","coordinates":[[[69.3301081081081,34.55],[69.3301060308411,34.5499789091544],[69.3300998788684,34.5499586288181],[69.3300898886067,34.5499399383532],[69.3300764439763,34.5499235560236],[69.3300600616468,34.5499101113933],[69.3300413711819,34.5499001211316],[69.3300210908456,34.5498939691589],[69.33,34.5498918918919],[69.3299789091544,34.5498939691589],[69.3299586288181,34.5499001211316],[69.3299399383532,34.5499101113933],[69.3299235560237,34.5499235560236],[69.3299101113933,34.5499399383532],[69.3299001211316,34.5499586288181],[69.3298939691589,34.5499789091544],[69.3298918918919,34.55],[69.3298939691589,34.5500210908456],[69.3299001211316,34.5500413711819],[69.3299101113933,34.5500600616468],[69.3299235560237,34.5500764439763],[69.3299399383532,34.5500898886067],[69.3299586288181,34.5500998788684],[69.3299789091544,34.5501060308411],[69.33,34.5501081081081],[69.3300210908456,34.5501060308411],[69.3300413711819,34.5500998788684],[69.3300600616468,34.5500898886067],[69.3300764439763,34.5500764439763],[69.3300898886067,34.5500600616468],[69.3300998788684,34.5500413711819],[69.3301060308411,34.5500210908456],[69.3301081081081,34.55]]]}},{"properties":{"occupation":"Reporter","home_town":"Kabul","month":7,"latitude":34.55,"suspected_attacker":"Government","unique_id":13,"date":{"end_time":"2005/07/04 00:00:00 -0400","original":"7/3/2005","granularity":"day","time":"2005/07/03 00:00:00 -0400"},"investigation_result":null,"gender":"Male","incident_reason":"Reporting","day":3,"incident_province":"Kabul","incident_type":"Threatened","year":2005,"longitude":69.33,"organization":"Pajhwok","id":"12","incident_town":"Kabul","incident_district":"Kabul","age":null,"home_province":"Kabul","notes_other_details":null},"type":"Feature","geometry":{"type":"Polygon","coordinates":[[[69.3301081081081,34.55],[69.3301060308411,34.5499789091544],[69.3300998788684,34.5499586288181],[69.3300898886067,34.5499399383532],[69.3300764439763,34.5499235560236],[69.3300600616468,34.5499101113933],[69.3300413711819,34.5499001211316],[69.3300210908456,34.5498939691589],[69.33,34.5498918918919],[69.3299789091544,34.5498939691589],[69.3299586288181,34.5499001211316],[69.3299399383532,34.5499101113933],[69.3299235560237,34.5499235560236],[69.3299101113933,34.5499399383532],[69.3299001211316,34.5499586288181],[69.3298939691589,34.5499789091544],[69.3298918918919,34.55],[69.3298939691589,34.5500210908456],[69.3299001211316,34.5500413711819],[69.3299101113933,34.5500600616468],[69.3299235560237,34.5500764439763],[69.3299399383532,34.5500898886067],[69.3299586288181,34.5500998788684],[69.3299789091544,34.5501060308411],[69.33,34.5501081081081],[69.3300210908456,34.5501060308411],[69.3300413711819,34.5500998788684],[69.3300600616468,34.5500898886067],[69.3300764439763,34.5500764439763],[69.3300898886067,34.5500600616468],[69.3300998788684,34.5500413711819],[69.3301060308411,34.5500210908456],[69.3301081081081,34.55]]]}},{"properties":{"occupation":"Reporter","home_town":"Kabul","month":7,"latitude":34.55,"suspected_attacker":"Government","unique_id":14,"date":{"end_time":"2005/07/06 00:00:00 -0400","original":"7/5/2005","granularity":"day","time":"2005/07/05 00:00:00 -0400"},"investigation_result":null,"gender":"Male","incident_reason":"Reporting","day":5,"incident_province":"Kabul","incident_type":"Threatened","year":2005,"longitude":69.33,"organization":"Pajhwok","id":"13","incident_town":"Kabul City","incident_district":"Kabul City","age":null,"home_province":"Kabul","notes_other_details":null},"type":"Feature","geometry":{"type":"Polygon","coordinates":[[[69.3301081081081,34.55],[69.3301060308411,34.5499789091544],[69.3300998788684,34.5499586288181],[69.3300898886067,34.5499399383532],[69.3300764439763,34.5499235560236],[69.3300600616468,34.5499101113933],[69.3300413711819,34.5499001211316],[69.3300210908456,34.5498939691589],[69.33,34.5498918918919],[69.3299789091544,34.5498939691589],[69.3299586288181,34.5499001211316],[69.3299399383532,34.5499101113933],[69.3299235560237,34.5499235560236],[69.3299101113933,34.5499399383532],[69.3299001211316,34.5499586288181],[69.3298939691589,34.5499789091544],[69.3298918918919,34.55],[69.3298939691589,34.5500210908456],[69.3299001211316,34.5500413711819],[69.3299101113933,34.5500600616468],[69.3299235560237,34.5500764439763],[69.3299399383532,34.5500898886067],[69.3299586288181,34.5500998788684],[69.3299789091544,34.5501060308411],[69.33,34.5501081081081],[69.3300210908456,34.5501060308411],[69.3300413711819,34.5500998788684],[69.3300600616468,34.5500898886067],[69.3300764439763,34.5500764439763],[69.3300898886067,34.5500600616468],[69.3300998788684,34.5500413711819],[69.3301060308411,34.5500210908456],[69.3301081081081,34.55]]]}},{"properties":{"occupation":"Journalist","home_town":"Kabul","month":7,"latitude":34.55,"suspected_attacker":"Government","unique_id":15,"date":{"end_time":"2005/07/14 00:00:00 -0400","original":"7/13/2005","granularity":"day","time":"2005/07/13 00:00:00 -0400"},"investigation_result":null,"gender":"Male","incident_reason":"Reporting","day":13,"incident_province":"Kabul","incident_type":"Beaten","year":2005,"longitude":69.33,"organization":"Chye dagh Weekly","id":"14","incident_town":"Kabul City","incident_district":"Kabul City","age":null,"home_province":"Kabul","notes_other_details":null},"type":"Feature","geometry":{"type":"Polygon","coordinates":[[[69.3301081081081,34.55],[69.3301060308411,34.5499789091544],[69.3300998788684,34.5499586288181],[69.3300898886067,34.5499399383532],[69.3300764439763,34.5499235560236],[69.3300600616468,34.5499101113933],[69.3300413711819,34.5499001211316],[69.3300210908456,34.5498939691589],[69.33,34.5498918918919],[69.3299789091544,34.5498939691589],[69.3299586288181,34.5499001211316],[69.3299399383532,34.5499101113933],[69.3299235560237,34.5499235560236],[69.3299101113933,34.5499399383532],[69.3299001211316,34.5499586288181],[69.3298939691589,34.5499789091544],[69.3298918918919,34.55],[69.3298939691589,34.5500210908456],[69.3299001211316,34.5500413711819],[69.3299101113933,34.5500600616468],[69.3299235560237,34.5500764439763],[69.3299399383532,34.5500898886067],[69.3299586288181,34.5500998788684],[69.3299789091544,34.5501060308411],[69.33,34.5501081081081],[69.3300210908456,34.5501060308411],[69.3300413711819,34.5500998788684],[69.3300600616468,34.5500898886067],[69.3300764439763,34.5500764439763],[69.3300898886067,34.5500600616468],[69.3300998788684,34.5500413711819],[69.3301060308411,34.5500210908456],[69.3301081081081,34.55]]]}},{"properties":{"occupation":"Journalist","home_town":"Kabul","month":9,"latitude":34.55,"suspected_attacker":"Government","unique_id":16,"date":{"end_time":"2005/09/09 00:00:00 -0400","original":"9/8/2005","granularity":"day","time":"2005/09/08 00:00:00 -0400"},"investigation_result":null,"gender":"Male","incident_reason":"Reporting","day":8,"incident_province":"Kabul","incident_type":"Beaten","year":2005,"longitude":69.33,"organization":"Sadaye afghan news agency","id":"15","incident_town":"Kabul City","incident_district":"Kabul City","age":null,"home_province":"Kabul","notes_other_details":null},"type":"Feature","geometry":{"type":"Polygon","coordinates":[[[69.3301081081081,34.55],[69.3301060308411,34.5499789091544],[69.3300998788684,34.5499586288181],[69.3300898886067,34.5499399383532],[69.3300764439763,34.5499235560236],[69.3300600616468,34.5499101113933],[69.3300413711819,34.5499001211316],[69.3300210908456,34.5498939691589],[69.33,34.5498918918919],[69.3299789091544,34.5498939691589],[69.3299586288181,34.5499001211316],[69.3299399383532,34.5499101113933],[69.3299235560237,34.5499235560236],[69.3299101113933,34.5499399383532],[69.3299001211316,34.5499586288181],[69.3298939691589,34.5499789091544],[69.3298918918919,34.55],[69.3298939691589,34.5500210908456],[69.3299001211316,34.5500413711819],[69.3299101113933,34.5500600616468],[69.3299235560237,34.5500764439763],[69.3299399383532,34.5500898886067],[69.3299586288181,34.5500998788684],[69.3299789091544,34.5501060308411],[69.33,34.5501081081081],[69.3300210908456,34.5501060308411],[69.3300413711819,34.5500998788684],[69.3300600616468,34.5500898886067],[69.3300764439763,34.5500764439763],[69.3300898886067,34.5500600616468],[69.3300998788684,34.5500413711819],[69.3301060308411,34.5500210908456],[69.3301081081081,34.55]]]}},{"properties":{"occupation":"Journalist","home_town":"Kabul","month":9,"latitude":34.55,"suspected_attacker":"Government","unique_id":17,"date":{"end_time":"2005/09/09 00:00:00 -0400","original":"9/8/2005","granularity":"day","time":"2005/09/08 00:00:00 -0400"},"investigation_result":null,"gender":"Male","incident_reason":"Reporting","day":8,"incident_province":"Kabul","incident_type":"Beaten","year":2005,"longitude":69.33,"organization":"Sadaye afghan news agency","id":"16","incident_town":"Kabul City","incident_district":"Kabul City","age":null,"home_province":"Kabul","notes_other_details":null},"type":"Feature","geometry":{"type":"Polygon","coordinates":[[[69.3301081081081,34.55],[69.3301060308411,34.5499789091544],[69.3300998788684,34.5499586288181],[69.3300898886067,34.5499399383532],[69.3300764439763,34.5499235560236],[69.3300600616468,34.5499101113933],[69.3300413711819,34.5499001211316],[69.3300210908456,34.5498939691589],[69.33,34.5498918918919],[69.3299789091544,34.5498939691589],[69.3299586288181,34.5499001211316],[69.3299399383532,34.5499101113933],[69.3299235560237,34.5499235560236],[69.3299101113933,34.5499399383532],[69.3299001211316,34.5499586288181],[69.3298939691589,34.5499789091544],[69.3298918918919,34.55],[69.3298939691589,34.5500210908456],[69.3299001211316,34.5500413711819],[69.3299101113933,34.5500600616468],[69.3299235560237,34.5500764439763],[69.3299399383532,34.5500898886067],[69.3299586288181,34.5500998788684],[69.3299789091544,34.5501060308411],[69.33,34.5501081081081],[69.3300210908456,34.5501060308411],[69.3300413711819,34.5500998788684],[69.3300600616468,34.5500898886067],[69.3300764439763,34.5500764439763],[69.3300898886067,34.5500600616468],[69.3300998788684,34.5500413711819],[69.3301060308411,34.5500210908456],[69.3301081081081,34.55]]]}},{"properties":{"occupation":"Journalist","home_town":"Kabul","month":9,"latitude":35.42,"suspected_attacker":"un known armed men","unique_id":18,"date":{"end_time":"2005/09/15 00:00:00 -0400","original":"9/14/2005","granularity":"day","time":"2005/09/14 00:00:00 -0400"},"investigation_result":null,"gender":"Male","incident_reason":"Reporting","day":14,"incident_province":"Nuristan","incident_type":"Kidnapped","year":2005,"longitude":70.79,"organization":"Bamiyan Weekly","id":"17","incident_town":"Waigal District","incident_district":"Waigal District","age":null,"home_province":"Kabul","notes_other_details":null},"type":"Feature","geometry":{"type":"Polygon","coordinates":[[[70.7901081081081,35.42],[70.7901060308411,35.4199789091544],[70.7900998788684,35.4199586288181],[70.7900898886067,35.4199399383532],[70.7900764439763,35.4199235560237],[70.7900600616468,35.4199101113933],[70.7900413711819,35.4199001211316],[70.7900210908456,35.4198939691589],[70.79,35.4198918918919],[70.7899789091544,35.4198939691589],[70.7899586288181,35.4199001211316],[70.7899399383532,35.4199101113933],[70.7899235560237,35.4199235560237],[70.7899101113933,35.4199399383532],[70.7899001211316,35.4199586288181],[70.7898939691589,35.4199789091544],[70.7898918918919,35.42],[70.7898939691589,35.4200210908456],[70.7899001211316,35.4200413711819],[70.7899101113933,35.4200600616468],[70.7899235560237,35.4200764439763],[70.7899399383532,35.4200898886067],[70.7899586288181,35.4200998788684],[70.7899789091544,35.4201060308411],[70.79,35.4201081081081],[70.7900210908456,35.4201060308411],[70.7900413711819,35.4200998788684],[70.7900600616468,35.4200898886067],[70.7900764439763,35.4200764439763],[70.7900898886067,35.4200600616468],[70.7900998788684,35.4200413711819],[70.7901060308411,35.4200210908456],[70.7901081081081,35.42]]]}},{"properties":{"occupation":"Journalist","home_town":"Kabul","month":7,"latitude":34.55,"suspected_attacker":"Government","unique_id":19,"date":{"end_time":"2005/07/15 00:00:00 -0400","original":"7/14/2005","granularity":"day","time":"2005/07/14 00:00:00 -0400"},"investigation_result":null,"gender":"Male","incident_reason":"Reporting","day":14,"incident_province":"Kabul","incident_type":"Beaten","year":2005,"longitude":69.33,"organization":"Aina TV","id":"18","incident_town":"Kabul City","incident_district":"Kabul City","age":null,"home_province":"Kabul","notes_other_details":null},"type":"Feature","geometry":{"type":"Polygon","coordinates":[[[69.3301081081081,34.55],[69.3301060308411,34.5499789091544],[69.3300998788684,34.5499586288181],[69.3300898886067,34.5499399383532],[69.3300764439763,34.5499235560236],[69.3300600616468,34.5499101113933],[69.3300413711819,34.5499001211316],[69.3300210908456,34.5498939691589],[69.33,34.5498918918919],[69.3299789091544,34.5498939691589],[69.3299586288181,34.5499001211316],[69.3299399383532,34.5499101113933],[69.3299235560237,34.5499235560236],[69.3299101113933,34.5499399383532],[69.3299001211316,34.5499586288181],[69.3298939691589,34.5499789091544],[69.3298918918919,34.55],[69.3298939691589,34.5500210908456],[69.3299001211316,34.5500413711819],[69.3299101113933,34.5500600616468],[69.3299235560237,34.5500764439763],[69.3299399383532,34.5500898886067],[69.3299586288181,34.5500998788684],[69.3299789091544,34.5501060308411],[69.33,34.5501081081081],[69.3300210908456,34.5501060308411],[69.3300413711819,34.5500998788684],[69.3300600616468,34.5500898886067],[69.3300764439763,34.5500764439763],[69.3300898886067,34.5500600616468],[69.3300998788684,34.5500413711819],[69.3301060308411,34.5500210908456],[69.3301081081081,34.55]]]}},{"properties":{"occupation":"Journalist","home_town":"Kabul","month":7,"latitude":34.55,"suspected_attacker":"Government","unique_id":20,"date":{"end_time":"2005/07/15 00:00:00 -0400","original":"7/14/2005","granularity":"day","time":"2005/07/14 00:00:00 -0400"},"investigation_result":null,"gender":"Male","incident_reason":"Reporting","day":14,"incident_province":"Kabul","incident_type":"Beaten","year":2005,"longitude":69.33,"organization":"Aina TV","id":"19","incident_town":"Kabul City","incident_district":"Kabul City","age":null,"home_province":"Kabul","notes_other_details":null},"type":"Feature","geometry":{"type":"Polygon","coordinates":[[[69.3301081081081,34.55],[69.3301060308411,34.5499789091544],[69.3300998788684,34.5499586288181],[69.3300898886067,34.5499399383532],[69.3300764439763,34.5499235560236],[69.3300600616468,34.5499101113933],[69.3300413711819,34.5499001211316],[69.3300210908456,34.5498939691589],[69.33,34.5498918918919],[69.3299789091544,34.5498939691589],[69.3299586288181,34.5499001211316],[69.3299399383532,34.5499101113933],[69.3299235560237,34.5499235560236],[69.3299101113933,34.5499399383532],[69.3299001211316,34.5499586288181],[69.3298939691589,34.5499789091544],[69.3298918918919,34.55],[69.3298939691589,34.5500210908456],[69.3299001211316,34.5500413711819],[69.3299101113933,34.5500600616468],[69.3299235560237,34.5500764439763],[69.3299399383532,34.5500898886067],[69.3299586288181,34.5500998788684],[69.3299789091544,34.5501060308411],[69.33,34.5501081081081],[69.3300210908456,34.5501060308411],[69.3300413711819,34.5500998788684],[69.3300600616468,34.5500898886067],[69.3300764439763,34.5500764439763],[69.3300898886067,34.5500600616468],[69.3300998788684,34.5500413711819],[69.3301060308411,34.5500210908456],[69.3301081081081,34.55]]]}},{"properties":{"occupation":"Journalist","home_town":"Kabul","month":10,"latitude":34.55,"suspected_attacker":"Government","unique_id":21,"date":{"end_time":"2005/10/02 00:00:00 -0400","original":"10/1/2005","granularity":"day","time":"2005/10/01 00:00:00 -0400"},"investigation_result":null,"gender":"Male","incident_reason":"Publishing an article about apostasy","day":1,"incident_province":"Kabul","incident_type":"Arrested","year":2005,"longitude":69.33,"organization":"Women's Rights Magazine","id":"20","incident_town":"Kabul City","incident_district":"Kabul City","age":null,"home_province":"Kabul","notes_other_details":null},"type":"Feature","geometry":{"type":"Polygon","coordinates":[[[69.3301081081081,34.55],[69.3301060308411,34.5499789091544],[69.3300998788684,34.5499586288181],[69.3300898886067,34.5499399383532],[69.3300764439763,34.5499235560236],[69.3300600616468,34.5499101113933],[69.3300413711819,34.5499001211316],[69.3300210908456,34.5498939691589],[69.33,34.5498918918919],[69.3299789091544,34.5498939691589],[69.3299586288181,34.5499001211316],[69.3299399383532,34.5499101113933],[69.3299235560237,34.5499235560236],[69.3299101113933,34.5499399383532],[69.3299001211316,34.5499586288181],[69.3298939691589,34.5499789091544],[69.3298918918919,34.55],[69.3298939691589,34.5500210908456],[69.3299001211316,34.5500413711819],[69.3299101113933,34.5500600616468],[69.3299235560237,34.5500764439763],[69.3299399383532,34.5500898886067],[69.3299586288181,34.5500998788684],[69.3299789091544,34.5501060308411],[69.33,34.5501081081081],[69.3300210908456,34.5501060308411],[69.3300413711819,34.5500998788684],[69.3300600616468,34.5500898886067],[69.3300764439763,34.5500764439763],[69.3300898886067,34.5500600616468],[69.3300998788684,34.5500413711819],[69.3301060308411,34.5500210908456],[69.3301081081081,34.55]]]}},{"properties":{"occupation":"Journalist","home_town":"Khost City","month":11,"latitude":33.38,"suspected_attacker":null,"unique_id":22,"date":{"end_time":"2005/12/01 00:00:00 -0500","original":"11/30/2005","granularity":"day","time":"2005/11/30 00:00:00 -0500"},"investigation_result":null,"gender":"Male","incident_reason":"Roadside bomb near army base","day":30,"incident_province":"Khost","incident_type":"Killed","year":2005,"longitude":69.83,"organization":"Soli Paygham Radio","id":"21","incident_town":"Haidar Khil District","incident_district":"Haidar Khil District","age":null,"home_province":"Khost","notes_other_details":null},"type":"Feature","geometry":{"type":"Polygon","coordinates":[[[69.8301081081081,33.38],[69.8301060308411,33.3799789091544],[69.8300998788684,33.3799586288181],[69.8300898886067,33.3799399383532],[69.8300764439763,33.3799235560237],[69.8300600616468,33.3799101113933],[69.8300413711819,33.3799001211316],[69.8300210908456,33.3798939691589],[69.83,33.3798918918919],[69.8299789091544,33.3798939691589],[69.8299586288181,33.3799001211316],[69.8299399383532,33.3799101113933],[69.8299235560237,33.3799235560237],[69.8299101113933,33.3799399383532],[69.8299001211316,33.3799586288181],[69.8298939691589,33.3799789091544],[69.8298918918919,33.38],[69.8298939691589,33.3800210908456],[69.8299001211316,33.3800413711819],[69.8299101113933,33.3800600616468],[69.8299235560237,33.3800764439763],[69.8299399383532,33.3800898886067],[69.8299586288181,33.3800998788684],[69.8299789091544,33.3801060308411],[69.83,33.3801081081081],[69.8300210908456,33.3801060308411],[69.8300413711819,33.3800998788684],[69.8300600616468,33.3800898886067],[69.8300764439763,33.3800764439763],[69.8300898886067,33.3800600616468],[69.8300998788684,33.3800413711819],[69.8301060308411,33.3800210908456],[69.8301081081081,33.38]]]}},{"properties":{"occupation":"Journalist","home_town":"Unclear","month":11,"latitude":35.8,"suspected_attacker":"Baghlan police comonder","unique_id":23,"date":{"end_time":"2005/12/01 00:00:00 -0500","original":"11/30/2005","granularity":"day","time":"2005/11/30 00:00:00 -0500"},"investigation_result":null,"gender":"Male","incident_reason":"Asking question from Baghlan police commander about a bomb blast","day":30,"incident_province":"Baghlan","incident_type":"Threatened","year":2005,"longitude":68.91,"organization":"Pajhwok","id":"22","incident_town":"Pol-e-Khomri City","incident_district":"Pol-e-Khomri City","age":null,"home_province":"Panjshir","notes_other_details":null},"type":"Feature","geometry":{"type":"Polygon","coordinates":[[[68.9101081081081,35.8],[68.9101060308411,35.7999789091544],[68.9100998788684,35.7999586288181],[68.9100898886067,35.7999399383532],[68.9100764439763,35.7999235560236],[68.9100600616468,35.7999101113933],[68.9100413711819,35.7999001211316],[68.9100210908456,35.7998939691589],[68.91,35.7998918918919],[68.9099789091544,35.7998939691589],[68.9099586288181,35.7999001211316],[68.9099399383532,35.7999101113933],[68.9099235560237,35.7999235560236],[68.9099101113933,35.7999399383532],[68.9099001211316,35.7999586288181],[68.9098939691589,35.7999789091544],[68.9098918918919,35.8],[68.9098939691589,35.8000210908456],[68.9099001211316,35.8000413711819],[68.9099101113933,35.8000600616468],[68.9099235560237,35.8000764439763],[68.9099399383532,35.8000898886067],[68.9099586288181,35.8000998788684],[68.9099789091544,35.8001060308411],[68.91,35.8001081081081],[68.9100210908456,35.8001060308411],[68.9100413711819,35.8000998788684],[68.9100600616468,35.8000898886067],[68.9100764439763,35.8000764439763],[68.9100898886067,35.8000600616468],[68.9100998788684,35.8000413711819],[68.9101060308411,35.8000210908456],[68.9101081081081,35.8]]]}},{"properties":{"occupation":"Journalist","home_town":"Kabul City","month":12,"latitude":34.55,"suspected_attacker":"Police","unique_id":24,"date":{"end_time":"2005/12/13 00:00:00 -0500","original":"12/12/2005","granularity":"day","time":"2005/12/12 00:00:00 -0500"},"investigation_result":null,"gender":"Male","incident_reason":"Reporting from demonstration","day":12,"incident_province":"Kabul","incident_type":"Beaten","year":2005,"longitude":69.33,"organization":"Aryana TV","id":"23","incident_town":"Kabul City","incident_district":"Kabul City","age":null,"home_province":"Kabul","notes_other_details":null},"type":"Feature","geometry":{"type":"Polygon","coordinates":[[[69.3301081081081,34.55],[69.3301060308411,34.5499789091544],[69.3300998788684,34.5499586288181],[69.3300898886067,34.5499399383532],[69.3300764439763,34.5499235560236],[69.3300600616468,34.5499101113933],[69.3300413711819,34.5499001211316],[69.3300210908456,34.5498939691589],[69.33,34.5498918918919],[69.3299789091544,34.5498939691589],[69.3299586288181,34.5499001211316],[69.3299399383532,34.5499101113933],[69.3299235560237,34.5499235560236],[69.3299101113933,34.5499399383532],[69.3299001211316,34.5499586288181],[69.3298939691589,34.5499789091544],[69.3298918918919,34.55],[69.3298939691589,34.5500210908456],[69.3299001211316,34.5500413711819],[69.3299101113933,34.5500600616468],[69.3299235560237,34.5500764439763],[69.3299399383532,34.5500898886067],[69.3299586288181,34.5500998788684],[69.3299789091544,34.5501060308411],[69.33,34.5501081081081],[69.3300210908456,34.5501060308411],[69.3300413711819,34.5500998788684],[69.3300600616468,34.5500898886067],[69.3300764439763,34.5500764439763],[69.3300898886067,34.5500600616468],[69.3300998788684,34.5500413711819],[69.3301060308411,34.5500210908456],[69.3301081081081,34.55]]]}},{"properties":{"occupation":"Camera Man","home_town":"Kabul City","month":12,"latitude":34.55,"suspected_attacker":"Police","unique_id":25,"date":{"end_time":"2005/12/13 00:00:00 -0500","original":"12/12/2005","granularity":"day","time":"2005/12/12 00:00:00 -0500"},"investigation_result":null,"gender":"Male","incident_reason":"Reporting from demonstration","day":12,"incident_province":"Kabul","incident_type":"Beaten","year":2005,"longitude":69.33,"organization":"Aryana TV","id":"24","incident_town":"Kabul City","incident_district":"Kabul City","age":null,"home_province":"Kabul","notes_other_details":null},"type":"Feature","geometry":{"type":"Polygon","coordinates":[[[69.3301081081081,34.55],[69.3301060308411,34.5499789091544],[69.3300998788684,34.5499586288181],[69.3300898886067,34.5499399383532],[69.3300764439763,34.5499235560236],[69.3300600616468,34.5499101113933],[69.3300413711819,34.5499001211316],[69.3300210908456,34.5498939691589],[69.33,34.5498918918919],[69.3299789091544,34.5498939691589],[69.3299586288181,34.5499001211316],[69.3299399383532,34.5499101113933],[69.3299235560237,34.5499235560236],[69.3299101113933,34.5499399383532],[69.3299001211316,34.5499586288181],[69.3298939691589,34.5499789091544],[69.3298918918919,34.55],[69.3298939691589,34.5500210908456],[69.3299001211316,34.5500413711819],[69.3299101113933,34.5500600616468],[69.3299235560237,34.5500764439763],[69.3299399383532,34.5500898886067],[69.3299586288181,34.5500998788684],[69.3299789091544,34.5501060308411],[69.33,34.5501081081081],[69.3300210908456,34.5501060308411],[69.3300413711819,34.5500998788684],[69.3300600616468,34.5500898886067],[69.3300764439763,34.5500764439763],[69.3300898886067,34.5500600616468],[69.3300998788684,34.5500413711819],[69.3301060308411,34.5500210908456],[69.3301081081081,34.55]]]}},{"properties":{"occupation":"Journalist","home_town":"Kabul City","month":1,"latitude":34.55,"suspected_attacker":"CFC Coalition forces","unique_id":26,"date":{"end_time":"2006/01/02 00:00:00 -0500","original":"1/1/2006","granularity":"day","time":"2006/01/01 00:00:00 -0500"},"investigation_result":null,"gender":"Male","incident_reason":"Filming in the vicinity of Camp Eggers in Kabul","day":1,"incident_province":"Kabul","incident_type":"Arrested","year":2006,"longitude":69.33,"organization":"Al Jazeera","id":"25","incident_town":"Kabul City","incident_district":"Kabul City","age":null,"home_province":"Kabul","notes_other_details":null},"type":"Feature","geometry":{"type":"Polygon","coordinates":[[[69.3301081081081,34.55],[69.3301060308411,34.5499789091544],[69.3300998788684,34.5499586288181],[69.3300898886067,34.5499399383532],[69.3300764439763,34.5499235560236],[69.3300600616468,34.5499101113933],[69.3300413711819,34.5499001211316],[69.3300210908456,34.5498939691589],[69.33,34.5498918918919],[69.3299789091544,34.5498939691589],[69.3299586288181,34.5499001211316],[69.3299399383532,34.5499101113933],[69.3299235560237,34.5499235560236],[69.3299101113933,34.5499399383532],[69.3299001211316,34.5499586288181],[69.3298939691589,34.5499789091544],[69.3298918918919,34.55],[69.3298939691589,34.5500210908456],[69.3299001211316,34.5500413711819],[69.3299101113933,34.5500600616468],[69.3299235560237,34.5500764439763],[69.3299399383532,34.5500898886067],[69.3299586288181,34.5500998788684],[69.3299789091544,34.5501060308411],[69.33,34.5501081081081],[69.3300210908456,34.5501060308411],[69.3300413711819,34.5500998788684],[69.3300600616468,34.5500898886067],[69.3300764439763,34.5500764439763],[69.3300898886067,34.5500600616468],[69.3300998788684,34.5500413711819],[69.3301060308411,34.5500210908456],[69.3301081081081,34.55]]]}},{"properties":{"occupation":"Journalist","home_town":"Kabul City","month":1,"latitude":34.55,"suspected_attacker":"CFC Coalition forces","unique_id":27,"date":{"end_time":"2006/01/02 00:00:00 -0500","original":"1/1/2006","granularity":"day","time":"2006/01/01 00:00:00 -0500"},"investigation_result":null,"gender":"Male","incident_reason":"Filming in the vicinity of Camp Eggers in Kabul","day":1,"incident_province":"Kabul","incident_type":"Arrested","year":2006,"longitude":69.33,"organization":"Al Jazeera","id":"26","incident_town":"Kabul City","incident_district":"Kabul City","age":null,"home_province":"Kabul","notes_other_details":null},"type":"Feature","geometry":{"type":"Polygon","coordinates":[[[69.3301081081081,34.55],[69.3301060308411,34.5499789091544],[69.3300998788684,34.5499586288181],[69.3300898886067,34.5499399383532],[69.3300764439763,34.5499235560236],[69.3300600616468,34.5499101113933],[69.3300413711819,34.5499001211316],[69.3300210908456,34.5498939691589],[69.33,34.5498918918919],[69.3299789091544,34.5498939691589],[69.3299586288181,34.5499001211316],[69.3299399383532,34.5499101113933],[69.3299235560237,34.5499235560236],[69.3299101113933,34.5499399383532],[69.3299001211316,34.5499586288181],[69.3298939691589,34.5499789091544],[69.3298918918919,34.55],[69.3298939691589,34.5500210908456],[69.3299001211316,34.5500413711819],[69.3299101113933,34.5500600616468],[69.3299235560237,34.5500764439763],[69.3299399383532,34.5500898886067],[69.3299586288181,34.5500998788684],[69.3299789091544,34.5501060308411],[69.33,34.5501081081081],[69.3300210908456,34.5501060308411],[69.3300413711819,34.5500998788684],[69.3300600616468,34.5500898886067],[69.3300764439763,34.5500764439763],[69.3300898886067,34.5500600616468],[69.3300998788684,34.5500413711819],[69.3301060308411,34.5500210908456],[69.3301081081081,34.55]]]}},{"properties":{"occupation":"Journalist","home_town":"Kandahar City","month":1,"latitude":31.04,"suspected_attacker":"CFC Coalition forces","unique_id":28,"date":{"end_time":"2006/01/10 00:00:00 -0500","original":"1/9/2006","granularity":"day","time":"2006/01/09 00:00:00 -0500"},"investigation_result":null,"gender":"Male","incident_reason":"Unclear","day":9,"incident_province":"Kandahar","incident_type":"Arrested","year":2006,"longitude":65.71,"organization":"Narenj Magazine","id":"27","incident_town":"Kandahar","incident_district":"Kandahar","age":null,"home_province":"Kandahar","notes_other_details":null},"type":"Feature","geometry":{"type":"Polygon","coordinates":[[[65.7101081081081,31.04],[65.7101060308411,31.0399789091544],[65.7100998788684,31.0399586288181],[65.7100898886067,31.0399399383532],[65.7100764439763,31.0399235560237],[65.7100600616468,31.0399101113933],[65.7100413711819,31.0399001211316],[65.7100210908456,31.0398939691589],[65.71,31.0398918918919],[65.7099789091544,31.0398939691589],[65.7099586288181,31.0399001211316],[65.7099399383532,31.0399101113933],[65.7099235560237,31.0399235560237],[65.7099101113933,31.0399399383532],[65.7099001211316,31.0399586288181],[65.7098939691589,31.0399789091544],[65.7098918918919,31.04],[65.7098939691589,31.0400210908456],[65.7099001211316,31.0400413711819],[65.7099101113933,31.0400600616468],[65.7099235560237,31.0400764439763],[65.7099399383532,31.0400898886067],[65.7099586288181,31.0400998788684],[65.7099789091544,31.0401060308411],[65.71,31.0401081081081],[65.7100210908456,31.0401060308411],[65.7100413711819,31.0400998788684],[65.7100600616468,31.0400898886067],[65.7100764439763,31.0400764439763],[65.7100898886067,31.0400600616468],[65.7100998788684,31.0400413711819],[65.7101060308411,31.0400210908456],[65.7101081081081,31.04]]]}},{"properties":{"occupation":"Journalist","home_town":"Hirat City","month":2,"latitude":34.2,"suspected_attacker":"Police","unique_id":29,"date":{"end_time":"2006/02/10 00:00:00 -0500","original":"2/9/2006","granularity":"day","time":"2006/02/09 00:00:00 -0500"},"investigation_result":null,"gender":"Male","incident_reason":"Reporting from Shia and Sunni riot in Hirat","day":9,"incident_province":"Hirat","incident_type":"Beaten","year":2006,"longitude":62.13,"organization":"Tolo TV","id":"28","incident_town":"Hirat City","incident_district":"Hirat City","age":null,"home_province":"Hirat","notes_other_details":null},"type":"Feature","geometry":{"type":"Polygon","coordinates":[[[62.1301081081081,34.2],[62.1301060308411,34.1999789091544],[62.1300998788684,34.1999586288181],[62.1300898886067,34.1999399383532],[62.1300764439763,34.1999235560237],[62.1300600616468,34.1999101113933],[62.1300413711819,34.1999001211316],[62.1300210908456,34.1998939691589],[62.13,34.1998918918919],[62.1299789091544,34.1998939691589],[62.1299586288181,34.1999001211316],[62.1299399383532,34.1999101113933],[62.1299235560237,34.1999235560237],[62.1299101113933,34.1999399383532],[62.1299001211316,34.1999586288181],[62.1298939691589,34.1999789091544],[62.1298918918919,34.2],[62.1298939691589,34.2000210908456],[62.1299001211316,34.2000413711819],[62.1299101113933,34.2000600616468],[62.1299235560237,34.2000764439764],[62.1299399383532,34.2000898886067],[62.1299586288181,34.2000998788684],[62.1299789091544,34.2001060308411],[62.13,34.2001081081081],[62.1300210908456,34.2001060308411],[62.1300413711819,34.2000998788684],[62.1300600616468,34.2000898886067],[62.1300764439763,34.2000764439764],[62.1300898886067,34.2000600616468],[62.1300998788684,34.2000413711819],[62.1301060308411,34.2000210908456],[62.1301081081081,34.2]]]}},{"properties":{"occupation":"Journalist","home_town":"Hirat City","month":2,"latitude":34.2,"suspected_attacker":"Police","unique_id":30,"date":{"end_time":"2006/02/10 00:00:00 -0500","original":"2/9/2006","granularity":"day","time":"2006/02/09 00:00:00 -0500"},"investigation_result":null,"gender":"Male","incident_reason":"Reporting from Shia and Sunni riot in Hirat","day":9,"incident_province":"Hirat","incident_type":"Beaten","year":2006,"longitude":62.13,"organization":"Pajhwok","id":"29","incident_town":"Hirat City","incident_district":"Hirat City","age":null,"home_province":"Hirat","notes_other_details":null},"type":"Feature","geometry":{"type":"Polygon","coordinates":[[[62.1301081081081,34.2],[62.1301060308411,34.1999789091544],[62.1300998788684,34.1999586288181],[62.1300898886067,34.1999399383532],[62.1300764439763,34.1999235560237],[62.1300600616468,34.1999101113933],[62.1300413711819,34.1999001211316],[62.1300210908456,34.1998939691589],[62.13,34.1998918918919],[62.1299789091544,34.1998939691589],[62.1299586288181,34.1999001211316],[62.1299399383532,34.1999101113933],[62.1299235560237,34.1999235560237],[62.1299101113933,34.1999399383532],[62.1299001211316,34.1999586288181],[62.1298939691589,34.1999789091544],[62.1298918918919,34.2],[62.1298939691589,34.2000210908456],[62.1299001211316,34.2000413711819],[62.1299101113933,34.2000600616468],[62.1299235560237,34.2000764439764],[62.1299399383532,34.2000898886067],[62.1299586288181,34.2000998788684],[62.1299789091544,34.2001060308411],[62.13,34.2001081081081],[62.1300210908456,34.2001060308411],[62.1300413711819,34.2000998788684],[62.1300600616468,34.2000898886067],[62.1300764439763,34.2000764439764],[62.1300898886067,34.2000600616468],[62.1300998788684,34.2000413711819],[62.1301060308411,34.2000210908456],[62.1301081081081,34.2]]]}},{"properties":{"occupation":"Journalist","home_town":"Hirat City","month":2,"latitude":34.2,"suspected_attacker":"Police","unique_id":31,"date":{"end_time":"2006/02/10 00:00:00 -0500","original":"2/9/2006","granularity":"day","time":"2006/02/09 00:00:00 -0500"},"investigation_result":null,"gender":"Male","incident_reason":"Reporting from Shia and Sunni riot in Hirat","day":9,"incident_province":"Hirat","incident_type":"Threatened","year":2006,"longitude":62.13,"organization":"Radio Ashna","id":"30","incident_town":"Hirat City","incident_district":"Hirat City","age":null,"home_province":"Hirat","notes_other_details":null},"type":"Feature","geometry":{"type":"Polygon","coordinates":[[[62.1301081081081,34.2],[62.1301060308411,34.1999789091544],[62.1300998788684,34.1999586288181],[62.1300898886067,34.1999399383532],[62.1300764439763,34.1999235560237],[62.1300600616468,34.1999101113933],[62.1300413711819,34.1999001211316],[62.1300210908456,34.1998939691589],[62.13,34.1998918918919],[62.1299789091544,34.1998939691589],[62.1299586288181,34.1999001211316],[62.1299399383532,34.1999101113933],[62.1299235560237,34.1999235560237],[62.1299101113933,34.1999399383532],[62.1299001211316,34.1999586288181],[62.1298939691589,34.1999789091544],[62.1298918918919,34.2],[62.1298939691589,34.2000210908456],[62.1299001211316,34.2000413711819],[62.1299101113933,34.2000600616468],[62.1299235560237,34.2000764439764],[62.1299399383532,34.2000898886067],[62.1299586288181,34.2000998788684],[62.1299789091544,34.2001060308411],[62.13,34.2001081081081],[62.1300210908456,34.2001060308411],[62.1300413711819,34.2000998788684],[62.1300600616468,34.2000898886067],[62.1300764439763,34.2000764439764],[62.1300898886067,34.2000600616468],[62.1300998788684,34.2000413711819],[62.1301060308411,34.2000210908456],[62.1301081081081,34.2]]]}},{"properties":{"occupation":"Journalist","home_town":"Hirat City","month":2,"latitude":34.2,"suspected_attacker":"Police","unique_id":32,"date":{"end_time":"2006/02/10 00:00:00 -0500","original":"2/9/2006","granularity":"day","time":"2006/02/09 00:00:00 -0500"},"investigation_result":null,"gender":"Male","incident_reason":"Reporting from Shia and Sunni riot in Hirat","day":9,"incident_province":"Hirat","incident_type":"Beaten","year":2006,"longitude":62.13,"organization":"Azadi Radio","id":"31","incident_town":"Hirat City","incident_district":"Hirat City","age":null,"home_province":"Hirat","notes_other_details":null},"type":"Feature","geometry":{"type":"Polygon","coordinates":[[[62.1301081081081,34.2],[62.1301060308411,34.1999789091544],[62.1300998788684,34.1999586288181],[62.1300898886067,34.1999399383532],[62.1300764439763,34.1999235560237],[62.1300600616468,34.1999101113933],[62.1300413711819,34.1999001211316],[62.1300210908456,34.1998939691589],[62.13,34.1998918918919],[62.1299789091544,34.1998939691589],[62.1299586288181,34.1999001211316],[62.1299399383532,34.1999101113933],[62.1299235560237,34.1999235560237],[62.1299101113933,34.1999399383532],[62.1299001211316,34.1999586288181],[62.1298939691589,34.1999789091544],[62.1298918918919,34.2],[62.1298939691589,34.2000210908456],[62.1299001211316,34.2000413711819],[62.1299101113933,34.2000600616468],[62.1299235560237,34.2000764439764],[62.1299399383532,34.2000898886067],[62.1299586288181,34.2000998788684],[62.1299789091544,34.2001060308411],[62.13,34.2001081081081],[62.1300210908456,34.2001060308411],[62.1300413711819,34.2000998788684],[62.1300600616468,34.2000898886067],[62.1300764439763,34.2000764439764],[62.1300898886067,34.2000600616468],[62.1300998788684,34.2000413711819],[62.1301060308411,34.2000210908456],[62.1301081081081,34.2]]]}},{"properties":{"occupation":"Journalist","home_town":"Jabulsaraj District","month":2,"latitude":34.55,"suspected_attacker":"Government","unique_id":33,"date":{"end_time":"2011/02/07 00:00:00 -0500","original":"2/6/2011","granularity":"day","time":"2011/02/06 00:00:00 -0500"},"investigation_result":null,"gender":"Male","incident_reason":"To an attempted murder","day":null,"incident_province":"Kabul","incident_type":"Arrested","year":2006,"longitude":69.33,"organization":"Sadaye Sulh FM","id":"32","incident_town":"Kabul City","incident_district":"Kabul City","age":null,"home_province":"Parwan","notes_other_details":null},"type":"Feature","geometry":{"type":"Polygon","coordinates":[[[69.3301081081081,34.55],[69.3301060308411,34.5499789091544],[69.3300998788684,34.5499586288181],[69.3300898886067,34.5499399383532],[69.3300764439763,34.5499235560236],[69.3300600616468,34.5499101113933],[69.3300413711819,34.5499001211316],[69.3300210908456,34.5498939691589],[69.33,34.5498918918919],[69.3299789091544,34.5498939691589],[69.3299586288181,34.5499001211316],[69.3299399383532,34.5499101113933],[69.3299235560237,34.5499235560236],[69.3299101113933,34.5499399383532],[69.3299001211316,34.5499586288181],[69.3298939691589,34.5499789091544],[69.3298918918919,34.55],[69.3298939691589,34.5500210908456],[69.3299001211316,34.5500413711819],[69.3299101113933,34.5500600616468],[69.3299235560237,34.5500764439763],[69.3299399383532,34.5500898886067],[69.3299586288181,34.5500998788684],[69.3299789091544,34.5501060308411],[69.33,34.5501081081081],[69.3300210908456,34.5501060308411],[69.3300413711819,34.5500998788684],[69.3300600616468,34.5500898886067],[69.3300764439763,34.5500764439763],[69.3300898886067,34.5500600616468],[69.3300998788684,34.5500413711819],[69.3301060308411,34.5500210908456],[69.3301081081081,34.55]]]}},{"properties":{"occupation":"Journalist","home_town":"Kabul City","month":5,"latitude":34.55,"suspected_attacker":"member of parliament","unique_id":34,"date":{"end_time":"2006/05/10 00:00:00 -0400","original":"5/9/2006","granularity":"day","time":"2006/05/09 00:00:00 -0400"},"investigation_result":null,"gender":"Male","incident_reason":"Filming from Parliament","day":9,"incident_province":"Kabul","incident_type":"Beaten","year":2006,"longitude":69.33,"organization":"Tolo TV","id":"33","incident_town":"Kabul City","incident_district":"Kabul City","age":null,"home_province":"Kabul","notes_other_details":null},"type":"Feature","geometry":{"type":"Polygon","coordinates":[[[69.3301081081081,34.55],[69.3301060308411,34.5499789091544],[69.3300998788684,34.5499586288181],[69.3300898886067,34.5499399383532],[69.3300764439763,34.5499235560236],[69.3300600616468,34.5499101113933],[69.3300413711819,34.5499001211316],[69.3300210908456,34.5498939691589],[69.33,34.5498918918919],[69.3299789091544,34.5498939691589],[69.3299586288181,34.5499001211316],[69.3299399383532,34.5499101113933],[69.3299235560237,34.5499235560236],[69.3299101113933,34.5499399383532],[69.3299001211316,34.5499586288181],[69.3298939691589,34.5499789091544],[69.3298918918919,34.55],[69.3298939691589,34.5500210908456],[69.3299001211316,34.5500413711819],[69.3299101113933,34.5500600616468],[69.3299235560237,34.5500764439763],[69.3299399383532,34.5500898886067],[69.3299586288181,34.5500998788684],[69.3299789091544,34.5501060308411],[69.33,34.5501081081081],[69.3300210908456,34.5501060308411],[69.3300413711819,34.5500998788684],[69.3300600616468,34.5500898886067],[69.3300764439763,34.5500764439763],[69.3300898886067,34.5500600616468],[69.3300998788684,34.5500413711819],[69.3301060308411,34.5500210908456],[69.3301081081081,34.55]]]}},{"properties":{"occupation":"Journalist","home_town":"Kabul City","month":5,"latitude":34.55,"suspected_attacker":"president security officers","unique_id":35,"date":{"end_time":"2006/05/28 00:00:00 -0400","original":"5/27/2006","granularity":"day","time":"2006/05/27 00:00:00 -0400"},"investigation_result":null,"gender":"Male","incident_reason":"On the way from office to Parliament","day":27,"incident_province":"Kabul","incident_type":"Beaten","year":2006,"longitude":69.33,"organization":"Aina TV","id":"34","incident_town":"Kabul City","incident_district":"Kabul City","age":null,"home_province":"Kabul","notes_other_details":null},"type":"Feature","geometry":{"type":"Polygon","coordinates":[[[69.3301081081081,34.55],[69.3301060308411,34.5499789091544],[69.3300998788684,34.5499586288181],[69.3300898886067,34.5499399383532],[69.3300764439763,34.5499235560236],[69.3300600616468,34.5499101113933],[69.3300413711819,34.5499001211316],[69.3300210908456,34.5498939691589],[69.33,34.5498918918919],[69.3299789091544,34.5498939691589],[69.3299586288181,34.5499001211316],[69.3299399383532,34.5499101113933],[69.3299235560237,34.5499235560236],[69.3299101113933,34.5499399383532],[69.3299001211316,34.5499586288181],[69.3298939691589,34.5499789091544],[69.3298918918919,34.55],[69.3298939691589,34.5500210908456],[69.3299001211316,34.5500413711819],[69.3299101113933,34.5500600616468],[69.3299235560237,34.5500764439763],[69.3299399383532,34.5500898886067],[69.3299586288181,34.5500998788684],[69.3299789091544,34.5501060308411],[69.33,34.5501081081081],[69.3300210908456,34.5501060308411],[69.3300413711819,34.5500998788684],[69.3300600616468,34.5500898886067],[69.3300764439763,34.5500764439763],[69.3300898886067,34.5500600616468],[69.3300998788684,34.5500413711819],[69.3301060308411,34.5500210908456],[69.3301081081081,34.55]]]}},{"properties":{"occupation":"Journalist","home_town":"Kabul City","month":5,"latitude":34.55,"suspected_attacker":"president security officers","unique_id":36,"date":{"end_time":"2006/05/28 00:00:00 -0400","original":"5/27/2006","granularity":"day","time":"2006/05/27 00:00:00 -0400"},"investigation_result":null,"gender":"Male","incident_reason":"On the way from office to Parliament","day":27,"incident_province":"Kabul","incident_type":"Beaten","year":2006,"longitude":69.33,"organization":"Aina TV","id":"35","incident_town":"Kabul City","incident_district":"Kabul City","age":null,"home_province":"Kabul","notes_other_details":null},"type":"Feature","geometry":{"type":"Polygon","coordinates":[[[69.3301081081081,34.55],[69.3301060308411,34.5499789091544],[69.3300998788684,34.5499586288181],[69.3300898886067,34.5499399383532],[69.3300764439763,34.5499235560236],[69.3300600616468,34.5499101113933],[69.3300413711819,34.5499001211316],[69.3300210908456,34.5498939691589],[69.33,34.5498918918919],[69.3299789091544,34.5498939691589],[69.3299586288181,34.5499001211316],[69.3299399383532,34.5499101113933],[69.3299235560237,34.5499235560236],[69.3299101113933,34.5499399383532],[69.3299001211316,34.5499586288181],[69.3298939691589,34.5499789091544],[69.3298918918919,34.55],[69.3298939691589,34.5500210908456],[69.3299001211316,34.5500413711819],[69.3299101113933,34.5500600616468],[69.3299235560237,34.5500764439763],[69.3299399383532,34.5500898886067],[69.3299586288181,34.5500998788684],[69.3299789091544,34.5501060308411],[69.33,34.5501081081081],[69.3300210908456,34.5501060308411],[69.3300413711819,34.5500998788684],[69.3300600616468,34.5500898886067],[69.3300764439763,34.5500764439763],[69.3300898886067,34.5500600616468],[69.3300998788684,34.5500413711819],[69.3301060308411,34.5500210908456],[69.3301081081081,34.55]]]}},{"properties":{"occupation":"Journalist","home_town":"Kabul City","month":5,"latitude":34.55,"suspected_attacker":"president security officers","unique_id":37,"date":{"end_time":"2006/05/28 00:00:00 -0400","original":"5/27/2006","granularity":"day","time":"2006/05/27 00:00:00 -0400"},"investigation_result":null,"gender":"Male","incident_reason":"On the way from office to Parliament","day":27,"incident_province":"Kabul","incident_type":"Beaten","year":2006,"longitude":69.33,"organization":"Aina TV","id":"36","incident_town":"Kabul City","incident_district":"Kabul City","age":null,"home_province":"Kabul","notes_other_details":null},"type":"Feature","geometry":{"type":"Polygon","coordinates":[[[69.3301081081081,34.55],[69.3301060308411,34.5499789091544],[69.3300998788684,34.5499586288181],[69.3300898886067,34.5499399383532],[69.3300764439763,34.5499235560236],[69.3300600616468,34.5499101113933],[69.3300413711819,34.5499001211316],[69.3300210908456,34.5498939691589],[69.33,34.5498918918919],[69.3299789091544,34.5498939691589],[69.3299586288181,34.5499001211316],[69.3299399383532,34.5499101113933],[69.3299235560237,34.5499235560236],[69.3299101113933,34.5499399383532],[69.3299001211316,34.5499586288181],[69.3298939691589,34.5499789091544],[69.3298918918919,34.55],[69.3298939691589,34.5500210908456],[69.3299001211316,34.5500413711819],[69.3299101113933,34.5500600616468],[69.3299235560237,34.5500764439763],[69.3299399383532,34.5500898886067],[69.3299586288181,34.5500998788684],[69.3299789091544,34.5501060308411],[69.33,34.5501081081081],[69.3300210908456,34.5501060308411],[69.3300413711819,34.5500998788684],[69.3300600616468,34.5500898886067],[69.3300764439763,34.5500764439763],[69.3300898886067,34.5500600616468],[69.3300998788684,34.5500413711819],[69.3301060308411,34.5500210908456],[69.3301081081081,34.55]]]}},{"properties":{"occupation":"Journalist","home_town":"Khost City","month":6,"latitude":33.38,"suspected_attacker":"Khost Governor","unique_id":38,"date":{"end_time":"2011/06/07 00:00:00 -0400","original":"6/6/2011","granularity":"day","time":"2011/06/06 00:00:00 -0400"},"investigation_result":null,"gender":"Male","incident_reason":"Reporting","day":null,"incident_province":"Khost","incident_type":"Threatened","year":2006,"longitude":69.83,"organization":"Jawan Ghagh","id":"37","incident_town":"Khost City","incident_district":"Khost City","age":null,"home_province":"Khost","notes_other_details":null},"type":"Feature","geometry":{"type":"Polygon","coordinates":[[[69.8301081081081,33.38],[69.8301060308411,33.3799789091544],[69.8300998788684,33.3799586288181],[69.8300898886067,33.3799399383532],[69.8300764439763,33.3799235560237],[69.8300600616468,33.3799101113933],[69.8300413711819,33.3799001211316],[69.8300210908456,33.3798939691589],[69.83,33.3798918918919],[69.8299789091544,33.3798939691589],[69.8299586288181,33.3799001211316],[69.8299399383532,33.3799101113933],[69.8299235560237,33.3799235560237],[69.8299101113933,33.3799399383532],[69.8299001211316,33.3799586288181],[69.8298939691589,33.3799789091544],[69.8298918918919,33.38],[69.8298939691589,33.3800210908456],[69.8299001211316,33.3800413711819],[69.8299101113933,33.3800600616468],[69.8299235560237,33.3800764439763],[69.8299399383532,33.3800898886067],[69.8299586288181,33.3800998788684],[69.8299789091544,33.3801060308411],[69.83,33.3801081081081],[69.8300210908456,33.3801060308411],[69.8300413711819,33.3800998788684],[69.8300600616468,33.3800898886067],[69.8300764439763,33.3800764439763],[69.8300898886067,33.3800600616468],[69.8300998788684,33.3800413711819],[69.8301060308411,33.3800210908456],[69.8301081081081,33.38]]]}},{"properties":{"occupation":"Radio Manager","home_town":"Said Abad District","month":6,"latitude":34.3,"suspected_attacker":"Taliban","unique_id":39,"date":{"end_time":"2011/06/07 00:00:00 -0400","original":"6/6/2011","granularity":"day","time":"2011/06/06 00:00:00 -0400"},"investigation_result":null,"gender":"Male","incident_reason":"Radio Broadcasting","day":null,"incident_province":"Wardak","incident_type":"Threatened","year":2006,"longitude":68.22,"organization":"Radio Yawali Ghazh","id":"38","incident_town":"Said Abad District","incident_district":"Said Abad District","age":null,"home_province":"Wardak","notes_other_details":null},"type":"Feature","geometry":{"type":"Polygon","coordinates":[[[68.2201081081081,34.3],[68.2201060308411,34.2999789091544],[68.2200998788684,34.2999586288181],[68.2200898886067,34.2999399383532],[68.2200764439763,34.2999235560236],[68.2200600616468,34.2999101113933],[68.2200413711819,34.2999001211316],[68.2200210908456,34.2998939691589],[68.22,34.2998918918919],[68.2199789091544,34.2998939691589],[68.2199586288181,34.2999001211316],[68.2199399383532,34.2999101113933],[68.2199235560237,34.2999235560236],[68.2199101113933,34.2999399383532],[68.2199001211316,34.2999586288181],[68.2198939691589,34.2999789091544],[68.2198918918919,34.3],[68.2198939691589,34.3000210908456],[68.2199001211316,34.3000413711819],[68.2199101113933,34.3000600616468],[68.2199235560237,34.3000764439763],[68.2199399383532,34.3000898886067],[68.2199586288181,34.3000998788684],[68.2199789091544,34.3001060308411],[68.22,34.3001081081081],[68.2200210908456,34.3001060308411],[68.2200413711819,34.3000998788684],[68.2200600616468,34.3000898886067],[68.2200764439763,34.3000764439763],[68.2200898886067,34.3000600616468],[68.2200998788684,34.3000413711819],[68.2201060308411,34.3000210908456],[68.2201081081081,34.3]]]}},{"properties":{"occupation":"Journalist","home_town":"Jalalabad","month":6,"latitude":34.27,"suspected_attacker":"Taliban","unique_id":40,"date":{"end_time":"2006/06/17 00:00:00 -0400","original":"6/16/2006","granularity":"day","time":"2006/06/16 00:00:00 -0400"},"investigation_result":null,"gender":"Male","incident_reason":"Publishing an article","day":16,"incident_province":"Nangarhar","incident_type":"Threatened","year":2006,"longitude":70.48,"organization":"Afghan Islamic News Agency","id":"39","incident_town":"Jalalabad","incident_district":"Jalalabad","age":null,"home_province":"Nangarhar","notes_other_details":null},"type":"Feature","geometry":{"type":"Polygon","coordinates":[[[70.4801081081081,34.27],[70.4801060308411,34.2699789091544],[70.4800998788684,34.2699586288181],[70.4800898886067,34.2699399383532],[70.4800764439763,34.2699235560237],[70.4800600616468,34.2699101113933],[70.4800413711819,34.2699001211316],[70.4800210908456,34.2698939691589],[70.48,34.2698918918919],[70.4799789091544,34.2698939691589],[70.4799586288181,34.2699001211316],[70.4799399383532,34.2699101113933],[70.4799235560237,34.2699235560237],[70.4799101113933,34.2699399383532],[70.4799001211316,34.2699586288181],[70.4798939691589,34.2699789091544],[70.4798918918919,34.27],[70.4798939691589,34.2700210908456],[70.4799001211316,34.2700413711819],[70.4799101113933,34.2700600616468],[70.4799235560237,34.2700764439764],[70.4799399383532,34.2700898886067],[70.4799586288181,34.2700998788684],[70.4799789091544,34.2701060308411],[70.48,34.2701081081081],[70.4800210908456,34.2701060308411],[70.4800413711819,34.2700998788684],[70.4800600616468,34.2700898886067],[70.4800764439763,34.2700764439764],[70.4800898886067,34.2700600616468],[70.4800998788684,34.2700413711819],[70.4801060308411,34.2700210908456],[70.4801081081081,34.27]]]}},{"properties":{"occupation":"Journalist","home_town":"Kabul City","month":7,"latitude":34.55,"suspected_attacker":"Unknown","unique_id":41,"date":{"end_time":"2006/07/30 00:00:00 -0400","original":"7/29/2006","granularity":"day","time":"2006/07/29 00:00:00 -0400"},"investigation_result":null,"gender":"Male","incident_reason":"Reporting","day":29,"incident_province":"Kabul","incident_type":"Beaten","year":2006,"longitude":69.33,"organization":"Tolo TV","id":"40","incident_town":"Kabul City","incident_district":"Kabul City","age":null,"home_province":"Kabul","notes_other_details":null},"type":"Feature","geometry":{"type":"Polygon","coordinates":[[[69.3301081081081,34.55],[69.3301060308411,34.5499789091544],[69.3300998788684,34.5499586288181],[69.3300898886067,34.5499399383532],[69.3300764439763,34.5499235560236],[69.3300600616468,34.5499101113933],[69.3300413711819,34.5499001211316],[69.3300210908456,34.5498939691589],[69.33,34.5498918918919],[69.3299789091544,34.5498939691589],[69.3299586288181,34.5499001211316],[69.3299399383532,34.5499101113933],[69.3299235560237,34.5499235560236],[69.3299101113933,34.5499399383532],[69.3299001211316,34.5499586288181],[69.3298939691589,34.5499789091544],[69.3298918918919,34.55],[69.3298939691589,34.5500210908456],[69.3299001211316,34.5500413711819],[69.3299101113933,34.5500600616468],[69.3299235560237,34.5500764439763],[69.3299399383532,34.5500898886067],[69.3299586288181,34.5500998788684],[69.3299789091544,34.5501060308411],[69.33,34.5501081081081],[69.3300210908456,34.5501060308411],[69.3300413711819,34.5500998788684],[69.3300600616468,34.5500898886067],[69.3300764439763,34.5500764439763],[69.3300898886067,34.5500600616468],[69.3300998788684,34.5500413711819],[69.3301060308411,34.5500210908456],[69.3301081081081,34.55]]]}},{"properties":{"occupation":"Camera Man","home_town":"Kandahar City","month":7,"latitude":31.04,"suspected_attacker":"Taliban","unique_id":42,"date":{"end_time":"2006/07/23 00:00:00 -0400","original":"7/22/2006","granularity":"day","time":"2006/07/22 00:00:00 -0400"},"investigation_result":null,"gender":"Male","incident_reason":"In a suicide attack in Kandahar City","day":22,"incident_province":"Kandahar","incident_type":"Killed","year":2006,"longitude":65.71,"organization":"Aryana TV","id":"41","incident_town":"Kandahar City","incident_district":"Kandahar City","age":null,"home_province":"Kandahar","notes_other_details":null},"type":"Feature","geometry":{"type":"Polygon","coordinates":[[[65.7101081081081,31.04],[65.7101060308411,31.0399789091544],[65.7100998788684,31.0399586288181],[65.7100898886067,31.0399399383532],[65.7100764439763,31.0399235560237],[65.7100600616468,31.0399101113933],[65.7100413711819,31.0399001211316],[65.7100210908456,31.0398939691589],[65.71,31.0398918918919],[65.7099789091544,31.0398939691589],[65.7099586288181,31.0399001211316],[65.7099399383532,31.0399101113933],[65.7099235560237,31.0399235560237],[65.7099101113933,31.0399399383532],[65.7099001211316,31.0399586288181],[65.7098939691589,31.0399789091544],[65.7098918918919,31.04],[65.7098939691589,31.0400210908456],[65.7099001211316,31.0400413711819],[65.7099101113933,31.0400600616468],[65.7099235560237,31.0400764439763],[65.7099399383532,31.0400898886067],[65.7099586288181,31.0400998788684],[65.7099789091544,31.0401060308411],[65.71,31.0401081081081],[65.7100210908456,31.0401060308411],[65.7100413711819,31.0400998788684],[65.7100600616468,31.0400898886067],[65.7100764439763,31.0400764439763],[65.7100898886067,31.0400600616468],[65.7100998788684,31.0400413711819],[65.7101060308411,31.0400210908456],[65.7101081081081,31.04]]]}},{"properties":{"occupation":"Journalist","home_town":"Lashkargah City","month":7,"latitude":31.12,"suspected_attacker":"Government","unique_id":43,"date":{"end_time":"2006/07/14 00:00:00 -0400","original":"7/13/2006","granularity":"day","time":"2006/07/13 00:00:00 -0400"},"investigation_result":null,"gender":"Male","incident_reason":"Reporting","day":13,"incident_province":"Hilmand","incident_type":"Threatened","year":2006,"longitude":64.02,"organization":"Azadi Radio","id":"42","incident_town":"Lashkargah City","incident_district":"Lashkargah City","age":null,"home_province":"Hilmand","notes_other_details":null},"type":"Feature","geometry":{"type":"Polygon","coordinates":[[[64.0201081081081,31.12],[64.0201060308411,31.1199789091544],[64.0200998788684,31.1199586288181],[64.0200898886067,31.1199399383532],[64.0200764439763,31.1199235560237],[64.0200600616468,31.1199101113933],[64.0200413711819,31.1199001211316],[64.0200210908456,31.1198939691589],[64.02,31.1198918918919],[64.0199789091544,31.1198939691589],[64.0199586288181,31.1199001211316],[64.0199399383532,31.1199101113933],[64.0199235560237,31.1199235560237],[64.0199101113933,31.1199399383532],[64.0199001211316,31.1199586288181],[64.0198939691589,31.1199789091544],[64.0198918918919,31.12],[64.0198939691589,31.1200210908456],[64.0199001211316,31.1200413711819],[64.0199101113933,31.1200600616468],[64.0199235560237,31.1200764439763],[64.0199399383532,31.1200898886067],[64.0199586288181,31.1200998788684],[64.0199789091544,31.1201060308411],[64.02,31.1201081081081],[64.0200210908456,31.1201060308411],[64.0200413711819,31.1200998788684],[64.0200600616468,31.1200898886067],[64.0200764439763,31.1200764439763],[64.0200898886067,31.1200600616468],[64.0200998788684,31.1200413711819],[64.0201060308411,31.1200210908456],[64.0201081081081,31.12]]]}},{"properties":{"occupation":"Journalist","home_town":"Khost City","month":8,"latitude":33.38,"suspected_attacker":"Unknown Individuals","unique_id":44,"date":{"end_time":"2006/08/14 00:00:00 -0400","original":"8/13/2006","granularity":"day","time":"2006/08/13 00:00:00 -0400"},"investigation_result":null,"gender":"Male","incident_reason":"Reporting","day":13,"incident_province":"Khost","incident_type":"Beaten","year":2006,"longitude":69.83,"organization":"Freelance","id":"43","incident_town":"Khost City","incident_district":"Khost City","age":null,"home_province":"Khost","notes_other_details":null},"type":"Feature","geometry":{"type":"Polygon","coordinates":[[[69.8301081081081,33.38],[69.8301060308411,33.3799789091544],[69.8300998788684,33.3799586288181],[69.8300898886067,33.3799399383532],[69.8300764439763,33.3799235560237],[69.8300600616468,33.3799101113933],[69.8300413711819,33.3799001211316],[69.8300210908456,33.3798939691589],[69.83,33.3798918918919],[69.8299789091544,33.3798939691589],[69.8299586288181,33.3799001211316],[69.8299399383532,33.3799101113933],[69.8299235560237,33.3799235560237],[69.8299101113933,33.3799399383532],[69.8299001211316,33.3799586288181],[69.8298939691589,33.3799789091544],[69.8298918918919,33.38],[69.8298939691589,33.3800210908456],[69.8299001211316,33.3800413711819],[69.8299101113933,33.3800600616468],[69.8299235560237,33.3800764439763],[69.8299399383532,33.3800898886067],[69.8299586288181,33.3800998788684],[69.8299789091544,33.3801060308411],[69.83,33.3801081081081],[69.8300210908456,33.3801060308411],[69.8300413711819,33.3800998788684],[69.8300600616468,33.3800898886067],[69.8300764439763,33.3800764439763],[69.8300898886067,33.3800600616468],[69.8300998788684,33.3800413711819],[69.8301060308411,33.3800210908456],[69.8301081081081,33.38]]]}},{"properties":{"occupation":"Journalist","home_town":"Gardiz City","month":7,"latitude":33.63,"suspected_attacker":"Taliban","unique_id":45,"date":{"end_time":"2011/07/07 00:00:00 -0400","original":"7/6/2011","granularity":"day","time":"2011/07/06 00:00:00 -0400"},"investigation_result":null,"gender":"Male","incident_reason":"Reporting","day":null,"incident_province":"Paktya","incident_type":"Beaten","year":2006,"longitude":69.39,"organization":"Soli Paygham Radio","id":"44","incident_town":"Gardiz","incident_district":"Gardiz","age":null,"home_province":"Paktia","notes_other_details":null},"type":"Feature","geometry":{"type":"Polygon","coordinates":[[[69.3901081081081,33.63],[69.3901060308411,33.6299789091544],[69.3900998788684,33.6299586288181],[69.3900898886067,33.6299399383532],[69.3900764439763,33.6299235560237],[69.3900600616468,33.6299101113933],[69.3900413711819,33.6299001211316],[69.3900210908456,33.6298939691589],[69.39,33.6298918918919],[69.3899789091544,33.6298939691589],[69.3899586288181,33.6299001211316],[69.3899399383532,33.6299101113933],[69.3899235560237,33.6299235560237],[69.3899101113933,33.6299399383532],[69.3899001211316,33.6299586288181],[69.3898939691589,33.6299789091544],[69.3898918918919,33.63],[69.3898939691589,33.6300210908456],[69.3899001211316,33.6300413711819],[69.3899101113933,33.6300600616468],[69.3899235560237,33.6300764439763],[69.3899399383532,33.6300898886067],[69.3899586288181,33.6300998788684],[69.3899789091544,33.6301060308411],[69.39,33.6301081081081],[69.3900210908456,33.6301060308411],[69.3900413711819,33.6300998788684],[69.3900600616468,33.6300898886067],[69.3900764439763,33.6300764439763],[69.3900898886067,33.6300600616468],[69.3900998788684,33.6300413711819],[69.3901060308411,33.6300210908456],[69.3901081081081,33.63]]]}},{"properties":{"occupation":"Journalist","home_town":"Gardiz City","month":7,"latitude":33.63,"suspected_attacker":"Taliban","unique_id":46,"date":{"end_time":"2011/07/07 00:00:00 -0400","original":"7/6/2011","granularity":"day","time":"2011/07/06 00:00:00 -0400"},"investigation_result":null,"gender":"Male","incident_reason":"Reporting from a suicide attack","day":null,"incident_province":"Paktya","incident_type":"Beaten","year":2006,"longitude":69.39,"organization":"RTA","id":"45","incident_town":"Gardiz","incident_district":"Gardiz","age":null,"home_province":"Paktia","notes_other_details":null},"type":"Feature","geometry":{"type":"Polygon","coordinates":[[[69.3901081081081,33.63],[69.3901060308411,33.6299789091544],[69.3900998788684,33.6299586288181],[69.3900898886067,33.6299399383532],[69.3900764439763,33.6299235560237],[69.3900600616468,33.6299101113933],[69.3900413711819,33.6299001211316],[69.3900210908456,33.6298939691589],[69.39,33.6298918918919],[69.3899789091544,33.6298939691589],[69.3899586288181,33.6299001211316],[69.3899399383532,33.6299101113933],[69.3899235560237,33.6299235560237],[69.3899101113933,33.6299399383532],[69.3899001211316,33.6299586288181],[69.3898939691589,33.6299789091544],[69.3898918918919,33.63],[69.3898939691589,33.6300210908456],[69.3899001211316,33.6300413711819],[69.3899101113933,33.6300600616468],[69.3899235560237,33.6300764439763],[69.3899399383532,33.6300898886067],[69.3899586288181,33.6300998788684],[69.3899789091544,33.6301060308411],[69.39,33.6301081081081],[69.3900210908456,33.6301060308411],[69.3900413711819,33.6300998788684],[69.3900600616468,33.6300898886067],[69.3900764439763,33.6300764439763],[69.3900898886067,33.6300600616468],[69.3900998788684,33.6300413711819],[69.3901060308411,33.6300210908456],[69.3901081081081,33.63]]]}},{"properties":{"occupation":"Journalist","home_town":"Gardiz City","month":null,"latitude":33.63,"suspected_attacker":"Unknown Individuals","unique_id":47,"date":{"end_time":"2007/01/01 00:00:00 -0500","original":"2006","granularity":"year","time":"2006/01/01 00:00:00 -0500"},"investigation_result":null,"gender":"Male","incident_reason":"Reporting from a suicide attack","day":null,"incident_province":"Paktya","incident_type":"Threatened","year":2006,"longitude":69.39,"organization":"RTA","id":"46","incident_town":"Gardiz","incident_district":"Gardiz","age":null,"home_province":"Paktia","notes_other_details":null},"type":"Feature","geometry":{"type":"Polygon","coordinates":[[[69.3901081081081,33.63],[69.3901060308411,33.6299789091544],[69.3900998788684,33.6299586288181],[69.3900898886067,33.6299399383532],[69.3900764439763,33.6299235560237],[69.3900600616468,33.6299101113933],[69.3900413711819,33.6299001211316],[69.3900210908456,33.6298939691589],[69.39,33.6298918918919],[69.3899789091544,33.6298939691589],[69.3899586288181,33.6299001211316],[69.3899399383532,33.6299101113933],[69.3899235560237,33.6299235560237],[69.3899101113933,33.6299399383532],[69.3899001211316,33.6299586288181],[69.3898939691589,33.6299789091544],[69.3898918918919,33.63],[69.3898939691589,33.6300210908456],[69.3899001211316,33.6300413711819],[69.3899101113933,33.6300600616468],[69.3899235560237,33.6300764439763],[69.3899399383532,33.6300898886067],[69.3899586288181,33.6300998788684],[69.3899789091544,33.6301060308411],[69.39,33.6301081081081],[69.3900210908456,33.6301060308411],[69.3900413711819,33.6300998788684],[69.3900600616468,33.6300898886067],[69.3900764439763,33.6300764439763],[69.3900898886067,33.6300600616468],[69.3900998788684,33.6300413711819],[69.3901060308411,33.6300210908456],[69.3901081081081,33.63]]]}},{"properties":{"occupation":"Journalist","home_town":"Gardiz City","month":9,"latitude":33.63,"suspected_attacker":"Government","unique_id":48,"date":{"end_time":"2011/09/07 00:00:00 -0400","original":"9/6/2011","granularity":"day","time":"2011/09/06 00:00:00 -0400"},"investigation_result":null,"gender":"Male","incident_reason":"Reporting","day":null,"incident_province":"Paktya","incident_type":"Beaten","year":2006,"longitude":69.39,"organization":"Soli Paygham Radio","id":"47","incident_town":"Gardiz","incident_district":"Gardiz","age":null,"home_province":"Paktia","notes_other_details":null},"type":"Feature","geometry":{"type":"Polygon","coordinates":[[[69.3901081081081,33.63],[69.3901060308411,33.6299789091544],[69.3900998788684,33.6299586288181],[69.3900898886067,33.6299399383532],[69.3900764439763,33.6299235560237],[69.3900600616468,33.6299101113933],[69.3900413711819,33.6299001211316],[69.3900210908456,33.6298939691589],[69.39,33.6298918918919],[69.3899789091544,33.6298939691589],[69.3899586288181,33.6299001211316],[69.3899399383532,33.6299101113933],[69.3899235560237,33.6299235560237],[69.3899101113933,33.6299399383532],[69.3899001211316,33.6299586288181],[69.3898939691589,33.6299789091544],[69.3898918918919,33.63],[69.3898939691589,33.6300210908456],[69.3899001211316,33.6300413711819],[69.3899101113933,33.6300600616468],[69.3899235560237,33.6300764439763],[69.3899399383532,33.6300898886067],[69.3899586288181,33.6300998788684],[69.3899789091544,33.6301060308411],[69.39,33.6301081081081],[69.3900210908456,33.6301060308411],[69.3900413711819,33.6300998788684],[69.3900600616468,33.6300898886067],[69.3900764439763,33.6300764439763],[69.3900898886067,33.6300600616468],[69.3900998788684,33.6300413711819],[69.3901060308411,33.6300210908456],[69.3901081081081,33.63]]]}},{"properties":{"occupation":"Manager","home_town":"Kabul City","month":8,"latitude":34.55,"suspected_attacker":"Government","unique_id":49,"date":{"end_time":"2006/08/24 00:00:00 -0400","original":"8/23/2006","granularity":"day","time":"2006/08/23 00:00:00 -0400"},"investigation_result":null,"gender":"Male","incident_reason":"Publishing an article","day":23,"incident_province":"Kabul","incident_type":"Arrested","year":2006,"longitude":69.33,"organization":"Arman Mili Daily","id":"48","incident_town":"Kabul City","incident_district":"Kabul City","age":null,"home_province":"Kabul","notes_other_details":null},"type":"Feature","geometry":{"type":"Polygon","coordinates":[[[69.3301081081081,34.55],[69.3301060308411,34.5499789091544],[69.3300998788684,34.5499586288181],[69.3300898886067,34.5499399383532],[69.3300764439763,34.5499235560236],[69.3300600616468,34.5499101113933],[69.3300413711819,34.5499001211316],[69.3300210908456,34.5498939691589],[69.33,34.5498918918919],[69.3299789091544,34.5498939691589],[69.3299586288181,34.5499001211316],[69.3299399383532,34.5499101113933],[69.3299235560237,34.5499235560236],[69.3299101113933,34.5499399383532],[69.3299001211316,34.5499586288181],[69.3298939691589,34.5499789091544],[69.3298918918919,34.55],[69.3298939691589,34.5500210908456],[69.3299001211316,34.5500413711819],[69.3299101113933,34.5500600616468],[69.3299235560237,34.5500764439763],[69.3299399383532,34.5500898886067],[69.3299586288181,34.5500998788684],[69.3299789091544,34.5501060308411],[69.33,34.5501081081081],[69.3300210908456,34.5501060308411],[69.3300413711819,34.5500998788684],[69.3300600616468,34.5500898886067],[69.3300764439763,34.5500764439763],[69.3300898886067,34.5500600616468],[69.3300998788684,34.5500413711819],[69.3301060308411,34.5500210908456],[69.3301081081081,34.55]]]}},{"properties":{"occupation":"Journalist","home_town":"Italian","month":10,"latitude":31.04,"suspected_attacker":"Unknown Individuals","unique_id":50,"date":{"end_time":"2006/10/13 00:00:00 -0400","original":"10/12/2006","granularity":"day","time":"2006/10/12 00:00:00 -0400"},"investigation_result":null,"gender":"Male","incident_reason":"Reporting","day":12,"incident_province":"Kandahar","incident_type":"Kidnapped","year":2006,"longitude":65.71,"organization":"Freelance","id":"49","incident_town":null,"incident_district":null,"age":null,"home_province":"Italy","notes_other_details":null},"type":"Feature","geometry":{"type":"Polygon","coordinates":[[[65.7101081081081,31.04],[65.7101060308411,31.0399789091544],[65.7100998788684,31.0399586288181],[65.7100898886067,31.0399399383532],[65.7100764439763,31.0399235560237],[65.7100600616468,31.0399101113933],[65.7100413711819,31.0399001211316],[65.7100210908456,31.0398939691589],[65.71,31.0398918918919],[65.7099789091544,31.0398939691589],[65.7099586288181,31.0399001211316],[65.7099399383532,31.0399101113933],[65.7099235560237,31.0399235560237],[65.7099101113933,31.0399399383532],[65.7099001211316,31.0399586288181],[65.7098939691589,31.0399789091544],[65.7098918918919,31.04],[65.7098939691589,31.0400210908456],[65.7099001211316,31.0400413711819],[65.7099101113933,31.0400600616468],[65.7099235560237,31.0400764439763],[65.7099399383532,31.0400898886067],[65.7099586288181,31.0400998788684],[65.7099789091544,31.0401060308411],[65.71,31.0401081081081],[65.7100210908456,31.0401060308411],[65.7100413711819,31.0400998788684],[65.7100600616468,31.0400898886067],[65.7100764439763,31.0400764439763],[65.7100898886067,31.0400600616468],[65.7100998788684,31.0400413711819],[65.7101060308411,31.0400210908456],[65.7101081081081,31.04]]]}},{"properties":{"occupation":"Journalist","home_town":"Unclear","month":10,"latitude":35.8,"suspected_attacker":"Unknown Individuals","unique_id":51,"date":{"end_time":"2006/10/29 00:00:00 -0400","original":"10/28/2006","granularity":"day","time":"2006/10/28 00:00:00 -0400"},"investigation_result":null,"gender":"Male","incident_reason":"Reporting","day":28,"incident_province":"Baghlan","incident_type":"Killed","year":2006,"longitude":68.91,"organization":"DW","id":"50","incident_town":null,"incident_district":null,"age":null,"home_province":"Germany","notes_other_details":null},"type":"Feature","geometry":{"type":"Polygon","coordinates":[[[68.9101081081081,35.8],[68.9101060308411,35.7999789091544],[68.9100998788684,35.7999586288181],[68.9100898886067,35.7999399383532],[68.9100764439763,35.7999235560236],[68.9100600616468,35.7999101113933],[68.9100413711819,35.7999001211316],[68.9100210908456,35.7998939691589],[68.91,35.7998918918919],[68.9099789091544,35.7998939691589],[68.9099586288181,35.7999001211316],[68.9099399383532,35.7999101113933],[68.9099235560237,35.7999235560236],[68.9099101113933,35.7999399383532],[68.9099001211316,35.7999586288181],[68.9098939691589,35.7999789091544],[68.9098918918919,35.8],[68.9098939691589,35.8000210908456],[68.9099001211316,35.8000413711819],[68.9099101113933,35.8000600616468],[68.9099235560237,35.8000764439763],[68.9099399383532,35.8000898886067],[68.9099586288181,35.8000998788684],[68.9099789091544,35.8001060308411],[68.91,35.8001081081081],[68.9100210908456,35.8001060308411],[68.9100413711819,35.8000998788684],[68.9100600616468,35.8000898886067],[68.9100764439763,35.8000764439763],[68.9100898886067,35.8000600616468],[68.9100998788684,35.8000413711819],[68.9101060308411,35.8000210908456],[68.9101081081081,35.8]]]}},{"properties":{"occupation":"Journalist","home_town":"Unclear","month":10,"latitude":35.8,"suspected_attacker":"Unknown Individuals","unique_id":52,"date":{"end_time":"2006/10/29 00:00:00 -0400","original":"10/28/2006","granularity":"day","time":"2006/10/28 00:00:00 -0400"},"investigation_result":null,"gender":"Male","incident_reason":"Reporting","day":28,"incident_province":"Baghlan","incident_type":"Killed","year":2006,"longitude":68.91,"organization":"Dochiwele","id":"51","incident_town":null,"incident_district":null,"age":null,"home_province":"Germany","notes_other_details":null},"type":"Feature","geometry":{"type":"Polygon","coordinates":[[[68.9101081081081,35.8],[68.9101060308411,35.7999789091544],[68.9100998788684,35.7999586288181],[68.9100898886067,35.7999399383532],[68.9100764439763,35.7999235560236],[68.9100600616468,35.7999101113933],[68.9100413711819,35.7999001211316],[68.9100210908456,35.7998939691589],[68.91,35.7998918918919],[68.9099789091544,35.7998939691589],[68.9099586288181,35.7999001211316],[68.9099399383532,35.7999101113933],[68.9099235560237,35.7999235560236],[68.9099101113933,35.7999399383532],[68.9099001211316,35.7999586288181],[68.9098939691589,35.7999789091544],[68.9098918918919,35.8],[68.9098939691589,35.8000210908456],[68.9099001211316,35.8000413711819],[68.9099101113933,35.8000600616468],[68.9099235560237,35.8000764439763],[68.9099399383532,35.8000898886067],[68.9099586288181,35.8000998788684],[68.9099789091544,35.8001060308411],[68.91,35.8001081081081],[68.9100210908456,35.8001060308411],[68.9100413711819,35.8000998788684],[68.9100600616468,35.8000898886067],[68.9100764439763,35.8000764439763],[68.9100898886067,35.8000600616468],[68.9100998788684,35.8000413711819],[68.9101060308411,35.8000210908456],[68.9101081081081,35.8]]]}},{"properties":{"occupation":"Journalist","home_town":"Hirat City","month":10,"latitude":34.2,"suspected_attacker":"General Attorney","unique_id":53,"date":{"end_time":"2006/10/05 00:00:00 -0400","original":"10/4/2006","granularity":"day","time":"2006/10/04 00:00:00 -0400"},"investigation_result":null,"gender":"Male","incident_reason":"Reporting","day":4,"incident_province":"Hirat","incident_type":"Threatened","year":2006,"longitude":62.13,"organization":"Aryana TV","id":"52","incident_town":"Hirat City","incident_district":"Hirat City","age":null,"home_province":"Hirat","notes_other_details":null},"type":"Feature","geometry":{"type":"Polygon","coordinates":[[[62.1301081081081,34.2],[62.1301060308411,34.1999789091544],[62.1300998788684,34.1999586288181],[62.1300898886067,34.1999399383532],[62.1300764439763,34.1999235560237],[62.1300600616468,34.1999101113933],[62.1300413711819,34.1999001211316],[62.1300210908456,34.1998939691589],[62.13,34.1998918918919],[62.1299789091544,34.1998939691589],[62.1299586288181,34.1999001211316],[62.1299399383532,34.1999101113933],[62.1299235560237,34.1999235560237],[62.1299101113933,34.1999399383532],[62.1299001211316,34.1999586288181],[62.1298939691589,34.1999789091544],[62.1298918918919,34.2],[62.1298939691589,34.2000210908456],[62.1299001211316,34.2000413711819],[62.1299101113933,34.2000600616468],[62.1299235560237,34.2000764439764],[62.1299399383532,34.2000898886067],[62.1299586288181,34.2000998788684],[62.1299789091544,34.2001060308411],[62.13,34.2001081081081],[62.1300210908456,34.2001060308411],[62.1300413711819,34.2000998788684],[62.1300600616468,34.2000898886067],[62.1300764439763,34.2000764439764],[62.1300898886067,34.2000600616468],[62.1300998788684,34.2000413711819],[62.1301060308411,34.2000210908456],[62.1301081081081,34.2]]]}},{"properties":{"occupation":"ATV Manager","home_town":"Kabul City","month":10,"latitude":34.2,"suspected_attacker":"General Attorney","unique_id":54,"date":{"end_time":"2006/10/05 00:00:00 -0400","original":"10/4/2006","granularity":"day","time":"2006/10/04 00:00:00 -0400"},"investigation_result":null,"gender":"Male","incident_reason":"Reporting","day":4,"incident_province":"Hirat","incident_type":"Threatened","year":2006,"longitude":62.13,"organization":"Aryana TV","id":"53","incident_town":"Hirat City","incident_district":"Hirat City","age":null,"home_province":"Kabul","notes_other_details":null},"type":"Feature","geometry":{"type":"Polygon","coordinates":[[[62.1301081081081,34.2],[62.1301060308411,34.1999789091544],[62.1300998788684,34.1999586288181],[62.1300898886067,34.1999399383532],[62.1300764439763,34.1999235560237],[62.1300600616468,34.1999101113933],[62.1300413711819,34.1999001211316],[62.1300210908456,34.1998939691589],[62.13,34.1998918918919],[62.1299789091544,34.1998939691589],[62.1299586288181,34.1999001211316],[62.1299399383532,34.1999101113933],[62.1299235560237,34.1999235560237],[62.1299101113933,34.1999399383532],[62.1299001211316,34.1999586288181],[62.1298939691589,34.1999789091544],[62.1298918918919,34.2],[62.1298939691589,34.2000210908456],[62.1299001211316,34.2000413711819],[62.1299101113933,34.2000600616468],[62.1299235560237,34.2000764439764],[62.1299399383532,34.2000898886067],[62.1299586288181,34.2000998788684],[62.1299789091544,34.2001060308411],[62.13,34.2001081081081],[62.1300210908456,34.2001060308411],[62.1300413711819,34.2000998788684],[62.1300600616468,34.2000898886067],[62.1300764439763,34.2000764439764],[62.1300898886067,34.2000600616468],[62.1300998788684,34.2000413711819],[62.1301060308411,34.2000210908456],[62.1301081081081,34.2]]]}},{"properties":{"occupation":"Journalist","home_town":"Kabul City","month":10,"latitude":34.55,"suspected_attacker":"Police","unique_id":55,"date":{"end_time":"2006/10/18 00:00:00 -0400","original":"10/17/2006","granularity":"day","time":"2006/10/17 00:00:00 -0400"},"investigation_result":null,"gender":"Male","incident_reason":"Covering press conference of an AF minister","day":17,"incident_province":"Kabu