{"type":"FeatureCollection","data_type":"Data Feed","url_type":"csv","permissions":[{"permissions":{"download":true,"view":true},"group_id":"everyone"}],"classification":null,"title":"September 2012 Foreign Cities","count":61,"stream_id":339708,"contributor":{"url":"http://geocommons.com/users/56497","name":"GeorgeEastman"},"data_attributes":null,"calculation_params":null,"icon_link":null,"link":"http://geocommons.com/overlays/339708.json","extent":[-124.535,-32.1833,144.833,56.0937],"geometry_types":["point"],"unique_name":null,"name":"September 2012 Foreign Cities","feature_count":61,"description":"All the foreign places from which the visitors of the George Eastman House come.","next_feature":null,"is_raster":false,"short_classification":"Y","stats":{"date":{"max":"2012/09/30 00:00:00 -0400","variance":654016159475.41,"mean":"2012/09/14 07:04:55 -0400","stdev":808712.655691383,"min":"2012/09/01 00:00:00 -0400","median":"2012/09/16 00:00:00 -0400"}},"features":[{"properties":{"city":"Toronto","date":{"end_time":"2012/09/02 00:00:00 -0400","original":"9/1/2012","granularity":"day","time":"2012/09/01 00:00:00 -0400"},"country":"Canada","geo_score":0.857,"id":"adbnb5c4frlm","geo_precision":"zip"},"type":"Feature","geometry":{"type":"Point","coordinates":[-96.981734654,49.547791028]}},{"properties":{"city":"Toronto","date":{"end_time":"2012/09/02 00:00:00 -0400","original":"9/1/2012","granularity":"day","time":"2012/09/01 00:00:00 -0400"},"country":"Canada","geo_score":0.857,"id":"adbnb521bgg4","geo_precision":"zip"},"type":"Feature","geometry":{"type":"Point","coordinates":[-96.981734654,49.547791028]}},{"properties":{"city":"Toronto","date":{"end_time":"2012/09/02 00:00:00 -0400","original":"9/1/2012","granularity":"day","time":"2012/09/01 00:00:00 -0400"},"country":"Canada","geo_score":0.857,"id":"adbnb5acdyc5","geo_precision":"zip"},"type":"Feature","geometry":{"type":"Point","coordinates":[-96.981734654,49.547791028]}},{"properties":{"city":"Mississauga","date":{"end_time":"2012/09/02 00:00:00 -0400","original":"9/1/2012","granularity":"day","time":"2012/09/01 00:00:00 -0400"},"country":"Canada","geo_score":0.857,"id":"adbnb50etl1i","geo_precision":"zip"},"type":"Feature","geometry":{"type":"Point","coordinates":[-83.03317474,46.200057846]}},{"properties":{"city":"Edinburgh","date":{"end_time":"2012/09/06 00:00:00 -0400","original":"9/5/2012","granularity":"day","time":"2012/09/05 00:00:00 -0400"},"country":"Scotland","geo_score":0.714,"id":"adbnb5cd86gk","geo_precision":"zip"},"type":"Feature","geometry":{"type":"Point","coordinates":[14.9333333,48.2833333]}},{"properties":{"city":"Berlin","date":{"end_time":"2012/09/06 00:00:00 -0400","original":"9/5/2012","granularity":"day","time":"2012/09/05 00:00:00 -0400"},"country":"Germany","geo_score":0.857,"id":"adbnb5ajx8m6","geo_precision":"zip"},"type":"Feature","geometry":{"type":"Point","coordinates":[7.8166667,51.4]}},{"properties":{"city":"Tokyo","date":{"end_time":"2012/09/06 00:00:00 -0400","original":"9/5/2012","granularity":"day","time":"2012/09/05 00:00:00 -0400"},"country":"Japan","geo_score":0.857,"id":"adbnb56na9no","geo_precision":"zip"},"type":"Feature","geometry":{"type":"Point","coordinates":[140.3913889,38.1669444]}},{"properties":{"city":"London","date":{"end_time":"2012/09/06 00:00:00 -0400","original":"9/5/2012","granularity":"day","time":"2012/09/05 00:00:00 -0400"},"country":"United Kingdom","geo_score":0.857,"id":"adbnb561pc4p","geo_precision":"zip"},"type":"Feature","geometry":{"type":"Point","coordinates":[-2.8508333,51.7316667]}},{"properties":{"city":"Canberra","date":{"end_time":"2012/09/06 00:00:00 -0400","original":"9/5/2012","granularity":"day","time":"2012/09/05 00:00:00 -0400"},"country":"Australia","geo_score":0.857,"id":"adbnb58u0waf","geo_precision":"zip"},"type":"Feature","geometry":{"type":"Point","coordinates":[144.8333333,-32.1833333]}},{"properties":{"city":"Berlin","date":{"end_time":"2012/09/06 00:00:00 -0400","original":"9/5/2012","granularity":"day","time":"2012/09/05 00:00:00 -0400"},"country":"Germany","geo_score":0.857,"id":"adbnb598k942","geo_precision":"zip"},"type":"Feature","geometry":{"type":"Point","coordinates":[7.8166667,51.4]}},{"properties":{"city":"Berlin","date":{"end_time":"2012/09/06 00:00:00 -0400","original":"9/5/2012","granularity":"day","time":"2012/09/05 00:00:00 -0400"},"country":"Germany","geo_score":0.857,"id":"adbnb5a2c77a","geo_precision":"zip"},"type":"Feature","geometry":{"type":"Point","coordinates":[7.8166667,51.4]}},{"properties":{"city":"Paris","date":{"end_time":"2012/09/06 00:00:00 -0400","original":"9/5/2012","granularity":"day","time":"2012/09/05 00:00:00 -0400"},"country":"France","geo_score":0.857,"id":"adbnb503c6jt","geo_precision":"zip"},"type":"Feature","geometry":{"type":"Point","coordinates":[4.9333333,47.1]}},{"properties":{"city":"Taipei","date":{"end_time":"2012/09/06 00:00:00 -0400","original":"9/5/2012","granularity":"day","time":"2012/09/05 00:00:00 -0400"},"country":"Taiwan","geo_score":0.857,"id":"adbnb53a9302","geo_precision":"zip"},"type":"Feature","geometry":{"type":"Point","coordinates":[121.0666667,24.7]}},{"properties":{"city":"Ottawa","date":{"end_time":"2012/09/06 00:00:00 -0400","original":"9/5/2012","granularity":"day","time":"2012/09/05 00:00:00 -0400"},"country":"Canada","geo_score":0.857,"id":"adbnb5e4o85x","geo_precision":"zip"},"type":"Feature","geometry":{"type":"Point","coordinates":[-75.6902861595154,45.4209405046496]}},{"properties":{"city":"Berlin","date":{"end_time":"2012/09/06 00:00:00 -0400","original":"9/5/2012","granularity":"day","time":"2012/09/05 00:00:00 -0400"},"country":"Germany","geo_score":0.857,"id":"adbnb5372rv1","geo_precision":"zip"},"type":"Feature","geometry":{"type":"Point","coordinates":[7.8166667,51.4]}},{"properties":{"city":"Copenhagen","date":{"end_time":"2012/09/06 00:00:00 -0400","original":"9/5/2012","granularity":"day","time":"2012/09/05 00:00:00 -0400"},"country":"Denmark","geo_score":0.857,"id":"adbnb50bxwgs","geo_precision":"zip"},"type":"Feature","geometry":{"type":"Point","coordinates":[12.5903,55.6771]}},{"properties":{"city":"Copenhagen","date":{"end_time":"2012/09/06 00:00:00 -0400","original":"9/5/2012","granularity":"day","time":"2012/09/05 00:00:00 -0400"},"country":"Denmark","geo_score":0.857,"id":"adbnb5b490vf","geo_precision":"zip"},"type":"Feature","geometry":{"type":"Point","coordinates":[12.5903,55.6771]}},{"properties":{"city":"Vineland","date":{"end_time":"2012/09/06 00:00:00 -0400","original":"9/5/2012","granularity":"day","time":"2012/09/05 00:00:00 -0400"},"country":"Canada","geo_score":0.857,"id":"adbnb4zl4qx8","geo_precision":"zip"},"type":"Feature","geometry":{"type":"Point","coordinates":[-79.39959648,43.166815365]}},{"properties":{"city":"Ottawa","date":{"end_time":"2012/09/06 00:00:00 -0400","original":"9/5/2012","granularity":"day","time":"2012/09/05 00:00:00 -0400"},"country":"Canada","geo_score":0.857,"id":"adbnb4z3axvk","geo_precision":"zip"},"type":"Feature","geometry":{"type":"Point","coordinates":[-75.6902861595154,45.4209405046496]}},{"properties":{"city":"Guelph","date":{"end_time":"2012/09/06 00:00:00 -0400","original":"9/5/2012","granularity":"day","time":"2012/09/05 00:00:00 -0400"},"country":"Canada","geo_score":0.857,"id":"adbnb4z1om1l","geo_precision":"zip"},"type":"Feature","geometry":{"type":"Point","coordinates":[-80.299675381,43.566796808]}},{"properties":{"city":"North York","date":{"end_time":"2012/09/06 00:00:00 -0400","original":"9/5/2012","granularity":"day","time":"2012/09/05 00:00:00 -0400"},"country":"Canada","geo_score":0.857,"id":"adbnb4za12is","geo_precision":"zip"},"type":"Feature","geometry":{"type":"Point","coordinates":[-79.416304667,43.766813883]}},{"properties":{"city":"Thorold","date":{"end_time":"2012/09/06 00:00:00 -0400","original":"9/5/2012","granularity":"day","time":"2012/09/05 00:00:00 -0400"},"country":"Canada","geo_score":0.857,"id":"adbnb5em44vb","geo_precision":"zip"},"type":"Feature","geometry":{"type":"Point","coordinates":[-79.249583286,43.050116751]}},{"properties":{"city":"Anjou","date":{"end_time":"2012/09/06 00:00:00 -0400","original":"9/5/2012","granularity":"day","time":"2012/09/05 00:00:00 -0400"},"country":"Canada","geo_score":0.857,"id":"adbnb4zvb84h","geo_precision":"zip"},"type":"Feature","geometry":{"type":"Point","coordinates":[-73.549172577,45.600078515]}},{"properties":{"city":"Ottawa","date":{"end_time":"2012/09/06 00:00:00 -0400","original":"9/5/2012","granularity":"day","time":"2012/09/05 00:00:00 -0400"},"country":"Canada","geo_score":0.857,"id":"adbnb5437mel","geo_precision":"zip"},"type":"Feature","geometry":{"type":"Point","coordinates":[-75.6902861595154,45.4209405046496]}},{"properties":{"city":"Toronto","date":{"end_time":"2012/09/06 00:00:00 -0400","original":"9/5/2012","granularity":"day","time":"2012/09/05 00:00:00 -0400"},"country":"Canada","geo_score":0.857,"id":"adbnb5e6fw2z","geo_precision":"zip"},"type":"Feature","geometry":{"type":"Point","coordinates":[-96.981734654,49.547791028]}},{"properties":{"city":"Toronto","date":{"end_time":"2012/09/06 00:00:00 -0400","original":"9/5/2012","granularity":"day","time":"2012/09/05 00:00:00 -0400"},"country":"Canada","geo_score":0.857,"id":"adbnb55nnrb3","geo_precision":"zip"},"type":"Feature","geometry":{"type":"Point","coordinates":[-96.981734654,49.547791028]}},{"properties":{"city":"Cairo","date":{"end_time":"2012/09/13 00:00:00 -0400","original":"9/12/2012","granularity":"day","time":"2012/09/12 00:00:00 -0400"},"country":"Egypt","geo_score":0.857,"id":"adbnb53m37zg","geo_precision":"zip"},"type":"Feature","geometry":{"type":"Point","coordinates":[31.25,30.05]}},{"properties":{"city":"London","date":{"end_time":"2012/09/13 00:00:00 -0400","original":"9/12/2012","granularity":"day","time":"2012/09/12 00:00:00 -0400"},"country":"United Kingdom","geo_score":0.857,"id":"adbnb54lm87w","geo_precision":"zip"},"type":"Feature","geometry":{"type":"Point","coordinates":[-2.8508333,51.7316667]}},{"properties":{"city":"Bern","date":{"end_time":"2012/09/14 00:00:00 -0400","original":"9/13/2012","granularity":"day","time":"2012/09/13 00:00:00 -0400"},"country":"Switzerland","geo_score":0.857,"id":"adbnb5bwh0h3","geo_precision":"zip"},"type":"Feature","geometry":{"type":"Point","coordinates":[8.9833333,46.3666667]}},{"properties":{"city":"Bern","date":{"end_time":"2012/09/14 00:00:00 -0400","original":"9/13/2012","granularity":"day","time":"2012/09/13 00:00:00 -0400"},"country":"Switzerland","geo_score":0.857,"id":"adbnb5ec5g58","geo_precision":"zip"},"type":"Feature","geometry":{"type":"Point","coordinates":[8.9833333,46.3666667]}},{"properties":{"city":"Toronto","date":{"end_time":"2012/09/17 00:00:00 -0400","original":"9/16/2012","granularity":"day","time":"2012/09/16 00:00:00 -0400"},"country":"Canada","geo_score":0.857,"id":"adbnb5boft7p","geo_precision":"zip"},"type":"Feature","geometry":{"type":"Point","coordinates":[-96.981734654,49.547791028]}},{"properties":{"city":"Richmond Hill","date":{"end_time":"2012/09/17 00:00:00 -0400","original":"9/16/2012","granularity":"day","time":"2012/09/16 00:00:00 -0400"},"country":"Canada","geo_score":0.857,"id":"adbnb50txh8i","geo_precision":"zip"},"type":"Feature","geometry":{"type":"Point","coordinates":[-83.817718873,46.150075217]}},{"properties":{"city":"St. Catharines","date":{"end_time":"2012/09/19 00:00:00 -0400","original":"9/18/2012","granularity":"day","time":"2012/09/18 00:00:00 -0400"},"country":"Canada","geo_score":0.857,"id":"adbnb52yqgw2","geo_precision":"zip"},"type":"Feature","geometry":{"type":"Point","coordinates":[-60.148446254,45.983438684]}},{"properties":{"city":"Edmonton","date":{"end_time":"2012/09/19 00:00:00 -0400","original":"9/18/2012","granularity":"day","time":"2012/09/18 00:00:00 -0400"},"country":"Canada","geo_score":0.857,"id":"adbnb53j497i","geo_precision":"zip"},"type":"Feature","geometry":{"type":"Point","coordinates":[-124.535165901,56.093728141]}},{"properties":{"city":"Sydney","date":{"end_time":"2012/09/19 00:00:00 -0400","original":"9/18/2012","granularity":"day","time":"2012/09/18 00:00:00 -0400"},"country":"Australia","geo_score":0.857,"id":"adbnb5f0xeqn","geo_precision":"zip"},"type":"Feature","geometry":{"type":"Point","coordinates":[137.0166667,-20.05]}},{"properties":{"city":"Canberra","date":{"end_time":"2012/09/22 00:00:00 -0400","original":"9/21/2012","granularity":"day","time":"2012/09/21 00:00:00 -0400"},"country":"Australia","geo_score":0.857,"id":"adbnb55ymy7t","geo_precision":"zip"},"type":"Feature","geometry":{"type":"Point","coordinates":[144.8333333,-32.1833333]}},{"properties":{"city":"Jerusalem","date":{"end_time":"2012/09/22 00:00:00 -0400","original":"9/21/2012","granularity":"day","time":"2012/09/21 00:00:00 -0400"},"country":"Isreal","geo_score":0.714,"id":"adbnb50mrjhc","geo_precision":"zip"},"type":"Feature","geometry":{"type":"Point","coordinates":[31.0166667,-25.6833333]}},{"properties":{"city":"Ottawa","date":{"end_time":"2012/09/22 00:00:00 -0400","original":"9/21/2012","granularity":"day","time":"2012/09/21 00:00:00 -0400"},"country":"Canada","geo_score":0.857,"id":"adbnb5awhyz7","geo_precision":"zip"},"type":"Feature","geometry":{"type":"Point","coordinates":[-75.6902861595154,45.4209405046496]}},{"properties":{"city":"Madrid","date":{"end_time":"2012/09/22 00:00:00 -0400","original":"9/21/2012","granularity":"day","time":"2012/09/21 00:00:00 -0400"},"country":"Spain","geo_score":0.857,"id":"adbnb5eh4bz5","geo_precision":"zip"},"type":"Feature","geometry":{"type":"Point","coordinates":[3.8007,40.0014]}},{"properties":{"city":"Amsterdam","date":{"end_time":"2012/09/22 00:00:00 -0400","original":"9/21/2012","granularity":"day","time":"2012/09/21 00:00:00 -0400"},"country":"Holland","geo_score":0.714,"id":"adbnb55v551w","geo_precision":"zip"},"type":"Feature","geometry":{"type":"Point","coordinates":[23.0166667,-31.2833333]}},{"properties":{"city":"Oakville","date":{"end_time":"2012/09/22 00:00:00 -0400","original":"9/21/2012","granularity":"day","time":"2012/09/21 00:00:00 -0400"},"country":"Canada","geo_score":0.857,"id":"adbnb5ae02c2","geo_precision":"zip"},"type":"Feature","geometry":{"type":"Point","coordinates":[-98.004612497,49.929413959]}},{"properties":{"city":"Burlington","date":{"end_time":"2012/09/23 00:00:00 -0400","original":"9/22/2012","granularity":"day","time":"2012/09/22 00:00:00 -0400"},"country":"Canada","geo_score":0.857,"id":"adbnb52c9459","geo_precision":"zip"},"type":"Feature","geometry":{"type":"Point","coordinates":[-91.933564441,52.66682028]}},{"properties":{"city":"Dunnville","date":{"end_time":"2012/09/23 00:00:00 -0400","original":"9/22/2012","granularity":"day","time":"2012/09/22 00:00:00 -0400"},"country":"Canada","geo_score":0.857,"id":"adbnb5ch04az","geo_precision":"zip"},"type":"Feature","geometry":{"type":"Point","coordinates":[-72.017400604,45.784274288]}},{"properties":{"city":"Toronto","date":{"end_time":"2012/09/23 00:00:00 -0400","original":"9/22/2012","granularity":"day","time":"2012/09/22 00:00:00 -0400"},"country":"Canada","geo_score":0.857,"id":"adbnb57jhjzf","geo_precision":"zip"},"type":"Feature","geometry":{"type":"Point","coordinates":[-96.981734654,49.547791028]}},{"properties":{"city":"Toronto","date":{"end_time":"2012/09/23 00:00:00 -0400","original":"9/22/2012","granularity":"day","time":"2012/09/22 00:00:00 -0400"},"country":"Canada","geo_score":0.857,"id":"adbnb5cq9w3x","geo_precision":"zip"},"type":"Feature","geometry":{"type":"Point","coordinates":[-96.981734654,49.547791028]}},{"properties":{"city":"Toronto","date":{"end_time":"2012/09/23 00:00:00 -0400","original":"9/22/2012","granularity":"day","time":"2012/09/22 00:00:00 -0400"},"country":"Canada","geo_score":0.857,"id":"adbnb53nwnc4","geo_precision":"zip"},"type":"Feature","geometry":{"type":"Point","coordinates":[-96.981734654,49.547791028]}},{"properties":{"city":"Toronto","date":{"end_time":"2012/09/23 00:00:00 -0400","original":"9/22/2012","granularity":"day","time":"2012/09/22 00:00:00 -0400"},"country":"Canada","geo_score":0.857,"id":"adbnb5ed1nyk","geo_precision":"zip"},"type":"Feature","geometry":{"type":"Point","coordinates":[-96.981734654,49.547791028]}},{"properties":{"city":"Curridge","date":{"end_time":"2012/09/23 00:00:00 -0400","original":"9/22/2012","granularity":"day","time":"2012/09/22 00:00:00 -0400"},"country":"United Kingdom","geo_score":0.857,"id":"adbnb4z8gsup","geo_precision":"zip"},"type":"Feature","geometry":{"type":"Point","coordinates":[-4.5,55.55]}},{"properties":{"city":"Bern","date":{"end_time":"2012/09/26 00:00:00 -0400","original":"9/25/2012","granularity":"day","time":"2012/09/25 00:00:00 -0400"},"country":"Switzerland","geo_score":0.857,"id":"adbnb55vrlo2","geo_precision":"zip"},"type":"Feature","geometry":{"type":"Point","coordinates":[8.9833333,46.3666667]}},{"properties":{"city":"City of Brussels","date":{"end_time":"2012/09/26 00:00:00 -0400","original":"9/25/2012","granularity":"day","time":"2012/09/25 00:00:00 -0400"},"country":"Belgium","geo_score":0.857,"id":"adbnb4yndl8r","geo_precision":"zip"},"type":"Feature","geometry":{"type":"Point","coordinates":[4.48207855224609,50.8961039555436]}},{"properties":{"city":"Berlin","date":{"end_time":"2012/09/26 00:00:00 -0400","original":"9/25/2012","granularity":"day","time":"2012/09/25 00:00:00 -0400"},"country":"Germany","geo_score":0.857,"id":"adbnb58bkjq5","geo_precision":"zip"},"type":"Feature","geometry":{"type":"Point","coordinates":[7.8166667,51.4]}},{"properties":{"city":"Amsterdam","date":{"end_time":"2012/09/27 00:00:00 -0400","original":"9/26/2012","granularity":"day","time":"2012/09/26 00:00:00 -0400"},"country":"Netherlands","geo_score":0.857,"id":"adbnb50nsazo","geo_precision":"zip"},"type":"Feature","geometry":{"type":"Point","coordinates":[4.5333333,52.3333333]}},{"properties":{"city":"Rome","date":{"end_time":"2012/09/27 00:00:00 -0400","original":"9/26/2012","granularity":"day","time":"2012/09/26 00:00:00 -0400"},"country":"Italy","geo_score":0.857,"id":"adbnb59b2ow0","geo_precision":"zip"},"type":"Feature","geometry":{"type":"Point","coordinates":[11.01857,46.441412]}},{"properties":{"city":"Berlin","date":{"end_time":"2012/09/27 00:00:00 -0400","original":"9/26/2012","granularity":"day","time":"2012/09/26 00:00:00 -0400"},"country":"Germany","geo_score":0.857,"id":"adbnb5euew7f","geo_precision":"zip"},"type":"Feature","geometry":{"type":"Point","coordinates":[7.8166667,51.4]}},{"properties":{"city":"Tokyo","date":{"end_time":"2012/09/27 00:00:00 -0400","original":"9/26/2012","granularity":"day","time":"2012/09/26 00:00:00 -0400"},"country":"Japan","geo_score":0.857,"id":"adbnb5daczkd","geo_precision":"zip"},"type":"Feature","geometry":{"type":"Point","coordinates":[140.3913889,38.1669444]}},{"properties":{"city":"Jerusalem","date":{"end_time":"2012/09/27 00:00:00 -0400","original":"9/26/2012","granularity":"day","time":"2012/09/26 00:00:00 -0400"},"country":"Isreal","geo_score":0.714,"id":"adbnb5ambge9","geo_precision":"zip"},"type":"Feature","geometry":{"type":"Point","coordinates":[31.0166667,-25.6833333]}},{"properties":{"city":"Amsterdam","date":{"end_time":"2012/09/27 00:00:00 -0400","original":"9/26/2012","granularity":"day","time":"2012/09/26 00:00:00 -0400"},"country":"Netherlands","geo_score":0.857,"id":"adbnb5egbe8i","geo_precision":"zip"},"type":"Feature","geometry":{"type":"Point","coordinates":[4.5333333,52.3333333]}},{"properties":{"city":"Kuala Lumpur","date":{"end_time":"2012/09/27 00:00:00 -0400","original":"9/26/2012","granularity":"day","time":"2012/09/26 00:00:00 -0400"},"country":"Malaysia","geo_score":0.857,"id":"adbnb55abhcx","geo_precision":"zip"},"type":"Feature","geometry":{"type":"Point","coordinates":[100.4666667,4.95]}},{"properties":{"city":"Liverpool","date":{"end_time":"2012/09/27 00:00:00 -0400","original":"9/26/2012","granularity":"day","time":"2012/09/26 00:00:00 -0400"},"country":"United Kingdom","geo_score":0.857,"id":"adbnb5catgw0","geo_precision":"zip"},"type":"Feature","geometry":{"type":"Point","coordinates":[-0.0816947221755981,51.5177963524152]}},{"properties":{"city":"Ballyclare","date":{"end_time":"2012/09/30 00:00:00 -0400","original":"9/29/2012","granularity":"day","time":"2012/09/29 00:00:00 -0400"},"country":"United Kingdom","geo_score":0.857,"id":"adbnb594isn3","geo_precision":"zip"},"type":"Feature","geometry":{"type":"Point","coordinates":[-5.9666667,54.7]}},{"properties":{"city":"Brasília","date":{"end_time":"2012/10/01 00:00:00 -0400","original":"9/30/2012","granularity":"day","time":"2012/09/30 00:00:00 -0400"},"country":"Brazil","geo_score":0.857,"id":"adbnb4zmqsgx","geo_precision":"zip"},"type":"Feature","geometry":{"type":"Point","coordinates":[-68.74805556,-11.01611111]}}],"is_temporal":true,"author":{"url":"","metadata":"","contact_name":"Eliza Kozlowski","contact_address":"900 East Avenue\r\nRochester, NY 14607\r\n\r\ninfo@geh.org","source":"George Eastman House","contact_phone":"(585) 271-3361"},"source":"","pagination":{"sort":null,"start":0,"total":61,"limit":1000000},"state":"complete","tags":"abroad,city,country,eastman,foreign,geh,george,guest,house,location,place,travel,visit","published":"2013-04-02T16:00:00Z","id":339708}