{"type":"FeatureCollection","data_type":"Dataset","url_type":null,"permissions":[{"permissions":{"download":true,"view":true},"group_id":"everyone"}],"classification":null,"title":"MyDATA","count":667,"stream_id":349687,"contributor":{"url":"http://geocommons.com/users/70458","name":"wagtail"},"data_attributes":null,"calculation_params":null,"icon_link":null,"link":"http://geocommons.com/overlays/349687.json","extent":[-113.79,39.1654,6.17187,53.4255],"geometry_types":["point"],"unique_name":null,"name":"MyDATA","feature_count":667,"description":"","next_feature":null,"is_raster":false,"short_classification":"Y","stats":{"latitude":{"max":53.4254816,"variance":7.08918989526858,"mean":44.0155653458771,"stdev":2.66255326618428,"min":39.1653519,"median":43.1000898},"date":{"max":"2013/04/20 00:00:00 -0400","variance":1.1748058007387e+15,"mean":"2011/07/25 03:08:38 -0400","stdev":34275440.1975919,"min":"1999/05/15 00:00:00 -0400","median":"2011/07/22 00:00:00 -0400"},"checklists":{"max":557,"variance":476.920535227892,"mean":3.42578710644678,"stdev":21.8385103710828,"min":1,"median":1},"longitude":{"max":6.171869,"variance":707.47771723742,"mean":-77.3952648722639,"stdev":26.598453286562,"min":-113.7902927,"median":-85.4119205}},"features":[{"properties":{"latitude":43.123203,"date":{"end_time":"1999/05/16 00:00:00 -0400","original":"5/15/1999","granularity":"day","time":"1999/05/15 00:00:00 -0400"},"checklists":557,"longitude":-85.3578646,"id":"adtlbsrh0u9n","location":"DeBruine Home"},"type":"Feature","geometry":{"type":"Point","coordinates":[-85.3578646,43.123203]}},{"properties":{"latitude":42.7891652,"date":{"end_time":"2011/06/21 00:00:00 -0400","original":"6/20/2011","granularity":"day","time":"2011/06/20 00:00:00 -0400"},"checklists":48,"longitude":-86.1226845,"id":"adtlbsk3dsc2","location":"Kollen Park"},"type":"Feature","geometry":{"type":"Point","coordinates":[-86.1226845,42.7891652]}},{"properties":{"latitude":43.1472584,"date":{"end_time":"2009/05/30 00:00:00 -0400","original":"5/29/2009","granularity":"day","time":"2009/05/29 00:00:00 -0400"},"checklists":44,"longitude":-85.3972435,"id":"adtlbsp90u1l","location":"Wetland at Wabasis Creek and 12 Mile Rd."},"type":"Feature","geometry":{"type":"Point","coordinates":[-85.3972435,43.1472584]}},{"properties":{"latitude":42.7753544,"date":{"end_time":"2011/07/16 00:00:00 -0400","original":"7/15/2011","granularity":"day","time":"2011/07/15 00:00:00 -0400"},"checklists":32,"longitude":-86.2095236,"id":"adtlbspzomqb","location":"Holland SP"},"type":"Feature","geometry":{"type":"Point","coordinates":[-86.2095236,42.7753544]}},{"properties":{"latitude":43.6739325,"date":{"end_time":"2009/09/27 00:00:00 -0400","original":"9/26/2009","granularity":"day","time":"2009/09/26 00:00:00 -0400"},"checklists":28,"longitude":-87.8155124,"id":"adtlbsiqoodq","location":"Onion River and HWY V"},"type":"Feature","geometry":{"type":"Point","coordinates":[-87.8155124,43.6739325]}},{"properties":{"latitude":42.7748654,"date":{"end_time":"2011/06/21 00:00:00 -0400","original":"6/20/2011","granularity":"day","time":"2011/06/20 00:00:00 -0400"},"checklists":25,"longitude":-86.1376619,"id":"adtlbst8cduu","location":"DeGraaf Nature Center"},"type":"Feature","geometry":{"type":"Point","coordinates":[-86.1376619,42.7748654]}},{"properties":{"latitude":42.79433,"date":{"end_time":"2011/06/23 00:00:00 -0400","original":"6/22/2011","granularity":"day","time":"2011/06/22 00:00:00 -0400"},"checklists":24,"longitude":-86.100626,"id":"adtlbsp8e5gl","location":"Window on the Waterfront Park"},"type":"Feature","geometry":{"type":"Point","coordinates":[-86.100626,42.79433]}},{"properties":{"latitude":43.1237651,"date":{"end_time":"2010/04/06 00:00:00 -0400","original":"4/5/2010","granularity":"day","time":"2010/04/05 00:00:00 -0400"},"checklists":23,"longitude":-85.386266,"id":"adtlbsenaa9g","location":"Flat Iron Lake Preserve (restricted access)"},"type":"Feature","geometry":{"type":"Point","coordinates":[-85.386266,43.1237651]}},{"properties":{"latitude":43.109568,"date":{"end_time":"2010/02/09 00:00:00 -0500","original":"2/8/2010","granularity":"day","time":"2010/02/08 00:00:00 -0500"},"checklists":19,"longitude":-85.2715874,"id":"adtlbsqvk4u6","location":"Heffron Fields (Ionia Co.)"},"type":"Feature","geometry":{"type":"Point","coordinates":[-85.2715874,43.109568]}},{"properties":{"latitude":43.13897,"date":{"end_time":"2009/11/04 00:00:00 -0500","original":"11/3/2009","granularity":"day","time":"2009/11/03 00:00:00 -0500"},"checklists":18,"longitude":-85.39466,"id":"adtlbskhnk5z","location":"Wabasis Lake Park"},"type":"Feature","geometry":{"type":"Point","coordinates":[-85.39466,43.13897]}},{"properties":{"latitude":43.7020521,"date":{"end_time":"2011/05/19 00:00:00 -0400","original":"5/18/2011","granularity":"day","time":"2011/05/18 00:00:00 -0400"},"checklists":17,"longitude":-87.7506995,"id":"adtlbsts9n27","location":"Donohue"},"type":"Feature","geometry":{"type":"Point","coordinates":[-87.7506995,43.7020521]}},{"properties":{"latitude":52.225289,"date":{"end_time":"2011/08/11 00:00:00 -0400","original":"8/10/2011","granularity":"day","time":"2011/08/10 00:00:00 -0400"},"checklists":16,"longitude":5.9776032,"id":"adtlbssf72d2","location":"Hoornbloem 81"},"type":"Feature","geometry":{"type":"Point","coordinates":[5.9776032,52.225289]}},{"properties":{"latitude":43.2511023,"date":{"end_time":"2011/09/25 00:00:00 -0400","original":"9/24/2011","granularity":"day","time":"2011/09/24 00:00:00 -0400"},"checklists":15,"longitude":-86.037524,"id":"adtlbsorl0cr","location":"Muskegon Wastewater System"},"type":"Feature","geometry":{"type":"Point","coordinates":[-86.037524,43.2511023]}},{"properties":{"latitude":43.1274549,"date":{"end_time":"2010/03/08 00:00:00 -0500","original":"3/7/2010","granularity":"day","time":"2010/03/07 00:00:00 -0500"},"checklists":14,"longitude":-85.369606,"id":"adtlbst3btjz","location":"Hull Lane"},"type":"Feature","geometry":{"type":"Point","coordinates":[-85.369606,43.1274549]}},{"properties":{"latitude":42.7041198,"date":{"end_time":"2011/06/22 00:00:00 -0400","original":"6/21/2011","granularity":"day","time":"2011/06/21 00:00:00 -0400"},"checklists":13,"longitude":-85.9206766,"id":"adtlbspv8hit","location":"Smits House"},"type":"Feature","geometry":{"type":"Point","coordinates":[-85.9206766,42.7041198]}},{"properties":{"latitude":42.78707,"date":{"end_time":"2011/09/15 00:00:00 -0400","original":"9/14/2011","granularity":"day","time":"2011/09/14 00:00:00 -0400"},"checklists":13,"longitude":-86.1028274,"id":"adtlbsjphw6h","location":"Hope College--The Oaks"},"type":"Feature","geometry":{"type":"Point","coordinates":[-86.1028274,42.78707]}},{"properties":{"latitude":43.7641099,"date":{"end_time":"2010/12/29 00:00:00 -0500","original":"12/28/2010","granularity":"day","time":"2010/12/28 00:00:00 -0500"},"checklists":12,"longitude":-87.6958297,"id":"adtlbsjl1sh2","location":"Sheboygan--North Point"},"type":"Feature","geometry":{"type":"Point","coordinates":[-87.6958297,43.7641099]}},{"properties":{"latitude":42.8763415,"date":{"end_time":"2011/06/25 00:00:00 -0400","original":"6/24/2011","granularity":"day","time":"2011/06/24 00:00:00 -0400"},"checklists":12,"longitude":-85.5267137,"id":"adtlbsm100cs","location":"Gerald R. Ford Airport (Kraft Ave Access)"},"type":"Feature","geometry":{"type":"Point","coordinates":[-85.5267137,42.8763415]}},{"properties":{"latitude":43.67181,"date":{"end_time":"2010/12/29 00:00:00 -0500","original":"12/28/2010","granularity":"day","time":"2010/12/28 00:00:00 -0500"},"checklists":10,"longitude":-87.71857,"id":"adtlbsh0ne01","location":"Kohler-Andre SP"},"type":"Feature","geometry":{"type":"Point","coordinates":[-87.71857,43.67181]}},{"properties":{"latitude":42.94936,"date":{"end_time":"2011/02/06 00:00:00 -0500","original":"2/5/2011","granularity":"day","time":"2011/02/05 00:00:00 -0500"},"checklists":10,"longitude":-84.60337,"id":"adtlbshrsg7n","location":"Clinton"},"type":"Feature","geometry":{"type":"Point","coordinates":[-84.60337,42.94936]}},{"properties":{"latitude":43.0123043,"date":{"end_time":"2011/02/16 00:00:00 -0500","original":"2/15/2011","granularity":"day","time":"2011/02/15 00:00:00 -0500"},"checklists":10,"longitude":-85.6695843,"id":"adtlbshwwrt9","location":"Riverside Park"},"type":"Feature","geometry":{"type":"Point","coordinates":[-85.6695843,43.0123043]}},{"properties":{"latitude":42.9385485,"date":{"end_time":"2011/06/24 00:00:00 -0400","original":"6/23/2011","granularity":"day","time":"2011/06/23 00:00:00 -0400"},"checklists":10,"longitude":-85.3428268,"id":"adtlbsigrp8f","location":"Flat River--Riverside Dr (Lowell)"},"type":"Feature","geometry":{"type":"Point","coordinates":[-85.3428268,42.9385485]}},{"properties":{"latitude":42.9313366,"date":{"end_time":"2011/07/23 00:00:00 -0400","original":"7/22/2011","granularity":"day","time":"2011/07/22 00:00:00 -0400"},"checklists":10,"longitude":-85.7307816,"id":"adtlbssnstjk","location":"I-196 Ponds east of Millenium Park"},"type":"Feature","geometry":{"type":"Point","coordinates":[-85.7307816,42.9313366]}},{"properties":{"latitude":43.2235227,"date":{"end_time":"2009/11/22 00:00:00 -0500","original":"11/21/2009","granularity":"day","time":"2009/11/21 00:00:00 -0500"},"checklists":9,"longitude":-86.3392696,"id":"adtlbsj0ry40","location":"Pere Marquette Park"},"type":"Feature","geometry":{"type":"Point","coordinates":[-86.3392696,43.2235227]}},{"properties":{"latitude":43.0626765,"date":{"end_time":"2010/08/30 00:00:00 -0400","original":"8/29/2010","granularity":"day","time":"2010/08/29 00:00:00 -0400"},"checklists":9,"longitude":-85.5872057,"id":"adtlbspgp6f9","location":"Grand River--DNR Park (Plainfield Charter Twp.)"},"type":"Feature","geometry":{"type":"Point","coordinates":[-85.5872057,43.0626765]}},{"properties":{"latitude":43.1339067,"date":{"end_time":"2010/09/14 00:00:00 -0400","original":"9/13/2010","granularity":"day","time":"2010/09/13 00:00:00 -0400"},"checklists":9,"longitude":-85.367074,"id":"adtlbsubqw50","location":"Mobile Home Marsh"},"type":"Feature","geometry":{"type":"Point","coordinates":[-85.367074,43.1339067]}},{"properties":{"latitude":42.673696,"date":{"end_time":"2010/10/12 00:00:00 -0400","original":"10/11/2010","granularity":"day","time":"2010/10/11 00:00:00 -0400"},"checklists":9,"longitude":-80.3310871,"id":"adtlbshfpiq1","location":"Long Point--Turkey Point Beach"},"type":"Feature","geometry":{"type":"Point","coordinates":[-80.3310871,42.673696]}},{"properties":{"latitude":43.7578,"date":{"end_time":"2011/05/20 00:00:00 -0400","original":"5/19/2011","granularity":"day","time":"2011/05/19 00:00:00 -0400"},"checklists":9,"longitude":-87.7029,"id":"adtlbskj3fvo","location":"Sheboygan--Lakefront"},"type":"Feature","geometry":{"type":"Point","coordinates":[-87.7029,43.7578]}},{"properties":{"latitude":42.804664,"date":{"end_time":"2011/06/15 00:00:00 -0400","original":"6/14/2011","granularity":"day","time":"2011/06/14 00:00:00 -0400"},"checklists":9,"longitude":-85.9857309,"id":"adtlbsjsjmx5","location":"Holland Rest Area on HWY 196"},"type":"Feature","geometry":{"type":"Point","coordinates":[-85.9857309,42.804664]}},{"properties":{"latitude":42.7961249,"date":{"end_time":"2011/07/20 00:00:00 -0400","original":"7/19/2011","granularity":"day","time":"2011/07/19 00:00:00 -0400"},"checklists":9,"longitude":-86.1174917,"id":"adtlbsi878hr","location":"Dunton Park"},"type":"Feature","geometry":{"type":"Point","coordinates":[-86.1174917,42.7961249]}},{"properties":{"latitude":43.1369758,"date":{"end_time":"2010/03/23 00:00:00 -0400","original":"3/22/2010","granularity":"day","time":"2010/03/22 00:00:00 -0400"},"checklists":8,"longitude":-85.3660011,"id":"adtlbssri6cj","location":"Mobile Home Community--Lakefront"},"type":"Feature","geometry":{"type":"Point","coordinates":[-85.3660011,43.1369758]}},{"properties":{"latitude":43.1018602,"date":{"end_time":"2010/04/12 00:00:00 -0400","original":"4/11/2010","granularity":"day","time":"2010/04/11 00:00:00 -0400"},"checklists":8,"longitude":-85.3996468,"id":"adtlbsuffwpu","location":"Wabasis Ave. and 9 Mile"},"type":"Feature","geometry":{"type":"Point","coordinates":[-85.3996468,43.1018602]}},{"properties":{"latitude":43.03484,"date":{"end_time":"2011/01/23 00:00:00 -0500","original":"1/22/2011","granularity":"day","time":"2011/01/22 00:00:00 -0500"},"checklists":8,"longitude":-85.55583,"id":"adtlbspp9euj","location":"Kent"},"type":"Feature","geometry":{"type":"Point","coordinates":[-85.55583,43.03484]}},{"properties":{"latitude":42.8268566,"date":{"end_time":"2011/02/06 00:00:00 -0500","original":"2/5/2011","granularity":"day","time":"2011/02/05 00:00:00 -0500"},"checklists":8,"longitude":-82.1720976,"id":"adtlbsgui28m","location":"Lambton"},"type":"Feature","geometry":{"type":"Point","coordinates":[-82.1720976,42.8268566]}},{"properties":{"latitude":42.9936083,"date":{"end_time":"2011/02/06 00:00:00 -0500","original":"2/5/2011","granularity":"day","time":"2011/02/05 00:00:00 -0500"},"checklists":8,"longitude":-81.4572422,"id":"adtlbsszicj9","location":"Middlesex"},"type":"Feature","geometry":{"type":"Point","coordinates":[-81.4572422,42.9936083]}},{"properties":{"latitude":43.1089894,"date":{"end_time":"2011/02/06 00:00:00 -0500","original":"2/5/2011","granularity":"day","time":"2011/02/05 00:00:00 -0500"},"checklists":8,"longitude":-80.7689428,"id":"adtlbsl9wuf2","location":"Oxford"},"type":"Feature","geometry":{"type":"Point","coordinates":[-80.7689428,43.1089894]}},{"properties":{"latitude":43.00457,"date":{"end_time":"2011/02/06 00:00:00 -0500","original":"2/5/2011","granularity":"day","time":"2011/02/05 00:00:00 -0500"},"checklists":8,"longitude":-83.69396,"id":"adtlbsgxzoq6","location":"Genesee"},"type":"Feature","geometry":{"type":"Point","coordinates":[-83.69396,43.00457]}},{"properties":{"latitude":43.23584,"date":{"end_time":"2011/06/19 00:00:00 -0400","original":"6/18/2011","granularity":"day","time":"2011/06/18 00:00:00 -0400"},"checklists":8,"longitude":-85.3617,"id":"adtlbspr3p19","location":"Lincoln Lake"},"type":"Feature","geometry":{"type":"Point","coordinates":[-85.3617,43.23584]}},{"properties":{"latitude":42.8569572,"date":{"end_time":"2011/06/21 00:00:00 -0400","original":"6/20/2011","granularity":"day","time":"2011/06/20 00:00:00 -0400"},"checklists":8,"longitude":-85.5169344,"id":"adtlbsrljzqi","location":"60th St east of Kraft"},"type":"Feature","geometry":{"type":"Point","coordinates":[-85.5169344,42.8569572]}},{"properties":{"latitude":42.805375,"date":{"end_time":"2011/09/15 00:00:00 -0400","original":"9/14/2011","granularity":"day","time":"2011/09/14 00:00:00 -0400"},"checklists":8,"longitude":-85.5129929,"id":"adtlbshdxsg9","location":"Caledonia Sewage Ponds (limited access)"},"type":"Feature","geometry":{"type":"Point","coordinates":[-85.5129929,42.805375]}},{"properties":{"latitude":42.7273436,"date":{"end_time":"2011/10/14 00:00:00 -0400","original":"10/13/2011","granularity":"day","time":"2011/10/13 00:00:00 -0400"},"checklists":8,"longitude":-86.0972786,"id":"adtlbsnreop4","location":"Outdoor Discovery Center"},"type":"Feature","geometry":{"type":"Point","coordinates":[-86.0972786,42.7273436]}},{"properties":{"latitude":43.07391,"date":{"end_time":"2009/08/21 00:00:00 -0400","original":"8/20/2009","granularity":"day","time":"2009/08/20 00:00:00 -0400"},"checklists":7,"longitude":-85.46264,"id":"adtlbslwob5x","location":"Pickerel Lake Nature Preserve"},"type":"Feature","geometry":{"type":"Point","coordinates":[-85.46264,43.07391]}},{"properties":{"latitude":42.9538729,"date":{"end_time":"2010/01/03 00:00:00 -0500","original":"1/2/2010","granularity":"day","time":"2010/01/02 00:00:00 -0500"},"checklists":7,"longitude":-85.6082752,"id":"adtlbsq73n8v","location":"Reed's Lake"},"type":"Feature","geometry":{"type":"Point","coordinates":[-85.6082752,42.9538729]}},{"properties":{"latitude":42.9564,"date":{"end_time":"2011/02/06 00:00:00 -0500","original":"2/5/2011","granularity":"day","time":"2011/02/05 00:00:00 -0500"},"checklists":7,"longitude":-84.14734,"id":"adtlbsfysgpx","location":"Shiawassee"},"type":"Feature","geometry":{"type":"Point","coordinates":[-84.14734,42.9564]}},{"properties":{"latitude":42.9334,"date":{"end_time":"2011/02/06 00:00:00 -0500","original":"2/5/2011","granularity":"day","time":"2011/02/05 00:00:00 -0500"},"checklists":7,"longitude":-80.66643,"id":"adtlbsenmpbd","location":"Springford"},"type":"Feature","geometry":{"type":"Point","coordinates":[-80.66643,42.9334]}},{"properties":{"latitude":42.98109,"date":{"end_time":"2011/04/22 00:00:00 -0400","original":"4/21/2011","granularity":"day","time":"2011/04/21 00:00:00 -0400"},"checklists":7,"longitude":-85.53528,"id":"adtlbsi8iqvh","location":"Roselle Park"},"type":"Feature","geometry":{"type":"Point","coordinates":[-85.53528,42.98109]}},{"properties":{"latitude":41.44871,"date":{"end_time":"2011/05/18 00:00:00 -0400","original":"5/17/2011","granularity":"day","time":"2011/05/17 00:00:00 -0400"},"checklists":7,"longitude":-87.38184,"id":"adtlbsikekrm","location":"Lake"},"type":"Feature","geometry":{"type":"Point","coordinates":[-87.38184,41.44871]}},{"properties":{"latitude":42.8482403,"date":{"end_time":"2011/06/25 00:00:00 -0400","original":"6/24/2011","granularity":"day","time":"2011/06/24 00:00:00 -0400"},"checklists":7,"longitude":-85.6107244,"id":"adtlbsed5mk5","location":"M-6 (Kent Co.)"},"type":"Feature","geometry":{"type":"Point","coordinates":[-85.6107244,42.8482403]}},{"properties":{"latitude":42.7817007,"date":{"end_time":"2011/06/30 00:00:00 -0400","original":"6/29/2011","granularity":"day","time":"2011/06/29 00:00:00 -0400"},"checklists":7,"longitude":-85.9206877,"id":"adtlbseekfxt","location":"Autumn Hills Landfill"},"type":"Feature","geometry":{"type":"Point","coordinates":[-85.9206877,42.7817007]}},{"properties":{"latitude":43.0649301,"date":{"end_time":"2011/12/18 00:00:00 -0500","original":"12/17/2011","granularity":"day","time":"2011/12/17 00:00:00 -0500"},"checklists":7,"longitude":-80.7789381,"id":"adtlbssfbbx2","location":"Trillium Woods Provincial Park"},"type":"Feature","geometry":{"type":"Point","coordinates":[-80.7789381,43.0649301]}},{"properties":{"latitude":42.7448549,"date":{"end_time":"2012/01/13 00:00:00 -0500","original":"1/12/2012","granularity":"day","time":"2012/01/12 00:00:00 -0500"},"checklists":7,"longitude":-86.1159629,"id":"adtlbslxkfvu","location":"Tulip City Airport (restricted access)"},"type":"Feature","geometry":{"type":"Point","coordinates":[-86.1159629,42.7448549]}},{"properties":{"latitude":52.4425542,"date":{"end_time":"2012/12/18 00:00:00 -0500","original":"12/17/2012","granularity":"day","time":"2012/12/17 00:00:00 -0500"},"checklists":7,"longitude":4.7809089,"id":"adtlbsr74fgp","location":"Westzaan Boerderij"},"type":"Feature","geometry":{"type":"Point","coordinates":[4.7809089,52.4425542]}},{"properties":{"latitude":43.1032859,"date":{"end_time":"2003/05/02 00:00:00 -0400","original":"5/1/2003","granularity":"day","time":"2003/05/01 00:00:00 -0400"},"checklists":6,"longitude":-85.5557621,"id":"adtlbsfk1epg","location":"Winding Trail Acres"},"type":"Feature","geometry":{"type":"Point","coordinates":[-85.5557621,43.1032859]}},{"properties":{"latitude":42.9796761,"date":{"end_time":"2009/12/14 00:00:00 -0500","original":"12/13/2009","granularity":"day","time":"2009/12/13 00:00:00 -0500"},"checklists":6,"longitude":-85.5852985,"id":"adtlbsgvb531","location":"Frederik Meijer Gardens"},"type":"Feature","geometry":{"type":"Point","coordinates":[-85.5852985,42.9796761]}},{"properties":{"latitude":43.0435,"date":{"end_time":"2010/01/05 00:00:00 -0500","original":"1/4/2010","granularity":"day","time":"2010/01/04 00:00:00 -0500"},"checklists":6,"longitude":-85.38007,"id":"adtlbsgdt70x","location":"Murray Lake"},"type":"Feature","geometry":{"type":"Point","coordinates":[-85.38007,43.0435]}},{"properties":{"latitude":43.1092233,"date":{"end_time":"2010/02/04 00:00:00 -0500","original":"2/3/2010","granularity":"day","time":"2010/02/03 00:00:00 -0500"},"checklists":6,"longitude":-85.3325272,"id":"adtlbsj3h6n4","location":"Heffron Fields (Kent Co.)"},"type":"Feature","geometry":{"type":"Point","coordinates":[-85.3325272,43.1092233]}},{"properties":{"latitude":43.056015,"date":{"end_time":"2010/04/18 00:00:00 -0400","original":"4/17/2010","granularity":"day","time":"2010/04/17 00:00:00 -0400"},"checklists":6,"longitude":-86.2476568,"id":"adtlbsphyrn3","location":"Grand Haven SP"},"type":"Feature","geometry":{"type":"Point","coordinates":[-86.2476568,43.056015]}},{"properties":{"latitude":44.3644831,"date":{"end_time":"2010/06/07 00:00:00 -0400","original":"6/6/2010","granularity":"day","time":"2010/06/06 00:00:00 -0400"},"checklists":6,"longitude":-84.8041534,"id":"adtlbsf8tltd","location":"Houghton Lake Flats"},"type":"Feature","geometry":{"type":"Point","coordinates":[-84.8041534,44.3644831]}},{"properties":{"latitude":43.0826807,"date":{"end_time":"2010/09/05 00:00:00 -0400","original":"9/4/2010","granularity":"day","time":"2010/09/04 00:00:00 -0400"},"checklists":6,"longitude":-85.4119205,"id":"adtlbsplscih","location":"Cannonsburg Sand and Gravel and Duga Lake"},"type":"Feature","geometry":{"type":"Point","coordinates":[-85.4119205,43.0826807]}},{"properties":{"latitude":43.06006,"date":{"end_time":"2010/12/26 00:00:00 -0500","original":"12/25/2010","granularity":"day","time":"2010/12/25 00:00:00 -0500"},"checklists":6,"longitude":-85.57819,"id":"adtlbsoln6nm","location":"Versluis Park"},"type":"Feature","geometry":{"type":"Point","coordinates":[-85.57819,43.06006]}},{"properties":{"latitude":43.6727452,"date":{"end_time":"2010/12/30 00:00:00 -0500","original":"12/29/2010","granularity":"day","time":"2010/12/29 00:00:00 -0500"},"checklists":6,"longitude":-87.758317,"id":"adtlbsnyd5ji","location":"Sauk Trail Rd."},"type":"Feature","geometry":{"type":"Point","coordinates":[-87.758317,43.6727452]}},{"properties":{"latitude":42.94979,"date":{"end_time":"2011/02/06 00:00:00 -0500","original":"2/5/2011","granularity":"day","time":"2011/02/05 00:00:00 -0500"},"checklists":6,"longitude":-85.07577,"id":"adtlbspoq7px","location":"Ionia"},"type":"Feature","geometry":{"type":"Point","coordinates":[-85.07577,42.94979]}},{"properties":{"latitude":43.10719,"date":{"end_time":"2011/02/06 00:00:00 -0500","original":"2/5/2011","granularity":"day","time":"2011/02/05 00:00:00 -0500"},"checklists":6,"longitude":-83.22172,"id":"adtlbskx1uj0","location":"Lapeer"},"type":"Feature","geometry":{"type":"Point","coordinates":[-83.22172,43.10719]}},{"properties":{"latitude":42.90199,"date":{"end_time":"2011/02/06 00:00:00 -0500","original":"2/5/2011","granularity":"day","time":"2011/02/05 00:00:00 -0500"},"checklists":6,"longitude":-82.70601,"id":"adtlbsh3la1k","location":"St. Clair"},"type":"Feature","geometry":{"type":"Point","coordinates":[-82.70601,42.90199]}},{"properties":{"latitude":43.29904,"date":{"end_time":"2011/02/24 00:00:00 -0500","original":"2/23/2011","granularity":"day","time":"2011/02/23 00:00:00 -0500"},"checklists":6,"longitude":-85.19983,"id":"adtlbspk4c9a","location":"Montcalm"},"type":"Feature","geometry":{"type":"Point","coordinates":[-85.19983,43.29904]}},{"properties":{"latitude":42.7874645,"date":{"end_time":"2011/06/15 00:00:00 -0400","original":"6/14/2011","granularity":"day","time":"2011/06/14 00:00:00 -0400"},"checklists":6,"longitude":-86.1055237,"id":"adtlbsj8irlj","location":"Hope College--Schaap Science Center Organic Chemistry Lab"},"type":"Feature","geometry":{"type":"Point","coordinates":[-86.1055237,42.7874645]}},{"properties":{"latitude":43.1447626,"date":{"end_time":"2011/06/19 00:00:00 -0400","original":"6/18/2011","granularity":"day","time":"2011/06/18 00:00:00 -0400"},"checklists":6,"longitude":-85.352402,"id":"adtlbstpttxa","location":"Lincoln Lake Rd. and 12 Mile Rd. Swamp"},"type":"Feature","geometry":{"type":"Point","coordinates":[-85.352402,43.1447626]}},{"properties":{"latitude":42.7931921,"date":{"end_time":"2011/06/23 00:00:00 -0400","original":"6/22/2011","granularity":"day","time":"2011/06/22 00:00:00 -0400"},"checklists":6,"longitude":-86.0966563,"id":"adtlbssfy8ck","location":"Windmill Island Park"},"type":"Feature","geometry":{"type":"Point","coordinates":[-86.0966563,42.7931921]}},{"properties":{"latitude":42.7835591,"date":{"end_time":"2012/01/10 00:00:00 -0500","original":"1/9/2012","granularity":"day","time":"2012/01/09 00:00:00 -0500"},"checklists":6,"longitude":-86.1867356,"id":"adtlbspwbm6z","location":"Lake Macatawa--Chippewa Point"},"type":"Feature","geometry":{"type":"Point","coordinates":[-86.1867356,42.7835591]}},{"properties":{"latitude":43.0835897,"date":{"end_time":"2009/05/12 00:00:00 -0400","original":"5/11/2009","granularity":"day","time":"2009/05/11 00:00:00 -0400"},"checklists":5,"longitude":-85.236783,"id":"adtlbslnw3m4","location":"Belding Sewage Lagoons (restricted access)"},"type":"Feature","geometry":{"type":"Point","coordinates":[-85.236783,43.0835897]}},{"properties":{"latitude":43.77889,"date":{"end_time":"2009/09/27 00:00:00 -0400","original":"9/26/2009","granularity":"day","time":"2009/09/26 00:00:00 -0400"},"checklists":5,"longitude":-87.75527,"id":"adtlbso6q7lp","location":"Maywood Environmental Area"},"type":"Feature","geometry":{"type":"Point","coordinates":[-87.75527,43.77889]}},{"properties":{"latitude":43.2645813,"date":{"end_time":"2009/11/22 00:00:00 -0500","original":"11/21/2009","granularity":"day","time":"2009/11/21 00:00:00 -0500"},"checklists":5,"longitude":-86.0079803,"id":"adtlbskj7ize","location":"Muskegon Wastewater System--White/Swanson Fields"},"type":"Feature","geometry":{"type":"Point","coordinates":[-86.0079803,43.2645813]}},{"properties":{"latitude":43.0198625,"date":{"end_time":"2009/11/27 00:00:00 -0500","original":"11/26/2009","granularity":"day","time":"2009/11/26 00:00:00 -0500"},"checklists":5,"longitude":-85.602411,"id":"adtlbss5bgm3","location":"Wildridge Pond"},"type":"Feature","geometry":{"type":"Point","coordinates":[-85.602411,43.0198625]}},{"properties":{"latitude":43.1093173,"date":{"end_time":"2010/02/28 00:00:00 -0500","original":"2/27/2010","granularity":"day","time":"2010/02/27 00:00:00 -0500"},"checklists":5,"longitude":-85.3526545,"id":"adtlbsfuq4rz","location":"Lincoln Lake Ave. and Big Pine Island Dr."},"type":"Feature","geometry":{"type":"Point","coordinates":[-85.3526545,43.1093173]}},{"properties":{"latitude":43.1546826,"date":{"end_time":"2010/03/10 00:00:00 -0500","original":"3/9/2010","granularity":"day","time":"2010/03/09 00:00:00 -0500"},"checklists":5,"longitude":-85.3920293,"id":"adtlbslcj7kg","location":"Wabasis Ave. and Elkins"},"type":"Feature","geometry":{"type":"Point","coordinates":[-85.3920293,43.1546826]}},{"properties":{"latitude":43.1315265,"date":{"end_time":"2010/04/06 00:00:00 -0400","original":"4/5/2010","granularity":"day","time":"2010/04/05 00:00:00 -0400"},"checklists":5,"longitude":-85.3717518,"id":"adtlbsf3fs83","location":"Hull Lane Lakefront"},"type":"Feature","geometry":{"type":"Point","coordinates":[-85.3717518,43.1315265]}},{"properties":{"latitude":42.60591,"date":{"end_time":"2010/05/18 00:00:00 -0400","original":"5/17/2010","granularity":"day","time":"2010/05/17 00:00:00 -0400"},"checklists":5,"longitude":-83.91142,"id":"adtlbsfd1qqi","location":"Livingston"},"type":"Feature","geometry":{"type":"Point","coordinates":[-83.91142,42.60591]}},{"properties":{"latitude":41.9213607,"date":{"end_time":"2010/07/06 00:00:00 -0400","original":"7/5/2010","granularity":"day","time":"2010/07/05 00:00:00 -0400"},"checklists":5,"longitude":-86.5810794,"id":"adtlbslxvxlu","location":"Warren Dunes SP--Floral Lane"},"type":"Feature","geometry":{"type":"Point","coordinates":[-86.5810794,41.9213607]}},{"properties":{"latitude":43.1198748,"date":{"end_time":"2010/08/11 00:00:00 -0400","original":"8/10/2010","granularity":"day","time":"2010/08/10 00:00:00 -0400"},"checklists":5,"longitude":-85.3423548,"id":"adtlbsgrlxo8","location":"Tully"},"type":"Feature","geometry":{"type":"Point","coordinates":[-85.3423548,43.1198748]}},{"properties":{"latitude":43.125312,"date":{"end_time":"2011/01/09 00:00:00 -0500","original":"1/8/2011","granularity":"day","time":"2011/01/08 00:00:00 -0500"},"checklists":5,"longitude":-85.3770844,"id":"adtlbsj6vlf5","location":"Hart Rd. and Lessiter Rd."},"type":"Feature","geometry":{"type":"Point","coordinates":[-85.3770844,43.125312]}},{"properties":{"latitude":42.93363,"date":{"end_time":"2011/01/16 00:00:00 -0500","original":"1/15/2011","granularity":"day","time":"2011/01/15 00:00:00 -0500"},"checklists":5,"longitude":-85.34192,"id":"adtlbsjpkdrq","location":"Lowell"},"type":"Feature","geometry":{"type":"Point","coordinates":[-85.34192,42.93363]}},{"properties":{"latitude":43.99226,"date":{"end_time":"2011/02/23 00:00:00 -0500","original":"2/22/2011","granularity":"day","time":"2011/02/22 00:00:00 -0500"},"checklists":5,"longitude":-84.85052,"id":"adtlbsr49cif","location":"Clare"},"type":"Feature","geometry":{"type":"Point","coordinates":[-84.85052,43.99226]}},{"properties":{"latitude":43.163041,"date":{"end_time":"2011/03/13 00:00:00 -0500","original":"3/12/2011","granularity":"day","time":"2011/03/12 00:00:00 -0500"},"checklists":5,"longitude":-85.3650784,"id":"adtlbsltyw8a","location":"Podunk Reservoir"},"type":"Feature","geometry":{"type":"Point","coordinates":[-85.3650784,43.163041]}},{"properties":{"latitude":52.0605081,"date":{"end_time":"2011/08/10 00:00:00 -0400","original":"8/9/2011","granularity":"day","time":"2011/08/09 00:00:00 -0400"},"checklists":5,"longitude":5.946751,"id":"adtlbskkwkmw","location":"Gelderland"},"type":"Feature","geometry":{"type":"Point","coordinates":[5.946751,52.0605081]}},{"properties":{"latitude":42.7875314,"date":{"end_time":"2011/09/06 00:00:00 -0400","original":"9/5/2011","granularity":"day","time":"2011/09/05 00:00:00 -0400"},"checklists":5,"longitude":-86.1066771,"id":"adtlbsqhb8ie","location":"Hope College--Graves Place"},"type":"Feature","geometry":{"type":"Point","coordinates":[-86.1066771,42.7875314]}},{"properties":{"latitude":43.2581433,"date":{"end_time":"2011/12/30 00:00:00 -0500","original":"12/29/2011","granularity":"day","time":"2011/12/29 00:00:00 -0500"},"checklists":5,"longitude":-85.6878448,"id":"adtlbsm9r91x","location":"Howard Christensen Nature Center"},"type":"Feature","geometry":{"type":"Point","coordinates":[-85.6878448,43.2581433]}},{"properties":{"latitude":42.7107706,"date":{"end_time":"2012/02/23 00:00:00 -0500","original":"2/22/2012","granularity":"day","time":"2012/02/22 00:00:00 -0500"},"checklists":5,"longitude":-85.9973054,"id":"adtlbsghimm1","location":"140th and 46th fields"},"type":"Feature","geometry":{"type":"Point","coordinates":[-85.9973054,42.7107706]}},{"properties":{"latitude":42.8249802,"date":{"end_time":"2012/03/04 00:00:00 -0500","original":"3/3/2012","granularity":"day","time":"2012/03/03 00:00:00 -0500"},"checklists":5,"longitude":-85.5942623,"id":"adtlbsth7fbf","location":"76th St Flooded Field between Hannah Lake and Breton"},"type":"Feature","geometry":{"type":"Point","coordinates":[-85.5942623,42.8249802]}},{"properties":{"latitude":44.1090898,"date":{"end_time":"2012/03/24 00:00:00 -0400","original":"3/23/2012","granularity":"day","time":"2012/03/23 00:00:00 -0400"},"checklists":5,"longitude":-85.3813632,"id":"adtlbsqaar5w","location":"Kettunen Center"},"type":"Feature","geometry":{"type":"Point","coordinates":[-85.3813632,44.1090898]}},{"properties":{"latitude":42.9633293,"date":{"end_time":"2010/01/22 00:00:00 -0500","original":"1/21/2010","granularity":"day","time":"2010/01/21 00:00:00 -0500"},"checklists":4,"longitude":-85.668129,"id":"adtlbsft1b7p","location":"Grand Rapids"},"type":"Feature","geometry":{"type":"Point","coordinates":[-85.668129,42.9633293]}},{"properties":{"latitude":43.0654391,"date":{"end_time":"2010/02/07 00:00:00 -0500","original":"2/6/2010","granularity":"day","time":"2010/02/06 00:00:00 -0500"},"checklists":4,"longitude":-85.4120493,"id":"adtlbsmxh4k3","location":"Saul Lake Bog Nature Preserve"},"type":"Feature","geometry":{"type":"Point","coordinates":[-85.4120493,43.0654391]}},{"properties":{"latitude":43.085909,"date":{"end_time":"2010/03/01 00:00:00 -0500","original":"2/28/2010","granularity":"day","time":"2010/02/28 00:00:00 -0500"},"checklists":4,"longitude":-85.3969431,"id":"adtlbsjcyak9","location":"Wabasis Ave. and M44"},"type":"Feature","geometry":{"type":"Point","coordinates":[-85.3969431,43.085909]}},{"properties":{"latitude":42.5806413,"date":{"end_time":"2010/05/16 00:00:00 -0400","original":"5/15/2010","granularity":"day","time":"2010/05/15 00:00:00 -0400"},"checklists":4,"longitude":-80.3857613,"id":"adtlbsf2s2z7","location":"Long Point--'New' Provincial Park"},"type":"Feature","geometry":{"type":"Point","coordinates":[-80.3857613,42.5806413]}},{"properties":{"latitude":43.1180266,"date":{"end_time":"2010/05/30 00:00:00 -0400","original":"5/29/2010","granularity":"day","time":"2010/05/29 00:00:00 -0400"},"checklists":4,"longitude":-85.396986,"id":"adtlbslkrgyw","location":"Wabasis Ave. and 10 Mile"},"type":"Feature","geometry":{"type":"Point","coordinates":[-85.396986,43.1180266]}},{"properties":{"latitude":42.0260038,"date":{"end_time":"2010/09/21 00:00:00 -0400","original":"9/20/2010","granularity":"day","time":"2010/09/20 00:00:00 -0400"},"checklists":4,"longitude":-83.1978204,"id":"adtlbst8ro4l","location":"Pte. Mouillee SGA"},"type":"Feature","geometry":{"type":"Point","coordinates":[-83.1978204,42.0260038]}},{"properties":{"latitude":43.2982,"date":{"end_time":"2011/02/24 00:00:00 -0500","original":"2/23/2011","granularity":"day","time":"2011/02/23 00:00:00 -0500"},"checklists":4,"longitude":-84.60933,"id":"adtlbsnem23g","location":"Gratiot"},"type":"Feature","geometry":{"type":"Point","coordinates":[-84.60933,43.2982]}},{"properties":{"latitude":43.64315,"date":{"end_time":"2011/03/20 00:00:00 -0400","original":"3/19/2011","granularity":"day","time":"2011/03/19 00:00:00 -0400"},"checklists":4,"longitude":-85.32644,"id":"adtlbsf2ukkg","location":"Mecosta"},"type":"Feature","geometry":{"type":"Point","coordinates":[-85.32644,43.64315]}},{"properties":{"latitude":42.59931,"date":{"end_time":"2011/04/10 00:00:00 -0400","original":"4/9/2011","granularity":"day","time":"2011/04/09 00:00:00 -0400"},"checklists":4,"longitude":-84.84236,"id":"adtlbspa4fur","location":"Eaton"},"type":"Feature","geometry":{"type":"Point","coordinates":[-84.84236,42.59931]}},{"properties":{"latitude":43.1157416,"date":{"end_time":"2011/05/03 00:00:00 -0400","original":"5/2/2011","granularity":"day","time":"2011/05/02 00:00:00 -0400"},"checklists":4,"longitude":-85.2381087,"id":"adtlbsigbf58","location":"Flat River SGA--Ranney Rd."},"type":"Feature","geometry":{"type":"Point","coordinates":[-85.2381087,43.1157416]}},{"properties":{"latitude":42.98953,"date":{"end_time":"2011/05/10 00:00:00 -0400","original":"5/9/2011","granularity":"day","time":"2011/05/09 00:00:00 -0400"},"checklists":4,"longitude":-86.02988,"id":"adtlbsr75xbb","location":"Ottawa"},"type":"Feature","geometry":{"type":"Point","coordinates":[-86.02988,42.98953]}},{"properties":{"latitude":41.50274,"date":{"end_time":"2011/05/18 00:00:00 -0400","original":"5/17/2011","granularity":"day","time":"2011/05/17 00:00:00 -0400"},"checklists":4,"longitude":-86.71409,"id":"adtlbsh68wx6","location":"La Porte"},"type":"Feature","geometry":{"type":"Point","coordinates":[-86.71409,41.50274]}},{"properties":{"latitude":43.6741383,"date":{"end_time":"2011/05/19 00:00:00 -0400","original":"5/18/2011","granularity":"day","time":"2011/05/18 00:00:00 -0400"},"checklists":4,"longitude":-87.8003097,"id":"adtlbsq7lcdk","location":"Six Corners"},"type":"Feature","geometry":{"type":"Point","coordinates":[-87.8003097,43.6741383]}},{"properties":{"latitude":42.8475103,"date":{"end_time":"2011/06/16 00:00:00 -0400","original":"6/15/2011","granularity":"day","time":"2011/06/15 00:00:00 -0400"},"checklists":4,"longitude":-85.8051839,"id":"adtlbsgoui65","location":"M-6 (Ottawa Co.)"},"type":"Feature","geometry":{"type":"Point","coordinates":[-85.8051839,42.8475103]}},{"properties":{"latitude":42.9072222,"date":{"end_time":"2011/06/21 00:00:00 -0400","original":"6/20/2011","granularity":"day","time":"2011/06/20 00:00:00 -0400"},"checklists":4,"longitude":-85.3588889,"id":"adtlbst48ths","location":"Bradford Dickinson White Nature Preserve"},"type":"Feature","geometry":{"type":"Point","coordinates":[-85.3588889,42.9072222]}},{"properties":{"latitude":42.9091974,"date":{"end_time":"2011/06/22 00:00:00 -0400","original":"6/21/2011","granularity":"day","time":"2011/06/21 00:00:00 -0400"},"checklists":4,"longitude":-85.5359674,"id":"adtlbsnrb7fs","location":"Wetland East of Hotel Ave"},"type":"Feature","geometry":{"type":"Point","coordinates":[-85.5359674,42.9091974]}},{"properties":{"latitude":43.0039959,"date":{"end_time":"2011/06/26 00:00:00 -0400","original":"6/25/2011","granularity":"day","time":"2011/06/25 00:00:00 -0400"},"checklists":4,"longitude":-83.2195165,"id":"adtlbserif8q","location":"Lapeer Co. Rest Area on I-69"},"type":"Feature","geometry":{"type":"Point","coordinates":[-83.2195165,43.0039959]}},{"properties":{"latitude":43.2185471,"date":{"end_time":"2011/07/01 00:00:00 -0400","original":"6/30/2011","granularity":"day","time":"2011/06/30 00:00:00 -0400"},"checklists":4,"longitude":-85.5204964,"id":"adtlbsochhih","location":"17 Mile Rd marshes"},"type":"Feature","geometry":{"type":"Point","coordinates":[-85.5204964,43.2185471]}},{"properties":{"latitude":43.1604272,"date":{"end_time":"2011/07/01 00:00:00 -0400","original":"6/30/2011","granularity":"day","time":"2011/06/30 00:00:00 -0400"},"checklists":4,"longitude":-85.4803598,"id":"adtlbsn04cc8","location":"13 Mile Rd &amp; Berrigan Ave (flooded field)"},"type":"Feature","geometry":{"type":"Point","coordinates":[-85.4803598,43.1604272]}},{"properties":{"latitude":42.8178932,"date":{"end_time":"2011/07/06 00:00:00 -0400","original":"7/5/2011","granularity":"day","time":"2011/07/05 00:00:00 -0400"},"checklists":4,"longitude":-86.1576317,"id":"adtlbsshbpwf","location":"152nd Ave .5 miles north of James St."},"type":"Feature","geometry":{"type":"Point","coordinates":[-86.1576317,42.8178932]}},{"properties":{"latitude":52.3153527,"date":{"end_time":"2011/08/10 00:00:00 -0400","original":"8/9/2011","granularity":"day","time":"2011/08/09 00:00:00 -0400"},"checklists":4,"longitude":4.7492695,"id":"adtlbsoe9epi","location":"Amsteram Airport Schiphol"},"type":"Feature","geometry":{"type":"Point","coordinates":[4.7492695,52.3153527]}},{"properties":{"latitude":42.7015506,"date":{"end_time":"2011/09/07 00:00:00 -0400","original":"9/6/2011","granularity":"day","time":"2011/09/06 00:00:00 -0400"},"checklists":4,"longitude":-86.1950397,"id":"adtlbshjfm58","location":"Saugatuck Dunes SP"},"type":"Feature","geometry":{"type":"Point","coordinates":[-86.1950397,42.7015506]}},{"properties":{"latitude":43.2862572,"date":{"end_time":"2011/10/30 00:00:00 -0400","original":"10/29/2011","granularity":"day","time":"2011/10/29 00:00:00 -0400"},"checklists":4,"longitude":-85.3925657,"id":"adtlbsgijpk4","location":"Penny and Sprague"},"type":"Feature","geometry":{"type":"Point","coordinates":[-85.3925657,43.2862572]}},{"properties":{"latitude":42.7770704,"date":{"end_time":"2011/11/24 00:00:00 -0500","original":"11/23/2011","granularity":"day","time":"2011/11/23 00:00:00 -0500"},"checklists":4,"longitude":-85.6757641,"id":"adtlbsnwiwzg","location":"Kent Dump"},"type":"Feature","geometry":{"type":"Point","coordinates":[-85.6757641,42.7770704]}},{"properties":{"latitude":43.1535086,"date":{"end_time":"2011/11/27 00:00:00 -0500","original":"11/26/2011","granularity":"day","time":"2011/11/26 00:00:00 -0500"},"checklists":4,"longitude":-85.3295803,"id":"adtlbsorr8sv","location":"Morgan Lake Channel"},"type":"Feature","geometry":{"type":"Point","coordinates":[-85.3295803,43.1535086]}},{"properties":{"latitude":42.699039,"date":{"end_time":"2011/12/27 00:00:00 -0500","original":"12/26/2011","granularity":"day","time":"2011/12/26 00:00:00 -0500"},"checklists":4,"longitude":-86.0314374,"id":"adtlbsjzvpro","location":"M-40 near 50th"},"type":"Feature","geometry":{"type":"Point","coordinates":[-86.0314374,42.699039]}},{"properties":{"latitude":42.9651349,"date":{"end_time":"2012/01/08 00:00:00 -0500","original":"1/7/2012","granularity":"day","time":"2012/01/07 00:00:00 -0500"},"checklists":4,"longitude":-85.3324739,"id":"adtlbsnh2zvh","location":"Flat River Bluff Park"},"type":"Feature","geometry":{"type":"Point","coordinates":[-85.3324739,42.9651349]}},{"properties":{"latitude":42.7879896,"date":{"end_time":"2012/04/27 00:00:00 -0400","original":"4/26/2012","granularity":"day","time":"2012/04/26 00:00:00 -0400"},"checklists":4,"longitude":-86.1060663,"id":"adtlbsr4rmz0","location":"Hope College finals study spots (mainly VanderWerf and VanWylen)"},"type":"Feature","geometry":{"type":"Point","coordinates":[-86.1060663,42.7879896]}},{"properties":{"latitude":43.164434,"date":{"end_time":"2009/09/16 00:00:00 -0400","original":"9/15/2009","granularity":"day","time":"2009/09/15 00:00:00 -0400"},"checklists":3,"longitude":-85.2678108,"id":"adtlbsjzz222","location":"Baldwin Lake"},"type":"Feature","geometry":{"type":"Point","coordinates":[-85.2678108,43.164434]}},{"properties":{"latitude":43.230954,"date":{"end_time":"2010/01/19 00:00:00 -0500","original":"1/18/2010","granularity":"day","time":"2010/01/18 00:00:00 -0500"},"checklists":3,"longitude":-86.3301587,"id":"adtlbsmcrhgt","location":"Muskegon--Channel"},"type":"Feature","geometry":{"type":"Point","coordinates":[-86.3301587,43.230954]}},{"properties":{"latitude":43.0728379,"date":{"end_time":"2010/04/18 00:00:00 -0400","original":"4/17/2010","granularity":"day","time":"2010/04/17 00:00:00 -0400"},"checklists":3,"longitude":-86.2260246,"id":"adtlbsq7rnh4","location":"Harbor Island"},"type":"Feature","geometry":{"type":"Point","coordinates":[-86.2260246,43.0728379]}},{"properties":{"latitude":44.6516809,"date":{"end_time":"2010/05/07 00:00:00 -0400","original":"5/6/2010","granularity":"day","time":"2010/05/06 00:00:00 -0400"},"checklists":3,"longitude":-84.6376419,"id":"adtlbsj61l52","location":"Staley Lake Rd and M-72"},"type":"Feature","geometry":{"type":"Point","coordinates":[-84.6376419,44.6516809]}},{"properties":{"latitude":41.9553986,"date":{"end_time":"2010/05/18 00:00:00 -0400","original":"5/17/2010","granularity":"day","time":"2010/05/17 00:00:00 -0400"},"checklists":3,"longitude":-82.5139999,"id":"adtlbsiux3og","location":"Point Pelee National Park"},"type":"Feature","geometry":{"type":"Point","coordinates":[-82.5139999,41.9553986]}},{"properties":{"latitude":43.1233126,"date":{"end_time":"2010/08/02 00:00:00 -0400","original":"8/1/2010","granularity":"day","time":"2010/08/01 00:00:00 -0400"},"checklists":3,"longitude":-85.3580886,"id":"adtlbsj7rd0c","location":"DeBruine Bird Feeder"},"type":"Feature","geometry":{"type":"Point","coordinates":[-85.3580886,43.1233126]}},{"properties":{"latitude":43.09783,"date":{"end_time":"2010/09/21 00:00:00 -0400","original":"9/20/2010","granularity":"day","time":"2010/09/20 00:00:00 -0400"},"checklists":3,"longitude":-85.22892,"id":"adtlbsns7ecb","location":"Belding"},"type":"Feature","geometry":{"type":"Point","coordinates":[-85.22892,43.09783]}},{"properties":{"latitude":43.2698937,"date":{"end_time":"2010/10/14 00:00:00 -0400","original":"10/13/2010","granularity":"day","time":"2010/10/13 00:00:00 -0400"},"checklists":3,"longitude":-79.9324894,"id":"adtlbsox15vv","location":"Dundas--Dundas Marsh  (Hydro Pond)"},"type":"Feature","geometry":{"type":"Point","coordinates":[-79.9324894,43.2698937]}},{"properties":{"latitude":43.2718623,"date":{"end_time":"2010/10/14 00:00:00 -0400","original":"10/13/2010","granularity":"day","time":"2010/10/13 00:00:00 -0400"},"checklists":3,"longitude":-79.9224043,"id":"adtlbssuraer","location":"Hamilton--Cootes Paradise (The Willows)"},"type":"Feature","geometry":{"type":"Point","coordinates":[-79.9224043,43.2718623]}},{"properties":{"latitude":43.7494943,"date":{"end_time":"2010/12/29 00:00:00 -0500","original":"12/28/2010","granularity":"day","time":"2010/12/28 00:00:00 -0500"},"checklists":3,"longitude":-87.7020291,"id":"adtlbstnsmyd","location":"Sheboygan--Harbor (general)"},"type":"Feature","geometry":{"type":"Point","coordinates":[-87.7020291,43.7494943]}},{"properties":{"latitude":42.99987,"date":{"end_time":"2011/02/06 00:00:00 -0500","original":"2/5/2011","granularity":"day","time":"2011/02/05 00:00:00 -0500"},"checklists":3,"longitude":-80.59971,"id":"adtlbstl9z9q","location":"Norwich"},"type":"Feature","geometry":{"type":"Point","coordinates":[-80.59971,42.99987]}},{"properties":{"latitude":43.1199964,"date":{"end_time":"2011/02/13 00:00:00 -0500","original":"2/12/2011","granularity":"day","time":"2011/02/12 00:00:00 -0500"},"checklists":3,"longitude":-85.3423929,"id":"adtlbsm9t3f4","location":"10 Mile Rd and Tully Ave"},"type":"Feature","geometry":{"type":"Point","coordinates":[-85.3423929,43.1199964]}},{"properties":{"latitude":42.9995627,"date":{"end_time":"2011/02/16 00:00:00 -0500","original":"2/15/2011","granularity":"day","time":"2011/02/15 00:00:00 -0500"},"checklists":3,"longitude":-85.6716871,"id":"adtlbsnebuif","location":"Riverside Park--South"},"type":"Feature","geometry":{"type":"Point","coordinates":[-85.6716871,42.9995627]}},{"properties":{"latitude":43.64389,"date":{"end_time":"2011/02/24 00:00:00 -0500","original":"2/23/2011","granularity":"day","time":"2011/02/23 00:00:00 -0500"},"checklists":3,"longitude":-84.85064,"id":"adtlbsf6sw99","location":"Isabella"},"type":"Feature","geometry":{"type":"Point","coordinates":[-84.85064,43.64389]}},{"properties":{"latitude":42.980932,"date":{"end_time":"2011/03/12 00:00:00 -0500","original":"3/11/2011","granularity":"day","time":"2011/03/11 00:00:00 -0500"},"checklists":3,"longitude":-85.6723309,"id":"adtlbsp6f7iy","location":"Grand River--Canal Park"},"type":"Feature","geometry":{"type":"Point","coordinates":[-85.6723309,42.980932]}},{"properties":{"latitude":43.17753,"date":{"end_time":"2011/03/13 00:00:00 -0500","original":"3/12/2011","granularity":"day","time":"2011/03/12 00:00:00 -0500"},"checklists":3,"longitude":-85.25282,"id":"adtlbsm7vlrb","location":"Greenville"},"type":"Feature","geometry":{"type":"Point","coordinates":[-85.25282,43.17753]}},{"properties":{"latitude":43.99313,"date":{"end_time":"2011/03/20 00:00:00 -0400","original":"3/19/2011","granularity":"day","time":"2011/03/19 00:00:00 -0400"},"checklists":3,"longitude":-85.32774,"id":"adtlbsjin7kl","location":"Osceola"},"type":"Feature","geometry":{"type":"Point","coordinates":[-85.32774,43.99313]}},{"properties":{"latitude":44.3412,"date":{"end_time":"2011/03/20 00:00:00 -0400","original":"3/19/2011","granularity":"day","time":"2011/03/19 00:00:00 -0400"},"checklists":3,"longitude":-85.57758,"id":"adtlbsfjdfhr","location":"Wexford"},"type":"Feature","geometry":{"type":"Point","coordinates":[-85.57758,44.3412]}},{"properties":{"latitude":43.1233048,"date":{"end_time":"2011/04/01 00:00:00 -0400","original":"3/31/2011","granularity":"day","time":"2011/03/31 00:00:00 -0400"},"checklists":3,"longitude":-85.3761292,"id":"adtlbsmpv3vi","location":"The Little Duck Pond"},"type":"Feature","geometry":{"type":"Point","coordinates":[-85.3761292,43.1233048]}},{"properties":{"latitude":42.60298,"date":{"end_time":"2011/04/10 00:00:00 -0400","original":"4/9/2011","granularity":"day","time":"2011/04/09 00:00:00 -0400"},"checklists":3,"longitude":-84.37397,"id":"adtlbsqivd38","location":"Ingham"},"type":"Feature","geometry":{"type":"Point","coordinates":[-84.37397,42.60298]}},{"properties":{"latitude":43.1123406,"date":{"end_time":"2011/04/21 00:00:00 -0400","original":"4/20/2011","granularity":"day","time":"2011/04/20 00:00:00 -0400"},"checklists":3,"longitude":-85.3754425,"id":"adtlbskcy5tt","location":"Chapin Lake"},"type":"Feature","geometry":{"type":"Point","coordinates":[-85.3754425,43.1123406]}},{"properties":{"latitude":41.8126,"date":{"end_time":"2011/05/18 00:00:00 -0400","original":"5/17/2011","granularity":"day","time":"2011/05/17 00:00:00 -0400"},"checklists":3,"longitude":-87.89935,"id":"adtlbsgcgjv5","location":"Cook"},"type":"Feature","geometry":{"type":"Point","coordinates":[-87.89935,41.8126]}},{"properties":{"latitude":43.01924,"date":{"end_time":"2011/05/18 00:00:00 -0400","original":"5/17/2011","granularity":"day","time":"2011/05/17 00:00:00 -0400"},"checklists":3,"longitude":-87.93937,"id":"adtlbsepakxd","location":"Milwaukee"},"type":"Feature","geometry":{"type":"Point","coordinates":[-87.93937,43.01924]}},{"properties":{"latitude":42.24804,"date":{"end_time":"2011/05/18 00:00:00 -0400","original":"5/17/2011","granularity":"day","time":"2011/05/17 00:00:00 -0400"},"checklists":3,"longitude":-86.06985,"id":"adtlbslcbb9q","location":"Van Buren"},"type":"Feature","geometry":{"type":"Point","coordinates":[-86.06985,42.24804]}},{"properties":{"latitude":42.7872241,"date":{"end_time":"2011/06/15 00:00:00 -0400","original":"6/14/2011","granularity":"day","time":"2011/06/14 00:00:00 -0400"},"checklists":3,"longitude":-86.1021924,"id":"adtlbssbfzoa","location":"Hope College--General"},"type":"Feature","geometry":{"type":"Point","coordinates":[-86.1021924,42.7872241]}},{"properties":{"latitude":42.80406,"date":{"end_time":"2011/06/30 00:00:00 -0400","original":"6/29/2011","granularity":"day","time":"2011/06/29 00:00:00 -0400"},"checklists":3,"longitude":-86.0725379,"id":"adtlbsq3ccww","location":"US Army Corps of Engineers Dredge Spoils Ponds (Holland)"},"type":"Feature","geometry":{"type":"Point","coordinates":[-86.0725379,42.80406]}},{"properties":{"latitude":43.0412926,"date":{"end_time":"2011/07/02 00:00:00 -0400","original":"7/1/2011","granularity":"day","time":"2011/07/01 00:00:00 -0400"},"checklists":3,"longitude":-85.493288,"id":"adtlbsefhtmz","location":"Cannonsburg SGA"},"type":"Feature","geometry":{"type":"Point","coordinates":[-85.493288,43.0412926]}},{"properties":{"latitude":42.8093809,"date":{"end_time":"2011/07/12 00:00:00 -0400","original":"7/11/2011","granularity":"day","time":"2011/07/11 00:00:00 -0400"},"checklists":3,"longitude":-85.9789181,"id":"adtlbskqtm81","location":"Upper Macatawa Natural Area"},"type":"Feature","geometry":{"type":"Point","coordinates":[-85.9789181,42.8093809]}},{"properties":{"latitude":42.9410461,"date":{"end_time":"2011/07/15 00:00:00 -0400","original":"7/14/2011","granularity":"day","time":"2011/07/14 00:00:00 -0400"},"checklists":3,"longitude":-85.7443321,"id":"adtlbspgxdhh","location":"Millennium Park (Kent Co.)"},"type":"Feature","geometry":{"type":"Point","coordinates":[-85.7443321,42.9410461]}},{"properties":{"latitude":43.142602,"date":{"end_time":"2011/07/17 00:00:00 -0400","original":"7/16/2011","granularity":"day","time":"2011/07/16 00:00:00 -0400"},"checklists":3,"longitude":-85.3790524,"id":"adtlbshwya48","location":"Wellman Ave"},"type":"Feature","geometry":{"type":"Point","coordinates":[-85.3790524,43.142602]}},{"properties":{"latitude":44.7377329,"date":{"end_time":"2011/08/04 00:00:00 -0400","original":"8/3/2011","granularity":"day","time":"2011/08/03 00:00:00 -0400"},"checklists":3,"longitude":-84.6849346,"id":"adtlbskrfpz6","location":"Hartwick Pines SP--Campground"},"type":"Feature","geometry":{"type":"Point","coordinates":[-84.6849346,44.7377329]}},{"properties":{"latitude":44.741237,"date":{"end_time":"2011/08/04 00:00:00 -0400","original":"8/3/2011","granularity":"day","time":"2011/08/03 00:00:00 -0400"},"checklists":3,"longitude":-84.6636915,"id":"adtlbskwj470","location":"Hartwick Pines SP--Visitor Center"},"type":"Feature","geometry":{"type":"Point","coordinates":[-84.6636915,44.741237]}},{"properties":{"latitude":52.3246388,"date":{"end_time":"2011/08/11 00:00:00 -0400","original":"8/10/2011","granularity":"day","time":"2011/08/10 00:00:00 -0400"},"checklists":3,"longitude":5.8491898,"id":"adtlbstd992m","location":"Vierhouten Bos"},"type":"Feature","geometry":{"type":"Point","coordinates":[5.8491898,52.3246388]}},{"properties":{"latitude":52.0958107,"date":{"end_time":"2011/08/12 00:00:00 -0400","original":"8/11/2011","granularity":"day","time":"2011/08/11 00:00:00 -0400"},"checklists":3,"longitude":5.1774097,"id":"adtlbssp4ayg","location":"Utrecht"},"type":"Feature","geometry":{"type":"Point","coordinates":[5.1774097,52.0958107]}},{"properties":{"latitude":52.4640633,"date":{"end_time":"2011/08/20 00:00:00 -0400","original":"8/19/2011","granularity":"day","time":"2011/08/19 00:00:00 -0400"},"checklists":3,"longitude":4.7723579,"id":"adtlbsr87jgt","location":"Westzaan"},"type":"Feature","geometry":{"type":"Point","coordinates":[4.7723579,52.4640633]}},{"properties":{"latitude":42.7877133,"date":{"end_time":"2011/09/13 00:00:00 -0400","original":"9/12/2011","granularity":"day","time":"2011/09/12 00:00:00 -0400"},"checklists":3,"longitude":-86.1081011,"id":"adtlbstvses4","location":"Hope College--Centennial Park"},"type":"Feature","geometry":{"type":"Point","coordinates":[-86.1081011,42.7877133]}},{"properties":{"latitude":43.2849847,"date":{"end_time":"2011/09/25 00:00:00 -0400","original":"9/24/2011","granularity":"day","time":"2011/09/24 00:00:00 -0400"},"checklists":3,"longitude":-86.080018,"id":"adtlbskqc9qk","location":"Muskegon SGA--Lane's Landing"},"type":"Feature","geometry":{"type":"Point","coordinates":[-86.080018,43.2849847]}},{"properties":{"latitude":43.1198152,"date":{"end_time":"2011/10/15 00:00:00 -0400","original":"10/14/2011","granularity":"day","time":"2011/10/14 00:00:00 -0400"},"checklists":3,"longitude":-85.2355986,"id":"adtlbstfn7rs","location":"Flat River SGA (Montcalm Co.)"},"type":"Feature","geometry":{"type":"Point","coordinates":[-85.2355986,43.1198152]}},{"properties":{"latitude":43.0386987,"date":{"end_time":"2011/10/30 00:00:00 -0400","original":"10/29/2011","granularity":"day","time":"2011/10/29 00:00:00 -0400"},"checklists":3,"longitude":-85.6521692,"id":"adtlbsfkbiqo","location":"Lamoreaux Park"},"type":"Feature","geometry":{"type":"Point","coordinates":[-85.6521692,43.0386987]}},{"properties":{"latitude":42.8052457,"date":{"end_time":"2012/02/18 00:00:00 -0500","original":"2/17/2012","granularity":"day","time":"2012/02/17 00:00:00 -0500"},"checklists":3,"longitude":-86.0458388,"id":"adtlbsk9epir","location":"Cool Pond at Van Hill and Chicago Dr"},"type":"Feature","geometry":{"type":"Point","coordinates":[-86.0458388,42.8052457]}},{"properties":{"latitude":42.6433667,"date":{"end_time":"2012/03/11 00:00:00 -0500","original":"3/10/2012","granularity":"day","time":"2012/03/10 00:00:00 -0500"},"checklists":3,"longitude":-86.1974859,"id":"adtlbsoj9m41","location":"Wade's Bayou Park"},"type":"Feature","geometry":{"type":"Point","coordinates":[-86.1974859,42.6433667]}},{"properties":{"latitude":42.6445712,"date":{"end_time":"2012/04/06 00:00:00 -0400","original":"4/5/2012","granularity":"day","time":"2012/04/05 00:00:00 -0400"},"checklists":3,"longitude":-85.9223959,"id":"adtlbsjjt0jz","location":"Allegan SGA--Goose Lake"},"type":"Feature","geometry":{"type":"Point","coordinates":[-85.9223959,42.6445712]}},{"properties":{"latitude":42.7983922,"date":{"end_time":"2012/05/03 00:00:00 -0400","original":"5/2/2012","granularity":"day","time":"2012/05/02 00:00:00 -0400"},"checklists":3,"longitude":-86.1432195,"id":"adtlbst004p2","location":"Pine Creek Park"},"type":"Feature","geometry":{"type":"Point","coordinates":[-86.1432195,42.7983922]}},{"properties":{"latitude":43.1119444,"date":{"end_time":"2012/08/03 00:00:00 -0400","original":"8/2/2012","granularity":"day","time":"2012/08/02 00:00:00 -0400"},"checklists":3,"longitude":-85.3573158,"id":"adtlbsg6tyb6","location":"Fields btwn McArthur and Lincoln Lake"},"type":"Feature","geometry":{"type":"Point","coordinates":[-85.3573158,43.1119444]}},{"properties":{"latitude":45.1220762,"date":{"end_time":"2012/08/23 00:00:00 -0400","original":"8/22/2012","granularity":"day","time":"2012/08/22 00:00:00 -0400"},"checklists":3,"longitude":-85.9765845,"id":"adtlbsqggf5l","location":"North Manitou Island--Village"},"type":"Feature","geometry":{"type":"Point","coordinates":[-85.9765845,45.1220762]}},{"properties":{"latitude":42.709819,"date":{"end_time":"2012/12/11 00:00:00 -0500","original":"12/10/2012","granularity":"day","time":"2012/12/10 00:00:00 -0500"},"checklists":3,"longitude":-85.9380359,"id":"adtlbssmntxa","location":"140th and 40th"},"type":"Feature","geometry":{"type":"Point","coordinates":[-85.9380359,42.709819]}},{"properties":{"latitude":42.769636,"date":{"end_time":"2013/04/13 00:00:00 -0400","original":"4/12/2013","granularity":"day","time":"2013/04/12 00:00:00 -0400"},"checklists":3,"longitude":-85.6612587,"id":"adtlbseylzt5","location":"Division Ave. Field north of Electric Ave. (flooded field)"},"type":"Feature","geometry":{"type":"Point","coordinates":[-85.6612587,42.769636]}},{"properties":{"latitude":43.1275881,"date":{"end_time":"2009/05/26 00:00:00 -0400","original":"5/25/2009","granularity":"day","time":"2009/05/25 00:00:00 -0400"},"checklists":2,"longitude":-85.5596352,"id":"adtlbslo5br0","location":"Rogue River--upstream from Rockford Dam"},"type":"Feature","geometry":{"type":"Point","coordinates":[-85.5596352,43.1275881]}},{"properties":{"latitude":43.2400757,"date":{"end_time":"2009/11/22 00:00:00 -0500","original":"11/21/2009","granularity":"day","time":"2009/11/21 00:00:00 -0500"},"checklists":2,"longitude":-86.0165634,"id":"adtlbsmepznj","location":"Muskegon Wastewater System--East Lagoon and Landfill"},"type":"Feature","geometry":{"type":"Point","coordinates":[-86.0165634,43.2400757]}},{"properties":{"latitude":43.0723363,"date":{"end_time":"2009/12/14 00:00:00 -0500","original":"12/13/2009","granularity":"day","time":"2009/12/13 00:00:00 -0500"},"checklists":2,"longitude":-85.4014492,"id":"adtlbsjvik4f","location":"M44 and Gavin Lake Ave."},"type":"Feature","geometry":{"type":"Point","coordinates":[-85.4014492,43.0723363]}},{"properties":{"latitude":43.3761848,"date":{"end_time":"2010/01/19 00:00:00 -0500","original":"1/18/2010","granularity":"day","time":"2010/01/18 00:00:00 -0500"},"checklists":2,"longitude":-86.4261281,"id":"adtlbsiwhxmc","location":"Medbery Park (White Lake channel)"},"type":"Feature","geometry":{"type":"Point","coordinates":[-86.4261281,43.3761848]}},{"properties":{"latitude":43.2360791,"date":{"end_time":"2010/01/19 00:00:00 -0500","original":"1/18/2010","granularity":"day","time":"2010/01/18 00:00:00 -0500"},"checklists":2,"longitude":-86.3402653,"id":"adtlbsn3rr9w","location":"Muskegon SP"},"type":"Feature","geometry":{"type":"Point","coordinates":[-86.3402653,43.2360791]}},{"properties":{"latitude":43.0821792,"date":{"end_time":"2010/01/22 00:00:00 -0500","original":"1/21/2010","granularity":"day","time":"2010/01/21 00:00:00 -0500"},"checklists":2,"longitude":-85.3754425,"id":"adtlbslzp1jz","location":"Grattan"},"type":"Feature","geometry":{"type":"Point","coordinates":[-85.3754425,43.0821792]}},{"properties":{"latitude":42.9727528,"date":{"end_time":"2010/02/07 00:00:00 -0500","original":"2/6/2010","granularity":"day","time":"2010/02/06 00:00:00 -0500"},"checklists":2,"longitude":-85.3531265,"id":"adtlbsnufaq1","location":"Lincoln Lake Ave. north of Lowell"},"type":"Feature","geometry":{"type":"Point","coordinates":[-85.3531265,42.9727528]}},{"properties":{"latitude":43.1000898,"date":{"end_time":"2010/02/19 00:00:00 -0500","original":"2/18/2010","granularity":"day","time":"2010/02/18 00:00:00 -0500"},"checklists":2,"longitude":-85.2282643,"id":"adtlbsju8cv4","location":"Bridge Street"},"type":"Feature","geometry":{"type":"Point","coordinates":[-85.2282643,43.1000898]}},{"properties":{"latitude":43.0568164,"date":{"end_time":"2010/03/29 00:00:00 -0400","original":"3/28/2010","granularity":"day","time":"2010/03/28 00:00:00 -0400"},"checklists":2,"longitude":-85.4068565,"id":"adtlbsn88zz8","location":"Gavin Lake"},"type":"Feature","geometry":{"type":"Point","coordinates":[-85.4068565,43.0568164]}},{"properties":{"latitude":43.1228271,"date":{"end_time":"2010/04/08 00:00:00 -0400","original":"4/7/2010","granularity":"day","time":"2010/04/07 00:00:00 -0400"},"checklists":2,"longitude":-85.3643998,"id":"adtlbskszgs6","location":"McArthur Ave"},"type":"Feature","geometry":{"type":"Point","coordinates":[-85.3643998,43.1228271]}},{"properties":{"latitude":44.3194345,"date":{"end_time":"2010/05/07 00:00:00 -0400","original":"5/6/2010","granularity":"day","time":"2010/05/06 00:00:00 -0400"},"checklists":2,"longitude":-84.8227465,"id":"adtlbsmu159k","location":"Houghton Lake WRA--Nellsville Rd Boardwalk"},"type":"Feature","geometry":{"type":"Point","coordinates":[-84.8227465,44.3194345]}},{"properties":{"latitude":44.6788459,"date":{"end_time":"2010/05/07 00:00:00 -0400","original":"5/6/2010","granularity":"day","time":"2010/05/06 00:00:00 -0400"},"checklists":2,"longitude":-84.5947909,"id":"adtlbsra6ffo","location":"Guide's Rest (Trout Unlimited)"},"type":"Feature","geometry":{"type":"Point","coordinates":[-84.5947909,44.6788459]}},{"properties":{"latitude":44.7403668,"date":{"end_time":"2010/05/07 00:00:00 -0400","original":"5/6/2010","granularity":"day","time":"2010/05/06 00:00:00 -0400"},"checklists":2,"longitude":-84.6631783,"id":"adtlbsil2ppm","location":"Hartwick Pines SP (general)"},"type":"Feature","geometry":{"type":"Point","coordinates":[-84.6631783,44.7403668]}},{"properties":{"latitude":42.8179674,"date":{"end_time":"2010/05/16 00:00:00 -0400","original":"5/15/2010","granularity":"day","time":"2010/05/15 00:00:00 -0400"},"checklists":2,"longitude":-80.7159841,"id":"adtlbsgzta90","location":"DeBie's"},"type":"Feature","geometry":{"type":"Point","coordinates":[-80.7159841,42.8179674]}},{"properties":{"latitude":42.66473,"date":{"end_time":"2010/05/18 00:00:00 -0400","original":"5/17/2010","granularity":"day","time":"2010/05/17 00:00:00 -0400"},"checklists":2,"longitude":-83.38782,"id":"adtlbsf4i1j1","location":"Oakland"},"type":"Feature","geometry":{"type":"Point","coordinates":[-83.38782,42.66473]}},{"properties":{"latitude":43.1126383,"date":{"end_time":"2010/05/21 00:00:00 -0400","original":"5/20/2010","granularity":"day","time":"2010/05/20 00:00:00 -0400"},"checklists":2,"longitude":-85.3628254,"id":"adtlbso7djh0","location":"McArthur, Jenks"},"type":"Feature","geometry":{"type":"Point","coordinates":[-85.3628254,43.1126383]}},{"properties":{"latitude":41.91908,"date":{"end_time":"2010/06/22 00:00:00 -0400","original":"6/21/2010","granularity":"day","time":"2010/06/21 00:00:00 -0400"},"checklists":2,"longitude":-85.99856,"id":"adtlbsq09c4z","location":"Cass"},"type":"Feature","geometry":{"type":"Point","coordinates":[-85.99856,41.91908]}},{"properties":{"latitude":41.9024285,"date":{"end_time":"2010/07/06 00:00:00 -0400","original":"7/5/2010","granularity":"day","time":"2010/07/05 00:00:00 -0400"},"checklists":2,"longitude":-86.5982959,"id":"adtlbseb76hw","location":"Warren Dunes SP"},"type":"Feature","geometry":{"type":"Point","coordinates":[-86.5982959,41.9024285]}},{"properties":{"latitude":43.184777,"date":{"end_time":"2010/07/22 00:00:00 -0400","original":"7/21/2010","granularity":"day","time":"2010/07/21 00:00:00 -0400"},"checklists":2,"longitude":-79.3656635,"id":"adtlbso2bz77","location":"Jordan Harbour"},"type":"Feature","geometry":{"type":"Point","coordinates":[-79.3656635,43.184777]}},{"properties":{"latitude":42.6578862,"date":{"end_time":"2010/07/23 00:00:00 -0400","original":"7/22/2010","granularity":"day","time":"2010/07/22 00:00:00 -0400"},"checklists":2,"longitude":-81.2150145,"id":"adtlbsfw1ggz","location":"Port Stanley--River Mouth &amp; Beaches"},"type":"Feature","geometry":{"type":"Point","coordinates":[-81.2150145,42.6578862]}},{"properties":{"latitude":42.5904364,"date":{"end_time":"2010/07/24 00:00:00 -0400","original":"7/23/2010","granularity":"day","time":"2010/07/23 00:00:00 -0400"},"checklists":2,"longitude":-80.5008602,"id":"adtlbsjuikrh","location":"Long Point--Lee Brown WMA"},"type":"Feature","geometry":{"type":"Point","coordinates":[-80.5008602,42.5904364]}},{"properties":{"latitude":43.0222196,"date":{"end_time":"2010/08/02 00:00:00 -0400","original":"8/1/2010","granularity":"day","time":"2010/08/01 00:00:00 -0400"},"checklists":2,"longitude":-85.6049109,"id":"adtlbsor62tc","location":"Perch Lake"},"type":"Feature","geometry":{"type":"Point","coordinates":[-85.6049109,43.0222196]}},{"properties":{"latitude":43.2641438,"date":{"end_time":"2010/08/21 00:00:00 -0400","original":"8/20/2010","granularity":"day","time":"2010/08/20 00:00:00 -0400"},"checklists":2,"longitude":-86.0539169,"id":"adtlbsgakr1m","location":"Muskegon Wastewater System--Grassy Cells"},"type":"Feature","geometry":{"type":"Point","coordinates":[-86.0539169,43.2641438]}},{"properties":{"latitude":43.0590772,"date":{"end_time":"2010/09/05 00:00:00 -0400","original":"9/4/2010","granularity":"day","time":"2010/09/04 00:00:00 -0400"},"checklists":2,"longitude":-85.4645519,"id":"adtlbsl23lod","location":"Townsend Park"},"type":"Feature","geometry":{"type":"Point","coordinates":[-85.4645519,43.0590772]}},{"properties":{"latitude":42.5827742,"date":{"end_time":"2010/10/13 00:00:00 -0400","original":"10/12/2010","granularity":"day","time":"2010/10/12 00:00:00 -0400"},"checklists":2,"longitude":-80.3978848,"id":"adtlbsphgw37","location":"Old Cut"},"type":"Feature","geometry":{"type":"Point","coordinates":[-80.3978848,42.5827742]}},{"properties":{"latitude":43.0859404,"date":{"end_time":"2010/10/30 00:00:00 -0400","original":"10/29/2010","granularity":"day","time":"2010/10/29 00:00:00 -0400"},"checklists":2,"longitude":-85.5527687,"id":"adtlbspk7ktb","location":"M44 and East Beltline"},"type":"Feature","geometry":{"type":"Point","coordinates":[-85.5527687,43.0859404]}},{"properties":{"latitude":41.5933418,"date":{"end_time":"2010/12/28 00:00:00 -0500","original":"12/27/2010","granularity":"day","time":"2010/12/27 00:00:00 -0500"},"checklists":2,"longitude":-87.3464432,"id":"adtlbsm00u27","location":"Gary"},"type":"Feature","geometry":{"type":"Point","coordinates":[-87.3464432,41.5933418]}},{"properties":{"latitude":42.59857,"date":{"end_time":"2010/12/28 00:00:00 -0500","original":"12/27/2010","granularity":"day","time":"2010/12/27 00:00:00 -0500"},"checklists":2,"longitude":-85.915,"id":"adtlbsn1a3vw","location":"Allegan"},"type":"Feature","geometry":{"type":"Point","coordinates":[-85.915,42.59857]}},{"properties":{"latitude":42.00714,"date":{"end_time":"2010/12/28 00:00:00 -0500","original":"12/27/2010","granularity":"day","time":"2010/12/27 00:00:00 -0500"},"checklists":2,"longitude":-86.53082,"id":"adtlbsmjxoeb","location":"Berrien"},"type":"Feature","geometry":{"type":"Point","coordinates":[-86.53082,42.00714]}},{"properties":{"latitude":43.0167993,"date":{"end_time":"2011/01/09 00:00:00 -0500","original":"1/8/2011","granularity":"day","time":"2011/01/08 00:00:00 -0500"},"checklists":2,"longitude":-85.4678285,"id":"adtlbsi8ectb","location":"Chase Lake (limited access)"},"type":"Feature","geometry":{"type":"Point","coordinates":[-85.4678285,43.0167993]}},{"properties":{"latitude":42.90973,"date":{"end_time":"2011/01/29 00:00:00 -0500","original":"1/28/2011","granularity":"day","time":"2011/01/28 00:00:00 -0500"},"checklists":2,"longitude":-85.76313,"id":"adtlbsm3pskh","location":"Grandville"},"type":"Feature","geometry":{"type":"Point","coordinates":[-85.76313,42.90973]}},{"properties":{"latitude":43.0888238,"date":{"end_time":"2011/02/04 00:00:00 -0500","original":"2/3/2011","granularity":"day","time":"2011/02/03 00:00:00 -0500"},"checklists":2,"longitude":-85.2349377,"id":"adtlbsrimli2","location":"Flat River from M-44 Bridge"},"type":"Feature","geometry":{"type":"Point","coordinates":[-85.2349377,43.0888238]}},{"properties":{"latitude":43.1230855,"date":{"end_time":"2011/02/09 00:00:00 -0500","original":"2/8/2011","granularity":"day","time":"2011/02/08 00:00:00 -0500"},"checklists":2,"longitude":-85.3643703,"id":"adtlbsgxl5m9","location":"McArthur, Hart"},"type":"Feature","geometry":{"type":"Point","coordinates":[-85.3643703,43.1230855]}},{"properties":{"latitude":45.49115,"date":{"end_time":"2011/02/23 00:00:00 -0500","original":"2/22/2011","granularity":"day","time":"2011/02/22 00:00:00 -0500"},"checklists":2,"longitude":-84.47018,"id":"adtlbso0hlh8","location":"Cheboygan"},"type":"Feature","geometry":{"type":"Point","coordinates":[-84.47018,45.49115]}},{"properties":{"latitude":46.4898835,"date":{"end_time":"2011/02/23 00:00:00 -0500","original":"2/22/2011","granularity":"day","time":"2011/02/22 00:00:00 -0500"},"checklists":2,"longitude":-84.3200684,"id":"adtlbsm4g6c5","location":"Sault Sainte Marie Lakefront"},"type":"Feature","geometry":{"type":"Point","coordinates":[-84.3200684,46.4898835]}},{"properties":{"latitude":46.05141,"date":{"end_time":"2011/02/23 00:00:00 -0500","original":"2/22/2011","granularity":"day","time":"2011/02/22 00:00:00 -0500"},"checklists":2,"longitude":-84.98614,"id":"adtlbskglwp8","location":"Mackinac"},"type":"Feature","geometry":{"type":"Point","coordinates":[-84.98614,46.05141]}},{"properties":{"latitude":44.68618,"date":{"end_time":"2011/02/23 00:00:00 -0500","original":"2/22/2011","granularity":"day","time":"2011/02/22 00:00:00 -0500"},"checklists":2,"longitude":-84.61488,"id":"adtlbsn83v7r","location":"Crawford"},"type":"Feature","geometry":{"type":"Point","coordinates":[-84.61488,44.68618]}},{"properties":{"latitude":45.03209,"date":{"end_time":"2011/02/23 00:00:00 -0500","original":"2/22/2011","granularity":"day","time":"2011/02/22 00:00:00 -0500"},"checklists":2,"longitude":-84.61613,"id":"adtlbsez3wsw","location":"Otsego"},"type":"Feature","geometry":{"type":"Point","coordinates":[-84.61613,45.03209]}},{"properties":{"latitude":46.3199038,"date":{"end_time":"2011/02/23 00:00:00 -0500","original":"2/22/2011","granularity":"day","time":"2011/02/22 00:00:00 -0500"},"checklists":2,"longitude":-84.2263842,"id":"adtlbstytggw","location":"Dunbar Forest"},"type":"Feature","geometry":{"type":"Point","coordinates":[-84.2263842,46.3199038]}},{"properties":{"latitude":43.1502838,"date":{"end_time":"2011/03/13 00:00:00 -0500","original":"3/12/2011","granularity":"day","time":"2011/03/12 00:00:00 -0500"},"checklists":2,"longitude":-85.2524471,"id":"adtlbso6nsg3","location":"Flat River at River Rd."},"type":"Feature","geometry":{"type":"Point","coordinates":[-85.2524471,43.1502838]}},{"properties":{"latitude":43.1389487,"date":{"end_time":"2011/03/16 00:00:00 -0400","original":"3/15/2011","granularity":"day","time":"2011/03/15 00:00:00 -0400"},"checklists":2,"longitude":-85.3791332,"id":"adtlbsmopx4i","location":"Oakfield Township"},"type":"Feature","geometry":{"type":"Point","coordinates":[-85.3791332,43.1389487]}},{"properties":{"latitude":43.1192169,"date":{"end_time":"2011/05/03 00:00:00 -0400","original":"5/2/2011","granularity":"day","time":"2011/05/02 00:00:00 -0400"},"checklists":2,"longitude":-85.2699137,"id":"adtlbslcszle","location":"Bricker from Youngman to M-91"},"type":"Feature","geometry":{"type":"Point","coordinates":[-85.2699137,43.1192169]}},{"properties":{"latitude":42.9601443,"date":{"end_time":"2011/05/06 00:00:00 -0400","original":"5/5/2011","granularity":"day","time":"2011/05/05 00:00:00 -0400"},"checklists":2,"longitude":-85.3791761,"id":"adtlbskbtraa","location":"Wittenbach/Wege Center"},"type":"Feature","geometry":{"type":"Point","coordinates":[-85.3791761,42.9601443]}},{"properties":{"latitude":43.1223285,"date":{"end_time":"2011/05/13 00:00:00 -0400","original":"5/12/2011","granularity":"day","time":"2011/05/12 00:00:00 -0400"},"checklists":2,"longitude":-85.4767628,"id":"adtlbshb6vet","location":"Brower Lake Preserve"},"type":"Feature","geometry":{"type":"Point","coordinates":[-85.4767628,43.1223285]}},{"properties":{"latitude":42.5933333,"date":{"end_time":"2011/05/14 00:00:00 -0400","original":"5/13/2011","granularity":"day","time":"2011/05/13 00:00:00 -0400"},"checklists":2,"longitude":-80.4547222,"id":"adtlbsojgujd","location":"Long Point--Big Creek NWA"},"type":"Feature","geometry":{"type":"Point","coordinates":[-80.4547222,42.5933333]}},{"properties":{"latitude":42.72512,"date":{"end_time":"2011/05/18 00:00:00 -0400","original":"5/17/2011","granularity":"day","time":"2011/05/17 00:00:00 -0400"},"checklists":2,"longitude":-88.02825,"id":"adtlbsespb9o","location":"Racine"},"type":"Feature","geometry":{"type":"Point","coordinates":[-88.02825,42.72512]}},{"properties":{"latitude":43.66937,"date":{"end_time":"2011/05/29 00:00:00 -0400","original":"5/28/2011","granularity":"day","time":"2011/05/28 00:00:00 -0400"},"checklists":2,"longitude":-88.19954,"id":"adtlbssjyc7m","location":"Spruce Lake Bog (Fond du Lac Co.)"},"type":"Feature","geometry":{"type":"Point","coordinates":[-88.19954,43.66937]}},{"properties":{"latitude":43.1270325,"date":{"end_time":"2011/06/14 00:00:00 -0400","original":"6/13/2011","granularity":"day","time":"2011/06/13 00:00:00 -0400"},"checklists":2,"longitude":-85.6801869,"id":"adtlbsgxomfj","location":"Sparta Airport"},"type":"Feature","geometry":{"type":"Point","coordinates":[-85.6801869,43.1270325]}},{"properties":{"latitude":43.0784679,"date":{"end_time":"2011/06/19 00:00:00 -0400","original":"6/18/2011","granularity":"day","time":"2011/06/18 00:00:00 -0400"},"checklists":2,"longitude":-85.139504,"id":"adtlbsgvscw0","location":"Bird Berry Farm"},"type":"Feature","geometry":{"type":"Point","coordinates":[-85.139504,43.0784679]}},{"properties":{"latitude":42.8562295,"date":{"end_time":"2011/06/21 00:00:00 -0400","original":"6/20/2011","granularity":"day","time":"2011/06/20 00:00:00 -0400"},"checklists":2,"longitude":-85.5841141,"id":"adtlbsk4qsn7","location":"Paris Park"},"type":"Feature","geometry":{"type":"Point","coordinates":[-85.5841141,42.8562295]}},{"properties":{"latitude":42.7789604,"date":{"end_time":"2011/06/23 00:00:00 -0400","original":"6/22/2011","granularity":"day","time":"2011/06/22 00:00:00 -0400"},"checklists":2,"longitude":-86.0603714,"id":"adtlbslqhpcw","location":"Van Raalte Farm"},"type":"Feature","geometry":{"type":"Point","coordinates":[-86.0603714,42.7789604]}},{"properties":{"latitude":43.0364935,"date":{"end_time":"2011/06/26 00:00:00 -0400","original":"6/25/2011","granularity":"day","time":"2011/06/25 00:00:00 -0400"},"checklists":2,"longitude":-82.5757313,"id":"adtlbsorx10r","location":"Port Huron SGA"},"type":"Feature","geometry":{"type":"Point","coordinates":[-82.5757313,43.0364935]}},{"properties":{"latitude":41.9197359,"date":{"end_time":"2011/06/28 00:00:00 -0400","original":"6/27/2011","granularity":"day","time":"2011/06/27 00:00:00 -0400"},"checklists":2,"longitude":-86.1683664,"id":"adtlbstu2610","location":"Wells St. and RR Crossing"},"type":"Feature","geometry":{"type":"Point","coordinates":[-86.1683664,41.9197359]}},{"properties":{"latitude":42.6650879,"date":{"end_time":"2011/06/30 00:00:00 -0400","original":"6/29/2011","granularity":"day","time":"2011/06/29 00:00:00 -0400"},"checklists":2,"longitude":-85.9280033,"id":"adtlbsiliot8","location":"Silver Creek County Park"},"type":"Feature","geometry":{"type":"Point","coordinates":[-85.9280033,42.6650879]}},{"properties":{"latitude":42.8008798,"date":{"end_time":"2011/06/30 00:00:00 -0400","original":"6/29/2011","granularity":"day","time":"2011/06/29 00:00:00 -0400"},"checklists":2,"longitude":-86.0607791,"id":"adtlbsfs2oxo","location":"Paw Paw Park"},"type":"Feature","geometry":{"type":"Point","coordinates":[-86.0607791,42.8008798]}},{"properties":{"latitude":41.6023,"date":{"end_time":"2011/07/03 00:00:00 -0400","original":"7/2/2011","granularity":"day","time":"2011/07/02 00:00:00 -0400"},"checklists":2,"longitude":-85.86388,"id":"adtlbsg5lypp","location":"Elkhart"},"type":"Feature","geometry":{"type":"Point","coordinates":[-85.86388,41.6023]}},{"properties":{"latitude":41.64958,"date":{"end_time":"2011/07/03 00:00:00 -0400","original":"7/2/2011","granularity":"day","time":"2011/07/02 00:00:00 -0400"},"checklists":2,"longitude":-85.42821,"id":"adtlbsqs9do2","location":"Lagrange"},"type":"Feature","geometry":{"type":"Point","coordinates":[-85.42821,41.64958]}},{"properties":{"latitude":42.251,"date":{"end_time":"2011/07/03 00:00:00 -0400","original":"7/2/2011","granularity":"day","time":"2011/07/02 00:00:00 -0400"},"checklists":2,"longitude":-85.5346,"id":"adtlbsl2lnm9","location":"Kalamazoo"},"type":"Feature","geometry":{"type":"Point","coordinates":[-85.5346,42.251]}},{"properties":{"latitude":42.7987071,"date":{"end_time":"2011/07/06 00:00:00 -0400","original":"7/5/2011","granularity":"day","time":"2011/07/05 00:00:00 -0400"},"checklists":2,"longitude":-86.2093306,"id":"adtlbsjfg0uq","location":"Tunnel Park"},"type":"Feature","geometry":{"type":"Point","coordinates":[-86.2093306,42.7987071]}},{"properties":{"latitude":42.7492812,"date":{"end_time":"2011/07/06 00:00:00 -0400","original":"7/5/2011","granularity":"day","time":"2011/07/05 00:00:00 -0400"},"checklists":2,"longitude":-86.1978722,"id":"adtlbsl41hjc","location":"Kelly Lake"},"type":"Feature","geometry":{"type":"Point","coordinates":[-86.1978722,42.7492812]}},{"properties":{"latitude":42.8255015,"date":{"end_time":"2011/07/06 00:00:00 -0400","original":"7/5/2011","granularity":"day","time":"2011/07/05 00:00:00 -0400"},"checklists":2,"longitude":-86.1849246,"id":"adtlbsezxly3","location":"Riley Trails Park"},"type":"Feature","geometry":{"type":"Point","coordinates":[-86.1849246,42.8255015]}},{"properties":{"latitude":42.8490175,"date":{"end_time":"2011/07/16 00:00:00 -0400","original":"7/15/2011","granularity":"day","time":"2011/07/15 00:00:00 -0400"},"checklists":2,"longitude":-85.7641268,"id":"adtlbsofsrsc","location":"M-6 Swamps at Wilson Ave."},"type":"Feature","geometry":{"type":"Point","coordinates":[-85.7641268,42.8490175]}},{"properties":{"latitude":44.7327109,"date":{"end_time":"2011/08/04 00:00:00 -0400","original":"8/3/2011","granularity":"day","time":"2011/08/03 00:00:00 -0400"},"checklists":2,"longitude":-84.6482849,"id":"adtlbsnune7e","location":"Hartwick Pines SP--Bog Area"},"type":"Feature","geometry":{"type":"Point","coordinates":[-84.6482849,44.7327109]}},{"properties":{"latitude":42.21188,"date":{"end_time":"2011/08/09 00:00:00 -0400","original":"8/8/2011","granularity":"day","time":"2011/08/08 00:00:00 -0400"},"checklists":2,"longitude":-83.35047,"id":"adtlbstelt32","location":"Detroit Metro Airport (restricted access)"},"type":"Feature","geometry":{"type":"Point","coordinates":[-83.35047,42.21188]}},{"properties":{"latitude":52.5812306,"date":{"end_time":"2011/08/10 00:00:00 -0400","original":"8/9/2011","granularity":"day","time":"2011/08/09 00:00:00 -0400"},"checklists":2,"longitude":4.8728816,"id":"adtlbsh1mj5j","location":"Noord-Holland"},"type":"Feature","geometry":{"type":"Point","coordinates":[4.8728816,52.5812306]}},{"properties":{"latitude":51.7610405,"date":{"end_time":"2011/08/16 00:00:00 -0400","original":"8/15/2011","granularity":"day","time":"2011/08/15 00:00:00 -0400"},"checklists":2,"longitude":4.7694397,"id":"adtlbsg7k1fs","location":"Biesbos"},"type":"Feature","geometry":{"type":"Point","coordinates":[4.7694397,51.7610405]}},{"properties":{"latitude":52.2117617,"date":{"end_time":"2011/08/17 00:00:00 -0400","original":"8/16/2011","granularity":"day","time":"2011/08/16 00:00:00 -0400"},"checklists":2,"longitude":5.9120178,"id":"adtlbsetnd7h","location":"Berg en Bos"},"type":"Feature","geometry":{"type":"Point","coordinates":[5.9120178,52.2117617]}},{"properties":{"latitude":53.002189,"date":{"end_time":"2011/08/20 00:00:00 -0400","original":"8/19/2011","granularity":"day","time":"2011/08/19 00:00:00 -0400"},"checklists":2,"longitude":4.782227,"id":"adtlbsqm05w5","location":"Texel--Veerhaven (Ferry harbor and jetty)"},"type":"Feature","geometry":{"type":"Point","coordinates":[4.782227,53.002189]}},{"properties":{"latitude":52.4532896,"date":{"end_time":"2011/08/21 00:00:00 -0400","original":"8/20/2011","granularity":"day","time":"2011/08/20 00:00:00 -0400"},"checklists":2,"longitude":4.7725296,"id":"adtlbsqaxxd8","location":"Westzaan by Kayak"},"type":"Feature","geometry":{"type":"Point","coordinates":[4.7725296,52.4532896]}},{"properties":{"latitude":42.7548905,"date":{"end_time":"2011/09/02 00:00:00 -0400","original":"9/1/2011","granularity":"day","time":"2011/09/01 00:00:00 -0400"},"checklists":2,"longitude":-85.920393,"id":"adtlbso3m3wb","location":"56th Ave. between Adams and 142nd"},"type":"Feature","geometry":{"type":"Point","coordinates":[-85.920393,42.7548905]}},{"properties":{"latitude":43.1793174,"date":{"end_time":"2011/09/11 00:00:00 -0400","original":"9/10/2011","granularity":"day","time":"2011/09/10 00:00:00 -0400"},"checklists":2,"longitude":-85.2901425,"id":"adtlbsft60v1","location":"Wal-Mart Drainage Ponds and Klackle Orchards"},"type":"Feature","geometry":{"type":"Point","coordinates":[-85.2901425,43.1793174]}},{"properties":{"latitude":42.9326652,"date":{"end_time":"2011/09/18 00:00:00 -0400","original":"9/17/2011","granularity":"day","time":"2011/09/17 00:00:00 -0400"},"checklists":2,"longitude":-85.5839306,"id":"adtlbsigp00v","location":"Calvin College Ecosystem Preserve"},"type":"Feature","geometry":{"type":"Point","coordinates":[-85.5839306,42.9326652]}},{"properties":{"latitude":42.7459364,"date":{"end_time":"2011/10/06 00:00:00 -0400","original":"10/5/2011","granularity":"day","time":"2011/10/05 00:00:00 -0400"},"checklists":2,"longitude":-86.2000823,"id":"adtlbsmwwl03","location":"Hope College Nature Preserve (restricted access)"},"type":"Feature","geometry":{"type":"Point","coordinates":[-86.2000823,42.7459364]}},{"properties":{"latitude":42.1151557,"date":{"end_time":"2011/11/01 00:00:00 -0400","original":"10/31/2011","granularity":"day","time":"2011/10/31 00:00:00 -0400"},"checklists":2,"longitude":-86.4894291,"id":"adtlbske9n8l","location":"Tiscornia Park"},"type":"Feature","geometry":{"type":"Point","coordinates":[-86.4894291,42.1151557]}},{"properties":{"latitude":42.8775491,"date":{"end_time":"2011/11/26 00:00:00 -0500","original":"11/25/2011","granularity":"day","time":"2011/11/25 00:00:00 -0500"},"checklists":2,"longitude":-85.7529259,"id":"adtlbspgi0qf","location":"Rivertown Crossings Mall Ponds"},"type":"Feature","geometry":{"type":"Point","coordinates":[-85.7529259,42.8775491]}},{"properties":{"latitude":43.74288,"date":{"end_time":"2011/12/17 00:00:00 -0500","original":"12/16/2011","granularity":"day","time":"2011/12/16 00:00:00 -0500"},"checklists":2,"longitude":-83.9348,"id":"adtlbshsz559","location":"Bay"},"type":"Feature","geometry":{"type":"Point","coordinates":[-83.9348,43.74288]}},{"properties":{"latitude":43.35067,"date":{"end_time":"2011/12/17 00:00:00 -0500","original":"12/16/2011","granularity":"day","time":"2011/12/16 00:00:00 -0500"},"checklists":2,"longitude":-84.03155,"id":"adtlbsoov40d","location":"Saginaw"},"type":"Feature","geometry":{"type":"Point","coordinates":[-84.03155,43.35067]}},{"properties":{"latitude":42.9976055,"date":{"end_time":"2011/12/18 00:00:00 -0500","original":"12/17/2011","granularity":"day","time":"2011/12/17 00:00:00 -0500"},"checklists":2,"longitude":-80.8074985,"id":"adtlbslf6wyn","location":"Ingersoll--Oxford County Landfill"},"type":"Feature","geometry":{"type":"Point","coordinates":[-80.8074985,42.9976055]}},{"properties":{"latitude":42.9350848,"date":{"end_time":"2011/12/28 00:00:00 -0500","original":"12/27/2011","granularity":"day","time":"2011/12/27 00:00:00 -0500"},"checklists":2,"longitude":-85.3506711,"id":"adtlbsha0r2p","location":"Rufous Hummingbird spot"},"type":"Feature","geometry":{"type":"Point","coordinates":[-85.3506711,42.9350848]}},{"properties":{"latitude":42.9868354,"date":{"end_time":"2012/01/01 00:00:00 -0500","original":"12/31/2011","granularity":"day","time":"2011/12/31 00:00:00 -0500"},"checklists":2,"longitude":-85.3264276,"id":"adtlbspwjhaa","location":"Fallasburg Park"},"type":"Feature","geometry":{"type":"Point","coordinates":[-85.3264276,42.9868354]}},{"properties":{"latitude":43.1072704,"date":{"end_time":"2012/01/07 00:00:00 -0500","original":"1/6/2012","granularity":"day","time":"2012/01/06 00:00:00 -0500"},"checklists":2,"longitude":-85.3652269,"id":"adtlbstb69c2","location":"Big Pine Island Lake--Waterway Drive Access"},"type":"Feature","geometry":{"type":"Point","coordinates":[-85.3652269,43.1072704]}},{"properties":{"latitude":43.1349799,"date":{"end_time":"2012/01/07 00:00:00 -0500","original":"1/6/2012","granularity":"day","time":"2012/01/06 00:00:00 -0500"},"checklists":2,"longitude":-85.3780241,"id":"adtlbsrujhdu","location":"Wabasis Lake--White's Point"},"type":"Feature","geometry":{"type":"Point","coordinates":[-85.3780241,43.1349799]}},{"properties":{"latitude":43.0164213,"date":{"end_time":"2012/01/08 00:00:00 -0500","original":"1/7/2012","granularity":"day","time":"2012/01/07 00:00:00 -0500"},"checklists":2,"longitude":-85.3518747,"id":"adtlbsspwtvw","location":"Lincoln Lake Rd--Alton"},"type":"Feature","geometry":{"type":"Point","coordinates":[-85.3518747,43.0164213]}},{"properties":{"latitude":43.0517846,"date":{"end_time":"2012/01/08 00:00:00 -0500","original":"1/7/2012","granularity":"day","time":"2012/01/07 00:00:00 -0500"},"checklists":2,"longitude":-85.3547517,"id":"adtlbsja56ry","location":"Lincoln Lake Rd--6 Mile Pastures"},"type":"Feature","geometry":{"type":"Point","coordinates":[-85.3547517,43.0517846]}},{"properties":{"latitude":42.9500148,"date":{"end_time":"2012/01/10 00:00:00 -0500","original":"1/9/2012","granularity":"day","time":"2012/01/09 00:00:00 -0500"},"checklists":2,"longitude":-86.2193298,"id":"adtlbsgj12vd","location":"Kirk Park"},"type":"Feature","geometry":{"type":"Point","coordinates":[-86.2193298,42.9500148]}},{"properties":{"latitude":42.7297287,"date":{"end_time":"2012/01/10 00:00:00 -0500","original":"1/9/2012","granularity":"day","time":"2012/01/09 00:00:00 -0500"},"checklists":2,"longitude":-86.080461,"id":"adtlbsn4e9c3","location":"Fillmore Cottonwood Park"},"type":"Feature","geometry":{"type":"Point","coordinates":[-86.080461,42.7297287]}},{"properties":{"latitude":42.9250229,"date":{"end_time":"2012/02/17 00:00:00 -0500","original":"2/16/2012","granularity":"day","time":"2012/02/16 00:00:00 -0500"},"checklists":2,"longitude":-85.3425638,"id":"adtlbsk46h76","location":"Lowell--Grand River at Lincoln Lake Ave"},"type":"Feature","geometry":{"type":"Point","coordinates":[-85.3425638,42.9250229]}},{"properties":{"latitude":42.7879304,"date":{"end_time":"2012/02/28 00:00:00 -0500","original":"2/27/2012","granularity":"day","time":"2012/02/27 00:00:00 -0500"},"checklists":2,"longitude":-86.1048334,"id":"adtlbsfi0y4q","location":"Hope College--Van Wylen Library (4th floor)"},"type":"Feature","geometry":{"type":"Point","coordinates":[-86.1048334,42.7879304]}},{"properties":{"latitude":42.72833,"date":{"end_time":"2012/03/04 00:00:00 -0500","original":"3/3/2012","granularity":"day","time":"2012/03/03 00:00:00 -0500"},"checklists":2,"longitude":-86.00974,"id":"adtlbsfcdzef","location":"Overisel"},"type":"Feature","geometry":{"type":"Point","coordinates":[-86.00974,42.72833]}},{"properties":{"latitude":43.1856758,"date":{"end_time":"2012/03/13 00:00:00 -0400","original":"3/12/2012","granularity":"day","time":"2012/03/12 00:00:00 -0400"},"checklists":2,"longitude":-86.0098433,"id":"adtlbsmlo7g4","location":"Swanson/Musketawa Trail Area"},"type":"Feature","geometry":{"type":"Point","coordinates":[-86.0098433,43.1856758]}},{"properties":{"latitude":41.6108541,"date":{"end_time":"2012/03/16 00:00:00 -0400","original":"3/15/2012","granularity":"day","time":"2012/03/15 00:00:00 -0400"},"checklists":2,"longitude":-83.1924677,"id":"adtlbsnpteti","location":"Magee Marsh Wildlife Area (Ottawa Co.)"},"type":"Feature","geometry":{"type":"Point","coordinates":[-83.1924677,41.6108541]}},{"properties":{"latitude":41.6081267,"date":{"end_time":"2012/03/16 00:00:00 -0400","original":"3/15/2012","granularity":"day","time":"2012/03/15 00:00:00 -0400"},"checklists":2,"longitude":-83.2374001,"id":"adtlbsnz6pbh","location":"Ottawa NWR (Ottawa Co.)"},"type":"Feature","geometry":{"type":"Point","coordinates":[-83.2374001,41.6081267]}},{"properties":{"latitude":42.6437517,"date":{"end_time":"2012/04/06 00:00:00 -0400","original":"4/5/2012","granularity":"day","time":"2012/04/05 00:00:00 -0400"},"checklists":2,"longitude":-85.8986937,"id":"adtlbsnzwkb3","location":"Allegan SGA--Grouse Loop and Mudflats Trail"},"type":"Feature","geometry":{"type":"Point","coordinates":[-85.8986937,42.6437517]}},{"properties":{"latitude":42.812569,"date":{"end_time":"2012/04/07 00:00:00 -0400","original":"4/6/2012","granularity":"day","time":"2012/04/06 00:00:00 -0400"},"checklists":2,"longitude":-85.3893805,"id":"adtlbsfwjazt","location":"84th St and Bergy Ave."},"type":"Feature","geometry":{"type":"Point","coordinates":[-85.3893805,42.812569]}},{"properties":{"latitude":43.1363832,"date":{"end_time":"2012/04/19 00:00:00 -0400","original":"4/18/2012","granularity":"day","time":"2012/04/18 00:00:00 -0400"},"checklists":2,"longitude":-85.3622884,"id":"adtlbsn5533j","location":"Little Mud Lake by Kayak"},"type":"Feature","geometry":{"type":"Point","coordinates":[-85.3622884,43.1363832]}},{"properties":{"latitude":43.115665,"date":{"end_time":"2012/04/24 00:00:00 -0400","original":"4/23/2012","granularity":"day","time":"2012/04/23 00:00:00 -0400"},"checklists":2,"longitude":-85.391231,"id":"adtlbsf8ssie","location":"Sandhill Farm (private, not accessible to public)"},"type":"Feature","geometry":{"type":"Point","coordinates":[-85.391231,43.115665]}},{"properties":{"latitude":43.0868343,"date":{"end_time":"2012/05/08 00:00:00 -0400","original":"5/7/2012","granularity":"day","time":"2012/05/07 00:00:00 -0400"},"checklists":2,"longitude":-85.5137055,"id":"adtlbsqrscqd","location":"Valvoline Oil Change"},"type":"Feature","geometry":{"type":"Point","coordinates":[-85.5137055,43.0868343]}},{"properties":{"latitude":53.4254816,"date":{"end_time":"2012/05/09 00:00:00 -0400","original":"5/8/2012","granularity":"day","time":"2012/05/08 00:00:00 -0400"},"checklists":2,"longitude":-6.2397643,"id":"adtlbskl3awt","location":"Dublin International Airport (restricted access)"},"type":"Feature","geometry":{"type":"Point","coordinates":[-6.2397643,53.4254816]}},{"properties":{"latitude":52.451825,"date":{"end_time":"2012/05/10 00:00:00 -0400","original":"5/9/2012","granularity":"day","time":"2012/05/09 00:00:00 -0400"},"checklists":2,"longitude":5.3702545,"id":"adtlbssbyux1","location":"Oostvaardersplassen"},"type":"Feature","geometry":{"type":"Point","coordinates":[5.3702545,52.451825]}},{"properties":{"latitude":52.0262516,"date":{"end_time":"2012/05/12 00:00:00 -0400","original":"5/11/2012","granularity":"day","time":"2012/05/11 00:00:00 -0400"},"checklists":2,"longitude":6.0232746,"id":"adtlbsnfiygs","location":"Posbank"},"type":"Feature","geometry":{"type":"Point","coordinates":[6.0232746,52.0262516]}},{"properties":{"latitude":51.0381536,"date":{"end_time":"2012/05/17 00:00:00 -0400","original":"5/16/2012","granularity":"day","time":"2012/05/16 00:00:00 -0400"},"checklists":2,"longitude":4.2405362,"id":"adtlbseaqufe","location":"Vlaamse Gewest"},"type":"Feature","geometry":{"type":"Point","coordinates":[4.2405362,51.0381536]}},{"properties":{"latitude":48.8466434,"date":{"end_time":"2012/05/17 00:00:00 -0400","original":"5/16/2012","granularity":"day","time":"2012/05/16 00:00:00 -0400"},"checklists":2,"longitude":2.3368263,"id":"adtlbsigw1bu","location":"Jardin du Luxembourg"},"type":"Feature","geometry":{"type":"Point","coordinates":[2.3368263,48.8466434]}},{"properties":{"latitude":50.3138788,"date":{"end_time":"2012/05/17 00:00:00 -0400","original":"5/16/2012","granularity":"day","time":"2012/05/16 00:00:00 -0400"},"checklists":2,"longitude":5.0027563,"id":"adtlbslxrxif","location":"Wallonne, Rgion"},"type":"Feature","geometry":{"type":"Point","coordinates":[5.0027563,50.3138788]}},{"properties":{"latitude":42.9830815,"date":{"end_time":"2012/06/24 00:00:00 -0400","original":"6/23/2012","granularity":"day","time":"2012/06/23 00:00:00 -0400"},"checklists":2,"longitude":-82.538701,"id":"adtlbsgrf0s8","location":"Wadhams Rd at Wadhams to Avoca Trail"},"type":"Feature","geometry":{"type":"Point","coordinates":[-82.538701,42.9830815]}},{"properties":{"latitude":43.0041921,"date":{"end_time":"2012/06/27 00:00:00 -0400","original":"6/26/2012","granularity":"day","time":"2012/06/26 00:00:00 -0400"},"checklists":2,"longitude":-83.4701514,"id":"adtlbstaf39c","location":"DeBuck's Sod Farm"},"type":"Feature","geometry":{"type":"Point","coordinates":[-83.4701514,43.0041921]}},{"properties":{"latitude":42.8120402,"date":{"end_time":"2012/08/10 00:00:00 -0400","original":"8/9/2012","granularity":"day","time":"2012/08/09 00:00:00 -0400"},"checklists":2,"longitude":-85.7626715,"id":"adtlbsht90vo","location":"84th and Wilson"},"type":"Feature","geometry":{"type":"Point","coordinates":[-85.7626715,42.8120402]}},{"properties":{"latitude":42.6640086,"date":{"end_time":"2012/09/29 00:00:00 -0400","original":"9/28/2012","granularity":"day","time":"2012/09/28 00:00:00 -0400"},"checklists":2,"longitude":-86.2162399,"id":"adtlbsg3hrk0","location":"Oval Beach"},"type":"Feature","geometry":{"type":"Point","coordinates":[-86.2162399,42.6640086]}},{"properties":{"latitude":43.0871654,"date":{"end_time":"2012/10/07 00:00:00 -0400","original":"10/6/2012","granularity":"day","time":"2012/10/06 00:00:00 -0400"},"checklists":2,"longitude":-85.4311295,"id":"adtlbsfsoco1","location":"Tiffany and M-44"},"type":"Feature","geometry":{"type":"Point","coordinates":[-85.4311295,43.0871654]}},{"properties":{"latitude":42.7104049,"date":{"end_time":"2012/10/11 00:00:00 -0400","original":"10/10/2012","granularity":"day","time":"2012/10/10 00:00:00 -0400"},"checklists":2,"longitude":-86.0165779,"id":"adtlbso97yai","location":"140th and 48th fields"},"type":"Feature","geometry":{"type":"Point","coordinates":[-86.0165779,42.7104049]}},{"properties":{"latitude":52.1696176,"date":{"end_time":"2012/12/27 00:00:00 -0500","original":"12/26/2012","granularity":"day","time":"2012/12/26 00:00:00 -0500"},"checklists":2,"longitude":5.7565772,"id":"adtlbshrux1j","location":"Kootwijkerzand"},"type":"Feature","geometry":{"type":"Point","coordinates":[5.7565772,52.1696176]}},{"properties":{"latitude":52.2189967,"date":{"end_time":"2012/12/31 00:00:00 -0500","original":"12/30/2012","granularity":"day","time":"2012/12/30 00:00:00 -0500"},"checklists":2,"longitude":5.9605119,"id":"adtlbslrigoo","location":"Oranjepark"},"type":"Feature","geometry":{"type":"Point","coordinates":[5.9605119,52.2189967]}},{"properties":{"latitude":42.8111642,"date":{"end_time":"2013/01/16 00:00:00 -0500","original":"1/15/2013","granularity":"day","time":"2013/01/15 00:00:00 -0500"},"checklists":2,"longitude":-85.900678,"id":"adtlbsrg01ze","location":"Byron and 48th"},"type":"Feature","geometry":{"type":"Point","coordinates":[-85.900678,42.8111642]}},{"properties":{"latitude":43.0850628,"date":{"end_time":"2013/03/21 00:00:00 -0400","original":"3/20/2013","granularity":"day","time":"2013/03/20 00:00:00 -0400"},"checklists":2,"longitude":-85.5367184,"id":"adtlbsljiuhg","location":"M-44 and Blakely Fields"},"type":"Feature","geometry":{"type":"Point","coordinates":[-85.5367184,43.0850628]}},{"properties":{"latitude":42.781418,"date":{"end_time":"2013/03/30 00:00:00 -0400","original":"3/29/2013","granularity":"day","time":"2013/03/29 00:00:00 -0400"},"checklists":2,"longitude":-85.496947,"id":"adtlbshsq6og","location":"100th St flooded field"},"type":"Feature","geometry":{"type":"Point","coordinates":[-85.496947,42.781418]}},{"properties":{"latitude":42.7973845,"date":{"end_time":"2013/04/07 00:00:00 -0400","original":"4/6/2013","granularity":"day","time":"2013/04/06 00:00:00 -0400"},"checklists":2,"longitude":-85.6065416,"id":"adtlbsom8ual","location":"92nd St Flooded Field"},"type":"Feature","geometry":{"type":"Point","coordinates":[-85.6065416,42.7973845]}},{"properties":{"latitude":43.009637,"date":{"end_time":"2013/04/11 00:00:00 -0400","original":"4/10/2013","granularity":"day","time":"2013/04/10 00:00:00 -0400"},"checklists":2,"longitude":-85.3525257,"id":"adtlbspujn9w","location":"Tiny Pond on Lincoln Lake S of 3 mile"},"type":"Feature","geometry":{"type":"Point","coordinates":[-85.3525257,43.009637]}},{"properties":{"latitude":42.8128755,"date":{"end_time":"2013/04/13 00:00:00 -0400","original":"4/12/2013","granularity":"day","time":"2013/04/12 00:00:00 -0400"},"checklists":2,"longitude":-85.9706783,"id":"adtlbsta3gvy","location":"Byron floodings at I-196"},"type":"Feature","geometry":{"type":"Point","coordinates":[-85.9706783,42.8128755]}},{"properties":{"latitude":42.770077,"date":{"end_time":"2013/04/13 00:00:00 -0400","original":"4/12/2013","granularity":"day","time":"2013/04/12 00:00:00 -0400"},"checklists":2,"longitude":-85.5706,"id":"adtlbslkzrqa","location":"108th St btwn E Paris and Hannah Lake (flooded field)"},"type":"Feature","geometry":{"type":"Point","coordinates":[-85.5706,42.770077]}},{"properties":{"latitude":42.75372,"date":{"end_time":"2013/04/18 00:00:00 -0400","original":"4/17/2013","granularity":"day","time":"2013/04/17 00:00:00 -0400"},"checklists":2,"longitude":-85.64677,"id":"adtlbsknp5md","location":"148th Ave. 0.3 miles west of 10th"},"type":"Feature","geometry":{"type":"Point","coordinates":[-85.64677,42.75372]}},{"properties":{"latitude":43.9553,"date":{"end_time":"2007/07/02 00:00:00 -0400","original":"7/1/2007","granularity":"day","time":"2007/07/01 00:00:00 -0400"},"checklists":1,"longitude":-86.45258,"id":"adtlbsfhaj45","location":"Ludington"},"type":"Feature","geometry":{"type":"Point","coordinates":[-86.45258,43.9553]}},{"properties":{"latitude":43.4277257,"date":{"end_time":"2009/06/21 00:00:00 -0400","original":"6/20/2009","granularity":"day","time":"2009/06/20 00:00:00 -0400"},"checklists":1,"longitude":-98.4108496,"id":"adtlbsjq5tpe","location":"Corsica"},"type":"Feature","geometry":{"type":"Point","coordinates":[-98.4108496,43.4277257]}},{"properties":{"latitude":43.9051204,"date":{"end_time":"2009/06/22 00:00:00 -0400","original":"6/21/2009","granularity":"day","time":"2009/06/21 00:00:00 -0400"},"checklists":1,"longitude":-102.3092473,"id":"adtlbsl40q79","location":"Badlands NP--Sage Creek Rim Rd."},"type":"Feature","geometry":{"type":"Point","coordinates":[-102.3092473,43.9051204]}},{"properties":{"latitude":43.77299,"date":{"end_time":"2009/06/23 00:00:00 -0400","original":"6/22/2009","granularity":"day","time":"2009/06/22 00:00:00 -0400"},"checklists":1,"longitude":-103.51701,"id":"adtlbsmi9qfa","location":"Stockade Lake"},"type":"Feature","geometry":{"type":"Point","coordinates":[-103.51701,43.77299]}},{"properties":{"latitude":43.7067869,"date":{"end_time":"2009/06/23 00:00:00 -0400","original":"6/22/2009","granularity":"day","time":"2009/06/22 00:00:00 -0400"},"checklists":1,"longitude":-103.3406639,"id":"adtlbsrs1wnp","location":"Custer SP  - Wildlife Loop"},"type":"Feature","geometry":{"type":"Point","coordinates":[-103.3406639,43.7067869]}},{"properties":{"latitude":43.8403309,"date":{"end_time":"2009/06/23 00:00:00 -0400","original":"6/22/2009","granularity":"day","time":"2009/06/22 00:00:00 -0400"},"checklists":1,"longitude":-103.5578048,"id":"adtlbsqdvqzi","location":"Custer SP--Sylvan Lake campground"},"type":"Feature","geometry":{"type":"Point","coordinates":[-103.5578048,43.8403309]}},{"properties":{"latitude":47.839208,"date":{"end_time":"2009/06/26 00:00:00 -0400","original":"6/25/2009","granularity":"day","time":"2009/06/25 00:00:00 -0400"},"checklists":1,"longitude":-112.214592,"id":"adtlbsnuzo7x","location":"Bouma Postyards"},"type":"Feature","geometry":{"type":"Point","coordinates":[-112.214592,47.839208]}},{"properties":{"latitude":47.8130185,"date":{"end_time":"2009/06/28 00:00:00 -0400","original":"6/27/2009","granularity":"day","time":"2009/06/27 00:00:00 -0400"},"checklists":1,"longitude":-112.1801168,"id":"adtlbsmu6hkj","location":"Choteau Jungle Gym"},"type":"Feature","geometry":{"type":"Point","coordinates":[-112.1801168,47.8130185]}},{"properties":{"latitude":47.8199892,"date":{"end_time":"2009/06/28 00:00:00 -0400","original":"6/27/2009","granularity":"day","time":"2009/06/27 00:00:00 -0400"},"checklists":1,"longitude":-112.1700814,"id":"adtlbsj91x1e","location":"Choteau Private Residence"},"type":"Feature","geometry":{"type":"Point","coordinates":[-112.1700814,47.8199892]}},{"properties":{"latitude":44.5262364,"date":{"end_time":"2009/06/30 00:00:00 -0400","original":"6/29/2009","granularity":"day","time":"2009/06/29 00:00:00 -0400"},"checklists":1,"longitude":-109.0549333,"id":"adtlbsfnk2ny","location":"Cody"},"type":"Feature","geometry":{"type":"Point","coordinates":[-109.0549333,44.5262364]}},{"properties":{"latitude":44.56641,"date":{"end_time":"2009/07/01 00:00:00 -0400","original":"6/30/2009","granularity":"day","time":"2009/06/30 00:00:00 -0400"},"checklists":1,"longitude":-110.3820848,"id":"adtlbshdx4wq","location":"Yellowstone NP--Fishing Bridge"},"type":"Feature","geometry":{"type":"Point","coordinates":[-110.3820848,44.56641]}},{"properties":{"latitude":44.6496887,"date":{"end_time":"2009/07/01 00:00:00 -0400","original":"6/30/2009","granularity":"day","time":"2009/06/30 00:00:00 -0400"},"checklists":1,"longitude":-110.4587772,"id":"adtlbsqf7cdl","location":"Yellowstone NP--Haydn Valley"},"type":"Feature","geometry":{"type":"Point","coordinates":[-110.4587772,44.6496887]}},{"properties":{"latitude":44.4640752,"date":{"end_time":"2009/07/01 00:00:00 -0400","original":"6/30/2009","granularity":"day","time":"2009/06/30 00:00:00 -0400"},"checklists":1,"longitude":-109.6065904,"id":"adtlbsrlzvjm","location":"Yellowstone NP--E Entrance"},"type":"Feature","geometry":{"type":"Point","coordinates":[-109.6065904,44.4640752]}},{"properties":{"latitude":44.9763398,"date":{"end_time":"2009/07/01 00:00:00 -0400","original":"6/30/2009","granularity":"day","time":"2009/06/30 00:00:00 -0400"},"checklists":1,"longitude":-110.70179,"id":"adtlbslal26n","location":"Yellowstone NP--Mammoth Hot Springs"},"type":"Feature","geometry":{"type":"Point","coordinates":[-110.70179,44.9763398]}},{"properties":{"latitude":44.529445,"date":{"end_time":"2009/07/01 00:00:00 -0400","original":"6/30/2009","granularity":"day","time":"2009/06/30 00:00:00 -0400"},"checklists":1,"longitude":-110.2973399,"id":"adtlbsukdm2k","location":"Yellowstone NP--Steamboat Point"},"type":"Feature","geometry":{"type":"Point","coordinates":[-110.2973399,44.529445]}},{"properties":{"latitude":48.6602988,"date":{"end_time":"2009/07/03 00:00:00 -0400","original":"7/2/2009","granularity":"day","time":"2009/07/02 00:00:00 -0400"},"checklists":1,"longitude":-113.7902927,"id":"adtlbsjqafsa","location":"Glacier NP--Avalanche Lake Trail"},"type":"Feature","geometry":{"type":"Point","coordinates":[-113.7902927,48.6602988]}},{"properties":{"latitude":48.8165363,"date":{"end_time":"2009/07/04 00:00:00 -0400","original":"7/3/2009","granularity":"day","time":"2009/07/03 00:00:00 -0400"},"checklists":1,"longitude":-113.7063114,"id":"adtlbsluxiz8","location":"Glacier NP--Many Glacier--Iceberg Lake Trail"},"type":"Feature","geometry":{"type":"Point","coordinates":[-113.7063114,48.8165363]}},{"properties":{"latitude":48.6950849,"date":{"end_time":"2009/07/04 00:00:00 -0400","original":"7/3/2009","granularity":"day","time":"2009/07/03 00:00:00 -0400"},"checklists":1,"longitude":-113.7199347,"id":"adtlbsrgsdpb","location":"Glacier NP--Logan Pass"},"type":"Feature","geometry":{"type":"Point","coordinates":[-113.7199347,48.6950849]}},{"properties":{"latitude":46.6136013,"date":{"end_time":"2009/08/14 00:00:00 -0400","original":"8/13/2009","granularity":"day","time":"2009/08/13 00:00:00 -0400"},"checklists":1,"longitude":-85.2576141,"id":"adtlbser852h","location":"Tahquamenon Falls SP (Luce Co.)"},"type":"Feature","geometry":{"type":"Point","coordinates":[-85.2576141,46.6136013]}},{"properties":{"latitude":46.1752,"date":{"end_time":"2009/08/15 00:00:00 -0400","original":"8/14/2009","granularity":"day","time":"2009/08/14 00:00:00 -0400"},"checklists":1,"longitude":-88.54942,"id":"adtlbser0nvc","location":"Iron"},"type":"Feature","geometry":{"type":"Point","coordinates":[-88.54942,46.1752]}},{"properties":{"latitude":46.5803962,"date":{"end_time":"2009/08/15 00:00:00 -0400","original":"8/14/2009","granularity":"day","time":"2009/08/14 00:00:00 -0400"},"checklists":1,"longitude":-86.282854,"id":"adtlbstcsham","location":"Pictured Rocks National Lakeshore"},"type":"Feature","geometry":{"type":"Point","coordinates":[-86.282854,46.5803962]}},{"properties":{"latitude":43.0959221,"date":{"end_time":"2009/10/18 00:00:00 -0400","original":"10/17/2009","granularity":"day","time":"2009/10/17 00:00:00 -0400"},"checklists":1,"longitude":-85.2042747,"id":"adtlbsubz14a","location":"Lightning Bend Park"},"type":"Feature","geometry":{"type":"Point","coordinates":[-85.2042747,43.0959221]}},{"properties":{"latitude":43.0262857,"date":{"end_time":"2010/01/02 00:00:00 -0500","original":"1/1/2010","granularity":"day","time":"2010/01/01 00:00:00 -0500"},"checklists":1,"longitude":-85.5984478,"id":"adtlbsrzru37","location":"Provin Trails Park"},"type":"Feature","geometry":{"type":"Point","coordinates":[-85.5984478,43.0262857]}},{"properties":{"latitude":42.9268285,"date":{"end_time":"2010/01/03 00:00:00 -0500","original":"1/2/2010","granularity":"day","time":"2010/01/02 00:00:00 -0500"},"checklists":1,"longitude":-85.6240082,"id":"adtlbsq2z0z7","location":"Grand Rapids CBC Section F - Reeds Lake Area"},"type":"Feature","geometry":{"type":"Point","coordinates":[-85.6240082,42.9268285]}},{"properties":{"latitude":43.0618647,"date":{"end_time":"2010/01/24 00:00:00 -0500","original":"1/23/2010","granularity":"day","time":"2010/01/23 00:00:00 -0500"},"checklists":1,"longitude":-85.6090736,"id":"adtlbseuqi4i","location":"Grand River--Jupiter Ave."},"type":"Feature","geometry":{"type":"Point","coordinates":[-85.6090736,43.0618647]}},{"properties":{"latitude":43.197793,"date":{"end_time":"2010/02/26 00:00:00 -0500","original":"2/25/2010","granularity":"day","time":"2010/02/25 00:00:00 -0500"},"checklists":1,"longitude":-85.5768013,"id":"adtlbsf7mq83","location":"US-131 between M-46 and M-57"},"type":"Feature","geometry":{"type":"Point","coordinates":[-85.5768013,43.197793]}},{"properties":{"latitude":44.7631,"date":{"end_time":"2010/03/06 00:00:00 -0500","original":"3/5/2010","granularity":"day","time":"2010/03/05 00:00:00 -0500"},"checklists":1,"longitude":-85.62068,"id":"adtlbst0qqr5","location":"Traverse City"},"type":"Feature","geometry":{"type":"Point","coordinates":[-85.62068,44.7631]}},{"properties":{"latitude":43.1184025,"date":{"end_time":"2010/04/06 00:00:00 -0400","original":"4/5/2010","granularity":"day","time":"2010/04/05 00:00:00 -0400"},"checklists":1,"longitude":-85.3769875,"id":"adtlbssti0pa","location":"Lessiter Ave. and 10 Mile Rd."},"type":"Feature","geometry":{"type":"Point","coordinates":[-85.3769875,43.1184025]}},{"properties":{"latitude":43.1472154,"date":{"end_time":"2010/04/06 00:00:00 -0400","original":"4/5/2010","granularity":"day","time":"2010/04/05 00:00:00 -0400"},"checklists":1,"longitude":-85.43046,"id":"adtlbsj4u2dv","location":"Ramsdell and 12 Mile"},"type":"Feature","geometry":{"type":"Point","coordinates":[-85.43046,43.1472154]}},{"properties":{"latitude":43.1255443,"date":{"end_time":"2010/04/11 00:00:00 -0400","original":"4/10/2010","granularity":"day","time":"2010/04/10 00:00:00 -0400"},"checklists":1,"longitude":-85.3967285,"id":"adtlbsr5p5mb","location":"Wabasis Ave. and Hart Rd."},"type":"Feature","geometry":{"type":"Point","coordinates":[-85.3967285,43.1255443]}},{"properties":{"latitude":43.0860658,"date":{"end_time":"2010/04/12 00:00:00 -0400","original":"4/11/2010","granularity":"day","time":"2010/04/11 00:00:00 -0400"},"checklists":1,"longitude":-85.456295,"id":"adtlbss6k268","location":"Bostwick Lake"},"type":"Feature","geometry":{"type":"Point","coordinates":[-85.456295,43.0860658]}},{"properties":{"latitude":43.1102572,"date":{"end_time":"2010/04/12 00:00:00 -0400","original":"4/11/2010","granularity":"day","time":"2010/04/11 00:00:00 -0400"},"checklists":1,"longitude":-85.128336,"id":"adtlbsk3052s","location":"Long Lake"},"type":"Feature","geometry":{"type":"Point","coordinates":[-85.128336,43.1102572]}},{"properties":{"latitude":43.2513295,"date":{"end_time":"2010/04/18 00:00:00 -0400","original":"4/17/2010","granularity":"day","time":"2010/04/17 00:00:00 -0400"},"checklists":1,"longitude":-86.0361671,"id":"adtlbsq39iyh","location":"Muskegon Wastewater"},"type":"Feature","geometry":{"type":"Point","coordinates":[-86.0361671,43.2513295]}},{"properties":{"latitude":43.0232236,"date":{"end_time":"2010/04/18 00:00:00 -0400","original":"4/17/2010","granularity":"day","time":"2010/04/17 00:00:00 -0400"},"checklists":1,"longitude":-86.1920786,"id":"adtlbsm09n8c","location":"Hofma Preserve"},"type":"Feature","geometry":{"type":"Point","coordinates":[-86.1920786,43.0232236]}},{"properties":{"latitude":42.7326711,"date":{"end_time":"2010/05/05 00:00:00 -0400","original":"5/4/2010","granularity":"day","time":"2010/05/04 00:00:00 -0400"},"checklists":1,"longitude":-84.5554161,"id":"adtlbsed9rg5","location":"Lansing--Capitol Building"},"type":"Feature","geometry":{"type":"Point","coordinates":[-84.5554161,42.7326711]}},{"properties":{"latitude":44.6436816,"date":{"end_time":"2010/05/07 00:00:00 -0400","original":"5/6/2010","granularity":"day","time":"2010/05/06 00:00:00 -0400"},"checklists":1,"longitude":-84.7025299,"id":"adtlbshe13xc","location":"Grayling Sewage Ponds"},"type":"Feature","geometry":{"type":"Point","coordinates":[-84.7025299,44.6436816]}},{"properties":{"latitude":44.6421548,"date":{"end_time":"2010/05/07 00:00:00 -0400","original":"5/6/2010","granularity":"day","time":"2010/05/06 00:00:00 -0400"},"checklists":1,"longitude":-84.7092676,"id":"adtlbsevs600","location":"Military Rd. Exit"},"type":"Feature","geometry":{"type":"Point","coordinates":[-84.7092676,44.6421548]}},{"properties":{"latitude":43.5555151,"date":{"end_time":"2010/06/03 00:00:00 -0400","original":"6/2/2010","granularity":"day","time":"2010/06/02 00:00:00 -0400"},"checklists":1,"longitude":-88.6301422,"id":"adtlbsnik8f0","location":"Horicon Marsh--General"},"type":"Feature","geometry":{"type":"Point","coordinates":[-88.6301422,43.5555151]}},{"properties":{"latitude":43.6535901,"date":{"end_time":"2010/06/08 00:00:00 -0400","original":"6/7/2010","granularity":"day","time":"2010/06/07 00:00:00 -0400"},"checklists":1,"longitude":-87.7258301,"id":"adtlbsfx7eeb","location":"Terry-Andrae State Park"},"type":"Feature","geometry":{"type":"Point","coordinates":[-87.7258301,43.6535901]}},{"properties":{"latitude":39.1653519,"date":{"end_time":"2010/06/11 00:00:00 -0400","original":"6/10/2010","granularity":"day","time":"2010/06/10 00:00:00 -0400"},"checklists":1,"longitude":-86.5263977,"id":"adtlbsmeevn0","location":"Bloomington"},"type":"Feature","geometry":{"type":"Point","coordinates":[-86.5263977,39.1653519]}},{"properties":{"latitude":43.2817043,"date":{"end_time":"2010/07/22 00:00:00 -0400","original":"7/21/2010","granularity":"day","time":"2010/07/21 00:00:00 -0400"},"checklists":1,"longitude":-79.9193573,"id":"adtlbsegribq","location":"Hamilton--Royal Botanical Gardens"},"type":"Feature","geometry":{"type":"Point","coordinates":[-79.9193573,43.2817043]}},{"properties":{"latitude":43.1775795,"date":{"end_time":"2010/07/26 00:00:00 -0400","original":"7/25/2010","granularity":"day","time":"2010/07/25 00:00:00 -0400"},"checklists":1,"longitude":-85.2475977,"id":"adtlbsrrngii","location":"Danish Kingdom Playground"},"type":"Feature","geometry":{"type":"Point","coordinates":[-85.2475977,43.1775795]}},{"properties":{"latitude":41.669065,"date":{"end_time":"2010/08/03 00:00:00 -0400","original":"8/2/2010","granularity":"day","time":"2010/08/02 00:00:00 -0400"},"checklists":1,"longitude":-87.5201797,"id":"adtlbsm1pcgh","location":"Wolf Lake"},"type":"Feature","geometry":{"type":"Point","coordinates":[-87.5201797,41.669065]}},{"properties":{"latitude":43.2468908,"date":{"end_time":"2010/08/21 00:00:00 -0400","original":"8/20/2010","granularity":"day","time":"2010/08/20 00:00:00 -0400"},"checklists":1,"longitude":-86.0379524,"id":"adtlbsr7i7uy","location":"Muskegon Wastewater System--Center Dike"},"type":"Feature","geometry":{"type":"Point","coordinates":[-86.0379524,43.2468908]}},{"properties":{"latitude":43.2206894,"date":{"end_time":"2010/08/21 00:00:00 -0400","original":"8/20/2010","granularity":"day","time":"2010/08/20 00:00:00 -0400"},"checklists":1,"longitude":-86.008255,"id":"adtlbsrzn30u","location":"Muskegon Wastewater System--Laketon/Swanson Fields"},"type":"Feature","geometry":{"type":"Point","coordinates":[-86.008255,43.2206894]}},{"properties":{"latitude":43.2593622,"date":{"end_time":"2010/08/21 00:00:00 -0400","original":"8/20/2010","granularity":"day","time":"2010/08/20 00:00:00 -0400"},"checklists":1,"longitude":-86.0477886,"id":"adtlbsr8fs14","location":"Muskegon Wastewater System--Secondary Treatment Cells"},"type":"Feature","geometry":{"type":"Point","coordinates":[-86.0477886,43.2593622]}},{"properties":{"latitude":43.0865672,"date":{"end_time":"2010/08/30 00:00:00 -0400","original":"8/29/2010","granularity":"day","time":"2010/08/29 00:00:00 -0400"},"checklists":1,"longitude":-85.4704571,"id":"adtlbsj7qg0o","location":"M44 and Pando Area"},"type":"Feature","geometry":{"type":"Point","coordinates":[-85.4704571,43.0865672]}},{"properties":{"latitude":43.0433627,"date":{"end_time":"2010/09/05 00:00:00 -0400","original":"9/4/2010","granularity":"day","time":"2010/09/04 00:00:00 -0400"},"checklists":1,"longitude":-85.4250526,"id":"adtlbsrvvqra","location":"Parnell on Cannonsburg"},"type":"Feature","geometry":{"type":"Point","coordinates":[-85.4250526,43.0433627]}},{"properties":{"latitude":42.0691986,"date":{"end_time":"2010/09/21 00:00:00 -0400","original":"9/20/2010","granularity":"day","time":"2010/09/20 00:00:00 -0400"},"checklists":1,"longitude":-83.1941986,"id":"adtlbsk0ojwo","location":"Lake Erie Metropark"},"type":"Feature","geometry":{"type":"Point","coordinates":[-83.1941986,42.0691986]}},{"properties":{"latitude":42.0441936,"date":{"end_time":"2010/09/21 00:00:00 -0400","original":"9/20/2010","granularity":"day","time":"2010/09/20 00:00:00 -0400"},"checklists":1,"longitude":-83.2118225,"id":"adtlbstnmvh5","location":"Point Moillee (Rivermouth)"},"type":"Feature","geometry":{"type":"Point","coordinates":[-83.2118225,42.0441936]}},{"properties":{"latitude":43.0633697,"date":{"end_time":"2010/10/04 00:00:00 -0400","original":"10/3/2010","granularity":"day","time":"2010/10/03 00:00:00 -0400"},"checklists":1,"longitude":-85.5798054,"id":"adtlbsjpghjd","location":"Grand River and East Beltline"},"type":"Feature","geometry":{"type":"Point","coordinates":[-85.5798054,43.0633697]}},{"properties":{"latitude":42.91193,"date":{"end_time":"2010/10/10 00:00:00 -0400","original":"10/9/2010","granularity":"day","time":"2010/10/09 00:00:00 -0400"},"checklists":1,"longitude":-83.98466,"id":"adtlbso97wry","location":"Durand"},"type":"Feature","geometry":{"type":"Point","coordinates":[-83.98466,42.91193]}},{"properties":{"latitude":43.3024455,"date":{"end_time":"2010/10/14 00:00:00 -0400","original":"10/13/2010","granularity":"day","time":"2010/10/13 00:00:00 -0400"},"checklists":1,"longitude":-79.8011684,"id":"adtlbsouuz9i","location":"Windermere Basin"},"type":"Feature","geometry":{"type":"Point","coordinates":[-79.8011684,43.3024455]}},{"properties":{"latitude":43.2449761,"date":{"end_time":"2010/10/14 00:00:00 -0400","original":"10/13/2010","granularity":"day","time":"2010/10/13 00:00:00 -0400"},"checklists":1,"longitude":-79.7304225,"id":"adtlbsk5cpue","location":"Ernie Seager Parkette"},"type":"Feature","geometry":{"type":"Point","coordinates":[-79.7304225,43.2449761]}},{"properties":{"latitude":42.6781447,"date":{"end_time":"2010/10/15 00:00:00 -0400","original":"10/14/2010","granularity":"day","time":"2010/10/14 00:00:00 -0400"},"checklists":1,"longitude":-81.2473297,"id":"adtlbsiuhpuf","location":"Port Stanley--Sewage Lagoons"},"type":"Feature","geometry":{"type":"Point","coordinates":[-81.2473297,42.6781447]}},{"properties":{"latitude":42.6651447,"date":{"end_time":"2010/10/15 00:00:00 -0400","original":"10/14/2010","granularity":"day","time":"2010/10/14 00:00:00 -0400"},"checklists":1,"longitude":-81.1700821,"id":"adtlbsh4v833","location":"Hawk Cliff (southern station)"},"type":"Feature","geometry":{"type":"Point","coordinates":[-81.1700821,42.6651447]}},{"properties":{"latitude":42.7270283,"date":{"end_time":"2010/10/15 00:00:00 -0400","original":"10/14/2010","granularity":"day","time":"2010/10/14 00:00:00 -0400"},"checklists":1,"longitude":-80.4425812,"id":"adtlbsezbmmj","location":"Backus Woods Conservation Area"},"type":"Feature","geometry":{"type":"Point","coordinates":[-80.4425812,42.7270283]}},{"properties":{"latitude":42.6424196,"date":{"end_time":"2010/10/16 00:00:00 -0400","original":"10/15/2010","granularity":"day","time":"2010/10/15 00:00:00 -0400"},"checklists":1,"longitude":-80.8063316,"id":"adtlbsotiipx","location":"Port Burwell--Town Beach &amp; Harbour"},"type":"Feature","geometry":{"type":"Point","coordinates":[-80.8063316,42.6424196]}},{"properties":{"latitude":43.1199687,"date":{"end_time":"2010/11/29 00:00:00 -0500","original":"11/28/2010","granularity":"day","time":"2010/11/28 00:00:00 -0500"},"checklists":1,"longitude":-85.5858457,"id":"adtlbsqy9ved","location":"Wolven Rd."},"type":"Feature","geometry":{"type":"Point","coordinates":[-85.5858457,43.1199687]}},{"properties":{"latitude":43.072619,"date":{"end_time":"2010/12/14 00:00:00 -0500","original":"12/13/2010","granularity":"day","time":"2010/12/13 00:00:00 -0500"},"checklists":1,"longitude":-79.074761,"id":"adtlbsf8dx9y","location":"Niagara--Upper Falls (ON)"},"type":"Feature","geometry":{"type":"Point","coordinates":[-79.074761,43.072619]}},{"properties":{"latitude":43.1785809,"date":{"end_time":"2010/12/14 00:00:00 -0500","original":"12/13/2010","granularity":"day","time":"2010/12/13 00:00:00 -0500"},"checklists":1,"longitude":-79.2724514,"id":"adtlbsh1aqm6","location":"Martindale--St. Catherines"},"type":"Feature","geometry":{"type":"Point","coordinates":[-79.2724514,43.1785809]}},{"properties":{"latitude":43.1433,"date":{"end_time":"2010/12/14 00:00:00 -0500","original":"12/13/2010","granularity":"day","time":"2010/12/13 00:00:00 -0500"},"checklists":1,"longitude":-79.0447,"id":"adtlbsi43k9m","location":"Niagara--Adam Beck (ON)"},"type":"Feature","geometry":{"type":"Point","coordinates":[-79.0447,43.1433]}},{"properties":{"latitude":42.9977423,"date":{"end_time":"2010/12/15 00:00:00 -0500","original":"12/14/2010","granularity":"day","time":"2010/12/14 00:00:00 -0500"},"checklists":1,"longitude":-80.8267593,"id":"adtlbsii1slj","location":"Salford Area"},"type":"Feature","geometry":{"type":"Point","coordinates":[-80.8267593,42.9977423]}},{"properties":{"latitude":42.9164579,"date":{"end_time":"2010/12/15 00:00:00 -0500","original":"12/14/2010","granularity":"day","time":"2010/12/14 00:00:00 -0500"},"checklists":1,"longitude":-80.6703758,"id":"adtlbsf0irbp","location":"Springford Area"},"type":"Feature","geometry":{"type":"Point","coordinates":[-80.6703758,42.9164579]}},{"properties":{"latitude":43.3872,"date":{"end_time":"2010/12/28 00:00:00 -0500","original":"12/27/2010","granularity":"day","time":"2010/12/27 00:00:00 -0500"},"checklists":1,"longitude":-87.87569,"id":"adtlbsggn7rl","location":"Port Washington"},"type":"Feature","geometry":{"type":"Point","coordinates":[-87.87569,43.3872]}},{"properties":{"latitude":42.12753,"date":{"end_time":"2010/12/28 00:00:00 -0500","original":"12/27/2010","granularity":"day","time":"2010/12/27 00:00:00 -0500"},"checklists":1,"longitude":-87.82897,"id":"adtlbsthcdot","location":"Northbrook"},"type":"Feature","geometry":{"type":"Point","coordinates":[-87.82897,42.12753]}},{"properties":{"latitude":43.058455,"date":{"end_time":"2010/12/31 00:00:00 -0500","original":"12/30/2010","granularity":"day","time":"2010/12/30 00:00:00 -0500"},"checklists":1,"longitude":-87.876085,"id":"adtlbsrop079","location":"Bradford Beach/North Point"},"type":"Feature","geometry":{"type":"Point","coordinates":[-87.876085,43.058455]}},{"properties":{"latitude":42.10974,"date":{"end_time":"2010/12/31 00:00:00 -0500","original":"12/30/2010","granularity":"day","time":"2010/12/30 00:00:00 -0500"},"checklists":1,"longitude":-86.48002,"id":"adtlbsf2zqw6","location":"Saint Joseph"},"type":"Feature","geometry":{"type":"Point","coordinates":[-86.48002,42.10974]}},{"properties":{"latitude":43.0328402,"date":{"end_time":"2011/01/02 00:00:00 -0500","original":"1/1/2011","granularity":"day","time":"2011/01/01 00:00:00 -0500"},"checklists":1,"longitude":-85.4017124,"id":"adtlbsq1x529","location":"Grand Rapids CBC Section C1--Murray Lake Area"},"type":"Feature","geometry":{"type":"Point","coordinates":[-85.4017124,43.0328402]}},{"properties":{"latitude":43.0161535,"date":{"end_time":"2011/01/09 00:00:00 -0500","original":"1/8/2011","granularity":"day","time":"2011/01/08 00:00:00 -0500"},"checklists":1,"longitude":-85.4408247,"id":"adtlbsfu1zu7","location":"McCabe Ave. and 3 Mile Rd."},"type":"Feature","geometry":{"type":"Point","coordinates":[-85.4408247,43.0161535]}},{"properties":{"latitude":42.78752,"date":{"end_time":"2011/01/29 00:00:00 -0500","original":"1/28/2011","granularity":"day","time":"2011/01/28 00:00:00 -0500"},"checklists":1,"longitude":-86.10894,"id":"adtlbsswijyd","location":"Holland"},"type":"Feature","geometry":{"type":"Point","coordinates":[-86.10894,42.78752]}},{"properties":{"latitude":42.98004,"date":{"end_time":"2011/02/06 00:00:00 -0500","original":"2/5/2011","granularity":"day","time":"2011/02/05 00:00:00 -0500"},"checklists":1,"longitude":-81.22987,"id":"adtlbsnkk87q","location":"London"},"type":"Feature","geometry":{"type":"Point","coordinates":[-81.22987,42.98004]}},{"properties":{"latitude":43.099998,"date":{"end_time":"2011/02/06 00:00:00 -0500","original":"2/5/2011","granularity":"day","time":"2011/02/05 00:00:00 -0500"},"checklists":1,"longitude":-82.5,"id":"adtlbsmorlpt","location":"Port Huron"},"type":"Feature","geometry":{"type":"Point","coordinates":[-82.5,43.099998]}},{"properties":{"latitude":42.7369308,"date":{"end_time":"2011/02/13 00:00:00 -0500","original":"2/12/2011","granularity":"day","time":"2011/02/12 00:00:00 -0500"},"checklists":1,"longitude":-84.4838791,"id":"adtlbsuixqct","location":"East Lansing"},"type":"Feature","geometry":{"type":"Point","coordinates":[-84.4838791,42.7369308]}},{"properties":{"latitude":43.1331864,"date":{"end_time":"2011/02/20 00:00:00 -0500","original":"2/19/2011","granularity":"day","time":"2011/02/19 00:00:00 -0500"},"checklists":1,"longitude":-85.3423977,"id":"adtlbsmxymga","location":"Tully and 11 Mile"},"type":"Feature","geometry":{"type":"Point","coordinates":[-85.3423977,43.1331864]}},{"properties":{"latitude":46.3185997,"date":{"end_time":"2011/02/23 00:00:00 -0500","original":"2/22/2011","granularity":"day","time":"2011/02/22 00:00:00 -0500"},"checklists":1,"longitude":-85.1582909,"id":"adtlbsr125s3","location":"Hulbert Bog"},"type":"Feature","geometry":{"type":"Point","coordinates":[-85.1582909,46.3185997]}},{"properties":{"latitude":46.3625372,"date":{"end_time":"2011/02/23 00:00:00 -0500","original":"2/22/2011","granularity":"day","time":"2011/02/22 00:00:00 -0500"},"checklists":1,"longitude":-84.2800283,"id":"adtlbspddc47","location":"Lower Haylane, 10 Mile"},"type":"Feature","geometry":{"type":"Point","coordinates":[-84.2800283,46.3625372]}},{"properties":{"latitude":46.3341656,"date":{"end_time":"2011/02/23 00:00:00 -0500","original":"2/22/2011","granularity":"day","time":"2011/02/22 00:00:00 -0500"},"checklists":1,"longitude":-84.4451183,"id":"adtlbstqi001","location":"Dafter Dump"},"type":"Feature","geometry":{"type":"Point","coordinates":[-84.4451183,46.3341656]}},{"properties":{"latitude":45.52935,"date":{"end_time":"2011/02/23 00:00:00 -0500","original":"2/22/2011","granularity":"day","time":"2011/02/22 00:00:00 -0500"},"checklists":1,"longitude":-84.92232,"id":"adtlbsprwuoc","location":"Emmet"},"type":"Feature","geometry":{"type":"Point","coordinates":[-84.92232,45.52935]}},{"properties":{"latitude":44.34038,"date":{"end_time":"2011/02/23 00:00:00 -0500","original":"2/22/2011","granularity":"day","time":"2011/02/22 00:00:00 -0500"},"checklists":1,"longitude":-84.61346,"id":"adtlbsp70t21","location":"Roscommon"},"type":"Feature","geometry":{"type":"Point","coordinates":[-84.61346,44.34038]}},{"properties":{"latitude":46.3755962,"date":{"end_time":"2011/02/23 00:00:00 -0500","original":"2/22/2011","granularity":"day","time":"2011/02/22 00:00:00 -0500"},"checklists":1,"longitude":-84.3640137,"id":"adtlbshnajq0","location":"9 Mile and HWY 129"},"type":"Feature","geometry":{"type":"Point","coordinates":[-84.3640137,46.3755962]}},{"properties":{"latitude":46.3606788,"date":{"end_time":"2011/02/24 00:00:00 -0500","original":"2/23/2011","granularity":"day","time":"2011/02/23 00:00:00 -0500"},"checklists":1,"longitude":-84.4288373,"id":"adtlbsqiwyx8","location":"Dafter Post Office"},"type":"Feature","geometry":{"type":"Point","coordinates":[-84.4288373,46.3606788]}},{"properties":{"latitude":46.2740039,"date":{"end_time":"2011/02/24 00:00:00 -0500","original":"2/23/2011","granularity":"day","time":"2011/02/23 00:00:00 -0500"},"checklists":1,"longitude":-84.5148611,"id":"adtlbslh34ha","location":"Tone Line and HWY 129"},"type":"Feature","geometry":{"type":"Point","coordinates":[-84.5148611,46.2740039]}},{"properties":{"latitude":46.376366,"date":{"end_time":"2011/02/24 00:00:00 -0500","original":"2/23/2011","granularity":"day","time":"2011/02/23 00:00:00 -0500"},"checklists":1,"longitude":-84.2695141,"id":"adtlbsqz3446","location":"Soo Fields and Area"},"type":"Feature","geometry":{"type":"Point","coordinates":[-84.2695141,46.376366]}},{"properties":{"latitude":46.4192216,"date":{"end_time":"2011/02/24 00:00:00 -0500","original":"2/23/2011","granularity":"day","time":"2011/02/23 00:00:00 -0500"},"checklists":1,"longitude":-84.3803215,"id":"adtlbsn8bb9w","location":"6 mile east of 75"},"type":"Feature","geometry":{"type":"Point","coordinates":[-84.3803215,46.4192216]}},{"properties":{"latitude":43.1260142,"date":{"end_time":"2011/03/03 00:00:00 -0500","original":"3/2/2011","granularity":"day","time":"2011/03/02 00:00:00 -0500"},"checklists":1,"longitude":-85.3786182,"id":"adtlbshkmhhc","location":"Wabasis Shore Dr"},"type":"Feature","geometry":{"type":"Point","coordinates":[-85.3786182,43.1260142]}},{"properties":{"latitude":43.0975203,"date":{"end_time":"2011/03/06 00:00:00 -0500","original":"3/5/2011","granularity":"day","time":"2011/03/05 00:00:00 -0500"},"checklists":1,"longitude":-85.2135336,"id":"adtlbsejnn79","location":"Knowlton Yard"},"type":"Feature","geometry":{"type":"Point","coordinates":[-85.2135336,43.0975203]}},{"properties":{"latitude":43.1092148,"date":{"end_time":"2011/03/06 00:00:00 -0500","original":"3/5/2011","granularity":"day","time":"2011/03/05 00:00:00 -0500"},"checklists":1,"longitude":-85.3325537,"id":"adtlbsmq29px","location":"Heffron Rd and Ashley Ave"},"type":"Feature","geometry":{"type":"Point","coordinates":[-85.3325537,43.1092148]}},{"properties":{"latitude":43.1039283,"date":{"end_time":"2011/03/06 00:00:00 -0500","original":"3/5/2011","granularity":"day","time":"2011/03/05 00:00:00 -0500"},"checklists":1,"longitude":-85.2540779,"id":"adtlbsihtjgl","location":"Candlestone on Ellis"},"type":"Feature","geometry":{"type":"Point","coordinates":[-85.2540779,43.1039283]}},{"properties":{"latitude":43.1404048,"date":{"end_time":"2011/03/13 00:00:00 -0500","original":"3/12/2011","granularity":"day","time":"2011/03/12 00:00:00 -0500"},"checklists":1,"longitude":-85.3324628,"id":"adtlbshto8bo","location":"Beardslee and Ashley"},"type":"Feature","geometry":{"type":"Point","coordinates":[-85.3324628,43.1404048]}},{"properties":{"latitude":43.1497515,"date":{"end_time":"2011/03/13 00:00:00 -0500","original":"3/12/2011","granularity":"day","time":"2011/03/12 00:00:00 -0500"},"checklists":1,"longitude":-85.3164768,"id":"adtlbshhhqvq","location":"Bearslee Lake Marsh"},"type":"Feature","geometry":{"type":"Point","coordinates":[-85.3164768,43.1497515]}},{"properties":{"latitude":43.1484052,"date":{"end_time":"2011/03/13 00:00:00 -0500","original":"3/12/2011","granularity":"day","time":"2011/03/12 00:00:00 -0500"},"checklists":1,"longitude":-85.2669525,"id":"adtlbsntqloe","location":"M-91 and Baker Rd."},"type":"Feature","geometry":{"type":"Point","coordinates":[-85.2669525,43.1484052]}},{"properties":{"latitude":41.9959877,"date":{"end_time":"2011/04/10 00:00:00 -0400","original":"4/9/2011","granularity":"day","time":"2011/04/09 00:00:00 -0400"},"checklists":1,"longitude":-83.2907867,"id":"adtlbss7hzix","location":"Swan Creek Rd."},"type":"Feature","geometry":{"type":"Point","coordinates":[-83.2907867,41.9959877]}},{"properties":{"latitude":42.134201,"date":{"end_time":"2011/04/10 00:00:00 -0400","original":"4/9/2011","granularity":"day","time":"2011/04/09 00:00:00 -0400"},"checklists":1,"longitude":-83.3716965,"id":"adtlbsgd7poo","location":"Willow Metropark"},"type":"Feature","geometry":{"type":"Point","coordinates":[-83.3716965,42.134201]}},{"properties":{"latitude":43.1789095,"date":{"end_time":"2011/04/20 00:00:00 -0400","original":"4/19/2011","granularity":"day","time":"2011/04/19 00:00:00 -0400"},"checklists":1,"longitude":-85.260483,"id":"adtlbsu7npel","location":"Greenville Post Office"},"type":"Feature","geometry":{"type":"Point","coordinates":[-85.260483,43.1789095]}},{"properties":{"latitude":43.04333,"date":{"end_time":"2011/04/22 00:00:00 -0400","original":"4/21/2011","granularity":"day","time":"2011/04/21 00:00:00 -0400"},"checklists":1,"longitude":-85.41142,"id":"adtlbsocihdf","location":"Parnell"},"type":"Feature","geometry":{"type":"Point","coordinates":[-85.41142,43.04333]}},{"properties":{"latitude":43.0975046,"date":{"end_time":"2011/04/27 00:00:00 -0400","original":"4/26/2011","granularity":"day","time":"2011/04/26 00:00:00 -0400"},"checklists":1,"longitude":-85.2354956,"id":"adtlbsm4j4u9","location":"Water Street Park"},"type":"Feature","geometry":{"type":"Point","coordinates":[-85.2354956,43.0975046]}},{"properties":{"latitude":43.0475026,"date":{"end_time":"2011/04/29 00:00:00 -0400","original":"4/28/2011","granularity":"day","time":"2011/04/28 00:00:00 -0400"},"checklists":1,"longitude":-85.6008339,"id":"adtlbsn1j2a4","location":"Plainfield Gulley"},"type":"Feature","geometry":{"type":"Point","coordinates":[-85.6008339,43.0475026]}},{"properties":{"latitude":43.130446,"date":{"end_time":"2011/05/03 00:00:00 -0400","original":"5/2/2011","granularity":"day","time":"2011/05/02 00:00:00 -0400"},"checklists":1,"longitude":-85.2482629,"id":"adtlbshdpd3d","location":"Wabasis Creek at River Road"},"type":"Feature","geometry":{"type":"Point","coordinates":[-85.2482629,43.130446]}},{"properties":{"latitude":43.1188724,"date":{"end_time":"2011/05/03 00:00:00 -0400","original":"5/2/2011","granularity":"day","time":"2011/05/02 00:00:00 -0400"},"checklists":1,"longitude":-85.3029156,"id":"adtlbsrvabiy","location":"Bricker and Johnson"},"type":"Feature","geometry":{"type":"Point","coordinates":[-85.3029156,43.1188724]}},{"properties":{"latitude":42.962774,"date":{"end_time":"2011/05/06 00:00:00 -0400","original":"5/5/2011","granularity":"day","time":"2011/05/05 00:00:00 -0400"},"checklists":1,"longitude":-85.5403233,"id":"adtlbsl7tr1c","location":"Fulton and Spaulding"},"type":"Feature","geometry":{"type":"Point","coordinates":[-85.5403233,42.962774]}},{"properties":{"latitude":43.17006,"date":{"end_time":"2011/05/13 00:00:00 -0400","original":"5/12/2011","granularity":"day","time":"2011/05/12 00:00:00 -0400"},"checklists":1,"longitude":-79.24979,"id":"adtlbsjuj6ge","location":"St. Catharines"},"type":"Feature","geometry":{"type":"Point","coordinates":[-79.24979,43.17006]}},{"properties":{"latitude":42.5795669,"date":{"end_time":"2011/05/14 00:00:00 -0400","original":"5/13/2011","granularity":"day","time":"2011/05/13 00:00:00 -0400"},"checklists":1,"longitude":-80.4273891,"id":"adtlbslfv4ts","location":"Long Point--Townsite"},"type":"Feature","geometry":{"type":"Point","coordinates":[-80.4273891,42.5795669]}},{"properties":{"latitude":43.0216941,"date":{"end_time":"2011/05/14 00:00:00 -0400","original":"5/13/2011","granularity":"day","time":"2011/05/13 00:00:00 -0400"},"checklists":1,"longitude":-80.6628549,"id":"adtlbssweoa0","location":"Pine Spot"},"type":"Feature","geometry":{"type":"Point","coordinates":[-80.6628549,43.0216941]}},{"properties":{"latitude":43.0234746,"date":{"end_time":"2011/05/14 00:00:00 -0400","original":"5/13/2011","granularity":"day","time":"2011/05/13 00:00:00 -0400"},"checklists":1,"longitude":-80.6999016,"id":"adtlbsu4xa3f","location":"HWY 59 and HWY 46 Farms, Oxford"},"type":"Feature","geometry":{"type":"Point","coordinates":[-80.6999016,43.0234746]}},{"properties":{"latitude":43.1232385,"date":{"end_time":"2011/05/15 00:00:00 -0400","original":"5/14/2011","granularity":"day","time":"2011/05/14 00:00:00 -0400"},"checklists":1,"longitude":-80.3040261,"id":"adtlbsti9fh8","location":"Brant"},"type":"Feature","geometry":{"type":"Point","coordinates":[-80.3040261,43.1232385]}},{"properties":{"latitude":42.934802,"date":{"end_time":"2011/05/15 00:00:00 -0400","original":"5/14/2011","granularity":"day","time":"2011/05/14 00:00:00 -0400"},"checklists":1,"longitude":-79.8530851,"id":"adtlbsimh2in","location":"Haldimand"},"type":"Feature","geometry":{"type":"Point","coordinates":[-79.8530851,42.934802]}},{"properties":{"latitude":43.37048,"date":{"end_time":"2011/05/18 00:00:00 -0400","original":"5/17/2011","granularity":"day","time":"2011/05/17 00:00:00 -0400"},"checklists":1,"longitude":-87.92247,"id":"adtlbsfsr88d","location":"Ozaukee"},"type":"Feature","geometry":{"type":"Point","coordinates":[-87.92247,43.37048]}},{"properties":{"latitude":42.5779,"date":{"end_time":"2011/05/18 00:00:00 -0400","original":"5/17/2011","granularity":"day","time":"2011/05/17 00:00:00 -0400"},"checklists":1,"longitude":-88.04561,"id":"adtlbsg80k3s","location":"Kenosha"},"type":"Feature","geometry":{"type":"Point","coordinates":[-88.04561,42.5779]}},{"properties":{"latitude":41.47035,"date":{"end_time":"2011/05/18 00:00:00 -0400","original":"5/17/2011","granularity":"day","time":"2011/05/17 00:00:00 -0400"},"checklists":1,"longitude":-87.08462,"id":"adtlbstyc8pv","location":"Porter"},"type":"Feature","geometry":{"type":"Point","coordinates":[-87.08462,41.47035]}},{"properties":{"latitude":43.4936,"date":{"end_time":"2011/05/25 00:00:00 -0400","original":"5/24/2011","granularity":"day","time":"2011/05/24 00:00:00 -0400"},"checklists":1,"longitude":-87.7952,"id":"adtlbskz8p2k","location":"Harrington Beach SP"},"type":"Feature","geometry":{"type":"Point","coordinates":[-87.7952,43.4936]}},{"properties":{"latitude":43.8303383,"date":{"end_time":"2011/05/28 00:00:00 -0400","original":"5/27/2011","granularity":"day","time":"2011/05/27 00:00:00 -0400"},"checklists":1,"longitude":-88.0927331,"id":"adtlbspz6cyz","location":"Sheboygan Marsh SWA--general"},"type":"Feature","geometry":{"type":"Point","coordinates":[-88.0927331,43.8303383]}},{"properties":{"latitude":43.6237,"date":{"end_time":"2011/05/29 00:00:00 -0400","original":"5/28/2011","granularity":"day","time":"2011/05/28 00:00:00 -0400"},"checklists":1,"longitude":-88.67391,"id":"adtlbslb09dz","location":"Horicon NWR--Auto Tour and Trails"},"type":"Feature","geometry":{"type":"Point","coordinates":[-88.67391,43.6237]}},{"properties":{"latitude":43.53127,"date":{"end_time":"2011/05/29 00:00:00 -0400","original":"5/28/2011","granularity":"day","time":"2011/05/28 00:00:00 -0400"},"checklists":1,"longitude":-88.62425,"id":"adtlbso5uipw","location":"Horicon NWR--Dike Rd."},"type":"Feature","geometry":{"type":"Point","coordinates":[-88.62425,43.53127]}},{"properties":{"latitude":43.6332176,"date":{"end_time":"2011/05/29 00:00:00 -0400","original":"5/28/2011","granularity":"day","time":"2011/05/28 00:00:00 -0400"},"checklists":1,"longitude":-88.6409569,"id":"adtlbsmnp9om","location":"Horicon NWR--Hwy. 49 (Fond du Lac Co.)"},"type":"Feature","geometry":{"type":"Point","coordinates":[-88.6409569,43.6332176]}},{"properties":{"latitude":43.6096852,"date":{"end_time":"2011/05/29 00:00:00 -0400","original":"5/28/2011","granularity":"day","time":"2011/05/28 00:00:00 -0400"},"checklists":1,"longitude":-88.1856814,"id":"adtlbskhfr71","location":"Kettle Moraine SF--Fond du Lac Co."},"type":"Feature","geometry":{"type":"Point","coordinates":[-88.1856814,43.6096852]}},{"properties":{"latitude":43.65349,"date":{"end_time":"2011/05/29 00:00:00 -0400","original":"5/28/2011","granularity":"day","time":"2011/05/28 00:00:00 -0400"},"checklists":1,"longitude":-88.20971,"id":"adtlbsjmz95n","location":"Kettle Moraine SF--Kettle Moraine Lake"},"type":"Feature","geometry":{"type":"Point","coordinates":[-88.20971,43.65349]}},{"properties":{"latitude":44.0927942,"date":{"end_time":"2011/05/29 00:00:00 -0400","original":"5/28/2011","granularity":"day","time":"2011/05/28 00:00:00 -0400"},"checklists":1,"longitude":-87.6501703,"id":"adtlbssxurbr","location":"Manitowoc Lakefront"},"type":"Feature","geometry":{"type":"Point","coordinates":[-87.6501703,44.0927942]}},{"properties":{"latitude":43.5186491,"date":{"end_time":"2011/05/29 00:00:00 -0400","original":"5/28/2011","granularity":"day","time":"2011/05/28 00:00:00 -0400"},"checklists":1,"longitude":-88.5854244,"id":"adtlbse3hwuq","location":"Horicon Marsh--Northern Rd."},"type":"Feature","geometry":{"type":"Point","coordinates":[-88.5854244,43.5186491]}},{"properties":{"latitude":43.5679543,"date":{"end_time":"2011/05/29 00:00:00 -0400","original":"5/28/2011","granularity":"day","time":"2011/05/28 00:00:00 -0400"},"checklists":1,"longitude":-88.6109161,"id":"adtlbsr3f8cw","location":"Horicon NWR--Visitor Center"},"type":"Feature","geometry":{"type":"Point","coordinates":[-88.6109161,43.5679543]}},{"properties":{"latitude":44.0608809,"date":{"end_time":"2011/05/29 00:00:00 -0400","original":"5/28/2011","granularity":"day","time":"2011/05/28 00:00:00 -0400"},"checklists":1,"longitude":-87.6545691,"id":"adtlbsp0fxya","location":"Silver Creek Park"},"type":"Feature","geometry":{"type":"Point","coordinates":[-87.6545691,44.0608809]}},{"properties":{"latitude":43.9371649,"date":{"end_time":"2011/05/29 00:00:00 -0400","original":"5/28/2011","granularity":"day","time":"2011/05/28 00:00:00 -0400"},"checklists":1,"longitude":-87.7199497,"id":"adtlbsr2o0zy","location":"Fischer Creek Conservation Area"},"type":"Feature","geometry":{"type":"Point","coordinates":[-87.7199497,43.9371649]}},{"properties":{"latitude":43.6958,"date":{"end_time":"2011/05/29 00:00:00 -0400","original":"5/28/2011","granularity":"day","time":"2011/05/28 00:00:00 -0400"},"checklists":1,"longitude":-88.17035,"id":"adtlbsqgvafk","location":"Camp Long Lake"},"type":"Feature","geometry":{"type":"Point","coordinates":[-88.17035,43.6958]}},{"properties":{"latitude":43.6019001,"date":{"end_time":"2011/05/29 00:00:00 -0400","original":"5/28/2011","granularity":"day","time":"2011/05/28 00:00:00 -0400"},"checklists":1,"longitude":-88.6152077,"id":"adtlbseswlvi","location":"Horicon NWR--Bud Cook Trails"},"type":"Feature","geometry":{"type":"Point","coordinates":[-88.6152077,43.6019001]}},{"properties":{"latitude":43.8176073,"date":{"end_time":"2011/05/31 00:00:00 -0400","original":"5/30/2011","granularity":"day","time":"2011/05/30 00:00:00 -0400"},"checklists":1,"longitude":-87.8257897,"id":"adtlbso2ws54","location":"Howards Grove--Riverside Park"},"type":"Feature","geometry":{"type":"Point","coordinates":[-87.8257897,43.8176073]}},{"properties":{"latitude":43.7454445,"date":{"end_time":"2011/06/09 00:00:00 -0400","original":"6/8/2011","granularity":"day","time":"2011/06/08 00:00:00 -0400"},"checklists":1,"longitude":-87.7196476,"id":"adtlbstj7ml9","location":"Donohue Warehouse"},"type":"Feature","geometry":{"type":"Point","coordinates":[-87.7196476,43.7454445]}},{"properties":{"latitude":43.7377054,"date":{"end_time":"2011/06/10 00:00:00 -0400","original":"6/9/2011","granularity":"day","time":"2011/06/09 00:00:00 -0400"},"checklists":1,"longitude":-87.7740741,"id":"adtlbsr9sckk","location":"Sheboygan River Park"},"type":"Feature","geometry":{"type":"Point","coordinates":[-87.7740741,43.7377054]}},{"properties":{"latitude":43.0032657,"date":{"end_time":"2011/06/12 00:00:00 -0400","original":"6/11/2011","granularity":"day","time":"2011/06/11 00:00:00 -0400"},"checklists":1,"longitude":-87.88592,"id":"adtlbsloma6h","location":"Lake Express Ferry--Milwaukee Terminal"},"type":"Feature","geometry":{"type":"Point","coordinates":[-87.88592,43.0032657]}},{"properties":{"latitude":43.0206467,"date":{"end_time":"2011/06/12 00:00:00 -0400","original":"6/11/2011","granularity":"day","time":"2011/06/11 00:00:00 -0400"},"checklists":1,"longitude":-87.65094,"id":"adtlbsmmq2uy","location":"Lake Express Ferry--Milwaukee 20 min."},"type":"Feature","geometry":{"type":"Point","coordinates":[-87.65094,43.0206467]}},{"properties":{"latitude":43.2124285,"date":{"end_time":"2011/06/12 00:00:00 -0400","original":"6/11/2011","granularity":"day","time":"2011/06/11 00:00:00 -0400"},"checklists":1,"longitude":-86.4093132,"id":"adtlbsjypmou","location":"Lake Express Ferry--Muskegon 5 min."},"type":"Feature","geometry":{"type":"Point","coordinates":[-86.4093132,43.2124285]}},{"properties":{"latitude":43.173417,"date":{"end_time":"2011/06/12 00:00:00 -0400","original":"6/11/2011","granularity":"day","time":"2011/06/11 00:00:00 -0400"},"checklists":1,"longitude":-85.3921795,"id":"adtlbsq5whkk","location":"Wabasis Ave. and M-57"},"type":"Feature","geometry":{"type":"Point","coordinates":[-85.3921795,43.173417]}},{"properties":{"latitude":43.2138432,"date":{"end_time":"2011/06/19 00:00:00 -0400","original":"6/18/2011","granularity":"day","time":"2011/06/18 00:00:00 -0400"},"checklists":1,"longitude":-85.3457623,"id":"adtlbsf10tu9","location":"White Pine Park"},"type":"Feature","geometry":{"type":"Point","coordinates":[-85.3457623,43.2138432]}},{"properties":{"latitude":42.8544069,"date":{"end_time":"2011/06/21 00:00:00 -0400","original":"6/20/2011","granularity":"day","time":"2011/06/20 00:00:00 -0400"},"checklists":1,"longitude":-85.5605135,"id":"adtlbslp7x46","location":"Steelcase Headquarters"},"type":"Feature","geometry":{"type":"Point","coordinates":[-85.5605135,42.8544069]}},{"properties":{"latitude":42.905111,"date":{"end_time":"2011/06/22 00:00:00 -0400","original":"6/21/2011","granularity":"day","time":"2011/06/21 00:00:00 -0400"},"checklists":1,"longitude":-85.5420345,"id":"adtlbsljqkd2","location":"Wetland West of Hotel Ave"},"type":"Feature","geometry":{"type":"Point","coordinates":[-85.5420345,42.905111]}},{"properties":{"latitude":42.9719992,"date":{"end_time":"2011/06/24 00:00:00 -0400","original":"6/23/2011","granularity":"day","time":"2011/06/23 00:00:00 -0400"},"checklists":1,"longitude":-85.3154898,"id":"adtlbsho92is","location":"Lowell SGA (Kent Co.)"},"type":"Feature","geometry":{"type":"Point","coordinates":[-85.3154898,42.9719992]}},{"properties":{"latitude":42.8040495,"date":{"end_time":"2011/06/26 00:00:00 -0400","original":"6/25/2011","granularity":"day","time":"2011/06/25 00:00:00 -0400"},"checklists":1,"longitude":-84.3884697,"id":"adtlbshwzhmd","location":"Rose Lake State Wildlife Research Area"},"type":"Feature","geometry":{"type":"Point","coordinates":[-84.3884697,42.8040495]}},{"properties":{"latitude":42.8120464,"date":{"end_time":"2011/06/30 00:00:00 -0400","original":"6/29/2011","granularity":"day","time":"2011/06/29 00:00:00 -0400"},"checklists":1,"longitude":-85.7228193,"id":"adtlbsi0ap4m","location":"Byron Township"},"type":"Feature","geometry":{"type":"Point","coordinates":[-85.7228193,42.8120464]}},{"properties":{"latitude":41.67285,"date":{"end_time":"2011/07/03 00:00:00 -0400","original":"7/2/2011","granularity":"day","time":"2011/07/02 00:00:00 -0400"},"checklists":1,"longitude":-85.58029,"id":"adtlbspzip8b","location":"Shipshewana"},"type":"Feature","geometry":{"type":"Point","coordinates":[-85.58029,41.67285]}},{"properties":{"latitude":41.91877,"date":{"end_time":"2011/07/03 00:00:00 -0400","original":"7/2/2011","granularity":"day","time":"2011/07/02 00:00:00 -0400"},"checklists":1,"longitude":-85.54822,"id":"adtlbslfylxm","location":"St. Joseph"},"type":"Feature","geometry":{"type":"Point","coordinates":[-85.54822,41.91877]}},{"properties":{"latitude":42.7729868,"date":{"end_time":"2011/07/05 00:00:00 -0400","original":"7/4/2011","granularity":"day","time":"2011/07/04 00:00:00 -0400"},"checklists":1,"longitude":-85.4329491,"id":"adtlbsprqa2l","location":"Coldwater River by Kayak (Whitneyville Ave. to Morse Lake Ave.)"},"type":"Feature","geometry":{"type":"Point","coordinates":[-85.4329491,42.7729868]}},{"properties":{"latitude":42.7662035,"date":{"end_time":"2011/07/06 00:00:00 -0400","original":"7/5/2011","granularity":"day","time":"2011/07/05 00:00:00 -0400"},"checklists":1,"longitude":-86.1996907,"id":"adtlbsomga81","location":"Sanctuary Woods"},"type":"Feature","geometry":{"type":"Point","coordinates":[-86.1996907,42.7662035]}},{"properties":{"latitude":42.7691319,"date":{"end_time":"2011/07/06 00:00:00 -0400","original":"7/5/2011","granularity":"day","time":"2011/07/05 00:00:00 -0400"},"checklists":1,"longitude":-86.1370182,"id":"adtlbsh51abe","location":"Graafschap Cemetery (Ottawa Co.)"},"type":"Feature","geometry":{"type":"Point","coordinates":[-86.1370182,42.7691319]}},{"properties":{"latitude":42.9689886,"date":{"end_time":"2011/07/12 00:00:00 -0400","original":"7/11/2011","granularity":"day","time":"2011/07/11 00:00:00 -0400"},"checklists":1,"longitude":-85.666243,"id":"adtlbsild5ed","location":"Medical Mile"},"type":"Feature","geometry":{"type":"Point","coordinates":[-85.666243,42.9689886]}},{"properties":{"latitude":42.6420724,"date":{"end_time":"2011/07/12 00:00:00 -0400","original":"7/11/2011","granularity":"day","time":"2011/07/11 00:00:00 -0400"},"checklists":1,"longitude":-86.2109613,"id":"adtlbsjjqgk8","location":"Home"},"type":"Feature","geometry":{"type":"Point","coordinates":[-86.2109613,42.6420724]}},{"properties":{"latitude":42.6411253,"date":{"end_time":"2011/07/12 00:00:00 -0400","original":"7/11/2011","granularity":"day","time":"2011/07/11 00:00:00 -0400"},"checklists":1,"longitude":-86.2144482,"id":"adtlbsga3hcv","location":"Old MiRo Golf Couse"},"type":"Feature","geometry":{"type":"Point","coordinates":[-86.2144482,42.6411253]}},{"properties":{"latitude":42.6713295,"date":{"end_time":"2011/07/14 00:00:00 -0400","original":"7/13/2011","granularity":"day","time":"2011/07/13 00:00:00 -0400"},"checklists":1,"longitude":-86.2098885,"id":"adtlbsrdp4ws","location":"Saugatuck Harbor Natural Area"},"type":"Feature","geometry":{"type":"Point","coordinates":[-86.2098885,42.6713295]}},{"properties":{"latitude":42.8530174,"date":{"end_time":"2011/07/20 00:00:00 -0400","original":"7/19/2011","granularity":"day","time":"2011/07/19 00:00:00 -0400"},"checklists":1,"longitude":-85.5427508,"id":"adtlbsf2otca","location":"M-6 and Broadmoor"},"type":"Feature","geometry":{"type":"Point","coordinates":[-85.5427508,42.8530174]}},{"properties":{"latitude":42.78923,"date":{"end_time":"2011/07/20 00:00:00 -0400","original":"7/19/2011","granularity":"day","time":"2011/07/19 00:00:00 -0400"},"checklists":1,"longitude":-85.51672,"id":"adtlbsil3wwi","location":"Caledonia"},"type":"Feature","geometry":{"type":"Point","coordinates":[-85.51672,42.78923]}},{"properties":{"latitude":43.1834627,"date":{"end_time":"2011/07/27 00:00:00 -0400","original":"7/26/2011","granularity":"day","time":"2011/07/26 00:00:00 -0400"},"checklists":1,"longitude":-85.3858395,"id":"adtlbsfgjg7u","location":"Sandy Bottoms"},"type":"Feature","geometry":{"type":"Point","coordinates":[-85.3858395,43.1834627]}},{"properties":{"latitude":42.9972987,"date":{"end_time":"2011/07/28 00:00:00 -0400","original":"7/27/2011","granularity":"day","time":"2011/07/27 00:00:00 -0400"},"checklists":1,"longitude":-82.4228668,"id":"adtlbsgqimbw","location":"Blue Water Bridge"},"type":"Feature","geometry":{"type":"Point","coordinates":[-82.4228668,42.9972987]}},{"properties":{"latitude":43.0763233,"date":{"end_time":"2011/07/29 00:00:00 -0400","original":"7/28/2011","granularity":"day","time":"2011/07/28 00:00:00 -0400"},"checklists":1,"longitude":-80.6088996,"id":"adtlbsk9s75o","location":"Overbeek's"},"type":"Feature","geometry":{"type":"Point","coordinates":[-80.6088996,43.0763233]}},{"properties":{"latitude":42.8794578,"date":{"end_time":"2011/07/30 00:00:00 -0400","original":"7/29/2011","granularity":"day","time":"2011/07/29 00:00:00 -0400"},"checklists":1,"longitude":-81.0228503,"id":"adtlbsrhsag9","location":"Maat Farm"},"type":"Feature","geometry":{"type":"Point","coordinates":[-81.0228503,42.8794578]}},{"properties":{"latitude":44.7359039,"date":{"end_time":"2011/08/04 00:00:00 -0400","original":"8/3/2011","granularity":"day","time":"2011/08/03 00:00:00 -0400"},"checklists":1,"longitude":-84.6566105,"id":"adtlbsj87fxs","location":"Hartwick Pines SP--Hartwick Lake"},"type":"Feature","geometry":{"type":"Point","coordinates":[-84.6566105,44.7359039]}},{"properties":{"latitude":44.7431365,"date":{"end_time":"2011/08/04 00:00:00 -0400","original":"8/3/2011","granularity":"day","time":"2011/08/03 00:00:00 -0400"},"checklists":1,"longitude":-84.6475554,"id":"adtlbsqdg8p1","location":"Hartwick Pines SP--Foot Trail"},"type":"Feature","geometry":{"type":"Point","coordinates":[-84.6475554,44.7431365]}},{"properties":{"latitude":44.6861073,"date":{"end_time":"2011/08/05 00:00:00 -0400","original":"8/4/2011","granularity":"day","time":"2011/08/04 00:00:00 -0400"},"checklists":1,"longitude":-84.5762361,"id":"adtlbssjd540","location":"Stephan Bridge Rd. and N. Down River Rd."},"type":"Feature","geometry":{"type":"Point","coordinates":[-84.5762361,44.6861073]}},{"properties":{"latitude":44.7308045,"date":{"end_time":"2011/08/05 00:00:00 -0400","original":"8/4/2011","granularity":"day","time":"2011/08/04 00:00:00 -0400"},"checklists":1,"longitude":-84.6838188,"id":"adtlbsqawzj7","location":"Hartwick Pines SP--Bright and Glory Lakes"},"type":"Feature","geometry":{"type":"Point","coordinates":[-84.6838188,44.7308045]}},{"properties":{"latitude":44.7478528,"date":{"end_time":"2011/08/05 00:00:00 -0400","original":"8/4/2011","granularity":"day","time":"2011/08/04 00:00:00 -0400"},"checklists":1,"longitude":-84.6385002,"id":"adtlbso74ppo","location":"Hartwick Pines SP--Au Sable River Trail"},"type":"Feature","geometry":{"type":"Point","coordinates":[-84.6385002,44.7478528]}},{"properties":{"latitude":52.1409789,"date":{"end_time":"2011/08/12 00:00:00 -0400","original":"8/11/2011","granularity":"day","time":"2011/08/11 00:00:00 -0400"},"checklists":1,"longitude":4.6480397,"id":"adtlbslq39je","location":"Avifauna"},"type":"Feature","geometry":{"type":"Point","coordinates":[4.6480397,52.1409789]}},{"properties":{"latitude":52.5932464,"date":{"end_time":"2011/08/13 00:00:00 -0400","original":"8/12/2011","granularity":"day","time":"2011/08/12 00:00:00 -0400"},"checklists":1,"longitude":6.0953522,"id":"adtlbskmezf6","location":"Hasselt"},"type":"Feature","geometry":{"type":"Point","coordinates":[6.0953522,52.5932464]}},{"properties":{"latitude":52.236736,"date":{"end_time":"2011/08/14 00:00:00 -0400","original":"8/13/2011","granularity":"day","time":"2011/08/13 00:00:00 -0400"},"checklists":1,"longitude":6.0484886,"id":"adtlbsn73lbi","location":"Teuge"},"type":"Feature","geometry":{"type":"Point","coordinates":[6.0484886,52.236736]}},{"properties":{"latitude":50.8612274,"date":{"end_time":"2011/08/18 00:00:00 -0400","original":"8/17/2011","granularity":"day","time":"2011/08/17 00:00:00 -0400"},"checklists":1,"longitude":5.8296204,"id":"adtlbso3g2ke","location":"Mt. Cauberg and Valkenburg"},"type":"Feature","geometry":{"type":"Point","coordinates":[5.8296204,50.8612274]}},{"properties":{"latitude":51.5599796,"date":{"end_time":"2011/08/18 00:00:00 -0400","original":"8/17/2011","granularity":"day","time":"2011/08/17 00:00:00 -0400"},"checklists":1,"longitude":5.198608,"id":"adtlbsrtikjh","location":"Noord-Brabant"},"type":"Feature","geometry":{"type":"Point","coordinates":[5.198608,51.5599796]}},{"properties":{"latitude":53.0763932,"date":{"end_time":"2011/08/20 00:00:00 -0400","original":"8/19/2011","granularity":"day","time":"2011/08/19 00:00:00 -0400"},"checklists":1,"longitude":4.738884,"id":"adtlbsepuhni","location":"National Park Texel--Duinen van Texel (Texel Dunes)"},"type":"Feature","geometry":{"type":"Point","coordinates":[4.738884,53.0763932]}},{"properties":{"latitude":53.1821215,"date":{"end_time":"2011/08/20 00:00:00 -0400","original":"8/19/2011","granularity":"day","time":"2011/08/19 00:00:00 -0400"},"checklists":1,"longitude":4.8551846,"id":"adtlbsqbeegd","location":"Texel--Vuurtoren Eierland (Lighthouse)"},"type":"Feature","geometry":{"type":"Point","coordinates":[4.8551846,53.1821215]}},{"properties":{"latitude":53.0712572,"date":{"end_time":"2011/08/20 00:00:00 -0400","original":"8/19/2011","granularity":"day","time":"2011/08/19 00:00:00 -0400"},"checklists":1,"longitude":4.7927856,"id":"adtlbspyj3i7","location":"Nationaal Park Texel"},"type":"Feature","geometry":{"type":"Point","coordinates":[4.7927856,53.0712572]}},{"properties":{"latitude":42.8527185,"date":{"end_time":"2011/09/06 00:00:00 -0400","original":"9/5/2011","granularity":"day","time":"2011/09/05 00:00:00 -0400"},"checklists":1,"longitude":-85.7493696,"id":"adtlbssbn6tv","location":"M-6 Swamps and Marsh between Byron Center and Wilson Ave."},"type":"Feature","geometry":{"type":"Point","coordinates":[-85.7493696,42.8527185]}},{"properties":{"latitude":42.7829449,"date":{"end_time":"2011/09/09 00:00:00 -0400","original":"9/8/2011","granularity":"day","time":"2011/09/08 00:00:00 -0400"},"checklists":1,"longitude":-85.9402328,"id":"adtlbsplyymg","location":"Drenthe"},"type":"Feature","geometry":{"type":"Point","coordinates":[-85.9402328,42.7829449]}},{"properties":{"latitude":42.73327,"date":{"end_time":"2011/09/10 00:00:00 -0400","original":"9/9/2011","granularity":"day","time":"2011/09/09 00:00:00 -0400"},"checklists":1,"longitude":-86.1981297,"id":"adtlbspuc61n","location":"Gilligan Lake"},"type":"Feature","geometry":{"type":"Point","coordinates":[-86.1981297,42.73327]}},{"properties":{"latitude":42.7240648,"date":{"end_time":"2011/09/10 00:00:00 -0400","original":"9/9/2011","granularity":"day","time":"2011/09/09 00:00:00 -0400"},"checklists":1,"longitude":-86.2057686,"id":"adtlbsti4zs9","location":"Laketown Township Park"},"type":"Feature","geometry":{"type":"Point","coordinates":[-86.2057686,42.7240648]}},{"properties":{"latitude":42.7239,"date":{"end_time":"2011/09/10 00:00:00 -0400","original":"9/9/2011","granularity":"day","time":"2011/09/09 00:00:00 -0400"},"checklists":1,"longitude":-86.1772,"id":"adtlbstevwxt","location":"Huyser Farm Nature Preserve"},"type":"Feature","geometry":{"type":"Point","coordinates":[-86.1772,42.7239]}},{"properties":{"latitude":43.0663483,"date":{"end_time":"2011/09/13 00:00:00 -0400","original":"9/12/2011","granularity":"day","time":"2011/09/12 00:00:00 -0400"},"checklists":1,"longitude":-86.2434483,"id":"adtlbse6wqol","location":"Kitchel-Lindquist Dunes Preserve"},"type":"Feature","geometry":{"type":"Point","coordinates":[-86.2434483,43.0663483]}},{"properties":{"latitude":43.262427,"date":{"end_time":"2011/09/25 00:00:00 -0400","original":"9/24/2011","granularity":"day","time":"2011/09/24 00:00:00 -0400"},"checklists":1,"longitude":-85.8138971,"id":"adtlbsguf7pr","location":"M-37 and Mud Lake"},"type":"Feature","geometry":{"type":"Point","coordinates":[-85.8138971,43.262427]}},{"properties":{"latitude":42.2945673,"date":{"end_time":"2011/10/04 00:00:00 -0400","original":"10/3/2011","granularity":"day","time":"2011/10/03 00:00:00 -0400"},"checklists":1,"longitude":-83.7139635,"id":"adtlbsltiwnz","location":"U of M Campus"},"type":"Feature","geometry":{"type":"Point","coordinates":[-83.7139635,42.2945673]}},{"properties":{"latitude":42.6883493,"date":{"end_time":"2011/10/07 00:00:00 -0400","original":"10/6/2011","granularity":"day","time":"2011/10/06 00:00:00 -0400"},"checklists":1,"longitude":-85.9667301,"id":"adtlbsiri8ly","location":"NE Hamilton Countryside"},"type":"Feature","geometry":{"type":"Point","coordinates":[-85.9667301,42.6883493]}},{"properties":{"latitude":42.340086,"date":{"end_time":"2011/10/22 00:00:00 -0400","original":"10/21/2011","granularity":"day","time":"2011/10/21 00:00:00 -0400"},"checklists":1,"longitude":-82.9775444,"id":"adtlbsts2mww","location":"Belle Isle"},"type":"Feature","geometry":{"type":"Point","coordinates":[-82.9775444,42.340086]}},{"properties":{"latitude":42.1958331,"date":{"end_time":"2011/10/30 00:00:00 -0400","original":"10/29/2011","granularity":"day","time":"2011/10/29 00:00:00 -0400"},"checklists":1,"longitude":-85.730052,"id":"adtlbsm2v2b7","location":"Kalamazoo Adventure Center"},"type":"Feature","geometry":{"type":"Point","coordinates":[-85.730052,42.1958331]}},{"properties":{"latitude":43.2763888,"date":{"end_time":"2011/10/30 00:00:00 -0400","original":"10/29/2011","granularity":"day","time":"2011/10/29 00:00:00 -0400"},"checklists":1,"longitude":-85.3570533,"id":"adtlbsfq85t0","location":"Maston Lake"},"type":"Feature","geometry":{"type":"Point","coordinates":[-85.3570533,43.2763888]}},{"properties":{"latitude":42.6153912,"date":{"end_time":"2011/10/30 00:00:00 -0400","original":"10/29/2011","granularity":"day","time":"2011/10/29 00:00:00 -0400"},"checklists":1,"longitude":-85.4828167,"id":"adtlbsjliwjr","location":"Yankee Springs SRA"},"type":"Feature","geometry":{"type":"Point","coordinates":[-85.4828167,42.6153912]}},{"properties":{"latitude":46.7705085,"date":{"end_time":"2011/11/06 00:00:00 -0400","original":"11/5/2011","granularity":"day","time":"2011/11/05 00:00:00 -0400"},"checklists":1,"longitude":-84.9571252,"id":"adtlbsjrxojn","location":"Whitefish Point Bird Observatory"},"type":"Feature","geometry":{"type":"Point","coordinates":[-84.9571252,46.7705085]}},{"properties":{"latitude":45.7780596,"date":{"end_time":"2011/11/06 00:00:00 -0400","original":"11/5/2011","granularity":"day","time":"2011/11/05 00:00:00 -0400"},"checklists":1,"longitude":-84.7821808,"id":"adtlbsqm5uk5","location":"The Headlands Park"},"type":"Feature","geometry":{"type":"Point","coordinates":[-84.7821808,45.7780596]}},{"properties":{"latitude":45.8823548,"date":{"end_time":"2011/11/06 00:00:00 -0400","original":"11/5/2011","granularity":"day","time":"2011/11/05 00:00:00 -0400"},"checklists":1,"longitude":-84.7444296,"id":"adtlbsppwiep","location":"Mackinac Chain Lake I-75 Scenic Lookout"},"type":"Feature","geometry":{"type":"Point","coordinates":[-84.7444296,45.8823548]}},{"properties":{"latitude":46.3722224,"date":{"end_time":"2011/11/06 00:00:00 -0400","original":"11/5/2011","granularity":"day","time":"2011/11/05 00:00:00 -0400"},"checklists":1,"longitude":-85.5098122,"id":"adtlbskxtqov","location":"Tahquamenon River - East Branch at M-123"},"type":"Feature","geometry":{"type":"Point","coordinates":[-85.5098122,46.3722224]}},{"properties":{"latitude":42.4651473,"date":{"end_time":"2011/11/08 00:00:00 -0500","original":"11/7/2011","granularity":"day","time":"2011/11/07 00:00:00 -0500"},"checklists":1,"longitude":-85.5337286,"id":"adtlbsikoszj","location":"Plainwell Marsh"},"type":"Feature","geometry":{"type":"Point","coordinates":[-85.5337286,42.4651473]}},{"properties":{"latitude":41.8007831,"date":{"end_time":"2011/11/08 00:00:00 -0500","original":"11/7/2011","granularity":"day","time":"2011/11/07 00:00:00 -0500"},"checklists":1,"longitude":-86.7489052,"id":"adtlbsufvm8n","location":"New Buffalo"},"type":"Feature","geometry":{"type":"Point","coordinates":[-86.7489052,41.8007831]}},{"properties":{"latitude":42.884719,"date":{"end_time":"2011/11/30 00:00:00 -0500","original":"11/29/2011","granularity":"day","time":"2011/11/29 00:00:00 -0500"},"checklists":1,"longitude":-85.5085316,"id":"adtlbsmgdpgj","location":"Gerald R. Ford Airport (FedEx Terminal)"},"type":"Feature","geometry":{"type":"Point","coordinates":[-85.5085316,42.884719]}},{"properties":{"latitude":42.6879142,"date":{"end_time":"2011/12/03 00:00:00 -0500","original":"12/2/2011","granularity":"day","time":"2011/12/02 00:00:00 -0500"},"checklists":1,"longitude":-85.9179254,"id":"adtlbsrapcdh","location":"Allegan SGA-36th and Silver Creek"},"type":"Feature","geometry":{"type":"Point","coordinates":[-85.9179254,42.6879142]}},{"properties":{"latitude":42.6373786,"date":{"end_time":"2011/12/03 00:00:00 -0500","original":"12/2/2011","granularity":"day","time":"2011/12/02 00:00:00 -0500"},"checklists":1,"longitude":-85.8987398,"id":"adtlbsjmtjk7","location":"Allegan SGA--130th and 36th"},"type":"Feature","geometry":{"type":"Point","coordinates":[-85.8987398,42.6373786]}},{"properties":{"latitude":42.6224968,"date":{"end_time":"2011/12/03 00:00:00 -0500","original":"12/2/2011","granularity":"day","time":"2011/12/02 00:00:00 -0500"},"checklists":1,"longitude":-85.9186527,"id":"adtlbsqy1904","location":"Allegan SGA--128th and 36th"},"type":"Feature","geometry":{"type":"Point","coordinates":[-85.9186527,42.6224968]}},{"properties":{"latitude":43.2679797,"date":{"end_time":"2011/12/04 00:00:00 -0500","original":"12/3/2011","granularity":"day","time":"2011/12/03 00:00:00 -0500"},"checklists":1,"longitude":-85.3228122,"id":"adtlbsmhnhny","location":"Bass Lake (Kent Co.)"},"type":"Feature","geometry":{"type":"Point","coordinates":[-85.3228122,43.2679797]}},{"properties":{"latitude":43.2933557,"date":{"end_time":"2011/12/04 00:00:00 -0500","original":"12/3/2011","granularity":"day","time":"2011/12/03 00:00:00 -0500"},"checklists":1,"longitude":-85.5303615,"id":"adtlbsl568ss","location":"Sand Lake (Kent Co.)"},"type":"Feature","geometry":{"type":"Point","coordinates":[-85.5303615,43.2933557]}},{"properties":{"latitude":43.3305965,"date":{"end_time":"2011/12/04 00:00:00 -0500","original":"12/3/2011","granularity":"day","time":"2011/12/03 00:00:00 -0500"},"checklists":1,"longitude":-85.5379181,"id":"adtlbsollxr7","location":"Whitefish Lake"},"type":"Feature","geometry":{"type":"Point","coordinates":[-85.5379181,43.3305965]}},{"properties":{"latitude":43.2966339,"date":{"end_time":"2011/12/04 00:00:00 -0500","original":"12/3/2011","granularity":"day","time":"2011/12/03 00:00:00 -0500"},"checklists":1,"longitude":-85.5276695,"id":"adtlbsgks67f","location":"Sand Lake (Montcalm Co.)"},"type":"Feature","geometry":{"type":"Point","coordinates":[-85.5276695,43.2966339]}},{"properties":{"latitude":42.816905,"date":{"end_time":"2011/12/13 00:00:00 -0500","original":"12/12/2011","granularity":"day","time":"2011/12/12 00:00:00 -0500"},"checklists":1,"longitude":-85.6568384,"id":"adtlbsic0rfj","location":"Brewer Park"},"type":"Feature","geometry":{"type":"Point","coordinates":[-85.6568384,42.816905]}},{"properties":{"latitude":42.8065237,"date":{"end_time":"2011/12/13 00:00:00 -0500","original":"12/12/2011","granularity":"day","time":"2011/12/12 00:00:00 -0500"},"checklists":1,"longitude":-85.6278652,"id":"adtlbsj9r9ch","location":"Prairie Wolf Park"},"type":"Feature","geometry":{"type":"Point","coordinates":[-85.6278652,42.8065237]}},{"properties":{"latitude":42.7821824,"date":{"end_time":"2011/12/13 00:00:00 -0500","original":"12/12/2011","granularity":"day","time":"2011/12/12 00:00:00 -0500"},"checklists":1,"longitude":-85.887435,"id":"adtlbsqws6tz","location":"Adams St. east of Autumn Hills"},"type":"Feature","geometry":{"type":"Point","coordinates":[-85.887435,42.7821824]}},{"properties":{"latitude":42.7322227,"date":{"end_time":"2011/12/15 00:00:00 -0500","original":"12/14/2011","granularity":"day","time":"2011/12/14 00:00:00 -0500"},"checklists":1,"longitude":-85.9988431,"id":"adtlbsr7i60j","location":"142nd and 46th"},"type":"Feature","geometry":{"type":"Point","coordinates":[-85.9988431,42.7322227]}},{"properties":{"latitude":43.9008611,"date":{"end_time":"2011/12/17 00:00:00 -0500","original":"12/16/2011","granularity":"day","time":"2011/12/16 00:00:00 -0500"},"checklists":1,"longitude":-83.9520044,"id":"adtlbsg8nvwk","location":"Republic Landfill (restricted access)"},"type":"Feature","geometry":{"type":"Point","coordinates":[-83.9520044,43.9008611]}},{"properties":{"latitude":43.0128477,"date":{"end_time":"2011/12/17 00:00:00 -0500","original":"12/16/2011","granularity":"day","time":"2011/12/16 00:00:00 -0500"},"checklists":1,"longitude":-83.5547165,"id":"adtlbsrgu607","location":"Meijer Gas Station on I-69/Irish Rd"},"type":"Feature","geometry":{"type":"Point","coordinates":[-83.5547165,43.0128477]}},{"properties":{"latitude":41.6741,"date":{"end_time":"2011/12/25 00:00:00 -0500","original":"12/24/2011","granularity":"day","time":"2011/12/24 00:00:00 -0500"},"checklists":1,"longitude":-87.5254,"id":"adtlbshgjsyk","location":"Wolf Lake Conservation Area (Cook Co.)"},"type":"Feature","geometry":{"type":"Point","coordinates":[-87.5254,41.6741]}},{"properties":{"latitude":42.9799116,"date":{"end_time":"2012/01/01 00:00:00 -0500","original":"12/31/2011","granularity":"day","time":"2011/12/31 00:00:00 -0500"},"checklists":1,"longitude":-85.4657364,"id":"adtlbse8f8f7","location":"Seidman Park"},"type":"Feature","geometry":{"type":"Point","coordinates":[-85.4657364,42.9799116]}},{"properties":{"latitude":43.1020025,"date":{"end_time":"2012/01/07 00:00:00 -0500","original":"1/6/2012","granularity":"day","time":"2012/01/06 00:00:00 -0500"},"checklists":1,"longitude":-85.371832,"id":"adtlbssc02nj","location":"Big Pine Island Lake--Dream Isle Boat Launch"},"type":"Feature","geometry":{"type":"Point","coordinates":[-85.371832,43.1020025]}},{"properties":{"latitude":43.0966934,"date":{"end_time":"2012/01/07 00:00:00 -0500","original":"1/6/2012","granularity":"day","time":"2012/01/06 00:00:00 -0500"},"checklists":1,"longitude":-85.3626461,"id":"adtlbsgx8sgw","location":"Big Pine Island Lake--Woodland Park Access"},"type":"Feature","geometry":{"type":"Point","coordinates":[-85.3626461,43.0966934]}},{"properties":{"latitude":43.0657221,"date":{"end_time":"2012/01/08 00:00:00 -0500","original":"1/7/2012","granularity":"day","time":"2012/01/07 00:00:00 -0500"},"checklists":1,"longitude":-85.3620456,"id":"adtlbsov8uyy","location":"Scally Lake"},"type":"Feature","geometry":{"type":"Point","coordinates":[-85.3620456,43.0657221]}},{"properties":{"latitude":43.2054886,"date":{"end_time":"2012/01/10 00:00:00 -0500","original":"1/9/2012","granularity":"day","time":"2012/01/09 00:00:00 -0500"},"checklists":1,"longitude":-86.320771,"id":"adtlbsjhlde2","location":"Norman F. Kruse Park"},"type":"Feature","geometry":{"type":"Point","coordinates":[-86.320771,43.2054886]}},{"properties":{"latitude":43.1121683,"date":{"end_time":"2012/01/10 00:00:00 -0500","original":"1/9/2012","granularity":"day","time":"2012/01/09 00:00:00 -0500"},"checklists":1,"longitude":-86.2633095,"id":"adtlbsqzkxky","location":"P. J. Hoffmaster SP--South (Ottawa Co.)"},"type":"Feature","geometry":{"type":"Point","coordinates":[-86.2633095,43.1121683]}},{"properties":{"latitude":42.9014959,"date":{"end_time":"2012/01/10 00:00:00 -0500","original":"1/9/2012","granularity":"day","time":"2012/01/09 00:00:00 -0500"},"checklists":1,"longitude":-86.21521,"id":"adtlbsm2f8xk","location":"Port Sheldon"},"type":"Feature","geometry":{"type":"Point","coordinates":[-86.21521,42.9014959]}},{"properties":{"latitude":43.0208391,"date":{"end_time":"2012/01/10 00:00:00 -0500","original":"1/9/2012","granularity":"day","time":"2012/01/09 00:00:00 -0500"},"checklists":1,"longitude":-86.2273121,"id":"adtlbsqlshzn","location":"Rosy Mound Natural Area"},"type":"Feature","geometry":{"type":"Point","coordinates":[-86.2273121,43.0208391]}},{"properties":{"latitude":42.645387,"date":{"end_time":"2012/02/04 00:00:00 -0500","original":"2/3/2012","granularity":"day","time":"2012/02/03 00:00:00 -0500"},"checklists":1,"longitude":-86.2260246,"id":"adtlbstqs7sh","location":"Douglas Beach Park"},"type":"Feature","geometry":{"type":"Point","coordinates":[-86.2260246,42.645387]}},{"properties":{"latitude":42.652,"date":{"end_time":"2012/02/04 00:00:00 -0500","original":"2/3/2012","granularity":"day","time":"2012/02/03 00:00:00 -0500"},"checklists":1,"longitude":-86.2044,"id":"adtlbsqjeno9","location":"Kalamazoo Lake"},"type":"Feature","geometry":{"type":"Point","coordinates":[-86.2044,42.652]}},{"properties":{"latitude":42.6836669,"date":{"end_time":"2012/02/04 00:00:00 -0500","original":"2/3/2012","granularity":"day","time":"2012/02/03 00:00:00 -0500"},"checklists":1,"longitude":-86.0928948,"id":"adtlbsejik0f","location":"138th and Lincoln Ave."},"type":"Feature","geometry":{"type":"Point","coordinates":[-86.0928948,42.6836669]}},{"properties":{"latitude":42.93528,"date":{"end_time":"2012/02/07 00:00:00 -0500","original":"2/6/2012","granularity":"day","time":"2012/02/06 00:00:00 -0500"},"checklists":1,"longitude":-86.08955,"id":"adtlbsqoil4g","location":"Pigeon Creek County Park"},"type":"Feature","geometry":{"type":"Point","coordinates":[-86.08955,42.93528]}},{"properties":{"latitude":42.7302748,"date":{"end_time":"2012/02/23 00:00:00 -0500","original":"2/22/2012","granularity":"day","time":"2012/02/22 00:00:00 -0500"},"checklists":1,"longitude":-86.0797209,"id":"adtlbsstkh0i","location":"Cottonwood Park"},"type":"Feature","geometry":{"type":"Point","coordinates":[-86.0797209,42.7302748]}},{"properties":{"latitude":42.8268424,"date":{"end_time":"2012/02/24 00:00:00 -0500","original":"2/23/2012","granularity":"day","time":"2012/02/23 00:00:00 -0500"},"checklists":1,"longitude":-86.1557408,"id":"adtlbsu8n7zp","location":"Great Lakes Elementary School"},"type":"Feature","geometry":{"type":"Point","coordinates":[-86.1557408,42.8268424]}},{"properties":{"latitude":42.8465234,"date":{"end_time":"2012/02/26 00:00:00 -0500","original":"2/25/2012","granularity":"day","time":"2012/02/25 00:00:00 -0500"},"checklists":1,"longitude":-85.7856106,"id":"adtlbsiw4ltw","location":"M-6 (Byron Township)"},"type":"Feature","geometry":{"type":"Point","coordinates":[-85.7856106,42.8465234]}},{"properties":{"latitude":42.7658126,"date":{"end_time":"2012/03/04 00:00:00 -0500","original":"3/3/2012","granularity":"day","time":"2012/03/03 00:00:00 -0500"},"checklists":1,"longitude":-85.7250854,"id":"adtlbse3yj73","location":"Ottagan Fields West of 18th St."},"type":"Feature","geometry":{"type":"Point","coordinates":[-85.7250854,42.7658126]}},{"properties":{"latitude":42.7677422,"date":{"end_time":"2012/03/04 00:00:00 -0500","original":"3/3/2012","granularity":"day","time":"2012/03/03 00:00:00 -0500"},"checklists":1,"longitude":-85.861446,"id":"adtlbsgbkbop","location":"Ottawa-Allegan County Border on 32nd"},"type":"Feature","geometry":{"type":"Point","coordinates":[-85.861446,42.7677422]}},{"properties":{"latitude":42.7674722,"date":{"end_time":"2012/03/04 00:00:00 -0500","original":"3/3/2012","granularity":"day","time":"2012/03/03 00:00:00 -0500"},"checklists":1,"longitude":-85.8612158,"id":"adtlbsqnney3","location":"Allegan-Ottawa County Border on 32nd"},"type":"Feature","geometry":{"type":"Point","coordinates":[-85.8612158,42.7674722]}},{"properties":{"latitude":42.85673,"date":{"end_time":"2012/03/06 00:00:00 -0500","original":"3/5/2012","granularity":"day","time":"2012/03/05 00:00:00 -0500"},"checklists":1,"longitude":-85.38032,"id":"adtlbstg50z8","location":"Alto"},"type":"Feature","geometry":{"type":"Point","coordinates":[-85.38032,42.85673]}},{"properties":{"latitude":43.2173157,"date":{"end_time":"2012/03/07 00:00:00 -0500","original":"3/6/2012","granularity":"day","time":"2012/03/06 00:00:00 -0500"},"checklists":1,"longitude":-86.2955743,"id":"adtlbsoorupj","location":"Muskegon Lake--McCracken St and Lakeshore Dr"},"type":"Feature","geometry":{"type":"Point","coordinates":[-86.2955743,43.2173157]}},{"properties":{"latitude":42.9035224,"date":{"end_time":"2012/03/07 00:00:00 -0500","original":"3/6/2012","granularity":"day","time":"2012/03/06 00:00:00 -0500"},"checklists":1,"longitude":-86.1979496,"id":"adtlbsruqzd2","location":"Pigeon Lake boat launch"},"type":"Feature","geometry":{"type":"Point","coordinates":[-86.1979496,42.9035224]}},{"properties":{"latitude":42.6012532,"date":{"end_time":"2012/03/11 00:00:00 -0500","original":"3/10/2012","granularity":"day","time":"2012/03/10 00:00:00 -0500"},"checklists":1,"longitude":-86.1877303,"id":"adtlbsfug801","location":"Field E of 66th St. b/w 124th and 126th"},"type":"Feature","geometry":{"type":"Point","coordinates":[-86.1877303,42.6012532]}},{"properties":{"latitude":43.1764071,"date":{"end_time":"2012/03/11 00:00:00 -0500","original":"3/10/2012","granularity":"day","time":"2012/03/10 00:00:00 -0500"},"checklists":1,"longitude":-85.4603235,"id":"adtlbsr6ip8o","location":"M-57 Fields"},"type":"Feature","geometry":{"type":"Point","coordinates":[-85.4603235,43.1764071]}},{"properties":{"latitude":42.7303283,"date":{"end_time":"2012/03/11 00:00:00 -0500","original":"3/10/2012","granularity":"day","time":"2012/03/10 00:00:00 -0500"},"checklists":1,"longitude":-86.1479657,"id":"adtlbsu4h9as","location":"196/31 Median"},"type":"Feature","geometry":{"type":"Point","coordinates":[-86.1479657,42.7303283]}},{"properties":{"latitude":43.1938341,"date":{"end_time":"2012/03/13 00:00:00 -0400","original":"3/12/2012","granularity":"day","time":"2012/03/12 00:00:00 -0400"},"checklists":1,"longitude":-86.0011009,"id":"adtlbsnsaut2","location":"Fields N of Ravenna Heights W of Moorland"},"type":"Feature","geometry":{"type":"Point","coordinates":[-86.0011009,43.1938341]}},{"properties":{"latitude":42.25658,"date":{"end_time":"2012/03/16 00:00:00 -0400","original":"3/15/2012","granularity":"day","time":"2012/03/15 00:00:00 -0400"},"checklists":1,"longitude":-83.84057,"id":"adtlbsfv11qq","location":"Washtenaw"},"type":"Feature","geometry":{"type":"Point","coordinates":[-83.84057,42.25658]}},{"properties":{"latitude":41.39011,"date":{"end_time":"2012/03/16 00:00:00 -0400","original":"3/15/2012","granularity":"day","time":"2012/03/15 00:00:00 -0400"},"checklists":1,"longitude":-83.63907,"id":"adtlbsnk0nwi","location":"Wood"},"type":"Feature","geometry":{"type":"Point","coordinates":[-83.63907,41.39011]}},{"properties":{"latitude":41.6785534,"date":{"end_time":"2012/03/16 00:00:00 -0400","original":"3/15/2012","granularity":"day","time":"2012/03/15 00:00:00 -0400"},"checklists":1,"longitude":-83.6675835,"id":"adtlbsmtc2o9","location":"Wildwood Preserve Metropark"},"type":"Feature","geometry":{"type":"Point","coordinates":[-83.6675835,41.6785534]}},{"properties":{"latitude":42.4177095,"date":{"end_time":"2012/03/17 00:00:00 -0400","original":"3/16/2012","granularity":"day","time":"2012/03/16 00:00:00 -0400"},"checklists":1,"longitude":-82.1391111,"id":"adtlbsl7lmkj","location":"Chatham-Kent"},"type":"Feature","geometry":{"type":"Point","coordinates":[-82.1391111,42.4177095]}},{"properties":{"latitude":41.6498064,"date":{"end_time":"2012/03/17 00:00:00 -0400","original":"3/16/2012","granularity":"day","time":"2012/03/16 00:00:00 -0400"},"checklists":1,"longitude":-83.2374224,"id":"adtlbsjmvyw0","location":"Metzger Marsh Wildlife Area"},"type":"Feature","geometry":{"type":"Point","coordinates":[-83.2374224,41.6498064]}},{"properties":{"latitude":43.2675813,"date":{"end_time":"2012/03/18 00:00:00 -0400","original":"3/17/2012","granularity":"day","time":"2012/03/17 00:00:00 -0400"},"checklists":1,"longitude":-79.9393559,"id":"adtlbsf41v6r","location":"Dundas--Dejardins Canal"},"type":"Feature","geometry":{"type":"Point","coordinates":[-79.9393559,43.2675813]}},{"properties":{"latitude":43.1843333,"date":{"end_time":"2012/03/18 00:00:00 -0400","original":"3/17/2012","granularity":"day","time":"2012/03/17 00:00:00 -0400"},"checklists":1,"longitude":-79.2816854,"id":"adtlbsrh8ppw","location":"Green Ribbon Trail"},"type":"Feature","geometry":{"type":"Point","coordinates":[-79.2816854,43.1843333]}},{"properties":{"latitude":43.2031835,"date":{"end_time":"2012/03/18 00:00:00 -0400","original":"3/17/2012","granularity":"day","time":"2012/03/17 00:00:00 -0400"},"checklists":1,"longitude":-79.2649115,"id":"adtlbsn7utup","location":"St. Catharines--Lakeside Park"},"type":"Feature","geometry":{"type":"Point","coordinates":[-79.2649115,43.2031835]}},{"properties":{"latitude":43.212616,"date":{"end_time":"2012/03/18 00:00:00 -0400","original":"3/17/2012","granularity":"day","time":"2012/03/17 00:00:00 -0400"},"checklists":1,"longitude":-79.601318,"id":"adtlbstjtlg8","location":"Grimsby--Hunter Road"},"type":"Feature","geometry":{"type":"Point","coordinates":[-79.601318,43.212616]}},{"properties":{"latitude":43.1980236,"date":{"end_time":"2012/03/18 00:00:00 -0400","original":"3/17/2012","granularity":"day","time":"2012/03/17 00:00:00 -0400"},"checklists":1,"longitude":-79.2833519,"id":"adtlbsqj99qd","location":"Colton Ave. End"},"type":"Feature","geometry":{"type":"Point","coordinates":[-79.2833519,43.1980236]}},{"properties":{"latitude":43.1815381,"date":{"end_time":"2012/03/18 00:00:00 -0400","original":"3/17/2012","granularity":"day","time":"2012/03/17 00:00:00 -0400"},"checklists":1,"longitude":-79.3245769,"id":"adtlbsqodlnq","location":"St. Catharines--Charles Daley Park"},"type":"Feature","geometry":{"type":"Point","coordinates":[-79.3245769,43.1815381]}},{"properties":{"latitude":42.9812003,"date":{"end_time":"2012/03/20 00:00:00 -0400","original":"3/19/2012","granularity":"day","time":"2012/03/19 00:00:00 -0400"},"checklists":1,"longitude":-82.756423,"id":"adtlbslouedl","location":"I-69 at Co. Hwy 19 (exit 184)"},"type":"Feature","geometry":{"type":"Point","coordinates":[-82.756423,42.9812003]}},{"properties":{"latitude":42.9650103,"date":{"end_time":"2012/03/20 00:00:00 -0400","original":"3/19/2012","granularity":"day","time":"2012/03/19 00:00:00 -0400"},"checklists":1,"longitude":-80.6376109,"id":"adtlbste66nj","location":"Middletown Line Rd S of Airport Rd"},"type":"Feature","geometry":{"type":"Point","coordinates":[-80.6376109,42.9650103]}},{"properties":{"latitude":43.0891768,"date":{"end_time":"2012/03/21 00:00:00 -0400","original":"3/20/2012","granularity":"day","time":"2012/03/20 00:00:00 -0400"},"checklists":1,"longitude":-85.2246839,"id":"adtlbsn5t6do","location":"Dentist"},"type":"Feature","geometry":{"type":"Point","coordinates":[-85.2246839,43.0891768]}},{"properties":{"latitude":43.101,"date":{"end_time":"2012/03/22 00:00:00 -0400","original":"3/21/2012","granularity":"day","time":"2012/03/21 00:00:00 -0400"},"checklists":1,"longitude":-85.39054,"id":"adtlbsm7uikl","location":"Muskrat Lake"},"type":"Feature","geometry":{"type":"Point","coordinates":[-85.39054,43.101]}},{"properties":{"latitude":44.10251,"date":{"end_time":"2012/03/24 00:00:00 -0400","original":"3/23/2012","granularity":"day","time":"2012/03/23 00:00:00 -0400"},"checklists":1,"longitude":-85.45895,"id":"adtlbslpnx4h","location":"Tustin"},"type":"Feature","geometry":{"type":"Point","coordinates":[-85.45895,44.10251]}},{"properties":{"latitude":42.785558,"date":{"end_time":"2012/03/29 00:00:00 -0400","original":"3/28/2012","granularity":"day","time":"2012/03/28 00:00:00 -0400"},"checklists":1,"longitude":-86.1000252,"id":"adtlbsfxgz3f","location":"Hope College--Dow Center"},"type":"Feature","geometry":{"type":"Point","coordinates":[-86.1000252,42.785558]}},{"properties":{"latitude":42.7767625,"date":{"end_time":"2012/03/30 00:00:00 -0400","original":"3/29/2012","granularity":"day","time":"2012/03/29 00:00:00 -0400"},"checklists":1,"longitude":-86.1006486,"id":"adtlbsntwr63","location":"Prospect Park"},"type":"Feature","geometry":{"type":"Point","coordinates":[-86.1006486,42.7767625]}},{"properties":{"latitude":42.7887747,"date":{"end_time":"2012/04/03 00:00:00 -0400","original":"4/2/2012","granularity":"day","time":"2012/04/02 00:00:00 -0400"},"checklists":1,"longitude":-86.2105397,"id":"adtlbseec2d3","location":"Calculus Exam De-stress Run"},"type":"Feature","geometry":{"type":"Point","coordinates":[-86.2105397,42.7887747]}},{"properties":{"latitude":42.6373589,"date":{"end_time":"2012/04/06 00:00:00 -0400","original":"4/5/2012","granularity":"day","time":"2012/04/05 00:00:00 -0400"},"checklists":1,"longitude":-85.9024215,"id":"adtlbsnx2b0v","location":"Allegan SGA--Meadow Thickets and Grassland at 130th"},"type":"Feature","geometry":{"type":"Point","coordinates":[-85.9024215,42.6373589]}},{"properties":{"latitude":42.6295576,"date":{"end_time":"2012/04/06 00:00:00 -0400","original":"4/5/2012","granularity":"day","time":"2012/04/05 00:00:00 -0400"},"checklists":1,"longitude":-85.8987865,"id":"adtlbsi4dlht","location":"Allegan SGA--Woodland Marshes"},"type":"Feature","geometry":{"type":"Point","coordinates":[-85.8987865,42.6295576]}},{"properties":{"latitude":43.0452456,"date":{"end_time":"2012/04/10 00:00:00 -0400","original":"4/9/2012","granularity":"day","time":"2012/04/09 00:00:00 -0400"},"checklists":1,"longitude":-86.1242996,"id":"adtlbsesqb0v","location":"Grand Haven SGA--Bruce Bayou"},"type":"Feature","geometry":{"type":"Point","coordinates":[-86.1242996,43.0452456]}},{"properties":{"latitude":43.0518211,"date":{"end_time":"2012/04/14 00:00:00 -0400","original":"4/13/2012","granularity":"day","time":"2012/04/13 00:00:00 -0400"},"checklists":1,"longitude":-86.0796089,"id":"adtlbsk8d09m","location":"120th fields north of Cypress Street"},"type":"Feature","geometry":{"type":"Point","coordinates":[-86.0796089,43.0518211]}},{"properties":{"latitude":43.2927005,"date":{"end_time":"2012/04/15 00:00:00 -0400","original":"4/14/2012","granularity":"day","time":"2012/04/14 00:00:00 -0400"},"checklists":1,"longitude":-86.0566753,"id":"adtlbsexrse0","location":"Muskegon SGA--Headquarters"},"type":"Feature","geometry":{"type":"Point","coordinates":[-86.0566753,43.2927005]}},{"properties":{"latitude":42.5339827,"date":{"end_time":"2012/04/17 00:00:00 -0400","original":"4/16/2012","granularity":"day","time":"2012/04/16 00:00:00 -0400"},"checklists":1,"longitude":-83.6461258,"id":"adtlbsrr4wo6","location":"Kensington Metropark (Oakland Co.)"},"type":"Feature","geometry":{"type":"Point","coordinates":[-83.6461258,42.5339827]}},{"properties":{"latitude":43.0384951,"date":{"end_time":"2012/04/22 00:00:00 -0400","original":"4/21/2012","granularity":"day","time":"2012/04/21 00:00:00 -0400"},"checklists":1,"longitude":-85.5606478,"id":"adtlbsgmz926","location":"Fox Den Ridge"},"type":"Feature","geometry":{"type":"Point","coordinates":[-85.5606478,43.0384951]}},{"properties":{"latitude":42.6273971,"date":{"end_time":"2012/04/25 00:00:00 -0400","original":"4/24/2012","granularity":"day","time":"2012/04/24 00:00:00 -0400"},"checklists":1,"longitude":-85.9012141,"id":"adtlbsnh2y7n","location":"Allegan SGA--Grassland Trail"},"type":"Feature","geometry":{"type":"Point","coordinates":[-85.9012141,42.6273971]}},{"properties":{"latitude":42.76813,"date":{"end_time":"2012/04/29 00:00:00 -0400","original":"4/28/2012","granularity":"day","time":"2012/04/28 00:00:00 -0400"},"checklists":1,"longitude":-85.36291,"id":"adtlbsjqmpo3","location":"Maher Sanctuary"},"type":"Feature","geometry":{"type":"Point","coordinates":[-85.36291,42.76813]}},{"properties":{"latitude":42.7698672,"date":{"end_time":"2012/04/29 00:00:00 -0400","original":"4/28/2012","granularity":"day","time":"2012/04/28 00:00:00 -0400"},"checklists":1,"longitude":-85.7803003,"id":"adtlbsj3d75q","location":"Kenowa and 108th (Kent Co.)"},"type":"Feature","geometry":{"type":"Point","coordinates":[-85.7803003,42.7698672]}},{"properties":{"latitude":42.7635357,"date":{"end_time":"2012/04/29 00:00:00 -0400","original":"4/28/2012","granularity":"day","time":"2012/04/28 00:00:00 -0400"},"checklists":1,"longitude":-85.7823639,"id":"adtlbse4o2fy","location":"Kenowa and Ottogan (Allegan Co.)"},"type":"Feature","geometry":{"type":"Point","coordinates":[-85.7823639,42.7635357]}},{"properties":{"latitude":42.7698058,"date":{"end_time":"2012/04/29 00:00:00 -0400","original":"4/28/2012","granularity":"day","time":"2012/04/28 00:00:00 -0400"},"checklists":1,"longitude":-85.7868272,"id":"adtlbsiz62id","location":"Kenowa and Ottogan (Ottawa Co.)"},"type":"Feature","geometry":{"type":"Point","coordinates":[-85.7868272,42.7698058]}},{"properties":{"latitude":42.7690837,"date":{"end_time":"2012/05/02 00:00:00 -0400","original":"5/1/2012","granularity":"day","time":"2012/05/01 00:00:00 -0400"},"checklists":1,"longitude":-85.9606849,"id":"adtlbsf61god","location":"Ottogan and 72nd"},"type":"Feature","geometry":{"type":"Point","coordinates":[-85.9606849,42.7690837]}},{"properties":{"latitude":42.77519,"date":{"end_time":"2012/05/04 00:00:00 -0400","original":"5/3/2012","granularity":"day","time":"2012/05/03 00:00:00 -0400"},"checklists":1,"longitude":-85.35801,"id":"adtlbsqqx86n","location":"Baker Ave Coldwater River Sanctuary"},"type":"Feature","geometry":{"type":"Point","coordinates":[-85.35801,42.77519]}},{"properties":{"latitude":42.1560548,"date":{"end_time":"2012/05/08 00:00:00 -0400","original":"5/7/2012","granularity":"day","time":"2012/05/07 00:00:00 -0400"},"checklists":1,"longitude":-86.3802195,"id":"adtlbsnfi5wj","location":"Sarett Nature Center"},"type":"Feature","geometry":{"type":"Point","coordinates":[-86.3802195,42.1560548]}},{"properties":{"latitude":52.4149491,"date":{"end_time":"2012/05/10 00:00:00 -0400","original":"5/9/2012","granularity":"day","time":"2012/05/09 00:00:00 -0400"},"checklists":1,"longitude":5.2225106,"id":"adtlbsfks1ck","location":"Lepelaarplassen--Trekvogelgraslandje"},"type":"Feature","geometry":{"type":"Point","coordinates":[5.2225106,52.4149491]}},{"properties":{"latitude":52.5559066,"date":{"end_time":"2012/05/11 00:00:00 -0400","original":"5/10/2012","granularity":"day","time":"2012/05/10 00:00:00 -0400"},"checklists":1,"longitude":5.9185235,"id":"adtlbsp5nbe9","location":"Kampen"},"type":"Feature","geometry":{"type":"Point","coordinates":[5.9185235,52.5559066]}},{"properties":{"latitude":52.4475536,"date":{"end_time":"2012/05/12 00:00:00 -0400","original":"5/11/2012","granularity":"day","time":"2012/05/11 00:00:00 -0400"},"checklists":1,"longitude":4.8944979,"id":"adtlbslgpd43","location":"Het Twiske"},"type":"Feature","geometry":{"type":"Point","coordinates":[4.8944979,52.4475536]}},{"properties":{"latitude":51.604308,"date":{"end_time":"2012/05/13 00:00:00 -0400","original":"5/12/2012","granularity":"day","time":"2012/05/12 00:00:00 -0400"},"checklists":1,"longitude":4.1051669,"id":"adtlbsrq9j6q","location":"Sint Annaland--Harbor Area"},"type":"Feature","geometry":{"type":"Point","coordinates":[4.1051669,51.604308]}},{"properties":{"latitude":51.6094253,"date":{"end_time":"2012/05/13 00:00:00 -0400","original":"5/12/2012","granularity":"day","time":"2012/05/12 00:00:00 -0400"},"checklists":1,"longitude":4.1770071,"id":"adtlbspwllqm","location":"Sint Annaland--Het Stinkgat"},"type":"Feature","geometry":{"type":"Point","coordinates":[4.1770071,51.6094253]}},{"properties":{"latitude":52.3440623,"date":{"end_time":"2012/05/16 00:00:00 -0400","original":"5/15/2012","granularity":"day","time":"2012/05/15 00:00:00 -0400"},"checklists":1,"longitude":5.0247031,"id":"adtlbslul8q1","location":"Diemer Vijfhoek"},"type":"Feature","geometry":{"type":"Point","coordinates":[5.0247031,52.3440623]}},{"properties":{"latitude":49.6498464,"date":{"end_time":"2012/05/17 00:00:00 -0400","original":"5/16/2012","granularity":"day","time":"2012/05/16 00:00:00 -0400"},"checklists":1,"longitude":2.8143752,"id":"adtlbsqu95yd","location":"Picardie"},"type":"Feature","geometry":{"type":"Point","coordinates":[2.8143752,49.6498464]}},{"properties":{"latitude":50.8366997,"date":{"end_time":"2012/05/17 00:00:00 -0400","original":"5/16/2012","granularity":"day","time":"2012/05/16 00:00:00 -0400"},"checklists":1,"longitude":4.3704129,"id":"adtlbse4cobe","location":"Bruxelles-Capitale, Rgion de"},"type":"Feature","geometry":{"type":"Point","coordinates":[4.3704129,50.8366997]}},{"properties":{"latitude":50.472398,"date":{"end_time":"2012/05/17 00:00:00 -0400","original":"5/16/2012","granularity":"day","time":"2012/05/16 00:00:00 -0400"},"checklists":1,"longitude":2.7211254,"id":"adtlbsf3jyu8","location":"Nord-Pas-de-Calais"},"type":"Feature","geometry":{"type":"Point","coordinates":[2.7211254,50.472398]}},{"properties":{"latitude":48.8530256,"date":{"end_time":"2012/05/19 00:00:00 -0400","original":"5/18/2012","granularity":"day","time":"2012/05/18 00:00:00 -0400"},"checklists":1,"longitude":2.3491859,"id":"adtlbsig89dy","location":"Cathedral de Notre Dame de Paris"},"type":"Feature","geometry":{"type":"Point","coordinates":[2.3491859,48.8530256]}},{"properties":{"latitude":48.8340396,"date":{"end_time":"2012/05/20 00:00:00 -0400","original":"5/19/2012","granularity":"day","time":"2012/05/19 00:00:00 -0400"},"checklists":1,"longitude":2.2126736,"id":"adtlbselzg0o","location":"Parc de Saint-Cloud"},"type":"Feature","geometry":{"type":"Point","coordinates":[2.2126736,48.8340396]}},{"properties":{"latitude":48.8468346,"date":{"end_time":"2012/05/22 00:00:00 -0400","original":"5/21/2012","granularity":"day","time":"2012/05/21 00:00:00 -0400"},"checklists":1,"longitude":2.3475029,"id":"adtlbserqd7r","location":"Durufle Apartment"},"type":"Feature","geometry":{"type":"Point","coordinates":[2.3475029,48.8468346]}},{"properties":{"latitude":48.8649406,"date":{"end_time":"2012/05/23 00:00:00 -0400","original":"5/22/2012","granularity":"day","time":"2012/05/22 00:00:00 -0400"},"checklists":1,"longitude":2.2558022,"id":"adtlbsmvgron","location":"Bois de Boulogne"},"type":"Feature","geometry":{"type":"Point","coordinates":[2.2558022,48.8649406]}},{"properties":{"latitude":48.8099713,"date":{"end_time":"2012/05/23 00:00:00 -0400","original":"5/22/2012","granularity":"day","time":"2012/05/22 00:00:00 -0400"},"checklists":1,"longitude":2.1002925,"id":"adtlbsok65xe","location":"Jardins du chateau de Versailles"},"type":"Feature","geometry":{"type":"Point","coordinates":[2.1002925,48.8099713]}},{"properties":{"latitude":48.8869394,"date":{"end_time":"2012/05/24 00:00:00 -0400","original":"5/23/2012","granularity":"day","time":"2012/05/23 00:00:00 -0400"},"checklists":1,"longitude":2.3425847,"id":"adtlbsljj5qv","location":"Basilique du Sacre Coeur"},"type":"Feature","geometry":{"type":"Point","coordinates":[2.3425847,48.8869394]}},{"properties":{"latitude":48.863579,"date":{"end_time":"2012/05/24 00:00:00 -0400","original":"5/23/2012","granularity":"day","time":"2012/05/23 00:00:00 -0400"},"checklists":1,"longitude":2.3271288,"id":"adtlbsohlt72","location":"Jardin des Tuileries"},"type":"Feature","geometry":{"type":"Point","coordinates":[2.3271288,48.863579]}},{"properties":{"latitude":52.4957334,"date":{"end_time":"2012/05/25 00:00:00 -0400","original":"5/24/2012","granularity":"day","time":"2012/05/24 00:00:00 -0400"},"checklists":1,"longitude":4.5870095,"id":"adtlbsh0103o","location":"Beverwijk aan Zee"},"type":"Feature","geometry":{"type":"Point","coordinates":[4.5870095,52.4957334]}},{"properties":{"latitude":43.14666,"date":{"end_time":"2012/05/29 00:00:00 -0400","original":"5/28/2012","granularity":"day","time":"2012/05/28 00:00:00 -0400"},"checklists":1,"longitude":-85.948,"id":"adtlbsmgvvzk","location":"Patterson Park"},"type":"Feature","geometry":{"type":"Point","coordinates":[-85.948,43.14666]}},{"properties":{"latitude":43.2190872,"date":{"end_time":"2012/05/29 00:00:00 -0400","original":"5/28/2012","granularity":"day","time":"2012/05/28 00:00:00 -0400"},"checklists":1,"longitude":-86.2081542,"id":"adtlbsso4rne","location":"Bingo Parking Lot"},"type":"Feature","geometry":{"type":"Point","coordinates":[-86.2081542,43.2190872]}},{"properties":{"latitude":43.1272859,"date":{"end_time":"2012/06/05 00:00:00 -0400","original":"6/4/2012","granularity":"day","time":"2012/06/04 00:00:00 -0400"},"checklists":1,"longitude":-85.3426263,"id":"adtlbsgdyqzi","location":"Tully--10 mile to 11 mile"},"type":"Feature","geometry":{"type":"Point","coordinates":[-85.3426263,43.1272859]}},{"properties":{"latitude":43.147352,"date":{"end_time":"2012/06/05 00:00:00 -0400","original":"6/4/2012","granularity":"day","time":"2012/06/04 00:00:00 -0400"},"checklists":1,"longitude":-85.342787,"id":"adtlbst7cf5n","location":"Tully and 12 Mile"},"type":"Feature","geometry":{"type":"Point","coordinates":[-85.342787,43.147352]}},{"properties":{"latitude":43.0442006,"date":{"end_time":"2012/06/11 00:00:00 -0400","original":"6/10/2012","granularity":"day","time":"2012/06/10 00:00:00 -0400"},"checklists":1,"longitude":-85.6590297,"id":"adtlbsp8bzt7","location":"West River and 131"},"type":"Feature","geometry":{"type":"Point","coordinates":[-85.6590297,43.0442006]}},{"properties":{"latitude":42.8558337,"date":{"end_time":"2012/06/16 00:00:00 -0400","original":"6/15/2012","granularity":"day","time":"2012/06/15 00:00:00 -0400"},"checklists":1,"longitude":-85.520038,"id":"adtlbsoacsaz","location":"Gerald Ford International Airport (60th St east of Kraft Ave)"},"type":"Feature","geometry":{"type":"Point","coordinates":[-85.520038,42.8558337]}},{"properties":{"latitude":43.902835,"date":{"end_time":"2012/06/16 00:00:00 -0400","original":"6/15/2012","granularity":"day","time":"2012/06/15 00:00:00 -0400"},"checklists":1,"longitude":-85.7822789,"id":"adtlbsgg14af","location":"Twin Creek Rd north of Hwy 10"},"type":"Feature","geometry":{"type":"Point","coordinates":[-85.7822789,43.902835]}},{"properties":{"latitude":44.0367634,"date":{"end_time":"2012/06/16 00:00:00 -0400","original":"6/15/2012","granularity":"day","time":"2012/06/15 00:00:00 -0400"},"checklists":1,"longitude":-86.4946318,"id":"adtlbsslllqx","location":"Ludington SP"},"type":"Feature","geometry":{"type":"Point","coordinates":[-86.4946318,44.0367634]}},{"properties":{"latitude":44.00048,"date":{"end_time":"2012/06/16 00:00:00 -0400","original":"6/15/2012","granularity":"day","time":"2012/06/15 00:00:00 -0400"},"checklists":1,"longitude":-86.2792,"id":"adtlbsqoiq75","location":"Mason"},"type":"Feature","geometry":{"type":"Point","coordinates":[-86.2792,44.00048]}},{"properties":{"latitude":43.64401,"date":{"end_time":"2012/06/16 00:00:00 -0400","original":"6/15/2012","granularity":"day","time":"2012/06/15 00:00:00 -0400"},"checklists":1,"longitude":-86.29022,"id":"adtlbsp0ap31","location":"Oceana"},"type":"Feature","geometry":{"type":"Point","coordinates":[-86.29022,43.64401]}},{"properties":{"latitude":42.9028894,"date":{"end_time":"2012/06/19 00:00:00 -0400","original":"6/18/2012","granularity":"day","time":"2012/06/18 00:00:00 -0400"},"checklists":1,"longitude":-85.780691,"id":"adtlbsrsovx8","location":"196 btwn Chicago Drive Exits"},"type":"Feature","geometry":{"type":"Point","coordinates":[-85.780691,42.9028894]}},{"properties":{"latitude":43.2497453,"date":{"end_time":"2012/06/22 00:00:00 -0400","original":"6/21/2012","granularity":"day","time":"2012/06/21 00:00:00 -0400"},"checklists":1,"longitude":-85.3819279,"id":"adtlbsh5j47b","location":"19 Mile and Force"},"type":"Feature","geometry":{"type":"Point","coordinates":[-85.3819279,43.2497453]}},{"properties":{"latitude":43.294259,"date":{"end_time":"2012/06/22 00:00:00 -0400","original":"6/21/2012","granularity":"day","time":"2012/06/21 00:00:00 -0400"},"checklists":1,"longitude":-85.3924019,"id":"adtlbspm1dde","location":"22 Mile and Penny"},"type":"Feature","geometry":{"type":"Point","coordinates":[-85.3924019,43.294259]}},{"properties":{"latitude":43.2380339,"date":{"end_time":"2012/06/22 00:00:00 -0400","original":"6/21/2012","granularity":"day","time":"2012/06/21 00:00:00 -0400"},"checklists":1,"longitude":-85.3681927,"id":"adtlbsnc1jg5","location":"Spencer Library Backwoods Trails"},"type":"Feature","geometry":{"type":"Point","coordinates":[-85.3681927,43.2380339]}},{"properties":{"latitude":43.1377361,"date":{"end_time":"2012/06/22 00:00:00 -0400","original":"6/21/2012","granularity":"day","time":"2012/06/21 00:00:00 -0400"},"checklists":1,"longitude":-85.3064385,"id":"adtlbstw701j","location":"Honeycrisp Lane"},"type":"Feature","geometry":{"type":"Point","coordinates":[-85.3064385,43.1377361]}},{"properties":{"latitude":42.9240472,"date":{"end_time":"2012/06/24 00:00:00 -0400","original":"6/23/2012","granularity":"day","time":"2012/06/23 00:00:00 -0400"},"checklists":1,"longitude":-80.6264768,"id":"adtlbsky8hkr","location":"Otterville Residence"},"type":"Feature","geometry":{"type":"Point","coordinates":[-80.6264768,42.9240472]}},{"properties":{"latitude":43.0793429,"date":{"end_time":"2012/06/26 00:00:00 -0400","original":"6/25/2012","granularity":"day","time":"2012/06/25 00:00:00 -0400"},"checklists":1,"longitude":-80.7421527,"id":"adtlbsjphoj1","location":"Cedar Line Marsh"},"type":"Feature","geometry":{"type":"Point","coordinates":[-80.7421527,43.0793429]}},{"properties":{"latitude":43.0729064,"date":{"end_time":"2012/06/26 00:00:00 -0400","original":"6/25/2012","granularity":"day","time":"2012/06/25 00:00:00 -0400"},"checklists":1,"longitude":-80.7776593,"id":"adtlbsl5oe76","location":"Curry btwn Dodge Line and Trillium Line"},"type":"Feature","geometry":{"type":"Point","coordinates":[-80.7776593,43.0729064]}},{"properties":{"latitude":43.0824792,"date":{"end_time":"2012/06/26 00:00:00 -0400","original":"6/25/2012","granularity":"day","time":"2012/06/25 00:00:00 -0400"},"checklists":1,"longitude":-80.7646591,"id":"adtlbsjh1rix","location":"Curry btwn Old Stage and Dodge Line"},"type":"Feature","geometry":{"type":"Point","coordinates":[-80.7646591,43.0824792]}},{"properties":{"latitude":43.0670168,"date":{"end_time":"2012/06/26 00:00:00 -0400","original":"6/25/2012","granularity":"day","time":"2012/06/25 00:00:00 -0400"},"checklists":1,"longitude":-80.7816726,"id":"adtlbsjqywww","location":"Trillium Private Residence"},"type":"Feature","geometry":{"type":"Point","coordinates":[-80.7816726,43.0670168]}},{"properties":{"latitude":43.0857644,"date":{"end_time":"2012/07/01 00:00:00 -0400","original":"6/30/2012","granularity":"day","time":"2012/06/30 00:00:00 -0400"},"checklists":1,"longitude":-85.4446165,"id":"adtlbsgxmles","location":"M-44 at Old Belding Rd"},"type":"Feature","geometry":{"type":"Point","coordinates":[-85.4446165,43.0857644]}},{"properties":{"latitude":43.1285006,"date":{"end_time":"2012/07/07 00:00:00 -0400","original":"7/6/2012","granularity":"day","time":"2012/07/06 00:00:00 -0400"},"checklists":1,"longitude":-85.3808443,"id":"adtlbskz2p87","location":"Wabasis Condominium Future Lots"},"type":"Feature","geometry":{"type":"Point","coordinates":[-85.3808443,43.1285006]}},{"properties":{"latitude":42.9488687,"date":{"end_time":"2012/07/21 00:00:00 -0400","original":"7/20/2012","granularity":"day","time":"2012/07/20 00:00:00 -0400"},"checklists":1,"longitude":-80.6536184,"id":"adtlbsqy9uxn","location":"Maple Dell Farm"},"type":"Feature","geometry":{"type":"Point","coordinates":[-80.6536184,42.9488687]}},{"properties":{"latitude":43.3163106,"date":{"end_time":"2012/07/22 00:00:00 -0400","original":"7/21/2012","granularity":"day","time":"2012/07/21 00:00:00 -0400"},"checklists":1,"longitude":-80.8261585,"id":"adtlbsrgexnf","location":"Tavistock Sewage Lagoons"},"type":"Feature","geometry":{"type":"Point","coordinates":[-80.8261585,43.3163106]}},{"properties":{"latitude":43.1533167,"date":{"end_time":"2012/08/02 00:00:00 -0400","original":"8/1/2012","granularity":"day","time":"2012/08/01 00:00:00 -0400"},"checklists":1,"longitude":-85.3672705,"id":"adtlbssutpp4","location":"Wabasis Creek at Connelly Ave"},"type":"Feature","geometry":{"type":"Point","coordinates":[-85.3672705,43.1533167]}},{"properties":{"latitude":43.17791,"date":{"end_time":"2012/08/03 00:00:00 -0400","original":"8/2/2012","granularity":"day","time":"2012/08/02 00:00:00 -0400"},"checklists":1,"longitude":-85.280664,"id":"adtlbspzzjxr","location":"Kmart Parking Lot"},"type":"Feature","geometry":{"type":"Point","coordinates":[-85.280664,43.17791]}},{"properties":{"latitude":43.1779461,"date":{"end_time":"2012/08/03 00:00:00 -0400","original":"8/2/2012","granularity":"day","time":"2012/08/02 00:00:00 -0400"},"checklists":1,"longitude":-85.2395256,"id":"adtlbskesg3k","location":"Greenville Community Center"},"type":"Feature","geometry":{"type":"Point","coordinates":[-85.2395256,43.1779461]}},{"properties":{"latitude":43.1182481,"date":{"end_time":"2012/08/04 00:00:00 -0400","original":"8/3/2012","granularity":"day","time":"2012/08/03 00:00:00 -0400"},"checklists":1,"longitude":-85.4057075,"id":"adtlbsth42i8","location":"10 Mile Swamp btwn Wabasis and Nugent"},"type":"Feature","geometry":{"type":"Point","coordinates":[-85.4057075,43.1182481]}},{"properties":{"latitude":43.1345408,"date":{"end_time":"2012/08/04 00:00:00 -0400","original":"8/3/2012","granularity":"day","time":"2012/08/03 00:00:00 -0400"},"checklists":1,"longitude":-85.4117342,"id":"adtlbsssm1b0","location":"Nugent Creek btwn 11 Mile and Tower"},"type":"Feature","geometry":{"type":"Point","coordinates":[-85.4117342,43.1345408]}},{"properties":{"latitude":43.1460253,"date":{"end_time":"2012/08/04 00:00:00 -0400","original":"8/3/2012","granularity":"day","time":"2012/08/03 00:00:00 -0400"},"checklists":1,"longitude":-85.4118185,"id":"adtlbssaburk","location":"Nugent Marsh btwn 12 Mile and Tower"},"type":"Feature","geometry":{"type":"Point","coordinates":[-85.4118185,43.1460253]}},{"properties":{"latitude":43.1234669,"date":{"end_time":"2012/08/04 00:00:00 -0400","original":"8/3/2012","granularity":"day","time":"2012/08/03 00:00:00 -0400"},"checklists":1,"longitude":-85.4117787,"id":"adtlbsgg9uw5","location":"Nugent btwn 10 and 11 Mile"},"type":"Feature","geometry":{"type":"Point","coordinates":[-85.4117787,43.1234669]}},{"properties":{"latitude":43.1327611,"date":{"end_time":"2012/08/04 00:00:00 -0400","original":"8/3/2012","granularity":"day","time":"2012/08/03 00:00:00 -0400"},"checklists":1,"longitude":-85.4116502,"id":"adtlbsrv2pu4","location":"Nugent, 11 Mile"},"type":"Feature","geometry":{"type":"Point","coordinates":[-85.4116502,43.1327611]}},{"properties":{"latitude":43.1581486,"date":{"end_time":"2012/08/04 00:00:00 -0400","original":"8/3/2012","granularity":"day","time":"2012/08/03 00:00:00 -0400"},"checklists":1,"longitude":-85.3774396,"id":"adtlbsj61gjb","location":"Scranton btwn 13 Mile and Elkins"},"type":"Feature","geometry":{"type":"Point","coordinates":[-85.3774396,43.1581486]}},{"properties":{"latitude":43.1331294,"date":{"end_time":"2012/08/08 00:00:00 -0400","original":"8/7/2012","granularity":"day","time":"2012/08/07 00:00:00 -0400"},"checklists":1,"longitude":-85.3375098,"id":"adtlbsp1vy2x","location":"11 Mile (Ashley - Tully)"},"type":"Feature","geometry":{"type":"Point","coordinates":[-85.3375098,43.1331294]}},{"properties":{"latitude":43.1262473,"date":{"end_time":"2012/08/08 00:00:00 -0400","original":"8/7/2012","granularity":"day","time":"2012/08/07 00:00:00 -0400"},"checklists":1,"longitude":-85.332362,"id":"adtlbsifsdix","location":"Ashley (10 Mile - 11 Mile)"},"type":"Feature","geometry":{"type":"Point","coordinates":[-85.332362,43.1262473]}},{"properties":{"latitude":43.1258836,"date":{"end_time":"2012/08/09 00:00:00 -0400","original":"8/8/2012","granularity":"day","time":"2012/08/08 00:00:00 -0400"},"checklists":1,"longitude":-85.3779788,"id":"adtlbsrfa7ov","location":"Wabasis Shore Ponds"},"type":"Feature","geometry":{"type":"Point","coordinates":[-85.3779788,43.1258836]}},{"properties":{"latitude":42.7823053,"date":{"end_time":"2012/08/10 00:00:00 -0400","original":"8/9/2012","granularity":"day","time":"2012/08/09 00:00:00 -0400"},"checklists":1,"longitude":-85.8025813,"id":"adtlbshj4yki","location":"Adams and 8th"},"type":"Feature","geometry":{"type":"Point","coordinates":[-85.8025813,42.7823053]}},{"properties":{"latitude":43.1239522,"date":{"end_time":"2012/08/14 00:00:00 -0400","original":"8/13/2012","granularity":"day","time":"2012/08/13 00:00:00 -0400"},"checklists":1,"longitude":-85.4411095,"id":"adtlbshtg4q2","location":"Ramsdell (10 - 11 Mile)"},"type":"Feature","geometry":{"type":"Point","coordinates":[-85.4411095,43.1239522]}},{"properties":{"latitude":42.6456128,"date":{"end_time":"2012/08/15 00:00:00 -0400","original":"8/14/2012","granularity":"day","time":"2012/08/14 00:00:00 -0400"},"checklists":1,"longitude":-86.1884501,"id":"adtlbsp2mu3n","location":"Kalamazoo River at I-196"},"type":"Feature","geometry":{"type":"Point","coordinates":[-86.1884501,42.6456128]}},{"properties":{"latitude":43.1782028,"date":{"end_time":"2012/08/16 00:00:00 -0400","original":"8/15/2012","granularity":"day","time":"2012/08/15 00:00:00 -0400"},"checklists":1,"longitude":-85.2409363,"id":"adtlbsgd5c9b","location":"Flat River Trail"},"type":"Feature","geometry":{"type":"Point","coordinates":[-85.2409363,43.1782028]}},{"properties":{"latitude":43.119957,"date":{"end_time":"2012/08/17 00:00:00 -0400","original":"8/16/2012","granularity":"day","time":"2012/08/16 00:00:00 -0400"},"checklists":1,"longitude":-85.5623882,"id":"adtlbsp8to6m","location":"Rockford Dam"},"type":"Feature","geometry":{"type":"Point","coordinates":[-85.5623882,43.119957]}},{"properties":{"latitude":43.2547052,"date":{"end_time":"2012/08/18 00:00:00 -0400","original":"8/17/2012","granularity":"day","time":"2012/08/17 00:00:00 -0400"},"checklists":1,"longitude":-81.8364716,"id":"adtlbsli0zlb","location":"Pinery Provincial Park"},"type":"Feature","geometry":{"type":"Point","coordinates":[-81.8364716,43.2547052]}},{"properties":{"latitude":42.5829243,"date":{"end_time":"2012/08/19 00:00:00 -0400","original":"8/18/2012","granularity":"day","time":"2012/08/18 00:00:00 -0400"},"checklists":1,"longitude":-80.3983998,"id":"adtlbsi63yu9","location":"Long Point--LPBO Old Cut Field Station"},"type":"Feature","geometry":{"type":"Point","coordinates":[-80.3983998,42.5829243]}},{"properties":{"latitude":42.937365,"date":{"end_time":"2012/08/19 00:00:00 -0400","original":"8/18/2012","granularity":"day","time":"2012/08/18 00:00:00 -0400"},"checklists":1,"longitude":-80.6296716,"id":"adtlbsllh3ki","location":"Milldale and Middletown Line Road"},"type":"Feature","geometry":{"type":"Point","coordinates":[-80.6296716,42.937365]}},{"properties":{"latitude":42.67719,"date":{"end_time":"2012/08/21 00:00:00 -0400","original":"8/20/2012","granularity":"day","time":"2012/08/20 00:00:00 -0400"},"checklists":1,"longitude":-82.91629,"id":"adtlbshj9u81","location":"Macomb"},"type":"Feature","geometry":{"type":"Point","coordinates":[-82.91629,42.67719]}},{"properties":{"latitude":44.68683,"date":{"end_time":"2012/08/23 00:00:00 -0400","original":"8/22/2012","granularity":"day","time":"2012/08/22 00:00:00 -0400"},"checklists":1,"longitude":-85.57665,"id":"adtlbsmym503","location":"Grand Traverse"},"type":"Feature","geometry":{"type":"Point","coordinates":[-85.57665,44.68683]}},{"properties":{"latitude":45.1582917,"date":{"end_time":"2012/08/23 00:00:00 -0400","original":"8/22/2012","granularity":"day","time":"2012/08/22 00:00:00 -0400"},"checklists":1,"longitude":-86.0444766,"id":"adtlbsenk4to","location":"North Manitou Island--Potholes"},"type":"Feature","geometry":{"type":"Point","coordinates":[-86.0444766,45.1582917]}},{"properties":{"latitude":44.243723,"date":{"end_time":"2012/08/23 00:00:00 -0400","original":"8/22/2012","granularity":"day","time":"2012/08/22 00:00:00 -0400"},"checklists":1,"longitude":-85.456175,"id":"adtlbsqpjwkp","location":"William Mitchell SP"},"type":"Feature","geometry":{"type":"Point","coordinates":[-85.456175,44.243723]}},{"properties":{"latitude":45.0241239,"date":{"end_time":"2012/08/23 00:00:00 -0400","original":"8/22/2012","granularity":"day","time":"2012/08/22 00:00:00 -0400"},"checklists":1,"longitude":-85.761407,"id":"adtlbsiz8xmf","location":"Manitou Transit Dock"},"type":"Feature","geometry":{"type":"Point","coordinates":[-85.761407,45.0241239]}},{"properties":{"latitude":44.359592,"date":{"end_time":"2012/08/23 00:00:00 -0400","original":"8/22/2012","granularity":"day","time":"2012/08/22 00:00:00 -0400"},"checklists":1,"longitude":-85.6140256,"id":"adtlbssycn0l","location":"M-115 in NE Manistee NF"},"type":"Feature","geometry":{"type":"Point","coordinates":[-85.6140256,44.359592]}},{"properties":{"latitude":45.0417472,"date":{"end_time":"2012/08/23 00:00:00 -0400","original":"8/22/2012","granularity":"day","time":"2012/08/22 00:00:00 -0400"},"checklists":1,"longitude":-85.8753902,"id":"adtlbsexveiw","location":"North Manitou Island Ferry Crossing"},"type":"Feature","geometry":{"type":"Point","coordinates":[-85.8753902,45.0417472]}},{"properties":{"latitude":45.1417498,"date":{"end_time":"2012/08/23 00:00:00 -0400","original":"8/22/2012","granularity":"day","time":"2012/08/22 00:00:00 -0400"},"checklists":1,"longitude":-86.0090285,"id":"adtlbsllelv9","location":"North Manitou Island--Pole Bridge"},"type":"Feature","geometry":{"type":"Point","coordinates":[-86.0090285,45.1417498]}},{"properties":{"latitude":45.0593874,"date":{"end_time":"2012/08/24 00:00:00 -0400","original":"8/23/2012","granularity":"day","time":"2012/08/23 00:00:00 -0400"},"checklists":1,"longitude":-85.9631048,"id":"adtlbsf0hqvt","location":"North Manitou Island--Dimmick's Point"},"type":"Feature","geometry":{"type":"Point","coordinates":[-85.9631048,45.0593874]}},{"properties":{"latitude":45.0908229,"date":{"end_time":"2012/08/24 00:00:00 -0400","original":"8/23/2012","granularity":"day","time":"2012/08/23 00:00:00 -0400"},"checklists":1,"longitude":-85.9849959,"id":"adtlbskbc7qq","location":"North Manitou Island--Old School Ruins"},"type":"Feature","geometry":{"type":"Point","coordinates":[-85.9849959,45.0908229]}},{"properties":{"latitude":41.6630486,"date":{"end_time":"2012/09/01 00:00:00 -0400","original":"8/31/2012","granularity":"day","time":"2012/08/31 00:00:00 -0400"},"checklists":1,"longitude":-87.0366169,"id":"adtlbsn4qm77","location":"Indiana Dunes State Park"},"type":"Feature","geometry":{"type":"Point","coordinates":[-87.0366169,41.6630486]}},{"properties":{"latitude":42.7963964,"date":{"end_time":"2012/09/11 00:00:00 -0400","original":"9/10/2012","granularity":"day","time":"2012/09/10 00:00:00 -0400"},"checklists":1,"longitude":-86.0809447,"id":"adtlbsouh9s2","location":"Chicago Drive and M-31"},"type":"Feature","geometry":{"type":"Point","coordinates":[-86.0809447,42.7963964]}},{"properties":{"latitude":43.158319,"date":{"end_time":"2012/10/07 00:00:00 -0400","original":"10/6/2012","granularity":"day","time":"2012/10/06 00:00:00 -0400"},"checklists":1,"longitude":-85.3149891,"id":"adtlbsgrucm7","location":"Simpson and Van Hoose"},"type":"Feature","geometry":{"type":"Point","coordinates":[-85.3149891,43.158319]}},{"properties":{"latitude":43.0999092,"date":{"end_time":"2012/10/07 00:00:00 -0400","original":"10/6/2012","granularity":"day","time":"2012/10/06 00:00:00 -0400"},"checklists":1,"longitude":-85.4117318,"id":"adtlbsngw8fo","location":"Steele Lake"},"type":"Feature","geometry":{"type":"Point","coordinates":[-85.4117318,43.0999092]}},{"properties":{"latitude":43.4377139,"date":{"end_time":"2012/10/09 00:00:00 -0400","original":"10/8/2012","granularity":"day","time":"2012/10/08 00:00:00 -0400"},"checklists":1,"longitude":-85.6645203,"id":"adtlbsrah4qb","location":"Croton Dam"},"type":"Feature","geometry":{"type":"Point","coordinates":[-85.6645203,43.4377139]}},{"properties":{"latitude":43.4870747,"date":{"end_time":"2012/10/09 00:00:00 -0400","original":"10/8/2012","granularity":"day","time":"2012/10/08 00:00:00 -0400"},"checklists":1,"longitude":-85.6348658,"id":"adtlbsf22snr","location":"Hardy Dam Rustic Nature Trail"},"type":"Feature","geometry":{"type":"Point","coordinates":[-85.6348658,43.4870747]}},{"properties":{"latitude":43.5034949,"date":{"end_time":"2012/10/09 00:00:00 -0400","original":"10/8/2012","granularity":"day","time":"2012/10/08 00:00:00 -0400"},"checklists":1,"longitude":-85.5883963,"id":"adtlbsk6k586","location":"Newaygo SP"},"type":"Feature","geometry":{"type":"Point","coordinates":[-85.5883963,43.5034949]}},{"properties":{"latitude":43.2832664,"date":{"end_time":"2012/10/09 00:00:00 -0400","original":"10/8/2012","granularity":"day","time":"2012/10/08 00:00:00 -0400"},"checklists":1,"longitude":-85.6127858,"id":"adtlbsr09s3y","location":"Fisk Knob"},"type":"Feature","geometry":{"type":"Point","coordinates":[-85.6127858,43.2832664]}},{"properties":{"latitude":43.3103801,"date":{"end_time":"2012/10/09 00:00:00 -0400","original":"10/8/2012","granularity":"day","time":"2012/10/08 00:00:00 -0400"},"checklists":1,"longitude":-85.6294631,"id":"adtlbsln1jcw","location":"Ensley Nature Preserve"},"type":"Feature","geometry":{"type":"Point","coordinates":[-85.6294631,43.3103801]}},{"properties":{"latitude":43.3553284,"date":{"end_time":"2012/10/09 00:00:00 -0400","original":"10/8/2012","granularity":"day","time":"2012/10/08 00:00:00 -0400"},"checklists":1,"longitude":-85.712285,"id":"adtlbsscf9f3","location":"Old Rice Lake Muck Flats"},"type":"Feature","geometry":{"type":"Point","coordinates":[-85.712285,43.3553284]}},{"properties":{"latitude":43.5898845,"date":{"end_time":"2012/11/04 00:00:00 -0400","original":"11/3/2012","granularity":"day","time":"2012/11/03 00:00:00 -0400"},"checklists":1,"longitude":-84.2454996,"id":"adtlbsgsg11e","location":"Whiting Overlook Park"},"type":"Feature","geometry":{"type":"Point","coordinates":[-84.2454996,43.5898845]}},{"properties":{"latitude":43.5951891,"date":{"end_time":"2012/11/04 00:00:00 -0400","original":"11/3/2012","granularity":"day","time":"2012/11/03 00:00:00 -0400"},"checklists":1,"longitude":-84.1337107,"id":"adtlbsqkk9n2","location":"Carter Rd and Fisher Rd Pond"},"type":"Feature","geometry":{"type":"Point","coordinates":[-84.1337107,43.5951891]}},{"properties":{"latitude":43.9478294,"date":{"end_time":"2012/11/04 00:00:00 -0400","original":"11/3/2012","granularity":"day","time":"2012/11/03 00:00:00 -0400"},"checklists":1,"longitude":-83.2853419,"id":"adtlbsk1kkqz","location":"Caseville Jetty"},"type":"Feature","geometry":{"type":"Point","coordinates":[-83.2853419,43.9478294]}},{"properties":{"latitude":43.5828,"date":{"end_time":"2012/11/04 00:00:00 -0400","original":"11/3/2012","granularity":"day","time":"2012/11/03 00:00:00 -0400"},"checklists":1,"longitude":-84.2309,"id":"adtlbso5yc2m","location":"Dow Ponds (no access)"},"type":"Feature","geometry":{"type":"Point","coordinates":[-84.2309,43.5828]}},{"properties":{"latitude":43.69706,"date":{"end_time":"2012/11/04 00:00:00 -0400","original":"11/3/2012","granularity":"day","time":"2012/11/03 00:00:00 -0400"},"checklists":1,"longitude":-83.51723,"id":"adtlbsqvldxa","location":"Fish Point SWA"},"type":"Feature","geometry":{"type":"Point","coordinates":[-83.51723,43.69706]}},{"properties":{"latitude":43.0648731,"date":{"end_time":"2012/11/11 00:00:00 -0500","original":"11/10/2012","granularity":"day","time":"2012/11/10 00:00:00 -0500"},"checklists":1,"longitude":-85.4971355,"id":"adtlbsiqk6c8","location":"Kreuter Rd -- Spruce Patch near Resistor Facility"},"type":"Feature","geometry":{"type":"Point","coordinates":[-85.4971355,43.0648731]}},{"properties":{"latitude":41.84631,"date":{"end_time":"2012/11/22 00:00:00 -0500","original":"11/21/2012","granularity":"day","time":"2012/11/21 00:00:00 -0500"},"checklists":1,"longitude":-88.09473,"id":"adtlbskaxf3r","location":"Du Page"},"type":"Feature","geometry":{"type":"Point","coordinates":[-88.09473,41.84631]}},{"properties":{"latitude":42.5265824,"date":{"end_time":"2012/12/14 00:00:00 -0500","original":"12/13/2012","granularity":"day","time":"2012/12/13 00:00:00 -0500"},"checklists":1,"longitude":-83.672905,"id":"adtlbsn5kkbm","location":"Kensington Metropark (Livingston Co.)"},"type":"Feature","geometry":{"type":"Point","coordinates":[-83.672905,42.5265824]}},{"properties":{"latitude":52.2037164,"date":{"end_time":"2012/12/15 00:00:00 -0500","original":"12/14/2012","granularity":"day","time":"2012/12/14 00:00:00 -0500"},"checklists":1,"longitude":5.8151352,"id":"adtlbsmek6kj","location":"A1 Veluwe"},"type":"Feature","geometry":{"type":"Point","coordinates":[5.8151352,52.2037164]}},{"properties":{"latitude":52.1645924,"date":{"end_time":"2012/12/16 00:00:00 -0500","original":"12/15/2012","granularity":"day","time":"2012/12/15 00:00:00 -0500"},"checklists":1,"longitude":5.9065127,"id":"adtlbsjtjczy","location":"Het Leesten"},"type":"Feature","geometry":{"type":"Point","coordinates":[5.9065127,52.1645924]}},{"properties":{"latitude":52.0163506,"date":{"end_time":"2012/12/25 00:00:00 -0500","original":"12/24/2012","granularity":"day","time":"2012/12/24 00:00:00 -0500"},"checklists":1,"longitude":5.922575,"id":"adtlbsrjtm7c","location":"A12/A50"},"type":"Feature","geometry":{"type":"Point","coordinates":[5.922575,52.0163506]}},{"properties":{"latitude":52.0856244,"date":{"end_time":"2012/12/25 00:00:00 -0500","original":"12/24/2012","granularity":"day","time":"2012/12/24 00:00:00 -0500"},"checklists":1,"longitude":5.8383751,"id":"adtlbsr1rys0","location":"National Park De Hoge Veluwe"},"type":"Feature","geometry":{"type":"Point","coordinates":[5.8383751,52.0856244]}},{"properties":{"latitude":51.9910396,"date":{"end_time":"2012/12/25 00:00:00 -0500","original":"12/24/2012","granularity":"day","time":"2012/12/24 00:00:00 -0500"},"checklists":1,"longitude":5.9041643,"id":"adtlbss8dqfr","location":"Sonsbeek Park"},"type":"Feature","geometry":{"type":"Point","coordinates":[5.9041643,51.9910396]}},{"properties":{"latitude":52.2237214,"date":{"end_time":"2012/12/30 00:00:00 -0500","original":"12/29/2012","granularity":"day","time":"2012/12/29 00:00:00 -0500"},"checklists":1,"longitude":6.171869,"id":"adtlbsu88jz4","location":"Wilp (Gelderland)"},"type":"Feature","geometry":{"type":"Point","coordinates":[6.171869,52.2237214]}},{"properties":{"latitude":52.2323959,"date":{"end_time":"2012/12/30 00:00:00 -0500","original":"12/29/2012","granularity":"day","time":"2012/12/29 00:00:00 -0500"},"checklists":1,"longitude":6.1600673,"id":"adtlbssyc661","location":"Wilp (Overijssel)"},"type":"Feature","geometry":{"type":"Point","coordinates":[6.1600673,52.2323959]}},{"properties":{"latitude":52.2239637,"date":{"end_time":"2013/01/03 00:00:00 -0500","original":"1/2/2013","granularity":"day","time":"2013/01/02 00:00:00 -0500"},"checklists":1,"longitude":5.9668636,"id":"adtlbsenl7rs","location":"Verstrijderspark"},"type":"Feature","geometry":{"type":"Point","coordinates":[5.9668636,52.2239637]}},{"properties":{"latitude":52.3030438,"date":{"end_time":"2013/01/06 00:00:00 -0500","original":"1/5/2013","granularity":"day","time":"2013/01/05 00:00:00 -0500"},"checklists":1,"longitude":4.8375064,"id":"adtlbsufvuvt","location":"A9 naar Amsterlveen"},"type":"Feature","geometry":{"type":"Point","coordinates":[4.8375064,52.3030438]}},{"properties":{"latitude":52.1869385,"date":{"end_time":"2013/01/06 00:00:00 -0500","original":"1/5/2013","granularity":"day","time":"2013/01/05 00:00:00 -0500"},"checklists":1,"longitude":5.4129153,"id":"adtlbsndx1ou","location":"Amersfoort - A1"},"type":"Feature","geometry":{"type":"Point","coordinates":[5.4129153,52.1869385]}},{"properties":{"latitude":52.4650342,"date":{"end_time":"2013/01/06 00:00:00 -0500","original":"1/5/2013","granularity":"day","time":"2013/01/05 00:00:00 -0500"},"checklists":1,"longitude":4.7959643,"id":"adtlbsi67ab0","location":"Westzaan - A8"},"type":"Feature","geometry":{"type":"Point","coordinates":[4.7959643,52.4650342]}},{"properties":{"latitude":52.4018009,"date":{"end_time":"2013/01/06 00:00:00 -0500","original":"1/5/2013","granularity":"day","time":"2013/01/05 00:00:00 -0500"},"checklists":1,"longitude":4.5778686,"id":"adtlbsmlw9v7","location":"Zuid-Kennemerland Nationaal Park--Erebegraafplaats"},"type":"Feature","geometry":{"type":"Point","coordinates":[4.5778686,52.4018009]}},{"properties":{"latitude":52.4173027,"date":{"end_time":"2013/01/06 00:00:00 -0500","original":"1/5/2013","granularity":"day","time":"2013/01/05 00:00:00 -0500"},"checklists":1,"longitude":4.6419841,"id":"adtlbsesndet","location":"N208--Santpoort tot Bloemendaal"},"type":"Feature","geometry":{"type":"Point","coordinates":[4.6419841,52.4173027]}},{"properties":{"latitude":52.3984132,"date":{"end_time":"2013/01/06 00:00:00 -0500","original":"1/5/2013","granularity":"day","time":"2013/01/05 00:00:00 -0500"},"checklists":1,"longitude":4.5625049,"id":"adtlbsf7ui1k","location":"Zuid-Kennemerland Nationaal Park--Bokkedoorns Wandelroute"},"type":"Feature","geometry":{"type":"Point","coordinates":[4.5625049,52.3984132]}},{"properties":{"latitude":52.453718,"date":{"end_time":"2013/01/06 00:00:00 -0500","original":"1/5/2013","granularity":"day","time":"2013/01/05 00:00:00 -0500"},"checklists":1,"longitude":4.6267062,"id":"adtlbsj728nu","location":"IJmuiden--Zeeweg"},"type":"Feature","geometry":{"type":"Point","coordinates":[4.6267062,52.453718]}},{"properties":{"latitude":52.4007861,"date":{"end_time":"2013/01/06 00:00:00 -0500","original":"1/5/2013","granularity":"day","time":"2013/01/05 00:00:00 -0500"},"checklists":1,"longitude":4.5415622,"id":"adtlbsp46xme","location":"Zuid-Kennemerland Nationaal Park--Strand"},"type":"Feature","geometry":{"type":"Point","coordinates":[4.5415622,52.4007861]}},{"properties":{"latitude":52.2258226,"date":{"end_time":"2013/01/06 00:00:00 -0500","original":"1/5/2013","granularity":"day","time":"2013/01/05 00:00:00 -0500"},"checklists":1,"longitude":5.8543169,"id":"adtlbsibmpm5","location":"Amersfoortsebos"},"type":"Feature","geometry":{"type":"Point","coordinates":[5.8543169,52.2258226]}},{"properties":{"latitude":43.0953993,"date":{"end_time":"2013/01/16 00:00:00 -0500","original":"1/15/2013","granularity":"day","time":"2013/01/15 00:00:00 -0500"},"checklists":1,"longitude":-85.3521903,"id":"adtlbshfngn5","location":"Lincoln Lake and Strotheide"},"type":"Feature","geometry":{"type":"Point","coordinates":[-85.3521903,43.0953993]}},{"properties":{"latitude":43.1444913,"date":{"end_time":"2013/02/17 00:00:00 -0500","original":"2/16/2013","granularity":"day","time":"2013/02/16 00:00:00 -0500"},"checklists":1,"longitude":-85.315876,"id":"adtlbselqgk6","location":"Brewster Lane to Bearslee Lake"},"type":"Feature","geometry":{"type":"Point","coordinates":[-85.315876,43.1444913]}},{"properties":{"latitude":42.6726547,"date":{"end_time":"2013/02/23 00:00:00 -0500","original":"2/22/2013","granularity":"day","time":"2013/02/22 00:00:00 -0500"},"checklists":1,"longitude":-85.9746265,"id":"adtlbssaofk2","location":"135th and 44th Fields"},"type":"Feature","geometry":{"type":"Point","coordinates":[-85.9746265,42.6726547]}},{"properties":{"latitude":42.8127181,"date":{"end_time":"2013/03/15 00:00:00 -0400","original":"3/14/2013","granularity":"day","time":"2013/03/14 00:00:00 -0400"},"checklists":1,"longitude":-85.3559589,"id":"adtlbsfvyxe3","location":"84th near Alden Nash - Marsh"},"type":"Feature","geometry":{"type":"Point","coordinates":[-85.3559589,42.8127181]}},{"properties":{"latitude":43.2196086,"date":{"end_time":"2013/03/20 00:00:00 -0400","original":"3/19/2013","granularity":"day","time":"2013/03/19 00:00:00 -0400"},"checklists":1,"longitude":-85.598613,"id":"adtlbshrasnu","location":"17 Mile Rd and Woodlawn Hills Dr"},"type":"Feature","geometry":{"type":"Point","coordinates":[-85.598613,43.2196086]}},{"properties":{"latitude":43.1755434,"date":{"end_time":"2013/03/20 00:00:00 -0400","original":"3/19/2013","granularity":"day","time":"2013/03/19 00:00:00 -0400"},"checklists":1,"longitude":-85.5205393,"id":"adtlbsj4pade","location":"M-57 and Teft Ave"},"type":"Feature","geometry":{"type":"Point","coordinates":[-85.5205393,43.1755434]}},{"properties":{"latitude":42.7911144,"date":{"end_time":"2013/03/24 00:00:00 -0400","original":"3/23/2013","granularity":"day","time":"2013/03/23 00:00:00 -0400"},"checklists":1,"longitude":-86.0968709,"id":"adtlbsowdmss","location":"Macatawa Area Express Headquarters"},"type":"Feature","geometry":{"type":"Point","coordinates":[-86.0968709,42.7911144]}},{"properties":{"latitude":42.801009,"date":{"end_time":"2013/03/30 00:00:00 -0400","original":"3/29/2013","granularity":"day","time":"2013/03/29 00:00:00 -0400"},"checklists":1,"longitude":-85.585025,"id":"adtlbsqnhm7k","location":"Hanna Lake Ave north of 92nd St"},"type":"Feature","geometry":{"type":"Point","coordinates":[-85.585025,42.801009]}},{"properties":{"latitude":42.7719849,"date":{"end_time":"2013/04/02 00:00:00 -0400","original":"4/1/2013","granularity":"day","time":"2013/04/01 00:00:00 -0400"},"checklists":1,"longitude":-86.2134133,"id":"adtlbsk2k0ki","location":"Macatawa--South Breakwall"},"type":"Feature","geometry":{"type":"Point","coordinates":[-86.2134133,42.7719849]}},{"properties":{"latitude":42.7993683,"date":{"end_time":"2013/04/11 00:00:00 -0400","original":"4/10/2013","granularity":"day","time":"2013/04/10 00:00:00 -0400"},"checklists":1,"longitude":-85.5891609,"id":"adtlbsn84d5d","location":"92nd and Hannah Lake (flooded gulley)"},"type":"Feature","geometry":{"type":"Point","coordinates":[-85.5891609,42.7993683]}},{"properties":{"latitude":42.797542,"date":{"end_time":"2013/04/11 00:00:00 -0400","original":"4/10/2013","granularity":"day","time":"2013/04/10 00:00:00 -0400"},"checklists":1,"longitude":-85.7292366,"id":"adtlbspw9j88","location":"92nd btwn Ivanrest and Byron Center (flooded field)"},"type":"Feature","geometry":{"type":"Point","coordinates":[-85.7292366,42.797542]}},{"properties":{"latitude":42.7683128,"date":{"end_time":"2013/04/11 00:00:00 -0400","original":"4/10/2013","granularity":"day","time":"2013/04/10 00:00:00 -0400"},"checklists":1,"longitude":-85.7424545,"id":"adtlbssl7q4q","location":"Ivanrest and 108th"},"type":"Feature","geometry":{"type":"Point","coordinates":[-85.7424545,42.7683128]}},{"properties":{"latitude":42.7972901,"date":{"end_time":"2013/04/11 00:00:00 -0400","original":"4/10/2013","granularity":"day","time":"2013/04/10 00:00:00 -0400"},"checklists":1,"longitude":-85.7007408,"id":"adtlbshkg69t","location":"92nd St RRxing"},"type":"Feature","geometry":{"type":"Point","coordinates":[-85.7007408,42.7972901]}},{"properties":{"latitude":42.7678087,"date":{"end_time":"2013/04/13 00:00:00 -0400","original":"4/12/2013","granularity":"day","time":"2013/04/12 00:00:00 -0400"},"checklists":1,"longitude":-85.5092525,"id":"adtlbsu6db2j","location":"108th west of M-37 (flooded field)"},"type":"Feature","geometry":{"type":"Point","coordinates":[-85.5092525,42.7678087]}},{"properties":{"latitude":42.7692264,"date":{"end_time":"2013/04/13 00:00:00 -0400","original":"4/12/2013","granularity":"day","time":"2013/04/12 00:00:00 -0400"},"checklists":1,"longitude":-85.5531549,"id":"adtlbsm83hn9","location":"108th btwn E Paris and Patterson (flooded field)"},"type":"Feature","geometry":{"type":"Point","coordinates":[-85.5531549,42.7692264]}},{"properties":{"latitude":42.7830551,"date":{"end_time":"2013/04/13 00:00:00 -0400","original":"4/12/2013","granularity":"day","time":"2013/04/12 00:00:00 -0400"},"checklists":1,"longitude":-85.7027149,"id":"adtlbst2p7fb","location":"100th and Burlingame"},"type":"Feature","geometry":{"type":"Point","coordinates":[-85.7027149,42.7830551]}},{"properties":{"latitude":42.582205,"date":{"end_time":"2013/04/14 00:00:00 -0400","original":"4/13/2013","granularity":"day","time":"2013/04/13 00:00:00 -0400"},"checklists":1,"longitude":-83.295046,"id":"adtlbsplytuw","location":"Kirk in the Hills"},"type":"Feature","geometry":{"type":"Point","coordinates":[-83.295046,42.582205]}},{"properties":{"latitude":42.8599856,"date":{"end_time":"2013/04/14 00:00:00 -0400","original":"4/13/2013","granularity":"day","time":"2013/04/13 00:00:00 -0400"},"checklists":1,"longitude":-84.9124718,"id":"adtlbshy4xbo","location":"Portland Exit, I-196"},"type":"Feature","geometry":{"type":"Point","coordinates":[-84.9124718,42.8599856]}},{"properties":{"latitude":42.7975105,"date":{"end_time":"2013/04/16 00:00:00 -0400","original":"4/15/2013","granularity":"day","time":"2013/04/15 00:00:00 -0400"},"checklists":1,"longitude":-86.126976,"id":"adtlbsflmujb","location":"Aniline and Ottawa Beach Rd"},"type":"Feature","geometry":{"type":"Point","coordinates":[-86.126976,42.7975105]}},{"properties":{"latitude":42.7886613,"date":{"end_time":"2013/04/21 00:00:00 -0400","original":"4/20/2013","granularity":"day","time":"2013/04/20 00:00:00 -0400"},"checklists":1,"longitude":-86.1770582,"id":"adtlbsjxzj82","location":"160th Ave end"},"type":"Feature","geometry":{"type":"Point","coordinates":[-86.1770582,42.7886613]}}],"is_temporal":true,"author":{"url":"","metadata":null,"contact_name":null,"contact_address":null,"source":null,"contact_phone":null},"source":"","pagination":{"sort":null,"start":0,"total":667,"limit":1000000},"state":"complete","tags":"","published":"2014-08-17T00:33:25-04:00","id":349687}