{"type":"FeatureCollection","data_type":"Dataset","url_type":null,"permissions":[{"permissions":{"download":true,"view":true},"group_id":"everyone"}],"classification":null,"title":"MHBebirdlocations","count":965,"stream_id":351518,"contributor":{"url":"http://geocommons.com/users/70900","name":"glacierbirder"},"data_attributes":null,"calculation_params":null,"icon_link":null,"link":"http://geocommons.com/overlays/351518.json","extent":[-176.655,-34.9198,116.396,65.2875],"geometry_types":["point"],"unique_name":null,"name":"MHBebirdlocations","feature_count":965,"description":"Matt Brooks eBird location data","next_feature":null,"is_raster":false,"short_classification":"Y","stats":{"latitude":{"max":65.287476,"variance":427.693621758998,"mean":31.1927399454922,"stdev":20.6807548643418,"min":-34.9197542,"median":32.2612251},"date":{"max":"2013/03/04 00:00:00 -0500","variance":8.83502908444557e+15,"mean":"2006/10/28 12:58:26 -0400","stdev":93994835.4136841,"min":"1989/12/18 00:00:00 -0500","median":"2006/03/10 00:00:00 -0500"},"total":{"max":83,"variance":21.5422247543713,"mean":2.34715025906736,"stdev":4.64136022674079,"min":1,"median":1},"longitude":{"max":116.3963699,"variance":2436.88802247356,"mean":-103.309549366114,"stdev":49.364846018939,"min":-176.6549635,"median":-110.584312}},"features":[{"properties":{"latitude":58.4168077,"date":{"end_time":"2003/04/21 00:00:00 -0400","original":"4/20/2003","granularity":"day","time":"2003/04/20 00:00:00 -0400"},"total":83,"longitude":-134.5470929,"id":"advy9tir6m9u","location":"Juneau--Mendenhall Visitor Center-Trails"},"type":"Feature","geometry":{"type":"Point","coordinates":[-134.5470929,58.4168077]}},{"properties":{"latitude":32.278549,"date":{"end_time":"2005/12/07 00:00:00 -0500","original":"12/6/2005","granularity":"day","time":"2005/12/06 00:00:00 -0500"},"total":54,"longitude":-111.022495,"id":"advy9tu3gjxk","location":"Sweetwater Wetlands"},"type":"Feature","geometry":{"type":"Point","coordinates":[-111.022495,32.278549]}},{"properties":{"latitude":58.2964435,"date":{"end_time":"2003/10/07 00:00:00 -0400","original":"10/6/2003","granularity":"day","time":"2003/10/06 00:00:00 -0400"},"total":53,"longitude":-134.4303417,"id":"advy9trbegtr","location":"Juneau - 3320B Douglas Hwy"},"type":"Feature","geometry":{"type":"Point","coordinates":[-134.4303417,58.2964435]}},{"properties":{"latitude":58.3523993,"date":{"end_time":"2003/04/27 00:00:00 -0400","original":"4/26/2003","granularity":"day","time":"2003/04/26 00:00:00 -0400"},"total":43,"longitude":-134.5945144,"id":"advy9tt69flr","location":"Juneau--Mendenhall Wetlands-Airport Dike Trail"},"type":"Feature","geometry":{"type":"Point","coordinates":[-134.5945144,58.3523993]}},{"properties":{"latitude":32.2336857,"date":{"end_time":"2007/03/18 00:00:00 -0400","original":"3/17/2007","granularity":"day","time":"2007/03/17 00:00:00 -0400"},"total":36,"longitude":-110.9681153,"id":"advy9twd0evg","location":"938 N. 6th Ave - Matt's House"},"type":"Feature","geometry":{"type":"Point","coordinates":[-110.9681153,32.2336857]}},{"properties":{"latitude":58.4057814,"date":{"end_time":"2003/05/08 00:00:00 -0400","original":"5/7/2003","granularity":"day","time":"2003/05/07 00:00:00 -0400"},"total":27,"longitude":-134.5713186,"id":"advy9twy4ont","location":"Juneau--Mendenhall Forelands-Moose Lake area"},"type":"Feature","geometry":{"type":"Point","coordinates":[-134.5713186,58.4057814]}},{"properties":{"latitude":32.4767499,"date":{"end_time":"2007/01/06 00:00:00 -0500","original":"1/5/2007","granularity":"day","time":"2007/01/05 00:00:00 -0500"},"total":23,"longitude":-111.310215,"id":"advy9tqtqsy9","location":"Simpson Farm - TAS Cons. Easement"},"type":"Feature","geometry":{"type":"Point","coordinates":[-111.310215,32.4767499]}},{"properties":{"latitude":58.3495957,"date":{"end_time":"2003/05/19 00:00:00 -0400","original":"5/18/2003","granularity":"day","time":"2003/05/18 00:00:00 -0400"},"total":22,"longitude":-134.5714474,"id":"advy9tlko311","location":"Juneau--Mendenhall Wetlands-E of river mouth"},"type":"Feature","geometry":{"type":"Point","coordinates":[-134.5714474,58.3495957]}},{"properties":{"latitude":58.6669413,"date":{"end_time":"2004/02/28 00:00:00 -0500","original":"2/27/2004","granularity":"day","time":"2004/02/27 00:00:00 -0500"},"total":22,"longitude":-134.9416351,"id":"advy9tu9rmhl","location":"Point Bridget SP (Juneau)"},"type":"Feature","geometry":{"type":"Point","coordinates":[-134.9416351,58.6669413]}},{"properties":{"latitude":32.247964,"date":{"end_time":"2004/01/01 00:00:00 -0500","original":"12/31/2003","granularity":"day","time":"2003/12/31 00:00:00 -0500"},"total":20,"longitude":-106.819833,"id":"advy9ti2k74u","location":"Mesilla Valley Bosque SP"},"type":"Feature","geometry":{"type":"Point","coordinates":[-106.819833,32.247964]}},{"properties":{"latitude":58.3311702,"date":{"end_time":"2003/07/19 00:00:00 -0400","original":"7/18/2003","granularity":"day","time":"2003/07/18 00:00:00 -0400"},"total":16,"longitude":-134.5996857,"id":"advy9to2f4kf","location":"Juneau--Mendenhall Wetlands-Fish Creek Delta"},"type":"Feature","geometry":{"type":"Point","coordinates":[-134.5996857,58.3311702]}},{"properties":{"latitude":32.4585014,"date":{"end_time":"2007/01/06 00:00:00 -0500","original":"1/5/2007","granularity":"day","time":"2007/01/05 00:00:00 -0500"},"total":16,"longitude":-111.2882423,"id":"advy9tn35s8j","location":"Martin Farm - TAS Cons. Easement"},"type":"Feature","geometry":{"type":"Point","coordinates":[-111.2882423,32.4585014]}},{"properties":{"latitude":31.6736175,"date":{"end_time":"2007/01/06 00:00:00 -0500","original":"1/5/2007","granularity":"day","time":"2007/01/05 00:00:00 -0500"},"total":16,"longitude":-111.053195,"id":"advy9tiah57p","location":"Esperanza Conservation Easement - TAS"},"type":"Feature","geometry":{"type":"Point","coordinates":[-111.053195,31.6736175]}},{"properties":{"latitude":32.2085164,"date":{"end_time":"2007/01/04 00:00:00 -0500","original":"1/3/2007","granularity":"day","time":"2007/01/03 00:00:00 -0500"},"total":15,"longitude":-110.9111881,"id":"advy9tpkj9fa","location":"Randolph GC/Hardesty Bldg"},"type":"Feature","geometry":{"type":"Point","coordinates":[-110.9111881,32.2085164]}},{"properties":{"latitude":58.5283716,"date":{"end_time":"2003/04/27 00:00:00 -0400","original":"4/26/2003","granularity":"day","time":"2003/04/26 00:00:00 -0400"},"total":14,"longitude":-134.8270512,"id":"advy9tnjun9v","location":"Eagle Beach SRA (Juneau)"},"type":"Feature","geometry":{"type":"Point","coordinates":[-134.8270512,58.5283716]}},{"properties":{"latitude":44.8239169,"date":{"end_time":"2006/12/29 00:00:00 -0500","original":"12/28/2006","granularity":"day","time":"2006/12/28 00:00:00 -0500"},"total":14,"longitude":-93.0384493,"id":"advy9tnbd4nr","location":"paths near Sarah's moms house"},"type":"Feature","geometry":{"type":"Point","coordinates":[-93.0384493,44.8239169]}},{"properties":{"latitude":32.4261364,"date":{"end_time":"2007/02/06 00:00:00 -0500","original":"2/5/2007","granularity":"day","time":"2007/02/05 00:00:00 -0500"},"total":13,"longitude":-110.9076127,"id":"advy9tn9p2o8","location":"Catalina SP"},"type":"Feature","geometry":{"type":"Point","coordinates":[-110.9076127,32.4261364]}},{"properties":{"latitude":58.7295022,"date":{"end_time":"2003/05/04 00:00:00 -0400","original":"5/3/2003","granularity":"day","time":"2003/05/03 00:00:00 -0400"},"total":12,"longitude":-134.9845505,"id":"advy9tvmp6fp","location":"Berner's Bay"},"type":"Feature","geometry":{"type":"Point","coordinates":[-134.9845505,58.7295022]}},{"properties":{"latitude":31.539,"date":{"end_time":"2004/10/12 00:00:00 -0400","original":"10/11/2004","granularity":"day","time":"2004/10/11 00:00:00 -0400"},"total":12,"longitude":-110.761,"id":"advy9towhxzs","location":"Patagonia--Patons' yard"},"type":"Feature","geometry":{"type":"Point","coordinates":[-110.761,31.539]}},{"properties":{"latitude":32.2298515,"date":{"end_time":"2004/10/14 00:00:00 -0400","original":"10/13/2004","granularity":"day","time":"2004/10/13 00:00:00 -0400"},"total":12,"longitude":-109.8243175,"id":"advy9txoozmq","location":"Willcox--Lake Cochise and Twin Lakes Golf Course"},"type":"Feature","geometry":{"type":"Point","coordinates":[-109.8243175,32.2298515]}},{"properties":{"latitude":31.720328,"date":{"end_time":"2007/04/02 00:00:00 -0400","original":"4/1/2007","granularity":"day","time":"2007/04/01 00:00:00 -0400"},"total":12,"longitude":-110.879045,"id":"advy9tx3jqf8","location":"Madera Canyon--Madera Kubo B&amp;B"},"type":"Feature","geometry":{"type":"Point","coordinates":[-110.879045,31.720328]}},{"properties":{"latitude":58.3454294,"date":{"end_time":"2003/05/14 00:00:00 -0400","original":"5/13/2003","granularity":"day","time":"2003/05/13 00:00:00 -0400"},"total":11,"longitude":-134.4974291,"id":"advy9txirxym","location":"Juneau--Pioneer Home Marsh"},"type":"Feature","geometry":{"type":"Point","coordinates":[-134.4974291,58.3454294]}},{"properties":{"latitude":58.3236156,"date":{"end_time":"2004/07/12 00:00:00 -0400","original":"7/11/2004","granularity":"day","time":"2004/07/11 00:00:00 -0400"},"total":11,"longitude":-134.3857527,"id":"advy9tl8f8h5","location":"Juneau - Mt. Juneau Ridge"},"type":"Feature","geometry":{"type":"Point","coordinates":[-134.3857527,58.3236156]}},{"properties":{"latitude":31.6128313,"date":{"end_time":"2007/01/15 00:00:00 -0500","original":"1/14/2007","granularity":"day","time":"2007/01/14 00:00:00 -0500"},"total":11,"longitude":-111.040829,"id":"advy9tkhj25r","location":"De Anza Trail--Tubac"},"type":"Feature","geometry":{"type":"Point","coordinates":[-111.040829,31.6128313]}},{"properties":{"latitude":58.3022738,"date":{"end_time":"2003/10/28 00:00:00 -0500","original":"10/27/2003","granularity":"day","time":"2003/10/27 00:00:00 -0500"},"total":10,"longitude":-134.4198704,"id":"advy9tt75bwc","location":"Juneau--downtown"},"type":"Feature","geometry":{"type":"Point","coordinates":[-134.4198704,58.3022738]}},{"properties":{"latitude":31.712726,"date":{"end_time":"2007/04/02 00:00:00 -0400","original":"4/1/2007","granularity":"day","time":"2007/04/01 00:00:00 -0400"},"total":10,"longitude":-110.874989,"id":"advy9tpbrmgh","location":"Madera Canyon--upper canyon"},"type":"Feature","geometry":{"type":"Point","coordinates":[-110.874989,31.712726]}},{"properties":{"latitude":32.2314793,"date":{"end_time":"2011/05/22 00:00:00 -0400","original":"5/21/2011","granularity":"day","time":"2011/05/21 00:00:00 -0400"},"total":10,"longitude":-110.9659102,"id":"advy9twrqjjl","location":"Tucson Audubon Society Office"},"type":"Feature","geometry":{"type":"Point","coordinates":[-110.9659102,32.2314793]}},{"properties":{"latitude":32.253839,"date":{"end_time":"2012/09/03 00:00:00 -0400","original":"9/2/2012","granularity":"day","time":"2012/09/02 00:00:00 -0400"},"total":10,"longitude":-110.955826,"id":"advy9tphc746","location":"1024 E Copper St"},"type":"Feature","geometry":{"type":"Point","coordinates":[-110.955826,32.253839]}},{"properties":{"latitude":58.3088705,"date":{"end_time":"2003/06/01 00:00:00 -0400","original":"5/31/2003","granularity":"day","time":"2003/05/31 00:00:00 -0400"},"total":9,"longitude":-134.381304,"id":"advy9tvg928d","location":"Juneau--Perseverance Trail and Gold Crk Basin"},"type":"Feature","geometry":{"type":"Point","coordinates":[-134.381304,58.3088705]}},{"properties":{"latitude":58.4132114,"date":{"end_time":"2003/06/29 00:00:00 -0400","original":"6/28/2003","granularity":"day","time":"2003/06/28 00:00:00 -0400"},"total":9,"longitude":-134.6065092,"id":"advy9to6gqhm","location":"Juneau--Community Gardens"},"type":"Feature","geometry":{"type":"Point","coordinates":[-134.6065092,58.4132114]}},{"properties":{"latitude":31.508,"date":{"end_time":"2004/10/13 00:00:00 -0400","original":"10/12/2004","granularity":"day","time":"2004/10/12 00:00:00 -0400"},"total":9,"longitude":-110.802,"id":"advy9txhzd97","location":"Patagonia Roadside Rest Area"},"type":"Feature","geometry":{"type":"Point","coordinates":[-110.802,31.508]}},{"properties":{"latitude":31.739938,"date":{"end_time":"2007/03/10 00:00:00 -0500","original":"3/9/2007","granularity":"day","time":"2007/03/09 00:00:00 -0500"},"total":9,"longitude":-110.886147,"id":"advy9tpada8f","location":"Madera Canyon--Proctor Rd."},"type":"Feature","geometry":{"type":"Point","coordinates":[-110.886147,31.739938]}},{"properties":{"latitude":32.9178495,"date":{"end_time":"2001/04/01 00:00:00 -0500","original":"3/31/2001","granularity":"day","time":"2001/03/31 00:00:00 -0500"},"total":8,"longitude":-107.7171707,"id":"advy9twiok7m","location":"Kingston"},"type":"Feature","geometry":{"type":"Point","coordinates":[-107.7171707,32.9178495]}},{"properties":{"latitude":58.302364,"date":{"end_time":"2005/01/28 00:00:00 -0500","original":"1/27/2005","granularity":"day","time":"2005/01/27 00:00:00 -0500"},"total":8,"longitude":-134.6786499,"id":"advy9tm0lqk5","location":"Outer Point Trail (Juneau)"},"type":"Feature","geometry":{"type":"Point","coordinates":[-134.6786499,58.302364]}},{"properties":{"latitude":31.4661537,"date":{"end_time":"2007/02/28 00:00:00 -0500","original":"2/27/2007","granularity":"day","time":"2007/02/27 00:00:00 -0500"},"total":8,"longitude":-110.7364368,"id":"advy9trtwfrp","location":"Humboldt Canyon"},"type":"Feature","geometry":{"type":"Point","coordinates":[-110.7364368,31.4661537]}},{"properties":{"latitude":32.31229,"date":{"end_time":"1994/06/14 00:00:00 -0400","original":"6/13/1994","granularity":"day","time":"1994/06/13 00:00:00 -0400"},"total":7,"longitude":-106.77856,"id":"advy9tsp199q","location":"Las Cruces"},"type":"Feature","geometry":{"type":"Point","coordinates":[-106.77856,32.31229]}},{"properties":{"latitude":59.4990499,"date":{"end_time":"2002/09/04 00:00:00 -0400","original":"9/3/2002","granularity":"day","time":"2002/09/03 00:00:00 -0400"},"total":7,"longitude":-135.3541374,"id":"advy9thj6xu0","location":"Skagway--Dyea"},"type":"Feature","geometry":{"type":"Point","coordinates":[-135.3541374,59.4990499]}},{"properties":{"latitude":33.802,"date":{"end_time":"2002/10/23 00:00:00 -0400","original":"10/22/2002","granularity":"day","time":"2002/10/22 00:00:00 -0400"},"total":7,"longitude":-106.88,"id":"advy9txzqcf2","location":"Bosque del Apache NWR"},"type":"Feature","geometry":{"type":"Point","coordinates":[-106.88,33.802]}},{"properties":{"latitude":58.33481,"date":{"end_time":"2003/10/24 00:00:00 -0400","original":"10/23/2003","granularity":"day","time":"2003/10/23 00:00:00 -0400"},"total":7,"longitude":-134.47717,"id":"advy9tw45mdw","location":"Juneau--Twin Lakes"},"type":"Feature","geometry":{"type":"Point","coordinates":[-134.47717,58.33481]}},{"properties":{"latitude":59.1897762,"date":{"end_time":"2004/06/09 00:00:00 -0400","original":"6/8/2004","granularity":"day","time":"2004/06/08 00:00:00 -0400"},"total":7,"longitude":-135.3024673,"id":"advy9tjy6fp2","location":"Katzehin River mouth"},"type":"Feature","geometry":{"type":"Point","coordinates":[-135.3024673,59.1897762]}},{"properties":{"latitude":58.9713399,"date":{"end_time":"2004/07/06 00:00:00 -0400","original":"7/5/2004","granularity":"day","time":"2004/07/05 00:00:00 -0400"},"total":7,"longitude":-135.2216148,"id":"advy9tibufte","location":"Lynn Canal--Eldred Rock area"},"type":"Feature","geometry":{"type":"Point","coordinates":[-135.2216148,58.9713399]}},{"properties":{"latitude":58.4886698,"date":{"end_time":"2004/07/28 00:00:00 -0400","original":"7/27/2004","granularity":"day","time":"2004/07/27 00:00:00 -0400"},"total":7,"longitude":-134.8846436,"id":"advy9tls3o2t","location":"Lynn Canal - Favorite Channel"},"type":"Feature","geometry":{"type":"Point","coordinates":[-134.8846436,58.4886698]}},{"properties":{"latitude":31.3769,"date":{"end_time":"2004/10/13 00:00:00 -0400","original":"10/12/2004","granularity":"day","time":"2004/10/12 00:00:00 -0400"},"total":7,"longitude":-110.8543,"id":"advy9trt6s3z","location":"Kino Springs"},"type":"Feature","geometry":{"type":"Point","coordinates":[-110.8543,31.3769]}},{"properties":{"latitude":31.4951992,"date":{"end_time":"2006/10/31 00:00:00 -0500","original":"10/30/2006","granularity":"day","time":"2006/10/30 00:00:00 -0500"},"total":7,"longitude":-110.8566971,"id":"advy9tl4okzq","location":"Patagonia Lake State Park"},"type":"Feature","geometry":{"type":"Point","coordinates":[-110.8566971,31.4951992]}},{"properties":{"latitude":32.3866997,"date":{"end_time":"2007/03/12 00:00:00 -0400","original":"3/11/2007","granularity":"day","time":"2007/03/11 00:00:00 -0500"},"total":7,"longitude":-110.7101974,"id":"advy9tivxw4z","location":"Mt. Lemmon--Rose Canyon Lake"},"type":"Feature","geometry":{"type":"Point","coordinates":[-110.7101974,32.3866997]}},{"properties":{"latitude":32.2806015,"date":{"end_time":"2007/03/22 00:00:00 -0400","original":"3/21/2007","granularity":"day","time":"2007/03/21 00:00:00 -0400"},"total":7,"longitude":-110.7303009,"id":"advy9tq8enqs","location":"Agua Caliente Park"},"type":"Feature","geometry":{"type":"Point","coordinates":[-110.7303009,32.2806015]}},{"properties":{"latitude":27.0916667,"date":{"end_time":"2008/02/11 00:00:00 -0500","original":"2/10/2008","granularity":"day","time":"2008/02/10 00:00:00 -0500"},"total":7,"longitude":-109.45,"id":"advy9tt8jeuh","location":"Rio May at Navojoa"},"type":"Feature","geometry":{"type":"Point","coordinates":[-109.45,27.0916667]}},{"properties":{"latitude":32.3300526,"date":{"end_time":"2001/03/19 00:00:00 -0500","original":"3/18/2001","granularity":"day","time":"2001/03/18 00:00:00 -0500"},"total":6,"longitude":-110.7944301,"id":"advy9toggaug","location":"Sabino Canyon Recreation Area"},"type":"Feature","geometry":{"type":"Point","coordinates":[-110.7944301,32.3300526]}},{"properties":{"latitude":31.8771992,"date":{"end_time":"2001/05/13 00:00:00 -0400","original":"5/12/2001","granularity":"day","time":"2001/05/12 00:00:00 -0400"},"total":6,"longitude":-109.1781998,"id":"advy9tjpq5ln","location":"Cave Creek Canyon--South Fork"},"type":"Feature","geometry":{"type":"Point","coordinates":[-109.1781998,31.8771992]}},{"properties":{"latitude":58.2730558,"date":{"end_time":"2003/06/01 00:00:00 -0400","original":"5/31/2003","granularity":"day","time":"2003/05/31 00:00:00 -0400"},"total":6,"longitude":-134.3876869,"id":"advy9tx7b4gk","location":"Juneau--Douglas-Treadwell/Sandy Beach area"},"type":"Feature","geometry":{"type":"Point","coordinates":[-134.3876869,58.2730558]}},{"properties":{"latitude":58.4388808,"date":{"end_time":"2003/06/16 00:00:00 -0400","original":"6/15/2003","granularity":"day","time":"2003/06/15 00:00:00 -0400"},"total":6,"longitude":-134.6453476,"id":"advy9tp8xlmc","location":"Montana Creek Trail"},"type":"Feature","geometry":{"type":"Point","coordinates":[-134.6453476,58.4388808]}},{"properties":{"latitude":41.831439,"date":{"end_time":"2003/08/09 00:00:00 -0400","original":"8/8/2003","granularity":"day","time":"2003/08/08 00:00:00 -0400"},"total":6,"longitude":-90.5644226,"id":"advy9tprq6tk","location":"DeWitt"},"type":"Feature","geometry":{"type":"Point","coordinates":[-90.5644226,41.831439]}},{"properties":{"latitude":60.0618421,"date":{"end_time":"2004/05/25 00:00:00 -0400","original":"5/24/2004","granularity":"day","time":"2004/05/24 00:00:00 -0400"},"total":6,"longitude":-128.9165783,"id":"advy9tno4ni1","location":"Albert Creek--Albert Creek Bird Observatory"},"type":"Feature","geometry":{"type":"Point","coordinates":[-128.9165783,60.0618421]}},{"properties":{"latitude":31.9015007,"date":{"end_time":"2007/02/04 00:00:00 -0500","original":"2/3/2007","granularity":"day","time":"2007/02/03 00:00:00 -0500"},"total":6,"longitude":-110.9710007,"id":"advy9ttjhg5g","location":"Green Valley WTP"},"type":"Feature","geometry":{"type":"Point","coordinates":[-110.9710007,31.9015007]}},{"properties":{"latitude":31.5614979,"date":{"end_time":"2007/02/11 00:00:00 -0500","original":"2/10/2007","granularity":"day","time":"2007/02/10 00:00:00 -0500"},"total":6,"longitude":-109.7200191,"id":"advy9tookq3x","location":"Whitewater Draw WA"},"type":"Feature","geometry":{"type":"Point","coordinates":[-109.7200191,31.5614979]}},{"properties":{"latitude":31.528,"date":{"end_time":"2007/02/25 00:00:00 -0500","original":"2/24/2007","granularity":"day","time":"2007/02/24 00:00:00 -0500"},"total":6,"longitude":-110.775,"id":"advy9tuqb73v","location":"Patagonia-Sonoita Creek Preserve"},"type":"Feature","geometry":{"type":"Point","coordinates":[-110.775,31.528]}},{"properties":{"latitude":31.7780881,"date":{"end_time":"2007/03/10 00:00:00 -0500","original":"3/9/2007","granularity":"day","time":"2007/03/09 00:00:00 -0500"},"total":6,"longitude":-110.8875847,"id":"advy9txqe5s5","location":"grasslands below Madera Canyon"},"type":"Feature","geometry":{"type":"Point","coordinates":[-110.8875847,31.7780881]}},{"properties":{"latitude":31.4724011,"date":{"end_time":"2007/04/28 00:00:00 -0400","original":"4/27/2007","granularity":"day","time":"2007/04/27 00:00:00 -0400"},"total":6,"longitude":-110.9867749,"id":"advy9tnndkra","location":"Rio Rico Pond"},"type":"Feature","geometry":{"type":"Point","coordinates":[-110.9867749,31.4724011]}},{"properties":{"latitude":32.01793,"date":{"end_time":"2007/07/05 00:00:00 -0400","original":"7/4/2007","granularity":"day","time":"2007/07/04 00:00:00 -0400"},"total":6,"longitude":-110.6429,"id":"advy9thlppn5","location":"Cienega Creek Preserve (permit required)"},"type":"Feature","geometry":{"type":"Point","coordinates":[-110.6429,32.01793]}},{"properties":{"latitude":27.9531649,"date":{"end_time":"2008/02/07 00:00:00 -0500","original":"2/6/2008","granularity":"day","time":"2008/02/06 00:00:00 -0500"},"total":6,"longitude":-111.0549545,"id":"advy9tv30wor","location":"San Carlos"},"type":"Feature","geometry":{"type":"Point","coordinates":[-111.0549545,27.9531649]}},{"properties":{"latitude":31.7572371,"date":{"end_time":"2008/12/29 00:00:00 -0500","original":"12/28/2008","granularity":"day","time":"2008/12/28 00:00:00 -0500"},"total":6,"longitude":-110.8436855,"id":"advy9tosrqiu","location":"Florida Canyon--lower"},"type":"Feature","geometry":{"type":"Point","coordinates":[-110.8436855,31.7572371]}},{"properties":{"latitude":32.233647,"date":{"end_time":"2009/01/12 00:00:00 -0500","original":"1/11/2009","granularity":"day","time":"2009/01/11 00:00:00 -0500"},"total":6,"longitude":-110.9665167,"id":"advy9thmk0y0","location":"Catalina Park"},"type":"Feature","geometry":{"type":"Point","coordinates":[-110.9665167,32.233647]}},{"properties":{"latitude":27.0236684,"date":{"end_time":"2010/02/21 00:00:00 -0500","original":"2/20/2010","granularity":"day","time":"2010/02/20 00:00:00 -0500"},"total":6,"longitude":-108.9246738,"id":"advy9tuhao1y","location":"Rancho Acosta - Alamos"},"type":"Feature","geometry":{"type":"Point","coordinates":[-108.9246738,27.0236684]}},{"properties":{"latitude":33.1685772,"date":{"end_time":"2010/05/03 00:00:00 -0400","original":"5/2/2010","granularity":"day","time":"2010/05/02 00:00:00 -0400"},"total":6,"longitude":-108.2077133,"id":"advy9tndcuxu","location":"Gila River--Below Confluence of East and West Forks"},"type":"Feature","geometry":{"type":"Point","coordinates":[-108.2077133,33.1685772]}},{"properties":{"latitude":21.436215,"date":{"end_time":"2013/02/21 00:00:00 -0500","original":"2/20/2013","granularity":"day","time":"2013/02/20 00:00:00 -0500"},"total":6,"longitude":-157.852031,"id":"advy9tku1u3g","location":"Kane'ohe bed and breakfast"},"type":"Feature","geometry":{"type":"Point","coordinates":[-157.852031,21.436215]}},{"properties":{"latitude":61.2342515,"date":{"end_time":"2002/02/25 00:00:00 -0500","original":"2/24/2002","granularity":"day","time":"2002/02/24 00:00:00 -0500"},"total":5,"longitude":-149.2712295,"id":"advy9tw8x9ql","location":"Eagle River Nature Center (Anchorage)"},"type":"Feature","geometry":{"type":"Point","coordinates":[-149.2712295,61.2342515]}},{"properties":{"latitude":63.7175902,"date":{"end_time":"2002/06/02 00:00:00 -0400","original":"6/1/2002","granularity":"day","time":"2002/06/01 00:00:00 -0400"},"total":5,"longitude":-148.9881706,"id":"advy9to4j8qj","location":"Denali NP"},"type":"Feature","geometry":{"type":"Point","coordinates":[-148.9881706,63.7175902]}},{"properties":{"latitude":58.3881695,"date":{"end_time":"2003/06/09 00:00:00 -0400","original":"6/8/2003","granularity":"day","time":"2003/06/08 00:00:00 -0400"},"total":5,"longitude":-134.534111,"id":"advy9tisygg0","location":"Thunder Mountain"},"type":"Feature","geometry":{"type":"Point","coordinates":[-134.534111,58.3881695]}},{"properties":{"latitude":58.2654541,"date":{"end_time":"2003/06/14 00:00:00 -0400","original":"6/13/2003","granularity":"day","time":"2003/06/13 00:00:00 -0400"},"total":5,"longitude":-134.3236542,"id":"advy9tn47t0g","location":"Juneau--Sheep Creek Trail"},"type":"Feature","geometry":{"type":"Point","coordinates":[-134.3236542,58.2654541]}},{"properties":{"latitude":58.2923221,"date":{"end_time":"2003/06/15 00:00:00 -0400","original":"6/14/2003","granularity":"day","time":"2003/06/14 00:00:00 -0400"},"total":5,"longitude":-134.4424868,"id":"advy9tlbs8yd","location":"Dan Moller Trail"},"type":"Feature","geometry":{"type":"Point","coordinates":[-134.4424868,58.2923221]}},{"properties":{"latitude":58.3802415,"date":{"end_time":"2003/06/17 00:00:00 -0400","original":"6/16/2003","granularity":"day","time":"2003/06/16 00:00:00 -0400"},"total":5,"longitude":-134.6001148,"id":"advy9tm7jbtp","location":"Brotherhood Trail"},"type":"Feature","geometry":{"type":"Point","coordinates":[-134.6001148,58.3802415]}},{"properties":{"latitude":58.2951702,"date":{"end_time":"2003/06/30 00:00:00 -0400","original":"6/29/2003","granularity":"day","time":"2003/06/29 00:00:00 -0400"},"total":5,"longitude":-134.377691,"id":"advy9tozjgd9","location":"Juneau--Mount Roberts Trail-Alpine"},"type":"Feature","geometry":{"type":"Point","coordinates":[-134.377691,58.2951702]}},{"properties":{"latitude":58.491602,"date":{"end_time":"2004/03/28 00:00:00 -0500","original":"3/27/2004","granularity":"day","time":"2004/03/27 00:00:00 -0500"},"total":5,"longitude":-134.7913027,"id":"advy9tj1go3n","location":"Amalga Harbor"},"type":"Feature","geometry":{"type":"Point","coordinates":[-134.7913027,58.491602]}},{"properties":{"latitude":19.992466,"date":{"end_time":"2005/03/20 00:00:00 -0500","original":"3/19/2005","granularity":"day","time":"2005/03/19 00:00:00 -0500"},"total":5,"longitude":-155.2411938,"id":"advy9tswdm92","location":"Laupahoehoe Point County Park"},"type":"Feature","geometry":{"type":"Point","coordinates":[-155.2411938,19.992466]}},{"properties":{"latitude":31.7692091,"date":{"end_time":"2006/11/01 00:00:00 -0500","original":"10/31/2006","granularity":"day","time":"2006/10/31 00:00:00 -0500"},"total":5,"longitude":-110.6684777,"id":"advy9ts4b8g9","location":"Las Cienegas NCA (Pima Co.)"},"type":"Feature","geometry":{"type":"Point","coordinates":[-110.6684777,31.7692091]}},{"properties":{"latitude":31.5051994,"date":{"end_time":"2007/02/28 00:00:00 -0500","original":"2/27/2007","granularity":"day","time":"2007/02/27 00:00:00 -0500"},"total":5,"longitude":-110.7031021,"id":"advy9tpxq4wz","location":"Harshaw Canyon"},"type":"Feature","geometry":{"type":"Point","coordinates":[-110.7031021,31.5051994]}},{"properties":{"latitude":31.5694771,"date":{"end_time":"2007/03/31 00:00:00 -0400","original":"3/30/2007","granularity":"day","time":"2007/03/30 00:00:00 -0400"},"total":5,"longitude":-111.0472888,"id":"advy9txu76fs","location":"De Anza Trail--Tumacacori"},"type":"Feature","geometry":{"type":"Point","coordinates":[-111.0472888,31.5694771]}},{"properties":{"latitude":31.8847242,"date":{"end_time":"2007/09/15 00:00:00 -0400","original":"9/14/2007","granularity":"day","time":"2007/09/14 00:00:00 -0400"},"total":5,"longitude":-109.1755749,"id":"advy9to1jywv","location":"Cave Creek Canyon--Sunny Flat CG"},"type":"Feature","geometry":{"type":"Point","coordinates":[-109.1755749,31.8847242]}},{"properties":{"latitude":27.955591,"date":{"end_time":"2008/02/08 00:00:00 -0500","original":"2/7/2008","granularity":"day","time":"2008/02/07 00:00:00 -0500"},"total":5,"longitude":-110.9763336,"id":"advy9tvhmur3","location":"Estero de Soldado, San Carlos"},"type":"Feature","geometry":{"type":"Point","coordinates":[-110.9763336,27.955591]}},{"properties":{"latitude":27.0982539,"date":{"end_time":"2008/02/11 00:00:00 -0500","original":"2/10/2008","granularity":"day","time":"2008/02/10 00:00:00 -0500"},"total":5,"longitude":-109.1608429,"id":"advy9tpemylg","location":"Navajoa to Alamos"},"type":"Feature","geometry":{"type":"Point","coordinates":[-109.1608429,27.0982539]}},{"properties":{"latitude":-13.1558805,"date":{"end_time":"2008/10/17 00:00:00 -0400","original":"10/16/2008","granularity":"day","time":"2008/10/16 00:00:00 -0400"},"total":5,"longitude":-72.5408363,"id":"advy9tnjjlsz","location":"Train tracks - Puente Ruinas to hydro plant"},"type":"Feature","geometry":{"type":"Point","coordinates":[-72.5408363,-13.1558805]}},{"properties":{"latitude":27.2790435,"date":{"end_time":"2009/02/24 00:00:00 -0500","original":"2/23/2009","granularity":"day","time":"2009/02/23 00:00:00 -0500"},"total":5,"longitude":-109.6655273,"id":"advy9txdc4vq","location":"Hwy 15 --Ciudad Obregón to Navajoa"},"type":"Feature","geometry":{"type":"Point","coordinates":[-109.6655273,27.2790435]}},{"properties":{"latitude":27.0168586,"date":{"end_time":"2009/12/07 00:00:00 -0500","original":"12/6/2009","granularity":"day","time":"2009/12/06 00:00:00 -0500"},"total":5,"longitude":-108.9469743,"id":"advy9tv9fsv0","location":"El Pedregal Nature Lodge"},"type":"Feature","geometry":{"type":"Point","coordinates":[-108.9469743,27.0168586]}},{"properties":{"latitude":11.1433417,"date":{"end_time":"2011/07/25 00:00:00 -0400","original":"7/24/2011","granularity":"day","time":"2011/07/24 00:00:00 -0400"},"total":5,"longitude":-74.1176081,"id":"advy9tqbcxg0","location":"Minca town and around"},"type":"Feature","geometry":{"type":"Point","coordinates":[-74.1176081,11.1433417]}},{"properties":{"latitude":61.21755,"date":{"end_time":"2002/02/25 00:00:00 -0500","original":"2/24/2002","granularity":"day","time":"2002/02/24 00:00:00 -0500"},"total":4,"longitude":-149.9022,"id":"advy9tqkjc7i","location":"Anchorage"},"type":"Feature","geometry":{"type":"Point","coordinates":[-149.9022,61.21755]}},{"properties":{"latitude":61.2059712,"date":{"end_time":"2002/05/11 00:00:00 -0400","original":"5/10/2002","granularity":"day","time":"2002/05/10 00:00:00 -0400"},"total":4,"longitude":-149.9211502,"id":"advy9tjsyudm","location":"Anchorage--Westchester Lagoon"},"type":"Feature","geometry":{"type":"Point","coordinates":[-149.9211502,61.2059712]}},{"properties":{"latitude":60.777602,"date":{"end_time":"2002/05/22 00:00:00 -0400","original":"5/21/2002","granularity":"day","time":"2002/05/21 00:00:00 -0400"},"total":4,"longitude":-148.7033844,"id":"advy9ttlbbmz","location":"Whittier"},"type":"Feature","geometry":{"type":"Point","coordinates":[-148.7033844,60.777602]}},{"properties":{"latitude":59.9571991,"date":{"end_time":"2002/06/26 00:00:00 -0400","original":"6/25/2002","granularity":"day","time":"2002/06/25 00:00:00 -0400"},"total":4,"longitude":-149.3684998,"id":"advy9ttoay0v","location":"Resurrection Bay (Seward)"},"type":"Feature","geometry":{"type":"Point","coordinates":[-149.3684998,59.9571991]}},{"properties":{"latitude":32.32773,"date":{"end_time":"2003/03/09 00:00:00 -0500","original":"3/8/2003","granularity":"day","time":"2003/03/08 00:00:00 -0500"},"total":4,"longitude":-106.59024,"id":"advy9tnew5mo","location":"Dripping Springs Natural Area"},"type":"Feature","geometry":{"type":"Point","coordinates":[-106.59024,32.32773]}},{"properties":{"latitude":32.3374143,"date":{"end_time":"2003/12/27 00:00:00 -0500","original":"12/26/2003","granularity":"day","time":"2003/12/26 00:00:00 -0500"},"total":4,"longitude":-106.5869475,"id":"advy9tu9z0uz","location":"Fillmore Canyon"},"type":"Feature","geometry":{"type":"Point","coordinates":[-106.5869475,32.3374143]}},{"properties":{"latitude":58.294107,"date":{"end_time":"2004/03/06 00:00:00 -0500","original":"3/5/2004","granularity":"day","time":"2004/03/05 00:00:00 -0500"},"total":4,"longitude":-134.4118881,"id":"advy9tqpnxmk","location":"Juneau - Gastineau Channel"},"type":"Feature","geometry":{"type":"Point","coordinates":[-134.4118881,58.294107]}},{"properties":{"latitude":58.5210929,"date":{"end_time":"2004/03/28 00:00:00 -0500","original":"3/27/2004","granularity":"day","time":"2004/03/27 00:00:00 -0500"},"total":4,"longitude":-134.8325443,"id":"advy9tuibg9r","location":"Scout Camp Trail (Juneau)"},"type":"Feature","geometry":{"type":"Point","coordinates":[-134.8325443,58.5210929]}},{"properties":{"latitude":58.3294804,"date":{"end_time":"2004/05/03 00:00:00 -0400","original":"5/2/2004","granularity":"day","time":"2004/05/02 00:00:00 -0400"},"total":4,"longitude":-134.4766259,"id":"advy9tvhstfm","location":"Juneau--Mendenhall Wetlands-Salmon Creek Delta"},"type":"Feature","geometry":{"type":"Point","coordinates":[-134.4766259,58.3294804]}},{"properties":{"latitude":59.4565051,"date":{"end_time":"2004/05/16 00:00:00 -0400","original":"5/15/2004","granularity":"day","time":"2004/05/15 00:00:00 -0400"},"total":4,"longitude":-135.3157711,"id":"advy9timlrjf","location":"Skagway"},"type":"Feature","geometry":{"type":"Point","coordinates":[-135.3157711,59.4565051]}},{"properties":{"latitude":57.049881,"date":{"end_time":"2004/05/21 00:00:00 -0400","original":"5/20/2004","granularity":"day","time":"2004/05/20 00:00:00 -0400"},"total":4,"longitude":-135.3335381,"id":"advy9tjldmq7","location":"Sitka"},"type":"Feature","geometry":{"type":"Point","coordinates":[-135.3335381,57.049881]}},{"properties":{"latitude":58.5153489,"date":{"end_time":"2004/05/24 00:00:00 -0400","original":"5/23/2004","granularity":"day","time":"2004/05/23 00:00:00 -0400"},"total":4,"longitude":-134.944725,"id":"advy9tlqrl0e","location":"Lynn Canal"},"type":"Feature","geometry":{"type":"Point","coordinates":[-134.944725,58.5153489]}},{"properties":{"latitude":60.0654508,"date":{"end_time":"2004/05/24 00:00:00 -0400","original":"5/23/2004","granularity":"day","time":"2004/05/23 00:00:00 -0400"},"total":4,"longitude":-128.7030959,"id":"advy9tiy4a8i","location":"Watson Lake--Wye Lake"},"type":"Feature","geometry":{"type":"Point","coordinates":[-128.7030959,60.0654508]}},{"properties":{"latitude":57.3157698,"date":{"end_time":"2004/07/08 00:00:00 -0400","original":"7/7/2004","granularity":"day","time":"2004/07/07 00:00:00 -0400"},"total":4,"longitude":-135.6529999,"id":"advy9twryatv","location":"Sitka - Neva Strait"},"type":"Feature","geometry":{"type":"Point","coordinates":[-135.6529999,57.3157698]}},{"properties":{"latitude":58.2756977,"date":{"end_time":"2004/07/11 00:00:00 -0400","original":"7/10/2004","granularity":"day","time":"2004/07/10 00:00:00 -0400"},"total":4,"longitude":-134.5148849,"id":"advy9trak1mx","location":"Juneau--Eaglecrest Ski Basin"},"type":"Feature","geometry":{"type":"Point","coordinates":[-134.5148849,58.2756977]}},{"properties":{"latitude":32.3371487,"date":{"end_time":"2004/10/05 00:00:00 -0400","original":"10/4/2004","granularity":"day","time":"2004/10/04 00:00:00 -0400"},"total":4,"longitude":-106.6038179,"id":"advy9tpp4csc","location":"La Cueva Picnic Area--Organ Mtns."},"type":"Feature","geometry":{"type":"Point","coordinates":[-106.6038179,32.3371487]}},{"properties":{"latitude":32.2437113,"date":{"end_time":"2004/10/13 00:00:00 -0400","original":"10/12/2004","granularity":"day","time":"2004/10/12 00:00:00 -0400"},"total":4,"longitude":-111.168125,"id":"advy9tuio39w","location":"Arizona-Sonora Desert Museum"},"type":"Feature","geometry":{"type":"Point","coordinates":[-111.168125,32.2437113]}},{"properties":{"latitude":32.3304211,"date":{"end_time":"2004/10/28 00:00:00 -0400","original":"10/27/2004","granularity":"day","time":"2004/10/27 00:00:00 -0400"},"total":4,"longitude":-106.8009281,"id":"advy9todizfq","location":"Las Cruces - canals by mom"},"type":"Feature","geometry":{"type":"Point","coordinates":[-106.8009281,32.3304211]}},{"properties":{"latitude":58.4715706,"date":{"end_time":"2004/11/05 00:00:00 -0500","original":"11/4/2004","granularity":"day","time":"2004/11/04 00:00:00 -0500"},"total":4,"longitude":-134.78405,"id":"advy9toah0ye","location":"Juneau - Shrine of St. Terese"},"type":"Feature","geometry":{"type":"Point","coordinates":[-134.78405,58.4715706]}},{"properties":{"latitude":58.3747182,"date":{"end_time":"2005/05/01 00:00:00 -0400","original":"4/30/2005","granularity":"day","time":"2005/04/30 00:00:00 -0400"},"total":4,"longitude":-134.6628571,"id":"advy9tkhhzxm","location":"Juneau - Auke Bay"},"type":"Feature","geometry":{"type":"Point","coordinates":[-134.6628571,58.3747182]}},{"properties":{"latitude":-0.0510693,"date":{"end_time":"2006/01/11 00:00:00 -0500","original":"1/10/2006","granularity":"day","time":"2006/01/10 00:00:00 -0500"},"total":4,"longitude":-78.77841,"id":"advy9tljio3b","location":"Mindo--general area"},"type":"Feature","geometry":{"type":"Point","coordinates":[-78.77841,-0.0510693]}},{"properties":{"latitude":-0.026865,"date":{"end_time":"2006/01/12 00:00:00 -0500","original":"1/11/2006","granularity":"day","time":"2006/01/11 00:00:00 -0500"},"total":4,"longitude":-78.7621021,"id":"advy9tqchyi6","location":"Mindo Juction"},"type":"Feature","geometry":{"type":"Point","coordinates":[-78.7621021,-0.026865]}},{"properties":{"latitude":-0.0295258,"date":{"end_time":"2006/01/15 00:00:00 -0500","original":"1/14/2006","granularity":"day","time":"2006/01/14 00:00:00 -0500"},"total":4,"longitude":-78.707428,"id":"advy9tq9ptw4","location":"Bellavista Cloud Forest Lodge"},"type":"Feature","geometry":{"type":"Point","coordinates":[-78.707428,-0.0295258]}},{"properties":{"latitude":-0.3291159,"date":{"end_time":"2006/01/23 00:00:00 -0500","original":"1/22/2006","granularity":"day","time":"2006/01/22 00:00:00 -0500"},"total":4,"longitude":-78.2095234,"id":"advy9tmuajmp","location":"Papallacta--pass &amp; vicinity"},"type":"Feature","geometry":{"type":"Point","coordinates":[-78.2095234,-0.3291159]}},{"properties":{"latitude":-13.157235,"date":{"end_time":"2006/03/17 00:00:00 -0500","original":"3/16/2006","granularity":"day","time":"2006/03/16 00:00:00 -0500"},"total":4,"longitude":-72.531781,"id":"advy9tn3ccd2","location":"Machu Picchu town to Puente Ruinas area"},"type":"Feature","geometry":{"type":"Point","coordinates":[-72.531781,-13.157235]}},{"properties":{"latitude":60.4545092,"date":{"end_time":"2006/09/29 00:00:00 -0400","original":"9/28/2006","granularity":"day","time":"2006/09/28 00:00:00 -0400"},"total":4,"longitude":-172.7600098,"id":"advy9tnr2gng","location":"St Matthew Is. group (St. Matthew-Hall-Pinnacle Islands)"},"type":"Feature","geometry":{"type":"Point","coordinates":[-172.7600098,60.4545092]}},{"properties":{"latitude":31.6938,"date":{"end_time":"2006/11/20 00:00:00 -0500","original":"11/19/2006","granularity":"day","time":"2006/11/19 00:00:00 -0500"},"total":4,"longitude":-110.8609,"id":"advy9tih8p7h","location":"Madera Canyon--Josephine Saddle"},"type":"Feature","geometry":{"type":"Point","coordinates":[-110.8609,31.6938]}},{"properties":{"latitude":32.4427119,"date":{"end_time":"2006/12/05 00:00:00 -0500","original":"12/4/2006","granularity":"day","time":"2006/12/04 00:00:00 -0500"},"total":4,"longitude":-110.7598686,"id":"advy9txzvpdw","location":"Mt. Lemmon--Summerhaven"},"type":"Feature","geometry":{"type":"Point","coordinates":[-110.7598686,32.4427119]}},{"properties":{"latitude":31.7251514,"date":{"end_time":"2007/03/10 00:00:00 -0500","original":"3/9/2007","granularity":"day","time":"2007/03/09 00:00:00 -0500"},"total":4,"longitude":-110.8801067,"id":"advy9tq7s96z","location":"Madera Canyon--Santa Rita Lodge"},"type":"Feature","geometry":{"type":"Point","coordinates":[-110.8801067,31.7251514]}},{"properties":{"latitude":32.3380383,"date":{"end_time":"2007/03/20 00:00:00 -0400","original":"3/19/2007","granularity":"day","time":"2007/03/19 00:00:00 -0400"},"total":4,"longitude":-111.0814548,"id":"advy9ty0gt7a","location":"Santa Cruz River--Ina Rd."},"type":"Feature","geometry":{"type":"Point","coordinates":[-111.0814548,32.3380383]}},{"properties":{"latitude":31.4043999,"date":{"end_time":"2007/03/27 00:00:00 -0400","original":"3/26/2007","granularity":"day","time":"2007/03/26 00:00:00 -0400"},"total":4,"longitude":-111.0858002,"id":"advy9tteoyss","location":"Pena Blanca Lake"},"type":"Feature","geometry":{"type":"Point","coordinates":[-111.0858002,31.4043999]}},{"properties":{"latitude":32.3731003,"date":{"end_time":"2007/04/27 00:00:00 -0400","original":"4/26/2007","granularity":"day","time":"2007/04/26 00:00:00 -0400"},"total":4,"longitude":-110.6912994,"id":"advy9tsxytb0","location":"Mt. Lemmon--Bear Canyon (Middle Picnic Area)"},"type":"Feature","geometry":{"type":"Point","coordinates":[-110.6912994,32.3731003]}},{"properties":{"latitude":32.2401009,"date":{"end_time":"2007/04/27 00:00:00 -0400","original":"4/26/2007","granularity":"day","time":"2007/04/26 00:00:00 -0400"},"total":4,"longitude":-110.7201004,"id":"advy9txnb3fo","location":"Tanque Verde Wash--Wentworth Rd."},"type":"Feature","geometry":{"type":"Point","coordinates":[-110.7201004,32.2401009]}},{"properties":{"latitude":32.917,"date":{"end_time":"2007/05/14 00:00:00 -0400","original":"5/13/2007","granularity":"day","time":"2007/05/13 00:00:00 -0400"},"total":4,"longitude":-110.735,"id":"advy9tmofhs0","location":"Dudleyville"},"type":"Feature","geometry":{"type":"Point","coordinates":[-110.735,32.917]}},{"properties":{"latitude":51.9333115,"date":{"end_time":"2007/05/21 00:00:00 -0400","original":"5/20/2007","granularity":"day","time":"2007/05/20 00:00:00 -0400"},"total":4,"longitude":-176.5749264,"id":"advy9tr06g9h","location":"Adak Is.--Clam Lagoon"},"type":"Feature","geometry":{"type":"Point","coordinates":[-176.5749264,51.9333115]}},{"properties":{"latitude":45.0955413,"date":{"end_time":"2007/06/25 00:00:00 -0400","original":"6/24/2007","granularity":"day","time":"2007/06/24 00:00:00 -0400"},"total":4,"longitude":-93.4744692,"id":"advy9to9cvz2","location":"Sarah's Dad's House area"},"type":"Feature","geometry":{"type":"Point","coordinates":[-93.4744692,45.0955413]}},{"properties":{"latitude":31.7878465,"date":{"end_time":"2007/08/02 00:00:00 -0400","original":"8/1/2007","granularity":"day","time":"2007/08/01 00:00:00 -0400"},"total":4,"longitude":-110.6365728,"id":"advy9tphkdcm","location":"Las Cienegas NCA--Empire Gulch"},"type":"Feature","geometry":{"type":"Point","coordinates":[-110.6365728,31.7878465]}},{"properties":{"latitude":31.7306042,"date":{"end_time":"2007/12/09 00:00:00 -0500","original":"12/8/2007","granularity":"day","time":"2007/12/08 00:00:00 -0500"},"total":4,"longitude":-111.0544619,"id":"advy9tue50uz","location":"Amado WTP"},"type":"Feature","geometry":{"type":"Point","coordinates":[-111.0544619,31.7306042]}},{"properties":{"latitude":26.9166667,"date":{"end_time":"2008/02/09 00:00:00 -0500","original":"2/8/2008","granularity":"day","time":"2008/02/08 00:00:00 -0500"},"total":4,"longitude":-108.9166667,"id":"advy9ttvixlp","location":"Mentidero, Arroyo, and Rio Cuchijaqui"},"type":"Feature","geometry":{"type":"Point","coordinates":[-108.9166667,26.9166667]}},{"properties":{"latitude":27.025,"date":{"end_time":"2008/02/09 00:00:00 -0500","original":"2/8/2008","granularity":"day","time":"2008/02/08 00:00:00 -0500"},"total":4,"longitude":-108.9333333,"id":"advy9tkx9cb5","location":"Alamos - cemetery to sewage ponds"},"type":"Feature","geometry":{"type":"Point","coordinates":[-108.9333333,27.025]}},{"properties":{"latitude":27.7146859,"date":{"end_time":"2008/08/06 00:00:00 -0400","original":"8/5/2008","granularity":"day","time":"2008/08/05 00:00:00 -0400"},"total":4,"longitude":85.3114128,"id":"advy9tqmpa43","location":"Kathmandu--Thamel area"},"type":"Feature","geometry":{"type":"Point","coordinates":[85.3114128,27.7146859]}},{"properties":{"latitude":28.2133418,"date":{"end_time":"2008/08/10 00:00:00 -0400","original":"8/9/2008","granularity":"day","time":"2008/08/09 00:00:00 -0400"},"total":4,"longitude":83.9566011,"id":"advy9tv1ziz0","location":"Pokhara--Phewa Lakeside"},"type":"Feature","geometry":{"type":"Point","coordinates":[83.9566011,28.2133418]}},{"properties":{"latitude":26.4877054,"date":{"end_time":"2008/08/31 00:00:00 -0400","original":"8/30/2008","granularity":"day","time":"2008/08/30 00:00:00 -0400"},"total":4,"longitude":74.5545959,"id":"advy9tlvrzs4","location":"Pushkar and surrounding area"},"type":"Feature","geometry":{"type":"Point","coordinates":[74.5545959,26.4877054]}},{"properties":{"latitude":32.1861206,"date":{"end_time":"2008/12/28 00:00:00 -0500","original":"12/27/2008","granularity":"day","time":"2008/12/27 00:00:00 -0500"},"total":4,"longitude":-110.8162263,"id":"advy9tqhbaor","location":"Lakeside Park"},"type":"Feature","geometry":{"type":"Point","coordinates":[-110.8162263,32.1861206]}},{"properties":{"latitude":27.0207104,"date":{"end_time":"2009/02/23 00:00:00 -0500","original":"2/22/2009","granularity":"day","time":"2009/02/22 00:00:00 -0500"},"total":4,"longitude":-108.9255166,"id":"advy9tttn1ky","location":"Stephanie Meyer's Yard"},"type":"Feature","geometry":{"type":"Point","coordinates":[-108.9255166,27.0207104]}},{"properties":{"latitude":31.6714585,"date":{"end_time":"2009/06/12 00:00:00 -0400","original":"6/11/2009","granularity":"day","time":"2009/06/11 00:00:00 -0400"},"total":4,"longitude":-110.941082,"id":"advy9twm92sj","location":"Montosa Canyon"},"type":"Feature","geometry":{"type":"Point","coordinates":[-110.941082,31.6714585]}},{"properties":{"latitude":32.2605631,"date":{"end_time":"2009/11/08 00:00:00 -0500","original":"11/7/2009","granularity":"day","time":"2009/11/07 00:00:00 -0500"},"total":4,"longitude":-110.8727628,"id":"advy9tkdgm3x","location":"Fort Lowell Park and Pantano Wash"},"type":"Feature","geometry":{"type":"Point","coordinates":[-110.8727628,32.2605631]}},{"properties":{"latitude":31.8908005,"date":{"end_time":"2001/07/06 00:00:00 -0400","original":"7/5/2001","granularity":"day","time":"2001/07/05 00:00:00 -0400"},"total":3,"longitude":-109.1679001,"id":"advy9tlq2gt3","location":"Cave Creek Canyon"},"type":"Feature","geometry":{"type":"Point","coordinates":[-109.1679001,31.8908005]}},{"properties":{"latitude":60.1046894,"date":{"end_time":"2002/06/07 00:00:00 -0400","original":"6/6/2002","granularity":"day","time":"2002/06/06 00:00:00 -0400"},"total":3,"longitude":-149.4439316,"id":"advy9ttb0pvd","location":"Seward, General"},"type":"Feature","geometry":{"type":"Point","coordinates":[-149.4439316,60.1046894]}},{"properties":{"latitude":17.1523615,"date":{"end_time":"2002/11/02 00:00:00 -0500","original":"11/1/2002","granularity":"day","time":"2002/11/01 00:00:00 -0500"},"total":3,"longitude":-89.0741444,"id":"advy9trzfe8w","location":"San Ignacio"},"type":"Feature","geometry":{"type":"Point","coordinates":[-89.0741444,17.1523615]}},{"properties":{"latitude":14.6947743,"date":{"end_time":"2002/11/17 00:00:00 -0500","original":"11/16/2002","granularity":"day","time":"2002/11/16 00:00:00 -0500"},"total":3,"longitude":-91.1937332,"id":"advy9tr0jse0","location":"Lago de Atitlan area"},"type":"Feature","geometry":{"type":"Point","coordinates":[-91.1937332,14.6947743]}},{"properties":{"latitude":41.57306,"date":{"end_time":"2003/03/20 00:00:00 -0500","original":"3/19/2003","granularity":"day","time":"2003/03/19 00:00:00 -0500"},"total":3,"longitude":-93.6186218,"id":"advy9tkjiezr","location":"Des Moines"},"type":"Feature","geometry":{"type":"Point","coordinates":[-93.6186218,41.57306]}},{"properties":{"latitude":58.3908598,"date":{"end_time":"2003/06/23 00:00:00 -0400","original":"6/22/2003","granularity":"day","time":"2003/06/22 00:00:00 -0400"},"total":3,"longitude":-134.6773624,"id":"advy9twvh59n","location":"Spaulding Meadows Trail"},"type":"Feature","geometry":{"type":"Point","coordinates":[-134.6773624,58.3908598]}},{"properties":{"latitude":58.5422346,"date":{"end_time":"2003/07/13 00:00:00 -0400","original":"7/12/2003","granularity":"day","time":"2003/07/12 00:00:00 -0400"},"total":3,"longitude":-134.7819901,"id":"advy9tvo6oqa","location":"Juneau--Eagle Glacier Trail"},"type":"Feature","geometry":{"type":"Point","coordinates":[-134.7819901,58.5422346]}},{"properties":{"latitude":32.3732992,"date":{"end_time":"2004/10/06 00:00:00 -0400","original":"10/5/2004","granularity":"day","time":"2004/10/05 00:00:00 -0400"},"total":3,"longitude":-106.7304289,"id":"advy9ttfl0ee","location":"Las Cruces - Dad"},"type":"Feature","geometry":{"type":"Point","coordinates":[-106.7304289,32.3732992]}},{"properties":{"latitude":32.455812,"date":{"end_time":"2004/10/09 00:00:00 -0400","original":"10/8/2004","granularity":"day","time":"2004/10/08 00:00:00 -0400"},"total":3,"longitude":-106.720794,"id":"advy9tvp15zm","location":"Issack Lake"},"type":"Feature","geometry":{"type":"Point","coordinates":[-106.720794,32.455812]}},{"properties":{"latitude":31.9136009,"date":{"end_time":"2004/10/10 00:00:00 -0400","original":"10/9/2004","granularity":"day","time":"2004/10/09 00:00:00 -0400"},"total":3,"longitude":-109.1408005,"id":"advy9tj4itoz","location":"Portal"},"type":"Feature","geometry":{"type":"Point","coordinates":[-109.1408005,31.9136009]}},{"properties":{"latitude":31.8724995,"date":{"end_time":"2004/10/10 00:00:00 -0400","original":"10/9/2004","granularity":"day","time":"2004/10/09 00:00:00 -0400"},"total":3,"longitude":-109.2335968,"id":"advy9tpttuz5","location":"Cave Creek Canyon--Herb Martyr CG"},"type":"Feature","geometry":{"type":"Point","coordinates":[-109.2335968,31.8724995]}},{"properties":{"latitude":31.921224,"date":{"end_time":"2004/10/11 00:00:00 -0400","original":"10/10/2004","granularity":"day","time":"2004/10/10 00:00:00 -0400"},"total":3,"longitude":-109.1282621,"id":"advy9trx09pc","location":"Portal--Jasper's yard"},"type":"Feature","geometry":{"type":"Point","coordinates":[-109.1282621,31.921224]}},{"properties":{"latitude":32.910465,"date":{"end_time":"2004/10/14 00:00:00 -0400","original":"10/13/2004","granularity":"day","time":"2004/10/13 00:00:00 -0400"},"total":3,"longitude":-107.765755,"id":"advy9ts0cf86","location":"Emory Pass"},"type":"Feature","geometry":{"type":"Point","coordinates":[-107.765755,32.910465]}},{"properties":{"latitude":47.47795,"date":{"end_time":"2004/11/26 00:00:00 -0500","original":"11/25/2004","granularity":"day","time":"2004/11/25 00:00:00 -0500"},"total":3,"longitude":-122.362434,"id":"advy9tu7fbbn","location":"Seahurst Park"},"type":"Feature","geometry":{"type":"Point","coordinates":[-122.362434,47.47795]}},{"properties":{"latitude":58.4123234,"date":{"end_time":"2005/02/11 00:00:00 -0500","original":"2/10/2005","granularity":"day","time":"2005/02/10 00:00:00 -0500"},"total":3,"longitude":-134.7679138,"id":"advy9tt8q3bp","location":"Juneau - Jeff and Terese's house"},"type":"Feature","geometry":{"type":"Point","coordinates":[-134.7679138,58.4123234]}},{"properties":{"latitude":19.9444965,"date":{"end_time":"2005/03/19 00:00:00 -0500","original":"3/18/2005","granularity":"day","time":"2005/03/18 00:00:00 -0500"},"total":3,"longitude":-155.8672857,"id":"advy9tmqgpxd","location":"Puako Petroglyph Preserve"},"type":"Feature","geometry":{"type":"Point","coordinates":[-155.8672857,19.9444965]}},{"properties":{"latitude":19.3292867,"date":{"end_time":"2005/03/25 00:00:00 -0500","original":"3/24/2005","granularity":"day","time":"2005/03/24 00:00:00 -0500"},"total":3,"longitude":-155.194416,"id":"advy9tpfahx8","location":"Hawai'i Volcanoes National Park (general)"},"type":"Feature","geometry":{"type":"Point","coordinates":[-155.194416,19.3292867]}},{"properties":{"latitude":22.0714028,"date":{"end_time":"2005/04/02 00:00:00 -0500","original":"4/1/2005","granularity":"day","time":"2005/04/01 00:00:00 -0500"},"total":3,"longitude":-159.6619892,"id":"advy9tocvrgh","location":"Waimea Canyon"},"type":"Feature","geometry":{"type":"Point","coordinates":[-159.6619892,22.0714028]}},{"properties":{"latitude":22.2320374,"date":{"end_time":"2005/04/04 00:00:00 -0400","original":"4/3/2005","granularity":"day","time":"2005/04/03 00:00:00 -0500"},"total":3,"longitude":-159.4022757,"id":"advy9tuzbbs9","location":"Kilauea Point NWR"},"type":"Feature","geometry":{"type":"Point","coordinates":[-159.4022757,22.2320374]}},{"properties":{"latitude":38.0909943,"date":{"end_time":"2005/11/25 00:00:00 -0500","original":"11/24/2005","granularity":"day","time":"2005/11/24 00:00:00 -0500"},"total":3,"longitude":-102.622261,"id":"advy9tpvi684","location":"Lamar area"},"type":"Feature","geometry":{"type":"Point","coordinates":[-102.622261,38.0909943]}},{"properties":{"latitude":33.3614502,"date":{"end_time":"2005/12/08 00:00:00 -0500","original":"12/7/2005","granularity":"day","time":"2005/12/07 00:00:00 -0500"},"total":3,"longitude":-111.7339478,"id":"advy9tk6l7u6","location":"Riparian Preserve at Gilbert Water Ranch"},"type":"Feature","geometry":{"type":"Point","coordinates":[-111.7339478,33.3614502]}},{"properties":{"latitude":32.2212982,"date":{"end_time":"2005/12/20 00:00:00 -0500","original":"12/19/2005","granularity":"day","time":"2005/12/19 00:00:00 -0500"},"total":3,"longitude":-111.0286026,"id":"advy9txe47h1","location":"Tucson--Shannon-Broadway Desert"},"type":"Feature","geometry":{"type":"Point","coordinates":[-111.0286026,32.2212982]}},{"properties":{"latitude":-0.4640815,"date":{"end_time":"2006/01/26 00:00:00 -0500","original":"1/25/2006","granularity":"day","time":"2006/01/25 00:00:00 -0500"},"total":3,"longitude":-77.8892469,"id":"advy9twbfcbi","location":"Baeza--town &amp; vicinity"},"type":"Feature","geometry":{"type":"Point","coordinates":[-77.8892469,-0.4640815]}},{"properties":{"latitude":-0.9971306,"date":{"end_time":"2006/01/27 00:00:00 -0500","original":"1/26/2006","granularity":"day","time":"2006/01/26 00:00:00 -0500"},"total":3,"longitude":-77.8180075,"id":"advy9tt9j47l","location":"Tena--Parque Amazonico \"La Isla\""},"type":"Feature","geometry":{"type":"Point","coordinates":[-77.8180075,-0.9971306]}},{"properties":{"latitude":-1.0642322,"date":{"end_time":"2006/02/09 00:00:00 -0500","original":"2/8/2006","granularity":"day","time":"2006/02/08 00:00:00 -0500"},"total":3,"longitude":-77.6330423,"id":"advy9ti01vqv","location":"Cabañas Aliñahui"},"type":"Feature","geometry":{"type":"Point","coordinates":[-77.6330423,-1.0642322]}},{"properties":{"latitude":-13.163607,"date":{"end_time":"2006/03/17 00:00:00 -0500","original":"3/16/2006","granularity":"day","time":"2006/03/16 00:00:00 -0500"},"total":3,"longitude":-72.546165,"id":"advy9tw1x41g","location":"Machu Picchu Ruins"},"type":"Feature","geometry":{"type":"Point","coordinates":[-72.546165,-13.163607]}},{"properties":{"latitude":31.9224611,"date":{"end_time":"2006/09/11 00:00:00 -0400","original":"9/10/2006","granularity":"day","time":"2006/09/10 00:00:00 -0400"},"total":3,"longitude":-109.9675232,"id":"advy9to4q7tn","location":"Cochise Stronghold"},"type":"Feature","geometry":{"type":"Point","coordinates":[-109.9675232,31.9224611]}},{"properties":{"latitude":57.2239703,"date":{"end_time":"2006/09/28 00:00:00 -0400","original":"9/27/2006","granularity":"day","time":"2006/09/27 00:00:00 -0400"},"total":3,"longitude":-168.5192871,"id":"advy9tr7k3hi","location":"Offshore - Priblof Islands area"},"type":"Feature","geometry":{"type":"Point","coordinates":[-168.5192871,57.2239703]}},{"properties":{"latitude":32.0331096,"date":{"end_time":"2006/11/20 00:00:00 -0500","original":"11/19/2006","granularity":"day","time":"2006/11/19 00:00:00 -0500"},"total":3,"longitude":-110.9914398,"id":"advy9tlo703z","location":"I-19 Corridor--Tucson to Green Valley"},"type":"Feature","geometry":{"type":"Point","coordinates":[-110.9914398,32.0331096]}},{"properties":{"latitude":32.305044,"date":{"end_time":"2006/11/26 00:00:00 -0500","original":"11/25/2006","granularity":"day","time":"2006/11/25 00:00:00 -0500"},"total":3,"longitude":-106.5930891,"id":"advy9tm47g1h","location":"Soledad Canyon Day Use Area"},"type":"Feature","geometry":{"type":"Point","coordinates":[-106.5930891,32.305044]}},{"properties":{"latitude":32.337101,"date":{"end_time":"2006/12/05 00:00:00 -0500","original":"12/4/2006","granularity":"day","time":"2006/12/04 00:00:00 -0500"},"total":3,"longitude":-110.6921005,"id":"advy9tp52nfd","location":"Mt. Lemmon--Molino Basin"},"type":"Feature","geometry":{"type":"Point","coordinates":[-110.6921005,32.337101]}},{"properties":{"latitude":32.4484106,"date":{"end_time":"2006/12/05 00:00:00 -0500","original":"12/4/2006","granularity":"day","time":"2006/12/04 00:00:00 -0500"},"total":3,"longitude":-110.7810647,"id":"advy9ths0d44","location":"Mt. Lemmon--Ski Valley"},"type":"Feature","geometry":{"type":"Point","coordinates":[-110.7810647,32.4484106]}},{"properties":{"latitude":32.2102866,"date":{"end_time":"2006/12/06 00:00:00 -0500","original":"12/5/2006","granularity":"day","time":"2006/12/05 00:00:00 -0500"},"total":3,"longitude":-110.9235907,"id":"advy9tmis53b","location":"Reid Park"},"type":"Feature","geometry":{"type":"Point","coordinates":[-110.9235907,32.2102866]}},{"properties":{"latitude":32.2765723,"date":{"end_time":"2006/12/09 00:00:00 -0500","original":"12/8/2006","granularity":"day","time":"2006/12/08 00:00:00 -0500"},"total":3,"longitude":-108.8799135,"id":"advy9tn024iz","location":"Lordsburg Playa"},"type":"Feature","geometry":{"type":"Point","coordinates":[-108.8799135,32.2765723]}},{"properties":{"latitude":32.3616486,"date":{"end_time":"2007/01/02 00:00:00 -0500","original":"1/1/2007","granularity":"day","time":"2007/01/01 00:00:00 -0500"},"total":3,"longitude":-110.9258201,"id":"advy9txenimw","location":"Pima Canyon"},"type":"Feature","geometry":{"type":"Point","coordinates":[-110.9258201,32.3616486]}},{"properties":{"latitude":31.4290009,"date":{"end_time":"2007/03/27 00:00:00 -0400","original":"3/26/2007","granularity":"day","time":"2007/03/26 00:00:00 -0400"},"total":3,"longitude":-111.1905975,"id":"advy9tuhh82k","location":"Sycamore Canyon (Santa Cruz Co.)"},"type":"Feature","geometry":{"type":"Point","coordinates":[-111.1905975,31.4290009]}},{"properties":{"latitude":32.4210014,"date":{"end_time":"2007/04/27 00:00:00 -0400","original":"4/26/2007","granularity":"day","time":"2007/04/26 00:00:00 -0400"},"total":3,"longitude":-110.731102,"id":"advy9tsf2ohh","location":"Mt. Lemmon--Bear Wallow"},"type":"Feature","geometry":{"type":"Point","coordinates":[-110.731102,32.4210014]}},{"properties":{"latitude":31.4180254,"date":{"end_time":"2007/05/08 00:00:00 -0400","original":"5/7/2007","granularity":"day","time":"2007/05/07 00:00:00 -0400"},"total":3,"longitude":-111.2382513,"id":"advy9trch65h","location":"California Gulch"},"type":"Feature","geometry":{"type":"Point","coordinates":[-111.2382513,31.4180254]}},{"properties":{"latitude":31.422409,"date":{"end_time":"2007/05/08 00:00:00 -0400","original":"5/7/2007","granularity":"day","time":"2007/05/07 00:00:00 -0400"},"total":3,"longitude":-111.245972,"id":"advy9twv4mim","location":"Oro Blanco Mine"},"type":"Feature","geometry":{"type":"Point","coordinates":[-111.245972,31.422409]}},{"properties":{"latitude":51.885604,"date":{"end_time":"2007/05/23 00:00:00 -0400","original":"5/22/2007","granularity":"day","time":"2007/05/22 00:00:00 -0400"},"total":3,"longitude":-176.5914917,"id":"advy9tppo4wu","location":"Adak Is.--Kuluk Bay"},"type":"Feature","geometry":{"type":"Point","coordinates":[-176.5914917,51.885604]}},{"properties":{"latitude":31.4156019,"date":{"end_time":"2007/08/04 00:00:00 -0400","original":"8/3/2007","granularity":"day","time":"2007/08/03 00:00:00 -0400"},"total":3,"longitude":-110.2765277,"id":"advy9tslb80z","location":"Miller Canyon--Beatty's Guest Ranch"},"type":"Feature","geometry":{"type":"Point","coordinates":[-110.2765277,31.4156019]}},{"properties":{"latitude":31.9815,"date":{"end_time":"2007/08/24 00:00:00 -0400","original":"8/23/2007","granularity":"day","time":"2007/08/23 00:00:00 -0400"},"total":3,"longitude":-110.2924,"id":"advy9tutvw4g","location":"Benson STP"},"type":"Feature","geometry":{"type":"Point","coordinates":[-110.2924,31.9815]}},{"properties":{"latitude":32.3175119,"date":{"end_time":"2007/11/11 00:00:00 -0500","original":"11/10/2007","granularity":"day","time":"2007/11/10 00:00:00 -0500"},"total":3,"longitude":-111.0506415,"id":"advy9tqgmj9q","location":"Gravel Pit"},"type":"Feature","geometry":{"type":"Point","coordinates":[-111.0506415,32.3175119]}},{"properties":{"latitude":31.2926341,"date":{"end_time":"2008/02/07 00:00:00 -0500","original":"2/6/2008","granularity":"day","time":"2008/02/06 00:00:00 -0500"},"total":3,"longitude":-110.9811401,"id":"advy9tihu6rq","location":"Nogales - KM21 checkpoint area"},"type":"Feature","geometry":{"type":"Point","coordinates":[-110.9811401,31.2926341]}},{"properties":{"latitude":27.2143349,"date":{"end_time":"2008/02/10 00:00:00 -0500","original":"2/9/2008","granularity":"day","time":"2008/02/09 00:00:00 -0500"},"total":3,"longitude":-109.1278839,"id":"advy9tn7w2v3","location":"Rio Mayo - below Mocuzari Dam"},"type":"Feature","geometry":{"type":"Point","coordinates":[-109.1278839,27.2143349]}},{"properties":{"latitude":32.3377823,"date":{"end_time":"2008/04/07 00:00:00 -0400","original":"4/6/2008","granularity":"day","time":"2008/04/06 00:00:00 -0400"},"total":3,"longitude":-110.718673,"id":"advy9tks2c9u","location":"Mt. Lemmon--Gordon Hirabayashi RA (Prison Camp)"},"type":"Feature","geometry":{"type":"Point","coordinates":[-110.718673,32.3377823]}},{"properties":{"latitude":31.6843547,"date":{"end_time":"2008/04/24 00:00:00 -0400","original":"4/23/2008","granularity":"day","time":"2008/04/23 00:00:00 -0400"},"total":3,"longitude":-110.6556702,"id":"advy9tkuc6hr","location":"Sonoita area"},"type":"Feature","geometry":{"type":"Point","coordinates":[-110.6556702,31.6843547]}},{"properties":{"latitude":32.3771019,"date":{"end_time":"2008/05/06 00:00:00 -0400","original":"5/5/2008","granularity":"day","time":"2008/05/05 00:00:00 -0400"},"total":3,"longitude":-110.6850967,"id":"advy9tx8tiki","location":"Mt. Lemmon--Bear Canyon (General Hitchcock Campground)"},"type":"Feature","geometry":{"type":"Point","coordinates":[-110.6850967,32.3771019]}},{"properties":{"latitude":14.3570731,"date":{"end_time":"2008/07/24 00:00:00 -0400","original":"7/23/2008","granularity":"day","time":"2008/07/23 00:00:00 -0400"},"total":3,"longitude":100.5605156,"id":"advy9tnfcg10","location":"Ayutthaya"},"type":"Feature","geometry":{"type":"Point","coordinates":[100.5605156,14.3570731]}},{"properties":{"latitude":19.3983509,"date":{"end_time":"2008/08/01 00:00:00 -0400","original":"7/31/2008","granularity":"day","time":"2008/07/31 00:00:00 -0400"},"total":3,"longitude":98.9301664,"id":"advy9tlln3q9","location":"Chiang Dao--Malee's Nature Bungalows"},"type":"Feature","geometry":{"type":"Point","coordinates":[98.9301664,19.3983509]}},{"properties":{"latitude":27.4847,"date":{"end_time":"2008/08/16 00:00:00 -0400","original":"8/15/2008","granularity":"day","time":"2008/08/15 00:00:00 -0400"},"total":3,"longitude":84.5409279,"id":"advy9tkebdui","location":"Chitwan NP"},"type":"Feature","geometry":{"type":"Point","coordinates":[84.5409279,27.4847]}},{"properties":{"latitude":41.0119324,"date":{"end_time":"2008/09/10 00:00:00 -0400","original":"9/9/2008","granularity":"day","time":"2008/09/09 00:00:00 -0400"},"total":3,"longitude":28.9836502,"id":"advy9txz6ef2","location":"Istanbul--Topkapi Palace"},"type":"Feature","geometry":{"type":"Point","coordinates":[28.9836502,41.0119324]}},{"properties":{"latitude":45.642908,"date":{"end_time":"2008/09/15 00:00:00 -0400","original":"9/14/2008","granularity":"day","time":"2008/09/14 00:00:00 -0400"},"total":3,"longitude":25.5911708,"id":"advy9tn3b8po","location":"Brasov - town"},"type":"Feature","geometry":{"type":"Point","coordinates":[25.5911708,45.642908]}},{"properties":{"latitude":53.3408158,"date":{"end_time":"2008/09/27 00:00:00 -0400","original":"9/26/2008","granularity":"day","time":"2008/09/26 00:00:00 -0400"},"total":3,"longitude":-6.5408134,"id":"advy9tx7m3ap","location":"Celbridge area"},"type":"Feature","geometry":{"type":"Point","coordinates":[-6.5408134,53.3408158]}},{"properties":{"latitude":-12.111166,"date":{"end_time":"2008/10/10 00:00:00 -0400","original":"10/9/2008","granularity":"day","time":"2008/10/09 00:00:00 -0400"},"total":3,"longitude":-77.051239,"id":"advy9toaq1zx","location":"Lima - Miraflores - general area"},"type":"Feature","geometry":{"type":"Point","coordinates":[-77.051239,-12.111166]}},{"properties":{"latitude":-13.2493028,"date":{"end_time":"2008/10/16 00:00:00 -0400","original":"10/15/2008","granularity":"day","time":"2008/10/15 00:00:00 -0400"},"total":3,"longitude":-72.2900391,"id":"advy9tu04tup","location":"Ollantaytambo"},"type":"Feature","geometry":{"type":"Point","coordinates":[-72.2900391,-13.2493028]}},{"properties":{"latitude":-17.7502398,"date":{"end_time":"2008/11/07 00:00:00 -0500","original":"11/6/2008","granularity":"day","time":"2008/11/06 00:00:00 -0500"},"total":3,"longitude":-63.2092381,"id":"advy9tvhl4tu","location":"Puente Urubo"},"type":"Feature","geometry":{"type":"Point","coordinates":[-63.2092381,-17.7502398]}},{"properties":{"latitude":38.8891456,"date":{"end_time":"2008/11/21 00:00:00 -0500","original":"11/20/2008","granularity":"day","time":"2008/11/20 00:00:00 -0500"},"total":3,"longitude":-77.0304876,"id":"advy9to7cbqb","location":"National Mall"},"type":"Feature","geometry":{"type":"Point","coordinates":[-77.0304876,38.8891456]}},{"properties":{"latitude":32.3033188,"date":{"end_time":"2009/01/03 00:00:00 -0500","original":"1/2/2009","granularity":"day","time":"2009/01/02 00:00:00 -0500"},"total":3,"longitude":-111.0477072,"id":"advy9tq2467k","location":"Santa Cruz River--Sunset Rd. to Camino del Cerro"},"type":"Feature","geometry":{"type":"Point","coordinates":[-111.0477072,32.3033188]}},{"properties":{"latitude":40.4115,"date":{"end_time":"2009/07/18 00:00:00 -0400","original":"7/17/2009","granularity":"day","time":"2009/07/17 00:00:00 -0400"},"total":3,"longitude":-105.08763,"id":"advy9tuvk9gp","location":"Loveland--Lake Loveland"},"type":"Feature","geometry":{"type":"Point","coordinates":[-105.08763,40.4115]}},{"properties":{"latitude":27.0416849,"date":{"end_time":"2011/01/06 00:00:00 -0500","original":"1/5/2011","granularity":"day","time":"2011/01/05 00:00:00 -0500"},"total":3,"longitude":-108.7337997,"id":"advy9thqsd1i","location":"Palo Injerto Ranch (REMM Reserve)"},"type":"Feature","geometry":{"type":"Point","coordinates":[-108.7337997,27.0416849]}},{"properties":{"latitude":-13.1578509,"date":{"end_time":"2011/07/15 00:00:00 -0400","original":"7/14/2011","granularity":"day","time":"2011/07/14 00:00:00 -0400"},"total":3,"longitude":-72.5225867,"id":"advy9tld650r","location":"Inkaterra hotel - feeders and trails"},"type":"Feature","geometry":{"type":"Point","coordinates":[-72.5225867,-13.1578509]}},{"properties":{"latitude":10.4205726,"date":{"end_time":"2011/07/27 00:00:00 -0400","original":"7/26/2011","granularity":"day","time":"2011/07/26 00:00:00 -0400"},"total":3,"longitude":-75.5523583,"id":"advy9tq3n7jt","location":"Cartagena - old town and seawall"},"type":"Feature","geometry":{"type":"Point","coordinates":[-75.5523583,10.4205726]}},{"properties":{"latitude":32.1805717,"date":{"end_time":"2011/12/18 00:00:00 -0500","original":"12/17/2011","granularity":"day","time":"2011/12/17 00:00:00 -0500"},"total":3,"longitude":-111.0074136,"id":"advy9tqce6j2","location":"Kennedy Park"},"type":"Feature","geometry":{"type":"Point","coordinates":[-111.0074136,32.1805717]}},{"properties":{"latitude":32.0054606,"date":{"end_time":"2001/05/13 00:00:00 -0400","original":"5/12/2001","granularity":"day","time":"2001/05/12 00:00:00 -0400"},"total":2,"longitude":-109.3566656,"id":"advy9tm1xkr7","location":"Chiricahua National Monument"},"type":"Feature","geometry":{"type":"Point","coordinates":[-109.3566656,32.0054606]}},{"properties":{"latitude":60.2318646,"date":{"end_time":"2001/08/30 00:00:00 -0400","original":"8/29/2001","granularity":"day","time":"2001/08/29 00:00:00 -0400"},"total":2,"longitude":-132.9160309,"id":"advy9tni37eq","location":"Teslin Lake--Teslin Lake Bird Observatory"},"type":"Feature","geometry":{"type":"Point","coordinates":[-132.9160309,60.2318646]}},{"properties":{"latitude":61.1388026,"date":{"end_time":"2002/03/14 00:00:00 -0500","original":"3/13/2002","granularity":"day","time":"2002/03/13 00:00:00 -0500"},"total":2,"longitude":-149.7107792,"id":"advy9tjccvy5","location":"Anchorage--Prospect Heights Trailhead"},"type":"Feature","geometry":{"type":"Point","coordinates":[-149.7107792,61.1388026]}},{"properties":{"latitude":61.133524,"date":{"end_time":"2002/05/26 00:00:00 -0400","original":"5/25/2002","granularity":"day","time":"2002/05/25 00:00:00 -0400"},"total":2,"longitude":-146.3270931,"id":"advy9ttjjj34","location":"Valdez--Duck Flats"},"type":"Feature","geometry":{"type":"Point","coordinates":[-146.3270931,61.133524]}},{"properties":{"latitude":60.101398,"date":{"end_time":"2002/06/06 00:00:00 -0400","original":"6/5/2002","granularity":"day","time":"2002/06/05 00:00:00 -0400"},"total":2,"longitude":-149.4350052,"id":"advy9tn5v3rd","location":"Seward--Waterfront (by Iditarod Mem.)"},"type":"Feature","geometry":{"type":"Point","coordinates":[-149.4350052,60.101398]}},{"properties":{"latitude":61.0210376,"date":{"end_time":"2002/07/15 00:00:00 -0400","original":"7/14/2002","granularity":"day","time":"2002/07/14 00:00:00 -0400"},"total":2,"longitude":-149.0953088,"id":"advy9tritzb3","location":"Crow Creek Pass Trail (Chugach NF-Girdwood)"},"type":"Feature","geometry":{"type":"Point","coordinates":[-149.0953088,61.0210376]}},{"properties":{"latitude":60.1645262,"date":{"end_time":"2002/09/04 00:00:00 -0400","original":"9/3/2002","granularity":"day","time":"2002/09/03 00:00:00 -0400"},"total":2,"longitude":-134.7105789,"id":"advy9tl627c5","location":"Carcross"},"type":"Feature","geometry":{"type":"Point","coordinates":[-134.7105789,60.1645262]}},{"properties":{"latitude":42.9423499,"date":{"end_time":"2002/09/18 00:00:00 -0400","original":"9/17/2002","granularity":"day","time":"2002/09/17 00:00:00 -0400"},"total":2,"longitude":-122.1240234,"id":"advy9thpvefi","location":"Crater Lake NP"},"type":"Feature","geometry":{"type":"Point","coordinates":[-122.1240234,42.9423499]}},{"properties":{"latitude":37.26904,"date":{"end_time":"2002/09/26 00:00:00 -0400","original":"9/25/2002","granularity":"day","time":"2002/09/25 00:00:00 -0400"},"total":2,"longitude":-119.25796,"id":"advy9tm5idqr","location":"California"},"type":"Feature","geometry":{"type":"Point","coordinates":[-119.25796,37.26904]}},{"properties":{"latitude":15.1637227,"date":{"end_time":"2002/11/07 00:00:00 -0500","original":"11/6/2002","granularity":"day","time":"2002/11/06 00:00:00 -0500"},"total":2,"longitude":-90.2332878,"id":"advy9tr7k070","location":"Biotopo del Quetzal \"Mario Dary Rivera\""},"type":"Feature","geometry":{"type":"Point","coordinates":[-90.2332878,15.1637227]}},{"properties":{"latitude":14.5589947,"date":{"end_time":"2002/11/09 00:00:00 -0500","original":"11/8/2002","granularity":"day","time":"2002/11/08 00:00:00 -0500"},"total":2,"longitude":-90.734024,"id":"advy9tmlg7vd","location":"Antigua Guatemala"},"type":"Feature","geometry":{"type":"Point","coordinates":[-90.734024,14.5589947]}},{"properties":{"latitude":10.30702,"date":{"end_time":"2003/02/03 00:00:00 -0500","original":"2/2/2003","granularity":"day","time":"2003/02/02 00:00:00 -0500"},"total":2,"longitude":-84.80974,"id":"advy9tkmu3re","location":"Monteverde"},"type":"Feature","geometry":{"type":"Point","coordinates":[-84.80974,10.30702]}},{"properties":{"latitude":8.48025,"date":{"end_time":"2003/02/10 00:00:00 -0500","original":"2/9/2003","granularity":"day","time":"2003/02/09 00:00:00 -0500"},"total":2,"longitude":-83.5893389,"id":"advy9tp0zupf","location":"PN Corcovado--Sirena"},"type":"Feature","geometry":{"type":"Point","coordinates":[-83.5893389,8.48025]}},{"properties":{"latitude":58.2094293,"date":{"end_time":"2003/06/28 00:00:00 -0400","original":"6/27/2003","granularity":"day","time":"2003/06/27 00:00:00 -0400"},"total":2,"longitude":-134.2199707,"id":"advy9ts1ic5u","location":"Juneau--Point Bishop trail"},"type":"Feature","geometry":{"type":"Point","coordinates":[-134.2199707,58.2094293]}},{"properties":{"latitude":58.3034884,"date":{"end_time":"2003/09/23 00:00:00 -0400","original":"9/22/2003","granularity":"day","time":"2003/09/22 00:00:00 -0400"},"total":2,"longitude":-134.6961594,"id":"advy9tm8nqtt","location":"North Douglas - boat"},"type":"Feature","geometry":{"type":"Point","coordinates":[-134.6961594,58.3034884]}},{"properties":{"latitude":58.4123114,"date":{"end_time":"2003/10/15 00:00:00 -0400","original":"10/14/2003","granularity":"day","time":"2003/10/14 00:00:00 -0400"},"total":2,"longitude":-135.3996277,"id":"advy9tqauxzp","location":"Couverden area"},"type":"Feature","geometry":{"type":"Point","coordinates":[-135.3996277,58.4123114]}},{"properties":{"latitude":58.264503,"date":{"end_time":"2003/11/02 00:00:00 -0500","original":"11/1/2003","granularity":"day","time":"2003/11/01 00:00:00 -0500"},"total":2,"longitude":-134.3960953,"id":"advy9trg28o0","location":"Juneau - Mt. Jumbo Trail"},"type":"Feature","geometry":{"type":"Point","coordinates":[-134.3960953,58.264503]}},{"properties":{"latitude":58.3553602,"date":{"end_time":"2004/03/28 00:00:00 -0500","original":"3/27/2004","granularity":"day","time":"2004/03/27 00:00:00 -0500"},"total":2,"longitude":-134.6259499,"id":"advy9tnu6vrn","location":"Juneau--Mendenhall Wetlands-W of river"},"type":"Feature","geometry":{"type":"Point","coordinates":[-134.6259499,58.3553602]}},{"properties":{"latitude":58.5730383,"date":{"end_time":"2004/05/10 00:00:00 -0400","original":"5/9/2004","granularity":"day","time":"2004/05/09 00:00:00 -0400"},"total":2,"longitude":-134.7545242,"id":"advy9tmkdiw1","location":"Herbert Glacier Trail"},"type":"Feature","geometry":{"type":"Point","coordinates":[-134.7545242,58.5730383]}},{"properties":{"latitude":57.4991259,"date":{"end_time":"2004/05/21 00:00:00 -0400","original":"5/20/2004","granularity":"day","time":"2004/05/20 00:00:00 -0400"},"total":2,"longitude":-135.2492523,"id":"advy9tjuuhi1","location":"Peril Strait"},"type":"Feature","geometry":{"type":"Point","coordinates":[-135.2492523,57.4991259]}},{"properties":{"latitude":64.4912815,"date":{"end_time":"2004/06/11 00:00:00 -0400","original":"6/10/2004","granularity":"day","time":"2004/06/10 00:00:00 -0400"},"total":2,"longitude":-164.7520065,"id":"advy9tsyoixm","location":"Nome--Safety Sound"},"type":"Feature","geometry":{"type":"Point","coordinates":[-164.7520065,64.4912815]}},{"properties":{"latitude":64.5496205,"date":{"end_time":"2004/06/11 00:00:00 -0400","original":"6/10/2004","granularity":"day","time":"2004/06/10 00:00:00 -0400"},"total":2,"longitude":-164.4399261,"id":"advy9tryy3ls","location":"Nome--Solomon (Nome-Council Rd.)"},"type":"Feature","geometry":{"type":"Point","coordinates":[-164.4399261,64.5496205]}},{"properties":{"latitude":64.4557741,"date":{"end_time":"2004/06/11 00:00:00 -0400","original":"6/10/2004","granularity":"day","time":"2004/06/10 00:00:00 -0400"},"total":2,"longitude":-165.1001358,"id":"advy9tvnsa6j","location":"Nome-Council Rd.--Hastings Creek"},"type":"Feature","geometry":{"type":"Point","coordinates":[-165.1001358,64.4557741]}},{"properties":{"latitude":64.5040676,"date":{"end_time":"2004/06/11 00:00:00 -0400","original":"6/10/2004","granularity":"day","time":"2004/06/10 00:00:00 -0400"},"total":2,"longitude":-165.4377079,"id":"advy9tpuugvg","location":"Nome--Sewage Ponds"},"type":"Feature","geometry":{"type":"Point","coordinates":[-165.4377079,64.5040676]}},{"properties":{"latitude":65.287476,"date":{"end_time":"2004/06/12 00:00:00 -0400","original":"6/11/2004","granularity":"day","time":"2004/06/11 00:00:00 -0400"},"total":2,"longitude":-164.7711468,"id":"advy9tkcakgi","location":"Kougarok Road--MP 72 (Nome)"},"type":"Feature","geometry":{"type":"Point","coordinates":[-164.7711468,65.287476]}},{"properties":{"latitude":64.9038908,"date":{"end_time":"2004/06/12 00:00:00 -0400","original":"6/11/2004","granularity":"day","time":"2004/06/11 00:00:00 -0400"},"total":2,"longitude":-165.0094986,"id":"advy9ttbrn7j","location":"Kougarok Road--Salmon Lake (Nome)"},"type":"Feature","geometry":{"type":"Point","coordinates":[-165.0094986,64.9038908]}},{"properties":{"latitude":64.6344688,"date":{"end_time":"2004/06/13 00:00:00 -0400","original":"6/12/2004","granularity":"day","time":"2004/06/12 00:00:00 -0400"},"total":2,"longitude":-165.7150269,"id":"advy9tj4r8iv","location":"Teller Rd. (Nome)"},"type":"Feature","geometry":{"type":"Point","coordinates":[-165.7150269,64.6344688]}},{"properties":{"latitude":60.1189347,"date":{"end_time":"2004/06/19 00:00:00 -0400","original":"6/18/2004","granularity":"day","time":"2004/06/18 00:00:00 -0400"},"total":2,"longitude":-134.5591736,"id":"advy9tllmg1t","location":"Bove Island Overlook - Yukon"},"type":"Feature","geometry":{"type":"Point","coordinates":[-134.5591736,60.1189347]}},{"properties":{"latitude":60.1652549,"date":{"end_time":"2004/07/17 00:00:00 -0400","original":"7/16/2004","granularity":"day","time":"2004/07/16 00:00:00 -0400"},"total":2,"longitude":-134.7134972,"id":"advy9tkjuu3w","location":"Carcross--Bennett Lake"},"type":"Feature","geometry":{"type":"Point","coordinates":[-134.7134972,60.1652549]}},{"properties":{"latitude":59.7256004,"date":{"end_time":"2004/07/17 00:00:00 -0400","original":"7/16/2004","granularity":"day","time":"2004/07/16 00:00:00 -0400"},"total":2,"longitude":-134.9915886,"id":"advy9tlehb69","location":"Shallow Lake"},"type":"Feature","geometry":{"type":"Point","coordinates":[-134.9915886,59.7256004]}},{"properties":{"latitude":59.2353375,"date":{"end_time":"2004/07/27 00:00:00 -0400","original":"7/26/2004","granularity":"day","time":"2004/07/26 00:00:00 -0400"},"total":2,"longitude":-135.3743935,"id":"advy9txdrtr6","location":"Haines--Chilkoot Inlet"},"type":"Feature","geometry":{"type":"Point","coordinates":[-135.3743935,59.2353375]}},{"properties":{"latitude":58.1399081,"date":{"end_time":"2004/09/01 00:00:00 -0400","original":"8/31/2004","granularity":"day","time":"2004/08/31 00:00:00 -0400"},"total":2,"longitude":-136.5044403,"id":"advy9tle5qvk","location":"Cross Sound"},"type":"Feature","geometry":{"type":"Point","coordinates":[-136.5044403,58.1399081]}},{"properties":{"latitude":59.8071406,"date":{"end_time":"2004/09/03 00:00:00 -0400","original":"9/2/2004","granularity":"day","time":"2004/09/02 00:00:00 -0400"},"total":2,"longitude":-148.7061382,"id":"advy9trp0ncm","location":"Cross Gulf Ferry - bet. PWS and Resur. Bay"},"type":"Feature","geometry":{"type":"Point","coordinates":[-148.7061382,59.8071406]}},{"properties":{"latitude":59.8889369,"date":{"end_time":"2004/09/03 00:00:00 -0400","original":"9/2/2004","granularity":"day","time":"2004/09/02 00:00:00 -0400"},"total":2,"longitude":-148.2824707,"id":"advy9tqnucfb","location":"Prince William Sound - near Bainbridge Glacier"},"type":"Feature","geometry":{"type":"Point","coordinates":[-148.2824707,59.8889369]}},{"properties":{"latitude":59.7890905,"date":{"end_time":"2004/09/03 00:00:00 -0400","original":"9/2/2004","granularity":"day","time":"2004/09/02 00:00:00 -0400"},"total":2,"longitude":-142.5333309,"id":"advy9tlilpz7","location":"Cross Gulf Ferry - between Yakutat and Valdez"},"type":"Feature","geometry":{"type":"Point","coordinates":[-142.5333309,59.7890905]}},{"properties":{"latitude":58.5243041,"date":{"end_time":"2004/09/09 00:00:00 -0400","original":"9/8/2004","granularity":"day","time":"2004/09/08 00:00:00 -0400"},"total":2,"longitude":-134.7951221,"id":"advy9thooe7r","location":"Herbert River Bridge"},"type":"Feature","geometry":{"type":"Point","coordinates":[-134.7951221,58.5243041]}},{"properties":{"latitude":58.351127,"date":{"end_time":"2004/09/25 00:00:00 -0400","original":"9/24/2004","granularity":"day","time":"2004/09/24 00:00:00 -0400"},"total":2,"longitude":-134.6494675,"id":"advy9tiyel8t","location":"Juneau - Gus van Vleit's yard"},"type":"Feature","geometry":{"type":"Point","coordinates":[-134.6494675,58.351127]}},{"properties":{"latitude":34.816,"date":{"end_time":"2004/10/03 00:00:00 -0400","original":"10/2/2004","granularity":"day","time":"2004/10/02 00:00:00 -0400"},"total":2,"longitude":-111.828,"id":"advy9txbin1w","location":"Red Rock SP"},"type":"Feature","geometry":{"type":"Point","coordinates":[-111.828,34.816]}},{"properties":{"latitude":31.3954753,"date":{"end_time":"2004/10/11 00:00:00 -0400","original":"10/10/2004","granularity":"day","time":"2004/10/10 00:00:00 -0400"},"total":2,"longitude":-110.0950241,"id":"advy9tw3h2cu","location":"Palominas Area"},"type":"Feature","geometry":{"type":"Point","coordinates":[-110.0950241,31.3954753]}},{"properties":{"latitude":31.4596004,"date":{"end_time":"2004/10/12 00:00:00 -0400","original":"10/11/2004","granularity":"day","time":"2004/10/11 00:00:00 -0400"},"total":2,"longitude":-110.3525009,"id":"advy9tv36zu8","location":"Scheelite Canyon"},"type":"Feature","geometry":{"type":"Point","coordinates":[-110.3525009,31.4596004]}},{"properties":{"latitude":31.6732995,"date":{"end_time":"2004/10/12 00:00:00 -0400","original":"10/11/2004","granularity":"day","time":"2004/10/11 00:00:00 -0400"},"total":2,"longitude":-110.5629845,"id":"advy9tmc666o","location":"Lower Elgin Road"},"type":"Feature","geometry":{"type":"Point","coordinates":[-110.5629845,31.6732995]}},{"properties":{"latitude":31.4456005,"date":{"end_time":"2004/10/12 00:00:00 -0400","original":"10/11/2004","granularity":"day","time":"2004/10/11 00:00:00 -0400"},"total":2,"longitude":-110.3124008,"id":"advy9tu0ne5b","location":"Ramsey Canyon Preserve"},"type":"Feature","geometry":{"type":"Point","coordinates":[-110.3124008,31.4456005]}},{"properties":{"latitude":26.1400912,"date":{"end_time":"2004/10/19 00:00:00 -0400","original":"10/18/2004","granularity":"day","time":"2004/10/18 00:00:00 -0400"},"total":2,"longitude":-97.1748233,"id":"advy9tintnz0","location":"South Padre Is.--WBC/Conv. Center/Laguna Madre Trail (LTC 035)"},"type":"Feature","geometry":{"type":"Point","coordinates":[-97.1748233,26.1400912]}},{"properties":{"latitude":26.5170831,"date":{"end_time":"2004/10/22 00:00:00 -0400","original":"10/21/2004","granularity":"day","time":"2004/10/21 00:00:00 -0400"},"total":2,"longitude":-99.1260338,"id":"advy9tmdfsad","location":"across Rio Grande from US side - El Rio RV Park"},"type":"Feature","geometry":{"type":"Point","coordinates":[-99.1260338,26.5170831]}},{"properties":{"latitude":29.1782435,"date":{"end_time":"2004/10/23 00:00:00 -0400","original":"10/22/2004","granularity":"day","time":"2004/10/22 00:00:00 -0400"},"total":2,"longitude":-102.9531759,"id":"advy9tqurxmk","location":"Big Bend NP--Rio Grande Village Nature Trail"},"type":"Feature","geometry":{"type":"Point","coordinates":[-102.9531759,29.1782435]}},{"properties":{"latitude":58.3622462,"date":{"end_time":"2004/12/11 00:00:00 -0500","original":"12/10/2004","granularity":"day","time":"2004/12/10 00:00:00 -0500"},"total":2,"longitude":-134.4826126,"id":"advy9ts134nd","location":"Juneau - Lemon Creek"},"type":"Feature","geometry":{"type":"Point","coordinates":[-134.4826126,58.3622462]}},{"properties":{"latitude":41.58725,"date":{"end_time":"2004/12/22 00:00:00 -0500","original":"12/21/2004","granularity":"day","time":"2004/12/21 00:00:00 -0500"},"total":2,"longitude":-90.35472,"id":"advy9tx9aenv","location":"Le Claire--West Canal Shore Dr."},"type":"Feature","geometry":{"type":"Point","coordinates":[-90.35472,41.58725]}},{"properties":{"latitude":19.4210154,"date":{"end_time":"2005/03/19 00:00:00 -0500","original":"3/18/2005","granularity":"day","time":"2005/03/18 00:00:00 -0500"},"total":2,"longitude":-155.9111667,"id":"advy9tufvmv0","location":"Puuhonua O Honaunau NHP ('Place of Refuge')"},"type":"Feature","geometry":{"type":"Point","coordinates":[-155.9111667,19.4210154]}},{"properties":{"latitude":19.7308362,"date":{"end_time":"2005/03/21 00:00:00 -0500","original":"3/20/2005","granularity":"day","time":"2005/03/20 00:00:00 -0500"},"total":2,"longitude":-155.0285912,"id":"advy9twgbjsj","location":"Lokowaka Pond"},"type":"Feature","geometry":{"type":"Point","coordinates":[-155.0285912,19.7308362]}},{"properties":{"latitude":19.821604,"date":{"end_time":"2005/03/23 00:00:00 -0500","original":"3/22/2005","granularity":"day","time":"2005/03/22 00:00:00 -0500"},"total":2,"longitude":-155.6085157,"id":"advy9tmi1lzi","location":"Pu'u La'au, Ka'ohe GMA"},"type":"Feature","geometry":{"type":"Point","coordinates":[-155.6085157,19.821604]}},{"properties":{"latitude":19.8838571,"date":{"end_time":"2005/03/23 00:00:00 -0500","original":"3/22/2005","granularity":"day","time":"2005/03/22 00:00:00 -0500"},"total":2,"longitude":-155.6676865,"id":"advy9tx3dv65","location":"Saddle Road pastures"},"type":"Feature","geometry":{"type":"Point","coordinates":[-155.6676865,19.8838571]}},{"properties":{"latitude":18.9282926,"date":{"end_time":"2005/03/26 00:00:00 -0500","original":"3/25/2005","granularity":"day","time":"2005/03/25 00:00:00 -0500"},"total":2,"longitude":-155.6740388,"id":"advy9tlbu1ru","location":"South Point"},"type":"Feature","geometry":{"type":"Point","coordinates":[-155.6740388,18.9282926]}},{"properties":{"latitude":21.2710538,"date":{"end_time":"2005/03/29 00:00:00 -0500","original":"3/28/2005","granularity":"day","time":"2005/03/28 00:00:00 -0500"},"total":2,"longitude":-157.8215878,"id":"advy9trr9as8","location":"Kapiolani Park"},"type":"Feature","geometry":{"type":"Point","coordinates":[-157.8215878,21.2710538]}},{"properties":{"latitude":21.3108002,"date":{"end_time":"2005/03/29 00:00:00 -0500","original":"3/28/2005","granularity":"day","time":"2005/03/28 00:00:00 -0500"},"total":2,"longitude":-157.7279675,"id":"advy9tsj5hek","location":"Kuli'ou'ou Valley Trail"},"type":"Feature","geometry":{"type":"Point","coordinates":[-157.7279675,21.3108002]}},{"properties":{"latitude":21.6484935,"date":{"end_time":"2005/03/30 00:00:00 -0500","original":"3/29/2005","granularity":"day","time":"2005/03/29 00:00:00 -0500"},"total":2,"longitude":-157.9143047,"id":"advy9tmy7qd1","location":"La'ie Point"},"type":"Feature","geometry":{"type":"Point","coordinates":[-157.9143047,21.6484935]}},{"properties":{"latitude":22.1477015,"date":{"end_time":"2005/04/02 00:00:00 -0500","original":"4/1/2005","granularity":"day","time":"2005/04/01 00:00:00 -0500"},"total":2,"longitude":-159.6171427,"id":"advy9tw7bg4r","location":"Pihea and Alakai Swamp Trails (Junction)"},"type":"Feature","geometry":{"type":"Point","coordinates":[-159.6171427,22.1477015]}},{"properties":{"latitude":22.1302507,"date":{"end_time":"2005/04/03 00:00:00 -0500","original":"4/2/2005","granularity":"day","time":"2005/04/02 00:00:00 -0500"},"total":2,"longitude":-159.6556377,"id":"advy9tpi87pu","location":"Koke'e State Park"},"type":"Feature","geometry":{"type":"Point","coordinates":[-159.6556377,22.1302507]}},{"properties":{"latitude":32.3093864,"date":{"end_time":"2005/05/11 00:00:00 -0400","original":"5/10/2005","granularity":"day","time":"2005/05/10 00:00:00 -0400"},"total":2,"longitude":-106.825819,"id":"advy9tuqak4t","location":"Rio Grande Bike Path - Picacho section"},"type":"Feature","geometry":{"type":"Point","coordinates":[-106.825819,32.3093864]}},{"properties":{"latitude":58.3876776,"date":{"end_time":"2005/05/26 00:00:00 -0400","original":"5/25/2005","granularity":"day","time":"2005/05/25 00:00:00 -0400"},"total":2,"longitude":-134.6326447,"id":"advy9tq959x2","location":"Juneau - Auke Lake"},"type":"Feature","geometry":{"type":"Point","coordinates":[-134.6326447,58.3876776]}},{"properties":{"latitude":56.162759,"date":{"end_time":"2005/06/11 00:00:00 -0400","original":"6/10/2005","granularity":"day","time":"2005/06/10 00:00:00 -0400"},"total":2,"longitude":-133.3194351,"id":"advy9tlnskfc","location":"Prince of Wales Is.--N. of El Capitan Passage"},"type":"Feature","geometry":{"type":"Point","coordinates":[-133.3194351,56.162759]}},{"properties":{"latitude":55.4788535,"date":{"end_time":"2005/06/12 00:00:00 -0400","original":"6/11/2005","granularity":"day","time":"2005/06/11 00:00:00 -0400"},"total":2,"longitude":-133.140564,"id":"advy9thvm63e","location":"Craig - Prince of Wales"},"type":"Feature","geometry":{"type":"Point","coordinates":[-133.140564,55.4788535]}},{"properties":{"latitude":56.00283,"date":{"end_time":"2005/06/13 00:00:00 -0400","original":"6/12/2005","granularity":"day","time":"2005/06/12 00:00:00 -0400"},"total":2,"longitude":-133.67862,"id":"advy9tn1qqlt","location":"Kosciusko Island"},"type":"Feature","geometry":{"type":"Point","coordinates":[-133.67862,56.00283]}},{"properties":{"latitude":55.3427645,"date":{"end_time":"2005/06/18 00:00:00 -0400","original":"6/17/2005","granularity":"day","time":"2005/06/17 00:00:00 -0400"},"total":2,"longitude":-131.6462517,"id":"advy9tho0wr1","location":"Ketchikan"},"type":"Feature","geometry":{"type":"Point","coordinates":[-131.6462517,55.3427645]}},{"properties":{"latitude":56.0499291,"date":{"end_time":"2005/10/04 00:00:00 -0400","original":"10/3/2005","granularity":"day","time":"2005/10/03 00:00:00 -0400"},"total":2,"longitude":-129.9029446,"id":"advy9tm298fd","location":"Stewart--Bear Lake"},"type":"Feature","geometry":{"type":"Point","coordinates":[-129.9029446,56.0499291]}},{"properties":{"latitude":48.0546769,"date":{"end_time":"2005/10/09 00:00:00 -0400","original":"10/8/2005","granularity":"day","time":"2005/10/08 00:00:00 -0400"},"total":2,"longitude":-123.7953186,"id":"advy9tx8oz6f","location":"Olympic NP--Lake Crescent--Marymere Falls Trail"},"type":"Feature","geometry":{"type":"Point","coordinates":[-123.7953186,48.0546769]}},{"properties":{"latitude":43.8364312,"date":{"end_time":"2005/10/12 00:00:00 -0400","original":"10/11/2005","granularity":"day","time":"2005/10/11 00:00:00 -0400"},"total":2,"longitude":-124.1630495,"id":"advy9tjrdrxe","location":"Oregon Dunes Overlook"},"type":"Feature","geometry":{"type":"Point","coordinates":[-124.1630495,43.8364312]}},{"properties":{"latitude":38.2081741,"date":{"end_time":"2005/10/16 00:00:00 -0400","original":"10/15/2005","granularity":"day","time":"2005/10/15 00:00:00 -0400"},"total":2,"longitude":-122.4514461,"id":"advy9txts86g","location":"Viansa Winery and wetlands"},"type":"Feature","geometry":{"type":"Point","coordinates":[-122.4514461,38.2081741]}},{"properties":{"latitude":32.2790588,"date":{"end_time":"2005/10/25 00:00:00 -0400","original":"10/24/2005","granularity":"day","time":"2005/10/24 00:00:00 -0400"},"total":2,"longitude":-106.5935612,"id":"advy9tm8r0i4","location":"Achenbach Canyon"},"type":"Feature","geometry":{"type":"Point","coordinates":[-106.5935612,32.2790588]}},{"properties":{"latitude":31.8835432,"date":{"end_time":"2005/11/08 00:00:00 -0500","original":"11/7/2005","granularity":"day","time":"2005/11/07 00:00:00 -0500"},"total":2,"longitude":-109.2058731,"id":"advy9tuoi0dt","location":"Cave Creek Canyon--Southwestern Research Station"},"type":"Feature","geometry":{"type":"Point","coordinates":[-109.2058731,31.8835432]}},{"properties":{"latitude":31.9172001,"date":{"end_time":"2005/12/05 00:00:00 -0500","original":"12/4/2005","granularity":"day","time":"2005/12/04 00:00:00 -0500"},"total":2,"longitude":-109.2790985,"id":"advy9ttrfwwv","location":"Barfoot Park"},"type":"Feature","geometry":{"type":"Point","coordinates":[-109.2790985,31.9172001]}},{"properties":{"latitude":-0.2238,"date":{"end_time":"2006/01/11 00:00:00 -0500","original":"1/10/2006","granularity":"day","time":"2006/01/10 00:00:00 -0500"},"total":2,"longitude":-78.5133,"id":"advy9truhtkn","location":"Quito--general area"},"type":"Feature","geometry":{"type":"Point","coordinates":[-78.5133,-0.2238]}},{"properties":{"latitude":-0.0558758,"date":{"end_time":"2006/01/12 00:00:00 -0500","original":"1/11/2006","granularity":"day","time":"2006/01/11 00:00:00 -0500"},"total":2,"longitude":-78.7761784,"id":"advy9twc42kr","location":"Mindo - Hotel Los Colibris"},"type":"Feature","geometry":{"type":"Point","coordinates":[-78.7761784,-0.0558758]}},{"properties":{"latitude":-0.0387096,"date":{"end_time":"2006/01/14 00:00:00 -0500","original":"1/13/2006","granularity":"day","time":"2006/01/13 00:00:00 -0500"},"total":2,"longitude":-78.7685094,"id":"advy9tuts5bi","location":"Mindo Road (1525m)"},"type":"Feature","geometry":{"type":"Point","coordinates":[-78.7685094,-0.0387096]}},{"properties":{"latitude":-0.0308132,"date":{"end_time":"2006/01/14 00:00:00 -0500","original":"1/13/2006","granularity":"day","time":"2006/01/13 00:00:00 -0500"},"total":2,"longitude":-78.7644625,"id":"advy9tw87mv7","location":"Septimo Paraiso"},"type":"Feature","geometry":{"type":"Point","coordinates":[-78.7644625,-0.0308132]}},{"properties":{"latitude":-6.918819,"date":{"end_time":"2006/02/22 00:00:00 -0500","original":"2/21/2006","granularity":"day","time":"2006/02/21 00:00:00 -0500"},"total":2,"longitude":-79.875172,"id":"advy9ti6ufex","location":"Puerto Eten"},"type":"Feature","geometry":{"type":"Point","coordinates":[-79.875172,-6.918819]}},{"properties":{"latitude":-9.9309768,"date":{"end_time":"2006/02/27 00:00:00 -0500","original":"2/26/2006","granularity":"day","time":"2006/02/26 00:00:00 -0500"},"total":2,"longitude":-76.2561035,"id":"advy9tsfikvj","location":"Huanuco"},"type":"Feature","geometry":{"type":"Point","coordinates":[-76.2561035,-9.9309768]}},{"properties":{"latitude":-9.328352,"date":{"end_time":"2006/02/28 00:00:00 -0500","original":"2/27/2006","granularity":"day","time":"2006/02/27 00:00:00 -0500"},"total":2,"longitude":-76.0307121,"id":"advy9tqox3yu","location":"Tingo Maria NP - Oilbird cave area"},"type":"Feature","geometry":{"type":"Point","coordinates":[-76.0307121,-9.328352]}},{"properties":{"latitude":-14.832328,"date":{"end_time":"2006/03/09 00:00:00 -0500","original":"3/8/2006","granularity":"day","time":"2006/03/08 00:00:00 -0500"},"total":2,"longitude":-74.941864,"id":"advy9tn76ihx","location":"Nazca area"},"type":"Feature","geometry":{"type":"Point","coordinates":[-74.941864,-14.832328]}},{"properties":{"latitude":-16.3675801,"date":{"end_time":"2006/03/12 00:00:00 -0500","original":"3/11/2006","granularity":"day","time":"2006/03/11 00:00:00 -0500"},"total":2,"longitude":-71.1749268,"id":"advy9to2brhc","location":"Lagunas Salinas"},"type":"Feature","geometry":{"type":"Point","coordinates":[-71.1749268,-16.3675801]}},{"properties":{"latitude":-15.8193416,"date":{"end_time":"2006/03/13 00:00:00 -0500","original":"3/12/2006","granularity":"day","time":"2006/03/12 00:00:00 -0500"},"total":2,"longitude":-69.9708939,"id":"advy9tvkw37u","location":"Lago Titicaca--Islas Uros"},"type":"Feature","geometry":{"type":"Point","coordinates":[-69.9708939,-15.8193416]}},{"properties":{"latitude":-16.15986,"date":{"end_time":"2006/03/20 00:00:00 -0500","original":"3/19/2006","granularity":"day","time":"2006/03/19 00:00:00 -0500"},"total":2,"longitude":-69.0832329,"id":"advy9tkk54gg","location":"Copacabana--Marshes North of Town"},"type":"Feature","geometry":{"type":"Point","coordinates":[-69.0832329,-16.15986]}},{"properties":{"latitude":-13.7360501,"date":{"end_time":"2006/03/25 00:00:00 -0500","original":"3/24/2006","granularity":"day","time":"2006/03/24 00:00:00 -0500"},"total":2,"longitude":-76.3951492,"id":"advy9tir4m15","location":"Islas Ballestas"},"type":"Feature","geometry":{"type":"Point","coordinates":[-76.3951492,-13.7360501]}},{"properties":{"latitude":-13.8344338,"date":{"end_time":"2006/03/25 00:00:00 -0500","original":"3/24/2006","granularity":"day","time":"2006/03/24 00:00:00 -0500"},"total":2,"longitude":-76.2518334,"id":"advy9to8r63b","location":"Paracas"},"type":"Feature","geometry":{"type":"Point","coordinates":[-76.2518334,-13.8344338]}},{"properties":{"latitude":-3.7015317,"date":{"end_time":"2006/03/29 00:00:00 -0500","original":"3/28/2006","granularity":"day","time":"2006/03/28 00:00:00 -0500"},"total":2,"longitude":-73.2110023,"id":"advy9ttfwi21","location":"Iquitos--Rio Amazon islands"},"type":"Feature","geometry":{"type":"Point","coordinates":[-73.2110023,-3.7015317]}},{"properties":{"latitude":60.5917933,"date":{"end_time":"2006/07/21 00:00:00 -0400","original":"7/20/2006","granularity":"day","time":"2006/07/20 00:00:00 -0400"},"total":2,"longitude":-137.2318125,"id":"advy9ti9epe7","location":"Kathleen River--Haines Road"},"type":"Feature","geometry":{"type":"Point","coordinates":[-137.2318125,60.5917933]}},{"properties":{"latitude":53.8891656,"date":{"end_time":"2006/09/25 00:00:00 -0400","original":"9/24/2006","granularity":"day","time":"2006/09/24 00:00:00 -0400"},"total":2,"longitude":-166.5398598,"id":"advy9tu4ej4d","location":"Dutch Harbor (Unalaska Is.)"},"type":"Feature","geometry":{"type":"Point","coordinates":[-166.5398598,53.8891656]}},{"properties":{"latitude":54.0835623,"date":{"end_time":"2006/09/26 00:00:00 -0400","original":"9/25/2006","granularity":"day","time":"2006/09/25 00:00:00 -0400"},"total":2,"longitude":-166.4923096,"id":"advy9tqk0kbl","location":"Bering Sea - N of Dutch Harbor"},"type":"Feature","geometry":{"type":"Point","coordinates":[-166.4923096,54.0835623]}},{"properties":{"latitude":57.7553748,"date":{"end_time":"2006/10/06 00:00:00 -0400","original":"10/5/2006","granularity":"day","time":"2006/10/05 00:00:00 -0400"},"total":2,"longitude":-160.9606934,"id":"advy9ttky530","location":"Offshore - Bristol Bay"},"type":"Feature","geometry":{"type":"Point","coordinates":[-160.9606934,57.7553748]}},{"properties":{"latitude":33.1774666,"date":{"end_time":"2006/12/15 00:00:00 -0500","original":"12/14/2006","granularity":"day","time":"2006/12/14 00:00:00 -0500"},"total":2,"longitude":-115.6150961,"id":"advy9tplz6pj","location":"Salton Sea NWR--Unit 2 / Visitor Center"},"type":"Feature","geometry":{"type":"Point","coordinates":[-115.6150961,33.1774666]}},{"properties":{"latitude":32.9731671,"date":{"end_time":"2006/12/15 00:00:00 -0500","original":"12/14/2006","granularity":"day","time":"2006/12/14 00:00:00 -0500"},"total":2,"longitude":-115.5360031,"id":"advy9tuakso1","location":"Salton Sea - Brawley area"},"type":"Feature","geometry":{"type":"Point","coordinates":[-115.5360031,32.9731671]}},{"properties":{"latitude":32.2804254,"date":{"end_time":"2006/12/21 00:00:00 -0500","original":"12/20/2006","granularity":"day","time":"2006/12/20 00:00:00 -0500"},"total":2,"longitude":-111.0256058,"id":"advy9twhbvuj","location":"Roger Road WRF"},"type":"Feature","geometry":{"type":"Point","coordinates":[-111.0256058,32.2804254]}},{"properties":{"latitude":32.2649478,"date":{"end_time":"2007/01/05 00:00:00 -0500","original":"1/4/2007","granularity":"day","time":"2007/01/04 00:00:00 -0500"},"total":2,"longitude":-110.9811517,"id":"advy9ti8c03z","location":"Evergreen Cemetery"},"type":"Feature","geometry":{"type":"Point","coordinates":[-110.9811517,32.2649478]}},{"properties":{"latitude":31.6799882,"date":{"end_time":"2007/02/11 00:00:00 -0500","original":"2/10/2007","granularity":"day","time":"2007/02/10 00:00:00 -0500"},"total":2,"longitude":-109.6864126,"id":"advy9tpoabic","location":"Sulphur Springs Valley--south of Sunizona"},"type":"Feature","geometry":{"type":"Point","coordinates":[-109.6864126,31.6799882]}},{"properties":{"latitude":31.6942873,"date":{"end_time":"2007/02/28 00:00:00 -0500","original":"2/27/2007","granularity":"day","time":"2007/02/27 00:00:00 -0500"},"total":2,"longitude":-110.5258942,"id":"advy9txxywuh","location":"Water tank"},"type":"Feature","geometry":{"type":"Point","coordinates":[-110.5258942,31.6942873]}},{"properties":{"latitude":32.180752,"date":{"end_time":"2007/03/04 00:00:00 -0500","original":"3/3/2007","granularity":"day","time":"2007/03/03 00:00:00 -0500"},"total":2,"longitude":-110.719749,"id":"advy9twhnp2y","location":"Saguaro NP--Rincon Mountains Unit"},"type":"Feature","geometry":{"type":"Point","coordinates":[-110.719749,32.180752]}},{"properties":{"latitude":31.6572,"date":{"end_time":"2007/03/25 00:00:00 -0400","original":"3/24/2007","granularity":"day","time":"2007/03/24 00:00:00 -0400"},"total":2,"longitude":-110.18,"id":"advy9tisoo61","location":"San Pedro Riparian NCA"},"type":"Feature","geometry":{"type":"Point","coordinates":[-110.18,31.6572]}},{"properties":{"latitude":33.4332333,"date":{"end_time":"2007/04/09 00:00:00 -0400","original":"4/8/2007","granularity":"day","time":"2007/04/08 00:00:00 -0400"},"total":2,"longitude":-111.9186044,"id":"advy9tt6desr","location":"Tempe Town Lake"},"type":"Feature","geometry":{"type":"Point","coordinates":[-111.9186044,33.4332333]}},{"properties":{"latitude":32.4281938,"date":{"end_time":"2007/04/27 00:00:00 -0400","original":"4/26/2007","granularity":"day","time":"2007/04/26 00:00:00 -0400"},"total":2,"longitude":-110.7560945,"id":"advy9tu8m3ie","location":"Mt. Lemmon--Marshall Gulch"},"type":"Feature","geometry":{"type":"Point","coordinates":[-110.7560945,32.4281938]}},{"properties":{"latitude":31.7974086,"date":{"end_time":"2007/04/28 00:00:00 -0400","original":"4/27/2007","granularity":"day","time":"2007/04/27 00:00:00 -0400"},"total":2,"longitude":-110.7868486,"id":"advy9twu1m9x","location":"Greaterville Road"},"type":"Feature","geometry":{"type":"Point","coordinates":[-110.7868486,31.7974086]}},{"properties":{"latitude":51.8941856,"date":{"end_time":"2007/05/21 00:00:00 -0400","original":"5/20/2007","granularity":"day","time":"2007/05/20 00:00:00 -0400"},"total":2,"longitude":-176.6443634,"id":"advy9tix0quh","location":"Adak Island (Aleutian Is.)"},"type":"Feature","geometry":{"type":"Point","coordinates":[-176.6443634,51.8941856]}},{"properties":{"latitude":32.4404984,"date":{"end_time":"2007/07/29 00:00:00 -0400","original":"7/28/2007","granularity":"day","time":"2007/07/28 00:00:00 -0400"},"total":2,"longitude":-110.7902985,"id":"advy9tkrht3u","location":"Mt. Lemmon--upper"},"type":"Feature","geometry":{"type":"Point","coordinates":[-110.7902985,32.4404984]}},{"properties":{"latitude":31.4421997,"date":{"end_time":"2007/08/04 00:00:00 -0400","original":"8/3/2007","granularity":"day","time":"2007/08/03 00:00:00 -0400"},"total":2,"longitude":-110.2855988,"id":"advy9ts5cdez","location":"Carr Canyon"},"type":"Feature","geometry":{"type":"Point","coordinates":[-110.2855988,31.4421997]}},{"properties":{"latitude":31.9030991,"date":{"end_time":"2007/09/14 00:00:00 -0400","original":"9/13/2007","granularity":"day","time":"2007/09/13 00:00:00 -0400"},"total":2,"longitude":-109.2776031,"id":"advy9twtrwqo","location":"Rustler Park"},"type":"Feature","geometry":{"type":"Point","coordinates":[-109.2776031,31.9030991]}},{"properties":{"latitude":31.4481247,"date":{"end_time":"2007/10/11 00:00:00 -0400","original":"10/10/2007","granularity":"day","time":"2007/10/10 00:00:00 -0400"},"total":2,"longitude":-110.6026093,"id":"advy9tus4wyr","location":"San Rafael Grasslands"},"type":"Feature","geometry":{"type":"Point","coordinates":[-110.6026093,31.4481247]}},{"properties":{"latitude":32.9204706,"date":{"end_time":"2007/11/10 00:00:00 -0500","original":"11/9/2007","granularity":"day","time":"2007/11/09 00:00:00 -0500"},"total":2,"longitude":-111.7807174,"id":"advy9twdbrgm","location":"Dave White Golf Course"},"type":"Feature","geometry":{"type":"Point","coordinates":[-111.7807174,32.9204706]}},{"properties":{"latitude":32.3103,"date":{"end_time":"2007/12/15 00:00:00 -0500","original":"12/14/2007","granularity":"day","time":"2007/12/14 00:00:00 -0500"},"total":2,"longitude":-110.5689,"id":"advy9tnybwxm","location":"Redington Pass"},"type":"Feature","geometry":{"type":"Point","coordinates":[-110.5689,32.3103]}},{"properties":{"latitude":30.1546272,"date":{"end_time":"2008/02/07 00:00:00 -0500","original":"2/6/2008","granularity":"day","time":"2008/02/06 00:00:00 -0500"},"total":2,"longitude":-111.1102295,"id":"advy9to6cd6o","location":"Hwy 15--Nogales - Hermosillo"},"type":"Feature","geometry":{"type":"Point","coordinates":[-111.1102295,30.1546272]}},{"properties":{"latitude":27.7516077,"date":{"end_time":"2008/02/08 00:00:00 -0500","original":"2/7/2008","granularity":"day","time":"2008/02/07 00:00:00 -0500"},"total":2,"longitude":-110.4043579,"id":"advy9tpeh66w","location":"Hwy 15--Guaymas to Ciudad Obregón"},"type":"Feature","geometry":{"type":"Point","coordinates":[-110.4043579,27.7516077]}},{"properties":{"latitude":27.05,"date":{"end_time":"2008/02/08 00:00:00 -0500","original":"2/7/2008","granularity":"day","time":"2008/02/07 00:00:00 -0500"},"total":2,"longitude":-109.35,"id":"advy9tote5ow","location":"Aduana"},"type":"Feature","geometry":{"type":"Point","coordinates":[-109.35,27.05]}},{"properties":{"latitude":26.846128,"date":{"end_time":"2008/06/15 00:00:00 -0400","original":"6/14/2008","granularity":"day","time":"2008/06/14 00:00:00 -0400"},"total":2,"longitude":100.2049255,"id":"advy9tlr3gfa","location":"Lijiang, Yunnan--Black Dragon Pool"},"type":"Feature","geometry":{"type":"Point","coordinates":[100.2049255,26.846128]}},{"properties":{"latitude":27.1923499,"date":{"end_time":"2008/06/16 00:00:00 -0400","original":"6/15/2008","granularity":"day","time":"2008/06/15 00:00:00 -0400"},"total":2,"longitude":100.0954056,"id":"advy9tqdj7nr","location":"Tiger Leaping Gorge (Yunnan)"},"type":"Feature","geometry":{"type":"Point","coordinates":[100.0954056,27.1923499]}},{"properties":{"latitude":25.6080944,"date":{"end_time":"2008/06/18 00:00:00 -0400","original":"6/17/2008","granularity":"day","time":"2008/06/17 00:00:00 -0400"},"total":2,"longitude":100.2241516,"id":"advy9tsdey5t","location":"Er Hai &amp; Cang Shan--Dali (Yunnan Province)"},"type":"Feature","geometry":{"type":"Point","coordinates":[100.2241516,25.6080944]}},{"properties":{"latitude":20.9822773,"date":{"end_time":"2008/06/21 00:00:00 -0400","original":"6/20/2008","granularity":"day","time":"2008/06/20 00:00:00 -0400"},"total":2,"longitude":101.4027786,"id":"advy9tx6y15l","location":"Luang Namtha area (including fields around town)"},"type":"Feature","geometry":{"type":"Point","coordinates":[101.4027786,20.9822773]}},{"properties":{"latitude":20.7856467,"date":{"end_time":"2008/06/22 00:00:00 -0400","original":"6/21/2008","granularity":"day","time":"2008/06/21 00:00:00 -0400"},"total":2,"longitude":101.3392639,"id":"advy9tqvl4jp","location":"Ham Ha National Bio-diversity Cons. Area - general"},"type":"Feature","geometry":{"type":"Point","coordinates":[101.3392639,20.7856467]}},{"properties":{"latitude":11.5795134,"date":{"end_time":"2008/07/08 00:00:00 -0400","original":"7/7/2008","granularity":"day","time":"2008/07/07 00:00:00 -0400"},"total":2,"longitude":104.9209785,"id":"advy9tmou855","location":"Phnom Penh - general"},"type":"Feature","geometry":{"type":"Point","coordinates":[104.9209785,11.5795134]}},{"properties":{"latitude":10.6089818,"date":{"end_time":"2008/07/13 00:00:00 -0400","original":"7/12/2008","granularity":"day","time":"2008/07/12 00:00:00 -0400"},"total":2,"longitude":103.510952,"id":"advy9ttsf44v","location":"Sihanoukville (coastal)"},"type":"Feature","geometry":{"type":"Point","coordinates":[103.510952,10.6089818]}},{"properties":{"latitude":13.7591024,"date":{"end_time":"2008/07/19 00:00:00 -0400","original":"7/18/2008","granularity":"day","time":"2008/07/18 00:00:00 -0400"},"total":2,"longitude":100.4972219,"id":"advy9twa4d2m","location":"Bangkok--Khao San Road"},"type":"Feature","geometry":{"type":"Point","coordinates":[100.4972219,13.7591024]}},{"properties":{"latitude":19.4035643,"date":{"end_time":"2008/08/01 00:00:00 -0400","original":"7/31/2008","granularity":"day","time":"2008/07/31 00:00:00 -0400"},"total":2,"longitude":98.9211924,"id":"advy9tsyw1tb","location":"Chiang Dao--Wat Tham Pha Plong"},"type":"Feature","geometry":{"type":"Point","coordinates":[98.9211924,19.4035643]}},{"properties":{"latitude":27.4860401,"date":{"end_time":"2008/08/18 00:00:00 -0400","original":"8/17/2008","granularity":"day","time":"2008/08/17 00:00:00 -0400"},"total":2,"longitude":83.2753372,"id":"advy9tx624ry","location":"Lumbini - crane reserve and around"},"type":"Feature","geometry":{"type":"Point","coordinates":[83.2753372,27.4860401]}},{"properties":{"latitude":27.1747511,"date":{"end_time":"2008/08/22 00:00:00 -0400","original":"8/21/2008","granularity":"day","time":"2008/08/21 00:00:00 -0400"},"total":2,"longitude":78.0421543,"id":"advy9turrcj5","location":"Taj Mahal"},"type":"Feature","geometry":{"type":"Point","coordinates":[78.0421543,27.1747511]}},{"properties":{"latitude":27.1797142,"date":{"end_time":"2008/08/23 00:00:00 -0400","original":"8/22/2008","granularity":"day","time":"2008/08/22 00:00:00 -0400"},"total":2,"longitude":78.0216837,"id":"advy9tj7jk86","location":"Agra Fort"},"type":"Feature","geometry":{"type":"Point","coordinates":[78.0216837,27.1797142]}},{"properties":{"latitude":27.1556986,"date":{"end_time":"2008/08/27 00:00:00 -0400","original":"8/26/2008","granularity":"day","time":"2008/08/26 00:00:00 -0400"},"total":2,"longitude":77.5119781,"id":"advy9ts1nclq","location":"Bharatpur--Keoladeo Ghana NP"},"type":"Feature","geometry":{"type":"Point","coordinates":[77.5119781,27.1556986]}},{"properties":{"latitude":40.998557,"date":{"end_time":"2008/09/10 00:00:00 -0400","original":"9/9/2008","granularity":"day","time":"2008/09/09 00:00:00 -0400"},"total":2,"longitude":28.9851952,"id":"advy9tvrij5h","location":"Istanbul - nearshore seawatch"},"type":"Feature","geometry":{"type":"Point","coordinates":[28.9851952,40.998557]}},{"properties":{"latitude":46.2208805,"date":{"end_time":"2008/09/18 00:00:00 -0400","original":"9/17/2008","granularity":"day","time":"2008/09/17 00:00:00 -0400"},"total":2,"longitude":24.7917652,"id":"advy9tkjvkfr","location":"Sighisoara area"},"type":"Feature","geometry":{"type":"Point","coordinates":[24.7917652,46.2208805]}},{"properties":{"latitude":48.232483,"date":{"end_time":"2008/09/21 00:00:00 -0400","original":"9/20/2008","granularity":"day","time":"2008/09/20 00:00:00 -0400"},"total":2,"longitude":16.404223,"id":"advy9tjt5myg","location":"Donau Insel"},"type":"Feature","geometry":{"type":"Point","coordinates":[16.404223,48.232483]}},{"properties":{"latitude":-13.4126638,"date":{"end_time":"2008/10/16 00:00:00 -0400","original":"10/15/2008","granularity":"day","time":"2008/10/15 00:00:00 -0400"},"total":2,"longitude":-71.8440628,"id":"advy9tqdniti","location":"Pisac Ruins and hike down to town"},"type":"Feature","geometry":{"type":"Point","coordinates":[-71.8440628,-13.4126638]}},{"properties":{"latitude":-13.3112861,"date":{"end_time":"2008/10/17 00:00:00 -0400","original":"10/16/2008","granularity":"day","time":"2008/10/16 00:00:00 -0400"},"total":2,"longitude":-72.1808624,"id":"advy9ticxmec","location":"Maras-Moray-Salineras area"},"type":"Feature","geometry":{"type":"Point","coordinates":[-72.1808624,-13.3112861]}},{"properties":{"latitude":-16.5177327,"date":{"end_time":"2008/10/26 00:00:00 -0400","original":"10/25/2008","granularity":"day","time":"2008/10/25 00:00:00 -0400"},"total":2,"longitude":-68.1104279,"id":"advy9thz3snd","location":"La Paz - lower (Valle de Luna, etc)"},"type":"Feature","geometry":{"type":"Point","coordinates":[-68.1104279,-16.5177327]}},{"properties":{"latitude":-25.6815147,"date":{"end_time":"2008/11/14 00:00:00 -0500","original":"11/13/2008","granularity":"day","time":"2008/11/13 00:00:00 -0500"},"total":2,"longitude":-54.4625003,"id":"advy9tl90q33","location":"PN Iguazú, Argentina"},"type":"Feature","geometry":{"type":"Point","coordinates":[-54.4625003,-25.6815147]}},{"properties":{"latitude":-34.6082039,"date":{"end_time":"2008/11/18 00:00:00 -0500","original":"11/17/2008","granularity":"day","time":"2008/11/17 00:00:00 -0500"},"total":2,"longitude":-58.3539677,"id":"advy9tsurrwi","location":"Reserva Ecológica Costanera Sur"},"type":"Feature","geometry":{"type":"Point","coordinates":[-58.3539677,-34.6082039]}},{"properties":{"latitude":32.2820533,"date":{"end_time":"2008/12/25 00:00:00 -0500","original":"12/24/2008","granularity":"day","time":"2008/12/24 00:00:00 -0500"},"total":2,"longitude":-106.7459106,"id":"advy9tjmm590","location":"NMSU campus"},"type":"Feature","geometry":{"type":"Point","coordinates":[-106.7459106,32.2820533]}},{"properties":{"latitude":32.0725746,"date":{"end_time":"2009/01/17 00:00:00 -0500","original":"1/16/2009","granularity":"day","time":"2009/01/16 00:00:00 -0500"},"total":2,"longitude":-109.8826039,"id":"advy9tphrdsb","location":"Apache Station WA"},"type":"Feature","geometry":{"type":"Point","coordinates":[-109.8826039,32.0725746]}},{"properties":{"latitude":27.0435319,"date":{"end_time":"2009/02/22 00:00:00 -0500","original":"2/21/2009","granularity":"day","time":"2009/02/21 00:00:00 -0500"},"total":2,"longitude":-108.9943314,"id":"advy9tsllf2h","location":"Aduana - old road to town through wash"},"type":"Feature","geometry":{"type":"Point","coordinates":[-108.9943314,27.0435319]}},{"properties":{"latitude":37.2730966,"date":{"end_time":"2009/07/13 00:00:00 -0400","original":"7/12/2009","granularity":"day","time":"2009/07/12 00:00:00 -0400"},"total":2,"longitude":-107.8707647,"id":"advy9tse51u4","location":"Durango--Fort Lewis College--College Hill"},"type":"Feature","geometry":{"type":"Point","coordinates":[-107.8707647,37.2730966]}},{"properties":{"latitude":40.391829,"date":{"end_time":"2009/07/18 00:00:00 -0400","original":"7/17/2009","granularity":"day","time":"2009/07/17 00:00:00 -0400"},"total":2,"longitude":-105.6082678,"id":"advy9tnx3ezz","location":"RMNP--Little Horseshoe Park"},"type":"Feature","geometry":{"type":"Point","coordinates":[-105.6082678,40.391829]}},{"properties":{"latitude":32.7096,"date":{"end_time":"2009/10/11 00:00:00 -0400","original":"10/10/2009","granularity":"day","time":"2009/10/10 00:00:00 -0400"},"total":2,"longitude":-114.9644566,"id":"advy9tx6ma15","location":"Gordon's Well near Yuma"},"type":"Feature","geometry":{"type":"Point","coordinates":[-114.9644566,32.7096]}},{"properties":{"latitude":32.166313,"date":{"end_time":"2009/10/12 00:00:00 -0400","original":"10/11/2009","granularity":"day","time":"2009/10/11 00:00:00 -0400"},"total":2,"longitude":-120.1245117,"id":"advy9trqlg7e","location":"Offshore--2000 fathom water west of Cortez Bank (VEN Co.)"},"type":"Feature","geometry":{"type":"Point","coordinates":[-120.1245117,32.166313]}},{"properties":{"latitude":32.6364838,"date":{"end_time":"2009/10/12 00:00:00 -0400","original":"10/11/2009","granularity":"day","time":"2009/10/11 00:00:00 -0400"},"total":2,"longitude":-117.4273682,"id":"advy9ts8halx","location":"Nine Mile Bank (SD Co.)"},"type":"Feature","geometry":{"type":"Point","coordinates":[-117.4273682,32.6364838]}},{"properties":{"latitude":32.4170663,"date":{"end_time":"2009/10/12 00:00:00 -0400","original":"10/11/2009","granularity":"day","time":"2009/10/11 00:00:00 -0400"},"total":2,"longitude":-119.1082764,"id":"advy9ttqdk81","location":"Cortez Bank (LA Co.)"},"type":"Feature","geometry":{"type":"Point","coordinates":[-119.1082764,32.4170663]}},{"properties":{"latitude":26.8296094,"date":{"end_time":"2010/02/23 00:00:00 -0500","original":"2/22/2010","granularity":"day","time":"2010/02/22 00:00:00 -0500"},"total":2,"longitude":-109.5631522,"id":"advy9thk7oz9","location":"Farm fields enroute to Yavaros"},"type":"Feature","geometry":{"type":"Point","coordinates":[-109.5631522,26.8296094]}},{"properties":{"latitude":31.733668,"date":{"end_time":"2010/04/27 00:00:00 -0400","original":"4/26/2010","granularity":"day","time":"2010/04/26 00:00:00 -0400"},"total":2,"longitude":-110.882269,"id":"advy9txljwps","location":"Madera Canyon--Whitehouse Picnic area"},"type":"Feature","geometry":{"type":"Point","coordinates":[-110.882269,31.733668]}},{"properties":{"latitude":31.850865,"date":{"end_time":"2010/04/27 00:00:00 -0400","original":"4/26/2010","granularity":"day","time":"2010/04/26 00:00:00 -0400"},"total":2,"longitude":-110.974376,"id":"advy9tjg3lcb","location":"Continental"},"type":"Feature","geometry":{"type":"Point","coordinates":[-110.974376,31.850865]}},{"properties":{"latitude":32.0512984,"date":{"end_time":"2010/08/29 00:00:00 -0400","original":"8/28/2010","granularity":"day","time":"2010/08/28 00:00:00 -0400"},"total":2,"longitude":-110.6363797,"id":"advy9tqtys12","location":"La Posta Quemada Ranch"},"type":"Feature","geometry":{"type":"Point","coordinates":[-110.6363797,32.0512984]}},{"properties":{"latitude":27.0252598,"date":{"end_time":"2011/01/03 00:00:00 -0500","original":"1/2/2011","granularity":"day","time":"2011/01/02 00:00:00 -0500"},"total":2,"longitude":-109.0148449,"id":"advy9tit9s87","location":"Upper Aduana Wash (above town)"},"type":"Feature","geometry":{"type":"Point","coordinates":[-109.0148449,27.0252598]}},{"properties":{"latitude":27.04584,"date":{"end_time":"2011/01/05 00:00:00 -0500","original":"1/4/2011","granularity":"day","time":"2011/01/04 00:00:00 -0500"},"total":2,"longitude":-108.76556,"id":"advy9ttnb9do","location":"ANP SIERRA DE ALAMOS"},"type":"Feature","geometry":{"type":"Point","coordinates":[-108.76556,27.04584]}},{"properties":{"latitude":27.0925395,"date":{"end_time":"2011/01/06 00:00:00 -0500","original":"1/5/2011","granularity":"day","time":"2011/01/05 00:00:00 -0500"},"total":2,"longitude":-108.710081,"id":"advy9tt75loc","location":"Arroyo Verde and Barranca Santa Barbara"},"type":"Feature","geometry":{"type":"Point","coordinates":[-108.710081,27.0925395]}},{"properties":{"latitude":27.9541667,"date":{"end_time":"2011/01/07 00:00:00 -0500","original":"1/6/2011","granularity":"day","time":"2011/01/06 00:00:00 -0500"},"total":2,"longitude":-110.8333333,"id":"advy9tqez4o8","location":"Empalme Causeway"},"type":"Feature","geometry":{"type":"Point","coordinates":[-110.8333333,27.9541667]}},{"properties":{"latitude":32.348157,"date":{"end_time":"2011/03/05 00:00:00 -0500","original":"3/4/2011","granularity":"day","time":"2011/03/04 00:00:00 -0500"},"total":2,"longitude":-111.0942,"id":"advy9tvm22hz","location":"Santa Cruz River--Crossroads Regional Park"},"type":"Feature","geometry":{"type":"Point","coordinates":[-111.0942,32.348157]}},{"properties":{"latitude":31.7221396,"date":{"end_time":"2011/05/24 00:00:00 -0400","original":"5/23/2011","granularity":"day","time":"2011/05/23 00:00:00 -0400"},"total":2,"longitude":-110.8797151,"id":"advy9tr7btpv","location":"Madera Canyon--Amphitheater"},"type":"Feature","geometry":{"type":"Point","coordinates":[-110.8797151,31.7221396]}},{"properties":{"latitude":42.3553409,"date":{"end_time":"2011/06/12 00:00:00 -0400","original":"6/11/2011","granularity":"day","time":"2011/06/11 00:00:00 -0400"},"total":2,"longitude":-71.0790968,"id":"advy9tqoilxa","location":"Charles River Esplanade"},"type":"Feature","geometry":{"type":"Point","coordinates":[-71.0790968,42.3553409]}},{"properties":{"latitude":9.063493,"date":{"end_time":"2011/07/11 00:00:00 -0400","original":"7/10/2011","granularity":"day","time":"2011/07/10 00:00:00 -0400"},"total":2,"longitude":-79.3611611,"id":"advy9tp2j0uh","location":"Tocumen Marsh"},"type":"Feature","geometry":{"type":"Point","coordinates":[-79.3611611,9.063493]}},{"properties":{"latitude":6.5494424,"date":{"end_time":"2011/07/23 00:00:00 -0400","original":"7/22/2011","granularity":"day","time":"2011/07/22 00:00:00 -0400"},"total":2,"longitude":-73.1281834,"id":"advy9tr61spr","location":"Parque El Gallineral (San Gil)"},"type":"Feature","geometry":{"type":"Point","coordinates":[-73.1281834,6.5494424]}},{"properties":{"latitude":11.1271205,"date":{"end_time":"2011/07/25 00:00:00 -0400","original":"7/24/2011","granularity":"day","time":"2011/07/24 00:00:00 -0400"},"total":2,"longitude":-74.2133141,"id":"advy9tngvnnb","location":"Santa Marta region - lowland"},"type":"Feature","geometry":{"type":"Point","coordinates":[-74.2133141,11.1271205]}},{"properties":{"latitude":11.112464,"date":{"end_time":"2011/07/26 00:00:00 -0400","original":"7/25/2011","granularity":"day","time":"2011/07/25 00:00:00 -0400"},"total":2,"longitude":-74.0673351,"id":"advy9tiazttj","location":"Reserva ProAves - El Dorado"},"type":"Feature","geometry":{"type":"Point","coordinates":[-74.0673351,11.112464]}},{"properties":{"latitude":32.38775,"date":{"end_time":"2012/04/25 00:00:00 -0400","original":"4/24/2012","granularity":"day","time":"2012/04/24 00:00:00 -0400"},"total":2,"longitude":-110.698,"id":"advy9tt3bwkp","location":"Mt. Lemmon--Willow Canyon"},"type":"Feature","geometry":{"type":"Point","coordinates":[-110.698,32.38775]}},{"properties":{"latitude":45.449709,"date":{"end_time":"2012/08/27 00:00:00 -0400","original":"8/26/2012","granularity":"day","time":"2012/08/26 00:00:00 -0400"},"total":2,"longitude":-99.846773,"id":"advy9tuog20w","location":"west of Aberdeen"},"type":"Feature","geometry":{"type":"Point","coordinates":[-99.846773,45.449709]}},{"properties":{"latitude":45.52909,"date":{"end_time":"2012/08/27 00:00:00 -0400","original":"8/26/2012","granularity":"day","time":"2012/08/26 00:00:00 -0400"},"total":2,"longitude":-100.276307,"id":"advy9tiwczy1","location":"Glenham tracks and pond"},"type":"Feature","geometry":{"type":"Point","coordinates":[-100.276307,45.52909]}},{"properties":{"latitude":27.1208468,"date":{"end_time":"2012/12/16 00:00:00 -0500","original":"12/15/2012","granularity":"day","time":"2012/12/15 00:00:00 -0500"},"total":2,"longitude":-108.7208313,"id":"advy9twdd8jf","location":"Santa Barbara Valley and fields"},"type":"Feature","geometry":{"type":"Point","coordinates":[-108.7208313,27.1208468]}},{"properties":{"latitude":32.0435868,"date":{"end_time":"2013/01/21 00:00:00 -0500","original":"1/20/2013","granularity":"day","time":"2013/01/20 00:00:00 -0500"},"total":2,"longitude":-109.883194,"id":"advy9thr2cz8","location":"US 191--I-10 to Sunsites"},"type":"Feature","geometry":{"type":"Point","coordinates":[-109.883194,32.0435868]}},{"properties":{"latitude":21.8996151,"date":{"end_time":"2013/02/17 00:00:00 -0500","original":"2/16/2013","granularity":"day","time":"2013/02/16 00:00:00 -0500"},"total":2,"longitude":-159.6055824,"id":"advy9tpb29ez","location":"Salt Pond Beach Park ponds"},"type":"Feature","geometry":{"type":"Point","coordinates":[-159.6055824,21.8996151]}},{"properties":{"latitude":40.15352,"date":{"end_time":"1989/12/19 00:00:00 -0500","original":"12/18/1989","granularity":"day","time":"1989/12/18 00:00:00 -0500"},"total":1,"longitude":-74.37668,"id":"advy9twv8d9m","location":"New Jersey"},"type":"Feature","geometry":{"type":"Point","coordinates":[-74.37668,40.15352]}},{"properties":{"latitude":48.2172831,"date":{"end_time":"1997/12/29 00:00:00 -0500","original":"12/28/1997","granularity":"day","time":"1997/12/28 00:00:00 -0500"},"total":1,"longitude":16.3821196,"id":"advy9tjpzrnn","location":"Wien"},"type":"Feature","geometry":{"type":"Point","coordinates":[16.3821196,48.2172831]}},{"properties":{"latitude":48.9329038,"date":{"end_time":"1998/01/01 00:00:00 -0500","original":"12/31/1997","granularity":"day","time":"1997/12/31 00:00:00 -0500"},"total":1,"longitude":11.4261965,"id":"advy9tngz2bm","location":"Bayern"},"type":"Feature","geometry":{"type":"Point","coordinates":[11.4261965,48.9329038]}},{"properties":{"latitude":32.1769218,"date":{"end_time":"1998/06/15 00:00:00 -0400","original":"6/14/1998","granularity":"day","time":"1998/06/14 00:00:00 -0400"},"total":1,"longitude":-104.4373627,"id":"advy9tmmkwqg","location":"Carlsbad Caverns NP -- Cavern Entrance"},"type":"Feature","geometry":{"type":"Point","coordinates":[-104.4373627,32.1769218]}},{"properties":{"latitude":33.7831424,"date":{"end_time":"2000/06/14 00:00:00 -0400","original":"6/13/2000","granularity":"day","time":"2000/06/13 00:00:00 -0400"},"total":1,"longitude":-106.8928528,"id":"advy9trgjvpd","location":"Bosque del Apache NWR -- Marsh Loop"},"type":"Feature","geometry":{"type":"Point","coordinates":[-106.8928528,33.7831424]}},{"properties":{"latitude":33.3961834,"date":{"end_time":"2000/06/21 00:00:00 -0400","original":"6/20/2000","granularity":"day","time":"2000/06/20 00:00:00 -0400"},"total":1,"longitude":-105.747335,"id":"advy9tq39c8v","location":"Lincoln NF -- Oak Grove Campground"},"type":"Feature","geometry":{"type":"Point","coordinates":[-105.747335,33.3961834]}},{"properties":{"latitude":31.7198009,"date":{"end_time":"2001/05/13 00:00:00 -0400","original":"5/12/2001","granularity":"day","time":"2001/05/12 00:00:00 -0400"},"total":1,"longitude":-110.1865997,"id":"advy9ti9pbyf","location":"San Pedro RNCA--Fairbank"},"type":"Feature","geometry":{"type":"Point","coordinates":[-110.1865997,31.7198009]}},{"properties":{"latitude":31.8360722,"date":{"end_time":"2001/05/13 00:00:00 -0400","original":"5/12/2001","granularity":"day","time":"2001/05/12 00:00:00 -0400"},"total":1,"longitude":-110.3486592,"id":"advy9tt1l5tc","location":"Kartchner Caverns SP"},"type":"Feature","geometry":{"type":"Point","coordinates":[-110.3486592,31.8360722]}},{"properties":{"latitude":33.2276494,"date":{"end_time":"2001/05/20 00:00:00 -0400","original":"5/19/2001","granularity":"day","time":"2001/05/19 00:00:00 -0400"},"total":1,"longitude":-108.2663369,"id":"advy9tqh7tqa","location":"Gila Cliff Dwellings NM"},"type":"Feature","geometry":{"type":"Point","coordinates":[-108.2663369,33.2276494]}},{"properties":{"latitude":33.1168498,"date":{"end_time":"2001/05/20 00:00:00 -0400","original":"5/19/2001","granularity":"day","time":"2001/05/19 00:00:00 -0400"},"total":1,"longitude":-108.1785965,"id":"advy9tjn419c","location":"Gila Wilderness Area"},"type":"Feature","geometry":{"type":"Point","coordinates":[-108.1785965,33.1168498]}},{"properties":{"latitude":38.2653389,"date":{"end_time":"2001/07/11 00:00:00 -0400","original":"7/10/2001","granularity":"day","time":"2001/07/10 00:00:00 -0400"},"total":1,"longitude":-105.6132889,"id":"advy9tjvqpn9","location":"Wet Mountain Valley, general"},"type":"Feature","geometry":{"type":"Point","coordinates":[-105.6132889,38.2653389]}},{"properties":{"latitude":38.2626432,"date":{"end_time":"2001/07/12 00:00:00 -0400","original":"7/11/2001","granularity":"day","time":"2001/07/11 00:00:00 -0400"},"total":1,"longitude":-105.6606674,"id":"advy9timb0j5","location":"Rainbow Trail Lutheran Camp"},"type":"Feature","geometry":{"type":"Point","coordinates":[-105.6606674,38.2626432]}},{"properties":{"latitude":38.99619,"date":{"end_time":"2001/07/17 00:00:00 -0400","original":"7/16/2001","granularity":"day","time":"2001/07/16 00:00:00 -0400"},"total":1,"longitude":-105.54598,"id":"advy9ty1et0n","location":"Colorado"},"type":"Feature","geometry":{"type":"Point","coordinates":[-105.54598,38.99619]}},{"properties":{"latitude":39.6394005,"date":{"end_time":"2001/08/13 00:00:00 -0400","original":"8/12/2001","granularity":"day","time":"2001/08/12 00:00:00 -0400"},"total":1,"longitude":-104.8541031,"id":"advy9tmij06t","location":"Cherry Creek SP"},"type":"Feature","geometry":{"type":"Point","coordinates":[-104.8541031,39.6394005]}},{"properties":{"latitude":47.3680646,"date":{"end_time":"2001/08/25 00:00:00 -0400","original":"8/24/2001","granularity":"day","time":"2001/08/24 00:00:00 -0400"},"total":1,"longitude":-114.2529557,"id":"advy9txs9ydu","location":"National Bison Range--Visitor Center"},"type":"Feature","geometry":{"type":"Point","coordinates":[-114.2529557,47.3680646]}},{"properties":{"latitude":54.9624262,"date":{"end_time":"2001/08/28 00:00:00 -0400","original":"8/27/2001","granularity":"day","time":"2001/08/27 00:00:00 -0400"},"total":1,"longitude":-123.0537415,"id":"advy9tsfqr8j","location":"McLeod Lake, BC"},"type":"Feature","geometry":{"type":"Point","coordinates":[-123.0537415,54.9624262]}},{"properties":{"latitude":63.5366977,"date":{"end_time":"2001/09/01 00:00:00 -0400","original":"8/31/2001","granularity":"day","time":"2001/08/31 00:00:00 -0400"},"total":1,"longitude":-149.8135185,"id":"advy9tul8daz","location":"Denali NP--Polychrome Pass area"},"type":"Feature","geometry":{"type":"Point","coordinates":[-149.8135185,63.5366977]}},{"properties":{"latitude":61.1564467,"date":{"end_time":"2002/02/08 00:00:00 -0500","original":"2/7/2002","granularity":"day","time":"2002/02/07 00:00:00 -0500"},"total":1,"longitude":-149.7546387,"id":"advy9tjqmu0i","location":"Anchorage--Far North Bicentennial Park"},"type":"Feature","geometry":{"type":"Point","coordinates":[-149.7546387,61.1564467]}},{"properties":{"latitude":60.0485606,"date":{"end_time":"2002/02/16 00:00:00 -0500","original":"2/15/2002","granularity":"day","time":"2002/02/15 00:00:00 -0500"},"total":1,"longitude":-151.6710663,"id":"advy9tr5dmbs","location":"Ninilchik (Kenai Peninsula)"},"type":"Feature","geometry":{"type":"Point","coordinates":[-151.6710663,60.0485606]}},{"properties":{"latitude":61.059303,"date":{"end_time":"2002/05/13 00:00:00 -0400","original":"5/12/2002","granularity":"day","time":"2002/05/12 00:00:00 -0400"},"total":1,"longitude":-149.8041415,"id":"advy9twmzf5o","location":"Anchorage--Potter Marsh S pullout (Seward Hwy. MP A11.3)"},"type":"Feature","geometry":{"type":"Point","coordinates":[-149.8041415,61.059303]}},{"properties":{"latitude":61.2015364,"date":{"end_time":"2002/05/15 00:00:00 -0400","original":"5/14/2002","granularity":"day","time":"2002/05/14 00:00:00 -0400"},"total":1,"longitude":-149.7609043,"id":"advy9tltowa4","location":"Anchorage--Cheney Lake"},"type":"Feature","geometry":{"type":"Point","coordinates":[-149.7609043,61.2015364]}},{"properties":{"latitude":60.4686424,"date":{"end_time":"2002/05/23 00:00:00 -0400","original":"5/22/2002","granularity":"day","time":"2002/05/22 00:00:00 -0400"},"total":1,"longitude":-145.3635406,"id":"advy9thw0r2w","location":"Cordova--Copper River Highway"},"type":"Feature","geometry":{"type":"Point","coordinates":[-145.3635406,60.4686424]}},{"properties":{"latitude":60.5482884,"date":{"end_time":"2002/05/24 00:00:00 -0400","original":"5/23/2002","granularity":"day","time":"2002/05/23 00:00:00 -0400"},"total":1,"longitude":-145.7896042,"id":"advy9tq0w2nd","location":"Orca Bay - kayak"},"type":"Feature","geometry":{"type":"Point","coordinates":[-145.7896042,60.5482884]}},{"properties":{"latitude":61.5368722,"date":{"end_time":"2002/06/23 00:00:00 -0400","original":"6/22/2002","granularity":"day","time":"2002/06/22 00:00:00 -0400"},"total":1,"longitude":-149.2616701,"id":"advy9tvq33v0","location":"Palmer Hay Flats--Rabbit Slough Access Road"},"type":"Feature","geometry":{"type":"Point","coordinates":[-149.2616701,61.5368722]}},{"properties":{"latitude":61.1234672,"date":{"end_time":"2002/07/05 00:00:00 -0400","original":"7/4/2002","granularity":"day","time":"2002/07/04 00:00:00 -0400"},"total":1,"longitude":-149.5421219,"id":"advy9tpimr9z","location":"Williwaw Lakes, Chugach SP, AK"},"type":"Feature","geometry":{"type":"Point","coordinates":[-149.5421219,61.1234672]}},{"properties":{"latitude":63.3685904,"date":{"end_time":"2002/07/12 00:00:00 -0400","original":"7/11/2002","granularity":"day","time":"2002/07/11 00:00:00 -0400"},"total":1,"longitude":-148.3277893,"id":"advy9tvj1pkg","location":"Denali Highway"},"type":"Feature","geometry":{"type":"Point","coordinates":[-148.3277893,63.3685904]}},{"properties":{"latitude":61.9216216,"date":{"end_time":"2002/07/14 00:00:00 -0400","original":"7/13/2002","granularity":"day","time":"2002/07/13 00:00:00 -0400"},"total":1,"longitude":-147.246666,"id":"advy9txaqtn6","location":"Glenn Hwy, Alaska"},"type":"Feature","geometry":{"type":"Point","coordinates":[-147.246666,61.9216216]}},{"properties":{"latitude":61.7324199,"date":{"end_time":"2002/08/31 00:00:00 -0400","original":"8/30/2002","granularity":"day","time":"2002/08/30 00:00:00 -0400"},"total":1,"longitude":-144.945631,"id":"advy9txyu61g","location":"Kenny Lake (Edgerton Highway)"},"type":"Feature","geometry":{"type":"Point","coordinates":[-144.945631,61.7324199]}},{"properties":{"latitude":63.4071202,"date":{"end_time":"2002/09/01 00:00:00 -0400","original":"8/31/2002","granularity":"day","time":"2002/08/31 00:00:00 -0400"},"total":1,"longitude":-142.2983551,"id":"advy9tksib0i","location":"Tetlin NWR, AK"},"type":"Feature","geometry":{"type":"Point","coordinates":[-142.2983551,63.4071202]}},{"properties":{"latitude":46.8503299,"date":{"end_time":"2002/09/13 00:00:00 -0400","original":"9/12/2002","granularity":"day","time":"2002/09/12 00:00:00 -0400"},"total":1,"longitude":-121.7524849,"id":"advy9tsk5dsa","location":"Mount Rainier National Park"},"type":"Feature","geometry":{"type":"Point","coordinates":[-121.7524849,46.8503299]}},{"properties":{"latitude":46.2451827,"date":{"end_time":"2002/09/14 00:00:00 -0400","original":"9/13/2002","granularity":"day","time":"2002/09/13 00:00:00 -0400"},"total":1,"longitude":-122.090495,"id":"advy9toxgsx8","location":"Mount St. Helen's NM"},"type":"Feature","geometry":{"type":"Point","coordinates":[-122.090495,46.2451827]}},{"properties":{"latitude":46.0367141,"date":{"end_time":"2002/09/17 00:00:00 -0400","original":"9/16/2002","granularity":"day","time":"2002/09/16 00:00:00 -0400"},"total":1,"longitude":-123.9316177,"id":"advy9txs8v7k","location":"Coastal Oregon - north"},"type":"Feature","geometry":{"type":"Point","coordinates":[-123.9316177,46.0367141]}},{"properties":{"latitude":38.0336882,"date":{"end_time":"2002/09/20 00:00:00 -0400","original":"9/19/2002","granularity":"day","time":"2002/09/19 00:00:00 -0400"},"total":1,"longitude":-122.9771805,"id":"advy9tuy08bl","location":"Point Reyes, General"},"type":"Feature","geometry":{"type":"Point","coordinates":[-122.9771805,38.0336882]}},{"properties":{"latitude":36.0575541,"date":{"end_time":"2002/09/30 00:00:00 -0400","original":"9/29/2002","granularity":"day","time":"2002/09/29 00:00:00 -0400"},"total":1,"longitude":-112.1677308,"id":"advy9twh5jp8","location":"Grand Canyon NP--South Rim"},"type":"Feature","geometry":{"type":"Point","coordinates":[-112.1677308,36.0575541]}},{"properties":{"latitude":17.740505,"date":{"end_time":"2002/10/31 00:00:00 -0500","original":"10/30/2002","granularity":"day","time":"2002/10/30 00:00:00 -0500"},"total":1,"longitude":-88.025575,"id":"advy9tp4t3k8","location":"Caye Caulker"},"type":"Feature","geometry":{"type":"Point","coordinates":[-88.025575,17.740505]}},{"properties":{"latitude":17.261506,"date":{"end_time":"2002/11/02 00:00:00 -0500","original":"11/1/2002","granularity":"day","time":"2002/11/01 00:00:00 -0500"},"total":1,"longitude":-88.787118,"id":"advy9tv4v9gl","location":"Guanacaste NP"},"type":"Feature","geometry":{"type":"Point","coordinates":[-88.787118,17.261506]}},{"properties":{"latitude":17.22248,"date":{"end_time":"2002/11/05 00:00:00 -0500","original":"11/4/2002","granularity":"day","time":"2002/11/04 00:00:00 -0500"},"total":1,"longitude":-89.62307,"id":"advy9tsrg0kp","location":"Tikal"},"type":"Feature","geometry":{"type":"Point","coordinates":[-89.62307,17.22248]}},{"properties":{"latitude":14.846156,"date":{"end_time":"2002/11/16 00:00:00 -0500","original":"11/15/2002","granularity":"day","time":"2002/11/15 00:00:00 -0500"},"total":1,"longitude":-91.5212631,"id":"advy9twlgdpn","location":"Quetzaltenango"},"type":"Feature","geometry":{"type":"Point","coordinates":[-91.5212631,14.846156]}},{"properties":{"latitude":14.7885537,"date":{"end_time":"2002/11/25 00:00:00 -0500","original":"11/24/2002","granularity":"day","time":"2002/11/24 00:00:00 -0500"},"total":1,"longitude":-91.6555882,"id":"advy9tvzyslc","location":"Laguna Chicabal"},"type":"Feature","geometry":{"type":"Point","coordinates":[-91.6555882,14.7885537]}},{"properties":{"latitude":14.7397516,"date":{"end_time":"2002/12/01 00:00:00 -0500","original":"11/30/2002","granularity":"day","time":"2002/11/30 00:00:00 -0500"},"total":1,"longitude":-91.5688992,"id":"advy9tqsl9mf","location":"Volcano Santa Maria"},"type":"Feature","geometry":{"type":"Point","coordinates":[-91.5688992,14.7397516]}},{"properties":{"latitude":13.8816569,"date":{"end_time":"2003/01/03 00:00:00 -0500","original":"1/2/2003","granularity":"day","time":"2003/01/02 00:00:00 -0500"},"total":1,"longitude":-90.4205704,"id":"advy9tljobxq","location":"Biotopo Monterico-Hawaii"},"type":"Feature","geometry":{"type":"Point","coordinates":[-90.4205704,13.8816569]}},{"properties":{"latitude":13.9789947,"date":{"end_time":"2003/01/06 00:00:00 -0500","original":"1/5/2003","granularity":"day","time":"2003/01/05 00:00:00 -0500"},"total":1,"longitude":-89.6743155,"id":"advy9tn1n8gy","location":"Sitio Arqueológico El Tazumal"},"type":"Feature","geometry":{"type":"Point","coordinates":[-89.6743155,13.9789947]}},{"properties":{"latitude":13.825412,"date":{"end_time":"2003/01/07 00:00:00 -0500","original":"1/6/2003","granularity":"day","time":"2003/01/06 00:00:00 -0500"},"total":1,"longitude":-89.6214867,"id":"advy9tk28pz4","location":"PN Los Volcanes--Sector Cerro Verde"},"type":"Feature","geometry":{"type":"Point","coordinates":[-89.6214867,13.825412]}},{"properties":{"latitude":14.5287314,"date":{"end_time":"2003/01/11 00:00:00 -0500","original":"1/10/2003","granularity":"day","time":"2003/01/10 00:00:00 -0500"},"total":1,"longitude":-88.6994934,"id":"advy9txwe16z","location":"PN Celaque"},"type":"Feature","geometry":{"type":"Point","coordinates":[-88.6994934,14.5287314]}},{"properties":{"latitude":14.8598504,"date":{"end_time":"2003/01/13 00:00:00 -0500","original":"1/12/2003","granularity":"day","time":"2003/01/12 00:00:00 -0500"},"total":1,"longitude":-89.1815186,"id":"advy9ts40kzl","location":"Copan Ruins"},"type":"Feature","geometry":{"type":"Point","coordinates":[-89.1815186,14.8598504]}},{"properties":{"latitude":15.7861307,"date":{"end_time":"2003/01/15 00:00:00 -0500","original":"1/14/2003","granularity":"day","time":"2003/01/14 00:00:00 -0500"},"total":1,"longitude":-87.458725,"id":"advy9tu32hpt","location":"Tela, Honduras"},"type":"Feature","geometry":{"type":"Point","coordinates":[-87.458725,15.7861307]}},{"properties":{"latitude":15.4245581,"date":{"end_time":"2003/01/15 00:00:00 -0500","original":"1/14/2003","granularity":"day","time":"2003/01/14 00:00:00 -0500"},"total":1,"longitude":-88.0643463,"id":"advy9tjh7fn4","location":"general area of flooded field"},"type":"Feature","geometry":{"type":"Point","coordinates":[-88.0643463,15.4245581]}},{"properties":{"latitude":15.0677917,"date":{"end_time":"2003/01/17 00:00:00 -0500","original":"1/16/2003","granularity":"day","time":"2003/01/16 00:00:00 -0500"},"total":1,"longitude":-86.7604065,"id":"advy9tuublot","location":"PN La Muralla"},"type":"Feature","geometry":{"type":"Point","coordinates":[-86.7604065,15.0677917]}},{"properties":{"latitude":13.0906698,"date":{"end_time":"2003/01/19 00:00:00 -0500","original":"1/18/2003","granularity":"day","time":"2003/01/18 00:00:00 -0500"},"total":1,"longitude":-86.3532257,"id":"advy9tni3qdf","location":"Estelli"},"type":"Feature","geometry":{"type":"Point","coordinates":[-86.3532257,13.0906698]}},{"properties":{"latitude":11.9868092,"date":{"end_time":"2003/01/23 00:00:00 -0500","original":"1/22/2003","granularity":"day","time":"2003/01/22 00:00:00 -0500"},"total":1,"longitude":-86.1668444,"id":"advy9tlxh8lv","location":"Parque Nacional Volcan Masaya"},"type":"Feature","geometry":{"type":"Point","coordinates":[-86.1668444,11.9868092]}},{"properties":{"latitude":11.4757979,"date":{"end_time":"2003/01/27 00:00:00 -0500","original":"1/26/2003","granularity":"day","time":"2003/01/26 00:00:00 -0500"},"total":1,"longitude":-85.5117416,"id":"advy9tjt7ysv","location":"Volcán Maderas--Finca Magdalena"},"type":"Feature","geometry":{"type":"Point","coordinates":[-85.5117416,11.4757979]}},{"properties":{"latitude":10.9955806,"date":{"end_time":"2003/01/30 00:00:00 -0500","original":"1/29/2003","granularity":"day","time":"2003/01/29 00:00:00 -0500"},"total":1,"longitude":-84.7198677,"id":"advy9tti87d5","location":"Rio Frio &amp; Cano Negro"},"type":"Feature","geometry":{"type":"Point","coordinates":[-84.7198677,10.9955806]}},{"properties":{"latitude":10.7612452,"date":{"end_time":"2003/02/01 00:00:00 -0500","original":"1/31/2003","granularity":"day","time":"2003/01/31 00:00:00 -0500"},"total":1,"longitude":-85.3276048,"id":"advy9tl17gck","location":"Rincon de la Vieja - Laguna Fumarolica Trail"},"type":"Feature","geometry":{"type":"Point","coordinates":[-85.3276048,10.7612452]}},{"properties":{"latitude":10.4732053,"date":{"end_time":"2003/02/02 00:00:00 -0500","original":"2/1/2003","granularity":"day","time":"2003/02/01 00:00:00 -0500"},"total":1,"longitude":-84.9672318,"id":"advy9tjfmdwa","location":"Tilaran"},"type":"Feature","geometry":{"type":"Point","coordinates":[-84.9672318,10.4732053]}},{"properties":{"latitude":10.3569444,"date":{"end_time":"2003/02/04 00:00:00 -0500","original":"2/3/2003","granularity":"day","time":"2003/02/03 00:00:00 -0500"},"total":1,"longitude":-84.7897222,"id":"advy9tmyntro","location":"Reserva Santa Elena"},"type":"Feature","geometry":{"type":"Point","coordinates":[-84.7897222,10.3569444]}},{"properties":{"latitude":10.3331586,"date":{"end_time":"2003/02/05 00:00:00 -0500","original":"2/4/2003","granularity":"day","time":"2003/02/04 00:00:00 -0500"},"total":1,"longitude":-84.8305893,"id":"advy9tiptb48","location":"Monteverde--Selvanatura"},"type":"Feature","geometry":{"type":"Point","coordinates":[-84.8305893,10.3331586]}},{"properties":{"latitude":10.30136,"date":{"end_time":"2003/02/06 00:00:00 -0500","original":"2/5/2003","granularity":"day","time":"2003/02/05 00:00:00 -0500"},"total":1,"longitude":-84.79572,"id":"advy9tlr49nu","location":"Monteverde--Hummingbird Gallery"},"type":"Feature","geometry":{"type":"Point","coordinates":[-84.79572,10.30136]}},{"properties":{"latitude":8.5310239,"date":{"end_time":"2003/02/08 00:00:00 -0500","original":"2/7/2003","granularity":"day","time":"2003/02/07 00:00:00 -0500"},"total":1,"longitude":-83.2993698,"id":"advy9tl2t4y2","location":"Puerto Jimenez"},"type":"Feature","geometry":{"type":"Point","coordinates":[-83.2993698,8.5310239]}},{"properties":{"latitude":8.4529254,"date":{"end_time":"2003/02/09 00:00:00 -0500","original":"2/8/2003","granularity":"day","time":"2003/02/08 00:00:00 -0500"},"total":1,"longitude":-83.4621048,"id":"advy9tqu6pyb","location":"Osa Peninsula - along road"},"type":"Feature","geometry":{"type":"Point","coordinates":[-83.4621048,8.4529254]}},{"properties":{"latitude":8.8685747,"date":{"end_time":"2003/02/13 00:00:00 -0500","original":"2/12/2003","granularity":"day","time":"2003/02/12 00:00:00 -0500"},"total":1,"longitude":-82.5631142,"id":"advy9tlwwnew","location":"Guadelupe"},"type":"Feature","geometry":{"type":"Point","coordinates":[-82.5631142,8.8685747]}},{"properties":{"latitude":8.8892664,"date":{"end_time":"2003/02/14 00:00:00 -0500","original":"2/13/2003","granularity":"day","time":"2003/02/13 00:00:00 -0500"},"total":1,"longitude":-82.5510979,"id":"advy9tvvgtuv","location":"La Amistad NP"},"type":"Feature","geometry":{"type":"Point","coordinates":[-82.5510979,8.8892664]}},{"properties":{"latitude":8.8715033,"date":{"end_time":"2003/02/15 00:00:00 -0500","original":"2/14/2003","granularity":"day","time":"2003/02/14 00:00:00 -0500"},"total":1,"longitude":-82.5468063,"id":"advy9tjjul9q","location":"Cabanas Los Quetzales"},"type":"Feature","geometry":{"type":"Point","coordinates":[-82.5468063,8.8715033]}},{"properties":{"latitude":8.84216,"date":{"end_time":"2003/02/16 00:00:00 -0500","original":"2/15/2003","granularity":"day","time":"2003/02/15 00:00:00 -0500"},"total":1,"longitude":-82.5518703,"id":"advy9tnc8yld","location":"Sendero de Los Quetzales"},"type":"Feature","geometry":{"type":"Point","coordinates":[-82.5518703,8.84216]}},{"properties":{"latitude":8.8018727,"date":{"end_time":"2003/02/19 00:00:00 -0500","original":"2/18/2003","granularity":"day","time":"2003/02/18 00:00:00 -0500"},"total":1,"longitude":-82.5186539,"id":"advy9tu9rd5w","location":"Volcan Baru--Road from Boquete"},"type":"Feature","geometry":{"type":"Point","coordinates":[-82.5186539,8.8018727]}},{"properties":{"latitude":9.0197259,"date":{"end_time":"2003/02/20 00:00:00 -0500","original":"2/19/2003","granularity":"day","time":"2003/02/19 00:00:00 -0500"},"total":1,"longitude":-79.6026635,"id":"advy9txvzmco","location":"Pipeline Road"},"type":"Feature","geometry":{"type":"Point","coordinates":[-79.6026635,9.0197259]}},{"properties":{"latitude":9.312564,"date":{"end_time":"2003/02/22 00:00:00 -0500","original":"2/21/2003","granularity":"day","time":"2003/02/21 00:00:00 -0500"},"total":1,"longitude":-82.194507,"id":"advy9tv2ndkm","location":"Bocas del Toro - Isla Solarte"},"type":"Feature","geometry":{"type":"Point","coordinates":[-82.194507,9.312564]}},{"properties":{"latitude":9.7374819,"date":{"end_time":"2003/02/25 00:00:00 -0500","original":"2/24/2003","granularity":"day","time":"2003/02/24 00:00:00 -0500"},"total":1,"longitude":-82.8408623,"id":"advy9tkr8cc5","location":"Cahuita"},"type":"Feature","geometry":{"type":"Point","coordinates":[-82.8408623,9.7374819]}},{"properties":{"latitude":10.1752977,"date":{"end_time":"2003/02/27 00:00:00 -0500","original":"2/26/2003","granularity":"day","time":"2003/02/26 00:00:00 -0500"},"total":1,"longitude":-84.2490005,"id":"advy9tnqlufm","location":"Volcano Poas NP"},"type":"Feature","geometry":{"type":"Point","coordinates":[-84.2490005,10.1752977]}},{"properties":{"latitude":40.6673258,"date":{"end_time":"2003/03/19 00:00:00 -0500","original":"3/18/2003","granularity":"day","time":"2003/03/18 00:00:00 -0500"},"total":1,"longitude":-99.0898991,"id":"advy9tmunkdi","location":"Kea Lake WMA"},"type":"Feature","geometry":{"type":"Point","coordinates":[-99.0898991,40.6673258]}},{"properties":{"latitude":41.5755524,"date":{"end_time":"2003/03/24 00:00:00 -0500","original":"3/23/2003","granularity":"day","time":"2003/03/23 00:00:00 -0500"},"total":1,"longitude":-93.2627163,"id":"advy9tpkhem1","location":"Neal Smith NWR"},"type":"Feature","geometry":{"type":"Point","coordinates":[-93.2627163,41.5755524]}},{"properties":{"latitude":38.6748562,"date":{"end_time":"2003/04/08 00:00:00 -0400","original":"4/7/2003","granularity":"day","time":"2003/04/07 00:00:00 -0400"},"total":1,"longitude":-109.5874214,"id":"advy9tsorpqe","location":"Arches NP"},"type":"Feature","geometry":{"type":"Point","coordinates":[-109.5874214,38.6748562]}},{"properties":{"latitude":42.9391454,"date":{"end_time":"2003/04/10 00:00:00 -0400","original":"4/9/2003","granularity":"day","time":"2003/04/09 00:00:00 -0400"},"total":1,"longitude":-115.3184223,"id":"advy9txtzhqk","location":"Three Island Crossing SP"},"type":"Feature","geometry":{"type":"Point","coordinates":[-115.3184223,42.9391454]}},{"properties":{"latitude":58.3575546,"date":{"end_time":"2003/07/10 00:00:00 -0400","original":"7/9/2003","granularity":"day","time":"2003/07/09 00:00:00 -0400"},"total":1,"longitude":-134.5333385,"id":"advy9tw0j63m","location":"Juneau - King's House"},"type":"Feature","geometry":{"type":"Point","coordinates":[-134.5333385,58.3575546]}},{"properties":{"latitude":58.4334895,"date":{"end_time":"2003/07/20 00:00:00 -0400","original":"7/19/2003","granularity":"day","time":"2003/07/19 00:00:00 -0400"},"total":1,"longitude":-134.5890427,"id":"advy9tkibzg7","location":"Juneau - Mt. McGinnis"},"type":"Feature","geometry":{"type":"Point","coordinates":[-134.5890427,58.4334895]}},{"properties":{"latitude":41.714118,"date":{"end_time":"2003/08/10 00:00:00 -0400","original":"8/9/2003","granularity":"day","time":"2003/08/09 00:00:00 -0400"},"total":1,"longitude":-90.5283737,"id":"advy9tvss0mp","location":"Scott County Park"},"type":"Feature","geometry":{"type":"Point","coordinates":[-90.5283737,41.714118]}},{"properties":{"latitude":32.22178,"date":{"end_time":"2003/12/23 00:00:00 -0500","original":"12/22/2003","granularity":"day","time":"2003/12/22 00:00:00 -0500"},"total":1,"longitude":-110.92665,"id":"advy9tx3bfgm","location":"Tucson"},"type":"Feature","geometry":{"type":"Point","coordinates":[-110.92665,32.22178]}},{"properties":{"latitude":33.151188,"date":{"end_time":"2003/12/30 00:00:00 -0500","original":"12/29/2003","granularity":"day","time":"2003/12/29 00:00:00 -0500"},"total":1,"longitude":-107.203,"id":"advy9tlgzjh6","location":"Elephant Butte SP -- Paseo del Rio"},"type":"Feature","geometry":{"type":"Point","coordinates":[-107.203,33.151188]}},{"properties":{"latitude":35.68693,"date":{"end_time":"2003/12/30 00:00:00 -0500","original":"12/29/2003","granularity":"day","time":"2003/12/29 00:00:00 -0500"},"total":1,"longitude":-105.93758,"id":"advy9tkug6jm","location":"Santa Fe"},"type":"Feature","geometry":{"type":"Point","coordinates":[-105.93758,35.68693]}},{"properties":{"latitude":34.66286,"date":{"end_time":"2003/12/31 00:00:00 -0500","original":"12/30/2003","granularity":"day","time":"2003/12/30 00:00:00 -0500"},"total":1,"longitude":-106.77658,"id":"advy9ts4a25z","location":"Belen"},"type":"Feature","geometry":{"type":"Point","coordinates":[-106.77658,34.66286]}},{"properties":{"latitude":32.3697822,"date":{"end_time":"2004/01/02 00:00:00 -0500","original":"1/1/2004","granularity":"day","time":"2004/01/01 00:00:00 -0500"},"total":1,"longitude":-106.5572634,"id":"advy9tpumyv0","location":"Aguirre Spring Recreation Area"},"type":"Feature","geometry":{"type":"Point","coordinates":[-106.5572634,32.3697822]}},{"properties":{"latitude":58.4182743,"date":{"end_time":"2004/02/29 00:00:00 -0500","original":"2/28/2004","granularity":"day","time":"2004/02/28 00:00:00 -0500"},"total":1,"longitude":-134.5903301,"id":"advy9tnrmtr5","location":"Juneau--Mendenhall Lake-Campgrnd &amp; Trails"},"type":"Feature","geometry":{"type":"Point","coordinates":[-134.5903301,58.4182743]}},{"properties":{"latitude":58.3729854,"date":{"end_time":"2004/03/20 00:00:00 -0500","original":"3/19/2004","granularity":"day","time":"2004/03/19 00:00:00 -0500"},"total":1,"longitude":-134.7267151,"id":"advy9twoheyu","location":"Auke Recreation Area--Point Louisa (Juneau)"},"type":"Feature","geometry":{"type":"Point","coordinates":[-134.7267151,58.3729854]}},{"properties":{"latitude":59.2370936,"date":{"end_time":"2004/05/17 00:00:00 -0400","original":"5/16/2004","granularity":"day","time":"2004/05/16 00:00:00 -0400"},"total":1,"longitude":-135.4452896,"id":"advy9tkg3kmd","location":"Haines"},"type":"Feature","geometry":{"type":"Point","coordinates":[-135.4452896,59.2370936]}},{"properties":{"latitude":57.898,"date":{"end_time":"2004/05/23 00:00:00 -0400","original":"5/22/2004","granularity":"day","time":"2004/05/22 00:00:00 -0400"},"total":1,"longitude":-133.277,"id":"advy9tm5t5c0","location":"Tracy Arm (Holkham Bay-Stephens Passage)"},"type":"Feature","geometry":{"type":"Point","coordinates":[-133.277,57.898]}},{"properties":{"latitude":59.783176,"date":{"end_time":"2004/05/29 00:00:00 -0400","original":"5/28/2004","granularity":"day","time":"2004/05/28 00:00:00 -0400"},"total":1,"longitude":-133.7626648,"id":"advy9tie9xi5","location":"Atlin, BC - along road"},"type":"Feature","geometry":{"type":"Point","coordinates":[-133.7626648,59.783176]}},{"properties":{"latitude":64.48523,"date":{"end_time":"2004/06/11 00:00:00 -0400","original":"6/10/2004","granularity":"day","time":"2004/06/10 00:00:00 -0400"},"total":1,"longitude":-165.29861,"id":"advy9tl23m22","location":"Nome River mouth"},"type":"Feature","geometry":{"type":"Point","coordinates":[-165.29861,64.48523]}},{"properties":{"latitude":64.6469307,"date":{"end_time":"2004/06/12 00:00:00 -0400","original":"6/11/2004","granularity":"day","time":"2004/06/11 00:00:00 -0400"},"total":1,"longitude":-165.2924824,"id":"advy9twlwu84","location":"Kougarok Road--Nome River"},"type":"Feature","geometry":{"type":"Point","coordinates":[-165.2924824,64.6469307]}},{"properties":{"latitude":65.2592929,"date":{"end_time":"2004/06/13 00:00:00 -0400","original":"6/12/2004","granularity":"day","time":"2004/06/12 00:00:00 -0400"},"total":1,"longitude":-166.3549805,"id":"advy9twejove","location":"Teller (Seward Peninsula)"},"type":"Feature","geometry":{"type":"Point","coordinates":[-166.3549805,65.2592929]}},{"properties":{"latitude":64.5238417,"date":{"end_time":"2004/06/13 00:00:00 -0400","original":"6/12/2004","granularity":"day","time":"2004/06/12 00:00:00 -0400"},"total":1,"longitude":-165.2812528,"id":"advy9tpuh3tc","location":"Nome--dump (Beam Rd.)"},"type":"Feature","geometry":{"type":"Point","coordinates":[-165.2812528,64.5238417]}},{"properties":{"latitude":64.834984,"date":{"end_time":"2004/06/13 00:00:00 -0400","original":"6/12/2004","granularity":"day","time":"2004/06/12 00:00:00 -0400"},"total":1,"longitude":-166.40685,"id":"advy9toox2xy","location":"Woolley Lagoon (NW of Nome)"},"type":"Feature","geometry":{"type":"Point","coordinates":[-166.40685,64.834984]}},{"properties":{"latitude":64.52735,"date":{"end_time":"2004/06/14 00:00:00 -0400","original":"6/13/2004","granularity":"day","time":"2004/06/13 00:00:00 -0400"},"total":1,"longitude":-165.41586,"id":"advy9tnypnjn","location":"Nome--Center Creek Road"},"type":"Feature","geometry":{"type":"Point","coordinates":[-165.41586,64.52735]}},{"properties":{"latitude":64.499819,"date":{"end_time":"2004/06/14 00:00:00 -0400","original":"6/13/2004","granularity":"day","time":"2004/06/13 00:00:00 -0400"},"total":1,"longitude":-165.425236,"id":"advy9tuhedqv","location":"Nome--Harbor"},"type":"Feature","geometry":{"type":"Point","coordinates":[-165.425236,64.499819]}},{"properties":{"latitude":61.2083266,"date":{"end_time":"2004/06/15 00:00:00 -0400","original":"6/14/2004","granularity":"day","time":"2004/06/14 00:00:00 -0400"},"total":1,"longitude":-149.9247327,"id":"advy9tqs9ulk","location":"Anchorage--Coastal Trail-Chester Creek mouth"},"type":"Feature","geometry":{"type":"Point","coordinates":[-149.9247327,61.2083266]}},{"properties":{"latitude":60.7193044,"date":{"end_time":"2004/06/19 00:00:00 -0400","original":"6/18/2004","granularity":"day","time":"2004/06/18 00:00:00 -0400"},"total":1,"longitude":-135.0478935,"id":"advy9tjhe90e","location":"Whitehorse--Yukon River"},"type":"Feature","geometry":{"type":"Point","coordinates":[-135.0478935,60.7193044]}},{"properties":{"latitude":59.4528845,"date":{"end_time":"2004/06/20 00:00:00 -0400","original":"6/19/2004","granularity":"day","time":"2004/06/19 00:00:00 -0400"},"total":1,"longitude":-135.3356838,"id":"advy9tq77wz2","location":"Skagway--Yakutania Point trail"},"type":"Feature","geometry":{"type":"Point","coordinates":[-135.3356838,59.4528845]}},{"properties":{"latitude":58.5467614,"date":{"end_time":"2004/06/29 00:00:00 -0400","original":"6/28/2004","granularity":"day","time":"2004/06/28 00:00:00 -0400"},"total":1,"longitude":-134.9230957,"id":"advy9tkm1mcg","location":"Juneau - Sentinel Island"},"type":"Feature","geometry":{"type":"Point","coordinates":[-134.9230957,58.5467614]}},{"properties":{"latitude":58.4114243,"date":{"end_time":"2004/06/29 00:00:00 -0400","original":"6/28/2004","granularity":"day","time":"2004/06/28 00:00:00 -0400"},"total":1,"longitude":-134.9567413,"id":"advy9twrl47y","location":"Point Retreat - Admiralty Island"},"type":"Feature","geometry":{"type":"Point","coordinates":[-134.9567413,58.4114243]}},{"properties":{"latitude":58.4610246,"date":{"end_time":"2004/07/01 00:00:00 -0400","original":"6/30/2004","granularity":"day","time":"2004/06/30 00:00:00 -0400"},"total":1,"longitude":-134.773407,"id":"advy9tn9udy0","location":"Out the Road - MP 22"},"type":"Feature","geometry":{"type":"Point","coordinates":[-134.773407,58.4610246]}},{"properties":{"latitude":60.6869644,"date":{"end_time":"2004/07/17 00:00:00 -0400","original":"7/16/2004","granularity":"day","time":"2004/07/16 00:00:00 -0400"},"total":1,"longitude":-135.0302124,"id":"advy9tkntoqa","location":"Whitehorse--Schwatka Lake"},"type":"Feature","geometry":{"type":"Point","coordinates":[-135.0302124,60.6869644]}},{"properties":{"latitude":60.8820204,"date":{"end_time":"2004/07/17 00:00:00 -0400","original":"7/16/2004","granularity":"day","time":"2004/07/16 00:00:00 -0400"},"total":1,"longitude":-135.3652954,"id":"advy9tr820h3","location":"Takhini Hot Spring"},"type":"Feature","geometry":{"type":"Point","coordinates":[-135.3652954,60.8820204]}},{"properties":{"latitude":58.2516667,"date":{"end_time":"2004/09/01 00:00:00 -0400","original":"8/31/2004","granularity":"day","time":"2004/08/31 00:00:00 -0400"},"total":1,"longitude":-135.4766667,"id":"advy9tmnsvz9","location":"Cross Gulf Ferry - Cross Sound area"},"type":"Feature","geometry":{"type":"Point","coordinates":[-135.4766667,58.2516667]}},{"properties":{"latitude":59.6633333,"date":{"end_time":"2004/09/02 00:00:00 -0400","original":"9/1/2004","granularity":"day","time":"2004/09/01 00:00:00 -0400"},"total":1,"longitude":-143.6583333,"id":"advy9tnyksjt","location":"Cross Gulf Ferry -  E of Kayak Island"},"type":"Feature","geometry":{"type":"Point","coordinates":[-143.6583333,59.6633333]}},{"properties":{"latitude":59.6783333,"date":{"end_time":"2004/09/02 00:00:00 -0400","original":"9/1/2004","granularity":"day","time":"2004/09/01 00:00:00 -0400"},"total":1,"longitude":-144.135,"id":"advy9tquirrz","location":"Cross Gulf Ferry - near Pampaloma Spur"},"type":"Feature","geometry":{"type":"Point","coordinates":[-144.135,59.6783333]}},{"properties":{"latitude":59.5565919,"date":{"end_time":"2004/09/02 00:00:00 -0400","original":"9/1/2004","granularity":"day","time":"2004/09/01 00:00:00 -0400"},"total":1,"longitude":-139.9259949,"id":"advy9tt2z9f2","location":"Yakutat Bay"},"type":"Feature","geometry":{"type":"Point","coordinates":[-139.9259949,59.5565919]}},{"properties":{"latitude":60.0706365,"date":{"end_time":"2004/09/03 00:00:00 -0400","original":"9/2/2004","granularity":"day","time":"2004/09/02 00:00:00 -0400"},"total":1,"longitude":-149.4349383,"id":"advy9twks2v5","location":"Seward--Lowell Point"},"type":"Feature","geometry":{"type":"Point","coordinates":[-149.4349383,60.0706365]}},{"properties":{"latitude":60.1779204,"date":{"end_time":"2004/09/04 00:00:00 -0400","original":"9/3/2004","granularity":"day","time":"2004/09/03 00:00:00 -0400"},"total":1,"longitude":-146.8015193,"id":"advy9tvo3gn9","location":"Cross Gulf Ferry - S of Hinchinbrook Entr"},"type":"Feature","geometry":{"type":"Point","coordinates":[-146.8015193,60.1779204]}},{"properties":{"latitude":58.2994864,"date":{"end_time":"2004/09/05 00:00:00 -0400","original":"9/4/2004","granularity":"day","time":"2004/09/04 00:00:00 -0400"},"total":1,"longitude":-137.4036138,"id":"advy9tm9z1vl","location":"Cross Gulf Ferry - West of Peruse Glacier"},"type":"Feature","geometry":{"type":"Point","coordinates":[-137.4036138,58.2994864]}},{"properties":{"latitude":58.5006426,"date":{"end_time":"2004/09/10 00:00:00 -0400","original":"9/9/2004","granularity":"day","time":"2004/09/09 00:00:00 -0400"},"total":1,"longitude":-134.7737503,"id":"advy9thtvskr","location":"Juneau - Peterson Creek Trail"},"type":"Feature","geometry":{"type":"Point","coordinates":[-134.7737503,58.5006426]}},{"properties":{"latitude":33.4618165,"date":{"end_time":"2004/10/02 00:00:00 -0400","original":"10/1/2004","granularity":"day","time":"2004/10/01 00:00:00 -0400"},"total":1,"longitude":-111.9436349,"id":"advy9trzggwn","location":"Desert Botanical Garden"},"type":"Feature","geometry":{"type":"Point","coordinates":[-111.9436349,33.4618165]}},{"properties":{"latitude":33.5207371,"date":{"end_time":"2004/10/02 00:00:00 -0400","original":"10/1/2004","granularity":"day","time":"2004/10/01 00:00:00 -0400"},"total":1,"longitude":-111.9744161,"id":"advy9thmwf46","location":"Camelback Mountain Recreation Area"},"type":"Feature","geometry":{"type":"Point","coordinates":[-111.9744161,33.5207371]}},{"properties":{"latitude":34.9748037,"date":{"end_time":"2004/10/03 00:00:00 -0400","original":"10/2/2004","granularity":"day","time":"2004/10/02 00:00:00 -0400"},"total":1,"longitude":-111.754606,"id":"advy9ttc58wn","location":"Oak Creek Canyon"},"type":"Feature","geometry":{"type":"Point","coordinates":[-111.754606,34.9748037]}},{"properties":{"latitude":35.1717762,"date":{"end_time":"2004/10/03 00:00:00 -0400","original":"10/2/2004","granularity":"day","time":"2004/10/02 00:00:00 -0400"},"total":1,"longitude":-111.5094022,"id":"advy9thiq47h","location":"Walnut Canyon NM"},"type":"Feature","geometry":{"type":"Point","coordinates":[-111.5094022,35.1717762]}},{"properties":{"latitude":32.4861722,"date":{"end_time":"2004/10/06 00:00:00 -0400","original":"10/5/2004","granularity":"day","time":"2004/10/05 00:00:00 -0400"},"total":1,"longitude":-106.9223222,"id":"advy9tw6ai97","location":"Leasburg Dam SP"},"type":"Feature","geometry":{"type":"Point","coordinates":[-106.9223222,32.4861722]}},{"properties":{"latitude":33.1828477,"date":{"end_time":"2004/10/08 00:00:00 -0400","original":"10/7/2004","granularity":"day","time":"2004/10/07 00:00:00 -0400"},"total":1,"longitude":-107.2054657,"id":"advy9tkx36cq","location":"Elephant Butte SP -- Main Marina"},"type":"Feature","geometry":{"type":"Point","coordinates":[-107.2054657,33.1828477]}},{"properties":{"latitude":32.9851435,"date":{"end_time":"2004/10/08 00:00:00 -0400","original":"10/7/2004","granularity":"day","time":"2004/10/07 00:00:00 -0400"},"total":1,"longitude":-107.2894657,"id":"advy9tomnyiy","location":"Caballo Lake SP -- Seco Flats"},"type":"Feature","geometry":{"type":"Point","coordinates":[-107.2894657,32.9851435]}},{"properties":{"latitude":34.694522,"date":{"end_time":"2004/10/08 00:00:00 -0400","original":"10/7/2004","granularity":"day","time":"2004/10/07 00:00:00 -0400"},"total":1,"longitude":-106.773237,"id":"advy9txyx289","location":"Belen (Taco Bell) Marsh"},"type":"Feature","geometry":{"type":"Point","coordinates":[-106.773237,34.694522]}},{"properties":{"latitude":31.9204006,"date":{"end_time":"2004/10/10 00:00:00 -0400","original":"10/9/2004","granularity":"day","time":"2004/10/09 00:00:00 -0400"},"total":1,"longitude":-109.1275024,"id":"advy9tlj1t5t","location":"Portal--Big Thicket"},"type":"Feature","geometry":{"type":"Point","coordinates":[-109.1275024,31.9204006]}},{"properties":{"latitude":31.909,"date":{"end_time":"2004/10/10 00:00:00 -0400","original":"10/9/2004","granularity":"day","time":"2004/10/09 00:00:00 -0400"},"total":1,"longitude":-109.251,"id":"advy9tqsgcyp","location":"East Turkey Creek"},"type":"Feature","geometry":{"type":"Point","coordinates":[-109.251,31.909]}},{"properties":{"latitude":31.8361028,"date":{"end_time":"2004/10/10 00:00:00 -0400","original":"10/9/2004","granularity":"day","time":"2004/10/09 00:00:00 -0400"},"total":1,"longitude":-109.0508306,"id":"advy9tuv4lvq","location":"Stateline Rd. (Cochise Co.)"},"type":"Feature","geometry":{"type":"Point","coordinates":[-109.0508306,31.8361028]}},{"properties":{"latitude":31.8499104,"date":{"end_time":"2004/10/10 00:00:00 -0400","original":"10/9/2004","granularity":"day","time":"2004/10/09 00:00:00 -0400"},"total":1,"longitude":-109.0476322,"id":"advy9tqr55gv","location":"Stateline Road (Hidalgo County)"},"type":"Feature","geometry":{"type":"Point","coordinates":[-109.0476322,31.8499104]}},{"properties":{"latitude":31.5599995,"date":{"end_time":"2004/10/11 00:00:00 -0400","original":"10/10/2004","granularity":"day","time":"2004/10/10 00:00:00 -0400"},"total":1,"longitude":-110.1994019,"id":"advy9tj11x6n","location":"Sierra Vista EOP"},"type":"Feature","geometry":{"type":"Point","coordinates":[-110.1994019,31.5599995]}},{"properties":{"latitude":31.5427632,"date":{"end_time":"2004/10/11 00:00:00 -0400","original":"10/10/2004","granularity":"day","time":"2004/10/10 00:00:00 -0400"},"total":1,"longitude":-110.1337928,"id":"advy9to42e7u","location":"San Pedro RNCA--Kingfisher Pond"},"type":"Feature","geometry":{"type":"Point","coordinates":[-110.1337928,31.5427632]}},{"properties":{"latitude":31.9493008,"date":{"end_time":"2004/10/17 00:00:00 -0400","original":"10/16/2004","granularity":"day","time":"2004/10/16 00:00:00 -0400"},"total":1,"longitude":-106.3423004,"id":"advy9ti8s0b5","location":"Fred Hervey Water Reclamation Ponds (FWTX 4)"},"type":"Feature","geometry":{"type":"Point","coordinates":[-106.3423004,31.9493008]}},{"properties":{"latitude":31.9001007,"date":{"end_time":"2004/10/17 00:00:00 -0400","original":"10/16/2004","granularity":"day","time":"2004/10/16 00:00:00 -0400"},"total":1,"longitude":-104.870697,"id":"advy9twb3haa","location":"Guadalupe Mountains NP"},"type":"Feature","geometry":{"type":"Point","coordinates":[-104.870697,31.9001007]}},{"properties":{"latitude":31.2588113,"date":{"end_time":"2004/10/18 00:00:00 -0400","original":"10/17/2004","granularity":"day","time":"2004/10/17 00:00:00 -0400"},"total":1,"longitude":-104.8483658,"id":"advy9tnmtxf8","location":"along Hwy 54"},"type":"Feature","geometry":{"type":"Point","coordinates":[-104.8483658,31.2588113]}},{"properties":{"latitude":30.9617996,"date":{"end_time":"2004/10/18 00:00:00 -0400","original":"10/17/2004","granularity":"day","time":"2004/10/17 00:00:00 -0400"},"total":1,"longitude":-103.7192993,"id":"advy9tu4m113","location":"Lake Balmorhea (FWTX 20)"},"type":"Feature","geometry":{"type":"Point","coordinates":[-103.7192993,30.9617996]}},{"properties":{"latitude":26.1857402,"date":{"end_time":"2004/10/19 00:00:00 -0400","original":"10/18/2004","granularity":"day","time":"2004/10/18 00:00:00 -0400"},"total":1,"longitude":-97.6641657,"id":"advy9tmxw4xc","location":"Harlingen Arroyo Colorado (Ramsey Park) WBC (LTC 026)"},"type":"Feature","geometry":{"type":"Point","coordinates":[-97.6641657,26.1857402]}},{"properties":{"latitude":26.2644011,"date":{"end_time":"2004/10/19 00:00:00 -0400","original":"10/18/2004","granularity":"day","time":"2004/10/18 00:00:00 -0400"},"total":1,"longitude":-97.3870182,"id":"advy9tvijl73","location":"Laguna Atascosa NWR (LTC 024)"},"type":"Feature","geometry":{"type":"Point","coordinates":[-97.3870182,26.2644011]}},{"properties":{"latitude":26.0677701,"date":{"end_time":"2004/10/19 00:00:00 -0400","original":"10/18/2004","granularity":"day","time":"2004/10/18 00:00:00 -0400"},"total":1,"longitude":-97.146306,"id":"advy9tw2b325","location":"South Padre Is.--jetty"},"type":"Feature","geometry":{"type":"Point","coordinates":[-97.146306,26.0677701]}},{"properties":{"latitude":26.21506,"date":{"end_time":"2004/10/19 00:00:00 -0400","original":"10/18/2004","granularity":"day","time":"2004/10/18 00:00:00 -0400"},"total":1,"longitude":-97.448553,"id":"advy9tnlig1z","location":"Cameron Co.- CR106 /General Brant Rd. (W. of Laguna Atascosa)"},"type":"Feature","geometry":{"type":"Point","coordinates":[-97.448553,26.21506]}},{"properties":{"latitude":25.9379103,"date":{"end_time":"2004/10/20 00:00:00 -0400","original":"10/19/2004","granularity":"day","time":"2004/10/19 00:00:00 -0400"},"total":1,"longitude":-97.3982196,"id":"advy9tsoexd9","location":"Brownsville Landfill (LTC 041)"},"type":"Feature","geometry":{"type":"Point","coordinates":[-97.3982196,25.9379103]}},{"properties":{"latitude":25.8519631,"date":{"end_time":"2004/10/20 00:00:00 -0400","original":"10/19/2004","granularity":"day","time":"2004/10/19 00:00:00 -0400"},"total":1,"longitude":-97.4211788,"id":"advy9trwakvc","location":"Sabal Palm Sanctuary (LTC 042)"},"type":"Feature","geometry":{"type":"Point","coordinates":[-97.4211788,25.8519631]}},{"properties":{"latitude":26.0838442,"date":{"end_time":"2004/10/20 00:00:00 -0400","original":"10/19/2004","granularity":"day","time":"2004/10/19 00:00:00 -0400"},"total":1,"longitude":-97.1693945,"id":"advy9tun2zzf","location":"South Padre Is.--Queen Isabella causeway area"},"type":"Feature","geometry":{"type":"Point","coordinates":[-97.1693945,26.0838442]}},{"properties":{"latitude":25.911388,"date":{"end_time":"2004/10/20 00:00:00 -0400","original":"10/19/2004","granularity":"day","time":"2004/10/19 00:00:00 -0400"},"total":1,"longitude":-97.4904876,"id":"advy9ti4bnyh","location":"Brownsville"},"type":"Feature","geometry":{"type":"Point","coordinates":[-97.4904876,25.911388]}},{"properties":{"latitude":26.0057269,"date":{"end_time":"2004/10/20 00:00:00 -0400","original":"10/19/2004","granularity":"day","time":"2004/10/19 00:00:00 -0400"},"total":1,"longitude":-97.4183462,"id":"advy9tqx8hhj","location":"Cameron Co.- Old Port Isabel Rd"},"type":"Feature","geometry":{"type":"Point","coordinates":[-97.4183462,26.0057269]}},{"properties":{"latitude":26.2908369,"date":{"end_time":"2004/10/21 00:00:00 -0400","original":"10/20/2004","granularity":"day","time":"2004/10/20 00:00:00 -0400"},"total":1,"longitude":-98.1361764,"id":"advy9txsmhow","location":"Edinburg Scenic Wetlands WBC (LTC 061)"},"type":"Feature","geometry":{"type":"Point","coordinates":[-98.1361764,26.2908369]}},{"properties":{"latitude":26.0615634,"date":{"end_time":"2004/10/21 00:00:00 -0400","original":"10/20/2004","granularity":"day","time":"2004/10/20 00:00:00 -0400"},"total":1,"longitude":-98.1492805,"id":"advy9txb049w","location":"Santa Ana NWR (LTC 059)"},"type":"Feature","geometry":{"type":"Point","coordinates":[-98.1492805,26.0615634]}},{"properties":{"latitude":26.1384105,"date":{"end_time":"2004/10/21 00:00:00 -0400","original":"10/20/2004","granularity":"day","time":"2004/10/20 00:00:00 -0400"},"total":1,"longitude":-98.3327866,"id":"advy9to64k06","location":"Anzalduas County Pk (LTC 068)"},"type":"Feature","geometry":{"type":"Point","coordinates":[-98.3327866,26.1384105]}},{"properties":{"latitude":26.1630001,"date":{"end_time":"2004/10/21 00:00:00 -0400","original":"10/20/2004","granularity":"day","time":"2004/10/20 00:00:00 -0400"},"total":1,"longitude":-98.2714005,"id":"advy9tm1xgls","location":"McAllen Sewage Ponds (LTC 066)"},"type":"Feature","geometry":{"type":"Point","coordinates":[-98.2714005,26.1630001]}},{"properties":{"latitude":26.1896055,"date":{"end_time":"2004/10/21 00:00:00 -0400","original":"10/20/2004","granularity":"day","time":"2004/10/20 00:00:00 -0400"},"total":1,"longitude":-98.1958706,"id":"advy9tt434yy","location":"Allen Williams' Backyard"},"type":"Feature","geometry":{"type":"Point","coordinates":[-98.1958706,26.1896055]}},{"properties":{"latitude":26.5326942,"date":{"end_time":"2004/10/22 00:00:00 -0400","original":"10/21/2004","granularity":"day","time":"2004/10/21 00:00:00 -0400"},"total":1,"longitude":-99.1487913,"id":"advy9tjld6yi","location":"El Rio RV Park"},"type":"Feature","geometry":{"type":"Point","coordinates":[-99.1487913,26.5326942]}},{"properties":{"latitude":27.0434503,"date":{"end_time":"2004/10/22 00:00:00 -0400","original":"10/21/2004","granularity":"day","time":"2004/10/21 00:00:00 -0400"},"total":1,"longitude":-99.4527054,"id":"advy9tv63br7","location":"across Rio Grande from US side - San Ignacio"},"type":"Feature","geometry":{"type":"Point","coordinates":[-99.4527054,27.0434503]}},{"properties":{"latitude":26.1927972,"date":{"end_time":"2004/10/22 00:00:00 -0400","original":"10/21/2004","granularity":"day","time":"2004/10/21 00:00:00 -0400"},"total":1,"longitude":-98.2351971,"id":"advy9to1txk0","location":"McAllen- Roselawn Cemetery"},"type":"Feature","geometry":{"type":"Point","coordinates":[-98.2351971,26.1927972]}},{"properties":{"latitude":27.5291993,"date":{"end_time":"2004/10/22 00:00:00 -0400","original":"10/21/2004","granularity":"day","time":"2004/10/21 00:00:00 -0400"},"total":1,"longitude":-99.4781113,"id":"advy9txdg4ar","location":"Laredo"},"type":"Feature","geometry":{"type":"Point","coordinates":[-99.4781113,27.5291993]}},{"properties":{"latitude":26.1867127,"date":{"end_time":"2004/10/22 00:00:00 -0400","original":"10/21/2004","granularity":"day","time":"2004/10/21 00:00:00 -0400"},"total":1,"longitude":-98.3765602,"id":"advy9ttyntke","location":"Bentsen Palm Village RV Resort"},"type":"Feature","geometry":{"type":"Point","coordinates":[-98.3765602,26.1867127]}},{"properties":{"latitude":26.1787023,"date":{"end_time":"2004/10/22 00:00:00 -0400","original":"10/21/2004","granularity":"day","time":"2004/10/21 00:00:00 -0400"},"total":1,"longitude":-98.3860016,"id":"advy9tok7fed","location":"Bentsen-Rio Grande Val. SP WBC (Mission) (LTC 069)"},"type":"Feature","geometry":{"type":"Point","coordinates":[-98.3860016,26.1787023]}},{"properties":{"latitude":27.0443993,"date":{"end_time":"2004/10/22 00:00:00 -0400","original":"10/21/2004","granularity":"day","time":"2004/10/21 00:00:00 -0400"},"total":1,"longitude":-99.4403,"id":"advy9tlonqe1","location":"San Ygnacio (LTC 087)"},"type":"Feature","geometry":{"type":"Point","coordinates":[-99.4403,27.0443993]}},{"properties":{"latitude":26.1479755,"date":{"end_time":"2004/10/22 00:00:00 -0400","original":"10/21/2004","granularity":"day","time":"2004/10/21 00:00:00 -0400"},"total":1,"longitude":-97.9897937,"id":"advy9tpw83uu","location":"Frontera Audubon Center (LTC 058)"},"type":"Feature","geometry":{"type":"Point","coordinates":[-97.9897937,26.1479755]}},{"properties":{"latitude":29.9320076,"date":{"end_time":"2004/10/23 00:00:00 -0400","original":"10/22/2004","granularity":"day","time":"2004/10/22 00:00:00 -0400"},"total":1,"longitude":-103.2481384,"id":"advy9tky974y","location":"Highway 385 south of Marathon"},"type":"Feature","geometry":{"type":"Point","coordinates":[-103.2481384,29.9320076]}},{"properties":{"latitude":30.2076721,"date":{"end_time":"2004/10/23 00:00:00 -0400","original":"10/22/2004","granularity":"day","time":"2004/10/22 00:00:00 -0400"},"total":1,"longitude":-103.2299423,"id":"advy9tno5sar","location":"Marathon"},"type":"Feature","geometry":{"type":"Point","coordinates":[-103.2299423,30.2076721]}},{"properties":{"latitude":30.8299452,"date":{"end_time":"2004/10/23 00:00:00 -0400","original":"10/22/2004","granularity":"day","time":"2004/10/22 00:00:00 -0400"},"total":1,"longitude":-104.7632217,"id":"advy9ts2xlkq","location":"along highway 90"},"type":"Feature","geometry":{"type":"Point","coordinates":[-104.7632217,30.8299452]}},{"properties":{"latitude":29.2712002,"date":{"end_time":"2004/10/23 00:00:00 -0400","original":"10/22/2004","granularity":"day","time":"2004/10/22 00:00:00 -0400"},"total":1,"longitude":-103.1352997,"id":"advy9tp6akxe","location":"Big Bend NP--Dugout Wells"},"type":"Feature","geometry":{"type":"Point","coordinates":[-103.1352997,29.2712002]}},{"properties":{"latitude":29.2742996,"date":{"end_time":"2004/10/24 00:00:00 -0400","original":"10/23/2004","granularity":"day","time":"2004/10/23 00:00:00 -0400"},"total":1,"longitude":-103.3035965,"id":"advy9tx3lfdy","location":"Big Bend NP--Chisos Basin (FWTX 42)"},"type":"Feature","geometry":{"type":"Point","coordinates":[-103.3035965,29.2742996]}},{"properties":{"latitude":29.2413998,"date":{"end_time":"2004/10/24 00:00:00 -0400","original":"10/23/2004","granularity":"day","time":"2004/10/23 00:00:00 -0400"},"total":1,"longitude":-103.2970963,"id":"advy9tm05zrw","location":"Big Bend NP--Boot Spring"},"type":"Feature","geometry":{"type":"Point","coordinates":[-103.2970963,29.2413998]}},{"properties":{"latitude":31.22,"date":{"end_time":"2004/10/25 00:00:00 -0400","original":"10/24/2004","granularity":"day","time":"2004/10/24 00:00:00 -0400"},"total":1,"longitude":-105.785,"id":"advy9twugi3j","location":"McNary Reservoir"},"type":"Feature","geometry":{"type":"Point","coordinates":[-105.785,31.22]}},{"properties":{"latitude":30.4968264,"date":{"end_time":"2004/10/25 00:00:00 -0400","original":"10/24/2004","granularity":"day","time":"2004/10/24 00:00:00 -0400"},"total":1,"longitude":-103.749733,"id":"advy9tmeybjq","location":"Highway 118 north of Alpine"},"type":"Feature","geometry":{"type":"Point","coordinates":[-103.749733,30.4968264]}},{"properties":{"latitude":30.6918758,"date":{"end_time":"2004/10/25 00:00:00 -0400","original":"10/24/2004","granularity":"day","time":"2004/10/24 00:00:00 -0400"},"total":1,"longitude":-104.0470505,"id":"advy9tsvlau4","location":"Highway 118 north of Ft. Davis"},"type":"Feature","geometry":{"type":"Point","coordinates":[-104.0470505,30.6918758]}},{"properties":{"latitude":30.671729,"date":{"end_time":"2004/10/25 00:00:00 -0400","original":"10/24/2004","granularity":"day","time":"2004/10/24 00:00:00 -0400"},"total":1,"longitude":-104.0226746,"id":"advy9tvnftqi","location":"Davis Mtns - McDonald Observ. /Mt. Locke area (FWTX 24)"},"type":"Feature","geometry":{"type":"Point","coordinates":[-104.0226746,30.671729]}},{"properties":{"latitude":32.50026,"date":{"end_time":"2004/10/31 00:00:00 -0400","original":"10/30/2004","granularity":"day","time":"2004/10/30 00:00:00 -0400"},"total":1,"longitude":-106.8731976,"id":"advy9tv2ka6p","location":"Dona Ana - Pictograph arroyo near Radium Springs"},"type":"Feature","geometry":{"type":"Point","coordinates":[-106.8731976,32.50026]}},{"properties":{"latitude":33.4287862,"date":{"end_time":"2004/11/02 00:00:00 -0500","original":"11/1/2004","granularity":"day","time":"2004/11/01 00:00:00 -0500"},"total":1,"longitude":-112.0080185,"id":"advy9totw1lg","location":"Phoenix"},"type":"Feature","geometry":{"type":"Point","coordinates":[-112.0080185,33.4287862]}},{"properties":{"latitude":47.6109621,"date":{"end_time":"2004/11/27 00:00:00 -0500","original":"11/26/2004","granularity":"day","time":"2004/11/26 00:00:00 -0500"},"total":1,"longitude":-122.3406601,"id":"advy9tp1xalk","location":"Seattle"},"type":"Feature","geometry":{"type":"Point","coordinates":[-122.3406601,47.6109621]}},{"properties":{"latitude":58.3354839,"date":{"end_time":"2004/12/11 00:00:00 -0500","original":"12/10/2004","granularity":"day","time":"2004/12/10 00:00:00 -0500"},"total":1,"longitude":-134.5915318,"id":"advy9tjpythn","location":"Juneau - Steve Zimmerman's nieghborhood"},"type":"Feature","geometry":{"type":"Point","coordinates":[-134.5915318,58.3354839]}},{"properties":{"latitude":41.5442871,"date":{"end_time":"2004/12/22 00:00:00 -0500","original":"12/21/2004","granularity":"day","time":"2004/12/21 00:00:00 -0500"},"total":1,"longitude":-90.6028748,"id":"advy9tldc07a","location":"Davenport"},"type":"Feature","geometry":{"type":"Point","coordinates":[-90.6028748,41.5442871]}},{"properties":{"latitude":58.2983519,"date":{"end_time":"2005/01/28 00:00:00 -0500","original":"1/27/2005","granularity":"day","time":"2005/01/27 00:00:00 -0500"},"total":1,"longitude":-134.4208145,"id":"advy9ths003c","location":"Juneau--Gold Creek Delta"},"type":"Feature","geometry":{"type":"Point","coordinates":[-134.4208145,58.2983519]}},{"properties":{"latitude":58.2967719,"date":{"end_time":"2005/02/28 00:00:00 -0500","original":"2/27/2005","granularity":"day","time":"2005/02/27 00:00:00 -0500"},"total":1,"longitude":-134.3866096,"id":"advy9txxxkr3","location":"Juneau--Mt. Roberts Trail"},"type":"Feature","geometry":{"type":"Point","coordinates":[-134.3866096,58.2967719]}},{"properties":{"latitude":19.6771833,"date":{"end_time":"2005/03/19 00:00:00 -0500","original":"3/18/2005","granularity":"day","time":"2005/03/18 00:00:00 -0500"},"total":1,"longitude":-156.0259759,"id":"advy9tp9xo7v","location":"Kaloko-Honokohau NHP -- Aimakapa Pond"},"type":"Feature","geometry":{"type":"Point","coordinates":[-156.0259759,19.6771833]}},{"properties":{"latitude":19.4894409,"date":{"end_time":"2005/03/19 00:00:00 -0500","original":"3/18/2005","granularity":"day","time":"2005/03/18 00:00:00 -0500"},"total":1,"longitude":-155.9107161,"id":"advy9ti203in","location":"Manago Hotel, HI"},"type":"Feature","geometry":{"type":"Point","coordinates":[-155.9107161,19.4894409]}},{"properties":{"latitude":20.114734,"date":{"end_time":"2005/03/20 00:00:00 -0500","original":"3/19/2005","granularity":"day","time":"2005/03/19 00:00:00 -0500"},"total":1,"longitude":-155.5998802,"id":"advy9thnu0tr","location":"Waipio Valley"},"type":"Feature","geometry":{"type":"Point","coordinates":[-155.5998802,20.114734]}},{"properties":{"latitude":19.4156613,"date":{"end_time":"2005/03/22 00:00:00 -0500","original":"3/21/2005","granularity":"day","time":"2005/03/21 00:00:00 -0500"},"total":1,"longitude":-155.1395702,"id":"advy9tj319s5","location":"Pu'u O'o Trail (new) - to vent"},"type":"Feature","geometry":{"type":"Point","coordinates":[-155.1395702,19.4156613]}},{"properties":{"latitude":19.4837473,"date":{"end_time":"2005/03/22 00:00:00 -0500","original":"3/21/2005","granularity":"day","time":"2005/03/21 00:00:00 -0500"},"total":1,"longitude":-154.8989868,"id":"advy9twdfgfr","location":"Lava Tree State Park"},"type":"Feature","geometry":{"type":"Point","coordinates":[-154.8989868,19.4837473]}},{"properties":{"latitude":19.6482527,"date":{"end_time":"2005/03/23 00:00:00 -0500","original":"3/22/2005","granularity":"day","time":"2005/03/22 00:00:00 -0500"},"total":1,"longitude":-155.3710127,"id":"advy9tjrf09d","location":"Powerline Road and further Pu'u O'o Trail"},"type":"Feature","geometry":{"type":"Point","coordinates":[-155.3710127,19.6482527]}},{"properties":{"latitude":19.4136642,"date":{"end_time":"2005/03/24 00:00:00 -0500","original":"3/23/2005","granularity":"day","time":"2005/03/23 00:00:00 -0500"},"total":1,"longitude":-155.2386349,"id":"advy9txqaf1h","location":"Hawai'i Volcanoes NP -- Kilauea Iki and Thurston Lava Tube"},"type":"Feature","geometry":{"type":"Point","coordinates":[-155.2386349,19.4136642]}},{"properties":{"latitude":19.2827903,"date":{"end_time":"2005/03/24 00:00:00 -0500","original":"3/23/2005","granularity":"day","time":"2005/03/23 00:00:00 -0500"},"total":1,"longitude":-155.1177049,"id":"advy9tuir6a9","location":"Hawai'i Volcanoes NP -- Coastal Chain of Craters Rd"},"type":"Feature","geometry":{"type":"Point","coordinates":[-155.1177049,19.2827903]}},{"properties":{"latitude":19.4592684,"date":{"end_time":"2005/03/25 00:00:00 -0500","original":"3/24/2005","granularity":"day","time":"2005/03/24 00:00:00 -0500"},"total":1,"longitude":-155.3426456,"id":"advy9tkoss26","location":"Hawai'i Volcanoes NP -- middle of Strip Road (powerline x-ing)"},"type":"Feature","geometry":{"type":"Point","coordinates":[-155.3426456,19.4592684]}},{"properties":{"latitude":19.4435086,"date":{"end_time":"2005/03/25 00:00:00 -0500","original":"3/24/2005","granularity":"day","time":"2005/03/24 00:00:00 -0500"},"total":1,"longitude":-155.3193855,"id":"advy9to8krrb","location":"Hawai'i Volcanoes NP -- Kipuka Ki (only!)"},"type":"Feature","geometry":{"type":"Point","coordinates":[-155.3193855,19.4435086]}},{"properties":{"latitude":19.4929006,"date":{"end_time":"2005/03/25 00:00:00 -0500","original":"3/24/2005","granularity":"day","time":"2005/03/24 00:00:00 -0500"},"total":1,"longitude":-155.385561,"id":"advy9to7vugy","location":"Mauna Loa Trail, Top of Strip Road"},"type":"Feature","geometry":{"type":"Point","coordinates":[-155.385561,19.4929006]}},{"properties":{"latitude":19.3799545,"date":{"end_time":"2005/03/26 00:00:00 -0500","original":"3/25/2005","granularity":"day","time":"2005/03/25 00:00:00 -0500"},"total":1,"longitude":-155.8976054,"id":"advy9tt9569v","location":"Ho'Okena Beach Park"},"type":"Feature","geometry":{"type":"Point","coordinates":[-155.8976054,19.3799545]}},{"properties":{"latitude":19.0849122,"date":{"end_time":"2005/03/26 00:00:00 -0500","original":"3/25/2005","granularity":"day","time":"2005/03/25 00:00:00 -0500"},"total":1,"longitude":-155.5504203,"id":"advy9tjzsm7y","location":"Whittington Beach Park"},"type":"Feature","geometry":{"type":"Point","coordinates":[-155.5504203,19.0849122]}},{"properties":{"latitude":19.4754532,"date":{"end_time":"2005/03/27 00:00:00 -0500","original":"3/26/2005","granularity":"day","time":"2005/03/26 00:00:00 -0500"},"total":1,"longitude":-155.9195137,"id":"advy9tiw6s17","location":"Kealakekua Bay"},"type":"Feature","geometry":{"type":"Point","coordinates":[-155.9195137,19.4754532]}},{"properties":{"latitude":19.821297,"date":{"end_time":"2005/03/28 00:00:00 -0500","original":"3/27/2005","granularity":"day","time":"2005/03/27 00:00:00 -0500"},"total":1,"longitude":-155.843811,"id":"advy9tiohqw4","location":"Pu'u Anahulu - Big Island Country Club"},"type":"Feature","geometry":{"type":"Point","coordinates":[-155.843811,19.821297]}},{"properties":{"latitude":21.2764006,"date":{"end_time":"2005/03/29 00:00:00 -0500","original":"3/28/2005","granularity":"day","time":"2005/03/28 00:00:00 -0500"},"total":1,"longitude":-157.68557,"id":"advy9tocogve","location":"Lana'i Lookout"},"type":"Feature","geometry":{"type":"Point","coordinates":[-157.68557,21.2764006]}},{"properties":{"latitude":21.2988697,"date":{"end_time":"2005/03/29 00:00:00 -0500","original":"3/28/2005","granularity":"day","time":"2005/03/28 00:00:00 -0500"},"total":1,"longitude":-157.8709545,"id":"advy9tu32qah","location":"Sand Island State Recreation Area"},"type":"Feature","geometry":{"type":"Point","coordinates":[-157.8709545,21.2988697]}},{"properties":{"latitude":21.3291958,"date":{"end_time":"2005/03/29 00:00:00 -0500","original":"3/28/2005","granularity":"day","time":"2005/03/28 00:00:00 -0500"},"total":1,"longitude":-157.6572418,"id":"advy9tiqd983","location":"Manana Island"},"type":"Feature","geometry":{"type":"Point","coordinates":[-157.6572418,21.3291958]}},{"properties":{"latitude":21.3912752,"date":{"end_time":"2005/03/29 00:00:00 -0500","original":"3/28/2005","granularity":"day","time":"2005/03/28 00:00:00 -0500"},"total":1,"longitude":-157.74333,"id":"advy9twy3bsd","location":"Hamakua Marsh"},"type":"Feature","geometry":{"type":"Point","coordinates":[-157.74333,21.3912752]}},{"properties":{"latitude":21.6912773,"date":{"end_time":"2005/03/30 00:00:00 -0500","original":"3/29/2005","granularity":"day","time":"2005/03/29 00:00:00 -0500"},"total":1,"longitude":-157.9578581,"id":"advy9tugrn7g","location":"James Campbell NWR"},"type":"Feature","geometry":{"type":"Point","coordinates":[-157.9578581,21.6912773]}},{"properties":{"latitude":21.663839,"date":{"end_time":"2005/03/30 00:00:00 -0500","original":"3/29/2005","granularity":"day","time":"2005/03/29 00:00:00 -0500"},"total":1,"longitude":-157.9439592,"id":"advy9txd6sr2","location":"Kulima Sewage Treatment Plant"},"type":"Feature","geometry":{"type":"Point","coordinates":[-157.9439592,21.663839]}},{"properties":{"latitude":21.5141322,"date":{"end_time":"2005/03/30 00:00:00 -0500","original":"3/29/2005","granularity":"day","time":"2005/03/29 00:00:00 -0500"},"total":1,"longitude":-157.8372717,"id":"advy9tir4r4y","location":"Kualoa Regional Park"},"type":"Feature","geometry":{"type":"Point","coordinates":[-157.8372717,21.5141322]}},{"properties":{"latitude":21.3988172,"date":{"end_time":"2005/03/30 00:00:00 -0500","original":"3/29/2005","granularity":"day","time":"2005/03/29 00:00:00 -0500"},"total":1,"longitude":-157.9000568,"id":"advy9tikf84i","location":"Lower 'Aiea Loop Trail and Keaiwa Heiau SP"},"type":"Feature","geometry":{"type":"Point","coordinates":[-157.9000568,21.3988172]}},{"properties":{"latitude":21.4103031,"date":{"end_time":"2005/03/30 00:00:00 -0500","original":"3/29/2005","granularity":"day","time":"2005/03/29 00:00:00 -0500"},"total":1,"longitude":-157.7979183,"id":"advy9ttqkzjx","location":"Kaneohe"},"type":"Feature","geometry":{"type":"Point","coordinates":[-157.7979183,21.4103031]}},{"properties":{"latitude":21.5742024,"date":{"end_time":"2005/03/31 00:00:00 -0500","original":"3/30/2005","granularity":"day","time":"2005/03/30 00:00:00 -0500"},"total":1,"longitude":-158.2777119,"id":"advy9to1tnlz","location":"Ka'ena Point NAR"},"type":"Feature","geometry":{"type":"Point","coordinates":[-158.2777119,21.5742024]}},{"properties":{"latitude":21.6624032,"date":{"end_time":"2005/03/31 00:00:00 -0500","original":"3/30/2005","granularity":"day","time":"2005/03/30 00:00:00 -0500"},"total":1,"longitude":-157.9241323,"id":"advy9tmzxqyn","location":"Moko-Auia Island"},"type":"Feature","geometry":{"type":"Point","coordinates":[-157.9241323,21.6624032]}},{"properties":{"latitude":21.3243732,"date":{"end_time":"2005/03/31 00:00:00 -0500","original":"3/30/2005","granularity":"day","time":"2005/03/30 00:00:00 -0500"},"total":1,"longitude":-157.8502536,"id":"advy9tv8j35t","location":"Oahu Cemetery"},"type":"Feature","geometry":{"type":"Point","coordinates":[-157.8502536,21.3243732]}},{"properties":{"latitude":21.4303848,"date":{"end_time":"2005/03/31 00:00:00 -0500","original":"3/30/2005","granularity":"day","time":"2005/03/30 00:00:00 -0500"},"total":1,"longitude":-157.9359126,"id":"advy9tueyrbx","location":"Manana Trail"},"type":"Feature","geometry":{"type":"Point","coordinates":[-157.9359126,21.4303848]}},{"properties":{"latitude":21.2485396,"date":{"end_time":"2005/04/01 00:00:00 -0500","original":"3/31/2005","granularity":"day","time":"2005/03/31 00:00:00 -0500"},"total":1,"longitude":-157.8812599,"id":"advy9tsqgfkb","location":"Offshore (fishing charter)"},"type":"Feature","geometry":{"type":"Point","coordinates":[-157.8812599,21.2485396]}},{"properties":{"latitude":21.9549272,"date":{"end_time":"2005/04/02 00:00:00 -0500","original":"4/1/2005","granularity":"day","time":"2005/04/01 00:00:00 -0500"},"total":1,"longitude":-159.335736,"id":"advy9ts8lhm9","location":"Nawiliwili Lighthouse"},"type":"Feature","geometry":{"type":"Point","coordinates":[-159.335736,21.9549272]}},{"properties":{"latitude":21.9478494,"date":{"end_time":"2005/04/02 00:00:00 -0500","original":"4/1/2005","granularity":"day","time":"2005/04/01 00:00:00 -0500"},"total":1,"longitude":-159.39026,"id":"advy9txcmi1w","location":"Huleia River Valley (Haiku Rd)"},"type":"Feature","geometry":{"type":"Point","coordinates":[-159.39026,21.9478494]}},{"properties":{"latitude":22.0787999,"date":{"end_time":"2005/04/03 00:00:00 -0500","original":"4/2/2005","granularity":"day","time":"2005/04/02 00:00:00 -0500"},"total":1,"longitude":-159.7635269,"id":"advy9ttwz7sd","location":"Polihale State Park"},"type":"Feature","geometry":{"type":"Point","coordinates":[-159.7635269,22.0787999]}},{"properties":{"latitude":21.8706087,"date":{"end_time":"2005/04/03 00:00:00 -0500","original":"4/2/2005","granularity":"day","time":"2005/04/02 00:00:00 -0500"},"total":1,"longitude":-159.4459963,"id":"advy9twk1sru","location":"Makahuena Point"},"type":"Feature","geometry":{"type":"Point","coordinates":[-159.4459963,21.8706087]}},{"properties":{"latitude":22.2106496,"date":{"end_time":"2005/04/04 00:00:00 -0400","original":"4/3/2005","granularity":"day","time":"2005/04/03 00:00:00 -0500"},"total":1,"longitude":-159.4732361,"id":"advy9twkkip0","location":"Hanalei NWR"},"type":"Feature","geometry":{"type":"Point","coordinates":[-159.4732361,22.2106496]}},{"properties":{"latitude":22.2202244,"date":{"end_time":"2005/04/04 00:00:00 -0400","original":"4/3/2005","granularity":"day","time":"2005/04/03 00:00:00 -0500"},"total":1,"longitude":-159.5803642,"id":"advy9tvbcqs9","location":"Ha'ena State Park"},"type":"Feature","geometry":{"type":"Point","coordinates":[-159.5803642,22.2202244]}},{"properties":{"latitude":22.0340784,"date":{"end_time":"2005/04/04 00:00:00 -0400","original":"4/3/2005","granularity":"day","time":"2005/04/03 00:00:00 -0500"},"total":1,"longitude":-159.379102,"id":"advy9tje9sl9","location":"Wailua Falls, Ma'alo Road"},"type":"Feature","geometry":{"type":"Point","coordinates":[-159.379102,22.0340784]}},{"properties":{"latitude":21.3775786,"date":{"end_time":"2005/04/06 00:00:00 -0400","original":"4/5/2005","granularity":"day","time":"2005/04/05 00:00:00 -0400"},"total":1,"longitude":-158.00495,"id":"advy9tx9amdk","location":"Pouhala Marsh"},"type":"Feature","geometry":{"type":"Point","coordinates":[-158.00495,21.3775786]}},{"properties":{"latitude":58.276829,"date":{"end_time":"2005/04/11 00:00:00 -0400","original":"4/10/2005","granularity":"day","time":"2005/04/10 00:00:00 -0400"},"total":1,"longitude":-134.3950653,"id":"advy9twh1mb9","location":"Juneau - Downtown Douglas"},"type":"Feature","geometry":{"type":"Point","coordinates":[-134.3950653,58.276829]}},{"properties":{"latitude":35.13,"date":{"end_time":"2005/05/09 00:00:00 -0400","original":"5/8/2005","granularity":"day","time":"2005/05/08 00:00:00 -0400"},"total":1,"longitude":-106.683,"id":"advy9tt2xrc6","location":"Rio Grande Nature Center"},"type":"Feature","geometry":{"type":"Point","coordinates":[-106.683,35.13]}},{"properties":{"latitude":39.849403,"date":{"end_time":"2005/05/11 00:00:00 -0400","original":"5/10/2005","granularity":"day","time":"2005/05/10 00:00:00 -0400"},"total":1,"longitude":-104.6700096,"id":"advy9tlwti8m","location":"Denver International Airport"},"type":"Feature","geometry":{"type":"Point","coordinates":[-104.6700096,39.849403]}},{"properties":{"latitude":60.2972222,"date":{"end_time":"2005/05/19 00:00:00 -0400","original":"5/18/2005","granularity":"day","time":"2005/05/18 00:00:00 -0400"},"total":1,"longitude":-133.9859444,"id":"advy9tknu46f","location":"Little Atlin Lake--boat launch"},"type":"Feature","geometry":{"type":"Point","coordinates":[-133.9859444,60.2972222]}},{"properties":{"latitude":58.4730068,"date":{"end_time":"2005/05/28 00:00:00 -0400","original":"5/27/2005","granularity":"day","time":"2005/05/27 00:00:00 -0400"},"total":1,"longitude":-134.7737503,"id":"advy9trjsdc1","location":"Out the Road - logging road MP25"},"type":"Feature","geometry":{"type":"Point","coordinates":[-134.7737503,58.4730068]}},{"properties":{"latitude":56.2442529,"date":{"end_time":"2005/06/02 00:00:00 -0400","original":"6/1/2005","granularity":"day","time":"2005/06/01 00:00:00 -0400"},"total":1,"longitude":-133.3194351,"id":"advy9tm7rjb9","location":"Prince of Wales - Red Bay Lake Cabin"},"type":"Feature","geometry":{"type":"Point","coordinates":[-133.3194351,56.2442529]}},{"properties":{"latitude":56.3468694,"date":{"end_time":"2005/06/02 00:00:00 -0400","original":"6/1/2005","granularity":"day","time":"2005/06/01 00:00:00 -0400"},"total":1,"longitude":-133.5231972,"id":"advy9tlo3eld","location":"Prince of Wales - Memorial Beach Rec Area"},"type":"Feature","geometry":{"type":"Point","coordinates":[-133.5231972,56.3468694]}},{"properties":{"latitude":55.6853269,"date":{"end_time":"2005/06/07 00:00:00 -0400","original":"6/6/2005","granularity":"day","time":"2005/06/06 00:00:00 -0400"},"total":1,"longitude":-132.5267029,"id":"advy9tkcc1w2","location":"Thorne Bay"},"type":"Feature","geometry":{"type":"Point","coordinates":[-132.5267029,55.6853269]}},{"properties":{"latitude":55.8521916,"date":{"end_time":"2005/06/08 00:00:00 -0400","original":"6/7/2005","granularity":"day","time":"2005/06/07 00:00:00 -0400"},"total":1,"longitude":-133.2339478,"id":"advy9tlczvo7","location":"Tuxekan Island, Prince of Wales"},"type":"Feature","geometry":{"type":"Point","coordinates":[-133.2339478,55.8521916]}},{"properties":{"latitude":55.2211904,"date":{"end_time":"2005/06/12 00:00:00 -0400","original":"6/11/2005","granularity":"day","time":"2005/06/11 00:00:00 -0400"},"total":1,"longitude":-132.8109741,"id":"advy9tmvc2xc","location":"Hydaburg - Prince of Wales"},"type":"Feature","geometry":{"type":"Point","coordinates":[-132.8109741,55.2211904]}},{"properties":{"latitude":56.1046683,"date":{"end_time":"2005/06/13 00:00:00 -0400","original":"6/12/2005","granularity":"day","time":"2005/06/12 00:00:00 -0400"},"total":1,"longitude":-133.1760979,"id":"advy9tkzc1nc","location":"Whale Pass/Neck Lake"},"type":"Feature","geometry":{"type":"Point","coordinates":[-133.1760979,56.1046683]}},{"properties":{"latitude":57.6938735,"date":{"end_time":"2005/06/25 00:00:00 -0400","original":"6/24/2005","granularity":"day","time":"2005/06/24 00:00:00 -0400"},"total":1,"longitude":-133.1851959,"id":"advy9trtuqle","location":"Ford's Terror"},"type":"Feature","geometry":{"type":"Point","coordinates":[-133.1851959,57.6938735]}},{"properties":{"latitude":58.0032713,"date":{"end_time":"2005/07/21 00:00:00 -0400","original":"7/20/2005","granularity":"day","time":"2005/07/20 00:00:00 -0400"},"total":1,"longitude":-135.5197906,"id":"advy9tsvv2vo","location":"Chichagof Island - roads from Hoonah"},"type":"Feature","geometry":{"type":"Point","coordinates":[-135.5197906,58.0032713]}},{"properties":{"latitude":57.632237,"date":{"end_time":"2005/07/24 00:00:00 -0400","original":"7/23/2005","granularity":"day","time":"2005/07/23 00:00:00 -0400"},"total":1,"longitude":-134.3904305,"id":"advy9tla3bos","location":"Distin Lake - Admiralty Island"},"type":"Feature","geometry":{"type":"Point","coordinates":[-134.3904305,57.632237]}},{"properties":{"latitude":58.146202,"date":{"end_time":"2005/08/08 00:00:00 -0400","original":"8/7/2005","granularity":"day","time":"2005/08/07 00:00:00 -0400"},"total":1,"longitude":-134.330864,"id":"advy9tj92114","location":"Green Cove - Admiralty Island"},"type":"Feature","geometry":{"type":"Point","coordinates":[-134.330864,58.146202]}},{"properties":{"latitude":58.3327804,"date":{"end_time":"2005/08/14 00:00:00 -0400","original":"8/13/2005","granularity":"day","time":"2005/08/13 00:00:00 -0400"},"total":1,"longitude":-134.7360706,"id":"advy9tvjl8mi","location":"Juneau - Portland Island"},"type":"Feature","geometry":{"type":"Point","coordinates":[-134.7360706,58.3327804]}},{"properties":{"latitude":60.827299,"date":{"end_time":"2005/09/03 00:00:00 -0400","original":"9/2/2005","granularity":"day","time":"2005/09/02 00:00:00 -0400"},"total":1,"longitude":-149.0319443,"id":"advy9tonu2zh","location":"Ponds at end of Turnagain Arm"},"type":"Feature","geometry":{"type":"Point","coordinates":[-149.0319443,60.827299]}},{"properties":{"latitude":60.062656,"date":{"end_time":"2005/09/03 00:00:00 -0400","original":"9/2/2005","granularity":"day","time":"2005/09/02 00:00:00 -0400"},"total":1,"longitude":-149.4459915,"id":"advy9ty1g0tr","location":"Seward--Tonsina Creek/Caines Head Trail"},"type":"Feature","geometry":{"type":"Point","coordinates":[-149.4459915,60.062656]}},{"properties":{"latitude":58.349866,"date":{"end_time":"2005/09/19 00:00:00 -0400","original":"9/18/2005","granularity":"day","time":"2005/09/18 00:00:00 -0400"},"total":1,"longitude":-136.005249,"id":"advy9tsi8jjz","location":"Icy Strait--mouth of Glacier Bay"},"type":"Feature","geometry":{"type":"Point","coordinates":[-136.005249,58.349866]}},{"properties":{"latitude":60.0500175,"date":{"end_time":"2005/10/04 00:00:00 -0400","original":"10/3/2005","granularity":"day","time":"2005/10/03 00:00:00 -0400"},"total":1,"longitude":-130.9952259,"id":"advy9tqyzibf","location":"Swift River--marshes"},"type":"Feature","geometry":{"type":"Point","coordinates":[-130.9952259,60.0500175]}},{"properties":{"latitude":57.5298336,"date":{"end_time":"2005/10/04 00:00:00 -0400","original":"10/3/2005","granularity":"day","time":"2005/10/03 00:00:00 -0400"},"total":1,"longitude":-130.1921082,"id":"advy9tlwqyph","location":"Kinaskan Lake Provincial Park"},"type":"Feature","geometry":{"type":"Point","coordinates":[-130.1921082,57.5298336]}},{"properties":{"latitude":55.9079761,"date":{"end_time":"2005/10/06 00:00:00 -0400","original":"10/5/2005","granularity":"day","time":"2005/10/05 00:00:00 -0400"},"total":1,"longitude":-130.0195456,"id":"advy9tmtcaky","location":"Hyder--Dock Road"},"type":"Feature","geometry":{"type":"Point","coordinates":[-130.0195456,55.9079761]}},{"properties":{"latitude":55.9609605,"date":{"end_time":"2005/10/06 00:00:00 -0400","original":"10/5/2005","granularity":"day","time":"2005/10/05 00:00:00 -0400"},"total":1,"longitude":-130.0618708,"id":"advy9tqymrp0","location":"Hyder--Fish Creek"},"type":"Feature","geometry":{"type":"Point","coordinates":[-130.0618708,55.9609605]}},{"properties":{"latitude":47.9196209,"date":{"end_time":"2005/10/11 00:00:00 -0400","original":"10/10/2005","granularity":"day","time":"2005/10/10 00:00:00 -0400"},"total":1,"longitude":-124.6385193,"id":"advy9tibs8yk","location":"Olympic NP--Rialto Beach"},"type":"Feature","geometry":{"type":"Point","coordinates":[-124.6385193,47.9196209]}},{"properties":{"latitude":46.2987426,"date":{"end_time":"2005/10/11 00:00:00 -0400","original":"10/10/2005","granularity":"day","time":"2005/10/10 00:00:00 -0400"},"total":1,"longitude":-124.0780449,"id":"advy9tshxm7m","location":"Lewis and Clark NHP--Cape Disappointment"},"type":"Feature","geometry":{"type":"Point","coordinates":[-124.0780449,46.2987426]}},{"properties":{"latitude":46.1008958,"date":{"end_time":"2005/10/12 00:00:00 -0400","original":"10/11/2005","granularity":"day","time":"2005/10/11 00:00:00 -0400"},"total":1,"longitude":-123.9416599,"id":"advy9tsvkech","location":"Sunset Beach State Rec Site"},"type":"Feature","geometry":{"type":"Point","coordinates":[-123.9416599,46.1008958]}},{"properties":{"latitude":44.8288173,"date":{"end_time":"2005/10/12 00:00:00 -0400","original":"10/11/2005","granularity":"day","time":"2005/10/11 00:00:00 -0400"},"total":1,"longitude":-124.0658998,"id":"advy9tjfrs1c","location":"Boiler Bay State Wayside"},"type":"Feature","geometry":{"type":"Point","coordinates":[-124.0658998,44.8288173]}},{"properties":{"latitude":43.1351,"date":{"end_time":"2005/10/13 00:00:00 -0400","original":"10/12/2005","granularity":"day","time":"2005/10/12 00:00:00 -0400"},"total":1,"longitude":-124.4027,"id":"advy9twl1yhk","location":"Bandon Marsh NWR"},"type":"Feature","geometry":{"type":"Point","coordinates":[-124.4027,43.1351]}},{"properties":{"latitude":40.857361,"date":{"end_time":"2005/10/13 00:00:00 -0400","original":"10/12/2005","granularity":"day","time":"2005/10/12 00:00:00 -0400"},"total":1,"longitude":-124.094612,"id":"advy9tplobju","location":"Arcata Marsh and Wildlife Sanctuary"},"type":"Feature","geometry":{"type":"Point","coordinates":[-124.094612,40.857361]}},{"properties":{"latitude":38.3262385,"date":{"end_time":"2005/10/14 00:00:00 -0400","original":"10/13/2005","granularity":"day","time":"2005/10/13 00:00:00 -0400"},"total":1,"longitude":-123.040266,"id":"advy9tqhgbbo","location":"Bodega Bay--general area"},"type":"Feature","geometry":{"type":"Point","coordinates":[-123.040266,38.3262385]}},{"properties":{"latitude":39.3084682,"date":{"end_time":"2005/10/14 00:00:00 -0400","original":"10/13/2005","granularity":"day","time":"2005/10/13 00:00:00 -0400"},"total":1,"longitude":-123.8069057,"id":"advy9tnkzoa7","location":"Mendocino Headlands SP"},"type":"Feature","geometry":{"type":"Point","coordinates":[-123.8069057,39.3084682]}},{"properties":{"latitude":40.3161846,"date":{"end_time":"2005/10/14 00:00:00 -0400","original":"10/13/2005","granularity":"day","time":"2005/10/13 00:00:00 -0400"},"total":1,"longitude":-123.9772797,"id":"advy9twxb0rj","location":"Humboldt Redwoods SP"},"type":"Feature","geometry":{"type":"Point","coordinates":[-123.9772797,40.3161846]}},{"properties":{"latitude":38.046914,"date":{"end_time":"2005/10/15 00:00:00 -0400","original":"10/14/2005","granularity":"day","time":"2005/10/14 00:00:00 -0400"},"total":1,"longitude":-123.463217,"id":"advy9tqmtthg","location":"Cordell Bank (MRN Co.)"},"type":"Feature","geometry":{"type":"Point","coordinates":[-123.463217,38.046914]}},{"properties":{"latitude":38.0841398,"date":{"end_time":"2005/10/16 00:00:00 -0400","original":"10/15/2005","granularity":"day","time":"2005/10/15 00:00:00 -0400"},"total":1,"longitude":-122.8211403,"id":"advy9tm3p176","location":"Fairfield Estuary"},"type":"Feature","geometry":{"type":"Point","coordinates":[-122.8211403,38.0841398]}},{"properties":{"latitude":38.4375015,"date":{"end_time":"2005/10/16 00:00:00 -0400","original":"10/15/2005","granularity":"day","time":"2005/10/15 00:00:00 -0400"},"total":1,"longitude":-122.5144511,"id":"advy9tmwsx1h","location":"Sugar Loaf Ridge SP"},"type":"Feature","geometry":{"type":"Point","coordinates":[-122.5144511,38.4375015]}},{"properties":{"latitude":39.0329944,"date":{"end_time":"2005/10/16 00:00:00 -0400","original":"10/15/2005","granularity":"day","time":"2005/10/15 00:00:00 -0400"},"total":1,"longitude":-120.1351869,"id":"advy9txl5cy7","location":"Meeks Creek Meadow"},"type":"Feature","geometry":{"type":"Point","coordinates":[-120.1351869,39.0329944]}},{"properties":{"latitude":38.6853758,"date":{"end_time":"2005/10/16 00:00:00 -0400","original":"10/15/2005","granularity":"day","time":"2005/10/15 00:00:00 -0400"},"total":1,"longitude":-120.9956932,"id":"advy9togvl72","location":"Cameron Park Lake"},"type":"Feature","geometry":{"type":"Point","coordinates":[-120.9956932,38.6853758]}},{"properties":{"latitude":39.523111,"date":{"end_time":"2005/10/17 00:00:00 -0400","original":"10/16/2005","granularity":"day","time":"2005/10/16 00:00:00 -0400"},"total":1,"longitude":-118.578186,"id":"advy9tv8x85f","location":"Stillwater NWR"},"type":"Feature","geometry":{"type":"Point","coordinates":[-118.578186,39.523111]}},{"properties":{"latitude":39.5208387,"date":{"end_time":"2005/10/17 00:00:00 -0400","original":"10/16/2005","granularity":"day","time":"2005/10/16 00:00:00 -0400"},"total":1,"longitude":-119.831905,"id":"advy9tmgyvdu","location":"Idlewild Park"},"type":"Feature","geometry":{"type":"Point","coordinates":[-119.831905,39.5208387]}},{"properties":{"latitude":39.2733899,"date":{"end_time":"2005/10/17 00:00:00 -0400","original":"10/16/2005","granularity":"day","time":"2005/10/16 00:00:00 -0400"},"total":1,"longitude":-119.9367142,"id":"advy9toyfx3v","location":"Lake Tahoe area, NV"},"type":"Feature","geometry":{"type":"Point","coordinates":[-119.9367142,39.2733899]}},{"properties":{"latitude":39.165,"date":{"end_time":"2005/10/18 00:00:00 -0400","original":"10/17/2005","granularity":"day","time":"2005/10/17 00:00:00 -0400"},"total":1,"longitude":-114.812,"id":"advy9tletzd1","location":"Comins Lake"},"type":"Feature","geometry":{"type":"Point","coordinates":[-114.812,39.165]}},{"properties":{"latitude":38.883297,"date":{"end_time":"2005/10/18 00:00:00 -0400","original":"10/17/2005","granularity":"day","time":"2005/10/17 00:00:00 -0400"},"total":1,"longitude":-114.0118942,"id":"advy9tu165ko","location":"Pruess Reservoir"},"type":"Feature","geometry":{"type":"Point","coordinates":[-114.0118942,38.883297]}},{"properties":{"latitude":39.0057537,"date":{"end_time":"2005/10/18 00:00:00 -0400","original":"10/17/2005","granularity":"day","time":"2005/10/17 00:00:00 -0400"},"total":1,"longitude":-114.2191243,"id":"advy9tlhttcx","location":"Great Basin NP"},"type":"Feature","geometry":{"type":"Point","coordinates":[-114.2191243,39.0057537]}},{"properties":{"latitude":37.6461898,"date":{"end_time":"2005/10/18 00:00:00 -0400","original":"10/17/2005","granularity":"day","time":"2005/10/17 00:00:00 -0400"},"total":1,"longitude":-112.1660052,"id":"advy9tqqmhdy","location":"Bryce Canyon NP"},"type":"Feature","geometry":{"type":"Point","coordinates":[-112.1660052,37.6461898]}},{"properties":{"latitude":36.8088724,"date":{"end_time":"2005/10/20 00:00:00 -0400","original":"10/19/2005","granularity":"day","time":"2005/10/19 00:00:00 -0400"},"total":1,"longitude":-107.6022434,"id":"advy9tioec5q","location":"Navajo Lake SP"},"type":"Feature","geometry":{"type":"Point","coordinates":[-107.6022434,36.8088724]}},{"properties":{"latitude":37.0050873,"date":{"end_time":"2005/10/20 00:00:00 -0400","original":"10/19/2005","granularity":"day","time":"2005/10/19 00:00:00 -0400"},"total":1,"longitude":-111.5038076,"id":"advy9tnuvnk0","location":"Lake Powell -- Wahweap Bay (Utah side)"},"type":"Feature","geometry":{"type":"Point","coordinates":[-111.5038076,37.0050873]}},{"properties":{"latitude":36.0446575,"date":{"end_time":"2005/10/20 00:00:00 -0400","original":"10/19/2005","granularity":"day","time":"2005/10/19 00:00:00 -0400"},"total":1,"longitude":-107.9324341,"id":"advy9ttru5zo","location":"Chaco Culture NHP"},"type":"Feature","geometry":{"type":"Point","coordinates":[-107.9324341,36.0446575]}},{"properties":{"latitude":37.5921269,"date":{"end_time":"2005/10/20 00:00:00 -0400","original":"10/19/2005","granularity":"day","time":"2005/10/19 00:00:00 -0400"},"total":1,"longitude":-110.0181198,"id":"advy9ttvunac","location":"Natural Bridges NM"},"type":"Feature","geometry":{"type":"Point","coordinates":[-110.0181198,37.5921269]}},{"properties":{"latitude":32.1163919,"date":{"end_time":"2005/10/27 00:00:00 -0400","original":"10/26/2005","granularity":"day","time":"2005/10/26 00:00:00 -0400"},"total":1,"longitude":-104.4559488,"id":"advy9tuenzms","location":"Washington Ranch"},"type":"Feature","geometry":{"type":"Point","coordinates":[-104.4559488,32.1163919]}},{"properties":{"latitude":32.1091003,"date":{"end_time":"2005/10/27 00:00:00 -0400","original":"10/26/2005","granularity":"day","time":"2005/10/26 00:00:00 -0400"},"total":1,"longitude":-104.4710999,"id":"advy9tji0kse","location":"Carlsbad Caverns NP -- Rattlesnake Springs"},"type":"Feature","geometry":{"type":"Point","coordinates":[-104.4710999,32.1091003]}},{"properties":{"latitude":35.5986242,"date":{"end_time":"2005/10/27 00:00:00 -0400","original":"10/26/2005","granularity":"day","time":"2005/10/26 00:00:00 -0400"},"total":1,"longitude":-105.6818676,"id":"advy9tpb9c8j","location":"Santa Fe NF -- Monastery Lake"},"type":"Feature","geometry":{"type":"Point","coordinates":[-105.6818676,35.5986242]}},{"properties":{"latitude":32.0836669,"date":{"end_time":"2005/10/27 00:00:00 -0400","original":"10/26/2005","granularity":"day","time":"2005/10/26 00:00:00 -0400"},"total":1,"longitude":-104.5546854,"id":"advy9tntdl2o","location":"Black River Recreation Area - Campground"},"type":"Feature","geometry":{"type":"Point","coordinates":[-104.5546854,32.0836669]}},{"properties":{"latitude":31.518628,"date":{"end_time":"2005/11/09 00:00:00 -0500","original":"11/8/2005","granularity":"day","time":"2005/11/08 00:00:00 -0500"},"total":1,"longitude":-109.0053371,"id":"advy9tx8koug","location":"Clanton Canyon"},"type":"Feature","geometry":{"type":"Point","coordinates":[-109.0053371,31.518628]}},{"properties":{"latitude":35.2103004,"date":{"end_time":"2005/11/28 00:00:00 -0500","original":"11/27/2005","granularity":"day","time":"2005/11/27 00:00:00 -0500"},"total":1,"longitude":-106.4487,"id":"advy9ts349cd","location":"Cibola NF -- Sandia Crest"},"type":"Feature","geometry":{"type":"Point","coordinates":[-106.4487,35.2103004]}},{"properties":{"latitude":35.1297718,"date":{"end_time":"2005/11/29 00:00:00 -0500","original":"11/28/2005","granularity":"day","time":"2005/11/28 00:00:00 -0500"},"total":1,"longitude":-106.6816235,"id":"advy9tpd0vym","location":"Rio Grande Nature Center -- Candelaria Wetlands"},"type":"Feature","geometry":{"type":"Point","coordinates":[-106.6816235,35.1297718]}},{"properties":{"latitude":31.5478992,"date":{"end_time":"2005/12/06 00:00:00 -0500","original":"12/5/2005","granularity":"day","time":"2005/12/05 00:00:00 -0500"},"total":1,"longitude":-110.1408997,"id":"advy9tukzq4n","location":"San Pedro RNCA--San Pedro House"},"type":"Feature","geometry":{"type":"Point","coordinates":[-110.1408997,31.5478992]}},{"properties":{"latitude":33.5110032,"date":{"end_time":"2005/12/09 00:00:00 -0500","original":"12/8/2005","granularity":"day","time":"2005/12/08 00:00:00 -0500"},"total":1,"longitude":-111.906631,"id":"advy9ts5tpnx","location":"Scottsdale--Chaparral Park"},"type":"Feature","geometry":{"type":"Point","coordinates":[-111.906631,33.5110032]}},{"properties":{"latitude":33.5841106,"date":{"end_time":"2005/12/09 00:00:00 -0500","original":"12/8/2005","granularity":"day","time":"2005/12/08 00:00:00 -0500"},"total":1,"longitude":-111.8805599,"id":"advy9tpg6rz1","location":"Scottsdale--Paradise Memorial Gardens"},"type":"Feature","geometry":{"type":"Point","coordinates":[-111.8805599,33.5841106]}},{"properties":{"latitude":32.7235024,"date":{"end_time":"2005/12/11 00:00:00 -0500","original":"12/10/2005","granularity":"day","time":"2005/12/10 00:00:00 -0500"},"total":1,"longitude":-109.1012764,"id":"advy9tmpr0gl","location":"Duncan"},"type":"Feature","geometry":{"type":"Point","coordinates":[-109.1012764,32.7235024]}},{"properties":{"latitude":-0.2092977,"date":{"end_time":"2006/01/11 00:00:00 -0500","original":"1/10/2006","granularity":"day","time":"2006/01/10 00:00:00 -0500"},"total":1,"longitude":-78.4984732,"id":"advy9tnl3bd4","location":"Parque El Ejido"},"type":"Feature","geometry":{"type":"Point","coordinates":[-78.4984732,-0.2092977]}},{"properties":{"latitude":-0.045619,"date":{"end_time":"2006/01/12 00:00:00 -0500","original":"1/11/2006","granularity":"day","time":"2006/01/11 00:00:00 -0500"},"total":1,"longitude":-78.7794828,"id":"advy9tp32vcu","location":"Mindo--Las Mariposas"},"type":"Feature","geometry":{"type":"Point","coordinates":[-78.7794828,-0.045619]}},{"properties":{"latitude":-0.0470352,"date":{"end_time":"2006/01/13 00:00:00 -0500","original":"1/12/2006","granularity":"day","time":"2006/01/12 00:00:00 -0500"},"total":1,"longitude":-78.8066483,"id":"advy9tm5qdub","location":"Mindo-Nambillo Ecological Reserve"},"type":"Feature","geometry":{"type":"Point","coordinates":[-78.8066483,-0.0470352]}},{"properties":{"latitude":-0.0489235,"date":{"end_time":"2006/01/16 00:00:00 -0500","original":"1/15/2006","granularity":"day","time":"2006/01/15 00:00:00 -0500"},"total":1,"longitude":-78.7674236,"id":"advy9tohbtk7","location":"Mindo--Yellow House Trails"},"type":"Feature","geometry":{"type":"Point","coordinates":[-78.7674236,-0.0489235]}},{"properties":{"latitude":0.1431887,"date":{"end_time":"2006/01/17 00:00:00 -0500","original":"1/16/2006","granularity":"day","time":"2006/01/16 00:00:00 -0500"},"total":1,"longitude":-79.1346782,"id":"advy9tuxv1q3","location":"Rio Silanche Bird Sanctuary"},"type":"Feature","geometry":{"type":"Point","coordinates":[-79.1346782,0.1431887]}},{"properties":{"latitude":0.0284958,"date":{"end_time":"2006/01/17 00:00:00 -0500","original":"1/16/2006","granularity":"day","time":"2006/01/16 00:00:00 -0500"},"total":1,"longitude":-78.8540268,"id":"advy9thxdrrz","location":"Milpe Bird Sanctuary"},"type":"Feature","geometry":{"type":"Point","coordinates":[-78.8540268,0.0284958]}},{"properties":{"latitude":-0.0500393,"date":{"end_time":"2006/01/18 00:00:00 -0500","original":"1/17/2006","granularity":"day","time":"2006/01/17 00:00:00 -0500"},"total":1,"longitude":-78.7882805,"id":"advy9thvhclz","location":"Mindo--South Road"},"type":"Feature","geometry":{"type":"Point","coordinates":[-78.7882805,-0.0500393]}},{"properties":{"latitude":-0.0209427,"date":{"end_time":"2006/01/19 00:00:00 -0500","original":"1/18/2006","granularity":"day","time":"2006/01/18 00:00:00 -0500"},"total":1,"longitude":-78.7467798,"id":"advy9tugbhhx","location":"Mindo Loma"},"type":"Feature","geometry":{"type":"Point","coordinates":[-78.7467798,-0.0209427]}},{"properties":{"latitude":-0.0279808,"date":{"end_time":"2006/01/22 00:00:00 -0500","original":"1/21/2006","granularity":"day","time":"2006/01/21 00:00:00 -0500"},"total":1,"longitude":-78.6930084,"id":"advy9toe7ue3","location":"Nono-Mindo Road--Tony Nunnery's yard"},"type":"Feature","geometry":{"type":"Point","coordinates":[-78.6930084,-0.0279808]}},{"properties":{"latitude":-0.3709576,"date":{"end_time":"2006/01/24 00:00:00 -0500","original":"1/23/2006","granularity":"day","time":"2006/01/23 00:00:00 -0500"},"total":1,"longitude":-78.0815987,"id":"advy9tuxtrkr","location":"Guango Lodge"},"type":"Feature","geometry":{"type":"Point","coordinates":[-78.0815987,-0.3709576]}},{"properties":{"latitude":-0.3187735,"date":{"end_time":"2006/01/25 00:00:00 -0500","original":"1/24/2006","granularity":"day","time":"2006/01/24 00:00:00 -0500"},"total":1,"longitude":-78.191328,"id":"advy9tuk3oi0","location":"Papallacta Pass--antennas site (Reserva Ecológica Cayambe-Coca)"},"type":"Feature","geometry":{"type":"Point","coordinates":[-78.191328,-0.3187735]}},{"properties":{"latitude":-0.4712222,"date":{"end_time":"2006/01/26 00:00:00 -0500","original":"1/25/2006","granularity":"day","time":"2006/01/25 00:00:00 -0500"},"total":1,"longitude":-77.8981944,"id":"advy9thmyw15","location":"Baeza Road"},"type":"Feature","geometry":{"type":"Point","coordinates":[-77.8981944,-0.4712222]}},{"properties":{"latitude":-0.9869183,"date":{"end_time":"2006/01/28 00:00:00 -0500","original":"1/27/2006","granularity":"day","time":"2006/01/27 00:00:00 -0500"},"total":1,"longitude":-77.807579,"id":"advy9tntnn98","location":"Tena--Hotel Auca &amp; Rio Misahualli"},"type":"Feature","geometry":{"type":"Point","coordinates":[-77.807579,-0.9869183]}},{"properties":{"latitude":-0.5939377,"date":{"end_time":"2006/01/30 00:00:00 -0500","original":"1/29/2006","granularity":"day","time":"2006/01/29 00:00:00 -0500"},"total":1,"longitude":-77.8834534,"id":"advy9tl9gyrg","location":"Cabañas San Isidro"},"type":"Feature","geometry":{"type":"Point","coordinates":[-77.8834534,-0.5939377]}},{"properties":{"latitude":-0.0022745,"date":{"end_time":"2006/02/01 00:00:00 -0500","original":"1/31/2006","granularity":"day","time":"2006/01/31 00:00:00 -0500"},"total":1,"longitude":-78.4559011,"id":"advy9tk1c32g","location":"Mitad del Mundo"},"type":"Feature","geometry":{"type":"Point","coordinates":[-78.4559011,-0.0022745]}},{"properties":{"latitude":0.0370789,"date":{"end_time":"2006/02/01 00:00:00 -0500","original":"1/31/2006","granularity":"day","time":"2006/01/31 00:00:00 -0500"},"total":1,"longitude":-78.480835,"id":"advy9tx7m57j","location":"Reserva Geobotánica Pululahua--general area"},"type":"Feature","geometry":{"type":"Point","coordinates":[-78.480835,0.0370789]}},{"properties":{"latitude":-0.1865151,"date":{"end_time":"2006/02/02 00:00:00 -0500","original":"2/1/2006","granularity":"day","time":"2006/02/01 00:00:00 -0500"},"total":1,"longitude":-78.4857863,"id":"advy9tpcn1r9","location":"Quito--Parque La Carolina, Jardin Botanico"},"type":"Feature","geometry":{"type":"Point","coordinates":[-78.4857863,-0.1865151]}},{"properties":{"latitude":0.3714726,"date":{"end_time":"2006/02/03 00:00:00 -0500","original":"2/2/2006","granularity":"day","time":"2006/02/02 00:00:00 -0500"},"total":1,"longitude":-78.1014633,"id":"advy9trtlbsq","location":"Laguna Yahuarcocha"},"type":"Feature","geometry":{"type":"Point","coordinates":[-78.1014633,0.3714726]}},{"properties":{"latitude":0.234403,"date":{"end_time":"2006/02/03 00:00:00 -0500","original":"2/2/2006","granularity":"day","time":"2006/02/02 00:00:00 -0500"},"total":1,"longitude":-78.2586193,"id":"advy9toit25w","location":"Otavalo--general area"},"type":"Feature","geometry":{"type":"Point","coordinates":[-78.2586193,0.234403]}},{"properties":{"latitude":0.8055102,"date":{"end_time":"2006/02/04 00:00:00 -0500","original":"2/3/2006","granularity":"day","time":"2006/02/03 00:00:00 -0500"},"total":1,"longitude":-77.585814,"id":"advy9tsyeh0t","location":"El Santuario de las Lajas"},"type":"Feature","geometry":{"type":"Point","coordinates":[-77.585814,0.8055102]}},{"properties":{"latitude":-0.5608,"date":{"end_time":"2006/02/05 00:00:00 -0500","original":"2/4/2006","granularity":"day","time":"2006/02/04 00:00:00 -0500"},"total":1,"longitude":-78.59473,"id":"advy9tpfzxh5","location":"Hosteria Papagayo"},"type":"Feature","geometry":{"type":"Point","coordinates":[-78.59473,-0.5608]}},{"properties":{"latitude":-0.658633,"date":{"end_time":"2006/02/06 00:00:00 -0500","original":"2/5/2006","granularity":"day","time":"2006/02/05 00:00:00 -0500"},"total":1,"longitude":-78.3746281,"id":"advy9tp0ar32","location":"PN Cotopaxi"},"type":"Feature","geometry":{"type":"Point","coordinates":[-78.3746281,-0.658633]}},{"properties":{"latitude":-1.3976999,"date":{"end_time":"2006/02/07 00:00:00 -0500","original":"2/6/2006","granularity":"day","time":"2006/02/06 00:00:00 -0500"},"total":1,"longitude":-78.4279633,"id":"advy9trrb4sm","location":"Baños"},"type":"Feature","geometry":{"type":"Point","coordinates":[-78.4279633,-1.3976999]}},{"properties":{"latitude":-1.4665147,"date":{"end_time":"2006/02/08 00:00:00 -0500","original":"2/7/2006","granularity":"day","time":"2006/02/07 00:00:00 -0500"},"total":1,"longitude":-77.9974365,"id":"advy9tk1kyxh","location":"Puyo--general area"},"type":"Feature","geometry":{"type":"Point","coordinates":[-77.9974365,-1.4665147]}},{"properties":{"latitude":-1.0649259,"date":{"end_time":"2006/02/10 00:00:00 -0500","original":"2/9/2006","granularity":"day","time":"2006/02/09 00:00:00 -0500"},"total":1,"longitude":-77.6138592,"id":"advy9tny1fv4","location":"Jatun Sacha Biological Station"},"type":"Feature","geometry":{"type":"Point","coordinates":[-77.6138592,-1.0649259]}},{"properties":{"latitude":-2.83,"date":{"end_time":"2006/02/13 00:00:00 -0500","original":"2/12/2006","granularity":"day","time":"2006/02/12 00:00:00 -0500"},"total":1,"longitude":-79.2097222,"id":"advy9twae6fz","location":"PN El Cajas"},"type":"Feature","geometry":{"type":"Point","coordinates":[-79.2097222,-2.83]}},{"properties":{"latitude":-2.8607491,"date":{"end_time":"2006/02/14 00:00:00 -0500","original":"2/13/2006","granularity":"day","time":"2006/02/13 00:00:00 -0500"},"total":1,"longitude":-78.934021,"id":"advy9twjxnwq","location":"Cuenca - vicinity"},"type":"Feature","geometry":{"type":"Point","coordinates":[-78.934021,-2.8607491]}},{"properties":{"latitude":-4.0990341,"date":{"end_time":"2006/02/15 00:00:00 -0500","original":"2/14/2006","granularity":"day","time":"2006/02/14 00:00:00 -0500"},"total":1,"longitude":-79.1721153,"id":"advy9twc1cnw","location":"PN Podocarpus--Cajanuma"},"type":"Feature","geometry":{"type":"Point","coordinates":[-79.1721153,-4.0990341]}},{"properties":{"latitude":-3.9820809,"date":{"end_time":"2006/02/15 00:00:00 -0500","original":"2/14/2006","granularity":"day","time":"2006/02/14 00:00:00 -0500"},"total":1,"longitude":-79.2059326,"id":"advy9tuk9yy1","location":"Loja - vicinity"},"type":"Feature","geometry":{"type":"Point","coordinates":[-79.2059326,-3.9820809]}},{"properties":{"latitude":-4.0373918,"date":{"end_time":"2006/02/16 00:00:00 -0500","original":"2/15/2006","granularity":"day","time":"2006/02/15 00:00:00 -0500"},"total":1,"longitude":-78.9911842,"id":"advy9tkhdv90","location":"Old Loja-Zamora Rd."},"type":"Feature","geometry":{"type":"Point","coordinates":[-78.9911842,-4.0373918]}},{"properties":{"latitude":-4.1094786,"date":{"end_time":"2006/02/17 00:00:00 -0500","original":"2/16/2006","granularity":"day","time":"2006/02/16 00:00:00 -0500"},"total":1,"longitude":-78.96595,"id":"advy9ts691cu","location":"PN Podocarpus--Río Bombuscaro"},"type":"Feature","geometry":{"type":"Point","coordinates":[-78.96595,-4.1094786]}},{"properties":{"latitude":-4.2666429,"date":{"end_time":"2006/02/18 00:00:00 -0500","original":"2/17/2006","granularity":"day","time":"2006/02/17 00:00:00 -0500"},"total":1,"longitude":-79.2261887,"id":"advy9tqocgpb","location":"Vilcabamba--vicinity"},"type":"Feature","geometry":{"type":"Point","coordinates":[-79.2261887,-4.2666429]}},{"properties":{"latitude":-4.891204,"date":{"end_time":"2006/02/18 00:00:00 -0500","original":"2/17/2006","granularity":"day","time":"2006/02/17 00:00:00 -0500"},"total":1,"longitude":-79.1372681,"id":"advy9tv06haz","location":"Road to Zumba"},"type":"Feature","geometry":{"type":"Point","coordinates":[-79.1372681,-4.891204]}},{"properties":{"latitude":-5.3343788,"date":{"end_time":"2006/02/19 00:00:00 -0500","original":"2/18/2006","granularity":"day","time":"2006/02/18 00:00:00 -0500"},"total":1,"longitude":-78.8900757,"id":"advy9ty03c7o","location":"road from border to Jaen"},"type":"Feature","geometry":{"type":"Point","coordinates":[-78.8900757,-5.3343788]}},{"properties":{"latitude":-5.8343333,"date":{"end_time":"2006/02/20 00:00:00 -0500","original":"2/19/2006","granularity":"day","time":"2006/02/19 00:00:00 -0500"},"total":1,"longitude":-77.9985,"id":"advy9tpe4uos","location":"La Florida"},"type":"Feature","geometry":{"type":"Point","coordinates":[-77.9985,-5.8343333]}},{"properties":{"latitude":-6.4197072,"date":{"end_time":"2006/02/21 00:00:00 -0500","original":"2/20/2006","granularity":"day","time":"2006/02/20 00:00:00 -0500"},"total":1,"longitude":-77.9236221,"id":"advy9tr1we1o","location":"Kuelap Fortress area"},"type":"Feature","geometry":{"type":"Point","coordinates":[-77.9236221,-6.4197072]}},{"properties":{"latitude":-6.7053131,"date":{"end_time":"2006/02/22 00:00:00 -0500","original":"2/21/2006","granularity":"day","time":"2006/02/21 00:00:00 -0500"},"total":1,"longitude":-79.8994017,"id":"advy9trnvt2j","location":"Museo Tumbas Reales de Sipan"},"type":"Feature","geometry":{"type":"Point","coordinates":[-79.8994017,-6.7053131]}},{"properties":{"latitude":-6.4877778,"date":{"end_time":"2006/02/23 00:00:00 -0500","original":"2/22/2006","granularity":"day","time":"2006/02/22 00:00:00 -0500"},"total":1,"longitude":-79.7647222,"id":"advy9tmebq5g","location":"Bosque Pomac"},"type":"Feature","geometry":{"type":"Point","coordinates":[-79.7647222,-6.4877778]}},{"properties":{"latitude":-8.1098763,"date":{"end_time":"2006/02/24 00:00:00 -0500","original":"2/23/2006","granularity":"day","time":"2006/02/23 00:00:00 -0500"},"total":1,"longitude":-79.0730667,"id":"advy9tx1gxeu","location":"Ruinas de Chan Chan ponds"},"type":"Feature","geometry":{"type":"Point","coordinates":[-79.0730667,-8.1098763]}},{"properties":{"latitude":-8.079625,"date":{"end_time":"2006/02/24 00:00:00 -0500","original":"2/23/2006","granularity":"day","time":"2006/02/23 00:00:00 -0500"},"total":1,"longitude":-79.1216469,"id":"advy9tin4bfz","location":"Huanchaco"},"type":"Feature","geometry":{"type":"Point","coordinates":[-79.1216469,-8.079625]}},{"properties":{"latitude":-9.0800823,"date":{"end_time":"2006/02/25 00:00:00 -0500","original":"2/24/2006","granularity":"day","time":"2006/02/24 00:00:00 -0500"},"total":1,"longitude":-77.6529551,"id":"advy9tusas8j","location":"Huascaran NP--Maria Josefa Trail"},"type":"Feature","geometry":{"type":"Point","coordinates":[-77.6529551,-9.0800823]}},{"properties":{"latitude":-9.0526629,"date":{"end_time":"2006/02/26 00:00:00 -0500","original":"2/25/2006","granularity":"day","time":"2006/02/25 00:00:00 -0500"},"total":1,"longitude":-77.6211548,"id":"advy9tst3scn","location":"Huascaran NP--Laguna Llanganuco"},"type":"Feature","geometry":{"type":"Point","coordinates":[-77.6211548,-9.0526629]}},{"properties":{"latitude":-10.1195412,"date":{"end_time":"2006/02/27 00:00:00 -0500","original":"2/26/2006","granularity":"day","time":"2006/02/26 00:00:00 -0500"},"total":1,"longitude":-77.2842264,"id":"advy9tpe8x8n","location":"Laguna Conococha"},"type":"Feature","geometry":{"type":"Point","coordinates":[-77.2842264,-10.1195412]}},{"properties":{"latitude":-11.0813846,"date":{"end_time":"2006/03/02 00:00:00 -0500","original":"3/1/2006","granularity":"day","time":"2006/03/01 00:00:00 -0500"},"total":1,"longitude":-76.1737061,"id":"advy9tnzjtjm","location":"Ondores"},"type":"Feature","geometry":{"type":"Point","coordinates":[-76.1737061,-11.0813846]}},{"properties":{"latitude":-11.0166885,"date":{"end_time":"2006/03/03 00:00:00 -0500","original":"3/2/2006","granularity":"day","time":"2006/03/02 00:00:00 -0500"},"total":1,"longitude":-76.0913086,"id":"advy9trphn3i","location":"Lago de Junin"},"type":"Feature","geometry":{"type":"Point","coordinates":[-76.0913086,-11.0166885]}},{"properties":{"latitude":-11.773833,"date":{"end_time":"2006/03/06 00:00:00 -0500","original":"3/5/2006","granularity":"day","time":"2006/03/05 00:00:00 -0500"},"total":1,"longitude":-76.614,"id":"advy9tmxxfyc","location":"Santa Eulalia Road"},"type":"Feature","geometry":{"type":"Point","coordinates":[-76.614,-11.773833]}},{"properties":{"latitude":-11.5941492,"date":{"end_time":"2006/03/06 00:00:00 -0500","original":"3/5/2006","granularity":"day","time":"2006/03/05 00:00:00 -0500"},"total":1,"longitude":-76.3834763,"id":"advy9txi1mwg","location":"Alto Valle Santa Eulalia-Milloc"},"type":"Feature","geometry":{"type":"Point","coordinates":[-76.3834763,-11.5941492]}},{"properties":{"latitude":-12.2110963,"date":{"end_time":"2006/03/07 00:00:00 -0500","original":"3/6/2006","granularity":"day","time":"2006/03/06 00:00:00 -0500"},"total":1,"longitude":-76.9897413,"id":"advy9tih168j","location":"Pantanos de Villa"},"type":"Feature","geometry":{"type":"Point","coordinates":[-76.9897413,-12.2110963]}},{"properties":{"latitude":-12.1027738,"date":{"end_time":"2006/03/08 00:00:00 -0500","original":"3/7/2006","granularity":"day","time":"2006/03/07 00:00:00 -0500"},"total":1,"longitude":-77.0352745,"id":"advy9tqgik3y","location":"Parque El Olivar, San Isidro"},"type":"Feature","geometry":{"type":"Point","coordinates":[-77.0352745,-12.1027738]}},{"properties":{"latitude":-16.4073138,"date":{"end_time":"2006/03/10 00:00:00 -0500","original":"3/9/2006","granularity":"day","time":"2006/03/09 00:00:00 -0500"},"total":1,"longitude":-71.5427971,"id":"advy9tpw0z5l","location":"Arequipa area"},"type":"Feature","geometry":{"type":"Point","coordinates":[-71.5427971,-16.4073138]}},{"properties":{"latitude":-15.6093259,"date":{"end_time":"2006/03/11 00:00:00 -0500","original":"3/10/2006","granularity":"day","time":"2006/03/10 00:00:00 -0500"},"total":1,"longitude":-71.8595123,"id":"advy9tof6dc1","location":"Colca Canyon - condor overlook area"},"type":"Feature","geometry":{"type":"Point","coordinates":[-71.8595123,-15.6093259]}},{"properties":{"latitude":-15.7763955,"date":{"end_time":"2006/03/13 00:00:00 -0500","original":"3/12/2006","granularity":"day","time":"2006/03/12 00:00:00 -0500"},"total":1,"longitude":-69.6821594,"id":"advy9tip8t4u","location":"Lago Titicaca--Isla Taquile"},"type":"Feature","geometry":{"type":"Point","coordinates":[-69.6821594,-15.7763955]}},{"properties":{"latitude":-18.2560888,"date":{"end_time":"2006/03/22 00:00:00 -0500","original":"3/21/2006","granularity":"day","time":"2006/03/21 00:00:00 -0500"},"total":1,"longitude":-69.1623688,"id":"advy9tsxeppm","location":"Parque Nacional Lauca, Lago Chungará"},"type":"Feature","geometry":{"type":"Point","coordinates":[-69.1623688,-18.2560888]}},{"properties":{"latitude":-18.4724046,"date":{"end_time":"2006/03/22 00:00:00 -0500","original":"3/21/2006","granularity":"day","time":"2006/03/21 00:00:00 -0500"},"total":1,"longitude":-70.3238511,"id":"advy9twdsbso","location":"Arica - Puerto"},"type":"Feature","geometry":{"type":"Point","coordinates":[-70.3238511,-18.4724046]}},{"properties":{"latitude":-18.4770041,"date":{"end_time":"2006/03/22 00:00:00 -0500","original":"3/21/2006","granularity":"day","time":"2006/03/21 00:00:00 -0500"},"total":1,"longitude":-70.3207397,"id":"advy9tl2k3n6","location":"Arica"},"type":"Feature","geometry":{"type":"Point","coordinates":[-70.3207397,-18.4770041]}},{"properties":{"latitude":-18.4805859,"date":{"end_time":"2006/03/23 00:00:00 -0500","original":"3/22/2006","granularity":"day","time":"2006/03/22 00:00:00 -0500"},"total":1,"longitude":-70.3318977,"id":"advy9tm3ksrm","location":"Arica (El Alacran)"},"type":"Feature","geometry":{"type":"Point","coordinates":[-70.3318977,-18.4805859]}},{"properties":{"latitude":-18.5157287,"date":{"end_time":"2006/03/23 00:00:00 -0500","original":"3/22/2006","granularity":"day","time":"2006/03/22 00:00:00 -0500"},"total":1,"longitude":-70.1809323,"id":"advy9tlh2iwy","location":"Azapa, Museo de Azapa"},"type":"Feature","geometry":{"type":"Point","coordinates":[-70.1809323,-18.5157287]}},{"properties":{"latitude":-18.1626935,"date":{"end_time":"2006/03/24 00:00:00 -0500","original":"3/23/2006","granularity":"day","time":"2006/03/23 00:00:00 -0500"},"total":1,"longitude":-70.674448,"id":"advy9tlucydn","location":"Boca del Río, Tacna"},"type":"Feature","geometry":{"type":"Point","coordinates":[-70.674448,-18.1626935]}},{"properties":{"latitude":-13.8714967,"date":{"end_time":"2006/03/25 00:00:00 -0500","original":"3/24/2006","granularity":"day","time":"2006/03/24 00:00:00 -0500"},"total":1,"longitude":-76.2827969,"id":"advy9tnkbqsb","location":"Reserva Nacional de Paracas"},"type":"Feature","geometry":{"type":"Point","coordinates":[-76.2827969,-13.8714967]}},{"properties":{"latitude":-13.8978267,"date":{"end_time":"2006/03/25 00:00:00 -0500","original":"3/24/2006","granularity":"day","time":"2006/03/24 00:00:00 -0500"},"total":1,"longitude":-76.3122368,"id":"advy9tqzan96","location":"Reserva Nacional de Paracas--Lagunillas"},"type":"Feature","geometry":{"type":"Point","coordinates":[-76.3122368,-13.8978267]}},{"properties":{"latitude":-3.9807109,"date":{"end_time":"2006/03/29 00:00:00 -0500","original":"3/28/2006","granularity":"day","time":"2006/03/28 00:00:00 -0500"},"total":1,"longitude":-73.438797,"id":"advy9tpewheb","location":"Allpahuayo-Mishana Reserve (terra firme)"},"type":"Feature","geometry":{"type":"Point","coordinates":[-73.438797,-3.9807109]}},{"properties":{"latitude":-3.9402956,"date":{"end_time":"2006/03/31 00:00:00 -0500","original":"3/30/2006","granularity":"day","time":"2006/03/30 00:00:00 -0500"},"total":1,"longitude":-73.4017181,"id":"advy9tpwwc5m","location":"Allpahuayo-Mishana Reserve (KM 25)"},"type":"Feature","geometry":{"type":"Point","coordinates":[-73.4017181,-3.9402956]}},{"properties":{"latitude":58.3766392,"date":{"end_time":"2006/04/27 00:00:00 -0400","original":"4/26/2006","granularity":"day","time":"2006/04/26 00:00:00 -0400"},"total":1,"longitude":-134.5770907,"id":"advy9tqzms3t","location":"Juneau - pond along Mendenhall Loop Rd"},"type":"Feature","geometry":{"type":"Point","coordinates":[-134.5770907,58.3766392]}},{"properties":{"latitude":59.4418781,"date":{"end_time":"2006/07/10 00:00:00 -0400","original":"7/9/2006","granularity":"day","time":"2006/07/09 00:00:00 -0400"},"total":1,"longitude":-135.2678776,"id":"advy9tvm8stt","location":"Skagway--Upper Dewey Lake"},"type":"Feature","geometry":{"type":"Point","coordinates":[-135.2678776,59.4418781]}},{"properties":{"latitude":60.7132169,"date":{"end_time":"2006/07/23 00:00:00 -0400","original":"7/22/2006","granularity":"day","time":"2006/07/22 00:00:00 -0400"},"total":1,"longitude":-135.048151,"id":"advy9twyipne","location":"Whitehorse--Yukon River Trail--SS Klondike"},"type":"Feature","geometry":{"type":"Point","coordinates":[-135.048151,60.7132169]}},{"properties":{"latitude":60.7020465,"date":{"end_time":"2006/07/23 00:00:00 -0400","original":"7/22/2006","granularity":"day","time":"2006/07/22 00:00:00 -0400"},"total":1,"longitude":-135.0475502,"id":"advy9tthixv3","location":"Whitehorse--Yukon River Trail--Robert Service campground"},"type":"Feature","geometry":{"type":"Point","coordinates":[-135.0475502,60.7020465]}},{"properties":{"latitude":32.2335526,"date":{"end_time":"2006/07/29 00:00:00 -0400","original":"7/28/2006","granularity":"day","time":"2006/07/28 00:00:00 -0400"},"total":1,"longitude":-111.0234348,"id":"advy9tkgvo0g","location":"Greasewood Park"},"type":"Feature","geometry":{"type":"Point","coordinates":[-111.0234348,32.2335526]}},{"properties":{"latitude":61.2302603,"date":{"end_time":"2006/09/24 00:00:00 -0400","original":"9/23/2006","granularity":"day","time":"2006/09/23 00:00:00 -0400"},"total":1,"longitude":-149.8797798,"id":"advy9thxwo7f","location":"Anchorage--Government Hill"},"type":"Feature","geometry":{"type":"Point","coordinates":[-149.8797798,61.2302603]}},{"properties":{"latitude":56.6996805,"date":{"end_time":"2006/10/15 00:00:00 -0400","original":"10/14/2006","granularity":"day","time":"2006/10/14 00:00:00 -0400"},"total":1,"longitude":-134.5306091,"id":"advy9tmem65s","location":"Outer Chatham Strait-south end (Sitka)"},"type":"Feature","geometry":{"type":"Point","coordinates":[-134.5306091,56.6996805]}},{"properties":{"latitude":55.437727,"date":{"end_time":"2006/10/16 00:00:00 -0400","original":"10/15/2006","granularity":"day","time":"2006/10/15 00:00:00 -0400"},"total":1,"longitude":-131.8383408,"id":"advy9ti5wb4t","location":"Ketchikan - in channel north of city"},"type":"Feature","geometry":{"type":"Point","coordinates":[-131.8383408,55.437727]}},{"properties":{"latitude":54.4498684,"date":{"end_time":"2006/10/16 00:00:00 -0400","original":"10/15/2006","granularity":"day","time":"2006/10/15 00:00:00 -0400"},"total":1,"longitude":-131.2770081,"id":"advy9tns5ndi","location":"Dixon Entrance"},"type":"Feature","geometry":{"type":"Point","coordinates":[-131.2770081,54.4498684]}},{"properties":{"latitude":54.7851344,"date":{"end_time":"2006/10/17 00:00:00 -0400","original":"10/16/2006","granularity":"day","time":"2006/10/16 00:00:00 -0400"},"total":1,"longitude":-127.1514487,"id":"advy9tmit5fz","location":"Smithers--Riverfront Park"},"type":"Feature","geometry":{"type":"Point","coordinates":[-127.1514487,54.7851344]}},{"properties":{"latitude":45.8847357,"date":{"end_time":"2006/10/22 00:00:00 -0400","original":"10/21/2006","granularity":"day","time":"2006/10/21 00:00:00 -0400"},"total":1,"longitude":-123.9683104,"id":"advy9tos7l3c","location":"Haystack Rock"},"type":"Feature","geometry":{"type":"Point","coordinates":[-123.9683104,45.8847357]}},{"properties":{"latitude":31.7274371,"date":{"end_time":"2006/11/19 00:00:00 -0500","original":"11/18/2006","granularity":"day","time":"2006/11/18 00:00:00 -0500"},"total":1,"longitude":-110.7075119,"id":"advy9tilg41m","location":"Gardner Canyon"},"type":"Feature","geometry":{"type":"Point","coordinates":[-110.7075119,31.7274371]}},{"properties":{"latitude":32.4896011,"date":{"end_time":"2006/12/06 00:00:00 -0500","original":"12/5/2006","granularity":"day","time":"2006/12/05 00:00:00 -0500"},"total":1,"longitude":-111.3182983,"id":"advy9tqinnh8","location":"Marana Pecan Grove"},"type":"Feature","geometry":{"type":"Point","coordinates":[-111.3182983,32.4896011]}},{"properties":{"latitude":33.0765879,"date":{"end_time":"2006/12/15 00:00:00 -0500","original":"12/14/2006","granularity":"day","time":"2006/12/14 00:00:00 -0500"},"total":1,"longitude":-115.5110643,"id":"advy9tin4gfo","location":"Ramer Lake"},"type":"Feature","geometry":{"type":"Point","coordinates":[-115.5110643,33.0765879]}},{"properties":{"latitude":33.1965376,"date":{"end_time":"2006/12/15 00:00:00 -0500","original":"12/14/2006","granularity":"day","time":"2006/12/14 00:00:00 -0500"},"total":1,"longitude":-115.6128216,"id":"advy9tlakaco","location":"Salton Sea--Red Hill area"},"type":"Feature","geometry":{"type":"Point","coordinates":[-115.6128216,33.1965376]}},{"properties":{"latitude":32.8423083,"date":{"end_time":"2006/12/15 00:00:00 -0500","original":"12/14/2006","granularity":"day","time":"2006/12/14 00:00:00 -0500"},"total":1,"longitude":-113.2748795,"id":"advy9tx5h6zm","location":"I-8 creosote flats"},"type":"Feature","geometry":{"type":"Point","coordinates":[-113.2748795,32.8423083]}},{"properties":{"latitude":32.764037,"date":{"end_time":"2006/12/16 00:00:00 -0500","original":"12/15/2006","granularity":"day","time":"2006/12/15 00:00:00 -0500"},"total":1,"longitude":-115.7021713,"id":"advy9tj8847m","location":"Fig Lagoon"},"type":"Feature","geometry":{"type":"Point","coordinates":[-115.7021713,32.764037]}},{"properties":{"latitude":33.0826963,"date":{"end_time":"2006/12/16 00:00:00 -0500","original":"12/15/2006","granularity":"day","time":"2006/12/15 00:00:00 -0500"},"total":1,"longitude":-115.7097244,"id":"advy9tm3ki5h","location":"Salton Sea NWR--Unit 1"},"type":"Feature","geometry":{"type":"Point","coordinates":[-115.7097244,33.0826963]}},{"properties":{"latitude":33.1810944,"date":{"end_time":"2006/12/16 00:00:00 -0500","original":"12/15/2006","granularity":"day","time":"2006/12/15 00:00:00 -0500"},"total":1,"longitude":-115.6211472,"id":"advy9tqmdqs8","location":"Salton Sea--Rock Hill Trail"},"type":"Feature","geometry":{"type":"Point","coordinates":[-115.6211472,33.1810944]}},{"properties":{"latitude":33.1996978,"date":{"end_time":"2006/12/16 00:00:00 -0500","original":"12/15/2006","granularity":"day","time":"2006/12/15 00:00:00 -0500"},"total":1,"longitude":-115.5971146,"id":"advy9tl027ys","location":"Salton Sea--Garst Rd."},"type":"Feature","geometry":{"type":"Point","coordinates":[-115.5971146,33.1996978]}},{"properties":{"latitude":33.1722397,"date":{"end_time":"2006/12/16 00:00:00 -0500","original":"12/15/2006","granularity":"day","time":"2006/12/15 00:00:00 -0500"},"total":1,"longitude":-115.6427077,"id":"advy9to3u3us","location":"Salton Sea--Obsidian Butte"},"type":"Feature","geometry":{"type":"Point","coordinates":[-115.6427077,33.1722397]}},{"properties":{"latitude":32.7818446,"date":{"end_time":"2006/12/16 00:00:00 -0500","original":"12/15/2006","granularity":"day","time":"2006/12/15 00:00:00 -0500"},"total":1,"longitude":-115.6841469,"id":"advy9tno059k","location":"Sunbeam Lake County Park"},"type":"Feature","geometry":{"type":"Point","coordinates":[-115.6841469,32.7818446]}},{"properties":{"latitude":32.6541181,"date":{"end_time":"2006/12/22 00:00:00 -0500","original":"12/21/2006","granularity":"day","time":"2006/12/21 00:00:00 -0500"},"total":1,"longitude":-111.5948296,"id":"advy9tk1n9mr","location":"Evergreen Turf Sod Farm--Tweedy/Pretzer"},"type":"Feature","geometry":{"type":"Point","coordinates":[-111.5948296,32.6541181]}},{"properties":{"latitude":31.321115,"date":{"end_time":"2007/01/21 00:00:00 -0500","original":"1/20/2007","granularity":"day","time":"2007/01/20 00:00:00 -0500"},"total":1,"longitude":-113.529178,"id":"advy9tvkal4s","location":"Puerto Peñasco"},"type":"Feature","geometry":{"type":"Point","coordinates":[-113.529178,31.321115]}},{"properties":{"latitude":31.9203654,"date":{"end_time":"2007/01/21 00:00:00 -0500","original":"1/20/2007","granularity":"day","time":"2007/01/20 00:00:00 -0500"},"total":1,"longitude":-111.851929,"id":"advy9tlbu4cw","location":"Sells--Big Pond"},"type":"Feature","geometry":{"type":"Point","coordinates":[-111.851929,31.9203654]}},{"properties":{"latitude":31.5948217,"date":{"end_time":"2007/04/12 00:00:00 -0400","original":"4/11/2007","granularity":"day","time":"2007/04/11 00:00:00 -0400"},"total":1,"longitude":-111.0473049,"id":"advy9tt4jxp4","location":"De Anza Trail--Carmen (Clark Crossing Rd)"},"type":"Feature","geometry":{"type":"Point","coordinates":[-111.0473049,31.5948217]}},{"properties":{"latitude":31.8553978,"date":{"end_time":"2007/04/15 00:00:00 -0400","original":"4/14/2007","granularity":"day","time":"2007/04/14 00:00:00 -0400"},"total":1,"longitude":-109.9628448,"id":"advy9ts7xpw3","location":"Dragoon Mtns - south side"},"type":"Feature","geometry":{"type":"Point","coordinates":[-109.9628448,31.8553978]}},{"properties":{"latitude":31.3904516,"date":{"end_time":"2007/04/26 00:00:00 -0400","original":"4/25/2007","granularity":"day","time":"2007/04/25 00:00:00 -0400"},"total":1,"longitude":-110.2392496,"id":"advy9tryvtgv","location":"Ash Canyon B&amp;B"},"type":"Feature","geometry":{"type":"Point","coordinates":[-110.2392496,31.3904516]}},{"properties":{"latitude":31.4596996,"date":{"end_time":"2007/04/26 00:00:00 -0400","original":"4/25/2007","granularity":"day","time":"2007/04/25 00:00:00 -0400"},"total":1,"longitude":-110.3644028,"id":"advy9ty0mafs","location":"Garden Canyon"},"type":"Feature","geometry":{"type":"Point","coordinates":[-110.3644028,31.4596996]}},{"properties":{"latitude":31.429,"date":{"end_time":"2007/04/26 00:00:00 -0400","original":"4/25/2007","granularity":"day","time":"2007/04/25 00:00:00 -0400"},"total":1,"longitude":-110.304,"id":"advy9tpcmjs6","location":"Carr Canyon--Ramsey Vista CG"},"type":"Feature","geometry":{"type":"Point","coordinates":[-110.304,31.429]}},{"properties":{"latitude":32.3093722,"date":{"end_time":"2007/04/27 00:00:00 -0400","original":"4/26/2007","granularity":"day","time":"2007/04/26 00:00:00 -0400"},"total":1,"longitude":-110.7210007,"id":"advy9txrll5j","location":"Mt. Lemmon--Babad Do'ag Vista"},"type":"Feature","geometry":{"type":"Point","coordinates":[-110.7210007,32.3093722]}},{"properties":{"latitude":32.1601551,"date":{"end_time":"2007/05/09 00:00:00 -0400","original":"5/8/2007","granularity":"day","time":"2007/05/08 00:00:00 -0400"},"total":1,"longitude":-111.0732257,"id":"advy9tnoed3n","location":"Vesey Park"},"type":"Feature","geometry":{"type":"Point","coordinates":[-111.0732257,32.1601551]}},{"properties":{"latitude":33.26316,"date":{"end_time":"2007/05/14 00:00:00 -0400","original":"5/13/2007","granularity":"day","time":"2007/05/13 00:00:00 -0400"},"total":1,"longitude":-110.77238,"id":"advy9tt9f5ja","location":"Hwy. 77--El Capitan Rest Stop"},"type":"Feature","geometry":{"type":"Point","coordinates":[-110.77238,33.26316]}},{"properties":{"latitude":58.3081782,"date":{"end_time":"2007/05/18 00:00:00 -0400","original":"5/17/2007","granularity":"day","time":"2007/05/17 00:00:00 -0400"},"total":1,"longitude":-134.4551468,"id":"advy9tqlzqc0","location":"Juneau - John's House"},"type":"Feature","geometry":{"type":"Point","coordinates":[-134.4551468,58.3081782]}},{"properties":{"latitude":58.3056109,"date":{"end_time":"2007/05/20 00:00:00 -0400","original":"5/19/2007","granularity":"day","time":"2007/05/19 00:00:00 -0400"},"total":1,"longitude":-134.4166946,"id":"advy9tivyc9g","location":"Juneau--Gold Creek Flume Trail"},"type":"Feature","geometry":{"type":"Point","coordinates":[-134.4166946,58.3056109]}},{"properties":{"latitude":58.6733203,"date":{"end_time":"2007/05/21 00:00:00 -0400","original":"5/20/2007","granularity":"day","time":"2007/05/20 00:00:00 -0400"},"total":1,"longitude":-156.6595459,"id":"advy9tokf82t","location":"King Salmon"},"type":"Feature","geometry":{"type":"Point","coordinates":[-156.6595459,58.6733203]}},{"properties":{"latitude":51.8844319,"date":{"end_time":"2007/05/21 00:00:00 -0400","original":"5/20/2007","granularity":"day","time":"2007/05/20 00:00:00 -0400"},"total":1,"longitude":-176.6476464,"id":"advy9tqgo4l7","location":"Adak Is.--Smew Ponds (N side E-W runway)"},"type":"Feature","geometry":{"type":"Point","coordinates":[-176.6476464,51.8844319]}},{"properties":{"latitude":51.8564569,"date":{"end_time":"2007/05/21 00:00:00 -0400","original":"5/20/2007","granularity":"day","time":"2007/05/20 00:00:00 -0400"},"total":1,"longitude":-176.6423893,"id":"advy9tjxxdty","location":"Adak Is.--Sweeper Cove"},"type":"Feature","geometry":{"type":"Point","coordinates":[-176.6423893,51.8564569]}},{"properties":{"latitude":51.9354812,"date":{"end_time":"2007/05/21 00:00:00 -0400","original":"5/20/2007","granularity":"day","time":"2007/05/20 00:00:00 -0400"},"total":1,"longitude":-176.5587902,"id":"advy9tquza5m","location":"Adak Is.--Clam Lagoon Seawall"},"type":"Feature","geometry":{"type":"Point","coordinates":[-176.5587902,51.9354812]}},{"properties":{"latitude":51.8910736,"date":{"end_time":"2007/05/21 00:00:00 -0400","original":"5/20/2007","granularity":"day","time":"2007/05/20 00:00:00 -0400"},"total":1,"longitude":-176.624735,"id":"advy9tx09774","location":"Adak Is.--Airport Creek Mouth"},"type":"Feature","geometry":{"type":"Point","coordinates":[-176.624735,51.8910736]}},{"properties":{"latitude":51.9905821,"date":{"end_time":"2007/05/22 00:00:00 -0400","original":"5/21/2007","granularity":"day","time":"2007/05/21 00:00:00 -0400"},"total":1,"longitude":-176.6129816,"id":"advy9tm7yg7r","location":"Adak Is.--Former USCG LORAN Station"},"type":"Feature","geometry":{"type":"Point","coordinates":[-176.6129816,51.9905821]}},{"properties":{"latitude":51.850042,"date":{"end_time":"2007/05/23 00:00:00 -0400","original":"5/22/2007","granularity":"day","time":"2007/05/22 00:00:00 -0400"},"total":1,"longitude":-176.6549635,"id":"advy9timzs9y","location":"Adak Is.--Small Boat Basin"},"type":"Feature","geometry":{"type":"Point","coordinates":[-176.6549635,51.850042]}},{"properties":{"latitude":51.8956157,"date":{"end_time":"2007/05/23 00:00:00 -0400","original":"5/22/2007","granularity":"day","time":"2007/05/22 00:00:00 -0400"},"total":1,"longitude":-176.6355228,"id":"advy9tog7hyc","location":"Adak Is.--Contractor Camp Marsh"},"type":"Feature","geometry":{"type":"Point","coordinates":[-176.6355228,51.8956157]}},{"properties":{"latitude":51.9225142,"date":{"end_time":"2007/05/24 00:00:00 -0400","original":"5/23/2007","granularity":"day","time":"2007/05/23 00:00:00 -0400"},"total":1,"longitude":-176.5812778,"id":"advy9txqopn2","location":"Adak Is.--Clam Lagoon-Mud Flats"},"type":"Feature","geometry":{"type":"Point","coordinates":[-176.5812778,51.9225142]}},{"properties":{"latitude":63.0557955,"date":{"end_time":"2007/05/26 00:00:00 -0400","original":"5/25/2007","granularity":"day","time":"2007/05/25 00:00:00 -0400"},"total":1,"longitude":-145.7650566,"id":"advy9tjvkhjm","location":"Denali Hwy--13 Mile Hill-MP P13 (Valdez-Cordova CA)"},"type":"Feature","geometry":{"type":"Point","coordinates":[-145.7650566,63.0557955]}},{"properties":{"latitude":63.0507586,"date":{"end_time":"2007/05/26 00:00:00 -0400","original":"5/25/2007","granularity":"day","time":"2007/05/25 00:00:00 -0400"},"total":1,"longitude":-145.985899,"id":"advy9tqxrdre","location":"Denali Hwy--Tangle Lakes-MP P20 (Valdez-Cordova CA)"},"type":"Feature","geometry":{"type":"Point","coordinates":[-145.985899,63.0507586]}},{"properties":{"latitude":63.0859016,"date":{"end_time":"2007/05/26 00:00:00 -0400","original":"5/25/2007","granularity":"day","time":"2007/05/25 00:00:00 -0400"},"total":1,"longitude":-146.4314461,"id":"advy9tn9dsg4","location":"Denali Hwy--Maclaren Summit-MP P36.8 (Valdez-Cordova CA)"},"type":"Feature","geometry":{"type":"Point","coordinates":[-146.4314461,63.0859016]}},{"properties":{"latitude":63.1197993,"date":{"end_time":"2007/05/27 00:00:00 -0400","original":"5/26/2007","granularity":"day","time":"2007/05/26 00:00:00 -0400"},"total":1,"longitude":-146.5311384,"id":"advy9tpuzo5g","location":"Denali Hwy--Maclaren River Bridge-MP P42 (M-S Boro)"},"type":"Feature","geometry":{"type":"Point","coordinates":[-146.5311384,63.1197993]}},{"properties":{"latitude":63.0535176,"date":{"end_time":"2007/05/27 00:00:00 -0400","original":"5/26/2007","granularity":"day","time":"2007/05/26 00:00:00 -0400"},"total":1,"longitude":-147.4066544,"id":"advy9tmzqyr2","location":"Denali Hwy--Esker Ponds -MP P59 (M-S Boro)"},"type":"Feature","geometry":{"type":"Point","coordinates":[-147.4066544,63.0535176]}},{"properties":{"latitude":63.1046997,"date":{"end_time":"2007/05/27 00:00:00 -0400","original":"5/26/2007","granularity":"day","time":"2007/05/26 00:00:00 -0400"},"total":1,"longitude":-147.5208092,"id":"advy9ts1wgbz","location":"Denali Hwy--Susitna River Bridge-MP P79.5 (M-S Boro)"},"type":"Feature","geometry":{"type":"Point","coordinates":[-147.5208092,63.1046997]}},{"properties":{"latitude":62.3162488,"date":{"end_time":"2007/05/27 00:00:00 -0400","original":"5/26/2007","granularity":"day","time":"2007/05/26 00:00:00 -0400"},"total":1,"longitude":-150.2273941,"id":"advy9txuc1z2","location":"Trapper Creek roadside"},"type":"Feature","geometry":{"type":"Point","coordinates":[-150.2273941,62.3162488]}},{"properties":{"latitude":61.2056818,"date":{"end_time":"2007/05/28 00:00:00 -0400","original":"5/27/2007","granularity":"day","time":"2007/05/27 00:00:00 -0400"},"total":1,"longitude":-149.783392,"id":"advy9thih092","location":"Anchorage--Russian Jack Springs Park"},"type":"Feature","geometry":{"type":"Point","coordinates":[-149.783392,61.2056818]}},{"properties":{"latitude":44.8395,"date":{"end_time":"2007/06/29 00:00:00 -0400","original":"6/28/2007","granularity":"day","time":"2007/06/28 00:00:00 -0400"},"total":1,"longitude":-93.2281,"id":"advy9to7kgqj","location":"Minnesota Valley NWR"},"type":"Feature","geometry":{"type":"Point","coordinates":[-93.2281,44.8395]}},{"properties":{"latitude":44.886,"date":{"end_time":"2007/06/29 00:00:00 -0400","original":"6/28/2007","granularity":"day","time":"2007/06/28 00:00:00 -0400"},"total":1,"longitude":-93.1776,"id":"advy9tktde16","location":"Fort Snelling State Park"},"type":"Feature","geometry":{"type":"Point","coordinates":[-93.1776,44.886]}},{"properties":{"latitude":35.3583333,"date":{"end_time":"2007/07/08 00:00:00 -0400","original":"7/7/2007","granularity":"day","time":"2007/07/07 00:00:00 -0400"},"total":1,"longitude":-111.6208333,"id":"advy9ttxbzol","location":"Coconino NF--Lockett Meadow CG"},"type":"Feature","geometry":{"type":"Point","coordinates":[-111.6208333,35.3583333]}},{"properties":{"latitude":32.5508647,"date":{"end_time":"2007/07/13 00:00:00 -0400","original":"7/12/2007","granularity":"day","time":"2007/07/12 00:00:00 -0400"},"total":1,"longitude":-111.1026764,"id":"advy9tw6fd56","location":"Cochie - TAS Restoration Site"},"type":"Feature","geometry":{"type":"Point","coordinates":[-111.1026764,32.5508647]}},{"properties":{"latitude":32.6985809,"date":{"end_time":"2007/07/21 00:00:00 -0400","original":"7/20/2007","granularity":"day","time":"2007/07/20 00:00:00 -0400"},"total":1,"longitude":-117.2452163,"id":"advy9txvngkd","location":"Point Loma--general area"},"type":"Feature","geometry":{"type":"Point","coordinates":[-117.2452163,32.6985809]}},{"properties":{"latitude":32.5710707,"date":{"end_time":"2007/07/22 00:00:00 -0400","original":"7/21/2007","granularity":"day","time":"2007/07/21 00:00:00 -0400"},"total":1,"longitude":-117.1290303,"id":"advy9tl71q3u","location":"Tijuana Slough NWR"},"type":"Feature","geometry":{"type":"Point","coordinates":[-117.1290303,32.5710707]}},{"properties":{"latitude":32.543512,"date":{"end_time":"2007/07/22 00:00:00 -0400","original":"7/21/2007","granularity":"day","time":"2007/07/21 00:00:00 -0400"},"total":1,"longitude":-117.1162455,"id":"advy9tku0388","location":"Border Field SP"},"type":"Feature","geometry":{"type":"Point","coordinates":[-117.1162455,32.543512]}},{"properties":{"latitude":32.8377606,"date":{"end_time":"2007/07/23 00:00:00 -0400","original":"7/22/2007","granularity":"day","time":"2007/07/22 00:00:00 -0400"},"total":1,"longitude":-116.7783047,"id":"advy9trdv1hg","location":"Alpine"},"type":"Feature","geometry":{"type":"Point","coordinates":[-116.7783047,32.8377606]}},{"properties":{"latitude":31.4482569,"date":{"end_time":"2007/08/04 00:00:00 -0400","original":"8/3/2007","granularity":"day","time":"2007/08/03 00:00:00 -0400"},"total":1,"longitude":-110.3067604,"id":"advy9ttp2pzr","location":"Ramsey Canyon Inn"},"type":"Feature","geometry":{"type":"Point","coordinates":[-110.3067604,31.4482569]}},{"properties":{"latitude":32.4151791,"date":{"end_time":"2007/08/21 00:00:00 -0400","original":"8/20/2007","granularity":"day","time":"2007/08/20 00:00:00 -0400"},"total":1,"longitude":-110.7316114,"id":"advy9txh06ew","location":"Mt. Lemmon--Mt. Bigelow area"},"type":"Feature","geometry":{"type":"Point","coordinates":[-110.7316114,32.4151791]}},{"properties":{"latitude":32.0601277,"date":{"end_time":"2007/08/26 00:00:00 -0400","original":"8/25/2007","granularity":"day","time":"2007/08/25 00:00:00 -0400"},"total":1,"longitude":-110.0772732,"id":"advy9ti6dzxs","location":"Texas Canyon Rest Area"},"type":"Feature","geometry":{"type":"Point","coordinates":[-110.0772732,32.0601277]}},{"properties":{"latitude":31.9131554,"date":{"end_time":"2007/09/14 00:00:00 -0400","original":"9/13/2007","granularity":"day","time":"2007/09/13 00:00:00 -0400"},"total":1,"longitude":-109.2752981,"id":"advy9tnusfbf","location":"Barfoot Lookout"},"type":"Feature","geometry":{"type":"Point","coordinates":[-109.2752981,31.9131554]}},{"properties":{"latitude":31.9328003,"date":{"end_time":"2007/09/14 00:00:00 -0400","original":"9/13/2007","granularity":"day","time":"2007/09/13 00:00:00 -0400"},"total":1,"longitude":-109.2713013,"id":"advy9tj1p5h7","location":"Pinery Canyon"},"type":"Feature","geometry":{"type":"Point","coordinates":[-109.2713013,31.9328003]}},{"properties":{"latitude":32.7407148,"date":{"end_time":"2007/10/15 00:00:00 -0400","original":"10/14/2007","granularity":"day","time":"2007/10/14 00:00:00 -0400"},"total":1,"longitude":-110.6504989,"id":"advy9twl6xt1","location":"Mammoth Sewage Ponds"},"type":"Feature","geometry":{"type":"Point","coordinates":[-110.6504989,32.7407148]}},{"properties":{"latitude":32.2892958,"date":{"end_time":"2007/10/22 00:00:00 -0400","original":"10/21/2007","granularity":"day","time":"2007/10/21 00:00:00 -0400"},"total":1,"longitude":-110.9698494,"id":"advy9tjjyqlm","location":"Rillito River--Oracle Rd. to First Ave."},"type":"Feature","geometry":{"type":"Point","coordinates":[-110.9698494,32.2892958]}},{"properties":{"latitude":40.02103,"date":{"end_time":"2007/11/02 00:00:00 -0400","original":"11/1/2007","granularity":"day","time":"2007/11/01 00:00:00 -0400"},"total":1,"longitude":-105.26211,"id":"advy9ts9u47r","location":"Boulder"},"type":"Feature","geometry":{"type":"Point","coordinates":[-105.26211,40.02103]}},{"properties":{"latitude":39.977712,"date":{"end_time":"2007/11/03 00:00:00 -0400","original":"11/2/2007","granularity":"day","time":"2007/11/02 00:00:00 -0400"},"total":1,"longitude":-105.5097502,"id":"advy9tohn5q0","location":"Mud Lake Open Space"},"type":"Feature","geometry":{"type":"Point","coordinates":[-105.5097502,39.977712]}},{"properties":{"latitude":39.7432919,"date":{"end_time":"2007/11/05 00:00:00 -0500","original":"11/4/2007","granularity":"day","time":"2007/11/04 00:00:00 -0400"},"total":1,"longitude":-104.6004868,"id":"advy9tml61o3","location":"Watkins area"},"type":"Feature","geometry":{"type":"Point","coordinates":[-104.6004868,39.7432919]}},{"properties":{"latitude":32.2956722,"date":{"end_time":"2007/12/24 00:00:00 -0500","original":"12/23/2007","granularity":"day","time":"2007/12/23 00:00:00 -0500"},"total":1,"longitude":-106.7984207,"id":"advy9txd5aq0","location":"Burn Lake"},"type":"Feature","geometry":{"type":"Point","coordinates":[-106.7984207,32.2956722]}},{"properties":{"latitude":32.2714312,"date":{"end_time":"2007/12/24 00:00:00 -0500","original":"12/23/2007","granularity":"day","time":"2007/12/23 00:00:00 -0500"},"total":1,"longitude":-106.7804575,"id":"advy9tlk9s2f","location":"Mesilla Park"},"type":"Feature","geometry":{"type":"Point","coordinates":[-106.7804575,32.2714312]}},{"properties":{"latitude":33.459,"date":{"end_time":"2008/01/13 00:00:00 -0500","original":"1/12/2008","granularity":"day","time":"2008/01/12 00:00:00 -0500"},"total":1,"longitude":-111.482,"id":"advy9txtha8e","location":"Lost Dutchman SP"},"type":"Feature","geometry":{"type":"Point","coordinates":[-111.482,33.459]}},{"properties":{"latitude":32.8871014,"date":{"end_time":"2008/01/13 00:00:00 -0500","original":"1/12/2008","granularity":"day","time":"2008/01/12 00:00:00 -0500"},"total":1,"longitude":-111.7531121,"id":"advy9tqe3osw","location":"Casa Grande--Monk Parakeet colony"},"type":"Feature","geometry":{"type":"Point","coordinates":[-111.7531121,32.8871014]}},{"properties":{"latitude":32.3261613,"date":{"end_time":"2008/01/17 00:00:00 -0500","original":"1/16/2008","granularity":"day","time":"2008/01/16 00:00:00 -0500"},"total":1,"longitude":-110.8253574,"id":"advy9tvhs348","location":"Esperero Canyon"},"type":"Feature","geometry":{"type":"Point","coordinates":[-110.8253574,32.3261613]}},{"properties":{"latitude":19.6348271,"date":{"end_time":"2008/01/23 00:00:00 -0500","original":"1/22/2008","granularity":"day","time":"2008/01/22 00:00:00 -0500"},"total":1,"longitude":-155.9892082,"id":"advy9tiedrle","location":"Kailua-Kona Town Area (not wilderness or upper elevations!)"},"type":"Feature","geometry":{"type":"Point","coordinates":[-155.9892082,19.6348271]}},{"properties":{"latitude":20.0230325,"date":{"end_time":"2008/01/27 00:00:00 -0500","original":"1/26/2008","granularity":"day","time":"2008/01/26 00:00:00 -0500"},"total":1,"longitude":-155.6673431,"id":"advy9tog9ee1","location":"Waimea general"},"type":"Feature","geometry":{"type":"Point","coordinates":[-155.6673431,20.0230325]}},{"properties":{"latitude":32.2265432,"date":{"end_time":"2008/01/30 00:00:00 -0500","original":"1/29/2008","granularity":"day","time":"2008/01/29 00:00:00 -0500"},"total":1,"longitude":-110.9826422,"id":"advy9tm8qfoc","location":"Santa Cruz River Park--Speedway to Congress"},"type":"Feature","geometry":{"type":"Point","coordinates":[-110.9826422,32.2265432]}},{"properties":{"latitude":32.9100005,"date":{"end_time":"2008/02/07 00:00:00 -0500","original":"2/6/2008","granularity":"day","time":"2008/02/06 00:00:00 -0500"},"total":1,"longitude":-111.7894936,"id":"advy9tiwtkms","location":"Casa Grande WTP"},"type":"Feature","geometry":{"type":"Point","coordinates":[-111.7894936,32.9100005]}},{"properties":{"latitude":28.6231036,"date":{"end_time":"2008/02/07 00:00:00 -0500","original":"2/6/2008","granularity":"day","time":"2008/02/06 00:00:00 -0500"},"total":1,"longitude":-111.0168457,"id":"advy9ti86cie","location":"Hwy 15--Hermosillo to Guaymas"},"type":"Feature","geometry":{"type":"Point","coordinates":[-111.0168457,28.6231036]}},{"properties":{"latitude":32.97675,"date":{"end_time":"2008/03/23 00:00:00 -0400","original":"3/22/2008","granularity":"day","time":"2008/03/22 00:00:00 -0400"},"total":1,"longitude":-107.384544,"id":"advy9to1or8p","location":"Las Animas Creek (Sierra Co.)"},"type":"Feature","geometry":{"type":"Point","coordinates":[-107.384544,32.97675]}},{"properties":{"latitude":34.0717866,"date":{"end_time":"2008/03/25 00:00:00 -0400","original":"3/24/2008","granularity":"day","time":"2008/03/24 00:00:00 -0400"},"total":1,"longitude":-109.8551273,"id":"advy9tnryp4h","location":"McNary--old mill area (Apache Co.)"},"type":"Feature","geometry":{"type":"Point","coordinates":[-109.8551273,34.0717866]}},{"properties":{"latitude":32.6954438,"date":{"end_time":"2008/04/05 00:00:00 -0400","original":"4/4/2008","granularity":"day","time":"2008/04/04 00:00:00 -0400"},"total":1,"longitude":-110.6144714,"id":"advy9trxhmmj","location":"7B Ranch"},"type":"Feature","geometry":{"type":"Point","coordinates":[-110.6144714,32.6954438]}},{"properties":{"latitude":32.6003009,"date":{"end_time":"2008/04/12 00:00:00 -0400","original":"4/11/2008","granularity":"day","time":"2008/04/11 00:00:00 -0400"},"total":1,"longitude":-110.5358934,"id":"advy9to7q686","location":"San Pedro River--San Manuel Crossing"},"type":"Feature","geometry":{"type":"Point","coordinates":[-110.5358934,32.6003009]}},{"properties":{"latitude":33.9396572,"date":{"end_time":"2008/06/03 00:00:00 -0400","original":"6/2/2008","granularity":"day","time":"2008/06/02 00:00:00 -0400"},"total":1,"longitude":-118.4061813,"id":"advy9tw17k7h","location":"LAX"},"type":"Feature","geometry":{"type":"Point","coordinates":[-118.4061813,33.9396572]}},{"properties":{"latitude":39.9250745,"date":{"end_time":"2008/06/04 00:00:00 -0400","original":"6/3/2008","granularity":"day","time":"2008/06/03 00:00:00 -0400"},"total":1,"longitude":116.3963699,"id":"advy9tow6fz0","location":"Jingshan Park/Forbidden City area"},"type":"Feature","geometry":{"type":"Point","coordinates":[116.3963699,39.9250745]}},{"properties":{"latitude":49.19626,"date":{"end_time":"2008/06/04 00:00:00 -0400","original":"6/3/2008","granularity":"day","time":"2008/06/03 00:00:00 -0400"},"total":1,"longitude":-123.20307,"id":"advy9trft4wm","location":"Vancouver--airport"},"type":"Feature","geometry":{"type":"Point","coordinates":[-123.20307,49.19626]}},{"properties":{"latitude":40.3607296,"date":{"end_time":"2008/06/06 00:00:00 -0400","original":"6/5/2008","granularity":"day","time":"2008/06/05 00:00:00 -0400"},"total":1,"longitude":115.9901998,"id":"advy9tosm69j","location":"Baidaling"},"type":"Feature","geometry":{"type":"Point","coordinates":[115.9901998,40.3607296]}},{"properties":{"latitude":34.2906849,"date":{"end_time":"2008/06/09 00:00:00 -0400","original":"6/8/2008","granularity":"day","time":"2008/06/08 00:00:00 -0400"},"total":1,"longitude":109.0860736,"id":"advy9trpk0o9","location":"Xi'an--Ba River park (east of Xi'an)"},"type":"Feature","geometry":{"type":"Point","coordinates":[109.0860736,34.2906849]}},{"properties":{"latitude":37.1876726,"date":{"end_time":"2008/06/09 00:00:00 -0400","original":"6/8/2008","granularity":"day","time":"2008/06/08 00:00:00 -0400"},"total":1,"longitude":112.1824265,"id":"advy9tjge6xp","location":"Pingyao outskirts and fields"},"type":"Feature","geometry":{"type":"Point","coordinates":[112.1824265,37.1876726]}},{"properties":{"latitude":34.3846356,"date":{"end_time":"2008/06/13 00:00:00 -0400","original":"6/12/2008","granularity":"day","time":"2008/06/12 00:00:00 -0400"},"total":1,"longitude":109.2760062,"id":"advy9ttz7632","location":"Xi'an--Terra Cotta Warriors site"},"type":"Feature","geometry":{"type":"Point","coordinates":[109.2760062,34.3846356]}},{"properties":{"latitude":21.8665968,"date":{"end_time":"2008/06/21 00:00:00 -0400","original":"6/20/2008","granularity":"day","time":"2008/06/20 00:00:00 -0400"},"total":1,"longitude":101.3653564,"id":"advy9tiaiguw","location":"South of Jinghong"},"type":"Feature","geometry":{"type":"Point","coordinates":[101.3653564,21.8665968]}},{"properties":{"latitude":19.8306632,"date":{"end_time":"2008/06/28 00:00:00 -0400","original":"6/27/2008","granularity":"day","time":"2008/06/27 00:00:00 -0400"},"total":1,"longitude":102.1035004,"id":"advy9tktxgzo","location":"Tat Kuang Si Falls"},"type":"Feature","geometry":{"type":"Point","coordinates":[102.1035004,19.8306632]}},{"properties":{"latitude":18.910996,"date":{"end_time":"2008/07/01 00:00:00 -0400","original":"6/30/2008","granularity":"day","time":"2008/06/30 00:00:00 -0400"},"total":1,"longitude":102.4421024,"id":"advy9twfjp4w","location":"Pha Lao area (open space along river)"},"type":"Feature","geometry":{"type":"Point","coordinates":[102.4421024,18.910996]}},{"properties":{"latitude":13.4125,"date":{"end_time":"2008/07/05 00:00:00 -0400","original":"7/4/2008","granularity":"day","time":"2008/07/04 00:00:00 -0400"},"total":1,"longitude":103.8668,"id":"advy9tu3kz3b","location":"Angkor Wat"},"type":"Feature","geometry":{"type":"Point","coordinates":[103.8668,13.4125]}},{"properties":{"latitude":13.3608947,"date":{"end_time":"2008/07/05 00:00:00 -0400","original":"7/4/2008","granularity":"day","time":"2008/07/04 00:00:00 -0400"},"total":1,"longitude":103.857193,"id":"advy9tsq3b7f","location":"Siem Reap"},"type":"Feature","geometry":{"type":"Point","coordinates":[103.857193,13.3608947]}},{"properties":{"latitude":12.0312619,"date":{"end_time":"2008/07/19 00:00:00 -0400","original":"7/18/2008","granularity":"day","time":"2008/07/18 00:00:00 -0400"},"total":1,"longitude":102.7386475,"id":"advy9tnqrv2p","location":"Trat area - Thailand"},"type":"Feature","geometry":{"type":"Point","coordinates":[102.7386475,12.0312619]}},{"properties":{"latitude":18.7912677,"date":{"end_time":"2008/07/28 00:00:00 -0400","original":"7/27/2008","granularity":"day","time":"2008/07/27 00:00:00 -0400"},"total":1,"longitude":98.9847565,"id":"advy9tolwuji","location":"Chang Mai - General"},"type":"Feature","geometry":{"type":"Point","coordinates":[98.9847565,18.7912677]}},{"properties":{"latitude":28.2011036,"date":{"end_time":"2008/08/12 00:00:00 -0400","original":"8/11/2008","granularity":"day","time":"2008/08/11 00:00:00 -0400"},"total":1,"longitude":83.953743,"id":"advy9tv1bwl9","location":"Pokhara--Climbs to World Peace Pagoda"},"type":"Feature","geometry":{"type":"Point","coordinates":[83.953743,28.2011036]}},{"properties":{"latitude":26.7750394,"date":{"end_time":"2008/08/20 00:00:00 -0400","original":"8/19/2008","granularity":"day","time":"2008/08/19 00:00:00 -0400"},"total":1,"longitude":82.5210571,"id":"advy9tjpx66u","location":"Gorahkpur - Lucknow Railway"},"type":"Feature","geometry":{"type":"Point","coordinates":[82.5210571,26.7750394]}},{"properties":{"latitude":27.4607579,"date":{"end_time":"2008/08/20 00:00:00 -0400","original":"8/19/2008","granularity":"day","time":"2008/08/19 00:00:00 -0400"},"total":1,"longitude":83.4535217,"id":"advy9tru1cij","location":"Sunauli (India side)"},"type":"Feature","geometry":{"type":"Point","coordinates":[83.4535217,27.4607579]}},{"properties":{"latitude":26.3623421,"date":{"end_time":"2008/08/21 00:00:00 -0400","original":"8/20/2008","granularity":"day","time":"2008/08/20 00:00:00 -0400"},"total":1,"longitude":79.7937012,"id":"advy9tvgmdxh","location":"Lucknow - Agra Highway"},"type":"Feature","geometry":{"type":"Point","coordinates":[79.7937012,26.3623421]}},{"properties":{"latitude":28.6664912,"date":{"end_time":"2008/09/08 00:00:00 -0400","original":"9/7/2008","granularity":"day","time":"2008/09/07 00:00:00 -0400"},"total":1,"longitude":77.2410965,"id":"advy9tvm53qe","location":"Dehli - river channel"},"type":"Feature","geometry":{"type":"Point","coordinates":[77.2410965,28.6664912]}},{"properties":{"latitude":44.1260423,"date":{"end_time":"2008/09/14 00:00:00 -0400","original":"9/13/2008","granularity":"day","time":"2008/09/13 00:00:00 -0400"},"total":1,"longitude":25.9895325,"id":"advy9tqa1e2i","location":"Ruse - Bucharest train route"},"type":"Feature","geometry":{"type":"Point","coordinates":[25.9895325,44.1260423]}},{"properties":{"latitude":43.3691191,"date":{"end_time":"2008/09/14 00:00:00 -0400","original":"9/13/2008","granularity":"day","time":"2008/09/13 00:00:00 -0400"},"total":1,"longitude":25.7162476,"id":"advy9tns74nk","location":"Ruse - Tirnovo train route"},"type":"Feature","geometry":{"type":"Point","coordinates":[25.7162476,43.3691191]}},{"properties":{"latitude":44.4416242,"date":{"end_time":"2008/09/14 00:00:00 -0400","original":"9/13/2008","granularity":"day","time":"2008/09/13 00:00:00 -0400"},"total":1,"longitude":26.0925293,"id":"advy9tu16j92","location":"Bucharest general"},"type":"Feature","geometry":{"type":"Point","coordinates":[26.0925293,44.4416242]}},{"properties":{"latitude":45.6387674,"date":{"end_time":"2008/09/17 00:00:00 -0400","original":"9/16/2008","granularity":"day","time":"2008/09/16 00:00:00 -0400"},"total":1,"longitude":25.5981445,"id":"advy9tmcnsje","location":"Brasov - Mt.Tampa"},"type":"Feature","geometry":{"type":"Point","coordinates":[25.5981445,45.6387674]}},{"properties":{"latitude":47.5146501,"date":{"end_time":"2008/09/24 00:00:00 -0400","original":"9/23/2008","granularity":"day","time":"2008/09/23 00:00:00 -0400"},"total":1,"longitude":19.0837669,"id":"advy9tvxgd9z","location":"Budapest City Park"},"type":"Feature","geometry":{"type":"Point","coordinates":[19.0837669,47.5146501]}},{"properties":{"latitude":53.3521908,"date":{"end_time":"2008/09/28 00:00:00 -0400","original":"9/27/2008","granularity":"day","time":"2008/09/27 00:00:00 -0400"},"total":1,"longitude":-6.2677002,"id":"advy9txxbfv9","location":"Dublin"},"type":"Feature","geometry":{"type":"Point","coordinates":[-6.2677002,53.3521908]}},{"properties":{"latitude":53.1850532,"date":{"end_time":"2008/09/29 00:00:00 -0400","original":"9/28/2008","granularity":"day","time":"2008/09/28 00:00:00 -0400"},"total":1,"longitude":-6.0764694,"id":"advy9toysmfb","location":"Bray Head"},"type":"Feature","geometry":{"type":"Point","coordinates":[-6.0764694,53.1850532]}},{"properties":{"latitude":43.0804787,"date":{"end_time":"2008/10/09 00:00:00 -0400","original":"10/8/2008","granularity":"day","time":"2008/10/08 00:00:00 -0400"},"total":1,"longitude":-79.0782702,"id":"advy9tr82bz4","location":"Niagara--Below the Falls (ON)"},"type":"Feature","geometry":{"type":"Point","coordinates":[-79.0782702,43.0804787]}},{"properties":{"latitude":43.2554632,"date":{"end_time":"2008/10/09 00:00:00 -0400","original":"10/8/2008","granularity":"day","time":"2008/10/08 00:00:00 -0400"},"total":1,"longitude":-79.1146839,"id":"advy9trum6as","location":"Niagara-on-the-Lake--Niagara Shores CA"},"type":"Feature","geometry":{"type":"Point","coordinates":[-79.1146839,43.2554632]}},{"properties":{"latitude":-12.7903748,"date":{"end_time":"2008/10/11 00:00:00 -0400","original":"10/10/2008","granularity":"day","time":"2008/10/10 00:00:00 -0400"},"total":1,"longitude":-76.5719604,"id":"advy9tuueuhr","location":"Highway south of Lima to Pisco"},"type":"Feature","geometry":{"type":"Point","coordinates":[-76.5719604,-12.7903748]}},{"properties":{"latitude":-13.6820163,"date":{"end_time":"2008/10/12 00:00:00 -0400","original":"10/11/2008","granularity":"day","time":"2008/10/11 00:00:00 -0400"},"total":1,"longitude":-76.2145615,"id":"advy9tnvry4d","location":"Boca del Río Pisco"},"type":"Feature","geometry":{"type":"Point","coordinates":[-76.2145615,-13.6820163]}},{"properties":{"latitude":-13.5711944,"date":{"end_time":"2008/10/14 00:00:00 -0400","original":"10/13/2008","granularity":"day","time":"2008/10/13 00:00:00 -0400"},"total":1,"longitude":-72.8913611,"id":"advy9ty0mm70","location":"Bosque Ampay"},"type":"Feature","geometry":{"type":"Point","coordinates":[-72.8913611,-13.5711944]}},{"properties":{"latitude":-13.5069885,"date":{"end_time":"2008/10/14 00:00:00 -0400","original":"10/13/2008","granularity":"day","time":"2008/10/13 00:00:00 -0400"},"total":1,"longitude":-71.9803619,"id":"advy9tmpo47m","location":"Sacsayhuaman area"},"type":"Feature","geometry":{"type":"Point","coordinates":[-71.9803619,-13.5069885]}},{"properties":{"latitude":-13.1572804,"date":{"end_time":"2008/10/20 00:00:00 -0400","original":"10/19/2008","granularity":"day","time":"2008/10/19 00:00:00 -0400"},"total":1,"longitude":-72.5361371,"id":"advy9tna9isl","location":"Cerro Putukusi"},"type":"Feature","geometry":{"type":"Point","coordinates":[-72.5361371,-13.1572804]}},{"properties":{"latitude":-13.1150667,"date":{"end_time":"2008/10/22 00:00:00 -0400","original":"10/21/2008","granularity":"day","time":"2008/10/21 00:00:00 -0400"},"total":1,"longitude":-72.3490667,"id":"advy9tobb1ij","location":"Abra Malaga (Valqui B2)"},"type":"Feature","geometry":{"type":"Point","coordinates":[-72.3490667,-13.1150667]}},{"properties":{"latitude":-13.6141333,"date":{"end_time":"2008/10/23 00:00:00 -0400","original":"10/22/2008","granularity":"day","time":"2008/10/22 00:00:00 -0400"},"total":1,"longitude":-71.7312333,"id":"advy9tmu4196","location":"Huacarpay"},"type":"Feature","geometry":{"type":"Point","coordinates":[-71.7312333,-13.6141333]}},{"properties":{"latitude":-15.4827983,"date":{"end_time":"2008/10/25 00:00:00 -0400","original":"10/24/2008","granularity":"day","time":"2008/10/24 00:00:00 -0400"},"total":1,"longitude":-70.1449585,"id":"advy9ts0fn2e","location":"Juliaca area"},"type":"Feature","geometry":{"type":"Point","coordinates":[-70.1449585,-15.4827983]}},{"properties":{"latitude":-16.3491323,"date":{"end_time":"2008/10/29 00:00:00 -0400","original":"10/28/2008","granularity":"day","time":"2008/10/28 00:00:00 -0400"},"total":1,"longitude":-68.1227875,"id":"advy9tm19ar0","location":"Chacaltaya (ski area and around)"},"type":"Feature","geometry":{"type":"Point","coordinates":[-68.1227875,-16.3491323]}},{"properties":{"latitude":-18.6774713,"date":{"end_time":"2008/10/31 00:00:00 -0400","original":"10/30/2008","granularity":"day","time":"2008/10/30 00:00:00 -0400"},"total":1,"longitude":-66.8930054,"id":"advy9tnf9tle","location":"Oruro to Potosi"},"type":"Feature","geometry":{"type":"Point","coordinates":[-66.8930054,-18.6774713]}},{"properties":{"latitude":-19.4950751,"date":{"end_time":"2008/11/02 00:00:00 -0400","original":"11/1/2008","granularity":"day","time":"2008/11/01 00:00:00 -0400"},"total":1,"longitude":-65.2258301,"id":"advy9tqtsdmb","location":"Potosi to Sucre"},"type":"Feature","geometry":{"type":"Point","coordinates":[-65.2258301,-19.4950751]}},{"properties":{"latitude":-19.1750853,"date":{"end_time":"2008/11/03 00:00:00 -0500","original":"11/2/2008","granularity":"day","time":"2008/11/02 00:00:00 -0400"},"total":1,"longitude":-64.916153,"id":"advy9txmo8jx","location":"Tarabuco"},"type":"Feature","geometry":{"type":"Point","coordinates":[-64.916153,-19.1750853]}},{"properties":{"latitude":-19.0528999,"date":{"end_time":"2008/11/04 00:00:00 -0500","original":"11/3/2008","granularity":"day","time":"2008/11/03 00:00:00 -0500"},"total":1,"longitude":-65.2679729,"id":"advy9tpakcev","location":"Sucre cemetary"},"type":"Feature","geometry":{"type":"Point","coordinates":[-65.2679729,-19.0528999]}},{"properties":{"latitude":-17.982054,"date":{"end_time":"2008/11/05 00:00:00 -0500","original":"11/4/2008","granularity":"day","time":"2008/11/04 00:00:00 -0500"},"total":1,"longitude":-64.027461,"id":"advy9tvxvwm1","location":"Carretera Antigua between Santa Cruz and Comarapa"},"type":"Feature","geometry":{"type":"Point","coordinates":[-64.027461,-17.982054]}},{"properties":{"latitude":-17.788574,"date":{"end_time":"2008/11/07 00:00:00 -0500","original":"11/6/2008","granularity":"day","time":"2008/11/06 00:00:00 -0500"},"total":1,"longitude":-63.2863998,"id":"advy9tlk2odm","location":"Biocentro Guembe, Santa Cruz"},"type":"Feature","geometry":{"type":"Point","coordinates":[-63.2863998,-17.788574]}},{"properties":{"latitude":-21.447956,"date":{"end_time":"2008/11/12 00:00:00 -0500","original":"11/11/2008","granularity":"day","time":"2008/11/11 00:00:00 -0500"},"total":1,"longitude":-61.3806152,"id":"advy9tr2fpv5","location":"Chaco - Highway 9 roadside"},"type":"Feature","geometry":{"type":"Point","coordinates":[-61.3806152,-21.447956]}},{"properties":{"latitude":-25.5470879,"date":{"end_time":"2008/11/13 00:00:00 -0500","original":"11/12/2008","granularity":"day","time":"2008/11/12 00:00:00 -0500"},"total":1,"longitude":-54.5879745,"id":"advy9tsjc3z4","location":"Foz do Iguaçu"},"type":"Feature","geometry":{"type":"Point","coordinates":[-54.5879745,-25.5470879]}},{"properties":{"latitude":-25.5986648,"date":{"end_time":"2008/11/13 00:00:00 -0500","original":"11/12/2008","granularity":"day","time":"2008/11/12 00:00:00 -0500"},"total":1,"longitude":-54.5740206,"id":"advy9tunv8wv","location":"Puerto Iguazu"},"type":"Feature","geometry":{"type":"Point","coordinates":[-54.5740206,-25.5986648]}},{"properties":{"latitude":-25.6004,"date":{"end_time":"2008/11/15 00:00:00 -0500","original":"11/14/2008","granularity":"day","time":"2008/11/14 00:00:00 -0500"},"total":1,"longitude":-54.56865,"id":"advy9tno1wa8","location":"Jardin de Picaflores, Pto. Iguazú"},"type":"Feature","geometry":{"type":"Point","coordinates":[-54.56865,-25.6004]}},{"properties":{"latitude":-33.0915415,"date":{"end_time":"2008/11/16 00:00:00 -0500","original":"11/15/2008","granularity":"day","time":"2008/11/15 00:00:00 -0500"},"total":1,"longitude":-56.4697266,"id":"advy9trl1c4b","location":"Salto to Montevideo drive"},"type":"Feature","geometry":{"type":"Point","coordinates":[-56.4697266,-33.0915415]}},{"properties":{"latitude":-31.3841236,"date":{"end_time":"2008/11/16 00:00:00 -0500","original":"11/15/2008","granularity":"day","time":"2008/11/15 00:00:00 -0500"},"total":1,"longitude":-58.0490112,"id":"advy9tosj86f","location":"Concordia area, Argentina"},"type":"Feature","geometry":{"type":"Point","coordinates":[-58.0490112,-31.3841236]}},{"properties":{"latitude":-34.9197542,"date":{"end_time":"2008/11/17 00:00:00 -0500","original":"11/16/2008","granularity":"day","time":"2008/11/16 00:00:00 -0500"},"total":1,"longitude":-56.1720228,"id":"advy9tnin5ek","location":"Montevideo - boat club area"},"type":"Feature","geometry":{"type":"Point","coordinates":[-56.1720228,-34.9197542]}},{"properties":{"latitude":-34.5408535,"date":{"end_time":"2008/11/18 00:00:00 -0500","original":"11/17/2008","granularity":"day","time":"2008/11/17 00:00:00 -0500"},"total":1,"longitude":-58.442502,"id":"advy9tjk6vqi","location":"Universidad de Buenos Aires"},"type":"Feature","geometry":{"type":"Point","coordinates":[-58.442502,-34.5408535]}},{"properties":{"latitude":38.9490715,"date":{"end_time":"2008/11/21 00:00:00 -0500","original":"11/20/2008","granularity":"day","time":"2008/11/20 00:00:00 -0500"},"total":1,"longitude":-77.3883283,"id":"advy9tlykr3m","location":"Dulles Access Toll Road Wetlands (fairfax Co.)"},"type":"Feature","geometry":{"type":"Point","coordinates":[-77.3883283,38.9490715]}},{"properties":{"latitude":35.669151,"date":{"end_time":"2008/11/25 00:00:00 -0500","original":"11/24/2008","granularity":"day","time":"2008/11/24 00:00:00 -0500"},"total":1,"longitude":-106.3517761,"id":"advy9tp2f1s8","location":"Kasha-Katuwe Tent Rocks NM"},"type":"Feature","geometry":{"type":"Point","coordinates":[-106.3517761,35.669151]}},{"properties":{"latitude":32.2403921,"date":{"end_time":"2008/12/13 00:00:00 -0500","original":"12/12/2008","granularity":"day","time":"2008/12/12 00:00:00 -0500"},"total":1,"longitude":-110.6254578,"id":"advy9twc2pm3","location":"Bridal Veil Falls area - Saguaro NP East"},"type":"Feature","geometry":{"type":"Point","coordinates":[-110.6254578,32.2403921]}},{"properties":{"latitude":26.9963643,"date":{"end_time":"2009/02/23 00:00:00 -0500","original":"2/22/2009","granularity":"day","time":"2009/02/22 00:00:00 -0500"},"total":1,"longitude":-108.9402044,"id":"advy9tjfivvy","location":"Sierra de Alamos - TDF above dump"},"type":"Feature","geometry":{"type":"Point","coordinates":[-108.9402044,26.9963643]}},{"properties":{"latitude":27.05901,"date":{"end_time":"2009/02/24 00:00:00 -0500","original":"2/23/2009","granularity":"day","time":"2009/02/23 00:00:00 -0500"},"total":1,"longitude":-109.97825,"id":"advy9tqk1nhj","location":"AICA SISTEMA TOBARI"},"type":"Feature","geometry":{"type":"Point","coordinates":[-109.97825,27.05901]}},{"properties":{"latitude":31.3435712,"date":{"end_time":"2009/03/02 00:00:00 -0500","original":"3/1/2009","granularity":"day","time":"2009/03/01 00:00:00 -0500"},"total":1,"longitude":-109.0694914,"id":"advy9tweevrn","location":"Guadalupe Canyon (Cochise Co.)"},"type":"Feature","geometry":{"type":"Point","coordinates":[-109.0694914,31.3435712]}},{"properties":{"latitude":31.3371,"date":{"end_time":"2009/03/02 00:00:00 -0500","original":"3/1/2009","granularity":"day","time":"2009/03/01 00:00:00 -0500"},"total":1,"longitude":-109.2787,"id":"advy9tn8zp79","location":"Slaughter Ranch"},"type":"Feature","geometry":{"type":"Point","coordinates":[-109.2787,31.3371]}},{"properties":{"latitude":31.59073,"date":{"end_time":"2009/03/19 00:00:00 -0400","original":"3/18/2009","granularity":"day","time":"2009/03/18 00:00:00 -0400"},"total":1,"longitude":-110.51038,"id":"advy9tuvxiow","location":"Appleton-Whittell Research Ranch"},"type":"Feature","geometry":{"type":"Point","coordinates":[-110.51038,31.59073]}},{"properties":{"latitude":33.3210796,"date":{"end_time":"2009/03/24 00:00:00 -0400","original":"3/23/2009","granularity":"day","time":"2009/03/23 00:00:00 -0400"},"total":1,"longitude":-108.8802463,"id":"advy9ts7vzst","location":"Glenwood Fish Hatchery"},"type":"Feature","geometry":{"type":"Point","coordinates":[-108.8802463,33.3210796]}},{"properties":{"latitude":33.375532,"date":{"end_time":"2009/03/24 00:00:00 -0400","original":"3/23/2009","granularity":"day","time":"2009/03/23 00:00:00 -0400"},"total":1,"longitude":-108.8356075,"id":"advy9tjwkyr3","location":"Catwalk National Recreation Trail"},"type":"Feature","geometry":{"type":"Point","coordinates":[-108.8356075,33.375532]}},{"properties":{"latitude":31.8865151,"date":{"end_time":"2009/05/23 00:00:00 -0400","original":"5/22/2009","granularity":"day","time":"2009/05/22 00:00:00 -0400"},"total":1,"longitude":-110.9685629,"id":"advy9tm7jxkr","location":"Continental Maintenance Yard"},"type":"Feature","geometry":{"type":"Point","coordinates":[-110.9685629,31.8865151]}},{"properties":{"latitude":31.6961496,"date":{"end_time":"2009/06/22 00:00:00 -0400","original":"6/21/2009","granularity":"day","time":"2009/06/21 00:00:00 -0400"},"total":1,"longitude":-110.8481126,"id":"advy9tndlej0","location":"Mt. Wrightson"},"type":"Feature","geometry":{"type":"Point","coordinates":[-110.8481126,31.6961496]}},{"properties":{"latitude":37.1847222,"date":{"end_time":"2009/07/13 00:00:00 -0400","original":"7/12/2009","granularity":"day","time":"2009/07/12 00:00:00 -0400"},"total":1,"longitude":-108.4877778,"id":"advy9tvdpclj","location":"Mesa Verde NP"},"type":"Feature","geometry":{"type":"Point","coordinates":[-108.4877778,37.1847222]}},{"properties":{"latitude":37.8043589,"date":{"end_time":"2009/07/14 00:00:00 -0400","original":"7/13/2009","granularity":"day","time":"2009/07/13 00:00:00 -0400"},"total":1,"longitude":-107.7652359,"id":"advy9tj3ebkr","location":"S. Mineral Creek near Silverton"},"type":"Feature","geometry":{"type":"Point","coordinates":[-107.7652359,37.8043589]}},{"properties":{"latitude":38.4404806,"date":{"end_time":"2009/07/16 00:00:00 -0400","original":"7/15/2009","granularity":"day","time":"2009/07/15 00:00:00 -0400"},"total":1,"longitude":-107.8699493,"id":"advy9tr56rjd","location":"Chipeta Lake SWA"},"type":"Feature","geometry":{"type":"Point","coordinates":[-107.8699493,38.4404806]}},{"properties":{"latitude":37.9485293,"date":{"end_time":"2009/07/16 00:00:00 -0400","original":"7/15/2009","granularity":"day","time":"2009/07/15 00:00:00 -0400"},"total":1,"longitude":-107.9777527,"id":"advy9tv8nn7a","location":"camping near Telluride"},"type":"Feature","geometry":{"type":"Point","coordinates":[-107.9777527,37.9485293]}},{"properties":{"latitude":38.4707937,"date":{"end_time":"2009/07/17 00:00:00 -0400","original":"7/16/2009","granularity":"day","time":"2009/07/16 00:00:00 -0400"},"total":1,"longitude":-107.1846771,"id":"advy9tnfw82g","location":"Blue Mesa Reservoir"},"type":"Feature","geometry":{"type":"Point","coordinates":[-107.1846771,38.4707937]}},{"properties":{"latitude":40.2985777,"date":{"end_time":"2009/07/21 00:00:00 -0400","original":"7/20/2009","granularity":"day","time":"2009/07/20 00:00:00 -0400"},"total":1,"longitude":-105.168643,"id":"advy9ti6sx29","location":"Dry Creek Reservoir"},"type":"Feature","geometry":{"type":"Point","coordinates":[-105.168643,40.2985777]}},{"properties":{"latitude":40.4411335,"date":{"end_time":"2009/07/21 00:00:00 -0400","original":"7/20/2009","granularity":"day","time":"2009/07/20 00:00:00 -0400"},"total":1,"longitude":-105.7550383,"id":"advy9trlws0q","location":"RMNP--Trail Ridge Road--Alpine Visitor Center"},"type":"Feature","geometry":{"type":"Point","coordinates":[-105.7550383,40.4411335]}},{"properties":{"latitude":35.820335,"date":{"end_time":"2009/07/23 00:00:00 -0400","original":"7/22/2009","granularity":"day","time":"2009/07/22 00:00:00 -0400"},"total":1,"longitude":-106.6052396,"id":"advy9towl7xn","location":"Jemez Falls"},"type":"Feature","geometry":{"type":"Point","coordinates":[-106.6052396,35.820335]}},{"properties":{"latitude":35.7825972,"date":{"end_time":"2009/07/23 00:00:00 -0400","original":"7/22/2009","granularity":"day","time":"2009/07/22 00:00:00 -0400"},"total":1,"longitude":-106.2743193,"id":"advy9trbw0mg","location":"Bandelier NM -- Main Loop Trail"},"type":"Feature","geometry":{"type":"Point","coordinates":[-106.2743193,35.7825972]}},{"properties":{"latitude":35.8679083,"date":{"end_time":"2009/07/23 00:00:00 -0400","original":"7/22/2009","granularity":"day","time":"2009/07/22 00:00:00 -0400"},"total":1,"longitude":-106.4781189,"id":"advy9tt8g359","location":"Valles Caldera NM"},"type":"Feature","geometry":{"type":"Point","coordinates":[-106.4781189,35.8679083]}},{"properties":{"latitude":35.1466675,"date":{"end_time":"2009/08/10 00:00:00 -0400","original":"8/9/2009","granularity":"day","time":"2009/08/09 00:00:00 -0400"},"total":1,"longitude":-89.9866638,"id":"advy9tialer9","location":"Overton Park"},"type":"Feature","geometry":{"type":"Point","coordinates":[-89.9866638,35.1466675]}},{"properties":{"latitude":35.0900498,"date":{"end_time":"2009/08/11 00:00:00 -0400","original":"8/10/2009","granularity":"day","time":"2009/08/10 00:00:00 -0400"},"total":1,"longitude":-89.8648489,"id":"advy9tpx2618","location":"Lichterman Nature Center"},"type":"Feature","geometry":{"type":"Point","coordinates":[-89.8648489,35.0900498]}},{"properties":{"latitude":33.2909338,"date":{"end_time":"2009/08/12 00:00:00 -0400","original":"8/11/2009","granularity":"day","time":"2009/08/11 00:00:00 -0400"},"total":1,"longitude":-91.1642075,"id":"advy9tho36vg","location":"Mississippi River--Highway 82 Bridge"},"type":"Feature","geometry":{"type":"Point","coordinates":[-91.1642075,33.2909338]}},{"properties":{"latitude":34.7375922,"date":{"end_time":"2009/08/12 00:00:00 -0400","original":"8/11/2009","granularity":"day","time":"2009/08/11 00:00:00 -0400"},"total":1,"longitude":-90.4463196,"id":"advy9thyhqdf","location":"Mhoon Landing Park"},"type":"Feature","geometry":{"type":"Point","coordinates":[-90.4463196,34.7375922]}},{"properties":{"latitude":33.1668,"date":{"end_time":"2009/08/12 00:00:00 -0400","original":"8/11/2009","granularity":"day","time":"2009/08/11 00:00:00 -0400"},"total":1,"longitude":-92.1414,"id":"advy9tx5ppr8","location":"Felsenthal NWR"},"type":"Feature","geometry":{"type":"Point","coordinates":[-92.1414,33.1668]}},{"properties":{"latitude":32.4987953,"date":{"end_time":"2009/08/12 00:00:00 -0400","original":"8/11/2009","granularity":"day","time":"2009/08/11 00:00:00 -0400"},"total":1,"longitude":-93.7091732,"id":"advy9txxqfnk","location":"Veterans Park (Stoner Woods)"},"type":"Feature","geometry":{"type":"Point","coordinates":[-93.7091732,32.4987953]}},{"properties":{"latitude":33.1725,"date":{"end_time":"2009/08/12 00:00:00 -0400","original":"8/11/2009","granularity":"day","time":"2009/08/11 00:00:00 -0400"},"total":1,"longitude":-91.8155,"id":"advy9tpjq7e8","location":"Levi Wilcoxon Trail"},"type":"Feature","geometry":{"type":"Point","coordinates":[-91.8155,33.1725]}},{"properties":{"latitude":32.4947052,"date":{"end_time":"2009/08/13 00:00:00 -0400","original":"8/12/2009","granularity":"day","time":"2009/08/12 00:00:00 -0400"},"total":1,"longitude":-94.2160034,"id":"advy9totfhqc","location":"East Texas"},"type":"Feature","geometry":{"type":"Point","coordinates":[-94.2160034,32.4947052]}},{"properties":{"latitude":32.4031538,"date":{"end_time":"2009/08/14 00:00:00 -0400","original":"8/13/2009","granularity":"day","time":"2009/08/13 00:00:00 -0400"},"total":1,"longitude":-97.1658325,"id":"advy9tllggwx","location":"Central Texas general"},"type":"Feature","geometry":{"type":"Point","coordinates":[-97.1658325,32.4031538]}},{"properties":{"latitude":32.8882366,"date":{"end_time":"2009/08/15 00:00:00 -0400","original":"8/14/2009","granularity":"day","time":"2009/08/14 00:00:00 -0400"},"total":1,"longitude":-105.4811096,"id":"advy9tu9biyp","location":"Mayhill area - Lincoln NF"},"type":"Feature","geometry":{"type":"Point","coordinates":[-105.4811096,32.8882366]}},{"properties":{"latitude":32.8571008,"date":{"end_time":"2009/08/15 00:00:00 -0400","original":"8/14/2009","granularity":"day","time":"2009/08/14 00:00:00 -0400"},"total":1,"longitude":-103.793807,"id":"advy9tnbp7o7","location":"Maljamar Rest Area"},"type":"Feature","geometry":{"type":"Point","coordinates":[-103.793807,32.8571008]}},{"properties":{"latitude":32.435613,"date":{"end_time":"2009/08/15 00:00:00 -0400","original":"8/14/2009","granularity":"day","time":"2009/08/14 00:00:00 -0400"},"total":1,"longitude":-100.3115273,"id":"advy9tlg4fo6","location":"Lake Sweetwater"},"type":"Feature","geometry":{"type":"Point","coordinates":[-100.3115273,32.435613]}},{"properties":{"latitude":56.8169289,"date":{"end_time":"2009/08/22 00:00:00 -0400","original":"8/21/2009","granularity":"day","time":"2009/08/21 00:00:00 -0400"},"total":1,"longitude":-132.9498653,"id":"advy9thshwxr","location":"Petersburg--North Nordic Drive to Hungry Point"},"type":"Feature","geometry":{"type":"Point","coordinates":[-132.9498653,56.8169289]}},{"properties":{"latitude":56.7921688,"date":{"end_time":"2009/08/22 00:00:00 -0400","original":"8/21/2009","granularity":"day","time":"2009/08/21 00:00:00 -0400"},"total":1,"longitude":-132.9822729,"id":"advy9tp3vqtp","location":"Petersburg--Mitkof Highway"},"type":"Feature","geometry":{"type":"Point","coordinates":[-132.9822729,56.7921688]}},{"properties":{"latitude":31.5222886,"date":{"end_time":"2009/09/02 00:00:00 -0400","original":"9/1/2009","granularity":"day","time":"2009/09/01 00:00:00 -0400"},"total":1,"longitude":-110.7033572,"id":"advy9titxy3r","location":"Spirit Tree Inn"},"type":"Feature","geometry":{"type":"Point","coordinates":[-110.7033572,31.5222886]}},{"properties":{"latitude":31.388,"date":{"end_time":"2009/10/07 00:00:00 -0400","original":"10/6/2009","granularity":"day","time":"2009/10/06 00:00:00 -0400"},"total":1,"longitude":-110.959,"id":"advy9tmoyv19","location":"Palo Duro Creek Golf Course Ponds"},"type":"Feature","geometry":{"type":"Point","coordinates":[-110.959,31.388]}},{"properties":{"latitude":32.7031,"date":{"end_time":"2009/10/11 00:00:00 -0400","original":"10/10/2009","granularity":"day","time":"2009/10/10 00:00:00 -0400"},"total":1,"longitude":-113.9606667,"id":"advy9tsz5qqr","location":"Tacna slop ponds"},"type":"Feature","geometry":{"type":"Point","coordinates":[-113.9606667,32.7031]}},{"properties":{"latitude":32.8201946,"date":{"end_time":"2009/10/11 00:00:00 -0400","original":"10/10/2009","granularity":"day","time":"2009/10/10 00:00:00 -0400"},"total":1,"longitude":-117.0568398,"id":"advy9tvktfm5","location":"Mission Trails Regional Park--Visitor Center and loop trails"},"type":"Feature","geometry":{"type":"Point","coordinates":[-117.0568398,32.8201946]}},{"properties":{"latitude":32.6369271,"date":{"end_time":"2009/10/12 00:00:00 -0400","original":"10/11/2009","granularity":"day","time":"2009/10/11 00:00:00 -0400"},"total":1,"longitude":-117.5791168,"id":"advy9tvpas7j","location":"San Diego Trough (SD Co.)"},"type":"Feature","geometry":{"type":"Point","coordinates":[-117.5791168,32.6369271]}},{"properties":{"latitude":32.0408075,"date":{"end_time":"2009/10/12 00:00:00 -0400","original":"10/11/2009","granularity":"day","time":"2009/10/11 00:00:00 -0400"},"total":1,"longitude":-118.5205164,"id":"advy9tlnnawg","location":"Mushroom Bank (LA Co.)"},"type":"Feature","geometry":{"type":"Point","coordinates":[-118.5205164,32.0408075]}},{"properties":{"latitude":32.606406,"date":{"end_time":"2009/10/12 00:00:00 -0400","original":"10/11/2009","granularity":"day","time":"2009/10/11 00:00:00 -0400"},"total":1,"longitude":-117.2872922,"id":"advy9tl56kgu","location":"Pt. Loma--offshore waters (SD Co.)"},"type":"Feature","geometry":{"type":"Point","coordinates":[-117.2872922,32.606406]}},{"properties":{"latitude":32.686191,"date":{"end_time":"2009/10/12 00:00:00 -0400","original":"10/11/2009","granularity":"day","time":"2009/10/11 00:00:00 -0400"},"total":1,"longitude":-117.2328839,"id":"advy9tx2jr36","location":"San Diego Bay--Ballast Point"},"type":"Feature","geometry":{"type":"Point","coordinates":[-117.2328839,32.686191]}},{"properties":{"latitude":32.3428414,"date":{"end_time":"2009/10/13 00:00:00 -0400","original":"10/12/2009","granularity":"day","time":"2009/10/12 00:00:00 -0400"},"total":1,"longitude":-119.6740723,"id":"advy9tqsnj8s","location":"Offshore--shelf west of Cortez Bank (VEN Co.)"},"type":"Feature","geometry":{"type":"Point","coordinates":[-119.6740723,32.3428414]}},{"properties":{"latitude":31.5620774,"date":{"end_time":"2009/10/28 00:00:00 -0400","original":"10/27/2009","granularity":"day","time":"2009/10/27 00:00:00 -0400"},"total":1,"longitude":-111.047042,"id":"advy9tlmgnhu","location":"Santa Gertrudis Lane (foot access only)"},"type":"Feature","geometry":{"type":"Point","coordinates":[-111.047042,31.5620774]}},{"properties":{"latitude":32.2518324,"date":{"end_time":"2009/11/24 00:00:00 -0500","original":"11/23/2009","granularity":"day","time":"2009/11/23 00:00:00 -0500"},"total":1,"longitude":-110.8064827,"id":"advy9tudrfz4","location":"Tucson--Woodland Road"},"type":"Feature","geometry":{"type":"Point","coordinates":[-110.8064827,32.2518324]}},{"properties":{"latitude":44.7465046,"date":{"end_time":"2009/12/28 00:00:00 -0500","original":"12/27/2009","granularity":"day","time":"2009/12/27 00:00:00 -0500"},"total":1,"longitude":-92.8012133,"id":"advy9ts5vs0c","location":"Prescott Marina"},"type":"Feature","geometry":{"type":"Point","coordinates":[-92.8012133,44.7465046]}},{"properties":{"latitude":44.7487382,"date":{"end_time":"2009/12/28 00:00:00 -0500","original":"12/27/2009","granularity":"day","time":"2009/12/27 00:00:00 -0500"},"total":1,"longitude":-92.8115986,"id":"advy9tkmr9on","location":"Point Douglas Park"},"type":"Feature","geometry":{"type":"Point","coordinates":[-92.8115986,44.7487382]}},{"properties":{"latitude":31.4597377,"date":{"end_time":"2010/01/04 00:00:00 -0500","original":"1/3/2010","granularity":"day","time":"2010/01/03 00:00:00 -0500"},"total":1,"longitude":-111.0381912,"id":"advy9tqndqnl","location":"Bellota Canyon"},"type":"Feature","geometry":{"type":"Point","coordinates":[-111.0381912,31.4597377]}},{"properties":{"latitude":26.7113,"date":{"end_time":"2010/02/23 00:00:00 -0500","original":"2/22/2010","granularity":"day","time":"2010/02/22 00:00:00 -0500"},"total":1,"longitude":-109.61991,"id":"advy9twe8z7x","location":"AICA ZONAS HUMEDAS YAVAROS"},"type":"Feature","geometry":{"type":"Point","coordinates":[-109.61991,26.7113]}},{"properties":{"latitude":27.0241081,"date":{"end_time":"2010/02/24 00:00:00 -0500","original":"2/23/2010","granularity":"day","time":"2010/02/23 00:00:00 -0500"},"total":1,"longitude":-108.9581638,"id":"advy9tsp4kl5","location":"Uvalama Wash"},"type":"Feature","geometry":{"type":"Point","coordinates":[-108.9581638,27.0241081]}},{"properties":{"latitude":32.2732364,"date":{"end_time":"2010/09/28 00:00:00 -0400","original":"9/27/2010","granularity":"day","time":"2010/09/27 00:00:00 -0400"},"total":1,"longitude":-110.9032059,"id":"advy9tjqxl6c","location":"Rillito River--Columbus Weed Patch"},"type":"Feature","geometry":{"type":"Point","coordinates":[-110.9032059,32.2732364]}},{"properties":{"latitude":28.0152979,"date":{"end_time":"2010/10/16 00:00:00 -0400","original":"10/15/2010","granularity":"day","time":"2010/10/15 00:00:00 -0400"},"total":1,"longitude":-111.0545039,"id":"advy9tn60v16","location":"Nacapule Canyon"},"type":"Feature","geometry":{"type":"Point","coordinates":[-111.0545039,28.0152979]}},{"properties":{"latitude":32.1812,"date":{"end_time":"2010/11/14 00:00:00 -0500","original":"11/13/2010","granularity":"day","time":"2010/11/13 00:00:00 -0500"},"total":1,"longitude":-110.932,"id":"advy9ti30vcl","location":"Sam Lena Park and KERP"},"type":"Feature","geometry":{"type":"Point","coordinates":[-110.932,32.1812]}},{"properties":{"latitude":26.9419512,"date":{"end_time":"2011/01/03 00:00:00 -0500","original":"1/2/2011","granularity":"day","time":"2011/01/02 00:00:00 -0500"},"total":1,"longitude":-108.8879651,"id":"advy9tt3npxa","location":"Rio Cuchujaqui Bridge Site"},"type":"Feature","geometry":{"type":"Point","coordinates":[-108.8879651,26.9419512]}},{"properties":{"latitude":32.1086204,"date":{"end_time":"2011/01/23 00:00:00 -0500","original":"1/22/2011","granularity":"day","time":"2011/01/22 00:00:00 -0500"},"total":1,"longitude":-109.7228783,"id":"advy9trfq5ak","location":"Kansas Settlement--Arzberger Rd"},"type":"Feature","geometry":{"type":"Point","coordinates":[-109.7228783,32.1086204]}},{"properties":{"latitude":45.0703911,"date":{"end_time":"2011/02/07 00:00:00 -0500","original":"2/6/2011","granularity":"day","time":"2011/02/06 00:00:00 -0500"},"total":1,"longitude":-93.2666581,"id":"advy9twio7tq","location":"near Fridley, MN"},"type":"Feature","geometry":{"type":"Point","coordinates":[-93.2666581,45.0703911]}},{"properties":{"latitude":29.9873525,"date":{"end_time":"2011/04/03 00:00:00 -0400","original":"4/2/2011","granularity":"day","time":"2011/04/02 00:00:00 -0400"},"total":1,"longitude":-95.3418446,"id":"advy9tmnmgx8","location":"Bush Intercontinenrtal Airport"},"type":"Feature","geometry":{"type":"Point","coordinates":[-95.3418446,29.9873525]}},{"properties":{"latitude":38.9407522,"date":{"end_time":"2011/04/07 00:00:00 -0400","original":"4/6/2011","granularity":"day","time":"2011/04/06 00:00:00 -0400"},"total":1,"longitude":-77.0493937,"id":"advy9tmdujo1","location":"Rock Creek Park--Beach Drive - Park Rd."},"type":"Feature","geometry":{"type":"Point","coordinates":[-77.0493937,38.9407522]}},{"properties":{"latitude":32.2408709,"date":{"end_time":"2011/04/15 00:00:00 -0400","original":"4/14/2011","granularity":"day","time":"2011/04/14 00:00:00 -0400"},"total":1,"longitude":-110.9397618,"id":"advy9tt3xvkz","location":"Yellow-throated Warbler spot - AZ Inn"},"type":"Feature","geometry":{"type":"Point","coordinates":[-110.9397618,32.2408709]}},{"properties":{"latitude":42.3536409,"date":{"end_time":"2011/06/12 00:00:00 -0400","original":"6/11/2011","granularity":"day","time":"2011/06/11 00:00:00 -0400"},"total":1,"longitude":-71.0705435,"id":"advy9tsh5jal","location":"Boston Public Garden"},"type":"Feature","geometry":{"type":"Point","coordinates":[-71.0705435,42.3536409]}},{"properties":{"latitude":43.1866545,"date":{"end_time":"2011/06/12 00:00:00 -0400","original":"6/11/2011","granularity":"day","time":"2011/06/11 00:00:00 -0400"},"total":1,"longitude":-71.6804695,"id":"advy9tkx4zih","location":"Smith Pond Bog Wildlife Sanctuary, Hopkinton"},"type":"Feature","geometry":{"type":"Point","coordinates":[-71.6804695,43.1866545]}},{"properties":{"latitude":43.1425958,"date":{"end_time":"2011/06/13 00:00:00 -0400","original":"6/12/2011","granularity":"day","time":"2011/06/12 00:00:00 -0400"},"total":1,"longitude":-72.5098742,"id":"advy9tupsrpw","location":"Vermont Academy grounds"},"type":"Feature","geometry":{"type":"Point","coordinates":[-72.5098742,43.1425958]}},{"properties":{"latitude":42.61992,"date":{"end_time":"2011/06/13 00:00:00 -0400","original":"6/12/2011","granularity":"day","time":"2011/06/12 00:00:00 -0400"},"total":1,"longitude":-70.63346,"id":"advy9txw4x7l","location":"Good Harbor Beach"},"type":"Feature","geometry":{"type":"Point","coordinates":[-70.63346,42.61992]}},{"properties":{"latitude":-13.4105209,"date":{"end_time":"2011/07/14 00:00:00 -0400","original":"7/13/2011","granularity":"day","time":"2011/07/13 00:00:00 -0400"},"total":1,"longitude":-72.0349445,"id":"advy9tmnyuwd","location":"Chinchero--marsh"},"type":"Feature","geometry":{"type":"Point","coordinates":[-72.0349445,-13.4105209]}},{"properties":{"latitude":3.5371811,"date":{"end_time":"2011/07/20 00:00:00 -0400","original":"7/19/2011","granularity":"day","time":"2011/07/19 00:00:00 -0400"},"total":1,"longitude":-76.3848022,"id":"advy9tkp8oet","location":"Cali Airport"},"type":"Feature","geometry":{"type":"Point","coordinates":[-76.3848022,3.5371811]}},{"properties":{"latitude":-0.1398056,"date":{"end_time":"2011/07/20 00:00:00 -0400","original":"7/19/2011","granularity":"day","time":"2011/07/19 00:00:00 -0400"},"total":1,"longitude":-78.4883529,"id":"advy9tsz9fkm","location":"Quito airport"},"type":"Feature","geometry":{"type":"Point","coordinates":[-78.4883529,-0.1398056]}},{"properties":{"latitude":6.0855628,"date":{"end_time":"2011/07/21 00:00:00 -0400","original":"7/20/2011","granularity":"day","time":"2011/07/20 00:00:00 -0400"},"total":1,"longitude":-73.3987492,"id":"advy9tox3bus","location":"drive from Bogota to San Gil"},"type":"Feature","geometry":{"type":"Point","coordinates":[-73.3987492,6.0855628]}},{"properties":{"latitude":4.6059101,"date":{"end_time":"2011/07/21 00:00:00 -0400","original":"7/20/2011","granularity":"day","time":"2011/07/20 00:00:00 -0400"},"total":1,"longitude":-74.0557831,"id":"advy9tsb5j3r","location":"Monserrate Peak gardens"},"type":"Feature","geometry":{"type":"Point","coordinates":[-74.0557831,4.6059101]}},{"properties":{"latitude":6.6640259,"date":{"end_time":"2011/07/23 00:00:00 -0400","original":"7/22/2011","granularity":"day","time":"2011/07/22 00:00:00 -0400"},"total":1,"longitude":-73.2470055,"id":"advy9tpf01du","location":"Camino Real hike from Barichara to Guane"},"type":"Feature","geometry":{"type":"Point","coordinates":[-73.2470055,6.6640259]}},{"properties":{"latitude":10.8438333,"date":{"end_time":"2011/07/27 00:00:00 -0400","original":"7/26/2011","granularity":"day","time":"2011/07/26 00:00:00 -0400"},"total":1,"longitude":-74.5456667,"id":"advy9twa01ny","location":"Reserva de Biósfera RAMSAR Ciénaga Grande, Isla de Salamanca y Sabana Grande"},"type":"Feature","geometry":{"type":"Point","coordinates":[-74.5456667,10.8438333]}},{"properties":{"latitude":32.0600959,"date":{"end_time":"2011/08/09 00:00:00 -0400","original":"8/8/2011","granularity":"day","time":"2011/08/08 00:00:00 -0400"},"total":1,"longitude":-107.8503625,"id":"advy9tks8q3s","location":"Fields south of Deming"},"type":"Feature","geometry":{"type":"Point","coordinates":[-107.8503625,32.0600959]}},{"properties":{"latitude":43.6301353,"date":{"end_time":"2011/12/25 00:00:00 -0500","original":"12/24/2011","granularity":"day","time":"2011/12/24 00:00:00 -0500"},"total":1,"longitude":-91.208024,"id":"advy9tueqsmb","location":"Snowy Owl spot above bluff"},"type":"Feature","geometry":{"type":"Point","coordinates":[-91.208024,43.6301353]}},{"properties":{"latitude":44.801193,"date":{"end_time":"2011/12/29 00:00:00 -0500","original":"12/28/2011","granularity":"day","time":"2011/12/28 00:00:00 -0500"},"total":1,"longitude":-93.2692,"id":"advy9tts7ni8","location":"Black Dog Lake"},"type":"Feature","geometry":{"type":"Point","coordinates":[-93.2692,44.801193]}},{"properties":{"latitude":31.7444223,"date":{"end_time":"2012/01/02 00:00:00 -0500","original":"1/1/2012","granularity":"day","time":"2012/01/01 00:00:00 -0500"},"total":1,"longitude":-110.7420851,"id":"advy9txp726e","location":"Kentucky Camp"},"type":"Feature","geometry":{"type":"Point","coordinates":[-110.7420851,31.7444223]}},{"properties":{"latitude":31.4853527,"date":{"end_time":"2012/01/03 00:00:00 -0500","original":"1/2/2012","granularity":"day","time":"2012/01/02 00:00:00 -0500"},"total":1,"longitude":-111.2452369,"id":"advy9twypr41","location":"Papago Tanks"},"type":"Feature","geometry":{"type":"Point","coordinates":[-111.2452369,31.4853527]}},{"properties":{"latitude":31.459971,"date":{"end_time":"2012/01/03 00:00:00 -0500","original":"1/2/2012","granularity":"day","time":"2012/01/02 00:00:00 -0500"},"total":1,"longitude":-111.2359414,"id":"advy9txkwxbe","location":"Ruby (ghost town)"},"type":"Feature","geometry":{"type":"Point","coordinates":[-111.2359414,31.459971]}},{"properties":{"latitude":32.365,"date":{"end_time":"2012/01/15 00:00:00 -0500","original":"1/14/2012","granularity":"day","time":"2012/01/14 00:00:00 -0500"},"total":1,"longitude":-109.934,"id":"advy9tw20uqg","location":"Sulphur Springs Valley--north of Willcox (Cochise Co.)"},"type":"Feature","geometry":{"type":"Point","coordinates":[-109.934,32.365]}},{"properties":{"latitude":32.1417155,"date":{"end_time":"2012/01/15 00:00:00 -0500","original":"1/14/2012","granularity":"day","time":"2012/01/14 00:00:00 -0500"},"total":1,"longitude":-109.7569692,"id":"advy9ttcwsyl","location":"Willcox Playa WA (no water)"},"type":"Feature","geometry":{"type":"Point","coordinates":[-109.7569692,32.1417155]}},{"properties":{"latitude":31.876683,"date":{"end_time":"2012/01/16 00:00:00 -0500","original":"1/15/2012","granularity":"day","time":"2012/01/15 00:00:00 -0500"},"total":1,"longitude":-110.2126819,"id":"advy9thwyesn","location":"St. David--Holy Trinity Monastery"},"type":"Feature","geometry":{"type":"Point","coordinates":[-110.2126819,31.876683]}},{"properties":{"latitude":31.8548291,"date":{"end_time":"2012/01/31 00:00:00 -0500","original":"1/30/2012","granularity":"day","time":"2012/01/30 00:00:00 -0500"},"total":1,"longitude":-110.979445,"id":"advy9tsobptx","location":"Santa Cruz River--Continental Rd."},"type":"Feature","geometry":{"type":"Point","coordinates":[-110.979445,31.8548291]}},{"properties":{"latitude":32.6459059,"date":{"end_time":"2012/02/05 00:00:00 -0500","original":"2/4/2012","granularity":"day","time":"2012/02/04 00:00:00 -0500"},"total":1,"longitude":-111.4046129,"id":"advy9tqeakwn","location":"Picacho Peak SP"},"type":"Feature","geometry":{"type":"Point","coordinates":[-111.4046129,32.6459059]}},{"properties":{"latitude":32.5379839,"date":{"end_time":"2012/02/14 00:00:00 -0500","original":"2/13/2012","granularity":"day","time":"2012/02/13 00:00:00 -0500"},"total":1,"longitude":-110.716606,"id":"advy9thobd0s","location":"Peppersauce Canyon"},"type":"Feature","geometry":{"type":"Point","coordinates":[-110.716606,32.5379839]}},{"properties":{"latitude":32.7584613,"date":{"end_time":"2012/03/02 00:00:00 -0500","original":"3/1/2012","granularity":"day","time":"2012/03/01 00:00:00 -0500"},"total":1,"longitude":-117.2283376,"id":"advy9tsjh2hf","location":"San Diego River--I-5 to Robb Field"},"type":"Feature","geometry":{"type":"Point","coordinates":[-117.2283376,32.7584613]}},{"properties":{"latitude":32.7797699,"date":{"end_time":"2012/03/02 00:00:00 -0500","original":"3/1/2012","granularity":"day","time":"2012/03/01 00:00:00 -0500"},"total":1,"longitude":-115.5665588,"id":"advy9tlye7q9","location":"El Centro area"},"type":"Feature","geometry":{"type":"Point","coordinates":[-115.5665588,32.7797699]}},{"properties":{"latitude":32.853056,"date":{"end_time":"2012/03/03 00:00:00 -0500","original":"3/2/2012","granularity":"day","time":"2012/03/02 00:00:00 -0500"},"total":1,"longitude":-117.3865155,"id":"advy9tok18kj","location":"La Jolla--offshore waters (SD Co.)"},"type":"Feature","geometry":{"type":"Point","coordinates":[-117.3865155,32.853056]}},{"properties":{"latitude":32.7755756,"date":{"end_time":"2012/03/03 00:00:00 -0500","original":"3/2/2012","granularity":"day","time":"2012/03/02 00:00:00 -0500"},"total":1,"longitude":-117.2296117,"id":"advy9twg5oc9","location":"Mission Bay"},"type":"Feature","geometry":{"type":"Point","coordinates":[-117.2296117,32.7755756]}},{"properties":{"latitude":32.7177997,"date":{"end_time":"2012/03/03 00:00:00 -0500","original":"3/2/2012","granularity":"day","time":"2012/03/02 00:00:00 -0500"},"total":1,"longitude":-117.173146,"id":"advy9tinmou4","location":"San Diego downtown waterfront"},"type":"Feature","geometry":{"type":"Point","coordinates":[-117.173146,32.7177997]}},{"properties":{"latitude":32.7354094,"date":{"end_time":"2012/03/04 00:00:00 -0500","original":"3/3/2012","granularity":"day","time":"2012/03/03 00:00:00 -0500"},"total":1,"longitude":-117.1455743,"id":"advy9tvtlbj4","location":"Balboa Park"},"type":"Feature","geometry":{"type":"Point","coordinates":[-117.1455743,32.7354094]}},{"properties":{"latitude":34.6245,"date":{"end_time":"2012/04/01 00:00:00 -0400","original":"3/31/2012","granularity":"day","time":"2012/03/31 00:00:00 -0400"},"total":1,"longitude":-106.7202068,"id":"advy9ttkp7tw","location":"Belen - grandpas house"},"type":"Feature","geometry":{"type":"Point","coordinates":[-106.7202068,34.6245]}},{"properties":{"latitude":31.7814941,"date":{"end_time":"2012/04/10 00:00:00 -0400","original":"4/9/2012","granularity":"day","time":"2012/04/09 00:00:00 -0400"},"total":1,"longitude":-111.630257,"id":"advy9tsvenvc","location":"Baboquivari Campground and Fresnal Canyon"},"type":"Feature","geometry":{"type":"Point","coordinates":[-111.630257,31.7814941]}},{"properties":{"latitude":32.3479858,"date":{"end_time":"2012/04/17 00:00:00 -0400","original":"4/16/2012","granularity":"day","time":"2012/04/16 00:00:00 -0400"},"total":1,"longitude":-110.8544855,"id":"advy9tqqwocv","location":"Ventana Canyon"},"type":"Feature","geometry":{"type":"Point","coordinates":[-110.8544855,32.3479858]}},{"properties":{"latitude":32.3732802,"date":{"end_time":"2012/04/25 00:00:00 -0400","original":"4/24/2012","granularity":"day","time":"2012/04/24 00:00:00 -0400"},"total":1,"longitude":-111.0494987,"id":"advy9ts8mo05","location":"Arthur Pack Regional Park"},"type":"Feature","geometry":{"type":"Point","coordinates":[-111.0494987,32.3732802]}},{"properties":{"latitude":32.3128333,"date":{"end_time":"2012/04/25 00:00:00 -0400","original":"4/24/2012","granularity":"day","time":"2012/04/24 00:00:00 -0400"},"total":1,"longitude":-110.7418174,"id":"advy9tttnrzc","location":"Mt. Lemmon--Soldier Canyon"},"type":"Feature","geometry":{"type":"Point","coordinates":[-110.7418174,32.3128333]}},{"properties":{"latitude":32.434362,"date":{"end_time":"2012/05/07 00:00:00 -0400","original":"5/6/2012","granularity":"day","time":"2012/05/06 00:00:00 -0400"},"total":1,"longitude":-111.25607,"id":"advy9tsq8oyl","location":"American bittern from hot air balloon-general area"},"type":"Feature","geometry":{"type":"Point","coordinates":[-111.25607,32.434362]}},{"properties":{"latitude":36.0612422,"date":{"end_time":"2012/05/14 00:00:00 -0400","original":"5/13/2012","granularity":"day","time":"2012/05/13 00:00:00 -0400"},"total":1,"longitude":-112.1084833,"id":"advy9topsnkm","location":"Grand Canyon NP--Mather Point"},"type":"Feature","geometry":{"type":"Point","coordinates":[-112.1084833,36.0612422]}},{"properties":{"latitude":35.188324,"date":{"end_time":"2012/05/14 00:00:00 -0400","original":"5/13/2012","granularity":"day","time":"2012/05/13 00:00:00 -0400"},"total":1,"longitude":-111.619766,"id":"advy9tk54zpd","location":"Little America forest"},"type":"Feature","geometry":{"type":"Point","coordinates":[-111.619766,35.188324]}},{"properties":{"latitude":34.831613,"date":{"end_time":"2012/05/15 00:00:00 -0400","original":"5/14/2012","granularity":"day","time":"2012/05/14 00:00:00 -0400"},"total":1,"longitude":-111.766159,"id":"advy9tq7jvqt","location":"chapel of the cross area"},"type":"Feature","geometry":{"type":"Point","coordinates":[-111.766159,34.831613]}},{"properties":{"latitude":33.4564,"date":{"end_time":"2012/05/15 00:00:00 -0400","original":"5/14/2012","granularity":"day","time":"2012/05/14 00:00:00 -0400"},"total":1,"longitude":-111.95,"id":"advy9tl5i6eh","location":"Papago Park, Phoenix/Tempe"},"type":"Feature","geometry":{"type":"Point","coordinates":[-111.95,33.4564]}},{"properties":{"latitude":32.3131068,"date":{"end_time":"2012/05/31 00:00:00 -0400","original":"5/30/2012","granularity":"day","time":"2012/05/30 00:00:00 -0400"},"total":1,"longitude":-110.8113941,"id":"advy9tquz50n","location":"Sabino Dam and downstream riparian"},"type":"Feature","geometry":{"type":"Point","coordinates":[-110.8113941,32.3131068]}},{"properties":{"latitude":32.836688,"date":{"end_time":"2012/06/05 00:00:00 -0400","original":"6/4/2012","granularity":"day","time":"2012/06/04 00:00:00 -0400"},"total":1,"longitude":-110.703177,"id":"advy9tvv7gse","location":"Dan and jamie's house"},"type":"Feature","geometry":{"type":"Point","coordinates":[-110.703177,32.836688]}},{"properties":{"latitude":31.769332,"date":{"end_time":"2012/06/24 00:00:00 -0400","original":"6/23/2012","granularity":"day","time":"2012/06/23 00:00:00 -0400"},"total":1,"longitude":-110.8873272,"id":"advy9tov3uqh","location":"Madera Canyon--grasslands below Proctor Rd"},"type":"Feature","geometry":{"type":"Point","coordinates":[-110.8873272,31.769332]}},{"properties":{"latitude":31.7150256,"date":{"end_time":"2012/06/24 00:00:00 -0400","original":"6/23/2012","granularity":"day","time":"2012/06/23 00:00:00 -0400"},"total":1,"longitude":-110.861578,"id":"advy9tskgrgy","location":"Madera Canyon--Kent Springs"},"type":"Feature","geometry":{"type":"Point","coordinates":[-110.861578,31.7150256]}},{"properties":{"latitude":32.9207363,"date":{"end_time":"2012/07/16 00:00:00 -0400","original":"7/15/2012","granularity":"day","time":"2012/07/15 00:00:00 -0400"},"total":1,"longitude":-107.5675249,"id":"advy9ttv7aq3","location":"Hillsboro Park"},"type":"Feature","geometry":{"type":"Point","coordinates":[-107.5675249,32.9207363]}},{"properties":{"latitude":35.7290786,"date":{"end_time":"2012/07/17 00:00:00 -0400","original":"7/16/2012","granularity":"day","time":"2012/07/16 00:00:00 -0400"},"total":1,"longitude":-105.8374098,"id":"advy9tho5fx4","location":"Black Canyon Campground"},"type":"Feature","geometry":{"type":"Point","coordinates":[-105.8374098,35.7290786]}},{"properties":{"latitude":35.6888653,"date":{"end_time":"2012/07/17 00:00:00 -0400","original":"7/16/2012","granularity":"day","time":"2012/07/16 00:00:00 -0400"},"total":1,"longitude":-105.9315661,"id":"advy9tpx4by5","location":"Santa Fe downtown area"},"type":"Feature","geometry":{"type":"Point","coordinates":[-105.9315661,35.6888653]}},{"properties":{"latitude":36.1397992,"date":{"end_time":"2012/07/18 00:00:00 -0400","original":"7/17/2012","granularity":"day","time":"2012/07/17 00:00:00 -0400"},"total":1,"longitude":-105.9697607,"id":"advy9ticrz2z","location":"Los Luceros upland"},"type":"Feature","geometry":{"type":"Point","coordinates":[-105.9697607,36.1397992]}},{"properties":{"latitude":36.6020257,"date":{"end_time":"2012/07/19 00:00:00 -0400","original":"7/18/2012","granularity":"day","time":"2012/07/18 00:00:00 -0400"},"total":1,"longitude":-105.4374008,"id":"advy9tsp10fp","location":"Carson NF -- Bull of the Woods Trail"},"type":"Feature","geometry":{"type":"Point","coordinates":[-105.4374008,36.6020257]}},{"properties":{"latitude":36.5560945,"date":{"end_time":"2012/07/19 00:00:00 -0400","original":"7/18/2012","granularity":"day","time":"2012/07/18 00:00:00 -0400"},"total":1,"longitude":-105.5372974,"id":"advy9twqeo1j","location":"Cuchilla del Medio campground"},"type":"Feature","geometry":{"type":"Point","coordinates":[-105.5372974,36.5560945]}},{"properties":{"latitude":36.0470007,"date":{"end_time":"2012/07/20 00:00:00 -0400","original":"7/19/2012","granularity":"day","time":"2012/07/19 00:00:00 -0400"},"total":1,"longitude":-105.8149222,"id":"advy9timawvm","location":"Truchas"},"type":"Feature","geometry":{"type":"Point","coordinates":[-105.8149222,36.0470007]}},{"properties":{"latitude":31.7736706,"date":{"end_time":"2012/07/25 00:00:00 -0400","original":"7/24/2012","granularity":"day","time":"2012/07/24 00:00:00 -0400"},"total":1,"longitude":-110.8579351,"id":"advy9tji770x","location":"White House Canyon Road"},"type":"Feature","geometry":{"type":"Point","coordinates":[-110.8579351,31.7736706]}},{"properties":{"latitude":31.7170699,"date":{"end_time":"2012/08/16 00:00:00 -0400","original":"8/15/2012","granularity":"day","time":"2012/08/15 00:00:00 -0400"},"total":1,"longitude":-110.5931854,"id":"advy9tnvd183","location":"Las Ciengas NCA--South Entrance (Santa Cruz Co.)"},"type":"Feature","geometry":{"type":"Point","coordinates":[-110.5931854,31.7170699]}},{"properties":{"latitude":32.4111248,"date":{"end_time":"2012/08/16 00:00:00 -0400","original":"8/15/2012","granularity":"day","time":"2012/08/15 00:00:00 -0400"},"total":1,"longitude":-110.7064819,"id":"advy9tp6l2d4","location":"Mt. Lemmon--Incinerator Ridge"},"type":"Feature","geometry":{"type":"Point","coordinates":[-110.7064819,32.4111248]}},{"properties":{"latitude":32.4343387,"date":{"end_time":"2012/08/16 00:00:00 -0400","original":"8/15/2012","granularity":"day","time":"2012/08/15 00:00:00 -0400"},"total":1,"longitude":-110.7526013,"id":"advy9tl67l7k","location":"Mt. Lemmon--Inspiration Rock Picnic Area"},"type":"Feature","geometry":{"type":"Point","coordinates":[-110.7526013,32.4343387]}},{"properties":{"latitude":45.4595059,"date":{"end_time":"2012/08/27 00:00:00 -0400","original":"8/26/2012","granularity":"day","time":"2012/08/26 00:00:00 -0400"},"total":1,"longitude":-98.5154762,"id":"advy9tmz5p5m","location":"Aberdeen and Surrounding Area"},"type":"Feature","geometry":{"type":"Point","coordinates":[-98.5154762,45.4595059]}},{"properties":{"latitude":45.712454,"date":{"end_time":"2012/08/28 00:00:00 -0400","original":"8/27/2012","granularity":"day","time":"2012/08/27 00:00:00 -0400"},"total":1,"longitude":-100.134714,"id":"advy9tlten2v","location":"near uncle Steve's house - SD"},"type":"Feature","geometry":{"type":"Point","coordinates":[-100.134714,45.712454]}},{"properties":{"latitude":45.533692,"date":{"end_time":"2012/08/28 00:00:00 -0400","original":"8/27/2012","granularity":"day","time":"2012/08/27 00:00:00 -0400"},"total":1,"longitude":-100.275724,"id":"advy9ttnrw7z","location":"Wielands house"},"type":"Feature","geometry":{"type":"Point","coordinates":[-100.275724,45.533692]}},{"properties":{"latitude":45.953965,"date":{"end_time":"2012/08/28 00:00:00 -0400","original":"8/27/2012","granularity":"day","time":"2012/08/27 00:00:00 -0400"},"total":1,"longitude":-100.066916,"id":"advy9tsojtsy","location":"just north of North Dakota border"},"type":"Feature","geometry":{"type":"Point","coordinates":[-100.066916,45.953965]}},{"properties":{"latitude":45.351727,"date":{"end_time":"2012/08/29 00:00:00 -0400","original":"8/28/2012","granularity":"day","time":"2012/08/28 00:00:00 -0400"},"total":1,"longitude":-97.405025,"id":"advy9tu0ejqv","location":"SD - easy of Aberdeen along hwy12"},"type":"Feature","geometry":{"type":"Point","coordinates":[-97.405025,45.351727]}},{"properties":{"latitude":45.571575,"date":{"end_time":"2012/08/29 00:00:00 -0400","original":"8/28/2012","granularity":"day","time":"2012/08/28 00:00:00 -0400"},"total":1,"longitude":-96.176431,"id":"advy9tsu4j0y","location":"MN - along highway 28"},"type":"Feature","geometry":{"type":"Point","coordinates":[-96.176431,45.571575]}},{"properties":{"latitude":44.827702,"date":{"end_time":"2012/09/01 00:00:00 -0400","original":"8/31/2012","granularity":"day","time":"2012/08/31 00:00:00 -0400"},"total":1,"longitude":-93.225752,"id":"advy9tjqofbc","location":"FT Snelling state park- south end"},"type":"Feature","geometry":{"type":"Point","coordinates":[-93.225752,44.827702]}},{"properties":{"latitude":44.8773731,"date":{"end_time":"2012/09/02 00:00:00 -0400","original":"9/1/2012","granularity":"day","time":"2012/09/01 00:00:00 -0400"},"total":1,"longitude":-93.2931089,"id":"advy9trh56ay","location":"Wood Lake Nature Center"},"type":"Feature","geometry":{"type":"Point","coordinates":[-93.2931089,44.8773731]}},{"properties":{"latitude":31.826363,"date":{"end_time":"2012/09/16 00:00:00 -0400","original":"9/15/2012","granularity":"day","time":"2012/09/15 00:00:00 -0400"},"total":1,"longitude":-110.584312,"id":"advy9thqqjvg","location":"empire ranch cienega area"},"type":"Feature","geometry":{"type":"Point","coordinates":[-110.584312,31.826363]}},{"properties":{"latitude":32.8915794,"date":{"end_time":"2012/10/08 00:00:00 -0400","original":"10/7/2012","granularity":"day","time":"2012/10/07 00:00:00 -0400"},"total":1,"longitude":-107.2956401,"id":"advy9tmp6agb","location":"Caballo Lake SP -- Below Dam"},"type":"Feature","geometry":{"type":"Point","coordinates":[-107.2956401,32.8915794]}},{"properties":{"latitude":32.899925,"date":{"end_time":"2012/10/08 00:00:00 -0400","original":"10/7/2012","granularity":"day","time":"2012/10/07 00:00:00 -0400"},"total":1,"longitude":-107.30381,"id":"advy9tkifkt6","location":"Caballo Lake SP -- Percha Flats"},"type":"Feature","geometry":{"type":"Point","coordinates":[-107.30381,32.899925]}},{"properties":{"latitude":32.337,"date":{"end_time":"2012/10/14 00:00:00 -0400","original":"10/13/2012","granularity":"day","time":"2012/10/13 00:00:00 -0400"},"total":1,"longitude":-110.2367,"id":"advy9txirt0w","location":"Muleshoe Ranch Preserve"},"type":"Feature","geometry":{"type":"Point","coordinates":[-110.2367,32.337]}},{"properties":{"latitude":32.2612251,"date":{"end_time":"2012/10/17 00:00:00 -0400","original":"10/16/2012","granularity":"day","time":"2012/10/16 00:00:00 -0400"},"total":1,"longitude":-110.8999872,"id":"advy9tnn0yss","location":"McCormick Park"},"type":"Feature","geometry":{"type":"Point","coordinates":[-110.8999872,32.2612251]}},{"properties":{"latitude":32.9051389,"date":{"end_time":"2012/11/05 00:00:00 -0500","original":"11/4/2012","granularity":"day","time":"2012/11/04 00:00:00 -0400"},"total":1,"longitude":-110.5633593,"id":"advy9tkpr47l","location":"Aravaipa Canyon--west"},"type":"Feature","geometry":{"type":"Point","coordinates":[-110.5633593,32.9051389]}},{"properties":{"latitude":32.3217521,"date":{"end_time":"2012/11/25 00:00:00 -0500","original":"11/24/2012","granularity":"day","time":"2012/11/24 00:00:00 -0500"},"total":1,"longitude":-108.8171654,"id":"advy9twld5b4","location":"Fraggle Rock area"},"type":"Feature","geometry":{"type":"Point","coordinates":[-108.8171654,32.3217521]}},{"properties":{"latitude":32.2307825,"date":{"end_time":"2012/12/20 00:00:00 -0500","original":"12/19/2012","granularity":"day","time":"2012/12/19 00:00:00 -0500"},"total":1,"longitude":-110.9184812,"id":"advy9tjt2m24","location":"Jake's House"},"type":"Feature","geometry":{"type":"Point","coordinates":[-110.9184812,32.2307825]}},{"properties":{"latitude":32.2142897,"date":{"end_time":"2012/12/25 00:00:00 -0500","original":"12/24/2012","granularity":"day","time":"2012/12/24 00:00:00 -0500"},"total":1,"longitude":-111.005162,"id":"advy9tng1v2l","location":"Tumamoc Hill"},"type":"Feature","geometry":{"type":"Point","coordinates":[-111.005162,32.2142897]}},{"properties":{"latitude":31.5172708,"date":{"end_time":"2012/12/30 00:00:00 -0500","original":"12/29/2012","granularity":"day","time":"2012/12/29 00:00:00 -0500"},"total":1,"longitude":-110.3887872,"id":"advy9ts8vccq","location":"Huachuca Canyon"},"type":"Feature","geometry":{"type":"Point","coordinates":[-110.3887872,31.5172708]}},{"properties":{"latitude":31.4253006,"date":{"end_time":"2012/12/31 00:00:00 -0500","original":"12/30/2012","granularity":"day","time":"2012/12/30 00:00:00 -0500"},"total":1,"longitude":-110.4540024,"id":"advy9tn0fqre","location":"Parker Canyon Lake"},"type":"Feature","geometry":{"type":"Point","coordinates":[-110.4540024,31.4253006]}},{"properties":{"latitude":31.3459405,"date":{"end_time":"2012/12/31 00:00:00 -0500","original":"12/30/2012","granularity":"day","time":"2012/12/30 00:00:00 -0500"},"total":1,"longitude":-110.2535668,"id":"advy9txxera3","location":"Coronado NM"},"type":"Feature","geometry":{"type":"Point","coordinates":[-110.2535668,31.3459405]}},{"properties":{"latitude":31.45,"date":{"end_time":"2012/12/31 00:00:00 -0500","original":"12/30/2012","granularity":"day","time":"2012/12/30 00:00:00 -0500"},"total":1,"longitude":-110.4,"id":"advy9tqc8v1k","location":"Scotia Canyon"},"type":"Feature","geometry":{"type":"Point","coordinates":[-110.4,31.45]}},{"properties":{"latitude":31.4384285,"date":{"end_time":"2012/12/31 00:00:00 -0500","original":"12/30/2012","granularity":"day","time":"2012/12/30 00:00:00 -0500"},"total":1,"longitude":-110.1076526,"id":"advy9toh8hhu","location":"San Pedro RNCA--Hereford Bridge"},"type":"Feature","geometry":{"type":"Point","coordinates":[-110.1076526,31.4384285]}},{"properties":{"latitude":31.9541528,"date":{"end_time":"2013/01/20 00:00:00 -0500","original":"1/19/2013","granularity":"day","time":"2013/01/19 00:00:00 -0500"},"total":1,"longitude":-109.8414417,"id":"advy9tj3w1m8","location":"Sunsites Sewage Ponds"},"type":"Feature","geometry":{"type":"Point","coordinates":[-109.8414417,31.9541528]}},{"properties":{"latitude":31.9822584,"date":{"end_time":"2013/01/21 00:00:00 -0500","original":"1/20/2013","granularity":"day","time":"2013/01/20 00:00:00 -0500"},"total":1,"longitude":-110.2114683,"id":"advy9tjtjbod","location":"Benson along highway"},"type":"Feature","geometry":{"type":"Point","coordinates":[-110.2114683,31.9822584]}},{"properties":{"latitude":32.2567548,"date":{"end_time":"2013/01/21 00:00:00 -0500","original":"1/20/2013","granularity":"day","time":"2013/01/20 00:00:00 -0500"},"total":1,"longitude":-109.8225183,"id":"advy9tt79h7z","location":"Willcox Historic Cemetery"},"type":"Feature","geometry":{"type":"Point","coordinates":[-109.8225183,32.2567548]}},{"properties":{"latitude":32.474115,"date":{"end_time":"2013/01/28 00:00:00 -0500","original":"1/27/2013","granularity":"day","time":"2013/01/27 00:00:00 -0500"},"total":1,"longitude":-111.089077,"id":"advy9tu5ecwu","location":"burro canyon trail"},"type":"Feature","geometry":{"type":"Point","coordinates":[-111.089077,32.474115]}},{"properties":{"latitude":32.495096,"date":{"end_time":"2013/02/04 00:00:00 -0500","original":"2/3/2013","granularity":"day","time":"2013/02/03 00:00:00 -0500"},"total":1,"longitude":-106.893364,"id":"advy9tsti4ml","location":"petroglyph arroyo"},"type":"Feature","geometry":{"type":"Point","coordinates":[-106.893364,32.495096]}},{"properties":{"latitude":22.2072115,"date":{"end_time":"2013/02/19 00:00:00 -0500","original":"2/18/2013","granularity":"day","time":"2013/02/18 00:00:00 -0500"},"total":1,"longitude":-159.4754791,"id":"advy9tr4fuw2","location":"Hanalei NWR -- Ohiki Rd."},"type":"Feature","geometry":{"type":"Point","coordinates":[-159.4754791,22.2072115]}},{"properties":{"latitude":22.051982,"date":{"end_time":"2013/02/19 00:00:00 -0500","original":"2/18/2013","granularity":"day","time":"2013/02/18 00:00:00 -0500"},"total":1,"longitude":-159.329107,"id":"advy9tscntsa","location":"Sands Hotel Wailua"},"type":"Feature","geometry":{"type":"Point","coordinates":[-159.329107,22.051982]}},{"properties":{"latitude":22.224956,"date":{"end_time":"2013/02/19 00:00:00 -0500","original":"2/18/2013","granularity":"day","time":"2013/02/18 00:00:00 -0500"},"total":1,"longitude":-159.4511,"id":"advy9trtr7wk","location":"Anini Beach"},"type":"Feature","geometry":{"type":"Point","coordinates":[-159.4511,22.224956]}},{"properties":{"latitude":21.3681354,"date":{"end_time":"2013/02/21 00:00:00 -0500","original":"2/20/2013","granularity":"day","time":"2013/02/20 00:00:00 -0500"},"total":1,"longitude":-157.9388321,"id":"advy9tonm3e7","location":"Pearl Harbor--WWII Valor in the Pacific NM"},"type":"Feature","geometry":{"type":"Point","coordinates":[-157.9388321,21.3681354]}},{"properties":{"latitude":21.3883481,"date":{"end_time":"2013/02/22 00:00:00 -0500","original":"2/21/2013","granularity":"day","time":"2013/02/21 00:00:00 -0500"},"total":1,"longitude":-157.8072739,"id":"advy9trzr8h6","location":"Ho'omaluhia Botanical Garden, Oahu"},"type":"Feature","geometry":{"type":"Point","coordinates":[-157.8072739,21.3883481]}},{"properties":{"latitude":21.3067276,"date":{"end_time":"2013/02/23 00:00:00 -0500","original":"2/22/2013","granularity":"day","time":"2013/02/22 00:00:00 -0500"},"total":1,"longitude":-157.8592014,"id":"advy9tte0c5m","location":"Iolani Palace"},"type":"Feature","geometry":{"type":"Point","coordinates":[-157.8592014,21.3067276]}},{"properties":{"latitude":21.6830426,"date":{"end_time":"2013/02/23 00:00:00 -0500","original":"2/22/2013","granularity":"day","time":"2013/02/22 00:00:00 -0500"},"total":1,"longitude":-157.958293,"id":"advy9tmps9sv","location":"Kahuku Aqua Ponds"},"type":"Feature","geometry":{"type":"Point","coordinates":[-157.958293,21.6830426]}},{"properties":{"latitude":21.694278,"date":{"end_time":"2013/02/23 00:00:00 -0500","original":"2/22/2013","granularity":"day","time":"2013/02/22 00:00:00 -0500"},"total":1,"longitude":-158.0187607,"id":"advy9tocxf6p","location":"North Shore Oahu"},"type":"Feature","geometry":{"type":"Point","coordinates":[-158.0187607,21.694278]}},{"properties":{"latitude":31.8907631,"date":{"end_time":"2013/03/03 00:00:00 -0500","original":"3/2/2013","granularity":"day","time":"2013/03/02 00:00:00 -0500"},"total":1,"longitude":-110.21666,"id":"advy9tw8qefs","location":"St. David--Golden Bell Rd"},"type":"Feature","geometry":{"type":"Point","coordinates":[-110.21666,31.8907631]}},{"properties":{"latitude":32.242397,"date":{"end_time":"2013/03/05 00:00:00 -0500","original":"3/4/2013","granularity":"day","time":"2013/03/04 00:00:00 -0500"},"total":1,"longitude":-110.92143,"id":"advy9tvb1mfa","location":"US-AZ-Tucson-3332 E Elida St"},"type":"Feature","geometry":{"type":"Point","coordinates":[-110.92143,32.242397]}}],"is_temporal":true,"author":{"url":"","metadata":"","contact_name":"","contact_address":"","source":"","contact_phone":""},"source":"","pagination":{"sort":null,"start":0,"total":965,"limit":1000000},"state":"complete","tags":"","published":"2014-08-16T16:03:38-04:00","id":351518}