{"type":"FeatureCollection","data_type":"Dataset","url_type":null,"permissions":[{"permissions":{"download":true,"view":true},"group_id":"everyone"}],"classification":null,"title":"ebirdmap","count":454,"stream_id":381035,"contributor":{"url":"http://geocommons.com/users/78515","name":"SharpTern"},"data_attributes":null,"calculation_params":null,"icon_link":null,"link":"http://geocommons.com/overlays/381035.json","extent":[-124.018,25.1392,-52.7651,51.5947],"geometry_types":["point"],"unique_name":null,"name":"ebirdmap","feature_count":454,"description":"","next_feature":null,"is_raster":false,"short_classification":"Y","stats":{"column_5":{"max":75,"variance":17.3864690608866,"mean":2.13215859030837,"stdev":4.1697085103022,"min":1,"median":1},"latitude":{"max":51.594669,"variance":26.8724416999834,"mean":42.6401517953744,"stdev":5.1838635880956,"min":25.1391667,"median":43.7979403},"date":{"max":"2013/07/24 00:00:00 -0400","variance":1.42561837593858e+15,"mean":"2011/10/19 07:08:51 -0400","stdev":37757361.8773687,"min":"2005/07/07 00:00:00 -0400","median":"2011/11/13 00:00:00 -0500"},"longitude":{"max":-52.7651256,"variance":74.949376963182,"mean":-85.8127846323788,"stdev":8.65733082209419,"min":-124.0178776,"median":-84.5202975}},"features":[{"properties":{"latitude":42.7094222,"column_5":75,"date":{"end_time":"2006/06/11 00:00:00 -0400","original":"6/10/2006","granularity":"day","time":"2006/06/10 00:00:00 -0400"},"longitude":-84.5194056,"id":"ag2kyx3mq324","location":"Fenner Nature Center"},"type":"Feature","geometry":{"type":"Point","coordinates":[-84.5194056,42.7094222]}},{"properties":{"latitude":42.7600697,"column_5":21,"date":{"end_time":"2011/11/15 00:00:00 -0500","original":"11/14/2011","granularity":"day","time":"2011/11/14 00:00:00 -0500"},"longitude":-84.4004402,"id":"ag2kyx4auyv4","location":"Lake Lansing"},"type":"Feature","geometry":{"type":"Point","coordinates":[-84.4004402,42.7600697]}},{"properties":{"latitude":44.8861801,"column_5":18,"date":{"end_time":"2011/08/15 00:00:00 -0400","original":"8/14/2011","granularity":"day","time":"2011/08/14 00:00:00 -0400"},"longitude":-84.3069738,"id":"ag2kyxgm9vs9","location":"Lewiston Yard"},"type":"Feature","geometry":{"type":"Point","coordinates":[-84.3069738,44.8861801]}},{"properties":{"latitude":42.7597267,"column_5":17,"date":{"end_time":"2012/01/31 00:00:00 -0500","original":"1/30/2012","granularity":"day","time":"2012/01/30 00:00:00 -0500"},"longitude":-84.5661311,"id":"ag2kyx89l9lk","location":"Lansing Yard"},"type":"Feature","geometry":{"type":"Point","coordinates":[-84.5661311,42.7597267]}},{"properties":{"latitude":42.7669896,"column_5":16,"date":{"end_time":"2011/06/14 00:00:00 -0400","original":"6/13/2011","granularity":"day","time":"2011/06/13 00:00:00 -0400"},"longitude":-84.6370089,"id":"ag2kyxgh38sb","location":"Hawk Meadows Park"},"type":"Feature","geometry":{"type":"Point","coordinates":[-84.6370089,42.7669896]}},{"properties":{"latitude":43.1419549,"column_5":12,"date":{"end_time":"2011/07/26 00:00:00 -0400","original":"7/25/2011","granularity":"day","time":"2011/07/25 00:00:00 -0400"},"longitude":-84.5780754,"id":"ag2kyx5kxri5","location":"Maple River SGA - Unit A"},"type":"Feature","geometry":{"type":"Point","coordinates":[-84.5780754,43.1419549]}},{"properties":{"latitude":44.2506402,"column_5":12,"date":{"end_time":"2011/09/19 00:00:00 -0400","original":"9/18/2011","granularity":"day","time":"2011/09/18 00:00:00 -0400"},"longitude":-83.4539938,"id":"ag2kyx7y3qtr","location":"Sandy Hook Trail, Tawas Point"},"type":"Feature","geometry":{"type":"Point","coordinates":[-83.4539938,44.2506402]}},{"properties":{"latitude":41.6498064,"column_5":11,"date":{"end_time":"2010/05/14 00:00:00 -0400","original":"5/13/2010","granularity":"day","time":"2010/05/13 00:00:00 -0400"},"longitude":-83.2374224,"id":"ag2kyx58wrdm","location":"Metzger Marsh Wildlife Area"},"type":"Feature","geometry":{"type":"Point","coordinates":[-83.2374224,41.6498064]}},{"properties":{"latitude":42.7170655,"column_5":11,"date":{"end_time":"2011/01/01 00:00:00 -0500","original":"12/31/2010","granularity":"day","time":"2010/12/31 00:00:00 -0500"},"longitude":-84.531641,"id":"ag2kyxcd3a6f","location":"Potter Park"},"type":"Feature","geometry":{"type":"Point","coordinates":[-84.531641,42.7170655]}},{"properties":{"latitude":42.7863307,"column_5":11,"date":{"end_time":"2011/11/24 00:00:00 -0500","original":"11/23/2011","granularity":"day","time":"2011/11/23 00:00:00 -0500"},"longitude":-84.438858,"id":"ag2kyxdvl0rn","location":"Park Lake (Clinton Co.)"},"type":"Feature","geometry":{"type":"Point","coordinates":[-84.438858,42.7863307]}},{"properties":{"latitude":43.1443973,"column_5":10,"date":{"end_time":"2010/03/28 00:00:00 -0400","original":"3/27/2010","granularity":"day","time":"2010/03/27 00:00:00 -0400"},"longitude":-84.5537853,"id":"ag2kyx5srfwi","location":"Maple River State Game Area"},"type":"Feature","geometry":{"type":"Point","coordinates":[-84.5537853,43.1443973]}},{"properties":{"latitude":42.7665328,"column_5":10,"date":{"end_time":"2012/04/13 00:00:00 -0400","original":"4/12/2012","granularity":"day","time":"2012/04/12 00:00:00 -0400"},"longitude":-84.3889368,"id":"ag2kyxab0l9f","location":"Lake Lansing Park North"},"type":"Feature","geometry":{"type":"Point","coordinates":[-84.3889368,42.7665328]}},{"properties":{"latitude":41.6253904,"column_5":8,"date":{"end_time":"2010/05/14 00:00:00 -0400","original":"5/13/2010","granularity":"day","time":"2010/05/13 00:00:00 -0400"},"longitude":-83.191309,"id":"ag2kyxbkfzvn","location":"Magee Marsh Wildlife Area (Lucas Co.)"},"type":"Feature","geometry":{"type":"Point","coordinates":[-83.191309,41.6253904]}},{"properties":{"latitude":42.691836,"column_5":8,"date":{"end_time":"2010/10/11 00:00:00 -0400","original":"10/10/2010","granularity":"day","time":"2010/10/10 00:00:00 -0400"},"longitude":-84.6299601,"id":"ag2kyx8thr59","location":"Woldumar Nature Center"},"type":"Feature","geometry":{"type":"Point","coordinates":[-84.6299601,42.691836]}},{"properties":{"latitude":42.9492767,"column_5":8,"date":{"end_time":"2011/06/17 00:00:00 -0400","original":"6/16/2011","granularity":"day","time":"2011/06/16 00:00:00 -0400"},"longitude":-84.4122291,"id":"ag2kyxcvc9ll","location":"Sleepy Hollow, North of Lake Ovid"},"type":"Feature","geometry":{"type":"Point","coordinates":[-84.4122291,42.9492767]}},{"properties":{"latitude":42.6973874,"column_5":8,"date":{"end_time":"2011/07/28 00:00:00 -0400","original":"7/27/2011","granularity":"day","time":"2011/07/27 00:00:00 -0400"},"longitude":-84.3765557,"id":"ag2kyxiajbq9","location":"Harris Nature Center"},"type":"Feature","geometry":{"type":"Point","coordinates":[-84.3765557,42.6973874]}},{"properties":{"latitude":42.9351677,"column_5":8,"date":{"end_time":"2011/12/18 00:00:00 -0500","original":"12/17/2011","granularity":"day","time":"2011/12/17 00:00:00 -0500"},"longitude":-84.4048681,"id":"ag2kyx8f8mcn","location":"Sleepy Hollow SP (Lake Ovid)"},"type":"Feature","geometry":{"type":"Point","coordinates":[-84.4048681,42.9351677]}},{"properties":{"latitude":41.6277095,"column_5":8,"date":{"end_time":"2012/05/09 00:00:00 -0400","original":"5/8/2012","granularity":"day","time":"2012/05/08 00:00:00 -0400"},"longitude":-83.191884,"id":"ag2kyxcw0jry","location":"Magee Marsh Wildlife Area--Boardwalk"},"type":"Feature","geometry":{"type":"Point","coordinates":[-83.191884,41.6277095]}},{"properties":{"latitude":43.3627233,"column_5":8,"date":{"end_time":"2012/07/21 00:00:00 -0400","original":"7/20/2012","granularity":"day","time":"2012/07/20 00:00:00 -0400"},"longitude":-84.0148115,"id":"ag2kyx4q73wq","location":"Shiawassee NWR--Wildlife Drive"},"type":"Feature","geometry":{"type":"Point","coordinates":[-84.0148115,43.3627233]}},{"properties":{"latitude":44.9918576,"column_5":7,"date":{"end_time":"2006/07/20 00:00:00 -0400","original":"7/19/2006","granularity":"day","time":"2006/07/19 00:00:00 -0400"},"longitude":-85.477404,"id":"ag2kyx5ka6sw","location":"Old Mission Point Park/Lighthouse Park"},"type":"Feature","geometry":{"type":"Point","coordinates":[-85.477404,44.9918576]}},{"properties":{"latitude":43.1420802,"column_5":7,"date":{"end_time":"2011/07/26 00:00:00 -0400","original":"7/25/2011","granularity":"day","time":"2011/07/25 00:00:00 -0400"},"longitude":-84.543314,"id":"ag2kyx3wzh6k","location":"Maple River SGA - Unit C"},"type":"Feature","geometry":{"type":"Point","coordinates":[-84.543314,43.1420802]}},{"properties":{"latitude":44.3644831,"column_5":7,"date":{"end_time":"2011/08/18 00:00:00 -0400","original":"8/17/2011","granularity":"day","time":"2011/08/17 00:00:00 -0400"},"longitude":-84.8041534,"id":"ag2kyx5sw4s3","location":"Houghton Lake Flats"},"type":"Feature","geometry":{"type":"Point","coordinates":[-84.8041534,44.3644831]}},{"properties":{"latitude":44.44131,"column_5":7,"date":{"end_time":"2011/10/30 00:00:00 -0400","original":"10/29/2011","granularity":"day","time":"2011/10/29 00:00:00 -0400"},"longitude":-83.67534,"id":"ag2kyx7u2aj4","location":"Iargo Springs Interpretive Site"},"type":"Feature","geometry":{"type":"Point","coordinates":[-83.67534,44.44131]}},{"properties":{"latitude":43.2235227,"column_5":7,"date":{"end_time":"2012/01/07 00:00:00 -0500","original":"1/6/2012","granularity":"day","time":"2012/01/06 00:00:00 -0500"},"longitude":-86.3392696,"id":"ag2kyxj0ys9a","location":"Pere Marquette Park"},"type":"Feature","geometry":{"type":"Point","coordinates":[-86.3392696,43.2235227]}},{"properties":{"latitude":42.8087349,"column_5":7,"date":{"end_time":"2012/04/15 00:00:00 -0400","original":"4/14/2012","granularity":"day","time":"2012/04/14 00:00:00 -0400"},"longitude":-84.3714671,"id":"ag2kyxexjwpu","location":"Rose Lake - Vermillion Creek"},"type":"Feature","geometry":{"type":"Point","coordinates":[-84.3714671,42.8087349]}},{"properties":{"latitude":43.2511023,"column_5":7,"date":{"end_time":"2012/07/16 00:00:00 -0400","original":"7/15/2012","granularity":"day","time":"2012/07/15 00:00:00 -0400"},"longitude":-86.037524,"id":"ag2kyx5im45z","location":"Muskegon Wastewater System"},"type":"Feature","geometry":{"type":"Point","coordinates":[-86.037524,43.2511023]}},{"properties":{"latitude":44.7321317,"column_5":6,"date":{"end_time":"2010/05/26 00:00:00 -0400","original":"5/25/2010","granularity":"day","time":"2010/05/25 00:00:00 -0400"},"longitude":-86.1551285,"id":"ag2kyxch63ej","location":"Platte Point"},"type":"Feature","geometry":{"type":"Point","coordinates":[-86.1551285,44.7321317]}},{"properties":{"latitude":44.7403668,"column_5":6,"date":{"end_time":"2011/04/14 00:00:00 -0400","original":"4/13/2011","granularity":"day","time":"2011/04/13 00:00:00 -0400"},"longitude":-84.6631783,"id":"ag2kyxbapnrf","location":"Hartwick Pines SP (general)"},"type":"Feature","geometry":{"type":"Point","coordinates":[-84.6631783,44.7403668]}},{"properties":{"latitude":43.6704171,"column_5":6,"date":{"end_time":"2011/05/18 00:00:00 -0400","original":"5/17/2011","granularity":"day","time":"2011/05/17 00:00:00 -0400"},"longitude":-83.9065361,"id":"ag2kyxfcj1bw","location":"Tobico Lagoon"},"type":"Feature","geometry":{"type":"Point","coordinates":[-83.9065361,43.6704171]}},{"properties":{"latitude":43.2641438,"column_5":6,"date":{"end_time":"2012/01/10 00:00:00 -0500","original":"1/9/2012","granularity":"day","time":"2012/01/09 00:00:00 -0500"},"longitude":-86.0539169,"id":"ag2kyx9ttbb1","location":"Muskegon Wastewater System--Grassy Cells"},"type":"Feature","geometry":{"type":"Point","coordinates":[-86.0539169,43.2641438]}},{"properties":{"latitude":42.7290532,"column_5":6,"date":{"end_time":"2012/05/05 00:00:00 -0400","original":"5/4/2012","granularity":"day","time":"2012/05/04 00:00:00 -0400"},"longitude":-84.3763702,"id":"ag2kyxe5r9ha","location":"Van Atta Road Natural Area"},"type":"Feature","geometry":{"type":"Point","coordinates":[-84.3763702,42.7290532]}},{"properties":{"latitude":42.6962519,"column_5":5,"date":{"end_time":"2005/07/08 00:00:00 -0400","original":"7/7/2005","granularity":"day","time":"2005/07/07 00:00:00 -0400"},"longitude":-84.5298064,"id":"ag2kyxf1sv3t","location":"Hawk Island"},"type":"Feature","geometry":{"type":"Point","coordinates":[-84.5298064,42.6962519]}},{"properties":{"latitude":42.713597,"column_5":5,"date":{"end_time":"2011/04/29 00:00:00 -0400","original":"4/28/2011","granularity":"day","time":"2011/04/28 00:00:00 -0400"},"longitude":-84.5288944,"id":"ag2kyxdaym08","location":"Shubell Park"},"type":"Feature","geometry":{"type":"Point","coordinates":[-84.5288944,42.713597]}},{"properties":{"latitude":44.9446021,"column_5":5,"date":{"end_time":"2011/09/22 00:00:00 -0400","original":"9/21/2011","granularity":"day","time":"2011/09/21 00:00:00 -0400"},"longitude":-84.382081,"id":"ag2kyxal2k7k","location":"Big Bear Lake"},"type":"Feature","geometry":{"type":"Point","coordinates":[-84.382081,44.9446021]}},{"properties":{"latitude":42.0691986,"column_5":5,"date":{"end_time":"2012/02/01 00:00:00 -0500","original":"1/31/2012","granularity":"day","time":"2012/01/31 00:00:00 -0500"},"longitude":-83.1941986,"id":"ag2kyx4chf81","location":"Lake Erie Metropark"},"type":"Feature","geometry":{"type":"Point","coordinates":[-83.1941986,42.0691986]}},{"properties":{"latitude":42.0260038,"column_5":5,"date":{"end_time":"2012/03/29 00:00:00 -0400","original":"3/28/2012","granularity":"day","time":"2012/03/28 00:00:00 -0400"},"longitude":-83.1978204,"id":"ag2kyx6wunl0","location":"Pte. Mouillee SGA"},"type":"Feature","geometry":{"type":"Point","coordinates":[-83.1978204,42.0260038]}},{"properties":{"latitude":42.3946852,"column_5":4,"date":{"end_time":"2008/10/13 00:00:00 -0400","original":"10/12/2008","granularity":"day","time":"2008/10/12 00:00:00 -0400"},"longitude":-84.9989033,"id":"ag2kyxe8gjo3","location":"Bernard W. Baker Sanctuary"},"type":"Feature","geometry":{"type":"Point","coordinates":[-84.9989033,42.3946852]}},{"properties":{"latitude":44.742344,"column_5":4,"date":{"end_time":"2011/04/14 00:00:00 -0400","original":"4/13/2011","granularity":"day","time":"2011/04/13 00:00:00 -0400"},"longitude":-84.6472549,"id":"ag2kyx4juda9","location":"Hartwick Pines - AuSable Trail"},"type":"Feature","geometry":{"type":"Point","coordinates":[-84.6472549,44.742344]}},{"properties":{"latitude":43.7742237,"column_5":4,"date":{"end_time":"2011/05/18 00:00:00 -0400","original":"5/17/2011","granularity":"day","time":"2011/05/17 00:00:00 -0400"},"longitude":-83.9376283,"id":"ag2kyxfhcxaa","location":"Nayanquing Point SWA"},"type":"Feature","geometry":{"type":"Point","coordinates":[-83.9376283,43.7742237]}},{"properties":{"latitude":46.5830449,"column_5":4,"date":{"end_time":"2011/07/08 00:00:00 -0400","original":"7/7/2011","granularity":"day","time":"2011/07/07 00:00:00 -0400"},"longitude":-87.38711,"id":"ag2kyxbjy5qz","location":"Bog Walk, Marquette"},"type":"Feature","geometry":{"type":"Point","coordinates":[-87.38711,46.5830449]}},{"properties":{"latitude":42.6942648,"column_5":4,"date":{"end_time":"2011/07/28 00:00:00 -0400","original":"7/27/2011","granularity":"day","time":"2011/07/27 00:00:00 -0400"},"longitude":-84.3789482,"id":"ag2kyxc07ohi","location":"Legg Park Field"},"type":"Feature","geometry":{"type":"Point","coordinates":[-84.3789482,42.6942648]}},{"properties":{"latitude":44.8553668,"column_5":4,"date":{"end_time":"2011/08/15 00:00:00 -0400","original":"8/14/2011","granularity":"day","time":"2011/08/14 00:00:00 -0400"},"longitude":-84.3673611,"id":"ag2kyxgzbnga","location":"Old 612"},"type":"Feature","geometry":{"type":"Point","coordinates":[-84.3673611,44.8553668]}},{"properties":{"latitude":44.8026057,"column_5":4,"date":{"end_time":"2011/08/20 00:00:00 -0400","original":"8/19/2011","granularity":"day","time":"2011/08/19 00:00:00 -0400"},"longitude":-84.3803644,"id":"ag2kyx545pcv","location":"Pickerel Lake"},"type":"Feature","geometry":{"type":"Point","coordinates":[-84.3803644,44.8026057]}},{"properties":{"latitude":44.4063163,"column_5":4,"date":{"end_time":"2011/10/19 00:00:00 -0400","original":"10/18/2011","granularity":"day","time":"2011/10/18 00:00:00 -0400"},"longitude":-83.3185959,"id":"ag2kyxbthgkr","location":"AuSable River Breakwall"},"type":"Feature","geometry":{"type":"Point","coordinates":[-83.3185959,44.4063163]}},{"properties":{"latitude":43.2498291,"column_5":4,"date":{"end_time":"2012/01/10 00:00:00 -0500","original":"1/9/2012","granularity":"day","time":"2012/01/09 00:00:00 -0500"},"longitude":-86.0484924,"id":"ag2kyx6os2e4","location":"Muskegon Wastewater System--West Lagoon"},"type":"Feature","geometry":{"type":"Point","coordinates":[-86.0484924,43.2498291]}},{"properties":{"latitude":43.2206894,"column_5":4,"date":{"end_time":"2012/03/14 00:00:00 -0400","original":"3/13/2012","granularity":"day","time":"2012/03/13 00:00:00 -0400"},"longitude":-86.008255,"id":"ag2kyxdvkau7","location":"Muskegon Wastewater System--Laketon/Swanson Fields"},"type":"Feature","geometry":{"type":"Point","coordinates":[-86.008255,43.2206894]}},{"properties":{"latitude":42.704247,"column_5":4,"date":{"end_time":"2012/03/21 00:00:00 -0400","original":"3/20/2012","granularity":"day","time":"2012/03/20 00:00:00 -0400"},"longitude":-84.3400669,"id":"ag2kyximcnpo","location":"Williamstown Township Community Park"},"type":"Feature","geometry":{"type":"Point","coordinates":[-84.3400669,42.704247]}},{"properties":{"latitude":44.36827,"column_5":4,"date":{"end_time":"2012/04/27 00:00:00 -0400","original":"4/26/2012","granularity":"day","time":"2012/04/26 00:00:00 -0400"},"longitude":-83.4477604,"id":"ag2kyxayv0iw","location":"Tuttle Marsh Wildlife Area"},"type":"Feature","geometry":{"type":"Point","coordinates":[-83.4477604,44.36827]}},{"properties":{"latitude":41.6841898,"column_5":4,"date":{"end_time":"2012/05/08 00:00:00 -0400","original":"5/7/2012","granularity":"day","time":"2012/05/07 00:00:00 -0400"},"longitude":-83.3654426,"id":"ag2kyx71e39b","location":"Maumee Bay SP--Boardwalk"},"type":"Feature","geometry":{"type":"Point","coordinates":[-83.3654426,41.6841898]}},{"properties":{"latitude":43.6700032,"column_5":4,"date":{"end_time":"2012/08/22 00:00:00 -0400","original":"8/21/2012","granularity":"day","time":"2012/08/21 00:00:00 -0400"},"longitude":-83.9116268,"id":"ag2kyxj821jl","location":"Bay City SRA"},"type":"Feature","geometry":{"type":"Point","coordinates":[-83.9116268,43.6700032]}},{"properties":{"latitude":46.9910259,"column_5":3,"date":{"end_time":"2008/08/07 00:00:00 -0400","original":"8/6/2008","granularity":"day","time":"2008/08/06 00:00:00 -0400"},"longitude":-103.490181,"id":"ag2kyx5tos2y","location":"Theodore Roosevelt NP, Wind Canyon"},"type":"Feature","geometry":{"type":"Point","coordinates":[-103.490181,46.9910259]}},{"properties":{"latitude":46.9513755,"column_5":3,"date":{"end_time":"2008/08/08 00:00:00 -0400","original":"8/7/2008","granularity":"day","time":"2008/08/07 00:00:00 -0400"},"longitude":-103.5313368,"id":"ag2kyxjxp5zh","location":"Theodore Roosevelt NP--Cottonwood Campground"},"type":"Feature","geometry":{"type":"Point","coordinates":[-103.5313368,46.9513755]}},{"properties":{"latitude":41.611298,"column_5":3,"date":{"end_time":"2010/05/14 00:00:00 -0400","original":"5/13/2010","granularity":"day","time":"2010/05/13 00:00:00 -0400"},"longitude":-83.240606,"id":"ag2kyxeqo16k","location":"Ottawa NWR--Stange Rd. @ Krause Rd. and Observation Tower"},"type":"Feature","geometry":{"type":"Point","coordinates":[-83.240606,41.611298]}},{"properties":{"latitude":41.5536134,"column_5":3,"date":{"end_time":"2010/05/30 00:00:00 -0400","original":"5/29/2010","granularity":"day","time":"2010/05/29 00:00:00 -0400"},"longitude":-83.8585468,"id":"ag2kyx6irbk7","location":"Oak Openings Preserve Metropark"},"type":"Feature","geometry":{"type":"Point","coordinates":[-83.8585468,41.5536134]}},{"properties":{"latitude":45.8439882,"column_5":3,"date":{"end_time":"2011/03/13 00:00:00 -0500","original":"3/12/2011","granularity":"day","time":"2011/03/12 00:00:00 -0500"},"longitude":-84.7241592,"id":"ag2kyx9g9hzw","location":"Mackinac Bridge (North End)"},"type":"Feature","geometry":{"type":"Point","coordinates":[-84.7241592,45.8439882]}},{"properties":{"latitude":41.607517,"column_5":3,"date":{"end_time":"2011/05/12 00:00:00 -0400","original":"5/11/2011","granularity":"day","time":"2011/05/11 00:00:00 -0400"},"longitude":-83.2096338,"id":"ag2kyx7coyvg","location":"Ottawa NWR--Visitor Center and Boardwalk"},"type":"Feature","geometry":{"type":"Point","coordinates":[-83.2096338,41.607517]}},{"properties":{"latitude":44.7265218,"column_5":3,"date":{"end_time":"2011/06/13 00:00:00 -0400","original":"6/12/2011","granularity":"day","time":"2011/06/12 00:00:00 -0400"},"longitude":-86.1435413,"id":"ag2kyx8vejjl","location":"El Dorado Park"},"type":"Feature","geometry":{"type":"Point","coordinates":[-86.1435413,44.7265218]}},{"properties":{"latitude":43.3249826,"column_5":3,"date":{"end_time":"2011/07/21 00:00:00 -0400","original":"7/20/2011","granularity":"day","time":"2011/07/20 00:00:00 -0400"},"longitude":-84.0332329,"id":"ag2kyxgu36qb","location":"Shiawassee NWR--Bishop Road Observation Platform"},"type":"Feature","geometry":{"type":"Point","coordinates":[-84.0332329,43.3249826]}},{"properties":{"latitude":44.7810278,"column_5":3,"date":{"end_time":"2011/08/17 00:00:00 -0400","original":"8/16/2011","granularity":"day","time":"2011/08/16 00:00:00 -0400"},"longitude":-84.5892549,"id":"ag2kyx48d8ix","location":"Jones Lake - South Shore"},"type":"Feature","geometry":{"type":"Point","coordinates":[-84.5892549,44.7810278]}},{"properties":{"latitude":44.8378562,"column_5":3,"date":{"end_time":"2011/08/19 00:00:00 -0400","original":"8/18/2011","granularity":"day","time":"2011/08/18 00:00:00 -0400"},"longitude":-84.3730903,"id":"ag2kyx4i0s1f","location":"Pickerel Lake Road Two-track"},"type":"Feature","geometry":{"type":"Point","coordinates":[-84.3730903,44.8378562]}},{"properties":{"latitude":44.864508,"column_5":3,"date":{"end_time":"2011/08/26 00:00:00 -0400","original":"8/25/2011","granularity":"day","time":"2011/08/25 00:00:00 -0400"},"longitude":-84.3138885,"id":"ag2kyx9bvuls","location":"Lewiston Lodge"},"type":"Feature","geometry":{"type":"Point","coordinates":[-84.3138885,44.864508]}},{"properties":{"latitude":44.9473661,"column_5":3,"date":{"end_time":"2011/09/24 00:00:00 -0400","original":"9/23/2011","granularity":"day","time":"2011/09/23 00:00:00 -0400"},"longitude":-84.3836689,"id":"ag2kyxgxwdbi","location":"Beaver Pond/Big Bear Lake"},"type":"Feature","geometry":{"type":"Point","coordinates":[-84.3836689,44.9473661]}},{"properties":{"latitude":46.5864737,"column_5":3,"date":{"end_time":"2011/09/26 00:00:00 -0400","original":"9/25/2011","granularity":"day","time":"2011/09/25 00:00:00 -0400"},"longitude":-87.3849535,"id":"ag2kyxestj2r","location":"Presque Isle Park"},"type":"Feature","geometry":{"type":"Point","coordinates":[-87.3849535,46.5864737]}},{"properties":{"latitude":44.7797637,"column_5":3,"date":{"end_time":"2011/10/05 00:00:00 -0400","original":"10/4/2011","granularity":"day","time":"2011/10/04 00:00:00 -0400"},"longitude":-85.3110695,"id":"ag2kyxc5tlue","location":"M-72"},"type":"Feature","geometry":{"type":"Point","coordinates":[-85.3110695,44.7797637]}},{"properties":{"latitude":43.6719071,"column_5":3,"date":{"end_time":"2011/10/16 00:00:00 -0400","original":"10/15/2011","granularity":"day","time":"2011/10/15 00:00:00 -0400"},"longitude":-83.9067936,"id":"ag2kyx41727u","location":"Bay City Rec Area Beach"},"type":"Feature","geometry":{"type":"Point","coordinates":[-83.9067936,43.6719071]}},{"properties":{"latitude":44.2772858,"column_5":3,"date":{"end_time":"2011/10/19 00:00:00 -0400","original":"10/18/2011","granularity":"day","time":"2011/10/18 00:00:00 -0400"},"longitude":-83.5132599,"id":"ag2kyxdbi9yj","location":"Tawas City"},"type":"Feature","geometry":{"type":"Point","coordinates":[-83.5132599,44.2772858]}},{"properties":{"latitude":44.3420821,"column_5":3,"date":{"end_time":"2011/10/23 00:00:00 -0400","original":"10/22/2011","granularity":"day","time":"2011/10/22 00:00:00 -0400"},"longitude":-84.7921157,"id":"ag2kyxddgvpk","location":"Houghton Lake Access"},"type":"Feature","geometry":{"type":"Point","coordinates":[-84.7921157,44.3420821]}},{"properties":{"latitude":44.6307948,"column_5":3,"date":{"end_time":"2011/10/23 00:00:00 -0400","original":"10/22/2011","granularity":"day","time":"2011/10/22 00:00:00 -0400"},"longitude":-84.5151615,"id":"ag2kyx9qj9ys","location":"Wakeley Lake Trail"},"type":"Feature","geometry":{"type":"Point","coordinates":[-84.5151615,44.6307948]}},{"properties":{"latitude":44.0302683,"column_5":3,"date":{"end_time":"2012/01/07 00:00:00 -0500","original":"1/6/2012","granularity":"day","time":"2012/01/06 00:00:00 -0500"},"longitude":-86.5056472,"id":"ag2kyxa9dk2v","location":"Big Sable River"},"type":"Feature","geometry":{"type":"Point","coordinates":[-86.5056472,44.0302683]}},{"properties":{"latitude":43.2400757,"column_5":3,"date":{"end_time":"2012/01/10 00:00:00 -0500","original":"1/9/2012","granularity":"day","time":"2012/01/09 00:00:00 -0500"},"longitude":-86.0165634,"id":"ag2kyxjtyvn5","location":"Muskegon Wastewater System--East Lagoon and Landfill"},"type":"Feature","geometry":{"type":"Point","coordinates":[-86.0165634,43.2400757]}},{"properties":{"latitude":42.7989033,"column_5":3,"date":{"end_time":"2012/02/16 00:00:00 -0500","original":"2/15/2012","granularity":"day","time":"2012/02/15 00:00:00 -0500"},"longitude":-84.3897168,"id":"ag2kyx8utbmy","location":"Rose Lake - Stoll Road"},"type":"Feature","geometry":{"type":"Point","coordinates":[-84.3897168,42.7989033]}},{"properties":{"latitude":43.1538901,"column_5":3,"date":{"end_time":"2012/02/23 00:00:00 -0500","original":"2/22/2012","granularity":"day","time":"2012/02/22 00:00:00 -0500"},"longitude":-84.5433729,"id":"ag2kyxegc879","location":"Ranger/Baldwin Roads"},"type":"Feature","geometry":{"type":"Point","coordinates":[-84.5433729,43.1538901]}},{"properties":{"latitude":42.716324,"column_5":3,"date":{"end_time":"2012/03/17 00:00:00 -0400","original":"3/16/2012","granularity":"day","time":"2012/03/16 00:00:00 -0400"},"longitude":-84.5218425,"id":"ag2kyxgu3hp6","location":"River Trail/Krueger's Landing"},"type":"Feature","geometry":{"type":"Point","coordinates":[-84.5218425,42.716324]}},{"properties":{"latitude":42.802387,"column_5":3,"date":{"end_time":"2012/03/20 00:00:00 -0400","original":"3/19/2012","granularity":"day","time":"2012/03/19 00:00:00 -0400"},"longitude":-84.4412613,"id":"ag2kyxgaixtf","location":"Bengel Wildlife Center"},"type":"Feature","geometry":{"type":"Point","coordinates":[-84.4412613,42.802387]}},{"properties":{"latitude":42.5141201,"column_5":3,"date":{"end_time":"2012/04/07 00:00:00 -0400","original":"4/6/2012","granularity":"day","time":"2012/04/06 00:00:00 -0400"},"longitude":-84.3231583,"id":"ag2kyxcv79us","location":"Dansville SGA"},"type":"Feature","geometry":{"type":"Point","coordinates":[-84.3231583,42.5141201]}},{"properties":{"latitude":44.6199672,"column_5":3,"date":{"end_time":"2012/04/25 00:00:00 -0400","original":"4/24/2012","granularity":"day","time":"2012/04/24 00:00:00 -0400"},"longitude":-86.2242517,"id":"ag2kyxattrmy","location":"Betsie Lake"},"type":"Feature","geometry":{"type":"Point","coordinates":[-86.2242517,44.6199672]}},{"properties":{"latitude":42.0764619,"column_5":3,"date":{"end_time":"2012/05/03 00:00:00 -0400","original":"5/2/2012","granularity":"day","time":"2012/05/02 00:00:00 -0400"},"longitude":-83.1984651,"id":"ag2kyxg9fcnt","location":"Lake Erie Metropark--Marshlands Nature Center"},"type":"Feature","geometry":{"type":"Point","coordinates":[-83.1984651,42.0764619]}},{"properties":{"latitude":41.5462998,"column_5":3,"date":{"end_time":"2012/05/13 00:00:00 -0400","original":"5/12/2012","granularity":"day","time":"2012/05/12 00:00:00 -0400"},"longitude":-83.8445368,"id":"ag2kyx4r3p9j","location":"Oak Openings Preserve Metropark--Buehner Center and Mallard Lake"},"type":"Feature","geometry":{"type":"Point","coordinates":[-83.8445368,41.5462998]}},{"properties":{"latitude":41.6310555,"column_5":3,"date":{"end_time":"2013/05/08 00:00:00 -0400","original":"5/7/2013","granularity":"day","time":"2013/05/07 00:00:00 -0400"},"longitude":-83.1958526,"id":"ag2kyxec15f6","location":"Ottawa NWR--Crane Creek Estuary Trail"},"type":"Feature","geometry":{"type":"Point","coordinates":[-83.1958526,41.6310555]}},{"properties":{"latitude":48.4613685,"column_5":2,"date":{"end_time":"2008/08/12 00:00:00 -0400","original":"8/11/2008","granularity":"day","time":"2008/08/11 00:00:00 -0400"},"longitude":-122.942698,"id":"ag2kyx3mfq19","location":"Lopez Island -- Shark Reef Park"},"type":"Feature","geometry":{"type":"Point","coordinates":[-122.942698,48.4613685]}},{"properties":{"latitude":28.1922058,"column_5":2,"date":{"end_time":"2009/02/12 00:00:00 -0500","original":"2/11/2009","granularity":"day","time":"2009/02/11 00:00:00 -0500"},"longitude":-82.7866387,"id":"ag2kyxedm8ek","location":"Anclote Gulf County Park"},"type":"Feature","geometry":{"type":"Point","coordinates":[-82.7866387,28.1922058]}},{"properties":{"latitude":28.0706,"column_5":2,"date":{"end_time":"2009/02/17 00:00:00 -0500","original":"2/16/2009","granularity":"day","time":"2009/02/16 00:00:00 -0500"},"longitude":-82.8314,"id":"ag2kyx3iji6o","location":"Honeymoon Island SP"},"type":"Feature","geometry":{"type":"Point","coordinates":[-82.8314,28.0706]}},{"properties":{"latitude":44.7104512,"column_5":2,"date":{"end_time":"2009/05/11 00:00:00 -0400","original":"5/10/2009","granularity":"day","time":"2009/05/10 00:00:00 -0400"},"longitude":-86.1284351,"id":"ag2kyx8qz7oy","location":"Sleeping Bear Dunes NL, Loon Lake"},"type":"Feature","geometry":{"type":"Point","coordinates":[-86.1284351,44.7104512]}},{"properties":{"latitude":41.5116624,"column_5":2,"date":{"end_time":"2010/05/14 00:00:00 -0400","original":"5/13/2010","granularity":"day","time":"2010/05/13 00:00:00 -0400"},"longitude":-82.9354477,"id":"ag2kyxj3u49m","location":"Port Clinton"},"type":"Feature","geometry":{"type":"Point","coordinates":[-82.9354477,41.5116624]}},{"properties":{"latitude":42.645387,"column_5":2,"date":{"end_time":"2010/11/15 00:00:00 -0500","original":"11/14/2010","granularity":"day","time":"2010/11/14 00:00:00 -0500"},"longitude":-86.2260246,"id":"ag2kyxio1taw","location":"Douglas Beach Park"},"type":"Feature","geometry":{"type":"Point","coordinates":[-86.2260246,42.645387]}},{"properties":{"latitude":44.7915818,"column_5":2,"date":{"end_time":"2010/11/25 00:00:00 -0500","original":"11/24/2010","granularity":"day","time":"2010/11/24 00:00:00 -0500"},"longitude":-84.5461464,"id":"ag2kyxi2yzcl","location":"KP Lake"},"type":"Feature","geometry":{"type":"Point","coordinates":[-84.5461464,44.7915818]}},{"properties":{"latitude":42.7705181,"column_5":2,"date":{"end_time":"2011/02/06 00:00:00 -0500","original":"2/5/2011","granularity":"day","time":"2011/02/05 00:00:00 -0500"},"longitude":-84.7447586,"id":"ag2kyxjgq41o","location":"ADM Road"},"type":"Feature","geometry":{"type":"Point","coordinates":[-84.7447586,42.7705181]}},{"properties":{"latitude":42.5098179,"column_5":2,"date":{"end_time":"2011/06/25 00:00:00 -0400","original":"6/24/2011","granularity":"day","time":"2011/06/24 00:00:00 -0400"},"longitude":-84.4338799,"id":"ag2kyx5dtppn","location":"Plains Road"},"type":"Feature","geometry":{"type":"Point","coordinates":[-84.4338799,42.5098179]}},{"properties":{"latitude":43.0663483,"column_5":2,"date":{"end_time":"2011/07/01 00:00:00 -0400","original":"6/30/2011","granularity":"day","time":"2011/06/30 00:00:00 -0400"},"longitude":-85.4128218,"id":"ag2kyxjj58h9","location":"Saul Lake Bog"},"type":"Feature","geometry":{"type":"Point","coordinates":[-85.4128218,43.0663483]}},{"properties":{"latitude":46.6058477,"column_5":2,"date":{"end_time":"2011/07/11 00:00:00 -0400","original":"7/10/2011","granularity":"day","time":"2011/07/10 00:00:00 -0400"},"longitude":-85.2059054,"id":"ag2kyxbjkf3z","location":"River Walk, Tahquamenon Falls"},"type":"Feature","geometry":{"type":"Point","coordinates":[-85.2059054,46.6058477]}},{"properties":{"latitude":43.3522703,"column_5":2,"date":{"end_time":"2011/07/21 00:00:00 -0400","original":"7/20/2011","granularity":"day","time":"2011/07/20 00:00:00 -0400"},"longitude":-84.0134168,"id":"ag2kyxgellxt","location":"Shiawasse NWR - Location B"},"type":"Feature","geometry":{"type":"Point","coordinates":[-84.0134168,43.3522703]}},{"properties":{"latitude":43.3551412,"column_5":2,"date":{"end_time":"2011/07/21 00:00:00 -0400","original":"7/20/2011","granularity":"day","time":"2011/07/20 00:00:00 -0400"},"longitude":-84.0384579,"id":"ag2kyx5d29gg","location":"Shiawassee NWR - Location A"},"type":"Feature","geometry":{"type":"Point","coordinates":[-84.0384579,43.3551412]}},{"properties":{"latitude":44.8842151,"column_5":2,"date":{"end_time":"2011/08/06 00:00:00 -0400","original":"8/5/2011","granularity":"day","time":"2011/08/05 00:00:00 -0400"},"longitude":-84.3229008,"id":"ag2kyxclars7","location":"Lewiston"},"type":"Feature","geometry":{"type":"Point","coordinates":[-84.3229008,44.8842151]}},{"properties":{"latitude":44.8335043,"column_5":2,"date":{"end_time":"2011/08/16 00:00:00 -0400","original":"8/15/2011","granularity":"day","time":"2011/08/15 00:00:00 -0400"},"longitude":-84.4589639,"id":"ag2kyxak37pl","location":"Highlander Trail"},"type":"Feature","geometry":{"type":"Point","coordinates":[-84.4589639,44.8335043]}},{"properties":{"latitude":44.8575876,"column_5":2,"date":{"end_time":"2011/08/16 00:00:00 -0400","original":"8/15/2011","granularity":"day","time":"2011/08/15 00:00:00 -0400"},"longitude":-84.3501949,"id":"ag2kyxf5y0vw","location":"Wet Area Old 612"},"type":"Feature","geometry":{"type":"Point","coordinates":[-84.3501949,44.8575876]}},{"properties":{"latitude":44.6985555,"column_5":2,"date":{"end_time":"2011/08/17 00:00:00 -0400","original":"8/16/2011","granularity":"day","time":"2011/08/16 00:00:00 -0400"},"longitude":-84.4938326,"id":"ag2kyx4jnj5t","location":"Dyer Truck Trail"},"type":"Feature","geometry":{"type":"Point","coordinates":[-84.4938326,44.6985555]}},{"properties":{"latitude":44.791399,"column_5":2,"date":{"end_time":"2011/08/19 00:00:00 -0400","original":"8/18/2011","granularity":"day","time":"2011/08/18 00:00:00 -0400"},"longitude":-84.3751502,"id":"ag2kyxbwop7r","location":"Pickerel Lake Parking"},"type":"Feature","geometry":{"type":"Point","coordinates":[-84.3751502,44.791399]}},{"properties":{"latitude":44.9255689,"column_5":2,"date":{"end_time":"2011/08/26 00:00:00 -0400","original":"8/25/2011","granularity":"day","time":"2011/08/25 00:00:00 -0400"},"longitude":-84.3144035,"id":"ag2kyx7ub2sz","location":"Buttles Pathway 1-2"},"type":"Feature","geometry":{"type":"Point","coordinates":[-84.3144035,44.9255689]}},{"properties":{"latitude":44.8003788,"column_5":2,"date":{"end_time":"2011/09/12 00:00:00 -0400","original":"9/11/2011","granularity":"day","time":"2011/09/11 00:00:00 -0400"},"longitude":-85.2881312,"id":"ag2kyx7l2fio","location":"Skegemog Swamp Observation Deck"},"type":"Feature","geometry":{"type":"Point","coordinates":[-85.2881312,44.8003788]}},{"properties":{"latitude":46.7704975,"column_5":2,"date":{"end_time":"2011/09/13 00:00:00 -0400","original":"9/12/2011","granularity":"day","time":"2011/09/12 00:00:00 -0400"},"longitude":-84.9540138,"id":"ag2kyxi3ny1h","location":"Whitefish Point (Beach)"},"type":"Feature","geometry":{"type":"Point","coordinates":[-84.9540138,46.7704975]}},{"properties":{"latitude":46.5549281,"column_5":2,"date":{"end_time":"2011/09/14 00:00:00 -0400","original":"9/13/2011","granularity":"day","time":"2011/09/13 00:00:00 -0400"},"longitude":-85.0312936,"id":"ag2kyxhbp0n7","location":"Tahquamenon River Mouth"},"type":"Feature","geometry":{"type":"Point","coordinates":[-85.0312936,46.5549281]}},{"properties":{"latitude":44.8423599,"column_5":2,"date":{"end_time":"2011/09/15 00:00:00 -0400","original":"9/14/2011","granularity":"day","time":"2011/09/14 00:00:00 -0400"},"longitude":-84.4250393,"id":"ag2kyxi95b2a","location":"612 Near Walsh"},"type":"Feature","geometry":{"type":"Point","coordinates":[-84.4250393,44.8423599]}},{"properties":{"latitude":44.7333664,"column_5":2,"date":{"end_time":"2011/09/16 00:00:00 -0400","original":"9/15/2011","granularity":"day","time":"2011/09/15 00:00:00 -0400"},"longitude":-84.6849346,"id":"ag2kyx4v22aq","location":"Glory Lake Trail"},"type":"Feature","geometry":{"type":"Point","coordinates":[-84.6849346,44.7333664]}},{"properties":{"latitude":44.6056239,"column_5":2,"date":{"end_time":"2011/09/18 00:00:00 -0400","original":"9/17/2011","granularity":"day","time":"2011/09/17 00:00:00 -0400"},"longitude":-84.2590427,"id":"ag2kyxj0qaem","location":"Luzerne Boardwalk"},"type":"Feature","geometry":{"type":"Point","coordinates":[-84.2590427,44.6056239]}},{"properties":{"latitude":44.6957489,"column_5":2,"date":{"end_time":"2011/10/07 00:00:00 -0400","original":"10/6/2011","granularity":"day","time":"2011/10/06 00:00:00 -0400"},"longitude":-83.7849998,"id":"ag2kyxhp0r3x","location":"M-65"},"type":"Feature","geometry":{"type":"Point","coordinates":[-83.7849998,44.6957489]}},{"properties":{"latitude":43.6789219,"column_5":2,"date":{"end_time":"2011/10/09 00:00:00 -0400","original":"10/8/2011","granularity":"day","time":"2011/10/08 00:00:00 -0400"},"longitude":-83.9201832,"id":"ag2kyx9s722z","location":"Tobico Marsh"},"type":"Feature","geometry":{"type":"Point","coordinates":[-83.9201832,43.6789219]}},{"properties":{"latitude":45.017911,"column_5":2,"date":{"end_time":"2011/10/13 00:00:00 -0400","original":"10/12/2011","granularity":"day","time":"2011/10/12 00:00:00 -0400"},"longitude":-84.6208191,"id":"ag2kyx5v0c6s","location":"M-32"},"type":"Feature","geometry":{"type":"Point","coordinates":[-84.6208191,45.017911]}},{"properties":{"latitude":43.6726986,"column_5":2,"date":{"end_time":"2011/10/16 00:00:00 -0400","original":"10/15/2011","granularity":"day","time":"2011/10/15 00:00:00 -0400"},"longitude":-83.9142179,"id":"ag2kyxch0s55","location":"Andersen Nature Trail"},"type":"Feature","geometry":{"type":"Point","coordinates":[-83.9142179,43.6726986]}},{"properties":{"latitude":44.8008396,"column_5":2,"date":{"end_time":"2011/10/24 00:00:00 -0400","original":"10/23/2011","granularity":"day","time":"2011/10/23 00:00:00 -0400"},"longitude":-84.3130302,"id":"ag2kyxeiyf3h","location":"Bear Lake Road"},"type":"Feature","geometry":{"type":"Point","coordinates":[-84.3130302,44.8008396]}},{"properties":{"latitude":46.6446635,"column_5":2,"date":{"end_time":"2011/10/27 00:00:00 -0400","original":"10/26/2011","granularity":"day","time":"2011/10/26 00:00:00 -0400"},"longitude":-87.5446415,"id":"ag2kyxb6tip4","location":"Echo Lake"},"type":"Feature","geometry":{"type":"Point","coordinates":[-87.5446415,46.6446635]}},{"properties":{"latitude":44.2768864,"column_5":2,"date":{"end_time":"2011/10/30 00:00:00 -0400","original":"10/29/2011","granularity":"day","time":"2011/10/29 00:00:00 -0400"},"longitude":-83.4885406,"id":"ag2kyxiyc0ac","location":"East Tawas Harbor"},"type":"Feature","geometry":{"type":"Point","coordinates":[-83.4885406,44.2768864]}},{"properties":{"latitude":44.9322381,"column_5":2,"date":{"end_time":"2011/10/31 00:00:00 -0400","original":"10/30/2011","granularity":"day","time":"2011/10/30 00:00:00 -0400"},"longitude":-84.6899986,"id":"ag2kyxfz2rvf","location":"Otsego Lake State Park"},"type":"Feature","geometry":{"type":"Point","coordinates":[-84.6899986,44.9322381]}},{"properties":{"latitude":46.5415653,"column_5":2,"date":{"end_time":"2011/11/11 00:00:00 -0500","original":"11/10/2011","granularity":"day","time":"2011/11/10 00:00:00 -0500"},"longitude":-87.3839664,"id":"ag2kyxdfdrhf","location":"Marquette--Lower Harbor"},"type":"Feature","geometry":{"type":"Point","coordinates":[-87.3839664,46.5415653]}},{"properties":{"latitude":42.6433667,"column_5":2,"date":{"end_time":"2011/11/14 00:00:00 -0500","original":"11/13/2011","granularity":"day","time":"2011/11/13 00:00:00 -0500"},"longitude":-86.1974859,"id":"ag2kyx94qmqb","location":"Wade's Bayou Park"},"type":"Feature","geometry":{"type":"Point","coordinates":[-86.1974859,42.6433667]}},{"properties":{"latitude":44.6420327,"column_5":2,"date":{"end_time":"2011/12/07 00:00:00 -0500","original":"12/6/2011","granularity":"day","time":"2011/12/06 00:00:00 -0500"},"longitude":-83.2979965,"id":"ag2kyx4ukukw","location":"Harrisville SP"},"type":"Feature","geometry":{"type":"Point","coordinates":[-83.2979965,44.6420327]}},{"properties":{"latitude":44.6592359,"column_5":2,"date":{"end_time":"2011/12/12 00:00:00 -0500","original":"12/11/2011","granularity":"day","time":"2011/12/11 00:00:00 -0500"},"longitude":-83.2847218,"id":"ag2kyxahe3ls","location":"Harrisville Harbor"},"type":"Feature","geometry":{"type":"Point","coordinates":[-83.2847218,44.6592359]}},{"properties":{"latitude":45.0449943,"column_5":2,"date":{"end_time":"2011/12/12 00:00:00 -0500","original":"12/11/2011","granularity":"day","time":"2011/12/11 00:00:00 -0500"},"longitude":-83.4474783,"id":"ag2kyxdqjypt","location":"Water Works Park"},"type":"Feature","geometry":{"type":"Point","coordinates":[-83.4474783,45.0449943]}},{"properties":{"latitude":42.7086773,"column_5":2,"date":{"end_time":"2012/01/08 00:00:00 -0500","original":"1/7/2012","granularity":"day","time":"2012/01/07 00:00:00 -0500"},"longitude":-84.53373,"id":"ag2kyxikpgv0","location":"Josh's House"},"type":"Feature","geometry":{"type":"Point","coordinates":[-84.53373,42.7086773]}},{"properties":{"latitude":42.6260329,"column_5":2,"date":{"end_time":"2012/01/09 00:00:00 -0500","original":"1/8/2012","granularity":"day","time":"2012/01/08 00:00:00 -0500"},"longitude":-84.1089539,"id":"ag2kyx8pkukc","location":"Judd and Nicholson Roads"},"type":"Feature","geometry":{"type":"Point","coordinates":[-84.1089539,42.6260329]}},{"properties":{"latitude":42.6299483,"column_5":2,"date":{"end_time":"2012/02/14 00:00:00 -0500","original":"2/13/2012","granularity":"day","time":"2012/02/13 00:00:00 -0500"},"longitude":-84.3100338,"id":"ag2kyxg4kxih","location":"Frost/Zimmer"},"type":"Feature","geometry":{"type":"Point","coordinates":[-84.3100338,42.6299483]}},{"properties":{"latitude":42.7098598,"column_5":2,"date":{"end_time":"2012/02/24 00:00:00 -0500","original":"2/23/2012","granularity":"day","time":"2012/02/23 00:00:00 -0500"},"longitude":-84.5282798,"id":"ag2kyxhvmbrs","location":"Sycamore Creek Golf/River Trail"},"type":"Feature","geometry":{"type":"Point","coordinates":[-84.5282798,42.7098598]}},{"properties":{"latitude":43.3212657,"column_5":2,"date":{"end_time":"2012/03/08 00:00:00 -0500","original":"3/7/2012","granularity":"day","time":"2012/03/07 00:00:00 -0500"},"longitude":-84.0361343,"id":"ag2kyxd0ooq8","location":"Shiawasse NWR - Curtis Road"},"type":"Feature","geometry":{"type":"Point","coordinates":[-84.0361343,43.3212657]}},{"properties":{"latitude":43.2468908,"column_5":2,"date":{"end_time":"2012/03/14 00:00:00 -0400","original":"3/13/2012","granularity":"day","time":"2012/03/13 00:00:00 -0400"},"longitude":-86.0379524,"id":"ag2kyxj4jkwj","location":"Muskegon Wastewater System--Center Dike"},"type":"Feature","geometry":{"type":"Point","coordinates":[-86.0379524,43.2468908]}},{"properties":{"latitude":42.9413283,"column_5":2,"date":{"end_time":"2012/03/19 00:00:00 -0400","original":"3/18/2012","granularity":"day","time":"2012/03/18 00:00:00 -0400"},"longitude":-85.1279788,"id":"ag2kyxfm7xso","location":"Ionia SRA, Sessions Lake (and Shores)"},"type":"Feature","geometry":{"type":"Point","coordinates":[-85.1279788,42.9413283]}},{"properties":{"latitude":42.3808834,"column_5":2,"date":{"end_time":"2012/04/08 00:00:00 -0400","original":"4/7/2012","granularity":"day","time":"2012/04/07 00:00:00 -0400"},"longitude":-85.0009398,"id":"ag2kyxd9d1qz","location":"Baker Sanctuary, South Side"},"type":"Feature","geometry":{"type":"Point","coordinates":[-85.0009398,42.3808834]}},{"properties":{"latitude":42.5339827,"column_5":2,"date":{"end_time":"2012/04/16 00:00:00 -0400","original":"4/15/2012","granularity":"day","time":"2012/04/15 00:00:00 -0400"},"longitude":-83.6461258,"id":"ag2kyxc6nwu9","location":"Kensington Metropark (Oakland Co.)"},"type":"Feature","geometry":{"type":"Point","coordinates":[-83.6461258,42.5339827]}},{"properties":{"latitude":42.5297274,"column_5":2,"date":{"end_time":"2012/04/16 00:00:00 -0400","original":"4/15/2012","granularity":"day","time":"2012/04/15 00:00:00 -0400"},"longitude":-83.6701927,"id":"ag2kyxh7lmti","location":"Kensington Metropark--Nature Center"},"type":"Feature","geometry":{"type":"Point","coordinates":[-83.6701927,42.5297274]}},{"properties":{"latitude":42.5796301,"column_5":2,"date":{"end_time":"2012/04/20 00:00:00 -0400","original":"4/19/2012","granularity":"day","time":"2012/04/19 00:00:00 -0400"},"longitude":-82.8032684,"id":"ag2kyx9c32iv","location":"Lake St. Clair Metropark (Metro Beach Metropark)"},"type":"Feature","geometry":{"type":"Point","coordinates":[-82.8032684,42.5796301]}},{"properties":{"latitude":44.7088909,"column_5":2,"date":{"end_time":"2012/04/25 00:00:00 -0400","original":"4/24/2012","granularity":"day","time":"2012/04/24 00:00:00 -0400"},"longitude":-86.1259721,"id":"ag2kyxco4trc","location":"Sleeping Bear Dunes NL--Loon Lake"},"type":"Feature","geometry":{"type":"Point","coordinates":[-86.1259721,44.7088909]}},{"properties":{"latitude":41.6039256,"column_5":2,"date":{"end_time":"2012/05/07 00:00:00 -0400","original":"5/6/2012","granularity":"day","time":"2012/05/06 00:00:00 -0400"},"longitude":-83.153283,"id":"ag2kyx5j3gi0","location":"Turtle Creek estuary--OH-2 bridge"},"type":"Feature","geometry":{"type":"Point","coordinates":[-83.153283,41.6039256]}},{"properties":{"latitude":41.5991334,"column_5":2,"date":{"end_time":"2012/05/09 00:00:00 -0400","original":"5/8/2012","granularity":"day","time":"2012/05/08 00:00:00 -0400"},"longitude":-83.1838739,"id":"ag2kyx3kck33","location":"Ottawa NWR--Boss Unit"},"type":"Feature","geometry":{"type":"Point","coordinates":[-83.1838739,41.5991334]}},{"properties":{"latitude":42.7209836,"column_5":2,"date":{"end_time":"2012/05/20 00:00:00 -0400","original":"5/19/2012","granularity":"day","time":"2012/05/19 00:00:00 -0400"},"longitude":-84.5181655,"id":"ag2kyxg3w8c6","location":"River Trail- Aurelius to 496"},"type":"Feature","geometry":{"type":"Point","coordinates":[-84.5181655,42.7209836]}},{"properties":{"latitude":44.4357814,"column_5":2,"date":{"end_time":"2012/05/25 00:00:00 -0400","original":"5/24/2012","granularity":"day","time":"2012/05/24 00:00:00 -0400"},"longitude":-83.6244639,"id":"ag2kyxbt9hyv","location":"Lumberman's Memorial"},"type":"Feature","geometry":{"type":"Point","coordinates":[-83.6244639,44.4357814]}},{"properties":{"latitude":46.8785333,"column_5":2,"date":{"end_time":"2012/06/05 00:00:00 -0400","original":"6/4/2012","granularity":"day","time":"2012/06/04 00:00:00 -0400"},"longitude":-99.2670876,"id":"ag2kyxcw25qq","location":"I-94 Potholes"},"type":"Feature","geometry":{"type":"Point","coordinates":[-99.2670876,46.8785333]}},{"properties":{"latitude":46.9086888,"column_5":2,"date":{"end_time":"2012/06/06 00:00:00 -0400","original":"6/5/2012","granularity":"day","time":"2012/06/05 00:00:00 -0400"},"longitude":-103.5237256,"id":"ag2kyxdsivjw","location":"Red Trail Campground, Medora"},"type":"Feature","geometry":{"type":"Point","coordinates":[-103.5237256,46.9086888]}},{"properties":{"latitude":46.9551,"column_5":2,"date":{"end_time":"2012/06/06 00:00:00 -0400","original":"6/5/2012","granularity":"day","time":"2012/06/05 00:00:00 -0400"},"longitude":-103.4581,"id":"ag2kyx9kh388","location":"Theodore Roosevelt National Park - South Unit"},"type":"Feature","geometry":{"type":"Point","coordinates":[-103.4581,46.9551]}},{"properties":{"latitude":46.6483049,"column_5":2,"date":{"end_time":"2012/08/03 00:00:00 -0400","original":"8/2/2012","granularity":"day","time":"2012/08/02 00:00:00 -0400"},"longitude":-85.4132777,"id":"ag2kyx9mhmdd","location":"Pike Lake Road"},"type":"Feature","geometry":{"type":"Point","coordinates":[-85.4132777,46.6483049]}},{"properties":{"latitude":42.75965,"column_5":2,"date":{"end_time":"2012/09/19 00:00:00 -0400","original":"9/18/2012","granularity":"day","time":"2012/09/18 00:00:00 -0400"},"longitude":-84.7625439,"id":"ag2kyxjbeha0","location":"Fitzgerald Park"},"type":"Feature","geometry":{"type":"Point","coordinates":[-84.7625439,42.75965]}},{"properties":{"latitude":42.4799468,"column_5":2,"date":{"end_time":"2012/10/10 00:00:00 -0400","original":"10/9/2012","granularity":"day","time":"2012/10/09 00:00:00 -0400"},"longitude":-83.7810516,"id":"ag2kyx4zqrvp","location":"Huron Meadows Metropark"},"type":"Feature","geometry":{"type":"Point","coordinates":[-83.7810516,42.4799468]}},{"properties":{"latitude":42.5265824,"column_5":2,"date":{"end_time":"2012/10/10 00:00:00 -0400","original":"10/9/2012","granularity":"day","time":"2012/10/09 00:00:00 -0400"},"longitude":-83.672905,"id":"ag2kyxadseej","location":"Kensington Metropark (Livingston Co.)"},"type":"Feature","geometry":{"type":"Point","coordinates":[-83.672905,42.5265824]}},{"properties":{"latitude":29.2518777,"column_5":2,"date":{"end_time":"2012/11/08 00:00:00 -0500","original":"11/7/2012","granularity":"day","time":"2012/11/07 00:00:00 -0500"},"longitude":-98.3931431,"id":"ag2kyxfa8p6n","location":"San Antonio- Braunig Lake (HOTE 101)"},"type":"Feature","geometry":{"type":"Point","coordinates":[-98.3931431,29.2518777]}},{"properties":{"latitude":42.62642,"column_5":2,"date":{"end_time":"2013/04/17 00:00:00 -0400","original":"4/16/2013","granularity":"day","time":"2013/04/16 00:00:00 -0400"},"longitude":-84.40687,"id":"ag2kyxgd2xv3","location":"Green Acres Turf Farm"},"type":"Feature","geometry":{"type":"Point","coordinates":[-84.40687,42.62642]}},{"properties":{"latitude":41.7770083,"column_5":2,"date":{"end_time":"2013/04/29 00:00:00 -0400","original":"4/28/2013","granularity":"day","time":"2013/04/28 00:00:00 -0400"},"longitude":-86.6639918,"id":"ag2kyxbavz8r","location":"Kesling Preserve (Forest Lawn Rd.)"},"type":"Feature","geometry":{"type":"Point","coordinates":[-86.6639918,41.7770083]}},{"properties":{"latitude":42.7026065,"column_5":2,"date":{"end_time":"2013/05/02 00:00:00 -0400","original":"5/1/2013","granularity":"day","time":"2013/05/01 00:00:00 -0400"},"longitude":-84.5314555,"id":"ag2kyxihz4mt","location":"Scott Woods Park"},"type":"Feature","geometry":{"type":"Point","coordinates":[-84.5314555,42.7026065]}},{"properties":{"latitude":37.9632997,"column_5":2,"date":{"end_time":"2013/06/01 00:00:00 -0400","original":"5/31/2013","granularity":"day","time":"2013/05/31 00:00:00 -0400"},"longitude":-84.384377,"id":"ag2kyxen5mgy","location":"Canebrake Drive"},"type":"Feature","geometry":{"type":"Point","coordinates":[-84.384377,37.9632997]}},{"properties":{"latitude":45.0567731,"column_5":1,"date":{"end_time":"2005/07/21 00:00:00 -0400","original":"7/20/2005","granularity":"day","time":"2005/07/20 00:00:00 -0400"},"longitude":-86.0037951,"id":"ag2kyxi7s175","location":"Southern Point, North Manitou Island"},"type":"Feature","geometry":{"type":"Point","coordinates":[-86.0037951,45.0567731]}},{"properties":{"latitude":32.9114416,"column_5":1,"date":{"end_time":"2007/04/11 00:00:00 -0400","original":"4/10/2007","granularity":"day","time":"2007/04/10 00:00:00 -0400"},"longitude":-79.5917201,"id":"ag2kyxj8wtgg","location":"Cape Romain NWR--Bulls Island--Jack's Creek Impoundment"},"type":"Feature","geometry":{"type":"Point","coordinates":[-79.5917201,32.9114416]}},{"properties":{"latitude":33.7879932,"column_5":1,"date":{"end_time":"2007/04/11 00:00:00 -0400","original":"4/10/2007","granularity":"day","time":"2007/04/10 00:00:00 -0400"},"longitude":-80.7071114,"id":"ag2kyxh4gi1t","location":"Cedar Creek, Congaree National Park"},"type":"Feature","geometry":{"type":"Point","coordinates":[-80.7071114,33.7879932]}},{"properties":{"latitude":33.0653628,"column_5":1,"date":{"end_time":"2007/04/12 00:00:00 -0400","original":"4/11/2007","granularity":"day","time":"2007/04/11 00:00:00 -0400"},"longitude":-79.9241638,"id":"ag2kyx5tsa5q","location":"Cooper River"},"type":"Feature","geometry":{"type":"Point","coordinates":[-79.9241638,33.0653628]}},{"properties":{"latitude":47.0151415,"column_5":1,"date":{"end_time":"2008/08/09 00:00:00 -0400","original":"8/8/2008","granularity":"day","time":"2008/08/08 00:00:00 -0400"},"longitude":-114.4087029,"id":"ag2kyxhbfl1z","location":"Clark Fork River"},"type":"Feature","geometry":{"type":"Point","coordinates":[-114.4087029,47.0151415]}},{"properties":{"latitude":48.0546769,"column_5":1,"date":{"end_time":"2008/08/09 00:00:00 -0400","original":"8/8/2008","granularity":"day","time":"2008/08/08 00:00:00 -0400"},"longitude":-123.7953186,"id":"ag2kyx43y1n5","location":"Olympic NP--Lake Crescent--Marymere Falls Trail"},"type":"Feature","geometry":{"type":"Point","coordinates":[-123.7953186,48.0546769]}},{"properties":{"latitude":47.978072,"column_5":1,"date":{"end_time":"2008/08/11 00:00:00 -0400","original":"8/10/2008","granularity":"day","time":"2008/08/10 00:00:00 -0400"},"longitude":-123.5205743,"id":"ag2kyxf3y60u","location":"Olympic NP--Hurricane Ridge"},"type":"Feature","geometry":{"type":"Point","coordinates":[-123.5205743,47.978072]}},{"properties":{"latitude":48.5358175,"column_5":1,"date":{"end_time":"2008/08/12 00:00:00 -0400","original":"8/11/2008","granularity":"day","time":"2008/08/11 00:00:00 -0400"},"longitude":-122.8573608,"id":"ag2kyx7qqntf","location":"Lopez Island -- Spencer Spit State Park"},"type":"Feature","geometry":{"type":"Point","coordinates":[-122.8573608,48.5358175]}},{"properties":{"latitude":47.6254299,"column_5":1,"date":{"end_time":"2008/08/14 00:00:00 -0400","original":"8/13/2008","granularity":"day","time":"2008/08/13 00:00:00 -0400"},"longitude":-124.0178776,"id":"ag2kyx8qe3c6","location":"Olympic NP--Queets"},"type":"Feature","geometry":{"type":"Point","coordinates":[-124.0178776,47.6254299]}},{"properties":{"latitude":48.1628795,"column_5":1,"date":{"end_time":"2008/08/15 00:00:00 -0400","original":"8/14/2008","granularity":"day","time":"2008/08/14 00:00:00 -0400"},"longitude":-123.164978,"id":"ag2kyxceonz8","location":"Dungeness NWR"},"type":"Feature","geometry":{"type":"Point","coordinates":[-123.164978,48.1628795]}},{"properties":{"latitude":44.8926677,"column_5":1,"date":{"end_time":"2008/08/17 00:00:00 -0400","original":"8/16/2008","granularity":"day","time":"2008/08/16 00:00:00 -0400"},"longitude":-110.3877107,"id":"ag2kyx3qi3eu","location":"Yellowstone NP--Tower Roosevelt area"},"type":"Feature","geometry":{"type":"Point","coordinates":[-110.3877107,44.8926677]}},{"properties":{"latitude":44.5728609,"column_5":1,"date":{"end_time":"2008/08/17 00:00:00 -0400","original":"8/16/2008","granularity":"day","time":"2008/08/16 00:00:00 -0400"},"longitude":-107.5698853,"id":"ag2kyx71yobc","location":"Bighorn Mountains"},"type":"Feature","geometry":{"type":"Point","coordinates":[-107.5698853,44.5728609]}},{"properties":{"latitude":43.8627526,"column_5":1,"date":{"end_time":"2008/08/18 00:00:00 -0400","original":"8/17/2008","granularity":"day","time":"2008/08/17 00:00:00 -0400"},"longitude":-102.2250366,"id":"ag2kyx9k9fbt","location":"Badlands NP, Pinnacles Area"},"type":"Feature","geometry":{"type":"Point","coordinates":[-102.2250366,43.8627526]}},{"properties":{"latitude":42.7004783,"column_5":1,"date":{"end_time":"2009/01/02 00:00:00 -0500","original":"1/1/2009","granularity":"day","time":"2009/01/01 00:00:00 -0500"},"longitude":-84.3156052,"id":"ag2kyx90k64h","location":"Williamnston"},"type":"Feature","geometry":{"type":"Point","coordinates":[-84.3156052,42.7004783]}},{"properties":{"latitude":28.53356,"column_5":1,"date":{"end_time":"2009/02/18 00:00:00 -0500","original":"2/17/2009","granularity":"day","time":"2009/02/17 00:00:00 -0500"},"longitude":-82.6407051,"id":"ag2kyxcmyx04","location":"Mud River"},"type":"Feature","geometry":{"type":"Point","coordinates":[-82.6407051,28.53356]}},{"properties":{"latitude":44.7251339,"column_5":1,"date":{"end_time":"2009/05/11 00:00:00 -0400","original":"5/10/2009","granularity":"day","time":"2009/05/10 00:00:00 -0400"},"longitude":-86.1428408,"id":"ag2kyx5a8jxo","location":"Platte River"},"type":"Feature","geometry":{"type":"Point","coordinates":[-86.1428408,44.7251339]}},{"properties":{"latitude":44.5,"column_5":1,"date":{"end_time":"2009/06/25 00:00:00 -0400","original":"6/24/2009","granularity":"day","time":"2009/06/24 00:00:00 -0400"},"longitude":-67.1027778,"id":"ag2kyxaetued","location":"Machias Seal Island"},"type":"Feature","geometry":{"type":"Point","coordinates":[-67.1027778,44.5]}},{"properties":{"latitude":44.3346541,"column_5":1,"date":{"end_time":"2009/06/25 00:00:00 -0400","original":"6/24/2009","granularity":"day","time":"2009/06/24 00:00:00 -0400"},"longitude":-68.2065582,"id":"ag2kyxh00cq4","location":"Acadia NP, Precipice Area"},"type":"Feature","geometry":{"type":"Point","coordinates":[-68.2065582,44.3346541]}},{"properties":{"latitude":44.3308437,"column_5":1,"date":{"end_time":"2009/06/30 00:00:00 -0400","original":"6/29/2009","granularity":"day","time":"2009/06/29 00:00:00 -0400"},"longitude":-68.3640597,"id":"ag2kyxfl06nb","location":"Long Pond, Acadia"},"type":"Feature","geometry":{"type":"Point","coordinates":[-68.3640597,44.3308437]}},{"properties":{"latitude":44.3242165,"column_5":1,"date":{"end_time":"2009/06/30 00:00:00 -0400","original":"6/29/2009","granularity":"day","time":"2009/06/29 00:00:00 -0400"},"longitude":-68.4213066,"id":"ag2kyxdy0l25","location":"Bartlett Island"},"type":"Feature","geometry":{"type":"Point","coordinates":[-68.4213066,44.3242165]}},{"properties":{"latitude":47.2612579,"column_5":1,"date":{"end_time":"2009/07/01 00:00:00 -0400","original":"6/30/2009","granularity":"day","time":"2009/06/30 00:00:00 -0400"},"longitude":-52.7651256,"id":"ag2kyxcszxh1","location":"NL--Witless Bay--Gull Island"},"type":"Feature","geometry":{"type":"Point","coordinates":[-52.7651256,47.2612579]}},{"properties":{"latitude":46.823875,"column_5":1,"date":{"end_time":"2009/07/02 00:00:00 -0400","original":"7/1/2009","granularity":"day","time":"2009/07/01 00:00:00 -0400"},"longitude":-54.1877942,"id":"ag2kyxikqmrc","location":"NL--Cape St. Mary's"},"type":"Feature","geometry":{"type":"Point","coordinates":[-54.1877942,46.823875]}},{"properties":{"latitude":41.618394,"column_5":1,"date":{"end_time":"2010/05/30 00:00:00 -0400","original":"5/29/2010","granularity":"day","time":"2010/05/29 00:00:00 -0400"},"longitude":-83.7818241,"id":"ag2kyxcafdzb","location":"Kitty Todd Nature Preserve"},"type":"Feature","geometry":{"type":"Point","coordinates":[-83.7818241,41.618394]}},{"properties":{"latitude":45.5861731,"column_5":1,"date":{"end_time":"2010/06/24 00:00:00 -0400","original":"6/23/2010","granularity":"day","time":"2010/06/23 00:00:00 -0400"},"longitude":-64.9539185,"id":"ag2kyx7rrcjg","location":"Fundy National Park, shore"},"type":"Feature","geometry":{"type":"Point","coordinates":[-64.9539185,45.5861731]}},{"properties":{"latitude":45.5487987,"column_5":1,"date":{"end_time":"2010/06/24 00:00:00 -0400","original":"6/23/2010","granularity":"day","time":"2010/06/23 00:00:00 -0400"},"longitude":-65.0152016,"id":"ag2kyx6lg6sg","location":"Point Wolfe Estuary"},"type":"Feature","geometry":{"type":"Point","coordinates":[-65.0152016,45.5487987]}},{"properties":{"latitude":45.7126,"column_5":1,"date":{"end_time":"2010/06/26 00:00:00 -0400","original":"6/25/2010","granularity":"day","time":"2010/06/25 00:00:00 -0400"},"longitude":-64.760376,"id":"ag2kyxclk9ty","location":"Calhoun Marsh"},"type":"Feature","geometry":{"type":"Point","coordinates":[-64.760376,45.7126]}},{"properties":{"latitude":46.9952411,"column_5":1,"date":{"end_time":"2010/06/27 00:00:00 -0400","original":"6/26/2010","granularity":"day","time":"2010/06/26 00:00:00 -0400"},"longitude":-58.9086914,"id":"ag2kyx862axs","location":"Gulf of St. Lawrence"},"type":"Feature","geometry":{"type":"Point","coordinates":[-58.9086914,46.9952411]}},{"properties":{"latitude":46.9337371,"column_5":1,"date":{"end_time":"2010/06/30 00:00:00 -0400","original":"6/29/2010","granularity":"day","time":"2010/06/29 00:00:00 -0400"},"longitude":-52.9516554,"id":"ag2kyxedfu9j","location":"Renews Harbour"},"type":"Feature","geometry":{"type":"Point","coordinates":[-52.9516554,46.9337371]}},{"properties":{"latitude":48.4928905,"column_5":1,"date":{"end_time":"2010/07/03 00:00:00 -0400","original":"7/2/2010","granularity":"day","time":"2010/07/02 00:00:00 -0400"},"longitude":-54.0187454,"id":"ag2kyxek8z7s","location":"Sandy Pond, Terra Nova NP"},"type":"Feature","geometry":{"type":"Point","coordinates":[-54.0187454,48.4928905]}},{"properties":{"latitude":48.5086441,"column_5":1,"date":{"end_time":"2010/07/03 00:00:00 -0400","original":"7/2/2010","granularity":"day","time":"2010/07/02 00:00:00 -0400"},"longitude":-53.9543724,"id":"ag2kyxfhbwkm","location":"Ochre Hill, Terra Nova NP"},"type":"Feature","geometry":{"type":"Point","coordinates":[-53.9543724,48.5086441]}},{"properties":{"latitude":51.3530556,"column_5":1,"date":{"end_time":"2010/07/05 00:00:00 -0400","original":"7/4/2010","granularity":"day","time":"2010/07/04 00:00:00 -0400"},"longitude":-55.5666667,"id":"ag2kyxaf0sho","location":"NL--St. Anthony"},"type":"Feature","geometry":{"type":"Point","coordinates":[-55.5666667,51.3530556]}},{"properties":{"latitude":51.594669,"column_5":1,"date":{"end_time":"2010/07/06 00:00:00 -0400","original":"7/5/2010","granularity":"day","time":"2010/07/05 00:00:00 -0400"},"longitude":-55.5361028,"id":"ag2kyx9qd36y","location":"NL--L'Anse aux Meadows"},"type":"Feature","geometry":{"type":"Point","coordinates":[-55.5361028,51.594669]}},{"properties":{"latitude":51.536833,"column_5":1,"date":{"end_time":"2010/07/06 00:00:00 -0400","original":"7/5/2010","granularity":"day","time":"2010/07/05 00:00:00 -0400"},"longitude":-55.6927013,"id":"ag2kyxarse6w","location":"Pistolet Bay Provincial Park"},"type":"Feature","geometry":{"type":"Point","coordinates":[-55.6927013,51.536833]}},{"properties":{"latitude":46.7433897,"column_5":1,"date":{"end_time":"2010/07/09 00:00:00 -0400","original":"7/8/2010","granularity":"day","time":"2010/07/08 00:00:00 -0400"},"longitude":-60.3262711,"id":"ag2kyx9bv27r","location":"Cape Breton Highlands NP"},"type":"Feature","geometry":{"type":"Point","coordinates":[-60.3262711,46.7433897]}},{"properties":{"latitude":46.9196105,"column_5":1,"date":{"end_time":"2010/08/12 00:00:00 -0400","original":"8/11/2010","granularity":"day","time":"2010/08/11 00:00:00 -0400"},"longitude":-90.5514193,"id":"ag2kyxhyapwz","location":"Stockton Island, Apostle Islands NL"},"type":"Feature","geometry":{"type":"Point","coordinates":[-90.5514193,46.9196105]}},{"properties":{"latitude":46.5221646,"column_5":1,"date":{"end_time":"2010/08/13 00:00:00 -0400","original":"8/12/2010","granularity":"day","time":"2010/08/12 00:00:00 -0400"},"longitude":-91.1310607,"id":"ag2kyxfhl2dk","location":"Doug's Driveway"},"type":"Feature","geometry":{"type":"Point","coordinates":[-91.1310607,46.5221646]}},{"properties":{"latitude":42.5567606,"column_5":1,"date":{"end_time":"2010/11/15 00:00:00 -0500","original":"11/14/2010","granularity":"day","time":"2010/11/14 00:00:00 -0500"},"longitude":-85.995607,"id":"ag2kyxbiu672","location":"Allegan SGA--46th St between 118th Ave and 121st Ave"},"type":"Feature","geometry":{"type":"Point","coordinates":[-85.995607,42.5567606]}},{"properties":{"latitude":42.6434298,"column_5":1,"date":{"end_time":"2010/11/15 00:00:00 -0500","original":"11/14/2010","granularity":"day","time":"2010/11/14 00:00:00 -0500"},"longitude":-86.1905336,"id":"ag2kyxh0q7ly","location":"Schultz Park"},"type":"Feature","geometry":{"type":"Point","coordinates":[-86.1905336,42.6434298]}},{"properties":{"latitude":28.2586408,"column_5":1,"date":{"end_time":"2011/01/02 00:00:00 -0500","original":"1/1/2011","granularity":"day","time":"2011/01/01 00:00:00 -0500"},"longitude":-82.6371941,"id":"ag2kyx4t393t","location":"J.B. Starkey Wilderness Park---Bluebird Trail"},"type":"Feature","geometry":{"type":"Point","coordinates":[-82.6371941,28.2586408]}},{"properties":{"latitude":25.850959,"column_5":1,"date":{"end_time":"2011/01/03 00:00:00 -0500","original":"1/2/2011","granularity":"day","time":"2011/01/02 00:00:00 -0500"},"longitude":-80.9904385,"id":"ag2kyx83fhj1","location":"Clyde Butcher's Property"},"type":"Feature","geometry":{"type":"Point","coordinates":[-80.9904385,25.850959]}},{"properties":{"latitude":25.8762916,"column_5":1,"date":{"end_time":"2011/01/03 00:00:00 -0500","original":"1/2/2011","granularity":"day","time":"2011/01/02 00:00:00 -0500"},"longitude":-81.2293911,"id":"ag2kyxi2j9j7","location":"Tamiami Trail VC"},"type":"Feature","geometry":{"type":"Point","coordinates":[-81.2293911,25.8762916]}},{"properties":{"latitude":25.8675841,"column_5":1,"date":{"end_time":"2011/01/04 00:00:00 -0500","original":"1/3/2011","granularity":"day","time":"2011/01/03 00:00:00 -0500"},"longitude":-81.1501694,"id":"ag2kyx6w3lo7","location":"Big Cypress National Preserve--Kirby Storter Roadside Park &amp; Boardwalk"},"type":"Feature","geometry":{"type":"Point","coordinates":[-81.1501694,25.8675841]}},{"properties":{"latitude":25.76202,"column_5":1,"date":{"end_time":"2011/01/04 00:00:00 -0500","original":"1/3/2011","granularity":"day","time":"2011/01/03 00:00:00 -0500"},"longitude":-80.78274,"id":"ag2kyxbbeaal","location":"Miccosukee Indian Village"},"type":"Feature","geometry":{"type":"Point","coordinates":[-80.78274,25.76202]}},{"properties":{"latitude":25.1866667,"column_5":1,"date":{"end_time":"2011/01/05 00:00:00 -0500","original":"1/4/2011","granularity":"day","time":"2011/01/04 00:00:00 -0500"},"longitude":-80.8936111,"id":"ag2kyxbgttwy","location":"Everglades NP--Mrazek Pond"},"type":"Feature","geometry":{"type":"Point","coordinates":[-80.8936111,25.1866667]}},{"properties":{"latitude":25.382488,"column_5":1,"date":{"end_time":"2011/01/05 00:00:00 -0500","original":"1/4/2011","granularity":"day","time":"2011/01/04 00:00:00 -0500"},"longitude":-80.60715,"id":"ag2kyx8vaye1","location":"Everglades NP--Anhinga Trail"},"type":"Feature","geometry":{"type":"Point","coordinates":[-80.60715,25.382488]}},{"properties":{"latitude":25.1416,"column_5":1,"date":{"end_time":"2011/01/05 00:00:00 -0500","original":"1/4/2011","granularity":"day","time":"2011/01/04 00:00:00 -0500"},"longitude":-80.9255,"id":"ag2kyxg3wkqo","location":"Everglades NP--Flamingo"},"type":"Feature","geometry":{"type":"Point","coordinates":[-80.9255,25.1416]}},{"properties":{"latitude":25.1391667,"column_5":1,"date":{"end_time":"2011/01/05 00:00:00 -0500","original":"1/4/2011","granularity":"day","time":"2011/01/04 00:00:00 -0500"},"longitude":-80.9375,"id":"ag2kyxaka345","location":"Everglades NP--Eco Pond"},"type":"Feature","geometry":{"type":"Point","coordinates":[-80.9375,25.1391667]}},{"properties":{"latitude":25.2813046,"column_5":1,"date":{"end_time":"2011/01/05 00:00:00 -0500","original":"1/4/2011","granularity":"day","time":"2011/01/04 00:00:00 -0500"},"longitude":-80.8001782,"id":"ag2kyxfkd4gx","location":"Everglades NP--Paurotis Pond"},"type":"Feature","geometry":{"type":"Point","coordinates":[-80.8001782,25.2813046]}},{"properties":{"latitude":25.437074,"column_5":1,"date":{"end_time":"2011/01/05 00:00:00 -0500","original":"1/4/2011","granularity":"day","time":"2011/01/04 00:00:00 -0500"},"longitude":-80.6993866,"id":"ag2kyx7uzhrq","location":"Park Road, Everglades NP"},"type":"Feature","geometry":{"type":"Point","coordinates":[-80.6993866,25.437074]}},{"properties":{"latitude":25.3985091,"column_5":1,"date":{"end_time":"2011/01/05 00:00:00 -0500","original":"1/4/2011","granularity":"day","time":"2011/01/04 00:00:00 -0500"},"longitude":-80.6554395,"id":"ag2kyxia5tig","location":"Everglades NP--Long Pine Key Campground"},"type":"Feature","geometry":{"type":"Point","coordinates":[-80.6554395,25.3985091]}},{"properties":{"latitude":26.4605844,"column_5":1,"date":{"end_time":"2011/01/06 00:00:00 -0500","original":"1/5/2011","granularity":"day","time":"2011/01/05 00:00:00 -0500"},"longitude":-82.1233177,"id":"ag2kyxeoihe7","location":"Ding Darling NWR"},"type":"Feature","geometry":{"type":"Point","coordinates":[-82.1233177,26.4605844]}},{"properties":{"latitude":46.3917008,"column_5":1,"date":{"end_time":"2011/03/09 00:00:00 -0500","original":"3/8/2011","granularity":"day","time":"2011/03/08 00:00:00 -0500"},"longitude":-86.9576454,"id":"ag2kyx4ng2v3","location":"Rock River Canyon"},"type":"Feature","geometry":{"type":"Point","coordinates":[-86.9576454,46.3917008]}},{"properties":{"latitude":41.6051585,"column_5":1,"date":{"end_time":"2011/05/12 00:00:00 -0400","original":"5/11/2011","granularity":"day","time":"2011/05/11 00:00:00 -0400"},"longitude":-83.1933045,"id":"ag2kyxcabyq7","location":"Magee Marsh Wildlife Area--Black Swamp Bird Observatory"},"type":"Feature","geometry":{"type":"Point","coordinates":[-83.1933045,41.6051585]}},{"properties":{"latitude":41.7011147,"column_5":1,"date":{"end_time":"2011/05/13 00:00:00 -0400","original":"5/12/2011","granularity":"day","time":"2011/05/12 00:00:00 -0400"},"longitude":-83.3374786,"id":"ag2kyx7l7pw9","location":"Cedar Point NWR"},"type":"Feature","geometry":{"type":"Point","coordinates":[-83.3374786,41.7011147]}},{"properties":{"latitude":43.7979403,"column_5":1,"date":{"end_time":"2011/05/19 00:00:00 -0400","original":"5/18/2011","granularity":"day","time":"2011/05/18 00:00:00 -0400"},"longitude":-83.4103489,"id":"ag2kyxfl0jrg","location":"Saginaw Wetlands MNA Preserve"},"type":"Feature","geometry":{"type":"Point","coordinates":[-83.4103489,43.7979403]}},{"properties":{"latitude":44.5055655,"column_5":1,"date":{"end_time":"2011/05/22 00:00:00 -0400","original":"5/21/2011","granularity":"day","time":"2011/05/21 00:00:00 -0400"},"longitude":-84.3269348,"id":"ag2kyx5nj2jv","location":"Roscommon"},"type":"Feature","geometry":{"type":"Point","coordinates":[-84.3269348,44.5055655]}},{"properties":{"latitude":42.1721347,"column_5":1,"date":{"end_time":"2011/05/31 00:00:00 -0400","original":"5/30/2011","granularity":"day","time":"2011/05/30 00:00:00 -0400"},"longitude":-80.0849462,"id":"ag2kyx8ka6lz","location":"Presque Isle SP--Beach 10"},"type":"Feature","geometry":{"type":"Point","coordinates":[-80.0849462,42.1721347]}},{"properties":{"latitude":40.1218789,"column_5":1,"date":{"end_time":"2011/06/01 00:00:00 -0400","original":"5/31/2011","granularity":"day","time":"2011/05/31 00:00:00 -0400"},"longitude":-79.1749907,"id":"ag2kyx8ticas","location":"Spruce Flats Bog"},"type":"Feature","geometry":{"type":"Point","coordinates":[-79.1749907,40.1218789]}},{"properties":{"latitude":40.1573605,"column_5":1,"date":{"end_time":"2011/06/01 00:00:00 -0400","original":"5/31/2011","granularity":"day","time":"2011/05/31 00:00:00 -0400"},"longitude":-79.2293644,"id":"ag2kyx84bbdm","location":"Linn Run State Park"},"type":"Feature","geometry":{"type":"Point","coordinates":[-79.2293644,40.1573605]}},{"properties":{"latitude":40.2368191,"column_5":1,"date":{"end_time":"2011/06/02 00:00:00 -0400","original":"6/1/2011","granularity":"day","time":"2011/06/01 00:00:00 -0400"},"longitude":-79.5737171,"id":"ag2kyxhfronn","location":"Youngwood Swamp"},"type":"Feature","geometry":{"type":"Point","coordinates":[-79.5737171,40.2368191]}},{"properties":{"latitude":40.314254,"column_5":1,"date":{"end_time":"2011/06/03 00:00:00 -0400","original":"6/2/2011","granularity":"day","time":"2011/06/02 00:00:00 -0400"},"longitude":-79.3846321,"id":"ag2kyx9wup11","location":"Mom's Apartment"},"type":"Feature","geometry":{"type":"Point","coordinates":[-79.3846321,40.314254]}},{"properties":{"latitude":40.1456604,"column_5":1,"date":{"end_time":"2011/06/03 00:00:00 -0400","original":"6/2/2011","granularity":"day","time":"2011/06/02 00:00:00 -0400"},"longitude":-79.2691116,"id":"ag2kyxdvemfq","location":"Powdermill (IBA)"},"type":"Feature","geometry":{"type":"Point","coordinates":[-79.2691116,40.1456604]}},{"properties":{"latitude":39.8586269,"column_5":1,"date":{"end_time":"2011/06/04 00:00:00 -0400","original":"6/3/2011","granularity":"day","time":"2011/06/03 00:00:00 -0400"},"longitude":-79.4975857,"id":"ag2kyxhwxuci","location":"Ohiopyle SP"},"type":"Feature","geometry":{"type":"Point","coordinates":[-79.4975857,39.8586269]}},{"properties":{"latitude":39.1121479,"column_5":1,"date":{"end_time":"2011/06/04 00:00:00 -0400","original":"6/3/2011","granularity":"day","time":"2011/06/03 00:00:00 -0400"},"longitude":-79.4963837,"id":"ag2kyxaq9bzz","location":"Blackwater Falls State Park"},"type":"Feature","geometry":{"type":"Point","coordinates":[-79.4963837,39.1121479]}},{"properties":{"latitude":39.8635937,"column_5":1,"date":{"end_time":"2011/06/04 00:00:00 -0400","original":"6/3/2011","granularity":"day","time":"2011/06/03 00:00:00 -0400"},"longitude":-79.5021021,"id":"ag2kyxfcq36o","location":"Cucumber Falls"},"type":"Feature","geometry":{"type":"Point","coordinates":[-79.5021021,39.8635937]}},{"properties":{"latitude":39.0472774,"column_5":1,"date":{"end_time":"2011/06/05 00:00:00 -0400","original":"6/4/2011","granularity":"day","time":"2011/06/04 00:00:00 -0400"},"longitude":-79.4451427,"id":"ag2kyxar1hlp","location":"Big John's Family Fixins"},"type":"Feature","geometry":{"type":"Point","coordinates":[-79.4451427,39.0472774]}},{"properties":{"latitude":39.19315,"column_5":1,"date":{"end_time":"2011/06/05 00:00:00 -0400","original":"6/4/2011","granularity":"day","time":"2011/06/04 00:00:00 -0400"},"longitude":-79.4847107,"id":"ag2kyx3ti4xg","location":"Fairfax Stone State Park"},"type":"Feature","geometry":{"type":"Point","coordinates":[-79.4847107,39.19315]}},{"properties":{"latitude":38.9377813,"column_5":1,"date":{"end_time":"2011/06/05 00:00:00 -0400","original":"6/4/2011","granularity":"day","time":"2011/06/04 00:00:00 -0400"},"longitude":-79.6738815,"id":"ag2kyx40xzyx","location":"Stuart Rec Area"},"type":"Feature","geometry":{"type":"Point","coordinates":[-79.6738815,38.9377813]}},{"properties":{"latitude":39.0661809,"column_5":1,"date":{"end_time":"2011/06/05 00:00:00 -0400","original":"6/4/2011","granularity":"day","time":"2011/06/04 00:00:00 -0400"},"longitude":-79.4395638,"id":"ag2kyxjenjjy","location":"Canaan Valley NWR"},"type":"Feature","geometry":{"type":"Point","coordinates":[-79.4395638,39.0661809]}},{"properties":{"latitude":39.0236092,"column_5":1,"date":{"end_time":"2011/06/06 00:00:00 -0400","original":"6/5/2011","granularity":"day","time":"2011/06/05 00:00:00 -0400"},"longitude":-79.4274979,"id":"ag2kyxclbr26","location":"Canaan Valley NWR--Freeland Rd. Tract"},"type":"Feature","geometry":{"type":"Point","coordinates":[-79.4274979,39.0236092]}},{"properties":{"latitude":44.9457563,"column_5":1,"date":{"end_time":"2011/06/13 00:00:00 -0400","original":"6/12/2011","granularity":"day","time":"2011/06/12 00:00:00 -0400"},"longitude":-85.8827448,"id":"ag2kyxbu313d","location":"Good Harbor Bay"},"type":"Feature","geometry":{"type":"Point","coordinates":[-85.8827448,44.9457563]}},{"properties":{"latitude":45.902433,"column_5":1,"date":{"end_time":"2011/07/07 00:00:00 -0400","original":"7/6/2011","granularity":"day","time":"2011/07/06 00:00:00 -0400"},"longitude":-84.8508024,"id":"ag2kyxd00bvo","location":"US2 Rest Area"},"type":"Feature","geometry":{"type":"Point","coordinates":[-84.8508024,45.902433]}},{"properties":{"latitude":46.5899391,"column_5":1,"date":{"end_time":"2011/07/08 00:00:00 -0400","original":"7/7/2011","granularity":"day","time":"2011/07/07 00:00:00 -0400"},"longitude":-87.3859835,"id":"ag2kyx5ft00l","location":"West Side, Presque Isle"},"type":"Feature","geometry":{"type":"Point","coordinates":[-87.3859835,46.5899391]}},{"properties":{"latitude":46.4744877,"column_5":1,"date":{"end_time":"2011/07/09 00:00:00 -0400","original":"7/8/2011","granularity":"day","time":"2011/07/08 00:00:00 -0400"},"longitude":-86.5430403,"id":"ag2kyxjv6qs1","location":"Miners Falls"},"type":"Feature","geometry":{"type":"Point","coordinates":[-86.5430403,46.4744877]}},{"properties":{"latitude":46.493008,"column_5":1,"date":{"end_time":"2011/07/09 00:00:00 -0400","original":"7/8/2011","granularity":"day","time":"2011/07/08 00:00:00 -0400"},"longitude":-86.5509367,"id":"ag2kyxihrssc","location":"Miners Castle"},"type":"Feature","geometry":{"type":"Point","coordinates":[-86.5509367,46.493008]}},{"properties":{"latitude":46.7170333,"column_5":1,"date":{"end_time":"2011/07/10 00:00:00 -0400","original":"7/9/2011","granularity":"day","time":"2011/07/09 00:00:00 -0400"},"longitude":-87.4120331,"id":"ag2kyx4etawp","location":"Granite Island"},"type":"Feature","geometry":{"type":"Point","coordinates":[-87.4120331,46.7170333]}},{"properties":{"latitude":46.5053932,"column_5":1,"date":{"end_time":"2011/07/10 00:00:00 -0400","original":"7/9/2011","granularity":"day","time":"2011/07/09 00:00:00 -0400"},"longitude":-87.4378681,"id":"ag2kyxg7e4p3","location":"Morgan Falls"},"type":"Feature","geometry":{"type":"Point","coordinates":[-87.4378681,46.5053932]}},{"properties":{"latitude":46.6189663,"column_5":1,"date":{"end_time":"2011/07/11 00:00:00 -0400","original":"7/10/2011","granularity":"day","time":"2011/07/10 00:00:00 -0400"},"longitude":-85.1366615,"id":"ag2kyxi0sfvx","location":"Tahquamenon Bogs"},"type":"Feature","geometry":{"type":"Point","coordinates":[-85.1366615,46.6189663]}},{"properties":{"latitude":42.5095015,"column_5":1,"date":{"end_time":"2011/07/25 00:00:00 -0400","original":"7/24/2011","granularity":"day","time":"2011/07/24 00:00:00 -0400"},"longitude":-84.3745279,"id":"ag2kyxef8s25","location":"Plains Road Ponds"},"type":"Feature","geometry":{"type":"Point","coordinates":[-84.3745279,42.5095015]}},{"properties":{"latitude":42.4888083,"column_5":1,"date":{"end_time":"2011/07/25 00:00:00 -0400","original":"7/24/2011","granularity":"day","time":"2011/07/24 00:00:00 -0400"},"longitude":-84.3550014,"id":"ag2kyxd29gfp","location":"Meridan-Catholic Church Roads"},"type":"Feature","geometry":{"type":"Point","coordinates":[-84.3550014,42.4888083]}},{"properties":{"latitude":42.9994529,"column_5":1,"date":{"end_time":"2011/08/02 00:00:00 -0400","original":"8/1/2011","granularity":"day","time":"2011/08/01 00:00:00 -0400"},"longitude":-84.5205474,"id":"ag2kyxa8hjii","location":"127/21 Junction"},"type":"Feature","geometry":{"type":"Point","coordinates":[-84.5205474,42.9994529]}},{"properties":{"latitude":42.7439394,"column_5":1,"date":{"end_time":"2011/08/03 00:00:00 -0400","original":"8/2/2011","granularity":"day","time":"2011/08/02 00:00:00 -0400"},"longitude":-84.5748353,"id":"ag2kyxjrbm5b","location":"Comfort St. Backyard"},"type":"Feature","geometry":{"type":"Point","coordinates":[-84.5748353,42.7439394]}},{"properties":{"latitude":42.579239,"column_5":1,"date":{"end_time":"2011/08/04 00:00:00 -0400","original":"8/3/2011","granularity":"day","time":"2011/08/03 00:00:00 -0400"},"longitude":-84.509266,"id":"ag2kyx8cm7ko","location":"Harvey's Yard"},"type":"Feature","geometry":{"type":"Point","coordinates":[-84.509266,42.579239]}},{"properties":{"latitude":44.7858253,"column_5":1,"date":{"end_time":"2011/08/13 00:00:00 -0400","original":"8/12/2011","granularity":"day","time":"2011/08/12 00:00:00 -0400"},"longitude":-84.6288013,"id":"ag2kyx6zfuck","location":"County 612"},"type":"Feature","geometry":{"type":"Point","coordinates":[-84.6288013,44.7858253]}},{"properties":{"latitude":44.8540739,"column_5":1,"date":{"end_time":"2011/08/16 00:00:00 -0400","original":"8/15/2011","granularity":"day","time":"2011/08/15 00:00:00 -0400"},"longitude":-84.368434,"id":"ag2kyx9buyrz","location":"Oscoda Old 612"},"type":"Feature","geometry":{"type":"Point","coordinates":[-84.368434,44.8540739]}},{"properties":{"latitude":44.6985783,"column_5":1,"date":{"end_time":"2011/08/17 00:00:00 -0400","original":"8/16/2011","granularity":"day","time":"2011/08/16 00:00:00 -0400"},"longitude":-84.5001519,"id":"ag2kyxhmagen","location":"Dyer Truck Trail Wetland"},"type":"Feature","geometry":{"type":"Point","coordinates":[-84.5001519,44.6985783]}},{"properties":{"latitude":44.6988605,"column_5":1,"date":{"end_time":"2011/08/17 00:00:00 -0400","original":"8/16/2011","granularity":"day","time":"2011/08/16 00:00:00 -0400"},"longitude":-84.5046043,"id":"ag2kyxhmvojw","location":"Dyer Truck/Down River"},"type":"Feature","geometry":{"type":"Point","coordinates":[-84.5046043,44.6988605]}},{"properties":{"latitude":44.8405341,"column_5":1,"date":{"end_time":"2011/08/19 00:00:00 -0400","original":"8/18/2011","granularity":"day","time":"2011/08/18 00:00:00 -0400"},"longitude":-84.4225502,"id":"ag2kyx4ykywo","location":"Walsh Rd. (Near 612)"},"type":"Feature","geometry":{"type":"Point","coordinates":[-84.4225502,44.8405341]}},{"properties":{"latitude":44.6839417,"column_5":1,"date":{"end_time":"2011/08/20 00:00:00 -0400","original":"8/19/2011","granularity":"day","time":"2011/08/19 00:00:00 -0400"},"longitude":-84.5267916,"id":"ag2kyxdba6ga","location":"Down River/Wakeley"},"type":"Feature","geometry":{"type":"Point","coordinates":[-84.5267916,44.6839417]}},{"properties":{"latitude":44.872051,"column_5":1,"date":{"end_time":"2011/08/20 00:00:00 -0400","original":"8/19/2011","granularity":"day","time":"2011/08/19 00:00:00 -0400"},"longitude":-86.0557365,"id":"ag2kyxdym57x","location":"Cottonwood Trail"},"type":"Feature","geometry":{"type":"Point","coordinates":[-86.0557365,44.872051]}},{"properties":{"latitude":44.8679907,"column_5":1,"date":{"end_time":"2011/08/21 00:00:00 -0400","original":"8/20/2011","granularity":"day","time":"2011/08/20 00:00:00 -0400"},"longitude":-84.3334794,"id":"ag2kyx5eyrhx","location":"Old 612 Near Cobb"},"type":"Feature","geometry":{"type":"Point","coordinates":[-84.3334794,44.8679907]}},{"properties":{"latitude":44.5116253,"column_5":1,"date":{"end_time":"2011/09/06 00:00:00 -0400","original":"9/5/2011","granularity":"day","time":"2011/09/05 00:00:00 -0400"},"longitude":-84.7584701,"id":"ag2kyx4yhui5","location":"North Higgins Lake SP (Crawford Co.)"},"type":"Feature","geometry":{"type":"Point","coordinates":[-84.7584701,44.5116253]}},{"properties":{"latitude":44.7315677,"column_5":1,"date":{"end_time":"2011/09/08 00:00:00 -0400","original":"9/7/2011","granularity":"day","time":"2011/09/07 00:00:00 -0400"},"longitude":-84.6841836,"id":"ag2kyx7oclgn","location":"Glory Lake"},"type":"Feature","geometry":{"type":"Point","coordinates":[-84.6841836,44.7315677]}},{"properties":{"latitude":45.2260399,"column_5":1,"date":{"end_time":"2011/09/09 00:00:00 -0400","original":"9/8/2011","granularity":"day","time":"2011/09/08 00:00:00 -0400"},"longitude":-84.4163489,"id":"ag2kyxiwkhkf","location":"Cornwall Creek Flooding"},"type":"Feature","geometry":{"type":"Point","coordinates":[-84.4163489,45.2260399]}},{"properties":{"latitude":45.1563798,"column_5":1,"date":{"end_time":"2011/09/09 00:00:00 -0400","original":"9/8/2011","granularity":"day","time":"2011/09/08 00:00:00 -0400"},"longitude":-84.5029306,"id":"ag2kyxim9s8t","location":"Sturgeon Valley Road"},"type":"Feature","geometry":{"type":"Point","coordinates":[-84.5029306,45.1563798]}},{"properties":{"latitude":44.562955,"column_5":1,"date":{"end_time":"2011/09/10 00:00:00 -0400","original":"9/9/2011","granularity":"day","time":"2011/09/09 00:00:00 -0400"},"longitude":-84.5039177,"id":"ag2kyxfha4ok","location":"AuSable River - Mason Tract"},"type":"Feature","geometry":{"type":"Point","coordinates":[-84.5039177,44.562955]}},{"properties":{"latitude":45.2253976,"column_5":1,"date":{"end_time":"2011/09/10 00:00:00 -0400","original":"9/9/2011","granularity":"day","time":"2011/09/09 00:00:00 -0400"},"longitude":-84.3902779,"id":"ag2kyxdh49zk","location":"Osmun Road Field"},"type":"Feature","geometry":{"type":"Point","coordinates":[-84.3902779,45.2253976]}},{"properties":{"latitude":43.0667067,"column_5":1,"date":{"end_time":"2011/09/12 00:00:00 -0400","original":"9/11/2011","granularity":"day","time":"2011/09/11 00:00:00 -0400"},"longitude":-85.4126394,"id":"ag2kyxhdruwt","location":"Saul Lake Bog"},"type":"Feature","geometry":{"type":"Point","coordinates":[-85.4126394,43.0667067]}},{"properties":{"latitude":46.5399713,"column_5":1,"date":{"end_time":"2011/09/14 00:00:00 -0400","original":"9/13/2011","granularity":"day","time":"2011/09/13 00:00:00 -0400"},"longitude":-85.040338,"id":"ag2kyxfg687n","location":"Lone Pine Road (Beach)"},"type":"Feature","geometry":{"type":"Point","coordinates":[-85.040338,46.5399713]}},{"properties":{"latitude":44.5383664,"column_5":1,"date":{"end_time":"2011/09/18 00:00:00 -0400","original":"9/17/2011","granularity":"day","time":"2011/09/17 00:00:00 -0400"},"longitude":-84.4245672,"id":"ag2kyxbtwft9","location":"M-18"},"type":"Feature","geometry":{"type":"Point","coordinates":[-84.4245672,44.5383664]}},{"properties":{"latitude":44.6082515,"column_5":1,"date":{"end_time":"2011/09/18 00:00:00 -0400","original":"9/17/2011","granularity":"day","time":"2011/09/17 00:00:00 -0400"},"longitude":-84.270587,"id":"ag2kyx9ivdmh","location":"Palmer/Deeter"},"type":"Feature","geometry":{"type":"Point","coordinates":[-84.270587,44.6082515]}},{"properties":{"latitude":46.2674775,"column_5":1,"date":{"end_time":"2011/09/25 00:00:00 -0400","original":"9/24/2011","granularity":"day","time":"2011/09/24 00:00:00 -0400"},"longitude":-85.9755707,"id":"ag2kyx9ww4pj","location":"Seney NWR--Wildlife Drive and Fishing Loop"},"type":"Feature","geometry":{"type":"Point","coordinates":[-85.9755707,46.2674775]}},{"properties":{"latitude":46.4787138,"column_5":1,"date":{"end_time":"2011/09/26 00:00:00 -0400","original":"9/25/2011","granularity":"day","time":"2011/09/25 00:00:00 -0400"},"longitude":-87.2150517,"id":"ag2kyxc690wz","location":"Lake LeVasseur"},"type":"Feature","geometry":{"type":"Point","coordinates":[-87.2150517,46.4787138]}},{"properties":{"latitude":46.4701429,"column_5":1,"date":{"end_time":"2011/09/26 00:00:00 -0400","original":"9/25/2011","granularity":"day","time":"2011/09/25 00:00:00 -0400"},"longitude":-87.2213173,"id":"ag2kyx5zahk4","location":"Kawbawgam Rd."},"type":"Feature","geometry":{"type":"Point","coordinates":[-87.2213173,46.4701429]}},{"properties":{"latitude":46.6352716,"column_5":1,"date":{"end_time":"2011/09/27 00:00:00 -0400","original":"9/26/2011","granularity":"day","time":"2011/09/26 00:00:00 -0400"},"longitude":-87.4710846,"id":"ag2kyxj79yjp","location":"Harlow Creek Mouth"},"type":"Feature","geometry":{"type":"Point","coordinates":[-87.4710846,46.6352716]}},{"properties":{"latitude":44.9905108,"column_5":1,"date":{"end_time":"2011/09/30 00:00:00 -0400","original":"9/29/2011","granularity":"day","time":"2011/09/29 00:00:00 -0400"},"longitude":-85.4915714,"id":"ag2kyx3phkuv","location":"Old Mission Point, West Spit"},"type":"Feature","geometry":{"type":"Point","coordinates":[-85.4915714,44.9905108]}},{"properties":{"latitude":44.6912338,"column_5":1,"date":{"end_time":"2011/10/01 00:00:00 -0400","original":"9/30/2011","granularity":"day","time":"2011/09/30 00:00:00 -0400"},"longitude":-86.1101532,"id":"ag2kyxczh2q8","location":"Platte Lake Access"},"type":"Feature","geometry":{"type":"Point","coordinates":[-86.1101532,44.6912338]}},{"properties":{"latitude":44.7116711,"column_5":1,"date":{"end_time":"2011/10/01 00:00:00 -0400","original":"9/30/2011","granularity":"day","time":"2011/09/30 00:00:00 -0400"},"longitude":-86.0646629,"id":"ag2kyx9ttsyg","location":"Little Platte Lake Access"},"type":"Feature","geometry":{"type":"Point","coordinates":[-86.0646629,44.7116711]}},{"properties":{"latitude":44.7284426,"column_5":1,"date":{"end_time":"2011/10/03 00:00:00 -0400","original":"10/2/2011","granularity":"day","time":"2011/10/02 00:00:00 -0400"},"longitude":-84.374485,"id":"ag2kyx719x98","location":"Walsh Road (South)"},"type":"Feature","geometry":{"type":"Point","coordinates":[-84.374485,44.7284426]}},{"properties":{"latitude":44.0227552,"column_5":1,"date":{"end_time":"2011/10/08 00:00:00 -0400","original":"10/7/2011","granularity":"day","time":"2011/10/07 00:00:00 -0400"},"longitude":-83.0405474,"id":"ag2kyx4d885a","location":"Jenks County Park"},"type":"Feature","geometry":{"type":"Point","coordinates":[-83.0405474,44.0227552]}},{"properties":{"latitude":44.0488869,"column_5":1,"date":{"end_time":"2011/10/08 00:00:00 -0400","original":"10/7/2011","granularity":"day","time":"2011/10/07 00:00:00 -0400"},"longitude":-82.990551,"id":"ag2kyxbvrk70","location":"Port Austin Beach"},"type":"Feature","geometry":{"type":"Point","coordinates":[-82.990551,44.0488869]}},{"properties":{"latitude":44.0050935,"column_5":1,"date":{"end_time":"2011/10/08 00:00:00 -0400","original":"10/7/2011","granularity":"day","time":"2011/10/07 00:00:00 -0400"},"longitude":-83.062917,"id":"ag2kyx73089y","location":"Port Crescent SP, Shore"},"type":"Feature","geometry":{"type":"Point","coordinates":[-83.062917,44.0050935]}},{"properties":{"latitude":43.9932467,"column_5":1,"date":{"end_time":"2011/10/08 00:00:00 -0400","original":"10/7/2011","granularity":"day","time":"2011/10/07 00:00:00 -0400"},"longitude":-83.1341887,"id":"ag2kyx4amt66","location":"Thompson County Park"},"type":"Feature","geometry":{"type":"Point","coordinates":[-83.1341887,43.9932467]}},{"properties":{"latitude":44.0018909,"column_5":1,"date":{"end_time":"2011/10/08 00:00:00 -0400","original":"10/7/2011","granularity":"day","time":"2011/10/07 00:00:00 -0400"},"longitude":-83.0340672,"id":"ag2kyx4blev7","location":"Port Crescent Road"},"type":"Feature","geometry":{"type":"Point","coordinates":[-83.0340672,44.0018909]}},{"properties":{"latitude":44.0001004,"column_5":1,"date":{"end_time":"2011/10/08 00:00:00 -0400","original":"10/7/2011","granularity":"day","time":"2011/10/07 00:00:00 -0400"},"longitude":-83.0725193,"id":"ag2kyxh3kgbw","location":"Port Crescent SP, Dunes"},"type":"Feature","geometry":{"type":"Point","coordinates":[-83.0725193,44.0001004]}},{"properties":{"latitude":43.9659785,"column_5":1,"date":{"end_time":"2011/10/09 00:00:00 -0400","original":"10/8/2011","granularity":"day","time":"2011/10/08 00:00:00 -0400"},"longitude":-83.0419636,"id":"ag2kyxi1gr8n","location":"Oak Beach Road"},"type":"Feature","geometry":{"type":"Point","coordinates":[-83.0419636,43.9659785]}},{"properties":{"latitude":44.9496137,"column_5":1,"date":{"end_time":"2011/10/13 00:00:00 -0400","original":"10/12/2011","granularity":"day","time":"2011/10/12 00:00:00 -0400"},"longitude":-84.1946697,"id":"ag2kyxdyt1tj","location":"Shoreline Drive"},"type":"Feature","geometry":{"type":"Point","coordinates":[-84.1946697,44.9496137]}},{"properties":{"latitude":43.3338873,"column_5":1,"date":{"end_time":"2011/10/17 00:00:00 -0400","original":"10/16/2011","granularity":"day","time":"2011/10/16 00:00:00 -0400"},"longitude":-84.0382862,"id":"ag2kyxdqggk4","location":"Shiawassee NWR Location C"},"type":"Feature","geometry":{"type":"Point","coordinates":[-84.0382862,43.3338873]}},{"properties":{"latitude":44.3224972,"column_5":1,"date":{"end_time":"2011/10/19 00:00:00 -0400","original":"10/18/2011","granularity":"day","time":"2011/10/18 00:00:00 -0400"},"longitude":-83.6164284,"id":"ag2kyx78vfik","location":"Plank Road"},"type":"Feature","geometry":{"type":"Point","coordinates":[-83.6164284,44.3224972]}},{"properties":{"latitude":44.8104613,"column_5":1,"date":{"end_time":"2011/10/22 00:00:00 -0400","original":"10/21/2011","granularity":"day","time":"2011/10/21 00:00:00 -0400"},"longitude":-84.3647003,"id":"ag2kyxjh9diu","location":"Pickerel Lake Road"},"type":"Feature","geometry":{"type":"Point","coordinates":[-84.3647003,44.8104613]}},{"properties":{"latitude":44.3782876,"column_5":1,"date":{"end_time":"2011/10/23 00:00:00 -0400","original":"10/22/2011","granularity":"day","time":"2011/10/22 00:00:00 -0400"},"longitude":-84.8421335,"id":"ag2kyxcvevgb","location":"Michelson's Landing"},"type":"Feature","geometry":{"type":"Point","coordinates":[-84.8421335,44.3782876]}},{"properties":{"latitude":44.4238503,"column_5":1,"date":{"end_time":"2011/10/23 00:00:00 -0400","original":"10/22/2011","granularity":"day","time":"2011/10/22 00:00:00 -0400"},"longitude":-84.6748924,"id":"ag2kyx4jzsxf","location":"Marl Lake"},"type":"Feature","geometry":{"type":"Point","coordinates":[-84.6748924,44.4238503]}},{"properties":{"latitude":46.0981144,"column_5":1,"date":{"end_time":"2011/10/26 00:00:00 -0400","original":"10/25/2011","granularity":"day","time":"2011/10/25 00:00:00 -0400"},"longitude":-85.4202461,"id":"ag2kyxa8oag4","location":"Lake Michigan (Naubinway)"},"type":"Feature","geometry":{"type":"Point","coordinates":[-85.4202461,46.0981144]}},{"properties":{"latitude":46.3391063,"column_5":1,"date":{"end_time":"2011/10/26 00:00:00 -0400","original":"10/25/2011","granularity":"day","time":"2011/10/25 00:00:00 -0400"},"longitude":-85.6978226,"id":"ag2kyxiwxp2r","location":"McMillan"},"type":"Feature","geometry":{"type":"Point","coordinates":[-85.6978226,46.3391063]}},{"properties":{"latitude":46.0950194,"column_5":1,"date":{"end_time":"2011/10/26 00:00:00 -0400","original":"10/25/2011","granularity":"day","time":"2011/10/25 00:00:00 -0400"},"longitude":-85.3926516,"id":"ag2kyx5esywe","location":"Log Cabin Rest Stop"},"type":"Feature","geometry":{"type":"Point","coordinates":[-85.3926516,46.0950194]}},{"properties":{"latitude":46.6281621,"column_5":1,"date":{"end_time":"2011/10/27 00:00:00 -0400","original":"10/26/2011","granularity":"day","time":"2011/10/26 00:00:00 -0400"},"longitude":-87.4918556,"id":"ag2kyxdqfn04","location":"Harlow Lake"},"type":"Feature","geometry":{"type":"Point","coordinates":[-87.4918556,46.6281621]}},{"properties":{"latitude":46.4993376,"column_5":1,"date":{"end_time":"2011/10/27 00:00:00 -0400","original":"10/26/2011","granularity":"day","time":"2011/10/26 00:00:00 -0400"},"longitude":-87.5946808,"id":"ag2kyxjawko5","location":"Negaunee"},"type":"Feature","geometry":{"type":"Point","coordinates":[-87.5946808,46.4993376]}},{"properties":{"latitude":46.4894108,"column_5":1,"date":{"end_time":"2011/10/27 00:00:00 -0400","original":"10/26/2011","granularity":"day","time":"2011/10/26 00:00:00 -0400"},"longitude":-87.3200226,"id":"ag2kyxgmluqd","location":"Harvey"},"type":"Feature","geometry":{"type":"Point","coordinates":[-87.3200226,46.4894108]}},{"properties":{"latitude":46.8115155,"column_5":1,"date":{"end_time":"2011/10/28 00:00:00 -0400","original":"10/27/2011","granularity":"day","time":"2011/10/27 00:00:00 -0400"},"longitude":-87.7246284,"id":"ag2kyxjqdk7k","location":"Perkins Park"},"type":"Feature","geometry":{"type":"Point","coordinates":[-87.7246284,46.8115155]}},{"properties":{"latitude":44.2754422,"column_5":1,"date":{"end_time":"2011/10/30 00:00:00 -0400","original":"10/29/2011","granularity":"day","time":"2011/10/29 00:00:00 -0400"},"longitude":-83.5021019,"id":"ag2kyx492xme","location":"East Tawas"},"type":"Feature","geometry":{"type":"Point","coordinates":[-83.5021019,44.2754422]}},{"properties":{"latitude":44.3660478,"column_5":1,"date":{"end_time":"2011/10/30 00:00:00 -0400","original":"10/29/2011","granularity":"day","time":"2011/10/29 00:00:00 -0400"},"longitude":-83.4592724,"id":"ag2kyxdo4ajr","location":"Tuttle Marsh (Tuttle Puddle)"},"type":"Feature","geometry":{"type":"Point","coordinates":[-83.4592724,44.3660478]}},{"properties":{"latitude":44.9874453,"column_5":1,"date":{"end_time":"2011/10/31 00:00:00 -0400","original":"10/30/2011","granularity":"day","time":"2011/10/30 00:00:00 -0400"},"longitude":-84.4749928,"id":"ag2kyxfrpsv0","location":"M-32 Farms"},"type":"Feature","geometry":{"type":"Point","coordinates":[-84.4749928,44.9874453]}},{"properties":{"latitude":44.681104,"column_5":1,"date":{"end_time":"2011/11/03 00:00:00 -0400","original":"11/2/2011","granularity":"day","time":"2011/11/02 00:00:00 -0400"},"longitude":-83.7542725,"id":"ag2kyx5r1hjy","location":"M65 Curran"},"type":"Feature","geometry":{"type":"Point","coordinates":[-83.7542725,44.681104]}},{"properties":{"latitude":44.7256375,"column_5":1,"date":{"end_time":"2011/11/03 00:00:00 -0400","original":"11/2/2011","granularity":"day","time":"2011/11/02 00:00:00 -0400"},"longitude":-84.0316772,"id":"ag2kyxf6zqnk","location":"Fairview"},"type":"Feature","geometry":{"type":"Point","coordinates":[-84.0316772,44.7256375]}},{"properties":{"latitude":44.5998795,"column_5":1,"date":{"end_time":"2011/11/06 00:00:00 -0400","original":"11/5/2011","granularity":"day","time":"2011/11/05 00:00:00 -0400"},"longitude":-84.5578194,"id":"ag2kyxb07x0c","location":"Chase Bridge Road"},"type":"Feature","geometry":{"type":"Point","coordinates":[-84.5578194,44.5998795]}},{"properties":{"latitude":44.713135,"column_5":1,"date":{"end_time":"2011/11/06 00:00:00 -0400","original":"11/5/2011","granularity":"day","time":"2011/11/05 00:00:00 -0400"},"longitude":-84.4280434,"id":"ag2kyxilb1sz","location":"McMasters Bridge Road"},"type":"Feature","geometry":{"type":"Point","coordinates":[-84.4280434,44.713135]}},{"properties":{"latitude":45.4026083,"column_5":1,"date":{"end_time":"2011/11/08 00:00:00 -0500","original":"11/7/2011","granularity":"day","time":"2011/11/07 00:00:00 -0500"},"longitude":-84.6296597,"id":"ag2kyxctcbn0","location":"Burt Lake State Park"},"type":"Feature","geometry":{"type":"Point","coordinates":[-84.6296597,45.4026083]}},{"properties":{"latitude":45.7485849,"column_5":1,"date":{"end_time":"2011/11/08 00:00:00 -0500","original":"11/7/2011","granularity":"day","time":"2011/11/07 00:00:00 -0500"},"longitude":-84.9099398,"id":"ag2kyxhps0t5","location":"Wilderness State Park Drive"},"type":"Feature","geometry":{"type":"Point","coordinates":[-84.9099398,45.7485849]}},{"properties":{"latitude":45.7475218,"column_5":1,"date":{"end_time":"2011/11/08 00:00:00 -0500","original":"11/7/2011","granularity":"day","time":"2011/11/07 00:00:00 -0500"},"longitude":-84.7986603,"id":"ag2kyx3y18wi","location":"Trails End Bay"},"type":"Feature","geometry":{"type":"Point","coordinates":[-84.7986603,45.7475218]}},{"properties":{"latitude":45.7829082,"column_5":1,"date":{"end_time":"2011/11/08 00:00:00 -0500","original":"11/7/2011","granularity":"day","time":"2011/11/07 00:00:00 -0500"},"longitude":-84.7322702,"id":"ag2kyx8gtbfv","location":"Mackinaw City"},"type":"Feature","geometry":{"type":"Point","coordinates":[-84.7322702,45.7829082]}},{"properties":{"latitude":45.3415284,"column_5":1,"date":{"end_time":"2011/11/08 00:00:00 -0500","original":"11/7/2011","granularity":"day","time":"2011/11/07 00:00:00 -0500"},"longitude":-84.6077728,"id":"ag2kyx932w76","location":"I-75"},"type":"Feature","geometry":{"type":"Point","coordinates":[-84.6077728,45.3415284]}},{"properties":{"latitude":45.7457174,"column_5":1,"date":{"end_time":"2011/11/08 00:00:00 -0500","original":"11/7/2011","granularity":"day","time":"2011/11/07 00:00:00 -0500"},"longitude":-84.8311257,"id":"ag2kyxdls7yb","location":"Cecil Bay"},"type":"Feature","geometry":{"type":"Point","coordinates":[-84.8311257,45.7457174]}},{"properties":{"latitude":46.6560207,"column_5":1,"date":{"end_time":"2011/11/13 00:00:00 -0500","original":"11/12/2011","granularity":"day","time":"2011/11/12 00:00:00 -0500"},"longitude":-88.0574236,"id":"ag2kyxfbqa17","location":"Peshekee Grade"},"type":"Feature","geometry":{"type":"Point","coordinates":[-88.0574236,46.6560207]}},{"properties":{"latitude":46.0592211,"column_5":1,"date":{"end_time":"2011/11/13 00:00:00 -0500","original":"11/12/2011","granularity":"day","time":"2011/11/12 00:00:00 -0500"},"longitude":-85.1823878,"id":"ag2kyx8pvrry","location":"Epoufette Bay"},"type":"Feature","geometry":{"type":"Point","coordinates":[-85.1823878,46.0592211]}},{"properties":{"latitude":46.3951935,"column_5":1,"date":{"end_time":"2011/11/13 00:00:00 -0500","original":"11/12/2011","granularity":"day","time":"2011/11/12 00:00:00 -0500"},"longitude":-86.6484833,"id":"ag2kyxdrigta","location":"M28 South of Munising"},"type":"Feature","geometry":{"type":"Point","coordinates":[-86.6484833,46.3951935]}},{"properties":{"latitude":42.5499821,"column_5":1,"date":{"end_time":"2011/11/14 00:00:00 -0500","original":"11/13/2011","granularity":"day","time":"2011/11/13 00:00:00 -0500"},"longitude":-86.1178436,"id":"ag2kyxcduly6","location":"Allegan SGA--Farm Unit"},"type":"Feature","geometry":{"type":"Point","coordinates":[-86.1178436,42.5499821]}},{"properties":{"latitude":42.5733729,"column_5":1,"date":{"end_time":"2011/11/14 00:00:00 -0500","original":"11/13/2011","granularity":"day","time":"2011/11/13 00:00:00 -0500"},"longitude":-85.9724808,"id":"ag2kyx71xgqv","location":"Allegan SGA--Highbanks Unit"},"type":"Feature","geometry":{"type":"Point","coordinates":[-85.9724808,42.5733729]}},{"properties":{"latitude":42.6387576,"column_5":1,"date":{"end_time":"2011/11/14 00:00:00 -0500","original":"11/13/2011","granularity":"day","time":"2011/11/13 00:00:00 -0500"},"longitude":-86.1470604,"id":"ag2kyxi3uua2","location":"Kalamazoo River--Morrison Bayou"},"type":"Feature","geometry":{"type":"Point","coordinates":[-86.1470604,42.6387576]}},{"properties":{"latitude":42.6640086,"column_5":1,"date":{"end_time":"2011/11/14 00:00:00 -0500","original":"11/13/2011","granularity":"day","time":"2011/11/13 00:00:00 -0500"},"longitude":-86.2162399,"id":"ag2kyx4b4qnt","location":"Oval Beach"},"type":"Feature","geometry":{"type":"Point","coordinates":[-86.2162399,42.6640086]}},{"properties":{"latitude":42.6403045,"column_5":1,"date":{"end_time":"2011/11/14 00:00:00 -0500","original":"11/13/2011","granularity":"day","time":"2011/11/13 00:00:00 -0500"},"longitude":-86.1763287,"id":"ag2kyxi7b1y4","location":"Kalamazoo River--Newport Harbor"},"type":"Feature","geometry":{"type":"Point","coordinates":[-86.1763287,42.6403045]}},{"properties":{"latitude":42.6212968,"column_5":1,"date":{"end_time":"2011/11/14 00:00:00 -0500","original":"11/13/2011","granularity":"day","time":"2011/11/13 00:00:00 -0500"},"longitude":-86.1509228,"id":"ag2kyxf0j0ud","location":"62nd St &amp; 128th Ave Field"},"type":"Feature","geometry":{"type":"Point","coordinates":[-86.1509228,42.6212968]}},{"properties":{"latitude":42.8277567,"column_5":1,"date":{"end_time":"2011/11/24 00:00:00 -0500","original":"11/23/2011","granularity":"day","time":"2011/11/23 00:00:00 -0500"},"longitude":-84.5441937,"id":"ag2kyxerr09c","location":"Herbison Rd"},"type":"Feature","geometry":{"type":"Point","coordinates":[-84.5441937,42.8277567]}},{"properties":{"latitude":44.7166568,"column_5":1,"date":{"end_time":"2011/12/03 00:00:00 -0500","original":"12/2/2011","granularity":"day","time":"2011/12/02 00:00:00 -0500"},"longitude":-84.4294886,"id":"ag2kyx428w0k","location":"North Down River/McMasters"},"type":"Feature","geometry":{"type":"Point","coordinates":[-84.4294886,44.7166568]}},{"properties":{"latitude":45.0093398,"column_5":1,"date":{"end_time":"2011/12/06 00:00:00 -0500","original":"12/5/2011","granularity":"day","time":"2011/12/05 00:00:00 -0500"},"longitude":-84.586473,"id":"ag2kyxdssf43","location":"Big Lake"},"type":"Feature","geometry":{"type":"Point","coordinates":[-84.586473,45.0093398]}},{"properties":{"latitude":45.0134053,"column_5":1,"date":{"end_time":"2011/12/07 00:00:00 -0500","original":"12/6/2011","granularity":"day","time":"2011/12/06 00:00:00 -0500"},"longitude":-83.4645371,"id":"ag2kyxhqgt0x","location":"M23 Alpena"},"type":"Feature","geometry":{"type":"Point","coordinates":[-83.4645371,45.0134053]}},{"properties":{"latitude":45.06312,"column_5":1,"date":{"end_time":"2011/12/12 00:00:00 -0500","original":"12/11/2011","granularity":"day","time":"2011/12/11 00:00:00 -0500"},"longitude":-83.458293,"id":"ag2kyxfg8x5q","location":"Lake Besser (South)"},"type":"Feature","geometry":{"type":"Point","coordinates":[-83.458293,45.06312]}},{"properties":{"latitude":44.7270853,"column_5":1,"date":{"end_time":"2011/12/12 00:00:00 -0500","original":"12/11/2011","granularity":"day","time":"2011/12/11 00:00:00 -0500"},"longitude":-84.2444377,"id":"ag2kyx5344pz","location":"Miller Road"},"type":"Feature","geometry":{"type":"Point","coordinates":[-84.2444377,44.7270853]}},{"properties":{"latitude":45.0080048,"column_5":1,"date":{"end_time":"2011/12/12 00:00:00 -0500","original":"12/11/2011","granularity":"day","time":"2011/12/11 00:00:00 -0500"},"longitude":-83.4395175,"id":"ag2kyx4umjo6","location":"Partridge Point"},"type":"Feature","geometry":{"type":"Point","coordinates":[-83.4395175,45.0080048]}},{"properties":{"latitude":44.7679431,"column_5":1,"date":{"end_time":"2011/12/13 00:00:00 -0500","original":"12/12/2011","granularity":"day","time":"2011/12/12 00:00:00 -0500"},"longitude":-85.6233215,"id":"ag2kyxgj44mf","location":"Traverse City Marina (Clinch Marina)"},"type":"Feature","geometry":{"type":"Point","coordinates":[-85.6233215,44.7679431]}},{"properties":{"latitude":43.990452,"column_5":1,"date":{"end_time":"2011/12/23 00:00:00 -0500","original":"12/22/2011","granularity":"day","time":"2011/12/22 00:00:00 -0500"},"longitude":-83.8841634,"id":"ag2kyxew2b3f","location":"State and Hagley"},"type":"Feature","geometry":{"type":"Point","coordinates":[-83.8841634,43.990452]}},{"properties":{"latitude":42.8503425,"column_5":1,"date":{"end_time":"2011/12/24 00:00:00 -0500","original":"12/23/2011","granularity":"day","time":"2011/12/23 00:00:00 -0500"},"longitude":-84.5171218,"id":"ag2kyxe8whh8","location":"Exit 86 Route 127"},"type":"Feature","geometry":{"type":"Point","coordinates":[-84.5171218,42.8503425]}},{"properties":{"latitude":43.954039,"column_5":1,"date":{"end_time":"2012/01/07 00:00:00 -0500","original":"1/6/2012","granularity":"day","time":"2012/01/06 00:00:00 -0500"},"longitude":-86.4612114,"id":"ag2kyx9g1sge","location":"Ludington Harbor"},"type":"Feature","geometry":{"type":"Point","coordinates":[-86.4612114,43.954039]}},{"properties":{"latitude":43.9566026,"column_5":1,"date":{"end_time":"2012/01/07 00:00:00 -0500","original":"1/6/2012","granularity":"day","time":"2012/01/06 00:00:00 -0500"},"longitude":-86.2951045,"id":"ag2kyxc29x62","location":"Scottville"},"type":"Feature","geometry":{"type":"Point","coordinates":[-86.2951045,43.9566026]}},{"properties":{"latitude":44.2440763,"column_5":1,"date":{"end_time":"2012/01/11 00:00:00 -0500","original":"1/10/2012","granularity":"day","time":"2012/01/10 00:00:00 -0500"},"longitude":-85.3657298,"id":"ag2kyxhv3jj2","location":"Rt 131, Cadillac"},"type":"Feature","geometry":{"type":"Point","coordinates":[-85.3657298,44.2440763]}},{"properties":{"latitude":44.7890076,"column_5":1,"date":{"end_time":"2012/01/25 00:00:00 -0500","original":"1/24/2012","granularity":"day","time":"2012/01/24 00:00:00 -0500"},"longitude":-84.5983176,"id":"ag2kyx922lgv","location":"612 Near Jones Lake"},"type":"Feature","geometry":{"type":"Point","coordinates":[-84.5983176,44.7890076]}},{"properties":{"latitude":44.0858428,"column_5":1,"date":{"end_time":"2012/01/27 00:00:00 -0500","original":"1/26/2012","granularity":"day","time":"2012/01/26 00:00:00 -0500"},"longitude":-84.7984533,"id":"ag2kyxabq2ir","location":"Rte 127 Mile 180"},"type":"Feature","geometry":{"type":"Point","coordinates":[-84.7984533,44.0858428]}},{"properties":{"latitude":42.6151854,"column_5":1,"date":{"end_time":"2012/02/14 00:00:00 -0500","original":"2/13/2012","granularity":"day","time":"2012/02/13 00:00:00 -0500"},"longitude":-84.3436901,"id":"ag2kyx5c4zxa","location":"Waldo"},"type":"Feature","geometry":{"type":"Point","coordinates":[-84.3436901,42.6151854]}},{"properties":{"latitude":42.9269694,"column_5":1,"date":{"end_time":"2012/02/23 00:00:00 -0500","original":"2/22/2012","granularity":"day","time":"2012/02/22 00:00:00 -0500"},"longitude":-84.5202975,"id":"ag2kyx6tbcqt","location":"Price Road Exit Ponds"},"type":"Feature","geometry":{"type":"Point","coordinates":[-84.5202975,42.9269694]}},{"properties":{"latitude":42.5141828,"column_5":1,"date":{"end_time":"2012/02/29 00:00:00 -0500","original":"2/28/2012","granularity":"day","time":"2012/02/28 00:00:00 -0500"},"longitude":-84.2851214,"id":"ag2kyx7avgt3","location":"Dansville SGA (Howard/Ewers)"},"type":"Feature","geometry":{"type":"Point","coordinates":[-84.2851214,42.5141828]}},{"properties":{"latitude":43.5153653,"column_5":1,"date":{"end_time":"2012/03/08 00:00:00 -0500","original":"3/7/2012","granularity":"day","time":"2012/03/07 00:00:00 -0500"},"longitude":-84.4669537,"id":"ag2kyxje9joi","location":"Porter Area"},"type":"Feature","geometry":{"type":"Point","coordinates":[-84.4669537,43.5153653]}},{"properties":{"latitude":43.600815,"column_5":1,"date":{"end_time":"2012/03/08 00:00:00 -0500","original":"3/7/2012","granularity":"day","time":"2012/03/07 00:00:00 -0500"},"longitude":-84.29258,"id":"ag2kyxg1e824","location":"Chippewa Nature Center"},"type":"Feature","geometry":{"type":"Point","coordinates":[-84.29258,43.600815]}},{"properties":{"latitude":43.5954902,"column_5":1,"date":{"end_time":"2012/03/08 00:00:00 -0500","original":"3/7/2012","granularity":"day","time":"2012/03/07 00:00:00 -0500"},"longitude":-84.002129,"id":"ag2kyxdllqzx","location":"US10"},"type":"Feature","geometry":{"type":"Point","coordinates":[-84.002129,43.5954902]}},{"properties":{"latitude":43.1837948,"column_5":1,"date":{"end_time":"2012/03/14 00:00:00 -0400","original":"3/13/2012","granularity":"day","time":"2012/03/13 00:00:00 -0400"},"longitude":-86.0080833,"id":"ag2kyx9yq9xi","location":"Swanson/Musketawa Trail"},"type":"Feature","geometry":{"type":"Point","coordinates":[-86.0080833,43.1837948]}},{"properties":{"latitude":43.2476248,"column_5":1,"date":{"end_time":"2012/03/14 00:00:00 -0400","original":"3/13/2012","granularity":"day","time":"2012/03/13 00:00:00 -0400"},"longitude":-86.3322263,"id":"ag2kyx9g9ch2","location":"Muskegon SP - Snug Harbor"},"type":"Feature","geometry":{"type":"Point","coordinates":[-86.3322263,43.2476248]}},{"properties":{"latitude":43.2013376,"column_5":1,"date":{"end_time":"2012/03/14 00:00:00 -0400","original":"3/13/2012","granularity":"day","time":"2012/03/13 00:00:00 -0400"},"longitude":-85.9871373,"id":"ag2kyxatfo04","location":"Moorland Fields"},"type":"Feature","geometry":{"type":"Point","coordinates":[-85.9871373,43.2013376]}},{"properties":{"latitude":43.2360791,"column_5":1,"date":{"end_time":"2012/03/14 00:00:00 -0400","original":"3/13/2012","granularity":"day","time":"2012/03/13 00:00:00 -0400"},"longitude":-86.3402653,"id":"ag2kyxckurb6","location":"Muskegon SP"},"type":"Feature","geometry":{"type":"Point","coordinates":[-86.3402653,43.2360791]}},{"properties":{"latitude":42.7591713,"column_5":1,"date":{"end_time":"2012/03/16 00:00:00 -0400","original":"3/15/2012","granularity":"day","time":"2012/03/15 00:00:00 -0400"},"longitude":-84.7580848,"id":"ag2kyxffo6na","location":"The Ledges, Fitzgerald Park"},"type":"Feature","geometry":{"type":"Point","coordinates":[-84.7580848,42.7591713]}},{"properties":{"latitude":43.1557529,"column_5":1,"date":{"end_time":"2012/03/18 00:00:00 -0400","original":"3/17/2012","granularity":"day","time":"2012/03/17 00:00:00 -0400"},"longitude":-84.5820182,"id":"ag2kyxckibig","location":"Ranger Road/Croswell Road"},"type":"Feature","geometry":{"type":"Point","coordinates":[-84.5820182,43.1557529]}},{"properties":{"latitude":42.9294406,"column_5":1,"date":{"end_time":"2012/03/18 00:00:00 -0400","original":"3/17/2012","granularity":"day","time":"2012/03/17 00:00:00 -0400"},"longitude":-84.4530854,"id":"ag2kyxd3qipj","location":"Price Road"},"type":"Feature","geometry":{"type":"Point","coordinates":[-84.4530854,42.9294406]}},{"properties":{"latitude":43.2616437,"column_5":1,"date":{"end_time":"2012/03/19 00:00:00 -0400","original":"3/18/2012","granularity":"day","time":"2012/03/18 00:00:00 -0400"},"longitude":-86.039257,"id":"ag2kyx6ty5xp","location":"Muskegon Wastewater System--Headquarters"},"type":"Feature","geometry":{"type":"Point","coordinates":[-86.039257,43.2616437]}},{"properties":{"latitude":42.7021898,"column_5":1,"date":{"end_time":"2012/03/21 00:00:00 -0400","original":"3/20/2012","granularity":"day","time":"2012/03/20 00:00:00 -0400"},"longitude":-84.531834,"id":"ag2kyxcuaads","location":"Scotts Woods"},"type":"Feature","geometry":{"type":"Point","coordinates":[-84.531834,42.7021898]}},{"properties":{"latitude":42.0403691,"column_5":1,"date":{"end_time":"2012/03/29 00:00:00 -0400","original":"3/28/2012","granularity":"day","time":"2012/03/28 00:00:00 -0400"},"longitude":-83.1998062,"id":"ag2kyx74n2w2","location":"Pte. Mouillee SGA--HQ"},"type":"Feature","geometry":{"type":"Point","coordinates":[-83.1998062,42.0403691]}},{"properties":{"latitude":42.8694183,"column_5":1,"date":{"end_time":"2012/04/06 00:00:00 -0400","original":"4/5/2012","granularity":"day","time":"2012/04/05 00:00:00 -0400"},"longitude":-84.4527904,"id":"ag2kyx6el1bc","location":"Looking Glass River Access"},"type":"Feature","geometry":{"type":"Point","coordinates":[-84.4527904,42.8694183]}},{"properties":{"latitude":42.3770882,"column_5":1,"date":{"end_time":"2012/04/08 00:00:00 -0400","original":"4/7/2012","granularity":"day","time":"2012/04/07 00:00:00 -0400"},"longitude":-84.9793415,"id":"ag2kyx4zo9no","location":"Baker Sanctuary, Doty Trail"},"type":"Feature","geometry":{"type":"Point","coordinates":[-84.9793415,42.3770882]}},{"properties":{"latitude":42.7164349,"column_5":1,"date":{"end_time":"2012/04/18 00:00:00 -0400","original":"4/17/2012","granularity":"day","time":"2012/04/17 00:00:00 -0400"},"longitude":-84.4747782,"id":"ag2kyxgv1grn","location":"Baker Woodlot"},"type":"Feature","geometry":{"type":"Point","coordinates":[-84.4747782,42.7164349]}},{"properties":{"latitude":44.6938734,"column_5":1,"date":{"end_time":"2012/04/25 00:00:00 -0400","original":"4/24/2012","granularity":"day","time":"2012/04/24 00:00:00 -0400"},"longitude":-86.1865665,"id":"ag2kyx4pf6bv","location":"Sleeping Bear Dunes National Lakeshore - Round Lake"},"type":"Feature","geometry":{"type":"Point","coordinates":[-86.1865665,44.6938734]}},{"properties":{"latitude":44.809654,"column_5":1,"date":{"end_time":"2012/04/25 00:00:00 -0400","original":"4/24/2012","granularity":"day","time":"2012/04/24 00:00:00 -0400"},"longitude":-85.5606298,"id":"ag2kyxaot19w","location":"East Arm Access, Mission Peninsula"},"type":"Feature","geometry":{"type":"Point","coordinates":[-85.5606298,44.809654]}},{"properties":{"latitude":44.8176528,"column_5":1,"date":{"end_time":"2012/04/25 00:00:00 -0400","original":"4/24/2012","granularity":"day","time":"2012/04/24 00:00:00 -0400"},"longitude":-86.0513178,"id":"ag2kyxj632ck","location":"Chippewa Run Preserve"},"type":"Feature","geometry":{"type":"Point","coordinates":[-86.0513178,44.8176528]}},{"properties":{"latitude":44.8116101,"column_5":1,"date":{"end_time":"2012/04/25 00:00:00 -0400","original":"4/24/2012","granularity":"day","time":"2012/04/24 00:00:00 -0400"},"longitude":-86.0556047,"id":"ag2kyx6hcrfe","location":"Sleeping Bear Dunes Visitor Center"},"type":"Feature","geometry":{"type":"Point","coordinates":[-86.0556047,44.8116101]}},{"properties":{"latitude":44.5197361,"column_5":1,"date":{"end_time":"2012/04/25 00:00:00 -0400","original":"4/24/2012","granularity":"day","time":"2012/04/24 00:00:00 -0400"},"longitude":-86.2328921,"id":"ag2kyx3zo86k","location":"Arcadia Scenic Turnout"},"type":"Feature","geometry":{"type":"Point","coordinates":[-86.2328921,44.5197361]}},{"properties":{"latitude":43.0395283,"column_5":1,"date":{"end_time":"2012/04/27 00:00:00 -0400","original":"4/26/2012","granularity":"day","time":"2012/04/26 00:00:00 -0400"},"longitude":-83.6095405,"id":"ag2kyxa1z5pt","location":"For Mar Nature Preserve"},"type":"Feature","geometry":{"type":"Point","coordinates":[-83.6095405,43.0395283]}},{"properties":{"latitude":44.1633733,"column_5":1,"date":{"end_time":"2012/04/27 00:00:00 -0400","original":"4/26/2012","granularity":"day","time":"2012/04/26 00:00:00 -0400"},"longitude":-83.5686423,"id":"ag2kyxakjir0","location":"Dyer Road"},"type":"Feature","geometry":{"type":"Point","coordinates":[-83.5686423,44.1633733]}},{"properties":{"latitude":41.611913,"column_5":1,"date":{"end_time":"2012/05/08 00:00:00 -0400","original":"5/7/2012","granularity":"day","time":"2012/05/07 00:00:00 -0400"},"longitude":-83.1872106,"id":"ag2kyx5hgq1f","location":"Magee Marsh Wildlife Area--Migratory Bird Center &amp; Hawk Tower"},"type":"Feature","geometry":{"type":"Point","coordinates":[-83.1872106,41.611913]}},{"properties":{"latitude":41.6113354,"column_5":1,"date":{"end_time":"2012/05/09 00:00:00 -0400","original":"5/8/2012","granularity":"day","time":"2012/05/08 00:00:00 -0400"},"longitude":-83.213625,"id":"ag2kyxcv6ly3","location":"Ottawa NWR--Auto Tour (Ottawa Co.)"},"type":"Feature","geometry":{"type":"Point","coordinates":[-83.213625,41.6113354]}},{"properties":{"latitude":41.6116242,"column_5":1,"date":{"end_time":"2012/05/09 00:00:00 -0400","original":"5/8/2012","granularity":"day","time":"2012/05/08 00:00:00 -0400"},"longitude":-83.2031965,"id":"ag2kyxbkdiex","location":"Ottawa NWR--Walking Trail Woodland"},"type":"Feature","geometry":{"type":"Point","coordinates":[-83.2031965,41.6116242]}},{"properties":{"latitude":41.5777496,"column_5":1,"date":{"end_time":"2012/05/13 00:00:00 -0400","original":"5/12/2012","granularity":"day","time":"2012/05/12 00:00:00 -0400"},"longitude":-83.8546461,"id":"ag2kyxbib82s","location":"Oak Openings Preserve (North End)"},"type":"Feature","geometry":{"type":"Point","coordinates":[-83.8546461,41.5777496]}},{"properties":{"latitude":41.610909,"column_5":1,"date":{"end_time":"2012/05/14 00:00:00 -0400","original":"5/13/2012","granularity":"day","time":"2012/05/13 00:00:00 -0400"},"longitude":-83.2499735,"id":"ag2kyxjm6hqa","location":"Krause Road Fields"},"type":"Feature","geometry":{"type":"Point","coordinates":[-83.2499735,41.610909]}},{"properties":{"latitude":41.6831393,"column_5":1,"date":{"end_time":"2012/05/14 00:00:00 -0400","original":"5/13/2012","granularity":"day","time":"2012/05/13 00:00:00 -0400"},"longitude":-83.3818999,"id":"ag2kyxaeexs6","location":"Maumee Bay SP--The Hill"},"type":"Feature","geometry":{"type":"Point","coordinates":[-83.3818999,41.6831393]}},{"properties":{"latitude":44.0380448,"column_5":1,"date":{"end_time":"2012/05/25 00:00:00 -0400","original":"5/24/2012","granularity":"day","time":"2012/05/24 00:00:00 -0400"},"longitude":-83.875848,"id":"ag2kyxj73vuz","location":"Roadside Park, Omer"},"type":"Feature","geometry":{"type":"Point","coordinates":[-83.875848,44.0380448]}},{"properties":{"latitude":42.7745744,"column_5":1,"date":{"end_time":"2012/05/30 00:00:00 -0400","original":"5/29/2012","granularity":"day","time":"2012/05/29 00:00:00 -0400"},"longitude":-84.4847916,"id":"ag2kyxdg3al3","location":"Chandler Crossing field"},"type":"Feature","geometry":{"type":"Point","coordinates":[-84.4847916,42.7745744]}},{"properties":{"latitude":44.055596,"column_5":1,"date":{"end_time":"2012/06/04 00:00:00 -0400","original":"6/3/2012","granularity":"day","time":"2012/06/03 00:00:00 -0400"},"longitude":-90.162431,"id":"ag2kyx6u3x7t","location":"Necedah NWR, Observation Deck"},"type":"Feature","geometry":{"type":"Point","coordinates":[-90.162431,44.055596]}},{"properties":{"latitude":45.6655324,"column_5":1,"date":{"end_time":"2012/06/04 00:00:00 -0400","original":"6/3/2012","granularity":"day","time":"2012/06/03 00:00:00 -0400"},"longitude":-94.8098397,"id":"ag2kyxcdz7db","location":"Melrose Super 8"},"type":"Feature","geometry":{"type":"Point","coordinates":[-94.8098397,45.6655324]}},{"properties":{"latitude":46.6699,"column_5":1,"date":{"end_time":"2012/06/05 00:00:00 -0400","original":"6/4/2012","granularity":"day","time":"2012/06/04 00:00:00 -0400"},"longitude":-100.2277,"id":"ag2kyxavmss6","location":"Long Lake NWR"},"type":"Feature","geometry":{"type":"Point","coordinates":[-100.2277,46.6699]}},{"properties":{"latitude":47.0085553,"column_5":1,"date":{"end_time":"2012/06/05 00:00:00 -0400","original":"6/4/2012","granularity":"day","time":"2012/06/04 00:00:00 -0400"},"longitude":-98.8633854,"id":"ag2kyxggvh3d","location":"Pipestem Creek and Area"},"type":"Feature","geometry":{"type":"Point","coordinates":[-98.8633854,47.0085553]}},{"properties":{"latitude":46.7385461,"column_5":1,"date":{"end_time":"2012/06/05 00:00:00 -0400","original":"6/4/2012","granularity":"day","time":"2012/06/04 00:00:00 -0400"},"longitude":-100.3534847,"id":"ag2kyx4chj0d","location":"Long Lake Creek"},"type":"Feature","geometry":{"type":"Point","coordinates":[-100.3534847,46.7385461]}},{"properties":{"latitude":46.9071676,"column_5":1,"date":{"end_time":"2012/06/05 00:00:00 -0400","original":"6/4/2012","granularity":"day","time":"2012/06/04 00:00:00 -0400"},"longitude":-98.1436451,"id":"ag2kyx44rgjw","location":"Hobart Lake"},"type":"Feature","geometry":{"type":"Point","coordinates":[-98.1436451,46.9071676]}},{"properties":{"latitude":46.8932357,"column_5":1,"date":{"end_time":"2012/06/05 00:00:00 -0400","original":"6/4/2012","granularity":"day","time":"2012/06/04 00:00:00 -0400"},"longitude":-98.8633403,"id":"ag2kyx6cf9x4","location":"I-94 Mile 251"},"type":"Feature","geometry":{"type":"Point","coordinates":[-98.8633403,46.8932357]}},{"properties":{"latitude":46.8955764,"column_5":1,"date":{"end_time":"2012/06/05 00:00:00 -0400","original":"6/4/2012","granularity":"day","time":"2012/06/04 00:00:00 -0400"},"longitude":-103.3815515,"id":"ag2kyxjc4uiu","location":"Theodore Roosevelt NP--Painted Canyon"},"type":"Feature","geometry":{"type":"Point","coordinates":[-103.3815515,46.8955764]}},{"properties":{"latitude":47.0900705,"column_5":1,"date":{"end_time":"2012/06/06 00:00:00 -0400","original":"6/5/2012","granularity":"day","time":"2012/06/05 00:00:00 -0400"},"longitude":-104.5380411,"id":"ag2kyx7zoyei","location":"I-94 Montana"},"type":"Feature","geometry":{"type":"Point","coordinates":[-104.5380411,47.0900705]}},{"properties":{"latitude":47.0574931,"column_5":1,"date":{"end_time":"2012/06/06 00:00:00 -0400","original":"6/5/2012","granularity":"day","time":"2012/06/05 00:00:00 -0400"},"longitude":-104.6825409,"id":"ag2kyx4g0i07","location":"Makoshika SP"},"type":"Feature","geometry":{"type":"Point","coordinates":[-104.6825409,47.0574931]}},{"properties":{"latitude":46.9256552,"column_5":1,"date":{"end_time":"2012/06/06 00:00:00 -0400","original":"6/5/2012","granularity":"day","time":"2012/06/05 00:00:00 -0400"},"longitude":-103.3895006,"id":"ag2kyxi5jjkf","location":"Buck Hill, TRNP"},"type":"Feature","geometry":{"type":"Point","coordinates":[-103.3895006,46.9256552]}},{"properties":{"latitude":46.8236683,"column_5":1,"date":{"end_time":"2012/06/07 00:00:00 -0400","original":"6/6/2012","granularity":"day","time":"2012/06/06 00:00:00 -0400"},"longitude":-104.2227785,"id":"ag2kyxdj7e6x","location":"US 7 Near Lamesteer"},"type":"Feature","geometry":{"type":"Point","coordinates":[-104.2227785,46.8236683]}},{"properties":{"latitude":46.2345463,"column_5":1,"date":{"end_time":"2012/06/07 00:00:00 -0400","original":"6/6/2012","granularity":"day","time":"2012/06/06 00:00:00 -0400"},"longitude":-103.9494901,"id":"ag2kyxgn016g","location":"Camp Crook Rd."},"type":"Feature","geometry":{"type":"Point","coordinates":[-103.9494901,46.2345463]}},{"properties":{"latitude":46.3223666,"column_5":1,"date":{"end_time":"2012/06/07 00:00:00 -0400","original":"6/6/2012","granularity":"day","time":"2012/06/06 00:00:00 -0400"},"longitude":-103.9361004,"id":"ag2kyxdpz6me","location":"Old 16"},"type":"Feature","geometry":{"type":"Point","coordinates":[-103.9361004,46.3223666]}},{"properties":{"latitude":46.8091747,"column_5":1,"date":{"end_time":"2012/06/07 00:00:00 -0400","original":"6/6/2012","granularity":"day","time":"2012/06/06 00:00:00 -0400"},"longitude":-103.1890302,"id":"ag2kyxbqq8z4","location":"US 85 South of Belfield"},"type":"Feature","geometry":{"type":"Point","coordinates":[-103.1890302,46.8091747]}},{"properties":{"latitude":46.953301,"column_5":1,"date":{"end_time":"2012/06/07 00:00:00 -0400","original":"6/6/2012","granularity":"day","time":"2012/06/06 00:00:00 -0400"},"longitude":-103.3875909,"id":"ag2kyx7djhy6","location":"Upper Talkington Trail"},"type":"Feature","geometry":{"type":"Point","coordinates":[-103.3875909,46.953301]}},{"properties":{"latitude":46.4966984,"column_5":1,"date":{"end_time":"2012/06/08 00:00:00 -0400","original":"6/7/2012","granularity":"day","time":"2012/06/07 00:00:00 -0400"},"longitude":-103.3219011,"id":"ag2kyx8if0b6","location":"Amidon - North of Town"},"type":"Feature","geometry":{"type":"Point","coordinates":[-103.3219011,46.4966984]}},{"properties":{"latitude":47.5946,"column_5":1,"date":{"end_time":"2012/06/08 00:00:00 -0400","original":"6/7/2012","granularity":"day","time":"2012/06/07 00:00:00 -0400"},"longitude":-103.3316,"id":"ag2kyx5qv9n1","location":"Theodore Roosevelt National Park--North Unit"},"type":"Feature","geometry":{"type":"Point","coordinates":[-103.3316,47.5946]}},{"properties":{"latitude":48.5933,"column_5":1,"date":{"end_time":"2012/06/09 00:00:00 -0400","original":"6/8/2012","granularity":"day","time":"2012/06/08 00:00:00 -0400"},"longitude":-102.4438,"id":"ag2kyxb259do","location":"Lostwood NWR"},"type":"Feature","geometry":{"type":"Point","coordinates":[-102.4438,48.5933]}},{"properties":{"latitude":47.9731,"column_5":1,"date":{"end_time":"2012/06/10 00:00:00 -0400","original":"6/9/2012","granularity":"day","time":"2012/06/09 00:00:00 -0400"},"longitude":-97.2762,"id":"ag2kyxhvsct2","location":"Kellys Slough NWR"},"type":"Feature","geometry":{"type":"Point","coordinates":[-97.2762,47.9731]}},{"properties":{"latitude":47.7103416,"column_5":1,"date":{"end_time":"2012/06/10 00:00:00 -0400","original":"6/9/2012","granularity":"day","time":"2012/06/09 00:00:00 -0400"},"longitude":-96.1643489,"id":"ag2kyxjg08sq","location":"US 2 Minnesota"},"type":"Feature","geometry":{"type":"Point","coordinates":[-96.1643489,47.7103416]}},{"properties":{"latitude":47.0700926,"column_5":1,"date":{"end_time":"2012/06/10 00:00:00 -0400","original":"6/9/2012","granularity":"day","time":"2012/06/09 00:00:00 -0400"},"longitude":-92.6297665,"id":"ag2kyx4wwjc8","location":"Sax-Zim Bog--east of Meadowlands"},"type":"Feature","geometry":{"type":"Point","coordinates":[-92.6297665,47.0700926]}},{"properties":{"latitude":47.7269481,"column_5":1,"date":{"end_time":"2012/06/10 00:00:00 -0400","original":"6/9/2012","granularity":"day","time":"2012/06/09 00:00:00 -0400"},"longitude":-96.4527404,"id":"ag2kyx3l40bh","location":"Pankratz Memorial Prairie"},"type":"Feature","geometry":{"type":"Point","coordinates":[-96.4527404,47.7269481]}},{"properties":{"latitude":46.3697926,"column_5":1,"date":{"end_time":"2012/06/11 00:00:00 -0400","original":"6/10/2012","granularity":"day","time":"2012/06/10 00:00:00 -0400"},"longitude":-90.6424856,"id":"ag2kyxhw3sgt","location":"Copper Falls SP"},"type":"Feature","geometry":{"type":"Point","coordinates":[-90.6424856,46.3697926]}},{"properties":{"latitude":46.3099198,"column_5":1,"date":{"end_time":"2012/06/12 00:00:00 -0400","original":"6/11/2012","granularity":"day","time":"2012/06/11 00:00:00 -0400"},"longitude":-85.5909066,"id":"ag2kyx5nw1tj","location":"M-28 McMillan Rest Stop"},"type":"Feature","geometry":{"type":"Point","coordinates":[-85.5909066,46.3099198]}},{"properties":{"latitude":42.5653051,"column_5":1,"date":{"end_time":"2012/06/23 00:00:00 -0400","original":"6/22/2012","granularity":"day","time":"2012/06/22 00:00:00 -0400"},"longitude":-85.9797592,"id":"ag2kyxiom1ib","location":"Allegan SGA--Swan Creek (118th Ave to Highbanks Unit)"},"type":"Feature","geometry":{"type":"Point","coordinates":[-85.9797592,42.5653051]}},{"properties":{"latitude":42.55095,"column_5":1,"date":{"end_time":"2012/07/16 00:00:00 -0400","original":"7/15/2012","granularity":"day","time":"2012/07/15 00:00:00 -0400"},"longitude":-85.98399,"id":"ag2kyxadzu1g","location":"Allegan SGA--Swan Creek Pond"},"type":"Feature","geometry":{"type":"Point","coordinates":[-85.98399,42.55095]}},{"properties":{"latitude":42.5464742,"column_5":1,"date":{"end_time":"2012/07/16 00:00:00 -0400","original":"7/15/2012","granularity":"day","time":"2012/07/15 00:00:00 -0400"},"longitude":-86.1167054,"id":"ag2kyx6mgstd","location":"Allegan SGA, 59th St. Gravel Pit"},"type":"Feature","geometry":{"type":"Point","coordinates":[-86.1167054,42.5464742]}},{"properties":{"latitude":46.6238753,"column_5":1,"date":{"end_time":"2012/08/01 00:00:00 -0400","original":"7/31/2012","granularity":"day","time":"2012/07/31 00:00:00 -0400"},"longitude":-87.4673586,"id":"ag2kyx6n65az","location":"North Country Trail, Wetmore Landing"},"type":"Feature","geometry":{"type":"Point","coordinates":[-87.4673586,46.6238753]}},{"properties":{"latitude":46.4599743,"column_5":1,"date":{"end_time":"2012/08/03 00:00:00 -0400","original":"8/2/2012","granularity":"day","time":"2012/08/02 00:00:00 -0400"},"longitude":-85.4665947,"id":"ag2kyxfsrkv6","location":"Murphy Creek Burn"},"type":"Feature","geometry":{"type":"Point","coordinates":[-85.4665947,46.4599743]}},{"properties":{"latitude":43.2951545,"column_5":1,"date":{"end_time":"2012/08/07 00:00:00 -0400","original":"8/6/2012","granularity":"day","time":"2012/08/06 00:00:00 -0400"},"longitude":-84.9082876,"id":"ag2kyxgwb638","location":"Crystal Rd. - Stanton Rd."},"type":"Feature","geometry":{"type":"Point","coordinates":[-84.9082876,43.2951545]}},{"properties":{"latitude":43.6274816,"column_5":1,"date":{"end_time":"2012/08/22 00:00:00 -0400","original":"8/21/2012","granularity":"day","time":"2012/08/21 00:00:00 -0400"},"longitude":-83.7779348,"id":"ag2kyxc0tp3g","location":"Finn Road Campground"},"type":"Feature","geometry":{"type":"Point","coordinates":[-83.7779348,43.6274816]}},{"properties":{"latitude":42.7105872,"column_5":1,"date":{"end_time":"2012/08/29 00:00:00 -0400","original":"8/28/2012","granularity":"day","time":"2012/08/28 00:00:00 -0400"},"longitude":-84.4732837,"id":"ag2kyxeuo0k4","location":"MSU Sod Farm"},"type":"Feature","geometry":{"type":"Point","coordinates":[-84.4732837,42.7105872]}},{"properties":{"latitude":40.3207656,"column_5":1,"date":{"end_time":"2012/09/17 00:00:00 -0400","original":"9/16/2012","granularity":"day","time":"2012/09/16 00:00:00 -0400"},"longitude":-79.4787884,"id":"ag2kyxcjxvd6","location":"Twin Lakes Park"},"type":"Feature","geometry":{"type":"Point","coordinates":[-79.4787884,40.3207656]}},{"properties":{"latitude":40.3056781,"column_5":1,"date":{"end_time":"2012/09/17 00:00:00 -0400","original":"9/16/2012","granularity":"day","time":"2012/09/16 00:00:00 -0400"},"longitude":-79.5096867,"id":"ag2kyx5m1iyk","location":"Greensburg Super 8"},"type":"Feature","geometry":{"type":"Point","coordinates":[-79.5096867,40.3056781]}},{"properties":{"latitude":46.7705085,"column_5":1,"date":{"end_time":"2012/09/26 00:00:00 -0400","original":"9/25/2012","granularity":"day","time":"2012/09/25 00:00:00 -0400"},"longitude":-84.9571252,"id":"ag2kyxbp4lox","location":"Whitefish Point Bird Observatory"},"type":"Feature","geometry":{"type":"Point","coordinates":[-84.9571252,46.7705085]}},{"properties":{"latitude":42.3957628,"column_5":1,"date":{"end_time":"2012/10/14 00:00:00 -0400","original":"10/13/2012","granularity":"day","time":"2012/10/13 00:00:00 -0400"},"longitude":-85.3832531,"id":"ag2kyx9hsdd2","location":"Kellogg Bird Sanctuary"},"type":"Feature","geometry":{"type":"Point","coordinates":[-85.3832531,42.3957628]}},{"properties":{"latitude":29.2947829,"column_5":1,"date":{"end_time":"2012/11/08 00:00:00 -0500","original":"11/7/2012","granularity":"day","time":"2012/11/07 00:00:00 -0500"},"longitude":-98.4948778,"id":"ag2kyxc1j7ue","location":"Mitchell Lake (HOTE 103)"},"type":"Feature","geometry":{"type":"Point","coordinates":[-98.4948778,29.2947829]}},{"properties":{"latitude":29.5185495,"column_5":1,"date":{"end_time":"2012/11/08 00:00:00 -0500","original":"11/7/2012","granularity":"day","time":"2012/11/07 00:00:00 -0500"},"longitude":-98.4809683,"id":"ag2kyxht1lco","location":"LaQuinta - San Antonio Airport"},"type":"Feature","geometry":{"type":"Point","coordinates":[-98.4809683,29.5185495]}},{"properties":{"latitude":26.5340383,"column_5":1,"date":{"end_time":"2012/11/09 00:00:00 -0500","original":"11/8/2012","granularity":"day","time":"2012/11/08 00:00:00 -0500"},"longitude":-99.1565681,"id":"ag2kyxix44t8","location":"Chapeo (LTC 081)"},"type":"Feature","geometry":{"type":"Point","coordinates":[-99.1565681,26.5340383]}},{"properties":{"latitude":26.5148584,"column_5":1,"date":{"end_time":"2012/11/09 00:00:00 -0500","original":"11/8/2012","granularity":"day","time":"2012/11/08 00:00:00 -0500"},"longitude":-99.1162062,"id":"ag2kyxhxbh9h","location":"Salineo (LTC 080)"},"type":"Feature","geometry":{"type":"Point","coordinates":[-99.1162062,26.5148584]}},{"properties":{"latitude":26.514148,"column_5":1,"date":{"end_time":"2012/11/09 00:00:00 -0500","original":"11/8/2012","granularity":"day","time":"2012/11/08 00:00:00 -0500"},"longitude":-99.1175044,"id":"ag2kyxaf154s","location":"La Gloria, Tamps. (across from Salineo, TX)"},"type":"Feature","geometry":{"type":"Point","coordinates":[-99.1175044,26.514148]}},{"properties":{"latitude":26.5651323,"column_5":1,"date":{"end_time":"2012/11/09 00:00:00 -0500","original":"11/8/2012","granularity":"day","time":"2012/11/08 00:00:00 -0500"},"longitude":-99.1261541,"id":"ag2kyx8fopjb","location":"Starr County Park (Falcon Heights)(LTC 082)"},"type":"Feature","geometry":{"type":"Point","coordinates":[-99.1261541,26.5651323]}},{"properties":{"latitude":26.1787023,"column_5":1,"date":{"end_time":"2012/11/10 00:00:00 -0500","original":"11/9/2012","granularity":"day","time":"2012/11/09 00:00:00 -0500"},"longitude":-98.3860016,"id":"ag2kyxa93ccj","location":"Bentsen-Rio Grande Val. SP WBC (Mission) (LTC 069)"},"type":"Feature","geometry":{"type":"Point","coordinates":[-98.3860016,26.1787023]}},{"properties":{"latitude":26.0838442,"column_5":1,"date":{"end_time":"2012/11/10 00:00:00 -0500","original":"11/9/2012","granularity":"day","time":"2012/11/09 00:00:00 -0500"},"longitude":-97.1693945,"id":"ag2kyx699fkz","location":"South Padre Is.--Queen Isabella causeway area"},"type":"Feature","geometry":{"type":"Point","coordinates":[-97.1693945,26.0838442]}},{"properties":{"latitude":25.8519631,"column_5":1,"date":{"end_time":"2012/11/11 00:00:00 -0500","original":"11/10/2012","granularity":"day","time":"2012/11/10 00:00:00 -0500"},"longitude":-97.4211788,"id":"ag2kyx5vujcg","location":"Sabal Palm Sanctuary (LTC 042)"},"type":"Feature","geometry":{"type":"Point","coordinates":[-97.4211788,25.8519631]}},{"properties":{"latitude":25.8512013,"column_5":1,"date":{"end_time":"2012/11/11 00:00:00 -0500","original":"11/10/2012","granularity":"day","time":"2012/11/10 00:00:00 -0500"},"longitude":-97.4129176,"id":"ag2kyx7vk7bs","location":"Cross-river From Sabal Palm"},"type":"Feature","geometry":{"type":"Point","coordinates":[-97.4129176,25.8512013]}},{"properties":{"latitude":25.9774625,"column_5":1,"date":{"end_time":"2012/11/11 00:00:00 -0500","original":"11/10/2012","granularity":"day","time":"2012/11/10 00:00:00 -0500"},"longitude":-97.4239468,"id":"ag2kyx6ow0i9","location":"FM 511"},"type":"Feature","geometry":{"type":"Point","coordinates":[-97.4239468,25.9774625]}},{"properties":{"latitude":26.1996901,"column_5":1,"date":{"end_time":"2012/11/11 00:00:00 -0500","original":"11/10/2012","granularity":"day","time":"2012/11/10 00:00:00 -0500"},"longitude":-97.708261,"id":"ag2kyxeqvto0","location":"Harlingen Convention Center"},"type":"Feature","geometry":{"type":"Point","coordinates":[-97.708261,26.1996901]}},{"properties":{"latitude":26.1400912,"column_5":1,"date":{"end_time":"2012/11/12 00:00:00 -0500","original":"11/11/2012","granularity":"day","time":"2012/11/11 00:00:00 -0500"},"longitude":-97.1748233,"id":"ag2kyxhchv1a","location":"South Padre Is.--WBC/Conv. Center/Laguna Madre Trail (LTC 035)"},"type":"Feature","geometry":{"type":"Point","coordinates":[-97.1748233,26.1400912]}},{"properties":{"latitude":26.2163251,"column_5":1,"date":{"end_time":"2012/11/12 00:00:00 -0500","original":"11/11/2012","granularity":"day","time":"2012/11/11 00:00:00 -0500"},"longitude":-97.3425493,"id":"ag2kyx9hnw38","location":"Laguna Atascosa NWR--Bayside Drive"},"type":"Feature","geometry":{"type":"Point","coordinates":[-97.3425493,26.2163251]}},{"properties":{"latitude":26.2285086,"column_5":1,"date":{"end_time":"2012/11/12 00:00:00 -0500","original":"11/11/2012","granularity":"day","time":"2012/11/11 00:00:00 -0500"},"longitude":-97.3475226,"id":"ag2kyx9ix3yv","location":"Laguna Atascosa NWR--HQ and Kiskadee Trail"},"type":"Feature","geometry":{"type":"Point","coordinates":[-97.3475226,26.2285086]}},{"properties":{"latitude":26.1399994,"column_5":1,"date":{"end_time":"2012/11/12 00:00:00 -0500","original":"11/11/2012","granularity":"day","time":"2012/11/11 00:00:00 -0500"},"longitude":-97.1699982,"id":"ag2kyx9buyt4","location":"South Padre Is.--Andy Bowie County Park"},"type":"Feature","geometry":{"type":"Point","coordinates":[-97.1699982,26.1399994]}},{"properties":{"latitude":26.21506,"column_5":1,"date":{"end_time":"2012/11/12 00:00:00 -0500","original":"11/11/2012","granularity":"day","time":"2012/11/11 00:00:00 -0500"},"longitude":-97.448553,"id":"ag2kyxgmodcw","location":"Cameron Co.- CR106 /General Brant Rd. (W. of Laguna Atascosa)"},"type":"Feature","geometry":{"type":"Point","coordinates":[-97.448553,26.21506]}},{"properties":{"latitude":26.0652008,"column_5":1,"date":{"end_time":"2012/11/12 00:00:00 -0500","original":"11/11/2012","granularity":"day","time":"2012/11/11 00:00:00 -0500"},"longitude":-97.2173004,"id":"ag2kyxckzesj","location":"Port Isabel (LTC 033)"},"type":"Feature","geometry":{"type":"Point","coordinates":[-97.2173004,26.0652008]}},{"properties":{"latitude":44.0932874,"column_5":1,"date":{"end_time":"2012/12/17 00:00:00 -0500","original":"12/16/2012","granularity":"day","time":"2012/12/16 00:00:00 -0500"},"longitude":-86.2777805,"id":"ag2kyxe4bad0","location":"Freeman Rd ponds"},"type":"Feature","geometry":{"type":"Point","coordinates":[-86.2777805,44.0932874]}},{"properties":{"latitude":44.7357596,"column_5":1,"date":{"end_time":"2012/12/18 00:00:00 -0500","original":"12/17/2012","granularity":"day","time":"2012/12/17 00:00:00 -0500"},"longitude":-85.6164551,"id":"ag2kyxbh006h","location":"Boardman Lake--Logans Landing"},"type":"Feature","geometry":{"type":"Point","coordinates":[-85.6164551,44.7357596]}},{"properties":{"latitude":44.7620238,"column_5":1,"date":{"end_time":"2012/12/18 00:00:00 -0500","original":"12/17/2012","granularity":"day","time":"2012/12/17 00:00:00 -0500"},"longitude":-86.0735975,"id":"ag2kyx6kky3f","location":"Esch Road Beach"},"type":"Feature","geometry":{"type":"Point","coordinates":[-86.0735975,44.7620238]}},{"properties":{"latitude":44.7920248,"column_5":1,"date":{"end_time":"2012/12/18 00:00:00 -0500","original":"12/17/2012","granularity":"day","time":"2012/12/17 00:00:00 -0500"},"longitude":-85.8884387,"id":"ag2kyxhc6hpt","location":"M72"},"type":"Feature","geometry":{"type":"Point","coordinates":[-85.8884387,44.7920248]}},{"properties":{"latitude":42.2386218,"column_5":1,"date":{"end_time":"2013/01/12 00:00:00 -0500","original":"1/11/2013","granularity":"day","time":"2013/01/11 00:00:00 -0500"},"longitude":-83.4312057,"id":"ag2kyxhy8401","location":"Grace Lake (Visteon Pond)"},"type":"Feature","geometry":{"type":"Point","coordinates":[-83.4312057,42.2386218]}},{"properties":{"latitude":41.8753449,"column_5":1,"date":{"end_time":"2013/01/18 00:00:00 -0500","original":"1/17/2013","granularity":"day","time":"2013/01/17 00:00:00 -0500"},"longitude":-87.6152372,"id":"ag2kyxis612j","location":"Monroe Harbor (Chicago)"},"type":"Feature","geometry":{"type":"Point","coordinates":[-87.6152372,41.8753449]}},{"properties":{"latitude":41.6677186,"column_5":1,"date":{"end_time":"2013/01/18 00:00:00 -0500","original":"1/17/2013","granularity":"day","time":"2013/01/17 00:00:00 -0500"},"longitude":-87.5246644,"id":"ag2kyxf5suqg","location":"Wolf Lake (Lake Co.)"},"type":"Feature","geometry":{"type":"Point","coordinates":[-87.5246644,41.6677186]}},{"properties":{"latitude":42.4543599,"column_5":1,"date":{"end_time":"2013/02/03 00:00:00 -0500","original":"2/2/2013","granularity":"day","time":"2013/02/02 00:00:00 -0500"},"longitude":-83.7377608,"id":"ag2kyxflk3ea","location":"Tuthill Farms"},"type":"Feature","geometry":{"type":"Point","coordinates":[-83.7377608,42.4543599]}},{"properties":{"latitude":42.4185144,"column_5":1,"date":{"end_time":"2013/02/03 00:00:00 -0500","original":"2/2/2013","granularity":"day","time":"2013/02/02 00:00:00 -0500"},"longitude":-83.9254618,"id":"ag2kyxh3a1ic","location":"Portage Lake (Washtenaw Co.)"},"type":"Feature","geometry":{"type":"Point","coordinates":[-83.9254618,42.4185144]}},{"properties":{"latitude":42.69007,"column_5":1,"date":{"end_time":"2013/02/13 00:00:00 -0500","original":"2/12/2013","granularity":"day","time":"2013/02/12 00:00:00 -0500"},"longitude":-84.48741,"id":"ag2kyx9ebq9i","location":"Lansing, 3623 College Road"},"type":"Feature","geometry":{"type":"Point","coordinates":[-84.48741,42.69007]}},{"properties":{"latitude":46.34529,"column_5":1,"date":{"end_time":"2013/02/17 00:00:00 -0500","original":"2/16/2013","granularity":"day","time":"2013/02/16 00:00:00 -0500"},"longitude":-84.38721,"id":"ag2kyxc5u3vh","location":"Dafter, 11 Mile Road"},"type":"Feature","geometry":{"type":"Point","coordinates":[-84.38721,46.34529]}},{"properties":{"latitude":46.33143,"column_5":1,"date":{"end_time":"2013/02/17 00:00:00 -0500","original":"2/16/2013","granularity":"day","time":"2013/02/16 00:00:00 -0500"},"longitude":-84.28063,"id":"ag2kyxh1owh3","location":"Riverside and 12mile"},"type":"Feature","geometry":{"type":"Point","coordinates":[-84.28063,46.33143]}},{"properties":{"latitude":46.21525,"column_5":1,"date":{"end_time":"2013/02/17 00:00:00 -0500","original":"2/16/2013","granularity":"day","time":"2013/02/16 00:00:00 -0500"},"longitude":-84.57149,"id":"ag2kyxhptdtk","location":"Rudyard, 20000 South Centerline Road"},"type":"Feature","geometry":{"type":"Point","coordinates":[-84.57149,46.21525]}},{"properties":{"latitude":46.38597,"column_5":1,"date":{"end_time":"2013/02/17 00:00:00 -0500","original":"2/16/2013","granularity":"day","time":"2013/02/16 00:00:00 -0500"},"longitude":-84.25983,"id":"ag2kyx8i5cb3","location":"Lower Hay Lake Road"},"type":"Feature","geometry":{"type":"Point","coordinates":[-84.25983,46.38597]}},{"properties":{"latitude":46.3199,"column_5":1,"date":{"end_time":"2013/02/17 00:00:00 -0500","original":"2/16/2013","granularity":"day","time":"2013/02/16 00:00:00 -0500"},"longitude":-84.22638,"id":"ag2kyxeer4e5","location":"Dunbar Forest"},"type":"Feature","geometry":{"type":"Point","coordinates":[-84.22638,46.3199]}},{"properties":{"latitude":46.34682,"column_5":1,"date":{"end_time":"2013/02/17 00:00:00 -0500","original":"2/16/2013","granularity":"day","time":"2013/02/16 00:00:00 -0500"},"longitude":-84.3546,"id":"ag2kyx4plh0f","location":"46.3468 X -84.3546"},"type":"Feature","geometry":{"type":"Point","coordinates":[-84.3546,46.34682]}},{"properties":{"latitude":46.49668,"column_5":1,"date":{"end_time":"2013/02/18 00:00:00 -0500","original":"2/17/2013","granularity":"day","time":"2013/02/17 00:00:00 -0500"},"longitude":-84.32904,"id":"ag2kyxcwdvrl","location":"Edison Sault Power Plant"},"type":"Feature","geometry":{"type":"Point","coordinates":[-84.32904,46.49668]}},{"properties":{"latitude":46.3764548,"column_5":1,"date":{"end_time":"2013/02/18 00:00:00 -0500","original":"2/17/2013","granularity":"day","time":"2013/02/17 00:00:00 -0500"},"longitude":-84.2695999,"id":"ag2kyxiyg89y","location":"Nicolet and 9 mile"},"type":"Feature","geometry":{"type":"Point","coordinates":[-84.2695999,46.3764548]}},{"properties":{"latitude":44.3423,"column_5":1,"date":{"end_time":"2013/02/18 00:00:00 -0500","original":"2/17/2013","granularity":"day","time":"2013/02/17 00:00:00 -0500"},"longitude":-85.40524,"id":"ag2kyxjdr97t","location":"Cedar Creek, U.S. 131"},"type":"Feature","geometry":{"type":"Point","coordinates":[-85.40524,44.3423]}},{"properties":{"latitude":46.29045,"column_5":1,"date":{"end_time":"2013/02/18 00:00:00 -0500","original":"2/17/2013","granularity":"day","time":"2013/02/17 00:00:00 -0500"},"longitude":-84.51067,"id":"ag2kyx9544hr","location":"Kinross Road - Feeders"},"type":"Feature","geometry":{"type":"Point","coordinates":[-84.51067,46.29045]}},{"properties":{"latitude":43.1307749,"column_5":1,"date":{"end_time":"2013/03/11 00:00:00 -0400","original":"3/10/2013","granularity":"day","time":"2013/03/10 00:00:00 -0500"},"longitude":-84.5383358,"id":"ag2kyxanfi3l","location":"Wilson and Baldwin"},"type":"Feature","geometry":{"type":"Point","coordinates":[-84.5383358,43.1307749]}},{"properties":{"latitude":43.1408276,"column_5":1,"date":{"end_time":"2013/03/11 00:00:00 -0400","original":"3/10/2013","granularity":"day","time":"2013/03/10 00:00:00 -0500"},"longitude":-84.5631409,"id":"ag2kyxeusb3w","location":"Maple River SGA (Gratiot Co.)"},"type":"Feature","geometry":{"type":"Point","coordinates":[-84.5631409,43.1408276]}},{"properties":{"latitude":43.1469649,"column_5":1,"date":{"end_time":"2013/03/11 00:00:00 -0400","original":"3/10/2013","granularity":"day","time":"2013/03/10 00:00:00 -0500"},"longitude":-84.4478273,"id":"ag2kyxa81bmy","location":"Ransom and Taft"},"type":"Feature","geometry":{"type":"Point","coordinates":[-84.4478273,43.1469649]}},{"properties":{"latitude":42.5844331,"column_5":1,"date":{"end_time":"2013/03/31 00:00:00 -0400","original":"3/30/2013","granularity":"day","time":"2013/03/30 00:00:00 -0400"},"longitude":-82.5924683,"id":"ag2kyxe846zu","location":"Harsens Island"},"type":"Feature","geometry":{"type":"Point","coordinates":[-82.5924683,42.5844331]}},{"properties":{"latitude":43.15402,"column_5":1,"date":{"end_time":"2013/04/15 00:00:00 -0400","original":"4/14/2013","granularity":"day","time":"2013/04/14 00:00:00 -0400"},"longitude":-84.55074,"id":"ag2kyx9oecwn","location":"Washington, 2630 East Ranger Road"},"type":"Feature","geometry":{"type":"Point","coordinates":[-84.55074,43.15402]}},{"properties":{"latitude":43.82483,"column_5":1,"date":{"end_time":"2013/04/23 00:00:00 -0400","original":"4/22/2013","granularity":"day","time":"2013/04/22 00:00:00 -0400"},"longitude":-83.93517,"id":"ag2kyxcmculh","location":"Pinconning, 2001-2823 Townline 16 Road"},"type":"Feature","geometry":{"type":"Point","coordinates":[-83.93517,43.82483]}},{"properties":{"latitude":43.79782,"column_5":1,"date":{"end_time":"2013/04/23 00:00:00 -0400","original":"4/22/2013","granularity":"day","time":"2013/04/22 00:00:00 -0400"},"longitude":-83.94718,"id":"ag2kyxhs30xn","location":"Fraser, 2006-2258 North Tower Beach Road"},"type":"Feature","geometry":{"type":"Point","coordinates":[-83.94718,43.79782]}},{"properties":{"latitude":42.6913415,"column_5":1,"date":{"end_time":"2013/04/24 00:00:00 -0400","original":"4/23/2013","granularity":"day","time":"2013/04/23 00:00:00 -0400"},"longitude":-84.5301454,"id":"ag2kyxjkjsrr","location":"Hawk Island County Park"},"type":"Feature","geometry":{"type":"Point","coordinates":[-84.5301454,42.6913415]}},{"properties":{"latitude":42.7753544,"column_5":1,"date":{"end_time":"2013/04/29 00:00:00 -0400","original":"4/28/2013","granularity":"day","time":"2013/04/28 00:00:00 -0400"},"longitude":-86.2095236,"id":"ag2kyxa8zr8e","location":"Holland SP"},"type":"Feature","geometry":{"type":"Point","coordinates":[-86.2095236,42.7753544]}},{"properties":{"latitude":42.1151557,"column_5":1,"date":{"end_time":"2013/04/29 00:00:00 -0400","original":"4/28/2013","granularity":"day","time":"2013/04/28 00:00:00 -0400"},"longitude":-86.4894291,"id":"ag2kyx77qd4c","location":"Tiscornia Park"},"type":"Feature","geometry":{"type":"Point","coordinates":[-86.4894291,42.1151557]}},{"properties":{"latitude":41.6794158,"column_5":1,"date":{"end_time":"2013/04/30 00:00:00 -0400","original":"4/29/2013","granularity":"day","time":"2013/04/29 00:00:00 -0400"},"longitude":-86.9804716,"id":"ag2kyxj88mpt","location":"Indiana Dunes National Lakeshore -- Great Marsh Trail"},"type":"Feature","geometry":{"type":"Point","coordinates":[-86.9804716,41.6794158]}},{"properties":{"latitude":41.63667,"column_5":1,"date":{"end_time":"2013/04/30 00:00:00 -0400","original":"4/29/2013","granularity":"day","time":"2013/04/29 00:00:00 -0400"},"longitude":-86.98089,"id":"ag2kyx8fkr7g","location":"Pine, 424-464 East 1400 North"},"type":"Feature","geometry":{"type":"Point","coordinates":[-86.98089,41.63667]}},{"properties":{"latitude":41.61753,"column_5":1,"date":{"end_time":"2013/04/30 00:00:00 -0400","original":"4/29/2013","granularity":"day","time":"2013/04/29 00:00:00 -0400"},"longitude":-87.03651,"id":"ag2kyx89ihm3","location":"Chesterton, 791 Indian Boundary Road"},"type":"Feature","geometry":{"type":"Point","coordinates":[-87.03651,41.61753]}},{"properties":{"latitude":41.6251,"column_5":1,"date":{"end_time":"2013/04/30 00:00:00 -0400","original":"4/29/2013","granularity":"day","time":"2013/04/29 00:00:00 -0400"},"longitude":-86.97384,"id":"ag2kyxfla6ni","location":"Heron Rookery"},"type":"Feature","geometry":{"type":"Point","coordinates":[-86.97384,41.6251]}},{"properties":{"latitude":41.6630486,"column_5":1,"date":{"end_time":"2013/04/30 00:00:00 -0400","original":"4/29/2013","granularity":"day","time":"2013/04/29 00:00:00 -0400"},"longitude":-87.0366169,"id":"ag2kyx475fer","location":"Indiana Dunes SP"},"type":"Feature","geometry":{"type":"Point","coordinates":[-87.0366169,41.6630486]}},{"properties":{"latitude":41.66667,"column_5":1,"date":{"end_time":"2013/04/30 00:00:00 -0400","original":"4/29/2013","granularity":"day","time":"2013/04/29 00:00:00 -0400"},"longitude":-86.8938,"id":"ag2kyx53hzwv","location":"Michigan City, 5830 Franklin Street"},"type":"Feature","geometry":{"type":"Point","coordinates":[-86.8938,41.66667]}},{"properties":{"latitude":42.13801,"column_5":1,"date":{"end_time":"2013/05/02 00:00:00 -0400","original":"5/1/2013","granularity":"day","time":"2013/05/01 00:00:00 -0400"},"longitude":-84.36473,"id":"ag2kyxdwa4xd","location":"Liberty, 8470-8528 South Meridian Road"},"type":"Feature","geometry":{"type":"Point","coordinates":[-84.36473,42.13801]}},{"properties":{"latitude":42.7328159,"column_5":1,"date":{"end_time":"2013/05/03 00:00:00 -0400","original":"5/2/2013","granularity":"day","time":"2013/05/02 00:00:00 -0400"},"longitude":-84.3718049,"id":"ag2kyx3i1zb3","location":"Van Atta Natural Area"},"type":"Feature","geometry":{"type":"Point","coordinates":[-84.3718049,42.7328159]}},{"properties":{"latitude":43.06544,"column_5":1,"date":{"end_time":"2013/05/06 00:00:00 -0400","original":"5/5/2013","granularity":"day","time":"2013/05/05 00:00:00 -0400"},"longitude":-85.41205,"id":"ag2kyx7hqv4r","location":"Saul Lake Bog Nature Preserve"},"type":"Feature","geometry":{"type":"Point","coordinates":[-85.41205,43.06544]}},{"properties":{"latitude":41.5546927,"column_5":1,"date":{"end_time":"2013/05/07 00:00:00 -0400","original":"5/6/2013","granularity":"day","time":"2013/05/06 00:00:00 -0400"},"longitude":-83.8525559,"id":"ag2kyxbk09wd","location":"Oak Openings Preserve Metropark--Gridham Rd. Sand Dunes"},"type":"Feature","geometry":{"type":"Point","coordinates":[-83.8525559,41.5546927]}},{"properties":{"latitude":41.6275048,"column_5":1,"date":{"end_time":"2013/05/08 00:00:00 -0400","original":"5/7/2013","granularity":"day","time":"2013/05/07 00:00:00 -0400"},"longitude":-83.2346331,"id":"ag2kyxgxwagx","location":"Ottawa NWR--Auto Tour (Lucas Co.)"},"type":"Feature","geometry":{"type":"Point","coordinates":[-83.2346331,41.6275048]}},{"properties":{"latitude":41.6500841,"column_5":1,"date":{"end_time":"2013/05/08 00:00:00 -0400","original":"5/7/2013","granularity":"day","time":"2013/05/07 00:00:00 -0400"},"longitude":-83.2525063,"id":"ag2kyxd17lxl","location":"Howard Farms"},"type":"Feature","geometry":{"type":"Point","coordinates":[-83.2525063,41.6500841]}},{"properties":{"latitude":41.616469,"column_5":1,"date":{"end_time":"2013/05/08 00:00:00 -0400","original":"5/7/2013","granularity":"day","time":"2013/05/07 00:00:00 -0400"},"longitude":-83.2698441,"id":"ag2kyx9n096i","location":"Lucas County"},"type":"Feature","geometry":{"type":"Point","coordinates":[-83.2698441,41.616469]}},{"properties":{"latitude":41.6260156,"column_5":1,"date":{"end_time":"2013/05/15 00:00:00 -0400","original":"5/14/2013","granularity":"day","time":"2013/05/14 00:00:00 -0400"},"longitude":-83.1783891,"id":"ag2kyx9nz8hp","location":"Magee Marsh Wildlife Area--Beach East"},"type":"Feature","geometry":{"type":"Point","coordinates":[-83.1783891,41.6260156]}},{"properties":{"latitude":43.5898845,"column_5":1,"date":{"end_time":"2013/05/23 00:00:00 -0400","original":"5/22/2013","granularity":"day","time":"2013/05/22 00:00:00 -0400"},"longitude":-84.2454996,"id":"ag2kyxgdzcd4","location":"Whiting Overlook Park"},"type":"Feature","geometry":{"type":"Point","coordinates":[-84.2454996,43.5898845]}},{"properties":{"latitude":37.8220058,"column_5":1,"date":{"end_time":"2013/06/02 00:00:00 -0400","original":"6/1/2013","granularity":"day","time":"2013/06/01 00:00:00 -0400"},"longitude":-83.6789453,"id":"ag2kyx45ghle","location":"Auxier Ridge"},"type":"Feature","geometry":{"type":"Point","coordinates":[-83.6789453,37.8220058]}},{"properties":{"latitude":37.771618,"column_5":1,"date":{"end_time":"2013/06/02 00:00:00 -0400","original":"6/1/2013","granularity":"day","time":"2013/06/01 00:00:00 -0400"},"longitude":-83.566043,"id":"ag2kyxhwgaq0","location":"Red River Gorge (Wolfe Co.)--Rock Bridge Trail"},"type":"Feature","geometry":{"type":"Point","coordinates":[-83.566043,37.771618]}},{"properties":{"latitude":37.7669095,"column_5":1,"date":{"end_time":"2013/06/03 00:00:00 -0400","original":"6/2/2013","granularity":"day","time":"2013/06/02 00:00:00 -0400"},"longitude":-83.6743032,"id":"ag2kyx53i0bg","location":"Natural Bridge SRP"},"type":"Feature","geometry":{"type":"Point","coordinates":[-83.6743032,37.7669095]}},{"properties":{"latitude":38.00959,"column_5":1,"date":{"end_time":"2013/06/03 00:00:00 -0400","original":"6/2/2013","granularity":"day","time":"2013/06/02 00:00:00 -0400"},"longitude":-84.21525,"id":"ag2kyxbv3ab7","location":"Winchester, Brownland Way"},"type":"Feature","geometry":{"type":"Point","coordinates":[-84.21525,38.00959]}},{"properties":{"latitude":38.882401,"column_5":1,"date":{"end_time":"2013/06/03 00:00:00 -0400","original":"6/2/2013","granularity":"day","time":"2013/06/02 00:00:00 -0400"},"longitude":-84.750402,"id":"ag2kyxh4ge2s","location":"Big Bone Lick SP"},"type":"Feature","geometry":{"type":"Point","coordinates":[-84.750402,38.882401]}},{"properties":{"latitude":40.96923,"column_5":1,"date":{"end_time":"2013/06/03 00:00:00 -0400","original":"6/2/2013","granularity":"day","time":"2013/06/02 00:00:00 -0400"},"longitude":-83.74043,"id":"ag2kyxjfnc1g","location":"Eagle, Interstate 75"},"type":"Feature","geometry":{"type":"Point","coordinates":[-83.74043,40.96923]}},{"properties":{"latitude":42.99006,"column_5":1,"date":{"end_time":"2013/06/23 00:00:00 -0400","original":"6/22/2013","granularity":"day","time":"2013/06/22 00:00:00 -0400"},"longitude":-85.35216,"id":"ag2kyxglz8f1","location":"Vergennes, 1201-1299 Lincoln Lake Avenue Northeast"},"type":"Feature","geometry":{"type":"Point","coordinates":[-85.35216,42.99006]}},{"properties":{"latitude":44.86332,"column_5":1,"date":{"end_time":"2013/07/25 00:00:00 -0400","original":"7/24/2013","granularity":"day","time":"2013/07/24 00:00:00 -0400"},"longitude":-85.51918,"id":"ag2kyxj4thjh","location":"Peninsula, 12001-12283 Center Road"},"type":"Feature","geometry":{"type":"Point","coordinates":[-85.51918,44.86332]}},{"properties":{"latitude":44.78611,"column_5":1,"date":{"end_time":"2013/07/25 00:00:00 -0400","original":"7/24/2013","granularity":"day","time":"2013/07/24 00:00:00 -0400"},"longitude":-85.57421,"id":"ag2kyxhesfnr","location":"Pelizzari Natural Area"},"type":"Feature","geometry":{"type":"Point","coordinates":[-85.57421,44.78611]}}],"is_temporal":true,"author":{"url":"","metadata":null,"contact_name":null,"contact_address":null,"source":null,"contact_phone":null},"source":"","pagination":{"sort":null,"start":0,"total":454,"limit":1000000},"state":"complete","tags":"","published":"2014-08-16T14:27:15-04:00","id":381035}