{"type":"FeatureCollection","data_type":"Dataset","url_type":null,"permissions":[{"permissions":{"download":true,"view":true},"group_id":"everyone"}],"classification":null,"title":"activity report","count":600,"stream_id":90750,"contributor":{"url":"http://geocommons.com/users/21697","name":"campbellmacdonald"},"data_attributes":null,"calculation_params":null,"icon_link":null,"link":"http://geocommons.com/overlays/90750.json","extent":[-123.404,-33.9009,151.668,61.011],"geometry_types":["point"],"unique_name":null,"name":"activity report","feature_count":600,"description":"Early parking mobility data","next_feature":null,"is_raster":false,"short_classification":"Y","stats":{"lattitude":{"max":61.011036,"mean":42.788553105,"variance":133.346916590269,"stdev":11.5475935410919,"min":-33.900913,"median":46.169407},"date":{"max":"2010/04/14 00:00:00 -0400","mean":"2010/01/08 04:46:42 -0500","variance":19449242265371.6,"stdev":4410129.50664395,"min":"2009/09/27 00:00:00 -0400","median":"2010/01/17 00:00:00 -0500"},"longitude":{"max":151.667572,"mean":-71.245408545,"variance":3165.87239112547,"stdev":56.2660856211401,"min":-123.404121,"median":-89.862701}},"features":[{"properties":{"city":null,"lattitude":49.298176,"user-last-name":null,"ime":"19:35:13","state/province":null,"street-address":null,"date":{"end_time":"2009/11/04 00:00:00 -0500","original":"11/03/09","granularity":"day","time":"2009/11/03 00:00:00 -0500"},"country":null,"user-email":"campbell.macdonald@gmail.com","event":"AddLocations","longitude":-123.13192,"id":"a6kgrhpnx17v","user-first-name":null},"type":"Feature","geometry":{"type":"Point","coordinates":[-123.13192,49.298176]}},{"properties":{"city":null,"lattitude":35.099827,"user-last-name":"Samuels","ime":"13:59:30","state/province":null,"street-address":null,"date":{"end_time":"2010/02/08 00:00:00 -0500","original":"02/07/10","granularity":"day","time":"2010/02/07 00:00:00 -0500"},"country":null,"user-email":"samuelszs@aol.com","event":"AddLocations","longitude":-89.844688,"id":"a6kgrhyc3vc3","user-first-name":"Sherrie"},"type":"Feature","geometry":{"type":"Point","coordinates":[-89.844688,35.099827]}},{"properties":{"city":null,"lattitude":49.15876,"user-last-name":"P","ime":"8:22:33","state/province":null,"street-address":null,"date":{"end_time":"2009/11/28 00:00:00 -0500","original":"11/27/09","granularity":"day","time":"2009/11/27 00:00:00 -0500"},"country":null,"user-email":"dia@dccp.ca","event":"AddLocations","longitude":-122.779526,"id":"a6kgrhp3e11i","user-first-name":"Deanna"},"type":"Feature","geometry":{"type":"Point","coordinates":[-122.779526,49.15876]}},{"properties":{"city":null,"lattitude":43.582428,"user-last-name":"Gibaud","ime":"16:04:25","state/province":null,"street-address":null,"date":{"end_time":"2009/12/19 00:00:00 -0500","original":"12/18/09","granularity":"day","time":"2009/12/18 00:00:00 -0500"},"country":null,"user-email":"gibaud.chris@gmail.com","event":"AddLocations","longitude":5.421145,"id":"a6kgrhuaq7z0","user-first-name":"Chris"},"type":"Feature","geometry":{"type":"Point","coordinates":[5.421145,43.582428]}},{"properties":{"city":null,"lattitude":52.584167,"user-last-name":"Moult","ime":"13:47:05","state/province":null,"street-address":null,"date":{"end_time":"2009/11/26 00:00:00 -0500","original":"11/25/09","granularity":"day","time":"2009/11/25 00:00:00 -0500"},"country":null,"user-email":"andrewmoult@yahoo.co.uk","event":"AddLocations","longitude":-1.980543,"id":"a6kgrhnkbtdk","user-first-name":"Andrew"},"type":"Feature","geometry":{"type":"Point","coordinates":[-1.980543,52.584167]}},{"properties":{"city":null,"lattitude":51.481918,"user-last-name":"Rodriguez amad","ime":"2:22:21","state/province":null,"street-address":null,"date":{"end_time":"2009/12/06 00:00:00 -0500","original":"12/05/09","granularity":"day","time":"2009/12/05 00:00:00 -0500"},"country":null,"user-email":"rodriguez78@hotmail.co.uk","event":"AddLocations","longitude":-0.175953,"id":"a6kgrhwuq70x","user-first-name":"Carlos"},"type":"Feature","geometry":{"type":"Point","coordinates":[-0.175953,51.481918]}},{"properties":{"city":null,"lattitude":61.011036,"user-last-name":"Kivelä","ime":"5:32:48","state/province":null,"street-address":null,"date":{"end_time":"2010/03/21 00:00:00 -0400","original":"03/20/10","granularity":"day","time":"2010/03/20 00:00:00 -0400"},"country":null,"user-email":"jari@pixoi.com","event":"AddLocations","longitude":24.413149,"id":"a6kgrhwn00j7","user-first-name":"Jari"},"type":"Feature","geometry":{"type":"Point","coordinates":[24.413149,61.011036]}},{"properties":{"city":null,"lattitude":47.421829,"user-last-name":null,"ime":"15:00:21","state/province":null,"street-address":null,"date":{"end_time":"2010/01/30 00:00:00 -0500","original":"01/29/10","granularity":"day","time":"2010/01/29 00:00:00 -0500"},"country":null,"user-email":"b-brave@gmx.net","event":"AddLocations","longitude":9.37358,"id":"a6kgrhqievx5","user-first-name":null},"type":"Feature","geometry":{"type":"Point","coordinates":[9.37358,47.421829]}},{"properties":{"city":null,"lattitude":30.323494,"user-last-name":"S","ime":"21:30:33","state/province":null,"street-address":null,"date":{"end_time":"2010/02/08 00:00:00 -0500","original":"02/07/10","granularity":"day","time":"2010/02/07 00:00:00 -0500"},"country":null,"user-email":"qqmech@gmail.com","event":"AddLocations","longitude":-97.724274,"id":"a6kgrhknh28m","user-first-name":"Mike"},"type":"Feature","geometry":{"type":"Point","coordinates":[-97.724274,30.323494]}},{"properties":{"city":null,"lattitude":35.110332,"user-last-name":"Samuels","ime":"14:35:26","state/province":null,"street-address":null,"date":{"end_time":"2010/02/08 00:00:00 -0500","original":"02/07/10","granularity":"day","time":"2010/02/07 00:00:00 -0500"},"country":null,"user-email":"samuelszs@aol.com","event":"AddLocations","longitude":-89.894379,"id":"a6kgrhxrcy2s","user-first-name":"Sherrie"},"type":"Feature","geometry":{"type":"Point","coordinates":[-89.894379,35.110332]}},{"properties":{"city":null,"lattitude":35.125919,"user-last-name":"Samuels","ime":"21:54:30","state/province":null,"street-address":null,"date":{"end_time":"2010/02/12 00:00:00 -0500","original":"02/11/10","granularity":"day","time":"2010/02/11 00:00:00 -0500"},"country":null,"user-email":"samuelszs@aol.com","event":"AddLocations","longitude":-89.888008,"id":"a6kgrhw3xhgk","user-first-name":"Sherrie"},"type":"Feature","geometry":{"type":"Point","coordinates":[-89.888008,35.125919]}},{"properties":{"city":null,"lattitude":35.0947,"user-last-name":"Samuels","ime":"16:30:15","state/province":null,"street-address":null,"date":{"end_time":"2010/03/16 00:00:00 -0400","original":"03/15/10","granularity":"day","time":"2010/03/15 00:00:00 -0400"},"country":null,"user-email":"samuelszs@aol.com","event":"AddLocations","longitude":-89.808998,"id":"a6kgrhomj5ry","user-first-name":"Sherrie"},"type":"Feature","geometry":{"type":"Point","coordinates":[-89.808998,35.0947]}},{"properties":{"city":null,"lattitude":38.96748,"user-last-name":"Clayson","ime":"14:48:21","state/province":null,"street-address":null,"date":{"end_time":"2010/01/04 00:00:00 -0500","original":"01/03/10","granularity":"day","time":"2010/01/03 00:00:00 -0500"},"country":null,"user-email":"steve.clayson@mac.com","event":"AddLocations","longitude":-77.358925,"id":"a6kgrhn6r76p","user-first-name":"Steve"},"type":"Feature","geometry":{"type":"Point","coordinates":[-77.358925,38.96748]}},{"properties":{"city":null,"lattitude":49.838966,"user-last-name":"Williams","ime":"23:18:15","state/province":null,"street-address":null,"date":{"end_time":"2010/03/10 00:00:00 -0500","original":"03/09/10","granularity":"day","time":"2010/03/09 00:00:00 -0500"},"country":null,"user-email":"va7mw@shaw.ca","event":"AddLocations","longitude":-119.611977,"id":"a6kgrhyrvdwl","user-first-name":"Merv"},"type":"Feature","geometry":{"type":"Point","coordinates":[-119.611977,49.838966]}},{"properties":{"city":null,"lattitude":35.116302,"user-last-name":"Samuels","ime":"14:42:39","state/province":null,"street-address":null,"date":{"end_time":"2010/02/08 00:00:00 -0500","original":"02/07/10","granularity":"day","time":"2010/02/07 00:00:00 -0500"},"country":null,"user-email":"samuelszs@aol.com","event":"AddLocations","longitude":-89.894936,"id":"a6kgrhq2wev0","user-first-name":"Sherrie"},"type":"Feature","geometry":{"type":"Point","coordinates":[-89.894936,35.116302]}},{"properties":{"city":null,"lattitude":55.772881,"user-last-name":null,"ime":"23:52:12","state/province":null,"street-address":null,"date":{"end_time":"2009/12/05 00:00:00 -0500","original":"12/04/09","granularity":"day","time":"2009/12/04 00:00:00 -0500"},"country":null,"user-email":"i.austin618@btinternet.com","event":"AddLocations","longitude":-4.030931,"id":"a6kgrhkkvddn","user-first-name":null},"type":"Feature","geometry":{"type":"Point","coordinates":[-4.030931,55.772881]}},{"properties":{"city":null,"lattitude":33.870224,"user-last-name":"Leathers","ime":"23:13:22","state/province":null,"street-address":null,"date":{"end_time":"2010/02/18 00:00:00 -0500","original":"02/17/10","granularity":"day","time":"2010/02/17 00:00:00 -0500"},"country":null,"user-email":"drewleathers@gmail.com","event":"AddLocations","longitude":-84.09269,"id":"a6kgrhs4ef34","user-first-name":"Drew"},"type":"Feature","geometry":{"type":"Point","coordinates":[-84.09269,33.870224]}},{"properties":{"city":null,"lattitude":45.46907,"user-last-name":"D","ime":"7:34:32","state/province":null,"street-address":null,"date":{"end_time":"2010/03/03 00:00:00 -0500","original":"03/02/10","granularity":"day","time":"2010/03/02 00:00:00 -0500"},"country":null,"user-email":"kentia000@hotmail.com","event":"AddLocations","longitude":-73.539101,"id":"a6kgrhrbo2u0","user-first-name":"Mel"},"type":"Feature","geometry":{"type":"Point","coordinates":[-73.539101,45.46907]}},{"properties":{"city":null,"lattitude":55.007923,"user-last-name":"Shield","ime":"7:10:13","state/province":null,"street-address":null,"date":{"end_time":"2009/12/29 00:00:00 -0500","original":"12/28/09","granularity":"day","time":"2009/12/28 00:00:00 -0500"},"country":null,"user-email":"sumbodistopme@hotmail.com","event":"AddLocations","longitude":-1.507135,"id":"a6kgrhqqewa3","user-first-name":"Jamie"},"type":"Feature","geometry":{"type":"Point","coordinates":[-1.507135,55.007923]}},{"properties":{"city":null,"lattitude":49.28405,"user-last-name":"Nachbaur","ime":"17:12:15","state/province":null,"street-address":null,"date":{"end_time":"2009/10/23 00:00:00 -0400","original":"10/22/09","granularity":"day","time":"2009/10/22 00:00:00 -0400"},"country":null,"user-email":"mike.nachbaur@nachbaur.com","event":"AddLocations","longitude":-123.115852,"id":"a6kgrho5qdyl","user-first-name":"Mike"},"type":"Feature","geometry":{"type":"Point","coordinates":[-123.115852,49.28405]}},{"properties":{"city":null,"lattitude":38.978729,"user-last-name":"Clayson","ime":"20:42:43","state/province":null,"street-address":null,"date":{"end_time":"2010/01/01 00:00:00 -0500","original":"12/31/09","granularity":"day","time":"2009/12/31 00:00:00 -0500"},"country":null,"user-email":"steve.clayson@mac.com","event":"AddLocations","longitude":-77.350075,"id":"a6kgrhv9tnl0","user-first-name":"Steve"},"type":"Feature","geometry":{"type":"Point","coordinates":[-77.350075,38.978729]}},{"properties":{"city":null,"lattitude":51.347294,"user-last-name":"culliven","ime":"11:56:22","state/province":null,"street-address":null,"date":{"end_time":"2009/11/29 00:00:00 -0500","original":"11/28/09","granularity":"day","time":"2009/11/28 00:00:00 -0500"},"country":null,"user-email":"conrad52@me.com","event":"AddLocations","longitude":-2.979221,"id":"a6kgrhrn45ze","user-first-name":"conrad"},"type":"Feature","geometry":{"type":"Point","coordinates":[-2.979221,51.347294]}},{"properties":{"city":null,"lattitude":33.810707,"user-last-name":"Collman","ime":"18:50:48","state/province":null,"street-address":null,"date":{"end_time":"2010/01/29 00:00:00 -0500","original":"01/28/10","granularity":"day","time":"2010/01/28 00:00:00 -0500"},"country":null,"user-email":"oahu1973@aol.com","event":"AddLocations","longitude":-84.394592,"id":"a6kgri007mjs","user-first-name":"Peter"},"type":"Feature","geometry":{"type":"Point","coordinates":[-84.394592,33.810707]}},{"properties":{"city":null,"lattitude":49.154766,"user-last-name":"P","ime":"8:15:41","state/province":null,"street-address":null,"date":{"end_time":"2009/11/28 00:00:00 -0500","original":"11/27/09","granularity":"day","time":"2009/11/27 00:00:00 -0500"},"country":null,"user-email":"dia@dccp.ca","event":"AddLocations","longitude":-122.78051,"id":"a6kgrht9pdtl","user-first-name":"Deanna"},"type":"Feature","geometry":{"type":"Point","coordinates":[-122.78051,49.154766]}},{"properties":{"city":null,"lattitude":49.299946,"user-last-name":null,"ime":"19:28:24","state/province":null,"street-address":null,"date":{"end_time":"2009/11/04 00:00:00 -0500","original":"11/03/09","granularity":"day","time":"2009/11/03 00:00:00 -0500"},"country":null,"user-email":"campbell.macdonald@gmail.com","event":"AddLocations","longitude":-123.130348,"id":"a6kgrhlhhpph","user-first-name":null},"type":"Feature","geometry":{"type":"Point","coordinates":[-123.130348,49.299946]}},{"properties":{"city":null,"lattitude":35.133289,"user-last-name":"Samuels","ime":"19:50:33","state/province":null,"street-address":null,"date":{"end_time":"2010/02/08 00:00:00 -0500","original":"02/07/10","granularity":"day","time":"2010/02/07 00:00:00 -0500"},"country":null,"user-email":"samuelszs@aol.com","event":"AddLocations","longitude":-89.958221,"id":"a6kgrhkj7p2y","user-first-name":"Sherrie"},"type":"Feature","geometry":{"type":"Point","coordinates":[-89.958221,35.133289]}},{"properties":{"city":null,"lattitude":48.205666,"user-last-name":"Grass","ime":"7:59:24","state/province":null,"street-address":null,"date":{"end_time":"2010/01/23 00:00:00 -0500","original":"01/22/10","granularity":"day","time":"2010/01/22 00:00:00 -0500"},"country":null,"user-email":"friedrich.grass@chello.at","event":"AddLocations","longitude":16.273209,"id":"a6kgrhzfp5kb","user-first-name":"Friedrich"},"type":"Feature","geometry":{"type":"Point","coordinates":[16.273209,48.205666]}},{"properties":{"city":null,"lattitude":49.270401,"user-last-name":"Coyne","ime":"2:38:43","state/province":null,"street-address":null,"date":{"end_time":"2010/02/21 00:00:00 -0500","original":"02/20/10","granularity":"day","time":"2010/02/20 00:00:00 -0500"},"country":null,"user-email":"jocoyne@shaw.ca","event":"AddLocations","longitude":-123.256546,"id":"a6kgrhv5k8tc","user-first-name":"Joan"},"type":"Feature","geometry":{"type":"Point","coordinates":[-123.256546,49.270401]}},{"properties":{"city":null,"lattitude":51.51791,"user-last-name":"Roland-Shrubb","ime":"17:04:39","state/province":null,"street-address":null,"date":{"end_time":"2010/01/22 00:00:00 -0500","original":"01/21/10","granularity":"day","time":"2010/01/21 00:00:00 -0500"},"country":null,"user-email":"david@roland-shrubb.freeserve.co.uk","event":"AddLocations","longitude":-0.098818,"id":"a6kgrhvetk6n","user-first-name":"David"},"type":"Feature","geometry":{"type":"Point","coordinates":[-0.098818,51.51791]}},{"properties":{"city":null,"lattitude":42.018406,"user-last-name":"Megown","ime":"2:22:56","state/province":null,"street-address":null,"date":{"end_time":"2010/01/11 00:00:00 -0500","original":"01/10/10","granularity":"day","time":"2010/01/10 00:00:00 -0500"},"country":null,"user-email":"jeffreymegown@aol.com","event":"AddLocations","longitude":-91.598892,"id":"a6kgrhk8gm34","user-first-name":"Jeffrey"},"type":"Feature","geometry":{"type":"Point","coordinates":[-91.598892,42.018406]}},{"properties":{"city":null,"lattitude":60.997173,"user-last-name":"Kivelä","ime":"5:25:58","state/province":null,"street-address":null,"date":{"end_time":"2010/03/21 00:00:00 -0400","original":"03/20/10","granularity":"day","time":"2010/03/20 00:00:00 -0400"},"country":null,"user-email":"jari@pixoi.com","event":"AddLocations","longitude":24.478491,"id":"a6kgrhlxwrvw","user-first-name":"Jari"},"type":"Feature","geometry":{"type":"Point","coordinates":[24.478491,60.997173]}},{"properties":{"city":null,"lattitude":28.342911,"user-last-name":"Prather","ime":"20:58:53","state/province":null,"street-address":null,"date":{"end_time":"2010/03/13 00:00:00 -0500","original":"03/12/10","granularity":"day","time":"2010/03/12 00:00:00 -0500"},"country":null,"user-email":"parking.iphone3@prather.org","event":"AddLocations","longitude":-81.385147,"id":"a6kgrhw97vp0","user-first-name":"Chris"},"type":"Feature","geometry":{"type":"Point","coordinates":[-81.385147,28.342911]}},{"properties":{"city":null,"lattitude":35.126045,"user-last-name":"Samuels","ime":"3:40:47","state/province":null,"street-address":null,"date":{"end_time":"2010/02/11 00:00:00 -0500","original":"02/10/10","granularity":"day","time":"2010/02/10 00:00:00 -0500"},"country":null,"user-email":"samuelszs@aol.com","event":"AddLocations","longitude":-89.757797,"id":"a6kgrhl3d708","user-first-name":"Sherrie"},"type":"Feature","geometry":{"type":"Point","coordinates":[-89.757797,35.126045]}},{"properties":{"city":null,"lattitude":49.192081,"user-last-name":"Bush","ime":"3:20:31","state/province":null,"street-address":null,"date":{"end_time":"2010/02/10 00:00:00 -0500","original":"02/09/10","granularity":"day","time":"2010/02/09 00:00:00 -0500"},"country":null,"user-email":"gabbys88@telus.net","event":"AddLocations","longitude":-123.1297,"id":"a6kgrhmb4o4z","user-first-name":"Don"},"type":"Feature","geometry":{"type":"Point","coordinates":[-123.1297,49.192081]}},{"properties":{"city":null,"lattitude":35.12962,"user-last-name":"Samuels","ime":"0:13:14","state/province":null,"street-address":null,"date":{"end_time":"2010/02/11 00:00:00 -0500","original":"02/10/10","granularity":"day","time":"2010/02/10 00:00:00 -0500"},"country":null,"user-email":"samuelszs@aol.com","event":"AddLocations","longitude":-89.951309,"id":"a6kgrhl31908","user-first-name":"Sherrie"},"type":"Feature","geometry":{"type":"Point","coordinates":[-89.951309,35.12962]}},{"properties":{"city":null,"lattitude":41.96093,"user-last-name":"Megown","ime":"23:02:42","state/province":null,"street-address":null,"date":{"end_time":"2010/01/16 00:00:00 -0500","original":"01/15/10","granularity":"day","time":"2010/01/15 00:00:00 -0500"},"country":null,"user-email":"jeffreymegown@aol.com","event":"AddLocations","longitude":-91.666557,"id":"a6kgrhunhaz3","user-first-name":"Jeffrey"},"type":"Feature","geometry":{"type":"Point","coordinates":[-91.666557,41.96093]}},{"properties":{"city":null,"lattitude":35.133888,"user-last-name":"Samuels","ime":"17:28:51","state/province":null,"street-address":null,"date":{"end_time":"2010/02/13 00:00:00 -0500","original":"02/12/10","granularity":"day","time":"2010/02/12 00:00:00 -0500"},"country":null,"user-email":"samuelszs@aol.com","event":"AddLocations","longitude":-89.870613,"id":"a6kgrhy8lwnp","user-first-name":"Sherrie"},"type":"Feature","geometry":{"type":"Point","coordinates":[-89.870613,35.133888]}},{"properties":{"city":null,"lattitude":38.978382,"user-last-name":"Clayson","ime":"20:43:01","state/province":null,"street-address":null,"date":{"end_time":"2010/01/01 00:00:00 -0500","original":"12/31/09","granularity":"day","time":"2009/12/31 00:00:00 -0500"},"country":null,"user-email":"steve.clayson@mac.com","event":"AddLocations","longitude":-77.350014,"id":"a6kgrhq6dfhs","user-first-name":"Steve"},"type":"Feature","geometry":{"type":"Point","coordinates":[-77.350014,38.978382]}},{"properties":{"city":null,"lattitude":37.328682,"user-last-name":"Nachbaur","ime":"23:48:38","state/province":null,"street-address":null,"date":{"end_time":"2009/10/21 00:00:00 -0400","original":"10/20/09","granularity":"day","time":"2009/10/20 00:00:00 -0400"},"country":null,"user-email":"mike.nachbaur@decafninja.com","event":"AddLocations","longitude":-122.028099,"id":"a6kgrhxclg07","user-first-name":"Mike"},"type":"Feature","geometry":{"type":"Point","coordinates":[-122.028099,37.328682]}},{"properties":{"city":null,"lattitude":51.230888,"user-last-name":"Howe","ime":"21:05:34","state/province":null,"street-address":null,"date":{"end_time":"2009/12/07 00:00:00 -0500","original":"12/06/09","granularity":"day","time":"2009/12/06 00:00:00 -0500"},"country":null,"user-email":"garyhowe93@hotmail.com","event":"AddLocations","longitude":-0.332145,"id":"a6kgrhz1yysg","user-first-name":"Gary"},"type":"Feature","geometry":{"type":"Point","coordinates":[-0.332145,51.230888]}},{"properties":{"city":null,"lattitude":35.197773,"user-last-name":"Samuels","ime":"14:18:01","state/province":null,"street-address":null,"date":{"end_time":"2010/02/11 00:00:00 -0500","original":"02/10/10","granularity":"day","time":"2010/02/10 00:00:00 -0500"},"country":null,"user-email":"samuelszs@aol.com","event":"AddLocations","longitude":-89.79435,"id":"a6kgrho5c8md","user-first-name":"Sherrie"},"type":"Feature","geometry":{"type":"Point","coordinates":[-89.79435,35.197773]}},{"properties":{"city":null,"lattitude":48.207268,"user-last-name":"Grass","ime":"16:47:00","state/province":null,"street-address":null,"date":{"end_time":"2010/01/19 00:00:00 -0500","original":"01/18/10","granularity":"day","time":"2010/01/18 00:00:00 -0500"},"country":null,"user-email":"friedrich.grass@chello.at","event":"AddLocations","longitude":16.221539,"id":"a6kgrhqwrmbw","user-first-name":"Friedrich"},"type":"Feature","geometry":{"type":"Point","coordinates":[16.221539,48.207268]}},{"properties":{"city":null,"lattitude":35.094582,"user-last-name":"Samuels","ime":"16:30:44","state/province":null,"street-address":null,"date":{"end_time":"2010/03/16 00:00:00 -0400","original":"03/15/10","granularity":"day","time":"2010/03/15 00:00:00 -0400"},"country":null,"user-email":"samuelszs@aol.com","event":"AddLocations","longitude":-89.809387,"id":"a6kgrhzmq1iw","user-first-name":"Sherrie"},"type":"Feature","geometry":{"type":"Point","coordinates":[-89.809387,35.094582]}},{"properties":{"city":null,"lattitude":47.36927,"user-last-name":"Nimal","ime":"12:51:46","state/province":null,"street-address":null,"date":{"end_time":"2009/12/13 00:00:00 -0500","original":"12/12/09","granularity":"day","time":"2009/12/12 00:00:00 -0500"},"country":null,"user-email":"spnimalraj@hotmail.com","event":"AddLocations","longitude":8.500994,"id":"a6kgrhw1u42i","user-first-name":"Soosai"},"type":"Feature","geometry":{"type":"Point","coordinates":[8.500994,47.36927]}},{"properties":{"city":null,"lattitude":49.282589,"user-last-name":null,"ime":"23:04:37","state/province":null,"street-address":null,"date":{"end_time":"2009/10/22 00:00:00 -0400","original":"10/21/09","granularity":"day","time":"2009/10/21 00:00:00 -0400"},"country":null,"user-email":"campbell.macdonald@gmail.com","event":"AddLocations","longitude":-123.081665,"id":"a6kgrhu7sziq","user-first-name":null},"type":"Feature","geometry":{"type":"Point","coordinates":[-123.081665,49.282589]}},{"properties":{"city":null,"lattitude":35.04649,"user-last-name":"Samuels","ime":"3:48:10","state/province":null,"street-address":null,"date":{"end_time":"2010/02/11 00:00:00 -0500","original":"02/10/10","granularity":"day","time":"2010/02/10 00:00:00 -0500"},"country":null,"user-email":"samuelszs@aol.com","event":"AddLocations","longitude":-89.692177,"id":"a6kgrhpyv1gx","user-first-name":"Sherrie"},"type":"Feature","geometry":{"type":"Point","coordinates":[-89.692177,35.04649]}},{"properties":{"city":null,"lattitude":28.343044,"user-last-name":"Prather","ime":"6:40:44","state/province":null,"street-address":null,"date":{"end_time":"2009/12/12 00:00:00 -0500","original":"12/11/09","granularity":"day","time":"2009/12/11 00:00:00 -0500"},"country":null,"user-email":"parking.iphone2@prather.org","event":"AddLocations","longitude":-81.386055,"id":"a6kgrhn1nf43","user-first-name":"Chris"},"type":"Feature","geometry":{"type":"Point","coordinates":[-81.386055,28.343044]}},{"properties":{"city":null,"lattitude":55.170441,"user-last-name":"W","ime":"20:36:18","state/province":null,"street-address":null,"date":{"end_time":"2010/02/12 00:00:00 -0500","original":"02/11/10","granularity":"day","time":"2010/02/11 00:00:00 -0500"},"country":null,"user-email":"sitting_duck_8@hotmail.com","event":"AddLocations","longitude":-118.790421,"id":"a6kgrhqbknnv","user-first-name":"Mark"},"type":"Feature","geometry":{"type":"Point","coordinates":[-118.790421,55.170441]}},{"properties":{"city":null,"lattitude":35.110332,"user-last-name":"Samuels","ime":"14:36:00","state/province":null,"street-address":null,"date":{"end_time":"2010/02/08 00:00:00 -0500","original":"02/07/10","granularity":"day","time":"2010/02/07 00:00:00 -0500"},"country":null,"user-email":"samuelszs@aol.com","event":"AddLocations","longitude":-89.894173,"id":"a6kgrhsj3jwc","user-first-name":"Sherrie"},"type":"Feature","geometry":{"type":"Point","coordinates":[-89.894173,35.110332]}},{"properties":{"city":null,"lattitude":38.959496,"user-last-name":"Clayson","ime":"14:56:02","state/province":null,"street-address":null,"date":{"end_time":"2010/01/04 00:00:00 -0500","original":"01/03/10","granularity":"day","time":"2010/01/03 00:00:00 -0500"},"country":null,"user-email":"steve.clayson@mac.com","event":"AddLocations","longitude":-77.355476,"id":"a6kgrhpkib8e","user-first-name":"Steve"},"type":"Feature","geometry":{"type":"Point","coordinates":[-77.355476,38.959496]}},{"properties":{"city":null,"lattitude":35.100288,"user-last-name":"Samuels","ime":"14:28:52","state/province":null,"street-address":null,"date":{"end_time":"2010/02/08 00:00:00 -0500","original":"02/07/10","granularity":"day","time":"2010/02/07 00:00:00 -0500"},"country":null,"user-email":"samuelszs@aol.com","event":"AddLocations","longitude":-89.847931,"id":"a6kgrhuow4on","user-first-name":"Sherrie"},"type":"Feature","geometry":{"type":"Point","coordinates":[-89.847931,35.100288]}},{"properties":{"city":null,"lattitude":52.029682,"user-last-name":"Mueller","ime":"18:12:39","state/province":null,"street-address":null,"date":{"end_time":"2009/11/26 00:00:00 -0500","original":"11/25/09","granularity":"day","time":"2009/11/25 00:00:00 -0500"},"country":null,"user-email":"muellevo@web.de","event":"AddLocations","longitude":6.820965,"id":"a6kgrhyv6ahl","user-first-name":"Volker"},"type":"Feature","geometry":{"type":"Point","coordinates":[6.820965,52.029682]}},{"properties":{"city":null,"lattitude":49.296867,"user-last-name":null,"ime":"18:53:04","state/province":null,"street-address":null,"date":{"end_time":"2009/11/04 00:00:00 -0500","original":"11/03/09","granularity":"day","time":"2009/11/03 00:00:00 -0500"},"country":null,"user-email":"campbell.macdonald@gmail.com","event":"AddLocations","longitude":-123.127838,"id":"a6kgri0734pi","user-first-name":null},"type":"Feature","geometry":{"type":"Point","coordinates":[-123.127838,49.296867]}},{"properties":{"city":null,"lattitude":42.866199,"user-last-name":"Shertzer","ime":"0:36:28","state/province":null,"street-address":null,"date":{"end_time":"2010/03/24 00:00:00 -0400","original":"03/23/10","granularity":"day","time":"2010/03/23 00:00:00 -0400"},"country":null,"user-email":"daveshertzer@me.com","event":"AddLocations","longitude":-73.78157,"id":"a6kgrhxogszr","user-first-name":"Dave"},"type":"Feature","geometry":{"type":"Point","coordinates":[-73.78157,42.866199]}},{"properties":{"city":null,"lattitude":38.966621,"user-last-name":"Clayson","ime":"14:48:57","state/province":null,"street-address":null,"date":{"end_time":"2010/01/04 00:00:00 -0500","original":"01/03/10","granularity":"day","time":"2010/01/03 00:00:00 -0500"},"country":null,"user-email":"steve.clayson@mac.com","event":"AddLocations","longitude":-77.357697,"id":"a6kgrhvp4dkb","user-first-name":"Steve"},"type":"Feature","geometry":{"type":"Point","coordinates":[-77.357697,38.966621]}},{"properties":{"city":null,"lattitude":38.953819,"user-last-name":"Clayson","ime":"20:00:21","state/province":null,"street-address":null,"date":{"end_time":"2010/01/07 00:00:00 -0500","original":"01/06/10","granularity":"day","time":"2010/01/06 00:00:00 -0500"},"country":null,"user-email":"steve.clayson@mac.com","event":"AddLocations","longitude":-77.447342,"id":"a6kgrhr35q92","user-first-name":"Steve"},"type":"Feature","geometry":{"type":"Point","coordinates":[-77.447342,38.953819]}},{"properties":{"city":null,"lattitude":51.52277,"user-last-name":"O'Brien","ime":"21:10:30","state/province":null,"street-address":null,"date":{"end_time":"2009/12/03 00:00:00 -0500","original":"12/02/09","granularity":"day","time":"2009/12/02 00:00:00 -0500"},"country":null,"user-email":"mickmeee@gmail.com","event":"AddLocations","longitude":-0.459934,"id":"a6kgrhvyvcfk","user-first-name":"Michael"},"type":"Feature","geometry":{"type":"Point","coordinates":[-0.459934,51.52277]}},{"properties":{"city":null,"lattitude":47.465542,"user-last-name":null,"ime":"14:53:55","state/province":null,"street-address":null,"date":{"end_time":"2010/01/30 00:00:00 -0500","original":"01/29/10","granularity":"day","time":"2010/01/29 00:00:00 -0500"},"country":null,"user-email":"b-brave@gmx.net","event":"AddLocations","longitude":9.044634,"id":"a6kgrhr3mif8","user-first-name":null},"type":"Feature","geometry":{"type":"Point","coordinates":[9.044634,47.465542]}},{"properties":{"city":null,"lattitude":51.416904,"user-last-name":"Brazil","ime":"22:23:17","state/province":null,"street-address":null,"date":{"end_time":"2009/12/02 00:00:00 -0500","original":"12/01/09","granularity":"day","time":"2009/12/01 00:00:00 -0500"},"country":null,"user-email":"claire.brazil@sky.com","event":"AddLocations","longitude":-0.748436,"id":"a6kgrhldgdez","user-first-name":"Claire"},"type":"Feature","geometry":{"type":"Point","coordinates":[-0.748436,51.416904]}},{"properties":{"city":null,"lattitude":37.330421,"user-last-name":null,"ime":"23:07:55","state/province":null,"street-address":null,"date":{"end_time":"2010/02/05 00:00:00 -0500","original":"02/04/10","granularity":"day","time":"2010/02/04 00:00:00 -0500"},"country":null,"user-email":"campbell@parkingmobility.com","event":"AddLocations","longitude":-122.03112,"id":"a6kgrhujtih0","user-first-name":null},"type":"Feature","geometry":{"type":"Point","coordinates":[-122.03112,37.330421]}},{"properties":{"city":null,"lattitude":35.101055,"user-last-name":"Samuels","ime":"14:07:30","state/province":null,"street-address":null,"date":{"end_time":"2010/02/08 00:00:00 -0500","original":"02/07/10","granularity":"day","time":"2010/02/07 00:00:00 -0500"},"country":null,"user-email":"samuelszs@aol.com","event":"AddLocations","longitude":-89.844589,"id":"a6kgrhxh0l1g","user-first-name":"Sherrie"},"type":"Feature","geometry":{"type":"Point","coordinates":[-89.844589,35.101055]}},{"properties":{"city":null,"lattitude":47.424088,"user-last-name":null,"ime":"15:01:08","state/province":null,"street-address":null,"date":{"end_time":"2010/01/30 00:00:00 -0500","original":"01/29/10","granularity":"day","time":"2010/01/29 00:00:00 -0500"},"country":null,"user-email":"b-brave@gmx.net","event":"AddLocations","longitude":9.379009,"id":"a6kgrhrhnc0v","user-first-name":null},"type":"Feature","geometry":{"type":"Point","coordinates":[9.379009,47.424088]}},{"properties":{"city":null,"lattitude":44.437092,"user-last-name":"M","ime":"4:57:39","state/province":null,"street-address":null,"date":{"end_time":"2010/02/25 00:00:00 -0500","original":"02/24/10","granularity":"day","time":"2010/02/24 00:00:00 -0500"},"country":null,"user-email":"bill@disabilitiesunlimited.org","event":"AddLocations","longitude":-88.035004,"id":"a6kgrhxt39rk","user-first-name":"Bill"},"type":"Feature","geometry":{"type":"Point","coordinates":[-88.035004,44.437092]}},{"properties":{"city":null,"lattitude":38.978134,"user-last-name":"Clayson","ime":"20:43:22","state/province":null,"street-address":null,"date":{"end_time":"2010/01/01 00:00:00 -0500","original":"12/31/09","granularity":"day","time":"2009/12/31 00:00:00 -0500"},"country":null,"user-email":"steve.clayson@mac.com","event":"AddLocations","longitude":-77.349342,"id":"a6kgrhk8kly3","user-first-name":"Steve"},"type":"Feature","geometry":{"type":"Point","coordinates":[-77.349342,38.978134]}},{"properties":{"city":null,"lattitude":49.285908,"user-last-name":null,"ime":"19:05:45","state/province":null,"street-address":null,"date":{"end_time":"2010/01/29 00:00:00 -0500","original":"01/28/10","granularity":"day","time":"2010/01/28 00:00:00 -0500"},"country":null,"user-email":"ian@coalharbourgroup.com","event":"AddLocations","longitude":-123.13958,"id":"a6kgrhr2bovh","user-first-name":null},"type":"Feature","geometry":{"type":"Point","coordinates":[-123.13958,49.285908]}},{"properties":{"city":null,"lattitude":42.935581,"user-last-name":"Shertzer","ime":"13:14:12","state/province":null,"street-address":null,"date":{"end_time":"2010/03/25 00:00:00 -0400","original":"03/24/10","granularity":"day","time":"2010/03/24 00:00:00 -0400"},"country":null,"user-email":"daveshertzer@me.com","event":"AddLocations","longitude":-73.809052,"id":"a6kgrhuml00p","user-first-name":"Dave"},"type":"Feature","geometry":{"type":"Point","coordinates":[-73.809052,42.935581]}},{"properties":{"city":null,"lattitude":52.238598,"user-last-name":"Redmond","ime":"21:26:49","state/province":null,"street-address":null,"date":{"end_time":"2010/03/08 00:00:00 -0500","original":"03/07/10","granularity":"day","time":"2010/03/07 00:00:00 -0500"},"country":null,"user-email":"david.redmond@ymail.com","event":"AddLocations","longitude":-0.897987,"id":"a6kgrhsx98hd","user-first-name":"David"},"type":"Feature","geometry":{"type":"Point","coordinates":[-0.897987,52.238598]}},{"properties":{"city":null,"lattitude":49.155125,"user-last-name":"P","ime":"8:16:19","state/province":null,"street-address":null,"date":{"end_time":"2009/11/28 00:00:00 -0500","original":"11/27/09","granularity":"day","time":"2009/11/27 00:00:00 -0500"},"country":null,"user-email":"dia@dccp.ca","event":"AddLocations","longitude":-122.780746,"id":"a6kgrhry8mum","user-first-name":"Deanna"},"type":"Feature","geometry":{"type":"Point","coordinates":[-122.780746,49.155125]}},{"properties":{"city":null,"lattitude":48.200157,"user-last-name":"Grass","ime":"10:51:46","state/province":null,"street-address":null,"date":{"end_time":"2010/01/17 00:00:00 -0500","original":"01/16/10","granularity":"day","time":"2010/01/16 00:00:00 -0500"},"country":null,"user-email":"friedrich.grass@chello.at","event":"AddLocations","longitude":16.376881,"id":"a6kgrhkyuf60","user-first-name":"Friedrich"},"type":"Feature","geometry":{"type":"Point","coordinates":[16.376881,48.200157]}},{"properties":{"city":null,"lattitude":42.034981,"user-last-name":"Megown","ime":"15:08:21","state/province":null,"street-address":null,"date":{"end_time":"2010/01/24 00:00:00 -0500","original":"01/23/10","granularity":"day","time":"2010/01/23 00:00:00 -0500"},"country":null,"user-email":"jeffreymegown@aol.com","event":"AddLocations","longitude":-91.639755,"id":"a6kgrhunkhi9","user-first-name":"Jeffrey"},"type":"Feature","geometry":{"type":"Point","coordinates":[-91.639755,42.034981]}},{"properties":{"city":null,"lattitude":51.047398,"user-last-name":"Spradling","ime":"19:04:32","state/province":null,"street-address":null,"date":{"end_time":"2010/01/18 00:00:00 -0500","original":"01/17/10","granularity":"day","time":"2010/01/17 00:00:00 -0500"},"country":null,"user-email":"andrew@parkingmobility.com","event":"AddLocations","longitude":-114.061012,"id":"a6kgrhnfpuh3","user-first-name":"Andrew"},"type":"Feature","geometry":{"type":"Point","coordinates":[-114.061012,51.047398]}},{"properties":{"city":null,"lattitude":51.858784,"user-last-name":"Heneville","ime":"10:04:43","state/province":null,"street-address":null,"date":{"end_time":"2010/04/15 00:00:00 -0400","original":"04/14/10","granularity":"day","time":"2010/04/14 00:00:00 -0400"},"country":null,"user-email":"kit.heneville@googlemail.com","event":"AddLocations","longitude":-3.137487,"id":"a6kgrhtagp6x","user-first-name":"Kit"},"type":"Feature","geometry":{"type":"Point","coordinates":[-3.137487,51.858784]}},{"properties":{"city":null,"lattitude":51.047375,"user-last-name":"Spradling","ime":"19:40:21","state/province":null,"street-address":null,"date":{"end_time":"2010/01/18 00:00:00 -0500","original":"01/17/10","granularity":"day","time":"2010/01/17 00:00:00 -0500"},"country":null,"user-email":"andrew@parkingmobility.com","event":"AddLocations","longitude":-114.078766,"id":"a6kgrhl52lx9","user-first-name":"Andrew"},"type":"Feature","geometry":{"type":"Point","coordinates":[-114.078766,51.047375]}},{"properties":{"city":null,"lattitude":35.157227,"user-last-name":"Samuels","ime":"14:11:15","state/province":null,"street-address":null,"date":{"end_time":"2010/02/11 00:00:00 -0500","original":"02/10/10","granularity":"day","time":"2010/02/10 00:00:00 -0500"},"country":null,"user-email":"samuelszs@aol.com","event":"AddLocations","longitude":-89.885277,"id":"a6kgrhmt3sbj","user-first-name":"Sherrie"},"type":"Feature","geometry":{"type":"Point","coordinates":[-89.885277,35.157227]}},{"properties":{"city":null,"lattitude":49.285942,"user-last-name":"Spradling","ime":"1:35:52","state/province":null,"street-address":null,"date":{"end_time":"2010/01/15 00:00:00 -0500","original":"01/14/10","granularity":"day","time":"2010/01/14 00:00:00 -0500"},"country":null,"user-email":"ryan@parkingmobility.com","event":"AddLocations","longitude":-123.135239,"id":"a6kgrhovq0s4","user-first-name":"Ryan"},"type":"Feature","geometry":{"type":"Point","coordinates":[-123.135239,49.285942]}},{"properties":{"city":null,"lattitude":49.282085,"user-last-name":"Nachbaur","ime":"19:44:00","state/province":null,"street-address":null,"date":{"end_time":"2010/01/21 00:00:00 -0500","original":"01/20/10","granularity":"day","time":"2010/01/20 00:00:00 -0500"},"country":null,"user-email":"michael@nachbaur.com","event":"AddLocations","longitude":-123.132767,"id":"a6kgrhrmnqnt","user-first-name":"Mike"},"type":"Feature","geometry":{"type":"Point","coordinates":[-123.132767,49.282085]}},{"properties":{"city":null,"lattitude":49.102718,"user-last-name":"Fleet","ime":"19:10:41","state/province":null,"street-address":null,"date":{"end_time":"2010/01/31 00:00:00 -0500","original":"01/30/10","granularity":"day","time":"2010/01/30 00:00:00 -0500"},"country":null,"user-email":"fleetexcavating@gmail.com","event":"AddLocations","longitude":-122.652802,"id":"a6kgrhnzemb6","user-first-name":"Kevin"},"type":"Feature","geometry":{"type":"Point","coordinates":[-122.652802,49.102718]}},{"properties":{"city":null,"lattitude":46.169407,"user-last-name":"Syloda","ime":"18:26:13","state/province":null,"street-address":null,"date":{"end_time":"2009/12/15 00:00:00 -0500","original":"12/14/09","granularity":"day","time":"2009/12/14 00:00:00 -0500"},"country":null,"user-email":"syloda@hotmail.com","event":"AddLocations","longitude":6.120627,"id":"a6kgrhu1w3zx","user-first-name":"Syloda"},"type":"Feature","geometry":{"type":"Point","coordinates":[6.120627,46.169407]}},{"properties":{"city":null,"lattitude":38.967239,"user-last-name":"Clayson","ime":"14:49:14","state/province":null,"street-address":null,"date":{"end_time":"2010/01/04 00:00:00 -0500","original":"01/03/10","granularity":"day","time":"2010/01/03 00:00:00 -0500"},"country":null,"user-email":"steve.clayson@mac.com","event":"AddLocations","longitude":-77.357491,"id":"a6kgrhmc6oo1","user-first-name":"Steve"},"type":"Feature","geometry":{"type":"Point","coordinates":[-77.357491,38.967239]}},{"properties":{"city":null,"lattitude":51.486832,"user-last-name":"Rodriguez amad","ime":"4:02:26","state/province":null,"street-address":null,"date":{"end_time":"2009/12/07 00:00:00 -0500","original":"12/06/09","granularity":"day","time":"2009/12/06 00:00:00 -0500"},"country":null,"user-email":"rodriguez78@hotmail.co.uk","event":"AddLocations","longitude":-0.167111,"id":"a6kgrhlu24cy","user-first-name":"Carlos"},"type":"Feature","geometry":{"type":"Point","coordinates":[-0.167111,51.486832]}},{"properties":{"city":null,"lattitude":29.612047,"user-last-name":"Couch","ime":"16:03:48","state/province":null,"street-address":null,"date":{"end_time":"2010/03/27 00:00:00 -0400","original":"03/26/10","granularity":"day","time":"2010/03/26 00:00:00 -0400"},"country":null,"user-email":"tcouch61@yahoo.com","event":"AddLocations","longitude":-90.757904,"id":"a6kgrhktpc8z","user-first-name":"Tory"},"type":"Feature","geometry":{"type":"Point","coordinates":[-90.757904,29.612047]}},{"properties":{"city":null,"lattitude":35.099861,"user-last-name":"Samuels","ime":"14:00:36","state/province":null,"street-address":null,"date":{"end_time":"2010/02/08 00:00:00 -0500","original":"02/07/10","granularity":"day","time":"2010/02/07 00:00:00 -0500"},"country":null,"user-email":"samuelszs@aol.com","event":"AddLocations","longitude":-89.844704,"id":"a6kgrhy1wk0u","user-first-name":"Sherrie"},"type":"Feature","geometry":{"type":"Point","coordinates":[-89.844704,35.099861]}},{"properties":{"city":null,"lattitude":49.828041,"user-last-name":"Williams","ime":"22:33:49","state/province":null,"street-address":null,"date":{"end_time":"2010/03/06 00:00:00 -0500","original":"03/05/10","granularity":"day","time":"2010/03/05 00:00:00 -0500"},"country":null,"user-email":"va7mw@shaw.ca","event":"AddLocations","longitude":-119.629654,"id":"a6kgrhpdjd6s","user-first-name":"Merv"},"type":"Feature","geometry":{"type":"Point","coordinates":[-119.629654,49.828041]}},{"properties":{"city":null,"lattitude":35.146263,"user-last-name":"Samuels","ime":"0:21:01","state/province":null,"street-address":null,"date":{"end_time":"2010/02/11 00:00:00 -0500","original":"02/10/10","granularity":"day","time":"2010/02/10 00:00:00 -0500"},"country":null,"user-email":"samuelszs@aol.com","event":"AddLocations","longitude":-89.994263,"id":"a6kgrhywe6ob","user-first-name":"Sherrie"},"type":"Feature","geometry":{"type":"Point","coordinates":[-89.994263,35.146263]}},{"properties":{"city":null,"lattitude":35.197536,"user-last-name":"Samuels","ime":"14:18:33","state/province":null,"street-address":null,"date":{"end_time":"2010/02/11 00:00:00 -0500","original":"02/10/10","granularity":"day","time":"2010/02/10 00:00:00 -0500"},"country":null,"user-email":"samuelszs@aol.com","event":"AddLocations","longitude":-89.794891,"id":"a6kgrhzt4yap","user-first-name":"Sherrie"},"type":"Feature","geometry":{"type":"Point","coordinates":[-89.794891,35.197536]}},{"properties":{"city":null,"lattitude":48.871105,"user-last-name":"Prodel","ime":"6:50:38","state/province":null,"street-address":null,"date":{"end_time":"2009/11/28 00:00:00 -0500","original":"11/27/09","granularity":"day","time":"2009/11/27 00:00:00 -0500"},"country":null,"user-email":"jy.prodel@jyp-design.com","event":"AddLocations","longitude":2.332206,"id":"a6kgrhznmgbm","user-first-name":"Jean Yves"},"type":"Feature","geometry":{"type":"Point","coordinates":[2.332206,48.871105]}},{"properties":{"city":null,"lattitude":50.9683,"user-last-name":"Kinloch","ime":"20:19:14","state/province":null,"street-address":null,"date":{"end_time":"2010/04/04 00:00:00 -0400","original":"04/03/10","granularity":"day","time":"2010/04/03 00:00:00 -0400"},"country":null,"user-email":"liz_kinloch@btinternet.com","event":"AddLocations","longitude":-1.352016,"id":"a6kgrhmfz53v","user-first-name":"Liz"},"type":"Feature","geometry":{"type":"Point","coordinates":[-1.352016,50.9683]}},{"properties":{"city":null,"lattitude":49.289661,"user-last-name":null,"ime":"20:55:12","state/province":null,"street-address":null,"date":{"end_time":"2009/11/04 00:00:00 -0500","original":"11/03/09","granularity":"day","time":"2009/11/03 00:00:00 -0500"},"country":null,"user-email":"campbell.macdonald@gmail.com","event":"AddLocations","longitude":-123.137978,"id":"a6kgrhoj15u0","user-first-name":null},"type":"Feature","geometry":{"type":"Point","coordinates":[-123.137978,49.289661]}},{"properties":{"city":null,"lattitude":45.468246,"user-last-name":"D","ime":"7:35:31","state/province":null,"street-address":null,"date":{"end_time":"2010/03/03 00:00:00 -0500","original":"03/02/10","granularity":"day","time":"2010/03/02 00:00:00 -0500"},"country":null,"user-email":"kentia000@hotmail.com","event":"AddLocations","longitude":-73.5429,"id":"a6kgrhpkiv0j","user-first-name":"Mel"},"type":"Feature","geometry":{"type":"Point","coordinates":[-73.5429,45.468246]}},{"properties":{"city":null,"lattitude":38.9786,"user-last-name":"Clayson","ime":"20:43:41","state/province":null,"street-address":null,"date":{"end_time":"2010/01/01 00:00:00 -0500","original":"12/31/09","granularity":"day","time":"2009/12/31 00:00:00 -0500"},"country":null,"user-email":"steve.clayson@mac.com","event":"AddLocations","longitude":-77.348984,"id":"a6kgrhpnsanz","user-first-name":"Steve"},"type":"Feature","geometry":{"type":"Point","coordinates":[-77.348984,38.9786]}},{"properties":{"city":null,"lattitude":50.41803,"user-last-name":"Steinier","ime":"9:04:49","state/province":null,"street-address":null,"date":{"end_time":"2010/02/04 00:00:00 -0500","original":"02/03/10","granularity":"day","time":"2010/02/03 00:00:00 -0500"},"country":null,"user-email":"philippe@handimobility.org","event":"AddLocations","longitude":4.457632,"id":"a6kgrhzn6p2o","user-first-name":"Philippe"},"type":"Feature","geometry":{"type":"Point","coordinates":[4.457632,50.41803]}},{"properties":{"city":null,"lattitude":39.010311,"user-last-name":"Clayson","ime":"19:53:38","state/province":null,"street-address":null,"date":{"end_time":"2010/01/07 00:00:00 -0500","original":"01/06/10","granularity":"day","time":"2010/01/06 00:00:00 -0500"},"country":null,"user-email":"steve.clayson@mac.com","event":"AddLocations","longitude":-77.43586,"id":"a6kgrhkbvpl0","user-first-name":"Steve"},"type":"Feature","geometry":{"type":"Point","coordinates":[-77.43586,39.010311]}},{"properties":{"city":null,"lattitude":35.140297,"user-last-name":"Samuels","ime":"0:35:28","state/province":null,"street-address":null,"date":{"end_time":"2010/02/11 00:00:00 -0500","original":"02/10/10","granularity":"day","time":"2010/02/10 00:00:00 -0500"},"country":null,"user-email":"samuelszs@aol.com","event":"AddLocations","longitude":-89.797295,"id":"a6kgrhzlx1ys","user-first-name":"Sherrie"},"type":"Feature","geometry":{"type":"Point","coordinates":[-89.797295,35.140297]}},{"properties":{"city":null,"lattitude":51.03735,"user-last-name":"Spradling","ime":"0:42:34","state/province":null,"street-address":null,"date":{"end_time":"2010/01/30 00:00:00 -0500","original":"01/29/10","granularity":"day","time":"2010/01/29 00:00:00 -0500"},"country":null,"user-email":"andrew@parkingmobility.com","event":"AddLocations","longitude":-114.168938,"id":"a6kgrhm5blnm","user-first-name":"Andrew"},"type":"Feature","geometry":{"type":"Point","coordinates":[-114.168938,51.03735]}},{"properties":{"city":null,"lattitude":35.13855,"user-last-name":"Samuels","ime":"0:28:20","state/province":null,"street-address":null,"date":{"end_time":"2010/02/11 00:00:00 -0500","original":"02/10/10","granularity":"day","time":"2010/02/10 00:00:00 -0500"},"country":null,"user-email":"samuelszs@aol.com","event":"AddLocations","longitude":-89.797737,"id":"a6kgrhsxbggn","user-first-name":"Sherrie"},"type":"Feature","geometry":{"type":"Point","coordinates":[-89.797737,35.13855]}},{"properties":{"city":null,"lattitude":48.218563,"user-last-name":"Grass","ime":"15:31:19","state/province":null,"street-address":null,"date":{"end_time":"2010/01/17 00:00:00 -0500","original":"01/16/10","granularity":"day","time":"2010/01/16 00:00:00 -0500"},"country":null,"user-email":"friedrich.grass@chello.at","event":"AddLocations","longitude":16.34404,"id":"a6kgrhykntj9","user-first-name":"Friedrich"},"type":"Feature","geometry":{"type":"Point","coordinates":[16.34404,48.218563]}},{"properties":{"city":null,"lattitude":42.683586,"user-last-name":"Shertzer","ime":"19:57:37","state/province":null,"street-address":null,"date":{"end_time":"2010/02/21 00:00:00 -0500","original":"02/20/10","granularity":"day","time":"2010/02/20 00:00:00 -0500"},"country":null,"user-email":"daveshertzer@me.com","event":"AddLocations","longitude":-73.770828,"id":"a6kgrhxo2clv","user-first-name":"Dave"},"type":"Feature","geometry":{"type":"Point","coordinates":[-73.770828,42.683586]}},{"properties":{"city":null,"lattitude":35.110321,"user-last-name":"Samuels","ime":"14:36:37","state/province":null,"street-address":null,"date":{"end_time":"2010/02/08 00:00:00 -0500","original":"02/07/10","granularity":"day","time":"2010/02/07 00:00:00 -0500"},"country":null,"user-email":"samuelszs@aol.com","event":"AddLocations","longitude":-89.894028,"id":"a6kgrht4s9ds","user-first-name":"Sherrie"},"type":"Feature","geometry":{"type":"Point","coordinates":[-89.894028,35.110321]}},{"properties":{"city":null,"lattitude":30.318344,"user-last-name":"S","ime":"21:38:59","state/province":null,"street-address":null,"date":{"end_time":"2010/02/08 00:00:00 -0500","original":"02/07/10","granularity":"day","time":"2010/02/07 00:00:00 -0500"},"country":null,"user-email":"qqmech@gmail.com","event":"AddLocations","longitude":-97.723976,"id":"a6kgrhwhhc66","user-first-name":"Mike"},"type":"Feature","geometry":{"type":"Point","coordinates":[-97.723976,30.318344]}},{"properties":{"city":null,"lattitude":42.03511,"user-last-name":"Megown","ime":"15:08:46","state/province":null,"street-address":null,"date":{"end_time":"2010/01/24 00:00:00 -0500","original":"01/23/10","granularity":"day","time":"2010/01/23 00:00:00 -0500"},"country":null,"user-email":"jeffreymegown@aol.com","event":"AddLocations","longitude":-91.640129,"id":"a6kgrhtiulrz","user-first-name":"Jeffrey"},"type":"Feature","geometry":{"type":"Point","coordinates":[-91.640129,42.03511]}},{"properties":{"city":null,"lattitude":52.233379,"user-last-name":"Redmond","ime":"10:15:50","state/province":null,"street-address":null,"date":{"end_time":"2010/04/12 00:00:00 -0400","original":"04/11/10","granularity":"day","time":"2010/04/11 00:00:00 -0400"},"country":null,"user-email":"david.redmond@ymail.com","event":"AddLocations","longitude":-0.895101,"id":"a6kgrhvqani4","user-first-name":"David"},"type":"Feature","geometry":{"type":"Point","coordinates":[-0.895101,52.233379]}},{"properties":{"city":null,"lattitude":35.133335,"user-last-name":"Samuels","ime":"19:44:29","state/province":null,"street-address":null,"date":{"end_time":"2010/02/08 00:00:00 -0500","original":"02/07/10","granularity":"day","time":"2010/02/07 00:00:00 -0500"},"country":null,"user-email":"samuelszs@aol.com","event":"AddLocations","longitude":-89.959908,"id":"a6kgrhxeqhx9","user-first-name":"Sherrie"},"type":"Feature","geometry":{"type":"Point","coordinates":[-89.959908,35.133335]}},{"properties":{"city":null,"lattitude":35.157238,"user-last-name":"Samuels","ime":"14:11:39","state/province":null,"street-address":null,"date":{"end_time":"2010/02/11 00:00:00 -0500","original":"02/10/10","granularity":"day","time":"2010/02/10 00:00:00 -0500"},"country":null,"user-email":"samuelszs@aol.com","event":"AddLocations","longitude":-89.885475,"id":"a6kgrhnw659a","user-first-name":"Sherrie"},"type":"Feature","geometry":{"type":"Point","coordinates":[-89.885475,35.157238]}},{"properties":{"city":null,"lattitude":38.96703,"user-last-name":"Clayson","ime":"14:49:33","state/province":null,"street-address":null,"date":{"end_time":"2010/01/04 00:00:00 -0500","original":"01/03/10","granularity":"day","time":"2010/01/03 00:00:00 -0500"},"country":null,"user-email":"steve.clayson@mac.com","event":"AddLocations","longitude":-77.356331,"id":"a6kgrhzzo869","user-first-name":"Steve"},"type":"Feature","geometry":{"type":"Point","coordinates":[-77.356331,38.96703]}},{"properties":{"city":null,"lattitude":54.976643,"user-last-name":"Shield","ime":"7:18:34","state/province":null,"street-address":null,"date":{"end_time":"2009/12/29 00:00:00 -0500","original":"12/28/09","granularity":"day","time":"2009/12/28 00:00:00 -0500"},"country":null,"user-email":"sumbodistopme@hotmail.com","event":"AddLocations","longitude":-1.612394,"id":"a6kgrhz9geej","user-first-name":"Jamie"},"type":"Feature","geometry":{"type":"Point","coordinates":[-1.612394,54.976643]}},{"properties":{"city":null,"lattitude":51.513092,"user-last-name":"Raphael","ime":"18:41:24","state/province":null,"street-address":null,"date":{"end_time":"2010/02/25 00:00:00 -0500","original":"02/24/10","granularity":"day","time":"2010/02/24 00:00:00 -0500"},"country":null,"user-email":"richard@391676.com","event":"AddLocations","longitude":-0.121636,"id":"a6kgrhk1g1ze","user-first-name":"Richard"},"type":"Feature","geometry":{"type":"Point","coordinates":[-0.121636,51.513092]}},{"properties":{"city":null,"lattitude":37.333004,"user-last-name":null,"ime":"4:13:06","state/province":null,"street-address":null,"date":{"end_time":"2009/10/11 00:00:00 -0400","original":"10/10/09","granularity":"day","time":"2009/10/10 00:00:00 -0400"},"country":null,"user-email":"system+unknown-user@parkingmobility.com","event":"AddLocations","longitude":-122.034073,"id":"a6kgrhry33e1","user-first-name":null},"type":"Feature","geometry":{"type":"Point","coordinates":[-122.034073,37.333004]}},{"properties":{"city":null,"lattitude":41.309841,"user-last-name":"Megown","ime":"21:43:38","state/province":null,"street-address":null,"date":{"end_time":"2010/01/11 00:00:00 -0500","original":"01/10/10","granularity":"day","time":"2010/01/10 00:00:00 -0500"},"country":null,"user-email":"jeffreymegown@aol.com","event":"AddLocations","longitude":-92.648331,"id":"a6kgrhtvghdo","user-first-name":"Jeffrey"},"type":"Feature","geometry":{"type":"Point","coordinates":[-92.648331,41.309841]}},{"properties":{"city":null,"lattitude":51.462444,"user-last-name":"Gerreyn","ime":"11:39:57","state/province":null,"street-address":null,"date":{"end_time":"2010/01/07 00:00:00 -0500","original":"01/06/10","granularity":"day","time":"2010/01/06 00:00:00 -0500"},"country":null,"user-email":"ann63gerreyn@googlemail.com","event":"AddLocations","longitude":-0.012789,"id":"a6kgrhtz3tzb","user-first-name":"Ann-Marie"},"type":"Feature","geometry":{"type":"Point","coordinates":[-0.012789,51.462444]}},{"properties":{"city":null,"lattitude":43.581123,"user-last-name":"Gibaud","ime":"3:03:14","state/province":null,"street-address":null,"date":{"end_time":"2009/12/21 00:00:00 -0500","original":"12/20/09","granularity":"day","time":"2009/12/20 00:00:00 -0500"},"country":null,"user-email":"gibaud.chris@gmail.com","event":"AddLocations","longitude":5.423165,"id":"a6kgrhpp8fvx","user-first-name":"Chris"},"type":"Feature","geometry":{"type":"Point","coordinates":[5.423165,43.581123]}},{"properties":{"city":null,"lattitude":47.423481,"user-last-name":null,"ime":"15:01:45","state/province":null,"street-address":null,"date":{"end_time":"2010/01/30 00:00:00 -0500","original":"01/29/10","granularity":"day","time":"2010/01/29 00:00:00 -0500"},"country":null,"user-email":"b-brave@gmx.net","event":"AddLocations","longitude":9.376045,"id":"a6kgrhqo769q","user-first-name":null},"type":"Feature","geometry":{"type":"Point","coordinates":[9.376045,47.423481]}},{"properties":{"city":null,"lattitude":50.369198,"user-last-name":"Steinier","ime":"21:07:55","state/province":null,"street-address":null,"date":{"end_time":"2010/01/17 00:00:00 -0500","original":"01/16/10","granularity":"day","time":"2010/01/16 00:00:00 -0500"},"country":null,"user-email":"philippe@handimobility.org","event":"AddLocations","longitude":4.396433,"id":"a6kgrhzi62bv","user-first-name":"Philippe"},"type":"Feature","geometry":{"type":"Point","coordinates":[4.396433,50.369198]}},{"properties":{"city":null,"lattitude":51.540527,"user-last-name":"Raphael","ime":"22:10:57","state/province":null,"street-address":null,"date":{"end_time":"2009/12/19 00:00:00 -0500","original":"12/18/09","granularity":"day","time":"2009/12/18 00:00:00 -0500"},"country":null,"user-email":"richard@391676.com","event":"AddLocations","longitude":0.714114,"id":"a6kgrhl0dtwj","user-first-name":"Richard"},"type":"Feature","geometry":{"type":"Point","coordinates":[0.714114,51.540527]}},{"properties":{"city":null,"lattitude":50.369442,"user-last-name":"Steinier","ime":"8:57:56","state/province":null,"street-address":null,"date":{"end_time":"2010/02/04 00:00:00 -0500","original":"02/03/10","granularity":"day","time":"2010/02/03 00:00:00 -0500"},"country":null,"user-email":"philippe@handimobility.org","event":"AddLocations","longitude":4.395689,"id":"a6kgrhtpbks1","user-first-name":"Philippe"},"type":"Feature","geometry":{"type":"Point","coordinates":[4.395689,50.369442]}},{"properties":{"city":null,"lattitude":48.203991,"user-last-name":"Grass","ime":"20:16:40","state/province":null,"street-address":null,"date":{"end_time":"2010/01/18 00:00:00 -0500","original":"01/17/10","granularity":"day","time":"2010/01/17 00:00:00 -0500"},"country":null,"user-email":"friedrich.grass@chello.at","event":"AddLocations","longitude":16.369038,"id":"a6kgrhv3bfsv","user-first-name":"Friedrich"},"type":"Feature","geometry":{"type":"Point","coordinates":[16.369038,48.203991]}},{"properties":{"city":null,"lattitude":49.828041,"user-last-name":"Williams","ime":"22:19:54","state/province":null,"street-address":null,"date":{"end_time":"2010/03/06 00:00:00 -0500","original":"03/05/10","granularity":"day","time":"2010/03/05 00:00:00 -0500"},"country":null,"user-email":"va7mw@shaw.ca","event":"AddLocations","longitude":-119.629654,"id":"a6kgrhw2igdk","user-first-name":"Merv"},"type":"Feature","geometry":{"type":"Point","coordinates":[-119.629654,49.828041]}},{"properties":{"city":null,"lattitude":42.027157,"user-last-name":"Megown","ime":"18:47:13","state/province":null,"street-address":null,"date":{"end_time":"2010/01/15 00:00:00 -0500","original":"01/14/10","granularity":"day","time":"2010/01/14 00:00:00 -0500"},"country":null,"user-email":"jeffreymegown@aol.com","event":"AddLocations","longitude":-91.640831,"id":"a6kgrhwpirwf","user-first-name":"Jeffrey"},"type":"Feature","geometry":{"type":"Point","coordinates":[-91.640831,42.027157]}},{"properties":{"city":null,"lattitude":45.468391,"user-last-name":"D","ime":"7:35:53","state/province":null,"street-address":null,"date":{"end_time":"2010/03/03 00:00:00 -0500","original":"03/02/10","granularity":"day","time":"2010/03/02 00:00:00 -0500"},"country":null,"user-email":"kentia000@hotmail.com","event":"AddLocations","longitude":-73.542892,"id":"a6kgrhq4iadb","user-first-name":"Mel"},"type":"Feature","geometry":{"type":"Point","coordinates":[-73.542892,45.468391]}},{"properties":{"city":null,"lattitude":38.967392,"user-last-name":"Clayson","ime":"14:49:48","state/province":null,"street-address":null,"date":{"end_time":"2010/01/04 00:00:00 -0500","original":"01/03/10","granularity":"day","time":"2010/01/03 00:00:00 -0500"},"country":null,"user-email":"steve.clayson@mac.com","event":"AddLocations","longitude":-77.356308,"id":"a6kgrhp896s8","user-first-name":"Steve"},"type":"Feature","geometry":{"type":"Point","coordinates":[-77.356308,38.967392]}},{"properties":{"city":null,"lattitude":52.768005,"user-last-name":"Roland-Shrubb","ime":"0:53:36","state/province":null,"street-address":null,"date":{"end_time":"2010/01/21 00:00:00 -0500","original":"01/20/10","granularity":"day","time":"2010/01/20 00:00:00 -0500"},"country":null,"user-email":"david@roland-shrubb.freeserve.co.uk","event":"AddLocations","longitude":-0.888997,"id":"a6kgri0alx33","user-first-name":"David"},"type":"Feature","geometry":{"type":"Point","coordinates":[-0.888997,52.768005]}},{"properties":{"city":null,"lattitude":35.11301,"user-last-name":"Samuels","ime":"19:32:55","state/province":null,"street-address":null,"date":{"end_time":"2010/02/18 00:00:00 -0500","original":"02/17/10","granularity":"day","time":"2010/02/17 00:00:00 -0500"},"country":null,"user-email":"samuelszs@aol.com","event":"AddLocations","longitude":-89.894455,"id":"a6kgrhlhotjq","user-first-name":"Sherrie"},"type":"Feature","geometry":{"type":"Point","coordinates":[-89.894455,35.11301]}},{"properties":{"city":null,"lattitude":35.110329,"user-last-name":"Samuels","ime":"14:37:00","state/province":null,"street-address":null,"date":{"end_time":"2010/02/08 00:00:00 -0500","original":"02/07/10","granularity":"day","time":"2010/02/07 00:00:00 -0500"},"country":null,"user-email":"samuelszs@aol.com","event":"AddLocations","longitude":-89.893967,"id":"a6kgrhu2h4zk","user-first-name":"Sherrie"},"type":"Feature","geometry":{"type":"Point","coordinates":[-89.893967,35.110329]}},{"properties":{"city":null,"lattitude":49.157024,"user-last-name":"P","ime":"8:17:06","state/province":null,"street-address":null,"date":{"end_time":"2009/11/28 00:00:00 -0500","original":"11/27/09","granularity":"day","time":"2009/11/27 00:00:00 -0500"},"country":null,"user-email":"dia@dccp.ca","event":"AddLocations","longitude":-122.780922,"id":"a6kgrht28ale","user-first-name":"Deanna"},"type":"Feature","geometry":{"type":"Point","coordinates":[-122.780922,49.157024]}},{"properties":{"city":null,"lattitude":35.128628,"user-last-name":"Samuels","ime":"18:19:03","state/province":null,"street-address":null,"date":{"end_time":"2010/02/26 00:00:00 -0500","original":"02/25/10","granularity":"day","time":"2010/02/25 00:00:00 -0500"},"country":null,"user-email":"samuelszs@aol.com","event":"AddLocations","longitude":-89.946732,"id":"a6kgrhn88x7y","user-first-name":"Sherrie"},"type":"Feature","geometry":{"type":"Point","coordinates":[-89.946732,35.128628]}},{"properties":{"city":null,"lattitude":51.047134,"user-last-name":"Spradling","ime":"19:12:30","state/province":null,"street-address":null,"date":{"end_time":"2010/01/18 00:00:00 -0500","original":"01/17/10","granularity":"day","time":"2010/01/17 00:00:00 -0500"},"country":null,"user-email":"andrew@parkingmobility.com","event":"AddLocations","longitude":-114.071465,"id":"a6kgrhpbk20u","user-first-name":"Andrew"},"type":"Feature","geometry":{"type":"Point","coordinates":[-114.071465,51.047134]}},{"properties":{"city":null,"lattitude":49.245033,"user-last-name":"Spradling","ime":"19:43:46","state/province":null,"street-address":null,"date":{"end_time":"2010/02/21 00:00:00 -0500","original":"02/20/10","granularity":"day","time":"2010/02/20 00:00:00 -0500"},"country":null,"user-email":"andrew@parkingmobility.com","event":"AddLocations","longitude":-123.126518,"id":"a6kgrhqvy64n","user-first-name":"Andrew"},"type":"Feature","geometry":{"type":"Point","coordinates":[-123.126518,49.245033]}},{"properties":{"city":null,"lattitude":35.197239,"user-last-name":"Samuels","ime":"14:19:11","state/province":null,"street-address":null,"date":{"end_time":"2010/02/11 00:00:00 -0500","original":"02/10/10","granularity":"day","time":"2010/02/10 00:00:00 -0500"},"country":null,"user-email":"samuelszs@aol.com","event":"AddLocations","longitude":-89.79538,"id":"a6kgrhnpfkp3","user-first-name":"Sherrie"},"type":"Feature","geometry":{"type":"Point","coordinates":[-89.79538,35.197239]}},{"properties":{"city":null,"lattitude":35.13546,"user-last-name":"Samuels","ime":"14:04:53","state/province":null,"street-address":null,"date":{"end_time":"2010/02/11 00:00:00 -0500","original":"02/10/10","granularity":"day","time":"2010/02/10 00:00:00 -0500"},"country":null,"user-email":"samuelszs@aol.com","event":"AddLocations","longitude":-89.878258,"id":"a6kgrhlfzdof","user-first-name":"Sherrie"},"type":"Feature","geometry":{"type":"Point","coordinates":[-89.878258,35.13546]}},{"properties":{"city":null,"lattitude":49.216816,"user-last-name":"H","ime":"22:11:34","state/province":null,"street-address":null,"date":{"end_time":"2010/01/30 00:00:00 -0500","original":"01/29/10","granularity":"day","time":"2010/01/29 00:00:00 -0500"},"country":null,"user-email":"deanh@tsaj.com","event":"AddLocations","longitude":-122.665672,"id":"a6kgrhont9pb","user-first-name":"Dean"},"type":"Feature","geometry":{"type":"Point","coordinates":[-122.665672,49.216816]}},{"properties":{"city":null,"lattitude":49.301048,"user-last-name":null,"ime":"19:22:46","state/province":null,"street-address":null,"date":{"end_time":"2009/11/04 00:00:00 -0500","original":"11/03/09","granularity":"day","time":"2009/11/03 00:00:00 -0500"},"country":null,"user-email":"campbell.macdonald@gmail.com","event":"AddLocations","longitude":-123.130074,"id":"a6kgrhue9j6z","user-first-name":null},"type":"Feature","geometry":{"type":"Point","coordinates":[-123.130074,49.301048]}},{"properties":{"city":null,"lattitude":38.96748,"user-last-name":"Clayson","ime":"14:50:00","state/province":null,"street-address":null,"date":{"end_time":"2010/01/04 00:00:00 -0500","original":"01/03/10","granularity":"day","time":"2010/01/03 00:00:00 -0500"},"country":null,"user-email":"steve.clayson@mac.com","event":"AddLocations","longitude":-77.355865,"id":"a6kgrhpd7hn4","user-first-name":"Steve"},"type":"Feature","geometry":{"type":"Point","coordinates":[-77.355865,38.96748]}},{"properties":{"city":null,"lattitude":39.010403,"user-last-name":"Clayson","ime":"19:54:15","state/province":null,"street-address":null,"date":{"end_time":"2010/01/07 00:00:00 -0500","original":"01/06/10","granularity":"day","time":"2010/01/06 00:00:00 -0500"},"country":null,"user-email":"steve.clayson@mac.com","event":"AddLocations","longitude":-77.438728,"id":"a6kgrhug2j8s","user-first-name":"Steve"},"type":"Feature","geometry":{"type":"Point","coordinates":[-77.438728,39.010403]}},{"properties":{"city":null,"lattitude":35.138668,"user-last-name":"Samuels","ime":"0:28:53","state/province":null,"street-address":null,"date":{"end_time":"2010/02/11 00:00:00 -0500","original":"02/10/10","granularity":"day","time":"2010/02/10 00:00:00 -0500"},"country":null,"user-email":"samuelszs@aol.com","event":"AddLocations","longitude":-89.79776,"id":"a6kgrhq3w63t","user-first-name":"Sherrie"},"type":"Feature","geometry":{"type":"Point","coordinates":[-89.79776,35.138668]}},{"properties":{"city":null,"lattitude":53.644306,"user-last-name":"Blacker","ime":"18:01:50","state/province":null,"street-address":null,"date":{"end_time":"2009/11/30 00:00:00 -0500","original":"11/29/09","granularity":"day","time":"2009/11/29 00:00:00 -0500"},"country":null,"user-email":"pa@alanblacker.com","event":"AddLocations","longitude":-1.803689,"id":"a6kgrht2ptoj","user-first-name":"Alan"},"type":"Feature","geometry":{"type":"Point","coordinates":[-1.803689,53.644306]}},{"properties":{"city":null,"lattitude":51.183453,"user-last-name":"Poll","ime":"4:20:30","state/province":null,"street-address":null,"date":{"end_time":"2010/03/05 00:00:00 -0500","original":"03/04/10","granularity":"day","time":"2010/03/04 00:00:00 -0500"},"country":null,"user-email":"toad19652000@yahoo.co.uk","event":"AddLocations","longitude":0.254547,"id":"a6kgrhvjvyj2","user-first-name":"Martyn"},"type":"Feature","geometry":{"type":"Point","coordinates":[0.254547,51.183453]}},{"properties":{"city":null,"lattitude":49.147984,"user-last-name":"P","ime":"8:24:24","state/province":null,"street-address":null,"date":{"end_time":"2009/11/28 00:00:00 -0500","original":"11/27/09","granularity":"day","time":"2009/11/27 00:00:00 -0500"},"country":null,"user-email":"dia@dccp.ca","event":"AddLocations","longitude":-122.766609,"id":"a6kgrhkmf4uc","user-first-name":"Deanna"},"type":"Feature","geometry":{"type":"Point","coordinates":[-122.766609,49.147984]}},{"properties":{"city":null,"lattitude":51.509254,"user-last-name":"Howe","ime":"21:42:37","state/province":null,"street-address":null,"date":{"end_time":"2009/12/07 00:00:00 -0500","original":"12/06/09","granularity":"day","time":"2009/12/06 00:00:00 -0500"},"country":null,"user-email":"garyhowe93@hotmail.com","event":"AddLocations","longitude":-0.129872,"id":"a6kgrhxnaanu","user-first-name":"Gary"},"type":"Feature","geometry":{"type":"Point","coordinates":[-0.129872,51.509254]}},{"properties":{"city":null,"lattitude":37.327309,"user-last-name":null,"ime":"18:30:57","state/province":null,"street-address":null,"date":{"end_time":"2010/02/04 00:00:00 -0500","original":"02/03/10","granularity":"day","time":"2010/02/03 00:00:00 -0500"},"country":null,"user-email":"ian@coalharbourgroup.com","event":"AddLocations","longitude":-122.033447,"id":"a6kgrhnpjyfn","user-first-name":null},"type":"Feature","geometry":{"type":"Point","coordinates":[-122.033447,37.327309]}},{"properties":{"city":null,"lattitude":41.950401,"user-last-name":"Megown","ime":"22:59:15","state/province":null,"street-address":null,"date":{"end_time":"2010/01/14 00:00:00 -0500","original":"01/13/10","granularity":"day","time":"2010/01/13 00:00:00 -0500"},"country":null,"user-email":"jeffreymegown@aol.com","event":"AddLocations","longitude":-91.715805,"id":"a6kgrhzrmdq3","user-first-name":"Jeffrey"},"type":"Feature","geometry":{"type":"Point","coordinates":[-91.715805,41.950401]}},{"properties":{"city":null,"lattitude":29.887262,"user-last-name":"Spradling","ime":"22:07:17","state/province":null,"street-address":null,"date":{"end_time":"2010/03/29 00:00:00 -0400","original":"03/28/10","granularity":"day","time":"2010/03/28 00:00:00 -0400"},"country":null,"user-email":"andrew@parkingmobility.com","event":"AddLocations","longitude":-97.933037,"id":"a6kgrhp73w21","user-first-name":"Andrew"},"type":"Feature","geometry":{"type":"Point","coordinates":[-97.933037,29.887262]}},{"properties":{"city":null,"lattitude":35.191586,"user-last-name":"Samuels","ime":"0:43:15","state/province":null,"street-address":null,"date":{"end_time":"2010/02/11 00:00:00 -0500","original":"02/10/10","granularity":"day","time":"2010/02/10 00:00:00 -0500"},"country":null,"user-email":"samuelszs@aol.com","event":"AddLocations","longitude":-89.795059,"id":"a6kgrhjz17uz","user-first-name":"Sherrie"},"type":"Feature","geometry":{"type":"Point","coordinates":[-89.795059,35.191586]}},{"properties":{"city":null,"lattitude":37.332493,"user-last-name":null,"ime":"4:13:33","state/province":null,"street-address":null,"date":{"end_time":"2009/10/11 00:00:00 -0400","original":"10/10/09","granularity":"day","time":"2009/10/10 00:00:00 -0400"},"country":null,"user-email":"system+unknown-user@parkingmobility.com","event":"AddLocations","longitude":-122.034348,"id":"a6kgrhr94fre","user-first-name":null},"type":"Feature","geometry":{"type":"Point","coordinates":[-122.034348,37.332493]}},{"properties":{"city":null,"lattitude":37.789299,"user-last-name":"Menendez","ime":"17:07:02","state/province":null,"street-address":null,"date":{"end_time":"2009/12/04 00:00:00 -0500","original":"12/03/09","granularity":"day","time":"2009/12/03 00:00:00 -0500"},"country":null,"user-email":"dennismenendez1@mac.com","event":"AddLocations","longitude":-122.395172,"id":"a6kgrhv4zzr0","user-first-name":"Dennis"},"type":"Feature","geometry":{"type":"Point","coordinates":[-122.395172,37.789299]}},{"properties":{"city":null,"lattitude":35.100975,"user-last-name":"Samuels","ime":"14:30:01","state/province":null,"street-address":null,"date":{"end_time":"2010/02/08 00:00:00 -0500","original":"02/07/10","granularity":"day","time":"2010/02/07 00:00:00 -0500"},"country":null,"user-email":"samuelszs@aol.com","event":"AddLocations","longitude":-89.852371,"id":"a6kgrhp1d6o5","user-first-name":"Sherrie"},"type":"Feature","geometry":{"type":"Point","coordinates":[-89.852371,35.100975]}},{"properties":{"city":null,"lattitude":48.186813,"user-last-name":"Grass","ime":"22:13:57","state/province":null,"street-address":null,"date":{"end_time":"2010/01/16 00:00:00 -0500","original":"01/15/10","granularity":"day","time":"2010/01/15 00:00:00 -0500"},"country":null,"user-email":"friedrich.grass@chello.at","event":"AddLocations","longitude":16.31325,"id":"a6kgrhte9wfk","user-first-name":"Friedrich"},"type":"Feature","geometry":{"type":"Point","coordinates":[16.31325,48.186813]}},{"properties":{"city":null,"lattitude":46.193356,"user-last-name":"Cardinal","ime":"10:26:30","state/province":null,"street-address":null,"date":{"end_time":"2010/01/15 00:00:00 -0500","original":"01/14/10","granularity":"day","time":"2010/01/14 00:00:00 -0500"},"country":null,"user-email":"thomas@uwl-workshop.com","event":"AddLocations","longitude":-1.187292,"id":"a6kgrhmjkyh5","user-first-name":"Thomas"},"type":"Feature","geometry":{"type":"Point","coordinates":[-1.187292,46.193356]}},{"properties":{"city":null,"lattitude":35.157242,"user-last-name":"Samuels","ime":"14:12:11","state/province":null,"street-address":null,"date":{"end_time":"2010/02/11 00:00:00 -0500","original":"02/10/10","granularity":"day","time":"2010/02/10 00:00:00 -0500"},"country":null,"user-email":"samuelszs@aol.com","event":"AddLocations","longitude":-89.885666,"id":"a6kgrhk3fl91","user-first-name":"Sherrie"},"type":"Feature","geometry":{"type":"Point","coordinates":[-89.885666,35.157242]}},{"properties":{"city":null,"lattitude":49.284607,"user-last-name":"Nachbaur","ime":"17:13:57","state/province":null,"street-address":null,"date":{"end_time":"2009/10/23 00:00:00 -0400","original":"10/22/09","granularity":"day","time":"2009/10/22 00:00:00 -0400"},"country":null,"user-email":"mike.nachbaur@nachbaur.com","event":"AddLocations","longitude":-123.114883,"id":"a6kgrhuvleag","user-first-name":"Mike"},"type":"Feature","geometry":{"type":"Point","coordinates":[-123.114883,49.284607]}},{"properties":{"city":null,"lattitude":35.088226,"user-last-name":"Samuels","ime":"23:43:41","state/province":null,"street-address":null,"date":{"end_time":"2010/02/12 00:00:00 -0500","original":"02/11/10","granularity":"day","time":"2010/02/11 00:00:00 -0500"},"country":null,"user-email":"samuelszs@aol.com","event":"AddLocations","longitude":-89.800423,"id":"a6kgrhlh9vbs","user-first-name":"Sherrie"},"type":"Feature","geometry":{"type":"Point","coordinates":[-89.800423,35.088226]}},{"properties":{"city":null,"lattitude":42.857304,"user-last-name":"Shertzer","ime":"16:42:49","state/province":null,"street-address":null,"date":{"end_time":"2010/03/25 00:00:00 -0400","original":"03/24/10","granularity":"day","time":"2010/03/24 00:00:00 -0400"},"country":null,"user-email":"daveshertzer@me.com","event":"AddLocations","longitude":-73.787056,"id":"a6kgrhzok3p1","user-first-name":"Dave"},"type":"Feature","geometry":{"type":"Point","coordinates":[-73.787056,42.857304]}},{"properties":{"city":null,"lattitude":35.143883,"user-last-name":"Samuels","ime":"16:04:28","state/province":null,"street-address":null,"date":{"end_time":"2010/02/25 00:00:00 -0500","original":"02/24/10","granularity":"day","time":"2010/02/24 00:00:00 -0500"},"country":null,"user-email":"samuelszs@aol.com","event":"AddLocations","longitude":-89.995125,"id":"a6kgrhktt8gx","user-first-name":"Sherrie"},"type":"Feature","geometry":{"type":"Point","coordinates":[-89.995125,35.143883]}},{"properties":{"city":null,"lattitude":35.132988,"user-last-name":"Samuels","ime":"19:45:04","state/province":null,"street-address":null,"date":{"end_time":"2010/02/08 00:00:00 -0500","original":"02/07/10","granularity":"day","time":"2010/02/07 00:00:00 -0500"},"country":null,"user-email":"samuelszs@aol.com","event":"AddLocations","longitude":-89.960068,"id":"a6kgrht239uj","user-first-name":"Sherrie"},"type":"Feature","geometry":{"type":"Point","coordinates":[-89.960068,35.132988]}},{"properties":{"city":null,"lattitude":51.417061,"user-last-name":"Brazil","ime":"22:24:28","state/province":null,"street-address":null,"date":{"end_time":"2009/12/02 00:00:00 -0500","original":"12/01/09","granularity":"day","time":"2009/12/01 00:00:00 -0500"},"country":null,"user-email":"claire.brazil@sky.com","event":"AddLocations","longitude":-0.750766,"id":"a6kgrhs6v949","user-first-name":"Claire"},"type":"Feature","geometry":{"type":"Point","coordinates":[-0.750766,51.417061]}},{"properties":{"city":null,"lattitude":37.332653,"user-last-name":null,"ime":"3:59:20","state/province":null,"street-address":null,"date":{"end_time":"2009/10/11 00:00:00 -0400","original":"10/10/09","granularity":"day","time":"2009/10/10 00:00:00 -0400"},"country":null,"user-email":"system+unknown-user@parkingmobility.com","event":"AddLocations","longitude":-122.031013,"id":"a6kgrhnydo3m","user-first-name":null},"type":"Feature","geometry":{"type":"Point","coordinates":[-122.031013,37.332653]}},{"properties":{"city":null,"lattitude":43.580597,"user-last-name":"Gibaud","ime":"3:03:48","state/province":null,"street-address":null,"date":{"end_time":"2009/12/21 00:00:00 -0500","original":"12/20/09","granularity":"day","time":"2009/12/20 00:00:00 -0500"},"country":null,"user-email":"gibaud.chris@gmail.com","event":"AddLocations","longitude":5.423532,"id":"a6kgrhq0q69n","user-first-name":"Chris"},"type":"Feature","geometry":{"type":"Point","coordinates":[5.423532,43.580597]}},{"properties":{"city":null,"lattitude":41.443462,"user-last-name":"López","ime":"21:05:46","state/province":null,"street-address":null,"date":{"end_time":"2009/12/02 00:00:00 -0500","original":"12/01/09","granularity":"day","time":"2009/12/01 00:00:00 -0500"},"country":null,"user-email":"rsgore@hotmail.com","event":"AddLocations","longitude":2.217706,"id":"a6kgrhqar3td","user-first-name":"Lolo"},"type":"Feature","geometry":{"type":"Point","coordinates":[2.217706,41.443462]}},{"properties":{"city":null,"lattitude":35.101055,"user-last-name":"Samuels","ime":"14:08:42","state/province":null,"street-address":null,"date":{"end_time":"2010/02/08 00:00:00 -0500","original":"02/07/10","granularity":"day","time":"2010/02/07 00:00:00 -0500"},"country":null,"user-email":"samuelszs@aol.com","event":"AddLocations","longitude":-89.844543,"id":"a6kgrhtna4jv","user-first-name":"Sherrie"},"type":"Feature","geometry":{"type":"Point","coordinates":[-89.844543,35.101055]}},{"properties":{"city":null,"lattitude":35.100277,"user-last-name":"Samuels","ime":"14:23:01","state/province":null,"street-address":null,"date":{"end_time":"2010/02/08 00:00:00 -0500","original":"02/07/10","granularity":"day","time":"2010/02/07 00:00:00 -0500"},"country":null,"user-email":"samuelszs@aol.com","event":"AddLocations","longitude":-89.847885,"id":"a6kgrhmgcnt7","user-first-name":"Sherrie"},"type":"Feature","geometry":{"type":"Point","coordinates":[-89.847885,35.100277]}},{"properties":{"city":null,"lattitude":50.386497,"user-last-name":"Steinier","ime":"13:38:59","state/province":null,"street-address":null,"date":{"end_time":"2010/02/21 00:00:00 -0500","original":"02/20/10","granularity":"day","time":"2010/02/20 00:00:00 -0500"},"country":null,"user-email":"philippe@handimobility.org","event":"AddLocations","longitude":4.463072,"id":"a6kgrhlwtq22","user-first-name":"Philippe"},"type":"Feature","geometry":{"type":"Point","coordinates":[4.463072,50.386497]}},{"properties":{"city":null,"lattitude":59.860367,"user-last-name":"Häggström","ime":"19:51:14","state/province":null,"street-address":null,"date":{"end_time":"2010/02/21 00:00:00 -0500","original":"02/20/10","granularity":"day","time":"2010/02/20 00:00:00 -0500"},"country":null,"user-email":"erik.haggstrom@verdandigarden.se","event":"AddLocations","longitude":17.646164,"id":"a6kgrhuu0s6h","user-first-name":"Erik"},"type":"Feature","geometry":{"type":"Point","coordinates":[17.646164,59.860367]}},{"properties":{"city":null,"lattitude":-32.903442,"user-last-name":"Wotton","ime":"1:19:57","state/province":null,"street-address":null,"date":{"end_time":"2009/11/30 00:00:00 -0500","original":"11/29/09","granularity":"day","time":"2009/11/29 00:00:00 -0500"},"country":null,"user-email":"kyteflyer@gmail.com","event":"AddLocations","longitude":151.667572,"id":"a6kgri0dsjk7","user-first-name":"Sue"},"type":"Feature","geometry":{"type":"Point","coordinates":[151.667572,-32.903442]}},{"properties":{"city":null,"lattitude":48.210773,"user-last-name":"Grass","ime":"14:16:59","state/province":null,"street-address":null,"date":{"end_time":"2010/01/14 00:00:00 -0500","original":"01/13/10","granularity":"day","time":"2010/01/13 00:00:00 -0500"},"country":null,"user-email":"friedrich.grass@chello.at","event":"AddLocations","longitude":16.382387,"id":"a6kgrhrkg0lq","user-first-name":"Friedrich"},"type":"Feature","geometry":{"type":"Point","coordinates":[16.382387,48.210773]}},{"properties":{"city":null,"lattitude":42.020393,"user-last-name":"Megown","ime":"2:24:43","state/province":null,"street-address":null,"date":{"end_time":"2010/01/11 00:00:00 -0500","original":"01/10/10","granularity":"day","time":"2010/01/10 00:00:00 -0500"},"country":null,"user-email":"jeffreymegown@aol.com","event":"AddLocations","longitude":-91.598671,"id":"a6kgrhsy9c09","user-first-name":"Jeffrey"},"type":"Feature","geometry":{"type":"Point","coordinates":[-91.598671,42.020393]}},{"properties":{"city":null,"lattitude":35.14035,"user-last-name":"Samuels","ime":"0:36:24","state/province":null,"street-address":null,"date":{"end_time":"2010/02/11 00:00:00 -0500","original":"02/10/10","granularity":"day","time":"2010/02/10 00:00:00 -0500"},"country":null,"user-email":"samuelszs@aol.com","event":"AddLocations","longitude":-89.797379,"id":"a6kgrhztwme1","user-first-name":"Sherrie"},"type":"Feature","geometry":{"type":"Point","coordinates":[-89.797379,35.14035]}},{"properties":{"city":null,"lattitude":49.157558,"user-last-name":"P","ime":"8:17:36","state/province":null,"street-address":null,"date":{"end_time":"2009/11/28 00:00:00 -0500","original":"11/27/09","granularity":"day","time":"2009/11/27 00:00:00 -0500"},"country":null,"user-email":"dia@dccp.ca","event":"AddLocations","longitude":-122.780853,"id":"a6kgrhl3xue7","user-first-name":"Deanna"},"type":"Feature","geometry":{"type":"Point","coordinates":[-122.780853,49.157558]}},{"properties":{"city":null,"lattitude":35.133358,"user-last-name":"Samuels","ime":"0:14:57","state/province":null,"street-address":null,"date":{"end_time":"2010/02/11 00:00:00 -0500","original":"02/10/10","granularity":"day","time":"2010/02/10 00:00:00 -0500"},"country":null,"user-email":"samuelszs@aol.com","event":"AddLocations","longitude":-89.961708,"id":"a6kgrhrzy8t8","user-first-name":"Sherrie"},"type":"Feature","geometry":{"type":"Point","coordinates":[-89.961708,35.133358]}},{"properties":{"city":null,"lattitude":47.465755,"user-last-name":null,"ime":"14:55:20","state/province":null,"street-address":null,"date":{"end_time":"2010/01/30 00:00:00 -0500","original":"01/29/10","granularity":"day","time":"2010/01/29 00:00:00 -0500"},"country":null,"user-email":"b-brave@gmx.net","event":"AddLocations","longitude":9.045402,"id":"a6kgrhn3rn3f","user-first-name":null},"type":"Feature","geometry":{"type":"Point","coordinates":[9.045402,47.465755]}},{"properties":{"city":null,"lattitude":45.466656,"user-last-name":"D","ime":"7:29:23","state/province":null,"street-address":null,"date":{"end_time":"2010/03/03 00:00:00 -0500","original":"03/02/10","granularity":"day","time":"2010/03/02 00:00:00 -0500"},"country":null,"user-email":"kentia000@hotmail.com","event":"AddLocations","longitude":-73.54425,"id":"a6kgrhy31i05","user-first-name":"Mel"},"type":"Feature","geometry":{"type":"Point","coordinates":[-73.54425,45.466656]}},{"properties":{"city":null,"lattitude":41.960941,"user-last-name":"Megown","ime":"20:19:48","state/province":null,"street-address":null,"date":{"end_time":"2010/01/16 00:00:00 -0500","original":"01/15/10","granularity":"day","time":"2010/01/15 00:00:00 -0500"},"country":null,"user-email":"jeffreymegown@aol.com","event":"AddLocations","longitude":-91.710266,"id":"a6kgrhypt85y","user-first-name":"Jeffrey"},"type":"Feature","geometry":{"type":"Point","coordinates":[-91.710266,41.960941]}},{"properties":{"city":null,"lattitude":38.968288,"user-last-name":"Clayson","ime":"14:50:27","state/province":null,"street-address":null,"date":{"end_time":"2010/01/04 00:00:00 -0500","original":"01/03/10","granularity":"day","time":"2010/01/03 00:00:00 -0500"},"country":null,"user-email":"steve.clayson@mac.com","event":"AddLocations","longitude":-77.354568,"id":"a6kgrhri2jil","user-first-name":"Steve"},"type":"Feature","geometry":{"type":"Point","coordinates":[-77.354568,38.968288]}},{"properties":{"city":null,"lattitude":43.580441,"user-last-name":"Gibaud","ime":"3:04:04","state/province":null,"street-address":null,"date":{"end_time":"2009/12/21 00:00:00 -0500","original":"12/20/09","granularity":"day","time":"2009/12/20 00:00:00 -0500"},"country":null,"user-email":"gibaud.chris@gmail.com","event":"AddLocations","longitude":5.423298,"id":"a6kgrhqyfxot","user-first-name":"Chris"},"type":"Feature","geometry":{"type":"Point","coordinates":[5.423298,43.580441]}},{"properties":{"city":null,"lattitude":37.331062,"user-last-name":null,"ime":"4:06:49","state/province":null,"street-address":null,"date":{"end_time":"2009/10/11 00:00:00 -0400","original":"10/10/09","granularity":"day","time":"2009/10/10 00:00:00 -0400"},"country":null,"user-email":"system+unknown-user@parkingmobility.com","event":"AddLocations","longitude":-122.03183,"id":"a6kgrhs0ggo8","user-first-name":null},"type":"Feature","geometry":{"type":"Point","coordinates":[-122.03183,37.331062]}},{"properties":{"city":null,"lattitude":52.584713,"user-last-name":"Moult","ime":"13:49:22","state/province":null,"street-address":null,"date":{"end_time":"2009/11/26 00:00:00 -0500","original":"11/25/09","granularity":"day","time":"2009/11/25 00:00:00 -0500"},"country":null,"user-email":"andrewmoult@yahoo.co.uk","event":"AddLocations","longitude":-1.979631,"id":"a6kgrhteu3kd","user-first-name":"Andrew"},"type":"Feature","geometry":{"type":"Point","coordinates":[-1.979631,52.584713]}},{"properties":{"city":null,"lattitude":49.290127,"user-last-name":null,"ime":"0:24:58","state/province":null,"street-address":null,"date":{"end_time":"2009/10/17 00:00:00 -0400","original":"10/16/09","granularity":"day","time":"2009/10/16 00:00:00 -0400"},"country":null,"user-email":"Campbell.macdonald@gmail.com","event":"AddLocations","longitude":-123.133125,"id":"a6kgrhzsq07j","user-first-name":null},"type":"Feature","geometry":{"type":"Point","coordinates":[-123.133125,49.290127]}},{"properties":{"city":null,"lattitude":49.263809,"user-last-name":null,"ime":"18:33:57","state/province":null,"street-address":null,"date":{"end_time":"2010/02/20 00:00:00 -0500","original":"02/19/10","granularity":"day","time":"2010/02/19 00:00:00 -0500"},"country":null,"user-email":"ian@coalharbourgroup.com","event":"AddLocations","longitude":-123.169922,"id":"a6kgrhr827qv","user-first-name":null},"type":"Feature","geometry":{"type":"Point","coordinates":[-123.169922,49.263809]}},{"properties":{"city":null,"lattitude":48.204494,"user-last-name":"Grass","ime":"7:47:07","state/province":null,"street-address":null,"date":{"end_time":"2010/01/23 00:00:00 -0500","original":"01/22/10","granularity":"day","time":"2010/01/22 00:00:00 -0500"},"country":null,"user-email":"friedrich.grass@chello.at","event":"AddLocations","longitude":16.35766,"id":"a6kgrhksi79u","user-first-name":"Friedrich"},"type":"Feature","geometry":{"type":"Point","coordinates":[16.35766,48.204494]}},{"properties":{"city":null,"lattitude":30.323328,"user-last-name":"S","ime":"21:25:40","state/province":null,"street-address":null,"date":{"end_time":"2010/02/08 00:00:00 -0500","original":"02/07/10","granularity":"day","time":"2010/02/07 00:00:00 -0500"},"country":null,"user-email":"qqmech@gmail.com","event":"AddLocations","longitude":-97.724335,"id":"a6kgrhmo2blx","user-first-name":"Mike"},"type":"Feature","geometry":{"type":"Point","coordinates":[-97.724335,30.323328]}},{"properties":{"city":null,"lattitude":35.088104,"user-last-name":"Samuels","ime":"23:44:07","state/province":null,"street-address":null,"date":{"end_time":"2010/02/12 00:00:00 -0500","original":"02/11/10","granularity":"day","time":"2010/02/11 00:00:00 -0500"},"country":null,"user-email":"samuelszs@aol.com","event":"AddLocations","longitude":-89.800514,"id":"a6kgri0eqhkf","user-first-name":"Sherrie"},"type":"Feature","geometry":{"type":"Point","coordinates":[-89.800514,35.088104]}},{"properties":{"city":null,"lattitude":35.191521,"user-last-name":"Samuels","ime":"0:43:45","state/province":null,"street-address":null,"date":{"end_time":"2010/02/11 00:00:00 -0500","original":"02/10/10","granularity":"day","time":"2010/02/10 00:00:00 -0500"},"country":null,"user-email":"samuelszs@aol.com","event":"AddLocations","longitude":-89.795052,"id":"a6kgrhs12aab","user-first-name":"Sherrie"},"type":"Feature","geometry":{"type":"Point","coordinates":[-89.795052,35.191521]}},{"properties":{"city":null,"lattitude":43.581848,"user-last-name":"Gibaud","ime":"14:15:55","state/province":null,"street-address":null,"date":{"end_time":"2009/12/22 00:00:00 -0500","original":"12/21/09","granularity":"day","time":"2009/12/21 00:00:00 -0500"},"country":null,"user-email":"gibaud.chris@gmail.com","event":"AddLocations","longitude":5.42235,"id":"a6kgrhm0pk7z","user-first-name":"Chris"},"type":"Feature","geometry":{"type":"Point","coordinates":[5.42235,43.581848]}},{"properties":{"city":null,"lattitude":54.977062,"user-last-name":"Shield","ime":"7:19:37","state/province":null,"street-address":null,"date":{"end_time":"2009/12/29 00:00:00 -0500","original":"12/28/09","granularity":"day","time":"2009/12/28 00:00:00 -0500"},"country":null,"user-email":"sumbodistopme@hotmail.com","event":"AddLocations","longitude":-1.612838,"id":"a6kgrhngwkqv","user-first-name":"Jamie"},"type":"Feature","geometry":{"type":"Point","coordinates":[-1.612838,54.977062]}},{"properties":{"city":null,"lattitude":37.328617,"user-last-name":"Nachbaur","ime":"14:47:43","state/province":null,"street-address":null,"date":{"end_time":"2009/10/20 00:00:00 -0400","original":"10/19/09","granularity":"day","time":"2009/10/19 00:00:00 -0400"},"country":null,"user-email":"mike.nachbaur@decafninja.com","event":"AddLocations","longitude":-122.029449,"id":"a6kgrhlnp7vr","user-first-name":"Mike"},"type":"Feature","geometry":{"type":"Point","coordinates":[-122.029449,37.328617]}},{"properties":{"city":null,"lattitude":41.949791,"user-last-name":"Megown","ime":"14:28:07","state/province":null,"street-address":null,"date":{"end_time":"2010/01/23 00:00:00 -0500","original":"01/22/10","granularity":"day","time":"2010/01/22 00:00:00 -0500"},"country":null,"user-email":"jeffreymegown@aol.com","event":"AddLocations","longitude":-91.713524,"id":"a6kgrhn6oy1d","user-first-name":"Jeffrey"},"type":"Feature","geometry":{"type":"Point","coordinates":[-91.713524,41.949791]}},{"properties":{"city":null,"lattitude":35.101028,"user-last-name":"Samuels","ime":"14:30:37","state/province":null,"street-address":null,"date":{"end_time":"2010/02/08 00:00:00 -0500","original":"02/07/10","granularity":"day","time":"2010/02/07 00:00:00 -0500"},"country":null,"user-email":"samuelszs@aol.com","event":"AddLocations","longitude":-89.852303,"id":"a6kgrhtuxn8d","user-first-name":"Sherrie"},"type":"Feature","geometry":{"type":"Point","coordinates":[-89.852303,35.101028]}},{"properties":{"city":null,"lattitude":35.198555,"user-last-name":"Samuels","ime":"14:19:56","state/province":null,"street-address":null,"date":{"end_time":"2010/02/11 00:00:00 -0500","original":"02/10/10","granularity":"day","time":"2010/02/10 00:00:00 -0500"},"country":null,"user-email":"samuelszs@aol.com","event":"AddLocations","longitude":-89.797379,"id":"a6kgrhuwbvcx","user-first-name":"Sherrie"},"type":"Feature","geometry":{"type":"Point","coordinates":[-89.797379,35.198555]}},{"properties":{"city":null,"lattitude":35.111214,"user-last-name":"Samuels","ime":"14:37:48","state/province":null,"street-address":null,"date":{"end_time":"2010/02/08 00:00:00 -0500","original":"02/07/10","granularity":"day","time":"2010/02/07 00:00:00 -0500"},"country":null,"user-email":"samuelszs@aol.com","event":"AddLocations","longitude":-89.893616,"id":"a6kgrhy3lzek","user-first-name":"Sherrie"},"type":"Feature","geometry":{"type":"Point","coordinates":[-89.893616,35.111214]}},{"properties":{"city":null,"lattitude":51.416847,"user-last-name":"Brazil","ime":"22:25:01","state/province":null,"street-address":null,"date":{"end_time":"2009/12/02 00:00:00 -0500","original":"12/01/09","granularity":"day","time":"2009/12/01 00:00:00 -0500"},"country":null,"user-email":"claire.brazil@sky.com","event":"AddLocations","longitude":-0.752103,"id":"a6kgrhz3glif","user-first-name":"Claire"},"type":"Feature","geometry":{"type":"Point","coordinates":[-0.752103,51.416847]}},{"properties":{"city":null,"lattitude":35.113819,"user-last-name":"Samuels","ime":"19:33:47","state/province":null,"street-address":null,"date":{"end_time":"2010/02/18 00:00:00 -0500","original":"02/17/10","granularity":"day","time":"2010/02/17 00:00:00 -0500"},"country":null,"user-email":"samuelszs@aol.com","event":"AddLocations","longitude":-89.894058,"id":"a6kgrhydnpo1","user-first-name":"Sherrie"},"type":"Feature","geometry":{"type":"Point","coordinates":[-89.894058,35.113819]}},{"properties":{"city":null,"lattitude":35.144978,"user-last-name":"Samuels","ime":"16:05:03","state/province":null,"street-address":null,"date":{"end_time":"2010/02/25 00:00:00 -0500","original":"02/24/10","granularity":"day","time":"2010/02/24 00:00:00 -0500"},"country":null,"user-email":"samuelszs@aol.com","event":"AddLocations","longitude":-89.994598,"id":"a6kgrhy0d0cf","user-first-name":"Sherrie"},"type":"Feature","geometry":{"type":"Point","coordinates":[-89.994598,35.144978]}},{"properties":{"city":null,"lattitude":52.237831,"user-last-name":"Redmond","ime":"9:32:38","state/province":null,"street-address":null,"date":{"end_time":"2010/03/08 00:00:00 -0500","original":"03/07/10","granularity":"day","time":"2010/03/07 00:00:00 -0500"},"country":null,"user-email":"david.redmond@ymail.com","event":"AddLocations","longitude":-0.895242,"id":"a6kgrhz8wk4z","user-first-name":"David"},"type":"Feature","geometry":{"type":"Point","coordinates":[-0.895242,52.237831]}},{"properties":{"city":null,"lattitude":50.967308,"user-last-name":"Kinloch","ime":"20:20:40","state/province":null,"street-address":null,"date":{"end_time":"2010/04/04 00:00:00 -0400","original":"04/03/10","granularity":"day","time":"2010/04/03 00:00:00 -0400"},"country":null,"user-email":"liz_kinloch@btinternet.com","event":"AddLocations","longitude":-1.351785,"id":"a6kgrhq9tuf5","user-first-name":"Liz"},"type":"Feature","geometry":{"type":"Point","coordinates":[-1.351785,50.967308]}},{"properties":{"city":null,"lattitude":42.857193,"user-last-name":"Shertzer","ime":"19:17:18","state/province":null,"street-address":null,"date":{"end_time":"2010/03/10 00:00:00 -0500","original":"03/09/10","granularity":"day","time":"2010/03/09 00:00:00 -0500"},"country":null,"user-email":"daveshertzer@me.com","event":"AddLocations","longitude":-73.786972,"id":"a6kgrhv7ip2p","user-first-name":"Dave"},"type":"Feature","geometry":{"type":"Point","coordinates":[-73.786972,42.857193]}},{"properties":{"city":null,"lattitude":35.131645,"user-last-name":"Samuels","ime":"3:35:48","state/province":null,"street-address":null,"date":{"end_time":"2010/02/11 00:00:00 -0500","original":"02/10/10","granularity":"day","time":"2010/02/10 00:00:00 -0500"},"country":null,"user-email":"samuelszs@aol.com","event":"AddLocations","longitude":-89.863876,"id":"a6kgri0fwz4m","user-first-name":"Sherrie"},"type":"Feature","geometry":{"type":"Point","coordinates":[-89.863876,35.131645]}},{"properties":{"city":null,"lattitude":35.149414,"user-last-name":"Samuels","ime":"0:22:32","state/province":null,"street-address":null,"date":{"end_time":"2010/02/11 00:00:00 -0500","original":"02/10/10","granularity":"day","time":"2010/02/10 00:00:00 -0500"},"country":null,"user-email":"samuelszs@aol.com","event":"AddLocations","longitude":-89.994057,"id":"a6kgrhua5upm","user-first-name":"Sherrie"},"type":"Feature","geometry":{"type":"Point","coordinates":[-89.994057,35.149414]}},{"properties":{"city":null,"lattitude":49.157974,"user-last-name":"P","ime":"8:18:03","state/province":null,"street-address":null,"date":{"end_time":"2009/11/28 00:00:00 -0500","original":"11/27/09","granularity":"day","time":"2009/11/27 00:00:00 -0500"},"country":null,"user-email":"dia@dccp.ca","event":"AddLocations","longitude":-122.781563,"id":"a6kgrhquth2z","user-first-name":"Deanna"},"type":"Feature","geometry":{"type":"Point","coordinates":[-122.781563,49.157974]}},{"properties":{"city":null,"lattitude":49.300121,"user-last-name":null,"ime":"19:09:17","state/province":null,"street-address":null,"date":{"end_time":"2009/11/04 00:00:00 -0500","original":"11/03/09","granularity":"day","time":"2009/11/03 00:00:00 -0500"},"country":null,"user-email":"campbell.macdonald@gmail.com","event":"AddLocations","longitude":-123.126122,"id":"a6kgrhkbo1s6","user-first-name":null},"type":"Feature","geometry":{"type":"Point","coordinates":[-123.126122,49.300121]}},{"properties":{"city":null,"lattitude":35.101055,"user-last-name":"Samuels","ime":"14:02:10","state/province":null,"street-address":null,"date":{"end_time":"2010/02/08 00:00:00 -0500","original":"02/07/10","granularity":"day","time":"2010/02/07 00:00:00 -0500"},"country":null,"user-email":"samuelszs@aol.com","event":"AddLocations","longitude":-89.844498,"id":"a6kgrho5s8on","user-first-name":"Sherrie"},"type":"Feature","geometry":{"type":"Point","coordinates":[-89.844498,35.101055]}},{"properties":{"city":null,"lattitude":51.046059,"user-last-name":"Spradling","ime":"19:49:12","state/province":null,"street-address":null,"date":{"end_time":"2010/01/18 00:00:00 -0500","original":"01/17/10","granularity":"day","time":"2010/01/17 00:00:00 -0500"},"country":null,"user-email":"andrew@parkingmobility.com","event":"AddLocations","longitude":-114.078163,"id":"a6kgrhpc0vrh","user-first-name":"Andrew"},"type":"Feature","geometry":{"type":"Point","coordinates":[-114.078163,51.046059]}},{"properties":{"city":null,"lattitude":35.133335,"user-last-name":"Samuels","ime":"0:15:27","state/province":null,"street-address":null,"date":{"end_time":"2010/02/11 00:00:00 -0500","original":"02/10/10","granularity":"day","time":"2010/02/10 00:00:00 -0500"},"country":null,"user-email":"samuelszs@aol.com","event":"AddLocations","longitude":-89.962646,"id":"a6kgrhwc758s","user-first-name":"Sherrie"},"type":"Feature","geometry":{"type":"Point","coordinates":[-89.962646,35.133335]}},{"properties":{"city":null,"lattitude":43.58057,"user-last-name":"Gibaud","ime":"3:04:30","state/province":null,"street-address":null,"date":{"end_time":"2009/12/21 00:00:00 -0500","original":"12/20/09","granularity":"day","time":"2009/12/20 00:00:00 -0500"},"country":null,"user-email":"gibaud.chris@gmail.com","event":"AddLocations","longitude":5.421995,"id":"a6kgrhka98cg","user-first-name":"Chris"},"type":"Feature","geometry":{"type":"Point","coordinates":[5.421995,43.58057]}},{"properties":{"city":null,"lattitude":37.331524,"user-last-name":null,"ime":"3:52:55","state/province":null,"street-address":null,"date":{"end_time":"2009/10/11 00:00:00 -0400","original":"10/10/09","granularity":"day","time":"2009/10/10 00:00:00 -0400"},"country":null,"user-email":"system+unknown-user@parkingmobility.com","event":"AddLocations","longitude":-122.030945,"id":"a6kgrhm7cazh","user-first-name":null},"type":"Feature","geometry":{"type":"Point","coordinates":[-122.030945,37.331524]}},{"properties":{"city":null,"lattitude":46.168526,"user-last-name":"Syloda","ime":"18:27:54","state/province":null,"street-address":null,"date":{"end_time":"2009/12/15 00:00:00 -0500","original":"12/14/09","granularity":"day","time":"2009/12/14 00:00:00 -0500"},"country":null,"user-email":"syloda@hotmail.com","event":"AddLocations","longitude":6.120413,"id":"a6kgrhqkazn7","user-first-name":"Syloda"},"type":"Feature","geometry":{"type":"Point","coordinates":[6.120413,46.168526]}},{"properties":{"city":null,"lattitude":51.483849,"user-last-name":"Rodriguez amad","ime":"14:56:41","state/province":null,"street-address":null,"date":{"end_time":"2009/12/06 00:00:00 -0500","original":"12/05/09","granularity":"day","time":"2009/12/05 00:00:00 -0500"},"country":null,"user-email":"rodriguez78@hotmail.co.uk","event":"AddLocations","longitude":-0.176833,"id":"a6kgrhod6y37","user-first-name":"Carlos"},"type":"Feature","geometry":{"type":"Point","coordinates":[-0.176833,51.483849]}},{"properties":{"city":null,"lattitude":35.100307,"user-last-name":"Samuels","ime":"14:23:45","state/province":null,"street-address":null,"date":{"end_time":"2010/02/08 00:00:00 -0500","original":"02/07/10","granularity":"day","time":"2010/02/07 00:00:00 -0500"},"country":null,"user-email":"samuelszs@aol.com","event":"AddLocations","longitude":-89.848068,"id":"a6kgrhqcxgas","user-first-name":"Sherrie"},"type":"Feature","geometry":{"type":"Point","coordinates":[-89.848068,35.100307]}},{"properties":{"city":null,"lattitude":53.383736,"user-last-name":"Baker","ime":"21:58:07","state/province":null,"street-address":null,"date":{"end_time":"2010/01/12 00:00:00 -0500","original":"01/11/10","granularity":"day","time":"2010/01/11 00:00:00 -0500"},"country":null,"user-email":"lrd1960@yahoo.co.uk","event":"AddLocations","longitude":-1.490117,"id":"a6kgrhsdpttp","user-first-name":"Keith"},"type":"Feature","geometry":{"type":"Point","coordinates":[-1.490117,53.383736]}},{"properties":{"city":null,"lattitude":51.500702,"user-last-name":"Rodriguez amad","ime":"13:08:10","state/province":null,"street-address":null,"date":{"end_time":"2009/12/07 00:00:00 -0500","original":"12/06/09","granularity":"day","time":"2009/12/06 00:00:00 -0500"},"country":null,"user-email":"rodriguez78@hotmail.co.uk","event":"AddLocations","longitude":-0.194535,"id":"a6kgrhp06bbb","user-first-name":"Carlos"},"type":"Feature","geometry":{"type":"Point","coordinates":[-0.194535,51.500702]}},{"properties":{"city":null,"lattitude":48.870968,"user-last-name":"Prodel","ime":"6:52:20","state/province":null,"street-address":null,"date":{"end_time":"2009/11/28 00:00:00 -0500","original":"11/27/09","granularity":"day","time":"2009/11/27 00:00:00 -0500"},"country":null,"user-email":"jy.prodel@jyp-design.com","event":"AddLocations","longitude":2.331859,"id":"a6kgrhza35ia","user-first-name":"Jean Yves"},"type":"Feature","geometry":{"type":"Point","coordinates":[2.331859,48.870968]}},{"properties":{"city":null,"lattitude":38.966526,"user-last-name":"Clayson","ime":"14:51:01","state/province":null,"street-address":null,"date":{"end_time":"2010/01/04 00:00:00 -0500","original":"01/03/10","granularity":"day","time":"2010/01/03 00:00:00 -0500"},"country":null,"user-email":"steve.clayson@mac.com","event":"AddLocations","longitude":-77.359444,"id":"a6kgrhvvelkw","user-first-name":"Steve"},"type":"Feature","geometry":{"type":"Point","coordinates":[-77.359444,38.966526]}},{"properties":{"city":null,"lattitude":51.484093,"user-last-name":"Rodriguez amad","ime":"19:09:44","state/province":null,"street-address":null,"date":{"end_time":"2009/12/10 00:00:00 -0500","original":"12/09/09","granularity":"day","time":"2009/12/09 00:00:00 -0500"},"country":null,"user-email":"rodriguez78@hotmail.co.uk","event":"AddLocations","longitude":-0.182867,"id":"a6kgrhoqnx5x","user-first-name":"Carlos"},"type":"Feature","geometry":{"type":"Point","coordinates":[-0.182867,51.484093]}},{"properties":{"city":null,"lattitude":37.3325,"user-last-name":null,"ime":"4:14:33","state/province":null,"street-address":null,"date":{"end_time":"2009/10/11 00:00:00 -0400","original":"10/10/09","granularity":"day","time":"2009/10/10 00:00:00 -0400"},"country":null,"user-email":"system+unknown-user@parkingmobility.com","event":"AddLocations","longitude":-122.03524,"id":"a6kgrhoea19n","user-first-name":null},"type":"Feature","geometry":{"type":"Point","coordinates":[-122.03524,37.3325]}},{"properties":{"city":null,"lattitude":38.957886,"user-last-name":"Clayson","ime":"17:02:16","state/province":null,"street-address":null,"date":{"end_time":"2010/01/02 00:00:00 -0500","original":"01/01/10","granularity":"day","time":"2010/01/01 00:00:00 -0500"},"country":null,"user-email":"steve.clayson@mac.com","event":"AddLocations","longitude":-77.357307,"id":"a6kgrhrjyxgo","user-first-name":"Steve"},"type":"Feature","geometry":{"type":"Point","coordinates":[-77.357307,38.957886]}},{"properties":{"city":null,"lattitude":34.933037,"user-last-name":"Samuels","ime":"14:41:48","state/province":null,"street-address":null,"date":{"end_time":"2010/02/11 00:00:00 -0500","original":"02/10/10","granularity":"day","time":"2010/02/10 00:00:00 -0500"},"country":null,"user-email":"samuelszs@aol.com","event":"AddLocations","longitude":-89.998924,"id":"a6kgrhl5wjny","user-first-name":"Sherrie"},"type":"Feature","geometry":{"type":"Point","coordinates":[-89.998924,34.933037]}},{"properties":{"city":null,"lattitude":52.584988,"user-last-name":"Moult","ime":"13:49:58","state/province":null,"street-address":null,"date":{"end_time":"2009/11/26 00:00:00 -0500","original":"11/25/09","granularity":"day","time":"2009/11/25 00:00:00 -0500"},"country":null,"user-email":"andrewmoult@yahoo.co.uk","event":"AddLocations","longitude":-1.978928,"id":"a6kgrhr0l8dt","user-first-name":"Andrew"},"type":"Feature","geometry":{"type":"Point","coordinates":[-1.978928,52.584988]}},{"properties":{"city":null,"lattitude":35.101627,"user-last-name":"Samuels","ime":"16:13:42","state/province":null,"street-address":null,"date":{"end_time":"2010/02/12 00:00:00 -0500","original":"02/11/10","granularity":"day","time":"2010/02/11 00:00:00 -0500"},"country":null,"user-email":"samuelszs@aol.com","event":"AddLocations","longitude":-89.862907,"id":"a6kgrhuyfkl3","user-first-name":"Sherrie"},"type":"Feature","geometry":{"type":"Point","coordinates":[-89.862907,35.101627]}},{"properties":{"city":null,"lattitude":53.381157,"user-last-name":"Baker","ime":"8:39:28","state/province":null,"street-address":null,"date":{"end_time":"2010/03/29 00:00:00 -0400","original":"03/28/10","granularity":"day","time":"2010/03/28 00:00:00 -0400"},"country":null,"user-email":"lrd1960@yahoo.co.uk","event":"AddLocations","longitude":-1.471927,"id":"a6kgrhxth84z","user-first-name":"Keith"},"type":"Feature","geometry":{"type":"Point","coordinates":[-1.471927,53.381157]}},{"properties":{"city":null,"lattitude":47.464405,"user-last-name":null,"ime":"14:56:03","state/province":null,"street-address":null,"date":{"end_time":"2010/01/30 00:00:00 -0500","original":"01/29/10","granularity":"day","time":"2010/01/29 00:00:00 -0500"},"country":null,"user-email":"b-brave@gmx.net","event":"AddLocations","longitude":9.042609,"id":"a6kgrhrbfque","user-first-name":null},"type":"Feature","geometry":{"type":"Point","coordinates":[9.042609,47.464405]}},{"properties":{"city":null,"lattitude":55.169357,"user-last-name":"W","ime":"20:38:34","state/province":null,"street-address":null,"date":{"end_time":"2010/02/12 00:00:00 -0500","original":"02/11/10","granularity":"day","time":"2010/02/11 00:00:00 -0500"},"country":null,"user-email":"sitting_duck_8@hotmail.com","event":"AddLocations","longitude":-118.796074,"id":"a6kgrhtqvbq0","user-first-name":"Mark"},"type":"Feature","geometry":{"type":"Point","coordinates":[-118.796074,55.169357]}},{"properties":{"city":null,"lattitude":49.157738,"user-last-name":"P","ime":"8:18:21","state/province":null,"street-address":null,"date":{"end_time":"2009/11/28 00:00:00 -0500","original":"11/27/09","granularity":"day","time":"2009/11/27 00:00:00 -0500"},"country":null,"user-email":"dia@dccp.ca","event":"AddLocations","longitude":-122.781342,"id":"a6kgrhuiwehh","user-first-name":"Deanna"},"type":"Feature","geometry":{"type":"Point","coordinates":[-122.781342,49.157738]}},{"properties":{"city":null,"lattitude":35.197979,"user-last-name":"Samuels","ime":"14:20:22","state/province":null,"street-address":null,"date":{"end_time":"2010/02/11 00:00:00 -0500","original":"02/10/10","granularity":"day","time":"2010/02/10 00:00:00 -0500"},"country":null,"user-email":"samuelszs@aol.com","event":"AddLocations","longitude":-89.797394,"id":"a6kgrhnlxv2v","user-first-name":"Sherrie"},"type":"Feature","geometry":{"type":"Point","coordinates":[-89.797394,35.197979]}},{"properties":{"city":null,"lattitude":51.048717,"user-last-name":"Spradling","ime":"20:40:47","state/province":null,"street-address":null,"date":{"end_time":"2010/01/17 00:00:00 -0500","original":"01/16/10","granularity":"day","time":"2010/01/16 00:00:00 -0500"},"country":null,"user-email":"andrew@parkingmobility.com","event":"AddLocations","longitude":-114.072586,"id":"a6kgrhr6yc65","user-first-name":"Andrew"},"type":"Feature","geometry":{"type":"Point","coordinates":[-114.072586,51.048717]}},{"properties":{"city":null,"lattitude":35.140774,"user-last-name":"Samuels","ime":"0:37:14","state/province":null,"street-address":null,"date":{"end_time":"2010/02/11 00:00:00 -0500","original":"02/10/10","granularity":"day","time":"2010/02/10 00:00:00 -0500"},"country":null,"user-email":"samuelszs@aol.com","event":"AddLocations","longitude":-89.797302,"id":"a6kgrhpxu8tn","user-first-name":"Sherrie"},"type":"Feature","geometry":{"type":"Point","coordinates":[-89.797302,35.140774]}},{"properties":{"city":null,"lattitude":49.186031,"user-last-name":"Petraschuk","ime":"3:17:28","state/province":null,"street-address":null,"date":{"end_time":"2010/04/04 00:00:00 -0400","original":"04/03/10","granularity":"day","time":"2010/04/03 00:00:00 -0400"},"country":null,"user-email":"dtm4857@yahoo.ca","event":"AddLocations","longitude":-122.856483,"id":"a6kgrhmx2cmj","user-first-name":"Dan"},"type":"Feature","geometry":{"type":"Point","coordinates":[-122.856483,49.186031]}},{"properties":{"city":null,"lattitude":49.25872,"user-last-name":null,"ime":"21:31:30","state/province":null,"street-address":null,"date":{"end_time":"2010/04/05 00:00:00 -0400","original":"04/04/10","granularity":"day","time":"2010/04/04 00:00:00 -0400"},"country":null,"user-email":"ian@coalharbourgroup.com","event":"AddLocations","longitude":-123.222031,"id":"a6kgrhrpxto1","user-first-name":null},"type":"Feature","geometry":{"type":"Point","coordinates":[-123.222031,49.25872]}},{"properties":{"city":null,"lattitude":49.826683,"user-last-name":"Williams","ime":"22:35:44","state/province":null,"street-address":null,"date":{"end_time":"2010/03/06 00:00:00 -0500","original":"03/05/10","granularity":"day","time":"2010/03/05 00:00:00 -0500"},"country":null,"user-email":"va7mw@shaw.ca","event":"AddLocations","longitude":-119.629288,"id":"a6kgrhxrzdi9","user-first-name":"Merv"},"type":"Feature","geometry":{"type":"Point","coordinates":[-119.629288,49.826683]}},{"properties":{"city":null,"lattitude":30.290867,"user-last-name":"S","ime":"21:55:01","state/province":null,"street-address":null,"date":{"end_time":"2010/02/08 00:00:00 -0500","original":"02/07/10","granularity":"day","time":"2010/02/07 00:00:00 -0500"},"country":null,"user-email":"qqmech@gmail.com","event":"AddLocations","longitude":-97.739632,"id":"a6kgrhx6k9yy","user-first-name":"Mike"},"type":"Feature","geometry":{"type":"Point","coordinates":[-97.739632,30.290867]}},{"properties":{"city":null,"lattitude":35.131638,"user-last-name":"Samuels","ime":"3:36:17","state/province":null,"street-address":null,"date":{"end_time":"2010/02/11 00:00:00 -0500","original":"02/10/10","granularity":"day","time":"2010/02/10 00:00:00 -0500"},"country":null,"user-email":"samuelszs@aol.com","event":"AddLocations","longitude":-89.863335,"id":"a6kgrhts54jy","user-first-name":"Sherrie"},"type":"Feature","geometry":{"type":"Point","coordinates":[-89.863335,35.131638]}},{"properties":{"city":null,"lattitude":51.500427,"user-last-name":"Rodriguez amad","ime":"13:01:19","state/province":null,"street-address":null,"date":{"end_time":"2009/12/07 00:00:00 -0500","original":"12/06/09","granularity":"day","time":"2009/12/06 00:00:00 -0500"},"country":null,"user-email":"rodriguez78@hotmail.co.uk","event":"AddLocations","longitude":-0.195619,"id":"a6kgrhzr0tdz","user-first-name":"Carlos"},"type":"Feature","geometry":{"type":"Point","coordinates":[-0.195619,51.500427]}},{"properties":{"city":null,"lattitude":35.088005,"user-last-name":"Samuels","ime":"23:44:51","state/province":null,"street-address":null,"date":{"end_time":"2010/02/12 00:00:00 -0500","original":"02/11/10","granularity":"day","time":"2010/02/11 00:00:00 -0500"},"country":null,"user-email":"samuelszs@aol.com","event":"AddLocations","longitude":-89.799995,"id":"a6kgrhwqr02r","user-first-name":"Sherrie"},"type":"Feature","geometry":{"type":"Point","coordinates":[-89.799995,35.088005]}},{"properties":{"city":null,"lattitude":38.888916,"user-last-name":"Clayson","ime":"20:02:43","state/province":null,"street-address":null,"date":{"end_time":"2010/01/07 00:00:00 -0500","original":"01/06/10","granularity":"day","time":"2010/01/06 00:00:00 -0500"},"country":null,"user-email":"steve.clayson@mac.com","event":"AddLocations","longitude":-77.091431,"id":"a6kgri059pnm","user-first-name":"Steve"},"type":"Feature","geometry":{"type":"Point","coordinates":[-77.091431,38.888916]}},{"properties":{"city":null,"lattitude":37.328259,"user-last-name":null,"ime":"18:32:15","state/province":null,"street-address":null,"date":{"end_time":"2010/02/04 00:00:00 -0500","original":"02/03/10","granularity":"day","time":"2010/02/03 00:00:00 -0500"},"country":null,"user-email":"ian@coalharbourgroup.com","event":"AddLocations","longitude":-122.033501,"id":"a6kgrhtrdhr8","user-first-name":null},"type":"Feature","geometry":{"type":"Point","coordinates":[-122.033501,37.328259]}},{"properties":{"city":null,"lattitude":39.007843,"user-last-name":"Clayson","ime":"19:55:34","state/province":null,"street-address":null,"date":{"end_time":"2010/01/07 00:00:00 -0500","original":"01/06/10","granularity":"day","time":"2010/01/06 00:00:00 -0500"},"country":null,"user-email":"steve.clayson@mac.com","event":"AddLocations","longitude":-77.43618,"id":"a6kgri05f8m5","user-first-name":"Steve"},"type":"Feature","geometry":{"type":"Point","coordinates":[-77.43618,39.007843]}},{"properties":{"city":null,"lattitude":42.864822,"user-last-name":"Shertzer","ime":"12:17:51","state/province":null,"street-address":null,"date":{"end_time":"2010/03/02 00:00:00 -0500","original":"03/01/10","granularity":"day","time":"2010/03/01 00:00:00 -0500"},"country":null,"user-email":"daveshertzer@me.com","event":"AddLocations","longitude":-73.788429,"id":"a6kgrhrhu8qt","user-first-name":"Dave"},"type":"Feature","geometry":{"type":"Point","coordinates":[-73.788429,42.864822]}},{"properties":{"city":null,"lattitude":51.049816,"user-last-name":"Spradling","ime":"19:28:15","state/province":null,"street-address":null,"date":{"end_time":"2010/01/18 00:00:00 -0500","original":"01/17/10","granularity":"day","time":"2010/01/17 00:00:00 -0500"},"country":null,"user-email":"andrew@parkingmobility.com","event":"AddLocations","longitude":-114.080559,"id":"a6kgrhsjcz8z","user-first-name":"Andrew"},"type":"Feature","geometry":{"type":"Point","coordinates":[-114.080559,51.049816]}},{"properties":{"city":null,"lattitude":41.951584,"user-last-name":"Megown","ime":"2:55:38","state/province":null,"street-address":null,"date":{"end_time":"2010/01/16 00:00:00 -0500","original":"01/15/10","granularity":"day","time":"2010/01/15 00:00:00 -0500"},"country":null,"user-email":"jeffreymegown@aol.com","event":"AddLocations","longitude":-91.717468,"id":"a6kgrhtsqwt9","user-first-name":"Jeffrey"},"type":"Feature","geometry":{"type":"Point","coordinates":[-91.717468,41.951584]}},{"properties":{"city":null,"lattitude":33.813457,"user-last-name":"Valdez","ime":"15:29:25","state/province":null,"street-address":null,"date":{"end_time":"2009/12/15 00:00:00 -0500","original":"12/14/09","granularity":"day","time":"2009/12/14 00:00:00 -0500"},"country":null,"user-email":"mvaldez852@aol.com","event":"AddLocations","longitude":-118.346497,"id":"a6kgrhuf0b5s","user-first-name":"M"},"type":"Feature","geometry":{"type":"Point","coordinates":[-118.346497,33.813457]}},{"properties":{"city":null,"lattitude":59.340073,"user-last-name":"Lager","ime":"20:33:03","state/province":null,"street-address":null,"date":{"end_time":"2010/03/07 00:00:00 -0500","original":"03/06/10","granularity":"day","time":"2010/03/06 00:00:00 -0500"},"country":null,"user-email":"rullstolsfotograf@gmail.com","event":"AddLocations","longitude":18.092453,"id":"a6kgrhsvsfu5","user-first-name":"Jojo"},"type":"Feature","geometry":{"type":"Point","coordinates":[18.092453,59.340073]}},{"properties":{"city":null,"lattitude":52.237244,"user-last-name":"Redmond","ime":"9:26:10","state/province":null,"street-address":null,"date":{"end_time":"2010/03/08 00:00:00 -0500","original":"03/07/10","granularity":"day","time":"2010/03/07 00:00:00 -0500"},"country":null,"user-email":"david.redmond@ymail.com","event":"AddLocations","longitude":-0.895568,"id":"a6kgrhl38r04","user-first-name":"David"},"type":"Feature","geometry":{"type":"Point","coordinates":[-0.895568,52.237244]}},{"properties":{"city":null,"lattitude":33.802956,"user-last-name":"Paulsen","ime":"5:25:22","state/province":null,"street-address":null,"date":{"end_time":"2010/04/05 00:00:00 -0400","original":"04/04/10","granularity":"day","time":"2010/04/04 00:00:00 -0400"},"country":null,"user-email":"purse1@yahoo.com","event":"AddLocations","longitude":-117.927132,"id":"a6kgrhmljciw","user-first-name":"David"},"type":"Feature","geometry":{"type":"Point","coordinates":[-117.927132,33.802956]}},{"properties":{"city":null,"lattitude":49.164711,"user-last-name":null,"ime":"22:06:23","state/province":null,"street-address":null,"date":{"end_time":"2009/10/25 00:00:00 -0400","original":"10/24/09","granularity":"day","time":"2009/10/24 00:00:00 -0400"},"country":null,"user-email":"campbell.macdonald@gmail.com","event":"AddLocations","longitude":-123.14241,"id":"a6kgrhv92717","user-first-name":null},"type":"Feature","geometry":{"type":"Point","coordinates":[-123.14241,49.164711]}},{"properties":{"city":null,"lattitude":43.581421,"user-last-name":"Gibaud","ime":"3:05:03","state/province":null,"street-address":null,"date":{"end_time":"2009/12/21 00:00:00 -0500","original":"12/20/09","granularity":"day","time":"2009/12/20 00:00:00 -0500"},"country":null,"user-email":"gibaud.chris@gmail.com","event":"AddLocations","longitude":5.423783,"id":"a6kgrhq839vi","user-first-name":"Chris"},"type":"Feature","geometry":{"type":"Point","coordinates":[5.423783,43.581421]}},{"properties":{"city":null,"lattitude":35.094604,"user-last-name":"Samuels","ime":"3:50:46","state/province":null,"street-address":null,"date":{"end_time":"2010/02/11 00:00:00 -0500","original":"02/10/10","granularity":"day","time":"2010/02/10 00:00:00 -0500"},"country":null,"user-email":"samuelszs@aol.com","event":"AddLocations","longitude":-89.803398,"id":"a6kgrhyqhpw1","user-first-name":"Sherrie"},"type":"Feature","geometry":{"type":"Point","coordinates":[-89.803398,35.094604]}},{"properties":{"city":null,"lattitude":51.511082,"user-last-name":"Howe","ime":"21:44:03","state/province":null,"street-address":null,"date":{"end_time":"2009/12/07 00:00:00 -0500","original":"12/06/09","granularity":"day","time":"2009/12/06 00:00:00 -0500"},"country":null,"user-email":"garyhowe93@hotmail.com","event":"AddLocations","longitude":-0.131743,"id":"a6kgrhncrcv3","user-first-name":"Gary"},"type":"Feature","geometry":{"type":"Point","coordinates":[-0.131743,51.511082]}},{"properties":{"city":null,"lattitude":49.147945,"user-last-name":"P","ime":"8:11:32","state/province":null,"street-address":null,"date":{"end_time":"2009/11/28 00:00:00 -0500","original":"11/27/09","granularity":"day","time":"2009/11/27 00:00:00 -0500"},"country":null,"user-email":"dia@dccp.ca","event":"AddLocations","longitude":-122.766556,"id":"a6kgrhvm7uje","user-first-name":"Deanna"},"type":"Feature","geometry":{"type":"Point","coordinates":[-122.766556,49.147945]}},{"properties":{"city":null,"lattitude":38.888809,"user-last-name":"Clayson","ime":"20:02:52","state/province":null,"street-address":null,"date":{"end_time":"2010/01/07 00:00:00 -0500","original":"01/06/10","granularity":"day","time":"2010/01/06 00:00:00 -0500"},"country":null,"user-email":"steve.clayson@mac.com","event":"AddLocations","longitude":-77.091354,"id":"a6kgrhm8mz7c","user-first-name":"Steve"},"type":"Feature","geometry":{"type":"Point","coordinates":[-77.091354,38.888809]}},{"properties":{"city":null,"lattitude":49.220287,"user-last-name":"H","ime":"16:46:39","state/province":null,"street-address":null,"date":{"end_time":"2010/04/04 00:00:00 -0400","original":"04/03/10","granularity":"day","time":"2010/04/03 00:00:00 -0400"},"country":null,"user-email":"deanh@tsaj.com","event":"AddLocations","longitude":-122.671371,"id":"a6kgrhkbwyh8","user-first-name":"Dean"},"type":"Feature","geometry":{"type":"Point","coordinates":[-122.671371,49.220287]}},{"properties":{"city":null,"lattitude":51.04884,"user-last-name":"Spradling","ime":"20:41:10","state/province":null,"street-address":null,"date":{"end_time":"2010/01/17 00:00:00 -0500","original":"01/16/10","granularity":"day","time":"2010/01/16 00:00:00 -0500"},"country":null,"user-email":"andrew@parkingmobility.com","event":"AddLocations","longitude":-114.080032,"id":"a6kgrhr6jase","user-first-name":"Andrew"},"type":"Feature","geometry":{"type":"Point","coordinates":[-114.080032,51.04884]}},{"properties":{"city":null,"lattitude":35.137859,"user-last-name":"Samuels","ime":"0:30:24","state/province":null,"street-address":null,"date":{"end_time":"2010/02/11 00:00:00 -0500","original":"02/10/10","granularity":"day","time":"2010/02/10 00:00:00 -0500"},"country":null,"user-email":"samuelszs@aol.com","event":"AddLocations","longitude":-89.797867,"id":"a6kgrhxck18s","user-first-name":"Sherrie"},"type":"Feature","geometry":{"type":"Point","coordinates":[-89.797867,35.137859]}},{"properties":{"city":null,"lattitude":35.133831,"user-last-name":"Samuels","ime":"0:16:05","state/province":null,"street-address":null,"date":{"end_time":"2010/02/11 00:00:00 -0500","original":"02/10/10","granularity":"day","time":"2010/02/10 00:00:00 -0500"},"country":null,"user-email":"samuelszs@aol.com","event":"AddLocations","longitude":-89.963722,"id":"a6kgrhoc4z30","user-first-name":"Sherrie"},"type":"Feature","geometry":{"type":"Point","coordinates":[-89.963722,35.133831]}},{"properties":{"city":null,"lattitude":35.197678,"user-last-name":"Samuels","ime":"14:20:47","state/province":null,"street-address":null,"date":{"end_time":"2010/02/11 00:00:00 -0500","original":"02/10/10","granularity":"day","time":"2010/02/10 00:00:00 -0500"},"country":null,"user-email":"samuelszs@aol.com","event":"AddLocations","longitude":-89.797409,"id":"a6kgrhwafxpq","user-first-name":"Sherrie"},"type":"Feature","geometry":{"type":"Point","coordinates":[-89.797409,35.197678]}},{"properties":{"city":null,"lattitude":37.329861,"user-last-name":"Nachbaur","ime":"14:55:47","state/province":null,"street-address":null,"date":{"end_time":"2009/10/20 00:00:00 -0400","original":"10/19/09","granularity":"day","time":"2009/10/19 00:00:00 -0400"},"country":null,"user-email":"mike.nachbaur@decafninja.com","event":"AddLocations","longitude":-122.028198,"id":"a6kgrhrcm716","user-first-name":"Mike"},"type":"Feature","geometry":{"type":"Point","coordinates":[-122.028198,37.329861]}},{"properties":{"city":null,"lattitude":51.461094,"user-last-name":"Gerreyn","ime":"11:41:53","state/province":null,"street-address":null,"date":{"end_time":"2010/01/07 00:00:00 -0500","original":"01/06/10","granularity":"day","time":"2010/01/06 00:00:00 -0500"},"country":null,"user-email":"ann63gerreyn@googlemail.com","event":"AddLocations","longitude":-0.010107,"id":"a6kgrhxfv68f","user-first-name":"Ann-Marie"},"type":"Feature","geometry":{"type":"Point","coordinates":[-0.010107,51.461094]}},{"properties":{"city":null,"lattitude":51.051373,"user-last-name":"Spradling","ime":"18:38:20","state/province":null,"street-address":null,"date":{"end_time":"2010/01/18 00:00:00 -0500","original":"01/17/10","granularity":"day","time":"2010/01/17 00:00:00 -0500"},"country":null,"user-email":"andrew@parkingmobility.com","event":"AddLocations","longitude":-114.065117,"id":"a6kgrho3k00r","user-first-name":"Andrew"},"type":"Feature","geometry":{"type":"Point","coordinates":[-114.065117,51.051373]}},{"properties":{"city":null,"lattitude":49.692322,"user-last-name":"Chalkley","ime":"21:16:18","state/province":null,"street-address":null,"date":{"end_time":"2010/03/25 00:00:00 -0400","original":"03/24/10","granularity":"day","time":"2010/03/24 00:00:00 -0400"},"country":null,"user-email":"kitty_nikki@live.ca","event":"AddLocations","longitude":-112.842392,"id":"a6kgrhyv1qw0","user-first-name":"Nikki"},"type":"Feature","geometry":{"type":"Point","coordinates":[-112.842392,49.692322]}},{"properties":{"city":null,"lattitude":51.049786,"user-last-name":"Spradling","ime":"21:09:52","state/province":null,"street-address":null,"date":{"end_time":"2010/01/17 00:00:00 -0500","original":"01/16/10","granularity":"day","time":"2010/01/16 00:00:00 -0500"},"country":null,"user-email":"andrew@parkingmobility.com","event":"AddLocations","longitude":-114.072571,"id":"a6kgrhs7gfo3","user-first-name":"Andrew"},"type":"Feature","geometry":{"type":"Point","coordinates":[-114.072571,51.049786]}},{"properties":{"city":null,"lattitude":44.486725,"user-last-name":"M","ime":"5:00:11","state/province":null,"street-address":null,"date":{"end_time":"2010/02/25 00:00:00 -0500","original":"02/24/10","granularity":"day","time":"2010/02/24 00:00:00 -0500"},"country":null,"user-email":"bill@disabilitiesunlimited.org","event":"AddLocations","longitude":-88.06636,"id":"a6kgrhy79why","user-first-name":"Bill"},"type":"Feature","geometry":{"type":"Point","coordinates":[-88.06636,44.486725]}},{"properties":{"city":null,"lattitude":35.120518,"user-last-name":"Samuels","ime":"21:50:38","state/province":null,"street-address":null,"date":{"end_time":"2010/02/12 00:00:00 -0500","original":"02/11/10","granularity":"day","time":"2010/02/11 00:00:00 -0500"},"country":null,"user-email":"samuelszs@aol.com","event":"AddLocations","longitude":-89.887054,"id":"a6kgrhwz8ucj","user-first-name":"Sherrie"},"type":"Feature","geometry":{"type":"Point","coordinates":[-89.887054,35.120518]}},{"properties":{"city":null,"lattitude":51.263889,"user-last-name":"Eastwood","ime":"23:15:01","state/province":null,"street-address":null,"date":{"end_time":"2009/12/27 00:00:00 -0500","original":"12/26/09","granularity":"day","time":"2009/12/26 00:00:00 -0500"},"country":null,"user-email":"martin1983@live.co.uk","event":"AddLocations","longitude":-1.084954,"id":"a6kgrhk7yyqo","user-first-name":"Martin"},"type":"Feature","geometry":{"type":"Point","coordinates":[-1.084954,51.263889]}},{"properties":{"city":null,"lattitude":51.051174,"user-last-name":"Spradling","ime":"18:45:33","state/province":null,"street-address":null,"date":{"end_time":"2010/01/18 00:00:00 -0500","original":"01/17/10","granularity":"day","time":"2010/01/17 00:00:00 -0500"},"country":null,"user-email":"andrew@parkingmobility.com","event":"AddLocations","longitude":-114.063065,"id":"a6kgrhqnzly5","user-first-name":"Andrew"},"type":"Feature","geometry":{"type":"Point","coordinates":[-114.063065,51.051174]}},{"properties":{"city":null,"lattitude":35.100304,"user-last-name":"Samuels","ime":"14:24:26","state/province":null,"street-address":null,"date":{"end_time":"2010/02/08 00:00:00 -0500","original":"02/07/10","granularity":"day","time":"2010/02/07 00:00:00 -0500"},"country":null,"user-email":"samuelszs@aol.com","event":"AddLocations","longitude":-89.84803,"id":"a6kgrhpjwbov","user-first-name":"Sherrie"},"type":"Feature","geometry":{"type":"Point","coordinates":[-89.84803,35.100304]}},{"properties":{"city":null,"lattitude":52.771027,"user-last-name":"Toone","ime":"7:09:41","state/province":null,"street-address":null,"date":{"end_time":"2009/12/02 00:00:00 -0500","original":"12/01/09","granularity":"day","time":"2009/12/01 00:00:00 -0500"},"country":null,"user-email":"jenny_toone@btinternet.com","event":"AddLocations","longitude":1.514922,"id":"a6kgrhxkelah","user-first-name":"Jenny"},"type":"Feature","geometry":{"type":"Point","coordinates":[1.514922,52.771027]}},{"properties":{"city":null,"lattitude":-33.8927,"user-last-name":"Paulsen","ime":"9:37:18","state/province":null,"street-address":null,"date":{"end_time":"2010/04/04 00:00:00 -0400","original":"04/03/10","granularity":"day","time":"2010/04/03 00:00:00 -0400"},"country":null,"user-email":"purse1@yahoo.com","event":"AddLocations","longitude":151.202179,"id":"a6kgrhlqht6l","user-first-name":"David"},"type":"Feature","geometry":{"type":"Point","coordinates":[151.202179,-33.8927]}},{"properties":{"city":null,"lattitude":51.05027,"user-last-name":"Spradling","ime":"18:52:44","state/province":null,"street-address":null,"date":{"end_time":"2010/01/18 00:00:00 -0500","original":"01/17/10","granularity":"day","time":"2010/01/17 00:00:00 -0500"},"country":null,"user-email":"andrew@parkingmobility.com","event":"AddLocations","longitude":-114.062096,"id":"a6kgrhqjf7vw","user-first-name":"Andrew"},"type":"Feature","geometry":{"type":"Point","coordinates":[-114.062096,51.05027]}},{"properties":{"city":null,"lattitude":49.157017,"user-last-name":"P","ime":"8:18:54","state/province":null,"street-address":null,"date":{"end_time":"2009/11/28 00:00:00 -0500","original":"11/27/09","granularity":"day","time":"2009/11/27 00:00:00 -0500"},"country":null,"user-email":"dia@dccp.ca","event":"AddLocations","longitude":-122.781578,"id":"a6kgrhwp0vx6","user-first-name":"Deanna"},"type":"Feature","geometry":{"type":"Point","coordinates":[-122.781578,49.157017]}},{"properties":{"city":null,"lattitude":35.149349,"user-last-name":"Samuels","ime":"0:23:24","state/province":null,"street-address":null,"date":{"end_time":"2010/02/11 00:00:00 -0500","original":"02/10/10","granularity":"day","time":"2010/02/10 00:00:00 -0500"},"country":null,"user-email":"samuelszs@aol.com","event":"AddLocations","longitude":-89.994186,"id":"a6kgrhqpz24p","user-first-name":"Sherrie"},"type":"Feature","geometry":{"type":"Point","coordinates":[-89.994186,35.149349]}},{"properties":{"city":null,"lattitude":35.087891,"user-last-name":"Samuels","ime":"23:45:15","state/province":null,"street-address":null,"date":{"end_time":"2010/02/12 00:00:00 -0500","original":"02/11/10","granularity":"day","time":"2010/02/11 00:00:00 -0500"},"country":null,"user-email":"samuelszs@aol.com","event":"AddLocations","longitude":-89.800079,"id":"a6kgrhrpbaou","user-first-name":"Sherrie"},"type":"Feature","geometry":{"type":"Point","coordinates":[-89.800079,35.087891]}},{"properties":{"city":null,"lattitude":53.381439,"user-last-name":"Baker","ime":"20:06:44","state/province":null,"street-address":null,"date":{"end_time":"2010/01/16 00:00:00 -0500","original":"01/15/10","granularity":"day","time":"2010/01/15 00:00:00 -0500"},"country":null,"user-email":"lrd1960@yahoo.co.uk","event":"AddLocations","longitude":-1.492832,"id":"a6kgrhnvx9zu","user-first-name":"Keith"},"type":"Feature","geometry":{"type":"Point","coordinates":[-1.492832,53.381439]}},{"properties":{"city":null,"lattitude":49.27684,"user-last-name":null,"ime":"4:15:16","state/province":null,"street-address":null,"date":{"end_time":"2009/10/23 00:00:00 -0400","original":"10/22/09","granularity":"day","time":"2009/10/22 00:00:00 -0400"},"country":null,"user-email":"campbell.macdonald@gmail.com","event":"AddLocations","longitude":-123.13485,"id":"a6kgrhnloly2","user-first-name":null},"type":"Feature","geometry":{"type":"Point","coordinates":[-123.13485,49.27684]}},{"properties":{"city":null,"lattitude":30.269386,"user-last-name":"Spradling","ime":"17:10:40","state/province":null,"street-address":null,"date":{"end_time":"2010/03/27 00:00:00 -0400","original":"03/26/10","granularity":"day","time":"2010/03/26 00:00:00 -0400"},"country":null,"user-email":"andrew@parkingmobility.com","event":"AddLocations","longitude":-97.730431,"id":"a6kgrhow49o7","user-first-name":"Andrew"},"type":"Feature","geometry":{"type":"Point","coordinates":[-97.730431,30.269386]}},{"properties":{"city":null,"lattitude":35.048306,"user-last-name":"Samuels","ime":"3:43:51","state/province":null,"street-address":null,"date":{"end_time":"2010/02/11 00:00:00 -0500","original":"02/10/10","granularity":"day","time":"2010/02/10 00:00:00 -0500"},"country":null,"user-email":"samuelszs@aol.com","event":"AddLocations","longitude":-89.692627,"id":"a6kgrholjjwy","user-first-name":"Sherrie"},"type":"Feature","geometry":{"type":"Point","coordinates":[-89.692627,35.048306]}},{"properties":{"city":null,"lattitude":35.113682,"user-last-name":"Samuels","ime":"14:38:49","state/province":null,"street-address":null,"date":{"end_time":"2010/02/08 00:00:00 -0500","original":"02/07/10","granularity":"day","time":"2010/02/07 00:00:00 -0500"},"country":null,"user-email":"samuelszs@aol.com","event":"AddLocations","longitude":-89.894424,"id":"a6kgrhpe526q","user-first-name":"Sherrie"},"type":"Feature","geometry":{"type":"Point","coordinates":[-89.894424,35.113682]}},{"properties":{"city":null,"lattitude":42.028328,"user-last-name":"Megown","ime":"0:42:19","state/province":null,"street-address":null,"date":{"end_time":"2010/01/14 00:00:00 -0500","original":"01/13/10","granularity":"day","time":"2010/01/13 00:00:00 -0500"},"country":null,"user-email":"jeffreymegown@aol.com","event":"AddLocations","longitude":-91.628624,"id":"a6kgrhtzckpn","user-first-name":"Jeffrey"},"type":"Feature","geometry":{"type":"Point","coordinates":[-91.628624,42.028328]}},{"properties":{"city":null,"lattitude":51.049995,"user-last-name":"Spradling","ime":"18:59:58","state/province":null,"street-address":null,"date":{"end_time":"2010/01/18 00:00:00 -0500","original":"01/17/10","granularity":"day","time":"2010/01/17 00:00:00 -0500"},"country":null,"user-email":"andrew@parkingmobility.com","event":"AddLocations","longitude":-114.05777,"id":"a6kgrhwq9iyn","user-first-name":"Andrew"},"type":"Feature","geometry":{"type":"Point","coordinates":[-114.05777,51.049995]}},{"properties":{"city":null,"lattitude":35.140827,"user-last-name":"Samuels","ime":"0:37:49","state/province":null,"street-address":null,"date":{"end_time":"2010/02/11 00:00:00 -0500","original":"02/10/10","granularity":"day","time":"2010/02/10 00:00:00 -0500"},"country":null,"user-email":"samuelszs@aol.com","event":"AddLocations","longitude":-89.79734,"id":"a6kgrhuurds9","user-first-name":"Sherrie"},"type":"Feature","geometry":{"type":"Point","coordinates":[-89.79734,35.140827]}},{"properties":{"city":null,"lattitude":48.210777,"user-last-name":"Grass","ime":"17:24:35","state/province":null,"street-address":null,"date":{"end_time":"2010/01/14 00:00:00 -0500","original":"01/13/10","granularity":"day","time":"2010/01/13 00:00:00 -0500"},"country":null,"user-email":"friedrich.grass@chello.at","event":"AddLocations","longitude":16.381243,"id":"a6kgrhzlk30f","user-first-name":"Friedrich"},"type":"Feature","geometry":{"type":"Point","coordinates":[16.381243,48.210777]}},{"properties":{"city":null,"lattitude":30.322485,"user-last-name":"S","ime":"21:34:10","state/province":null,"street-address":null,"date":{"end_time":"2010/02/08 00:00:00 -0500","original":"02/07/10","granularity":"day","time":"2010/02/07 00:00:00 -0500"},"country":null,"user-email":"qqmech@gmail.com","event":"AddLocations","longitude":-97.724556,"id":"a6kgrhl3ajrr","user-first-name":"Mike"},"type":"Feature","geometry":{"type":"Point","coordinates":[-97.724556,30.322485]}},{"properties":{"city":null,"lattitude":51.052448,"user-last-name":"Spradling","ime":"17:15:19","state/province":null,"street-address":null,"date":{"end_time":"2010/02/15 00:00:00 -0500","original":"02/14/10","granularity":"day","time":"2010/02/14 00:00:00 -0500"},"country":null,"user-email":"andrew@parkingmobility.com","event":"AddLocations","longitude":-114.088219,"id":"a6kgrhtfd9rq","user-first-name":"Andrew"},"type":"Feature","geometry":{"type":"Point","coordinates":[-114.088219,51.052448]}},{"properties":{"city":null,"lattitude":35.197514,"user-last-name":"Samuels","ime":"14:21:07","state/province":null,"street-address":null,"date":{"end_time":"2010/02/11 00:00:00 -0500","original":"02/10/10","granularity":"day","time":"2010/02/10 00:00:00 -0500"},"country":null,"user-email":"samuelszs@aol.com","event":"AddLocations","longitude":-89.797424,"id":"a6kgrhp7h3wu","user-first-name":"Sherrie"},"type":"Feature","geometry":{"type":"Point","coordinates":[-89.797424,35.197514]}},{"properties":{"city":null,"lattitude":37.329582,"user-last-name":"Nachbaur","ime":"14:48:58","state/province":null,"street-address":null,"date":{"end_time":"2009/10/20 00:00:00 -0400","original":"10/19/09","granularity":"day","time":"2009/10/19 00:00:00 -0400"},"country":null,"user-email":"mike.nachbaur@decafninja.com","event":"AddLocations","longitude":-122.03006,"id":"a6kgrhzla5hd","user-first-name":"Mike"},"type":"Feature","geometry":{"type":"Point","coordinates":[-122.03006,37.329582]}},{"properties":{"city":null,"lattitude":35.134098,"user-last-name":"Samuels","ime":"0:16:32","state/province":null,"street-address":null,"date":{"end_time":"2010/02/11 00:00:00 -0500","original":"02/10/10","granularity":"day","time":"2010/02/10 00:00:00 -0500"},"country":null,"user-email":"samuelszs@aol.com","event":"AddLocations","longitude":-89.964027,"id":"a6kgrhxpx0qf","user-first-name":"Sherrie"},"type":"Feature","geometry":{"type":"Point","coordinates":[-89.964027,35.134098]}},{"properties":{"city":null,"lattitude":51.492554,"user-last-name":"Rodriguez amad","ime":"19:10:41","state/province":null,"street-address":null,"date":{"end_time":"2009/12/10 00:00:00 -0500","original":"12/09/09","granularity":"day","time":"2009/12/09 00:00:00 -0500"},"country":null,"user-email":"rodriguez78@hotmail.co.uk","event":"AddLocations","longitude":-0.159688,"id":"a6kgrhljbe63","user-first-name":"Carlos"},"type":"Feature","geometry":{"type":"Point","coordinates":[-0.159688,51.492554]}},{"properties":{"city":null,"lattitude":49.683884,"user-last-name":"Chalkley","ime":"14:25:03","state/province":null,"street-address":null,"date":{"end_time":"2010/03/16 00:00:00 -0400","original":"03/15/10","granularity":"day","time":"2010/03/15 00:00:00 -0400"},"country":null,"user-email":"kitty_nikki@live.ca","event":"AddLocations","longitude":-112.825806,"id":"a6kgrhk9z7vb","user-first-name":"Nikki"},"type":"Feature","geometry":{"type":"Point","coordinates":[-112.825806,49.683884]}},{"properties":{"city":null,"lattitude":51.481037,"user-last-name":"Brazil","ime":"22:26:20","state/province":null,"street-address":null,"date":{"end_time":"2009/12/02 00:00:00 -0500","original":"12/01/09","granularity":"day","time":"2009/12/01 00:00:00 -0500"},"country":null,"user-email":"claire.brazil@sky.com","event":"AddLocations","longitude":-0.60976,"id":"a6kgrhpvcjtp","user-first-name":"Claire"},"type":"Feature","geometry":{"type":"Point","coordinates":[-0.60976,51.481037]}},{"properties":{"city":null,"lattitude":35.159714,"user-last-name":"Samuels","ime":"21:57:07","state/province":null,"street-address":null,"date":{"end_time":"2010/02/25 00:00:00 -0500","original":"02/24/10","granularity":"day","time":"2010/02/24 00:00:00 -0500"},"country":null,"user-email":"samuelszs@aol.com","event":"AddLocations","longitude":-89.793755,"id":"a6kgrhxdj3u8","user-first-name":"Sherrie"},"type":"Feature","geometry":{"type":"Point","coordinates":[-89.793755,35.159714]}},{"properties":{"city":null,"lattitude":49.157322,"user-last-name":"P","ime":"8:19:18","state/province":null,"street-address":null,"date":{"end_time":"2009/11/28 00:00:00 -0500","original":"11/27/09","granularity":"day","time":"2009/11/27 00:00:00 -0500"},"country":null,"user-email":"dia@dccp.ca","event":"AddLocations","longitude":-122.781967,"id":"a6kgrhucufv2","user-first-name":"Deanna"},"type":"Feature","geometry":{"type":"Point","coordinates":[-122.781967,49.157322]}},{"properties":{"city":null,"lattitude":42.033081,"user-last-name":"Megown","ime":"15:51:52","state/province":null,"street-address":null,"date":{"end_time":"2010/01/20 00:00:00 -0500","original":"01/19/10","granularity":"day","time":"2010/01/19 00:00:00 -0500"},"country":null,"user-email":"jeffreymegown@aol.com","event":"AddLocations","longitude":-91.606064,"id":"a6kgrhwp7eg0","user-first-name":"Jeffrey"},"type":"Feature","geometry":{"type":"Point","coordinates":[-91.606064,42.033081]}},{"properties":{"city":null,"lattitude":49.220722,"user-last-name":"H","ime":"16:47:17","state/province":null,"street-address":null,"date":{"end_time":"2010/04/04 00:00:00 -0400","original":"04/03/10","granularity":"day","time":"2010/04/03 00:00:00 -0400"},"country":null,"user-email":"deanh@tsaj.com","event":"AddLocations","longitude":-122.672462,"id":"a6kgrhlcvi3q","user-first-name":"Dean"},"type":"Feature","geometry":{"type":"Point","coordinates":[-122.672462,49.220722]}},{"properties":{"city":null,"lattitude":35.09914,"user-last-name":"Samuels","ime":"14:10:39","state/province":null,"street-address":null,"date":{"end_time":"2010/02/08 00:00:00 -0500","original":"02/07/10","granularity":"day","time":"2010/02/07 00:00:00 -0500"},"country":null,"user-email":"samuelszs@aol.com","event":"AddLocations","longitude":-89.84639,"id":"a6kgrhq6d1a7","user-first-name":"Sherrie"},"type":"Feature","geometry":{"type":"Point","coordinates":[-89.84639,35.09914]}},{"properties":{"city":null,"lattitude":43.419998,"user-last-name":"Gibaud","ime":"14:17:28","state/province":null,"street-address":null,"date":{"end_time":"2009/12/22 00:00:00 -0500","original":"12/21/09","granularity":"day","time":"2009/12/21 00:00:00 -0500"},"country":null,"user-email":"gibaud.chris@gmail.com","event":"AddLocations","longitude":5.362016,"id":"a6kgrhxotk3i","user-first-name":"Chris"},"type":"Feature","geometry":{"type":"Point","coordinates":[5.362016,43.419998]}},{"properties":{"city":null,"lattitude":35.140938,"user-last-name":"Samuels","ime":"0:38:15","state/province":null,"street-address":null,"date":{"end_time":"2010/02/11 00:00:00 -0500","original":"02/10/10","granularity":"day","time":"2010/02/10 00:00:00 -0500"},"country":null,"user-email":"samuelszs@aol.com","event":"AddLocations","longitude":-89.79731,"id":"a6kgrhysh6g3","user-first-name":"Sherrie"},"type":"Feature","geometry":{"type":"Point","coordinates":[-89.79731,35.140938]}},{"properties":{"city":null,"lattitude":28.343039,"user-last-name":"Prather","ime":"6:36:57","state/province":null,"street-address":null,"date":{"end_time":"2009/12/12 00:00:00 -0500","original":"12/11/09","granularity":"day","time":"2009/12/11 00:00:00 -0500"},"country":null,"user-email":"parking.iphone2@prather.org","event":"AddLocations","longitude":-81.385872,"id":"a6kgrhoixqce","user-first-name":"Chris"},"type":"Feature","geometry":{"type":"Point","coordinates":[-81.385872,28.343039]}},{"properties":{"city":null,"lattitude":35.159172,"user-last-name":"Samuels","ime":"20:45:44","state/province":null,"street-address":null,"date":{"end_time":"2010/02/25 00:00:00 -0500","original":"02/24/10","granularity":"day","time":"2010/02/24 00:00:00 -0500"},"country":null,"user-email":"samuelszs@aol.com","event":"AddLocations","longitude":-89.793831,"id":"a6kgrhvavhyn","user-first-name":"Sherrie"},"type":"Feature","geometry":{"type":"Point","coordinates":[-89.793831,35.159172]}},{"properties":{"city":null,"lattitude":37.328907,"user-last-name":"Nachbaur","ime":"6:36:57","state/province":null,"street-address":null,"date":{"end_time":"2009/12/12 00:00:00 -0500","original":"12/11/09","granularity":"day","time":"2009/12/11 00:00:00 -0500"},"country":null,"user-email":"michael@nachbaur.com","event":"AddLocations","longitude":-122.031052,"id":"a6kgrhxf4itk","user-first-name":"Mike"},"type":"Feature","geometry":{"type":"Point","coordinates":[-122.031052,37.328907]}},{"properties":{"city":null,"lattitude":30.29862,"user-last-name":"Spradling","ime":"18:39:33","state/province":null,"street-address":null,"date":{"end_time":"2010/03/31 00:00:00 -0400","original":"03/30/10","granularity":"day","time":"2010/03/30 00:00:00 -0400"},"country":null,"user-email":"andrew@parkingmobility.com","event":"AddLocations","longitude":-97.717957,"id":"a6kgri0fc2lq","user-first-name":"Andrew"},"type":"Feature","geometry":{"type":"Point","coordinates":[-97.717957,30.29862]}},{"properties":{"city":null,"lattitude":51.051422,"user-last-name":"Spradling","ime":"20:06:08","state/province":null,"street-address":null,"date":{"end_time":"2010/01/17 00:00:00 -0500","original":"01/16/10","granularity":"day","time":"2010/01/16 00:00:00 -0500"},"country":null,"user-email":"andrew@parkingmobility.com","event":"AddLocations","longitude":-114.078308,"id":"a6kgrhpxqalp","user-first-name":"Andrew"},"type":"Feature","geometry":{"type":"Point","coordinates":[-114.078308,51.051422]}},{"properties":{"city":null,"lattitude":41.980247,"user-last-name":"Megown","ime":"18:31:57","state/province":null,"street-address":null,"date":{"end_time":"2010/01/12 00:00:00 -0500","original":"01/11/10","granularity":"day","time":"2010/01/11 00:00:00 -0500"},"country":null,"user-email":"jeffreymegown@aol.com","event":"AddLocations","longitude":-91.657219,"id":"a6kgrhy8f93q","user-first-name":"Jeffrey"},"type":"Feature","geometry":{"type":"Point","coordinates":[-91.657219,41.980247]}},{"properties":{"city":null,"lattitude":49.157303,"user-last-name":"P","ime":"8:19:36","state/province":null,"street-address":null,"date":{"end_time":"2009/11/28 00:00:00 -0500","original":"11/27/09","granularity":"day","time":"2009/11/27 00:00:00 -0500"},"country":null,"user-email":"dia@dccp.ca","event":"AddLocations","longitude":-122.781868,"id":"a6kgrhnxrpoe","user-first-name":"Deanna"},"type":"Feature","geometry":{"type":"Point","coordinates":[-122.781868,49.157303]}},{"properties":{"city":null,"lattitude":51.049057,"user-last-name":"Spradling","ime":"0:25:15","state/province":null,"street-address":null,"date":{"end_time":"2010/02/04 00:00:00 -0500","original":"02/03/10","granularity":"day","time":"2010/02/03 00:00:00 -0500"},"country":null,"user-email":"andrew@parkingmobility.com","event":"AddLocations","longitude":-114.099823,"id":"a6kgrhzeql1m","user-first-name":"Andrew"},"type":"Feature","geometry":{"type":"Point","coordinates":[-114.099823,51.049057]}},{"properties":{"city":null,"lattitude":49.281021,"user-last-name":null,"ime":"9:29:43","state/province":null,"street-address":null,"date":{"end_time":"2009/10/18 00:00:00 -0400","original":"10/17/09","granularity":"day","time":"2009/10/17 00:00:00 -0400"},"country":null,"user-email":"Campbell.macdonald@gmail.com","event":"AddLocations","longitude":-123.131889,"id":"a6kgrhn8t7w7","user-first-name":null},"type":"Feature","geometry":{"type":"Point","coordinates":[-123.131889,49.281021]}},{"properties":{"city":null,"lattitude":35.120556,"user-last-name":"Samuels","ime":"17:25:24","state/province":null,"street-address":null,"date":{"end_time":"2010/02/13 00:00:00 -0500","original":"02/12/10","granularity":"day","time":"2010/02/12 00:00:00 -0500"},"country":null,"user-email":"samuelszs@aol.com","event":"AddLocations","longitude":-89.875153,"id":"a6kgrhlcr8qy","user-first-name":"Sherrie"},"type":"Feature","geometry":{"type":"Point","coordinates":[-89.875153,35.120556]}},{"properties":{"city":null,"lattitude":44.484486,"user-last-name":"M","ime":"5:01:03","state/province":null,"street-address":null,"date":{"end_time":"2010/02/25 00:00:00 -0500","original":"02/24/10","granularity":"day","time":"2010/02/24 00:00:00 -0500"},"country":null,"user-email":"bill@disabilitiesunlimited.org","event":"AddLocations","longitude":-88.062569,"id":"a6kgrhq3bgvv","user-first-name":"Bill"},"type":"Feature","geometry":{"type":"Point","coordinates":[-88.062569,44.484486]}},{"properties":{"city":null,"lattitude":35.101376,"user-last-name":"Samuels","ime":"16:15:03","state/province":null,"street-address":null,"date":{"end_time":"2010/02/12 00:00:00 -0500","original":"02/11/10","granularity":"day","time":"2010/02/11 00:00:00 -0500"},"country":null,"user-email":"samuelszs@aol.com","event":"AddLocations","longitude":-89.862701,"id":"a6kgrhxzdb9m","user-first-name":"Sherrie"},"type":"Feature","geometry":{"type":"Point","coordinates":[-89.862701,35.101376]}},{"properties":{"city":null,"lattitude":35.19022,"user-last-name":"Samuels","ime":"0:45:40","state/province":null,"street-address":null,"date":{"end_time":"2010/02/11 00:00:00 -0500","original":"02/10/10","granularity":"day","time":"2010/02/10 00:00:00 -0500"},"country":null,"user-email":"samuelszs@aol.com","event":"AddLocations","longitude":-89.795647,"id":"a6kgrho7wiv9","user-first-name":"Sherrie"},"type":"Feature","geometry":{"type":"Point","coordinates":[-89.795647,35.19022]}},{"properties":{"city":null,"lattitude":51.486813,"user-last-name":"Rodriguez amad","ime":"15:05:23","state/province":null,"street-address":null,"date":{"end_time":"2009/12/06 00:00:00 -0500","original":"12/05/09","granularity":"day","time":"2009/12/05 00:00:00 -0500"},"country":null,"user-email":"rodriguez78@hotmail.co.uk","event":"AddLocations","longitude":-0.167855,"id":"a6kgrhy0zruy","user-first-name":"Carlos"},"type":"Feature","geometry":{"type":"Point","coordinates":[-0.167855,51.486813]}},{"properties":{"city":null,"lattitude":35.196983,"user-last-name":"Samuels","ime":"14:21:45","state/province":null,"street-address":null,"date":{"end_time":"2010/02/11 00:00:00 -0500","original":"02/10/10","granularity":"day","time":"2010/02/10 00:00:00 -0500"},"country":null,"user-email":"samuelszs@aol.com","event":"AddLocations","longitude":-89.797455,"id":"a6kgrhsez6f2","user-first-name":"Sherrie"},"type":"Feature","geometry":{"type":"Point","coordinates":[-89.797455,35.196983]}},{"properties":{"city":null,"lattitude":38.959679,"user-last-name":"Clayson","ime":"14:52:30","state/province":null,"street-address":null,"date":{"end_time":"2010/01/04 00:00:00 -0500","original":"01/03/10","granularity":"day","time":"2010/01/03 00:00:00 -0500"},"country":null,"user-email":"steve.clayson@mac.com","event":"AddLocations","longitude":-77.35627,"id":"a6kgrhlzcew7","user-first-name":"Steve"},"type":"Feature","geometry":{"type":"Point","coordinates":[-77.35627,38.959679]}},{"properties":{"city":null,"lattitude":43.419693,"user-last-name":"Gibaud","ime":"14:17:50","state/province":null,"street-address":null,"date":{"end_time":"2009/12/22 00:00:00 -0500","original":"12/21/09","granularity":"day","time":"2009/12/21 00:00:00 -0500"},"country":null,"user-email":"gibaud.chris@gmail.com","event":"AddLocations","longitude":5.361738,"id":"a6kgrhopgocs","user-first-name":"Chris"},"type":"Feature","geometry":{"type":"Point","coordinates":[5.361738,43.419693]}},{"properties":{"city":null,"lattitude":35.160328,"user-last-name":"Samuels","ime":"21:57:38","state/province":null,"street-address":null,"date":{"end_time":"2010/02/25 00:00:00 -0500","original":"02/24/10","granularity":"day","time":"2010/02/24 00:00:00 -0500"},"country":null,"user-email":"samuelszs@aol.com","event":"AddLocations","longitude":-89.793678,"id":"a6kgrhrb0nht","user-first-name":"Sherrie"},"type":"Feature","geometry":{"type":"Point","coordinates":[-89.793678,35.160328]}},{"properties":{"city":null,"lattitude":51.491898,"user-last-name":"Rodriguez amad","ime":"19:11:17","state/province":null,"street-address":null,"date":{"end_time":"2009/12/10 00:00:00 -0500","original":"12/09/09","granularity":"day","time":"2009/12/09 00:00:00 -0500"},"country":null,"user-email":"rodriguez78@hotmail.co.uk","event":"AddLocations","longitude":-0.159624,"id":"a6kgrhqzgyo2","user-first-name":"Carlos"},"type":"Feature","geometry":{"type":"Point","coordinates":[-0.159624,51.491898]}},{"properties":{"city":null,"lattitude":38.888435,"user-last-name":"Clayson","ime":"20:03:59","state/province":null,"street-address":null,"date":{"end_time":"2010/01/07 00:00:00 -0500","original":"01/06/10","granularity":"day","time":"2010/01/06 00:00:00 -0500"},"country":null,"user-email":"steve.clayson@mac.com","event":"AddLocations","longitude":-77.090988,"id":"a6kgrhspjvk8","user-first-name":"Steve"},"type":"Feature","geometry":{"type":"Point","coordinates":[-77.090988,38.888435]}},{"properties":{"city":null,"lattitude":35.062374,"user-last-name":"Samuels","ime":"14:50:28","state/province":null,"street-address":null,"date":{"end_time":"2010/02/11 00:00:00 -0500","original":"02/10/10","granularity":"day","time":"2010/02/10 00:00:00 -0500"},"country":null,"user-email":"samuelszs@aol.com","event":"AddLocations","longitude":-90.129585,"id":"a6kgrhnu1mbm","user-first-name":"Sherrie"},"type":"Feature","geometry":{"type":"Point","coordinates":[-90.129585,35.062374]}},{"properties":{"city":null,"lattitude":47.421349,"user-last-name":null,"ime":"15:04:43","state/province":null,"street-address":null,"date":{"end_time":"2010/01/30 00:00:00 -0500","original":"01/29/10","granularity":"day","time":"2010/01/29 00:00:00 -0500"},"country":null,"user-email":"b-brave@gmx.net","event":"AddLocations","longitude":9.370173,"id":"a6kgrhx3ub0h","user-first-name":null},"type":"Feature","geometry":{"type":"Point","coordinates":[9.370173,47.421349]}},{"properties":{"city":null,"lattitude":51.488514,"user-last-name":"Bell","ime":"17:07:46","state/province":null,"street-address":null,"date":{"end_time":"2010/02/22 00:00:00 -0500","original":"02/21/10","granularity":"day","time":"2010/02/21 00:00:00 -0500"},"country":null,"user-email":"mwbell68@gmail.com","event":"AddLocations","longitude":-0.165644,"id":"a6kgrhuuifp7","user-first-name":"Mike"},"type":"Feature","geometry":{"type":"Point","coordinates":[-0.165644,51.488514]}},{"properties":{"city":null,"lattitude":48.192471,"user-last-name":"Grass","ime":"7:42:03","state/province":null,"street-address":null,"date":{"end_time":"2010/01/23 00:00:00 -0500","original":"01/22/10","granularity":"day","time":"2010/01/22 00:00:00 -0500"},"country":null,"user-email":"friedrich.grass@chello.at","event":"AddLocations","longitude":16.346064,"id":"a6kgrhpda00t","user-first-name":"Friedrich"},"type":"Feature","geometry":{"type":"Point","coordinates":[16.346064,48.192471]}},{"properties":{"city":null,"lattitude":51.481842,"user-last-name":"Brazil","ime":"22:26:56","state/province":null,"street-address":null,"date":{"end_time":"2009/12/02 00:00:00 -0500","original":"12/01/09","granularity":"day","time":"2009/12/01 00:00:00 -0500"},"country":null,"user-email":"claire.brazil@sky.com","event":"AddLocations","longitude":-0.608501,"id":"a6kgrhrrb2d7","user-first-name":"Claire"},"type":"Feature","geometry":{"type":"Point","coordinates":[-0.608501,51.481842]}},{"properties":{"city":null,"lattitude":59.231792,"user-last-name":"Moen","ime":"17:52:34","state/province":null,"street-address":null,"date":{"end_time":"2009/12/04 00:00:00 -0500","original":"12/03/09","granularity":"day","time":"2009/12/03 00:00:00 -0500"},"country":null,"user-email":"kimandre.moen@gmail.com","event":"AddLocations","longitude":10.973045,"id":"a6kgrhz2rjvr","user-first-name":"Kim andre"},"type":"Feature","geometry":{"type":"Point","coordinates":[10.973045,59.231792]}},{"properties":{"city":null,"lattitude":35.114418,"user-last-name":"Samuels","ime":"19:35:43","state/province":null,"street-address":null,"date":{"end_time":"2010/02/18 00:00:00 -0500","original":"02/17/10","granularity":"day","time":"2010/02/17 00:00:00 -0500"},"country":null,"user-email":"samuelszs@aol.com","event":"AddLocations","longitude":-89.894989,"id":"a6kgrhyde8el","user-first-name":"Sherrie"},"type":"Feature","geometry":{"type":"Point","coordinates":[-89.894989,35.114418]}},{"properties":{"city":null,"lattitude":35.140999,"user-last-name":"Samuels","ime":"0:38:42","state/province":null,"street-address":null,"date":{"end_time":"2010/02/11 00:00:00 -0500","original":"02/10/10","granularity":"day","time":"2010/02/10 00:00:00 -0500"},"country":null,"user-email":"samuelszs@aol.com","event":"AddLocations","longitude":-89.797279,"id":"a6kgrhpwamw8","user-first-name":"Sherrie"},"type":"Feature","geometry":{"type":"Point","coordinates":[-89.797279,35.140999]}},{"properties":{"city":null,"lattitude":46.155731,"user-last-name":"Cardinal","ime":"19:04:27","state/province":null,"street-address":null,"date":{"end_time":"2010/01/15 00:00:00 -0500","original":"01/14/10","granularity":"day","time":"2010/01/14 00:00:00 -0500"},"country":null,"user-email":"thomas@uwl-workshop.com","event":"AddLocations","longitude":-1.15455,"id":"a6kgrhply25w","user-first-name":"Thomas"},"type":"Feature","geometry":{"type":"Point","coordinates":[-1.15455,46.155731]}},{"properties":{"city":null,"lattitude":35.092739,"user-last-name":"Samuels","ime":"3:51:59","state/province":null,"street-address":null,"date":{"end_time":"2010/02/11 00:00:00 -0500","original":"02/10/10","granularity":"day","time":"2010/02/10 00:00:00 -0500"},"country":null,"user-email":"samuelszs@aol.com","event":"AddLocations","longitude":-89.803658,"id":"a6kgrhkwa8du","user-first-name":"Sherrie"},"type":"Feature","geometry":{"type":"Point","coordinates":[-89.803658,35.092739]}},{"properties":{"city":null,"lattitude":53.5975,"user-last-name":"Weeks","ime":"2:17:47","state/province":null,"street-address":null,"date":{"end_time":"2010/02/18 00:00:00 -0500","original":"02/17/10","granularity":"day","time":"2010/02/17 00:00:00 -0500"},"country":null,"user-email":"zachary.weeks@gmail.com","event":"AddLocations","longitude":-113.530174,"id":"a6kgri03bemo","user-first-name":"Zachary"},"type":"Feature","geometry":{"type":"Point","coordinates":[-113.530174,53.5975]}},{"properties":{"city":null,"lattitude":43.296669,"user-last-name":"MILLER","ime":"23:31:48","state/province":null,"street-address":null,"date":{"end_time":"2010/01/25 00:00:00 -0500","original":"01/24/10","granularity":"day","time":"2010/01/24 00:00:00 -0500"},"country":null,"user-email":"jejer13@hotmail.com","event":"AddLocations","longitude":5.371595,"id":"a6kgrhwcumje","user-first-name":"Jerome"},"type":"Feature","geometry":{"type":"Point","coordinates":[5.371595,43.296669]}},{"properties":{"city":null,"lattitude":35.140144,"user-last-name":"Samuels","ime":"0:31:34","state/province":null,"street-address":null,"date":{"end_time":"2010/02/11 00:00:00 -0500","original":"02/10/10","granularity":"day","time":"2010/02/10 00:00:00 -0500"},"country":null,"user-email":"samuelszs@aol.com","event":"AddLocations","longitude":-89.797371,"id":"a6kgrhqxrfkd","user-first-name":"Sherrie"},"type":"Feature","geometry":{"type":"Point","coordinates":[-89.797371,35.140144]}},{"properties":{"city":null,"lattitude":51.545292,"user-last-name":"Raphael","ime":"18:44:30","state/province":null,"street-address":null,"date":{"end_time":"2010/02/25 00:00:00 -0500","original":"02/24/10","granularity":"day","time":"2010/02/24 00:00:00 -0500"},"country":null,"user-email":"richard@391676.com","event":"AddLocations","longitude":0.709211,"id":"a6kgrhtrjgqz","user-first-name":"Richard"},"type":"Feature","geometry":{"type":"Point","coordinates":[0.709211,51.545292]}},{"properties":{"city":null,"lattitude":43.169125,"user-last-name":"Farr","ime":"19:03:32","state/province":null,"street-address":null,"date":{"end_time":"2010/02/15 00:00:00 -0500","original":"02/14/10","granularity":"day","time":"2010/02/14 00:00:00 -0500"},"country":null,"user-email":"heffey@sympatico.ca","event":"AddLocations","longitude":-77.632294,"id":"a6kgrhy9ntvg","user-first-name":"Jeffrey"},"type":"Feature","geometry":{"type":"Point","coordinates":[-77.632294,43.169125]}},{"properties":{"city":null,"lattitude":35.1003,"user-last-name":"Samuels","ime":"14:25:31","state/province":null,"street-address":null,"date":{"end_time":"2010/02/08 00:00:00 -0500","original":"02/07/10","granularity":"day","time":"2010/02/07 00:00:00 -0500"},"country":null,"user-email":"samuelszs@aol.com","event":"AddLocations","longitude":-89.848,"id":"a6kgrhodc0eq","user-first-name":"Sherrie"},"type":"Feature","geometry":{"type":"Point","coordinates":[-89.848,35.1003]}},{"properties":{"city":null,"lattitude":35.132298,"user-last-name":"Samuels","ime":"19:04:42","state/province":null,"street-address":null,"date":{"end_time":"2010/02/08 00:00:00 -0500","original":"02/07/10","granularity":"day","time":"2010/02/07 00:00:00 -0500"},"country":null,"user-email":"samuelszs@aol.com","event":"AddLocations","longitude":-89.959366,"id":"a6kgrhpvgf35","user-first-name":"Sherrie"},"type":"Feature","geometry":{"type":"Point","coordinates":[-89.959366,35.132298]}},{"properties":{"city":null,"lattitude":38.959602,"user-last-name":"Clayson","ime":"14:52:44","state/province":null,"street-address":null,"date":{"end_time":"2010/01/04 00:00:00 -0500","original":"01/03/10","granularity":"day","time":"2010/01/03 00:00:00 -0500"},"country":null,"user-email":"steve.clayson@mac.com","event":"AddLocations","longitude":-77.356056,"id":"a6kgrhkincge","user-first-name":"Steve"},"type":"Feature","geometry":{"type":"Point","coordinates":[-77.356056,38.959602]}},{"properties":{"city":null,"lattitude":49.157795,"user-last-name":"P","ime":"8:19:57","state/province":null,"street-address":null,"date":{"end_time":"2009/11/28 00:00:00 -0500","original":"11/27/09","granularity":"day","time":"2009/11/27 00:00:00 -0500"},"country":null,"user-email":"dia@dccp.ca","event":"AddLocations","longitude":-122.782646,"id":"a6kgrhsz9nth","user-first-name":"Deanna"},"type":"Feature","geometry":{"type":"Point","coordinates":[-122.782646,49.157795]}},{"properties":{"city":null,"lattitude":48.649029,"user-last-name":"Williams","ime":"1:19:07","state/province":null,"street-address":null,"date":{"end_time":"2010/01/08 00:00:00 -0500","original":"01/07/10","granularity":"day","time":"2010/01/07 00:00:00 -0500"},"country":null,"user-email":"tom@tomwilliams.ca","event":"AddLocations","longitude":-123.404121,"id":"a6kgri06gd05","user-first-name":"Tom"},"type":"Feature","geometry":{"type":"Point","coordinates":[-123.404121,48.649029]}},{"properties":{"city":null,"lattitude":48.203934,"user-last-name":"Grass","ime":"20:05:28","state/province":null,"street-address":null,"date":{"end_time":"2010/01/18 00:00:00 -0500","original":"01/17/10","granularity":"day","time":"2010/01/17 00:00:00 -0500"},"country":null,"user-email":"friedrich.grass@chello.at","event":"AddLocations","longitude":16.368685,"id":"a6kgrhynr6xo","user-first-name":"Friedrich"},"type":"Feature","geometry":{"type":"Point","coordinates":[16.368685,48.203934]}},{"properties":{"city":null,"lattitude":35.12038,"user-last-name":"Samuels","ime":"17:25:47","state/province":null,"street-address":null,"date":{"end_time":"2010/02/13 00:00:00 -0500","original":"02/12/10","granularity":"day","time":"2010/02/12 00:00:00 -0500"},"country":null,"user-email":"samuelszs@aol.com","event":"AddLocations","longitude":-89.87516,"id":"a6kgrhqr0mdb","user-first-name":"Sherrie"},"type":"Feature","geometry":{"type":"Point","coordinates":[-89.87516,35.12038]}},{"properties":{"city":null,"lattitude":35.134178,"user-last-name":"Samuels","ime":"0:17:25","state/province":null,"street-address":null,"date":{"end_time":"2010/02/11 00:00:00 -0500","original":"02/10/10","granularity":"day","time":"2010/02/10 00:00:00 -0500"},"country":null,"user-email":"samuelszs@aol.com","event":"AddLocations","longitude":-89.964218,"id":"a6kgrhshu2fe","user-first-name":"Sherrie"},"type":"Feature","geometry":{"type":"Point","coordinates":[-89.964218,35.134178]}},{"properties":{"city":null,"lattitude":33.687729,"user-last-name":"Chaffoo","ime":"19:47:32","state/province":null,"street-address":null,"date":{"end_time":"2010/01/03 00:00:00 -0500","original":"01/02/10","granularity":"day","time":"2010/01/02 00:00:00 -0500"},"country":null,"user-email":"rgrantstuart@gmail.com","event":"AddLocations","longitude":-116.307968,"id":"a6kgrhm4jc11","user-first-name":"Grant"},"type":"Feature","geometry":{"type":"Point","coordinates":[-116.307968,33.687729]}},{"properties":{"city":null,"lattitude":49.25808,"user-last-name":"Coyne","ime":"2:35:54","state/province":null,"street-address":null,"date":{"end_time":"2010/02/21 00:00:00 -0500","original":"02/20/10","granularity":"day","time":"2010/02/20 00:00:00 -0500"},"country":null,"user-email":"jocoyne@shaw.ca","event":"AddLocations","longitude":-123.24791,"id":"a6kgrhvhusck","user-first-name":"Joan"},"type":"Feature","geometry":{"type":"Point","coordinates":[-123.24791,49.25808]}},{"properties":{"city":null,"lattitude":33.813564,"user-last-name":"Valdez","ime":"15:30:56","state/province":null,"street-address":null,"date":{"end_time":"2009/12/15 00:00:00 -0500","original":"12/14/09","granularity":"day","time":"2009/12/14 00:00:00 -0500"},"country":null,"user-email":"mvaldez852@aol.com","event":"AddLocations","longitude":-118.346466,"id":"a6kgrhodpjy8","user-first-name":"M"},"type":"Feature","geometry":{"type":"Point","coordinates":[-118.346466,33.813564]}},{"properties":{"city":null,"lattitude":52.239269,"user-last-name":"Redmond","ime":"21:23:30","state/province":null,"street-address":null,"date":{"end_time":"2010/03/08 00:00:00 -0500","original":"03/07/10","granularity":"day","time":"2010/03/07 00:00:00 -0500"},"country":null,"user-email":"david.redmond@ymail.com","event":"AddLocations","longitude":-0.889985,"id":"a6kgrho2lo44","user-first-name":"David"},"type":"Feature","geometry":{"type":"Point","coordinates":[-0.889985,52.239269]}},{"properties":{"city":null,"lattitude":42.863995,"user-last-name":"Shertzer","ime":"1:00:35","state/province":null,"street-address":null,"date":{"end_time":"2010/03/01 00:00:00 -0500","original":"02/28/10","granularity":"day","time":"2010/02/28 00:00:00 -0500"},"country":null,"user-email":"daveshertzer@me.com","event":"AddLocations","longitude":-73.785019,"id":"a6kgrhksix0c","user-first-name":"Dave"},"type":"Feature","geometry":{"type":"Point","coordinates":[-73.785019,42.863995]}},{"properties":{"city":null,"lattitude":54.975971,"user-last-name":"Shield","ime":"7:21:57","state/province":null,"street-address":null,"date":{"end_time":"2009/12/29 00:00:00 -0500","original":"12/28/09","granularity":"day","time":"2009/12/28 00:00:00 -0500"},"country":null,"user-email":"sumbodistopme@hotmail.com","event":"AddLocations","longitude":-1.610791,"id":"a6kgrhlfv2h6","user-first-name":"Jamie"},"type":"Feature","geometry":{"type":"Point","coordinates":[-1.610791,54.975971]}},{"properties":{"city":null,"lattitude":49.158134,"user-last-name":"P","ime":"8:20:13","state/province":null,"street-address":null,"date":{"end_time":"2009/11/28 00:00:00 -0500","original":"11/27/09","granularity":"day","time":"2009/11/27 00:00:00 -0500"},"country":null,"user-email":"dia@dccp.ca","event":"AddLocations","longitude":-122.78231,"id":"a6kgrhu6vpua","user-first-name":"Deanna"},"type":"Feature","geometry":{"type":"Point","coordinates":[-122.78231,49.158134]}},{"properties":{"city":null,"lattitude":35.190159,"user-last-name":"Samuels","ime":"0:46:13","state/province":null,"street-address":null,"date":{"end_time":"2010/02/11 00:00:00 -0500","original":"02/10/10","granularity":"day","time":"2010/02/10 00:00:00 -0500"},"country":null,"user-email":"samuelszs@aol.com","event":"AddLocations","longitude":-89.795601,"id":"a6kgrhsw947d","user-first-name":"Sherrie"},"type":"Feature","geometry":{"type":"Point","coordinates":[-89.795601,35.190159]}},{"properties":{"city":null,"lattitude":42.857304,"user-last-name":"Shertzer","ime":"16:38:34","state/province":null,"street-address":null,"date":{"end_time":"2010/03/25 00:00:00 -0400","original":"03/24/10","granularity":"day","time":"2010/03/24 00:00:00 -0400"},"country":null,"user-email":"daveshertzer@me.com","event":"AddLocations","longitude":-73.787056,"id":"a6kgrho3oeu2","user-first-name":"Dave"},"type":"Feature","geometry":{"type":"Point","coordinates":[-73.787056,42.857304]}},{"properties":{"city":null,"lattitude":35.092667,"user-last-name":"Samuels","ime":"3:52:21","state/province":null,"street-address":null,"date":{"end_time":"2010/02/11 00:00:00 -0500","original":"02/10/10","granularity":"day","time":"2010/02/10 00:00:00 -0500"},"country":null,"user-email":"samuelszs@aol.com","event":"AddLocations","longitude":-89.803909,"id":"a6kgrhlptkyc","user-first-name":"Sherrie"},"type":"Feature","geometry":{"type":"Point","coordinates":[-89.803909,35.092667]}},{"properties":{"city":null,"lattitude":35.141735,"user-last-name":"Samuels","ime":"0:39:06","state/province":null,"street-address":null,"date":{"end_time":"2010/02/11 00:00:00 -0500","original":"02/10/10","granularity":"day","time":"2010/02/10 00:00:00 -0500"},"country":null,"user-email":"samuelszs@aol.com","event":"AddLocations","longitude":-89.797302,"id":"a6kgrhn71fri","user-first-name":"Sherrie"},"type":"Feature","geometry":{"type":"Point","coordinates":[-89.797302,35.141735]}},{"properties":{"city":null,"lattitude":49.206966,"user-last-name":null,"ime":"20:45:40","state/province":null,"street-address":null,"date":{"end_time":"2009/10/22 00:00:00 -0400","original":"10/21/09","granularity":"day","time":"2009/10/21 00:00:00 -0400"},"country":null,"user-email":"campbell.macdonald@gmail.com","event":"AddLocations","longitude":-122.910683,"id":"a6kgrhqhe9dl","user-first-name":null},"type":"Feature","geometry":{"type":"Point","coordinates":[-122.910683,49.206966]}},{"properties":{"city":null,"lattitude":42.019558,"user-last-name":"Megown","ime":"23:58:21","state/province":null,"street-address":null,"date":{"end_time":"2010/01/15 00:00:00 -0500","original":"01/14/10","granularity":"day","time":"2010/01/14 00:00:00 -0500"},"country":null,"user-email":"jeffreymegown@aol.com","event":"AddLocations","longitude":-91.664093,"id":"a6kgrhkbr115","user-first-name":"Jeffrey"},"type":"Feature","geometry":{"type":"Point","coordinates":[-91.664093,42.019558]}},{"properties":{"city":null,"lattitude":51.459415,"user-last-name":"Gerreyn","ime":"11:43:23","state/province":null,"street-address":null,"date":{"end_time":"2010/01/07 00:00:00 -0500","original":"01/06/10","granularity":"day","time":"2010/01/06 00:00:00 -0500"},"country":null,"user-email":"ann63gerreyn@googlemail.com","event":"AddLocations","longitude":-0.011319,"id":"a6kgrhlke4zx","user-first-name":"Ann-Marie"},"type":"Feature","geometry":{"type":"Point","coordinates":[-0.011319,51.459415]}},{"properties":{"city":null,"lattitude":35.12817,"user-last-name":"Samuels","ime":"0:10:29","state/province":null,"street-address":null,"date":{"end_time":"2010/02/11 00:00:00 -0500","original":"02/10/10","granularity":"day","time":"2010/02/10 00:00:00 -0500"},"country":null,"user-email":"samuelszs@aol.com","event":"AddLocations","longitude":-89.945625,"id":"a6kgrhxq22gi","user-first-name":"Sherrie"},"type":"Feature","geometry":{"type":"Point","coordinates":[-89.945625,35.12817]}},{"properties":{"city":null,"lattitude":35.046616,"user-last-name":"Samuels","ime":"3:45:14","state/province":null,"street-address":null,"date":{"end_time":"2010/02/11 00:00:00 -0500","original":"02/10/10","granularity":"day","time":"2010/02/10 00:00:00 -0500"},"country":null,"user-email":"samuelszs@aol.com","event":"AddLocations","longitude":-89.692665,"id":"a6kgrhuydbn0","user-first-name":"Sherrie"},"type":"Feature","geometry":{"type":"Point","coordinates":[-89.692665,35.046616]}},{"properties":{"city":null,"lattitude":42.874062,"user-last-name":"Shertzer","ime":"19:46:55","state/province":null,"street-address":null,"date":{"end_time":"2010/02/21 00:00:00 -0500","original":"02/20/10","granularity":"day","time":"2010/02/20 00:00:00 -0500"},"country":null,"user-email":"daveshertzer@me.com","event":"AddLocations","longitude":-73.774612,"id":"a6kgrhx2rrme","user-first-name":"Dave"},"type":"Feature","geometry":{"type":"Point","coordinates":[-73.774612,42.874062]}},{"properties":{"city":null,"lattitude":30.252474,"user-last-name":"S","ime":"23:18:18","state/province":null,"street-address":null,"date":{"end_time":"2010/03/20 00:00:00 -0400","original":"03/19/10","granularity":"day","time":"2010/03/19 00:00:00 -0400"},"country":null,"user-email":"qqmech@gmail.com","event":"AddLocations","longitude":-97.768105,"id":"a6kgrhyfwou7","user-first-name":"Mike"},"type":"Feature","geometry":{"type":"Point","coordinates":[-97.768105,30.252474]}},{"properties":{"city":null,"lattitude":30.313246,"user-last-name":"Spradling","ime":"14:21:31","state/province":null,"street-address":null,"date":{"end_time":"2010/04/01 00:00:00 -0400","original":"03/31/10","granularity":"day","time":"2010/03/31 00:00:00 -0400"},"country":null,"user-email":"andrew@parkingmobility.com","event":"AddLocations","longitude":-97.70755,"id":"a6kgrhkibtgd","user-first-name":"Andrew"},"type":"Feature","geometry":{"type":"Point","coordinates":[-97.70755,30.313246]}},{"properties":{"city":null,"lattitude":51.535854,"user-last-name":"Raphael","ime":"22:07:17","state/province":null,"street-address":null,"date":{"end_time":"2009/12/19 00:00:00 -0500","original":"12/18/09","granularity":"day","time":"2009/12/18 00:00:00 -0500"},"country":null,"user-email":"richard@391676.com","event":"AddLocations","longitude":0.713085,"id":"a6kgrhz0v2dh","user-first-name":"Richard"},"type":"Feature","geometry":{"type":"Point","coordinates":[0.713085,51.535854]}},{"properties":{"city":null,"lattitude":51.263355,"user-last-name":"Eastwood","ime":"22:47:54","state/province":null,"street-address":null,"date":{"end_time":"2009/12/27 00:00:00 -0500","original":"12/26/09","granularity":"day","time":"2009/12/26 00:00:00 -0500"},"country":null,"user-email":"martin1983@live.co.uk","event":"AddLocations","longitude":-1.088471,"id":"a6kgrhqxwht6","user-first-name":"Martin"},"type":"Feature","geometry":{"type":"Point","coordinates":[-1.088471,51.263355]}},{"properties":{"city":null,"lattitude":38.669796,"user-last-name":"Deger","ime":"15:07:37","state/province":null,"street-address":null,"date":{"end_time":"2010/01/28 00:00:00 -0500","original":"01/27/10","granularity":"day","time":"2010/01/27 00:00:00 -0500"},"country":null,"user-email":"limobykeith@me.com","event":"AddLocations","longitude":-121.304626,"id":"a6kgrhstej00","user-first-name":"Keith"},"type":"Feature","geometry":{"type":"Point","coordinates":[-121.304626,38.669796]}},{"properties":{"city":null,"lattitude":51.484638,"user-last-name":"Rodriguez amad","ime":"14:58:54","state/province":null,"street-address":null,"date":{"end_time":"2009/12/06 00:00:00 -0500","original":"12/05/09","granularity":"day","time":"2009/12/05 00:00:00 -0500"},"country":null,"user-email":"rodriguez78@hotmail.co.uk","event":"AddLocations","longitude":-0.174284,"id":"a6kgrhljhqok","user-first-name":"Carlos"},"type":"Feature","geometry":{"type":"Point","coordinates":[-0.174284,51.484638]}},{"properties":{"city":null,"lattitude":35.114994,"user-last-name":"Samuels","ime":"19:36:13","state/province":null,"street-address":null,"date":{"end_time":"2010/02/18 00:00:00 -0500","original":"02/17/10","granularity":"day","time":"2010/02/17 00:00:00 -0500"},"country":null,"user-email":"samuelszs@aol.com","event":"AddLocations","longitude":-89.894585,"id":"a6kgrhl1nool","user-first-name":"Sherrie"},"type":"Feature","geometry":{"type":"Point","coordinates":[-89.894585,35.114994]}},{"properties":{"city":null,"lattitude":42.031803,"user-last-name":"Megown","ime":"15:20:44","state/province":null,"street-address":null,"date":{"end_time":"2010/01/23 00:00:00 -0500","original":"01/22/10","granularity":"day","time":"2010/01/22 00:00:00 -0500"},"country":null,"user-email":"jeffreymegown@aol.com","event":"AddLocations","longitude":-91.598412,"id":"a6kgrhy2flaf","user-first-name":"Jeffrey"},"type":"Feature","geometry":{"type":"Point","coordinates":[-91.598412,42.031803]}},{"properties":{"city":null,"lattitude":49.272835,"user-last-name":"Beleznay","ime":"7:23:36","state/province":null,"street-address":null,"date":{"end_time":"2010/02/02 00:00:00 -0500","original":"02/01/10","granularity":"day","time":"2010/02/01 00:00:00 -0500"},"country":null,"user-email":"dbeleznay@shaw.ca","event":"AddLocations","longitude":-123.135429,"id":"a6kgrhttjngu","user-first-name":"Doug"},"type":"Feature","geometry":{"type":"Point","coordinates":[-123.135429,49.272835]}},{"properties":{"city":null,"lattitude":35.116501,"user-last-name":"Samuels","ime":"14:40:19","state/province":null,"street-address":null,"date":{"end_time":"2010/02/08 00:00:00 -0500","original":"02/07/10","granularity":"day","time":"2010/02/07 00:00:00 -0500"},"country":null,"user-email":"samuelszs@aol.com","event":"AddLocations","longitude":-89.894722,"id":"a6kgrhq8wtf8","user-first-name":"Sherrie"},"type":"Feature","geometry":{"type":"Point","coordinates":[-89.894722,35.116501]}},{"properties":{"city":null,"lattitude":35.106651,"user-last-name":"Samuels","ime":"14:33:10","state/province":null,"street-address":null,"date":{"end_time":"2010/02/08 00:00:00 -0500","original":"02/07/10","granularity":"day","time":"2010/02/07 00:00:00 -0500"},"country":null,"user-email":"samuelszs@aol.com","event":"AddLocations","longitude":-89.877449,"id":"a6kgrhugj8wh","user-first-name":"Sherrie"},"type":"Feature","geometry":{"type":"Point","coordinates":[-89.877449,35.106651]}},{"properties":{"city":null,"lattitude":49.15266,"user-last-name":"P","ime":"8:13:17","state/province":null,"street-address":null,"date":{"end_time":"2009/11/28 00:00:00 -0500","original":"11/27/09","granularity":"day","time":"2009/11/27 00:00:00 -0500"},"country":null,"user-email":"dia@dccp.ca","event":"AddLocations","longitude":-122.775261,"id":"a6kgrhpbxanb","user-first-name":"Deanna"},"type":"Feature","geometry":{"type":"Point","coordinates":[-122.775261,49.15266]}},{"properties":{"city":null,"lattitude":60.998524,"user-last-name":"Kivelä","ime":"5:30:38","state/province":null,"street-address":null,"date":{"end_time":"2010/03/21 00:00:00 -0400","original":"03/20/10","granularity":"day","time":"2010/03/20 00:00:00 -0400"},"country":null,"user-email":"jari@pixoi.com","event":"AddLocations","longitude":24.476883,"id":"a6kgrhka4r5v","user-first-name":"Jari"},"type":"Feature","geometry":{"type":"Point","coordinates":[24.476883,60.998524]}},{"properties":{"city":null,"lattitude":51.037045,"user-last-name":"Spradling","ime":"0:46:22","state/province":null,"street-address":null,"date":{"end_time":"2010/01/30 00:00:00 -0500","original":"01/29/10","granularity":"day","time":"2010/01/29 00:00:00 -0500"},"country":null,"user-email":"andrew@parkingmobility.com","event":"AddLocations","longitude":-114.167557,"id":"a6kgrhzeb6pb","user-first-name":"Andrew"},"type":"Feature","geometry":{"type":"Point","coordinates":[-114.167557,51.037045]}},{"properties":{"city":null,"lattitude":51.518539,"user-last-name":"Roland-Shrubb","ime":"17:02:14","state/province":null,"street-address":null,"date":{"end_time":"2010/01/22 00:00:00 -0500","original":"01/21/10","granularity":"day","time":"2010/01/21 00:00:00 -0500"},"country":null,"user-email":"david@roland-shrubb.freeserve.co.uk","event":"AddLocations","longitude":-0.098153,"id":"a6kgrho5jacr","user-first-name":"David"},"type":"Feature","geometry":{"type":"Point","coordinates":[-0.098153,51.518539]}},{"properties":{"city":null,"lattitude":35.1586,"user-last-name":"Samuels","ime":"21:58:21","state/province":null,"street-address":null,"date":{"end_time":"2010/02/25 00:00:00 -0500","original":"02/24/10","granularity":"day","time":"2010/02/24 00:00:00 -0500"},"country":null,"user-email":"samuelszs@aol.com","event":"AddLocations","longitude":-89.793877,"id":"a6kgrhkgmqej","user-first-name":"Sherrie"},"type":"Feature","geometry":{"type":"Point","coordinates":[-89.793877,35.1586]}},{"properties":{"city":null,"lattitude":29.887104,"user-last-name":"Spradling","ime":"22:10:33","state/province":null,"street-address":null,"date":{"end_time":"2010/03/29 00:00:00 -0400","original":"03/28/10","granularity":"day","time":"2010/03/28 00:00:00 -0400"},"country":null,"user-email":"andrew@parkingmobility.com","event":"AddLocations","longitude":-97.933174,"id":"a6kgrhwibzul","user-first-name":"Andrew"},"type":"Feature","geometry":{"type":"Point","coordinates":[-97.933174,29.887104]}},{"properties":{"city":null,"lattitude":48.207626,"user-last-name":"Grass","ime":"14:12:48","state/province":null,"street-address":null,"date":{"end_time":"2010/01/14 00:00:00 -0500","original":"01/13/10","granularity":"day","time":"2010/01/13 00:00:00 -0500"},"country":null,"user-email":"friedrich.grass@chello.at","event":"AddLocations","longitude":16.366041,"id":"a6kgrhs6c4xd","user-first-name":"Friedrich"},"type":"Feature","geometry":{"type":"Point","coordinates":[16.366041,48.207626]}},{"properties":{"city":null,"lattitude":53.238583,"user-last-name":"Stokes","ime":"18:19:45","state/province":null,"street-address":null,"date":{"end_time":"2010/01/11 00:00:00 -0500","original":"01/10/10","granularity":"day","time":"2010/01/10 00:00:00 -0500"},"country":null,"user-email":"rapid7max@aol.com","event":"AddLocations","longitude":-1.426946,"id":"a6kgrhro3bpn","user-first-name":"Paul"},"type":"Feature","geometry":{"type":"Point","coordinates":[-1.426946,53.238583]}},{"properties":{"city":null,"lattitude":-33.889301,"user-last-name":"Paulsen","ime":"9:38:59","state/province":null,"street-address":null,"date":{"end_time":"2010/04/04 00:00:00 -0400","original":"04/03/10","granularity":"day","time":"2010/04/03 00:00:00 -0400"},"country":null,"user-email":"purse1@yahoo.com","event":"AddLocations","longitude":151.177658,"id":"a6kgrhyiedpm","user-first-name":"David"},"type":"Feature","geometry":{"type":"Point","coordinates":[151.177658,-33.889301]}},{"properties":{"city":null,"lattitude":47.424217,"user-last-name":null,"ime":"17:04:44","state/province":null,"street-address":null,"date":{"end_time":"2010/02/01 00:00:00 -0500","original":"01/31/10","granularity":"day","time":"2010/01/31 00:00:00 -0500"},"country":null,"user-email":"b-brave@gmx.net","event":"AddLocations","longitude":9.377413,"id":"a6kgrhutkxom","user-first-name":null},"type":"Feature","geometry":{"type":"Point","coordinates":[9.377413,47.424217]}},{"properties":{"city":null,"lattitude":50.418686,"user-last-name":"Steinier","ime":"9:01:37","state/province":null,"street-address":null,"date":{"end_time":"2010/02/04 00:00:00 -0500","original":"02/03/10","granularity":"day","time":"2010/02/03 00:00:00 -0500"},"country":null,"user-email":"philippe@handimobility.org","event":"AddLocations","longitude":4.458569,"id":"a6kgrhnmt59n","user-first-name":"Philippe"},"type":"Feature","geometry":{"type":"Point","coordinates":[4.458569,50.418686]}},{"properties":{"city":null,"lattitude":49.157276,"user-last-name":"P","ime":"8:20:34","state/province":null,"street-address":null,"date":{"end_time":"2009/11/28 00:00:00 -0500","original":"11/27/09","granularity":"day","time":"2009/11/27 00:00:00 -0500"},"country":null,"user-email":"dia@dccp.ca","event":"AddLocations","longitude":-122.78138,"id":"a6kgrhlvgbdi","user-first-name":"Deanna"},"type":"Feature","geometry":{"type":"Point","coordinates":[-122.78138,49.157276]}},{"properties":{"city":null,"lattitude":50.967129,"user-last-name":"Kinloch","ime":"20:53:01","state/province":null,"street-address":null,"date":{"end_time":"2010/03/22 00:00:00 -0400","original":"03/21/10","granularity":"day","time":"2010/03/21 00:00:00 -0400"},"country":null,"user-email":"liz_kinloch@btinternet.com","event":"AddLocations","longitude":-1.351239,"id":"a6kgrhs7xq3g","user-first-name":"Liz"},"type":"Feature","geometry":{"type":"Point","coordinates":[-1.351239,50.967129]}},{"properties":{"city":null,"lattitude":48.799137,"user-last-name":"Pascale","ime":"14:47:11","state/province":null,"street-address":null,"date":{"end_time":"2009/12/04 00:00:00 -0500","original":"12/03/09","granularity":"day","time":"2009/12/03 00:00:00 -0500"},"country":null,"user-email":"valletpascal@aol.com","event":"AddLocations","longitude":2.291342,"id":"a6kgrhy8pkov","user-first-name":"Vallet"},"type":"Feature","geometry":{"type":"Point","coordinates":[2.291342,48.799137]}},{"properties":{"city":null,"lattitude":45.467072,"user-last-name":"D","ime":"23:37:30","state/province":null,"street-address":null,"date":{"end_time":"2010/02/26 00:00:00 -0500","original":"02/25/10","granularity":"day","time":"2010/02/25 00:00:00 -0500"},"country":null,"user-email":"kentia000@hotmail.com","event":"AddLocations","longitude":-73.542564,"id":"a6kgrhxmje44","user-first-name":"Mel"},"type":"Feature","geometry":{"type":"Point","coordinates":[-73.542564,45.467072]}},{"properties":{"city":null,"lattitude":33.868137,"user-last-name":"Leathers","ime":"23:11:13","state/province":null,"street-address":null,"date":{"end_time":"2010/02/18 00:00:00 -0500","original":"02/17/10","granularity":"day","time":"2010/02/17 00:00:00 -0500"},"country":null,"user-email":"drewleathers@gmail.com","event":"AddLocations","longitude":-84.094772,"id":"a6kgrhxlvr2k","user-first-name":"Drew"},"type":"Feature","geometry":{"type":"Point","coordinates":[-84.094772,33.868137]}},{"properties":{"city":null,"lattitude":35.092518,"user-last-name":"Samuels","ime":"3:52:43","state/province":null,"street-address":null,"date":{"end_time":"2010/02/11 00:00:00 -0500","original":"02/10/10","granularity":"day","time":"2010/02/10 00:00:00 -0500"},"country":null,"user-email":"samuelszs@aol.com","event":"AddLocations","longitude":-89.804123,"id":"a6kgrhvcd9ku","user-first-name":"Sherrie"},"type":"Feature","geometry":{"type":"Point","coordinates":[-89.804123,35.092518]}},{"properties":{"city":null,"lattitude":30.317348,"user-last-name":"S","ime":"14:06:03","state/province":null,"street-address":null,"date":{"end_time":"2010/02/25 00:00:00 -0500","original":"02/24/10","granularity":"day","time":"2010/02/24 00:00:00 -0500"},"country":null,"user-email":"qqmech@gmail.com","event":"AddLocations","longitude":-97.740494,"id":"a6kgrhrulmf6","user-first-name":"Mike"},"type":"Feature","geometry":{"type":"Point","coordinates":[-97.740494,30.317348]}},{"properties":{"city":null,"lattitude":35.10006,"user-last-name":"Samuels","ime":"13:57:35","state/province":null,"street-address":null,"date":{"end_time":"2010/02/08 00:00:00 -0500","original":"02/07/10","granularity":"day","time":"2010/02/07 00:00:00 -0500"},"country":null,"user-email":"samuelszs@aol.com","event":"AddLocations","longitude":-89.845192,"id":"a6kgrhp8pyi8","user-first-name":"Sherrie"},"type":"Feature","geometry":{"type":"Point","coordinates":[-89.845192,35.10006]}},{"properties":{"city":null,"lattitude":-33.900913,"user-last-name":"Paulsen","ime":"9:46:15","state/province":null,"street-address":null,"date":{"end_time":"2010/04/04 00:00:00 -0400","original":"04/03/10","granularity":"day","time":"2010/04/03 00:00:00 -0400"},"country":null,"user-email":"purse1@yahoo.com","event":"AddLocations","longitude":151.233948,"id":"a6kgrhya70y0","user-first-name":"David"},"type":"Feature","geometry":{"type":"Point","coordinates":[151.233948,-33.900913]}},{"properties":{"city":null,"lattitude":35.190033,"user-last-name":"Samuels","ime":"0:46:39","state/province":null,"street-address":null,"date":{"end_time":"2010/02/11 00:00:00 -0500","original":"02/10/10","granularity":"day","time":"2010/02/10 00:00:00 -0500"},"country":null,"user-email":"samuelszs@aol.com","event":"AddLocations","longitude":-89.795647,"id":"a6kgrhvv5ddq","user-first-name":"Sherrie"},"type":"Feature","geometry":{"type":"Point","coordinates":[-89.795647,35.190033]}},{"properties":{"city":null,"lattitude":38.957386,"user-last-name":"Clayson","ime":"14:53:28","state/province":null,"street-address":null,"date":{"end_time":"2010/01/04 00:00:00 -0500","original":"01/03/10","granularity":"day","time":"2010/01/03 00:00:00 -0500"},"country":null,"user-email":"steve.clayson@mac.com","event":"AddLocations","longitude":-77.358452,"id":"a6kgrhqwy0nq","user-first-name":"Steve"},"type":"Feature","geometry":{"type":"Point","coordinates":[-77.358452,38.957386]}},{"properties":{"city":null,"lattitude":35.046497,"user-last-name":"Samuels","ime":"3:45:38","state/province":null,"street-address":null,"date":{"end_time":"2010/02/11 00:00:00 -0500","original":"02/10/10","granularity":"day","time":"2010/02/10 00:00:00 -0500"},"country":null,"user-email":"samuelszs@aol.com","event":"AddLocations","longitude":-89.692627,"id":"a6kgrhnqq3o9","user-first-name":"Sherrie"},"type":"Feature","geometry":{"type":"Point","coordinates":[-89.692627,35.046497]}},{"properties":{"city":null,"lattitude":51.050724,"user-last-name":"Spradling","ime":"19:23:12","state/province":null,"street-address":null,"date":{"end_time":"2010/01/18 00:00:00 -0500","original":"01/17/10","granularity":"day","time":"2010/01/17 00:00:00 -0500"},"country":null,"user-email":"andrew@parkingmobility.com","event":"AddLocations","longitude":-114.075897,"id":"a6kgrhut053g","user-first-name":"Andrew"},"type":"Feature","geometry":{"type":"Point","coordinates":[-114.075897,51.050724]}},{"properties":{"city":null,"lattitude":41.961964,"user-last-name":"Megown","ime":"18:30:42","state/province":null,"street-address":null,"date":{"end_time":"2010/01/14 00:00:00 -0500","original":"01/13/10","granularity":"day","time":"2010/01/13 00:00:00 -0500"},"country":null,"user-email":"jeffreymegown@aol.com","event":"AddLocations","longitude":-91.667686,"id":"a6kgrho1gbml","user-first-name":"Jeffrey"},"type":"Feature","geometry":{"type":"Point","coordinates":[-91.667686,41.961964]}},{"properties":{"city":null,"lattitude":48.425499,"user-last-name":"Philip","ime":"18:01:12","state/province":null,"street-address":null,"date":{"end_time":"2010/02/26 00:00:00 -0500","original":"02/25/10","granularity":"day","time":"2010/02/25 00:00:00 -0500"},"country":null,"user-email":"davidstewartphilip@gmail.com","event":"AddLocations","longitude":-123.357231,"id":"a6kgrhrrz0xd","user-first-name":"David"},"type":"Feature","geometry":{"type":"Point","coordinates":[-123.357231,48.425499]}},{"properties":{"city":null,"lattitude":49.69706,"user-last-name":"Chalkley","ime":"21:12:20","state/province":null,"street-address":null,"date":{"end_time":"2010/03/30 00:00:00 -0400","original":"03/29/10","granularity":"day","time":"2010/03/29 00:00:00 -0400"},"country":null,"user-email":"kitty_nikki@live.ca","event":"AddLocations","longitude":-112.834999,"id":"a6kgrhpyat95","user-first-name":"Nikki"},"type":"Feature","geometry":{"type":"Point","coordinates":[-112.834999,49.69706]}},{"properties":{"city":null,"lattitude":51.880844,"user-last-name":"Heneville","ime":"10:09:07","state/province":null,"street-address":null,"date":{"end_time":"2010/04/15 00:00:00 -0400","original":"04/14/10","granularity":"day","time":"2010/04/14 00:00:00 -0400"},"country":null,"user-email":"kit.heneville@googlemail.com","event":"AddLocations","longitude":-5.266271,"id":"a6kgrhvzm8te","user-first-name":"Kit"},"type":"Feature","geometry":{"type":"Point","coordinates":[-5.266271,51.880844]}},{"properties":{"city":null,"lattitude":32.865768,"user-last-name":"Gutierrez","ime":"4:46:15","state/province":null,"street-address":null,"date":{"end_time":"2009/12/28 00:00:00 -0500","original":"12/27/09","granularity":"day","time":"2009/12/27 00:00:00 -0500"},"country":null,"user-email":"emiliogu@myway.com","event":"AddLocations","longitude":-96.835846,"id":"a6kgrhtm4ey3","user-first-name":"Emilio"},"type":"Feature","geometry":{"type":"Point","coordinates":[-96.835846,32.865768]}},{"properties":{"city":null,"lattitude":28.343031,"user-last-name":null,"ime":"16:42:48","state/province":null,"street-address":null,"date":{"end_time":"2009/10/22 00:00:00 -0400","original":"10/21/09","granularity":"day","time":"2009/10/21 00:00:00 -0400"},"country":null,"user-email":"parking.iphone@prather.org","event":"AddLocations","longitude":-81.385674,"id":"a6kgrho0dij1","user-first-name":null},"type":"Feature","geometry":{"type":"Point","coordinates":[-81.385674,28.343031]}},{"properties":{"city":null,"lattitude":51.037334,"user-last-name":"Spradling","ime":"0:39:32","state/province":null,"street-address":null,"date":{"end_time":"2010/01/30 00:00:00 -0500","original":"01/29/10","granularity":"day","time":"2010/01/29 00:00:00 -0500"},"country":null,"user-email":"andrew@parkingmobility.com","event":"AddLocations","longitude":-114.168579,"id":"a6kgrho6k2bv","user-first-name":"Andrew"},"type":"Feature","geometry":{"type":"Point","coordinates":[-114.168579,51.037334]}},{"properties":{"city":null,"lattitude":37.514408,"user-last-name":"Kim","ime":"9:31:37","state/province":null,"street-address":null,"date":{"end_time":"2010/01/28 00:00:00 -0500","original":"01/27/10","granularity":"day","time":"2010/01/27 00:00:00 -0500"},"country":null,"user-email":"cnblue@chol.com","event":"AddLocations","longitude":127.017746,"id":"a6kgrhkw2ego","user-first-name":"Hangsik"},"type":"Feature","geometry":{"type":"Point","coordinates":[127.017746,37.514408]}},{"properties":{"city":null,"lattitude":48.066917,"user-last-name":"Grass","ime":"13:05:06","state/province":null,"street-address":null,"date":{"end_time":"2010/01/17 00:00:00 -0500","original":"01/16/10","granularity":"day","time":"2010/01/16 00:00:00 -0500"},"country":null,"user-email":"friedrich.grass@chello.at","event":"AddLocations","longitude":16.35816,"id":"a6kgrhl4k7lq","user-first-name":"Friedrich"},"type":"Feature","geometry":{"type":"Point","coordinates":[16.35816,48.066917]}},{"properties":{"city":null,"lattitude":42.020866,"user-last-name":"Megown","ime":"2:27:59","state/province":null,"street-address":null,"date":{"end_time":"2010/01/11 00:00:00 -0500","original":"01/10/10","granularity":"day","time":"2010/01/10 00:00:00 -0500"},"country":null,"user-email":"jeffreymegown@aol.com","event":"AddLocations","longitude":-91.597862,"id":"a6kgrhwyl1ru","user-first-name":"Jeffrey"},"type":"Feature","geometry":{"type":"Point","coordinates":[-91.597862,42.020866]}},{"properties":{"city":null,"lattitude":53.380733,"user-last-name":"Baker","ime":"21:35:03","state/province":null,"street-address":null,"date":{"end_time":"2010/03/29 00:00:00 -0400","original":"03/28/10","granularity":"day","time":"2010/03/28 00:00:00 -0400"},"country":null,"user-email":"lrd1960@yahoo.co.uk","event":"AddLocations","longitude":-1.467875,"id":"a6kgrhvgv9o6","user-first-name":"Keith"},"type":"Feature","geometry":{"type":"Point","coordinates":[-1.467875,53.380733]}},{"properties":{"city":null,"lattitude":49.282063,"user-last-name":"Williams","ime":"23:56:33","state/province":null,"street-address":null,"date":{"end_time":"2010/01/17 00:00:00 -0500","original":"01/16/10","granularity":"day","time":"2010/01/16 00:00:00 -0500"},"country":null,"user-email":"tom@tomwilliams.ca","event":"AddLocations","longitude":-123.110153,"id":"a6kgrhslu15p","user-first-name":"Tom"},"type":"Feature","geometry":{"type":"Point","coordinates":[-123.110153,49.282063]}},{"properties":{"city":null,"lattitude":42.027393,"user-last-name":"Megown","ime":"15:28:18","state/province":null,"street-address":null,"date":{"end_time":"2010/01/11 00:00:00 -0500","original":"01/10/10","granularity":"day","time":"2010/01/10 00:00:00 -0500"},"country":null,"user-email":"jeffreymegown@aol.com","event":"AddLocations","longitude":-91.618935,"id":"a6kgrhyh9hn1","user-first-name":"Jeffrey"},"type":"Feature","geometry":{"type":"Point","coordinates":[-91.618935,42.027393]}},{"properties":{"city":null,"lattitude":48.218784,"user-last-name":"Grass","ime":"15:28:22","state/province":null,"street-address":null,"date":{"end_time":"2010/01/17 00:00:00 -0500","original":"01/16/10","granularity":"day","time":"2010/01/16 00:00:00 -0500"},"country":null,"user-email":"friedrich.grass@chello.at","event":"AddLocations","longitude":16.343536,"id":"a6kgrhlp2v40","user-first-name":"Friedrich"},"type":"Feature","geometry":{"type":"Point","coordinates":[16.343536,48.218784]}},{"properties":{"city":null,"lattitude":51.484665,"user-last-name":"Brazil","ime":"22:28:02","state/province":null,"street-address":null,"date":{"end_time":"2009/12/02 00:00:00 -0500","original":"12/01/09","granularity":"day","time":"2009/12/01 00:00:00 -0500"},"country":null,"user-email":"claire.brazil@sky.com","event":"AddLocations","longitude":-0.609107,"id":"a6kgrhkyigpt","user-first-name":"Claire"},"type":"Feature","geometry":{"type":"Point","coordinates":[-0.609107,51.484665]}},{"properties":{"city":null,"lattitude":45.467358,"user-last-name":"D","ime":"7:32:43","state/province":null,"street-address":null,"date":{"end_time":"2010/03/03 00:00:00 -0500","original":"03/02/10","granularity":"day","time":"2010/03/02 00:00:00 -0500"},"country":null,"user-email":"kentia000@hotmail.com","event":"AddLocations","longitude":-73.540215,"id":"a6kgrhw2rndy","user-first-name":"Mel"},"type":"Feature","geometry":{"type":"Point","coordinates":[-73.540215,45.467358]}},{"properties":{"city":null,"lattitude":-33.889179,"user-last-name":"Paulsen","ime":"9:39:25","state/province":null,"street-address":null,"date":{"end_time":"2010/04/04 00:00:00 -0400","original":"04/03/10","granularity":"day","time":"2010/04/03 00:00:00 -0400"},"country":null,"user-email":"purse1@yahoo.com","event":"AddLocations","longitude":151.177597,"id":"a6kgrhrem9te","user-first-name":"David"},"type":"Feature","geometry":{"type":"Point","coordinates":[151.177597,-33.889179]}},{"properties":{"city":null,"lattitude":51.501648,"user-last-name":"Rodriguez amad","ime":"13:18:06","state/province":null,"street-address":null,"date":{"end_time":"2009/12/07 00:00:00 -0500","original":"12/06/09","granularity":"day","time":"2009/12/06 00:00:00 -0500"},"country":null,"user-email":"rodriguez78@hotmail.co.uk","event":"AddLocations","longitude":-0.189945,"id":"a6kgrhzv9cb3","user-first-name":"Carlos"},"type":"Feature","geometry":{"type":"Point","coordinates":[-0.189945,51.501648]}},{"properties":{"city":null,"lattitude":38.888908,"user-last-name":"Clayson","ime":"20:05:10","state/province":null,"street-address":null,"date":{"end_time":"2010/01/07 00:00:00 -0500","original":"01/06/10","granularity":"day","time":"2010/01/06 00:00:00 -0500"},"country":null,"user-email":"steve.clayson@mac.com","event":"AddLocations","longitude":-77.093094,"id":"a6kgrhojjgfm","user-first-name":"Steve"},"type":"Feature","geometry":{"type":"Point","coordinates":[-77.093094,38.888908]}},{"properties":{"city":null,"lattitude":49.282093,"user-last-name":"Ambesi","ime":"17:19:31","state/province":null,"street-address":null,"date":{"end_time":"2010/02/01 00:00:00 -0500","original":"01/31/10","granularity":"day","time":"2010/01/31 00:00:00 -0500"},"country":null,"user-email":"carolambesi@telus.net","event":"AddLocations","longitude":-123.100441,"id":"a6kgrhumlh0e","user-first-name":"Carol"},"type":"Feature","geometry":{"type":"Point","coordinates":[-123.100441,49.282093]}},{"properties":{"city":null,"lattitude":51.051495,"user-last-name":"Spradling","ime":"18:33:24","state/province":null,"street-address":null,"date":{"end_time":"2010/01/18 00:00:00 -0500","original":"01/17/10","granularity":"day","time":"2010/01/17 00:00:00 -0500"},"country":null,"user-email":"andrew@parkingmobility.com","event":"AddLocations","longitude":-114.065201,"id":"a6kgrhkhvdz7","user-first-name":"Andrew"},"type":"Feature","geometry":{"type":"Point","coordinates":[-114.065201,51.051495]}},{"properties":{"city":null,"lattitude":60.969845,"user-last-name":"Kivelä","ime":"5:24:03","state/province":null,"street-address":null,"date":{"end_time":"2010/03/21 00:00:00 -0400","original":"03/20/10","granularity":"day","time":"2010/03/20 00:00:00 -0400"},"country":null,"user-email":"jari@pixoi.com","event":"AddLocations","longitude":24.545258,"id":"a6kgrhmszxg0","user-first-name":"Jari"},"type":"Feature","geometry":{"type":"Point","coordinates":[24.545258,60.969845]}},{"properties":{"city":null,"lattitude":35.100296,"user-last-name":"Samuels","ime":"14:26:36","state/province":null,"street-address":null,"date":{"end_time":"2010/02/08 00:00:00 -0500","original":"02/07/10","granularity":"day","time":"2010/02/07 00:00:00 -0500"},"country":null,"user-email":"samuelszs@aol.com","event":"AddLocations","longitude":-89.847954,"id":"a6kgrhv32zm4","user-first-name":"Sherrie"},"type":"Feature","geometry":{"type":"Point","coordinates":[-89.847954,35.100296]}},{"properties":{"city":null,"lattitude":43.223553,"user-last-name":"Smith","ime":"21:40:51","state/province":null,"street-address":null,"date":{"end_time":"2010/02/04 00:00:00 -0500","original":"02/03/10","granularity":"day","time":"2010/02/03 00:00:00 -0500"},"country":null,"user-email":"willywonka1995@hotmail.com","event":"AddLocations","longitude":-79.744652,"id":"a6kgrhzm06o7","user-first-name":"Jhon"},"type":"Feature","geometry":{"type":"Point","coordinates":[-79.744652,43.223553]}},{"properties":{"city":null,"lattitude":49.157242,"user-last-name":"P","ime":"8:21:03","state/province":null,"street-address":null,"date":{"end_time":"2009/11/28 00:00:00 -0500","original":"11/27/09","granularity":"day","time":"2009/11/27 00:00:00 -0500"},"country":null,"user-email":"dia@dccp.ca","event":"AddLocations","longitude":-122.77951,"id":"a6kgrhkp5ykk","user-first-name":"Deanna"},"type":"Feature","geometry":{"type":"Point","coordinates":[-122.77951,49.157242]}},{"properties":{"city":null,"lattitude":37.332539,"user-last-name":null,"ime":"2:14:28","state/province":null,"street-address":null,"date":{"end_time":"2009/10/12 00:00:00 -0400","original":"10/11/09","granularity":"day","time":"2009/10/11 00:00:00 -0400"},"country":null,"user-email":"system+unknown-user@parkingmobility.com","event":"AddLocations","longitude":-122.033066,"id":"a6kgrhn7pa01","user-first-name":null},"type":"Feature","geometry":{"type":"Point","coordinates":[-122.033066,37.332539]}},{"properties":{"city":null,"lattitude":30.374741,"user-last-name":"Spradling","ime":"5:47:59","state/province":null,"street-address":null,"date":{"end_time":"2010/03/25 00:00:00 -0400","original":"03/24/10","granularity":"day","time":"2010/03/24 00:00:00 -0400"},"country":null,"user-email":"andrew@parkingmobility.com","event":"AddLocations","longitude":-97.67675,"id":"a6kgrhr4fr8o","user-first-name":"Andrew"},"type":"Feature","geometry":{"type":"Point","coordinates":[-97.67675,30.374741]}},{"properties":{"city":null,"lattitude":-32.879555,"user-last-name":"Wotton","ime":"1:16:22","state/province":null,"street-address":null,"date":{"end_time":"2009/11/30 00:00:00 -0500","original":"11/29/09","granularity":"day","time":"2009/11/29 00:00:00 -0500"},"country":null,"user-email":"kyteflyer@gmail.com","event":"AddLocations","longitude":151.65947,"id":"a6kgrhy0ayc3","user-first-name":"Sue"},"type":"Feature","geometry":{"type":"Point","coordinates":[151.65947,-32.879555]}},{"properties":{"city":null,"lattitude":51.132912,"user-last-name":"Poll","ime":"4:10:02","state/province":null,"street-address":null,"date":{"end_time":"2010/03/05 00:00:00 -0500","original":"03/04/10","granularity":"day","time":"2010/03/04 00:00:00 -0500"},"country":null,"user-email":"toad19652000@yahoo.co.uk","event":"AddLocations","longitude":0.263693,"id":"a6kgrhyvjrpe","user-first-name":"Martyn"},"type":"Feature","geometry":{"type":"Point","coordinates":[0.263693,51.132912]}},{"properties":{"city":null,"lattitude":35.189983,"user-last-name":"Samuels","ime":"0:47:04","state/province":null,"street-address":null,"date":{"end_time":"2010/02/11 00:00:00 -0500","original":"02/10/10","granularity":"day","time":"2010/02/10 00:00:00 -0500"},"country":null,"user-email":"samuelszs@aol.com","event":"AddLocations","longitude":-89.795609,"id":"a6kgrhofydcc","user-first-name":"Sherrie"},"type":"Feature","geometry":{"type":"Point","coordinates":[-89.795609,35.189983]}},{"properties":{"city":null,"lattitude":49.300056,"user-last-name":null,"ime":"19:26:39","state/province":null,"street-address":null,"date":{"end_time":"2009/11/04 00:00:00 -0500","original":"11/03/09","granularity":"day","time":"2009/11/03 00:00:00 -0500"},"country":null,"user-email":"campbell.macdonald@gmail.com","event":"AddLocations","longitude":-123.130348,"id":"a6kgrhryezw1","user-first-name":null},"type":"Feature","geometry":{"type":"Point","coordinates":[-123.130348,49.300056]}},{"properties":{"city":null,"lattitude":49.277653,"user-last-name":"Nachbaur","ime":"23:53:49","state/province":null,"street-address":null,"date":{"end_time":"2009/10/21 00:00:00 -0400","original":"10/20/09","granularity":"day","time":"2009/10/20 00:00:00 -0400"},"country":null,"user-email":"mike.nachbaur@decafninja.com","event":"AddLocations","longitude":-123.131332,"id":"a6kgrhzviyvg","user-first-name":"Mike"},"type":"Feature","geometry":{"type":"Point","coordinates":[-123.131332,49.277653]}},{"properties":{"city":null,"lattitude":43.582417,"user-last-name":"Gibaud","ime":"16:03:00","state/province":null,"street-address":null,"date":{"end_time":"2009/12/19 00:00:00 -0500","original":"12/18/09","granularity":"day","time":"2009/12/18 00:00:00 -0500"},"country":null,"user-email":"gibaud.chris@gmail.com","event":"AddLocations","longitude":5.420815,"id":"a6kgrhr6e8w2","user-first-name":"Chris"},"type":"Feature","geometry":{"type":"Point","coordinates":[5.420815,43.582417]}},{"properties":{"city":null,"lattitude":35.11869,"user-last-name":"Samuels","ime":"23:57:02","state/province":null,"street-address":null,"date":{"end_time":"2010/02/10 00:00:00 -0500","original":"02/09/10","granularity":"day","time":"2010/02/09 00:00:00 -0500"},"country":null,"user-email":"samuelszs@aol.com","event":"AddLocations","longitude":-89.944778,"id":"a6kgrhv34u49","user-first-name":"Sherrie"},"type":"Feature","geometry":{"type":"Point","coordinates":[-89.944778,35.11869]}},{"properties":{"city":null,"lattitude":46.170795,"user-last-name":"Syloda","ime":"21:58:32","state/province":null,"street-address":null,"date":{"end_time":"2009/12/15 00:00:00 -0500","original":"12/14/09","granularity":"day","time":"2009/12/14 00:00:00 -0500"},"country":null,"user-email":"syloda@hotmail.com","event":"AddLocations","longitude":6.115938,"id":"a6kgrhk2o81v","user-first-name":"Syloda"},"type":"Feature","geometry":{"type":"Point","coordinates":[6.115938,46.170795]}},{"properties":{"city":null,"lattitude":35.135845,"user-last-name":"Samuels","ime":"14:08:56","state/province":null,"street-address":null,"date":{"end_time":"2010/02/11 00:00:00 -0500","original":"02/10/10","granularity":"day","time":"2010/02/10 00:00:00 -0500"},"country":null,"user-email":"samuelszs@aol.com","event":"AddLocations","longitude":-89.880867,"id":"a6kgrhr97rqq","user-first-name":"Sherrie"},"type":"Feature","geometry":{"type":"Point","coordinates":[-89.880867,35.135845]}},{"properties":{"city":null,"lattitude":48.753773,"user-last-name":"Pascale","ime":"13:15:57","state/province":null,"street-address":null,"date":{"end_time":"2009/12/03 00:00:00 -0500","original":"12/02/09","granularity":"day","time":"2009/12/02 00:00:00 -0500"},"country":null,"user-email":"valletpascal@aol.com","event":"AddLocations","longitude":2.303018,"id":"a6kgrhokpkqv","user-first-name":"Vallet"},"type":"Feature","geometry":{"type":"Point","coordinates":[2.303018,48.753773]}},{"properties":{"city":null,"lattitude":35.120239,"user-last-name":"Samuels","ime":"17:27:01","state/province":null,"street-address":null,"date":{"end_time":"2010/02/13 00:00:00 -0500","original":"02/12/10","granularity":"day","time":"2010/02/12 00:00:00 -0500"},"country":null,"user-email":"samuelszs@aol.com","event":"AddLocations","longitude":-89.874687,"id":"a6kgrhpcaaq0","user-first-name":"Sherrie"},"type":"Feature","geometry":{"type":"Point","coordinates":[-89.874687,35.120239]}},{"properties":{"city":null,"lattitude":37.330647,"user-last-name":null,"ime":"4:10:23","state/province":null,"street-address":null,"date":{"end_time":"2009/10/11 00:00:00 -0400","original":"10/10/09","granularity":"day","time":"2009/10/10 00:00:00 -0400"},"country":null,"user-email":"system+unknown-user@parkingmobility.com","event":"AddLocations","longitude":-122.033348,"id":"a6kgrhkehhcz","user-first-name":null},"type":"Feature","geometry":{"type":"Point","coordinates":[-122.033348,37.330647]}},{"properties":{"city":null,"lattitude":49.157154,"user-last-name":"P","ime":"8:21:17","state/province":null,"street-address":null,"date":{"end_time":"2009/11/28 00:00:00 -0500","original":"11/27/09","granularity":"day","time":"2009/11/27 00:00:00 -0500"},"country":null,"user-email":"dia@dccp.ca","event":"AddLocations","longitude":-122.779419,"id":"a6kgrhtqjgii","user-first-name":"Deanna"},"type":"Feature","geometry":{"type":"Point","coordinates":[-122.779419,49.157154]}},{"properties":{"city":null,"lattitude":49.158257,"user-last-name":null,"ime":"3:32:14","state/province":null,"street-address":null,"date":{"end_time":"2009/10/13 00:00:00 -0400","original":"10/12/09","granularity":"day","time":"2009/10/12 00:00:00 -0400"},"country":null,"user-email":"system+unknown-user@parkingmobility.com","event":"AddLocations","longitude":-122.780098,"id":"a6kgrhzmhr4b","user-first-name":null},"type":"Feature","geometry":{"type":"Point","coordinates":[-122.780098,49.158257]}},{"properties":{"city":null,"lattitude":30.309273,"user-last-name":"Spradling","ime":"19:32:39","state/province":null,"street-address":null,"date":{"end_time":"2010/03/30 00:00:00 -0400","original":"03/29/10","granularity":"day","time":"2010/03/29 00:00:00 -0400"},"country":null,"user-email":"andrew@parkingmobility.com","event":"AddLocations","longitude":-97.733681,"id":"a6kgrhl2dtx6","user-first-name":"Andrew"},"type":"Feature","geometry":{"type":"Point","coordinates":[-97.733681,30.309273]}},{"properties":{"city":null,"lattitude":50.96722,"user-last-name":"Kinloch","ime":"20:53:44","state/province":null,"street-address":null,"date":{"end_time":"2010/03/22 00:00:00 -0400","original":"03/21/10","granularity":"day","time":"2010/03/21 00:00:00 -0400"},"country":null,"user-email":"liz_kinloch@btinternet.com","event":"AddLocations","longitude":-1.353649,"id":"a6kgrhxosn7v","user-first-name":"Liz"},"type":"Feature","geometry":{"type":"Point","coordinates":[-1.353649,50.96722]}},{"properties":{"city":null,"lattitude":51.535324,"user-last-name":"Raphael","ime":"22:08:15","state/province":null,"street-address":null,"date":{"end_time":"2009/12/19 00:00:00 -0500","original":"12/18/09","granularity":"day","time":"2009/12/18 00:00:00 -0500"},"country":null,"user-email":"richard@391676.com","event":"AddLocations","longitude":0.713524,"id":"a6kgrhn0pc55","user-first-name":"Richard"},"type":"Feature","geometry":{"type":"Point","coordinates":[0.713524,51.535324]}},{"properties":{"city":null,"lattitude":49.037613,"user-last-name":"P","ime":"2:16:38","state/province":null,"street-address":null,"date":{"end_time":"2010/01/21 00:00:00 -0500","original":"01/20/10","granularity":"day","time":"2010/01/20 00:00:00 -0500"},"country":null,"user-email":"dccp@me.com","event":"AddLocations","longitude":-122.800667,"id":"a6kgrhmd8qww","user-first-name":"Deanna"},"type":"Feature","geometry":{"type":"Point","coordinates":[-122.800667,49.037613]}},{"properties":{"city":null,"lattitude":38.88792,"user-last-name":"Clayson","ime":"20:05:30","state/province":null,"street-address":null,"date":{"end_time":"2010/01/07 00:00:00 -0500","original":"01/06/10","granularity":"day","time":"2010/01/06 00:00:00 -0500"},"country":null,"user-email":"steve.clayson@mac.com","event":"AddLocations","longitude":-77.093811,"id":"a6kgrhy431p1","user-first-name":"Steve"},"type":"Feature","geometry":{"type":"Point","coordinates":[-77.093811,38.88792]}},{"properties":{"city":null,"lattitude":51.485207,"user-last-name":"Brazil","ime":"22:28:25","state/province":null,"street-address":null,"date":{"end_time":"2009/12/02 00:00:00 -0500","original":"12/01/09","granularity":"day","time":"2009/12/01 00:00:00 -0500"},"country":null,"user-email":"claire.brazil@sky.com","event":"AddLocations","longitude":-0.608996,"id":"a6kgrhof9uij","user-first-name":"Claire"},"type":"Feature","geometry":{"type":"Point","coordinates":[-0.608996,51.485207]}},{"properties":{"city":null,"lattitude":35.128742,"user-last-name":"Samuels","ime":"0:11:32","state/province":null,"street-address":null,"date":{"end_time":"2010/02/11 00:00:00 -0500","original":"02/10/10","granularity":"day","time":"2010/02/10 00:00:00 -0500"},"country":null,"user-email":"samuelszs@aol.com","event":"AddLocations","longitude":-89.947746,"id":"a6kgrhp7p7ud","user-first-name":"Sherrie"},"type":"Feature","geometry":{"type":"Point","coordinates":[-89.947746,35.128742]}},{"properties":{"city":null,"lattitude":51.045853,"user-last-name":"Spradling","ime":"20:13:58","state/province":null,"street-address":null,"date":{"end_time":"2010/01/18 00:00:00 -0500","original":"01/17/10","granularity":"day","time":"2010/01/17 00:00:00 -0500"},"country":null,"user-email":"andrew@parkingmobility.com","event":"AddLocations","longitude":-114.050644,"id":"a6kgrhn7xp3l","user-first-name":"Andrew"},"type":"Feature","geometry":{"type":"Point","coordinates":[-114.050644,51.045853]}},{"properties":{"city":null,"lattitude":30.327253,"user-last-name":"Spradling","ime":"22:54:20","state/province":null,"street-address":null,"date":{"end_time":"2010/03/29 00:00:00 -0400","original":"03/28/10","granularity":"day","time":"2010/03/28 00:00:00 -0400"},"country":null,"user-email":"andrew@parkingmobility.com","event":"AddLocations","longitude":-97.704857,"id":"a6kgrhy2mkw4","user-first-name":"Andrew"},"type":"Feature","geometry":{"type":"Point","coordinates":[-97.704857,30.327253]}},{"properties":{"city":null,"lattitude":37.332306,"user-last-name":null,"ime":"2:14:46","state/province":null,"street-address":null,"date":{"end_time":"2009/10/12 00:00:00 -0400","original":"10/11/09","granularity":"day","time":"2009/10/11 00:00:00 -0400"},"country":null,"user-email":"system+unknown-user@parkingmobility.com","event":"AddLocations","longitude":-122.033081,"id":"a6kgri0ho9r8","user-first-name":null},"type":"Feature","geometry":{"type":"Point","coordinates":[-122.033081,37.332306]}},{"properties":{"city":null,"lattitude":35.134468,"user-last-name":"Samuels","ime":"3:39:12","state/province":null,"street-address":null,"date":{"end_time":"2010/02/11 00:00:00 -0500","original":"02/10/10","granularity":"day","time":"2010/02/10 00:00:00 -0500"},"country":null,"user-email":"samuelszs@aol.com","event":"AddLocations","longitude":-89.864815,"id":"a6kgrhyv4cvu","user-first-name":"Sherrie"},"type":"Feature","geometry":{"type":"Point","coordinates":[-89.864815,35.134468]}},{"properties":{"city":null,"lattitude":51.266159,"user-last-name":"Eastwood","ime":"22:48:59","state/province":null,"street-address":null,"date":{"end_time":"2009/12/27 00:00:00 -0500","original":"12/26/09","granularity":"day","time":"2009/12/26 00:00:00 -0500"},"country":null,"user-email":"martin1983@live.co.uk","event":"AddLocations","longitude":-1.088921,"id":"a6kgrhxt4a5z","user-first-name":"Martin"},"type":"Feature","geometry":{"type":"Point","coordinates":[-1.088921,51.266159]}},{"properties":{"city":null,"lattitude":48.187134,"user-last-name":"Grass","ime":"16:52:25","state/province":null,"street-address":null,"date":{"end_time":"2010/01/19 00:00:00 -0500","original":"01/18/10","granularity":"day","time":"2010/01/18 00:00:00 -0500"},"country":null,"user-email":"friedrich.grass@chello.at","event":"AddLocations","longitude":16.124538,"id":"a6kgrhrhp8a5","user-first-name":"Friedrich"},"type":"Feature","geometry":{"type":"Point","coordinates":[16.124538,48.187134]}},{"properties":{"city":null,"lattitude":49.284201,"user-last-name":null,"ime":"23:24:08","state/province":null,"street-address":null,"date":{"end_time":"2009/09/28 00:00:00 -0400","original":"09/27/09","granularity":"day","time":"2009/09/27 00:00:00 -0400"},"country":null,"user-email":"system+unknown-user@parkingmobility.com","event":"AddLocations","longitude":-123.121927,"id":"a6kgrhl2b4xj","user-first-name":null},"type":"Feature","geometry":{"type":"Point","coordinates":[-123.121927,49.284201]}},{"properties":{"city":null,"lattitude":38.961308,"user-last-name":"Clayson","ime":"14:54:13","state/province":null,"street-address":null,"date":{"end_time":"2010/01/04 00:00:00 -0500","original":"01/03/10","granularity":"day","time":"2010/01/03 00:00:00 -0500"},"country":null,"user-email":"steve.clayson@mac.com","event":"AddLocations","longitude":-77.355392,"id":"a6kgrhufbvcq","user-first-name":"Steve"},"type":"Feature","geometry":{"type":"Point","coordinates":[-77.355392,38.961308]}},{"properties":{"city":null,"lattitude":49.23678,"user-last-name":null,"ime":"23:24:09","state/province":null,"street-address":null,"date":{"end_time":"2009/09/28 00:00:00 -0400","original":"09/27/09","granularity":"day","time":"2009/09/27 00:00:00 -0400"},"country":null,"user-email":"system+unknown-user@parkingmobility.com","event":"AddLocations","longitude":-123.161317,"id":"a6kgrhogw98p","user-first-name":null},"type":"Feature","geometry":{"type":"Point","coordinates":[-123.161317,49.23678]}},{"properties":{"city":null,"lattitude":52.767162,"user-last-name":"Roland-Shrubb","ime":"0:50:52","state/province":null,"street-address":null,"date":{"end_time":"2010/01/21 00:00:00 -0500","original":"01/20/10","granularity":"day","time":"2010/01/20 00:00:00 -0500"},"country":null,"user-email":"david@roland-shrubb.freeserve.co.uk","event":"AddLocations","longitude":-0.888326,"id":"a6kgrht1xbqx","user-first-name":"David"},"type":"Feature","geometry":{"type":"Point","coordinates":[-0.888326,52.767162]}},{"properties":{"city":null,"lattitude":49.233618,"user-last-name":null,"ime":"23:24:10","state/province":null,"street-address":null,"date":{"end_time":"2009/09/28 00:00:00 -0400","original":"09/27/09","granularity":"day","time":"2009/09/27 00:00:00 -0400"},"country":null,"user-email":"system+unknown-user@parkingmobility.com","event":"AddLocations","longitude":-123.161351,"id":"a6kgrhmntsy6","user-first-name":null},"type":"Feature","geometry":{"type":"Point","coordinates":[-123.161351,49.233618]}},{"properties":{"city":null,"lattitude":49.271247,"user-last-name":null,"ime":"23:24:11","state/province":null,"street-address":null,"date":{"end_time":"2009/09/28 00:00:00 -0400","original":"09/27/09","granularity":"day","time":"2009/09/27 00:00:00 -0400"},"country":null,"user-email":"system+unknown-user@parkingmobility.com","event":"AddLocations","longitude":-123.069193,"id":"a6kgrhs6a69p","user-first-name":null},"type":"Feature","geometry":{"type":"Point","coordinates":[-123.069193,49.271247]}},{"properties":{"city":null,"lattitude":51.047153,"user-last-name":"Spradling","ime":"19:59:47","state/province":null,"street-address":null,"date":{"end_time":"2010/01/18 00:00:00 -0500","original":"01/17/10","granularity":"day","time":"2010/01/17 00:00:00 -0500"},"country":null,"user-email":"andrew@parkingmobility.com","event":"AddLocations","longitude":-114.086563,"id":"a6kgrhn554ys","user-first-name":"Andrew"},"type":"Feature","geometry":{"type":"Point","coordinates":[-114.086563,51.047153]}},{"properties":{"city":null,"lattitude":48.186024,"user-last-name":"Grass","ime":"22:11:01","state/province":null,"street-address":null,"date":{"end_time":"2010/01/16 00:00:00 -0500","original":"01/15/10","granularity":"day","time":"2010/01/15 00:00:00 -0500"},"country":null,"user-email":"friedrich.grass@chello.at","event":"AddLocations","longitude":16.302263,"id":"a6kgri0d6j6u","user-first-name":"Friedrich"},"type":"Feature","geometry":{"type":"Point","coordinates":[16.302263,48.186024]}},{"properties":{"city":null,"lattitude":49.282925,"user-last-name":null,"ime":"23:24:12","state/province":null,"street-address":null,"date":{"end_time":"2009/09/28 00:00:00 -0400","original":"09/27/09","granularity":"day","time":"2009/09/27 00:00:00 -0400"},"country":null,"user-email":"system+unknown-user@parkingmobility.com","event":"AddLocations","longitude":-123.121273,"id":"a6kgrho58t94","user-first-name":null},"type":"Feature","geometry":{"type":"Point","coordinates":[-123.121273,49.282925]}},{"properties":{"city":null,"lattitude":49.262115,"user-last-name":"Nachbaur","ime":"18:10:01","state/province":null,"street-address":null,"date":{"end_time":"2010/01/14 00:00:00 -0500","original":"01/13/10","granularity":"day","time":"2010/01/13 00:00:00 -0500"},"country":null,"user-email":"michael@nachbaur.com","event":"AddLocations","longitude":-123.121674,"id":"a6kgri00f8u7","user-first-name":"Mike"},"type":"Feature","geometry":{"type":"Point","coordinates":[-123.121674,49.262115]}},{"properties":{"city":null,"lattitude":49.283113,"user-last-name":null,"ime":"23:24:13","state/province":null,"street-address":null,"date":{"end_time":"2009/09/28 00:00:00 -0400","original":"09/27/09","granularity":"day","time":"2009/09/27 00:00:00 -0400"},"country":null,"user-email":"system+unknown-user@parkingmobility.com","event":"AddLocations","longitude":-123.121219,"id":"a6kgrhy9yavj","user-first-name":null},"type":"Feature","geometry":{"type":"Point","coordinates":[-123.121219,49.283113]}},{"properties":{"city":null,"lattitude":35.116371,"user-last-name":"Samuels","ime":"14:41:26","state/province":null,"street-address":null,"date":{"end_time":"2010/02/08 00:00:00 -0500","original":"02/07/10","granularity":"day","time":"2010/02/07 00:00:00 -0500"},"country":null,"user-email":"samuelszs@aol.com","event":"AddLocations","longitude":-89.894936,"id":"a6kgrhto3y45","user-first-name":"Sherrie"},"type":"Feature","geometry":{"type":"Point","coordinates":[-89.894936,35.116371]}},{"properties":{"city":null,"lattitude":35.141701,"user-last-name":"Samuels","ime":"0:40:21","state/province":null,"street-address":null,"date":{"end_time":"2010/02/11 00:00:00 -0500","original":"02/10/10","granularity":"day","time":"2010/02/10 00:00:00 -0500"},"country":null,"user-email":"samuelszs@aol.com","event":"AddLocations","longitude":-89.79805,"id":"a6kgrht9hghr","user-first-name":"Sherrie"},"type":"Feature","geometry":{"type":"Point","coordinates":[-89.79805,35.141701]}},{"properties":{"city":null,"lattitude":49.27218,"user-last-name":null,"ime":"23:24:14","state/province":null,"street-address":null,"date":{"end_time":"2009/09/28 00:00:00 -0400","original":"09/27/09","granularity":"day","time":"2009/09/27 00:00:00 -0400"},"country":null,"user-email":"system+unknown-user@parkingmobility.com","event":"AddLocations","longitude":-123.069865,"id":"a6kgrhkuk59a","user-first-name":null},"type":"Feature","geometry":{"type":"Point","coordinates":[-123.069865,49.27218]}},{"properties":{"city":null,"lattitude":49.27573,"user-last-name":null,"ime":"23:24:14","state/province":null,"street-address":null,"date":{"end_time":"2009/09/28 00:00:00 -0400","original":"09/27/09","granularity":"day","time":"2009/09/27 00:00:00 -0400"},"country":null,"user-email":"system+unknown-user@parkingmobility.com","event":"AddLocations","longitude":-123.069265,"id":"a6kgrhki81bb","user-first-name":null},"type":"Feature","geometry":{"type":"Point","coordinates":[-123.069265,49.27573]}},{"properties":{"city":null,"lattitude":49.28032,"user-last-name":null,"ime":"23:24:15","state/province":null,"street-address":null,"date":{"end_time":"2009/09/28 00:00:00 -0400","original":"09/27/09","granularity":"day","time":"2009/09/27 00:00:00 -0400"},"country":null,"user-email":"system+unknown-user@parkingmobility.com","event":"AddLocations","longitude":-123.101352,"id":"a6kgrhtnh4f7","user-first-name":null},"type":"Feature","geometry":{"type":"Point","coordinates":[-123.101352,49.28032]}},{"properties":{"city":null,"lattitude":49.236842,"user-last-name":null,"ime":"23:24:15","state/province":null,"street-address":null,"date":{"end_time":"2009/09/28 00:00:00 -0400","original":"09/27/09","granularity":"day","time":"2009/09/27 00:00:00 -0400"},"country":null,"user-email":"system+unknown-user@parkingmobility.com","event":"AddLocations","longitude":-123.159807,"id":"a6kgrhqx2swz","user-first-name":null},"type":"Feature","geometry":{"type":"Point","coordinates":[-123.159807,49.236842]}},{"properties":{"city":null,"lattitude":49.232238,"user-last-name":null,"ime":"23:24:15","state/province":null,"street-address":null,"date":{"end_time":"2009/09/28 00:00:00 -0400","original":"09/27/09","granularity":"day","time":"2009/09/27 00:00:00 -0400"},"country":null,"user-email":"system+unknown-user@parkingmobility.com","event":"AddLocations","longitude":-123.160108,"id":"a6kgrhkoqfeg","user-first-name":null},"type":"Feature","geometry":{"type":"Point","coordinates":[-123.160108,49.232238]}},{"properties":{"city":null,"lattitude":49.325321,"user-last-name":"Favella","ime":"2:11:02","state/province":null,"street-address":null,"date":{"end_time":"2010/02/07 00:00:00 -0500","original":"02/06/10","granularity":"day","time":"2010/02/06 00:00:00 -0500"},"country":null,"user-email":"xgr24@yahoo.ca","event":"AddLocations","longitude":-123.141571,"id":"a6kgrhkohk8t","user-first-name":"Alex"},"type":"Feature","geometry":{"type":"Point","coordinates":[-123.141571,49.325321]}},{"properties":{"city":null,"lattitude":30.253197,"user-last-name":"S","ime":"23:19:32","state/province":null,"street-address":null,"date":{"end_time":"2010/03/20 00:00:00 -0400","original":"03/19/10","granularity":"day","time":"2010/03/19 00:00:00 -0400"},"country":null,"user-email":"qqmech@gmail.com","event":"AddLocations","longitude":-97.768135,"id":"a6kgrhtxgksw","user-first-name":"Mike"},"type":"Feature","geometry":{"type":"Point","coordinates":[-97.768135,30.253197]}},{"properties":{"city":null,"lattitude":49.27398,"user-last-name":null,"ime":"23:24:16","state/province":null,"street-address":null,"date":{"end_time":"2009/09/28 00:00:00 -0400","original":"09/27/09","granularity":"day","time":"2009/09/27 00:00:00 -0400"},"country":null,"user-email":"system+unknown-user@parkingmobility.com","event":"AddLocations","longitude":-123.069242,"id":"a6kgrhqpkg8c","user-first-name":null},"type":"Feature","geometry":{"type":"Point","coordinates":[-123.069242,49.27398]}},{"properties":{"city":null,"lattitude":49.237811,"user-last-name":null,"ime":"23:24:16","state/province":null,"street-address":null,"date":{"end_time":"2009/09/28 00:00:00 -0400","original":"09/27/09","granularity":"day","time":"2009/09/27 00:00:00 -0400"},"country":null,"user-email":"system+unknown-user@parkingmobility.com","event":"AddLocations","longitude":-123.158484,"id":"a6kgrhtdaxs2","user-first-name":null},"type":"Feature","geometry":{"type":"Point","coordinates":[-123.158484,49.237811]}},{"properties":{"city":null,"lattitude":49.263448,"user-last-name":null,"ime":"23:24:17","state/province":null,"street-address":null,"date":{"end_time":"2009/09/28 00:00:00 -0400","original":"09/27/09","granularity":"day","time":"2009/09/27 00:00:00 -0400"},"country":null,"user-email":"system+unknown-user@parkingmobility.com","event":"AddLocations","longitude":-123.12386,"id":"a6kgrhwdcmso","user-first-name":null},"type":"Feature","geometry":{"type":"Point","coordinates":[-123.12386,49.263448]}},{"properties":{"city":null,"lattitude":53.541817,"user-last-name":"Sandilands","ime":"22:18:28","state/province":null,"street-address":null,"date":{"end_time":"2010/02/15 00:00:00 -0500","original":"02/14/10","granularity":"day","time":"2010/02/14 00:00:00 -0500"},"country":null,"user-email":"bdsandilands@me.com","event":"AddLocations","longitude":-113.58078,"id":"a6kgrhq04kih","user-first-name":"Bryan"},"type":"Feature","geometry":{"type":"Point","coordinates":[-113.58078,53.541817]}},{"properties":{"city":null,"lattitude":37.331463,"user-last-name":"Dan","ime":"22:56:02","state/province":null,"street-address":null,"date":{"end_time":"2009/11/21 00:00:00 -0500","original":"11/20/09","granularity":"day","time":"2009/11/20 00:00:00 -0500"},"country":null,"user-email":"dive3452@gmail.com","event":"AddLocations","longitude":-122.005844,"id":"a6kgrhwb4hxy","user-first-name":"Diver"},"type":"Feature","geometry":{"type":"Point","coordinates":[-122.005844,37.331463]}},{"properties":{"city":null,"lattitude":35.226025,"user-last-name":"Samuels","ime":"14:16:27","state/province":null,"street-address":null,"date":{"end_time":"2010/02/11 00:00:00 -0500","original":"02/10/10","granularity":"day","time":"2010/02/10 00:00:00 -0500"},"country":null,"user-email":"samuelszs@aol.com","event":"AddLocations","longitude":-89.730995,"id":"a6kgrhk7psrp","user-first-name":"Sherrie"},"type":"Feature","geometry":{"type":"Point","coordinates":[-89.730995,35.226025]}},{"properties":{"city":null,"lattitude":49.254083,"user-last-name":null,"ime":"23:24:17","state/province":null,"street-address":null,"date":{"end_time":"2009/09/28 00:00:00 -0400","original":"09/27/09","granularity":"day","time":"2009/09/27 00:00:00 -0400"},"country":null,"user-email":"system+unknown-user@parkingmobility.com","event":"AddLocations","longitude":-123.10074,"id":"a6kgrhp7y70e","user-first-name":null},"type":"Feature","geometry":{"type":"Point","coordinates":[-123.10074,49.254083]}},{"properties":{"city":null,"lattitude":-33.888649,"user-last-name":"Paulsen","ime":"9:40:02","state/province":null,"street-address":null,"date":{"end_time":"2010/04/04 00:00:00 -0400","original":"04/03/10","granularity":"day","time":"2010/04/03 00:00:00 -0400"},"country":null,"user-email":"purse1@yahoo.com","event":"AddLocations","longitude":151.177383,"id":"a6kgrhuupbsm","user-first-name":"David"},"type":"Feature","geometry":{"type":"Point","coordinates":[151.177383,-33.888649]}},{"properties":{"city":null,"lattitude":49.262189,"user-last-name":null,"ime":"23:24:17","state/province":null,"street-address":null,"date":{"end_time":"2009/09/28 00:00:00 -0400","original":"09/27/09","granularity":"day","time":"2009/09/27 00:00:00 -0400"},"country":null,"user-email":"system+unknown-user@parkingmobility.com","event":"AddLocations","longitude":-123.101146,"id":"a6kgrhm4p36h","user-first-name":null},"type":"Feature","geometry":{"type":"Point","coordinates":[-123.101146,49.262189]}},{"properties":{"city":null,"lattitude":49.234602,"user-last-name":null,"ime":"23:24:18","state/province":null,"street-address":null,"date":{"end_time":"2009/09/28 00:00:00 -0400","original":"09/27/09","granularity":"day","time":"2009/09/27 00:00:00 -0400"},"country":null,"user-email":"system+unknown-user@parkingmobility.com","event":"AddLocations","longitude":-123.161686,"id":"a6kgrhlag99w","user-first-name":null},"type":"Feature","geometry":{"type":"Point","coordinates":[-123.161686,49.234602]}},{"properties":{"city":null,"lattitude":49.247102,"user-last-name":null,"ime":"23:24:18","state/province":null,"street-address":null,"date":{"end_time":"2009/09/28 00:00:00 -0400","original":"09/27/09","granularity":"day","time":"2009/09/27 00:00:00 -0400"},"country":null,"user-email":"system+unknown-user@parkingmobility.com","event":"AddLocations","longitude":-123.101067,"id":"a6kgrhsmz1wx","user-first-name":null},"type":"Feature","geometry":{"type":"Point","coordinates":[-123.101067,49.247102]}},{"properties":{"city":null,"lattitude":49.250122,"user-last-name":null,"ime":"23:24:18","state/province":null,"street-address":null,"date":{"end_time":"2009/09/28 00:00:00 -0400","original":"09/27/09","granularity":"day","time":"2009/09/27 00:00:00 -0400"},"country":null,"user-email":"system+unknown-user@parkingmobility.com","event":"AddLocations","longitude":-123.10113,"id":"a6kgrhkbnnq4","user-first-name":null},"type":"Feature","geometry":{"type":"Point","coordinates":[-123.10113,49.250122]}},{"properties":{"city":null,"lattitude":49.267647,"user-last-name":null,"ime":"23:24:19","state/province":null,"street-address":null,"date":{"end_time":"2009/09/28 00:00:00 -0400","original":"09/27/09","granularity":"day","time":"2009/09/27 00:00:00 -0400"},"country":null,"user-email":"system+unknown-user@parkingmobility.com","event":"AddLocations","longitude":-123.069548,"id":"a6kgrhskwebf","user-first-name":null},"type":"Feature","geometry":{"type":"Point","coordinates":[-123.069548,49.267647]}},{"properties":{"city":null,"lattitude":45.467335,"user-last-name":"D","ime":"7:33:23","state/province":null,"street-address":null,"date":{"end_time":"2010/03/03 00:00:00 -0500","original":"03/02/10","granularity":"day","time":"2010/03/02 00:00:00 -0500"},"country":null,"user-email":"kentia000@hotmail.com","event":"AddLocations","longitude":-73.540077,"id":"a6kgrhp9eju5","user-first-name":"Mel"},"type":"Feature","geometry":{"type":"Point","coordinates":[-73.540077,45.467335]}},{"properties":{"city":null,"lattitude":45.456882,"user-last-name":"D","ime":"17:47:46","state/province":null,"street-address":null,"date":{"end_time":"2010/02/26 00:00:00 -0500","original":"02/25/10","granularity":"day","time":"2010/02/25 00:00:00 -0500"},"country":null,"user-email":"kentia000@hotmail.com","event":"AddLocations","longitude":-73.546623,"id":"a6kgrhkba7bi","user-first-name":"Mel"},"type":"Feature","geometry":{"type":"Point","coordinates":[-73.546623,45.456882]}},{"properties":{"city":null,"lattitude":49.278593,"user-last-name":null,"ime":"23:24:19","state/province":null,"street-address":null,"date":{"end_time":"2009/09/28 00:00:00 -0400","original":"09/27/09","granularity":"day","time":"2009/09/27 00:00:00 -0400"},"country":null,"user-email":"system+unknown-user@parkingmobility.com","event":"AddLocations","longitude":-123.097432,"id":"a6kgrhknas7x","user-first-name":null},"type":"Feature","geometry":{"type":"Point","coordinates":[-123.097432,49.278593]}},{"properties":{"city":null,"lattitude":49.280364,"user-last-name":null,"ime":"23:24:20","state/province":null,"street-address":null,"date":{"end_time":"2009/09/28 00:00:00 -0400","original":"09/27/09","granularity":"day","time":"2009/09/27 00:00:00 -0400"},"country":null,"user-email":"system+unknown-user@parkingmobility.com","event":"AddLocations","longitude":-123.099077,"id":"a6kgrhsn5id3","user-first-name":null},"type":"Feature","geometry":{"type":"Point","coordinates":[-123.099077,49.280364]}},{"properties":{"city":null,"lattitude":49.279559,"user-last-name":null,"ime":"23:24:20","state/province":null,"street-address":null,"date":{"end_time":"2009/09/28 00:00:00 -0400","original":"09/27/09","granularity":"day","time":"2009/09/27 00:00:00 -0400"},"country":null,"user-email":"system+unknown-user@parkingmobility.com","event":"AddLocations","longitude":-123.100333,"id":"a6kgrhzj7gqz","user-first-name":null},"type":"Feature","geometry":{"type":"Point","coordinates":[-123.100333,49.279559]}},{"properties":{"city":null,"lattitude":49.267918,"user-last-name":null,"ime":"23:24:20","state/province":null,"street-address":null,"date":{"end_time":"2009/09/28 00:00:00 -0400","original":"09/27/09","granularity":"day","time":"2009/09/27 00:00:00 -0400"},"country":null,"user-email":"system+unknown-user@parkingmobility.com","event":"AddLocations","longitude":-123.150453,"id":"a6kgrhlpe42y","user-first-name":null},"type":"Feature","geometry":{"type":"Point","coordinates":[-123.150453,49.267918]}},{"properties":{"city":null,"lattitude":51.500477,"user-last-name":"Rodriguez amad","ime":"13:18:47","state/province":null,"street-address":null,"date":{"end_time":"2009/12/07 00:00:00 -0500","original":"12/06/09","granularity":"day","time":"2009/12/06 00:00:00 -0500"},"country":null,"user-email":"rodriguez78@hotmail.co.uk","event":"AddLocations","longitude":-0.196044,"id":"a6kgrhvw8yj2","user-first-name":"Carlos"},"type":"Feature","geometry":{"type":"Point","coordinates":[-0.196044,51.500477]}},{"properties":{"city":null,"lattitude":49.268269,"user-last-name":null,"ime":"23:24:21","state/province":null,"street-address":null,"date":{"end_time":"2009/09/28 00:00:00 -0400","original":"09/27/09","granularity":"day","time":"2009/09/27 00:00:00 -0400"},"country":null,"user-email":"system+unknown-user@parkingmobility.com","event":"AddLocations","longitude":-123.166158,"id":"a6kgrhuckhsy","user-first-name":null},"type":"Feature","geometry":{"type":"Point","coordinates":[-123.166158,49.268269]}},{"properties":{"city":null,"lattitude":49.267974,"user-last-name":null,"ime":"23:24:21","state/province":null,"street-address":null,"date":{"end_time":"2009/09/28 00:00:00 -0400","original":"09/27/09","granularity":"day","time":"2009/09/27 00:00:00 -0400"},"country":null,"user-email":"system+unknown-user@parkingmobility.com","event":"AddLocations","longitude":-123.14754,"id":"a6kgrhr8q23z","user-first-name":null},"type":"Feature","geometry":{"type":"Point","coordinates":[-123.14754,49.267974]}},{"properties":{"city":null,"lattitude":49.288055,"user-last-name":null,"ime":"23:24:22","state/province":null,"street-address":null,"date":{"end_time":"2009/09/28 00:00:00 -0400","original":"09/27/09","granularity":"day","time":"2009/09/27 00:00:00 -0400"},"country":null,"user-email":"system+unknown-user@parkingmobility.com","event":"AddLocations","longitude":-123.129796,"id":"a6kgrhpr7q59","user-first-name":null},"type":"Feature","geometry":{"type":"Point","coordinates":[-123.129796,49.288055]}},{"properties":{"city":null,"lattitude":49.291635,"user-last-name":null,"ime":"23:24:22","state/province":null,"street-address":null,"date":{"end_time":"2009/09/28 00:00:00 -0400","original":"09/27/09","granularity":"day","time":"2009/09/27 00:00:00 -0400"},"country":null,"user-email":"system+unknown-user@parkingmobility.com","event":"AddLocations","longitude":-123.135596,"id":"a6kgrhtzdykg","user-first-name":null},"type":"Feature","geometry":{"type":"Point","coordinates":[-123.135596,49.291635]}},{"properties":{"city":null,"lattitude":30.282381,"user-last-name":"Spradling","ime":"18:32:10","state/province":null,"street-address":null,"date":{"end_time":"2010/03/27 00:00:00 -0400","original":"03/26/10","granularity":"day","time":"2010/03/26 00:00:00 -0400"},"country":null,"user-email":"andrew@parkingmobility.com","event":"AddLocations","longitude":-97.741837,"id":"a6kgrhttwcmf","user-first-name":"Andrew"},"type":"Feature","geometry":{"type":"Point","coordinates":[-97.741837,30.282381]}},{"properties":{"city":null,"lattitude":49.28796,"user-last-name":null,"ime":"23:24:22","state/province":null,"street-address":null,"date":{"end_time":"2009/09/28 00:00:00 -0400","original":"09/27/09","granularity":"day","time":"2009/09/27 00:00:00 -0400"},"country":null,"user-email":"system+unknown-user@parkingmobility.com","event":"AddLocations","longitude":-123.137738,"id":"a6kgrhxgsoqq","user-first-name":null},"type":"Feature","geometry":{"type":"Point","coordinates":[-123.137738,49.28796]}},{"properties":{"city":null,"lattitude":49.290867,"user-last-name":null,"ime":"15:45:11","state/province":null,"street-address":null,"date":{"end_time":"2009/10/17 00:00:00 -0400","original":"10/16/09","granularity":"day","time":"2009/10/16 00:00:00 -0400"},"country":null,"user-email":"Campbell.macdonald@gmail.com","event":"AddLocations","longitude":-123.135239,"id":"a6kgrhofh4nx","user-first-name":null},"type":"Feature","geometry":{"type":"Point","coordinates":[-123.135239,49.290867]}},{"properties":{"city":null,"lattitude":49.287822,"user-last-name":null,"ime":"23:24:23","state/province":null,"street-address":null,"date":{"end_time":"2009/09/28 00:00:00 -0400","original":"09/27/09","granularity":"day","time":"2009/09/27 00:00:00 -0400"},"country":null,"user-email":"system+unknown-user@parkingmobility.com","event":"AddLocations","longitude":-123.140605,"id":"a6kgrhpjhajo","user-first-name":null},"type":"Feature","geometry":{"type":"Point","coordinates":[-123.140605,49.287822]}},{"properties":{"city":null,"lattitude":49.290176,"user-last-name":null,"ime":"23:24:23","state/province":null,"street-address":null,"date":{"end_time":"2009/09/28 00:00:00 -0400","original":"09/27/09","granularity":"day","time":"2009/09/27 00:00:00 -0400"},"country":null,"user-email":"system+unknown-user@parkingmobility.com","event":"AddLocations","longitude":-123.1378,"id":"a6kgrhl3nt7a","user-first-name":null},"type":"Feature","geometry":{"type":"Point","coordinates":[-123.1378,49.290176]}},{"properties":{"city":null,"lattitude":49.280955,"user-last-name":null,"ime":"23:24:23","state/province":null,"street-address":null,"date":{"end_time":"2009/09/28 00:00:00 -0400","original":"09/27/09","granularity":"day","time":"2009/09/27 00:00:00 -0400"},"country":null,"user-email":"system+unknown-user@parkingmobility.com","event":"AddLocations","longitude":-123.049416,"id":"a6kgrhxkqoq0","user-first-name":null},"type":"Feature","geometry":{"type":"Point","coordinates":[-123.049416,49.280955]}},{"properties":{"city":null,"lattitude":49.26394,"user-last-name":null,"ime":"23:24:24","state/province":null,"street-address":null,"date":{"end_time":"2009/09/28 00:00:00 -0400","original":"09/27/09","granularity":"day","time":"2009/09/27 00:00:00 -0400"},"country":null,"user-email":"system+unknown-user@parkingmobility.com","event":"AddLocations","longitude":-123.164868,"id":"a6kgrhrbrh2h","user-first-name":null},"type":"Feature","geometry":{"type":"Point","coordinates":[-123.164868,49.26394]}},{"properties":{"city":null,"lattitude":49.264034,"user-last-name":null,"ime":"23:24:24","state/province":null,"street-address":null,"date":{"end_time":"2009/09/28 00:00:00 -0400","original":"09/27/09","granularity":"day","time":"2009/09/27 00:00:00 -0400"},"country":null,"user-email":"system+unknown-user@parkingmobility.com","event":"AddLocations","longitude":-123.17035,"id":"a6kgrhz10cfa","user-first-name":null},"type":"Feature","geometry":{"type":"Point","coordinates":[-123.17035,49.264034]}},{"properties":{"city":null,"lattitude":49.276527,"user-last-name":null,"ime":"23:24:24","state/province":null,"street-address":null,"date":{"end_time":"2009/09/28 00:00:00 -0400","original":"09/27/09","granularity":"day","time":"2009/09/27 00:00:00 -0400"},"country":null,"user-email":"system+unknown-user@parkingmobility.com","event":"AddLocations","longitude":-123.119194,"id":"a6kgrhss4018","user-first-name":null},"type":"Feature","geometry":{"type":"Point","coordinates":[-123.119194,49.276527]}},{"properties":{"city":null,"lattitude":49.276087,"user-last-name":null,"ime":"23:24:24","state/province":null,"street-address":null,"date":{"end_time":"2009/09/28 00:00:00 -0400","original":"09/27/09","granularity":"day","time":"2009/09/27 00:00:00 -0400"},"country":null,"user-email":"system+unknown-user@parkingmobility.com","event":"AddLocations","longitude":-123.120969,"id":"a6kgrhsr33an","user-first-name":null},"type":"Feature","geometry":{"type":"Point","coordinates":[-123.120969,49.276087]}},{"properties":{"city":null,"lattitude":49.264096,"user-last-name":null,"ime":"23:24:25","state/province":null,"street-address":null,"date":{"end_time":"2009/09/28 00:00:00 -0400","original":"09/27/09","granularity":"day","time":"2009/09/27 00:00:00 -0400"},"country":null,"user-email":"system+unknown-user@parkingmobility.com","event":"AddLocations","longitude":-123.173328,"id":"a6kgrhmgb3rh","user-first-name":null},"type":"Feature","geometry":{"type":"Point","coordinates":[-123.173328,49.264096]}},{"properties":{"city":null,"lattitude":49.282943,"user-last-name":null,"ime":"23:24:25","state/province":null,"street-address":null,"date":{"end_time":"2009/09/28 00:00:00 -0400","original":"09/27/09","granularity":"day","time":"2009/09/27 00:00:00 -0400"},"country":null,"user-email":"system+unknown-user@parkingmobility.com","event":"AddLocations","longitude":-123.11344,"id":"a6kgrhspjfkk","user-first-name":null},"type":"Feature","geometry":{"type":"Point","coordinates":[-123.11344,49.282943]}},{"properties":{"city":null,"lattitude":49.289359,"user-last-name":null,"ime":"23:24:25","state/province":null,"street-address":null,"date":{"end_time":"2009/09/28 00:00:00 -0400","original":"09/27/09","granularity":"day","time":"2009/09/27 00:00:00 -0400"},"country":null,"user-email":"system+unknown-user@parkingmobility.com","event":"AddLocations","longitude":-123.132531,"id":"a6kgrhvmzd0f","user-first-name":null},"type":"Feature","geometry":{"type":"Point","coordinates":[-123.132531,49.289359]}},{"properties":{"city":null,"lattitude":43.435749,"user-last-name":"Gibaud","ime":"1:08:48","state/province":null,"street-address":null,"date":{"end_time":"2009/12/19 00:00:00 -0500","original":"12/18/09","granularity":"day","time":"2009/12/18 00:00:00 -0500"},"country":null,"user-email":"gibaud.chris@gmail.com","event":"AddLocations","longitude":5.258636,"id":"a6kgrhw30t2u","user-first-name":"Chris"},"type":"Feature","geometry":{"type":"Point","coordinates":[5.258636,43.435749]}},{"properties":{"city":null,"lattitude":49.275622,"user-last-name":null,"ime":"23:24:26","state/province":null,"street-address":null,"date":{"end_time":"2009/09/28 00:00:00 -0400","original":"09/27/09","granularity":"day","time":"2009/09/27 00:00:00 -0400"},"country":null,"user-email":"system+unknown-user@parkingmobility.com","event":"AddLocations","longitude":-123.126665,"id":"a6kgrht9vjon","user-first-name":null},"type":"Feature","geometry":{"type":"Point","coordinates":[-123.126665,49.275622]}},{"properties":{"city":null,"lattitude":49.237444,"user-last-name":null,"ime":"23:24:26","state/province":null,"street-address":null,"date":{"end_time":"2009/09/28 00:00:00 -0400","original":"09/27/09","granularity":"day","time":"2009/09/27 00:00:00 -0400"},"country":null,"user-email":"system+unknown-user@parkingmobility.com","event":"AddLocations","longitude":-123.032668,"id":"a6kgrhyaenex","user-first-name":null},"type":"Feature","geometry":{"type":"Point","coordinates":[-123.032668,49.237444]}},{"properties":{"city":null,"lattitude":51.474861,"user-last-name":"Olli","ime":"10:19:37","state/province":null,"street-address":null,"date":{"end_time":"2010/04/13 00:00:00 -0400","original":"04/12/10","granularity":"day","time":"2010/04/12 00:00:00 -0400"},"country":null,"user-email":"sam_olli@msn.com","event":"AddLocations","longitude":-0.084908,"id":"a6kgrhxpeicj","user-first-name":"Sam"},"type":"Feature","geometry":{"type":"Point","coordinates":[-0.084908,51.474861]}},{"properties":{"city":null,"lattitude":49.237405,"user-last-name":null,"ime":"23:24:26","state/province":null,"street-address":null,"date":{"end_time":"2009/09/28 00:00:00 -0400","original":"09/27/09","granularity":"day","time":"2009/09/27 00:00:00 -0400"},"country":null,"user-email":"system+unknown-user@parkingmobility.com","event":"AddLocations","longitude":-123.032353,"id":"a6kgrhro57c3","user-first-name":null},"type":"Feature","geometry":{"type":"Point","coordinates":[-123.032353,49.237405]}},{"properties":{"city":null,"lattitude":35.099827,"user-last-name":"Samuels","ime":"13:58:41","state/province":null,"street-address":null,"date":{"end_time":"2010/02/08 00:00:00 -0500","original":"02/07/10","granularity":"day","time":"2010/02/07 00:00:00 -0500"},"country":null,"user-email":"samuelszs@aol.com","event":"AddLocations","longitude":-89.844635,"id":"a6kgrhmu41v8","user-first-name":"Sherrie"},"type":"Feature","geometry":{"type":"Point","coordinates":[-89.844635,35.099827]}},{"properties":{"city":null,"lattitude":49.233088,"user-last-name":null,"ime":"23:24:27","state/province":null,"street-address":null,"date":{"end_time":"2009/09/28 00:00:00 -0400","original":"09/27/09","granularity":"day","time":"2009/09/27 00:00:00 -0400"},"country":null,"user-email":"system+unknown-user@parkingmobility.com","event":"AddLocations","longitude":-123.065429,"id":"a6kgrhmnpqqu","user-first-name":null},"type":"Feature","geometry":{"type":"Point","coordinates":[-123.065429,49.233088]}},{"properties":{"city":null,"lattitude":49.2305,"user-last-name":null,"ime":"23:24:27","state/province":null,"street-address":null,"date":{"end_time":"2009/09/28 00:00:00 -0400","original":"09/27/09","granularity":"day","time":"2009/09/27 00:00:00 -0400"},"country":null,"user-email":"system+unknown-user@parkingmobility.com","event":"AddLocations","longitude":-123.065729,"id":"a6kgrhq4s5cn","user-first-name":null},"type":"Feature","geometry":{"type":"Point","coordinates":[-123.065729,49.2305]}},{"properties":{"city":null,"lattitude":49.258014,"user-last-name":null,"ime":"23:24:27","state/province":null,"street-address":null,"date":{"end_time":"2009/09/28 00:00:00 -0400","original":"09/27/09","granularity":"day","time":"2009/09/27 00:00:00 -0400"},"country":null,"user-email":"system+unknown-user@parkingmobility.com","event":"AddLocations","longitude":-123.138394,"id":"a6kgri00y6ua","user-first-name":null},"type":"Feature","geometry":{"type":"Point","coordinates":[-123.138394,49.258014]}},{"properties":{"city":null,"lattitude":35.120892,"user-last-name":"Samuels","ime":"17:27:32","state/province":null,"street-address":null,"date":{"end_time":"2010/02/13 00:00:00 -0500","original":"02/12/10","granularity":"day","time":"2010/02/12 00:00:00 -0500"},"country":null,"user-email":"samuelszs@aol.com","event":"AddLocations","longitude":-89.874184,"id":"a6kgrhk0xevd","user-first-name":"Sherrie"},"type":"Feature","geometry":{"type":"Point","coordinates":[-89.874184,35.120892]}},{"properties":{"city":null,"lattitude":30.290909,"user-last-name":"S","ime":"21:58:19","state/province":null,"street-address":null,"date":{"end_time":"2010/02/08 00:00:00 -0500","original":"02/07/10","granularity":"day","time":"2010/02/07 00:00:00 -0500"},"country":null,"user-email":"qqmech@gmail.com","event":"AddLocations","longitude":-97.739738,"id":"a6kgrhlwzo9a","user-first-name":"Mike"},"type":"Feature","geometry":{"type":"Point","coordinates":[-97.739738,30.290909]}},{"properties":{"city":null,"lattitude":49.262697,"user-last-name":null,"ime":"23:24:28","state/province":null,"street-address":null,"date":{"end_time":"2009/09/28 00:00:00 -0400","original":"09/27/09","granularity":"day","time":"2009/09/27 00:00:00 -0400"},"country":null,"user-email":"system+unknown-user@parkingmobility.com","event":"AddLocations","longitude":-123.139615,"id":"a6kgrhxbn8oh","user-first-name":null},"type":"Feature","geometry":{"type":"Point","coordinates":[-123.139615,49.262697]}},{"properties":{"city":null,"lattitude":49.265324,"user-last-name":null,"ime":"23:24:28","state/province":null,"street-address":null,"date":{"end_time":"2009/09/28 00:00:00 -0400","original":"09/27/09","granularity":"day","time":"2009/09/27 00:00:00 -0400"},"country":null,"user-email":"system+unknown-user@parkingmobility.com","event":"AddLocations","longitude":-123.138925,"id":"a6kgrhx55xb4","user-first-name":null},"type":"Feature","geometry":{"type":"Point","coordinates":[-123.138925,49.265324]}},{"properties":{"city":null,"lattitude":49.274782,"user-last-name":null,"ime":"23:24:28","state/province":null,"street-address":null,"date":{"end_time":"2009/09/28 00:00:00 -0400","original":"09/27/09","granularity":"day","time":"2009/09/27 00:00:00 -0400"},"country":null,"user-email":"system+unknown-user@parkingmobility.com","event":"AddLocations","longitude":-123.119352,"id":"a6kgri08ih3o","user-first-name":null},"type":"Feature","geometry":{"type":"Point","coordinates":[-123.119352,49.274782]}},{"properties":{"city":null,"lattitude":49.284561,"user-last-name":null,"ime":"7:12:03","state/province":null,"street-address":null,"date":{"end_time":"2010/03/03 00:00:00 -0500","original":"03/02/10","granularity":"day","time":"2010/03/02 00:00:00 -0500"},"country":null,"user-email":"ian@coalharbourgroup.com","event":"AddLocations","longitude":-123.1371,"id":"a6kgrhyudnfm","user-first-name":null},"type":"Feature","geometry":{"type":"Point","coordinates":[-123.1371,49.284561]}},{"properties":{"city":null,"lattitude":39.954163,"user-last-name":"Durso","ime":"1:23:41","state/province":null,"street-address":null,"date":{"end_time":"2010/03/01 00:00:00 -0500","original":"02/28/10","granularity":"day","time":"2010/02/28 00:00:00 -0500"},"country":null,"user-email":"kbrenneck@gmail.com","event":"AddLocations","longitude":-75.146255,"id":"a6kgrhv37s1f","user-first-name":"Kris"},"type":"Feature","geometry":{"type":"Point","coordinates":[-75.146255,39.954163]}},{"properties":{"city":null,"lattitude":49.26406,"user-last-name":null,"ime":"23:24:29","state/province":null,"street-address":null,"date":{"end_time":"2009/09/28 00:00:00 -0400","original":"09/27/09","granularity":"day","time":"2009/09/27 00:00:00 -0400"},"country":null,"user-email":"system+unknown-user@parkingmobility.com","event":"AddLocations","longitude":-123.162689,"id":"a6kgrhlca5r1","user-first-name":null},"type":"Feature","geometry":{"type":"Point","coordinates":[-123.162689,49.26406]}},{"properties":{"city":null,"lattitude":49.228809,"user-last-name":null,"ime":"23:24:29","state/province":null,"street-address":null,"date":{"end_time":"2009/09/28 00:00:00 -0400","original":"09/27/09","granularity":"day","time":"2009/09/27 00:00:00 -0400"},"country":null,"user-email":"system+unknown-user@parkingmobility.com","event":"AddLocations","longitude":-123.090801,"id":"a6kgrhk215eb","user-first-name":null},"type":"Feature","geometry":{"type":"Point","coordinates":[-123.090801,49.228809]}},{"properties":{"city":null,"lattitude":49.226714,"user-last-name":null,"ime":"23:24:29","state/province":null,"street-address":null,"date":{"end_time":"2009/09/28 00:00:00 -0400","original":"09/27/09","granularity":"day","time":"2009/09/27 00:00:00 -0400"},"country":null,"user-email":"system+unknown-user@parkingmobility.com","event":"AddLocations","longitude":-123.090656,"id":"a6kgrhqjsbat","user-first-name":null},"type":"Feature","geometry":{"type":"Point","coordinates":[-123.090656,49.226714]}},{"properties":{"city":null,"lattitude":38.961201,"user-last-name":"Clayson","ime":"14:54:35","state/province":null,"street-address":null,"date":{"end_time":"2010/01/04 00:00:00 -0500","original":"01/03/10","granularity":"day","time":"2010/01/03 00:00:00 -0500"},"country":null,"user-email":"steve.clayson@mac.com","event":"AddLocations","longitude":-77.356361,"id":"a6kgrhwbnr4h","user-first-name":"Steve"},"type":"Feature","geometry":{"type":"Point","coordinates":[-77.356361,38.961201]}},{"properties":{"city":null,"lattitude":43.582237,"user-last-name":"Gibaud","ime":"16:03:40","state/province":null,"street-address":null,"date":{"end_time":"2009/12/19 00:00:00 -0500","original":"12/18/09","granularity":"day","time":"2009/12/18 00:00:00 -0500"},"country":null,"user-email":"gibaud.chris@gmail.com","event":"AddLocations","longitude":5.42217,"id":"a6kgrhvvvp18","user-first-name":"Chris"},"type":"Feature","geometry":{"type":"Point","coordinates":[5.42217,43.582237]}},{"properties":{"city":null,"lattitude":49.158382,"user-last-name":"P","ime":"8:21:49","state/province":null,"street-address":null,"date":{"end_time":"2009/11/28 00:00:00 -0500","original":"11/27/09","granularity":"day","time":"2009/11/27 00:00:00 -0500"},"country":null,"user-email":"dia@dccp.ca","event":"AddLocations","longitude":-122.779442,"id":"a6kgrhs42ehf","user-first-name":"Deanna"},"type":"Feature","geometry":{"type":"Point","coordinates":[-122.779442,49.158382]}},{"properties":{"city":null,"lattitude":35.093472,"user-last-name":"Samuels","ime":"3:53:56","state/province":null,"street-address":null,"date":{"end_time":"2010/02/11 00:00:00 -0500","original":"02/10/10","granularity":"day","time":"2010/02/10 00:00:00 -0500"},"country":null,"user-email":"samuelszs@aol.com","event":"AddLocations","longitude":-89.802704,"id":"a6kgrhtmsrqj","user-first-name":"Sherrie"},"type":"Feature","geometry":{"type":"Point","coordinates":[-89.802704,35.093472]}},{"properties":{"city":null,"lattitude":35.133389,"user-last-name":"Samuels","ime":"19:42:23","state/province":null,"street-address":null,"date":{"end_time":"2010/02/08 00:00:00 -0500","original":"02/07/10","granularity":"day","time":"2010/02/07 00:00:00 -0500"},"country":null,"user-email":"samuelszs@aol.com","event":"AddLocations","longitude":-89.958565,"id":"a6kgrhq60hh8","user-first-name":"Sherrie"},"type":"Feature","geometry":{"type":"Point","coordinates":[-89.958565,35.133389]}},{"properties":{"city":null,"lattitude":35.189297,"user-last-name":"Samuels","ime":"0:47:49","state/province":null,"street-address":null,"date":{"end_time":"2010/02/11 00:00:00 -0500","original":"02/10/10","granularity":"day","time":"2010/02/10 00:00:00 -0500"},"country":null,"user-email":"samuelszs@aol.com","event":"AddLocations","longitude":-89.795601,"id":"a6kgrhzrlo2n","user-first-name":"Sherrie"},"type":"Feature","geometry":{"type":"Point","coordinates":[-89.795601,35.189297]}},{"properties":{"city":null,"lattitude":51.045998,"user-last-name":"Spradling","ime":"19:45:50","state/province":null,"street-address":null,"date":{"end_time":"2010/01/18 00:00:00 -0500","original":"01/17/10","granularity":"day","time":"2010/01/17 00:00:00 -0500"},"country":null,"user-email":"andrew@parkingmobility.com","event":"AddLocations","longitude":-114.079353,"id":"a6kgrhkef8cc","user-first-name":"Andrew"},"type":"Feature","geometry":{"type":"Point","coordinates":[-114.079353,51.045998]}},{"properties":{"city":null,"lattitude":48.218685,"user-last-name":"Grass","ime":"15:29:22","state/province":null,"street-address":null,"date":{"end_time":"2010/01/17 00:00:00 -0500","original":"01/16/10","granularity":"day","time":"2010/01/16 00:00:00 -0500"},"country":null,"user-email":"friedrich.grass@chello.at","event":"AddLocations","longitude":16.3438,"id":"a6kgrhvhxelm","user-first-name":"Friedrich"},"type":"Feature","geometry":{"type":"Point","coordinates":[16.3438,48.218685]}},{"properties":{"city":null,"lattitude":50.418705,"user-last-name":"Steinier","ime":"9:02:58","state/province":null,"street-address":null,"date":{"end_time":"2010/02/04 00:00:00 -0500","original":"02/03/10","granularity":"day","time":"2010/02/03 00:00:00 -0500"},"country":null,"user-email":"philippe@handimobility.org","event":"AddLocations","longitude":4.458744,"id":"a6kgrhyg28ej","user-first-name":"Philippe"},"type":"Feature","geometry":{"type":"Point","coordinates":[4.458744,50.418705]}},{"properties":{"city":null,"lattitude":39.006638,"user-last-name":"Clayson","ime":"19:51:48","state/province":null,"street-address":null,"date":{"end_time":"2010/01/07 00:00:00 -0500","original":"01/06/10","granularity":"day","time":"2010/01/06 00:00:00 -0500"},"country":null,"user-email":"steve.clayson@mac.com","event":"AddLocations","longitude":-77.440147,"id":"a6kgrhox5twn","user-first-name":"Steve"},"type":"Feature","geometry":{"type":"Point","coordinates":[-77.440147,39.006638]}},{"properties":{"city":null,"lattitude":49.149662,"user-last-name":"Beleznay","ime":"7:17:58","state/province":null,"street-address":null,"date":{"end_time":"2010/02/02 00:00:00 -0500","original":"02/01/10","granularity":"day","time":"2010/02/01 00:00:00 -0500"},"country":null,"user-email":"dbeleznay@shaw.ca","event":"AddLocations","longitude":-123.182304,"id":"a6kgrhno1b2n","user-first-name":"Doug"},"type":"Feature","geometry":{"type":"Point","coordinates":[-123.182304,49.149662]}},{"properties":{"city":null,"lattitude":51.048599,"user-last-name":"Spradling","ime":"19:17:18","state/province":null,"street-address":null,"date":{"end_time":"2010/01/18 00:00:00 -0500","original":"01/17/10","granularity":"day","time":"2010/01/17 00:00:00 -0500"},"country":null,"user-email":"andrew@parkingmobility.com","event":"AddLocations","longitude":-114.069008,"id":"a6kgrhuaa51r","user-first-name":"Andrew"},"type":"Feature","geometry":{"type":"Point","coordinates":[-114.069008,51.048599]}},{"properties":{"city":null,"lattitude":37.743893,"user-last-name":"Menendez","ime":"0:57:26","state/province":null,"street-address":null,"date":{"end_time":"2010/01/28 00:00:00 -0500","original":"01/27/10","granularity":"day","time":"2010/01/27 00:00:00 -0500"},"country":null,"user-email":"dennismenendez@yahoo.com","event":"AddLocations","longitude":-122.453812,"id":"a6kgrhs1d4it","user-first-name":"Dennis"},"type":"Feature","geometry":{"type":"Point","coordinates":[-122.453812,37.743893]}},{"properties":{"city":null,"lattitude":42.026218,"user-last-name":"Megown","ime":"14:33:27","state/province":null,"street-address":null,"date":{"end_time":"2010/01/22 00:00:00 -0500","original":"01/21/10","granularity":"day","time":"2010/01/21 00:00:00 -0500"},"country":null,"user-email":"jeffreymegown@aol.com","event":"AddLocations","longitude":-91.619606,"id":"a6kgri08twm4","user-first-name":"Jeffrey"},"type":"Feature","geometry":{"type":"Point","coordinates":[-91.619606,42.026218]}},{"properties":{"city":null,"lattitude":35.128338,"user-last-name":"Samuels","ime":"17:48:10","state/province":null,"street-address":null,"date":{"end_time":"2010/02/26 00:00:00 -0500","original":"02/25/10","granularity":"day","time":"2010/02/25 00:00:00 -0500"},"country":null,"user-email":"samuelszs@aol.com","event":"AddLocations","longitude":-89.946236,"id":"a6kgrhv1qucd","user-first-name":"Sherrie"},"type":"Feature","geometry":{"type":"Point","coordinates":[-89.946236,35.128338]}},{"properties":{"city":null,"lattitude":42.02494,"user-last-name":"Megown","ime":"20:33:44","state/province":null,"street-address":null,"date":{"end_time":"2010/01/14 00:00:00 -0500","original":"01/13/10","granularity":"day","time":"2010/01/13 00:00:00 -0500"},"country":null,"user-email":"jeffreymegown@aol.com","event":"AddLocations","longitude":-91.623535,"id":"a6kgrhva4gxu","user-first-name":"Jeffrey"},"type":"Feature","geometry":{"type":"Point","coordinates":[-91.623535,42.02494]}},{"properties":{"city":null,"lattitude":51.417454,"user-last-name":"Brazil","ime":"22:22:01","state/province":null,"street-address":null,"date":{"end_time":"2009/12/02 00:00:00 -0500","original":"12/01/09","granularity":"day","time":"2009/12/01 00:00:00 -0500"},"country":null,"user-email":"claire.brazil@sky.com","event":"AddLocations","longitude":-0.746852,"id":"a6kgrhkle1nu","user-first-name":"Claire"},"type":"Feature","geometry":{"type":"Point","coordinates":[-0.746852,51.417454]}},{"properties":{"city":null,"lattitude":49.280411,"user-last-name":"P","ime":"7:52:21","state/province":null,"street-address":null,"date":{"end_time":"2009/12/05 00:00:00 -0500","original":"12/04/09","granularity":"day","time":"2009/12/04 00:00:00 -0500"},"country":null,"user-email":"dia@dccp.ca","event":"AddLocations","longitude":-122.914436,"id":"a6kgrhk31dc6","user-first-name":"Deanna"},"type":"Feature","geometry":{"type":"Point","coordinates":[-122.914436,49.280411]}},{"properties":{"city":null,"lattitude":43.430988,"user-last-name":"Gibaud","ime":"16:11:11","state/province":null,"street-address":null,"date":{"end_time":"2009/12/19 00:00:00 -0500","original":"12/18/09","granularity":"day","time":"2009/12/18 00:00:00 -0500"},"country":null,"user-email":"gibaud.chris@gmail.com","event":"AddLocations","longitude":5.261544,"id":"a6kgrhtug4zp","user-first-name":"Chris"},"type":"Feature","geometry":{"type":"Point","coordinates":[5.261544,43.430988]}},{"properties":{"city":null,"lattitude":41.961105,"user-last-name":"Megown","ime":"15:47:33","state/province":null,"street-address":null,"date":{"end_time":"2010/01/20 00:00:00 -0500","original":"01/19/10","granularity":"day","time":"2010/01/19 00:00:00 -0500"},"country":null,"user-email":"jeffreymegown@aol.com","event":"AddLocations","longitude":-91.681976,"id":"a6kgrhq1kotb","user-first-name":"Jeffrey"},"type":"Feature","geometry":{"type":"Point","coordinates":[-91.681976,41.961105]}},{"properties":{"city":null,"lattitude":35.110355,"user-last-name":"Samuels","ime":"14:34:55","state/province":null,"street-address":null,"date":{"end_time":"2010/02/08 00:00:00 -0500","original":"02/07/10","granularity":"day","time":"2010/02/07 00:00:00 -0500"},"country":null,"user-email":"samuelszs@aol.com","event":"AddLocations","longitude":-89.894432,"id":"a6kgrhyulqs5","user-first-name":"Sherrie"},"type":"Feature","geometry":{"type":"Point","coordinates":[-89.894432,35.110355]}},{"properties":{"city":null,"lattitude":49.274414,"user-last-name":null,"ime":"21:27:06","state/province":null,"street-address":null,"date":{"end_time":"2009/11/12 00:00:00 -0500","original":"11/11/09","granularity":"day","time":"2009/11/11 00:00:00 -0500"},"country":null,"user-email":"campbell.macdonald@gmail.com","event":"AddLocations","longitude":-123.237839,"id":"a6kgrhwn35o9","user-first-name":null},"type":"Feature","geometry":{"type":"Point","coordinates":[-123.237839,49.274414]}},{"properties":{"city":null,"lattitude":38.960758,"user-last-name":"Clayson","ime":"14:54:58","state/province":null,"street-address":null,"date":{"end_time":"2010/01/04 00:00:00 -0500","original":"01/03/10","granularity":"day","time":"2010/01/03 00:00:00 -0500"},"country":null,"user-email":"steve.clayson@mac.com","event":"AddLocations","longitude":-77.354744,"id":"a6kgrhl4kn98","user-first-name":"Steve"},"type":"Feature","geometry":{"type":"Point","coordinates":[-77.354744,38.960758]}},{"properties":{"city":null,"lattitude":25.350899,"user-last-name":"A aziz a albaker","ime":"1:16:04","state/province":null,"street-address":null,"date":{"end_time":"2010/04/13 00:00:00 -0400","original":"04/12/10","granularity":"day","time":"2010/04/12 00:00:00 -0400"},"country":null,"user-email":"moudbaker@mac.com","event":"AddLocations","longitude":51.519341,"id":"a6kgrhri8e59","user-first-name":"Muhammad"},"type":"Feature","geometry":{"type":"Point","coordinates":[51.519341,25.350899]}},{"properties":{"city":null,"lattitude":35.099987,"user-last-name":"Samuels","ime":"18:53:56","state/province":null,"street-address":null,"date":{"end_time":"2010/02/19 00:00:00 -0500","original":"02/18/10","granularity":"day","time":"2010/02/18 00:00:00 -0500"},"country":null,"user-email":"samuelszs@aol.com","event":"AddLocations","longitude":-89.840889,"id":"a6kgrhuzc7s5","user-first-name":"Sherrie"},"type":"Feature","geometry":{"type":"Point","coordinates":[-89.840889,35.099987]}},{"properties":{"city":null,"lattitude":51.045063,"user-last-name":"Spradling","ime":"20:36:20","state/province":null,"street-address":null,"date":{"end_time":"2010/01/18 00:00:00 -0500","original":"01/17/10","granularity":"day","time":"2010/01/17 00:00:00 -0500"},"country":null,"user-email":"andrew@parkingmobility.com","event":"AddLocations","longitude":-114.070587,"id":"a6kgrhn9glxk","user-first-name":"Andrew"},"type":"Feature","geometry":{"type":"Point","coordinates":[-114.070587,51.045063]}},{"properties":{"city":null,"lattitude":35.129276,"user-last-name":"Samuels","ime":"0:12:26","state/province":null,"street-address":null,"date":{"end_time":"2010/02/11 00:00:00 -0500","original":"02/10/10","granularity":"day","time":"2010/02/10 00:00:00 -0500"},"country":null,"user-email":"samuelszs@aol.com","event":"AddLocations","longitude":-89.949409,"id":"a6kgrhqxof9p","user-first-name":"Sherrie"},"type":"Feature","geometry":{"type":"Point","coordinates":[-89.949409,35.129276]}},{"properties":{"city":null,"lattitude":51.049911,"user-last-name":"Spradling","ime":"19:31:55","state/province":null,"street-address":null,"date":{"end_time":"2010/01/18 00:00:00 -0500","original":"01/17/10","granularity":"day","time":"2010/01/17 00:00:00 -0500"},"country":null,"user-email":"andrew@parkingmobility.com","event":"AddLocations","longitude":-114.084023,"id":"a6kgrhmzsih2","user-first-name":"Andrew"},"type":"Feature","geometry":{"type":"Point","coordinates":[-114.084023,51.049911]}},{"properties":{"city":null,"lattitude":54.070763,"user-last-name":"Parkinson","ime":"15:48:32","state/province":null,"street-address":null,"date":{"end_time":"2009/12/02 00:00:00 -0500","original":"12/01/09","granularity":"day","time":"2009/12/01 00:00:00 -0500"},"country":null,"user-email":"anthonyparkinson@btinternet.com","event":"AddLocations","longitude":-2.86579,"id":"a6kgrhq8be9u","user-first-name":"Anthony"},"type":"Feature","geometry":{"type":"Point","coordinates":[-2.86579,54.070763]}},{"properties":{"city":null,"lattitude":38.978844,"user-last-name":"Clayson","ime":"20:42:14","state/province":null,"street-address":null,"date":{"end_time":"2010/01/01 00:00:00 -0500","original":"12/31/09","granularity":"day","time":"2009/12/31 00:00:00 -0500"},"country":null,"user-email":"steve.clayson@mac.com","event":"AddLocations","longitude":-77.349998,"id":"a6kgrhntk1yj","user-first-name":"Steve"},"type":"Feature","geometry":{"type":"Point","coordinates":[-77.349998,38.978844]}},{"properties":{"city":null,"lattitude":52.584751,"user-last-name":"Moult","ime":"13:53:58","state/province":null,"street-address":null,"date":{"end_time":"2009/11/26 00:00:00 -0500","original":"11/25/09","granularity":"day","time":"2009/11/25 00:00:00 -0500"},"country":null,"user-email":"andrewmoult@yahoo.co.uk","event":"AddLocations","longitude":-1.980484,"id":"a6kgrhmss4ov","user-first-name":"Andrew"},"type":"Feature","geometry":{"type":"Point","coordinates":[-1.980484,52.584751]}},{"properties":{"city":null,"lattitude":35.140194,"user-last-name":"Samuels","ime":"0:34:00","state/province":null,"street-address":null,"date":{"end_time":"2010/02/11 00:00:00 -0500","original":"02/10/10","granularity":"day","time":"2010/02/10 00:00:00 -0500"},"country":null,"user-email":"samuelszs@aol.com","event":"AddLocations","longitude":-89.797318,"id":"a6kgrhzenkma","user-first-name":"Sherrie"},"type":"Feature","geometry":{"type":"Point","coordinates":[-89.797318,35.140194]}},{"properties":{"city":null,"lattitude":49.15559,"user-last-name":null,"ime":"21:05:33","state/province":null,"street-address":null,"date":{"end_time":"2009/10/13 00:00:00 -0400","original":"10/12/09","granularity":"day","time":"2009/10/12 00:00:00 -0400"},"country":null,"user-email":"system+unknown-user@parkingmobility.com","event":"AddLocations","longitude":-122.778625,"id":"a6kgrhze5pab","user-first-name":null},"type":"Feature","geometry":{"type":"Point","coordinates":[-122.778625,49.15559]}},{"properties":{"city":null,"lattitude":35.04649,"user-last-name":"Samuels","ime":"3:47:16","state/province":null,"street-address":null,"date":{"end_time":"2010/02/11 00:00:00 -0500","original":"02/10/10","granularity":"day","time":"2010/02/10 00:00:00 -0500"},"country":null,"user-email":"samuelszs@aol.com","event":"AddLocations","longitude":-89.692345,"id":"a6kgrhlatzdr","user-first-name":"Sherrie"},"type":"Feature","geometry":{"type":"Point","coordinates":[-89.692345,35.04649]}},{"properties":{"city":null,"lattitude":45.469028,"user-last-name":"D","ime":"7:34:06","state/province":null,"street-address":null,"date":{"end_time":"2010/03/03 00:00:00 -0500","original":"03/02/10","granularity":"day","time":"2010/03/02 00:00:00 -0500"},"country":null,"user-email":"kentia000@hotmail.com","event":"AddLocations","longitude":-73.539276,"id":"a6kgrho3e7cz","user-first-name":"Mel"},"type":"Feature","geometry":{"type":"Point","coordinates":[-73.539276,45.469028]}},{"properties":{"city":null,"lattitude":37.740627,"user-last-name":"Menendez","ime":"16:31:34","state/province":null,"street-address":null,"date":{"end_time":"2009/12/08 00:00:00 -0500","original":"12/07/09","granularity":"day","time":"2009/12/07 00:00:00 -0500"},"country":null,"user-email":"dennismenendez1@mac.com","event":"AddLocations","longitude":-122.465843,"id":"a6kgrhkkubwp","user-first-name":"Dennis"},"type":"Feature","geometry":{"type":"Point","coordinates":[-122.465843,37.740627]}},{"properties":{"city":null,"lattitude":49.655537,"user-last-name":"Chalkley","ime":"1:17:08","state/province":null,"street-address":null,"date":{"end_time":"2010/03/07 00:00:00 -0500","original":"03/06/10","granularity":"day","time":"2010/03/06 00:00:00 -0500"},"country":null,"user-email":"kitty_nikki@live.ca","event":"AddLocations","longitude":-112.795761,"id":"a6kgrhxy1v12","user-first-name":"Nikki"},"type":"Feature","geometry":{"type":"Point","coordinates":[-112.795761,49.655537]}},{"properties":{"city":null,"lattitude":35.189472,"user-last-name":"Samuels","ime":"0:48:21","state/province":null,"street-address":null,"date":{"end_time":"2010/02/11 00:00:00 -0500","original":"02/10/10","granularity":"day","time":"2010/02/10 00:00:00 -0500"},"country":null,"user-email":"samuelszs@aol.com","event":"AddLocations","longitude":-89.795593,"id":"a6kgrhspxhlk","user-first-name":"Sherrie"},"type":"Feature","geometry":{"type":"Point","coordinates":[-89.795593,35.189472]}},{"properties":{"city":null,"lattitude":-33.888519,"user-last-name":"Paulsen","ime":"9:40:49","state/province":null,"street-address":null,"date":{"end_time":"2010/04/04 00:00:00 -0400","original":"04/03/10","granularity":"day","time":"2010/04/03 00:00:00 -0400"},"country":null,"user-email":"purse1@yahoo.com","event":"AddLocations","longitude":151.180832,"id":"a6kgri02ds3t","user-first-name":"David"},"type":"Feature","geometry":{"type":"Point","coordinates":[151.180832,-33.888519]}},{"properties":{"city":null,"lattitude":35.123566,"user-last-name":"Samuels","ime":"14:02:55","state/province":null,"street-address":null,"date":{"end_time":"2010/02/11 00:00:00 -0500","original":"02/10/10","granularity":"day","time":"2010/02/10 00:00:00 -0500"},"country":null,"user-email":"samuelszs@aol.com","event":"AddLocations","longitude":-89.882965,"id":"a6kgrhny5bq5","user-first-name":"Sherrie"},"type":"Feature","geometry":{"type":"Point","coordinates":[-89.882965,35.123566]}},{"properties":{"city":null,"lattitude":51.046104,"user-last-name":"Spradling","ime":"19:53:31","state/province":null,"street-address":null,"date":{"end_time":"2010/01/18 00:00:00 -0500","original":"01/17/10","granularity":"day","time":"2010/01/17 00:00:00 -0500"},"country":null,"user-email":"andrew@parkingmobility.com","event":"AddLocations","longitude":-114.082077,"id":"a6kgrhtx19bz","user-first-name":"Andrew"},"type":"Feature","geometry":{"type":"Point","coordinates":[-114.082077,51.046104]}},{"properties":{"city":null,"lattitude":37.32584,"user-last-name":"Nachbaur","ime":"16:21:08","state/province":null,"street-address":null,"date":{"end_time":"2010/01/16 00:00:00 -0500","original":"01/15/10","granularity":"day","time":"2010/01/15 00:00:00 -0500"},"country":null,"user-email":"michael@nachbaur.com","event":"AddLocations","longitude":-122.028862,"id":"a6kgrhr1z1x0","user-first-name":"Mike"},"type":"Feature","geometry":{"type":"Point","coordinates":[-122.028862,37.32584]}},{"properties":{"city":null,"lattitude":49.262798,"user-last-name":null,"ime":"1:17:41","state/province":null,"street-address":null,"date":{"end_time":"2009/11/30 00:00:00 -0500","original":"11/29/09","granularity":"day","time":"2009/11/29 00:00:00 -0500"},"country":null,"user-email":"campbell.macdonald@gmail.com","event":"AddLocations","longitude":-123.108231,"id":"a6kgrhkbeah2","user-first-name":null},"type":"Feature","geometry":{"type":"Point","coordinates":[-123.108231,49.262798]}},{"properties":{"city":null,"lattitude":46.716534,"user-last-name":"Stefano","ime":"14:29:50","state/province":null,"street-address":null,"date":{"end_time":"2009/11/26 00:00:00 -0500","original":"11/25/09","granularity":"day","time":"2009/11/25 00:00:00 -0500"},"country":null,"user-email":"iddocop@gmail.com","event":"AddLocations","longitude":11.657825,"id":"a6kgrhpr9kbf","user-first-name":"Iddo"},"type":"Feature","geometry":{"type":"Point","coordinates":[11.657825,46.716534]}},{"properties":{"city":null,"lattitude":49.657055,"user-last-name":"Chalkley","ime":"1:38:39","state/province":null,"street-address":null,"date":{"end_time":"2010/03/07 00:00:00 -0500","original":"03/06/10","granularity":"day","time":"2010/03/06 00:00:00 -0500"},"country":null,"user-email":"kitty_nikki@live.ca","event":"AddLocations","longitude":-112.791634,"id":"a6kgrhv70y3d","user-first-name":"Nikki"},"type":"Feature","geometry":{"type":"Point","coordinates":[-112.791634,49.657055]}},{"properties":{"city":null,"lattitude":46.174046,"user-last-name":"Cardinal","ime":"10:24:28","state/province":null,"street-address":null,"date":{"end_time":"2010/01/15 00:00:00 -0500","original":"01/14/10","granularity":"day","time":"2010/01/14 00:00:00 -0500"},"country":null,"user-email":"thomas@uwl-workshop.com","event":"AddLocations","longitude":-1.168187,"id":"a6kgrhtiw587","user-first-name":"Thomas"},"type":"Feature","geometry":{"type":"Point","coordinates":[-1.168187,46.174046]}},{"properties":{"city":null,"lattitude":30.252316,"user-last-name":"S","ime":"23:20:49","state/province":null,"street-address":null,"date":{"end_time":"2010/03/20 00:00:00 -0400","original":"03/19/10","granularity":"day","time":"2010/03/19 00:00:00 -0400"},"country":null,"user-email":"qqmech@gmail.com","event":"AddSuggestions","longitude":-97.768753,"id":"a6kgrhmv2rja","user-first-name":"Mike"},"type":"Feature","geometry":{"type":"Point","coordinates":[-97.768753,30.252316]}},{"properties":{"city":null,"lattitude":39.005642,"user-last-name":"Clayson","ime":"19:52:50","state/province":null,"street-address":null,"date":{"end_time":"2010/01/07 00:00:00 -0500","original":"01/06/10","granularity":"day","time":"2010/01/06 00:00:00 -0500"},"country":null,"user-email":"steve.clayson@mac.com","event":"AddSuggestions","longitude":-77.438751,"id":"a6kgrhrqzh5o","user-first-name":"Steve"},"type":"Feature","geometry":{"type":"Point","coordinates":[-77.438751,39.005642]}},{"properties":{"city":null,"lattitude":49.287838,"user-last-name":"Spradling","ime":"18:55:12","state/province":null,"street-address":null,"date":{"end_time":"2009/11/14 00:00:00 -0500","original":"11/13/09","granularity":"day","time":"2009/11/13 00:00:00 -0500"},"country":null,"user-email":"craig@parkingmobility.com","event":"AddSuggestions","longitude":-123.134636,"id":"a6kgrhq72vlz","user-first-name":"Craig"},"type":"Feature","geometry":{"type":"Point","coordinates":[-123.134636,49.287838]}},{"properties":{"city":null,"lattitude":52.039631,"user-last-name":"Head","ime":"19:37:13","state/province":null,"street-address":null,"date":{"end_time":"2009/11/27 00:00:00 -0500","original":"11/26/09","granularity":"day","time":"2009/11/26 00:00:00 -0500"},"country":null,"user-email":"sportylix@msn.com","event":"AddSuggestions","longitude":-0.296105,"id":"a6kgrhzuqx9a","user-first-name":"Lin"},"type":"Feature","geometry":{"type":"Point","coordinates":[-0.296105,52.039631]}},{"properties":{"city":null,"lattitude":41.961044,"user-last-name":"Megown","ime":"15:48:53","state/province":null,"street-address":null,"date":{"end_time":"2010/01/20 00:00:00 -0500","original":"01/19/10","granularity":"day","time":"2010/01/19 00:00:00 -0500"},"country":null,"user-email":"jeffreymegown@aol.com","event":"AddSuggestions","longitude":-91.682053,"id":"a6kgrhvua5v6","user-first-name":"Jeffrey"},"type":"Feature","geometry":{"type":"Point","coordinates":[-91.682053,41.961044]}},{"properties":{"city":null,"lattitude":51.495239,"user-last-name":"Parmenter","ime":"14:09:42","state/province":null,"street-address":null,"date":{"end_time":"2009/12/02 00:00:00 -0500","original":"12/01/09","granularity":"day","time":"2009/12/01 00:00:00 -0500"},"country":null,"user-email":"glen.parmenter@talktalk.net","event":"AddSuggestions","longitude":0.121086,"id":"a6kgrhqxbgj9","user-first-name":"Glen"},"type":"Feature","geometry":{"type":"Point","coordinates":[0.121086,51.495239]}},{"properties":{"city":null,"lattitude":51.481857,"user-last-name":"Rodriguez amad","ime":"2:23:28","state/province":null,"street-address":null,"date":{"end_time":"2009/12/06 00:00:00 -0500","original":"12/05/09","granularity":"day","time":"2009/12/05 00:00:00 -0500"},"country":null,"user-email":"rodriguez78@hotmail.co.uk","event":"AddSuggestions","longitude":-0.180448,"id":"a6kgrho2l53i","user-first-name":"Carlos"},"type":"Feature","geometry":{"type":"Point","coordinates":[-0.180448,51.481857]}},{"properties":{"city":null,"lattitude":51.496929,"user-last-name":"Evans","ime":"3:11:47","state/province":null,"street-address":null,"date":{"end_time":"2010/01/19 00:00:00 -0500","original":"01/18/10","granularity":"day","time":"2010/01/18 00:00:00 -0500"},"country":null,"user-email":"jonathanlloydevans@yahoo.co.uk","event":"AddSuggestions","longitude":-0.135934,"id":"a6kgrhn8r0r8","user-first-name":"Jonathan"},"type":"Feature","geometry":{"type":"Point","coordinates":[-0.135934,51.496929]}},{"properties":{"city":null,"lattitude":48.422195,"user-last-name":"Ash","ime":"14:50:20","state/province":null,"street-address":null,"date":{"end_time":"2010/02/21 00:00:00 -0500","original":"02/20/10","granularity":"day","time":"2010/02/20 00:00:00 -0500"},"country":null,"user-email":"chrissyash@shaw.ca","event":"AddSuggestions","longitude":-123.363029,"id":"a6kgrhx6y131","user-first-name":"Chris"},"type":"Feature","geometry":{"type":"Point","coordinates":[-123.363029,48.422195]}},{"properties":{"city":null,"lattitude":49.286255,"user-last-name":null,"ime":"21:39:30","state/province":null,"street-address":null,"date":{"end_time":"2010/01/21 00:00:00 -0500","original":"01/20/10","granularity":"day","time":"2010/01/20 00:00:00 -0500"},"country":null,"user-email":"ian@coalharbourgroup.com","event":"AddSuggestions","longitude":-123.135994,"id":"a6kgrhlm7jsx","user-first-name":null},"type":"Feature","geometry":{"type":"Point","coordinates":[-123.135994,49.286255]}},{"properties":{"city":null,"lattitude":40.747334,"user-last-name":"Bhujel","ime":"3:31:32","state/province":null,"street-address":null,"date":{"end_time":"2010/01/21 00:00:00 -0500","original":"01/20/10","granularity":"day","time":"2010/01/20 00:00:00 -0500"},"country":null,"user-email":"punk_36hero@hotmail.com","event":"AddSuggestions","longitude":-73.901848,"id":"a6kgrhy5lewh","user-first-name":"Parthav"},"type":"Feature","geometry":{"type":"Point","coordinates":[-73.901848,40.747334]}},{"properties":{"city":null,"lattitude":51.495502,"user-last-name":"Parmenter","ime":"17:52:35","state/province":null,"street-address":null,"date":{"end_time":"2009/12/02 00:00:00 -0500","original":"12/01/09","granularity":"day","time":"2009/12/01 00:00:00 -0500"},"country":null,"user-email":"glen.parmenter@talktalk.net","event":"AddSuggestions","longitude":0.119571,"id":"a6kgrhoca4ec","user-first-name":"Glen"},"type":"Feature","geometry":{"type":"Point","coordinates":[0.119571,51.495502]}},{"properties":{"city":null,"lattitude":49.285744,"user-last-name":null,"ime":"19:10:38","state/province":null,"street-address":null,"date":{"end_time":"2010/01/20 00:00:00 -0500","original":"01/19/10","granularity":"day","time":"2010/01/19 00:00:00 -0500"},"country":null,"user-email":"ian@coalharbourgroup.com","event":"AddSuggestions","longitude":-123.137665,"id":"a6kgrhtmc840","user-first-name":null},"type":"Feature","geometry":{"type":"Point","coordinates":[-123.137665,49.285744]}},{"properties":{"city":null,"lattitude":33.810711,"user-last-name":"Collman","ime":"16:49:08","state/province":null,"street-address":null,"date":{"end_time":"2010/03/02 00:00:00 -0500","original":"03/01/10","granularity":"day","time":"2010/03/01 00:00:00 -0500"},"country":null,"user-email":"peter_collman@shepherd.org","event":"AddSuggestions","longitude":-84.394554,"id":"a6kgrhy8t0od","user-first-name":"Peter"},"type":"Feature","geometry":{"type":"Point","coordinates":[-84.394554,33.810711]}},{"properties":{"city":null,"lattitude":42.683548,"user-last-name":"Shertzer","ime":"20:06:09","state/province":null,"street-address":null,"date":{"end_time":"2010/02/21 00:00:00 -0500","original":"02/20/10","granularity":"day","time":"2010/02/20 00:00:00 -0500"},"country":null,"user-email":"daveshertzer@me.com","event":"AddSuggestions","longitude":-73.770866,"id":"a6kgri071g22","user-first-name":"Dave"},"type":"Feature","geometry":{"type":"Point","coordinates":[-73.770866,42.683548]}},{"properties":{"city":null,"lattitude":47.368774,"user-last-name":"Nimal","ime":"13:08:14","state/province":null,"street-address":null,"date":{"end_time":"2009/12/13 00:00:00 -0500","original":"12/12/09","granularity":"day","time":"2009/12/12 00:00:00 -0500"},"country":null,"user-email":"spnimalraj@hotmail.com","event":"AddSuggestions","longitude":8.500843,"id":"a6kgrhuu1gvg","user-first-name":"Soosai"},"type":"Feature","geometry":{"type":"Point","coordinates":[8.500843,47.368774]}},{"properties":{"city":null,"lattitude":49.286045,"user-last-name":null,"ime":"23:50:55","state/province":null,"street-address":null,"date":{"end_time":"2009/10/21 00:00:00 -0400","original":"10/20/09","granularity":"day","time":"2009/10/20 00:00:00 -0400"},"country":null,"user-email":"campbell.macdonald@gmail.com","event":"AddSuggestions","longitude":-123.137482,"id":"a6kgrhobilai","user-first-name":null},"type":"Feature","geometry":{"type":"Point","coordinates":[-123.137482,49.286045]}},{"properties":{"city":null,"lattitude":51.479939,"user-last-name":"Rodriguez amad","ime":"2:25:33","state/province":null,"street-address":null,"date":{"end_time":"2009/12/06 00:00:00 -0500","original":"12/05/09","granularity":"day","time":"2009/12/05 00:00:00 -0500"},"country":null,"user-email":"rodriguez78@hotmail.co.uk","event":"AddSuggestions","longitude":-0.178571,"id":"a6kgrhrwg96z","user-first-name":"Carlos"},"type":"Feature","geometry":{"type":"Point","coordinates":[-0.178571,51.479939]}},{"properties":{"city":null,"lattitude":51.482235,"user-last-name":"Rodriguez amad","ime":"14:50:04","state/province":null,"street-address":null,"date":{"end_time":"2009/12/06 00:00:00 -0500","original":"12/05/09","granularity":"day","time":"2009/12/05 00:00:00 -0500"},"country":null,"user-email":"rodriguez78@hotmail.co.uk","event":"AddSuggestions","longitude":-0.179378,"id":"a6kgrhmofdbt","user-first-name":"Carlos"},"type":"Feature","geometry":{"type":"Point","coordinates":[-0.179378,51.482235]}},{"properties":{"city":null,"lattitude":50.967564,"user-last-name":"Kinloch","ime":"20:51:12","state/province":null,"street-address":null,"date":{"end_time":"2010/03/22 00:00:00 -0400","original":"03/21/10","granularity":"day","time":"2010/03/21 00:00:00 -0400"},"country":null,"user-email":"liz_kinloch@btinternet.com","event":"AddSuggestions","longitude":-1.353954,"id":"a6kgrhts6t4t","user-first-name":"Liz"},"type":"Feature","geometry":{"type":"Point","coordinates":[-1.353954,50.967564]}},{"properties":{"city":null,"lattitude":49.276615,"user-last-name":null,"ime":"4:42:55","state/province":null,"street-address":null,"date":{"end_time":"2009/10/18 00:00:00 -0400","original":"10/17/09","granularity":"day","time":"2009/10/17 00:00:00 -0400"},"country":null,"user-email":"Campbell.macdonald@gmail.com","event":"AddSuggestions","longitude":-123.119423,"id":"a6kgri00ghgb","user-first-name":null},"type":"Feature","geometry":{"type":"Point","coordinates":[-123.119423,49.276615]}},{"properties":{"city":null,"lattitude":51.495438,"user-last-name":"Evans","ime":"3:14:10","state/province":null,"street-address":null,"date":{"end_time":"2010/01/19 00:00:00 -0500","original":"01/18/10","granularity":"day","time":"2010/01/18 00:00:00 -0500"},"country":null,"user-email":"jonathanlloydevans@yahoo.co.uk","event":"AddSuggestions","longitude":-0.132721,"id":"a6kgrhxjdx4u","user-first-name":"Jonathan"},"type":"Feature","geometry":{"type":"Point","coordinates":[-0.132721,51.495438]}},{"properties":{"city":null,"lattitude":40.753891,"user-last-name":"Bhujel","ime":"3:33:26","state/province":null,"street-address":null,"date":{"end_time":"2010/01/21 00:00:00 -0500","original":"01/20/10","granularity":"day","time":"2010/01/20 00:00:00 -0500"},"country":null,"user-email":"punk_36hero@hotmail.com","event":"AddSuggestions","longitude":-73.897476,"id":"a6kgrho8f08b","user-first-name":"Parthav"},"type":"Feature","geometry":{"type":"Point","coordinates":[-73.897476,40.753891]}},{"properties":{"city":null,"lattitude":19.013494,"user-last-name":null,"ime":"5:03:34","state/province":null,"street-address":null,"date":{"end_time":"2009/10/25 00:00:00 -0400","original":"10/24/09","granularity":"day","time":"2009/10/24 00:00:00 -0400"},"country":null,"user-email":"campbell.macdonald@gmail.com","event":"AddSuggestions","longitude":72.819679,"id":"a6kgrhvd7k99","user-first-name":null},"type":"Feature","geometry":{"type":"Point","coordinates":[72.819679,19.013494]}},{"properties":{"city":null,"lattitude":49.877899,"user-last-name":null,"ime":"22:21:01","state/province":null,"street-address":null,"date":{"end_time":"2009/12/25 00:00:00 -0500","original":"12/24/09","granularity":"day","time":"2009/12/24 00:00:00 -0500"},"country":null,"user-email":"campyworldtour@yahoo.com","event":"AddSuggestions","longitude":-97.148216,"id":"a6kgrhvmeykc","user-first-name":null},"type":"Feature","geometry":{"type":"Point","coordinates":[-97.148216,49.877899]}},{"properties":{"city":null,"lattitude":44.434208,"user-last-name":"Lorenz","ime":"3:05:31","state/province":null,"street-address":null,"date":{"end_time":"2010/02/26 00:00:00 -0500","original":"02/25/10","granularity":"day","time":"2010/02/25 00:00:00 -0500"},"country":null,"user-email":"lathe57@msn.com","event":"AddSuggestions","longitude":-77.896584,"id":"a6kgrhxyy8ms","user-first-name":"Harry"},"type":"Feature","geometry":{"type":"Point","coordinates":[-77.896584,44.434208]}},{"properties":{"city":null,"lattitude":37.325516,"user-last-name":null,"ime":"17:01:50","state/province":null,"street-address":null,"date":{"end_time":"2010/02/03 00:00:00 -0500","original":"02/02/10","granularity":"day","time":"2010/02/02 00:00:00 -0500"},"country":null,"user-email":"campbell@parkingmobility.com","event":"AddSuggestions","longitude":-122.019707,"id":"a6kgrhtnjqlv","user-first-name":null},"type":"Feature","geometry":{"type":"Point","coordinates":[-122.019707,37.325516]}},{"properties":{"city":null,"lattitude":42.048145,"user-last-name":"Fleege","ime":"23:10:28","state/province":null,"street-address":null,"date":{"end_time":"2010/01/13 00:00:00 -0500","original":"01/12/10","granularity":"day","time":"2010/01/12 00:00:00 -0500"},"country":null,"user-email":"bob@oldmanwheeler.com","event":"AddSuggestions","longitude":-93.630638,"id":"a6kgrhsybz9d","user-first-name":"Bob"},"type":"Feature","geometry":{"type":"Point","coordinates":[-93.630638,42.048145]}},{"properties":{"city":null,"lattitude":33.824692,"user-last-name":"Calipes","ime":"6:48:20","state/province":null,"street-address":null,"date":{"end_time":"2009/12/03 00:00:00 -0500","original":"12/02/09","granularity":"day","time":"2009/12/02 00:00:00 -0500"},"country":null,"user-email":"bitog@yahoo.com","event":"AddSuggestions","longitude":-117.98893,"id":"a6kgrhlfgbfx","user-first-name":"Lamberto"},"type":"Feature","geometry":{"type":"Point","coordinates":[-117.98893,33.824692]}},{"properties":{"city":null,"lattitude":49.281002,"user-last-name":null,"ime":"4:30:50","state/province":null,"street-address":null,"date":{"end_time":"2009/10/11 00:00:00 -0400","original":"10/10/09","granularity":"day","time":"2009/10/10 00:00:00 -0400"},"country":null,"user-email":"system+unknown-user@parkingmobility.com","event":"AddSuggestions","longitude":-123.120285,"id":"a6kgrhreb6oy","user-first-name":null},"type":"Feature","geometry":{"type":"Point","coordinates":[-123.120285,49.281002]}},{"properties":{"city":null,"lattitude":47.368774,"user-last-name":"Nimal","ime":"12:41:48","state/province":null,"street-address":null,"date":{"end_time":"2009/12/13 00:00:00 -0500","original":"12/12/09","granularity":"day","time":"2009/12/12 00:00:00 -0500"},"country":null,"user-email":"spnimalraj@hotmail.com","event":"AddSuggestions","longitude":8.500843,"id":"a6kgrhne94os","user-first-name":"Soosai"},"type":"Feature","geometry":{"type":"Point","coordinates":[8.500843,47.368774]}},{"properties":{"city":null,"lattitude":33.687729,"user-last-name":"Chaffoo","ime":"19:48:04","state/province":null,"street-address":null,"date":{"end_time":"2010/01/03 00:00:00 -0500","original":"01/02/10","granularity":"day","time":"2010/01/02 00:00:00 -0500"},"country":null,"user-email":"rgrantstuart@gmail.com","event":"AddSuggestions","longitude":-116.307968,"id":"a6kgrhutps31","user-first-name":"Grant"},"type":"Feature","geometry":{"type":"Point","coordinates":[-116.307968,33.687729]}},{"properties":{"city":null,"lattitude":49.864849,"user-last-name":null,"ime":"22:42:54","state/province":null,"street-address":null,"date":{"end_time":"2009/10/14 00:00:00 -0400","original":"10/13/09","granularity":"day","time":"2009/10/13 00:00:00 -0400"},"country":null,"user-email":"system+unknown-user@parkingmobility.com","event":"AddSuggestions","longitude":-97.211494,"id":"a6kgrhr03625","user-first-name":null},"type":"Feature","geometry":{"type":"Point","coordinates":[-97.211494,49.864849]}},{"properties":{"city":null,"lattitude":37.326954,"user-last-name":"Nachbaur","ime":"0:30:19","state/province":null,"street-address":null,"date":{"end_time":"2009/10/21 00:00:00 -0400","original":"10/20/09","granularity":"day","time":"2009/10/20 00:00:00 -0400"},"country":null,"user-email":"mike.nachbaur@decafninja.com","event":"AddSuggestions","longitude":-122.027756,"id":"a6kgrhzagqfv","user-first-name":"Mike"},"type":"Feature","geometry":{"type":"Point","coordinates":[-122.027756,37.326954]}},{"properties":{"city":null,"lattitude":51.50787,"user-last-name":"Howe","ime":"21:46:20","state/province":null,"street-address":null,"date":{"end_time":"2009/12/07 00:00:00 -0500","original":"12/06/09","granularity":"day","time":"2009/12/06 00:00:00 -0500"},"country":null,"user-email":"garyhowe93@hotmail.com","event":"AddSuggestions","longitude":-0.141611,"id":"a6kgrhxx98q3","user-first-name":"Gary"},"type":"Feature","geometry":{"type":"Point","coordinates":[-0.141611,51.50787]}},{"properties":{"city":null,"lattitude":42.031803,"user-last-name":"Megown","ime":"15:21:49","state/province":null,"street-address":null,"date":{"end_time":"2010/01/23 00:00:00 -0500","original":"01/22/10","granularity":"day","time":"2010/01/22 00:00:00 -0500"},"country":null,"user-email":"jeffreymegown@aol.com","event":"AddSuggestions","longitude":-91.598282,"id":"a6kgrhxnp2l1","user-first-name":"Jeffrey"},"type":"Feature","geometry":{"type":"Point","coordinates":[-91.598282,42.031803]}},{"properties":{"city":null,"lattitude":37.329857,"user-last-name":"Nachbaur","ime":"0:24:00","state/province":null,"street-address":null,"date":{"end_time":"2009/10/21 00:00:00 -0400","original":"10/20/09","granularity":"day","time":"2009/10/20 00:00:00 -0400"},"country":null,"user-email":"mike.nachbaur@decafninja.com","event":"AddSuggestions","longitude":-122.026993,"id":"a6kgrhzxm40a","user-first-name":"Mike"},"type":"Feature","geometry":{"type":"Point","coordinates":[-122.026993,37.329857]}},{"properties":{"city":null,"lattitude":49.28603,"user-last-name":null,"ime":"22:27:44","state/province":null,"street-address":null,"date":{"end_time":"2010/01/14 00:00:00 -0500","original":"01/13/10","granularity":"day","time":"2010/01/13 00:00:00 -0500"},"country":null,"user-email":"ian@coalharbourgroup.com","event":"AddSuggestions","longitude":-123.136871,"id":"a6kgrhvy6ex9","user-first-name":null},"type":"Feature","geometry":{"type":"Point","coordinates":[-123.136871,49.28603]}},{"properties":{"city":null,"lattitude":47.369202,"user-last-name":"Nimal","ime":"12:43:27","state/province":null,"street-address":null,"date":{"end_time":"2009/12/13 00:00:00 -0500","original":"12/12/09","granularity":"day","time":"2009/12/12 00:00:00 -0500"},"country":null,"user-email":"spnimalraj@hotmail.com","event":"AddSuggestions","longitude":8.500962,"id":"a6kgrhvcrov8","user-first-name":"Soosai"},"type":"Feature","geometry":{"type":"Point","coordinates":[8.500962,47.369202]}},{"properties":{"city":null,"lattitude":42.874107,"user-last-name":"Shertzer","ime":"20:10:11","state/province":null,"street-address":null,"date":{"end_time":"2010/02/21 00:00:00 -0500","original":"02/20/10","granularity":"day","time":"2010/02/20 00:00:00 -0500"},"country":null,"user-email":"daveshertzer@me.com","event":"AddSuggestions","longitude":-73.774536,"id":"a6kgrht755c1","user-first-name":"Dave"},"type":"Feature","geometry":{"type":"Point","coordinates":[-73.774536,42.874107]}}],"is_temporal":true,"author":{"url":"","metadata":"","contact_name":"","contact_address":"","source":"","contact_phone":""},"source":"","pagination":{"sort":null,"start":0,"total":600,"limit":1000000},"state":"complete","tags":"","published":"2014-08-10T12:12:52-04:00","id":90750}